01:57:52.192473 IP tom-Latitude-3570.38680 > free.example.com.3333: tcp 348
01:57:52.233115 IP free.example.com.3333 > tom-Latitude-3570.38680: tcp 0
01:57:52.353016 IP free.example.com.3333 > tom-Latitude-3570.38680: tcp 63
01:57:52.353034 IP tom-Latitude-3570.38680 > free.example.com.3333: tcp 0
01:58:00.098142 IP free.example.com.3333 > tom-Latitude-3570.38680: tcp 363
01:58:00.098169 IP tom-Latitude-3570.38680 > free.example.com.3333: tcp 0
01:59:00.093342 IP free.example.com.3333 > tom-Latitude-3570.38680: tcp 363
01:59:00.093360 IP tom-Latitude-3570.38680 > free.example.com.3333: tcp 0
01:59:21.820584 IP free.example.com.3333 > tom-Latitude-3570.38680: tcp 363
01:59:21.820603 IP tom-Latitude-3570.38680 > free.example.com.3333: tcp 0
01:59:35.506430 IP tom-Latitude-3570.38680 > free.example.com.3333: tcp 348
01:59:35.572274 IP free.example.com.3333 > tom-Latitude-3570.38680: tcp 0
01:59:35.691464 IP free.example.com.3333 > tom-Latitude-3570.38680: tcp 63
01:59:35.691472 IP tom-Latitude-3570.38680 > free.example.com.3333: tcp 0
02:00:00.106024 IP free.example.com.3333 > tom-Latitude-3570.38680: tcp 363
02:00:00.106047 IP tom-Latitude-3570.38680 > free.example.com.3333: tcp 0
02:00:16.405010 IP tom-Latitude-3570.38680 > free.example.com.3333: tcp 348
02:00:16.478197 IP free.example.com.3333 > tom-Latitude-3570.38680: tcp 0
02:00:16.624385 IP free.example.com.3333 > tom-Latitude-3570.38680: tcp 63
02:00:16.624403 IP tom-Latitude-3570.38680 > free.example.com.3333: tcp 0
02:00:31.512191 IP tom-Latitude-3570.38680 > free.example.com.3333: tcp 348
02:00:31.576640 IP free.example.com.3333 > tom-Latitude-3570.38680: tcp 0
02:00:31.697467 IP free.example.com.3333 > tom-Latitude-3570.38680: tcp 63
02:00:31.697484 IP tom-Latitude-3570.38680 > free.example.com.3333: tcp 0
02:01:00.122415 IP free.example.com.3333 > tom-Latitude-3570.38680: tcp 363
02:01:00.122440 IP tom-Latitude-3570.38680 > free.example.com.3333: tcp 0
02:01:06.450473 IP tom-Latitude-3570.38680 > free.example.com.3333: tcp 348
02:01:06.487668 IP free.example.com.3333 > tom-Latitude-3570.38680: tcp 0
02:01:06.609296 IP free.example.com.3333 > tom-Latitude-3570.38680: tcp 63
02:01:06.609313 IP tom-Latitude-3570.38680 > free.example.com.3333: tcp 0
02:01:40.504900 IP free.example.com.3333 > tom-Latitude-3570.38680: tcp 363
02:01:40.504922 IP tom-Latitude-3570.38680 > free.example.com.3333: tcp 0
02:02:00.120204 IP free.example.com.3333 > tom-Latitude-3570.38680: tcp 363
02:02:00.120222 IP tom-Latitude-3570.38680 > free.example.com.3333: tcp 0
02:02:00.417151 IP free.example.com.3333 > tom-Latitude-3570.38680: tcp 363
02:02:00.417173 IP tom-Latitude-3570.38680 > free.example.com.3333: tcp 0
02:02:03.238175 IP free.example.com.3333 > tom-Latitude-3570.38680: tcp 363
02:02:03.238198 IP tom-Latitude-3570.38680 > free.example.com.3333: tcp 0
02:02:08.745805 IP free.example.com.3333 > tom-Latitude-3570.38680: tcp 363
02:02:08.745824 IP tom-Latitude-3570.38680 > free.example.com.3333: tcp 0
02:03:00.174353 IP free.example.com.3333 > tom-Latitude-3570.38680: tcp 363
02:03:00.174365 IP tom-Latitude-3570.38680 > free.example.com.3333: tcp 0
02:03:54.566140 IP tom-Latitude-3570.38680 > free.example.com.3333: tcp 348
02:03:54.612099 IP free.example.com.3333 > tom-Latitude-3570.38680: tcp 0
02:03:54.856332 IP free.example.com.3333 > tom-Latitude-3570.38680: tcp 63
02:03:54.856355 IP tom-Latitude-3570.38680 > free.example.com.3333: tcp 0
02:03:57.421054 IP free.example.com.3333 > tom-Latitude-3570.38680: tcp 363
02:03:57.421077 IP tom-Latitude-3570.38680 > free.example.com.3333: tcp 0
02:04:00.104421 IP free.example.com.3333 > tom-Latitude-3570.38680: tcp 363
02:04:00.104439 IP tom-Latitude-3570.38680 > free.example.com.3333: tcp 0
02:05:00.099905 IP free.example.com.3333 > tom-Latitude-3570.38680: tcp 363
02:05:00.099923 IP tom-Latitude-3570.38680 > free.example.com.3333: tcp 0
02:05:07.099549 IP free.example.com.3333 > tom-Latitude-3570.38680: tcp 363
02:05:07.099569 IP tom-Latitude-3570.38680 > free.example.com.3333: tcp 0
02:05:20.879647 IP tom-Latitude-3570.38680 > free.example.com.3333: tcp 348
02:05:21.267153 IP free.example.com.3333 > tom-Latitude-3570.38680: tcp 0
02:05:21.392752 IP free.example.com.3333 > tom-Latitude-3570.38680: tcp 63
02:05:21.392766 IP tom-Latitude-3570.38680 > free.example.com.3333: tcp 0
02:06:00.124481 IP free.example.com.3333 > tom-Latitude-3570.38680: tcp 363
02:06:00.124503 IP tom-Latitude-3570.38680 > free.example.com.3333: tcp 0
02:06:21.775013 IP free.example.com.3333 > tom-Latitude-3570.38680: tcp 363
02:06:21.775026 IP tom-Latitude-3570.38680 > free.example.com.3333: tcp 0
02:07:00.111555 IP free.example.com.3333 > tom-Latitude-3570.38680: tcp 363
02:07:00.111575 IP tom-Latitude-3570.38680 > free.example.com.3333: tcp 0
02:07:04.041462 IP tom-Latitude-3570.38680 > free.example.com.3333: tcp 348
02:07:04.117460 IP free.example.com.3333 > tom-Latitude-3570.38680: tcp 0
02:07:04.299846 IP free.example.com.3333 > tom-Latitude-3570.38680: tcp 63
02:07:04.299866 IP tom-Latitude-3570.38680 > free.example.com.3333: tcp 0
02:07:10.035721 IP tom-Latitude-3570.38680 > free.example.com.3333: tcp 348
02:07:10.079585 IP free.example.com.3333 > tom-Latitude-3570.38680: tcp 0
02:07:10.215527 IP free.example.com.3333 > tom-Latitude-3570.38680: tcp 63
02:07:10.215545 IP tom-Latitude-3570.38680 > free.example.com.3333: tcp 0
02:07:41.046427 IP tom-Latitude-3570.38680 > free.example.com.3333: tcp 348
02:07:41.575758 IP free.example.com.3333 > tom-Latitude-3570.38680: tcp 0
02:07:41.600128 IP free.example.com.3333 > tom-Latitude-3570.38680: tcp 63
02:07:41.600149 IP tom-Latitude-3570.38680 > free.example.com.3333: tcp 0
02:08:00.100729 IP free.example.com.3333 > tom-Latitude-3570.38680: tcp 363
02:08:00.100752 IP tom-Latitude-3570.38680 > free.example.com.3333: tcp 0
02:08:15.619240 IP tom-Latitude-3570.38680 > free.example.com.3333: tcp 348
02:08:15.982337 IP free.example.com.3333 > tom-Latitude-3570.38680: tcp 0
02:08:15.982374 IP free.example.com.3333 > tom-Latitude-3570.38680: tcp 63
02:08:15.982386 IP tom-Latitude-3570.38680 > free.example.com.3333: tcp 0
02:08:18.152910 IP free.example.com.3333 > tom-Latitude-3570.38680: tcp 363
02:08:18.152932 IP tom-Latitude-3570.38680 > free.example.com.3333: tcp 0
02:09:00.113553 IP free.example.com.3333 > tom-Latitude-3570.38680: tcp 363
02:09:00.113575 IP tom-Latitude-3570.38680 > free.example.com.3333: tcp 0
02:09:48.874193 IP tom-Latitude-3570.38680 > free.example.com.3333: tcp 348
02:09:49.531711 IP tom-Latitude-3570.38680 > free.example.com.3333: tcp 348
02:09:50.715702 IP tom-Latitude-3570.38680 > free.example.com.3333: tcp 348
02:09:53.275703 IP tom-Latitude-3570.38680 > free.example.com.3333: tcp 348
02:09:58.139720 IP tom-Latitude-3570.38680 > free.example.com.3333: tcp 348
02:09:58.874291 IP tom-Latitude-3570.38680 > free.example.com.3333: tcp 0
02:10:00.112362 IP free.example.com.3333 > tom-Latitude-3570.38680: tcp 363
02:10:00.112385 IP tom-Latitude-3570.38680 > free.example.com.3333: tcp 0
02:10:00.712340 IP free.example.com.3333 > tom-Latitude-3570.38680: tcp 363
02:10:00.712346 IP tom-Latitude-3570.38680 > free.example.com.3333: tcp 0
02:10:04.872436 IP free.example.com.3333 > tom-Latitude-3570.38680: tcp 0
02:10:04.872455 IP tom-Latitude-3570.38680 > free.example.com.3333: tcp 0
02:10:05.039546 IP free.example.com.3333 > tom-Latitude-3570.38680: tcp 63
02:10:05.039566 IP tom-Latitude-3570.38680 > free.example.com.3333: tcp 0
