03:10:32.148625 IP tom-Latitude-3570.39248 > free.example.com.3333: tcp 348
03:10:32.196929 IP free.example.com.3333 > tom-Latitude-3570.39248: tcp 0
03:10:32.319307 IP free.example.com.3333 > tom-Latitude-3570.39248: tcp 63
03:10:32.319322 IP tom-Latitude-3570.39248 > free.example.com.3333: tcp 0
03:11:00.088654 IP free.example.com.3333 > tom-Latitude-3570.39248: tcp 363
03:11:00.088675 IP tom-Latitude-3570.39248 > free.example.com.3333: tcp 0
03:11:39.288382 IP tom-Latitude-3570.39248 > free.example.com.3333: tcp 348
03:11:39.363224 IP free.example.com.3333 > tom-Latitude-3570.39248: tcp 0
03:11:39.471660 IP free.example.com.3333 > tom-Latitude-3570.39248: tcp 63
03:11:39.471688 IP tom-Latitude-3570.39248 > free.example.com.3333: tcp 0
03:12:00.083768 IP free.example.com.3333 > tom-Latitude-3570.39248: tcp 363
03:12:00.083789 IP tom-Latitude-3570.39248 > free.example.com.3333: tcp 0
03:12:01.572173 IP tom-Latitude-3570.39248 > free.example.com.3333: tcp 348
03:12:01.619805 IP free.example.com.3333 > tom-Latitude-3570.39248: tcp 0
03:12:01.737919 IP free.example.com.3333 > tom-Latitude-3570.39248: tcp 63
03:12:01.737937 IP tom-Latitude-3570.39248 > free.example.com.3333: tcp 0
03:12:27.268251 IP free.example.com.3333 > tom-Latitude-3570.39248: tcp 363
03:12:27.268291 IP tom-Latitude-3570.39248 > free.example.com.3333: tcp 0
03:12:34.865618 IP tom-Latitude-3570.39248 > free.example.com.3333: tcp 348
03:12:34.916839 IP free.example.com.3333 > tom-Latitude-3570.39248: tcp 0
03:12:35.040809 IP free.example.com.3333 > tom-Latitude-3570.39248: tcp 63
03:12:35.040821 IP tom-Latitude-3570.39248 > free.example.com.3333: tcp 0
03:13:00.078587 IP free.example.com.3333 > tom-Latitude-3570.39248: tcp 363
03:13:00.078607 IP tom-Latitude-3570.39248 > free.example.com.3333: tcp 0
03:14:00.117163 IP free.example.com.3333 > tom-Latitude-3570.39248: tcp 363
03:14:00.117182 IP tom-Latitude-3570.39248 > free.example.com.3333: tcp 0
03:14:47.488040 IP tom-Latitude-3570.39248 > free.example.com.3333: tcp 348
03:14:47.536206 IP free.example.com.3333 > tom-Latitude-3570.39248: tcp 0
03:14:47.648813 IP free.example.com.3333 > tom-Latitude-3570.39248: tcp 63
03:14:47.648831 IP tom-Latitude-3570.39248 > free.example.com.3333: tcp 0
03:15:00.083040 IP free.example.com.3333 > tom-Latitude-3570.39248: tcp 363
03:15:00.083060 IP tom-Latitude-3570.39248 > free.example.com.3333: tcp 0
03:15:19.857294 IP tom-Latitude-3570.39248 > free.example.com.3333: tcp 348
03:15:19.902985 IP free.example.com.3333 > tom-Latitude-3570.39248: tcp 0
03:15:20.091296 IP free.example.com.3333 > tom-Latitude-3570.39248: tcp 63
03:15:20.091314 IP tom-Latitude-3570.39248 > free.example.com.3333: tcp 0
03:15:28.496861 IP tom-Latitude-3570.39248 > free.example.com.3333: tcp 348
03:15:28.547198 IP free.example.com.3333 > tom-Latitude-3570.39248: tcp 0
03:15:28.692972 IP free.example.com.3333 > tom-Latitude-3570.39248: tcp 63
03:15:28.692995 IP tom-Latitude-3570.39248 > free.example.com.3333: tcp 0
03:15:34.755161 IP tom-Latitude-3570.39248 > free.example.com.3333: tcp 348
03:15:34.821015 IP free.example.com.3333 > tom-Latitude-3570.39248: tcp 0
03:15:35.042168 IP free.example.com.3333 > tom-Latitude-3570.39248: tcp 63
03:15:35.042190 IP tom-Latitude-3570.39248 > free.example.com.3333: tcp 0
03:16:00.233213 IP free.example.com.3333 > tom-Latitude-3570.39248: tcp 363
03:16:00.233236 IP tom-Latitude-3570.39248 > free.example.com.3333: tcp 0
03:16:30.424652 IP tom-Latitude-3570.39248 > free.example.com.3333: tcp 348
03:16:30.463302 IP free.example.com.3333 > tom-Latitude-3570.39248: tcp 0
03:16:30.645512 IP free.example.com.3333 > tom-Latitude-3570.39248: tcp 63
03:16:30.645530 IP tom-Latitude-3570.39248 > free.example.com.3333: tcp 0
03:16:36.326048 IP free.example.com.3333 > tom-Latitude-3570.39248: tcp 363
03:16:36.326062 IP tom-Latitude-3570.39248 > free.example.com.3333: tcp 0
03:16:45.425528 IP tom-Latitude-3570.39248 > free.example.com.3333: tcp 348
03:16:45.465340 IP free.example.com.3333 > tom-Latitude-3570.39248: tcp 0
03:16:45.583850 IP free.example.com.3333 > tom-Latitude-3570.39248: tcp 63
03:16:45.583870 IP tom-Latitude-3570.39248 > free.example.com.3333: tcp 0
03:16:54.801419 IP tom-Latitude-3570.39248 > free.example.com.3333: tcp 348
03:16:54.841862 IP free.example.com.3333 > tom-Latitude-3570.39248: tcp 0
03:16:54.959388 IP free.example.com.3333 > tom-Latitude-3570.39248: tcp 63
03:16:54.959407 IP tom-Latitude-3570.39248 > free.example.com.3333: tcp 0
03:17:00.239562 IP free.example.com.3333 > tom-Latitude-3570.39248: tcp 363
03:17:00.239577 IP tom-Latitude-3570.39248 > free.example.com.3333: tcp 0
03:18:00.087923 IP free.example.com.3333 > tom-Latitude-3570.39248: tcp 363
03:18:00.087941 IP tom-Latitude-3570.39248 > free.example.com.3333: tcp 0
03:18:31.615861 IP tom-Latitude-3570.39248 > free.example.com.3333: tcp 348
03:18:31.687441 IP free.example.com.3333 > tom-Latitude-3570.39248: tcp 0
03:18:31.888074 IP free.example.com.3333 > tom-Latitude-3570.39248: tcp 63
03:18:31.888093 IP tom-Latitude-3570.39248 > free.example.com.3333: tcp 0
03:19:00.085877 IP free.example.com.3333 > tom-Latitude-3570.39248: tcp 363
03:19:00.085909 IP tom-Latitude-3570.39248 > free.example.com.3333: tcp 0
03:20:00.260069 IP free.example.com.3333 > tom-Latitude-3570.39248: tcp 363
03:20:00.260089 IP tom-Latitude-3570.39248 > free.example.com.3333: tcp 0
03:21:00.118243 IP free.example.com.3333 > tom-Latitude-3570.39248: tcp 363
03:21:00.118247 IP tom-Latitude-3570.39248 > free.example.com.3333: tcp 0
03:22:00.086792 IP free.example.com.3333 > tom-Latitude-3570.39248: tcp 363
03:22:00.086810 IP tom-Latitude-3570.39248 > free.example.com.3333: tcp 0
03:22:58.027527 IP free.example.com.3333 > tom-Latitude-3570.39248: tcp 363
03:22:58.027547 IP tom-Latitude-3570.39248 > free.example.com.3333: tcp 0
03:23:00.098619 IP free.example.com.3333 > tom-Latitude-3570.39248: tcp 363
03:23:00.098637 IP tom-Latitude-3570.39248 > free.example.com.3333: tcp 0
03:23:24.828964 IP free.example.com.3333 > tom-Latitude-3570.39248: tcp 363
03:23:24.828987 IP tom-Latitude-3570.39248 > free.example.com.3333: tcp 0
03:23:30.987019 IP tom-Latitude-3570.39248 > free.example.com.3333: tcp 348
03:23:31.073841 IP free.example.com.3333 > tom-Latitude-3570.39248: tcp 0
03:23:31.411529 IP free.example.com.3333 > tom-Latitude-3570.39248: tcp 63
03:23:31.411551 IP tom-Latitude-3570.39248 > free.example.com.3333: tcp 0
03:24:00.086900 IP free.example.com.3333 > tom-Latitude-3570.39248: tcp 363
03:24:00.086920 IP tom-Latitude-3570.39248 > free.example.com.3333: tcp 0
03:25:00.086888 IP free.example.com.3333 > tom-Latitude-3570.39248: tcp 363
03:25:00.086907 IP tom-Latitude-3570.39248 > free.example.com.3333: tcp 0
03:25:44.938861 IP tom-Latitude-3570.39248 > free.example.com.3333: tcp 348
03:25:45.114872 IP free.example.com.3333 > tom-Latitude-3570.39248: tcp 0
03:25:45.350039 IP free.example.com.3333 > tom-Latitude-3570.39248: tcp 63
03:25:45.350063 IP tom-Latitude-3570.39248 > free.example.com.3333: tcp 0
03:26:00.300550 IP free.example.com.3333 > tom-Latitude-3570.39248: tcp 363
03:26:00.300574 IP tom-Latitude-3570.39248 > free.example.com.3333: tcp 0
03:26:06.050851 IP free.example.com.3333 > tom-Latitude-3570.39248: tcp 363
03:26:06.050861 IP tom-Latitude-3570.39248 > free.example.com.3333: tcp 0
03:27:00.102563 IP free.example.com.3333 > tom-Latitude-3570.39248: tcp 363
03:27:00.102567 IP tom-Latitude-3570.39248 > free.example.com.3333: tcp 0
