03:28:00.313977 IP free.example.com.3333 > tom-Latitude-3570.39248: tcp 363
03:28:00.313997 IP tom-Latitude-3570.39248 > free.example.com.3333: tcp 0
03:28:39.190910 IP tom-Latitude-3570.39248 > free.example.com.3333: tcp 348
03:28:39.238827 IP free.example.com.3333 > tom-Latitude-3570.39248: tcp 0
03:28:39.356914 IP free.example.com.3333 > tom-Latitude-3570.39248: tcp 63
03:28:39.356964 IP tom-Latitude-3570.39248 > free.example.com.3333: tcp 0
03:29:00.097007 IP free.example.com.3333 > tom-Latitude-3570.39248: tcp 363
03:29:00.097031 IP tom-Latitude-3570.39248 > free.example.com.3333: tcp 0
03:30:00.123205 IP free.example.com.3333 > tom-Latitude-3570.39248: tcp 363
03:30:00.123209 IP tom-Latitude-3570.39248 > free.example.com.3333: tcp 0
03:31:00.129253 IP free.example.com.3333 > tom-Latitude-3570.39248: tcp 363
03:31:00.129269 IP tom-Latitude-3570.39248 > free.example.com.3333: tcp 0
03:32:00.091333 IP free.example.com.3333 > tom-Latitude-3570.39248: tcp 363
03:32:00.091352 IP tom-Latitude-3570.39248 > free.example.com.3333: tcp 0
03:32:29.539436 IP tom-Latitude-3570.39248 > free.example.com.3333: tcp 348
03:32:29.595250 IP free.example.com.3333 > tom-Latitude-3570.39248: tcp 0
03:32:29.716972 IP free.example.com.3333 > tom-Latitude-3570.39248: tcp 63
03:32:29.716992 IP tom-Latitude-3570.39248 > free.example.com.3333: tcp 0
03:32:43.133123 IP tom-Latitude-3570.39248 > free.example.com.3333: tcp 348
03:32:43.185156 IP free.example.com.3333 > tom-Latitude-3570.39248: tcp 0
03:32:43.309352 IP free.example.com.3333 > tom-Latitude-3570.39248: tcp 63
03:32:43.309365 IP tom-Latitude-3570.39248 > free.example.com.3333: tcp 0
03:32:51.822020 IP tom-Latitude-3570.39248 > free.example.com.3333: tcp 348
03:32:51.878870 IP free.example.com.3333 > tom-Latitude-3570.39248: tcp 0
03:32:51.998919 IP free.example.com.3333 > tom-Latitude-3570.39248: tcp 63
03:32:51.998934 IP tom-Latitude-3570.39248 > free.example.com.3333: tcp 0
03:33:00.087983 IP free.example.com.3333 > tom-Latitude-3570.39248: tcp 363
03:33:00.088006 IP tom-Latitude-3570.39248 > free.example.com.3333: tcp 0
03:33:53.662224 IP tom-Latitude-3570.39248 > free.example.com.3333: tcp 348
03:33:53.705005 IP free.example.com.3333 > tom-Latitude-3570.39248: tcp 0
03:33:53.859859 IP free.example.com.3333 > tom-Latitude-3570.39248: tcp 63
03:33:53.859869 IP tom-Latitude-3570.39248 > free.example.com.3333: tcp 0
03:34:00.149322 IP free.example.com.3333 > tom-Latitude-3570.39248: tcp 363
03:34:00.149347 IP tom-Latitude-3570.39248 > free.example.com.3333: tcp 0
03:34:48.813169 IP free.example.com.3333 > tom-Latitude-3570.39248: tcp 363
03:34:48.813187 IP tom-Latitude-3570.39248 > free.example.com.3333: tcp 0
03:35:00.091120 IP free.example.com.3333 > tom-Latitude-3570.39248: tcp 363
03:35:00.091240 IP tom-Latitude-3570.39248 > free.example.com.3333: tcp 0
03:35:09.819032 IP tom-Latitude-3570.39248 > free.example.com.3333: tcp 348
03:35:09.860656 IP free.example.com.3333 > tom-Latitude-3570.39248: tcp 0
03:35:09.984106 IP free.example.com.3333 > tom-Latitude-3570.39248: tcp 63
03:35:09.984122 IP tom-Latitude-3570.39248 > free.example.com.3333: tcp 0
03:35:24.609161 IP free.example.com.3333 > tom-Latitude-3570.39248: tcp 363
03:35:24.609182 IP tom-Latitude-3570.39248 > free.example.com.3333: tcp 0
03:35:59.343451 IP free.example.com.3333 > tom-Latitude-3570.39248: tcp 363
03:35:59.343468 IP tom-Latitude-3570.39248 > free.example.com.3333: tcp 0
03:36:00.138640 IP free.example.com.3333 > tom-Latitude-3570.39248: tcp 363
03:36:00.138655 IP tom-Latitude-3570.39248 > free.example.com.3333: tcp 0
03:36:09.044516 IP free.example.com.3333 > tom-Latitude-3570.39248: tcp 363
03:36:09.044534 IP tom-Latitude-3570.39248 > free.example.com.3333: tcp 0
03:36:20.174980 IP tom-Latitude-3570.39248 > free.example.com.3333: tcp 348
03:36:20.214760 IP free.example.com.3333 > tom-Latitude-3570.39248: tcp 0
03:36:20.343687 IP free.example.com.3333 > tom-Latitude-3570.39248: tcp 63
03:36:20.343708 IP tom-Latitude-3570.39248 > free.example.com.3333: tcp 0
03:36:22.644546 IP tom-Latitude-3570.39248 > free.exa