02:39:09.356867 IP tom-Latitude-3570.39248 > free.example.com.3333: tcp 348
02:39:09.438839 IP free.example.com.3333 > tom-Latitude-3570.39248: tcp 0
02:39:09.557405 IP free.example.com.3333 > tom-Latitude-3570.39248: tcp 63
02:39:09.557428 IP tom-Latitude-3570.39248 > free.example.com.3333: tcp 0
02:40:00.112681 IP free.example.com.3333 > tom-Latitude-3570.39248: tcp 363
02:40:00.112707 IP tom-Latitude-3570.39248 > free.example.com.3333: tcp 0
02:40:09.063396 IP tom-Latitude-3570.39248 > free.example.com.3333: tcp 348
02:40:09.164349 IP free.example.com.3333 > tom-Latitude-3570.39248: tcp 0
02:40:09.280291 IP free.example.com.3333 > tom-Latitude-3570.39248: tcp 63
02:40:09.280310 IP tom-Latitude-3570.39248 > free.example.com.3333: tcp 0
02:41:00.073614 IP free.example.com.3333 > tom-Latitude-3570.39248: tcp 363
02:41:00.073628 IP tom-Latitude-3570.39248 > free.example.com.3333: tcp 0
02:42:00.070856 IP free.example.com.3333 > tom-Latitude-3570.39248: tcp 363
02:42:00.070874 IP tom-Latitude-3570.39248 > free.example.com.3333: tcp 0
02:42:16.186808 IP tom-Latitude-3570.39248 > free.example.com.3333: tcp 348
02:42:16.270304 IP free.example.com.3333 > tom-Latitude-3570.39248: tcp 0
02:42:16.388461 IP free.example.com.3333 > tom-Latitude-3570.39248: tcp 63
02:42:16.388474 IP tom-Latitude-3570.39248 > free.example.com.3333: tcp 0
02:42:17.150554 IP free.example.com.3333 > tom-Latitude-3570.39248: tcp 363
02:42:17.150579 IP tom-Latitude-3570.39248 > free.example.com.3333: tcp 0
02:42:36.088212 IP free.example.com.3333 > tom-Latitude-3570.39248: tcp 363
02:42:36.088242 IP tom-Latitude-3570.39248 > free.example.com.3333: tcp 0
02:43:00.080561 IP free.example.com.3333 > tom-Latitude-3570.39248: tcp 363
02:43:00.080581 IP tom-Latitude-3570.39248 > free.example.com.3333: tcp 0
02:44:00.079136 IP free.example.com.3333 > tom-Latitude-3570.39248: tcp 363
02:44:00.079151 IP tom-Latitude-3570.39248 > free.example.com.3333: tcp 0
02:44:40.793321 IP tom-Latitude-3570.39248 > free.example.com.3333: tcp 348
02:44:40.862759 IP free.example.com.3333 > tom-Latitude-3570.39248: tcp 0
02:44:40.980517 IP free.example.com.3333 > tom-Latitude-3570.39248: tcp 63
02:44:40.980540 IP tom-Latitude-3570.39248 > free.example.com.3333: tcp 0
02:44:44.457745 IP tom-Latitude-3570.39248 > free.example.com.3333: tcp 348
02:44:44.520483 IP free.example.com.3333 > tom-Latitude-3570.39248: tcp 0
02:44:44.642524 IP free.example.com.3333 > tom-Latitude-3570.39248: tcp 63
02:44:44.642542 IP tom-Latitude-3570.39248 > free.example.com.3333: tcp 0
02:45:00.079326 IP free.example.com.3333 > tom-Latitude-3570.39248: tcp 363
02:45:00.079460 IP tom-Latitude-3570.39248 > free.example.com.3333: tcp 0
02:46:00.075733 IP free.example.com.3333 > tom-Latitude-3570.39248: tcp 363
02:46:00.075757 IP tom-Latitude-3570.39248 > free.example.com.3333: tcp 0
02:46:17.273334 IP tom-Latitude-3570.39248 > free.example.com.3333: tcp 348
02:46:17.311410 IP free.example.com.3333 > tom-Latitude-3570.39248: tcp 0
02:46:17.442506 IP free.example.com.3333 > tom-Latitude-3570.39248: tcp 63
02:46:17.442516 IP tom-Latitude-3570.39248 > free.example.com.3333: tcp 0
02:47:00.085284 IP free.example.com.3333 > tom-Latitude-3570.39248: tcp 363
02:47:00.085307 IP tom-Latitude-3570.39248 > free.example.com.3333: tcp 0
02:48:00.106693 IP free.example.com.3333 > tom-Latitude-3570.39248: tcp 363
02:48:00.106711 IP tom-Latitude-3570.39248 > free.example.com.3333: tcp 0
02:48:11.612701 IP free.example.com.3333 > tom-Latitude-3570.39248: tcp 363
02:48:11.612720 IP tom-Latitude-3570.39248 > free.example.com.3333: tcp 0
02:48:25.926962 IP tom-Latitude-3570.39248 > free.example.com.3333: tcp 348
02:48:26.034382 IP free.example.com.3333 > tom-Latitude-3570.39248: tcp 0
02:48:26.152294 IP free.example.com.3333 > tom-Latitude-3570.39248: tcp 63
02:48:26.152312 IP tom-Latitude-3570.39248 > free.example.com.3333: tcp 0
02:49:00.072293 IP free.example.com.3333 > tom-Latitude-3570.39248: tcp 363
02:49:00.072317 IP tom-Latitude-3570.39248 > free.example.com.3333: tcp 0
02:49:28.935025 IP tom-Latitude-3570.39248 > free.example.com.3333: tcp 348
02:49:28.986106 IP free.example.com.3333 > tom-Latitude-3570.39248: tcp 0
02:49:29.101930 IP free.example.com.3333 > tom-Latitude-3570.39248: tcp 63
02:49:29.101954 IP tom-Latitude-3570.39248 > free.example.com.3333: tcp 0
02:50:00.085806 IP free.example.com.3333 > tom-Latitude-3570.39248: tcp 363
02:50:00.085832 IP tom-Latitude-3570.39248 > free.example.com.3333: tcp 0
02:50:42.767082 IP tom-Latitude-3570.39248 > free.example.com.3333: tcp 348
02:50:42.816757 IP free.example.com.3333 > tom-Latitude-3570.39248: tcp 0
02:50:42.936446 IP free.example.com.3333 > tom-Latitude-3570.39248: tcp 63
02:50:42.936463 IP tom-Latitude-3570.39248 > free.example.com.3333: tcp 0
02:50:43.082070 IP tom-Latitude-3570.39248 > free.example.com.3333: tcp 348
02:50:43.115029 IP free.example.com.3333 > tom-Latitude-3570.39248: tcp 0
02:50:43.237143 IP free.example.com.3333 > tom-Latitude-3570.39248: tcp 63
02:50:43.237162 IP tom-Latitude-3570.39248 > free.example.com.3333: tcp 0
02:51:00.083975 IP free.example.com.3333 > tom-Latitude-3570.39248: tcp 363
02:51:00.083998 IP tom-Latitude-3570.39248 > free.example.com.3333: tcp 0
02:51:03.881153 IP tom-Latitude-3570.39248 > free.example.com.3333: tcp 348
02:51:03.925241 IP free.example.com.3333 > tom-Latitude-3570.39248: tcp 0
02:51:04.043003 IP free.example.com.3333 > tom-Latitude-3570.39248: tcp 63
02:51:04.043019 IP tom-Latitude-3570.39248 > free.example.com.3333: tcp 0
02:52:00.074909 IP free.example.com.3333 > tom-Latitude-3570.39248: tcp 363
02:52:00.074935 IP tom-Latitude-3570.39248 > free.example.com.3333: tcp 0
02:52:23.468368 IP tom-Latitude-3570.39248 > free.example.com.3333: tcp 348
02:52:23.520803 IP free.example.com.3333 > tom-Latitude-3570.39248: tcp 0
02:52:23.628445 IP free.example.com.3333 > tom-Latitude-3570.39248: tcp 63
02:52:23.628464 IP tom-Latitude-3570.39248 > free.example.com.3333: tcp 0
02:53:00.076247 IP free.example.com.3333 > tom-Latitude-3570.39248: tcp 363
02:53:00.076274 IP tom-Latitude-3570.39248 > free.example.com.3333: tcp 0
02:53:03.492353 IP free.example.com.3333 > tom-Latitude-3570.39248: tcp 363
02:53:03.492373 IP tom-Latitude-3570.39248 > free.example.com.3333: tcp 0
02:53:07.738402 IP tom-Latitude-3570.39248 > free.example.com.3333: tcp 348
02:53:07.796345 IP free.example.com.3333 > tom-Latitude-3570.39248: tcp 0
02:53:07.916077 IP free.example.com.3333 > tom-Latitude-3570.39248: tcp 63
02:53:07.916086 IP tom-Latitude-3570.39248 > free.example.com.3333: tcp 0
02:54:00.322787 IP free.example.com.3333 > tom-Latitude-3570.39248: tcp 363
02:54:00.322806 IP tom-Latitude-3570.39248 > free.example.com.3333: tcp 0
02:54:25.813783 IP free.example.com.3333 > tom-Latitude-3570.39248: tcp 363
02:54:25.813799 IP tom-Latitude-3570.39248 > free.example.com.3333: tcp 0
02:54:31.973879 IP tom-Latitude-3570.39248 > free.example.com.3333: tcp 348
02:54:32.038490 IP free.example.com.3333 > tom-Latitude-3570.39248: tcp 0
02:54:32.154537 IP free.example.com.3333 > tom-Latitude-3570.39248: tcp 63
02:54:32.154554 IP tom-Latitude-3570.39248 > free.example.com.3333: tcp 0
02:54:43.797961 IP free.example.com.3333 > tom-Latitude-3570.39248: tcp 363
02:54:43.798058 IP tom-Latitude-3570.39248 > free.example.com.3333: tcp 0
02:55:00.071614 IP free.example.com.3333 > tom-Latitude-3570.39248: tcp 363
02:55:00.071623 IP tom-Latitude-3570.39248 > free.example.com.3333: tcp 0
