05:22:12.656861 IP tom-Latitude-3570.49070 > c-185-45-236-223.customer.ggaweb.ch.8333: tcp 24
05:22:12.687746 IP tom-Latitude-3570.49070 > c-185-45-236-223.customer.ggaweb.ch.8333: tcp 721
05:22:12.753799 IP c-185-45-236-223.customer.ggaweb.ch.8333 > tom-Latitude-3570.49070: tcp 0
05:22:12.770033 IP c-185-45-236-223.customer.ggaweb.ch.8333 > tom-Latitude-3570.49070: tcp 0
05:22:12.841226 IP vmi195435.contaboserver.net.8333 > tom-Latitude-3570.39110: tcp 24
05:22:12.844535 IP vmi195435.contaboserver.net.8333 > tom-Latitude-3570.39110: tcp 1261
05:22:12.844662 IP tom-Latitude-3570.39110 > vmi195435.contaboserver.net.8333: tcp 0
05:22:12.845193 IP tom-Latitude-3570.39110 > vmi195435.contaboserver.net.8333: tcp 24
05:22:12.845210 IP tom-Latitude-3570.39110 > vmi195435.contaboserver.net.8333: tcp 1261
05:22:12.873343 IP vmi195435.contaboserver.net.8333 > tom-Latitude-3570.39110: tcp 0
05:22:12.883029 IP vmi195435.contaboserver.net.8333 > tom-Latitude-3570.39110: tcp 0
05:22:12.962398 IP vmi195435.contaboserver.net.8333 > tom-Latitude-3570.39110: tcp 24
05:22:12.963315 IP vmi195435.contaboserver.net.8333 > tom-Latitude-3570.39110: tcp 223
05:22:12.963321 IP vmi195435.contaboserver.net.8333 > tom-Latitude-3570.39110: tcp 24
05:22:12.963324 IP vmi195435.contaboserver.net.8333 > tom-Latitude-3570.39110: tcp 223
05:22:12.963326 IP vmi195435.contaboserver.net.8333 > tom-Latitude-3570.39110: tcp 24
05:22:12.963328 IP vmi195435.contaboserver.net.8333 > tom-Latitude-3570.39110: tcp 256
05:22:12.963330 IP vmi195435.contaboserver.net.8333 > tom-Latitude-3570.39110: tcp 24
05:22:12.963331 IP tom-Latitude-3570.39110 > vmi195435.contaboserver.net.8333: tcp 0
05:22:12.963332 IP vmi195435.contaboserver.net.8333 > tom-Latitude-3570.39110: tcp 769
05:22:12.963334 IP vmi195435.contaboserver.net.8333 > tom-Latitude-3570.39110: tcp 24
05:22:12.963335 IP vmi195435.contaboserver.net.8333 > tom-Latitude-3570.39110: tcp 263
05:22:12.963372 IP tom-Latitude-3570.39110 > vmi195435.contaboserver.net.8333: tcp 0
05:22:13.041370 IP vmi195435.contaboserver.net.8333 > tom-Latitude-3570.39110: tcp 1448
05:22:13.041499 IP tom-Latitude-3570.39110 > vmi195435.contaboserver.net.8333: tcp 0
05:22:13.042077 IP vmi195435.contaboserver.net.8333 > tom-Latitude-3570.39110: tcp 1448
05:22:13.042096 IP vmi195435.contaboserver.net.8333 > tom-Latitude-3570.39110: tcp 1448
05:22:13.042125 IP vmi195435.contaboserver.net.8333 > tom-Latitude-3570.39110: tcp 1448
05:22:13.042140 IP vmi195435.contaboserver.net.8333 > tom-Latitude-3570.39110: tcp 1448
05:22:13.042178 IP tom-Latitude-3570.39110 > vmi195435.contaboserver.net.8333: tcp 0
05:22:13.049267 IP vmi195435.contaboserver.net.8333 > tom-Latitude-3570.39110: tcp 1448
05:22:13.049373 IP vmi195435.contaboserver.net.8333 > tom-Latitude-3570.39110: tcp 537
05:22:13.049401 IP tom-Latitude-3570.39110 > vmi195435.contaboserver.net.8333: tcp 0
05:22:13.352603 IP tom-Latitude-3570.49070 > c-185-45-236-223.customer.ggaweb.ch.8333: tcp 24
05:22:13.352623 IP tom-Latitude-3570.49070 > c-185-45-236-223.customer.ggaweb.ch.8333: tcp 1261
05:22:13.385003 IP c-185-45-236-223.customer.ggaweb.ch.8333 > tom-Latitude-3570.49070: tcp 0
05:22:13.394103 IP c-185-45-236-223.customer.ggaweb.ch.8333 > tom-Latitude-3570.49070: tcp 0
05:22:13.653791 IP tom-Latitude-3570.57976 > 167.99.216.145.8333: tcp 24
05:22:13.653811 IP tom-Latitude-3570.57976 > 167.99.216.145.8333: tcp 1261
05:22:13.704745 IP 167.99.216.145.8333 > tom-Latitude-3570.57976: tcp 0
05:22:13.854436 IP tom-Latitude-3570.57976 > 167.99.216.145.8333: tcp 24
05:22:13.857172 IP tom-Latitude-3570.57976 > 167.99.216.145.8333: tcp 721
05:22:13.891531 IP 167.99.216.145.8333 > tom-Latitude-3570.57976: tcp 0
05:22:14.055251 IP tom-Latitude-3570.60988 > 81.198.101.144.8333: tcp 24
05:22:14.055269 IP tom-Latitude-3570.60988 > 81.198.101.144.8333: tcp 1261
05:22:14.094283 IP 81.198.101.144.8333 > tom-Latitude-3570.60988: tcp 0
05:22:14.256300 IP tom-Latitude-3570.46284 > static-87-75-105-186.vodafonexdsl.co.uk.8333: tcp 24
05:22:14.256319 IP tom-Latitude-3570.46284 > static-87-75-105-186.vodafonexdsl.co.uk.8333: tcp 1261
05:22:14.301484 IP static-87-75-105-186.vodafonexdsl.co.uk.8333 > tom-Latitude-3570.46284: tcp 0
05:22:14.336147 IP bb42-60-217-183.singnet.com.sg.8333 > tom-Latitude-3570.60470: tcp 24
05:22:14.336172 IP tom-Latitude-3570.60470 > bb42-60-217-183.singnet.com.sg.8333: tcp 0
05:22:14.336749 IP bb42-60-217-183.singnet.com.sg.8333 > tom-Latitude-3570.60470: tcp 31
05:22:14.336772 IP tom-Latitude-3570.60470 > bb42-60-217-183.singnet.com.sg.8333: tcp 0
05:22:14.437656 IP tom-Latitude-3570.42516 > 2.56.9.15.8333: tcp 24
05:22:14.437677 IP tom-Latitude-3570.42516 > 2.56.9.15.8333: tcp 1261
05:22:14.437887 IP tom-Latitude-3570.46284 > static-87-75-105-186.vodafonexdsl.co.uk.8333: tcp 24
05:22:14.437894 IP tom-Latitude-3570.46284 > static-87-75-105-186.vodafonexdsl.co.uk.8333: tcp 1261
05:22:14.477157 IP 2.56.9.15.8333 > tom-Latitude-3570.42516: tcp 0
05:22:14.491211 IP 2.56.9.15.8333 > tom-Latitude-3570.42516: tcp 0
05:22:14.491225 IP static-87-75-105-186.vodafonexdsl.co.uk.8333 > tom-Latitude-3570.46284: tcp 0
05:22:14.949655 IP c-185-45-236-223.customer.ggaweb.ch.8333 > tom-Latitude-3570.49070: tcp 24
05:22:14.949670 IP c-185-45-236-223.customer.ggaweb.ch.8333 > tom-Latitude-3570.49070: tcp 505
05:22:14.949686 IP tom-Latitude-3570.49070 > c-185-45-236-223.customer.ggaweb.ch.8333: tcp 0
05:22:14.949966 IP tom-Latitude-3570.49070 > c-185-45-236-223.customer.ggaweb.ch.8333: tcp 24
05:22:14.951142 IP tom-Latitude-3570.49070 > c-185-45-236-223.customer.ggaweb.ch.8333: tcp 505
05:22:14.985167 IP c-185-45-236-223.customer.ggaweb.ch.8333 > tom-Latitude-3570.49070: tcp 505
05:22:14.985173 IP tom-Latitude-3570.49070 > c-185-45-236-223.customer.ggaweb.ch.8333: tcp 0
05:22:15.001112 IP c-185-45-236-223.customer.ggaweb.ch.8333 > tom-Latitude-3570.49070: tcp 0
05:22:15.001693 IP c-185-45-236-223.customer.ggaweb.ch.8333 > tom-Latitude-3570.49070: tcp 0
05:22:15.084482 IP c-185-45-236-223.customer.ggaweb.ch.8333 > tom-Latitude-3570.49070: tcp 24
05:22:15.084499 IP tom-Latitude-3570.49070 > c-185-45-236-223.customer.ggaweb.ch.8333: tcp 0
05:22:15.085682 IP c-185-45-236-223.customer.ggaweb.ch.8333 > tom-Latitude-3570.49070: tcp 1403
05:22:15.085706 IP tom-Latitude-3570.49070 > c-185-45-236-223.customer.ggaweb.ch.8333: tcp 0
05:22:15.085737 IP c-185-45-236-223.customer.ggaweb.ch.8333 > tom-Latitude-3570.49070: tcp 616
05:22:15.085741 IP tom-Latitude-3570.49070 > c-185-45-236-223.customer.ggaweb.ch.8333: tcp 0
05:22:15.085750 IP c-185-45-236-223.customer.ggaweb.ch.8333 > tom-Latitude-3570.49070: tcp 640
05:22:15.085755 IP tom-Latitude-3570.49070 > c-185-45-236-223.customer.ggaweb.ch.8333: tcp 0
05:22:15.085759 IP c-185-45-236-223.customer.ggaweb.ch.8333 > tom-Latitude-3570.49070: tcp 898
05:22:15.085762 IP tom-Latitude-3570.49070 > c-185-45-236-223.customer.ggaweb.ch.8333: tcp 0
05:22:15.085765 IP c-185-45-236-223.customer.ggaweb.ch.8333 > tom-Latitude-3570.49070: tcp 613
05:22:15.085767 IP tom-Latitude-3570.49070 > c-185-45-236-223.customer.ggaweb.ch.8333: tcp 0
05:22:15.085772 IP c-185-45-236-223.customer.ggaweb.ch.8333 > tom-Latitude-3570.49070: tcp 257
05:22:15.085776 IP tom-Latitude-3570.49070 > c-185-45-236-223.customer.ggaweb.ch.8333: tcp 0
05:22:15.390861 IP tom-Latitude-3570.56714 > ns3113832.ip-54-38-177.eu.8333: tcp 24
05:22:15.390882 IP tom-Latitude-3570.56714 > ns3113832.ip-54-38-177.eu.8333: tcp 1261
05:22:15.395068 IP bb42-60-217-183.singnet.com.sg.8333 > tom-Latitude-3570.60470: tcp 24
05:22:15.395086 IP tom-Latitude-3570.60470 > bb42-60-217-183.singnet.com.sg.8333: tcp 0
05:22:15.395104 IP bb42-60-217-183.singnet.com.sg.8333 > tom-Latitude-3570.60470: tcp 1261
05:22:15.395108 IP tom-Latitude-3570.60470 > bb42-60-217-183.singnet.com.sg.8333: tcp 0
05:22:15.395603 IP tom-Latitude-3570.60470 > bb42-60-217-183.singnet.com.sg.8333: tcp 24
05:22:15.399183 IP tom-Latitude-3570.60470 > bb42-60-217-183.singnet.com.sg.8333: tcp 109
05:22:15.428301 IP vmi195435.contaboserver.net.8333 > tom-Latitude-3570.39110: tcp 24
05:22:15.436086 IP vmi195435.contaboserver.net.8333 > tom-Latitude-3570.39110: tcp 685
05:22:15.436208 IP tom-Latitude-3570.39110 > vmi195435.contaboserver.net.8333: tcp 0
05:22:15.436537 IP tom-Latitude-3570.39110 > vmi195435.contaboserver.net.8333: tcp 24
05:22:15.436860 IP tom-Latitude-3570.42516 > 2.56.9.15.8333: tcp 24
05:22:15.436869 IP tom-Latitude-3570.42516 > 2.56.9.15.8333: tcp 1261
05:22:15.436913 IP ns3113832.ip-54-38-177.eu.8333 > tom-Latitude-3570.56714: tcp 0
05:22:15.436924 IP ns3113832.ip-54-38-177.eu.8333 > tom-Latitude-3570.56714: tcp 0
05:22:15.438333 IP tom-Latitude-3570.39110 > vmi195435.contaboserver.net.8333: tcp 73
05:22:15.439571 IP bb42-60-217-183.singnet.com.sg.8333 > tom-Latitude-3570.60470: tcp 0
05:22:15.439577 IP bb42-60-217-183.singnet.com.sg.8333 > tom-Latitude-3570.60470: tcp 0
05:22:15.473461 IP vmi195435.contaboserver.net.8333 > tom-Latitude-3570.39110: tcp 0
05:22:15.473466 IP 2.56.9.15.8333 > tom-Latitude-3570.42516: tcp 0
05:22:15.473469 IP 2.56.9.15.8333 > tom-Latitude-3570.42516: tcp 0
05:22:15.473471 IP vmi195435.contaboserver.net.8333 > tom-Latitude-3570.39110: tcp 0
05:22:15.550320 IP vmi195435.contaboserver.net.8333 > tom-Latitude-3570.39110: tcp 24
05:22:15.551004 IP vmi195435.contaboserver.net.8333 > tom-Latitude-3570.39110: tcp 225
05:22:15.551011 IP vmi195435.contaboserver.net.8333 > tom-Latitude-3570.39110: tcp 24
05:22:15.551014 IP vmi195435.contaboserver.net.8333 > tom-Latitude-3570.39110: tcp 254
05:22:15.551019 IP tom-Latitude-3570.39110 > vmi195435.contaboserver.net.8333: tcp 0
05:22:15.591909 IP tom-Latitude-3570.39110 > vmi195435.contaboserver.net.8333: tcp 0
05:22:15.752367 IP tom-Latitude-3570.56714 > ns3113832.ip-54-38-177.eu.8333: tcp 24
05:22:15.752562 IP tom-Latitude-3570.42516 > 2.56.9.15.8333: tcp 24
05:22:15.752568 IP tom-Latitude-3570.42516 > 2.56.9.15.8333: tcp 1189
05:22:15.754530 IP tom-Latitude-3570.56714 > ns3113832.ip-54-38-177.eu.8333: tcp 577
05:22:15.785539 IP ns3113832.ip-54-38-177.eu.8333 > tom-Latitude-3570.56714: tcp 0
05:22:15.791923 IP 2.56.9.15.8333 > tom-Latitude-3570.42516: tcp 0
05:22:15.795844 IP 2.56.9.15.8333 > tom-Latitude-3570.42516: tcp 0
05:22:15.796424 IP ns3113832.ip-54-38-177.eu.8333 > tom-Latitude-3570.56714: tcp 0
05:22:15.813641 IP bb42-60-217-183.singnet.com.sg.8333 > tom-Latitude-3570.60470: tcp 24
05:22:15.815539 IP bb42-60-217-183.singnet.com.sg.8333 > tom-Latitude-3570.60470: tcp 250
05:22:15.815562 IP bb42-60-217-183.singnet.com.sg.8333 > tom-Latitude-3570.60470: tcp 24
05:22:15.815565 IP bb42-60-217-183.singnet.com.sg.8333 > tom-Latitude-3570.60470: tcp 256
05:22:15.815568 IP bb42-60-217-183.singnet.com.sg.8333 > tom-Latitude-3570.60470: tcp 24
05:22:15.815570 IP bb42-60-217-183.singnet.com.sg.8333 > tom-Latitude-3570.60470: tcp 372
05:22:15.815673 IP tom-Latitude-3570.60470 > bb42-60-217-183.singnet.com.sg.8333: tcp 0
05:22:16.120196 IP tom-Latitude-3570.49070 > c-185-45-236-223.customer.ggaweb.ch.8333: tcp 24
05:22:16.120327 IP tom-Latitude-3570.60988 > 81.198.101.144.8333: tcp 24
05:22:16.120413 IP tom-Latitude-3570.57976 > 167.99.216.145.8333: tcp 24
05:22:16.122705 IP tom-Latitude-3570.49070 > c-185-45-236-223.customer.ggaweb.ch.8333: tcp 181
05:22:16.123571 IP tom-Latitude-3570.60988 > 81.198.101.144.8333: tcp 685
05:22:16.124236 IP tom-Latitude-3570.57976 > 167.99.216.145.8333: tcp 685
05:22:16.179402 IP 167.99.216.145.8333 > tom-Latitude-3570.57976: tcp 24
05:22:16.179423 IP 167.99.216.145.8333 > tom-Latitude-3570.57976: tcp 757
05:22:16.179428 IP c-185-45-236-223.customer.ggaweb.ch.8333 > tom-Latitude-3570.49070: tcp 0
05:22:16.179513 IP tom-Latitude-3570.57976 > 167.99.216.145.8333: tcp 0
05:22:16.179861 IP tom-Latitude-3570.57976 > 167.99.216.145.8333: tcp 24
05:22:16.179877 IP tom-Latitude-3570.57976 > 167.99.216.145.8333: tcp 73
05:22:16.182364 IP c-185-45-236-223.customer.ggaweb.ch.8333 > tom-Latitude-3570.49070: tcp 0
05:22:16.183017 IP 81.198.101.144.8333 > tom-Latitude-3570.60988: tcp 0
05:22:16.183022 IP 167.99.216.145.8333 > tom-Latitude-3570.57976: tcp 0
05:22:16.214138 IP 167.99.216.145.8333 > tom-Latitude-3570.57976: tcp 0
05:22:16.275336 IP 167.99.216.145.8333 > tom-Latitude-3570.57976: tcp 24
05:22:16.275935 IP 167.99.216.145.8333 > tom-Latitude-3570.57976: tcp 226
05:22:16.275941 IP 167.99.216.145.8333 > tom-Latitude-3570.57976: tcp 24
05:22:16.275944 IP 167.99.216.145.8333 > tom-Latitude-3570.57976: tcp 191
05:22:16.275952 IP tom-Latitude-3570.57976 > 167.99.216.145.8333: tcp 0
05:22:16.778008 IP tom-Latitude-3570.39110 > vmi195435.contaboserver.net.8333: tcp 24
05:22:16.780883 IP tom-Latitude-3570.39110 > vmi195435.contaboserver.net.8333: tcp 73
05:22:16.847096 IP static-87-75-105-186.vodafonexdsl.co.uk.8333 > tom-Latitude-3570.46284: tcp 24
05:22:16.850382 IP static-87-75-105-186.vodafonexdsl.co.uk.8333 > tom-Latitude-3570.46284: tcp 1261
05:22:16.850401 IP static-87-75-105-186.vodafonexdsl.co.uk.8333 > tom-Latitude-3570.46284: tcp 1261
05:22:16.850429 IP tom-Latitude-3570.46284 > static-87-75-105-186.vodafonexdsl.co.uk.8333: tcp 0
05:22:16.850443 IP static-87-75-105-186.vodafonexdsl.co.uk.8333 > tom-Latitude-3570.46284: tcp 24
05:22:16.850446 IP tom-Latitude-3570.46284 > static-87-75-105-186.vodafonexdsl.co.uk.8333: tcp 0
05:22:16.850450 IP vmi195435.contaboserver.net.8333 > tom-Latitude-3570.39110: tcp 0
05:22:16.850456 IP vmi195435.contaboserver.net.8333 > tom-Latitude-3570.39110: tcp 0
05:22:16.850462 IP static-87-75-105-186.vodafonexdsl.co.uk.8333 > tom-Latitude-3570.46284: tcp 433
05:22:16.850465 IP tom-Latitude-3570.46284 > static-87-75-105-186.vodafonexdsl.co.uk.8333: tcp 0
05:22:16.851009 IP tom-Latitude-3570.46284 > static-87-75-105-186.vodafonexdsl.co.uk.8333: tcp 24
05:22:16.854177 IP tom-Latitude-3570.46284 > static-87-75-105-186.vodafonexdsl.co.uk.8333: tcp 109
05:22:16.889012 IP static-87-75-105-186.vodafonexdsl.co.uk.8333 > tom-Latitude-3570.46284: tcp 0
05:22:16.948985 IP static-87-75-105-186.vodafonexdsl.co.uk.8333 > tom-Latitude-3570.46284: tcp 24
05:22:16.949779 IP static-87-75-105-186.vodafonexdsl.co.uk.8333 > tom-Latitude-3570.46284: tcp 405
05:22:16.949786 IP static-87-75-105-186.vodafonexdsl.co.uk.8333 > tom-Latitude-3570.46284: tcp 24
05:22:16.949789 IP static-87-75-105-186.vodafonexdsl.co.uk.8333 > tom-Latitude-3570.46284: tcp 224
05:22:16.949791 IP static-87-75-105-186.vodafonexdsl.co.uk.8333 > tom-Latitude-3570.46284: tcp 24
05:22:16.949793 IP static-87-75-105-186.vodafonexdsl.co.uk.8333 > tom-Latitude-3570.46284: tcp 223
05:22:16.949797 IP tom-Latitude-3570.46284 > static-87-75-105-186.vodafonexdsl.co.uk.8333: tcp 0
05:22:16.949837 IP tom-Latitude-3570.46284 > static-87-75-105-186.vodafonexdsl.co.uk.8333: tcp 0
05:22:17.352064 IP tom-Latitude-3570.57976 > 167.99.216.145.8333: tcp 24
05:22:17.354136 IP tom-Latitude-3570.57976 > 167.99.216.145.8333: tcp 109
05:22:17.422593 IP 167.99.216.145.8333 > tom-Latitude-3570.57976: tcp 0
05:22:17.714593 IP 81.198.101.144.8333 > tom-Latitude-3570.60988: tcp 24
05:22:17.714613 IP 81.198.101.144.8333 > tom-Latitude-3570.60988: tcp 8
05:22:17.714702 IP tom-Latitude-3570.60988 > 81.198.101.144.8333: tcp 0
05:22:17.714857 IP tom-Latitude-3570.60988 > 81.198.101.144.8333: tcp 24
05:22:17.716362 IP tom-Latitude-3570.60988 > 81.198.101.144.8333: tcp 8
05:22:17.752220 IP 81.198.101.144.8333 > tom-Latitude-3570.60988: tcp 0
05:22:17.919382 IP c-185-45-236-223.customer.ggaweb.ch.8333 > tom-Latitude-3570.49070: tcp 24
05:22:17.919405 IP tom-Latitude-3570.49070 > c-185-45-236-223.customer.ggaweb.ch.8333: tcp 0
05:22:17.919437 IP c-185-45-236-223.customer.ggaweb.ch.8333 > tom-Latitude-3570.49070: tcp 253
05:22:17.919443 IP tom-Latitude-3570.49070 > c-185-45-236-223.customer.ggaweb.ch.8333: tcp 0
05:22:17.919770 IP tom-Latitude-3570.49070 > c-185-45-236-223.customer.ggaweb.ch.8333: tcp 24
05:22:17.921801 IP tom-Latitude-3570.49070 > c-185-45-236-223.customer.ggaweb.ch.8333: tcp 73
05:22:17.962702 IP c-185-45-236-223.customer.ggaweb.ch.8333 > tom-Latitude-3570.49070: tcp 0
05:22:17.962709 IP c-185-45-236-223.customer.ggaweb.ch.8333 > tom-Latitude-3570.49070: tcp 0
05:22:18.045801 IP c-185-45-236-223.customer.ggaweb.ch.8333 > tom-Latitude-3570.49070: tcp 24
05:22:18.046352 IP c-185-45-236-223.customer.ggaweb.ch.8333 > tom-Latitude-3570.49070: tcp 535
05:22:18.046481 IP tom-Latitude-3570.49070 > c-185-45-236-223.customer.ggaweb.ch.8333: tcp 0
05:22:18.147595 IP tom-Latitude-3570.39110 > vmi195435.contaboserver.net.8333: tcp 24
05:22:18.148668 IP tom-Latitude-3570.39110 > vmi195435.contaboserver.net.8333: tcp 181
05:22:18.184683 IP vmi195435.contaboserver.net.8333 > tom-Latitude-3570.39110: tcp 0
05:22:18.191467 IP vmi195435.contaboserver.net.8333 > tom-Latitude-3570.39110: tcp 0
05:22:18.248020 IP tom-Latitude-3570.42516 > 2.56.9.15.8333: tcp 24
05:22:18.248953 IP tom-Latitude-3570.42516 > 2.56.9.15.8333: tcp 361
05:22:18.284713 IP 2.56.9.15.8333 > tom-Latitude-3570.42516: tcp 0
05:22:18.291478 IP 2.56.9.15.8333 > tom-Latitude-3570.42516: tcp 0
05:22:18.379847 IP bb42-60-217-183.singnet.com.sg.8333 > tom-Latitude-3570.60470: tcp 24
05:22:18.380990 IP bb42-60-217-183.singnet.com.sg.8333 > tom-Latitude-3570.60470: tcp 937
05:22:18.381104 IP tom-Latitude-3570.60470 > bb42-60-217-183.singnet.com.sg.8333: tcp 0
05:22:18.983024 IP tom-Latitude-3570.57976 > 167.99.216.145.8333: tcp 24
05:22:18.985262 IP tom-Latitude-3570.57976 > 167.99.216.145.8333: tcp 73
05:22:19.082273 IP 167.99.216.145.8333 > tom-Latitude-3570.57976: tcp 0
05:22:19.183766 IP tom-Latitude-3570.60988 > 81.198.101.144.8333: tcp 24
05:22:19.184918 IP tom-Latitude-3570.60988 > 81.198.101.144.8333: tcp 253
05:22:19.221459 IP 81.198.101.144.8333 > tom-Latitude-3570.60988: tcp 0
05:22:19.284183 IP tom-Latitude-3570.46284 > static-87-75-105-186.vodafonexdsl.co.uk.8333: tcp 24
05:22:19.285442 IP 81.198.101.144.8333 > tom-Latitude-3570.60988: tcp 24
05:22:19.285459 IP 81.198.101.144.8333 > tom-Latitude-3570.60988: tcp 289
05:22:19.285486 IP tom-Latitude-3570.60988 > 81.198.101.144.8333: tcp 0
05:22:19.285729 IP tom-Latitude-3570.60988 > 81.198.101.144.8333: tcp 24
05:22:19.286306 IP tom-Latitude-3570.46284 > static-87-75-105-186.vodafonexdsl.co.uk.8333: tcp 73
05:22:19.287892 IP tom-Latitude-3570.60988 > 81.198.101.144.8333: tcp 37
05:22:19.320769 IP static-87-75-105-186.vodafonexdsl.co.uk.8333 > tom-Latitude-3570.46284: tcp 0
05:22:19.321371 IP 81.198.101.144.8333 > tom-Latitude-3570.60988: tcp 0
05:22:19.346804 IP vmi195435.contaboserver.net.8333 > tom-Latitude-3570.39110: tcp 24
05:22:19.346828 IP tom-Latitude-3570.39110 > vmi195435.contaboserver.net.8333: tcp 0
05:22:19.347805 IP vmi195435.contaboserver.net.8333 > tom-Latitude-3570.39110: tcp 37
05:22:19.347823 IP tom-Latitude-3570.39110 > vmi195435.contaboserver.net.8333: tcp 0
05:22:19.352974 IP 167.99.216.145.8333 > tom-Latitude-3570.57976: tcp 24
05:22:19.352994 IP 167.99.216.145.8333 > tom-Latitude-3570.57976: tcp 37
05:22:19.353083 IP tom-Latitude-3570.57976 > 167.99.216.145.8333: tcp 0
05:22:19.411843 IP 81.198.101.144.8333 > tom-Latitude-3570.60988: tcp 24
05:22:19.412396 IP 81.198.101.144.8333 > tom-Latitude-3570.60988: tcp 256
05:22:19.412526 IP tom-Latitude-3570.60988 > 81.198.101.144.8333: tcp 0
05:22:19.505426 IP c-185-45-236-223.customer.ggaweb.ch.8333 > tom-Latitude-3570.49070: tcp 24
05:22:19.505447 IP c-185-45-236-223.customer.ggaweb.ch.8333 > tom-Latitude-3570.49070: tcp 109
05:22:19.505538 IP tom-Latitude-3570.49070 > c-185-45-236-223.customer.ggaweb.ch.8333: tcp 0
05:22:19.505765 IP tom-Latitude-3570.49070 > c-185-45-236-223.customer.ggaweb.ch.8333: tcp 24
05:22:19.505841 IP tom-Latitude-3570.46284 > static-87-75-105-186.vodafonexdsl.co.uk.8333: tcp 24
05:22:19.507438 IP tom-Latitude-3570.49070 > c-185-45-236-223.customer.ggaweb.ch.8333: tcp 73
05:22:19.508436 IP tom-Latitude-3570.46284 > static-87-75-105-186.vodafonexdsl.co.uk.8333: tcp 37
05:22:19.530793 IP c-185-45-236-223.customer.ggaweb.ch.8333 > tom-Latitude-3570.49070: tcp 0
05:22:19.538800 IP static-87-75-105-186.vodafonexdsl.co.uk.8333 > tom-Latitude-3570.46284: tcp 0
05:22:19.538815 IP c-185-45-236-223.customer.ggaweb.ch.8333 > tom-Latitude-3570.49070: tcp 0
05:22:19.628848 IP c-185-45-236-223.customer.ggaweb.ch.8333 > tom-Latitude-3570.49070: tcp 24
05:22:19.629569 IP c-185-45-236-223.customer.ggaweb.ch.8333 > tom-Latitude-3570.49070: tcp 806
05:22:19.629698 IP tom-Latitude-3570.49070 > c-185-45-236-223.customer.ggaweb.ch.8333: tcp 0
05:22:19.733085 IP tom-Latitude-3570.49070 > c-185-45-236-223.customer.ggaweb.ch.8333: tcp 24
05:22:19.735346 IP tom-Latitude-3570.49070 > c-185-45-236-223.customer.ggaweb.ch.8333: tcp 31
05:22:19.762805 IP c-185-45-236-223.customer.ggaweb.ch.8333 > tom-Latitude-3570.49070: tcp 0
05:22:19.778676 IP c-185-45-236-223.customer.ggaweb.ch.8333 > tom-Latitude-3570.49070: tcp 0
05:22:19.833492 IP tom-Latitude-3570.57976 > 167.99.216.145.8333: tcp 24
05:22:19.834430 IP tom-Latitude-3570.57976 > 167.99.216.145.8333: tcp 73
05:22:19.876622 IP 167.99.216.145.8333 > tom-Latitude-3570.57976: tcp 0
05:22:20.335147 IP tom-Latitude-3570.42516 > 2.56.9.15.8333: tcp 24
05:22:20.335190 IP tom-Latitude-3570.46284 > static-87-75-105-186.vodafonexdsl.co.uk.8333: tcp 24
05:22:20.371115 IP tom-Latitude-3570.42516 > 2.56.9.15.8333: tcp 109
05:22:20.372003 IP tom-Latitude-3570.46284 > static-87-75-105-186.vodafonexdsl.co.uk.8333: tcp 73
05:22:20.433997 IP 2.56.9.15.8333 > tom-Latitude-3570.42516: tcp 0
05:22:20.442446 IP static-87-75-105-186.vodafonexdsl.co.uk.8333 > tom-Latitude-3570.46284: tcp 0
05:22:20.442460 IP 2.56.9.15.8333 > tom-Latitude-3570.42516: tcp 0
05:22:20.787224 IP bb42-60-217-183.singnet.com.sg.8333 > tom-Latitude-3570.60470: tcp 24
05:22:20.787243 IP bb42-60-217-183.singnet.com.sg.8333 > tom-Latitude-3570.60470: tcp 109
05:22:20.787335 IP tom-Latitude-3570.60470 > bb42-60-217-183.singnet.com.sg.8333: tcp 0
05:22:20.815485 IP bb42-60-217-183.singnet.com.sg.8333 > tom-Latitude-3570.60470: tcp 109
05:22:20.815503 IP tom-Latitude-3570.60470 > bb42-60-217-183.singnet.com.sg.8333: tcp 0
05:22:20.988323 IP tom-Latitude-3570.56714 > ns3113832.ip-54-38-177.eu.8333: tcp 24
05:22:20.990568 IP tom-Latitude-3570.56714 > ns3113832.ip-54-38-177.eu.8333: tcp 469
05:22:21.026402 IP ns3113832.ip-54-38-177.eu.8333 > tom-Latitude-3570.56714: tcp 0
05:22:21.034554 IP ns3113832.ip-54-38-177.eu.8333 > tom-Latitude-3570.56714: tcp 0
05:22:21.196217 IP static-87-75-105-186.vodafonexdsl.co.uk.8333 > tom-Latitude-3570.46284: tcp 24
05:22:21.196238 IP static-87-75-105-186.vodafonexdsl.co.uk.8333 > tom-Latitude-3570.46284: tcp 145
05:22:21.196329 IP tom-Latitude-3570.46284 > static-87-75-105-186.vodafonexdsl.co.uk.8333: tcp 0
05:22:21.196558 IP tom-Latitude-3570.46284 > static-87-75-105-186.vodafonexdsl.co.uk.8333: tcp 24
05:22:21.198296 IP tom-Latitude-3570.46284 > static-87-75-105-186.vodafonexdsl.co.uk.8333: tcp 145
05:22:21.241051 IP static-87-75-105-186.vodafonexdsl.co.uk.8333 > tom-Latitude-3570.46284: tcp 0
05:22:21.308952 IP static-87-75-105-186.vodafonexdsl.co.uk.8333 > tom-Latitude-3570.46284: tcp 24
05:22:21.311205 IP static-87-75-105-186.vodafonexdsl.co.uk.8333 > tom-Latitude-3570.46284: tcp 247
05:22:21.311226 IP static-87-75-105-186.vodafonexdsl.co.uk.8333 > tom-Latitude-3570.46284: tcp 24
05:22:21.311230 IP static-87-75-105-186.vodafonexdsl.co.uk.8333 > tom-Latitude-3570.46284: tcp 225
05:22:21.311251 IP static-87-75-105-186.vodafonexdsl.co.uk.8333 > tom-Latitude-3570.46284: tcp 24
05:22:21.311253 IP static-87-75-105-186.vodafonexdsl.co.uk.8333 > tom-Latitude-3570.46284: tcp 191
05:22:21.311256 IP static-87-75-105-186.vodafonexdsl.co.uk.8333 > tom-Latitude-3570.46284: tcp 24
05:22:21.311259 IP static-87-75-105-186.vodafonexdsl.co.uk.8333 > tom-Latitude-3570.46284: tcp 223
05:22:21.311336 IP tom-Latitude-3570.46284 > static-87-75-105-186.vodafonexdsl.co.uk.8333: tcp 0
05:22:21.513541 IP tom-Latitude-3570.42516 > 2.56.9.15.8333: tcp 24
05:22:21.515630 IP tom-Latitude-3570.42516 > 2.56.9.15.8333: tcp 145
05:22:21.544457 IP 2.56.9.15.8333 > tom-Latitude-3570.42516: tcp 0
05:22:21.550860 IP 2.56.9.15.8333 > tom-Latitude-3570.42516: tcp 0
05:22:21.613926 IP tom-Latitude-3570.57976 > 167.99.216.145.8333: tcp 24
05:22:21.614155 IP tom-Latitude-3570.60470 > bb42-60-217-183.singnet.com.sg.8333: tcp 24
05:22:21.642864 IP tom-Latitude-3570.57976 > 167.99.216.145.8333: tcp 145
05:22:21.643540 IP tom-Latitude-3570.60470 > bb42-60-217-183.singnet.com.sg.8333: tcp 145
05:22:21.691895 IP bb42-60-217-183.singnet.com.sg.8333 > tom-Latitude-3570.60470: tcp 0
05:22:21.691907 IP bb42-60-217-183.singnet.com.sg.8333 > tom-Latitude-3570.60470: tcp 0
05:22:21.691910 IP 167.99.216.145.8333 > tom-Latitude-3570.57976: tcp 0
05:22:22.516972 IP tom-Latitude-3570.39110 > vmi195435.contaboserver.net.8333: tcp 24
05:22:22.519537 IP tom-Latitude-3570.39110 > vmi195435.contaboserver.net.8333: tcp 217
05:22:22.573415 IP vmi195435.contaboserver.net.8333 > tom-Latitude-3570.39110: tcp 0
05:22:22.581804 IP vmi195435.contaboserver.net.8333 > tom-Latitude-3570.39110: tcp 0
05:22:23.319668 IP tom-Latitude-3570.49070 > c-185-45-236-223.customer.ggaweb.ch.8333: tcp 24
05:22:23.321876 IP tom-Latitude-3570.49070 > c-185-45-236-223.customer.ggaweb.ch.8333: tcp 145
05:22:23.375130 IP c-185-45-236-223.customer.ggaweb.ch.8333 > tom-Latitude-3570.49070: tcp 0
05:22:23.381743 IP c-185-45-236-223.customer.ggaweb.ch.8333 > tom-Latitude-3570.49070: tcp 0
05:22:23.653810 IP 81.198.101.144.8333 > tom-Latitude-3570.60988: tcp 24
05:22:23.653830 IP 81.198.101.144.8333 > tom-Latitude-3570.60988: tcp 361
05:22:23.653836 IP 81.198.101.144.8333 > tom-Latitude-3570.60988: tcp 361
05:22:23.653848 IP tom-Latitude-3570.60988 > 81.198.101.144.8333: tcp 0
05:22:23.654166 IP tom-Latitude-3570.60988 > 81.198.101.144.8333: tcp 24
05:22:23.655553 IP tom-Latitude-3570.60988 > 81.198.101.144.8333: tcp 145
05:22:23.691171 IP 81.198.101.144.8333 > tom-Latitude-3570.60988: tcp 0
05:22:23.788931 IP 81.198.101.144.8333 > tom-Latitude-3570.60988: tcp 24
05:22:23.792751 IP 81.198.101.144.8333 > tom-Latitude-3570.60988: tcp 223
05:22:23.792771 IP 81.198.101.144.8333 > tom-Latitude-3570.60988: tcp 24
05:22:23.792776 IP 81.198.101.144.8333 > tom-Latitude-3570.60988: tcp 333
05:22:23.792779 IP 81.198.101.144.8333 > tom-Latitude-3570.60988: tcp 24
05:22:23.792783 IP 81.198.101.144.8333 > tom-Latitude-3570.60988: tcp 222
05:22:23.792790 IP 81.198.101.144.8333 > tom-Latitude-3570.60988: tcp 24
05:22:23.792793 IP 81.198.101.144.8333 > tom-Latitude-3570.60988: tcp 443
05:22:23.792839 IP tom-Latitude-3570.60988 > 81.198.101.144.8333: tcp 0
05:22:23.894889 IP tom-Latitude-3570.56714 > ns3113832.ip-54-38-177.eu.8333: tcp 24
05:22:23.896066 IP tom-Latitude-3570.56714 > ns3113832.ip-54-38-177.eu.8333: tcp 289
05:22:23.924187 IP ns3113832.ip-54-38-177.eu.8333 > tom-Latitude-3570.56714: tcp 0
05:22:23.931877 IP ns3113832.ip-54-38-177.eu.8333 > tom-Latitude-3570.56714: tcp 0
05:22:23.972974 IP tom-Latitude-3570.46616 > p5093b76d.dip0.t-ipconnect.de.8333: tcp 0
05:22:23.995309 IP tom-Latitude-3570.42516 > 2.56.9.15.8333: tcp 24
05:22:23.996267 IP tom-Latitude-3570.42516 > 2.56.9.15.8333: tcp 145
05:22:24.003787 IP p5093b76d.dip0.t-ipconnect.de.8333 > tom-Latitude-3570.46616: tcp 0
05:22:24.003820 IP tom-Latitude-3570.46616 > p5093b76d.dip0.t-ipconnect.de.8333: tcp 0
05:22:24.004120 IP tom-Latitude-3570.46616 > p5093b76d.dip0.t-ipconnect.de.8333: tcp 24
05:22:24.005510 IP tom-Latitude-3570.46616 > p5093b76d.dip0.t-ipconnect.de.8333: tcp 102
05:22:24.032962 IP 2.56.9.15.8333 > tom-Latitude-3570.42516: tcp 0
05:22:24.033587 IP 2.56.9.15.8333 > tom-Latitude-3570.42516: tcp 0
05:22:24.074876 IP p5093b76d.dip0.t-ipconnect.de.8333 > tom-Latitude-3570.46616: tcp 0
05:22:24.131062 IP bb42-60-217-183.singnet.com.sg.8333 > tom-Latitude-3570.60470: tcp 24
05:22:24.131088 IP tom-Latitude-3570.60470 > bb42-60-217-183.singnet.com.sg.8333: tcp 0
05:22:24.131755 IP bb42-60-217-183.singnet.com.sg.8333 > tom-Latitude-3570.60470: tcp 253
05:22:24.131781 IP tom-Latitude-3570.60470 > bb42-60-217-183.singnet.com.sg.8333: tcp 0
05:22:24.132044 IP tom-Latitude-3570.60470 > bb42-60-217-183.singnet.com.sg.8333: tcp 24
05:22:24.133914 IP tom-Latitude-3570.60470 > bb42-60-217-183.singnet.com.sg.8333: tcp 109
05:22:24.202362 IP bb42-60-217-183.singnet.com.sg.8333 > tom-Latitude-3570.60470: tcp 0
05:22:24.203076 IP bb42-60-217-183.singnet.com.sg.8333 > tom-Latitude-3570.60470: tcp 0
05:22:24.263207 IP 167.99.216.145.8333 > tom-Latitude-3570.57976: tcp 24
05:22:24.263227 IP 167.99.216.145.8333 > tom-Latitude-3570.57976: tcp 37
05:22:24.263274 IP tom-Latitude-3570.57976 > 167.99.216.145.8333: tcp 0
05:22:24.263441 IP tom-Latitude-3570.57976 > 167.99.216.145.8333: tcp 24
05:22:24.266779 IP tom-Latitude-3570.57976 > 167.99.216.145.8333: tcp 37
05:22:24.303153 IP 167.99.216.145.8333 > tom-Latitude-3570.57976: tcp 0
05:22:24.677824 IP bb42-60-217-183.singnet.com.sg.8333 > tom-Latitude-3570.60470: tcp 24
05:22:24.677846 IP bb42-60-217-183.singnet.com.sg.8333 > tom-Latitude-3570.60470: tcp 517
05:22:24.677851 IP bb42-60-217-183.singnet.com.sg.8333 > tom-Latitude-3570.60470: tcp 24
05:22:24.677854 IP bb42-60-217-183.singnet.com.sg.8333 > tom-Latitude-3570.60470: tcp 667
05:22:24.677858 IP bb42-60-217-183.singnet.com.sg.8333 > tom-Latitude-3570.60470: tcp 24
05:22:24.677891 IP tom-Latitude-3570.60470 > bb42-60-217-183.singnet.com.sg.8333: tcp 0
05:22:24.678114 IP bb42-60-217-183.singnet.com.sg.8333 > tom-Latitude-3570.60470: tcp 1460
05:22:24.678130 IP bb42-60-217-183.singnet.com.sg.8333 > tom-Latitude-3570.60470: tcp 211
05:22:24.678194 IP tom-Latitude-3570.60470 > bb42-60-217-183.singnet.com.sg.8333: tcp 0
05:22:24.684204 IP bb42-60-217-183.singnet.com.sg.8333 > tom-Latitude-3570.60470: tcp 211
05:22:24.684219 IP tom-Latitude-3570.60470 > bb42-60-217-183.singnet.com.sg.8333: tcp 0
05:22:24.707771 IP 2.56.9.15.8333 > tom-Latitude-3570.42516: tcp 24
05:22:24.707793 IP 2.56.9.15.8333 > tom-Latitude-3570.42516: tcp 181
05:22:24.707840 IP tom-Latitude-3570.42516 > 2.56.9.15.8333: tcp 0
05:22:24.708061 IP tom-Latitude-3570.42516 > 2.56.9.15.8333: tcp 24
05:22:24.709524 IP tom-Latitude-3570.42516 > 2.56.9.15.8333: tcp 73
05:22:24.721472 IP static-87-75-105-186.vodafonexdsl.co.uk.8333 > tom-Latitude-3570.46284: tcp 24
05:22:24.725461 IP static-87-75-105-186.vodafonexdsl.co.uk.8333 > tom-Latitude-3570.46284: tcp 253
05:22:24.725526 IP tom-Latitude-3570.46284 > static-87-75-105-186.vodafonexdsl.co.uk.8333: tcp 0
05:22:24.725712 IP tom-Latitude-3570.39110 > vmi195435.contaboserver.net.8333: tcp 24
05:22:24.727006 IP tom-Latitude-3570.39110 > vmi195435.contaboserver.net.8333: tcp 253
05:22:24.738131 IP 2.56.9.15.8333 > tom-Latitude-3570.42516: tcp 0
05:22:24.745773 IP 2.56.9.15.8333 > tom-Latitude-3570.42516: tcp 0
05:22:24.763925 IP vmi195435.contaboserver.net.8333 > tom-Latitude-3570.39110: tcp 0
05:22:24.763940 IP vmi195435.contaboserver.net.8333 > tom-Latitude-3570.39110: tcp 0
05:22:24.841377 IP 2.56.9.15.8333 > tom-Latitude-3570.42516: tcp 24
05:22:24.845260 IP 2.56.9.15.8333 > tom-Latitude-3570.42516: tcp 257
05:22:24.845326 IP tom-Latitude-3570.42516 > 2.56.9.15.8333: tcp 0
05:22:24.845650 IP 2.56.9.15.8333 > tom-Latitude-3570.42516: tcp 24
05:22:24.845681 IP 2.56.9.15.8333 > tom-Latitude-3570.42516: tcp 372
05:22:24.845722 IP tom-Latitude-3570.42516 > 2.56.9.15.8333: tcp 0
05:22:25.247733 IP tom-Latitude-3570.46284 > static-87-75-105-186.vodafonexdsl.co.uk.8333: tcp 24
05:22:25.249811 IP tom-Latitude-3570.46284 > static-87-75-105-186.vodafonexdsl.co.uk.8333: tcp 73
05:22:25.293348 IP static-87-75-105-186.vodafonexdsl.co.uk.8333 > tom-Latitude-3570.46284: tcp 0
05:22:25.348146 IP tom-Latitude-3570.60988 > 81.198.101.144.8333: tcp 24
05:22:25.349313 IP tom-Latitude-3570.60988 > 81.198.101.144.8333: tcp 181
05:22:25.400549 IP 81.198.101.144.8333 > tom-Latitude-3570.60988: tcp 0
05:22:25.548854 IP tom-Latitude-3570.60470 > bb42-60-217-183.singnet.com.sg.8333: tcp 24
05:22:25.551124 IP tom-Latitude-3570.60470 > bb42-60-217-183.singnet.com.sg.8333: tcp 73
05:22:25.585716 IP bb42-60-217-183.singnet.com.sg.8333 > tom-Latitude-3570.60470: tcp 0
05:22:25.593340 IP bb42-60-217-183.singnet.com.sg.8333 > tom-Latitude-3570.60470: tcp 0
05:22:25.649248 IP tom-Latitude-3570.39110 > vmi195435.contaboserver.net.8333: tcp 24
05:22:25.650192 IP tom-Latitude-3570.39110 > vmi195435.contaboserver.net.8333: tcp 73
05:22:25.688004 IP vmi195435.contaboserver.net.8333 > tom-Latitude-3570.39110: tcp 0
05:22:25.691727 IP vmi195435.contaboserver.net.8333 > tom-Latitude-3570.39110: tcp 0
05:22:25.790441 IP static-87-75-105-186.vodafonexdsl.co.uk.8333 > tom-Latitude-3570.46284: tcp 24
05:22:25.805336 IP static-87-75-105-186.vodafonexdsl.co.uk.8333 > tom-Latitude-3570.46284: tcp 145
05:22:25.805403 IP tom-Latitude-3570.46284 > static-87-75-105-186.vodafonexdsl.co.uk.8333: tcp 0
05:22:25.805613 IP tom-Latitude-3570.46284 > static-87-75-105-186.vodafonexdsl.co.uk.8333: tcp 24
05:22:25.807556 IP tom-Latitude-3570.46284 > static-87-75-105-186.vodafonexdsl.co.uk.8333: tcp 145
05:22:25.817184 IP c-185-45-236-223.customer.ggaweb.ch.8333 > tom-Latitude-3570.49070: tcp 24
05:22:25.817920 IP c-185-45-236-223.customer.ggaweb.ch.8333 > tom-Latitude-3570.49070: tcp 433
05:22:25.817985 IP tom-Latitude-3570.49070 > c-185-45-236-223.customer.ggaweb.ch.8333: tcp 0
05:22:25.839094 IP static-87-75-105-186.vodafonexdsl.co.uk.8333 > tom-Latitude-3570.46284: tcp 0
05:22:25.905375 IP static-87-75-105-186.vodafonexdsl.co.uk.8333 > tom-Latitude-3570.46284: tcp 24
05:22:25.906314 IP static-87-75-105-186.vodafonexdsl.co.uk.8333 > tom-Latitude-3570.46284: tcp 486
05:22:25.906320 IP static-87-75-105-186.vodafonexdsl.co.uk.8333 > tom-Latitude-3570.46284: tcp 24
05:22:25.906327 IP static-87-75-105-186.vodafonexdsl.co.uk.8333 > tom-Latitude-3570.46284: tcp 281
05:22:25.906330 IP static-87-75-105-186.vodafonexdsl.co.uk.8333 > tom-Latitude-3570.46284: tcp 24
05:22:25.906333 IP static-87-75-105-186.vodafonexdsl.co.uk.8333 > tom-Latitude-3570.46284: tcp 226
05:22:25.906335 IP static-87-75-105-186.vodafonexdsl.co.uk.8333 > tom-Latitude-3570.46284: tcp 24
05:22:25.906338 IP static-87-75-105-186.vodafonexdsl.co.uk.8333 > tom-Latitude-3570.46284: tcp 520
05:22:25.906339 IP tom-Latitude-3570.46284 > static-87-75-105-186.vodafonexdsl.co.uk.8333: tcp 0
05:22:25.906387 IP tom-Latitude-3570.46284 > static-87-75-105-186.vodafonexdsl.co.uk.8333: tcp 0
05:22:26.612657 IP tom-Latitude-3570.60988 > 81.198.101.144.8333: tcp 24
05:22:26.612710 IP tom-Latitude-3570.60470 > bb42-60-217-183.singnet.com.sg.8333: tcp 24
05:22:26.614695 IP tom-Latitude-3570.60988 > 81.198.101.144.8333: tcp 145
05:22:26.615607 IP tom-Latitude-3570.60470 > bb42-60-217-183.singnet.com.sg.8333: tcp 145
05:22:26.673710 IP 2.56.9.15.8333 > tom-Latitude-3570.42516: tcp 24
05:22:26.681376 IP 2.56.9.15.8333 > tom-Latitude-3570.42516: tcp 145
05:22:26.681443 IP tom-Latitude-3570.42516 > 2.56.9.15.8333: tcp 0
05:22:26.684325 IP 81.198.101.144.8333 > tom-Latitude-3570.60988: tcp 0
05:22:26.684844 IP bb42-60-217-183.singnet.com.sg.8333 > tom-Latitude-3570.60470: tcp 0
05:22:26.684851 IP bb42-60-217-183.singnet.com.sg.8333 > tom-Latitude-3570.60470: tcp 0
05:22:26.699335 IP 2.56.9.15.8333 > tom-Latitude-3570.42516: tcp 145
05:22:26.699353 IP tom-Latitude-3570.42516 > 2.56.9.15.8333: tcp 0
05:22:26.782100 IP tom-Latitude-3570.57976 > 167.99.216.145.8333: tcp 24
05:22:26.783417 IP tom-Latitude-3570.57976 > 167.99.216.145.8333: tcp 469
05:22:26.823322 IP 167.99.216.145.8333 > tom-Latitude-3570.57976: tcp 0
05:22:27.083174 IP tom-Latitude-3570.39110 > vmi195435.contaboserver.net.8333: tcp 24
05:22:27.085887 IP tom-Latitude-3570.39110 > vmi195435.contaboserver.net.8333: tcp 145
05:22:27.114418 IP vmi195435.contaboserver.net.8333 > tom-Latitude-3570.39110: tcp 0
05:22:27.121764 IP vmi195435.contaboserver.net.8333 > tom-Latitude-3570.39110: tcp 0
05:22:27.954644 IP ns3113832.ip-54-38-177.eu.8333 > tom-Latitude-3570.56714: tcp 24
05:22:27.954669 IP tom-Latitude-3570.56714 > ns3113832.ip-54-38-177.eu.8333: tcp 0
05:22:27.954687 IP ns3113832.ip-54-38-177.eu.8333 > tom-Latitude-3570.56714: tcp 325
05:22:27.954692 IP tom-Latitude-3570.56714 > ns3113832.ip-54-38-177.eu.8333: tcp 0
05:22:27.954697 IP ns3113832.ip-54-38-177.eu.8333 > tom-Latitude-3570.56714: tcp 325
05:22:27.954701 IP tom-Latitude-3570.56714 > ns3113832.ip-54-38-177.eu.8333: tcp 0
05:22:28.041540 IP 2.56.9.15.8333 > tom-Latitude-3570.42516: tcp 24
05:22:28.041549 IP tom-Latitude-3570.42516 > 2.56.9.15.8333: tcp 0
05:22:28.041559 IP 2.56.9.15.8333 > tom-Latitude-3570.42516: tcp 145
05:22:28.041563 IP tom-Latitude-3570.42516 > 2.56.9.15.8333: tcp 0
05:22:28.041770 IP tom-Latitude-3570.42516 > 2.56.9.15.8333: tcp 24
05:22:28.043698 IP tom-Latitude-3570.42516 > 2.56.9.15.8333: tcp 145
05:22:28.091712 IP 2.56.9.15.8333 > tom-Latitude-3570.42516: tcp 0
05:22:28.091718 IP 2.56.9.15.8333 > tom-Latitude-3570.42516: tcp 0
05:22:28.190345 IP 2.56.9.15.8333 > tom-Latitude-3570.42516: tcp 24
05:22:28.191259 IP 2.56.9.15.8333 > tom-Latitude-3570.42516: tcp 491
05:22:28.191277 IP 2.56.9.15.8333 > tom-Latitude-3570.42516: tcp 24
05:22:28.191281 IP 2.56.9.15.8333 > tom-Latitude-3570.42516: tcp 224
05:22:28.191284 IP 2.56.9.15.8333 > tom-Latitude-3570.42516: tcp 24
05:22:28.191286 IP 2.56.9.15.8333 > tom-Latitude-3570.42516: tcp 371
05:22:28.191323 IP 2.56.9.15.8333 > tom-Latitude-3570.42516: tcp 24
05:22:28.191326 IP 2.56.9.15.8333 > tom-Latitude-3570.42516: tcp 373
05:22:28.191356 IP tom-Latitude-3570.42516 > 2.56.9.15.8333: tcp 0
05:22:28.397236 IP tom-Latitude-3570.49070 > c-185-45-236-223.customer.ggaweb.ch.8333: tcp 24
05:22:28.397287 IP tom-Latitude-3570.60988 > 81.198.101.144.8333: tcp 24
05:22:28.399315 IP tom-Latitude-3570.49070 > c-185-45-236-223.customer.ggaweb.ch.8333: tcp 181
05:22:28.400233 IP tom-Latitude-3570.60988 > 81.198.101.144.8333: tcp 145
05:22:28.442946 IP c-185-45-236-223.customer.ggaweb.ch.8333 > tom-Latitude-3570.49070: tcp 0
05:22:28.443803 IP c-185-45-236-223.customer.ggaweb.ch.8333 > tom-Latitude-3570.49070: tcp 0
05:22:28.443816 IP 81.198.101.144.8333 > tom-Latitude-3570.60988: tcp 0
05:22:28.598006 IP tom-Latitude-3570.57976 > 167.99.216.145.8333: tcp 24
05:22:28.598062 IP tom-Latitude-3570.46284 > static-87-75-105-186.vodafonexdsl.co.uk.8333: tcp 24
05:22:28.600126 IP tom-Latitude-3570.57976 > 167.99.216.145.8333: tcp 145
05:22:28.601604 IP tom-Latitude-3570.46284 > static-87-75-105-186.vodafonexdsl.co.uk.8333: tcp 145
05:22:28.641337 IP 167.99.216.145.8333 > tom-Latitude-3570.57976: tcp 0
05:22:28.641971 IP static-87-75-105-186.vodafonexdsl.co.uk.8333 > tom-Latitude-3570.46284: tcp 0
05:22:28.899112 IP tom-Latitude-3570.60470 > bb42-60-217-183.singnet.com.sg.8333: tcp 24
05:22:28.901154 IP tom-Latitude-3570.60470 > bb42-60-217-183.singnet.com.sg.8333: tcp 145
05:22:28.901750 IP vmi195435.contaboserver.net.8333 > tom-Latitude-3570.39110: tcp 24
05:22:28.901776 IP tom-Latitude-3570.39110 > vmi195435.contaboserver.net.8333: tcp 0
05:22:28.901794 IP vmi195435.contaboserver.net.8333 > tom-Latitude-3570.39110: tcp 289
05:22:28.901798 IP tom-Latitude-3570.39110 > vmi195435.contaboserver.net.8333: tcp 0
05:22:28.901803 IP vmi195435.contaboserver.net.8333 > tom-Latitude-3570.39110: tcp 289
05:22:28.901805 IP tom-Latitude-3570.39110 > vmi195435.contaboserver.net.8333: tcp 0
05:22:28.902043 IP tom-Latitude-3570.39110 > vmi195435.contaboserver.net.8333: tcp 24
05:22:28.906405 IP tom-Latitude-3570.39110 > vmi195435.contaboserver.net.8333: tcp 145
05:22:28.943067 IP bb42-60-217-183.singnet.com.sg.8333 > tom-Latitude-3570.60470: tcp 0
05:22:28.943703 IP vmi195435.contaboserver.net.8333 > tom-Latitude-3570.39110: tcp 0
05:22:28.943706 IP bb42-60-217-183.singnet.com.sg.8333 > tom-Latitude-3570.60470: tcp 0
05:22:28.943708 IP vmi195435.contaboserver.net.8333 > tom-Latitude-3570.39110: tcp 0
