01:24:04.456541 IP tom-Latitude-3570.42516 > 2.56.9.15.8333: tcp 24
01:24:04.457497 IP tom-Latitude-3570.42516 > 2.56.9.15.8333: tcp 145
01:24:04.505893 IP 2.56.9.15.8333 > tom-Latitude-3570.42516: tcp 0
01:24:04.520527 IP ns3113832.ip-54-38-177.eu.8333 > tom-Latitude-3570.56714: tcp 24
01:24:04.520554 IP tom-Latitude-3570.56714 > ns3113832.ip-54-38-177.eu.8333: tcp 0
01:24:04.521026 IP ns3113832.ip-54-38-177.eu.8333 > tom-Latitude-3570.56714: tcp 31
01:24:04.521033 IP tom-Latitude-3570.56714 > ns3113832.ip-54-38-177.eu.8333: tcp 0
01:24:04.621373 IP tom-Latitude-3570.60988 > 81.198.101.144.8333: tcp 24
01:24:04.622322 IP tom-Latitude-3570.60988 > 81.198.101.144.8333: tcp 37
01:24:04.663202 IP 81.198.101.144.8333 > tom-Latitude-3570.60988: tcp 0
01:24:07.599941 IP c-185-45-236-223.customer.ggaweb.ch.8333 > tom-Latitude-3570.49070: tcp 24
01:24:07.601591 IP c-185-45-236-223.customer.ggaweb.ch.8333 > tom-Latitude-3570.49070: tcp 505
01:24:07.601609 IP c-185-45-236-223.customer.ggaweb.ch.8333 > tom-Latitude-3570.49070: tcp 505
01:24:07.601636 IP tom-Latitude-3570.49070 > c-185-45-236-223.customer.ggaweb.ch.8333: tcp 0
01:24:07.602051 IP tom-Latitude-3570.49070 > c-185-45-236-223.customer.ggaweb.ch.8333: tcp 24
01:24:07.603024 IP tom-Latitude-3570.49070 > c-185-45-236-223.customer.ggaweb.ch.8333: tcp 505
01:24:07.627648 IP vmi195435.contaboserver.net.8333 > tom-Latitude-3570.39110: tcp 24
01:24:07.627668 IP vmi195435.contaboserver.net.8333 > tom-Latitude-3570.39110: tcp 505
01:24:07.627757 IP tom-Latitude-3570.39110 > vmi195435.contaboserver.net.8333: tcp 0
01:24:07.633958 IP c-185-45-236-223.customer.ggaweb.ch.8333 > tom-Latitude-3570.49070: tcp 0
01:24:07.637792 IP c-185-45-236-223.customer.ggaweb.ch.8333 > tom-Latitude-3570.49070: tcp 0
01:24:07.719087 IP c-185-45-236-223.customer.ggaweb.ch.8333 > tom-Latitude-3570.49070: tcp 24
01:24:07.721060 IP c-185-45-236-223.customer.ggaweb.ch.8333 > tom-Latitude-3570.49070: tcp 1273
01:24:07.721076 IP c-185-45-236-223.customer.ggaweb.ch.8333 > tom-Latitude-3570.49070: tcp 24
01:24:07.721079 IP c-185-45-236-223.customer.ggaweb.ch.8333 > tom-Latitude-3570.49070: tcp 410
01:24:07.721154 IP tom-Latitude-3570.49070 > c-185-45-236-223.customer.ggaweb.ch.8333: tcp 0
01:24:07.722882 IP c-185-45-236-223.customer.ggaweb.ch.8333 > tom-Latitude-3570.49070: tcp 226
01:24:07.723925 IP c-185-45-236-223.customer.ggaweb.ch.8333 > tom-Latitude-3570.49070: tcp 857
01:24:07.723949 IP c-185-45-236-223.customer.ggaweb.ch.8333 > tom-Latitude-3570.49070: tcp 24
01:24:07.723952 IP c-185-45-236-223.customer.ggaweb.ch.8333 > tom-Latitude-3570.49070: tcp 372
01:24:07.723955 IP c-185-45-236-223.customer.ggaweb.ch.8333 > tom-Latitude-3570.49070: tcp 24
01:24:07.723958 IP c-185-45-236-223.customer.ggaweb.ch.8333 > tom-Latitude-3570.49070: tcp 934
01:24:07.723988 IP tom-Latitude-3570.49070 > c-185-45-236-223.customer.ggaweb.ch.8333: tcp 0
01:24:07.819658 IP c-185-45-236-223.customer.ggaweb.ch.8333 > tom-Latitude-3570.49070: tcp 1448
01:24:07.819682 IP c-185-45-236-223.customer.ggaweb.ch.8333 > tom-Latitude-3570.49070: tcp 1043
01:24:07.819771 IP tom-Latitude-3570.49070 > c-185-45-236-223.customer.ggaweb.ch.8333: tcp 0
01:24:07.921997 IP 81.198.101.144.8333 > tom-Latitude-3570.60988: tcp 24
01:24:07.922017 IP 81.198.101.144.8333 > tom-Latitude-3570.60988: tcp 469
01:24:07.922110 IP tom-Latitude-3570.60988 > 81.198.101.144.8333: tcp 0
01:24:08.123167 IP tom-Latitude-3570.57976 > 167.99.216.145.8333: tcp 24
01:24:08.124108 IP tom-Latitude-3570.57976 > 167.99.216.145.8333: tcp 505
01:24:08.155327 IP 167.99.216.145.8333 > tom-Latitude-3570.57976: tcp 0
01:24:08.163845 IP 167.99.216.145.8333 > tom-Latitude-3570.57976: tcp 0
01:24:08.408114 IP bb42-60-217-183.singnet.com.sg.8333 > tom-Latitude-3570.60470: tcp 24
01:24:08.408134 IP bb42-60-217-183.singnet.com.sg.8333 > tom-Latitude-3570.60470: tcp 685
01:24:08.408228 IP tom-Latitude-3570.60470 > bb42-60-217-183.singnet.com.sg.8333: tcp 0
01:24:08.408469 IP tom-Latitude-3570.60470 > bb42-60-217-183.singnet.com.sg.8333: tcp 24
01:24:08.410113 IP tom-Latitude-3570.60470 > bb42-60-217-183.singnet.com.sg.8333: tcp 37
01:24:08.451831 IP bb42-60-217-183.singnet.com.sg.8333 > tom-Latitude-3570.60470: tcp 0
01:24:08.452375 IP bb42-60-217-183.singnet.com.sg.8333 > tom-Latitude-3570.60470: tcp 0
01:24:08.772502 IP 2.56.9.15.8333 > tom-Latitude-3570.42516: tcp 24
01:24:08.773294 IP 2.56.9.15.8333 > tom-Latitude-3570.42516: tcp 541
01:24:08.773427 IP tom-Latitude-3570.42516 > 2.56.9.15.8333: tcp 0
01:24:08.829599 IP bb42-60-217-183.singnet.com.sg.8333 > tom-Latitude-3570.60470: tcp 24
01:24:08.832866 IP bb42-60-217-183.singnet.com.sg.8333 > tom-Latitude-3570.60470: tcp 370
01:24:08.832997 IP tom-Latitude-3570.60470 > bb42-60-217-183.singnet.com.sg.8333: tcp 0
01:24:08.933684 IP tom-Latitude-3570.49070 > c-185-45-236-223.customer.ggaweb.ch.8333: tcp 24
01:24:08.934670 IP tom-Latitude-3570.49070 > c-185-45-236-223.customer.ggaweb.ch.8333: tcp 31
01:24:08.966188 IP c-185-45-236-223.customer.ggaweb.ch.8333 > tom-Latitude-3570.49070: tcp 0
01:24:08.973538 IP c-185-45-236-223.customer.ggaweb.ch.8333 > tom-Latitude-3570.49070: tcp 0
01:24:09.334952 IP tom-Latitude-3570.56714 > ns3113832.ip-54-38-177.eu.8333: tcp 24
01:24:09.334994 IP tom-Latitude-3570.57976 > 167.99.216.145.8333: tcp 24
01:24:09.335832 IP tom-Latitude-3570.57976 > 167.99.216.145.8333: tcp 37
01:24:09.335858 IP tom-Latitude-3570.56714 > ns3113832.ip-54-38-177.eu.8333: tcp 541
01:24:09.400474 IP ns3113832.ip-54-38-177.eu.8333 > tom-Latitude-3570.56714: tcp 0
01:24:09.400489 IP ns3113832.ip-54-38-177.eu.8333 > tom-Latitude-3570.56714: tcp 0
01:24:09.400491 IP 167.99.216.145.8333 > tom-Latitude-3570.57976: tcp 0
01:24:09.400494 IP 167.99.216.145.8333 > tom-Latitude-3570.57976: tcp 0
01:24:09.635992 IP tom-Latitude-3570.39110 > vmi195435.contaboserver.net.8333: tcp 24
01:24:09.636935 IP tom-Latitude-3570.39110 > vmi195435.contaboserver.net.8333: tcp 37
01:24:09.665607 IP vmi195435.contaboserver.net.8333 > tom-Latitude-3570.39110: tcp 0
01:24:09.676968 IP vmi195435.contaboserver.net.8333 > tom-Latitude-3570.39110: tcp 0
01:24:10.538501 IP tom-Latitude-3570.42516 > 2.56.9.15.8333: tcp 24
01:24:10.611477 IP tom-Latitude-3570.42516 > 2.56.9.15.8333: tcp 31
01:24:10.643520 IP 2.56.9.15.8333 > tom-Latitude-3570.42516: tcp 0
01:24:10.859011 IP c-185-45-236-223.customer.ggaweb.ch.8333 > tom-Latitude-3570.49070: tcp 24
01:24:10.859502 IP c-185-45-236-223.customer.ggaweb.ch.8333 > tom-Latitude-3570.49070: tcp 37
01:24:10.859599 IP tom-Latitude-3570.49070 > c-185-45-236-223.customer.ggaweb.ch.8333: tcp 0
01:24:11.461459 IP tom-Latitude-3570.60988 > 81.198.101.144.8333: tcp 24
01:24:11.462740 IP tom-Latitude-3570.60988 > 81.198.101.144.8333: tcp 73
01:24:11.523625 IP 81.198.101.144.8333 > tom-Latitude-3570.60988: tcp 0
01:24:12.400160 IP 2.56.9.15.8333 > tom-Latitude-3570.42516: tcp 24
01:24:12.400821 IP 2.56.9.15.8333 > tom-Latitude-3570.42516: tcp 145
01:24:12.400840 IP 2.56.9.15.8333 > tom-Latitude-3570.42516: tcp 145
01:24:12.400853 IP tom-Latitude-3570.42516 > 2.56.9.15.8333: tcp 0
01:24:12.401074 IP tom-Latitude-3570.42516 > 2.56.9.15.8333: tcp 24
01:24:12.403254 IP tom-Latitude-3570.42516 > 2.56.9.15.8333: tcp 145
01:24:12.441870 IP 2.56.9.15.8333 > tom-Latitude-3570.42516: tcp 0
01:24:12.538045 IP 2.56.9.15.8333 > tom-Latitude-3570.42516: tcp 24
01:24:12.538064 IP 2.56.9.15.8333 > tom-Latitude-3570.42516: tcp 192
01:24:12.538070 IP 2.56.9.15.8333 > tom-Latitude-3570.42516: tcp 24
01:24:12.538073 IP 2.56.9.15.8333 > tom-Latitude-3570.42516: tcp 225
01:24:12.538075 IP 2.56.9.15.8333 > tom-Latitude-3570.42516: tcp 24
01:24:12.538110 IP tom-Latitude-3570.42516 > 2.56.9.15.8333: tcp 0
01:24:12.542705 IP 2.56.9.15.8333 > tom-Latitude-3570.42516: tcp 372
01:24:12.542723 IP 2.56.9.15.8333 > tom-Latitude-3570.42516: tcp 24
01:24:12.542727 IP 2.56.9.15.8333 > tom-Latitude-3570.42516: tcp 224
01:24:12.542771 IP tom-Latitude-3570.42516 > 2.56.9.15.8333: tcp 0
01:24:12.644012 IP tom-Latitude-3570.60988 > 81.198.101.144.8333: tcp 24
01:24:12.644956 IP tom-Latitude-3570.60988 > 81.198.101.144.8333: tcp 145
01:24:12.683513 IP 81.198.101.144.8333 > tom-Latitude-3570.60988: tcp 0
01:24:12.844686 IP tom-Latitude-3570.46284 > static-87-75-105-186.vodafonexdsl.co.uk.8333: tcp 24
01:24:12.944890 IP tom-Latitude-3570.60988 > 81.198.101.144.8333: tcp 24
01:24:13.012426 IP tom-Latitude-3570.60988 > 81.198.101.144.8333: tcp 31
01:24:13.012438 IP tom-Latitude-3570.46284 > static-87-75-105-186.vodafonexdsl.co.uk.8333: tcp 685
01:24:13.056004 IP static-87-75-105-186.vodafonexdsl.co.uk.8333 > tom-Latitude-3570.46284: tcp 0
01:24:13.074621 IP 81.198.101.144.8333 > tom-Latitude-3570.60988: tcp 0
01:24:13.075251 IP static-87-75-105-186.vodafonexdsl.co.uk.8333 > tom-Latitude-3570.46284: tcp 0
01:24:13.747571 IP tom-Latitude-3570.49070 > c-185-45-236-223.customer.ggaweb.ch.8333: tcp 24
01:24:13.748348 IP tom-Latitude-3570.49070 > c-185-45-236-223.customer.ggaweb.ch.8333: tcp 145
01:24:13.795089 IP c-185-45-236-223.customer.ggaweb.ch.8333 > tom-Latitude-3570.49070: tcp 0
01:24:13.803095 IP c-185-45-236-223.customer.ggaweb.ch.8333 > tom-Latitude-3570.49070: tcp 0
01:24:14.449072 IP tom-Latitude-3570.57976 > 167.99.216.145.8333: tcp 24
01:24:14.449910 IP tom-Latitude-3570.57976 > 167.99.216.145.8333: tcp 145
01:24:14.505916 IP 167.99.216.145.8333 > tom-Latitude-3570.57976: tcp 0
01:24:14.513926 IP 167.99.216.145.8333 > tom-Latitude-3570.57976: tcp 0
01:24:14.549477 IP tom-Latitude-3570.56714 > ns3113832.ip-54-38-177.eu.8333: tcp 24
01:24:14.550419 IP tom-Latitude-3570.56714 > ns3113832.ip-54-38-177.eu.8333: tcp 145
01:24:14.576220 IP ns3113832.ip-54-38-177.eu.8333 > tom-Latitude-3570.56714: tcp 0
01:24:14.583481 IP ns3113832.ip-54-38-177.eu.8333 > tom-Latitude-3570.56714: tcp 0
01:24:14.960093 IP bb42-60-217-183.singnet.com.sg.8333 > tom-Latitude-3570.60470: tcp 24
01:24:14.960836 IP bb42-60-217-183.singnet.com.sg.8333 > tom-Latitude-3570.60470: tcp 253
01:24:14.960856 IP tom-Latitude-3570.60470 > bb42-60-217-183.singnet.com.sg.8333: tcp 0
01:24:14.961026 IP tom-Latitude-3570.60470 > bb42-60-217-183.singnet.com.sg.8333: tcp 24
01:24:14.962293 IP tom-Latitude-3570.60470 > bb42-60-217-183.singnet.com.sg.8333: tcp 109
01:24:14.994306 IP bb42-60-217-183.singnet.com.sg.8333 > tom-Latitude-3570.60470: tcp 0
01:24:14.994312 IP bb42-60-217-183.singnet.com.sg.8333 > tom-Latitude-3570.60470: tcp 0
01:24:15.462377 IP tom-Latitude-3570.39110 > vmi195435.contaboserver.net.8333: tcp 24
01:24:15.509601 IP tom-Latitude-3570.39110 > vmi195435.contaboserver.net.8333: tcp 145
01:24:15.553704 IP bb42-60-217-183.singnet.com.sg.8333 > tom-Latitude-3570.60470: tcp 24
01:24:15.554800 IP bb42-60-217-183.singnet.com.sg.8333 > tom-Latitude-3570.60470: tcp 414
01:24:15.554818 IP bb42-60-217-183.singnet.com.sg.8333 > tom-Latitude-3570.60470: tcp 24
01:24:15.554820 IP bb42-60-217-183.singnet.com.sg.8333 > tom-Latitude-3570.60470: tcp 252
01:24:15.554823 IP bb42-60-217-183.singnet.com.sg.8333 > tom-Latitude-3570.60470: tcp 24
01:24:15.554825 IP bb42-60-217-183.singnet.com.sg.8333 > tom-Latitude-3570.60470: tcp 781
01:24:15.554828 IP bb42-60-217-183.singnet.com.sg.8333 > tom-Latitude-3570.60470: tcp 781
01:24:15.554856 IP tom-Latitude-3570.60470 > bb42-60-217-183.singnet.com.sg.8333: tcp 0
01:24:15.556433 IP vmi195435.contaboserver.net.8333 > tom-Latitude-3570.39110: tcp 0
01:24:15.563616 IP vmi195435.contaboserver.net.8333 > tom-Latitude-3570.39110: tcp 0
01:24:15.861271 IP tom-Latitude-3570.42516 > 2.56.9.15.8333: tcp 24
01:24:15.862210 IP tom-Latitude-3570.42516 > 2.56.9.15.8333: tcp 109
01:24:15.879303 IP 167.99.216.145.8333 > tom-Latitude-3570.57976: tcp 24
01:24:15.879327 IP tom-Latitude-3570.57976 > 167.99.216.145.8333: tcp 0
01:24:15.879900 IP 167.99.216.145.8333 > tom-Latitude-3570.57976: tcp 217
01:24:15.879924 IP tom-Latitude-3570.57976 > 167.99.216.145.8333: tcp 0
01:24:15.880237 IP tom-Latitude-3570.57976 > 167.99.216.145.8333: tcp 24
01:24:15.881143 IP tom-Latitude-3570.57976 > 167.99.216.145.8333: tcp 109
01:24:15.903609 IP 2.56.9.15.8333 > tom-Latitude-3570.42516: tcp 0
01:24:15.911542 IP 167.99.216.145.8333 > tom-Latitude-3570.57976: tcp 0
01:24:15.923744 IP 167.99.216.145.8333 > tom-Latitude-3570.57976: tcp 0
01:24:15.974864 IP 167.99.216.145.8333 > tom-Latitude-3570.57976: tcp 24
01:24:15.975740 IP 167.99.216.145.8333 > tom-Latitude-3570.57976: tcp 367
01:24:15.975756 IP 167.99.216.145.8333 > tom-Latitude-3570.57976: tcp 24
01:24:15.975758 IP 167.99.216.145.8333 > tom-Latitude-3570.57976: tcp 225
01:24:15.975761 IP 167.99.216.145.8333 > tom-Latitude-3570.57976: tcp 24
01:24:15.975763 IP 167.99.216.145.8333 > tom-Latitude-3570.57976: tcp 223
01:24:15.975851 IP tom-Latitude-3570.57976 > 167.99.216.145.8333: tcp 0
01:24:16.080170 IP tom-Latitude-3570.42516 > 2.56.9.15.8333: tcp 24
01:24:16.081149 IP tom-Latitude-3570.42516 > 2.56.9.15.8333: tcp 109
01:24:16.180584 IP tom-Latitude-3570.60988 > 81.198.101.144.8333: tcp 24
01:24:16.215799 IP tom-Latitude-3570.42516 > 2.56.9.15.8333: tcp 109
01:24:16.281011 IP tom-Latitude-3570.56714 > ns3113832.ip-54-38-177.eu.8333: tcp 24
01:24:16.281460 IP tom-Latitude-3570.60988 > 81.198.101.144.8333: tcp 217
01:24:16.282138 IP tom-Latitude-3570.56714 > ns3113832.ip-54-38-177.eu.8333: tcp 217
01:24:16.324220 IP 2.56.9.15.8333 > tom-Latitude-3570.42516: tcp 0
01:24:16.324235 IP ns3113832.ip-54-38-177.eu.8333 > tom-Latitude-3570.56714: tcp 0
01:24:16.324239 IP 81.198.101.144.8333 > tom-Latitude-3570.60988: tcp 0
01:24:16.324242 IP ns3113832.ip-54-38-177.eu.8333 > tom-Latitude-3570.56714: tcp 0
01:24:16.367716 IP 81.198.101.144.8333 > tom-Latitude-3570.60988: tcp 24
01:24:16.368330 IP 81.198.101.144.8333 > tom-Latitude-3570.60988: tcp 217
01:24:16.368460 IP tom-Latitude-3570.60988 > 81.198.101.144.8333: tcp 0
01:24:16.575778 IP 2.56.9.15.8333 > tom-Latitude-3570.42516: tcp 24
01:24:16.576448 IP 2.56.9.15.8333 > tom-Latitude-3570.42516: tcp 37
01:24:16.576576 IP tom-Latitude-3570.42516 > 2.56.9.15.8333: tcp 0
01:24:16.576757 IP tom-Latitude-3570.42516 > 2.56.9.15.8333: tcp 24
01:24:16.578125 IP tom-Latitude-3570.42516 > 2.56.9.15.8333: tcp 37
01:24:16.614394 IP 2.56.9.15.8333 > tom-Latitude-3570.42516: tcp 0
01:24:16.614405 IP 2.56.9.15.8333 > tom-Latitude-3570.42516: tcp 0
01:24:16.713277 IP 2.56.9.15.8333 > tom-Latitude-3570.42516: tcp 24
01:24:16.713296 IP 2.56.9.15.8333 > tom-Latitude-3570.42516: tcp 439
01:24:16.713393 IP tom-Latitude-3570.42516 > 2.56.9.15.8333: tcp 0
01:24:17.015018 IP tom-Latitude-3570.39110 > vmi195435.contaboserver.net.8333: tcp 24
01:24:17.016015 IP tom-Latitude-3570.39110 > vmi195435.contaboserver.net.8333: tcp 253
01:24:17.075187 IP vmi195435.contaboserver.net.8333 > tom-Latitude-3570.39110: tcp 0
01:24:17.083881 IP vmi195435.contaboserver.net.8333 > tom-Latitude-3570.39110: tcp 0
01:24:17.416409 IP tom-Latitude-3570.60988 > 81.198.101.144.8333: tcp 24
01:24:17.417344 IP tom-Latitude-3570.60988 > 81.198.101.144.8333: tcp 37
01:24:17.472778 IP 81.198.101.144.8333 > tom-Latitude-3570.60988: tcp 0
01:24:17.717343 IP tom-Latitude-3570.60470 > bb42-60-217-183.singnet.com.sg.8333: tcp 24
01:24:17.718293 IP tom-Latitude-3570.60470 > bb42-60-217-183.singnet.com.sg.8333: tcp 145
01:24:17.745347 IP bb42-60-217-183.singnet.com.sg.8333 > tom-Latitude-3570.60470: tcp 0
01:24:17.753078 IP bb42-60-217-183.singnet.com.sg.8333 > tom-Latitude-3570.60470: tcp 0
01:24:17.810852 IP c-185-45-236-223.customer.ggaweb.ch.8333 > tom-Latitude-3570.49070: tcp 24
01:24:17.814150 IP c-185-45-236-223.customer.ggaweb.ch.8333 > tom-Latitude-3570.49070: tcp 289
01:24:17.814280 IP tom-Latitude-3570.49070 > c-185-45-236-223.customer.ggaweb.ch.8333: tcp 0
01:24:17.814502 IP tom-Latitude-3570.49070 > c-185-45-236-223.customer.ggaweb.ch.8333: tcp 24
01:24:17.815865 IP tom-Latitude-3570.49070 > c-185-45-236-223.customer.ggaweb.ch.8333: tcp 37
01:24:17.844110 IP c-185-45-236-223.customer.ggaweb.ch.8333 > tom-Latitude-3570.49070: tcp 0
01:24:17.844740 IP c-185-45-236-223.customer.ggaweb.ch.8333 > tom-Latitude-3570.49070: tcp 0
01:24:17.872993 IP bb42-60-217-183.singnet.com.sg.8333 > tom-Latitude-3570.60470: tcp 24
01:24:17.873011 IP tom-Latitude-3570.60470 > bb42-60-217-183.singnet.com.sg.8333: tcp 0
01:24:17.873608 IP bb42-60-217-183.singnet.com.sg.8333 > tom-Latitude-3570.60470: tcp 145
01:24:17.873632 IP tom-Latitude-3570.60470 > bb42-60-217-183.singnet.com.sg.8333: tcp 0
01:24:17.925523 IP c-185-45-236-223.customer.ggaweb.ch.8333 > tom-Latitude-3570.49070: tcp 24
01:24:17.926125 IP c-185-45-236-223.customer.ggaweb.ch.8333 > tom-Latitude-3570.49070: tcp 224
01:24:17.926254 IP tom-Latitude-3570.49070 > c-185-45-236-223.customer.ggaweb.ch.8333: tcp 0
01:24:18.026958 IP tom-Latitude-3570.39110 > vmi195435.contaboserver.net.8333: tcp 24
01:24:18.065275 IP tom-Latitude-3570.39110 > vmi195435.contaboserver.net.8333: tcp 37
01:24:18.095807 IP vmi195435.contaboserver.net.8333 > tom-Latitude-3570.39110: tcp 0
01:24:18.103388 IP vmi195435.contaboserver.net.8333 > tom-Latitude-3570.39110: tcp 0
01:24:18.125324 IP 167.99.216.145.8333 > tom-Latitude-3570.57976: tcp 24
01:24:18.125374 IP 167.99.216.145.8333 > tom-Latitude-3570.57976: tcp 37
01:24:18.125490 IP tom-Latitude-3570.57976 > 167.99.216.145.8333: tcp 0
01:24:18.410561 IP 167.99.216.145.8333 > tom-Latitude-3570.57976: tcp 24
01:24:18.410578 IP 167.99.216.145.8333 > tom-Latitude-3570.57976: tcp 37
01:24:18.410582 IP ns3113832.ip-54-38-177.eu.8333 > tom-Latitude-3570.56714: tcp 24
01:24:18.410610 IP tom-Latitude-3570.56714 > ns3113832.ip-54-38-177.eu.8333: tcp 0
01:24:18.410624 IP ns3113832.ip-54-38-177.eu.8333 > tom-Latitude-3570.56714: tcp 73
01:24:18.410640 IP tom-Latitude-3570.56714 > ns3113832.ip-54-38-177.eu.8333: tcp 0
01:24:18.410692 IP tom-Latitude-3570.57976 > 167.99.216.145.8333: tcp 0
01:24:18.800942 IP bb42-60-217-183.singnet.com.sg.8333 > tom-Latitude-3570.60470: tcp 24
01:24:18.800966 IP tom-Latitude-3570.60470 > bb42-60-217-183.singnet.com.sg.8333: tcp 0
01:24:18.801545 IP bb42-60-217-183.singnet.com.sg.8333 > tom-Latitude-3570.60470: tcp 61
01:24:18.801562 IP tom-Latitude-3570.60470 > bb42-60-217-183.singnet.com.sg.8333: tcp 0
01:24:18.838069 IP 81.198.101.144.8333 > tom-Latitude-3570.60988: tcp 24
01:24:18.838697 IP 81.198.101.144.8333 > tom-Latitude-3570.60988: tcp 37
01:24:18.838824 IP tom-Latitude-3570.60988 > 81.198.101.144.8333: tcp 0
01:24:18.838974 IP tom-Latitude-3570.42516 > 2.56.9.15.8333: tcp 24
01:24:18.840420 IP tom-Latitude-3570.42516 > 2.56.9.15.8333: tcp 37
01:24:18.873666 IP 2.56.9.15.8333 > tom-Latitude-3570.42516: tcp 0
01:24:18.876002 IP 2.56.9.15.8333 > tom-Latitude-3570.42516: tcp 0
01:24:18.974710 IP 2.56.9.15.8333 > tom-Latitude-3570.42516: tcp 24
01:24:18.975901 IP 2.56.9.15.8333 > tom-Latitude-3570.42516: tcp 37
01:24:18.976030 IP tom-Latitude-3570.42516 > 2.56.9.15.8333: tcp 0
01:24:18.976165 IP tom-Latitude-3570.42516 > 2.56.9.15.8333: tcp 24
01:24:18.977651 IP tom-Latitude-3570.42516 > 2.56.9.15.8333: tcp 37
01:24:19.013604 IP 2.56.9.15.8333 > tom-Latitude-3570.42516: tcp 0
01:24:19.014235 IP 2.56.9.15.8333 > tom-Latitude-3570.42516: tcp 0
01:24:19.109794 IP 2.56.9.15.8333 > tom-Latitude-3570.42516: tcp 24
01:24:19.118686 IP 2.56.9.15.8333 > tom-Latitude-3570.42516: tcp 634
01:24:19.118800 IP tom-Latitude-3570.42516 > 2.56.9.15.8333: tcp 0
01:24:19.119222 IP static-87-75-105-186.vodafonexdsl.co.uk.8333 > tom-Latitude-3570.46284: tcp 24
01:24:19.119248 IP tom-Latitude-3570.46284 > static-87-75-105-186.vodafonexdsl.co.uk.8333: tcp 0
01:24:19.126555 IP static-87-75-105-186.vodafonexdsl.co.uk.8333 > tom-Latitude-3570.46284: tcp 289
01:24:19.126574 IP tom-Latitude-3570.46284 > static-87-75-105-186.vodafonexdsl.co.uk.8333: tcp 0
01:24:19.327508 IP tom-Latitude-3570.57976 > 167.99.216.145.8333: tcp 24
01:24:19.337921 IP tom-Latitude-3570.57976 > 167.99.216.145.8333: tcp 37
01:24:19.368325 IP 167.99.216.145.8333 > tom-Latitude-3570.57976: tcp 0
01:24:19.375583 IP 167.99.216.145.8333 > tom-Latitude-3570.57976: tcp 0
01:24:19.628399 IP tom-Latitude-3570.60988 > 81.198.101.144.8333: tcp 24
01:24:19.628439 IP tom-Latitude-3570.56714 > ns3113832.ip-54-38-177.eu.8333: tcp 24
01:24:19.629259 IP tom-Latitude-3570.56714 > ns3113832.ip-54-38-177.eu.8333: tcp 37
01:24:19.629266 IP tom-Latitude-3570.60988 > 81.198.101.144.8333: tcp 37
01:24:19.682613 IP ns3113832.ip-54-38-177.eu.8333 > tom-Latitude-3570.56714: tcp 0
01:24:19.682628 IP ns3113832.ip-54-38-177.eu.8333 > tom-Latitude-3570.56714: tcp 0
01:24:19.682630 IP 81.198.101.144.8333 > tom-Latitude-3570.60988: tcp 0
01:24:20.129861 IP tom-Latitude-3570.49070 > c-185-45-236-223.customer.ggaweb.ch.8333: tcp 24
01:24:20.129929 IP tom-Latitude-3570.46284 > static-87-75-105-186.vodafonexdsl.co.uk.8333: tcp 24
01:24:20.130871 IP tom-Latitude-3570.46284 > static-87-75-105-186.vodafonexdsl.co.uk.8333: tcp 37
01:24:20.130882 IP tom-Latitude-3570.49070 > c-185-45-236-223.customer.ggaweb.ch.8333: tcp 37
01:24:20.187302 IP c-185-45-236-223.customer.ggaweb.ch.8333 > tom-Latitude-3570.49070: tcp 0
01:24:20.194808 IP static-87-75-105-186.vodafonexdsl.co.uk.8333 > tom-Latitude-3570.46284: tcp 0
01:24:20.194821 IP static-87-75-105-186.vodafonexdsl.co.uk.8333 > tom-Latitude-3570.46284: tcp 0
01:24:20.194824 IP c-185-45-236-223.customer.ggaweb.ch.8333 > tom-Latitude-3570.49070: tcp 0
01:24:20.227968 IP 167.99.216.145.8333 > tom-Latitude-3570.57976: tcp 24
01:24:20.228525 IP 167.99.216.145.8333 > tom-Latitude-3570.57976: tcp 145
01:24:20.228604 IP tom-Latitude-3570.57976 > 167.99.216.145.8333: tcp 0
01:24:20.228852 IP tom-Latitude-3570.57976 > 167.99.216.145.8333: tcp 24
01:24:20.230017 IP tom-Latitude-3570.57976 > 167.99.216.145.8333: tcp 145
01:24:20.248969 IP static-87-75-105-186.vodafonexdsl.co.uk.8333 > tom-Latitude-3570.46284: tcp 24
01:24:20.248986 IP tom-Latitude-3570.46284 > static-87-75-105-186.vodafonexdsl.co.uk.8333: tcp 0
01:24:20.255741 IP static-87-75-105-186.vodafonexdsl.co.uk.8333 > tom-Latitude-3570.46284: tcp 181
01:24:20.255765 IP tom-Latitude-3570.46284 > static-87-75-105-186.vodafonexdsl.co.uk.8333: tcp 0
01:24:20.263158 IP 167.99.216.145.8333 > tom-Latitude-3570.57976: tcp 0
01:24:20.263816 IP 167.99.216.145.8333 > tom-Latitude-3570.57976: tcp 0
01:24:20.327709 IP 167.99.216.145.8333 > tom-Latitude-3570.57976: tcp 24
01:24:20.327728 IP 167.99.216.145.8333 > tom-Latitude-3570.57976: tcp 701
01:24:20.327732 IP 167.99.216.145.8333 > tom-Latitude-3570.57976: tcp 24
01:24:20.327734 IP 167.99.216.145.8333 > tom-Latitude-3570.57976: tcp 248
01:24:20.327736 IP 167.99.216.145.8333 > tom-Latitude-3570.57976: tcp 24
01:24:20.327823 IP tom-Latitude-3570.57976 > 167.99.216.145.8333: tcp 0
01:24:20.329697 IP 167.99.216.145.8333 > tom-Latitude-3570.57976: tcp 1448
01:24:20.329711 IP 167.99.216.145.8333 > tom-Latitude-3570.57976: tcp 1222
01:24:20.329713 IP 167.99.216.145.8333 > tom-Latitude-3570.57976: tcp 24
01:24:20.329716 IP 167.99.216.145.8333 > tom-Latitude-3570.57976: tcp 439
01:24:20.329798 IP tom-Latitude-3570.57976 > 167.99.216.145.8333: tcp 0
01:24:20.686246 IP c-185-45-236-223.customer.ggaweb.ch.8333 > tom-Latitude-3570.49070: tcp 24
01:24:20.686709 IP c-185-45-236-223.customer.ggaweb.ch.8333 > tom-Latitude-3570.49070: tcp 181
01:24:20.686805 IP tom-Latitude-3570.49070 > c-185-45-236-223.customer.ggaweb.ch.8333: tcp 0
01:24:20.687026 IP tom-Latitude-3570.49070 > c-185-45-236-223.customer.ggaweb.ch.8333: tcp 24
01:24:20.688367 IP tom-Latitude-3570.49070 > c-185-45-236-223.customer.ggaweb.ch.8333: tcp 37
01:24:20.723124 IP c-185-45-236-223.customer.ggaweb.ch.8333 > tom-Latitude-3570.49070: tcp 0
01:24:20.736101 IP c-185-45-236-223.customer.ggaweb.ch.8333 > tom-Latitude-3570.49070: tcp 0
01:24:20.809026 IP c-185-45-236-223.customer.ggaweb.ch.8333 > tom-Latitude-3570.49070: tcp 24
01:24:20.809045 IP c-185-45-236-223.customer.ggaweb.ch.8333 > tom-Latitude-3570.49070: tcp 247
01:24:20.809136 IP tom-Latitude-3570.49070 > c-185-45-236-223.customer.ggaweb.ch.8333: tcp 0
01:24:20.909872 IP tom-Latitude-3570.60988 > 81.198.101.144.8333: tcp 24
01:24:20.909924 IP tom-Latitude-3570.56714 > ns3113832.ip-54-38-177.eu.8333: tcp 24
01:24:20.910844 IP tom-Latitude-3570.56714 > ns3113832.ip-54-38-177.eu.8333: tcp 181
01:24:20.910856 IP tom-Latitude-3570.60988 > 81.198.101.144.8333: tcp 181
01:24:20.951482 IP ns3113832.ip-54-38-177.eu.8333 > tom-Latitude-3570.56714: tcp 0
01:24:20.952153 IP ns3113832.ip-54-38-177.eu.8333 > tom-Latitude-3570.56714: tcp 0
01:24:20.952166 IP 81.198.101.144.8333 > tom-Latitude-3570.60988: tcp 0
01:24:21.110688 IP tom-Latitude-3570.42516 > 2.56.9.15.8333: tcp 24
01:24:21.111636 IP tom-Latitude-3570.42516 > 2.56.9.15.8333: tcp 31
01:24:21.135481 IP 2.56.9.15.8333 > tom-Latitude-3570.42516: tcp 0
01:24:21.144436 IP 2.56.9.15.8333 > tom-Latitude-3570.42516: tcp 0
01:24:21.163544 IP c-185-45-236-223.customer.ggaweb.ch.8333 > tom-Latitude-3570.49070: tcp 24
01:24:21.164165 IP c-185-45-236-223.customer.ggaweb.ch.8333 > tom-Latitude-3570.49070: tcp 73
01:24:21.164295 IP tom-Latitude-3570.49070 > c-185-45-236-223.customer.ggaweb.ch.8333: tcp 0
01:24:21.164484 IP tom-Latitude-3570.49070 > c-185-45-236-223.customer.ggaweb.ch.8333: tcp 24
01:24:21.165825 IP tom-Latitude-3570.49070 > c-185-45-236-223.customer.ggaweb.ch.8333: tcp 73
01:24:21.211634 IP c-185-45-236-223.customer.ggaweb.ch.8333 > tom-Latitude-3570.49070: tcp 0
01:24:21.216669 IP c-185-45-236-223.customer.ggaweb.ch.8333 > tom-Latitude-3570.49070: tcp 0
01:24:21.286494 IP c-185-45-236-223.customer.ggaweb.ch.8333 > tom-Latitude-3570.49070: tcp 24
01:24:21.287198 IP c-185-45-236-223.customer.ggaweb.ch.8333 > tom-Latitude-3570.49070: tcp 882
01:24:21.287267 IP tom-Latitude-3570.49070 > c-185-45-236-223.customer.ggaweb.ch.8333: tcp 0
01:24:21.388647 IP tom-Latitude-3570.60470 > bb42-60-217-183.singnet.com.sg.8333: tcp 24
01:24:21.388695 IP tom-Latitude-3570.46284 > static-87-75-105-186.vodafonexdsl.co.uk.8333: tcp 24
01:24:21.389614 IP tom-Latitude-3570.46284 > static-87-75-105-186.vodafonexdsl.co.uk.8333: tcp 109
01:24:21.389625 IP tom-Latitude-3570.60470 > bb42-60-217-183.singnet.com.sg.8333: tcp 325
01:24:21.423990 IP static-87-75-105-186.vodafonexdsl.co.uk.8333 > tom-Latitude-3570.46284: tcp 0
01:24:21.431598 IP static-87-75-105-186.vodafonexdsl.co.uk.8333 > tom-Latitude-3570.46284: tcp 0
01:24:21.432187 IP bb42-60-217-183.singnet.com.sg.8333 > tom-Latitude-3570.60470: tcp 0
01:24:21.432203 IP bb42-60-217-183.singnet.com.sg.8333 > tom-Latitude-3570.60470: tcp 0
01:24:21.513216 IP 81.198.101.144.8333 > tom-Latitude-3570.60988: tcp 24
01:24:21.514462 IP 81.198.101.144.8333 > tom-Latitude-3570.60988: tcp 73
01:24:21.514487 IP tom-Latitude-3570.60988 > 81.198.101.144.8333: tcp 0
01:24:22.639918 IP ns3113832.ip-54-38-177.eu.8333 > tom-Latitude-3570.56714: tcp 24
01:24:22.639943 IP tom-Latitude-3570.56714 > ns3113832.ip-54-38-177.eu.8333: tcp 0
01:24:22.647728 IP ns3113832.ip-54-38-177.eu.8333 > tom-Latitude-3570.56714: tcp 181
01:24:22.647753 IP tom-Latitude-3570.56714 > ns3113832.ip-54-38-177.eu.8333: tcp 0
01:24:22.647933 IP tom-Latitude-3570.56714 > ns3113832.ip-54-38-177.eu.8333: tcp 24
01:24:22.648914 IP tom-Latitude-3570.56714 > ns3113832.ip-54-38-177.eu.8333: tcp 109
01:24:22.657152 IP ns3113832.ip-54-38-177.eu.8333 > tom-Latitude-3570.56714: tcp 181
01:24:22.657158 IP tom-Latitude-3570.56714 > ns3113832.ip-54-38-177.eu.8333: tcp 0
01:24:22.691547 IP ns3113832.ip-54-38-177.eu.8333 > tom-Latitude-3570.56714: tcp 0
01:24:22.692185 IP ns3113832.ip-54-38-177.eu.8333 > tom-Latitude-3570.56714: tcp 0
01:24:22.807572 IP ns3113832.ip-54-38-177.eu.8333 > tom-Latitude-3570.56714: tcp 1350
01:24:22.807589 IP tom-Latitude-3570.56714 > ns3113832.ip-54-38-177.eu.8333: tcp 0
01:24:22.810104 IP ns3113832.ip-54-38-177.eu.8333 > tom-Latitude-3570.56714: tcp 1350
01:24:22.810124 IP tom-Latitude-3570.56714 > ns3113832.ip-54-38-177.eu.8333: tcp 0
01:24:22.810134 IP ns3113832.ip-54-38-177.eu.8333 > tom-Latitude-3570.56714: tcp 1350
01:24:22.810136 IP tom-Latitude-3570.56714 > ns3113832.ip-54-38-177.eu.8333: tcp 0
01:24:22.810140 IP ns3113832.ip-54-38-177.eu.8333 > tom-Latitude-3570.56714: tcp 1350
01:24:22.810142 IP tom-Latitude-3570.56714 > ns3113832.ip-54-38-177.eu.8333: tcp 0
01:24:22.810144 IP ns3113832.ip-54-38-177.eu.8333 > tom-Latitude-3570.56714: tcp 1350
01:24:22.810145 IP tom-Latitude-3570.56714 > ns3113832.ip-54-38-177.eu.8333: tcp 0
01:24:22.810148 IP ns3113832.ip-54-38-177.eu.8333 > tom-Latitude-3570.56714: tcp 1350
01:24:22.810150 IP tom-Latitude-3570.56714 > ns3113832.ip-54-38-177.eu.8333: tcp 0
01:24:22.810152 IP ns3113832.ip-54-38-177.eu.8333 > tom-Latitude-3570.56714: tcp 1350
01:24:22.810153 IP tom-Latitude-3570.56714 > ns3113832.ip-54-38-177.eu.8333: tcp 0
01:24:22.810155 IP ns3113832.ip-54-38-177.eu.8333 > tom-Latitude-3570.56714: tcp 141
01:24:22.810157 IP tom-Latitude-3570.56714 > ns3113832.ip-54-38-177.eu.8333: tcp 0
01:24:22.846668 IP ns3113832.ip-54-38-177.eu.8333 > tom-Latitude-3570.56714: tcp 1374
01:24:22.846696 IP tom-Latitude-3570.56714 > ns3113832.ip-54-38-177.eu.8333: tcp 0
01:24:22.846712 IP ns3113832.ip-54-38-177.eu.8333 > tom-Latitude-3570.56714: tcp 1350
01:24:22.846716 IP tom-Latitude-3570.56714 > ns3113832.ip-54-38-177.eu.8333: tcp 0
01:24:22.846721 IP ns3113832.ip-54-38-177.eu.8333 > tom-Latitude-3570.56714: tcp 1350
01:24:22.846724 IP tom-Latitude-3570.56714 > ns3113832.ip-54-38-177.eu.8333: tcp 0
01:24:22.846727 IP ns3113832.ip-54-38-177.eu.8333 > tom-Latitude-3570.56714: tcp 1350
01:24:22.846736 IP tom-Latitude-3570.56714 > ns3113832.ip-54-38-177.eu.8333: tcp 0
01:24:22.846737 IP ns3113832.ip-54-38-177.eu.8333 > tom-Latitude-3570.56714: tcp 1350
01:24:22.846739 IP ns3113832.ip-54-38-177.eu.8333 > tom-Latitude-3570.56714: tcp 1350
01:24:22.846742 IP tom-Latitude-3570.56714 > ns3113832.ip-54-38-177.eu.8333: tcp 0
01:24:22.846743 IP ns3113832.ip-54-38-177.eu.8333 > tom-Latitude-3570.56714: tcp 1350
01:24:22.846746 IP tom-Latitude-3570.56714 > ns3113832.ip-54-38-177.eu.8333: tcp 0
01:24:22.846768 IP tom-Latitude-3570.56714 > ns3113832.ip-54-38-177.eu.8333: tcp 0
01:24:22.858357 IP tom-Latitude-3570.57976 > 167.99.216.145.8333: tcp 24
01:24:22.858404 IP tom-Latitude-3570.60470 > bb42-60-217-183.singnet.com.sg.8333: tcp 24
01:24:22.859678 IP tom-Latitude-3570.60470 > bb42-60-217-183.singnet.com.sg.8333: tcp 37
01:24:22.859683 IP tom-Latitude-3570.57976 > 167.99.216.145.8333: tcp 145
01:24:22.886681 IP 167.99.216.145.8333 > tom-Latitude-3570.57976: tcp 0
01:24:22.886695 IP bb42-60-217-183.singnet.com.sg.8333 > tom-Latitude-3570.60470: tcp 0
01:24:22.891498 IP bb42-60-217-183.singnet.com.sg.8333 > tom-Latitude-3570.60470: tcp 0
01:24:22.891936 IP 167.99.216.145.8333 > tom-Latitude-3570.57976: tcp 0
01:24:22.962776 IP tom-Latitude-3570.49070 > c-185-45-236-223.customer.ggaweb.ch.8333: tcp 24
01:24:22.963720 IP tom-Latitude-3570.49070 > c-185-45-236-223.customer.ggaweb.ch.8333: tcp 109
01:24:22.995422 IP c-185-45-236-223.customer.ggaweb.ch.8333 > tom-Latitude-3570.49070: tcp 0
01:24:23.003583 IP c-185-45-236-223.customer.ggaweb.ch.8333 > tom-Latitude-3570.49070: tcp 0
01:24:23.063107 IP tom-Latitude-3570.60988 > 81.198.101.144.8333: tcp 24
01:24:23.063161 IP tom-Latitude-3570.57976 > 167.99.216.145.8333: tcp 24
01:24:23.064078 IP tom-Latitude-3570.57976 > 167.99.216.145.8333: tcp 73
01:24:23.064090 IP tom-Latitude-3570.60988 > 81.198.101.144.8333: tcp 31
01:24:23.095566 IP 167.99.216.145.8333 > tom-Latitude-3570.57976: tcp 0
01:24:23.104031 IP 81.198.101.144.8333 > tom-Latitude-3570.60988: tcp 0
01:24:23.104524 IP 167.99.216.145.8333 > tom-Latitude-3570.57976: tcp 0
01:24:23.163449 IP tom-Latitude-3570.60470 > bb42-60-217-183.singnet.com.sg.8333: tcp 24
01:24:23.180420 IP tom-Latitude-3570.60470 > bb42-60-217-183.singnet.com.sg.8333: tcp 128
01:24:23.205525 IP bb42-60-217-183.singnet.com.sg.8333 > tom-Latitude-3570.60470: tcp 0
01:24:23.213236 IP bb42-60-217-183.singnet.com.sg.8333 > tom-Latitude-3570.60470: tcp 0
01:24:23.447531 IP 167.99.216.145.8333 > tom-Latitude-3570.57976: tcp 24
01:24:23.451203 IP 167.99.216.145.8333 > tom-Latitude-3570.57976: tcp 145
01:24:23.451267 IP tom-Latitude-3570.57976 > 167.99.216.145.8333: tcp 0
01:24:23.451506 IP tom-Latitude-3570.57976 > 167.99.216.145.8333: tcp 24
01:24:23.452924 IP tom-Latitude-3570.57976 > 167.99.216.145.8333: tcp 145
01:24:23.471205 IP 81.198.101.144.8333 > tom-Latitude-3570.60988: tcp 24
01:24:23.471243 IP 81.198.101.144.8333 > tom-Latitude-3570.60988: tcp 145
01:24:23.471297 IP tom-Latitude-3570.60988 > 81.198.101.144.8333: tcp 0
01:24:23.484284 IP 167.99.216.145.8333 > tom-Latitude-3570.57976: tcp 0
01:24:23.484298 IP 167.99.216.145.8333 > tom-Latitude-3570.57976: tcp 0
01:24:23.549107 IP 167.99.216.145.8333 > tom-Latitude-3570.57976: tcp 24
01:24:23.549127 IP 167.99.216.145.8333 > tom-Latitude-3570.57976: tcp 223
01:24:23.549131 IP 167.99.216.145.8333 > tom-Latitude-3570.57976: tcp 24
01:24:23.549133 IP 167.99.216.145.8333 > tom-Latitude-3570.57976: tcp 223
01:24:23.549134 IP 167.99.216.145.8333 > tom-Latitude-3570.57976: tcp 24
01:24:23.549136 IP 167.99.216.145.8333 > tom-Latitude-3570.57976: tcp 961
01:24:23.549139 IP 167.99.216.145.8333 > tom-Latitude-3570.57976: tcp 24
01:24:23.549141 IP 167.99.216.145.8333 > tom-Latitude-3570.57976: tcp 1075
01:24:23.549230 IP tom-Latitude-3570.57976 > 167.99.216.145.8333: tcp 0
01:24:23.553296 IP tom-Latitude-3570.57976 > 167.99.216.145.8333: tcp 24
01:24:23.553967 IP tom-Latitude-3570.57976 > 167.99.216.145.8333: tcp 217
01:24:23.570519 IP static-87-75-105-186.vodafonexdsl.co.uk.8333 > tom-Latitude-3570.46284: tcp 24
01:24:23.570543 IP tom-Latitude-3570.46284 > static-87-75-105-186.vodafonexdsl.co.uk.8333: tcp 0
01:24:23.574318 IP static-87-75-105-186.vodafonexdsl.co.uk.8333 > tom-Latitude-3570.46284: tcp 181
01:24:23.574342 IP tom-Latitude-3570.46284 > static-87-75-105-186.vodafonexdsl.co.uk.8333: tcp 0
01:24:23.583481 IP 167.99.216.145.8333 > tom-Latitude-3570.57976: tcp 0
01:24:23.586444 IP 167.99.216.145.8333 > tom-Latitude-3570.57976: tcp 0
01:24:23.646410 IP 167.99.216.145.8333 > tom-Latitude-3570.57976: tcp 24
01:24:23.647089 IP 167.99.216.145.8333 > tom-Latitude-3570.57976: tcp 217
01:24:23.647202 IP tom-Latitude-3570.57976 > 167.99.216.145.8333: tcp 0
01:24:23.647382 IP tom-Latitude-3570.42516 > 2.56.9.15.8333: tcp 24
01:24:23.648730 IP tom-Latitude-3570.42516 > 2.56.9.15.8333: tcp 469
01:24:23.684679 IP 2.56.9.15.8333 > tom-Latitude-3570.42516: tcp 0
01:24:23.685238 IP 2.56.9.15.8333 > tom-Latitude-3570.42516: tcp 0
01:24:23.732147 IP bb42-60-217-183.singnet.com.sg.8333 > tom-Latitude-3570.60470: tcp 24
01:24:23.732195 IP tom-Latitude-3570.60470 > bb42-60-217-183.singnet.com.sg.8333: tcp 0
01:24:23.732730 IP bb42-60-217-183.singnet.com.sg.8333 > tom-Latitude-3570.60470: tcp 109
01:24:23.732740 IP tom-Latitude-3570.60470 > bb42-60-217-183.singnet.com.sg.8333: tcp 0
01:24:23.758543 IP vmi195435.contaboserver.net.8333 > tom-Latitude-3570.39110: tcp 24
01:24:23.759145 IP vmi195435.contaboserver.net.8333 > tom-Latitude-3570.39110: tcp 505
01:24:23.759240 IP tom-Latitude-3570.39110 > vmi195435.contaboserver.net.8333: tcp 0
01:24:23.781368 IP 2.56.9.15.8333 > tom-Latitude-3570.42516: tcp 24
01:24:23.782057 IP 2.56.9.15.8333 > tom-Latitude-3570.42516: tcp 37
01:24:23.782074 IP tom-Latitude-3570.42516 > 2.56.9.15.8333: tcp 0
01:24:23.782214 IP tom-Latitude-3570.42516 > 2.56.9.15.8333: tcp 24
01:24:23.783590 IP tom-Latitude-3570.42516 > 2.56.9.15.8333: tcp 223
01:24:23.823549 IP 2.56.9.15.8333 > tom-Latitude-3570.42516: tcp 0
01:24:23.824183 IP 2.56.9.15.8333 > tom-Latitude-3570.42516: tcp 0
01:24:24.283801 IP tom-Latitude-3570.49070 > c-185-45-236-223.customer.ggaweb.ch.8333: tcp 24
01:24:24.284849 IP tom-Latitude-3570.49070 > c-185-45-236-223.customer.ggaweb.ch.8333: tcp 109
01:24:24.335353 IP c-185-45-236-223.customer.ggaweb.ch.8333 > tom-Latitude-3570.49070: tcp 0
01:24:24.343857 IP c-185-45-236-223.customer.ggaweb.ch.8333 > tom-Latitude-3570.49070: tcp 0
01:24:24.484539 IP tom-Latitude-3570.39110 > vmi195435.contaboserver.net.8333: tcp 24
01:24:24.485531 IP tom-Latitude-3570.39110 > vmi195435.contaboserver.net.8333: tcp 37
01:24:24.515759 IP vmi195435.contaboserver.net.8333 > tom-Latitude-3570.39110: tcp 0
01:24:24.525280 IP vmi195435.contaboserver.net.8333 > tom-Latitude-3570.39110: tcp 0
01:24:25.487599 IP tom-Latitude-3570.56714 > ns3113832.ip-54-38-177.eu.8333: tcp 24
01:24:25.488563 IP tom-Latitude-3570.56714 > ns3113832.ip-54-38-177.eu.8333: tcp 109
01:24:25.534442 IP ns3113832.ip-54-38-177.eu.8333 > tom-Latitude-3570.56714: tcp 0
01:24:25.534456 IP ns3113832.ip-54-38-177.eu.8333 > tom-Latitude-3570.56714: tcp 0
01:24:25.762479 IP vmi195435.contaboserver.net.8333 > tom-Latitude-3570.39110: tcp 24
01:24:25.762499 IP vmi195435.contaboserver.net.8333 > tom-Latitude-3570.39110: tcp 145
01:24:25.762584 IP tom-Latitude-3570.39110 > vmi195435.contaboserver.net.8333: tcp 0
01:24:25.762738 IP tom-Latitude-3570.39110 > vmi195435.contaboserver.net.8333: tcp 24
01:24:25.764210 IP tom-Latitude-3570.39110 > vmi195435.contaboserver.net.8333: tcp 145
01:24:25.802407 IP vmi195435.contaboserver.net.8333 > tom-Latitude-3570.39110: tcp 0
01:24:25.809060 IP vmi195435.contaboserver.net.8333 > tom-Latitude-3570.39110: tcp 0
01:24:25.880659 IP vmi195435.contaboserver.net.8333 > tom-Latitude-3570.39110: tcp 24
01:24:25.882407 IP vmi195435.contaboserver.net.8333 > tom-Latitude-3570.39110: tcp 225
01:24:25.882425 IP vmi195435.contaboserver.net.8333 > tom-Latitude-3570.39110: tcp 24
01:24:25.882429 IP vmi195435.contaboserver.net.8333 > tom-Latitude-3570.39110: tcp 192
01:24:25.882431 IP vmi195435.contaboserver.net.8333 > tom-Latitude-3570.39110: tcp 24
01:24:25.882433 IP vmi195435.contaboserver.net.8333 > tom-Latitude-3570.39110: tcp 225
01:24:25.882435 IP vmi195435.contaboserver.net.8333 > tom-Latitude-3570.39110: tcp 24
01:24:25.882455 IP vmi195435.contaboserver.net.8333 > tom-Latitude-3570.39110: tcp 224
01:24:25.882517 IP tom-Latitude-3570.39110 > vmi195435.contaboserver.net.8333: tcp 0
01:24:25.985860 IP tom-Latitude-3570.57976 > 167.99.216.145.8333: tcp 24
01:24:25.986799 IP tom-Latitude-3570.57976 > 167.99.216.145.8333: tcp 145
01:24:26.071726 IP tom-Latitude-3570.57976 > 167.99.216.145.8333: tcp 145
01:24:26.086288 IP tom-Latitude-3570.60988 > 81.198.101.144.8333: tcp 24
01:24:26.086336 IP tom-Latitude-3570.56714 > ns3113832.ip-54-38-177.eu.8333: tcp 24
01:24:26.186763 IP tom-Latitude-3570.46284 > static-87-75-105-186.vodafonexdsl.co.uk.8333: tcp 24
01:24:26.197524 IP 167.99.216.145.8333 > tom-Latitude-3570.57976: tcp 0
01:24:26.197538 IP 167.99.216.145.8333 > tom-Latitude-3570.57976: tcp 0
01:24:26.197540 IP ns3113832.ip-54-38-177.eu.8333 > tom-Latitude-3570.56714: tcp 24
01:24:26.197558 IP tom-Latitude-3570.56714 > ns3113832.ip-54-38-177.eu.8333: tcp 145
01:24:26.197589 IP ns3113832.ip-54-38-177.eu.8333 > tom-Latitude-3570.56714: tcp 217
01:24:26.202301 IP tom-Latitude-3570.46284 > static-87-75-105-186.vodafonexdsl.co.uk.8333: tcp 217
01:24:26.202309 IP tom-Latitude-3570.56714 > ns3113832.ip-54-38-177.eu.8333: tcp 61
01:24:26.202311 IP tom-Latitude-3570.60988 > 81.198.101.144.8333: tcp 217
01:24:26.244084 IP 167.99.216.145.8333 > tom-Latitude-3570.57976: tcp 0
01:24:26.244758 IP ns3113832.ip-54-38-177.eu.8333 > tom-Latitude-3570.56714: tcp 0
01:24:26.244773 IP static-87-75-105-186.vodafonexdsl.co.uk.8333 > tom-Latitude-3570.46284: tcp 0
01:24:26.244776 IP ns3113832.ip-54-38-177.eu.8333 > tom-Latitude-3570.56714: tcp 0
01:24:26.248911 IP static-87-75-105-186.vodafonexdsl.co.uk.8333 > tom-Latitude-3570.46284: tcp 0
01:24:26.248925 IP ns3113832.ip-54-38-177.eu.8333 > tom-Latitude-3570.56714: tcp 0
01:24:26.248928 IP 81.198.101.144.8333 > tom-Latitude-3570.60988: tcp 0
01:24:26.298143 IP tom-Latitude-3570.39110 > vmi195435.contaboserver.net.8333: tcp 24
01:24:26.299085 IP tom-Latitude-3570.39110 > vmi195435.contaboserver.net.8333: tcp 61
