08:26:07.107241 IP tom-Latitude-3570.56714 > ns3113832.ip-54-38-177.eu.8333: tcp 24
08:26:07.110500 IP tom-Latitude-3570.56714 > ns3113832.ip-54-38-177.eu.8333: tcp 757
08:26:07.161215 IP ns3113832.ip-54-38-177.eu.8333 > tom-Latitude-3570.56714: tcp 0
08:26:07.176661 IP ns3113832.ip-54-38-177.eu.8333 > tom-Latitude-3570.56714: tcp 0
08:26:07.308005 IP tom-Latitude-3570.60470 > bb42-60-217-183.singnet.com.sg.8333: tcp 24
08:26:07.310290 IP tom-Latitude-3570.60470 > bb42-60-217-183.singnet.com.sg.8333: tcp 253
08:26:07.341288 IP bb42-60-217-183.singnet.com.sg.8333 > tom-Latitude-3570.60470: tcp 0
08:26:07.348037 IP bb42-60-217-183.singnet.com.sg.8333 > tom-Latitude-3570.60470: tcp 0
08:26:07.967761 IP c-185-45-236-223.customer.ggaweb.ch.8333 > tom-Latitude-3570.49070: tcp 24
08:26:07.967787 IP tom-Latitude-3570.49070 > c-185-45-236-223.customer.ggaweb.ch.8333: tcp 0
08:26:07.967806 IP c-185-45-236-223.customer.ggaweb.ch.8333 > tom-Latitude-3570.49070: tcp 865
08:26:07.967811 IP tom-Latitude-3570.49070 > c-185-45-236-223.customer.ggaweb.ch.8333: tcp 0
08:26:07.968222 IP tom-Latitude-3570.49070 > c-185-45-236-223.customer.ggaweb.ch.8333: tcp 24
08:26:07.969735 IP tom-Latitude-3570.49070 > c-185-45-236-223.customer.ggaweb.ch.8333: tcp 793
08:26:08.027682 IP c-185-45-236-223.customer.ggaweb.ch.8333 > tom-Latitude-3570.49070: tcp 0
08:26:08.043133 IP vmi195435.contaboserver.net.8333 > tom-Latitude-3570.39110: tcp 24
08:26:08.043815 IP vmi195435.contaboserver.net.8333 > tom-Latitude-3570.39110: tcp 469
08:26:08.043834 IP tom-Latitude-3570.39110 > vmi195435.contaboserver.net.8333: tcp 0
08:26:08.044094 IP tom-Latitude-3570.57976 > 167.99.216.145.8333: tcp 24
08:26:08.045200 IP tom-Latitude-3570.57976 > 167.99.216.145.8333: tcp 73
08:26:08.051461 IP c-185-45-236-223.customer.ggaweb.ch.8333 > tom-Latitude-3570.49070: tcp 0
08:26:08.086521 IP 167.99.216.145.8333 > tom-Latitude-3570.57976: tcp 0
08:26:08.087184 IP 167.99.216.145.8333 > tom-Latitude-3570.57976: tcp 0
08:26:08.134343 IP c-185-45-236-223.customer.ggaweb.ch.8333 > tom-Latitude-3570.49070: tcp 24
08:26:08.136368 IP c-185-45-236-223.customer.ggaweb.ch.8333 > tom-Latitude-3570.49070: tcp 1448
08:26:08.136386 IP c-185-45-236-223.customer.ggaweb.ch.8333 > tom-Latitude-3570.49070: tcp 365
08:26:08.136433 IP tom-Latitude-3570.49070 > c-185-45-236-223.customer.ggaweb.ch.8333: tcp 0
08:26:08.137173 IP c-185-45-236-223.customer.ggaweb.ch.8333 > tom-Latitude-3570.49070: tcp 278
08:26:08.147657 IP c-185-45-236-223.customer.ggaweb.ch.8333 > tom-Latitude-3570.49070: tcp 987
08:26:08.147708 IP tom-Latitude-3570.49070 > c-185-45-236-223.customer.ggaweb.ch.8333: tcp 0
08:26:08.149176 IP c-185-45-236-223.customer.ggaweb.ch.8333 > tom-Latitude-3570.49070: tcp 1303
08:26:08.150831 IP c-185-45-236-223.customer.ggaweb.ch.8333 > tom-Latitude-3570.49070: tcp 1382
08:26:08.150848 IP tom-Latitude-3570.49070 > c-185-45-236-223.customer.ggaweb.ch.8333: tcp 0
08:26:08.152420 IP c-185-45-236-223.customer.ggaweb.ch.8333 > tom-Latitude-3570.49070: tcp 66
08:26:08.152427 IP c-185-45-236-223.customer.ggaweb.ch.8333 > tom-Latitude-3570.49070: tcp 407
08:26:08.152437 IP tom-Latitude-3570.49070 > c-185-45-236-223.customer.ggaweb.ch.8333: tcp 0
08:26:08.152437 IP c-185-45-236-223.customer.ggaweb.ch.8333 > tom-Latitude-3570.49070: tcp 1402
08:26:08.152440 IP c-185-45-236-223.customer.ggaweb.ch.8333 > tom-Latitude-3570.49070: tcp 256
08:26:08.152457 IP tom-Latitude-3570.49070 > c-185-45-236-223.customer.ggaweb.ch.8333: tcp 0
08:26:08.355758 IP tom-Latitude-3570.42516 > 2.56.9.15.8333: tcp 24
08:26:08.357795 IP tom-Latitude-3570.42516 > 2.56.9.15.8333: tcp 793
08:26:08.398632 IP 2.56.9.15.8333 > tom-Latitude-3570.42516: tcp 0
08:26:08.408630 IP 2.56.9.15.8333 > tom-Latitude-3570.42516: tcp 0
08:26:08.456310 IP tom-Latitude-3570.46284 > static-87-75-105-186.vodafonexdsl.co.uk.8333: tcp 24
08:26:08.456331 IP tom-Latitude-3570.46284 > static-87-75-105-186.vodafonexdsl.co.uk.8333: tcp 1045
08:26:08.506640 IP static-87-75-105-186.vodafonexdsl.co.uk.8333 > tom-Latitude-3570.46284: tcp 0
08:26:08.657068 IP tom-Latitude-3570.60988 > 81.198.101.144.8333: tcp 24
08:26:08.657088 IP tom-Latitude-3570.60988 > 81.198.101.144.8333: tcp 1045
08:26:08.657191 IP tom-Latitude-3570.56714 > ns3113832.ip-54-38-177.eu.8333: tcp 24
08:26:08.660780 IP tom-Latitude-3570.56714 > ns3113832.ip-54-38-177.eu.8333: tcp 793
08:26:08.692005 IP 81.198.101.144.8333 > tom-Latitude-3570.60988: tcp 0
08:26:08.725381 IP ns3113832.ip-54-38-177.eu.8333 > tom-Latitude-3570.56714: tcp 0
08:26:08.935911 IP tom-Latitude-3570.60988 > 81.198.101.144.8333: tcp 1045
08:26:08.938612 IP c-185-45-236-223.customer.ggaweb.ch.8333 > tom-Latitude-3570.49070: tcp 24
08:26:08.938633 IP c-185-45-236-223.customer.ggaweb.ch.8333 > tom-Latitude-3570.49070: tcp 181
08:26:08.938721 IP tom-Latitude-3570.49070 > c-185-45-236-223.customer.ggaweb.ch.8333: tcp 0
08:26:08.938903 IP tom-Latitude-3570.49070 > c-185-45-236-223.customer.ggaweb.ch.8333: tcp 24
08:26:08.940234 IP tom-Latitude-3570.49070 > c-185-45-236-223.customer.ggaweb.ch.8333: tcp 181
08:26:09.004160 IP 81.198.101.144.8333 > tom-Latitude-3570.60988: tcp 0
08:26:09.004768 IP c-185-45-236-223.customer.ggaweb.ch.8333 > tom-Latitude-3570.49070: tcp 0
08:26:09.010920 IP c-185-45-236-223.customer.ggaweb.ch.8333 > tom-Latitude-3570.49070: tcp 0
08:26:09.088775 IP c-185-45-236-223.customer.ggaweb.ch.8333 > tom-Latitude-3570.49070: tcp 24
08:26:09.089678 IP c-185-45-236-223.customer.ggaweb.ch.8333 > tom-Latitude-3570.49070: tcp 1276
08:26:09.089698 IP c-185-45-236-223.customer.ggaweb.ch.8333 > tom-Latitude-3570.49070: tcp 855
08:26:09.089788 IP tom-Latitude-3570.49070 > c-185-45-236-223.customer.ggaweb.ch.8333: tcp 0
08:26:09.192237 IP tom-Latitude-3570.46284 > static-87-75-105-186.vodafonexdsl.co.uk.8333: tcp 24
08:26:09.194196 IP tom-Latitude-3570.46284 > static-87-75-105-186.vodafonexdsl.co.uk.8333: tcp 181
08:26:09.237988 IP static-87-75-105-186.vodafonexdsl.co.uk.8333 > tom-Latitude-3570.46284: tcp 0
08:26:09.251744 IP ns3113832.ip-54-38-177.eu.8333 > tom-Latitude-3570.56714: tcp 24
08:26:09.252334 IP ns3113832.ip-54-38-177.eu.8333 > tom-Latitude-3570.56714: tcp 181
08:26:09.252461 IP tom-Latitude-3570.56714 > ns3113832.ip-54-38-177.eu.8333: tcp 0
08:26:09.252618 IP tom-Latitude-3570.56714 > ns3113832.ip-54-38-177.eu.8333: tcp 24
08:26:09.254053 IP tom-Latitude-3570.56714 > ns3113832.ip-54-38-177.eu.8333: tcp 37
08:26:09.327057 IP ns3113832.ip-54-38-177.eu.8333 > tom-Latitude-3570.56714: tcp 0
08:26:09.327072 IP ns3113832.ip-54-38-177.eu.8333 > tom-Latitude-3570.56714: tcp 0
08:26:09.353048 IP tom-Latitude-3570.60988 > 81.198.101.144.8333: tcp 24
08:26:09.354034 IP tom-Latitude-3570.60988 > 81.198.101.144.8333: tcp 181
08:26:09.386516 IP ns3113832.ip-54-38-177.eu.8333 > tom-Latitude-3570.56714: tcp 24
08:26:09.387224 IP 81.198.101.144.8333 > tom-Latitude-3570.60988: tcp 0
08:26:09.387240 IP ns3113832.ip-54-38-177.eu.8333 > tom-Latitude-3570.56714: tcp 463
08:26:09.387361 IP tom-Latitude-3570.56714 > ns3113832.ip-54-38-177.eu.8333: tcp 0
08:26:09.399793 IP 81.198.101.144.8333 > tom-Latitude-3570.60988: tcp 0
08:26:09.588562 IP tom-Latitude-3570.56714 > ns3113832.ip-54-38-177.eu.8333: tcp 24
08:26:09.590866 IP tom-Latitude-3570.56714 > ns3113832.ip-54-38-177.eu.8333: tcp 37
08:26:09.630604 IP ns3113832.ip-54-38-177.eu.8333 > tom-Latitude-3570.56714: tcp 0
08:26:09.640022 IP ns3113832.ip-54-38-177.eu.8333 > tom-Latitude-3570.56714: tcp 0
08:26:09.889622 IP tom-Latitude-3570.60988 > 81.198.101.144.8333: tcp 24
08:26:09.889712 IP tom-Latitude-3570.42516 > 2.56.9.15.8333: tcp 24
08:26:09.891690 IP tom-Latitude-3570.60988 > 81.198.101.144.8333: tcp 37
08:26:09.892564 IP tom-Latitude-3570.42516 > 2.56.9.15.8333: tcp 217
08:26:09.955296 IP 81.198.101.144.8333 > tom-Latitude-3570.60988: tcp 0
08:26:09.959967 IP 2.56.9.15.8333 > tom-Latitude-3570.42516: tcp 0
08:26:09.961360 IP 81.198.101.144.8333 > tom-Latitude-3570.60988: tcp 0
08:26:09.963493 IP 2.56.9.15.8333 > tom-Latitude-3570.42516: tcp 0
08:26:10.090441 IP tom-Latitude-3570.46284 > static-87-75-105-186.vodafonexdsl.co.uk.8333: tcp 24
08:26:10.092624 IP tom-Latitude-3570.46284 > static-87-75-105-186.vodafonexdsl.co.uk.8333: tcp 37
08:26:10.154131 IP static-87-75-105-186.vodafonexdsl.co.uk.8333 > tom-Latitude-3570.46284: tcp 0
08:26:10.190993 IP tom-Latitude-3570.57976 > 167.99.216.145.8333: tcp 24
08:26:10.191938 IP tom-Latitude-3570.57976 > 167.99.216.145.8333: tcp 1009
08:26:10.227554 IP 167.99.216.145.8333 > tom-Latitude-3570.57976: tcp 0
08:26:10.238347 IP 167.99.216.145.8333 > tom-Latitude-3570.57976: tcp 0
08:26:10.266208 IP c-185-45-236-223.customer.ggaweb.ch.8333 > tom-Latitude-3570.49070: tcp 24
08:26:10.272281 IP c-185-45-236-223.customer.ggaweb.ch.8333 > tom-Latitude-3570.49070: tcp 217
08:26:10.272388 IP tom-Latitude-3570.49070 > c-185-45-236-223.customer.ggaweb.ch.8333: tcp 0
08:26:10.272601 IP tom-Latitude-3570.49070 > c-185-45-236-223.customer.ggaweb.ch.8333: tcp 24
08:26:10.273928 IP tom-Latitude-3570.49070 > c-185-45-236-223.customer.ggaweb.ch.8333: tcp 181
08:26:10.318719 IP c-185-45-236-223.customer.ggaweb.ch.8333 > tom-Latitude-3570.49070: tcp 0
08:26:10.323354 IP c-185-45-236-223.customer.ggaweb.ch.8333 > tom-Latitude-3570.49070: tcp 0
08:26:10.408308 IP c-185-45-236-223.customer.ggaweb.ch.8333 > tom-Latitude-3570.49070: tcp 24
08:26:10.408328 IP c-185-45-236-223.customer.ggaweb.ch.8333 > tom-Latitude-3570.49070: tcp 403
08:26:10.408334 IP c-185-45-236-223.customer.ggaweb.ch.8333 > tom-Latitude-3570.49070: tcp 699
08:26:10.408420 IP tom-Latitude-3570.49070 > c-185-45-236-223.customer.ggaweb.ch.8333: tcp 0
08:26:10.412822 IP c-185-45-236-223.customer.ggaweb.ch.8333 > tom-Latitude-3570.49070: tcp 293
08:26:10.412838 IP c-185-45-236-223.customer.ggaweb.ch.8333 > tom-Latitude-3570.49070: tcp 712
08:26:10.412917 IP tom-Latitude-3570.49070 > c-185-45-236-223.customer.ggaweb.ch.8333: tcp 0
08:26:10.614676 IP tom-Latitude-3570.56714 > ns3113832.ip-54-38-177.eu.8333: tcp 24
08:26:10.616862 IP tom-Latitude-3570.56714 > ns3113832.ip-54-38-177.eu.8333: tcp 181
08:26:10.666668 IP ns3113832.ip-54-38-177.eu.8333 > tom-Latitude-3570.56714: tcp 0
08:26:10.678312 IP ns3113832.ip-54-38-177.eu.8333 > tom-Latitude-3570.56714: tcp 0
08:26:10.915597 IP tom-Latitude-3570.46284 > static-87-75-105-186.vodafonexdsl.co.uk.8333: tcp 24
08:26:10.917748 IP tom-Latitude-3570.46284 > static-87-75-105-186.vodafonexdsl.co.uk.8333: tcp 181
08:26:10.960955 IP static-87-75-105-186.vodafonexdsl.co.uk.8333 > tom-Latitude-3570.46284: tcp 24
08:26:10.988180 IP static-87-75-105-186.vodafonexdsl.co.uk.8333 > tom-Latitude-3570.46284: tcp 217
08:26:10.988207 IP tom-Latitude-3570.46284 > static-87-75-105-186.vodafonexdsl.co.uk.8333: tcp 0
08:26:10.988413 IP tom-Latitude-3570.42516 > 2.56.9.15.8333: tcp 24
08:26:10.988520 IP tom-Latitude-3570.46284 > static-87-75-105-186.vodafonexdsl.co.uk.8333: tcp 24
08:26:10.989831 IP tom-Latitude-3570.42516 > 2.56.9.15.8333: tcp 181
08:26:10.990484 IP tom-Latitude-3570.46284 > static-87-75-105-186.vodafonexdsl.co.uk.8333: tcp 37
08:26:11.039053 IP 2.56.9.15.8333 > tom-Latitude-3570.42516: tcp 0
08:26:11.039879 IP 2.56.9.15.8333 > tom-Latitude-3570.42516: tcp 0
08:26:11.039893 IP static-87-75-105-186.vodafonexdsl.co.uk.8333 > tom-Latitude-3570.46284: tcp 0
08:26:11.347318 IP static-87-75-105-186.vodafonexdsl.co.uk.8333 > tom-Latitude-3570.46284: tcp 24
08:26:11.347338 IP static-87-75-105-186.vodafonexdsl.co.uk.8333 > tom-Latitude-3570.46284: tcp 191
08:26:11.347364 IP static-87-75-105-186.vodafonexdsl.co.uk.8333 > tom-Latitude-3570.46284: tcp 191
08:26:11.347392 IP tom-Latitude-3570.46284 > static-87-75-105-186.vodafonexdsl.co.uk.8333: tcp 0
08:26:11.448351 IP tom-Latitude-3570.56714 > ns3113832.ip-54-38-177.eu.8333: tcp 24
08:26:11.449338 IP tom-Latitude-3570.56714 > ns3113832.ip-54-38-177.eu.8333: tcp 37
08:26:11.492018 IP ns3113832.ip-54-38-177.eu.8333 > tom-Latitude-3570.56714: tcp 0
08:26:11.508179 IP ns3113832.ip-54-38-177.eu.8333 > tom-Latitude-3570.56714: tcp 0
08:26:11.592025 IP static-87-75-105-186.vodafonexdsl.co.uk.8333 > tom-Latitude-3570.46284: tcp 24
08:26:11.592042 IP tom-Latitude-3570.46284 > static-87-75-105-186.vodafonexdsl.co.uk.8333: tcp 0
08:26:11.629046 IP static-87-75-105-186.vodafonexdsl.co.uk.8333 > tom-Latitude-3570.46284: tcp 109
08:26:11.629069 IP tom-Latitude-3570.46284 > static-87-75-105-186.vodafonexdsl.co.uk.8333: tcp 0
08:26:11.629303 IP tom-Latitude-3570.46284 > static-87-75-105-186.vodafonexdsl.co.uk.8333: tcp 24
08:26:11.630596 IP tom-Latitude-3570.46284 > static-87-75-105-186.vodafonexdsl.co.uk.8333: tcp 109
08:26:11.678081 IP static-87-75-105-186.vodafonexdsl.co.uk.8333 > tom-Latitude-3570.46284: tcp 0
08:26:11.693407 IP 167.99.216.145.8333 > tom-Latitude-3570.57976: tcp 24
08:26:11.694016 IP 167.99.216.145.8333 > tom-Latitude-3570.57976: tcp 325
08:26:11.694147 IP tom-Latitude-3570.57976 > 167.99.216.145.8333: tcp 0
08:26:11.748078 IP static-87-75-105-186.vodafonexdsl.co.uk.8333 > tom-Latitude-3570.46284: tcp 24
08:26:11.792170 IP static-87-75-105-186.vodafonexdsl.co.uk.8333 > tom-Latitude-3570.46284: tcp 394
08:26:11.792194 IP tom-Latitude-3570.46284 > static-87-75-105-186.vodafonexdsl.co.uk.8333: tcp 0
08:26:11.792388 IP tom-Latitude-3570.42516 > 2.56.9.15.8333: tcp 24
08:26:11.792706 IP static-87-75-105-186.vodafonexdsl.co.uk.8333 > tom-Latitude-3570.46284: tcp 249
08:26:11.794100 IP tom-Latitude-3570.42516 > 2.56.9.15.8333: tcp 37
08:26:11.795764 IP static-87-75-105-186.vodafonexdsl.co.uk.8333 > tom-Latitude-3570.46284: tcp 1440
08:26:11.795778 IP static-87-75-105-186.vodafonexdsl.co.uk.8333 > tom-Latitude-3570.46284: tcp 700
08:26:11.795881 IP tom-Latitude-3570.46284 > static-87-75-105-186.vodafonexdsl.co.uk.8333: tcp 0
08:26:11.839124 IP 2.56.9.15.8333 > tom-Latitude-3570.42516: tcp 0
08:26:11.841585 IP 2.56.9.15.8333 > tom-Latitude-3570.42516: tcp 0
08:26:11.935244 IP 2.56.9.15.8333 > tom-Latitude-3570.42516: tcp 24
08:26:11.935900 IP 2.56.9.15.8333 > tom-Latitude-3570.42516: tcp 256
08:26:11.935922 IP 167.99.216.145.8333 > tom-Latitude-3570.57976: tcp 24
08:26:11.935926 IP 167.99.216.145.8333 > tom-Latitude-3570.57976: tcp 37
08:26:11.936010 IP tom-Latitude-3570.57976 > 167.99.216.145.8333: tcp 0
08:26:11.936038 IP tom-Latitude-3570.42516 > 2.56.9.15.8333: tcp 0
08:26:11.936123 IP tom-Latitude-3570.56714 > ns3113832.ip-54-38-177.eu.8333: tcp 24
08:26:11.936180 IP tom-Latitude-3570.57976 > 167.99.216.145.8333: tcp 24
08:26:11.936450 IP tom-Latitude-3570.42516 > 2.56.9.15.8333: tcp 24
08:26:11.938253 IP tom-Latitude-3570.56714 > ns3113832.ip-54-38-177.eu.8333: tcp 109
08:26:11.938956 IP tom-Latitude-3570.57976 > 167.99.216.145.8333: tcp 37
08:26:11.939661 IP tom-Latitude-3570.42516 > 2.56.9.15.8333: tcp 54
08:26:11.988331 IP ns3113832.ip-54-38-177.eu.8333 > tom-Latitude-3570.56714: tcp 0
08:26:11.988921 IP 2.56.9.15.8333 > tom-Latitude-3570.42516: tcp 0
08:26:11.988936 IP ns3113832.ip-54-38-177.eu.8333 > tom-Latitude-3570.56714: tcp 0
08:26:11.988939 IP 167.99.216.145.8333 > tom-Latitude-3570.57976: tcp 0
08:26:11.988942 IP 167.99.216.145.8333 > tom-Latitude-3570.57976: tcp 0
08:26:11.988944 IP 2.56.9.15.8333 > tom-Latitude-3570.42516: tcp 0
08:26:12.042486 IP 167.99.216.145.8333 > tom-Latitude-3570.57976: tcp 24
08:26:12.042507 IP 167.99.216.145.8333 > tom-Latitude-3570.57976: tcp 192
08:26:12.042597 IP tom-Latitude-3570.57976 > 167.99.216.145.8333: tcp 0
08:26:12.243623 IP tom-Latitude-3570.39110 > vmi195435.contaboserver.net.8333: tcp 24
08:26:12.245667 IP tom-Latitude-3570.39110 > vmi195435.contaboserver.net.8333: tcp 901
08:26:12.246188 IP static-87-75-105-186.vodafonexdsl.co.uk.8333 > tom-Latitude-3570.46284: tcp 24
08:26:12.246206 IP static-87-75-105-186.vodafonexdsl.co.uk.8333 > tom-Latitude-3570.46284: tcp 37
08:26:12.246320 IP tom-Latitude-3570.46284 > static-87-75-105-186.vodafonexdsl.co.uk.8333: tcp 0
08:26:12.276145 IP static-87-75-105-186.vodafonexdsl.co.uk.8333 > tom-Latitude-3570.46284: tcp 37
08:26:12.276159 IP tom-Latitude-3570.46284 > static-87-75-105-186.vodafonexdsl.co.uk.8333: tcp 0
08:26:12.308165 IP vmi195435.contaboserver.net.8333 > tom-Latitude-3570.39110: tcp 0
08:26:12.308819 IP vmi195435.contaboserver.net.8333 > tom-Latitude-3570.39110: tcp 0
08:26:13.350113 IP tom-Latitude-3570.60988 > 81.198.101.144.8333: tcp 24
08:26:13.350176 IP tom-Latitude-3570.42516 > 2.56.9.15.8333: tcp 24
08:26:13.352432 IP tom-Latitude-3570.60988 > 81.198.101.144.8333: tcp 361
08:26:13.353294 IP tom-Latitude-3570.42516 > 2.56.9.15.8333: tcp 181
08:26:13.386824 IP 81.198.101.144.8333 > tom-Latitude-3570.60988: tcp 0
08:26:13.397243 IP 2.56.9.15.8333 > tom-Latitude-3570.42516: tcp 0
08:26:13.401010 IP 81.198.101.144.8333 > tom-Latitude-3570.60988: tcp 0
08:26:13.409898 IP 2.56.9.15.8333 > tom-Latitude-3570.42516: tcp 0
08:26:14.829007 IP bb42-60-217-183.singnet.com.sg.8333 > tom-Latitude-3570.60470: tcp 24
08:26:14.829028 IP bb42-60-217-183.singnet.com.sg.8333 > tom-Latitude-3570.60470: tcp 1261
08:26:14.829117 IP tom-Latitude-3570.60470 > bb42-60-217-183.singnet.com.sg.8333: tcp 0
08:26:14.829221 IP bb42-60-217-183.singnet.com.sg.8333 > tom-Latitude-3570.60470: tcp 1261
08:26:14.829233 IP tom-Latitude-3570.60470 > bb42-60-217-183.singnet.com.sg.8333: tcp 0
08:26:14.829242 IP ns3113832.ip-54-38-177.eu.8333 > tom-Latitude-3570.56714: tcp 24
08:26:14.829255 IP ns3113832.ip-54-38-177.eu.8333 > tom-Latitude-3570.56714: tcp 181
08:26:14.829261 IP ns3113832.ip-54-38-177.eu.8333 > tom-Latitude-3570.56714: tcp 181
08:26:14.829265 IP tom-Latitude-3570.56714 > ns3113832.ip-54-38-177.eu.8333: tcp 0
08:26:14.829551 IP tom-Latitude-3570.60470 > bb42-60-217-183.singnet.com.sg.8333: tcp 24
08:26:14.829652 IP tom-Latitude-3570.56714 > ns3113832.ip-54-38-177.eu.8333: tcp 24
08:26:14.831925 IP tom-Latitude-3570.60470 > bb42-60-217-183.singnet.com.sg.8333: tcp 73
08:26:14.832592 IP tom-Latitude-3570.56714 > ns3113832.ip-54-38-177.eu.8333: tcp 73
08:26:14.877654 IP bb42-60-217-183.singnet.com.sg.8333 > tom-Latitude-3570.60470: tcp 0
08:26:14.881576 IP ns3113832.ip-54-38-177.eu.8333 > tom-Latitude-3570.56714: tcp 0
08:26:14.882234 IP ns3113832.ip-54-38-177.eu.8333 > tom-Latitude-3570.56714: tcp 0
08:26:14.882239 IP bb42-60-217-183.singnet.com.sg.8333 > tom-Latitude-3570.60470: tcp 0
08:26:14.948938 IP ns3113832.ip-54-38-177.eu.8333 > tom-Latitude-3570.56714: tcp 24
08:26:14.949692 IP ns3113832.ip-54-38-177.eu.8333 > tom-Latitude-3570.56714: tcp 226
08:26:14.949699 IP ns3113832.ip-54-38-177.eu.8333 > tom-Latitude-3570.56714: tcp 24
08:26:14.949702 IP ns3113832.ip-54-38-177.eu.8333 > tom-Latitude-3570.56714: tcp 420
08:26:14.949714 IP tom-Latitude-3570.56714 > ns3113832.ip-54-38-177.eu.8333: tcp 0
08:26:15.151031 IP tom-Latitude-3570.60470 > bb42-60-217-183.singnet.com.sg.8333: tcp 24
08:26:15.153261 IP tom-Latitude-3570.60470 > bb42-60-217-183.singnet.com.sg.8333: tcp 253
08:26:15.186449 IP bb42-60-217-183.singnet.com.sg.8333 > tom-Latitude-3570.60470: tcp 0
08:26:15.200613 IP bb42-60-217-183.singnet.com.sg.8333 > tom-Latitude-3570.60470: tcp 0
08:26:15.274462 IP bb42-60-217-183.singnet.com.sg.8333 > tom-Latitude-3570.60470: tcp 24
08:26:15.274484 IP bb42-60-217-183.singnet.com.sg.8333 > tom-Latitude-3570.60470: tcp 256
08:26:15.274489 IP bb42-60-217-183.singnet.com.sg.8333 > tom-Latitude-3570.60470: tcp 24
08:26:15.274493 IP bb42-60-217-183.singnet.com.sg.8333 > tom-Latitude-3570.60470: tcp 420
08:26:15.274529 IP tom-Latitude-3570.60470 > bb42-60-217-183.singnet.com.sg.8333: tcp 0
08:26:15.373980 IP 81.198.101.144.8333 > tom-Latitude-3570.60988: tcp 24
08:26:15.374607 IP 81.198.101.144.8333 > tom-Latitude-3570.60988: tcp 181
08:26:15.374670 IP tom-Latitude-3570.60988 > 81.198.101.144.8333: tcp 0
08:26:15.374893 IP tom-Latitude-3570.60988 > 81.198.101.144.8333: tcp 24
08:26:15.374967 IP tom-Latitude-3570.46284 > static-87-75-105-186.vodafonexdsl.co.uk.8333: tcp 24
08:26:15.376198 IP tom-Latitude-3570.60988 > 81.198.101.144.8333: tcp 37
08:26:15.377277 IP tom-Latitude-3570.46284 > static-87-75-105-186.vodafonexdsl.co.uk.8333: tcp 145
08:26:15.427822 IP 81.198.101.144.8333 > tom-Latitude-3570.60988: tcp 0
08:26:15.428434 IP 81.198.101.144.8333 > tom-Latitude-3570.60988: tcp 0
08:26:15.438921 IP static-87-75-105-186.vodafonexdsl.co.uk.8333 > tom-Latitude-3570.46284: tcp 0
08:26:15.475387 IP tom-Latitude-3570.57976 > 167.99.216.145.8333: tcp 24
08:26:15.476327 IP tom-Latitude-3570.57976 > 167.99.216.145.8333: tcp 145
08:26:15.510078 IP 81.198.101.144.8333 > tom-Latitude-3570.60988: tcp 24
08:26:15.510643 IP 81.198.101.144.8333 > tom-Latitude-3570.60988: tcp 224
08:26:15.510706 IP tom-Latitude-3570.60988 > 81.198.101.144.8333: tcp 0
08:26:15.517687 IP 167.99.216.145.8333 > tom-Latitude-3570.57976: tcp 0
08:26:15.528780 IP 167.99.216.145.8333 > tom-Latitude-3570.57976: tcp 0
08:26:15.611007 IP vmi195435.contaboserver.net.8333 > tom-Latitude-3570.39110: tcp 24
08:26:15.627951 IP vmi195435.contaboserver.net.8333 > tom-Latitude-3570.39110: tcp 325
08:26:15.628011 IP tom-Latitude-3570.39110 > vmi195435.contaboserver.net.8333: tcp 0
08:26:15.628234 IP tom-Latitude-3570.39110 > vmi195435.contaboserver.net.8333: tcp 24
08:26:15.629536 IP tom-Latitude-3570.39110 > vmi195435.contaboserver.net.8333: tcp 145
08:26:15.666993 IP vmi195435.contaboserver.net.8333 > tom-Latitude-3570.39110: tcp 0
08:26:15.667646 IP vmi195435.contaboserver.net.8333 > tom-Latitude-3570.39110: tcp 0
08:26:15.749022 IP vmi195435.contaboserver.net.8333 > tom-Latitude-3570.39110: tcp 24
08:26:15.749925 IP vmi195435.contaboserver.net.8333 > tom-Latitude-3570.39110: tcp 414
08:26:15.749948 IP vmi195435.contaboserver.net.8333 > tom-Latitude-3570.39110: tcp 24
08:26:15.749953 IP vmi195435.contaboserver.net.8333 > tom-Latitude-3570.39110: tcp 249
08:26:15.749956 IP vmi195435.contaboserver.net.8333 > tom-Latitude-3570.39110: tcp 24
08:26:15.749959 IP vmi195435.contaboserver.net.8333 > tom-Latitude-3570.39110: tcp 406
08:26:15.749962 IP vmi195435.contaboserver.net.8333 > tom-Latitude-3570.39110: tcp 24
08:26:15.749965 IP vmi195435.contaboserver.net.8333 > tom-Latitude-3570.39110: tcp 192
08:26:15.750008 IP tom-Latitude-3570.39110 > vmi195435.contaboserver.net.8333: tcp 0
08:26:15.750799 IP tom-Latitude-3570.60988 > 81.198.101.144.8333: tcp 24
08:26:15.751484 IP tom-Latitude-3570.60988 > 81.198.101.144.8333: tcp 37
08:26:15.787828 IP static-87-75-105-186.vodafonexdsl.co.uk.8333 > tom-Latitude-3570.46284: tcp 24
08:26:15.787853 IP tom-Latitude-3570.46284 > static-87-75-105-186.vodafonexdsl.co.uk.8333: tcp 0
08:26:15.806424 IP 81.198.101.144.8333 > tom-Latitude-3570.60988: tcp 0
08:26:15.814912 IP 81.198.101.144.8333 > tom-Latitude-3570.60988: tcp 0
08:26:15.827964 IP static-87-75-105-186.vodafonexdsl.co.uk.8333 > tom-Latitude-3570.46284: tcp 109
08:26:15.827990 IP tom-Latitude-3570.46284 > static-87-75-105-186.vodafonexdsl.co.uk.8333: tcp 0
08:26:15.828214 IP tom-Latitude-3570.60470 > bb42-60-217-183.singnet.com.sg.8333: tcp 24
08:26:15.829547 IP tom-Latitude-3570.60470 > bb42-60-217-183.singnet.com.sg.8333: tcp 181
08:26:15.866427 IP bb42-60-217-183.singnet.com.sg.8333 > tom-Latitude-3570.60470: tcp 0
08:26:15.867105 IP bb42-60-217-183.singnet.com.sg.8333 > tom-Latitude-3570.60470: tcp 0
08:26:15.909013 IP 81.198.101.144.8333 > tom-Latitude-3570.60988: tcp 24
08:26:15.909651 IP 81.198.101.144.8333 > tom-Latitude-3570.60988: tcp 37
08:26:15.909713 IP tom-Latitude-3570.60988 > 81.198.101.144.8333: tcp 0
08:26:15.909850 IP tom-Latitude-3570.60988 > 81.198.101.144.8333: tcp 24
08:26:15.909975 IP tom-Latitude-3570.56714 > ns3113832.ip-54-38-177.eu.8333: tcp 24
08:26:15.911907 IP tom-Latitude-3570.60988 > 81.198.101.144.8333: tcp 414
08:26:15.912521 IP tom-Latitude-3570.56714 > ns3113832.ip-54-38-177.eu.8333: tcp 181
08:26:15.947007 IP 81.198.101.144.8333 > tom-Latitude-3570.60988: tcp 0
08:26:15.947904 IP ns3113832.ip-54-38-177.eu.8333 > tom-Latitude-3570.56714: tcp 0
08:26:15.947919 IP 81.198.101.144.8333 > tom-Latitude-3570.60988: tcp 0
08:26:15.947922 IP ns3113832.ip-54-38-177.eu.8333 > tom-Latitude-3570.56714: tcp 0
08:26:16.000998 IP ns3113832.ip-54-38-177.eu.8333 > tom-Latitude-3570.56714: tcp 24
08:26:16.001016 IP ns3113832.ip-54-38-177.eu.8333 > tom-Latitude-3570.56714: tcp 37
08:26:16.001063 IP tom-Latitude-3570.56714 > ns3113832.ip-54-38-177.eu.8333: tcp 0
08:26:16.001198 IP tom-Latitude-3570.56714 > ns3113832.ip-54-38-177.eu.8333: tcp 24
08:26:16.002706 IP tom-Latitude-3570.56714 > ns3113832.ip-54-38-177.eu.8333: tcp 192
08:26:16.047007 IP ns3113832.ip-54-38-177.eu.8333 > tom-Latitude-3570.56714: tcp 0
08:26:16.047617 IP ns3113832.ip-54-38-177.eu.8333 > tom-Latitude-3570.56714: tcp 0
08:26:16.135020 IP c-185-45-236-223.customer.ggaweb.ch.8333 > tom-Latitude-3570.49070: tcp 24
08:26:16.135708 IP c-185-45-236-223.customer.ggaweb.ch.8333 > tom-Latitude-3570.49070: tcp 541
08:26:16.135771 IP tom-Latitude-3570.49070 > c-185-45-236-223.customer.ggaweb.ch.8333: tcp 0
08:26:16.136044 IP tom-Latitude-3570.49070 > c-185-45-236-223.customer.ggaweb.ch.8333: tcp 24
08:26:16.137302 IP tom-Latitude-3570.49070 > c-185-45-236-223.customer.ggaweb.ch.8333: tcp 37
08:26:16.196437 IP c-185-45-236-223.customer.ggaweb.ch.8333 > tom-Latitude-3570.49070: tcp 0
08:26:16.197086 IP c-185-45-236-223.customer.ggaweb.ch.8333 > tom-Latitude-3570.49070: tcp 0
08:26:16.245187 IP bb42-60-217-183.singnet.com.sg.8333 > tom-Latitude-3570.60470: tcp 24
08:26:16.245206 IP bb42-60-217-183.singnet.com.sg.8333 > tom-Latitude-3570.60470: tcp 37
08:26:16.245251 IP tom-Latitude-3570.60470 > bb42-60-217-183.singnet.com.sg.8333: tcp 0
08:26:16.245411 IP tom-Latitude-3570.60470 > bb42-60-217-183.singnet.com.sg.8333: tcp 24
08:26:16.245552 IP tom-Latitude-3570.42516 > 2.56.9.15.8333: tcp 24
08:26:16.247745 IP tom-Latitude-3570.60470 > bb42-60-217-183.singnet.com.sg.8333: tcp 192
08:26:16.248308 IP tom-Latitude-3570.42516 > 2.56.9.15.8333: tcp 325
08:26:16.267957 IP c-185-45-236-223.customer.ggaweb.ch.8333 > tom-Latitude-3570.49070: tcp 24
08:26:16.268959 IP c-185-45-236-223.customer.ggaweb.ch.8333 > tom-Latitude-3570.49070: tcp 1448
08:26:16.268982 IP c-185-45-236-223.customer.ggaweb.ch.8333 > tom-Latitude-3570.49070: tcp 1448
08:26:16.268986 IP c-185-45-236-223.customer.ggaweb.ch.8333 > tom-Latitude-3570.49070: tcp 366
08:26:16.269025 IP tom-Latitude-3570.49070 > c-185-45-236-223.customer.ggaweb.ch.8333: tcp 0
08:26:16.285346 IP bb42-60-217-183.singnet.com.sg.8333 > tom-Latitude-3570.60470: tcp 0
08:26:16.296392 IP 2.56.9.15.8333 > tom-Latitude-3570.42516: tcp 0
08:26:16.296407 IP bb42-60-217-183.singnet.com.sg.8333 > tom-Latitude-3570.60470: tcp 0
08:26:16.309021 IP 2.56.9.15.8333 > tom-Latitude-3570.42516: tcp 0
08:26:16.372035 IP tom-Latitude-3570.39110 > vmi195435.contaboserver.net.8333: tcp 24
08:26:16.372974 IP tom-Latitude-3570.39110 > vmi195435.contaboserver.net.8333: tcp 37
08:26:16.411342 IP vmi195435.contaboserver.net.8333 > tom-Latitude-3570.39110: tcp 0
08:26:16.426337 IP vmi195435.contaboserver.net.8333 > tom-Latitude-3570.39110: tcp 0
08:26:16.672247 IP 167.99.216.145.8333 > tom-Latitude-3570.57976: tcp 24
08:26:16.672267 IP 167.99.216.145.8333 > tom-Latitude-3570.57976: tcp 8
08:26:16.672311 IP tom-Latitude-3570.57976 > 167.99.216.145.8333: tcp 0
08:26:16.672460 IP tom-Latitude-3570.56714 > ns3113832.ip-54-38-177.eu.8333: tcp 24
08:26:16.672489 IP tom-Latitude-3570.57976 > 167.99.216.145.8333: tcp 24
08:26:16.673854 IP tom-Latitude-3570.56714 > ns3113832.ip-54-38-177.eu.8333: tcp 37
08:26:16.674514 IP tom-Latitude-3570.57976 > 167.99.216.145.8333: tcp 8
08:26:16.719153 IP ns3113832.ip-54-38-177.eu.8333 > tom-Latitude-3570.56714: tcp 0
08:26:16.719744 IP 167.99.216.145.8333 > tom-Latitude-3570.57976: tcp 0
08:26:16.719758 IP ns3113832.ip-54-38-177.eu.8333 > tom-Latitude-3570.56714: tcp 0
08:26:16.719762 IP 167.99.216.145.8333 > tom-Latitude-3570.57976: tcp 0
08:26:17.174267 IP tom-Latitude-3570.60988 > 81.198.101.144.8333: tcp 24
08:26:17.176326 IP tom-Latitude-3570.60988 > 81.198.101.144.8333: tcp 145
08:26:17.197823 IP static-87-75-105-186.vodafonexdsl.co.uk.8333 > tom-Latitude-3570.46284: tcp 24
08:26:17.197842 IP tom-Latitude-3570.46284 > static-87-75-105-186.vodafonexdsl.co.uk.8333: tcp 0
08:26:17.212292 IP 81.198.101.144.8333 > tom-Latitude-3570.60988: tcp 0
08:26:17.228458 IP 81.198.101.144.8333 > tom-Latitude-3570.60988: tcp 0
08:26:17.234100 IP 2.56.9.15.8333 > tom-Latitude-3570.42516: tcp 24
08:26:17.234657 IP 2.56.9.15.8333 > tom-Latitude-3570.42516: tcp 73
08:26:17.234719 IP tom-Latitude-3570.42516 > 2.56.9.15.8333: tcp 0
08:26:17.234912 IP tom-Latitude-3570.42516 > 2.56.9.15.8333: tcp 24
08:26:17.236276 IP tom-Latitude-3570.42516 > 2.56.9.15.8333: tcp 37
08:26:17.245061 IP static-87-75-105-186.vodafonexdsl.co.uk.8333 > tom-Latitude-3570.46284: tcp 181
08:26:17.245107 IP tom-Latitude-3570.46284 > static-87-75-105-186.vodafonexdsl.co.uk.8333: tcp 0
08:26:17.245357 IP tom-Latitude-3570.46284 > static-87-75-105-186.vodafonexdsl.co.uk.8333: tcp 24
08:26:17.246491 IP tom-Latitude-3570.46284 > static-87-75-105-186.vodafonexdsl.co.uk.8333: tcp 37
08:26:17.283969 IP 2.56.9.15.8333 > tom-Latitude-3570.42516: tcp 0
08:26:17.289219 IP 2.56.9.15.8333 > tom-Latitude-3570.42516: tcp 0
08:26:17.289841 IP static-87-75-105-186.vodafonexdsl.co.uk.8333 > tom-Latitude-3570.46284: tcp 0
08:26:17.358353 IP static-87-75-105-186.vodafonexdsl.co.uk.8333 > tom-Latitude-3570.46284: tcp 24
08:26:17.397431 IP 2.56.9.15.8333 > tom-Latitude-3570.42516: tcp 24
08:26:17.397982 IP 2.56.9.15.8333 > tom-Latitude-3570.42516: tcp 420
08:26:17.398049 IP tom-Latitude-3570.42516 > 2.56.9.15.8333: tcp 0
08:26:17.399781 IP tom-Latitude-3570.46284 > static-87-75-105-186.vodafonexdsl.co.uk.8333: tcp 0
08:26:17.425417 IP static-87-75-105-186.vodafonexdsl.co.uk.8333 > tom-Latitude-3570.46284: tcp 518
08:26:17.425444 IP tom-Latitude-3570.46284 > static-87-75-105-186.vodafonexdsl.co.uk.8333: tcp 0
08:26:17.593922 IP 81.198.101.144.8333 > tom-Latitude-3570.60988: tcp 24
08:26:17.593943 IP 81.198.101.144.8333 > tom-Latitude-3570.60988: tcp 31
08:26:17.593984 IP tom-Latitude-3570.60988 > 81.198.101.144.8333: tcp 0
08:26:17.694549 IP tom-Latitude-3570.49070 > c-185-45-236-223.customer.ggaweb.ch.8333: tcp 24
08:26:17.696242 IP tom-Latitude-3570.49070 > c-185-45-236-223.customer.ggaweb.ch.8333: tcp 289
08:26:17.722350 IP c-185-45-236-223.customer.ggaweb.ch.8333 > tom-Latitude-3570.49070: tcp 0
08:26:17.730063 IP c-185-45-236-223.customer.ggaweb.ch.8333 > tom-Latitude-3570.49070: tcp 0
08:26:17.795038 IP tom-Latitude-3570.60988 > 81.198.101.144.8333: tcp 24
08:26:17.795095 IP tom-Latitude-3570.46284 > static-87-75-105-186.vodafonexdsl.co.uk.8333: tcp 24
08:26:17.834629 IP c-185-45-236-223.customer.ggaweb.ch.8333 > tom-Latitude-3570.49070: tcp 24
08:26:17.834650 IP c-185-45-236-223.customer.ggaweb.ch.8333 > tom-Latitude-3570.49070: tcp 900
08:26:17.834656 IP c-185-45-236-223.customer.ggaweb.ch.8333 > tom-Latitude-3570.49070: tcp 614
08:26:17.834679 IP c-185-45-236-223.customer.ggaweb.ch.8333 > tom-Latitude-3570.49070: tcp 640
08:26:17.834684 IP c-185-45-236-223.customer.ggaweb.ch.8333 > tom-Latitude-3570.49070: tcp 284
08:26:17.834695 IP tom-Latitude-3570.49070 > c-185-45-236-223.customer.ggaweb.ch.8333: tcp 0
08:26:17.835113 IP tom-Latitude-3570.42516 > 2.56.9.15.8333: tcp 24
08:26:17.835339 IP tom-Latitude-3570.49070 > c-185-45-236-223.customer.ggaweb.ch.8333: tcp 24
08:26:17.838077 IP tom-Latitude-3570.60988 > 81.198.101.144.8333: tcp 73
08:26:17.838652 IP tom-Latitude-3570.46284 > static-87-75-105-186.vodafonexdsl.co.uk.8333: tcp 31
08:26:17.839877 IP tom-Latitude-3570.42516 > 2.56.9.15.8333: tcp 37
08:26:17.840590 IP tom-Latitude-3570.49070 > c-185-45-236-223.customer.ggaweb.ch.8333: tcp 342
08:26:17.879491 IP 81.198.101.144.8333 > tom-Latitude-3570.60988: tcp 0
08:26:17.880317 IP 2.56.9.15.8333 > tom-Latitude-3570.42516: tcp 0
08:26:17.880331 IP 81.198.101.144.8333 > tom-Latitude-3570.60988: tcp 0
08:26:17.880334 IP c-185-45-236-223.customer.ggaweb.ch.8333 > tom-Latitude-3570.49070: tcp 0
08:26:17.880338 IP static-87-75-105-186.vodafonexdsl.co.uk.8333 > tom-Latitude-3570.46284: tcp 0
08:26:17.880341 IP 2.56.9.15.8333 > tom-Latitude-3570.42516: tcp 0
08:26:17.880343 IP c-185-45-236-223.customer.ggaweb.ch.8333 > tom-Latitude-3570.49070: tcp 0
08:26:17.936497 IP tom-Latitude-3570.56714 > ns3113832.ip-54-38-177.eu.8333: tcp 24
08:26:17.937437 IP tom-Latitude-3570.56714 > ns3113832.ip-54-38-177.eu.8333: tcp 73
08:26:17.964367 IP c-185-45-236-223.customer.ggaweb.ch.8333 > tom-Latitude-3570.49070: tcp 24
08:26:17.964959 IP c-185-45-236-223.customer.ggaweb.ch.8333 > tom-Latitude-3570.49070: tcp 284
08:26:17.965023 IP tom-Latitude-3570.49070 > c-185-45-236-223.customer.ggaweb.ch.8333: tcp 0
08:26:17.965464 IP tom-Latitude-3570.49070 > c-185-45-236-223.customer.ggaweb.ch.8333: tcp 24
08:26:17.966640 IP tom-Latitude-3570.49070 > c-185-45-236-223.customer.ggaweb.ch.8333: tcp 37
08:26:17.968274 IP c-185-45-236-223.customer.ggaweb.ch.8333 > tom-Latitude-3570.49070: tcp 24
08:26:17.968322 IP c-185-45-236-223.customer.ggaweb.ch.8333 > tom-Latitude-3570.49070: tcp 283
08:26:17.968327 IP c-185-45-236-223.customer.ggaweb.ch.8333 > tom-Latitude-3570.49070: tcp 24
08:26:17.968330 IP c-185-45-236-223.customer.ggaweb.ch.8333 > tom-Latitude-3570.49070: tcp 283
08:26:17.968335 IP c-185-45-236-223.customer.ggaweb.ch.8333 > tom-Latitude-3570.49070: tcp 24
08:26:17.968338 IP c-185-45-236-223.customer.ggaweb.ch.8333 > tom-Latitude-3570.49070: tcp 284
08:26:17.968344 IP c-185-45-236-223.customer.ggaweb.ch.8333 > tom-Latitude-3570.49070: tcp 24
08:26:17.968346 IP c-185-45-236-223.customer.ggaweb.ch.8333 > tom-Latitude-3570.49070: tcp 283
08:26:17.968380 IP tom-Latitude-3570.49070 > c-185-45-236-223.customer.ggaweb.ch.8333: tcp 0
08:26:17.968765 IP tom-Latitude-3570.49070 > c-185-45-236-223.customer.ggaweb.ch.8333: tcp 24
08:26:17.968779 IP tom-Latitude-3570.49070 > c-185-45-236-223.customer.ggaweb.ch.8333: tcp 37
08:26:17.969887 IP tom-Latitude-3570.49070 > c-185-45-236-223.customer.ggaweb.ch.8333: tcp 183
08:26:17.971084 IP ns3113832.ip-54-38-177.eu.8333 > tom-Latitude-3570.56714: tcp 0
08:26:17.977126 IP ns3113832.ip-54-38-177.eu.8333 > tom-Latitude-3570.56714: tcp 0
08:26:18.007002 IP c-185-45-236-223.customer.ggaweb.ch.8333 > tom-Latitude-3570.49070: tcp 0
08:26:18.007599 IP c-185-45-236-223.customer.ggaweb.ch.8333 > tom-Latitude-3570.49070: tcp 0
08:26:18.007615 IP c-185-45-236-223.customer.ggaweb.ch.8333 > tom-Latitude-3570.49070: tcp 0
08:26:18.007617 IP c-185-45-236-223.customer.ggaweb.ch.8333 > tom-Latitude-3570.49070: tcp 0
08:26:18.007619 IP c-185-45-236-223.customer.ggaweb.ch.8333 > tom-Latitude-3570.49070: tcp 0
08:26:18.051393 IP c-185-45-236-223.customer.ggaweb.ch.8333 > tom-Latitude-3570.49070: tcp 308
08:26:18.051903 IP tom-Latitude-3570.49070 > c-185-45-236-223.customer.ggaweb.ch.8333: tcp 24
08:26:18.052842 IP tom-Latitude-3570.49070 > c-185-45-236-223.customer.ggaweb.ch.8333: tcp 37
08:26:18.082352 IP c-185-45-236-223.customer.ggaweb.ch.8333 > tom-Latitude-3570.49070: tcp 0
08:26:18.089450 IP c-185-45-236-223.customer.ggaweb.ch.8333 > tom-Latitude-3570.49070: tcp 0
08:26:18.093674 IP c-185-45-236-223.customer.ggaweb.ch.8333 > tom-Latitude-3570.49070: tcp 24
08:26:18.094489 IP c-185-45-236-223.customer.ggaweb.ch.8333 > tom-Latitude-3570.49070: tcp 284
08:26:18.094507 IP c-185-45-236-223.customer.ggaweb.ch.8333 > tom-Latitude-3570.49070: tcp 24
08:26:18.094512 IP c-185-45-236-223.customer.ggaweb.ch.8333 > tom-Latitude-3570.49070: tcp 284
08:26:18.094515 IP c-185-45-236-223.customer.ggaweb.ch.8333 > tom-Latitude-3570.49070: tcp 24
08:26:18.094517 IP c-185-45-236-223.customer.ggaweb.ch.8333 > tom-Latitude-3570.49070: tcp 283
08:26:18.094520 IP c-185-45-236-223.customer.ggaweb.ch.8333 > tom-Latitude-3570.49070: tcp 24
08:26:18.094522 IP c-185-45-236-223.customer.ggaweb.ch.8333 > tom-Latitude-3570.49070: tcp 283
08:26:18.094524 IP c-185-45-236-223.customer.ggaweb.ch.8333 > tom-Latitude-3570.49070: tcp 24
08:26:18.094527 IP c-185-45-236-223.customer.ggaweb.ch.8333 > tom-Latitude-3570.49070: tcp 283
08:26:18.094555 IP tom-Latitude-3570.49070 > c-185-45-236-223.customer.ggaweb.ch.8333: tcp 0
08:26:18.095004 IP tom-Latitude-3570.49070 > c-185-45-236-223.customer.ggaweb.ch.8333: tcp 24
08:26:18.095982 IP tom-Latitude-3570.49070 > c-185-45-236-223.customer.ggaweb.ch.8333: tcp 220
08:26:18.130236 IP c-185-45-236-223.customer.ggaweb.ch.8333 > tom-Latitude-3570.49070: tcp 0
08:26:18.176054 IP c-185-45-236-223.customer.ggaweb.ch.8333 > tom-Latitude-3570.49070: tcp 24
08:26:18.176691 IP c-185-45-236-223.customer.ggaweb.ch.8333 > tom-Latitude-3570.49070: tcp 284
08:26:18.176820 IP tom-Latitude-3570.49070 > c-185-45-236-223.customer.ggaweb.ch.8333: tcp 0
08:26:18.177161 IP tom-Latitude-3570.49070 > c-185-45-236-223.customer.ggaweb.ch.8333: tcp 24
08:26:18.177243 IP tom-Latitude-3570.57976 > 167.99.216.145.8333: tcp 24
08:26:18.178342 IP tom-Latitude-3570.49070 > c-185-45-236-223.customer.ggaweb.ch.8333: tcp 37
08:26:18.179026 IP tom-Latitude-3570.57976 > 167.99.216.145.8333: tcp 289
08:26:18.214390 IP c-185-45-236-223.customer.ggaweb.ch.8333 > tom-Latitude-3570.49070: tcp 24
08:26:18.215205 IP c-185-45-236-223.customer.ggaweb.ch.8333 > tom-Latitude-3570.49070: tcp 284
08:26:18.215222 IP c-185-45-236-223.customer.ggaweb.ch.8333 > tom-Latitude-3570.49070: tcp 24
08:26:18.215225 IP c-185-45-236-223.customer.ggaweb.ch.8333 > tom-Latitude-3570.49070: tcp 284
08:26:18.215230 IP c-185-45-236-223.customer.ggaweb.ch.8333 > tom-Latitude-3570.49070: tcp 24
08:26:18.215232 IP c-185-45-236-223.customer.ggaweb.ch.8333 > tom-Latitude-3570.49070: tcp 283
08:26:18.215252 IP c-185-45-236-223.customer.ggaweb.ch.8333 > tom-Latitude-3570.49070: tcp 24
08:26:18.215255 IP c-185-45-236-223.customer.ggaweb.ch.8333 > tom-Latitude-3570.49070: tcp 284
08:26:18.215317 IP tom-Latitude-3570.49070 > c-185-45-236-223.customer.ggaweb.ch.8333: tcp 0
08:26:18.215711 IP tom-Latitude-3570.49070 > c-185-45-236-223.customer.ggaweb.ch.8333: tcp 24
08:26:18.215763 IP tom-Latitude-3570.49070 > c-185-45-236-223.customer.ggaweb.ch.8333: tcp 37
08:26:18.216946 IP tom-Latitude-3570.49070 > c-185-45-236-223.customer.ggaweb.ch.8333: tcp 183
08:26:18.218084 IP 167.99.216.145.8333 > tom-Latitude-3570.57976: tcp 0
08:26:18.218096 IP c-185-45-236-223.customer.ggaweb.ch.8333 > tom-Latitude-3570.49070: tcp 0
08:26:18.218100 IP 167.99.216.145.8333 > tom-Latitude-3570.57976: tcp 0
08:26:18.258375 IP c-185-45-236-223.customer.ggaweb.ch.8333 > tom-Latitude-3570.49070: tcp 0
08:26:18.297736 IP c-185-45-236-223.customer.ggaweb.ch.8333 > tom-Latitude-3570.49070: tcp 0
08:26:18.308324 IP c-185-45-236-223.customer.ggaweb.ch.8333 > tom-Latitude-3570.49070: tcp 24
08:26:18.308344 IP c-185-45-236-223.customer.ggaweb.ch.8333 > tom-Latitude-3570.49070: tcp 284
08:26:18.308436 IP tom-Latitude-3570.49070 > c-185-45-236-223.customer.ggaweb.ch.8333: tcp 0
08:26:18.308814 IP tom-Latitude-3570.49070 > c-185-45-236-223.customer.ggaweb.ch.8333: tcp 24
08:26:18.309955 IP tom-Latitude-3570.49070 > c-185-45-236-223.customer.ggaweb.ch.8333: tcp 37
08:26:18.345627 IP c-185-45-236-223.customer.ggaweb.ch.8333 > tom-Latitude-3570.49070: tcp 24
08:26:18.346329 IP c-185-45-236-223.customer.ggaweb.ch.8333 > tom-Latitude-3570.49070: tcp 284
08:26:18.346352 IP c-185-45-236-223.customer.ggaweb.ch.8333 > tom-Latitude-3570.49070: tcp 24
08:26:18.346354 IP c-185-45-236-223.customer.ggaweb.ch.8333 > tom-Latitude-3570.49070: tcp 37
08:26:18.346356 IP c-185-45-236-223.customer.ggaweb.ch.8333 > tom-Latitude-3570.49070: tcp 24
08:26:18.346377 IP c-185-45-236-223.customer.ggaweb.ch.8333 > tom-Latitude-3570.49070: tcp 284
08:26:18.346382 IP c-185-45-236-223.customer.ggaweb.ch.8333 > tom-Latitude-3570.49070: tcp 24
08:26:18.346384 IP c-185-45-236-223.customer.ggaweb.ch.8333 > tom-Latitude-3570.49070: tcp 284
