03:50:26.354251 IP tom-Latitude-3570.46284 > static-87-75-105-186.vodafonexdsl.co.uk.8333: tcp 24
03:50:26.356355 IP tom-Latitude-3570.46284 > static-87-75-105-186.vodafonexdsl.co.uk.8333: tcp 217
03:50:26.414331 IP static-87-75-105-186.vodafonexdsl.co.uk.8333 > tom-Latitude-3570.46284: tcp 0
03:50:26.414346 IP static-87-75-105-186.vodafonexdsl.co.uk.8333 > tom-Latitude-3570.46284: tcp 0
03:50:26.454715 IP tom-Latitude-3570.60470 > bb42-60-217-183.singnet.com.sg.8333: tcp 24
03:50:26.455659 IP tom-Latitude-3570.60470 > bb42-60-217-183.singnet.com.sg.8333: tcp 469
03:50:26.487847 IP bb42-60-217-183.singnet.com.sg.8333 > tom-Latitude-3570.60470: tcp 0
03:50:26.495607 IP bb42-60-217-183.singnet.com.sg.8333 > tom-Latitude-3570.60470: tcp 0
03:50:26.540850 IP bb42-60-217-183.singnet.com.sg.8333 > tom-Latitude-3570.60470: tcp 24
03:50:26.540871 IP bb42-60-217-183.singnet.com.sg.8333 > tom-Latitude-3570.60470: tcp 577
03:50:26.540916 IP tom-Latitude-3570.60470 > bb42-60-217-183.singnet.com.sg.8333: tcp 0
03:50:26.541194 IP tom-Latitude-3570.60470 > bb42-60-217-183.singnet.com.sg.8333: tcp 24
03:50:26.542521 IP tom-Latitude-3570.60470 > bb42-60-217-183.singnet.com.sg.8333: tcp 109
03:50:26.576269 IP bb42-60-217-183.singnet.com.sg.8333 > tom-Latitude-3570.60470: tcp 0
03:50:26.576277 IP bb42-60-217-183.singnet.com.sg.8333 > tom-Latitude-3570.60470: tcp 0
03:50:26.842121 IP tom-Latitude-3570.42516 > 2.56.9.15.8333: tcp 24
03:50:26.845105 IP tom-Latitude-3570.42516 > 2.56.9.15.8333: tcp 469
03:50:26.877752 IP 2.56.9.15.8333 > tom-Latitude-3570.42516: tcp 0
03:50:26.885623 IP 2.56.9.15.8333 > tom-Latitude-3570.42516: tcp 0
03:50:26.952655 IP bb42-60-217-183.singnet.com.sg.8333 > tom-Latitude-3570.60470: tcp 24
03:50:26.953632 IP bb42-60-217-183.singnet.com.sg.8333 > tom-Latitude-3570.60470: tcp 225
03:50:26.953650 IP bb42-60-217-183.singnet.com.sg.8333 > tom-Latitude-3570.60470: tcp 24
03:50:26.953656 IP bb42-60-217-183.singnet.com.sg.8333 > tom-Latitude-3570.60470: tcp 192
03:50:26.953659 IP bb42-60-217-183.singnet.com.sg.8333 > tom-Latitude-3570.60470: tcp 24
03:50:26.953662 IP bb42-60-217-183.singnet.com.sg.8333 > tom-Latitude-3570.60470: tcp 371
03:50:26.953719 IP tom-Latitude-3570.60470 > bb42-60-217-183.singnet.com.sg.8333: tcp 0
03:50:27.220313 IP static-87-75-105-186.vodafonexdsl.co.uk.8333 > tom-Latitude-3570.46284: tcp 24
03:50:27.232566 IP static-87-75-105-186.vodafonexdsl.co.uk.8333 > tom-Latitude-3570.46284: tcp 289
03:50:27.232630 IP tom-Latitude-3570.46284 > static-87-75-105-186.vodafonexdsl.co.uk.8333: tcp 0
03:50:27.232901 IP tom-Latitude-3570.46284 > static-87-75-105-186.vodafonexdsl.co.uk.8333: tcp 24
03:50:27.233982 IP tom-Latitude-3570.46284 > static-87-75-105-186.vodafonexdsl.co.uk.8333: tcp 181
03:50:27.263111 IP static-87-75-105-186.vodafonexdsl.co.uk.8333 > tom-Latitude-3570.46284: tcp 0
03:50:27.263125 IP static-87-75-105-186.vodafonexdsl.co.uk.8333 > tom-Latitude-3570.46284: tcp 0
03:50:27.326506 IP static-87-75-105-186.vodafonexdsl.co.uk.8333 > tom-Latitude-3570.46284: tcp 24
03:50:27.327095 IP static-87-75-105-186.vodafonexdsl.co.uk.8333 > tom-Latitude-3570.46284: tcp 252
03:50:27.327114 IP static-87-75-105-186.vodafonexdsl.co.uk.8333 > tom-Latitude-3570.46284: tcp 24
03:50:27.327160 IP tom-Latitude-3570.46284 > static-87-75-105-186.vodafonexdsl.co.uk.8333: tcp 0
03:50:27.327369 IP tom-Latitude-3570.57976 > 167.99.216.145.8333: tcp 24
03:50:27.329250 IP tom-Latitude-3570.57976 > 167.99.216.145.8333: tcp 109
03:50:27.334432 IP static-87-75-105-186.vodafonexdsl.co.uk.8333 > tom-Latitude-3570.46284: tcp 192
03:50:27.335104 IP static-87-75-105-186.vodafonexdsl.co.uk.8333 > tom-Latitude-3570.46284: tcp 24
03:50:27.335131 IP static-87-75-105-186.vodafonexdsl.co.uk.8333 > tom-Latitude-3570.46284: tcp 246
03:50:27.335135 IP static-87-75-105-186.vodafonexdsl.co.uk.8333 > tom-Latitude-3570.46284: tcp 24
03:50:27.335137 IP static-87-75-105-186.vodafonexdsl.co.uk.8333 > tom-Latitude-3570.46284: tcp 283
03:50:27.335140 IP static-87-75-105-186.vodafonexdsl.co.uk.8333 > tom-Latitude-3570.46284: tcp 24
03:50:27.335142 IP static-87-75-105-186.vodafonexdsl.co.uk.8333 > tom-Latitude-3570.46284: tcp 284
03:50:27.335164 IP tom-Latitude-3570.46284 > static-87-75-105-186.vodafonexdsl.co.uk.8333: tcp 0
03:50:27.365435 IP 167.99.216.145.8333 > tom-Latitude-3570.57976: tcp 0
03:50:27.366057 IP 167.99.216.145.8333 > tom-Latitude-3570.57976: tcp 0
03:50:27.638812 IP tom-Latitude-3570.57976 > 167.99.216.145.8333: tcp 24
03:50:27.640167 IP tom-Latitude-3570.57976 > 167.99.216.145.8333: tcp 181
03:50:27.640734 IP ns3113832.ip-54-38-177.eu.8333 > tom-Latitude-3570.56714: tcp 24
03:50:27.640756 IP ns3113832.ip-54-38-177.eu.8333 > tom-Latitude-3570.56714: tcp 505
03:50:27.640799 IP tom-Latitude-3570.56714 > ns3113832.ip-54-38-177.eu.8333: tcp 0
03:50:27.685314 IP 167.99.216.145.8333 > tom-Latitude-3570.57976: tcp 0
03:50:27.685939 IP 167.99.216.145.8333 > tom-Latitude-3570.57976: tcp 0
03:50:27.741481 IP tom-Latitude-3570.39110 > vmi195435.contaboserver.net.8333: tcp 24
03:50:27.744732 IP tom-Latitude-3570.39110 > vmi195435.contaboserver.net.8333: tcp 289
03:50:27.777516 IP vmi195435.contaboserver.net.8333 > tom-Latitude-3570.39110: tcp 0
03:50:27.783660 IP vmi195435.contaboserver.net.8333 > tom-Latitude-3570.39110: tcp 0
03:50:28.003060 IP 2.56.9.15.8333 > tom-Latitude-3570.42516: tcp 24
03:50:28.003082 IP 2.56.9.15.8333 > tom-Latitude-3570.42516: tcp 505
03:50:28.003148 IP tom-Latitude-3570.42516 > 2.56.9.15.8333: tcp 0
03:50:28.003466 IP tom-Latitude-3570.42516 > 2.56.9.15.8333: tcp 24
03:50:28.004528 IP tom-Latitude-3570.42516 > 2.56.9.15.8333: tcp 217
03:50:28.045301 IP 2.56.9.15.8333 > tom-Latitude-3570.42516: tcp 0
03:50:28.045890 IP 2.56.9.15.8333 > tom-Latitude-3570.42516: tcp 0
03:50:28.144681 IP 2.56.9.15.8333 > tom-Latitude-3570.42516: tcp 24
03:50:28.145531 IP 2.56.9.15.8333 > tom-Latitude-3570.42516: tcp 226
03:50:28.145551 IP 2.56.9.15.8333 > tom-Latitude-3570.42516: tcp 24
03:50:28.145555 IP 2.56.9.15.8333 > tom-Latitude-3570.42516: tcp 404
03:50:28.145558 IP 2.56.9.15.8333 > tom-Latitude-3570.42516: tcp 24
03:50:28.145561 IP 2.56.9.15.8333 > tom-Latitude-3570.42516: tcp 217
03:50:28.145564 IP 2.56.9.15.8333 > tom-Latitude-3570.42516: tcp 24
03:50:28.145566 IP 2.56.9.15.8333 > tom-Latitude-3570.42516: tcp 283
03:50:28.145568 IP 2.56.9.15.8333 > tom-Latitude-3570.42516: tcp 24
03:50:28.145571 IP 2.56.9.15.8333 > tom-Latitude-3570.42516: tcp 283
03:50:28.145600 IP tom-Latitude-3570.42516 > 2.56.9.15.8333: tcp 0
03:50:28.236275 IP 2.56.9.15.8333 > tom-Latitude-3570.42516: tcp 308
03:50:28.236514 IP tom-Latitude-3570.39110 > vmi195435.contaboserver.net.8333: tcp 24
03:50:28.236613 IP tom-Latitude-3570.56714 > ns3113832.ip-54-38-177.eu.8333: tcp 24
03:50:28.239467 IP tom-Latitude-3570.39110 > vmi195435.contaboserver.net.8333: tcp 181
03:50:28.240043 IP tom-Latitude-3570.56714 > ns3113832.ip-54-38-177.eu.8333: tcp 181
03:50:28.253328 IP 81.198.101.144.8333 > tom-Latitude-3570.60988: tcp 24
03:50:28.254072 IP 81.198.101.144.8333 > tom-Latitude-3570.60988: tcp 937
03:50:28.254136 IP tom-Latitude-3570.60988 > 81.198.101.144.8333: tcp 0
03:50:28.256986 IP vmi195435.contaboserver.net.8333 > tom-Latitude-3570.39110: tcp 0
03:50:28.268174 IP ns3113832.ip-54-38-177.eu.8333 > tom-Latitude-3570.56714: tcp 0
03:50:28.273303 IP vmi195435.contaboserver.net.8333 > tom-Latitude-3570.39110: tcp 0
03:50:28.274362 IP ns3113832.ip-54-38-177.eu.8333 > tom-Latitude-3570.56714: tcp 0
03:50:28.279904 IP tom-Latitude-3570.42516 > 2.56.9.15.8333: tcp 0
03:50:28.331321 IP ns3113832.ip-54-38-177.eu.8333 > tom-Latitude-3570.56714: tcp 24
03:50:28.331881 IP ns3113832.ip-54-38-177.eu.8333 > tom-Latitude-3570.56714: tcp 181
03:50:28.331968 IP tom-Latitude-3570.56714 > ns3113832.ip-54-38-177.eu.8333: tcp 0
03:50:28.332138 IP tom-Latitude-3570.56714 > ns3113832.ip-54-38-177.eu.8333: tcp 24
03:50:28.332209 IP tom-Latitude-3570.56714 > ns3113832.ip-54-38-177.eu.8333: tcp 1202
03:50:28.333529 IP tom-Latitude-3570.56714 > ns3113832.ip-54-38-177.eu.8333: tcp 307
03:50:28.369097 IP ns3113832.ip-54-38-177.eu.8333 > tom-Latitude-3570.56714: tcp 0
03:50:28.369112 IP ns3113832.ip-54-38-177.eu.8333 > tom-Latitude-3570.56714: tcp 0
03:50:28.369115 IP ns3113832.ip-54-38-177.eu.8333 > tom-Latitude-3570.56714: tcp 0
03:50:28.532956 IP tom-Latitude-3570.39110 > vmi195435.contaboserver.net.8333: tcp 24
03:50:28.535160 IP tom-Latitude-3570.39110 > vmi195435.contaboserver.net.8333: tcp 37
03:50:28.566082 IP vmi195435.contaboserver.net.8333 > tom-Latitude-3570.39110: tcp 0
03:50:28.575347 IP vmi195435.contaboserver.net.8333 > tom-Latitude-3570.39110: tcp 0
03:50:28.834044 IP tom-Latitude-3570.57976 > 167.99.216.145.8333: tcp 24
03:50:28.836057 IP tom-Latitude-3570.57976 > 167.99.216.145.8333: tcp 217
03:50:28.876461 IP 167.99.216.145.8333 > tom-Latitude-3570.57976: tcp 0
03:50:28.885004 IP 167.99.216.145.8333 > tom-Latitude-3570.57976: tcp 0
03:50:29.536449 IP tom-Latitude-3570.60988 > 81.198.101.144.8333: tcp 24
03:50:29.536551 IP tom-Latitude-3570.60470 > bb42-60-217-183.singnet.com.sg.8333: tcp 24
03:50:29.539397 IP tom-Latitude-3570.60988 > 81.198.101.144.8333: tcp 37
03:50:29.540026 IP tom-Latitude-3570.60470 > bb42-60-217-183.singnet.com.sg.8333: tcp 397
03:50:29.594701 IP ns3113832.ip-54-38-177.eu.8333 > tom-Latitude-3570.56714: tcp 24
03:50:29.597599 IP ns3113832.ip-54-38-177.eu.8333 > tom-Latitude-3570.56714: tcp 577
03:50:29.597618 IP bb42-60-217-183.singnet.com.sg.8333 > tom-Latitude-3570.60470: tcp 0
03:50:29.597626 IP 81.198.101.144.8333 > tom-Latitude-3570.60988: tcp 0
03:50:29.597631 IP bb42-60-217-183.singnet.com.sg.8333 > tom-Latitude-3570.60470: tcp 0
03:50:29.597663 IP tom-Latitude-3570.56714 > ns3113832.ip-54-38-177.eu.8333: tcp 0
03:50:29.598011 IP tom-Latitude-3570.56714 > ns3113832.ip-54-38-177.eu.8333: tcp 24
03:50:29.599254 IP tom-Latitude-3570.56714 > ns3113832.ip-54-38-177.eu.8333: tcp 541
03:50:29.635519 IP ns3113832.ip-54-38-177.eu.8333 > tom-Latitude-3570.56714: tcp 0
03:50:29.636094 IP ns3113832.ip-54-38-177.eu.8333 > tom-Latitude-3570.56714: tcp 0
03:50:29.694912 IP ns3113832.ip-54-38-177.eu.8333 > tom-Latitude-3570.56714: tcp 24
03:50:29.695865 IP ns3113832.ip-54-38-177.eu.8333 > tom-Latitude-3570.56714: tcp 1134
03:50:29.695884 IP ns3113832.ip-54-38-177.eu.8333 > tom-Latitude-3570.56714: tcp 24
03:50:29.695888 IP ns3113832.ip-54-38-177.eu.8333 > tom-Latitude-3570.56714: tcp 283
03:50:29.695891 IP ns3113832.ip-54-38-177.eu.8333 > tom-Latitude-3570.56714: tcp 24
03:50:29.695894 IP ns3113832.ip-54-38-177.eu.8333 > tom-Latitude-3570.56714: tcp 284
03:50:29.695897 IP ns3113832.ip-54-38-177.eu.8333 > tom-Latitude-3570.56714: tcp 24
03:50:29.695900 IP ns3113832.ip-54-38-177.eu.8333 > tom-Latitude-3570.56714: tcp 283
03:50:29.695902 IP ns3113832.ip-54-38-177.eu.8333 > tom-Latitude-3570.56714: tcp 24
03:50:29.695904 IP ns3113832.ip-54-38-177.eu.8333 > tom-Latitude-3570.56714: tcp 283
03:50:29.695931 IP tom-Latitude-3570.56714 > ns3113832.ip-54-38-177.eu.8333: tcp 0
03:50:29.752155 IP ns3113832.ip-54-38-177.eu.8333 > tom-Latitude-3570.56714: tcp 1350
03:50:29.752378 IP ns3113832.ip-54-38-177.eu.8333 > tom-Latitude-3570.56714: tcp 1350
03:50:29.752391 IP ns3113832.ip-54-38-177.eu.8333 > tom-Latitude-3570.56714: tcp 374
03:50:29.752395 IP ns3113832.ip-54-38-177.eu.8333 > tom-Latitude-3570.56714: tcp 24
03:50:29.752398 IP ns3113832.ip-54-38-177.eu.8333 > tom-Latitude-3570.56714: tcp 37
03:50:29.752436 IP tom-Latitude-3570.56714 > ns3113832.ip-54-38-177.eu.8333: tcp 0
03:50:29.754800 IP tom-Latitude-3570.56714 > ns3113832.ip-54-38-177.eu.8333: tcp 24
03:50:29.755493 IP tom-Latitude-3570.56714 > ns3113832.ip-54-38-177.eu.8333: tcp 37
03:50:29.785503 IP ns3113832.ip-54-38-177.eu.8333 > tom-Latitude-3570.56714: tcp 0
03:50:29.786112 IP ns3113832.ip-54-38-177.eu.8333 > tom-Latitude-3570.56714: tcp 0
03:50:29.843625 IP ns3113832.ip-54-38-177.eu.8333 > tom-Latitude-3570.56714: tcp 24
03:50:29.843645 IP ns3113832.ip-54-38-177.eu.8333 > tom-Latitude-3570.56714: tcp 468
03:50:29.843730 IP tom-Latitude-3570.56714 > ns3113832.ip-54-38-177.eu.8333: tcp 0
03:50:29.944902 IP tom-Latitude-3570.49070 > c-185-45-236-223.customer.ggaweb.ch.8333: tcp 24
03:50:29.944923 IP tom-Latitude-3570.49070 > c-185-45-236-223.customer.ggaweb.ch.8333: tcp 1261
03:50:29.985699 IP c-185-45-236-223.customer.ggaweb.ch.8333 > tom-Latitude-3570.49070: tcp 0
03:50:30.025441 IP c-185-45-236-223.customer.ggaweb.ch.8333 > tom-Latitude-3570.49070: tcp 0
03:50:30.461496 IP 2.56.9.15.8333 > tom-Latitude-3570.42516: tcp 24
03:50:30.461522 IP tom-Latitude-3570.42516 > 2.56.9.15.8333: tcp 0
03:50:30.461541 IP 2.56.9.15.8333 > tom-Latitude-3570.42516: tcp 793
03:50:30.461546 IP tom-Latitude-3570.42516 > 2.56.9.15.8333: tcp 0
03:50:30.461550 IP 2.56.9.15.8333 > tom-Latitude-3570.42516: tcp 793
03:50:30.461553 IP tom-Latitude-3570.42516 > 2.56.9.15.8333: tcp 0
03:50:30.461930 IP tom-Latitude-3570.42516 > 2.56.9.15.8333: tcp 24
03:50:30.465958 IP tom-Latitude-3570.42516 > 2.56.9.15.8333: tcp 289
03:50:30.504912 IP 2.56.9.15.8333 > tom-Latitude-3570.42516: tcp 0
03:50:30.505481 IP 2.56.9.15.8333 > tom-Latitude-3570.42516: tcp 0
03:50:30.665488 IP 2.56.9.15.8333 > tom-Latitude-3570.42516: tcp 24
03:50:30.665508 IP 2.56.9.15.8333 > tom-Latitude-3570.42516: tcp 248
03:50:30.665513 IP 2.56.9.15.8333 > tom-Latitude-3570.42516: tcp 24
03:50:30.665516 IP 2.56.9.15.8333 > tom-Latitude-3570.42516: tcp 390
03:50:30.665520 IP 2.56.9.15.8333 > tom-Latitude-3570.42516: tcp 24
03:50:30.665523 IP 2.56.9.15.8333 > tom-Latitude-3570.42516: tcp 284
03:50:30.665527 IP 2.56.9.15.8333 > tom-Latitude-3570.42516: tcp 24
03:50:30.665530 IP 2.56.9.15.8333 > tom-Latitude-3570.42516: tcp 284
03:50:30.665567 IP 2.56.9.15.8333 > tom-Latitude-3570.42516: tcp 24
03:50:30.665572 IP 2.56.9.15.8333 > tom-Latitude-3570.42516: tcp 284
03:50:30.665578 IP tom-Latitude-3570.42516 > 2.56.9.15.8333: tcp 0
03:50:30.665642 IP tom-Latitude-3570.42516 > 2.56.9.15.8333: tcp 0
03:50:30.702906 IP 2.56.9.15.8333 > tom-Latitude-3570.42516: tcp 923
03:50:30.743911 IP tom-Latitude-3570.42516 > 2.56.9.15.8333: tcp 0
03:50:30.804381 IP tom-Latitude-3570.60988 > 81.198.101.144.8333: tcp 24
03:50:30.805316 IP tom-Latitude-3570.60988 > 81.198.101.144.8333: tcp 865
03:50:30.844225 IP 81.198.101.144.8333 > tom-Latitude-3570.60988: tcp 0
03:50:30.973591 IP c-185-45-236-223.customer.ggaweb.ch.8333 > tom-Latitude-3570.49070: tcp 24
03:50:30.973614 IP c-185-45-236-223.customer.ggaweb.ch.8333 > tom-Latitude-3570.49070: tcp 1261
03:50:30.973656 IP tom-Latitude-3570.49070 > c-185-45-236-223.customer.ggaweb.ch.8333: tcp 0
03:50:30.974110 IP tom-Latitude-3570.49070 > c-185-45-236-223.customer.ggaweb.ch.8333: tcp 24
03:50:30.975576 IP tom-Latitude-3570.49070 > c-185-45-236-223.customer.ggaweb.ch.8333: tcp 505
03:50:31.014729 IP c-185-45-236-223.customer.ggaweb.ch.8333 > tom-Latitude-3570.49070: tcp 0
03:50:31.015398 IP c-185-45-236-223.customer.ggaweb.ch.8333 > tom-Latitude-3570.49070: tcp 0
03:50:31.074458 IP tom-Latitude-3570.42516 > 2.56.9.15.8333: tcp 24
03:50:31.075392 IP tom-Latitude-3570.42516 > 2.56.9.15.8333: tcp 73
03:50:31.106538 IP c-185-45-236-223.customer.ggaweb.ch.8333 > tom-Latitude-3570.49070: tcp 24
03:50:31.106559 IP c-185-45-236-223.customer.ggaweb.ch.8333 > tom-Latitude-3570.49070: tcp 1200
03:50:31.106564 IP c-185-45-236-223.customer.ggaweb.ch.8333 > tom-Latitude-3570.49070: tcp 24
03:50:31.106603 IP tom-Latitude-3570.49070 > c-185-45-236-223.customer.ggaweb.ch.8333: tcp 0
03:50:31.116655 IP c-185-45-236-223.customer.ggaweb.ch.8333 > tom-Latitude-3570.49070: tcp 1382
03:50:31.118549 IP c-185-45-236-223.customer.ggaweb.ch.8333 > tom-Latitude-3570.49070: tcp 66
03:50:31.118563 IP tom-Latitude-3570.49070 > c-185-45-236-223.customer.ggaweb.ch.8333: tcp 0
03:50:31.118616 IP c-185-45-236-223.customer.ggaweb.ch.8333 > tom-Latitude-3570.49070: tcp 1448
03:50:31.118625 IP c-185-45-236-223.customer.ggaweb.ch.8333 > tom-Latitude-3570.49070: tcp 1448
03:50:31.118629 IP c-185-45-236-223.customer.ggaweb.ch.8333 > tom-Latitude-3570.49070: tcp 1448
03:50:31.118640 IP c-185-45-236-223.customer.ggaweb.ch.8333 > tom-Latitude-3570.49070: tcp 1448
03:50:31.118647 IP c-185-45-236-223.customer.ggaweb.ch.8333 > tom-Latitude-3570.49070: tcp 1448
03:50:31.118671 IP c-185-45-236-223.customer.ggaweb.ch.8333 > tom-Latitude-3570.49070: tcp 1448
03:50:31.118675 IP 2.56.9.15.8333 > tom-Latitude-3570.42516: tcp 0
03:50:31.118679 IP tom-Latitude-3570.49070 > c-185-45-236-223.customer.ggaweb.ch.8333: tcp 0
03:50:31.118684 IP 2.56.9.15.8333 > tom-Latitude-3570.42516: tcp 0
03:50:31.118746 IP tom-Latitude-3570.49070 > c-185-45-236-223.customer.ggaweb.ch.8333: tcp 0
03:50:31.189064 IP c-185-45-236-223.customer.ggaweb.ch.8333 > tom-Latitude-3570.49070: tcp 1382
03:50:31.189901 IP c-185-45-236-223.customer.ggaweb.ch.8333 > tom-Latitude-3570.49070: tcp 66
03:50:31.189918 IP tom-Latitude-3570.49070 > c-185-45-236-223.customer.ggaweb.ch.8333: tcp 0
03:50:31.200284 IP c-185-45-236-223.customer.ggaweb.ch.8333 > tom-Latitude-3570.49070: tcp 1382
03:50:31.201601 IP c-185-45-236-223.customer.ggaweb.ch.8333 > tom-Latitude-3570.49070: tcp 66
03:50:31.201618 IP tom-Latitude-3570.49070 > c-185-45-236-223.customer.ggaweb.ch.8333: tcp 0
03:50:31.201642 IP c-185-45-236-223.customer.ggaweb.ch.8333 > tom-Latitude-3570.49070: tcp 1448
03:50:31.201650 IP c-185-45-236-223.customer.ggaweb.ch.8333 > tom-Latitude-3570.49070: tcp 1448
03:50:31.201655 IP c-185-45-236-223.customer.ggaweb.ch.8333 > tom-Latitude-3570.49070: tcp 1448
03:50:31.201659 IP c-185-45-236-223.customer.ggaweb.ch.8333 > tom-Latitude-3570.49070: tcp 266
03:50:31.201701 IP tom-Latitude-3570.49070 > c-185-45-236-223.customer.ggaweb.ch.8333: tcp 0
03:50:31.215570 IP tom-Latitude-3570.56714 > ns3113832.ip-54-38-177.eu.8333: tcp 24
03:50:31.216304 IP tom-Latitude-3570.56714 > ns3113832.ip-54-38-177.eu.8333: tcp 469
03:50:31.265439 IP ns3113832.ip-54-38-177.eu.8333 > tom-Latitude-3570.56714: tcp 0
03:50:31.690629 IP static-87-75-105-186.vodafonexdsl.co.uk.8333 > tom-Latitude-3570.46284: tcp 24
03:50:31.690651 IP static-87-75-105-186.vodafonexdsl.co.uk.8333 > tom-Latitude-3570.46284: tcp 1261
03:50:31.690656 IP static-87-75-105-186.vodafonexdsl.co.uk.8333 > tom-Latitude-3570.46284: tcp 24
03:50:31.690659 IP static-87-75-105-186.vodafonexdsl.co.uk.8333 > tom-Latitude-3570.46284: tcp 397
03:50:31.690696 IP tom-Latitude-3570.46284 > static-87-75-105-186.vodafonexdsl.co.uk.8333: tcp 0
03:50:31.690911 IP vmi195435.contaboserver.net.8333 > tom-Latitude-3570.39110: tcp 24
03:50:31.690927 IP tom-Latitude-3570.39110 > vmi195435.contaboserver.net.8333: tcp 0
03:50:31.690942 IP vmi195435.contaboserver.net.8333 > tom-Latitude-3570.39110: tcp 1261
03:50:31.690947 IP tom-Latitude-3570.39110 > vmi195435.contaboserver.net.8333: tcp 0
03:50:31.690954 IP static-87-75-105-186.vodafonexdsl.co.uk.8333 > tom-Latitude-3570.46284: tcp 397
03:50:31.690959 IP tom-Latitude-3570.46284 > static-87-75-105-186.vodafonexdsl.co.uk.8333: tcp 0
03:50:31.691184 IP tom-Latitude-3570.46284 > static-87-75-105-186.vodafonexdsl.co.uk.8333: tcp 24
03:50:31.691448 IP tom-Latitude-3570.39110 > vmi195435.contaboserver.net.8333: tcp 24
03:50:31.694720 IP tom-Latitude-3570.46284 > static-87-75-105-186.vodafonexdsl.co.uk.8333: tcp 109
03:50:31.695944 IP tom-Latitude-3570.39110 > vmi195435.contaboserver.net.8333: tcp 37
03:50:31.735846 IP static-87-75-105-186.vodafonexdsl.co.uk.8333 > tom-Latitude-3570.46284: tcp 0
03:50:31.736436 IP static-87-75-105-186.vodafonexdsl.co.uk.8333 > tom-Latitude-3570.46284: tcp 0
03:50:31.736453 IP vmi195435.contaboserver.net.8333 > tom-Latitude-3570.39110: tcp 0
03:50:31.736458 IP vmi195435.contaboserver.net.8333 > tom-Latitude-3570.39110: tcp 0
03:50:31.803967 IP static-87-75-105-186.vodafonexdsl.co.uk.8333 > tom-Latitude-3570.46284: tcp 24
03:50:31.803987 IP static-87-75-105-186.vodafonexdsl.co.uk.8333 > tom-Latitude-3570.46284: tcp 404
03:50:31.803993 IP static-87-75-105-186.vodafonexdsl.co.uk.8333 > tom-Latitude-3570.46284: tcp 24
03:50:31.803997 IP static-87-75-105-186.vodafonexdsl.co.uk.8333 > tom-Latitude-3570.46284: tcp 404
03:50:31.803999 IP static-87-75-105-186.vodafonexdsl.co.uk.8333 > tom-Latitude-3570.46284: tcp 24
03:50:31.804034 IP tom-Latitude-3570.46284 > static-87-75-105-186.vodafonexdsl.co.uk.8333: tcp 0
03:50:31.806660 IP static-87-75-105-186.vodafonexdsl.co.uk.8333 > tom-Latitude-3570.46284: tcp 404
03:50:31.813946 IP vmi195435.contaboserver.net.8333 > tom-Latitude-3570.39110: tcp 24
03:50:31.814556 IP vmi195435.contaboserver.net.8333 > tom-Latitude-3570.39110: tcp 223
03:50:31.814642 IP tom-Latitude-3570.39110 > vmi195435.contaboserver.net.8333: tcp 0
03:50:31.825896 IP vmi195435.contaboserver.net.8333 > tom-Latitude-3570.39110: tcp 24
03:50:31.826938 IP vmi195435.contaboserver.net.8333 > tom-Latitude-3570.39110: tcp 289
03:50:31.826998 IP tom-Latitude-3570.39110 > vmi195435.contaboserver.net.8333: tcp 0
03:50:31.827215 IP tom-Latitude-3570.39110 > vmi195435.contaboserver.net.8333: tcp 24
03:50:31.828477 IP tom-Latitude-3570.39110 > vmi195435.contaboserver.net.8333: tcp 37
03:50:31.847790 IP tom-Latitude-3570.46284 > static-87-75-105-186.vodafonexdsl.co.uk.8333: tcp 0
03:50:31.865585 IP vmi195435.contaboserver.net.8333 > tom-Latitude-3570.39110: tcp 0
03:50:31.866210 IP vmi195435.contaboserver.net.8333 > tom-Latitude-3570.39110: tcp 0
03:50:31.943728 IP vmi195435.contaboserver.net.8333 > tom-Latitude-3570.39110: tcp 24
03:50:31.944392 IP vmi195435.contaboserver.net.8333 > tom-Latitude-3570.39110: tcp 192
03:50:31.944453 IP tom-Latitude-3570.39110 > vmi195435.contaboserver.net.8333: tcp 0
03:50:31.961852 IP bb42-60-217-183.singnet.com.sg.8333 > tom-Latitude-3570.60470: tcp 24
03:50:31.961875 IP bb42-60-217-183.singnet.com.sg.8333 > tom-Latitude-3570.60470: tcp 1261
03:50:31.961917 IP tom-Latitude-3570.60470 > bb42-60-217-183.singnet.com.sg.8333: tcp 0
03:50:31.962455 IP tom-Latitude-3570.42516 > 2.56.9.15.8333: tcp 24
03:50:31.965437 IP tom-Latitude-3570.42516 > 2.56.9.15.8333: tcp 685
03:50:32.005778 IP 2.56.9.15.8333 > tom-Latitude-3570.42516: tcp 0
03:50:32.006427 IP 2.56.9.15.8333 > tom-Latitude-3570.42516: tcp 0
03:50:32.202334 IP bb42-60-217-183.singnet.com.sg.8333 > tom-Latitude-3570.60470: tcp 24
03:50:32.202355 IP bb42-60-217-183.singnet.com.sg.8333 > tom-Latitude-3570.60470: tcp 253
03:50:32.202400 IP tom-Latitude-3570.60470 > bb42-60-217-183.singnet.com.sg.8333: tcp 0
03:50:32.604077 IP tom-Latitude-3570.60988 > 81.198.101.144.8333: tcp 24
03:50:32.606346 IP tom-Latitude-3570.60988 > 81.198.101.144.8333: tcp 685
03:50:32.612058 IP 2.56.9.15.8333 > tom-Latitude-3570.42516: tcp 24
03:50:32.612083 IP tom-Latitude-3570.42516 > 2.56.9.15.8333: tcp 0
03:50:32.612101 IP 2.56.9.15.8333 > tom-Latitude-3570.42516: tcp 109
03:50:32.612106 IP tom-Latitude-3570.42516 > 2.56.9.15.8333: tcp 0
03:50:32.612350 IP tom-Latitude-3570.42516 > 2.56.9.15.8333: tcp 24
03:50:32.615076 IP tom-Latitude-3570.42516 > 2.56.9.15.8333: tcp 109
03:50:32.644645 IP 81.198.101.144.8333 > tom-Latitude-3570.60988: tcp 0
03:50:32.644659 IP 2.56.9.15.8333 > tom-Latitude-3570.42516: tcp 0
03:50:32.652285 IP 2.56.9.15.8333 > tom-Latitude-3570.42516: tcp 0
03:50:32.713047 IP tom-Latitude-3570.57976 > 167.99.216.145.8333: tcp 24
03:50:32.713068 IP tom-Latitude-3570.57976 > 167.99.216.145.8333: tcp 1261
03:50:32.720045 IP vmi195435.contaboserver.net.8333 > tom-Latitude-3570.39110: tcp 24
03:50:32.721028 IP vmi195435.contaboserver.net.8333 > tom-Latitude-3570.39110: tcp 181
03:50:32.721087 IP tom-Latitude-3570.39110 > vmi195435.contaboserver.net.8333: tcp 0
03:50:32.721294 IP tom-Latitude-3570.39110 > vmi195435.contaboserver.net.8333: tcp 24
03:50:32.722684 IP tom-Latitude-3570.39110 > vmi195435.contaboserver.net.8333: tcp 73
03:50:32.731854 IP 167.99.216.145.8333 > tom-Latitude-3570.57976: tcp 0
03:50:32.735715 IP 81.198.101.144.8333 > tom-Latitude-3570.60988: tcp 24
03:50:32.736382 IP 81.198.101.144.8333 > tom-Latitude-3570.60988: tcp 37
03:50:32.736401 IP tom-Latitude-3570.60988 > 81.198.101.144.8333: tcp 0
03:50:32.736461 IP tom-Latitude-3570.60988 > 81.198.101.144.8333: tcp 24
03:50:32.737963 IP tom-Latitude-3570.60988 > 81.198.101.144.8333: tcp 223
03:50:32.739558 IP 2.56.9.15.8333 > tom-Latitude-3570.42516: tcp 24
03:50:32.739579 IP 2.56.9.15.8333 > tom-Latitude-3570.42516: tcp 404
03:50:32.739583 IP 2.56.9.15.8333 > tom-Latitude-3570.42516: tcp 24
03:50:32.739586 IP 2.56.9.15.8333 > tom-Latitude-3570.42516: tcp 284
03:50:32.739592 IP 2.56.9.15.8333 > tom-Latitude-3570.42516: tcp 24
03:50:32.739596 IP 2.56.9.15.8333 > tom-Latitude-3570.42516: tcp 284
03:50:32.739649 IP tom-Latitude-3570.42516 > 2.56.9.15.8333: tcp 0
03:50:32.742548 IP 167.99.216.145.8333 > tom-Latitude-3570.57976: tcp 0
03:50:32.743230 IP vmi195435.contaboserver.net.8333 > tom-Latitude-3570.39110: tcp 0
03:50:32.748039 IP vmi195435.contaboserver.net.8333 > tom-Latitude-3570.39110: tcp 0
03:50:32.773847 IP 81.198.101.144.8333 > tom-Latitude-3570.60988: tcp 0
03:50:33.041752 IP tom-Latitude-3570.49070 > c-185-45-236-223.customer.ggaweb.ch.8333: tcp 24
03:50:33.043699 IP tom-Latitude-3570.49070 > c-185-45-236-223.customer.ggaweb.ch.8333: tcp 541
03:50:33.075405 IP bb42-60-217-183.singnet.com.sg.8333 > tom-Latitude-3570.60470: tcp 24
03:50:33.075978 IP bb42-60-217-183.singnet.com.sg.8333 > tom-Latitude-3570.60470: tcp 217
03:50:33.076042 IP tom-Latitude-3570.60470 > bb42-60-217-183.singnet.com.sg.8333: tcp 0
03:50:33.078712 IP c-185-45-236-223.customer.ggaweb.ch.8333 > tom-Latitude-3570.49070: tcp 0
03:50:33.085335 IP c-185-45-236-223.customer.ggaweb.ch.8333 > tom-Latitude-3570.49070: tcp 0
03:50:33.226296 IP vmi195435.contaboserver.net.8333 > tom-Latitude-3570.39110: tcp 24
03:50:33.226318 IP vmi195435.contaboserver.net.8333 > tom-Latitude-3570.39110: tcp 700
03:50:33.226323 IP vmi195435.contaboserver.net.8333 > tom-Latitude-3570.39110: tcp 24
03:50:33.226327 IP vmi195435.contaboserver.net.8333 > tom-Latitude-3570.39110: tcp 404
03:50:33.226357 IP tom-Latitude-3570.39110 > vmi195435.contaboserver.net.8333: tcp 0
03:50:33.428477 IP tom-Latitude-3570.42516 > 2.56.9.15.8333: tcp 24
03:50:33.430585 IP tom-Latitude-3570.42516 > 2.56.9.15.8333: tcp 73
03:50:33.466295 IP 2.56.9.15.8333 > tom-Latitude-3570.42516: tcp 0
03:50:33.476773 IP 2.56.9.15.8333 > tom-Latitude-3570.42516: tcp 0
03:50:34.351598 IP bb42-60-217-183.singnet.com.sg.8333 > tom-Latitude-3570.60470: tcp 24
03:50:34.351619 IP bb42-60-217-183.singnet.com.sg.8333 > tom-Latitude-3570.60470: tcp 109
03:50:34.351625 IP bb42-60-217-183.singnet.com.sg.8333 > tom-Latitude-3570.60470: tcp 109
03:50:34.351636 IP tom-Latitude-3570.60470 > bb42-60-217-183.singnet.com.sg.8333: tcp 0
03:50:34.351652 IP vmi195435.contaboserver.net.8333 > tom-Latitude-3570.39110: tcp 24
03:50:34.351656 IP vmi195435.contaboserver.net.8333 > tom-Latitude-3570.39110: tcp 217
03:50:34.351719 IP tom-Latitude-3570.39110 > vmi195435.contaboserver.net.8333: tcp 0
03:50:34.351867 IP tom-Latitude-3570.60470 > bb42-60-217-183.singnet.com.sg.8333: tcp 24
03:50:34.351978 IP tom-Latitude-3570.39110 > vmi195435.contaboserver.net.8333: tcp 24
03:50:34.355087 IP tom-Latitude-3570.60470 > bb42-60-217-183.singnet.com.sg.8333: tcp 109
03:50:34.355865 IP tom-Latitude-3570.39110 > vmi195435.contaboserver.net.8333: tcp 109
03:50:34.385644 IP vmi195435.contaboserver.net.8333 > tom-Latitude-3570.39110: tcp 0
03:50:34.386270 IP bb42-60-217-183.singnet.com.sg.8333 > tom-Latitude-3570.60470: tcp 0
03:50:34.386284 IP vmi195435.contaboserver.net.8333 > tom-Latitude-3570.39110: tcp 0
03:50:34.386288 IP bb42-60-217-183.singnet.com.sg.8333 > tom-Latitude-3570.60470: tcp 0
03:50:34.452398 IP tom-Latitude-3570.60988 > 81.198.101.144.8333: tcp 24
03:50:34.453941 IP tom-Latitude-3570.60988 > 81.198.101.144.8333: tcp 181
03:50:34.463509 IP vmi195435.contaboserver.net.8333 > tom-Latitude-3570.39110: tcp 24
03:50:34.464277 IP vmi195435.contaboserver.net.8333 > tom-Latitude-3570.39110: tcp 283
03:50:34.464301 IP vmi195435.contaboserver.net.8333 > tom-Latitude-3570.39110: tcp 24
03:50:34.464304 IP vmi195435.contaboserver.net.8333 > tom-Latitude-3570.39110: tcp 283
03:50:34.464307 IP vmi195435.contaboserver.net.8333 > tom-Latitude-3570.39110: tcp 24
03:50:34.464311 IP vmi195435.contaboserver.net.8333 > tom-Latitude-3570.39110: tcp 284
03:50:34.464362 IP tom-Latitude-3570.39110 > vmi195435.contaboserver.net.8333: tcp 0
03:50:34.482043 IP 81.198.101.144.8333 > tom-Latitude-3570.60988: tcp 0
03:50:34.565772 IP tom-Latitude-3570.56714 > ns3113832.ip-54-38-177.eu.8333: tcp 24
03:50:34.567447 IP tom-Latitude-3570.56714 > ns3113832.ip-54-38-177.eu.8333: tcp 793
03:50:34.597296 IP ns3113832.ip-54-38-177.eu.8333 > tom-Latitude-3570.56714: tcp 0
03:50:34.605233 IP ns3113832.ip-54-38-177.eu.8333 > tom-Latitude-3570.56714: tcp 0
03:50:34.766353 IP tom-Latitude-3570.42516 > 2.56.9.15.8333: tcp 24
03:50:34.768471 IP tom-Latitude-3570.42516 > 2.56.9.15.8333: tcp 109
03:50:34.769075 IP bb42-60-217-183.singnet.com.sg.8333 > tom-Latitude-3570.60470: tcp 24
03:50:34.769096 IP bb42-60-217-183.singnet.com.sg.8333 > tom-Latitude-3570.60470: tcp 220
03:50:34.769102 IP bb42-60-217-183.singnet.com.sg.8333 > tom-Latitude-3570.60470: tcp 24
03:50:34.769105 IP bb42-60-217-183.singnet.com.sg.8333 > tom-Latitude-3570.60470: tcp 226
03:50:34.769107 IP bb42-60-217-183.singnet.com.sg.8333 > tom-Latitude-3570.60470: tcp 24
03:50:34.769140 IP tom-Latitude-3570.60470 > bb42-60-217-183.singnet.com.sg.8333: tcp 0
03:50:34.772906 IP bb42-60-217-183.singnet.com.sg.8333 > tom-Latitude-3570.60470: tcp 1460
03:50:34.772927 IP bb42-60-217-183.singnet.com.sg.8333 > tom-Latitude-3570.60470: tcp 1460
03:50:34.772934 IP bb42-60-217-183.singnet.com.sg.8333 > tom-Latitude-3570.60470: tcp 1460
03:50:34.772944 IP bb42-60-217-183.singnet.com.sg.8333 > tom-Latitude-3570.60470: tcp 1460
03:50:34.772950 IP bb42-60-217-183.singnet.com.sg.8333 > tom-Latitude-3570.60470: tcp 1460
03:50:34.773002 IP tom-Latitude-3570.60470 > bb42-60-217-183.singnet.com.sg.8333: tcp 0
03:50:34.775037 IP bb42-60-217-183.singnet.com.sg.8333 > tom-Latitude-3570.60470: tcp 1382
03:50:34.776594 IP bb42-60-217-183.singnet.com.sg.8333 > tom-Latitude-3570.60470: tcp 78
03:50:34.776617 IP bb42-60-217-183.singnet.com.sg.8333 > tom-Latitude-3570.60470: tcp 1460
03:50:34.776624 IP bb42-60-217-183.singnet.com.sg.8333 > tom-Latitude-3570.60470: tcp 1460
03:50:34.776630 IP bb42-60-217-183.singnet.com.sg.8333 > tom-Latitude-3570.60470: tcp 1460
03:50:34.776635 IP bb42-60-217-183.singnet.com.sg.8333 > tom-Latitude-3570.60470: tcp 1382
03:50:34.776664 IP tom-Latitude-3570.60470 > bb42-60-217-183.singnet.com.sg.8333: tcp 0
03:50:34.787141 IP 2.56.9.15.8333 > tom-Latitude-3570.42516: tcp 0
03:50:34.795686 IP bb42-60-217-183.singnet.com.sg.8333 > tom-Latitude-3570.60470: tcp 1382
03:50:34.796638 IP bb42-60-217-183.singnet.com.sg.8333 > tom-Latitude-3570.60470: tcp 1287
03:50:34.796740 IP tom-Latitude-3570.60470 > bb42-60-217-183.singnet.com.sg.8333: tcp 0
03:50:34.804984 IP 2.56.9.15.8333 > tom-Latitude-3570.42516: tcp 0
03:50:34.913256 IP tom-Latitude-3570.42516 > 2.56.9.15.8333: tcp 24
03:50:34.913498 IP tom-Latitude-3570.46284 > static-87-75-105-186.vodafonexdsl.co.uk.8333: tcp 24
03:50:34.915495 IP tom-Latitude-3570.42516 > 2.56.9.15.8333: tcp 109
03:50:34.915960 IP tom-Latitude-3570.46284 > static-87-75-105-186.vodafonexdsl.co.uk.8333: tcp 505
03:50:34.947281 IP 2.56.9.15.8333 > tom-Latitude-3570.42516: tcp 0
03:50:34.955285 IP 2.56.9.15.8333 > tom-Latitude-3570.42516: tcp 0
03:50:34.955928 IP static-87-75-105-186.vodafonexdsl.co.uk.8333 > tom-Latitude-3570.46284: tcp 0
03:50:34.955942 IP static-87-75-105-186.vodafonexdsl.co.uk.8333 > tom-Latitude-3570.46284: tcp 0
03:50:36.017095 IP tom-Latitude-3570.56714 > ns3113832.ip-54-38-177.eu.8333: tcp 24
03:50:36.022276 IP tom-Latitude-3570.56714 > ns3113832.ip-54-38-177.eu.8333: tcp 109
03:50:36.065831 IP ns3113832.ip-54-38-177.eu.8333 > tom-Latitude-3570.56714: tcp 0
03:50:36.074771 IP ns3113832.ip-54-38-177.eu.8333 > tom-Latitude-3570.56714: tcp 0
03:50:36.217843 IP tom-Latitude-3570.49070 > c-185-45-236-223.customer.ggaweb.ch.8333: tcp 24
03:50:36.220093 IP tom-Latitude-3570.49070 > c-185-45-236-223.customer.ggaweb.ch.8333: tcp 289
03:50:36.220729 IP bb42-60-217-183.singnet.com.sg.8333 > tom-Latitude-3570.60470: tcp 24
03:50:36.220750 IP bb42-60-217-183.singnet.com.sg.8333 > tom-Latitude-3570.60470: tcp 1117
03:50:36.220796 IP tom-Latitude-3570.60470 > bb42-60-217-183.singnet.com.sg.8333: tcp 0
03:50:36.221313 IP tom-Latitude-3570.60470 > bb42-60-217-183.singnet.com.sg.8333: tcp 24
03:50:36.222791 IP tom-Latitude-3570.60470 > bb42-60-217-183.singnet.com.sg.8333: tcp 1009
03:50:36.254969 IP c-185-45-236-223.customer.ggaweb.ch.8333 > tom-Latitude-3570.49070: tcp 0
03:50:36.255634 IP c-185-45-236-223.customer.ggaweb.ch.8333 > tom-Latitude-3570.49070: tcp 0
03:50:36.255660 IP bb42-60-217-183.singnet.com.sg.8333 > tom-Latitude-3570.60470: tcp 0
03:50:36.255662 IP bb42-60-217-183.singnet.com.sg.8333 > tom-Latitude-3570.60470: tcp 0
03:50:36.809163 IP bb42-60-217-183.singnet.com.sg.8333 > tom-Latitude-3570.60470: tcp 24
03:50:36.809184 IP bb42-60-217-183.singnet.com.sg.8333 > tom-Latitude-3570.60470: tcp 247
03:50:36.809189 IP bb42-60-217-183.singnet.com.sg.8333 > tom-Latitude-3570.60470: tcp 24
03:50:36.809193 IP bb42-60-217-183.singnet.com.sg.8333 > tom-Latitude-3570.60470: tcp 247
03:50:36.809196 IP bb42-60-217-183.singnet.com.sg.8333 > tom-Latitude-3570.60470: tcp 24
03:50:36.809198 IP bb42-60-217-183.singnet.com.sg.8333 > tom-Latitude-3570.60470: tcp 246
03:50:36.809201 IP bb42-60-217-183.singnet.com.sg.8333 > tom-Latitude-3570.60470: tcp 24
03:50:36.809204 IP bb42-60-217-183.singnet.com.sg.8333 > tom-Latitude-3570.60470: tcp 189
03:50:36.809207 IP bb42-60-217-183.singnet.com.sg.8333 > tom-Latitude-3570.60470: tcp 24
03:50:36.809234 IP tom-Latitude-3570.60470 > bb42-60-217-183.singnet.com.sg.8333: tcp 0
03:50:36.810064 IP bb42-60-217-183.singnet.com.sg.8333 > tom-Latitude-3570.60470: tcp 251
03:50:36.810084 IP bb42-60-217-183.singnet.com.sg.8333 > tom-Latitude-3570.60470: tcp 24
03:50:36.810090 IP bb42-60-217-183.singnet.com.sg.8333 > tom-Latitude-3570.60470: tcp 226
03:50:36.810094 IP bb42-60-217-183.singnet.com.sg.8333 > tom-Latitude-3570.60470: tcp 24
03:50:36.810098 IP bb42-60-217-183.singnet.com.sg.8333 > tom-Latitude-3570.60470: tcp 226
03:50:36.810101 IP bb42-60-217-183.singnet.com.sg.8333 > tom-Latitude-3570.60470: tcp 24
03:50:36.810104 IP bb42-60-217-183.singnet.com.sg.8333 > tom-Latitude-3570.60470: tcp 257
03:50:36.810107 IP bb42-60-217-183.singnet.com.sg.8333 > tom-Latitude-3570.60470: tcp 24
03:50:36.810111 IP bb42-60-217-183.singnet.com.sg.8333 > tom-Latitude-3570.60470: tcp 283
03:50:36.810113 IP bb42-60-217-183.singnet.com.sg.8333 > tom-Latitude-3570.60470: tcp 24
03:50:36.810117 IP bb42-60-217-183.singnet.com.sg.8333 > tom-Latitude-3570.60470: tcp 283
03:50:36.810120 IP bb42-60-217-183.singnet.com.sg.8333 > tom-Latitude-3570.60470: tcp 24
03:50:36.810123 IP tom-Latitude-3570.60470 > bb42-60-217-183.singnet.com.sg.8333: tcp 0
03:50:36.810123 IP bb42-60-217-183.singnet.com.sg.8333 > tom-Latitude-3570.60470: tcp 283
03:50:36.810127 IP bb42-60-217-183.singnet.com.sg.8333 > tom-Latitude-3570.60470: tcp 24
03:50:36.810131 IP bb42-60-217-183.singnet.com.sg.8333 > tom-Latitude-3570.60470: tcp 283
03:50:36.810134 IP bb42-60-217-183.singnet.com.sg.8333 > tom-Latitude-3570.60470: tcp 24
03:50:36.810138 IP bb42-60-217-183.singnet.com.sg.8333 > tom-Latitude-3570.60470: tcp 283
03:50:36.810143 IP bb42-60-217-183.singnet.com.sg.8333 > tom-Latitude-3570.60470: tcp 24
03:50:36.810149 IP bb42-60-217-183.singnet.com.sg.8333 > tom-Latitude-3570.60470: tcp 283
03:50:36.810153 IP bb42-60-217-183.singnet.com.sg.8333 > tom-Latitude-3570.60470: tcp 24
03:50:36.810158 IP bb42-60-217-183.singnet.com.sg.8333 > tom-Latitude-3570.60470: tcp 283
03:50:36.810163 IP bb42-60-217-183.singnet.com.sg.8333 > tom-Latitude-3570.60470: tcp 24
03:50:36.810167 IP bb42-60-217-183.singnet.com.sg.8333 > tom-Latitude-3570.60470: tcp 283
03:50:36.810171 IP bb42-60-217-183.singnet.com.sg.8333 > tom-Latitude-3570.60470: tcp 24
03:50:36.810178 IP bb42-60-217-183.singnet.com.sg.8333 > tom-Latitude-3570.60470: tcp 1382
03:50:36.810200 IP tom-Latitude-3570.60470 > bb42-60-217-183.singnet.com.sg.8333: tcp 0
03:50:36.845571 IP bb42-60-217-183.singnet.com.sg.8333 > tom-Latitude-3570.60470: tcp 1382
03:50:36.846216 IP bb42-60-217-183.singnet.com.sg.8333 > tom-Latitude-3570.60470: tcp 903
03:50:36.846252 IP tom-Latitude-3570.60470 > bb42-60-217-183.singnet.com.sg.8333: tcp 0
03:50:36.947740 IP tom-Latitude-3570.56714 > ns3113832.ip-54-38-177.eu.8333: tcp 24
03:50:36.949699 IP tom-Latitude-3570.56714 > ns3113832.ip-54-38-177.eu.8333: tcp 1009
03:50:36.977187 IP ns3113832.ip-54-38-177.eu.8333 > tom-Latitude-3570.56714: tcp 0
03:50:36.985171 IP ns3113832.ip-54-38-177.eu.8333 > tom-Latitude-3570.56714: tcp 0
03:50:37.026263 IP 167.99.216.145.8333 > tom-Latitude-3570.57976: tcp 24
03:50:37.027314 IP 167.99.216.145.8333 > tom-Latitude-3570.57976: tcp 1261
03:50:37.027377 IP tom-Latitude-3570.57976 > 167.99.216.145.8333: tcp 0
03:50:37.027809 IP tom-Latitude-3570.57976 > 167.99.216.145.8333: tcp 24
03:50:37.028787 IP tom-Latitude-3570.57976 > 167.99.216.145.8333: tcp 73
03:50:37.063937 IP 167.99.216.145.8333 > tom-Latitude-3570.57976: tcp 0
03:50:37.065023 IP 167.99.216.145.8333 > tom-Latitude-3570.57976: tcp 0
03:50:37.128226 IP 167.99.216.145.8333 > tom-Latitude-3570.57976: tcp 24
03:50:37.128970 IP 167.99.216.145.8333 > tom-Latitude-3570.57976: tcp 223
03:50:37.128980 IP 167.99.216.145.8333 > tom-Latitude-3570.57976: tcp 24
03:50:37.128983 IP 167.99.216.145.8333 > tom-Latitude-3570.57976: tcp 249
03:50:37.128991 IP tom-Latitude-3570.57976 > 167.99.216.145.8333: tcp 0
03:50:37.436023 IP 167.99.216.145.8333 > tom-Latitude-3570.57976: tcp 24
03:50:37.436040 IP 167.99.216.145.8333 > tom-Latitude-3570.57976: tcp 577
03:50:37.436075 IP tom-Latitude-3570.57976 > 167.99.216.145.8333: tcp 0
03:50:37.436317 IP tom-Latitude-3570.57976 > 167.99.216.145.8333: tcp 24
03:50:37.437799 IP tom-Latitude-3570.57976 > 167.99.216.145.8333: tcp 73
03:50:37.444040 IP 167.99.216.145.8333 > tom-Latitude-3570.57976: tcp 577
03:50:37.444048 IP tom-Latitude-3570.57976 > 167.99.216.145.8333: tcp 0
03:50:37.478986 IP 167.99.216.145.8333 > tom-Latitude-3570.57976: tcp 0
03:50:37.479000 IP 167.99.216.145.8333 > tom-Latitude-3570.57976: tcp 0
03:50:37.536774 IP tom-Latitude-3570.60988 > 81.198.101.144.8333: tcp 24
03:50:37.536794 IP tom-Latitude-3570.60988 > 81.198.101.144.8333: tcp 1261
03:50:37.536827 IP tom-Latitude-3570.56714 > ns3113832.ip-54-38-177.eu.8333: tcp 24
03:50:37.538333 IP 167.99.216.145.8333 > tom-Latitude-3570.57976: tcp 24
03:50:37.538350 IP tom-Latitude-3570.57976 > 167.99.216.145.8333: tcp 0
03:50:37.538369 IP 167.99.216.145.8333 > tom-Latitude-3570.57976: tcp 226
03:50:37.538408 IP tom-Latitude-3570.57976 > 167.99.216.145.8333: tcp 0
03:50:37.538412 IP 167.99.216.145.8333 > tom-Latitude-3570.57976: tcp 24
03:50:37.538414 IP tom-Latitude-3570.57976 > 167.99.216.145.8333: tcp 0
03:50:37.538418 IP 167.99.216.145.8333 > tom-Latitude-3570.57976: tcp 283
03:50:37.538420 IP tom-Latitude-3570.57976 > 167.99.216.145.8333: tcp 0
03:50:37.558489 IP tom-Latitude-3570.56714 > ns3113832.ip-54-38-177.eu.8333: tcp 73
03:50:37.603422 IP 81.198.101.144.8333 > tom-Latitude-3570.60988: tcp 0
03:50:37.603436 IP ns3113832.ip-54-38-177.eu.8333 > tom-Latitude-3570.56714: tcp 0
03:50:37.603440 IP ns3113832.ip-54-38-177.eu.8333 > tom-Latitude-3570.56714: tcp 0
03:50:37.739754 IP tom-Latitude-3570.46284 > static-87-75-105-186.vodafonexdsl.co.uk.8333: tcp 24
03:50:37.739774 IP tom-Latitude-3570.46284 > static-87-75-105-186.vodafonexdsl.co.uk.8333: tcp 1153
03:50:37.777144 IP static-87-75-105-186.vodafonexdsl.co.uk.8333 > tom-Latitude-3570.46284: tcp 0
