08:06:30.956866 IP 2.56.9.15.8333 > tom-Latitude-3570.42516: tcp 1368
08:06:30.956881 IP 2.56.9.15.8333 > tom-Latitude-3570.42516: tcp 1368
08:06:30.956888 IP 2.56.9.15.8333 > tom-Latitude-3570.42516: tcp 1368
08:06:30.956891 IP 2.56.9.15.8333 > tom-Latitude-3570.42516: tcp 1368
08:06:30.956894 IP 2.56.9.15.8333 > tom-Latitude-3570.42516: tcp 1368
08:06:30.956916 IP 2.56.9.15.8333 > tom-Latitude-3570.42516: tcp 1368
08:06:30.956919 IP 2.56.9.15.8333 > tom-Latitude-3570.42516: tcp 1368
08:06:30.956922 IP 2.56.9.15.8333 > tom-Latitude-3570.42516: tcp 1368
08:06:30.956954 IP tom-Latitude-3570.42516 > 2.56.9.15.8333: tcp 0
08:06:30.958488 IP 2.56.9.15.8333 > tom-Latitude-3570.42516: tcp 1368
08:06:30.958511 IP 2.56.9.15.8333 > tom-Latitude-3570.42516: tcp 1368
08:06:30.958516 IP 2.56.9.15.8333 > tom-Latitude-3570.42516: tcp 1368
08:06:30.958519 IP 2.56.9.15.8333 > tom-Latitude-3570.42516: tcp 1368
08:06:30.958523 IP 2.56.9.15.8333 > tom-Latitude-3570.42516: tcp 1368
08:06:30.958545 IP tom-Latitude-3570.42516 > 2.56.9.15.8333: tcp 0
08:06:30.958545 IP 2.56.9.15.8333 > tom-Latitude-3570.42516: tcp 1368
08:06:30.958548 IP 2.56.9.15.8333 > tom-Latitude-3570.42516: tcp 1368
08:06:30.958551 IP 2.56.9.15.8333 > tom-Latitude-3570.42516: tcp 1368
08:06:30.958593 IP tom-Latitude-3570.42516 > 2.56.9.15.8333: tcp 0
08:06:30.958873 IP 2.56.9.15.8333 > tom-Latitude-3570.42516: tcp 1368
08:06:30.958880 IP 2.56.9.15.8333 > tom-Latitude-3570.42516: tcp 1368
08:06:30.958893 IP tom-Latitude-3570.42516 > 2.56.9.15.8333: tcp 0
08:06:30.961994 IP 2.56.9.15.8333 > tom-Latitude-3570.42516: tcp 1368
08:06:30.965225 IP 2.56.9.15.8333 > tom-Latitude-3570.42516: tcp 1368
08:06:30.965278 IP tom-Latitude-3570.42516 > 2.56.9.15.8333: tcp 0
08:06:30.965474 IP 2.56.9.15.8333 > tom-Latitude-3570.42516: tcp 1368
08:06:30.968371 IP 2.56.9.15.8333 > tom-Latitude-3570.42516: tcp 1368
08:06:30.968450 IP tom-Latitude-3570.42516 > 2.56.9.15.8333: tcp 0
08:06:30.969292 IP 2.56.9.15.8333 > tom-Latitude-3570.42516: tcp 1368
08:06:30.971807 IP 2.56.9.15.8333 > tom-Latitude-3570.42516: tcp 1368
08:06:30.971850 IP tom-Latitude-3570.42516 > 2.56.9.15.8333: tcp 0
08:06:30.973023 IP 2.56.9.15.8333 > tom-Latitude-3570.42516: tcp 1368
08:06:30.973039 IP 2.56.9.15.8333 > tom-Latitude-3570.42516: tcp 1368
08:06:30.973047 IP 2.56.9.15.8333 > tom-Latitude-3570.42516: tcp 1368
08:06:30.973110 IP tom-Latitude-3570.42516 > 2.56.9.15.8333: tcp 0
08:06:30.975573 IP 2.56.9.15.8333 > tom-Latitude-3570.42516: tcp 1368
08:06:30.977032 IP 2.56.9.15.8333 > tom-Latitude-3570.42516: tcp 1368
08:06:30.977048 IP 2.56.9.15.8333 > tom-Latitude-3570.42516: tcp 1368
08:06:30.977052 IP 2.56.9.15.8333 > tom-Latitude-3570.42516: tcp 1368
08:06:30.977055 IP 2.56.9.15.8333 > tom-Latitude-3570.42516: tcp 1368
08:06:30.977059 IP 2.56.9.15.8333 > tom-Latitude-3570.42516: tcp 1104
08:06:30.977087 IP tom-Latitude-3570.42516 > 2.56.9.15.8333: tcp 0
08:06:31.305315 IP tom-Latitude-3570.60988 > 81.198.101.144.8333: tcp 24
08:06:31.308026 IP tom-Latitude-3570.60988 > 81.198.101.144.8333: tcp 73
08:06:31.358307 IP 81.198.101.144.8333 > tom-Latitude-3570.60988: tcp 0
08:06:31.367169 IP 81.198.101.144.8333 > tom-Latitude-3570.60988: tcp 0
08:06:31.370188 IP c-185-45-236-223.customer.ggaweb.ch.8333 > tom-Latitude-3570.49070: tcp 24
08:06:31.370805 IP c-185-45-236-223.customer.ggaweb.ch.8333 > tom-Latitude-3570.49070: tcp 73
08:06:31.370844 IP tom-Latitude-3570.49070 > c-185-45-236-223.customer.ggaweb.ch.8333: tcp 0
08:06:31.672014 IP 167.99.216.145.8333 > tom-Latitude-3570.57976: tcp 24
08:06:31.672030 IP 167.99.216.145.8333 > tom-Latitude-3570.57976: tcp 37
08:06:31.672137 IP tom-Latitude-3570.57976 > 167.99.216.145.8333: tcp 0
08:06:31.672309 IP tom-Latitude-3570.57976 > 167.99.216.145.8333: tcp 24
08:06:31.674620 IP tom-Latitude-3570.57976 > 167.99.216.145.8333: tcp 37
08:06:31.707362 IP 167.99.216.145.8333 > tom-Latitude-3570.57976: tcp 37
08:06:31.707381 IP tom-Latitude-3570.57976 > 167.99.216.145.8333: tcp 0
08:06:31.717336 IP 167.99.216.145.8333 > tom-Latitude-3570.57976: tcp 0
08:06:31.772790 IP tom-Latitude-3570.56714 > ns3113832.ip-54-38-177.eu.8333: tcp 24
08:06:31.773732 IP tom-Latitude-3570.56714 > ns3113832.ip-54-38-177.eu.8333: tcp 181
08:06:31.780379 IP 167.99.216.145.8333 > tom-Latitude-3570.57976: tcp 24
08:06:31.780403 IP tom-Latitude-3570.57976 > 167.99.216.145.8333: tcp 0
08:06:31.780437 IP 167.99.216.145.8333 > tom-Latitude-3570.57976: tcp 283
08:06:31.780442 IP tom-Latitude-3570.57976 > 167.99.216.145.8333: tcp 0
08:06:31.816453 IP ns3113832.ip-54-38-177.eu.8333 > tom-Latitude-3570.56714: tcp 0
08:06:31.981577 IP tom-Latitude-3570.39110 > vmi195435.contaboserver.net.8333: tcp 24
08:06:31.981625 IP tom-Latitude-3570.56714 > ns3113832.ip-54-38-177.eu.8333: tcp 24
08:06:31.981680 IP tom-Latitude-3570.46284 > static-87-75-105-186.vodafonexdsl.co.uk.8333: tcp 24
08:06:31.982835 IP tom-Latitude-3570.39110 > vmi195435.contaboserver.net.8333: tcp 289
08:06:31.983368 IP tom-Latitude-3570.56714 > ns3113832.ip-54-38-177.eu.8333: tcp 37
08:06:31.984214 IP tom-Latitude-3570.46284 > static-87-75-105-186.vodafonexdsl.co.uk.8333: tcp 109
08:06:32.027454 IP vmi195435.contaboserver.net.8333 > tom-Latitude-3570.39110: tcp 0
08:06:32.028135 IP ns3113832.ip-54-38-177.eu.8333 > tom-Latitude-3570.56714: tcp 0
08:06:32.028150 IP static-87-75-105-186.vodafonexdsl.co.uk.8333 > tom-Latitude-3570.46284: tcp 0
08:06:32.031881 IP tom-Latitude-3570.45038 > 178.170.146.22.8333: tcp 0
08:06:32.086918 IP ns3113832.ip-54-38-177.eu.8333 > tom-Latitude-3570.56714: tcp 24
08:06:32.086936 IP ns3113832.ip-54-38-177.eu.8333 > tom-Latitude-3570.56714: tcp 37
08:06:32.087048 IP tom-Latitude-3570.56714 > ns3113832.ip-54-38-177.eu.8333: tcp 0
08:06:32.087187 IP tom-Latitude-3570.56714 > ns3113832.ip-54-38-177.eu.8333: tcp 24
08:06:32.088746 IP tom-Latitude-3570.56714 > ns3113832.ip-54-38-177.eu.8333: tcp 283
08:06:32.101122 IP 178.170.146.22.8333 > tom-Latitude-3570.45038: tcp 0
08:06:32.117329 IP ns3113832.ip-54-38-177.eu.8333 > tom-Latitude-3570.56714: tcp 0
08:06:32.676372 IP tom-Latitude-3570.36840 > 185.160.164.156.8333: tcp 0
08:06:32.728333 IP 185.160.164.156.8333 > tom-Latitude-3570.36840: tcp 0
08:06:32.728366 IP tom-Latitude-3570.36840 > 185.160.164.156.8333: tcp 0
08:06:32.728667 IP tom-Latitude-3570.36840 > 185.160.164.156.8333: tcp 24
08:06:32.729935 IP tom-Latitude-3570.36840 > 185.160.164.156.8333: tcp 102
08:06:32.798463 IP 185.160.164.156.8333 > tom-Latitude-3570.36840: tcp 0
08:06:32.889783 IP tom-Latitude-3570.60988 > 81.198.101.144.8333: tcp 24
08:06:32.891746 IP tom-Latitude-3570.60988 > 81.198.101.144.8333: tcp 37
08:06:32.919466 IP 81.198.101.144.8333 > tom-Latitude-3570.60988: tcp 0
08:06:32.928831 IP 81.198.101.144.8333 > tom-Latitude-3570.60988: tcp 0
08:06:32.990184 IP tom-Latitude-3570.49070 > c-185-45-236-223.customer.ggaweb.ch.8333: tcp 24
08:06:32.992841 IP tom-Latitude-3570.49070 > c-185-45-236-223.customer.ggaweb.ch.8333: tcp 37
08:06:33.019465 IP c-185-45-236-223.customer.ggaweb.ch.8333 > tom-Latitude-3570.49070: tcp 0
08:06:33.027911 IP c-185-45-236-223.customer.ggaweb.ch.8333 > tom-Latitude-3570.49070: tcp 0
08:06:33.692608 IP tom-Latitude-3570.60470 > bb42-60-217-183.singnet.com.sg.8333: tcp 24
08:06:33.696583 IP tom-Latitude-3570.60470 > bb42-60-217-183.singnet.com.sg.8333: tcp 541
08:06:33.757387 IP bb42-60-217-183.singnet.com.sg.8333 > tom-Latitude-3570.60470: tcp 0
08:06:33.845809 IP c-185-45-236-223.customer.ggaweb.ch.8333 > tom-Latitude-3570.49070: tcp 24
08:06:33.845831 IP c-185-45-236-223.customer.ggaweb.ch.8333 > tom-Latitude-3570.49070: tcp 1261
08:06:33.845921 IP tom-Latitude-3570.49070 > c-185-45-236-223.customer.ggaweb.ch.8333: tcp 0
08:06:33.846434 IP tom-Latitude-3570.49070 > c-185-45-236-223.customer.ggaweb.ch.8333: tcp 24
08:06:33.846450 IP tom-Latitude-3570.49070 > c-185-45-236-223.customer.ggaweb.ch.8333: tcp 1261
08:06:33.877209 IP c-185-45-236-223.customer.ggaweb.ch.8333 > tom-Latitude-3570.49070: tcp 0
08:06:33.885139 IP c-185-45-236-223.customer.ggaweb.ch.8333 > tom-Latitude-3570.49070: tcp 0
08:06:33.946698 IP tom-Latitude-3570.42516 > 2.56.9.15.8333: tcp 24
08:06:33.947500 IP tom-Latitude-3570.42516 > 2.56.9.15.8333: tcp 37
08:06:33.973870 IP c-185-45-236-223.customer.ggaweb.ch.8333 > tom-Latitude-3570.49070: tcp 24
08:06:33.973886 IP c-185-45-236-223.customer.ggaweb.ch.8333 > tom-Latitude-3570.49070: tcp 938
08:06:33.973890 IP c-185-45-236-223.customer.ggaweb.ch.8333 > tom-Latitude-3570.49070: tcp 224
08:06:33.973892 IP c-185-45-236-223.customer.ggaweb.ch.8333 > tom-Latitude-3570.49070: tcp 282
08:06:33.973965 IP tom-Latitude-3570.49070 > c-185-45-236-223.customer.ggaweb.ch.8333: tcp 0
08:06:33.974056 IP c-185-45-236-223.customer.ggaweb.ch.8333 > tom-Latitude-3570.49070: tcp 863
08:06:33.975012 IP c-185-45-236-223.customer.ggaweb.ch.8333 > tom-Latitude-3570.49070: tcp 581
08:06:33.975025 IP c-185-45-236-223.customer.ggaweb.ch.8333 > tom-Latitude-3570.49070: tcp 922
08:06:33.975030 IP c-185-45-236-223.customer.ggaweb.ch.8333 > tom-Latitude-3570.49070: tcp 557
08:06:33.975033 IP c-185-45-236-223.customer.ggaweb.ch.8333 > tom-Latitude-3570.49070: tcp 616
08:06:33.975056 IP c-185-45-236-223.customer.ggaweb.ch.8333 > tom-Latitude-3570.49070: tcp 922
08:06:33.975103 IP tom-Latitude-3570.49070 > c-185-45-236-223.customer.ggaweb.ch.8333: tcp 0
08:06:33.983194 IP 2.56.9.15.8333 > tom-Latitude-3570.42516: tcp 0
08:06:34.057918 IP c-185-45-236-223.customer.ggaweb.ch.8333 > tom-Latitude-3570.49070: tcp 1448
08:06:34.058052 IP tom-Latitude-3570.49070 > c-185-45-236-223.customer.ggaweb.ch.8333: tcp 0
08:06:34.058319 IP c-185-45-236-223.customer.ggaweb.ch.8333 > tom-Latitude-3570.49070: tcp 1448
08:06:34.058334 IP c-185-45-236-223.customer.ggaweb.ch.8333 > tom-Latitude-3570.49070: tcp 1448
08:06:34.058338 IP c-185-45-236-223.customer.ggaweb.ch.8333 > tom-Latitude-3570.49070: tcp 576
08:06:34.058412 IP tom-Latitude-3570.49070 > c-185-45-236-223.customer.ggaweb.ch.8333: tcp 0
08:06:34.058746 IP tom-Latitude-3570.56714 > ns3113832.ip-54-38-177.eu.8333: tcp 24
08:06:34.060352 IP tom-Latitude-3570.56714 > ns3113832.ip-54-38-177.eu.8333: tcp 721
08:06:34.097358 IP ns3113832.ip-54-38-177.eu.8333 > tom-Latitude-3570.56714: tcp 0
08:06:34.162743 IP tom-Latitude-3570.60470 > bb42-60-217-183.singnet.com.sg.8333: tcp 24
08:06:34.162763 IP tom-Latitude-3570.60470 > bb42-60-217-183.singnet.com.sg.8333: tcp 1261
08:06:34.206059 IP bb42-60-217-183.singnet.com.sg.8333 > tom-Latitude-3570.60470: tcp 0
08:06:34.262350 IP static-87-75-105-186.vodafonexdsl.co.uk.8333 > tom-Latitude-3570.46284: tcp 24
08:06:34.287326 IP static-87-75-105-186.vodafonexdsl.co.uk.8333 > tom-Latitude-3570.46284: tcp 1261
08:06:34.287460 IP tom-Latitude-3570.46284 > static-87-75-105-186.vodafonexdsl.co.uk.8333: tcp 0
08:06:34.287877 IP tom-Latitude-3570.46284 > static-87-75-105-186.vodafonexdsl.co.uk.8333: tcp 24
08:06:34.289177 IP tom-Latitude-3570.46284 > static-87-75-105-186.vodafonexdsl.co.uk.8333: tcp 37
08:06:34.325696 IP static-87-75-105-186.vodafonexdsl.co.uk.8333 > tom-Latitude-3570.46284: tcp 0
08:06:34.412394 IP 167.99.216.145.8333 > tom-Latitude-3570.57976: tcp 24
08:06:34.412412 IP tom-Latitude-3570.57976 > 167.99.216.145.8333: tcp 0
08:06:34.413142 IP 167.99.216.145.8333 > tom-Latitude-3570.57976: tcp 1261
08:06:34.413166 IP tom-Latitude-3570.57976 > 167.99.216.145.8333: tcp 0
08:06:34.413681 IP tom-Latitude-3570.57976 > 167.99.216.145.8333: tcp 24
08:06:34.415256 IP tom-Latitude-3570.57976 > 167.99.216.145.8333: tcp 73
08:06:34.447705 IP 167.99.216.145.8333 > tom-Latitude-3570.57976: tcp 0
08:06:34.451136 IP static-87-75-105-186.vodafonexdsl.co.uk.8333 > tom-Latitude-3570.46284: tcp 24
08:06:34.451777 IP static-87-75-105-186.vodafonexdsl.co.uk.8333 > tom-Latitude-3570.46284: tcp 224
08:06:34.451892 IP tom-Latitude-3570.46284 > static-87-75-105-186.vodafonexdsl.co.uk.8333: tcp 0
08:06:34.509399 IP 167.99.216.145.8333 > tom-Latitude-3570.57976: tcp 24
08:06:34.510119 IP 167.99.216.145.8333 > tom-Latitude-3570.57976: tcp 336
08:06:34.510138 IP 167.99.216.145.8333 > tom-Latitude-3570.57976: tcp 24
08:06:34.510141 IP 167.99.216.145.8333 > tom-Latitude-3570.57976: tcp 226
08:06:34.510231 IP tom-Latitude-3570.57976 > 167.99.216.145.8333: tcp 0
08:06:34.744218 IP 178.170.146.22.8333 > tom-Latitude-3570.45038: tcp 0
08:06:34.805425 IP 81.198.101.144.8333 > tom-Latitude-3570.60988: tcp 24
08:06:34.806015 IP 81.198.101.144.8333 > tom-Latitude-3570.60988: tcp 37
08:06:34.806144 IP tom-Latitude-3570.60988 > 81.198.101.144.8333: tcp 0
08:06:34.806282 IP tom-Latitude-3570.60988 > 81.198.101.144.8333: tcp 24
08:06:34.808211 IP tom-Latitude-3570.60988 > 81.198.101.144.8333: tcp 283
08:06:34.837317 IP 81.198.101.144.8333 > tom-Latitude-3570.60988: tcp 0
08:06:34.837931 IP 81.198.101.144.8333 > tom-Latitude-3570.60988: tcp 0
08:06:35.107511 IP tom-Latitude-3570.57976 > 167.99.216.145.8333: tcp 24
08:06:35.109800 IP tom-Latitude-3570.57976 > 167.99.216.145.8333: tcp 109
08:06:35.147341 IP 167.99.216.145.8333 > tom-Latitude-3570.57976: tcp 0
08:06:35.208153 IP tom-Latitude-3570.39110 > vmi195435.contaboserver.net.8333: tcp 24
08:06:35.208173 IP tom-Latitude-3570.39110 > vmi195435.contaboserver.net.8333: tcp 1261
08:06:35.246940 IP vmi195435.contaboserver.net.8333 > tom-Latitude-3570.39110: tcp 0
08:06:35.563404 IP bb42-60-217-183.singnet.com.sg.8333 > tom-Latitude-3570.60470: tcp 24
08:06:35.563424 IP bb42-60-217-183.singnet.com.sg.8333 > tom-Latitude-3570.60470: tcp 145
08:06:35.563516 IP tom-Latitude-3570.60470 > bb42-60-217-183.singnet.com.sg.8333: tcp 0
08:06:35.563721 IP tom-Latitude-3570.60470 > bb42-60-217-183.singnet.com.sg.8333: tcp 24
08:06:35.566064 IP tom-Latitude-3570.60470 > bb42-60-217-183.singnet.com.sg.8333: tcp 109
08:06:35.607342 IP bb42-60-217-183.singnet.com.sg.8333 > tom-Latitude-3570.60470: tcp 0
08:06:35.768216 IP static-87-75-105-186.vodafonexdsl.co.uk.8333 > tom-Latitude-3570.46284: tcp 24
08:06:35.768235 IP static-87-75-105-186.vodafonexdsl.co.uk.8333 > tom-Latitude-3570.46284: tcp 289
08:06:35.768331 IP tom-Latitude-3570.46284 > static-87-75-105-186.vodafonexdsl.co.uk.8333: tcp 0
08:06:35.768601 IP tom-Latitude-3570.46284 > static-87-75-105-186.vodafonexdsl.co.uk.8333: tcp 24
08:06:35.769707 IP tom-Latitude-3570.46284 > static-87-75-105-186.vodafonexdsl.co.uk.8333: tcp 73
08:06:35.797217 IP static-87-75-105-186.vodafonexdsl.co.uk.8333 > tom-Latitude-3570.46284: tcp 0
08:06:35.872878 IP static-87-75-105-186.vodafonexdsl.co.uk.8333 > tom-Latitude-3570.46284: tcp 24
08:06:35.878403 IP static-87-75-105-186.vodafonexdsl.co.uk.8333 > tom-Latitude-3570.46284: tcp 431
08:06:35.878535 IP tom-Latitude-3570.46284 > static-87-75-105-186.vodafonexdsl.co.uk.8333: tcp 0
08:06:35.878919 IP static-87-75-105-186.vodafonexdsl.co.uk.8333 > tom-Latitude-3570.46284: tcp 225
08:06:35.919906 IP tom-Latitude-3570.46284 > static-87-75-105-186.vodafonexdsl.co.uk.8333: tcp 0
08:06:35.978323 IP bb42-60-217-183.singnet.com.sg.8333 > tom-Latitude-3570.60470: tcp 24
08:06:35.988313 IP bb42-60-217-183.singnet.com.sg.8333 > tom-Latitude-3570.60470: tcp 1382
08:06:35.988443 IP tom-Latitude-3570.60470 > bb42-60-217-183.singnet.com.sg.8333: tcp 0
08:06:35.990119 IP bb42-60-217-183.singnet.com.sg.8333 > tom-Latitude-3570.60470: tcp 78
08:06:35.990142 IP bb42-60-217-183.singnet.com.sg.8333 > tom-Latitude-3570.60470: tcp 1460
08:06:35.990168 IP bb42-60-217-183.singnet.com.sg.8333 > tom-Latitude-3570.60470: tcp 1460
08:06:35.990172 IP bb42-60-217-183.singnet.com.sg.8333 > tom-Latitude-3570.60470: tcp 1460
08:06:35.990182 IP bb42-60-217-183.singnet.com.sg.8333 > tom-Latitude-3570.60470: tcp 1460
08:06:35.990186 IP bb42-60-217-183.singnet.com.sg.8333 > tom-Latitude-3570.60470: tcp 1460
08:06:35.990191 IP bb42-60-217-183.singnet.com.sg.8333 > tom-Latitude-3570.60470: tcp 1460
08:06:35.990196 IP bb42-60-217-183.singnet.com.sg.8333 > tom-Latitude-3570.60470: tcp 1460
08:06:35.990247 IP tom-Latitude-3570.60470 > bb42-60-217-183.singnet.com.sg.8333: tcp 0
08:06:35.990392 IP bb42-60-217-183.singnet.com.sg.8333 > tom-Latitude-3570.60470: tcp 1460
08:06:35.990488 IP tom-Latitude-3570.60470 > bb42-60-217-183.singnet.com.sg.8333: tcp 0
08:06:36.026505 IP bb42-60-217-183.singnet.com.sg.8333 > tom-Latitude-3570.60470: tcp 1382
08:06:36.028048 IP bb42-60-217-183.singnet.com.sg.8333 > tom-Latitude-3570.60470: tcp 1382
08:06:36.028068 IP bb42-60-217-183.singnet.com.sg.8333 > tom-Latitude-3570.60470: tcp 1382
08:06:36.028071 IP bb42-60-217-183.singnet.com.sg.8333 > tom-Latitude-3570.60470: tcp 517
08:06:36.028161 IP tom-Latitude-3570.60470 > bb42-60-217-183.singnet.com.sg.8333: tcp 0
08:06:36.447020 IP tom-Latitude-3570.60988 > 81.198.101.144.8333: tcp 24
08:06:36.447042 IP tom-Latitude-3570.60988 > 81.198.101.144.8333: tcp 1261
08:06:36.447086 IP tom-Latitude-3570.60470 > bb42-60-217-183.singnet.com.sg.8333: tcp 24
08:06:36.450739 IP tom-Latitude-3570.60470 > bb42-60-217-183.singnet.com.sg.8333: tcp 145
08:06:36.497109 IP vmi195435.contaboserver.net.8333 > tom-Latitude-3570.39110: tcp 24
08:06:36.497133 IP tom-Latitude-3570.39110 > vmi195435.contaboserver.net.8333: tcp 0
08:06:36.505244 IP vmi195435.contaboserver.net.8333 > tom-Latitude-3570.39110: tcp 361
08:06:36.505268 IP tom-Latitude-3570.39110 > vmi195435.contaboserver.net.8333: tcp 0
08:06:36.505593 IP tom-Latitude-3570.39110 > vmi195435.contaboserver.net.8333: tcp 24
08:06:36.505859 IP tom-Latitude-3570.42516 > 2.56.9.15.8333: tcp 24
08:06:36.505868 IP tom-Latitude-3570.42516 > 2.56.9.15.8333: tcp 1261
08:06:36.506871 IP tom-Latitude-3570.39110 > vmi195435.contaboserver.net.8333: tcp 73
08:06:36.508866 IP 81.198.101.144.8333 > tom-Latitude-3570.60988: tcp 0
08:06:36.514739 IP 81.198.101.144.8333 > tom-Latitude-3570.60988: tcp 0
08:06:36.515310 IP bb42-60-217-183.singnet.com.sg.8333 > tom-Latitude-3570.60470: tcp 0
08:06:36.518127 IP vmi195435.contaboserver.net.8333 > tom-Latitude-3570.39110: tcp 361
08:06:36.518139 IP tom-Latitude-3570.39110 > vmi195435.contaboserver.net.8333: tcp 0
08:06:36.536277 IP vmi195435.contaboserver.net.8333 > tom-Latitude-3570.39110: tcp 0
08:06:36.536846 IP 2.56.9.15.8333 > tom-Latitude-3570.42516: tcp 0
08:06:36.615474 IP vmi195435.contaboserver.net.8333 > tom-Latitude-3570.39110: tcp 24
08:06:36.615498 IP tom-Latitude-3570.39110 > vmi195435.contaboserver.net.8333: tcp 0
08:06:36.616174 IP vmi195435.contaboserver.net.8333 > tom-Latitude-3570.39110: tcp 246
08:06:36.616199 IP tom-Latitude-3570.39110 > vmi195435.contaboserver.net.8333: tcp 0
08:06:36.616230 IP vmi195435.contaboserver.net.8333 > tom-Latitude-3570.39110: tcp 24
08:06:36.616234 IP tom-Latitude-3570.39110 > vmi195435.contaboserver.net.8333: tcp 0
08:06:36.616238 IP vmi195435.contaboserver.net.8333 > tom-Latitude-3570.39110: tcp 249
08:06:36.616240 IP tom-Latitude-3570.39110 > vmi195435.contaboserver.net.8333: tcp 0
08:06:36.717247 IP tom-Latitude-3570.60988 > 81.198.101.144.8333: tcp 24
08:06:36.718191 IP tom-Latitude-3570.60988 > 81.198.101.144.8333: tcp 361
08:06:36.749257 IP 81.198.101.144.8333 > tom-Latitude-3570.60988: tcp 0
08:06:36.756304 IP 81.198.101.144.8333 > tom-Latitude-3570.60988: tcp 0
08:06:36.894624 IP ns3113832.ip-54-38-177.eu.8333 > tom-Latitude-3570.56714: tcp 24
08:06:36.894644 IP ns3113832.ip-54-38-177.eu.8333 > tom-Latitude-3570.56714: tcp 865
08:06:36.894735 IP tom-Latitude-3570.56714 > ns3113832.ip-54-38-177.eu.8333: tcp 0
08:06:36.995483 IP tom-Latitude-3570.60470 > bb42-60-217-183.singnet.com.sg.8333: tcp 24
08:06:36.996890 IP tom-Latitude-3570.60470 > bb42-60-217-183.singnet.com.sg.8333: tcp 73
08:06:37.036647 IP bb42-60-217-183.singnet.com.sg.8333 > tom-Latitude-3570.60470: tcp 0
08:06:37.697933 IP tom-Latitude-3570.46284 > static-87-75-105-186.vodafonexdsl.co.uk.8333: tcp 24
08:06:37.700018 IP tom-Latitude-3570.46284 > static-87-75-105-186.vodafonexdsl.co.uk.8333: tcp 73
08:06:37.766672 IP static-87-75-105-186.vodafonexdsl.co.uk.8333 > tom-Latitude-3570.46284: tcp 0
08:06:38.099336 IP tom-Latitude-3570.42516 > 2.56.9.15.8333: tcp 24
08:06:38.101426 IP tom-Latitude-3570.42516 > 2.56.9.15.8333: tcp 361
08:06:38.102370 IP 167.99.216.145.8333 > tom-Latitude-3570.57976: tcp 24
08:06:38.102390 IP 167.99.216.145.8333 > tom-Latitude-3570.57976: tcp 325
08:06:38.102395 IP 167.99.216.145.8333 > tom-Latitude-3570.57976: tcp 325
08:06:38.102422 IP tom-Latitude-3570.57976 > 167.99.216.145.8333: tcp 0
08:06:38.102731 IP tom-Latitude-3570.57976 > 167.99.216.145.8333: tcp 24
08:06:38.104407 IP tom-Latitude-3570.57976 > 167.99.216.145.8333: tcp 73
08:06:38.155076 IP 2.56.9.15.8333 > tom-Latitude-3570.42516: tcp 0
08:06:38.155668 IP 167.99.216.145.8333 > tom-Latitude-3570.57976: tcp 0
08:06:38.220103 IP 167.99.216.145.8333 > tom-Latitude-3570.57976: tcp 24
08:06:38.220125 IP 167.99.216.145.8333 > tom-Latitude-3570.57976: tcp 405
08:06:38.220129 IP 167.99.216.145.8333 > tom-Latitude-3570.57976: tcp 24
08:06:38.220131 IP 167.99.216.145.8333 > tom-Latitude-3570.57976: tcp 190
08:06:38.220217 IP tom-Latitude-3570.57976 > 167.99.216.145.8333: tcp 0
08:06:39.224413 IP tom-Latitude-3570.49070 > c-185-45-236-223.customer.ggaweb.ch.8333: tcp 24
08:06:39.227169 IP tom-Latitude-3570.49070 > c-185-45-236-223.customer.ggaweb.ch.8333: tcp 433
08:06:39.252333 IP 167.99.216.145.8333 > tom-Latitude-3570.57976: tcp 24
08:06:39.255658 IP 167.99.216.145.8333 > tom-Latitude-3570.57976: tcp 37
08:06:39.255681 IP 167.99.216.145.8333 > tom-Latitude-3570.57976: tcp 37
08:06:39.255710 IP tom-Latitude-3570.57976 > 167.99.216.145.8333: tcp 0
08:06:39.255958 IP tom-Latitude-3570.57976 > 167.99.216.145.8333: tcp 24
08:06:39.257279 IP tom-Latitude-3570.57976 > 167.99.216.145.8333: tcp 37
08:06:39.264613 IP c-185-45-236-223.customer.ggaweb.ch.8333 > tom-Latitude-3570.49070: tcp 0
08:06:39.273784 IP c-185-45-236-223.customer.ggaweb.ch.8333 > tom-Latitude-3570.49070: tcp 0
08:06:39.298111 IP 167.99.216.145.8333 > tom-Latitude-3570.57976: tcp 0
08:06:39.356490 IP tom-Latitude-3570.56714 > ns3113832.ip-54-38-177.eu.8333: tcp 24
08:06:39.357427 IP tom-Latitude-3570.56714 > ns3113832.ip-54-38-177.eu.8333: tcp 109
08:06:39.360587 IP 167.99.216.145.8333 > tom-Latitude-3570.57976: tcp 24
08:06:39.361324 IP 167.99.216.145.8333 > tom-Latitude-3570.57976: tcp 406
08:06:39.361458 IP tom-Latitude-3570.57976 > 167.99.216.145.8333: tcp 0
08:06:39.400549 IP ns3113832.ip-54-38-177.eu.8333 > tom-Latitude-3570.56714: tcp 0
08:06:39.462425 IP tom-Latitude-3570.56714 > ns3113832.ip-54-38-177.eu.8333: tcp 24
08:06:39.463380 IP tom-Latitude-3570.56714 > ns3113832.ip-54-38-177.eu.8333: tcp 37
08:06:39.506127 IP ns3113832.ip-54-38-177.eu.8333 > tom-Latitude-3570.56714: tcp 0
08:06:40.164705 IP tom-Latitude-3570.46284 > static-87-75-105-186.vodafonexdsl.co.uk.8333: tcp 24
08:06:40.227064 IP tom-Latitude-3570.46284 > static-87-75-105-186.vodafonexdsl.co.uk.8333: tcp 109
08:06:40.276224 IP static-87-75-105-186.vodafonexdsl.co.uk.8333 > tom-Latitude-3570.46284: tcp 0
08:06:40.478726 IP vmi195435.contaboserver.net.8333 > tom-Latitude-3570.39110: tcp 24
08:06:40.478743 IP tom-Latitude-3570.39110 > vmi195435.contaboserver.net.8333: tcp 0
08:06:40.478761 IP vmi195435.contaboserver.net.8333 > tom-Latitude-3570.39110: tcp 253
08:06:40.478766 IP tom-Latitude-3570.39110 > vmi195435.contaboserver.net.8333: tcp 0
08:06:40.478769 IP bb42-60-217-183.singnet.com.sg.8333 > tom-Latitude-3570.60470: tcp 24
08:06:40.478791 IP bb42-60-217-183.singnet.com.sg.8333 > tom-Latitude-3570.60470: tcp 181
08:06:40.478872 IP tom-Latitude-3570.60470 > bb42-60-217-183.singnet.com.sg.8333: tcp 0
08:06:40.479046 IP tom-Latitude-3570.39110 > vmi195435.contaboserver.net.8333: tcp 24
08:06:40.485971 IP tom-Latitude-3570.39110 > vmi195435.contaboserver.net.8333: tcp 145
08:06:40.493986 IP vmi195435.contaboserver.net.8333 > tom-Latitude-3570.39110: tcp 253
08:06:40.494002 IP tom-Latitude-3570.39110 > vmi195435.contaboserver.net.8333: tcp 0
08:06:40.521283 IP vmi195435.contaboserver.net.8333 > tom-Latitude-3570.39110: tcp 0
08:06:40.601488 IP vmi195435.contaboserver.net.8333 > tom-Latitude-3570.39110: tcp 24
08:06:40.601512 IP tom-Latitude-3570.39110 > vmi195435.contaboserver.net.8333: tcp 0
08:06:40.603694 IP vmi195435.contaboserver.net.8333 > tom-Latitude-3570.39110: tcp 414
08:06:40.603718 IP tom-Latitude-3570.39110 > vmi195435.contaboserver.net.8333: tcp 0
08:06:40.603750 IP vmi195435.contaboserver.net.8333 > tom-Latitude-3570.39110: tcp 24
08:06:40.603754 IP tom-Latitude-3570.39110 > vmi195435.contaboserver.net.8333: tcp 0
08:06:40.603773 IP vmi195435.contaboserver.net.8333 > tom-Latitude-3570.39110: tcp 189
08:06:40.603775 IP tom-Latitude-3570.39110 > vmi195435.contaboserver.net.8333: tcp 0
08:06:40.603778 IP vmi195435.contaboserver.net.8333 > tom-Latitude-3570.39110: tcp 24
08:06:40.603780 IP tom-Latitude-3570.39110 > vmi195435.contaboserver.net.8333: tcp 0
08:06:40.603783 IP vmi195435.contaboserver.net.8333 > tom-Latitude-3570.39110: tcp 225
08:06:40.603788 IP tom-Latitude-3570.39110 > vmi195435.contaboserver.net.8333: tcp 0
08:06:40.603793 IP vmi195435.contaboserver.net.8333 > tom-Latitude-3570.39110: tcp 24
08:06:40.603795 IP tom-Latitude-3570.39110 > vmi195435.contaboserver.net.8333: tcp 0
08:06:40.603799 IP vmi195435.contaboserver.net.8333 > tom-Latitude-3570.39110: tcp 249
08:06:40.603807 IP tom-Latitude-3570.39110 > vmi195435.contaboserver.net.8333: tcp 0
08:06:41.207318 IP tom-Latitude-3570.60470 > bb42-60-217-183.singnet.com.sg.8333: tcp 24
08:06:41.209429 IP tom-Latitude-3570.60470 > bb42-60-217-183.singnet.com.sg.8333: tcp 73
08:06:41.245916 IP bb42-60-217-183.singnet.com.sg.8333 > tom-Latitude-3570.60470: tcp 0
08:06:42.322680 IP 2.56.9.15.8333 > tom-Latitude-3570.42516: tcp 24
08:06:42.322699 IP 2.56.9.15.8333 > tom-Latitude-3570.42516: tcp 433
08:06:42.322702 IP vmi195435.contaboserver.net.8333 > tom-Latitude-3570.39110: tcp 24
08:06:42.322711 IP tom-Latitude-3570.39110 > vmi195435.contaboserver.net.8333: tcp 0
08:06:42.322758 IP vmi195435.contaboserver.net.8333 > tom-Latitude-3570.39110: tcp 181
08:06:42.322762 IP tom-Latitude-3570.39110 > vmi195435.contaboserver.net.8333: tcp 0
08:06:42.322764 IP 2.56.9.15.8333 > tom-Latitude-3570.42516: tcp 433
08:06:42.322769 IP tom-Latitude-3570.42516 > 2.56.9.15.8333: tcp 0
08:06:42.322772 IP vmi195435.contaboserver.net.8333 > tom-Latitude-3570.39110: tcp 181
08:06:42.322774 IP tom-Latitude-3570.39110 > vmi195435.contaboserver.net.8333: tcp 0
08:06:42.323012 IP tom-Latitude-3570.39110 > vmi195435.contaboserver.net.8333: tcp 24
08:06:42.326403 IP tom-Latitude-3570.39110 > vmi195435.contaboserver.net.8333: tcp 181
08:06:42.369950 IP vmi195435.contaboserver.net.8333 > tom-Latitude-3570.39110: tcp 0
08:06:42.447238 IP vmi195435.contaboserver.net.8333 > tom-Latitude-3570.39110: tcp 24
08:06:42.447258 IP vmi195435.contaboserver.net.8333 > tom-Latitude-3570.39110: tcp 223
08:06:42.447262 IP vmi195435.contaboserver.net.8333 > tom-Latitude-3570.39110: tcp 24
08:06:42.447265 IP vmi195435.contaboserver.net.8333 > tom-Latitude-3570.39110: tcp 221
08:06:42.447285 IP vmi195435.contaboserver.net.8333 > tom-Latitude-3570.39110: tcp 24
08:06:42.447287 IP vmi195435.contaboserver.net.8333 > tom-Latitude-3570.39110: tcp 216
08:06:42.447289 IP vmi195435.contaboserver.net.8333 > tom-Latitude-3570.39110: tcp 24
08:06:42.447351 IP tom-Latitude-3570.39110 > vmi195435.contaboserver.net.8333: tcp 0
08:06:42.447940 IP vmi195435.contaboserver.net.8333 > tom-Latitude-3570.39110: tcp 519
08:06:42.447962 IP vmi195435.contaboserver.net.8333 > tom-Latitude-3570.39110: tcp 24
08:06:42.447981 IP vmi195435.contaboserver.net.8333 > tom-Latitude-3570.39110: tcp 225
08:06:42.448025 IP tom-Latitude-3570.39110 > vmi195435.contaboserver.net.8333: tcp 0
08:06:43.552831 IP tom-Latitude-3570.56714 > ns3113832.ip-54-38-177.eu.8333: tcp 24
08:06:43.555125 IP tom-Latitude-3570.56714 > ns3113832.ip-54-38-177.eu.8333: tcp 325
08:06:43.618643 IP ns3113832.ip-54-38-177.eu.8333 > tom-Latitude-3570.56714: tcp 0
08:06:44.556287 IP tom-Latitude-3570.60988 > 81.198.101.144.8333: tcp 24
08:06:44.558431 IP tom-Latitude-3570.60988 > 81.198.101.144.8333: tcp 433
08:06:44.610416 IP 81.198.101.144.8333 > tom-Latitude-3570.60988: tcp 0
08:06:44.616451 IP 81.198.101.144.8333 > tom-Latitude-3570.60988: tcp 0
08:06:44.757062 IP tom-Latitude-3570.60470 > bb42-60-217-183.singnet.com.sg.8333: tcp 24
08:06:44.759246 IP tom-Latitude-3570.60470 > bb42-60-217-183.singnet.com.sg.8333: tcp 181
08:06:44.796282 IP bb42-60-217-183.singnet.com.sg.8333 > tom-Latitude-3570.60470: tcp 0
08:06:45.394141 IP ns3113832.ip-54-38-177.eu.8333 > tom-Latitude-3570.56714: tcp 24
08:06:45.394161 IP ns3113832.ip-54-38-177.eu.8333 > tom-Latitude-3570.56714: tcp 145
08:06:45.394166 IP ns3113832.ip-54-38-177.eu.8333 > tom-Latitude-3570.56714: tcp 145
08:06:45.394193 IP tom-Latitude-3570.56714 > ns3113832.ip-54-38-177.eu.8333: tcp 0
08:06:45.394478 IP tom-Latitude-3570.56714 > ns3113832.ip-54-38-177.eu.8333: tcp 24
08:06:45.395748 IP tom-Latitude-3570.56714 > ns3113832.ip-54-38-177.eu.8333: tcp 145
08:06:45.437265 IP ns3113832.ip-54-38-177.eu.8333 > tom-Latitude-3570.56714: tcp 0
08:06:45.477730 IP 167.99.216.145.8333 > tom-Latitude-3570.57976: tcp 24
08:06:45.487730 IP 167.99.216.145.8333 > tom-Latitude-3570.57976: tcp 37
08:06:45.487862 IP tom-Latitude-3570.57976 > 167.99.216.145.8333: tcp 0
08:06:45.488025 IP tom-Latitude-3570.57976 > 167.99.216.145.8333: tcp 24
08:06:45.489454 IP tom-Latitude-3570.57976 > 167.99.216.145.8333: tcp 37
08:06:45.495924 IP ns3113832.ip-54-38-177.eu.8333 > tom-Latitude-3570.56714: tcp 24
08:06:45.496971 IP ns3113832.ip-54-38-177.eu.8333 > tom-Latitude-3570.56714: tcp 1187
08:06:45.496986 IP ns3113832.ip-54-38-177.eu.8333 > tom-Latitude-3570.56714: tcp 24
08:06:45.496988 IP ns3113832.ip-54-38-177.eu.8333 > tom-Latitude-3570.56714: tcp 225
08:06:45.496991 IP ns3113832.ip-54-38-177.eu.8333 > tom-Latitude-3570.56714: tcp 24
08:06:45.497011 IP ns3113832.ip-54-38-177.eu.8333 > tom-Latitude-3570.56714: tcp 224
08:06:45.497014 IP ns3113832.ip-54-38-177.eu.8333 > tom-Latitude-3570.56714: tcp 24
08:06:45.497016 IP ns3113832.ip-54-38-177.eu.8333 > tom-Latitude-3570.56714: tcp 404
08:06:45.497070 IP tom-Latitude-3570.56714 > ns3113832.ip-54-38-177.eu.8333: tcp 0
08:06:45.523771 IP 167.99.216.145.8333 > tom-Latitude-3570.57976: tcp 0
08:06:46.001126 IP tom-Latitude-3570.42516 > 2.56.9.15.8333: tcp 24
08:06:46.003299 IP tom-Latitude-3570.42516 > 2.56.9.15.8333: tcp 145
08:06:46.047853 IP bb42-60-217-183.singnet.com.sg.8333 > tom-Latitude-3570.60470: tcp 24
08:06:46.047874 IP bb42-60-217-183.singnet.com.sg.8333 > tom-Latitude-3570.60470: tcp 181
08:06:46.047965 IP tom-Latitude-3570.60470 > bb42-60-217-183.singnet.com.sg.8333: tcp 0
08:06:46.048180 IP tom-Latitude-3570.60470 > bb42-60-217-183.singnet.com.sg.8333: tcp 24
08:06:46.049790 IP tom-Latitude-3570.60470 > bb42-60-217-183.singnet.com.sg.8333: tcp 37
08:06:46.058114 IP 2.56.9.15.8333 > tom-Latitude-3570.42516: tcp 0
08:06:46.077309 IP bb42-60-217-183.singnet.com.sg.8333 > tom-Latitude-3570.60470: tcp 0
08:06:46.827464 IP bb42-60-217-183.singnet.com.sg.8333 > tom-Latitude-3570.60470: tcp 24
08:06:46.827485 IP bb42-60-217-183.singnet.com.sg.8333 > tom-Latitude-3570.60470: tcp 225
08:06:46.827489 IP bb42-60-217-183.singnet.com.sg.8333 > tom-Latitude-3570.60470: tcp 225
08:06:46.827517 IP tom-Latitude-3570.60470 > bb42-60-217-183.singnet.com.sg.8333: tcp 0
08:06:46.827816 IP tom-Latitude-3570.57976 > 167.99.216.145.8333: tcp 24
08:06:46.829020 IP tom-Latitude-3570.57976 > 167.99.216.145.8333: tcp 469
08:06:46.867788 IP 167.99.216.145.8333 > tom-Latitude-3570.57976: tcp 0
08:06:46.928331 IP tom-Latitude-3570.39110 > vmi195435.contaboserver.net.8333: tcp 24
08:06:46.929287 IP tom-Latitude-3570.39110 > vmi195435.contaboserver.net.8333: tcp 181
08:06:46.969079 IP vmi195435.contaboserver.net.8333 > tom-Latitude-3570.39110: tcp 0
08:06:47.129109 IP tom-Latitude-3570.42516 > 2.56.9.15.8333: tcp 24
08:06:47.132826 IP tom-Latitude-3570.42516 > 2.56.9.15.8333: tcp 37
08:06:47.176452 IP 2.56.9.15.8333 > tom-Latitude-3570.42516: tcp 0
08:06:47.229533 IP tom-Latitude-3570.57976 > 167.99.216.145.8333: tcp 24
08:06:47.230483 IP tom-Latitude-3570.57976 > 167.99.216.145.8333: tcp 37
08:06:47.267645 IP 167.99.216.145.8333 > tom-Latitude-3570.57976: tcp 0
08:06:47.731296 IP tom-Latitude-3570.49070 > c-185-45-236-223.customer.ggaweb.ch.8333: tcp 24
08:06:47.733444 IP tom-Latitude-3570.49070 > c-185-45-236-223.customer.ggaweb.ch.8333: tcp 541
08:06:47.788285 IP 167.99.216.145.8333 > tom-Latitude-3570.57976: tcp 24
08:06:47.788304 IP 167.99.216.145.8333 > tom-Latitude-3570.57976: tcp 73
08:06:47.788306 IP 167.99.216.145.8333 > tom-Latitude-3570.57976: tcp 73
08:06:47.788334 IP tom-Latitude-3570.57976 > 167.99.216.145.8333: tcp 0
08:06:47.788347 IP c-185-45-236-223.customer.ggaweb.ch.8333 > tom-Latitude-3570.49070: tcp 0
08:06:47.788582 IP tom-Latitude-3570.57976 > 167.99.216.145.8333: tcp 24
08:06:47.789950 IP tom-Latitude-3570.57976 > 167.99.216.145.8333: tcp 73
08:06:47.796321 IP c-185-45-236-223.customer.ggaweb.ch.8333 > tom-Latitude-3570.49070: tcp 0
08:06:47.828313 IP 167.99.216.145.8333 > tom-Latitude-3570.57976: tcp 0
08:06:47.890687 IP 167.99.216.145.8333 > tom-Latitude-3570.57976: tcp 24
08:06:47.890708 IP 167.99.216.145.8333 > tom-Latitude-3570.57976: tcp 191
08:06:47.890712 IP 167.99.216.145.8333 > tom-Latitude-3570.57976: tcp 24
08:06:47.890715 IP 167.99.216.145.8333 > tom-Latitude-3570.57976: tcp 249
08:06:47.890812 IP tom-Latitude-3570.57976 > 167.99.216.145.8333: tcp 0
08:06:48.192583 IP tom-Latitude-3570.39110 > vmi195435.contaboserver.net.8333: tcp 24
08:06:48.194781 IP tom-Latitude-3570.39110 > vmi195435.contaboserver.net.8333: tcp 73
08:06:48.237402 IP vmi195435.contaboserver.net.8333 > tom-Latitude-3570.39110: tcp 0
08:06:48.293068 IP tom-Latitude-3570.60988 > 81.198.101.144.8333: tcp 24
08:06:48.294005 IP tom-Latitude-3570.60988 > 81.198.101.144.8333: tcp 253
08:06:48.329394 IP 81.198.101.144.8333 > tom-Latitude-3570.60988: tcp 0
08:06:48.336512 IP 81.198.101.144.8333 > tom-Latitude-3570.60988: tcp 0
08:06:48.379438 IP 167.99.216.145.8333 > tom-Latitude-3570.57976: tcp 24
08:06:48.379995 IP 167.99.216.145.8333 > tom-Latitude-3570.57976: tcp 37
08:06:48.380125 IP tom-Latitude-3570.57976 > 167.99.216.145.8333: tcp 0
08:06:48.380304 IP tom-Latitude-3570.57976 > 167.99.216.145.8333: tcp 24
08:06:48.381804 IP tom-Latitude-3570.57976 > 167.99.216.145.8333: tcp 37
08:06:48.417348 IP 167.99.216.145.8333 > tom-Latitude-3570.57976: tcp 0
08:06:48.479802 IP 167.99.216.145.8333 > tom-Latitude-3570.57976: tcp 24
08:06:48.479823 IP 167.99.216.145.8333 > tom-Latitude-3570.57976: tcp 225
08:06:48.479916 IP tom-Latitude-3570.57976 > 167.99.216.145.8333: tcp 0
08:06:48.480067 IP tom-Latitude-3570.49070 > c-185-45-236-223.customer.ggaweb.ch.8333: tcp 24
08:06:48.480110 IP tom-Latitude-3570.56714 > ns3113832.ip-54-38-177.eu.8333: tcp 24
08:06:48.482032 IP tom-Latitude-3570.49070 > c-185-45-236-223.customer.ggaweb.ch.8333: tcp 73
08:06:48.482687 IP tom-Latitude-3570.56714 > ns3113832.ip-54-38-177.eu.8333: tcp 109
08:06:48.489197 IP bb42-60-217-183.singnet.com.sg.8333 > tom-Latitude-3570.60470: tcp 24
08:06:48.489211 IP tom-Latitude-3570.60470 > bb42-60-217-183.singnet.com.sg.8333: tcp 0
08:06:48.489911 IP bb42-60-217-183.singnet.com.sg.8333 > tom-Latitude-3570.60470: tcp 73
08:06:48.489925 IP tom-Latitude-3570.60470 > bb42-60-217-183.singnet.com.sg.8333: tcp 0
08:06:48.502266 IP c-185-45-236-223.customer.ggaweb.ch.8333 > tom-Latitude-3570.49070: tcp 0
08:06:48.510282 IP ns3113832.ip-54-38-177.eu.8333 > tom-Latitude-3570.56714: tcp 0
08:06:48.510886 IP c-185-45-236-223.customer.ggaweb.ch.8333 > tom-Latitude-3570.49070: tcp 0
08:06:48.791249 IP tom-Latitude-3570.60470 > bb42-60-217-183.singnet.com.sg.8333: tcp 24
08:06:48.793517 IP tom-Latitude-3570.60470 > bb42-60-217-183.singnet.com.sg.8333: tcp 37
08:06:48.840171 IP bb42-60-217-183.singnet.com.sg.8333 > tom-Latitude-3570.60470: tcp 0
08:06:48.991994 IP tom-Latitude-3570.42516 > 2.56.9.15.8333: tcp 24
08:06:48.994282 IP tom-Latitude-3570.42516 > 2.56.9.15.8333: tcp 109
08:06:49.037307 IP 2.56.9.15.8333 > tom-Latitude-3570.42516: tcp 0
08:06:49.092380 IP tom-Latitude-3570.60988 > 81.198.101.144.8333: tcp 24
08:06:49.093389 IP tom-Latitude-3570.60988 > 81.198.101.144.8333: tcp 37
08:06:49.168598 IP 81.198.101.144.8333 > tom-Latitude-3570.60988: tcp 0
08:06:49.174455 IP 2.56.9.15.8333 > tom-Latitude-3570.42516: tcp 24
08:06:49.174479 IP tom-Latitude-3570.42516 > 2.56.9.15.8333: tcp 0
08:06:49.174510 IP 2.56.9.15.8333 > tom-Latitude-3570.42516: tcp 37
08:06:49.174514 IP tom-Latitude-3570.42516 > 2.56.9.15.8333: tcp 0
08:06:49.174519 IP 81.198.101.144.8333 > tom-Latitude-3570.60988: tcp 0
08:06:49.174709 IP tom-Latitude-3570.42516 > 2.56.9.15.8333: tcp 24
08:06:49.177630 IP tom-Latitude-3570.42516 > 2.56.9.15.8333: tcp 225
08:06:49.199940 IP bb42-60-217-183.singnet.com.sg.8333 > tom-Latitude-3570.60470: tcp 24
08:06:49.199964 IP tom-Latitude-3570.60470 > bb42-60-217-183.singnet.com.sg.8333: tcp 0
08:06:49.202881 IP bb42-60-217-183.singnet.com.sg.8333 > tom-Latitude-3570.60470: tcp 37
08:06:49.202898 IP tom-Latitude-3570.60470 > bb42-60-217-183.singnet.com.sg.8333: tcp 0
08:06:49.203153 IP tom-Latitude-3570.60470 > bb42-60-217-183.singnet.com.sg.8333: tcp 24
08:06:49.204349 IP tom-Latitude-3570.60470 > bb42-60-217-183.singnet.com.sg.8333: tcp 225
08:06:49.217352 IP 2.56.9.15.8333 > tom-Latitude-3570.42516: tcp 0
08:06:49.237315 IP bb42-60-217-183.singnet.com.sg.8333 > tom-Latitude-3570.60470: tcp 0
08:06:49.490141 IP c-185-45-236-223.customer.ggaweb.ch.8333 > tom-Latitude-3570.49070: tcp 24
08:06:49.490162 IP c-185-45-236-223.customer.ggaweb.ch.8333 > tom-Latitude-3570.49070: tcp 469
08:06:49.490167 IP c-185-45-236-223.customer.ggaweb.ch.8333 > tom-Latitude-3570.49070: tcp 469
08:06:49.490194 IP tom-Latitude-3570.49070 > c-185-45-236-223.customer.ggaweb.ch.8333: tcp 0
08:06:49.490564 IP tom-Latitude-3570.49070 > c-185-45-236-223.customer.ggaweb.ch.8333: tcp 24
08:06:49.491781 IP tom-Latitude-3570.49070 > c-185-45-236-223.customer.ggaweb.ch.8333: tcp 433
08:06:49.534176 IP c-185-45-236-223.customer.ggaweb.ch.8333 > tom-Latitude-3570.49070: tcp 0
08:06:49.534755 IP c-185-45-236-223.customer.ggaweb.ch.8333 > tom-Latitude-3570.49070: tcp 0
08:06:49.610569 IP c-185-45-236-223.customer.ggaweb.ch.8333 > tom-Latitude-3570.49070: tcp 24
08:06:49.611771 IP c-185-45-236-223.customer.ggaweb.ch.8333 > tom-Latitude-3570.49070: tcp 976
08:06:49.611790 IP c-185-45-236-223.customer.ggaweb.ch.8333 > tom-Latitude-3570.49070: tcp 1229
08:06:49.611794 IP c-185-45-236-223.customer.ggaweb.ch.8333 > tom-Latitude-3570.49070: tcp 1230
08:06:49.611796 IP c-185-45-236-223.customer.ggaweb.ch.8333 > tom-Latitude-3570.49070: tcp 308
08:06:49.611883 IP tom-Latitude-3570.49070 > c-185-45-236-223.customer.ggaweb.ch.8333: tcp 0
08:06:49.715650 IP tom-Latitude-3570.60470 > bb42-60-217-183.singnet.com.sg.8333: tcp 24
08:06:49.717375 IP tom-Latitude-3570.60470 > bb42-60-217-183.singnet.com.sg.8333: tcp 433
08:06:49.757336 IP bb42-60-217-183.singnet.com.sg.8333 > tom-Latitude-3570.60470: tcp 0
08:06:49.816112 IP tom-Latitude-3570.39110 > vmi195435.contaboserver.net.8333: tcp 24
08:06:49.816196 IP tom-Latitude-3570.60988 > 81.198.101.144.8333: tcp 24
08:06:49.817154 IP tom-Latitude-3570.39110 > vmi195435.contaboserver.net.8333: tcp 469
08:06:49.817771 IP tom-Latitude-3570.60988 > 81.198.101.144.8333: tcp 433
08:06:49.855556 IP 81.198.101.144.8333 > tom-Latitude-3570.60988: tcp 0
08:06:49.866475 IP vmi195435.contaboserver.net.8333 > tom-Latitude-3570.39110: tcp 0
08:06:49.867075 IP 81.198.101.144.8333 > tom-Latitude-3570.60988: tcp 0
08:06:49.948487 IP 81.198.101.144.8333 > tom-Latitude-3570.60988: tcp 24
08:06:49.949525 IP 81.198.101.144.8333 > tom-Latitude-3570.60988: tcp 109
08:06:49.949655 IP tom-Latitude-3570.60988 > 81.198.101.144.8333: tcp 0
