19:19:51.663134 IP tom-Latitude-3570.47742 > 97-82-78-25.dhcp.leds.al.charter.com.8333: tcp 24
19:19:51.663151 IP tom-Latitude-3570.47742 > 97-82-78-25.dhcp.leds.al.charter.com.8333: tcp 1153
19:19:51.721689 IP 97-82-78-25.dhcp.leds.al.charter.com.8333 > tom-Latitude-3570.47742: tcp 0
19:19:51.763409 IP tom-Latitude-3570.33922 > pool-108-20-207-31.bstnma.fios.verizon.net.8333: tcp 24
19:19:51.763466 IP tom-Latitude-3570.54046 > 184-101-12-201.phnx.qwest.net.8333: tcp 24
19:19:51.764243 IP tom-Latitude-3570.54046 > 184-101-12-201.phnx.qwest.net.8333: tcp 217
19:19:51.764248 IP tom-Latitude-3570.33922 > pool-108-20-207-31.bstnma.fios.verizon.net.8333: tcp 109
19:19:51.772850 IP 97-82-78-25.dhcp.leds.al.charter.com.8333 > tom-Latitude-3570.47742: tcp 0
19:19:51.793873 IP pool-108-20-207-31.bstnma.fios.verizon.net.8333 > tom-Latitude-3570.33922: tcp 0
19:19:51.794518 IP 184-101-12-201.phnx.qwest.net.8333 > tom-Latitude-3570.54046: tcp 0
19:19:51.794530 IP 184-101-12-201.phnx.qwest.net.8333 > tom-Latitude-3570.54046: tcp 0
19:19:51.797406 IP pool-108-20-207-31.bstnma.fios.verizon.net.8333 > tom-Latitude-3570.33922: tcp 0
19:19:51.863671 IP tom-Latitude-3570.56244 > 172.214.77.34.bc.googleusercontent.com.8333: tcp 24
19:19:51.865091 IP tom-Latitude-3570.56244 > 172.214.77.34.bc.googleusercontent.com.8333: tcp 61
19:19:51.893888 IP 172.214.77.34.bc.googleusercontent.com.8333 > tom-Latitude-3570.56244: tcp 0
19:19:51.911891 IP 172.214.77.34.bc.googleusercontent.com.8333 > tom-Latitude-3570.56244: tcp 0
19:19:52.571588 IP ec2-52-56-97-80.eu-west-2.compute.amazonaws.com.8333 > tom-Latitude-3570.36650: tcp 24
19:19:52.571608 IP ec2-52-56-97-80.eu-west-2.compute.amazonaws.com.8333 > tom-Latitude-3570.36650: tcp 181
19:19:52.571641 IP tom-Latitude-3570.36650 > ec2-52-56-97-80.eu-west-2.compute.amazonaws.com.8333: tcp 0
19:19:52.571853 IP tom-Latitude-3570.36650 > ec2-52-56-97-80.eu-west-2.compute.amazonaws.com.8333: tcp 24
19:19:52.574795 IP tom-Latitude-3570.36650 > ec2-52-56-97-80.eu-west-2.compute.amazonaws.com.8333: tcp 181
19:19:52.626117 IP ec2-52-56-97-80.eu-west-2.compute.amazonaws.com.8333 > tom-Latitude-3570.36650: tcp 0
19:19:52.647854 IP ec2-52-56-97-80.eu-west-2.compute.amazonaws.com.8333 > tom-Latitude-3570.36650: tcp 0
19:19:52.708582 IP ec2-52-56-97-80.eu-west-2.compute.amazonaws.com.8333 > tom-Latitude-3570.36650: tcp 24
19:19:52.708596 IP ec2-52-56-97-80.eu-west-2.compute.amazonaws.com.8333 > tom-Latitude-3570.36650: tcp 226
19:19:52.708665 IP tom-Latitude-3570.36650 > ec2-52-56-97-80.eu-west-2.compute.amazonaws.com.8333: tcp 0
19:19:52.709402 IP ec2-52-56-97-80.eu-west-2.compute.amazonaws.com.8333 > tom-Latitude-3570.36650: tcp 1382
19:19:52.712472 IP ec2-52-56-97-80.eu-west-2.compute.amazonaws.com.8333 > tom-Latitude-3570.36650: tcp 56
19:19:52.712489 IP tom-Latitude-3570.36650 > ec2-52-56-97-80.eu-west-2.compute.amazonaws.com.8333: tcp 0
19:19:52.750176 IP 172.214.77.34.bc.googleusercontent.com.8333 > tom-Latitude-3570.56244: tcp 24
19:19:52.750190 IP 172.214.77.34.bc.googleusercontent.com.8333 > tom-Latitude-3570.56244: tcp 325
19:19:52.750217 IP tom-Latitude-3570.56244 > 172.214.77.34.bc.googleusercontent.com.8333: tcp 0
19:19:52.983655 IP host93-234-110-95.serverdedicati.aruba.it.8333 > tom-Latitude-3570.34082: tcp 24
19:19:52.983669 IP host93-234-110-95.serverdedicati.aruba.it.8333 > tom-Latitude-3570.34082: tcp 289
19:19:52.983739 IP tom-Latitude-3570.34082 > host93-234-110-95.serverdedicati.aruba.it.8333: tcp 0
19:19:52.983878 IP tom-Latitude-3570.34082 > host93-234-110-95.serverdedicati.aruba.it.8333: tcp 24
19:19:52.985973 IP tom-Latitude-3570.34082 > host93-234-110-95.serverdedicati.aruba.it.8333: tcp 37
19:19:53.022298 IP host93-234-110-95.serverdedicati.aruba.it.8333 > tom-Latitude-3570.34082: tcp 0
19:19:53.022312 IP host93-234-110-95.serverdedicati.aruba.it.8333 > tom-Latitude-3570.34082: tcp 0
19:19:53.056702 IP 172.214.77.34.bc.googleusercontent.com.8333 > tom-Latitude-3570.56244: tcp 24
19:19:53.056717 IP 172.214.77.34.bc.googleusercontent.com.8333 > tom-Latitude-3570.56244: tcp 73
19:19:53.056756 IP tom-Latitude-3570.56244 > 172.214.77.34.bc.googleusercontent.com.8333: tcp 0
19:19:53.116191 IP host93-234-110-95.serverdedicati.aruba.it.8333 > tom-Latitude-3570.34082: tcp 24
19:19:53.116211 IP host93-234-110-95.serverdedicati.aruba.it.8333 > tom-Latitude-3570.34082: tcp 248
19:19:53.116259 IP tom-Latitude-3570.34082 > host93-234-110-95.serverdedicati.aruba.it.8333: tcp 0
19:19:53.216817 IP tom-Latitude-3570.56244 > 172.214.77.34.bc.googleusercontent.com.8333: tcp 24
19:19:53.216850 IP tom-Latitude-3570.36650 > ec2-52-56-97-80.eu-west-2.compute.amazonaws.com.8333: tcp 24
19:19:53.216994 IP tom-Latitude-3570.59818 > c-73-101-52-184.hsd1.pa.comcast.net.8333: tcp 24
19:19:53.217774 IP tom-Latitude-3570.36650 > ec2-52-56-97-80.eu-west-2.compute.amazonaws.com.8333: tcp 37
19:19:53.217785 IP tom-Latitude-3570.56244 > 172.214.77.34.bc.googleusercontent.com.8333: tcp 37
19:19:53.218392 IP tom-Latitude-3570.59818 > c-73-101-52-184.hsd1.pa.comcast.net.8333: tcp 505
19:19:53.249888 IP c-73-101-52-184.hsd1.pa.comcast.net.8333 > tom-Latitude-3570.59818: tcp 0
19:19:53.250435 IP 172.214.77.34.bc.googleusercontent.com.8333 > tom-Latitude-3570.56244: tcp 0
19:19:53.254430 IP ec2-52-56-97-80.eu-west-2.compute.amazonaws.com.8333 > tom-Latitude-3570.36650: tcp 0
19:19:53.254438 IP ec2-52-56-97-80.eu-west-2.compute.amazonaws.com.8333 > tom-Latitude-3570.36650: tcp 0
19:19:53.254441 IP 172.214.77.34.bc.googleusercontent.com.8333 > tom-Latitude-3570.56244: tcp 0
19:19:53.254443 IP c-73-101-52-184.hsd1.pa.comcast.net.8333 > tom-Latitude-3570.59818: tcp 0
19:19:53.317164 IP tom-Latitude-3570.33922 > pool-108-20-207-31.bstnma.fios.verizon.net.8333: tcp 24
19:19:53.349197 IP tom-Latitude-3570.33922 > pool-108-20-207-31.bstnma.fios.verizon.net.8333: tcp 217
19:19:53.396228 IP pool-108-20-207-31.bstnma.fios.verizon.net.8333 > tom-Latitude-3570.33922: tcp 0
19:19:53.396792 IP pool-108-20-207-31.bstnma.fios.verizon.net.8333 > tom-Latitude-3570.33922: tcp 0
19:19:53.717915 IP tom-Latitude-3570.54046 > 184-101-12-201.phnx.qwest.net.8333: tcp 24
19:19:53.719943 IP tom-Latitude-3570.54046 > 184-101-12-201.phnx.qwest.net.8333: tcp 217
19:19:53.762117 IP 184-101-12-201.phnx.qwest.net.8333 > tom-Latitude-3570.54046: tcp 0
19:19:53.809716 IP 184-101-12-201.phnx.qwest.net.8333 > tom-Latitude-3570.54046: tcp 0
19:19:54.005152 IP 59.110.157.16.8333 > tom-Latitude-3570.47822: tcp 24
19:19:54.005166 IP tom-Latitude-3570.47822 > 59.110.157.16.8333: tcp 0
19:19:54.005179 IP 59.110.157.16.8333 > tom-Latitude-3570.47822: tcp 505
19:19:54.005182 IP tom-Latitude-3570.47822 > 59.110.157.16.8333: tcp 0
19:19:54.105667 IP tom-Latitude-3570.47742 > 97-82-78-25.dhcp.leds.al.charter.com.8333: tcp 24
19:19:54.106469 IP tom-Latitude-3570.47742 > 97-82-78-25.dhcp.leds.al.charter.com.8333: tcp 217
19:19:54.139798 IP ec2-52-56-97-80.eu-west-2.compute.amazonaws.com.8333 > tom-Latitude-3570.36650: tcp 24
19:19:54.146304 IP ec2-52-56-97-80.eu-west-2.compute.amazonaws.com.8333 > tom-Latitude-3570.36650: tcp 109
19:19:54.146377 IP tom-Latitude-3570.36650 > ec2-52-56-97-80.eu-west-2.compute.amazonaws.com.8333: tcp 0
19:19:54.146500 IP tom-Latitude-3570.36650 > ec2-52-56-97-80.eu-west-2.compute.amazonaws.com.8333: tcp 24
19:19:54.149099 IP tom-Latitude-3570.36650 > ec2-52-56-97-80.eu-west-2.compute.amazonaws.com.8333: tcp 109
19:19:54.161683 IP 97-82-78-25.dhcp.leds.al.charter.com.8333 > tom-Latitude-3570.47742: tcp 0
19:19:54.169710 IP 59.110.157.16.8333 > tom-Latitude-3570.47822: tcp 24
19:19:54.169722 IP tom-Latitude-3570.47822 > 59.110.157.16.8333: tcp 0
19:19:54.191767 IP 59.110.157.16.8333 > tom-Latitude-3570.47822: tcp 37
19:19:54.191800 IP tom-Latitude-3570.47822 > 59.110.157.16.8333: tcp 0
19:19:54.192463 IP 97-82-78-25.dhcp.leds.al.charter.com.8333 > tom-Latitude-3570.47742: tcp 0
19:19:54.213702 IP ec2-52-56-97-80.eu-west-2.compute.amazonaws.com.8333 > tom-Latitude-3570.36650: tcp 0
19:19:54.214360 IP ec2-52-56-97-80.eu-west-2.compute.amazonaws.com.8333 > tom-Latitude-3570.36650: tcp 0
19:19:54.273950 IP ec2-52-56-97-80.eu-west-2.compute.amazonaws.com.8333 > tom-Latitude-3570.36650: tcp 24
19:19:54.274687 IP ec2-52-56-97-80.eu-west-2.compute.amazonaws.com.8333 > tom-Latitude-3570.36650: tcp 406
19:19:54.274802 IP tom-Latitude-3570.36650 > ec2-52-56-97-80.eu-west-2.compute.amazonaws.com.8333: tcp 0
19:19:54.277323 IP ec2-52-56-97-80.eu-west-2.compute.amazonaws.com.8333 > tom-Latitude-3570.36650: tcp 703
19:19:54.319695 IP tom-Latitude-3570.36650 > ec2-52-56-97-80.eu-west-2.compute.amazonaws.com.8333: tcp 0
19:19:54.517155 IP 97-82-78-25.dhcp.leds.al.charter.com.8333 > tom-Latitude-3570.47742: tcp 24
19:19:54.517169 IP 97-82-78-25.dhcp.leds.al.charter.com.8333 > tom-Latitude-3570.47742: tcp 109
19:19:54.517207 IP tom-Latitude-3570.47742 > 97-82-78-25.dhcp.leds.al.charter.com.8333: tcp 0
19:19:54.817835 IP tom-Latitude-3570.54046 > 184-101-12-201.phnx.qwest.net.8333: tcp 24
19:19:54.819626 IP tom-Latitude-3570.54046 > 184-101-12-201.phnx.qwest.net.8333: tcp 109
19:19:54.862225 IP 184-101-12-201.phnx.qwest.net.8333 > tom-Latitude-3570.54046: tcp 0
19:19:54.862237 IP 184-101-12-201.phnx.qwest.net.8333 > tom-Latitude-3570.54046: tcp 0
19:19:55.029105 IP c-73-101-52-184.hsd1.pa.comcast.net.8333 > tom-Latitude-3570.59818: tcp 24
19:19:55.029121 IP c-73-101-52-184.hsd1.pa.comcast.net.8333 > tom-Latitude-3570.59818: tcp 145
19:19:55.029138 IP tom-Latitude-3570.59818 > c-73-101-52-184.hsd1.pa.comcast.net.8333: tcp 0
19:19:55.029284 IP tom-Latitude-3570.59818 > c-73-101-52-184.hsd1.pa.comcast.net.8333: tcp 24
19:19:55.030425 IP tom-Latitude-3570.59818 > c-73-101-52-184.hsd1.pa.comcast.net.8333: tcp 37
19:19:55.064110 IP c-73-101-52-184.hsd1.pa.comcast.net.8333 > tom-Latitude-3570.59818: tcp 0
19:19:55.064816 IP c-73-101-52-184.hsd1.pa.comcast.net.8333 > tom-Latitude-3570.59818: tcp 0
19:19:55.389466 IP c-73-101-52-184.hsd1.pa.comcast.net.8333 > tom-Latitude-3570.59818: tcp 24
19:19:55.389475 IP c-73-101-52-184.hsd1.pa.comcast.net.8333 > tom-Latitude-3570.59818: tcp 216
19:19:55.389573 IP tom-Latitude-3570.59818 > c-73-101-52-184.hsd1.pa.comcast.net.8333: tcp 0
19:19:55.490168 IP tom-Latitude-3570.34082 > host93-234-110-95.serverdedicati.aruba.it.8333: tcp 24
19:19:55.491636 IP tom-Latitude-3570.34082 > host93-234-110-95.serverdedicati.aruba.it.8333: tcp 145
19:19:55.521763 IP host93-234-110-95.serverdedicati.aruba.it.8333 > tom-Latitude-3570.34082: tcp 0
19:19:55.540767 IP host93-234-110-95.serverdedicati.aruba.it.8333 > tom-Latitude-3570.34082: tcp 0
19:19:55.790656 IP tom-Latitude-3570.56244 > 172.214.77.34.bc.googleusercontent.com.8333: tcp 24
19:19:55.791420 IP tom-Latitude-3570.56244 > 172.214.77.34.bc.googleusercontent.com.8333: tcp 145
19:19:55.823515 IP 172.214.77.34.bc.googleusercontent.com.8333 > tom-Latitude-3570.56244: tcp 0
19:19:55.827260 IP 172.214.77.34.bc.googleusercontent.com.8333 > tom-Latitude-3570.56244: tcp 0
19:19:55.845777 IP 59.110.157.16.8333 > tom-Latitude-3570.47822: tcp 24
19:19:55.845795 IP tom-Latitude-3570.47822 > 59.110.157.16.8333: tcp 0
19:19:55.858180 IP 59.110.157.16.8333 > tom-Latitude-3570.47822: tcp 253
19:19:55.858202 IP tom-Latitude-3570.47822 > 59.110.157.16.8333: tcp 0
19:19:55.858451 IP tom-Latitude-3570.47822 > 59.110.157.16.8333: tcp 24
19:19:55.859560 IP tom-Latitude-3570.47822 > 59.110.157.16.8333: tcp 145
19:19:55.911159 IP 59.110.157.16.8333 > tom-Latitude-3570.47822: tcp 0
19:19:55.911177 IP 59.110.157.16.8333 > tom-Latitude-3570.47822: tcp 0
19:19:56.359877 IP tom-Latitude-3570.33922 > pool-108-20-207-31.bstnma.fios.verizon.net.8333: tcp 24
19:19:56.360712 IP tom-Latitude-3570.33922 > pool-108-20-207-31.bstnma.fios.verizon.net.8333: tcp 145
19:19:56.503710 IP tom-Latitude-3570.33922 > pool-108-20-207-31.bstnma.fios.verizon.net.8333: tcp 145
19:19:56.550388 IP pool-108-20-207-31.bstnma.fios.verizon.net.8333 > tom-Latitude-3570.33922: tcp 0
19:19:56.550392 IP pool-108-20-207-31.bstnma.fios.verizon.net.8333 > tom-Latitude-3570.33922: tcp 0
19:19:56.567069 IP pool-108-20-207-31.bstnma.fios.verizon.net.8333 > tom-Latitude-3570.33922: tcp 0
19:19:57.077870 IP 59.110.157.16.8333 > tom-Latitude-3570.47822: tcp 24
19:19:57.077876 IP 59.110.157.16.8333 > tom-Latitude-3570.47822: tcp 192
19:19:57.077878 IP 59.110.157.16.8333 > tom-Latitude-3570.47822: tcp 24
19:19:57.077920 IP tom-Latitude-3570.47822 > 59.110.157.16.8333: tcp 0
19:19:57.326474 IP 59.110.157.16.8333 > tom-Latitude-3570.47822: tcp 1448
19:19:57.326487 IP 59.110.157.16.8333 > tom-Latitude-3570.47822: tcp 18
19:19:57.326532 IP tom-Latitude-3570.47822 > 59.110.157.16.8333: tcp 0
19:19:57.431028 IP tom-Latitude-3570.54046 > 184-101-12-201.phnx.qwest.net.8333: tcp 24
19:19:57.431769 IP tom-Latitude-3570.54046 > 184-101-12-201.phnx.qwest.net.8333: tcp 181
19:19:57.450386 IP ec2-52-56-97-80.eu-west-2.compute.amazonaws.com.8333 > tom-Latitude-3570.36650: tcp 24
19:19:57.450408 IP tom-Latitude-3570.36650 > ec2-52-56-97-80.eu-west-2.compute.amazonaws.com.8333: tcp 0
19:19:57.450434 IP ec2-52-56-97-80.eu-west-2.compute.amazonaws.com.8333 > tom-Latitude-3570.36650: tcp 649
19:19:57.450438 IP tom-Latitude-3570.36650 > ec2-52-56-97-80.eu-west-2.compute.amazonaws.com.8333: tcp 0
19:19:57.450756 IP tom-Latitude-3570.36650 > ec2-52-56-97-80.eu-west-2.compute.amazonaws.com.8333: tcp 24
19:19:57.451740 IP tom-Latitude-3570.36650 > ec2-52-56-97-80.eu-west-2.compute.amazonaws.com.8333: tcp 469
19:19:57.463702 IP 184-101-12-201.phnx.qwest.net.8333 > tom-Latitude-3570.54046: tcp 0
19:19:57.468279 IP 184-101-12-201.phnx.qwest.net.8333 > tom-Latitude-3570.54046: tcp 0
19:19:57.497990 IP ec2-52-56-97-80.eu-west-2.compute.amazonaws.com.8333 > tom-Latitude-3570.36650: tcp 0
19:19:57.499147 IP ec2-52-56-97-80.eu-west-2.compute.amazonaws.com.8333 > tom-Latitude-3570.36650: tcp 0
19:19:57.606337 IP ec2-52-56-97-80.eu-west-2.compute.amazonaws.com.8333 > tom-Latitude-3570.36650: tcp 24
19:19:57.607427 IP ec2-52-56-97-80.eu-west-2.compute.amazonaws.com.8333 > tom-Latitude-3570.36650: tcp 257
19:19:57.607519 IP tom-Latitude-3570.36650 > ec2-52-56-97-80.eu-west-2.compute.amazonaws.com.8333: tcp 0
19:19:57.617422 IP ec2-52-56-97-80.eu-west-2.compute.amazonaws.com.8333 > tom-Latitude-3570.36650: tcp 1448
19:19:57.617695 IP tom-Latitude-3570.36650 > ec2-52-56-97-80.eu-west-2.compute.amazonaws.com.8333: tcp 0
19:19:57.619733 IP ec2-52-56-97-80.eu-west-2.compute.amazonaws.com.8333 > tom-Latitude-3570.36650: tcp 118
19:19:57.632738 IP ec2-52-56-97-80.eu-west-2.compute.amazonaws.com.8333 > tom-Latitude-3570.36650: tcp 1448
19:19:57.632882 IP tom-Latitude-3570.36650 > ec2-52-56-97-80.eu-west-2.compute.amazonaws.com.8333: tcp 0
19:19:57.635488 IP ec2-52-56-97-80.eu-west-2.compute.amazonaws.com.8333 > tom-Latitude-3570.36650: tcp 485
19:19:57.637458 IP ec2-52-56-97-80.eu-west-2.compute.amazonaws.com.8333 > tom-Latitude-3570.36650: tcp 250
19:19:57.637465 IP ec2-52-56-97-80.eu-west-2.compute.amazonaws.com.8333 > tom-Latitude-3570.36650: tcp 24
19:19:57.637468 IP ec2-52-56-97-80.eu-west-2.compute.amazonaws.com.8333 > tom-Latitude-3570.36650: tcp 1448
19:19:57.637527 IP tom-Latitude-3570.36650 > ec2-52-56-97-80.eu-west-2.compute.amazonaws.com.8333: tcp 0
19:19:57.656753 IP ec2-52-56-97-80.eu-west-2.compute.amazonaws.com.8333 > tom-Latitude-3570.36650: tcp 1448
19:19:57.656867 IP tom-Latitude-3570.36650 > ec2-52-56-97-80.eu-west-2.compute.amazonaws.com.8333: tcp 0
19:19:57.662156 IP ec2-52-56-97-80.eu-west-2.compute.amazonaws.com.8333 > tom-Latitude-3570.36650: tcp 1448
19:19:57.662265 IP tom-Latitude-3570.36650 > ec2-52-56-97-80.eu-west-2.compute.amazonaws.com.8333: tcp 0
19:19:57.677075 IP ec2-52-56-97-80.eu-west-2.compute.amazonaws.com.8333 > tom-Latitude-3570.36650: tcp 1382
19:19:57.677917 IP ec2-52-56-97-80.eu-west-2.compute.amazonaws.com.8333 > tom-Latitude-3570.36650: tcp 66
19:19:57.677927 IP tom-Latitude-3570.36650 > ec2-52-56-97-80.eu-west-2.compute.amazonaws.com.8333: tcp 0
19:19:57.677941 IP ec2-52-56-97-80.eu-west-2.compute.amazonaws.com.8333 > tom-Latitude-3570.36650: tcp 1448
19:19:57.677944 IP ec2-52-56-97-80.eu-west-2.compute.amazonaws.com.8333 > tom-Latitude-3570.36650: tcp 1382
19:19:57.678006 IP tom-Latitude-3570.36650 > ec2-52-56-97-80.eu-west-2.compute.amazonaws.com.8333: tcp 0
19:19:57.691717 IP ec2-52-56-97-80.eu-west-2.compute.amazonaws.com.8333 > tom-Latitude-3570.36650: tcp 1382
19:19:57.692453 IP ec2-52-56-97-80.eu-west-2.compute.amazonaws.com.8333 > tom-Latitude-3570.36650: tcp 1382
19:19:57.692539 IP tom-Latitude-3570.36650 > ec2-52-56-97-80.eu-west-2.compute.amazonaws.com.8333: tcp 0
19:19:57.695127 IP ec2-52-56-97-80.eu-west-2.compute.amazonaws.com.8333 > tom-Latitude-3570.36650: tcp 1382
19:19:57.699018 IP ec2-52-56-97-80.eu-west-2.compute.amazonaws.com.8333 > tom-Latitude-3570.36650: tcp 381
19:19:57.699127 IP tom-Latitude-3570.36650 > ec2-52-56-97-80.eu-west-2.compute.amazonaws.com.8333: tcp 0
19:19:57.809967 IP 172.214.77.34.bc.googleusercontent.com.8333 > tom-Latitude-3570.56244: tcp 24
19:19:57.811791 IP 172.214.77.34.bc.googleusercontent.com.8333 > tom-Latitude-3570.56244: tcp 469
19:19:57.811811 IP tom-Latitude-3570.56244 > 172.214.77.34.bc.googleusercontent.com.8333: tcp 0
19:19:59.114475 IP tom-Latitude-3570.54046 > 184-101-12-201.phnx.qwest.net.8333: tcp 24
19:19:59.116618 IP tom-Latitude-3570.54046 > 184-101-12-201.phnx.qwest.net.8333: tcp 469
19:19:59.128476 IP 172.214.77.34.bc.googleusercontent.com.8333 > tom-Latitude-3570.56244: tcp 24
19:19:59.128484 IP 172.214.77.34.bc.googleusercontent.com.8333 > tom-Latitude-3570.56244: tcp 289
19:19:59.128558 IP tom-Latitude-3570.56244 > 172.214.77.34.bc.googleusercontent.com.8333: tcp 0
19:19:59.128832 IP tom-Latitude-3570.56244 > 172.214.77.34.bc.googleusercontent.com.8333: tcp 24
19:19:59.129791 IP tom-Latitude-3570.56244 > 172.214.77.34.bc.googleusercontent.com.8333: tcp 145
19:19:59.183763 IP 184-101-12-201.phnx.qwest.net.8333 > tom-Latitude-3570.54046: tcp 0
19:19:59.229245 IP tom-Latitude-3570.34082 > host93-234-110-95.serverdedicati.aruba.it.8333: tcp 24
19:19:59.230134 IP tom-Latitude-3570.34082 > host93-234-110-95.serverdedicati.aruba.it.8333: tcp 613
19:19:59.247681 IP tom-Latitude-3570.56244 > 172.214.77.34.bc.googleusercontent.com.8333: tcp 145
19:19:59.258481 IP 184-101-12-201.phnx.qwest.net.8333 > tom-Latitude-3570.54046: tcp 0
19:19:59.258486 IP 172.214.77.34.bc.googleusercontent.com.8333 > tom-Latitude-3570.56244: tcp 0
19:19:59.258490 IP 172.214.77.34.bc.googleusercontent.com.8333 > tom-Latitude-3570.56244: tcp 0
19:19:59.258493 IP 97-82-78-25.dhcp.leds.al.charter.com.8333 > tom-Latitude-3570.47742: tcp 24
19:19:59.258498 IP 97-82-78-25.dhcp.leds.al.charter.com.8333 > tom-Latitude-3570.47742: tcp 865
19:19:59.258520 IP tom-Latitude-3570.47742 > 97-82-78-25.dhcp.leds.al.charter.com.8333: tcp 0
19:19:59.258895 IP tom-Latitude-3570.47742 > 97-82-78-25.dhcp.leds.al.charter.com.8333: tcp 24
19:19:59.259854 IP tom-Latitude-3570.47742 > 97-82-78-25.dhcp.leds.al.charter.com.8333: tcp 73
19:19:59.312405 IP host93-234-110-95.serverdedicati.aruba.it.8333 > tom-Latitude-3570.34082: tcp 0
19:19:59.312418 IP host93-234-110-95.serverdedicati.aruba.it.8333 > tom-Latitude-3570.34082: tcp 0
19:19:59.330886 IP 172.214.77.34.bc.googleusercontent.com.8333 > tom-Latitude-3570.56244: tcp 0
19:19:59.340706 IP 172.214.77.34.bc.googleusercontent.com.8333 > tom-Latitude-3570.56244: tcp 24
19:19:59.343505 IP 172.214.77.34.bc.googleusercontent.com.8333 > tom-Latitude-3570.56244: tcp 224
19:19:59.343525 IP tom-Latitude-3570.56244 > 172.214.77.34.bc.googleusercontent.com.8333: tcp 0
19:19:59.344094 IP tom-Latitude-3570.47822 > 59.110.157.16.8333: tcp 24
19:19:59.344139 IP tom-Latitude-3570.54046 > 184-101-12-201.phnx.qwest.net.8333: tcp 24
19:19:59.344169 IP 172.214.77.34.bc.googleusercontent.com.8333 > tom-Latitude-3570.56244: tcp 24
19:19:59.344178 IP 172.214.77.34.bc.googleusercontent.com.8333 > tom-Latitude-3570.56244: tcp 224
19:19:59.344181 IP 172.214.77.34.bc.googleusercontent.com.8333 > tom-Latitude-3570.56244: tcp 24
19:19:59.344274 IP tom-Latitude-3570.56244 > 172.214.77.34.bc.googleusercontent.com.8333: tcp 0
19:19:59.344788 IP tom-Latitude-3570.54046 > 184-101-12-201.phnx.qwest.net.8333: tcp 37
19:19:59.344793 IP tom-Latitude-3570.47822 > 59.110.157.16.8333: tcp 505
19:19:59.346885 IP 172.214.77.34.bc.googleusercontent.com.8333 > tom-Latitude-3570.56244: tcp 224
19:19:59.347507 IP 172.214.77.34.bc.googleusercontent.com.8333 > tom-Latitude-3570.56244: tcp 24
19:19:59.347521 IP 172.214.77.34.bc.googleusercontent.com.8333 > tom-Latitude-3570.56244: tcp 225
19:19:59.347626 IP tom-Latitude-3570.56244 > 172.214.77.34.bc.googleusercontent.com.8333: tcp 0
19:19:59.354355 IP 97-82-78-25.dhcp.leds.al.charter.com.8333 > tom-Latitude-3570.47742: tcp 0
19:19:59.354365 IP 97-82-78-25.dhcp.leds.al.charter.com.8333 > tom-Latitude-3570.47742: tcp 0
19:19:59.389847 IP 184-101-12-201.phnx.qwest.net.8333 > tom-Latitude-3570.54046: tcp 0
19:19:59.390459 IP 184-101-12-201.phnx.qwest.net.8333 > tom-Latitude-3570.54046: tcp 0
19:19:59.390464 IP 59.110.157.16.8333 > tom-Latitude-3570.47822: tcp 0
19:19:59.390467 IP 59.110.157.16.8333 > tom-Latitude-3570.47822: tcp 0
19:19:59.484341 IP 97-82-78-25.dhcp.leds.al.charter.com.8333 > tom-Latitude-3570.47742: tcp 24
19:19:59.485144 IP 97-82-78-25.dhcp.leds.al.charter.com.8333 > tom-Latitude-3570.47742: tcp 1382
19:19:59.485168 IP tom-Latitude-3570.47742 > 97-82-78-25.dhcp.leds.al.charter.com.8333: tcp 0
19:19:59.487730 IP 97-82-78-25.dhcp.leds.al.charter.com.8333 > tom-Latitude-3570.47742: tcp 78
19:19:59.491579 IP 97-82-78-25.dhcp.leds.al.charter.com.8333 > tom-Latitude-3570.47742: tcp 1382
19:19:59.491613 IP tom-Latitude-3570.47742 > 97-82-78-25.dhcp.leds.al.charter.com.8333: tcp 0
19:19:59.492195 IP 97-82-78-25.dhcp.leds.al.charter.com.8333 > tom-Latitude-3570.47742: tcp 78
19:19:59.494799 IP 97-82-78-25.dhcp.leds.al.charter.com.8333 > tom-Latitude-3570.47742: tcp 1382
19:19:59.494817 IP tom-Latitude-3570.47742 > 97-82-78-25.dhcp.leds.al.charter.com.8333: tcp 0
19:19:59.495414 IP 97-82-78-25.dhcp.leds.al.charter.com.8333 > tom-Latitude-3570.47742: tcp 78
19:19:59.508197 IP 97-82-78-25.dhcp.leds.al.charter.com.8333 > tom-Latitude-3570.47742: tcp 1011
19:19:59.508218 IP tom-Latitude-3570.47742 > 97-82-78-25.dhcp.leds.al.charter.com.8333: tcp 0
19:19:59.508922 IP 97-82-78-25.dhcp.leds.al.charter.com.8333 > tom-Latitude-3570.47742: tcp 24
19:19:59.508927 IP 97-82-78-25.dhcp.leds.al.charter.com.8333 > tom-Latitude-3570.47742: tcp 226
19:19:59.508930 IP ec2-52-56-97-80.eu-west-2.compute.amazonaws.com.8333 > tom-Latitude-3570.36650: tcp 24
19:19:59.508934 IP ec2-52-56-97-80.eu-west-2.compute.amazonaws.com.8333 > tom-Latitude-3570.36650: tcp 397
19:19:59.508934 IP tom-Latitude-3570.47742 > 97-82-78-25.dhcp.leds.al.charter.com.8333: tcp 0
19:19:59.508950 IP tom-Latitude-3570.36650 > ec2-52-56-97-80.eu-west-2.compute.amazonaws.com.8333: tcp 0
19:19:59.514093 IP tom-Latitude-3570.36650 > ec2-52-56-97-80.eu-west-2.compute.amazonaws.com.8333: tcp 24
19:19:59.516241 IP tom-Latitude-3570.36650 > ec2-52-56-97-80.eu-west-2.compute.amazonaws.com.8333: tcp 181
19:19:59.527663 IP 184-101-12-201.phnx.qwest.net.8333 > tom-Latitude-3570.54046: tcp 24
19:19:59.527671 IP tom-Latitude-3570.54046 > 184-101-12-201.phnx.qwest.net.8333: tcp 0
19:19:59.536918 IP 184-101-12-201.phnx.qwest.net.8333 > tom-Latitude-3570.54046: tcp 721
19:19:59.536927 IP tom-Latitude-3570.54046 > 184-101-12-201.phnx.qwest.net.8333: tcp 0
19:19:59.541745 IP ec2-52-56-97-80.eu-west-2.compute.amazonaws.com.8333 > tom-Latitude-3570.36650: tcp 0
19:19:59.550286 IP ec2-52-56-97-80.eu-west-2.compute.amazonaws.com.8333 > tom-Latitude-3570.36650: tcp 0
19:19:59.606380 IP ec2-52-56-97-80.eu-west-2.compute.amazonaws.com.8333 > tom-Latitude-3570.36650: tcp 24
19:19:59.607007 IP ec2-52-56-97-80.eu-west-2.compute.amazonaws.com.8333 > tom-Latitude-3570.36650: tcp 263
19:19:59.607033 IP tom-Latitude-3570.36650 > ec2-52-56-97-80.eu-west-2.compute.amazonaws.com.8333: tcp 0
19:19:59.607251 IP tom-Latitude-3570.56244 > 172.214.77.34.bc.googleusercontent.com.8333: tcp 24
19:19:59.607831 IP tom-Latitude-3570.33922 > pool-108-20-207-31.bstnma.fios.verizon.net.8333: tcp 24
19:19:59.608414 IP tom-Latitude-3570.56244 > 172.214.77.34.bc.googleusercontent.com.8333: tcp 73
19:19:59.609079 IP tom-Latitude-3570.33922 > pool-108-20-207-31.bstnma.fios.verizon.net.8333: tcp 865
19:19:59.622391 IP ec2-52-56-97-80.eu-west-2.compute.amazonaws.com.8333 > tom-Latitude-3570.36650: tcp 1382
19:19:59.623025 IP ec2-52-56-97-80.eu-west-2.compute.amazonaws.com.8333 > tom-Latitude-3570.36650: tcp 4
19:19:59.623033 IP tom-Latitude-3570.36650 > ec2-52-56-97-80.eu-west-2.compute.amazonaws.com.8333: tcp 0
19:19:59.641750 IP 172.214.77.34.bc.googleusercontent.com.8333 > tom-Latitude-3570.56244: tcp 0
19:19:59.642383 IP 172.214.77.34.bc.googleusercontent.com.8333 > tom-Latitude-3570.56244: tcp 0
19:19:59.642388 IP pool-108-20-207-31.bstnma.fios.verizon.net.8333 > tom-Latitude-3570.33922: tcp 0
19:19:59.647660 IP pool-108-20-207-31.bstnma.fios.verizon.net.8333 > tom-Latitude-3570.33922: tcp 0
19:20:00.353973 IP 59.110.157.16.8333 > tom-Latitude-3570.47822: tcp 24
19:20:00.353989 IP 59.110.157.16.8333 > tom-Latitude-3570.47822: tcp 289
19:20:00.354066 IP tom-Latitude-3570.47822 > 59.110.157.16.8333: tcp 0
19:20:00.358006 IP 59.110.157.16.8333 > tom-Latitude-3570.47822: tcp 289
19:20:00.358021 IP tom-Latitude-3570.47822 > 59.110.157.16.8333: tcp 0
19:20:01.055596 IP tom-Latitude-3570.47822 > 59.110.157.16.8333: tcp 24
19:20:01.057555 IP tom-Latitude-3570.47822 > 59.110.157.16.8333: tcp 73
19:20:01.099705 IP 59.110.157.16.8333 > tom-Latitude-3570.47822: tcp 0
19:20:01.107811 IP 59.110.157.16.8333 > tom-Latitude-3570.47822: tcp 24
19:20:01.107828 IP tom-Latitude-3570.47822 > 59.110.157.16.8333: tcp 0
19:20:01.108566 IP 59.110.157.16.8333 > tom-Latitude-3570.47822: tcp 325
19:20:01.108592 IP tom-Latitude-3570.47822 > 59.110.157.16.8333: tcp 0
19:20:01.109115 IP tom-Latitude-3570.47822 > 59.110.157.16.8333: tcp 24
19:20:01.109138 IP tom-Latitude-3570.47822 > 59.110.157.16.8333: tcp 253
19:20:01.179691 IP 59.110.157.16.8333 > tom-Latitude-3570.47822: tcp 0
19:20:01.189761 IP 59.110.157.16.8333 > tom-Latitude-3570.47822: tcp 0
19:20:01.370765 IP 97-82-78-25.dhcp.leds.al.charter.com.8333 > tom-Latitude-3570.47742: tcp 24
19:20:01.370780 IP 97-82-78-25.dhcp.leds.al.charter.com.8333 > tom-Latitude-3570.47742: tcp 469
19:20:01.370852 IP tom-Latitude-3570.47742 > 97-82-78-25.dhcp.leds.al.charter.com.8333: tcp 0
19:20:01.371111 IP tom-Latitude-3570.47742 > 97-82-78-25.dhcp.leds.al.charter.com.8333: tcp 24
19:20:01.376400 IP tom-Latitude-3570.47742 > 97-82-78-25.dhcp.leds.al.charter.com.8333: tcp 37
19:20:01.405799 IP 97-82-78-25.dhcp.leds.al.charter.com.8333 > tom-Latitude-3570.47742: tcp 0
19:20:01.406488 IP 97-82-78-25.dhcp.leds.al.charter.com.8333 > tom-Latitude-3570.47742: tcp 0
19:20:01.685612 IP 97-82-78-25.dhcp.leds.al.charter.com.8333 > tom-Latitude-3570.47742: tcp 24
19:20:01.685627 IP 97-82-78-25.dhcp.leds.al.charter.com.8333 > tom-Latitude-3570.47742: tcp 226
19:20:01.685663 IP tom-Latitude-3570.47742 > 97-82-78-25.dhcp.leds.al.charter.com.8333: tcp 0
19:20:01.686206 IP tom-Latitude-3570.59818 > c-73-101-52-184.hsd1.pa.comcast.net.8333: tcp 24
19:20:01.686216 IP tom-Latitude-3570.59818 > c-73-101-52-184.hsd1.pa.comcast.net.8333: tcp 1045
19:20:01.686331 IP pool-108-20-207-31.bstnma.fios.verizon.net.8333 > tom-Latitude-3570.33922: tcp 24
19:20:01.686335 IP tom-Latitude-3570.33922 > pool-108-20-207-31.bstnma.fios.verizon.net.8333: tcp 0
19:20:01.686339 IP pool-108-20-207-31.bstnma.fios.verizon.net.8333 > tom-Latitude-3570.33922: tcp 433
19:20:01.686341 IP tom-Latitude-3570.33922 > pool-108-20-207-31.bstnma.fios.verizon.net.8333: tcp 0
19:20:01.745700 IP c-73-101-52-184.hsd1.pa.comcast.net.8333 > tom-Latitude-3570.59818: tcp 0
19:20:01.746295 IP c-73-101-52-184.hsd1.pa.comcast.net.8333 > tom-Latitude-3570.59818: tcp 0
19:20:02.588131 IP tom-Latitude-3570.56244 > 172.214.77.34.bc.googleusercontent.com.8333: tcp 24
19:20:02.589251 IP tom-Latitude-3570.56244 > 172.214.77.34.bc.googleusercontent.com.8333: tcp 217
19:20:02.709071 IP 172.214.77.34.bc.googleusercontent.com.8333 > tom-Latitude-3570.56244: tcp 0
19:20:02.709085 IP 172.214.77.34.bc.googleusercontent.com.8333 > tom-Latitude-3570.56244: tcp 0
19:20:02.755666 IP 59.110.157.16.8333 > tom-Latitude-3570.47822: tcp 24
19:20:02.758366 IP 59.110.157.16.8333 > tom-Latitude-3570.47822: tcp 931
19:20:02.758463 IP tom-Latitude-3570.47822 > 59.110.157.16.8333: tcp 0
19:20:02.759505 IP 59.110.157.16.8333 > tom-Latitude-3570.47822: tcp 24
19:20:02.799723 IP tom-Latitude-3570.47822 > 59.110.157.16.8333: tcp 0
19:20:02.959866 IP tom-Latitude-3570.56244 > 172.214.77.34.bc.googleusercontent.com.8333: tcp 24
19:20:02.960802 IP tom-Latitude-3570.56244 > 172.214.77.34.bc.googleusercontent.com.8333: tcp 37
19:20:02.981192 IP 59.110.157.16.8333 > tom-Latitude-3570.47822: tcp 1382
19:20:02.981209 IP tom-Latitude-3570.47822 > 59.110.157.16.8333: tcp 0
19:20:02.981812 IP 59.110.157.16.8333 > tom-Latitude-3570.47822: tcp 66
19:20:02.981817 IP tom-Latitude-3570.47822 > 59.110.157.16.8333: tcp 0
19:20:02.984120 IP 59.110.157.16.8333 > tom-Latitude-3570.47822: tcp 553
19:20:02.984152 IP tom-Latitude-3570.47822 > 59.110.157.16.8333: tcp 0
19:20:02.994890 IP 172.214.77.34.bc.googleusercontent.com.8333 > tom-Latitude-3570.56244: tcp 0
19:20:02.995410 IP 172.214.77.34.bc.googleusercontent.com.8333 > tom-Latitude-3570.56244: tcp 0
19:20:03.386007 IP tom-Latitude-3570.34082 > host93-234-110-95.serverdedicati.aruba.it.8333: tcp 24
19:20:03.388010 IP tom-Latitude-3570.34082 > host93-234-110-95.serverdedicati.aruba.it.8333: tcp 685
19:20:03.450420 IP host93-234-110-95.serverdedicati.aruba.it.8333 > tom-Latitude-3570.34082: tcp 0
19:20:03.459643 IP host93-234-110-95.serverdedicati.aruba.it.8333 > tom-Latitude-3570.34082: tcp 0
19:20:03.786649 IP tom-Latitude-3570.54046 > 184-101-12-201.phnx.qwest.net.8333: tcp 24
19:20:03.787374 IP tom-Latitude-3570.54046 > 184-101-12-201.phnx.qwest.net.8333: tcp 465
19:20:03.877572 IP 184-101-12-201.phnx.qwest.net.8333 > tom-Latitude-3570.54046: tcp 0
19:20:03.877577 IP 184-101-12-201.phnx.qwest.net.8333 > tom-Latitude-3570.54046: tcp 0
19:20:04.006697 IP 184-101-12-201.phnx.qwest.net.8333 > tom-Latitude-3570.54046: tcp 24
19:20:04.006722 IP tom-Latitude-3570.54046 > 184-101-12-201.phnx.qwest.net.8333: tcp 0
19:20:04.006740 IP 184-101-12-201.phnx.qwest.net.8333 > tom-Latitude-3570.54046: tcp 8
19:20:04.006746 IP tom-Latitude-3570.54046 > 184-101-12-201.phnx.qwest.net.8333: tcp 0
19:20:04.006903 IP tom-Latitude-3570.54046 > 184-101-12-201.phnx.qwest.net.8333: tcp 24
19:20:04.008155 IP tom-Latitude-3570.54046 > 184-101-12-201.phnx.qwest.net.8333: tcp 8
19:20:04.026253 IP 172.214.77.34.bc.googleusercontent.com.8333 > tom-Latitude-3570.56244: tcp 24
19:20:04.026846 IP 172.214.77.34.bc.googleusercontent.com.8333 > tom-Latitude-3570.56244: tcp 865
19:20:04.026903 IP tom-Latitude-3570.56244 > 172.214.77.34.bc.googleusercontent.com.8333: tcp 0
19:20:04.027352 IP tom-Latitude-3570.56244 > 172.214.77.34.bc.googleusercontent.com.8333: tcp 24
19:20:04.028245 IP tom-Latitude-3570.56244 > 172.214.77.34.bc.googleusercontent.com.8333: tcp 649
19:20:04.055804 IP 184-101-12-201.phnx.qwest.net.8333 > tom-Latitude-3570.54046: tcp 0
19:20:04.056415 IP 184-101-12-201.phnx.qwest.net.8333 > tom-Latitude-3570.54046: tcp 0
19:20:04.056438 IP 184-101-12-201.phnx.qwest.net.8333 > tom-Latitude-3570.54046: tcp 24
19:20:04.063618 IP 172.214.77.34.bc.googleusercontent.com.8333 > tom-Latitude-3570.56244: tcp 0
19:20:04.099722 IP tom-Latitude-3570.54046 > 184-101-12-201.phnx.qwest.net.8333: tcp 0
19:20:04.103706 IP 172.214.77.34.bc.googleusercontent.com.8333 > tom-Latitude-3570.56244: tcp 0
19:20:04.171832 IP 172.214.77.34.bc.googleusercontent.com.8333 > tom-Latitude-3570.56244: tcp 24
19:20:04.175305 IP 172.214.77.34.bc.googleusercontent.com.8333 > tom-Latitude-3570.56244: tcp 962
19:20:04.175475 IP tom-Latitude-3570.56244 > 172.214.77.34.bc.googleusercontent.com.8333: tcp 0
19:20:04.175806 IP 172.214.77.34.bc.googleusercontent.com.8333 > tom-Latitude-3570.56244: tcp 24
19:20:04.175824 IP 172.214.77.34.bc.googleusercontent.com.8333 > tom-Latitude-3570.56244: tcp 371
19:20:04.175830 IP 172.214.77.34.bc.googleusercontent.com.8333 > tom-Latitude-3570.56244: tcp 24
19:20:04.175881 IP tom-Latitude-3570.56244 > 172.214.77.34.bc.googleusercontent.com.8333: tcp 0
19:20:04.178479 IP 172.214.77.34.bc.googleusercontent.com.8333 > tom-Latitude-3570.56244: tcp 224
19:20:04.179178 IP 172.214.77.34.bc.googleusercontent.com.8333 > tom-Latitude-3570.56244: tcp 24
19:20:04.179185 IP 172.214.77.34.bc.googleusercontent.com.8333 > tom-Latitude-3570.56244: tcp 256
19:20:04.179188 IP 172.214.77.34.bc.googleusercontent.com.8333 > tom-Latitude-3570.56244: tcp 24
19:20:04.179190 IP 172.214.77.34.bc.googleusercontent.com.8333 > tom-Latitude-3570.56244: tcp 224
19:20:04.179192 IP 172.214.77.34.bc.googleusercontent.com.8333 > tom-Latitude-3570.56244: tcp 24
19:20:04.179201 IP tom-Latitude-3570.56244 > 172.214.77.34.bc.googleusercontent.com.8333: tcp 0
19:20:04.182276 IP 172.214.77.34.bc.googleusercontent.com.8333 > tom-Latitude-3570.56244: tcp 698
19:20:04.182297 IP tom-Latitude-3570.56244 > 172.214.77.34.bc.googleusercontent.com.8333: tcp 0
19:20:04.182939 IP 172.214.77.34.bc.googleusercontent.com.8333 > tom-Latitude-3570.56244: tcp 24
19:20:04.182947 IP 172.214.77.34.bc.googleusercontent.com.8333 > tom-Latitude-3570.56244: tcp 407
19:20:04.182950 IP 172.214.77.34.bc.googleusercontent.com.8333 > tom-Latitude-3570.56244: tcp 24
19:20:04.182953 IP 172.214.77.34.bc.googleusercontent.com.8333 > tom-Latitude-3570.56244: tcp 248
19:20:04.182955 IP 172.214.77.34.bc.googleusercontent.com.8333 > tom-Latitude-3570.56244: tcp 24
19:20:04.182957 IP 172.214.77.34.bc.googleusercontent.com.8333 > tom-Latitude-3570.56244: tcp 223
19:20:04.182962 IP tom-Latitude-3570.56244 > 172.214.77.34.bc.googleusercontent.com.8333: tcp 0
19:20:04.186110 IP 172.214.77.34.bc.googleusercontent.com.8333 > tom-Latitude-3570.56244: tcp 24
19:20:04.186120 IP 172.214.77.34.bc.googleusercontent.com.8333 > tom-Latitude-3570.56244: tcp 226
19:20:04.186123 IP 172.214.77.34.bc.googleusercontent.com.8333 > tom-Latitude-3570.56244: tcp 24
19:20:04.186125 IP 172.214.77.34.bc.googleusercontent.com.8333 > tom-Latitude-3570.56244: tcp 247
19:20:04.186136 IP tom-Latitude-3570.56244 > 172.214.77.34.bc.googleusercontent.com.8333: tcp 0
19:20:04.188657 IP 172.214.77.34.bc.googleusercontent.com.8333 > tom-Latitude-3570.56244: tcp 24
19:20:04.189355 IP 172.214.77.34.bc.googleusercontent.com.8333 > tom-Latitude-3570.56244: tcp 247
19:20:04.189359 IP 172.214.77.34.bc.googleusercontent.com.8333 > tom-Latitude-3570.56244: tcp 24
19:20:04.189363 IP 172.214.77.34.bc.googleusercontent.com.8333 > tom-Latitude-3570.56244: tcp 519
19:20:04.189365 IP 172.214.77.34.bc.googleusercontent.com.8333 > tom-Latitude-3570.56244: tcp 24
19:20:04.189367 IP 172.214.77.34.bc.googleusercontent.com.8333 > tom-Latitude-3570.56244: tcp 337
19:20:04.189374 IP tom-Latitude-3570.56244 > 172.214.77.34.bc.googleusercontent.com.8333: tcp 0
19:20:04.191805 IP 184-101-12-201.phnx.qwest.net.8333 > tom-Latitude-3570.54046: tcp 8
19:20:04.191810 IP tom-Latitude-3570.54046 > 184-101-12-201.phnx.qwest.net.8333: tcp 0
19:20:04.205985 IP 172.214.77.34.bc.googleusercontent.com.8333 > tom-Latitude-3570.56244: tcp 1162
19:20:04.206010 IP tom-Latitude-3570.56244 > 172.214.77.34.bc.googleusercontent.com.8333: tcp 0
19:20:04.206657 IP tom-Latitude-3570.36650 > ec2-52-56-97-80.eu-west-2.compute.amazonaws.com.8333: tcp 24
19:20:04.207306 IP tom-Latitude-3570.36650 > ec2-52-56-97-80.eu-west-2.compute.amazonaws.com.8333: tcp 829
19:20:04.256219 IP ec2-52-56-97-80.eu-west-2.compute.amazonaws.com.8333 > tom-Latitude-3570.36650: tcp 0
19:20:04.279654 IP ec2-52-56-97-80.eu-west-2.compute.amazonaws.com.8333 > tom-Latitude-3570.36650: tcp 0
19:20:04.708436 IP tom-Latitude-3570.47742 > 97-82-78-25.dhcp.leds.al.charter.com.8333: tcp 24
19:20:04.709258 IP tom-Latitude-3570.47742 > 97-82-78-25.dhcp.leds.al.charter.com.8333: tcp 649
19:20:04.741760 IP 97-82-78-25.dhcp.leds.al.charter.com.8333 > tom-Latitude-3570.47742: tcp 0
19:20:04.745200 IP 97-82-78-25.dhcp.leds.al.charter.com.8333 > tom-Latitude-3570.47742: tcp 0
19:20:04.908925 IP tom-Latitude-3570.59818 > c-73-101-52-184.hsd1.pa.comcast.net.8333: tcp 24
19:20:04.909014 IP tom-Latitude-3570.34082 > host93-234-110-95.serverdedicati.aruba.it.8333: tcp 24
19:20:04.910204 IP tom-Latitude-3570.34082 > host93-234-110-95.serverdedicati.aruba.it.8333: tcp 649
19:20:04.910214 IP tom-Latitude-3570.59818 > c-73-101-52-184.hsd1.pa.comcast.net.8333: tcp 901
19:20:04.957274 IP c-73-101-52-184.hsd1.pa.comcast.net.8333 > tom-Latitude-3570.59818: tcp 0
19:20:04.957281 IP host93-234-110-95.serverdedicati.aruba.it.8333 > tom-Latitude-3570.34082: tcp 0
19:20:04.957284 IP c-73-101-52-184.hsd1.pa.comcast.net.8333 > tom-Latitude-3570.59818: tcp 0
19:20:04.957286 IP host93-234-110-95.serverdedicati.aruba.it.8333 > tom-Latitude-3570.34082: tcp 0
19:20:05.109422 IP tom-Latitude-3570.54046 > 184-101-12-201.phnx.qwest.net.8333: tcp 24
19:20:05.110144 IP tom-Latitude-3570.54046 > 184-101-12-201.phnx.qwest.net.8333: tcp 649
19:20:05.149647 IP 184-101-12-201.phnx.qwest.net.8333 > tom-Latitude-3570.54046: tcp 0
19:20:05.679224 IP 97-82-78-25.dhcp.leds.al.charter.com.8333 > tom-Latitude-3570.47742: tcp 24
19:20:05.679294 IP 97-82-78-25.dhcp.leds.al.charter.com.8333 > tom-Latitude-3570.47742: tcp 289
19:20:05.679312 IP tom-Latitude-3570.47742 > 97-82-78-25.dhcp.leds.al.charter.com.8333: tcp 0
19:20:05.679501 IP tom-Latitude-3570.47742 > 97-82-78-25.dhcp.leds.al.charter.com.8333: tcp 24
19:20:05.680644 IP tom-Latitude-3570.47742 > 97-82-78-25.dhcp.leds.al.charter.com.8333: tcp 289
19:20:05.715742 IP 97-82-78-25.dhcp.leds.al.charter.com.8333 > tom-Latitude-3570.47742: tcp 0
19:20:05.730478 IP 97-82-78-25.dhcp.leds.al.charter.com.8333 > tom-Latitude-3570.47742: tcp 0
19:20:05.880056 IP tom-Latitude-3570.47822 > 59.110.157.16.8333: tcp 24
19:20:05.881958 IP tom-Latitude-3570.47822 > 59.110.157.16.8333: tcp 685
19:20:05.918912 IP 97-82-78-25.dhcp.leds.al.charter.com.8333 > tom-Latitude-3570.47742: tcp 24
19:20:05.920221 IP 97-82-78-25.dhcp.leds.al.charter.com.8333 > tom-Latitude-3570.47742: tcp 291
19:20:05.920240 IP 97-82-78-25.dhcp.leds.al.charter.com.8333 > tom-Latitude-3570.47742: tcp 24
19:20:05.920242 IP 97-82-78-25.dhcp.leds.al.charter.com.8333 > tom-Latitude-3570.47742: tcp 249
19:20:05.920244 IP 97-82-78-25.dhcp.leds.al.charter.com.8333 > tom-Latitude-3570.47742: tcp 24
19:20:05.920247 IP 97-82-78-25.dhcp.leds.al.charter.com.8333 > tom-Latitude-3570.47742: tcp 257
19:20:05.920249 IP 97-82-78-25.dhcp.leds.al.charter.com.8333 > tom-Latitude-3570.47742: tcp 24
19:20:05.920251 IP 97-82-78-25.dhcp.leds.al.charter.com.8333 > tom-Latitude-3570.47742: tcp 760
19:20:05.920270 IP 97-82-78-25.dhcp.leds.al.charter.com.8333 > tom-Latitude-3570.47742: tcp 24
19:20:05.920272 IP 97-82-78-25.dhcp.leds.al.charter.com.8333 > tom-Latitude-3570.47742: tcp 405
19:20:05.920274 IP 97-82-78-25.dhcp.leds.al.charter.com.8333 > tom-Latitude-3570.47742: tcp 24
19:20:05.920277 IP 97-82-78-25.dhcp.leds.al.charter.com.8333 > tom-Latitude-3570.47742: tcp 247
19:20:05.920279 IP 97-82-78-25.dhcp.leds.al.charter.com.8333 > tom-Latitude-3570.47742: tcp 24
19:20:05.920281 IP 97-82-78-25.dhcp.leds.al.charter.com.8333 > tom-Latitude-3570.47742: tcp 283
19:20:05.920283 IP 97-82-78-25.dhcp.leds.al.charter.com.8333 > tom-Latitude-3570.47742: tcp 24
19:20:05.920285 IP 97-82-78-25.dhcp.leds.al.charter.com.8333 > tom-Latitude-3570.47742: tcp 349
19:20:05.920344 IP tom-Latitude-3570.47742 > 97-82-78-25.dhcp.leds.al.charter.com.8333: tcp 0
