13:07:04.725251 IP 172.214.77.34.bc.googleusercontent.com.8333 > tom-Latitude-3570.56244: tcp 0
13:07:04.738489 IP 172.214.77.34.bc.googleusercontent.com.8333 > tom-Latitude-3570.56244: tcp 0
13:07:04.799554 IP 172.214.77.34.bc.googleusercontent.com.8333 > tom-Latitude-3570.56244: tcp 24
13:07:04.800876 IP 172.214.77.34.bc.googleusercontent.com.8333 > tom-Latitude-3570.56244: tcp 224
13:07:04.800888 IP 172.214.77.34.bc.googleusercontent.com.8333 > tom-Latitude-3570.56244: tcp 24
13:07:04.800942 IP tom-Latitude-3570.56244 > 172.214.77.34.bc.googleusercontent.com.8333: tcp 0
13:07:04.801492 IP 172.214.77.34.bc.googleusercontent.com.8333 > tom-Latitude-3570.56244: tcp 247
13:07:04.801503 IP 172.214.77.34.bc.googleusercontent.com.8333 > tom-Latitude-3570.56244: tcp 24
13:07:04.801508 IP 172.214.77.34.bc.googleusercontent.com.8333 > tom-Latitude-3570.56244: tcp 216
13:07:04.801512 IP 172.214.77.34.bc.googleusercontent.com.8333 > tom-Latitude-3570.56244: tcp 24
13:07:04.801514 IP 172.214.77.34.bc.googleusercontent.com.8333 > tom-Latitude-3570.56244: tcp 249
13:07:04.801518 IP 172.214.77.34.bc.googleusercontent.com.8333 > tom-Latitude-3570.56244: tcp 24
13:07:04.801520 IP 172.214.77.34.bc.googleusercontent.com.8333 > tom-Latitude-3570.56244: tcp 283
13:07:04.801523 IP 172.214.77.34.bc.googleusercontent.com.8333 > tom-Latitude-3570.56244: tcp 24
13:07:04.801525 IP 172.214.77.34.bc.googleusercontent.com.8333 > tom-Latitude-3570.56244: tcp 630
13:07:04.801537 IP tom-Latitude-3570.56244 > 172.214.77.34.bc.googleusercontent.com.8333: tcp 0
13:07:04.803290 IP 172.214.77.34.bc.googleusercontent.com.8333 > tom-Latitude-3570.56244: tcp 24
13:07:04.803328 IP 172.214.77.34.bc.googleusercontent.com.8333 > tom-Latitude-3570.56244: tcp 283
13:07:04.803333 IP 172.214.77.34.bc.googleusercontent.com.8333 > tom-Latitude-3570.56244: tcp 24
13:07:04.803384 IP tom-Latitude-3570.56244 > 172.214.77.34.bc.googleusercontent.com.8333: tcp 0
13:07:04.806250 IP 172.214.77.34.bc.googleusercontent.com.8333 > tom-Latitude-3570.56244: tcp 284
13:07:04.806450 IP 172.214.77.34.bc.googleusercontent.com.8333 > tom-Latitude-3570.56244: tcp 24
13:07:04.806477 IP tom-Latitude-3570.56244 > 172.214.77.34.bc.googleusercontent.com.8333: tcp 0
13:07:04.809503 IP 172.214.77.34.bc.googleusercontent.com.8333 > tom-Latitude-3570.56244: tcp 284
13:07:04.809696 IP 172.214.77.34.bc.googleusercontent.com.8333 > tom-Latitude-3570.56244: tcp 24
13:07:04.809702 IP 172.214.77.34.bc.googleusercontent.com.8333 > tom-Latitude-3570.56244: tcp 284
13:07:04.809848 IP tom-Latitude-3570.56244 > 172.214.77.34.bc.googleusercontent.com.8333: tcp 0
13:07:06.282814 IP ns3051461.ip-51-255-95.eu.8333 > tom-Latitude-3570.56118: tcp 24
13:07:06.282830 IP ns3051461.ip-51-255-95.eu.8333 > tom-Latitude-3570.56118: tcp 1261
13:07:06.282861 IP tom-Latitude-3570.56118 > ns3051461.ip-51-255-95.eu.8333: tcp 0
13:07:06.283243 IP tom-Latitude-3570.56118 > ns3051461.ip-51-255-95.eu.8333: tcp 24
13:07:06.284344 IP tom-Latitude-3570.56118 > ns3051461.ip-51-255-95.eu.8333: tcp 397
13:07:06.356680 IP ns3051461.ip-51-255-95.eu.8333 > tom-Latitude-3570.56118: tcp 0
13:07:06.684256 IP tom-Latitude-3570.34082 > host93-234-110-95.serverdedicati.aruba.it.8333: tcp 24
13:07:06.687848 IP tom-Latitude-3570.34082 > host93-234-110-95.serverdedicati.aruba.it.8333: tcp 1009
13:07:06.691787 IP ns3051461.ip-51-255-95.eu.8333 > tom-Latitude-3570.56118: tcp 0
13:07:06.691794 IP ns3051461.ip-51-255-95.eu.8333 > tom-Latitude-3570.56118: tcp 24
13:07:06.691799 IP ns3051461.ip-51-255-95.eu.8333 > tom-Latitude-3570.56118: tcp 374
13:07:06.691802 IP ns3051461.ip-51-255-95.eu.8333 > tom-Latitude-3570.56118: tcp 553
13:07:06.691804 IP ns3051461.ip-51-255-95.eu.8333 > tom-Latitude-3570.56118: tcp 769
13:07:06.691808 IP ns3051461.ip-51-255-95.eu.8333 > tom-Latitude-3570.56118: tcp 1387
13:07:06.691883 IP tom-Latitude-3570.56118 > ns3051461.ip-51-255-95.eu.8333: tcp 0
13:07:06.762784 IP c-73-101-52-184.hsd1.pa.comcast.net.8333 > tom-Latitude-3570.59818: tcp 24
13:07:06.768587 IP c-73-101-52-184.hsd1.pa.comcast.net.8333 > tom-Latitude-3570.59818: tcp 1261
13:07:06.768661 IP tom-Latitude-3570.59818 > c-73-101-52-184.hsd1.pa.comcast.net.8333: tcp 0
13:07:06.768809 IP tom-Latitude-3570.56244 > 172.214.77.34.bc.googleusercontent.com.8333: tcp 24
13:07:06.769073 IP tom-Latitude-3570.59818 > c-73-101-52-184.hsd1.pa.comcast.net.8333: tcp 24
13:07:06.771169 IP tom-Latitude-3570.59818 > c-73-101-52-184.hsd1.pa.comcast.net.8333: tcp 37
13:07:06.771174 IP tom-Latitude-3570.56244 > 172.214.77.34.bc.googleusercontent.com.8333: tcp 397
13:07:06.776467 IP host93-234-110-95.serverdedicati.aruba.it.8333 > tom-Latitude-3570.34082: tcp 0
13:07:06.869398 IP tom-Latitude-3570.47742 > 97-82-78-25.dhcp.leds.al.charter.com.8333: tcp 24
13:07:06.869414 IP tom-Latitude-3570.47742 > 97-82-78-25.dhcp.leds.al.charter.com.8333: tcp 1261
13:07:06.911737 IP tom-Latitude-3570.59818 > c-73-101-52-184.hsd1.pa.comcast.net.8333: tcp 37
13:07:06.919793 IP tom-Latitude-3570.56244 > 172.214.77.34.bc.googleusercontent.com.8333: tcp 397
13:07:06.969638 IP tom-Latitude-3570.56344 > 23.226.90.172.8333: tcp 24
13:07:06.969792 IP tom-Latitude-3570.56118 > ns3051461.ip-51-255-95.eu.8333: tcp 24
13:07:06.970564 IP tom-Latitude-3570.56118 > ns3051461.ip-51-255-95.eu.8333: tcp 37
13:07:06.970574 IP tom-Latitude-3570.56344 > 23.226.90.172.8333: tcp 37
13:07:06.973147 IP c-73-101-52-184.hsd1.pa.comcast.net.8333 > tom-Latitude-3570.59818: tcp 1261
13:07:06.973172 IP tom-Latitude-3570.59818 > c-73-101-52-184.hsd1.pa.comcast.net.8333: tcp 0
13:07:07.131721 IP tom-Latitude-3570.34082 > host93-234-110-95.serverdedicati.aruba.it.8333: tcp 1009
13:07:07.154292 IP host93-234-110-95.serverdedicati.aruba.it.8333 > tom-Latitude-3570.34082: tcp 0
13:07:07.163785 IP tom-Latitude-3570.47742 > 97-82-78-25.dhcp.leds.al.charter.com.8333: tcp 1261
13:07:07.170304 IP tom-Latitude-3570.47742 > 97-82-78-25.dhcp.leds.al.charter.com.8333: tcp 24
13:07:07.170320 IP tom-Latitude-3570.47742 > 97-82-78-25.dhcp.leds.al.charter.com.8333: tcp 649
13:07:07.195727 IP tom-Latitude-3570.56244 > 172.214.77.34.bc.googleusercontent.com.8333: tcp 421
13:07:07.204541 IP c-73-101-52-184.hsd1.pa.comcast.net.8333 > tom-Latitude-3570.59818: tcp 0
13:07:07.217554 IP 172.214.77.34.bc.googleusercontent.com.8333 > tom-Latitude-3570.56244: tcp 0
13:07:07.259708 IP tom-Latitude-3570.56118 > ns3051461.ip-51-255-95.eu.8333: tcp 37
13:07:07.270558 IP tom-Latitude-3570.34082 > host93-234-110-95.serverdedicati.aruba.it.8333: tcp 24
13:07:07.271045 IP tom-Latitude-3570.34082 > host93-234-110-95.serverdedicati.aruba.it.8333: tcp 397
13:07:07.284620 IP c-73-101-52-184.hsd1.pa.comcast.net.8333 > tom-Latitude-3570.59818: tcp 0
13:07:07.323693 IP tom-Latitude-3570.56344 > 23.226.90.172.8333: tcp 37
13:07:07.370934 IP tom-Latitude-3570.36650 > ec2-52-56-97-80.eu-west-2.compute.amazonaws.com.8333: tcp 24
13:07:07.370955 IP tom-Latitude-3570.36650 > ec2-52-56-97-80.eu-west-2.compute.amazonaws.com.8333: tcp 1261
13:07:07.386743 IP c-73-101-52-184.hsd1.pa.comcast.net.8333 > tom-Latitude-3570.59818: tcp 24
13:07:07.386756 IP tom-Latitude-3570.59818 > c-73-101-52-184.hsd1.pa.comcast.net.8333: tcp 0
13:07:07.386803 IP c-73-101-52-184.hsd1.pa.comcast.net.8333 > tom-Latitude-3570.59818: tcp 217
13:07:07.386809 IP tom-Latitude-3570.59818 > c-73-101-52-184.hsd1.pa.comcast.net.8333: tcp 0
13:07:07.386988 IP tom-Latitude-3570.59818 > c-73-101-52-184.hsd1.pa.comcast.net.8333: tcp 24
13:07:07.387230 IP tom-Latitude-3570.59818 > c-73-101-52-184.hsd1.pa.comcast.net.8333: tcp 145
13:07:07.440501 IP c-73-101-52-184.hsd1.pa.comcast.net.8333 > tom-Latitude-3570.59818: tcp 24
13:07:07.444141 IP c-73-101-52-184.hsd1.pa.comcast.net.8333 > tom-Latitude-3570.59818: tcp 284
13:07:07.444249 IP tom-Latitude-3570.59818 > c-73-101-52-184.hsd1.pa.comcast.net.8333: tcp 0
13:07:07.595773 IP tom-Latitude-3570.36650 > ec2-52-56-97-80.eu-west-2.compute.amazonaws.com.8333: tcp 1261
13:07:07.598604 IP host93-234-110-95.serverdedicati.aruba.it.8333 > tom-Latitude-3570.34082: tcp 24
13:07:07.598636 IP tom-Latitude-3570.34082 > host93-234-110-95.serverdedicati.aruba.it.8333: tcp 0
13:07:07.611084 IP host93-234-110-95.serverdedicati.aruba.it.8333 > tom-Latitude-3570.34082: tcp 1081
13:07:07.611103 IP tom-Latitude-3570.34082 > host93-234-110-95.serverdedicati.aruba.it.8333: tcp 0
13:07:07.611612 IP tom-Latitude-3570.34082 > host93-234-110-95.serverdedicati.aruba.it.8333: tcp 24
13:07:07.611619 IP tom-Latitude-3570.34082 > host93-234-110-95.serverdedicati.aruba.it.8333: tcp 505
13:07:07.742261 IP host93-234-110-95.serverdedicati.aruba.it.8333 > tom-Latitude-3570.34082: tcp 1081
13:07:07.742276 IP tom-Latitude-3570.34082 > host93-234-110-95.serverdedicati.aruba.it.8333: tcp 0
13:07:07.771744 IP tom-Latitude-3570.56244 > 172.214.77.34.bc.googleusercontent.com.8333: tcp 397
13:07:07.803784 IP tom-Latitude-3570.47742 > 97-82-78-25.dhcp.leds.al.charter.com.8333: tcp 1309
13:07:07.826969 IP 172.214.77.34.bc.googleusercontent.com.8333 > tom-Latitude-3570.56244: tcp 0
13:07:07.855600 IP 97-82-78-25.dhcp.leds.al.charter.com.8333 > tom-Latitude-3570.47742: tcp 0
13:07:07.867738 IP tom-Latitude-3570.56118 > ns3051461.ip-51-255-95.eu.8333: tcp 61
13:07:07.907867 IP tom-Latitude-3570.34082 > host93-234-110-95.serverdedicati.aruba.it.8333: tcp 950
13:07:07.912429 IP tom-Latitude-3570.33922 > pool-108-20-207-31.bstnma.fios.verizon.net.8333: tcp 24
13:07:07.912445 IP tom-Latitude-3570.33922 > pool-108-20-207-31.bstnma.fios.verizon.net.8333: tcp 1261
13:07:07.976808 IP 97-82-78-25.dhcp.leds.al.charter.com.8333 > tom-Latitude-3570.47742: tcp 24
13:07:07.976824 IP tom-Latitude-3570.47742 > 97-82-78-25.dhcp.leds.al.charter.com.8333: tcp 0
13:07:07.976956 IP 97-82-78-25.dhcp.leds.al.charter.com.8333 > tom-Latitude-3570.47742: tcp 1261
13:07:07.976969 IP tom-Latitude-3570.47742 > 97-82-78-25.dhcp.leds.al.charter.com.8333: tcp 0
13:07:07.983563 IP 97-82-78-25.dhcp.leds.al.charter.com.8333 > tom-Latitude-3570.47742: tcp 0
13:07:07.983735 IP c-73-101-52-184.hsd1.pa.comcast.net.8333 > tom-Latitude-3570.59818: tcp 0
13:07:08.007888 IP 172.214.77.34.bc.googleusercontent.com.8333 > tom-Latitude-3570.56244: tcp 0
13:07:08.012200 IP 23.226.90.172.8333 > tom-Latitude-3570.56344: tcp 0
13:07:08.012211 IP ns3051461.ip-51-255-95.eu.8333 > tom-Latitude-3570.56118: tcp 0
13:07:08.012576 IP ns3051461.ip-51-255-95.eu.8333 > tom-Latitude-3570.56118: tcp 0
13:07:08.012581 IP 23.226.90.172.8333 > tom-Latitude-3570.56344: tcp 0
13:07:08.012583 IP host93-234-110-95.serverdedicati.aruba.it.8333 > tom-Latitude-3570.34082: tcp 0
13:07:08.017553 IP 97-82-78-25.dhcp.leds.al.charter.com.8333 > tom-Latitude-3570.47742: tcp 0
13:07:08.022061 IP 97-82-78-25.dhcp.leds.al.charter.com.8333 > tom-Latitude-3570.47742: tcp 0
13:07:08.025257 IP 97-82-78-25.dhcp.leds.al.charter.com.8333 > tom-Latitude-3570.47742: tcp 0
13:07:08.036038 IP 172.214.77.34.bc.googleusercontent.com.8333 > tom-Latitude-3570.56244: tcp 0
13:07:08.039861 IP ns3051461.ip-51-255-95.eu.8333 > tom-Latitude-3570.56118: tcp 0
13:07:08.039983 IP host93-234-110-95.serverdedicati.aruba.it.8333 > tom-Latitude-3570.34082: tcp 0
13:07:08.039987 IP host93-234-110-95.serverdedicati.aruba.it.8333 > tom-Latitude-3570.34082: tcp 0
13:07:08.043715 IP 23.226.90.172.8333 > tom-Latitude-3570.56344: tcp 0
13:07:08.055037 IP ec2-52-56-97-80.eu-west-2.compute.amazonaws.com.8333 > tom-Latitude-3570.36650: tcp 0
13:07:08.055436 IP ec2-52-56-97-80.eu-west-2.compute.amazonaws.com.8333 > tom-Latitude-3570.36650: tcp 0
13:07:08.055442 IP c-73-101-52-184.hsd1.pa.comcast.net.8333 > tom-Latitude-3570.59818: tcp 0
13:07:08.055445 IP pool-108-20-207-31.bstnma.fios.verizon.net.8333 > tom-Latitude-3570.33922: tcp 24
13:07:08.055453 IP tom-Latitude-3570.33922 > pool-108-20-207-31.bstnma.fios.verizon.net.8333: tcp 0
13:07:08.055466 IP pool-108-20-207-31.bstnma.fios.verizon.net.8333 > tom-Latitude-3570.33922: tcp 1261
13:07:08.055524 IP tom-Latitude-3570.33922 > pool-108-20-207-31.bstnma.fios.verizon.net.8333: tcp 0
13:07:08.056235 IP tom-Latitude-3570.33922 > pool-108-20-207-31.bstnma.fios.verizon.net.8333: tcp 24
13:07:08.056254 IP tom-Latitude-3570.33922 > pool-108-20-207-31.bstnma.fios.verizon.net.8333: tcp 73
13:07:08.057808 IP c-73-101-52-184.hsd1.pa.comcast.net.8333 > tom-Latitude-3570.59818: tcp 0
13:07:08.058078 IP ec2-52-56-97-80.eu-west-2.compute.amazonaws.com.8333 > tom-Latitude-3570.36650: tcp 0
13:07:08.065623 IP host93-234-110-95.serverdedicati.aruba.it.8333 > tom-Latitude-3570.34082: tcp 0
13:07:08.073460 IP host93-234-110-95.serverdedicati.aruba.it.8333 > tom-Latitude-3570.34082: tcp 0
13:07:08.089927 IP 172.214.77.34.bc.googleusercontent.com.8333 > tom-Latitude-3570.56244: tcp 0
13:07:08.117181 IP 97-82-78-25.dhcp.leds.al.charter.com.8333 > tom-Latitude-3570.47742: tcp 0
13:07:08.123001 IP ns3051461.ip-51-255-95.eu.8333 > tom-Latitude-3570.56118: tcp 0
13:07:08.123011 IP host93-234-110-95.serverdedicati.aruba.it.8333 > tom-Latitude-3570.34082: tcp 0
13:07:08.124605 IP pool-108-20-207-31.bstnma.fios.verizon.net.8333 > tom-Latitude-3570.33922: tcp 0
13:07:08.137785 IP pool-108-20-207-31.bstnma.fios.verizon.net.8333 > tom-Latitude-3570.33922: tcp 0
13:07:08.137796 IP pool-108-20-207-31.bstnma.fios.verizon.net.8333 > tom-Latitude-3570.33922: tcp 0
13:07:08.140033 IP pool-108-20-207-31.bstnma.fios.verizon.net.8333 > tom-Latitude-3570.33922: tcp 0
13:07:08.156503 IP tom-Latitude-3570.56244 > 172.214.77.34.bc.googleusercontent.com.8333: tcp 24
13:07:08.157002 IP tom-Latitude-3570.56244 > 172.214.77.34.bc.googleusercontent.com.8333: tcp 37
13:07:08.165636 IP host93-234-110-95.serverdedicati.aruba.it.8333 > tom-Latitude-3570.34082: tcp 24
13:07:08.165649 IP tom-Latitude-3570.34082 > host93-234-110-95.serverdedicati.aruba.it.8333: tcp 0
13:07:08.166023 IP host93-234-110-95.serverdedicati.aruba.it.8333 > tom-Latitude-3570.34082: tcp 257
13:07:08.166030 IP tom-Latitude-3570.34082 > host93-234-110-95.serverdedicati.aruba.it.8333: tcp 0
13:07:08.166035 IP host93-234-110-95.serverdedicati.aruba.it.8333 > tom-Latitude-3570.34082: tcp 24
13:07:08.166037 IP tom-Latitude-3570.34082 > host93-234-110-95.serverdedicati.aruba.it.8333: tcp 0
13:07:08.166041 IP host93-234-110-95.serverdedicati.aruba.it.8333 > tom-Latitude-3570.34082: tcp 404
13:07:08.166042 IP tom-Latitude-3570.34082 > host93-234-110-95.serverdedicati.aruba.it.8333: tcp 0
13:07:08.166045 IP host93-234-110-95.serverdedicati.aruba.it.8333 > tom-Latitude-3570.34082: tcp 24
13:07:08.166047 IP tom-Latitude-3570.34082 > host93-234-110-95.serverdedicati.aruba.it.8333: tcp 0
13:07:08.166050 IP host93-234-110-95.serverdedicati.aruba.it.8333 > tom-Latitude-3570.34082: tcp 248
13:07:08.166052 IP host93-234-110-95.serverdedicati.aruba.it.8333 > tom-Latitude-3570.34082: tcp 24
13:07:08.166055 IP host93-234-110-95.serverdedicati.aruba.it.8333 > tom-Latitude-3570.34082: tcp 215
13:07:08.166056 IP tom-Latitude-3570.34082 > host93-234-110-95.serverdedicati.aruba.it.8333: tcp 0
13:07:08.166056 IP host93-234-110-95.serverdedicati.aruba.it.8333 > tom-Latitude-3570.34082: tcp 24
13:07:08.166058 IP host93-234-110-95.serverdedicati.aruba.it.8333 > tom-Latitude-3570.34082: tcp 191
13:07:08.166063 IP tom-Latitude-3570.34082 > host93-234-110-95.serverdedicati.aruba.it.8333: tcp 0
13:07:08.166078 IP tom-Latitude-3570.34082 > host93-234-110-95.serverdedicati.aruba.it.8333: tcp 0
13:07:08.166080 IP tom-Latitude-3570.34082 > host93-234-110-95.serverdedicati.aruba.it.8333: tcp 0
13:07:08.166083 IP tom-Latitude-3570.34082 > host93-234-110-95.serverdedicati.aruba.it.8333: tcp 0
13:07:08.184693 IP 23.226.90.172.8333 > tom-Latitude-3570.56344: tcp 24
13:07:08.184701 IP tom-Latitude-3570.56344 > 23.226.90.172.8333: tcp 0
13:07:08.185181 IP 23.226.90.172.8333 > tom-Latitude-3570.56344: tcp 283
13:07:08.185188 IP tom-Latitude-3570.56344 > 23.226.90.172.8333: tcp 0
13:07:08.185908 IP tom-Latitude-3570.56344 > 23.226.90.172.8333: tcp 24
13:07:08.186449 IP tom-Latitude-3570.56344 > 23.226.90.172.8333: tcp 37
13:07:08.190286 IP 172.214.77.34.bc.googleusercontent.com.8333 > tom-Latitude-3570.56244: tcp 0
13:07:08.193970 IP 172.214.77.34.bc.googleusercontent.com.8333 > tom-Latitude-3570.56244: tcp 0
13:07:08.228165 IP c-73-101-52-184.hsd1.pa.comcast.net.8333 > tom-Latitude-3570.59818: tcp 24
13:07:08.228377 IP c-73-101-52-184.hsd1.pa.comcast.net.8333 > tom-Latitude-3570.59818: tcp 499
13:07:08.228383 IP c-73-101-52-184.hsd1.pa.comcast.net.8333 > tom-Latitude-3570.59818: tcp 24
13:07:08.228386 IP c-73-101-52-184.hsd1.pa.comcast.net.8333 > tom-Latitude-3570.59818: tcp 284
13:07:08.228401 IP c-73-101-52-184.hsd1.pa.comcast.net.8333 > tom-Latitude-3570.59818: tcp 24
13:07:08.228402 IP c-73-101-52-184.hsd1.pa.comcast.net.8333 > tom-Latitude-3570.59818: tcp 284
13:07:08.228404 IP c-73-101-52-184.hsd1.pa.comcast.net.8333 > tom-Latitude-3570.59818: tcp 24
13:07:08.228411 IP tom-Latitude-3570.59818 > c-73-101-52-184.hsd1.pa.comcast.net.8333: tcp 0
13:07:08.228443 IP tom-Latitude-3570.59818 > c-73-101-52-184.hsd1.pa.comcast.net.8333: tcp 0
13:07:08.241342 IP c-73-101-52-184.hsd1.pa.comcast.net.8333 > tom-Latitude-3570.59818: tcp 284
13:07:08.241354 IP 23.226.90.172.8333 > tom-Latitude-3570.56344: tcp 0
13:07:08.241359 IP 23.226.90.172.8333 > tom-Latitude-3570.56344: tcp 0
13:07:08.256985 IP host93-234-110-95.serverdedicati.aruba.it.8333 > tom-Latitude-3570.34082: tcp 1448
13:07:08.257010 IP tom-Latitude-3570.34082 > host93-234-110-95.serverdedicati.aruba.it.8333: tcp 0
13:07:08.257043 IP host93-234-110-95.serverdedicati.aruba.it.8333 > tom-Latitude-3570.34082: tcp 1371
13:07:08.257065 IP tom-Latitude-3570.34082 > host93-234-110-95.serverdedicati.aruba.it.8333: tcp 0
13:07:08.283698 IP tom-Latitude-3570.59818 > c-73-101-52-184.hsd1.pa.comcast.net.8333: tcp 0
13:07:08.285434 IP pool-108-20-207-31.bstnma.fios.verizon.net.8333 > tom-Latitude-3570.33922: tcp 24
13:07:08.285796 IP pool-108-20-207-31.bstnma.fios.verizon.net.8333 > tom-Latitude-3570.33922: tcp 403
13:07:08.285804 IP pool-108-20-207-31.bstnma.fios.verizon.net.8333 > tom-Latitude-3570.33922: tcp 24
13:07:08.285847 IP tom-Latitude-3570.33922 > pool-108-20-207-31.bstnma.fios.verizon.net.8333: tcp 0
13:07:08.288437 IP pool-108-20-207-31.bstnma.fios.verizon.net.8333 > tom-Latitude-3570.33922: tcp 225
13:07:08.331741 IP tom-Latitude-3570.33922 > pool-108-20-207-31.bstnma.fios.verizon.net.8333: tcp 0
13:07:08.389122 IP tom-Latitude-3570.36650 > ec2-52-56-97-80.eu-west-2.compute.amazonaws.com.8333: tcp 24
13:07:08.389411 IP tom-Latitude-3570.36650 > ec2-52-56-97-80.eu-west-2.compute.amazonaws.com.8333: tcp 901
13:07:08.425025 IP ec2-52-56-97-80.eu-west-2.compute.amazonaws.com.8333 > tom-Latitude-3570.36650: tcp 0
13:07:08.425087 IP 23.226.90.172.8333 > tom-Latitude-3570.56344: tcp 24
13:07:08.425096 IP 23.226.90.172.8333 > tom-Latitude-3570.56344: tcp 284
13:07:08.425170 IP tom-Latitude-3570.56344 > 23.226.90.172.8333: tcp 0
13:07:08.425497 IP tom-Latitude-3570.56344 > 23.226.90.172.8333: tcp 24
13:07:08.425856 IP tom-Latitude-3570.56344 > 23.226.90.172.8333: tcp 37
13:07:08.452475 IP ec2-52-56-97-80.eu-west-2.compute.amazonaws.com.8333 > tom-Latitude-3570.36650: tcp 0
13:07:08.472847 IP 23.226.90.172.8333 > tom-Latitude-3570.56344: tcp 0
13:07:08.472860 IP 23.226.90.172.8333 > tom-Latitude-3570.56344: tcp 0
13:07:08.525790 IP tom-Latitude-3570.59818 > c-73-101-52-184.hsd1.pa.comcast.net.8333: tcp 24
13:07:08.526044 IP tom-Latitude-3570.59818 > c-73-101-52-184.hsd1.pa.comcast.net.8333: tcp 577
13:07:08.532758 IP 97-82-78-25.dhcp.leds.al.charter.com.8333 > tom-Latitude-3570.47742: tcp 24
13:07:08.532782 IP tom-Latitude-3570.47742 > 97-82-78-25.dhcp.leds.al.charter.com.8333: tcp 0
13:07:08.532806 IP 97-82-78-25.dhcp.leds.al.charter.com.8333 > tom-Latitude-3570.47742: tcp 505
13:07:08.532810 IP tom-Latitude-3570.47742 > 97-82-78-25.dhcp.leds.al.charter.com.8333: tcp 0
13:07:08.533058 IP tom-Latitude-3570.47742 > 97-82-78-25.dhcp.leds.al.charter.com.8333: tcp 24
13:07:08.534115 IP tom-Latitude-3570.47742 > 97-82-78-25.dhcp.leds.al.charter.com.8333: tcp 37
13:07:08.598075 IP c-73-101-52-184.hsd1.pa.comcast.net.8333 > tom-Latitude-3570.59818: tcp 0
13:07:08.598180 IP c-73-101-52-184.hsd1.pa.comcast.net.8333 > tom-Latitude-3570.59818: tcp 0
13:07:08.598185 IP 97-82-78-25.dhcp.leds.al.charter.com.8333 > tom-Latitude-3570.47742: tcp 0
13:07:08.598189 IP 97-82-78-25.dhcp.leds.al.charter.com.8333 > tom-Latitude-3570.47742: tcp 0
13:07:08.633374 IP tom-Latitude-3570.56244 > 172.214.77.34.bc.googleusercontent.com.8333: tcp 24
13:07:08.635918 IP tom-Latitude-3570.56244 > 172.214.77.34.bc.googleusercontent.com.8333: tcp 721
13:07:08.641340 IP ec2-52-56-97-80.eu-west-2.compute.amazonaws.com.8333 > tom-Latitude-3570.36650: tcp 24
13:07:08.641688 IP ec2-52-56-97-80.eu-west-2.compute.amazonaws.com.8333 > tom-Latitude-3570.36650: tcp 181
13:07:08.641698 IP 23.226.90.172.8333 > tom-Latitude-3570.56344: tcp 24
13:07:08.641756 IP tom-Latitude-3570.36650 > ec2-52-56-97-80.eu-west-2.compute.amazonaws.com.8333: tcp 0
13:07:08.641933 IP tom-Latitude-3570.36650 > ec2-52-56-97-80.eu-west-2.compute.amazonaws.com.8333: tcp 24
13:07:08.642029 IP tom-Latitude-3570.33922 > pool-108-20-207-31.bstnma.fios.verizon.net.8333: tcp 24
13:07:08.642140 IP tom-Latitude-3570.36650 > ec2-52-56-97-80.eu-west-2.compute.amazonaws.com.8333: tcp 145
13:07:08.642340 IP tom-Latitude-3570.33922 > pool-108-20-207-31.bstnma.fios.verizon.net.8333: tcp 217
13:07:08.644390 IP 23.226.90.172.8333 > tom-Latitude-3570.56344: tcp 283
13:07:08.644447 IP tom-Latitude-3570.56344 > 23.226.90.172.8333: tcp 0
13:07:08.644687 IP tom-Latitude-3570.56344 > 23.226.90.172.8333: tcp 24
13:07:08.645073 IP tom-Latitude-3570.56344 > 23.226.90.172.8333: tcp 37
13:07:08.678806 IP 172.214.77.34.bc.googleusercontent.com.8333 > tom-Latitude-3570.56244: tcp 0
13:07:08.737196 IP 172.214.77.34.bc.googleusercontent.com.8333 > tom-Latitude-3570.56244: tcp 0
13:07:08.748672 IP ec2-52-56-97-80.eu-west-2.compute.amazonaws.com.8333 > tom-Latitude-3570.36650: tcp 0
13:07:08.766937 IP 97-82-78-25.dhcp.leds.al.charter.com.8333 > tom-Latitude-3570.47742: tcp 24
13:07:08.767056 IP 97-82-78-25.dhcp.leds.al.charter.com.8333 > tom-Latitude-3570.47742: tcp 284
13:07:08.767085 IP tom-Latitude-3570.47742 > 97-82-78-25.dhcp.leds.al.charter.com.8333: tcp 0
13:07:08.849451 IP 23.226.90.172.8333 > tom-Latitude-3570.56344: tcp 24
13:07:08.849464 IP 23.226.90.172.8333 > tom-Latitude-3570.56344: tcp 8
13:07:08.849506 IP tom-Latitude-3570.56344 > 23.226.90.172.8333: tcp 0
13:07:08.849551 IP tom-Latitude-3570.56344 > 23.226.90.172.8333: tcp 24
13:07:08.850571 IP tom-Latitude-3570.56344 > 23.226.90.172.8333: tcp 8
13:07:08.902690 IP pool-108-20-207-31.bstnma.fios.verizon.net.8333 > tom-Latitude-3570.33922: tcp 0
13:07:08.926740 IP ec2-52-56-97-80.eu-west-2.compute.amazonaws.com.8333 > tom-Latitude-3570.36650: tcp 0
13:07:08.926802 IP pool-108-20-207-31.bstnma.fios.verizon.net.8333 > tom-Latitude-3570.33922: tcp 0
13:07:08.926804 IP 23.226.90.172.8333 > tom-Latitude-3570.56344: tcp 0
13:07:08.936628 IP 23.226.90.172.8333 > tom-Latitude-3570.56344: tcp 0
13:07:08.936747 IP 23.226.90.172.8333 > tom-Latitude-3570.56344: tcp 0
13:07:08.942189 IP 23.226.90.172.8333 > tom-Latitude-3570.56344: tcp 0
13:07:08.949778 IP tom-Latitude-3570.33922 > pool-108-20-207-31.bstnma.fios.verizon.net.8333: tcp 24
13:07:08.951025 IP tom-Latitude-3570.33922 > pool-108-20-207-31.bstnma.fios.verizon.net.8333: tcp 37
13:07:08.983258 IP ec2-52-56-97-80.eu-west-2.compute.amazonaws.com.8333 > tom-Latitude-3570.36650: tcp 24
13:07:08.983276 IP ec2-52-56-97-80.eu-west-2.compute.amazonaws.com.8333 > tom-Latitude-3570.36650: tcp 488
13:07:08.983365 IP tom-Latitude-3570.36650 > ec2-52-56-97-80.eu-west-2.compute.amazonaws.com.8333: tcp 0
13:07:08.983411 IP ec2-52-56-97-80.eu-west-2.compute.amazonaws.com.8333 > tom-Latitude-3570.36650: tcp 615
13:07:08.984132 IP tom-Latitude-3570.56118 > ns3051461.ip-51-255-95.eu.8333: tcp 24
13:07:08.984349 IP tom-Latitude-3570.56118 > ns3051461.ip-51-255-95.eu.8333: tcp 829
13:07:09.004470 IP pool-108-20-207-31.bstnma.fios.verizon.net.8333 > tom-Latitude-3570.33922: tcp 0
13:07:09.004536 IP pool-108-20-207-31.bstnma.fios.verizon.net.8333 > tom-Latitude-3570.33922: tcp 0
13:07:09.023771 IP tom-Latitude-3570.36650 > ec2-52-56-97-80.eu-west-2.compute.amazonaws.com.8333: tcp 0
13:07:09.029060 IP ns3051461.ip-51-255-95.eu.8333 > tom-Latitude-3570.56118: tcp 0
13:07:09.038677 IP ns3051461.ip-51-255-95.eu.8333 > tom-Latitude-3570.56118: tcp 0
13:07:09.107680 IP 23.226.90.172.8333 > tom-Latitude-3570.56344: tcp 24
13:07:09.110111 IP 23.226.90.172.8333 > tom-Latitude-3570.56344: tcp 283
13:07:09.110134 IP tom-Latitude-3570.56344 > 23.226.90.172.8333: tcp 0
13:07:09.110480 IP tom-Latitude-3570.56344 > 23.226.90.172.8333: tcp 24
13:07:09.110706 IP tom-Latitude-3570.56344 > 23.226.90.172.8333: tcp 37
13:07:09.147673 IP 23.226.90.172.8333 > tom-Latitude-3570.56344: tcp 0
13:07:09.150923 IP 23.226.90.172.8333 > tom-Latitude-3570.56344: tcp 0
13:07:09.310823 IP tom-Latitude-3570.33922 > pool-108-20-207-31.bstnma.fios.verizon.net.8333: tcp 24
13:07:09.312363 IP tom-Latitude-3570.33922 > pool-108-20-207-31.bstnma.fios.verizon.net.8333: tcp 145
13:07:09.318660 IP 23.226.90.172.8333 > tom-Latitude-3570.56344: tcp 24
13:07:09.318797 IP 23.226.90.172.8333 > tom-Latitude-3570.56344: tcp 283
13:07:09.318904 IP tom-Latitude-3570.56344 > 23.226.90.172.8333: tcp 0
13:07:09.319307 IP tom-Latitude-3570.56344 > 23.226.90.172.8333: tcp 24
13:07:09.319500 IP tom-Latitude-3570.56344 > 23.226.90.172.8333: tcp 37
13:07:09.410284 IP pool-108-20-207-31.bstnma.fios.verizon.net.8333 > tom-Latitude-3570.33922: tcp 0
13:07:09.410303 IP pool-108-20-207-31.bstnma.fios.verizon.net.8333 > tom-Latitude-3570.33922: tcp 0
13:07:09.434551 IP 23.226.90.172.8333 > tom-Latitude-3570.56344: tcp 0
13:07:09.434594 IP 23.226.90.172.8333 > tom-Latitude-3570.56344: tcp 0
13:07:09.720035 IP tom-Latitude-3570.47742 > 97-82-78-25.dhcp.leds.al.charter.com.8333: tcp 24
13:07:09.721764 IP tom-Latitude-3570.47742 > 97-82-78-25.dhcp.leds.al.charter.com.8333: tcp 181
13:07:09.721850 IP 23.226.90.172.8333 > tom-Latitude-3570.56344: tcp 24
13:07:09.721861 IP 23.226.90.172.8333 > tom-Latitude-3570.56344: tcp 283
13:07:09.721906 IP tom-Latitude-3570.56344 > 23.226.90.172.8333: tcp 0
13:07:09.722249 IP tom-Latitude-3570.56344 > 23.226.90.172.8333: tcp 24
13:07:09.722562 IP tom-Latitude-3570.56344 > 23.226.90.172.8333: tcp 37
13:07:09.759456 IP 97-82-78-25.dhcp.leds.al.charter.com.8333 > tom-Latitude-3570.47742: tcp 0
13:07:09.759469 IP 97-82-78-25.dhcp.leds.al.charter.com.8333 > tom-Latitude-3570.47742: tcp 0
13:07:09.761778 IP 23.226.90.172.8333 > tom-Latitude-3570.56344: tcp 0
13:07:09.765840 IP 23.226.90.172.8333 > tom-Latitude-3570.56344: tcp 0
13:07:09.969744 IP 23.226.90.172.8333 > tom-Latitude-3570.56344: tcp 24
13:07:09.969758 IP 23.226.90.172.8333 > tom-Latitude-3570.56344: tcp 284
13:07:09.969832 IP tom-Latitude-3570.56344 > 23.226.90.172.8333: tcp 0
13:07:09.970143 IP tom-Latitude-3570.56344 > 23.226.90.172.8333: tcp 24
13:07:09.970568 IP tom-Latitude-3570.56344 > 23.226.90.172.8333: tcp 69
13:07:10.022523 IP 23.226.90.172.8333 > tom-Latitude-3570.56344: tcp 0
13:07:10.028303 IP 23.226.90.172.8333 > tom-Latitude-3570.56344: tcp 0
13:07:10.070404 IP tom-Latitude-3570.34082 > host93-234-110-95.serverdedicati.aruba.it.8333: tcp 24
13:07:10.072580 IP tom-Latitude-3570.34082 > host93-234-110-95.serverdedicati.aruba.it.8333: tcp 253
13:07:10.102852 IP host93-234-110-95.serverdedicati.aruba.it.8333 > tom-Latitude-3570.34082: tcp 0
13:07:10.106067 IP host93-234-110-95.serverdedicati.aruba.it.8333 > tom-Latitude-3570.34082: tcp 0
13:07:10.199656 IP 23.226.90.172.8333 > tom-Latitude-3570.56344: tcp 24
13:07:10.199668 IP 23.226.90.172.8333 > tom-Latitude-3570.56344: tcp 8
13:07:10.199671 IP 23.226.90.172.8333 > tom-Latitude-3570.56344: tcp 24
13:07:10.199680 IP 23.226.90.172.8333 > tom-Latitude-3570.56344: tcp 283
13:07:10.199713 IP tom-Latitude-3570.56344 > 23.226.90.172.8333: tcp 0
13:07:10.200128 IP tom-Latitude-3570.56344 > 23.226.90.172.8333: tcp 24
13:07:10.200455 IP tom-Latitude-3570.56344 > 23.226.90.172.8333: tcp 37
13:07:10.236794 IP 23.226.90.172.8333 > tom-Latitude-3570.56344: tcp 0
13:07:10.236805 IP 23.226.90.172.8333 > tom-Latitude-3570.56344: tcp 0
13:07:10.480796 IP 23.226.90.172.8333 > tom-Latitude-3570.56344: tcp 24
13:07:10.480815 IP 23.226.90.172.8333 > tom-Latitude-3570.56344: tcp 283
13:07:10.480910 IP tom-Latitude-3570.56344 > 23.226.90.172.8333: tcp 0
13:07:10.481322 IP tom-Latitude-3570.56344 > 23.226.90.172.8333: tcp 24
13:07:10.481384 IP tom-Latitude-3570.56118 > ns3051461.ip-51-255-95.eu.8333: tcp 24
13:07:10.481620 IP tom-Latitude-3570.56344 > 23.226.90.172.8333: tcp 37
13:07:10.481827 IP tom-Latitude-3570.56118 > ns3051461.ip-51-255-95.eu.8333: tcp 109
13:07:10.581663 IP tom-Latitude-3570.56244 > 172.214.77.34.bc.googleusercontent.com.8333: tcp 24
13:07:10.582149 IP tom-Latitude-3570.56244 > 172.214.77.34.bc.googleusercontent.com.8333: tcp 181
13:07:10.604715 IP 23.226.90.172.8333 > tom-Latitude-3570.56344: tcp 283
13:07:10.604733 IP tom-Latitude-3570.56344 > 23.226.90.172.8333: tcp 0
13:07:10.624464 IP ns3051461.ip-51-255-95.eu.8333 > tom-Latitude-3570.56118: tcp 0
13:07:10.683704 IP tom-Latitude-3570.56344 > 23.226.90.172.8333: tcp 37
13:07:10.703364 IP 23.226.90.172.8333 > tom-Latitude-3570.56344: tcp 0
13:07:10.782018 IP tom-Latitude-3570.59818 > c-73-101-52-184.hsd1.pa.comcast.net.8333: tcp 24
13:07:10.786257 IP tom-Latitude-3570.59818 > c-73-101-52-184.hsd1.pa.comcast.net.8333: tcp 181
13:07:10.850511 IP ns3051461.ip-51-255-95.eu.8333 > tom-Latitude-3570.56118: tcp 0
13:07:10.875767 IP tom-Latitude-3570.56244 > 172.214.77.34.bc.googleusercontent.com.8333: tcp 181
13:07:10.962808 IP 23.226.90.172.8333 > tom-Latitude-3570.56344: tcp 0
13:07:10.990413 IP ns3051461.ip-51-255-95.eu.8333 > tom-Latitude-3570.56118: tcp 24
13:07:10.990437 IP ns3051461.ip-51-255-95.eu.8333 > tom-Latitude-3570.56118: tcp 829
13:07:10.990460 IP host93-234-110-95.serverdedicati.aruba.it.8333 > tom-Latitude-3570.34082: tcp 24
13:07:10.990479 IP tom-Latitude-3570.34082 > host93-234-110-95.serverdedicati.aruba.it.8333: tcp 0
13:07:10.990504 IP host93-234-110-95.serverdedicati.aruba.it.8333 > tom-Latitude-3570.34082: tcp 1045
13:07:10.990511 IP tom-Latitude-3570.34082 > host93-234-110-95.serverdedicati.aruba.it.8333: tcp 0
13:07:10.990532 IP tom-Latitude-3570.56118 > ns3051461.ip-51-255-95.eu.8333: tcp 0
13:07:10.991046 IP tom-Latitude-3570.56118 > ns3051461.ip-51-255-95.eu.8333: tcp 24
13:07:10.991262 IP tom-Latitude-3570.56118 > ns3051461.ip-51-255-95.eu.8333: tcp 829
13:07:10.991352 IP tom-Latitude-3570.34082 > host93-234-110-95.serverdedicati.aruba.it.8333: tcp 24
13:07:10.991758 IP tom-Latitude-3570.34082 > host93-234-110-95.serverdedicati.aruba.it.8333: tcp 217
13:07:11.038632 IP 172.214.77.34.bc.googleusercontent.com.8333 > tom-Latitude-3570.56244: tcp 0
13:07:11.125640 IP host93-234-110-95.serverdedicati.aruba.it.8333 > tom-Latitude-3570.34082: tcp 1045
13:07:11.125658 IP tom-Latitude-3570.34082 > host93-234-110-95.serverdedicati.aruba.it.8333: tcp 0
13:07:11.128924 IP 23.226.90.172.8333 > tom-Latitude-3570.56344: tcp 24
13:07:11.128930 IP tom-Latitude-3570.56344 > 23.226.90.172.8333: tcp 0
13:07:11.133452 IP 23.226.90.172.8333 > tom-Latitude-3570.56344: tcp 283
13:07:11.133459 IP tom-Latitude-3570.56344 > 23.226.90.172.8333: tcp 0
13:07:11.133799 IP tom-Latitude-3570.56344 > 23.226.90.172.8333: tcp 24
13:07:11.133964 IP 172.214.77.34.bc.googleusercontent.com.8333 > tom-Latitude-3570.56244: tcp 0
13:07:11.133969 IP 23.226.90.172.8333 > tom-Latitude-3570.56344: tcp 0
13:07:11.133974 IP tom-Latitude-3570.56344 > 23.226.90.172.8333: tcp 37
13:07:11.133980 IP c-73-101-52-184.hsd1.pa.comcast.net.8333 > tom-Latitude-3570.59818: tcp 0
13:07:11.139472 IP c-73-101-52-184.hsd1.pa.comcast.net.8333 > tom-Latitude-3570.59818: tcp 0
13:07:11.139485 IP 172.214.77.34.bc.googleusercontent.com.8333 > tom-Latitude-3570.56244: tcp 0
13:07:11.145362 IP ns3051461.ip-51-255-95.eu.8333 > tom-Latitude-3570.56118: tcp 0
13:07:11.186649 IP ns3051461.ip-51-255-95.eu.8333 > tom-Latitude-3570.56118: tcp 0
13:07:11.186778 IP host93-234-110-95.serverdedicati.aruba.it.8333 > tom-Latitude-3570.34082: tcp 0
13:07:11.204851 IP host93-234-110-95.serverdedicati.aruba.it.8333 > tom-Latitude-3570.34082: tcp 0
13:07:11.225296 IP 23.226.90.172.8333 > tom-Latitude-3570.56344: tcp 0
13:07:11.229102 IP 23.226.90.172.8333 > tom-Latitude-3570.56344: tcp 0
13:07:11.234226 IP tom-Latitude-3570.56344 > 23.226.90.172.8333: tcp 24
13:07:11.234243 IP tom-Latitude-3570.56344 > 23.226.90.172.8333: tcp 1261
13:07:11.246555 IP ns3051461.ip-51-255-95.eu.8333 > tom-Latitude-3570.56118: tcp 24
13:07:11.246706 IP ns3051461.ip-51-255-95.eu.8333 > tom-Latitude-3570.56118: tcp 450
13:07:11.246732 IP tom-Latitude-3570.56118 > ns3051461.ip-51-255-95.eu.8333: tcp 0
13:07:11.252750 IP ns3051461.ip-51-255-95.eu.8333 > tom-Latitude-3570.56118: tcp 452
13:07:11.253003 IP ns3051461.ip-51-255-95.eu.8333 > tom-Latitude-3570.56118: tcp 530
13:07:11.253022 IP tom-Latitude-3570.56118 > ns3051461.ip-51-255-95.eu.8333: tcp 0
13:07:11.255869 IP ns3051461.ip-51-255-95.eu.8333 > tom-Latitude-3570.56118: tcp 587
13:07:11.256339 IP ns3051461.ip-51-255-95.eu.8333 > tom-Latitude-3570.56118: tcp 332
13:07:11.256346 IP ns3051461.ip-51-255-95.eu.8333 > tom-Latitude-3570.56118: tcp 284
13:07:11.256350 IP ns3051461.ip-51-255-95.eu.8333 > tom-Latitude-3570.56118: tcp 307
13:07:11.256353 IP ns3051461.ip-51-255-95.eu.8333 > tom-Latitude-3570.56118: tcp 307
13:07:11.256355 IP ns3051461.ip-51-255-95.eu.8333 > tom-Latitude-3570.56118: tcp 24
13:07:11.256364 IP tom-Latitude-3570.56118 > ns3051461.ip-51-255-95.eu.8333: tcp 0
13:07:11.270667 IP 23.226.90.172.8333 > tom-Latitude-3570.56344: tcp 0
13:07:11.295657 IP host93-234-110-95.serverdedicati.aruba.it.8333 > tom-Latitude-3570.34082: tcp 24
13:07:11.295674 IP tom-Latitude-3570.34082 > host93-234-110-95.serverdedicati.aruba.it.8333: tcp 0
13:07:11.295703 IP host93-234-110-95.serverdedicati.aruba.it.8333 > tom-Latitude-3570.34082: tcp 405
13:07:11.295706 IP tom-Latitude-3570.34082 > host93-234-110-95.serverdedicati.aruba.it.8333: tcp 0
13:07:11.295712 IP host93-234-110-95.serverdedicati.aruba.it.8333 > tom-Latitude-3570.34082: tcp 24
13:07:11.295714 IP tom-Latitude-3570.34082 > host93-234-110-95.serverdedicati.aruba.it.8333: tcp 0
13:07:11.298520 IP host93-234-110-95.serverdedicati.aruba.it.8333 > tom-Latitude-3570.34082: tcp 191
13:07:11.298531 IP tom-Latitude-3570.34082 > host93-234-110-95.serverdedicati.aruba.it.8333: tcp 0
13:07:11.299052 IP host93-234-110-95.serverdedicati.aruba.it.8333 > tom-Latitude-3570.34082: tcp 24
13:07:11.299057 IP tom-Latitude-3570.34082 > host93-234-110-95.serverdedicati.aruba.it.8333: tcp 0
13:07:11.299065 IP host93-234-110-95.serverdedicati.aruba.it.8333 > tom-Latitude-3570.34082: tcp 283
13:07:11.299068 IP tom-Latitude-3570.34082 > host93-234-110-95.serverdedicati.aruba.it.8333: tcp 0
13:07:11.299072 IP host93-234-110-95.serverdedicati.aruba.it.8333 > tom-Latitude-3570.34082: tcp 24
13:07:11.299074 IP tom-Latitude-3570.34082 > host93-234-110-95.serverdedicati.aruba.it.8333: tcp 0
13:07:11.299077 IP host93-234-110-95.serverdedicati.aruba.it.8333 > tom-Latitude-3570.34082: tcp 283
13:07:11.299079 IP tom-Latitude-3570.34082 > host93-234-110-95.serverdedicati.aruba.it.8333: tcp 0
13:07:11.299536 IP host93-234-110-95.serverdedicati.aruba.it.8333 > tom-Latitude-3570.34082: tcp 24
13:07:11.299539 IP tom-Latitude-3570.34082 > host93-234-110-95.serverdedicati.aruba.it.8333: tcp 0
13:07:11.299545 IP host93-234-110-95.serverdedicati.aruba.it.8333 > tom-Latitude-3570.34082: tcp 284
13:07:11.299548 IP tom-Latitude-3570.34082 > host93-234-110-95.serverdedicati.aruba.it.8333: tcp 0
13:07:11.301571 IP 23.226.90.172.8333 > tom-Latitude-3570.56344: tcp 0
13:07:11.305649 IP ns3051461.ip-51-255-95.eu.8333 > tom-Latitude-3570.56118: tcp 1448
13:07:11.305672 IP tom-Latitude-3570.56118 > ns3051461.ip-51-255-95.eu.8333: tcp 0
13:07:11.308817 IP ns3051461.ip-51-255-95.eu.8333 > tom-Latitude-3570.56118: tcp 1448
13:07:11.308838 IP tom-Latitude-3570.56118 > ns3051461.ip-51-255-95.eu.8333: tcp 0
13:07:11.311847 IP ns3051461.ip-51-255-95.eu.8333 > tom-Latitude-3570.56118: tcp 1080
13:07:11.355741 IP tom-Latitude-3570.56118 > ns3051461.ip-51-255-95.eu.8333: tcp 0
13:07:11.382889 IP host93-234-110-95.serverdedicati.aruba.it.8333 > tom-Latitude-3570.34082: tcp 308
13:07:11.382903 IP tom-Latitude-3570.34082 > host93-234-110-95.serverdedicati.aruba.it.8333: tcp 0
13:07:11.406799 IP 23.226.90.172.8333 > tom-Latitude-3570.56344: tcp 24
13:07:11.406914 IP 23.226.90.172.8333 > tom-Latitude-3570.56344: tcp 284
13:07:11.406936 IP tom-Latitude-3570.56344 > 23.226.90.172.8333: tcp 0
13:07:11.407220 IP tom-Latitude-3570.56344 > 23.226.90.172.8333: tcp 24
13:07:11.407408 IP tom-Latitude-3570.56344 > 23.226.90.172.8333: tcp 37
13:07:11.453651 IP 23.226.90.172.8333 > tom-Latitude-3570.56344: tcp 0
13:07:11.457106 IP 23.226.90.172.8333 > tom-Latitude-3570.56344: tcp 0
13:07:11.507594 IP tom-Latitude-3570.59818 > c-73-101-52-184.hsd1.pa.comcast.net.8333: tcp 24
13:07:11.507610 IP tom-Latitude-3570.59818 > c-73-101-52-184.hsd1.pa.comcast.net.8333: tcp 1045
13:07:11.544791 IP c-73-101-52-184.hsd1.pa.comcast.net.8333 > tom-Latitude-3570.59818: tcp 0
13:07:11.632315 IP 23.226.90.172.8333 > tom-Latitude-3570.56344: tcp 24
13:07:11.632330 IP 23.226.90.172.8333 > tom-Latitude-3570.56344: tcp 283
13:07:11.632360 IP tom-Latitude-3570.56344 > 23.226.90.172.8333: tcp 0
13:07:11.632723 IP tom-Latitude-3570.56344 > 23.226.90.172.8333: tcp 24
13:07:11.671830 IP tom-Latitude-3570.56344 > 23.226.90.172.8333: tcp 37
13:07:11.833064 IP tom-Latitude-3570.56118 > ns3051461.ip-51-255-95.eu.8333: tcp 24
13:07:11.834537 IP tom-Latitude-3570.56118 > ns3051461.ip-51-255-95.eu.8333: tcp 217
13:07:11.835201 IP c-73-101-52-184.hsd1.pa.comcast.net.8333 > tom-Latitude-3570.59818: tcp 0
13:07:11.838628 IP 23.226.90.172.8333 > tom-Latitude-3570.56344: tcp 283
13:07:11.838647 IP tom-Latitude-3570.56344 > 23.226.90.172.8333: tcp 0
13:07:11.895696 IP tom-Latitude-3570.56344 > 23.226.90.172.8333: tcp 37
13:07:11.933476 IP tom-Latitude-3570.36650 > ec2-52-56-97-80.eu-west-2.compute.amazonaws.com.8333: tcp 24
13:07:11.933494 IP tom-Latitude-3570.36650 > ec2-52-56-97-80.eu-west-2.compute.amazonaws.com.8333: tcp 1045
13:07:11.937960 IP 23.226.90.172.8333 > tom-Latitude-3570.56344: tcp 0
13:07:11.937974 IP 23.226.90.172.8333 > tom-Latitude-3570.56344: tcp 0
13:07:11.937977 IP ns3051461.ip-51-255-95.eu.8333 > tom-Latitude-3570.56118: tcp 0
13:07:11.937980 IP ns3051461.ip-51-255-95.eu.8333 > tom-Latitude-3570.56118: tcp 0
13:07:11.951140 IP 23.226.90.172.8333 > tom-Latitude-3570.56344: tcp 0
13:07:12.018647 IP ec2-52-56-97-80.eu-west-2.compute.amazonaws.com.8333 > tom-Latitude-3570.36650: tcp 0
13:07:12.018749 IP ec2-52-56-97-80.eu-west-2.compute.amazonaws.com.8333 > tom-Latitude-3570.36650: tcp 0
13:07:12.109527 IP 23.226.90.172.8333 > tom-Latitude-3570.56344: tcp 24
13:07:12.109546 IP tom-Latitude-3570.56344 > 23.226.90.172.8333: tcp 0
13:07:12.109620 IP 23.226.90.172.8333 > tom-Latitude-3570.56344: tcp 37
13:07:12.109627 IP tom-Latitude-3570.56344 > 23.226.90.172.8333: tcp 0
13:07:12.110055 IP tom-Latitude-3570.33922 > pool-108-20-207-31.bstnma.fios.verizon.net.8333: tcp 24
13:07:12.110082 IP tom-Latitude-3570.33922 > pool-108-20-207-31.bstnma.fios.verizon.net.8333: tcp 1045
13:07:12.148040 IP pool-108-20-207-31.bstnma.fios.verizon.net.8333 > tom-Latitude-3570.33922: tcp 0
13:07:12.151662 IP pool-108-20-207-31.bstnma.fios.verizon.net.8333 > tom-Latitude-3570.33922: tcp 0
13:07:12.164865 IP c-73-101-52-184.hsd1.pa.comcast.net.8333 > tom-Latitude-3570.59818: tcp 24
