00:15:12.522571 IP tom-Latitude-3570.39110 > vmi195435.contaboserver.net.8333: tcp 24
00:15:12.523512 IP tom-Latitude-3570.39110 > vmi195435.contaboserver.net.8333: tcp 325
00:15:12.563332 IP c-185-45-236-223.customer.ggaweb.ch.8333 > tom-Latitude-3570.49070: tcp 24
00:15:12.563355 IP tom-Latitude-3570.49070 > c-185-45-236-223.customer.ggaweb.ch.8333: tcp 0
00:15:12.564083 IP c-185-45-236-223.customer.ggaweb.ch.8333 > tom-Latitude-3570.49070: tcp 541
00:15:12.564107 IP tom-Latitude-3570.49070 > c-185-45-236-223.customer.ggaweb.ch.8333: tcp 0
00:15:12.564513 IP tom-Latitude-3570.49070 > c-185-45-236-223.customer.ggaweb.ch.8333: tcp 24
00:15:12.566426 IP tom-Latitude-3570.49070 > c-185-45-236-223.customer.ggaweb.ch.8333: tcp 361
00:15:12.574454 IP vmi195435.contaboserver.net.8333 > tom-Latitude-3570.39110: tcp 0
00:15:12.581103 IP vmi195435.contaboserver.net.8333 > tom-Latitude-3570.39110: tcp 0
00:15:12.605833 IP c-185-45-236-223.customer.ggaweb.ch.8333 > tom-Latitude-3570.49070: tcp 0
00:15:12.605848 IP c-185-45-236-223.customer.ggaweb.ch.8333 > tom-Latitude-3570.49070: tcp 0
00:15:12.664844 IP tom-Latitude-3570.60988 > 81.198.101.144.8333: tcp 24
00:15:12.665789 IP tom-Latitude-3570.60988 > 81.198.101.144.8333: tcp 37
00:15:12.700678 IP c-185-45-236-223.customer.ggaweb.ch.8333 > tom-Latitude-3570.49070: tcp 24
00:15:12.701885 IP c-185-45-236-223.customer.ggaweb.ch.8333 > tom-Latitude-3570.49070: tcp 923
00:15:12.701902 IP c-185-45-236-223.customer.ggaweb.ch.8333 > tom-Latitude-3570.49070: tcp 1233
00:15:12.701906 IP c-185-45-236-223.customer.ggaweb.ch.8333 > tom-Latitude-3570.49070: tcp 518
00:15:12.701910 IP c-185-45-236-223.customer.ggaweb.ch.8333 > tom-Latitude-3570.49070: tcp 712
00:15:12.701911 IP 81.198.101.144.8333 > tom-Latitude-3570.60988: tcp 0
00:15:12.701995 IP tom-Latitude-3570.49070 > c-185-45-236-223.customer.ggaweb.ch.8333: tcp 0
00:15:12.703993 IP 81.198.101.144.8333 > tom-Latitude-3570.60988: tcp 0
00:15:12.850039 IP default-rdns.vocus.co.nz.8333 > tom-Latitude-3570.39282: tcp 24
00:15:12.850695 IP default-rdns.vocus.co.nz.8333 > tom-Latitude-3570.39282: tcp 61
00:15:12.850828 IP tom-Latitude-3570.39282 > default-rdns.vocus.co.nz.8333: tcp 0
00:15:12.951472 IP tom-Latitude-3570.39282 > default-rdns.vocus.co.nz.8333: tcp 24
00:15:12.952415 IP tom-Latitude-3570.39282 > default-rdns.vocus.co.nz.8333: tcp 541
00:15:12.977398 IP default-rdns.vocus.co.nz.8333 > tom-Latitude-3570.39282: tcp 0
00:15:12.985433 IP default-rdns.vocus.co.nz.8333 > tom-Latitude-3570.39282: tcp 0
00:15:13.051957 IP tom-Latitude-3570.60470 > bb42-60-217-183.singnet.com.sg.8333: tcp 24
00:15:13.052931 IP tom-Latitude-3570.60470 > bb42-60-217-183.singnet.com.sg.8333: tcp 433
00:15:13.077134 IP bb42-60-217-183.singnet.com.sg.8333 > tom-Latitude-3570.60470: tcp 0
00:15:13.085118 IP bb42-60-217-183.singnet.com.sg.8333 > tom-Latitude-3570.60470: tcp 0
00:15:13.841667 IP ns3113832.ip-54-38-177.eu.8333 > tom-Latitude-3570.56714: tcp 24
00:15:13.843284 IP ns3113832.ip-54-38-177.eu.8333 > tom-Latitude-3570.56714: tcp 505
00:15:13.843303 IP ns3113832.ip-54-38-177.eu.8333 > tom-Latitude-3570.56714: tcp 505
00:15:13.843312 IP tom-Latitude-3570.56714 > ns3113832.ip-54-38-177.eu.8333: tcp 0
00:15:13.843588 IP tom-Latitude-3570.60988 > 81.198.101.144.8333: tcp 24
00:15:13.843861 IP tom-Latitude-3570.56714 > ns3113832.ip-54-38-177.eu.8333: tcp 24
00:15:13.844652 IP tom-Latitude-3570.60988 > 81.198.101.144.8333: tcp 361
00:15:13.845232 IP tom-Latitude-3570.56714 > ns3113832.ip-54-38-177.eu.8333: tcp 73
00:15:13.875070 IP 81.198.101.144.8333 > tom-Latitude-3570.60988: tcp 0
00:15:13.875709 IP ns3113832.ip-54-38-177.eu.8333 > tom-Latitude-3570.56714: tcp 0
00:15:13.875724 IP 81.198.101.144.8333 > tom-Latitude-3570.60988: tcp 0
00:15:13.878071 IP ns3113832.ip-54-38-177.eu.8333 > tom-Latitude-3570.56714: tcp 0
00:15:13.934130 IP ns3113832.ip-54-38-177.eu.8333 > tom-Latitude-3570.56714: tcp 24
00:15:13.937171 IP ns3113832.ip-54-38-177.eu.8333 > tom-Latitude-3570.56714: tcp 224
00:15:13.937189 IP ns3113832.ip-54-38-177.eu.8333 > tom-Latitude-3570.56714: tcp 24
00:15:13.937191 IP ns3113832.ip-54-38-177.eu.8333 > tom-Latitude-3570.56714: tcp 371
00:15:13.937300 IP tom-Latitude-3570.56714 > ns3113832.ip-54-38-177.eu.8333: tcp 0
00:15:14.242281 IP tom-Latitude-3570.39282 > default-rdns.vocus.co.nz.8333: tcp 24
00:15:14.243218 IP tom-Latitude-3570.39282 > default-rdns.vocus.co.nz.8333: tcp 73
00:15:14.296938 IP default-rdns.vocus.co.nz.8333 > tom-Latitude-3570.39282: tcp 0
00:15:14.306059 IP default-rdns.vocus.co.nz.8333 > tom-Latitude-3570.39282: tcp 0
00:15:14.643648 IP tom-Latitude-3570.49070 > c-185-45-236-223.customer.ggaweb.ch.8333: tcp 24
00:15:14.680620 IP tom-Latitude-3570.49070 > c-185-45-236-223.customer.ggaweb.ch.8333: tcp 73
00:15:14.727657 IP c-185-45-236-223.customer.ggaweb.ch.8333 > tom-Latitude-3570.49070: tcp 0
00:15:14.736563 IP c-185-45-236-223.customer.ggaweb.ch.8333 > tom-Latitude-3570.49070: tcp 0
00:15:14.844499 IP tom-Latitude-3570.57976 > 167.99.216.145.8333: tcp 24
00:15:14.844622 IP tom-Latitude-3570.42516 > 2.56.9.15.8333: tcp 24
00:15:14.845458 IP tom-Latitude-3570.42516 > 2.56.9.15.8333: tcp 757
00:15:14.845468 IP tom-Latitude-3570.57976 > 167.99.216.145.8333: tcp 613
00:15:14.878805 IP 2.56.9.15.8333 > tom-Latitude-3570.42516: tcp 0
00:15:14.886773 IP 167.99.216.145.8333 > tom-Latitude-3570.57976: tcp 0
00:15:14.887382 IP 2.56.9.15.8333 > tom-Latitude-3570.42516: tcp 0
00:15:14.887396 IP 167.99.216.145.8333 > tom-Latitude-3570.57976: tcp 0
00:15:14.945046 IP tom-Latitude-3570.39110 > vmi195435.contaboserver.net.8333: tcp 24
00:15:14.945105 IP tom-Latitude-3570.42516 > 2.56.9.15.8333: tcp 24
00:15:14.946058 IP tom-Latitude-3570.42516 > 2.56.9.15.8333: tcp 31
00:15:14.946069 IP tom-Latitude-3570.39110 > vmi195435.contaboserver.net.8333: tcp 433
00:15:14.968718 IP vmi195435.contaboserver.net.8333 > tom-Latitude-3570.39110: tcp 24
00:15:14.971271 IP vmi195435.contaboserver.net.8333 > tom-Latitude-3570.39110: tcp 8
00:15:14.971396 IP tom-Latitude-3570.39110 > vmi195435.contaboserver.net.8333: tcp 0
00:15:14.971511 IP tom-Latitude-3570.39110 > vmi195435.contaboserver.net.8333: tcp 24
00:15:14.972246 IP tom-Latitude-3570.39110 > vmi195435.contaboserver.net.8333: tcp 8
00:15:14.977386 IP 2.56.9.15.8333 > tom-Latitude-3570.42516: tcp 0
00:15:14.986741 IP vmi195435.contaboserver.net.8333 > tom-Latitude-3570.39110: tcp 0
00:15:14.987371 IP 2.56.9.15.8333 > tom-Latitude-3570.42516: tcp 0
00:15:14.987385 IP vmi195435.contaboserver.net.8333 > tom-Latitude-3570.39110: tcp 0
00:15:15.009060 IP vmi195435.contaboserver.net.8333 > tom-Latitude-3570.39110: tcp 0
00:15:15.009075 IP vmi195435.contaboserver.net.8333 > tom-Latitude-3570.39110: tcp 0
00:15:15.053408 IP default-rdns.vocus.co.nz.8333 > tom-Latitude-3570.39282: tcp 24
00:15:15.054090 IP default-rdns.vocus.co.nz.8333 > tom-Latitude-3570.39282: tcp 145
00:15:15.054221 IP tom-Latitude-3570.39282 > default-rdns.vocus.co.nz.8333: tcp 0
00:15:15.054425 IP tom-Latitude-3570.39282 > default-rdns.vocus.co.nz.8333: tcp 24
00:15:15.055730 IP tom-Latitude-3570.39282 > default-rdns.vocus.co.nz.8333: tcp 145
00:15:15.086704 IP default-rdns.vocus.co.nz.8333 > tom-Latitude-3570.39282: tcp 0
00:15:15.087253 IP default-rdns.vocus.co.nz.8333 > tom-Latitude-3570.39282: tcp 0
00:15:15.196778 IP c-185-45-236-223.customer.ggaweb.ch.8333 > tom-Latitude-3570.49070: tcp 24
00:15:15.197363 IP c-185-45-236-223.customer.ggaweb.ch.8333 > tom-Latitude-3570.49070: tcp 31
00:15:15.197491 IP tom-Latitude-3570.49070 > c-185-45-236-223.customer.ggaweb.ch.8333: tcp 0
00:15:15.413836 IP default-rdns.vocus.co.nz.8333 > tom-Latitude-3570.39282: tcp 24
00:15:15.420097 IP default-rdns.vocus.co.nz.8333 > tom-Latitude-3570.39282: tcp 372
00:15:15.420115 IP default-rdns.vocus.co.nz.8333 > tom-Latitude-3570.39282: tcp 24
00:15:15.420118 IP default-rdns.vocus.co.nz.8333 > tom-Latitude-3570.39282: tcp 255
00:15:15.420120 IP default-rdns.vocus.co.nz.8333 > tom-Latitude-3570.39282: tcp 24
00:15:15.420122 IP default-rdns.vocus.co.nz.8333 > tom-Latitude-3570.39282: tcp 591
00:15:15.420124 IP default-rdns.vocus.co.nz.8333 > tom-Latitude-3570.39282: tcp 24
00:15:15.420144 IP default-rdns.vocus.co.nz.8333 > tom-Latitude-3570.39282: tcp 486
00:15:15.420211 IP tom-Latitude-3570.39282 > default-rdns.vocus.co.nz.8333: tcp 0
00:15:15.522123 IP tom-Latitude-3570.57976 > 167.99.216.145.8333: tcp 24
00:15:15.523961 IP tom-Latitude-3570.57976 > 167.99.216.145.8333: tcp 145
00:15:15.559256 IP 167.99.216.145.8333 > tom-Latitude-3570.57976: tcp 0
00:15:15.565478 IP 167.99.216.145.8333 > tom-Latitude-3570.57976: tcp 0
00:15:15.622461 IP tom-Latitude-3570.39110 > vmi195435.contaboserver.net.8333: tcp 24
00:15:15.623444 IP tom-Latitude-3570.39110 > vmi195435.contaboserver.net.8333: tcp 8
00:15:15.657055 IP vmi195435.contaboserver.net.8333 > tom-Latitude-3570.39110: tcp 0
00:15:15.666871 IP vmi195435.contaboserver.net.8333 > tom-Latitude-3570.39110: tcp 0
00:15:15.679795 IP c-185-45-236-223.customer.ggaweb.ch.8333 > tom-Latitude-3570.49070: tcp 24
00:15:15.680348 IP c-185-45-236-223.customer.ggaweb.ch.8333 > tom-Latitude-3570.49070: tcp 289
00:15:15.680467 IP tom-Latitude-3570.49070 > c-185-45-236-223.customer.ggaweb.ch.8333: tcp 0
00:15:15.680663 IP tom-Latitude-3570.49070 > c-185-45-236-223.customer.ggaweb.ch.8333: tcp 24
00:15:15.681911 IP tom-Latitude-3570.49070 > c-185-45-236-223.customer.ggaweb.ch.8333: tcp 145
00:15:15.716733 IP c-185-45-236-223.customer.ggaweb.ch.8333 > tom-Latitude-3570.49070: tcp 0
00:15:15.717384 IP c-185-45-236-223.customer.ggaweb.ch.8333 > tom-Latitude-3570.49070: tcp 0
00:15:15.744870 IP vmi195435.contaboserver.net.8333 > tom-Latitude-3570.39110: tcp 24
00:15:15.745483 IP vmi195435.contaboserver.net.8333 > tom-Latitude-3570.39110: tcp 8
00:15:15.745607 IP tom-Latitude-3570.39110 > vmi195435.contaboserver.net.8333: tcp 0
00:15:15.813146 IP c-185-45-236-223.customer.ggaweb.ch.8333 > tom-Latitude-3570.49070: tcp 24
00:15:15.813196 IP c-185-45-236-223.customer.ggaweb.ch.8333 > tom-Latitude-3570.49070: tcp 1140
00:15:15.813314 IP tom-Latitude-3570.49070 > c-185-45-236-223.customer.ggaweb.ch.8333: tcp 0
00:15:15.814951 IP tom-Latitude-3570.49070 > c-185-45-236-223.customer.ggaweb.ch.8333: tcp 24
00:15:15.815635 IP tom-Latitude-3570.49070 > c-185-45-236-223.customer.ggaweb.ch.8333: tcp 37
00:15:15.856693 IP c-185-45-236-223.customer.ggaweb.ch.8333 > tom-Latitude-3570.49070: tcp 0
00:15:15.857432 IP c-185-45-236-223.customer.ggaweb.ch.8333 > tom-Latitude-3570.49070: tcp 0
00:15:15.894735 IP 167.99.216.145.8333 > tom-Latitude-3570.57976: tcp 24
00:15:15.895314 IP 167.99.216.145.8333 > tom-Latitude-3570.57976: tcp 217
00:15:15.895448 IP tom-Latitude-3570.57976 > 167.99.216.145.8333: tcp 0
00:15:15.895668 IP tom-Latitude-3570.57976 > 167.99.216.145.8333: tcp 24
00:15:15.896979 IP tom-Latitude-3570.57976 > 167.99.216.145.8333: tcp 73
00:15:15.960865 IP 167.99.216.145.8333 > tom-Latitude-3570.57976: tcp 0
00:15:15.960882 IP 167.99.216.145.8333 > tom-Latitude-3570.57976: tcp 0
00:15:15.960884 IP 81.198.101.144.8333 > tom-Latitude-3570.60988: tcp 24
00:15:15.960896 IP 81.198.101.144.8333 > tom-Latitude-3570.60988: tcp 433
00:15:15.960899 IP c-185-45-236-223.customer.ggaweb.ch.8333 > tom-Latitude-3570.49070: tcp 24
00:15:15.960901 IP c-185-45-236-223.customer.ggaweb.ch.8333 > tom-Latitude-3570.49070: tcp 37
00:15:15.961001 IP tom-Latitude-3570.49070 > c-185-45-236-223.customer.ggaweb.ch.8333: tcp 0
00:15:15.961029 IP tom-Latitude-3570.60988 > 81.198.101.144.8333: tcp 0
00:15:15.988657 IP 167.99.216.145.8333 > tom-Latitude-3570.57976: tcp 24
00:15:15.989518 IP 167.99.216.145.8333 > tom-Latitude-3570.57976: tcp 225
00:15:15.989537 IP 167.99.216.145.8333 > tom-Latitude-3570.57976: tcp 24
00:15:15.989539 IP 167.99.216.145.8333 > tom-Latitude-3570.57976: tcp 192
00:15:15.989657 IP tom-Latitude-3570.57976 > 167.99.216.145.8333: tcp 0
00:15:16.190665 IP tom-Latitude-3570.39282 > default-rdns.vocus.co.nz.8333: tcp 24
00:15:16.191538 IP tom-Latitude-3570.39282 > default-rdns.vocus.co.nz.8333: tcp 31
00:15:16.228542 IP default-rdns.vocus.co.nz.8333 > tom-Latitude-3570.39282: tcp 0
00:15:16.235326 IP default-rdns.vocus.co.nz.8333 > tom-Latitude-3570.39282: tcp 0
00:15:17.093512 IP tom-Latitude-3570.42516 > 2.56.9.15.8333: tcp 24
00:15:17.094451 IP tom-Latitude-3570.42516 > 2.56.9.15.8333: tcp 325
00:15:17.123064 IP c-185-45-236-223.customer.ggaweb.ch.8333 > tom-Latitude-3570.49070: tcp 24
00:15:17.123686 IP c-185-45-236-223.customer.ggaweb.ch.8333 > tom-Latitude-3570.49070: tcp 181
00:15:17.123795 IP tom-Latitude-3570.49070 > c-185-45-236-223.customer.ggaweb.ch.8333: tcp 0
00:15:17.124000 IP tom-Latitude-3570.49070 > c-185-45-236-223.customer.ggaweb.ch.8333: tcp 24
00:15:17.125351 IP tom-Latitude-3570.49070 > c-185-45-236-223.customer.ggaweb.ch.8333: tcp 109
00:15:17.127914 IP 2.56.9.15.8333 > tom-Latitude-3570.42516: tcp 0
00:15:17.137046 IP 2.56.9.15.8333 > tom-Latitude-3570.42516: tcp 0
00:15:17.167029 IP c-185-45-236-223.customer.ggaweb.ch.8333 > tom-Latitude-3570.49070: tcp 0
00:15:17.167671 IP c-185-45-236-223.customer.ggaweb.ch.8333 > tom-Latitude-3570.49070: tcp 0
00:15:17.251022 IP c-185-45-236-223.customer.ggaweb.ch.8333 > tom-Latitude-3570.49070: tcp 24
00:15:17.261166 IP c-185-45-236-223.customer.ggaweb.ch.8333 > tom-Latitude-3570.49070: tcp 647
00:15:17.261184 IP c-185-45-236-223.customer.ggaweb.ch.8333 > tom-Latitude-3570.49070: tcp 266
00:15:17.261277 IP tom-Latitude-3570.49070 > c-185-45-236-223.customer.ggaweb.ch.8333: tcp 0
00:15:17.463136 IP tom-Latitude-3570.42516 > 2.56.9.15.8333: tcp 24
00:15:17.464299 IP tom-Latitude-3570.42516 > 2.56.9.15.8333: tcp 109
00:15:17.499036 IP 2.56.9.15.8333 > tom-Latitude-3570.42516: tcp 0
00:15:17.505776 IP 2.56.9.15.8333 > tom-Latitude-3570.42516: tcp 0
00:15:17.570087 IP ns3113832.ip-54-38-177.eu.8333 > tom-Latitude-3570.56714: tcp 24
00:15:17.575593 IP ns3113832.ip-54-38-177.eu.8333 > tom-Latitude-3570.56714: tcp 505
00:15:17.575736 IP tom-Latitude-3570.56714 > ns3113832.ip-54-38-177.eu.8333: tcp 0
00:15:17.575993 IP tom-Latitude-3570.56714 > ns3113832.ip-54-38-177.eu.8333: tcp 24
00:15:17.577160 IP tom-Latitude-3570.56714 > ns3113832.ip-54-38-177.eu.8333: tcp 37
00:15:17.583998 IP bb42-60-217-183.singnet.com.sg.8333 > tom-Latitude-3570.60470: tcp 24
00:15:17.584677 IP bb42-60-217-183.singnet.com.sg.8333 > tom-Latitude-3570.60470: tcp 577
00:15:17.584809 IP tom-Latitude-3570.60470 > bb42-60-217-183.singnet.com.sg.8333: tcp 0
00:15:17.596003 IP ns3113832.ip-54-38-177.eu.8333 > tom-Latitude-3570.56714: tcp 0
00:15:17.611929 IP ns3113832.ip-54-38-177.eu.8333 > tom-Latitude-3570.56714: tcp 0
00:15:17.674693 IP ns3113832.ip-54-38-177.eu.8333 > tom-Latitude-3570.56714: tcp 24
00:15:17.674712 IP ns3113832.ip-54-38-177.eu.8333 > tom-Latitude-3570.56714: tcp 224
00:15:17.674804 IP tom-Latitude-3570.56714 > ns3113832.ip-54-38-177.eu.8333: tcp 0
00:15:18.076513 IP tom-Latitude-3570.60988 > 81.198.101.144.8333: tcp 24
00:15:18.079170 IP tom-Latitude-3570.60988 > 81.198.101.144.8333: tcp 145
00:15:18.127026 IP 81.198.101.144.8333 > tom-Latitude-3570.60988: tcp 0
00:15:18.135313 IP 81.198.101.144.8333 > tom-Latitude-3570.60988: tcp 0
00:15:18.174267 IP ns3113832.ip-54-38-177.eu.8333 > tom-Latitude-3570.56714: tcp 24
00:15:18.174941 IP ns3113832.ip-54-38-177.eu.8333 > tom-Latitude-3570.56714: tcp 73
00:15:18.175072 IP tom-Latitude-3570.56714 > ns3113832.ip-54-38-177.eu.8333: tcp 0
00:15:18.175257 IP tom-Latitude-3570.56714 > ns3113832.ip-54-38-177.eu.8333: tcp 24
00:15:18.176717 IP tom-Latitude-3570.56714 > ns3113832.ip-54-38-177.eu.8333: tcp 73
00:15:18.215693 IP ns3113832.ip-54-38-177.eu.8333 > tom-Latitude-3570.56714: tcp 0
00:15:18.215708 IP ns3113832.ip-54-38-177.eu.8333 > tom-Latitude-3570.56714: tcp 0
00:15:18.272548 IP ns3113832.ip-54-38-177.eu.8333 > tom-Latitude-3570.56714: tcp 24
00:15:18.273412 IP ns3113832.ip-54-38-177.eu.8333 > tom-Latitude-3570.56714: tcp 1350
00:15:18.273430 IP ns3113832.ip-54-38-177.eu.8333 > tom-Latitude-3570.56714: tcp 93
00:15:18.273432 IP ns3113832.ip-54-38-177.eu.8333 > tom-Latitude-3570.56714: tcp 24
00:15:18.273434 IP ns3113832.ip-54-38-177.eu.8333 > tom-Latitude-3570.56714: tcp 258
00:15:18.273525 IP tom-Latitude-3570.56714 > ns3113832.ip-54-38-177.eu.8333: tcp 0
00:15:18.876780 IP tom-Latitude-3570.39110 > vmi195435.contaboserver.net.8333: tcp 24
00:15:18.877771 IP tom-Latitude-3570.39110 > vmi195435.contaboserver.net.8333: tcp 541
00:15:18.932856 IP 2.56.9.15.8333 > tom-Latitude-3570.42516: tcp 24
00:15:18.932880 IP tom-Latitude-3570.42516 > 2.56.9.15.8333: tcp 0
00:15:18.933448 IP 2.56.9.15.8333 > tom-Latitude-3570.42516: tcp 181
00:15:18.933478 IP tom-Latitude-3570.42516 > 2.56.9.15.8333: tcp 0
00:15:18.933493 IP vmi195435.contaboserver.net.8333 > tom-Latitude-3570.39110: tcp 0
00:15:18.933704 IP tom-Latitude-3570.42516 > 2.56.9.15.8333: tcp 24
00:15:18.934850 IP tom-Latitude-3570.42516 > 2.56.9.15.8333: tcp 37
00:15:18.936130 IP vmi195435.contaboserver.net.8333 > tom-Latitude-3570.39110: tcp 0
00:15:18.964893 IP 2.56.9.15.8333 > tom-Latitude-3570.42516: tcp 0
00:15:18.965566 IP 2.56.9.15.8333 > tom-Latitude-3570.42516: tcp 0
00:15:19.035516 IP 2.56.9.15.8333 > tom-Latitude-3570.42516: tcp 24
00:15:19.036082 IP 2.56.9.15.8333 > tom-Latitude-3570.42516: tcp 37
00:15:19.036147 IP tom-Latitude-3570.42516 > 2.56.9.15.8333: tcp 0
00:15:19.036335 IP tom-Latitude-3570.42516 > 2.56.9.15.8333: tcp 24
00:15:19.037760 IP tom-Latitude-3570.42516 > 2.56.9.15.8333: tcp 37
00:15:19.059483 IP 2.56.9.15.8333 > tom-Latitude-3570.42516: tcp 24
00:15:19.062635 IP 2.56.9.15.8333 > tom-Latitude-3570.42516: tcp 245
00:15:19.062700 IP tom-Latitude-3570.42516 > 2.56.9.15.8333: tcp 0
00:15:19.065704 IP 2.56.9.15.8333 > tom-Latitude-3570.42516: tcp 0
00:15:19.065718 IP 2.56.9.15.8333 > tom-Latitude-3570.42516: tcp 0
00:15:19.154588 IP 167.99.216.145.8333 > tom-Latitude-3570.57976: tcp 24
00:15:19.155146 IP 167.99.216.145.8333 > tom-Latitude-3570.57976: tcp 397
00:15:19.155212 IP tom-Latitude-3570.57976 > 167.99.216.145.8333: tcp 0
00:15:19.155356 IP tom-Latitude-3570.39110 > vmi195435.contaboserver.net.8333: tcp 24
00:15:19.155529 IP tom-Latitude-3570.57976 > 167.99.216.145.8333: tcp 24
00:15:19.156571 IP tom-Latitude-3570.57976 > 167.99.216.145.8333: tcp 109
00:15:19.156577 IP tom-Latitude-3570.39110 > vmi195435.contaboserver.net.8333: tcp 37
00:15:19.162359 IP 2.56.9.15.8333 > tom-Latitude-3570.42516: tcp 24
00:15:19.163054 IP 2.56.9.15.8333 > tom-Latitude-3570.42516: tcp 223
00:15:19.163107 IP tom-Latitude-3570.42516 > 2.56.9.15.8333: tcp 0
00:15:19.186692 IP 167.99.216.145.8333 > tom-Latitude-3570.57976: tcp 0
00:15:19.187368 IP vmi195435.contaboserver.net.8333 > tom-Latitude-3570.39110: tcp 0
00:15:19.187382 IP 167.99.216.145.8333 > tom-Latitude-3570.57976: tcp 0
00:15:19.187386 IP vmi195435.contaboserver.net.8333 > tom-Latitude-3570.39110: tcp 0
00:15:19.249950 IP 167.99.216.145.8333 > tom-Latitude-3570.57976: tcp 24
00:15:19.249970 IP 167.99.216.145.8333 > tom-Latitude-3570.57976: tcp 223
00:15:19.249975 IP 167.99.216.145.8333 > tom-Latitude-3570.57976: tcp 24
00:15:19.249978 IP 167.99.216.145.8333 > tom-Latitude-3570.57976: tcp 225
00:15:19.249980 IP 167.99.216.145.8333 > tom-Latitude-3570.57976: tcp 24
00:15:19.249983 IP 167.99.216.145.8333 > tom-Latitude-3570.57976: tcp 373
00:15:19.250019 IP tom-Latitude-3570.57976 > 167.99.216.145.8333: tcp 0
00:15:19.351637 IP tom-Latitude-3570.60470 > bb42-60-217-183.singnet.com.sg.8333: tcp 24
00:15:19.353466 IP tom-Latitude-3570.60470 > bb42-60-217-183.singnet.com.sg.8333: tcp 253
00:15:19.388543 IP bb42-60-217-183.singnet.com.sg.8333 > tom-Latitude-3570.60470: tcp 0
00:15:19.396524 IP bb42-60-217-183.singnet.com.sg.8333 > tom-Latitude-3570.60470: tcp 0
00:15:19.552309 IP tom-Latitude-3570.49070 > c-185-45-236-223.customer.ggaweb.ch.8333: tcp 24
00:15:19.552381 IP tom-Latitude-3570.56714 > ns3113832.ip-54-38-177.eu.8333: tcp 24
00:15:19.553271 IP tom-Latitude-3570.56714 > ns3113832.ip-54-38-177.eu.8333: tcp 181
00:15:19.553282 IP tom-Latitude-3570.49070 > c-185-45-236-223.customer.ggaweb.ch.8333: tcp 8
00:15:19.588501 IP ns3113832.ip-54-38-177.eu.8333 > tom-Latitude-3570.56714: tcp 0
00:15:19.596554 IP c-185-45-236-223.customer.ggaweb.ch.8333 > tom-Latitude-3570.49070: tcp 0
00:15:19.597159 IP ns3113832.ip-54-38-177.eu.8333 > tom-Latitude-3570.56714: tcp 0
00:15:19.597172 IP c-185-45-236-223.customer.ggaweb.ch.8333 > tom-Latitude-3570.49070: tcp 0
00:15:19.648550 IP c-185-45-236-223.customer.ggaweb.ch.8333 > tom-Latitude-3570.49070: tcp 24
00:15:19.649221 IP c-185-45-236-223.customer.ggaweb.ch.8333 > tom-Latitude-3570.49070: tcp 8
00:15:19.649284 IP tom-Latitude-3570.49070 > c-185-45-236-223.customer.ggaweb.ch.8333: tcp 0
00:15:19.649412 IP tom-Latitude-3570.49070 > c-185-45-236-223.customer.ggaweb.ch.8333: tcp 24
00:15:19.650863 IP tom-Latitude-3570.49070 > c-185-45-236-223.customer.ggaweb.ch.8333: tcp 8
00:15:19.653781 IP ns3113832.ip-54-38-177.eu.8333 > tom-Latitude-3570.56714: tcp 24
00:15:19.654392 IP ns3113832.ip-54-38-177.eu.8333 > tom-Latitude-3570.56714: tcp 109
00:15:19.654474 IP tom-Latitude-3570.56714 > ns3113832.ip-54-38-177.eu.8333: tcp 0
00:15:19.654594 IP tom-Latitude-3570.56714 > ns3113832.ip-54-38-177.eu.8333: tcp 24
00:15:19.655919 IP tom-Latitude-3570.56714 > ns3113832.ip-54-38-177.eu.8333: tcp 869
00:15:19.681230 IP c-185-45-236-223.customer.ggaweb.ch.8333 > tom-Latitude-3570.49070: tcp 24
00:15:19.681250 IP c-185-45-236-223.customer.ggaweb.ch.8333 > tom-Latitude-3570.49070: tcp 8
00:15:19.681296 IP tom-Latitude-3570.49070 > c-185-45-236-223.customer.ggaweb.ch.8333: tcp 0
00:15:19.692988 IP c-185-45-236-223.customer.ggaweb.ch.8333 > tom-Latitude-3570.49070: tcp 0
00:15:19.693545 IP c-185-45-236-223.customer.ggaweb.ch.8333 > tom-Latitude-3570.49070: tcp 0
00:15:19.693558 IP ns3113832.ip-54-38-177.eu.8333 > tom-Latitude-3570.56714: tcp 0
00:15:19.693562 IP ns3113832.ip-54-38-177.eu.8333 > tom-Latitude-3570.56714: tcp 0
00:15:19.800781 IP bb42-60-217-183.singnet.com.sg.8333 > tom-Latitude-3570.60470: tcp 24
00:15:19.800800 IP bb42-60-217-183.singnet.com.sg.8333 > tom-Latitude-3570.60470: tcp 37
00:15:19.800847 IP tom-Latitude-3570.60470 > bb42-60-217-183.singnet.com.sg.8333: tcp 0
00:15:19.800988 IP tom-Latitude-3570.60470 > bb42-60-217-183.singnet.com.sg.8333: tcp 24
00:15:19.802403 IP tom-Latitude-3570.60470 > bb42-60-217-183.singnet.com.sg.8333: tcp 225
00:15:19.839760 IP bb42-60-217-183.singnet.com.sg.8333 > tom-Latitude-3570.60470: tcp 0
00:15:19.839775 IP bb42-60-217-183.singnet.com.sg.8333 > tom-Latitude-3570.60470: tcp 0
00:15:20.102112 IP tom-Latitude-3570.49070 > c-185-45-236-223.customer.ggaweb.ch.8333: tcp 24
00:15:20.103043 IP tom-Latitude-3570.49070 > c-185-45-236-223.customer.ggaweb.ch.8333: tcp 289
00:15:20.146689 IP c-185-45-236-223.customer.ggaweb.ch.8333 > tom-Latitude-3570.49070: tcp 0
00:15:20.156173 IP c-185-45-236-223.customer.ggaweb.ch.8333 > tom-Latitude-3570.49070: tcp 0
00:15:21.305764 IP tom-Latitude-3570.42516 > 2.56.9.15.8333: tcp 24
00:15:21.306755 IP tom-Latitude-3570.42516 > 2.56.9.15.8333: tcp 109
00:15:21.369684 IP 2.56.9.15.8333 > tom-Latitude-3570.42516: tcp 0
00:15:21.369696 IP 2.56.9.15.8333 > tom-Latitude-3570.42516: tcp 0
00:15:21.406232 IP tom-Latitude-3570.39282 > default-rdns.vocus.co.nz.8333: tcp 24
00:15:21.407167 IP tom-Latitude-3570.39282 > default-rdns.vocus.co.nz.8333: tcp 577
00:15:21.439121 IP default-rdns.vocus.co.nz.8333 > tom-Latitude-3570.39282: tcp 0
00:15:21.446985 IP default-rdns.vocus.co.nz.8333 > tom-Latitude-3570.39282: tcp 0
00:15:21.506666 IP tom-Latitude-3570.60988 > 81.198.101.144.8333: tcp 24
00:15:21.507656 IP tom-Latitude-3570.60988 > 81.198.101.144.8333: tcp 253
00:15:21.538983 IP 81.198.101.144.8333 > tom-Latitude-3570.60988: tcp 0
00:15:21.547004 IP 81.198.101.144.8333 > tom-Latitude-3570.60988: tcp 0
00:15:21.672492 IP 81.198.101.144.8333 > tom-Latitude-3570.60988: tcp 24
00:15:21.673122 IP 81.198.101.144.8333 > tom-Latitude-3570.60988: tcp 145
00:15:21.673210 IP tom-Latitude-3570.60988 > 81.198.101.144.8333: tcp 0
00:15:21.673415 IP tom-Latitude-3570.60988 > 81.198.101.144.8333: tcp 24
00:15:21.674750 IP tom-Latitude-3570.60988 > 81.198.101.144.8333: tcp 145
00:15:21.707402 IP 81.198.101.144.8333 > tom-Latitude-3570.60988: tcp 0
00:15:21.707417 IP 81.198.101.144.8333 > tom-Latitude-3570.60988: tcp 0
00:15:21.736424 IP ns3113832.ip-54-38-177.eu.8333 > tom-Latitude-3570.56714: tcp 24
00:15:21.737769 IP ns3113832.ip-54-38-177.eu.8333 > tom-Latitude-3570.56714: tcp 253
00:15:21.737833 IP tom-Latitude-3570.56714 > ns3113832.ip-54-38-177.eu.8333: tcp 0
00:15:21.738081 IP tom-Latitude-3570.56714 > ns3113832.ip-54-38-177.eu.8333: tcp 24
00:15:21.739421 IP tom-Latitude-3570.56714 > ns3113832.ip-54-38-177.eu.8333: tcp 109
00:15:21.776949 IP ns3113832.ip-54-38-177.eu.8333 > tom-Latitude-3570.56714: tcp 0
00:15:21.784964 IP ns3113832.ip-54-38-177.eu.8333 > tom-Latitude-3570.56714: tcp 0
00:15:21.800423 IP 81.198.101.144.8333 > tom-Latitude-3570.60988: tcp 24
00:15:21.801542 IP 81.198.101.144.8333 > tom-Latitude-3570.60988: tcp 367
00:15:21.801557 IP 81.198.101.144.8333 > tom-Latitude-3570.60988: tcp 24
00:15:21.801562 IP 81.198.101.144.8333 > tom-Latitude-3570.60988: tcp 1448
00:15:21.801565 IP 81.198.101.144.8333 > tom-Latitude-3570.60988: tcp 167
00:15:21.801567 IP 81.198.101.144.8333 > tom-Latitude-3570.60988: tcp 24
00:15:21.801570 IP 81.198.101.144.8333 > tom-Latitude-3570.60988: tcp 225
00:15:21.801572 IP 81.198.101.144.8333 > tom-Latitude-3570.60988: tcp 24
00:15:21.801574 IP 81.198.101.144.8333 > tom-Latitude-3570.60988: tcp 257
00:15:21.801597 IP tom-Latitude-3570.60988 > 81.198.101.144.8333: tcp 0
00:15:21.833277 IP ns3113832.ip-54-38-177.eu.8333 > tom-Latitude-3570.56714: tcp 24
00:15:21.834145 IP ns3113832.ip-54-38-177.eu.8333 > tom-Latitude-3570.56714: tcp 519
00:15:21.834164 IP ns3113832.ip-54-38-177.eu.8333 > tom-Latitude-3570.56714: tcp 24
00:15:21.834168 IP ns3113832.ip-54-38-177.eu.8333 > tom-Latitude-3570.56714: tcp 246
00:15:21.834171 IP ns3113832.ip-54-38-177.eu.8333 > tom-Latitude-3570.56714: tcp 24
00:15:21.834173 IP ns3113832.ip-54-38-177.eu.8333 > tom-Latitude-3570.56714: tcp 246
00:15:21.834211 IP tom-Latitude-3570.56714 > ns3113832.ip-54-38-177.eu.8333: tcp 0
00:15:22.138847 IP tom-Latitude-3570.49070 > c-185-45-236-223.customer.ggaweb.ch.8333: tcp 24
00:15:22.139791 IP tom-Latitude-3570.49070 > c-185-45-236-223.customer.ggaweb.ch.8333: tcp 253
00:15:22.196802 IP c-185-45-236-223.customer.ggaweb.ch.8333 > tom-Latitude-3570.49070: tcp 0
00:15:22.197373 IP c-185-45-236-223.customer.ggaweb.ch.8333 > tom-Latitude-3570.49070: tcp 0
00:15:22.740701 IP tom-Latitude-3570.60988 > 81.198.101.144.8333: tcp 24
00:15:22.740744 IP tom-Latitude-3570.42516 > 2.56.9.15.8333: tcp 24
00:15:22.741666 IP tom-Latitude-3570.42516 > 2.56.9.15.8333: tcp 8
00:15:22.741678 IP tom-Latitude-3570.60988 > 81.198.101.144.8333: tcp 8
00:15:22.792718 IP default-rdns.vocus.co.nz.8333 > tom-Latitude-3570.39282: tcp 24
00:15:22.792738 IP default-rdns.vocus.co.nz.8333 > tom-Latitude-3570.39282: tcp 73
00:15:22.792740 IP 2.56.9.15.8333 > tom-Latitude-3570.42516: tcp 24
00:15:22.792785 IP tom-Latitude-3570.39282 > default-rdns.vocus.co.nz.8333: tcp 0
00:15:22.795786 IP 2.56.9.15.8333 > tom-Latitude-3570.42516: tcp 8
00:15:22.795850 IP tom-Latitude-3570.42516 > 2.56.9.15.8333: tcp 0
00:15:22.795990 IP tom-Latitude-3570.42516 > 2.56.9.15.8333: tcp 24
00:15:22.796509 IP default-rdns.vocus.co.nz.8333 > tom-Latitude-3570.39282: tcp 73
00:15:22.796531 IP tom-Latitude-3570.39282 > default-rdns.vocus.co.nz.8333: tcp 0
00:15:22.796544 IP 2.56.9.15.8333 > tom-Latitude-3570.42516: tcp 8
00:15:22.796549 IP tom-Latitude-3570.42516 > 2.56.9.15.8333: tcp 8
00:15:22.796554 IP 81.198.101.144.8333 > tom-Latitude-3570.60988: tcp 0
00:15:22.796559 IP 2.56.9.15.8333 > tom-Latitude-3570.42516: tcp 0
00:15:22.796562 IP 2.56.9.15.8333 > tom-Latitude-3570.42516: tcp 0
00:15:22.796564 IP 81.198.101.144.8333 > tom-Latitude-3570.60988: tcp 0
00:15:22.826573 IP 2.56.9.15.8333 > tom-Latitude-3570.42516: tcp 0
00:15:22.827159 IP 2.56.9.15.8333 > tom-Latitude-3570.42516: tcp 0
00:15:22.894051 IP 2.56.9.15.8333 > tom-Latitude-3570.42516: tcp 24
00:15:22.894826 IP 2.56.9.15.8333 > tom-Latitude-3570.42516: tcp 8
00:15:22.894891 IP tom-Latitude-3570.42516 > 2.56.9.15.8333: tcp 0
00:15:22.895080 IP tom-Latitude-3570.39282 > default-rdns.vocus.co.nz.8333: tcp 24
00:15:22.897129 IP tom-Latitude-3570.39282 > default-rdns.vocus.co.nz.8333: tcp 217
00:15:22.926563 IP default-rdns.vocus.co.nz.8333 > tom-Latitude-3570.39282: tcp 0
00:15:22.927247 IP default-rdns.vocus.co.nz.8333 > tom-Latitude-3570.39282: tcp 0
00:15:22.972629 IP 81.198.101.144.8333 > tom-Latitude-3570.60988: tcp 24
00:15:22.973273 IP 81.198.101.144.8333 > tom-Latitude-3570.60988: tcp 8
00:15:22.973337 IP tom-Latitude-3570.60988 > 81.198.101.144.8333: tcp 0
00:15:22.973533 IP tom-Latitude-3570.42516 > 2.56.9.15.8333: tcp 24
00:15:22.974920 IP tom-Latitude-3570.42516 > 2.56.9.15.8333: tcp 253
00:15:22.995545 IP default-rdns.vocus.co.nz.8333 > tom-Latitude-3570.39282: tcp 24
00:15:22.995565 IP tom-Latitude-3570.39282 > default-rdns.vocus.co.nz.8333: tcp 0
00:15:22.995607 IP default-rdns.vocus.co.nz.8333 > tom-Latitude-3570.39282: tcp 541
00:15:22.995618 IP tom-Latitude-3570.39282 > default-rdns.vocus.co.nz.8333: tcp 0
00:15:22.995980 IP tom-Latitude-3570.39282 > default-rdns.vocus.co.nz.8333: tcp 24
00:15:22.996993 IP tom-Latitude-3570.39282 > default-rdns.vocus.co.nz.8333: tcp 325
00:15:23.005353 IP 2.56.9.15.8333 > tom-Latitude-3570.42516: tcp 0
00:15:23.008054 IP 2.56.9.15.8333 > tom-Latitude-3570.42516: tcp 0
00:15:23.039623 IP default-rdns.vocus.co.nz.8333 > tom-Latitude-3570.39282: tcp 0
00:15:23.042727 IP default-rdns.vocus.co.nz.8333 > tom-Latitude-3570.39282: tcp 0
00:15:23.091606 IP ns3113832.ip-54-38-177.eu.8333 > tom-Latitude-3570.56714: tcp 24
00:15:23.092252 IP ns3113832.ip-54-38-177.eu.8333 > tom-Latitude-3570.56714: tcp 469
00:15:23.092382 IP tom-Latitude-3570.56714 > ns3113832.ip-54-38-177.eu.8333: tcp 0
00:15:23.092522 IP tom-Latitude-3570.39110 > vmi195435.contaboserver.net.8333: tcp 24
00:15:23.092748 IP tom-Latitude-3570.56714 > ns3113832.ip-54-38-177.eu.8333: tcp 24
00:15:23.093267 IP tom-Latitude-3570.39110 > vmi195435.contaboserver.net.8333: tcp 31
00:15:23.093997 IP tom-Latitude-3570.56714 > ns3113832.ip-54-38-177.eu.8333: tcp 145
00:15:23.098447 IP ns3113832.ip-54-38-177.eu.8333 > tom-Latitude-3570.56714: tcp 24
00:15:23.099152 IP ns3113832.ip-54-38-177.eu.8333 > tom-Latitude-3570.56714: tcp 8
00:15:23.099166 IP tom-Latitude-3570.56714 > ns3113832.ip-54-38-177.eu.8333: tcp 0
00:15:23.099253 IP tom-Latitude-3570.56714 > ns3113832.ip-54-38-177.eu.8333: tcp 24
00:15:23.100499 IP tom-Latitude-3570.56714 > ns3113832.ip-54-38-177.eu.8333: tcp 8
00:15:23.125047 IP ns3113832.ip-54-38-177.eu.8333 > tom-Latitude-3570.56714: tcp 0
00:15:23.125699 IP vmi195435.contaboserver.net.8333 > tom-Latitude-3570.39110: tcp 0
00:15:23.125713 IP vmi195435.contaboserver.net.8333 > tom-Latitude-3570.39110: tcp 0
00:15:23.125715 IP ns3113832.ip-54-38-177.eu.8333 > tom-Latitude-3570.56714: tcp 0
00:15:23.134564 IP ns3113832.ip-54-38-177.eu.8333 > tom-Latitude-3570.56714: tcp 0
00:15:23.135235 IP ns3113832.ip-54-38-177.eu.8333 > tom-Latitude-3570.56714: tcp 0
00:15:23.184890 IP ns3113832.ip-54-38-177.eu.8333 > tom-Latitude-3570.56714: tcp 24
00:15:23.185782 IP ns3113832.ip-54-38-177.eu.8333 > tom-Latitude-3570.56714: tcp 419
00:15:23.185800 IP ns3113832.ip-54-38-177.eu.8333 > tom-Latitude-3570.56714: tcp 24
00:15:23.185802 IP ns3113832.ip-54-38-177.eu.8333 > tom-Latitude-3570.56714: tcp 247
00:15:23.185805 IP ns3113832.ip-54-38-177.eu.8333 > tom-Latitude-3570.56714: tcp 24
00:15:23.185806 IP ns3113832.ip-54-38-177.eu.8333 > tom-Latitude-3570.56714: tcp 250
00:15:23.185808 IP ns3113832.ip-54-38-177.eu.8333 > tom-Latitude-3570.56714: tcp 24
00:15:23.185810 IP ns3113832.ip-54-38-177.eu.8333 > tom-Latitude-3570.56714: tcp 190
00:15:23.185908 IP tom-Latitude-3570.56714 > ns3113832.ip-54-38-177.eu.8333: tcp 0
00:15:23.290032 IP tom-Latitude-3570.56714 > ns3113832.ip-54-38-177.eu.8333: tcp 24
00:15:23.290970 IP tom-Latitude-3570.56714 > ns3113832.ip-54-38-177.eu.8333: tcp 8
00:15:23.325785 IP ns3113832.ip-54-38-177.eu.8333 > tom-Latitude-3570.56714: tcp 0
00:15:23.328894 IP ns3113832.ip-54-38-177.eu.8333 > tom-Latitude-3570.56714: tcp 0
00:15:23.369308 IP default-rdns.vocus.co.nz.8333 > tom-Latitude-3570.39282: tcp 24
00:15:23.369328 IP default-rdns.vocus.co.nz.8333 > tom-Latitude-3570.39282: tcp 223
00:15:23.369331 IP default-rdns.vocus.co.nz.8333 > tom-Latitude-3570.39282: tcp 24
00:15:23.369334 IP default-rdns.vocus.co.nz.8333 > tom-Latitude-3570.39282: tcp 226
00:15:23.369335 IP default-rdns.vocus.co.nz.8333 > tom-Latitude-3570.39282: tcp 24
00:15:23.369424 IP tom-Latitude-3570.39282 > default-rdns.vocus.co.nz.8333: tcp 0
00:15:23.369956 IP tom-Latitude-3570.60470 > bb42-60-217-183.singnet.com.sg.8333: tcp 24
00:15:23.370470 IP default-rdns.vocus.co.nz.8333 > tom-Latitude-3570.39282: tcp 223
00:15:23.370483 IP default-rdns.vocus.co.nz.8333 > tom-Latitude-3570.39282: tcp 24
00:15:23.370485 IP default-rdns.vocus.co.nz.8333 > tom-Latitude-3570.39282: tcp 246
00:15:23.370487 IP default-rdns.vocus.co.nz.8333 > tom-Latitude-3570.39282: tcp 24
00:15:23.370489 IP default-rdns.vocus.co.nz.8333 > tom-Latitude-3570.39282: tcp 192
00:15:23.370492 IP default-rdns.vocus.co.nz.8333 > tom-Latitude-3570.39282: tcp 24
00:15:23.370494 IP default-rdns.vocus.co.nz.8333 > tom-Latitude-3570.39282: tcp 373
00:15:23.370513 IP default-rdns.vocus.co.nz.8333 > tom-Latitude-3570.39282: tcp 24
00:15:23.370515 IP default-rdns.vocus.co.nz.8333 > tom-Latitude-3570.39282: tcp 224
00:15:23.370517 IP default-rdns.vocus.co.nz.8333 > tom-Latitude-3570.39282: tcp 24
00:15:23.370526 IP default-rdns.vocus.co.nz.8333 > tom-Latitude-3570.39282: tcp 1360
00:15:23.370528 IP default-rdns.vocus.co.nz.8333 > tom-Latitude-3570.39282: tcp 340
00:15:23.370530 IP default-rdns.vocus.co.nz.8333 > tom-Latitude-3570.39282: tcp 24
00:15:23.370554 IP tom-Latitude-3570.39282 > default-rdns.vocus.co.nz.8333: tcp 0
00:15:23.370997 IP tom-Latitude-3570.60470 > bb42-60-217-183.singnet.com.sg.8333: tcp 433
00:15:23.372796 IP default-rdns.vocus.co.nz.8333 > tom-Latitude-3570.39282: tcp 374
00:15:23.384497 IP ns3113832.ip-54-38-177.eu.8333 > tom-Latitude-3570.56714: tcp 24
00:15:23.391593 IP ns3113832.ip-54-38-177.eu.8333 > tom-Latitude-3570.56714: tcp 8
00:15:23.391615 IP tom-Latitude-3570.56714 > ns3113832.ip-54-38-177.eu.8333: tcp 0
00:15:23.391731 IP tom-Latitude-3570.60470 > bb42-60-217-183.singnet.com.sg.8333: tcp 24
00:15:23.391739 IP tom-Latitude-3570.60470 > bb42-60-217-183.singnet.com.sg.8333: tcp 289
00:15:23.406631 IP bb42-60-217-183.singnet.com.sg.8333 > tom-Latitude-3570.60470: tcp 0
00:15:23.408916 IP bb42-60-217-183.singnet.com.sg.8333 > tom-Latitude-3570.60470: tcp 0
00:15:23.415791 IP tom-Latitude-3570.39282 > default-rdns.vocus.co.nz.8333: tcp 0
00:15:23.438436 IP bb42-60-217-183.singnet.com.sg.8333 > tom-Latitude-3570.60470: tcp 0
00:15:23.444440 IP bb42-60-217-183.singnet.com.sg.8333 > tom-Latitude-3570.60470: tcp 0
00:15:23.511484 IP vmi195435.contaboserver.net.8333 > tom-Latitude-3570.39110: tcp 24
00:15:23.511493 IP vmi195435.contaboserver.net.8333 > tom-Latitude-3570.39110: tcp 1009
00:15:23.511499 IP tom-Latitude-3570.39110 > vmi195435.contaboserver.net.8333: tcp 0
00:15:23.511761 IP tom-Latitude-3570.39110 > vmi195435.contaboserver.net.8333: tcp 24
00:15:23.512848 IP tom-Latitude-3570.39110 > vmi195435.contaboserver.net.8333: tcp 109
00:15:23.547515 IP 81.198.101.144.8333 > tom-Latitude-3570.60988: tcp 24
00:15:23.548288 IP 81.198.101.144.8333 > tom-Latitude-3570.60988: tcp 433
00:15:23.548294 IP vmi195435.contaboserver.net.8333 > tom-Latitude-3570.39110: tcp 0
00:15:23.548301 IP tom-Latitude-3570.60988 > 81.198.101.144.8333: tcp 0
00:15:23.553369 IP vmi195435.contaboserver.net.8333 > tom-Latitude-3570.39110: tcp 0
00:15:23.640546 IP vmi195435.contaboserver.net.8333 > tom-Latitude-3570.39110: tcp 24
00:15:23.640565 IP vmi195435.contaboserver.net.8333 > tom-Latitude-3570.39110: tcp 933
00:15:23.640569 IP vmi195435.contaboserver.net.8333 > tom-Latitude-3570.39110: tcp 24
00:15:23.640571 IP vmi195435.contaboserver.net.8333 > tom-Latitude-3570.39110: tcp 245
00:15:23.640573 IP vmi195435.contaboserver.net.8333 > tom-Latitude-3570.39110: tcp 24
00:15:23.640574 IP vmi195435.contaboserver.net.8333 > tom-Latitude-3570.39110: tcp 680
00:15:23.640656 IP tom-Latitude-3570.39110 > vmi195435.contaboserver.net.8333: tcp 0
00:15:23.943041 IP tom-Latitude-3570.39282 > default-rdns.vocus.co.nz.8333: tcp 24
00:15:23.943803 IP tom-Latitude-3570.39282 > default-rdns.vocus.co.nz.8333: tcp 253
00:15:23.999112 IP default-rdns.vocus.co.nz.8333 > tom-Latitude-3570.39282: tcp 0
00:15:24.015266 IP default-rdns.vocus.co.nz.8333 > tom-Latitude-3570.39282: tcp 0
00:15:24.043286 IP tom-Latitude-3570.60470 > bb42-60-217-183.singnet.com.sg.8333: tcp 24
00:15:24.044274 IP tom-Latitude-3570.60470 > bb42-60-217-183.singnet.com.sg.8333: tcp 109
00:15:24.085749 IP bb42-60-217-183.singnet.com.sg.8333 > tom-Latitude-3570.60470: tcp 0
00:15:24.089560 IP bb42-60-217-183.singnet.com.sg.8333 > tom-Latitude-3570.60470: tcp 0
00:15:24.143568 IP tom-Latitude-3570.60988 > 81.198.101.144.8333: tcp 24
00:15:24.152237 IP tom-Latitude-3570.60988 > 81.198.101.144.8333: tcp 253
00:15:24.167942 IP 81.198.101.144.8333 > tom-Latitude-3570.60988: tcp 24
00:15:24.168852 IP 81.198.101.144.8333 > tom-Latitude-3570.60988: tcp 181
00:15:24.168983 IP tom-Latitude-3570.60988 > 81.198.101.144.8333: tcp 0
00:15:24.181102 IP 81.198.101.144.8333 > tom-Latitude-3570.60988: tcp 0
00:15:24.196108 IP 81.198.101.144.8333 > tom-Latitude-3570.60988: tcp 0
00:15:24.269565 IP tom-Latitude-3570.49070 > c-185-45-236-223.customer.ggaweb.ch.8333: tcp 24
00:15:24.270536 IP tom-Latitude-3570.49070 > c-185-45-236-223.customer.ggaweb.ch.8333: tcp 577
00:15:24.299088 IP c-185-45-236-223.customer.ggaweb.ch.8333 > tom-Latitude-3570.49070: tcp 0
00:15:24.306933 IP c-185-45-236-223.customer.ggaweb.ch.8333 > tom-Latitude-3570.49070: tcp 0
00:15:24.369969 IP tom-Latitude-3570.39282 > default-rdns.vocus.co.nz.8333: tcp 24
00:15:24.370910 IP tom-Latitude-3570.39282 > default-rdns.vocus.co.nz.8333: tcp 8
00:15:24.399076 IP default-rdns.vocus.co.nz.8333 > tom-Latitude-3570.39282: tcp 0
00:15:24.407218 IP default-rdns.vocus.co.nz.8333 > tom-Latitude-3570.39282: tcp 0
00:15:24.458138 IP default-rdns.vocus.co.nz.8333 > tom-Latitude-3570.39282: tcp 24
00:15:24.458155 IP tom-Latitude-3570.39282 > default-rdns.vocus.co.nz.8333: tcp 0
00:15:24.458748 IP default-rdns.vocus.co.nz.8333 > tom-Latitude-3570.39282: tcp 8
00:15:24.458765 IP tom-Latitude-3570.39282 > default-rdns.vocus.co.nz.8333: tcp 0
00:15:24.458960 IP tom-Latitude-3570.39282 > default-rdns.vocus.co.nz.8333: tcp 24
00:15:24.460080 IP tom-Latitude-3570.39282 > default-rdns.vocus.co.nz.8333: tcp 8
00:15:24.497139 IP default-rdns.vocus.co.nz.8333 > tom-Latitude-3570.39282: tcp 0
00:15:24.497752 IP default-rdns.vocus.co.nz.8333 > tom-Latitude-3570.39282: tcp 0
00:15:24.708042 IP ns3113832.ip-54-38-177.eu.8333 > tom-Latitude-3570.56714: tcp 24
00:15:24.708781 IP ns3113832.ip-54-38-177.eu.8333 > tom-Latitude-3570.56714: tcp 289
00:15:24.708913 IP tom-Latitude-3570.56714 > ns3113832.ip-54-38-177.eu.8333: tcp 0
00:15:24.709126 IP tom-Latitude-3570.56714 > ns3113832.ip-54-38-177.eu.8333: tcp 24
00:15:24.710476 IP tom-Latitude-3570.56714 > ns3113832.ip-54-38-177.eu.8333: tcp 181
00:15:24.711916 IP 81.198.101.144.8333 > tom-Latitude-3570.60988: tcp 24
00:15:24.711950 IP 81.198.101.144.8333 > tom-Latitude-3570.60988: tcp 8
00:15:24.712038 IP tom-Latitude-3570.60988 > 81.198.101.144.8333: tcp 0
