07:44:15.336620 IP c-185-45-236-223.customer.ggaweb.ch.8333 > tom-Latitude-3570.49070: tcp 24
07:44:15.336643 IP c-185-45-236-223.customer.ggaweb.ch.8333 > tom-Latitude-3570.49070: tcp 1261
07:44:15.336728 IP tom-Latitude-3570.49070 > c-185-45-236-223.customer.ggaweb.ch.8333: tcp 0
07:44:15.337111 IP tom-Latitude-3570.49070 > c-185-45-236-223.customer.ggaweb.ch.8333: tcp 24
07:44:15.338195 IP tom-Latitude-3570.49070 > c-185-45-236-223.customer.ggaweb.ch.8333: tcp 325
07:44:15.437603 IP tom-Latitude-3570.49070 > c-185-45-236-223.customer.ggaweb.ch.8333: tcp 24
07:44:15.437623 IP tom-Latitude-3570.49070 > c-185-45-236-223.customer.ggaweb.ch.8333: tcp 577
07:44:15.539455 IP c-185-45-236-223.customer.ggaweb.ch.8333 > tom-Latitude-3570.49070: tcp 0
07:44:15.539471 IP c-185-45-236-223.customer.ggaweb.ch.8333 > tom-Latitude-3570.49070: tcp 0
07:44:15.539474 IP c-185-45-236-223.customer.ggaweb.ch.8333 > tom-Latitude-3570.49070: tcp 24
07:44:15.539484 IP c-185-45-236-223.customer.ggaweb.ch.8333 > tom-Latitude-3570.49070: tcp 520
07:44:15.539491 IP c-185-45-236-223.customer.ggaweb.ch.8333 > tom-Latitude-3570.49070: tcp 24
07:44:15.539494 IP c-185-45-236-223.customer.ggaweb.ch.8333 > tom-Latitude-3570.49070: tcp 404
07:44:15.539569 IP tom-Latitude-3570.49070 > c-185-45-236-223.customer.ggaweb.ch.8333: tcp 0
07:44:15.539781 IP c-185-45-236-223.customer.ggaweb.ch.8333 > tom-Latitude-3570.49070: tcp 398
07:44:15.539795 IP c-185-45-236-223.customer.ggaweb.ch.8333 > tom-Latitude-3570.49070: tcp 250
07:44:15.539814 IP c-185-45-236-223.customer.ggaweb.ch.8333 > tom-Latitude-3570.49070: tcp 316
07:44:15.539819 IP c-185-45-236-223.customer.ggaweb.ch.8333 > tom-Latitude-3570.49070: tcp 24
07:44:15.539823 IP c-185-45-236-223.customer.ggaweb.ch.8333 > tom-Latitude-3570.49070: tcp 841
07:44:15.539826 IP c-185-45-236-223.customer.ggaweb.ch.8333 > tom-Latitude-3570.49070: tcp 216
07:44:15.539849 IP tom-Latitude-3570.49070 > c-185-45-236-223.customer.ggaweb.ch.8333: tcp 0
07:44:15.545907 IP c-185-45-236-223.customer.ggaweb.ch.8333 > tom-Latitude-3570.49070: tcp 225
07:44:15.576919 IP c-185-45-236-223.customer.ggaweb.ch.8333 > tom-Latitude-3570.49070: tcp 0
07:44:15.587312 IP c-185-45-236-223.customer.ggaweb.ch.8333 > tom-Latitude-3570.49070: tcp 0
07:44:15.587779 IP tom-Latitude-3570.49070 > c-185-45-236-223.customer.ggaweb.ch.8333: tcp 0
07:44:15.646619 IP tom-Latitude-3570.46284 > static-87-75-105-186.vodafonexdsl.co.uk.8333: tcp 24
07:44:15.647580 IP tom-Latitude-3570.46284 > static-87-75-105-186.vodafonexdsl.co.uk.8333: tcp 325
07:44:15.687077 IP static-87-75-105-186.vodafonexdsl.co.uk.8333 > tom-Latitude-3570.46284: tcp 0
07:44:15.947812 IP tom-Latitude-3570.57976 > 167.99.216.145.8333: tcp 24
07:44:15.949885 IP tom-Latitude-3570.57976 > 167.99.216.145.8333: tcp 325
07:44:15.979380 IP 167.99.216.145.8333 > tom-Latitude-3570.57976: tcp 0
07:44:15.986639 IP 167.99.216.145.8333 > tom-Latitude-3570.57976: tcp 0
07:44:16.223615 IP vmi195435.contaboserver.net.8333 > tom-Latitude-3570.39110: tcp 24
07:44:16.223635 IP vmi195435.contaboserver.net.8333 > tom-Latitude-3570.39110: tcp 1261
07:44:16.223740 IP tom-Latitude-3570.39110 > vmi195435.contaboserver.net.8333: tcp 0
07:44:16.224177 IP tom-Latitude-3570.39110 > vmi195435.contaboserver.net.8333: tcp 24
07:44:16.226401 IP tom-Latitude-3570.39110 > vmi195435.contaboserver.net.8333: tcp 505
07:44:16.248619 IP vmi195435.contaboserver.net.8333 > tom-Latitude-3570.39110: tcp 1261
07:44:16.248639 IP tom-Latitude-3570.39110 > vmi195435.contaboserver.net.8333: tcp 0
07:44:16.260588 IP vmi195435.contaboserver.net.8333 > tom-Latitude-3570.39110: tcp 0
07:44:16.268055 IP vmi195435.contaboserver.net.8333 > tom-Latitude-3570.39110: tcp 0
07:44:16.345236 IP vmi195435.contaboserver.net.8333 > tom-Latitude-3570.39110: tcp 24
07:44:16.345254 IP tom-Latitude-3570.39110 > vmi195435.contaboserver.net.8333: tcp 0
07:44:16.346256 IP vmi195435.contaboserver.net.8333 > tom-Latitude-3570.39110: tcp 292
07:44:16.346280 IP tom-Latitude-3570.39110 > vmi195435.contaboserver.net.8333: tcp 0
07:44:16.346309 IP vmi195435.contaboserver.net.8333 > tom-Latitude-3570.39110: tcp 24
07:44:16.346313 IP tom-Latitude-3570.39110 > vmi195435.contaboserver.net.8333: tcp 0
07:44:16.346318 IP vmi195435.contaboserver.net.8333 > tom-Latitude-3570.39110: tcp 248
07:44:16.346320 IP tom-Latitude-3570.39110 > vmi195435.contaboserver.net.8333: tcp 0
07:44:16.346323 IP vmi195435.contaboserver.net.8333 > tom-Latitude-3570.39110: tcp 24
07:44:16.346325 IP tom-Latitude-3570.39110 > vmi195435.contaboserver.net.8333: tcp 0
07:44:16.346329 IP vmi195435.contaboserver.net.8333 > tom-Latitude-3570.39110: tcp 248
07:44:16.346331 IP tom-Latitude-3570.39110 > vmi195435.contaboserver.net.8333: tcp 0
07:44:16.346335 IP vmi195435.contaboserver.net.8333 > tom-Latitude-3570.39110: tcp 24
07:44:16.346337 IP tom-Latitude-3570.39110 > vmi195435.contaboserver.net.8333: tcp 0
07:44:16.346343 IP vmi195435.contaboserver.net.8333 > tom-Latitude-3570.39110: tcp 189
07:44:16.346345 IP vmi195435.contaboserver.net.8333 > tom-Latitude-3570.39110: tcp 24
07:44:16.346348 IP vmi195435.contaboserver.net.8333 > tom-Latitude-3570.39110: tcp 225
07:44:16.346352 IP tom-Latitude-3570.39110 > vmi195435.contaboserver.net.8333: tcp 0
07:44:16.346359 IP tom-Latitude-3570.39110 > vmi195435.contaboserver.net.8333: tcp 0
07:44:16.346361 IP tom-Latitude-3570.39110 > vmi195435.contaboserver.net.8333: tcp 0
07:44:16.375911 IP bb42-60-217-183.singnet.com.sg.8333 > tom-Latitude-3570.60470: tcp 24
07:44:16.375931 IP bb42-60-217-183.singnet.com.sg.8333 > tom-Latitude-3570.60470: tcp 1261
07:44:16.376024 IP tom-Latitude-3570.60470 > bb42-60-217-183.singnet.com.sg.8333: tcp 0
07:44:16.376458 IP tom-Latitude-3570.60470 > bb42-60-217-183.singnet.com.sg.8333: tcp 24
07:44:16.377494 IP tom-Latitude-3570.60470 > bb42-60-217-183.singnet.com.sg.8333: tcp 145
07:44:16.415977 IP bb42-60-217-183.singnet.com.sg.8333 > tom-Latitude-3570.60470: tcp 0
07:44:16.415992 IP bb42-60-217-183.singnet.com.sg.8333 > tom-Latitude-3570.60470: tcp 0
07:44:16.422513 IP vmi195435.contaboserver.net.8333 > tom-Latitude-3570.39110: tcp 1448
07:44:16.422531 IP tom-Latitude-3570.39110 > vmi195435.contaboserver.net.8333: tcp 0
07:44:16.425850 IP vmi195435.contaboserver.net.8333 > tom-Latitude-3570.39110: tcp 1319
07:44:16.425864 IP tom-Latitude-3570.39110 > vmi195435.contaboserver.net.8333: tcp 0
07:44:16.527672 IP tom-Latitude-3570.39110 > vmi195435.contaboserver.net.8333: tcp 24
07:44:16.528811 IP tom-Latitude-3570.39110 > vmi195435.contaboserver.net.8333: tcp 37
07:44:16.566694 IP vmi195435.contaboserver.net.8333 > tom-Latitude-3570.39110: tcp 0
07:44:16.570706 IP vmi195435.contaboserver.net.8333 > tom-Latitude-3570.39110: tcp 0
07:44:16.628110 IP tom-Latitude-3570.42516 > 2.56.9.15.8333: tcp 24
07:44:16.629095 IP tom-Latitude-3570.42516 > 2.56.9.15.8333: tcp 829
07:44:16.658542 IP 2.56.9.15.8333 > tom-Latitude-3570.42516: tcp 0
07:44:16.674000 IP 2.56.9.15.8333 > tom-Latitude-3570.42516: tcp 0
07:44:16.828880 IP tom-Latitude-3570.56714 > ns3113832.ip-54-38-177.eu.8333: tcp 24
07:44:16.830965 IP tom-Latitude-3570.56714 > ns3113832.ip-54-38-177.eu.8333: tcp 829
07:44:16.831735 IP bb42-60-217-183.singnet.com.sg.8333 > tom-Latitude-3570.60470: tcp 24
07:44:16.831757 IP bb42-60-217-183.singnet.com.sg.8333 > tom-Latitude-3570.60470: tcp 283
07:44:16.831761 IP bb42-60-217-183.singnet.com.sg.8333 > tom-Latitude-3570.60470: tcp 24
07:44:16.831764 IP bb42-60-217-183.singnet.com.sg.8333 > tom-Latitude-3570.60470: tcp 226
07:44:16.831784 IP bb42-60-217-183.singnet.com.sg.8333 > tom-Latitude-3570.60470: tcp 24
07:44:16.831786 IP bb42-60-217-183.singnet.com.sg.8333 > tom-Latitude-3570.60470: tcp 225
07:44:16.831789 IP bb42-60-217-183.singnet.com.sg.8333 > tom-Latitude-3570.60470: tcp 24
07:44:16.831792 IP bb42-60-217-183.singnet.com.sg.8333 > tom-Latitude-3570.60470: tcp 226
07:44:16.831794 IP 167.99.216.145.8333 > tom-Latitude-3570.57976: tcp 24
07:44:16.831798 IP 167.99.216.145.8333 > tom-Latitude-3570.57976: tcp 217
07:44:16.831851 IP tom-Latitude-3570.57976 > 167.99.216.145.8333: tcp 0
07:44:16.831884 IP tom-Latitude-3570.60470 > bb42-60-217-183.singnet.com.sg.8333: tcp 0
07:44:16.867278 IP ns3113832.ip-54-38-177.eu.8333 > tom-Latitude-3570.56714: tcp 0
07:44:16.933523 IP tom-Latitude-3570.57976 > 167.99.216.145.8333: tcp 24
07:44:16.952323 IP tom-Latitude-3570.57976 > 167.99.216.145.8333: tcp 505
07:44:16.979353 IP 167.99.216.145.8333 > tom-Latitude-3570.57976: tcp 0
07:44:17.006796 IP 167.99.216.145.8333 > tom-Latitude-3570.57976: tcp 0
07:44:17.006809 IP c-185-45-236-223.customer.ggaweb.ch.8333 > tom-Latitude-3570.49070: tcp 24
07:44:17.006843 IP tom-Latitude-3570.49070 > c-185-45-236-223.customer.ggaweb.ch.8333: tcp 0
07:44:17.015014 IP c-185-45-236-223.customer.ggaweb.ch.8333 > tom-Latitude-3570.49070: tcp 1009
07:44:17.015038 IP tom-Latitude-3570.49070 > c-185-45-236-223.customer.ggaweb.ch.8333: tcp 0
07:44:17.015523 IP tom-Latitude-3570.49070 > c-185-45-236-223.customer.ggaweb.ch.8333: tcp 24
07:44:17.031393 IP tom-Latitude-3570.49070 > c-185-45-236-223.customer.ggaweb.ch.8333: tcp 361
07:44:17.057849 IP c-185-45-236-223.customer.ggaweb.ch.8333 > tom-Latitude-3570.49070: tcp 0
07:44:17.065825 IP c-185-45-236-223.customer.ggaweb.ch.8333 > tom-Latitude-3570.49070: tcp 0
07:44:17.150216 IP c-185-45-236-223.customer.ggaweb.ch.8333 > tom-Latitude-3570.49070: tcp 24
07:44:17.150241 IP c-185-45-236-223.customer.ggaweb.ch.8333 > tom-Latitude-3570.49070: tcp 1382
07:44:17.150330 IP tom-Latitude-3570.49070 > c-185-45-236-223.customer.ggaweb.ch.8333: tcp 0
07:44:17.150768 IP c-185-45-236-223.customer.ggaweb.ch.8333 > tom-Latitude-3570.49070: tcp 66
07:44:17.150800 IP c-185-45-236-223.customer.ggaweb.ch.8333 > tom-Latitude-3570.49070: tcp 103
07:44:17.150865 IP tom-Latitude-3570.49070 > c-185-45-236-223.customer.ggaweb.ch.8333: tcp 0
07:44:17.153398 IP c-185-45-236-223.customer.ggaweb.ch.8333 > tom-Latitude-3570.49070: tcp 922
07:44:17.154772 IP c-185-45-236-223.customer.ggaweb.ch.8333 > tom-Latitude-3570.49070: tcp 558
07:44:17.154887 IP tom-Latitude-3570.49070 > c-185-45-236-223.customer.ggaweb.ch.8333: tcp 0
07:44:17.456642 IP tom-Latitude-3570.46284 > static-87-75-105-186.vodafonexdsl.co.uk.8333: tcp 24
07:44:17.486745 IP tom-Latitude-3570.46284 > static-87-75-105-186.vodafonexdsl.co.uk.8333: tcp 1009
07:44:17.534651 IP static-87-75-105-186.vodafonexdsl.co.uk.8333 > tom-Latitude-3570.46284: tcp 0
07:44:17.758013 IP tom-Latitude-3570.60470 > bb42-60-217-183.singnet.com.sg.8333: tcp 24
07:44:17.761561 IP tom-Latitude-3570.60470 > bb42-60-217-183.singnet.com.sg.8333: tcp 397
07:44:17.798224 IP bb42-60-217-183.singnet.com.sg.8333 > tom-Latitude-3570.60470: tcp 0
07:44:17.798881 IP bb42-60-217-183.singnet.com.sg.8333 > tom-Latitude-3570.60470: tcp 0
07:44:17.813166 IP bb42-60-217-183.singnet.com.sg.8333 > tom-Latitude-3570.60470: tcp 24
07:44:17.813187 IP bb42-60-217-183.singnet.com.sg.8333 > tom-Latitude-3570.60470: tcp 685
07:44:17.813278 IP tom-Latitude-3570.60470 > bb42-60-217-183.singnet.com.sg.8333: tcp 0
07:44:17.813613 IP tom-Latitude-3570.60470 > bb42-60-217-183.singnet.com.sg.8333: tcp 24
07:44:17.814733 IP tom-Latitude-3570.60470 > bb42-60-217-183.singnet.com.sg.8333: tcp 289
07:44:17.868941 IP bb42-60-217-183.singnet.com.sg.8333 > tom-Latitude-3570.60470: tcp 0
07:44:17.913885 IP tom-Latitude-3570.57976 > 167.99.216.145.8333: tcp 24
07:44:17.914992 IP tom-Latitude-3570.57976 > 167.99.216.145.8333: tcp 361
07:44:17.948841 IP 167.99.216.145.8333 > tom-Latitude-3570.57976: tcp 0
07:44:17.957870 IP 167.99.216.145.8333 > tom-Latitude-3570.57976: tcp 0
07:44:18.031535 IP ns3113832.ip-54-38-177.eu.8333 > tom-Latitude-3570.56714: tcp 24
07:44:18.031557 IP ns3113832.ip-54-38-177.eu.8333 > tom-Latitude-3570.56714: tcp 1081
07:44:18.031647 IP tom-Latitude-3570.56714 > ns3113832.ip-54-38-177.eu.8333: tcp 0
07:44:18.032098 IP tom-Latitude-3570.56714 > ns3113832.ip-54-38-177.eu.8333: tcp 24
07:44:18.033378 IP tom-Latitude-3570.56714 > ns3113832.ip-54-38-177.eu.8333: tcp 289
07:44:18.050019 IP vmi195435.contaboserver.net.8333 > tom-Latitude-3570.39110: tcp 24
07:44:18.050030 IP tom-Latitude-3570.39110 > vmi195435.contaboserver.net.8333: tcp 0
07:44:18.050114 IP vmi195435.contaboserver.net.8333 > tom-Latitude-3570.39110: tcp 1225
07:44:18.050121 IP tom-Latitude-3570.39110 > vmi195435.contaboserver.net.8333: tcp 0
07:44:18.050460 IP tom-Latitude-3570.39110 > vmi195435.contaboserver.net.8333: tcp 24
07:44:18.052129 IP tom-Latitude-3570.39110 > vmi195435.contaboserver.net.8333: tcp 181
07:44:18.068825 IP ns3113832.ip-54-38-177.eu.8333 > tom-Latitude-3570.56714: tcp 0
07:44:18.086056 IP vmi195435.contaboserver.net.8333 > tom-Latitude-3570.39110: tcp 0
07:44:18.086061 IP vmi195435.contaboserver.net.8333 > tom-Latitude-3570.39110: tcp 0
07:44:18.129916 IP ns3113832.ip-54-38-177.eu.8333 > tom-Latitude-3570.56714: tcp 24
07:44:18.129923 IP ns3113832.ip-54-38-177.eu.8333 > tom-Latitude-3570.56714: tcp 224
07:44:18.129926 IP ns3113832.ip-54-38-177.eu.8333 > tom-Latitude-3570.56714: tcp 24
07:44:18.129929 IP ns3113832.ip-54-38-177.eu.8333 > tom-Latitude-3570.56714: tcp 283
07:44:18.129930 IP ns3113832.ip-54-38-177.eu.8333 > tom-Latitude-3570.56714: tcp 24
07:44:18.129931 IP tom-Latitude-3570.56714 > ns3113832.ip-54-38-177.eu.8333: tcp 0
07:44:18.129935 IP ns3113832.ip-54-38-177.eu.8333 > tom-Latitude-3570.56714: tcp 283
07:44:18.129936 IP ns3113832.ip-54-38-177.eu.8333 > tom-Latitude-3570.56714: tcp 24
07:44:18.129970 IP tom-Latitude-3570.56714 > ns3113832.ip-54-38-177.eu.8333: tcp 0
07:44:18.130041 IP ns3113832.ip-54-38-177.eu.8333 > tom-Latitude-3570.56714: tcp 284
07:44:18.130048 IP ns3113832.ip-54-38-177.eu.8333 > tom-Latitude-3570.56714: tcp 24
07:44:18.130052 IP ns3113832.ip-54-38-177.eu.8333 > tom-Latitude-3570.56714: tcp 284
07:44:18.130053 IP tom-Latitude-3570.56714 > ns3113832.ip-54-38-177.eu.8333: tcp 0
07:44:18.164967 IP vmi195435.contaboserver.net.8333 > tom-Latitude-3570.39110: tcp 24
07:44:18.165887 IP vmi195435.contaboserver.net.8333 > tom-Latitude-3570.39110: tcp 592
07:44:18.165894 IP vmi195435.contaboserver.net.8333 > tom-Latitude-3570.39110: tcp 24
07:44:18.165897 IP vmi195435.contaboserver.net.8333 > tom-Latitude-3570.39110: tcp 249
07:44:18.165898 IP vmi195435.contaboserver.net.8333 > tom-Latitude-3570.39110: tcp 24
07:44:18.165901 IP vmi195435.contaboserver.net.8333 > tom-Latitude-3570.39110: tcp 283
07:44:18.165902 IP vmi195435.contaboserver.net.8333 > tom-Latitude-3570.39110: tcp 24
07:44:18.165906 IP tom-Latitude-3570.39110 > vmi195435.contaboserver.net.8333: tcp 0
07:44:18.165907 IP vmi195435.contaboserver.net.8333 > tom-Latitude-3570.39110: tcp 283
07:44:18.165908 IP vmi195435.contaboserver.net.8333 > tom-Latitude-3570.39110: tcp 24
07:44:18.165912 IP vmi195435.contaboserver.net.8333 > tom-Latitude-3570.39110: tcp 284
07:44:18.165958 IP tom-Latitude-3570.39110 > vmi195435.contaboserver.net.8333: tcp 0
07:44:18.166804 IP tom-Latitude-3570.57976 > 167.99.216.145.8333: tcp 24
07:44:18.167797 IP tom-Latitude-3570.57976 > 167.99.216.145.8333: tcp 217
07:44:18.171907 IP tom-Latitude-3570.56714 > ns3113832.ip-54-38-177.eu.8333: tcp 0
07:44:18.181546 IP ns3113832.ip-54-38-177.eu.8333 > tom-Latitude-3570.56714: tcp 924
07:44:18.181570 IP tom-Latitude-3570.56714 > ns3113832.ip-54-38-177.eu.8333: tcp 0
07:44:18.201928 IP 167.99.216.145.8333 > tom-Latitude-3570.57976: tcp 0
07:44:18.202500 IP 167.99.216.145.8333 > tom-Latitude-3570.57976: tcp 0
07:44:18.229628 IP bb42-60-217-183.singnet.com.sg.8333 > tom-Latitude-3570.60470: tcp 24
07:44:18.236722 IP bb42-60-217-183.singnet.com.sg.8333 > tom-Latitude-3570.60470: tcp 284
07:44:18.236741 IP bb42-60-217-183.singnet.com.sg.8333 > tom-Latitude-3570.60470: tcp 24
07:44:18.236744 IP bb42-60-217-183.singnet.com.sg.8333 > tom-Latitude-3570.60470: tcp 283
07:44:18.236747 IP bb42-60-217-183.singnet.com.sg.8333 > tom-Latitude-3570.60470: tcp 24
07:44:18.236749 IP bb42-60-217-183.singnet.com.sg.8333 > tom-Latitude-3570.60470: tcp 283
07:44:18.236769 IP bb42-60-217-183.singnet.com.sg.8333 > tom-Latitude-3570.60470: tcp 24
07:44:18.236771 IP bb42-60-217-183.singnet.com.sg.8333 > tom-Latitude-3570.60470: tcp 283
07:44:18.236773 IP bb42-60-217-183.singnet.com.sg.8333 > tom-Latitude-3570.60470: tcp 24
07:44:18.236838 IP tom-Latitude-3570.60470 > bb42-60-217-183.singnet.com.sg.8333: tcp 0
07:44:18.236919 IP bb42-60-217-183.singnet.com.sg.8333 > tom-Latitude-3570.60470: tcp 284
07:44:18.236945 IP bb42-60-217-183.singnet.com.sg.8333 > tom-Latitude-3570.60470: tcp 24
07:44:18.236950 IP bb42-60-217-183.singnet.com.sg.8333 > tom-Latitude-3570.60470: tcp 284
07:44:18.236953 IP bb42-60-217-183.singnet.com.sg.8333 > tom-Latitude-3570.60470: tcp 24
07:44:18.236976 IP bb42-60-217-183.singnet.com.sg.8333 > tom-Latitude-3570.60470: tcp 284
07:44:18.237009 IP bb42-60-217-183.singnet.com.sg.8333 > tom-Latitude-3570.60470: tcp 24
07:44:18.237017 IP bb42-60-217-183.singnet.com.sg.8333 > tom-Latitude-3570.60470: tcp 284
07:44:18.237043 IP tom-Latitude-3570.60470 > bb42-60-217-183.singnet.com.sg.8333: tcp 0
07:44:18.339629 IP tom-Latitude-3570.60988 > 81.198.101.144.8333: tcp 24
07:44:18.339650 IP tom-Latitude-3570.60988 > 81.198.101.144.8333: tcp 1261
07:44:18.368615 IP 81.198.101.144.8333 > tom-Latitude-3570.60988: tcp 0
07:44:18.386682 IP 81.198.101.144.8333 > tom-Latitude-3570.60988: tcp 0
07:44:18.466626 IP 81.198.101.144.8333 > tom-Latitude-3570.60988: tcp 24
07:44:18.467173 IP 81.198.101.144.8333 > tom-Latitude-3570.60988: tcp 37
07:44:18.467301 IP tom-Latitude-3570.60988 > 81.198.101.144.8333: tcp 0
07:44:18.467436 IP tom-Latitude-3570.60988 > 81.198.101.144.8333: tcp 24
07:44:18.469089 IP tom-Latitude-3570.60988 > 81.198.101.144.8333: tcp 283
07:44:18.505687 IP 81.198.101.144.8333 > tom-Latitude-3570.60988: tcp 0
07:44:18.505701 IP 81.198.101.144.8333 > tom-Latitude-3570.60988: tcp 0
07:44:18.567926 IP tom-Latitude-3570.39110 > vmi195435.contaboserver.net.8333: tcp 24
07:44:18.568896 IP tom-Latitude-3570.39110 > vmi195435.contaboserver.net.8333: tcp 37
07:44:18.599621 IP vmi195435.contaboserver.net.8333 > tom-Latitude-3570.39110: tcp 0
07:44:18.610217 IP vmi195435.contaboserver.net.8333 > tom-Latitude-3570.39110: tcp 0
07:44:19.098692 IP 2.56.9.15.8333 > tom-Latitude-3570.42516: tcp 24
07:44:19.099518 IP 2.56.9.15.8333 > tom-Latitude-3570.42516: tcp 1261
07:44:19.099649 IP tom-Latitude-3570.42516 > 2.56.9.15.8333: tcp 0
07:44:19.100063 IP tom-Latitude-3570.42516 > 2.56.9.15.8333: tcp 24
07:44:19.101334 IP tom-Latitude-3570.42516 > 2.56.9.15.8333: tcp 37
07:44:19.137408 IP 2.56.9.15.8333 > tom-Latitude-3570.42516: tcp 0
07:44:19.137416 IP 2.56.9.15.8333 > tom-Latitude-3570.42516: tcp 0
07:44:19.231436 IP 2.56.9.15.8333 > tom-Latitude-3570.42516: tcp 24
07:44:19.234710 IP 2.56.9.15.8333 > tom-Latitude-3570.42516: tcp 404
07:44:19.234726 IP tom-Latitude-3570.42516 > 2.56.9.15.8333: tcp 0
07:44:19.636496 IP tom-Latitude-3570.42516 > 2.56.9.15.8333: tcp 24
07:44:19.638636 IP tom-Latitude-3570.42516 > 2.56.9.15.8333: tcp 37
07:44:19.686387 IP 81.198.101.144.8333 > tom-Latitude-3570.60988: tcp 24
07:44:19.686408 IP 81.198.101.144.8333 > tom-Latitude-3570.60988: tcp 1261
07:44:19.686520 IP tom-Latitude-3570.60988 > 81.198.101.144.8333: tcp 0
07:44:19.686946 IP tom-Latitude-3570.60988 > 81.198.101.144.8333: tcp 24
07:44:19.687953 IP tom-Latitude-3570.60988 > 81.198.101.144.8333: tcp 109
07:44:19.689230 IP 2.56.9.15.8333 > tom-Latitude-3570.42516: tcp 0
07:44:19.697027 IP 2.56.9.15.8333 > tom-Latitude-3570.42516: tcp 0
07:44:19.708333 IP 81.198.101.144.8333 > tom-Latitude-3570.60988: tcp 0
07:44:19.722066 IP 81.198.101.144.8333 > tom-Latitude-3570.60988: tcp 0
07:44:19.792415 IP 2.56.9.15.8333 > tom-Latitude-3570.42516: tcp 325
07:44:19.792421 IP tom-Latitude-3570.42516 > 2.56.9.15.8333: tcp 0
07:44:19.859462 IP 81.198.101.144.8333 > tom-Latitude-3570.60988: tcp 24
07:44:19.859482 IP 81.198.101.144.8333 > tom-Latitude-3570.60988: tcp 406
07:44:19.859488 IP 81.198.101.144.8333 > tom-Latitude-3570.60988: tcp 24
07:44:19.859491 IP 81.198.101.144.8333 > tom-Latitude-3570.60988: tcp 418
07:44:19.859511 IP 81.198.101.144.8333 > tom-Latitude-3570.60988: tcp 24
07:44:19.859543 IP 81.198.101.144.8333 > tom-Latitude-3570.60988: tcp 836
07:44:19.859579 IP tom-Latitude-3570.60988 > 81.198.101.144.8333: tcp 0
07:44:19.860489 IP tom-Latitude-3570.42516 > 2.56.9.15.8333: tcp 24
07:44:19.864004 IP tom-Latitude-3570.42516 > 2.56.9.15.8333: tcp 37
07:44:19.865937 IP 2.56.9.15.8333 > tom-Latitude-3570.42516: tcp 325
07:44:19.865953 IP tom-Latitude-3570.42516 > 2.56.9.15.8333: tcp 0
07:44:19.897307 IP 2.56.9.15.8333 > tom-Latitude-3570.42516: tcp 0
07:44:19.898194 IP 2.56.9.15.8333 > tom-Latitude-3570.42516: tcp 0
07:44:19.906217 IP 2.56.9.15.8333 > tom-Latitude-3570.42516: tcp 24
07:44:19.906242 IP tom-Latitude-3570.42516 > 2.56.9.15.8333: tcp 0
07:44:19.906598 IP tom-Latitude-3570.42516 > 2.56.9.15.8333: tcp 24
07:44:19.907711 IP tom-Latitude-3570.42516 > 2.56.9.15.8333: tcp 181
07:44:19.941394 IP 2.56.9.15.8333 > tom-Latitude-3570.42516: tcp 0
07:44:19.971294 IP bb42-60-217-183.singnet.com.sg.8333 > tom-Latitude-3570.60470: tcp 24
07:44:19.971314 IP bb42-60-217-183.singnet.com.sg.8333 > tom-Latitude-3570.60470: tcp 721
07:44:19.971406 IP tom-Latitude-3570.60470 > bb42-60-217-183.singnet.com.sg.8333: tcp 0
07:44:20.032419 IP 2.56.9.15.8333 > tom-Latitude-3570.42516: tcp 24
07:44:20.034434 IP 2.56.9.15.8333 > tom-Latitude-3570.42516: tcp 521
07:44:20.034441 IP 2.56.9.15.8333 > tom-Latitude-3570.42516: tcp 24
07:44:20.034453 IP tom-Latitude-3570.42516 > 2.56.9.15.8333: tcp 0
07:44:20.034588 IP 2.56.9.15.8333 > tom-Latitude-3570.42516: tcp 225
07:44:20.034595 IP 2.56.9.15.8333 > tom-Latitude-3570.42516: tcp 24
07:44:20.034599 IP 2.56.9.15.8333 > tom-Latitude-3570.42516: tcp 225
07:44:20.034601 IP 2.56.9.15.8333 > tom-Latitude-3570.42516: tcp 24
07:44:20.034604 IP tom-Latitude-3570.42516 > 2.56.9.15.8333: tcp 0
07:44:20.035149 IP 2.56.9.15.8333 > tom-Latitude-3570.42516: tcp 226
07:44:20.035155 IP 2.56.9.15.8333 > tom-Latitude-3570.42516: tcp 24
07:44:20.035159 IP 2.56.9.15.8333 > tom-Latitude-3570.42516: tcp 226
07:44:20.035165 IP tom-Latitude-3570.42516 > 2.56.9.15.8333: tcp 0
07:44:20.337208 IP tom-Latitude-3570.49070 > c-185-45-236-223.customer.ggaweb.ch.8333: tcp 24
07:44:20.337228 IP tom-Latitude-3570.49070 > c-185-45-236-223.customer.ggaweb.ch.8333: tcp 1081
07:44:20.341010 IP 81.198.101.144.8333 > tom-Latitude-3570.60988: tcp 24
07:44:20.341030 IP 81.198.101.144.8333 > tom-Latitude-3570.60988: tcp 8
07:44:20.341120 IP tom-Latitude-3570.60988 > 81.198.101.144.8333: tcp 0
07:44:20.341250 IP tom-Latitude-3570.60988 > 81.198.101.144.8333: tcp 24
07:44:20.342960 IP tom-Latitude-3570.60988 > 81.198.101.144.8333: tcp 8
07:44:20.375779 IP c-185-45-236-223.customer.ggaweb.ch.8333 > tom-Latitude-3570.49070: tcp 0
07:44:20.379359 IP c-185-45-236-223.customer.ggaweb.ch.8333 > tom-Latitude-3570.49070: tcp 0
07:44:20.379967 IP 81.198.101.144.8333 > tom-Latitude-3570.60988: tcp 0
07:44:20.379981 IP 81.198.101.144.8333 > tom-Latitude-3570.60988: tcp 0
07:44:20.542077 IP tom-Latitude-3570.39110 > vmi195435.contaboserver.net.8333: tcp 24
07:44:20.544334 IP tom-Latitude-3570.39110 > vmi195435.contaboserver.net.8333: tcp 325
07:44:20.569700 IP vmi195435.contaboserver.net.8333 > tom-Latitude-3570.39110: tcp 0
07:44:20.575821 IP vmi195435.contaboserver.net.8333 > tom-Latitude-3570.39110: tcp 0
07:44:20.943668 IP tom-Latitude-3570.46284 > static-87-75-105-186.vodafonexdsl.co.uk.8333: tcp 24
07:44:20.943704 IP tom-Latitude-3570.46284 > static-87-75-105-186.vodafonexdsl.co.uk.8333: tcp 1081
07:44:21.035063 IP static-87-75-105-186.vodafonexdsl.co.uk.8333 > tom-Latitude-3570.46284: tcp 0
07:44:21.044116 IP tom-Latitude-3570.60470 > bb42-60-217-183.singnet.com.sg.8333: tcp 24
07:44:21.045015 IP tom-Latitude-3570.60470 > bb42-60-217-183.singnet.com.sg.8333: tcp 73
07:44:21.086620 IP bb42-60-217-183.singnet.com.sg.8333 > tom-Latitude-3570.60470: tcp 0
07:44:21.646092 IP tom-Latitude-3570.60988 > 81.198.101.144.8333: tcp 24
07:44:21.648007 IP tom-Latitude-3570.60988 > 81.198.101.144.8333: tcp 181
07:44:21.682179 IP 81.198.101.144.8333 > tom-Latitude-3570.60988: tcp 0
07:44:21.686739 IP 81.198.101.144.8333 > tom-Latitude-3570.60988: tcp 0
07:44:21.776376 IP 81.198.101.144.8333 > tom-Latitude-3570.60988: tcp 24
07:44:21.776931 IP 81.198.101.144.8333 > tom-Latitude-3570.60988: tcp 73
07:44:21.777059 IP tom-Latitude-3570.60988 > 81.198.101.144.8333: tcp 0
07:44:21.777198 IP tom-Latitude-3570.60988 > 81.198.101.144.8333: tcp 24
07:44:21.777417 IP tom-Latitude-3570.56714 > ns3113832.ip-54-38-177.eu.8333: tcp 24
07:44:21.780312 IP tom-Latitude-3570.60988 > 81.198.101.144.8333: tcp 770
07:44:21.780969 IP tom-Latitude-3570.56714 > ns3113832.ip-54-38-177.eu.8333: tcp 505
07:44:21.819481 IP 81.198.101.144.8333 > tom-Latitude-3570.60988: tcp 0
07:44:21.825030 IP 81.198.101.144.8333 > tom-Latitude-3570.60988: tcp 0
07:44:21.825731 IP ns3113832.ip-54-38-177.eu.8333 > tom-Latitude-3570.56714: tcp 0
07:44:21.926019 IP 2.56.9.15.8333 > tom-Latitude-3570.42516: tcp 24
07:44:21.967907 IP tom-Latitude-3570.42516 > 2.56.9.15.8333: tcp 0
07:44:22.155823 IP 2.56.9.15.8333 > tom-Latitude-3570.42516: tcp 1045
07:44:22.155847 IP tom-Latitude-3570.42516 > 2.56.9.15.8333: tcp 0
07:44:22.155899 IP 2.56.9.15.8333 > tom-Latitude-3570.42516: tcp 1045
07:44:22.155905 IP tom-Latitude-3570.42516 > 2.56.9.15.8333: tcp 0
07:44:22.156481 IP tom-Latitude-3570.42516 > 2.56.9.15.8333: tcp 24
07:44:22.156497 IP tom-Latitude-3570.42516 > 2.56.9.15.8333: tcp 1045
07:44:22.199083 IP 2.56.9.15.8333 > tom-Latitude-3570.42516: tcp 0
07:44:22.294317 IP 2.56.9.15.8333 > tom-Latitude-3570.42516: tcp 24
07:44:22.294325 IP 2.56.9.15.8333 > tom-Latitude-3570.42516: tcp 404
07:44:22.294328 IP 2.56.9.15.8333 > tom-Latitude-3570.42516: tcp 24
07:44:22.294352 IP tom-Latitude-3570.42516 > 2.56.9.15.8333: tcp 0
07:44:22.294504 IP 2.56.9.15.8333 > tom-Latitude-3570.42516: tcp 404
07:44:22.294512 IP 2.56.9.15.8333 > tom-Latitude-3570.42516: tcp 24
07:44:22.294515 IP 2.56.9.15.8333 > tom-Latitude-3570.42516: tcp 575
07:44:22.294520 IP tom-Latitude-3570.42516 > 2.56.9.15.8333: tcp 0
07:44:22.297277 IP 2.56.9.15.8333 > tom-Latitude-3570.42516: tcp 24
07:44:22.297402 IP 2.56.9.15.8333 > tom-Latitude-3570.42516: tcp 248
07:44:22.297408 IP 2.56.9.15.8333 > tom-Latitude-3570.42516: tcp 24
07:44:22.297411 IP 2.56.9.15.8333 > tom-Latitude-3570.42516: tcp 223
07:44:22.297417 IP tom-Latitude-3570.42516 > 2.56.9.15.8333: tcp 0
07:44:22.389570 IP 2.56.9.15.8333 > tom-Latitude-3570.42516: tcp 1368
07:44:22.390313 IP 2.56.9.15.8333 > tom-Latitude-3570.42516: tcp 1368
07:44:22.390431 IP tom-Latitude-3570.42516 > 2.56.9.15.8333: tcp 0
07:44:22.392968 IP 2.56.9.15.8333 > tom-Latitude-3570.42516: tcp 1368
07:44:22.393987 IP 2.56.9.15.8333 > tom-Latitude-3570.42516: tcp 1368
07:44:22.394016 IP 2.56.9.15.8333 > tom-Latitude-3570.42516: tcp 1368
07:44:22.394022 IP 2.56.9.15.8333 > tom-Latitude-3570.42516: tcp 163
07:44:22.394061 IP tom-Latitude-3570.42516 > 2.56.9.15.8333: tcp 0
07:44:22.450821 IP 81.198.101.144.8333 > tom-Latitude-3570.60988: tcp 24
07:44:22.451585 IP 81.198.101.144.8333 > tom-Latitude-3570.60988: tcp 1189
07:44:22.451741 IP tom-Latitude-3570.60988 > 81.198.101.144.8333: tcp 0
07:44:22.452140 IP tom-Latitude-3570.60988 > 81.198.101.144.8333: tcp 24
07:44:22.453345 IP tom-Latitude-3570.60988 > 81.198.101.144.8333: tcp 145
07:44:22.493141 IP 81.198.101.144.8333 > tom-Latitude-3570.60988: tcp 0
07:44:22.493155 IP 81.198.101.144.8333 > tom-Latitude-3570.60988: tcp 0
07:44:22.591614 IP 81.198.101.144.8333 > tom-Latitude-3570.60988: tcp 24
07:44:22.591634 IP 81.198.101.144.8333 > tom-Latitude-3570.60988: tcp 257
07:44:22.591638 IP 81.198.101.144.8333 > tom-Latitude-3570.60988: tcp 24
07:44:22.591642 IP 81.198.101.144.8333 > tom-Latitude-3570.60988: tcp 403
07:44:22.591644 IP 81.198.101.144.8333 > tom-Latitude-3570.60988: tcp 24
07:44:22.591646 IP 81.198.101.144.8333 > tom-Latitude-3570.60988: tcp 404
07:44:22.591749 IP tom-Latitude-3570.60988 > 81.198.101.144.8333: tcp 0
07:44:22.592612 IP 81.198.101.144.8333 > tom-Latitude-3570.60988: tcp 24
07:44:22.592629 IP 81.198.101.144.8333 > tom-Latitude-3570.60988: tcp 283
07:44:22.592702 IP tom-Latitude-3570.60988 > 81.198.101.144.8333: tcp 0
07:44:22.619836 IP vmi195435.contaboserver.net.8333 > tom-Latitude-3570.39110: tcp 24
07:44:22.619857 IP vmi195435.contaboserver.net.8333 > tom-Latitude-3570.39110: tcp 1261
07:44:22.619942 IP tom-Latitude-3570.39110 > vmi195435.contaboserver.net.8333: tcp 0
07:44:22.620362 IP tom-Latitude-3570.39110 > vmi195435.contaboserver.net.8333: tcp 24
07:44:22.621496 IP tom-Latitude-3570.39110 > vmi195435.contaboserver.net.8333: tcp 217
07:44:22.657591 IP vmi195435.contaboserver.net.8333 > tom-Latitude-3570.39110: tcp 0
07:44:22.658390 IP vmi195435.contaboserver.net.8333 > tom-Latitude-3570.39110: tcp 0
07:44:22.735197 IP vmi195435.contaboserver.net.8333 > tom-Latitude-3570.39110: tcp 24
07:44:22.736165 IP vmi195435.contaboserver.net.8333 > tom-Latitude-3570.39110: tcp 404
07:44:22.736183 IP vmi195435.contaboserver.net.8333 > tom-Latitude-3570.39110: tcp 24
07:44:22.736186 IP vmi195435.contaboserver.net.8333 > tom-Latitude-3570.39110: tcp 404
07:44:22.736189 IP vmi195435.contaboserver.net.8333 > tom-Latitude-3570.39110: tcp 24
07:44:22.736191 IP vmi195435.contaboserver.net.8333 > tom-Latitude-3570.39110: tcp 360
07:44:22.736212 IP vmi195435.contaboserver.net.8333 > tom-Latitude-3570.39110: tcp 24
07:44:22.736275 IP tom-Latitude-3570.39110 > vmi195435.contaboserver.net.8333: tcp 0
07:44:22.741122 IP vmi195435.contaboserver.net.8333 > tom-Latitude-3570.39110: tcp 256
07:44:22.741137 IP vmi195435.contaboserver.net.8333 > tom-Latitude-3570.39110: tcp 24
07:44:22.741140 IP vmi195435.contaboserver.net.8333 > tom-Latitude-3570.39110: tcp 283
07:44:22.741215 IP tom-Latitude-3570.39110 > vmi195435.contaboserver.net.8333: tcp 0
07:44:22.770658 IP static-87-75-105-186.vodafonexdsl.co.uk.8333 > tom-Latitude-3570.46284: tcp 24
07:44:22.776831 IP static-87-75-105-186.vodafonexdsl.co.uk.8333 > tom-Latitude-3570.46284: tcp 1261
07:44:22.776968 IP tom-Latitude-3570.46284 > static-87-75-105-186.vodafonexdsl.co.uk.8333: tcp 0
07:44:22.811924 IP vmi195435.contaboserver.net.8333 > tom-Latitude-3570.39110: tcp 307
07:44:22.855798 IP tom-Latitude-3570.39110 > vmi195435.contaboserver.net.8333: tcp 0
07:44:23.012831 IP tom-Latitude-3570.42516 > 2.56.9.15.8333: tcp 24
07:44:23.014754 IP tom-Latitude-3570.42516 > 2.56.9.15.8333: tcp 361
07:44:23.056321 IP 2.56.9.15.8333 > tom-Latitude-3570.42516: tcp 0
07:44:23.113438 IP tom-Latitude-3570.57976 > 167.99.216.145.8333: tcp 24
07:44:23.113458 IP tom-Latitude-3570.57976 > 167.99.216.145.8333: tcp 1261
07:44:23.113592 IP tom-Latitude-3570.46284 > static-87-75-105-186.vodafonexdsl.co.uk.8333: tcp 24
07:44:23.259539 IP 2.56.9.15.8333 > tom-Latitude-3570.42516: tcp 24
07:44:23.259559 IP 2.56.9.15.8333 > tom-Latitude-3570.42516: tcp 325
07:44:23.259564 IP 2.56.9.15.8333 > tom-Latitude-3570.42516: tcp 24
07:44:23.259566 IP 2.56.9.15.8333 > tom-Latitude-3570.42516: tcp 73
07:44:23.259652 IP tom-Latitude-3570.42516 > 2.56.9.15.8333: tcp 0
07:44:23.259912 IP tom-Latitude-3570.42516 > 2.56.9.15.8333: tcp 24
07:44:23.269647 IP tom-Latitude-3570.46284 > static-87-75-105-186.vodafonexdsl.co.uk.8333: tcp 145
07:44:23.270975 IP tom-Latitude-3570.42516 > 2.56.9.15.8333: tcp 624
07:44:23.273195 IP 2.56.9.15.8333 > tom-Latitude-3570.42516: tcp 73
07:44:23.273214 IP tom-Latitude-3570.42516 > 2.56.9.15.8333: tcp 0
07:44:23.307479 IP 167.99.216.145.8333 > tom-Latitude-3570.57976: tcp 0
07:44:23.315253 IP 167.99.216.145.8333 > tom-Latitude-3570.57976: tcp 0
07:44:23.315918 IP static-87-75-105-186.vodafonexdsl.co.uk.8333 > tom-Latitude-3570.46284: tcp 0
07:44:23.315923 IP 2.56.9.15.8333 > tom-Latitude-3570.42516: tcp 0
07:44:23.410365 IP 2.56.9.15.8333 > tom-Latitude-3570.42516: tcp 24
07:44:23.410385 IP tom-Latitude-3570.42516 > 2.56.9.15.8333: tcp 0
07:44:23.413615 IP 2.56.9.15.8333 > tom-Latitude-3570.42516: tcp 226
07:44:23.413639 IP tom-Latitude-3570.42516 > 2.56.9.15.8333: tcp 0
07:44:24.116545 IP tom-Latitude-3570.57976 > 167.99.216.145.8333: tcp 24
07:44:24.116566 IP tom-Latitude-3570.57976 > 167.99.216.145.8333: tcp 1045
07:44:24.283905 IP tom-Latitude-3570.57976 > 167.99.216.145.8333: tcp 1045
07:44:24.317270 IP tom-Latitude-3570.46284 > static-87-75-105-186.vodafonexdsl.co.uk.8333: tcp 24
07:44:24.351579 IP tom-Latitude-3570.46284 > static-87-75-105-186.vodafonexdsl.co.uk.8333: tcp 37
07:44:24.387351 IP 167.99.216.145.8333 > tom-Latitude-3570.57976: tcp 0
07:44:24.387368 IP static-87-75-105-186.vodafonexdsl.co.uk.8333 > tom-Latitude-3570.46284: tcp 0
07:44:24.718558 IP tom-Latitude-3570.60988 > 81.198.101.144.8333: tcp 24
07:44:24.719553 IP tom-Latitude-3570.60988 > 81.198.101.144.8333: tcp 253
07:44:24.770672 IP 81.198.101.144.8333 > tom-Latitude-3570.60988: tcp 0
07:44:24.776540 IP 81.198.101.144.8333 > tom-Latitude-3570.60988: tcp 0
07:44:24.919383 IP tom-Latitude-3570.39110 > vmi195435.contaboserver.net.8333: tcp 24
07:44:24.919610 IP tom-Latitude-3570.60470 > bb42-60-217-183.singnet.com.sg.8333: tcp 24
07:44:24.919617 IP tom-Latitude-3570.60470 > bb42-60-217-183.singnet.com.sg.8333: tcp 1261
07:44:24.921535 IP tom-Latitude-3570.39110 > vmi195435.contaboserver.net.8333: tcp 181
07:44:24.949108 IP vmi195435.contaboserver.net.8333 > tom-Latitude-3570.39110: tcp 0
07:44:24.956838 IP bb42-60-217-183.singnet.com.sg.8333 > tom-Latitude-3570.60470: tcp 0
07:44:24.959384 IP vmi195435.contaboserver.net.8333 > tom-Latitude-3570.39110: tcp 0
07:44:25.120543 IP tom-Latitude-3570.56714 > ns3113832.ip-54-38-177.eu.8333: tcp 24
07:44:25.120564 IP tom-Latitude-3570.56714 > ns3113832.ip-54-38-177.eu.8333: tcp 1261
07:44:25.198704 IP ns3113832.ip-54-38-177.eu.8333 > tom-Latitude-3570.56714: tcp 0
07:44:25.474052 IP 2.56.9.15.8333 > tom-Latitude-3570.42516: tcp 24
07:44:25.474070 IP tom-Latitude-3570.42516 > 2.56.9.15.8333: tcp 0
07:44:25.475163 IP 2.56.9.15.8333 > tom-Latitude-3570.42516: tcp 649
07:44:25.475187 IP tom-Latitude-3570.42516 > 2.56.9.15.8333: tcp 0
07:44:25.475221 IP c-185-45-236-223.customer.ggaweb.ch.8333 > tom-Latitude-3570.49070: tcp 1261
07:44:25.475226 IP tom-Latitude-3570.49070 > c-185-45-236-223.customer.ggaweb.ch.8333: tcp 0
07:44:25.475699 IP tom-Latitude-3570.42516 > 2.56.9.15.8333: tcp 24
07:44:25.478266 IP tom-Latitude-3570.42516 > 2.56.9.15.8333: tcp 649
07:44:25.508396 IP 2.56.9.15.8333 > tom-Latitude-3570.42516: tcp 649
07:44:25.508404 IP tom-Latitude-3570.42516 > 2.56.9.15.8333: tcp 0
07:44:25.521861 IP 2.56.9.15.8333 > tom-Latitude-3570.42516: tcp 0
07:44:25.535981 IP c-185-45-236-223.customer.ggaweb.ch.8333 > tom-Latitude-3570.49070: tcp 24
07:44:25.536013 IP tom-Latitude-3570.49070 > c-185-45-236-223.customer.ggaweb.ch.8333: tcp 0
07:44:25.617036 IP 2.56.9.15.8333 > tom-Latitude-3570.42516: tcp 24
07:44:25.617062 IP tom-Latitude-3570.42516 > 2.56.9.15.8333: tcp 0
07:44:25.617705 IP 2.56.9.15.8333 > tom-Latitude-3570.42516: tcp 405
07:44:25.617730 IP tom-Latitude-3570.42516 > 2.56.9.15.8333: tcp 0
07:44:25.617746 IP 2.56.9.15.8333 > tom-Latitude-3570.42516: tcp 24
07:44:25.617749 IP tom-Latitude-3570.42516 > 2.56.9.15.8333: tcp 0
07:44:25.620341 IP 2.56.9.15.8333 > tom-Latitude-3570.42516: tcp 225
07:44:25.620359 IP tom-Latitude-3570.42516 > 2.56.9.15.8333: tcp 0
07:44:25.620377 IP 2.56.9.15.8333 > tom-Latitude-3570.42516: tcp 24
07:44:25.620380 IP tom-Latitude-3570.42516 > 2.56.9.15.8333: tcp 0
07:44:25.620386 IP 2.56.9.15.8333 > tom-Latitude-3570.42516: tcp 225
07:44:25.620388 IP tom-Latitude-3570.42516 > 2.56.9.15.8333: tcp 0
07:44:25.620392 IP 2.56.9.15.8333 > tom-Latitude-3570.42516: tcp 24
07:44:25.620394 IP tom-Latitude-3570.42516 > 2.56.9.15.8333: tcp 0
07:44:25.625694 IP 2.56.9.15.8333 > tom-Latitude-3570.42516: tcp 371
07:44:25.625707 IP tom-Latitude-3570.42516 > 2.56.9.15.8333: tcp 0
07:44:25.625723 IP 2.56.9.15.8333 > tom-Latitude-3570.42516: tcp 24
07:44:25.625726 IP tom-Latitude-3570.42516 > 2.56.9.15.8333: tcp 0
07:44:25.625731 IP 2.56.9.15.8333 > tom-Latitude-3570.42516: tcp 371
07:44:25.625734 IP tom-Latitude-3570.42516 > 2.56.9.15.8333: tcp 0
07:44:25.711435 IP 2.56.9.15.8333 > tom-Latitude-3570.42516: tcp 1368
07:44:25.711452 IP tom-Latitude-3570.42516 > 2.56.9.15.8333: tcp 0
07:44:25.720318 IP 2.56.9.15.8333 > tom-Latitude-3570.42516: tcp 1368
07:44:25.720332 IP tom-Latitude-3570.42516 > 2.56.9.15.8333: tcp 0
07:44:25.721173 IP 2.56.9.15.8333 > tom-Latitude-3570.42516: tcp 973
07:44:25.721186 IP tom-Latitude-3570.42516 > 2.56.9.15.8333: tcp 0
07:44:26.190449 IP ns3113832.ip-54-38-177.eu.8333 > tom-Latitude-3570.56714: tcp 24
07:44:26.190474 IP tom-Latitude-3570.56714 > ns3113832.ip-54-38-177.eu.8333: tcp 0
07:44:26.190492 IP ns3113832.ip-54-38-177.eu.8333 > tom-Latitude-3570.56714: tcp 865
07:44:26.190497 IP tom-Latitude-3570.56714 > ns3113832.ip-54-38-177.eu.8333: tcp 0
07:44:26.190861 IP tom-Latitude-3570.56714 > ns3113832.ip-54-38-177.eu.8333: tcp 24
07:44:26.192473 IP tom-Latitude-3570.56714 > ns3113832.ip-54-38-177.eu.8333: tcp 37
07:44:26.198761 IP ns3113832.ip-54-38-177.eu.8333 > tom-Latitude-3570.56714: tcp 865
07:44:26.198780 IP tom-Latitude-3570.56714 > ns3113832.ip-54-38-177.eu.8333: tcp 0
07:44:26.211475 IP vmi195435.contaboserver.net.8333 > tom-Latitude-3570.39110: tcp 565
07:44:26.211500 IP tom-Latitude-3570.39110 > vmi195435.contaboserver.net.8333: tcp 0
07:44:26.226930 IP ns3113832.ip-54-38-177.eu.8333 > tom-Latitude-3570.56714: tcp 0
07:44:26.290269 IP ns3113832.ip-54-38-177.eu.8333 > tom-Latitude-3570.56714: tcp 24
07:44:26.290286 IP tom-Latitude-3570.56714 > ns3113832.ip-54-38-177.eu.8333: tcp 0
07:44:26.290307 IP ns3113832.ip-54-38-177.eu.8333 > tom-Latitude-3570.56714: tcp 521
07:44:26.290310 IP tom-Latitude-3570.56714 > ns3113832.ip-54-38-177.eu.8333: tcp 0
07:44:26.804776 IP 2.56.9.15.8333 > tom-Latitude-3570.42516: tcp 24
07:44:26.804794 IP tom-Latitude-3570.42516 > 2.56.9.15.8333: tcp 0
07:44:26.804812 IP 2.56.9.15.8333 > tom-Latitude-3570.42516: tcp 289
07:44:26.804816 IP tom-Latitude-3570.42516 > 2.56.9.15.8333: tcp 0
07:44:26.805210 IP tom-Latitude-3570.42516 > 2.56.9.15.8333: tcp 24
07:44:26.806915 IP tom-Latitude-3570.42516 > 2.56.9.15.8333: tcp 253
07:44:26.834625 IP 2.56.9.15.8333 > tom-Latitude-3570.42516: tcp 289
07:44:26.834644 IP tom-Latitude-3570.42516 > 2.56.9.15.8333: tcp 0
07:44:26.847108 IP 2.56.9.15.8333 > tom-Latitude-3570.42516: tcp 0
07:44:26.941403 IP 2.56.9.15.8333 > tom-Latitude-3570.42516: tcp 24
07:44:26.941428 IP tom-Latitude-3570.42516 > 2.56.9.15.8333: tcp 0
07:44:26.942320 IP 2.56.9.15.8333 > tom-Latitude-3570.42516: tcp 246
07:44:26.942344 IP tom-Latitude-3570.42516 > 2.56.9.15.8333: tcp 0
07:44:26.942374 IP 2.56.9.15.8333 > tom-Latitude-3570.42516: tcp 24
07:44:26.942377 IP tom-Latitude-3570.42516 > 2.56.9.15.8333: tcp 0
07:44:26.942381 IP 2.56.9.15.8333 > tom-Latitude-3570.42516: tcp 370
07:44:26.942384 IP tom-Latitude-3570.42516 > 2.56.9.15.8333: tcp 0
07:44:26.942387 IP 2.56.9.15.8333 > tom-Latitude-3570.42516: tcp 24
07:44:26.942389 IP tom-Latitude-3570.42516 > 2.56.9.15.8333: tcp 0
07:44:26.942398 IP 2.56.9.15.8333 > tom-Latitude-3570.42516: tcp 249
07:44:26.942402 IP tom-Latitude-3570.42516 > 2.56.9.15.8333: tcp 0
07:44:26.942405 IP 2.56.9.15.8333 > tom-Latitude-3570.42516: tcp 24
07:44:26.942408 IP tom-Latitude-3570.42516 > 2.56.9.15.8333: tcp 0
07:44:26.942411 IP 2.56.9.15.8333 > tom-Latitude-3570.42516: tcp 225
07:44:26.942415 IP tom-Latitude-3570.42516 > 2.56.9.15.8333: tcp 0
07:44:26.944533 IP 2.56.9.15.8333 > tom-Latitude-3570.42516: tcp 24
07:44:26.944551 IP tom-Latitude-3570.42516 > 2.56.9.15.8333: tcp 0
07:44:26.944569 IP 2.56.9.15.8333 > tom-Latitude-3570.42516: tcp 284
07:44:26.944571 IP tom-Latitude-3570.42516 > 2.56.9.15.8333: tcp 0
