15:30:02.164952 IP 172.214.77.34.bc.googleusercontent.com.8333 > tom-Latitude-3570.56244: tcp 24
15:30:02.164963 IP 172.214.77.34.bc.googleusercontent.com.8333 > tom-Latitude-3570.56244: tcp 325
15:30:02.165012 IP tom-Latitude-3570.56244 > 172.214.77.34.bc.googleusercontent.com.8333: tcp 0
15:30:02.165198 IP tom-Latitude-3570.56244 > 172.214.77.34.bc.googleusercontent.com.8333: tcp 24
15:30:02.165469 IP tom-Latitude-3570.56244 > 172.214.77.34.bc.googleusercontent.com.8333: tcp 73
15:30:02.256574 IP 172.214.77.34.bc.googleusercontent.com.8333 > tom-Latitude-3570.56244: tcp 0
15:30:02.256727 IP 172.214.77.34.bc.googleusercontent.com.8333 > tom-Latitude-3570.56244: tcp 0
15:30:02.322736 IP 172.214.77.34.bc.googleusercontent.com.8333 > tom-Latitude-3570.56244: tcp 24
15:30:02.322844 IP 172.214.77.34.bc.googleusercontent.com.8333 > tom-Latitude-3570.56244: tcp 223
15:30:02.322849 IP 172.214.77.34.bc.googleusercontent.com.8333 > tom-Latitude-3570.56244: tcp 24
15:30:02.322853 IP 172.214.77.34.bc.googleusercontent.com.8333 > tom-Latitude-3570.56244: tcp 371
15:30:02.322865 IP tom-Latitude-3570.56244 > 172.214.77.34.bc.googleusercontent.com.8333: tcp 0
15:30:02.322989 IP tom-Latitude-3570.47742 > 97-82-78-25.dhcp.leds.al.charter.com.8333: tcp 24
15:30:02.323340 IP tom-Latitude-3570.47742 > 97-82-78-25.dhcp.leds.al.charter.com.8333: tcp 253
15:30:02.380539 IP 97-82-78-25.dhcp.leds.al.charter.com.8333 > tom-Latitude-3570.47742: tcp 0
15:30:02.380552 IP 97-82-78-25.dhcp.leds.al.charter.com.8333 > tom-Latitude-3570.47742: tcp 0
15:30:02.724870 IP tom-Latitude-3570.34082 > host93-234-110-95.serverdedicati.aruba.it.8333: tcp 24
15:30:02.726564 IP tom-Latitude-3570.34082 > host93-234-110-95.serverdedicati.aruba.it.8333: tcp 793
15:30:02.758527 IP host93-234-110-95.serverdedicati.aruba.it.8333 > tom-Latitude-3570.34082: tcp 0
15:30:02.790551 IP host93-234-110-95.serverdedicati.aruba.it.8333 > tom-Latitude-3570.34082: tcp 0
15:30:04.322336 IP 172.214.77.34.bc.googleusercontent.com.8333 > tom-Latitude-3570.56244: tcp 24
15:30:04.326414 IP 172.214.77.34.bc.googleusercontent.com.8333 > tom-Latitude-3570.56244: tcp 613
15:30:04.326674 IP tom-Latitude-3570.56244 > 172.214.77.34.bc.googleusercontent.com.8333: tcp 0
15:30:04.328099 IP tom-Latitude-3570.56244 > 172.214.77.34.bc.googleusercontent.com.8333: tcp 24
15:30:04.328390 IP tom-Latitude-3570.56244 > 172.214.77.34.bc.googleusercontent.com.8333: tcp 613
15:30:04.428446 IP tom-Latitude-3570.56344 > 23.226.90.172.8333: tcp 24
15:30:04.428500 IP tom-Latitude-3570.33922 > pool-108-20-207-31.bstnma.fios.verizon.net.8333: tcp 24
15:30:04.428761 IP tom-Latitude-3570.33922 > pool-108-20-207-31.bstnma.fios.verizon.net.8333: tcp 73
15:30:04.428767 IP tom-Latitude-3570.56344 > 23.226.90.172.8333: tcp 73
15:30:04.434847 IP 172.214.77.34.bc.googleusercontent.com.8333 > tom-Latitude-3570.56244: tcp 0
15:30:04.434853 IP 172.214.77.34.bc.googleusercontent.com.8333 > tom-Latitude-3570.56244: tcp 0
15:30:04.478312 IP 23.226.90.172.8333 > tom-Latitude-3570.56344: tcp 0
15:30:04.478416 IP pool-108-20-207-31.bstnma.fios.verizon.net.8333 > tom-Latitude-3570.33922: tcp 0
15:30:04.483716 IP 23.226.90.172.8333 > tom-Latitude-3570.56344: tcp 0
15:30:04.483722 IP pool-108-20-207-31.bstnma.fios.verizon.net.8333 > tom-Latitude-3570.33922: tcp 0
15:30:04.494820 IP 172.214.77.34.bc.googleusercontent.com.8333 > tom-Latitude-3570.56244: tcp 24
15:30:04.494840 IP 172.214.77.34.bc.googleusercontent.com.8333 > tom-Latitude-3570.56244: tcp 405
15:30:04.494844 IP 172.214.77.34.bc.googleusercontent.com.8333 > tom-Latitude-3570.56244: tcp 24
15:30:04.494894 IP tom-Latitude-3570.56244 > 172.214.77.34.bc.googleusercontent.com.8333: tcp 0
15:30:04.508712 IP 172.214.77.34.bc.googleusercontent.com.8333 > tom-Latitude-3570.56244: tcp 402
15:30:04.508780 IP 172.214.77.34.bc.googleusercontent.com.8333 > tom-Latitude-3570.56244: tcp 24
15:30:04.508786 IP 172.214.77.34.bc.googleusercontent.com.8333 > tom-Latitude-3570.56244: tcp 297
15:30:04.508859 IP tom-Latitude-3570.56244 > 172.214.77.34.bc.googleusercontent.com.8333: tcp 0
15:30:04.511793 IP 172.214.77.34.bc.googleusercontent.com.8333 > tom-Latitude-3570.56244: tcp 24
15:30:04.512021 IP 172.214.77.34.bc.googleusercontent.com.8333 > tom-Latitude-3570.56244: tcp 224
15:30:04.512041 IP 172.214.77.34.bc.googleusercontent.com.8333 > tom-Latitude-3570.56244: tcp 24
15:30:04.512044 IP 172.214.77.34.bc.googleusercontent.com.8333 > tom-Latitude-3570.56244: tcp 191
15:30:04.512048 IP 172.214.77.34.bc.googleusercontent.com.8333 > tom-Latitude-3570.56244: tcp 24
15:30:04.512061 IP tom-Latitude-3570.56244 > 172.214.77.34.bc.googleusercontent.com.8333: tcp 0
15:30:04.515120 IP 172.214.77.34.bc.googleusercontent.com.8333 > tom-Latitude-3570.56244: tcp 402
15:30:04.515582 IP 172.214.77.34.bc.googleusercontent.com.8333 > tom-Latitude-3570.56244: tcp 24
15:30:04.515588 IP 172.214.77.34.bc.googleusercontent.com.8333 > tom-Latitude-3570.56244: tcp 403
15:30:04.515591 IP 172.214.77.34.bc.googleusercontent.com.8333 > tom-Latitude-3570.56244: tcp 24
15:30:04.515593 IP 172.214.77.34.bc.googleusercontent.com.8333 > tom-Latitude-3570.56244: tcp 372
15:30:04.515595 IP 172.214.77.34.bc.googleusercontent.com.8333 > tom-Latitude-3570.56244: tcp 24
15:30:04.515598 IP 172.214.77.34.bc.googleusercontent.com.8333 > tom-Latitude-3570.56244: tcp 225
15:30:04.515600 IP 172.214.77.34.bc.googleusercontent.com.8333 > tom-Latitude-3570.56244: tcp 24
15:30:04.515602 IP 172.214.77.34.bc.googleusercontent.com.8333 > tom-Latitude-3570.56244: tcp 226
15:30:04.515602 IP tom-Latitude-3570.56244 > 172.214.77.34.bc.googleusercontent.com.8333: tcp 0
15:30:04.515604 IP 172.214.77.34.bc.googleusercontent.com.8333 > tom-Latitude-3570.56244: tcp 24
15:30:04.515606 IP 172.214.77.34.bc.googleusercontent.com.8333 > tom-Latitude-3570.56244: tcp 283
15:30:04.515608 IP 172.214.77.34.bc.googleusercontent.com.8333 > tom-Latitude-3570.56244: tcp 24
15:30:04.515648 IP tom-Latitude-3570.56244 > 172.214.77.34.bc.googleusercontent.com.8333: tcp 0
15:30:04.521505 IP 172.214.77.34.bc.googleusercontent.com.8333 > tom-Latitude-3570.56244: tcp 249
15:30:04.521515 IP 172.214.77.34.bc.googleusercontent.com.8333 > tom-Latitude-3570.56244: tcp 24
15:30:04.521560 IP tom-Latitude-3570.56244 > 172.214.77.34.bc.googleusercontent.com.8333: tcp 0
15:30:04.529350 IP 172.214.77.34.bc.googleusercontent.com.8333 > tom-Latitude-3570.56244: tcp 217
15:30:04.529359 IP 172.214.77.34.bc.googleusercontent.com.8333 > tom-Latitude-3570.56244: tcp 24
15:30:04.529363 IP 172.214.77.34.bc.googleusercontent.com.8333 > tom-Latitude-3570.56244: tcp 405
15:30:04.529398 IP tom-Latitude-3570.56244 > 172.214.77.34.bc.googleusercontent.com.8333: tcp 0
15:30:04.532010 IP 172.214.77.34.bc.googleusercontent.com.8333 > tom-Latitude-3570.56244: tcp 1043
15:30:04.575774 IP tom-Latitude-3570.56244 > 172.214.77.34.bc.googleusercontent.com.8333: tcp 0
15:30:04.633210 IP tom-Latitude-3570.33922 > pool-108-20-207-31.bstnma.fios.verizon.net.8333: tcp 24
15:30:04.633572 IP tom-Latitude-3570.33922 > pool-108-20-207-31.bstnma.fios.verizon.net.8333: tcp 613
15:30:04.671526 IP pool-108-20-207-31.bstnma.fios.verizon.net.8333 > tom-Latitude-3570.33922: tcp 0
15:30:04.671533 IP pool-108-20-207-31.bstnma.fios.verizon.net.8333 > tom-Latitude-3570.33922: tcp 0
15:30:04.833522 IP tom-Latitude-3570.56344 > 23.226.90.172.8333: tcp 24
15:30:04.833810 IP tom-Latitude-3570.56344 > 23.226.90.172.8333: tcp 31
15:30:04.933862 IP tom-Latitude-3570.59818 > c-73-101-52-184.hsd1.pa.comcast.net.8333: tcp 24
15:30:04.933872 IP tom-Latitude-3570.59818 > c-73-101-52-184.hsd1.pa.comcast.net.8333: tcp 1261
15:30:04.954986 IP 23.226.90.172.8333 > tom-Latitude-3570.56344: tcp 0
15:30:04.954991 IP 23.226.90.172.8333 > tom-Latitude-3570.56344: tcp 0
15:30:05.033223 IP tom-Latitude-3570.46762 > 79.103.45.228.dsl.dyn.forthnet.gr.8333: tcp 0
15:30:05.067612 IP c-73-101-52-184.hsd1.pa.comcast.net.8333 > tom-Latitude-3570.59818: tcp 0
15:30:05.148684 IP 79.103.45.228.dsl.dyn.forthnet.gr.8333 > tom-Latitude-3570.46762: tcp 0
15:30:05.334355 IP tom-Latitude-3570.47742 > 97-82-78-25.dhcp.leds.al.charter.com.8333: tcp 24
15:30:05.335828 IP tom-Latitude-3570.47742 > 97-82-78-25.dhcp.leds.al.charter.com.8333: tcp 37
15:30:05.364346 IP 97-82-78-25.dhcp.leds.al.charter.com.8333 > tom-Latitude-3570.47742: tcp 0
15:30:05.367334 IP 97-82-78-25.dhcp.leds.al.charter.com.8333 > tom-Latitude-3570.47742: tcp 0
15:30:05.534368 IP 172.214.77.34.bc.googleusercontent.com.8333 > tom-Latitude-3570.56244: tcp 24
15:30:05.534385 IP tom-Latitude-3570.56244 > 172.214.77.34.bc.googleusercontent.com.8333: tcp 0
15:30:05.538306 IP 172.214.77.34.bc.googleusercontent.com.8333 > tom-Latitude-3570.56244: tcp 253
15:30:05.538313 IP tom-Latitude-3570.56244 > 172.214.77.34.bc.googleusercontent.com.8333: tcp 0
15:30:05.538532 IP tom-Latitude-3570.56244 > 172.214.77.34.bc.googleusercontent.com.8333: tcp 24
15:30:05.538882 IP tom-Latitude-3570.56244 > 172.214.77.34.bc.googleusercontent.com.8333: tcp 253
15:30:05.542477 IP 97-82-78-25.dhcp.leds.al.charter.com.8333 > tom-Latitude-3570.47742: tcp 24
15:30:05.542714 IP 97-82-78-25.dhcp.leds.al.charter.com.8333 > tom-Latitude-3570.47742: tcp 256
15:30:05.542726 IP tom-Latitude-3570.47742 > 97-82-78-25.dhcp.leds.al.charter.com.8333: tcp 0
15:30:05.543015 IP tom-Latitude-3570.47742 > 97-82-78-25.dhcp.leds.al.charter.com.8333: tcp 24
15:30:05.543286 IP tom-Latitude-3570.47742 > 97-82-78-25.dhcp.leds.al.charter.com.8333: tcp 54
15:30:05.564330 IP 172.214.77.34.bc.googleusercontent.com.8333 > tom-Latitude-3570.56244: tcp 0
15:30:05.572413 IP 172.214.77.34.bc.googleusercontent.com.8333 > tom-Latitude-3570.56244: tcp 0
15:30:05.575493 IP 97-82-78-25.dhcp.leds.al.charter.com.8333 > tom-Latitude-3570.47742: tcp 0
15:30:05.578688 IP 97-82-78-25.dhcp.leds.al.charter.com.8333 > tom-Latitude-3570.47742: tcp 0
15:30:05.643405 IP tom-Latitude-3570.34082 > host93-234-110-95.serverdedicati.aruba.it.8333: tcp 24
15:30:05.643736 IP tom-Latitude-3570.34082 > host93-234-110-95.serverdedicati.aruba.it.8333: tcp 613
15:30:05.645098 IP 172.214.77.34.bc.googleusercontent.com.8333 > tom-Latitude-3570.56244: tcp 24
15:30:05.645512 IP 172.214.77.34.bc.googleusercontent.com.8333 > tom-Latitude-3570.56244: tcp 374
15:30:05.645519 IP 172.214.77.34.bc.googleusercontent.com.8333 > tom-Latitude-3570.56244: tcp 24
15:30:05.645522 IP 172.214.77.34.bc.googleusercontent.com.8333 > tom-Latitude-3570.56244: tcp 256
15:30:05.645525 IP 172.214.77.34.bc.googleusercontent.com.8333 > tom-Latitude-3570.56244: tcp 24
15:30:05.645534 IP tom-Latitude-3570.56244 > 172.214.77.34.bc.googleusercontent.com.8333: tcp 0
15:30:05.648471 IP 172.214.77.34.bc.googleusercontent.com.8333 > tom-Latitude-3570.56244: tcp 256
15:30:05.648811 IP 172.214.77.34.bc.googleusercontent.com.8333 > tom-Latitude-3570.56244: tcp 24
15:30:05.648818 IP 172.214.77.34.bc.googleusercontent.com.8333 > tom-Latitude-3570.56244: tcp 1049
15:30:05.648821 IP 172.214.77.34.bc.googleusercontent.com.8333 > tom-Latitude-3570.56244: tcp 24
15:30:05.648832 IP tom-Latitude-3570.56244 > 172.214.77.34.bc.googleusercontent.com.8333: tcp 0
15:30:05.651727 IP 172.214.77.34.bc.googleusercontent.com.8333 > tom-Latitude-3570.56244: tcp 553
15:30:05.652106 IP 172.214.77.34.bc.googleusercontent.com.8333 > tom-Latitude-3570.56244: tcp 24
15:30:05.652113 IP 172.214.77.34.bc.googleusercontent.com.8333 > tom-Latitude-3570.56244: tcp 372
15:30:05.652116 IP 172.214.77.34.bc.googleusercontent.com.8333 > tom-Latitude-3570.56244: tcp 24
15:30:05.652118 IP 172.214.77.34.bc.googleusercontent.com.8333 > tom-Latitude-3570.56244: tcp 401
15:30:05.652128 IP tom-Latitude-3570.56244 > 172.214.77.34.bc.googleusercontent.com.8333: tcp 0
15:30:05.670422 IP host93-234-110-95.serverdedicati.aruba.it.8333 > tom-Latitude-3570.34082: tcp 0
15:30:05.676351 IP host93-234-110-95.serverdedicati.aruba.it.8333 > tom-Latitude-3570.34082: tcp 0
15:30:05.753643 IP tom-Latitude-3570.56344 > 23.226.90.172.8333: tcp 24
15:30:05.753981 IP tom-Latitude-3570.56344 > 23.226.90.172.8333: tcp 865
15:30:05.780457 IP 23.226.90.172.8333 > tom-Latitude-3570.56344: tcp 0
15:30:05.783898 IP 23.226.90.172.8333 > tom-Latitude-3570.56344: tcp 0
15:30:05.954096 IP tom-Latitude-3570.33922 > pool-108-20-207-31.bstnma.fios.verizon.net.8333: tcp 24
15:30:05.955536 IP tom-Latitude-3570.33922 > pool-108-20-207-31.bstnma.fios.verizon.net.8333: tcp 253
15:30:05.989278 IP pool-108-20-207-31.bstnma.fios.verizon.net.8333 > tom-Latitude-3570.33922: tcp 0
15:30:05.990326 IP pool-108-20-207-31.bstnma.fios.verizon.net.8333 > tom-Latitude-3570.33922: tcp 0
15:30:06.354841 IP tom-Latitude-3570.47742 > 97-82-78-25.dhcp.leds.al.charter.com.8333: tcp 24
15:30:06.354963 IP tom-Latitude-3570.36650 > ec2-52-56-97-80.eu-west-2.compute.amazonaws.com.8333: tcp 24
15:30:06.355579 IP tom-Latitude-3570.36650 > ec2-52-56-97-80.eu-west-2.compute.amazonaws.com.8333: tcp 937
15:30:06.355591 IP tom-Latitude-3570.47742 > 97-82-78-25.dhcp.leds.al.charter.com.8333: tcp 937
15:30:06.378384 IP 97-82-78-25.dhcp.leds.al.charter.com.8333 > tom-Latitude-3570.47742: tcp 0
15:30:06.381500 IP ec2-52-56-97-80.eu-west-2.compute.amazonaws.com.8333 > tom-Latitude-3570.36650: tcp 0
15:30:06.393420 IP 97-82-78-25.dhcp.leds.al.charter.com.8333 > tom-Latitude-3570.47742: tcp 0
15:30:06.405314 IP ec2-52-56-97-80.eu-west-2.compute.amazonaws.com.8333 > tom-Latitude-3570.36650: tcp 0
15:30:06.755627 IP tom-Latitude-3570.34082 > host93-234-110-95.serverdedicati.aruba.it.8333: tcp 24
15:30:06.757258 IP tom-Latitude-3570.34082 > host93-234-110-95.serverdedicati.aruba.it.8333: tcp 253
15:30:06.786586 IP host93-234-110-95.serverdedicati.aruba.it.8333 > tom-Latitude-3570.34082: tcp 0
15:30:06.786759 IP host93-234-110-95.serverdedicati.aruba.it.8333 > tom-Latitude-3570.34082: tcp 0
15:30:07.443455 IP 79.103.45.228.dsl.dyn.forthnet.gr.8333 > tom-Latitude-3570.46762: tcp 0
15:30:07.443465 IP host93-234-110-95.serverdedicati.aruba.it.8333 > tom-Latitude-3570.34082: tcp 24
15:30:07.443478 IP tom-Latitude-3570.34082 > host93-234-110-95.serverdedicati.aruba.it.8333: tcp 0
15:30:07.444538 IP host93-234-110-95.serverdedicati.aruba.it.8333 > tom-Latitude-3570.34082: tcp 361
15:30:07.444557 IP tom-Latitude-3570.34082 > host93-234-110-95.serverdedicati.aruba.it.8333: tcp 0
15:30:07.444942 IP tom-Latitude-3570.34082 > host93-234-110-95.serverdedicati.aruba.it.8333: tcp 24
15:30:07.445175 IP tom-Latitude-3570.34082 > host93-234-110-95.serverdedicati.aruba.it.8333: tcp 361
15:30:07.579782 IP tom-Latitude-3570.34082 > host93-234-110-95.serverdedicati.aruba.it.8333: tcp 361
15:30:07.612565 IP host93-234-110-95.serverdedicati.aruba.it.8333 > tom-Latitude-3570.34082: tcp 0
15:30:07.622819 IP host93-234-110-95.serverdedicati.aruba.it.8333 > tom-Latitude-3570.34082: tcp 0
15:30:07.652638 IP host93-234-110-95.serverdedicati.aruba.it.8333 > tom-Latitude-3570.34082: tcp 0
15:30:07.713135 IP host93-234-110-95.serverdedicati.aruba.it.8333 > tom-Latitude-3570.34082: tcp 24
15:30:07.713424 IP host93-234-110-95.serverdedicati.aruba.it.8333 > tom-Latitude-3570.34082: tcp 589
15:30:07.713430 IP host93-234-110-95.serverdedicati.aruba.it.8333 > tom-Latitude-3570.34082: tcp 24
15:30:07.713432 IP host93-234-110-95.serverdedicati.aruba.it.8333 > tom-Latitude-3570.34082: tcp 249
15:30:07.713434 IP host93-234-110-95.serverdedicati.aruba.it.8333 > tom-Latitude-3570.34082: tcp 24
15:30:07.713523 IP tom-Latitude-3570.34082 > host93-234-110-95.serverdedicati.aruba.it.8333: tcp 0
15:30:07.715977 IP host93-234-110-95.serverdedicati.aruba.it.8333 > tom-Latitude-3570.34082: tcp 371
15:30:07.716293 IP host93-234-110-95.serverdedicati.aruba.it.8333 > tom-Latitude-3570.34082: tcp 24
15:30:07.716299 IP host93-234-110-95.serverdedicati.aruba.it.8333 > tom-Latitude-3570.34082: tcp 222
15:30:07.716302 IP host93-234-110-95.serverdedicati.aruba.it.8333 > tom-Latitude-3570.34082: tcp 24
15:30:07.716347 IP tom-Latitude-3570.34082 > host93-234-110-95.serverdedicati.aruba.it.8333: tcp 0
15:30:07.719309 IP host93-234-110-95.serverdedicati.aruba.it.8333 > tom-Latitude-3570.34082: tcp 1382
15:30:07.719540 IP host93-234-110-95.serverdedicati.aruba.it.8333 > tom-Latitude-3570.34082: tcp 66
15:30:07.719549 IP tom-Latitude-3570.34082 > host93-234-110-95.serverdedicati.aruba.it.8333: tcp 0
15:30:07.823437 IP host93-234-110-95.serverdedicati.aruba.it.8333 > tom-Latitude-3570.34082: tcp 1448
15:30:07.823495 IP tom-Latitude-3570.34082 > host93-234-110-95.serverdedicati.aruba.it.8333: tcp 0
15:30:07.828988 IP host93-234-110-95.serverdedicati.aruba.it.8333 > tom-Latitude-3570.34082: tcp 1377
15:30:07.871889 IP tom-Latitude-3570.34082 > host93-234-110-95.serverdedicati.aruba.it.8333: tcp 0
15:30:07.930490 IP tom-Latitude-3570.56244 > 172.214.77.34.bc.googleusercontent.com.8333: tcp 24
15:30:07.931046 IP tom-Latitude-3570.56244 > 172.214.77.34.bc.googleusercontent.com.8333: tcp 361
15:30:07.977855 IP c-73-101-52-184.hsd1.pa.comcast.net.8333 > tom-Latitude-3570.59818: tcp 24
15:30:07.982913 IP c-73-101-52-184.hsd1.pa.comcast.net.8333 > tom-Latitude-3570.59818: tcp 937
15:30:07.982919 IP 172.214.77.34.bc.googleusercontent.com.8333 > tom-Latitude-3570.56244: tcp 0
15:30:07.982997 IP tom-Latitude-3570.59818 > c-73-101-52-184.hsd1.pa.comcast.net.8333: tcp 0
15:30:07.983057 IP 172.214.77.34.bc.googleusercontent.com.8333 > tom-Latitude-3570.56244: tcp 0
15:30:07.983299 IP tom-Latitude-3570.59818 > c-73-101-52-184.hsd1.pa.comcast.net.8333: tcp 24
15:30:07.983525 IP tom-Latitude-3570.59818 > c-73-101-52-184.hsd1.pa.comcast.net.8333: tcp 181
15:30:07.983537 IP tom-Latitude-3570.56118 > ns3051461.ip-51-255-95.eu.8333: tcp 24
15:30:07.983543 IP tom-Latitude-3570.56118 > ns3051461.ip-51-255-95.eu.8333: tcp 1261
15:30:08.139319 IP c-73-101-52-184.hsd1.pa.comcast.net.8333 > tom-Latitude-3570.59818: tcp 0
15:30:08.139329 IP ns3051461.ip-51-255-95.eu.8333 > tom-Latitude-3570.56118: tcp 0
15:30:08.172554 IP ns3051461.ip-51-255-95.eu.8333 > tom-Latitude-3570.56118: tcp 0
15:30:08.284097 IP tom-Latitude-3570.36650 > ec2-52-56-97-80.eu-west-2.compute.amazonaws.com.8333: tcp 24
15:30:08.284306 IP tom-Latitude-3570.36650 > ec2-52-56-97-80.eu-west-2.compute.amazonaws.com.8333: tcp 361
15:30:08.299897 IP c-73-101-52-184.hsd1.pa.comcast.net.8333 > tom-Latitude-3570.59818: tcp 24
15:30:08.299904 IP c-73-101-52-184.hsd1.pa.comcast.net.8333 > tom-Latitude-3570.59818: tcp 251
15:30:08.299924 IP c-73-101-52-184.hsd1.pa.comcast.net.8333 > tom-Latitude-3570.59818: tcp 24
15:30:08.299927 IP c-73-101-52-184.hsd1.pa.comcast.net.8333 > tom-Latitude-3570.59818: tcp 278
15:30:08.299930 IP c-73-101-52-184.hsd1.pa.comcast.net.8333 > tom-Latitude-3570.59818: tcp 24
15:30:08.299935 IP c-73-101-52-184.hsd1.pa.comcast.net.8333 > tom-Latitude-3570.59818: tcp 226
15:30:08.299937 IP c-73-101-52-184.hsd1.pa.comcast.net.8333 > tom-Latitude-3570.59818: tcp 24
15:30:08.299954 IP c-73-101-52-184.hsd1.pa.comcast.net.8333 > tom-Latitude-3570.59818: tcp 371
15:30:08.299957 IP c-73-101-52-184.hsd1.pa.comcast.net.8333 > tom-Latitude-3570.59818: tcp 24
15:30:08.299960 IP c-73-101-52-184.hsd1.pa.comcast.net.8333 > tom-Latitude-3570.59818: tcp 401
15:30:08.299980 IP tom-Latitude-3570.59818 > c-73-101-52-184.hsd1.pa.comcast.net.8333: tcp 0
15:30:08.318458 IP ec2-52-56-97-80.eu-west-2.compute.amazonaws.com.8333 > tom-Latitude-3570.36650: tcp 0
15:30:08.318727 IP ec2-52-56-97-80.eu-west-2.compute.amazonaws.com.8333 > tom-Latitude-3570.36650: tcp 0
15:30:08.503097 IP tom-Latitude-3570.56344 > 23.226.90.172.8333: tcp 24
15:30:08.504526 IP tom-Latitude-3570.56344 > 23.226.90.172.8333: tcp 541
15:30:08.534168 IP tom-Latitude-3570.43940 > 94-43-126-102.dsl.utg.ge.8333: tcp 0
15:30:08.536818 IP 23.226.90.172.8333 > tom-Latitude-3570.56344: tcp 0
15:30:08.556571 IP 23.226.90.172.8333 > tom-Latitude-3570.56344: tcp 0
15:30:08.576520 IP 94-43-126-102.dsl.utg.ge.8333 > tom-Latitude-3570.43940: tcp 0
15:30:08.576557 IP tom-Latitude-3570.43940 > 94-43-126-102.dsl.utg.ge.8333: tcp 0
15:30:08.576807 IP tom-Latitude-3570.43940 > 94-43-126-102.dsl.utg.ge.8333: tcp 24
15:30:08.576999 IP tom-Latitude-3570.43940 > 94-43-126-102.dsl.utg.ge.8333: tcp 102
15:30:08.603429 IP tom-Latitude-3570.56244 > 172.214.77.34.bc.googleusercontent.com.8333: tcp 24
15:30:08.603716 IP tom-Latitude-3570.56244 > 172.214.77.34.bc.googleusercontent.com.8333: tcp 181
15:30:08.630512 IP 172.214.77.34.bc.googleusercontent.com.8333 > tom-Latitude-3570.56244: tcp 0
15:30:08.630886 IP 172.214.77.34.bc.googleusercontent.com.8333 > tom-Latitude-3570.56244: tcp 0
15:30:08.664551 IP 94-43-126-102.dsl.utg.ge.8333 > tom-Latitude-3570.43940: tcp 0
15:30:09.077030 IP tom-Latitude-3570.47822 > 59.110.157.16.8333: tcp 0
15:30:09.079663 IP 94-43-126-102.dsl.utg.ge.8333 > tom-Latitude-3570.43940: tcp 24
15:30:09.079698 IP tom-Latitude-3570.43940 > 94-43-126-102.dsl.utg.ge.8333: tcp 0
15:30:09.079836 IP 94-43-126-102.dsl.utg.ge.8333 > tom-Latitude-3570.43940: tcp 104
15:30:09.079841 IP tom-Latitude-3570.43940 > 94-43-126-102.dsl.utg.ge.8333: tcp 0
15:30:09.079844 IP 94-43-126-102.dsl.utg.ge.8333 > tom-Latitude-3570.43940: tcp 24
15:30:09.079846 IP 94-43-126-102.dsl.utg.ge.8333 > tom-Latitude-3570.43940: tcp 24
15:30:09.079851 IP tom-Latitude-3570.43940 > 94-43-126-102.dsl.utg.ge.8333: tcp 0
15:30:09.079873 IP tom-Latitude-3570.43940 > 94-43-126-102.dsl.utg.ge.8333: tcp 0
15:30:09.080002 IP tom-Latitude-3570.43940 > 94-43-126-102.dsl.utg.ge.8333: tcp 24
15:30:09.080146 IP tom-Latitude-3570.43940 > 94-43-126-102.dsl.utg.ge.8333: tcp 1254
15:30:09.080300 IP tom-Latitude-3570.43940 > 94-43-126-102.dsl.utg.ge.8333: tcp 32
15:30:09.116260 IP 59.110.157.16.8333 > tom-Latitude-3570.47822: tcp 0
15:30:09.116287 IP tom-Latitude-3570.47822 > 59.110.157.16.8333: tcp 0
15:30:09.116302 IP 94-43-126-102.dsl.utg.ge.8333 > tom-Latitude-3570.43940: tcp 0
15:30:09.116766 IP tom-Latitude-3570.47822 > 59.110.157.16.8333: tcp 24
15:30:09.117051 IP tom-Latitude-3570.47822 > 59.110.157.16.8333: tcp 102
15:30:09.155513 IP 94-43-126-102.dsl.utg.ge.8333 > tom-Latitude-3570.43940: tcp 0
15:30:09.155655 IP 94-43-126-102.dsl.utg.ge.8333 > tom-Latitude-3570.43940: tcp 0
15:30:09.204459 IP 59.110.157.16.8333 > tom-Latitude-3570.47822: tcp 0
15:30:09.261137 IP 94-43-126-102.dsl.utg.ge.8333 > tom-Latitude-3570.43940: tcp 24
15:30:09.261151 IP 94-43-126-102.dsl.utg.ge.8333 > tom-Latitude-3570.43940: tcp 98
15:30:09.261155 IP 94-43-126-102.dsl.utg.ge.8333 > tom-Latitude-3570.43940: tcp 24
15:30:09.261182 IP tom-Latitude-3570.43940 > 94-43-126-102.dsl.utg.ge.8333: tcp 0
15:30:09.261283 IP tom-Latitude-3570.43940 > 94-43-126-102.dsl.utg.ge.8333: tcp 24
15:30:09.261582 IP tom-Latitude-3570.43940 > 94-43-126-102.dsl.utg.ge.8333: tcp 8
15:30:09.263662 IP 94-43-126-102.dsl.utg.ge.8333 > tom-Latitude-3570.43940: tcp 1116
15:30:09.263741 IP tom-Latitude-3570.43940 > 94-43-126-102.dsl.utg.ge.8333: tcp 24
15:30:09.263747 IP tom-Latitude-3570.43940 > 94-43-126-102.dsl.utg.ge.8333: tcp 82
15:30:09.290523 IP 94-43-126-102.dsl.utg.ge.8333 > tom-Latitude-3570.43940: tcp 0
15:30:09.290673 IP 94-43-126-102.dsl.utg.ge.8333 > tom-Latitude-3570.43940: tcp 0
15:30:09.310354 IP 94-43-126-102.dsl.utg.ge.8333 > tom-Latitude-3570.43940: tcp 0
15:30:09.313993 IP 94-43-126-102.dsl.utg.ge.8333 > tom-Latitude-3570.43940: tcp 0
15:30:09.321637 IP 94-43-126-102.dsl.utg.ge.8333 > tom-Latitude-3570.43940: tcp 24
15:30:09.321658 IP 94-43-126-102.dsl.utg.ge.8333 > tom-Latitude-3570.43940: tcp 8
15:30:09.321662 IP 94-43-126-102.dsl.utg.ge.8333 > tom-Latitude-3570.43940: tcp 24
15:30:09.321664 IP 94-43-126-102.dsl.utg.ge.8333 > tom-Latitude-3570.43940: tcp 82
15:30:09.321712 IP tom-Latitude-3570.43940 > 94-43-126-102.dsl.utg.ge.8333: tcp 0
15:30:09.606893 IP 59.110.157.16.8333 > tom-Latitude-3570.47822: tcp 24
15:30:09.606949 IP tom-Latitude-3570.47822 > 59.110.157.16.8333: tcp 0
15:30:09.606968 IP 59.110.157.16.8333 > tom-Latitude-3570.47822: tcp 102
15:30:09.606973 IP tom-Latitude-3570.47822 > 59.110.157.16.8333: tcp 0
15:30:09.606977 IP 59.110.157.16.8333 > tom-Latitude-3570.47822: tcp 24
15:30:09.606979 IP tom-Latitude-3570.47822 > 59.110.157.16.8333: tcp 0
15:30:09.607074 IP tom-Latitude-3570.47822 > 59.110.157.16.8333: tcp 24
15:30:09.607285 IP tom-Latitude-3570.47822 > 59.110.157.16.8333: tcp 1254
15:30:09.607648 IP tom-Latitude-3570.47822 > 59.110.157.16.8333: tcp 32
15:30:09.706514 IP 59.110.157.16.8333 > tom-Latitude-3570.47822: tcp 0
15:30:09.768965 IP 59.110.157.16.8333 > tom-Latitude-3570.47822: tcp 0
15:30:09.816477 IP 59.110.157.16.8333 > tom-Latitude-3570.47822: tcp 0
15:30:09.894171 IP host93-234-110-95.serverdedicati.aruba.it.8333 > tom-Latitude-3570.34082: tcp 24
15:30:09.894184 IP tom-Latitude-3570.34082 > host93-234-110-95.serverdedicati.aruba.it.8333: tcp 0
15:30:09.900978 IP host93-234-110-95.serverdedicati.aruba.it.8333 > tom-Latitude-3570.34082: tcp 973
15:30:09.900989 IP tom-Latitude-3570.34082 > host93-234-110-95.serverdedicati.aruba.it.8333: tcp 0
15:30:09.901517 IP tom-Latitude-3570.34082 > host93-234-110-95.serverdedicati.aruba.it.8333: tcp 24
15:30:09.901744 IP tom-Latitude-3570.34082 > host93-234-110-95.serverdedicati.aruba.it.8333: tcp 793
15:30:10.071018 IP host93-234-110-95.serverdedicati.aruba.it.8333 > tom-Latitude-3570.34082: tcp 973
15:30:10.071040 IP tom-Latitude-3570.34082 > host93-234-110-95.serverdedicati.aruba.it.8333: tcp 0
15:30:10.087769 IP tom-Latitude-3570.34082 > host93-234-110-95.serverdedicati.aruba.it.8333: tcp 793
15:30:10.152498 IP host93-234-110-95.serverdedicati.aruba.it.8333 > tom-Latitude-3570.34082: tcp 0
15:30:10.369303 IP 59.110.157.16.8333 > tom-Latitude-3570.47822: tcp 24
15:30:10.369536 IP 59.110.157.16.8333 > tom-Latitude-3570.47822: tcp 24
15:30:10.369540 IP 59.110.157.16.8333 > tom-Latitude-3570.47822: tcp 9
15:30:10.369542 IP 59.110.157.16.8333 > tom-Latitude-3570.47822: tcp 24
15:30:10.369544 IP 59.110.157.16.8333 > tom-Latitude-3570.47822: tcp 9
15:30:10.369545 IP 59.110.157.16.8333 > tom-Latitude-3570.47822: tcp 24
15:30:10.369547 IP 59.110.157.16.8333 > tom-Latitude-3570.47822: tcp 8
15:30:10.369562 IP 59.110.157.16.8333 > tom-Latitude-3570.47822: tcp 55
15:30:10.369568 IP tom-Latitude-3570.47822 > 59.110.157.16.8333: tcp 0
15:30:10.369593 IP tom-Latitude-3570.47822 > 59.110.157.16.8333: tcp 0
15:30:10.369654 IP tom-Latitude-3570.47822 > 59.110.157.16.8333: tcp 24
15:30:10.369951 IP tom-Latitude-3570.47822 > 59.110.157.16.8333: tcp 8
15:30:10.371976 IP 59.110.157.16.8333 > tom-Latitude-3570.47822: tcp 24
15:30:10.398376 IP host93-234-110-95.serverdedicati.aruba.it.8333 > tom-Latitude-3570.34082: tcp 0
15:30:10.403361 IP host93-234-110-95.serverdedicati.aruba.it.8333 > tom-Latitude-3570.34082: tcp 0
15:30:10.413011 IP 59.110.157.16.8333 > tom-Latitude-3570.47822: tcp 0
15:30:10.415769 IP tom-Latitude-3570.47822 > 59.110.157.16.8333: tcp 0
15:30:10.420327 IP 59.110.157.16.8333 > tom-Latitude-3570.47822: tcp 0
15:30:10.501136 IP host93-234-110-95.serverdedicati.aruba.it.8333 > tom-Latitude-3570.34082: tcp 24
15:30:10.501152 IP tom-Latitude-3570.34082 > host93-234-110-95.serverdedicati.aruba.it.8333: tcp 0
15:30:10.501547 IP host93-234-110-95.serverdedicati.aruba.it.8333 > tom-Latitude-3570.34082: tcp 418
15:30:10.501550 IP tom-Latitude-3570.34082 > host93-234-110-95.serverdedicati.aruba.it.8333: tcp 0
15:30:10.501559 IP host93-234-110-95.serverdedicati.aruba.it.8333 > tom-Latitude-3570.34082: tcp 24
15:30:10.501563 IP tom-Latitude-3570.34082 > host93-234-110-95.serverdedicati.aruba.it.8333: tcp 0
15:30:10.501567 IP host93-234-110-95.serverdedicati.aruba.it.8333 > tom-Latitude-3570.34082: tcp 247
15:30:10.501572 IP tom-Latitude-3570.34082 > host93-234-110-95.serverdedicati.aruba.it.8333: tcp 0
15:30:10.501588 IP host93-234-110-95.serverdedicati.aruba.it.8333 > tom-Latitude-3570.34082: tcp 24
15:30:10.501591 IP host93-234-110-95.serverdedicati.aruba.it.8333 > tom-Latitude-3570.34082: tcp 371
15:30:10.501593 IP tom-Latitude-3570.34082 > host93-234-110-95.serverdedicati.aruba.it.8333: tcp 0
15:30:10.501593 IP host93-234-110-95.serverdedicati.aruba.it.8333 > tom-Latitude-3570.34082: tcp 24
15:30:10.501595 IP host93-234-110-95.serverdedicati.aruba.it.8333 > tom-Latitude-3570.34082: tcp 435
15:30:10.501597 IP host93-234-110-95.serverdedicati.aruba.it.8333 > tom-Latitude-3570.34082: tcp 24
15:30:10.501598 IP tom-Latitude-3570.34082 > host93-234-110-95.serverdedicati.aruba.it.8333: tcp 0
15:30:10.501600 IP host93-234-110-95.serverdedicati.aruba.it.8333 > tom-Latitude-3570.34082: tcp 256
15:30:10.501601 IP tom-Latitude-3570.34082 > host93-234-110-95.serverdedicati.aruba.it.8333: tcp 0
15:30:10.501604 IP tom-Latitude-3570.34082 > host93-234-110-95.serverdedicati.aruba.it.8333: tcp 0
15:30:10.501607 IP tom-Latitude-3570.34082 > host93-234-110-95.serverdedicati.aruba.it.8333: tcp 0
15:30:10.501609 IP tom-Latitude-3570.34082 > host93-234-110-95.serverdedicati.aruba.it.8333: tcp 0
15:30:10.587775 IP host93-234-110-95.serverdedicati.aruba.it.8333 > tom-Latitude-3570.34082: tcp 1382
15:30:10.587795 IP tom-Latitude-3570.34082 > host93-234-110-95.serverdedicati.aruba.it.8333: tcp 0
15:30:10.588216 IP host93-234-110-95.serverdedicati.aruba.it.8333 > tom-Latitude-3570.34082: tcp 66
15:30:10.588220 IP tom-Latitude-3570.34082 > host93-234-110-95.serverdedicati.aruba.it.8333: tcp 0
15:30:10.588231 IP host93-234-110-95.serverdedicati.aruba.it.8333 > tom-Latitude-3570.34082: tcp 1448
15:30:10.588234 IP tom-Latitude-3570.34082 > host93-234-110-95.serverdedicati.aruba.it.8333: tcp 0
15:30:10.588240 IP host93-234-110-95.serverdedicati.aruba.it.8333 > tom-Latitude-3570.34082: tcp 1448
15:30:10.588242 IP tom-Latitude-3570.34082 > host93-234-110-95.serverdedicati.aruba.it.8333: tcp 0
15:30:10.592931 IP host93-234-110-95.serverdedicati.aruba.it.8333 > tom-Latitude-3570.34082: tcp 1382
15:30:10.593071 IP host93-234-110-95.serverdedicati.aruba.it.8333 > tom-Latitude-3570.34082: tcp 66
15:30:10.593077 IP tom-Latitude-3570.34082 > host93-234-110-95.serverdedicati.aruba.it.8333: tcp 0
15:30:10.607527 IP host93-234-110-95.serverdedicati.aruba.it.8333 > tom-Latitude-3570.34082: tcp 1448
15:30:10.607566 IP tom-Latitude-3570.34082 > host93-234-110-95.serverdedicati.aruba.it.8333: tcp 0
15:30:10.610476 IP host93-234-110-95.serverdedicati.aruba.it.8333 > tom-Latitude-3570.34082: tcp 809
15:30:10.610503 IP tom-Latitude-3570.34082 > host93-234-110-95.serverdedicati.aruba.it.8333: tcp 0
15:30:10.610641 IP 97-82-78-25.dhcp.leds.al.charter.com.8333 > tom-Latitude-3570.47742: tcp 24
15:30:10.617450 IP 97-82-78-25.dhcp.leds.al.charter.com.8333 > tom-Latitude-3570.47742: tcp 1261
15:30:10.617472 IP tom-Latitude-3570.47742 > 97-82-78-25.dhcp.leds.al.charter.com.8333: tcp 0
15:30:10.617798 IP tom-Latitude-3570.47742 > 97-82-78-25.dhcp.leds.al.charter.com.8333: tcp 24
15:30:10.617985 IP tom-Latitude-3570.47742 > 97-82-78-25.dhcp.leds.al.charter.com.8333: tcp 73
15:30:10.675910 IP 59.110.157.16.8333 > tom-Latitude-3570.47822: tcp 1199
15:30:10.675919 IP tom-Latitude-3570.47822 > 59.110.157.16.8333: tcp 0
15:30:10.676044 IP tom-Latitude-3570.47822 > 59.110.157.16.8333: tcp 24
15:30:10.676108 IP 97-82-78-25.dhcp.leds.al.charter.com.8333 > tom-Latitude-3570.47742: tcp 0
15:30:10.676115 IP 97-82-78-25.dhcp.leds.al.charter.com.8333 > tom-Latitude-3570.47742: tcp 0
15:30:10.676369 IP tom-Latitude-3570.47822 > 59.110.157.16.8333: tcp 82
15:30:10.712551 IP 59.110.157.16.8333 > tom-Latitude-3570.47822: tcp 0
15:30:10.717473 IP 59.110.157.16.8333 > tom-Latitude-3570.47822: tcp 0
15:30:10.820719 IP host93-234-110-95.serverdedicati.aruba.it.8333 > tom-Latitude-3570.34082: tcp 24
15:30:10.820726 IP host93-234-110-95.serverdedicati.aruba.it.8333 > tom-Latitude-3570.34082: tcp 397
15:30:10.820804 IP tom-Latitude-3570.34082 > host93-234-110-95.serverdedicati.aruba.it.8333: tcp 0
15:30:10.821126 IP tom-Latitude-3570.34082 > host93-234-110-95.serverdedicati.aruba.it.8333: tcp 24
15:30:10.821434 IP tom-Latitude-3570.34082 > host93-234-110-95.serverdedicati.aruba.it.8333: tcp 325
15:30:10.940220 IP 97-82-78-25.dhcp.leds.al.charter.com.8333 > tom-Latitude-3570.47742: tcp 24
15:30:10.940226 IP 97-82-78-25.dhcp.leds.al.charter.com.8333 > tom-Latitude-3570.47742: tcp 366
15:30:10.940230 IP 97-82-78-25.dhcp.leds.al.charter.com.8333 > tom-Latitude-3570.47742: tcp 24
15:30:10.940232 IP 97-82-78-25.dhcp.leds.al.charter.com.8333 > tom-Latitude-3570.47742: tcp 898
15:30:10.940245 IP tom-Latitude-3570.47742 > 97-82-78-25.dhcp.leds.al.charter.com.8333: tcp 0
15:30:11.031018 IP host93-234-110-95.serverdedicati.aruba.it.8333 > tom-Latitude-3570.34082: tcp 0
15:30:11.031025 IP host93-234-110-95.serverdedicati.aruba.it.8333 > tom-Latitude-3570.34082: tcp 0
15:30:11.141788 IP tom-Latitude-3570.59818 > c-73-101-52-184.hsd1.pa.comcast.net.8333: tcp 24
15:30:11.141969 IP tom-Latitude-3570.33922 > pool-108-20-207-31.bstnma.fios.verizon.net.8333: tcp 24
15:30:11.141974 IP tom-Latitude-3570.33922 > pool-108-20-207-31.bstnma.fios.verizon.net.8333: tcp 1261
15:30:11.142095 IP tom-Latitude-3570.59818 > c-73-101-52-184.hsd1.pa.comcast.net.8333: tcp 865
15:30:11.242294 IP tom-Latitude-3570.47822 > 59.110.157.16.8333: tcp 24
15:30:11.243056 IP tom-Latitude-3570.47822 > 59.110.157.16.8333: tcp 865
15:30:11.247710 IP tom-Latitude-3570.33922 > pool-108-20-207-31.bstnma.fios.verizon.net.8333: tcp 1261
15:30:11.342625 IP tom-Latitude-3570.43940 > 94-43-126-102.dsl.utg.ge.8333: tcp 24
15:30:11.342990 IP tom-Latitude-3570.43940 > 94-43-126-102.dsl.utg.ge.8333: tcp 721
15:30:11.387743 IP tom-Latitude-3570.47822 > 59.110.157.16.8333: tcp 865
15:30:11.414294 IP host93-234-110-95.serverdedicati.aruba.it.8333 > tom-Latitude-3570.34082: tcp 24
15:30:11.414300 IP host93-234-110-95.serverdedicati.aruba.it.8333 > tom-Latitude-3570.34082: tcp 403
15:30:11.414303 IP host93-234-110-95.serverdedicati.aruba.it.8333 > tom-Latitude-3570.34082: tcp 24
15:30:11.414305 IP host93-234-110-95.serverdedicati.aruba.it.8333 > tom-Latitude-3570.34082: tcp 403
15:30:11.414307 IP host93-234-110-95.serverdedicati.aruba.it.8333 > tom-Latitude-3570.34082: tcp 24
15:30:11.414308 IP host93-234-110-95.serverdedicati.aruba.it.8333 > tom-Latitude-3570.34082: tcp 404
15:30:11.414310 IP host93-234-110-95.serverdedicati.aruba.it.8333 > tom-Latitude-3570.34082: tcp 24
15:30:11.414312 IP host93-234-110-95.serverdedicati.aruba.it.8333 > tom-Latitude-3570.34082: tcp 401
15:30:11.414314 IP host93-234-110-95.serverdedicati.aruba.it.8333 > tom-Latitude-3570.34082: tcp 24
15:30:11.414316 IP host93-234-110-95.serverdedicati.aruba.it.8333 > tom-Latitude-3570.34082: tcp 374
15:30:11.414317 IP host93-234-110-95.serverdedicati.aruba.it.8333 > tom-Latitude-3570.34082: tcp 24
15:30:11.414319 IP host93-234-110-95.serverdedicati.aruba.it.8333 > tom-Latitude-3570.34082: tcp 283
15:30:11.414321 IP host93-234-110-95.serverdedicati.aruba.it.8333 > tom-Latitude-3570.34082: tcp 24
15:30:11.414323 IP host93-234-110-95.serverdedicati.aruba.it.8333 > tom-Latitude-3570.34082: tcp 488
15:30:11.414339 IP host93-234-110-95.serverdedicati.aruba.it.8333 > tom-Latitude-3570.34082: tcp 1233
15:30:11.414340 IP tom-Latitude-3570.34082 > host93-234-110-95.serverdedicati.aruba.it.8333: tcp 0
15:30:11.414345 IP host93-234-110-95.serverdedicati.aruba.it.8333 > tom-Latitude-3570.34082: tcp 1233
15:30:11.414347 IP 94-43-126-102.dsl.utg.ge.8333 > tom-Latitude-3570.43940: tcp 24
15:30:11.414350 IP tom-Latitude-3570.34082 > host93-234-110-95.serverdedicati.aruba.it.8333: tcp 0
15:30:11.414421 IP 94-43-126-102.dsl.utg.ge.8333 > tom-Latitude-3570.43940: tcp 1448
15:30:11.414427 IP tom-Latitude-3570.43940 > 94-43-126-102.dsl.utg.ge.8333: tcp 0
15:30:11.414433 IP 94-43-126-102.dsl.utg.ge.8333 > tom-Latitude-3570.43940: tcp 1448
15:30:11.414436 IP tom-Latitude-3570.43940 > 94-43-126-102.dsl.utg.ge.8333: tcp 0
15:30:11.414442 IP 94-43-126-102.dsl.utg.ge.8333 > tom-Latitude-3570.43940: tcp 1448
15:30:11.414444 IP tom-Latitude-3570.43940 > 94-43-126-102.dsl.utg.ge.8333: tcp 0
15:30:11.414449 IP 94-43-126-102.dsl.utg.ge.8333 > tom-Latitude-3570.43940: tcp 1448
15:30:11.414452 IP tom-Latitude-3570.43940 > 94-43-126-102.dsl.utg.ge.8333: tcp 0
15:30:11.414458 IP 94-43-126-102.dsl.utg.ge.8333 > tom-Latitude-3570.43940: tcp 1448
15:30:11.414462 IP tom-Latitude-3570.43940 > 94-43-126-102.dsl.utg.ge.8333: tcp 0
15:30:11.414469 IP 94-43-126-102.dsl.utg.ge.8333 > tom-Latitude-3570.43940: tcp 1448
15:30:11.414472 IP tom-Latitude-3570.43940 > 94-43-126-102.dsl.utg.ge.8333: tcp 0
15:30:11.414477 IP 94-43-126-102.dsl.utg.ge.8333 > tom-Latitude-3570.43940: tcp 1448
15:30:11.414480 IP pool-108-20-207-31.bstnma.fios.verizon.net.8333 > tom-Latitude-3570.33922: tcp 24
15:30:11.414482 IP tom-Latitude-3570.33922 > pool-108-20-207-31.bstnma.fios.verizon.net.8333: tcp 0
15:30:11.414486 IP tom-Latitude-3570.43940 > 94-43-126-102.dsl.utg.ge.8333: tcp 0
15:30:11.414486 IP pool-108-20-207-31.bstnma.fios.verizon.net.8333 > tom-Latitude-3570.33922: tcp 1261
15:30:11.414489 IP tom-Latitude-3570.33922 > pool-108-20-207-31.bstnma.fios.verizon.net.8333: tcp 0
15:30:11.414490 IP c-73-101-52-184.hsd1.pa.comcast.net.8333 > tom-Latitude-3570.59818: tcp 0
15:30:11.414494 IP pool-108-20-207-31.bstnma.fios.verizon.net.8333 > tom-Latitude-3570.33922: tcp 0
15:30:11.414496 IP 59.110.157.16.8333 > tom-Latitude-3570.47822: tcp 0
15:30:11.414499 IP pool-108-20-207-31.bstnma.fios.verizon.net.8333 > tom-Latitude-3570.33922: tcp 0
15:30:11.414502 IP 59.110.157.16.8333 > tom-Latitude-3570.47822: tcp 0
15:30:11.414505 IP pool-108-20-207-31.bstnma.fios.verizon.net.8333 > tom-Latitude-3570.33922: tcp 0
15:30:11.414509 IP 94-43-126-102.dsl.utg.ge.8333 > tom-Latitude-3570.43940: tcp 1382
15:30:11.414510 IP 94-43-126-102.dsl.utg.ge.8333 > tom-Latitude-3570.43940: tcp 0
15:30:11.417059 IP 94-43-126-102.dsl.utg.ge.8333 > tom-Latitude-3570.43940: tcp 1382
15:30:11.417077 IP tom-Latitude-3570.43940 > 94-43-126-102.dsl.utg.ge.8333: tcp 0
15:30:11.423070 IP 59.110.157.16.8333 > tom-Latitude-3570.47822: tcp 0
15:30:11.471741 IP 94-43-126-102.dsl.utg.ge.8333 > tom-Latitude-3570.43940: tcp 1382
15:30:11.487529 IP 94-43-126-102.dsl.utg.ge.8333 > tom-Latitude-3570.43940: tcp 1382
15:30:11.487543 IP tom-Latitude-3570.43940 > 94-43-126-102.dsl.utg.ge.8333: tcp 0
15:30:11.487857 IP 94-43-126-102.dsl.utg.ge.8333 > tom-Latitude-3570.43940: tcp 1382
15:30:11.490633 IP 94-43-126-102.dsl.utg.ge.8333 > tom-Latitude-3570.43940: tcp 1382
15:30:11.490638 IP tom-Latitude-3570.43940 > 94-43-126-102.dsl.utg.ge.8333: tcp 0
15:30:11.499340 IP 94-43-126-102.dsl.utg.ge.8333 > tom-Latitude-3570.43940: tcp 1382
15:30:11.525989 IP 94-43-126-102.dsl.utg.ge.8333 > tom-Latitude-3570.43940: tcp 1382
15:30:11.526005 IP tom-Latitude-3570.43940 > 94-43-126-102.dsl.utg.ge.8333: tcp 0
15:30:11.527609 IP tom-Latitude-3570.36650 > ec2-52-56-97-80.eu-west-2.compute.amazonaws.com.8333: tcp 24
15:30:11.527620 IP tom-Latitude-3570.36650 > ec2-52-56-97-80.eu-west-2.compute.amazonaws.com.8333: tcp 1261
15:30:11.549093 IP 94-43-126-102.dsl.utg.ge.8333 > tom-Latitude-3570.43940: tcp 1382
15:30:11.549106 IP 94-43-126-102.dsl.utg.ge.8333 > tom-Latitude-3570.43940: tcp 1382
15:30:11.549115 IP tom-Latitude-3570.43940 > 94-43-126-102.dsl.utg.ge.8333: tcp 0
15:30:11.549126 IP 94-43-126-102.dsl.utg.ge.8333 > tom-Latitude-3570.43940: tcp 1382
15:30:11.549130 IP 94-43-126-102.dsl.utg.ge.8333 > tom-Latitude-3570.43940: tcp 1382
15:30:11.549133 IP tom-Latitude-3570.43940 > 94-43-126-102.dsl.utg.ge.8333: tcp 0
15:30:11.549136 IP 94-43-126-102.dsl.utg.ge.8333 > tom-Latitude-3570.43940: tcp 1382
15:30:11.549143 IP 94-43-126-102.dsl.utg.ge.8333 > tom-Latitude-3570.43940: tcp 1382
15:30:11.549145 IP tom-Latitude-3570.43940 > 94-43-126-102.dsl.utg.ge.8333: tcp 0
15:30:11.549149 IP 94-43-126-102.dsl.utg.ge.8333 > tom-Latitude-3570.43940: tcp 519
15:30:11.549416 IP tom-Latitude-3570.47742 > 97-82-78-25.dhcp.leds.al.charter.com.8333: tcp 24
15:30:11.556432 IP tom-Latitude-3570.47742 > 97-82-78-25.dhcp.leds.al.charter.com.8333: tcp 469
