23:33:48.283761 IP tom-Latitude-3570.47742 > 97-82-78-25.dhcp.leds.al.charter.com.8333: tcp 183
23:33:49.307767 IP tom-Latitude-3570.36650 > 52.56.97.80.8333: tcp 32
23:33:49.927489 IP tom-Latitude-3570.47742 > 97-82-78-25.dhcp.leds.al.charter.com.8333: tcp 24
23:33:49.927505 IP tom-Latitude-3570.47742 > 97-82-78-25.dhcp.leds.al.charter.com.8333: tcp 289
23:33:50.507772 IP 59.110.157.16.8333 > tom-Latitude-3570.47822: tcp 24
23:33:50.507796 IP tom-Latitude-3570.47822 > 59.110.157.16.8333: tcp 0
23:33:50.507810 IP 59.110.157.16.8333 > tom-Latitude-3570.47822: tcp 1261
23:33:50.507812 IP tom-Latitude-3570.47822 > 59.110.157.16.8333: tcp 0
23:33:50.635650 IP pool-108-20-207-31.bstnma.fios.verizon.net.8333 > tom-Latitude-3570.33922: tcp 24
23:33:50.675759 IP tom-Latitude-3570.33922 > pool-108-20-207-31.bstnma.fios.verizon.net.8333: tcp 0
23:33:53.014297 IP tom-Latitude-3570.59818 > c-73-101-52-184.hsd1.pa.comcast.net.8333: tcp 24
23:33:53.014317 IP tom-Latitude-3570.59818 > c-73-101-52-184.hsd1.pa.comcast.net.8333: tcp 109
23:33:55.233907 IP 172.214.77.34.bc.googleusercontent.com.8333 > tom-Latitude-3570.56244: tcp 24
23:33:55.275694 IP tom-Latitude-3570.56244 > 172.214.77.34.bc.googleusercontent.com.8333: tcp 0
23:33:56.421586 IP 59.110.157.16.8333 > tom-Latitude-3570.47822: tcp 24
23:33:56.421609 IP tom-Latitude-3570.47822 > 59.110.157.16.8333: tcp 0
23:33:56.424768 IP 59.110.157.16.8333 > tom-Latitude-3570.47822: tcp 1261
23:33:56.424820 IP tom-Latitude-3570.47822 > 59.110.157.16.8333: tcp 0
23:33:56.526893 IP tom-Latitude-3570.33922 > pool-108-20-207-31.bstnma.fios.verizon.net.8333: tcp 24
23:33:56.526913 IP tom-Latitude-3570.33922 > pool-108-20-207-31.bstnma.fios.verizon.net.8333: tcp 109
23:33:57.028344 IP pool-108-20-207-31.bstnma.fios.verizon.net.8333 > tom-Latitude-3570.33922: tcp 1382
23:33:57.028999 IP tom-Latitude-3570.33922 > pool-108-20-207-31.bstnma.fios.verizon.net.8333: tcp 24
23:33:57.029019 IP tom-Latitude-3570.33922 > pool-108-20-207-31.bstnma.fios.verizon.net.8333: tcp 361
23:33:57.037346 IP pool-108-20-207-31.bstnma.fios.verizon.net.8333 > tom-Latitude-3570.33922: tcp 1382
23:33:57.038794 IP 59.110.157.16.8333 > tom-Latitude-3570.47822: tcp 24
23:33:57.038799 IP tom-Latitude-3570.47822 > 59.110.157.16.8333: tcp 0
23:33:57.039568 IP 59.110.157.16.8333 > tom-Latitude-3570.47822: tcp 1261
23:33:57.039571 IP tom-Latitude-3570.47822 > 59.110.157.16.8333: tcp 0
23:33:57.079904 IP tom-Latitude-3570.33922 > pool-108-20-207-31.bstnma.fios.verizon.net.8333: tcp 0
23:33:57.766147 IP pool-108-20-207-31.bstnma.fios.verizon.net.8333 > tom-Latitude-3570.33922: tcp 1067
23:33:57.766215 IP tom-Latitude-3570.33922 > pool-108-20-207-31.bstnma.fios.verizon.net.8333: tcp 0
23:33:58.523743 IP tom-Latitude-3570.54046 > 184-101-12-201.phnx.qwest.net.8333: tcp 115
23:33:59.770155 IP tom-Latitude-3570.47742 > 97-82-78-25.dhcp.leds.al.charter.com.8333: tcp 24
23:34:00.921954 IP pool-108-20-207-31.bstnma.fios.verizon.net.8333 > tom-Latitude-3570.33922: tcp 24
23:34:00.922020 IP tom-Latitude-3570.33922 > pool-108-20-207-31.bstnma.fios.verizon.net.8333: tcp 0
23:34:10.256087 IP 52.56.97.80.8333 > tom-Latitude-3570.36650: tcp 24
23:34:10.256301 IP tom-Latitude-3570.36650 > 52.56.97.80.8333: tcp 0
23:34:10.257019 IP 52.56.97.80.8333 > tom-Latitude-3570.36650: tcp 223
23:34:10.257048 IP 52.56.97.80.8333 > tom-Latitude-3570.36650: tcp 1382
23:34:10.257157 IP tom-Latitude-3570.36650 > 52.56.97.80.8333: tcp 0
23:34:10.259266 IP 52.56.97.80.8333 > tom-Latitude-3570.36650: tcp 66
23:34:10.259325 IP tom-Latitude-3570.36650 > 52.56.97.80.8333: tcp 0
23:34:10.260763 IP 52.56.97.80.8333 > tom-Latitude-3570.36650: tcp 122
23:34:10.260769 IP 52.56.97.80.8333 > tom-Latitude-3570.36650: tcp 1382
23:34:10.260821 IP tom-Latitude-3570.36650 > 52.56.97.80.8333: tcp 0
23:34:10.270057 IP 52.56.97.80.8333 > tom-Latitude-3570.36650: tcp 66
23:34:10.270069 IP 52.56.97.80.8333 > tom-Latitude-3570.36650: tcp 90
23:34:10.270073 IP 52.56.97.80.8333 > tom-Latitude-3570.36650: tcp 1382
23:34:10.270144 IP tom-Latitude-3570.36650 > 52.56.97.80.8333: tcp 0
23:34:10.271987 IP 52.56.97.80.8333 > tom-Latitude-3570.36650: tcp 66
23:34:10.272036 IP tom-Latitude-3570.36650 > 52.56.97.80.8333: tcp 0
23:34:10.272752 IP 52.56.97.80.8333 > tom-Latitude-3570.36650: tcp 89
23:34:10.272755 IP 52.56.97.80.8333 > tom-Latitude-3570.36650: tcp 24
23:34:10.272757 IP 52.56.97.80.8333 > tom-Latitude-3570.36650: tcp 283
23:34:10.272799 IP tom-Latitude-3570.36650 > 52.56.97.80.8333: tcp 0
23:34:10.316968 IP 52.56.97.80.8333 > tom-Latitude-3570.36650: tcp 1382
23:34:10.359780 IP tom-Latitude-3570.36650 > 52.56.97.80.8333: tcp 0
23:34:10.375263 IP 59.110.157.16.8333 > tom-Latitude-3570.47822: tcp 0
23:34:10.375977 IP 59.110.157.16.8333 > tom-Latitude-3570.47822: tcp 0
23:34:10.375992 IP 52.56.97.80.8333 > tom-Latitude-3570.36650: tcp 0
23:34:10.375995 IP 59.110.157.16.8333 > tom-Latitude-3570.47822: tcp 0
23:34:10.375998 IP 59.110.157.16.8333 > tom-Latitude-3570.47822: tcp 0
23:34:10.376000 IP 59.110.157.16.8333 > tom-Latitude-3570.47822: tcp 0
23:34:10.382153 IP c-73-101-52-184.hsd1.pa.comcast.net.8333 > tom-Latitude-3570.59818: tcp 0
23:34:10.607020 IP c-73-101-52-184.hsd1.pa.comcast.net.8333 > tom-Latitude-3570.59818: tcp 0
23:34:10.730418 IP 184-101-12-201.phnx.qwest.net.8333 > tom-Latitude-3570.54046: tcp 0
23:34:10.731262 IP 52.56.97.80.8333 > tom-Latitude-3570.36650: tcp 1382
23:34:10.734866 IP 52.56.97.80.8333 > tom-Latitude-3570.36650: tcp 1382
23:34:10.734906 IP tom-Latitude-3570.36650 > 52.56.97.80.8333: tcp 0
23:34:10.792760 IP c-73-101-52-184.hsd1.pa.comcast.net.8333 > tom-Latitude-3570.59818: tcp 0
23:34:10.840878 IP c-73-101-52-184.hsd1.pa.comcast.net.8333 > tom-Latitude-3570.59818: tcp 0
23:34:10.840894 IP c-73-101-52-184.hsd1.pa.comcast.net.8333 > tom-Latitude-3570.59818: tcp 0
23:34:10.864057 IP c-73-101-52-184.hsd1.pa.comcast.net.8333 > tom-Latitude-3570.59818: tcp 0
23:34:10.864714 IP 184-101-12-201.phnx.qwest.net.8333 > tom-Latitude-3570.54046: tcp 0
23:34:10.867752 IP 184-101-12-201.phnx.qwest.net.8333 > tom-Latitude-3570.54046: tcp 0
23:34:10.896598 IP pool-108-20-207-31.bstnma.fios.verizon.net.8333 > tom-Latitude-3570.33922: tcp 0
23:34:10.899970 IP c-73-101-52-184.hsd1.pa.comcast.net.8333 > tom-Latitude-3570.59818: tcp 1382
23:34:10.903772 IP c-73-101-52-184.hsd1.pa.comcast.net.8333 > tom-Latitude-3570.59818: tcp 1279
23:34:10.903821 IP tom-Latitude-3570.59818 > c-73-101-52-184.hsd1.pa.comcast.net.8333: tcp 0
23:34:10.941417 IP pool-108-20-207-31.bstnma.fios.verizon.net.8333 > tom-Latitude-3570.33922: tcp 1382
23:34:10.946240 IP pool-108-20-207-31.bstnma.fios.verizon.net.8333 > tom-Latitude-3570.33922: tcp 1382
23:34:10.946313 IP tom-Latitude-3570.33922 > pool-108-20-207-31.bstnma.fios.verizon.net.8333: tcp 0
23:34:10.950649 IP pool-108-20-207-31.bstnma.fios.verizon.net.8333 > tom-Latitude-3570.33922: tcp 1382
23:34:10.950662 IP pool-108-20-207-31.bstnma.fios.verizon.net.8333 > tom-Latitude-3570.33922: tcp 1382
23:34:10.950690 IP tom-Latitude-3570.33922 > pool-108-20-207-31.bstnma.fios.verizon.net.8333: tcp 0
23:34:10.952925 IP pool-108-20-207-31.bstnma.fios.verizon.net.8333 > tom-Latitude-3570.33922: tcp 1382
23:34:10.956682 IP pool-108-20-207-31.bstnma.fios.verizon.net.8333 > tom-Latitude-3570.33922: tcp 1382
23:34:10.956708 IP tom-Latitude-3570.33922 > pool-108-20-207-31.bstnma.fios.verizon.net.8333: tcp 0
23:34:10.959934 IP pool-108-20-207-31.bstnma.fios.verizon.net.8333 > tom-Latitude-3570.33922: tcp 1382
23:34:10.963901 IP pool-108-20-207-31.bstnma.fios.verizon.net.8333 > tom-Latitude-3570.33922: tcp 1382
23:34:10.963920 IP tom-Latitude-3570.33922 > pool-108-20-207-31.bstnma.fios.verizon.net.8333: tcp 0
23:34:10.968007 IP pool-108-20-207-31.bstnma.fios.verizon.net.8333 > tom-Latitude-3570.33922: tcp 864
23:34:10.968030 IP tom-Latitude-3570.33922 > pool-108-20-207-31.bstnma.fios.verizon.net.8333: tcp 0
23:34:10.968591 IP pool-108-20-207-31.bstnma.fios.verizon.net.8333 > tom-Latitude-3570.33922: tcp 0
23:34:11.001390 IP host93-234-110-95.serverdedicati.aruba.it.8333 > tom-Latitude-3570.34082: tcp 0
23:34:11.056245 IP c-73-101-52-184.hsd1.pa.comcast.net.8333 > tom-Latitude-3570.59818: tcp 24
23:34:11.056259 IP c-73-101-52-184.hsd1.pa.comcast.net.8333 > tom-Latitude-3570.59818: tcp 249
23:34:11.056265 IP c-73-101-52-184.hsd1.pa.comcast.net.8333 > tom-Latitude-3570.59818: tcp 24
23:34:11.056268 IP c-73-101-52-184.hsd1.pa.comcast.net.8333 > tom-Latitude-3570.59818: tcp 225
23:34:11.056270 IP host93-234-110-95.serverdedicati.aruba.it.8333 > tom-Latitude-3570.34082: tcp 0
23:34:11.056293 IP tom-Latitude-3570.59818 > c-73-101-52-184.hsd1.pa.comcast.net.8333: tcp 0
23:34:11.070257 IP 184-101-12-201.phnx.qwest.net.8333 > tom-Latitude-3570.54046: tcp 1382
23:34:11.071124 IP 184-101-12-201.phnx.qwest.net.8333 > tom-Latitude-3570.54046: tcp 1382
23:34:11.071258 IP tom-Latitude-3570.54046 > 184-101-12-201.phnx.qwest.net.8333: tcp 0
23:34:11.078133 IP 184-101-12-201.phnx.qwest.net.8333 > tom-Latitude-3570.54046: tcp 1382
23:34:11.078948 IP 184-101-12-201.phnx.qwest.net.8333 > tom-Latitude-3570.54046: tcp 1382
23:34:11.078973 IP tom-Latitude-3570.54046 > 184-101-12-201.phnx.qwest.net.8333: tcp 0
23:34:11.081743 IP 184-101-12-201.phnx.qwest.net.8333 > tom-Latitude-3570.54046: tcp 1382
23:34:11.085498 IP 184-101-12-201.phnx.qwest.net.8333 > tom-Latitude-3570.54046: tcp 1382
23:34:11.085550 IP tom-Latitude-3570.54046 > 184-101-12-201.phnx.qwest.net.8333: tcp 0
23:34:11.092133 IP 184-101-12-201.phnx.qwest.net.8333 > tom-Latitude-3570.54046: tcp 1382
23:34:11.092857 IP 184-101-12-201.phnx.qwest.net.8333 > tom-Latitude-3570.54046: tcp 1330
23:34:11.092882 IP tom-Latitude-3570.54046 > 184-101-12-201.phnx.qwest.net.8333: tcp 0
23:34:11.093435 IP tom-Latitude-3570.54046 > 184-101-12-201.phnx.qwest.net.8333: tcp 24
23:34:11.093443 IP tom-Latitude-3570.54046 > 184-101-12-201.phnx.qwest.net.8333: tcp 37
23:34:11.094228 IP tom-Latitude-3570.54046 > 184-101-12-201.phnx.qwest.net.8333: tcp 61
23:34:11.101639 IP pool-108-20-207-31.bstnma.fios.verizon.net.8333 > tom-Latitude-3570.33922: tcp 24
23:34:11.101645 IP 184-101-12-201.phnx.qwest.net.8333 > tom-Latitude-3570.54046: tcp 1382
23:34:11.101662 IP tom-Latitude-3570.33922 > pool-108-20-207-31.bstnma.fios.verizon.net.8333: tcp 0
23:34:11.106785 IP pool-108-20-207-31.bstnma.fios.verizon.net.8333 > tom-Latitude-3570.33922: tcp 1460
23:34:11.106808 IP tom-Latitude-3570.33922 > pool-108-20-207-31.bstnma.fios.verizon.net.8333: tcp 0
23:34:11.112145 IP pool-108-20-207-31.bstnma.fios.verizon.net.8333 > tom-Latitude-3570.33922: tcp 1154
23:34:11.112166 IP tom-Latitude-3570.33922 > pool-108-20-207-31.bstnma.fios.verizon.net.8333: tcp 0
23:34:11.112858 IP pool-108-20-207-31.bstnma.fios.verizon.net.8333 > tom-Latitude-3570.33922: tcp 24
23:34:11.112865 IP pool-108-20-207-31.bstnma.fios.verizon.net.8333 > tom-Latitude-3570.33922: tcp 762
23:34:11.112879 IP tom-Latitude-3570.33922 > pool-108-20-207-31.bstnma.fios.verizon.net.8333: tcp 0
23:34:11.116681 IP pool-108-20-207-31.bstnma.fios.verizon.net.8333 > tom-Latitude-3570.33922: tcp 24
23:34:11.116716 IP tom-Latitude-3570.33922 > pool-108-20-207-31.bstnma.fios.verizon.net.8333: tcp 0
23:34:11.143701 IP tom-Latitude-3570.54046 > 184-101-12-201.phnx.qwest.net.8333: tcp 0
23:34:11.173908 IP 172.214.77.34.bc.googleusercontent.com.8333 > tom-Latitude-3570.56244: tcp 0
23:34:11.174507 IP pool-108-20-207-31.bstnma.fios.verizon.net.8333 > tom-Latitude-3570.33922: tcp 0
23:34:11.200798 IP pool-108-20-207-31.bstnma.fios.verizon.net.8333 > tom-Latitude-3570.33922: tcp 0
23:34:11.340227 IP host93-234-110-95.serverdedicati.aruba.it.8333 > tom-Latitude-3570.34082: tcp 0
23:34:11.340825 IP 172.214.77.34.bc.googleusercontent.com.8333 > tom-Latitude-3570.56244: tcp 0
23:34:11.376093 IP c-73-101-52-184.hsd1.pa.comcast.net.8333 > tom-Latitude-3570.59818: tcp 1382
23:34:11.379740 IP c-73-101-52-184.hsd1.pa.comcast.net.8333 > tom-Latitude-3570.59818: tcp 1382
23:34:11.379782 IP tom-Latitude-3570.59818 > c-73-101-52-184.hsd1.pa.comcast.net.8333: tcp 0
23:34:11.382794 IP c-73-101-52-184.hsd1.pa.comcast.net.8333 > tom-Latitude-3570.59818: tcp 1382
23:34:11.387809 IP c-73-101-52-184.hsd1.pa.comcast.net.8333 > tom-Latitude-3570.59818: tcp 1382
23:34:11.387835 IP tom-Latitude-3570.59818 > c-73-101-52-184.hsd1.pa.comcast.net.8333: tcp 0
23:34:11.390444 IP c-73-101-52-184.hsd1.pa.comcast.net.8333 > tom-Latitude-3570.59818: tcp 177
23:34:11.390840 IP tom-Latitude-3570.59818 > c-73-101-52-184.hsd1.pa.comcast.net.8333: tcp 24
23:34:11.390852 IP tom-Latitude-3570.59818 > c-73-101-52-184.hsd1.pa.comcast.net.8333: tcp 181
23:34:11.397101 IP host93-234-110-95.serverdedicati.aruba.it.8333 > tom-Latitude-3570.34082: tcp 1382
23:34:11.397109 IP host93-234-110-95.serverdedicati.aruba.it.8333 > tom-Latitude-3570.34082: tcp 1382
23:34:11.397124 IP tom-Latitude-3570.34082 > host93-234-110-95.serverdedicati.aruba.it.8333: tcp 0
23:34:11.406283 IP 97-82-78-25.dhcp.leds.al.charter.com.8333 > tom-Latitude-3570.47742: tcp 0
23:34:11.406291 IP 52.56.97.80.8333 > tom-Latitude-3570.36650: tcp 0
23:34:11.406298 IP 97-82-78-25.dhcp.leds.al.charter.com.8333 > tom-Latitude-3570.47742: tcp 0
23:34:11.406303 IP tom-Latitude-3570.47742 > 97-82-78-25.dhcp.leds.al.charter.com.8333: tcp 61
23:34:11.518092 IP 97-82-78-25.dhcp.leds.al.charter.com.8333 > tom-Latitude-3570.47742: tcp 0
23:34:11.547864 IP 184-101-12-201.phnx.qwest.net.8333 > tom-Latitude-3570.54046: tcp 0
23:34:11.616490 IP host93-234-110-95.serverdedicati.aruba.it.8333 > tom-Latitude-3570.34082: tcp 1382
23:34:11.617148 IP host93-234-110-95.serverdedicati.aruba.it.8333 > tom-Latitude-3570.34082: tcp 1382
23:34:11.617197 IP tom-Latitude-3570.34082 > host93-234-110-95.serverdedicati.aruba.it.8333: tcp 0
23:34:11.628649 IP host93-234-110-95.serverdedicati.aruba.it.8333 > tom-Latitude-3570.34082: tcp 1382
23:34:11.628660 IP host93-234-110-95.serverdedicati.aruba.it.8333 > tom-Latitude-3570.34082: tcp 1382
23:34:11.628687 IP tom-Latitude-3570.34082 > host93-234-110-95.serverdedicati.aruba.it.8333: tcp 0
23:34:11.630147 IP host93-234-110-95.serverdedicati.aruba.it.8333 > tom-Latitude-3570.34082: tcp 1382
23:34:11.633687 IP host93-234-110-95.serverdedicati.aruba.it.8333 > tom-Latitude-3570.34082: tcp 359
23:34:11.633709 IP tom-Latitude-3570.34082 > host93-234-110-95.serverdedicati.aruba.it.8333: tcp 0
23:34:11.692849 IP 97-82-78-25.dhcp.leds.al.charter.com.8333 > tom-Latitude-3570.47742: tcp 24
23:34:11.692907 IP 97-82-78-25.dhcp.leds.al.charter.com.8333 > tom-Latitude-3570.47742: tcp 534
23:34:11.692914 IP 97-82-78-25.dhcp.leds.al.charter.com.8333 > tom-Latitude-3570.47742: tcp 24
23:34:11.692916 IP 97-82-78-25.dhcp.leds.al.charter.com.8333 > tom-Latitude-3570.47742: tcp 443
23:34:11.692945 IP tom-Latitude-3570.47742 > 97-82-78-25.dhcp.leds.al.charter.com.8333: tcp 0
23:34:11.693296 IP tom-Latitude-3570.47742 > 97-82-78-25.dhcp.leds.al.charter.com.8333: tcp 24
23:34:11.693314 IP tom-Latitude-3570.47742 > 97-82-78-25.dhcp.leds.al.charter.com.8333: tcp 37
23:34:11.747478 IP 97-82-78-25.dhcp.leds.al.charter.com.8333 > tom-Latitude-3570.47742: tcp 1382
23:34:11.750220 IP 172.214.77.34.bc.googleusercontent.com.8333 > tom-Latitude-3570.56244: tcp 1382
23:34:11.756907 IP 97-82-78-25.dhcp.leds.al.charter.com.8333 > tom-Latitude-3570.47742: tcp 1382
23:34:11.756942 IP tom-Latitude-3570.47742 > 97-82-78-25.dhcp.leds.al.charter.com.8333: tcp 0
23:34:11.762249 IP 172.214.77.34.bc.googleusercontent.com.8333 > tom-Latitude-3570.56244: tcp 1382
23:34:11.762271 IP tom-Latitude-3570.56244 > 172.214.77.34.bc.googleusercontent.com.8333: tcp 0
23:34:11.766728 IP 97-82-78-25.dhcp.leds.al.charter.com.8333 > tom-Latitude-3570.47742: tcp 1382
23:34:11.766735 IP 172.214.77.34.bc.googleusercontent.com.8333 > tom-Latitude-3570.56244: tcp 1382
23:34:11.772638 IP 97-82-78-25.dhcp.leds.al.charter.com.8333 > tom-Latitude-3570.47742: tcp 1382
23:34:11.772658 IP tom-Latitude-3570.47742 > 97-82-78-25.dhcp.leds.al.charter.com.8333: tcp 0
23:34:11.777965 IP 172.214.77.34.bc.googleusercontent.com.8333 > tom-Latitude-3570.56244: tcp 1382
23:34:11.777977 IP tom-Latitude-3570.56244 > 172.214.77.34.bc.googleusercontent.com.8333: tcp 0
23:34:11.781123 IP 97-82-78-25.dhcp.leds.al.charter.com.8333 > tom-Latitude-3570.47742: tcp 1382
23:34:11.781856 IP 97-82-78-25.dhcp.leds.al.charter.com.8333 > tom-Latitude-3570.47742: tcp 1382
23:34:11.781942 IP tom-Latitude-3570.47742 > 97-82-78-25.dhcp.leds.al.charter.com.8333: tcp 0
23:34:11.784647 IP 172.214.77.34.bc.googleusercontent.com.8333 > tom-Latitude-3570.56244: tcp 1382
23:34:11.785142 IP tom-Latitude-3570.56244 > 172.214.77.34.bc.googleusercontent.com.8333: tcp 24
23:34:11.785150 IP tom-Latitude-3570.56244 > 172.214.77.34.bc.googleusercontent.com.8333: tcp 37
23:34:11.787685 IP 172.214.77.34.bc.googleusercontent.com.8333 > tom-Latitude-3570.56244: tcp 342
23:34:11.791893 IP 97-82-78-25.dhcp.leds.al.charter.com.8333 > tom-Latitude-3570.47742: tcp 1382
23:34:11.792776 IP 97-82-78-25.dhcp.leds.al.charter.com.8333 > tom-Latitude-3570.47742: tcp 1382
23:34:11.792789 IP tom-Latitude-3570.47742 > 97-82-78-25.dhcp.leds.al.charter.com.8333: tcp 0
23:34:11.816190 IP 59.110.157.16.8333 > tom-Latitude-3570.47822: tcp 1382
23:34:11.819286 IP 97-82-78-25.dhcp.leds.al.charter.com.8333 > tom-Latitude-3570.47742: tcp 1382
23:34:11.819726 IP 97-82-78-25.dhcp.leds.al.charter.com.8333 > tom-Latitude-3570.47742: tcp 46
23:34:11.819790 IP tom-Latitude-3570.47742 > 97-82-78-25.dhcp.leds.al.charter.com.8333: tcp 0
23:34:11.822847 IP 59.110.157.16.8333 > tom-Latitude-3570.47822: tcp 1382
23:34:11.823017 IP tom-Latitude-3570.47822 > 59.110.157.16.8333: tcp 0
23:34:11.825905 IP 59.110.157.16.8333 > tom-Latitude-3570.47822: tcp 1382
23:34:11.829832 IP 59.110.157.16.8333 > tom-Latitude-3570.47822: tcp 1382
23:34:11.829920 IP tom-Latitude-3570.47822 > 59.110.157.16.8333: tcp 0
23:34:11.831697 IP tom-Latitude-3570.56244 > 172.214.77.34.bc.googleusercontent.com.8333: tcp 0
23:34:11.836345 IP 184-101-12-201.phnx.qwest.net.8333 > tom-Latitude-3570.54046: tcp 1382
23:34:11.840567 IP 184-101-12-201.phnx.qwest.net.8333 > tom-Latitude-3570.54046: tcp 1382
23:34:11.840699 IP tom-Latitude-3570.54046 > 184-101-12-201.phnx.qwest.net.8333: tcp 0
23:34:11.844348 IP 184-101-12-201.phnx.qwest.net.8333 > tom-Latitude-3570.54046: tcp 1382
23:34:11.848254 IP 184-101-12-201.phnx.qwest.net.8333 > tom-Latitude-3570.54046: tcp 1382
23:34:11.848486 IP tom-Latitude-3570.54046 > 184-101-12-201.phnx.qwest.net.8333: tcp 0
23:34:11.849008 IP 184-101-12-201.phnx.qwest.net.8333 > tom-Latitude-3570.54046: tcp 1382
23:34:11.855967 IP 184-101-12-201.phnx.qwest.net.8333 > tom-Latitude-3570.54046: tcp 348
23:34:11.856005 IP tom-Latitude-3570.54046 > 184-101-12-201.phnx.qwest.net.8333: tcp 0
23:34:11.856325 IP tom-Latitude-3570.54046 > 184-101-12-201.phnx.qwest.net.8333: tcp 24
23:34:11.856334 IP tom-Latitude-3570.54046 > 184-101-12-201.phnx.qwest.net.8333: tcp 37
23:34:11.856784 IP 59.110.157.16.8333 > tom-Latitude-3570.47822: tcp 1382
23:34:11.859367 IP 59.110.157.16.8333 > tom-Latitude-3570.47822: tcp 1382
23:34:11.859387 IP tom-Latitude-3570.47822 > 59.110.157.16.8333: tcp 0
23:34:11.862561 IP 59.110.157.16.8333 > tom-Latitude-3570.47822: tcp 1382
23:34:11.867522 IP 59.110.157.16.8333 > tom-Latitude-3570.47822: tcp 1382
23:34:11.867536 IP 59.110.157.16.8333 > tom-Latitude-3570.47822: tcp 1382
23:34:11.867574 IP tom-Latitude-3570.47822 > 59.110.157.16.8333: tcp 0
23:34:11.874190 IP 59.110.157.16.8333 > tom-Latitude-3570.47822: tcp 1382
23:34:11.882043 IP 59.110.157.16.8333 > tom-Latitude-3570.47822: tcp 1382
23:34:11.882094 IP tom-Latitude-3570.47822 > 59.110.157.16.8333: tcp 0
23:34:11.885057 IP 59.110.157.16.8333 > tom-Latitude-3570.47822: tcp 1382
23:34:11.889807 IP 59.110.157.16.8333 > tom-Latitude-3570.47822: tcp 1382
23:34:11.889824 IP 59.110.157.16.8333 > tom-Latitude-3570.47822: tcp 1382
23:34:11.889861 IP tom-Latitude-3570.47822 > 59.110.157.16.8333: tcp 0
23:34:11.894673 IP tom-Latitude-3570.47822 > 59.110.157.16.8333: tcp 24
23:34:11.894686 IP tom-Latitude-3570.47822 > 59.110.157.16.8333: tcp 1117
23:34:11.920162 IP 59.110.157.16.8333 > tom-Latitude-3570.47822: tcp 1382
23:34:11.920976 IP 59.110.157.16.8333 > tom-Latitude-3570.47822: tcp 1382
23:34:11.921003 IP tom-Latitude-3570.47822 > 59.110.157.16.8333: tcp 0
23:34:11.923557 IP 52.56.97.80.8333 > tom-Latitude-3570.36650: tcp 1382
23:34:11.932136 IP 52.56.97.80.8333 > tom-Latitude-3570.36650: tcp 1382
23:34:11.932218 IP tom-Latitude-3570.36650 > 52.56.97.80.8333: tcp 0
23:34:11.935996 IP 52.56.97.80.8333 > tom-Latitude-3570.36650: tcp 1382
23:34:11.936302 IP tom-Latitude-3570.36650 > 52.56.97.80.8333: tcp 24
23:34:11.936317 IP tom-Latitude-3570.36650 > 52.56.97.80.8333: tcp 37
23:34:11.944651 IP 52.56.97.80.8333 > tom-Latitude-3570.36650: tcp 1382
23:34:11.948145 IP 52.56.97.80.8333 > tom-Latitude-3570.36650: tcp 1382
23:34:11.948263 IP tom-Latitude-3570.36650 > 52.56.97.80.8333: tcp 0
23:34:11.958386 IP 52.56.97.80.8333 > tom-Latitude-3570.36650: tcp 1382
23:34:11.959373 IP 52.56.97.80.8333 > tom-Latitude-3570.36650: tcp 1382
23:34:11.959379 IP 52.56.97.80.8333 > tom-Latitude-3570.36650: tcp 1382
23:34:11.959458 IP tom-Latitude-3570.36650 > 52.56.97.80.8333: tcp 0
23:34:11.965879 IP 52.56.97.80.8333 > tom-Latitude-3570.36650: tcp 607
23:34:12.007916 IP tom-Latitude-3570.36650 > 52.56.97.80.8333: tcp 0
23:34:12.010553 IP 97-82-78-25.dhcp.leds.al.charter.com.8333 > tom-Latitude-3570.47742: tcp 0
23:34:12.010580 IP tom-Latitude-3570.47742 > 97-82-78-25.dhcp.leds.al.charter.com.8333: tcp 1382
23:34:12.010589 IP tom-Latitude-3570.47742 > 97-82-78-25.dhcp.leds.al.charter.com.8333: tcp 1382
23:34:12.174053 IP 172.214.77.34.bc.googleusercontent.com.8333 > tom-Latitude-3570.56244: tcp 0
23:34:12.234173 IP 172.214.77.34.bc.googleusercontent.com.8333 > tom-Latitude-3570.56244: tcp 24
23:34:12.234303 IP tom-Latitude-3570.56244 > 172.214.77.34.bc.googleusercontent.com.8333: tcp 0
23:34:12.235009 IP 172.214.77.34.bc.googleusercontent.com.8333 > tom-Latitude-3570.56244: tcp 225
23:34:12.235025 IP 172.214.77.34.bc.googleusercontent.com.8333 > tom-Latitude-3570.56244: tcp 24
23:34:12.235030 IP 172.214.77.34.bc.googleusercontent.com.8333 > tom-Latitude-3570.56244: tcp 224
23:34:12.235032 IP 172.214.77.34.bc.googleusercontent.com.8333 > tom-Latitude-3570.56244: tcp 24
23:34:12.235035 IP 172.214.77.34.bc.googleusercontent.com.8333 > tom-Latitude-3570.56244: tcp 190
23:34:12.235036 IP 172.214.77.34.bc.googleusercontent.com.8333 > tom-Latitude-3570.56244: tcp 24
23:34:12.235038 IP 172.214.77.34.bc.googleusercontent.com.8333 > tom-Latitude-3570.56244: tcp 222
23:34:12.235040 IP 172.214.77.34.bc.googleusercontent.com.8333 > tom-Latitude-3570.56244: tcp 24
23:34:12.235130 IP tom-Latitude-3570.56244 > 172.214.77.34.bc.googleusercontent.com.8333: tcp 0
23:34:12.235802 IP tom-Latitude-3570.56244 > 172.214.77.34.bc.googleusercontent.com.8333: tcp 24
23:34:12.235820 IP tom-Latitude-3570.56244 > 172.214.77.34.bc.googleusercontent.com.8333: tcp 37
23:34:12.236822 IP tom-Latitude-3570.56244 > 172.214.77.34.bc.googleusercontent.com.8333: tcp 122
23:34:12.238472 IP 172.214.77.34.bc.googleusercontent.com.8333 > tom-Latitude-3570.56244: tcp 224
23:34:12.269897 IP host93-234-110-95.serverdedicati.aruba.it.8333 > tom-Latitude-3570.34082: tcp 24
23:34:12.270013 IP tom-Latitude-3570.34082 > host93-234-110-95.serverdedicati.aruba.it.8333: tcp 0
23:34:12.277367 IP host93-234-110-95.serverdedicati.aruba.it.8333 > tom-Latitude-3570.34082: tcp 1189
23:34:12.277486 IP tom-Latitude-3570.34082 > host93-234-110-95.serverdedicati.aruba.it.8333: tcp 0
23:34:12.277970 IP tom-Latitude-3570.34082 > host93-234-110-95.serverdedicati.aruba.it.8333: tcp 24
23:34:12.277990 IP tom-Latitude-3570.34082 > host93-234-110-95.serverdedicati.aruba.it.8333: tcp 145
23:34:12.279787 IP tom-Latitude-3570.56244 > 172.214.77.34.bc.googleusercontent.com.8333: tcp 0
23:34:14.220749 IP 184-101-12-201.phnx.qwest.net.8333 > tom-Latitude-3570.54046: tcp 0
23:34:14.220763 IP 184-101-12-201.phnx.qwest.net.8333 > tom-Latitude-3570.54046: tcp 0
23:34:14.231223 IP c-73-101-52-184.hsd1.pa.comcast.net.8333 > tom-Latitude-3570.59818: tcp 24
23:34:14.231876 IP c-73-101-52-184.hsd1.pa.comcast.net.8333 > tom-Latitude-3570.59818: tcp 829
23:34:14.232005 IP tom-Latitude-3570.59818 > c-73-101-52-184.hsd1.pa.comcast.net.8333: tcp 0
23:34:14.232394 IP tom-Latitude-3570.59818 > c-73-101-52-184.hsd1.pa.comcast.net.8333: tcp 24
23:34:14.256234 IP 184-101-12-201.phnx.qwest.net.8333 > tom-Latitude-3570.54046: tcp 0
23:34:14.286608 IP c-73-101-52-184.hsd1.pa.comcast.net.8333 > tom-Latitude-3570.59818: tcp 0
23:34:14.286619 IP tom-Latitude-3570.59818 > c-73-101-52-184.hsd1.pa.comcast.net.8333: tcp 253
23:34:14.287847 IP c-73-101-52-184.hsd1.pa.comcast.net.8333 > tom-Latitude-3570.59818: tcp 0
23:34:14.293932 IP 97-82-78-25.dhcp.leds.al.charter.com.8333 > tom-Latitude-3570.47742: tcp 0
23:34:14.323278 IP 59.110.157.16.8333 > tom-Latitude-3570.47822: tcp 1382
23:34:14.323299 IP 59.110.157.16.8333 > tom-Latitude-3570.47822: tcp 1382
23:34:14.323303 IP 59.110.157.16.8333 > tom-Latitude-3570.47822: tcp 1382
23:34:14.323394 IP tom-Latitude-3570.47822 > 59.110.157.16.8333: tcp 0
23:34:14.325933 IP 59.110.157.16.8333 > tom-Latitude-3570.47822: tcp 1382
23:34:14.351543 IP 59.110.157.16.8333 > tom-Latitude-3570.47822: tcp 1382
23:34:14.351684 IP tom-Latitude-3570.47822 > 59.110.157.16.8333: tcp 0
23:34:14.354373 IP 59.110.157.16.8333 > tom-Latitude-3570.47822: tcp 1382
23:34:14.355302 IP 59.110.157.16.8333 > tom-Latitude-3570.47822: tcp 1382
23:34:14.355308 IP 59.110.157.16.8333 > tom-Latitude-3570.47822: tcp 1382
23:34:14.355326 IP tom-Latitude-3570.47822 > 59.110.157.16.8333: tcp 0
23:34:14.371420 IP 59.110.157.16.8333 > tom-Latitude-3570.47822: tcp 1382
23:34:14.376640 IP 59.110.157.16.8333 > tom-Latitude-3570.47822: tcp 1382
23:34:14.376652 IP 59.110.157.16.8333 > tom-Latitude-3570.47822: tcp 1382
23:34:14.376655 IP 59.110.157.16.8333 > tom-Latitude-3570.47822: tcp 1382
23:34:14.376658 IP 59.110.157.16.8333 > tom-Latitude-3570.47822: tcp 1382
23:34:14.376662 IP 59.110.157.16.8333 > tom-Latitude-3570.47822: tcp 1382
23:34:14.376664 IP 97-82-78-25.dhcp.leds.al.charter.com.8333 > tom-Latitude-3570.47742: tcp 0
23:34:14.376669 IP 59.110.157.16.8333 > tom-Latitude-3570.47822: tcp 1382
23:34:14.376672 IP 59.110.157.16.8333 > tom-Latitude-3570.47822: tcp 1382
23:34:14.376673 IP 97-82-78-25.dhcp.leds.al.charter.com.8333 > tom-Latitude-3570.47742: tcp 0
23:34:14.376676 IP 52.56.97.80.8333 > tom-Latitude-3570.36650: tcp 934
23:34:14.376677 IP tom-Latitude-3570.47822 > 59.110.157.16.8333: tcp 0
23:34:14.376692 IP 172.214.77.34.bc.googleusercontent.com.8333 > tom-Latitude-3570.56244: tcp 0
23:34:14.376700 IP 172.214.77.34.bc.googleusercontent.com.8333 > tom-Latitude-3570.56244: tcp 0
23:34:14.376701 IP tom-Latitude-3570.56244 > 172.214.77.34.bc.googleusercontent.com.8333: tcp 499
23:34:14.376702 IP 184-101-12-201.phnx.qwest.net.8333 > tom-Latitude-3570.54046: tcp 0
23:34:14.376723 IP 184-101-12-201.phnx.qwest.net.8333 > tom-Latitude-3570.54046: tcp 0
23:34:14.376769 IP tom-Latitude-3570.36650 > 52.56.97.80.8333: tcp 0
23:34:14.376785 IP tom-Latitude-3570.47822 > 59.110.157.16.8333: tcp 0
23:34:14.422954 IP 172.214.77.34.bc.googleusercontent.com.8333 > tom-Latitude-3570.56244: tcp 24
23:34:14.423069 IP tom-Latitude-3570.56244 > 172.214.77.34.bc.googleusercontent.com.8333: tcp 0
23:34:14.426090 IP 172.214.77.34.bc.googleusercontent.com.8333 > tom-Latitude-3570.56244: tcp 283
23:34:14.426207 IP tom-Latitude-3570.56244 > 172.214.77.34.bc.googleusercontent.com.8333: tcp 0
23:34:14.426489 IP tom-Latitude-3570.56244 > 172.214.77.34.bc.googleusercontent.com.8333: tcp 24
23:34:14.426502 IP tom-Latitude-3570.56244 > 172.214.77.34.bc.googleusercontent.com.8333: tcp 37
23:34:14.433676 IP 59.110.157.16.8333 > tom-Latitude-3570.47822: tcp 0
23:34:14.459830 IP 97-82-78-25.dhcp.leds.al.charter.com.8333 > tom-Latitude-3570.47742: tcp 24
23:34:14.460725 IP 97-82-78-25.dhcp.leds.al.charter.com.8333 > tom-Latitude-3570.47742: tcp 817
23:34:14.460849 IP tom-Latitude-3570.47742 > 97-82-78-25.dhcp.leds.al.charter.com.8333: tcp 0
23:34:14.503067 IP 59.110.157.16.8333 > tom-Latitude-3570.47822: tcp 0
23:34:14.503624 IP 52.56.97.80.8333 > tom-Latitude-3570.36650: tcp 0
23:34:14.506724 IP 52.56.97.80.8333 > tom-Latitude-3570.36650: tcp 0
23:34:14.510076 IP 97-82-78-25.dhcp.leds.al.charter.com.8333 > tom-Latitude-3570.47742: tcp 24
23:34:14.510093 IP 97-82-78-25.dhcp.leds.al.charter.com.8333 > tom-Latitude-3570.47742: tcp 37
23:34:14.510202 IP tom-Latitude-3570.47742 > 97-82-78-25.dhcp.leds.al.charter.com.8333: tcp 0
23:34:14.566039 IP 52.56.97.80.8333 > tom-Latitude-3570.36650: tcp 24
23:34:14.566170 IP tom-Latitude-3570.36650 > 52.56.97.80.8333: tcp 0
23:34:14.566681 IP 52.56.97.80.8333 > tom-Latitude-3570.36650: tcp 225
23:34:14.566791 IP tom-Latitude-3570.36650 > 52.56.97.80.8333: tcp 0
23:34:14.567169 IP tom-Latitude-3570.36650 > 52.56.97.80.8333: tcp 24
23:34:14.568549 IP tom-Latitude-3570.36650 > 52.56.97.80.8333: tcp 37
23:34:14.660910 IP 97-82-78-25.dhcp.leds.al.charter.com.8333 > tom-Latitude-3570.47742: tcp 0
23:34:14.684228 IP 52.56.97.80.8333 > tom-Latitude-3570.36650: tcp 24
23:34:14.684990 IP 52.56.97.80.8333 > tom-Latitude-3570.36650: tcp 721
23:34:14.685104 IP tom-Latitude-3570.36650 > 52.56.97.80.8333: tcp 0
23:34:14.685510 IP tom-Latitude-3570.36650 > 52.56.97.80.8333: tcp 24
23:34:14.685524 IP tom-Latitude-3570.36650 > 52.56.97.80.8333: tcp 37
23:34:14.736694 IP 172.214.77.34.bc.googleusercontent.com.8333 > tom-Latitude-3570.56244: tcp 0
23:34:14.739783 IP 172.214.77.34.bc.googleusercontent.com.8333 > tom-Latitude-3570.56244: tcp 0
23:34:14.746696 IP 172.214.77.34.bc.googleusercontent.com.8333 > tom-Latitude-3570.56244: tcp 0
23:34:14.772058 IP host93-234-110-95.serverdedicati.aruba.it.8333 > tom-Latitude-3570.34082: tcp 0
23:34:14.790634 IP 97-82-78-25.dhcp.leds.al.charter.com.8333 > tom-Latitude-3570.47742: tcp 24
23:34:14.791415 IP 97-82-78-25.dhcp.leds.al.charter.com.8333 > tom-Latitude-3570.47742: tcp 73
23:34:14.791431 IP 97-82-78-25.dhcp.leds.al.charter.com.8333 > tom-Latitude-3570.47742: tcp 24
23:34:14.791433 IP 97-82-78-25.dhcp.leds.al.charter.com.8333 > tom-Latitude-3570.47742: tcp 37
23:34:14.791436 IP 97-82-78-25.dhcp.leds.al.charter.com.8333 > tom-Latitude-3570.47742: tcp 24
23:34:14.791437 IP 97-82-78-25.dhcp.leds.al.charter.com.8333 > tom-Latitude-3570.47742: tcp 37
23:34:14.791439 IP 97-82-78-25.dhcp.leds.al.charter.com.8333 > tom-Latitude-3570.47742: tcp 24
23:34:14.791441 IP 97-82-78-25.dhcp.leds.al.charter.com.8333 > tom-Latitude-3570.47742: tcp 253
23:34:14.791536 IP tom-Latitude-3570.47742 > 97-82-78-25.dhcp.leds.al.charter.com.8333: tcp 0
23:34:14.794292 IP host93-234-110-95.serverdedicati.aruba.it.8333 > tom-Latitude-3570.34082: tcp 0
23:34:14.794971 IP 184-101-12-201.phnx.qwest.net.8333 > tom-Latitude-3570.54046: tcp 24
23:34:14.794986 IP 184-101-12-201.phnx.qwest.net.8333 > tom-Latitude-3570.54046: tcp 283
23:34:14.795093 IP tom-Latitude-3570.54046 > 184-101-12-201.phnx.qwest.net.8333: tcp 0
23:34:14.795419 IP tom-Latitude-3570.54046 > 184-101-12-201.phnx.qwest.net.8333: tcp 24
23:34:14.795433 IP tom-Latitude-3570.54046 > 184-101-12-201.phnx.qwest.net.8333: tcp 37
23:34:14.806243 IP 172.214.77.34.bc.googleusercontent.com.8333 > tom-Latitude-3570.56244: tcp 24
23:34:14.806923 IP 172.214.77.34.bc.googleusercontent.com.8333 > tom-Latitude-3570.56244: tcp 37
23:34:14.806939 IP 172.214.77.34.bc.googleusercontent.com.8333 > tom-Latitude-3570.56244: tcp 24
23:34:14.806942 IP 172.214.77.34.bc.googleusercontent.com.8333 > tom-Latitude-3570.56244: tcp 37
23:34:14.806944 IP 172.214.77.34.bc.googleusercontent.com.8333 > tom-Latitude-3570.56244: tcp 24
23:34:14.806945 IP 172.214.77.34.bc.googleusercontent.com.8333 > tom-Latitude-3570.56244: tcp 37
23:34:14.807033 IP tom-Latitude-3570.56244 > 172.214.77.34.bc.googleusercontent.com.8333: tcp 0
23:34:14.809696 IP 184-101-12-201.phnx.qwest.net.8333 > tom-Latitude-3570.54046: tcp 24
23:34:14.827330 IP 184-101-12-201.phnx.qwest.net.8333 > tom-Latitude-3570.54046: tcp 1440
23:34:14.827395 IP tom-Latitude-3570.54046 > 184-101-12-201.phnx.qwest.net.8333: tcp 0
23:34:14.829299 IP 184-101-12-201.phnx.qwest.net.8333 > tom-Latitude-3570.54046: tcp 74
23:34:14.840114 IP 184-101-12-201.phnx.qwest.net.8333 > tom-Latitude-3570.54046: tcp 1382
23:34:14.840179 IP tom-Latitude-3570.54046 > 184-101-12-201.phnx.qwest.net.8333: tcp 0
23:34:14.843182 IP 184-101-12-201.phnx.qwest.net.8333 > tom-Latitude-3570.54046: tcp 58
23:34:14.843665 IP pool-108-20-207-31.bstnma.fios.verizon.net.8333 > tom-Latitude-3570.33922: tcp 0
23:34:14.843689 IP tom-Latitude-3570.33922 > pool-108-20-207-31.bstnma.fios.verizon.net.8333: tcp 97
23:34:14.843703 IP 184-101-12-201.phnx.qwest.net.8333 > tom-Latitude-3570.54046: tcp 95
23:34:14.843734 IP tom-Latitude-3570.54046 > 184-101-12-201.phnx.qwest.net.8333: tcp 0
23:34:14.844225 IP tom-Latitude-3570.54046 > 184-101-12-201.phnx.qwest.net.8333: tcp 24
23:34:14.844240 IP tom-Latitude-3570.54046 > 184-101-12-201.phnx.qwest.net.8333: tcp 37
23:34:14.897504 IP host93-234-110-95.serverdedicati.aruba.it.8333 > tom-Latitude-3570.34082: tcp 24
23:34:14.897523 IP host93-234-110-95.serverdedicati.aruba.it.8333 > tom-Latitude-3570.34082: tcp 225
23:34:14.897530 IP host93-234-110-95.serverdedicati.aruba.it.8333 > tom-Latitude-3570.34082: tcp 24
23:34:14.897532 IP host93-234-110-95.serverdedicati.aruba.it.8333 > tom-Latitude-3570.34082: tcp 226
23:34:14.897534 IP host93-234-110-95.serverdedicati.aruba.it.8333 > tom-Latitude-3570.34082: tcp 24
23:34:14.897540 IP host93-234-110-95.serverdedicati.aruba.it.8333 > tom-Latitude-3570.34082: tcp 1448
23:34:14.897546 IP host93-234-110-95.serverdedicati.aruba.it.8333 > tom-Latitude-3570.34082: tcp 1448
23:34:14.897578 IP tom-Latitude-3570.34082 > host93-234-110-95.serverdedicati.aruba.it.8333: tcp 0
23:34:14.898133 IP 184-101-12-201.phnx.qwest.net.8333 > tom-Latitude-3570.54046: tcp 0
23:34:14.898874 IP 184-101-12-201.phnx.qwest.net.8333 > tom-Latitude-3570.54046: tcp 0
23:34:14.903132 IP host93-234-110-95.serverdedicati.aruba.it.8333 > tom-Latitude-3570.34082: tcp 2764
23:34:14.903186 IP tom-Latitude-3570.34082 > host93-234-110-95.serverdedicati.aruba.it.8333: tcp 0
23:34:14.906749 IP host93-234-110-95.serverdedicati.aruba.it.8333 > tom-Latitude-3570.34082: tcp 1382
23:34:14.906764 IP host93-234-110-95.serverdedicati.aruba.it.8333 > tom-Latitude-3570.34082: tcp 198
23:34:14.906768 IP host93-234-110-95.serverdedicati.aruba.it.8333 > tom-Latitude-3570.34082: tcp 0
23:34:14.906801 IP tom-Latitude-3570.34082 > host93-234-110-95.serverdedicati.aruba.it.8333: tcp 0
23:34:14.918181 IP host93-234-110-95.serverdedicati.aruba.it.8333 > tom-Latitude-3570.34082: tcp 0
23:34:14.932180 IP host93-234-110-95.serverdedicati.aruba.it.8333 > tom-Latitude-3570.34082: tcp 0
23:34:14.932767 IP host93-234-110-95.serverdedicati.aruba.it.8333 > tom-Latitude-3570.34082: tcp 0
23:34:14.936916 IP 59.110.157.16.8333 > tom-Latitude-3570.47822: tcp 0
23:34:14.970225 IP host93-234-110-95.serverdedicati.aruba.it.8333 > tom-Latitude-3570.34082: tcp 1382
23:34:14.970797 IP host93-234-110-95.serverdedicati.aruba.it.8333 > tom-Latitude-3570.34082: tcp 66
23:34:14.970814 IP tom-Latitude-3570.34082 > host93-234-110-95.serverdedicati.aruba.it.8333: tcp 0
23:34:14.982364 IP pool-108-20-207-31.bstnma.fios.verizon.net.8333 > tom-Latitude-3570.33922: tcp 24
23:34:14.982417 IP tom-Latitude-3570.33922 > pool-108-20-207-31.bstnma.fios.verizon.net.8333: tcp 0
23:34:14.983134 IP pool-108-20-207-31.bstnma.fios.verizon.net.8333 > tom-Latitude-3570.33922: tcp 192
23:34:14.983141 IP pool-108-20-207-31.bstnma.fios.verizon.net.8333 > tom-Latitude-3570.33922: tcp 24
23:34:14.983144 IP pool-108-20-207-31.bstnma.fios.verizon.net.8333 > tom-Latitude-3570.33922: tcp 473
23:34:14.983149 IP pool-108-20-207-31.bstnma.fios.verizon.net.8333 > tom-Latitude-3570.33922: tcp 24
23:34:14.983152 IP pool-108-20-207-31.bstnma.fios.verizon.net.8333 > tom-Latitude-3570.33922: tcp 192
23:34:14.983154 IP pool-108-20-207-31.bstnma.fios.verizon.net.8333 > tom-Latitude-3570.33922: tcp 24
23:34:14.983157 IP pool-108-20-207-31.bstnma.fios.verizon.net.8333 > tom-Latitude-3570.33922: tcp 283
23:34:14.983159 IP pool-108-20-207-31.bstnma.fios.verizon.net.8333 > tom-Latitude-3570.33922: tcp 24
23:34:14.983161 IP tom-Latitude-3570.33922 > pool-108-20-207-31.bstnma.fios.verizon.net.8333: tcp 0
23:34:14.983217 IP tom-Latitude-3570.33922 > pool-108-20-207-31.bstnma.fios.verizon.net.8333: tcp 0
23:34:14.983400 IP tom-Latitude-3570.33922 > pool-108-20-207-31.bstnma.fios.verizon.net.8333: tcp 24
23:34:14.983413 IP tom-Latitude-3570.33922 > pool-108-20-207-31.bstnma.fios.verizon.net.8333: tcp 37
23:34:14.983451 IP tom-Latitude-3570.54046 > 184-101-12-201.phnx.qwest.net.8333: tcp 24
23:34:14.983457 IP tom-Latitude-3570.54046 > 184-101-12-201.phnx.qwest.net.8333: tcp 73
23:34:14.984501 IP tom-Latitude-3570.33922 > pool-108-20-207-31.bstnma.fios.verizon.net.8333: tcp 122
23:34:14.987636 IP pool-108-20-207-31.bstnma.fios.verizon.net.8333 > tom-Latitude-3570.33922: tcp 284
23:34:14.987657 IP pool-108-20-207-31.bstnma.fios.verizon.net.8333 > tom-Latitude-3570.33922: tcp 24
23:34:14.987660 IP pool-108-20-207-31.bstnma.fios.verizon.net.8333 > tom-Latitude-3570.33922: tcp 284
23:34:14.987663 IP pool-108-20-207-31.bstnma.fios.verizon.net.8333 > tom-Latitude-3570.33922: tcp 24
23:34:14.987743 IP tom-Latitude-3570.33922 > pool-108-20-207-31.bstnma.fios.verizon.net.8333: tcp 0
23:34:14.990070 IP pool-108-20-207-31.bstnma.fios.verizon.net.8333 > tom-Latitude-3570.33922: tcp 284
23:34:14.990083 IP pool-108-20-207-31.bstnma.fios.verizon.net.8333 > tom-Latitude-3570.33922: tcp 24
23:34:14.990152 IP tom-Latitude-3570.33922 > pool-108-20-207-31.bstnma.fios.verizon.net.8333: tcp 0
23:34:14.992905 IP pool-108-20-207-31.bstnma.fios.verizon.net.8333 > tom-Latitude-3570.33922: tcp 284
23:34:14.992919 IP 59.110.157.16.8333 > tom-Latitude-3570.47822: tcp 0
23:34:14.992926 IP c-73-101-52-184.hsd1.pa.comcast.net.8333 > tom-Latitude-3570.59818: tcp 0
23:34:14.993709 IP host93-234-110-95.serverdedicati.aruba.it.8333 > tom-Latitude-3570.34082: tcp 1382
23:34:15.035856 IP tom-Latitude-3570.33922 > pool-108-20-207-31.bstnma.fios.verizon.net.8333: tcp 0
23:34:15.035936 IP host93-234-110-95.serverdedicati.aruba.it.8333 > tom-Latitude-3570.34082: tcp 0
23:34:15.039907 IP tom-Latitude-3570.34082 > host93-234-110-95.serverdedicati.aruba.it.8333: tcp 0
23:34:15.093706 IP tom-Latitude-3570.36650 > 52.56.97.80.8333: tcp 24
23:34:15.093727 IP tom-Latitude-3570.36650 > 52.56.97.80.8333: tcp 61
23:34:15.144489 IP c-73-101-52-184.hsd1.pa.comcast.net.8333 > tom-Latitude-3570.59818: tcp 24
23:34:15.148363 IP c-73-101-52-184.hsd1.pa.comcast.net.8333 > tom-Latitude-3570.59818: tcp 249
23:34:15.148477 IP tom-Latitude-3570.59818 > c-73-101-52-184.hsd1.pa.comcast.net.8333: tcp 0
23:34:15.148821 IP tom-Latitude-3570.59818 > c-73-101-52-184.hsd1.pa.comcast.net.8333: tcp 24
23:34:15.148837 IP tom-Latitude-3570.59818 > c-73-101-52-184.hsd1.pa.comcast.net.8333: tcp 37
23:34:15.148921 IP c-73-101-52-184.hsd1.pa.comcast.net.8333 > tom-Latitude-3570.59818: tcp 24
23:34:15.148934 IP c-73-101-52-184.hsd1.pa.comcast.net.8333 > tom-Latitude-3570.59818: tcp 404
23:34:15.148937 IP c-73-101-52-184.hsd1.pa.comcast.net.8333 > tom-Latitude-3570.59818: tcp 24
23:34:15.149011 IP tom-Latitude-3570.59818 > c-73-101-52-184.hsd1.pa.comcast.net.8333: tcp 0
23:34:15.151399 IP c-73-101-52-184.hsd1.pa.comcast.net.8333 > tom-Latitude-3570.59818: tcp 247
23:34:15.151835 IP tom-Latitude-3570.59818 > c-73-101-52-184.hsd1.pa.comcast.net.8333: tcp 24
23:34:15.151851 IP tom-Latitude-3570.59818 > c-73-101-52-184.hsd1.pa.comcast.net.8333: tcp 37
