23:58:25.398139 IP 97-82-78-25.dhcp.leds.al.charter.com.8333 > tom-Latitude-3570.47742: tcp 24
23:58:25.398160 IP 97-82-78-25.dhcp.leds.al.charter.com.8333 > tom-Latitude-3570.47742: tcp 865
23:58:25.398164 IP ec2-52-56-97-80.eu-west-2.compute.amazonaws.com.8333 > tom-Latitude-3570.36650: tcp 24
23:58:25.398193 IP tom-Latitude-3570.36650 > ec2-52-56-97-80.eu-west-2.compute.amazonaws.com.8333: tcp 0
23:58:25.398206 IP ec2-52-56-97-80.eu-west-2.compute.amazonaws.com.8333 > tom-Latitude-3570.36650: tcp 613
23:58:25.398209 IP tom-Latitude-3570.36650 > ec2-52-56-97-80.eu-west-2.compute.amazonaws.com.8333: tcp 0
23:58:25.398212 IP 97-82-78-25.dhcp.leds.al.charter.com.8333 > tom-Latitude-3570.47742: tcp 865
23:58:25.398215 IP tom-Latitude-3570.47742 > 97-82-78-25.dhcp.leds.al.charter.com.8333: tcp 0
23:58:25.398582 IP tom-Latitude-3570.47742 > 97-82-78-25.dhcp.leds.al.charter.com.8333: tcp 24
23:58:25.398811 IP tom-Latitude-3570.36650 > ec2-52-56-97-80.eu-west-2.compute.amazonaws.com.8333: tcp 24
23:58:25.399598 IP tom-Latitude-3570.36650 > ec2-52-56-97-80.eu-west-2.compute.amazonaws.com.8333: tcp 73
23:58:25.399604 IP tom-Latitude-3570.47742 > 97-82-78-25.dhcp.leds.al.charter.com.8333: tcp 541
23:58:25.499226 IP tom-Latitude-3570.34082 > host93-234-110-95.serverdedicati.aruba.it.8333: tcp 24
23:58:25.500056 IP tom-Latitude-3570.34082 > host93-234-110-95.serverdedicati.aruba.it.8333: tcp 325
23:58:25.515891 IP tom-Latitude-3570.47742 > 97-82-78-25.dhcp.leds.al.charter.com.8333: tcp 541
23:58:25.531902 IP tom-Latitude-3570.36650 > ec2-52-56-97-80.eu-west-2.compute.amazonaws.com.8333: tcp 73
23:58:25.632779 IP 184-101-12-201.phnx.qwest.net.8333 > tom-Latitude-3570.54046: tcp 24
23:58:25.633414 IP 184-101-12-201.phnx.qwest.net.8333 > tom-Latitude-3570.54046: tcp 8
23:58:25.633544 IP tom-Latitude-3570.54046 > 184-101-12-201.phnx.qwest.net.8333: tcp 0
23:58:25.633634 IP tom-Latitude-3570.54046 > 184-101-12-201.phnx.qwest.net.8333: tcp 24
23:58:25.634506 IP tom-Latitude-3570.54046 > 184-101-12-201.phnx.qwest.net.8333: tcp 8
23:58:25.647903 IP tom-Latitude-3570.34082 > host93-234-110-95.serverdedicati.aruba.it.8333: tcp 325
23:58:25.692904 IP 97-82-78-25.dhcp.leds.al.charter.com.8333 > tom-Latitude-3570.47742: tcp 0
23:58:25.695634 IP 97-82-78-25.dhcp.leds.al.charter.com.8333 > tom-Latitude-3570.47742: tcp 0
23:58:25.695647 IP ec2-52-56-97-80.eu-west-2.compute.amazonaws.com.8333 > tom-Latitude-3570.36650: tcp 0
23:58:25.695652 IP ec2-52-56-97-80.eu-west-2.compute.amazonaws.com.8333 > tom-Latitude-3570.36650: tcp 0
23:58:25.695653 IP host93-234-110-95.serverdedicati.aruba.it.8333 > tom-Latitude-3570.34082: tcp 0
23:58:25.695656 IP host93-234-110-95.serverdedicati.aruba.it.8333 > tom-Latitude-3570.34082: tcp 0
23:58:25.695658 IP ec2-52-56-97-80.eu-west-2.compute.amazonaws.com.8333 > tom-Latitude-3570.36650: tcp 0
23:58:25.695661 IP 97-82-78-25.dhcp.leds.al.charter.com.8333 > tom-Latitude-3570.47742: tcp 0
23:58:25.696637 IP 184-101-12-201.phnx.qwest.net.8333 > tom-Latitude-3570.54046: tcp 0
23:58:25.697353 IP 184-101-12-201.phnx.qwest.net.8333 > tom-Latitude-3570.54046: tcp 0
23:58:25.697366 IP host93-234-110-95.serverdedicati.aruba.it.8333 > tom-Latitude-3570.34082: tcp 0
23:58:25.749618 IP ec2-52-56-97-80.eu-west-2.compute.amazonaws.com.8333 > tom-Latitude-3570.36650: tcp 24
23:58:25.755171 IP ec2-52-56-97-80.eu-west-2.compute.amazonaws.com.8333 > tom-Latitude-3570.36650: tcp 815
23:58:25.755186 IP ec2-52-56-97-80.eu-west-2.compute.amazonaws.com.8333 > tom-Latitude-3570.36650: tcp 214
23:58:25.755265 IP tom-Latitude-3570.36650 > ec2-52-56-97-80.eu-west-2.compute.amazonaws.com.8333: tcp 0
23:58:25.911986 IP 97-82-78-25.dhcp.leds.al.charter.com.8333 > tom-Latitude-3570.47742: tcp 24
23:58:25.912005 IP 97-82-78-25.dhcp.leds.al.charter.com.8333 > tom-Latitude-3570.47742: tcp 421
23:58:25.912008 IP 97-82-78-25.dhcp.leds.al.charter.com.8333 > tom-Latitude-3570.47742: tcp 24
23:58:25.912010 IP 97-82-78-25.dhcp.leds.al.charter.com.8333 > tom-Latitude-3570.47742: tcp 364
23:58:25.912013 IP 97-82-78-25.dhcp.leds.al.charter.com.8333 > tom-Latitude-3570.47742: tcp 24
23:58:25.912015 IP 97-82-78-25.dhcp.leds.al.charter.com.8333 > tom-Latitude-3570.47742: tcp 336
23:58:25.912035 IP 97-82-78-25.dhcp.leds.al.charter.com.8333 > tom-Latitude-3570.47742: tcp 24
23:58:25.912036 IP 97-82-78-25.dhcp.leds.al.charter.com.8333 > tom-Latitude-3570.47742: tcp 338
23:58:25.912038 IP 97-82-78-25.dhcp.leds.al.charter.com.8333 > tom-Latitude-3570.47742: tcp 24
23:58:25.912041 IP 97-82-78-25.dhcp.leds.al.charter.com.8333 > tom-Latitude-3570.47742: tcp 571
23:58:25.912047 IP 97-82-78-25.dhcp.leds.al.charter.com.8333 > tom-Latitude-3570.47742: tcp 24
23:58:25.912050 IP 97-82-78-25.dhcp.leds.al.charter.com.8333 > tom-Latitude-3570.47742: tcp 365
23:58:25.912052 IP 97-82-78-25.dhcp.leds.al.charter.com.8333 > tom-Latitude-3570.47742: tcp 24
23:58:25.912054 IP 97-82-78-25.dhcp.leds.al.charter.com.8333 > tom-Latitude-3570.47742: tcp 366
23:58:25.912056 IP 97-82-78-25.dhcp.leds.al.charter.com.8333 > tom-Latitude-3570.47742: tcp 24
23:58:25.912058 IP 97-82-78-25.dhcp.leds.al.charter.com.8333 > tom-Latitude-3570.47742: tcp 338
23:58:25.912059 IP 97-82-78-25.dhcp.leds.al.charter.com.8333 > tom-Latitude-3570.47742: tcp 24
23:58:25.912061 IP 97-82-78-25.dhcp.leds.al.charter.com.8333 > tom-Latitude-3570.47742: tcp 593
23:58:25.912063 IP 97-82-78-25.dhcp.leds.al.charter.com.8333 > tom-Latitude-3570.47742: tcp 24
23:58:25.912067 IP 97-82-78-25.dhcp.leds.al.charter.com.8333 > tom-Latitude-3570.47742: tcp 569
23:58:25.912070 IP 97-82-78-25.dhcp.leds.al.charter.com.8333 > tom-Latitude-3570.47742: tcp 24
23:58:25.912073 IP 97-82-78-25.dhcp.leds.al.charter.com.8333 > tom-Latitude-3570.47742: tcp 547
23:58:25.912093 IP tom-Latitude-3570.47742 > 97-82-78-25.dhcp.leds.al.charter.com.8333: tcp 0
23:58:25.912882 IP tom-Latitude-3570.56244 > 172.214.77.34.bc.googleusercontent.com.8333: tcp 24
23:58:25.914054 IP tom-Latitude-3570.56244 > 172.214.77.34.bc.googleusercontent.com.8333: tcp 433
23:58:25.958471 IP 172.214.77.34.bc.googleusercontent.com.8333 > tom-Latitude-3570.56244: tcp 0
23:58:25.972569 IP 97-82-78-25.dhcp.leds.al.charter.com.8333 > tom-Latitude-3570.47742: tcp 1382
23:58:25.973970 IP 97-82-78-25.dhcp.leds.al.charter.com.8333 > tom-Latitude-3570.47742: tcp 1382
23:58:25.973983 IP 97-82-78-25.dhcp.leds.al.charter.com.8333 > tom-Latitude-3570.47742: tcp 1382
23:58:25.973987 IP 97-82-78-25.dhcp.leds.al.charter.com.8333 > tom-Latitude-3570.47742: tcp 1382
23:58:25.974062 IP tom-Latitude-3570.47742 > 97-82-78-25.dhcp.leds.al.charter.com.8333: tcp 0
23:58:25.976255 IP 97-82-78-25.dhcp.leds.al.charter.com.8333 > tom-Latitude-3570.47742: tcp 1382
23:58:25.979084 IP 97-82-78-25.dhcp.leds.al.charter.com.8333 > tom-Latitude-3570.47742: tcp 1382
23:58:25.979098 IP 97-82-78-25.dhcp.leds.al.charter.com.8333 > tom-Latitude-3570.47742: tcp 1382
23:58:25.979102 IP 97-82-78-25.dhcp.leds.al.charter.com.8333 > tom-Latitude-3570.47742: tcp 1382
23:58:25.979104 IP 97-82-78-25.dhcp.leds.al.charter.com.8333 > tom-Latitude-3570.47742: tcp 1382
23:58:25.979126 IP 97-82-78-25.dhcp.leds.al.charter.com.8333 > tom-Latitude-3570.47742: tcp 1382
23:58:25.979129 IP 97-82-78-25.dhcp.leds.al.charter.com.8333 > tom-Latitude-3570.47742: tcp 1382
23:58:25.979132 IP 97-82-78-25.dhcp.leds.al.charter.com.8333 > tom-Latitude-3570.47742: tcp 256
23:58:25.979134 IP 172.214.77.34.bc.googleusercontent.com.8333 > tom-Latitude-3570.56244: tcp 0
23:58:25.979180 IP tom-Latitude-3570.47742 > 97-82-78-25.dhcp.leds.al.charter.com.8333: tcp 0
23:58:26.095164 IP tom-Latitude-3570.47822 > 59.110.157.16.8333: tcp 24
23:58:26.096052 IP tom-Latitude-3570.47822 > 59.110.157.16.8333: tcp 613
23:58:26.143223 IP 59.110.157.16.8333 > tom-Latitude-3570.47822: tcp 0
23:58:26.146878 IP 59.110.157.16.8333 > tom-Latitude-3570.47822: tcp 0
23:58:26.396142 IP tom-Latitude-3570.47742 > 97-82-78-25.dhcp.leds.al.charter.com.8333: tcp 24
23:58:26.396332 IP tom-Latitude-3570.56244 > 172.214.77.34.bc.googleusercontent.com.8333: tcp 24
23:58:26.432780 IP tom-Latitude-3570.56244 > 172.214.77.34.bc.googleusercontent.com.8333: tcp 505
23:58:26.432791 IP tom-Latitude-3570.47742 > 97-82-78-25.dhcp.leds.al.charter.com.8333: tcp 73
23:58:26.493541 IP 97-82-78-25.dhcp.leds.al.charter.com.8333 > tom-Latitude-3570.47742: tcp 0
23:58:26.496824 IP tom-Latitude-3570.59818 > c-73-101-52-184.hsd1.pa.comcast.net.8333: tcp 24
23:58:26.497764 IP tom-Latitude-3570.59818 > c-73-101-52-184.hsd1.pa.comcast.net.8333: tcp 613
23:58:26.501104 IP 97-82-78-25.dhcp.leds.al.charter.com.8333 > tom-Latitude-3570.47742: tcp 0
23:58:26.501750 IP 172.214.77.34.bc.googleusercontent.com.8333 > tom-Latitude-3570.56244: tcp 0
23:58:26.524719 IP 172.214.77.34.bc.googleusercontent.com.8333 > tom-Latitude-3570.56244: tcp 0
23:58:26.528432 IP c-73-101-52-184.hsd1.pa.comcast.net.8333 > tom-Latitude-3570.59818: tcp 0
23:58:26.544460 IP c-73-101-52-184.hsd1.pa.comcast.net.8333 > tom-Latitude-3570.59818: tcp 0
23:58:26.898269 IP tom-Latitude-3570.54046 > 184-101-12-201.phnx.qwest.net.8333: tcp 24
23:58:26.898289 IP tom-Latitude-3570.54046 > 184-101-12-201.phnx.qwest.net.8333: tcp 1045
23:58:26.901130 IP 97-82-78-25.dhcp.leds.al.charter.com.8333 > tom-Latitude-3570.47742: tcp 24
23:58:26.901145 IP 97-82-78-25.dhcp.leds.al.charter.com.8333 > tom-Latitude-3570.47742: tcp 217
23:58:26.901237 IP tom-Latitude-3570.47742 > 97-82-78-25.dhcp.leds.al.charter.com.8333: tcp 0
23:58:26.901592 IP tom-Latitude-3570.47742 > 97-82-78-25.dhcp.leds.al.charter.com.8333: tcp 24
23:58:26.902803 IP tom-Latitude-3570.47742 > 97-82-78-25.dhcp.leds.al.charter.com.8333: tcp 217
23:58:26.936389 IP 184-101-12-201.phnx.qwest.net.8333 > tom-Latitude-3570.54046: tcp 0
23:58:26.940461 IP 184-101-12-201.phnx.qwest.net.8333 > tom-Latitude-3570.54046: tcp 0
23:58:26.940877 IP 97-82-78-25.dhcp.leds.al.charter.com.8333 > tom-Latitude-3570.47742: tcp 0
23:58:26.960399 IP 97-82-78-25.dhcp.leds.al.charter.com.8333 > tom-Latitude-3570.47742: tcp 0
23:58:27.202405 IP tom-Latitude-3570.34082 > host93-234-110-95.serverdedicati.aruba.it.8333: tcp 24
23:58:27.204473 IP tom-Latitude-3570.34082 > host93-234-110-95.serverdedicati.aruba.it.8333: tcp 613
23:58:27.206876 IP 97-82-78-25.dhcp.leds.al.charter.com.8333 > tom-Latitude-3570.47742: tcp 24
23:58:27.206895 IP 97-82-78-25.dhcp.leds.al.charter.com.8333 > tom-Latitude-3570.47742: tcp 109
23:58:27.206899 IP 97-82-78-25.dhcp.leds.al.charter.com.8333 > tom-Latitude-3570.47742: tcp 24
23:58:27.206901 IP 97-82-78-25.dhcp.leds.al.charter.com.8333 > tom-Latitude-3570.47742: tcp 570
23:58:27.206903 IP 97-82-78-25.dhcp.leds.al.charter.com.8333 > tom-Latitude-3570.47742: tcp 24
23:58:27.206923 IP 97-82-78-25.dhcp.leds.al.charter.com.8333 > tom-Latitude-3570.47742: tcp 488
23:58:27.206925 IP 97-82-78-25.dhcp.leds.al.charter.com.8333 > tom-Latitude-3570.47742: tcp 24
23:58:27.206927 IP 97-82-78-25.dhcp.leds.al.charter.com.8333 > tom-Latitude-3570.47742: tcp 548
23:58:27.206929 IP 97-82-78-25.dhcp.leds.al.charter.com.8333 > tom-Latitude-3570.47742: tcp 24
23:58:27.206988 IP tom-Latitude-3570.47742 > 97-82-78-25.dhcp.leds.al.charter.com.8333: tcp 0
23:58:27.207137 IP tom-Latitude-3570.47742 > 97-82-78-25.dhcp.leds.al.charter.com.8333: tcp 24
23:58:27.207337 IP 97-82-78-25.dhcp.leds.al.charter.com.8333 > tom-Latitude-3570.47742: tcp 224
23:58:27.207351 IP 97-82-78-25.dhcp.leds.al.charter.com.8333 > tom-Latitude-3570.47742: tcp 24
23:58:27.207354 IP 97-82-78-25.dhcp.leds.al.charter.com.8333 > tom-Latitude-3570.47742: tcp 225
23:58:27.207356 IP 97-82-78-25.dhcp.leds.al.charter.com.8333 > tom-Latitude-3570.47742: tcp 24
23:58:27.207359 IP 97-82-78-25.dhcp.leds.al.charter.com.8333 > tom-Latitude-3570.47742: tcp 190
23:58:27.207360 IP 172.214.77.34.bc.googleusercontent.com.8333 > tom-Latitude-3570.56244: tcp 24
23:58:27.207365 IP 172.214.77.34.bc.googleusercontent.com.8333 > tom-Latitude-3570.56244: tcp 289
23:58:27.207416 IP tom-Latitude-3570.47742 > 97-82-78-25.dhcp.leds.al.charter.com.8333: tcp 0
23:58:27.207485 IP tom-Latitude-3570.56244 > 172.214.77.34.bc.googleusercontent.com.8333: tcp 0
23:58:27.208001 IP tom-Latitude-3570.47742 > 97-82-78-25.dhcp.leds.al.charter.com.8333: tcp 109
23:58:27.242526 IP host93-234-110-95.serverdedicati.aruba.it.8333 > tom-Latitude-3570.34082: tcp 0
23:58:27.243133 IP host93-234-110-95.serverdedicati.aruba.it.8333 > tom-Latitude-3570.34082: tcp 0
23:58:27.243138 IP 97-82-78-25.dhcp.leds.al.charter.com.8333 > tom-Latitude-3570.47742: tcp 0
23:58:27.246305 IP 97-82-78-25.dhcp.leds.al.charter.com.8333 > tom-Latitude-3570.47742: tcp 0
23:58:27.445820 IP 97-82-78-25.dhcp.leds.al.charter.com.8333 > tom-Latitude-3570.47742: tcp 24
23:58:27.445837 IP 97-82-78-25.dhcp.leds.al.charter.com.8333 > tom-Latitude-3570.47742: tcp 667
23:58:27.445842 IP 97-82-78-25.dhcp.leds.al.charter.com.8333 > tom-Latitude-3570.47742: tcp 24
23:58:27.445862 IP 97-82-78-25.dhcp.leds.al.charter.com.8333 > tom-Latitude-3570.47742: tcp 223
23:58:27.445864 IP 97-82-78-25.dhcp.leds.al.charter.com.8333 > tom-Latitude-3570.47742: tcp 24
23:58:27.445867 IP 97-82-78-25.dhcp.leds.al.charter.com.8333 > tom-Latitude-3570.47742: tcp 225
23:58:27.445915 IP tom-Latitude-3570.47742 > 97-82-78-25.dhcp.leds.al.charter.com.8333: tcp 0
23:58:27.650655 IP 184-101-12-201.phnx.qwest.net.8333 > tom-Latitude-3570.54046: tcp 24
23:58:27.650673 IP 184-101-12-201.phnx.qwest.net.8333 > tom-Latitude-3570.54046: tcp 289
23:58:27.650765 IP tom-Latitude-3570.54046 > 184-101-12-201.phnx.qwest.net.8333: tcp 0
23:58:27.650892 IP tom-Latitude-3570.54046 > 184-101-12-201.phnx.qwest.net.8333: tcp 24
23:58:27.652156 IP tom-Latitude-3570.54046 > 184-101-12-201.phnx.qwest.net.8333: tcp 325
23:58:27.688157 IP 184-101-12-201.phnx.qwest.net.8333 > tom-Latitude-3570.54046: tcp 0
23:58:27.710239 IP 184-101-12-201.phnx.qwest.net.8333 > tom-Latitude-3570.54046: tcp 0
23:58:27.852604 IP tom-Latitude-3570.33922 > pool-108-20-207-31.bstnma.fios.verizon.net.8333: tcp 24
23:58:27.852691 IP tom-Latitude-3570.33922 > pool-108-20-207-31.bstnma.fios.verizon.net.8333: tcp 1261
23:58:27.906728 IP pool-108-20-207-31.bstnma.fios.verizon.net.8333 > tom-Latitude-3570.33922: tcp 0
23:58:27.952996 IP tom-Latitude-3570.47822 > 59.110.157.16.8333: tcp 24
23:58:27.955260 IP tom-Latitude-3570.47822 > 59.110.157.16.8333: tcp 325
23:58:27.986630 IP 59.110.157.16.8333 > tom-Latitude-3570.47822: tcp 0
23:58:27.990296 IP 59.110.157.16.8333 > tom-Latitude-3570.47822: tcp 0
23:58:28.022628 IP pool-108-20-207-31.bstnma.fios.verizon.net.8333 > tom-Latitude-3570.33922: tcp 24
23:58:28.023213 IP pool-108-20-207-31.bstnma.fios.verizon.net.8333 > tom-Latitude-3570.33922: tcp 8
23:58:28.023255 IP tom-Latitude-3570.33922 > pool-108-20-207-31.bstnma.fios.verizon.net.8333: tcp 0
23:58:28.023404 IP tom-Latitude-3570.33922 > pool-108-20-207-31.bstnma.fios.verizon.net.8333: tcp 24
23:58:28.024736 IP tom-Latitude-3570.33922 > pool-108-20-207-31.bstnma.fios.verizon.net.8333: tcp 8
23:58:28.058566 IP pool-108-20-207-31.bstnma.fios.verizon.net.8333 > tom-Latitude-3570.33922: tcp 0
23:58:28.123796 IP tom-Latitude-3570.36650 > ec2-52-56-97-80.eu-west-2.compute.amazonaws.com.8333: tcp 24
23:58:28.126524 IP tom-Latitude-3570.36650 > ec2-52-56-97-80.eu-west-2.compute.amazonaws.com.8333: tcp 325
23:58:28.160056 IP ec2-52-56-97-80.eu-west-2.compute.amazonaws.com.8333 > tom-Latitude-3570.36650: tcp 0
23:58:28.160068 IP ec2-52-56-97-80.eu-west-2.compute.amazonaws.com.8333 > tom-Latitude-3570.36650: tcp 0
23:58:28.424520 IP tom-Latitude-3570.33922 > pool-108-20-207-31.bstnma.fios.verizon.net.8333: tcp 24
23:58:28.426760 IP tom-Latitude-3570.33922 > pool-108-20-207-31.bstnma.fios.verizon.net.8333: tcp 109
23:58:28.477250 IP pool-108-20-207-31.bstnma.fios.verizon.net.8333 > tom-Latitude-3570.33922: tcp 0
23:58:28.487444 IP 97-82-78-25.dhcp.leds.al.charter.com.8333 > tom-Latitude-3570.47742: tcp 24
23:58:28.487464 IP 97-82-78-25.dhcp.leds.al.charter.com.8333 > tom-Latitude-3570.47742: tcp 145
23:58:28.487553 IP tom-Latitude-3570.47742 > 97-82-78-25.dhcp.leds.al.charter.com.8333: tcp 0
23:58:28.487780 IP tom-Latitude-3570.47742 > 97-82-78-25.dhcp.leds.al.charter.com.8333: tcp 24
23:58:28.491166 IP tom-Latitude-3570.47742 > 97-82-78-25.dhcp.leds.al.charter.com.8333: tcp 145
23:58:28.540606 IP 97-82-78-25.dhcp.leds.al.charter.com.8333 > tom-Latitude-3570.47742: tcp 0
23:58:28.553280 IP 97-82-78-25.dhcp.leds.al.charter.com.8333 > tom-Latitude-3570.47742: tcp 0
23:58:28.604621 IP 59.110.157.16.8333 > tom-Latitude-3570.47822: tcp 24
23:58:28.604660 IP tom-Latitude-3570.47822 > 59.110.157.16.8333: tcp 0
23:58:28.604679 IP 59.110.157.16.8333 > tom-Latitude-3570.47822: tcp 109
23:58:28.604684 IP tom-Latitude-3570.47822 > 59.110.157.16.8333: tcp 0
23:58:28.777501 IP 97-82-78-25.dhcp.leds.al.charter.com.8333 > tom-Latitude-3570.47742: tcp 24
23:58:28.778322 IP 97-82-78-25.dhcp.leds.al.charter.com.8333 > tom-Latitude-3570.47742: tcp 247
23:58:28.778340 IP 97-82-78-25.dhcp.leds.al.charter.com.8333 > tom-Latitude-3570.47742: tcp 24
23:58:28.778345 IP 97-82-78-25.dhcp.leds.al.charter.com.8333 > tom-Latitude-3570.47742: tcp 1460
23:58:28.778347 IP 97-82-78-25.dhcp.leds.al.charter.com.8333 > tom-Latitude-3570.47742: tcp 226
23:58:28.778349 IP 97-82-78-25.dhcp.leds.al.charter.com.8333 > tom-Latitude-3570.47742: tcp 24
23:58:28.778350 IP 97-82-78-25.dhcp.leds.al.charter.com.8333 > tom-Latitude-3570.47742: tcp 374
23:58:28.778371 IP 97-82-78-25.dhcp.leds.al.charter.com.8333 > tom-Latitude-3570.47742: tcp 24
23:58:28.778372 IP 97-82-78-25.dhcp.leds.al.charter.com.8333 > tom-Latitude-3570.47742: tcp 192
23:58:28.778435 IP tom-Latitude-3570.47742 > 97-82-78-25.dhcp.leds.al.charter.com.8333: tcp 0
23:58:29.139493 IP c-73-101-52-184.hsd1.pa.comcast.net.8333 > tom-Latitude-3570.59818: tcp 24
23:58:29.139514 IP tom-Latitude-3570.59818 > c-73-101-52-184.hsd1.pa.comcast.net.8333: tcp 0
23:58:29.139541 IP c-73-101-52-184.hsd1.pa.comcast.net.8333 > tom-Latitude-3570.59818: tcp 469
23:58:29.139545 IP tom-Latitude-3570.59818 > c-73-101-52-184.hsd1.pa.comcast.net.8333: tcp 0
23:58:29.240264 IP tom-Latitude-3570.36650 > ec2-52-56-97-80.eu-west-2.compute.amazonaws.com.8333: tcp 24
23:58:29.240350 IP tom-Latitude-3570.47822 > 59.110.157.16.8333: tcp 24
23:58:29.241227 IP tom-Latitude-3570.47822 > 59.110.157.16.8333: tcp 37
23:58:29.241237 IP tom-Latitude-3570.36650 > ec2-52-56-97-80.eu-west-2.compute.amazonaws.com.8333: tcp 145
23:58:29.274809 IP 59.110.157.16.8333 > tom-Latitude-3570.47822: tcp 0
23:58:29.275396 IP ec2-52-56-97-80.eu-west-2.compute.amazonaws.com.8333 > tom-Latitude-3570.36650: tcp 0
23:58:29.275410 IP ec2-52-56-97-80.eu-west-2.compute.amazonaws.com.8333 > tom-Latitude-3570.36650: tcp 0
23:58:29.279084 IP 59.110.157.16.8333 > tom-Latitude-3570.47822: tcp 0
23:58:29.440845 IP tom-Latitude-3570.56244 > 172.214.77.34.bc.googleusercontent.com.8333: tcp 24
23:58:29.443081 IP tom-Latitude-3570.56244 > 172.214.77.34.bc.googleusercontent.com.8333: tcp 181
23:58:29.474059 IP 172.214.77.34.bc.googleusercontent.com.8333 > tom-Latitude-3570.56244: tcp 0
23:58:29.478732 IP 172.214.77.34.bc.googleusercontent.com.8333 > tom-Latitude-3570.56244: tcp 0
23:58:29.842039 IP tom-Latitude-3570.59818 > c-73-101-52-184.hsd1.pa.comcast.net.8333: tcp 24
23:58:29.843959 IP tom-Latitude-3570.59818 > c-73-101-52-184.hsd1.pa.comcast.net.8333: tcp 8
23:58:29.900925 IP c-73-101-52-184.hsd1.pa.comcast.net.8333 > tom-Latitude-3570.59818: tcp 0
23:58:29.918245 IP c-73-101-52-184.hsd1.pa.comcast.net.8333 > tom-Latitude-3570.59818: tcp 0
23:58:30.108053 IP c-73-101-52-184.hsd1.pa.comcast.net.8333 > tom-Latitude-3570.59818: tcp 24
23:58:30.108073 IP tom-Latitude-3570.59818 > c-73-101-52-184.hsd1.pa.comcast.net.8333: tcp 0
23:58:30.108105 IP c-73-101-52-184.hsd1.pa.comcast.net.8333 > tom-Latitude-3570.59818: tcp 8
23:58:30.108107 IP tom-Latitude-3570.59818 > c-73-101-52-184.hsd1.pa.comcast.net.8333: tcp 0
23:58:30.508995 IP tom-Latitude-3570.54046 > 184-101-12-201.phnx.qwest.net.8333: tcp 24
23:58:30.511099 IP tom-Latitude-3570.54046 > 184-101-12-201.phnx.qwest.net.8333: tcp 145
23:58:30.572577 IP 184-101-12-201.phnx.qwest.net.8333 > tom-Latitude-3570.54046: tcp 0
23:58:30.588466 IP 184-101-12-201.phnx.qwest.net.8333 > tom-Latitude-3570.54046: tcp 0
23:58:31.132345 IP c-73-101-52-184.hsd1.pa.comcast.net.8333 > tom-Latitude-3570.59818: tcp 24
23:58:31.132382 IP tom-Latitude-3570.59818 > c-73-101-52-184.hsd1.pa.comcast.net.8333: tcp 0
23:58:31.132414 IP c-73-101-52-184.hsd1.pa.comcast.net.8333 > tom-Latitude-3570.59818: tcp 145
23:58:31.132424 IP tom-Latitude-3570.59818 > c-73-101-52-184.hsd1.pa.comcast.net.8333: tcp 0
23:58:31.132609 IP tom-Latitude-3570.59818 > c-73-101-52-184.hsd1.pa.comcast.net.8333: tcp 24
23:58:31.133861 IP tom-Latitude-3570.59818 > c-73-101-52-184.hsd1.pa.comcast.net.8333: tcp 145
23:58:31.206839 IP c-73-101-52-184.hsd1.pa.comcast.net.8333 > tom-Latitude-3570.59818: tcp 0
23:58:31.207529 IP c-73-101-52-184.hsd1.pa.comcast.net.8333 > tom-Latitude-3570.59818: tcp 0
23:58:31.544175 IP c-73-101-52-184.hsd1.pa.comcast.net.8333 > tom-Latitude-3570.59818: tcp 24
23:58:31.544195 IP c-73-101-52-184.hsd1.pa.comcast.net.8333 > tom-Latitude-3570.59818: tcp 225
23:58:31.544199 IP c-73-101-52-184.hsd1.pa.comcast.net.8333 > tom-Latitude-3570.59818: tcp 24
23:58:31.544203 IP c-73-101-52-184.hsd1.pa.comcast.net.8333 > tom-Latitude-3570.59818: tcp 1460
23:58:31.544225 IP c-73-101-52-184.hsd1.pa.comcast.net.8333 > tom-Latitude-3570.59818: tcp 1460
23:58:31.544227 IP c-73-101-52-184.hsd1.pa.comcast.net.8333 > tom-Latitude-3570.59818: tcp 869
23:58:31.544230 IP c-73-101-52-184.hsd1.pa.comcast.net.8333 > tom-Latitude-3570.59818: tcp 24
23:58:31.544232 IP c-73-101-52-184.hsd1.pa.comcast.net.8333 > tom-Latitude-3570.59818: tcp 388
23:58:31.544234 IP c-73-101-52-184.hsd1.pa.comcast.net.8333 > tom-Latitude-3570.59818: tcp 24
23:58:31.544236 IP c-73-101-52-184.hsd1.pa.comcast.net.8333 > tom-Latitude-3570.59818: tcp 226
23:58:31.544296 IP tom-Latitude-3570.59818 > c-73-101-52-184.hsd1.pa.comcast.net.8333: tcp 0
23:58:31.749877 IP tom-Latitude-3570.47822 > 59.110.157.16.8333: tcp 24
23:58:31.752576 IP tom-Latitude-3570.47822 > 59.110.157.16.8333: tcp 145
23:58:31.786806 IP 59.110.157.16.8333 > tom-Latitude-3570.47822: tcp 0
23:58:31.810636 IP 59.110.157.16.8333 > tom-Latitude-3570.47822: tcp 0
23:58:32.050865 IP tom-Latitude-3570.56244 > 172.214.77.34.bc.googleusercontent.com.8333: tcp 24
23:58:32.052799 IP tom-Latitude-3570.56244 > 172.214.77.34.bc.googleusercontent.com.8333: tcp 145
23:58:32.091729 IP 172.214.77.34.bc.googleusercontent.com.8333 > tom-Latitude-3570.56244: tcp 0
23:58:32.122643 IP 172.214.77.34.bc.googleusercontent.com.8333 > tom-Latitude-3570.56244: tcp 0
23:58:32.151283 IP tom-Latitude-3570.54046 > 184-101-12-201.phnx.qwest.net.8333: tcp 24
23:58:32.153786 IP tom-Latitude-3570.54046 > 184-101-12-201.phnx.qwest.net.8333: tcp 145
23:58:32.187000 IP 184-101-12-201.phnx.qwest.net.8333 > tom-Latitude-3570.54046: tcp 0
23:58:32.187668 IP 184-101-12-201.phnx.qwest.net.8333 > tom-Latitude-3570.54046: tcp 0
23:58:32.552415 IP tom-Latitude-3570.34082 > host93-234-110-95.serverdedicati.aruba.it.8333: tcp 24
23:58:32.556034 IP tom-Latitude-3570.34082 > host93-234-110-95.serverdedicati.aruba.it.8333: tcp 613
23:58:32.604060 IP host93-234-110-95.serverdedicati.aruba.it.8333 > tom-Latitude-3570.34082: tcp 0
23:58:32.652725 IP host93-234-110-95.serverdedicati.aruba.it.8333 > tom-Latitude-3570.34082: tcp 0
23:58:32.752973 IP tom-Latitude-3570.36650 > ec2-52-56-97-80.eu-west-2.compute.amazonaws.com.8333: tcp 24
23:58:32.754110 IP tom-Latitude-3570.36650 > ec2-52-56-97-80.eu-west-2.compute.amazonaws.com.8333: tcp 145
23:58:32.830281 IP ec2-52-56-97-80.eu-west-2.compute.amazonaws.com.8333 > tom-Latitude-3570.36650: tcp 0
23:58:32.830296 IP ec2-52-56-97-80.eu-west-2.compute.amazonaws.com.8333 > tom-Latitude-3570.36650: tcp 0
23:58:32.865823 IP ec2-52-56-97-80.eu-west-2.compute.amazonaws.com.8333 > tom-Latitude-3570.36650: tcp 24
23:58:32.871476 IP ec2-52-56-97-80.eu-west-2.compute.amazonaws.com.8333 > tom-Latitude-3570.36650: tcp 325
23:58:32.871529 IP tom-Latitude-3570.36650 > ec2-52-56-97-80.eu-west-2.compute.amazonaws.com.8333: tcp 0
23:58:32.871820 IP tom-Latitude-3570.36650 > ec2-52-56-97-80.eu-west-2.compute.amazonaws.com.8333: tcp 24
23:58:32.872907 IP tom-Latitude-3570.36650 > ec2-52-56-97-80.eu-west-2.compute.amazonaws.com.8333: tcp 181
23:58:32.934797 IP ec2-52-56-97-80.eu-west-2.compute.amazonaws.com.8333 > tom-Latitude-3570.36650: tcp 0
23:58:33.006718 IP ec2-52-56-97-80.eu-west-2.compute.amazonaws.com.8333 > tom-Latitude-3570.36650: tcp 24
23:58:33.006738 IP ec2-52-56-97-80.eu-west-2.compute.amazonaws.com.8333 > tom-Latitude-3570.36650: tcp 405
23:58:33.006744 IP ec2-52-56-97-80.eu-west-2.compute.amazonaws.com.8333 > tom-Latitude-3570.36650: tcp 215
23:58:33.006746 IP ec2-52-56-97-80.eu-west-2.compute.amazonaws.com.8333 > tom-Latitude-3570.36650: tcp 24
23:58:33.006784 IP tom-Latitude-3570.36650 > ec2-52-56-97-80.eu-west-2.compute.amazonaws.com.8333: tcp 0
23:58:33.007756 IP ec2-52-56-97-80.eu-west-2.compute.amazonaws.com.8333 > tom-Latitude-3570.36650: tcp 1448
23:58:33.007775 IP ec2-52-56-97-80.eu-west-2.compute.amazonaws.com.8333 > tom-Latitude-3570.36650: tcp 1448
23:58:33.007784 IP ec2-52-56-97-80.eu-west-2.compute.amazonaws.com.8333 > tom-Latitude-3570.36650: tcp 1448
23:58:33.007817 IP tom-Latitude-3570.36650 > ec2-52-56-97-80.eu-west-2.compute.amazonaws.com.8333: tcp 0
23:58:33.019161 IP ec2-52-56-97-80.eu-west-2.compute.amazonaws.com.8333 > tom-Latitude-3570.36650: tcp 1382
23:58:33.020171 IP ec2-52-56-97-80.eu-west-2.compute.amazonaws.com.8333 > tom-Latitude-3570.36650: tcp 66
23:58:33.020189 IP tom-Latitude-3570.36650 > ec2-52-56-97-80.eu-west-2.compute.amazonaws.com.8333: tcp 0
23:58:33.020210 IP ec2-52-56-97-80.eu-west-2.compute.amazonaws.com.8333 > tom-Latitude-3570.36650: tcp 1448
23:58:33.020217 IP ec2-52-56-97-80.eu-west-2.compute.amazonaws.com.8333 > tom-Latitude-3570.36650: tcp 1448
23:58:33.020247 IP tom-Latitude-3570.36650 > ec2-52-56-97-80.eu-west-2.compute.amazonaws.com.8333: tcp 0
23:58:33.066036 IP ec2-52-56-97-80.eu-west-2.compute.amazonaws.com.8333 > tom-Latitude-3570.36650: tcp 1448
23:58:33.066057 IP ec2-52-56-97-80.eu-west-2.compute.amazonaws.com.8333 > tom-Latitude-3570.36650: tcp 1448
23:58:33.066064 IP ec2-52-56-97-80.eu-west-2.compute.amazonaws.com.8333 > tom-Latitude-3570.36650: tcp 1448
23:58:33.066069 IP ec2-52-56-97-80.eu-west-2.compute.amazonaws.com.8333 > tom-Latitude-3570.36650: tcp 1448
23:58:33.066074 IP ec2-52-56-97-80.eu-west-2.compute.amazonaws.com.8333 > tom-Latitude-3570.36650: tcp 1448
23:58:33.066077 IP ec2-52-56-97-80.eu-west-2.compute.amazonaws.com.8333 > tom-Latitude-3570.36650: tcp 1448
23:58:33.066080 IP ec2-52-56-97-80.eu-west-2.compute.amazonaws.com.8333 > tom-Latitude-3570.36650: tcp 1448
23:58:33.066111 IP tom-Latitude-3570.36650 > ec2-52-56-97-80.eu-west-2.compute.amazonaws.com.8333: tcp 0
23:58:33.087058 IP ec2-52-56-97-80.eu-west-2.compute.amazonaws.com.8333 > tom-Latitude-3570.36650: tcp 1284
23:58:33.127903 IP tom-Latitude-3570.36650 > ec2-52-56-97-80.eu-west-2.compute.amazonaws.com.8333: tcp 0
23:58:33.405141 IP tom-Latitude-3570.47822 > 59.110.157.16.8333: tcp 24
23:58:33.407260 IP tom-Latitude-3570.47822 > 59.110.157.16.8333: tcp 181
23:58:33.438550 IP 59.110.157.16.8333 > tom-Latitude-3570.47822: tcp 0
23:58:33.439121 IP 59.110.157.16.8333 > tom-Latitude-3570.47822: tcp 0
23:58:33.590742 IP host93-234-110-95.serverdedicati.aruba.it.8333 > tom-Latitude-3570.34082: tcp 24
23:58:33.590767 IP tom-Latitude-3570.34082 > host93-234-110-95.serverdedicati.aruba.it.8333: tcp 0
23:58:33.590811 IP host93-234-110-95.serverdedicati.aruba.it.8333 > tom-Latitude-3570.34082: tcp 253
23:58:33.590815 IP tom-Latitude-3570.34082 > host93-234-110-95.serverdedicati.aruba.it.8333: tcp 0
23:58:33.591016 IP tom-Latitude-3570.34082 > host93-234-110-95.serverdedicati.aruba.it.8333: tcp 24
23:58:33.592119 IP tom-Latitude-3570.34082 > host93-234-110-95.serverdedicati.aruba.it.8333: tcp 73
23:58:33.604443 IP 184-101-12-201.phnx.qwest.net.8333 > tom-Latitude-3570.54046: tcp 24
23:58:33.604451 IP 184-101-12-201.phnx.qwest.net.8333 > tom-Latitude-3570.54046: tcp 145
23:58:33.604468 IP tom-Latitude-3570.54046 > 184-101-12-201.phnx.qwest.net.8333: tcp 0
23:58:33.704774 IP tom-Latitude-3570.59818 > c-73-101-52-184.hsd1.pa.comcast.net.8333: tcp 24
23:58:33.706963 IP tom-Latitude-3570.59818 > c-73-101-52-184.hsd1.pa.comcast.net.8333: tcp 181
23:58:33.724833 IP host93-234-110-95.serverdedicati.aruba.it.8333 > tom-Latitude-3570.34082: tcp 0
23:58:33.738887 IP 97-82-78-25.dhcp.leds.al.charter.com.8333 > tom-Latitude-3570.47742: tcp 24
23:58:33.740328 IP 97-82-78-25.dhcp.leds.al.charter.com.8333 > tom-Latitude-3570.47742: tcp 361
23:58:33.740388 IP tom-Latitude-3570.47742 > 97-82-78-25.dhcp.leds.al.charter.com.8333: tcp 0
23:58:33.779744 IP 184-101-12-201.phnx.qwest.net.8333 > tom-Latitude-3570.54046: tcp 145
23:58:33.779757 IP tom-Latitude-3570.54046 > 184-101-12-201.phnx.qwest.net.8333: tcp 0
23:58:33.787138 IP host93-234-110-95.serverdedicati.aruba.it.8333 > tom-Latitude-3570.34082: tcp 0
23:58:33.836406 IP c-73-101-52-184.hsd1.pa.comcast.net.8333 > tom-Latitude-3570.59818: tcp 0
23:58:33.840767 IP tom-Latitude-3570.54046 > 184-101-12-201.phnx.qwest.net.8333: tcp 24
23:58:33.841535 IP tom-Latitude-3570.54046 > 184-101-12-201.phnx.qwest.net.8333: tcp 37
23:58:33.878903 IP host93-234-110-95.serverdedicati.aruba.it.8333 > tom-Latitude-3570.34082: tcp 24
23:58:33.881338 IP host93-234-110-95.serverdedicati.aruba.it.8333 > tom-Latitude-3570.34082: tcp 226
23:58:33.881381 IP host93-234-110-95.serverdedicati.aruba.it.8333 > tom-Latitude-3570.34082: tcp 24
23:58:33.881387 IP host93-234-110-95.serverdedicati.aruba.it.8333 > tom-Latitude-3570.34082: tcp 247
23:58:33.881440 IP tom-Latitude-3570.34082 > host93-234-110-95.serverdedicati.aruba.it.8333: tcp 0
23:58:33.894340 IP c-73-101-52-184.hsd1.pa.comcast.net.8333 > tom-Latitude-3570.59818: tcp 0
23:58:33.894353 IP 184-101-12-201.phnx.qwest.net.8333 > tom-Latitude-3570.54046: tcp 0
23:58:33.897363 IP 184-101-12-201.phnx.qwest.net.8333 > tom-Latitude-3570.54046: tcp 0
23:58:34.183024 IP tom-Latitude-3570.56244 > 172.214.77.34.bc.googleusercontent.com.8333: tcp 24
23:58:34.185392 IP tom-Latitude-3570.56244 > 172.214.77.34.bc.googleusercontent.com.8333: tcp 253
23:58:34.186002 IP host93-234-110-95.serverdedicati.aruba.it.8333 > tom-Latitude-3570.34082: tcp 24
23:58:34.186552 IP host93-234-110-95.serverdedicati.aruba.it.8333 > tom-Latitude-3570.34082: tcp 37
23:58:34.186682 IP tom-Latitude-3570.34082 > host93-234-110-95.serverdedicati.aruba.it.8333: tcp 0
23:58:34.186848 IP tom-Latitude-3570.34082 > host93-234-110-95.serverdedicati.aruba.it.8333: tcp 24
23:58:34.188321 IP tom-Latitude-3570.34082 > host93-234-110-95.serverdedicati.aruba.it.8333: tcp 37
23:58:34.220893 IP 172.214.77.34.bc.googleusercontent.com.8333 > tom-Latitude-3570.56244: tcp 0
23:58:34.224409 IP 172.214.77.34.bc.googleusercontent.com.8333 > tom-Latitude-3570.56244: tcp 0
23:58:34.228446 IP host93-234-110-95.serverdedicati.aruba.it.8333 > tom-Latitude-3570.34082: tcp 0
23:58:34.228903 IP host93-234-110-95.serverdedicati.aruba.it.8333 > tom-Latitude-3570.34082: tcp 0
23:58:34.266850 IP c-73-101-52-184.hsd1.pa.comcast.net.8333 > tom-Latitude-3570.59818: tcp 24
23:58:34.267504 IP c-73-101-52-184.hsd1.pa.comcast.net.8333 > tom-Latitude-3570.59818: tcp 8
23:58:34.267634 IP tom-Latitude-3570.59818 > c-73-101-52-184.hsd1.pa.comcast.net.8333: tcp 0
23:58:34.267766 IP tom-Latitude-3570.59818 > c-73-101-52-184.hsd1.pa.comcast.net.8333: tcp 24
23:58:34.269186 IP tom-Latitude-3570.59818 > c-73-101-52-184.hsd1.pa.comcast.net.8333: tcp 8
23:58:34.321489 IP host93-234-110-95.serverdedicati.aruba.it.8333 > tom-Latitude-3570.34082: tcp 24
23:58:34.321508 IP host93-234-110-95.serverdedicati.aruba.it.8333 > tom-Latitude-3570.34082: tcp 382
23:58:34.321512 IP c-73-101-52-184.hsd1.pa.comcast.net.8333 > tom-Latitude-3570.59818: tcp 0
23:58:34.321517 IP c-73-101-52-184.hsd1.pa.comcast.net.8333 > tom-Latitude-3570.59818: tcp 0
23:58:34.321615 IP tom-Latitude-3570.34082 > host93-234-110-95.serverdedicati.aruba.it.8333: tcp 0
23:58:34.422784 IP tom-Latitude-3570.36650 > ec2-52-56-97-80.eu-west-2.compute.amazonaws.com.8333: tcp 24
23:58:34.422831 IP tom-Latitude-3570.59818 > c-73-101-52-184.hsd1.pa.comcast.net.8333: tcp 24
23:58:34.422847 IP tom-Latitude-3570.34082 > host93-234-110-95.serverdedicati.aruba.it.8333: tcp 24
23:58:34.424391 IP tom-Latitude-3570.34082 > host93-234-110-95.serverdedicati.aruba.it.8333: tcp 8
23:58:34.424402 IP tom-Latitude-3570.59818 > c-73-101-52-184.hsd1.pa.comcast.net.8333: tcp 109
23:58:34.424405 IP tom-Latitude-3570.36650 > ec2-52-56-97-80.eu-west-2.compute.amazonaws.com.8333: tcp 109
23:58:34.431308 IP pool-108-20-207-31.bstnma.fios.verizon.net.8333 > tom-Latitude-3570.33922: tcp 24
23:58:34.435286 IP pool-108-20-207-31.bstnma.fios.verizon.net.8333 > tom-Latitude-3570.33922: tcp 613
23:58:34.435420 IP tom-Latitude-3570.33922 > pool-108-20-207-31.bstnma.fios.verizon.net.8333: tcp 0
23:58:34.435715 IP tom-Latitude-3570.33922 > pool-108-20-207-31.bstnma.fios.verizon.net.8333: tcp 24
23:58:34.436744 IP tom-Latitude-3570.33922 > pool-108-20-207-31.bstnma.fios.verizon.net.8333: tcp 37
23:58:34.452437 IP c-73-101-52-184.hsd1.pa.comcast.net.8333 > tom-Latitude-3570.59818: tcp 0
23:58:34.476543 IP c-73-101-52-184.hsd1.pa.comcast.net.8333 > tom-Latitude-3570.59818: tcp 0
23:58:34.476550 IP host93-234-110-95.serverdedicati.aruba.it.8333 > tom-Latitude-3570.34082: tcp 0
23:58:34.480295 IP ec2-52-56-97-80.eu-west-2.compute.amazonaws.com.8333 > tom-Latitude-3570.36650: tcp 0
23:58:34.480899 IP host93-234-110-95.serverdedicati.aruba.it.8333 > tom-Latitude-3570.34082: tcp 0
23:58:34.480927 IP pool-108-20-207-31.bstnma.fios.verizon.net.8333 > tom-Latitude-3570.33922: tcp 0
23:58:34.567788 IP host93-234-110-95.serverdedicati.aruba.it.8333 > tom-Latitude-3570.34082: tcp 24
23:58:34.568463 IP host93-234-110-95.serverdedicati.aruba.it.8333 > tom-Latitude-3570.34082: tcp 8
23:58:34.568595 IP tom-Latitude-3570.34082 > host93-234-110-95.serverdedicati.aruba.it.8333: tcp 0
23:58:34.625868 IP pool-108-20-207-31.bstnma.fios.verizon.net.8333 > tom-Latitude-3570.33922: tcp 24
23:58:34.630251 IP pool-108-20-207-31.bstnma.fios.verizon.net.8333 > tom-Latitude-3570.33922: tcp 1460
23:58:34.630288 IP pool-108-20-207-31.bstnma.fios.verizon.net.8333 > tom-Latitude-3570.33922: tcp 1460
23:58:34.630295 IP pool-108-20-207-31.bstnma.fios.verizon.net.8333 > tom-Latitude-3570.33922: tcp 1460
23:58:34.630345 IP tom-Latitude-3570.33922 > pool-108-20-207-31.bstnma.fios.verizon.net.8333: tcp 0
23:58:34.633334 IP pool-108-20-207-31.bstnma.fios.verizon.net.8333 > tom-Latitude-3570.33922: tcp 1460
23:58:34.633398 IP pool-108-20-207-31.bstnma.fios.verizon.net.8333 > tom-Latitude-3570.33922: tcp 1460
23:58:34.633408 IP pool-108-20-207-31.bstnma.fios.verizon.net.8333 > tom-Latitude-3570.33922: tcp 827
23:58:34.633555 IP tom-Latitude-3570.33922 > pool-108-20-207-31.bstnma.fios.verizon.net.8333: tcp 0
23:58:34.635286 IP c-73-101-52-184.hsd1.pa.comcast.net.8333 > tom-Latitude-3570.59818: tcp 24
23:58:34.635948 IP c-73-101-52-184.hsd1.pa.comcast.net.8333 > tom-Latitude-3570.59818: tcp 37
23:58:34.636141 IP tom-Latitude-3570.59818 > c-73-101-52-184.hsd1.pa.comcast.net.8333: tcp 0
23:58:34.642854 IP tom-Latitude-3570.59818 > c-73-101-52-184.hsd1.pa.comcast.net.8333: tcp 24
23:58:34.643964 IP tom-Latitude-3570.59818 > c-73-101-52-184.hsd1.pa.comcast.net.8333: tcp 382
23:58:34.686460 IP c-73-101-52-184.hsd1.pa.comcast.net.8333 > tom-Latitude-3570.59818: tcp 0
23:58:34.702491 IP c-73-101-52-184.hsd1.pa.comcast.net.8333 > tom-Latitude-3570.59818: tcp 0
23:58:34.743262 IP tom-Latitude-3570.34082 > host93-234-110-95.serverdedicati.aruba.it.8333: tcp 24
23:58:34.744050 IP tom-Latitude-3570.34082 > host93-234-110-95.serverdedicati.aruba.it.8333: tcp 37
23:58:34.805695 IP host93-234-110-95.serverdedicati.aruba.it.8333 > tom-Latitude-3570.34082: tcp 0
23:58:34.806253 IP host93-234-110-95.serverdedicati.aruba.it.8333 > tom-Latitude-3570.34082: tcp 0
23:58:35.645605 IP tom-Latitude-3570.34082 > host93-234-110-95.serverdedicati.aruba.it.8333: tcp 24
23:58:35.647877 IP tom-Latitude-3570.34082 > host93-234-110-95.serverdedicati.aruba.it.8333: tcp 31
23:58:35.709234 IP host93-234-110-95.serverdedicati.aruba.it.8333 > tom-Latitude-3570.34082: tcp 0
23:58:35.724637 IP host93-234-110-95.serverdedicati.aruba.it.8333 > tom-Latitude-3570.34082: tcp 0
23:58:35.746077 IP tom-Latitude-3570.59818 > c-73-101-52-184.hsd1.pa.comcast.net.8333: tcp 24
23:58:35.747016 IP tom-Latitude-3570.59818 > c-73-101-52-184.hsd1.pa.comcast.net.8333: tcp 37
23:58:35.788696 IP c-73-101-52-184.hsd1.pa.comcast.net.8333 > tom-Latitude-3570.59818: tcp 0
23:58:35.835556 IP c-73-101-52-184.hsd1.pa.comcast.net.8333 > tom-Latitude-3570.59818: tcp 0
23:58:36.448075 IP tom-Latitude-3570.47822 > 59.110.157.16.8333: tcp 24
23:58:36.448349 IP host93-234-110-95.serverdedicati.aruba.it.8333 > tom-Latitude-3570.34082: tcp 24
23:58:36.448369 IP host93-234-110-95.serverdedicati.aruba.it.8333 > tom-Latitude-3570.34082: tcp 8
23:58:36.448461 IP tom-Latitude-3570.34082 > host93-234-110-95.serverdedicati.aruba.it.8333: tcp 0
23:58:36.448595 IP tom-Latitude-3570.34082 > host93-234-110-95.serverdedicati.aruba.it.8333: tcp 24
23:58:36.448958 IP tom-Latitude-3570.47822 > 59.110.157.16.8333: tcp 145
23:58:36.449727 IP tom-Latitude-3570.34082 > host93-234-110-95.serverdedicati.aruba.it.8333: tcp 8
23:58:36.545035 IP 59.110.157.16.8333 > tom-Latitude-3570.47822: tcp 0
23:58:36.545691 IP 59.110.157.16.8333 > tom-Latitude-3570.47822: tcp 0
23:58:36.545705 IP host93-234-110-95.serverdedicati.aruba.it.8333 > tom-Latitude-3570.34082: tcp 0
23:58:36.545709 IP host93-234-110-95.serverdedicati.aruba.it.8333 > tom-Latitude-3570.34082: tcp 0
23:58:36.649014 IP tom-Latitude-3570.36650 > ec2-52-56-97-80.eu-west-2.compute.amazonaws.com.8333: tcp 24
23:58:36.659435 IP tom-Latitude-3570.36650 > ec2-52-56-97-80.eu-west-2.compute.amazonaws.com.8333: tcp 37
23:58:36.694655 IP ec2-52-56-97-80.eu-west-2.compute.amazonaws.com.8333 > tom-Latitude-3570.36650: tcp 0
23:58:36.849720 IP tom-Latitude-3570.47742 > 97-82-78-25.dhcp.leds.al.charter.com.8333: tcp 24
23:58:36.851983 IP tom-Latitude-3570.47742 > 97-82-78-25.dhcp.leds.al.charter.com.8333: tcp 109
23:58:36.901312 IP 97-82-78-25.dhcp.leds.al.charter.com.8333 > tom-Latitude-3570.47742: tcp 0
23:58:36.901327 IP 97-82-78-25.dhcp.leds.al.charter.com.8333 > tom-Latitude-3570.47742: tcp 0
23:58:37.481105 IP ec2-52-56-97-80.eu-west-2.compute.amazonaws.com.8333 > tom-Latitude-3570.36650: tcp 24
23:58:37.481124 IP tom-Latitude-3570.36650 > ec2-52-56-97-80.eu-west-2.compute.amazonaws.com.8333: tcp 0
23:58:37.481153 IP ec2-52-56-97-80.eu-west-2.compute.amazonaws.com.8333 > tom-Latitude-3570.36650: tcp 181
23:58:37.481157 IP tom-Latitude-3570.36650 > ec2-52-56-97-80.eu-west-2.compute.amazonaws.com.8333: tcp 0
23:58:37.481463 IP tom-Latitude-3570.36650 > ec2-52-56-97-80.eu-west-2.compute.amazonaws.com.8333: tcp 24
23:58:37.483186 IP tom-Latitude-3570.36650 > ec2-52-56-97-80.eu-west-2.compute.amazonaws.com.8333: tcp 181
23:58:37.545744 IP ec2-52-56-97-80.eu-west-2.compute.amazonaws.com.8333 > tom-Latitude-3570.36650: tcp 0
23:58:37.617236 IP ec2-52-56-97-80.eu-west-2.compute.amazonaws.com.8333 > tom-Latitude-3570.36650: tcp 24
23:58:37.617255 IP ec2-52-56-97-80.eu-west-2.compute.amazonaws.com.8333 > tom-Latitude-3570.36650: tcp 438
23:58:37.617261 IP ec2-52-56-97-80.eu-west-2.compute.amazonaws.com.8333 > tom-Latitude-3570.36650: tcp 1448
23:58:37.617284 IP ec2-52-56-97-80.eu-west-2.compute.amazonaws.com.8333 > tom-Latitude-3570.36650: tcp 1448
23:58:37.617288 IP ec2-52-56-97-80.eu-west-2.compute.amazonaws.com.8333 > tom-Latitude-3570.36650: tcp 1448
