06:39:13.350382 IP 167.99.216.145.8333 > tom-Latitude-3570.57976: tcp 0
06:39:13.350934 IP 167.99.216.145.8333 > tom-Latitude-3570.57976: tcp 0
06:39:13.418794 IP tom-Latitude-3570.49070 > c-185-45-236-223.customer.ggaweb.ch.8333: tcp 24
06:39:13.419881 IP tom-Latitude-3570.49070 > c-185-45-236-223.customer.ggaweb.ch.8333: tcp 649
06:39:13.477096 IP c-185-45-236-223.customer.ggaweb.ch.8333 > tom-Latitude-3570.49070: tcp 0
06:39:13.477110 IP c-185-45-236-223.customer.ggaweb.ch.8333 > tom-Latitude-3570.49070: tcp 0
06:39:13.920595 IP tom-Latitude-3570.60470 > bb42-60-217-183.singnet.com.sg.8333: tcp 24
06:39:13.920707 IP tom-Latitude-3570.42516 > 2.56.9.15.8333: tcp 24
06:39:13.922759 IP tom-Latitude-3570.60470 > bb42-60-217-183.singnet.com.sg.8333: tcp 253
06:39:13.923626 IP tom-Latitude-3570.42516 > 2.56.9.15.8333: tcp 577
06:39:13.979400 IP 2.56.9.15.8333 > tom-Latitude-3570.42516: tcp 24
06:39:13.979969 IP 2.56.9.15.8333 > tom-Latitude-3570.42516: tcp 577
06:39:13.980034 IP tom-Latitude-3570.42516 > 2.56.9.15.8333: tcp 0
06:39:13.980749 IP 2.56.9.15.8333 > tom-Latitude-3570.42516: tcp 0
06:39:13.981614 IP bb42-60-217-183.singnet.com.sg.8333 > tom-Latitude-3570.60470: tcp 0
06:39:14.302897 IP vmi195435.contaboserver.net.8333 > tom-Latitude-3570.39110: tcp 24
06:39:14.302915 IP tom-Latitude-3570.39110 > vmi195435.contaboserver.net.8333: tcp 0
06:39:14.304702 IP vmi195435.contaboserver.net.8333 > tom-Latitude-3570.39110: tcp 37
06:39:14.304719 IP tom-Latitude-3570.39110 > vmi195435.contaboserver.net.8333: tcp 0
06:39:14.304736 IP vmi195435.contaboserver.net.8333 > tom-Latitude-3570.39110: tcp 37
06:39:14.304740 IP tom-Latitude-3570.39110 > vmi195435.contaboserver.net.8333: tcp 0
06:39:14.304881 IP tom-Latitude-3570.39110 > vmi195435.contaboserver.net.8333: tcp 24
06:39:14.310619 IP tom-Latitude-3570.39110 > vmi195435.contaboserver.net.8333: tcp 37
06:39:14.349377 IP vmi195435.contaboserver.net.8333 > tom-Latitude-3570.39110: tcp 0
06:39:14.349391 IP vmi195435.contaboserver.net.8333 > tom-Latitude-3570.39110: tcp 0
06:39:14.429832 IP vmi195435.contaboserver.net.8333 > tom-Latitude-3570.39110: tcp 24
06:39:14.429853 IP vmi195435.contaboserver.net.8333 > tom-Latitude-3570.39110: tcp 405
06:39:14.429892 IP tom-Latitude-3570.39110 > vmi195435.contaboserver.net.8333: tcp 0
06:39:14.831611 IP tom-Latitude-3570.60470 > bb42-60-217-183.singnet.com.sg.8333: tcp 24
06:39:14.833796 IP tom-Latitude-3570.60470 > bb42-60-217-183.singnet.com.sg.8333: tcp 37
06:39:14.891072 IP bb42-60-217-183.singnet.com.sg.8333 > tom-Latitude-3570.60470: tcp 0
06:39:14.932060 IP tom-Latitude-3570.49070 > c-185-45-236-223.customer.ggaweb.ch.8333: tcp 24
06:39:14.932990 IP tom-Latitude-3570.49070 > c-185-45-236-223.customer.ggaweb.ch.8333: tcp 37
06:39:14.962998 IP c-185-45-236-223.customer.ggaweb.ch.8333 > tom-Latitude-3570.49070: tcp 0
06:39:14.971006 IP c-185-45-236-223.customer.ggaweb.ch.8333 > tom-Latitude-3570.49070: tcp 0
06:39:15.053552 IP 81.198.101.144.8333 > tom-Latitude-3570.60988: tcp 24
06:39:15.053574 IP 81.198.101.144.8333 > tom-Latitude-3570.60988: tcp 397
06:39:15.053616 IP tom-Latitude-3570.60988 > 81.198.101.144.8333: tcp 0
06:39:15.053826 IP tom-Latitude-3570.60988 > 81.198.101.144.8333: tcp 24
06:39:15.055087 IP tom-Latitude-3570.60988 > 81.198.101.144.8333: tcp 145
06:39:15.090110 IP 81.198.101.144.8333 > tom-Latitude-3570.60988: tcp 0
06:39:15.090704 IP 81.198.101.144.8333 > tom-Latitude-3570.60988: tcp 0
06:39:15.180597 IP 81.198.101.144.8333 > tom-Latitude-3570.60988: tcp 24
06:39:15.180617 IP 81.198.101.144.8333 > tom-Latitude-3570.60988: tcp 403
06:39:15.180660 IP tom-Latitude-3570.60988 > 81.198.101.144.8333: tcp 0
06:39:15.188277 IP 81.198.101.144.8333 > tom-Latitude-3570.60988: tcp 24
06:39:15.189104 IP 81.198.101.144.8333 > tom-Latitude-3570.60988: tcp 403
06:39:15.189119 IP 81.198.101.144.8333 > tom-Latitude-3570.60988: tcp 24
06:39:15.189123 IP 81.198.101.144.8333 > tom-Latitude-3570.60988: tcp 404
06:39:15.189129 IP 81.198.101.144.8333 > tom-Latitude-3570.60988: tcp 24
06:39:15.189133 IP 81.198.101.144.8333 > tom-Latitude-3570.60988: tcp 405
06:39:15.189179 IP tom-Latitude-3570.60988 > 81.198.101.144.8333: tcp 0
06:39:15.287526 IP static-87-75-105-186.vodafonexdsl.co.uk.8333 > tom-Latitude-3570.46284: tcp 24
06:39:15.295473 IP static-87-75-105-186.vodafonexdsl.co.uk.8333 > tom-Latitude-3570.46284: tcp 253
06:39:15.295537 IP tom-Latitude-3570.46284 > static-87-75-105-186.vodafonexdsl.co.uk.8333: tcp 0
06:39:15.295728 IP tom-Latitude-3570.46284 > static-87-75-105-186.vodafonexdsl.co.uk.8333: tcp 24
06:39:15.297061 IP tom-Latitude-3570.46284 > static-87-75-105-186.vodafonexdsl.co.uk.8333: tcp 73
06:39:15.329496 IP static-87-75-105-186.vodafonexdsl.co.uk.8333 > tom-Latitude-3570.46284: tcp 0
06:39:15.404523 IP static-87-75-105-186.vodafonexdsl.co.uk.8333 > tom-Latitude-3570.46284: tcp 24
06:39:15.404545 IP static-87-75-105-186.vodafonexdsl.co.uk.8333 > tom-Latitude-3570.46284: tcp 245
06:39:15.404550 IP static-87-75-105-186.vodafonexdsl.co.uk.8333 > tom-Latitude-3570.46284: tcp 24
06:39:15.404553 IP static-87-75-105-186.vodafonexdsl.co.uk.8333 > tom-Latitude-3570.46284: tcp 257
06:39:15.404590 IP tom-Latitude-3570.46284 > static-87-75-105-186.vodafonexdsl.co.uk.8333: tcp 0
06:39:15.505475 IP tom-Latitude-3570.56714 > ns3113832.ip-54-38-177.eu.8333: tcp 24
06:39:15.505537 IP tom-Latitude-3570.60470 > bb42-60-217-183.singnet.com.sg.8333: tcp 24
06:39:15.507029 IP tom-Latitude-3570.56714 > ns3113832.ip-54-38-177.eu.8333: tcp 685
06:39:15.507927 IP tom-Latitude-3570.60470 > bb42-60-217-183.singnet.com.sg.8333: tcp 217
06:39:15.534029 IP ns3113832.ip-54-38-177.eu.8333 > tom-Latitude-3570.56714: tcp 0
06:39:15.541367 IP ns3113832.ip-54-38-177.eu.8333 > tom-Latitude-3570.56714: tcp 0
06:39:15.541997 IP bb42-60-217-183.singnet.com.sg.8333 > tom-Latitude-3570.60470: tcp 0
06:39:15.949510 IP vmi195435.contaboserver.net.8333 > tom-Latitude-3570.39110: tcp 24
06:39:15.949531 IP vmi195435.contaboserver.net.8333 > tom-Latitude-3570.39110: tcp 217
06:39:15.949536 IP 2.56.9.15.8333 > tom-Latitude-3570.42516: tcp 24
06:39:15.949541 IP 2.56.9.15.8333 > tom-Latitude-3570.42516: tcp 469
06:39:15.949544 IP vmi195435.contaboserver.net.8333 > tom-Latitude-3570.39110: tcp 217
06:39:15.949555 IP tom-Latitude-3570.39110 > vmi195435.contaboserver.net.8333: tcp 0
06:39:15.949592 IP 2.56.9.15.8333 > tom-Latitude-3570.42516: tcp 469
06:39:15.949598 IP tom-Latitude-3570.42516 > 2.56.9.15.8333: tcp 0
06:39:15.949878 IP tom-Latitude-3570.42516 > 2.56.9.15.8333: tcp 24
06:39:15.951998 IP tom-Latitude-3570.42516 > 2.56.9.15.8333: tcp 217
06:39:15.988960 IP 2.56.9.15.8333 > tom-Latitude-3570.42516: tcp 0
06:39:16.084698 IP 2.56.9.15.8333 > tom-Latitude-3570.42516: tcp 24
06:39:16.084707 IP 2.56.9.15.8333 > tom-Latitude-3570.42516: tcp 225
06:39:16.084711 IP 2.56.9.15.8333 > tom-Latitude-3570.42516: tcp 24
06:39:16.084714 IP 2.56.9.15.8333 > tom-Latitude-3570.42516: tcp 225
06:39:16.084716 IP 2.56.9.15.8333 > tom-Latitude-3570.42516: tcp 24
06:39:16.084723 IP tom-Latitude-3570.42516 > 2.56.9.15.8333: tcp 0
06:39:16.085435 IP 2.56.9.15.8333 > tom-Latitude-3570.42516: tcp 226
06:39:16.085442 IP 2.56.9.15.8333 > tom-Latitude-3570.42516: tcp 24
06:39:16.085447 IP 2.56.9.15.8333 > tom-Latitude-3570.42516: tcp 370
06:39:16.085459 IP tom-Latitude-3570.42516 > 2.56.9.15.8333: tcp 0
06:39:16.088284 IP 2.56.9.15.8333 > tom-Latitude-3570.42516: tcp 24
06:39:16.089016 IP 2.56.9.15.8333 > tom-Latitude-3570.42516: tcp 370
06:39:16.089081 IP tom-Latitude-3570.42516 > 2.56.9.15.8333: tcp 0
06:39:16.178404 IP 2.56.9.15.8333 > tom-Latitude-3570.42516: tcp 455
06:39:16.178667 IP tom-Latitude-3570.57976 > 167.99.216.145.8333: tcp 24
06:39:16.179264 IP tom-Latitude-3570.42516 > 2.56.9.15.8333: tcp 24
06:39:16.179471 IP tom-Latitude-3570.57976 > 167.99.216.145.8333: tcp 433
06:39:16.180241 IP tom-Latitude-3570.42516 > 2.56.9.15.8333: tcp 37
06:39:16.202370 IP 167.99.216.145.8333 > tom-Latitude-3570.57976: tcp 0
06:39:16.210377 IP 2.56.9.15.8333 > tom-Latitude-3570.42516: tcp 0
06:39:16.211260 IP 167.99.216.145.8333 > tom-Latitude-3570.57976: tcp 0
06:39:16.304472 IP 2.56.9.15.8333 > tom-Latitude-3570.42516: tcp 24
06:39:16.305090 IP 2.56.9.15.8333 > tom-Latitude-3570.42516: tcp 408
06:39:16.305154 IP tom-Latitude-3570.42516 > 2.56.9.15.8333: tcp 0
06:39:16.506472 IP tom-Latitude-3570.46284 > static-87-75-105-186.vodafonexdsl.co.uk.8333: tcp 24
06:39:16.509150 IP tom-Latitude-3570.46284 > static-87-75-105-186.vodafonexdsl.co.uk.8333: tcp 253
06:39:16.550700 IP static-87-75-105-186.vodafonexdsl.co.uk.8333 > tom-Latitude-3570.46284: tcp 0
06:39:16.907923 IP tom-Latitude-3570.57976 > 167.99.216.145.8333: tcp 24
06:39:16.910059 IP tom-Latitude-3570.57976 > 167.99.216.145.8333: tcp 73
06:39:16.959564 IP 167.99.216.145.8333 > tom-Latitude-3570.57976: tcp 0
06:39:16.963450 IP 167.99.216.145.8333 > tom-Latitude-3570.57976: tcp 0
06:39:17.026935 IP c-185-45-236-223.customer.ggaweb.ch.8333 > tom-Latitude-3570.49070: tcp 24
06:39:17.027638 IP c-185-45-236-223.customer.ggaweb.ch.8333 > tom-Latitude-3570.49070: tcp 1045
06:39:17.027757 IP tom-Latitude-3570.49070 > c-185-45-236-223.customer.ggaweb.ch.8333: tcp 0
06:39:17.028164 IP tom-Latitude-3570.49070 > c-185-45-236-223.customer.ggaweb.ch.8333: tcp 24
06:39:17.029218 IP tom-Latitude-3570.49070 > c-185-45-236-223.customer.ggaweb.ch.8333: tcp 577
06:39:17.060725 IP c-185-45-236-223.customer.ggaweb.ch.8333 > tom-Latitude-3570.49070: tcp 0
06:39:17.061688 IP c-185-45-236-223.customer.ggaweb.ch.8333 > tom-Latitude-3570.49070: tcp 0
06:39:17.076676 IP static-87-75-105-186.vodafonexdsl.co.uk.8333 > tom-Latitude-3570.46284: tcp 24
06:39:17.099689 IP static-87-75-105-186.vodafonexdsl.co.uk.8333 > tom-Latitude-3570.46284: tcp 433
06:39:17.099710 IP tom-Latitude-3570.46284 > static-87-75-105-186.vodafonexdsl.co.uk.8333: tcp 0
06:39:17.099921 IP tom-Latitude-3570.46284 > static-87-75-105-186.vodafonexdsl.co.uk.8333: tcp 24
06:39:17.101085 IP tom-Latitude-3570.46284 > static-87-75-105-186.vodafonexdsl.co.uk.8333: tcp 37
06:39:17.142245 IP static-87-75-105-186.vodafonexdsl.co.uk.8333 > tom-Latitude-3570.46284: tcp 0
06:39:17.144506 IP c-185-45-236-223.customer.ggaweb.ch.8333 > tom-Latitude-3570.49070: tcp 24
06:39:17.144514 IP c-185-45-236-223.customer.ggaweb.ch.8333 > tom-Latitude-3570.49070: tcp 644
06:39:17.144527 IP tom-Latitude-3570.49070 > c-185-45-236-223.customer.ggaweb.ch.8333: tcp 0
06:39:17.144662 IP c-185-45-236-223.customer.ggaweb.ch.8333 > tom-Latitude-3570.49070: tcp 669
06:39:17.144669 IP c-185-45-236-223.customer.ggaweb.ch.8333 > tom-Latitude-3570.49070: tcp 523
06:39:17.144682 IP tom-Latitude-3570.49070 > c-185-45-236-223.customer.ggaweb.ch.8333: tcp 0
06:39:17.147950 IP c-185-45-236-223.customer.ggaweb.ch.8333 > tom-Latitude-3570.49070: tcp 870
06:39:17.147961 IP c-185-45-236-223.customer.ggaweb.ch.8333 > tom-Latitude-3570.49070: tcp 643
06:39:17.147964 IP c-185-45-236-223.customer.ggaweb.ch.8333 > tom-Latitude-3570.49070: tcp 643
06:39:17.147968 IP c-185-45-236-223.customer.ggaweb.ch.8333 > tom-Latitude-3570.49070: tcp 789
06:39:17.147971 IP c-185-45-236-223.customer.ggaweb.ch.8333 > tom-Latitude-3570.49070: tcp 395
06:39:17.147972 IP tom-Latitude-3570.49070 > c-185-45-236-223.customer.ggaweb.ch.8333: tcp 0
06:39:17.148004 IP tom-Latitude-3570.49070 > c-185-45-236-223.customer.ggaweb.ch.8333: tcp 0
06:39:17.191528 IP 81.198.101.144.8333 > tom-Latitude-3570.60988: tcp 24
06:39:17.194004 IP 81.198.101.144.8333 > tom-Latitude-3570.60988: tcp 1009
06:39:17.194068 IP tom-Latitude-3570.60988 > 81.198.101.144.8333: tcp 0
06:39:17.194386 IP tom-Latitude-3570.39110 > vmi195435.contaboserver.net.8333: tcp 24
06:39:17.194648 IP tom-Latitude-3570.60988 > 81.198.101.144.8333: tcp 24
06:39:17.195457 IP tom-Latitude-3570.39110 > vmi195435.contaboserver.net.8333: tcp 829
06:39:17.196117 IP tom-Latitude-3570.60988 > 81.198.101.144.8333: tcp 73
06:39:17.206925 IP static-87-75-105-186.vodafonexdsl.co.uk.8333 > tom-Latitude-3570.46284: tcp 24
06:39:17.206937 IP static-87-75-105-186.vodafonexdsl.co.uk.8333 > tom-Latitude-3570.46284: tcp 223
06:39:17.206956 IP tom-Latitude-3570.46284 > static-87-75-105-186.vodafonexdsl.co.uk.8333: tcp 0
06:39:17.217652 IP 81.198.101.144.8333 > tom-Latitude-3570.60988: tcp 0
06:39:17.235711 IP vmi195435.contaboserver.net.8333 > tom-Latitude-3570.39110: tcp 0
06:39:17.236288 IP 81.198.101.144.8333 > tom-Latitude-3570.60988: tcp 0
06:39:17.236316 IP vmi195435.contaboserver.net.8333 > tom-Latitude-3570.39110: tcp 0
06:39:17.238921 IP bb42-60-217-183.singnet.com.sg.8333 > tom-Latitude-3570.60470: tcp 24
06:39:17.242785 IP bb42-60-217-183.singnet.com.sg.8333 > tom-Latitude-3570.60470: tcp 793
06:39:17.242848 IP tom-Latitude-3570.60470 > bb42-60-217-183.singnet.com.sg.8333: tcp 0
06:39:17.316430 IP 167.99.216.145.8333 > tom-Latitude-3570.57976: tcp 24
06:39:17.316443 IP tom-Latitude-3570.57976 > 167.99.216.145.8333: tcp 0
06:39:17.317298 IP 167.99.216.145.8333 > tom-Latitude-3570.57976: tcp 757
06:39:17.317324 IP tom-Latitude-3570.57976 > 167.99.216.145.8333: tcp 0
06:39:17.317705 IP tom-Latitude-3570.57976 > 167.99.216.145.8333: tcp 24
06:39:17.318964 IP tom-Latitude-3570.57976 > 167.99.216.145.8333: tcp 109
06:39:17.324669 IP 81.198.101.144.8333 > tom-Latitude-3570.60988: tcp 24
06:39:17.325473 IP 81.198.101.144.8333 > tom-Latitude-3570.60988: tcp 247
06:39:17.325478 IP 81.198.101.144.8333 > tom-Latitude-3570.60988: tcp 24
06:39:17.325482 IP 81.198.101.144.8333 > tom-Latitude-3570.60988: tcp 223
06:39:17.325488 IP tom-Latitude-3570.60988 > 81.198.101.144.8333: tcp 0
06:39:17.352874 IP 167.99.216.145.8333 > tom-Latitude-3570.57976: tcp 0
06:39:17.352888 IP 167.99.216.145.8333 > tom-Latitude-3570.57976: tcp 0
06:39:17.415037 IP 167.99.216.145.8333 > tom-Latitude-3570.57976: tcp 24
06:39:17.415888 IP 167.99.216.145.8333 > tom-Latitude-3570.57976: tcp 226
06:39:17.415906 IP 167.99.216.145.8333 > tom-Latitude-3570.57976: tcp 24
06:39:17.415911 IP 167.99.216.145.8333 > tom-Latitude-3570.57976: tcp 226
06:39:17.415914 IP 167.99.216.145.8333 > tom-Latitude-3570.57976: tcp 24
06:39:17.415917 IP 167.99.216.145.8333 > tom-Latitude-3570.57976: tcp 225
06:39:17.415954 IP tom-Latitude-3570.57976 > 167.99.216.145.8333: tcp 0
06:39:17.617859 IP tom-Latitude-3570.57976 > 167.99.216.145.8333: tcp 24
06:39:17.620238 IP tom-Latitude-3570.57976 > 167.99.216.145.8333: tcp 37
06:39:17.620764 IP c-185-45-236-223.customer.ggaweb.ch.8333 > tom-Latitude-3570.49070: tcp 24
06:39:17.620784 IP c-185-45-236-223.customer.ggaweb.ch.8333 > tom-Latitude-3570.49070: tcp 73
06:39:17.620827 IP tom-Latitude-3570.49070 > c-185-45-236-223.customer.ggaweb.ch.8333: tcp 0
06:39:17.621008 IP tom-Latitude-3570.49070 > c-185-45-236-223.customer.ggaweb.ch.8333: tcp 24
06:39:17.622894 IP tom-Latitude-3570.49070 > c-185-45-236-223.customer.ggaweb.ch.8333: tcp 37
06:39:17.625453 IP c-185-45-236-223.customer.ggaweb.ch.8333 > tom-Latitude-3570.49070: tcp 73
06:39:17.625468 IP tom-Latitude-3570.49070 > c-185-45-236-223.customer.ggaweb.ch.8333: tcp 0
06:39:17.669011 IP 167.99.216.145.8333 > tom-Latitude-3570.57976: tcp 0
06:39:17.669562 IP 167.99.216.145.8333 > tom-Latitude-3570.57976: tcp 0
06:39:17.669575 IP c-185-45-236-223.customer.ggaweb.ch.8333 > tom-Latitude-3570.49070: tcp 0
06:39:17.669579 IP c-185-45-236-223.customer.ggaweb.ch.8333 > tom-Latitude-3570.49070: tcp 0
06:39:17.749850 IP c-185-45-236-223.customer.ggaweb.ch.8333 > tom-Latitude-3570.49070: tcp 24
06:39:17.749868 IP tom-Latitude-3570.49070 > c-185-45-236-223.customer.ggaweb.ch.8333: tcp 0
06:39:17.750512 IP c-185-45-236-223.customer.ggaweb.ch.8333 > tom-Latitude-3570.49070: tcp 403
06:39:17.750537 IP tom-Latitude-3570.49070 > c-185-45-236-223.customer.ggaweb.ch.8333: tcp 0
06:39:17.853446 IP tom-Latitude-3570.42516 > 2.56.9.15.8333: tcp 24
06:39:17.854504 IP tom-Latitude-3570.42516 > 2.56.9.15.8333: tcp 829
06:39:17.890857 IP 2.56.9.15.8333 > tom-Latitude-3570.42516: tcp 0
06:39:17.986890 IP 2.56.9.15.8333 > tom-Latitude-3570.42516: tcp 24
06:39:17.987527 IP 2.56.9.15.8333 > tom-Latitude-3570.42516: tcp 109
06:39:17.987590 IP tom-Latitude-3570.42516 > 2.56.9.15.8333: tcp 0
06:39:17.987791 IP tom-Latitude-3570.42516 > 2.56.9.15.8333: tcp 24
06:39:17.989633 IP tom-Latitude-3570.42516 > 2.56.9.15.8333: tcp 725
06:39:18.020980 IP 2.56.9.15.8333 > tom-Latitude-3570.42516: tcp 0
06:39:18.188513 IP tom-Latitude-3570.60470 > bb42-60-217-183.singnet.com.sg.8333: tcp 24
06:39:18.190594 IP tom-Latitude-3570.60470 > bb42-60-217-183.singnet.com.sg.8333: tcp 289
06:39:18.230847 IP bb42-60-217-183.singnet.com.sg.8333 > tom-Latitude-3570.60470: tcp 0
06:39:18.289084 IP tom-Latitude-3570.60988 > 81.198.101.144.8333: tcp 24
06:39:18.290596 IP tom-Latitude-3570.60988 > 81.198.101.144.8333: tcp 145
06:39:18.322878 IP 81.198.101.144.8333 > tom-Latitude-3570.60988: tcp 0
06:39:18.330842 IP 81.198.101.144.8333 > tom-Latitude-3570.60988: tcp 0
06:39:18.489913 IP tom-Latitude-3570.56714 > ns3113832.ip-54-38-177.eu.8333: tcp 24
06:39:18.489933 IP tom-Latitude-3570.56714 > ns3113832.ip-54-38-177.eu.8333: tcp 1081
06:39:18.492502 IP static-87-75-105-186.vodafonexdsl.co.uk.8333 > tom-Latitude-3570.46284: tcp 24
06:39:18.492520 IP static-87-75-105-186.vodafonexdsl.co.uk.8333 > tom-Latitude-3570.46284: tcp 8
06:39:18.492566 IP tom-Latitude-3570.46284 > static-87-75-105-186.vodafonexdsl.co.uk.8333: tcp 0
06:39:18.492707 IP tom-Latitude-3570.46284 > static-87-75-105-186.vodafonexdsl.co.uk.8333: tcp 24
06:39:18.494882 IP tom-Latitude-3570.46284 > static-87-75-105-186.vodafonexdsl.co.uk.8333: tcp 8
06:39:18.539122 IP ns3113832.ip-54-38-177.eu.8333 > tom-Latitude-3570.56714: tcp 0
06:39:18.539697 IP ns3113832.ip-54-38-177.eu.8333 > tom-Latitude-3570.56714: tcp 0
06:39:18.539712 IP static-87-75-105-186.vodafonexdsl.co.uk.8333 > tom-Latitude-3570.46284: tcp 0
06:39:18.693567 IP tom-Latitude-3570.46284 > static-87-75-105-186.vodafonexdsl.co.uk.8333: tcp 24
06:39:18.695761 IP tom-Latitude-3570.46284 > static-87-75-105-186.vodafonexdsl.co.uk.8333: tcp 397
06:39:18.740873 IP static-87-75-105-186.vodafonexdsl.co.uk.8333 > tom-Latitude-3570.46284: tcp 0
06:39:18.793985 IP tom-Latitude-3570.39110 > vmi195435.contaboserver.net.8333: tcp 24
06:39:18.794969 IP tom-Latitude-3570.39110 > vmi195435.contaboserver.net.8333: tcp 181
06:39:18.822940 IP vmi195435.contaboserver.net.8333 > tom-Latitude-3570.39110: tcp 0
06:39:18.832994 IP vmi195435.contaboserver.net.8333 > tom-Latitude-3570.39110: tcp 0
06:39:18.910267 IP vmi195435.contaboserver.net.8333 > tom-Latitude-3570.39110: tcp 24
06:39:18.910284 IP tom-Latitude-3570.39110 > vmi195435.contaboserver.net.8333: tcp 0
06:39:18.911188 IP vmi195435.contaboserver.net.8333 > tom-Latitude-3570.39110: tcp 284
06:39:18.911215 IP tom-Latitude-3570.39110 > vmi195435.contaboserver.net.8333: tcp 0
06:39:18.911231 IP vmi195435.contaboserver.net.8333 > tom-Latitude-3570.39110: tcp 24
06:39:18.911234 IP tom-Latitude-3570.39110 > vmi195435.contaboserver.net.8333: tcp 0
06:39:18.911637 IP tom-Latitude-3570.39110 > vmi195435.contaboserver.net.8333: tcp 24
06:39:18.913445 IP vmi195435.contaboserver.net.8333 > tom-Latitude-3570.39110: tcp 283
06:39:18.913462 IP vmi195435.contaboserver.net.8333 > tom-Latitude-3570.39110: tcp 24
06:39:18.913467 IP vmi195435.contaboserver.net.8333 > tom-Latitude-3570.39110: tcp 284
06:39:18.913481 IP tom-Latitude-3570.39110 > vmi195435.contaboserver.net.8333: tcp 37
06:39:18.913496 IP vmi195435.contaboserver.net.8333 > tom-Latitude-3570.39110: tcp 24
06:39:18.913501 IP vmi195435.contaboserver.net.8333 > tom-Latitude-3570.39110: tcp 284
06:39:18.913502 IP vmi195435.contaboserver.net.8333 > tom-Latitude-3570.39110: tcp 24
06:39:18.913505 IP vmi195435.contaboserver.net.8333 > tom-Latitude-3570.39110: tcp 284
06:39:18.913561 IP tom-Latitude-3570.39110 > vmi195435.contaboserver.net.8333: tcp 0
06:39:18.917074 IP tom-Latitude-3570.39110 > vmi195435.contaboserver.net.8333: tcp 244
06:39:18.949214 IP vmi195435.contaboserver.net.8333 > tom-Latitude-3570.39110: tcp 0
06:39:18.949228 IP vmi195435.contaboserver.net.8333 > tom-Latitude-3570.39110: tcp 0
06:39:18.949231 IP vmi195435.contaboserver.net.8333 > tom-Latitude-3570.39110: tcp 0
06:39:19.026119 IP vmi195435.contaboserver.net.8333 > tom-Latitude-3570.39110: tcp 24
06:39:19.026701 IP vmi195435.contaboserver.net.8333 > tom-Latitude-3570.39110: tcp 284
06:39:19.026762 IP tom-Latitude-3570.39110 > vmi195435.contaboserver.net.8333: tcp 0
06:39:19.027208 IP tom-Latitude-3570.39110 > vmi195435.contaboserver.net.8333: tcp 24
06:39:19.028378 IP tom-Latitude-3570.39110 > vmi195435.contaboserver.net.8333: tcp 37
06:39:19.029131 IP vmi195435.contaboserver.net.8333 > tom-Latitude-3570.39110: tcp 24
06:39:19.030841 IP vmi195435.contaboserver.net.8333 > tom-Latitude-3570.39110: tcp 283
06:39:19.030859 IP vmi195435.contaboserver.net.8333 > tom-Latitude-3570.39110: tcp 24
06:39:19.030863 IP vmi195435.contaboserver.net.8333 > tom-Latitude-3570.39110: tcp 283
06:39:19.030886 IP vmi195435.contaboserver.net.8333 > tom-Latitude-3570.39110: tcp 24
06:39:19.030889 IP vmi195435.contaboserver.net.8333 > tom-Latitude-3570.39110: tcp 284
06:39:19.030938 IP tom-Latitude-3570.39110 > vmi195435.contaboserver.net.8333: tcp 0
06:39:19.031296 IP tom-Latitude-3570.39110 > vmi195435.contaboserver.net.8333: tcp 61
06:39:19.031795 IP tom-Latitude-3570.39110 > vmi195435.contaboserver.net.8333: tcp 85
06:39:19.032774 IP tom-Latitude-3570.39110 > vmi195435.contaboserver.net.8333: tcp 37
06:39:19.033365 IP vmi195435.contaboserver.net.8333 > tom-Latitude-3570.39110: tcp 24
06:39:19.033378 IP vmi195435.contaboserver.net.8333 > tom-Latitude-3570.39110: tcp 283
06:39:19.033408 IP tom-Latitude-3570.39110 > vmi195435.contaboserver.net.8333: tcp 0
06:39:19.034093 IP tom-Latitude-3570.39110 > vmi195435.contaboserver.net.8333: tcp 61
06:39:19.060896 IP vmi195435.contaboserver.net.8333 > tom-Latitude-3570.39110: tcp 0
06:39:19.061934 IP vmi195435.contaboserver.net.8333 > tom-Latitude-3570.39110: tcp 0
06:39:19.061939 IP vmi195435.contaboserver.net.8333 > tom-Latitude-3570.39110: tcp 0
06:39:19.061942 IP vmi195435.contaboserver.net.8333 > tom-Latitude-3570.39110: tcp 0
06:39:19.068924 IP vmi195435.contaboserver.net.8333 > tom-Latitude-3570.39110: tcp 0
06:39:19.069549 IP vmi195435.contaboserver.net.8333 > tom-Latitude-3570.39110: tcp 0
06:39:19.143355 IP vmi195435.contaboserver.net.8333 > tom-Latitude-3570.39110: tcp 24
06:39:19.143375 IP vmi195435.contaboserver.net.8333 > tom-Latitude-3570.39110: tcp 433
06:39:19.143419 IP tom-Latitude-3570.39110 > vmi195435.contaboserver.net.8333: tcp 0
06:39:19.143716 IP tom-Latitude-3570.39110 > vmi195435.contaboserver.net.8333: tcp 24
06:39:19.144980 IP tom-Latitude-3570.39110 > vmi195435.contaboserver.net.8333: tcp 181
06:39:19.153739 IP vmi195435.contaboserver.net.8333 > tom-Latitude-3570.39110: tcp 24
06:39:19.154415 IP vmi195435.contaboserver.net.8333 > tom-Latitude-3570.39110: tcp 284
06:39:19.154427 IP tom-Latitude-3570.39110 > vmi195435.contaboserver.net.8333: tcp 0
06:39:19.154750 IP tom-Latitude-3570.39110 > vmi195435.contaboserver.net.8333: tcp 24
06:39:19.154758 IP tom-Latitude-3570.39110 > vmi195435.contaboserver.net.8333: tcp 37
06:39:19.165674 IP vmi195435.contaboserver.net.8333 > tom-Latitude-3570.39110: tcp 0
06:39:19.173607 IP vmi195435.contaboserver.net.8333 > tom-Latitude-3570.39110: tcp 0
06:39:19.177433 IP vmi195435.contaboserver.net.8333 > tom-Latitude-3570.39110: tcp 24
06:39:19.187561 IP vmi195435.contaboserver.net.8333 > tom-Latitude-3570.39110: tcp 283
06:39:19.187580 IP vmi195435.contaboserver.net.8333 > tom-Latitude-3570.39110: tcp 24
06:39:19.187584 IP vmi195435.contaboserver.net.8333 > tom-Latitude-3570.39110: tcp 283
06:39:19.187589 IP vmi195435.contaboserver.net.8333 > tom-Latitude-3570.39110: tcp 24
06:39:19.187592 IP vmi195435.contaboserver.net.8333 > tom-Latitude-3570.39110: tcp 283
06:39:19.187642 IP tom-Latitude-3570.39110 > vmi195435.contaboserver.net.8333: tcp 0
06:39:19.188079 IP tom-Latitude-3570.39110 > vmi195435.contaboserver.net.8333: tcp 24
06:39:19.188096 IP tom-Latitude-3570.39110 > vmi195435.contaboserver.net.8333: tcp 37
06:39:19.189843 IP tom-Latitude-3570.39110 > vmi195435.contaboserver.net.8333: tcp 122
06:39:19.191900 IP vmi195435.contaboserver.net.8333 > tom-Latitude-3570.39110: tcp 24
06:39:19.191915 IP vmi195435.contaboserver.net.8333 > tom-Latitude-3570.39110: tcp 284
06:39:19.191920 IP vmi195435.contaboserver.net.8333 > tom-Latitude-3570.39110: tcp 0
06:39:19.191960 IP tom-Latitude-3570.39110 > vmi195435.contaboserver.net.8333: tcp 0
06:39:19.192321 IP tom-Latitude-3570.39110 > vmi195435.contaboserver.net.8333: tcp 24
06:39:19.192335 IP tom-Latitude-3570.39110 > vmi195435.contaboserver.net.8333: tcp 37
06:39:19.238468 IP vmi195435.contaboserver.net.8333 > tom-Latitude-3570.39110: tcp 0
06:39:19.238483 IP vmi195435.contaboserver.net.8333 > tom-Latitude-3570.39110: tcp 0
06:39:19.252333 IP vmi195435.contaboserver.net.8333 > tom-Latitude-3570.39110: tcp 24
06:39:19.252357 IP vmi195435.contaboserver.net.8333 > tom-Latitude-3570.39110: tcp 224
06:39:19.252361 IP vmi195435.contaboserver.net.8333 > tom-Latitude-3570.39110: tcp 24
06:39:19.252364 IP vmi195435.contaboserver.net.8333 > tom-Latitude-3570.39110: tcp 668
06:39:19.252368 IP vmi195435.contaboserver.net.8333 > tom-Latitude-3570.39110: tcp 24
06:39:19.252398 IP tom-Latitude-3570.39110 > vmi195435.contaboserver.net.8333: tcp 0
06:39:19.253041 IP vmi195435.contaboserver.net.8333 > tom-Latitude-3570.39110: tcp 223
06:39:19.253061 IP vmi195435.contaboserver.net.8333 > tom-Latitude-3570.39110: tcp 24
06:39:19.253066 IP vmi195435.contaboserver.net.8333 > tom-Latitude-3570.39110: tcp 257
06:39:19.253069 IP vmi195435.contaboserver.net.8333 > tom-Latitude-3570.39110: tcp 24
06:39:19.253073 IP vmi195435.contaboserver.net.8333 > tom-Latitude-3570.39110: tcp 255
06:39:19.253107 IP tom-Latitude-3570.39110 > vmi195435.contaboserver.net.8333: tcp 0
06:39:19.266259 IP vmi195435.contaboserver.net.8333 > tom-Latitude-3570.39110: tcp 24
06:39:19.266879 IP vmi195435.contaboserver.net.8333 > tom-Latitude-3570.39110: tcp 284
06:39:19.266938 IP tom-Latitude-3570.39110 > vmi195435.contaboserver.net.8333: tcp 0
06:39:19.267322 IP tom-Latitude-3570.39110 > vmi195435.contaboserver.net.8333: tcp 24
06:39:19.268462 IP tom-Latitude-3570.39110 > vmi195435.contaboserver.net.8333: tcp 37
06:39:19.313361 IP vmi195435.contaboserver.net.8333 > tom-Latitude-3570.39110: tcp 24
06:39:19.320987 IP vmi195435.contaboserver.net.8333 > tom-Latitude-3570.39110: tcp 283
06:39:19.321011 IP vmi195435.contaboserver.net.8333 > tom-Latitude-3570.39110: tcp 0
06:39:19.321017 IP vmi195435.contaboserver.net.8333 > tom-Latitude-3570.39110: tcp 24
06:39:19.321071 IP tom-Latitude-3570.39110 > vmi195435.contaboserver.net.8333: tcp 0
06:39:19.321467 IP tom-Latitude-3570.39110 > vmi195435.contaboserver.net.8333: tcp 24
06:39:19.322584 IP vmi195435.contaboserver.net.8333 > tom-Latitude-3570.39110: tcp 283
06:39:19.322600 IP vmi195435.contaboserver.net.8333 > tom-Latitude-3570.39110: tcp 24
06:39:19.322602 IP vmi195435.contaboserver.net.8333 > tom-Latitude-3570.39110: tcp 284
06:39:19.322606 IP vmi195435.contaboserver.net.8333 > tom-Latitude-3570.39110: tcp 24
06:39:19.322608 IP vmi195435.contaboserver.net.8333 > tom-Latitude-3570.39110: tcp 283
06:39:19.322622 IP tom-Latitude-3570.39110 > vmi195435.contaboserver.net.8333: tcp 37
06:39:19.323812 IP tom-Latitude-3570.39110 > vmi195435.contaboserver.net.8333: tcp 183
06:39:19.358896 IP vmi195435.contaboserver.net.8333 > tom-Latitude-3570.39110: tcp 0
06:39:19.389953 IP vmi195435.contaboserver.net.8333 > tom-Latitude-3570.39110: tcp 24
06:39:19.390572 IP vmi195435.contaboserver.net.8333 > tom-Latitude-3570.39110: tcp 284
06:39:19.390631 IP tom-Latitude-3570.39110 > vmi195435.contaboserver.net.8333: tcp 0
06:39:19.391071 IP tom-Latitude-3570.39110 > vmi195435.contaboserver.net.8333: tcp 24
06:39:19.392431 IP tom-Latitude-3570.39110 > vmi195435.contaboserver.net.8333: tcp 37
06:39:19.430944 IP vmi195435.contaboserver.net.8333 > tom-Latitude-3570.39110: tcp 0
06:39:19.436746 IP vmi195435.contaboserver.net.8333 > tom-Latitude-3570.39110: tcp 24
06:39:19.436766 IP vmi195435.contaboserver.net.8333 > tom-Latitude-3570.39110: tcp 284
06:39:19.436773 IP vmi195435.contaboserver.net.8333 > tom-Latitude-3570.39110: tcp 24
06:39:19.436776 IP vmi195435.contaboserver.net.8333 > tom-Latitude-3570.39110: tcp 283
06:39:19.436807 IP tom-Latitude-3570.39110 > vmi195435.contaboserver.net.8333: tcp 0
06:39:19.437234 IP tom-Latitude-3570.39110 > vmi195435.contaboserver.net.8333: tcp 24
06:39:19.438455 IP tom-Latitude-3570.39110 > vmi195435.contaboserver.net.8333: tcp 98
06:39:19.439878 IP vmi195435.contaboserver.net.8333 > tom-Latitude-3570.39110: tcp 24
06:39:19.440589 IP vmi195435.contaboserver.net.8333 > tom-Latitude-3570.39110: tcp 283
06:39:19.440603 IP vmi195435.contaboserver.net.8333 > tom-Latitude-3570.39110: tcp 24
06:39:19.440607 IP vmi195435.contaboserver.net.8333 > tom-Latitude-3570.39110: tcp 284
06:39:19.440658 IP tom-Latitude-3570.39110 > vmi195435.contaboserver.net.8333: tcp 0
06:39:19.441040 IP tom-Latitude-3570.39110 > vmi195435.contaboserver.net.8333: tcp 24
06:39:19.441054 IP tom-Latitude-3570.39110 > vmi195435.contaboserver.net.8333: tcp 37
06:39:19.442443 IP tom-Latitude-3570.39110 > vmi195435.contaboserver.net.8333: tcp 61
06:39:19.470926 IP vmi195435.contaboserver.net.8333 > tom-Latitude-3570.39110: tcp 0
06:39:19.471663 IP vmi195435.contaboserver.net.8333 > tom-Latitude-3570.39110: tcp 0
06:39:19.509319 IP vmi195435.contaboserver.net.8333 > tom-Latitude-3570.39110: tcp 24
06:39:19.509342 IP vmi195435.contaboserver.net.8333 > tom-Latitude-3570.39110: tcp 284
06:39:19.509383 IP tom-Latitude-3570.39110 > vmi195435.contaboserver.net.8333: tcp 0
06:39:19.509803 IP tom-Latitude-3570.39110 > vmi195435.contaboserver.net.8333: tcp 24
06:39:19.511198 IP tom-Latitude-3570.39110 > vmi195435.contaboserver.net.8333: tcp 37
06:39:19.553041 IP vmi195435.contaboserver.net.8333 > tom-Latitude-3570.39110: tcp 24
06:39:19.553064 IP vmi195435.contaboserver.net.8333 > tom-Latitude-3570.39110: tcp 284
06:39:19.553069 IP vmi195435.contaboserver.net.8333 > tom-Latitude-3570.39110: tcp 24
06:39:19.553072 IP vmi195435.contaboserver.net.8333 > tom-Latitude-3570.39110: tcp 283
06:39:19.553074 IP vmi195435.contaboserver.net.8333 > tom-Latitude-3570.39110: tcp 24
06:39:19.553077 IP vmi195435.contaboserver.net.8333 > tom-Latitude-3570.39110: tcp 284
06:39:19.553079 IP vmi195435.contaboserver.net.8333 > tom-Latitude-3570.39110: tcp 0
06:39:19.553085 IP vmi195435.contaboserver.net.8333 > tom-Latitude-3570.39110: tcp 24
06:39:19.553088 IP vmi195435.contaboserver.net.8333 > tom-Latitude-3570.39110: tcp 283
06:39:19.553104 IP tom-Latitude-3570.39110 > vmi195435.contaboserver.net.8333: tcp 0
06:39:19.553463 IP tom-Latitude-3570.39110 > vmi195435.contaboserver.net.8333: tcp 24
06:39:19.554519 IP tom-Latitude-3570.39110 > vmi195435.contaboserver.net.8333: tcp 220
06:39:19.591066 IP vmi195435.contaboserver.net.8333 > tom-Latitude-3570.39110: tcp 0
06:39:19.630398 IP vmi195435.contaboserver.net.8333 > tom-Latitude-3570.39110: tcp 24
06:39:19.630418 IP vmi195435.contaboserver.net.8333 > tom-Latitude-3570.39110: tcp 284
06:39:19.630460 IP tom-Latitude-3570.39110 > vmi195435.contaboserver.net.8333: tcp 0
06:39:19.630882 IP tom-Latitude-3570.39110 > vmi195435.contaboserver.net.8333: tcp 24
06:39:19.633848 IP tom-Latitude-3570.39110 > vmi195435.contaboserver.net.8333: tcp 37
06:39:19.670319 IP vmi195435.contaboserver.net.8333 > tom-Latitude-3570.39110: tcp 24
06:39:19.670339 IP vmi195435.contaboserver.net.8333 > tom-Latitude-3570.39110: tcp 284
06:39:19.670343 IP vmi195435.contaboserver.net.8333 > tom-Latitude-3570.39110: tcp 24
06:39:19.670346 IP vmi195435.contaboserver.net.8333 > tom-Latitude-3570.39110: tcp 283
06:39:19.670351 IP vmi195435.contaboserver.net.8333 > tom-Latitude-3570.39110: tcp 0
06:39:19.670356 IP vmi195435.contaboserver.net.8333 > tom-Latitude-3570.39110: tcp 24
06:39:19.670402 IP tom-Latitude-3570.39110 > vmi195435.contaboserver.net.8333: tcp 0
06:39:19.670876 IP tom-Latitude-3570.39110 > vmi195435.contaboserver.net.8333: tcp 24
06:39:19.671830 IP tom-Latitude-3570.39110 > vmi195435.contaboserver.net.8333: tcp 98
06:39:19.673394 IP vmi195435.contaboserver.net.8333 > tom-Latitude-3570.39110: tcp 284
06:39:19.673413 IP vmi195435.contaboserver.net.8333 > tom-Latitude-3570.39110: tcp 24
06:39:19.673417 IP vmi195435.contaboserver.net.8333 > tom-Latitude-3570.39110: tcp 284
06:39:19.673457 IP tom-Latitude-3570.39110 > vmi195435.contaboserver.net.8333: tcp 0
06:39:19.673887 IP tom-Latitude-3570.39110 > vmi195435.contaboserver.net.8333: tcp 24
06:39:19.673902 IP tom-Latitude-3570.39110 > vmi195435.contaboserver.net.8333: tcp 37
06:39:19.675059 IP tom-Latitude-3570.39110 > vmi195435.contaboserver.net.8333: tcp 61
06:39:19.710662 IP vmi195435.contaboserver.net.8333 > tom-Latitude-3570.39110: tcp 0
06:39:19.711327 IP vmi195435.contaboserver.net.8333 > tom-Latitude-3570.39110: tcp 0
06:39:19.759267 IP vmi195435.contaboserver.net.8333 > tom-Latitude-3570.39110: tcp 24
06:39:19.759291 IP vmi195435.contaboserver.net.8333 > tom-Latitude-3570.39110: tcp 284
06:39:19.759331 IP tom-Latitude-3570.39110 > vmi195435.contaboserver.net.8333: tcp 0
06:39:19.759817 IP tom-Latitude-3570.39110 > vmi195435.contaboserver.net.8333: tcp 24
06:39:19.761001 IP tom-Latitude-3570.39110 > vmi195435.contaboserver.net.8333: tcp 37
06:39:19.790175 IP vmi195435.contaboserver.net.8333 > tom-Latitude-3570.39110: tcp 24
06:39:19.790970 IP vmi195435.contaboserver.net.8333 > tom-Latitude-3570.39110: tcp 283
06:39:19.790988 IP vmi195435.contaboserver.net.8333 > tom-Latitude-3570.39110: tcp 0
06:39:19.790996 IP vmi195435.contaboserver.net.8333 > tom-Latitude-3570.39110: tcp 24
06:39:19.791000 IP vmi195435.contaboserver.net.8333 > tom-Latitude-3570.39110: tcp 284
06:39:19.791002 IP vmi195435.contaboserver.net.8333 > tom-Latitude-3570.39110: tcp 24
06:39:19.791005 IP vmi195435.contaboserver.net.8333 > tom-Latitude-3570.39110: tcp 283
06:39:19.791032 IP tom-Latitude-3570.39110 > vmi195435.contaboserver.net.8333: tcp 0
06:39:19.791482 IP tom-Latitude-3570.39110 > vmi195435.contaboserver.net.8333: tcp 24
06:39:19.792659 IP tom-Latitude-3570.39110 > vmi195435.contaboserver.net.8333: tcp 159
06:39:19.794089 IP vmi195435.contaboserver.net.8333 > tom-Latitude-3570.39110: tcp 24
06:39:19.794105 IP vmi195435.contaboserver.net.8333 > tom-Latitude-3570.39110: tcp 284
06:39:19.794138 IP tom-Latitude-3570.39110 > vmi195435.contaboserver.net.8333: tcp 0
06:39:19.794485 IP tom-Latitude-3570.39110 > vmi195435.contaboserver.net.8333: tcp 24
06:39:19.794500 IP tom-Latitude-3570.39110 > vmi195435.contaboserver.net.8333: tcp 37
06:39:19.816931 IP 2.56.9.15.8333 > tom-Latitude-3570.42516: tcp 24
06:39:19.817512 IP 2.56.9.15.8333 > tom-Latitude-3570.42516: tcp 253
06:39:19.817615 IP tom-Latitude-3570.42516 > 2.56.9.15.8333: tcp 0
06:39:19.817857 IP tom-Latitude-3570.42516 > 2.56.9.15.8333: tcp 24
06:39:19.819066 IP tom-Latitude-3570.42516 > 2.56.9.15.8333: tcp 73
06:39:19.878330 IP vmi195435.contaboserver.net.8333 > tom-Latitude-3570.39110: tcp 0
06:39:19.878338 IP vmi195435.contaboserver.net.8333 > tom-Latitude-3570.39110: tcp 0
06:39:19.878341 IP 2.56.9.15.8333 > tom-Latitude-3570.42516: tcp 0
06:39:19.878343 IP vmi195435.contaboserver.net.8333 > tom-Latitude-3570.39110: tcp 24
06:39:19.886136 IP vmi195435.contaboserver.net.8333 > tom-Latitude-3570.39110: tcp 283
06:39:19.886148 IP tom-Latitude-3570.39110 > vmi195435.contaboserver.net.8333: tcp 0
06:39:19.886496 IP tom-Latitude-3570.39110 > vmi195435.contaboserver.net.8333: tcp 24
06:39:19.887674 IP tom-Latitude-3570.39110 > vmi195435.contaboserver.net.8333: tcp 37
06:39:19.910169 IP vmi195435.contaboserver.net.8333 > tom-Latitude-3570.39110: tcp 24
06:39:19.910190 IP vmi195435.contaboserver.net.8333 > tom-Latitude-3570.39110: tcp 283
06:39:19.910197 IP vmi195435.contaboserver.net.8333 > tom-Latitude-3570.39110: tcp 24
06:39:19.910200 IP vmi195435.contaboserver.net.8333 > tom-Latitude-3570.39110: tcp 283
06:39:19.910202 IP vmi195435.contaboserver.net.8333 > tom-Latitude-3570.39110: tcp 24
06:39:19.910205 IP vmi195435.contaboserver.net.8333 > tom-Latitude-3570.39110: tcp 284
06:39:19.910232 IP tom-Latitude-3570.39110 > vmi195435.contaboserver.net.8333: tcp 0
06:39:19.910660 IP tom-Latitude-3570.39110 > vmi195435.contaboserver.net.8333: tcp 24
06:39:19.910676 IP tom-Latitude-3570.39110 > vmi195435.contaboserver.net.8333: tcp 37
06:39:19.911791 IP tom-Latitude-3570.39110 > vmi195435.contaboserver.net.8333: tcp 122
06:39:19.913286 IP vmi195435.contaboserver.net.8333 > tom-Latitude-3570.39110: tcp 24
06:39:19.913307 IP vmi195435.contaboserver.net.8333 > tom-Latitude-3570.39110: tcp 284
06:39:19.913349 IP tom-Latitude-3570.39110 > vmi195435.contaboserver.net.8333: tcp 0
06:39:19.913836 IP tom-Latitude-3570.39110 > vmi195435.contaboserver.net.8333: tcp 24
06:39:19.913848 IP tom-Latitude-3570.39110 > vmi195435.contaboserver.net.8333: tcp 37
06:39:19.927739 IP vmi195435.contaboserver.net.8333 > tom-Latitude-3570.39110: tcp 0
06:39:19.950975 IP vmi195435.contaboserver.net.8333 > tom-Latitude-3570.39110: tcp 0
06:39:19.951563 IP vmi195435.contaboserver.net.8333 > tom-Latitude-3570.39110: tcp 0
06:39:19.958926 IP 2.56.9.15.8333 > tom-Latitude-3570.42516: tcp 24
06:39:19.965671 IP 2.56.9.15.8333 > tom-Latitude-3570.42516: tcp 190
06:39:19.965735 IP tom-Latitude-3570.42516 > 2.56.9.15.8333: tcp 0
06:39:19.966139 IP 2.56.9.15.8333 > tom-Latitude-3570.42516: tcp 24
06:39:19.966158 IP 2.56.9.15.8333 > tom-Latitude-3570.42516: tcp 225
06:39:19.966196 IP tom-Latitude-3570.42516 > 2.56.9.15.8333: tcp 0
06:39:19.991527 IP vmi195435.contaboserver.net.8333 > tom-Latitude-3570.39110: tcp 0
06:39:20.009307 IP vmi195435.contaboserver.net.8333 > tom-Latitude-3570.39110: tcp 24
06:39:20.009960 IP vmi195435.contaboserver.net.8333 > tom-Latitude-3570.39110: tcp 284
06:39:20.010044 IP tom-Latitude-3570.39110 > vmi195435.contaboserver.net.8333: tcp 0
06:39:20.010507 IP tom-Latitude-3570.39110 > vmi195435.contaboserver.net.8333: tcp 24
06:39:20.011906 IP tom-Latitude-3570.39110 > vmi195435.contaboserver.net.8333: tcp 37
06:39:20.046319 IP vmi195435.contaboserver.net.8333 > tom-Latitude-3570.39110: tcp 24
06:39:20.047191 IP vmi195435.contaboserver.net.8333 > tom-Latitude-3570.39110: tcp 283
06:39:20.047209 IP vmi195435.contaboserver.net.8333 > tom-Latitude-3570.39110: tcp 24
06:39:20.047214 IP vmi195435.contaboserver.net.8333 > tom-Latitude-3570.39110: tcp 283
06:39:20.047219 IP vmi195435.contaboserver.net.8333 > tom-Latitude-3570.39110: tcp 24
06:39:20.047222 IP vmi195435.contaboserver.net.8333 > tom-Latitude-3570.39110: tcp 283
06:39:20.047224 IP vmi195435.contaboserver.net.8333 > tom-Latitude-3570.39110: tcp 24
06:39:20.047228 IP vmi195435.contaboserver.net.8333 > tom-Latitude-3570.39110: tcp 283
06:39:20.047230 IP vmi195435.contaboserver.net.8333 > tom-Latitude-3570.39110: tcp 0
06:39:20.047235 IP vmi195435.contaboserver.net.8333 > tom-Latitude-3570.39110: tcp 0
06:39:20.047253 IP tom-Latitude-3570.39110 > vmi195435.contaboserver.net.8333: tcp 0
06:39:20.047650 IP tom-Latitude-3570.39110 > vmi195435.contaboserver.net.8333: tcp 24
06:39:20.048656 IP tom-Latitude-3570.39110 > vmi195435.contaboserver.net.8333: tcp 220
06:39:20.091088 IP vmi195435.contaboserver.net.8333 > tom-Latitude-3570.39110: tcp 0
06:39:20.091100 IP vmi195435.contaboserver.net.8333 > tom-Latitude-3570.39110: tcp 0
06:39:20.126437 IP vmi195435.contaboserver.net.8333 > tom-Latitude-3570.39110: tcp 24
06:39:20.127101 IP vmi195435.contaboserver.net.8333 > tom-Latitude-3570.39110: tcp 283
06:39:20.127161 IP tom-Latitude-3570.39110 > vmi195435.contaboserver.net.8333: tcp 0
06:39:20.127602 IP tom-Latitude-3570.39110 > vmi195435.contaboserver.net.8333: tcp 24
