21:54:22.505043 IP 59.110.157.16.8333 > tom-Latitude-3570.47822: tcp 0
21:54:22.510771 IP 97-82-78-25.dhcp.leds.al.charter.com.8333 > tom-Latitude-3570.47742: tcp 24
21:54:22.510782 IP tom-Latitude-3570.47742 > 97-82-78-25.dhcp.leds.al.charter.com.8333: tcp 0
21:54:22.511463 IP 97-82-78-25.dhcp.leds.al.charter.com.8333 > tom-Latitude-3570.47742: tcp 73
21:54:22.511467 IP tom-Latitude-3570.47742 > 97-82-78-25.dhcp.leds.al.charter.com.8333: tcp 0
21:54:22.511605 IP tom-Latitude-3570.47742 > 97-82-78-25.dhcp.leds.al.charter.com.8333: tcp 24
21:54:22.512749 IP tom-Latitude-3570.47742 > 97-82-78-25.dhcp.leds.al.charter.com.8333: tcp 37
21:54:22.584687 IP 97-82-78-25.dhcp.leds.al.charter.com.8333 > tom-Latitude-3570.47742: tcp 0
21:54:22.664435 IP 97-82-78-25.dhcp.leds.al.charter.com.8333 > tom-Latitude-3570.47742: tcp 0
21:54:22.830648 IP 97-82-78-25.dhcp.leds.al.charter.com.8333 > tom-Latitude-3570.47742: tcp 24
21:54:22.831331 IP 97-82-78-25.dhcp.leds.al.charter.com.8333 > tom-Latitude-3570.47742: tcp 249
21:54:22.831432 IP tom-Latitude-3570.47742 > 97-82-78-25.dhcp.leds.al.charter.com.8333: tcp 0
21:54:23.132550 IP tom-Latitude-3570.33922 > pool-108-20-207-31.bstnma.fios.verizon.net.8333: tcp 24
21:54:23.151790 IP tom-Latitude-3570.33922 > pool-108-20-207-31.bstnma.fios.verizon.net.8333: tcp 829
21:54:23.208932 IP pool-108-20-207-31.bstnma.fios.verizon.net.8333 > tom-Latitude-3570.33922: tcp 0
21:54:23.250460 IP pool-108-20-207-31.bstnma.fios.verizon.net.8333 > tom-Latitude-3570.33922: tcp 0
21:54:23.332984 IP tom-Latitude-3570.47822 > 59.110.157.16.8333: tcp 24
21:54:23.333798 IP tom-Latitude-3570.47822 > 59.110.157.16.8333: tcp 109
21:54:23.401120 IP 59.110.157.16.8333 > tom-Latitude-3570.47822: tcp 0
21:54:23.499551 IP 59.110.157.16.8333 > tom-Latitude-3570.47822: tcp 24
21:54:23.499559 IP tom-Latitude-3570.47822 > 59.110.157.16.8333: tcp 0
21:54:23.503574 IP 59.110.157.16.8333 > tom-Latitude-3570.47822: tcp 325
21:54:23.503582 IP tom-Latitude-3570.47822 > 59.110.157.16.8333: tcp 0
21:54:23.503835 IP tom-Latitude-3570.47822 > 59.110.157.16.8333: tcp 24
21:54:23.503909 IP tom-Latitude-3570.54046 > 184-101-12-201.phnx.qwest.net.8333: tcp 24
21:54:23.504920 IP tom-Latitude-3570.54046 > 184-101-12-201.phnx.qwest.net.8333: tcp 253
21:54:23.504924 IP tom-Latitude-3570.47822 > 59.110.157.16.8333: tcp 217
21:54:23.546057 IP 184-101-12-201.phnx.qwest.net.8333 > tom-Latitude-3570.54046: tcp 0
21:54:23.549096 IP 184-101-12-201.phnx.qwest.net.8333 > tom-Latitude-3570.54046: tcp 0
21:54:23.555017 IP 59.110.157.16.8333 > tom-Latitude-3570.47822: tcp 0
21:54:23.704426 IP tom-Latitude-3570.59818 > c-73-101-52-184.hsd1.pa.comcast.net.8333: tcp 24
21:54:23.705230 IP tom-Latitude-3570.59818 > c-73-101-52-184.hsd1.pa.comcast.net.8333: tcp 397
21:54:23.730946 IP 97-82-78-25.dhcp.leds.al.charter.com.8333 > tom-Latitude-3570.47742: tcp 24
21:54:23.734154 IP 97-82-78-25.dhcp.leds.al.charter.com.8333 > tom-Latitude-3570.47742: tcp 253
21:54:23.734173 IP tom-Latitude-3570.47742 > 97-82-78-25.dhcp.leds.al.charter.com.8333: tcp 0
21:54:23.734393 IP tom-Latitude-3570.47742 > 97-82-78-25.dhcp.leds.al.charter.com.8333: tcp 24
21:54:23.735540 IP tom-Latitude-3570.47742 > 97-82-78-25.dhcp.leds.al.charter.com.8333: tcp 37
21:54:23.768823 IP c-73-101-52-184.hsd1.pa.comcast.net.8333 > tom-Latitude-3570.59818: tcp 0
21:54:23.769507 IP c-73-101-52-184.hsd1.pa.comcast.net.8333 > tom-Latitude-3570.59818: tcp 0
21:54:23.772511 IP 97-82-78-25.dhcp.leds.al.charter.com.8333 > tom-Latitude-3570.47742: tcp 0
21:54:23.798974 IP 59.110.157.16.8333 > tom-Latitude-3570.47822: tcp 24
21:54:23.799645 IP 59.110.157.16.8333 > tom-Latitude-3570.47822: tcp 191
21:54:23.799651 IP 59.110.157.16.8333 > tom-Latitude-3570.47822: tcp 24
21:54:23.799667 IP tom-Latitude-3570.47822 > 59.110.157.16.8333: tcp 0
21:54:23.804865 IP 97-82-78-25.dhcp.leds.al.charter.com.8333 > tom-Latitude-3570.47742: tcp 0
21:54:23.944514 IP 184-101-12-201.phnx.qwest.net.8333 > tom-Latitude-3570.54046: tcp 24
21:54:23.948232 IP 184-101-12-201.phnx.qwest.net.8333 > tom-Latitude-3570.54046: tcp 217
21:54:23.948260 IP tom-Latitude-3570.54046 > 184-101-12-201.phnx.qwest.net.8333: tcp 0
21:54:23.948416 IP tom-Latitude-3570.59818 > c-73-101-52-184.hsd1.pa.comcast.net.8333: tcp 24
21:54:23.949608 IP tom-Latitude-3570.59818 > c-73-101-52-184.hsd1.pa.comcast.net.8333: tcp 37
21:54:23.980710 IP 97-82-78-25.dhcp.leds.al.charter.com.8333 > tom-Latitude-3570.47742: tcp 24
21:54:23.981450 IP 97-82-78-25.dhcp.leds.al.charter.com.8333 > tom-Latitude-3570.47742: tcp 281
21:54:23.981487 IP tom-Latitude-3570.47742 > 97-82-78-25.dhcp.leds.al.charter.com.8333: tcp 0
21:54:24.003625 IP c-73-101-52-184.hsd1.pa.comcast.net.8333 > tom-Latitude-3570.59818: tcp 0
21:54:24.003631 IP c-73-101-52-184.hsd1.pa.comcast.net.8333 > tom-Latitude-3570.59818: tcp 0
21:54:24.042949 IP 59.110.157.16.8333 > tom-Latitude-3570.47822: tcp 1332
21:54:24.043107 IP tom-Latitude-3570.34082 > host93-234-110-95.serverdedicati.aruba.it.8333: tcp 24
21:54:24.043877 IP tom-Latitude-3570.34082 > host93-234-110-95.serverdedicati.aruba.it.8333: tcp 217
21:54:24.083789 IP tom-Latitude-3570.47822 > 59.110.157.16.8333: tcp 0
21:54:24.106739 IP host93-234-110-95.serverdedicati.aruba.it.8333 > tom-Latitude-3570.34082: tcp 0
21:54:24.112137 IP host93-234-110-95.serverdedicati.aruba.it.8333 > tom-Latitude-3570.34082: tcp 0
21:54:24.144936 IP tom-Latitude-3570.34082 > host93-234-110-95.serverdedicati.aruba.it.8333: tcp 24
21:54:24.145723 IP tom-Latitude-3570.34082 > host93-234-110-95.serverdedicati.aruba.it.8333: tcp 181
21:54:24.192441 IP host93-234-110-95.serverdedicati.aruba.it.8333 > tom-Latitude-3570.34082: tcp 0
21:54:24.193035 IP host93-234-110-95.serverdedicati.aruba.it.8333 > tom-Latitude-3570.34082: tcp 0
21:54:24.650887 IP 184-101-12-201.phnx.qwest.net.8333 > tom-Latitude-3570.54046: tcp 24
21:54:24.651617 IP 184-101-12-201.phnx.qwest.net.8333 > tom-Latitude-3570.54046: tcp 217
21:54:24.651741 IP tom-Latitude-3570.54046 > 184-101-12-201.phnx.qwest.net.8333: tcp 0
21:54:24.651970 IP tom-Latitude-3570.54046 > 184-101-12-201.phnx.qwest.net.8333: tcp 24
21:54:24.653652 IP tom-Latitude-3570.54046 > 184-101-12-201.phnx.qwest.net.8333: tcp 181
21:54:24.728528 IP 184-101-12-201.phnx.qwest.net.8333 > tom-Latitude-3570.54046: tcp 0
21:54:24.852441 IP tom-Latitude-3570.36650 > ec2-52-56-97-80.eu-west-2.compute.amazonaws.com.8333: tcp 24
21:54:24.852515 IP tom-Latitude-3570.33922 > pool-108-20-207-31.bstnma.fios.verizon.net.8333: tcp 24
21:54:24.853275 IP tom-Latitude-3570.33922 > pool-108-20-207-31.bstnma.fios.verizon.net.8333: tcp 253
21:54:24.853280 IP tom-Latitude-3570.36650 > ec2-52-56-97-80.eu-west-2.compute.amazonaws.com.8333: tcp 397
21:54:24.934993 IP 184-101-12-201.phnx.qwest.net.8333 > tom-Latitude-3570.54046: tcp 0
21:54:24.952543 IP ec2-52-56-97-80.eu-west-2.compute.amazonaws.com.8333 > tom-Latitude-3570.36650: tcp 0
21:54:24.952672 IP tom-Latitude-3570.59818 > c-73-101-52-184.hsd1.pa.comcast.net.8333: tcp 24
21:54:24.953508 IP tom-Latitude-3570.59818 > c-73-101-52-184.hsd1.pa.comcast.net.8333: tcp 217
21:54:24.996747 IP pool-108-20-207-31.bstnma.fios.verizon.net.8333 > tom-Latitude-3570.33922: tcp 0
21:54:25.000575 IP pool-108-20-207-31.bstnma.fios.verizon.net.8333 > tom-Latitude-3570.33922: tcp 0
21:54:25.001165 IP ec2-52-56-97-80.eu-west-2.compute.amazonaws.com.8333 > tom-Latitude-3570.36650: tcp 0
21:54:25.001190 IP c-73-101-52-184.hsd1.pa.comcast.net.8333 > tom-Latitude-3570.59818: tcp 0
21:54:25.001192 IP c-73-101-52-184.hsd1.pa.comcast.net.8333 > tom-Latitude-3570.59818: tcp 0
21:54:25.155946 IP 184-101-12-201.phnx.qwest.net.8333 > tom-Latitude-3570.54046: tcp 24
21:54:25.171060 IP 184-101-12-201.phnx.qwest.net.8333 > tom-Latitude-3570.54046: tcp 1382
21:54:25.171163 IP tom-Latitude-3570.54046 > 184-101-12-201.phnx.qwest.net.8333: tcp 0
21:54:25.171647 IP 184-101-12-201.phnx.qwest.net.8333 > tom-Latitude-3570.54046: tcp 58
21:54:25.185893 IP 184-101-12-201.phnx.qwest.net.8333 > tom-Latitude-3570.54046: tcp 1232
21:54:25.185990 IP tom-Latitude-3570.54046 > 184-101-12-201.phnx.qwest.net.8333: tcp 0
21:54:25.440013 IP c-73-101-52-184.hsd1.pa.comcast.net.8333 > tom-Latitude-3570.59818: tcp 24
21:54:25.440028 IP tom-Latitude-3570.59818 > c-73-101-52-184.hsd1.pa.comcast.net.8333: tcp 0
21:54:25.443375 IP c-73-101-52-184.hsd1.pa.comcast.net.8333 > tom-Latitude-3570.59818: tcp 217
21:54:25.443383 IP tom-Latitude-3570.59818 > c-73-101-52-184.hsd1.pa.comcast.net.8333: tcp 0
21:54:25.443659 IP tom-Latitude-3570.59818 > c-73-101-52-184.hsd1.pa.comcast.net.8333: tcp 24
21:54:25.444684 IP tom-Latitude-3570.59818 > c-73-101-52-184.hsd1.pa.comcast.net.8333: tcp 37
21:54:25.540686 IP c-73-101-52-184.hsd1.pa.comcast.net.8333 > tom-Latitude-3570.59818: tcp 0
21:54:25.541189 IP c-73-101-52-184.hsd1.pa.comcast.net.8333 > tom-Latitude-3570.59818: tcp 0
21:54:25.710604 IP c-73-101-52-184.hsd1.pa.comcast.net.8333 > tom-Latitude-3570.59818: tcp 24
21:54:25.710617 IP c-73-101-52-184.hsd1.pa.comcast.net.8333 > tom-Latitude-3570.59818: tcp 838
21:54:25.710690 IP tom-Latitude-3570.59818 > c-73-101-52-184.hsd1.pa.comcast.net.8333: tcp 0
21:54:26.018724 IP 97-82-78-25.dhcp.leds.al.charter.com.8333 > tom-Latitude-3570.47742: tcp 24
21:54:26.019334 IP 97-82-78-25.dhcp.leds.al.charter.com.8333 > tom-Latitude-3570.47742: tcp 361
21:54:26.019357 IP tom-Latitude-3570.47742 > 97-82-78-25.dhcp.leds.al.charter.com.8333: tcp 0
21:54:26.019613 IP tom-Latitude-3570.47742 > 97-82-78-25.dhcp.leds.al.charter.com.8333: tcp 24
21:54:26.020756 IP tom-Latitude-3570.47742 > 97-82-78-25.dhcp.leds.al.charter.com.8333: tcp 145
21:54:26.058833 IP 172.214.77.34.bc.googleusercontent.com.8333 > tom-Latitude-3570.56244: tcp 24
21:54:26.063589 IP 172.214.77.34.bc.googleusercontent.com.8333 > tom-Latitude-3570.56244: tcp 757
21:54:26.063610 IP tom-Latitude-3570.56244 > 172.214.77.34.bc.googleusercontent.com.8333: tcp 0
21:54:26.120523 IP 97-82-78-25.dhcp.leds.al.charter.com.8333 > tom-Latitude-3570.47742: tcp 0
21:54:26.196539 IP 97-82-78-25.dhcp.leds.al.charter.com.8333 > tom-Latitude-3570.47742: tcp 0
21:54:26.358922 IP 97-82-78-25.dhcp.leds.al.charter.com.8333 > tom-Latitude-3570.47742: tcp 24
21:54:26.359624 IP 97-82-78-25.dhcp.leds.al.charter.com.8333 > tom-Latitude-3570.47742: tcp 223
21:54:26.359631 IP 97-82-78-25.dhcp.leds.al.charter.com.8333 > tom-Latitude-3570.47742: tcp 24
21:54:26.359649 IP tom-Latitude-3570.47742 > 97-82-78-25.dhcp.leds.al.charter.com.8333: tcp 0
21:54:26.365040 IP 97-82-78-25.dhcp.leds.al.charter.com.8333 > tom-Latitude-3570.47742: tcp 247
21:54:26.365686 IP 97-82-78-25.dhcp.leds.al.charter.com.8333 > tom-Latitude-3570.47742: tcp 24
21:54:26.365705 IP tom-Latitude-3570.47742 > 97-82-78-25.dhcp.leds.al.charter.com.8333: tcp 0
21:54:26.368411 IP 97-82-78-25.dhcp.leds.al.charter.com.8333 > tom-Latitude-3570.47742: tcp 1382
21:54:26.369077 IP 97-82-78-25.dhcp.leds.al.charter.com.8333 > tom-Latitude-3570.47742: tcp 78
21:54:26.369095 IP tom-Latitude-3570.47742 > 97-82-78-25.dhcp.leds.al.charter.com.8333: tcp 0
21:54:26.372243 IP 97-82-78-25.dhcp.leds.al.charter.com.8333 > tom-Latitude-3570.47742: tcp 1382
21:54:26.373001 IP 97-82-78-25.dhcp.leds.al.charter.com.8333 > tom-Latitude-3570.47742: tcp 78
21:54:26.373025 IP 97-82-78-25.dhcp.leds.al.charter.com.8333 > tom-Latitude-3570.47742: tcp 874
21:54:26.373028 IP 97-82-78-25.dhcp.leds.al.charter.com.8333 > tom-Latitude-3570.47742: tcp 24
21:54:26.373038 IP tom-Latitude-3570.47742 > 97-82-78-25.dhcp.leds.al.charter.com.8333: tcp 0
21:54:26.377729 IP 97-82-78-25.dhcp.leds.al.charter.com.8333 > tom-Latitude-3570.47742: tcp 225
21:54:26.419771 IP tom-Latitude-3570.47742 > 97-82-78-25.dhcp.leds.al.charter.com.8333: tcp 0
21:54:26.624319 IP c-73-101-52-184.hsd1.pa.comcast.net.8333 > tom-Latitude-3570.59818: tcp 24
21:54:26.628031 IP c-73-101-52-184.hsd1.pa.comcast.net.8333 > tom-Latitude-3570.59818: tcp 181
21:54:26.628054 IP tom-Latitude-3570.59818 > c-73-101-52-184.hsd1.pa.comcast.net.8333: tcp 0
21:54:26.628269 IP tom-Latitude-3570.59818 > c-73-101-52-184.hsd1.pa.comcast.net.8333: tcp 24
21:54:26.629387 IP tom-Latitude-3570.59818 > c-73-101-52-184.hsd1.pa.comcast.net.8333: tcp 37
21:54:26.662528 IP c-73-101-52-184.hsd1.pa.comcast.net.8333 > tom-Latitude-3570.59818: tcp 0
21:54:26.663107 IP c-73-101-52-184.hsd1.pa.comcast.net.8333 > tom-Latitude-3570.59818: tcp 0
21:54:26.820872 IP c-73-101-52-184.hsd1.pa.comcast.net.8333 > tom-Latitude-3570.59818: tcp 24
21:54:26.824647 IP c-73-101-52-184.hsd1.pa.comcast.net.8333 > tom-Latitude-3570.59818: tcp 223
21:54:26.824671 IP tom-Latitude-3570.59818 > c-73-101-52-184.hsd1.pa.comcast.net.8333: tcp 0
21:54:27.272855 IP pool-108-20-207-31.bstnma.fios.verizon.net.8333 > tom-Latitude-3570.33922: tcp 24
21:54:27.272875 IP tom-Latitude-3570.33922 > pool-108-20-207-31.bstnma.fios.verizon.net.8333: tcp 0
21:54:27.273443 IP pool-108-20-207-31.bstnma.fios.verizon.net.8333 > tom-Latitude-3570.33922: tcp 8
21:54:27.273448 IP tom-Latitude-3570.33922 > pool-108-20-207-31.bstnma.fios.verizon.net.8333: tcp 0
21:54:27.273592 IP tom-Latitude-3570.33922 > pool-108-20-207-31.bstnma.fios.verizon.net.8333: tcp 24
21:54:27.274822 IP tom-Latitude-3570.33922 > pool-108-20-207-31.bstnma.fios.verizon.net.8333: tcp 8
21:54:27.328558 IP pool-108-20-207-31.bstnma.fios.verizon.net.8333 > tom-Latitude-3570.33922: tcp 0
21:54:27.349493 IP pool-108-20-207-31.bstnma.fios.verizon.net.8333 > tom-Latitude-3570.33922: tcp 0
21:54:27.373846 IP tom-Latitude-3570.59818 > c-73-101-52-184.hsd1.pa.comcast.net.8333: tcp 24
21:54:27.374635 IP tom-Latitude-3570.59818 > c-73-101-52-184.hsd1.pa.comcast.net.8333: tcp 8
21:54:27.406486 IP c-73-101-52-184.hsd1.pa.comcast.net.8333 > tom-Latitude-3570.59818: tcp 0
21:54:27.407027 IP c-73-101-52-184.hsd1.pa.comcast.net.8333 > tom-Latitude-3570.59818: tcp 0
21:54:27.474175 IP tom-Latitude-3570.33922 > pool-108-20-207-31.bstnma.fios.verizon.net.8333: tcp 24
21:54:27.475019 IP tom-Latitude-3570.33922 > pool-108-20-207-31.bstnma.fios.verizon.net.8333: tcp 397
21:54:27.538630 IP pool-108-20-207-31.bstnma.fios.verizon.net.8333 > tom-Latitude-3570.33922: tcp 0
21:54:27.558449 IP pool-108-20-207-31.bstnma.fios.verizon.net.8333 > tom-Latitude-3570.33922: tcp 0
21:54:27.568563 IP c-73-101-52-184.hsd1.pa.comcast.net.8333 > tom-Latitude-3570.59818: tcp 24
21:54:27.569153 IP c-73-101-52-184.hsd1.pa.comcast.net.8333 > tom-Latitude-3570.59818: tcp 8
21:54:27.569179 IP tom-Latitude-3570.59818 > c-73-101-52-184.hsd1.pa.comcast.net.8333: tcp 0
21:54:27.970018 IP tom-Latitude-3570.47742 > 97-82-78-25.dhcp.leds.al.charter.com.8333: tcp 24
21:54:27.971356 IP tom-Latitude-3570.47742 > 97-82-78-25.dhcp.leds.al.charter.com.8333: tcp 37
21:54:28.040799 IP 97-82-78-25.dhcp.leds.al.charter.com.8333 > tom-Latitude-3570.47742: tcp 0
21:54:28.088651 IP 97-82-78-25.dhcp.leds.al.charter.com.8333 > tom-Latitude-3570.47742: tcp 0
21:54:28.270653 IP tom-Latitude-3570.56244 > 172.214.77.34.bc.googleusercontent.com.8333: tcp 24
21:54:28.270728 IP tom-Latitude-3570.54046 > 184-101-12-201.phnx.qwest.net.8333: tcp 24
21:54:28.271498 IP tom-Latitude-3570.54046 > 184-101-12-201.phnx.qwest.net.8333: tcp 217
21:54:28.271504 IP tom-Latitude-3570.56244 > 172.214.77.34.bc.googleusercontent.com.8333: tcp 37
21:54:28.424607 IP 184-101-12-201.phnx.qwest.net.8333 > tom-Latitude-3570.54046: tcp 0
21:54:28.488745 IP 172.214.77.34.bc.googleusercontent.com.8333 > tom-Latitude-3570.56244: tcp 0
21:54:28.679510 IP 184-101-12-201.phnx.qwest.net.8333 > tom-Latitude-3570.54046: tcp 0
21:54:28.808526 IP 172.214.77.34.bc.googleusercontent.com.8333 > tom-Latitude-3570.56244: tcp 0
21:54:29.172510 IP tom-Latitude-3570.34082 > host93-234-110-95.serverdedicati.aruba.it.8333: tcp 24
21:54:29.173323 IP tom-Latitude-3570.34082 > host93-234-110-95.serverdedicati.aruba.it.8333: tcp 397
21:54:29.433725 IP 97-82-78-25.dhcp.leds.al.charter.com.8333 > tom-Latitude-3570.47742: tcp 24
21:54:29.433743 IP tom-Latitude-3570.47742 > 97-82-78-25.dhcp.leds.al.charter.com.8333: tcp 0
21:54:29.437340 IP 97-82-78-25.dhcp.leds.al.charter.com.8333 > tom-Latitude-3570.47742: tcp 541
21:54:29.437344 IP tom-Latitude-3570.47742 > 97-82-78-25.dhcp.leds.al.charter.com.8333: tcp 0
21:54:29.437652 IP tom-Latitude-3570.47742 > 97-82-78-25.dhcp.leds.al.charter.com.8333: tcp 24
21:54:29.437765 IP tom-Latitude-3570.47822 > 59.110.157.16.8333: tcp 24
21:54:29.438660 IP tom-Latitude-3570.47822 > 59.110.157.16.8333: tcp 433
21:54:29.438665 IP tom-Latitude-3570.47742 > 97-82-78-25.dhcp.leds.al.charter.com.8333: tcp 541
21:54:29.467684 IP tom-Latitude-3570.34082 > host93-234-110-95.serverdedicati.aruba.it.8333: tcp 397
21:54:29.550492 IP host93-234-110-95.serverdedicati.aruba.it.8333 > tom-Latitude-3570.34082: tcp 0
21:54:29.550519 IP host93-234-110-95.serverdedicati.aruba.it.8333 > tom-Latitude-3570.34082: tcp 0
21:54:29.588882 IP 97-82-78-25.dhcp.leds.al.charter.com.8333 > tom-Latitude-3570.47742: tcp 541
21:54:29.588898 IP tom-Latitude-3570.47742 > 97-82-78-25.dhcp.leds.al.charter.com.8333: tcp 0
21:54:29.667771 IP tom-Latitude-3570.47742 > 97-82-78-25.dhcp.leds.al.charter.com.8333: tcp 541
21:54:29.723768 IP tom-Latitude-3570.47822 > 59.110.157.16.8333: tcp 433
21:54:29.752939 IP 97-82-78-25.dhcp.leds.al.charter.com.8333 > tom-Latitude-3570.47742: tcp 0
21:54:29.908799 IP 59.110.157.16.8333 > tom-Latitude-3570.47822: tcp 0
21:54:29.944629 IP 59.110.157.16.8333 > tom-Latitude-3570.47822: tcp 0
21:54:30.211771 IP tom-Latitude-3570.47742 > 97-82-78-25.dhcp.leds.al.charter.com.8333: tcp 541
21:54:30.411039 IP 97-82-78-25.dhcp.leds.al.charter.com.8333 > tom-Latitude-3570.47742: tcp 0
21:54:30.424592 IP host93-234-110-95.serverdedicati.aruba.it.8333 > tom-Latitude-3570.34082: tcp 0
21:54:30.486528 IP 97-82-78-25.dhcp.leds.al.charter.com.8333 > tom-Latitude-3570.47742: tcp 0
21:54:30.487194 IP 59.110.157.16.8333 > tom-Latitude-3570.47822: tcp 0
21:54:30.539773 IP tom-Latitude-3570.36650 > ec2-52-56-97-80.eu-west-2.compute.amazonaws.com.8333: tcp 24
21:54:30.540585 IP tom-Latitude-3570.36650 > ec2-52-56-97-80.eu-west-2.compute.amazonaws.com.8333: tcp 397
21:54:30.571827 IP 97-82-78-25.dhcp.leds.al.charter.com.8333 > tom-Latitude-3570.47742: tcp 24
21:54:30.571833 IP tom-Latitude-3570.47742 > 97-82-78-25.dhcp.leds.al.charter.com.8333: tcp 0
21:54:30.582972 IP 97-82-78-25.dhcp.leds.al.charter.com.8333 > tom-Latitude-3570.47742: tcp 1223
21:54:30.582984 IP tom-Latitude-3570.47742 > 97-82-78-25.dhcp.leds.al.charter.com.8333: tcp 0
21:54:30.583640 IP 97-82-78-25.dhcp.leds.al.charter.com.8333 > tom-Latitude-3570.47742: tcp 24
21:54:30.583645 IP tom-Latitude-3570.47742 > 97-82-78-25.dhcp.leds.al.charter.com.8333: tcp 0
21:54:30.583652 IP 97-82-78-25.dhcp.leds.al.charter.com.8333 > tom-Latitude-3570.47742: tcp 672
21:54:30.583654 IP tom-Latitude-3570.47742 > 97-82-78-25.dhcp.leds.al.charter.com.8333: tcp 0
21:54:30.583657 IP 97-82-78-25.dhcp.leds.al.charter.com.8333 > tom-Latitude-3570.47742: tcp 24
21:54:30.583658 IP tom-Latitude-3570.47742 > 97-82-78-25.dhcp.leds.al.charter.com.8333: tcp 0
21:54:30.586151 IP 97-82-78-25.dhcp.leds.al.charter.com.8333 > tom-Latitude-3570.47742: tcp 1104
21:54:30.586155 IP tom-Latitude-3570.47742 > 97-82-78-25.dhcp.leds.al.charter.com.8333: tcp 0
21:54:30.586689 IP 97-82-78-25.dhcp.leds.al.charter.com.8333 > tom-Latitude-3570.47742: tcp 24
21:54:30.586694 IP tom-Latitude-3570.47742 > 97-82-78-25.dhcp.leds.al.charter.com.8333: tcp 0
21:54:30.589254 IP 97-82-78-25.dhcp.leds.al.charter.com.8333 > tom-Latitude-3570.47742: tcp 405
21:54:30.589259 IP tom-Latitude-3570.47742 > 97-82-78-25.dhcp.leds.al.charter.com.8333: tcp 0
21:54:30.589806 IP 97-82-78-25.dhcp.leds.al.charter.com.8333 > tom-Latitude-3570.47742: tcp 24
21:54:30.589811 IP tom-Latitude-3570.47742 > 97-82-78-25.dhcp.leds.al.charter.com.8333: tcp 0
21:54:30.594736 IP 97-82-78-25.dhcp.leds.al.charter.com.8333 > tom-Latitude-3570.47742: tcp 247
21:54:30.594741 IP tom-Latitude-3570.47742 > 97-82-78-25.dhcp.leds.al.charter.com.8333: tcp 0
21:54:30.594748 IP 97-82-78-25.dhcp.leds.al.charter.com.8333 > tom-Latitude-3570.47742: tcp 24
21:54:30.594750 IP tom-Latitude-3570.47742 > 97-82-78-25.dhcp.leds.al.charter.com.8333: tcp 0
21:54:30.594753 IP 97-82-78-25.dhcp.leds.al.charter.com.8333 > tom-Latitude-3570.47742: tcp 486
21:54:30.594754 IP tom-Latitude-3570.47742 > 97-82-78-25.dhcp.leds.al.charter.com.8333: tcp 0
21:54:30.594756 IP 97-82-78-25.dhcp.leds.al.charter.com.8333 > tom-Latitude-3570.47742: tcp 24
21:54:30.594757 IP tom-Latitude-3570.47742 > 97-82-78-25.dhcp.leds.al.charter.com.8333: tcp 0
21:54:30.594780 IP 97-82-78-25.dhcp.leds.al.charter.com.8333 > tom-Latitude-3570.47742: tcp 247
21:54:30.594783 IP 97-82-78-25.dhcp.leds.al.charter.com.8333 > tom-Latitude-3570.47742: tcp 24
21:54:30.594786 IP 97-82-78-25.dhcp.leds.al.charter.com.8333 > tom-Latitude-3570.47742: tcp 247
21:54:30.594798 IP tom-Latitude-3570.47742 > 97-82-78-25.dhcp.leds.al.charter.com.8333: tcp 0
21:54:30.596786 IP 97-82-78-25.dhcp.leds.al.charter.com.8333 > tom-Latitude-3570.47742: tcp 24
21:54:30.596825 IP tom-Latitude-3570.47742 > 97-82-78-25.dhcp.leds.al.charter.com.8333: tcp 0
21:54:30.597483 IP 97-82-78-25.dhcp.leds.al.charter.com.8333 > tom-Latitude-3570.47742: tcp 224
21:54:30.597489 IP 97-82-78-25.dhcp.leds.al.charter.com.8333 > tom-Latitude-3570.47742: tcp 24
21:54:30.597492 IP 97-82-78-25.dhcp.leds.al.charter.com.8333 > tom-Latitude-3570.47742: tcp 225
21:54:30.597495 IP 97-82-78-25.dhcp.leds.al.charter.com.8333 > tom-Latitude-3570.47742: tcp 24
21:54:30.597497 IP 97-82-78-25.dhcp.leds.al.charter.com.8333 > tom-Latitude-3570.47742: tcp 372
21:54:30.597499 IP 97-82-78-25.dhcp.leds.al.charter.com.8333 > tom-Latitude-3570.47742: tcp 24
21:54:30.597506 IP tom-Latitude-3570.47742 > 97-82-78-25.dhcp.leds.al.charter.com.8333: tcp 0
21:54:30.597531 IP tom-Latitude-3570.47742 > 97-82-78-25.dhcp.leds.al.charter.com.8333: tcp 0
21:54:30.600508 IP 97-82-78-25.dhcp.leds.al.charter.com.8333 > tom-Latitude-3570.47742: tcp 371
21:54:30.600529 IP tom-Latitude-3570.47742 > 97-82-78-25.dhcp.leds.al.charter.com.8333: tcp 0
21:54:30.601169 IP 97-82-78-25.dhcp.leds.al.charter.com.8333 > tom-Latitude-3570.47742: tcp 24
21:54:30.601176 IP 97-82-78-25.dhcp.leds.al.charter.com.8333 > tom-Latitude-3570.47742: tcp 249
21:54:30.601179 IP 97-82-78-25.dhcp.leds.al.charter.com.8333 > tom-Latitude-3570.47742: tcp 24
21:54:30.601188 IP tom-Latitude-3570.47742 > 97-82-78-25.dhcp.leds.al.charter.com.8333: tcp 0
21:54:30.604664 IP 97-82-78-25.dhcp.leds.al.charter.com.8333 > tom-Latitude-3570.47742: tcp 371
21:54:30.604684 IP tom-Latitude-3570.47742 > 97-82-78-25.dhcp.leds.al.charter.com.8333: tcp 0
21:54:30.605184 IP 97-82-78-25.dhcp.leds.al.charter.com.8333 > tom-Latitude-3570.47742: tcp 24
21:54:30.605200 IP tom-Latitude-3570.47742 > 97-82-78-25.dhcp.leds.al.charter.com.8333: tcp 0
21:54:30.607890 IP 97-82-78-25.dhcp.leds.al.charter.com.8333 > tom-Latitude-3570.47742: tcp 225
21:54:30.607903 IP tom-Latitude-3570.47742 > 97-82-78-25.dhcp.leds.al.charter.com.8333: tcp 0
21:54:30.761975 IP 97-82-78-25.dhcp.leds.al.charter.com.8333 > tom-Latitude-3570.47742: tcp 0
21:54:30.761984 IP ec2-52-56-97-80.eu-west-2.compute.amazonaws.com.8333 > tom-Latitude-3570.36650: tcp 0
21:54:30.761989 IP ec2-52-56-97-80.eu-west-2.compute.amazonaws.com.8333 > tom-Latitude-3570.36650: tcp 0
21:54:30.912568 IP ec2-52-56-97-80.eu-west-2.compute.amazonaws.com.8333 > tom-Latitude-3570.36650: tcp 24
21:54:30.912581 IP tom-Latitude-3570.36650 > ec2-52-56-97-80.eu-west-2.compute.amazonaws.com.8333: tcp 0
21:54:30.914022 IP ec2-52-56-97-80.eu-west-2.compute.amazonaws.com.8333 > tom-Latitude-3570.36650: tcp 865
21:54:30.914029 IP tom-Latitude-3570.36650 > ec2-52-56-97-80.eu-west-2.compute.amazonaws.com.8333: tcp 0
21:54:30.914460 IP tom-Latitude-3570.36650 > ec2-52-56-97-80.eu-west-2.compute.amazonaws.com.8333: tcp 24
21:54:30.915469 IP tom-Latitude-3570.36650 > ec2-52-56-97-80.eu-west-2.compute.amazonaws.com.8333: tcp 325
21:54:31.014688 IP tom-Latitude-3570.34082 > host93-234-110-95.serverdedicati.aruba.it.8333: tcp 24
21:54:31.014799 IP tom-Latitude-3570.33922 > pool-108-20-207-31.bstnma.fios.verizon.net.8333: tcp 24
21:54:31.015477 IP tom-Latitude-3570.34082 > host93-234-110-95.serverdedicati.aruba.it.8333: tcp 8
21:54:31.016094 IP tom-Latitude-3570.33922 > pool-108-20-207-31.bstnma.fios.verizon.net.8333: tcp 541
21:54:31.066057 IP ec2-52-56-97-80.eu-west-2.compute.amazonaws.com.8333 > tom-Latitude-3570.36650: tcp 0
21:54:31.069868 IP ec2-52-56-97-80.eu-west-2.compute.amazonaws.com.8333 > tom-Latitude-3570.36650: tcp 0
21:54:31.075389 IP host93-234-110-95.serverdedicati.aruba.it.8333 > tom-Latitude-3570.34082: tcp 0
21:54:31.077522 IP pool-108-20-207-31.bstnma.fios.verizon.net.8333 > tom-Latitude-3570.33922: tcp 0
21:54:31.115103 IP tom-Latitude-3570.47822 > 59.110.157.16.8333: tcp 24
21:54:31.115881 IP tom-Latitude-3570.47822 > 59.110.157.16.8333: tcp 541
21:54:31.126845 IP ec2-52-56-97-80.eu-west-2.compute.amazonaws.com.8333 > tom-Latitude-3570.36650: tcp 24
21:54:31.127655 IP ec2-52-56-97-80.eu-west-2.compute.amazonaws.com.8333 > tom-Latitude-3570.36650: tcp 1245
21:54:31.127753 IP tom-Latitude-3570.36650 > ec2-52-56-97-80.eu-west-2.compute.amazonaws.com.8333: tcp 0
21:54:31.130406 IP ec2-52-56-97-80.eu-west-2.compute.amazonaws.com.8333 > tom-Latitude-3570.36650: tcp 1246
21:54:31.139131 IP ec2-52-56-97-80.eu-west-2.compute.amazonaws.com.8333 > tom-Latitude-3570.36650: tcp 1382
21:54:31.139174 IP tom-Latitude-3570.36650 > ec2-52-56-97-80.eu-west-2.compute.amazonaws.com.8333: tcp 0
21:54:31.140026 IP ec2-52-56-97-80.eu-west-2.compute.amazonaws.com.8333 > tom-Latitude-3570.36650: tcp 66
21:54:31.140035 IP ec2-52-56-97-80.eu-west-2.compute.amazonaws.com.8333 > tom-Latitude-3570.36650: tcp 1382
21:54:31.140126 IP tom-Latitude-3570.36650 > ec2-52-56-97-80.eu-west-2.compute.amazonaws.com.8333: tcp 0
21:54:31.142257 IP ec2-52-56-97-80.eu-west-2.compute.amazonaws.com.8333 > tom-Latitude-3570.36650: tcp 66
21:54:31.145660 IP ec2-52-56-97-80.eu-west-2.compute.amazonaws.com.8333 > tom-Latitude-3570.36650: tcp 1316
21:54:31.145756 IP tom-Latitude-3570.36650 > ec2-52-56-97-80.eu-west-2.compute.amazonaws.com.8333: tcp 0
21:54:31.146288 IP pool-108-20-207-31.bstnma.fios.verizon.net.8333 > tom-Latitude-3570.33922: tcp 0
21:54:31.148505 IP host93-234-110-95.serverdedicati.aruba.it.8333 > tom-Latitude-3570.34082: tcp 0
21:54:31.218406 IP 59.110.157.16.8333 > tom-Latitude-3570.47822: tcp 0
21:54:31.219035 IP 59.110.157.16.8333 > tom-Latitude-3570.47822: tcp 0
21:54:31.249121 IP tom-Latitude-3570.47822 > 59.110.157.16.8333: tcp 24
21:54:31.249889 IP tom-Latitude-3570.47822 > 59.110.157.16.8333: tcp 325
21:54:31.256369 IP host93-234-110-95.serverdedicati.aruba.it.8333 > tom-Latitude-3570.34082: tcp 24
21:54:31.256375 IP tom-Latitude-3570.34082 > host93-234-110-95.serverdedicati.aruba.it.8333: tcp 0
21:54:31.256967 IP host93-234-110-95.serverdedicati.aruba.it.8333 > tom-Latitude-3570.34082: tcp 8
21:54:31.256971 IP tom-Latitude-3570.34082 > host93-234-110-95.serverdedicati.aruba.it.8333: tcp 0
21:54:31.330627 IP 59.110.157.16.8333 > tom-Latitude-3570.47822: tcp 0
21:54:31.331331 IP 59.110.157.16.8333 > tom-Latitude-3570.47822: tcp 0
21:54:31.373122 IP pool-108-20-207-31.bstnma.fios.verizon.net.8333 > tom-Latitude-3570.33922: tcp 24
21:54:31.377203 IP pool-108-20-207-31.bstnma.fios.verizon.net.8333 > tom-Latitude-3570.33922: tcp 361
21:54:31.377228 IP tom-Latitude-3570.33922 > pool-108-20-207-31.bstnma.fios.verizon.net.8333: tcp 0
21:54:31.377414 IP tom-Latitude-3570.33922 > pool-108-20-207-31.bstnma.fios.verizon.net.8333: tcp 24
21:54:31.378542 IP tom-Latitude-3570.33922 > pool-108-20-207-31.bstnma.fios.verizon.net.8333: tcp 37
21:54:31.404515 IP 184-101-12-201.phnx.qwest.net.8333 > tom-Latitude-3570.54046: tcp 24
21:54:31.414952 IP 184-101-12-201.phnx.qwest.net.8333 > tom-Latitude-3570.54046: tcp 829
21:54:31.415049 IP tom-Latitude-3570.54046 > 184-101-12-201.phnx.qwest.net.8333: tcp 0
21:54:31.490777 IP pool-108-20-207-31.bstnma.fios.verizon.net.8333 > tom-Latitude-3570.33922: tcp 0
21:54:31.495108 IP pool-108-20-207-31.bstnma.fios.verizon.net.8333 > tom-Latitude-3570.33922: tcp 0
21:54:31.615721 IP tom-Latitude-3570.54046 > 184-101-12-201.phnx.qwest.net.8333: tcp 24
21:54:31.618612 IP tom-Latitude-3570.54046 > 184-101-12-201.phnx.qwest.net.8333: tcp 37
21:54:31.638854 IP pool-108-20-207-31.bstnma.fios.verizon.net.8333 > tom-Latitude-3570.33922: tcp 24
21:54:31.639521 IP pool-108-20-207-31.bstnma.fios.verizon.net.8333 > tom-Latitude-3570.33922: tcp 251
21:54:31.639618 IP tom-Latitude-3570.33922 > pool-108-20-207-31.bstnma.fios.verizon.net.8333: tcp 0
21:54:31.639882 IP tom-Latitude-3570.59818 > c-73-101-52-184.hsd1.pa.comcast.net.8333: tcp 24
21:54:31.641019 IP tom-Latitude-3570.59818 > c-73-101-52-184.hsd1.pa.comcast.net.8333: tcp 865
21:54:31.714858 IP 184-101-12-201.phnx.qwest.net.8333 > tom-Latitude-3570.54046: tcp 0
21:54:31.715469 IP 184-101-12-201.phnx.qwest.net.8333 > tom-Latitude-3570.54046: tcp 0
21:54:31.740460 IP tom-Latitude-3570.47822 > 59.110.157.16.8333: tcp 24
21:54:31.741504 IP tom-Latitude-3570.47822 > 59.110.157.16.8333: tcp 37
21:54:31.752695 IP c-73-101-52-184.hsd1.pa.comcast.net.8333 > tom-Latitude-3570.59818: tcp 0
21:54:31.760486 IP c-73-101-52-184.hsd1.pa.comcast.net.8333 > tom-Latitude-3570.59818: tcp 0
21:54:31.870577 IP 59.110.157.16.8333 > tom-Latitude-3570.47822: tcp 0
21:54:31.888518 IP 59.110.157.16.8333 > tom-Latitude-3570.47822: tcp 0
21:54:31.922819 IP c-73-101-52-184.hsd1.pa.comcast.net.8333 > tom-Latitude-3570.59818: tcp 24
21:54:31.922826 IP c-73-101-52-184.hsd1.pa.comcast.net.8333 > tom-Latitude-3570.59818: tcp 8
21:54:31.922828 IP c-73-101-52-184.hsd1.pa.comcast.net.8333 > tom-Latitude-3570.59818: tcp 24
21:54:31.922924 IP tom-Latitude-3570.59818 > c-73-101-52-184.hsd1.pa.comcast.net.8333: tcp 0
21:54:31.923032 IP tom-Latitude-3570.59818 > c-73-101-52-184.hsd1.pa.comcast.net.8333: tcp 24
21:54:31.925759 IP tom-Latitude-3570.59818 > c-73-101-52-184.hsd1.pa.comcast.net.8333: tcp 8
21:54:31.926314 IP c-73-101-52-184.hsd1.pa.comcast.net.8333 > tom-Latitude-3570.59818: tcp 37
21:54:31.967768 IP tom-Latitude-3570.59818 > c-73-101-52-184.hsd1.pa.comcast.net.8333: tcp 0
21:54:32.030541 IP c-73-101-52-184.hsd1.pa.comcast.net.8333 > tom-Latitude-3570.59818: tcp 0
21:54:32.040473 IP c-73-101-52-184.hsd1.pa.comcast.net.8333 > tom-Latitude-3570.59818: tcp 0
21:54:32.110472 IP 97-82-78-25.dhcp.leds.al.charter.com.8333 > tom-Latitude-3570.47742: tcp 24
21:54:32.110491 IP tom-Latitude-3570.47742 > 97-82-78-25.dhcp.leds.al.charter.com.8333: tcp 0
21:54:32.110524 IP 97-82-78-25.dhcp.leds.al.charter.com.8333 > tom-Latitude-3570.47742: tcp 469
21:54:32.110529 IP tom-Latitude-3570.47742 > 97-82-78-25.dhcp.leds.al.charter.com.8333: tcp 0
21:54:32.110718 IP tom-Latitude-3570.47742 > 97-82-78-25.dhcp.leds.al.charter.com.8333: tcp 24
21:54:32.112032 IP tom-Latitude-3570.47742 > 97-82-78-25.dhcp.leds.al.charter.com.8333: tcp 109
21:54:32.210317 IP 97-82-78-25.dhcp.leds.al.charter.com.8333 > tom-Latitude-3570.47742: tcp 0
21:54:32.218528 IP 97-82-78-25.dhcp.leds.al.charter.com.8333 > tom-Latitude-3570.47742: tcp 0
21:54:32.412936 IP 97-82-78-25.dhcp.leds.al.charter.com.8333 > tom-Latitude-3570.47742: tcp 24
21:54:32.413776 IP 97-82-78-25.dhcp.leds.al.charter.com.8333 > tom-Latitude-3570.47742: tcp 370
21:54:32.413781 IP 97-82-78-25.dhcp.leds.al.charter.com.8333 > tom-Latitude-3570.47742: tcp 24
21:54:32.413783 IP 97-82-78-25.dhcp.leds.al.charter.com.8333 > tom-Latitude-3570.47742: tcp 217
21:54:32.413785 IP 97-82-78-25.dhcp.leds.al.charter.com.8333 > tom-Latitude-3570.47742: tcp 24
21:54:32.413787 IP 97-82-78-25.dhcp.leds.al.charter.com.8333 > tom-Latitude-3570.47742: tcp 519
21:54:32.413852 IP tom-Latitude-3570.47742 > 97-82-78-25.dhcp.leds.al.charter.com.8333: tcp 0
21:54:32.816064 IP tom-Latitude-3570.56244 > 172.214.77.34.bc.googleusercontent.com.8333: tcp 24
21:54:32.816912 IP tom-Latitude-3570.56244 > 172.214.77.34.bc.googleusercontent.com.8333: tcp 1009
21:54:32.904721 IP 172.214.77.34.bc.googleusercontent.com.8333 > tom-Latitude-3570.56244: tcp 0
21:54:32.916306 IP tom-Latitude-3570.47822 > 59.110.157.16.8333: tcp 24
21:54:32.918639 IP tom-Latitude-3570.47822 > 59.110.157.16.8333: tcp 109
21:54:33.016459 IP 172.214.77.34.bc.googleusercontent.com.8333 > tom-Latitude-3570.56244: tcp 0
21:54:33.180188 IP 59.110.157.16.8333 > tom-Latitude-3570.47822: tcp 0
21:54:33.222606 IP 59.110.157.16.8333 > tom-Latitude-3570.47822: tcp 0
21:54:33.390512 IP c-73-101-52-184.hsd1.pa.comcast.net.8333 > tom-Latitude-3570.59818: tcp 24
21:54:33.390530 IP tom-Latitude-3570.59818 > c-73-101-52-184.hsd1.pa.comcast.net.8333: tcp 0
21:54:33.390562 IP c-73-101-52-184.hsd1.pa.comcast.net.8333 > tom-Latitude-3570.59818: tcp 325
21:54:33.390565 IP tom-Latitude-3570.59818 > c-73-101-52-184.hsd1.pa.comcast.net.8333: tcp 0
21:54:33.390762 IP tom-Latitude-3570.59818 > c-73-101-52-184.hsd1.pa.comcast.net.8333: tcp 24
21:54:33.391881 IP tom-Latitude-3570.59818 > c-73-101-52-184.hsd1.pa.comcast.net.8333: tcp 217
21:54:33.544478 IP c-73-101-52-184.hsd1.pa.comcast.net.8333 > tom-Latitude-3570.59818: tcp 0
21:54:33.614608 IP 184-101-12-201.phnx.qwest.net.8333 > tom-Latitude-3570.54046: tcp 24
21:54:33.619290 IP 184-101-12-201.phnx.qwest.net.8333 > tom-Latitude-3570.54046: tcp 541
21:54:33.619391 IP tom-Latitude-3570.54046 > 184-101-12-201.phnx.qwest.net.8333: tcp 0
21:54:33.619717 IP tom-Latitude-3570.54046 > 184-101-12-201.phnx.qwest.net.8333: tcp 24
21:54:33.620740 IP tom-Latitude-3570.54046 > 184-101-12-201.phnx.qwest.net.8333: tcp 181
21:54:33.784564 IP c-73-101-52-184.hsd1.pa.comcast.net.8333 > tom-Latitude-3570.59818: tcp 0
21:54:33.834066 IP 184-101-12-201.phnx.qwest.net.8333 > tom-Latitude-3570.54046: tcp 0
21:54:33.920421 IP tom-Latitude-3570.34082 > host93-234-110-95.serverdedicati.aruba.it.8333: tcp 24
21:54:33.921192 IP tom-Latitude-3570.34082 > host93-234-110-95.serverdedicati.aruba.it.8333: tcp 1009
21:54:33.939120 IP c-73-101-52-184.hsd1.pa.comcast.net.8333 > tom-Latitude-3570.59818: tcp 24
21:54:33.960627 IP c-73-101-52-184.hsd1.pa.comcast.net.8333 > tom-Latitude-3570.59818: tcp 250
21:54:33.960728 IP tom-Latitude-3570.59818 > c-73-101-52-184.hsd1.pa.comcast.net.8333: tcp 0
21:54:33.961541 IP c-73-101-52-184.hsd1.pa.comcast.net.8333 > tom-Latitude-3570.59818: tcp 24
21:54:33.961548 IP c-73-101-52-184.hsd1.pa.comcast.net.8333 > tom-Latitude-3570.59818: tcp 249
21:54:33.961550 IP c-73-101-52-184.hsd1.pa.comcast.net.8333 > tom-Latitude-3570.59818: tcp 24
21:54:33.961552 IP c-73-101-52-184.hsd1.pa.comcast.net.8333 > tom-Latitude-3570.59818: tcp 225
21:54:33.961554 IP c-73-101-52-184.hsd1.pa.comcast.net.8333 > tom-Latitude-3570.59818: tcp 24
21:54:33.961556 IP c-73-101-52-184.hsd1.pa.comcast.net.8333 > tom-Latitude-3570.59818: tcp 225
21:54:33.961557 IP c-73-101-52-184.hsd1.pa.comcast.net.8333 > tom-Latitude-3570.59818: tcp 24
21:54:33.961580 IP c-73-101-52-184.hsd1.pa.comcast.net.8333 > tom-Latitude-3570.59818: tcp 226
21:54:33.961581 IP c-73-101-52-184.hsd1.pa.comcast.net.8333 > tom-Latitude-3570.59818: tcp 24
21:54:33.961583 IP c-73-101-52-184.hsd1.pa.comcast.net.8333 > tom-Latitude-3570.59818: tcp 374
21:54:33.961603 IP tom-Latitude-3570.59818 > c-73-101-52-184.hsd1.pa.comcast.net.8333: tcp 0
21:54:34.024656 IP 184-101-12-201.phnx.qwest.net.8333 > tom-Latitude-3570.54046: tcp 0
21:54:34.072458 IP host93-234-110-95.serverdedicati.aruba.it.8333 > tom-Latitude-3570.34082: tcp 0
21:54:34.120525 IP host93-234-110-95.serverdedicati.aruba.it.8333 > tom-Latitude-3570.34082: tcp 0
21:54:34.244714 IP 184-101-12-201.phnx.qwest.net.8333 > tom-Latitude-3570.54046: tcp 24
21:54:34.256818 IP 184-101-12-201.phnx.qwest.net.8333 > tom-Latitude-3570.54046: tcp 1184
21:54:34.256920 IP tom-Latitude-3570.54046 > 184-101-12-201.phnx.qwest.net.8333: tcp 0
21:54:34.257110 IP tom-Latitude-3570.56244 > 172.214.77.34.bc.googleusercontent.com.8333: tcp 24
21:54:34.257172 IP tom-Latitude-3570.33922 > pool-108-20-207-31.bstnma.fios.verizon.net.8333: tcp 24
21:54:34.258291 IP tom-Latitude-3570.33922 > pool-108-20-207-31.bstnma.fios.verizon.net.8333: tcp 325
21:54:34.258296 IP tom-Latitude-3570.56244 > 172.214.77.34.bc.googleusercontent.com.8333: tcp 217
21:54:34.281032 IP c-73-101-52-184.hsd1.pa.comcast.net.8333 > tom-Latitude-3570.59818: tcp 24
21:54:34.281040 IP c-73-101-52-184.hsd1.pa.comcast.net.8333 > tom-Latitude-3570.59818: tcp 253
21:54:34.281135 IP tom-Latitude-3570.59818 > c-73-101-52-184.hsd1.pa.comcast.net.8333: tcp 0
21:54:34.281314 IP tom-Latitude-3570.59818 > c-73-101-52-184.hsd1.pa.comcast.net.8333: tcp 24
21:54:34.286442 IP tom-Latitude-3570.59818 > c-73-101-52-184.hsd1.pa.comcast.net.8333: tcp 73
21:54:34.302500 IP 172.214.77.34.bc.googleusercontent.com.8333 > tom-Latitude-3570.56244: tcp 24
21:54:34.303141 IP 172.214.77.34.bc.googleusercontent.com.8333 > tom-Latitude-3570.56244: tcp 505
21:54:34.303242 IP tom-Latitude-3570.56244 > 172.214.77.34.bc.googleusercontent.com.8333: tcp 0
21:54:34.303467 IP tom-Latitude-3570.56244 > 172.214.77.34.bc.googleusercontent.com.8333: tcp 24
21:54:34.303477 IP tom-Latitude-3570.56244 > 172.214.77.34.bc.googleusercontent.com.8333: tcp 37
21:54:34.378586 IP 172.214.77.34.bc.googleusercontent.com.8333 > tom-Latitude-3570.56244: tcp 0
21:54:34.392477 IP pool-108-20-207-31.bstnma.fios.verizon.net.8333 > tom-Latitude-3570.33922: tcp 0
21:54:34.477076 IP host93-234-110-95.serverdedicati.aruba.it.8333 > tom-Latitude-3570.34082: tcp 24
21:54:34.477087 IP tom-Latitude-3570.34082 > host93-234-110-95.serverdedicati.aruba.it.8333: tcp 0
21:54:34.482923 IP host93-234-110-95.serverdedicati.aruba.it.8333 > tom-Latitude-3570.34082: tcp 8
21:54:34.482927 IP tom-Latitude-3570.34082 > host93-234-110-95.serverdedicati.aruba.it.8333: tcp 0
21:54:34.483152 IP tom-Latitude-3570.34082 > host93-234-110-95.serverdedicati.aruba.it.8333: tcp 24
21:54:34.484211 IP tom-Latitude-3570.34082 > host93-234-110-95.serverdedicati.aruba.it.8333: tcp 8
21:54:34.566454 IP c-73-101-52-184.hsd1.pa.comcast.net.8333 > tom-Latitude-3570.59818: tcp 253
21:54:34.566462 IP tom-Latitude-3570.59818 > c-73-101-52-184.hsd1.pa.comcast.net.8333: tcp 0
21:54:34.587750 IP tom-Latitude-3570.59818 > c-73-101-52-184.hsd1.pa.comcast.net.8333: tcp 73
21:54:34.600677 IP host93-234-110-95.serverdedicati.aruba.it.8333 > tom-Latitude-3570.34082: tcp 24
21:54:34.601293 IP host93-234-110-95.serverdedicati.aruba.it.8333 > tom-Latitude-3570.34082: tcp 577
21:54:34.601425 IP tom-Latitude-3570.34082 > host93-234-110-95.serverdedicati.aruba.it.8333: tcp 0
21:54:34.601703 IP tom-Latitude-3570.34082 > host93-234-110-95.serverdedicati.aruba.it.8333: tcp 24
21:54:34.601713 IP tom-Latitude-3570.34082 > host93-234-110-95.serverdedicati.aruba.it.8333: tcp 73
21:54:34.670589 IP 172.214.77.34.bc.googleusercontent.com.8333 > tom-Latitude-3570.56244: tcp 505
21:54:34.670599 IP tom-Latitude-3570.56244 > 172.214.77.34.bc.googleusercontent.com.8333: tcp 0
21:54:34.695331 IP 172.214.77.34.bc.googleusercontent.com.8333 > tom-Latitude-3570.56244: tcp 0
21:54:34.794280 IP host93-234-110-95.serverdedicati.aruba.it.8333 > tom-Latitude-3570.34082: tcp 577
21:54:34.794293 IP tom-Latitude-3570.34082 > host93-234-110-95.serverdedicati.aruba.it.8333: tcp 0
21:54:34.802208 IP tom-Latitude-3570.47822 > 59.110.157.16.8333: tcp 24
21:54:34.802921 IP tom-Latitude-3570.47822 > 59.110.157.16.8333: tcp 397
21:54:34.807014 IP pool-108-20-207-31.bstnma.fios.verizon.net.8333 > tom-Latitude-3570.33922: tcp 0
21:54:34.872365 IP c-73-101-52-184.hsd1.pa.comcast.net.8333 > tom-Latitude-3570.59818: tcp 0
21:54:34.971746 IP tom-Latitude-3570.34082 > host93-234-110-95.serverdedicati.aruba.it.8333: tcp 73
21:54:35.032638 IP c-73-101-52-184.hsd1.pa.comcast.net.8333 > tom-Latitude-3570.59818: tcp 0
21:54:35.143429 IP 172.214.77.34.bc.googleusercontent.com.8333 > tom-Latitude-3570.56244: tcp 0
