01:30:11.440438 IP bb42-60-217-183.singnet.com.sg.8333 > tom-Latitude-3570.60470: tcp 24
01:30:11.441191 IP bb42-60-217-183.singnet.com.sg.8333 > tom-Latitude-3570.60470: tcp 649
01:30:11.441209 IP bb42-60-217-183.singnet.com.sg.8333 > tom-Latitude-3570.60470: tcp 649
01:30:11.441219 IP tom-Latitude-3570.60470 > bb42-60-217-183.singnet.com.sg.8333: tcp 0
01:30:11.441626 IP tom-Latitude-3570.60470 > bb42-60-217-183.singnet.com.sg.8333: tcp 24
01:30:11.442701 IP tom-Latitude-3570.60470 > bb42-60-217-183.singnet.com.sg.8333: tcp 325
01:30:11.487470 IP bb42-60-217-183.singnet.com.sg.8333 > tom-Latitude-3570.60470: tcp 0
01:30:11.843016 IP tom-Latitude-3570.42516 > 2.56.9.15.8333: tcp 24
01:30:11.843993 IP tom-Latitude-3570.42516 > 2.56.9.15.8333: tcp 253
01:30:11.893765 IP bb42-60-217-183.singnet.com.sg.8333 > tom-Latitude-3570.60470: tcp 24
01:30:11.894904 IP bb42-60-217-183.singnet.com.sg.8333 > tom-Latitude-3570.60470: tcp 338
01:30:11.894922 IP bb42-60-217-183.singnet.com.sg.8333 > tom-Latitude-3570.60470: tcp 24
01:30:11.894925 IP bb42-60-217-183.singnet.com.sg.8333 > tom-Latitude-3570.60470: tcp 226
01:30:11.894927 IP bb42-60-217-183.singnet.com.sg.8333 > tom-Latitude-3570.60470: tcp 24
01:30:11.894929 IP bb42-60-217-183.singnet.com.sg.8333 > tom-Latitude-3570.60470: tcp 225
01:30:11.894931 IP bb42-60-217-183.singnet.com.sg.8333 > tom-Latitude-3570.60470: tcp 24
01:30:11.894933 IP bb42-60-217-183.singnet.com.sg.8333 > tom-Latitude-3570.60470: tcp 373
01:30:11.894935 IP bb42-60-217-183.singnet.com.sg.8333 > tom-Latitude-3570.60470: tcp 24
01:30:11.894955 IP bb42-60-217-183.singnet.com.sg.8333 > tom-Latitude-3570.60470: tcp 226
01:30:11.894957 IP bb42-60-217-183.singnet.com.sg.8333 > tom-Latitude-3570.60470: tcp 24
01:30:11.894959 IP bb42-60-217-183.singnet.com.sg.8333 > tom-Latitude-3570.60470: tcp 421
01:30:11.894960 IP bb42-60-217-183.singnet.com.sg.8333 > tom-Latitude-3570.60470: tcp 24
01:30:11.894964 IP bb42-60-217-183.singnet.com.sg.8333 > tom-Latitude-3570.60470: tcp 249
01:30:11.894966 IP bb42-60-217-183.singnet.com.sg.8333 > tom-Latitude-3570.60470: tcp 24
01:30:11.895022 IP tom-Latitude-3570.60470 > bb42-60-217-183.singnet.com.sg.8333: tcp 0
01:30:11.898035 IP bb42-60-217-183.singnet.com.sg.8333 > tom-Latitude-3570.60470: tcp 222
01:30:11.898046 IP bb42-60-217-183.singnet.com.sg.8333 > tom-Latitude-3570.60470: tcp 24
01:30:11.898048 IP bb42-60-217-183.singnet.com.sg.8333 > tom-Latitude-3570.60470: tcp 284
01:30:11.898086 IP tom-Latitude-3570.60470 > bb42-60-217-183.singnet.com.sg.8333: tcp 0
01:30:11.902251 IP 2.56.9.15.8333 > tom-Latitude-3570.42516: tcp 0
01:30:12.201616 IP tom-Latitude-3570.60988 > 81.198.101.144.8333: tcp 24
01:30:12.202570 IP tom-Latitude-3570.60988 > 81.198.101.144.8333: tcp 901
01:30:12.232770 IP 81.198.101.144.8333 > tom-Latitude-3570.60988: tcp 0
01:30:12.237175 IP 81.198.101.144.8333 > tom-Latitude-3570.60988: tcp 0
01:30:12.301929 IP tom-Latitude-3570.57976 > 167.99.216.145.8333: tcp 24
01:30:12.301988 IP tom-Latitude-3570.46284 > static-87-75-105-186.vodafonexdsl.co.uk.8333: tcp 24
01:30:12.302777 IP tom-Latitude-3570.46284 > static-87-75-105-186.vodafonexdsl.co.uk.8333: tcp 325
01:30:12.302782 IP tom-Latitude-3570.57976 > 167.99.216.145.8333: tcp 325
01:30:12.335750 IP static-87-75-105-186.vodafonexdsl.co.uk.8333 > tom-Latitude-3570.46284: tcp 0
01:30:12.344399 IP 167.99.216.145.8333 > tom-Latitude-3570.57976: tcp 0
01:30:12.352947 IP static-87-75-105-186.vodafonexdsl.co.uk.8333 > tom-Latitude-3570.46284: tcp 0
01:30:12.353572 IP 167.99.216.145.8333 > tom-Latitude-3570.57976: tcp 0
01:30:12.402378 IP tom-Latitude-3570.39110 > vmi195435.contaboserver.net.8333: tcp 24
01:30:12.403360 IP tom-Latitude-3570.39110 > vmi195435.contaboserver.net.8333: tcp 325
01:30:12.435711 IP vmi195435.contaboserver.net.8333 > tom-Latitude-3570.39110: tcp 0
01:30:12.453028 IP vmi195435.contaboserver.net.8333 > tom-Latitude-3570.39110: tcp 0
01:30:13.040092 IP c-185-45-236-223.customer.ggaweb.ch.8333 > tom-Latitude-3570.49070: tcp 24
01:30:13.040841 IP c-185-45-236-223.customer.ggaweb.ch.8333 > tom-Latitude-3570.49070: tcp 901
01:30:13.040968 IP tom-Latitude-3570.49070 > c-185-45-236-223.customer.ggaweb.ch.8333: tcp 0
01:30:13.041362 IP tom-Latitude-3570.49070 > c-185-45-236-223.customer.ggaweb.ch.8333: tcp 24
01:30:13.042379 IP tom-Latitude-3570.49070 > c-185-45-236-223.customer.ggaweb.ch.8333: tcp 289
01:30:13.043085 IP c-185-45-236-223.customer.ggaweb.ch.8333 > tom-Latitude-3570.49070: tcp 901
01:30:13.043092 IP tom-Latitude-3570.49070 > c-185-45-236-223.customer.ggaweb.ch.8333: tcp 0
01:30:13.044886 IP c-185-45-236-223.customer.ggaweb.ch.8333 > tom-Latitude-3570.49070: tcp 24
01:30:13.044891 IP tom-Latitude-3570.49070 > c-185-45-236-223.customer.ggaweb.ch.8333: tcp 0
01:30:13.044898 IP c-185-45-236-223.customer.ggaweb.ch.8333 > tom-Latitude-3570.49070: tcp 73
01:30:13.044900 IP tom-Latitude-3570.49070 > c-185-45-236-223.customer.ggaweb.ch.8333: tcp 0
01:30:13.045029 IP tom-Latitude-3570.49070 > c-185-45-236-223.customer.ggaweb.ch.8333: tcp 24
01:30:13.045037 IP tom-Latitude-3570.49070 > c-185-45-236-223.customer.ggaweb.ch.8333: tcp 73
01:30:13.082952 IP c-185-45-236-223.customer.ggaweb.ch.8333 > tom-Latitude-3570.49070: tcp 0
01:30:13.083458 IP c-185-45-236-223.customer.ggaweb.ch.8333 > tom-Latitude-3570.49070: tcp 0
01:30:13.083464 IP c-185-45-236-223.customer.ggaweb.ch.8333 > tom-Latitude-3570.49070: tcp 0
01:30:13.086155 IP c-185-45-236-223.customer.ggaweb.ch.8333 > tom-Latitude-3570.49070: tcp 0
01:30:13.086690 IP static-87-75-105-186.vodafonexdsl.co.uk.8333 > tom-Latitude-3570.46284: tcp 24
01:30:13.086713 IP tom-Latitude-3570.46284 > static-87-75-105-186.vodafonexdsl.co.uk.8333: tcp 0
01:30:13.086743 IP static-87-75-105-186.vodafonexdsl.co.uk.8333 > tom-Latitude-3570.46284: tcp 31
01:30:13.086746 IP tom-Latitude-3570.46284 > static-87-75-105-186.vodafonexdsl.co.uk.8333: tcp 0
01:30:13.161241 IP c-185-45-236-223.customer.ggaweb.ch.8333 > tom-Latitude-3570.49070: tcp 24
01:30:13.164707 IP c-185-45-236-223.customer.ggaweb.ch.8333 > tom-Latitude-3570.49070: tcp 1382
01:30:13.164835 IP tom-Latitude-3570.49070 > c-185-45-236-223.customer.ggaweb.ch.8333: tcp 0
01:30:13.165812 IP c-185-45-236-223.customer.ggaweb.ch.8333 > tom-Latitude-3570.49070: tcp 50
01:30:13.165846 IP c-185-45-236-223.customer.ggaweb.ch.8333 > tom-Latitude-3570.49070: tcp 1448
01:30:13.165849 IP c-185-45-236-223.customer.ggaweb.ch.8333 > tom-Latitude-3570.49070: tcp 1448
01:30:13.165871 IP c-185-45-236-223.customer.ggaweb.ch.8333 > tom-Latitude-3570.49070: tcp 1448
01:30:13.165911 IP tom-Latitude-3570.49070 > c-185-45-236-223.customer.ggaweb.ch.8333: tcp 0
01:30:13.168049 IP c-185-45-236-223.customer.ggaweb.ch.8333 > tom-Latitude-3570.49070: tcp 1382
01:30:13.169465 IP c-185-45-236-223.customer.ggaweb.ch.8333 > tom-Latitude-3570.49070: tcp 66
01:30:13.169482 IP tom-Latitude-3570.49070 > c-185-45-236-223.customer.ggaweb.ch.8333: tcp 0
01:30:13.169502 IP c-185-45-236-223.customer.ggaweb.ch.8333 > tom-Latitude-3570.49070: tcp 1448
01:30:13.169507 IP c-185-45-236-223.customer.ggaweb.ch.8333 > tom-Latitude-3570.49070: tcp 1448
01:30:13.169528 IP c-185-45-236-223.customer.ggaweb.ch.8333 > tom-Latitude-3570.49070: tcp 1448
01:30:13.169596 IP tom-Latitude-3570.49070 > c-185-45-236-223.customer.ggaweb.ch.8333: tcp 0
01:30:13.172885 IP c-185-45-236-223.customer.ggaweb.ch.8333 > tom-Latitude-3570.49070: tcp 1448
01:30:13.173017 IP tom-Latitude-3570.49070 > c-185-45-236-223.customer.ggaweb.ch.8333: tcp 0
01:30:13.245532 IP c-185-45-236-223.customer.ggaweb.ch.8333 > tom-Latitude-3570.49070: tcp 1382
01:30:13.245944 IP c-185-45-236-223.customer.ggaweb.ch.8333 > tom-Latitude-3570.49070: tcp 66
01:30:13.245957 IP tom-Latitude-3570.49070 > c-185-45-236-223.customer.ggaweb.ch.8333: tcp 0
01:30:13.248123 IP c-185-45-236-223.customer.ggaweb.ch.8333 > tom-Latitude-3570.49070: tcp 984
01:30:13.258499 IP tom-Latitude-3570.49070 > c-185-45-236-223.customer.ggaweb.ch.8333: tcp 24
01:30:13.259265 IP tom-Latitude-3570.49070 > c-185-45-236-223.customer.ggaweb.ch.8333: tcp 31
01:30:13.283935 IP c-185-45-236-223.customer.ggaweb.ch.8333 > tom-Latitude-3570.49070: tcp 0
01:30:13.291923 IP c-185-45-236-223.customer.ggaweb.ch.8333 > tom-Latitude-3570.49070: tcp 0
01:30:13.565364 IP tom-Latitude-3570.56714 > ns3113832.ip-54-38-177.eu.8333: tcp 24
01:30:13.566301 IP tom-Latitude-3570.56714 > ns3113832.ip-54-38-177.eu.8333: tcp 685
01:30:13.594970 IP ns3113832.ip-54-38-177.eu.8333 > tom-Latitude-3570.56714: tcp 0
01:30:13.605298 IP ns3113832.ip-54-38-177.eu.8333 > tom-Latitude-3570.56714: tcp 0
01:30:13.662779 IP ns3113832.ip-54-38-177.eu.8333 > tom-Latitude-3570.56714: tcp 24
01:30:13.663460 IP ns3113832.ip-54-38-177.eu.8333 > tom-Latitude-3570.56714: tcp 37
01:30:13.663591 IP tom-Latitude-3570.56714 > ns3113832.ip-54-38-177.eu.8333: tcp 0
01:30:13.663737 IP tom-Latitude-3570.56714 > ns3113832.ip-54-38-177.eu.8333: tcp 24
01:30:13.665263 IP tom-Latitude-3570.56714 > ns3113832.ip-54-38-177.eu.8333: tcp 226
01:30:13.701653 IP ns3113832.ip-54-38-177.eu.8333 > tom-Latitude-3570.56714: tcp 0
01:30:13.702284 IP ns3113832.ip-54-38-177.eu.8333 > tom-Latitude-3570.56714: tcp 0
01:30:13.764250 IP tom-Latitude-3570.57976 > 167.99.216.145.8333: tcp 24
01:30:13.765190 IP tom-Latitude-3570.57976 > 167.99.216.145.8333: tcp 361
01:30:13.795940 IP 167.99.216.145.8333 > tom-Latitude-3570.57976: tcp 0
01:30:13.803595 IP 167.99.216.145.8333 > tom-Latitude-3570.57976: tcp 0
01:30:14.027149 IP bb42-60-217-183.singnet.com.sg.8333 > tom-Latitude-3570.60470: tcp 397
01:30:14.027166 IP tom-Latitude-3570.60470 > bb42-60-217-183.singnet.com.sg.8333: tcp 0
01:30:14.071948 IP bb42-60-217-183.singnet.com.sg.8333 > tom-Latitude-3570.60470: tcp 24
01:30:14.071973 IP tom-Latitude-3570.60470 > bb42-60-217-183.singnet.com.sg.8333: tcp 0
01:30:14.072299 IP tom-Latitude-3570.60470 > bb42-60-217-183.singnet.com.sg.8333: tcp 24
01:30:14.073517 IP tom-Latitude-3570.60470 > bb42-60-217-183.singnet.com.sg.8333: tcp 37
01:30:14.104541 IP bb42-60-217-183.singnet.com.sg.8333 > tom-Latitude-3570.60470: tcp 0
01:30:14.139206 IP vmi195435.contaboserver.net.8333 > tom-Latitude-3570.39110: tcp 24
01:30:14.139246 IP tom-Latitude-3570.39110 > vmi195435.contaboserver.net.8333: tcp 0
01:30:14.139828 IP vmi195435.contaboserver.net.8333 > tom-Latitude-3570.39110: tcp 541
01:30:14.139852 IP tom-Latitude-3570.39110 > vmi195435.contaboserver.net.8333: tcp 0
01:30:14.140240 IP tom-Latitude-3570.39110 > vmi195435.contaboserver.net.8333: tcp 24
01:30:14.141547 IP tom-Latitude-3570.39110 > vmi195435.contaboserver.net.8333: tcp 73
01:30:14.173958 IP vmi195435.contaboserver.net.8333 > tom-Latitude-3570.39110: tcp 0
01:30:14.174496 IP vmi195435.contaboserver.net.8333 > tom-Latitude-3570.39110: tcp 0
01:30:14.251916 IP vmi195435.contaboserver.net.8333 > tom-Latitude-3570.39110: tcp 24
01:30:14.251949 IP vmi195435.contaboserver.net.8333 > tom-Latitude-3570.39110: tcp 407
01:30:14.251952 IP vmi195435.contaboserver.net.8333 > tom-Latitude-3570.39110: tcp 24
01:30:14.251954 IP vmi195435.contaboserver.net.8333 > tom-Latitude-3570.39110: tcp 517
01:30:14.252036 IP tom-Latitude-3570.39110 > vmi195435.contaboserver.net.8333: tcp 0
01:30:14.355525 IP tom-Latitude-3570.60470 > bb42-60-217-183.singnet.com.sg.8333: tcp 24
01:30:14.356312 IP tom-Latitude-3570.60470 > bb42-60-217-183.singnet.com.sg.8333: tcp 73
01:30:14.392940 IP bb42-60-217-183.singnet.com.sg.8333 > tom-Latitude-3570.60470: tcp 0
01:30:14.490079 IP bb42-60-217-183.singnet.com.sg.8333 > tom-Latitude-3570.60470: tcp 24
01:30:14.490099 IP bb42-60-217-183.singnet.com.sg.8333 > tom-Latitude-3570.60470: tcp 315
01:30:14.490190 IP tom-Latitude-3570.60470 > bb42-60-217-183.singnet.com.sg.8333: tcp 0
01:30:14.702537 IP static-87-75-105-186.vodafonexdsl.co.uk.8333 > tom-Latitude-3570.46284: tcp 24
01:30:14.702585 IP tom-Latitude-3570.46284 > static-87-75-105-186.vodafonexdsl.co.uk.8333: tcp 0
01:30:14.722082 IP static-87-75-105-186.vodafonexdsl.co.uk.8333 > tom-Latitude-3570.46284: tcp 577
01:30:14.722105 IP tom-Latitude-3570.46284 > static-87-75-105-186.vodafonexdsl.co.uk.8333: tcp 0
01:30:14.722345 IP tom-Latitude-3570.57976 > 167.99.216.145.8333: tcp 24
01:30:14.722538 IP tom-Latitude-3570.46284 > static-87-75-105-186.vodafonexdsl.co.uk.8333: tcp 24
01:30:14.723565 IP tom-Latitude-3570.46284 > static-87-75-105-186.vodafonexdsl.co.uk.8333: tcp 109
01:30:14.723571 IP tom-Latitude-3570.57976 > 167.99.216.145.8333: tcp 109
01:30:14.763119 IP static-87-75-105-186.vodafonexdsl.co.uk.8333 > tom-Latitude-3570.46284: tcp 0
01:30:14.765654 IP 167.99.216.145.8333 > tom-Latitude-3570.57976: tcp 0
01:30:14.765668 IP static-87-75-105-186.vodafonexdsl.co.uk.8333 > tom-Latitude-3570.46284: tcp 0
01:30:14.767874 IP 167.99.216.145.8333 > tom-Latitude-3570.57976: tcp 0
01:30:14.815999 IP c-185-45-236-223.customer.ggaweb.ch.8333 > tom-Latitude-3570.49070: tcp 24
01:30:14.816666 IP c-185-45-236-223.customer.ggaweb.ch.8333 > tom-Latitude-3570.49070: tcp 217
01:30:14.816798 IP tom-Latitude-3570.49070 > c-185-45-236-223.customer.ggaweb.ch.8333: tcp 0
01:30:14.830974 IP static-87-75-105-186.vodafonexdsl.co.uk.8333 > tom-Latitude-3570.46284: tcp 24
01:30:14.834341 IP static-87-75-105-186.vodafonexdsl.co.uk.8333 > tom-Latitude-3570.46284: tcp 437
01:30:14.834347 IP static-87-75-105-186.vodafonexdsl.co.uk.8333 > tom-Latitude-3570.46284: tcp 24
01:30:14.834349 IP static-87-75-105-186.vodafonexdsl.co.uk.8333 > tom-Latitude-3570.46284: tcp 766
01:30:14.834351 IP static-87-75-105-186.vodafonexdsl.co.uk.8333 > tom-Latitude-3570.46284: tcp 24
01:30:14.834354 IP static-87-75-105-186.vodafonexdsl.co.uk.8333 > tom-Latitude-3570.46284: tcp 249
01:30:14.834360 IP tom-Latitude-3570.46284 > static-87-75-105-186.vodafonexdsl.co.uk.8333: tcp 0
01:30:14.875902 IP tom-Latitude-3570.46284 > static-87-75-105-186.vodafonexdsl.co.uk.8333: tcp 0
01:30:15.600877 IP 2.56.9.15.8333 > tom-Latitude-3570.42516: tcp 24
01:30:15.600901 IP tom-Latitude-3570.42516 > 2.56.9.15.8333: tcp 0
01:30:15.601630 IP 2.56.9.15.8333 > tom-Latitude-3570.42516: tcp 901
01:30:15.601653 IP tom-Latitude-3570.42516 > 2.56.9.15.8333: tcp 0
01:30:15.602208 IP tom-Latitude-3570.42516 > 2.56.9.15.8333: tcp 24
01:30:15.603415 IP tom-Latitude-3570.42516 > 2.56.9.15.8333: tcp 98
01:30:15.607157 IP 2.56.9.15.8333 > tom-Latitude-3570.42516: tcp 901
01:30:15.607164 IP tom-Latitude-3570.42516 > 2.56.9.15.8333: tcp 0
01:30:15.608478 IP 2.56.9.15.8333 > tom-Latitude-3570.42516: tcp 24
01:30:15.608483 IP tom-Latitude-3570.42516 > 2.56.9.15.8333: tcp 0
01:30:15.608490 IP 2.56.9.15.8333 > tom-Latitude-3570.42516: tcp 31
01:30:15.608492 IP tom-Latitude-3570.42516 > 2.56.9.15.8333: tcp 0
01:30:15.644350 IP 2.56.9.15.8333 > tom-Latitude-3570.42516: tcp 0
01:30:15.743537 IP 2.56.9.15.8333 > tom-Latitude-3570.42516: tcp 24
01:30:15.743561 IP tom-Latitude-3570.42516 > 2.56.9.15.8333: tcp 0
01:30:15.743593 IP 2.56.9.15.8333 > tom-Latitude-3570.42516: tcp 374
01:30:15.743598 IP tom-Latitude-3570.42516 > 2.56.9.15.8333: tcp 0
01:30:15.743854 IP tom-Latitude-3570.56714 > ns3113832.ip-54-38-177.eu.8333: tcp 24
01:30:15.744997 IP tom-Latitude-3570.56714 > ns3113832.ip-54-38-177.eu.8333: tcp 217
01:30:15.766081 IP 167.99.216.145.8333 > tom-Latitude-3570.57976: tcp 24
01:30:15.769336 IP 167.99.216.145.8333 > tom-Latitude-3570.57976: tcp 289
01:30:15.769467 IP tom-Latitude-3570.57976 > 167.99.216.145.8333: tcp 0
01:30:15.769714 IP tom-Latitude-3570.57976 > 167.99.216.145.8333: tcp 24
01:30:15.771882 IP tom-Latitude-3570.57976 > 167.99.216.145.8333: tcp 145
01:30:15.773598 IP ns3113832.ip-54-38-177.eu.8333 > tom-Latitude-3570.56714: tcp 0
01:30:15.774256 IP ns3113832.ip-54-38-177.eu.8333 > tom-Latitude-3570.56714: tcp 0
01:30:15.819829 IP 167.99.216.145.8333 > tom-Latitude-3570.57976: tcp 0
01:30:15.821240 IP 167.99.216.145.8333 > tom-Latitude-3570.57976: tcp 0
01:30:15.823738 IP vmi195435.contaboserver.net.8333 > tom-Latitude-3570.39110: tcp 24
01:30:15.824464 IP vmi195435.contaboserver.net.8333 > tom-Latitude-3570.39110: tcp 289
01:30:15.824570 IP tom-Latitude-3570.39110 > vmi195435.contaboserver.net.8333: tcp 0
01:30:15.824796 IP tom-Latitude-3570.39110 > vmi195435.contaboserver.net.8333: tcp 24
01:30:15.825985 IP tom-Latitude-3570.39110 > vmi195435.contaboserver.net.8333: tcp 37
01:30:15.854985 IP vmi195435.contaboserver.net.8333 > tom-Latitude-3570.39110: tcp 0
01:30:15.854992 IP vmi195435.contaboserver.net.8333 > tom-Latitude-3570.39110: tcp 0
01:30:15.874658 IP 167.99.216.145.8333 > tom-Latitude-3570.57976: tcp 24
01:30:15.875495 IP 167.99.216.145.8333 > tom-Latitude-3570.57976: tcp 225
01:30:15.875513 IP 167.99.216.145.8333 > tom-Latitude-3570.57976: tcp 24
01:30:15.875515 IP 167.99.216.145.8333 > tom-Latitude-3570.57976: tcp 223
01:30:15.875518 IP 167.99.216.145.8333 > tom-Latitude-3570.57976: tcp 24
01:30:15.875520 IP 167.99.216.145.8333 > tom-Latitude-3570.57976: tcp 225
01:30:15.875522 IP 167.99.216.145.8333 > tom-Latitude-3570.57976: tcp 24
01:30:15.875610 IP tom-Latitude-3570.57976 > 167.99.216.145.8333: tcp 0
01:30:15.875773 IP tom-Latitude-3570.56714 > ns3113832.ip-54-38-177.eu.8333: tcp 24
01:30:15.877056 IP tom-Latitude-3570.56714 > ns3113832.ip-54-38-177.eu.8333: tcp 37
01:30:15.877863 IP 167.99.216.145.8333 > tom-Latitude-3570.57976: tcp 730
01:30:15.913798 IP ns3113832.ip-54-38-177.eu.8333 > tom-Latitude-3570.56714: tcp 0
01:30:15.914422 IP ns3113832.ip-54-38-177.eu.8333 > tom-Latitude-3570.56714: tcp 0
01:30:15.919902 IP tom-Latitude-3570.57976 > 167.99.216.145.8333: tcp 0
01:30:15.931142 IP vmi195435.contaboserver.net.8333 > tom-Latitude-3570.39110: tcp 24
01:30:15.931834 IP vmi195435.contaboserver.net.8333 > tom-Latitude-3570.39110: tcp 483
01:30:15.931960 IP tom-Latitude-3570.39110 > vmi195435.contaboserver.net.8333: tcp 0
01:30:15.971360 IP ns3113832.ip-54-38-177.eu.8333 > tom-Latitude-3570.56714: tcp 24
01:30:15.971919 IP ns3113832.ip-54-38-177.eu.8333 > tom-Latitude-3570.56714: tcp 37
01:30:15.971978 IP tom-Latitude-3570.56714 > ns3113832.ip-54-38-177.eu.8333: tcp 0
01:30:15.972176 IP tom-Latitude-3570.60988 > 81.198.101.144.8333: tcp 24
01:30:15.972198 IP tom-Latitude-3570.56714 > ns3113832.ip-54-38-177.eu.8333: tcp 24
01:30:15.972242 IP tom-Latitude-3570.42516 > 2.56.9.15.8333: tcp 24
01:30:15.973601 IP tom-Latitude-3570.42516 > 2.56.9.15.8333: tcp 181
01:30:15.973611 IP tom-Latitude-3570.56714 > ns3113832.ip-54-38-177.eu.8333: tcp 374
01:30:15.973614 IP tom-Latitude-3570.60988 > 81.198.101.144.8333: tcp 793
01:30:16.063901 IP tom-Latitude-3570.56714 > ns3113832.ip-54-38-177.eu.8333: tcp 374
01:30:16.067904 IP tom-Latitude-3570.42516 > 2.56.9.15.8333: tcp 181
01:30:16.071787 IP tom-Latitude-3570.60988 > 81.198.101.144.8333: tcp 793
01:30:16.156755 IP 81.198.101.144.8333 > tom-Latitude-3570.60988: tcp 24
01:30:16.156777 IP 81.198.101.144.8333 > tom-Latitude-3570.60988: tcp 253
01:30:16.156779 IP 2.56.9.15.8333 > tom-Latitude-3570.42516: tcp 24
01:30:16.156808 IP tom-Latitude-3570.42516 > 2.56.9.15.8333: tcp 0
01:30:16.156836 IP 2.56.9.15.8333 > tom-Latitude-3570.42516: tcp 73
01:30:16.156838 IP tom-Latitude-3570.42516 > 2.56.9.15.8333: tcp 0
01:30:16.156872 IP tom-Latitude-3570.60988 > 81.198.101.144.8333: tcp 0
01:30:16.156967 IP tom-Latitude-3570.60988 > 81.198.101.144.8333: tcp 24
01:30:16.157086 IP tom-Latitude-3570.42516 > 2.56.9.15.8333: tcp 24
01:30:16.158182 IP tom-Latitude-3570.60988 > 81.198.101.144.8333: tcp 1382
01:30:16.158185 IP tom-Latitude-3570.60988 > 81.198.101.144.8333: tcp 1271
01:30:16.158189 IP tom-Latitude-3570.42516 > 2.56.9.15.8333: tcp 1237
01:30:16.183313 IP 81.198.101.144.8333 > tom-Latitude-3570.60988: tcp 253
01:30:16.183333 IP tom-Latitude-3570.60988 > 81.198.101.144.8333: tcp 0
01:30:16.202863 IP ns3113832.ip-54-38-177.eu.8333 > tom-Latitude-3570.56714: tcp 0
01:30:16.203464 IP 2.56.9.15.8333 > tom-Latitude-3570.42516: tcp 0
01:30:16.219494 IP 81.198.101.144.8333 > tom-Latitude-3570.60988: tcp 0
01:30:16.220057 IP 81.198.101.144.8333 > tom-Latitude-3570.60988: tcp 0
01:30:16.220071 IP 81.198.101.144.8333 > tom-Latitude-3570.60988: tcp 0
01:30:16.220073 IP 81.198.101.144.8333 > tom-Latitude-3570.60988: tcp 0
01:30:16.222668 IP 2.56.9.15.8333 > tom-Latitude-3570.42516: tcp 0
01:30:16.223307 IP 2.56.9.15.8333 > tom-Latitude-3570.42516: tcp 0
01:30:16.357826 IP tom-Latitude-3570.39110 > vmi195435.contaboserver.net.8333: tcp 24
01:30:16.358769 IP tom-Latitude-3570.39110 > vmi195435.contaboserver.net.8333: tcp 37
01:30:16.379810 IP 2.56.9.15.8333 > tom-Latitude-3570.42516: tcp 24
01:30:16.380473 IP 2.56.9.15.8333 > tom-Latitude-3570.42516: tcp 145
01:30:16.380603 IP tom-Latitude-3570.42516 > 2.56.9.15.8333: tcp 0
01:30:16.380768 IP tom-Latitude-3570.42516 > 2.56.9.15.8333: tcp 24
01:30:16.382097 IP tom-Latitude-3570.42516 > 2.56.9.15.8333: tcp 145
01:30:16.386319 IP vmi195435.contaboserver.net.8333 > tom-Latitude-3570.39110: tcp 0
01:30:16.391596 IP vmi195435.contaboserver.net.8333 > tom-Latitude-3570.39110: tcp 0
01:30:16.460872 IP 2.56.9.15.8333 > tom-Latitude-3570.42516: tcp 0
01:30:16.511701 IP 2.56.9.15.8333 > tom-Latitude-3570.42516: tcp 24
01:30:16.512611 IP 2.56.9.15.8333 > tom-Latitude-3570.42516: tcp 223
01:30:16.512629 IP 2.56.9.15.8333 > tom-Latitude-3570.42516: tcp 24
01:30:16.512631 IP 2.56.9.15.8333 > tom-Latitude-3570.42516: tcp 247
01:30:16.512633 IP 2.56.9.15.8333 > tom-Latitude-3570.42516: tcp 24
01:30:16.512635 IP 2.56.9.15.8333 > tom-Latitude-3570.42516: tcp 246
01:30:16.512638 IP 2.56.9.15.8333 > tom-Latitude-3570.42516: tcp 24
01:30:16.512658 IP 2.56.9.15.8333 > tom-Latitude-3570.42516: tcp 419
01:30:16.512727 IP tom-Latitude-3570.42516 > 2.56.9.15.8333: tcp 0
01:30:16.617395 IP tom-Latitude-3570.49070 > c-185-45-236-223.customer.ggaweb.ch.8333: tcp 24
01:30:16.618215 IP tom-Latitude-3570.49070 > c-185-45-236-223.customer.ggaweb.ch.8333: tcp 361
01:30:16.645109 IP c-185-45-236-223.customer.ggaweb.ch.8333 > tom-Latitude-3570.49070: tcp 0
01:30:16.653191 IP c-185-45-236-223.customer.ggaweb.ch.8333 > tom-Latitude-3570.49070: tcp 0
01:30:16.918482 IP tom-Latitude-3570.46284 > static-87-75-105-186.vodafonexdsl.co.uk.8333: tcp 24
01:30:16.919430 IP tom-Latitude-3570.46284 > static-87-75-105-186.vodafonexdsl.co.uk.8333: tcp 361
01:30:16.947860 IP static-87-75-105-186.vodafonexdsl.co.uk.8333 > tom-Latitude-3570.46284: tcp 0
01:30:16.954173 IP static-87-75-105-186.vodafonexdsl.co.uk.8333 > tom-Latitude-3570.46284: tcp 0
01:30:17.840261 IP 81.198.101.144.8333 > tom-Latitude-3570.60988: tcp 24
01:30:17.840284 IP tom-Latitude-3570.60988 > 81.198.101.144.8333: tcp 0
01:30:17.840873 IP 81.198.101.144.8333 > tom-Latitude-3570.60988: tcp 73
01:30:17.840889 IP tom-Latitude-3570.60988 > 81.198.101.144.8333: tcp 0
01:30:18.025321 IP 2.56.9.15.8333 > tom-Latitude-3570.42516: tcp 24
01:30:18.028427 IP 2.56.9.15.8333 > tom-Latitude-3570.42516: tcp 397
01:30:18.028540 IP tom-Latitude-3570.42516 > 2.56.9.15.8333: tcp 0
01:30:18.028847 IP tom-Latitude-3570.42516 > 2.56.9.15.8333: tcp 24
01:30:18.030087 IP tom-Latitude-3570.42516 > 2.56.9.15.8333: tcp 397
01:30:18.063026 IP 2.56.9.15.8333 > tom-Latitude-3570.42516: tcp 0
01:30:18.066136 IP 2.56.9.15.8333 > tom-Latitude-3570.42516: tcp 0
01:30:18.161463 IP 2.56.9.15.8333 > tom-Latitude-3570.42516: tcp 24
01:30:18.162307 IP 2.56.9.15.8333 > tom-Latitude-3570.42516: tcp 700
01:30:18.162325 IP 2.56.9.15.8333 > tom-Latitude-3570.42516: tcp 24
01:30:18.162439 IP tom-Latitude-3570.42516 > 2.56.9.15.8333: tcp 0
01:30:18.169153 IP 2.56.9.15.8333 > tom-Latitude-3570.42516: tcp 768
01:30:18.169785 IP 2.56.9.15.8333 > tom-Latitude-3570.42516: tcp 24
01:30:18.169798 IP 2.56.9.15.8333 > tom-Latitude-3570.42516: tcp 370
01:30:18.169802 IP 2.56.9.15.8333 > tom-Latitude-3570.42516: tcp 24
01:30:18.169805 IP 2.56.9.15.8333 > tom-Latitude-3570.42516: tcp 224
01:30:18.169824 IP 2.56.9.15.8333 > tom-Latitude-3570.42516: tcp 24
01:30:18.169827 IP 2.56.9.15.8333 > tom-Latitude-3570.42516: tcp 223
01:30:18.169864 IP tom-Latitude-3570.42516 > 2.56.9.15.8333: tcp 0
01:30:18.306886 IP 2.56.9.15.8333 > tom-Latitude-3570.42516: tcp 1368
01:30:18.306905 IP 2.56.9.15.8333 > tom-Latitude-3570.42516: tcp 846
01:30:18.306908 IP bb42-60-217-183.singnet.com.sg.8333 > tom-Latitude-3570.60470: tcp 24
01:30:18.307002 IP tom-Latitude-3570.42516 > 2.56.9.15.8333: tcp 0
01:30:18.307863 IP bb42-60-217-183.singnet.com.sg.8333 > tom-Latitude-3570.60470: tcp 829
01:30:18.307983 IP tom-Latitude-3570.60470 > bb42-60-217-183.singnet.com.sg.8333: tcp 0
01:30:19.215751 IP tom-Latitude-3570.60470 > bb42-60-217-183.singnet.com.sg.8333: tcp 24
01:30:19.216706 IP tom-Latitude-3570.60470 > bb42-60-217-183.singnet.com.sg.8333: tcp 37
01:30:19.273405 IP bb42-60-217-183.singnet.com.sg.8333 > tom-Latitude-3570.60470: tcp 0
01:30:19.516797 IP tom-Latitude-3570.49070 > c-185-45-236-223.customer.ggaweb.ch.8333: tcp 24
01:30:19.517784 IP tom-Latitude-3570.49070 > c-185-45-236-223.customer.ggaweb.ch.8333: tcp 397
01:30:19.547549 IP c-185-45-236-223.customer.ggaweb.ch.8333 > tom-Latitude-3570.49070: tcp 0
01:30:19.553605 IP c-185-45-236-223.customer.ggaweb.ch.8333 > tom-Latitude-3570.49070: tcp 0
01:30:19.817905 IP tom-Latitude-3570.39110 > vmi195435.contaboserver.net.8333: tcp 24
01:30:19.818840 IP tom-Latitude-3570.39110 > vmi195435.contaboserver.net.8333: tcp 541
01:30:19.846056 IP vmi195435.contaboserver.net.8333 > tom-Latitude-3570.39110: tcp 0
01:30:19.860882 IP vmi195435.contaboserver.net.8333 > tom-Latitude-3570.39110: tcp 0
01:30:20.018733 IP tom-Latitude-3570.57976 > 167.99.216.145.8333: tcp 24
01:30:20.019706 IP tom-Latitude-3570.57976 > 167.99.216.145.8333: tcp 577
01:30:20.045539 IP 167.99.216.145.8333 > tom-Latitude-3570.57976: tcp 0
01:30:20.053785 IP 167.99.216.145.8333 > tom-Latitude-3570.57976: tcp 0
01:30:20.307136 IP 81.198.101.144.8333 > tom-Latitude-3570.60988: tcp 24
01:30:20.307153 IP tom-Latitude-3570.60988 > 81.198.101.144.8333: tcp 0
01:30:20.309976 IP 81.198.101.144.8333 > tom-Latitude-3570.60988: tcp 31
01:30:20.309990 IP tom-Latitude-3570.60988 > 81.198.101.144.8333: tcp 0
01:30:20.310341 IP tom-Latitude-3570.56714 > ns3113832.ip-54-38-177.eu.8333: tcp 24
01:30:20.311533 IP tom-Latitude-3570.56714 > ns3113832.ip-54-38-177.eu.8333: tcp 721
01:30:20.352234 IP ns3113832.ip-54-38-177.eu.8333 > tom-Latitude-3570.56714: tcp 0
01:30:20.352843 IP ns3113832.ip-54-38-177.eu.8333 > tom-Latitude-3570.56714: tcp 0
01:30:20.711625 IP tom-Latitude-3570.46284 > static-87-75-105-186.vodafonexdsl.co.uk.8333: tcp 24
01:30:20.712255 IP tom-Latitude-3570.46284 > static-87-75-105-186.vodafonexdsl.co.uk.8333: tcp 397
01:30:20.745907 IP static-87-75-105-186.vodafonexdsl.co.uk.8333 > tom-Latitude-3570.46284: tcp 0
01:30:20.753187 IP static-87-75-105-186.vodafonexdsl.co.uk.8333 > tom-Latitude-3570.46284: tcp 0
01:30:21.012733 IP tom-Latitude-3570.60988 > 81.198.101.144.8333: tcp 24
01:30:21.013481 IP tom-Latitude-3570.60988 > 81.198.101.144.8333: tcp 541
01:30:21.054747 IP 81.198.101.144.8333 > tom-Latitude-3570.60988: tcp 0
01:30:21.064465 IP 81.198.101.144.8333 > tom-Latitude-3570.60988: tcp 0
01:30:21.231107 IP 81.198.101.144.8333 > tom-Latitude-3570.60988: tcp 24
01:30:21.231124 IP tom-Latitude-3570.60988 > 81.198.101.144.8333: tcp 0
01:30:21.231143 IP 81.198.101.144.8333 > tom-Latitude-3570.60988: tcp 289
01:30:21.231146 IP tom-Latitude-3570.60988 > 81.198.101.144.8333: tcp 0
01:30:21.231466 IP tom-Latitude-3570.60988 > 81.198.101.144.8333: tcp 24
01:30:21.232580 IP tom-Latitude-3570.60988 > 81.198.101.144.8333: tcp 289
01:30:21.263829 IP 81.198.101.144.8333 > tom-Latitude-3570.60988: tcp 0
01:30:21.264438 IP 81.198.101.144.8333 > tom-Latitude-3570.60988: tcp 0
01:30:21.273523 IP ns3113832.ip-54-38-177.eu.8333 > tom-Latitude-3570.56714: tcp 24
01:30:21.273542 IP ns3113832.ip-54-38-177.eu.8333 > tom-Latitude-3570.56714: tcp 31
01:30:21.273633 IP tom-Latitude-3570.56714 > ns3113832.ip-54-38-177.eu.8333: tcp 0
01:30:21.414245 IP 81.198.101.144.8333 > tom-Latitude-3570.60988: tcp 24
01:30:21.415420 IP 81.198.101.144.8333 > tom-Latitude-3570.60988: tcp 518
01:30:21.415436 IP 81.198.101.144.8333 > tom-Latitude-3570.60988: tcp 24
01:30:21.415439 IP 81.198.101.144.8333 > tom-Latitude-3570.60988: tcp 247
01:30:21.415441 IP 81.198.101.144.8333 > tom-Latitude-3570.60988: tcp 24
01:30:21.415443 IP 81.198.101.144.8333 > tom-Latitude-3570.60988: tcp 223
01:30:21.415446 IP 81.198.101.144.8333 > tom-Latitude-3570.60988: tcp 24
01:30:21.415466 IP 81.198.101.144.8333 > tom-Latitude-3570.60988: tcp 249
01:30:21.415467 IP 81.198.101.144.8333 > tom-Latitude-3570.60988: tcp 24
01:30:21.415470 IP 81.198.101.144.8333 > tom-Latitude-3570.60988: tcp 248
01:30:21.415472 IP 81.198.101.144.8333 > tom-Latitude-3570.60988: tcp 24
01:30:21.415473 IP 81.198.101.144.8333 > tom-Latitude-3570.60988: tcp 246
01:30:21.415475 IP 81.198.101.144.8333 > tom-Latitude-3570.60988: tcp 24
01:30:21.415477 IP 81.198.101.144.8333 > tom-Latitude-3570.60988: tcp 249
01:30:21.415478 IP 81.198.101.144.8333 > tom-Latitude-3570.60988: tcp 24
01:30:21.415480 IP 81.198.101.144.8333 > tom-Latitude-3570.60988: tcp 224
01:30:21.415536 IP tom-Latitude-3570.60988 > 81.198.101.144.8333: tcp 0
01:30:21.416187 IP tom-Latitude-3570.57976 > 167.99.216.145.8333: tcp 24
01:30:21.416979 IP tom-Latitude-3570.57976 > 167.99.216.145.8333: tcp 37
01:30:21.443560 IP 167.99.216.145.8333 > tom-Latitude-3570.57976: tcp 0
01:30:21.444089 IP 167.99.216.145.8333 > tom-Latitude-3570.57976: tcp 0
01:30:21.520020 IP tom-Latitude-3570.60470 > bb42-60-217-183.singnet.com.sg.8333: tcp 24
01:30:21.614837 IP tom-Latitude-3570.60470 > bb42-60-217-183.singnet.com.sg.8333: tcp 289
01:30:21.620450 IP tom-Latitude-3570.49070 > c-185-45-236-223.customer.ggaweb.ch.8333: tcp 24
01:30:21.654066 IP bb42-60-217-183.singnet.com.sg.8333 > tom-Latitude-3570.60470: tcp 0
01:30:21.656975 IP tom-Latitude-3570.49070 > c-185-45-236-223.customer.ggaweb.ch.8333: tcp 289
01:30:21.675376 IP c-185-45-236-223.customer.ggaweb.ch.8333 > tom-Latitude-3570.49070: tcp 0
01:30:21.683291 IP c-185-45-236-223.customer.ggaweb.ch.8333 > tom-Latitude-3570.49070: tcp 0
01:30:21.720782 IP tom-Latitude-3570.57976 > 167.99.216.145.8333: tcp 24
01:30:21.721768 IP tom-Latitude-3570.57976 > 167.99.216.145.8333: tcp 253
01:30:21.755380 IP 167.99.216.145.8333 > tom-Latitude-3570.57976: tcp 0
01:30:21.763252 IP 167.99.216.145.8333 > tom-Latitude-3570.57976: tcp 0
01:30:22.039381 IP bb42-60-217-183.singnet.com.sg.8333 > tom-Latitude-3570.60470: tcp 24
01:30:22.039907 IP bb42-60-217-183.singnet.com.sg.8333 > tom-Latitude-3570.60470: tcp 397
01:30:22.040007 IP tom-Latitude-3570.60470 > bb42-60-217-183.singnet.com.sg.8333: tcp 0
01:30:22.040290 IP tom-Latitude-3570.60470 > bb42-60-217-183.singnet.com.sg.8333: tcp 24
01:30:22.041399 IP tom-Latitude-3570.60470 > bb42-60-217-183.singnet.com.sg.8333: tcp 397
01:30:22.072624 IP bb42-60-217-183.singnet.com.sg.8333 > tom-Latitude-3570.60470: tcp 0
01:30:22.093636 IP vmi195435.contaboserver.net.8333 > tom-Latitude-3570.39110: tcp 24
01:30:22.094332 IP vmi195435.contaboserver.net.8333 > tom-Latitude-3570.39110: tcp 793
01:30:22.094458 IP tom-Latitude-3570.39110 > vmi195435.contaboserver.net.8333: tcp 0
01:30:22.094798 IP tom-Latitude-3570.39110 > vmi195435.contaboserver.net.8333: tcp 24
01:30:22.095904 IP tom-Latitude-3570.39110 > vmi195435.contaboserver.net.8333: tcp 109
01:30:22.132716 IP vmi195435.contaboserver.net.8333 > tom-Latitude-3570.39110: tcp 0
01:30:22.133268 IP vmi195435.contaboserver.net.8333 > tom-Latitude-3570.39110: tcp 0
01:30:22.195219 IP tom-Latitude-3570.46284 > static-87-75-105-186.vodafonexdsl.co.uk.8333: tcp 24
01:30:22.196157 IP tom-Latitude-3570.46284 > static-87-75-105-186.vodafonexdsl.co.uk.8333: tcp 289
01:30:22.212774 IP vmi195435.contaboserver.net.8333 > tom-Latitude-3570.39110: tcp 24
01:30:22.213407 IP vmi195435.contaboserver.net.8333 > tom-Latitude-3570.39110: tcp 192
01:30:22.213430 IP vmi195435.contaboserver.net.8333 > tom-Latitude-3570.39110: tcp 24
01:30:22.213432 IP vmi195435.contaboserver.net.8333 > tom-Latitude-3570.39110: tcp 246
01:30:22.213434 IP vmi195435.contaboserver.net.8333 > tom-Latitude-3570.39110: tcp 24
01:30:22.213436 IP vmi195435.contaboserver.net.8333 > tom-Latitude-3570.39110: tcp 224
01:30:22.213493 IP tom-Latitude-3570.39110 > vmi195435.contaboserver.net.8333: tcp 0
01:30:22.224309 IP static-87-75-105-186.vodafonexdsl.co.uk.8333 > tom-Latitude-3570.46284: tcp 0
01:30:22.232350 IP static-87-75-105-186.vodafonexdsl.co.uk.8333 > tom-Latitude-3570.46284: tcp 0
01:30:22.417268 IP 167.99.216.145.8333 > tom-Latitude-3570.57976: tcp 24
01:30:22.417291 IP tom-Latitude-3570.57976 > 167.99.216.145.8333: tcp 0
01:30:22.417324 IP 167.99.216.145.8333 > tom-Latitude-3570.57976: tcp 505
01:30:22.417329 IP tom-Latitude-3570.57976 > 167.99.216.145.8333: tcp 0
01:30:22.459949 IP bb42-60-217-183.singnet.com.sg.8333 > tom-Latitude-3570.60470: tcp 24
01:30:22.461140 IP bb42-60-217-183.singnet.com.sg.8333 > tom-Latitude-3570.60470: tcp 562
01:30:22.461159 IP bb42-60-217-183.singnet.com.sg.8333 > tom-Latitude-3570.60470: tcp 24
01:30:22.461161 IP bb42-60-217-183.singnet.com.sg.8333 > tom-Latitude-3570.60470: tcp 223
01:30:22.461164 IP bb42-60-217-183.singnet.com.sg.8333 > tom-Latitude-3570.60470: tcp 24
01:30:22.461165 IP bb42-60-217-183.singnet.com.sg.8333 > tom-Latitude-3570.60470: tcp 641
01:30:22.461168 IP bb42-60-217-183.singnet.com.sg.8333 > tom-Latitude-3570.60470: tcp 24
01:30:22.461187 IP bb42-60-217-183.singnet.com.sg.8333 > tom-Latitude-3570.60470: tcp 250
01:30:22.461189 IP bb42-60-217-183.singnet.com.sg.8333 > tom-Latitude-3570.60470: tcp 24
01:30:22.461190 IP bb42-60-217-183.singnet.com.sg.8333 > tom-Latitude-3570.60470: tcp 224
01:30:22.461192 IP bb42-60-217-183.singnet.com.sg.8333 > tom-Latitude-3570.60470: tcp 24
01:30:22.461196 IP bb42-60-217-183.singnet.com.sg.8333 > tom-Latitude-3570.60470: tcp 246
01:30:22.461211 IP bb42-60-217-183.singnet.com.sg.8333 > tom-Latitude-3570.60470: tcp 24
01:30:22.461213 IP bb42-60-217-183.singnet.com.sg.8333 > tom-Latitude-3570.60470: tcp 246
01:30:22.461215 IP bb42-60-217-183.singnet.com.sg.8333 > tom-Latitude-3570.60470: tcp 24
01:30:22.461216 IP bb42-60-217-183.singnet.com.sg.8333 > tom-Latitude-3570.60470: tcp 367
01:30:22.461260 IP tom-Latitude-3570.60470 > bb42-60-217-183.singnet.com.sg.8333: tcp 0
01:30:22.494440 IP bb42-60-217-183.singnet.com.sg.8333 > tom-Latitude-3570.60470: tcp 1382
01:30:22.494461 IP bb42-60-217-183.singnet.com.sg.8333 > tom-Latitude-3570.60470: tcp 933
01:30:22.494576 IP tom-Latitude-3570.60470 > bb42-60-217-183.singnet.com.sg.8333: tcp 0
01:30:22.495213 IP tom-Latitude-3570.42516 > 2.56.9.15.8333: tcp 24
01:30:22.495914 IP tom-Latitude-3570.42516 > 2.56.9.15.8333: tcp 721
01:30:22.531658 IP 2.56.9.15.8333 > tom-Latitude-3570.42516: tcp 24
01:30:22.532348 IP 2.56.9.15.8333 > tom-Latitude-3570.42516: tcp 829
01:30:22.532480 IP tom-Latitude-3570.42516 > 2.56.9.15.8333: tcp 0
01:30:22.532783 IP tom-Latitude-3570.42516 > 2.56.9.15.8333: tcp 24
01:30:22.532801 IP tom-Latitude-3570.42516 > 2.56.9.15.8333: tcp 37
01:30:22.534494 IP 2.56.9.15.8333 > tom-Latitude-3570.42516: tcp 0
01:30:22.535306 IP 2.56.9.15.8333 > tom-Latitude-3570.42516: tcp 0
01:30:22.573490 IP 2.56.9.15.8333 > tom-Latitude-3570.42516: tcp 0
01:30:22.574049 IP 2.56.9.15.8333 > tom-Latitude-3570.42516: tcp 0
01:30:22.806851 IP static-87-75-105-186.vodafonexdsl.co.uk.8333 > tom-Latitude-3570.46284: tcp 541
01:30:22.806868 IP tom-Latitude-3570.46284 > static-87-75-105-186.vodafonexdsl.co.uk.8333: tcp 0
01:30:22.806878 IP 2.56.9.15.8333 > tom-Latitude-3570.42516: tcp 74
01:30:22.806881 IP tom-Latitude-3570.42516 > 2.56.9.15.8333: tcp 0
01:30:22.864752 IP static-87-75-105-186.vodafonexdsl.co.uk.8333 > tom-Latitude-3570.46284: tcp 24
01:30:22.864776 IP tom-Latitude-3570.46284 > static-87-75-105-186.vodafonexdsl.co.uk.8333: tcp 0
01:30:22.864807 IP 2.56.9.15.8333 > tom-Latitude-3570.42516: tcp 24
01:30:22.864811 IP tom-Latitude-3570.42516 > 2.56.9.15.8333: tcp 0
01:30:22.864818 IP 2.56.9.15.8333 > tom-Latitude-3570.42516: tcp 1382
01:30:22.864821 IP tom-Latitude-3570.42516 > 2.56.9.15.8333: tcp 0
01:30:22.871141 IP tom-Latitude-3570.46284 > static-87-75-105-186.vodafonexdsl.co.uk.8333: tcp 24
01:30:22.871805 IP tom-Latitude-3570.46284 > static-87-75-105-186.vodafonexdsl.co.uk.8333: tcp 37
01:30:22.903290 IP static-87-75-105-186.vodafonexdsl.co.uk.8333 > tom-Latitude-3570.46284: tcp 0
01:30:22.903757 IP static-87-75-105-186.vodafonexdsl.co.uk.8333 > tom-Latitude-3570.46284: tcp 0
01:30:22.971903 IP static-87-75-105-186.vodafonexdsl.co.uk.8333 > tom-Latitude-3570.46284: tcp 24
01:30:22.974377 IP static-87-75-105-186.vodafonexdsl.co.uk.8333 > tom-Latitude-3570.46284: tcp 226
01:30:22.974458 IP tom-Latitude-3570.46284 > static-87-75-105-186.vodafonexdsl.co.uk.8333: tcp 0
01:30:23.010626 IP ns3113832.ip-54-38-177.eu.8333 > tom-Latitude-3570.56714: tcp 24
01:30:23.011367 IP ns3113832.ip-54-38-177.eu.8333 > tom-Latitude-3570.56714: tcp 865
01:30:23.011492 IP tom-Latitude-3570.56714 > ns3113832.ip-54-38-177.eu.8333: tcp 0
01:30:23.011924 IP tom-Latitude-3570.56714 > ns3113832.ip-54-38-177.eu.8333: tcp 24
01:30:23.013064 IP tom-Latitude-3570.56714 > ns3113832.ip-54-38-177.eu.8333: tcp 98
01:30:23.053416 IP ns3113832.ip-54-38-177.eu.8333 > tom-Latitude-3570.56714: tcp 0
01:30:23.053922 IP ns3113832.ip-54-38-177.eu.8333 > tom-Latitude-3570.56714: tcp 0
01:30:23.128628 IP ns3113832.ip-54-38-177.eu.8333 > tom-Latitude-3570.56714: tcp 24
01:30:23.128648 IP ns3113832.ip-54-38-177.eu.8333 > tom-Latitude-3570.56714: tcp 1275
01:30:23.128740 IP tom-Latitude-3570.56714 > ns3113832.ip-54-38-177.eu.8333: tcp 0
01:30:23.398363 IP vmi195435.contaboserver.net.8333 > tom-Latitude-3570.39110: tcp 24
01:30:23.398986 IP vmi195435.contaboserver.net.8333 > tom-Latitude-3570.39110: tcp 217
01:30:23.399006 IP tom-Latitude-3570.39110 > vmi195435.contaboserver.net.8333: tcp 0
01:30:23.399189 IP tom-Latitude-3570.39110 > vmi195435.contaboserver.net.8333: tcp 24
01:30:23.400382 IP tom-Latitude-3570.39110 > vmi195435.contaboserver.net.8333: tcp 109
01:30:23.432544 IP vmi195435.contaboserver.net.8333 > tom-Latitude-3570.39110: tcp 0
01:30:23.432550 IP vmi195435.contaboserver.net.8333 > tom-Latitude-3570.39110: tcp 0
01:30:23.444644 IP c-185-45-236-223.customer.ggaweb.ch.8333 > tom-Latitude-3570.49070: tcp 24
01:30:23.445291 IP c-185-45-236-223.customer.ggaweb.ch.8333 > tom-Latitude-3570.49070: tcp 757
01:30:23.445306 IP tom-Latitude-3570.49070 > c-185-45-236-223.customer.ggaweb.ch.8333: tcp 0
01:30:23.445524 IP tom-Latitude-3570.49070 > c-185-45-236-223.customer.ggaweb.ch.8333: tcp 24
01:30:23.446676 IP tom-Latitude-3570.49070 > c-185-45-236-223.customer.ggaweb.ch.8333: tcp 37
01:30:23.484294 IP c-185-45-236-223.customer.ggaweb.ch.8333 > tom-Latitude-3570.49070: tcp 0
01:30:23.484924 IP c-185-45-236-223.customer.ggaweb.ch.8333 > tom-Latitude-3570.49070: tcp 0
01:30:23.520107 IP static-87-75-105-186.vodafonexdsl.co.uk.8333 > tom-Latitude-3570.46284: tcp 24
01:30:23.528601 IP static-87-75-105-186.vodafonexdsl.co.uk.8333 > tom-Latitude-3570.46284: tcp 181
01:30:23.528627 IP tom-Latitude-3570.46284 > static-87-75-105-186.vodafonexdsl.co.uk.8333: tcp 0
01:30:23.563406 IP vmi195435.contaboserver.net.8333 > tom-Latitude-3570.39110: tcp 24
01:30:23.564250 IP vmi195435.contaboserver.net.8333 > tom-Latitude-3570.39110: tcp 249
01:30:23.564257 IP vmi195435.contaboserver.net.8333 > tom-Latitude-3570.39110: tcp 24
01:30:23.564259 IP vmi195435.contaboserver.net.8333 > tom-Latitude-3570.39110: tcp 666
01:30:23.564261 IP vmi195435.contaboserver.net.8333 > tom-Latitude-3570.39110: tcp 24
01:30:23.564263 IP vmi195435.contaboserver.net.8333 > tom-Latitude-3570.39110: tcp 486
01:30:23.564266 IP tom-Latitude-3570.39110 > vmi195435.contaboserver.net.8333: tcp 0
01:30:23.564305 IP tom-Latitude-3570.39110 > vmi195435.contaboserver.net.8333: tcp 0
