05:16:00.588303 IP tom-Latitude-3570.56714 > ns3113832.ip-54-38-177.eu.8333: tcp 24
05:16:00.588346 IP tom-Latitude-3570.46284 > static-87-75-105-186.vodafonexdsl.co.uk.8333: tcp 24
05:16:00.590449 IP tom-Latitude-3570.56714 > ns3113832.ip-54-38-177.eu.8333: tcp 109
05:16:00.591185 IP tom-Latitude-3570.46284 > static-87-75-105-186.vodafonexdsl.co.uk.8333: tcp 109
05:16:00.643428 IP ns3113832.ip-54-38-177.eu.8333 > tom-Latitude-3570.56714: tcp 0
05:16:00.651158 IP static-87-75-105-186.vodafonexdsl.co.uk.8333 > tom-Latitude-3570.46284: tcp 0
05:16:00.652706 IP ns3113832.ip-54-38-177.eu.8333 > tom-Latitude-3570.56714: tcp 0
05:16:00.652719 IP static-87-75-105-186.vodafonexdsl.co.uk.8333 > tom-Latitude-3570.46284: tcp 0
05:16:00.886265 IP 2.56.9.15.8333 > tom-Latitude-3570.42516: tcp 24
05:16:00.886293 IP 2.56.9.15.8333 > tom-Latitude-3570.42516: tcp 253
05:16:00.886353 IP tom-Latitude-3570.42516 > 2.56.9.15.8333: tcp 0
05:16:00.886622 IP tom-Latitude-3570.42516 > 2.56.9.15.8333: tcp 24
05:16:00.888612 IP tom-Latitude-3570.42516 > 2.56.9.15.8333: tcp 109
05:16:00.932961 IP 2.56.9.15.8333 > tom-Latitude-3570.42516: tcp 0
05:16:00.933559 IP 2.56.9.15.8333 > tom-Latitude-3570.42516: tcp 0
05:16:01.006978 IP static-87-75-105-186.vodafonexdsl.co.uk.8333 > tom-Latitude-3570.46284: tcp 24
05:16:01.007003 IP tom-Latitude-3570.46284 > static-87-75-105-186.vodafonexdsl.co.uk.8333: tcp 0
05:16:01.016893 IP static-87-75-105-186.vodafonexdsl.co.uk.8333 > tom-Latitude-3570.46284: tcp 145
05:16:01.016914 IP tom-Latitude-3570.46284 > static-87-75-105-186.vodafonexdsl.co.uk.8333: tcp 0
05:16:01.017188 IP tom-Latitude-3570.46284 > static-87-75-105-186.vodafonexdsl.co.uk.8333: tcp 24
05:16:01.019527 IP tom-Latitude-3570.46284 > static-87-75-105-186.vodafonexdsl.co.uk.8333: tcp 37
05:16:01.026568 IP 2.56.9.15.8333 > tom-Latitude-3570.42516: tcp 24
05:16:01.026589 IP 2.56.9.15.8333 > tom-Latitude-3570.42516: tcp 224
05:16:01.026595 IP 2.56.9.15.8333 > tom-Latitude-3570.42516: tcp 24
05:16:01.026636 IP tom-Latitude-3570.42516 > 2.56.9.15.8333: tcp 0
05:16:01.029379 IP 2.56.9.15.8333 > tom-Latitude-3570.42516: tcp 257
05:16:01.029398 IP 2.56.9.15.8333 > tom-Latitude-3570.42516: tcp 24
05:16:01.029402 IP 2.56.9.15.8333 > tom-Latitude-3570.42516: tcp 256
05:16:01.029446 IP tom-Latitude-3570.42516 > 2.56.9.15.8333: tcp 0
05:16:01.042517 IP static-87-75-105-186.vodafonexdsl.co.uk.8333 > tom-Latitude-3570.46284: tcp 0
05:16:01.050463 IP static-87-75-105-186.vodafonexdsl.co.uk.8333 > tom-Latitude-3570.46284: tcp 0
05:16:01.114339 IP static-87-75-105-186.vodafonexdsl.co.uk.8333 > tom-Latitude-3570.46284: tcp 24
05:16:01.115180 IP static-87-75-105-186.vodafonexdsl.co.uk.8333 > tom-Latitude-3570.46284: tcp 191
05:16:01.115245 IP tom-Latitude-3570.46284 > static-87-75-105-186.vodafonexdsl.co.uk.8333: tcp 0
05:16:01.216164 IP tom-Latitude-3570.56714 > ns3113832.ip-54-38-177.eu.8333: tcp 24
05:16:01.217309 IP tom-Latitude-3570.56714 > ns3113832.ip-54-38-177.eu.8333: tcp 145
05:16:01.248020 IP ns3113832.ip-54-38-177.eu.8333 > tom-Latitude-3570.56714: tcp 0
05:16:01.252918 IP ns3113832.ip-54-38-177.eu.8333 > tom-Latitude-3570.56714: tcp 0
05:16:01.394900 IP 2.56.9.15.8333 > tom-Latitude-3570.42516: tcp 24
05:16:01.394914 IP 2.56.9.15.8333 > tom-Latitude-3570.42516: tcp 73
05:16:01.394934 IP tom-Latitude-3570.42516 > 2.56.9.15.8333: tcp 0
05:16:01.395050 IP tom-Latitude-3570.42516 > 2.56.9.15.8333: tcp 24
05:16:01.397248 IP tom-Latitude-3570.42516 > 2.56.9.15.8333: tcp 37
05:16:01.417029 IP ns3113832.ip-54-38-177.eu.8333 > tom-Latitude-3570.56714: tcp 24
05:16:01.417047 IP ns3113832.ip-54-38-177.eu.8333 > tom-Latitude-3570.56714: tcp 37
05:16:01.417095 IP tom-Latitude-3570.56714 > ns3113832.ip-54-38-177.eu.8333: tcp 0
05:16:01.417279 IP tom-Latitude-3570.56714 > ns3113832.ip-54-38-177.eu.8333: tcp 24
05:16:01.418662 IP tom-Latitude-3570.56714 > ns3113832.ip-54-38-177.eu.8333: tcp 37
05:16:01.481423 IP 2.56.9.15.8333 > tom-Latitude-3570.42516: tcp 0
05:16:01.482092 IP ns3113832.ip-54-38-177.eu.8333 > tom-Latitude-3570.56714: tcp 0
05:16:01.482107 IP ns3113832.ip-54-38-177.eu.8333 > tom-Latitude-3570.56714: tcp 0
05:16:01.528394 IP ns3113832.ip-54-38-177.eu.8333 > tom-Latitude-3570.56714: tcp 24
05:16:01.528416 IP ns3113832.ip-54-38-177.eu.8333 > tom-Latitude-3570.56714: tcp 257
05:16:01.528462 IP tom-Latitude-3570.56714 > ns3113832.ip-54-38-177.eu.8333: tcp 0
05:16:01.540871 IP 2.56.9.15.8333 > tom-Latitude-3570.42516: tcp 24
05:16:01.540893 IP 2.56.9.15.8333 > tom-Latitude-3570.42516: tcp 256
05:16:01.540966 IP tom-Latitude-3570.42516 > 2.56.9.15.8333: tcp 0
05:16:01.700540 IP c-185-45-236-223.customer.ggaweb.ch.8333 > tom-Latitude-3570.49070: tcp 24
05:16:01.700571 IP c-185-45-236-223.customer.ggaweb.ch.8333 > tom-Latitude-3570.49070: tcp 253
05:16:01.700633 IP tom-Latitude-3570.49070 > c-185-45-236-223.customer.ggaweb.ch.8333: tcp 0
05:16:01.700858 IP tom-Latitude-3570.49070 > c-185-45-236-223.customer.ggaweb.ch.8333: tcp 24
05:16:01.702189 IP tom-Latitude-3570.49070 > c-185-45-236-223.customer.ggaweb.ch.8333: tcp 37
05:16:01.742981 IP c-185-45-236-223.customer.ggaweb.ch.8333 > tom-Latitude-3570.49070: tcp 0
05:16:01.743536 IP c-185-45-236-223.customer.ggaweb.ch.8333 > tom-Latitude-3570.49070: tcp 0
05:16:01.831925 IP c-185-45-236-223.customer.ggaweb.ch.8333 > tom-Latitude-3570.49070: tcp 24
05:16:01.831945 IP c-185-45-236-223.customer.ggaweb.ch.8333 > tom-Latitude-3570.49070: tcp 249
05:16:01.831985 IP tom-Latitude-3570.49070 > c-185-45-236-223.customer.ggaweb.ch.8333: tcp 0
05:16:02.110105 IP 81.198.101.144.8333 > tom-Latitude-3570.60988: tcp 24
05:16:02.110126 IP 81.198.101.144.8333 > tom-Latitude-3570.60988: tcp 541
05:16:02.110132 IP 167.99.216.145.8333 > tom-Latitude-3570.57976: tcp 24
05:16:02.110144 IP tom-Latitude-3570.57976 > 167.99.216.145.8333: tcp 0
05:16:02.110160 IP 167.99.216.145.8333 > tom-Latitude-3570.57976: tcp 361
05:16:02.110163 IP tom-Latitude-3570.57976 > 167.99.216.145.8333: tcp 0
05:16:02.110169 IP tom-Latitude-3570.60988 > 81.198.101.144.8333: tcp 0
05:16:02.110437 IP tom-Latitude-3570.60988 > 81.198.101.144.8333: tcp 24
05:16:02.112751 IP tom-Latitude-3570.60988 > 81.198.101.144.8333: tcp 37
05:16:02.153206 IP 81.198.101.144.8333 > tom-Latitude-3570.60988: tcp 0
05:16:02.156686 IP c-185-45-236-223.customer.ggaweb.ch.8333 > tom-Latitude-3570.49070: tcp 24
05:16:02.157316 IP c-185-45-236-223.customer.ggaweb.ch.8333 > tom-Latitude-3570.49070: tcp 73
05:16:02.157327 IP tom-Latitude-3570.49070 > c-185-45-236-223.customer.ggaweb.ch.8333: tcp 0
05:16:02.157447 IP tom-Latitude-3570.49070 > c-185-45-236-223.customer.ggaweb.ch.8333: tcp 24
05:16:02.158944 IP tom-Latitude-3570.49070 > c-185-45-236-223.customer.ggaweb.ch.8333: tcp 37
05:16:02.193250 IP c-185-45-236-223.customer.ggaweb.ch.8333 > tom-Latitude-3570.49070: tcp 0
05:16:02.193264 IP c-185-45-236-223.customer.ggaweb.ch.8333 > tom-Latitude-3570.49070: tcp 0
05:16:02.242995 IP 81.198.101.144.8333 > tom-Latitude-3570.60988: tcp 24
05:16:02.243589 IP 81.198.101.144.8333 > tom-Latitude-3570.60988: tcp 223
05:16:02.243654 IP tom-Latitude-3570.60988 > 81.198.101.144.8333: tcp 0
05:16:02.274944 IP c-185-45-236-223.customer.ggaweb.ch.8333 > tom-Latitude-3570.49070: tcp 24
05:16:02.275540 IP c-185-45-236-223.customer.ggaweb.ch.8333 > tom-Latitude-3570.49070: tcp 256
05:16:02.275604 IP tom-Latitude-3570.49070 > c-185-45-236-223.customer.ggaweb.ch.8333: tcp 0
05:16:02.978245 IP tom-Latitude-3570.56714 > ns3113832.ip-54-38-177.eu.8333: tcp 24
05:16:02.980553 IP tom-Latitude-3570.56714 > ns3113832.ip-54-38-177.eu.8333: tcp 145
05:16:03.032806 IP bb42-60-217-183.singnet.com.sg.8333 > tom-Latitude-3570.60470: tcp 24
05:16:03.033521 IP bb42-60-217-183.singnet.com.sg.8333 > tom-Latitude-3570.60470: tcp 361
05:16:03.033541 IP vmi195435.contaboserver.net.8333 > tom-Latitude-3570.39110: tcp 24
05:16:03.033548 IP vmi195435.contaboserver.net.8333 > tom-Latitude-3570.39110: tcp 433
05:16:03.033557 IP vmi195435.contaboserver.net.8333 > tom-Latitude-3570.39110: tcp 433
05:16:03.033567 IP tom-Latitude-3570.39110 > vmi195435.contaboserver.net.8333: tcp 0
05:16:03.033646 IP tom-Latitude-3570.60470 > bb42-60-217-183.singnet.com.sg.8333: tcp 0
05:16:03.033894 IP tom-Latitude-3570.39110 > vmi195435.contaboserver.net.8333: tcp 24
05:16:03.037204 IP ns3113832.ip-54-38-177.eu.8333 > tom-Latitude-3570.56714: tcp 0
05:16:03.040557 IP ns3113832.ip-54-38-177.eu.8333 > tom-Latitude-3570.56714: tcp 0
05:16:03.041209 IP tom-Latitude-3570.39110 > vmi195435.contaboserver.net.8333: tcp 109
05:16:03.082636 IP vmi195435.contaboserver.net.8333 > tom-Latitude-3570.39110: tcp 0
05:16:03.083644 IP vmi195435.contaboserver.net.8333 > tom-Latitude-3570.39110: tcp 0
05:16:03.161814 IP vmi195435.contaboserver.net.8333 > tom-Latitude-3570.39110: tcp 24
05:16:03.162547 IP vmi195435.contaboserver.net.8333 > tom-Latitude-3570.39110: tcp 251
05:16:03.162566 IP vmi195435.contaboserver.net.8333 > tom-Latitude-3570.39110: tcp 24
05:16:03.162570 IP vmi195435.contaboserver.net.8333 > tom-Latitude-3570.39110: tcp 226
05:16:03.162573 IP vmi195435.contaboserver.net.8333 > tom-Latitude-3570.39110: tcp 24
05:16:03.162576 IP vmi195435.contaboserver.net.8333 > tom-Latitude-3570.39110: tcp 256
05:16:03.162610 IP tom-Latitude-3570.39110 > vmi195435.contaboserver.net.8333: tcp 0
05:16:03.364230 IP tom-Latitude-3570.60988 > 81.198.101.144.8333: tcp 24
05:16:03.366277 IP tom-Latitude-3570.60988 > 81.198.101.144.8333: tcp 145
05:16:03.402753 IP 81.198.101.144.8333 > tom-Latitude-3570.60988: tcp 0
05:16:03.464534 IP tom-Latitude-3570.56714 > ns3113832.ip-54-38-177.eu.8333: tcp 24
05:16:03.464631 IP tom-Latitude-3570.57976 > 167.99.216.145.8333: tcp 24
05:16:03.465511 IP tom-Latitude-3570.56714 > ns3113832.ip-54-38-177.eu.8333: tcp 109
05:16:03.466940 IP tom-Latitude-3570.57976 > 167.99.216.145.8333: tcp 181
05:16:03.494663 IP ns3113832.ip-54-38-177.eu.8333 > tom-Latitude-3570.56714: tcp 0
05:16:03.502668 IP ns3113832.ip-54-38-177.eu.8333 > tom-Latitude-3570.56714: tcp 0
05:16:03.502682 IP 167.99.216.145.8333 > tom-Latitude-3570.57976: tcp 0
05:16:03.645975 IP 2.56.9.15.8333 > tom-Latitude-3570.42516: tcp 24
05:16:03.645995 IP 2.56.9.15.8333 > tom-Latitude-3570.42516: tcp 217
05:16:03.646042 IP tom-Latitude-3570.42516 > 2.56.9.15.8333: tcp 0
05:16:03.746426 IP tom-Latitude-3570.60470 > bb42-60-217-183.singnet.com.sg.8333: tcp 24
05:16:03.747228 IP tom-Latitude-3570.60470 > bb42-60-217-183.singnet.com.sg.8333: tcp 73
05:16:03.784725 IP bb42-60-217-183.singnet.com.sg.8333 > tom-Latitude-3570.60470: tcp 0
05:16:03.792461 IP bb42-60-217-183.singnet.com.sg.8333 > tom-Latitude-3570.60470: tcp 0
05:16:03.846826 IP tom-Latitude-3570.49070 > c-185-45-236-223.customer.ggaweb.ch.8333: tcp 24
05:16:03.848606 IP tom-Latitude-3570.49070 > c-185-45-236-223.customer.ggaweb.ch.8333: tcp 109
05:16:03.884572 IP c-185-45-236-223.customer.ggaweb.ch.8333 > tom-Latitude-3570.49070: tcp 0
05:16:03.892054 IP c-185-45-236-223.customer.ggaweb.ch.8333 > tom-Latitude-3570.49070: tcp 0
05:16:04.348603 IP tom-Latitude-3570.46284 > static-87-75-105-186.vodafonexdsl.co.uk.8333: tcp 24
05:16:04.350776 IP tom-Latitude-3570.46284 > static-87-75-105-186.vodafonexdsl.co.uk.8333: tcp 289
05:16:04.392995 IP static-87-75-105-186.vodafonexdsl.co.uk.8333 > tom-Latitude-3570.46284: tcp 0
05:16:04.401515 IP static-87-75-105-186.vodafonexdsl.co.uk.8333 > tom-Latitude-3570.46284: tcp 0
05:16:04.772374 IP vmi195435.contaboserver.net.8333 > tom-Latitude-3570.39110: tcp 24
05:16:04.772395 IP vmi195435.contaboserver.net.8333 > tom-Latitude-3570.39110: tcp 181
05:16:04.772437 IP tom-Latitude-3570.39110 > vmi195435.contaboserver.net.8333: tcp 0
05:16:04.772708 IP tom-Latitude-3570.39110 > vmi195435.contaboserver.net.8333: tcp 24
05:16:04.774513 IP tom-Latitude-3570.39110 > vmi195435.contaboserver.net.8333: tcp 181
05:16:04.775075 IP vmi195435.contaboserver.net.8333 > tom-Latitude-3570.39110: tcp 181
05:16:04.775091 IP tom-Latitude-3570.39110 > vmi195435.contaboserver.net.8333: tcp 0
05:16:04.811852 IP vmi195435.contaboserver.net.8333 > tom-Latitude-3570.39110: tcp 0
05:16:04.811866 IP vmi195435.contaboserver.net.8333 > tom-Latitude-3570.39110: tcp 0
05:16:04.860114 IP 167.99.216.145.8333 > tom-Latitude-3570.57976: tcp 24
05:16:04.860140 IP tom-Latitude-3570.57976 > 167.99.216.145.8333: tcp 0
05:16:04.860157 IP 167.99.216.145.8333 > tom-Latitude-3570.57976: tcp 8
05:16:04.860160 IP tom-Latitude-3570.57976 > 167.99.216.145.8333: tcp 0
05:16:04.860298 IP tom-Latitude-3570.57976 > 167.99.216.145.8333: tcp 24
05:16:04.862423 IP tom-Latitude-3570.57976 > 167.99.216.145.8333: tcp 8
05:16:04.893931 IP vmi195435.contaboserver.net.8333 > tom-Latitude-3570.39110: tcp 24
05:16:04.893947 IP tom-Latitude-3570.39110 > vmi195435.contaboserver.net.8333: tcp 0
05:16:04.894888 IP vmi195435.contaboserver.net.8333 > tom-Latitude-3570.39110: tcp 257
05:16:04.894914 IP tom-Latitude-3570.39110 > vmi195435.contaboserver.net.8333: tcp 0
05:16:04.894934 IP vmi195435.contaboserver.net.8333 > tom-Latitude-3570.39110: tcp 24
05:16:04.894939 IP tom-Latitude-3570.39110 > vmi195435.contaboserver.net.8333: tcp 0
05:16:04.894943 IP vmi195435.contaboserver.net.8333 > tom-Latitude-3570.39110: tcp 221
05:16:04.894963 IP vmi195435.contaboserver.net.8333 > tom-Latitude-3570.39110: tcp 24
05:16:04.894966 IP vmi195435.contaboserver.net.8333 > tom-Latitude-3570.39110: tcp 521
05:16:04.894966 IP tom-Latitude-3570.39110 > vmi195435.contaboserver.net.8333: tcp 0
05:16:04.894970 IP vmi195435.contaboserver.net.8333 > tom-Latitude-3570.39110: tcp 24
05:16:04.894973 IP tom-Latitude-3570.39110 > vmi195435.contaboserver.net.8333: tcp 0
05:16:04.894975 IP vmi195435.contaboserver.net.8333 > tom-Latitude-3570.39110: tcp 256
05:16:04.894977 IP tom-Latitude-3570.39110 > vmi195435.contaboserver.net.8333: tcp 0
05:16:04.894978 IP vmi195435.contaboserver.net.8333 > tom-Latitude-3570.39110: tcp 24
05:16:04.894996 IP vmi195435.contaboserver.net.8333 > tom-Latitude-3570.39110: tcp 283
05:16:04.894996 IP tom-Latitude-3570.39110 > vmi195435.contaboserver.net.8333: tcp 0
05:16:04.894999 IP 167.99.216.145.8333 > tom-Latitude-3570.57976: tcp 0
05:16:04.895000 IP tom-Latitude-3570.39110 > vmi195435.contaboserver.net.8333: tcp 0
05:16:04.895003 IP tom-Latitude-3570.39110 > vmi195435.contaboserver.net.8333: tcp 0
05:16:04.895006 IP tom-Latitude-3570.39110 > vmi195435.contaboserver.net.8333: tcp 0
05:16:04.983750 IP static-87-75-105-186.vodafonexdsl.co.uk.8333 > tom-Latitude-3570.46284: tcp 24
05:16:04.991748 IP static-87-75-105-186.vodafonexdsl.co.uk.8333 > tom-Latitude-3570.46284: tcp 253
05:16:04.991814 IP tom-Latitude-3570.46284 > static-87-75-105-186.vodafonexdsl.co.uk.8333: tcp 0
05:16:04.992060 IP tom-Latitude-3570.46284 > static-87-75-105-186.vodafonexdsl.co.uk.8333: tcp 24
05:16:04.993503 IP tom-Latitude-3570.46284 > static-87-75-105-186.vodafonexdsl.co.uk.8333: tcp 73
05:16:05.032559 IP static-87-75-105-186.vodafonexdsl.co.uk.8333 > tom-Latitude-3570.46284: tcp 0
05:16:05.034962 IP static-87-75-105-186.vodafonexdsl.co.uk.8333 > tom-Latitude-3570.46284: tcp 0
05:16:05.098583 IP static-87-75-105-186.vodafonexdsl.co.uk.8333 > tom-Latitude-3570.46284: tcp 24
05:16:05.099355 IP static-87-75-105-186.vodafonexdsl.co.uk.8333 > tom-Latitude-3570.46284: tcp 224
05:16:05.099375 IP static-87-75-105-186.vodafonexdsl.co.uk.8333 > tom-Latitude-3570.46284: tcp 24
05:16:05.099380 IP static-87-75-105-186.vodafonexdsl.co.uk.8333 > tom-Latitude-3570.46284: tcp 224
05:16:05.099422 IP tom-Latitude-3570.46284 > static-87-75-105-186.vodafonexdsl.co.uk.8333: tcp 0
05:16:05.180476 IP ns3113832.ip-54-38-177.eu.8333 > tom-Latitude-3570.56714: tcp 24
05:16:05.180498 IP ns3113832.ip-54-38-177.eu.8333 > tom-Latitude-3570.56714: tcp 253
05:16:05.180564 IP tom-Latitude-3570.56714 > ns3113832.ip-54-38-177.eu.8333: tcp 0
05:16:05.682332 IP tom-Latitude-3570.39110 > vmi195435.contaboserver.net.8333: tcp 24
05:16:05.684622 IP tom-Latitude-3570.39110 > vmi195435.contaboserver.net.8333: tcp 73
05:16:05.723026 IP vmi195435.contaboserver.net.8333 > tom-Latitude-3570.39110: tcp 0
05:16:05.723602 IP vmi195435.contaboserver.net.8333 > tom-Latitude-3570.39110: tcp 0
05:16:06.083804 IP tom-Latitude-3570.57976 > 167.99.216.145.8333: tcp 24
05:16:06.085814 IP tom-Latitude-3570.57976 > 167.99.216.145.8333: tcp 253
05:16:06.161191 IP 167.99.216.145.8333 > tom-Latitude-3570.57976: tcp 0
05:16:06.207224 IP 2.56.9.15.8333 > tom-Latitude-3570.42516: tcp 24
05:16:06.207781 IP 2.56.9.15.8333 > tom-Latitude-3570.42516: tcp 325
05:16:06.207846 IP tom-Latitude-3570.42516 > 2.56.9.15.8333: tcp 0
05:16:06.208087 IP tom-Latitude-3570.42516 > 2.56.9.15.8333: tcp 24
05:16:06.213449 IP tom-Latitude-3570.42516 > 2.56.9.15.8333: tcp 37
05:16:06.243172 IP 2.56.9.15.8333 > tom-Latitude-3570.42516: tcp 0
05:16:06.244220 IP 2.56.9.15.8333 > tom-Latitude-3570.42516: tcp 0
05:16:06.338194 IP 2.56.9.15.8333 > tom-Latitude-3570.42516: tcp 24
05:16:06.338815 IP 2.56.9.15.8333 > tom-Latitude-3570.42516: tcp 225
05:16:06.338868 IP tom-Latitude-3570.42516 > 2.56.9.15.8333: tcp 0
05:16:06.615747 IP 81.198.101.144.8333 > tom-Latitude-3570.60988: tcp 24
05:16:06.615769 IP 81.198.101.144.8333 > tom-Latitude-3570.60988: tcp 325
05:16:06.615813 IP tom-Latitude-3570.60988 > 81.198.101.144.8333: tcp 0
05:16:06.616045 IP tom-Latitude-3570.60988 > 81.198.101.144.8333: tcp 24
05:16:06.617285 IP tom-Latitude-3570.60988 > 81.198.101.144.8333: tcp 37
05:16:06.653153 IP 81.198.101.144.8333 > tom-Latitude-3570.60988: tcp 0
05:16:06.820389 IP 81.198.101.144.8333 > tom-Latitude-3570.60988: tcp 24
05:16:06.820411 IP 81.198.101.144.8333 > tom-Latitude-3570.60988: tcp 372
05:16:06.820456 IP tom-Latitude-3570.60988 > 81.198.101.144.8333: tcp 0
05:16:06.921527 IP tom-Latitude-3570.60470 > bb42-60-217-183.singnet.com.sg.8333: tcp 24
05:16:06.922511 IP tom-Latitude-3570.60470 > bb42-60-217-183.singnet.com.sg.8333: tcp 325
05:16:06.955157 IP bb42-60-217-183.singnet.com.sg.8333 > tom-Latitude-3570.60470: tcp 0
05:16:06.962199 IP bb42-60-217-183.singnet.com.sg.8333 > tom-Latitude-3570.60470: tcp 0
05:16:07.122256 IP tom-Latitude-3570.56714 > ns3113832.ip-54-38-177.eu.8333: tcp 24
05:16:07.125387 IP tom-Latitude-3570.56714 > ns3113832.ip-54-38-177.eu.8333: tcp 73
05:16:07.155170 IP ns3113832.ip-54-38-177.eu.8333 > tom-Latitude-3570.56714: tcp 0
05:16:07.163952 IP ns3113832.ip-54-38-177.eu.8333 > tom-Latitude-3570.56714: tcp 0
05:16:07.219978 IP ns3113832.ip-54-38-177.eu.8333 > tom-Latitude-3570.56714: tcp 24
05:16:07.220538 IP ns3113832.ip-54-38-177.eu.8333 > tom-Latitude-3570.56714: tcp 37
05:16:07.220602 IP tom-Latitude-3570.56714 > ns3113832.ip-54-38-177.eu.8333: tcp 0
05:16:07.220739 IP tom-Latitude-3570.56714 > ns3113832.ip-54-38-177.eu.8333: tcp 24
05:16:07.222276 IP tom-Latitude-3570.56714 > ns3113832.ip-54-38-177.eu.8333: tcp 372
05:16:07.253256 IP ns3113832.ip-54-38-177.eu.8333 > tom-Latitude-3570.56714: tcp 0
05:16:07.253765 IP ns3113832.ip-54-38-177.eu.8333 > tom-Latitude-3570.56714: tcp 0
05:16:07.622101 IP tom-Latitude-3570.49070 > c-185-45-236-223.customer.ggaweb.ch.8333: tcp 24
05:16:07.622143 IP tom-Latitude-3570.57976 > 167.99.216.145.8333: tcp 24
05:16:07.624824 IP tom-Latitude-3570.49070 > c-185-45-236-223.customer.ggaweb.ch.8333: tcp 325
05:16:07.625505 IP tom-Latitude-3570.57976 > 167.99.216.145.8333: tcp 73
05:16:07.652971 IP c-185-45-236-223.customer.ggaweb.ch.8333 > tom-Latitude-3570.49070: tcp 0
05:16:07.660962 IP 167.99.216.145.8333 > tom-Latitude-3570.57976: tcp 0
05:16:07.661716 IP c-185-45-236-223.customer.ggaweb.ch.8333 > tom-Latitude-3570.49070: tcp 0
05:16:07.698039 IP 167.99.216.145.8333 > tom-Latitude-3570.57976: tcp 24
05:16:07.699204 IP 167.99.216.145.8333 > tom-Latitude-3570.57976: tcp 325
05:16:07.699268 IP tom-Latitude-3570.57976 > 167.99.216.145.8333: tcp 0
05:16:07.699542 IP tom-Latitude-3570.57976 > 167.99.216.145.8333: tcp 24
05:16:07.700674 IP tom-Latitude-3570.57976 > 167.99.216.145.8333: tcp 253
05:16:07.732252 IP 167.99.216.145.8333 > tom-Latitude-3570.57976: tcp 0
05:16:07.796055 IP 167.99.216.145.8333 > tom-Latitude-3570.57976: tcp 24
05:16:07.796963 IP 167.99.216.145.8333 > tom-Latitude-3570.57976: tcp 340
05:16:07.796971 IP 167.99.216.145.8333 > tom-Latitude-3570.57976: tcp 24
05:16:07.796974 IP 167.99.216.145.8333 > tom-Latitude-3570.57976: tcp 372
05:16:07.796977 IP 167.99.216.145.8333 > tom-Latitude-3570.57976: tcp 24
05:16:07.796977 IP tom-Latitude-3570.57976 > 167.99.216.145.8333: tcp 0
05:16:07.796979 IP 167.99.216.145.8333 > tom-Latitude-3570.57976: tcp 247
05:16:07.796981 IP 167.99.216.145.8333 > tom-Latitude-3570.57976: tcp 24
05:16:07.796983 IP 167.99.216.145.8333 > tom-Latitude-3570.57976: tcp 224
05:16:07.796986 IP 167.99.216.145.8333 > tom-Latitude-3570.57976: tcp 24
05:16:07.797007 IP 167.99.216.145.8333 > tom-Latitude-3570.57976: tcp 224
05:16:07.797021 IP tom-Latitude-3570.57976 > 167.99.216.145.8333: tcp 0
05:16:07.880980 IP 167.99.216.145.8333 > tom-Latitude-3570.57976: tcp 823
05:16:07.880999 IP 167.99.216.145.8333 > tom-Latitude-3570.57976: tcp 24
05:16:07.881003 IP 167.99.216.145.8333 > tom-Latitude-3570.57976: tcp 37
05:16:07.881047 IP tom-Latitude-3570.57976 > 167.99.216.145.8333: tcp 0
05:16:07.883559 IP tom-Latitude-3570.42516 > 2.56.9.15.8333: tcp 24
05:16:07.883898 IP tom-Latitude-3570.57976 > 167.99.216.145.8333: tcp 24
05:16:07.884289 IP tom-Latitude-3570.42516 > 2.56.9.15.8333: tcp 253
05:16:07.885033 IP tom-Latitude-3570.57976 > 167.99.216.145.8333: tcp 37
05:16:07.931897 IP 2.56.9.15.8333 > tom-Latitude-3570.42516: tcp 0
05:16:07.931911 IP 2.56.9.15.8333 > tom-Latitude-3570.42516: tcp 0
05:16:07.931914 IP 167.99.216.145.8333 > tom-Latitude-3570.57976: tcp 0
05:16:07.993851 IP 167.99.216.145.8333 > tom-Latitude-3570.57976: tcp 24
05:16:07.994662 IP 167.99.216.145.8333 > tom-Latitude-3570.57976: tcp 192
05:16:07.994727 IP tom-Latitude-3570.57976 > 167.99.216.145.8333: tcp 0
05:16:08.095509 IP tom-Latitude-3570.46284 > static-87-75-105-186.vodafonexdsl.co.uk.8333: tcp 24
05:16:08.097086 IP tom-Latitude-3570.46284 > static-87-75-105-186.vodafonexdsl.co.uk.8333: tcp 361
05:16:08.123392 IP static-87-75-105-186.vodafonexdsl.co.uk.8333 > tom-Latitude-3570.46284: tcp 0
05:16:08.132781 IP static-87-75-105-186.vodafonexdsl.co.uk.8333 > tom-Latitude-3570.46284: tcp 0
05:16:08.158039 IP ns3113832.ip-54-38-177.eu.8333 > tom-Latitude-3570.56714: tcp 24
05:16:08.158061 IP ns3113832.ip-54-38-177.eu.8333 > tom-Latitude-3570.56714: tcp 217
05:16:08.158106 IP tom-Latitude-3570.56714 > ns3113832.ip-54-38-177.eu.8333: tcp 0
05:16:08.198641 IP static-87-75-105-186.vodafonexdsl.co.uk.8333 > tom-Latitude-3570.46284: tcp 24
05:16:08.199642 IP static-87-75-105-186.vodafonexdsl.co.uk.8333 > tom-Latitude-3570.46284: tcp 37
05:16:08.199673 IP tom-Latitude-3570.46284 > static-87-75-105-186.vodafonexdsl.co.uk.8333: tcp 0
05:16:08.199780 IP tom-Latitude-3570.46284 > static-87-75-105-186.vodafonexdsl.co.uk.8333: tcp 24
05:16:08.201232 IP tom-Latitude-3570.46284 > static-87-75-105-186.vodafonexdsl.co.uk.8333: tcp 520
05:16:08.243060 IP static-87-75-105-186.vodafonexdsl.co.uk.8333 > tom-Latitude-3570.46284: tcp 0
05:16:08.243074 IP static-87-75-105-186.vodafonexdsl.co.uk.8333 > tom-Latitude-3570.46284: tcp 0
05:16:08.300225 IP tom-Latitude-3570.42516 > 2.56.9.15.8333: tcp 24
05:16:08.301331 IP tom-Latitude-3570.42516 > 2.56.9.15.8333: tcp 73
05:16:08.334778 IP 2.56.9.15.8333 > tom-Latitude-3570.42516: tcp 0
05:16:08.338540 IP 2.56.9.15.8333 > tom-Latitude-3570.42516: tcp 24
05:16:08.339094 IP 2.56.9.15.8333 > tom-Latitude-3570.42516: tcp 61
05:16:08.339146 IP tom-Latitude-3570.42516 > 2.56.9.15.8333: tcp 0
05:16:08.382860 IP 2.56.9.15.8333 > tom-Latitude-3570.42516: tcp 0
05:16:09.342551 IP tom-Latitude-3570.60470 > bb42-60-217-183.singnet.com.sg.8333: tcp 24
05:16:09.345331 IP tom-Latitude-3570.60470 > bb42-60-217-183.singnet.com.sg.8333: tcp 289
05:16:09.392899 IP bb42-60-217-183.singnet.com.sg.8333 > tom-Latitude-3570.60470: tcp 0
05:16:09.401010 IP bb42-60-217-183.singnet.com.sg.8333 > tom-Latitude-3570.60470: tcp 0
05:16:09.585183 IP 167.99.216.145.8333 > tom-Latitude-3570.57976: tcp 24
05:16:09.585203 IP 167.99.216.145.8333 > tom-Latitude-3570.57976: tcp 253
05:16:09.585296 IP tom-Latitude-3570.57976 > 167.99.216.145.8333: tcp 0
05:16:09.585570 IP tom-Latitude-3570.57976 > 167.99.216.145.8333: tcp 24
05:16:09.587406 IP tom-Latitude-3570.57976 > 167.99.216.145.8333: tcp 253
05:16:09.632671 IP 167.99.216.145.8333 > tom-Latitude-3570.57976: tcp 0
05:16:09.695706 IP 167.99.216.145.8333 > tom-Latitude-3570.57976: tcp 24
05:16:09.695728 IP 167.99.216.145.8333 > tom-Latitude-3570.57976: tcp 404
05:16:09.695733 IP 167.99.216.145.8333 > tom-Latitude-3570.57976: tcp 24
05:16:09.695737 IP 167.99.216.145.8333 > tom-Latitude-3570.57976: tcp 249
05:16:09.695739 IP 167.99.216.145.8333 > tom-Latitude-3570.57976: tcp 24
05:16:09.695742 IP 167.99.216.145.8333 > tom-Latitude-3570.57976: tcp 257
05:16:09.695744 IP 167.99.216.145.8333 > tom-Latitude-3570.57976: tcp 24
05:16:09.695747 IP 167.99.216.145.8333 > tom-Latitude-3570.57976: tcp 257
05:16:09.695748 IP 167.99.216.145.8333 > tom-Latitude-3570.57976: tcp 24
05:16:09.695751 IP 167.99.216.145.8333 > tom-Latitude-3570.57976: tcp 225
05:16:09.695774 IP tom-Latitude-3570.57976 > 167.99.216.145.8333: tcp 0
05:16:09.750877 IP bb42-60-217-183.singnet.com.sg.8333 > tom-Latitude-3570.60470: tcp 24
05:16:09.751513 IP bb42-60-217-183.singnet.com.sg.8333 > tom-Latitude-3570.60470: tcp 541
05:16:09.751578 IP tom-Latitude-3570.60470 > bb42-60-217-183.singnet.com.sg.8333: tcp 0
05:16:09.757645 IP 167.99.216.145.8333 > tom-Latitude-3570.57976: tcp 643
05:16:09.799904 IP tom-Latitude-3570.57976 > 167.99.216.145.8333: tcp 0
05:16:10.059567 IP tom-Latitude-3570.56714 > ns3113832.ip-54-38-177.eu.8333: tcp 24
05:16:10.061626 IP tom-Latitude-3570.56714 > ns3113832.ip-54-38-177.eu.8333: tcp 325
05:16:10.088663 IP static-87-75-105-186.vodafonexdsl.co.uk.8333 > tom-Latitude-3570.46284: tcp 24
05:16:10.094699 IP ns3113832.ip-54-38-177.eu.8333 > tom-Latitude-3570.56714: tcp 0
05:16:10.098423 IP static-87-75-105-186.vodafonexdsl.co.uk.8333 > tom-Latitude-3570.46284: tcp 253
05:16:10.098529 IP tom-Latitude-3570.46284 > static-87-75-105-186.vodafonexdsl.co.uk.8333: tcp 0
05:16:10.104090 IP ns3113832.ip-54-38-177.eu.8333 > tom-Latitude-3570.56714: tcp 0
05:16:10.299580 IP tom-Latitude-3570.39110 > vmi195435.contaboserver.net.8333: tcp 24
05:16:10.301640 IP tom-Latitude-3570.39110 > vmi195435.contaboserver.net.8333: tcp 613
05:16:10.334683 IP vmi195435.contaboserver.net.8333 > tom-Latitude-3570.39110: tcp 0
05:16:10.344462 IP vmi195435.contaboserver.net.8333 > tom-Latitude-3570.39110: tcp 0
05:16:11.402725 IP tom-Latitude-3570.42516 > 2.56.9.15.8333: tcp 24
05:16:11.404782 IP tom-Latitude-3570.42516 > 2.56.9.15.8333: tcp 253
05:16:11.455304 IP ns3113832.ip-54-38-177.eu.8333 > tom-Latitude-3570.56714: tcp 24
05:16:11.456141 IP ns3113832.ip-54-38-177.eu.8333 > tom-Latitude-3570.56714: tcp 37
05:16:11.456205 IP tom-Latitude-3570.56714 > ns3113832.ip-54-38-177.eu.8333: tcp 0
05:16:11.456390 IP tom-Latitude-3570.56714 > ns3113832.ip-54-38-177.eu.8333: tcp 24
05:16:11.458725 IP tom-Latitude-3570.56714 > ns3113832.ip-54-38-177.eu.8333: tcp 37
05:16:11.459255 IP 2.56.9.15.8333 > tom-Latitude-3570.42516: tcp 0
05:16:11.464824 IP ns3113832.ip-54-38-177.eu.8333 > tom-Latitude-3570.56714: tcp 37
05:16:11.464844 IP tom-Latitude-3570.56714 > ns3113832.ip-54-38-177.eu.8333: tcp 0
05:16:11.467923 IP 2.56.9.15.8333 > tom-Latitude-3570.42516: tcp 0
05:16:11.492410 IP ns3113832.ip-54-38-177.eu.8333 > tom-Latitude-3570.56714: tcp 0
05:16:11.492970 IP ns3113832.ip-54-38-177.eu.8333 > tom-Latitude-3570.56714: tcp 0
05:16:11.551035 IP ns3113832.ip-54-38-177.eu.8333 > tom-Latitude-3570.56714: tcp 24
05:16:11.551052 IP tom-Latitude-3570.56714 > ns3113832.ip-54-38-177.eu.8333: tcp 0
05:16:11.551643 IP ns3113832.ip-54-38-177.eu.8333 > tom-Latitude-3570.56714: tcp 246
05:16:11.551669 IP tom-Latitude-3570.56714 > ns3113832.ip-54-38-177.eu.8333: tcp 0
05:16:11.643735 IP c-185-45-236-223.customer.ggaweb.ch.8333 > tom-Latitude-3570.49070: tcp 24
05:16:11.646870 IP c-185-45-236-223.customer.ggaweb.ch.8333 > tom-Latitude-3570.49070: tcp 757
05:16:11.646935 IP tom-Latitude-3570.49070 > c-185-45-236-223.customer.ggaweb.ch.8333: tcp 0
05:16:11.647268 IP tom-Latitude-3570.49070 > c-185-45-236-223.customer.ggaweb.ch.8333: tcp 24
05:16:11.648473 IP tom-Latitude-3570.49070 > c-185-45-236-223.customer.ggaweb.ch.8333: tcp 181
05:16:11.721329 IP c-185-45-236-223.customer.ggaweb.ch.8333 > tom-Latitude-3570.49070: tcp 0
05:16:11.721343 IP c-185-45-236-223.customer.ggaweb.ch.8333 > tom-Latitude-3570.49070: tcp 0
05:16:11.747782 IP tom-Latitude-3570.60988 > 81.198.101.144.8333: tcp 24
05:16:11.747832 IP tom-Latitude-3570.42516 > 2.56.9.15.8333: tcp 24
05:16:11.748765 IP tom-Latitude-3570.60988 > 81.198.101.144.8333: tcp 577
05:16:11.749357 IP tom-Latitude-3570.42516 > 2.56.9.15.8333: tcp 37
05:16:11.766120 IP c-185-45-236-223.customer.ggaweb.ch.8333 > tom-Latitude-3570.49070: tcp 24
05:16:11.766899 IP c-185-45-236-223.customer.ggaweb.ch.8333 > tom-Latitude-3570.49070: tcp 1349
05:16:11.766917 IP c-185-45-236-223.customer.ggaweb.ch.8333 > tom-Latitude-3570.49070: tcp 446
05:16:11.766963 IP tom-Latitude-3570.49070 > c-185-45-236-223.customer.ggaweb.ch.8333: tcp 0
05:16:11.786071 IP 2.56.9.15.8333 > tom-Latitude-3570.42516: tcp 0
05:16:11.786697 IP 81.198.101.144.8333 > tom-Latitude-3570.60988: tcp 0
05:16:11.786711 IP 2.56.9.15.8333 > tom-Latitude-3570.42516: tcp 0
05:16:11.869677 IP tom-Latitude-3570.39110 > vmi195435.contaboserver.net.8333: tcp 24
05:16:11.870620 IP tom-Latitude-3570.39110 > vmi195435.contaboserver.net.8333: tcp 217
05:16:11.904989 IP vmi195435.contaboserver.net.8333 > tom-Latitude-3570.39110: tcp 0
05:16:11.911847 IP vmi195435.contaboserver.net.8333 > tom-Latitude-3570.39110: tcp 0
05:16:12.554802 IP 81.198.101.144.8333 > tom-Latitude-3570.60988: tcp 24
05:16:12.554823 IP 81.198.101.144.8333 > tom-Latitude-3570.60988: tcp 109
05:16:12.554829 IP static-87-75-105-186.vodafonexdsl.co.uk.8333 > tom-Latitude-3570.46284: tcp 24
05:16:12.554834 IP static-87-75-105-186.vodafonexdsl.co.uk.8333 > tom-Latitude-3570.46284: tcp 217
05:16:12.554867 IP tom-Latitude-3570.60988 > 81.198.101.144.8333: tcp 0
05:16:12.554909 IP tom-Latitude-3570.46284 > static-87-75-105-186.vodafonexdsl.co.uk.8333: tcp 0
05:16:12.557171 IP 81.198.101.144.8333 > tom-Latitude-3570.60988: tcp 109
05:16:12.557190 IP tom-Latitude-3570.60988 > 81.198.101.144.8333: tcp 0
05:16:12.573761 IP static-87-75-105-186.vodafonexdsl.co.uk.8333 > tom-Latitude-3570.46284: tcp 217
05:16:12.573779 IP tom-Latitude-3570.46284 > static-87-75-105-186.vodafonexdsl.co.uk.8333: tcp 0
05:16:12.755898 IP tom-Latitude-3570.60988 > 81.198.101.144.8333: tcp 24
05:16:12.758680 IP tom-Latitude-3570.60988 > 81.198.101.144.8333: tcp 73
05:16:12.802890 IP 81.198.101.144.8333 > tom-Latitude-3570.60988: tcp 0
05:16:12.956574 IP tom-Latitude-3570.60470 > bb42-60-217-183.singnet.com.sg.8333: tcp 24
05:16:13.006422 IP tom-Latitude-3570.60470 > bb42-60-217-183.singnet.com.sg.8333: tcp 217
05:16:13.006953 IP ns3113832.ip-54-38-177.eu.8333 > tom-Latitude-3570.56714: tcp 24
05:16:13.006979 IP tom-Latitude-3570.56714 > ns3113832.ip-54-38-177.eu.8333: tcp 0
05:16:13.006996 IP ns3113832.ip-54-38-177.eu.8333 > tom-Latitude-3570.56714: tcp 217
05:16:13.007000 IP tom-Latitude-3570.56714 > ns3113832.ip-54-38-177.eu.8333: tcp 0
05:16:13.007281 IP tom-Latitude-3570.56714 > ns3113832.ip-54-38-177.eu.8333: tcp 24
05:16:13.011035 IP tom-Latitude-3570.56714 > ns3113832.ip-54-38-177.eu.8333: tcp 37
05:16:13.015169 IP ns3113832.ip-54-38-177.eu.8333 > tom-Latitude-3570.56714: tcp 217
05:16:13.015188 IP tom-Latitude-3570.56714 > ns3113832.ip-54-38-177.eu.8333: tcp 0
05:16:13.043005 IP bb42-60-217-183.singnet.com.sg.8333 > tom-Latitude-3570.60470: tcp 0
05:16:13.043588 IP ns3113832.ip-54-38-177.eu.8333 > tom-Latitude-3570.56714: tcp 0
05:16:13.043602 IP bb42-60-217-183.singnet.com.sg.8333 > tom-Latitude-3570.60470: tcp 0
05:16:13.043605 IP ns3113832.ip-54-38-177.eu.8333 > tom-Latitude-3570.56714: tcp 0
05:16:13.043608 IP vmi195435.contaboserver.net.8333 > tom-Latitude-3570.39110: tcp 24
05:16:13.043625 IP tom-Latitude-3570.39110 > vmi195435.contaboserver.net.8333: tcp 0
05:16:13.043642 IP vmi195435.contaboserver.net.8333 > tom-Latitude-3570.39110: tcp 145
05:16:13.043646 IP tom-Latitude-3570.39110 > vmi195435.contaboserver.net.8333: tcp 0
05:16:13.043866 IP tom-Latitude-3570.39110 > vmi195435.contaboserver.net.8333: tcp 24
05:16:13.045624 IP tom-Latitude-3570.39110 > vmi195435.contaboserver.net.8333: tcp 109
05:16:13.082871 IP vmi195435.contaboserver.net.8333 > tom-Latitude-3570.39110: tcp 0
05:16:13.082885 IP vmi195435.contaboserver.net.8333 > tom-Latitude-3570.39110: tcp 0
05:16:13.100811 IP ns3113832.ip-54-38-177.eu.8333 > tom-Latitude-3570.56714: tcp 24
05:16:13.100828 IP tom-Latitude-3570.56714 > ns3113832.ip-54-38-177.eu.8333: tcp 0
05:16:13.101360 IP ns3113832.ip-54-38-177.eu.8333 > tom-Latitude-3570.56714: tcp 249
05:16:13.101378 IP tom-Latitude-3570.56714 > ns3113832.ip-54-38-177.eu.8333: tcp 0
05:16:13.170316 IP vmi195435.contaboserver.net.8333 > tom-Latitude-3570.39110: tcp 24
05:16:13.170337 IP vmi195435.contaboserver.net.8333 > tom-Latitude-3570.39110: tcp 256
05:16:13.170341 IP vmi195435.contaboserver.net.8333 > tom-Latitude-3570.39110: tcp 24
05:16:13.170346 IP vmi195435.contaboserver.net.8333 > tom-Latitude-3570.39110: tcp 256
05:16:13.170348 IP vmi195435.contaboserver.net.8333 > tom-Latitude-3570.39110: tcp 24
05:16:13.170351 IP vmi195435.contaboserver.net.8333 > tom-Latitude-3570.39110: tcp 223
05:16:13.170400 IP tom-Latitude-3570.39110 > vmi195435.contaboserver.net.8333: tcp 0
05:16:13.373829 IP 167.99.216.145.8333 > tom-Latitude-3570.57976: tcp 24
05:16:13.373848 IP tom-Latitude-3570.57976 > 167.99.216.145.8333: tcp 0
05:16:13.373888 IP tom-Latitude-3570.46284 > static-87-75-105-186.vodafonexdsl.co.uk.8333: tcp 24
05:16:13.373890 IP 167.99.216.145.8333 > tom-Latitude-3570.57976: tcp 361
05:16:13.373897 IP tom-Latitude-3570.57976 > 167.99.216.145.8333: tcp 0
05:16:13.375654 IP tom-Latitude-3570.46284 > static-87-75-105-186.vodafonexdsl.co.uk.8333: tcp 145
05:16:13.415895 IP static-87-75-105-186.vodafonexdsl.co.uk.8333 > tom-Latitude-3570.46284: tcp 0
05:16:13.415901 IP static-87-75-105-186.vodafonexdsl.co.uk.8333 > tom-Latitude-3570.46284: tcp 0
05:16:13.783606 IP bb42-60-217-183.singnet.com.sg.8333 > tom-Latitude-3570.60470: tcp 24
05:16:13.783629 IP bb42-60-217-183.singnet.com.sg.8333 > tom-Latitude-3570.60470: tcp 145
05:16:13.783674 IP tom-Latitude-3570.60470 > bb42-60-217-183.singnet.com.sg.8333: tcp 0
05:16:13.988280 IP c-185-45-236-223.customer.ggaweb.ch.8333 > tom-Latitude-3570.49070: tcp 24
05:16:13.988296 IP c-185-45-236-223.customer.ggaweb.ch.8333 > tom-Latitude-3570.49070: tcp 145
05:16:13.988315 IP tom-Latitude-3570.49070 > c-185-45-236-223.customer.ggaweb.ch.8333: tcp 0
05:16:15.694160 IP tom-Latitude-3570.56714 > ns3113832.ip-54-38-177.eu.8333: tcp 24
05:16:15.696280 IP tom-Latitude-3570.56714 > ns3113832.ip-54-38-177.eu.8333: tcp 109
05:16:15.744305 IP ns3113832.ip-54-38-177.eu.8333 > tom-Latitude-3570.56714: tcp 0
05:16:15.751997 IP ns3113832.ip-54-38-177.eu.8333 > tom-Latitude-3570.56714: tcp 0
05:16:15.755899 IP 2.56.9.15.8333 > tom-Latitude-3570.42516: tcp 24
05:16:15.756553 IP 2.56.9.15.8333 > tom-Latitude-3570.42516: tcp 433
05:16:15.756619 IP tom-Latitude-3570.42516 > 2.56.9.15.8333: tcp 0
05:16:15.756789 IP tom-Latitude-3570.60988 > 81.198.101.144.8333: tcp 24
05:16:15.756956 IP tom-Latitude-3570.42516 > 2.56.9.15.8333: tcp 24
05:16:15.759852 IP tom-Latitude-3570.60988 > 81.198.101.144.8333: tcp 145
05:16:15.760672 IP tom-Latitude-3570.42516 > 2.56.9.15.8333: tcp 109
05:16:15.786970 IP static-87-75-105-186.vodafonexdsl.co.uk.8333 > tom-Latitude-3570.46284: tcp 24
05:16:15.787024 IP tom-Latitude-3570.46284 > static-87-75-105-186.vodafonexdsl.co.uk.8333: tcp 0
05:16:15.787040 IP static-87-75-105-186.vodafonexdsl.co.uk.8333 > tom-Latitude-3570.46284: tcp 37
05:16:15.787043 IP tom-Latitude-3570.46284 > static-87-75-105-186.vodafonexdsl.co.uk.8333: tcp 0
05:16:15.792258 IP 2.56.9.15.8333 > tom-Latitude-3570.42516: tcp 0
05:16:15.792273 IP 81.198.101.144.8333 > tom-Latitude-3570.60988: tcp 0
05:16:15.792277 IP 2.56.9.15.8333 > tom-Latitude-3570.42516: tcp 0
05:16:15.891623 IP 2.56.9.15.8333 > tom-Latitude-3570.42516: tcp 24
05:16:15.892367 IP 2.56.9.15.8333 > tom-Latitude-3570.42516: tcp 372
05:16:15.892386 IP 2.56.9.15.8333 > tom-Latitude-3570.42516: tcp 24
05:16:15.892392 IP 2.56.9.15.8333 > tom-Latitude-3570.42516: tcp 256
05:16:15.892395 IP 2.56.9.15.8333 > tom-Latitude-3570.42516: tcp 24
05:16:15.892399 IP 2.56.9.15.8333 > tom-Latitude-3570.42516: tcp 225
05:16:15.892435 IP tom-Latitude-3570.42516 > 2.56.9.15.8333: tcp 0
05:16:15.994099 IP tom-Latitude-3570.39110 > vmi195435.contaboserver.net.8333: tcp 24
05:16:15.995154 IP tom-Latitude-3570.39110 > vmi195435.contaboserver.net.8333: tcp 31
05:16:16.024399 IP vmi195435.contaboserver.net.8333 > tom-Latitude-3570.39110: tcp 0
05:16:16.033842 IP vmi195435.contaboserver.net.8333 > tom-Latitude-3570.39110: tcp 0
05:16:16.194781 IP tom-Latitude-3570.60988 > 81.198.101.144.8333: tcp 24
05:16:16.197109 IP tom-Latitude-3570.60988 > 81.198.101.144.8333: tcp 109
05:16:16.232316 IP 81.198.101.144.8333 > tom-Latitude-3570.60988: tcp 0
05:16:16.295103 IP tom-Latitude-3570.56714 > ns3113832.ip-54-38-177.eu.8333: tcp 24
05:16:16.296093 IP tom-Latitude-3570.56714 > ns3113832.ip-54-38-177.eu.8333: tcp 109
05:16:16.323467 IP ns3113832.ip-54-38-177.eu.8333 > tom-Latitude-3570.56714: tcp 0
05:16:16.331394 IP ns3113832.ip-54-38-177.eu.8333 > tom-Latitude-3570.56714: tcp 0
05:16:16.897096 IP tom-Latitude-3570.60470 > bb42-60-217-183.singnet.com.sg.8333: tcp 24
05:16:16.899099 IP tom-Latitude-3570.60470 > bb42-60-217-183.singnet.com.sg.8333: tcp 164
05:16:16.899703 IP vmi195435.contaboserver.net.8333 > tom-Latitude-3570.39110: tcp 24
05:16:16.899724 IP vmi195435.contaboserver.net.8333 > tom-Latitude-3570.39110: tcp 217
05:16:16.899735 IP vmi195435.contaboserver.net.8333 > tom-Latitude-3570.39110: tcp 217
05:16:16.899764 IP tom-Latitude-3570.39110 > vmi195435.contaboserver.net.8333: tcp 0
05:16:16.900012 IP tom-Latitude-3570.39110 > vmi195435.contaboserver.net.8333: tcp 24
05:16:16.902784 IP tom-Latitude-3570.39110 > vmi195435.contaboserver.net.8333: tcp 109
05:16:16.931166 IP bb42-60-217-183.singnet.com.sg.8333 > tom-Latitude-3570.60470: tcp 0
05:16:16.932170 IP vmi195435.contaboserver.net.8333 > tom-Latitude-3570.39110: tcp 0
05:16:16.932184 IP bb42-60-217-183.singnet.com.sg.8333 > tom-Latitude-3570.60470: tcp 0
05:16:16.932188 IP vmi195435.contaboserver.net.8333 > tom-Latitude-3570.39110: tcp 0
05:16:17.010273 IP vmi195435.contaboserver.net.8333 > tom-Latitude-3570.39110: tcp 24
05:16:17.011392 IP vmi195435.contaboserver.net.8333 > tom-Latitude-3570.39110: tcp 576
05:16:17.011410 IP vmi195435.contaboserver.net.8333 > tom-Latitude-3570.39110: tcp 24
05:16:17.011414 IP vmi195435.contaboserver.net.8333 > tom-Latitude-3570.39110: tcp 520
05:16:17.011417 IP vmi195435.contaboserver.net.8333 > tom-Latitude-3570.39110: tcp 24
05:16:17.011420 IP vmi195435.contaboserver.net.8333 > tom-Latitude-3570.39110: tcp 226
05:16:17.011452 IP tom-Latitude-3570.39110 > vmi195435.contaboserver.net.8333: tcp 0
05:16:17.265214 IP 81.198.101.144.8333 > tom-Latitude-3570.60988: tcp 24
05:16:17.265240 IP tom-Latitude-3570.60988 > 81.198.101.144.8333: tcp 0
05:16:17.265256 IP 81.198.101.144.8333 > tom-Latitude-3570.60988: tcp 73
05:16:17.265260 IP tom-Latitude-3570.60988 > 81.198.101.144.8333: tcp 0
05:16:17.466221 IP tom-Latitude-3570.46284 > static-87-75-105-186.vodafonexdsl.co.uk.8333: tcp 24
05:16:17.468370 IP tom-Latitude-3570.46284 > static-87-75-105-186.vodafonexdsl.co.uk.8333: tcp 181
