11:23:48.548715 IP c-73-101-52-184.hsd1.pa.comcast.net.8333 > tom-Latitude-3570.59818: tcp 24
11:23:48.548733 IP tom-Latitude-3570.59818 > c-73-101-52-184.hsd1.pa.comcast.net.8333: tcp 0
11:23:48.549201 IP c-73-101-52-184.hsd1.pa.comcast.net.8333 > tom-Latitude-3570.59818: tcp 226
11:23:48.549218 IP tom-Latitude-3570.59818 > c-73-101-52-184.hsd1.pa.comcast.net.8333: tcp 0
11:23:48.549234 IP c-73-101-52-184.hsd1.pa.comcast.net.8333 > tom-Latitude-3570.59818: tcp 24
11:23:48.549237 IP tom-Latitude-3570.59818 > c-73-101-52-184.hsd1.pa.comcast.net.8333: tcp 0
11:23:48.549241 IP c-73-101-52-184.hsd1.pa.comcast.net.8333 > tom-Latitude-3570.59818: tcp 249
11:23:48.549244 IP tom-Latitude-3570.59818 > c-73-101-52-184.hsd1.pa.comcast.net.8333: tcp 0
11:23:48.549247 IP c-73-101-52-184.hsd1.pa.comcast.net.8333 > tom-Latitude-3570.59818: tcp 24
11:23:48.549249 IP tom-Latitude-3570.59818 > c-73-101-52-184.hsd1.pa.comcast.net.8333: tcp 0
11:23:48.549252 IP c-73-101-52-184.hsd1.pa.comcast.net.8333 > tom-Latitude-3570.59818: tcp 224
11:23:48.549255 IP tom-Latitude-3570.59818 > c-73-101-52-184.hsd1.pa.comcast.net.8333: tcp 0
11:23:48.549258 IP c-73-101-52-184.hsd1.pa.comcast.net.8333 > tom-Latitude-3570.59818: tcp 24
11:23:48.549260 IP tom-Latitude-3570.59818 > c-73-101-52-184.hsd1.pa.comcast.net.8333: tcp 0
11:23:48.549778 IP tom-Latitude-3570.33922 > pool-108-20-207-31.bstnma.fios.verizon.net.8333: tcp 24
11:23:48.552469 IP c-73-101-52-184.hsd1.pa.comcast.net.8333 > tom-Latitude-3570.59818: tcp 963
11:23:48.552483 IP tom-Latitude-3570.59818 > c-73-101-52-184.hsd1.pa.comcast.net.8333: tcp 0
11:23:48.553922 IP tom-Latitude-3570.33922 > pool-108-20-207-31.bstnma.fios.verizon.net.8333: tcp 433
11:23:48.587523 IP pool-108-20-207-31.bstnma.fios.verizon.net.8333 > tom-Latitude-3570.33922: tcp 0
11:23:48.597409 IP pool-108-20-207-31.bstnma.fios.verizon.net.8333 > tom-Latitude-3570.33922: tcp 0
11:23:48.790962 IP ec2-52-56-97-80.eu-west-2.compute.amazonaws.com.8333 > tom-Latitude-3570.36650: tcp 24
11:23:48.790983 IP ec2-52-56-97-80.eu-west-2.compute.amazonaws.com.8333 > tom-Latitude-3570.36650: tcp 433
11:23:48.791027 IP tom-Latitude-3570.36650 > ec2-52-56-97-80.eu-west-2.compute.amazonaws.com.8333: tcp 0
11:23:48.891430 IP tom-Latitude-3570.47742 > 97-82-78-25.dhcp.leds.al.charter.com.8333: tcp 24
11:23:48.891992 IP tom-Latitude-3570.47742 > 97-82-78-25.dhcp.leds.al.charter.com.8333: tcp 289
11:23:48.892343 IP 23.226.90.172.8333 > tom-Latitude-3570.56344: tcp 24
11:23:48.892351 IP tom-Latitude-3570.56344 > 23.226.90.172.8333: tcp 0
11:23:48.892356 IP 23.226.90.172.8333 > tom-Latitude-3570.56344: tcp 31
11:23:48.892362 IP tom-Latitude-3570.56344 > 23.226.90.172.8333: tcp 0
11:23:48.926566 IP 97-82-78-25.dhcp.leds.al.charter.com.8333 > tom-Latitude-3570.47742: tcp 0
11:23:48.926581 IP 97-82-78-25.dhcp.leds.al.charter.com.8333 > tom-Latitude-3570.47742: tcp 0
11:23:49.046310 IP pool-108-20-207-31.bstnma.fios.verizon.net.8333 > tom-Latitude-3570.33922: tcp 24
11:23:49.046335 IP tom-Latitude-3570.33922 > pool-108-20-207-31.bstnma.fios.verizon.net.8333: tcp 0
11:23:49.046352 IP pool-108-20-207-31.bstnma.fios.verizon.net.8333 > tom-Latitude-3570.33922: tcp 109
11:23:49.046357 IP tom-Latitude-3570.33922 > pool-108-20-207-31.bstnma.fios.verizon.net.8333: tcp 0
11:23:49.046535 IP tom-Latitude-3570.34082 > host93-234-110-95.serverdedicati.aruba.it.8333: tcp 24
11:23:49.046880 IP tom-Latitude-3570.34082 > host93-234-110-95.serverdedicati.aruba.it.8333: tcp 145
11:23:49.076693 IP host93-234-110-95.serverdedicati.aruba.it.8333 > tom-Latitude-3570.34082: tcp 0
11:23:49.076707 IP host93-234-110-95.serverdedicati.aruba.it.8333 > tom-Latitude-3570.34082: tcp 0
11:23:49.114580 IP host93-234-110-95.serverdedicati.aruba.it.8333 > tom-Latitude-3570.34082: tcp 24
11:23:49.114601 IP host93-234-110-95.serverdedicati.aruba.it.8333 > tom-Latitude-3570.34082: tcp 145
11:23:49.114647 IP tom-Latitude-3570.34082 > host93-234-110-95.serverdedicati.aruba.it.8333: tcp 0
11:23:49.153817 IP 172.214.77.34.bc.googleusercontent.com.8333 > tom-Latitude-3570.56244: tcp 24
11:23:49.153840 IP 172.214.77.34.bc.googleusercontent.com.8333 > tom-Latitude-3570.56244: tcp 145
11:23:49.153887 IP tom-Latitude-3570.56244 > 172.214.77.34.bc.googleusercontent.com.8333: tcp 0
11:23:49.655875 IP tom-Latitude-3570.36650 > ec2-52-56-97-80.eu-west-2.compute.amazonaws.com.8333: tcp 24
11:23:49.656251 IP tom-Latitude-3570.36650 > ec2-52-56-97-80.eu-west-2.compute.amazonaws.com.8333: tcp 109
11:23:49.699950 IP ec2-52-56-97-80.eu-west-2.compute.amazonaws.com.8333 > tom-Latitude-3570.36650: tcp 0
11:23:49.707876 IP ec2-52-56-97-80.eu-west-2.compute.amazonaws.com.8333 > tom-Latitude-3570.36650: tcp 0
11:23:49.856617 IP tom-Latitude-3570.47742 > 97-82-78-25.dhcp.leds.al.charter.com.8333: tcp 24
11:23:49.859164 IP tom-Latitude-3570.47742 > 97-82-78-25.dhcp.leds.al.charter.com.8333: tcp 121
11:23:49.888949 IP 97-82-78-25.dhcp.leds.al.charter.com.8333 > tom-Latitude-3570.47742: tcp 0
11:23:49.905223 IP 97-82-78-25.dhcp.leds.al.charter.com.8333 > tom-Latitude-3570.47742: tcp 0
11:23:50.358244 IP ec2-52-56-97-80.eu-west-2.compute.amazonaws.com.8333 > tom-Latitude-3570.36650: tcp 24
11:23:50.358274 IP ec2-52-56-97-80.eu-west-2.compute.amazonaws.com.8333 > tom-Latitude-3570.36650: tcp 37
11:23:50.358317 IP tom-Latitude-3570.36650 > ec2-52-56-97-80.eu-west-2.compute.amazonaws.com.8333: tcp 0
11:23:50.358524 IP tom-Latitude-3570.36650 > ec2-52-56-97-80.eu-west-2.compute.amazonaws.com.8333: tcp 24
11:23:50.358982 IP tom-Latitude-3570.36650 > ec2-52-56-97-80.eu-west-2.compute.amazonaws.com.8333: tcp 37
11:23:50.396421 IP ec2-52-56-97-80.eu-west-2.compute.amazonaws.com.8333 > tom-Latitude-3570.36650: tcp 0
11:23:50.396437 IP ec2-52-56-97-80.eu-west-2.compute.amazonaws.com.8333 > tom-Latitude-3570.36650: tcp 0
11:23:50.461887 IP ec2-52-56-97-80.eu-west-2.compute.amazonaws.com.8333 > tom-Latitude-3570.36650: tcp 24
11:23:50.462068 IP ec2-52-56-97-80.eu-west-2.compute.amazonaws.com.8333 > tom-Latitude-3570.36650: tcp 1076
11:23:50.462101 IP tom-Latitude-3570.36650 > ec2-52-56-97-80.eu-west-2.compute.amazonaws.com.8333: tcp 0
11:23:50.516907 IP 23.226.90.172.8333 > tom-Latitude-3570.56344: tcp 24
11:23:50.516925 IP tom-Latitude-3570.56344 > 23.226.90.172.8333: tcp 0
11:23:50.516946 IP 23.226.90.172.8333 > tom-Latitude-3570.56344: tcp 217
11:23:50.516952 IP tom-Latitude-3570.56344 > 23.226.90.172.8333: tcp 0
11:23:50.517180 IP tom-Latitude-3570.56344 > 23.226.90.172.8333: tcp 24
11:23:50.517234 IP tom-Latitude-3570.56244 > 172.214.77.34.bc.googleusercontent.com.8333: tcp 24
11:23:50.517491 IP tom-Latitude-3570.56344 > 23.226.90.172.8333: tcp 37
11:23:50.517912 IP tom-Latitude-3570.56244 > 172.214.77.34.bc.googleusercontent.com.8333: tcp 37
11:23:50.557075 IP 23.226.90.172.8333 > tom-Latitude-3570.56344: tcp 0
11:23:50.557092 IP 172.214.77.34.bc.googleusercontent.com.8333 > tom-Latitude-3570.56244: tcp 0
11:23:50.557094 IP 23.226.90.172.8333 > tom-Latitude-3570.56344: tcp 0
11:23:50.557097 IP 172.214.77.34.bc.googleusercontent.com.8333 > tom-Latitude-3570.56244: tcp 0
11:23:50.727028 IP c-73-101-52-184.hsd1.pa.comcast.net.8333 > tom-Latitude-3570.59818: tcp 24
11:23:50.727055 IP tom-Latitude-3570.59818 > c-73-101-52-184.hsd1.pa.comcast.net.8333: tcp 0
11:23:50.727071 IP c-73-101-52-184.hsd1.pa.comcast.net.8333 > tom-Latitude-3570.59818: tcp 37
11:23:50.727074 IP tom-Latitude-3570.59818 > c-73-101-52-184.hsd1.pa.comcast.net.8333: tcp 0
11:23:50.727078 IP 23.226.90.172.8333 > tom-Latitude-3570.56344: tcp 24
11:23:50.727083 IP 23.226.90.172.8333 > tom-Latitude-3570.56344: tcp 224
11:23:50.727139 IP tom-Latitude-3570.56344 > 23.226.90.172.8333: tcp 0
11:23:50.750118 IP ec2-52-56-97-80.eu-west-2.compute.amazonaws.com.8333 > tom-Latitude-3570.36650: tcp 24
11:23:50.750168 IP ec2-52-56-97-80.eu-west-2.compute.amazonaws.com.8333 > tom-Latitude-3570.36650: tcp 37
11:23:50.750213 IP tom-Latitude-3570.36650 > ec2-52-56-97-80.eu-west-2.compute.amazonaws.com.8333: tcp 0
11:23:51.093250 IP 172.214.77.34.bc.googleusercontent.com.8333 > tom-Latitude-3570.56244: tcp 24
11:23:51.093269 IP 172.214.77.34.bc.googleusercontent.com.8333 > tom-Latitude-3570.56244: tcp 37
11:23:51.093317 IP tom-Latitude-3570.56244 > 172.214.77.34.bc.googleusercontent.com.8333: tcp 0
11:23:51.595215 IP tom-Latitude-3570.47742 > 97-82-78-25.dhcp.leds.al.charter.com.8333: tcp 24
11:23:51.595799 IP tom-Latitude-3570.47742 > 97-82-78-25.dhcp.leds.al.charter.com.8333: tcp 73
11:23:51.657530 IP 97-82-78-25.dhcp.leds.al.charter.com.8333 > tom-Latitude-3570.47742: tcp 0
11:23:51.669453 IP 97-82-78-25.dhcp.leds.al.charter.com.8333 > tom-Latitude-3570.47742: tcp 0
11:23:51.677206 IP ec2-52-56-97-80.eu-west-2.compute.amazonaws.com.8333 > tom-Latitude-3570.36650: tcp 24
11:23:51.677225 IP ec2-52-56-97-80.eu-west-2.compute.amazonaws.com.8333 > tom-Latitude-3570.36650: tcp 217
11:23:51.677321 IP tom-Latitude-3570.36650 > ec2-52-56-97-80.eu-west-2.compute.amazonaws.com.8333: tcp 0
11:23:51.677638 IP tom-Latitude-3570.36650 > ec2-52-56-97-80.eu-west-2.compute.amazonaws.com.8333: tcp 24
11:23:51.678036 IP tom-Latitude-3570.36650 > ec2-52-56-97-80.eu-west-2.compute.amazonaws.com.8333: tcp 217
11:23:51.724935 IP ec2-52-56-97-80.eu-west-2.compute.amazonaws.com.8333 > tom-Latitude-3570.36650: tcp 0
11:23:51.736602 IP ec2-52-56-97-80.eu-west-2.compute.amazonaws.com.8333 > tom-Latitude-3570.36650: tcp 0
11:23:51.778052 IP tom-Latitude-3570.33922 > pool-108-20-207-31.bstnma.fios.verizon.net.8333: tcp 24
11:23:51.779428 IP tom-Latitude-3570.33922 > pool-108-20-207-31.bstnma.fios.verizon.net.8333: tcp 73
11:23:51.791566 IP ec2-52-56-97-80.eu-west-2.compute.amazonaws.com.8333 > tom-Latitude-3570.36650: tcp 24
11:23:51.791587 IP ec2-52-56-97-80.eu-west-2.compute.amazonaws.com.8333 > tom-Latitude-3570.36650: tcp 190
11:23:51.791687 IP tom-Latitude-3570.36650 > ec2-52-56-97-80.eu-west-2.compute.amazonaws.com.8333: tcp 0
11:23:51.799758 IP ec2-52-56-97-80.eu-west-2.compute.amazonaws.com.8333 > tom-Latitude-3570.36650: tcp 1448
11:23:51.799775 IP ec2-52-56-97-80.eu-west-2.compute.amazonaws.com.8333 > tom-Latitude-3570.36650: tcp 351
11:23:51.799777 IP ec2-52-56-97-80.eu-west-2.compute.amazonaws.com.8333 > tom-Latitude-3570.36650: tcp 248
11:23:51.799869 IP tom-Latitude-3570.36650 > ec2-52-56-97-80.eu-west-2.compute.amazonaws.com.8333: tcp 0
11:23:51.810857 IP pool-108-20-207-31.bstnma.fios.verizon.net.8333 > tom-Latitude-3570.33922: tcp 0
11:23:51.824198 IP pool-108-20-207-31.bstnma.fios.verizon.net.8333 > tom-Latitude-3570.33922: tcp 0
11:23:52.203249 IP tom-Latitude-3570.56244 > 172.214.77.34.bc.googleusercontent.com.8333: tcp 24
11:23:52.203742 IP tom-Latitude-3570.56244 > 172.214.77.34.bc.googleusercontent.com.8333: tcp 217
11:23:52.246800 IP 97-82-78-25.dhcp.leds.al.charter.com.8333 > tom-Latitude-3570.47742: tcp 24
11:23:52.246822 IP 97-82-78-25.dhcp.leds.al.charter.com.8333 > tom-Latitude-3570.47742: tcp 325
11:23:52.246826 IP 172.214.77.34.bc.googleusercontent.com.8333 > tom-Latitude-3570.56244: tcp 0
11:23:52.246913 IP tom-Latitude-3570.47742 > 97-82-78-25.dhcp.leds.al.charter.com.8333: tcp 0
11:23:52.247171 IP tom-Latitude-3570.47742 > 97-82-78-25.dhcp.leds.al.charter.com.8333: tcp 24
11:23:52.247268 IP tom-Latitude-3570.33922 > pool-108-20-207-31.bstnma.fios.verizon.net.8333: tcp 24
11:23:52.247514 IP tom-Latitude-3570.47742 > 97-82-78-25.dhcp.leds.al.charter.com.8333: tcp 109
11:23:52.248559 IP tom-Latitude-3570.33922 > pool-108-20-207-31.bstnma.fios.verizon.net.8333: tcp 217
11:23:52.252115 IP 172.214.77.34.bc.googleusercontent.com.8333 > tom-Latitude-3570.56244: tcp 0
11:23:52.294154 IP 97-82-78-25.dhcp.leds.al.charter.com.8333 > tom-Latitude-3570.47742: tcp 0
11:23:52.297237 IP 97-82-78-25.dhcp.leds.al.charter.com.8333 > tom-Latitude-3570.47742: tcp 0
11:23:52.297254 IP pool-108-20-207-31.bstnma.fios.verizon.net.8333 > tom-Latitude-3570.33922: tcp 0
11:23:52.301141 IP pool-108-20-207-31.bstnma.fios.verizon.net.8333 > tom-Latitude-3570.33922: tcp 0
11:23:52.477218 IP 97-82-78-25.dhcp.leds.al.charter.com.8333 > tom-Latitude-3570.47742: tcp 24
11:23:52.477236 IP 97-82-78-25.dhcp.leds.al.charter.com.8333 > tom-Latitude-3570.47742: tcp 664
11:23:52.477241 IP 97-82-78-25.dhcp.leds.al.charter.com.8333 > tom-Latitude-3570.47742: tcp 24
11:23:52.477333 IP tom-Latitude-3570.47742 > 97-82-78-25.dhcp.leds.al.charter.com.8333: tcp 0
11:23:52.499410 IP 97-82-78-25.dhcp.leds.al.charter.com.8333 > tom-Latitude-3570.47742: tcp 226
11:23:52.499422 IP 97-82-78-25.dhcp.leds.al.charter.com.8333 > tom-Latitude-3570.47742: tcp 24
11:23:52.499424 IP 97-82-78-25.dhcp.leds.al.charter.com.8333 > tom-Latitude-3570.47742: tcp 247
11:23:52.499486 IP tom-Latitude-3570.47742 > 97-82-78-25.dhcp.leds.al.charter.com.8333: tcp 0
11:23:52.499588 IP tom-Latitude-3570.56344 > 23.226.90.172.8333: tcp 24
11:23:52.505977 IP tom-Latitude-3570.56344 > 23.226.90.172.8333: tcp 253
11:23:52.555358 IP 23.226.90.172.8333 > tom-Latitude-3570.56344: tcp 0
11:23:52.555374 IP 23.226.90.172.8333 > tom-Latitude-3570.56344: tcp 0
11:23:52.901191 IP tom-Latitude-3570.56244 > 172.214.77.34.bc.googleusercontent.com.8333: tcp 24
11:23:52.901352 IP tom-Latitude-3570.56118 > ns3051461.ip-51-255-95.eu.8333: tcp 24
11:23:52.901391 IP tom-Latitude-3570.33922 > pool-108-20-207-31.bstnma.fios.verizon.net.8333: tcp 24
11:23:52.902841 IP tom-Latitude-3570.33922 > pool-108-20-207-31.bstnma.fios.verizon.net.8333: tcp 109
11:23:52.902853 IP tom-Latitude-3570.56118 > ns3051461.ip-51-255-95.eu.8333: tcp 937
11:23:52.902856 IP tom-Latitude-3570.56244 > 172.214.77.34.bc.googleusercontent.com.8333: tcp 109
11:23:52.959059 IP 172.214.77.34.bc.googleusercontent.com.8333 > tom-Latitude-3570.56244: tcp 0
11:23:52.965587 IP ns3051461.ip-51-255-95.eu.8333 > tom-Latitude-3570.56118: tcp 0
11:23:52.965603 IP pool-108-20-207-31.bstnma.fios.verizon.net.8333 > tom-Latitude-3570.33922: tcp 0
11:23:52.968613 IP pool-108-20-207-31.bstnma.fios.verizon.net.8333 > tom-Latitude-3570.33922: tcp 0
11:23:52.985292 IP ns3051461.ip-51-255-95.eu.8333 > tom-Latitude-3570.56118: tcp 0
11:23:52.985305 IP 172.214.77.34.bc.googleusercontent.com.8333 > tom-Latitude-3570.56244: tcp 0
11:23:53.811339 IP host93-234-110-95.serverdedicati.aruba.it.8333 > tom-Latitude-3570.34082: tcp 24
11:23:53.811361 IP host93-234-110-95.serverdedicati.aruba.it.8333 > tom-Latitude-3570.34082: tcp 469
11:23:53.811364 IP host93-234-110-95.serverdedicati.aruba.it.8333 > tom-Latitude-3570.34082: tcp 469
11:23:53.811392 IP tom-Latitude-3570.34082 > host93-234-110-95.serverdedicati.aruba.it.8333: tcp 0
11:23:53.811684 IP tom-Latitude-3570.34082 > host93-234-110-95.serverdedicati.aruba.it.8333: tcp 24
11:23:53.812413 IP tom-Latitude-3570.34082 > host93-234-110-95.serverdedicati.aruba.it.8333: tcp 73
11:23:53.870460 IP host93-234-110-95.serverdedicati.aruba.it.8333 > tom-Latitude-3570.34082: tcp 0
11:23:53.953707 IP host93-234-110-95.serverdedicati.aruba.it.8333 > tom-Latitude-3570.34082: tcp 24
11:23:53.953731 IP host93-234-110-95.serverdedicati.aruba.it.8333 > tom-Latitude-3570.34082: tcp 373
11:23:53.953734 IP host93-234-110-95.serverdedicati.aruba.it.8333 > tom-Latitude-3570.34082: tcp 24
11:23:53.953736 IP host93-234-110-95.serverdedicati.aruba.it.8333 > tom-Latitude-3570.34082: tcp 374
11:23:53.953785 IP tom-Latitude-3570.34082 > host93-234-110-95.serverdedicati.aruba.it.8333: tcp 0
11:23:54.255331 IP tom-Latitude-3570.56118 > ns3051461.ip-51-255-95.eu.8333: tcp 24
11:23:54.256988 IP tom-Latitude-3570.56118 > ns3051461.ip-51-255-95.eu.8333: tcp 73
11:23:54.325960 IP ns3051461.ip-51-255-95.eu.8333 > tom-Latitude-3570.56118: tcp 0
11:23:54.342141 IP ns3051461.ip-51-255-95.eu.8333 > tom-Latitude-3570.56118: tcp 0
11:23:54.556409 IP tom-Latitude-3570.56344 > 23.226.90.172.8333: tcp 24
11:23:54.556459 IP tom-Latitude-3570.56244 > 172.214.77.34.bc.googleusercontent.com.8333: tcp 24
11:23:54.557066 IP tom-Latitude-3570.56244 > 172.214.77.34.bc.googleusercontent.com.8333: tcp 73
11:23:54.557076 IP tom-Latitude-3570.56344 > 23.226.90.172.8333: tcp 145
11:23:54.599604 IP 23.226.90.172.8333 > tom-Latitude-3570.56344: tcp 0
11:23:54.599620 IP 172.214.77.34.bc.googleusercontent.com.8333 > tom-Latitude-3570.56244: tcp 0
11:23:54.599623 IP 172.214.77.34.bc.googleusercontent.com.8333 > tom-Latitude-3570.56244: tcp 0
11:23:54.600170 IP 23.226.90.172.8333 > tom-Latitude-3570.56344: tcp 0
11:23:54.656792 IP tom-Latitude-3570.59818 > c-73-101-52-184.hsd1.pa.comcast.net.8333: tcp 24
11:23:54.657112 IP tom-Latitude-3570.59818 > c-73-101-52-184.hsd1.pa.comcast.net.8333: tcp 577
11:23:54.688444 IP c-73-101-52-184.hsd1.pa.comcast.net.8333 > tom-Latitude-3570.59818: tcp 0
11:23:54.697206 IP c-73-101-52-184.hsd1.pa.comcast.net.8333 > tom-Latitude-3570.59818: tcp 0
11:23:54.757198 IP tom-Latitude-3570.47742 > 97-82-78-25.dhcp.leds.al.charter.com.8333: tcp 24
11:23:54.759466 IP tom-Latitude-3570.47742 > 97-82-78-25.dhcp.leds.al.charter.com.8333: tcp 73
11:23:54.791158 IP 97-82-78-25.dhcp.leds.al.charter.com.8333 > tom-Latitude-3570.47742: tcp 0
11:23:54.804647 IP 97-82-78-25.dhcp.leds.al.charter.com.8333 > tom-Latitude-3570.47742: tcp 0
11:23:55.419167 IP 172.214.77.34.bc.googleusercontent.com.8333 > tom-Latitude-3570.56244: tcp 24
11:23:55.419185 IP 172.214.77.34.bc.googleusercontent.com.8333 > tom-Latitude-3570.56244: tcp 73
11:23:55.419187 IP 172.214.77.34.bc.googleusercontent.com.8333 > tom-Latitude-3570.56244: tcp 73
11:23:55.419214 IP tom-Latitude-3570.56244 > 172.214.77.34.bc.googleusercontent.com.8333: tcp 0
11:23:55.419472 IP tom-Latitude-3570.56244 > 172.214.77.34.bc.googleusercontent.com.8333: tcp 24
11:23:55.419980 IP tom-Latitude-3570.56244 > 172.214.77.34.bc.googleusercontent.com.8333: tcp 73
11:23:55.462041 IP 172.214.77.34.bc.googleusercontent.com.8333 > tom-Latitude-3570.56244: tcp 0
11:23:55.470503 IP 172.214.77.34.bc.googleusercontent.com.8333 > tom-Latitude-3570.56244: tcp 0
11:23:55.524658 IP 172.214.77.34.bc.googleusercontent.com.8333 > tom-Latitude-3570.56244: tcp 24
11:23:55.525408 IP 172.214.77.34.bc.googleusercontent.com.8333 > tom-Latitude-3570.56244: tcp 256
11:23:55.525425 IP 172.214.77.34.bc.googleusercontent.com.8333 > tom-Latitude-3570.56244: tcp 24
11:23:55.525428 IP 172.214.77.34.bc.googleusercontent.com.8333 > tom-Latitude-3570.56244: tcp 372
11:23:55.525521 IP tom-Latitude-3570.56244 > 172.214.77.34.bc.googleusercontent.com.8333: tcp 0
11:23:55.927525 IP tom-Latitude-3570.56344 > 23.226.90.172.8333: tcp 24
11:23:55.927572 IP tom-Latitude-3570.47742 > 97-82-78-25.dhcp.leds.al.charter.com.8333: tcp 24
11:23:55.928500 IP tom-Latitude-3570.47742 > 97-82-78-25.dhcp.leds.al.charter.com.8333: tcp 73
11:23:55.928511 IP tom-Latitude-3570.56344 > 23.226.90.172.8333: tcp 73
11:23:56.004564 IP 97-82-78-25.dhcp.leds.al.charter.com.8333 > tom-Latitude-3570.47742: tcp 24
11:23:56.004585 IP 97-82-78-25.dhcp.leds.al.charter.com.8333 > tom-Latitude-3570.47742: tcp 109
11:23:56.004589 IP 97-82-78-25.dhcp.leds.al.charter.com.8333 > tom-Latitude-3570.47742: tcp 0
11:23:56.004675 IP tom-Latitude-3570.47742 > 97-82-78-25.dhcp.leds.al.charter.com.8333: tcp 0
11:23:56.004880 IP tom-Latitude-3570.47742 > 97-82-78-25.dhcp.leds.al.charter.com.8333: tcp 24
11:23:56.004895 IP tom-Latitude-3570.47742 > 97-82-78-25.dhcp.leds.al.charter.com.8333: tcp 37
11:23:56.019271 IP 23.226.90.172.8333 > tom-Latitude-3570.56344: tcp 0
11:23:56.023148 IP 23.226.90.172.8333 > tom-Latitude-3570.56344: tcp 0
11:23:56.023164 IP 97-82-78-25.dhcp.leds.al.charter.com.8333 > tom-Latitude-3570.47742: tcp 0
11:23:56.032252 IP 97-82-78-25.dhcp.leds.al.charter.com.8333 > tom-Latitude-3570.47742: tcp 0
11:23:56.032268 IP 97-82-78-25.dhcp.leds.al.charter.com.8333 > tom-Latitude-3570.47742: tcp 0
11:23:56.211115 IP 97-82-78-25.dhcp.leds.al.charter.com.8333 > tom-Latitude-3570.47742: tcp 24
11:23:56.211427 IP 97-82-78-25.dhcp.leds.al.charter.com.8333 > tom-Latitude-3570.47742: tcp 668
11:23:56.211537 IP tom-Latitude-3570.47742 > 97-82-78-25.dhcp.leds.al.charter.com.8333: tcp 0
11:23:56.371102 IP host93-234-110-95.serverdedicati.aruba.it.8333 > tom-Latitude-3570.34082: tcp 24
11:23:56.371122 IP host93-234-110-95.serverdedicati.aruba.it.8333 > tom-Latitude-3570.34082: tcp 181
11:23:56.371215 IP tom-Latitude-3570.34082 > host93-234-110-95.serverdedicati.aruba.it.8333: tcp 0
11:23:56.371374 IP tom-Latitude-3570.34082 > host93-234-110-95.serverdedicati.aruba.it.8333: tcp 24
11:23:56.371607 IP tom-Latitude-3570.34082 > host93-234-110-95.serverdedicati.aruba.it.8333: tcp 73
11:23:56.414734 IP host93-234-110-95.serverdedicati.aruba.it.8333 > tom-Latitude-3570.34082: tcp 0
11:23:56.456945 IP 172.214.77.34.bc.googleusercontent.com.8333 > tom-Latitude-3570.56244: tcp 24
11:23:56.457111 IP 172.214.77.34.bc.googleusercontent.com.8333 > tom-Latitude-3570.56244: tcp 73
11:23:56.457199 IP tom-Latitude-3570.56244 > 172.214.77.34.bc.googleusercontent.com.8333: tcp 0
11:23:56.505349 IP host93-234-110-95.serverdedicati.aruba.it.8333 > tom-Latitude-3570.34082: tcp 24
11:23:56.505368 IP host93-234-110-95.serverdedicati.aruba.it.8333 > tom-Latitude-3570.34082: tcp 247
11:23:56.505372 IP host93-234-110-95.serverdedicati.aruba.it.8333 > tom-Latitude-3570.34082: tcp 24
11:23:56.505374 IP host93-234-110-95.serverdedicati.aruba.it.8333 > tom-Latitude-3570.34082: tcp 226
11:23:56.505464 IP tom-Latitude-3570.34082 > host93-234-110-95.serverdedicati.aruba.it.8333: tcp 0
11:23:56.505585 IP tom-Latitude-3570.56118 > ns3051461.ip-51-255-95.eu.8333: tcp 24
11:23:56.505969 IP tom-Latitude-3570.56118 > ns3051461.ip-51-255-95.eu.8333: tcp 109
11:23:56.544226 IP ns3051461.ip-51-255-95.eu.8333 > tom-Latitude-3570.56118: tcp 0
11:23:56.544242 IP ns3051461.ip-51-255-95.eu.8333 > tom-Latitude-3570.56118: tcp 0
11:23:57.026824 IP 97-82-78-25.dhcp.leds.al.charter.com.8333 > tom-Latitude-3570.47742: tcp 24
11:23:57.026842 IP 97-82-78-25.dhcp.leds.al.charter.com.8333 > tom-Latitude-3570.47742: tcp 73
11:23:57.026953 IP tom-Latitude-3570.47742 > 97-82-78-25.dhcp.leds.al.charter.com.8333: tcp 0
11:23:57.027072 IP tom-Latitude-3570.47742 > 97-82-78-25.dhcp.leds.al.charter.com.8333: tcp 24
11:23:57.027136 IP tom-Latitude-3570.56118 > ns3051461.ip-51-255-95.eu.8333: tcp 24
11:23:57.027579 IP tom-Latitude-3570.56118 > ns3051461.ip-51-255-95.eu.8333: tcp 73
11:23:57.027585 IP tom-Latitude-3570.47742 > 97-82-78-25.dhcp.leds.al.charter.com.8333: tcp 37
11:23:57.054950 IP 97-82-78-25.dhcp.leds.al.charter.com.8333 > tom-Latitude-3570.47742: tcp 0
11:23:57.058627 IP ns3051461.ip-51-255-95.eu.8333 > tom-Latitude-3570.56118: tcp 0
11:23:57.062687 IP 97-82-78-25.dhcp.leds.al.charter.com.8333 > tom-Latitude-3570.47742: tcp 0
11:23:57.062702 IP ns3051461.ip-51-255-95.eu.8333 > tom-Latitude-3570.56118: tcp 0
11:23:57.239458 IP 97-82-78-25.dhcp.leds.al.charter.com.8333 > tom-Latitude-3570.47742: tcp 24
11:23:57.241681 IP 97-82-78-25.dhcp.leds.al.charter.com.8333 > tom-Latitude-3570.47742: tcp 370
11:23:57.241818 IP tom-Latitude-3570.47742 > 97-82-78-25.dhcp.leds.al.charter.com.8333: tcp 0
11:23:57.342554 IP tom-Latitude-3570.59818 > c-73-101-52-184.hsd1.pa.comcast.net.8333: tcp 24
11:23:57.343064 IP tom-Latitude-3570.59818 > c-73-101-52-184.hsd1.pa.comcast.net.8333: tcp 217
11:23:57.380533 IP c-73-101-52-184.hsd1.pa.comcast.net.8333 > tom-Latitude-3570.59818: tcp 0
11:23:57.386265 IP c-73-101-52-184.hsd1.pa.comcast.net.8333 > tom-Latitude-3570.59818: tcp 0
11:23:57.548133 IP c-73-101-52-184.hsd1.pa.comcast.net.8333 > tom-Latitude-3570.59818: tcp 24
11:23:57.548151 IP tom-Latitude-3570.59818 > c-73-101-52-184.hsd1.pa.comcast.net.8333: tcp 0
11:23:57.548166 IP c-73-101-52-184.hsd1.pa.comcast.net.8333 > tom-Latitude-3570.59818: tcp 37
11:23:57.548169 IP tom-Latitude-3570.59818 > c-73-101-52-184.hsd1.pa.comcast.net.8333: tcp 0
11:23:57.548352 IP tom-Latitude-3570.59818 > c-73-101-52-184.hsd1.pa.comcast.net.8333: tcp 24
11:23:57.548933 IP tom-Latitude-3570.59818 > c-73-101-52-184.hsd1.pa.comcast.net.8333: tcp 247
11:23:57.596912 IP c-73-101-52-184.hsd1.pa.comcast.net.8333 > tom-Latitude-3570.59818: tcp 0
11:23:57.596927 IP c-73-101-52-184.hsd1.pa.comcast.net.8333 > tom-Latitude-3570.59818: tcp 0
11:23:58.000261 IP tom-Latitude-3570.36554 > 101.112.0.162.8333: tcp 0
11:23:58.080306 IP 101.112.0.162.8333 > tom-Latitude-3570.36554: tcp 0
11:23:58.250747 IP tom-Latitude-3570.34082 > host93-234-110-95.serverdedicati.aruba.it.8333: tcp 24
11:23:58.270873 IP tom-Latitude-3570.34082 > host93-234-110-95.serverdedicati.aruba.it.8333: tcp 37
11:23:58.332313 IP host93-234-110-95.serverdedicati.aruba.it.8333 > tom-Latitude-3570.34082: tcp 0
11:23:58.473617 IP ec2-52-56-97-80.eu-west-2.compute.amazonaws.com.8333 > tom-Latitude-3570.36650: tcp 24
11:23:58.473637 IP ec2-52-56-97-80.eu-west-2.compute.amazonaws.com.8333 > tom-Latitude-3570.36650: tcp 577
11:23:58.473728 IP tom-Latitude-3570.36650 > ec2-52-56-97-80.eu-west-2.compute.amazonaws.com.8333: tcp 0
11:23:58.473968 IP tom-Latitude-3570.36650 > ec2-52-56-97-80.eu-west-2.compute.amazonaws.com.8333: tcp 24
11:23:58.484513 IP tom-Latitude-3570.36650 > ec2-52-56-97-80.eu-west-2.compute.amazonaws.com.8333: tcp 181
11:23:58.527484 IP ec2-52-56-97-80.eu-west-2.compute.amazonaws.com.8333 > tom-Latitude-3570.36650: tcp 0
11:23:58.527492 IP ec2-52-56-97-80.eu-west-2.compute.amazonaws.com.8333 > tom-Latitude-3570.36650: tcp 0
11:23:58.595029 IP ec2-52-56-97-80.eu-west-2.compute.amazonaws.com.8333 > tom-Latitude-3570.36650: tcp 24
11:23:58.595047 IP ec2-52-56-97-80.eu-west-2.compute.amazonaws.com.8333 > tom-Latitude-3570.36650: tcp 226
11:23:58.595082 IP ec2-52-56-97-80.eu-west-2.compute.amazonaws.com.8333 > tom-Latitude-3570.36650: tcp 1437
11:23:58.595084 IP ec2-52-56-97-80.eu-west-2.compute.amazonaws.com.8333 > tom-Latitude-3570.36650: tcp 224
11:23:58.595144 IP tom-Latitude-3570.36650 > ec2-52-56-97-80.eu-west-2.compute.amazonaws.com.8333: tcp 0
11:23:58.799120 IP ns3051461.ip-51-255-95.eu.8333 > tom-Latitude-3570.56118: tcp 24
11:23:58.799140 IP ns3051461.ip-51-255-95.eu.8333 > tom-Latitude-3570.56118: tcp 217
11:23:58.799231 IP tom-Latitude-3570.56118 > ns3051461.ip-51-255-95.eu.8333: tcp 0
11:23:59.000098 IP tom-Latitude-3570.34082 > host93-234-110-95.serverdedicati.aruba.it.8333: tcp 24
11:23:59.003298 IP tom-Latitude-3570.34082 > host93-234-110-95.serverdedicati.aruba.it.8333: tcp 181
11:23:59.053961 IP host93-234-110-95.serverdedicati.aruba.it.8333 > tom-Latitude-3570.34082: tcp 0
11:23:59.235865 IP host93-234-110-95.serverdedicati.aruba.it.8333 > tom-Latitude-3570.34082: tcp 24
11:23:59.235887 IP host93-234-110-95.serverdedicati.aruba.it.8333 > tom-Latitude-3570.34082: tcp 109
11:23:59.235978 IP tom-Latitude-3570.34082 > host93-234-110-95.serverdedicati.aruba.it.8333: tcp 0
11:23:59.236129 IP tom-Latitude-3570.34082 > host93-234-110-95.serverdedicati.aruba.it.8333: tcp 24
11:23:59.237996 IP tom-Latitude-3570.34082 > host93-234-110-95.serverdedicati.aruba.it.8333: tcp 109
11:23:59.266974 IP host93-234-110-95.serverdedicati.aruba.it.8333 > tom-Latitude-3570.34082: tcp 0
11:23:59.336583 IP tom-Latitude-3570.33922 > pool-108-20-207-31.bstnma.fios.verizon.net.8333: tcp 24
11:23:59.339911 IP tom-Latitude-3570.33922 > pool-108-20-207-31.bstnma.fios.verizon.net.8333: tcp 469
11:23:59.360375 IP host93-234-110-95.serverdedicati.aruba.it.8333 > tom-Latitude-3570.34082: tcp 24
11:23:59.360395 IP host93-234-110-95.serverdedicati.aruba.it.8333 > tom-Latitude-3570.34082: tcp 224
11:23:59.360399 IP host93-234-110-95.serverdedicati.aruba.it.8333 > tom-Latitude-3570.34082: tcp 24
11:23:59.360401 IP host93-234-110-95.serverdedicati.aruba.it.8333 > tom-Latitude-3570.34082: tcp 224
11:23:59.360402 IP host93-234-110-95.serverdedicati.aruba.it.8333 > tom-Latitude-3570.34082: tcp 24
11:23:59.360422 IP host93-234-110-95.serverdedicati.aruba.it.8333 > tom-Latitude-3570.34082: tcp 405
11:23:59.360495 IP tom-Latitude-3570.34082 > host93-234-110-95.serverdedicati.aruba.it.8333: tcp 0
11:23:59.367730 IP pool-108-20-207-31.bstnma.fios.verizon.net.8333 > tom-Latitude-3570.33922: tcp 0
11:23:59.376784 IP pool-108-20-207-31.bstnma.fios.verizon.net.8333 > tom-Latitude-3570.33922: tcp 0
11:23:59.891685 IP c-73-101-52-184.hsd1.pa.comcast.net.8333 > tom-Latitude-3570.59818: tcp 24
11:23:59.891705 IP c-73-101-52-184.hsd1.pa.comcast.net.8333 > tom-Latitude-3570.59818: tcp 217
11:23:59.891799 IP tom-Latitude-3570.59818 > c-73-101-52-184.hsd1.pa.comcast.net.8333: tcp 0
11:24:00.077679 IP 23.226.90.172.8333 > tom-Latitude-3570.56344: tcp 24
11:24:00.083445 IP 23.226.90.172.8333 > tom-Latitude-3570.56344: tcp 433
11:24:00.083572 IP tom-Latitude-3570.56344 > 23.226.90.172.8333: tcp 0
11:24:00.537848 IP 101.112.0.162.8333 > tom-Latitude-3570.36554: tcp 0
11:24:01.499862 IP 172.214.77.34.bc.googleusercontent.com.8333 > tom-Latitude-3570.56244: tcp 24
11:24:01.499881 IP 172.214.77.34.bc.googleusercontent.com.8333 > tom-Latitude-3570.56244: tcp 433
11:24:01.499885 IP 172.214.77.34.bc.googleusercontent.com.8333 > tom-Latitude-3570.56244: tcp 433
11:24:01.499912 IP tom-Latitude-3570.56244 > 172.214.77.34.bc.googleusercontent.com.8333: tcp 0
11:24:01.500252 IP tom-Latitude-3570.56244 > 172.214.77.34.bc.googleusercontent.com.8333: tcp 24
11:24:01.500345 IP tom-Latitude-3570.36650 > ec2-52-56-97-80.eu-west-2.compute.amazonaws.com.8333: tcp 24
11:24:01.504549 IP tom-Latitude-3570.56244 > 172.214.77.34.bc.googleusercontent.com.8333: tcp 73
11:24:01.508994 IP tom-Latitude-3570.36650 > ec2-52-56-97-80.eu-west-2.compute.amazonaws.com.8333: tcp 109
11:24:01.534730 IP 172.214.77.34.bc.googleusercontent.com.8333 > tom-Latitude-3570.56244: tcp 0
11:24:01.539860 IP ec2-52-56-97-80.eu-west-2.compute.amazonaws.com.8333 > tom-Latitude-3570.36650: tcp 0
11:24:01.550319 IP 172.214.77.34.bc.googleusercontent.com.8333 > tom-Latitude-3570.56244: tcp 0
11:24:01.562348 IP ec2-52-56-97-80.eu-west-2.compute.amazonaws.com.8333 > tom-Latitude-3570.36650: tcp 0
11:24:01.612446 IP 172.214.77.34.bc.googleusercontent.com.8333 > tom-Latitude-3570.56244: tcp 24
11:24:01.612464 IP 172.214.77.34.bc.googleusercontent.com.8333 > tom-Latitude-3570.56244: tcp 541
11:24:01.612468 IP 172.214.77.34.bc.googleusercontent.com.8333 > tom-Latitude-3570.56244: tcp 24
11:24:01.612470 IP 172.214.77.34.bc.googleusercontent.com.8333 > tom-Latitude-3570.56244: tcp 437
11:24:01.612557 IP tom-Latitude-3570.56244 > 172.214.77.34.bc.googleusercontent.com.8333: tcp 0
11:24:02.516785 IP tom-Latitude-3570.36650 > ec2-52-56-97-80.eu-west-2.compute.amazonaws.com.8333: tcp 24
11:24:02.516850 IP tom-Latitude-3570.33922 > pool-108-20-207-31.bstnma.fios.verizon.net.8333: tcp 24
11:24:02.517304 IP tom-Latitude-3570.33922 > pool-108-20-207-31.bstnma.fios.verizon.net.8333: tcp 181
11:24:02.517334 IP tom-Latitude-3570.36650 > ec2-52-56-97-80.eu-west-2.compute.amazonaws.com.8333: tcp 73
11:24:02.578150 IP pool-108-20-207-31.bstnma.fios.verizon.net.8333 > tom-Latitude-3570.33922: tcp 0
11:24:02.580152 IP ec2-52-56-97-80.eu-west-2.compute.amazonaws.com.8333 > tom-Latitude-3570.36650: tcp 0
11:24:02.580167 IP pool-108-20-207-31.bstnma.fios.verizon.net.8333 > tom-Latitude-3570.33922: tcp 0
11:24:02.588084 IP ec2-52-56-97-80.eu-west-2.compute.amazonaws.com.8333 > tom-Latitude-3570.36650: tcp 0
11:24:02.817901 IP tom-Latitude-3570.47742 > 97-82-78-25.dhcp.leds.al.charter.com.8333: tcp 24
11:24:02.817947 IP tom-Latitude-3570.56244 > 172.214.77.34.bc.googleusercontent.com.8333: tcp 24
11:24:02.818001 IP tom-Latitude-3570.56118 > ns3051461.ip-51-255-95.eu.8333: tcp 24
11:24:02.819076 IP tom-Latitude-3570.56118 > ns3051461.ip-51-255-95.eu.8333: tcp 181
11:24:02.819089 IP tom-Latitude-3570.56244 > 172.214.77.34.bc.googleusercontent.com.8333: tcp 31
11:24:02.819093 IP tom-Latitude-3570.47742 > 97-82-78-25.dhcp.leds.al.charter.com.8333: tcp 397
11:24:02.849086 IP 97-82-78-25.dhcp.leds.al.charter.com.8333 > tom-Latitude-3570.47742: tcp 0
11:24:02.859839 IP 97-82-78-25.dhcp.leds.al.charter.com.8333 > tom-Latitude-3570.47742: tcp 0
11:24:02.859853 IP 172.214.77.34.bc.googleusercontent.com.8333 > tom-Latitude-3570.56244: tcp 0
11:24:02.859857 IP 172.214.77.34.bc.googleusercontent.com.8333 > tom-Latitude-3570.56244: tcp 0
11:24:02.859861 IP ns3051461.ip-51-255-95.eu.8333 > tom-Latitude-3570.56118: tcp 0
11:24:02.865233 IP ns3051461.ip-51-255-95.eu.8333 > tom-Latitude-3570.56118: tcp 0
11:24:03.319000 IP tom-Latitude-3570.56344 > 23.226.90.172.8333: tcp 24
11:24:03.319360 IP tom-Latitude-3570.56344 > 23.226.90.172.8333: tcp 73
11:24:03.367335 IP pool-108-20-207-31.bstnma.fios.verizon.net.8333 > tom-Latitude-3570.33922: tcp 24
11:24:03.367347 IP tom-Latitude-3570.33922 > pool-108-20-207-31.bstnma.fios.verizon.net.8333: tcp 0
11:24:03.367355 IP pool-108-20-207-31.bstnma.fios.verizon.net.8333 > tom-Latitude-3570.33922: tcp 181
11:24:03.367359 IP tom-Latitude-3570.33922 > pool-108-20-207-31.bstnma.fios.verizon.net.8333: tcp 0
11:24:03.367525 IP tom-Latitude-3570.33922 > pool-108-20-207-31.bstnma.fios.verizon.net.8333: tcp 24
11:24:03.371172 IP tom-Latitude-3570.33922 > pool-108-20-207-31.bstnma.fios.verizon.net.8333: tcp 181
11:24:03.376208 IP 23.226.90.172.8333 > tom-Latitude-3570.56344: tcp 0
11:24:03.376672 IP 23.226.90.172.8333 > tom-Latitude-3570.56344: tcp 0
11:24:03.408430 IP pool-108-20-207-31.bstnma.fios.verizon.net.8333 > tom-Latitude-3570.33922: tcp 0
11:24:03.476725 IP pool-108-20-207-31.bstnma.fios.verizon.net.8333 > tom-Latitude-3570.33922: tcp 0
11:24:03.601344 IP pool-108-20-207-31.bstnma.fios.verizon.net.8333 > tom-Latitude-3570.33922: tcp 24
11:24:03.601813 IP pool-108-20-207-31.bstnma.fios.verizon.net.8333 > tom-Latitude-3570.33922: tcp 418
11:24:03.601819 IP pool-108-20-207-31.bstnma.fios.verizon.net.8333 > tom-Latitude-3570.33922: tcp 24
11:24:03.601822 IP pool-108-20-207-31.bstnma.fios.verizon.net.8333 > tom-Latitude-3570.33922: tcp 224
11:24:03.601824 IP pool-108-20-207-31.bstnma.fios.verizon.net.8333 > tom-Latitude-3570.33922: tcp 24
11:24:03.601826 IP pool-108-20-207-31.bstnma.fios.verizon.net.8333 > tom-Latitude-3570.33922: tcp 404
11:24:03.601829 IP pool-108-20-207-31.bstnma.fios.verizon.net.8333 > tom-Latitude-3570.33922: tcp 24
11:24:03.601832 IP pool-108-20-207-31.bstnma.fios.verizon.net.8333 > tom-Latitude-3570.33922: tcp 372
11:24:03.601833 IP pool-108-20-207-31.bstnma.fios.verizon.net.8333 > tom-Latitude-3570.33922: tcp 24
11:24:03.601834 IP pool-108-20-207-31.bstnma.fios.verizon.net.8333 > tom-Latitude-3570.33922: tcp 224
11:24:03.601841 IP tom-Latitude-3570.33922 > pool-108-20-207-31.bstnma.fios.verizon.net.8333: tcp 0
11:24:03.601877 IP tom-Latitude-3570.33922 > pool-108-20-207-31.bstnma.fios.verizon.net.8333: tcp 0
11:24:03.603381 IP tom-Latitude-3570.33922 > pool-108-20-207-31.bstnma.fios.verizon.net.8333: tcp 24
11:24:03.604683 IP tom-Latitude-3570.33922 > pool-108-20-207-31.bstnma.fios.verizon.net.8333: tcp 73
11:24:03.666936 IP pool-108-20-207-31.bstnma.fios.verizon.net.8333 > tom-Latitude-3570.33922: tcp 0
11:24:03.666943 IP pool-108-20-207-31.bstnma.fios.verizon.net.8333 > tom-Latitude-3570.33922: tcp 0
11:24:03.703890 IP tom-Latitude-3570.36650 > ec2-52-56-97-80.eu-west-2.compute.amazonaws.com.8333: tcp 24
11:24:03.703940 IP tom-Latitude-3570.34082 > host93-234-110-95.serverdedicati.aruba.it.8333: tcp 24
11:24:03.720197 IP tom-Latitude-3570.34082 > host93-234-110-95.serverdedicati.aruba.it.8333: tcp 217
11:24:03.720203 IP tom-Latitude-3570.36650 > ec2-52-56-97-80.eu-west-2.compute.amazonaws.com.8333: tcp 145
11:24:03.747904 IP ec2-52-56-97-80.eu-west-2.compute.amazonaws.com.8333 > tom-Latitude-3570.36650: tcp 0
11:24:03.768124 IP host93-234-110-95.serverdedicati.aruba.it.8333 > tom-Latitude-3570.34082: tcp 0
11:24:03.768130 IP ec2-52-56-97-80.eu-west-2.compute.amazonaws.com.8333 > tom-Latitude-3570.36650: tcp 0
11:24:03.784807 IP 23.226.90.172.8333 > tom-Latitude-3570.56344: tcp 24
11:24:03.784818 IP 23.226.90.172.8333 > tom-Latitude-3570.56344: tcp 217
11:24:03.784838 IP tom-Latitude-3570.56344 > 23.226.90.172.8333: tcp 0
11:24:03.784996 IP tom-Latitude-3570.56344 > 23.226.90.172.8333: tcp 24
11:24:03.785063 IP tom-Latitude-3570.47742 > 97-82-78-25.dhcp.leds.al.charter.com.8333: tcp 24
11:24:03.785282 IP tom-Latitude-3570.47742 > 97-82-78-25.dhcp.leds.al.charter.com.8333: tcp 145
11:24:03.785288 IP tom-Latitude-3570.56344 > 23.226.90.172.8333: tcp 37
11:24:03.787791 IP pool-108-20-207-31.bstnma.fios.verizon.net.8333 > tom-Latitude-3570.33922: tcp 24
11:24:03.795891 IP pool-108-20-207-31.bstnma.fios.verizon.net.8333 > tom-Latitude-3570.33922: tcp 420
11:24:03.795897 IP pool-108-20-207-31.bstnma.fios.verizon.net.8333 > tom-Latitude-3570.33922: tcp 24
11:24:03.795900 IP pool-108-20-207-31.bstnma.fios.verizon.net.8333 > tom-Latitude-3570.33922: tcp 37
11:24:03.795913 IP tom-Latitude-3570.33922 > pool-108-20-207-31.bstnma.fios.verizon.net.8333: tcp 0
11:24:03.816983 IP 97-82-78-25.dhcp.leds.al.charter.com.8333 > tom-Latitude-3570.47742: tcp 0
11:24:03.817033 IP 23.226.90.172.8333 > tom-Latitude-3570.56344: tcp 0
11:24:03.817042 IP 97-82-78-25.dhcp.leds.al.charter.com.8333 > tom-Latitude-3570.47742: tcp 0
11:24:03.817047 IP 23.226.90.172.8333 > tom-Latitude-3570.56344: tcp 0
11:24:03.996675 IP 23.226.90.172.8333 > tom-Latitude-3570.56344: tcp 24
11:24:03.996708 IP 23.226.90.172.8333 > tom-Latitude-3570.56344: tcp 373
11:24:03.996823 IP tom-Latitude-3570.56344 > 23.226.90.172.8333: tcp 0
11:24:04.135739 IP pool-108-20-207-31.bstnma.fios.verizon.net.8333 > tom-Latitude-3570.33922: tcp 24
11:24:04.135753 IP pool-108-20-207-31.bstnma.fios.verizon.net.8333 > tom-Latitude-3570.33922: tcp 37
11:24:04.135775 IP tom-Latitude-3570.33922 > pool-108-20-207-31.bstnma.fios.verizon.net.8333: tcp 0
11:24:04.135900 IP tom-Latitude-3570.56118 > ns3051461.ip-51-255-95.eu.8333: tcp 24
11:24:04.136150 IP tom-Latitude-3570.56118 > ns3051461.ip-51-255-95.eu.8333: tcp 253
11:24:04.174920 IP ns3051461.ip-51-255-95.eu.8333 > tom-Latitude-3570.56118: tcp 0
11:24:04.174933 IP ns3051461.ip-51-255-95.eu.8333 > tom-Latitude-3570.56118: tcp 0
11:24:04.836946 IP tom-Latitude-3570.34082 > host93-234-110-95.serverdedicati.aruba.it.8333: tcp 24
11:24:04.839518 IP tom-Latitude-3570.34082 > host93-234-110-95.serverdedicati.aruba.it.8333: tcp 109
11:24:04.898250 IP ns3051461.ip-51-255-95.eu.8333 > tom-Latitude-3570.56118: tcp 24
11:24:04.898263 IP ns3051461.ip-51-255-95.eu.8333 > tom-Latitude-3570.56118: tcp 31
11:24:04.898266 IP ns3051461.ip-51-255-95.eu.8333 > tom-Latitude-3570.56118: tcp 31
11:24:04.898276 IP tom-Latitude-3570.56118 > ns3051461.ip-51-255-95.eu.8333: tcp 0
11:24:04.898323 IP ns3051461.ip-51-255-95.eu.8333 > tom-Latitude-3570.56118: tcp 24
11:24:04.898326 IP tom-Latitude-3570.56118 > ns3051461.ip-51-255-95.eu.8333: tcp 0
11:24:04.898329 IP ns3051461.ip-51-255-95.eu.8333 > tom-Latitude-3570.56118: tcp 73
11:24:04.898331 IP tom-Latitude-3570.56118 > ns3051461.ip-51-255-95.eu.8333: tcp 0
11:24:04.898428 IP tom-Latitude-3570.47742 > 97-82-78-25.dhcp.leds.al.charter.com.8333: tcp 24
11:24:04.898546 IP tom-Latitude-3570.56118 > ns3051461.ip-51-255-95.eu.8333: tcp 24
11:24:04.902926 IP tom-Latitude-3570.56118 > ns3051461.ip-51-255-95.eu.8333: tcp 73
11:24:04.902931 IP tom-Latitude-3570.47742 > 97-82-78-25.dhcp.leds.al.charter.com.8333: tcp 109
11:24:04.906543 IP host93-234-110-95.serverdedicati.aruba.it.8333 > tom-Latitude-3570.34082: tcp 0
11:24:04.916758 IP 172.214.77.34.bc.googleusercontent.com.8333 > tom-Latitude-3570.56244: tcp 24
11:24:04.916769 IP 172.214.77.34.bc.googleusercontent.com.8333 > tom-Latitude-3570.56244: tcp 289
11:24:04.916790 IP tom-Latitude-3570.56244 > 172.214.77.34.bc.googleusercontent.com.8333: tcp 0
11:24:04.916905 IP tom-Latitude-3570.56244 > 172.214.77.34.bc.googleusercontent.com.8333: tcp 24
11:24:04.922853 IP tom-Latitude-3570.56244 > 172.214.77.34.bc.googleusercontent.com.8333: tcp 37
11:24:04.940189 IP 97-82-78-25.dhcp.leds.al.charter.com.8333 > tom-Latitude-3570.47742: tcp 0
11:24:04.940198 IP ns3051461.ip-51-255-95.eu.8333 > tom-Latitude-3570.56118: tcp 0
