05:01:21.973146 IP vmi195435.contaboserver.net.8333 > tom-Latitude-3570.39110: tcp 24
05:01:21.973174 IP vmi195435.contaboserver.net.8333 > tom-Latitude-3570.39110: tcp 8
05:01:21.973270 IP tom-Latitude-3570.39110 > vmi195435.contaboserver.net.8333: tcp 0
05:01:22.174117 IP tom-Latitude-3570.46284 > static-87-75-105-186.vodafonexdsl.co.uk.8333: tcp 24
05:01:22.178180 IP tom-Latitude-3570.46284 > static-87-75-105-186.vodafonexdsl.co.uk.8333: tcp 37
05:01:22.205643 IP static-87-75-105-186.vodafonexdsl.co.uk.8333 > tom-Latitude-3570.46284: tcp 0
05:01:22.213510 IP static-87-75-105-186.vodafonexdsl.co.uk.8333 > tom-Latitude-3570.46284: tcp 0
05:01:22.391247 IP 167.99.216.145.8333 > tom-Latitude-3570.57976: tcp 24
05:01:22.391268 IP 167.99.216.145.8333 > tom-Latitude-3570.57976: tcp 541
05:01:22.391362 IP tom-Latitude-3570.57976 > 167.99.216.145.8333: tcp 0
05:01:22.391649 IP tom-Latitude-3570.57976 > 167.99.216.145.8333: tcp 24
05:01:22.392872 IP tom-Latitude-3570.57976 > 167.99.216.145.8333: tcp 253
05:01:22.433914 IP 167.99.216.145.8333 > tom-Latitude-3570.57976: tcp 0
05:01:22.433929 IP 167.99.216.145.8333 > tom-Latitude-3570.57976: tcp 0
05:01:22.495863 IP 167.99.216.145.8333 > tom-Latitude-3570.57976: tcp 24
05:01:22.496663 IP 167.99.216.145.8333 > tom-Latitude-3570.57976: tcp 256
05:01:22.496683 IP 167.99.216.145.8333 > tom-Latitude-3570.57976: tcp 24
05:01:22.496686 IP 167.99.216.145.8333 > tom-Latitude-3570.57976: tcp 257
05:01:22.496689 IP 167.99.216.145.8333 > tom-Latitude-3570.57976: tcp 24
05:01:22.496709 IP 167.99.216.145.8333 > tom-Latitude-3570.57976: tcp 405
05:01:22.496711 IP 167.99.216.145.8333 > tom-Latitude-3570.57976: tcp 24
05:01:22.496784 IP tom-Latitude-3570.57976 > 167.99.216.145.8333: tcp 0
05:01:22.499095 IP 167.99.216.145.8333 > tom-Latitude-3570.57976: tcp 371
05:01:22.499110 IP 167.99.216.145.8333 > tom-Latitude-3570.57976: tcp 24
05:01:22.499112 IP 167.99.216.145.8333 > tom-Latitude-3570.57976: tcp 224
05:01:22.499193 IP tom-Latitude-3570.57976 > 167.99.216.145.8333: tcp 0
05:01:22.557690 IP 167.99.216.145.8333 > tom-Latitude-3570.57976: tcp 832
05:01:22.599906 IP tom-Latitude-3570.57976 > 167.99.216.145.8333: tcp 0
05:01:22.801745 IP vmi195435.contaboserver.net.8333 > tom-Latitude-3570.39110: tcp 24
05:01:22.801766 IP vmi195435.contaboserver.net.8333 > tom-Latitude-3570.39110: tcp 469
05:01:22.801856 IP tom-Latitude-3570.39110 > vmi195435.contaboserver.net.8333: tcp 0
05:01:22.802119 IP tom-Latitude-3570.39110 > vmi195435.contaboserver.net.8333: tcp 24
05:01:22.803308 IP tom-Latitude-3570.39110 > vmi195435.contaboserver.net.8333: tcp 217
05:01:22.830417 IP vmi195435.contaboserver.net.8333 > tom-Latitude-3570.39110: tcp 469
05:01:22.830437 IP tom-Latitude-3570.39110 > vmi195435.contaboserver.net.8333: tcp 0
05:01:22.842480 IP vmi195435.contaboserver.net.8333 > tom-Latitude-3570.39110: tcp 0
05:01:22.846417 IP vmi195435.contaboserver.net.8333 > tom-Latitude-3570.39110: tcp 0
05:01:22.923615 IP vmi195435.contaboserver.net.8333 > tom-Latitude-3570.39110: tcp 24
05:01:22.923632 IP tom-Latitude-3570.39110 > vmi195435.contaboserver.net.8333: tcp 0
05:01:22.924004 IP vmi195435.contaboserver.net.8333 > tom-Latitude-3570.39110: tcp 1448
05:01:22.924027 IP tom-Latitude-3570.39110 > vmi195435.contaboserver.net.8333: tcp 0
05:01:22.924061 IP vmi195435.contaboserver.net.8333 > tom-Latitude-3570.39110: tcp 1418
05:01:22.924064 IP tom-Latitude-3570.39110 > vmi195435.contaboserver.net.8333: tcp 0
05:01:22.924068 IP vmi195435.contaboserver.net.8333 > tom-Latitude-3570.39110: tcp 24
05:01:22.924069 IP tom-Latitude-3570.39110 > vmi195435.contaboserver.net.8333: tcp 0
05:01:22.925509 IP vmi195435.contaboserver.net.8333 > tom-Latitude-3570.39110: tcp 246
05:01:22.925519 IP tom-Latitude-3570.39110 > vmi195435.contaboserver.net.8333: tcp 0
05:01:22.925535 IP vmi195435.contaboserver.net.8333 > tom-Latitude-3570.39110: tcp 24
05:01:22.925538 IP tom-Latitude-3570.39110 > vmi195435.contaboserver.net.8333: tcp 0
05:01:22.925559 IP vmi195435.contaboserver.net.8333 > tom-Latitude-3570.39110: tcp 249
05:01:22.925562 IP tom-Latitude-3570.39110 > vmi195435.contaboserver.net.8333: tcp 0
05:01:22.925566 IP vmi195435.contaboserver.net.8333 > tom-Latitude-3570.39110: tcp 24
05:01:22.925568 IP tom-Latitude-3570.39110 > vmi195435.contaboserver.net.8333: tcp 0
05:01:22.925572 IP vmi195435.contaboserver.net.8333 > tom-Latitude-3570.39110: tcp 224
05:01:22.925576 IP tom-Latitude-3570.39110 > vmi195435.contaboserver.net.8333: tcp 0
05:01:22.925579 IP vmi195435.contaboserver.net.8333 > tom-Latitude-3570.39110: tcp 24
05:01:22.925585 IP tom-Latitude-3570.39110 > vmi195435.contaboserver.net.8333: tcp 0
05:01:22.999966 IP vmi195435.contaboserver.net.8333 > tom-Latitude-3570.39110: tcp 1382
05:01:22.999984 IP tom-Latitude-3570.39110 > vmi195435.contaboserver.net.8333: tcp 0
05:01:23.001183 IP vmi195435.contaboserver.net.8333 > tom-Latitude-3570.39110: tcp 66
05:01:23.001201 IP tom-Latitude-3570.39110 > vmi195435.contaboserver.net.8333: tcp 0
05:01:23.001221 IP vmi195435.contaboserver.net.8333 > tom-Latitude-3570.39110: tcp 1448
05:01:23.001223 IP tom-Latitude-3570.39110 > vmi195435.contaboserver.net.8333: tcp 0
05:01:23.001246 IP vmi195435.contaboserver.net.8333 > tom-Latitude-3570.39110: tcp 1448
05:01:23.001248 IP tom-Latitude-3570.39110 > vmi195435.contaboserver.net.8333: tcp 0
05:01:23.004425 IP vmi195435.contaboserver.net.8333 > tom-Latitude-3570.39110: tcp 1448
05:01:23.004442 IP tom-Latitude-3570.39110 > vmi195435.contaboserver.net.8333: tcp 0
05:01:23.004458 IP vmi195435.contaboserver.net.8333 > tom-Latitude-3570.39110: tcp 75
05:01:23.004546 IP tom-Latitude-3570.39110 > vmi195435.contaboserver.net.8333: tcp 0
05:01:23.006612 IP vmi195435.contaboserver.net.8333 > tom-Latitude-3570.39110: tcp 24
05:01:23.006688 IP tom-Latitude-3570.39110 > vmi195435.contaboserver.net.8333: tcp 0
05:01:23.007857 IP vmi195435.contaboserver.net.8333 > tom-Latitude-3570.39110: tcp 8
05:01:23.007903 IP tom-Latitude-3570.39110 > vmi195435.contaboserver.net.8333: tcp 0
05:01:23.009479 IP tom-Latitude-3570.39110 > vmi195435.contaboserver.net.8333: tcp 24
05:01:23.014541 IP tom-Latitude-3570.39110 > vmi195435.contaboserver.net.8333: tcp 8
05:01:23.046807 IP vmi195435.contaboserver.net.8333 > tom-Latitude-3570.39110: tcp 0
05:01:23.046822 IP vmi195435.contaboserver.net.8333 > tom-Latitude-3570.39110: tcp 0
05:01:23.711697 IP tom-Latitude-3570.60470 > bb42-60-217-183.singnet.com.sg.8333: tcp 24
05:01:23.714298 IP tom-Latitude-3570.60470 > bb42-60-217-183.singnet.com.sg.8333: tcp 37
05:01:23.764839 IP c-185-45-236-223.customer.ggaweb.ch.8333 > tom-Latitude-3570.49070: tcp 24
05:01:23.764857 IP c-185-45-236-223.customer.ggaweb.ch.8333 > tom-Latitude-3570.49070: tcp 8
05:01:23.764967 IP tom-Latitude-3570.49070 > c-185-45-236-223.customer.ggaweb.ch.8333: tcp 0
05:01:23.765093 IP tom-Latitude-3570.49070 > c-185-45-236-223.customer.ggaweb.ch.8333: tcp 24
05:01:23.766761 IP tom-Latitude-3570.49070 > c-185-45-236-223.customer.ggaweb.ch.8333: tcp 8
05:01:23.774411 IP bb42-60-217-183.singnet.com.sg.8333 > tom-Latitude-3570.60470: tcp 0
05:01:23.796536 IP c-185-45-236-223.customer.ggaweb.ch.8333 > tom-Latitude-3570.49070: tcp 0
05:01:24.066228 IP tom-Latitude-3570.60470 > bb42-60-217-183.singnet.com.sg.8333: tcp 24
05:01:24.068267 IP tom-Latitude-3570.60470 > bb42-60-217-183.singnet.com.sg.8333: tcp 577
05:01:24.123820 IP bb42-60-217-183.singnet.com.sg.8333 > tom-Latitude-3570.60470: tcp 0
05:01:24.226200 IP bb42-60-217-183.singnet.com.sg.8333 > tom-Latitude-3570.60470: tcp 24
05:01:24.226224 IP tom-Latitude-3570.60470 > bb42-60-217-183.singnet.com.sg.8333: tcp 0
05:01:24.226257 IP bb42-60-217-183.singnet.com.sg.8333 > tom-Latitude-3570.60470: tcp 256
05:01:24.226263 IP tom-Latitude-3570.60470 > bb42-60-217-183.singnet.com.sg.8333: tcp 0
05:01:24.226266 IP bb42-60-217-183.singnet.com.sg.8333 > tom-Latitude-3570.60470: tcp 24
05:01:24.226268 IP tom-Latitude-3570.60470 > bb42-60-217-183.singnet.com.sg.8333: tcp 0
05:01:24.226272 IP bb42-60-217-183.singnet.com.sg.8333 > tom-Latitude-3570.60470: tcp 469
05:01:24.226274 IP tom-Latitude-3570.60470 > bb42-60-217-183.singnet.com.sg.8333: tcp 0
05:01:24.226648 IP tom-Latitude-3570.60470 > bb42-60-217-183.singnet.com.sg.8333: tcp 24
05:01:24.229898 IP tom-Latitude-3570.60470 > bb42-60-217-183.singnet.com.sg.8333: tcp 54
05:01:24.263254 IP bb42-60-217-183.singnet.com.sg.8333 > tom-Latitude-3570.60470: tcp 0
05:01:24.951571 IP 81.198.101.144.8333 > tom-Latitude-3570.60988: tcp 24
05:01:24.951592 IP 81.198.101.144.8333 > tom-Latitude-3570.60988: tcp 505
05:01:24.951596 IP 81.198.101.144.8333 > tom-Latitude-3570.60988: tcp 505
05:01:24.951624 IP tom-Latitude-3570.60988 > 81.198.101.144.8333: tcp 0
05:01:24.951936 IP tom-Latitude-3570.60988 > 81.198.101.144.8333: tcp 24
05:01:24.953130 IP tom-Latitude-3570.60988 > 81.198.101.144.8333: tcp 37
05:01:24.993929 IP 81.198.101.144.8333 > tom-Latitude-3570.60988: tcp 0
05:01:24.993943 IP 81.198.101.144.8333 > tom-Latitude-3570.60988: tcp 0
05:01:25.091290 IP 81.198.101.144.8333 > tom-Latitude-3570.60988: tcp 24
05:01:25.095550 IP 81.198.101.144.8333 > tom-Latitude-3570.60988: tcp 249
05:01:25.095690 IP tom-Latitude-3570.60988 > 81.198.101.144.8333: tcp 0
05:01:25.697921 IP tom-Latitude-3570.39110 > vmi195435.contaboserver.net.8333: tcp 24
05:01:25.700228 IP tom-Latitude-3570.39110 > vmi195435.contaboserver.net.8333: tcp 37
05:01:25.756408 IP vmi195435.contaboserver.net.8333 > tom-Latitude-3570.39110: tcp 0
05:01:25.764806 IP vmi195435.contaboserver.net.8333 > tom-Latitude-3570.39110: tcp 0
05:01:26.099361 IP tom-Latitude-3570.49070 > c-185-45-236-223.customer.ggaweb.ch.8333: tcp 24
05:01:26.101318 IP tom-Latitude-3570.49070 > c-185-45-236-223.customer.ggaweb.ch.8333: tcp 541
05:01:26.166013 IP c-185-45-236-223.customer.ggaweb.ch.8333 > tom-Latitude-3570.49070: tcp 0
05:01:26.400520 IP tom-Latitude-3570.56714 > ns3113832.ip-54-38-177.eu.8333: tcp 24
05:01:26.402580 IP tom-Latitude-3570.56714 > ns3113832.ip-54-38-177.eu.8333: tcp 685
05:01:26.437035 IP ns3113832.ip-54-38-177.eu.8333 > tom-Latitude-3570.56714: tcp 0
05:01:26.449050 IP ns3113832.ip-54-38-177.eu.8333 > tom-Latitude-3570.56714: tcp 0
05:01:26.500905 IP tom-Latitude-3570.49070 > c-185-45-236-223.customer.ggaweb.ch.8333: tcp 24
05:01:26.502067 IP tom-Latitude-3570.49070 > c-185-45-236-223.customer.ggaweb.ch.8333: tcp 8
05:01:26.545028 IP c-185-45-236-223.customer.ggaweb.ch.8333 > tom-Latitude-3570.49070: tcp 0
05:01:26.601393 IP tom-Latitude-3570.46284 > static-87-75-105-186.vodafonexdsl.co.uk.8333: tcp 24
05:01:26.602342 IP tom-Latitude-3570.46284 > static-87-75-105-186.vodafonexdsl.co.uk.8333: tcp 505
05:01:26.629795 IP c-185-45-236-223.customer.ggaweb.ch.8333 > tom-Latitude-3570.49070: tcp 24
05:01:26.629814 IP c-185-45-236-223.customer.ggaweb.ch.8333 > tom-Latitude-3570.49070: tcp 8
05:01:26.629905 IP tom-Latitude-3570.49070 > c-185-45-236-223.customer.ggaweb.ch.8333: tcp 0
05:01:26.635063 IP static-87-75-105-186.vodafonexdsl.co.uk.8333 > tom-Latitude-3570.46284: tcp 0
05:01:26.645128 IP static-87-75-105-186.vodafonexdsl.co.uk.8333 > tom-Latitude-3570.46284: tcp 0
05:01:26.713161 IP ns3113832.ip-54-38-177.eu.8333 > tom-Latitude-3570.56714: tcp 24
05:01:26.713792 IP ns3113832.ip-54-38-177.eu.8333 > tom-Latitude-3570.56714: tcp 505
05:01:26.713921 IP tom-Latitude-3570.56714 > ns3113832.ip-54-38-177.eu.8333: tcp 0
05:01:26.714234 IP tom-Latitude-3570.56714 > ns3113832.ip-54-38-177.eu.8333: tcp 24
05:01:26.715486 IP tom-Latitude-3570.56714 > ns3113832.ip-54-38-177.eu.8333: tcp 505
05:01:26.745069 IP ns3113832.ip-54-38-177.eu.8333 > tom-Latitude-3570.56714: tcp 0
05:01:26.745685 IP ns3113832.ip-54-38-177.eu.8333 > tom-Latitude-3570.56714: tcp 0
05:01:26.804520 IP ns3113832.ip-54-38-177.eu.8333 > tom-Latitude-3570.56714: tcp 24
05:01:26.805342 IP ns3113832.ip-54-38-177.eu.8333 > tom-Latitude-3570.56714: tcp 247
05:01:26.805361 IP ns3113832.ip-54-38-177.eu.8333 > tom-Latitude-3570.56714: tcp 24
05:01:26.805364 IP ns3113832.ip-54-38-177.eu.8333 > tom-Latitude-3570.56714: tcp 255
05:01:26.805366 IP ns3113832.ip-54-38-177.eu.8333 > tom-Latitude-3570.56714: tcp 24
05:01:26.805372 IP ns3113832.ip-54-38-177.eu.8333 > tom-Latitude-3570.56714: tcp 226
05:01:26.805392 IP ns3113832.ip-54-38-177.eu.8333 > tom-Latitude-3570.56714: tcp 24
05:01:26.805394 IP ns3113832.ip-54-38-177.eu.8333 > tom-Latitude-3570.56714: tcp 403
05:01:26.805396 IP ns3113832.ip-54-38-177.eu.8333 > tom-Latitude-3570.56714: tcp 24
05:01:26.805399 IP ns3113832.ip-54-38-177.eu.8333 > tom-Latitude-3570.56714: tcp 225
05:01:26.805466 IP tom-Latitude-3570.56714 > ns3113832.ip-54-38-177.eu.8333: tcp 0
05:01:26.805888 IP tom-Latitude-3570.60470 > bb42-60-217-183.singnet.com.sg.8333: tcp 24
05:01:26.806844 IP tom-Latitude-3570.60470 > bb42-60-217-183.singnet.com.sg.8333: tcp 73
05:01:26.835142 IP bb42-60-217-183.singnet.com.sg.8333 > tom-Latitude-3570.60470: tcp 0
05:01:26.861160 IP ns3113832.ip-54-38-177.eu.8333 > tom-Latitude-3570.56714: tcp 1350
05:01:26.861916 IP ns3113832.ip-54-38-177.eu.8333 > tom-Latitude-3570.56714: tcp 1348
05:01:26.862025 IP tom-Latitude-3570.56714 > ns3113832.ip-54-38-177.eu.8333: tcp 0
05:01:26.966619 IP tom-Latitude-3570.39110 > vmi195435.contaboserver.net.8333: tcp 24
05:01:26.966733 IP tom-Latitude-3570.46284 > static-87-75-105-186.vodafonexdsl.co.uk.8333: tcp 24
05:01:26.968846 IP tom-Latitude-3570.39110 > vmi195435.contaboserver.net.8333: tcp 505
05:01:26.969458 IP tom-Latitude-3570.46284 > static-87-75-105-186.vodafonexdsl.co.uk.8333: tcp 505
05:01:26.997018 IP static-87-75-105-186.vodafonexdsl.co.uk.8333 > tom-Latitude-3570.46284: tcp 0
05:01:27.005005 IP vmi195435.contaboserver.net.8333 > tom-Latitude-3570.39110: tcp 0
05:01:27.008965 IP static-87-75-105-186.vodafonexdsl.co.uk.8333 > tom-Latitude-3570.46284: tcp 0
05:01:27.008979 IP vmi195435.contaboserver.net.8333 > tom-Latitude-3570.39110: tcp 0
05:01:27.070154 IP bb42-60-217-183.singnet.com.sg.8333 > tom-Latitude-3570.60470: tcp 24
05:01:27.070858 IP bb42-60-217-183.singnet.com.sg.8333 > tom-Latitude-3570.60470: tcp 505
05:01:27.070991 IP tom-Latitude-3570.60470 > bb42-60-217-183.singnet.com.sg.8333: tcp 0
05:01:27.114677 IP 2.56.9.15.8333 > tom-Latitude-3570.42516: tcp 24
05:01:27.114686 IP tom-Latitude-3570.42516 > 2.56.9.15.8333: tcp 0
05:01:27.114695 IP 2.56.9.15.8333 > tom-Latitude-3570.42516: tcp 8
05:01:27.114697 IP tom-Latitude-3570.42516 > 2.56.9.15.8333: tcp 0
05:01:27.114816 IP tom-Latitude-3570.42516 > 2.56.9.15.8333: tcp 24
05:01:27.116680 IP tom-Latitude-3570.42516 > 2.56.9.15.8333: tcp 8
05:01:27.144173 IP 2.56.9.15.8333 > tom-Latitude-3570.42516: tcp 0
05:01:27.616496 IP tom-Latitude-3570.42516 > 2.56.9.15.8333: tcp 24
05:01:27.616517 IP tom-Latitude-3570.42516 > 2.56.9.15.8333: tcp 1189
05:01:27.619554 IP 167.99.216.145.8333 > tom-Latitude-3570.57976: tcp 24
05:01:27.619578 IP tom-Latitude-3570.57976 > 167.99.216.145.8333: tcp 0
05:01:27.619608 IP 167.99.216.145.8333 > tom-Latitude-3570.57976: tcp 793
05:01:27.619613 IP tom-Latitude-3570.57976 > 167.99.216.145.8333: tcp 0
05:01:27.619639 IP 167.99.216.145.8333 > tom-Latitude-3570.57976: tcp 793
05:01:27.619643 IP tom-Latitude-3570.57976 > 167.99.216.145.8333: tcp 0
05:01:27.620009 IP tom-Latitude-3570.57976 > 167.99.216.145.8333: tcp 24
05:01:27.626032 IP tom-Latitude-3570.57976 > 167.99.216.145.8333: tcp 37
05:01:27.664386 IP 2.56.9.15.8333 > tom-Latitude-3570.42516: tcp 0
05:01:27.665067 IP 167.99.216.145.8333 > tom-Latitude-3570.57976: tcp 0
05:01:27.665072 IP 167.99.216.145.8333 > tom-Latitude-3570.57976: tcp 0
05:01:27.728557 IP 167.99.216.145.8333 > tom-Latitude-3570.57976: tcp 24
05:01:27.729515 IP 167.99.216.145.8333 > tom-Latitude-3570.57976: tcp 372
05:01:27.729647 IP tom-Latitude-3570.57976 > 167.99.216.145.8333: tcp 0
05:01:27.920748 IP vmi195435.contaboserver.net.8333 > tom-Latitude-3570.39110: tcp 24
05:01:27.920767 IP vmi195435.contaboserver.net.8333 > tom-Latitude-3570.39110: tcp 73
05:01:27.920770 IP vmi195435.contaboserver.net.8333 > tom-Latitude-3570.39110: tcp 73
05:01:27.920797 IP tom-Latitude-3570.39110 > vmi195435.contaboserver.net.8333: tcp 0
05:01:27.921037 IP tom-Latitude-3570.39110 > vmi195435.contaboserver.net.8333: tcp 24
05:01:27.921098 IP tom-Latitude-3570.46284 > static-87-75-105-186.vodafonexdsl.co.uk.8333: tcp 24
05:01:27.923261 IP tom-Latitude-3570.39110 > vmi195435.contaboserver.net.8333: tcp 37
05:01:27.923916 IP tom-Latitude-3570.46284 > static-87-75-105-186.vodafonexdsl.co.uk.8333: tcp 37
05:01:27.964431 IP vmi195435.contaboserver.net.8333 > tom-Latitude-3570.39110: tcp 0
05:01:27.965148 IP static-87-75-105-186.vodafonexdsl.co.uk.8333 > tom-Latitude-3570.46284: tcp 0
05:01:27.965162 IP vmi195435.contaboserver.net.8333 > tom-Latitude-3570.39110: tcp 0
05:01:27.965166 IP static-87-75-105-186.vodafonexdsl.co.uk.8333 > tom-Latitude-3570.46284: tcp 0
05:01:28.044566 IP vmi195435.contaboserver.net.8333 > tom-Latitude-3570.39110: tcp 24
05:01:28.045243 IP vmi195435.contaboserver.net.8333 > tom-Latitude-3570.39110: tcp 225
05:01:28.045372 IP tom-Latitude-3570.39110 > vmi195435.contaboserver.net.8333: tcp 0
05:01:28.432682 IP ns3113832.ip-54-38-177.eu.8333 > tom-Latitude-3570.56714: tcp 24
05:01:28.432701 IP ns3113832.ip-54-38-177.eu.8333 > tom-Latitude-3570.56714: tcp 8
05:01:28.432704 IP 81.198.101.144.8333 > tom-Latitude-3570.60988: tcp 24
05:01:28.432708 IP 81.198.101.144.8333 > tom-Latitude-3570.60988: tcp 577
05:01:28.432795 IP tom-Latitude-3570.60988 > 81.198.101.144.8333: tcp 0
05:01:28.432828 IP tom-Latitude-3570.56714 > ns3113832.ip-54-38-177.eu.8333: tcp 0
05:01:28.433045 IP tom-Latitude-3570.56714 > ns3113832.ip-54-38-177.eu.8333: tcp 24
05:01:28.435901 IP tom-Latitude-3570.56714 > ns3113832.ip-54-38-177.eu.8333: tcp 8
05:01:28.519828 IP ns3113832.ip-54-38-177.eu.8333 > tom-Latitude-3570.56714: tcp 0
05:01:28.519843 IP ns3113832.ip-54-38-177.eu.8333 > tom-Latitude-3570.56714: tcp 0
05:01:28.552839 IP bb42-60-217-183.singnet.com.sg.8333 > tom-Latitude-3570.60470: tcp 24
05:01:28.560706 IP bb42-60-217-183.singnet.com.sg.8333 > tom-Latitude-3570.60470: tcp 109
05:01:28.560839 IP tom-Latitude-3570.60470 > bb42-60-217-183.singnet.com.sg.8333: tcp 0
05:01:28.962331 IP tom-Latitude-3570.42516 > 2.56.9.15.8333: tcp 24
05:01:28.964466 IP tom-Latitude-3570.42516 > 2.56.9.15.8333: tcp 73
05:01:29.003901 IP 2.56.9.15.8333 > tom-Latitude-3570.42516: tcp 0
05:01:29.363723 IP tom-Latitude-3570.56714 > ns3113832.ip-54-38-177.eu.8333: tcp 24
05:01:29.365970 IP tom-Latitude-3570.56714 > ns3113832.ip-54-38-177.eu.8333: tcp 73
05:01:29.415491 IP ns3113832.ip-54-38-177.eu.8333 > tom-Latitude-3570.56714: tcp 0
05:01:29.423271 IP ns3113832.ip-54-38-177.eu.8333 > tom-Latitude-3570.56714: tcp 0
05:01:29.464126 IP tom-Latitude-3570.46284 > static-87-75-105-186.vodafonexdsl.co.uk.8333: tcp 24
05:01:29.466234 IP tom-Latitude-3570.46284 > static-87-75-105-186.vodafonexdsl.co.uk.8333: tcp 37
05:01:29.496915 IP static-87-75-105-186.vodafonexdsl.co.uk.8333 > tom-Latitude-3570.46284: tcp 0
05:01:29.503503 IP static-87-75-105-186.vodafonexdsl.co.uk.8333 > tom-Latitude-3570.46284: tcp 0
05:01:29.765323 IP tom-Latitude-3570.49070 > c-185-45-236-223.customer.ggaweb.ch.8333: tcp 24
05:01:29.765357 IP tom-Latitude-3570.60988 > 81.198.101.144.8333: tcp 24
05:01:29.765383 IP tom-Latitude-3570.42516 > 2.56.9.15.8333: tcp 24
05:01:29.767476 IP tom-Latitude-3570.49070 > c-185-45-236-223.customer.ggaweb.ch.8333: tcp 577
05:01:29.768316 IP tom-Latitude-3570.60988 > 81.198.101.144.8333: tcp 8
05:01:29.768968 IP tom-Latitude-3570.42516 > 2.56.9.15.8333: tcp 8
05:01:29.804116 IP 81.198.101.144.8333 > tom-Latitude-3570.60988: tcp 0
05:01:29.804130 IP c-185-45-236-223.customer.ggaweb.ch.8333 > tom-Latitude-3570.49070: tcp 0
05:01:29.804135 IP 81.198.101.144.8333 > tom-Latitude-3570.60988: tcp 0
05:01:29.804137 IP 2.56.9.15.8333 > tom-Latitude-3570.42516: tcp 0
05:01:29.831321 IP 81.198.101.144.8333 > tom-Latitude-3570.60988: tcp 24
05:01:29.832000 IP 81.198.101.144.8333 > tom-Latitude-3570.60988: tcp 37
05:01:29.832129 IP tom-Latitude-3570.60988 > 81.198.101.144.8333: tcp 0
05:01:29.832306 IP tom-Latitude-3570.60988 > 81.198.101.144.8333: tcp 24
05:01:29.833738 IP tom-Latitude-3570.60988 > 81.198.101.144.8333: tcp 37
05:01:29.873239 IP 81.198.101.144.8333 > tom-Latitude-3570.60988: tcp 0
05:01:29.891919 IP 81.198.101.144.8333 > tom-Latitude-3570.60988: tcp 24
05:01:29.892506 IP 81.198.101.144.8333 > tom-Latitude-3570.60988: tcp 8
05:01:29.892622 IP tom-Latitude-3570.60988 > 81.198.101.144.8333: tcp 0
05:01:29.899194 IP 2.56.9.15.8333 > tom-Latitude-3570.42516: tcp 24
05:01:29.899787 IP 2.56.9.15.8333 > tom-Latitude-3570.42516: tcp 8
05:01:29.899895 IP tom-Latitude-3570.42516 > 2.56.9.15.8333: tcp 0
05:01:29.962342 IP 81.198.101.144.8333 > tom-Latitude-3570.60988: tcp 24
05:01:29.962939 IP 81.198.101.144.8333 > tom-Latitude-3570.60988: tcp 372
05:01:29.963069 IP tom-Latitude-3570.60988 > 81.198.101.144.8333: tcp 0
05:01:30.565640 IP tom-Latitude-3570.56714 > ns3113832.ip-54-38-177.eu.8333: tcp 24
05:01:30.567903 IP tom-Latitude-3570.56714 > ns3113832.ip-54-38-177.eu.8333: tcp 8
05:01:30.615284 IP ns3113832.ip-54-38-177.eu.8333 > tom-Latitude-3570.56714: tcp 0
05:01:30.623110 IP ns3113832.ip-54-38-177.eu.8333 > tom-Latitude-3570.56714: tcp 0
05:01:30.681038 IP ns3113832.ip-54-38-177.eu.8333 > tom-Latitude-3570.56714: tcp 24
05:01:30.683825 IP ns3113832.ip-54-38-177.eu.8333 > tom-Latitude-3570.56714: tcp 8
05:01:30.683955 IP tom-Latitude-3570.56714 > ns3113832.ip-54-38-177.eu.8333: tcp 0
05:01:30.985036 IP tom-Latitude-3570.60470 > bb42-60-217-183.singnet.com.sg.8333: tcp 24
05:01:30.987555 IP tom-Latitude-3570.60470 > bb42-60-217-183.singnet.com.sg.8333: tcp 37
05:01:31.025033 IP bb42-60-217-183.singnet.com.sg.8333 > tom-Latitude-3570.60470: tcp 0
05:01:31.081093 IP ns3113832.ip-54-38-177.eu.8333 > tom-Latitude-3570.56714: tcp 24
05:01:31.081112 IP ns3113832.ip-54-38-177.eu.8333 > tom-Latitude-3570.56714: tcp 73
05:01:31.081159 IP tom-Latitude-3570.56714 > ns3113832.ip-54-38-177.eu.8333: tcp 0
05:01:31.081348 IP tom-Latitude-3570.56714 > ns3113832.ip-54-38-177.eu.8333: tcp 24
05:01:31.088066 IP tom-Latitude-3570.56714 > ns3113832.ip-54-38-177.eu.8333: tcp 37
05:01:31.127304 IP ns3113832.ip-54-38-177.eu.8333 > tom-Latitude-3570.56714: tcp 0
05:01:31.127319 IP ns3113832.ip-54-38-177.eu.8333 > tom-Latitude-3570.56714: tcp 0
05:01:31.181758 IP tom-Latitude-3570.57976 > 167.99.216.145.8333: tcp 24
05:01:31.181808 IP tom-Latitude-3570.42516 > 2.56.9.15.8333: tcp 24
05:01:31.182741 IP tom-Latitude-3570.57976 > 167.99.216.145.8333: tcp 8
05:01:31.183316 IP ns3113832.ip-54-38-177.eu.8333 > tom-Latitude-3570.56714: tcp 24
05:01:31.183337 IP ns3113832.ip-54-38-177.eu.8333 > tom-Latitude-3570.56714: tcp 248
05:01:31.183405 IP tom-Latitude-3570.56714 > ns3113832.ip-54-38-177.eu.8333: tcp 0
05:01:31.183875 IP tom-Latitude-3570.42516 > 2.56.9.15.8333: tcp 37
05:01:31.216294 IP 167.99.216.145.8333 > tom-Latitude-3570.57976: tcp 0
05:01:31.216308 IP 167.99.216.145.8333 > tom-Latitude-3570.57976: tcp 0
05:01:31.216311 IP 2.56.9.15.8333 > tom-Latitude-3570.42516: tcp 0
05:01:31.257550 IP c-185-45-236-223.customer.ggaweb.ch.8333 > tom-Latitude-3570.49070: tcp 24
05:01:31.257572 IP c-185-45-236-223.customer.ggaweb.ch.8333 > tom-Latitude-3570.49070: tcp 109
05:01:31.257615 IP tom-Latitude-3570.49070 > c-185-45-236-223.customer.ggaweb.ch.8333: tcp 0
05:01:31.257800 IP tom-Latitude-3570.49070 > c-185-45-236-223.customer.ggaweb.ch.8333: tcp 24
05:01:31.259526 IP tom-Latitude-3570.49070 > c-185-45-236-223.customer.ggaweb.ch.8333: tcp 37
05:01:31.277573 IP 167.99.216.145.8333 > tom-Latitude-3570.57976: tcp 24
05:01:31.278184 IP 167.99.216.145.8333 > tom-Latitude-3570.57976: tcp 8
05:01:31.278249 IP tom-Latitude-3570.57976 > 167.99.216.145.8333: tcp 0
05:01:31.294301 IP c-185-45-236-223.customer.ggaweb.ch.8333 > tom-Latitude-3570.49070: tcp 0
05:01:31.340098 IP bb42-60-217-183.singnet.com.sg.8333 > tom-Latitude-3570.60470: tcp 24
05:01:31.340118 IP bb42-60-217-183.singnet.com.sg.8333 > tom-Latitude-3570.60470: tcp 8
05:01:31.340164 IP tom-Latitude-3570.60470 > bb42-60-217-183.singnet.com.sg.8333: tcp 0
05:01:31.340408 IP tom-Latitude-3570.57976 > 167.99.216.145.8333: tcp 24
05:01:31.340438 IP tom-Latitude-3570.60470 > bb42-60-217-183.singnet.com.sg.8333: tcp 24
05:01:31.340464 IP tom-Latitude-3570.42516 > 2.56.9.15.8333: tcp 24
05:01:31.341873 IP tom-Latitude-3570.57976 > 167.99.216.145.8333: tcp 109
05:01:31.342808 IP tom-Latitude-3570.60470 > bb42-60-217-183.singnet.com.sg.8333: tcp 8
05:01:31.343434 IP tom-Latitude-3570.42516 > 2.56.9.15.8333: tcp 37
05:01:31.375462 IP 167.99.216.145.8333 > tom-Latitude-3570.57976: tcp 0
05:01:31.375476 IP 167.99.216.145.8333 > tom-Latitude-3570.57976: tcp 0
05:01:31.375479 IP bb42-60-217-183.singnet.com.sg.8333 > tom-Latitude-3570.60470: tcp 0
05:01:31.375481 IP 2.56.9.15.8333 > tom-Latitude-3570.42516: tcp 0
05:01:31.379476 IP c-185-45-236-223.customer.ggaweb.ch.8333 > tom-Latitude-3570.49070: tcp 24
05:01:31.379497 IP c-185-45-236-223.customer.ggaweb.ch.8333 > tom-Latitude-3570.49070: tcp 223
05:01:31.379540 IP tom-Latitude-3570.49070 > c-185-45-236-223.customer.ggaweb.ch.8333: tcp 0
05:01:31.379994 IP tom-Latitude-3570.57976 > 167.99.216.145.8333: tcp 24
05:01:31.381611 IP tom-Latitude-3570.57976 > 167.99.216.145.8333: tcp 37
05:01:31.422996 IP 167.99.216.145.8333 > tom-Latitude-3570.57976: tcp 0
05:01:31.423637 IP 167.99.216.145.8333 > tom-Latitude-3570.57976: tcp 0
05:01:31.487331 IP 167.99.216.145.8333 > tom-Latitude-3570.57976: tcp 24
05:01:31.487349 IP 167.99.216.145.8333 > tom-Latitude-3570.57976: tcp 37
05:01:31.487396 IP tom-Latitude-3570.57976 > 167.99.216.145.8333: tcp 0
05:01:31.487537 IP tom-Latitude-3570.57976 > 167.99.216.145.8333: tcp 24
05:01:31.489112 IP tom-Latitude-3570.57976 > 167.99.216.145.8333: tcp 223
05:01:31.524973 IP 167.99.216.145.8333 > tom-Latitude-3570.57976: tcp 0
05:01:31.525819 IP 167.99.216.145.8333 > tom-Latitude-3570.57976: tcp 0
05:01:31.788703 IP tom-Latitude-3570.60470 > bb42-60-217-183.singnet.com.sg.8333: tcp 24
05:01:31.788772 IP tom-Latitude-3570.42516 > 2.56.9.15.8333: tcp 24
05:01:31.790749 IP tom-Latitude-3570.60470 > bb42-60-217-183.singnet.com.sg.8333: tcp 73
05:01:31.791580 IP tom-Latitude-3570.42516 > 2.56.9.15.8333: tcp 37
05:01:31.824853 IP 2.56.9.15.8333 > tom-Latitude-3570.42516: tcp 0
05:01:31.824867 IP bb42-60-217-183.singnet.com.sg.8333 > tom-Latitude-3570.60470: tcp 0
05:01:31.989474 IP tom-Latitude-3570.56714 > ns3113832.ip-54-38-177.eu.8333: tcp 24
05:01:31.991646 IP tom-Latitude-3570.56714 > ns3113832.ip-54-38-177.eu.8333: tcp 37
05:01:32.027002 IP ns3113832.ip-54-38-177.eu.8333 > tom-Latitude-3570.56714: tcp 0
05:01:32.033721 IP ns3113832.ip-54-38-177.eu.8333 > tom-Latitude-3570.56714: tcp 0
05:01:32.089877 IP tom-Latitude-3570.60988 > 81.198.101.144.8333: tcp 24
05:01:32.090884 IP tom-Latitude-3570.60988 > 81.198.101.144.8333: tcp 73
05:01:32.137576 IP 81.198.101.144.8333 > tom-Latitude-3570.60988: tcp 0
05:01:32.892520 IP tom-Latitude-3570.39110 > vmi195435.contaboserver.net.8333: tcp 24
05:01:32.896450 IP tom-Latitude-3570.39110 > vmi195435.contaboserver.net.8333: tcp 109
05:01:32.898245 IP 167.99.216.145.8333 > tom-Latitude-3570.57976: tcp 24
05:01:32.898261 IP 167.99.216.145.8333 > tom-Latitude-3570.57976: tcp 37
05:01:32.898264 IP 167.99.216.145.8333 > tom-Latitude-3570.57976: tcp 37
05:01:32.898288 IP tom-Latitude-3570.57976 > 167.99.216.145.8333: tcp 0
05:01:32.898299 IP 167.99.216.145.8333 > tom-Latitude-3570.57976: tcp 24
05:01:32.898301 IP tom-Latitude-3570.57976 > 167.99.216.145.8333: tcp 0
05:01:32.898305 IP 167.99.216.145.8333 > tom-Latitude-3570.57976: tcp 73
05:01:32.898319 IP tom-Latitude-3570.57976 > 167.99.216.145.8333: tcp 0
05:01:32.898523 IP tom-Latitude-3570.57976 > 167.99.216.145.8333: tcp 24
05:01:32.902042 IP tom-Latitude-3570.57976 > 167.99.216.145.8333: tcp 134
05:01:32.927287 IP vmi195435.contaboserver.net.8333 > tom-Latitude-3570.39110: tcp 0
05:01:32.932943 IP vmi195435.contaboserver.net.8333 > tom-Latitude-3570.39110: tcp 0
05:01:32.932956 IP 167.99.216.145.8333 > tom-Latitude-3570.57976: tcp 0
05:01:32.932961 IP 167.99.216.145.8333 > tom-Latitude-3570.57976: tcp 0
05:01:32.996833 IP 167.99.216.145.8333 > tom-Latitude-3570.57976: tcp 24
05:01:32.997693 IP 167.99.216.145.8333 > tom-Latitude-3570.57976: tcp 226
05:01:32.997712 IP 167.99.216.145.8333 > tom-Latitude-3570.57976: tcp 24
05:01:32.997715 IP 167.99.216.145.8333 > tom-Latitude-3570.57976: tcp 404
05:01:32.997717 IP 167.99.216.145.8333 > tom-Latitude-3570.57976: tcp 24
05:01:32.997720 IP 167.99.216.145.8333 > tom-Latitude-3570.57976: tcp 404
05:01:32.997807 IP tom-Latitude-3570.57976 > 167.99.216.145.8333: tcp 0
05:01:32.998220 IP tom-Latitude-3570.60470 > bb42-60-217-183.singnet.com.sg.8333: tcp 24
05:01:32.999586 IP tom-Latitude-3570.60470 > bb42-60-217-183.singnet.com.sg.8333: tcp 8
05:01:33.035217 IP bb42-60-217-183.singnet.com.sg.8333 > tom-Latitude-3570.60470: tcp 0
05:01:33.101141 IP tom-Latitude-3570.49070 > c-185-45-236-223.customer.ggaweb.ch.8333: tcp 24
05:01:33.102081 IP tom-Latitude-3570.49070 > c-185-45-236-223.customer.ggaweb.ch.8333: tcp 109
05:01:33.146568 IP c-185-45-236-223.customer.ggaweb.ch.8333 > tom-Latitude-3570.49070: tcp 0
05:01:33.301873 IP tom-Latitude-3570.60470 > bb42-60-217-183.singnet.com.sg.8333: tcp 24
05:01:33.305704 IP tom-Latitude-3570.60470 > bb42-60-217-183.singnet.com.sg.8333: tcp 109
05:01:33.315653 IP 167.99.216.145.8333 > tom-Latitude-3570.57976: tcp 24
05:01:33.315673 IP 167.99.216.145.8333 > tom-Latitude-3570.57976: tcp 73
05:01:33.315765 IP tom-Latitude-3570.57976 > 167.99.216.145.8333: tcp 0
05:01:33.315913 IP tom-Latitude-3570.57976 > 167.99.216.145.8333: tcp 24
05:01:33.317619 IP tom-Latitude-3570.57976 > 167.99.216.145.8333: tcp 73
05:01:33.336850 IP bb42-60-217-183.singnet.com.sg.8333 > tom-Latitude-3570.60470: tcp 0
05:01:33.342395 IP 167.99.216.145.8333 > tom-Latitude-3570.57976: tcp 0
05:01:33.351550 IP 167.99.216.145.8333 > tom-Latitude-3570.57976: tcp 0
05:01:33.418863 IP bb42-60-217-183.singnet.com.sg.8333 > tom-Latitude-3570.60470: tcp 24
05:01:33.419615 IP bb42-60-217-183.singnet.com.sg.8333 > tom-Latitude-3570.60470: tcp 8
05:01:33.419632 IP 167.99.216.145.8333 > tom-Latitude-3570.57976: tcp 24
05:01:33.419638 IP 167.99.216.145.8333 > tom-Latitude-3570.57976: tcp 405
05:01:33.419642 IP 167.99.216.145.8333 > tom-Latitude-3570.57976: tcp 24
05:01:33.419663 IP 167.99.216.145.8333 > tom-Latitude-3570.57976: tcp 382
05:01:33.419739 IP tom-Latitude-3570.57976 > 167.99.216.145.8333: tcp 0
05:01:33.419775 IP tom-Latitude-3570.60470 > bb42-60-217-183.singnet.com.sg.8333: tcp 0
05:01:34.626880 IP tom-Latitude-3570.60988 > 81.198.101.144.8333: tcp 24
05:01:34.629226 IP tom-Latitude-3570.60988 > 81.198.101.144.8333: tcp 181
05:01:34.651142 IP c-185-45-236-223.customer.ggaweb.ch.8333 > tom-Latitude-3570.49070: tcp 24
05:01:34.651787 IP c-185-45-236-223.customer.ggaweb.ch.8333 > tom-Latitude-3570.49070: tcp 289
05:01:34.651920 IP tom-Latitude-3570.49070 > c-185-45-236-223.customer.ggaweb.ch.8333: tcp 0
05:01:34.652121 IP tom-Latitude-3570.49070 > c-185-45-236-223.customer.ggaweb.ch.8333: tcp 24
05:01:34.653890 IP tom-Latitude-3570.49070 > c-185-45-236-223.customer.ggaweb.ch.8333: tcp 217
05:01:34.671085 IP 81.198.101.144.8333 > tom-Latitude-3570.60988: tcp 0
05:01:34.687681 IP c-185-45-236-223.customer.ggaweb.ch.8333 > tom-Latitude-3570.49070: tcp 0
05:01:34.752527 IP tom-Latitude-3570.39110 > vmi195435.contaboserver.net.8333: tcp 24
05:01:34.753464 IP tom-Latitude-3570.39110 > vmi195435.contaboserver.net.8333: tcp 181
05:01:34.770838 IP c-185-45-236-223.customer.ggaweb.ch.8333 > tom-Latitude-3570.49070: tcp 24
05:01:34.770859 IP c-185-45-236-223.customer.ggaweb.ch.8333 > tom-Latitude-3570.49070: tcp 959
05:01:34.770862 IP c-185-45-236-223.customer.ggaweb.ch.8333 > tom-Latitude-3570.49070: tcp 24
05:01:34.770948 IP tom-Latitude-3570.49070 > c-185-45-236-223.customer.ggaweb.ch.8333: tcp 0
05:01:34.771718 IP c-185-45-236-223.customer.ggaweb.ch.8333 > tom-Latitude-3570.49070: tcp 1448
05:01:34.771777 IP tom-Latitude-3570.49070 > c-185-45-236-223.customer.ggaweb.ch.8333: tcp 0
05:01:34.775844 IP c-185-45-236-223.customer.ggaweb.ch.8333 > tom-Latitude-3570.49070: tcp 1448
05:01:34.775859 IP c-185-45-236-223.customer.ggaweb.ch.8333 > tom-Latitude-3570.49070: tcp 1448
05:01:34.775863 IP c-185-45-236-223.customer.ggaweb.ch.8333 > tom-Latitude-3570.49070: tcp 1448
05:01:34.775885 IP c-185-45-236-223.customer.ggaweb.ch.8333 > tom-Latitude-3570.49070: tcp 1448
05:01:34.775890 IP c-185-45-236-223.customer.ggaweb.ch.8333 > tom-Latitude-3570.49070: tcp 1448
05:01:34.775906 IP c-185-45-236-223.customer.ggaweb.ch.8333 > tom-Latitude-3570.49070: tcp 1244
05:01:34.775944 IP tom-Latitude-3570.49070 > c-185-45-236-223.customer.ggaweb.ch.8333: tcp 0
05:01:34.782452 IP vmi195435.contaboserver.net.8333 > tom-Latitude-3570.39110: tcp 0
05:01:34.791037 IP vmi195435.contaboserver.net.8333 > tom-Latitude-3570.39110: tcp 0
05:01:35.186034 IP tom-Latitude-3570.46284 > static-87-75-105-186.vodafonexdsl.co.uk.8333: tcp 24
05:01:35.188677 IP tom-Latitude-3570.46284 > static-87-75-105-186.vodafonexdsl.co.uk.8333: tcp 505
05:01:35.243402 IP 167.99.216.145.8333 > tom-Latitude-3570.57976: tcp 24
05:01:35.243426 IP 167.99.216.145.8333 > tom-Latitude-3570.57976: tcp 1448
05:01:35.243516 IP tom-Latitude-3570.57976 > 167.99.216.145.8333: tcp 0
05:01:35.244282 IP 167.99.216.145.8333 > tom-Latitude-3570.57976: tcp 1448
05:01:35.244302 IP 167.99.216.145.8333 > tom-Latitude-3570.57976: tcp 1448
05:01:35.244306 IP 167.99.216.145.8333 > tom-Latitude-3570.57976: tcp 1382
05:01:35.244396 IP tom-Latitude-3570.57976 > 167.99.216.145.8333: tcp 0
05:01:35.245968 IP 167.99.216.145.8333 > tom-Latitude-3570.57976: tcp 66
05:01:35.245990 IP 167.99.216.145.8333 > tom-Latitude-3570.57976: tcp 1448
05:01:35.245995 IP 167.99.216.145.8333 > tom-Latitude-3570.57976: tcp 1448
05:01:35.246000 IP 167.99.216.145.8333 > tom-Latitude-3570.57976: tcp 1448
05:01:35.246021 IP 167.99.216.145.8333 > tom-Latitude-3570.57976: tcp 1448
05:01:35.246030 IP 167.99.216.145.8333 > tom-Latitude-3570.57976: tcp 1125
05:01:35.246033 IP vmi195435.contaboserver.net.8333 > tom-Latitude-3570.39110: tcp 24
05:01:35.246096 IP tom-Latitude-3570.57976 > 167.99.216.145.8333: tcp 0
05:01:35.246184 IP vmi195435.contaboserver.net.8333 > tom-Latitude-3570.39110: tcp 1382
05:01:35.246209 IP tom-Latitude-3570.39110 > vmi195435.contaboserver.net.8333: tcp 0
05:01:35.248330 IP vmi195435.contaboserver.net.8333 > tom-Latitude-3570.39110: tcp 66
05:01:35.248345 IP vmi195435.contaboserver.net.8333 > tom-Latitude-3570.39110: tcp 1448
05:01:35.248363 IP vmi195435.contaboserver.net.8333 > tom-Latitude-3570.39110: tcp 1448
05:01:35.248367 IP vmi195435.contaboserver.net.8333 > tom-Latitude-3570.39110: tcp 1448
05:01:35.248372 IP vmi195435.contaboserver.net.8333 > tom-Latitude-3570.39110: tcp 1448
05:01:35.248376 IP vmi195435.contaboserver.net.8333 > tom-Latitude-3570.39110: tcp 1448
05:01:35.248387 IP tom-Latitude-3570.39110 > vmi195435.contaboserver.net.8333: tcp 0
05:01:35.248460 IP tom-Latitude-3570.39110 > vmi195435.contaboserver.net.8333: tcp 0
05:01:35.256549 IP vmi195435.contaboserver.net.8333 > tom-Latitude-3570.39110: tcp 1448
05:01:35.256563 IP vmi195435.contaboserver.net.8333 > tom-Latitude-3570.39110: tcp 1448
05:01:35.256606 IP tom-Latitude-3570.39110 > vmi195435.contaboserver.net.8333: tcp 0
05:01:35.258185 IP vmi195435.contaboserver.net.8333 > tom-Latitude-3570.39110: tcp 1125
05:01:35.258193 IP ns3113832.ip-54-38-177.eu.8333 > tom-Latitude-3570.56714: tcp 24
05:01:35.258199 IP ns3113832.ip-54-38-177.eu.8333 > tom-Latitude-3570.56714: tcp 1350
05:01:35.258203 IP ns3113832.ip-54-38-177.eu.8333 > tom-Latitude-3570.56714: tcp 1350
05:01:35.258206 IP ns3113832.ip-54-38-177.eu.8333 > tom-Latitude-3570.56714: tcp 1350
05:01:35.258209 IP ns3113832.ip-54-38-177.eu.8333 > tom-Latitude-3570.56714: tcp 1350
05:01:35.258212 IP ns3113832.ip-54-38-177.eu.8333 > tom-Latitude-3570.56714: tcp 1350
05:01:35.258215 IP ns3113832.ip-54-38-177.eu.8333 > tom-Latitude-3570.56714: tcp 1350
05:01:35.258220 IP ns3113832.ip-54-38-177.eu.8333 > tom-Latitude-3570.56714: tcp 1350
05:01:35.258224 IP ns3113832.ip-54-38-177.eu.8333 > tom-Latitude-3570.56714: tcp 1350
05:01:35.258231 IP tom-Latitude-3570.56714 > ns3113832.ip-54-38-177.eu.8333: tcp 0
05:01:35.258474 IP ns3113832.ip-54-38-177.eu.8333 > tom-Latitude-3570.56714: tcp 1350
05:01:35.258480 IP 81.198.101.144.8333 > tom-Latitude-3570.60988: tcp 24
05:01:35.258483 IP 81.198.101.144.8333 > tom-Latitude-3570.60988: tcp 82
05:01:35.258498 IP static-87-75-105-186.vodafonexdsl.co.uk.8333 > tom-Latitude-3570.46284: tcp 0
05:01:35.258503 IP static-87-75-105-186.vodafonexdsl.co.uk.8333 > tom-Latitude-3570.46284: tcp 0
05:01:35.258504 IP tom-Latitude-3570.60988 > 81.198.101.144.8333: tcp 0
05:01:35.258515 IP tom-Latitude-3570.56714 > ns3113832.ip-54-38-177.eu.8333: tcp 0
05:01:35.284895 IP ns3113832.ip-54-38-177.eu.8333 > tom-Latitude-3570.56714: tcp 559
05:01:35.299722 IP tom-Latitude-3570.39110 > vmi195435.contaboserver.net.8333: tcp 0
05:01:35.310296 IP tom-Latitude-3570.49070 > c-185-45-236-223.customer.ggaweb.ch.8333: tcp 24
05:01:35.310589 IP tom-Latitude-3570.60470 > bb42-60-217-183.singnet.com.sg.8333: tcp 24
05:01:35.310644 IP tom-Latitude-3570.42516 > 2.56.9.15.8333: tcp 24
05:01:35.310689 IP tom-Latitude-3570.46284 > static-87-75-105-186.vodafonexdsl.co.uk.8333: tcp 24
05:01:35.311255 IP tom-Latitude-3570.49070 > c-185-45-236-223.customer.ggaweb.ch.8333: tcp 82
05:01:35.311845 IP tom-Latitude-3570.60470 > bb42-60-217-183.singnet.com.sg.8333: tcp 82
05:01:35.312501 IP tom-Latitude-3570.42516 > 2.56.9.15.8333: tcp 82
05:01:35.313217 IP tom-Latitude-3570.46284 > static-87-75-105-186.vodafonexdsl.co.uk.8333: tcp 82
05:01:35.334175 IP c-185-45-236-223.customer.ggaweb.ch.8333 > tom-Latitude-3570.49070: tcp 24
05:01:35.335769 IP tom-Latitude-3570.56714 > ns3113832.ip-54-38-177.eu.8333: tcp 0
05:01:35.338480 IP c-185-45-236-223.customer.ggaweb.ch.8333 > tom-Latitude-3570.49070: tcp 82
05:01:35.338596 IP tom-Latitude-3570.49070 > c-185-45-236-223.customer.ggaweb.ch.8333: tcp 0
05:01:35.344516 IP bb42-60-217-183.singnet.com.sg.8333 > tom-Latitude-3570.60470: tcp 0
05:01:35.345187 IP static-87-75-105-186.vodafonexdsl.co.uk.8333 > tom-Latitude-3570.46284: tcp 0
05:01:35.345199 IP 2.56.9.15.8333 > tom-Latitude-3570.42516: tcp 0
05:01:35.345203 IP c-185-45-236-223.customer.ggaweb.ch.8333 > tom-Latitude-3570.49070: tcp 0
05:01:35.345206 IP static-87-75-105-186.vodafonexdsl.co.uk.8333 > tom-Latitude-3570.46284: tcp 0
05:01:35.385430 IP 2.56.9.15.8333 > tom-Latitude-3570.42516: tcp 24
05:01:35.385449 IP 2.56.9.15.8333 > tom-Latitude-3570.42516: tcp 82
05:01:35.385565 IP tom-Latitude-3570.42516 > 2.56.9.15.8333: tcp 0
05:01:35.805557 IP static-87-75-105-186.vodafonexdsl.co.uk.8333 > tom-Latitude-3570.46284: tcp 24
05:01:35.805576 IP static-87-75-105-186.vodafonexdsl.co.uk.8333 > tom-Latitude-3570.46284: tcp 82
05:01:35.805579 IP bb42-60-217-183.singnet.com.sg.8333 > tom-Latitude-3570.60470: tcp 24
05:01:35.805582 IP bb42-60-217-183.singnet.com.sg.8333 > tom-Latitude-3570.60470: tcp 82
05:01:35.805584 IP static-87-75-105-186.vodafonexdsl.co.uk.8333 > tom-Latitude-3570.46284: tcp 82
05:01:35.805613 IP tom-Latitude-3570.46284 > static-87-75-105-186.vodafonexdsl.co.uk.8333: tcp 0
05:01:35.805627 IP bb42-60-217-183.singnet.com.sg.8333 > tom-Latitude-3570.60470: tcp 82
05:01:35.805629 IP tom-Latitude-3570.60470 > bb42-60-217-183.singnet.com.sg.8333: tcp 0
05:01:36.420460 IP 2.56.9.15.8333 > tom-Latitude-3570.42516: tcp 24
05:01:36.420480 IP 2.56.9.15.8333 > tom-Latitude-3570.42516: tcp 541
05:01:36.420485 IP 2.56.9.15.8333 > tom-Latitude-3570.42516: tcp 541
05:01:36.420513 IP tom-Latitude-3570.42516 > 2.56.9.15.8333: tcp 0
