00:58:56.305579 IP bb42-60-217-183.singnet.com.sg.8333 > tom-Latitude-3570.60470: tcp 191
00:58:56.305597 IP tom-Latitude-3570.60470 > bb42-60-217-183.singnet.com.sg.8333: tcp 0
00:58:56.305607 IP bb42-60-217-183.singnet.com.sg.8333 > tom-Latitude-3570.60470: tcp 24
00:58:56.305609 IP tom-Latitude-3570.60470 > bb42-60-217-183.singnet.com.sg.8333: tcp 0
00:58:56.305612 IP bb42-60-217-183.singnet.com.sg.8333 > tom-Latitude-3570.60470: tcp 406
00:58:56.305614 IP tom-Latitude-3570.60470 > bb42-60-217-183.singnet.com.sg.8333: tcp 0
00:58:56.305616 IP bb42-60-217-183.singnet.com.sg.8333 > tom-Latitude-3570.60470: tcp 24
00:58:56.305618 IP tom-Latitude-3570.60470 > bb42-60-217-183.singnet.com.sg.8333: tcp 0
00:58:56.305620 IP bb42-60-217-183.singnet.com.sg.8333 > tom-Latitude-3570.60470: tcp 401
00:58:56.305622 IP tom-Latitude-3570.60470 > bb42-60-217-183.singnet.com.sg.8333: tcp 0
00:58:56.305624 IP bb42-60-217-183.singnet.com.sg.8333 > tom-Latitude-3570.60470: tcp 24
00:58:56.305626 IP tom-Latitude-3570.60470 > bb42-60-217-183.singnet.com.sg.8333: tcp 0
00:58:56.305629 IP bb42-60-217-183.singnet.com.sg.8333 > tom-Latitude-3570.60470: tcp 223
00:58:56.305630 IP tom-Latitude-3570.60470 > bb42-60-217-183.singnet.com.sg.8333: tcp 0
00:58:56.305632 IP bb42-60-217-183.singnet.com.sg.8333 > tom-Latitude-3570.60470: tcp 24
00:58:56.305634 IP tom-Latitude-3570.60470 > bb42-60-217-183.singnet.com.sg.8333: tcp 0
00:58:56.305637 IP bb42-60-217-183.singnet.com.sg.8333 > tom-Latitude-3570.60470: tcp 247
00:58:56.305638 IP tom-Latitude-3570.60470 > bb42-60-217-183.singnet.com.sg.8333: tcp 0
00:58:56.305640 IP bb42-60-217-183.singnet.com.sg.8333 > tom-Latitude-3570.60470: tcp 247
00:58:56.305642 IP tom-Latitude-3570.60470 > bb42-60-217-183.singnet.com.sg.8333: tcp 0
00:58:56.392794 IP bb42-60-217-183.singnet.com.sg.8333 > tom-Latitude-3570.60470: tcp 24
00:58:56.392803 IP tom-Latitude-3570.60470 > bb42-60-217-183.singnet.com.sg.8333: tcp 0
00:58:56.495237 IP tom-Latitude-3570.57976 > 167.99.216.145.8333: tcp 24
00:58:56.496214 IP tom-Latitude-3570.57976 > 167.99.216.145.8333: tcp 181
00:58:56.540403 IP 167.99.216.145.8333 > tom-Latitude-3570.57976: tcp 0
00:58:56.695620 IP tom-Latitude-3570.39110 > vmi195435.contaboserver.net.8333: tcp 24
00:58:56.698053 IP tom-Latitude-3570.39110 > vmi195435.contaboserver.net.8333: tcp 505
00:58:56.732388 IP vmi195435.contaboserver.net.8333 > tom-Latitude-3570.39110: tcp 0
00:58:56.739626 IP vmi195435.contaboserver.net.8333 > tom-Latitude-3570.39110: tcp 0
00:58:56.896052 IP tom-Latitude-3570.42516 > 2.56.9.15.8333: tcp 24
00:58:56.897972 IP tom-Latitude-3570.42516 > 2.56.9.15.8333: tcp 505
00:58:56.940448 IP 2.56.9.15.8333 > tom-Latitude-3570.42516: tcp 0
00:58:57.044270 IP tom-Latitude-3570.59014 > 182.88.76.185.8333: tcp 0
00:58:57.123477 IP 182.88.76.185.8333 > tom-Latitude-3570.59014: tcp 0
00:58:57.335575 IP tom-Latitude-3570.46692 > 59.63.204.216.8333: tcp 0
00:58:57.416100 IP 59.63.204.216.8333 > tom-Latitude-3570.46692: tcp 0
00:58:57.416124 IP tom-Latitude-3570.46692 > 59.63.204.216.8333: tcp 0
00:58:57.416353 IP tom-Latitude-3570.46692 > 59.63.204.216.8333: tcp 24
00:58:57.417603 IP tom-Latitude-3570.46692 > 59.63.204.216.8333: tcp 102
00:58:57.496901 IP tom-Latitude-3570.39282 > default-rdns.vocus.co.nz.8333: tcp 24
00:58:57.497723 IP tom-Latitude-3570.39282 > default-rdns.vocus.co.nz.8333: tcp 505
00:58:57.500493 IP 59.63.204.216.8333 > tom-Latitude-3570.46692: tcp 0
00:58:57.532415 IP default-rdns.vocus.co.nz.8333 > tom-Latitude-3570.39282: tcp 0
00:58:57.539217 IP default-rdns.vocus.co.nz.8333 > tom-Latitude-3570.39282: tcp 0
00:58:57.943570 IP 2.56.9.15.8333 > tom-Latitude-3570.42516: tcp 24
00:58:57.943585 IP 2.56.9.15.8333 > tom-Latitude-3570.42516: tcp 217
00:58:57.943589 IP 2.56.9.15.8333 > tom-Latitude-3570.42516: tcp 217
00:58:57.943600 IP tom-Latitude-3570.42516 > 2.56.9.15.8333: tcp 0
00:58:57.943612 IP 2.56.9.15.8333 > tom-Latitude-3570.42516: tcp 24
00:58:57.943614 IP tom-Latitude-3570.42516 > 2.56.9.15.8333: tcp 0
00:58:57.943616 IP 2.56.9.15.8333 > tom-Latitude-3570.42516: tcp 37
00:58:57.943618 IP tom-Latitude-3570.42516 > 2.56.9.15.8333: tcp 0
00:58:57.943815 IP tom-Latitude-3570.42516 > 2.56.9.15.8333: tcp 24
00:58:57.945009 IP tom-Latitude-3570.42516 > 2.56.9.15.8333: tcp 278
00:58:57.978618 IP 2.56.9.15.8333 > tom-Latitude-3570.42516: tcp 0
00:58:58.148525 IP 2.56.9.15.8333 > tom-Latitude-3570.42516: tcp 24
00:58:58.148534 IP 2.56.9.15.8333 > tom-Latitude-3570.42516: tcp 214
00:58:58.148537 IP 2.56.9.15.8333 > tom-Latitude-3570.42516: tcp 24
00:58:58.148539 IP 2.56.9.15.8333 > tom-Latitude-3570.42516: tcp 280
00:58:58.148541 IP 2.56.9.15.8333 > tom-Latitude-3570.42516: tcp 24
00:58:58.148543 IP 2.56.9.15.8333 > tom-Latitude-3570.42516: tcp 224
00:58:58.148544 IP 2.56.9.15.8333 > tom-Latitude-3570.42516: tcp 24
00:58:58.148546 IP tom-Latitude-3570.42516 > 2.56.9.15.8333: tcp 0
00:58:58.148546 IP 2.56.9.15.8333 > tom-Latitude-3570.42516: tcp 418
00:58:58.148548 IP 2.56.9.15.8333 > tom-Latitude-3570.42516: tcp 24
00:58:58.148550 IP 2.56.9.15.8333 > tom-Latitude-3570.42516: tcp 225
00:58:58.148622 IP tom-Latitude-3570.42516 > 2.56.9.15.8333: tcp 0
00:58:58.185369 IP 2.56.9.15.8333 > tom-Latitude-3570.42516: tcp 462
00:58:58.235717 IP tom-Latitude-3570.42516 > 2.56.9.15.8333: tcp 0
00:58:58.386089 IP tom-Latitude-3570.60470 > bb42-60-217-183.singnet.com.sg.8333: tcp 24
00:58:58.387989 IP tom-Latitude-3570.60470 > bb42-60-217-183.singnet.com.sg.8333: tcp 253
00:58:58.422410 IP bb42-60-217-183.singnet.com.sg.8333 > tom-Latitude-3570.60470: tcp 0
00:58:58.429108 IP bb42-60-217-183.singnet.com.sg.8333 > tom-Latitude-3570.60470: tcp 0
00:58:58.967487 IP 167.99.216.145.8333 > tom-Latitude-3570.57976: tcp 24
00:58:58.967503 IP 167.99.216.145.8333 > tom-Latitude-3570.57976: tcp 397
00:58:58.967506 IP 167.99.216.145.8333 > tom-Latitude-3570.57976: tcp 397
00:58:58.967530 IP tom-Latitude-3570.57976 > 167.99.216.145.8333: tcp 0
00:58:58.967636 IP tom-Latitude-3570.39110 > vmi195435.contaboserver.net.8333: tcp 24
00:58:58.967785 IP tom-Latitude-3570.57976 > 167.99.216.145.8333: tcp 24
00:58:58.968958 IP tom-Latitude-3570.57976 > 167.99.216.145.8333: tcp 109
00:58:58.968963 IP tom-Latitude-3570.39110 > vmi195435.contaboserver.net.8333: tcp 253
00:58:59.010764 IP vmi195435.contaboserver.net.8333 > tom-Latitude-3570.39110: tcp 0
00:58:59.011513 IP vmi195435.contaboserver.net.8333 > tom-Latitude-3570.39110: tcp 0
00:58:59.011518 IP 167.99.216.145.8333 > tom-Latitude-3570.57976: tcp 0
00:58:59.067946 IP tom-Latitude-3570.39282 > default-rdns.vocus.co.nz.8333: tcp 24
00:58:59.069356 IP tom-Latitude-3570.39282 > default-rdns.vocus.co.nz.8333: tcp 253
00:58:59.074471 IP 167.99.216.145.8333 > tom-Latitude-3570.57976: tcp 24
00:58:59.074478 IP 167.99.216.145.8333 > tom-Latitude-3570.57976: tcp 224
00:58:59.074481 IP 167.99.216.145.8333 > tom-Latitude-3570.57976: tcp 24
00:58:59.074483 IP 167.99.216.145.8333 > tom-Latitude-3570.57976: tcp 223
00:58:59.074484 IP 167.99.216.145.8333 > tom-Latitude-3570.57976: tcp 24
00:58:59.074486 IP 167.99.216.145.8333 > tom-Latitude-3570.57976: tcp 225
00:58:59.074490 IP tom-Latitude-3570.57976 > 167.99.216.145.8333: tcp 0
00:58:59.110781 IP default-rdns.vocus.co.nz.8333 > tom-Latitude-3570.39282: tcp 0
00:58:59.111447 IP default-rdns.vocus.co.nz.8333 > tom-Latitude-3570.39282: tcp 0
00:58:59.115783 IP tom-Latitude-3570.57976 > 167.99.216.145.8333: tcp 0
00:58:59.377080 IP ns3113832.ip-54-38-177.eu.8333 > tom-Latitude-3570.56714: tcp 24
00:58:59.377094 IP ns3113832.ip-54-38-177.eu.8333 > tom-Latitude-3570.56714: tcp 685
00:58:59.377097 IP 182.88.76.185.8333 > tom-Latitude-3570.59014: tcp 0
00:58:59.377112 IP tom-Latitude-3570.56714 > ns3113832.ip-54-38-177.eu.8333: tcp 0
00:58:59.777897 IP tom-Latitude-3570.39110 > vmi195435.contaboserver.net.8333: tcp 24
00:58:59.778066 IP tom-Latitude-3570.49070 > c-185-45-236-223.customer.ggaweb.ch.8333: tcp 24
00:58:59.779749 IP tom-Latitude-3570.49070 > c-185-45-236-223.customer.ggaweb.ch.8333: tcp 829
00:58:59.779755 IP tom-Latitude-3570.39110 > vmi195435.contaboserver.net.8333: tcp 61
00:58:59.832011 IP vmi195435.contaboserver.net.8333 > tom-Latitude-3570.39110: tcp 0
00:58:59.847583 IP c-185-45-236-223.customer.ggaweb.ch.8333 > tom-Latitude-3570.49070: tcp 0
00:58:59.848221 IP vmi195435.contaboserver.net.8333 > tom-Latitude-3570.39110: tcp 0
00:58:59.848226 IP c-185-45-236-223.customer.ggaweb.ch.8333 > tom-Latitude-3570.49070: tcp 0
00:59:00.196213 IP ns3113832.ip-54-38-177.eu.8333 > tom-Latitude-3570.56714: tcp 24
00:59:00.196227 IP ns3113832.ip-54-38-177.eu.8333 > tom-Latitude-3570.56714: tcp 217
00:59:00.196248 IP tom-Latitude-3570.56714 > ns3113832.ip-54-38-177.eu.8333: tcp 0
00:59:00.196467 IP tom-Latitude-3570.56714 > ns3113832.ip-54-38-177.eu.8333: tcp 24
00:59:00.197572 IP tom-Latitude-3570.56714 > ns3113832.ip-54-38-177.eu.8333: tcp 217
00:59:00.248198 IP ns3113832.ip-54-38-177.eu.8333 > tom-Latitude-3570.56714: tcp 0
00:59:00.248804 IP ns3113832.ip-54-38-177.eu.8333 > tom-Latitude-3570.56714: tcp 0
00:59:00.298775 IP ns3113832.ip-54-38-177.eu.8333 > tom-Latitude-3570.56714: tcp 24
00:59:00.298782 IP ns3113832.ip-54-38-177.eu.8333 > tom-Latitude-3570.56714: tcp 255
00:59:00.298786 IP ns3113832.ip-54-38-177.eu.8333 > tom-Latitude-3570.56714: tcp 24
00:59:00.298788 IP ns3113832.ip-54-38-177.eu.8333 > tom-Latitude-3570.56714: tcp 224
00:59:00.298789 IP ns3113832.ip-54-38-177.eu.8333 > tom-Latitude-3570.56714: tcp 24
00:59:00.298800 IP tom-Latitude-3570.56714 > ns3113832.ip-54-38-177.eu.8333: tcp 0
00:59:00.299576 IP ns3113832.ip-54-38-177.eu.8333 > tom-Latitude-3570.56714: tcp 337
00:59:00.299583 IP ns3113832.ip-54-38-177.eu.8333 > tom-Latitude-3570.56714: tcp 24
00:59:00.299585 IP ns3113832.ip-54-38-177.eu.8333 > tom-Latitude-3570.56714: tcp 283
00:59:00.299587 IP ns3113832.ip-54-38-177.eu.8333 > tom-Latitude-3570.56714: tcp 24
00:59:00.299589 IP ns3113832.ip-54-38-177.eu.8333 > tom-Latitude-3570.56714: tcp 283
00:59:00.299595 IP tom-Latitude-3570.56714 > ns3113832.ip-54-38-177.eu.8333: tcp 0
00:59:00.354252 IP ns3113832.ip-54-38-177.eu.8333 > tom-Latitude-3570.56714: tcp 308
00:59:00.354606 IP tom-Latitude-3570.57976 > 167.99.216.145.8333: tcp 24
00:59:00.355414 IP tom-Latitude-3570.57976 > 167.99.216.145.8333: tcp 181
00:59:00.390597 IP 167.99.216.145.8333 > tom-Latitude-3570.57976: tcp 0
00:59:00.395787 IP tom-Latitude-3570.56714 > ns3113832.ip-54-38-177.eu.8333: tcp 0
00:59:00.443097 IP bb42-60-217-183.singnet.com.sg.8333 > tom-Latitude-3570.60470: tcp 24
00:59:00.443120 IP tom-Latitude-3570.60470 > bb42-60-217-183.singnet.com.sg.8333: tcp 0
00:59:00.443135 IP bb42-60-217-183.singnet.com.sg.8333 > tom-Latitude-3570.60470: tcp 325
00:59:00.443138 IP tom-Latitude-3570.60470 > bb42-60-217-183.singnet.com.sg.8333: tcp 0
00:59:00.543549 IP tom-Latitude-3570.42516 > 2.56.9.15.8333: tcp 24
00:59:00.544356 IP tom-Latitude-3570.42516 > 2.56.9.15.8333: tcp 289
00:59:00.582070 IP 2.56.9.15.8333 > tom-Latitude-3570.42516: tcp 0
00:59:00.597253 IP 167.99.216.145.8333 > tom-Latitude-3570.57976: tcp 24
00:59:00.597260 IP tom-Latitude-3570.57976 > 167.99.216.145.8333: tcp 0
00:59:00.597957 IP 167.99.216.145.8333 > tom-Latitude-3570.57976: tcp 73
00:59:00.597961 IP tom-Latitude-3570.57976 > 167.99.216.145.8333: tcp 0
00:59:00.598090 IP tom-Latitude-3570.57976 > 167.99.216.145.8333: tcp 24
00:59:00.599138 IP tom-Latitude-3570.57976 > 167.99.216.145.8333: tcp 37
00:59:00.640202 IP 167.99.216.145.8333 > tom-Latitude-3570.57976: tcp 0
00:59:00.702231 IP 167.99.216.145.8333 > tom-Latitude-3570.57976: tcp 24
00:59:00.702906 IP 167.99.216.145.8333 > tom-Latitude-3570.57976: tcp 284
00:59:00.702924 IP tom-Latitude-3570.57976 > 167.99.216.145.8333: tcp 0
00:59:00.803535 IP tom-Latitude-3570.60988 > 81.198.101.144.8333: tcp 24
00:59:00.804441 IP tom-Latitude-3570.60988 > 81.198.101.144.8333: tcp 757
00:59:00.830549 IP 81.198.101.144.8333 > tom-Latitude-3570.60988: tcp 0
00:59:00.838401 IP 81.198.101.144.8333 > tom-Latitude-3570.60988: tcp 0
00:59:01.304386 IP tom-Latitude-3570.39282 > default-rdns.vocus.co.nz.8333: tcp 24
00:59:01.306548 IP tom-Latitude-3570.39282 > default-rdns.vocus.co.nz.8333: tcp 325
00:59:01.350485 IP bb42-60-217-183.singnet.com.sg.8333 > tom-Latitude-3570.60470: tcp 24
00:59:01.350494 IP tom-Latitude-3570.60470 > bb42-60-217-183.singnet.com.sg.8333: tcp 0
00:59:01.351176 IP bb42-60-217-183.singnet.com.sg.8333 > tom-Latitude-3570.60470: tcp 73
00:59:01.351180 IP tom-Latitude-3570.60470 > bb42-60-217-183.singnet.com.sg.8333: tcp 0
00:59:01.351318 IP tom-Latitude-3570.60470 > bb42-60-217-183.singnet.com.sg.8333: tcp 24
00:59:01.352388 IP tom-Latitude-3570.60470 > bb42-60-217-183.singnet.com.sg.8333: tcp 37
00:59:01.353608 IP default-rdns.vocus.co.nz.8333 > tom-Latitude-3570.39282: tcp 0
00:59:01.360247 IP default-rdns.vocus.co.nz.8333 > tom-Latitude-3570.39282: tcp 0
00:59:01.380535 IP bb42-60-217-183.singnet.com.sg.8333 > tom-Latitude-3570.60470: tcp 0
00:59:01.381116 IP bb42-60-217-183.singnet.com.sg.8333 > tom-Latitude-3570.60470: tcp 0
00:59:01.384329 IP ns3113832.ip-54-38-177.eu.8333 > tom-Latitude-3570.56714: tcp 24
00:59:01.384336 IP tom-Latitude-3570.56714 > ns3113832.ip-54-38-177.eu.8333: tcp 0
00:59:01.385046 IP ns3113832.ip-54-38-177.eu.8333 > tom-Latitude-3570.56714: tcp 109
00:59:01.385053 IP tom-Latitude-3570.56714 > ns3113832.ip-54-38-177.eu.8333: tcp 0
00:59:01.385122 IP tom-Latitude-3570.56714 > ns3113832.ip-54-38-177.eu.8333: tcp 24
00:59:01.386174 IP tom-Latitude-3570.56714 > ns3113832.ip-54-38-177.eu.8333: tcp 37
00:59:01.420297 IP ns3113832.ip-54-38-177.eu.8333 > tom-Latitude-3570.56714: tcp 0
00:59:01.422797 IP ns3113832.ip-54-38-177.eu.8333 > tom-Latitude-3570.56714: tcp 0
00:59:01.478470 IP ns3113832.ip-54-38-177.eu.8333 > tom-Latitude-3570.56714: tcp 24
00:59:01.478477 IP ns3113832.ip-54-38-177.eu.8333 > tom-Latitude-3570.56714: tcp 223
00:59:01.478499 IP tom-Latitude-3570.56714 > ns3113832.ip-54-38-177.eu.8333: tcp 0
00:59:01.478672 IP tom-Latitude-3570.49070 > c-185-45-236-223.customer.ggaweb.ch.8333: tcp 24
00:59:01.478964 IP tom-Latitude-3570.57976 > 167.99.216.145.8333: tcp 24
00:59:01.480291 IP tom-Latitude-3570.57976 > 167.99.216.145.8333: tcp 37
00:59:01.480296 IP tom-Latitude-3570.49070 > c-185-45-236-223.customer.ggaweb.ch.8333: tcp 217
00:59:01.509341 IP 167.99.216.145.8333 > tom-Latitude-3570.57976: tcp 0
00:59:01.512588 IP c-185-45-236-223.customer.ggaweb.ch.8333 > tom-Latitude-3570.49070: tcp 0
00:59:01.513336 IP c-185-45-236-223.customer.ggaweb.ch.8333 > tom-Latitude-3570.49070: tcp 0
00:59:01.679275 IP tom-Latitude-3570.60470 > bb42-60-217-183.singnet.com.sg.8333: tcp 24
00:59:01.681198 IP tom-Latitude-3570.60470 > bb42-60-217-183.singnet.com.sg.8333: tcp 37
00:59:01.712438 IP bb42-60-217-183.singnet.com.sg.8333 > tom-Latitude-3570.60470: tcp 0
00:59:01.721061 IP bb42-60-217-183.singnet.com.sg.8333 > tom-Latitude-3570.60470: tcp 0
00:59:01.759805 IP bb42-60-217-183.singnet.com.sg.8333 > tom-Latitude-3570.60470: tcp 24
00:59:01.759816 IP bb42-60-217-183.singnet.com.sg.8333 > tom-Latitude-3570.60470: tcp 225
00:59:01.759842 IP tom-Latitude-3570.60470 > bb42-60-217-183.singnet.com.sg.8333: tcp 0
00:59:02.060599 IP tom-Latitude-3570.39282 > default-rdns.vocus.co.nz.8333: tcp 24
00:59:02.062568 IP tom-Latitude-3570.39282 > default-rdns.vocus.co.nz.8333: tcp 73
00:59:02.122940 IP default-rdns.vocus.co.nz.8333 > tom-Latitude-3570.39282: tcp 0
00:59:02.130717 IP default-rdns.vocus.co.nz.8333 > tom-Latitude-3570.39282: tcp 0
00:59:02.160753 IP tom-Latitude-3570.60988 > 81.198.101.144.8333: tcp 24
00:59:02.161570 IP tom-Latitude-3570.60988 > 81.198.101.144.8333: tcp 73
00:59:02.192805 IP 81.198.101.144.8333 > tom-Latitude-3570.60988: tcp 0
00:59:02.200462 IP 81.198.101.144.8333 > tom-Latitude-3570.60988: tcp 0
00:59:02.361171 IP tom-Latitude-3570.49070 > c-185-45-236-223.customer.ggaweb.ch.8333: tcp 24
00:59:02.363153 IP tom-Latitude-3570.49070 > c-185-45-236-223.customer.ggaweb.ch.8333: tcp 73
00:59:02.393138 IP c-185-45-236-223.customer.ggaweb.ch.8333 > tom-Latitude-3570.49070: tcp 0
00:59:02.400003 IP c-185-45-236-223.customer.ggaweb.ch.8333 > tom-Latitude-3570.49070: tcp 0
00:59:03.262913 IP tom-Latitude-3570.57976 > 167.99.216.145.8333: tcp 24
00:59:03.265725 IP tom-Latitude-3570.57976 > 167.99.216.145.8333: tcp 37
00:59:03.286383 IP c-185-45-236-223.customer.ggaweb.ch.8333 > tom-Latitude-3570.49070: tcp 24
00:59:03.287016 IP c-185-45-236-223.customer.ggaweb.ch.8333 > tom-Latitude-3570.49070: tcp 181
00:59:03.287033 IP tom-Latitude-3570.49070 > c-185-45-236-223.customer.ggaweb.ch.8333: tcp 0
00:59:03.287206 IP tom-Latitude-3570.49070 > c-185-45-236-223.customer.ggaweb.ch.8333: tcp 24
00:59:03.288401 IP tom-Latitude-3570.49070 > c-185-45-236-223.customer.ggaweb.ch.8333: tcp 145
00:59:03.294780 IP c-185-45-236-223.customer.ggaweb.ch.8333 > tom-Latitude-3570.49070: tcp 181
00:59:03.294786 IP tom-Latitude-3570.49070 > c-185-45-236-223.customer.ggaweb.ch.8333: tcp 0
00:59:03.295399 IP 167.99.216.145.8333 > tom-Latitude-3570.57976: tcp 24
00:59:03.295407 IP 167.99.216.145.8333 > tom-Latitude-3570.57976: tcp 217
00:59:03.295414 IP tom-Latitude-3570.57976 > 167.99.216.145.8333: tcp 0
00:59:03.295569 IP tom-Latitude-3570.57976 > 167.99.216.145.8333: tcp 24
00:59:03.295577 IP tom-Latitude-3570.57976 > 167.99.216.145.8333: tcp 109
00:59:03.307011 IP 167.99.216.145.8333 > tom-Latitude-3570.57976: tcp 0
00:59:03.313088 IP c-185-45-236-223.customer.ggaweb.ch.8333 > tom-Latitude-3570.49070: tcp 0
00:59:03.324160 IP c-185-45-236-223.customer.ggaweb.ch.8333 > tom-Latitude-3570.49070: tcp 0
00:59:03.324164 IP 167.99.216.145.8333 > tom-Latitude-3570.57976: tcp 0
00:59:03.386186 IP 167.99.216.145.8333 > tom-Latitude-3570.57976: tcp 24
00:59:03.386873 IP 167.99.216.145.8333 > tom-Latitude-3570.57976: tcp 223
00:59:03.386880 IP 167.99.216.145.8333 > tom-Latitude-3570.57976: tcp 24
00:59:03.386883 IP 167.99.216.145.8333 > tom-Latitude-3570.57976: tcp 407
00:59:03.386886 IP 167.99.216.145.8333 > tom-Latitude-3570.57976: tcp 24
00:59:03.386888 IP 167.99.216.145.8333 > tom-Latitude-3570.57976: tcp 247
00:59:03.386897 IP tom-Latitude-3570.57976 > 167.99.216.145.8333: tcp 0
00:59:03.407023 IP c-185-45-236-223.customer.ggaweb.ch.8333 > tom-Latitude-3570.49070: tcp 24
00:59:03.407029 IP tom-Latitude-3570.49070 > c-185-45-236-223.customer.ggaweb.ch.8333: tcp 0
00:59:03.407760 IP c-185-45-236-223.customer.ggaweb.ch.8333 > tom-Latitude-3570.49070: tcp 919
00:59:03.407768 IP tom-Latitude-3570.49070 > c-185-45-236-223.customer.ggaweb.ch.8333: tcp 0
00:59:03.407774 IP c-185-45-236-223.customer.ggaweb.ch.8333 > tom-Latitude-3570.49070: tcp 518
00:59:03.407777 IP tom-Latitude-3570.49070 > c-185-45-236-223.customer.ggaweb.ch.8333: tcp 0
00:59:03.509518 IP tom-Latitude-3570.60988 > 81.198.101.144.8333: tcp 24
00:59:03.509596 IP tom-Latitude-3570.42516 > 2.56.9.15.8333: tcp 24
00:59:03.510365 IP tom-Latitude-3570.42516 > 2.56.9.15.8333: tcp 361
00:59:03.510371 IP tom-Latitude-3570.60988 > 81.198.101.144.8333: tcp 253
00:59:03.542436 IP 81.198.101.144.8333 > tom-Latitude-3570.60988: tcp 0
00:59:03.550879 IP 2.56.9.15.8333 > tom-Latitude-3570.42516: tcp 0
00:59:03.558805 IP 81.198.101.144.8333 > tom-Latitude-3570.60988: tcp 0
00:59:03.809985 IP tom-Latitude-3570.57976 > 167.99.216.145.8333: tcp 24
00:59:03.818968 IP tom-Latitude-3570.57976 > 167.99.216.145.8333: tcp 73
00:59:03.819560 IP 81.198.101.144.8333 > tom-Latitude-3570.60988: tcp 24
00:59:03.819571 IP 81.198.101.144.8333 > tom-Latitude-3570.60988: tcp 37
00:59:03.819573 IP 81.198.101.144.8333 > tom-Latitude-3570.60988: tcp 24
00:59:03.819576 IP 81.198.101.144.8333 > tom-Latitude-3570.60988: tcp 73
00:59:03.819586 IP tom-Latitude-3570.60988 > 81.198.101.144.8333: tcp 0
00:59:03.819693 IP tom-Latitude-3570.60988 > 81.198.101.144.8333: tcp 24
00:59:03.820504 IP tom-Latitude-3570.60988 > 81.198.101.144.8333: tcp 494
00:59:03.868991 IP 167.99.216.145.8333 > tom-Latitude-3570.57976: tcp 0
00:59:03.871791 IP 81.198.101.144.8333 > tom-Latitude-3570.60988: tcp 0
00:59:03.871796 IP 81.198.101.144.8333 > tom-Latitude-3570.60988: tcp 0
00:59:04.620642 IP tom-Latitude-3570.56714 > ns3113832.ip-54-38-177.eu.8333: tcp 24
00:59:04.623731 IP tom-Latitude-3570.56714 > ns3113832.ip-54-38-177.eu.8333: tcp 253
00:59:04.676557 IP c-185-45-236-223.customer.ggaweb.ch.8333 > tom-Latitude-3570.49070: tcp 24
00:59:04.676569 IP tom-Latitude-3570.49070 > c-185-45-236-223.customer.ggaweb.ch.8333: tcp 0
00:59:04.676576 IP c-185-45-236-223.customer.ggaweb.ch.8333 > tom-Latitude-3570.49070: tcp 253
00:59:04.676578 IP tom-Latitude-3570.49070 > c-185-45-236-223.customer.ggaweb.ch.8333: tcp 0
00:59:04.676581 IP ns3113832.ip-54-38-177.eu.8333 > tom-Latitude-3570.56714: tcp 0
00:59:04.676727 IP tom-Latitude-3570.49070 > c-185-45-236-223.customer.ggaweb.ch.8333: tcp 24
00:59:04.677713 IP tom-Latitude-3570.49070 > c-185-45-236-223.customer.ggaweb.ch.8333: tcp 145
00:59:04.681326 IP ns3113832.ip-54-38-177.eu.8333 > tom-Latitude-3570.56714: tcp 0
00:59:04.721211 IP c-185-45-236-223.customer.ggaweb.ch.8333 > tom-Latitude-3570.49070: tcp 0
00:59:04.721216 IP c-185-45-236-223.customer.ggaweb.ch.8333 > tom-Latitude-3570.49070: tcp 0
00:59:04.906702 IP c-185-45-236-223.customer.ggaweb.ch.8333 > tom-Latitude-3570.49070: tcp 24
00:59:04.906728 IP c-185-45-236-223.customer.ggaweb.ch.8333 > tom-Latitude-3570.49070: tcp 1211
00:59:04.906779 IP tom-Latitude-3570.49070 > c-185-45-236-223.customer.ggaweb.ch.8333: tcp 0
00:59:05.725822 IP 2.56.9.15.8333 > tom-Latitude-3570.42516: tcp 24
00:59:05.725846 IP tom-Latitude-3570.42516 > 2.56.9.15.8333: tcp 0
00:59:05.725876 IP 2.56.9.15.8333 > tom-Latitude-3570.42516: tcp 253
00:59:05.725881 IP tom-Latitude-3570.42516 > 2.56.9.15.8333: tcp 0
00:59:05.725885 IP 2.56.9.15.8333 > tom-Latitude-3570.42516: tcp 253
00:59:05.725888 IP tom-Latitude-3570.42516 > 2.56.9.15.8333: tcp 0
00:59:05.726074 IP tom-Latitude-3570.42516 > 2.56.9.15.8333: tcp 24
00:59:05.727185 IP tom-Latitude-3570.42516 > 2.56.9.15.8333: tcp 73
00:59:05.770575 IP 2.56.9.15.8333 > tom-Latitude-3570.42516: tcp 0
00:59:05.926438 IP tom-Latitude-3570.56714 > ns3113832.ip-54-38-177.eu.8333: tcp 24
00:59:05.928111 IP tom-Latitude-3570.56714 > ns3113832.ip-54-38-177.eu.8333: tcp 145
00:59:05.937974 IP 2.56.9.15.8333 > tom-Latitude-3570.42516: tcp 24
00:59:05.938604 IP 2.56.9.15.8333 > tom-Latitude-3570.42516: tcp 257
00:59:05.938610 IP 2.56.9.15.8333 > tom-Latitude-3570.42516: tcp 24
00:59:05.938613 IP 2.56.9.15.8333 > tom-Latitude-3570.42516: tcp 225
00:59:05.938632 IP tom-Latitude-3570.42516 > 2.56.9.15.8333: tcp 0
00:59:05.949804 IP ns3113832.ip-54-38-177.eu.8333 > tom-Latitude-3570.56714: tcp 0
00:59:05.957581 IP ns3113832.ip-54-38-177.eu.8333 > tom-Latitude-3570.56714: tcp 0
00:59:06.039859 IP tom-Latitude-3570.39282 > default-rdns.vocus.co.nz.8333: tcp 24
00:59:06.040678 IP tom-Latitude-3570.39282 > default-rdns.vocus.co.nz.8333: tcp 469
00:59:06.072643 IP default-rdns.vocus.co.nz.8333 > tom-Latitude-3570.39282: tcp 0
00:59:06.080553 IP default-rdns.vocus.co.nz.8333 > tom-Latitude-3570.39282: tcp 0
00:59:06.440562 IP tom-Latitude-3570.57976 > 167.99.216.145.8333: tcp 24
00:59:06.440671 IP tom-Latitude-3570.60470 > bb42-60-217-183.singnet.com.sg.8333: tcp 24
00:59:06.442629 IP tom-Latitude-3570.57976 > 167.99.216.145.8333: tcp 217
00:59:06.443636 IP tom-Latitude-3570.60470 > bb42-60-217-183.singnet.com.sg.8333: tcp 469
00:59:06.488031 IP vmi195435.contaboserver.net.8333 > tom-Latitude-3570.39110: tcp 24
00:59:06.493439 IP vmi195435.contaboserver.net.8333 > tom-Latitude-3570.39110: tcp 1117
00:59:06.493501 IP tom-Latitude-3570.39110 > vmi195435.contaboserver.net.8333: tcp 0
00:59:06.493931 IP tom-Latitude-3570.39110 > vmi195435.contaboserver.net.8333: tcp 24
00:59:06.495101 IP tom-Latitude-3570.39110 > vmi195435.contaboserver.net.8333: tcp 217
00:59:06.505198 IP 167.99.216.145.8333 > tom-Latitude-3570.57976: tcp 0
00:59:06.505791 IP bb42-60-217-183.singnet.com.sg.8333 > tom-Latitude-3570.60470: tcp 0
00:59:06.529705 IP vmi195435.contaboserver.net.8333 > tom-Latitude-3570.39110: tcp 0
00:59:06.534078 IP vmi195435.contaboserver.net.8333 > tom-Latitude-3570.39110: tcp 0
00:59:06.594123 IP tom-Latitude-3570.49070 > c-185-45-236-223.customer.ggaweb.ch.8333: tcp 24
00:59:06.595067 IP tom-Latitude-3570.49070 > c-185-45-236-223.customer.ggaweb.ch.8333: tcp 73
00:59:06.608983 IP vmi195435.contaboserver.net.8333 > tom-Latitude-3570.39110: tcp 24
00:59:06.612226 IP vmi195435.contaboserver.net.8333 > tom-Latitude-3570.39110: tcp 386
00:59:06.612244 IP vmi195435.contaboserver.net.8333 > tom-Latitude-3570.39110: tcp 24
00:59:06.612247 IP vmi195435.contaboserver.net.8333 > tom-Latitude-3570.39110: tcp 216
00:59:06.612249 IP vmi195435.contaboserver.net.8333 > tom-Latitude-3570.39110: tcp 24
00:59:06.612251 IP vmi195435.contaboserver.net.8333 > tom-Latitude-3570.39110: tcp 225
00:59:06.612253 IP vmi195435.contaboserver.net.8333 > tom-Latitude-3570.39110: tcp 24
00:59:06.612272 IP vmi195435.contaboserver.net.8333 > tom-Latitude-3570.39110: tcp 226
00:59:06.612274 IP vmi195435.contaboserver.net.8333 > tom-Latitude-3570.39110: tcp 24
00:59:06.612276 IP vmi195435.contaboserver.net.8333 > tom-Latitude-3570.39110: tcp 224
00:59:06.612337 IP tom-Latitude-3570.39110 > vmi195435.contaboserver.net.8333: tcp 0
00:59:06.620859 IP c-185-45-236-223.customer.ggaweb.ch.8333 > tom-Latitude-3570.49070: tcp 0
00:59:06.629015 IP c-185-45-236-223.customer.ggaweb.ch.8333 > tom-Latitude-3570.49070: tcp 0
00:59:06.686458 IP vmi195435.contaboserver.net.8333 > tom-Latitude-3570.39110: tcp 248
00:59:06.727902 IP tom-Latitude-3570.39110 > vmi195435.contaboserver.net.8333: tcp 0
00:59:06.789553 IP tom-Latitude-3570.39282 > default-rdns.vocus.co.nz.8333: tcp 24
00:59:06.790498 IP tom-Latitude-3570.39282 > default-rdns.vocus.co.nz.8333: tcp 217
00:59:06.822954 IP default-rdns.vocus.co.nz.8333 > tom-Latitude-3570.39282: tcp 0
00:59:06.831135 IP default-rdns.vocus.co.nz.8333 > tom-Latitude-3570.39282: tcp 0
00:59:07.090607 IP tom-Latitude-3570.57976 > 167.99.216.145.8333: tcp 24
00:59:07.092664 IP tom-Latitude-3570.57976 > 167.99.216.145.8333: tcp 217
00:59:07.141931 IP 167.99.216.145.8333 > tom-Latitude-3570.57976: tcp 0
00:59:07.157399 IP default-rdns.vocus.co.nz.8333 > tom-Latitude-3570.39282: tcp 24
00:59:07.157983 IP default-rdns.vocus.co.nz.8333 > tom-Latitude-3570.39282: tcp 37
00:59:07.158113 IP tom-Latitude-3570.39282 > default-rdns.vocus.co.nz.8333: tcp 0
00:59:07.158204 IP tom-Latitude-3570.39282 > default-rdns.vocus.co.nz.8333: tcp 24
00:59:07.159759 IP tom-Latitude-3570.39282 > default-rdns.vocus.co.nz.8333: tcp 224
00:59:07.202070 IP default-rdns.vocus.co.nz.8333 > tom-Latitude-3570.39282: tcp 0
00:59:07.202084 IP default-rdns.vocus.co.nz.8333 > tom-Latitude-3570.39282: tcp 0
00:59:07.559549 IP tom-Latitude-3570.60988 > 81.198.101.144.8333: tcp 24
00:59:07.561836 IP tom-Latitude-3570.60988 > 81.198.101.144.8333: tcp 433
00:59:07.621994 IP 81.198.101.144.8333 > tom-Latitude-3570.60988: tcp 0
00:59:07.656806 IP 81.198.101.144.8333 > tom-Latitude-3570.60988: tcp 0
00:59:07.659990 IP tom-Latitude-3570.60470 > bb42-60-217-183.singnet.com.sg.8333: tcp 24
00:59:07.660928 IP tom-Latitude-3570.60470 > bb42-60-217-183.singnet.com.sg.8333: tcp 217
00:59:07.700611 IP bb42-60-217-183.singnet.com.sg.8333 > tom-Latitude-3570.60470: tcp 0
00:59:08.161074 IP tom-Latitude-3570.56714 > ns3113832.ip-54-38-177.eu.8333: tcp 24
00:59:08.162993 IP tom-Latitude-3570.56714 > ns3113832.ip-54-38-177.eu.8333: tcp 289
00:59:08.163551 IP default-rdns.vocus.co.nz.8333 > tom-Latitude-3570.39282: tcp 24
00:59:08.163563 IP default-rdns.vocus.co.nz.8333 > tom-Latitude-3570.39282: tcp 37
00:59:08.163565 IP default-rdns.vocus.co.nz.8333 > tom-Latitude-3570.39282: tcp 37
00:59:08.163569 IP tom-Latitude-3570.39282 > default-rdns.vocus.co.nz.8333: tcp 0
00:59:08.200335 IP ns3113832.ip-54-38-177.eu.8333 > tom-Latitude-3570.56714: tcp 0
00:59:08.201147 IP ns3113832.ip-54-38-177.eu.8333 > tom-Latitude-3570.56714: tcp 0
00:59:09.968418 IP tom-Latitude-3570.49070 > c-185-45-236-223.customer.ggaweb.ch.8333: tcp 24
00:59:09.970505 IP tom-Latitude-3570.49070 > c-185-45-236-223.customer.ggaweb.ch.8333: tcp 217
00:59:10.005838 IP vmi195435.contaboserver.net.8333 > tom-Latitude-3570.39110: tcp 24
00:59:10.005863 IP tom-Latitude-3570.39110 > vmi195435.contaboserver.net.8333: tcp 0
00:59:10.005896 IP vmi195435.contaboserver.net.8333 > tom-Latitude-3570.39110: tcp 253
00:59:10.005901 IP tom-Latitude-3570.39110 > vmi195435.contaboserver.net.8333: tcp 0
00:59:10.005905 IP vmi195435.contaboserver.net.8333 > tom-Latitude-3570.39110: tcp 253
00:59:10.005907 IP tom-Latitude-3570.39110 > vmi195435.contaboserver.net.8333: tcp 0
00:59:10.006168 IP tom-Latitude-3570.39110 > vmi195435.contaboserver.net.8333: tcp 24
00:59:10.007369 IP tom-Latitude-3570.39110 > vmi195435.contaboserver.net.8333: tcp 253
00:59:10.017243 IP c-185-45-236-223.customer.ggaweb.ch.8333 > tom-Latitude-3570.49070: tcp 0
00:59:10.025232 IP c-185-45-236-223.customer.ggaweb.ch.8333 > tom-Latitude-3570.49070: tcp 0
00:59:10.033409 IP vmi195435.contaboserver.net.8333 > tom-Latitude-3570.39110: tcp 0
00:59:10.033938 IP vmi195435.contaboserver.net.8333 > tom-Latitude-3570.39110: tcp 0
00:59:10.113483 IP vmi195435.contaboserver.net.8333 > tom-Latitude-3570.39110: tcp 24
00:59:10.114381 IP vmi195435.contaboserver.net.8333 > tom-Latitude-3570.39110: tcp 224
00:59:10.114398 IP vmi195435.contaboserver.net.8333 > tom-Latitude-3570.39110: tcp 24
00:59:10.114400 IP vmi195435.contaboserver.net.8333 > tom-Latitude-3570.39110: tcp 224
00:59:10.114402 IP vmi195435.contaboserver.net.8333 > tom-Latitude-3570.39110: tcp 24
00:59:10.114404 IP vmi195435.contaboserver.net.8333 > tom-Latitude-3570.39110: tcp 225
00:59:10.114407 IP vmi195435.contaboserver.net.8333 > tom-Latitude-3570.39110: tcp 24
00:59:10.114409 IP vmi195435.contaboserver.net.8333 > tom-Latitude-3570.39110: tcp 225
00:59:10.114411 IP vmi195435.contaboserver.net.8333 > tom-Latitude-3570.39110: tcp 24
00:59:10.114430 IP vmi195435.contaboserver.net.8333 > tom-Latitude-3570.39110: tcp 418
00:59:10.114495 IP tom-Latitude-3570.39110 > vmi195435.contaboserver.net.8333: tcp 0
00:59:10.216861 IP vmi195435.contaboserver.net.8333 > tom-Latitude-3570.39110: tcp 495
00:59:10.259780 IP tom-Latitude-3570.39110 > vmi195435.contaboserver.net.8333: tcp 0
00:59:10.418226 IP tom-Latitude-3570.49070 > c-185-45-236-223.customer.ggaweb.ch.8333: tcp 24
00:59:10.418288 IP tom-Latitude-3570.60988 > 81.198.101.144.8333: tcp 24
00:59:10.420419 IP tom-Latitude-3570.60988 > 81.198.101.144.8333: tcp 253
00:59:10.420430 IP tom-Latitude-3570.49070 > c-185-45-236-223.customer.ggaweb.ch.8333: tcp 253
00:59:10.443441 IP c-185-45-236-223.customer.ggaweb.ch.8333 > tom-Latitude-3570.49070: tcp 24
00:59:10.454039 IP c-185-45-236-223.customer.ggaweb.ch.8333 > tom-Latitude-3570.49070: tcp 253
00:59:10.454106 IP tom-Latitude-3570.49070 > c-185-45-236-223.customer.ggaweb.ch.8333: tcp 0
00:59:10.454512 IP 81.198.101.144.8333 > tom-Latitude-3570.60988: tcp 0
00:59:10.456753 IP c-185-45-236-223.customer.ggaweb.ch.8333 > tom-Latitude-3570.49070: tcp 0
00:59:10.460776 IP 81.198.101.144.8333 > tom-Latitude-3570.60988: tcp 0
00:59:10.461361 IP c-185-45-236-223.customer.ggaweb.ch.8333 > tom-Latitude-3570.49070: tcp 0
00:59:10.536172 IP 2.56.9.15.8333 > tom-Latitude-3570.42516: tcp 24
00:59:10.538730 IP 2.56.9.15.8333 > tom-Latitude-3570.42516: tcp 469
00:59:10.538796 IP tom-Latitude-3570.42516 > 2.56.9.15.8333: tcp 0
00:59:10.680024 IP ns3113832.ip-54-38-177.eu.8333 > tom-Latitude-3570.56714: tcp 24
00:59:10.680621 IP ns3113832.ip-54-38-177.eu.8333 > tom-Latitude-3570.56714: tcp 253
00:59:10.680687 IP tom-Latitude-3570.56714 > ns3113832.ip-54-38-177.eu.8333: tcp 0
00:59:10.881704 IP tom-Latitude-3570.60470 > bb42-60-217-183.singnet.com.sg.8333: tcp 24
00:59:10.883791 IP tom-Latitude-3570.60470 > bb42-60-217-183.singnet.com.sg.8333: tcp 253
00:59:10.913035 IP vmi195435.contaboserver.net.8333 > tom-Latitude-3570.39110: tcp 24
00:59:10.913061 IP tom-Latitude-3570.39110 > vmi195435.contaboserver.net.8333: tcp 0
00:59:10.913078 IP vmi195435.contaboserver.net.8333 > tom-Latitude-3570.39110: tcp 37
00:59:10.913081 IP tom-Latitude-3570.39110 > vmi195435.contaboserver.net.8333: tcp 0
00:59:10.913260 IP tom-Latitude-3570.39110 > vmi195435.contaboserver.net.8333: tcp 24
00:59:10.914551 IP tom-Latitude-3570.39110 > vmi195435.contaboserver.net.8333: tcp 37
00:59:10.921928 IP bb42-60-217-183.singnet.com.sg.8333 > tom-Latitude-3570.60470: tcp 0
00:59:10.939812 IP vmi195435.contaboserver.net.8333 > tom-Latitude-3570.39110: tcp 0
00:59:10.940397 IP vmi195435.contaboserver.net.8333 > tom-Latitude-3570.39110: tcp 0
00:59:11.020024 IP vmi195435.contaboserver.net.8333 > tom-Latitude-3570.39110: tcp 24
00:59:11.020043 IP vmi195435.contaboserver.net.8333 > tom-Latitude-3570.39110: tcp 223
00:59:11.020087 IP tom-Latitude-3570.39110 > vmi195435.contaboserver.net.8333: tcp 0
00:59:12.023673 IP tom-Latitude-3570.49070 > c-185-45-236-223.customer.ggaweb.ch.8333: tcp 24
00:59:12.025742 IP tom-Latitude-3570.49070 > c-185-45-236-223.customer.ggaweb.ch.8333: tcp 37
00:59:12.083027 IP c-185-45-236-223.customer.ggaweb.ch.8333 > tom-Latitude-3570.49070: tcp 0
00:59:12.091022 IP c-185-45-236-223.customer.ggaweb.ch.8333 > tom-Latitude-3570.49070: tcp 0
00:59:12.224379 IP tom-Latitude-3570.42516 > 2.56.9.15.8333: tcp 24
00:59:12.227071 IP tom-Latitude-3570.42516 > 2.56.9.15.8333: tcp 37
00:59:12.280499 IP 2.56.9.15.8333 > tom-Latitude-3570.42516: tcp 0
00:59:12.321358 IP vmi195435.contaboserver.net.8333 > tom-Latitude-3570.39110: tcp 24
00:59:12.321379 IP vmi195435.contaboserver.net.8333 > tom-Latitude-3570.39110: tcp 109
00:59:12.321420 IP tom-Latitude-3570.39110 > vmi195435.contaboserver.net.8333: tcp 0
00:59:12.321626 IP tom-Latitude-3570.39110 > vmi195435.contaboserver.net.8333: tcp 24
00:59:12.322898 IP tom-Latitude-3570.39110 > vmi195435.contaboserver.net.8333: tcp 109
00:59:12.336747 IP default-rdns.vocus.co.nz.8333 > tom-Latitude-3570.39282: tcp 24
00:59:12.336769 IP tom-Latitude-3570.39282 > default-rdns.vocus.co.nz.8333: tcp 0
00:59:12.337321 IP default-rdns.vocus.co.nz.8333 > tom-Latitude-3570.39282: tcp 289
00:59:12.337347 IP tom-Latitude-3570.39282 > default-rdns.vocus.co.nz.8333: tcp 0
00:59:12.349002 IP vmi195435.contaboserver.net.8333 > tom-Latitude-3570.39110: tcp 0
00:59:12.356451 IP vmi195435.contaboserver.net.8333 > tom-Latitude-3570.39110: tcp 0
00:59:12.438013 IP tom-Latitude-3570.56714 > ns3113832.ip-54-38-177.eu.8333: tcp 24
00:59:12.438158 IP vmi195435.contaboserver.net.8333 > tom-Latitude-3570.39110: tcp 24
00:59:12.438174 IP vmi195435.contaboserver.net.8333 > tom-Latitude-3570.39110: tcp 1448
00:59:12.438179 IP vmi195435.contaboserver.net.8333 > tom-Latitude-3570.39110: tcp 205
00:59:12.438183 IP vmi195435.contaboserver.net.8333 > tom-Latitude-3570.39110: tcp 24
00:59:12.438185 IP vmi195435.contaboserver.net.8333 > tom-Latitude-3570.39110: tcp 802
00:59:12.438188 IP vmi195435.contaboserver.net.8333 > tom-Latitude-3570.39110: tcp 24
00:59:12.438192 IP vmi195435.contaboserver.net.8333 > tom-Latitude-3570.39110: tcp 635
00:59:12.438202 IP tom-Latitude-3570.39110 > vmi195435.contaboserver.net.8333: tcp 0
00:59:12.438748 IP tom-Latitude-3570.56714 > ns3113832.ip-54-38-177.eu.8333: tcp 37
00:59:12.470547 IP ns3113832.ip-54-38-177.eu.8333 > tom-Latitude-3570.56714: tcp 0
00:59:12.471153 IP ns3113832.ip-54-38-177.eu.8333 > tom-Latitude-3570.56714: tcp 0
00:59:12.479792 IP tom-Latitude-3570.39110 > vmi195435.contaboserver.net.8333: tcp 0
00:59:12.481785 IP 167.99.216.145.8333 > tom-Latitude-3570.57976: tcp 24
00:59:12.481806 IP 167.99.216.145.8333 > tom-Latitude-3570.57976: tcp 397
00:59:12.481852 IP tom-Latitude-3570.57976 > 167.99.216.145.8333: tcp 0
00:59:12.582488 IP tom-Latitude-3570.42516 > 2.56.9.15.8333: tcp 24
00:59:12.584209 IP tom-Latitude-3570.42516 > 2.56.9.15.8333: tcp 109
00:59:12.620505 IP 2.56.9.15.8333 > tom-Latitude-3570.42516: tcp 0
00:59:12.791499 IP 2.56.9.15.8333 > tom-Latitude-3570.42516: tcp 24
00:59:12.791518 IP 2.56.9.15.8333 > tom-Latitude-3570.42516: tcp 37
00:59:12.791611 IP tom-Latitude-3570.42516 > 2.56.9.15.8333: tcp 0
00:59:12.791798 IP tom-Latitude-3570.49070 > c-185-45-236-223.customer.ggaweb.ch.8333: tcp 24
00:59:12.791841 IP tom-Latitude-3570.42516 > 2.56.9.15.8333: tcp 24
00:59:12.793811 IP tom-Latitude-3570.42516 > 2.56.9.15.8333: tcp 635
00:59:12.793821 IP tom-Latitude-3570.49070 > c-185-45-236-223.customer.ggaweb.ch.8333: tcp 109
00:59:12.838615 IP c-185-45-236-223.customer.ggaweb.ch.8333 > tom-Latitude-3570.49070: tcp 0
00:59:12.839248 IP 2.56.9.15.8333 > tom-Latitude-3570.42516: tcp 0
00:59:12.839262 IP c-185-45-236-223.customer.ggaweb.ch.8333 > tom-Latitude-3570.49070: tcp 0
00:59:12.892087 IP tom-Latitude-3570.60470 > bb42-60-217-183.singnet.com.sg.8333: tcp 24
00:59:12.893655 IP tom-Latitude-3570.60470 > bb42-60-217-183.singnet.com.sg.8333: tcp 145
00:59:12.930486 IP bb42-60-217-183.singnet.com.sg.8333 > tom-Latitude-3570.60470: tcp 0
00:59:13.393836 IP tom-Latitude-3570.60988 > 81.198.101.144.8333: tcp 24
00:59:13.395910 IP tom-Latitude-3570.60988 > 81.198.101.144.8333: tcp 145
00:59:13.440135 IP ns3113832.ip-54-38-177.eu.8333 > tom-Latitude-3570.56714: tcp 24
00:59:13.440736 IP ns3113832.ip-54-38-177.eu.8333 > tom-Latitude-3570.56714: tcp 109
00:59:13.440868 IP tom-Latitude-3570.56714 > ns3113832.ip-54-38-177.eu.8333: tcp 0
00:59:13.443012 IP 81.198.101.144.8333 > tom-Latitude-3570.60988: tcp 0
00:59:13.449326 IP 81.198.101.144.8333 > tom-Latitude-3570.60988: tcp 0
00:59:14.942070 IP vmi195435.contaboserver.net.8333 > tom-Latitude-3570.39110: tcp 24
00:59:14.942095 IP tom-Latitude-3570.39110 > vmi195435.contaboserver.net.8333: tcp 0
00:59:14.942128 IP vmi195435.contaboserver.net.8333 > tom-Latitude-3570.39110: tcp 217
00:59:14.942132 IP tom-Latitude-3570.39110 > vmi195435.contaboserver.net.8333: tcp 0
00:59:14.942136 IP vmi195435.contaboserver.net.8333 > tom-Latitude-3570.39110: tcp 217
00:59:14.942138 IP tom-Latitude-3570.39110 > vmi195435.contaboserver.net.8333: tcp 0
00:59:14.942140 IP 2.56.9.15.8333 > tom-Latitude-3570.42516: tcp 24
00:59:14.942144 IP 2.56.9.15.8333 > tom-Latitude-3570.42516: tcp 217
00:59:14.942146 IP bb42-60-217-183.singnet.com.sg.8333 > tom-Latitude-3570.60470: tcp 24
00:59:14.942149 IP bb42-60-217-183.singnet.com.sg.8333 > tom-Latitude-3570.60470: tcp 145
00:59:14.942151 IP bb42-60-217-183.singnet.com.sg.8333 > tom-Latitude-3570.60470: tcp 145
00:59:14.942153 IP tom-Latitude-3570.60470 > bb42-60-217-183.singnet.com.sg.8333: tcp 0
00:59:14.942225 IP tom-Latitude-3570.42516 > 2.56.9.15.8333: tcp 0
00:59:14.942400 IP tom-Latitude-3570.39110 > vmi195435.contaboserver.net.8333: tcp 24
00:59:14.943544 IP tom-Latitude-3570.39110 > vmi195435.contaboserver.net.8333: tcp 217
00:59:14.962701 IP 2.56.9.15.8333 > tom-Latitude-3570.42516: tcp 217
00:59:14.962720 IP tom-Latitude-3570.42516 > 2.56.9.15.8333: tcp 0
00:59:14.980572 IP vmi195435.contaboserver.net.8333 > tom-Latitude-3570.39110: tcp 0
00:59:14.981318 IP vmi195435.contaboserver.net.8333 > tom-Latitude-3570.39110: tcp 0
00:59:15.061080 IP vmi195435.contaboserver.net.8333 > tom-Latitude-3570.39110: tcp 24
00:59:15.061955 IP vmi195435.contaboserver.net.8333 > tom-Latitude-3570.39110: tcp 226
00:59:15.061972 IP vmi195435.contaboserver.net.8333 > tom-Latitude-3570.39110: tcp 24
00:59:15.061975 IP vmi195435.contaboserver.net.8333 > tom-Latitude-3570.39110: tcp 223
00:59:15.061977 IP vmi195435.contaboserver.net.8333 > tom-Latitude-3570.39110: tcp 24
00:59:15.061979 IP vmi195435.contaboserver.net.8333 > tom-Latitude-3570.39110: tcp 247
00:59:15.061981 IP vmi195435.contaboserver.net.8333 > tom-Latitude-3570.39110: tcp 24
00:59:15.061983 IP vmi195435.contaboserver.net.8333 > tom-Latitude-3570.39110: tcp 248
