03:55:13.399984 IP tom-Latitude-3570.57976 > 167.99.216.145.8333: tcp 24
03:55:13.402994 IP tom-Latitude-3570.57976 > 167.99.216.145.8333: tcp 37
03:55:13.426637 IP 167.99.216.145.8333 > tom-Latitude-3570.57976: tcp 0
03:55:13.434645 IP 167.99.216.145.8333 > tom-Latitude-3570.57976: tcp 0
03:55:13.801272 IP tom-Latitude-3570.56714 > ns3113832.ip-54-38-177.eu.8333: tcp 24
03:55:13.803520 IP tom-Latitude-3570.56714 > ns3113832.ip-54-38-177.eu.8333: tcp 397
03:55:13.846972 IP ns3113832.ip-54-38-177.eu.8333 > tom-Latitude-3570.56714: tcp 0
03:55:13.854364 IP ns3113832.ip-54-38-177.eu.8333 > tom-Latitude-3570.56714: tcp 0
03:55:13.901669 IP tom-Latitude-3570.39110 > vmi195435.contaboserver.net.8333: tcp 24
03:55:13.901719 IP tom-Latitude-3570.42516 > 2.56.9.15.8333: tcp 24
03:55:13.903219 IP tom-Latitude-3570.39110 > vmi195435.contaboserver.net.8333: tcp 37
03:55:13.904167 IP tom-Latitude-3570.42516 > 2.56.9.15.8333: tcp 31
03:55:13.937859 IP 2.56.9.15.8333 > tom-Latitude-3570.42516: tcp 0
03:55:13.944992 IP vmi195435.contaboserver.net.8333 > tom-Latitude-3570.39110: tcp 0
03:55:13.945007 IP vmi195435.contaboserver.net.8333 > tom-Latitude-3570.39110: tcp 0
03:55:13.945009 IP 2.56.9.15.8333 > tom-Latitude-3570.42516: tcp 0
03:55:15.105637 IP tom-Latitude-3570.49070 > c-185-45-236-223.customer.ggaweb.ch.8333: tcp 24
03:55:15.107871 IP tom-Latitude-3570.49070 > c-185-45-236-223.customer.ggaweb.ch.8333: tcp 145
03:55:15.156328 IP 2.56.9.15.8333 > tom-Latitude-3570.42516: tcp 24
03:55:15.156353 IP tom-Latitude-3570.42516 > 2.56.9.15.8333: tcp 0
03:55:15.156385 IP 2.56.9.15.8333 > tom-Latitude-3570.42516: tcp 253
03:55:15.156390 IP tom-Latitude-3570.42516 > 2.56.9.15.8333: tcp 0
03:55:15.156394 IP 81.198.101.144.8333 > tom-Latitude-3570.60988: tcp 24
03:55:15.156398 IP 81.198.101.144.8333 > tom-Latitude-3570.60988: tcp 397
03:55:15.156400 IP 2.56.9.15.8333 > tom-Latitude-3570.42516: tcp 24
03:55:15.156402 IP tom-Latitude-3570.42516 > 2.56.9.15.8333: tcp 0
03:55:15.156406 IP 2.56.9.15.8333 > tom-Latitude-3570.42516: tcp 37
03:55:15.156422 IP tom-Latitude-3570.42516 > 2.56.9.15.8333: tcp 0
03:55:15.156479 IP tom-Latitude-3570.60988 > 81.198.101.144.8333: tcp 0
03:55:15.156646 IP tom-Latitude-3570.60988 > 81.198.101.144.8333: tcp 24
03:55:15.156768 IP tom-Latitude-3570.42516 > 2.56.9.15.8333: tcp 24
03:55:15.163055 IP tom-Latitude-3570.60988 > 81.198.101.144.8333: tcp 253
03:55:15.163640 IP tom-Latitude-3570.42516 > 2.56.9.15.8333: tcp 37
03:55:15.165740 IP c-185-45-236-223.customer.ggaweb.ch.8333 > tom-Latitude-3570.49070: tcp 0
03:55:15.194248 IP 81.198.101.144.8333 > tom-Latitude-3570.60988: tcp 397
03:55:15.194268 IP tom-Latitude-3570.60988 > 81.198.101.144.8333: tcp 0
03:55:15.196517 IP 81.198.101.144.8333 > tom-Latitude-3570.60988: tcp 0
03:55:15.197362 IP 2.56.9.15.8333 > tom-Latitude-3570.42516: tcp 0
03:55:15.197377 IP 81.198.101.144.8333 > tom-Latitude-3570.60988: tcp 0
03:55:15.197381 IP 2.56.9.15.8333 > tom-Latitude-3570.42516: tcp 0
03:55:15.286237 IP 81.198.101.144.8333 > tom-Latitude-3570.60988: tcp 24
03:55:15.286254 IP tom-Latitude-3570.60988 > 81.198.101.144.8333: tcp 0
03:55:15.287268 IP 81.198.101.144.8333 > tom-Latitude-3570.60988: tcp 249
03:55:15.287291 IP tom-Latitude-3570.60988 > 81.198.101.144.8333: tcp 0
03:55:15.287322 IP 81.198.101.144.8333 > tom-Latitude-3570.60988: tcp 24
03:55:15.287325 IP tom-Latitude-3570.60988 > 81.198.101.144.8333: tcp 0
03:55:15.287328 IP 81.198.101.144.8333 > tom-Latitude-3570.60988: tcp 226
03:55:15.287330 IP tom-Latitude-3570.60988 > 81.198.101.144.8333: tcp 0
03:55:15.287333 IP 81.198.101.144.8333 > tom-Latitude-3570.60988: tcp 24
03:55:15.287349 IP tom-Latitude-3570.60988 > 81.198.101.144.8333: tcp 0
03:55:15.287352 IP 81.198.101.144.8333 > tom-Latitude-3570.60988: tcp 255
03:55:15.287355 IP tom-Latitude-3570.60988 > 81.198.101.144.8333: tcp 0
03:55:15.287358 IP 81.198.101.144.8333 > tom-Latitude-3570.60988: tcp 24
03:55:15.287360 IP tom-Latitude-3570.60988 > 81.198.101.144.8333: tcp 0
03:55:15.287370 IP 81.198.101.144.8333 > tom-Latitude-3570.60988: tcp 256
03:55:15.287375 IP tom-Latitude-3570.60988 > 81.198.101.144.8333: tcp 0
03:55:15.287381 IP 81.198.101.144.8333 > tom-Latitude-3570.60988: tcp 24
03:55:15.287386 IP 81.198.101.144.8333 > tom-Latitude-3570.60988: tcp 338
03:55:15.287389 IP tom-Latitude-3570.60988 > 81.198.101.144.8333: tcp 0
03:55:15.287389 IP 81.198.101.144.8333 > tom-Latitude-3570.60988: tcp 24
03:55:15.287394 IP 81.198.101.144.8333 > tom-Latitude-3570.60988: tcp 225
03:55:15.287396 IP 81.198.101.144.8333 > tom-Latitude-3570.60988: tcp 24
03:55:15.287397 IP tom-Latitude-3570.60988 > 81.198.101.144.8333: tcp 0
03:55:15.287399 IP 81.198.101.144.8333 > tom-Latitude-3570.60988: tcp 191
03:55:15.287399 IP tom-Latitude-3570.60988 > 81.198.101.144.8333: tcp 0
03:55:15.287401 IP tom-Latitude-3570.60988 > 81.198.101.144.8333: tcp 0
03:55:15.287404 IP tom-Latitude-3570.60988 > 81.198.101.144.8333: tcp 0
03:55:15.287406 IP tom-Latitude-3570.60988 > 81.198.101.144.8333: tcp 0
03:55:15.289622 IP 2.56.9.15.8333 > tom-Latitude-3570.42516: tcp 24
03:55:15.289634 IP 2.56.9.15.8333 > tom-Latitude-3570.42516: tcp 215
03:55:15.289733 IP tom-Latitude-3570.42516 > 2.56.9.15.8333: tcp 0
03:55:15.490318 IP tom-Latitude-3570.56714 > ns3113832.ip-54-38-177.eu.8333: tcp 24
03:55:15.490406 IP tom-Latitude-3570.46284 > static-87-75-105-186.vodafonexdsl.co.uk.8333: tcp 24
03:55:15.492296 IP tom-Latitude-3570.56714 > ns3113832.ip-54-38-177.eu.8333: tcp 61
03:55:15.493185 IP tom-Latitude-3570.46284 > static-87-75-105-186.vodafonexdsl.co.uk.8333: tcp 397
03:55:15.517867 IP ns3113832.ip-54-38-177.eu.8333 > tom-Latitude-3570.56714: tcp 0
03:55:15.526237 IP static-87-75-105-186.vodafonexdsl.co.uk.8333 > tom-Latitude-3570.46284: tcp 0
03:55:15.526251 IP static-87-75-105-186.vodafonexdsl.co.uk.8333 > tom-Latitude-3570.46284: tcp 0
03:55:15.526254 IP ns3113832.ip-54-38-177.eu.8333 > tom-Latitude-3570.56714: tcp 0
03:55:15.571944 IP 81.198.101.144.8333 > tom-Latitude-3570.60988: tcp 24
03:55:15.571968 IP tom-Latitude-3570.60988 > 81.198.101.144.8333: tcp 0
03:55:15.572561 IP 81.198.101.144.8333 > tom-Latitude-3570.60988: tcp 73
03:55:15.572578 IP tom-Latitude-3570.60988 > 81.198.101.144.8333: tcp 0
03:55:15.572825 IP tom-Latitude-3570.60988 > 81.198.101.144.8333: tcp 24
03:55:15.575652 IP tom-Latitude-3570.60988 > 81.198.101.144.8333: tcp 37
03:55:15.605923 IP 81.198.101.144.8333 > tom-Latitude-3570.60988: tcp 0
03:55:15.606582 IP 81.198.101.144.8333 > tom-Latitude-3570.60988: tcp 0
03:55:15.673285 IP tom-Latitude-3570.39110 > vmi195435.contaboserver.net.8333: tcp 24
03:55:15.674284 IP tom-Latitude-3570.39110 > vmi195435.contaboserver.net.8333: tcp 289
03:55:15.693978 IP 81.198.101.144.8333 > tom-Latitude-3570.60988: tcp 24
03:55:15.693997 IP 81.198.101.144.8333 > tom-Latitude-3570.60988: tcp 224
03:55:15.694089 IP tom-Latitude-3570.60988 > 81.198.101.144.8333: tcp 0
03:55:15.706636 IP vmi195435.contaboserver.net.8333 > tom-Latitude-3570.39110: tcp 0
03:55:15.714036 IP vmi195435.contaboserver.net.8333 > tom-Latitude-3570.39110: tcp 0
03:55:15.895138 IP tom-Latitude-3570.46284 > static-87-75-105-186.vodafonexdsl.co.uk.8333: tcp 24
03:55:15.897897 IP tom-Latitude-3570.46284 > static-87-75-105-186.vodafonexdsl.co.uk.8333: tcp 37
03:55:15.898411 IP static-87-75-105-186.vodafonexdsl.co.uk.8333 > tom-Latitude-3570.46284: tcp 24
03:55:15.898431 IP static-87-75-105-186.vodafonexdsl.co.uk.8333 > tom-Latitude-3570.46284: tcp 8
03:55:15.898523 IP tom-Latitude-3570.46284 > static-87-75-105-186.vodafonexdsl.co.uk.8333: tcp 0
03:55:15.899475 IP tom-Latitude-3570.46284 > static-87-75-105-186.vodafonexdsl.co.uk.8333: tcp 32
03:55:15.935960 IP static-87-75-105-186.vodafonexdsl.co.uk.8333 > tom-Latitude-3570.46284: tcp 0
03:55:15.936590 IP static-87-75-105-186.vodafonexdsl.co.uk.8333 > tom-Latitude-3570.46284: tcp 0
03:55:15.936606 IP static-87-75-105-186.vodafonexdsl.co.uk.8333 > tom-Latitude-3570.46284: tcp 0
03:55:16.400274 IP tom-Latitude-3570.42516 > 2.56.9.15.8333: tcp 24
03:55:16.402381 IP tom-Latitude-3570.42516 > 2.56.9.15.8333: tcp 37
03:55:16.458684 IP 2.56.9.15.8333 > tom-Latitude-3570.42516: tcp 0
03:55:16.467588 IP 2.56.9.15.8333 > tom-Latitude-3570.42516: tcp 0
03:55:17.787262 IP 167.99.216.145.8333 > tom-Latitude-3570.57976: tcp 24
03:55:17.787283 IP 167.99.216.145.8333 > tom-Latitude-3570.57976: tcp 541
03:55:17.787287 IP 167.99.216.145.8333 > tom-Latitude-3570.57976: tcp 541
03:55:17.787314 IP tom-Latitude-3570.57976 > 167.99.216.145.8333: tcp 0
03:55:17.787638 IP tom-Latitude-3570.57976 > 167.99.216.145.8333: tcp 24
03:55:17.789506 IP tom-Latitude-3570.57976 > 167.99.216.145.8333: tcp 217
03:55:17.834315 IP 167.99.216.145.8333 > tom-Latitude-3570.57976: tcp 0
03:55:17.834918 IP 167.99.216.145.8333 > tom-Latitude-3570.57976: tcp 0
03:55:17.888080 IP tom-Latitude-3570.56714 > ns3113832.ip-54-38-177.eu.8333: tcp 24
03:55:17.888117 IP tom-Latitude-3570.57976 > 167.99.216.145.8333: tcp 24
03:55:17.889398 IP tom-Latitude-3570.56714 > ns3113832.ip-54-38-177.eu.8333: tcp 325
03:55:17.890500 IP tom-Latitude-3570.57976 > 167.99.216.145.8333: tcp 31
03:55:17.918155 IP ns3113832.ip-54-38-177.eu.8333 > tom-Latitude-3570.56714: tcp 0
03:55:17.926163 IP 167.99.216.145.8333 > tom-Latitude-3570.57976: tcp 0
03:55:17.926899 IP ns3113832.ip-54-38-177.eu.8333 > tom-Latitude-3570.56714: tcp 0
03:55:17.926913 IP 167.99.216.145.8333 > tom-Latitude-3570.57976: tcp 0
03:55:17.976224 IP c-185-45-236-223.customer.ggaweb.ch.8333 > tom-Latitude-3570.49070: tcp 24
03:55:17.976245 IP c-185-45-236-223.customer.ggaweb.ch.8333 > tom-Latitude-3570.49070: tcp 577
03:55:17.976250 IP 167.99.216.145.8333 > tom-Latitude-3570.57976: tcp 24
03:55:17.976253 IP 167.99.216.145.8333 > tom-Latitude-3570.57976: tcp 311
03:55:17.976255 IP 167.99.216.145.8333 > tom-Latitude-3570.57976: tcp 24
03:55:17.976276 IP 167.99.216.145.8333 > tom-Latitude-3570.57976: tcp 226
03:55:17.976278 IP 167.99.216.145.8333 > tom-Latitude-3570.57976: tcp 24
03:55:17.976281 IP 167.99.216.145.8333 > tom-Latitude-3570.57976: tcp 226
03:55:17.976283 IP 167.99.216.145.8333 > tom-Latitude-3570.57976: tcp 24
03:55:17.976340 IP tom-Latitude-3570.49070 > c-185-45-236-223.customer.ggaweb.ch.8333: tcp 0
03:55:17.976379 IP tom-Latitude-3570.57976 > 167.99.216.145.8333: tcp 0
03:55:17.976605 IP tom-Latitude-3570.49070 > c-185-45-236-223.customer.ggaweb.ch.8333: tcp 24
03:55:17.976856 IP 167.99.216.145.8333 > tom-Latitude-3570.57976: tcp 1448
03:55:17.976875 IP 167.99.216.145.8333 > tom-Latitude-3570.57976: tcp 1448
03:55:17.976884 IP 167.99.216.145.8333 > tom-Latitude-3570.57976: tcp 1448
03:55:17.976927 IP tom-Latitude-3570.57976 > 167.99.216.145.8333: tcp 0
03:55:17.979620 IP tom-Latitude-3570.49070 > c-185-45-236-223.customer.ggaweb.ch.8333: tcp 37
03:55:18.013440 IP 167.99.216.145.8333 > tom-Latitude-3570.57976: tcp 1448
03:55:18.013552 IP tom-Latitude-3570.57976 > 167.99.216.145.8333: tcp 0
03:55:18.013989 IP 167.99.216.145.8333 > tom-Latitude-3570.57976: tcp 1448
03:55:18.014009 IP 167.99.216.145.8333 > tom-Latitude-3570.57976: tcp 1448
03:55:18.014101 IP tom-Latitude-3570.57976 > 167.99.216.145.8333: tcp 0
03:55:18.015180 IP 167.99.216.145.8333 > tom-Latitude-3570.57976: tcp 1448
03:55:18.015199 IP 167.99.216.145.8333 > tom-Latitude-3570.57976: tcp 1448
03:55:18.015203 IP 167.99.216.145.8333 > tom-Latitude-3570.57976: tcp 1448
03:55:18.015295 IP tom-Latitude-3570.57976 > 167.99.216.145.8333: tcp 0
03:55:18.017681 IP 167.99.216.145.8333 > tom-Latitude-3570.57976: tcp 1448
03:55:18.017818 IP tom-Latitude-3570.57976 > 167.99.216.145.8333: tcp 0
03:55:18.019293 IP 167.99.216.145.8333 > tom-Latitude-3570.57976: tcp 703
03:55:18.019301 IP c-185-45-236-223.customer.ggaweb.ch.8333 > tom-Latitude-3570.49070: tcp 0
03:55:18.021226 IP ns3113832.ip-54-38-177.eu.8333 > tom-Latitude-3570.56714: tcp 24
03:55:18.021239 IP tom-Latitude-3570.56714 > ns3113832.ip-54-38-177.eu.8333: tcp 0
03:55:18.021253 IP ns3113832.ip-54-38-177.eu.8333 > tom-Latitude-3570.56714: tcp 217
03:55:18.021257 IP tom-Latitude-3570.56714 > ns3113832.ip-54-38-177.eu.8333: tcp 0
03:55:18.059905 IP tom-Latitude-3570.57976 > 167.99.216.145.8333: tcp 0
03:55:18.103572 IP c-185-45-236-223.customer.ggaweb.ch.8333 > tom-Latitude-3570.49070: tcp 24
03:55:18.104157 IP c-185-45-236-223.customer.ggaweb.ch.8333 > tom-Latitude-3570.49070: tcp 438
03:55:18.104287 IP tom-Latitude-3570.49070 > c-185-45-236-223.customer.ggaweb.ch.8333: tcp 0
03:55:18.104417 IP tom-Latitude-3570.39110 > vmi195435.contaboserver.net.8333: tcp 24
03:55:18.105844 IP tom-Latitude-3570.39110 > vmi195435.contaboserver.net.8333: tcp 253
03:55:18.136271 IP vmi195435.contaboserver.net.8333 > tom-Latitude-3570.39110: tcp 0
03:55:18.136286 IP vmi195435.contaboserver.net.8333 > tom-Latitude-3570.39110: tcp 0
03:55:18.505961 IP tom-Latitude-3570.56714 > ns3113832.ip-54-38-177.eu.8333: tcp 24
03:55:18.506083 IP tom-Latitude-3570.60470 > bb42-60-217-183.singnet.com.sg.8333: tcp 24
03:55:18.506139 IP tom-Latitude-3570.46284 > static-87-75-105-186.vodafonexdsl.co.uk.8333: tcp 24
03:55:18.508014 IP tom-Latitude-3570.56714 > ns3113832.ip-54-38-177.eu.8333: tcp 37
03:55:18.511985 IP tom-Latitude-3570.60470 > bb42-60-217-183.singnet.com.sg.8333: tcp 577
03:55:18.512553 IP tom-Latitude-3570.46284 > static-87-75-105-186.vodafonexdsl.co.uk.8333: tcp 253
03:55:18.576747 IP ns3113832.ip-54-38-177.eu.8333 > tom-Latitude-3570.56714: tcp 0
03:55:18.592913 IP static-87-75-105-186.vodafonexdsl.co.uk.8333 > tom-Latitude-3570.46284: tcp 0
03:55:18.593586 IP ns3113832.ip-54-38-177.eu.8333 > tom-Latitude-3570.56714: tcp 0
03:55:18.593600 IP bb42-60-217-183.singnet.com.sg.8333 > tom-Latitude-3570.60470: tcp 0
03:55:18.593603 IP static-87-75-105-186.vodafonexdsl.co.uk.8333 > tom-Latitude-3570.46284: tcp 0
03:55:18.604108 IP 81.198.101.144.8333 > tom-Latitude-3570.60988: tcp 24
03:55:18.604128 IP 81.198.101.144.8333 > tom-Latitude-3570.60988: tcp 217
03:55:18.604242 IP tom-Latitude-3570.60988 > 81.198.101.144.8333: tcp 0
03:55:18.620219 IP static-87-75-105-186.vodafonexdsl.co.uk.8333 > tom-Latitude-3570.46284: tcp 24
03:55:18.626079 IP static-87-75-105-186.vodafonexdsl.co.uk.8333 > tom-Latitude-3570.46284: tcp 289
03:55:18.626211 IP tom-Latitude-3570.46284 > static-87-75-105-186.vodafonexdsl.co.uk.8333: tcp 0
03:55:18.626418 IP tom-Latitude-3570.46284 > static-87-75-105-186.vodafonexdsl.co.uk.8333: tcp 24
03:55:18.627808 IP tom-Latitude-3570.46284 > static-87-75-105-186.vodafonexdsl.co.uk.8333: tcp 37
03:55:18.672777 IP static-87-75-105-186.vodafonexdsl.co.uk.8333 > tom-Latitude-3570.46284: tcp 0
03:55:18.731579 IP static-87-75-105-186.vodafonexdsl.co.uk.8333 > tom-Latitude-3570.46284: tcp 24
03:55:18.732173 IP static-87-75-105-186.vodafonexdsl.co.uk.8333 > tom-Latitude-3570.46284: tcp 256
03:55:18.732247 IP tom-Latitude-3570.46284 > static-87-75-105-186.vodafonexdsl.co.uk.8333: tcp 0
03:55:18.933287 IP tom-Latitude-3570.42516 > 2.56.9.15.8333: tcp 24
03:55:18.935351 IP tom-Latitude-3570.42516 > 2.56.9.15.8333: tcp 289
03:55:18.973279 IP 2.56.9.15.8333 > tom-Latitude-3570.42516: tcp 0
03:55:18.976301 IP 2.56.9.15.8333 > tom-Latitude-3570.42516: tcp 0
03:55:19.033691 IP tom-Latitude-3570.56714 > ns3113832.ip-54-38-177.eu.8333: tcp 24
03:55:19.034633 IP tom-Latitude-3570.56714 > ns3113832.ip-54-38-177.eu.8333: tcp 37
03:55:19.067917 IP ns3113832.ip-54-38-177.eu.8333 > tom-Latitude-3570.56714: tcp 0
03:55:19.075011 IP ns3113832.ip-54-38-177.eu.8333 > tom-Latitude-3570.56714: tcp 0
03:55:19.334802 IP tom-Latitude-3570.39110 > vmi195435.contaboserver.net.8333: tcp 24
03:55:19.336980 IP tom-Latitude-3570.39110 > vmi195435.contaboserver.net.8333: tcp 73
03:55:19.387614 IP vmi195435.contaboserver.net.8333 > tom-Latitude-3570.39110: tcp 0
03:55:19.394476 IP vmi195435.contaboserver.net.8333 > tom-Latitude-3570.39110: tcp 0
03:55:19.535601 IP tom-Latitude-3570.57976 > 167.99.216.145.8333: tcp 24
03:55:19.537629 IP tom-Latitude-3570.57976 > 167.99.216.145.8333: tcp 73
03:55:19.575799 IP 167.99.216.145.8333 > tom-Latitude-3570.57976: tcp 0
03:55:19.836743 IP tom-Latitude-3570.49070 > c-185-45-236-223.customer.ggaweb.ch.8333: tcp 24
03:55:19.839861 IP tom-Latitude-3570.49070 > c-185-45-236-223.customer.ggaweb.ch.8333: tcp 37
03:55:19.874111 IP c-185-45-236-223.customer.ggaweb.ch.8333 > tom-Latitude-3570.49070: tcp 0
03:55:20.338393 IP tom-Latitude-3570.39110 > vmi195435.contaboserver.net.8333: tcp 24
03:55:20.340663 IP tom-Latitude-3570.39110 > vmi195435.contaboserver.net.8333: tcp 8
03:55:20.388059 IP vmi195435.contaboserver.net.8333 > tom-Latitude-3570.39110: tcp 0
03:55:20.395533 IP vmi195435.contaboserver.net.8333 > tom-Latitude-3570.39110: tcp 0
03:55:20.426983 IP static-87-75-105-186.vodafonexdsl.co.uk.8333 > tom-Latitude-3570.46284: tcp 24
03:55:20.427671 IP static-87-75-105-186.vodafonexdsl.co.uk.8333 > tom-Latitude-3570.46284: tcp 253
03:55:20.427788 IP tom-Latitude-3570.46284 > static-87-75-105-186.vodafonexdsl.co.uk.8333: tcp 0
03:55:20.428043 IP tom-Latitude-3570.46284 > static-87-75-105-186.vodafonexdsl.co.uk.8333: tcp 24
03:55:20.429313 IP tom-Latitude-3570.46284 > static-87-75-105-186.vodafonexdsl.co.uk.8333: tcp 253
03:55:20.467923 IP static-87-75-105-186.vodafonexdsl.co.uk.8333 > tom-Latitude-3570.46284: tcp 0
03:55:20.472899 IP vmi195435.contaboserver.net.8333 > tom-Latitude-3570.39110: tcp 24
03:55:20.472917 IP vmi195435.contaboserver.net.8333 > tom-Latitude-3570.39110: tcp 8
03:55:20.473031 IP tom-Latitude-3570.39110 > vmi195435.contaboserver.net.8333: tcp 0
03:55:20.541804 IP static-87-75-105-186.vodafonexdsl.co.uk.8333 > tom-Latitude-3570.46284: tcp 24
03:55:20.541824 IP static-87-75-105-186.vodafonexdsl.co.uk.8333 > tom-Latitude-3570.46284: tcp 257
03:55:20.541829 IP static-87-75-105-186.vodafonexdsl.co.uk.8333 > tom-Latitude-3570.46284: tcp 24
03:55:20.541853 IP static-87-75-105-186.vodafonexdsl.co.uk.8333 > tom-Latitude-3570.46284: tcp 251
03:55:20.541856 IP static-87-75-105-186.vodafonexdsl.co.uk.8333 > tom-Latitude-3570.46284: tcp 24
03:55:20.541860 IP static-87-75-105-186.vodafonexdsl.co.uk.8333 > tom-Latitude-3570.46284: tcp 190
03:55:20.541864 IP static-87-75-105-186.vodafonexdsl.co.uk.8333 > tom-Latitude-3570.46284: tcp 24
03:55:20.541867 IP static-87-75-105-186.vodafonexdsl.co.uk.8333 > tom-Latitude-3570.46284: tcp 247
03:55:20.541869 IP static-87-75-105-186.vodafonexdsl.co.uk.8333 > tom-Latitude-3570.46284: tcp 24
03:55:20.541873 IP static-87-75-105-186.vodafonexdsl.co.uk.8333 > tom-Latitude-3570.46284: tcp 373
03:55:20.541876 IP static-87-75-105-186.vodafonexdsl.co.uk.8333 > tom-Latitude-3570.46284: tcp 24
03:55:20.541924 IP tom-Latitude-3570.46284 > static-87-75-105-186.vodafonexdsl.co.uk.8333: tcp 0
03:55:20.542595 IP static-87-75-105-186.vodafonexdsl.co.uk.8333 > tom-Latitude-3570.46284: tcp 589
03:55:20.542611 IP static-87-75-105-186.vodafonexdsl.co.uk.8333 > tom-Latitude-3570.46284: tcp 24
03:55:20.542615 IP static-87-75-105-186.vodafonexdsl.co.uk.8333 > tom-Latitude-3570.46284: tcp 256
03:55:20.542701 IP tom-Latitude-3570.46284 > static-87-75-105-186.vodafonexdsl.co.uk.8333: tcp 0
03:55:20.744861 IP tom-Latitude-3570.56714 > ns3113832.ip-54-38-177.eu.8333: tcp 24
03:55:20.748134 IP tom-Latitude-3570.56714 > ns3113832.ip-54-38-177.eu.8333: tcp 253
03:55:20.748654 IP ns3113832.ip-54-38-177.eu.8333 > tom-Latitude-3570.56714: tcp 24
03:55:20.748679 IP tom-Latitude-3570.56714 > ns3113832.ip-54-38-177.eu.8333: tcp 0
03:55:20.748707 IP ns3113832.ip-54-38-177.eu.8333 > tom-Latitude-3570.56714: tcp 73
03:55:20.748710 IP tom-Latitude-3570.56714 > ns3113832.ip-54-38-177.eu.8333: tcp 0
03:55:20.786007 IP ns3113832.ip-54-38-177.eu.8333 > tom-Latitude-3570.56714: tcp 0
03:55:20.786654 IP ns3113832.ip-54-38-177.eu.8333 > tom-Latitude-3570.56714: tcp 0
03:55:20.853004 IP ns3113832.ip-54-38-177.eu.8333 > tom-Latitude-3570.56714: tcp 24
03:55:20.853021 IP tom-Latitude-3570.56714 > ns3113832.ip-54-38-177.eu.8333: tcp 0
03:55:20.854026 IP ns3113832.ip-54-38-177.eu.8333 > tom-Latitude-3570.56714: tcp 181
03:55:20.854043 IP tom-Latitude-3570.56714 > ns3113832.ip-54-38-177.eu.8333: tcp 0
03:55:20.854289 IP tom-Latitude-3570.56714 > ns3113832.ip-54-38-177.eu.8333: tcp 24
03:55:20.854353 IP tom-Latitude-3570.56714 > ns3113832.ip-54-38-177.eu.8333: tcp 1143
03:55:20.859601 IP tom-Latitude-3570.56714 > ns3113832.ip-54-38-177.eu.8333: tcp 613
03:55:20.894343 IP ns3113832.ip-54-38-177.eu.8333 > tom-Latitude-3570.56714: tcp 0
03:55:20.894350 IP ns3113832.ip-54-38-177.eu.8333 > tom-Latitude-3570.56714: tcp 0
03:55:20.901342 IP ns3113832.ip-54-38-177.eu.8333 > tom-Latitude-3570.56714: tcp 0
03:55:20.954579 IP tom-Latitude-3570.39110 > vmi195435.contaboserver.net.8333: tcp 24
03:55:20.955332 IP tom-Latitude-3570.39110 > vmi195435.contaboserver.net.8333: tcp 253
03:55:20.986907 IP vmi195435.contaboserver.net.8333 > tom-Latitude-3570.39110: tcp 0
03:55:20.996713 IP vmi195435.contaboserver.net.8333 > tom-Latitude-3570.39110: tcp 0
03:55:21.054770 IP tom-Latitude-3570.49070 > c-185-45-236-223.customer.ggaweb.ch.8333: tcp 24
03:55:21.054830 IP tom-Latitude-3570.42516 > 2.56.9.15.8333: tcp 24
03:55:21.055539 IP tom-Latitude-3570.49070 > c-185-45-236-223.customer.ggaweb.ch.8333: tcp 253
03:55:21.056170 IP tom-Latitude-3570.42516 > 2.56.9.15.8333: tcp 253
03:55:21.087945 IP 2.56.9.15.8333 > tom-Latitude-3570.42516: tcp 0
03:55:21.095954 IP c-185-45-236-223.customer.ggaweb.ch.8333 > tom-Latitude-3570.49070: tcp 0
03:55:21.096994 IP 2.56.9.15.8333 > tom-Latitude-3570.42516: tcp 0
03:55:21.355955 IP tom-Latitude-3570.60988 > 81.198.101.144.8333: tcp 24
03:55:21.358307 IP tom-Latitude-3570.60988 > 81.198.101.144.8333: tcp 325
03:55:21.387534 IP 81.198.101.144.8333 > tom-Latitude-3570.60988: tcp 0
03:55:21.395611 IP 81.198.101.144.8333 > tom-Latitude-3570.60988: tcp 0
03:55:21.678027 IP bb42-60-217-183.singnet.com.sg.8333 > tom-Latitude-3570.60470: tcp 24
03:55:21.678048 IP bb42-60-217-183.singnet.com.sg.8333 > tom-Latitude-3570.60470: tcp 361
03:55:21.678056 IP ns3113832.ip-54-38-177.eu.8333 > tom-Latitude-3570.56714: tcp 24
03:55:21.678079 IP ns3113832.ip-54-38-177.eu.8333 > tom-Latitude-3570.56714: tcp 181
03:55:21.678145 IP tom-Latitude-3570.56714 > ns3113832.ip-54-38-177.eu.8333: tcp 0
03:55:21.678175 IP tom-Latitude-3570.60470 > bb42-60-217-183.singnet.com.sg.8333: tcp 0
03:55:21.678365 IP tom-Latitude-3570.56714 > ns3113832.ip-54-38-177.eu.8333: tcp 24
03:55:21.680349 IP tom-Latitude-3570.56714 > ns3113832.ip-54-38-177.eu.8333: tcp 181
03:55:21.716159 IP ns3113832.ip-54-38-177.eu.8333 > tom-Latitude-3570.56714: tcp 0
03:55:21.716828 IP ns3113832.ip-54-38-177.eu.8333 > tom-Latitude-3570.56714: tcp 0
03:55:21.817587 IP ns3113832.ip-54-38-177.eu.8333 > tom-Latitude-3570.56714: tcp 225
03:55:21.817605 IP tom-Latitude-3570.56714 > ns3113832.ip-54-38-177.eu.8333: tcp 0
03:55:21.817617 IP ns3113832.ip-54-38-177.eu.8333 > tom-Latitude-3570.56714: tcp 24
03:55:21.817619 IP tom-Latitude-3570.56714 > ns3113832.ip-54-38-177.eu.8333: tcp 0
03:55:21.817622 IP ns3113832.ip-54-38-177.eu.8333 > tom-Latitude-3570.56714: tcp 408
03:55:21.817624 IP tom-Latitude-3570.56714 > ns3113832.ip-54-38-177.eu.8333: tcp 0
03:55:21.817626 IP ns3113832.ip-54-38-177.eu.8333 > tom-Latitude-3570.56714: tcp 24
03:55:21.817628 IP tom-Latitude-3570.56714 > ns3113832.ip-54-38-177.eu.8333: tcp 0
03:55:21.817631 IP ns3113832.ip-54-38-177.eu.8333 > tom-Latitude-3570.56714: tcp 247
03:55:21.817632 IP tom-Latitude-3570.56714 > ns3113832.ip-54-38-177.eu.8333: tcp 0
03:55:21.817634 IP ns3113832.ip-54-38-177.eu.8333 > tom-Latitude-3570.56714: tcp 24
03:55:21.817635 IP tom-Latitude-3570.56714 > ns3113832.ip-54-38-177.eu.8333: tcp 0
03:55:21.817638 IP ns3113832.ip-54-38-177.eu.8333 > tom-Latitude-3570.56714: tcp 375
03:55:21.817639 IP tom-Latitude-3570.56714 > ns3113832.ip-54-38-177.eu.8333: tcp 0
03:55:21.817641 IP ns3113832.ip-54-38-177.eu.8333 > tom-Latitude-3570.56714: tcp 24
03:55:21.817643 IP tom-Latitude-3570.56714 > ns3113832.ip-54-38-177.eu.8333: tcp 0
03:55:21.817645 IP ns3113832.ip-54-38-177.eu.8333 > tom-Latitude-3570.56714: tcp 257
03:55:21.817647 IP tom-Latitude-3570.56714 > ns3113832.ip-54-38-177.eu.8333: tcp 0
03:55:21.860549 IP ns3113832.ip-54-38-177.eu.8333 > tom-Latitude-3570.56714: tcp 24
03:55:21.860575 IP tom-Latitude-3570.56714 > ns3113832.ip-54-38-177.eu.8333: tcp 0
03:55:21.911902 IP bb42-60-217-183.singnet.com.sg.8333 > tom-Latitude-3570.60470: tcp 24
03:55:21.911920 IP bb42-60-217-183.singnet.com.sg.8333 > tom-Latitude-3570.60470: tcp 73
03:55:21.912035 IP tom-Latitude-3570.60470 > bb42-60-217-183.singnet.com.sg.8333: tcp 0
03:55:22.087457 IP vmi195435.contaboserver.net.8333 > tom-Latitude-3570.39110: tcp 24
03:55:22.087476 IP vmi195435.contaboserver.net.8333 > tom-Latitude-3570.39110: tcp 8
03:55:22.087562 IP tom-Latitude-3570.39110 > vmi195435.contaboserver.net.8333: tcp 0
03:55:22.087627 IP tom-Latitude-3570.39110 > vmi195435.contaboserver.net.8333: tcp 24
03:55:22.087827 IP tom-Latitude-3570.46284 > static-87-75-105-186.vodafonexdsl.co.uk.8333: tcp 24
03:55:22.091506 IP tom-Latitude-3570.39110 > vmi195435.contaboserver.net.8333: tcp 8
03:55:22.092771 IP tom-Latitude-3570.46284 > static-87-75-105-186.vodafonexdsl.co.uk.8333: tcp 181
03:55:22.125718 IP vmi195435.contaboserver.net.8333 > tom-Latitude-3570.39110: tcp 0
03:55:22.126319 IP vmi195435.contaboserver.net.8333 > tom-Latitude-3570.39110: tcp 0
03:55:22.126333 IP static-87-75-105-186.vodafonexdsl.co.uk.8333 > tom-Latitude-3570.46284: tcp 0
03:55:23.291794 IP tom-Latitude-3570.39110 > vmi195435.contaboserver.net.8333: tcp 24
03:55:23.294121 IP tom-Latitude-3570.39110 > vmi195435.contaboserver.net.8333: tcp 181
03:55:23.294868 IP 81.198.101.144.8333 > tom-Latitude-3570.60988: tcp 24
03:55:23.294889 IP 81.198.101.144.8333 > tom-Latitude-3570.60988: tcp 181
03:55:23.294893 IP c-185-45-236-223.customer.ggaweb.ch.8333 > tom-Latitude-3570.49070: tcp 24
03:55:23.294896 IP c-185-45-236-223.customer.ggaweb.ch.8333 > tom-Latitude-3570.49070: tcp 8
03:55:23.294917 IP 81.198.101.144.8333 > tom-Latitude-3570.60988: tcp 181
03:55:23.294942 IP tom-Latitude-3570.60988 > 81.198.101.144.8333: tcp 0
03:55:23.294960 IP c-185-45-236-223.customer.ggaweb.ch.8333 > tom-Latitude-3570.49070: tcp 8
03:55:23.294965 IP tom-Latitude-3570.49070 > c-185-45-236-223.customer.ggaweb.ch.8333: tcp 0
03:55:23.295059 IP tom-Latitude-3570.49070 > c-185-45-236-223.customer.ggaweb.ch.8333: tcp 24
03:55:23.297780 IP tom-Latitude-3570.49070 > c-185-45-236-223.customer.ggaweb.ch.8333: tcp 8
03:55:23.336440 IP vmi195435.contaboserver.net.8333 > tom-Latitude-3570.39110: tcp 0
03:55:23.336460 IP vmi195435.contaboserver.net.8333 > tom-Latitude-3570.39110: tcp 0
03:55:23.336463 IP c-185-45-236-223.customer.ggaweb.ch.8333 > tom-Latitude-3570.49070: tcp 0
03:55:23.419493 IP ns3113832.ip-54-38-177.eu.8333 > tom-Latitude-3570.56714: tcp 24
03:55:23.419517 IP tom-Latitude-3570.56714 > ns3113832.ip-54-38-177.eu.8333: tcp 0
03:55:23.419551 IP ns3113832.ip-54-38-177.eu.8333 > tom-Latitude-3570.56714: tcp 145
03:55:23.419557 IP tom-Latitude-3570.56714 > ns3113832.ip-54-38-177.eu.8333: tcp 0
03:55:23.419786 IP tom-Latitude-3570.56714 > ns3113832.ip-54-38-177.eu.8333: tcp 24
03:55:23.421463 IP tom-Latitude-3570.56714 > ns3113832.ip-54-38-177.eu.8333: tcp 145
03:55:23.454748 IP ns3113832.ip-54-38-177.eu.8333 > tom-Latitude-3570.56714: tcp 0
03:55:23.454763 IP ns3113832.ip-54-38-177.eu.8333 > tom-Latitude-3570.56714: tcp 0
03:55:23.514494 IP ns3113832.ip-54-38-177.eu.8333 > tom-Latitude-3570.56714: tcp 24
03:55:23.516210 IP ns3113832.ip-54-38-177.eu.8333 > tom-Latitude-3570.56714: tcp 1350
03:55:23.516227 IP ns3113832.ip-54-38-177.eu.8333 > tom-Latitude-3570.56714: tcp 576
03:55:23.516231 IP ns3113832.ip-54-38-177.eu.8333 > tom-Latitude-3570.56714: tcp 24
03:55:23.516344 IP tom-Latitude-3570.56714 > ns3113832.ip-54-38-177.eu.8333: tcp 0
03:55:23.516454 IP ns3113832.ip-54-38-177.eu.8333 > tom-Latitude-3570.56714: tcp 256
03:55:23.516479 IP ns3113832.ip-54-38-177.eu.8333 > tom-Latitude-3570.56714: tcp 24
03:55:23.516483 IP ns3113832.ip-54-38-177.eu.8333 > tom-Latitude-3570.56714: tcp 420
03:55:23.516485 IP ns3113832.ip-54-38-177.eu.8333 > tom-Latitude-3570.56714: tcp 24
03:55:23.516488 IP ns3113832.ip-54-38-177.eu.8333 > tom-Latitude-3570.56714: tcp 225
03:55:23.516507 IP tom-Latitude-3570.56714 > ns3113832.ip-54-38-177.eu.8333: tcp 0
03:55:23.620307 IP tom-Latitude-3570.57976 > 167.99.216.145.8333: tcp 24
03:55:23.620364 IP tom-Latitude-3570.46284 > static-87-75-105-186.vodafonexdsl.co.uk.8333: tcp 24
03:55:23.623246 IP tom-Latitude-3570.57976 > 167.99.216.145.8333: tcp 577
03:55:23.624278 IP tom-Latitude-3570.46284 > static-87-75-105-186.vodafonexdsl.co.uk.8333: tcp 145
03:55:23.674131 IP 167.99.216.145.8333 > tom-Latitude-3570.57976: tcp 0
03:55:23.674823 IP static-87-75-105-186.vodafonexdsl.co.uk.8333 > tom-Latitude-3570.46284: tcp 0
03:55:23.930910 IP bb42-60-217-183.singnet.com.sg.8333 > tom-Latitude-3570.60470: tcp 24
03:55:23.930930 IP bb42-60-217-183.singnet.com.sg.8333 > tom-Latitude-3570.60470: tcp 181
03:55:23.931023 IP tom-Latitude-3570.60470 > bb42-60-217-183.singnet.com.sg.8333: tcp 0
03:55:24.633449 IP tom-Latitude-3570.49070 > c-185-45-236-223.customer.ggaweb.ch.8333: tcp 24
03:55:24.636019 IP tom-Latitude-3570.49070 > c-185-45-236-223.customer.ggaweb.ch.8333: tcp 8
03:55:24.685956 IP 2.56.9.15.8333 > tom-Latitude-3570.42516: tcp 24
03:55:24.686733 IP 2.56.9.15.8333 > tom-Latitude-3570.42516: tcp 361
03:55:24.686751 IP 2.56.9.15.8333 > tom-Latitude-3570.42516: tcp 361
03:55:24.686779 IP tom-Latitude-3570.42516 > 2.56.9.15.8333: tcp 0
03:55:24.687039 IP tom-Latitude-3570.42516 > 2.56.9.15.8333: tcp 24
03:55:24.689573 IP tom-Latitude-3570.42516 > 2.56.9.15.8333: tcp 37
03:55:24.694965 IP c-185-45-236-223.customer.ggaweb.ch.8333 > tom-Latitude-3570.49070: tcp 0
03:55:24.716510 IP 2.56.9.15.8333 > tom-Latitude-3570.42516: tcp 0
03:55:24.724324 IP 2.56.9.15.8333 > tom-Latitude-3570.42516: tcp 0
03:55:24.779232 IP c-185-45-236-223.customer.ggaweb.ch.8333 > tom-Latitude-3570.49070: tcp 24
03:55:24.779902 IP c-185-45-236-223.customer.ggaweb.ch.8333 > tom-Latitude-3570.49070: tcp 8
03:55:24.780029 IP tom-Latitude-3570.49070 > c-185-45-236-223.customer.ggaweb.ch.8333: tcp 0
03:55:24.797073 IP 167.99.216.145.8333 > tom-Latitude-3570.57976: tcp 24
03:55:24.797097 IP tom-Latitude-3570.57976 > 167.99.216.145.8333: tcp 0
03:55:24.797130 IP 167.99.216.145.8333 > tom-Latitude-3570.57976: tcp 145
03:55:24.797135 IP tom-Latitude-3570.57976 > 167.99.216.145.8333: tcp 0
03:55:24.797363 IP tom-Latitude-3570.57976 > 167.99.216.145.8333: tcp 24
03:55:24.799357 IP tom-Latitude-3570.57976 > 167.99.216.145.8333: tcp 109
03:55:24.820252 IP 2.56.9.15.8333 > tom-Latitude-3570.42516: tcp 24
03:55:24.820263 IP 2.56.9.15.8333 > tom-Latitude-3570.42516: tcp 254
03:55:24.820326 IP tom-Latitude-3570.42516 > 2.56.9.15.8333: tcp 0
03:55:24.836009 IP 167.99.216.145.8333 > tom-Latitude-3570.57976: tcp 0
03:55:24.911871 IP 167.99.216.145.8333 > tom-Latitude-3570.57976: tcp 24
03:55:24.911892 IP 167.99.216.145.8333 > tom-Latitude-3570.57976: tcp 405
03:55:24.911896 IP 167.99.216.145.8333 > tom-Latitude-3570.57976: tcp 24
03:55:24.911899 IP 167.99.216.145.8333 > tom-Latitude-3570.57976: tcp 225
03:55:24.911901 IP 167.99.216.145.8333 > tom-Latitude-3570.57976: tcp 24
03:55:24.911904 IP 167.99.216.145.8333 > tom-Latitude-3570.57976: tcp 283
03:55:24.911991 IP tom-Latitude-3570.57976 > 167.99.216.145.8333: tcp 0
03:55:24.915563 IP static-87-75-105-186.vodafonexdsl.co.uk.8333 > tom-Latitude-3570.46284: tcp 24
03:55:24.931172 IP static-87-75-105-186.vodafonexdsl.co.uk.8333 > tom-Latitude-3570.46284: tcp 109
03:55:24.931285 IP tom-Latitude-3570.46284 > static-87-75-105-186.vodafonexdsl.co.uk.8333: tcp 0
03:55:25.132154 IP tom-Latitude-3570.46284 > static-87-75-105-186.vodafonexdsl.co.uk.8333: tcp 24
03:55:25.134231 IP tom-Latitude-3570.46284 > static-87-75-105-186.vodafonexdsl.co.uk.8333: tcp 37
03:55:25.178376 IP static-87-75-105-186.vodafonexdsl.co.uk.8333 > tom-Latitude-3570.46284: tcp 0
03:55:25.232582 IP tom-Latitude-3570.56714 > ns3113832.ip-54-38-177.eu.8333: tcp 24
03:55:25.233807 IP tom-Latitude-3570.56714 > ns3113832.ip-54-38-177.eu.8333: tcp 145
03:55:25.268216 IP ns3113832.ip-54-38-177.eu.8333 > tom-Latitude-3570.56714: tcp 0
03:55:25.276256 IP ns3113832.ip-54-38-177.eu.8333 > tom-Latitude-3570.56714: tcp 0
03:55:26.135583 IP tom-Latitude-3570.60988 > 81.198.101.144.8333: tcp 24
03:55:26.137652 IP tom-Latitude-3570.60988 > 81.198.101.144.8333: tcp 289
03:55:26.198157 IP 2.56.9.15.8333 > tom-Latitude-3570.42516: tcp 24
03:55:26.198176 IP 2.56.9.15.8333 > tom-Latitude-3570.42516: tcp 8
03:55:26.198180 IP 81.198.101.144.8333 > tom-Latitude-3570.60988: tcp 0
03:55:26.198270 IP tom-Latitude-3570.42516 > 2.56.9.15.8333: tcp 0
03:55:26.198381 IP tom-Latitude-3570.42516 > 2.56.9.15.8333: tcp 24
03:55:26.201168 IP tom-Latitude-3570.42516 > 2.56.9.15.8333: tcp 8
03:55:26.204806 IP 81.198.101.144.8333 > tom-Latitude-3570.60988: tcp 0
03:55:26.236249 IP 2.56.9.15.8333 > tom-Latitude-3570.42516: tcp 0
03:55:26.236794 IP 2.56.9.15.8333 > tom-Latitude-3570.42516: tcp 0
03:55:26.797780 IP bb42-60-217-183.singnet.com.sg.8333 > tom-Latitude-3570.60470: tcp 24
03:55:26.797799 IP bb42-60-217-183.singnet.com.sg.8333 > tom-Latitude-3570.60470: tcp 217
03:55:26.797895 IP tom-Latitude-3570.60470 > bb42-60-217-183.singnet.com.sg.8333: tcp 0
03:55:26.798085 IP tom-Latitude-3570.60470 > bb42-60-217-183.singnet.com.sg.8333: tcp 24
03:55:26.799410 IP tom-Latitude-3570.60470 > bb42-60-217-183.singnet.com.sg.8333: tcp 73
03:55:26.836212 IP bb42-60-217-183.singnet.com.sg.8333 > tom-Latitude-3570.60470: tcp 0
03:55:27.002775 IP vmi195435.contaboserver.net.8333 > tom-Latitude-3570.39110: tcp 24
03:55:27.002796 IP vmi195435.contaboserver.net.8333 > tom-Latitude-3570.39110: tcp 361
03:55:27.002800 IP ns3113832.ip-54-38-177.eu.8333 > tom-Latitude-3570.56714: tcp 24
03:55:27.002803 IP ns3113832.ip-54-38-177.eu.8333 > tom-Latitude-3570.56714: tcp 8
03:55:27.002882 IP tom-Latitude-3570.39110 > vmi195435.contaboserver.net.8333: tcp 0
03:55:27.002915 IP tom-Latitude-3570.56714 > ns3113832.ip-54-38-177.eu.8333: tcp 0
03:55:27.003077 IP tom-Latitude-3570.56714 > ns3113832.ip-54-38-177.eu.8333: tcp 24
03:55:27.009892 IP tom-Latitude-3570.56714 > ns3113832.ip-54-38-177.eu.8333: tcp 8
03:55:27.038383 IP ns3113832.ip-54-38-177.eu.8333 > tom-Latitude-3570.56714: tcp 0
03:55:27.051882 IP ns3113832.ip-54-38-177.eu.8333 > tom-Latitude-3570.56714: tcp 0
03:55:27.412168 IP bb42-60-217-183.singnet.com.sg.8333 > tom-Latitude-3570.60470: tcp 24
03:55:27.412189 IP bb42-60-217-183.singnet.com.sg.8333 > tom-Latitude-3570.60470: tcp 226
03:55:27.412193 IP bb42-60-217-183.singnet.com.sg.8333 > tom-Latitude-3570.60470: tcp 24
03:55:27.412195 IP bb42-60-217-183.singnet.com.sg.8333 > tom-Latitude-3570.60470: tcp 247
03:55:27.412280 IP tom-Latitude-3570.60470 > bb42-60-217-183.singnet.com.sg.8333: tcp 0
03:55:27.442215 IP bb42-60-217-183.singnet.com.sg.8333 > tom-Latitude-3570.60470: tcp 247
03:55:27.442234 IP tom-Latitude-3570.60470 > bb42-60-217-183.singnet.com.sg.8333: tcp 0
03:55:27.713731 IP tom-Latitude-3570.49070 > c-185-45-236-223.customer.ggaweb.ch.8333: tcp 24
03:55:27.720338 IP tom-Latitude-3570.49070 > c-185-45-236-223.customer.ggaweb.ch.8333: tcp 541
03:55:27.755392 IP c-185-45-236-223.customer.ggaweb.ch.8333 > tom-Latitude-3570.49070: tcp 0
03:55:27.914448 IP tom-Latitude-3570.60988 > 81.198.101.144.8333: tcp 24
03:55:27.914505 IP tom-Latitude-3570.42516 > 2.56.9.15.8333: tcp 24
03:55:27.916972 IP tom-Latitude-3570.60988 > 81.198.101.144.8333: tcp 8
03:55:27.918080 IP tom-Latitude-3570.42516 > 2.56.9.15.8333: tcp 8
03:55:27.947254 IP 81.198.101.144.8333 > tom-Latitude-3570.60988: tcp 0
03:55:27.955373 IP 2.56.9.15.8333 > tom-Latitude-3570.42516: tcp 0
03:55:27.956088 IP 2.56.9.15.8333 > tom-Latitude-3570.42516: tcp 0
03:55:27.956101 IP 81.198.101.144.8333 > tom-Latitude-3570.60988: tcp 0
03:55:28.045792 IP 81.198.101.144.8333 > tom-Latitude-3570.60988: tcp 24
03:55:28.045809 IP tom-Latitude-3570.60988 > 81.198.101.144.8333: tcp 0
03:55:28.045825 IP 81.198.101.144.8333 > tom-Latitude-3570.60988: tcp 8
03:55:28.045827 IP tom-Latitude-3570.60988 > 81.198.101.144.8333: tcp 0
03:55:28.049638 IP 2.56.9.15.8333 > tom-Latitude-3570.42516: tcp 24
03:55:28.050691 IP 2.56.9.15.8333 > tom-Latitude-3570.42516: tcp 8
03:55:28.050824 IP tom-Latitude-3570.42516 > 2.56.9.15.8333: tcp 0
03:55:28.436159 IP 81.198.101.144.8333 > tom-Latitude-3570.60988: tcp 24
03:55:28.436183 IP tom-Latitude-3570.60988 > 81.198.101.144.8333: tcp 0
03:55:28.436216 IP 81.198.101.144.8333 > tom-Latitude-3570.60988: tcp 217
03:55:28.436221 IP tom-Latitude-3570.60988 > 81.198.101.144.8333: tcp 0
03:55:28.436430 IP tom-Latitude-3570.60988 > 81.198.101.144.8333: tcp 24
03:55:28.437499 IP 81.198.101.144.8333 > tom-Latitude-3570.60988: tcp 217
03:55:28.437508 IP tom-Latitude-3570.60988 > 81.198.101.144.8333: tcp 145
03:55:28.475988 IP 81.198.101.144.8333 > tom-Latitude-3570.60988: tcp 0
03:55:28.476582 IP 81.198.101.144.8333 > tom-Latitude-3570.60988: tcp 0
03:55:28.536560 IP tom-Latitude-3570.56714 > ns3113832.ip-54-38-177.eu.8333: tcp 24
03:55:28.537524 IP tom-Latitude-3570.56714 > ns3113832.ip-54-38-177.eu.8333: tcp 8
03:55:28.564901 IP 81.198.101.144.8333 > tom-Latitude-3570.60988: tcp 24
03:55:28.564920 IP 81.198.101.144.8333 > tom-Latitude-3570.60988: tcp 220
03:55:28.564923 IP 81.198.101.144.8333 > tom-Latitude-3570.60988: tcp 24
03:55:28.565015 IP tom-Latitude-3570.60988 > 81.198.101.144.8333: tcp 0
03:55:28.565387 IP tom-Latitude-3570.60470 > bb42-60-217-183.singnet.com.sg.8333: tcp 24
03:55:28.568150 IP tom-Latitude-3570.60470 > bb42-60-217-183.singnet.com.sg.8333: tcp 37
03:55:28.576320 IP 81.198.101.144.8333 > tom-Latitude-3570.60988: tcp 1448
03:55:28.576449 IP tom-Latitude-3570.60988 > 81.198.101.144.8333: tcp 0
03:55:28.576960 IP 81.198.101.144.8333 > tom-Latitude-3570.60988: tcp 1448
03:55:28.576979 IP 81.198.101.144.8333 > tom-Latitude-3570.60988: tcp 704
03:55:28.576982 IP 81.198.101.144.8333 > tom-Latitude-3570.60988: tcp 24
03:55:28.576985 IP 81.198.101.144.8333 > tom-Latitude-3570.60988: tcp 242
03:55:28.577008 IP 81.198.101.144.8333 > tom-Latitude-3570.60988: tcp 24
03:55:28.577014 IP 81.198.101.144.8333 > tom-Latitude-3570.60988: tcp 226
03:55:28.577018 IP ns3113832.ip-54-38-177.eu.8333 > tom-Latitude-3570.56714: tcp 0
03:55:28.577029 IP ns3113832.ip-54-38-177.eu.8333 > tom-Latitude-3570.56714: tcp 0
03:55:28.577083 IP tom-Latitude-3570.60988 > 81.198.101.144.8333: tcp 0
03:55:28.605218 IP bb42-60-217-183.singnet.com.sg.8333 > tom-Latitude-3570.60470: tcp 0
03:55:28.632292 IP ns3113832.ip-54-38-177.eu.8333 > tom-Latitude-3570.56714: tcp 24
03:55:28.632300 IP ns3113832.ip-54-38-177.eu.8333 > tom-Latitude-3570.56714: tcp 8
03:55:28.632314 IP tom-Latitude-3570.56714 > ns3113832.ip-54-38-177.eu.8333: tcp 0
03:55:28.732779 IP tom-Latitude-3570.46284 > static-87-75-105-186.vodafonexdsl.co.uk.8333: tcp 24
03:55:28.733978 IP tom-Latitude-3570.46284 > static-87-75-105-186.vodafonexdsl.co.uk.8333: tcp 217
03:55:28.775503 IP static-87-75-105-186.vodafonexdsl.co.uk.8333 > tom-Latitude-3570.46284: tcp 0
03:55:29.255373 IP 2.56.9.15.8333 > tom-Latitude-3570.42516: tcp 24
03:55:29.255393 IP 2.56.9.15.8333 > tom-Latitude-3570.42516: tcp 361
03:55:29.255399 IP 2.56.9.15.8333 > tom-Latitude-3570.42516: tcp 361
03:55:29.255426 IP tom-Latitude-3570.42516 > 2.56.9.15.8333: tcp 0
03:55:29.255656 IP tom-Latitude-3570.42516 > 2.56.9.15.8333: tcp 24
03:55:29.257211 IP tom-Latitude-3570.42516 > 2.56.9.15.8333: tcp 37
03:55:29.293847 IP 2.56.9.15.8333 > tom-Latitude-3570.42516: tcp 0
03:55:29.294420 IP 2.56.9.15.8333 > tom-Latitude-3570.42516: tcp 0
03:55:29.456436 IP tom-Latitude-3570.57976 > 167.99.216.145.8333: tcp 24
03:55:29.464699 IP tom-Latitude-3570.57976 > 167.99.216.145.8333: tcp 217
