20:03:04.533650 IP 172.214.77.34.bc.googleusercontent.com.8333 > tom-Latitude-3570.56244: tcp 24
20:03:04.533677 IP 172.214.77.34.bc.googleusercontent.com.8333 > tom-Latitude-3570.56244: tcp 217
20:03:04.533682 IP host93-234-110-95.serverdedicati.aruba.it.8333 > tom-Latitude-3570.34082: tcp 24
20:03:04.533687 IP host93-234-110-95.serverdedicati.aruba.it.8333 > tom-Latitude-3570.34082: tcp 937
20:03:04.533750 IP tom-Latitude-3570.56244 > 172.214.77.34.bc.googleusercontent.com.8333: tcp 0
20:03:04.533796 IP tom-Latitude-3570.34082 > host93-234-110-95.serverdedicati.aruba.it.8333: tcp 0
20:03:04.534028 IP tom-Latitude-3570.56244 > 172.214.77.34.bc.googleusercontent.com.8333: tcp 24
20:03:04.535095 IP tom-Latitude-3570.56244 > 172.214.77.34.bc.googleusercontent.com.8333: tcp 73
20:03:04.540535 IP 172.214.77.34.bc.googleusercontent.com.8333 > tom-Latitude-3570.56244: tcp 217
20:03:04.540550 IP tom-Latitude-3570.56244 > 172.214.77.34.bc.googleusercontent.com.8333: tcp 0
20:03:04.543604 IP host93-234-110-95.serverdedicati.aruba.it.8333 > tom-Latitude-3570.34082: tcp 937
20:03:04.543609 IP tom-Latitude-3570.34082 > host93-234-110-95.serverdedicati.aruba.it.8333: tcp 0
20:03:04.635736 IP tom-Latitude-3570.56244 > 172.214.77.34.bc.googleusercontent.com.8333: tcp 73
20:03:04.735772 IP c-73-101-52-184.hsd1.pa.comcast.net.8333 > tom-Latitude-3570.59818: tcp 24
20:03:04.735785 IP tom-Latitude-3570.59818 > c-73-101-52-184.hsd1.pa.comcast.net.8333: tcp 0
20:03:04.739429 IP c-73-101-52-184.hsd1.pa.comcast.net.8333 > tom-Latitude-3570.59818: tcp 73
20:03:04.739442 IP tom-Latitude-3570.59818 > c-73-101-52-184.hsd1.pa.comcast.net.8333: tcp 0
20:03:04.770234 IP 172.214.77.34.bc.googleusercontent.com.8333 > tom-Latitude-3570.56244: tcp 0
20:03:04.770240 IP 172.214.77.34.bc.googleusercontent.com.8333 > tom-Latitude-3570.56244: tcp 0
20:03:04.770259 IP 172.214.77.34.bc.googleusercontent.com.8333 > tom-Latitude-3570.56244: tcp 0
20:03:04.829689 IP 172.214.77.34.bc.googleusercontent.com.8333 > tom-Latitude-3570.56244: tcp 24
20:03:04.829706 IP tom-Latitude-3570.56244 > 172.214.77.34.bc.googleusercontent.com.8333: tcp 0
20:03:04.830370 IP 172.214.77.34.bc.googleusercontent.com.8333 > tom-Latitude-3570.56244: tcp 223
20:03:04.830377 IP tom-Latitude-3570.56244 > 172.214.77.34.bc.googleusercontent.com.8333: tcp 0
20:03:04.830381 IP 172.214.77.34.bc.googleusercontent.com.8333 > tom-Latitude-3570.56244: tcp 24
20:03:04.830383 IP tom-Latitude-3570.56244 > 172.214.77.34.bc.googleusercontent.com.8333: tcp 0
20:03:04.830385 IP 172.214.77.34.bc.googleusercontent.com.8333 > tom-Latitude-3570.56244: tcp 226
20:03:04.830387 IP tom-Latitude-3570.56244 > 172.214.77.34.bc.googleusercontent.com.8333: tcp 0
20:03:05.503564 IP 59.110.157.16.8333 > tom-Latitude-3570.47822: tcp 24
20:03:05.503575 IP tom-Latitude-3570.47822 > 59.110.157.16.8333: tcp 0
20:03:05.503599 IP 59.110.157.16.8333 > tom-Latitude-3570.47822: tcp 289
20:03:05.503602 IP tom-Latitude-3570.47822 > 59.110.157.16.8333: tcp 0
20:03:05.503823 IP tom-Latitude-3570.47822 > 59.110.157.16.8333: tcp 24
20:03:05.504921 IP tom-Latitude-3570.47822 > 59.110.157.16.8333: tcp 73
20:03:05.539708 IP 59.110.157.16.8333 > tom-Latitude-3570.47822: tcp 0
20:03:05.543478 IP 59.110.157.16.8333 > tom-Latitude-3570.47822: tcp 0
20:03:05.967291 IP 59.110.157.16.8333 > tom-Latitude-3570.47822: tcp 24
20:03:05.967310 IP 59.110.157.16.8333 > tom-Latitude-3570.47822: tcp 374
20:03:05.967313 IP 59.110.157.16.8333 > tom-Latitude-3570.47822: tcp 24
20:03:05.967315 IP ec2-52-56-97-80.eu-west-2.compute.amazonaws.com.8333 > tom-Latitude-3570.36650: tcp 24
20:03:05.967318 IP ec2-52-56-97-80.eu-west-2.compute.amazonaws.com.8333 > tom-Latitude-3570.36650: tcp 505
20:03:05.967405 IP tom-Latitude-3570.36650 > ec2-52-56-97-80.eu-west-2.compute.amazonaws.com.8333: tcp 0
20:03:05.967439 IP tom-Latitude-3570.47822 > 59.110.157.16.8333: tcp 0
20:03:05.967742 IP tom-Latitude-3570.36650 > ec2-52-56-97-80.eu-west-2.compute.amazonaws.com.8333: tcp 24
20:03:05.969427 IP tom-Latitude-3570.36650 > ec2-52-56-97-80.eu-west-2.compute.amazonaws.com.8333: tcp 109
20:03:05.996311 IP 59.110.157.16.8333 > tom-Latitude-3570.47822: tcp 24
20:03:05.996326 IP tom-Latitude-3570.47822 > 59.110.157.16.8333: tcp 0
20:03:06.005415 IP ec2-52-56-97-80.eu-west-2.compute.amazonaws.com.8333 > tom-Latitude-3570.36650: tcp 0
20:03:06.011315 IP ec2-52-56-97-80.eu-west-2.compute.amazonaws.com.8333 > tom-Latitude-3570.36650: tcp 0
20:03:06.035530 IP 59.110.157.16.8333 > tom-Latitude-3570.47822: tcp 420
20:03:06.035548 IP tom-Latitude-3570.47822 > 59.110.157.16.8333: tcp 0
20:03:06.069688 IP ec2-52-56-97-80.eu-west-2.compute.amazonaws.com.8333 > tom-Latitude-3570.36650: tcp 24
20:03:06.070459 IP ec2-52-56-97-80.eu-west-2.compute.amazonaws.com.8333 > tom-Latitude-3570.36650: tcp 370
20:03:06.070464 IP ec2-52-56-97-80.eu-west-2.compute.amazonaws.com.8333 > tom-Latitude-3570.36650: tcp 711
20:03:06.070510 IP tom-Latitude-3570.36650 > ec2-52-56-97-80.eu-west-2.compute.amazonaws.com.8333: tcp 0
20:03:06.172014 IP tom-Latitude-3570.47742 > 97-82-78-25.dhcp.leds.al.charter.com.8333: tcp 24
20:03:06.172054 IP tom-Latitude-3570.36650 > ec2-52-56-97-80.eu-west-2.compute.amazonaws.com.8333: tcp 24
20:03:06.172086 IP tom-Latitude-3570.47822 > 59.110.157.16.8333: tcp 24
20:03:06.172910 IP tom-Latitude-3570.47822 > 59.110.157.16.8333: tcp 109
20:03:06.172915 IP tom-Latitude-3570.36650 > ec2-52-56-97-80.eu-west-2.compute.amazonaws.com.8333: tcp 91
20:03:06.172917 IP tom-Latitude-3570.47742 > 97-82-78-25.dhcp.leds.al.charter.com.8333: tcp 397
20:03:06.207623 IP 97-82-78-25.dhcp.leds.al.charter.com.8333 > tom-Latitude-3570.47742: tcp 0
20:03:06.208260 IP 97-82-78-25.dhcp.leds.al.charter.com.8333 > tom-Latitude-3570.47742: tcp 0
20:03:06.211234 IP ec2-52-56-97-80.eu-west-2.compute.amazonaws.com.8333 > tom-Latitude-3570.36650: tcp 0
20:03:06.215901 IP ec2-52-56-97-80.eu-west-2.compute.amazonaws.com.8333 > tom-Latitude-3570.36650: tcp 0
20:03:06.218622 IP 59.110.157.16.8333 > tom-Latitude-3570.47822: tcp 0
20:03:06.221385 IP 59.110.157.16.8333 > tom-Latitude-3570.47822: tcp 0
20:03:06.227549 IP c-73-101-52-184.hsd1.pa.comcast.net.8333 > tom-Latitude-3570.59818: tcp 24
20:03:06.227560 IP tom-Latitude-3570.59818 > c-73-101-52-184.hsd1.pa.comcast.net.8333: tcp 0
20:03:06.228183 IP c-73-101-52-184.hsd1.pa.comcast.net.8333 > tom-Latitude-3570.59818: tcp 109
20:03:06.228189 IP tom-Latitude-3570.59818 > c-73-101-52-184.hsd1.pa.comcast.net.8333: tcp 0
20:03:06.428712 IP tom-Latitude-3570.59818 > c-73-101-52-184.hsd1.pa.comcast.net.8333: tcp 24
20:03:06.430586 IP tom-Latitude-3570.59818 > c-73-101-52-184.hsd1.pa.comcast.net.8333: tcp 31
20:03:06.463382 IP c-73-101-52-184.hsd1.pa.comcast.net.8333 > tom-Latitude-3570.59818: tcp 0
20:03:06.468125 IP c-73-101-52-184.hsd1.pa.comcast.net.8333 > tom-Latitude-3570.59818: tcp 0
20:03:06.529014 IP tom-Latitude-3570.54046 > 184-101-12-201.phnx.qwest.net.8333: tcp 24
20:03:06.529692 IP tom-Latitude-3570.54046 > 184-101-12-201.phnx.qwest.net.8333: tcp 397
20:03:06.565541 IP 184-101-12-201.phnx.qwest.net.8333 > tom-Latitude-3570.54046: tcp 0
20:03:06.566188 IP 184-101-12-201.phnx.qwest.net.8333 > tom-Latitude-3570.54046: tcp 0
20:03:06.991139 IP 184-101-12-201.phnx.qwest.net.8333 > tom-Latitude-3570.54046: tcp 24
20:03:06.991171 IP tom-Latitude-3570.54046 > 184-101-12-201.phnx.qwest.net.8333: tcp 0
20:03:06.991193 IP 184-101-12-201.phnx.qwest.net.8333 > tom-Latitude-3570.54046: tcp 37
20:03:06.991211 IP tom-Latitude-3570.54046 > 184-101-12-201.phnx.qwest.net.8333: tcp 0
20:03:06.991363 IP tom-Latitude-3570.54046 > 184-101-12-201.phnx.qwest.net.8333: tcp 24
20:03:06.992631 IP tom-Latitude-3570.54046 > 184-101-12-201.phnx.qwest.net.8333: tcp 437
20:03:07.000628 IP 184-101-12-201.phnx.qwest.net.8333 > tom-Latitude-3570.54046: tcp 37
20:03:07.000690 IP tom-Latitude-3570.54046 > 184-101-12-201.phnx.qwest.net.8333: tcp 0
20:03:07.028596 IP 184-101-12-201.phnx.qwest.net.8333 > tom-Latitude-3570.54046: tcp 0
20:03:07.051220 IP 184-101-12-201.phnx.qwest.net.8333 > tom-Latitude-3570.54046: tcp 0
20:03:07.592549 IP tom-Latitude-3570.59818 > c-73-101-52-184.hsd1.pa.comcast.net.8333: tcp 24
20:03:07.594737 IP tom-Latitude-3570.59818 > c-73-101-52-184.hsd1.pa.comcast.net.8333: tcp 73
20:03:07.631523 IP c-73-101-52-184.hsd1.pa.comcast.net.8333 > tom-Latitude-3570.59818: tcp 0
20:03:07.632212 IP c-73-101-52-184.hsd1.pa.comcast.net.8333 > tom-Latitude-3570.59818: tcp 0
20:03:08.834403 IP ec2-52-56-97-80.eu-west-2.compute.amazonaws.com.8333 > tom-Latitude-3570.36650: tcp 24
20:03:08.834422 IP ec2-52-56-97-80.eu-west-2.compute.amazonaws.com.8333 > tom-Latitude-3570.36650: tcp 217
20:03:08.834508 IP tom-Latitude-3570.36650 > ec2-52-56-97-80.eu-west-2.compute.amazonaws.com.8333: tcp 0
20:03:08.834764 IP tom-Latitude-3570.36650 > ec2-52-56-97-80.eu-west-2.compute.amazonaws.com.8333: tcp 24
20:03:08.835837 IP tom-Latitude-3570.36650 > ec2-52-56-97-80.eu-west-2.compute.amazonaws.com.8333: tcp 217
20:03:08.873353 IP ec2-52-56-97-80.eu-west-2.compute.amazonaws.com.8333 > tom-Latitude-3570.36650: tcp 0
20:03:08.885381 IP ec2-52-56-97-80.eu-west-2.compute.amazonaws.com.8333 > tom-Latitude-3570.36650: tcp 0
20:03:08.943960 IP ec2-52-56-97-80.eu-west-2.compute.amazonaws.com.8333 > tom-Latitude-3570.36650: tcp 24
20:03:08.943976 IP ec2-52-56-97-80.eu-west-2.compute.amazonaws.com.8333 > tom-Latitude-3570.36650: tcp 249
20:03:08.944057 IP tom-Latitude-3570.36650 > ec2-52-56-97-80.eu-west-2.compute.amazonaws.com.8333: tcp 0
20:03:08.946838 IP ec2-52-56-97-80.eu-west-2.compute.amazonaws.com.8333 > tom-Latitude-3570.36650: tcp 1314
20:03:08.950357 IP ec2-52-56-97-80.eu-west-2.compute.amazonaws.com.8333 > tom-Latitude-3570.36650: tcp 523
20:03:08.950420 IP tom-Latitude-3570.36650 > ec2-52-56-97-80.eu-west-2.compute.amazonaws.com.8333: tcp 0
20:03:09.351662 IP tom-Latitude-3570.33922 > pool-108-20-207-31.bstnma.fios.verizon.net.8333: tcp 24
20:03:09.353486 IP tom-Latitude-3570.33922 > pool-108-20-207-31.bstnma.fios.verizon.net.8333: tcp 524
20:03:09.401718 IP pool-108-20-207-31.bstnma.fios.verizon.net.8333 > tom-Latitude-3570.33922: tcp 0
20:03:09.452471 IP tom-Latitude-3570.34082 > host93-234-110-95.serverdedicati.aruba.it.8333: tcp 24
20:03:09.453388 IP tom-Latitude-3570.34082 > host93-234-110-95.serverdedicati.aruba.it.8333: tcp 397
20:03:09.631784 IP tom-Latitude-3570.34082 > host93-234-110-95.serverdedicati.aruba.it.8333: tcp 397
20:03:09.634354 IP host93-234-110-95.serverdedicati.aruba.it.8333 > tom-Latitude-3570.34082: tcp 0
20:03:09.638093 IP host93-234-110-95.serverdedicati.aruba.it.8333 > tom-Latitude-3570.34082: tcp 0
20:03:09.671360 IP host93-234-110-95.serverdedicati.aruba.it.8333 > tom-Latitude-3570.34082: tcp 0
20:03:10.053629 IP tom-Latitude-3570.59818 > c-73-101-52-184.hsd1.pa.comcast.net.8333: tcp 24
20:03:10.056377 IP tom-Latitude-3570.59818 > c-73-101-52-184.hsd1.pa.comcast.net.8333: tcp 217
20:03:10.057038 IP 97-82-78-25.dhcp.leds.al.charter.com.8333 > tom-Latitude-3570.47742: tcp 24
20:03:10.057049 IP 97-82-78-25.dhcp.leds.al.charter.com.8333 > tom-Latitude-3570.47742: tcp 253
20:03:10.057061 IP tom-Latitude-3570.47742 > 97-82-78-25.dhcp.leds.al.charter.com.8333: tcp 0
20:03:10.057207 IP tom-Latitude-3570.47742 > 97-82-78-25.dhcp.leds.al.charter.com.8333: tcp 24
20:03:10.062477 IP tom-Latitude-3570.47742 > 97-82-78-25.dhcp.leds.al.charter.com.8333: tcp 37
20:03:10.119375 IP c-73-101-52-184.hsd1.pa.comcast.net.8333 > tom-Latitude-3570.59818: tcp 0
20:03:10.123296 IP 97-82-78-25.dhcp.leds.al.charter.com.8333 > tom-Latitude-3570.47742: tcp 253
20:03:10.123329 IP tom-Latitude-3570.47742 > 97-82-78-25.dhcp.leds.al.charter.com.8333: tcp 0
20:03:10.123772 IP c-73-101-52-184.hsd1.pa.comcast.net.8333 > tom-Latitude-3570.59818: tcp 0
20:03:10.126211 IP 97-82-78-25.dhcp.leds.al.charter.com.8333 > tom-Latitude-3570.47742: tcp 0
20:03:10.132126 IP 97-82-78-25.dhcp.leds.al.charter.com.8333 > tom-Latitude-3570.47742: tcp 0
20:03:10.678085 IP 97-82-78-25.dhcp.leds.al.charter.com.8333 > tom-Latitude-3570.47742: tcp 24
20:03:10.678105 IP tom-Latitude-3570.47742 > 97-82-78-25.dhcp.leds.al.charter.com.8333: tcp 0
20:03:10.678120 IP 97-82-78-25.dhcp.leds.al.charter.com.8333 > tom-Latitude-3570.47742: tcp 217
20:03:10.678124 IP tom-Latitude-3570.47742 > 97-82-78-25.dhcp.leds.al.charter.com.8333: tcp 0
20:03:10.678128 IP host93-234-110-95.serverdedicati.aruba.it.8333 > tom-Latitude-3570.34082: tcp 24
20:03:10.678131 IP tom-Latitude-3570.34082 > host93-234-110-95.serverdedicati.aruba.it.8333: tcp 0
20:03:10.678134 IP host93-234-110-95.serverdedicati.aruba.it.8333 > tom-Latitude-3570.34082: tcp 109
20:03:10.678136 IP tom-Latitude-3570.34082 > host93-234-110-95.serverdedicati.aruba.it.8333: tcp 0
20:03:10.678139 IP host93-234-110-95.serverdedicati.aruba.it.8333 > tom-Latitude-3570.34082: tcp 109
20:03:10.678142 IP tom-Latitude-3570.34082 > host93-234-110-95.serverdedicati.aruba.it.8333: tcp 0
20:03:10.678530 IP tom-Latitude-3570.34082 > host93-234-110-95.serverdedicati.aruba.it.8333: tcp 24
20:03:10.679451 IP tom-Latitude-3570.34082 > host93-234-110-95.serverdedicati.aruba.it.8333: tcp 73
20:03:10.713514 IP host93-234-110-95.serverdedicati.aruba.it.8333 > tom-Latitude-3570.34082: tcp 0
20:03:10.714040 IP host93-234-110-95.serverdedicati.aruba.it.8333 > tom-Latitude-3570.34082: tcp 0
20:03:10.979149 IP tom-Latitude-3570.54046 > 184-101-12-201.phnx.qwest.net.8333: tcp 24
20:03:10.982352 IP tom-Latitude-3570.54046 > 184-101-12-201.phnx.qwest.net.8333: tcp 253
20:03:10.983238 IP host93-234-110-95.serverdedicati.aruba.it.8333 > tom-Latitude-3570.34082: tcp 24
20:03:10.984597 IP host93-234-110-95.serverdedicati.aruba.it.8333 > tom-Latitude-3570.34082: tcp 223
20:03:10.984606 IP host93-234-110-95.serverdedicati.aruba.it.8333 > tom-Latitude-3570.34082: tcp 24
20:03:10.984608 IP host93-234-110-95.serverdedicati.aruba.it.8333 > tom-Latitude-3570.34082: tcp 520
20:03:10.984677 IP tom-Latitude-3570.34082 > host93-234-110-95.serverdedicati.aruba.it.8333: tcp 0
20:03:11.031311 IP 184-101-12-201.phnx.qwest.net.8333 > tom-Latitude-3570.54046: tcp 0
20:03:11.031851 IP 184-101-12-201.phnx.qwest.net.8333 > tom-Latitude-3570.54046: tcp 0
20:03:11.288579 IP tom-Latitude-3570.47822 > 59.110.157.16.8333: tcp 24
20:03:11.289537 IP tom-Latitude-3570.47822 > 59.110.157.16.8333: tcp 325
20:03:11.290137 IP 184-101-12-201.phnx.qwest.net.8333 > tom-Latitude-3570.54046: tcp 24
20:03:11.290155 IP tom-Latitude-3570.54046 > 184-101-12-201.phnx.qwest.net.8333: tcp 0
20:03:11.290167 IP 184-101-12-201.phnx.qwest.net.8333 > tom-Latitude-3570.54046: tcp 253
20:03:11.290172 IP tom-Latitude-3570.54046 > 184-101-12-201.phnx.qwest.net.8333: tcp 0
20:03:11.321461 IP 59.110.157.16.8333 > tom-Latitude-3570.47822: tcp 0
20:03:11.322146 IP 59.110.157.16.8333 > tom-Latitude-3570.47822: tcp 0
20:03:11.390710 IP tom-Latitude-3570.36650 > ec2-52-56-97-80.eu-west-2.compute.amazonaws.com.8333: tcp 24
20:03:11.391876 IP tom-Latitude-3570.36650 > ec2-52-56-97-80.eu-west-2.compute.amazonaws.com.8333: tcp 109
20:03:11.423394 IP ec2-52-56-97-80.eu-west-2.compute.amazonaws.com.8333 > tom-Latitude-3570.36650: tcp 0
20:03:11.423909 IP ec2-52-56-97-80.eu-west-2.compute.amazonaws.com.8333 > tom-Latitude-3570.36650: tcp 0
20:03:11.891852 IP tom-Latitude-3570.59818 > c-73-101-52-184.hsd1.pa.comcast.net.8333: tcp 24
20:03:11.894156 IP tom-Latitude-3570.59818 > c-73-101-52-184.hsd1.pa.comcast.net.8333: tcp 109
20:03:11.992051 IP tom-Latitude-3570.47742 > 97-82-78-25.dhcp.leds.al.charter.com.8333: tcp 24
20:03:11.992779 IP tom-Latitude-3570.47742 > 97-82-78-25.dhcp.leds.al.charter.com.8333: tcp 73
20:03:12.019691 IP tom-Latitude-3570.59818 > c-73-101-52-184.hsd1.pa.comcast.net.8333: tcp 109
20:03:12.092368 IP tom-Latitude-3570.56244 > 172.214.77.34.bc.googleusercontent.com.8333: tcp 24
20:03:12.093301 IP tom-Latitude-3570.56244 > 172.214.77.34.bc.googleusercontent.com.8333: tcp 505
20:03:12.123704 IP tom-Latitude-3570.47742 > 97-82-78-25.dhcp.leds.al.charter.com.8333: tcp 73
20:03:12.129198 IP c-73-101-52-184.hsd1.pa.comcast.net.8333 > tom-Latitude-3570.59818: tcp 0
20:03:12.129231 IP c-73-101-52-184.hsd1.pa.comcast.net.8333 > tom-Latitude-3570.59818: tcp 0
20:03:12.129234 IP 97-82-78-25.dhcp.leds.al.charter.com.8333 > tom-Latitude-3570.47742: tcp 0
20:03:12.130358 IP 97-82-78-25.dhcp.leds.al.charter.com.8333 > tom-Latitude-3570.47742: tcp 0
20:03:12.131523 IP c-73-101-52-184.hsd1.pa.comcast.net.8333 > tom-Latitude-3570.59818: tcp 0
20:03:12.155448 IP 172.214.77.34.bc.googleusercontent.com.8333 > tom-Latitude-3570.56244: tcp 0
20:03:12.175338 IP 172.214.77.34.bc.googleusercontent.com.8333 > tom-Latitude-3570.56244: tcp 0
20:03:12.176167 IP 97-82-78-25.dhcp.leds.al.charter.com.8333 > tom-Latitude-3570.47742: tcp 0
20:03:12.227603 IP 172.214.77.34.bc.googleusercontent.com.8333 > tom-Latitude-3570.56244: tcp 24
20:03:12.227617 IP tom-Latitude-3570.56244 > 172.214.77.34.bc.googleusercontent.com.8333: tcp 0
20:03:12.243744 IP 172.214.77.34.bc.googleusercontent.com.8333 > tom-Latitude-3570.56244: tcp 685
20:03:12.243776 IP tom-Latitude-3570.56244 > 172.214.77.34.bc.googleusercontent.com.8333: tcp 0
20:03:12.244109 IP tom-Latitude-3570.56244 > 172.214.77.34.bc.googleusercontent.com.8333: tcp 24
20:03:12.245365 IP tom-Latitude-3570.56244 > 172.214.77.34.bc.googleusercontent.com.8333: tcp 181
20:03:12.287663 IP 59.110.157.16.8333 > tom-Latitude-3570.47822: tcp 24
20:03:12.287688 IP tom-Latitude-3570.47822 > 59.110.157.16.8333: tcp 0
20:03:12.287703 IP 59.110.157.16.8333 > tom-Latitude-3570.47822: tcp 181
20:03:12.287708 IP tom-Latitude-3570.47822 > 59.110.157.16.8333: tcp 0
20:03:12.289855 IP 172.214.77.34.bc.googleusercontent.com.8333 > tom-Latitude-3570.56244: tcp 0
20:03:12.297281 IP 172.214.77.34.bc.googleusercontent.com.8333 > tom-Latitude-3570.56244: tcp 0
20:03:12.370461 IP 172.214.77.34.bc.googleusercontent.com.8333 > tom-Latitude-3570.56244: tcp 24
20:03:12.371393 IP 172.214.77.34.bc.googleusercontent.com.8333 > tom-Latitude-3570.56244: tcp 373
20:03:12.371410 IP 172.214.77.34.bc.googleusercontent.com.8333 > tom-Latitude-3570.56244: tcp 24
20:03:12.371413 IP 172.214.77.34.bc.googleusercontent.com.8333 > tom-Latitude-3570.56244: tcp 247
20:03:12.371415 IP 172.214.77.34.bc.googleusercontent.com.8333 > tom-Latitude-3570.56244: tcp 24
20:03:12.371417 IP 172.214.77.34.bc.googleusercontent.com.8333 > tom-Latitude-3570.56244: tcp 519
20:03:12.371420 IP 172.214.77.34.bc.googleusercontent.com.8333 > tom-Latitude-3570.56244: tcp 24
20:03:12.371422 IP 172.214.77.34.bc.googleusercontent.com.8333 > tom-Latitude-3570.56244: tcp 728
20:03:12.371424 IP 172.214.77.34.bc.googleusercontent.com.8333 > tom-Latitude-3570.56244: tcp 24
20:03:12.371512 IP tom-Latitude-3570.56244 > 172.214.77.34.bc.googleusercontent.com.8333: tcp 0
20:03:12.373745 IP 172.214.77.34.bc.googleusercontent.com.8333 > tom-Latitude-3570.56244: tcp 403
20:03:12.415789 IP tom-Latitude-3570.56244 > 172.214.77.34.bc.googleusercontent.com.8333: tcp 0
20:03:12.476974 IP tom-Latitude-3570.47742 > 97-82-78-25.dhcp.leds.al.charter.com.8333: tcp 24
20:03:12.477061 IP tom-Latitude-3570.33922 > pool-108-20-207-31.bstnma.fios.verizon.net.8333: tcp 24
20:03:12.477815 IP tom-Latitude-3570.33922 > pool-108-20-207-31.bstnma.fios.verizon.net.8333: tcp 289
20:03:12.477822 IP tom-Latitude-3570.47742 > 97-82-78-25.dhcp.leds.al.charter.com.8333: tcp 181
20:03:12.511583 IP 97-82-78-25.dhcp.leds.al.charter.com.8333 > tom-Latitude-3570.47742: tcp 0
20:03:12.514147 IP 97-82-78-25.dhcp.leds.al.charter.com.8333 > tom-Latitude-3570.47742: tcp 0
20:03:12.519457 IP pool-108-20-207-31.bstnma.fios.verizon.net.8333 > tom-Latitude-3570.33922: tcp 0
20:03:12.577285 IP tom-Latitude-3570.34082 > host93-234-110-95.serverdedicati.aruba.it.8333: tcp 24
20:03:12.578003 IP tom-Latitude-3570.34082 > host93-234-110-95.serverdedicati.aruba.it.8333: tcp 181
20:03:12.586128 IP 97-82-78-25.dhcp.leds.al.charter.com.8333 > tom-Latitude-3570.47742: tcp 24
20:03:12.586148 IP tom-Latitude-3570.47742 > 97-82-78-25.dhcp.leds.al.charter.com.8333: tcp 0
20:03:12.586806 IP 97-82-78-25.dhcp.leds.al.charter.com.8333 > tom-Latitude-3570.47742: tcp 181
20:03:12.586816 IP tom-Latitude-3570.47742 > 97-82-78-25.dhcp.leds.al.charter.com.8333: tcp 0
20:03:12.611373 IP host93-234-110-95.serverdedicati.aruba.it.8333 > tom-Latitude-3570.34082: tcp 0
20:03:12.612038 IP host93-234-110-95.serverdedicati.aruba.it.8333 > tom-Latitude-3570.34082: tcp 0
20:03:12.987789 IP tom-Latitude-3570.59818 > c-73-101-52-184.hsd1.pa.comcast.net.8333: tcp 24
20:03:12.989715 IP tom-Latitude-3570.59818 > c-73-101-52-184.hsd1.pa.comcast.net.8333: tcp 181
20:03:13.041298 IP c-73-101-52-184.hsd1.pa.comcast.net.8333 > tom-Latitude-3570.59818: tcp 0
20:03:13.041311 IP c-73-101-52-184.hsd1.pa.comcast.net.8333 > tom-Latitude-3570.59818: tcp 0
20:03:13.688951 IP tom-Latitude-3570.54046 > 184-101-12-201.phnx.qwest.net.8333: tcp 24
20:03:13.693075 IP tom-Latitude-3570.54046 > 184-101-12-201.phnx.qwest.net.8333: tcp 253
20:03:13.749537 IP ec2-52-56-97-80.eu-west-2.compute.amazonaws.com.8333 > tom-Latitude-3570.36650: tcp 24
20:03:13.750210 IP ec2-52-56-97-80.eu-west-2.compute.amazonaws.com.8333 > tom-Latitude-3570.36650: tcp 289
20:03:13.750270 IP tom-Latitude-3570.36650 > ec2-52-56-97-80.eu-west-2.compute.amazonaws.com.8333: tcp 0
20:03:13.750469 IP tom-Latitude-3570.36650 > ec2-52-56-97-80.eu-west-2.compute.amazonaws.com.8333: tcp 24
20:03:13.751712 IP tom-Latitude-3570.36650 > ec2-52-56-97-80.eu-west-2.compute.amazonaws.com.8333: tcp 109
20:03:13.807771 IP tom-Latitude-3570.54046 > 184-101-12-201.phnx.qwest.net.8333: tcp 253
20:03:13.851699 IP tom-Latitude-3570.36650 > ec2-52-56-97-80.eu-west-2.compute.amazonaws.com.8333: tcp 109
20:03:13.876549 IP ec2-52-56-97-80.eu-west-2.compute.amazonaws.com.8333 > tom-Latitude-3570.36650: tcp 289
20:03:13.876567 IP tom-Latitude-3570.36650 > ec2-52-56-97-80.eu-west-2.compute.amazonaws.com.8333: tcp 0
20:03:13.949640 IP 184-101-12-201.phnx.qwest.net.8333 > tom-Latitude-3570.54046: tcp 0
20:03:13.952607 IP 184-101-12-201.phnx.qwest.net.8333 > tom-Latitude-3570.54046: tcp 0
20:03:13.952620 IP ec2-52-56-97-80.eu-west-2.compute.amazonaws.com.8333 > tom-Latitude-3570.36650: tcp 0
20:03:13.952625 IP ec2-52-56-97-80.eu-west-2.compute.amazonaws.com.8333 > tom-Latitude-3570.36650: tcp 0
20:03:13.952627 IP 184-101-12-201.phnx.qwest.net.8333 > tom-Latitude-3570.54046: tcp 0
20:03:13.953370 IP ec2-52-56-97-80.eu-west-2.compute.amazonaws.com.8333 > tom-Latitude-3570.36650: tcp 0
20:03:14.023614 IP ec2-52-56-97-80.eu-west-2.compute.amazonaws.com.8333 > tom-Latitude-3570.36650: tcp 24
20:03:14.023627 IP tom-Latitude-3570.36650 > ec2-52-56-97-80.eu-west-2.compute.amazonaws.com.8333: tcp 0
20:03:14.024404 IP ec2-52-56-97-80.eu-west-2.compute.amazonaws.com.8333 > tom-Latitude-3570.36650: tcp 372
20:03:14.024407 IP tom-Latitude-3570.36650 > ec2-52-56-97-80.eu-west-2.compute.amazonaws.com.8333: tcp 0
20:03:14.024411 IP ec2-52-56-97-80.eu-west-2.compute.amazonaws.com.8333 > tom-Latitude-3570.36650: tcp 527
20:03:14.024412 IP tom-Latitude-3570.36650 > ec2-52-56-97-80.eu-west-2.compute.amazonaws.com.8333: tcp 0
20:03:14.326063 IP tom-Latitude-3570.59818 > c-73-101-52-184.hsd1.pa.comcast.net.8333: tcp 24
20:03:14.328349 IP tom-Latitude-3570.59818 > c-73-101-52-184.hsd1.pa.comcast.net.8333: tcp 109
20:03:14.375314 IP c-73-101-52-184.hsd1.pa.comcast.net.8333 > tom-Latitude-3570.59818: tcp 0
20:03:14.393358 IP c-73-101-52-184.hsd1.pa.comcast.net.8333 > tom-Latitude-3570.59818: tcp 0
20:03:14.426313 IP tom-Latitude-3570.47742 > 97-82-78-25.dhcp.leds.al.charter.com.8333: tcp 24
20:03:14.427080 IP tom-Latitude-3570.47742 > 97-82-78-25.dhcp.leds.al.charter.com.8333: tcp 109
20:03:14.487984 IP 97-82-78-25.dhcp.leds.al.charter.com.8333 > tom-Latitude-3570.47742: tcp 0
20:03:14.503160 IP 97-82-78-25.dhcp.leds.al.charter.com.8333 > tom-Latitude-3570.47742: tcp 0
20:03:14.978456 IP pool-108-20-207-31.bstnma.fios.verizon.net.8333 > tom-Latitude-3570.33922: tcp 24
20:03:14.978471 IP pool-108-20-207-31.bstnma.fios.verizon.net.8333 > tom-Latitude-3570.33922: tcp 433
20:03:14.978508 IP tom-Latitude-3570.33922 > pool-108-20-207-31.bstnma.fios.verizon.net.8333: tcp 0
20:03:14.978803 IP tom-Latitude-3570.33922 > pool-108-20-207-31.bstnma.fios.verizon.net.8333: tcp 24
20:03:14.979844 IP tom-Latitude-3570.33922 > pool-108-20-207-31.bstnma.fios.verizon.net.8333: tcp 325
20:03:15.053352 IP pool-108-20-207-31.bstnma.fios.verizon.net.8333 > tom-Latitude-3570.33922: tcp 0
20:03:15.079008 IP tom-Latitude-3570.34082 > host93-234-110-95.serverdedicati.aruba.it.8333: tcp 24
20:03:15.079779 IP tom-Latitude-3570.34082 > host93-234-110-95.serverdedicati.aruba.it.8333: tcp 109
20:03:15.107486 IP host93-234-110-95.serverdedicati.aruba.it.8333 > tom-Latitude-3570.34082: tcp 0
20:03:15.110691 IP host93-234-110-95.serverdedicati.aruba.it.8333 > tom-Latitude-3570.34082: tcp 0
20:03:15.187830 IP pool-108-20-207-31.bstnma.fios.verizon.net.8333 > tom-Latitude-3570.33922: tcp 24
20:03:15.188477 IP pool-108-20-207-31.bstnma.fios.verizon.net.8333 > tom-Latitude-3570.33922: tcp 248
20:03:15.188496 IP pool-108-20-207-31.bstnma.fios.verizon.net.8333 > tom-Latitude-3570.33922: tcp 24
20:03:15.188542 IP tom-Latitude-3570.33922 > pool-108-20-207-31.bstnma.fios.verizon.net.8333: tcp 0
20:03:15.191059 IP pool-108-20-207-31.bstnma.fios.verizon.net.8333 > tom-Latitude-3570.33922: tcp 338
20:03:15.191972 IP pool-108-20-207-31.bstnma.fios.verizon.net.8333 > tom-Latitude-3570.33922: tcp 24
20:03:15.191986 IP pool-108-20-207-31.bstnma.fios.verizon.net.8333 > tom-Latitude-3570.33922: tcp 782
20:03:15.191990 IP pool-108-20-207-31.bstnma.fios.verizon.net.8333 > tom-Latitude-3570.33922: tcp 24
20:03:15.191993 IP pool-108-20-207-31.bstnma.fios.verizon.net.8333 > tom-Latitude-3570.33922: tcp 223
20:03:15.191995 IP pool-108-20-207-31.bstnma.fios.verizon.net.8333 > tom-Latitude-3570.33922: tcp 24
20:03:15.191997 IP pool-108-20-207-31.bstnma.fios.verizon.net.8333 > tom-Latitude-3570.33922: tcp 223
20:03:15.192001 IP pool-108-20-207-31.bstnma.fios.verizon.net.8333 > tom-Latitude-3570.33922: tcp 24
20:03:15.192003 IP pool-108-20-207-31.bstnma.fios.verizon.net.8333 > tom-Latitude-3570.33922: tcp 224
20:03:15.192021 IP tom-Latitude-3570.33922 > pool-108-20-207-31.bstnma.fios.verizon.net.8333: tcp 0
20:03:15.194368 IP pool-108-20-207-31.bstnma.fios.verizon.net.8333 > tom-Latitude-3570.33922: tcp 24
20:03:15.195049 IP pool-108-20-207-31.bstnma.fios.verizon.net.8333 > tom-Latitude-3570.33922: tcp 192
20:03:15.195054 IP pool-108-20-207-31.bstnma.fios.verizon.net.8333 > tom-Latitude-3570.33922: tcp 24
20:03:15.195057 IP pool-108-20-207-31.bstnma.fios.verizon.net.8333 > tom-Latitude-3570.33922: tcp 223
20:03:15.195060 IP pool-108-20-207-31.bstnma.fios.verizon.net.8333 > tom-Latitude-3570.33922: tcp 24
20:03:15.195085 IP tom-Latitude-3570.33922 > pool-108-20-207-31.bstnma.fios.verizon.net.8333: tcp 0
20:03:15.197586 IP pool-108-20-207-31.bstnma.fios.verizon.net.8333 > tom-Latitude-3570.33922: tcp 226
20:03:15.239742 IP tom-Latitude-3570.33922 > pool-108-20-207-31.bstnma.fios.verizon.net.8333: tcp 0
20:03:15.798112 IP 184-101-12-201.phnx.qwest.net.8333 > tom-Latitude-3570.54046: tcp 24
20:03:15.798192 IP tom-Latitude-3570.54046 > 184-101-12-201.phnx.qwest.net.8333: tcp 0
20:03:15.798232 IP 184-101-12-201.phnx.qwest.net.8333 > tom-Latitude-3570.54046: tcp 397
20:03:15.798242 IP tom-Latitude-3570.54046 > 184-101-12-201.phnx.qwest.net.8333: tcp 0
20:03:15.798246 IP 184-101-12-201.phnx.qwest.net.8333 > tom-Latitude-3570.54046: tcp 397
20:03:15.798251 IP tom-Latitude-3570.54046 > 184-101-12-201.phnx.qwest.net.8333: tcp 0
20:03:15.798255 IP c-73-101-52-184.hsd1.pa.comcast.net.8333 > tom-Latitude-3570.59818: tcp 24
20:03:15.798261 IP tom-Latitude-3570.59818 > c-73-101-52-184.hsd1.pa.comcast.net.8333: tcp 0
20:03:15.798265 IP c-73-101-52-184.hsd1.pa.comcast.net.8333 > tom-Latitude-3570.59818: tcp 289
20:03:15.798268 IP tom-Latitude-3570.59818 > c-73-101-52-184.hsd1.pa.comcast.net.8333: tcp 0
20:03:15.798271 IP 59.110.157.16.8333 > tom-Latitude-3570.47822: tcp 24
20:03:15.798278 IP tom-Latitude-3570.47822 > 59.110.157.16.8333: tcp 0
20:03:15.798282 IP 59.110.157.16.8333 > tom-Latitude-3570.47822: tcp 541
20:03:15.798286 IP tom-Latitude-3570.47822 > 59.110.157.16.8333: tcp 0
20:03:15.798671 IP tom-Latitude-3570.36650 > ec2-52-56-97-80.eu-west-2.compute.amazonaws.com.8333: tcp 24
20:03:15.798941 IP tom-Latitude-3570.59818 > c-73-101-52-184.hsd1.pa.comcast.net.8333: tcp 24
20:03:15.799209 IP tom-Latitude-3570.47822 > 59.110.157.16.8333: tcp 24
20:03:15.799747 IP tom-Latitude-3570.59818 > c-73-101-52-184.hsd1.pa.comcast.net.8333: tcp 37
20:03:15.799758 IP tom-Latitude-3570.36650 > ec2-52-56-97-80.eu-west-2.compute.amazonaws.com.8333: tcp 325
20:03:15.800443 IP tom-Latitude-3570.47822 > 59.110.157.16.8333: tcp 73
20:03:15.837595 IP c-73-101-52-184.hsd1.pa.comcast.net.8333 > tom-Latitude-3570.59818: tcp 0
20:03:15.838176 IP c-73-101-52-184.hsd1.pa.comcast.net.8333 > tom-Latitude-3570.59818: tcp 0
20:03:15.838179 IP 59.110.157.16.8333 > tom-Latitude-3570.47822: tcp 0
20:03:15.841209 IP 59.110.157.16.8333 > tom-Latitude-3570.47822: tcp 0
20:03:15.845204 IP ec2-52-56-97-80.eu-west-2.compute.amazonaws.com.8333 > tom-Latitude-3570.36650: tcp 0
20:03:15.845780 IP ec2-52-56-97-80.eu-west-2.compute.amazonaws.com.8333 > tom-Latitude-3570.36650: tcp 0
20:03:15.845785 IP 172.214.77.34.bc.googleusercontent.com.8333 > tom-Latitude-3570.56244: tcp 24
20:03:15.845797 IP tom-Latitude-3570.56244 > 172.214.77.34.bc.googleusercontent.com.8333: tcp 0
20:03:15.848241 IP 172.214.77.34.bc.googleusercontent.com.8333 > tom-Latitude-3570.56244: tcp 541
20:03:15.848253 IP tom-Latitude-3570.56244 > 172.214.77.34.bc.googleusercontent.com.8333: tcp 0
20:03:16.049057 IP tom-Latitude-3570.34082 > host93-234-110-95.serverdedicati.aruba.it.8333: tcp 24
20:03:16.051058 IP tom-Latitude-3570.34082 > host93-234-110-95.serverdedicati.aruba.it.8333: tcp 325
20:03:16.051618 IP c-73-101-52-184.hsd1.pa.comcast.net.8333 > tom-Latitude-3570.59818: tcp 24
20:03:16.051635 IP c-73-101-52-184.hsd1.pa.comcast.net.8333 > tom-Latitude-3570.59818: tcp 1056
20:03:16.051638 IP host93-234-110-95.serverdedicati.aruba.it.8333 > tom-Latitude-3570.34082: tcp 24
20:03:16.051642 IP host93-234-110-95.serverdedicati.aruba.it.8333 > tom-Latitude-3570.34082: tcp 31
20:03:16.051784 IP tom-Latitude-3570.59818 > c-73-101-52-184.hsd1.pa.comcast.net.8333: tcp 0
20:03:16.051818 IP tom-Latitude-3570.34082 > host93-234-110-95.serverdedicati.aruba.it.8333: tcp 0
20:03:16.085365 IP host93-234-110-95.serverdedicati.aruba.it.8333 > tom-Latitude-3570.34082: tcp 0
20:03:16.085944 IP host93-234-110-95.serverdedicati.aruba.it.8333 > tom-Latitude-3570.34082: tcp 0
20:03:16.089041 IP 59.110.157.16.8333 > tom-Latitude-3570.47822: tcp 24
20:03:16.089826 IP 59.110.157.16.8333 > tom-Latitude-3570.47822: tcp 372
20:03:16.089832 IP 59.110.157.16.8333 > tom-Latitude-3570.47822: tcp 24
20:03:16.089916 IP tom-Latitude-3570.47822 > 59.110.157.16.8333: tcp 0
20:03:16.335779 IP 59.110.157.16.8333 > tom-Latitude-3570.47822: tcp 249
20:03:16.335795 IP ec2-52-56-97-80.eu-west-2.compute.amazonaws.com.8333 > tom-Latitude-3570.36650: tcp 24
20:03:16.335821 IP tom-Latitude-3570.36650 > ec2-52-56-97-80.eu-west-2.compute.amazonaws.com.8333: tcp 0
20:03:16.335832 IP ec2-52-56-97-80.eu-west-2.compute.amazonaws.com.8333 > tom-Latitude-3570.36650: tcp 253
20:03:16.335836 IP tom-Latitude-3570.36650 > ec2-52-56-97-80.eu-west-2.compute.amazonaws.com.8333: tcp 0
20:03:16.336092 IP tom-Latitude-3570.36650 > ec2-52-56-97-80.eu-west-2.compute.amazonaws.com.8333: tcp 24
20:03:16.337247 IP tom-Latitude-3570.36650 > ec2-52-56-97-80.eu-west-2.compute.amazonaws.com.8333: tcp 145
20:03:16.371511 IP ec2-52-56-97-80.eu-west-2.compute.amazonaws.com.8333 > tom-Latitude-3570.36650: tcp 0
20:03:16.379778 IP tom-Latitude-3570.47822 > 59.110.157.16.8333: tcp 0
20:03:16.392416 IP ec2-52-56-97-80.eu-west-2.compute.amazonaws.com.8333 > tom-Latitude-3570.36650: tcp 0
20:03:16.447938 IP ec2-52-56-97-80.eu-west-2.compute.amazonaws.com.8333 > tom-Latitude-3570.36650: tcp 24
20:03:16.451564 IP ec2-52-56-97-80.eu-west-2.compute.amazonaws.com.8333 > tom-Latitude-3570.36650: tcp 833
20:03:16.451631 IP tom-Latitude-3570.36650 > ec2-52-56-97-80.eu-west-2.compute.amazonaws.com.8333: tcp 0
20:03:16.452260 IP ec2-52-56-97-80.eu-west-2.compute.amazonaws.com.8333 > tom-Latitude-3570.36650: tcp 618
20:03:16.495805 IP tom-Latitude-3570.36650 > ec2-52-56-97-80.eu-west-2.compute.amazonaws.com.8333: tcp 0
20:03:16.553912 IP tom-Latitude-3570.56244 > 172.214.77.34.bc.googleusercontent.com.8333: tcp 24
20:03:16.554693 IP tom-Latitude-3570.56244 > 172.214.77.34.bc.googleusercontent.com.8333: tcp 145
20:03:16.605424 IP 172.214.77.34.bc.googleusercontent.com.8333 > tom-Latitude-3570.56244: tcp 0
20:03:16.606019 IP 172.214.77.34.bc.googleusercontent.com.8333 > tom-Latitude-3570.56244: tcp 0
20:03:16.623398 IP 97-82-78-25.dhcp.leds.al.charter.com.8333 > tom-Latitude-3570.47742: tcp 24
20:03:16.623421 IP tom-Latitude-3570.47742 > 97-82-78-25.dhcp.leds.al.charter.com.8333: tcp 0
20:03:16.624104 IP 97-82-78-25.dhcp.leds.al.charter.com.8333 > tom-Latitude-3570.47742: tcp 433
20:03:16.624120 IP tom-Latitude-3570.47742 > 97-82-78-25.dhcp.leds.al.charter.com.8333: tcp 0
20:03:16.724633 IP tom-Latitude-3570.59818 > c-73-101-52-184.hsd1.pa.comcast.net.8333: tcp 24
20:03:16.725451 IP tom-Latitude-3570.59818 > c-73-101-52-184.hsd1.pa.comcast.net.8333: tcp 289
20:03:16.759126 IP c-73-101-52-184.hsd1.pa.comcast.net.8333 > tom-Latitude-3570.59818: tcp 0
20:03:16.762791 IP c-73-101-52-184.hsd1.pa.comcast.net.8333 > tom-Latitude-3570.59818: tcp 0
20:03:17.225742 IP tom-Latitude-3570.47822 > 59.110.157.16.8333: tcp 24
20:03:17.228990 IP tom-Latitude-3570.47822 > 59.110.157.16.8333: tcp 145
20:03:17.238003 IP host93-234-110-95.serverdedicati.aruba.it.8333 > tom-Latitude-3570.34082: tcp 24
20:03:17.238719 IP host93-234-110-95.serverdedicati.aruba.it.8333 > tom-Latitude-3570.34082: tcp 289
20:03:17.238752 IP tom-Latitude-3570.34082 > host93-234-110-95.serverdedicati.aruba.it.8333: tcp 0
20:03:17.238960 IP tom-Latitude-3570.34082 > host93-234-110-95.serverdedicati.aruba.it.8333: tcp 24
20:03:17.240089 IP tom-Latitude-3570.34082 > host93-234-110-95.serverdedicati.aruba.it.8333: tcp 37
20:03:17.287988 IP 59.110.157.16.8333 > tom-Latitude-3570.47822: tcp 0
20:03:17.295545 IP 59.110.157.16.8333 > tom-Latitude-3570.47822: tcp 0
20:03:17.300525 IP host93-234-110-95.serverdedicati.aruba.it.8333 > tom-Latitude-3570.34082: tcp 0
20:03:17.300537 IP host93-234-110-95.serverdedicati.aruba.it.8333 > tom-Latitude-3570.34082: tcp 0
20:03:17.388708 IP host93-234-110-95.serverdedicati.aruba.it.8333 > tom-Latitude-3570.34082: tcp 24
20:03:17.392513 IP host93-234-110-95.serverdedicati.aruba.it.8333 > tom-Latitude-3570.34082: tcp 372
20:03:17.392774 IP tom-Latitude-3570.34082 > host93-234-110-95.serverdedicati.aruba.it.8333: tcp 0
20:03:17.794025 IP tom-Latitude-3570.54046 > 184-101-12-201.phnx.qwest.net.8333: tcp 24
20:03:17.795998 IP tom-Latitude-3570.54046 > 184-101-12-201.phnx.qwest.net.8333: tcp 325
20:03:17.796522 IP 97-82-78-25.dhcp.leds.al.charter.com.8333 > tom-Latitude-3570.47742: tcp 24
20:03:17.796575 IP tom-Latitude-3570.47742 > 97-82-78-25.dhcp.leds.al.charter.com.8333: tcp 0
20:03:17.796595 IP 97-82-78-25.dhcp.leds.al.charter.com.8333 > tom-Latitude-3570.47742: tcp 181
20:03:17.796610 IP tom-Latitude-3570.47742 > 97-82-78-25.dhcp.leds.al.charter.com.8333: tcp 0
20:03:17.855460 IP 184-101-12-201.phnx.qwest.net.8333 > tom-Latitude-3570.54046: tcp 0
20:03:17.856033 IP 184-101-12-201.phnx.qwest.net.8333 > tom-Latitude-3570.54046: tcp 0
20:03:17.921385 IP host93-234-110-95.serverdedicati.aruba.it.8333 > tom-Latitude-3570.34082: tcp 24
20:03:17.922073 IP host93-234-110-95.serverdedicati.aruba.it.8333 > tom-Latitude-3570.34082: tcp 109
20:03:17.922104 IP tom-Latitude-3570.34082 > host93-234-110-95.serverdedicati.aruba.it.8333: tcp 0
20:03:17.922289 IP tom-Latitude-3570.34082 > host93-234-110-95.serverdedicati.aruba.it.8333: tcp 24
20:03:17.924503 IP tom-Latitude-3570.34082 > host93-234-110-95.serverdedicati.aruba.it.8333: tcp 109
20:03:17.968513 IP host93-234-110-95.serverdedicati.aruba.it.8333 > tom-Latitude-3570.34082: tcp 0
20:03:17.969109 IP host93-234-110-95.serverdedicati.aruba.it.8333 > tom-Latitude-3570.34082: tcp 0
20:03:18.060326 IP host93-234-110-95.serverdedicati.aruba.it.8333 > tom-Latitude-3570.34082: tcp 24
20:03:18.060835 IP host93-234-110-95.serverdedicati.aruba.it.8333 > tom-Latitude-3570.34082: tcp 225
20:03:18.060850 IP host93-234-110-95.serverdedicati.aruba.it.8333 > tom-Latitude-3570.34082: tcp 24
20:03:18.060854 IP host93-234-110-95.serverdedicati.aruba.it.8333 > tom-Latitude-3570.34082: tcp 226
20:03:18.060856 IP host93-234-110-95.serverdedicati.aruba.it.8333 > tom-Latitude-3570.34082: tcp 24
20:03:18.060926 IP tom-Latitude-3570.34082 > host93-234-110-95.serverdedicati.aruba.it.8333: tcp 0
20:03:18.063323 IP host93-234-110-95.serverdedicati.aruba.it.8333 > tom-Latitude-3570.34082: tcp 224
20:03:18.103742 IP tom-Latitude-3570.34082 > host93-234-110-95.serverdedicati.aruba.it.8333: tcp 0
20:03:18.264107 IP tom-Latitude-3570.47822 > 59.110.157.16.8333: tcp 24
20:03:18.266167 IP tom-Latitude-3570.47822 > 59.110.157.16.8333: tcp 145
20:03:18.267744 IP 172.214.77.34.bc.googleusercontent.com.8333 > tom-Latitude-3570.56244: tcp 24
20:03:18.267769 IP tom-Latitude-3570.56244 > 172.214.77.34.bc.googleusercontent.com.8333: tcp 0
20:03:18.267775 IP 172.214.77.34.bc.googleusercontent.com.8333 > tom-Latitude-3570.56244: tcp 37
20:03:18.267777 IP tom-Latitude-3570.56244 > 172.214.77.34.bc.googleusercontent.com.8333: tcp 0
20:03:18.303606 IP 59.110.157.16.8333 > tom-Latitude-3570.47822: tcp 0
20:03:18.304226 IP 59.110.157.16.8333 > tom-Latitude-3570.47822: tcp 0
20:03:19.074390 IP host93-234-110-95.serverdedicati.aruba.it.8333 > tom-Latitude-3570.34082: tcp 24
20:03:19.074406 IP tom-Latitude-3570.34082 > host93-234-110-95.serverdedicati.aruba.it.8333: tcp 0
20:03:19.074432 IP host93-234-110-95.serverdedicati.aruba.it.8333 > tom-Latitude-3570.34082: tcp 37
20:03:19.074435 IP tom-Latitude-3570.34082 > host93-234-110-95.serverdedicati.aruba.it.8333: tcp 0
20:03:19.074552 IP tom-Latitude-3570.34082 > host93-234-110-95.serverdedicati.aruba.it.8333: tcp 24
20:03:19.075741 IP tom-Latitude-3570.34082 > host93-234-110-95.serverdedicati.aruba.it.8333: tcp 37
20:03:19.135469 IP host93-234-110-95.serverdedicati.aruba.it.8333 > tom-Latitude-3570.34082: tcp 0
20:03:19.138617 IP host93-234-110-95.serverdedicati.aruba.it.8333 > tom-Latitude-3570.34082: tcp 0
20:03:19.155766 IP c-73-101-52-184.hsd1.pa.comcast.net.8333 > tom-Latitude-3570.59818: tcp 24
20:03:19.159236 IP c-73-101-52-184.hsd1.pa.comcast.net.8333 > tom-Latitude-3570.59818: tcp 145
20:03:19.159314 IP tom-Latitude-3570.59818 > c-73-101-52-184.hsd1.pa.comcast.net.8333: tcp 0
20:03:19.159515 IP tom-Latitude-3570.47742 > 97-82-78-25.dhcp.leds.al.charter.com.8333: tcp 24
20:03:19.160763 IP tom-Latitude-3570.47742 > 97-82-78-25.dhcp.leds.al.charter.com.8333: tcp 109
20:03:19.191373 IP 97-82-78-25.dhcp.leds.al.charter.com.8333 > tom-Latitude-3570.47742: tcp 0
20:03:19.192136 IP 97-82-78-25.dhcp.leds.al.charter.com.8333 > tom-Latitude-3570.47742: tcp 0
20:03:19.225824 IP host93-234-110-95.serverdedicati.aruba.it.8333 > tom-Latitude-3570.34082: tcp 24
20:03:19.225840 IP host93-234-110-95.serverdedicati.aruba.it.8333 > tom-Latitude-3570.34082: tcp 225
20:03:19.225873 IP tom-Latitude-3570.34082 > host93-234-110-95.serverdedicati.aruba.it.8333: tcp 0
20:03:19.226017 IP tom-Latitude-3570.36650 > ec2-52-56-97-80.eu-west-2.compute.amazonaws.com.8333: tcp 24
20:03:19.227208 IP tom-Latitude-3570.36650 > ec2-52-56-97-80.eu-west-2.compute.amazonaws.com.8333: tcp 145
