07:16:59.339657 IP tom-Latitude-3570.60470 > bb42-60-217-183.singnet.com.sg.8333: tcp 24
07:16:59.341703 IP tom-Latitude-3570.60470 > bb42-60-217-183.singnet.com.sg.8333: tcp 145
07:16:59.386314 IP 81.198.101.144.8333 > tom-Latitude-3570.60988: tcp 24
07:16:59.386338 IP 81.198.101.144.8333 > tom-Latitude-3570.60988: tcp 37
07:16:59.386408 IP tom-Latitude-3570.60988 > 81.198.101.144.8333: tcp 0
07:16:59.389098 IP bb42-60-217-183.singnet.com.sg.8333 > tom-Latitude-3570.60470: tcp 0
07:16:59.396401 IP bb42-60-217-183.singnet.com.sg.8333 > tom-Latitude-3570.60470: tcp 0
07:17:00.189197 IP tom-Latitude-3570.42516 > 2.56.9.15.8333: tcp 24
07:17:00.191068 IP tom-Latitude-3570.42516 > 2.56.9.15.8333: tcp 37
07:17:00.239350 IP 2.56.9.15.8333 > tom-Latitude-3570.42516: tcp 0
07:17:00.247760 IP 2.56.9.15.8333 > tom-Latitude-3570.42516: tcp 0
07:17:00.289596 IP tom-Latitude-3570.46284 > static-87-75-105-186.vodafonexdsl.co.uk.8333: tcp 24
07:17:00.290527 IP tom-Latitude-3570.46284 > static-87-75-105-186.vodafonexdsl.co.uk.8333: tcp 8
07:17:00.324686 IP static-87-75-105-186.vodafonexdsl.co.uk.8333 > tom-Latitude-3570.46284: tcp 0
07:17:00.326451 IP static-87-75-105-186.vodafonexdsl.co.uk.8333 > tom-Latitude-3570.46284: tcp 0
07:17:00.393854 IP static-87-75-105-186.vodafonexdsl.co.uk.8333 > tom-Latitude-3570.46284: tcp 24
07:17:00.393873 IP static-87-75-105-186.vodafonexdsl.co.uk.8333 > tom-Latitude-3570.46284: tcp 8
07:17:00.393919 IP tom-Latitude-3570.46284 > static-87-75-105-186.vodafonexdsl.co.uk.8333: tcp 0
07:17:01.597828 IP tom-Latitude-3570.57976 > 167.99.216.145.8333: tcp 24
07:17:01.600783 IP tom-Latitude-3570.57976 > 167.99.216.145.8333: tcp 37
07:17:01.654341 IP 167.99.216.145.8333 > tom-Latitude-3570.57976: tcp 0
07:17:01.654355 IP 167.99.216.145.8333 > tom-Latitude-3570.57976: tcp 0
07:17:02.692995 IP static-87-75-105-186.vodafonexdsl.co.uk.8333 > tom-Latitude-3570.46284: tcp 24
07:17:02.693011 IP static-87-75-105-186.vodafonexdsl.co.uk.8333 > tom-Latitude-3570.46284: tcp 181
07:17:02.693016 IP static-87-75-105-186.vodafonexdsl.co.uk.8333 > tom-Latitude-3570.46284: tcp 181
07:17:02.693026 IP tom-Latitude-3570.46284 > static-87-75-105-186.vodafonexdsl.co.uk.8333: tcp 0
07:17:02.693038 IP 167.99.216.145.8333 > tom-Latitude-3570.57976: tcp 24
07:17:02.693058 IP 167.99.216.145.8333 > tom-Latitude-3570.57976: tcp 217
07:17:02.693071 IP tom-Latitude-3570.57976 > 167.99.216.145.8333: tcp 0
07:17:02.693192 IP tom-Latitude-3570.57976 > 167.99.216.145.8333: tcp 24
07:17:02.702749 IP tom-Latitude-3570.57976 > 167.99.216.145.8333: tcp 217
07:17:02.738780 IP 167.99.216.145.8333 > tom-Latitude-3570.57976: tcp 0
07:17:02.739463 IP 167.99.216.145.8333 > tom-Latitude-3570.57976: tcp 0
07:17:02.757943 IP bb42-60-217-183.singnet.com.sg.8333 > tom-Latitude-3570.60470: tcp 24
07:17:02.758527 IP bb42-60-217-183.singnet.com.sg.8333 > tom-Latitude-3570.60470: tcp 73
07:17:02.758547 IP tom-Latitude-3570.60470 > bb42-60-217-183.singnet.com.sg.8333: tcp 0
07:17:02.758613 IP tom-Latitude-3570.60470 > bb42-60-217-183.singnet.com.sg.8333: tcp 24
07:17:02.759858 IP tom-Latitude-3570.60470 > bb42-60-217-183.singnet.com.sg.8333: tcp 73
07:17:02.799028 IP bb42-60-217-183.singnet.com.sg.8333 > tom-Latitude-3570.60470: tcp 0
07:17:02.799033 IP bb42-60-217-183.singnet.com.sg.8333 > tom-Latitude-3570.60470: tcp 0
07:17:02.802457 IP 167.99.216.145.8333 > tom-Latitude-3570.57976: tcp 24
07:17:02.802464 IP 167.99.216.145.8333 > tom-Latitude-3570.57976: tcp 225
07:17:02.802468 IP 167.99.216.145.8333 > tom-Latitude-3570.57976: tcp 24
07:17:02.802479 IP tom-Latitude-3570.57976 > 167.99.216.145.8333: tcp 0
07:17:02.802692 IP 167.99.216.145.8333 > tom-Latitude-3570.57976: tcp 224
07:17:02.802697 IP 167.99.216.145.8333 > tom-Latitude-3570.57976: tcp 24
07:17:02.802700 IP 167.99.216.145.8333 > tom-Latitude-3570.57976: tcp 190
07:17:02.802703 IP 167.99.216.145.8333 > tom-Latitude-3570.57976: tcp 24
07:17:02.802706 IP 167.99.216.145.8333 > tom-Latitude-3570.57976: tcp 226
07:17:02.802708 IP 167.99.216.145.8333 > tom-Latitude-3570.57976: tcp 24
07:17:02.802710 IP tom-Latitude-3570.57976 > 167.99.216.145.8333: tcp 0
07:17:02.802731 IP tom-Latitude-3570.57976 > 167.99.216.145.8333: tcp 0
07:17:02.806223 IP 167.99.216.145.8333 > tom-Latitude-3570.57976: tcp 256
07:17:02.847908 IP tom-Latitude-3570.57976 > 167.99.216.145.8333: tcp 0
07:17:02.863096 IP 167.99.216.145.8333 > tom-Latitude-3570.57976: tcp 250
07:17:02.863122 IP tom-Latitude-3570.57976 > 167.99.216.145.8333: tcp 0
07:17:02.863736 IP tom-Latitude-3570.42516 > 2.56.9.15.8333: tcp 24
07:17:02.864614 IP tom-Latitude-3570.42516 > 2.56.9.15.8333: tcp 217
07:17:02.934226 IP 2.56.9.15.8333 > tom-Latitude-3570.42516: tcp 0
07:17:02.934239 IP 2.56.9.15.8333 > tom-Latitude-3570.42516: tcp 0
07:17:03.064414 IP tom-Latitude-3570.39110 > vmi195435.contaboserver.net.8333: tcp 24
07:17:03.066627 IP tom-Latitude-3570.39110 > vmi195435.contaboserver.net.8333: tcp 217
07:17:03.100151 IP vmi195435.contaboserver.net.8333 > tom-Latitude-3570.39110: tcp 0
07:17:03.106818 IP vmi195435.contaboserver.net.8333 > tom-Latitude-3570.39110: tcp 0
07:17:04.024340 IP bb42-60-217-183.singnet.com.sg.8333 > tom-Latitude-3570.60470: tcp 24
07:17:04.024362 IP bb42-60-217-183.singnet.com.sg.8333 > tom-Latitude-3570.60470: tcp 253
07:17:04.024367 IP vmi195435.contaboserver.net.8333 > tom-Latitude-3570.39110: tcp 24
07:17:04.024371 IP vmi195435.contaboserver.net.8333 > tom-Latitude-3570.39110: tcp 109
07:17:04.024406 IP tom-Latitude-3570.60470 > bb42-60-217-183.singnet.com.sg.8333: tcp 0
07:17:04.024442 IP tom-Latitude-3570.39110 > vmi195435.contaboserver.net.8333: tcp 0
07:17:04.024583 IP tom-Latitude-3570.39110 > vmi195435.contaboserver.net.8333: tcp 24
07:17:04.027604 IP tom-Latitude-3570.39110 > vmi195435.contaboserver.net.8333: tcp 109
07:17:04.048068 IP bb42-60-217-183.singnet.com.sg.8333 > tom-Latitude-3570.60470: tcp 253
07:17:04.048075 IP tom-Latitude-3570.60470 > bb42-60-217-183.singnet.com.sg.8333: tcp 0
07:17:04.063244 IP vmi195435.contaboserver.net.8333 > tom-Latitude-3570.39110: tcp 0
07:17:04.068834 IP vmi195435.contaboserver.net.8333 > tom-Latitude-3570.39110: tcp 0
07:17:04.144854 IP vmi195435.contaboserver.net.8333 > tom-Latitude-3570.39110: tcp 24
07:17:04.145893 IP vmi195435.contaboserver.net.8333 > tom-Latitude-3570.39110: tcp 246
07:17:04.145917 IP vmi195435.contaboserver.net.8333 > tom-Latitude-3570.39110: tcp 24
07:17:04.145921 IP vmi195435.contaboserver.net.8333 > tom-Latitude-3570.39110: tcp 191
07:17:04.145924 IP vmi195435.contaboserver.net.8333 > tom-Latitude-3570.39110: tcp 24
07:17:04.145927 IP vmi195435.contaboserver.net.8333 > tom-Latitude-3570.39110: tcp 405
07:17:04.145978 IP tom-Latitude-3570.39110 > vmi195435.contaboserver.net.8333: tcp 0
07:17:04.146751 IP tom-Latitude-3570.46284 > static-87-75-105-186.vodafonexdsl.co.uk.8333: tcp 24
07:17:04.151527 IP tom-Latitude-3570.46284 > static-87-75-105-186.vodafonexdsl.co.uk.8333: tcp 109
07:17:04.214129 IP static-87-75-105-186.vodafonexdsl.co.uk.8333 > tom-Latitude-3570.46284: tcp 0
07:17:04.448369 IP tom-Latitude-3570.49070 > c-185-45-236-223.customer.ggaweb.ch.8333: tcp 24
07:17:04.450414 IP tom-Latitude-3570.49070 > c-185-45-236-223.customer.ggaweb.ch.8333: tcp 325
07:17:04.489934 IP c-185-45-236-223.customer.ggaweb.ch.8333 > tom-Latitude-3570.49070: tcp 0
07:17:04.496671 IP c-185-45-236-223.customer.ggaweb.ch.8333 > tom-Latitude-3570.49070: tcp 0
07:17:05.050314 IP tom-Latitude-3570.60988 > 81.198.101.144.8333: tcp 24
07:17:05.050366 IP tom-Latitude-3570.42516 > 2.56.9.15.8333: tcp 24
07:17:05.052565 IP tom-Latitude-3570.60988 > 81.198.101.144.8333: tcp 325
07:17:05.055410 IP tom-Latitude-3570.42516 > 2.56.9.15.8333: tcp 109
07:17:05.117251 IP 81.198.101.144.8333 > tom-Latitude-3570.60988: tcp 0
07:17:05.117934 IP 2.56.9.15.8333 > tom-Latitude-3570.42516: tcp 0
07:17:05.117949 IP 81.198.101.144.8333 > tom-Latitude-3570.60988: tcp 0
07:17:05.117952 IP 2.56.9.15.8333 > tom-Latitude-3570.42516: tcp 0
07:17:05.150752 IP tom-Latitude-3570.57976 > 167.99.216.145.8333: tcp 24
07:17:05.151493 IP tom-Latitude-3570.57976 > 167.99.216.145.8333: tcp 109
07:17:05.180337 IP 167.99.216.145.8333 > tom-Latitude-3570.57976: tcp 0
07:17:05.188056 IP 167.99.216.145.8333 > tom-Latitude-3570.57976: tcp 0
07:17:05.552166 IP tom-Latitude-3570.46284 > static-87-75-105-186.vodafonexdsl.co.uk.8333: tcp 24
07:17:05.554397 IP tom-Latitude-3570.46284 > static-87-75-105-186.vodafonexdsl.co.uk.8333: tcp 37
07:17:05.617685 IP static-87-75-105-186.vodafonexdsl.co.uk.8333 > tom-Latitude-3570.46284: tcp 0
07:17:05.623719 IP static-87-75-105-186.vodafonexdsl.co.uk.8333 > tom-Latitude-3570.46284: tcp 24
07:17:05.623736 IP tom-Latitude-3570.46284 > static-87-75-105-186.vodafonexdsl.co.uk.8333: tcp 0
07:17:05.628820 IP static-87-75-105-186.vodafonexdsl.co.uk.8333 > tom-Latitude-3570.46284: tcp 217
07:17:05.628848 IP tom-Latitude-3570.46284 > static-87-75-105-186.vodafonexdsl.co.uk.8333: tcp 0
07:17:05.629157 IP tom-Latitude-3570.46284 > static-87-75-105-186.vodafonexdsl.co.uk.8333: tcp 24
07:17:05.630395 IP tom-Latitude-3570.46284 > static-87-75-105-186.vodafonexdsl.co.uk.8333: tcp 181
07:17:05.667264 IP static-87-75-105-186.vodafonexdsl.co.uk.8333 > tom-Latitude-3570.46284: tcp 0
07:17:05.734057 IP static-87-75-105-186.vodafonexdsl.co.uk.8333 > tom-Latitude-3570.46284: tcp 24
07:17:05.734939 IP static-87-75-105-186.vodafonexdsl.co.uk.8333 > tom-Latitude-3570.46284: tcp 373
07:17:05.734957 IP static-87-75-105-186.vodafonexdsl.co.uk.8333 > tom-Latitude-3570.46284: tcp 24
07:17:05.734961 IP static-87-75-105-186.vodafonexdsl.co.uk.8333 > tom-Latitude-3570.46284: tcp 818
07:17:05.734964 IP static-87-75-105-186.vodafonexdsl.co.uk.8333 > tom-Latitude-3570.46284: tcp 24
07:17:05.734967 IP static-87-75-105-186.vodafonexdsl.co.uk.8333 > tom-Latitude-3570.46284: tcp 190
07:17:05.734970 IP static-87-75-105-186.vodafonexdsl.co.uk.8333 > tom-Latitude-3570.46284: tcp 24
07:17:05.735006 IP tom-Latitude-3570.46284 > static-87-75-105-186.vodafonexdsl.co.uk.8333: tcp 0
07:17:05.737684 IP static-87-75-105-186.vodafonexdsl.co.uk.8333 > tom-Latitude-3570.46284: tcp 666
07:17:05.738324 IP static-87-75-105-186.vodafonexdsl.co.uk.8333 > tom-Latitude-3570.46284: tcp 24
07:17:05.738338 IP static-87-75-105-186.vodafonexdsl.co.uk.8333 > tom-Latitude-3570.46284: tcp 225
07:17:05.738373 IP tom-Latitude-3570.46284 > static-87-75-105-186.vodafonexdsl.co.uk.8333: tcp 0
07:17:06.442471 IP tom-Latitude-3570.57976 > 167.99.216.145.8333: tcp 24
07:17:06.442525 IP tom-Latitude-3570.42516 > 2.56.9.15.8333: tcp 24
07:17:06.444734 IP tom-Latitude-3570.57976 > 167.99.216.145.8333: tcp 181
07:17:06.445593 IP tom-Latitude-3570.42516 > 2.56.9.15.8333: tcp 181
07:17:06.474232 IP vmi195435.contaboserver.net.8333 > tom-Latitude-3570.39110: tcp 24
07:17:06.474796 IP vmi195435.contaboserver.net.8333 > tom-Latitude-3570.39110: tcp 253
07:17:06.474816 IP vmi195435.contaboserver.net.8333 > tom-Latitude-3570.39110: tcp 253
07:17:06.474828 IP tom-Latitude-3570.39110 > vmi195435.contaboserver.net.8333: tcp 0
07:17:06.475085 IP tom-Latitude-3570.39110 > vmi195435.contaboserver.net.8333: tcp 24
07:17:06.476177 IP tom-Latitude-3570.39110 > vmi195435.contaboserver.net.8333: tcp 73
07:17:06.486052 IP 2.56.9.15.8333 > tom-Latitude-3570.42516: tcp 0
07:17:06.494228 IP 167.99.216.145.8333 > tom-Latitude-3570.57976: tcp 0
07:17:06.494233 IP 2.56.9.15.8333 > tom-Latitude-3570.42516: tcp 0
07:17:06.494236 IP 167.99.216.145.8333 > tom-Latitude-3570.57976: tcp 0
07:17:06.500386 IP vmi195435.contaboserver.net.8333 > tom-Latitude-3570.39110: tcp 0
07:17:06.510908 IP vmi195435.contaboserver.net.8333 > tom-Latitude-3570.39110: tcp 0
07:17:06.686315 IP vmi195435.contaboserver.net.8333 > tom-Latitude-3570.39110: tcp 24
07:17:06.686323 IP vmi195435.contaboserver.net.8333 > tom-Latitude-3570.39110: tcp 257
07:17:06.686327 IP vmi195435.contaboserver.net.8333 > tom-Latitude-3570.39110: tcp 24
07:17:06.686330 IP vmi195435.contaboserver.net.8333 > tom-Latitude-3570.39110: tcp 224
07:17:06.686336 IP tom-Latitude-3570.39110 > vmi195435.contaboserver.net.8333: tcp 0
07:17:06.686652 IP tom-Latitude-3570.49070 > c-185-45-236-223.customer.ggaweb.ch.8333: tcp 24
07:17:06.688488 IP tom-Latitude-3570.49070 > c-185-45-236-223.customer.ggaweb.ch.8333: tcp 217
07:17:06.727901 IP tom-Latitude-3570.39110 > vmi195435.contaboserver.net.8333: tcp 0
07:17:06.776886 IP c-185-45-236-223.customer.ggaweb.ch.8333 > tom-Latitude-3570.49070: tcp 0
07:17:06.776901 IP c-185-45-236-223.customer.ggaweb.ch.8333 > tom-Latitude-3570.49070: tcp 0
07:17:06.887305 IP tom-Latitude-3570.42516 > 2.56.9.15.8333: tcp 24
07:17:06.890145 IP tom-Latitude-3570.42516 > 2.56.9.15.8333: tcp 73
07:17:06.920356 IP 2.56.9.15.8333 > tom-Latitude-3570.42516: tcp 0
07:17:06.928039 IP 2.56.9.15.8333 > tom-Latitude-3570.42516: tcp 0
07:17:07.388983 IP tom-Latitude-3570.49070 > c-185-45-236-223.customer.ggaweb.ch.8333: tcp 24
07:17:07.391968 IP tom-Latitude-3570.49070 > c-185-45-236-223.customer.ggaweb.ch.8333: tcp 37
07:17:07.439505 IP c-185-45-236-223.customer.ggaweb.ch.8333 > tom-Latitude-3570.49070: tcp 0
07:17:07.447447 IP c-185-45-236-223.customer.ggaweb.ch.8333 > tom-Latitude-3570.49070: tcp 0
07:17:07.524425 IP 81.198.101.144.8333 > tom-Latitude-3570.60988: tcp 24
07:17:07.525092 IP 81.198.101.144.8333 > tom-Latitude-3570.60988: tcp 253
07:17:07.525220 IP tom-Latitude-3570.60988 > 81.198.101.144.8333: tcp 0
07:17:07.726121 IP tom-Latitude-3570.60470 > bb42-60-217-183.singnet.com.sg.8333: tcp 24
07:17:07.728457 IP tom-Latitude-3570.60470 > bb42-60-217-183.singnet.com.sg.8333: tcp 325
07:17:07.761913 IP bb42-60-217-183.singnet.com.sg.8333 > tom-Latitude-3570.60470: tcp 0
07:17:07.776991 IP bb42-60-217-183.singnet.com.sg.8333 > tom-Latitude-3570.60470: tcp 0
07:17:07.926954 IP tom-Latitude-3570.56714 > ns3113832.ip-54-38-177.eu.8333: tcp 24
07:17:07.926999 IP tom-Latitude-3570.57976 > 167.99.216.145.8333: tcp 24
07:17:07.929057 IP tom-Latitude-3570.56714 > ns3113832.ip-54-38-177.eu.8333: tcp 577
07:17:07.929896 IP tom-Latitude-3570.57976 > 167.99.216.145.8333: tcp 73
07:17:07.970674 IP 167.99.216.145.8333 > tom-Latitude-3570.57976: tcp 0
07:17:07.970689 IP 167.99.216.145.8333 > tom-Latitude-3570.57976: tcp 0
07:17:07.970691 IP ns3113832.ip-54-38-177.eu.8333 > tom-Latitude-3570.56714: tcp 0
07:17:09.246388 IP bb42-60-217-183.singnet.com.sg.8333 > tom-Latitude-3570.60470: tcp 24
07:17:09.246412 IP tom-Latitude-3570.60470 > bb42-60-217-183.singnet.com.sg.8333: tcp 0
07:17:09.246445 IP bb42-60-217-183.singnet.com.sg.8333 > tom-Latitude-3570.60470: tcp 181
07:17:09.246450 IP tom-Latitude-3570.60470 > bb42-60-217-183.singnet.com.sg.8333: tcp 0
07:17:09.246454 IP 167.99.216.145.8333 > tom-Latitude-3570.57976: tcp 24
07:17:09.246456 IP tom-Latitude-3570.57976 > 167.99.216.145.8333: tcp 0
07:17:09.246461 IP 167.99.216.145.8333 > tom-Latitude-3570.57976: tcp 181
07:17:09.246463 IP tom-Latitude-3570.57976 > 167.99.216.145.8333: tcp 0
07:17:09.246472 IP bb42-60-217-183.singnet.com.sg.8333 > tom-Latitude-3570.60470: tcp 181
07:17:09.246476 IP tom-Latitude-3570.60470 > bb42-60-217-183.singnet.com.sg.8333: tcp 0
07:17:09.246668 IP tom-Latitude-3570.57976 > 167.99.216.145.8333: tcp 24
07:17:09.255331 IP tom-Latitude-3570.57976 > 167.99.216.145.8333: tcp 181
07:17:09.333873 IP 167.99.216.145.8333 > tom-Latitude-3570.57976: tcp 0
07:17:09.352394 IP 167.99.216.145.8333 > tom-Latitude-3570.57976: tcp 24
07:17:09.352401 IP 167.99.216.145.8333 > tom-Latitude-3570.57976: tcp 223
07:17:09.352404 IP 167.99.216.145.8333 > tom-Latitude-3570.57976: tcp 24
07:17:09.352410 IP tom-Latitude-3570.57976 > 167.99.216.145.8333: tcp 0
07:17:09.352951 IP 167.99.216.145.8333 > tom-Latitude-3570.57976: tcp 521
07:17:09.352957 IP 167.99.216.145.8333 > tom-Latitude-3570.57976: tcp 24
07:17:09.352962 IP 167.99.216.145.8333 > tom-Latitude-3570.57976: tcp 1448
07:17:09.352964 IP 167.99.216.145.8333 > tom-Latitude-3570.57976: tcp 432
07:17:09.352967 IP 167.99.216.145.8333 > tom-Latitude-3570.57976: tcp 24
07:17:09.352987 IP 167.99.216.145.8333 > tom-Latitude-3570.57976: tcp 371
07:17:09.352989 IP 167.99.216.145.8333 > tom-Latitude-3570.57976: tcp 24
07:17:09.353006 IP tom-Latitude-3570.57976 > 167.99.216.145.8333: tcp 0
07:17:09.411770 IP 167.99.216.145.8333 > tom-Latitude-3570.57976: tcp 257
07:17:09.455904 IP tom-Latitude-3570.57976 > 167.99.216.145.8333: tcp 0
07:17:09.913881 IP tom-Latitude-3570.39110 > vmi195435.contaboserver.net.8333: tcp 24
07:17:09.915941 IP tom-Latitude-3570.39110 > vmi195435.contaboserver.net.8333: tcp 181
07:17:09.958286 IP vmi195435.contaboserver.net.8333 > tom-Latitude-3570.39110: tcp 0
07:17:09.967208 IP vmi195435.contaboserver.net.8333 > tom-Latitude-3570.39110: tcp 0
07:17:10.014302 IP tom-Latitude-3570.49070 > c-185-45-236-223.customer.ggaweb.ch.8333: tcp 24
07:17:10.016031 IP tom-Latitude-3570.49070 > c-185-45-236-223.customer.ggaweb.ch.8333: tcp 181
07:17:10.049372 IP c-185-45-236-223.customer.ggaweb.ch.8333 > tom-Latitude-3570.49070: tcp 0
07:17:10.057373 IP c-185-45-236-223.customer.ggaweb.ch.8333 > tom-Latitude-3570.49070: tcp 0
07:17:10.415791 IP tom-Latitude-3570.56714 > ns3113832.ip-54-38-177.eu.8333: tcp 24
07:17:10.418251 IP tom-Latitude-3570.56714 > ns3113832.ip-54-38-177.eu.8333: tcp 181
07:17:10.457657 IP 167.99.216.145.8333 > tom-Latitude-3570.57976: tcp 24
07:17:10.457675 IP tom-Latitude-3570.57976 > 167.99.216.145.8333: tcp 0
07:17:10.458215 IP 167.99.216.145.8333 > tom-Latitude-3570.57976: tcp 73
07:17:10.458232 IP tom-Latitude-3570.57976 > 167.99.216.145.8333: tcp 0
07:17:10.458248 IP bb42-60-217-183.singnet.com.sg.8333 > tom-Latitude-3570.60470: tcp 24
07:17:10.458251 IP tom-Latitude-3570.60470 > bb42-60-217-183.singnet.com.sg.8333: tcp 0
07:17:10.458254 IP bb42-60-217-183.singnet.com.sg.8333 > tom-Latitude-3570.60470: tcp 73
07:17:10.458256 IP tom-Latitude-3570.60470 > bb42-60-217-183.singnet.com.sg.8333: tcp 0
07:17:10.458459 IP tom-Latitude-3570.57976 > 167.99.216.145.8333: tcp 24
07:17:10.462864 IP tom-Latitude-3570.57976 > 167.99.216.145.8333: tcp 73
07:17:10.468453 IP ns3113832.ip-54-38-177.eu.8333 > tom-Latitude-3570.56714: tcp 0
07:17:10.495559 IP 167.99.216.145.8333 > tom-Latitude-3570.57976: tcp 0
07:17:10.496126 IP 167.99.216.145.8333 > tom-Latitude-3570.57976: tcp 0
07:17:10.558703 IP 167.99.216.145.8333 > tom-Latitude-3570.57976: tcp 24
07:17:10.559443 IP 167.99.216.145.8333 > tom-Latitude-3570.57976: tcp 191
07:17:10.559465 IP 167.99.216.145.8333 > tom-Latitude-3570.57976: tcp 24
07:17:10.559469 IP 167.99.216.145.8333 > tom-Latitude-3570.57976: tcp 370
07:17:10.559558 IP tom-Latitude-3570.57976 > 167.99.216.145.8333: tcp 0
07:17:10.861120 IP tom-Latitude-3570.60988 > 81.198.101.144.8333: tcp 24
07:17:10.863285 IP tom-Latitude-3570.60988 > 81.198.101.144.8333: tcp 253
07:17:10.908676 IP 81.198.101.144.8333 > tom-Latitude-3570.60988: tcp 0
07:17:10.915873 IP 81.198.101.144.8333 > tom-Latitude-3570.60988: tcp 0
07:17:11.061906 IP tom-Latitude-3570.42516 > 2.56.9.15.8333: tcp 24
07:17:11.064092 IP tom-Latitude-3570.42516 > 2.56.9.15.8333: tcp 253
07:17:11.099318 IP 2.56.9.15.8333 > tom-Latitude-3570.42516: tcp 0
07:17:11.107541 IP 2.56.9.15.8333 > tom-Latitude-3570.42516: tcp 0
07:17:11.262654 IP tom-Latitude-3570.56714 > ns3113832.ip-54-38-177.eu.8333: tcp 24
07:17:11.264832 IP tom-Latitude-3570.56714 > ns3113832.ip-54-38-177.eu.8333: tcp 73
07:17:11.307328 IP ns3113832.ip-54-38-177.eu.8333 > tom-Latitude-3570.56714: tcp 0
07:17:11.363056 IP tom-Latitude-3570.39110 > vmi195435.contaboserver.net.8333: tcp 24
07:17:11.365597 IP tom-Latitude-3570.39110 > vmi195435.contaboserver.net.8333: tcp 73
07:17:11.400375 IP vmi195435.contaboserver.net.8333 > tom-Latitude-3570.39110: tcp 0
07:17:11.406336 IP vmi195435.contaboserver.net.8333 > tom-Latitude-3570.39110: tcp 0
07:17:12.318190 IP bb42-60-217-183.singnet.com.sg.8333 > tom-Latitude-3570.60470: tcp 24
07:17:12.318208 IP tom-Latitude-3570.60470 > bb42-60-217-183.singnet.com.sg.8333: tcp 0
07:17:12.318224 IP bb42-60-217-183.singnet.com.sg.8333 > tom-Latitude-3570.60470: tcp 217
07:17:12.318228 IP tom-Latitude-3570.60470 > bb42-60-217-183.singnet.com.sg.8333: tcp 0
07:17:12.318465 IP tom-Latitude-3570.60470 > bb42-60-217-183.singnet.com.sg.8333: tcp 24
07:17:12.321520 IP tom-Latitude-3570.60470 > bb42-60-217-183.singnet.com.sg.8333: tcp 217
07:17:12.357504 IP bb42-60-217-183.singnet.com.sg.8333 > tom-Latitude-3570.60470: tcp 0
07:17:12.358056 IP bb42-60-217-183.singnet.com.sg.8333 > tom-Latitude-3570.60470: tcp 0
07:17:12.920550 IP tom-Latitude-3570.49070 > c-185-45-236-223.customer.ggaweb.ch.8333: tcp 24
07:17:12.922809 IP tom-Latitude-3570.49070 > c-185-45-236-223.customer.ggaweb.ch.8333: tcp 73
07:17:12.925778 IP bb42-60-217-183.singnet.com.sg.8333 > tom-Latitude-3570.60470: tcp 24
07:17:12.925799 IP bb42-60-217-183.singnet.com.sg.8333 > tom-Latitude-3570.60470: tcp 257
07:17:12.925803 IP bb42-60-217-183.singnet.com.sg.8333 > tom-Latitude-3570.60470: tcp 24
07:17:12.925805 IP bb42-60-217-183.singnet.com.sg.8333 > tom-Latitude-3570.60470: tcp 257
07:17:12.925826 IP bb42-60-217-183.singnet.com.sg.8333 > tom-Latitude-3570.60470: tcp 24
07:17:12.925829 IP bb42-60-217-183.singnet.com.sg.8333 > tom-Latitude-3570.60470: tcp 663
07:17:12.925831 IP bb42-60-217-183.singnet.com.sg.8333 > tom-Latitude-3570.60470: tcp 24
07:17:12.925893 IP tom-Latitude-3570.60470 > bb42-60-217-183.singnet.com.sg.8333: tcp 0
07:17:12.925960 IP bb42-60-217-183.singnet.com.sg.8333 > tom-Latitude-3570.60470: tcp 247
07:17:12.925980 IP bb42-60-217-183.singnet.com.sg.8333 > tom-Latitude-3570.60470: tcp 24
07:17:12.925987 IP bb42-60-217-183.singnet.com.sg.8333 > tom-Latitude-3570.60470: tcp 247
07:17:12.925992 IP bb42-60-217-183.singnet.com.sg.8333 > tom-Latitude-3570.60470: tcp 24
07:17:12.925996 IP bb42-60-217-183.singnet.com.sg.8333 > tom-Latitude-3570.60470: tcp 224
07:17:12.926011 IP tom-Latitude-3570.60470 > bb42-60-217-183.singnet.com.sg.8333: tcp 0
07:17:12.926042 IP tom-Latitude-3570.60470 > bb42-60-217-183.singnet.com.sg.8333: tcp 0
07:17:12.967821 IP c-185-45-236-223.customer.ggaweb.ch.8333 > tom-Latitude-3570.49070: tcp 0
07:17:12.968423 IP c-185-45-236-223.customer.ggaweb.ch.8333 > tom-Latitude-3570.49070: tcp 0
07:17:13.028929 IP tom-Latitude-3570.39110 > vmi195435.contaboserver.net.8333: tcp 24
07:17:13.029868 IP tom-Latitude-3570.39110 > vmi195435.contaboserver.net.8333: tcp 217
07:17:13.059932 IP vmi195435.contaboserver.net.8333 > tom-Latitude-3570.39110: tcp 0
07:17:13.067705 IP vmi195435.contaboserver.net.8333 > tom-Latitude-3570.39110: tcp 0
07:17:13.530575 IP tom-Latitude-3570.60988 > 81.198.101.144.8333: tcp 24
07:17:13.533838 IP tom-Latitude-3570.60988 > 81.198.101.144.8333: tcp 217
07:17:13.589802 IP 81.198.101.144.8333 > tom-Latitude-3570.60988: tcp 0
07:17:13.599767 IP 81.198.101.144.8333 > tom-Latitude-3570.60988: tcp 0
07:17:13.931762 IP tom-Latitude-3570.42516 > 2.56.9.15.8333: tcp 24
07:17:13.935319 IP tom-Latitude-3570.42516 > 2.56.9.15.8333: tcp 217
07:17:13.988154 IP 2.56.9.15.8333 > tom-Latitude-3570.42516: tcp 0
07:17:13.996053 IP 2.56.9.15.8333 > tom-Latitude-3570.42516: tcp 0
07:17:14.734484 IP tom-Latitude-3570.49070 > c-185-45-236-223.customer.ggaweb.ch.8333: tcp 24
07:17:14.743828 IP tom-Latitude-3570.49070 > c-185-45-236-223.customer.ggaweb.ch.8333: tcp 217
07:17:14.794186 IP bb42-60-217-183.singnet.com.sg.8333 > tom-Latitude-3570.60470: tcp 24
07:17:14.801910 IP bb42-60-217-183.singnet.com.sg.8333 > tom-Latitude-3570.60470: tcp 217
07:17:14.802063 IP tom-Latitude-3570.60470 > bb42-60-217-183.singnet.com.sg.8333: tcp 0
07:17:14.802272 IP tom-Latitude-3570.60470 > bb42-60-217-183.singnet.com.sg.8333: tcp 24
07:17:14.804041 IP tom-Latitude-3570.60470 > bb42-60-217-183.singnet.com.sg.8333: tcp 217
07:17:14.805323 IP c-185-45-236-223.customer.ggaweb.ch.8333 > tom-Latitude-3570.49070: tcp 0
07:17:14.813907 IP c-185-45-236-223.customer.ggaweb.ch.8333 > tom-Latitude-3570.49070: tcp 0
07:17:14.837781 IP bb42-60-217-183.singnet.com.sg.8333 > tom-Latitude-3570.60470: tcp 0
07:17:14.837786 IP bb42-60-217-183.singnet.com.sg.8333 > tom-Latitude-3570.60470: tcp 0
07:17:15.404039 IP tom-Latitude-3570.57976 > 167.99.216.145.8333: tcp 24
07:17:15.406722 IP tom-Latitude-3570.57976 > 167.99.216.145.8333: tcp 217
07:17:15.434163 IP bb42-60-217-183.singnet.com.sg.8333 > tom-Latitude-3570.60470: tcp 224
07:17:15.434182 IP tom-Latitude-3570.60470 > bb42-60-217-183.singnet.com.sg.8333: tcp 0
07:17:15.435125 IP bb42-60-217-183.singnet.com.sg.8333 > tom-Latitude-3570.60470: tcp 24
07:17:15.435143 IP tom-Latitude-3570.60470 > bb42-60-217-183.singnet.com.sg.8333: tcp 0
07:17:15.435156 IP bb42-60-217-183.singnet.com.sg.8333 > tom-Latitude-3570.60470: tcp 1063
07:17:15.435158 IP tom-Latitude-3570.60470 > bb42-60-217-183.singnet.com.sg.8333: tcp 0
07:17:15.435161 IP bb42-60-217-183.singnet.com.sg.8333 > tom-Latitude-3570.60470: tcp 24
07:17:15.435162 IP tom-Latitude-3570.60470 > bb42-60-217-183.singnet.com.sg.8333: tcp 0
07:17:15.435165 IP bb42-60-217-183.singnet.com.sg.8333 > tom-Latitude-3570.60470: tcp 589
07:17:15.435167 IP tom-Latitude-3570.60470 > bb42-60-217-183.singnet.com.sg.8333: tcp 0
07:17:15.435170 IP bb42-60-217-183.singnet.com.sg.8333 > tom-Latitude-3570.60470: tcp 24
07:17:15.435171 IP tom-Latitude-3570.60470 > bb42-60-217-183.singnet.com.sg.8333: tcp 0
07:17:15.435174 IP bb42-60-217-183.singnet.com.sg.8333 > tom-Latitude-3570.60470: tcp 191
07:17:15.435175 IP tom-Latitude-3570.60470 > bb42-60-217-183.singnet.com.sg.8333: tcp 0
07:17:15.435177 IP bb42-60-217-183.singnet.com.sg.8333 > tom-Latitude-3570.60470: tcp 24
07:17:15.435179 IP tom-Latitude-3570.60470 > bb42-60-217-183.singnet.com.sg.8333: tcp 0
07:17:15.435181 IP bb42-60-217-183.singnet.com.sg.8333 > tom-Latitude-3570.60470: tcp 190
07:17:15.435183 IP tom-Latitude-3570.60470 > bb42-60-217-183.singnet.com.sg.8333: tcp 0
07:17:15.435192 IP bb42-60-217-183.singnet.com.sg.8333 > tom-Latitude-3570.60470: tcp 24
07:17:15.435195 IP tom-Latitude-3570.60470 > bb42-60-217-183.singnet.com.sg.8333: tcp 0
07:17:15.435200 IP bb42-60-217-183.singnet.com.sg.8333 > tom-Latitude-3570.60470: tcp 257
07:17:15.435203 IP tom-Latitude-3570.60470 > bb42-60-217-183.singnet.com.sg.8333: tcp 0
07:17:15.448501 IP 167.99.216.145.8333 > tom-Latitude-3570.57976: tcp 0
07:17:15.452132 IP 167.99.216.145.8333 > tom-Latitude-3570.57976: tcp 0
07:17:15.482631 IP bb42-60-217-183.singnet.com.sg.8333 > tom-Latitude-3570.60470: tcp 24
07:17:15.482659 IP tom-Latitude-3570.60470 > bb42-60-217-183.singnet.com.sg.8333: tcp 0
07:17:15.586468 IP tom-Latitude-3570.46284 > static-87-75-105-186.vodafonexdsl.co.uk.8333: tcp 24
07:17:15.588704 IP tom-Latitude-3570.46284 > static-87-75-105-186.vodafonexdsl.co.uk.8333: tcp 757
07:17:15.628652 IP static-87-75-105-186.vodafonexdsl.co.uk.8333 > tom-Latitude-3570.46284: tcp 0
07:17:15.733133 IP 167.99.216.145.8333 > tom-Latitude-3570.57976: tcp 24
07:17:15.735254 IP 167.99.216.145.8333 > tom-Latitude-3570.57976: tcp 469
07:17:15.735367 IP tom-Latitude-3570.57976 > 167.99.216.145.8333: tcp 0
07:17:15.735609 IP tom-Latitude-3570.57976 > 167.99.216.145.8333: tcp 24
07:17:15.736885 IP tom-Latitude-3570.57976 > 167.99.216.145.8333: tcp 253
07:17:15.777692 IP 167.99.216.145.8333 > tom-Latitude-3570.57976: tcp 0
07:17:15.778726 IP 167.99.216.145.8333 > tom-Latitude-3570.57976: tcp 0
07:17:15.840947 IP 167.99.216.145.8333 > tom-Latitude-3570.57976: tcp 24
07:17:15.842123 IP 167.99.216.145.8333 > tom-Latitude-3570.57976: tcp 223
07:17:15.842143 IP 167.99.216.145.8333 > tom-Latitude-3570.57976: tcp 24
07:17:15.842147 IP 167.99.216.145.8333 > tom-Latitude-3570.57976: tcp 643
07:17:15.842149 IP 167.99.216.145.8333 > tom-Latitude-3570.57976: tcp 24
07:17:15.842151 IP 167.99.216.145.8333 > tom-Latitude-3570.57976: tcp 369
07:17:15.842171 IP 167.99.216.145.8333 > tom-Latitude-3570.57976: tcp 24
07:17:15.842174 IP 167.99.216.145.8333 > tom-Latitude-3570.57976: tcp 223
07:17:15.842176 IP 167.99.216.145.8333 > tom-Latitude-3570.57976: tcp 24
07:17:15.842179 IP 167.99.216.145.8333 > tom-Latitude-3570.57976: tcp 1259
07:17:15.842240 IP tom-Latitude-3570.57976 > 167.99.216.145.8333: tcp 0
07:17:15.870571 IP ns3113832.ip-54-38-177.eu.8333 > tom-Latitude-3570.56714: tcp 24
07:17:15.871276 IP ns3113832.ip-54-38-177.eu.8333 > tom-Latitude-3570.56714: tcp 577
07:17:15.871294 IP tom-Latitude-3570.56714 > ns3113832.ip-54-38-177.eu.8333: tcp 0
07:17:15.901525 IP 167.99.216.145.8333 > tom-Latitude-3570.57976: tcp 499
07:17:15.943744 IP tom-Latitude-3570.57976 > 167.99.216.145.8333: tcp 0
07:17:16.002442 IP tom-Latitude-3570.60470 > bb42-60-217-183.singnet.com.sg.8333: tcp 24
07:17:16.003269 IP tom-Latitude-3570.60470 > bb42-60-217-183.singnet.com.sg.8333: tcp 253
07:17:16.039544 IP bb42-60-217-183.singnet.com.sg.8333 > tom-Latitude-3570.60470: tcp 0
07:17:16.046316 IP bb42-60-217-183.singnet.com.sg.8333 > tom-Latitude-3570.60470: tcp 0
07:17:16.102790 IP tom-Latitude-3570.56714 > ns3113832.ip-54-38-177.eu.8333: tcp 24
07:17:16.104250 IP tom-Latitude-3570.56714 > ns3113832.ip-54-38-177.eu.8333: tcp 109
07:17:16.147432 IP ns3113832.ip-54-38-177.eu.8333 > tom-Latitude-3570.56714: tcp 0
07:17:16.203094 IP tom-Latitude-3570.46284 > static-87-75-105-186.vodafonexdsl.co.uk.8333: tcp 24
07:17:16.203893 IP tom-Latitude-3570.46284 > static-87-75-105-186.vodafonexdsl.co.uk.8333: tcp 253
07:17:16.206914 IP ns3113832.ip-54-38-177.eu.8333 > tom-Latitude-3570.56714: tcp 24
07:17:16.206925 IP ns3113832.ip-54-38-177.eu.8333 > tom-Latitude-3570.56714: tcp 73
07:17:16.207014 IP tom-Latitude-3570.56714 > ns3113832.ip-54-38-177.eu.8333: tcp 0
07:17:16.207060 IP tom-Latitude-3570.56714 > ns3113832.ip-54-38-177.eu.8333: tcp 24
07:17:16.208605 IP tom-Latitude-3570.56714 > ns3113832.ip-54-38-177.eu.8333: tcp 472
07:17:16.245697 IP static-87-75-105-186.vodafonexdsl.co.uk.8333 > tom-Latitude-3570.46284: tcp 0
07:17:16.247168 IP ns3113832.ip-54-38-177.eu.8333 > tom-Latitude-3570.56714: tcp 0
07:17:16.303667 IP static-87-75-105-186.vodafonexdsl.co.uk.8333 > tom-Latitude-3570.46284: tcp 24
07:17:16.304360 IP static-87-75-105-186.vodafonexdsl.co.uk.8333 > tom-Latitude-3570.46284: tcp 37
07:17:16.304493 IP tom-Latitude-3570.46284 > static-87-75-105-186.vodafonexdsl.co.uk.8333: tcp 0
07:17:16.304616 IP tom-Latitude-3570.46284 > static-87-75-105-186.vodafonexdsl.co.uk.8333: tcp 24
07:17:16.306223 IP tom-Latitude-3570.46284 > static-87-75-105-186.vodafonexdsl.co.uk.8333: tcp 225
07:17:16.336590 IP static-87-75-105-186.vodafonexdsl.co.uk.8333 > tom-Latitude-3570.46284: tcp 0
07:17:16.412649 IP bb42-60-217-183.singnet.com.sg.8333 > tom-Latitude-3570.60470: tcp 24
07:17:16.412674 IP tom-Latitude-3570.60470 > bb42-60-217-183.singnet.com.sg.8333: tcp 0
07:17:16.413352 IP bb42-60-217-183.singnet.com.sg.8333 > tom-Latitude-3570.60470: tcp 73
07:17:16.413371 IP tom-Latitude-3570.60470 > bb42-60-217-183.singnet.com.sg.8333: tcp 0
07:17:16.413575 IP tom-Latitude-3570.60470 > bb42-60-217-183.singnet.com.sg.8333: tcp 24
07:17:16.415721 IP tom-Latitude-3570.60470 > bb42-60-217-183.singnet.com.sg.8333: tcp 472
07:17:16.447525 IP bb42-60-217-183.singnet.com.sg.8333 > tom-Latitude-3570.60470: tcp 0
07:17:16.448181 IP bb42-60-217-183.singnet.com.sg.8333 > tom-Latitude-3570.60470: tcp 0
07:17:16.815024 IP tom-Latitude-3570.60988 > 81.198.101.144.8333: tcp 24
07:17:16.817891 IP tom-Latitude-3570.60988 > 81.198.101.144.8333: tcp 469
07:17:16.868095 IP 81.198.101.144.8333 > tom-Latitude-3570.60988: tcp 0
07:17:16.876648 IP 81.198.101.144.8333 > tom-Latitude-3570.60988: tcp 0
07:17:16.890800 IP 81.198.101.144.8333 > tom-Latitude-3570.60988: tcp 24
07:17:16.891616 IP 81.198.101.144.8333 > tom-Latitude-3570.60988: tcp 397
07:17:16.891760 IP tom-Latitude-3570.60988 > 81.198.101.144.8333: tcp 0
07:17:17.293110 IP tom-Latitude-3570.49070 > c-185-45-236-223.customer.ggaweb.ch.8333: tcp 24
07:17:17.295127 IP tom-Latitude-3570.49070 > c-185-45-236-223.customer.ggaweb.ch.8333: tcp 469
07:17:17.339364 IP c-185-45-236-223.customer.ggaweb.ch.8333 > tom-Latitude-3570.49070: tcp 0
07:17:17.346229 IP c-185-45-236-223.customer.ggaweb.ch.8333 > tom-Latitude-3570.49070: tcp 0
07:17:17.594218 IP tom-Latitude-3570.39110 > vmi195435.contaboserver.net.8333: tcp 24
07:17:17.596120 IP tom-Latitude-3570.39110 > vmi195435.contaboserver.net.8333: tcp 469
07:17:17.629514 IP 167.99.216.145.8333 > tom-Latitude-3570.57976: tcp 24
07:17:17.629539 IP tom-Latitude-3570.57976 > 167.99.216.145.8333: tcp 0
07:17:17.629570 IP 167.99.216.145.8333 > tom-Latitude-3570.57976: tcp 145
07:17:17.629575 IP tom-Latitude-3570.57976 > 167.99.216.145.8333: tcp 0
07:17:17.629772 IP tom-Latitude-3570.57976 > 167.99.216.145.8333: tcp 24
07:17:17.631506 IP vmi195435.contaboserver.net.8333 > tom-Latitude-3570.39110: tcp 0
07:17:17.632906 IP tom-Latitude-3570.57976 > 167.99.216.145.8333: tcp 145
07:17:17.636401 IP vmi195435.contaboserver.net.8333 > tom-Latitude-3570.39110: tcp 0
07:17:17.667516 IP 167.99.216.145.8333 > tom-Latitude-3570.57976: tcp 0
07:17:17.668736 IP 167.99.216.145.8333 > tom-Latitude-3570.57976: tcp 0
07:17:17.732183 IP 167.99.216.145.8333 > tom-Latitude-3570.57976: tcp 24
07:17:17.732204 IP 167.99.216.145.8333 > tom-Latitude-3570.57976: tcp 189
07:17:17.732207 IP 167.99.216.145.8333 > tom-Latitude-3570.57976: tcp 24
07:17:17.732208 IP 167.99.216.145.8333 > tom-Latitude-3570.57976: tcp 254
07:17:17.732209 IP 167.99.216.145.8333 > tom-Latitude-3570.57976: tcp 24
07:17:17.732211 IP 167.99.216.145.8333 > tom-Latitude-3570.57976: tcp 224
07:17:17.732213 IP 167.99.216.145.8333 > tom-Latitude-3570.57976: tcp 24
07:17:17.732215 IP 167.99.216.145.8333 > tom-Latitude-3570.57976: tcp 226
07:17:17.732301 IP tom-Latitude-3570.57976 > 167.99.216.145.8333: tcp 0
07:17:18.052377 IP static-87-75-105-186.vodafonexdsl.co.uk.8333 > tom-Latitude-3570.46284: tcp 24
07:17:18.052397 IP static-87-75-105-186.vodafonexdsl.co.uk.8333 > tom-Latitude-3570.46284: tcp 109
07:17:18.052402 IP static-87-75-105-186.vodafonexdsl.co.uk.8333 > tom-Latitude-3570.46284: tcp 109
07:17:18.052429 IP tom-Latitude-3570.46284 > static-87-75-105-186.vodafonexdsl.co.uk.8333: tcp 0
07:17:18.152937 IP tom-Latitude-3570.49070 > c-185-45-236-223.customer.ggaweb.ch.8333: tcp 24
07:17:18.152996 IP tom-Latitude-3570.60470 > bb42-60-217-183.singnet.com.sg.8333: tcp 24
07:17:18.153892 IP tom-Latitude-3570.49070 > c-185-45-236-223.customer.ggaweb.ch.8333: tcp 145
07:17:18.154527 IP tom-Latitude-3570.60470 > bb42-60-217-183.singnet.com.sg.8333: tcp 145
07:17:18.189416 IP c-185-45-236-223.customer.ggaweb.ch.8333 > tom-Latitude-3570.49070: tcp 0
07:17:18.196346 IP bb42-60-217-183.singnet.com.sg.8333 > tom-Latitude-3570.60470: tcp 0
07:17:18.197690 IP c-185-45-236-223.customer.ggaweb.ch.8333 > tom-Latitude-3570.49070: tcp 0
07:17:18.197705 IP bb42-60-217-183.singnet.com.sg.8333 > tom-Latitude-3570.60470: tcp 0
07:17:18.253467 IP tom-Latitude-3570.42516 > 2.56.9.15.8333: tcp 24
07:17:18.253514 IP tom-Latitude-3570.46284 > static-87-75-105-186.vodafonexdsl.co.uk.8333: tcp 24
07:17:18.300671 IP tom-Latitude-3570.42516 > 2.56.9.15.8333: tcp 613
07:17:18.301300 IP tom-Latitude-3570.46284 > static-87-75-105-186.vodafonexdsl.co.uk.8333: tcp 37
07:17:18.329428 IP 2.56.9.15.8333 > tom-Latitude-3570.42516: tcp 0
07:17:18.345486 IP 2.56.9.15.8333 > tom-Latitude-3570.42516: tcp 0
07:17:18.346054 IP static-87-75-105-186.vodafonexdsl.co.uk.8333 > tom-Latitude-3570.46284: tcp 0
07:17:18.353935 IP tom-Latitude-3570.39110 > vmi195435.contaboserver.net.8333: tcp 24
07:17:18.354857 IP tom-Latitude-3570.39110 > vmi195435.contaboserver.net.8333: tcp 145
07:17:18.389411 IP vmi195435.contaboserver.net.8333 > tom-Latitude-3570.39110: tcp 0
07:17:18.397408 IP vmi195435.contaboserver.net.8333 > tom-Latitude-3570.39110: tcp 0
07:17:18.436482 IP bb42-60-217-183.singnet.com.sg.8333 > tom-Latitude-3570.60470: tcp 24
07:17:18.437708 IP bb42-60-217-183.singnet.com.sg.8333 > tom-Latitude-3570.60470: tcp 109
07:17:18.437839 IP tom-Latitude-3570.60470 > bb42-60-217-183.singnet.com.sg.8333: tcp 0
07:17:18.519456 IP 81.198.101.144.8333 > tom-Latitude-3570.60988: tcp 24
07:17:18.520133 IP 81.198.101.144.8333 > tom-Latitude-3570.60988: tcp 145
07:17:18.520262 IP tom-Latitude-3570.60988 > 81.198.101.144.8333: tcp 0
07:17:19.222811 IP tom-Latitude-3570.56714 > ns3113832.ip-54-38-177.eu.8333: tcp 24
07:17:19.224831 IP tom-Latitude-3570.56714 > ns3113832.ip-54-38-177.eu.8333: tcp 145
07:17:19.305184 IP static-87-75-105-186.vodafonexdsl.co.uk.8333 > tom-Latitude-3570.46284: tcp 24
07:17:19.305208 IP tom-Latitude-3570.46284 > static-87-75-105-186.vodafonexdsl.co.uk.8333: tcp 0
07:17:19.305239 IP static-87-75-105-186.vodafonexdsl.co.uk.8333 > tom-Latitude-3570.46284: tcp 8
07:17:19.305242 IP tom-Latitude-3570.46284 > static-87-75-105-186.vodafonexdsl.co.uk.8333: tcp 0
07:17:19.305386 IP tom-Latitude-3570.46284 > static-87-75-105-186.vodafonexdsl.co.uk.8333: tcp 24
07:17:19.308013 IP ns3113832.ip-54-38-177.eu.8333 > tom-Latitude-3570.56714: tcp 0
07:17:19.308716 IP tom-Latitude-3570.46284 > static-87-75-105-186.vodafonexdsl.co.uk.8333: tcp 8
07:17:19.336996 IP static-87-75-105-186.vodafonexdsl.co.uk.8333 > tom-Latitude-3570.46284: tcp 0
07:17:20.715170 IP 81.198.101.144.8333 > tom-Latitude-3570.60988: tcp 24
07:17:20.715188 IP 81.198.101.144.8333 > tom-Latitude-3570.60988: tcp 73
07:17:20.715190 IP 81.198.101.144.8333 > tom-Latitude-3570.60988: tcp 73
07:17:20.715218 IP tom-Latitude-3570.60988 > 81.198.101.144.8333: tcp 0
07:17:20.715409 IP tom-Latitude-3570.60988 > 81.198.101.144.8333: tcp 24
07:17:20.716797 IP tom-Latitude-3570.60988 > 81.198.101.144.8333: tcp 73
07:17:20.719461 IP vmi195435.contaboserver.net.8333 > tom-Latitude-3570.39110: tcp 24
07:17:20.719485 IP tom-Latitude-3570.39110 > vmi195435.contaboserver.net.8333: tcp 0
07:17:20.728239 IP vmi195435.contaboserver.net.8333 > tom-Latitude-3570.39110: tcp 37
07:17:20.728257 IP tom-Latitude-3570.39110 > vmi195435.contaboserver.net.8333: tcp 0
07:17:20.728439 IP tom-Latitude-3570.39110 > vmi195435.contaboserver.net.8333: tcp 24
07:17:20.729902 IP tom-Latitude-3570.39110 > vmi195435.contaboserver.net.8333: tcp 37
07:17:20.757936 IP 81.198.101.144.8333 > tom-Latitude-3570.60988: tcp 0
07:17:20.757950 IP vmi195435.contaboserver.net.8333 > tom-Latitude-3570.39110: tcp 0
07:17:20.757954 IP vmi195435.contaboserver.net.8333 > tom-Latitude-3570.39110: tcp 0
07:17:20.855025 IP 81.198.101.144.8333 > tom-Latitude-3570.60988: tcp 24
07:17:20.855046 IP 81.198.101.144.8333 > tom-Latitude-3570.60988: tcp 223
07:17:20.855050 IP 81.198.101.144.8333 > tom-Latitude-3570.60988: tcp 24
07:17:20.855052 IP 81.198.101.144.8333 > tom-Latitude-3570.60988: tcp 591
07:17:20.855142 IP tom-Latitude-3570.60988 > 81.198.101.144.8333: tcp 0
07:17:20.889493 IP tom-Latitude-3570.47920 > c-73-128-213-159.hsd1.md.comcast.net.8333: tcp 0
07:17:20.920104 IP c-73-128-213-159.hsd1.md.comcast.net.8333 > tom-Latitude-3570.47920: tcp 0
07:17:20.920136 IP tom-Latitude-3570.47920 > c-73-128-213-159.hsd1.md.comcast.net.8333: tcp 0
07:17:20.920432 IP tom-Latitude-3570.47920 > c-73-128-213-159.hsd1.md.comcast.net.8333: tcp 24
07:17:20.921583 IP tom-Latitude-3570.47920 > c-73-128-213-159.hsd1.md.comcast.net.8333: tcp 102
07:17:20.995888 IP tom-Latitude-3570.47920 > c-73-128-213-159.hsd1.md.comcast.net.8333: tcp 102
07:17:20.999685 IP c-73-128-213-159.hsd1.md.comcast.net.8333 > tom-Latitude-3570.47920: tcp 0
07:17:21.036158 IP c-73-128-213-159.hsd1.md.comcast.net.8333 > tom-Latitude-3570.47920: tcp 0
07:17:21.257188 IP tom-Latitude-3570.49070 > c-185-45-236-223.customer.ggaweb.ch.8333: tcp 24
07:17:21.259336 IP tom-Latitude-3570.49070 > c-185-45-236-223.customer.ggaweb.ch.8333: tcp 73
07:17:21.289177 IP c-185-45-236-223.customer.ggaweb.ch.8333 > tom-Latitude-3570.49070: tcp 0
07:17:21.297167 IP c-185-45-236-223.customer.ggaweb.ch.8333 > tom-Latitude-3570.49070: tcp 0
07:17:21.357611 IP tom-Latitude-3570.39110 > vmi195435.contaboserver.net.8333: tcp 24
