04:42:13.155349 IP c-185-45-236-223.customer.ggaweb.ch.8333 > tom-Latitude-3570.49070: tcp 24
04:42:13.155819 IP c-185-45-236-223.customer.ggaweb.ch.8333 > tom-Latitude-3570.49070: tcp 361
04:42:13.155836 IP ns3113832.ip-54-38-177.eu.8333 > tom-Latitude-3570.56714: tcp 24
04:42:13.155840 IP ns3113832.ip-54-38-177.eu.8333 > tom-Latitude-3570.56714: tcp 433
04:42:13.155845 IP c-185-45-236-223.customer.ggaweb.ch.8333 > tom-Latitude-3570.49070: tcp 361
04:42:13.155873 IP tom-Latitude-3570.49070 > c-185-45-236-223.customer.ggaweb.ch.8333: tcp 0
04:42:13.155888 IP bb42-60-217-183.singnet.com.sg.8333 > tom-Latitude-3570.60470: tcp 24
04:42:13.155891 IP bb42-60-217-183.singnet.com.sg.8333 > tom-Latitude-3570.60470: tcp 73
04:42:13.155895 IP ns3113832.ip-54-38-177.eu.8333 > tom-Latitude-3570.56714: tcp 433
04:42:13.155897 IP tom-Latitude-3570.56714 > ns3113832.ip-54-38-177.eu.8333: tcp 0
04:42:13.155909 IP static-87-75-105-186.vodafonexdsl.co.uk.8333 > tom-Latitude-3570.46284: tcp 24
04:42:13.155914 IP tom-Latitude-3570.46284 > static-87-75-105-186.vodafonexdsl.co.uk.8333: tcp 0
04:42:13.155926 IP static-87-75-105-186.vodafonexdsl.co.uk.8333 > tom-Latitude-3570.46284: tcp 685
04:42:13.155932 IP tom-Latitude-3570.46284 > static-87-75-105-186.vodafonexdsl.co.uk.8333: tcp 0
04:42:13.155940 IP bb42-60-217-183.singnet.com.sg.8333 > tom-Latitude-3570.60470: tcp 73
04:42:13.155944 IP tom-Latitude-3570.60470 > bb42-60-217-183.singnet.com.sg.8333: tcp 0
04:42:13.156195 IP tom-Latitude-3570.49070 > c-185-45-236-223.customer.ggaweb.ch.8333: tcp 24
04:42:13.160233 IP tom-Latitude-3570.49070 > c-185-45-236-223.customer.ggaweb.ch.8333: tcp 361
04:42:13.199087 IP c-185-45-236-223.customer.ggaweb.ch.8333 > tom-Latitude-3570.49070: tcp 0
04:42:13.282118 IP c-185-45-236-223.customer.ggaweb.ch.8333 > tom-Latitude-3570.49070: tcp 24
04:42:13.283068 IP c-185-45-236-223.customer.ggaweb.ch.8333 > tom-Latitude-3570.49070: tcp 1200
04:42:13.283198 IP tom-Latitude-3570.49070 > c-185-45-236-223.customer.ggaweb.ch.8333: tcp 0
04:42:13.283369 IP tom-Latitude-3570.39110 > vmi195435.contaboserver.net.8333: tcp 24
04:42:13.283833 IP tom-Latitude-3570.57976 > 167.99.216.145.8333: tcp 24
04:42:13.285091 IP tom-Latitude-3570.39110 > vmi195435.contaboserver.net.8333: tcp 145
04:42:13.285995 IP tom-Latitude-3570.57976 > 167.99.216.145.8333: tcp 541
04:42:13.286651 IP c-185-45-236-223.customer.ggaweb.ch.8333 > tom-Latitude-3570.49070: tcp 1236
04:42:13.293989 IP c-185-45-236-223.customer.ggaweb.ch.8333 > tom-Latitude-3570.49070: tcp 1398
04:42:13.294106 IP tom-Latitude-3570.49070 > c-185-45-236-223.customer.ggaweb.ch.8333: tcp 0
04:42:13.320777 IP vmi195435.contaboserver.net.8333 > tom-Latitude-3570.39110: tcp 0
04:42:13.320792 IP 167.99.216.145.8333 > tom-Latitude-3570.57976: tcp 0
04:42:13.320796 IP 167.99.216.145.8333 > tom-Latitude-3570.57976: tcp 0
04:42:13.397866 IP tom-Latitude-3570.57976 > 167.99.216.145.8333: tcp 24
04:42:13.398897 IP tom-Latitude-3570.57976 > 167.99.216.145.8333: tcp 325
04:42:13.431153 IP 167.99.216.145.8333 > tom-Latitude-3570.57976: tcp 0
04:42:13.439341 IP 167.99.216.145.8333 > tom-Latitude-3570.57976: tcp 0
04:42:13.699063 IP tom-Latitude-3570.60988 > 81.198.101.144.8333: tcp 24
04:42:13.701305 IP tom-Latitude-3570.60988 > 81.198.101.144.8333: tcp 865
04:42:13.751604 IP 81.198.101.144.8333 > tom-Latitude-3570.60988: tcp 0
04:42:13.759610 IP 81.198.101.144.8333 > tom-Latitude-3570.60988: tcp 0
04:42:14.702114 IP tom-Latitude-3570.42516 > 2.56.9.15.8333: tcp 24
04:42:14.704290 IP tom-Latitude-3570.42516 > 2.56.9.15.8333: tcp 361
04:42:14.709936 IP 81.198.101.144.8333 > tom-Latitude-3570.60988: tcp 24
04:42:14.709957 IP 81.198.101.144.8333 > tom-Latitude-3570.60988: tcp 109
04:42:14.709961 IP 81.198.101.144.8333 > tom-Latitude-3570.60988: tcp 109
04:42:14.709988 IP tom-Latitude-3570.60988 > 81.198.101.144.8333: tcp 0
04:42:14.710235 IP tom-Latitude-3570.60988 > 81.198.101.144.8333: tcp 24
04:42:14.711441 IP tom-Latitude-3570.60988 > 81.198.101.144.8333: tcp 109
04:42:14.745603 IP 2.56.9.15.8333 > tom-Latitude-3570.42516: tcp 0
04:42:14.746208 IP 2.56.9.15.8333 > tom-Latitude-3570.42516: tcp 0
04:42:14.746222 IP 81.198.101.144.8333 > tom-Latitude-3570.60988: tcp 0
04:42:14.746226 IP 81.198.101.144.8333 > tom-Latitude-3570.60988: tcp 0
04:42:14.835168 IP 81.198.101.144.8333 > tom-Latitude-3570.60988: tcp 24
04:42:14.835188 IP 81.198.101.144.8333 > tom-Latitude-3570.60988: tcp 223
04:42:14.835192 IP 81.198.101.144.8333 > tom-Latitude-3570.60988: tcp 24
04:42:14.835195 IP 81.198.101.144.8333 > tom-Latitude-3570.60988: tcp 249
04:42:14.835196 IP 81.198.101.144.8333 > tom-Latitude-3570.60988: tcp 24
04:42:14.835220 IP 81.198.101.144.8333 > tom-Latitude-3570.60988: tcp 189
04:42:14.835285 IP tom-Latitude-3570.60988 > 81.198.101.144.8333: tcp 0
04:42:15.036611 IP tom-Latitude-3570.46284 > static-87-75-105-186.vodafonexdsl.co.uk.8333: tcp 24
04:42:15.037550 IP tom-Latitude-3570.46284 > static-87-75-105-186.vodafonexdsl.co.uk.8333: tcp 145
04:42:15.071114 IP static-87-75-105-186.vodafonexdsl.co.uk.8333 > tom-Latitude-3570.46284: tcp 0
04:42:15.080689 IP static-87-75-105-186.vodafonexdsl.co.uk.8333 > tom-Latitude-3570.46284: tcp 0
04:42:15.136995 IP tom-Latitude-3570.49070 > c-185-45-236-223.customer.ggaweb.ch.8333: tcp 24
04:42:15.138006 IP tom-Latitude-3570.49070 > c-185-45-236-223.customer.ggaweb.ch.8333: tcp 109
04:42:15.179102 IP c-185-45-236-223.customer.ggaweb.ch.8333 > tom-Latitude-3570.49070: tcp 0
04:42:15.337705 IP tom-Latitude-3570.42516 > 2.56.9.15.8333: tcp 24
04:42:15.339965 IP tom-Latitude-3570.42516 > 2.56.9.15.8333: tcp 109
04:42:15.369504 IP 2.56.9.15.8333 > tom-Latitude-3570.42516: tcp 0
04:42:15.378191 IP 2.56.9.15.8333 > tom-Latitude-3570.42516: tcp 0
04:42:15.817826 IP vmi195435.contaboserver.net.8333 > tom-Latitude-3570.39110: tcp 24
04:42:15.817847 IP vmi195435.contaboserver.net.8333 > tom-Latitude-3570.39110: tcp 649
04:42:15.817852 IP vmi195435.contaboserver.net.8333 > tom-Latitude-3570.39110: tcp 649
04:42:15.817879 IP tom-Latitude-3570.39110 > vmi195435.contaboserver.net.8333: tcp 0
04:42:15.818227 IP tom-Latitude-3570.39110 > vmi195435.contaboserver.net.8333: tcp 24
04:42:15.819439 IP tom-Latitude-3570.39110 > vmi195435.contaboserver.net.8333: tcp 181
04:42:15.858567 IP vmi195435.contaboserver.net.8333 > tom-Latitude-3570.39110: tcp 0
04:42:15.918734 IP tom-Latitude-3570.56714 > ns3113832.ip-54-38-177.eu.8333: tcp 24
04:42:15.919673 IP tom-Latitude-3570.56714 > ns3113832.ip-54-38-177.eu.8333: tcp 361
04:42:15.938786 IP vmi195435.contaboserver.net.8333 > tom-Latitude-3570.39110: tcp 24
04:42:15.939840 IP vmi195435.contaboserver.net.8333 > tom-Latitude-3570.39110: tcp 225
04:42:15.939859 IP vmi195435.contaboserver.net.8333 > tom-Latitude-3570.39110: tcp 24
04:42:15.939864 IP vmi195435.contaboserver.net.8333 > tom-Latitude-3570.39110: tcp 1448
04:42:15.939866 IP vmi195435.contaboserver.net.8333 > tom-Latitude-3570.39110: tcp 8
04:42:15.939868 IP vmi195435.contaboserver.net.8333 > tom-Latitude-3570.39110: tcp 24
04:42:15.939889 IP vmi195435.contaboserver.net.8333 > tom-Latitude-3570.39110: tcp 247
04:42:15.939891 IP vmi195435.contaboserver.net.8333 > tom-Latitude-3570.39110: tcp 24
04:42:15.939894 IP vmi195435.contaboserver.net.8333 > tom-Latitude-3570.39110: tcp 815
04:42:15.939896 IP vmi195435.contaboserver.net.8333 > tom-Latitude-3570.39110: tcp 24
04:42:15.939954 IP tom-Latitude-3570.39110 > vmi195435.contaboserver.net.8333: tcp 0
04:42:15.949525 IP ns3113832.ip-54-38-177.eu.8333 > tom-Latitude-3570.56714: tcp 0
04:42:15.957535 IP ns3113832.ip-54-38-177.eu.8333 > tom-Latitude-3570.56714: tcp 0
04:42:16.014750 IP vmi195435.contaboserver.net.8333 > tom-Latitude-3570.39110: tcp 190
04:42:16.055913 IP tom-Latitude-3570.39110 > vmi195435.contaboserver.net.8333: tcp 0
04:42:16.516876 IP tom-Latitude-3570.56714 > ns3113832.ip-54-38-177.eu.8333: tcp 24
04:42:16.519863 IP tom-Latitude-3570.56714 > ns3113832.ip-54-38-177.eu.8333: tcp 181
04:42:16.571685 IP ns3113832.ip-54-38-177.eu.8333 > tom-Latitude-3570.56714: tcp 0
04:42:16.579618 IP ns3113832.ip-54-38-177.eu.8333 > tom-Latitude-3570.56714: tcp 0
04:42:16.717628 IP tom-Latitude-3570.46284 > static-87-75-105-186.vodafonexdsl.co.uk.8333: tcp 24
04:42:16.719868 IP tom-Latitude-3570.46284 > static-87-75-105-186.vodafonexdsl.co.uk.8333: tcp 181
04:42:16.750935 IP static-87-75-105-186.vodafonexdsl.co.uk.8333 > tom-Latitude-3570.46284: tcp 0
04:42:16.758947 IP static-87-75-105-186.vodafonexdsl.co.uk.8333 > tom-Latitude-3570.46284: tcp 0
04:42:16.944218 IP ns3113832.ip-54-38-177.eu.8333 > tom-Latitude-3570.56714: tcp 24
04:42:16.944242 IP tom-Latitude-3570.56714 > ns3113832.ip-54-38-177.eu.8333: tcp 0
04:42:16.944274 IP ns3113832.ip-54-38-177.eu.8333 > tom-Latitude-3570.56714: tcp 145
04:42:16.944279 IP tom-Latitude-3570.56714 > ns3113832.ip-54-38-177.eu.8333: tcp 0
04:42:16.944472 IP tom-Latitude-3570.56714 > ns3113832.ip-54-38-177.eu.8333: tcp 24
04:42:16.946659 IP tom-Latitude-3570.56714 > ns3113832.ip-54-38-177.eu.8333: tcp 145
04:42:16.978114 IP static-87-75-105-186.vodafonexdsl.co.uk.8333 > tom-Latitude-3570.46284: tcp 24
04:42:16.978131 IP tom-Latitude-3570.46284 > static-87-75-105-186.vodafonexdsl.co.uk.8333: tcp 0
04:42:16.990430 IP ns3113832.ip-54-38-177.eu.8333 > tom-Latitude-3570.56714: tcp 0
04:42:16.990444 IP ns3113832.ip-54-38-177.eu.8333 > tom-Latitude-3570.56714: tcp 0
04:42:16.992293 IP static-87-75-105-186.vodafonexdsl.co.uk.8333 > tom-Latitude-3570.46284: tcp 145
04:42:16.992317 IP tom-Latitude-3570.46284 > static-87-75-105-186.vodafonexdsl.co.uk.8333: tcp 0
04:42:17.021932 IP 81.198.101.144.8333 > tom-Latitude-3570.60988: tcp 24
04:42:17.021951 IP 81.198.101.144.8333 > tom-Latitude-3570.60988: tcp 8
04:42:17.022041 IP tom-Latitude-3570.60988 > 81.198.101.144.8333: tcp 0
04:42:17.022124 IP tom-Latitude-3570.60988 > 81.198.101.144.8333: tcp 24
04:42:17.022251 IP tom-Latitude-3570.60470 > bb42-60-217-183.singnet.com.sg.8333: tcp 24
04:42:17.023664 IP tom-Latitude-3570.60988 > 81.198.101.144.8333: tcp 8
04:42:17.024268 IP tom-Latitude-3570.60470 > bb42-60-217-183.singnet.com.sg.8333: tcp 577
04:42:17.055389 IP ns3113832.ip-54-38-177.eu.8333 > tom-Latitude-3570.56714: tcp 24
04:42:17.056190 IP ns3113832.ip-54-38-177.eu.8333 > tom-Latitude-3570.56714: tcp 226
04:42:17.056208 IP ns3113832.ip-54-38-177.eu.8333 > tom-Latitude-3570.56714: tcp 24
04:42:17.056320 IP tom-Latitude-3570.56714 > ns3113832.ip-54-38-177.eu.8333: tcp 0
04:42:17.059808 IP ns3113832.ip-54-38-177.eu.8333 > tom-Latitude-3570.56714: tcp 368
04:42:17.059824 IP ns3113832.ip-54-38-177.eu.8333 > tom-Latitude-3570.56714: tcp 24
04:42:17.059827 IP ns3113832.ip-54-38-177.eu.8333 > tom-Latitude-3570.56714: tcp 257
04:42:17.059830 IP ns3113832.ip-54-38-177.eu.8333 > tom-Latitude-3570.56714: tcp 24
04:42:17.059832 IP ns3113832.ip-54-38-177.eu.8333 > tom-Latitude-3570.56714: tcp 250
04:42:17.059835 IP 81.198.101.144.8333 > tom-Latitude-3570.60988: tcp 0
04:42:17.059841 IP bb42-60-217-183.singnet.com.sg.8333 > tom-Latitude-3570.60470: tcp 0
04:42:17.059935 IP tom-Latitude-3570.56714 > ns3113832.ip-54-38-177.eu.8333: tcp 0
04:42:17.064637 IP 81.198.101.144.8333 > tom-Latitude-3570.60988: tcp 0
04:42:17.067596 IP bb42-60-217-183.singnet.com.sg.8333 > tom-Latitude-3570.60470: tcp 0
04:42:17.161312 IP tom-Latitude-3570.57976 > 167.99.216.145.8333: tcp 24
04:42:17.162249 IP tom-Latitude-3570.57976 > 167.99.216.145.8333: tcp 433
04:42:17.190941 IP 167.99.216.145.8333 > tom-Latitude-3570.57976: tcp 0
04:42:17.198925 IP 167.99.216.145.8333 > tom-Latitude-3570.57976: tcp 0
04:42:17.562496 IP tom-Latitude-3570.49070 > c-185-45-236-223.customer.ggaweb.ch.8333: tcp 24
04:42:17.564692 IP tom-Latitude-3570.49070 > c-185-45-236-223.customer.ggaweb.ch.8333: tcp 325
04:42:17.629506 IP c-185-45-236-223.customer.ggaweb.ch.8333 > tom-Latitude-3570.49070: tcp 0
04:42:18.685132 IP 167.99.216.145.8333 > tom-Latitude-3570.57976: tcp 24
04:42:18.685153 IP 167.99.216.145.8333 > tom-Latitude-3570.57976: tcp 253
04:42:18.685179 IP vmi195435.contaboserver.net.8333 > tom-Latitude-3570.39110: tcp 24
04:42:18.685194 IP tom-Latitude-3570.39110 > vmi195435.contaboserver.net.8333: tcp 0
04:42:18.685211 IP vmi195435.contaboserver.net.8333 > tom-Latitude-3570.39110: tcp 289
04:42:18.685215 IP tom-Latitude-3570.39110 > vmi195435.contaboserver.net.8333: tcp 0
04:42:18.685219 IP 167.99.216.145.8333 > tom-Latitude-3570.57976: tcp 253
04:42:18.685222 IP tom-Latitude-3570.57976 > 167.99.216.145.8333: tcp 0
04:42:18.685227 IP vmi195435.contaboserver.net.8333 > tom-Latitude-3570.39110: tcp 289
04:42:18.685229 IP tom-Latitude-3570.39110 > vmi195435.contaboserver.net.8333: tcp 0
04:42:18.685398 IP tom-Latitude-3570.39110 > vmi195435.contaboserver.net.8333: tcp 24
04:42:18.685510 IP tom-Latitude-3570.57976 > 167.99.216.145.8333: tcp 24
04:42:18.688980 IP tom-Latitude-3570.39110 > vmi195435.contaboserver.net.8333: tcp 145
04:42:18.689582 IP tom-Latitude-3570.57976 > 167.99.216.145.8333: tcp 109
04:42:18.717475 IP 167.99.216.145.8333 > tom-Latitude-3570.57976: tcp 0
04:42:18.717482 IP vmi195435.contaboserver.net.8333 > tom-Latitude-3570.39110: tcp 0
04:42:18.717485 IP 167.99.216.145.8333 > tom-Latitude-3570.57976: tcp 0
04:42:18.731222 IP 81.198.101.144.8333 > tom-Latitude-3570.60988: tcp 24
04:42:18.732378 IP 81.198.101.144.8333 > tom-Latitude-3570.60988: tcp 577
04:42:18.732391 IP tom-Latitude-3570.60988 > 81.198.101.144.8333: tcp 0
04:42:18.732545 IP tom-Latitude-3570.60988 > 81.198.101.144.8333: tcp 24
04:42:18.733813 IP tom-Latitude-3570.60988 > 81.198.101.144.8333: tcp 37
04:42:18.767222 IP 81.198.101.144.8333 > tom-Latitude-3570.60988: tcp 0
04:42:18.767227 IP 81.198.101.144.8333 > tom-Latitude-3570.60988: tcp 0
04:42:18.782234 IP 167.99.216.145.8333 > tom-Latitude-3570.57976: tcp 24
04:42:18.782241 IP 167.99.216.145.8333 > tom-Latitude-3570.57976: tcp 189
04:42:18.782244 IP 167.99.216.145.8333 > tom-Latitude-3570.57976: tcp 24
04:42:18.782249 IP tom-Latitude-3570.57976 > 167.99.216.145.8333: tcp 0
04:42:18.782329 IP 167.99.216.145.8333 > tom-Latitude-3570.57976: tcp 225
04:42:18.782335 IP 167.99.216.145.8333 > tom-Latitude-3570.57976: tcp 24
04:42:18.782338 IP 167.99.216.145.8333 > tom-Latitude-3570.57976: tcp 374
04:42:18.782343 IP tom-Latitude-3570.57976 > 167.99.216.145.8333: tcp 0
04:42:18.795621 IP vmi195435.contaboserver.net.8333 > tom-Latitude-3570.39110: tcp 24
04:42:18.795642 IP vmi195435.contaboserver.net.8333 > tom-Latitude-3570.39110: tcp 256
04:42:18.795646 IP vmi195435.contaboserver.net.8333 > tom-Latitude-3570.39110: tcp 24
04:42:18.795670 IP vmi195435.contaboserver.net.8333 > tom-Latitude-3570.39110: tcp 225
04:42:18.795673 IP vmi195435.contaboserver.net.8333 > tom-Latitude-3570.39110: tcp 24
04:42:18.795684 IP vmi195435.contaboserver.net.8333 > tom-Latitude-3570.39110: tcp 247
04:42:18.795688 IP vmi195435.contaboserver.net.8333 > tom-Latitude-3570.39110: tcp 24
04:42:18.795694 IP vmi195435.contaboserver.net.8333 > tom-Latitude-3570.39110: tcp 247
04:42:18.795750 IP tom-Latitude-3570.39110 > vmi195435.contaboserver.net.8333: tcp 0
04:42:18.856339 IP 81.198.101.144.8333 > tom-Latitude-3570.60988: tcp 24
04:42:18.857007 IP 81.198.101.144.8333 > tom-Latitude-3570.60988: tcp 257
04:42:18.857137 IP tom-Latitude-3570.60988 > 81.198.101.144.8333: tcp 0
04:42:18.936601 IP 2.56.9.15.8333 > tom-Latitude-3570.42516: tcp 24
04:42:18.936622 IP 2.56.9.15.8333 > tom-Latitude-3570.42516: tcp 721
04:42:18.936729 IP tom-Latitude-3570.42516 > 2.56.9.15.8333: tcp 0
04:42:18.936995 IP tom-Latitude-3570.42516 > 2.56.9.15.8333: tcp 24
04:42:18.938544 IP tom-Latitude-3570.42516 > 2.56.9.15.8333: tcp 145
04:42:18.967227 IP 2.56.9.15.8333 > tom-Latitude-3570.42516: tcp 0
04:42:18.967235 IP 2.56.9.15.8333 > tom-Latitude-3570.42516: tcp 0
04:42:19.079906 IP 2.56.9.15.8333 > tom-Latitude-3570.42516: tcp 24
04:42:19.079926 IP 2.56.9.15.8333 > tom-Latitude-3570.42516: tcp 223
04:42:19.079930 IP 2.56.9.15.8333 > tom-Latitude-3570.42516: tcp 24
04:42:19.079934 IP 2.56.9.15.8333 > tom-Latitude-3570.42516: tcp 225
04:42:19.079935 IP 2.56.9.15.8333 > tom-Latitude-3570.42516: tcp 24
04:42:19.079955 IP 2.56.9.15.8333 > tom-Latitude-3570.42516: tcp 226
04:42:19.079957 IP 2.56.9.15.8333 > tom-Latitude-3570.42516: tcp 24
04:42:19.079964 IP 2.56.9.15.8333 > tom-Latitude-3570.42516: tcp 249
04:42:19.080028 IP tom-Latitude-3570.42516 > 2.56.9.15.8333: tcp 0
04:42:19.381825 IP tom-Latitude-3570.42516 > 2.56.9.15.8333: tcp 24
04:42:19.383928 IP tom-Latitude-3570.42516 > 2.56.9.15.8333: tcp 37
04:42:19.429348 IP 2.56.9.15.8333 > tom-Latitude-3570.42516: tcp 0
04:42:19.437158 IP 2.56.9.15.8333 > tom-Latitude-3570.42516: tcp 0
04:42:19.482273 IP tom-Latitude-3570.60988 > 81.198.101.144.8333: tcp 24
04:42:19.482330 IP tom-Latitude-3570.57976 > 167.99.216.145.8333: tcp 24
04:42:19.483209 IP tom-Latitude-3570.60988 > 81.198.101.144.8333: tcp 181
04:42:19.483918 IP tom-Latitude-3570.57976 > 167.99.216.145.8333: tcp 181
04:42:19.509144 IP 81.198.101.144.8333 > tom-Latitude-3570.60988: tcp 0
04:42:19.517119 IP 167.99.216.145.8333 > tom-Latitude-3570.57976: tcp 0
04:42:19.517761 IP 81.198.101.144.8333 > tom-Latitude-3570.60988: tcp 0
04:42:19.517774 IP 167.99.216.145.8333 > tom-Latitude-3570.57976: tcp 0
04:42:19.683124 IP tom-Latitude-3570.60470 > bb42-60-217-183.singnet.com.sg.8333: tcp 24
04:42:19.685499 IP tom-Latitude-3570.60470 > bb42-60-217-183.singnet.com.sg.8333: tcp 577
04:42:19.709149 IP bb42-60-217-183.singnet.com.sg.8333 > tom-Latitude-3570.60470: tcp 0
04:42:19.717096 IP bb42-60-217-183.singnet.com.sg.8333 > tom-Latitude-3570.60470: tcp 0
04:42:20.385336 IP tom-Latitude-3570.56714 > ns3113832.ip-54-38-177.eu.8333: tcp 24
04:42:20.387492 IP tom-Latitude-3570.56714 > ns3113832.ip-54-38-177.eu.8333: tcp 31
04:42:20.429574 IP ns3113832.ip-54-38-177.eu.8333 > tom-Latitude-3570.56714: tcp 0
04:42:20.437400 IP ns3113832.ip-54-38-177.eu.8333 > tom-Latitude-3570.56714: tcp 0
04:42:20.686244 IP tom-Latitude-3570.56714 > ns3113832.ip-54-38-177.eu.8333: tcp 24
04:42:20.688464 IP tom-Latitude-3570.56714 > ns3113832.ip-54-38-177.eu.8333: tcp 433
04:42:20.719588 IP ns3113832.ip-54-38-177.eu.8333 > tom-Latitude-3570.56714: tcp 0
04:42:20.731034 IP ns3113832.ip-54-38-177.eu.8333 > tom-Latitude-3570.56714: tcp 0
04:42:21.142584 IP 81.198.101.144.8333 > tom-Latitude-3570.60988: tcp 24
04:42:21.142603 IP 81.198.101.144.8333 > tom-Latitude-3570.60988: tcp 31
04:42:21.142607 IP 81.198.101.144.8333 > tom-Latitude-3570.60988: tcp 31
04:42:21.142633 IP tom-Latitude-3570.60988 > 81.198.101.144.8333: tcp 0
04:42:22.848188 IP tom-Latitude-3570.46284 > static-87-75-105-186.vodafonexdsl.co.uk.8333: tcp 24
04:42:22.850553 IP tom-Latitude-3570.46284 > static-87-75-105-186.vodafonexdsl.co.uk.8333: tcp 433
04:42:22.919255 IP static-87-75-105-186.vodafonexdsl.co.uk.8333 > tom-Latitude-3570.46284: tcp 24
04:42:22.919272 IP tom-Latitude-3570.46284 > static-87-75-105-186.vodafonexdsl.co.uk.8333: tcp 0
04:42:22.919291 IP static-87-75-105-186.vodafonexdsl.co.uk.8333 > tom-Latitude-3570.46284: tcp 901
04:42:22.919297 IP tom-Latitude-3570.46284 > static-87-75-105-186.vodafonexdsl.co.uk.8333: tcp 0
04:42:22.919299 IP static-87-75-105-186.vodafonexdsl.co.uk.8333 > tom-Latitude-3570.46284: tcp 0
04:42:22.919322 IP static-87-75-105-186.vodafonexdsl.co.uk.8333 > tom-Latitude-3570.46284: tcp 0
04:42:22.919687 IP tom-Latitude-3570.46284 > static-87-75-105-186.vodafonexdsl.co.uk.8333: tcp 24
04:42:22.921359 IP tom-Latitude-3570.46284 > static-87-75-105-186.vodafonexdsl.co.uk.8333: tcp 469
04:42:22.960813 IP static-87-75-105-186.vodafonexdsl.co.uk.8333 > tom-Latitude-3570.46284: tcp 0
04:42:22.960821 IP static-87-75-105-186.vodafonexdsl.co.uk.8333 > tom-Latitude-3570.46284: tcp 0
04:42:23.025693 IP static-87-75-105-186.vodafonexdsl.co.uk.8333 > tom-Latitude-3570.46284: tcp 24
04:42:23.026495 IP static-87-75-105-186.vodafonexdsl.co.uk.8333 > tom-Latitude-3570.46284: tcp 226
04:42:23.026513 IP static-87-75-105-186.vodafonexdsl.co.uk.8333 > tom-Latitude-3570.46284: tcp 24
04:42:23.026516 IP static-87-75-105-186.vodafonexdsl.co.uk.8333 > tom-Latitude-3570.46284: tcp 366
04:42:23.026518 IP static-87-75-105-186.vodafonexdsl.co.uk.8333 > tom-Latitude-3570.46284: tcp 24
04:42:23.026521 IP static-87-75-105-186.vodafonexdsl.co.uk.8333 > tom-Latitude-3570.46284: tcp 223
04:42:23.026522 IP static-87-75-105-186.vodafonexdsl.co.uk.8333 > tom-Latitude-3570.46284: tcp 24
04:42:23.026524 IP static-87-75-105-186.vodafonexdsl.co.uk.8333 > tom-Latitude-3570.46284: tcp 223
04:42:23.026545 IP static-87-75-105-186.vodafonexdsl.co.uk.8333 > tom-Latitude-3570.46284: tcp 24
04:42:23.026612 IP tom-Latitude-3570.46284 > static-87-75-105-186.vodafonexdsl.co.uk.8333: tcp 0
04:42:23.030794 IP static-87-75-105-186.vodafonexdsl.co.uk.8333 > tom-Latitude-3570.46284: tcp 223
04:42:23.030809 IP static-87-75-105-186.vodafonexdsl.co.uk.8333 > tom-Latitude-3570.46284: tcp 24
04:42:23.030812 IP static-87-75-105-186.vodafonexdsl.co.uk.8333 > tom-Latitude-3570.46284: tcp 348
04:42:23.030835 IP static-87-75-105-186.vodafonexdsl.co.uk.8333 > tom-Latitude-3570.46284: tcp 24
04:42:23.030894 IP tom-Latitude-3570.46284 > static-87-75-105-186.vodafonexdsl.co.uk.8333: tcp 0
04:42:23.031141 IP static-87-75-105-186.vodafonexdsl.co.uk.8333 > tom-Latitude-3570.46284: tcp 1440
04:42:23.031153 IP static-87-75-105-186.vodafonexdsl.co.uk.8333 > tom-Latitude-3570.46284: tcp 1440
04:42:23.031196 IP tom-Latitude-3570.46284 > static-87-75-105-186.vodafonexdsl.co.uk.8333: tcp 0
04:42:23.033492 IP static-87-75-105-186.vodafonexdsl.co.uk.8333 > tom-Latitude-3570.46284: tcp 919
04:42:23.033506 IP static-87-75-105-186.vodafonexdsl.co.uk.8333 > tom-Latitude-3570.46284: tcp 215
04:42:23.033509 IP static-87-75-105-186.vodafonexdsl.co.uk.8333 > tom-Latitude-3570.46284: tcp 394
04:42:23.033511 IP static-87-75-105-186.vodafonexdsl.co.uk.8333 > tom-Latitude-3570.46284: tcp 273
04:42:23.033514 IP static-87-75-105-186.vodafonexdsl.co.uk.8333 > tom-Latitude-3570.46284: tcp 250
04:42:23.033534 IP static-87-75-105-186.vodafonexdsl.co.uk.8333 > tom-Latitude-3570.46284: tcp 444
04:42:23.033541 IP static-87-75-105-186.vodafonexdsl.co.uk.8333 > tom-Latitude-3570.46284: tcp 226
04:42:23.033608 IP tom-Latitude-3570.46284 > static-87-75-105-186.vodafonexdsl.co.uk.8333: tcp 0
04:42:23.050305 IP 81.198.101.144.8333 > tom-Latitude-3570.60988: tcp 24
04:42:23.050319 IP tom-Latitude-3570.60988 > 81.198.101.144.8333: tcp 0
04:42:23.051726 IP 81.198.101.144.8333 > tom-Latitude-3570.60988: tcp 541
04:42:23.051741 IP tom-Latitude-3570.60988 > 81.198.101.144.8333: tcp 0
04:42:23.051962 IP tom-Latitude-3570.60988 > 81.198.101.144.8333: tcp 24
04:42:23.053120 IP tom-Latitude-3570.60988 > 81.198.101.144.8333: tcp 73
04:42:23.089421 IP 81.198.101.144.8333 > tom-Latitude-3570.60988: tcp 0
04:42:23.089429 IP 81.198.101.144.8333 > tom-Latitude-3570.60988: tcp 0
04:42:23.177470 IP 81.198.101.144.8333 > tom-Latitude-3570.60988: tcp 24
04:42:23.178217 IP 81.198.101.144.8333 > tom-Latitude-3570.60988: tcp 247
04:42:23.178234 IP 81.198.101.144.8333 > tom-Latitude-3570.60988: tcp 24
04:42:23.178237 IP 81.198.101.144.8333 > tom-Latitude-3570.60988: tcp 249
04:42:23.178327 IP tom-Latitude-3570.60988 > 81.198.101.144.8333: tcp 0
04:42:23.580191 IP tom-Latitude-3570.49070 > c-185-45-236-223.customer.ggaweb.ch.8333: tcp 24
04:42:23.582472 IP tom-Latitude-3570.49070 > c-185-45-236-223.customer.ggaweb.ch.8333: tcp 973
04:42:23.647300 IP c-185-45-236-223.customer.ggaweb.ch.8333 > tom-Latitude-3570.49070: tcp 0
04:42:23.881411 IP tom-Latitude-3570.39110 > vmi195435.contaboserver.net.8333: tcp 24
04:42:23.883463 IP tom-Latitude-3570.39110 > vmi195435.contaboserver.net.8333: tcp 829
04:42:23.937578 IP vmi195435.contaboserver.net.8333 > tom-Latitude-3570.39110: tcp 0
04:42:24.032109 IP tom-Latitude-3570.48542 > 5.171.188.189.8333: tcp 0
04:42:24.100582 IP 5.171.188.189.8333 > tom-Latitude-3570.48542: tcp 0
04:42:24.383216 IP tom-Latitude-3570.57976 > 167.99.216.145.8333: tcp 24
04:42:24.385469 IP tom-Latitude-3570.57976 > 167.99.216.145.8333: tcp 541
04:42:24.420591 IP 167.99.216.145.8333 > tom-Latitude-3570.57976: tcp 0
04:42:24.428522 IP 167.99.216.145.8333 > tom-Latitude-3570.57976: tcp 0
04:42:24.584003 IP tom-Latitude-3570.60470 > bb42-60-217-183.singnet.com.sg.8333: tcp 24
04:42:24.586102 IP tom-Latitude-3570.60470 > bb42-60-217-183.singnet.com.sg.8333: tcp 541
04:42:24.621632 IP bb42-60-217-183.singnet.com.sg.8333 > tom-Latitude-3570.60470: tcp 0
04:42:24.628530 IP bb42-60-217-183.singnet.com.sg.8333 > tom-Latitude-3570.60470: tcp 0
04:42:24.984618 IP tom-Latitude-3570.34994 > 45.56.152.163.8333: tcp 0
04:42:25.038083 IP c-185-45-236-223.customer.ggaweb.ch.8333 > tom-Latitude-3570.49070: tcp 24
04:42:25.038770 IP c-185-45-236-223.customer.ggaweb.ch.8333 > tom-Latitude-3570.49070: tcp 361
04:42:25.038900 IP tom-Latitude-3570.49070 > c-185-45-236-223.customer.ggaweb.ch.8333: tcp 0
04:42:25.039120 IP tom-Latitude-3570.49070 > c-185-45-236-223.customer.ggaweb.ch.8333: tcp 24
04:42:25.040651 IP tom-Latitude-3570.49070 > c-185-45-236-223.customer.ggaweb.ch.8333: tcp 361
04:42:25.041977 IP 45.56.152.163.8333 > tom-Latitude-3570.34994: tcp 0
04:42:25.041994 IP tom-Latitude-3570.34994 > 45.56.152.163.8333: tcp 0
04:42:25.042205 IP tom-Latitude-3570.34994 > 45.56.152.163.8333: tcp 24
04:42:25.044313 IP tom-Latitude-3570.34994 > 45.56.152.163.8333: tcp 102
04:42:25.068277 IP c-185-45-236-223.customer.ggaweb.ch.8333 > tom-Latitude-3570.49070: tcp 0
04:42:25.108807 IP 45.56.152.163.8333 > tom-Latitude-3570.34994: tcp 0
04:42:25.151805 IP c-185-45-236-223.customer.ggaweb.ch.8333 > tom-Latitude-3570.49070: tcp 24
04:42:25.154418 IP c-185-45-236-223.customer.ggaweb.ch.8333 > tom-Latitude-3570.49070: tcp 654
04:42:25.154442 IP c-185-45-236-223.customer.ggaweb.ch.8333 > tom-Latitude-3570.49070: tcp 723
04:42:25.154446 IP c-185-45-236-223.customer.ggaweb.ch.8333 > tom-Latitude-3570.49070: tcp 466
04:42:25.154553 IP tom-Latitude-3570.49070 > c-185-45-236-223.customer.ggaweb.ch.8333: tcp 0
04:42:25.154570 IP c-185-45-236-223.customer.ggaweb.ch.8333 > tom-Latitude-3570.49070: tcp 566
04:42:25.154577 IP c-185-45-236-223.customer.ggaweb.ch.8333 > tom-Latitude-3570.49070: tcp 474
04:42:25.154643 IP tom-Latitude-3570.49070 > c-185-45-236-223.customer.ggaweb.ch.8333: tcp 0
04:42:25.561282 IP tom-Latitude-3570.57976 > 167.99.216.145.8333: tcp 24
04:42:25.563518 IP tom-Latitude-3570.57976 > 167.99.216.145.8333: tcp 361
04:42:25.600576 IP 167.99.216.145.8333 > tom-Latitude-3570.57976: tcp 0
04:42:25.609180 IP 167.99.216.145.8333 > tom-Latitude-3570.57976: tcp 0
04:42:25.854111 IP bb42-60-217-183.singnet.com.sg.8333 > tom-Latitude-3570.60470: tcp 24
04:42:25.854136 IP tom-Latitude-3570.60470 > bb42-60-217-183.singnet.com.sg.8333: tcp 0
04:42:25.854169 IP bb42-60-217-183.singnet.com.sg.8333 > tom-Latitude-3570.60470: tcp 397
04:42:25.854174 IP tom-Latitude-3570.60470 > bb42-60-217-183.singnet.com.sg.8333: tcp 0
04:42:25.854401 IP tom-Latitude-3570.60470 > bb42-60-217-183.singnet.com.sg.8333: tcp 24
04:42:25.856149 IP tom-Latitude-3570.60470 > bb42-60-217-183.singnet.com.sg.8333: tcp 37
04:42:25.896641 IP bb42-60-217-183.singnet.com.sg.8333 > tom-Latitude-3570.60470: tcp 0
04:42:25.897255 IP bb42-60-217-183.singnet.com.sg.8333 > tom-Latitude-3570.60470: tcp 0
04:42:26.155264 IP tom-Latitude-3570.46284 > static-87-75-105-186.vodafonexdsl.co.uk.8333: tcp 24
04:42:26.158003 IP tom-Latitude-3570.46284 > static-87-75-105-186.vodafonexdsl.co.uk.8333: tcp 433
04:42:26.190777 IP static-87-75-105-186.vodafonexdsl.co.uk.8333 > tom-Latitude-3570.46284: tcp 0
04:42:26.201274 IP static-87-75-105-186.vodafonexdsl.co.uk.8333 > tom-Latitude-3570.46284: tcp 0
04:42:26.277848 IP bb42-60-217-183.singnet.com.sg.8333 > tom-Latitude-3570.60470: tcp 24
04:42:26.278481 IP bb42-60-217-183.singnet.com.sg.8333 > tom-Latitude-3570.60470: tcp 249
04:42:26.278613 IP tom-Latitude-3570.60470 > bb42-60-217-183.singnet.com.sg.8333: tcp 0
04:42:26.278762 IP tom-Latitude-3570.60988 > 81.198.101.144.8333: tcp 24
04:42:26.280198 IP tom-Latitude-3570.60988 > 81.198.101.144.8333: tcp 361
04:42:26.308956 IP 81.198.101.144.8333 > tom-Latitude-3570.60988: tcp 0
04:42:26.309617 IP 81.198.101.144.8333 > tom-Latitude-3570.60988: tcp 0
04:42:26.672380 IP 5.171.188.189.8333 > tom-Latitude-3570.48542: tcp 0
04:42:26.672393 IP ns3113832.ip-54-38-177.eu.8333 > tom-Latitude-3570.56714: tcp 24
04:42:26.672409 IP ns3113832.ip-54-38-177.eu.8333 > tom-Latitude-3570.56714: tcp 1081
04:42:26.672520 IP tom-Latitude-3570.56714 > ns3113832.ip-54-38-177.eu.8333: tcp 0
04:42:26.672815 IP tom-Latitude-3570.56714 > ns3113832.ip-54-38-177.eu.8333: tcp 24
04:42:26.673868 IP tom-Latitude-3570.56714 > ns3113832.ip-54-38-177.eu.8333: tcp 145
04:42:26.688393 IP vmi195435.contaboserver.net.8333 > tom-Latitude-3570.39110: tcp 24
04:42:26.688404 IP vmi195435.contaboserver.net.8333 > tom-Latitude-3570.39110: tcp 541
04:42:26.688421 IP tom-Latitude-3570.39110 > vmi195435.contaboserver.net.8333: tcp 0
04:42:26.707752 IP ns3113832.ip-54-38-177.eu.8333 > tom-Latitude-3570.56714: tcp 0
04:42:26.707758 IP ns3113832.ip-54-38-177.eu.8333 > tom-Latitude-3570.56714: tcp 0
04:42:26.772951 IP ns3113832.ip-54-38-177.eu.8333 > tom-Latitude-3570.56714: tcp 24
04:42:26.773989 IP ns3113832.ip-54-38-177.eu.8333 > tom-Latitude-3570.56714: tcp 225
04:42:26.773996 IP ns3113832.ip-54-38-177.eu.8333 > tom-Latitude-3570.56714: tcp 24
04:42:26.773998 IP ns3113832.ip-54-38-177.eu.8333 > tom-Latitude-3570.56714: tcp 225
04:42:26.774001 IP ns3113832.ip-54-38-177.eu.8333 > tom-Latitude-3570.56714: tcp 24
04:42:26.774003 IP ns3113832.ip-54-38-177.eu.8333 > tom-Latitude-3570.56714: tcp 224
04:42:26.774005 IP ns3113832.ip-54-38-177.eu.8333 > tom-Latitude-3570.56714: tcp 24
04:42:26.774007 IP ns3113832.ip-54-38-177.eu.8333 > tom-Latitude-3570.56714: tcp 420
04:42:26.774010 IP tom-Latitude-3570.56714 > ns3113832.ip-54-38-177.eu.8333: tcp 0
04:42:26.774061 IP tom-Latitude-3570.56714 > ns3113832.ip-54-38-177.eu.8333: tcp 0
04:42:26.976131 IP tom-Latitude-3570.60470 > bb42-60-217-183.singnet.com.sg.8333: tcp 24
04:42:26.978179 IP tom-Latitude-3570.60470 > bb42-60-217-183.singnet.com.sg.8333: tcp 145
04:42:27.011343 IP bb42-60-217-183.singnet.com.sg.8333 > tom-Latitude-3570.60470: tcp 0
04:42:27.018789 IP bb42-60-217-183.singnet.com.sg.8333 > tom-Latitude-3570.60470: tcp 0
04:42:27.076515 IP tom-Latitude-3570.60988 > 81.198.101.144.8333: tcp 24
04:42:27.076693 IP tom-Latitude-3570.42516 > 2.56.9.15.8333: tcp 24
04:42:27.076700 IP tom-Latitude-3570.42516 > 2.56.9.15.8333: tcp 1081
04:42:27.079425 IP tom-Latitude-3570.60988 > 81.198.101.144.8333: tcp 181
04:42:27.110941 IP 81.198.101.144.8333 > tom-Latitude-3570.60988: tcp 0
04:42:27.118891 IP 2.56.9.15.8333 > tom-Latitude-3570.42516: tcp 0
04:42:27.119571 IP 2.56.9.15.8333 > tom-Latitude-3570.42516: tcp 0
04:42:27.119585 IP 81.198.101.144.8333 > tom-Latitude-3570.60988: tcp 0
04:42:27.377514 IP tom-Latitude-3570.49070 > c-185-45-236-223.customer.ggaweb.ch.8333: tcp 24
04:42:27.379602 IP tom-Latitude-3570.49070 > c-185-45-236-223.customer.ggaweb.ch.8333: tcp 181
04:42:27.446858 IP c-185-45-236-223.customer.ggaweb.ch.8333 > tom-Latitude-3570.49070: tcp 0
04:42:27.578317 IP tom-Latitude-3570.46284 > static-87-75-105-186.vodafonexdsl.co.uk.8333: tcp 24
04:42:27.580532 IP tom-Latitude-3570.46284 > static-87-75-105-186.vodafonexdsl.co.uk.8333: tcp 181
04:42:27.610621 IP static-87-75-105-186.vodafonexdsl.co.uk.8333 > tom-Latitude-3570.46284: tcp 0
04:42:27.618632 IP static-87-75-105-186.vodafonexdsl.co.uk.8333 > tom-Latitude-3570.46284: tcp 0
04:42:27.879390 IP tom-Latitude-3570.57976 > 167.99.216.145.8333: tcp 24
04:42:27.881479 IP tom-Latitude-3570.57976 > 167.99.216.145.8333: tcp 181
04:42:27.882014 IP c-185-45-236-223.customer.ggaweb.ch.8333 > tom-Latitude-3570.49070: tcp 24
04:42:27.882035 IP c-185-45-236-223.customer.ggaweb.ch.8333 > tom-Latitude-3570.49070: tcp 181
04:42:27.882124 IP tom-Latitude-3570.49070 > c-185-45-236-223.customer.ggaweb.ch.8333: tcp 0
04:42:27.882311 IP tom-Latitude-3570.49070 > c-185-45-236-223.customer.ggaweb.ch.8333: tcp 24
04:42:27.884539 IP tom-Latitude-3570.49070 > c-185-45-236-223.customer.ggaweb.ch.8333: tcp 181
04:42:27.919009 IP 167.99.216.145.8333 > tom-Latitude-3570.57976: tcp 0
04:42:27.919024 IP 167.99.216.145.8333 > tom-Latitude-3570.57976: tcp 0
04:42:27.919026 IP c-185-45-236-223.customer.ggaweb.ch.8333 > tom-Latitude-3570.49070: tcp 0
04:42:28.041384 IP c-185-45-236-223.customer.ggaweb.ch.8333 > tom-Latitude-3570.49070: tcp 24
04:42:28.041407 IP c-185-45-236-223.customer.ggaweb.ch.8333 > tom-Latitude-3570.49070: tcp 1448
04:42:28.041409 IP c-185-45-236-223.customer.ggaweb.ch.8333 > tom-Latitude-3570.49070: tcp 69
04:42:28.041495 IP tom-Latitude-3570.49070 > c-185-45-236-223.customer.ggaweb.ch.8333: tcp 0
04:42:28.042396 IP c-185-45-236-223.customer.ggaweb.ch.8333 > tom-Latitude-3570.49070: tcp 519
04:42:28.083907 IP tom-Latitude-3570.49070 > c-185-45-236-223.customer.ggaweb.ch.8333: tcp 0
04:42:28.547752 IP tom-Latitude-3570.42516 > 2.56.9.15.8333: tcp 24
04:42:28.549864 IP tom-Latitude-3570.42516 > 2.56.9.15.8333: tcp 181
04:42:28.599487 IP 2.56.9.15.8333 > tom-Latitude-3570.42516: tcp 0
04:42:28.608302 IP 2.56.9.15.8333 > tom-Latitude-3570.42516: tcp 0
04:42:29.350131 IP tom-Latitude-3570.57976 > 167.99.216.145.8333: tcp 24
04:42:29.352448 IP tom-Latitude-3570.57976 > 167.99.216.145.8333: tcp 181
04:42:29.399645 IP 167.99.216.145.8333 > tom-Latitude-3570.57976: tcp 0
04:42:29.408696 IP 167.99.216.145.8333 > tom-Latitude-3570.57976: tcp 0
04:42:29.550954 IP tom-Latitude-3570.56714 > ns3113832.ip-54-38-177.eu.8333: tcp 24
04:42:29.552978 IP tom-Latitude-3570.56714 > ns3113832.ip-54-38-177.eu.8333: tcp 181
04:42:29.553794 IP bb42-60-217-183.singnet.com.sg.8333 > tom-Latitude-3570.60470: tcp 24
04:42:29.553814 IP bb42-60-217-183.singnet.com.sg.8333 > tom-Latitude-3570.60470: tcp 31
04:42:29.553905 IP tom-Latitude-3570.60470 > bb42-60-217-183.singnet.com.sg.8333: tcp 0
04:42:29.587545 IP ns3113832.ip-54-38-177.eu.8333 > tom-Latitude-3570.56714: tcp 0
04:42:29.588111 IP ns3113832.ip-54-38-177.eu.8333 > tom-Latitude-3570.56714: tcp 0
04:42:29.664364 IP ns3113832.ip-54-38-177.eu.8333 > tom-Latitude-3570.56714: tcp 24
04:42:29.664987 IP ns3113832.ip-54-38-177.eu.8333 > tom-Latitude-3570.56714: tcp 109
04:42:29.665098 IP tom-Latitude-3570.56714 > ns3113832.ip-54-38-177.eu.8333: tcp 0
04:42:29.665237 IP tom-Latitude-3570.56714 > ns3113832.ip-54-38-177.eu.8333: tcp 24
04:42:29.666747 IP tom-Latitude-3570.56714 > ns3113832.ip-54-38-177.eu.8333: tcp 109
04:42:29.699365 IP ns3113832.ip-54-38-177.eu.8333 > tom-Latitude-3570.56714: tcp 0
04:42:29.699947 IP ns3113832.ip-54-38-177.eu.8333 > tom-Latitude-3570.56714: tcp 0
04:42:29.758752 IP ns3113832.ip-54-38-177.eu.8333 > tom-Latitude-3570.56714: tcp 24
04:42:29.758772 IP ns3113832.ip-54-38-177.eu.8333 > tom-Latitude-3570.56714: tcp 225
04:42:29.758777 IP ns3113832.ip-54-38-177.eu.8333 > tom-Latitude-3570.56714: tcp 24
04:42:29.758779 IP ns3113832.ip-54-38-177.eu.8333 > tom-Latitude-3570.56714: tcp 225
04:42:29.758781 IP ns3113832.ip-54-38-177.eu.8333 > tom-Latitude-3570.56714: tcp 24
04:42:29.758783 IP ns3113832.ip-54-38-177.eu.8333 > tom-Latitude-3570.56714: tcp 249
04:42:29.758868 IP tom-Latitude-3570.56714 > ns3113832.ip-54-38-177.eu.8333: tcp 0
04:42:30.361621 IP tom-Latitude-3570.39110 > vmi195435.contaboserver.net.8333: tcp 24
04:42:30.361692 IP tom-Latitude-3570.60988 > 81.198.101.144.8333: tcp 24
04:42:30.364126 IP tom-Latitude-3570.39110 > vmi195435.contaboserver.net.8333: tcp 289
04:42:30.364981 IP tom-Latitude-3570.60988 > 81.198.101.144.8333: tcp 289
04:42:30.367866 IP vmi195435.contaboserver.net.8333 > tom-Latitude-3570.39110: tcp 24
04:42:30.367886 IP vmi195435.contaboserver.net.8333 > tom-Latitude-3570.39110: tcp 469
04:42:30.367890 IP ns3113832.ip-54-38-177.eu.8333 > tom-Latitude-3570.56714: tcp 24
04:42:30.367893 IP ns3113832.ip-54-38-177.eu.8333 > tom-Latitude-3570.56714: tcp 73
04:42:30.367973 IP tom-Latitude-3570.39110 > vmi195435.contaboserver.net.8333: tcp 0
04:42:30.368010 IP tom-Latitude-3570.56714 > ns3113832.ip-54-38-177.eu.8333: tcp 0
04:42:30.368198 IP tom-Latitude-3570.39110 > vmi195435.contaboserver.net.8333: tcp 24
04:42:30.368212 IP tom-Latitude-3570.39110 > vmi195435.contaboserver.net.8333: tcp 181
04:42:30.398779 IP 81.198.101.144.8333 > tom-Latitude-3570.60988: tcp 0
04:42:30.399397 IP vmi195435.contaboserver.net.8333 > tom-Latitude-3570.39110: tcp 0
04:42:30.399412 IP 81.198.101.144.8333 > tom-Latitude-3570.60988: tcp 0
04:42:30.406671 IP vmi195435.contaboserver.net.8333 > tom-Latitude-3570.39110: tcp 0
04:42:30.486558 IP vmi195435.contaboserver.net.8333 > tom-Latitude-3570.39110: tcp 24
04:42:30.487265 IP vmi195435.contaboserver.net.8333 > tom-Latitude-3570.39110: tcp 223
04:42:30.487274 IP vmi195435.contaboserver.net.8333 > tom-Latitude-3570.39110: tcp 24
04:42:30.487276 IP vmi195435.contaboserver.net.8333 > tom-Latitude-3570.39110: tcp 224
04:42:30.487282 IP vmi195435.contaboserver.net.8333 > tom-Latitude-3570.39110: tcp 24
04:42:30.487285 IP vmi195435.contaboserver.net.8333 > tom-Latitude-3570.39110: tcp 373
04:42:30.487306 IP vmi195435.contaboserver.net.8333 > tom-Latitude-3570.39110: tcp 24
04:42:30.487311 IP vmi195435.contaboserver.net.8333 > tom-Latitude-3570.39110: tcp 247
04:42:30.487314 IP vmi195435.contaboserver.net.8333 > tom-Latitude-3570.39110: tcp 24
04:42:30.487319 IP vmi195435.contaboserver.net.8333 > tom-Latitude-3570.39110: tcp 249
04:42:30.487335 IP tom-Latitude-3570.39110 > vmi195435.contaboserver.net.8333: tcp 0
04:42:30.591463 IP tom-Latitude-3570.49070 > c-185-45-236-223.customer.ggaweb.ch.8333: tcp 24
04:42:30.604281 IP tom-Latitude-3570.49070 > c-185-45-236-223.customer.ggaweb.ch.8333: tcp 289
04:42:30.640968 IP c-185-45-236-223.customer.ggaweb.ch.8333 > tom-Latitude-3570.49070: tcp 0
04:42:30.677585 IP c-185-45-236-223.customer.ggaweb.ch.8333 > tom-Latitude-3570.49070: tcp 24
04:42:30.677602 IP tom-Latitude-3570.49070 > c-185-45-236-223.customer.ggaweb.ch.8333: tcp 0
04:42:30.677621 IP c-185-45-236-223.customer.ggaweb.ch.8333 > tom-Latitude-3570.49070: tcp 289
04:42:30.677625 IP tom-Latitude-3570.49070 > c-185-45-236-223.customer.ggaweb.ch.8333: tcp 0
04:42:31.178111 IP 81.198.101.144.8333 > tom-Latitude-3570.60988: tcp 24
04:42:31.178131 IP 81.198.101.144.8333 > tom-Latitude-3570.60988: tcp 109
04:42:31.178136 IP 81.198.101.144.8333 > tom-Latitude-3570.60988: tcp 109
04:42:31.178164 IP tom-Latitude-3570.60988 > 81.198.101.144.8333: tcp 0
04:42:31.178181 IP bb42-60-217-183.singnet.com.sg.8333 > tom-Latitude-3570.60470: tcp 24
04:42:31.178185 IP bb42-60-217-183.singnet.com.sg.8333 > tom-Latitude-3570.60470: tcp 469
04:42:31.178188 IP vmi195435.contaboserver.net.8333 > tom-Latitude-3570.39110: tcp 24
04:42:31.178191 IP vmi195435.contaboserver.net.8333 > tom-Latitude-3570.39110: tcp 37
04:42:31.178261 IP tom-Latitude-3570.39110 > vmi195435.contaboserver.net.8333: tcp 0
04:42:31.178281 IP tom-Latitude-3570.60470 > bb42-60-217-183.singnet.com.sg.8333: tcp 0
04:42:31.178467 IP tom-Latitude-3570.39110 > vmi195435.contaboserver.net.8333: tcp 24
04:42:31.181177 IP tom-Latitude-3570.39110 > vmi195435.contaboserver.net.8333: tcp 37
04:42:31.218562 IP vmi195435.contaboserver.net.8333 > tom-Latitude-3570.39110: tcp 0
04:42:31.296684 IP vmi195435.contaboserver.net.8333 > tom-Latitude-3570.39110: tcp 24
04:42:31.297295 IP vmi195435.contaboserver.net.8333 > tom-Latitude-3570.39110: tcp 484
04:42:31.297402 IP tom-Latitude-3570.39110 > vmi195435.contaboserver.net.8333: tcp 0
04:42:31.997259 IP 167.99.216.145.8333 > tom-Latitude-3570.57976: tcp 24
04:42:31.997280 IP 167.99.216.145.8333 > tom-Latitude-3570.57976: tcp 361
04:42:31.997284 IP 167.99.216.145.8333 > tom-Latitude-3570.57976: tcp 361
04:42:31.997313 IP tom-Latitude-3570.57976 > 167.99.216.145.8333: tcp 0
