08:01:19.346143 IP tom-Latitude-3570.46284 > static-87-75-105-186.vodafonexdsl.co.uk.8333: tcp 24
08:01:19.347877 IP tom-Latitude-3570.46284 > static-87-75-105-186.vodafonexdsl.co.uk.8333: tcp 109
08:01:19.348415 IP 2.56.9.15.8333 > tom-Latitude-3570.42516: tcp 24
08:01:19.348445 IP tom-Latitude-3570.42516 > 2.56.9.15.8333: tcp 0
08:01:19.348476 IP 2.56.9.15.8333 > tom-Latitude-3570.42516: tcp 181
08:01:19.348481 IP tom-Latitude-3570.42516 > 2.56.9.15.8333: tcp 0
08:01:19.394690 IP static-87-75-105-186.vodafonexdsl.co.uk.8333 > tom-Latitude-3570.46284: tcp 0
08:01:19.395270 IP static-87-75-105-186.vodafonexdsl.co.uk.8333 > tom-Latitude-3570.46284: tcp 0
08:01:19.449177 IP tom-Latitude-3570.60470 > bb42-60-217-183.singnet.com.sg.8333: tcp 24
08:01:19.450122 IP tom-Latitude-3570.60470 > bb42-60-217-183.singnet.com.sg.8333: tcp 433
08:01:19.486728 IP bb42-60-217-183.singnet.com.sg.8333 > tom-Latitude-3570.60470: tcp 0
08:01:19.493345 IP bb42-60-217-183.singnet.com.sg.8333 > tom-Latitude-3570.60470: tcp 0
08:01:19.649989 IP tom-Latitude-3570.60988 > 81.198.101.144.8333: tcp 24
08:01:19.652250 IP tom-Latitude-3570.60988 > 81.198.101.144.8333: tcp 253
08:01:19.684535 IP 81.198.101.144.8333 > tom-Latitude-3570.60988: tcp 0
08:01:19.692490 IP 81.198.101.144.8333 > tom-Latitude-3570.60988: tcp 0
08:01:19.758778 IP vmi195435.contaboserver.net.8333 > tom-Latitude-3570.39110: tcp 24
08:01:19.759349 IP vmi195435.contaboserver.net.8333 > tom-Latitude-3570.39110: tcp 37
08:01:19.759474 IP tom-Latitude-3570.39110 > vmi195435.contaboserver.net.8333: tcp 0
08:01:19.759650 IP tom-Latitude-3570.39110 > vmi195435.contaboserver.net.8333: tcp 24
08:01:19.761143 IP tom-Latitude-3570.39110 > vmi195435.contaboserver.net.8333: tcp 37
08:01:19.794843 IP vmi195435.contaboserver.net.8333 > tom-Latitude-3570.39110: tcp 0
08:01:19.795310 IP vmi195435.contaboserver.net.8333 > tom-Latitude-3570.39110: tcp 0
08:01:19.872659 IP vmi195435.contaboserver.net.8333 > tom-Latitude-3570.39110: tcp 24
08:01:19.873241 IP vmi195435.contaboserver.net.8333 > tom-Latitude-3570.39110: tcp 226
08:01:19.873365 IP tom-Latitude-3570.39110 > vmi195435.contaboserver.net.8333: tcp 0
08:01:20.174770 IP tom-Latitude-3570.60470 > bb42-60-217-183.singnet.com.sg.8333: tcp 24
08:01:20.208465 IP tom-Latitude-3570.60470 > bb42-60-217-183.singnet.com.sg.8333: tcp 37
08:01:20.210349 IP static-87-75-105-186.vodafonexdsl.co.uk.8333 > tom-Latitude-3570.46284: tcp 24
08:01:20.210368 IP static-87-75-105-186.vodafonexdsl.co.uk.8333 > tom-Latitude-3570.46284: tcp 8
08:01:20.210371 IP static-87-75-105-186.vodafonexdsl.co.uk.8333 > tom-Latitude-3570.46284: tcp 8
08:01:20.210398 IP tom-Latitude-3570.46284 > static-87-75-105-186.vodafonexdsl.co.uk.8333: tcp 0
08:01:20.210586 IP tom-Latitude-3570.46284 > static-87-75-105-186.vodafonexdsl.co.uk.8333: tcp 24
08:01:20.215341 IP tom-Latitude-3570.46284 > static-87-75-105-186.vodafonexdsl.co.uk.8333: tcp 8
08:01:20.243118 IP bb42-60-217-183.singnet.com.sg.8333 > tom-Latitude-3570.60470: tcp 0
08:01:20.243132 IP bb42-60-217-183.singnet.com.sg.8333 > tom-Latitude-3570.60470: tcp 0
08:01:20.246604 IP static-87-75-105-186.vodafonexdsl.co.uk.8333 > tom-Latitude-3570.46284: tcp 0
08:01:20.247246 IP static-87-75-105-186.vodafonexdsl.co.uk.8333 > tom-Latitude-3570.46284: tcp 0
08:01:20.294776 IP bb42-60-217-183.singnet.com.sg.8333 > tom-Latitude-3570.60470: tcp 24
08:01:20.295260 IP bb42-60-217-183.singnet.com.sg.8333 > tom-Latitude-3570.60470: tcp 73
08:01:20.295356 IP tom-Latitude-3570.60470 > bb42-60-217-183.singnet.com.sg.8333: tcp 0
08:01:20.295528 IP tom-Latitude-3570.60470 > bb42-60-217-183.singnet.com.sg.8333: tcp 24
08:01:20.296877 IP tom-Latitude-3570.60470 > bb42-60-217-183.singnet.com.sg.8333: tcp 37
08:01:20.330448 IP bb42-60-217-183.singnet.com.sg.8333 > tom-Latitude-3570.60470: tcp 0
08:01:20.331067 IP bb42-60-217-183.singnet.com.sg.8333 > tom-Latitude-3570.60470: tcp 0
08:01:20.372564 IP static-87-75-105-186.vodafonexdsl.co.uk.8333 > tom-Latitude-3570.46284: tcp 24
08:01:20.388592 IP static-87-75-105-186.vodafonexdsl.co.uk.8333 > tom-Latitude-3570.46284: tcp 145
08:01:20.388723 IP tom-Latitude-3570.46284 > static-87-75-105-186.vodafonexdsl.co.uk.8333: tcp 0
08:01:20.388930 IP tom-Latitude-3570.46284 > static-87-75-105-186.vodafonexdsl.co.uk.8333: tcp 24
08:01:20.390490 IP tom-Latitude-3570.46284 > static-87-75-105-186.vodafonexdsl.co.uk.8333: tcp 73
08:01:20.426115 IP static-87-75-105-186.vodafonexdsl.co.uk.8333 > tom-Latitude-3570.46284: tcp 0
08:01:20.427910 IP static-87-75-105-186.vodafonexdsl.co.uk.8333 > tom-Latitude-3570.46284: tcp 0
08:01:20.492822 IP static-87-75-105-186.vodafonexdsl.co.uk.8333 > tom-Latitude-3570.46284: tcp 24
08:01:20.493610 IP static-87-75-105-186.vodafonexdsl.co.uk.8333 > tom-Latitude-3570.46284: tcp 256
08:01:20.493633 IP static-87-75-105-186.vodafonexdsl.co.uk.8333 > tom-Latitude-3570.46284: tcp 24
08:01:20.493637 IP static-87-75-105-186.vodafonexdsl.co.uk.8333 > tom-Latitude-3570.46284: tcp 247
08:01:20.493722 IP tom-Latitude-3570.46284 > static-87-75-105-186.vodafonexdsl.co.uk.8333: tcp 0
08:01:20.594527 IP tom-Latitude-3570.39110 > vmi195435.contaboserver.net.8333: tcp 24
08:01:20.595465 IP tom-Latitude-3570.39110 > vmi195435.contaboserver.net.8333: tcp 73
08:01:20.627282 IP vmi195435.contaboserver.net.8333 > tom-Latitude-3570.39110: tcp 0
08:01:20.636355 IP vmi195435.contaboserver.net.8333 > tom-Latitude-3570.39110: tcp 0
08:01:20.692386 IP bb42-60-217-183.singnet.com.sg.8333 > tom-Latitude-3570.60470: tcp 24
08:01:20.694944 IP tom-Latitude-3570.60470 > bb42-60-217-183.singnet.com.sg.8333: tcp 24
08:01:20.695885 IP tom-Latitude-3570.60470 > bb42-60-217-183.singnet.com.sg.8333: tcp 73
08:01:20.700213 IP bb42-60-217-183.singnet.com.sg.8333 > tom-Latitude-3570.60470: tcp 225
08:01:20.727220 IP bb42-60-217-183.singnet.com.sg.8333 > tom-Latitude-3570.60470: tcp 0
08:01:20.735156 IP bb42-60-217-183.singnet.com.sg.8333 > tom-Latitude-3570.60470: tcp 0
08:01:20.743785 IP tom-Latitude-3570.60470 > bb42-60-217-183.singnet.com.sg.8333: tcp 0
08:01:20.901380 IP tom-Latitude-3570.60988 > 81.198.101.144.8333: tcp 24
08:01:20.903860 IP tom-Latitude-3570.60988 > 81.198.101.144.8333: tcp 145
08:01:20.937261 IP 81.198.101.144.8333 > tom-Latitude-3570.60988: tcp 0
08:01:20.945781 IP 81.198.101.144.8333 > tom-Latitude-3570.60988: tcp 0
08:01:21.193277 IP vmi195435.contaboserver.net.8333 > tom-Latitude-3570.39110: tcp 24
08:01:21.193298 IP vmi195435.contaboserver.net.8333 > tom-Latitude-3570.39110: tcp 145
08:01:21.193385 IP tom-Latitude-3570.39110 > vmi195435.contaboserver.net.8333: tcp 0
08:01:21.193577 IP tom-Latitude-3570.39110 > vmi195435.contaboserver.net.8333: tcp 24
08:01:21.193665 IP tom-Latitude-3570.56714 > ns3113832.ip-54-38-177.eu.8333: tcp 24
08:01:21.194866 IP tom-Latitude-3570.39110 > vmi195435.contaboserver.net.8333: tcp 109
08:01:21.196607 IP tom-Latitude-3570.56714 > ns3113832.ip-54-38-177.eu.8333: tcp 145
08:01:21.216206 IP vmi195435.contaboserver.net.8333 > tom-Latitude-3570.39110: tcp 145
08:01:21.216225 IP tom-Latitude-3570.39110 > vmi195435.contaboserver.net.8333: tcp 0
08:01:21.228366 IP vmi195435.contaboserver.net.8333 > tom-Latitude-3570.39110: tcp 0
08:01:21.237130 IP ns3113832.ip-54-38-177.eu.8333 > tom-Latitude-3570.56714: tcp 0
08:01:21.237141 IP vmi195435.contaboserver.net.8333 > tom-Latitude-3570.39110: tcp 0
08:01:21.237989 IP ns3113832.ip-54-38-177.eu.8333 > tom-Latitude-3570.56714: tcp 0
08:01:21.313232 IP vmi195435.contaboserver.net.8333 > tom-Latitude-3570.39110: tcp 24
08:01:21.313240 IP tom-Latitude-3570.39110 > vmi195435.contaboserver.net.8333: tcp 0
08:01:21.314128 IP vmi195435.contaboserver.net.8333 > tom-Latitude-3570.39110: tcp 475
08:01:21.314153 IP tom-Latitude-3570.39110 > vmi195435.contaboserver.net.8333: tcp 0
08:01:21.314183 IP vmi195435.contaboserver.net.8333 > tom-Latitude-3570.39110: tcp 24
08:01:21.314186 IP tom-Latitude-3570.39110 > vmi195435.contaboserver.net.8333: tcp 0
08:01:21.314191 IP vmi195435.contaboserver.net.8333 > tom-Latitude-3570.39110: tcp 406
08:01:21.314194 IP tom-Latitude-3570.39110 > vmi195435.contaboserver.net.8333: tcp 0
08:01:21.314198 IP vmi195435.contaboserver.net.8333 > tom-Latitude-3570.39110: tcp 24
08:01:21.314199 IP tom-Latitude-3570.39110 > vmi195435.contaboserver.net.8333: tcp 0
08:01:21.314204 IP vmi195435.contaboserver.net.8333 > tom-Latitude-3570.39110: tcp 518
08:01:21.314208 IP tom-Latitude-3570.39110 > vmi195435.contaboserver.net.8333: tcp 0
08:01:21.616905 IP tom-Latitude-3570.57976 > 167.99.216.145.8333: tcp 24
08:01:21.616960 IP tom-Latitude-3570.46284 > static-87-75-105-186.vodafonexdsl.co.uk.8333: tcp 24
08:01:21.618961 IP tom-Latitude-3570.57976 > 167.99.216.145.8333: tcp 253
08:01:21.619872 IP tom-Latitude-3570.46284 > static-87-75-105-186.vodafonexdsl.co.uk.8333: tcp 109
08:01:21.635200 IP 167.99.216.145.8333 > tom-Latitude-3570.57976: tcp 0
08:01:21.635864 IP static-87-75-105-186.vodafonexdsl.co.uk.8333 > tom-Latitude-3570.46284: tcp 0
08:01:21.647052 IP 167.99.216.145.8333 > tom-Latitude-3570.57976: tcp 0
08:01:21.652162 IP static-87-75-105-186.vodafonexdsl.co.uk.8333 > tom-Latitude-3570.46284: tcp 0
08:01:21.807691 IP 2.56.9.15.8333 > tom-Latitude-3570.42516: tcp 24
08:01:21.807708 IP tom-Latitude-3570.42516 > 2.56.9.15.8333: tcp 0
08:01:21.807725 IP 2.56.9.15.8333 > tom-Latitude-3570.42516: tcp 325
08:01:21.807730 IP tom-Latitude-3570.42516 > 2.56.9.15.8333: tcp 0
08:01:21.808048 IP tom-Latitude-3570.42516 > 2.56.9.15.8333: tcp 24
08:01:21.809783 IP tom-Latitude-3570.42516 > 2.56.9.15.8333: tcp 73
08:01:21.839224 IP vmi195435.contaboserver.net.8333 > tom-Latitude-3570.39110: tcp 24
08:01:21.839247 IP tom-Latitude-3570.39110 > vmi195435.contaboserver.net.8333: tcp 0
08:01:21.839830 IP vmi195435.contaboserver.net.8333 > tom-Latitude-3570.39110: tcp 73
08:01:21.839847 IP tom-Latitude-3570.39110 > vmi195435.contaboserver.net.8333: tcp 0
08:01:21.845139 IP 2.56.9.15.8333 > tom-Latitude-3570.42516: tcp 0
08:01:21.943743 IP 2.56.9.15.8333 > tom-Latitude-3570.42516: tcp 24
08:01:21.945781 IP 2.56.9.15.8333 > tom-Latitude-3570.42516: tcp 365
08:01:21.945799 IP 2.56.9.15.8333 > tom-Latitude-3570.42516: tcp 24
08:01:21.945802 IP 2.56.9.15.8333 > tom-Latitude-3570.42516: tcp 192
08:01:21.945891 IP tom-Latitude-3570.42516 > 2.56.9.15.8333: tcp 0
08:01:22.147321 IP tom-Latitude-3570.57976 > 167.99.216.145.8333: tcp 24
08:01:22.149369 IP tom-Latitude-3570.57976 > 167.99.216.145.8333: tcp 73
08:01:22.178577 IP 167.99.216.145.8333 > tom-Latitude-3570.57976: tcp 0
08:01:22.186178 IP 167.99.216.145.8333 > tom-Latitude-3570.57976: tcp 0
08:01:22.282520 IP c-185-45-236-223.customer.ggaweb.ch.8333 > tom-Latitude-3570.49070: tcp 24
08:01:22.283167 IP c-185-45-236-223.customer.ggaweb.ch.8333 > tom-Latitude-3570.49070: tcp 649
08:01:22.283296 IP tom-Latitude-3570.49070 > c-185-45-236-223.customer.ggaweb.ch.8333: tcp 0
08:01:22.283567 IP tom-Latitude-3570.49070 > c-185-45-236-223.customer.ggaweb.ch.8333: tcp 24
08:01:22.285668 IP tom-Latitude-3570.49070 > c-185-45-236-223.customer.ggaweb.ch.8333: tcp 73
08:01:22.317124 IP c-185-45-236-223.customer.ggaweb.ch.8333 > tom-Latitude-3570.49070: tcp 0
08:01:22.317138 IP c-185-45-236-223.customer.ggaweb.ch.8333 > tom-Latitude-3570.49070: tcp 0
08:01:22.398365 IP c-185-45-236-223.customer.ggaweb.ch.8333 > tom-Latitude-3570.49070: tcp 24
08:01:22.401462 IP c-185-45-236-223.customer.ggaweb.ch.8333 > tom-Latitude-3570.49070: tcp 1382
08:01:22.401589 IP tom-Latitude-3570.49070 > c-185-45-236-223.customer.ggaweb.ch.8333: tcp 0
08:01:22.402366 IP c-185-45-236-223.customer.ggaweb.ch.8333 > tom-Latitude-3570.49070: tcp 66
08:01:22.402386 IP c-185-45-236-223.customer.ggaweb.ch.8333 > tom-Latitude-3570.49070: tcp 172
08:01:22.402390 IP c-185-45-236-223.customer.ggaweb.ch.8333 > tom-Latitude-3570.49070: tcp 273
08:01:22.402476 IP tom-Latitude-3570.49070 > c-185-45-236-223.customer.ggaweb.ch.8333: tcp 0
08:01:22.424333 IP static-87-75-105-186.vodafonexdsl.co.uk.8333 > tom-Latitude-3570.46284: tcp 24
08:01:22.424897 IP static-87-75-105-186.vodafonexdsl.co.uk.8333 > tom-Latitude-3570.46284: tcp 73
08:01:22.425025 IP tom-Latitude-3570.46284 > static-87-75-105-186.vodafonexdsl.co.uk.8333: tcp 0
08:01:22.726223 IP tom-Latitude-3570.46284 > static-87-75-105-186.vodafonexdsl.co.uk.8333: tcp 24
08:01:22.775327 IP tom-Latitude-3570.46284 > static-87-75-105-186.vodafonexdsl.co.uk.8333: tcp 73
08:01:22.829204 IP static-87-75-105-186.vodafonexdsl.co.uk.8333 > tom-Latitude-3570.46284: tcp 0
08:01:22.835794 IP static-87-75-105-186.vodafonexdsl.co.uk.8333 > tom-Latitude-3570.46284: tcp 0
08:01:23.027287 IP tom-Latitude-3570.56714 > ns3113832.ip-54-38-177.eu.8333: tcp 24
08:01:23.030139 IP tom-Latitude-3570.56714 > ns3113832.ip-54-38-177.eu.8333: tcp 253
08:01:23.051336 IP ns3113832.ip-54-38-177.eu.8333 > tom-Latitude-3570.56714: tcp 0
08:01:23.059246 IP ns3113832.ip-54-38-177.eu.8333 > tom-Latitude-3570.56714: tcp 0
08:01:23.077727 IP 81.198.101.144.8333 > tom-Latitude-3570.60988: tcp 24
08:01:23.077749 IP 81.198.101.144.8333 > tom-Latitude-3570.60988: tcp 181
08:01:23.077840 IP tom-Latitude-3570.60988 > 81.198.101.144.8333: tcp 0
08:01:23.446094 IP 2.56.9.15.8333 > tom-Latitude-3570.42516: tcp 24
08:01:23.446114 IP 2.56.9.15.8333 > tom-Latitude-3570.42516: tcp 109
08:01:23.446208 IP tom-Latitude-3570.42516 > 2.56.9.15.8333: tcp 0
08:01:23.446408 IP tom-Latitude-3570.42516 > 2.56.9.15.8333: tcp 24
08:01:23.449065 IP tom-Latitude-3570.42516 > 2.56.9.15.8333: tcp 37
08:01:23.495402 IP 2.56.9.15.8333 > tom-Latitude-3570.42516: tcp 0
08:01:23.546813 IP tom-Latitude-3570.57976 > 167.99.216.145.8333: tcp 24
08:01:23.548887 IP tom-Latitude-3570.57976 > 167.99.216.145.8333: tcp 73
08:01:23.577334 IP 167.99.216.145.8333 > tom-Latitude-3570.57976: tcp 0
08:01:23.585347 IP 167.99.216.145.8333 > tom-Latitude-3570.57976: tcp 0
08:01:23.592521 IP 2.56.9.15.8333 > tom-Latitude-3570.42516: tcp 24
08:01:23.592542 IP 2.56.9.15.8333 > tom-Latitude-3570.42516: tcp 317
08:01:23.592634 IP tom-Latitude-3570.42516 > 2.56.9.15.8333: tcp 0
08:01:23.693348 IP tom-Latitude-3570.56714 > ns3113832.ip-54-38-177.eu.8333: tcp 24
08:01:23.695240 IP tom-Latitude-3570.56714 > ns3113832.ip-54-38-177.eu.8333: tcp 37
08:01:23.728680 IP ns3113832.ip-54-38-177.eu.8333 > tom-Latitude-3570.56714: tcp 0
08:01:23.735497 IP ns3113832.ip-54-38-177.eu.8333 > tom-Latitude-3570.56714: tcp 0
08:01:23.804571 IP 167.99.216.145.8333 > tom-Latitude-3570.57976: tcp 24
08:01:23.805261 IP 167.99.216.145.8333 > tom-Latitude-3570.57976: tcp 73
08:01:23.805391 IP tom-Latitude-3570.57976 > 167.99.216.145.8333: tcp 0
08:01:23.805568 IP tom-Latitude-3570.57976 > 167.99.216.145.8333: tcp 24
08:01:23.806867 IP tom-Latitude-3570.57976 > 167.99.216.145.8333: tcp 37
08:01:23.835513 IP 167.99.216.145.8333 > tom-Latitude-3570.57976: tcp 0
08:01:23.836149 IP 167.99.216.145.8333 > tom-Latitude-3570.57976: tcp 0
08:01:23.899916 IP 167.99.216.145.8333 > tom-Latitude-3570.57976: tcp 24
08:01:23.900958 IP 167.99.216.145.8333 > tom-Latitude-3570.57976: tcp 736
08:01:23.901089 IP tom-Latitude-3570.57976 > 167.99.216.145.8333: tcp 0
08:01:24.674925 IP ns3113832.ip-54-38-177.eu.8333 > tom-Latitude-3570.56714: tcp 24
08:01:24.674947 IP ns3113832.ip-54-38-177.eu.8333 > tom-Latitude-3570.56714: tcp 109
08:01:24.674952 IP ns3113832.ip-54-38-177.eu.8333 > tom-Latitude-3570.56714: tcp 109
08:01:24.674964 IP tom-Latitude-3570.56714 > ns3113832.ip-54-38-177.eu.8333: tcp 0
08:01:24.675212 IP tom-Latitude-3570.56714 > ns3113832.ip-54-38-177.eu.8333: tcp 24
08:01:24.675273 IP tom-Latitude-3570.46284 > static-87-75-105-186.vodafonexdsl.co.uk.8333: tcp 24
08:01:24.677416 IP tom-Latitude-3570.56714 > ns3113832.ip-54-38-177.eu.8333: tcp 73
08:01:24.678081 IP tom-Latitude-3570.46284 > static-87-75-105-186.vodafonexdsl.co.uk.8333: tcp 73
08:01:24.719019 IP ns3113832.ip-54-38-177.eu.8333 > tom-Latitude-3570.56714: tcp 0
08:01:24.719034 IP static-87-75-105-186.vodafonexdsl.co.uk.8333 > tom-Latitude-3570.46284: tcp 0
08:01:24.719037 IP ns3113832.ip-54-38-177.eu.8333 > tom-Latitude-3570.56714: tcp 0
08:01:24.719040 IP static-87-75-105-186.vodafonexdsl.co.uk.8333 > tom-Latitude-3570.46284: tcp 0
08:01:24.774764 IP ns3113832.ip-54-38-177.eu.8333 > tom-Latitude-3570.56714: tcp 24
08:01:24.774785 IP ns3113832.ip-54-38-177.eu.8333 > tom-Latitude-3570.56714: tcp 1350
08:01:24.774832 IP tom-Latitude-3570.56714 > ns3113832.ip-54-38-177.eu.8333: tcp 0
08:01:24.774842 IP ns3113832.ip-54-38-177.eu.8333 > tom-Latitude-3570.56714: tcp 1350
08:01:24.775626 IP tom-Latitude-3570.39110 > vmi195435.contaboserver.net.8333: tcp 24
08:01:24.776667 IP ns3113832.ip-54-38-177.eu.8333 > tom-Latitude-3570.56714: tcp 1350
08:01:24.776730 IP tom-Latitude-3570.56714 > ns3113832.ip-54-38-177.eu.8333: tcp 0
08:01:24.778321 IP ns3113832.ip-54-38-177.eu.8333 > tom-Latitude-3570.56714: tcp 1350
08:01:24.778341 IP ns3113832.ip-54-38-177.eu.8333 > tom-Latitude-3570.56714: tcp 264
08:01:24.778345 IP ns3113832.ip-54-38-177.eu.8333 > tom-Latitude-3570.56714: tcp 24
08:01:24.778348 IP ns3113832.ip-54-38-177.eu.8333 > tom-Latitude-3570.56714: tcp 257
08:01:24.778387 IP tom-Latitude-3570.56714 > ns3113832.ip-54-38-177.eu.8333: tcp 0
08:01:24.780168 IP tom-Latitude-3570.39110 > vmi195435.contaboserver.net.8333: tcp 145
08:01:24.804945 IP vmi195435.contaboserver.net.8333 > tom-Latitude-3570.39110: tcp 0
08:01:24.812907 IP vmi195435.contaboserver.net.8333 > tom-Latitude-3570.39110: tcp 0
08:01:24.824070 IP ns3113832.ip-54-38-177.eu.8333 > tom-Latitude-3570.56714: tcp 24
08:01:24.824716 IP ns3113832.ip-54-38-177.eu.8333 > tom-Latitude-3570.56714: tcp 73
08:01:24.824779 IP tom-Latitude-3570.56714 > ns3113832.ip-54-38-177.eu.8333: tcp 0
08:01:24.824975 IP tom-Latitude-3570.56714 > ns3113832.ip-54-38-177.eu.8333: tcp 24
08:01:24.826410 IP tom-Latitude-3570.56714 > ns3113832.ip-54-38-177.eu.8333: tcp 73
08:01:24.865473 IP ns3113832.ip-54-38-177.eu.8333 > tom-Latitude-3570.56714: tcp 0
08:01:24.866111 IP ns3113832.ip-54-38-177.eu.8333 > tom-Latitude-3570.56714: tcp 0
08:01:24.923746 IP ns3113832.ip-54-38-177.eu.8333 > tom-Latitude-3570.56714: tcp 24
08:01:24.923767 IP ns3113832.ip-54-38-177.eu.8333 > tom-Latitude-3570.56714: tcp 223
08:01:24.923772 IP ns3113832.ip-54-38-177.eu.8333 > tom-Latitude-3570.56714: tcp 24
08:01:24.923776 IP ns3113832.ip-54-38-177.eu.8333 > tom-Latitude-3570.56714: tcp 257
08:01:24.923812 IP tom-Latitude-3570.56714 > ns3113832.ip-54-38-177.eu.8333: tcp 0
08:01:24.923987 IP tom-Latitude-3570.49070 > c-185-45-236-223.customer.ggaweb.ch.8333: tcp 24
08:01:24.924503 IP tom-Latitude-3570.57976 > 167.99.216.145.8333: tcp 24
08:01:24.925462 IP tom-Latitude-3570.49070 > c-185-45-236-223.customer.ggaweb.ch.8333: tcp 145
08:01:24.926067 IP tom-Latitude-3570.57976 > 167.99.216.145.8333: tcp 109
08:01:24.955041 IP c-185-45-236-223.customer.ggaweb.ch.8333 > tom-Latitude-3570.49070: tcp 0
08:01:24.955817 IP 167.99.216.145.8333 > tom-Latitude-3570.57976: tcp 0
08:01:24.968066 IP c-185-45-236-223.customer.ggaweb.ch.8333 > tom-Latitude-3570.49070: tcp 0
08:01:24.968079 IP 167.99.216.145.8333 > tom-Latitude-3570.57976: tcp 0
08:01:25.025263 IP tom-Latitude-3570.60470 > bb42-60-217-183.singnet.com.sg.8333: tcp 24
08:01:25.026213 IP tom-Latitude-3570.60470 > bb42-60-217-183.singnet.com.sg.8333: tcp 469
08:01:25.046977 IP bb42-60-217-183.singnet.com.sg.8333 > tom-Latitude-3570.60470: tcp 0
08:01:25.055870 IP bb42-60-217-183.singnet.com.sg.8333 > tom-Latitude-3570.60470: tcp 0
08:01:25.326219 IP tom-Latitude-3570.60988 > 81.198.101.144.8333: tcp 24
08:01:25.329224 IP tom-Latitude-3570.60988 > 81.198.101.144.8333: tcp 289
08:01:25.356937 IP 81.198.101.144.8333 > tom-Latitude-3570.60988: tcp 0
08:01:25.364908 IP 81.198.101.144.8333 > tom-Latitude-3570.60988: tcp 0
08:01:25.827933 IP tom-Latitude-3570.39110 > vmi195435.contaboserver.net.8333: tcp 24
08:01:25.830692 IP tom-Latitude-3570.39110 > vmi195435.contaboserver.net.8333: tcp 8
08:01:25.876857 IP vmi195435.contaboserver.net.8333 > tom-Latitude-3570.39110: tcp 0
08:01:25.884866 IP vmi195435.contaboserver.net.8333 > tom-Latitude-3570.39110: tcp 0
08:01:25.928430 IP tom-Latitude-3570.42516 > 2.56.9.15.8333: tcp 24
08:01:25.929987 IP tom-Latitude-3570.42516 > 2.56.9.15.8333: tcp 181
08:01:25.962955 IP vmi195435.contaboserver.net.8333 > tom-Latitude-3570.39110: tcp 24
08:01:25.962973 IP tom-Latitude-3570.39110 > vmi195435.contaboserver.net.8333: tcp 0
08:01:25.963602 IP vmi195435.contaboserver.net.8333 > tom-Latitude-3570.39110: tcp 8
08:01:25.963619 IP tom-Latitude-3570.39110 > vmi195435.contaboserver.net.8333: tcp 0
08:01:25.966101 IP 2.56.9.15.8333 > tom-Latitude-3570.42516: tcp 0
08:01:26.015514 IP c-185-45-236-223.customer.ggaweb.ch.8333 > tom-Latitude-3570.49070: tcp 24
08:01:26.015533 IP c-185-45-236-223.customer.ggaweb.ch.8333 > tom-Latitude-3570.49070: tcp 8
08:01:26.015577 IP tom-Latitude-3570.49070 > c-185-45-236-223.customer.ggaweb.ch.8333: tcp 0
08:01:26.015715 IP tom-Latitude-3570.49070 > c-185-45-236-223.customer.ggaweb.ch.8333: tcp 24
08:01:26.017150 IP tom-Latitude-3570.49070 > c-185-45-236-223.customer.ggaweb.ch.8333: tcp 8
08:01:26.044956 IP c-185-45-236-223.customer.ggaweb.ch.8333 > tom-Latitude-3570.49070: tcp 0
08:01:26.050305 IP c-185-45-236-223.customer.ggaweb.ch.8333 > tom-Latitude-3570.49070: tcp 0
08:01:26.216527 IP tom-Latitude-3570.39110 > vmi195435.contaboserver.net.8333: tcp 24
08:01:26.218847 IP tom-Latitude-3570.39110 > vmi195435.contaboserver.net.8333: tcp 145
08:01:26.247097 IP vmi195435.contaboserver.net.8333 > tom-Latitude-3570.39110: tcp 0
08:01:26.255009 IP vmi195435.contaboserver.net.8333 > tom-Latitude-3570.39110: tcp 0
08:01:26.818575 IP tom-Latitude-3570.57976 > 167.99.216.145.8333: tcp 24
08:01:26.820687 IP tom-Latitude-3570.57976 > 167.99.216.145.8333: tcp 37
08:01:26.874912 IP 167.99.216.145.8333 > tom-Latitude-3570.57976: tcp 0
08:01:26.883802 IP 167.99.216.145.8333 > tom-Latitude-3570.57976: tcp 0
08:01:27.219945 IP tom-Latitude-3570.46284 > static-87-75-105-186.vodafonexdsl.co.uk.8333: tcp 24
08:01:27.222819 IP tom-Latitude-3570.46284 > static-87-75-105-186.vodafonexdsl.co.uk.8333: tcp 145
08:01:27.267532 IP static-87-75-105-186.vodafonexdsl.co.uk.8333 > tom-Latitude-3570.46284: tcp 0
08:01:27.275542 IP static-87-75-105-186.vodafonexdsl.co.uk.8333 > tom-Latitude-3570.46284: tcp 0
08:01:27.542123 IP vmi195435.contaboserver.net.8333 > tom-Latitude-3570.39110: tcp 24
08:01:27.542148 IP tom-Latitude-3570.39110 > vmi195435.contaboserver.net.8333: tcp 0
08:01:27.542166 IP vmi195435.contaboserver.net.8333 > tom-Latitude-3570.39110: tcp 289
08:01:27.542170 IP tom-Latitude-3570.39110 > vmi195435.contaboserver.net.8333: tcp 0
08:01:27.542175 IP vmi195435.contaboserver.net.8333 > tom-Latitude-3570.39110: tcp 289
08:01:27.542178 IP tom-Latitude-3570.39110 > vmi195435.contaboserver.net.8333: tcp 0
08:01:27.542424 IP tom-Latitude-3570.39110 > vmi195435.contaboserver.net.8333: tcp 24
08:01:27.547037 IP tom-Latitude-3570.39110 > vmi195435.contaboserver.net.8333: tcp 289
08:01:27.586205 IP vmi195435.contaboserver.net.8333 > tom-Latitude-3570.39110: tcp 0
08:01:27.586219 IP vmi195435.contaboserver.net.8333 > tom-Latitude-3570.39110: tcp 0
08:01:27.671861 IP vmi195435.contaboserver.net.8333 > tom-Latitude-3570.39110: tcp 24
08:01:27.671883 IP vmi195435.contaboserver.net.8333 > tom-Latitude-3570.39110: tcp 257
08:01:27.671886 IP vmi195435.contaboserver.net.8333 > tom-Latitude-3570.39110: tcp 24
08:01:27.671890 IP vmi195435.contaboserver.net.8333 > tom-Latitude-3570.39110: tcp 371
08:01:27.671892 IP vmi195435.contaboserver.net.8333 > tom-Latitude-3570.39110: tcp 24
08:01:27.671923 IP tom-Latitude-3570.39110 > vmi195435.contaboserver.net.8333: tcp 0
08:01:27.672239 IP vmi195435.contaboserver.net.8333 > tom-Latitude-3570.39110: tcp 1448
08:01:27.672256 IP vmi195435.contaboserver.net.8333 > tom-Latitude-3570.39110: tcp 1448
08:01:27.672260 IP vmi195435.contaboserver.net.8333 > tom-Latitude-3570.39110: tcp 303
08:01:27.672267 IP vmi195435.contaboserver.net.8333 > tom-Latitude-3570.39110: tcp 24
08:01:27.672271 IP vmi195435.contaboserver.net.8333 > tom-Latitude-3570.39110: tcp 250
08:01:27.672296 IP tom-Latitude-3570.39110 > vmi195435.contaboserver.net.8333: tcp 0
08:01:27.746827 IP vmi195435.contaboserver.net.8333 > tom-Latitude-3570.39110: tcp 1448
08:01:27.746888 IP tom-Latitude-3570.39110 > vmi195435.contaboserver.net.8333: tcp 0
08:01:27.748323 IP vmi195435.contaboserver.net.8333 > tom-Latitude-3570.39110: tcp 813
08:01:27.791883 IP tom-Latitude-3570.39110 > vmi195435.contaboserver.net.8333: tcp 0
08:01:27.951423 IP tom-Latitude-3570.60988 > 81.198.101.144.8333: tcp 24
08:01:27.951492 IP tom-Latitude-3570.42516 > 2.56.9.15.8333: tcp 24
08:01:27.953352 IP tom-Latitude-3570.60988 > 81.198.101.144.8333: tcp 289
08:01:27.954209 IP tom-Latitude-3570.42516 > 2.56.9.15.8333: tcp 289
08:01:27.987497 IP 81.198.101.144.8333 > tom-Latitude-3570.60988: tcp 0
08:01:28.003170 IP 2.56.9.15.8333 > tom-Latitude-3570.42516: tcp 0
08:01:28.003797 IP 81.198.101.144.8333 > tom-Latitude-3570.60988: tcp 0
08:01:28.151998 IP tom-Latitude-3570.46284 > static-87-75-105-186.vodafonexdsl.co.uk.8333: tcp 24
08:01:28.154218 IP tom-Latitude-3570.46284 > static-87-75-105-186.vodafonexdsl.co.uk.8333: tcp 289
08:01:28.187174 IP static-87-75-105-186.vodafonexdsl.co.uk.8333 > tom-Latitude-3570.46284: tcp 0
08:01:28.195181 IP static-87-75-105-186.vodafonexdsl.co.uk.8333 > tom-Latitude-3570.46284: tcp 0
08:01:28.553243 IP tom-Latitude-3570.60470 > bb42-60-217-183.singnet.com.sg.8333: tcp 24
08:01:28.555499 IP tom-Latitude-3570.60470 > bb42-60-217-183.singnet.com.sg.8333: tcp 289
08:01:28.610227 IP bb42-60-217-183.singnet.com.sg.8333 > tom-Latitude-3570.60470: tcp 0
08:01:28.615703 IP bb42-60-217-183.singnet.com.sg.8333 > tom-Latitude-3570.60470: tcp 0
08:01:28.648154 IP ns3113832.ip-54-38-177.eu.8333 > tom-Latitude-3570.56714: tcp 24
08:01:28.648177 IP ns3113832.ip-54-38-177.eu.8333 > tom-Latitude-3570.56714: tcp 397
08:01:28.648219 IP tom-Latitude-3570.56714 > ns3113832.ip-54-38-177.eu.8333: tcp 0
08:01:28.648480 IP tom-Latitude-3570.56714 > ns3113832.ip-54-38-177.eu.8333: tcp 24
08:01:28.649862 IP tom-Latitude-3570.56714 > ns3113832.ip-54-38-177.eu.8333: tcp 109
08:01:28.662154 IP 167.99.216.145.8333 > tom-Latitude-3570.57976: tcp 24
08:01:28.662779 IP 167.99.216.145.8333 > tom-Latitude-3570.57976: tcp 37
08:01:28.662842 IP tom-Latitude-3570.57976 > 167.99.216.145.8333: tcp 0
08:01:28.662990 IP tom-Latitude-3570.57976 > 167.99.216.145.8333: tcp 24
08:01:28.666388 IP tom-Latitude-3570.57976 > 167.99.216.145.8333: tcp 37
08:01:28.685352 IP ns3113832.ip-54-38-177.eu.8333 > tom-Latitude-3570.56714: tcp 0
08:01:28.685963 IP ns3113832.ip-54-38-177.eu.8333 > tom-Latitude-3570.56714: tcp 0
08:01:28.693704 IP 167.99.216.145.8333 > tom-Latitude-3570.57976: tcp 0
08:01:28.694360 IP 167.99.216.145.8333 > tom-Latitude-3570.57976: tcp 0
08:01:28.745026 IP ns3113832.ip-54-38-177.eu.8333 > tom-Latitude-3570.56714: tcp 24
08:01:28.745683 IP ns3113832.ip-54-38-177.eu.8333 > tom-Latitude-3570.56714: tcp 382
08:01:28.745702 IP ns3113832.ip-54-38-177.eu.8333 > tom-Latitude-3570.56714: tcp 24
08:01:28.745707 IP ns3113832.ip-54-38-177.eu.8333 > tom-Latitude-3570.56714: tcp 257
08:01:28.745746 IP tom-Latitude-3570.56714 > ns3113832.ip-54-38-177.eu.8333: tcp 0
08:01:28.746222 IP ns3113832.ip-54-38-177.eu.8333 > tom-Latitude-3570.56714: tcp 24
08:01:28.748121 IP ns3113832.ip-54-38-177.eu.8333 > tom-Latitude-3570.56714: tcp 372
08:01:28.748166 IP tom-Latitude-3570.56714 > ns3113832.ip-54-38-177.eu.8333: tcp 0
08:01:28.849071 IP tom-Latitude-3570.60988 > 81.198.101.144.8333: tcp 24
08:01:28.850590 IP tom-Latitude-3570.60988 > 81.198.101.144.8333: tcp 109
08:01:28.878743 IP 81.198.101.144.8333 > tom-Latitude-3570.60988: tcp 0
08:01:28.885709 IP 81.198.101.144.8333 > tom-Latitude-3570.60988: tcp 0
08:01:29.049862 IP tom-Latitude-3570.46284 > static-87-75-105-186.vodafonexdsl.co.uk.8333: tcp 24
08:01:29.052137 IP tom-Latitude-3570.46284 > static-87-75-105-186.vodafonexdsl.co.uk.8333: tcp 109
08:01:29.052675 IP vmi195435.contaboserver.net.8333 > tom-Latitude-3570.39110: tcp 24
08:01:29.052700 IP tom-Latitude-3570.39110 > vmi195435.contaboserver.net.8333: tcp 0
08:01:29.052717 IP vmi195435.contaboserver.net.8333 > tom-Latitude-3570.39110: tcp 181
08:01:29.052721 IP tom-Latitude-3570.39110 > vmi195435.contaboserver.net.8333: tcp 0
08:01:29.052935 IP tom-Latitude-3570.39110 > vmi195435.contaboserver.net.8333: tcp 24
08:01:29.058943 IP tom-Latitude-3570.39110 > vmi195435.contaboserver.net.8333: tcp 73
08:01:29.067804 IP 2.56.9.15.8333 > tom-Latitude-3570.42516: tcp 24
08:01:29.067823 IP 2.56.9.15.8333 > tom-Latitude-3570.42516: tcp 8
08:01:29.067869 IP tom-Latitude-3570.42516 > 2.56.9.15.8333: tcp 0
08:01:29.068030 IP tom-Latitude-3570.42516 > 2.56.9.15.8333: tcp 24
08:01:29.069653 IP tom-Latitude-3570.42516 > 2.56.9.15.8333: tcp 8
08:01:29.085875 IP static-87-75-105-186.vodafonexdsl.co.uk.8333 > tom-Latitude-3570.46284: tcp 0
08:01:29.085890 IP static-87-75-105-186.vodafonexdsl.co.uk.8333 > tom-Latitude-3570.46284: tcp 0
08:01:29.085892 IP vmi195435.contaboserver.net.8333 > tom-Latitude-3570.39110: tcp 0
08:01:29.085896 IP vmi195435.contaboserver.net.8333 > tom-Latitude-3570.39110: tcp 0
08:01:29.093509 IP 2.56.9.15.8333 > tom-Latitude-3570.42516: tcp 0
08:01:29.165890 IP vmi195435.contaboserver.net.8333 > tom-Latitude-3570.39110: tcp 24
08:01:29.165911 IP vmi195435.contaboserver.net.8333 > tom-Latitude-3570.39110: tcp 226
08:01:29.165915 IP vmi195435.contaboserver.net.8333 > tom-Latitude-3570.39110: tcp 24
08:01:29.165919 IP vmi195435.contaboserver.net.8333 > tom-Latitude-3570.39110: tcp 254
08:01:29.165952 IP tom-Latitude-3570.39110 > vmi195435.contaboserver.net.8333: tcp 0
08:01:29.166577 IP tom-Latitude-3570.60470 > bb42-60-217-183.singnet.com.sg.8333: tcp 24
08:01:29.167392 IP tom-Latitude-3570.60470 > bb42-60-217-183.singnet.com.sg.8333: tcp 61
08:01:29.195685 IP bb42-60-217-183.singnet.com.sg.8333 > tom-Latitude-3570.60470: tcp 0
08:01:29.195700 IP bb42-60-217-183.singnet.com.sg.8333 > tom-Latitude-3570.60470: tcp 0
08:01:29.668451 IP tom-Latitude-3570.46284 > static-87-75-105-186.vodafonexdsl.co.uk.8333: tcp 24
08:01:29.670767 IP tom-Latitude-3570.46284 > static-87-75-105-186.vodafonexdsl.co.uk.8333: tcp 73
08:01:29.717735 IP static-87-75-105-186.vodafonexdsl.co.uk.8333 > tom-Latitude-3570.46284: tcp 0
08:01:29.725742 IP static-87-75-105-186.vodafonexdsl.co.uk.8333 > tom-Latitude-3570.46284: tcp 0
08:01:29.999760 IP 167.99.216.145.8333 > tom-Latitude-3570.57976: tcp 24
08:01:29.999782 IP 167.99.216.145.8333 > tom-Latitude-3570.57976: tcp 505
08:01:29.999848 IP tom-Latitude-3570.57976 > 167.99.216.145.8333: tcp 0
08:01:30.000141 IP tom-Latitude-3570.57976 > 167.99.216.145.8333: tcp 24
08:01:30.001456 IP tom-Latitude-3570.57976 > 167.99.216.145.8333: tcp 37
08:01:30.043868 IP 167.99.216.145.8333 > tom-Latitude-3570.57976: tcp 0
08:01:30.043881 IP 167.99.216.145.8333 > tom-Latitude-3570.57976: tcp 0
08:01:30.099604 IP 167.99.216.145.8333 > tom-Latitude-3570.57976: tcp 24
08:01:30.099625 IP 167.99.216.145.8333 > tom-Latitude-3570.57976: tcp 405
08:01:30.099669 IP tom-Latitude-3570.57976 > 167.99.216.145.8333: tcp 0
08:01:30.307015 IP vmi195435.contaboserver.net.8333 > tom-Latitude-3570.39110: tcp 24
08:01:30.307036 IP vmi195435.contaboserver.net.8333 > tom-Latitude-3570.39110: tcp 109
08:01:30.307077 IP tom-Latitude-3570.39110 > vmi195435.contaboserver.net.8333: tcp 0
08:01:30.307322 IP tom-Latitude-3570.39110 > vmi195435.contaboserver.net.8333: tcp 24
08:01:30.308611 IP tom-Latitude-3570.39110 > vmi195435.contaboserver.net.8333: tcp 73
08:01:30.313060 IP vmi195435.contaboserver.net.8333 > tom-Latitude-3570.39110: tcp 109
08:01:30.313076 IP tom-Latitude-3570.39110 > vmi195435.contaboserver.net.8333: tcp 0
08:01:30.351067 IP vmi195435.contaboserver.net.8333 > tom-Latitude-3570.39110: tcp 0
08:01:30.351082 IP vmi195435.contaboserver.net.8333 > tom-Latitude-3570.39110: tcp 0
08:01:30.445836 IP vmi195435.contaboserver.net.8333 > tom-Latitude-3570.39110: tcp 24
08:01:30.445853 IP tom-Latitude-3570.39110 > vmi195435.contaboserver.net.8333: tcp 0
08:01:30.445873 IP vmi195435.contaboserver.net.8333 > tom-Latitude-3570.39110: tcp 436
08:01:30.445879 IP tom-Latitude-3570.39110 > vmi195435.contaboserver.net.8333: tcp 0
08:01:30.445883 IP vmi195435.contaboserver.net.8333 > tom-Latitude-3570.39110: tcp 24
08:01:30.445886 IP tom-Latitude-3570.39110 > vmi195435.contaboserver.net.8333: tcp 0
08:01:30.445891 IP vmi195435.contaboserver.net.8333 > tom-Latitude-3570.39110: tcp 762
08:01:30.445893 IP tom-Latitude-3570.39110 > vmi195435.contaboserver.net.8333: tcp 0
08:01:30.648208 IP tom-Latitude-3570.49070 > c-185-45-236-223.customer.ggaweb.ch.8333: tcp 24
08:01:30.650312 IP tom-Latitude-3570.49070 > c-185-45-236-223.customer.ggaweb.ch.8333: tcp 649
08:01:30.689195 IP c-185-45-236-223.customer.ggaweb.ch.8333 > tom-Latitude-3570.49070: tcp 0
08:01:30.696147 IP c-185-45-236-223.customer.ggaweb.ch.8333 > tom-Latitude-3570.49070: tcp 0
08:01:30.848909 IP tom-Latitude-3570.56714 > ns3113832.ip-54-38-177.eu.8333: tcp 24
08:01:30.851002 IP tom-Latitude-3570.56714 > ns3113832.ip-54-38-177.eu.8333: tcp 181
08:01:30.891130 IP ns3113832.ip-54-38-177.eu.8333 > tom-Latitude-3570.56714: tcp 0
08:01:30.895352 IP ns3113832.ip-54-38-177.eu.8333 > tom-Latitude-3570.56714: tcp 0
08:01:30.949120 IP tom-Latitude-3570.49070 > c-185-45-236-223.customer.ggaweb.ch.8333: tcp 24
08:01:30.950062 IP tom-Latitude-3570.49070 > c-185-45-236-223.customer.ggaweb.ch.8333: tcp 8
08:01:30.965480 IP ns3113832.ip-54-38-177.eu.8333 > tom-Latitude-3570.56714: tcp 24
08:01:30.965499 IP ns3113832.ip-54-38-177.eu.8333 > tom-Latitude-3570.56714: tcp 37
08:01:30.965546 IP tom-Latitude-3570.56714 > ns3113832.ip-54-38-177.eu.8333: tcp 0
08:01:30.965712 IP tom-Latitude-3570.56714 > ns3113832.ip-54-38-177.eu.8333: tcp 24
08:01:30.965856 IP tom-Latitude-3570.57976 > 167.99.216.145.8333: tcp 24
08:01:30.967185 IP tom-Latitude-3570.56714 > ns3113832.ip-54-38-177.eu.8333: tcp 436
08:01:30.967853 IP tom-Latitude-3570.57976 > 167.99.216.145.8333: tcp 73
08:01:30.979406 IP c-185-45-236-223.customer.ggaweb.ch.8333 > tom-Latitude-3570.49070: tcp 0
08:01:30.986119 IP c-185-45-236-223.customer.ggaweb.ch.8333 > tom-Latitude-3570.49070: tcp 0
08:01:30.995049 IP ns3113832.ip-54-38-177.eu.8333 > tom-Latitude-3570.56714: tcp 0
08:01:30.995064 IP ns3113832.ip-54-38-177.eu.8333 > tom-Latitude-3570.56714: tcp 0
08:01:30.995066 IP 167.99.216.145.8333 > tom-Latitude-3570.57976: tcp 0
08:01:31.003638 IP 167.99.216.145.8333 > tom-Latitude-3570.57976: tcp 0
08:01:31.069501 IP c-185-45-236-223.customer.ggaweb.ch.8333 > tom-Latitude-3570.49070: tcp 24
08:01:31.070163 IP c-185-45-236-223.customer.ggaweb.ch.8333 > tom-Latitude-3570.49070: tcp 8
08:01:31.070224 IP tom-Latitude-3570.49070 > c-185-45-236-223.customer.ggaweb.ch.8333: tcp 0
08:01:31.638171 IP vmi195435.contaboserver.net.8333 > tom-Latitude-3570.39110: tcp 24
08:01:31.638196 IP tom-Latitude-3570.39110 > vmi195435.contaboserver.net.8333: tcp 0
08:01:31.638213 IP vmi195435.contaboserver.net.8333 > tom-Latitude-3570.39110: tcp 8
08:01:31.638217 IP tom-Latitude-3570.39110 > vmi195435.contaboserver.net.8333: tcp 0
08:01:31.638222 IP vmi195435.contaboserver.net.8333 > tom-Latitude-3570.39110: tcp 8
08:01:31.638225 IP 2.56.9.15.8333 > tom-Latitude-3570.42516: tcp 24
08:01:31.638229 IP tom-Latitude-3570.39110 > vmi195435.contaboserver.net.8333: tcp 0
08:01:31.638229 IP 2.56.9.15.8333 > tom-Latitude-3570.42516: tcp 325
08:01:31.638237 IP ns3113832.ip-54-38-177.eu.8333 > tom-Latitude-3570.56714: tcp 24
08:01:31.638240 IP ns3113832.ip-54-38-177.eu.8333 > tom-Latitude-3570.56714: tcp 8
08:01:31.638290 IP tom-Latitude-3570.56714 > ns3113832.ip-54-38-177.eu.8333: tcp 0
08:01:31.638302 IP tom-Latitude-3570.42516 > 2.56.9.15.8333: tcp 0
08:01:31.638334 IP tom-Latitude-3570.39110 > vmi195435.contaboserver.net.8333: tcp 24
08:01:31.638381 IP tom-Latitude-3570.56714 > ns3113832.ip-54-38-177.eu.8333: tcp 24
08:01:31.638480 IP tom-Latitude-3570.42516 > 2.56.9.15.8333: tcp 24
08:01:31.642233 IP tom-Latitude-3570.39110 > vmi195435.contaboserver.net.8333: tcp 8
08:01:31.642958 IP tom-Latitude-3570.56714 > ns3113832.ip-54-38-177.eu.8333: tcp 8
08:01:31.643635 IP tom-Latitude-3570.42516 > 2.56.9.15.8333: tcp 37
08:01:31.725253 IP ns3113832.ip-54-38-177.eu.8333 > tom-Latitude-3570.56714: tcp 0
08:01:31.725268 IP vmi195435.contaboserver.net.8333 > tom-Latitude-3570.39110: tcp 0
08:01:31.725271 IP ns3113832.ip-54-38-177.eu.8333 > tom-Latitude-3570.56714: tcp 0
08:01:31.725274 IP vmi195435.contaboserver.net.8333 > tom-Latitude-3570.39110: tcp 0
08:01:31.725275 IP 2.56.9.15.8333 > tom-Latitude-3570.42516: tcp 0
08:01:31.763067 IP vmi195435.contaboserver.net.8333 > tom-Latitude-3570.39110: tcp 24
08:01:31.763959 IP vmi195435.contaboserver.net.8333 > tom-Latitude-3570.39110: tcp 145
08:01:31.764018 IP tom-Latitude-3570.39110 > vmi195435.contaboserver.net.8333: tcp 0
08:01:31.764234 IP tom-Latitude-3570.39110 > vmi195435.contaboserver.net.8333: tcp 24
08:01:31.765653 IP tom-Latitude-3570.39110 > vmi195435.contaboserver.net.8333: tcp 109
08:01:31.784700 IP 2.56.9.15.8333 > tom-Latitude-3570.42516: tcp 24
08:01:31.784721 IP 2.56.9.15.8333 > tom-Latitude-3570.42516: tcp 256
08:01:31.784726 IP vmi195435.contaboserver.net.8333 > tom-Latitude-3570.39110: tcp 0
08:01:31.784765 IP tom-Latitude-3570.42516 > 2.56.9.15.8333: tcp 0
08:01:31.806879 IP vmi195435.contaboserver.net.8333 > tom-Latitude-3570.39110: tcp 0
08:01:31.885502 IP tom-Latitude-3570.60988 > 81.198.101.144.8333: tcp 24
08:01:31.886938 IP tom-Latitude-3570.60988 > 81.198.101.144.8333: tcp 217
08:01:31.887627 IP vmi195435.contaboserver.net.8333 > tom-Latitude-3570.39110: tcp 24
08:01:31.887646 IP vmi195435.contaboserver.net.8333 > tom-Latitude-3570.39110: tcp 225
08:01:31.887653 IP vmi195435.contaboserver.net.8333 > tom-Latitude-3570.39110: tcp 24
08:01:31.887656 IP vmi195435.contaboserver.net.8333 > tom-Latitude-3570.39110: tcp 223
08:01:31.887659 IP vmi195435.contaboserver.net.8333 > tom-Latitude-3570.39110: tcp 24
08:01:31.887662 IP vmi195435.contaboserver.net.8333 > tom-Latitude-3570.39110: tcp 225
08:01:31.887700 IP tom-Latitude-3570.39110 > vmi195435.contaboserver.net.8333: tcp 0
08:01:31.920105 IP 81.198.101.144.8333 > tom-Latitude-3570.60988: tcp 0
08:01:31.920149 IP 81.198.101.144.8333 > tom-Latitude-3570.60988: tcp 0
08:01:32.008095 IP 81.198.101.144.8333 > tom-Latitude-3570.60988: tcp 24
08:01:32.008115 IP 81.198.101.144.8333 > tom-Latitude-3570.60988: tcp 181
08:01:32.008160 IP tom-Latitude-3570.60988 > 81.198.101.144.8333: tcp 0
08:01:32.008371 IP tom-Latitude-3570.60988 > 81.198.101.144.8333: tcp 24
08:01:32.009826 IP tom-Latitude-3570.60988 > 81.198.101.144.8333: tcp 73
08:01:32.047057 IP 81.198.101.144.8333 > tom-Latitude-3570.60988: tcp 0
08:01:32.048195 IP 81.198.101.144.8333 > tom-Latitude-3570.60988: tcp 0
08:01:32.108797 IP tom-Latitude-3570.57976 > 167.99.216.145.8333: tcp 24
08:01:32.109737 IP tom-Latitude-3570.57976 > 167.99.216.145.8333: tcp 145
08:01:32.134243 IP 81.198.101.144.8333 > tom-Latitude-3570.60988: tcp 24
08:01:32.135012 IP 81.198.101.144.8333 > tom-Latitude-3570.60988: tcp 404
08:01:32.135031 IP 81.198.101.144.8333 > tom-Latitude-3570.60988: tcp 24
08:01:32.135035 IP 81.198.101.144.8333 > tom-Latitude-3570.60988: tcp 223
08:01:32.135099 IP tom-Latitude-3570.60988 > 81.198.101.144.8333: tcp 0
08:01:32.139531 IP 167.99.216.145.8333 > tom-Latitude-3570.57976: tcp 0
08:01:32.145650 IP 167.99.216.145.8333 > tom-Latitude-3570.57976: tcp 0
08:01:32.737656 IP tom-Latitude-3570.49070 > c-185-45-236-223.customer.ggaweb.ch.8333: tcp 24
08:01:32.741161 IP tom-Latitude-3570.49070 > c-185-45-236-223.customer.ggaweb.ch.8333: tcp 217
08:01:32.787467 IP c-185-45-236-223.customer.ggaweb.ch.8333 > tom-Latitude-3570.49070: tcp 0
