00:27:42.847848 IP 2.56.9.15.8333 > tom-Latitude-3570.42516: tcp 24
00:27:42.851821 IP 2.56.9.15.8333 > tom-Latitude-3570.42516: tcp 37
00:27:42.851934 IP tom-Latitude-3570.42516 > 2.56.9.15.8333: tcp 0
00:27:42.852159 IP tom-Latitude-3570.56714 > ns3113832.ip-54-38-177.eu.8333: tcp 24
00:27:42.852291 IP tom-Latitude-3570.42516 > 2.56.9.15.8333: tcp 24
00:27:42.853390 IP tom-Latitude-3570.42516 > 2.56.9.15.8333: tcp 37
00:27:42.853400 IP tom-Latitude-3570.56714 > ns3113832.ip-54-38-177.eu.8333: tcp 253
00:27:42.857689 IP bb42-60-217-183.singnet.com.sg.8333 > tom-Latitude-3570.60470: tcp 0
00:27:42.858314 IP bb42-60-217-183.singnet.com.sg.8333 > tom-Latitude-3570.60470: tcp 0
00:27:42.858335 IP default-rdns.vocus.co.nz.8333 > tom-Latitude-3570.39282: tcp 0
00:27:42.879590 IP ns3113832.ip-54-38-177.eu.8333 > tom-Latitude-3570.56714: tcp 0
00:27:42.880249 IP 2.56.9.15.8333 > tom-Latitude-3570.42516: tcp 0
00:27:42.880260 IP ns3113832.ip-54-38-177.eu.8333 > tom-Latitude-3570.56714: tcp 0
00:27:42.983588 IP 2.56.9.15.8333 > tom-Latitude-3570.42516: tcp 24
00:27:42.984295 IP 2.56.9.15.8333 > tom-Latitude-3570.42516: tcp 247
00:27:42.984427 IP tom-Latitude-3570.42516 > 2.56.9.15.8333: tcp 0
00:27:43.085151 IP tom-Latitude-3570.56714 > ns3113832.ip-54-38-177.eu.8333: tcp 24
00:27:43.086093 IP tom-Latitude-3570.56714 > ns3113832.ip-54-38-177.eu.8333: tcp 37
00:27:43.128398 IP ns3113832.ip-54-38-177.eu.8333 > tom-Latitude-3570.56714: tcp 0
00:27:43.128412 IP ns3113832.ip-54-38-177.eu.8333 > tom-Latitude-3570.56714: tcp 0
00:27:43.185655 IP tom-Latitude-3570.57976 > 167.99.216.145.8333: tcp 24
00:27:43.186642 IP tom-Latitude-3570.57976 > 167.99.216.145.8333: tcp 433
00:27:43.211441 IP 167.99.216.145.8333 > tom-Latitude-3570.57976: tcp 0
00:27:43.219492 IP 167.99.216.145.8333 > tom-Latitude-3570.57976: tcp 0
00:27:44.188857 IP tom-Latitude-3570.39110 > vmi195435.contaboserver.net.8333: tcp 24
00:27:44.188909 IP tom-Latitude-3570.60470 > bb42-60-217-183.singnet.com.sg.8333: tcp 24
00:27:44.189826 IP tom-Latitude-3570.60470 > bb42-60-217-183.singnet.com.sg.8333: tcp 37
00:27:44.189836 IP tom-Latitude-3570.39110 > vmi195435.contaboserver.net.8333: tcp 37
00:27:44.230199 IP bb42-60-217-183.singnet.com.sg.8333 > tom-Latitude-3570.60470: tcp 0
00:27:44.230768 IP bb42-60-217-183.singnet.com.sg.8333 > tom-Latitude-3570.60470: tcp 0
00:27:44.230781 IP vmi195435.contaboserver.net.8333 > tom-Latitude-3570.39110: tcp 0
00:27:44.891091 IP tom-Latitude-3570.49070 > c-185-45-236-223.customer.ggaweb.ch.8333: tcp 24
00:27:44.891798 IP tom-Latitude-3570.49070 > c-185-45-236-223.customer.ggaweb.ch.8333: tcp 289
00:27:44.930078 IP c-185-45-236-223.customer.ggaweb.ch.8333 > tom-Latitude-3570.49070: tcp 0
00:27:44.930696 IP c-185-45-236-223.customer.ggaweb.ch.8333 > tom-Latitude-3570.49070: tcp 0
00:27:45.192153 IP tom-Latitude-3570.39282 > default-rdns.vocus.co.nz.8333: tcp 24
00:27:45.193099 IP tom-Latitude-3570.39282 > default-rdns.vocus.co.nz.8333: tcp 37
00:27:45.240407 IP default-rdns.vocus.co.nz.8333 > tom-Latitude-3570.39282: tcp 0
00:27:45.286307 IP ns3113832.ip-54-38-177.eu.8333 > tom-Latitude-3570.56714: tcp 24
00:27:45.286909 IP ns3113832.ip-54-38-177.eu.8333 > tom-Latitude-3570.56714: tcp 253
00:27:45.287038 IP tom-Latitude-3570.56714 > ns3113832.ip-54-38-177.eu.8333: tcp 0
00:27:45.287279 IP tom-Latitude-3570.56714 > ns3113832.ip-54-38-177.eu.8333: tcp 24
00:27:45.288691 IP tom-Latitude-3570.56714 > ns3113832.ip-54-38-177.eu.8333: tcp 217
00:27:45.319277 IP ns3113832.ip-54-38-177.eu.8333 > tom-Latitude-3570.56714: tcp 0
00:27:45.319919 IP ns3113832.ip-54-38-177.eu.8333 > tom-Latitude-3570.56714: tcp 0
00:27:45.378328 IP ns3113832.ip-54-38-177.eu.8333 > tom-Latitude-3570.56714: tcp 24
00:27:45.379357 IP ns3113832.ip-54-38-177.eu.8333 > tom-Latitude-3570.56714: tcp 249
00:27:45.379372 IP ns3113832.ip-54-38-177.eu.8333 > tom-Latitude-3570.56714: tcp 24
00:27:45.379374 IP ns3113832.ip-54-38-177.eu.8333 > tom-Latitude-3570.56714: tcp 420
00:27:45.379377 IP ns3113832.ip-54-38-177.eu.8333 > tom-Latitude-3570.56714: tcp 24
00:27:45.379378 IP ns3113832.ip-54-38-177.eu.8333 > tom-Latitude-3570.56714: tcp 224
00:27:45.379398 IP ns3113832.ip-54-38-177.eu.8333 > tom-Latitude-3570.56714: tcp 24
00:27:45.379399 IP ns3113832.ip-54-38-177.eu.8333 > tom-Latitude-3570.56714: tcp 249
00:27:45.379401 IP ns3113832.ip-54-38-177.eu.8333 > tom-Latitude-3570.56714: tcp 24
00:27:45.379403 IP ns3113832.ip-54-38-177.eu.8333 > tom-Latitude-3570.56714: tcp 226
00:27:45.379453 IP tom-Latitude-3570.56714 > ns3113832.ip-54-38-177.eu.8333: tcp 0
00:27:45.435302 IP ns3113832.ip-54-38-177.eu.8333 > tom-Latitude-3570.56714: tcp 273
00:27:45.475745 IP tom-Latitude-3570.56714 > ns3113832.ip-54-38-177.eu.8333: tcp 0
00:27:46.037886 IP tom-Latitude-3570.60988 > 81.198.101.144.8333: tcp 24
00:27:46.050215 IP tom-Latitude-3570.60988 > 81.198.101.144.8333: tcp 433
00:27:46.107715 IP 81.198.101.144.8333 > tom-Latitude-3570.60988: tcp 0
00:27:46.315050 IP c-185-45-236-223.customer.ggaweb.ch.8333 > tom-Latitude-3570.49070: tcp 24
00:27:46.315919 IP c-185-45-236-223.customer.ggaweb.ch.8333 > tom-Latitude-3570.49070: tcp 361
00:27:46.316047 IP tom-Latitude-3570.49070 > c-185-45-236-223.customer.ggaweb.ch.8333: tcp 0
00:27:46.316291 IP tom-Latitude-3570.49070 > c-185-45-236-223.customer.ggaweb.ch.8333: tcp 24
00:27:46.316374 IP tom-Latitude-3570.39282 > default-rdns.vocus.co.nz.8333: tcp 24
00:27:46.317507 IP tom-Latitude-3570.39282 > default-rdns.vocus.co.nz.8333: tcp 217
00:27:46.317512 IP tom-Latitude-3570.49070 > c-185-45-236-223.customer.ggaweb.ch.8333: tcp 145
00:27:46.357519 IP c-185-45-236-223.customer.ggaweb.ch.8333 > tom-Latitude-3570.49070: tcp 0
00:27:46.358138 IP default-rdns.vocus.co.nz.8333 > tom-Latitude-3570.39282: tcp 0
00:27:46.358151 IP c-185-45-236-223.customer.ggaweb.ch.8333 > tom-Latitude-3570.49070: tcp 0
00:27:46.416674 IP tom-Latitude-3570.57976 > 167.99.216.145.8333: tcp 24
00:27:46.417665 IP tom-Latitude-3570.57976 > 167.99.216.145.8333: tcp 217
00:27:46.441513 IP c-185-45-236-223.customer.ggaweb.ch.8333 > tom-Latitude-3570.49070: tcp 24
00:27:46.442339 IP c-185-45-236-223.customer.ggaweb.ch.8333 > tom-Latitude-3570.49070: tcp 832
00:27:46.442357 IP c-185-45-236-223.customer.ggaweb.ch.8333 > tom-Latitude-3570.49070: tcp 465
00:27:46.442449 IP tom-Latitude-3570.49070 > c-185-45-236-223.customer.ggaweb.ch.8333: tcp 0
00:27:46.451346 IP 167.99.216.145.8333 > tom-Latitude-3570.57976: tcp 0
00:27:46.459336 IP 167.99.216.145.8333 > tom-Latitude-3570.57976: tcp 0
00:27:46.612288 IP c-185-45-236-223.customer.ggaweb.ch.8333 > tom-Latitude-3570.49070: tcp 24
00:27:46.612902 IP c-185-45-236-223.customer.ggaweb.ch.8333 > tom-Latitude-3570.49070: tcp 109
00:27:46.612960 IP tom-Latitude-3570.49070 > c-185-45-236-223.customer.ggaweb.ch.8333: tcp 0
00:27:46.613065 IP tom-Latitude-3570.49070 > c-185-45-236-223.customer.ggaweb.ch.8333: tcp 24
00:27:46.614421 IP tom-Latitude-3570.49070 > c-185-45-236-223.customer.ggaweb.ch.8333: tcp 109
00:27:46.649268 IP c-185-45-236-223.customer.ggaweb.ch.8333 > tom-Latitude-3570.49070: tcp 0
00:27:46.649927 IP c-185-45-236-223.customer.ggaweb.ch.8333 > tom-Latitude-3570.49070: tcp 0
00:27:46.732445 IP c-185-45-236-223.customer.ggaweb.ch.8333 > tom-Latitude-3570.49070: tcp 24
00:27:46.738646 IP c-185-45-236-223.customer.ggaweb.ch.8333 > tom-Latitude-3570.49070: tcp 1448
00:27:46.738664 IP c-185-45-236-223.customer.ggaweb.ch.8333 > tom-Latitude-3570.49070: tcp 771
00:27:46.738758 IP tom-Latitude-3570.49070 > c-185-45-236-223.customer.ggaweb.ch.8333: tcp 0
00:27:46.829335 IP ns3113832.ip-54-38-177.eu.8333 > tom-Latitude-3570.56714: tcp 24
00:27:46.829360 IP tom-Latitude-3570.56714 > ns3113832.ip-54-38-177.eu.8333: tcp 0
00:27:46.829391 IP ns3113832.ip-54-38-177.eu.8333 > tom-Latitude-3570.56714: tcp 145
00:27:46.829395 IP tom-Latitude-3570.56714 > ns3113832.ip-54-38-177.eu.8333: tcp 0
00:27:47.130676 IP tom-Latitude-3570.42516 > 2.56.9.15.8333: tcp 24
00:27:47.131624 IP tom-Latitude-3570.42516 > 2.56.9.15.8333: tcp 469
00:27:47.190723 IP 2.56.9.15.8333 > tom-Latitude-3570.42516: tcp 0
00:27:47.732559 IP tom-Latitude-3570.57976 > 167.99.216.145.8333: tcp 24
00:27:47.733509 IP tom-Latitude-3570.57976 > 167.99.216.145.8333: tcp 253
00:27:47.766737 IP ns3113832.ip-54-38-177.eu.8333 > tom-Latitude-3570.56714: tcp 24
00:27:47.766755 IP tom-Latitude-3570.56714 > ns3113832.ip-54-38-177.eu.8333: tcp 0
00:27:47.766773 IP ns3113832.ip-54-38-177.eu.8333 > tom-Latitude-3570.56714: tcp 181
00:27:47.766777 IP tom-Latitude-3570.56714 > ns3113832.ip-54-38-177.eu.8333: tcp 0
00:27:47.766780 IP ns3113832.ip-54-38-177.eu.8333 > tom-Latitude-3570.56714: tcp 181
00:27:47.766782 IP tom-Latitude-3570.56714 > ns3113832.ip-54-38-177.eu.8333: tcp 0
00:27:47.767030 IP tom-Latitude-3570.56714 > ns3113832.ip-54-38-177.eu.8333: tcp 24
00:27:47.768299 IP tom-Latitude-3570.56714 > ns3113832.ip-54-38-177.eu.8333: tcp 73
00:27:47.776591 IP 167.99.216.145.8333 > tom-Latitude-3570.57976: tcp 0
00:27:47.783662 IP 167.99.216.145.8333 > tom-Latitude-3570.57976: tcp 0
00:27:47.791704 IP ns3113832.ip-54-38-177.eu.8333 > tom-Latitude-3570.56714: tcp 0
00:27:47.800402 IP ns3113832.ip-54-38-177.eu.8333 > tom-Latitude-3570.56714: tcp 0
00:27:47.858586 IP ns3113832.ip-54-38-177.eu.8333 > tom-Latitude-3570.56714: tcp 24
00:27:47.859342 IP ns3113832.ip-54-38-177.eu.8333 > tom-Latitude-3570.56714: tcp 372
00:27:47.859359 IP ns3113832.ip-54-38-177.eu.8333 > tom-Latitude-3570.56714: tcp 24
00:27:47.859362 IP ns3113832.ip-54-38-177.eu.8333 > tom-Latitude-3570.56714: tcp 224
00:27:47.859452 IP tom-Latitude-3570.56714 > ns3113832.ip-54-38-177.eu.8333: tcp 0
00:27:47.860300 IP tom-Latitude-3570.57976 > 167.99.216.145.8333: tcp 24
00:27:47.861124 IP tom-Latitude-3570.57976 > 167.99.216.145.8333: tcp 37
00:27:47.888761 IP 167.99.216.145.8333 > tom-Latitude-3570.57976: tcp 0
00:27:47.889328 IP 167.99.216.145.8333 > tom-Latitude-3570.57976: tcp 0
00:27:48.125598 IP default-rdns.vocus.co.nz.8333 > tom-Latitude-3570.39282: tcp 24
00:27:48.128173 IP default-rdns.vocus.co.nz.8333 > tom-Latitude-3570.39282: tcp 325
00:27:48.128302 IP tom-Latitude-3570.39282 > default-rdns.vocus.co.nz.8333: tcp 0
00:27:48.730528 IP tom-Latitude-3570.60470 > bb42-60-217-183.singnet.com.sg.8333: tcp 24
00:27:48.731366 IP tom-Latitude-3570.60470 > bb42-60-217-183.singnet.com.sg.8333: tcp 541
00:27:48.760603 IP bb42-60-217-183.singnet.com.sg.8333 > tom-Latitude-3570.60470: tcp 0
00:27:48.767448 IP bb42-60-217-183.singnet.com.sg.8333 > tom-Latitude-3570.60470: tcp 0
00:27:49.011189 IP vmi195435.contaboserver.net.8333 > tom-Latitude-3570.39110: tcp 24
00:27:49.011754 IP vmi195435.contaboserver.net.8333 > tom-Latitude-3570.39110: tcp 793
00:27:49.011849 IP tom-Latitude-3570.39110 > vmi195435.contaboserver.net.8333: tcp 0
00:27:49.012162 IP tom-Latitude-3570.39110 > vmi195435.contaboserver.net.8333: tcp 24
00:27:49.013280 IP tom-Latitude-3570.39110 > vmi195435.contaboserver.net.8333: tcp 253
00:27:49.048412 IP vmi195435.contaboserver.net.8333 > tom-Latitude-3570.39110: tcp 0
00:27:49.138602 IP vmi195435.contaboserver.net.8333 > tom-Latitude-3570.39110: tcp 24
00:27:49.138622 IP vmi195435.contaboserver.net.8333 > tom-Latitude-3570.39110: tcp 518
00:27:49.138626 IP vmi195435.contaboserver.net.8333 > tom-Latitude-3570.39110: tcp 24
00:27:49.138628 IP vmi195435.contaboserver.net.8333 > tom-Latitude-3570.39110: tcp 370
00:27:49.138629 IP vmi195435.contaboserver.net.8333 > tom-Latitude-3570.39110: tcp 24
00:27:49.138631 IP vmi195435.contaboserver.net.8333 > tom-Latitude-3570.39110: tcp 263
00:27:49.138651 IP vmi195435.contaboserver.net.8333 > tom-Latitude-3570.39110: tcp 24
00:27:49.138652 IP vmi195435.contaboserver.net.8333 > tom-Latitude-3570.39110: tcp 223
00:27:49.138654 IP vmi195435.contaboserver.net.8333 > tom-Latitude-3570.39110: tcp 24
00:27:49.138656 IP vmi195435.contaboserver.net.8333 > tom-Latitude-3570.39110: tcp 283
00:27:49.138719 IP tom-Latitude-3570.39110 > vmi195435.contaboserver.net.8333: tcp 0
00:27:49.205345 IP vmi195435.contaboserver.net.8333 > tom-Latitude-3570.39110: tcp 614
00:27:49.247903 IP tom-Latitude-3570.39110 > vmi195435.contaboserver.net.8333: tcp 0
00:27:49.261216 IP ns3113832.ip-54-38-177.eu.8333 > tom-Latitude-3570.56714: tcp 24
00:27:49.261943 IP ns3113832.ip-54-38-177.eu.8333 > tom-Latitude-3570.56714: tcp 217
00:27:49.262073 IP tom-Latitude-3570.56714 > ns3113832.ip-54-38-177.eu.8333: tcp 0
00:27:49.362716 IP tom-Latitude-3570.57976 > 167.99.216.145.8333: tcp 24
00:27:49.363663 IP tom-Latitude-3570.57976 > 167.99.216.145.8333: tcp 217
00:27:49.392069 IP 167.99.216.145.8333 > tom-Latitude-3570.57976: tcp 0
00:27:49.399105 IP 167.99.216.145.8333 > tom-Latitude-3570.57976: tcp 0
00:27:49.496302 IP bb42-60-217-183.singnet.com.sg.8333 > tom-Latitude-3570.60470: tcp 24
00:27:49.496327 IP tom-Latitude-3570.60470 > bb42-60-217-183.singnet.com.sg.8333: tcp 0
00:27:49.496907 IP bb42-60-217-183.singnet.com.sg.8333 > tom-Latitude-3570.60470: tcp 61
00:27:49.496923 IP tom-Latitude-3570.60470 > bb42-60-217-183.singnet.com.sg.8333: tcp 0
00:27:49.697954 IP tom-Latitude-3570.56714 > ns3113832.ip-54-38-177.eu.8333: tcp 24
00:27:49.698915 IP tom-Latitude-3570.56714 > ns3113832.ip-54-38-177.eu.8333: tcp 37
00:27:49.732209 IP ns3113832.ip-54-38-177.eu.8333 > tom-Latitude-3570.56714: tcp 0
00:27:49.740133 IP ns3113832.ip-54-38-177.eu.8333 > tom-Latitude-3570.56714: tcp 0
00:27:49.748152 IP 81.198.101.144.8333 > tom-Latitude-3570.60988: tcp 24
00:27:49.748839 IP 81.198.101.144.8333 > tom-Latitude-3570.60988: tcp 433
00:27:49.748969 IP tom-Latitude-3570.60988 > 81.198.101.144.8333: tcp 0
00:27:49.849381 IP tom-Latitude-3570.60470 > bb42-60-217-183.singnet.com.sg.8333: tcp 24
00:27:49.891576 IP tom-Latitude-3570.60470 > bb42-60-217-183.singnet.com.sg.8333: tcp 181
00:27:49.922960 IP bb42-60-217-183.singnet.com.sg.8333 > tom-Latitude-3570.60470: tcp 0
00:27:49.931051 IP bb42-60-217-183.singnet.com.sg.8333 > tom-Latitude-3570.60470: tcp 0
00:27:50.050138 IP tom-Latitude-3570.49070 > c-185-45-236-223.customer.ggaweb.ch.8333: tcp 24
00:27:50.051075 IP tom-Latitude-3570.49070 > c-185-45-236-223.customer.ggaweb.ch.8333: tcp 253
00:27:50.080961 IP c-185-45-236-223.customer.ggaweb.ch.8333 > tom-Latitude-3570.49070: tcp 0
00:27:50.098999 IP c-185-45-236-223.customer.ggaweb.ch.8333 > tom-Latitude-3570.49070: tcp 0
00:27:50.451395 IP tom-Latitude-3570.60988 > 81.198.101.144.8333: tcp 24
00:27:50.452217 IP tom-Latitude-3570.60988 > 81.198.101.144.8333: tcp 109
00:27:50.508090 IP 81.198.101.144.8333 > tom-Latitude-3570.60988: tcp 0
00:27:50.968179 IP 81.198.101.144.8333 > tom-Latitude-3570.60988: tcp 24
00:27:50.968199 IP 81.198.101.144.8333 > tom-Latitude-3570.60988: tcp 145
00:27:50.968291 IP tom-Latitude-3570.60988 > 81.198.101.144.8333: tcp 0
00:27:50.968512 IP tom-Latitude-3570.60988 > 81.198.101.144.8333: tcp 24
00:27:50.969735 IP tom-Latitude-3570.60988 > 81.198.101.144.8333: tcp 145
00:27:50.999317 IP 81.198.101.144.8333 > tom-Latitude-3570.60988: tcp 0
00:27:51.253670 IP 81.198.101.144.8333 > tom-Latitude-3570.60988: tcp 24
00:27:51.254479 IP 81.198.101.144.8333 > tom-Latitude-3570.60988: tcp 340
00:27:51.254498 IP 81.198.101.144.8333 > tom-Latitude-3570.60988: tcp 24
00:27:51.254500 IP 81.198.101.144.8333 > tom-Latitude-3570.60988: tcp 226
00:27:51.254503 IP 81.198.101.144.8333 > tom-Latitude-3570.60988: tcp 24
00:27:51.254505 IP 81.198.101.144.8333 > tom-Latitude-3570.60988: tcp 224
00:27:51.254507 IP 81.198.101.144.8333 > tom-Latitude-3570.60988: tcp 24
00:27:51.254509 IP 81.198.101.144.8333 > tom-Latitude-3570.60988: tcp 246
00:27:51.254595 IP tom-Latitude-3570.60988 > 81.198.101.144.8333: tcp 0
00:27:51.356270 IP tom-Latitude-3570.42516 > 2.56.9.15.8333: tcp 24
00:27:51.357222 IP tom-Latitude-3570.42516 > 2.56.9.15.8333: tcp 397
00:27:51.398237 IP 2.56.9.15.8333 > tom-Latitude-3570.42516: tcp 0
00:27:51.657055 IP tom-Latitude-3570.57976 > 167.99.216.145.8333: tcp 24
00:27:51.657834 IP tom-Latitude-3570.57976 > 167.99.216.145.8333: tcp 145
00:27:51.662290 IP default-rdns.vocus.co.nz.8333 > tom-Latitude-3570.39282: tcp 24
00:27:51.662300 IP default-rdns.vocus.co.nz.8333 > tom-Latitude-3570.39282: tcp 433
00:27:51.662356 IP tom-Latitude-3570.39282 > default-rdns.vocus.co.nz.8333: tcp 0
00:27:51.662508 IP tom-Latitude-3570.39282 > default-rdns.vocus.co.nz.8333: tcp 24
00:27:51.663888 IP tom-Latitude-3570.39282 > default-rdns.vocus.co.nz.8333: tcp 37
00:27:51.699542 IP 167.99.216.145.8333 > tom-Latitude-3570.57976: tcp 0
00:27:51.699557 IP 167.99.216.145.8333 > tom-Latitude-3570.57976: tcp 0
00:27:51.699559 IP default-rdns.vocus.co.nz.8333 > tom-Latitude-3570.39282: tcp 0
00:27:52.246062 IP default-rdns.vocus.co.nz.8333 > tom-Latitude-3570.39282: tcp 24
00:27:52.246779 IP default-rdns.vocus.co.nz.8333 > tom-Latitude-3570.39282: tcp 225
00:27:52.246796 IP default-rdns.vocus.co.nz.8333 > tom-Latitude-3570.39282: tcp 225
00:27:52.246806 IP tom-Latitude-3570.39282 > default-rdns.vocus.co.nz.8333: tcp 0
00:27:52.347621 IP tom-Latitude-3570.60470 > bb42-60-217-183.singnet.com.sg.8333: tcp 24
00:27:52.348572 IP tom-Latitude-3570.60470 > bb42-60-217-183.singnet.com.sg.8333: tcp 181
00:27:52.381373 IP bb42-60-217-183.singnet.com.sg.8333 > tom-Latitude-3570.60470: tcp 0
00:27:52.390290 IP bb42-60-217-183.singnet.com.sg.8333 > tom-Latitude-3570.60470: tcp 0
00:27:52.447563 IP c-185-45-236-223.customer.ggaweb.ch.8333 > tom-Latitude-3570.49070: tcp 24
00:27:52.447582 IP c-185-45-236-223.customer.ggaweb.ch.8333 > tom-Latitude-3570.49070: tcp 469
00:27:52.447674 IP tom-Latitude-3570.49070 > c-185-45-236-223.customer.ggaweb.ch.8333: tcp 0
00:27:52.447917 IP tom-Latitude-3570.49070 > c-185-45-236-223.customer.ggaweb.ch.8333: tcp 24
00:27:52.449278 IP tom-Latitude-3570.49070 > c-185-45-236-223.customer.ggaweb.ch.8333: tcp 217
00:27:52.478488 IP c-185-45-236-223.customer.ggaweb.ch.8333 > tom-Latitude-3570.49070: tcp 0
00:27:52.478502 IP c-185-45-236-223.customer.ggaweb.ch.8333 > tom-Latitude-3570.49070: tcp 0
00:27:52.564127 IP c-185-45-236-223.customer.ggaweb.ch.8333 > tom-Latitude-3570.49070: tcp 24
00:27:52.564146 IP c-185-45-236-223.customer.ggaweb.ch.8333 > tom-Latitude-3570.49070: tcp 656
00:27:52.564151 IP c-185-45-236-223.customer.ggaweb.ch.8333 > tom-Latitude-3570.49070: tcp 646
00:27:52.564153 IP c-185-45-236-223.customer.ggaweb.ch.8333 > tom-Latitude-3570.49070: tcp 615
00:27:52.564155 IP c-185-45-236-223.customer.ggaweb.ch.8333 > tom-Latitude-3570.49070: tcp 271
00:27:52.564237 IP tom-Latitude-3570.49070 > c-185-45-236-223.customer.ggaweb.ch.8333: tcp 0
00:27:52.667224 IP tom-Latitude-3570.57976 > 167.99.216.145.8333: tcp 24
00:27:52.668174 IP tom-Latitude-3570.57976 > 167.99.216.145.8333: tcp 253
00:27:52.701344 IP 167.99.216.145.8333 > tom-Latitude-3570.57976: tcp 0
00:27:52.708025 IP 167.99.216.145.8333 > tom-Latitude-3570.57976: tcp 0
00:27:52.889161 IP ns3113832.ip-54-38-177.eu.8333 > tom-Latitude-3570.56714: tcp 24
00:27:52.889830 IP ns3113832.ip-54-38-177.eu.8333 > tom-Latitude-3570.56714: tcp 397
00:27:52.889959 IP tom-Latitude-3570.56714 > ns3113832.ip-54-38-177.eu.8333: tcp 0
00:27:53.090965 IP tom-Latitude-3570.39282 > default-rdns.vocus.co.nz.8333: tcp 24
00:27:53.091954 IP tom-Latitude-3570.39282 > default-rdns.vocus.co.nz.8333: tcp 217
00:27:53.129361 IP default-rdns.vocus.co.nz.8333 > tom-Latitude-3570.39282: tcp 0
00:27:53.209163 IP default-rdns.vocus.co.nz.8333 > tom-Latitude-3570.39282: tcp 24
00:27:53.209187 IP tom-Latitude-3570.39282 > default-rdns.vocus.co.nz.8333: tcp 0
00:27:53.209833 IP default-rdns.vocus.co.nz.8333 > tom-Latitude-3570.39282: tcp 217
00:27:53.209857 IP tom-Latitude-3570.39282 > default-rdns.vocus.co.nz.8333: tcp 0
00:27:53.912362 IP tom-Latitude-3570.60988 > 81.198.101.144.8333: tcp 24
00:27:53.912431 IP tom-Latitude-3570.42516 > 2.56.9.15.8333: tcp 24
00:27:53.913326 IP tom-Latitude-3570.42516 > 2.56.9.15.8333: tcp 253
00:27:53.913338 IP tom-Latitude-3570.60988 > 81.198.101.144.8333: tcp 253
00:27:53.977374 IP 2.56.9.15.8333 > tom-Latitude-3570.42516: tcp 0
00:27:53.984161 IP 81.198.101.144.8333 > tom-Latitude-3570.60988: tcp 0
00:27:54.484229 IP default-rdns.vocus.co.nz.8333 > tom-Latitude-3570.39282: tcp 24
00:27:54.484247 IP tom-Latitude-3570.39282 > default-rdns.vocus.co.nz.8333: tcp 0
00:27:54.484858 IP default-rdns.vocus.co.nz.8333 > tom-Latitude-3570.39282: tcp 37
00:27:54.484875 IP tom-Latitude-3570.39282 > default-rdns.vocus.co.nz.8333: tcp 0
00:27:54.485190 IP tom-Latitude-3570.39282 > default-rdns.vocus.co.nz.8333: tcp 24
00:27:54.486064 IP tom-Latitude-3570.39282 > default-rdns.vocus.co.nz.8333: tcp 37
00:27:54.518312 IP default-rdns.vocus.co.nz.8333 > tom-Latitude-3570.39282: tcp 0
00:27:54.556696 IP 81.198.101.144.8333 > tom-Latitude-3570.60988: tcp 24
00:27:54.559115 IP 81.198.101.144.8333 > tom-Latitude-3570.60988: tcp 253
00:27:54.559242 IP tom-Latitude-3570.60988 > 81.198.101.144.8333: tcp 0
00:27:54.559498 IP tom-Latitude-3570.60988 > 81.198.101.144.8333: tcp 24
00:27:54.560889 IP tom-Latitude-3570.60988 > 81.198.101.144.8333: tcp 181
00:27:54.599372 IP 81.198.101.144.8333 > tom-Latitude-3570.60988: tcp 0
00:27:54.798884 IP 81.198.101.144.8333 > tom-Latitude-3570.60988: tcp 24
00:27:54.799808 IP 81.198.101.144.8333 > tom-Latitude-3570.60988: tcp 189
00:27:54.799827 IP 81.198.101.144.8333 > tom-Latitude-3570.60988: tcp 24
00:27:54.799829 IP 81.198.101.144.8333 > tom-Latitude-3570.60988: tcp 248
00:27:54.799832 IP 81.198.101.144.8333 > tom-Latitude-3570.60988: tcp 24
00:27:54.799833 IP 81.198.101.144.8333 > tom-Latitude-3570.60988: tcp 226
00:27:54.799835 IP 81.198.101.144.8333 > tom-Latitude-3570.60988: tcp 24
00:27:54.799855 IP 81.198.101.144.8333 > tom-Latitude-3570.60988: tcp 226
00:27:54.799857 IP 81.198.101.144.8333 > tom-Latitude-3570.60988: tcp 24
00:27:54.799858 IP 81.198.101.144.8333 > tom-Latitude-3570.60988: tcp 226
00:27:54.799920 IP tom-Latitude-3570.60988 > 81.198.101.144.8333: tcp 0
00:27:54.847981 IP default-rdns.vocus.co.nz.8333 > tom-Latitude-3570.39282: tcp 24
00:27:54.848001 IP default-rdns.vocus.co.nz.8333 > tom-Latitude-3570.39282: tcp 386
00:27:54.848093 IP tom-Latitude-3570.39282 > default-rdns.vocus.co.nz.8333: tcp 0
00:27:55.049440 IP tom-Latitude-3570.56714 > ns3113832.ip-54-38-177.eu.8333: tcp 24
00:27:55.050400 IP tom-Latitude-3570.56714 > ns3113832.ip-54-38-177.eu.8333: tcp 217
00:27:55.080066 IP ns3113832.ip-54-38-177.eu.8333 > tom-Latitude-3570.56714: tcp 0
00:27:55.089421 IP ns3113832.ip-54-38-177.eu.8333 > tom-Latitude-3570.56714: tcp 0
00:27:55.244332 IP 167.99.216.145.8333 > tom-Latitude-3570.57976: tcp 24
00:27:55.252519 IP 167.99.216.145.8333 > tom-Latitude-3570.57976: tcp 577
00:27:55.252647 IP tom-Latitude-3570.57976 > 167.99.216.145.8333: tcp 0
00:27:55.252977 IP tom-Latitude-3570.57976 > 167.99.216.145.8333: tcp 24
00:27:55.254063 IP tom-Latitude-3570.57976 > 167.99.216.145.8333: tcp 289
00:27:55.257812 IP vmi195435.contaboserver.net.8333 > tom-Latitude-3570.39110: tcp 24
00:27:55.257819 IP tom-Latitude-3570.39110 > vmi195435.contaboserver.net.8333: tcp 0
00:27:55.268905 IP vmi195435.contaboserver.net.8333 > tom-Latitude-3570.39110: tcp 865
00:27:55.268912 IP tom-Latitude-3570.39110 > vmi195435.contaboserver.net.8333: tcp 0
00:27:55.270199 IP 167.99.216.145.8333 > tom-Latitude-3570.57976: tcp 0
00:27:55.289268 IP 167.99.216.145.8333 > tom-Latitude-3570.57976: tcp 0
00:27:55.356152 IP 167.99.216.145.8333 > tom-Latitude-3570.57976: tcp 24
00:27:55.357023 IP 167.99.216.145.8333 > tom-Latitude-3570.57976: tcp 257
00:27:55.357030 IP 167.99.216.145.8333 > tom-Latitude-3570.57976: tcp 24
00:27:55.357032 IP 167.99.216.145.8333 > tom-Latitude-3570.57976: tcp 224
00:27:55.357034 IP 167.99.216.145.8333 > tom-Latitude-3570.57976: tcp 24
00:27:55.357036 IP 167.99.216.145.8333 > tom-Latitude-3570.57976: tcp 249
00:27:55.357051 IP 167.99.216.145.8333 > tom-Latitude-3570.57976: tcp 24
00:27:55.357053 IP 167.99.216.145.8333 > tom-Latitude-3570.57976: tcp 418
00:27:55.357054 IP tom-Latitude-3570.57976 > 167.99.216.145.8333: tcp 0
00:27:55.357054 IP 167.99.216.145.8333 > tom-Latitude-3570.57976: tcp 24
00:27:55.357056 IP 167.99.216.145.8333 > tom-Latitude-3570.57976: tcp 225
00:27:55.357077 IP tom-Latitude-3570.57976 > 167.99.216.145.8333: tcp 0
00:27:55.421321 IP 167.99.216.145.8333 > tom-Latitude-3570.57976: tcp 1101
00:27:55.463902 IP tom-Latitude-3570.57976 > 167.99.216.145.8333: tcp 0
00:27:55.623424 IP tom-Latitude-3570.60470 > bb42-60-217-183.singnet.com.sg.8333: tcp 24
00:27:55.624370 IP tom-Latitude-3570.60470 > bb42-60-217-183.singnet.com.sg.8333: tcp 721
00:27:55.652535 IP bb42-60-217-183.singnet.com.sg.8333 > tom-Latitude-3570.60470: tcp 0
00:27:55.659430 IP bb42-60-217-183.singnet.com.sg.8333 > tom-Latitude-3570.60470: tcp 0
00:27:55.924253 IP tom-Latitude-3570.42516 > 2.56.9.15.8333: tcp 24
00:27:55.925204 IP tom-Latitude-3570.42516 > 2.56.9.15.8333: tcp 505
00:27:55.969304 IP 2.56.9.15.8333 > tom-Latitude-3570.42516: tcp 0
00:27:56.024659 IP tom-Latitude-3570.56714 > ns3113832.ip-54-38-177.eu.8333: tcp 24
00:27:56.025597 IP tom-Latitude-3570.56714 > ns3113832.ip-54-38-177.eu.8333: tcp 289
00:27:56.061451 IP ns3113832.ip-54-38-177.eu.8333 > tom-Latitude-3570.56714: tcp 0
00:27:56.069257 IP ns3113832.ip-54-38-177.eu.8333 > tom-Latitude-3570.56714: tcp 0
00:27:57.685281 IP c-185-45-236-223.customer.ggaweb.ch.8333 > tom-Latitude-3570.49070: tcp 24
00:27:57.685919 IP c-185-45-236-223.customer.ggaweb.ch.8333 > tom-Latitude-3570.49070: tcp 31
00:27:57.685936 IP c-185-45-236-223.customer.ggaweb.ch.8333 > tom-Latitude-3570.49070: tcp 31
00:27:57.685946 IP tom-Latitude-3570.49070 > c-185-45-236-223.customer.ggaweb.ch.8333: tcp 0
00:27:57.716477 IP default-rdns.vocus.co.nz.8333 > tom-Latitude-3570.39282: tcp 24
00:27:57.717148 IP default-rdns.vocus.co.nz.8333 > tom-Latitude-3570.39282: tcp 649
00:27:57.717278 IP tom-Latitude-3570.39282 > default-rdns.vocus.co.nz.8333: tcp 0
00:27:57.717609 IP tom-Latitude-3570.39282 > default-rdns.vocus.co.nz.8333: tcp 24
00:27:57.718920 IP tom-Latitude-3570.39282 > default-rdns.vocus.co.nz.8333: tcp 181
00:27:57.758162 IP default-rdns.vocus.co.nz.8333 > tom-Latitude-3570.39282: tcp 0
00:27:57.918332 IP tom-Latitude-3570.39110 > vmi195435.contaboserver.net.8333: tcp 24
00:27:57.919239 IP tom-Latitude-3570.39110 > vmi195435.contaboserver.net.8333: tcp 37
00:27:57.957996 IP vmi195435.contaboserver.net.8333 > tom-Latitude-3570.39110: tcp 0
00:27:58.084535 IP default-rdns.vocus.co.nz.8333 > tom-Latitude-3570.39282: tcp 24
00:27:58.085482 IP default-rdns.vocus.co.nz.8333 > tom-Latitude-3570.39282: tcp 226
00:27:58.085499 IP default-rdns.vocus.co.nz.8333 > tom-Latitude-3570.39282: tcp 24
00:27:58.085503 IP default-rdns.vocus.co.nz.8333 > tom-Latitude-3570.39282: tcp 1254
00:27:58.085505 IP default-rdns.vocus.co.nz.8333 > tom-Latitude-3570.39282: tcp 24
00:27:58.085507 IP default-rdns.vocus.co.nz.8333 > tom-Latitude-3570.39282: tcp 247
00:27:58.085509 IP default-rdns.vocus.co.nz.8333 > tom-Latitude-3570.39282: tcp 24
00:27:58.085528 IP default-rdns.vocus.co.nz.8333 > tom-Latitude-3570.39282: tcp 224
00:27:58.085530 IP default-rdns.vocus.co.nz.8333 > tom-Latitude-3570.39282: tcp 24
00:27:58.085532 IP default-rdns.vocus.co.nz.8333 > tom-Latitude-3570.39282: tcp 225
00:27:58.085608 IP tom-Latitude-3570.39282 > default-rdns.vocus.co.nz.8333: tcp 0
00:27:58.086069 IP tom-Latitude-3570.60470 > bb42-60-217-183.singnet.com.sg.8333: tcp 24
00:27:58.086939 IP tom-Latitude-3570.60470 > bb42-60-217-183.singnet.com.sg.8333: tcp 37
00:27:58.117659 IP bb42-60-217-183.singnet.com.sg.8333 > tom-Latitude-3570.60470: tcp 0
00:27:58.118238 IP bb42-60-217-183.singnet.com.sg.8333 > tom-Latitude-3570.60470: tcp 0
00:27:58.188843 IP tom-Latitude-3570.60988 > 81.198.101.144.8333: tcp 24
00:27:58.189783 IP tom-Latitude-3570.60988 > 81.198.101.144.8333: tcp 469
00:27:58.237238 IP 81.198.101.144.8333 > tom-Latitude-3570.60988: tcp 0
00:27:58.790645 IP tom-Latitude-3570.39110 > vmi195435.contaboserver.net.8333: tcp 24
00:27:58.791582 IP tom-Latitude-3570.39110 > vmi195435.contaboserver.net.8333: tcp 181
00:27:58.857852 IP vmi195435.contaboserver.net.8333 > tom-Latitude-3570.39110: tcp 24
00:27:58.857877 IP tom-Latitude-3570.39110 > vmi195435.contaboserver.net.8333: tcp 0
00:27:58.866411 IP vmi195435.contaboserver.net.8333 > tom-Latitude-3570.39110: tcp 541
00:27:58.866436 IP tom-Latitude-3570.39110 > vmi195435.contaboserver.net.8333: tcp 0
00:27:58.866815 IP tom-Latitude-3570.39110 > vmi195435.contaboserver.net.8333: tcp 24
00:27:58.866830 IP tom-Latitude-3570.39110 > vmi195435.contaboserver.net.8333: tcp 361
00:27:58.870528 IP vmi195435.contaboserver.net.8333 > tom-Latitude-3570.39110: tcp 0
00:27:58.895467 IP 167.99.216.145.8333 > tom-Latitude-3570.57976: tcp 24
00:27:58.895491 IP tom-Latitude-3570.57976 > 167.99.216.145.8333: tcp 0
00:27:58.896197 IP 167.99.216.145.8333 > tom-Latitude-3570.57976: tcp 505
00:27:58.896221 IP tom-Latitude-3570.57976 > 167.99.216.145.8333: tcp 0
00:27:58.898281 IP vmi195435.contaboserver.net.8333 > tom-Latitude-3570.39110: tcp 0
00:27:58.978830 IP vmi195435.contaboserver.net.8333 > tom-Latitude-3570.39110: tcp 24
00:27:58.980732 IP vmi195435.contaboserver.net.8333 > tom-Latitude-3570.39110: tcp 192
00:27:58.980738 IP vmi195435.contaboserver.net.8333 > tom-Latitude-3570.39110: tcp 24
00:27:58.980741 IP vmi195435.contaboserver.net.8333 > tom-Latitude-3570.39110: tcp 226
00:27:58.980743 IP vmi195435.contaboserver.net.8333 > tom-Latitude-3570.39110: tcp 24
00:27:58.980744 IP vmi195435.contaboserver.net.8333 > tom-Latitude-3570.39110: tcp 191
00:27:58.980746 IP vmi195435.contaboserver.net.8333 > tom-Latitude-3570.39110: tcp 24
00:27:58.980748 IP vmi195435.contaboserver.net.8333 > tom-Latitude-3570.39110: tcp 437
00:27:58.980749 IP vmi195435.contaboserver.net.8333 > tom-Latitude-3570.39110: tcp 24
00:27:58.980751 IP vmi195435.contaboserver.net.8333 > tom-Latitude-3570.39110: tcp 219
00:27:58.980751 IP tom-Latitude-3570.39110 > vmi195435.contaboserver.net.8333: tcp 0
00:27:58.980796 IP tom-Latitude-3570.39110 > vmi195435.contaboserver.net.8333: tcp 0
00:27:59.056843 IP vmi195435.contaboserver.net.8333 > tom-Latitude-3570.39110: tcp 1382
00:27:59.057341 IP vmi195435.contaboserver.net.8333 > tom-Latitude-3570.39110: tcp 66
00:27:59.057357 IP tom-Latitude-3570.39110 > vmi195435.contaboserver.net.8333: tcp 0
00:27:59.057374 IP vmi195435.contaboserver.net.8333 > tom-Latitude-3570.39110: tcp 365
00:27:59.094128 IP 81.198.101.144.8333 > tom-Latitude-3570.60988: tcp 24
00:27:59.094765 IP 81.198.101.144.8333 > tom-Latitude-3570.60988: tcp 217
00:27:59.094894 IP tom-Latitude-3570.60988 > 81.198.101.144.8333: tcp 0
00:27:59.099780 IP tom-Latitude-3570.39110 > vmi195435.contaboserver.net.8333: tcp 0
00:27:59.144444 IP ns3113832.ip-54-38-177.eu.8333 > tom-Latitude-3570.56714: tcp 24
00:27:59.145207 IP ns3113832.ip-54-38-177.eu.8333 > tom-Latitude-3570.56714: tcp 541
00:27:59.145222 IP tom-Latitude-3570.56714 > ns3113832.ip-54-38-177.eu.8333: tcp 0
00:27:59.413988 IP 167.99.216.145.8333 > tom-Latitude-3570.57976: tcp 24
00:27:59.414005 IP tom-Latitude-3570.57976 > 167.99.216.145.8333: tcp 0
00:27:59.414474 IP 167.99.216.145.8333 > tom-Latitude-3570.57976: tcp 37
00:27:59.414486 IP tom-Latitude-3570.57976 > 167.99.216.145.8333: tcp 0
00:27:59.514939 IP tom-Latitude-3570.60988 > 81.198.101.144.8333: tcp 24
00:27:59.515899 IP tom-Latitude-3570.60988 > 81.198.101.144.8333: tcp 145
00:27:59.560019 IP 81.198.101.144.8333 > tom-Latitude-3570.60988: tcp 0
00:27:59.815889 IP tom-Latitude-3570.60470 > bb42-60-217-183.singnet.com.sg.8333: tcp 24
00:27:59.816687 IP tom-Latitude-3570.60470 > bb42-60-217-183.singnet.com.sg.8333: tcp 505
00:27:59.861496 IP bb42-60-217-183.singnet.com.sg.8333 > tom-Latitude-3570.60470: tcp 0
00:27:59.867990 IP bb42-60-217-183.singnet.com.sg.8333 > tom-Latitude-3570.60470: tcp 0
00:28:00.517864 IP tom-Latitude-3570.49070 > c-185-45-236-223.customer.ggaweb.ch.8333: tcp 24
00:28:00.517884 IP tom-Latitude-3570.49070 > c-185-45-236-223.customer.ggaweb.ch.8333: tcp 1045
00:28:00.592638 IP c-185-45-236-223.customer.ggaweb.ch.8333 > tom-Latitude-3570.49070: tcp 0
00:28:00.600527 IP c-185-45-236-223.customer.ggaweb.ch.8333 > tom-Latitude-3570.49070: tcp 0
00:28:00.845628 IP 2.56.9.15.8333 > tom-Latitude-3570.42516: tcp 24
00:28:00.846348 IP 2.56.9.15.8333 > tom-Latitude-3570.42516: tcp 721
00:28:00.846449 IP tom-Latitude-3570.42516 > 2.56.9.15.8333: tcp 0
00:28:00.846772 IP tom-Latitude-3570.42516 > 2.56.9.15.8333: tcp 24
00:28:00.847891 IP tom-Latitude-3570.42516 > 2.56.9.15.8333: tcp 109
00:28:00.879412 IP 2.56.9.15.8333 > tom-Latitude-3570.42516: tcp 0
00:28:00.978326 IP 2.56.9.15.8333 > tom-Latitude-3570.42516: tcp 24
00:28:00.978440 IP 2.56.9.15.8333 > tom-Latitude-3570.42516: tcp 249
00:28:00.978456 IP 2.56.9.15.8333 > tom-Latitude-3570.42516: tcp 24
00:28:00.978464 IP 2.56.9.15.8333 > tom-Latitude-3570.42516: tcp 247
00:28:00.978471 IP 2.56.9.15.8333 > tom-Latitude-3570.42516: tcp 24
00:28:00.978476 IP 2.56.9.15.8333 > tom-Latitude-3570.42516: tcp 374
00:28:00.978644 IP tom-Latitude-3570.42516 > 2.56.9.15.8333: tcp 0
00:28:01.081941 IP tom-Latitude-3570.49070 > c-185-45-236-223.customer.ggaweb.ch.8333: tcp 24
00:28:01.081987 IP tom-Latitude-3570.60470 > bb42-60-217-183.singnet.com.sg.8333: tcp 24
00:28:01.082899 IP tom-Latitude-3570.60470 > bb42-60-217-183.singnet.com.sg.8333: tcp 109
00:28:01.082910 IP tom-Latitude-3570.49070 > c-185-45-236-223.customer.ggaweb.ch.8333: tcp 109
00:28:01.112533 IP c-185-45-236-223.customer.ggaweb.ch.8333 > tom-Latitude-3570.49070: tcp 0
00:28:01.119505 IP bb42-60-217-183.singnet.com.sg.8333 > tom-Latitude-3570.60470: tcp 0
00:28:01.120302 IP bb42-60-217-183.singnet.com.sg.8333 > tom-Latitude-3570.60470: tcp 0
00:28:01.120316 IP c-185-45-236-223.customer.ggaweb.ch.8333 > tom-Latitude-3570.49070: tcp 0
00:28:01.383010 IP tom-Latitude-3570.56714 > ns3113832.ip-54-38-177.eu.8333: tcp 24
00:28:01.407386 IP tom-Latitude-3570.56714 > ns3113832.ip-54-38-177.eu.8333: tcp 109
00:28:01.450367 IP ns3113832.ip-54-38-177.eu.8333 > tom-Latitude-3570.56714: tcp 0
00:28:01.459472 IP ns3113832.ip-54-38-177.eu.8333 > tom-Latitude-3570.56714: tcp 0
00:28:01.848036 IP 81.198.101.144.8333 > tom-Latitude-3570.60988: tcp 24
00:28:01.848056 IP 81.198.101.144.8333 > tom-Latitude-3570.60988: tcp 181
00:28:01.848060 IP 81.198.101.144.8333 > tom-Latitude-3570.60988: tcp 181
00:28:01.848087 IP tom-Latitude-3570.60988 > 81.198.101.144.8333: tcp 0
00:28:01.848379 IP tom-Latitude-3570.60988 > 81.198.101.144.8333: tcp 24
00:28:01.849687 IP tom-Latitude-3570.60988 > 81.198.101.144.8333: tcp 73
00:28:01.878467 IP 81.198.101.144.8333 > tom-Latitude-3570.60988: tcp 0
00:28:02.167475 IP 81.198.101.144.8333 > tom-Latitude-3570.60988: tcp 24
00:28:02.167495 IP 81.198.101.144.8333 > tom-Latitude-3570.60988: tcp 226
00:28:02.167499 IP 81.198.101.144.8333 > tom-Latitude-3570.60988: tcp 24
00:28:02.167501 IP 81.198.101.144.8333 > tom-Latitude-3570.60988: tcp 247
00:28:02.167597 IP tom-Latitude-3570.60988 > 81.198.101.144.8333: tcp 0
00:28:02.268740 IP tom-Latitude-3570.42516 > 2.56.9.15.8333: tcp 24
00:28:02.269674 IP tom-Latitude-3570.42516 > 2.56.9.15.8333: tcp 73
00:28:02.308358 IP 2.56.9.15.8333 > tom-Latitude-3570.42516: tcp 0
00:28:02.516450 IP 167.99.216.145.8333 > tom-Latitude-3570.57976: tcp 24
00:28:02.516468 IP tom-Latitude-3570.57976 > 167.99.216.145.8333: tcp 0
00:28:02.517078 IP 167.99.216.145.8333 > tom-Latitude-3570.57976: tcp 469
00:28:02.517102 IP tom-Latitude-3570.57976 > 167.99.216.145.8333: tcp 0
00:28:02.517498 IP tom-Latitude-3570.57976 > 167.99.216.145.8333: tcp 24
00:28:02.518272 IP tom-Latitude-3570.57976 > 167.99.216.145.8333: tcp 289
00:28:02.549287 IP 167.99.216.145.8333 > tom-Latitude-3570.57976: tcp 0
00:28:02.549944 IP 167.99.216.145.8333 > tom-Latitude-3570.57976: tcp 0
00:28:02.611818 IP 167.99.216.145.8333 > tom-Latitude-3570.57976: tcp 24
00:28:02.611836 IP 167.99.216.145.8333 > tom-Latitude-3570.57976: tcp 224
00:28:02.611839 IP 167.99.216.145.8333 > tom-Latitude-3570.57976: tcp 24
00:28:02.611841 IP 167.99.216.145.8333 > tom-Latitude-3570.57976: tcp 190
00:28:02.611843 IP 167.99.216.145.8333 > tom-Latitude-3570.57976: tcp 24
00:28:02.611845 IP 167.99.216.145.8333 > tom-Latitude-3570.57976: tcp 246
00:28:02.611865 IP 167.99.216.145.8333 > tom-Latitude-3570.57976: tcp 24
00:28:02.611868 IP 167.99.216.145.8333 > tom-Latitude-3570.57976: tcp 226
00:28:02.611870 IP 167.99.216.145.8333 > tom-Latitude-3570.57976: tcp 24
00:28:02.611872 IP 167.99.216.145.8333 > tom-Latitude-3570.57976: tcp 189
00:28:02.611933 IP tom-Latitude-3570.57976 > 167.99.216.145.8333: tcp 0
00:28:02.687658 IP 167.99.216.145.8333 > tom-Latitude-3570.57976: tcp 855
00:28:02.727907 IP tom-Latitude-3570.57976 > 167.99.216.145.8333: tcp 0
00:28:02.877634 IP vmi195435.contaboserver.net.8333 > tom-Latitude-3570.39110: tcp 24
00:28:02.877652 IP tom-Latitude-3570.39110 > vmi195435.contaboserver.net.8333: tcp 0
00:28:02.877668 IP vmi195435.contaboserver.net.8333 > tom-Latitude-3570.39110: tcp 31
00:28:02.877671 IP tom-Latitude-3570.39110 > vmi195435.contaboserver.net.8333: tcp 0
00:28:02.975379 IP 81.198.101.144.8333 > tom-Latitude-3570.60988: tcp 24
00:28:02.975397 IP 81.198.101.144.8333 > tom-Latitude-3570.60988: tcp 109
00:28:02.975489 IP tom-Latitude-3570.60988 > 81.198.101.144.8333: tcp 0
00:28:03.176430 IP tom-Latitude-3570.60988 > 81.198.101.144.8333: tcp 24
00:28:03.177396 IP tom-Latitude-3570.60988 > 81.198.101.144.8333: tcp 181
00:28:03.219495 IP 81.198.101.144.8333 > tom-Latitude-3570.60988: tcp 0
00:28:03.578072 IP tom-Latitude-3570.39282 > default-rdns.vocus.co.nz.8333: tcp 24
00:28:03.579010 IP tom-Latitude-3570.39282 > default-rdns.vocus.co.nz.8333: tcp 829
00:28:03.639075 IP default-rdns.vocus.co.nz.8333 > tom-Latitude-3570.39282: tcp 0
00:28:03.859462 IP 2.56.9.15.8333 > tom-Latitude-3570.42516: tcp 24
00:28:03.859481 IP 2.56.9.15.8333 > tom-Latitude-3570.42516: tcp 325
00:28:03.859576 IP tom-Latitude-3570.42516 > 2.56.9.15.8333: tcp 0
00:28:03.859844 IP tom-Latitude-3570.42516 > 2.56.9.15.8333: tcp 24
00:28:03.861085 IP tom-Latitude-3570.42516 > 2.56.9.15.8333: tcp 37
00:28:03.889306 IP 2.56.9.15.8333 > tom-Latitude-3570.42516: tcp 0
00:28:03.960101 IP tom-Latitude-3570.39110 > vmi195435.contaboserver.net.8333: tcp 24
00:28:03.966977 IP default-rdns.vocus.co.nz.8333 > tom-Latitude-3570.39282: tcp 24
00:28:03.966996 IP default-rdns.vocus.co.nz.8333 > tom-Latitude-3570.39282: tcp 73
00:28:03.967088 IP tom-Latitude-3570.39282 > default-rdns.vocus.co.nz.8333: tcp 0
00:28:03.967224 IP tom-Latitude-3570.39282 > default-rdns.vocus.co.nz.8333: tcp 24
00:28:03.968074 IP tom-Latitude-3570.39282 > default-rdns.vocus.co.nz.8333: tcp 459
00:28:03.968081 IP tom-Latitude-3570.39110 > vmi195435.contaboserver.net.8333: tcp 469
00:28:03.988524 IP 2.56.9.15.8333 > tom-Latitude-3570.42516: tcp 24
00:28:03.989180 IP 2.56.9.15.8333 > tom-Latitude-3570.42516: tcp 224
00:28:03.989311 IP tom-Latitude-3570.42516 > 2.56.9.15.8333: tcp 0
00:28:03.998944 IP default-rdns.vocus.co.nz.8333 > tom-Latitude-3570.39282: tcp 0
00:28:03.999536 IP vmi195435.contaboserver.net.8333 > tom-Latitude-3570.39110: tcp 0
00:28:04.290703 IP tom-Latitude-3570.60988 > 81.198.101.144.8333: tcp 24
00:28:04.291650 IP tom-Latitude-3570.60988 > 81.198.101.144.8333: tcp 37
00:28:04.330056 IP 81.198.101.144.8333 > tom-Latitude-3570.60988: tcp 0
00:28:05.050481 IP c-185-45-236-223.customer.ggaweb.ch.8333 > tom-Latitude-3570.49070: tcp 24
00:28:05.050506 IP tom-Latitude-3570.49070 > c-185-45-236-223.customer.ggaweb.ch.8333: tcp 0
00:28:05.051381 IP c-185-45-236-223.customer.ggaweb.ch.8333 > tom-Latitude-3570.49070: tcp 577
00:28:05.051405 IP tom-Latitude-3570.49070 > c-185-45-236-223.customer.ggaweb.ch.8333: tcp 0
00:28:05.051434 IP ns3113832.ip-54-38-177.eu.8333 > tom-Latitude-3570.56714: tcp 24
00:28:05.051440 IP ns3113832.ip-54-38-177.eu.8333 > tom-Latitude-3570.56714: tcp 577
