08:31:16.449427 IP tom-Latitude-3570.57976 > 167.99.216.145.8333: tcp 24
08:31:16.450340 IP tom-Latitude-3570.57976 > 167.99.216.145.8333: tcp 37
08:31:16.483322 IP 167.99.216.145.8333 > tom-Latitude-3570.57976: tcp 0
08:31:16.500251 IP 167.99.216.145.8333 > tom-Latitude-3570.57976: tcp 0
08:31:17.466965 IP vmi195435.contaboserver.net.8333 > tom-Latitude-3570.39110: tcp 24
08:31:17.466986 IP vmi195435.contaboserver.net.8333 > tom-Latitude-3570.39110: tcp 37
08:31:17.466989 IP bb42-60-217-183.singnet.com.sg.8333 > tom-Latitude-3570.60470: tcp 24
08:31:17.466992 IP bb42-60-217-183.singnet.com.sg.8333 > tom-Latitude-3570.60470: tcp 37
08:31:17.466994 IP vmi195435.contaboserver.net.8333 > tom-Latitude-3570.39110: tcp 37
08:31:17.467022 IP tom-Latitude-3570.39110 > vmi195435.contaboserver.net.8333: tcp 0
08:31:17.467069 IP bb42-60-217-183.singnet.com.sg.8333 > tom-Latitude-3570.60470: tcp 37
08:31:17.467072 IP tom-Latitude-3570.60470 > bb42-60-217-183.singnet.com.sg.8333: tcp 0
08:31:17.467273 IP tom-Latitude-3570.60470 > bb42-60-217-183.singnet.com.sg.8333: tcp 24
08:31:17.469336 IP tom-Latitude-3570.60470 > bb42-60-217-183.singnet.com.sg.8333: tcp 37
08:31:17.513888 IP bb42-60-217-183.singnet.com.sg.8333 > tom-Latitude-3570.60470: tcp 0
08:31:17.514436 IP bb42-60-217-183.singnet.com.sg.8333 > tom-Latitude-3570.60470: tcp 0
08:31:17.567774 IP tom-Latitude-3570.60988 > 81.198.101.144.8333: tcp 24
08:31:17.568711 IP tom-Latitude-3570.60988 > 81.198.101.144.8333: tcp 145
08:31:17.593514 IP 81.198.101.144.8333 > tom-Latitude-3570.60988: tcp 0
08:31:17.604344 IP 81.198.101.144.8333 > tom-Latitude-3570.60988: tcp 0
08:31:17.948857 IP bb42-60-217-183.singnet.com.sg.8333 > tom-Latitude-3570.60470: tcp 24
08:31:17.948876 IP bb42-60-217-183.singnet.com.sg.8333 > tom-Latitude-3570.60470: tcp 223
08:31:17.948880 IP c-185-45-236-223.customer.ggaweb.ch.8333 > tom-Latitude-3570.49070: tcp 24
08:31:17.948883 IP c-185-45-236-223.customer.ggaweb.ch.8333 > tom-Latitude-3570.49070: tcp 37
08:31:17.948978 IP tom-Latitude-3570.49070 > c-185-45-236-223.customer.ggaweb.ch.8333: tcp 0
08:31:17.949025 IP tom-Latitude-3570.60470 > bb42-60-217-183.singnet.com.sg.8333: tcp 0
08:31:17.949397 IP tom-Latitude-3570.46284 > static-87-75-105-186.vodafonexdsl.co.uk.8333: tcp 24
08:31:17.951197 IP tom-Latitude-3570.46284 > static-87-75-105-186.vodafonexdsl.co.uk.8333: tcp 37
08:31:17.991756 IP static-87-75-105-186.vodafonexdsl.co.uk.8333 > tom-Latitude-3570.46284: tcp 0
08:31:17.992554 IP static-87-75-105-186.vodafonexdsl.co.uk.8333 > tom-Latitude-3570.46284: tcp 0
08:31:18.250235 IP tom-Latitude-3570.57976 > 167.99.216.145.8333: tcp 24
08:31:18.253760 IP tom-Latitude-3570.57976 > 167.99.216.145.8333: tcp 37
08:31:18.254284 IP 167.99.216.145.8333 > tom-Latitude-3570.57976: tcp 24
08:31:18.254305 IP 167.99.216.145.8333 > tom-Latitude-3570.57976: tcp 73
08:31:18.254395 IP tom-Latitude-3570.57976 > 167.99.216.145.8333: tcp 0
08:31:18.254540 IP tom-Latitude-3570.57976 > 167.99.216.145.8333: tcp 61
08:31:18.291734 IP 167.99.216.145.8333 > tom-Latitude-3570.57976: tcp 0
08:31:18.292338 IP 167.99.216.145.8333 > tom-Latitude-3570.57976: tcp 0
08:31:18.292353 IP 167.99.216.145.8333 > tom-Latitude-3570.57976: tcp 0
08:31:18.356032 IP 167.99.216.145.8333 > tom-Latitude-3570.57976: tcp 24
08:31:18.356052 IP 167.99.216.145.8333 > tom-Latitude-3570.57976: tcp 256
08:31:18.356143 IP tom-Latitude-3570.57976 > 167.99.216.145.8333: tcp 0
08:31:18.456830 IP tom-Latitude-3570.49070 > c-185-45-236-223.customer.ggaweb.ch.8333: tcp 24
08:31:18.456878 IP tom-Latitude-3570.46284 > static-87-75-105-186.vodafonexdsl.co.uk.8333: tcp 24
08:31:18.520035 IP tom-Latitude-3570.49070 > c-185-45-236-223.customer.ggaweb.ch.8333: tcp 37
08:31:18.520662 IP tom-Latitude-3570.46284 > static-87-75-105-186.vodafonexdsl.co.uk.8333: tcp 37
08:31:18.552588 IP c-185-45-236-223.customer.ggaweb.ch.8333 > tom-Latitude-3570.49070: tcp 0
08:31:18.560975 IP static-87-75-105-186.vodafonexdsl.co.uk.8333 > tom-Latitude-3570.46284: tcp 0
08:31:18.560989 IP static-87-75-105-186.vodafonexdsl.co.uk.8333 > tom-Latitude-3570.46284: tcp 0
08:31:18.560992 IP c-185-45-236-223.customer.ggaweb.ch.8333 > tom-Latitude-3570.49070: tcp 0
08:31:19.790687 IP static-87-75-105-186.vodafonexdsl.co.uk.8333 > tom-Latitude-3570.46284: tcp 24
08:31:19.790708 IP static-87-75-105-186.vodafonexdsl.co.uk.8333 > tom-Latitude-3570.46284: tcp 217
08:31:19.790712 IP static-87-75-105-186.vodafonexdsl.co.uk.8333 > tom-Latitude-3570.46284: tcp 217
08:31:19.790740 IP tom-Latitude-3570.46284 > static-87-75-105-186.vodafonexdsl.co.uk.8333: tcp 0
08:31:19.790994 IP tom-Latitude-3570.46284 > static-87-75-105-186.vodafonexdsl.co.uk.8333: tcp 24
08:31:19.792130 IP tom-Latitude-3570.46284 > static-87-75-105-186.vodafonexdsl.co.uk.8333: tcp 217
08:31:19.831505 IP static-87-75-105-186.vodafonexdsl.co.uk.8333 > tom-Latitude-3570.46284: tcp 0
08:31:19.831512 IP static-87-75-105-186.vodafonexdsl.co.uk.8333 > tom-Latitude-3570.46284: tcp 0
08:31:19.928749 IP static-87-75-105-186.vodafonexdsl.co.uk.8333 > tom-Latitude-3570.46284: tcp 24
08:31:19.928768 IP static-87-75-105-186.vodafonexdsl.co.uk.8333 > tom-Latitude-3570.46284: tcp 281
08:31:19.928882 IP tom-Latitude-3570.46284 > static-87-75-105-186.vodafonexdsl.co.uk.8333: tcp 0
08:31:19.931964 IP static-87-75-105-186.vodafonexdsl.co.uk.8333 > tom-Latitude-3570.46284: tcp 281
08:31:19.935142 IP static-87-75-105-186.vodafonexdsl.co.uk.8333 > tom-Latitude-3570.46284: tcp 270
08:31:19.935259 IP tom-Latitude-3570.46284 > static-87-75-105-186.vodafonexdsl.co.uk.8333: tcp 0
08:31:19.937441 IP static-87-75-105-186.vodafonexdsl.co.uk.8333 > tom-Latitude-3570.46284: tcp 269
08:31:19.937459 IP static-87-75-105-186.vodafonexdsl.co.uk.8333 > tom-Latitude-3570.46284: tcp 279
08:31:19.937480 IP static-87-75-105-186.vodafonexdsl.co.uk.8333 > tom-Latitude-3570.46284: tcp 372
08:31:19.937538 IP tom-Latitude-3570.46284 > static-87-75-105-186.vodafonexdsl.co.uk.8333: tcp 0
08:31:20.440398 IP tom-Latitude-3570.39110 > vmi195435.contaboserver.net.8333: tcp 24
08:31:20.442491 IP tom-Latitude-3570.39110 > vmi195435.contaboserver.net.8333: tcp 289
08:31:20.452365 IP static-87-75-105-186.vodafonexdsl.co.uk.8333 > tom-Latitude-3570.46284: tcp 24
08:31:20.452998 IP static-87-75-105-186.vodafonexdsl.co.uk.8333 > tom-Latitude-3570.46284: tcp 37
08:31:20.453127 IP tom-Latitude-3570.46284 > static-87-75-105-186.vodafonexdsl.co.uk.8333: tcp 0
08:31:20.453250 IP tom-Latitude-3570.46284 > static-87-75-105-186.vodafonexdsl.co.uk.8333: tcp 24
08:31:20.454668 IP tom-Latitude-3570.46284 > static-87-75-105-186.vodafonexdsl.co.uk.8333: tcp 37
08:31:20.464289 IP vmi195435.contaboserver.net.8333 > tom-Latitude-3570.39110: tcp 0
08:31:20.472280 IP vmi195435.contaboserver.net.8333 > tom-Latitude-3570.39110: tcp 0
08:31:20.473138 IP static-87-75-105-186.vodafonexdsl.co.uk.8333 > tom-Latitude-3570.46284: tcp 0
08:31:20.475541 IP static-87-75-105-186.vodafonexdsl.co.uk.8333 > tom-Latitude-3570.46284: tcp 24
08:31:20.476192 IP static-87-75-105-186.vodafonexdsl.co.uk.8333 > tom-Latitude-3570.46284: tcp 8
08:31:20.476320 IP tom-Latitude-3570.46284 > static-87-75-105-186.vodafonexdsl.co.uk.8333: tcp 0
08:31:20.476410 IP tom-Latitude-3570.46284 > static-87-75-105-186.vodafonexdsl.co.uk.8333: tcp 24
08:31:20.477952 IP tom-Latitude-3570.46284 > static-87-75-105-186.vodafonexdsl.co.uk.8333: tcp 8
08:31:20.510949 IP static-87-75-105-186.vodafonexdsl.co.uk.8333 > tom-Latitude-3570.46284: tcp 0
08:31:20.548276 IP static-87-75-105-186.vodafonexdsl.co.uk.8333 > tom-Latitude-3570.46284: tcp 24
08:31:20.591918 IP tom-Latitude-3570.46284 > static-87-75-105-186.vodafonexdsl.co.uk.8333: tcp 0
08:31:20.596183 IP static-87-75-105-186.vodafonexdsl.co.uk.8333 > tom-Latitude-3570.46284: tcp 226
08:31:20.596198 IP tom-Latitude-3570.46284 > static-87-75-105-186.vodafonexdsl.co.uk.8333: tcp 0
08:31:20.713579 IP c-185-45-236-223.customer.ggaweb.ch.8333 > tom-Latitude-3570.49070: tcp 24
08:31:20.715951 IP c-185-45-236-223.customer.ggaweb.ch.8333 > tom-Latitude-3570.49070: tcp 397
08:31:20.716081 IP tom-Latitude-3570.49070 > c-185-45-236-223.customer.ggaweb.ch.8333: tcp 0
08:31:20.716282 IP tom-Latitude-3570.49070 > c-185-45-236-223.customer.ggaweb.ch.8333: tcp 24
08:31:20.727710 IP tom-Latitude-3570.49070 > c-185-45-236-223.customer.ggaweb.ch.8333: tcp 145
08:31:20.760256 IP c-185-45-236-223.customer.ggaweb.ch.8333 > tom-Latitude-3570.49070: tcp 0
08:31:20.760263 IP c-185-45-236-223.customer.ggaweb.ch.8333 > tom-Latitude-3570.49070: tcp 0
08:31:20.844268 IP c-185-45-236-223.customer.ggaweb.ch.8333 > tom-Latitude-3570.49070: tcp 24
08:31:20.845263 IP c-185-45-236-223.customer.ggaweb.ch.8333 > tom-Latitude-3570.49070: tcp 527
08:31:20.845283 IP c-185-45-236-223.customer.ggaweb.ch.8333 > tom-Latitude-3570.49070: tcp 1067
08:31:20.845371 IP tom-Latitude-3570.49070 > c-185-45-236-223.customer.ggaweb.ch.8333: tcp 0
08:31:21.047914 IP tom-Latitude-3570.39110 > vmi195435.contaboserver.net.8333: tcp 24
08:31:21.050059 IP tom-Latitude-3570.39110 > vmi195435.contaboserver.net.8333: tcp 181
08:31:21.082358 IP vmi195435.contaboserver.net.8333 > tom-Latitude-3570.39110: tcp 0
08:31:21.090365 IP vmi195435.contaboserver.net.8333 > tom-Latitude-3570.39110: tcp 0
08:31:21.635484 IP 81.198.101.144.8333 > tom-Latitude-3570.60988: tcp 24
08:31:21.635508 IP tom-Latitude-3570.60988 > 81.198.101.144.8333: tcp 0
08:31:21.635542 IP 81.198.101.144.8333 > tom-Latitude-3570.60988: tcp 613
08:31:21.635547 IP tom-Latitude-3570.60988 > 81.198.101.144.8333: tcp 0
08:31:21.635551 IP 81.198.101.144.8333 > tom-Latitude-3570.60988: tcp 613
08:31:21.635554 IP tom-Latitude-3570.60988 > 81.198.101.144.8333: tcp 0
08:31:21.635876 IP tom-Latitude-3570.60988 > 81.198.101.144.8333: tcp 24
08:31:21.636000 IP tom-Latitude-3570.60470 > bb42-60-217-183.singnet.com.sg.8333: tcp 24
08:31:21.638220 IP tom-Latitude-3570.60988 > 81.198.101.144.8333: tcp 145
08:31:21.638830 IP tom-Latitude-3570.60470 > bb42-60-217-183.singnet.com.sg.8333: tcp 433
08:31:21.669784 IP 81.198.101.144.8333 > tom-Latitude-3570.60988: tcp 0
08:31:21.670383 IP 81.198.101.144.8333 > tom-Latitude-3570.60988: tcp 0
08:31:21.671195 IP bb42-60-217-183.singnet.com.sg.8333 > tom-Latitude-3570.60470: tcp 0
08:31:21.671199 IP bb42-60-217-183.singnet.com.sg.8333 > tom-Latitude-3570.60470: tcp 0
08:31:21.815971 IP 81.198.101.144.8333 > tom-Latitude-3570.60988: tcp 24
08:31:21.859911 IP tom-Latitude-3570.60988 > 81.198.101.144.8333: tcp 0
08:31:21.916943 IP 81.198.101.144.8333 > tom-Latitude-3570.60988: tcp 588
08:31:21.916963 IP tom-Latitude-3570.60988 > 81.198.101.144.8333: tcp 0
08:31:21.916991 IP 81.198.101.144.8333 > tom-Latitude-3570.60988: tcp 24
08:31:21.916993 IP tom-Latitude-3570.60988 > 81.198.101.144.8333: tcp 0
08:31:21.916997 IP 81.198.101.144.8333 > tom-Latitude-3570.60988: tcp 284
08:31:21.917000 IP tom-Latitude-3570.60988 > 81.198.101.144.8333: tcp 0
08:31:21.917003 IP 81.198.101.144.8333 > tom-Latitude-3570.60988: tcp 24
08:31:21.917005 IP tom-Latitude-3570.60988 > 81.198.101.144.8333: tcp 0
08:31:21.917009 IP 81.198.101.144.8333 > tom-Latitude-3570.60988: tcp 284
08:31:21.917011 IP 81.198.101.144.8333 > tom-Latitude-3570.60988: tcp 24
08:31:21.917014 IP 81.198.101.144.8333 > tom-Latitude-3570.60988: tcp 284
08:31:21.917017 IP tom-Latitude-3570.60988 > 81.198.101.144.8333: tcp 0
08:31:21.917025 IP tom-Latitude-3570.60988 > 81.198.101.144.8333: tcp 0
08:31:21.917027 IP tom-Latitude-3570.60988 > 81.198.101.144.8333: tcp 0
08:31:22.019098 IP tom-Latitude-3570.57976 > 167.99.216.145.8333: tcp 24
08:31:22.028132 IP tom-Latitude-3570.57976 > 167.99.216.145.8333: tcp 541
08:31:22.052017 IP 167.99.216.145.8333 > tom-Latitude-3570.57976: tcp 0
08:31:22.060282 IP 167.99.216.145.8333 > tom-Latitude-3570.57976: tcp 0
08:31:22.219794 IP tom-Latitude-3570.39110 > vmi195435.contaboserver.net.8333: tcp 24
08:31:22.222103 IP tom-Latitude-3570.39110 > vmi195435.contaboserver.net.8333: tcp 145
08:31:22.251968 IP vmi195435.contaboserver.net.8333 > tom-Latitude-3570.39110: tcp 0
08:31:22.259952 IP vmi195435.contaboserver.net.8333 > tom-Latitude-3570.39110: tcp 0
08:31:22.520813 IP tom-Latitude-3570.56714 > ns3113832.ip-54-38-177.eu.8333: tcp 24
08:31:22.520833 IP tom-Latitude-3570.56714 > ns3113832.ip-54-38-177.eu.8333: tcp 1081
08:31:22.523427 IP c-185-45-236-223.customer.ggaweb.ch.8333 > tom-Latitude-3570.49070: tcp 24
08:31:22.523447 IP c-185-45-236-223.customer.ggaweb.ch.8333 > tom-Latitude-3570.49070: tcp 1045
08:31:22.523554 IP tom-Latitude-3570.49070 > c-185-45-236-223.customer.ggaweb.ch.8333: tcp 0
08:31:22.524191 IP tom-Latitude-3570.49070 > c-185-45-236-223.customer.ggaweb.ch.8333: tcp 24
08:31:22.525582 IP tom-Latitude-3570.49070 > c-185-45-236-223.customer.ggaweb.ch.8333: tcp 901
08:31:22.562486 IP ns3113832.ip-54-38-177.eu.8333 > tom-Latitude-3570.56714: tcp 0
08:31:22.563156 IP ns3113832.ip-54-38-177.eu.8333 > tom-Latitude-3570.56714: tcp 0
08:31:22.563161 IP c-185-45-236-223.customer.ggaweb.ch.8333 > tom-Latitude-3570.49070: tcp 0
08:31:22.563163 IP c-185-45-236-223.customer.ggaweb.ch.8333 > tom-Latitude-3570.49070: tcp 0
08:31:22.645421 IP c-185-45-236-223.customer.ggaweb.ch.8333 > tom-Latitude-3570.49070: tcp 24
08:31:22.646633 IP c-185-45-236-223.customer.ggaweb.ch.8333 > tom-Latitude-3570.49070: tcp 1448
08:31:22.646651 IP c-185-45-236-223.customer.ggaweb.ch.8333 > tom-Latitude-3570.49070: tcp 23
08:31:22.646656 IP c-185-45-236-223.customer.ggaweb.ch.8333 > tom-Latitude-3570.49070: tcp 1231
08:31:22.646744 IP tom-Latitude-3570.49070 > c-185-45-236-223.customer.ggaweb.ch.8333: tcp 0
08:31:22.647166 IP tom-Latitude-3570.60470 > bb42-60-217-183.singnet.com.sg.8333: tcp 24
08:31:22.648204 IP tom-Latitude-3570.60470 > bb42-60-217-183.singnet.com.sg.8333: tcp 181
08:31:22.650263 IP c-185-45-236-223.customer.ggaweb.ch.8333 > tom-Latitude-3570.49070: tcp 1230
08:31:22.650282 IP c-185-45-236-223.customer.ggaweb.ch.8333 > tom-Latitude-3570.49070: tcp 1231
08:31:22.650303 IP c-185-45-236-223.customer.ggaweb.ch.8333 > tom-Latitude-3570.49070: tcp 1252
08:31:22.650311 IP c-185-45-236-223.customer.ggaweb.ch.8333 > tom-Latitude-3570.49070: tcp 1448
08:31:22.650315 IP c-185-45-236-223.customer.ggaweb.ch.8333 > tom-Latitude-3570.49070: tcp 66
08:31:22.650375 IP tom-Latitude-3570.49070 > c-185-45-236-223.customer.ggaweb.ch.8333: tcp 0
08:31:22.680118 IP bb42-60-217-183.singnet.com.sg.8333 > tom-Latitude-3570.60470: tcp 0
08:31:22.680710 IP bb42-60-217-183.singnet.com.sg.8333 > tom-Latitude-3570.60470: tcp 0
08:31:22.715541 IP 2.56.9.15.8333 > tom-Latitude-3570.42516: tcp 24
08:31:22.729012 IP 2.56.9.15.8333 > tom-Latitude-3570.42516: tcp 1261
08:31:22.729143 IP tom-Latitude-3570.42516 > 2.56.9.15.8333: tcp 0
08:31:22.809101 IP ns3113832.ip-54-38-177.eu.8333 > tom-Latitude-3570.56714: tcp 24
08:31:22.809832 IP ns3113832.ip-54-38-177.eu.8333 > tom-Latitude-3570.56714: tcp 757
08:31:22.809862 IP tom-Latitude-3570.56714 > ns3113832.ip-54-38-177.eu.8333: tcp 0
08:31:22.910326 IP tom-Latitude-3570.42516 > 2.56.9.15.8333: tcp 24
08:31:22.911132 IP tom-Latitude-3570.42516 > 2.56.9.15.8333: tcp 793
08:31:23.069935 IP 2.56.9.15.8333 > tom-Latitude-3570.42516: tcp 0
08:31:23.069949 IP 2.56.9.15.8333 > tom-Latitude-3570.42516: tcp 0
08:31:23.211349 IP tom-Latitude-3570.60988 > 81.198.101.144.8333: tcp 24
08:31:23.213645 IP tom-Latitude-3570.60988 > 81.198.101.144.8333: tcp 31
08:31:23.241995 IP 81.198.101.144.8333 > tom-Latitude-3570.60988: tcp 0
08:31:23.250859 IP 81.198.101.144.8333 > tom-Latitude-3570.60988: tcp 0
08:31:23.813650 IP tom-Latitude-3570.46284 > static-87-75-105-186.vodafonexdsl.co.uk.8333: tcp 24
08:31:23.813671 IP tom-Latitude-3570.46284 > static-87-75-105-186.vodafonexdsl.co.uk.8333: tcp 1189
08:31:23.854286 IP static-87-75-105-186.vodafonexdsl.co.uk.8333 > tom-Latitude-3570.46284: tcp 0
08:31:24.196200 IP bb42-60-217-183.singnet.com.sg.8333 > tom-Latitude-3570.60470: tcp 24
08:31:24.201769 IP bb42-60-217-183.singnet.com.sg.8333 > tom-Latitude-3570.60470: tcp 1009
08:31:24.201879 IP tom-Latitude-3570.60470 > bb42-60-217-183.singnet.com.sg.8333: tcp 0
08:31:24.202191 IP tom-Latitude-3570.60470 > bb42-60-217-183.singnet.com.sg.8333: tcp 24
08:31:24.203502 IP tom-Latitude-3570.60470 > bb42-60-217-183.singnet.com.sg.8333: tcp 145
08:31:24.240722 IP bb42-60-217-183.singnet.com.sg.8333 > tom-Latitude-3570.60470: tcp 0
08:31:24.240731 IP bb42-60-217-183.singnet.com.sg.8333 > tom-Latitude-3570.60470: tcp 0
08:31:24.703801 IP tom-Latitude-3570.56714 > ns3113832.ip-54-38-177.eu.8333: tcp 24
08:31:24.703850 IP tom-Latitude-3570.57976 > 167.99.216.145.8333: tcp 24
08:31:24.705205 IP tom-Latitude-3570.56714 > ns3113832.ip-54-38-177.eu.8333: tcp 145
08:31:24.705981 IP ns3113832.ip-54-38-177.eu.8333 > tom-Latitude-3570.56714: tcp 24
08:31:24.706003 IP ns3113832.ip-54-38-177.eu.8333 > tom-Latitude-3570.56714: tcp 61
08:31:24.706006 IP bb42-60-217-183.singnet.com.sg.8333 > tom-Latitude-3570.60470: tcp 24
08:31:24.706010 IP bb42-60-217-183.singnet.com.sg.8333 > tom-Latitude-3570.60470: tcp 283
08:31:24.706031 IP bb42-60-217-183.singnet.com.sg.8333 > tom-Latitude-3570.60470: tcp 24
08:31:24.706033 IP bb42-60-217-183.singnet.com.sg.8333 > tom-Latitude-3570.60470: tcp 283
08:31:24.706036 IP bb42-60-217-183.singnet.com.sg.8333 > tom-Latitude-3570.60470: tcp 24
08:31:24.706038 IP bb42-60-217-183.singnet.com.sg.8333 > tom-Latitude-3570.60470: tcp 283
08:31:24.706040 IP bb42-60-217-183.singnet.com.sg.8333 > tom-Latitude-3570.60470: tcp 24
08:31:24.706043 IP bb42-60-217-183.singnet.com.sg.8333 > tom-Latitude-3570.60470: tcp 284
08:31:24.706095 IP tom-Latitude-3570.56714 > ns3113832.ip-54-38-177.eu.8333: tcp 0
08:31:24.706126 IP tom-Latitude-3570.60470 > bb42-60-217-183.singnet.com.sg.8333: tcp 0
08:31:24.706742 IP tom-Latitude-3570.57976 > 167.99.216.145.8333: tcp 31
08:31:24.740556 IP ns3113832.ip-54-38-177.eu.8333 > tom-Latitude-3570.56714: tcp 0
08:31:24.741373 IP ns3113832.ip-54-38-177.eu.8333 > tom-Latitude-3570.56714: tcp 0
08:31:24.741378 IP 167.99.216.145.8333 > tom-Latitude-3570.57976: tcp 0
08:31:24.741382 IP 167.99.216.145.8333 > tom-Latitude-3570.57976: tcp 0
08:31:25.008490 IP tom-Latitude-3570.42516 > 2.56.9.15.8333: tcp 24
08:31:25.051037 IP tom-Latitude-3570.42516 > 2.56.9.15.8333: tcp 145
08:31:25.102239 IP 2.56.9.15.8333 > tom-Latitude-3570.42516: tcp 0
08:31:25.108714 IP tom-Latitude-3570.49070 > c-185-45-236-223.customer.ggaweb.ch.8333: tcp 24
08:31:25.109657 IP tom-Latitude-3570.49070 > c-185-45-236-223.customer.ggaweb.ch.8333: tcp 145
08:31:25.110175 IP 2.56.9.15.8333 > tom-Latitude-3570.42516: tcp 0
08:31:25.142276 IP c-185-45-236-223.customer.ggaweb.ch.8333 > tom-Latitude-3570.49070: tcp 0
08:31:25.142291 IP c-185-45-236-223.customer.ggaweb.ch.8333 > tom-Latitude-3570.49070: tcp 0
08:31:25.309608 IP tom-Latitude-3570.57976 > 167.99.216.145.8333: tcp 24
08:31:25.309628 IP tom-Latitude-3570.57976 > 167.99.216.145.8333: tcp 1045
08:31:25.342549 IP 167.99.216.145.8333 > tom-Latitude-3570.57976: tcp 0
08:31:25.350464 IP 167.99.216.145.8333 > tom-Latitude-3570.57976: tcp 0
08:31:25.510374 IP tom-Latitude-3570.56714 > ns3113832.ip-54-38-177.eu.8333: tcp 24
08:31:25.512619 IP tom-Latitude-3570.56714 > ns3113832.ip-54-38-177.eu.8333: tcp 145
08:31:25.550227 IP ns3113832.ip-54-38-177.eu.8333 > tom-Latitude-3570.56714: tcp 0
08:31:25.553485 IP ns3113832.ip-54-38-177.eu.8333 > tom-Latitude-3570.56714: tcp 0
08:31:25.711304 IP tom-Latitude-3570.60988 > 81.198.101.144.8333: tcp 24
08:31:25.711324 IP tom-Latitude-3570.60988 > 81.198.101.144.8333: tcp 1045
08:31:25.720913 IP 2.56.9.15.8333 > tom-Latitude-3570.42516: tcp 24
08:31:25.728926 IP 2.56.9.15.8333 > tom-Latitude-3570.42516: tcp 109
08:31:25.729056 IP tom-Latitude-3570.42516 > 2.56.9.15.8333: tcp 0
08:31:25.729205 IP tom-Latitude-3570.42516 > 2.56.9.15.8333: tcp 24
08:31:25.731317 IP 81.198.101.144.8333 > tom-Latitude-3570.60988: tcp 0
08:31:25.732962 IP tom-Latitude-3570.42516 > 2.56.9.15.8333: tcp 109
08:31:25.740385 IP 81.198.101.144.8333 > tom-Latitude-3570.60988: tcp 0
08:31:25.761779 IP 2.56.9.15.8333 > tom-Latitude-3570.42516: tcp 0
08:31:25.763996 IP 2.56.9.15.8333 > tom-Latitude-3570.42516: tcp 0
08:31:25.829584 IP tom-Latitude-3570.60988 > 81.198.101.144.8333: tcp 24
08:31:25.833004 IP tom-Latitude-3570.60988 > 81.198.101.144.8333: tcp 31
08:31:25.855332 IP 2.56.9.15.8333 > tom-Latitude-3570.42516: tcp 24
08:31:25.856810 IP 2.56.9.15.8333 > tom-Latitude-3570.42516: tcp 223
08:31:25.856827 IP 2.56.9.15.8333 > tom-Latitude-3570.42516: tcp 24
08:31:25.856829 IP 2.56.9.15.8333 > tom-Latitude-3570.42516: tcp 249
08:31:25.856831 IP 2.56.9.15.8333 > tom-Latitude-3570.42516: tcp 24
08:31:25.856833 IP 2.56.9.15.8333 > tom-Latitude-3570.42516: tcp 256
08:31:25.856927 IP tom-Latitude-3570.42516 > 2.56.9.15.8333: tcp 0
08:31:25.862370 IP 81.198.101.144.8333 > tom-Latitude-3570.60988: tcp 0
08:31:25.867215 IP 81.198.101.144.8333 > tom-Latitude-3570.60988: tcp 0
08:31:25.958367 IP tom-Latitude-3570.60988 > 81.198.101.144.8333: tcp 24
08:31:25.959308 IP tom-Latitude-3570.60988 > 81.198.101.144.8333: tcp 109
08:31:25.982261 IP 81.198.101.144.8333 > tom-Latitude-3570.60988: tcp 0
08:31:25.990189 IP 81.198.101.144.8333 > tom-Latitude-3570.60988: tcp 0
08:31:26.459811 IP tom-Latitude-3570.39110 > vmi195435.contaboserver.net.8333: tcp 24
08:31:26.463783 IP tom-Latitude-3570.39110 > vmi195435.contaboserver.net.8333: tcp 8
08:31:26.466275 IP bb42-60-217-183.singnet.com.sg.8333 > tom-Latitude-3570.60470: tcp 24
08:31:26.466294 IP bb42-60-217-183.singnet.com.sg.8333 > tom-Latitude-3570.60470: tcp 109
08:31:26.466385 IP tom-Latitude-3570.60470 > bb42-60-217-183.singnet.com.sg.8333: tcp 0
08:31:26.482299 IP vmi195435.contaboserver.net.8333 > tom-Latitude-3570.39110: tcp 0
08:31:26.501110 IP vmi195435.contaboserver.net.8333 > tom-Latitude-3570.39110: tcp 0
08:31:26.531318 IP c-185-45-236-223.customer.ggaweb.ch.8333 > tom-Latitude-3570.49070: tcp 24
08:31:26.532056 IP c-185-45-236-223.customer.ggaweb.ch.8333 > tom-Latitude-3570.49070: tcp 8
08:31:26.532183 IP tom-Latitude-3570.49070 > c-185-45-236-223.customer.ggaweb.ch.8333: tcp 0
08:31:26.532263 IP tom-Latitude-3570.49070 > c-185-45-236-223.customer.ggaweb.ch.8333: tcp 24
08:31:26.533839 IP tom-Latitude-3570.49070 > c-185-45-236-223.customer.ggaweb.ch.8333: tcp 8
08:31:26.570494 IP c-185-45-236-223.customer.ggaweb.ch.8333 > tom-Latitude-3570.49070: tcp 0
08:31:26.570509 IP c-185-45-236-223.customer.ggaweb.ch.8333 > tom-Latitude-3570.49070: tcp 0
08:31:26.578292 IP vmi195435.contaboserver.net.8333 > tom-Latitude-3570.39110: tcp 24
08:31:26.578309 IP tom-Latitude-3570.39110 > vmi195435.contaboserver.net.8333: tcp 0
08:31:26.578973 IP vmi195435.contaboserver.net.8333 > tom-Latitude-3570.39110: tcp 8
08:31:26.578991 IP tom-Latitude-3570.39110 > vmi195435.contaboserver.net.8333: tcp 0
08:31:26.880459 IP tom-Latitude-3570.39110 > vmi195435.contaboserver.net.8333: tcp 24
08:31:26.880480 IP tom-Latitude-3570.39110 > vmi195435.contaboserver.net.8333: tcp 1153
08:31:26.932927 IP vmi195435.contaboserver.net.8333 > tom-Latitude-3570.39110: tcp 0
08:31:26.940115 IP vmi195435.contaboserver.net.8333 > tom-Latitude-3570.39110: tcp 0
08:31:27.281626 IP tom-Latitude-3570.49070 > c-185-45-236-223.customer.ggaweb.ch.8333: tcp 24
08:31:27.283889 IP tom-Latitude-3570.49070 > c-185-45-236-223.customer.ggaweb.ch.8333: tcp 109
08:31:27.314091 IP c-185-45-236-223.customer.ggaweb.ch.8333 > tom-Latitude-3570.49070: tcp 0
08:31:27.349809 IP c-185-45-236-223.customer.ggaweb.ch.8333 > tom-Latitude-3570.49070: tcp 0
08:31:27.984042 IP tom-Latitude-3570.57976 > 167.99.216.145.8333: tcp 24
08:31:27.986093 IP tom-Latitude-3570.57976 > 167.99.216.145.8333: tcp 109
08:31:28.037429 IP 167.99.216.145.8333 > tom-Latitude-3570.57976: tcp 0
08:31:28.041072 IP 167.99.216.145.8333 > tom-Latitude-3570.57976: tcp 0
08:31:28.189298 IP ns3113832.ip-54-38-177.eu.8333 > tom-Latitude-3570.56714: tcp 24
08:31:28.189319 IP ns3113832.ip-54-38-177.eu.8333 > tom-Latitude-3570.56714: tcp 361
08:31:28.189409 IP tom-Latitude-3570.56714 > ns3113832.ip-54-38-177.eu.8333: tcp 0
08:31:28.189632 IP tom-Latitude-3570.56714 > ns3113832.ip-54-38-177.eu.8333: tcp 24
08:31:28.190782 IP tom-Latitude-3570.56714 > ns3113832.ip-54-38-177.eu.8333: tcp 253
08:31:28.230276 IP ns3113832.ip-54-38-177.eu.8333 > tom-Latitude-3570.56714: tcp 0
08:31:28.230963 IP ns3113832.ip-54-38-177.eu.8333 > tom-Latitude-3570.56714: tcp 0
08:31:28.289750 IP ns3113832.ip-54-38-177.eu.8333 > tom-Latitude-3570.56714: tcp 24
08:31:28.289758 IP ns3113832.ip-54-38-177.eu.8333 > tom-Latitude-3570.56714: tcp 369
08:31:28.289761 IP ns3113832.ip-54-38-177.eu.8333 > tom-Latitude-3570.56714: tcp 24
08:31:28.289769 IP tom-Latitude-3570.56714 > ns3113832.ip-54-38-177.eu.8333: tcp 0
08:31:28.290006 IP ns3113832.ip-54-38-177.eu.8333 > tom-Latitude-3570.56714: tcp 404
08:31:28.290012 IP ns3113832.ip-54-38-177.eu.8333 > tom-Latitude-3570.56714: tcp 24
08:31:28.290015 IP ns3113832.ip-54-38-177.eu.8333 > tom-Latitude-3570.56714: tcp 373
08:31:28.290017 IP ns3113832.ip-54-38-177.eu.8333 > tom-Latitude-3570.56714: tcp 24
08:31:28.290019 IP ns3113832.ip-54-38-177.eu.8333 > tom-Latitude-3570.56714: tcp 247
08:31:28.290026 IP tom-Latitude-3570.56714 > ns3113832.ip-54-38-177.eu.8333: tcp 0
08:31:28.291869 IP ns3113832.ip-54-38-177.eu.8333 > tom-Latitude-3570.56714: tcp 24
08:31:28.291874 IP ns3113832.ip-54-38-177.eu.8333 > tom-Latitude-3570.56714: tcp 224
08:31:28.291957 IP tom-Latitude-3570.56714 > ns3113832.ip-54-38-177.eu.8333: tcp 0
08:31:28.354821 IP ns3113832.ip-54-38-177.eu.8333 > tom-Latitude-3570.56714: tcp 612
08:31:28.395907 IP tom-Latitude-3570.56714 > ns3113832.ip-54-38-177.eu.8333: tcp 0
08:31:28.756681 IP tom-Latitude-3570.49070 > c-185-45-236-223.customer.ggaweb.ch.8333: tcp 24
08:31:28.758973 IP tom-Latitude-3570.49070 > c-185-45-236-223.customer.ggaweb.ch.8333: tcp 253
08:31:28.761582 IP c-185-45-236-223.customer.ggaweb.ch.8333 > tom-Latitude-3570.49070: tcp 24
08:31:28.761604 IP c-185-45-236-223.customer.ggaweb.ch.8333 > tom-Latitude-3570.49070: tcp 433
08:31:28.761608 IP static-87-75-105-186.vodafonexdsl.co.uk.8333 > tom-Latitude-3570.46284: tcp 24
08:31:28.761636 IP tom-Latitude-3570.46284 > static-87-75-105-186.vodafonexdsl.co.uk.8333: tcp 0
08:31:28.761650 IP static-87-75-105-186.vodafonexdsl.co.uk.8333 > tom-Latitude-3570.46284: tcp 685
08:31:28.761653 IP tom-Latitude-3570.46284 > static-87-75-105-186.vodafonexdsl.co.uk.8333: tcp 0
08:31:28.761658 IP c-185-45-236-223.customer.ggaweb.ch.8333 > tom-Latitude-3570.49070: tcp 433
08:31:28.761661 IP tom-Latitude-3570.49070 > c-185-45-236-223.customer.ggaweb.ch.8333: tcp 0
08:31:28.761908 IP tom-Latitude-3570.49070 > c-185-45-236-223.customer.ggaweb.ch.8333: tcp 24
08:31:28.761926 IP tom-Latitude-3570.49070 > c-185-45-236-223.customer.ggaweb.ch.8333: tcp 181
08:31:28.808570 IP c-185-45-236-223.customer.ggaweb.ch.8333 > tom-Latitude-3570.49070: tcp 0
08:31:28.808578 IP c-185-45-236-223.customer.ggaweb.ch.8333 > tom-Latitude-3570.49070: tcp 0
08:31:28.808581 IP c-185-45-236-223.customer.ggaweb.ch.8333 > tom-Latitude-3570.49070: tcp 0
08:31:28.809181 IP c-185-45-236-223.customer.ggaweb.ch.8333 > tom-Latitude-3570.49070: tcp 0
08:31:28.862262 IP tom-Latitude-3570.39110 > vmi195435.contaboserver.net.8333: tcp 24
08:31:28.891106 IP tom-Latitude-3570.39110 > vmi195435.contaboserver.net.8333: tcp 253
08:31:28.894062 IP c-185-45-236-223.customer.ggaweb.ch.8333 > tom-Latitude-3570.49070: tcp 24
08:31:28.894987 IP c-185-45-236-223.customer.ggaweb.ch.8333 > tom-Latitude-3570.49070: tcp 224
08:31:28.895115 IP tom-Latitude-3570.49070 > c-185-45-236-223.customer.ggaweb.ch.8333: tcp 0
08:31:28.897766 IP c-185-45-236-223.customer.ggaweb.ch.8333 > tom-Latitude-3570.49070: tcp 24
08:31:28.898638 IP c-185-45-236-223.customer.ggaweb.ch.8333 > tom-Latitude-3570.49070: tcp 1448
08:31:28.898754 IP tom-Latitude-3570.49070 > c-185-45-236-223.customer.ggaweb.ch.8333: tcp 0
08:31:28.905108 IP c-185-45-236-223.customer.ggaweb.ch.8333 > tom-Latitude-3570.49070: tcp 1448
08:31:28.905226 IP tom-Latitude-3570.49070 > c-185-45-236-223.customer.ggaweb.ch.8333: tcp 0
08:31:28.910390 IP c-185-45-236-223.customer.ggaweb.ch.8333 > tom-Latitude-3570.49070: tcp 1448
08:31:28.910518 IP tom-Latitude-3570.49070 > c-185-45-236-223.customer.ggaweb.ch.8333: tcp 0
08:31:28.911305 IP c-185-45-236-223.customer.ggaweb.ch.8333 > tom-Latitude-3570.49070: tcp 1448
08:31:28.911325 IP c-185-45-236-223.customer.ggaweb.ch.8333 > tom-Latitude-3570.49070: tcp 1448
08:31:28.911330 IP c-185-45-236-223.customer.ggaweb.ch.8333 > tom-Latitude-3570.49070: tcp 1448
08:31:28.911333 IP c-185-45-236-223.customer.ggaweb.ch.8333 > tom-Latitude-3570.49070: tcp 1448
08:31:28.911418 IP tom-Latitude-3570.49070 > c-185-45-236-223.customer.ggaweb.ch.8333: tcp 0
08:31:28.933137 IP vmi195435.contaboserver.net.8333 > tom-Latitude-3570.39110: tcp 0
08:31:28.939715 IP vmi195435.contaboserver.net.8333 > tom-Latitude-3570.39110: tcp 0
08:31:28.979613 IP c-185-45-236-223.customer.ggaweb.ch.8333 > tom-Latitude-3570.49070: tcp 1382
08:31:28.980388 IP c-185-45-236-223.customer.ggaweb.ch.8333 > tom-Latitude-3570.49070: tcp 66
08:31:28.980405 IP tom-Latitude-3570.49070 > c-185-45-236-223.customer.ggaweb.ch.8333: tcp 0
08:31:28.987802 IP c-185-45-236-223.customer.ggaweb.ch.8333 > tom-Latitude-3570.49070: tcp 1448
08:31:28.987825 IP c-185-45-236-223.customer.ggaweb.ch.8333 > tom-Latitude-3570.49070: tcp 708
08:31:28.987914 IP tom-Latitude-3570.49070 > c-185-45-236-223.customer.ggaweb.ch.8333: tcp 0
08:31:29.105607 IP tom-Latitude-3570.39110 > vmi195435.contaboserver.net.8333: tcp 24
08:31:29.105712 IP tom-Latitude-3570.60470 > bb42-60-217-183.singnet.com.sg.8333: tcp 24
08:31:29.108749 IP tom-Latitude-3570.39110 > vmi195435.contaboserver.net.8333: tcp 181
08:31:29.109635 IP tom-Latitude-3570.60470 > bb42-60-217-183.singnet.com.sg.8333: tcp 433
08:31:29.132545 IP vmi195435.contaboserver.net.8333 > tom-Latitude-3570.39110: tcp 0
08:31:29.149703 IP vmi195435.contaboserver.net.8333 > tom-Latitude-3570.39110: tcp 0
08:31:29.151751 IP bb42-60-217-183.singnet.com.sg.8333 > tom-Latitude-3570.60470: tcp 0
08:31:29.152296 IP bb42-60-217-183.singnet.com.sg.8333 > tom-Latitude-3570.60470: tcp 0
08:31:29.622998 IP 2.56.9.15.8333 > tom-Latitude-3570.42516: tcp 24
08:31:29.623017 IP 2.56.9.15.8333 > tom-Latitude-3570.42516: tcp 8
08:31:29.623107 IP tom-Latitude-3570.42516 > 2.56.9.15.8333: tcp 0
08:31:29.623195 IP tom-Latitude-3570.42516 > 2.56.9.15.8333: tcp 24
08:31:29.625093 IP tom-Latitude-3570.42516 > 2.56.9.15.8333: tcp 8
08:31:29.660936 IP 2.56.9.15.8333 > tom-Latitude-3570.42516: tcp 0
08:31:29.661592 IP 2.56.9.15.8333 > tom-Latitude-3570.42516: tcp 0
08:31:29.679145 IP 81.198.101.144.8333 > tom-Latitude-3570.60988: tcp 24
08:31:29.679170 IP tom-Latitude-3570.60988 > 81.198.101.144.8333: tcp 0
08:31:29.679203 IP 81.198.101.144.8333 > tom-Latitude-3570.60988: tcp 469
08:31:29.679208 IP tom-Latitude-3570.60988 > 81.198.101.144.8333: tcp 0
08:31:29.679457 IP tom-Latitude-3570.60988 > 81.198.101.144.8333: tcp 24
08:31:29.681293 IP tom-Latitude-3570.60988 > 81.198.101.144.8333: tcp 37
08:31:29.722876 IP 81.198.101.144.8333 > tom-Latitude-3570.60988: tcp 0
08:31:29.723477 IP 81.198.101.144.8333 > tom-Latitude-3570.60988: tcp 0
08:31:29.810986 IP 81.198.101.144.8333 > tom-Latitude-3570.60988: tcp 24
08:31:29.811788 IP 81.198.101.144.8333 > tom-Latitude-3570.60988: tcp 226
08:31:29.811902 IP tom-Latitude-3570.60988 > 81.198.101.144.8333: tcp 0
08:31:30.012865 IP tom-Latitude-3570.56714 > ns3113832.ip-54-38-177.eu.8333: tcp 24
08:31:30.015180 IP tom-Latitude-3570.56714 > ns3113832.ip-54-38-177.eu.8333: tcp 217
08:31:30.042881 IP ns3113832.ip-54-38-177.eu.8333 > tom-Latitude-3570.56714: tcp 0
08:31:30.050825 IP ns3113832.ip-54-38-177.eu.8333 > tom-Latitude-3570.56714: tcp 0
08:31:30.121210 IP 81.198.101.144.8333 > tom-Latitude-3570.60988: tcp 24
08:31:30.163884 IP tom-Latitude-3570.60988 > 81.198.101.144.8333: tcp 0
08:31:30.614969 IP tom-Latitude-3570.42516 > 2.56.9.15.8333: tcp 24
08:31:30.689554 IP tom-Latitude-3570.42516 > 2.56.9.15.8333: tcp 469
08:31:30.710106 IP 81.198.101.144.8333 > tom-Latitude-3570.60988: tcp 37
08:31:30.710124 IP tom-Latitude-3570.60988 > 81.198.101.144.8333: tcp 0
08:31:30.710343 IP tom-Latitude-3570.60988 > 81.198.101.144.8333: tcp 24
08:31:30.712982 IP tom-Latitude-3570.60988 > 81.198.101.144.8333: tcp 37
08:31:30.723231 IP 2.56.9.15.8333 > tom-Latitude-3570.42516: tcp 0
08:31:30.751439 IP 2.56.9.15.8333 > tom-Latitude-3570.42516: tcp 0
08:31:30.752009 IP 81.198.101.144.8333 > tom-Latitude-3570.60988: tcp 0
08:31:30.752024 IP 81.198.101.144.8333 > tom-Latitude-3570.60988: tcp 0
08:31:30.841000 IP 81.198.101.144.8333 > tom-Latitude-3570.60988: tcp 24
08:31:30.841019 IP 81.198.101.144.8333 > tom-Latitude-3570.60988: tcp 224
08:31:30.841131 IP tom-Latitude-3570.60988 > 81.198.101.144.8333: tcp 0
08:31:31.142527 IP tom-Latitude-3570.46284 > static-87-75-105-186.vodafonexdsl.co.uk.8333: tcp 24
08:31:31.144961 IP tom-Latitude-3570.46284 > static-87-75-105-186.vodafonexdsl.co.uk.8333: tcp 73
08:31:31.190998 IP static-87-75-105-186.vodafonexdsl.co.uk.8333 > tom-Latitude-3570.46284: tcp 0
08:31:31.443568 IP tom-Latitude-3570.39110 > vmi195435.contaboserver.net.8333: tcp 24
08:31:31.451204 IP tom-Latitude-3570.39110 > vmi195435.contaboserver.net.8333: tcp 73
08:31:31.483934 IP vmi195435.contaboserver.net.8333 > tom-Latitude-3570.39110: tcp 0
08:31:31.490875 IP vmi195435.contaboserver.net.8333 > tom-Latitude-3570.39110: tcp 0
08:31:31.644301 IP tom-Latitude-3570.42516 > 2.56.9.15.8333: tcp 24
08:31:31.646511 IP tom-Latitude-3570.42516 > 2.56.9.15.8333: tcp 37
08:31:31.673034 IP 2.56.9.15.8333 > tom-Latitude-3570.42516: tcp 0
08:31:31.681030 IP 2.56.9.15.8333 > tom-Latitude-3570.42516: tcp 0
08:31:31.710080 IP 81.198.101.144.8333 > tom-Latitude-3570.60988: tcp 24
08:31:31.710738 IP 81.198.101.144.8333 > tom-Latitude-3570.60988: tcp 217
08:31:31.710868 IP tom-Latitude-3570.60988 > 81.198.101.144.8333: tcp 0
08:31:31.710950 IP tom-Latitude-3570.49070 > c-185-45-236-223.customer.ggaweb.ch.8333: tcp 24
08:31:31.711079 IP tom-Latitude-3570.60988 > 81.198.101.144.8333: tcp 24
08:31:31.712411 IP tom-Latitude-3570.49070 > c-185-45-236-223.customer.ggaweb.ch.8333: tcp 8
08:31:31.713058 IP tom-Latitude-3570.60988 > 81.198.101.144.8333: tcp 217
08:31:31.799905 IP tom-Latitude-3570.60988 > 81.198.101.144.8333: tcp 217
08:31:31.823904 IP tom-Latitude-3570.49070 > c-185-45-236-223.customer.ggaweb.ch.8333: tcp 8
08:31:31.875266 IP 81.198.101.144.8333 > tom-Latitude-3570.60988: tcp 0
08:31:31.875280 IP c-185-45-236-223.customer.ggaweb.ch.8333 > tom-Latitude-3570.49070: tcp 0
08:31:31.875283 IP 81.198.101.144.8333 > tom-Latitude-3570.60988: tcp 0
08:31:31.875286 IP c-185-45-236-223.customer.ggaweb.ch.8333 > tom-Latitude-3570.49070: tcp 0
08:31:31.875287 IP c-185-45-236-223.customer.ggaweb.ch.8333 > tom-Latitude-3570.49070: tcp 24
08:31:31.875295 IP c-185-45-236-223.customer.ggaweb.ch.8333 > tom-Latitude-3570.49070: tcp 8
08:31:31.875297 IP 81.198.101.144.8333 > tom-Latitude-3570.60988: tcp 24
08:31:31.875301 IP 81.198.101.144.8333 > tom-Latitude-3570.60988: tcp 612
08:31:31.875305 IP 81.198.101.144.8333 > tom-Latitude-3570.60988: tcp 24
08:31:31.875306 IP 81.198.101.144.8333 > tom-Latitude-3570.60988: tcp 225
08:31:31.875326 IP 81.198.101.144.8333 > tom-Latitude-3570.60988: tcp 24
08:31:31.875389 IP tom-Latitude-3570.49070 > c-185-45-236-223.customer.ggaweb.ch.8333: tcp 0
08:31:31.875418 IP tom-Latitude-3570.60988 > 81.198.101.144.8333: tcp 0
08:31:31.875492 IP 81.198.101.144.8333 > tom-Latitude-3570.60988: tcp 373
08:31:31.875502 IP 81.198.101.144.8333 > tom-Latitude-3570.60988: tcp 24
08:31:31.875506 IP 81.198.101.144.8333 > tom-Latitude-3570.60988: tcp 338
08:31:31.875509 IP 81.198.101.144.8333 > tom-Latitude-3570.60988: tcp 24
08:31:31.875511 IP 81.198.101.144.8333 > tom-Latitude-3570.60988: tcp 247
08:31:31.875514 IP 81.198.101.144.8333 > tom-Latitude-3570.60988: tcp 24
08:31:31.875523 IP 81.198.101.144.8333 > tom-Latitude-3570.60988: tcp 226
08:31:31.875528 IP vmi195435.contaboserver.net.8333 > tom-Latitude-3570.39110: tcp 24
08:31:31.875536 IP tom-Latitude-3570.60988 > 81.198.101.144.8333: tcp 0
08:31:31.875539 IP vmi195435.contaboserver.net.8333 > tom-Latitude-3570.39110: tcp 8
08:31:31.875559 IP tom-Latitude-3570.39110 > vmi195435.contaboserver.net.8333: tcp 0
08:31:31.875561 IP tom-Latitude-3570.39110 > vmi195435.contaboserver.net.8333: tcp 0
08:31:31.875865 IP tom-Latitude-3570.39110 > vmi195435.contaboserver.net.8333: tcp 24
08:31:31.884604 IP tom-Latitude-3570.39110 > vmi195435.contaboserver.net.8333: tcp 8
08:31:31.907948 IP ns3113832.ip-54-38-177.eu.8333 > tom-Latitude-3570.56714: tcp 24
08:31:31.907960 IP tom-Latitude-3570.56714 > ns3113832.ip-54-38-177.eu.8333: tcp 0
08:31:31.908610 IP ns3113832.ip-54-38-177.eu.8333 > tom-Latitude-3570.56714: tcp 8
08:31:31.908615 IP tom-Latitude-3570.56714 > ns3113832.ip-54-38-177.eu.8333: tcp 0
08:31:31.908670 IP tom-Latitude-3570.56714 > ns3113832.ip-54-38-177.eu.8333: tcp 24
08:31:31.910634 IP tom-Latitude-3570.56714 > ns3113832.ip-54-38-177.eu.8333: tcp 8
08:31:31.915911 IP tom-Latitude-3570.60988 > 81.198.101.144.8333: tcp 0
08:31:31.929337 IP 81.198.101.144.8333 > tom-Latitude-3570.60988: tcp 0
08:31:31.929962 IP c-185-45-236-223.customer.ggaweb.ch.8333 > tom-Latitude-3570.49070: tcp 0
08:31:31.929975 IP vmi195435.contaboserver.net.8333 > tom-Latitude-3570.39110: tcp 0
08:31:31.929980 IP vmi195435.contaboserver.net.8333 > tom-Latitude-3570.39110: tcp 0
08:31:31.949014 IP ns3113832.ip-54-38-177.eu.8333 > tom-Latitude-3570.56714: tcp 0
08:31:31.949682 IP ns3113832.ip-54-38-177.eu.8333 > tom-Latitude-3570.56714: tcp 0
08:31:32.109501 IP tom-Latitude-3570.57976 > 167.99.216.145.8333: tcp 24
08:31:32.111793 IP tom-Latitude-3570.57976 > 167.99.216.145.8333: tcp 721
08:31:32.132051 IP 167.99.216.145.8333 > tom-Latitude-3570.57976: tcp 0
08:31:32.139727 IP 167.99.216.145.8333 > tom-Latitude-3570.57976: tcp 0
08:31:32.204445 IP vmi195435.contaboserver.net.8333 > tom-Latitude-3570.39110: tcp 24
08:31:32.204466 IP vmi195435.contaboserver.net.8333 > tom-Latitude-3570.39110: tcp 469
08:31:32.204551 IP tom-Latitude-3570.39110 > vmi195435.contaboserver.net.8333: tcp 0
08:31:32.204771 IP tom-Latitude-3570.39110 > vmi195435.contaboserver.net.8333: tcp 24
08:31:32.206259 IP tom-Latitude-3570.39110 > vmi195435.contaboserver.net.8333: tcp 253
08:31:32.242024 IP vmi195435.contaboserver.net.8333 > tom-Latitude-3570.39110: tcp 0
08:31:32.242612 IP vmi195435.contaboserver.net.8333 > tom-Latitude-3570.39110: tcp 0
08:31:32.304900 IP tom-Latitude-3570.49070 > c-185-45-236-223.customer.ggaweb.ch.8333: tcp 24
08:31:32.305704 IP tom-Latitude-3570.49070 > c-185-45-236-223.customer.ggaweb.ch.8333: tcp 31
08:31:32.319568 IP vmi195435.contaboserver.net.8333 > tom-Latitude-3570.39110: tcp 24
08:31:32.320622 IP vmi195435.contaboserver.net.8333 > tom-Latitude-3570.39110: tcp 495
08:31:32.320640 IP vmi195435.contaboserver.net.8333 > tom-Latitude-3570.39110: tcp 24
08:31:32.320643 IP vmi195435.contaboserver.net.8333 > tom-Latitude-3570.39110: tcp 225
08:31:32.320646 IP vmi195435.contaboserver.net.8333 > tom-Latitude-3570.39110: tcp 24
08:31:32.320648 IP vmi195435.contaboserver.net.8333 > tom-Latitude-3570.39110: tcp 631
08:31:32.320650 IP vmi195435.contaboserver.net.8333 > tom-Latitude-3570.39110: tcp 24
08:31:32.320652 IP vmi195435.contaboserver.net.8333 > tom-Latitude-3570.39110: tcp 249
08:31:32.320672 IP vmi195435.contaboserver.net.8333 > tom-Latitude-3570.39110: tcp 24
08:31:32.320674 IP vmi195435.contaboserver.net.8333 > tom-Latitude-3570.39110: tcp 249
08:31:32.320733 IP tom-Latitude-3570.39110 > vmi195435.contaboserver.net.8333: tcp 0
08:31:32.331314 IP c-185-45-236-223.customer.ggaweb.ch.8333 > tom-Latitude-3570.49070: tcp 0
08:31:32.339763 IP c-185-45-236-223.customer.ggaweb.ch.8333 > tom-Latitude-3570.49070: tcp 0
