01:51:22.585972 IP tom-Latitude-3570.60988 > 81.198.101.144.8333: tcp 24
01:51:22.588253 IP tom-Latitude-3570.60988 > 81.198.101.144.8333: tcp 145
01:51:22.647071 IP 81.198.101.144.8333 > tom-Latitude-3570.60988: tcp 0
01:51:22.655745 IP 81.198.101.144.8333 > tom-Latitude-3570.60988: tcp 0
01:51:22.786728 IP tom-Latitude-3570.56714 > ns3113832.ip-54-38-177.eu.8333: tcp 24
01:51:22.788850 IP tom-Latitude-3570.56714 > ns3113832.ip-54-38-177.eu.8333: tcp 145
01:51:22.789423 IP 2.56.9.15.8333 > tom-Latitude-3570.42516: tcp 24
01:51:22.789444 IP 2.56.9.15.8333 > tom-Latitude-3570.42516: tcp 253
01:51:22.789488 IP tom-Latitude-3570.42516 > 2.56.9.15.8333: tcp 0
01:51:22.789745 IP tom-Latitude-3570.42516 > 2.56.9.15.8333: tcp 24
01:51:22.790809 IP tom-Latitude-3570.42516 > 2.56.9.15.8333: tcp 253
01:51:22.823989 IP ns3113832.ip-54-38-177.eu.8333 > tom-Latitude-3570.56714: tcp 0
01:51:22.824581 IP 2.56.9.15.8333 > tom-Latitude-3570.42516: tcp 0
01:51:22.918804 IP 2.56.9.15.8333 > tom-Latitude-3570.42516: tcp 24
01:51:22.919518 IP 2.56.9.15.8333 > tom-Latitude-3570.42516: tcp 371
01:51:22.919536 IP 2.56.9.15.8333 > tom-Latitude-3570.42516: tcp 24
01:51:22.919539 IP 2.56.9.15.8333 > tom-Latitude-3570.42516: tcp 223
01:51:22.919542 IP 2.56.9.15.8333 > tom-Latitude-3570.42516: tcp 24
01:51:22.919584 IP tom-Latitude-3570.42516 > 2.56.9.15.8333: tcp 0
01:51:22.927379 IP 2.56.9.15.8333 > tom-Latitude-3570.42516: tcp 440
01:51:22.927920 IP 2.56.9.15.8333 > tom-Latitude-3570.42516: tcp 24
01:51:22.927931 IP 2.56.9.15.8333 > tom-Latitude-3570.42516: tcp 225
01:51:22.927934 IP 2.56.9.15.8333 > tom-Latitude-3570.42516: tcp 24
01:51:22.927937 IP 2.56.9.15.8333 > tom-Latitude-3570.42516: tcp 247
01:51:22.927961 IP tom-Latitude-3570.42516 > 2.56.9.15.8333: tcp 0
01:51:23.016599 IP 2.56.9.15.8333 > tom-Latitude-3570.42516: tcp 498
01:51:23.016816 IP tom-Latitude-3570.39110 > vmi195435.contaboserver.net.8333: tcp 24
01:51:23.017636 IP tom-Latitude-3570.39110 > vmi195435.contaboserver.net.8333: tcp 181
01:51:23.047220 IP vmi195435.contaboserver.net.8333 > tom-Latitude-3570.39110: tcp 0
01:51:23.055216 IP vmi195435.contaboserver.net.8333 > tom-Latitude-3570.39110: tcp 0
01:51:23.059904 IP tom-Latitude-3570.42516 > 2.56.9.15.8333: tcp 0
01:51:23.120228 IP ns3113832.ip-54-38-177.eu.8333 > tom-Latitude-3570.56714: tcp 24
01:51:23.120894 IP ns3113832.ip-54-38-177.eu.8333 > tom-Latitude-3570.56714: tcp 325
01:51:23.120957 IP tom-Latitude-3570.56714 > ns3113832.ip-54-38-177.eu.8333: tcp 0
01:51:23.121189 IP tom-Latitude-3570.56714 > ns3113832.ip-54-38-177.eu.8333: tcp 24
01:51:23.122375 IP tom-Latitude-3570.56714 > ns3113832.ip-54-38-177.eu.8333: tcp 73
01:51:23.156367 IP ns3113832.ip-54-38-177.eu.8333 > tom-Latitude-3570.56714: tcp 0
01:51:23.213103 IP ns3113832.ip-54-38-177.eu.8333 > tom-Latitude-3570.56714: tcp 24
01:51:23.213852 IP ns3113832.ip-54-38-177.eu.8333 > tom-Latitude-3570.56714: tcp 225
01:51:23.213859 IP ns3113832.ip-54-38-177.eu.8333 > tom-Latitude-3570.56714: tcp 24
01:51:23.213862 IP ns3113832.ip-54-38-177.eu.8333 > tom-Latitude-3570.56714: tcp 226
01:51:23.213874 IP tom-Latitude-3570.56714 > ns3113832.ip-54-38-177.eu.8333: tcp 0
01:51:23.267152 IP c-185-45-236-223.customer.ggaweb.ch.8333 > tom-Latitude-3570.49070: tcp 24
01:51:23.270556 IP c-185-45-236-223.customer.ggaweb.ch.8333 > tom-Latitude-3570.49070: tcp 505
01:51:23.270617 IP tom-Latitude-3570.49070 > c-185-45-236-223.customer.ggaweb.ch.8333: tcp 0
01:51:23.270861 IP tom-Latitude-3570.49070 > c-185-45-236-223.customer.ggaweb.ch.8333: tcp 24
01:51:23.272139 IP tom-Latitude-3570.49070 > c-185-45-236-223.customer.ggaweb.ch.8333: tcp 37
01:51:23.305134 IP c-185-45-236-223.customer.ggaweb.ch.8333 > tom-Latitude-3570.49070: tcp 0
01:51:23.305739 IP c-185-45-236-223.customer.ggaweb.ch.8333 > tom-Latitude-3570.49070: tcp 0
01:51:23.388097 IP c-185-45-236-223.customer.ggaweb.ch.8333 > tom-Latitude-3570.49070: tcp 24
01:51:23.391857 IP c-185-45-236-223.customer.ggaweb.ch.8333 > tom-Latitude-3570.49070: tcp 374
01:51:23.391877 IP tom-Latitude-3570.49070 > c-185-45-236-223.customer.ggaweb.ch.8333: tcp 0
01:51:23.444205 IP static-87-75-105-186.vodafonexdsl.co.uk.8333 > tom-Latitude-3570.46284: tcp 24
01:51:23.457268 IP static-87-75-105-186.vodafonexdsl.co.uk.8333 > tom-Latitude-3570.46284: tcp 253
01:51:23.457332 IP tom-Latitude-3570.46284 > static-87-75-105-186.vodafonexdsl.co.uk.8333: tcp 0
01:51:23.658345 IP tom-Latitude-3570.60988 > 81.198.101.144.8333: tcp 24
01:51:23.658499 IP tom-Latitude-3570.60470 > bb42-60-217-183.singnet.com.sg.8333: tcp 24
01:51:23.696321 IP tom-Latitude-3570.60470 > bb42-60-217-183.singnet.com.sg.8333: tcp 865
01:51:23.696331 IP tom-Latitude-3570.60988 > 81.198.101.144.8333: tcp 361
01:51:23.726012 IP 81.198.101.144.8333 > tom-Latitude-3570.60988: tcp 0
01:51:23.738738 IP 81.198.101.144.8333 > tom-Latitude-3570.60988: tcp 0
01:51:23.738752 IP bb42-60-217-183.singnet.com.sg.8333 > tom-Latitude-3570.60470: tcp 0
01:51:23.758865 IP tom-Latitude-3570.39110 > vmi195435.contaboserver.net.8333: tcp 24
01:51:23.759806 IP tom-Latitude-3570.39110 > vmi195435.contaboserver.net.8333: tcp 181
01:51:23.785478 IP vmi195435.contaboserver.net.8333 > tom-Latitude-3570.39110: tcp 0
01:51:23.794291 IP vmi195435.contaboserver.net.8333 > tom-Latitude-3570.39110: tcp 0
01:51:24.059983 IP tom-Latitude-3570.42516 > 2.56.9.15.8333: tcp 24
01:51:24.062020 IP tom-Latitude-3570.42516 > 2.56.9.15.8333: tcp 109
01:51:24.113545 IP 2.56.9.15.8333 > tom-Latitude-3570.42516: tcp 0
01:51:24.360907 IP tom-Latitude-3570.56714 > ns3113832.ip-54-38-177.eu.8333: tcp 24
01:51:24.362961 IP tom-Latitude-3570.56714 > ns3113832.ip-54-38-177.eu.8333: tcp 37
01:51:24.406263 IP ns3113832.ip-54-38-177.eu.8333 > tom-Latitude-3570.56714: tcp 0
01:51:24.561625 IP tom-Latitude-3570.60470 > bb42-60-217-183.singnet.com.sg.8333: tcp 24
01:51:24.564373 IP tom-Latitude-3570.60470 > bb42-60-217-183.singnet.com.sg.8333: tcp 61
01:51:24.564898 IP 2.56.9.15.8333 > tom-Latitude-3570.42516: tcp 24
01:51:24.564923 IP tom-Latitude-3570.42516 > 2.56.9.15.8333: tcp 0
01:51:24.564938 IP 2.56.9.15.8333 > tom-Latitude-3570.42516: tcp 8
01:51:24.564941 IP tom-Latitude-3570.42516 > 2.56.9.15.8333: tcp 0
01:51:24.565084 IP tom-Latitude-3570.42516 > 2.56.9.15.8333: tcp 24
01:51:24.566192 IP tom-Latitude-3570.42516 > 2.56.9.15.8333: tcp 8
01:51:24.603249 IP bb42-60-217-183.singnet.com.sg.8333 > tom-Latitude-3570.60470: tcp 0
01:51:24.603915 IP 2.56.9.15.8333 > tom-Latitude-3570.42516: tcp 0
01:51:24.966558 IP tom-Latitude-3570.46284 > static-87-75-105-186.vodafonexdsl.co.uk.8333: tcp 24
01:51:24.968847 IP tom-Latitude-3570.46284 > static-87-75-105-186.vodafonexdsl.co.uk.8333: tcp 109
01:51:25.031314 IP ns3113832.ip-54-38-177.eu.8333 > tom-Latitude-3570.56714: tcp 24
01:51:25.031912 IP ns3113832.ip-54-38-177.eu.8333 > tom-Latitude-3570.56714: tcp 8
01:51:25.031928 IP static-87-75-105-186.vodafonexdsl.co.uk.8333 > tom-Latitude-3570.46284: tcp 0
01:51:25.031975 IP tom-Latitude-3570.56714 > ns3113832.ip-54-38-177.eu.8333: tcp 0
01:51:25.032108 IP tom-Latitude-3570.56714 > ns3113832.ip-54-38-177.eu.8333: tcp 24
01:51:25.034200 IP tom-Latitude-3570.56714 > ns3113832.ip-54-38-177.eu.8333: tcp 8
01:51:25.034728 IP static-87-75-105-186.vodafonexdsl.co.uk.8333 > tom-Latitude-3570.46284: tcp 0
01:51:25.044226 IP ns3113832.ip-54-38-177.eu.8333 > tom-Latitude-3570.56714: tcp 24
01:51:25.044888 IP ns3113832.ip-54-38-177.eu.8333 > tom-Latitude-3570.56714: tcp 181
01:51:25.044952 IP tom-Latitude-3570.56714 > ns3113832.ip-54-38-177.eu.8333: tcp 0
01:51:25.045172 IP tom-Latitude-3570.56714 > ns3113832.ip-54-38-177.eu.8333: tcp 24
01:51:25.045189 IP tom-Latitude-3570.56714 > ns3113832.ip-54-38-177.eu.8333: tcp 181
01:51:25.072760 IP ns3113832.ip-54-38-177.eu.8333 > tom-Latitude-3570.56714: tcp 0
01:51:25.075663 IP ns3113832.ip-54-38-177.eu.8333 > tom-Latitude-3570.56714: tcp 0
01:51:25.131941 IP ns3113832.ip-54-38-177.eu.8333 > tom-Latitude-3570.56714: tcp 24
01:51:25.132793 IP ns3113832.ip-54-38-177.eu.8333 > tom-Latitude-3570.56714: tcp 369
01:51:25.132800 IP ns3113832.ip-54-38-177.eu.8333 > tom-Latitude-3570.56714: tcp 24
01:51:25.132803 IP ns3113832.ip-54-38-177.eu.8333 > tom-Latitude-3570.56714: tcp 246
01:51:25.132805 IP ns3113832.ip-54-38-177.eu.8333 > tom-Latitude-3570.56714: tcp 24
01:51:25.132808 IP ns3113832.ip-54-38-177.eu.8333 > tom-Latitude-3570.56714: tcp 226
01:51:25.132811 IP ns3113832.ip-54-38-177.eu.8333 > tom-Latitude-3570.56714: tcp 24
01:51:25.132813 IP ns3113832.ip-54-38-177.eu.8333 > tom-Latitude-3570.56714: tcp 371
01:51:25.132815 IP ns3113832.ip-54-38-177.eu.8333 > tom-Latitude-3570.56714: tcp 24
01:51:25.132817 IP ns3113832.ip-54-38-177.eu.8333 > tom-Latitude-3570.56714: tcp 245
01:51:25.132821 IP tom-Latitude-3570.56714 > ns3113832.ip-54-38-177.eu.8333: tcp 0
01:51:25.132858 IP tom-Latitude-3570.56714 > ns3113832.ip-54-38-177.eu.8333: tcp 0
01:51:25.132921 IP tom-Latitude-3570.60988 > 81.198.101.144.8333: tcp 24
01:51:25.133278 IP tom-Latitude-3570.42516 > 2.56.9.15.8333: tcp 24
01:51:25.134925 IP tom-Latitude-3570.42516 > 2.56.9.15.8333: tcp 8
01:51:25.134930 IP tom-Latitude-3570.60988 > 81.198.101.144.8333: tcp 8
01:51:25.164978 IP 81.198.101.144.8333 > tom-Latitude-3570.60988: tcp 0
01:51:25.165596 IP 2.56.9.15.8333 > tom-Latitude-3570.42516: tcp 0
01:51:25.165610 IP 81.198.101.144.8333 > tom-Latitude-3570.60988: tcp 0
01:51:25.234592 IP tom-Latitude-3570.60470 > bb42-60-217-183.singnet.com.sg.8333: tcp 24
01:51:25.235528 IP tom-Latitude-3570.60470 > bb42-60-217-183.singnet.com.sg.8333: tcp 181
01:51:25.261050 IP 2.56.9.15.8333 > tom-Latitude-3570.42516: tcp 24
01:51:25.261635 IP 2.56.9.15.8333 > tom-Latitude-3570.42516: tcp 8
01:51:25.261698 IP tom-Latitude-3570.42516 > 2.56.9.15.8333: tcp 0
01:51:25.274938 IP bb42-60-217-183.singnet.com.sg.8333 > tom-Latitude-3570.60470: tcp 0
01:51:25.285992 IP 81.198.101.144.8333 > tom-Latitude-3570.60988: tcp 24
01:51:25.286600 IP 81.198.101.144.8333 > tom-Latitude-3570.60988: tcp 8
01:51:25.286663 IP tom-Latitude-3570.60988 > 81.198.101.144.8333: tcp 0
01:51:25.487282 IP tom-Latitude-3570.39110 > vmi195435.contaboserver.net.8333: tcp 24
01:51:25.489389 IP tom-Latitude-3570.39110 > vmi195435.contaboserver.net.8333: tcp 181
01:51:25.526924 IP vmi195435.contaboserver.net.8333 > tom-Latitude-3570.39110: tcp 0
01:51:25.534906 IP vmi195435.contaboserver.net.8333 > tom-Latitude-3570.39110: tcp 0
01:51:25.687993 IP tom-Latitude-3570.56714 > ns3113832.ip-54-38-177.eu.8333: tcp 24
01:51:25.690254 IP tom-Latitude-3570.56714 > ns3113832.ip-54-38-177.eu.8333: tcp 8
01:51:25.711995 IP 81.198.101.144.8333 > tom-Latitude-3570.60988: tcp 24
01:51:25.712580 IP 81.198.101.144.8333 > tom-Latitude-3570.60988: tcp 73
01:51:25.712642 IP tom-Latitude-3570.60988 > 81.198.101.144.8333: tcp 0
01:51:25.723941 IP ns3113832.ip-54-38-177.eu.8333 > tom-Latitude-3570.56714: tcp 0
01:51:25.782002 IP ns3113832.ip-54-38-177.eu.8333 > tom-Latitude-3570.56714: tcp 24
01:51:25.782638 IP ns3113832.ip-54-38-177.eu.8333 > tom-Latitude-3570.56714: tcp 8
01:51:25.782701 IP tom-Latitude-3570.56714 > ns3113832.ip-54-38-177.eu.8333: tcp 0
01:51:25.883278 IP tom-Latitude-3570.42516 > 2.56.9.15.8333: tcp 24
01:51:25.884222 IP tom-Latitude-3570.42516 > 2.56.9.15.8333: tcp 181
01:51:25.923799 IP 2.56.9.15.8333 > tom-Latitude-3570.42516: tcp 0
01:51:25.983849 IP tom-Latitude-3570.57976 > 167.99.216.145.8333: tcp 24
01:51:25.984789 IP tom-Latitude-3570.57976 > 167.99.216.145.8333: tcp 685
01:51:26.031363 IP 167.99.216.145.8333 > tom-Latitude-3570.57976: tcp 0
01:51:26.384848 IP tom-Latitude-3570.57976 > 167.99.216.145.8333: tcp 24
01:51:26.386816 IP tom-Latitude-3570.57976 > 167.99.216.145.8333: tcp 61
01:51:26.444667 IP 167.99.216.145.8333 > tom-Latitude-3570.57976: tcp 0
01:51:26.764113 IP 167.99.216.145.8333 > tom-Latitude-3570.57976: tcp 24
01:51:26.764132 IP tom-Latitude-3570.57976 > 167.99.216.145.8333: tcp 0
01:51:26.764138 IP 167.99.216.145.8333 > tom-Latitude-3570.57976: tcp 73
01:51:26.764141 IP tom-Latitude-3570.57976 > 167.99.216.145.8333: tcp 0
01:51:26.764144 IP 167.99.216.145.8333 > tom-Latitude-3570.57976: tcp 73
01:51:26.764147 IP tom-Latitude-3570.57976 > 167.99.216.145.8333: tcp 0
01:51:26.764372 IP tom-Latitude-3570.57976 > 167.99.216.145.8333: tcp 24
01:51:26.765623 IP tom-Latitude-3570.57976 > 167.99.216.145.8333: tcp 73
01:51:26.794920 IP 167.99.216.145.8333 > tom-Latitude-3570.57976: tcp 0
01:51:26.858072 IP 167.99.216.145.8333 > tom-Latitude-3570.57976: tcp 24
01:51:26.858718 IP 167.99.216.145.8333 > tom-Latitude-3570.57976: tcp 336
01:51:26.858736 IP 167.99.216.145.8333 > tom-Latitude-3570.57976: tcp 24
01:51:26.858739 IP 167.99.216.145.8333 > tom-Latitude-3570.57976: tcp 247
01:51:26.858782 IP tom-Latitude-3570.57976 > 167.99.216.145.8333: tcp 0
01:51:26.921978 IP c-185-45-236-223.customer.ggaweb.ch.8333 > tom-Latitude-3570.49070: tcp 24
01:51:26.922695 IP c-185-45-236-223.customer.ggaweb.ch.8333 > tom-Latitude-3570.49070: tcp 289
01:51:26.922756 IP tom-Latitude-3570.49070 > c-185-45-236-223.customer.ggaweb.ch.8333: tcp 0
01:51:26.922969 IP tom-Latitude-3570.49070 > c-185-45-236-223.customer.ggaweb.ch.8333: tcp 24
01:51:26.924273 IP tom-Latitude-3570.49070 > c-185-45-236-223.customer.ggaweb.ch.8333: tcp 37
01:51:26.956648 IP c-185-45-236-223.customer.ggaweb.ch.8333 > tom-Latitude-3570.49070: tcp 0
01:51:26.956657 IP c-185-45-236-223.customer.ggaweb.ch.8333 > tom-Latitude-3570.49070: tcp 0
01:51:27.038841 IP c-185-45-236-223.customer.ggaweb.ch.8333 > tom-Latitude-3570.49070: tcp 24
01:51:27.039482 IP c-185-45-236-223.customer.ggaweb.ch.8333 > tom-Latitude-3570.49070: tcp 420
01:51:27.039504 IP tom-Latitude-3570.49070 > c-185-45-236-223.customer.ggaweb.ch.8333: tcp 0
01:51:27.541434 IP tom-Latitude-3570.57976 > 167.99.216.145.8333: tcp 24
01:51:27.543752 IP tom-Latitude-3570.57976 > 167.99.216.145.8333: tcp 8
01:51:27.584761 IP bb42-60-217-183.singnet.com.sg.8333 > tom-Latitude-3570.60470: tcp 24
01:51:27.585324 IP bb42-60-217-183.singnet.com.sg.8333 > tom-Latitude-3570.60470: tcp 109
01:51:27.585387 IP tom-Latitude-3570.60470 > bb42-60-217-183.singnet.com.sg.8333: tcp 0
01:51:27.593096 IP 167.99.216.145.8333 > tom-Latitude-3570.57976: tcp 0
01:51:27.658021 IP 167.99.216.145.8333 > tom-Latitude-3570.57976: tcp 24
01:51:27.658569 IP 167.99.216.145.8333 > tom-Latitude-3570.57976: tcp 8
01:51:27.658630 IP tom-Latitude-3570.57976 > 167.99.216.145.8333: tcp 0
01:51:27.658805 IP tom-Latitude-3570.39110 > vmi195435.contaboserver.net.8333: tcp 24
01:51:27.660269 IP tom-Latitude-3570.39110 > vmi195435.contaboserver.net.8333: tcp 109
01:51:27.661658 IP bb42-60-217-183.singnet.com.sg.8333 > tom-Latitude-3570.60470: tcp 24
01:51:27.661672 IP bb42-60-217-183.singnet.com.sg.8333 > tom-Latitude-3570.60470: tcp 8
01:51:27.661710 IP tom-Latitude-3570.60470 > bb42-60-217-183.singnet.com.sg.8333: tcp 0
01:51:27.661830 IP tom-Latitude-3570.60470 > bb42-60-217-183.singnet.com.sg.8333: tcp 24
01:51:27.663145 IP tom-Latitude-3570.60470 > bb42-60-217-183.singnet.com.sg.8333: tcp 8
01:51:27.694945 IP vmi195435.contaboserver.net.8333 > tom-Latitude-3570.39110: tcp 0
01:51:27.695573 IP vmi195435.contaboserver.net.8333 > tom-Latitude-3570.39110: tcp 0
01:51:27.695587 IP bb42-60-217-183.singnet.com.sg.8333 > tom-Latitude-3570.60470: tcp 0
01:51:28.063232 IP tom-Latitude-3570.60470 > bb42-60-217-183.singnet.com.sg.8333: tcp 24
01:51:28.065552 IP tom-Latitude-3570.60470 > bb42-60-217-183.singnet.com.sg.8333: tcp 8
01:51:28.123829 IP bb42-60-217-183.singnet.com.sg.8333 > tom-Latitude-3570.60470: tcp 0
01:51:28.141332 IP 167.99.216.145.8333 > tom-Latitude-3570.57976: tcp 24
01:51:28.141983 IP 167.99.216.145.8333 > tom-Latitude-3570.57976: tcp 37
01:51:28.142046 IP tom-Latitude-3570.57976 > 167.99.216.145.8333: tcp 0
01:51:28.607414 IP static-87-75-105-186.vodafonexdsl.co.uk.8333 > tom-Latitude-3570.46284: tcp 24
01:51:28.607434 IP static-87-75-105-186.vodafonexdsl.co.uk.8333 > tom-Latitude-3570.46284: tcp 289
01:51:28.607439 IP bb42-60-217-183.singnet.com.sg.8333 > tom-Latitude-3570.60470: tcp 24
01:51:28.607442 IP bb42-60-217-183.singnet.com.sg.8333 > tom-Latitude-3570.60470: tcp 8
01:51:28.607445 IP static-87-75-105-186.vodafonexdsl.co.uk.8333 > tom-Latitude-3570.46284: tcp 289
01:51:28.607457 IP tom-Latitude-3570.46284 > static-87-75-105-186.vodafonexdsl.co.uk.8333: tcp 0
01:51:28.607471 IP 2.56.9.15.8333 > tom-Latitude-3570.42516: tcp 24
01:51:28.607475 IP tom-Latitude-3570.60470 > bb42-60-217-183.singnet.com.sg.8333: tcp 0
01:51:28.607475 IP 2.56.9.15.8333 > tom-Latitude-3570.42516: tcp 109
01:51:28.607538 IP tom-Latitude-3570.42516 > 2.56.9.15.8333: tcp 0
01:51:29.711432 IP tom-Latitude-3570.60988 > 81.198.101.144.8333: tcp 24
01:51:29.713552 IP tom-Latitude-3570.60988 > 81.198.101.144.8333: tcp 217
01:51:29.765881 IP 81.198.101.144.8333 > tom-Latitude-3570.60988: tcp 0
01:51:29.773885 IP 81.198.101.144.8333 > tom-Latitude-3570.60988: tcp 0
01:51:30.245850 IP 2.56.9.15.8333 > tom-Latitude-3570.42516: tcp 24
01:51:30.245868 IP 2.56.9.15.8333 > tom-Latitude-3570.42516: tcp 37
01:51:30.245914 IP tom-Latitude-3570.42516 > 2.56.9.15.8333: tcp 0
01:51:30.246100 IP tom-Latitude-3570.42516 > 2.56.9.15.8333: tcp 24
01:51:30.247369 IP tom-Latitude-3570.42516 > 2.56.9.15.8333: tcp 37
01:51:30.297716 IP 2.56.9.15.8333 > tom-Latitude-3570.42516: tcp 0
01:51:30.381364 IP 2.56.9.15.8333 > tom-Latitude-3570.42516: tcp 24
01:51:30.382052 IP 2.56.9.15.8333 > tom-Latitude-3570.42516: tcp 189
01:51:30.382116 IP tom-Latitude-3570.42516 > 2.56.9.15.8333: tcp 0
01:51:30.784049 IP tom-Latitude-3570.49070 > c-185-45-236-223.customer.ggaweb.ch.8333: tcp 24
01:51:30.784153 IP tom-Latitude-3570.60470 > bb42-60-217-183.singnet.com.sg.8333: tcp 24
01:51:30.786114 IP tom-Latitude-3570.60470 > bb42-60-217-183.singnet.com.sg.8333: tcp 37
01:51:30.786125 IP tom-Latitude-3570.49070 > c-185-45-236-223.customer.ggaweb.ch.8333: tcp 37
01:51:30.810786 IP c-185-45-236-223.customer.ggaweb.ch.8333 > tom-Latitude-3570.49070: tcp 24
01:51:30.811455 IP c-185-45-236-223.customer.ggaweb.ch.8333 > tom-Latitude-3570.49070: tcp 145
01:51:30.811518 IP tom-Latitude-3570.49070 > c-185-45-236-223.customer.ggaweb.ch.8333: tcp 0
01:51:30.811748 IP tom-Latitude-3570.49070 > c-185-45-236-223.customer.ggaweb.ch.8333: tcp 24
01:51:30.811763 IP tom-Latitude-3570.49070 > c-185-45-236-223.customer.ggaweb.ch.8333: tcp 109
01:51:30.826826 IP c-185-45-236-223.customer.ggaweb.ch.8333 > tom-Latitude-3570.49070: tcp 145
01:51:30.826845 IP tom-Latitude-3570.49070 > c-185-45-236-223.customer.ggaweb.ch.8333: tcp 0
01:51:30.827468 IP c-185-45-236-223.customer.ggaweb.ch.8333 > tom-Latitude-3570.49070: tcp 0
01:51:30.829745 IP c-185-45-236-223.customer.ggaweb.ch.8333 > tom-Latitude-3570.49070: tcp 0
01:51:30.830318 IP bb42-60-217-183.singnet.com.sg.8333 > tom-Latitude-3570.60470: tcp 0
01:51:30.855500 IP c-185-45-236-223.customer.ggaweb.ch.8333 > tom-Latitude-3570.49070: tcp 0
01:51:30.857947 IP c-185-45-236-223.customer.ggaweb.ch.8333 > tom-Latitude-3570.49070: tcp 0
01:51:30.912175 IP tom-Latitude-3570.60988 > 81.198.101.144.8333: tcp 24
01:51:30.913117 IP tom-Latitude-3570.60988 > 81.198.101.144.8333: tcp 37
01:51:30.925692 IP 81.198.101.144.8333 > tom-Latitude-3570.60988: tcp 24
01:51:30.926315 IP 81.198.101.144.8333 > tom-Latitude-3570.60988: tcp 73
01:51:30.926378 IP tom-Latitude-3570.60988 > 81.198.101.144.8333: tcp 0
01:51:30.935545 IP 81.198.101.144.8333 > tom-Latitude-3570.60988: tcp 0
01:51:30.939655 IP c-185-45-236-223.customer.ggaweb.ch.8333 > tom-Latitude-3570.49070: tcp 24
01:51:30.939672 IP tom-Latitude-3570.49070 > c-185-45-236-223.customer.ggaweb.ch.8333: tcp 0
01:51:30.942785 IP c-185-45-236-223.customer.ggaweb.ch.8333 > tom-Latitude-3570.49070: tcp 1344
01:51:30.942810 IP tom-Latitude-3570.49070 > c-185-45-236-223.customer.ggaweb.ch.8333: tcp 0
01:51:30.945690 IP 81.198.101.144.8333 > tom-Latitude-3570.60988: tcp 0
01:51:31.248258 IP tom-Latitude-3570.60988 > 81.198.101.144.8333: tcp 24
01:51:31.248313 IP tom-Latitude-3570.60470 > bb42-60-217-183.singnet.com.sg.8333: tcp 24
01:51:31.250596 IP tom-Latitude-3570.60470 > bb42-60-217-183.singnet.com.sg.8333: tcp 109
01:51:31.250608 IP tom-Latitude-3570.60988 > 81.198.101.144.8333: tcp 73
01:51:31.287525 IP 81.198.101.144.8333 > tom-Latitude-3570.60988: tcp 0
01:51:31.293735 IP c-185-45-236-223.customer.ggaweb.ch.8333 > tom-Latitude-3570.49070: tcp 24
01:51:31.293759 IP tom-Latitude-3570.49070 > c-185-45-236-223.customer.ggaweb.ch.8333: tcp 0
01:51:31.294394 IP c-185-45-236-223.customer.ggaweb.ch.8333 > tom-Latitude-3570.49070: tcp 37
01:51:31.294412 IP tom-Latitude-3570.49070 > c-185-45-236-223.customer.ggaweb.ch.8333: tcp 0
01:51:31.294428 IP 81.198.101.144.8333 > tom-Latitude-3570.60988: tcp 0
01:51:31.294433 IP bb42-60-217-183.singnet.com.sg.8333 > tom-Latitude-3570.60470: tcp 0
01:51:31.294657 IP tom-Latitude-3570.49070 > c-185-45-236-223.customer.ggaweb.ch.8333: tcp 24
01:51:31.294750 IP tom-Latitude-3570.56714 > ns3113832.ip-54-38-177.eu.8333: tcp 24
01:51:31.296164 IP tom-Latitude-3570.56714 > ns3113832.ip-54-38-177.eu.8333: tcp 253
01:51:31.296175 IP tom-Latitude-3570.49070 > c-185-45-236-223.customer.ggaweb.ch.8333: tcp 37
01:51:31.356757 IP 167.99.216.145.8333 > tom-Latitude-3570.57976: tcp 24
01:51:31.356774 IP 167.99.216.145.8333 > tom-Latitude-3570.57976: tcp 8
01:51:31.356777 IP c-185-45-236-223.customer.ggaweb.ch.8333 > tom-Latitude-3570.49070: tcp 0
01:51:31.356782 IP ns3113832.ip-54-38-177.eu.8333 > tom-Latitude-3570.56714: tcp 0
01:51:31.356804 IP c-185-45-236-223.customer.ggaweb.ch.8333 > tom-Latitude-3570.49070: tcp 0
01:51:31.356868 IP tom-Latitude-3570.57976 > 167.99.216.145.8333: tcp 0
01:51:31.357006 IP tom-Latitude-3570.57976 > 167.99.216.145.8333: tcp 24
01:51:31.357097 IP tom-Latitude-3570.46284 > static-87-75-105-186.vodafonexdsl.co.uk.8333: tcp 24
01:51:31.360395 IP tom-Latitude-3570.46284 > static-87-75-105-186.vodafonexdsl.co.uk.8333: tcp 145
01:51:31.360406 IP tom-Latitude-3570.57976 > 167.99.216.145.8333: tcp 8
01:51:31.403957 IP static-87-75-105-186.vodafonexdsl.co.uk.8333 > tom-Latitude-3570.46284: tcp 0
01:51:31.404517 IP static-87-75-105-186.vodafonexdsl.co.uk.8333 > tom-Latitude-3570.46284: tcp 0
01:51:31.404530 IP 167.99.216.145.8333 > tom-Latitude-3570.57976: tcp 0
01:51:31.411638 IP c-185-45-236-223.customer.ggaweb.ch.8333 > tom-Latitude-3570.49070: tcp 24
01:51:31.411659 IP c-185-45-236-223.customer.ggaweb.ch.8333 > tom-Latitude-3570.49070: tcp 1448
01:51:31.411663 IP c-185-45-236-223.customer.ggaweb.ch.8333 > tom-Latitude-3570.49070: tcp 515
01:51:31.411751 IP tom-Latitude-3570.49070 > c-185-45-236-223.customer.ggaweb.ch.8333: tcp 0
01:51:31.714395 IP tom-Latitude-3570.42516 > 2.56.9.15.8333: tcp 24
01:51:31.718429 IP tom-Latitude-3570.42516 > 2.56.9.15.8333: tcp 145
01:51:31.731665 IP 81.198.101.144.8333 > tom-Latitude-3570.60988: tcp 24
01:51:31.732261 IP 81.198.101.144.8333 > tom-Latitude-3570.60988: tcp 73
01:51:31.732389 IP tom-Latitude-3570.60988 > 81.198.101.144.8333: tcp 0
01:51:31.732535 IP tom-Latitude-3570.60988 > 81.198.101.144.8333: tcp 24
01:51:31.733964 IP tom-Latitude-3570.60988 > 81.198.101.144.8333: tcp 914
01:51:31.773155 IP 81.198.101.144.8333 > tom-Latitude-3570.60988: tcp 0
01:51:31.773705 IP 2.56.9.15.8333 > tom-Latitude-3570.42516: tcp 0
01:51:31.773719 IP 81.198.101.144.8333 > tom-Latitude-3570.60988: tcp 0
01:51:32.089065 IP ns3113832.ip-54-38-177.eu.8333 > tom-Latitude-3570.56714: tcp 24
01:51:32.089084 IP ns3113832.ip-54-38-177.eu.8333 > tom-Latitude-3570.56714: tcp 37
01:51:32.089087 IP ns3113832.ip-54-38-177.eu.8333 > tom-Latitude-3570.56714: tcp 37
01:51:32.089114 IP tom-Latitude-3570.56714 > ns3113832.ip-54-38-177.eu.8333: tcp 0
01:51:32.991769 IP tom-Latitude-3570.60988 > 81.198.101.144.8333: tcp 24
01:51:32.993882 IP tom-Latitude-3570.60988 > 81.198.101.144.8333: tcp 37
01:51:33.054003 IP 81.198.101.144.8333 > tom-Latitude-3570.60988: tcp 0
01:51:33.062615 IP 81.198.101.144.8333 > tom-Latitude-3570.60988: tcp 0
01:51:33.192505 IP tom-Latitude-3570.57976 > 167.99.216.145.8333: tcp 24
01:51:33.194580 IP tom-Latitude-3570.57976 > 167.99.216.145.8333: tcp 181
01:51:33.242956 IP 167.99.216.145.8333 > tom-Latitude-3570.57976: tcp 0
01:51:33.328024 IP static-87-75-105-186.vodafonexdsl.co.uk.8333 > tom-Latitude-3570.46284: tcp 24
01:51:33.328048 IP tom-Latitude-3570.46284 > static-87-75-105-186.vodafonexdsl.co.uk.8333: tcp 0
01:51:33.369985 IP static-87-75-105-186.vodafonexdsl.co.uk.8333 > tom-Latitude-3570.46284: tcp 109
01:51:33.370009 IP tom-Latitude-3570.46284 > static-87-75-105-186.vodafonexdsl.co.uk.8333: tcp 0
01:51:33.370299 IP tom-Latitude-3570.46284 > static-87-75-105-186.vodafonexdsl.co.uk.8333: tcp 24
01:51:33.371529 IP tom-Latitude-3570.46284 > static-87-75-105-186.vodafonexdsl.co.uk.8333: tcp 73
01:51:33.412929 IP static-87-75-105-186.vodafonexdsl.co.uk.8333 > tom-Latitude-3570.46284: tcp 0
01:51:33.413515 IP static-87-75-105-186.vodafonexdsl.co.uk.8333 > tom-Latitude-3570.46284: tcp 0
01:51:33.482969 IP static-87-75-105-186.vodafonexdsl.co.uk.8333 > tom-Latitude-3570.46284: tcp 24
01:51:33.500080 IP static-87-75-105-186.vodafonexdsl.co.uk.8333 > tom-Latitude-3570.46284: tcp 274
01:51:33.500207 IP tom-Latitude-3570.46284 > static-87-75-105-186.vodafonexdsl.co.uk.8333: tcp 0
01:51:33.500610 IP static-87-75-105-186.vodafonexdsl.co.uk.8333 > tom-Latitude-3570.46284: tcp 370
01:51:33.543906 IP tom-Latitude-3570.46284 > static-87-75-105-186.vodafonexdsl.co.uk.8333: tcp 0
01:51:33.701754 IP tom-Latitude-3570.39110 > vmi195435.contaboserver.net.8333: tcp 24
01:51:33.703971 IP tom-Latitude-3570.39110 > vmi195435.contaboserver.net.8333: tcp 253
01:51:33.704516 IP c-185-45-236-223.customer.ggaweb.ch.8333 > tom-Latitude-3570.49070: tcp 24
01:51:33.704537 IP c-185-45-236-223.customer.ggaweb.ch.8333 > tom-Latitude-3570.49070: tcp 217
01:51:33.704579 IP tom-Latitude-3570.49070 > c-185-45-236-223.customer.ggaweb.ch.8333: tcp 0
01:51:33.704796 IP tom-Latitude-3570.49070 > c-185-45-236-223.customer.ggaweb.ch.8333: tcp 24
01:51:33.705864 IP tom-Latitude-3570.49070 > c-185-45-236-223.customer.ggaweb.ch.8333: tcp 145
01:51:33.761204 IP vmi195435.contaboserver.net.8333 > tom-Latitude-3570.39110: tcp 0
01:51:33.761846 IP vmi195435.contaboserver.net.8333 > tom-Latitude-3570.39110: tcp 0
01:51:33.761851 IP c-185-45-236-223.customer.ggaweb.ch.8333 > tom-Latitude-3570.49070: tcp 0
01:51:33.761853 IP c-185-45-236-223.customer.ggaweb.ch.8333 > tom-Latitude-3570.49070: tcp 0
01:51:33.805018 IP tom-Latitude-3570.57976 > 167.99.216.145.8333: tcp 24
01:51:33.805823 IP tom-Latitude-3570.57976 > 167.99.216.145.8333: tcp 73
01:51:33.850931 IP c-185-45-236-223.customer.ggaweb.ch.8333 > tom-Latitude-3570.49070: tcp 24
01:51:33.851657 IP c-185-45-236-223.customer.ggaweb.ch.8333 > tom-Latitude-3570.49070: tcp 902
01:51:33.851664 IP c-185-45-236-223.customer.ggaweb.ch.8333 > tom-Latitude-3570.49070: tcp 250
01:51:33.851685 IP tom-Latitude-3570.49070 > c-185-45-236-223.customer.ggaweb.ch.8333: tcp 0
01:51:33.869457 IP 167.99.216.145.8333 > tom-Latitude-3570.57976: tcp 0
01:51:34.055506 IP tom-Latitude-3570.60470 > bb42-60-217-183.singnet.com.sg.8333: tcp 24
01:51:34.057582 IP tom-Latitude-3570.60470 > bb42-60-217-183.singnet.com.sg.8333: tcp 253
01:51:34.058128 IP bb42-60-217-183.singnet.com.sg.8333 > tom-Latitude-3570.60470: tcp 24
01:51:34.058149 IP bb42-60-217-183.singnet.com.sg.8333 > tom-Latitude-3570.60470: tcp 253
01:51:34.058241 IP tom-Latitude-3570.60470 > bb42-60-217-183.singnet.com.sg.8333: tcp 0
01:51:34.059009 IP tom-Latitude-3570.60470 > bb42-60-217-183.singnet.com.sg.8333: tcp 61
01:51:34.059682 IP 167.99.216.145.8333 > tom-Latitude-3570.57976: tcp 24
01:51:34.059691 IP 167.99.216.145.8333 > tom-Latitude-3570.57976: tcp 181
01:51:34.059740 IP tom-Latitude-3570.57976 > 167.99.216.145.8333: tcp 0
01:51:34.094687 IP bb42-60-217-183.singnet.com.sg.8333 > tom-Latitude-3570.60470: tcp 0
01:51:34.106117 IP c-185-45-236-223.customer.ggaweb.ch.8333 > tom-Latitude-3570.49070: tcp 24
01:51:34.106712 IP c-185-45-236-223.customer.ggaweb.ch.8333 > tom-Latitude-3570.49070: tcp 37
01:51:34.106800 IP tom-Latitude-3570.49070 > c-185-45-236-223.customer.ggaweb.ch.8333: tcp 0
01:51:34.124979 IP vmi195435.contaboserver.net.8333 > tom-Latitude-3570.39110: tcp 24
01:51:34.125005 IP vmi195435.contaboserver.net.8333 > tom-Latitude-3570.39110: tcp 181
01:51:34.125055 IP tom-Latitude-3570.39110 > vmi195435.contaboserver.net.8333: tcp 0
01:51:34.134693 IP bb42-60-217-183.singnet.com.sg.8333 > tom-Latitude-3570.60470: tcp 0
01:51:35.128206 IP tom-Latitude-3570.56714 > ns3113832.ip-54-38-177.eu.8333: tcp 24
01:51:35.130485 IP tom-Latitude-3570.56714 > ns3113832.ip-54-38-177.eu.8333: tcp 217
01:51:35.131108 IP bb42-60-217-183.singnet.com.sg.8333 > tom-Latitude-3570.60470: tcp 24
01:51:35.131128 IP bb42-60-217-183.singnet.com.sg.8333 > tom-Latitude-3570.60470: tcp 420
01:51:35.131131 IP bb42-60-217-183.singnet.com.sg.8333 > tom-Latitude-3570.60470: tcp 420
01:51:35.131158 IP tom-Latitude-3570.60470 > bb42-60-217-183.singnet.com.sg.8333: tcp 0
01:51:35.196798 IP c-185-45-236-223.customer.ggaweb.ch.8333 > tom-Latitude-3570.49070: tcp 24
01:51:35.196815 IP c-185-45-236-223.customer.ggaweb.ch.8333 > tom-Latitude-3570.49070: tcp 37
01:51:35.196818 IP ns3113832.ip-54-38-177.eu.8333 > tom-Latitude-3570.56714: tcp 0
01:51:35.196907 IP tom-Latitude-3570.49070 > c-185-45-236-223.customer.ggaweb.ch.8333: tcp 0
01:51:35.197034 IP tom-Latitude-3570.49070 > c-185-45-236-223.customer.ggaweb.ch.8333: tcp 24
01:51:35.199100 IP tom-Latitude-3570.49070 > c-185-45-236-223.customer.ggaweb.ch.8333: tcp 37
01:51:35.234823 IP c-185-45-236-223.customer.ggaweb.ch.8333 > tom-Latitude-3570.49070: tcp 0
01:51:35.235372 IP c-185-45-236-223.customer.ggaweb.ch.8333 > tom-Latitude-3570.49070: tcp 0
01:51:35.317978 IP c-185-45-236-223.customer.ggaweb.ch.8333 > tom-Latitude-3570.49070: tcp 24
01:51:35.318578 IP c-185-45-236-223.customer.ggaweb.ch.8333 > tom-Latitude-3570.49070: tcp 223
01:51:35.318707 IP tom-Latitude-3570.49070 > c-185-45-236-223.customer.ggaweb.ch.8333: tcp 0
01:51:35.620124 IP tom-Latitude-3570.42516 > 2.56.9.15.8333: tcp 24
01:51:35.622187 IP tom-Latitude-3570.42516 > 2.56.9.15.8333: tcp 289
01:51:35.674718 IP 2.56.9.15.8333 > tom-Latitude-3570.42516: tcp 0
01:51:36.322448 IP tom-Latitude-3570.39110 > vmi195435.contaboserver.net.8333: tcp 24
01:51:36.326378 IP tom-Latitude-3570.39110 > vmi195435.contaboserver.net.8333: tcp 37
01:51:36.326969 IP static-87-75-105-186.vodafonexdsl.co.uk.8333 > tom-Latitude-3570.46284: tcp 24
01:51:36.326992 IP tom-Latitude-3570.46284 > static-87-75-105-186.vodafonexdsl.co.uk.8333: tcp 0
01:51:36.327022 IP static-87-75-105-186.vodafonexdsl.co.uk.8333 > tom-Latitude-3570.46284: tcp 253
01:51:36.327027 IP tom-Latitude-3570.46284 > static-87-75-105-186.vodafonexdsl.co.uk.8333: tcp 0
01:51:36.327030 IP static-87-75-105-186.vodafonexdsl.co.uk.8333 > tom-Latitude-3570.46284: tcp 253
01:51:36.327034 IP tom-Latitude-3570.46284 > static-87-75-105-186.vodafonexdsl.co.uk.8333: tcp 0
01:51:36.327284 IP tom-Latitude-3570.46284 > static-87-75-105-186.vodafonexdsl.co.uk.8333: tcp 24
01:51:36.328051 IP tom-Latitude-3570.46284 > static-87-75-105-186.vodafonexdsl.co.uk.8333: tcp 37
01:51:36.364968 IP vmi195435.contaboserver.net.8333 > tom-Latitude-3570.39110: tcp 0
01:51:36.365845 IP vmi195435.contaboserver.net.8333 > tom-Latitude-3570.39110: tcp 0
01:51:36.365848 IP static-87-75-105-186.vodafonexdsl.co.uk.8333 > tom-Latitude-3570.46284: tcp 0
01:51:36.365850 IP static-87-75-105-186.vodafonexdsl.co.uk.8333 > tom-Latitude-3570.46284: tcp 0
01:51:36.476784 IP static-87-75-105-186.vodafonexdsl.co.uk.8333 > tom-Latitude-3570.46284: tcp 24
01:51:36.476836 IP static-87-75-105-186.vodafonexdsl.co.uk.8333 > tom-Latitude-3570.46284: tcp 370
01:51:36.476953 IP tom-Latitude-3570.46284 > static-87-75-105-186.vodafonexdsl.co.uk.8333: tcp 0
01:51:36.579723 IP tom-Latitude-3570.57976 > 167.99.216.145.8333: tcp 24
01:51:36.582374 IP tom-Latitude-3570.57976 > 167.99.216.145.8333: tcp 73
01:51:36.625359 IP 167.99.216.145.8333 > tom-Latitude-3570.57976: tcp 0
01:51:37.004164 IP static-87-75-105-186.vodafonexdsl.co.uk.8333 > tom-Latitude-3570.46284: tcp 24
01:51:37.004184 IP static-87-75-105-186.vodafonexdsl.co.uk.8333 > tom-Latitude-3570.46284: tcp 289
01:51:37.004275 IP tom-Latitude-3570.46284 > static-87-75-105-186.vodafonexdsl.co.uk.8333: tcp 0
01:51:37.004487 IP tom-Latitude-3570.46284 > static-87-75-105-186.vodafonexdsl.co.uk.8333: tcp 24
01:51:37.005827 IP tom-Latitude-3570.46284 > static-87-75-105-186.vodafonexdsl.co.uk.8333: tcp 289
01:51:37.045021 IP static-87-75-105-186.vodafonexdsl.co.uk.8333 > tom-Latitude-3570.46284: tcp 0
01:51:37.045634 IP static-87-75-105-186.vodafonexdsl.co.uk.8333 > tom-Latitude-3570.46284: tcp 0
01:51:37.111265 IP static-87-75-105-186.vodafonexdsl.co.uk.8333 > tom-Latitude-3570.46284: tcp 24
01:51:37.112082 IP static-87-75-105-186.vodafonexdsl.co.uk.8333 > tom-Latitude-3570.46284: tcp 760
01:51:37.112099 IP static-87-75-105-186.vodafonexdsl.co.uk.8333 > tom-Latitude-3570.46284: tcp 24
01:51:37.112102 IP static-87-75-105-186.vodafonexdsl.co.uk.8333 > tom-Latitude-3570.46284: tcp 247
01:51:37.112104 IP static-87-75-105-186.vodafonexdsl.co.uk.8333 > tom-Latitude-3570.46284: tcp 24
01:51:37.112106 IP static-87-75-105-186.vodafonexdsl.co.uk.8333 > tom-Latitude-3570.46284: tcp 225
01:51:37.112195 IP tom-Latitude-3570.46284 > static-87-75-105-186.vodafonexdsl.co.uk.8333: tcp 0
01:51:37.115858 IP static-87-75-105-186.vodafonexdsl.co.uk.8333 > tom-Latitude-3570.46284: tcp 24
01:51:37.115873 IP static-87-75-105-186.vodafonexdsl.co.uk.8333 > tom-Latitude-3570.46284: tcp 518
01:51:37.115876 IP static-87-75-105-186.vodafonexdsl.co.uk.8333 > tom-Latitude-3570.46284: tcp 24
01:51:37.115878 IP static-87-75-105-186.vodafonexdsl.co.uk.8333 > tom-Latitude-3570.46284: tcp 223
01:51:37.115879 IP static-87-75-105-186.vodafonexdsl.co.uk.8333 > tom-Latitude-3570.46284: tcp 24
01:51:37.115898 IP static-87-75-105-186.vodafonexdsl.co.uk.8333 > tom-Latitude-3570.46284: tcp 249
01:51:37.115901 IP static-87-75-105-186.vodafonexdsl.co.uk.8333 > tom-Latitude-3570.46284: tcp 308
01:51:37.115903 IP static-87-75-105-186.vodafonexdsl.co.uk.8333 > tom-Latitude-3570.46284: tcp 225
01:51:37.115958 IP tom-Latitude-3570.46284 > static-87-75-105-186.vodafonexdsl.co.uk.8333: tcp 0
01:51:37.217967 IP tom-Latitude-3570.57976 > 167.99.216.145.8333: tcp 24
01:51:37.218045 IP tom-Latitude-3570.60470 > bb42-60-217-183.singnet.com.sg.8333: tcp 24
01:51:37.220133 IP tom-Latitude-3570.60470 > bb42-60-217-183.singnet.com.sg.8333: tcp 361
01:51:37.220143 IP tom-Latitude-3570.57976 > 167.99.216.145.8333: tcp 289
01:51:37.276709 IP bb42-60-217-183.singnet.com.sg.8333 > tom-Latitude-3570.60470: tcp 0
01:51:37.276723 IP bb42-60-217-183.singnet.com.sg.8333 > tom-Latitude-3570.60470: tcp 0
01:51:37.276726 IP 167.99.216.145.8333 > tom-Latitude-3570.57976: tcp 0
01:51:37.819609 IP tom-Latitude-3570.39110 > vmi195435.contaboserver.net.8333: tcp 24
01:51:37.821732 IP tom-Latitude-3570.39110 > vmi195435.contaboserver.net.8333: tcp 325
01:51:37.849673 IP 81.198.101.144.8333 > tom-Latitude-3570.60988: tcp 24
01:51:37.850261 IP 81.198.101.144.8333 > tom-Latitude-3570.60988: tcp 37
01:51:37.850278 IP 81.198.101.144.8333 > tom-Latitude-3570.60988: tcp 37
01:51:37.850288 IP tom-Latitude-3570.60988 > 81.198.101.144.8333: tcp 0
01:51:37.850466 IP tom-Latitude-3570.60988 > 81.198.101.144.8333: tcp 24
01:51:37.854418 IP tom-Latitude-3570.60988 > 81.198.101.144.8333: tcp 37
01:51:37.862299 IP vmi195435.contaboserver.net.8333 > tom-Latitude-3570.39110: tcp 0
01:51:37.870270 IP vmi195435.contaboserver.net.8333 > tom-Latitude-3570.39110: tcp 0
01:51:37.886239 IP 81.198.101.144.8333 > tom-Latitude-3570.60988: tcp 0
01:51:37.886753 IP 81.198.101.144.8333 > tom-Latitude-3570.60988: tcp 0
01:51:37.972296 IP 81.198.101.144.8333 > tom-Latitude-3570.60988: tcp 24
01:51:37.972967 IP 81.198.101.144.8333 > tom-Latitude-3570.60988: tcp 37
01:51:37.973081 IP tom-Latitude-3570.60988 > 81.198.101.144.8333: tcp 0
01:51:37.973178 IP tom-Latitude-3570.60988 > 81.198.101.144.8333: tcp 24
01:51:37.974005 IP tom-Latitude-3570.60988 > 81.198.101.144.8333: tcp 37
01:51:38.005390 IP 81.198.101.144.8333 > tom-Latitude-3570.60988: tcp 0
01:51:38.006059 IP 81.198.101.144.8333 > tom-Latitude-3570.60988: tcp 0
01:51:38.474939 IP tom-Latitude-3570.60988 > 81.198.101.144.8333: tcp 24
01:51:38.477091 IP tom-Latitude-3570.60988 > 81.198.101.144.8333: tcp 613
01:51:38.489345 IP c-185-45-236-223.customer.ggaweb.ch.8333 > tom-Latitude-3570.49070: tcp 24
01:51:38.490075 IP c-185-45-236-223.customer.ggaweb.ch.8333 > tom-Latitude-3570.49070: tcp 361
01:51:38.490092 IP 81.198.101.144.8333 > tom-Latitude-3570.60988: tcp 24
01:51:38.490095 IP 81.198.101.144.8333 > tom-Latitude-3570.60988: tcp 73
01:51:38.490098 IP c-185-45-236-223.customer.ggaweb.ch.8333 > tom-Latitude-3570.49070: tcp 361
01:51:38.490126 IP tom-Latitude-3570.49070 > c-185-45-236-223.customer.ggaweb.ch.8333: tcp 0
01:51:38.490206 IP tom-Latitude-3570.60988 > 81.198.101.144.8333: tcp 0
01:51:38.490383 IP tom-Latitude-3570.49070 > c-185-45-236-223.customer.ggaweb.ch.8333: tcp 24
01:51:38.490419 IP tom-Latitude-3570.60988 > 81.198.101.144.8333: tcp 24
01:51:38.490425 IP tom-Latitude-3570.60988 > 81.198.101.144.8333: tcp 73
01:51:38.491756 IP tom-Latitude-3570.49070 > c-185-45-236-223.customer.ggaweb.ch.8333: tcp 37
01:51:38.502822 IP 81.198.101.144.8333 > tom-Latitude-3570.60988: tcp 0
01:51:38.510827 IP 81.198.101.144.8333 > tom-Latitude-3570.60988: tcp 0
01:51:38.519004 IP 81.198.101.144.8333 > tom-Latitude-3570.60988: tcp 0
01:51:38.519823 IP c-185-45-236-223.customer.ggaweb.ch.8333 > tom-Latitude-3570.49070: tcp 0
01:51:38.519837 IP 81.198.101.144.8333 > tom-Latitude-3570.60988: tcp 0
01:51:38.519840 IP c-185-45-236-223.customer.ggaweb.ch.8333 > tom-Latitude-3570.49070: tcp 0
01:51:38.601926 IP c-185-45-236-223.customer.ggaweb.ch.8333 > tom-Latitude-3570.49070: tcp 24
01:51:38.602519 IP c-185-45-236-223.customer.ggaweb.ch.8333 > tom-Latitude-3570.49070: tcp 247
01:51:38.602648 IP tom-Latitude-3570.49070 > c-185-45-236-223.customer.ggaweb.ch.8333: tcp 0
01:51:38.803680 IP tom-Latitude-3570.39110 > vmi195435.contaboserver.net.8333: tcp 24
01:51:38.805970 IP tom-Latitude-3570.39110 > vmi195435.contaboserver.net.8333: tcp 37
01:51:38.846836 IP vmi195435.contaboserver.net.8333 > tom-Latitude-3570.39110: tcp 0
01:51:38.854799 IP vmi195435.contaboserver.net.8333 > tom-Latitude-3570.39110: tcp 0
01:51:39.004271 IP tom-Latitude-3570.57976 > 167.99.216.145.8333: tcp 24
01:51:39.040006 IP tom-Latitude-3570.57976 > 167.99.216.145.8333: tcp 37
01:51:39.045695 IP bb42-60-217-183.singnet.com.sg.8333 > tom-Latitude-3570.60470: tcp 24
01:51:39.045719 IP tom-Latitude-3570.60470 > bb42-60-217-183.singnet.com.sg.8333: tcp 0
01:51:39.046365 IP bb42-60-217-183.singnet.com.sg.8333 > tom-Latitude-3570.60470: tcp 145
01:51:39.046389 IP tom-Latitude-3570.60470 > bb42-60-217-183.singnet.com.sg.8333: tcp 0
01:51:39.046618 IP tom-Latitude-3570.60470 > bb42-60-217-183.singnet.com.sg.8333: tcp 24
01:51:39.050170 IP tom-Latitude-3570.60470 > bb42-60-217-183.singnet.com.sg.8333: tcp 109
01:51:39.084976 IP 167.99.216.145.8333 > tom-Latitude-3570.57976: tcp 0
01:51:39.085550 IP bb42-60-217-183.singnet.com.sg.8333 > tom-Latitude-3570.60470: tcp 0
01:51:39.085565 IP bb42-60-217-183.singnet.com.sg.8333 > tom-Latitude-3570.60470: tcp 0
01:51:39.872015 IP bb42-60-217-183.singnet.com.sg.8333 > tom-Latitude-3570.60470: tcp 436
01:51:39.872033 IP tom-Latitude-3570.60470 > bb42-60-217-183.singnet.com.sg.8333: tcp 0
01:51:39.872044 IP bb42-60-217-183.singnet.com.sg.8333 > tom-Latitude-3570.60470: tcp 24
01:51:39.872047 IP tom-Latitude-3570.60470 > bb42-60-217-183.singnet.com.sg.8333: tcp 0
01:51:39.872049 IP bb42-60-217-183.singnet.com.sg.8333 > tom-Latitude-3570.60470: tcp 223
