09:55:44.636295 IP static-87-75-105-186.vodafonexdsl.co.uk.8333 > tom-Latitude-3570.47264: tcp 0
09:55:44.638340 IP 47.52.161.242.8333 > tom-Latitude-3570.52038: tcp 0
09:55:44.656623 IP 47.52.161.242.8333 > tom-Latitude-3570.52038: tcp 0
09:55:44.727366 IP 47.244.214.69.8333 > tom-Latitude-3570.43084: tcp 0
09:55:44.735111 IP 185.207.232.56.8333 > tom-Latitude-3570.60304: tcp 0
09:55:44.751544 IP 185.207.232.56.8333 > tom-Latitude-3570.60304: tcp 0
09:55:44.763906 IP tom-Latitude-3570.35144 > vmd25034.contaboserver.net.8333: tcp 73
09:55:44.811591 IP vmd25034.contaboserver.net.8333 > tom-Latitude-3570.35144: tcp 0
09:55:44.815130 IP 47.52.161.242.8333 > tom-Latitude-3570.52038: tcp 0
09:55:44.961675 IP 47.52.161.242.8333 > tom-Latitude-3570.52038: tcp 687
09:55:45.007908 IP tom-Latitude-3570.52038 > 47.52.161.242.8333: tcp 0
09:55:45.038768 IP vmd25034.contaboserver.net.8333 > tom-Latitude-3570.35144: tcp 0
09:55:45.040168 IP static-87-75-105-186.vodafonexdsl.co.uk.8333 > tom-Latitude-3570.47264: tcp 0
09:55:45.042817 IP 47.52.161.242.8333 > tom-Latitude-3570.52038: tcp 0
09:55:45.085288 IP static-87-75-105-186.vodafonexdsl.co.uk.8333 > tom-Latitude-3570.47264: tcp 0
09:55:45.121535 IP 106.33-244-23.rdns.scalabledns.com.8333 > tom-Latitude-3570.34524: tcp 0
09:55:45.263935 IP tom-Latitude-3570.60304 > 185.207.232.56.8333: tcp 24
09:55:45.296920 IP 185.207.232.56.8333 > tom-Latitude-3570.60304: tcp 24
09:55:45.296946 IP tom-Latitude-3570.60304 > 185.207.232.56.8333: tcp 8
09:55:45.311939 IP 185.207.232.56.8333 > tom-Latitude-3570.60304: tcp 8
09:55:45.332245 IP 47.52.161.242.8333 > tom-Latitude-3570.52038: tcp 61
09:55:45.332373 IP tom-Latitude-3570.52038 > 47.52.161.242.8333: tcp 0
09:55:45.332466 IP tom-Latitude-3570.52038 > 47.52.161.242.8333: tcp 24
09:55:45.332477 IP tom-Latitude-3570.52038 > 47.52.161.242.8333: tcp 284
09:55:45.355951 IP tom-Latitude-3570.60304 > 185.207.232.56.8333: tcp 0
09:55:45.355998 IP tom-Latitude-3570.60304 > 185.207.232.56.8333: tcp 32
09:55:45.499343 IP 106.33-244-23.rdns.scalabledns.com.8333 > tom-Latitude-3570.34524: tcp 0
09:55:45.534652 IP vmd25034.contaboserver.net.8333 > tom-Latitude-3570.35144: tcp 0
09:55:45.559759 IP tom-Latitude-3570.56010 > 23.226.90.172.8333: tcp 0
09:55:45.573266 IP vmd25034.contaboserver.net.8333 > tom-Latitude-3570.35144: tcp 0
09:55:45.591490 IP 106.33-244-23.rdns.scalabledns.com.8333 > tom-Latitude-3570.34524: tcp 0
09:55:45.603726 IP 104-62-47-181.lightspeed.bcvloh.sbcglobal.net.8333 > tom-Latitude-3570.33742: tcp 0
09:55:45.604998 IP 104-62-47-181.lightspeed.bcvloh.sbcglobal.net.8333 > tom-Latitude-3570.33742: tcp 0
09:55:45.606519 IP 47.52.161.242.8333 > tom-Latitude-3570.52038: tcp 0
09:55:45.608082 IP 185.207.232.56.8333 > tom-Latitude-3570.60304: tcp 0
09:55:45.614758 IP 47.52.161.242.8333 > tom-Latitude-3570.52038: tcp 0
09:55:45.635902 IP 104-62-47-181.lightspeed.bcvloh.sbcglobal.net.8333 > tom-Latitude-3570.33742: tcp 0
09:55:45.637529 IP 104-62-47-181.lightspeed.bcvloh.sbcglobal.net.8333 > tom-Latitude-3570.33742: tcp 0
09:55:45.644826 IP vmd25034.contaboserver.net.8333 > tom-Latitude-3570.35144: tcp 0
09:55:45.646333 IP 185.207.232.56.8333 > tom-Latitude-3570.60304: tcp 0
09:55:45.649496 IP 185.207.232.56.8333 > tom-Latitude-3570.60304: tcp 0
09:55:45.651017 IP 47.52.161.242.8333 > tom-Latitude-3570.52038: tcp 0
09:55:45.653740 IP 47.52.161.242.8333 > tom-Latitude-3570.52038: tcp 0
09:55:45.655162 IP 185.207.232.56.8333 > tom-Latitude-3570.60304: tcp 0
09:55:45.659613 IP 23.226.90.172.8333 > tom-Latitude-3570.56010: tcp 0
09:55:45.659645 IP tom-Latitude-3570.56010 > 23.226.90.172.8333: tcp 0
09:55:45.659950 IP tom-Latitude-3570.56010 > 23.226.90.172.8333: tcp 24
09:55:45.678077 IP vmd25034.contaboserver.net.8333 > tom-Latitude-3570.35144: tcp 24
09:55:45.718889 IP tom-Latitude-3570.56010 > 23.226.90.172.8333: tcp 102
09:55:45.723226 IP vmd25034.contaboserver.net.8333 > tom-Latitude-3570.35144: tcp 283
09:55:45.723250 IP tom-Latitude-3570.35144 > vmd25034.contaboserver.net.8333: tcp 0
09:55:45.723470 IP tom-Latitude-3570.43084 > 47.244.214.69.8333: tcp 24
09:55:45.723849 IP tom-Latitude-3570.35144 > vmd25034.contaboserver.net.8333: tcp 24
09:55:45.726757 IP vmd25034.contaboserver.net.8333 > tom-Latitude-3570.35144: tcp 24
09:55:45.728759 IP vmd25034.contaboserver.net.8333 > tom-Latitude-3570.35144: tcp 284
09:55:45.728875 IP tom-Latitude-3570.35144 > vmd25034.contaboserver.net.8333: tcp 0
09:55:45.732340 IP 185.207.232.56.8333 > tom-Latitude-3570.60304: tcp 24
09:55:45.732452 IP tom-Latitude-3570.60304 > 185.207.232.56.8333: tcp 0
09:55:45.743759 IP 185.207.232.56.8333 > tom-Latitude-3570.60304: tcp 8
09:55:45.743900 IP tom-Latitude-3570.60304 > 185.207.232.56.8333: tcp 0
09:55:45.744387 IP tom-Latitude-3570.43084 > 47.244.214.69.8333: tcp 325
09:55:45.744978 IP tom-Latitude-3570.35144 > vmd25034.contaboserver.net.8333: tcp 411
09:55:45.746911 IP 104-62-47-181.lightspeed.bcvloh.sbcglobal.net.8333 > tom-Latitude-3570.33742: tcp 24
09:55:45.774762 IP 104-62-47-181.lightspeed.bcvloh.sbcglobal.net.8333 > tom-Latitude-3570.33742: tcp 506
09:55:45.774780 IP tom-Latitude-3570.33742 > 104-62-47-181.lightspeed.bcvloh.sbcglobal.net.8333: tcp 0
09:55:45.876045 IP tom-Latitude-3570.60304 > 185.207.232.56.8333: tcp 24
09:55:45.877875 IP tom-Latitude-3570.60304 > 185.207.232.56.8333: tcp 289
09:55:45.887225 IP 47.52.161.242.8333 > tom-Latitude-3570.52038: tcp 313
09:55:45.887555 IP tom-Latitude-3570.52038 > 47.52.161.242.8333: tcp 24
09:55:45.888249 IP tom-Latitude-3570.52038 > 47.52.161.242.8333: tcp 217
09:55:45.910386 IP 47.52.161.242.8333 > tom-Latitude-3570.52038: tcp 247
09:55:45.927734 IP tom-Latitude-3570.56010 > 23.226.90.172.8333: tcp 102
09:55:45.945612 IP 47.52.161.242.8333 > tom-Latitude-3570.52038: tcp 73
09:55:45.945616 IP tom-Latitude-3570.52038 > 47.52.161.242.8333: tcp 0
09:55:45.983082 IP 23.226.90.172.8333 > tom-Latitude-3570.56010: tcp 0
09:55:46.045958 IP tom-Latitude-3570.43084 > 47.244.214.69.8333: tcp 24
09:55:46.045973 IP tom-Latitude-3570.43084 > 47.244.214.69.8333: tcp 145
09:55:46.054663 IP 23.226.90.172.8333 > tom-Latitude-3570.56010: tcp 0
09:55:46.099183 IP 47.244.214.69.8333 > tom-Latitude-3570.43084: tcp 24
09:55:46.099203 IP tom-Latitude-3570.43084 > 47.244.214.69.8333: tcp 0
09:55:46.282695 IP 47.244.214.69.8333 > tom-Latitude-3570.43084: tcp 0
09:55:46.284266 IP vmd25034.contaboserver.net.8333 > tom-Latitude-3570.35144: tcp 0
09:55:46.286469 IP 47.244.214.69.8333 > tom-Latitude-3570.43084: tcp 0
09:55:46.287871 IP vmd25034.contaboserver.net.8333 > tom-Latitude-3570.35144: tcp 0
09:55:46.289345 IP 185.207.232.56.8333 > tom-Latitude-3570.60304: tcp 0
09:55:46.290778 IP 185.207.232.56.8333 > tom-Latitude-3570.60304: tcp 0
09:55:46.294918 IP 47.52.161.242.8333 > tom-Latitude-3570.52038: tcp 0
09:55:46.298531 IP 23.226.90.172.8333 > tom-Latitude-3570.56010: tcp 24
09:55:46.298548 IP tom-Latitude-3570.56010 > 23.226.90.172.8333: tcp 0
09:55:46.299258 IP 23.226.90.172.8333 > tom-Latitude-3570.56010: tcp 126
09:55:46.299282 IP tom-Latitude-3570.56010 > 23.226.90.172.8333: tcp 0
09:55:46.299452 IP tom-Latitude-3570.56010 > 23.226.90.172.8333: tcp 24
09:55:46.299613 IP tom-Latitude-3570.56010 > 23.226.90.172.8333: tcp 1254
09:55:46.308486 IP tom-Latitude-3570.56010 > 23.226.90.172.8333: tcp 32
09:55:46.310091 IP 23.226.90.172.8333 > tom-Latitude-3570.56010: tcp 0
09:55:46.314401 IP 47.52.161.242.8333 > tom-Latitude-3570.52038: tcp 0
09:55:46.318685 IP 47.244.214.69.8333 > tom-Latitude-3570.43084: tcp 0
09:55:46.320178 IP 47.244.214.69.8333 > tom-Latitude-3570.43084: tcp 0
09:55:46.323861 IP vmd25034.contaboserver.net.8333 > tom-Latitude-3570.35144: tcp 24
09:55:46.328416 IP vmd25034.contaboserver.net.8333 > tom-Latitude-3570.35144: tcp 284
09:55:46.328544 IP tom-Latitude-3570.35144 > vmd25034.contaboserver.net.8333: tcp 0
09:55:46.330128 IP vmd25034.contaboserver.net.8333 > tom-Latitude-3570.35144: tcp 24
09:55:46.339360 IP vmd25034.contaboserver.net.8333 > tom-Latitude-3570.35144: tcp 283
09:55:46.339473 IP tom-Latitude-3570.35144 > vmd25034.contaboserver.net.8333: tcp 0
09:55:46.339547 IP 47.52.161.242.8333 > tom-Latitude-3570.52038: tcp 97
09:55:46.339977 IP tom-Latitude-3570.52038 > 47.52.161.242.8333: tcp 24
09:55:46.341045 IP 23.226.90.172.8333 > tom-Latitude-3570.56010: tcp 0
09:55:46.343539 IP tom-Latitude-3570.52038 > 47.52.161.242.8333: tcp 73
09:55:46.406077 IP 23.226.90.172.8333 > tom-Latitude-3570.56010: tcp 0
09:55:46.409681 IP 23.226.90.172.8333 > tom-Latitude-3570.56010: tcp 0
09:55:46.415235 IP 47.52.161.242.8333 > tom-Latitude-3570.52038: tcp 0
09:55:46.416882 IP 47.52.161.242.8333 > tom-Latitude-3570.52038: tcp 0
09:55:46.440268 IP tom-Latitude-3570.33742 > 104-62-47-181.lightspeed.bcvloh.sbcglobal.net.8333: tcp 24
09:55:46.447420 IP tom-Latitude-3570.33742 > 104-62-47-181.lightspeed.bcvloh.sbcglobal.net.8333: tcp 37
09:55:46.493355 IP 104-62-47-181.lightspeed.bcvloh.sbcglobal.net.8333 > tom-Latitude-3570.33742: tcp 0
09:55:46.495844 IP 104-62-47-181.lightspeed.bcvloh.sbcglobal.net.8333 > tom-Latitude-3570.33742: tcp 0
09:55:46.513755 IP 23.226.90.172.8333 > tom-Latitude-3570.56010: tcp 24
09:55:46.535685 IP 23.226.90.172.8333 > tom-Latitude-3570.56010: tcp 66
09:55:46.535702 IP 23.226.90.172.8333 > tom-Latitude-3570.56010: tcp 32
09:55:46.535795 IP tom-Latitude-3570.56010 > 23.226.90.172.8333: tcp 0
09:55:46.535912 IP tom-Latitude-3570.56010 > 23.226.90.172.8333: tcp 24
09:55:46.537614 IP 23.226.90.172.8333 > tom-Latitude-3570.56010: tcp 55
09:55:46.539902 IP 23.226.90.172.8333 > tom-Latitude-3570.56010: tcp 24
09:55:46.540050 IP tom-Latitude-3570.56010 > 23.226.90.172.8333: tcp 8
09:55:46.638062 IP tom-Latitude-3570.60304 > 185.207.232.56.8333: tcp 24
09:55:46.663189 IP tom-Latitude-3570.60304 > 185.207.232.56.8333: tcp 73
09:55:46.673193 IP 23.226.90.172.8333 > tom-Latitude-3570.56010: tcp 1029
09:55:46.673412 IP tom-Latitude-3570.56010 > 23.226.90.172.8333: tcp 24
09:55:46.673428 IP tom-Latitude-3570.56010 > 23.226.90.172.8333: tcp 82
09:55:46.682916 IP 23.226.90.172.8333 > tom-Latitude-3570.56010: tcp 32
09:55:46.697317 IP 47.52.161.242.8333 > tom-Latitude-3570.52038: tcp 213
09:55:46.698808 IP 47.52.161.242.8333 > tom-Latitude-3570.52038: tcp 216
09:55:46.698938 IP tom-Latitude-3570.52038 > 47.52.161.242.8333: tcp 0
09:55:46.703751 IP 47.52.161.242.8333 > tom-Latitude-3570.52038: tcp 213
09:55:46.723907 IP tom-Latitude-3570.56010 > 23.226.90.172.8333: tcp 0
09:55:46.748915 IP 47.52.161.242.8333 > tom-Latitude-3570.52038: tcp 429
09:55:46.748932 IP tom-Latitude-3570.52038 > 47.52.161.242.8333: tcp 0
09:55:46.749130 IP tom-Latitude-3570.43084 > 47.244.214.69.8333: tcp 24
09:55:46.749566 IP tom-Latitude-3570.52038 > 47.52.161.242.8333: tcp 24
09:55:46.756761 IP tom-Latitude-3570.43084 > 47.244.214.69.8333: tcp 8
09:55:46.759267 IP tom-Latitude-3570.52038 > 47.52.161.242.8333: tcp 73
09:55:46.770988 IP 47.52.161.242.8333 > tom-Latitude-3570.52038: tcp 249
09:55:46.811907 IP tom-Latitude-3570.52038 > 47.52.161.242.8333: tcp 0
09:55:46.857227 IP 47.52.161.242.8333 > tom-Latitude-3570.52038: tcp 405
09:55:46.857359 IP tom-Latitude-3570.52038 > 47.52.161.242.8333: tcp 0
09:55:46.857722 IP tom-Latitude-3570.52038 > 47.52.161.242.8333: tcp 24
09:55:46.857738 IP tom-Latitude-3570.52038 > 47.52.161.242.8333: tcp 37
09:55:46.869357 IP 23.226.90.172.8333 > tom-Latitude-3570.56010: tcp 0
09:55:46.872693 IP 23.226.90.172.8333 > tom-Latitude-3570.56010: tcp 24
09:55:46.872710 IP tom-Latitude-3570.56010 > 23.226.90.172.8333: tcp 0
09:55:46.873959 IP 23.226.90.172.8333 > tom-Latitude-3570.56010: tcp 8
09:55:46.873976 IP tom-Latitude-3570.56010 > 23.226.90.172.8333: tcp 0
09:55:46.877575 IP 23.226.90.172.8333 > tom-Latitude-3570.56010: tcp 24
09:55:46.877592 IP tom-Latitude-3570.56010 > 23.226.90.172.8333: tcp 0
09:55:46.936046 IP static.93.100.202.116.clients.your-server.de.8333 > tom-Latitude-3570.38996: tcp 745
09:55:46.936089 IP tom-Latitude-3570.38996 > static.93.100.202.116.clients.your-server.de.8333: tcp 0
09:55:46.936393 IP tom-Latitude-3570.38996 > static.93.100.202.116.clients.your-server.de.8333: tcp 24
09:55:46.936478 IP tom-Latitude-3570.33742 > 104-62-47-181.lightspeed.bcvloh.sbcglobal.net.8333: tcp 24
09:55:46.937189 IP 23.226.90.172.8333 > tom-Latitude-3570.56010: tcp 0
09:55:46.938201 IP tom-Latitude-3570.38996 > static.93.100.202.116.clients.your-server.de.8333: tcp 37
09:55:46.940599 IP 23.226.90.172.8333 > tom-Latitude-3570.56010: tcp 82
09:55:46.940613 IP tom-Latitude-3570.56010 > 23.226.90.172.8333: tcp 0
09:55:46.941341 IP tom-Latitude-3570.33742 > 104-62-47-181.lightspeed.bcvloh.sbcglobal.net.8333: tcp 145
09:55:46.945280 IP 185.207.232.56.8333 > tom-Latitude-3570.60304: tcp 0
09:55:47.011710 IP 23.226.90.172.8333 > tom-Latitude-3570.56010: tcp 0
09:55:47.014384 IP 185.207.232.56.8333 > tom-Latitude-3570.60304: tcp 0
09:55:47.015808 IP 23.226.90.172.8333 > tom-Latitude-3570.56010: tcp 0
09:55:47.036960 IP 47.52.161.242.8333 > tom-Latitude-3570.52038: tcp 397
09:55:47.037334 IP tom-Latitude-3570.47264 > static-87-75-105-186.vodafonexdsl.co.uk.8333: tcp 24
09:55:47.038070 IP tom-Latitude-3570.47264 > static-87-75-105-186.vodafonexdsl.co.uk.8333: tcp 1009
09:55:47.063933 IP 47.52.161.242.8333 > tom-Latitude-3570.52038: tcp 248
09:55:47.063950 IP tom-Latitude-3570.52038 > 47.52.161.242.8333: tcp 0
09:55:47.064427 IP tom-Latitude-3570.52038 > 47.52.161.242.8333: tcp 24
09:55:47.064444 IP tom-Latitude-3570.52038 > 47.52.161.242.8333: tcp 37
09:55:47.077934 IP 47.244.214.69.8333 > tom-Latitude-3570.43084: tcp 0
09:55:47.079431 IP 47.52.161.242.8333 > tom-Latitude-3570.52038: tcp 0
09:55:47.082650 IP 47.244.214.69.8333 > tom-Latitude-3570.43084: tcp 0
09:55:47.084054 IP 47.52.161.242.8333 > tom-Latitude-3570.52038: tcp 0
09:55:47.085583 IP 47.52.161.242.8333 > tom-Latitude-3570.52038: tcp 0
09:55:47.087115 IP 47.52.161.242.8333 > tom-Latitude-3570.52038: tcp 0
09:55:47.092707 IP static.93.100.202.116.clients.your-server.de.8333 > tom-Latitude-3570.38996: tcp 0
09:55:47.095461 IP 104-62-47-181.lightspeed.bcvloh.sbcglobal.net.8333 > tom-Latitude-3570.33742: tcp 0
09:55:47.096946 IP static.93.100.202.116.clients.your-server.de.8333 > tom-Latitude-3570.38996: tcp 0
09:55:47.098383 IP 104-62-47-181.lightspeed.bcvloh.sbcglobal.net.8333 > tom-Latitude-3570.33742: tcp 0
09:55:47.110246 IP 47.244.214.69.8333 > tom-Latitude-3570.43084: tcp 24
09:55:47.110264 IP tom-Latitude-3570.43084 > 47.244.214.69.8333: tcp 0
09:55:47.110275 IP 47.244.214.69.8333 > tom-Latitude-3570.43084: tcp 8
09:55:47.110277 IP tom-Latitude-3570.43084 > 47.244.214.69.8333: tcp 0
09:55:47.111682 IP static-87-75-105-186.vodafonexdsl.co.uk.8333 > tom-Latitude-3570.47264: tcp 0
09:55:47.116051 IP 47.244.214.69.8333 > tom-Latitude-3570.43084: tcp 24
09:55:47.116071 IP tom-Latitude-3570.43084 > 47.244.214.69.8333: tcp 0
09:55:47.135466 IP 47.244.214.69.8333 > tom-Latitude-3570.43084: tcp 8
09:55:47.135486 IP tom-Latitude-3570.43084 > 47.244.214.69.8333: tcp 0
09:55:47.137002 IP static-87-75-105-186.vodafonexdsl.co.uk.8333 > tom-Latitude-3570.47264: tcp 0
09:55:47.138651 IP 47.52.161.242.8333 > tom-Latitude-3570.52038: tcp 0
09:55:47.159055 IP 47.52.161.242.8333 > tom-Latitude-3570.52038: tcp 428
09:55:47.164406 IP 47.52.161.242.8333 > tom-Latitude-3570.52038: tcp 61
09:55:47.164546 IP tom-Latitude-3570.52038 > 47.52.161.242.8333: tcp 0
09:55:47.264932 IP tom-Latitude-3570.52038 > 47.52.161.242.8333: tcp 24
09:55:47.264959 IP tom-Latitude-3570.52038 > 47.52.161.242.8333: tcp 37
09:55:47.273807 IP static.93.100.202.116.clients.your-server.de.8333 > tom-Latitude-3570.38996: tcp 544
09:55:47.273824 IP 47.52.161.242.8333 > tom-Latitude-3570.52038: tcp 0
09:55:47.281676 IP 47.52.161.242.8333 > tom-Latitude-3570.52038: tcp 579
09:55:47.281696 IP 23.226.90.172.8333 > tom-Latitude-3570.56010: tcp 24
09:55:47.281723 IP tom-Latitude-3570.56010 > 23.226.90.172.8333: tcp 0
09:55:47.283578 IP 23.226.90.172.8333 > tom-Latitude-3570.56010: tcp 73
09:55:47.283590 IP tom-Latitude-3570.56010 > 23.226.90.172.8333: tcp 0
09:55:47.283777 IP tom-Latitude-3570.56010 > 23.226.90.172.8333: tcp 24
09:55:47.285900 IP tom-Latitude-3570.56010 > 23.226.90.172.8333: tcp 37
09:55:47.301440 IP 47.52.161.242.8333 > tom-Latitude-3570.52038: tcp 0
09:55:47.311376 IP 47.52.161.242.8333 > tom-Latitude-3570.52038: tcp 0
09:55:47.315904 IP tom-Latitude-3570.38996 > static.93.100.202.116.clients.your-server.de.8333: tcp 0
09:55:47.327901 IP tom-Latitude-3570.52038 > 47.52.161.242.8333: tcp 0
09:55:47.358849 IP 23.226.90.172.8333 > tom-Latitude-3570.56010: tcp 0
09:55:47.384216 IP tom-Latitude-3570.38996 > static.93.100.202.116.clients.your-server.de.8333: tcp 24
09:55:47.384711 IP tom-Latitude-3570.38996 > static.93.100.202.116.clients.your-server.de.8333: tcp 145
09:55:47.424819 IP static.93.100.202.116.clients.your-server.de.8333 > tom-Latitude-3570.38996: tcp 0
09:55:47.428888 IP static.93.100.202.116.clients.your-server.de.8333 > tom-Latitude-3570.38996: tcp 0
09:55:47.511490 IP 47.52.161.242.8333 > tom-Latitude-3570.52038: tcp 247
09:55:47.511617 IP tom-Latitude-3570.52038 > 47.52.161.242.8333: tcp 0
09:55:47.516520 IP 23.226.90.172.8333 > tom-Latitude-3570.56010: tcp 24
09:55:47.559904 IP tom-Latitude-3570.56010 > 23.226.90.172.8333: tcp 0
09:55:47.561236 IP 23.226.90.172.8333 > tom-Latitude-3570.56010: tcp 373
09:55:47.561260 IP tom-Latitude-3570.56010 > 23.226.90.172.8333: tcp 0
09:55:47.662450 IP tom-Latitude-3570.33742 > 104-62-47-181.lightspeed.bcvloh.sbcglobal.net.8333: tcp 24
09:55:47.663044 IP tom-Latitude-3570.33742 > 104-62-47-181.lightspeed.bcvloh.sbcglobal.net.8333: tcp 325
09:55:47.697649 IP 104-62-47-181.lightspeed.bcvloh.sbcglobal.net.8333 > tom-Latitude-3570.33742: tcp 0
09:55:47.717513 IP 104-62-47-181.lightspeed.bcvloh.sbcglobal.net.8333 > tom-Latitude-3570.33742: tcp 0
09:55:47.815759 IP 104-62-47-181.lightspeed.bcvloh.sbcglobal.net.8333 > tom-Latitude-3570.33742: tcp 24
09:55:47.859836 IP tom-Latitude-3570.33742 > 104-62-47-181.lightspeed.bcvloh.sbcglobal.net.8333: tcp 0
09:55:47.863013 IP tom-Latitude-3570.56010 > 23.226.90.172.8333: tcp 24
09:55:47.863458 IP tom-Latitude-3570.56010 > 23.226.90.172.8333: tcp 397
09:55:47.906239 IP 104-62-47-181.lightspeed.bcvloh.sbcglobal.net.8333 > tom-Latitude-3570.33742: tcp 289
09:55:47.906258 IP 23.226.90.172.8333 > tom-Latitude-3570.56010: tcp 0
09:55:47.906349 IP tom-Latitude-3570.33742 > 104-62-47-181.lightspeed.bcvloh.sbcglobal.net.8333: tcp 0
09:55:47.906554 IP tom-Latitude-3570.33742 > 104-62-47-181.lightspeed.bcvloh.sbcglobal.net.8333: tcp 24
09:55:47.907581 IP 23.226.90.172.8333 > tom-Latitude-3570.56010: tcp 0
09:55:47.908015 IP tom-Latitude-3570.33742 > 104-62-47-181.lightspeed.bcvloh.sbcglobal.net.8333: tcp 73
09:55:47.957510 IP 104-62-47-181.lightspeed.bcvloh.sbcglobal.net.8333 > tom-Latitude-3570.33742: tcp 0
09:55:47.958965 IP 104-62-47-181.lightspeed.bcvloh.sbcglobal.net.8333 > tom-Latitude-3570.33742: tcp 0
09:55:48.120318 IP 104-62-47-181.lightspeed.bcvloh.sbcglobal.net.8333 > tom-Latitude-3570.33742: tcp 24
09:55:48.163904 IP tom-Latitude-3570.33742 > 104-62-47-181.lightspeed.bcvloh.sbcglobal.net.8333: tcp 0
09:55:48.166968 IP 104-62-47-181.lightspeed.bcvloh.sbcglobal.net.8333 > tom-Latitude-3570.33742: tcp 620
09:55:48.167102 IP tom-Latitude-3570.33742 > 104-62-47-181.lightspeed.bcvloh.sbcglobal.net.8333: tcp 0
09:55:48.281280 IP 47.52.161.242.8333 > tom-Latitude-3570.52038: tcp 169
09:55:48.281412 IP tom-Latitude-3570.52038 > 47.52.161.242.8333: tcp 0
09:55:48.783395 IP tom-Latitude-3570.60304 > 185.207.232.56.8333: tcp 24
09:55:48.785952 IP tom-Latitude-3570.60304 > 185.207.232.56.8333: tcp 541
09:55:48.789298 IP static.93.100.202.116.clients.your-server.de.8333 > tom-Latitude-3570.38996: tcp 169
09:55:48.789322 IP tom-Latitude-3570.38996 > static.93.100.202.116.clients.your-server.de.8333: tcp 0
09:55:48.789620 IP tom-Latitude-3570.38996 > static.93.100.202.116.clients.your-server.de.8333: tcp 24
09:55:48.790076 IP tom-Latitude-3570.38996 > static.93.100.202.116.clients.your-server.de.8333: tcp 37
09:55:49.188348 IP vmd25034.contaboserver.net.8333 > tom-Latitude-3570.35144: tcp 24
09:55:49.231902 IP tom-Latitude-3570.35144 > vmd25034.contaboserver.net.8333: tcp 0
09:55:49.291435 IP tom-Latitude-3570.35144 > vmd25034.contaboserver.net.8333: tcp 24
09:55:49.291469 IP tom-Latitude-3570.52038 > 47.52.161.242.8333: tcp 24
09:55:49.294221 IP tom-Latitude-3570.35144 > vmd25034.contaboserver.net.8333: tcp 685
09:55:49.294241 IP tom-Latitude-3570.52038 > 47.52.161.242.8333: tcp 8
09:55:49.412621 IP vmd25034.contaboserver.net.8333 > tom-Latitude-3570.35144: tcp 577
09:55:49.412647 IP tom-Latitude-3570.35144 > vmd25034.contaboserver.net.8333: tcp 0
09:55:49.412678 IP 47.52.161.242.8333 > tom-Latitude-3570.52038: tcp 32
09:55:49.412753 IP tom-Latitude-3570.52038 > 47.52.161.242.8333: tcp 0
09:55:49.412979 IP tom-Latitude-3570.35144 > vmd25034.contaboserver.net.8333: tcp 24
09:55:49.412994 IP tom-Latitude-3570.35144 > vmd25034.contaboserver.net.8333: tcp 37
09:55:49.413010 IP tom-Latitude-3570.52038 > 47.52.161.242.8333: tcp 24
09:55:49.415898 IP tom-Latitude-3570.52038 > 47.52.161.242.8333: tcp 8
09:55:49.627792 IP tom-Latitude-3570.60304 > 185.207.232.56.8333: tcp 541
09:55:49.713700 IP tom-Latitude-3570.56010 > 23.226.90.172.8333: tcp 24
09:55:49.714423 IP tom-Latitude-3570.56010 > 23.226.90.172.8333: tcp 73
09:55:49.819912 IP tom-Latitude-3570.38996 > static.93.100.202.116.clients.your-server.de.8333: tcp 37
09:55:50.011917 IP tom-Latitude-3570.52038 > 47.52.161.242.8333: tcp 8
09:55:50.043103 IP static.93.100.202.116.clients.your-server.de.8333 > tom-Latitude-3570.38996: tcp 169
09:55:50.043122 IP tom-Latitude-3570.38996 > static.93.100.202.116.clients.your-server.de.8333: tcp 0
09:55:50.075905 IP tom-Latitude-3570.56010 > 23.226.90.172.8333: tcp 73
09:55:50.125920 IP 47.52.161.242.8333 > tom-Latitude-3570.52038: tcp 32
09:55:50.125940 IP tom-Latitude-3570.52038 > 47.52.161.242.8333: tcp 0
09:55:50.150884 IP static.93.100.202.116.clients.your-server.de.8333 > tom-Latitude-3570.38996: tcp 205
09:55:50.150909 IP tom-Latitude-3570.38996 > static.93.100.202.116.clients.your-server.de.8333: tcp 0
09:55:50.151219 IP tom-Latitude-3570.38996 > static.93.100.202.116.clients.your-server.de.8333: tcp 24
09:55:50.151234 IP tom-Latitude-3570.38996 > static.93.100.202.116.clients.your-server.de.8333: tcp 145
09:55:50.151375 IP tom-Latitude-3570.47264 > static-87-75-105-186.vodafonexdsl.co.uk.8333: tcp 24
09:55:50.207110 IP tom-Latitude-3570.47264 > static-87-75-105-186.vodafonexdsl.co.uk.8333: tcp 397
09:55:50.233800 IP vmd25034.contaboserver.net.8333 > tom-Latitude-3570.35144: tcp 577
09:55:50.233819 IP tom-Latitude-3570.35144 > vmd25034.contaboserver.net.8333: tcp 0
09:55:50.301909 IP 23.226.90.172.8333 > tom-Latitude-3570.56010: tcp 24
09:55:50.301935 IP tom-Latitude-3570.56010 > 23.226.90.172.8333: tcp 0
09:55:50.321642 IP 23.226.90.172.8333 > tom-Latitude-3570.56010: tcp 289
09:55:50.321667 IP tom-Latitude-3570.56010 > 23.226.90.172.8333: tcp 0
09:55:50.321999 IP tom-Latitude-3570.56010 > 23.226.90.172.8333: tcp 24
09:55:50.322028 IP tom-Latitude-3570.56010 > 23.226.90.172.8333: tcp 37
09:55:50.475793 IP tom-Latitude-3570.56010 > 23.226.90.172.8333: tcp 158
09:55:50.504272 IP 104-62-47-181.lightspeed.bcvloh.sbcglobal.net.8333 > tom-Latitude-3570.33742: tcp 24
09:55:50.504291 IP tom-Latitude-3570.33742 > 104-62-47-181.lightspeed.bcvloh.sbcglobal.net.8333: tcp 0
09:55:50.505682 IP 104-62-47-181.lightspeed.bcvloh.sbcglobal.net.8333 > tom-Latitude-3570.33742: tcp 217
09:55:50.505697 IP tom-Latitude-3570.33742 > 104-62-47-181.lightspeed.bcvloh.sbcglobal.net.8333: tcp 0
09:55:50.627503 IP 23.226.90.172.8333 > tom-Latitude-3570.56010: tcp 289
09:55:50.627510 IP tom-Latitude-3570.56010 > 23.226.90.172.8333: tcp 0
09:55:51.003919 IP tom-Latitude-3570.35144 > vmd25034.contaboserver.net.8333: tcp 37
09:55:51.099918 IP tom-Latitude-3570.60304 > 185.207.232.56.8333: tcp 565
09:55:51.325869 IP 47.244.214.69.8333 > tom-Latitude-3570.43084: tcp 24
09:55:51.325895 IP tom-Latitude-3570.43084 > 47.244.214.69.8333: tcp 0
09:55:51.395884 IP 23.226.90.172.8333 > tom-Latitude-3570.56010: tcp 24
09:55:51.395900 IP tom-Latitude-3570.56010 > 23.226.90.172.8333: tcp 0
09:55:51.408493 IP 23.226.90.172.8333 > tom-Latitude-3570.56010: tcp 73
09:55:51.408510 IP tom-Latitude-3570.56010 > 23.226.90.172.8333: tcp 0
09:55:51.497141 IP static.93.100.202.116.clients.your-server.de.8333 > tom-Latitude-3570.38996: tcp 133
09:55:51.515908 IP tom-Latitude-3570.47264 > static-87-75-105-186.vodafonexdsl.co.uk.8333: tcp 397
09:55:51.539916 IP tom-Latitude-3570.38996 > static.93.100.202.116.clients.your-server.de.8333: tcp 0
09:55:51.867911 IP tom-Latitude-3570.38996 > static.93.100.202.116.clients.your-server.de.8333: tcp 230
09:55:51.995922 IP tom-Latitude-3570.56010 > 23.226.90.172.8333: tcp 158
09:55:52.315916 IP tom-Latitude-3570.52038 > 47.52.161.242.8333: tcp 64
09:55:53.401497 IP 104-62-47-181.lightspeed.bcvloh.sbcglobal.net.8333 > tom-Latitude-3570.33742: tcp 217
09:55:53.401515 IP tom-Latitude-3570.33742 > 104-62-47-181.lightspeed.bcvloh.sbcglobal.net.8333: tcp 0
09:55:53.424341 IP vmd25034.contaboserver.net.8333 > tom-Latitude-3570.35144: tcp 24
09:55:53.424358 IP tom-Latitude-3570.35144 > vmd25034.contaboserver.net.8333: tcp 0
09:55:53.442134 IP vmd25034.contaboserver.net.8333 > tom-Latitude-3570.35144: tcp 289
09:55:53.442161 IP tom-Latitude-3570.35144 > vmd25034.contaboserver.net.8333: tcp 0
09:55:53.449797 IP 104-62-47-181.lightspeed.bcvloh.sbcglobal.net.8333 > tom-Latitude-3570.33742: tcp 133
09:55:53.449809 IP tom-Latitude-3570.33742 > 104-62-47-181.lightspeed.bcvloh.sbcglobal.net.8333: tcp 0
09:55:53.461836 IP 104-62-47-181.lightspeed.bcvloh.sbcglobal.net.8333 > tom-Latitude-3570.33742: tcp 24
09:55:53.461853 IP tom-Latitude-3570.33742 > 104-62-47-181.lightspeed.bcvloh.sbcglobal.net.8333: tcp 0
09:55:53.463930 IP 104-62-47-181.lightspeed.bcvloh.sbcglobal.net.8333 > tom-Latitude-3570.33742: tcp 73
09:55:53.463948 IP tom-Latitude-3570.33742 > 104-62-47-181.lightspeed.bcvloh.sbcglobal.net.8333: tcp 0
09:55:53.464175 IP tom-Latitude-3570.33742 > 104-62-47-181.lightspeed.bcvloh.sbcglobal.net.8333: tcp 24
09:55:53.471916 IP 185.207.232.56.8333 > tom-Latitude-3570.60304: tcp 0
09:55:53.474538 IP 185.207.232.56.8333 > tom-Latitude-3570.60304: tcp 0
09:55:53.480195 IP static.93.100.202.116.clients.your-server.de.8333 > tom-Latitude-3570.38996: tcp 0
09:55:53.480216 IP tom-Latitude-3570.38996 > static.93.100.202.116.clients.your-server.de.8333: tcp 61
09:55:53.481594 IP static.93.100.202.116.clients.your-server.de.8333 > tom-Latitude-3570.38996: tcp 0
09:55:53.501601 IP vmd25034.contaboserver.net.8333 > tom-Latitude-3570.35144: tcp 0
09:55:53.503104 IP 47.52.161.242.8333 > tom-Latitude-3570.52038: tcp 0
09:55:53.504578 IP vmd25034.contaboserver.net.8333 > tom-Latitude-3570.35144: tcp 0
09:55:53.506026 IP 47.52.161.242.8333 > tom-Latitude-3570.52038: tcp 0
09:55:53.507530 IP vmd25034.contaboserver.net.8333 > tom-Latitude-3570.35144: tcp 0
09:55:53.508865 IP vmd25034.contaboserver.net.8333 > tom-Latitude-3570.35144: tcp 0
09:55:53.511880 IP 47.52.161.242.8333 > tom-Latitude-3570.52038: tcp 0
09:55:53.513283 IP 47.52.161.242.8333 > tom-Latitude-3570.52038: tcp 0
09:55:53.517113 IP 185.207.232.56.8333 > tom-Latitude-3570.60304: tcp 0
09:55:53.520002 IP 23.226.90.172.8333 > tom-Latitude-3570.56010: tcp 0
09:55:53.520023 IP tom-Latitude-3570.56010 > 23.226.90.172.8333: tcp 97
09:55:53.521675 IP 23.226.90.172.8333 > tom-Latitude-3570.56010: tcp 0
09:55:53.531221 IP static.93.100.202.116.clients.your-server.de.8333 > tom-Latitude-3570.38996: tcp 0
09:55:53.534473 IP 47.52.161.242.8333 > tom-Latitude-3570.52038: tcp 0
09:55:53.540502 IP 23.226.90.172.8333 > tom-Latitude-3570.56010: tcp 0
09:55:53.541930 IP static.93.100.202.116.clients.your-server.de.8333 > tom-Latitude-3570.38996: tcp 0
09:55:53.543384 IP static-87-75-105-186.vodafonexdsl.co.uk.8333 > tom-Latitude-3570.47264: tcp 0
09:55:53.544957 IP static.93.100.202.116.clients.your-server.de.8333 > tom-Latitude-3570.38996: tcp 0
09:55:53.549684 IP static-87-75-105-186.vodafonexdsl.co.uk.8333 > tom-Latitude-3570.47264: tcp 0
09:55:53.561441 IP 23.226.90.172.8333 > tom-Latitude-3570.56010: tcp 0
09:55:53.562856 IP 23.226.90.172.8333 > tom-Latitude-3570.56010: tcp 0
09:55:53.566629 IP 23.226.90.172.8333 > tom-Latitude-3570.56010: tcp 0
09:55:53.624289 IP tom-Latitude-3570.33742 > 104-62-47-181.lightspeed.bcvloh.sbcglobal.net.8333: tcp 73
09:55:53.663039 IP static.93.100.202.116.clients.your-server.de.8333 > tom-Latitude-3570.38996: tcp 281
09:55:53.663066 IP tom-Latitude-3570.38996 > static.93.100.202.116.clients.your-server.de.8333: tcp 0
09:55:53.690759 IP static.93.100.202.116.clients.your-server.de.8333 > tom-Latitude-3570.38996: tcp 395
09:55:53.690772 IP tom-Latitude-3570.38996 > static.93.100.202.116.clients.your-server.de.8333: tcp 0
09:55:53.693077 IP static.93.100.202.116.clients.your-server.de.8333 > tom-Latitude-3570.38996: tcp 214
09:55:53.693094 IP tom-Latitude-3570.38996 > static.93.100.202.116.clients.your-server.de.8333: tcp 0
09:55:53.704284 IP static.93.100.202.116.clients.your-server.de.8333 > tom-Latitude-3570.38996: tcp 271
09:55:53.704302 IP tom-Latitude-3570.38996 > static.93.100.202.116.clients.your-server.de.8333: tcp 0
09:55:53.713517 IP static.93.100.202.116.clients.your-server.de.8333 > tom-Latitude-3570.38996: tcp 397
09:55:53.713535 IP tom-Latitude-3570.38996 > static.93.100.202.116.clients.your-server.de.8333: tcp 0
09:55:53.717013 IP vmd25034.contaboserver.net.8333 > tom-Latitude-3570.35144: tcp 24
09:55:53.717027 IP tom-Latitude-3570.35144 > vmd25034.contaboserver.net.8333: tcp 0
09:55:53.758797 IP vmd25034.contaboserver.net.8333 > tom-Latitude-3570.35144: tcp 1448
09:55:53.758814 IP tom-Latitude-3570.35144 > vmd25034.contaboserver.net.8333: tcp 0
09:55:53.771110 IP vmd25034.contaboserver.net.8333 > tom-Latitude-3570.35144: tcp 256
09:55:53.771127 IP tom-Latitude-3570.35144 > vmd25034.contaboserver.net.8333: tcp 0
09:55:53.779933 IP 23.226.90.172.8333 > tom-Latitude-3570.56010: tcp 24
09:55:53.779947 IP tom-Latitude-3570.56010 > 23.226.90.172.8333: tcp 0
09:55:53.887221 IP 23.226.90.172.8333 > tom-Latitude-3570.56010: tcp 963
09:55:53.887247 IP tom-Latitude-3570.56010 > 23.226.90.172.8333: tcp 0
09:55:53.906592 IP 47.52.161.242.8333 > tom-Latitude-3570.52038: tcp 32
09:55:53.906609 IP tom-Latitude-3570.52038 > 47.52.161.242.8333: tcp 0
09:55:54.449676 IP vmd25034.contaboserver.net.8333 > tom-Latitude-3570.35144: tcp 0
09:55:54.491905 IP tom-Latitude-3570.33742 > 104-62-47-181.lightspeed.bcvloh.sbcglobal.net.8333: tcp 73
09:55:54.497495 IP 185.207.232.56.8333 > tom-Latitude-3570.60304: tcp 0
09:55:54.549720 IP 47.244.214.69.8333 > tom-Latitude-3570.43084: tcp 613
09:55:54.549747 IP tom-Latitude-3570.43084 > 47.244.214.69.8333: tcp 0
09:55:54.549763 IP static-87-75-105-186.vodafonexdsl.co.uk.8333 > tom-Latitude-3570.47264: tcp 0
09:55:54.550064 IP tom-Latitude-3570.43084 > 47.244.214.69.8333: tcp 24
09:55:54.554757 IP static.93.100.202.116.clients.your-server.de.8333 > tom-Latitude-3570.38996: tcp 0
09:55:54.561623 IP 23.226.90.172.8333 > tom-Latitude-3570.56010: tcp 0
09:55:54.563482 IP 47.52.161.242.8333 > tom-Latitude-3570.52038: tcp 0
09:55:54.569641 IP 23.226.90.172.8333 > tom-Latitude-3570.56010: tcp 0
09:55:54.572349 IP 104-62-47-181.lightspeed.bcvloh.sbcglobal.net.8333 > tom-Latitude-3570.33742: tcp 0
09:55:54.573850 IP static.93.100.202.116.clients.your-server.de.8333 > tom-Latitude-3570.38996: tcp 0
09:55:54.577184 IP tom-Latitude-3570.43084 > 47.244.214.69.8333: tcp 8
09:55:54.579071 IP 104-62-47-181.lightspeed.bcvloh.sbcglobal.net.8333 > tom-Latitude-3570.33742: tcp 0
09:55:54.582062 IP 104-62-47-181.lightspeed.bcvloh.sbcglobal.net.8333 > tom-Latitude-3570.33742: tcp 0
09:55:54.600192 IP 47.244.214.69.8333 > tom-Latitude-3570.43084: tcp 0
09:55:54.611373 IP 47.244.214.69.8333 > tom-Latitude-3570.43084: tcp 0
09:55:54.709950 IP 23.226.90.172.8333 > tom-Latitude-3570.56010: tcp 24
09:55:54.709955 IP tom-Latitude-3570.56010 > 23.226.90.172.8333: tcp 0
09:55:54.757642 IP 23.226.90.172.8333 > tom-Latitude-3570.56010: tcp 686
09:55:54.757659 IP tom-Latitude-3570.56010 > 23.226.90.172.8333: tcp 0
09:55:54.774436 IP 104-62-47-181.lightspeed.bcvloh.sbcglobal.net.8333 > tom-Latitude-3570.33742: tcp 24
09:55:54.781514 IP 104-62-47-181.lightspeed.bcvloh.sbcglobal.net.8333 > tom-Latitude-3570.33742: tcp 692
09:55:54.781614 IP tom-Latitude-3570.33742 > 104-62-47-181.lightspeed.bcvloh.sbcglobal.net.8333: tcp 0
09:55:54.983193 IP tom-Latitude-3570.47264 > static-87-75-105-186.vodafonexdsl.co.uk.8333: tcp 24
09:55:54.983989 IP tom-Latitude-3570.47264 > static-87-75-105-186.vodafonexdsl.co.uk.8333: tcp 397
09:55:55.083701 IP tom-Latitude-3570.43084 > 47.244.214.69.8333: tcp 24
09:55:55.084705 IP tom-Latitude-3570.43084 > 47.244.214.69.8333: tcp 721
09:55:55.585293 IP tom-Latitude-3570.56010 > 23.226.90.172.8333: tcp 24
09:55:55.585905 IP tom-Latitude-3570.56010 > 23.226.90.172.8333: tcp 73
09:55:55.803916 IP tom-Latitude-3570.43084 > 47.244.214.69.8333: tcp 721
09:55:56.660138 IP 23.226.90.172.8333 > tom-Latitude-3570.56010: tcp 24
09:55:56.660154 IP tom-Latitude-3570.56010 > 23.226.90.172.8333: tcp 0
09:55:56.666065 IP 23.226.90.172.8333 > tom-Latitude-3570.56010: tcp 325
09:55:56.666082 IP tom-Latitude-3570.56010 > 23.226.90.172.8333: tcp 0
09:55:56.666384 IP tom-Latitude-3570.56010 > 23.226.90.172.8333: tcp 24
09:55:56.666401 IP tom-Latitude-3570.56010 > 23.226.90.172.8333: tcp 253
09:55:57.083921 IP tom-Latitude-3570.43084 > 47.244.214.69.8333: tcp 745
09:55:57.168042 IP tom-Latitude-3570.60304 > 185.207.232.56.8333: tcp 24
09:55:57.168757 IP tom-Latitude-3570.60304 > 185.207.232.56.8333: tcp 397
09:55:57.691918 IP tom-Latitude-3570.47264 > static-87-75-105-186.vodafonexdsl.co.uk.8333: tcp 397
09:55:57.815343 IP 185.207.232.56.8333 > tom-Latitude-3570.60304: tcp 24
09:55:57.815369 IP tom-Latitude-3570.60304 > 185.207.232.56.8333: tcp 0
09:55:57.896697 IP 185.207.232.56.8333 > tom-Latitude-3570.60304: tcp 793
09:55:57.896723 IP tom-Latitude-3570.60304 > 185.207.232.56.8333: tcp 0
09:55:57.897147 IP tom-Latitude-3570.60304 > 185.207.232.56.8333: tcp 24
09:55:57.897164 IP tom-Latitude-3570.60304 > 185.207.232.56.8333: tcp 145
09:55:57.915747 IP tom-Latitude-3570.56010 > 23.226.90.172.8333: tcp 253
09:55:57.997335 IP tom-Latitude-3570.52038 > 47.52.161.242.8333: tcp 24
09:55:57.998479 IP tom-Latitude-3570.52038 > 47.52.161.242.8333: tcp 397
09:55:58.601931 IP 104-62-47-181.lightspeed.bcvloh.sbcglobal.net.8333 > tom-Latitude-3570.33742: tcp 24
09:55:58.601951 IP 104-62-47-181.lightspeed.bcvloh.sbcglobal.net.8333 > tom-Latitude-3570.33742: tcp 31
09:55:58.601995 IP tom-Latitude-3570.33742 > 104-62-47-181.lightspeed.bcvloh.sbcglobal.net.8333: tcp 0
09:55:58.654160 IP 23.226.90.172.8333 > tom-Latitude-3570.56010: tcp 325
09:55:58.654180 IP tom-Latitude-3570.56010 > 23.226.90.172.8333: tcp 0
09:55:58.852347 IP 185.207.232.56.8333 > tom-Latitude-3570.60304: tcp 793
09:55:58.852367 IP tom-Latitude-3570.60304 > 185.207.232.56.8333: tcp 0
09:55:58.862064 IP 47.244.214.69.8333 > tom-Latitude-3570.43084: tcp 24
09:55:58.903879 IP tom-Latitude-3570.43084 > 47.244.214.69.8333: tcp 0
09:55:58.904014 IP 47.244.214.69.8333 > tom-Latitude-3570.43084: tcp 1261
09:55:58.904032 IP tom-Latitude-3570.43084 > 47.244.214.69.8333: tcp 0
09:55:59.205389 IP tom-Latitude-3570.38996 > static.93.100.202.116.clients.your-server.de.8333: tcp 24
09:55:59.206009 IP tom-Latitude-3570.38996 > static.93.100.202.116.clients.your-server.de.8333: tcp 73
09:55:59.406168 IP tom-Latitude-3570.35144 > vmd25034.contaboserver.net.8333: tcp 24
09:55:59.547944 IP tom-Latitude-3570.52038 > 47.52.161.242.8333: tcp 397
09:55:59.569513 IP tom-Latitude-3570.35144 > vmd25034.contaboserver.net.8333: tcp 73
09:55:59.702822 IP static-87-75-105-186.vodafonexdsl.co.uk.8333 > tom-Latitude-3570.47264: tcp 0
09:55:59.724911 IP static-87-75-105-186.vodafonexdsl.co.uk.8333 > tom-Latitude-3570.47264: tcp 0
09:55:59.728527 IP 47.244.214.69.8333 > tom-Latitude-3570.43084: tcp 0
09:55:59.728548 IP tom-Latitude-3570.43084 > 47.244.214.69.8333: tcp 313
09:55:59.739908 IP tom-Latitude-3570.43084 > 47.244.214.69.8333: tcp 721
09:55:59.835908 IP tom-Latitude-3570.60304 > 185.207.232.56.8333: tcp 145
09:56:00.810650 IP tom-Latitude-3570.52038 > 47.52.161.242.8333: tcp 24
09:56:00.810669 IP tom-Latitude-3570.52038 > 47.52.161.242.8333: tcp 31
09:56:00.821256 IP 47.244.214.69.8333 > tom-Latitude-3570.43084: tcp 0
09:56:00.821280 IP tom-Latitude-3570.43084 > 47.244.214.69.8333: tcp 55
09:56:00.831721 IP 23.226.90.172.8333 > tom-Latitude-3570.56010: tcp 0
09:56:00.863600 IP 23.226.90.172.8333 > tom-Latitude-3570.56010: tcp 0
09:56:00.920219 IP 47.244.214.69.8333 > tom-Latitude-3570.43084: tcp 0
09:56:00.935873 IP 23.226.90.172.8333 > tom-Latitude-3570.56010: tcp 0
09:56:00.941475 IP 23.226.90.172.8333 > tom-Latitude-3570.56010: tcp 0
09:56:00.977733 IP 47.244.214.69.8333 > tom-Latitude-3570.43084: tcp 0
09:56:01.013436 IP 185.207.232.56.8333 > tom-Latitude-3570.60304: tcp 0
09:56:01.015076 IP 185.207.232.56.8333 > tom-Latitude-3570.60304: tcp 0
09:56:01.019916 IP tom-Latitude-3570.38996 > static.93.100.202.116.clients.your-server.de.8333: tcp 73
09:56:01.029958 IP static-87-75-105-186.vodafonexdsl.co.uk.8333 > tom-Latitude-3570.47264: tcp 0
09:56:01.065103 IP 185.207.232.56.8333 > tom-Latitude-3570.60304: tcp 0
09:56:01.067916 IP 185.207.232.56.8333 > tom-Latitude-3570.60304: tcp 0
09:56:01.069407 IP 23.226.90.172.8333 > tom-Latitude-3570.56010: tcp 0
09:56:01.078480 IP 47.52.161.242.8333 > tom-Latitude-3570.52038: tcp 0
09:56:01.079887 IP 47.52.161.242.8333 > tom-Latitude-3570.52038: tcp 0
09:56:01.108427 IP static.93.100.202.116.clients.your-server.de.8333 > tom-Latitude-3570.38996: tcp 0
09:56:01.111499 IP vmd25034.contaboserver.net.8333 > tom-Latitude-3570.35144: tcp 0
09:56:01.112967 IP static.93.100.202.116.clients.your-server.de.8333 > tom-Latitude-3570.38996: tcp 0
09:56:01.114549 IP 47.52.161.242.8333 > tom-Latitude-3570.52038: tcp 0
09:56:01.121046 IP vmd25034.contaboserver.net.8333 > tom-Latitude-3570.35144: tcp 0
09:56:01.123044 IP 23.226.90.172.8333 > tom-Latitude-3570.56010: tcp 24
09:56:01.123061 IP tom-Latitude-3570.56010 > 23.226.90.172.8333: tcp 0
09:56:01.625819 IP 47.244.214.69.8333 > tom-Latitude-3570.43084: tcp 24
09:56:01.625841 IP tom-Latitude-3570.43084 > 47.244.214.69.8333: tcp 0
09:56:01.634559 IP 47.244.214.69.8333 > tom-Latitude-3570.43084: tcp 283
09:56:01.634579 IP tom-Latitude-3570.43084 > 47.244.214.69.8333: tcp 0
09:56:01.634590 IP 47.244.214.69.8333 > tom-Latitude-3570.43084: tcp 24
09:56:01.634592 IP tom-Latitude-3570.43084 > 47.244.214.69.8333: tcp 0
09:56:01.653679 IP 47.244.214.69.8333 > tom-Latitude-3570.43084: tcp 250
09:56:01.653701 IP tom-Latitude-3570.43084 > 47.244.214.69.8333: tcp 0
09:56:01.653712 IP 47.244.214.69.8333 > tom-Latitude-3570.43084: tcp 24
09:56:01.653714 IP tom-Latitude-3570.43084 > 47.244.214.69.8333: tcp 0
09:56:01.657436 IP 47.244.214.69.8333 > tom-Latitude-3570.43084: tcp 283
09:56:01.657457 IP tom-Latitude-3570.43084 > 47.244.214.69.8333: tcp 0
09:56:01.659413 IP 47.244.214.69.8333 > tom-Latitude-3570.43084: tcp 24
09:56:01.659433 IP tom-Latitude-3570.43084 > 47.244.214.69.8333: tcp 0
09:56:01.672345 IP 47.244.214.69.8333 > tom-Latitude-3570.43084: tcp 283
09:56:01.672365 IP tom-Latitude-3570.43084 > 47.244.214.69.8333: tcp 0
09:56:01.675704 IP 47.244.214.69.8333 > tom-Latitude-3570.43084: tcp 24
09:56:01.675723 IP tom-Latitude-3570.43084 > 47.244.214.69.8333: tcp 0
09:56:01.695584 IP 47.244.214.69.8333 > tom-Latitude-3570.43084: tcp 283
09:56:01.695605 IP tom-Latitude-3570.43084 > 47.244.214.69.8333: tcp 0
09:56:01.699226 IP 47.244.214.69.8333 > tom-Latitude-3570.43084: tcp 24
