03:20:17.514682 IP tom-Latitude-3570.56714 > ns3113832.ip-54-38-177.eu.8333: tcp 24
03:20:17.516996 IP tom-Latitude-3570.56714 > ns3113832.ip-54-38-177.eu.8333: tcp 37
03:20:17.555045 IP ns3113832.ip-54-38-177.eu.8333 > tom-Latitude-3570.56714: tcp 0
03:20:17.615076 IP tom-Latitude-3570.39110 > vmi195435.contaboserver.net.8333: tcp 24
03:20:17.616457 IP tom-Latitude-3570.39110 > vmi195435.contaboserver.net.8333: tcp 37
03:20:17.647034 IP vmi195435.contaboserver.net.8333 > tom-Latitude-3570.39110: tcp 0
03:20:17.656036 IP vmi195435.contaboserver.net.8333 > tom-Latitude-3570.39110: tcp 0
03:20:17.916268 IP tom-Latitude-3570.60470 > bb42-60-217-183.singnet.com.sg.8333: tcp 24
03:20:17.918305 IP tom-Latitude-3570.60470 > bb42-60-217-183.singnet.com.sg.8333: tcp 541
03:20:17.918842 IP 2.56.9.15.8333 > tom-Latitude-3570.42516: tcp 24
03:20:17.918867 IP tom-Latitude-3570.42516 > 2.56.9.15.8333: tcp 0
03:20:17.918897 IP 2.56.9.15.8333 > tom-Latitude-3570.42516: tcp 181
03:20:17.918902 IP tom-Latitude-3570.42516 > 2.56.9.15.8333: tcp 0
03:20:17.919107 IP tom-Latitude-3570.42516 > 2.56.9.15.8333: tcp 24
03:20:17.921734 IP tom-Latitude-3570.42516 > 2.56.9.15.8333: tcp 145
03:20:17.954139 IP bb42-60-217-183.singnet.com.sg.8333 > tom-Latitude-3570.60470: tcp 0
03:20:17.954710 IP bb42-60-217-183.singnet.com.sg.8333 > tom-Latitude-3570.60470: tcp 0
03:20:17.954725 IP 2.56.9.15.8333 > tom-Latitude-3570.42516: tcp 0
03:20:18.051283 IP 2.56.9.15.8333 > tom-Latitude-3570.42516: tcp 24
03:20:18.051304 IP 2.56.9.15.8333 > tom-Latitude-3570.42516: tcp 437
03:20:18.051308 IP 2.56.9.15.8333 > tom-Latitude-3570.42516: tcp 24
03:20:18.051310 IP 2.56.9.15.8333 > tom-Latitude-3570.42516: tcp 222
03:20:18.051330 IP 2.56.9.15.8333 > tom-Latitude-3570.42516: tcp 24
03:20:18.051338 IP 2.56.9.15.8333 > tom-Latitude-3570.42516: tcp 223
03:20:18.051341 IP 2.56.9.15.8333 > tom-Latitude-3570.42516: tcp 24
03:20:18.051344 IP 2.56.9.15.8333 > tom-Latitude-3570.42516: tcp 226
03:20:18.051402 IP tom-Latitude-3570.42516 > 2.56.9.15.8333: tcp 0
03:20:18.456249 IP tom-Latitude-3570.49070 > c-185-45-236-223.customer.ggaweb.ch.8333: tcp 24
03:20:18.458489 IP tom-Latitude-3570.49070 > c-185-45-236-223.customer.ggaweb.ch.8333: tcp 397
03:20:18.493277 IP c-185-45-236-223.customer.ggaweb.ch.8333 > tom-Latitude-3570.49070: tcp 0
03:20:18.556638 IP tom-Latitude-3570.60988 > 81.198.101.144.8333: tcp 24
03:20:18.557575 IP tom-Latitude-3570.60988 > 81.198.101.144.8333: tcp 145
03:20:18.595052 IP 81.198.101.144.8333 > tom-Latitude-3570.60988: tcp 0
03:20:18.683390 IP 81.198.101.144.8333 > tom-Latitude-3570.60988: tcp 24
03:20:18.684125 IP 81.198.101.144.8333 > tom-Latitude-3570.60988: tcp 73
03:20:18.684253 IP tom-Latitude-3570.60988 > 81.198.101.144.8333: tcp 0
03:20:18.684339 IP tom-Latitude-3570.60988 > 81.198.101.144.8333: tcp 24
03:20:18.685914 IP tom-Latitude-3570.60988 > 81.198.101.144.8333: tcp 469
03:20:18.737159 IP 81.198.101.144.8333 > tom-Latitude-3570.60988: tcp 0
03:20:18.957435 IP 2.56.9.15.8333 > tom-Latitude-3570.42516: tcp 24
03:20:18.957454 IP 2.56.9.15.8333 > tom-Latitude-3570.42516: tcp 31
03:20:18.957563 IP tom-Latitude-3570.42516 > 2.56.9.15.8333: tcp 0
03:20:18.957673 IP tom-Latitude-3570.39110 > vmi195435.contaboserver.net.8333: tcp 24
03:20:18.959107 IP tom-Latitude-3570.39110 > vmi195435.contaboserver.net.8333: tcp 145
03:20:19.005110 IP vmi195435.contaboserver.net.8333 > tom-Latitude-3570.39110: tcp 0
03:20:19.005779 IP vmi195435.contaboserver.net.8333 > tom-Latitude-3570.39110: tcp 0
03:20:19.559630 IP tom-Latitude-3570.60470 > bb42-60-217-183.singnet.com.sg.8333: tcp 24
03:20:19.561715 IP tom-Latitude-3570.60470 > bb42-60-217-183.singnet.com.sg.8333: tcp 145
03:20:19.615482 IP bb42-60-217-183.singnet.com.sg.8333 > tom-Latitude-3570.60470: tcp 0
03:20:19.623184 IP bb42-60-217-183.singnet.com.sg.8333 > tom-Latitude-3570.60470: tcp 0
03:20:19.961024 IP tom-Latitude-3570.56714 > ns3113832.ip-54-38-177.eu.8333: tcp 24
03:20:19.963018 IP tom-Latitude-3570.56714 > ns3113832.ip-54-38-177.eu.8333: tcp 145
03:20:19.963724 IP bb42-60-217-183.singnet.com.sg.8333 > tom-Latitude-3570.60470: tcp 24
03:20:19.963744 IP bb42-60-217-183.singnet.com.sg.8333 > tom-Latitude-3570.60470: tcp 61
03:20:19.963747 IP bb42-60-217-183.singnet.com.sg.8333 > tom-Latitude-3570.60470: tcp 24
03:20:19.963750 IP bb42-60-217-183.singnet.com.sg.8333 > tom-Latitude-3570.60470: tcp 361
03:20:19.963838 IP tom-Latitude-3570.60470 > bb42-60-217-183.singnet.com.sg.8333: tcp 0
03:20:19.964090 IP tom-Latitude-3570.60470 > bb42-60-217-183.singnet.com.sg.8333: tcp 24
03:20:19.967670 IP tom-Latitude-3570.60470 > bb42-60-217-183.singnet.com.sg.8333: tcp 217
03:20:20.017766 IP ns3113832.ip-54-38-177.eu.8333 > tom-Latitude-3570.56714: tcp 0
03:20:20.017775 IP bb42-60-217-183.singnet.com.sg.8333 > tom-Latitude-3570.60470: tcp 0
03:20:20.017778 IP bb42-60-217-183.singnet.com.sg.8333 > tom-Latitude-3570.60470: tcp 0
03:20:20.595816 IP bb42-60-217-183.singnet.com.sg.8333 > tom-Latitude-3570.60470: tcp 24
03:20:20.595838 IP bb42-60-217-183.singnet.com.sg.8333 > tom-Latitude-3570.60470: tcp 486
03:20:20.595843 IP bb42-60-217-183.singnet.com.sg.8333 > tom-Latitude-3570.60470: tcp 24
03:20:20.595846 IP bb42-60-217-183.singnet.com.sg.8333 > tom-Latitude-3570.60470: tcp 223
03:20:20.595866 IP bb42-60-217-183.singnet.com.sg.8333 > tom-Latitude-3570.60470: tcp 24
03:20:20.595868 IP bb42-60-217-183.singnet.com.sg.8333 > tom-Latitude-3570.60470: tcp 225
03:20:20.595874 IP bb42-60-217-183.singnet.com.sg.8333 > tom-Latitude-3570.60470: tcp 24
03:20:20.595877 IP bb42-60-217-183.singnet.com.sg.8333 > tom-Latitude-3570.60470: tcp 249
03:20:20.595938 IP tom-Latitude-3570.60470 > bb42-60-217-183.singnet.com.sg.8333: tcp 0
03:20:20.595975 IP bb42-60-217-183.singnet.com.sg.8333 > tom-Latitude-3570.60470: tcp 24
03:20:20.595997 IP bb42-60-217-183.singnet.com.sg.8333 > tom-Latitude-3570.60470: tcp 192
03:20:20.595999 IP bb42-60-217-183.singnet.com.sg.8333 > tom-Latitude-3570.60470: tcp 24
03:20:20.596002 IP bb42-60-217-183.singnet.com.sg.8333 > tom-Latitude-3570.60470: tcp 373
03:20:20.596033 IP tom-Latitude-3570.60470 > bb42-60-217-183.singnet.com.sg.8333: tcp 0
03:20:20.687788 IP tom-Latitude-3570.50772 > 47.244.213.136.8333: tcp 0
03:20:20.717243 IP 47.244.213.136.8333 > tom-Latitude-3570.50772: tcp 0
03:20:20.717274 IP tom-Latitude-3570.50772 > 47.244.213.136.8333: tcp 0
03:20:20.717624 IP tom-Latitude-3570.50772 > 47.244.213.136.8333: tcp 24
03:20:20.719451 IP tom-Latitude-3570.50772 > 47.244.213.136.8333: tcp 102
03:20:20.787920 IP tom-Latitude-3570.50772 > 47.244.213.136.8333: tcp 102
03:20:20.793939 IP 47.244.213.136.8333 > tom-Latitude-3570.50772: tcp 0
03:20:20.825130 IP 47.244.213.136.8333 > tom-Latitude-3570.50772: tcp 0
03:20:21.000881 IP tom-Latitude-3570.49070 > c-185-45-236-223.customer.ggaweb.ch.8333: tcp 24
03:20:21.003453 IP tom-Latitude-3570.49070 > c-185-45-236-223.customer.ggaweb.ch.8333: tcp 217
03:20:21.046182 IP c-185-45-236-223.customer.ggaweb.ch.8333 > tom-Latitude-3570.49070: tcp 0
03:20:21.101324 IP tom-Latitude-3570.56714 > ns3113832.ip-54-38-177.eu.8333: tcp 24
03:20:21.102260 IP tom-Latitude-3570.56714 > ns3113832.ip-54-38-177.eu.8333: tcp 217
03:20:21.153389 IP ns3113832.ip-54-38-177.eu.8333 > tom-Latitude-3570.56714: tcp 0
03:20:21.201780 IP tom-Latitude-3570.57976 > 167.99.216.145.8333: tcp 24
03:20:21.202713 IP tom-Latitude-3570.57976 > 167.99.216.145.8333: tcp 397
03:20:21.237372 IP 167.99.216.145.8333 > tom-Latitude-3570.57976: tcp 0
03:20:21.243466 IP 47.244.213.136.8333 > tom-Latitude-3570.50772: tcp 126
03:20:21.243490 IP tom-Latitude-3570.50772 > 47.244.213.136.8333: tcp 0
03:20:21.243520 IP 47.244.213.136.8333 > tom-Latitude-3570.50772: tcp 24
03:20:21.243524 IP tom-Latitude-3570.50772 > 47.244.213.136.8333: tcp 0
03:20:21.243529 IP 47.244.213.136.8333 > tom-Latitude-3570.50772: tcp 32
03:20:21.243531 IP tom-Latitude-3570.50772 > 47.244.213.136.8333: tcp 0
03:20:21.243534 IP 47.244.213.136.8333 > tom-Latitude-3570.50772: tcp 55
03:20:21.243536 IP tom-Latitude-3570.50772 > 47.244.213.136.8333: tcp 0
03:20:21.243674 IP tom-Latitude-3570.50772 > 47.244.213.136.8333: tcp 24
03:20:21.246317 IP 167.99.216.145.8333 > tom-Latitude-3570.57976: tcp 0
03:20:21.247692 IP tom-Latitude-3570.50772 > 47.244.213.136.8333: tcp 24
03:20:21.293951 IP tom-Latitude-3570.50772 > 47.244.213.136.8333: tcp 0
03:20:21.297133 IP 47.244.213.136.8333 > tom-Latitude-3570.50772: tcp 0
03:20:21.297175 IP 47.244.213.136.8333 > tom-Latitude-3570.50772: tcp 0
03:20:21.345689 IP tom-Latitude-3570.39110 > vmi195435.contaboserver.net.8333: tcp 24
03:20:21.346626 IP tom-Latitude-3570.39110 > vmi195435.contaboserver.net.8333: tcp 217
03:20:21.367204 IP 47.244.213.136.8333 > tom-Latitude-3570.50772: tcp 0
03:20:21.378963 IP vmi195435.contaboserver.net.8333 > tom-Latitude-3570.39110: tcp 0
03:20:21.385143 IP vmi195435.contaboserver.net.8333 > tom-Latitude-3570.39110: tcp 0
03:20:21.420702 IP 167.99.216.145.8333 > tom-Latitude-3570.57976: tcp 24
03:20:21.420718 IP tom-Latitude-3570.57976 > 167.99.216.145.8333: tcp 0
03:20:21.421358 IP 167.99.216.145.8333 > tom-Latitude-3570.57976: tcp 325
03:20:21.421382 IP tom-Latitude-3570.57976 > 167.99.216.145.8333: tcp 0
03:20:21.421667 IP tom-Latitude-3570.57976 > 167.99.216.145.8333: tcp 24
03:20:21.423660 IP tom-Latitude-3570.57976 > 167.99.216.145.8333: tcp 325
03:20:21.465333 IP 167.99.216.145.8333 > tom-Latitude-3570.57976: tcp 0
03:20:21.465341 IP 167.99.216.145.8333 > tom-Latitude-3570.57976: tcp 0
03:20:21.527716 IP 167.99.216.145.8333 > tom-Latitude-3570.57976: tcp 24
03:20:21.528506 IP 167.99.216.145.8333 > tom-Latitude-3570.57976: tcp 226
03:20:21.528523 IP 167.99.216.145.8333 > tom-Latitude-3570.57976: tcp 24
03:20:21.528526 IP 167.99.216.145.8333 > tom-Latitude-3570.57976: tcp 421
03:20:21.528529 IP 167.99.216.145.8333 > tom-Latitude-3570.57976: tcp 24
03:20:21.528623 IP tom-Latitude-3570.57976 > 167.99.216.145.8333: tcp 0
03:20:21.534953 IP 167.99.216.145.8333 > tom-Latitude-3570.57976: tcp 223
03:20:21.536143 IP 167.99.216.145.8333 > tom-Latitude-3570.57976: tcp 24
03:20:21.536159 IP 167.99.216.145.8333 > tom-Latitude-3570.57976: tcp 223
03:20:21.536162 IP 167.99.216.145.8333 > tom-Latitude-3570.57976: tcp 24
03:20:21.536164 IP 167.99.216.145.8333 > tom-Latitude-3570.57976: tcp 223
03:20:21.536251 IP tom-Latitude-3570.57976 > 167.99.216.145.8333: tcp 0
03:20:21.556281 IP 47.244.213.136.8333 > tom-Latitude-3570.50772: tcp 24
03:20:21.556301 IP tom-Latitude-3570.50772 > 47.244.213.136.8333: tcp 0
03:20:21.556847 IP 47.244.213.136.8333 > tom-Latitude-3570.50772: tcp 33
03:20:21.556867 IP tom-Latitude-3570.50772 > 47.244.213.136.8333: tcp 0
03:20:21.556877 IP 47.244.213.136.8333 > tom-Latitude-3570.50772: tcp 33
03:20:21.556879 IP tom-Latitude-3570.50772 > 47.244.213.136.8333: tcp 0
03:20:21.588177 IP 167.99.216.145.8333 > tom-Latitude-3570.57976: tcp 1214
03:20:21.631797 IP tom-Latitude-3570.57976 > 167.99.216.145.8333: tcp 0
03:20:21.789984 IP tom-Latitude-3570.49070 > c-185-45-236-223.customer.ggaweb.ch.8333: tcp 24
03:20:21.792319 IP tom-Latitude-3570.49070 > c-185-45-236-223.customer.ggaweb.ch.8333: tcp 325
03:20:21.792865 IP vmi195435.contaboserver.net.8333 > tom-Latitude-3570.39110: tcp 24
03:20:21.792885 IP vmi195435.contaboserver.net.8333 > tom-Latitude-3570.39110: tcp 325
03:20:21.792973 IP tom-Latitude-3570.39110 > vmi195435.contaboserver.net.8333: tcp 0
03:20:21.835040 IP c-185-45-236-223.customer.ggaweb.ch.8333 > tom-Latitude-3570.49070: tcp 0
03:20:21.993662 IP tom-Latitude-3570.60988 > 81.198.101.144.8333: tcp 24
03:20:21.995886 IP tom-Latitude-3570.60988 > 81.198.101.144.8333: tcp 541
03:20:22.035312 IP 81.198.101.144.8333 > tom-Latitude-3570.60988: tcp 0
03:20:22.125210 IP 81.198.101.144.8333 > tom-Latitude-3570.60988: tcp 24
03:20:22.125846 IP 81.198.101.144.8333 > tom-Latitude-3570.60988: tcp 37
03:20:22.125972 IP tom-Latitude-3570.60988 > 81.198.101.144.8333: tcp 0
03:20:22.126059 IP tom-Latitude-3570.60988 > 81.198.101.144.8333: tcp 24
03:20:22.129440 IP tom-Latitude-3570.60988 > 81.198.101.144.8333: tcp 226
03:20:22.165298 IP 81.198.101.144.8333 > tom-Latitude-3570.60988: tcp 0
03:20:22.627912 IP tom-Latitude-3570.46284 > static-87-75-105-186.vodafonexdsl.co.uk.8333: tcp 24
03:20:22.630246 IP tom-Latitude-3570.46284 > static-87-75-105-186.vodafonexdsl.co.uk.8333: tcp 793
03:20:22.667740 IP static-87-75-105-186.vodafonexdsl.co.uk.8333 > tom-Latitude-3570.46284: tcp 0
03:20:22.673495 IP static-87-75-105-186.vodafonexdsl.co.uk.8333 > tom-Latitude-3570.46284: tcp 0
03:20:22.715487 IP static-87-75-105-186.vodafonexdsl.co.uk.8333 > tom-Latitude-3570.46284: tcp 24
03:20:22.715504 IP tom-Latitude-3570.46284 > static-87-75-105-186.vodafonexdsl.co.uk.8333: tcp 0
03:20:22.721425 IP static-87-75-105-186.vodafonexdsl.co.uk.8333 > tom-Latitude-3570.46284: tcp 793
03:20:22.721449 IP tom-Latitude-3570.46284 > static-87-75-105-186.vodafonexdsl.co.uk.8333: tcp 0
03:20:22.821967 IP tom-Latitude-3570.42516 > 2.56.9.15.8333: tcp 24
03:20:22.822906 IP tom-Latitude-3570.42516 > 2.56.9.15.8333: tcp 541
03:20:22.865049 IP 2.56.9.15.8333 > tom-Latitude-3570.42516: tcp 0
03:20:23.053722 IP static-87-75-105-186.vodafonexdsl.co.uk.8333 > tom-Latitude-3570.46284: tcp 24
03:20:23.053746 IP tom-Latitude-3570.46284 > static-87-75-105-186.vodafonexdsl.co.uk.8333: tcp 0
03:20:23.053778 IP static-87-75-105-186.vodafonexdsl.co.uk.8333 > tom-Latitude-3570.46284: tcp 37
03:20:23.053780 IP tom-Latitude-3570.46284 > static-87-75-105-186.vodafonexdsl.co.uk.8333: tcp 0
03:20:23.053937 IP tom-Latitude-3570.46284 > static-87-75-105-186.vodafonexdsl.co.uk.8333: tcp 24
03:20:23.055914 IP tom-Latitude-3570.46284 > static-87-75-105-186.vodafonexdsl.co.uk.8333: tcp 37
03:20:23.095322 IP static-87-75-105-186.vodafonexdsl.co.uk.8333 > tom-Latitude-3570.46284: tcp 0
03:20:23.162221 IP static-87-75-105-186.vodafonexdsl.co.uk.8333 > tom-Latitude-3570.46284: tcp 24
03:20:23.162831 IP static-87-75-105-186.vodafonexdsl.co.uk.8333 > tom-Latitude-3570.46284: tcp 224
03:20:23.162961 IP tom-Latitude-3570.46284 > static-87-75-105-186.vodafonexdsl.co.uk.8333: tcp 0
03:20:23.464187 IP tom-Latitude-3570.49070 > c-185-45-236-223.customer.ggaweb.ch.8333: tcp 24
03:20:23.465881 IP tom-Latitude-3570.49070 > c-185-45-236-223.customer.ggaweb.ch.8333: tcp 37
03:20:23.524978 IP c-185-45-236-223.customer.ggaweb.ch.8333 > tom-Latitude-3570.49070: tcp 0
03:20:23.765216 IP tom-Latitude-3570.39110 > vmi195435.contaboserver.net.8333: tcp 24
03:20:23.765259 IP tom-Latitude-3570.60988 > 81.198.101.144.8333: tcp 24
03:20:23.767935 IP tom-Latitude-3570.39110 > vmi195435.contaboserver.net.8333: tcp 37
03:20:23.769245 IP tom-Latitude-3570.60988 > 81.198.101.144.8333: tcp 31
03:20:23.805686 IP vmi195435.contaboserver.net.8333 > tom-Latitude-3570.39110: tcp 0
03:20:23.806310 IP vmi195435.contaboserver.net.8333 > tom-Latitude-3570.39110: tcp 0
03:20:23.806324 IP 81.198.101.144.8333 > tom-Latitude-3570.60988: tcp 0
03:20:23.865645 IP tom-Latitude-3570.42516 > 2.56.9.15.8333: tcp 24
03:20:23.866702 IP tom-Latitude-3570.42516 > 2.56.9.15.8333: tcp 37
03:20:23.905569 IP 2.56.9.15.8333 > tom-Latitude-3570.42516: tcp 0
03:20:24.066364 IP tom-Latitude-3570.60988 > 81.198.101.144.8333: tcp 24
03:20:24.069618 IP tom-Latitude-3570.60988 > 81.198.101.144.8333: tcp 37
03:20:24.106555 IP 81.198.101.144.8333 > tom-Latitude-3570.60988: tcp 0
03:20:24.467753 IP tom-Latitude-3570.57976 > 167.99.216.145.8333: tcp 24
03:20:24.467845 IP tom-Latitude-3570.60470 > bb42-60-217-183.singnet.com.sg.8333: tcp 24
03:20:24.471450 IP tom-Latitude-3570.57976 > 167.99.216.145.8333: tcp 37
03:20:24.472454 IP tom-Latitude-3570.60470 > bb42-60-217-183.singnet.com.sg.8333: tcp 361
03:20:24.515604 IP 167.99.216.145.8333 > tom-Latitude-3570.57976: tcp 0
03:20:24.523352 IP bb42-60-217-183.singnet.com.sg.8333 > tom-Latitude-3570.60470: tcp 0
03:20:24.523368 IP bb42-60-217-183.singnet.com.sg.8333 > tom-Latitude-3570.60470: tcp 0
03:20:24.523371 IP 167.99.216.145.8333 > tom-Latitude-3570.57976: tcp 0
03:20:24.869278 IP tom-Latitude-3570.56714 > ns3113832.ip-54-38-177.eu.8333: tcp 24
03:20:24.871391 IP tom-Latitude-3570.56714 > ns3113832.ip-54-38-177.eu.8333: tcp 361
03:20:24.923075 IP ns3113832.ip-54-38-177.eu.8333 > tom-Latitude-3570.56714: tcp 0
03:20:25.716059 IP 81.198.101.144.8333 > tom-Latitude-3570.60988: tcp 24
03:20:25.716079 IP 81.198.101.144.8333 > tom-Latitude-3570.60988: tcp 73
03:20:25.716081 IP 81.198.101.144.8333 > tom-Latitude-3570.60988: tcp 73
03:20:25.716109 IP tom-Latitude-3570.60988 > 81.198.101.144.8333: tcp 0
03:20:25.716283 IP tom-Latitude-3570.60988 > 81.198.101.144.8333: tcp 24
03:20:25.717578 IP tom-Latitude-3570.60988 > 81.198.101.144.8333: tcp 73
03:20:25.755306 IP 81.198.101.144.8333 > tom-Latitude-3570.60988: tcp 0
03:20:25.844506 IP 81.198.101.144.8333 > tom-Latitude-3570.60988: tcp 24
03:20:25.845937 IP 81.198.101.144.8333 > tom-Latitude-3570.60988: tcp 226
03:20:25.845957 IP 81.198.101.144.8333 > tom-Latitude-3570.60988: tcp 24
03:20:25.845960 IP 81.198.101.144.8333 > tom-Latitude-3570.60988: tcp 217
03:20:25.846048 IP tom-Latitude-3570.60988 > 81.198.101.144.8333: tcp 0
03:20:25.846645 IP tom-Latitude-3570.42516 > 2.56.9.15.8333: tcp 24
03:20:25.847979 IP tom-Latitude-3570.42516 > 2.56.9.15.8333: tcp 37
03:20:25.885210 IP 2.56.9.15.8333 > tom-Latitude-3570.42516: tcp 0
03:20:25.947240 IP tom-Latitude-3570.42516 > 2.56.9.15.8333: tcp 24
03:20:25.948181 IP tom-Latitude-3570.42516 > 2.56.9.15.8333: tcp 37
03:20:25.967784 IP ns3113832.ip-54-38-177.eu.8333 > tom-Latitude-3570.56714: tcp 24
03:20:25.967809 IP tom-Latitude-3570.56714 > ns3113832.ip-54-38-177.eu.8333: tcp 0
03:20:25.968332 IP ns3113832.ip-54-38-177.eu.8333 > tom-Latitude-3570.56714: tcp 73
03:20:25.968349 IP tom-Latitude-3570.56714 > ns3113832.ip-54-38-177.eu.8333: tcp 0
03:20:25.980315 IP 2.56.9.15.8333 > tom-Latitude-3570.42516: tcp 0
03:20:26.570588 IP tom-Latitude-3570.39110 > vmi195435.contaboserver.net.8333: tcp 24
03:20:26.573506 IP tom-Latitude-3570.39110 > vmi195435.contaboserver.net.8333: tcp 73
03:20:26.626508 IP vmi195435.contaboserver.net.8333 > tom-Latitude-3570.39110: tcp 0
03:20:26.635279 IP vmi195435.contaboserver.net.8333 > tom-Latitude-3570.39110: tcp 0
03:20:27.072303 IP tom-Latitude-3570.46284 > static-87-75-105-186.vodafonexdsl.co.uk.8333: tcp 24
03:20:27.074294 IP tom-Latitude-3570.46284 > static-87-75-105-186.vodafonexdsl.co.uk.8333: tcp 73
03:20:27.121318 IP static-87-75-105-186.vodafonexdsl.co.uk.8333 > tom-Latitude-3570.46284: tcp 24
03:20:27.126704 IP static-87-75-105-186.vodafonexdsl.co.uk.8333 > tom-Latitude-3570.46284: tcp 217
03:20:27.126846 IP tom-Latitude-3570.46284 > static-87-75-105-186.vodafonexdsl.co.uk.8333: tcp 0
03:20:27.127019 IP tom-Latitude-3570.46284 > static-87-75-105-186.vodafonexdsl.co.uk.8333: tcp 24
03:20:27.130972 IP tom-Latitude-3570.46284 > static-87-75-105-186.vodafonexdsl.co.uk.8333: tcp 145
03:20:27.164934 IP static-87-75-105-186.vodafonexdsl.co.uk.8333 > tom-Latitude-3570.46284: tcp 0
03:20:27.238228 IP static-87-75-105-186.vodafonexdsl.co.uk.8333 > tom-Latitude-3570.46284: tcp 24
03:20:27.239027 IP static-87-75-105-186.vodafonexdsl.co.uk.8333 > tom-Latitude-3570.46284: tcp 569
03:20:27.239045 IP static-87-75-105-186.vodafonexdsl.co.uk.8333 > tom-Latitude-3570.46284: tcp 24
03:20:27.239048 IP static-87-75-105-186.vodafonexdsl.co.uk.8333 > tom-Latitude-3570.46284: tcp 277
03:20:27.239050 IP static-87-75-105-186.vodafonexdsl.co.uk.8333 > tom-Latitude-3570.46284: tcp 24
03:20:27.239054 IP static-87-75-105-186.vodafonexdsl.co.uk.8333 > tom-Latitude-3570.46284: tcp 249
03:20:27.239074 IP static-87-75-105-186.vodafonexdsl.co.uk.8333 > tom-Latitude-3570.46284: tcp 24
03:20:27.239077 IP static-87-75-105-186.vodafonexdsl.co.uk.8333 > tom-Latitude-3570.46284: tcp 190
03:20:27.239145 IP tom-Latitude-3570.46284 > static-87-75-105-186.vodafonexdsl.co.uk.8333: tcp 0
03:20:27.641539 IP tom-Latitude-3570.60470 > bb42-60-217-183.singnet.com.sg.8333: tcp 24
03:20:27.641590 IP tom-Latitude-3570.42516 > 2.56.9.15.8333: tcp 24
03:20:27.643847 IP tom-Latitude-3570.60470 > bb42-60-217-183.singnet.com.sg.8333: tcp 217
03:20:27.644732 IP tom-Latitude-3570.42516 > 2.56.9.15.8333: tcp 145
03:20:27.697550 IP 81.198.101.144.8333 > tom-Latitude-3570.60988: tcp 24
03:20:27.697569 IP 81.198.101.144.8333 > tom-Latitude-3570.60988: tcp 145
03:20:27.697680 IP tom-Latitude-3570.60988 > 81.198.101.144.8333: tcp 0
03:20:27.697792 IP tom-Latitude-3570.39110 > vmi195435.contaboserver.net.8333: tcp 24
03:20:27.697912 IP tom-Latitude-3570.57976 > 167.99.216.145.8333: tcp 24
03:20:27.700578 IP tom-Latitude-3570.39110 > vmi195435.contaboserver.net.8333: tcp 145
03:20:27.701289 IP tom-Latitude-3570.57976 > 167.99.216.145.8333: tcp 217
03:20:27.705342 IP bb42-60-217-183.singnet.com.sg.8333 > tom-Latitude-3570.60470: tcp 0
03:20:27.706091 IP 2.56.9.15.8333 > tom-Latitude-3570.42516: tcp 0
03:20:27.706104 IP bb42-60-217-183.singnet.com.sg.8333 > tom-Latitude-3570.60470: tcp 0
03:20:27.706107 IP c-185-45-236-223.customer.ggaweb.ch.8333 > tom-Latitude-3570.49070: tcp 24
03:20:27.706117 IP c-185-45-236-223.customer.ggaweb.ch.8333 > tom-Latitude-3570.49070: tcp 217
03:20:27.706193 IP tom-Latitude-3570.49070 > c-185-45-236-223.customer.ggaweb.ch.8333: tcp 0
03:20:27.717896 IP vmi195435.contaboserver.net.8333 > tom-Latitude-3570.39110: tcp 0
03:20:27.724795 IP 167.99.216.145.8333 > tom-Latitude-3570.57976: tcp 0
03:20:27.732134 IP vmi195435.contaboserver.net.8333 > tom-Latitude-3570.39110: tcp 0
03:20:27.732733 IP 167.99.216.145.8333 > tom-Latitude-3570.57976: tcp 0
03:20:28.709182 IP tom-Latitude-3570.56714 > ns3113832.ip-54-38-177.eu.8333: tcp 24
03:20:28.711266 IP tom-Latitude-3570.56714 > ns3113832.ip-54-38-177.eu.8333: tcp 145
03:20:28.753905 IP ns3113832.ip-54-38-177.eu.8333 > tom-Latitude-3570.56714: tcp 0
03:20:31.041162 IP 2.56.9.15.8333 > tom-Latitude-3570.42516: tcp 24
03:20:31.041182 IP 2.56.9.15.8333 > tom-Latitude-3570.42516: tcp 325
03:20:31.041205 IP 2.56.9.15.8333 > tom-Latitude-3570.42516: tcp 325
03:20:31.041216 IP tom-Latitude-3570.42516 > 2.56.9.15.8333: tcp 0
03:20:31.041474 IP tom-Latitude-3570.42516 > 2.56.9.15.8333: tcp 24
03:20:31.042563 IP tom-Latitude-3570.42516 > 2.56.9.15.8333: tcp 325
03:20:31.084986 IP 2.56.9.15.8333 > tom-Latitude-3570.42516: tcp 0
03:20:31.179944 IP 2.56.9.15.8333 > tom-Latitude-3570.42516: tcp 24
03:20:31.180691 IP 2.56.9.15.8333 > tom-Latitude-3570.42516: tcp 818
03:20:31.180710 IP 2.56.9.15.8333 > tom-Latitude-3570.42516: tcp 24
03:20:31.180820 IP tom-Latitude-3570.42516 > 2.56.9.15.8333: tcp 0
03:20:31.187861 IP 2.56.9.15.8333 > tom-Latitude-3570.42516: tcp 367
03:20:31.188415 IP 2.56.9.15.8333 > tom-Latitude-3570.42516: tcp 24
03:20:31.188431 IP 2.56.9.15.8333 > tom-Latitude-3570.42516: tcp 224
03:20:31.188434 IP 2.56.9.15.8333 > tom-Latitude-3570.42516: tcp 24
03:20:31.188454 IP 2.56.9.15.8333 > tom-Latitude-3570.42516: tcp 224
03:20:31.188457 IP 2.56.9.15.8333 > tom-Latitude-3570.42516: tcp 24
03:20:31.188461 IP 2.56.9.15.8333 > tom-Latitude-3570.42516: tcp 226
03:20:31.188505 IP tom-Latitude-3570.42516 > 2.56.9.15.8333: tcp 0
03:20:31.275928 IP 2.56.9.15.8333 > tom-Latitude-3570.42516: tcp 1217
03:20:31.276228 IP tom-Latitude-3570.56714 > ns3113832.ip-54-38-177.eu.8333: tcp 24
03:20:31.276979 IP tom-Latitude-3570.56714 > ns3113832.ip-54-38-177.eu.8333: tcp 181
03:20:31.314645 IP ns3113832.ip-54-38-177.eu.8333 > tom-Latitude-3570.56714: tcp 0
03:20:31.319904 IP tom-Latitude-3570.42516 > 2.56.9.15.8333: tcp 0
03:20:31.779161 IP tom-Latitude-3570.46284 > static-87-75-105-186.vodafonexdsl.co.uk.8333: tcp 24
03:20:31.782007 IP tom-Latitude-3570.46284 > static-87-75-105-186.vodafonexdsl.co.uk.8333: tcp 31
03:20:31.833282 IP static-87-75-105-186.vodafonexdsl.co.uk.8333 > tom-Latitude-3570.46284: tcp 0
03:20:32.180631 IP tom-Latitude-3570.46284 > static-87-75-105-186.vodafonexdsl.co.uk.8333: tcp 24
03:20:32.184210 IP tom-Latitude-3570.46284 > static-87-75-105-186.vodafonexdsl.co.uk.8333: tcp 325
03:20:32.234243 IP static-87-75-105-186.vodafonexdsl.co.uk.8333 > tom-Latitude-3570.46284: tcp 0
03:20:32.243471 IP 167.99.216.145.8333 > tom-Latitude-3570.57976: tcp 24
03:20:32.243496 IP tom-Latitude-3570.57976 > 167.99.216.145.8333: tcp 0
03:20:32.246540 IP 167.99.216.145.8333 > tom-Latitude-3570.57976: tcp 577
03:20:32.246564 IP tom-Latitude-3570.57976 > 167.99.216.145.8333: tcp 0
03:20:32.246967 IP tom-Latitude-3570.57976 > 167.99.216.145.8333: tcp 24
03:20:32.247929 IP tom-Latitude-3570.57976 > 167.99.216.145.8333: tcp 253
03:20:32.284498 IP 167.99.216.145.8333 > tom-Latitude-3570.57976: tcp 0
03:20:32.284506 IP 167.99.216.145.8333 > tom-Latitude-3570.57976: tcp 0
03:20:32.345645 IP 167.99.216.145.8333 > tom-Latitude-3570.57976: tcp 24
03:20:32.346519 IP 167.99.216.145.8333 > tom-Latitude-3570.57976: tcp 249
03:20:32.346538 IP 167.99.216.145.8333 > tom-Latitude-3570.57976: tcp 24
03:20:32.346541 IP 167.99.216.145.8333 > tom-Latitude-3570.57976: tcp 256
03:20:32.346544 IP 167.99.216.145.8333 > tom-Latitude-3570.57976: tcp 24
03:20:32.346546 IP 167.99.216.145.8333 > tom-Latitude-3570.57976: tcp 257
03:20:32.346570 IP 167.99.216.145.8333 > tom-Latitude-3570.57976: tcp 24
03:20:32.346638 IP tom-Latitude-3570.57976 > 167.99.216.145.8333: tcp 0
03:20:32.348713 IP 167.99.216.145.8333 > tom-Latitude-3570.57976: tcp 249
03:20:32.349701 IP 167.99.216.145.8333 > tom-Latitude-3570.57976: tcp 24
03:20:32.349732 IP 167.99.216.145.8333 > tom-Latitude-3570.57976: tcp 1340
03:20:32.349770 IP tom-Latitude-3570.57976 > 167.99.216.145.8333: tcp 0
03:20:32.407465 IP 167.99.216.145.8333 > tom-Latitude-3570.57976: tcp 608
03:20:32.447904 IP tom-Latitude-3570.57976 > 167.99.216.145.8333: tcp 0
03:20:32.709108 IP tom-Latitude-3570.49070 > c-185-45-236-223.customer.ggaweb.ch.8333: tcp 24
03:20:32.711257 IP tom-Latitude-3570.49070 > c-185-45-236-223.customer.ggaweb.ch.8333: tcp 577
03:20:32.763978 IP c-185-45-236-223.customer.ggaweb.ch.8333 > tom-Latitude-3570.49070: tcp 0
03:20:33.089229 IP static-87-75-105-186.vodafonexdsl.co.uk.8333 > tom-Latitude-3570.46284: tcp 24
03:20:33.089250 IP static-87-75-105-186.vodafonexdsl.co.uk.8333 > tom-Latitude-3570.46284: tcp 397
03:20:33.089254 IP static-87-75-105-186.vodafonexdsl.co.uk.8333 > tom-Latitude-3570.46284: tcp 397
03:20:33.089282 IP tom-Latitude-3570.46284 > static-87-75-105-186.vodafonexdsl.co.uk.8333: tcp 0
03:20:33.089567 IP tom-Latitude-3570.46284 > static-87-75-105-186.vodafonexdsl.co.uk.8333: tcp 24
03:20:33.090753 IP tom-Latitude-3570.46284 > static-87-75-105-186.vodafonexdsl.co.uk.8333: tcp 145
03:20:33.123971 IP static-87-75-105-186.vodafonexdsl.co.uk.8333 > tom-Latitude-3570.46284: tcp 0
03:20:33.196958 IP static-87-75-105-186.vodafonexdsl.co.uk.8333 > tom-Latitude-3570.46284: tcp 24
03:20:33.196979 IP static-87-75-105-186.vodafonexdsl.co.uk.8333 > tom-Latitude-3570.46284: tcp 407
03:20:33.196983 IP static-87-75-105-186.vodafonexdsl.co.uk.8333 > tom-Latitude-3570.46284: tcp 24
03:20:33.196987 IP static-87-75-105-186.vodafonexdsl.co.uk.8333 > tom-Latitude-3570.46284: tcp 226
03:20:33.196988 IP static-87-75-105-186.vodafonexdsl.co.uk.8333 > tom-Latitude-3570.46284: tcp 24
03:20:33.197009 IP static-87-75-105-186.vodafonexdsl.co.uk.8333 > tom-Latitude-3570.46284: tcp 370
03:20:33.197011 IP static-87-75-105-186.vodafonexdsl.co.uk.8333 > tom-Latitude-3570.46284: tcp 24
03:20:33.197083 IP tom-Latitude-3570.46284 > static-87-75-105-186.vodafonexdsl.co.uk.8333: tcp 0
03:20:33.198008 IP static-87-75-105-186.vodafonexdsl.co.uk.8333 > tom-Latitude-3570.46284: tcp 339
03:20:33.239907 IP tom-Latitude-3570.46284 > static-87-75-105-186.vodafonexdsl.co.uk.8333: tcp 0
03:20:33.908393 IP static-87-75-105-186.vodafonexdsl.co.uk.8333 > tom-Latitude-3570.46284: tcp 24
03:20:33.908407 IP tom-Latitude-3570.46284 > static-87-75-105-186.vodafonexdsl.co.uk.8333: tcp 0
03:20:33.908422 IP static-87-75-105-186.vodafonexdsl.co.uk.8333 > tom-Latitude-3570.46284: tcp 73
03:20:33.908424 IP tom-Latitude-3570.46284 > static-87-75-105-186.vodafonexdsl.co.uk.8333: tcp 0
03:20:33.908427 IP static-87-75-105-186.vodafonexdsl.co.uk.8333 > tom-Latitude-3570.46284: tcp 73
03:20:33.908446 IP tom-Latitude-3570.46284 > static-87-75-105-186.vodafonexdsl.co.uk.8333: tcp 0
03:20:33.908619 IP tom-Latitude-3570.46284 > static-87-75-105-186.vodafonexdsl.co.uk.8333: tcp 24
03:20:33.911309 IP tom-Latitude-3570.46284 > static-87-75-105-186.vodafonexdsl.co.uk.8333: tcp 73
03:20:33.943750 IP static-87-75-105-186.vodafonexdsl.co.uk.8333 > tom-Latitude-3570.46284: tcp 0
03:20:34.009855 IP static-87-75-105-186.vodafonexdsl.co.uk.8333 > tom-Latitude-3570.46284: tcp 24
03:20:34.010589 IP static-87-75-105-186.vodafonexdsl.co.uk.8333 > tom-Latitude-3570.46284: tcp 256
03:20:34.010608 IP static-87-75-105-186.vodafonexdsl.co.uk.8333 > tom-Latitude-3570.46284: tcp 24
03:20:34.010611 IP static-87-75-105-186.vodafonexdsl.co.uk.8333 > tom-Latitude-3570.46284: tcp 249
03:20:34.010699 IP tom-Latitude-3570.46284 > static-87-75-105-186.vodafonexdsl.co.uk.8333: tcp 0
03:20:34.318067 IP vmi195435.contaboserver.net.8333 > tom-Latitude-3570.39110: tcp 24
03:20:34.318089 IP vmi195435.contaboserver.net.8333 > tom-Latitude-3570.39110: tcp 793
03:20:34.318174 IP tom-Latitude-3570.39110 > vmi195435.contaboserver.net.8333: tcp 0
03:20:34.330793 IP vmi195435.contaboserver.net.8333 > tom-Latitude-3570.39110: tcp 793
03:20:34.330812 IP tom-Latitude-3570.39110 > vmi195435.contaboserver.net.8333: tcp 0
03:20:34.378862 IP bb42-60-217-183.singnet.com.sg.8333 > tom-Latitude-3570.60470: tcp 24
03:20:34.379579 IP bb42-60-217-183.singnet.com.sg.8333 > tom-Latitude-3570.60470: tcp 757
03:20:34.379719 IP tom-Latitude-3570.60470 > bb42-60-217-183.singnet.com.sg.8333: tcp 0
03:20:34.932991 IP c-185-45-236-223.customer.ggaweb.ch.8333 > tom-Latitude-3570.49070: tcp 24
03:20:34.933011 IP c-185-45-236-223.customer.ggaweb.ch.8333 > tom-Latitude-3570.49070: tcp 217
03:20:34.933016 IP c-185-45-236-223.customer.ggaweb.ch.8333 > tom-Latitude-3570.49070: tcp 217
03:20:34.933043 IP tom-Latitude-3570.49070 > c-185-45-236-223.customer.ggaweb.ch.8333: tcp 0
03:20:34.933349 IP tom-Latitude-3570.57976 > 167.99.216.145.8333: tcp 24
03:20:34.934525 IP tom-Latitude-3570.57976 > 167.99.216.145.8333: tcp 217
03:20:34.973951 IP 167.99.216.145.8333 > tom-Latitude-3570.57976: tcp 0
03:20:34.973996 IP 167.99.216.145.8333 > tom-Latitude-3570.57976: tcp 0
03:20:35.027840 IP bb42-60-217-183.singnet.com.sg.8333 > tom-Latitude-3570.60470: tcp 24
03:20:35.028403 IP bb42-60-217-183.singnet.com.sg.8333 > tom-Latitude-3570.60470: tcp 37
03:20:35.028531 IP tom-Latitude-3570.60470 > bb42-60-217-183.singnet.com.sg.8333: tcp 0
03:20:35.028764 IP tom-Latitude-3570.42516 > 2.56.9.15.8333: tcp 24
03:20:35.030103 IP tom-Latitude-3570.42516 > 2.56.9.15.8333: tcp 469
03:20:35.071552 IP 2.56.9.15.8333 > tom-Latitude-3570.42516: tcp 0
03:20:36.161501 IP 81.198.101.144.8333 > tom-Latitude-3570.60988: tcp 24
03:20:36.161521 IP 81.198.101.144.8333 > tom-Latitude-3570.60988: tcp 793
03:20:36.161526 IP 81.198.101.144.8333 > tom-Latitude-3570.60988: tcp 793
03:20:36.161553 IP tom-Latitude-3570.60988 > 81.198.101.144.8333: tcp 0
03:20:36.161568 IP static-87-75-105-186.vodafonexdsl.co.uk.8333 > tom-Latitude-3570.46284: tcp 24
03:20:36.161591 IP static-87-75-105-186.vodafonexdsl.co.uk.8333 > tom-Latitude-3570.46284: tcp 73
03:20:36.161597 IP static-87-75-105-186.vodafonexdsl.co.uk.8333 > tom-Latitude-3570.46284: tcp 73
03:20:36.161602 IP tom-Latitude-3570.46284 > static-87-75-105-186.vodafonexdsl.co.uk.8333: tcp 0
03:20:36.161917 IP tom-Latitude-3570.46284 > static-87-75-105-186.vodafonexdsl.co.uk.8333: tcp 24
03:20:36.164089 IP tom-Latitude-3570.46284 > static-87-75-105-186.vodafonexdsl.co.uk.8333: tcp 73
03:20:36.193900 IP static-87-75-105-186.vodafonexdsl.co.uk.8333 > tom-Latitude-3570.46284: tcp 0
03:20:36.261213 IP static-87-75-105-186.vodafonexdsl.co.uk.8333 > tom-Latitude-3570.46284: tcp 24
03:20:36.261233 IP static-87-75-105-186.vodafonexdsl.co.uk.8333 > tom-Latitude-3570.46284: tcp 370
03:20:36.261238 IP static-87-75-105-186.vodafonexdsl.co.uk.8333 > tom-Latitude-3570.46284: tcp 24
03:20:36.261330 IP tom-Latitude-3570.46284 > static-87-75-105-186.vodafonexdsl.co.uk.8333: tcp 0
03:20:36.262969 IP static-87-75-105-186.vodafonexdsl.co.uk.8333 > tom-Latitude-3570.46284: tcp 249
03:20:36.303901 IP tom-Latitude-3570.46284 > static-87-75-105-186.vodafonexdsl.co.uk.8333: tcp 0
03:20:36.322998 IP c-185-45-236-223.customer.ggaweb.ch.8333 > tom-Latitude-3570.49070: tcp 24
03:20:36.323015 IP tom-Latitude-3570.49070 > c-185-45-236-223.customer.ggaweb.ch.8333: tcp 0
03:20:36.323034 IP c-185-45-236-223.customer.ggaweb.ch.8333 > tom-Latitude-3570.49070: tcp 145
03:20:36.323038 IP tom-Latitude-3570.49070 > c-185-45-236-223.customer.ggaweb.ch.8333: tcp 0
03:20:36.323262 IP tom-Latitude-3570.49070 > c-185-45-236-223.customer.ggaweb.ch.8333: tcp 24
03:20:36.323472 IP tom-Latitude-3570.56714 > ns3113832.ip-54-38-177.eu.8333: tcp 24
03:20:36.325764 IP tom-Latitude-3570.49070 > c-185-45-236-223.customer.ggaweb.ch.8333: tcp 73
03:20:36.326486 IP tom-Latitude-3570.56714 > ns3113832.ip-54-38-177.eu.8333: tcp 685
03:20:36.363617 IP c-185-45-236-223.customer.ggaweb.ch.8333 > tom-Latitude-3570.49070: tcp 0
03:20:36.363632 IP ns3113832.ip-54-38-177.eu.8333 > tom-Latitude-3570.56714: tcp 0
03:20:36.446971 IP c-185-45-236-223.customer.ggaweb.ch.8333 > tom-Latitude-3570.49070: tcp 24
03:20:36.447589 IP c-185-45-236-223.customer.ggaweb.ch.8333 > tom-Latitude-3570.49070: tcp 774
03:20:36.447709 IP tom-Latitude-3570.49070 > c-185-45-236-223.customer.ggaweb.ch.8333: tcp 0
03:20:36.544972 IP 167.99.216.145.8333 > tom-Latitude-3570.57976: tcp 24
03:20:36.544996 IP tom-Latitude-3570.57976 > 167.99.216.145.8333: tcp 0
03:20:36.545584 IP 167.99.216.145.8333 > tom-Latitude-3570.57976: tcp 109
03:20:36.545608 IP tom-Latitude-3570.57976 > 167.99.216.145.8333: tcp 0
03:20:36.646182 IP tom-Latitude-3570.56714 > ns3113832.ip-54-38-177.eu.8333: tcp 24
03:20:36.646238 IP tom-Latitude-3570.60470 > bb42-60-217-183.singnet.com.sg.8333: tcp 24
03:20:36.667919 IP tom-Latitude-3570.56714 > ns3113832.ip-54-38-177.eu.8333: tcp 73
03:20:36.668494 IP tom-Latitude-3570.60470 > bb42-60-217-183.singnet.com.sg.8333: tcp 145
03:20:36.704016 IP bb42-60-217-183.singnet.com.sg.8333 > tom-Latitude-3570.60470: tcp 0
03:20:36.704604 IP ns3113832.ip-54-38-177.eu.8333 > tom-Latitude-3570.56714: tcp 0
03:20:36.704619 IP bb42-60-217-183.singnet.com.sg.8333 > tom-Latitude-3570.60470: tcp 0
03:20:36.746628 IP tom-Latitude-3570.39110 > vmi195435.contaboserver.net.8333: tcp 24
03:20:36.749133 IP tom-Latitude-3570.39110 > vmi195435.contaboserver.net.8333: tcp 145
03:20:36.775990 IP vmi195435.contaboserver.net.8333 > tom-Latitude-3570.39110: tcp 0
03:20:36.783894 IP vmi195435.contaboserver.net.8333 > tom-Latitude-3570.39110: tcp 0
03:20:36.853993 IP ns3113832.ip-54-38-177.eu.8333 > tom-Latitude-3570.56714: tcp 24
03:20:36.854017 IP tom-Latitude-3570.56714 > ns3113832.ip-54-38-177.eu.8333: tcp 0
03:20:36.854588 IP ns3113832.ip-54-38-177.eu.8333 > tom-Latitude-3570.56714: tcp 37
03:20:36.854606 IP tom-Latitude-3570.56714 > ns3113832.ip-54-38-177.eu.8333: tcp 0
03:20:36.854803 IP tom-Latitude-3570.56714 > ns3113832.ip-54-38-177.eu.8333: tcp 24
03:20:36.857962 IP tom-Latitude-3570.56714 > ns3113832.ip-54-38-177.eu.8333: tcp 344
03:20:36.884069 IP ns3113832.ip-54-38-177.eu.8333 > tom-Latitude-3570.56714: tcp 0
03:20:37.083004 IP static-87-75-105-186.vodafonexdsl.co.uk.8333 > tom-Latitude-3570.46284: tcp 24
03:20:37.083028 IP tom-Latitude-3570.46284 > static-87-75-105-186.vodafonexdsl.co.uk.8333: tcp 0
03:20:37.083058 IP static-87-75-105-186.vodafonexdsl.co.uk.8333 > tom-Latitude-3570.46284: tcp 73
03:20:37.083061 IP tom-Latitude-3570.46284 > static-87-75-105-186.vodafonexdsl.co.uk.8333: tcp 0
03:20:37.083065 IP bb42-60-217-183.singnet.com.sg.8333 > tom-Latitude-3570.60470: tcp 24
03:20:37.083086 IP bb42-60-217-183.singnet.com.sg.8333 > tom-Latitude-3570.60470: tcp 145
03:20:37.083117 IP tom-Latitude-3570.60470 > bb42-60-217-183.singnet.com.sg.8333: tcp 0
03:20:37.685258 IP tom-Latitude-3570.57976 > 167.99.216.145.8333: tcp 24
03:20:37.689164 IP tom-Latitude-3570.57976 > 167.99.216.145.8333: tcp 31
03:20:37.692108 IP ns3113832.ip-54-38-177.eu.8333 > tom-Latitude-3570.56714: tcp 24
03:20:37.692127 IP ns3113832.ip-54-38-177.eu.8333 > tom-Latitude-3570.56714: tcp 37
03:20:37.692131 IP ns3113832.ip-54-38-177.eu.8333 > tom-Latitude-3570.56714: tcp 37
03:20:37.692157 IP tom-Latitude-3570.56714 > ns3113832.ip-54-38-177.eu.8333: tcp 0
03:20:37.692335 IP tom-Latitude-3570.56714 > ns3113832.ip-54-38-177.eu.8333: tcp 24
03:20:37.707740 IP tom-Latitude-3570.56714 > ns3113832.ip-54-38-177.eu.8333: tcp 37
03:20:37.716042 IP 167.99.216.145.8333 > tom-Latitude-3570.57976: tcp 0
03:20:37.743990 IP 167.99.216.145.8333 > tom-Latitude-3570.57976: tcp 0
03:20:37.744667 IP ns3113832.ip-54-38-177.eu.8333 > tom-Latitude-3570.56714: tcp 0
03:20:37.802220 IP ns3113832.ip-54-38-177.eu.8333 > tom-Latitude-3570.56714: tcp 24
03:20:37.803688 IP ns3113832.ip-54-38-177.eu.8333 > tom-Latitude-3570.56714: tcp 1350
03:20:37.803708 IP ns3113832.ip-54-38-177.eu.8333 > tom-Latitude-3570.56714: tcp 1350
03:20:37.803712 IP ns3113832.ip-54-38-177.eu.8333 > tom-Latitude-3570.56714: tcp 1350
03:20:37.803715 IP ns3113832.ip-54-38-177.eu.8333 > tom-Latitude-3570.56714: tcp 1350
03:20:37.803737 IP ns3113832.ip-54-38-177.eu.8333 > tom-Latitude-3570.56714: tcp 1350
03:20:37.803803 IP tom-Latitude-3570.56714 > ns3113832.ip-54-38-177.eu.8333: tcp 0
03:20:37.807611 IP ns3113832.ip-54-38-177.eu.8333 > tom-Latitude-3570.56714: tcp 1350
03:20:37.807635 IP ns3113832.ip-54-38-177.eu.8333 > tom-Latitude-3570.56714: tcp 1350
03:20:37.807640 IP ns3113832.ip-54-38-177.eu.8333 > tom-Latitude-3570.56714: tcp 1350
03:20:37.807662 IP ns3113832.ip-54-38-177.eu.8333 > tom-Latitude-3570.56714: tcp 1273
03:20:37.807738 IP tom-Latitude-3570.56714 > ns3113832.ip-54-38-177.eu.8333: tcp 0
03:20:37.834543 IP tom-Latitude-3570.60470 > bb42-60-217-183.singnet.com.sg.8333: tcp 24
03:20:37.835596 IP tom-Latitude-3570.60470 > bb42-60-217-183.singnet.com.sg.8333: tcp 37
03:20:37.866497 IP bb42-60-217-183.singnet.com.sg.8333 > tom-Latitude-3570.60470: tcp 0
03:20:37.873933 IP bb42-60-217-183.singnet.com.sg.8333 > tom-Latitude-3570.60470: tcp 0
03:20:38.536731 IP tom-Latitude-3570.56714 > ns3113832.ip-54-38-177.eu.8333: tcp 24
03:20:38.539415 IP tom-Latitude-3570.56714 > ns3113832.ip-54-38-177.eu.8333: tcp 31
03:20:38.583972 IP c-185-45-236-223.customer.ggaweb.ch.8333 > tom-Latitude-3570.49070: tcp 24
03:20:38.585140 IP c-185-45-236-223.customer.ggaweb.ch.8333 > tom-Latitude-3570.49070: tcp 109
03:20:38.585160 IP c-185-45-236-223.customer.ggaweb.ch.8333 > tom-Latitude-3570.49070: tcp 109
03:20:38.585188 IP tom-Latitude-3570.49070 > c-185-45-236-223.customer.ggaweb.ch.8333: tcp 0
03:20:38.585382 IP tom-Latitude-3570.49070 > c-185-45-236-223.customer.ggaweb.ch.8333: tcp 24
03:20:38.585475 IP tom-Latitude-3570.46284 > static-87-75-105-186.vodafonexdsl.co.uk.8333: tcp 24
03:20:38.587230 IP tom-Latitude-3570.49070 > c-185-45-236-223.customer.ggaweb.ch.8333: tcp 73
03:20:38.588444 IP tom-Latitude-3570.46284 > static-87-75-105-186.vodafonexdsl.co.uk.8333: tcp 37
03:20:38.593545 IP ns3113832.ip-54-38-177.eu.8333 > tom-Latitude-3570.56714: tcp 0
03:20:38.621746 IP c-185-45-236-223.customer.ggaweb.ch.8333 > tom-Latitude-3570.49070: tcp 0
03:20:38.624551 IP static-87-75-105-186.vodafonexdsl.co.uk.8333 > tom-Latitude-3570.46284: tcp 0
03:20:38.657763 IP 167.99.216.145.8333 > tom-Latitude-3570.57976: tcp 24
03:20:38.657788 IP tom-Latitude-3570.57976 > 167.99.216.145.8333: tcp 0
03:20:38.658380 IP 167.99.216.145.8333 > tom-Latitude-3570.57976: tcp 73
03:20:38.658397 IP tom-Latitude-3570.57976 > 167.99.216.145.8333: tcp 0
03:20:38.704766 IP c-185-45-236-223.customer.ggaweb.ch.8333 > tom-Latitude-3570.49070: tcp 24
