23:24:51.384489 IP tom-Latitude-3570.33922 > pool-108-20-207-31.bstnma.fios.verizon.net.8333: tcp 24
23:24:51.386503 IP tom-Latitude-3570.33922 > pool-108-20-207-31.bstnma.fios.verizon.net.8333: tcp 361
23:24:51.424521 IP pool-108-20-207-31.bstnma.fios.verizon.net.8333 > tom-Latitude-3570.33922: tcp 0
23:24:51.470576 IP pool-108-20-207-31.bstnma.fios.verizon.net.8333 > tom-Latitude-3570.33922: tcp 0
23:24:51.886303 IP tom-Latitude-3570.36650 > ec2-52-56-97-80.eu-west-2.compute.amazonaws.com.8333: tcp 24
23:24:51.887668 IP tom-Latitude-3570.36650 > ec2-52-56-97-80.eu-west-2.compute.amazonaws.com.8333: tcp 649
23:24:51.935108 IP ec2-52-56-97-80.eu-west-2.compute.amazonaws.com.8333 > tom-Latitude-3570.36650: tcp 0
23:24:51.960835 IP ec2-52-56-97-80.eu-west-2.compute.amazonaws.com.8333 > tom-Latitude-3570.36650: tcp 0
23:24:52.068688 IP 97-82-78-25.dhcp.leds.al.charter.com.8333 > tom-Latitude-3570.47742: tcp 24
23:24:52.068713 IP tom-Latitude-3570.47742 > 97-82-78-25.dhcp.leds.al.charter.com.8333: tcp 0
23:24:52.071548 IP 97-82-78-25.dhcp.leds.al.charter.com.8333 > tom-Latitude-3570.47742: tcp 73
23:24:52.071565 IP tom-Latitude-3570.47742 > 97-82-78-25.dhcp.leds.al.charter.com.8333: tcp 0
23:24:52.071844 IP tom-Latitude-3570.47742 > 97-82-78-25.dhcp.leds.al.charter.com.8333: tcp 24
23:24:52.073061 IP tom-Latitude-3570.47742 > 97-82-78-25.dhcp.leds.al.charter.com.8333: tcp 73
23:24:52.110730 IP 97-82-78-25.dhcp.leds.al.charter.com.8333 > tom-Latitude-3570.47742: tcp 0
23:24:52.172264 IP tom-Latitude-3570.56244 > 172.214.77.34.bc.googleusercontent.com.8333: tcp 24
23:24:52.173820 IP tom-Latitude-3570.56244 > 172.214.77.34.bc.googleusercontent.com.8333: tcp 109
23:24:52.201212 IP 172.214.77.34.bc.googleusercontent.com.8333 > tom-Latitude-3570.56244: tcp 0
23:24:52.204348 IP 172.214.77.34.bc.googleusercontent.com.8333 > tom-Latitude-3570.56244: tcp 0
23:24:52.270702 IP 97-82-78-25.dhcp.leds.al.charter.com.8333 > tom-Latitude-3570.47742: tcp 24
23:24:52.271327 IP 97-82-78-25.dhcp.leds.al.charter.com.8333 > tom-Latitude-3570.47742: tcp 226
23:24:52.271344 IP 97-82-78-25.dhcp.leds.al.charter.com.8333 > tom-Latitude-3570.47742: tcp 24
23:24:52.271347 IP 97-82-78-25.dhcp.leds.al.charter.com.8333 > tom-Latitude-3570.47742: tcp 248
23:24:52.271435 IP tom-Latitude-3570.47742 > 97-82-78-25.dhcp.leds.al.charter.com.8333: tcp 0
23:24:52.374614 IP tom-Latitude-3570.47822 > 59.110.157.16.8333: tcp 24
23:24:52.375557 IP tom-Latitude-3570.47822 > 59.110.157.16.8333: tcp 541
23:24:52.408585 IP 59.110.157.16.8333 > tom-Latitude-3570.47822: tcp 0
23:24:52.440533 IP 59.110.157.16.8333 > tom-Latitude-3570.47822: tcp 0
23:24:52.520065 IP 172.214.77.34.bc.googleusercontent.com.8333 > tom-Latitude-3570.56244: tcp 24
23:24:52.520085 IP 172.214.77.34.bc.googleusercontent.com.8333 > tom-Latitude-3570.56244: tcp 181
23:24:52.520176 IP tom-Latitude-3570.56244 > 172.214.77.34.bc.googleusercontent.com.8333: tcp 0
23:24:52.520402 IP tom-Latitude-3570.56244 > 172.214.77.34.bc.googleusercontent.com.8333: tcp 24
23:24:52.521509 IP tom-Latitude-3570.56244 > 172.214.77.34.bc.googleusercontent.com.8333: tcp 109
23:24:52.555945 IP 172.214.77.34.bc.googleusercontent.com.8333 > tom-Latitude-3570.56244: tcp 0
23:24:52.557662 IP 172.214.77.34.bc.googleusercontent.com.8333 > tom-Latitude-3570.56244: tcp 0
23:24:52.618925 IP 172.214.77.34.bc.googleusercontent.com.8333 > tom-Latitude-3570.56244: tcp 24
23:24:52.619661 IP 172.214.77.34.bc.googleusercontent.com.8333 > tom-Latitude-3570.56244: tcp 666
23:24:52.619686 IP 172.214.77.34.bc.googleusercontent.com.8333 > tom-Latitude-3570.56244: tcp 24
23:24:52.619779 IP tom-Latitude-3570.56244 > 172.214.77.34.bc.googleusercontent.com.8333: tcp 0
23:24:52.623334 IP 172.214.77.34.bc.googleusercontent.com.8333 > tom-Latitude-3570.56244: tcp 373
23:24:52.623347 IP 172.214.77.34.bc.googleusercontent.com.8333 > tom-Latitude-3570.56244: tcp 24
23:24:52.623383 IP tom-Latitude-3570.56244 > 172.214.77.34.bc.googleusercontent.com.8333: tcp 0
23:24:52.623549 IP tom-Latitude-3570.34082 > host93-234-110-95.serverdedicati.aruba.it.8333: tcp 24
23:24:52.624828 IP tom-Latitude-3570.34082 > host93-234-110-95.serverdedicati.aruba.it.8333: tcp 109
23:24:52.626239 IP 172.214.77.34.bc.googleusercontent.com.8333 > tom-Latitude-3570.56244: tcp 248
23:24:52.658561 IP host93-234-110-95.serverdedicati.aruba.it.8333 > tom-Latitude-3570.34082: tcp 0
23:24:52.667781 IP tom-Latitude-3570.56244 > 172.214.77.34.bc.googleusercontent.com.8333: tcp 0
23:24:52.784975 IP c-73-101-52-184.hsd1.pa.comcast.net.8333 > tom-Latitude-3570.59818: tcp 24
23:24:52.785611 IP c-73-101-52-184.hsd1.pa.comcast.net.8333 > tom-Latitude-3570.59818: tcp 253
23:24:52.785744 IP tom-Latitude-3570.59818 > c-73-101-52-184.hsd1.pa.comcast.net.8333: tcp 0
23:24:52.886276 IP tom-Latitude-3570.59818 > c-73-101-52-184.hsd1.pa.comcast.net.8333: tcp 24
23:24:52.886321 IP tom-Latitude-3570.34082 > host93-234-110-95.serverdedicati.aruba.it.8333: tcp 24
23:24:52.888572 IP tom-Latitude-3570.34082 > host93-234-110-95.serverdedicati.aruba.it.8333: tcp 73
23:24:52.888583 IP tom-Latitude-3570.59818 > c-73-101-52-184.hsd1.pa.comcast.net.8333: tcp 37
23:24:52.937709 IP c-73-101-52-184.hsd1.pa.comcast.net.8333 > tom-Latitude-3570.59818: tcp 0
23:24:52.937753 IP c-73-101-52-184.hsd1.pa.comcast.net.8333 > tom-Latitude-3570.59818: tcp 0
23:24:52.937755 IP host93-234-110-95.serverdedicati.aruba.it.8333 > tom-Latitude-3570.34082: tcp 0
23:24:53.187294 IP tom-Latitude-3570.47822 > 59.110.157.16.8333: tcp 24
23:24:53.188058 IP tom-Latitude-3570.47822 > 59.110.157.16.8333: tcp 109
23:24:53.224518 IP 59.110.157.16.8333 > tom-Latitude-3570.47822: tcp 0
23:24:53.225643 IP 59.110.157.16.8333 > tom-Latitude-3570.47822: tcp 0
23:24:53.287753 IP tom-Latitude-3570.54046 > 184-101-12-201.phnx.qwest.net.8333: tcp 24
23:24:53.288688 IP tom-Latitude-3570.54046 > 184-101-12-201.phnx.qwest.net.8333: tcp 541
23:24:53.324612 IP 184-101-12-201.phnx.qwest.net.8333 > tom-Latitude-3570.54046: tcp 0
23:24:53.388196 IP tom-Latitude-3570.47742 > 97-82-78-25.dhcp.leds.al.charter.com.8333: tcp 24
23:24:53.388988 IP tom-Latitude-3570.47742 > 97-82-78-25.dhcp.leds.al.charter.com.8333: tcp 109
23:24:53.426356 IP 97-82-78-25.dhcp.leds.al.charter.com.8333 > tom-Latitude-3570.47742: tcp 0
23:24:54.251343 IP 184-101-12-201.phnx.qwest.net.8333 > tom-Latitude-3570.54046: tcp 24
23:24:54.254499 IP 184-101-12-201.phnx.qwest.net.8333 > tom-Latitude-3570.54046: tcp 109
23:24:54.254588 IP tom-Latitude-3570.54046 > 184-101-12-201.phnx.qwest.net.8333: tcp 0
23:24:54.254767 IP tom-Latitude-3570.36650 > ec2-52-56-97-80.eu-west-2.compute.amazonaws.com.8333: tcp 24
23:24:54.254905 IP tom-Latitude-3570.54046 > 184-101-12-201.phnx.qwest.net.8333: tcp 24
23:24:54.256187 IP tom-Latitude-3570.54046 > 184-101-12-201.phnx.qwest.net.8333: tcp 109
23:24:54.256198 IP tom-Latitude-3570.36650 > ec2-52-56-97-80.eu-west-2.compute.amazonaws.com.8333: tcp 181
23:24:54.328586 IP ec2-52-56-97-80.eu-west-2.compute.amazonaws.com.8333 > tom-Latitude-3570.36650: tcp 0
23:24:54.332364 IP 184-101-12-201.phnx.qwest.net.8333 > tom-Latitude-3570.54046: tcp 0
23:24:54.335573 IP ec2-52-56-97-80.eu-west-2.compute.amazonaws.com.8333 > tom-Latitude-3570.36650: tcp 0
23:24:54.578728 IP 184-101-12-201.phnx.qwest.net.8333 > tom-Latitude-3570.54046: tcp 24
23:24:54.590884 IP 184-101-12-201.phnx.qwest.net.8333 > tom-Latitude-3570.54046: tcp 721
23:24:54.591018 IP tom-Latitude-3570.54046 > 184-101-12-201.phnx.qwest.net.8333: tcp 0
23:24:54.698615 IP pool-108-20-207-31.bstnma.fios.verizon.net.8333 > tom-Latitude-3570.33922: tcp 24
23:24:54.698639 IP tom-Latitude-3570.33922 > pool-108-20-207-31.bstnma.fios.verizon.net.8333: tcp 0
23:24:54.699197 IP pool-108-20-207-31.bstnma.fios.verizon.net.8333 > tom-Latitude-3570.33922: tcp 325
23:24:54.699221 IP tom-Latitude-3570.33922 > pool-108-20-207-31.bstnma.fios.verizon.net.8333: tcp 0
23:24:54.699471 IP tom-Latitude-3570.33922 > pool-108-20-207-31.bstnma.fios.verizon.net.8333: tcp 24
23:24:54.700390 IP tom-Latitude-3570.33922 > pool-108-20-207-31.bstnma.fios.verizon.net.8333: tcp 37
23:24:54.768531 IP pool-108-20-207-31.bstnma.fios.verizon.net.8333 > tom-Latitude-3570.33922: tcp 0
23:24:54.769163 IP pool-108-20-207-31.bstnma.fios.verizon.net.8333 > tom-Latitude-3570.33922: tcp 0
23:24:54.911392 IP pool-108-20-207-31.bstnma.fios.verizon.net.8333 > tom-Latitude-3570.33922: tcp 24
23:24:54.911411 IP pool-108-20-207-31.bstnma.fios.verizon.net.8333 > tom-Latitude-3570.33922: tcp 225
23:24:54.911530 IP tom-Latitude-3570.33922 > pool-108-20-207-31.bstnma.fios.verizon.net.8333: tcp 0
23:24:55.306789 IP 59.110.157.16.8333 > tom-Latitude-3570.47822: tcp 24
23:24:55.306814 IP tom-Latitude-3570.47822 > 59.110.157.16.8333: tcp 0
23:24:55.513574 IP tom-Latitude-3570.47822 > 59.110.157.16.8333: tcp 24
23:24:55.530805 IP tom-Latitude-3570.47822 > 59.110.157.16.8333: tcp 145
23:24:55.584801 IP 59.110.157.16.8333 > tom-Latitude-3570.47822: tcp 0
23:24:55.608613 IP 59.110.157.16.8333 > tom-Latitude-3570.47822: tcp 0
23:24:55.736835 IP ec2-52-56-97-80.eu-west-2.compute.amazonaws.com.8333 > tom-Latitude-3570.36650: tcp 24
23:24:55.736860 IP tom-Latitude-3570.36650 > ec2-52-56-97-80.eu-west-2.compute.amazonaws.com.8333: tcp 0
23:24:55.737564 IP ec2-52-56-97-80.eu-west-2.compute.amazonaws.com.8333 > tom-Latitude-3570.36650: tcp 253
23:24:55.737589 IP tom-Latitude-3570.36650 > ec2-52-56-97-80.eu-west-2.compute.amazonaws.com.8333: tcp 0
23:24:55.737864 IP tom-Latitude-3570.36650 > ec2-52-56-97-80.eu-west-2.compute.amazonaws.com.8333: tcp 24
23:24:55.738682 IP tom-Latitude-3570.36650 > ec2-52-56-97-80.eu-west-2.compute.amazonaws.com.8333: tcp 109
23:24:55.770758 IP ec2-52-56-97-80.eu-west-2.compute.amazonaws.com.8333 > tom-Latitude-3570.36650: tcp 0
23:24:55.775650 IP ec2-52-56-97-80.eu-west-2.compute.amazonaws.com.8333 > tom-Latitude-3570.36650: tcp 0
23:24:55.833225 IP ec2-52-56-97-80.eu-west-2.compute.amazonaws.com.8333 > tom-Latitude-3570.36650: tcp 24
23:24:55.833938 IP ec2-52-56-97-80.eu-west-2.compute.amazonaws.com.8333 > tom-Latitude-3570.36650: tcp 225
23:24:55.833966 IP ec2-52-56-97-80.eu-west-2.compute.amazonaws.com.8333 > tom-Latitude-3570.36650: tcp 1448
23:24:55.834100 IP tom-Latitude-3570.36650 > ec2-52-56-97-80.eu-west-2.compute.amazonaws.com.8333: tcp 0
23:24:55.836612 IP ec2-52-56-97-80.eu-west-2.compute.amazonaws.com.8333 > tom-Latitude-3570.36650: tcp 377
23:24:55.879898 IP tom-Latitude-3570.36650 > ec2-52-56-97-80.eu-west-2.compute.amazonaws.com.8333: tcp 0
23:24:56.283155 IP 59.110.157.16.8333 > tom-Latitude-3570.47822: tcp 181
23:24:56.283179 IP tom-Latitude-3570.47822 > 59.110.157.16.8333: tcp 0
23:24:56.484044 IP tom-Latitude-3570.47742 > 97-82-78-25.dhcp.leds.al.charter.com.8333: tcp 24
23:24:56.485055 IP tom-Latitude-3570.47742 > 97-82-78-25.dhcp.leds.al.charter.com.8333: tcp 253
23:24:56.576559 IP 97-82-78-25.dhcp.leds.al.charter.com.8333 > tom-Latitude-3570.47742: tcp 0
23:24:56.785168 IP tom-Latitude-3570.34082 > host93-234-110-95.serverdedicati.aruba.it.8333: tcp 24
23:24:56.785236 IP tom-Latitude-3570.33922 > pool-108-20-207-31.bstnma.fios.verizon.net.8333: tcp 24
23:24:56.810838 IP tom-Latitude-3570.33922 > pool-108-20-207-31.bstnma.fios.verizon.net.8333: tcp 109
23:24:56.810849 IP tom-Latitude-3570.34082 > host93-234-110-95.serverdedicati.aruba.it.8333: tcp 253
23:24:56.836317 IP pool-108-20-207-31.bstnma.fios.verizon.net.8333 > tom-Latitude-3570.33922: tcp 24
23:24:56.840029 IP pool-108-20-207-31.bstnma.fios.verizon.net.8333 > tom-Latitude-3570.33922: tcp 217
23:24:56.840166 IP tom-Latitude-3570.33922 > pool-108-20-207-31.bstnma.fios.verizon.net.8333: tcp 0
23:24:56.840373 IP tom-Latitude-3570.33922 > pool-108-20-207-31.bstnma.fios.verizon.net.8333: tcp 24
23:24:56.840387 IP tom-Latitude-3570.33922 > pool-108-20-207-31.bstnma.fios.verizon.net.8333: tcp 109
23:24:56.846622 IP pool-108-20-207-31.bstnma.fios.verizon.net.8333 > tom-Latitude-3570.33922: tcp 0
23:24:56.847286 IP pool-108-20-207-31.bstnma.fios.verizon.net.8333 > tom-Latitude-3570.33922: tcp 0
23:24:56.847301 IP host93-234-110-95.serverdedicati.aruba.it.8333 > tom-Latitude-3570.34082: tcp 0
23:24:56.872632 IP pool-108-20-207-31.bstnma.fios.verizon.net.8333 > tom-Latitude-3570.33922: tcp 0
23:24:56.876378 IP pool-108-20-207-31.bstnma.fios.verizon.net.8333 > tom-Latitude-3570.33922: tcp 0
23:24:56.940661 IP tom-Latitude-3570.59818 > c-73-101-52-184.hsd1.pa.comcast.net.8333: tcp 24
23:24:56.940706 IP tom-Latitude-3570.47822 > 59.110.157.16.8333: tcp 24
23:24:56.941601 IP tom-Latitude-3570.47822 > 59.110.157.16.8333: tcp 73
23:24:56.941610 IP tom-Latitude-3570.59818 > c-73-101-52-184.hsd1.pa.comcast.net.8333: tcp 253
23:24:56.974668 IP c-73-101-52-184.hsd1.pa.comcast.net.8333 > tom-Latitude-3570.59818: tcp 0
23:24:56.975239 IP c-73-101-52-184.hsd1.pa.comcast.net.8333 > tom-Latitude-3570.59818: tcp 0
23:24:56.978309 IP 59.110.157.16.8333 > tom-Latitude-3570.47822: tcp 0
23:24:56.978885 IP 59.110.157.16.8333 > tom-Latitude-3570.47822: tcp 0
23:24:57.011098 IP pool-108-20-207-31.bstnma.fios.verizon.net.8333 > tom-Latitude-3570.33922: tcp 24
23:24:57.011751 IP pool-108-20-207-31.bstnma.fios.verizon.net.8333 > tom-Latitude-3570.33922: tcp 247
23:24:57.011769 IP pool-108-20-207-31.bstnma.fios.verizon.net.8333 > tom-Latitude-3570.33922: tcp 24
23:24:57.011772 IP pool-108-20-207-31.bstnma.fios.verizon.net.8333 > tom-Latitude-3570.33922: tcp 193
23:24:57.011774 IP pool-108-20-207-31.bstnma.fios.verizon.net.8333 > tom-Latitude-3570.33922: tcp 24
23:24:57.011864 IP tom-Latitude-3570.33922 > pool-108-20-207-31.bstnma.fios.verizon.net.8333: tcp 0
23:24:57.012294 IP tom-Latitude-3570.54046 > 184-101-12-201.phnx.qwest.net.8333: tcp 24
23:24:57.013418 IP tom-Latitude-3570.54046 > 184-101-12-201.phnx.qwest.net.8333: tcp 181
23:24:57.014866 IP pool-108-20-207-31.bstnma.fios.verizon.net.8333 > tom-Latitude-3570.33922: tcp 521
23:24:57.044612 IP 184-101-12-201.phnx.qwest.net.8333 > tom-Latitude-3570.54046: tcp 0
23:24:57.055788 IP tom-Latitude-3570.33922 > pool-108-20-207-31.bstnma.fios.verizon.net.8333: tcp 0
23:24:57.319177 IP tom-Latitude-3570.54046 > 184-101-12-201.phnx.qwest.net.8333: tcp 24
23:24:57.320119 IP tom-Latitude-3570.54046 > 184-101-12-201.phnx.qwest.net.8333: tcp 73
23:24:57.394624 IP 184-101-12-201.phnx.qwest.net.8333 > tom-Latitude-3570.54046: tcp 0
23:24:57.519854 IP tom-Latitude-3570.47742 > 97-82-78-25.dhcp.leds.al.charter.com.8333: tcp 24
23:24:57.520793 IP tom-Latitude-3570.47742 > 97-82-78-25.dhcp.leds.al.charter.com.8333: tcp 109
23:24:57.584633 IP 97-82-78-25.dhcp.leds.al.charter.com.8333 > tom-Latitude-3570.47742: tcp 0
23:24:58.021420 IP tom-Latitude-3570.56244 > 172.214.77.34.bc.googleusercontent.com.8333: tcp 24
23:24:58.022150 IP tom-Latitude-3570.56244 > 172.214.77.34.bc.googleusercontent.com.8333: tcp 361
23:24:58.090784 IP 172.214.77.34.bc.googleusercontent.com.8333 > tom-Latitude-3570.56244: tcp 0
23:24:58.096604 IP 172.214.77.34.bc.googleusercontent.com.8333 > tom-Latitude-3570.56244: tcp 0
23:24:58.422647 IP tom-Latitude-3570.59818 > c-73-101-52-184.hsd1.pa.comcast.net.8333: tcp 24
23:24:58.423387 IP tom-Latitude-3570.59818 > c-73-101-52-184.hsd1.pa.comcast.net.8333: tcp 109
23:24:58.466703 IP c-73-101-52-184.hsd1.pa.comcast.net.8333 > tom-Latitude-3570.59818: tcp 0
23:24:58.480717 IP c-73-101-52-184.hsd1.pa.comcast.net.8333 > tom-Latitude-3570.59818: tcp 0
23:24:58.823946 IP tom-Latitude-3570.36650 > ec2-52-56-97-80.eu-west-2.compute.amazonaws.com.8333: tcp 24
23:24:58.824870 IP tom-Latitude-3570.36650 > ec2-52-56-97-80.eu-west-2.compute.amazonaws.com.8333: tcp 109
23:24:58.864720 IP ec2-52-56-97-80.eu-west-2.compute.amazonaws.com.8333 > tom-Latitude-3570.36650: tcp 0
23:24:58.880913 IP ec2-52-56-97-80.eu-west-2.compute.amazonaws.com.8333 > tom-Latitude-3570.36650: tcp 0
23:24:59.007593 IP c-73-101-52-184.hsd1.pa.comcast.net.8333 > tom-Latitude-3570.59818: tcp 24
23:24:59.011014 IP c-73-101-52-184.hsd1.pa.comcast.net.8333 > tom-Latitude-3570.59818: tcp 289
23:24:59.011146 IP tom-Latitude-3570.59818 > c-73-101-52-184.hsd1.pa.comcast.net.8333: tcp 0
23:24:59.011444 IP tom-Latitude-3570.59818 > c-73-101-52-184.hsd1.pa.comcast.net.8333: tcp 24
23:24:59.012688 IP tom-Latitude-3570.59818 > c-73-101-52-184.hsd1.pa.comcast.net.8333: tcp 289
23:24:59.091008 IP c-73-101-52-184.hsd1.pa.comcast.net.8333 > tom-Latitude-3570.59818: tcp 0
23:24:59.130844 IP c-73-101-52-184.hsd1.pa.comcast.net.8333 > tom-Latitude-3570.59818: tcp 0
23:24:59.232454 IP pool-108-20-207-31.bstnma.fios.verizon.net.8333 > tom-Latitude-3570.33922: tcp 24
23:24:59.232478 IP tom-Latitude-3570.33922 > pool-108-20-207-31.bstnma.fios.verizon.net.8333: tcp 0
23:24:59.233002 IP pool-108-20-207-31.bstnma.fios.verizon.net.8333 > tom-Latitude-3570.33922: tcp 37
23:24:59.233020 IP tom-Latitude-3570.33922 > pool-108-20-207-31.bstnma.fios.verizon.net.8333: tcp 0
23:24:59.233295 IP tom-Latitude-3570.33922 > pool-108-20-207-31.bstnma.fios.verizon.net.8333: tcp 24
23:24:59.234338 IP tom-Latitude-3570.33922 > pool-108-20-207-31.bstnma.fios.verizon.net.8333: tcp 37
23:24:59.266104 IP pool-108-20-207-31.bstnma.fios.verizon.net.8333 > tom-Latitude-3570.33922: tcp 0
23:24:59.269787 IP pool-108-20-207-31.bstnma.fios.verizon.net.8333 > tom-Latitude-3570.33922: tcp 0
23:24:59.291395 IP c-73-101-52-184.hsd1.pa.comcast.net.8333 > tom-Latitude-3570.59818: tcp 24
23:24:59.292285 IP c-73-101-52-184.hsd1.pa.comcast.net.8333 > tom-Latitude-3570.59818: tcp 250
23:24:59.292333 IP c-73-101-52-184.hsd1.pa.comcast.net.8333 > tom-Latitude-3570.59818: tcp 24
23:24:59.292336 IP c-73-101-52-184.hsd1.pa.comcast.net.8333 > tom-Latitude-3570.59818: tcp 223
23:24:59.292338 IP c-73-101-52-184.hsd1.pa.comcast.net.8333 > tom-Latitude-3570.59818: tcp 24
23:24:59.292340 IP c-73-101-52-184.hsd1.pa.comcast.net.8333 > tom-Latitude-3570.59818: tcp 224
23:24:59.292342 IP c-73-101-52-184.hsd1.pa.comcast.net.8333 > tom-Latitude-3570.59818: tcp 24
23:24:59.292344 IP c-73-101-52-184.hsd1.pa.comcast.net.8333 > tom-Latitude-3570.59818: tcp 191
23:24:59.292362 IP c-73-101-52-184.hsd1.pa.comcast.net.8333 > tom-Latitude-3570.59818: tcp 24
23:24:59.292364 IP c-73-101-52-184.hsd1.pa.comcast.net.8333 > tom-Latitude-3570.59818: tcp 223
23:24:59.292366 IP c-73-101-52-184.hsd1.pa.comcast.net.8333 > tom-Latitude-3570.59818: tcp 24
23:24:59.292368 IP c-73-101-52-184.hsd1.pa.comcast.net.8333 > tom-Latitude-3570.59818: tcp 223
23:24:59.292422 IP tom-Latitude-3570.59818 > c-73-101-52-184.hsd1.pa.comcast.net.8333: tcp 0
23:24:59.294780 IP c-73-101-52-184.hsd1.pa.comcast.net.8333 > tom-Latitude-3570.59818: tcp 24
23:24:59.295532 IP c-73-101-52-184.hsd1.pa.comcast.net.8333 > tom-Latitude-3570.59818: tcp 226
23:24:59.295538 IP c-73-101-52-184.hsd1.pa.comcast.net.8333 > tom-Latitude-3570.59818: tcp 24
23:24:59.295542 IP c-73-101-52-184.hsd1.pa.comcast.net.8333 > tom-Latitude-3570.59818: tcp 223
23:24:59.295553 IP tom-Latitude-3570.59818 > c-73-101-52-184.hsd1.pa.comcast.net.8333: tcp 0
23:24:59.797610 IP tom-Latitude-3570.47742 > 97-82-78-25.dhcp.leds.al.charter.com.8333: tcp 24
23:24:59.797658 IP tom-Latitude-3570.59818 > c-73-101-52-184.hsd1.pa.comcast.net.8333: tcp 24
23:24:59.798493 IP tom-Latitude-3570.59818 > c-73-101-52-184.hsd1.pa.comcast.net.8333: tcp 37
23:24:59.798509 IP tom-Latitude-3570.47742 > 97-82-78-25.dhcp.leds.al.charter.com.8333: tcp 289
23:24:59.886889 IP c-73-101-52-184.hsd1.pa.comcast.net.8333 > tom-Latitude-3570.59818: tcp 0
23:24:59.896889 IP 97-82-78-25.dhcp.leds.al.charter.com.8333 > tom-Latitude-3570.47742: tcp 0
23:24:59.920787 IP c-73-101-52-184.hsd1.pa.comcast.net.8333 > tom-Latitude-3570.59818: tcp 0
23:24:59.984372 IP 97-82-78-25.dhcp.leds.al.charter.com.8333 > tom-Latitude-3570.47742: tcp 0
23:25:00.076562 IP c-73-101-52-184.hsd1.pa.comcast.net.8333 > tom-Latitude-3570.59818: tcp 24
23:25:00.077241 IP c-73-101-52-184.hsd1.pa.comcast.net.8333 > tom-Latitude-3570.59818: tcp 37
23:25:00.077370 IP tom-Latitude-3570.59818 > c-73-101-52-184.hsd1.pa.comcast.net.8333: tcp 0
23:25:00.434677 IP 172.214.77.34.bc.googleusercontent.com.8333 > tom-Latitude-3570.56244: tcp 24
23:25:00.434701 IP tom-Latitude-3570.56244 > 172.214.77.34.bc.googleusercontent.com.8333: tcp 0
23:25:00.440963 IP 172.214.77.34.bc.googleusercontent.com.8333 > tom-Latitude-3570.56244: tcp 433
23:25:00.440987 IP tom-Latitude-3570.56244 > 172.214.77.34.bc.googleusercontent.com.8333: tcp 0
23:25:00.441364 IP tom-Latitude-3570.56244 > 172.214.77.34.bc.googleusercontent.com.8333: tcp 24
23:25:00.442269 IP tom-Latitude-3570.56244 > 172.214.77.34.bc.googleusercontent.com.8333: tcp 145
23:25:00.514527 IP 172.214.77.34.bc.googleusercontent.com.8333 > tom-Latitude-3570.56244: tcp 0
23:25:00.522531 IP 172.214.77.34.bc.googleusercontent.com.8333 > tom-Latitude-3570.56244: tcp 0
23:25:00.583374 IP 172.214.77.34.bc.googleusercontent.com.8333 > tom-Latitude-3570.56244: tcp 24
23:25:00.584232 IP 172.214.77.34.bc.googleusercontent.com.8333 > tom-Latitude-3570.56244: tcp 223
23:25:00.584248 IP 172.214.77.34.bc.googleusercontent.com.8333 > tom-Latitude-3570.56244: tcp 24
23:25:00.584251 IP 172.214.77.34.bc.googleusercontent.com.8333 > tom-Latitude-3570.56244: tcp 223
23:25:00.584254 IP 172.214.77.34.bc.googleusercontent.com.8333 > tom-Latitude-3570.56244: tcp 24
23:25:00.584256 IP 172.214.77.34.bc.googleusercontent.com.8333 > tom-Latitude-3570.56244: tcp 223
23:25:00.584258 IP 172.214.77.34.bc.googleusercontent.com.8333 > tom-Latitude-3570.56244: tcp 24
23:25:00.584278 IP 172.214.77.34.bc.googleusercontent.com.8333 > tom-Latitude-3570.56244: tcp 339
23:25:00.584346 IP tom-Latitude-3570.56244 > 172.214.77.34.bc.googleusercontent.com.8333: tcp 0
23:25:00.584842 IP tom-Latitude-3570.54046 > 184-101-12-201.phnx.qwest.net.8333: tcp 24
23:25:00.585884 IP tom-Latitude-3570.54046 > 184-101-12-201.phnx.qwest.net.8333: tcp 325
23:25:00.707909 IP tom-Latitude-3570.54046 > 184-101-12-201.phnx.qwest.net.8333: tcp 325
23:25:00.745475 IP 97-82-78-25.dhcp.leds.al.charter.com.8333 > tom-Latitude-3570.47742: tcp 24
23:25:00.745494 IP 97-82-78-25.dhcp.leds.al.charter.com.8333 > tom-Latitude-3570.47742: tcp 253
23:25:00.745497 IP 184-101-12-201.phnx.qwest.net.8333 > tom-Latitude-3570.54046: tcp 0
23:25:00.745582 IP tom-Latitude-3570.47742 > 97-82-78-25.dhcp.leds.al.charter.com.8333: tcp 0
23:25:00.745831 IP tom-Latitude-3570.47742 > 97-82-78-25.dhcp.leds.al.charter.com.8333: tcp 24
23:25:00.747214 IP tom-Latitude-3570.47742 > 97-82-78-25.dhcp.leds.al.charter.com.8333: tcp 109
23:25:00.778931 IP 97-82-78-25.dhcp.leds.al.charter.com.8333 > tom-Latitude-3570.47742: tcp 0
23:25:00.789079 IP 97-82-78-25.dhcp.leds.al.charter.com.8333 > tom-Latitude-3570.47742: tcp 0
23:25:00.789092 IP 59.110.157.16.8333 > tom-Latitude-3570.47822: tcp 24
23:25:00.789109 IP tom-Latitude-3570.47822 > 59.110.157.16.8333: tcp 0
23:25:00.793295 IP 59.110.157.16.8333 > tom-Latitude-3570.47822: tcp 649
23:25:00.793315 IP tom-Latitude-3570.47822 > 59.110.157.16.8333: tcp 0
23:25:00.958938 IP 97-82-78-25.dhcp.leds.al.charter.com.8333 > tom-Latitude-3570.47742: tcp 24
23:25:00.959905 IP 97-82-78-25.dhcp.leds.al.charter.com.8333 > tom-Latitude-3570.47742: tcp 1460
23:25:00.959922 IP 97-82-78-25.dhcp.leds.al.charter.com.8333 > tom-Latitude-3570.47742: tcp 349
23:25:00.959925 IP 97-82-78-25.dhcp.leds.al.charter.com.8333 > tom-Latitude-3570.47742: tcp 24
23:25:00.960011 IP tom-Latitude-3570.47742 > 97-82-78-25.dhcp.leds.al.charter.com.8333: tcp 0
23:25:00.963190 IP 97-82-78-25.dhcp.leds.al.charter.com.8333 > tom-Latitude-3570.47742: tcp 1382
23:25:00.966448 IP 97-82-78-25.dhcp.leds.al.charter.com.8333 > tom-Latitude-3570.47742: tcp 72
23:25:00.966573 IP tom-Latitude-3570.47742 > 97-82-78-25.dhcp.leds.al.charter.com.8333: tcp 0
23:25:00.967034 IP 97-82-78-25.dhcp.leds.al.charter.com.8333 > tom-Latitude-3570.47742: tcp 24
23:25:00.967050 IP 97-82-78-25.dhcp.leds.al.charter.com.8333 > tom-Latitude-3570.47742: tcp 339
23:25:00.967123 IP tom-Latitude-3570.47742 > 97-82-78-25.dhcp.leds.al.charter.com.8333: tcp 0
23:25:01.069947 IP tom-Latitude-3570.34082 > host93-234-110-95.serverdedicati.aruba.it.8333: tcp 24
23:25:01.070049 IP tom-Latitude-3570.54046 > 184-101-12-201.phnx.qwest.net.8333: tcp 24
23:25:01.071053 IP tom-Latitude-3570.54046 > 184-101-12-201.phnx.qwest.net.8333: tcp 217
23:25:01.071070 IP tom-Latitude-3570.34082 > host93-234-110-95.serverdedicati.aruba.it.8333: tcp 649
23:25:01.108100 IP 184-101-12-201.phnx.qwest.net.8333 > tom-Latitude-3570.54046: tcp 0
23:25:01.108965 IP 184-101-12-201.phnx.qwest.net.8333 > tom-Latitude-3570.54046: tcp 0
23:25:01.122840 IP host93-234-110-95.serverdedicati.aruba.it.8333 > tom-Latitude-3570.34082: tcp 0
23:25:01.613026 IP ec2-52-56-97-80.eu-west-2.compute.amazonaws.com.8333 > tom-Latitude-3570.36650: tcp 24
23:25:01.613051 IP tom-Latitude-3570.36650 > ec2-52-56-97-80.eu-west-2.compute.amazonaws.com.8333: tcp 0
23:25:01.613082 IP ec2-52-56-97-80.eu-west-2.compute.amazonaws.com.8333 > tom-Latitude-3570.36650: tcp 685
23:25:01.613088 IP tom-Latitude-3570.36650 > ec2-52-56-97-80.eu-west-2.compute.amazonaws.com.8333: tcp 0
23:25:01.613451 IP tom-Latitude-3570.36650 > ec2-52-56-97-80.eu-west-2.compute.amazonaws.com.8333: tcp 24
23:25:01.614741 IP tom-Latitude-3570.36650 > ec2-52-56-97-80.eu-west-2.compute.amazonaws.com.8333: tcp 145
23:25:01.688363 IP ec2-52-56-97-80.eu-west-2.compute.amazonaws.com.8333 > tom-Latitude-3570.36650: tcp 0
23:25:01.692095 IP ec2-52-56-97-80.eu-west-2.compute.amazonaws.com.8333 > tom-Latitude-3570.36650: tcp 0
23:25:01.752640 IP ec2-52-56-97-80.eu-west-2.compute.amazonaws.com.8333 > tom-Latitude-3570.36650: tcp 24
23:25:01.756548 IP ec2-52-56-97-80.eu-west-2.compute.amazonaws.com.8333 > tom-Latitude-3570.36650: tcp 1382
23:25:01.756675 IP tom-Latitude-3570.36650 > ec2-52-56-97-80.eu-west-2.compute.amazonaws.com.8333: tcp 0
23:25:01.759527 IP ec2-52-56-97-80.eu-west-2.compute.amazonaws.com.8333 > tom-Latitude-3570.36650: tcp 66
23:25:01.760309 IP ec2-52-56-97-80.eu-west-2.compute.amazonaws.com.8333 > tom-Latitude-3570.36650: tcp 133
23:25:01.760327 IP ec2-52-56-97-80.eu-west-2.compute.amazonaws.com.8333 > tom-Latitude-3570.36650: tcp 863
23:25:01.760443 IP tom-Latitude-3570.36650 > ec2-52-56-97-80.eu-west-2.compute.amazonaws.com.8333: tcp 0
23:25:01.966532 IP tom-Latitude-3570.47742 > 97-82-78-25.dhcp.leds.al.charter.com.8333: tcp 24
23:25:01.966641 IP tom-Latitude-3570.34082 > host93-234-110-95.serverdedicati.aruba.it.8333: tcp 24
23:25:01.967493 IP tom-Latitude-3570.34082 > host93-234-110-95.serverdedicati.aruba.it.8333: tcp 145
23:25:01.967504 IP tom-Latitude-3570.47742 > 97-82-78-25.dhcp.leds.al.charter.com.8333: tcp 145
23:25:01.994837 IP 97-82-78-25.dhcp.leds.al.charter.com.8333 > tom-Latitude-3570.47742: tcp 0
23:25:01.998924 IP 97-82-78-25.dhcp.leds.al.charter.com.8333 > tom-Latitude-3570.47742: tcp 0
23:25:01.999406 IP host93-234-110-95.serverdedicati.aruba.it.8333 > tom-Latitude-3570.34082: tcp 0
23:25:02.057809 IP 59.110.157.16.8333 > tom-Latitude-3570.47822: tcp 24
23:25:02.057826 IP tom-Latitude-3570.47822 > 59.110.157.16.8333: tcp 0
23:25:02.060625 IP 59.110.157.16.8333 > tom-Latitude-3570.47822: tcp 181
23:25:02.060649 IP tom-Latitude-3570.47822 > 59.110.157.16.8333: tcp 0
23:25:02.060943 IP tom-Latitude-3570.47822 > 59.110.157.16.8333: tcp 24
23:25:02.062161 IP tom-Latitude-3570.47822 > 59.110.157.16.8333: tcp 37
23:25:02.094446 IP 59.110.157.16.8333 > tom-Latitude-3570.47822: tcp 0
23:25:02.095220 IP 59.110.157.16.8333 > tom-Latitude-3570.47822: tcp 0
23:25:02.249734 IP host93-234-110-95.serverdedicati.aruba.it.8333 > tom-Latitude-3570.34082: tcp 24
23:25:02.249755 IP host93-234-110-95.serverdedicati.aruba.it.8333 > tom-Latitude-3570.34082: tcp 145
23:25:02.249849 IP tom-Latitude-3570.34082 > host93-234-110-95.serverdedicati.aruba.it.8333: tcp 0
23:25:02.250074 IP tom-Latitude-3570.34082 > host93-234-110-95.serverdedicati.aruba.it.8333: tcp 24
23:25:02.251545 IP tom-Latitude-3570.34082 > host93-234-110-95.serverdedicati.aruba.it.8333: tcp 109
23:25:02.300408 IP host93-234-110-95.serverdedicati.aruba.it.8333 > tom-Latitude-3570.34082: tcp 0
23:25:02.325144 IP 59.110.157.16.8333 > tom-Latitude-3570.47822: tcp 24
23:25:02.329368 IP 59.110.157.16.8333 > tom-Latitude-3570.47822: tcp 247
23:25:02.329500 IP tom-Latitude-3570.47822 > 59.110.157.16.8333: tcp 0
23:25:02.393143 IP host93-234-110-95.serverdedicati.aruba.it.8333 > tom-Latitude-3570.34082: tcp 24
23:25:02.393797 IP host93-234-110-95.serverdedicati.aruba.it.8333 > tom-Latitude-3570.34082: tcp 370
23:25:02.393809 IP host93-234-110-95.serverdedicati.aruba.it.8333 > tom-Latitude-3570.34082: tcp 24
23:25:02.393811 IP host93-234-110-95.serverdedicati.aruba.it.8333 > tom-Latitude-3570.34082: tcp 340
23:25:02.393813 IP host93-234-110-95.serverdedicati.aruba.it.8333 > tom-Latitude-3570.34082: tcp 24
23:25:02.393815 IP host93-234-110-95.serverdedicati.aruba.it.8333 > tom-Latitude-3570.34082: tcp 374
23:25:02.393882 IP tom-Latitude-3570.34082 > host93-234-110-95.serverdedicati.aruba.it.8333: tcp 0
23:25:02.800560 IP tom-Latitude-3570.33922 > pool-108-20-207-31.bstnma.fios.verizon.net.8333: tcp 24
23:25:02.802301 IP tom-Latitude-3570.33922 > pool-108-20-207-31.bstnma.fios.verizon.net.8333: tcp 829
23:25:02.850894 IP pool-108-20-207-31.bstnma.fios.verizon.net.8333 > tom-Latitude-3570.33922: tcp 0
23:25:02.868632 IP pool-108-20-207-31.bstnma.fios.verizon.net.8333 > tom-Latitude-3570.33922: tcp 0
23:25:03.402390 IP tom-Latitude-3570.36650 > ec2-52-56-97-80.eu-west-2.compute.amazonaws.com.8333: tcp 24
23:25:03.404451 IP tom-Latitude-3570.36650 > ec2-52-56-97-80.eu-west-2.compute.amazonaws.com.8333: tcp 145
23:25:03.457374 IP ec2-52-56-97-80.eu-west-2.compute.amazonaws.com.8333 > tom-Latitude-3570.36650: tcp 0
23:25:03.477007 IP ec2-52-56-97-80.eu-west-2.compute.amazonaws.com.8333 > tom-Latitude-3570.36650: tcp 0
23:25:03.603149 IP tom-Latitude-3570.47822 > 59.110.157.16.8333: tcp 24
23:25:03.604688 IP tom-Latitude-3570.47822 > 59.110.157.16.8333: tcp 109
23:25:03.650978 IP 59.110.157.16.8333 > tom-Latitude-3570.47822: tcp 0
23:25:03.703524 IP tom-Latitude-3570.47742 > 97-82-78-25.dhcp.leds.al.charter.com.8333: tcp 24
23:25:03.704445 IP tom-Latitude-3570.47742 > 97-82-78-25.dhcp.leds.al.charter.com.8333: tcp 145
23:25:03.712898 IP 59.110.157.16.8333 > tom-Latitude-3570.47822: tcp 0
23:25:03.762951 IP 97-82-78-25.dhcp.leds.al.charter.com.8333 > tom-Latitude-3570.47742: tcp 0
23:25:03.776648 IP 97-82-78-25.dhcp.leds.al.charter.com.8333 > tom-Latitude-3570.47742: tcp 0
23:25:04.326869 IP 172.214.77.34.bc.googleusercontent.com.8333 > tom-Latitude-3570.56244: tcp 24
23:25:04.328169 IP 172.214.77.34.bc.googleusercontent.com.8333 > tom-Latitude-3570.56244: tcp 577
23:25:04.328233 IP tom-Latitude-3570.56244 > 172.214.77.34.bc.googleusercontent.com.8333: tcp 0
23:25:04.328526 IP tom-Latitude-3570.56244 > 172.214.77.34.bc.googleusercontent.com.8333: tcp 24
23:25:04.329645 IP tom-Latitude-3570.56244 > 172.214.77.34.bc.googleusercontent.com.8333: tcp 181
23:25:04.360481 IP 172.214.77.34.bc.googleusercontent.com.8333 > tom-Latitude-3570.56244: tcp 0
23:25:04.364292 IP 172.214.77.34.bc.googleusercontent.com.8333 > tom-Latitude-3570.56244: tcp 0
23:25:04.425163 IP 172.214.77.34.bc.googleusercontent.com.8333 > tom-Latitude-3570.56244: tcp 24
23:25:04.425826 IP 172.214.77.34.bc.googleusercontent.com.8333 > tom-Latitude-3570.56244: tcp 224
23:25:04.425915 IP tom-Latitude-3570.56244 > 172.214.77.34.bc.googleusercontent.com.8333: tcp 0
23:25:04.428461 IP 172.214.77.34.bc.googleusercontent.com.8333 > tom-Latitude-3570.56244: tcp 24
23:25:04.429333 IP 172.214.77.34.bc.googleusercontent.com.8333 > tom-Latitude-3570.56244: tcp 224
23:25:04.429347 IP 172.214.77.34.bc.googleusercontent.com.8333 > tom-Latitude-3570.56244: tcp 24
23:25:04.429350 IP 172.214.77.34.bc.googleusercontent.com.8333 > tom-Latitude-3570.56244: tcp 246
23:25:04.429353 IP 172.214.77.34.bc.googleusercontent.com.8333 > tom-Latitude-3570.56244: tcp 24
23:25:04.429356 IP 172.214.77.34.bc.googleusercontent.com.8333 > tom-Latitude-3570.56244: tcp 223
23:25:04.429359 IP 172.214.77.34.bc.googleusercontent.com.8333 > tom-Latitude-3570.56244: tcp 24
23:25:04.429361 IP 172.214.77.34.bc.googleusercontent.com.8333 > tom-Latitude-3570.56244: tcp 382
23:25:04.429387 IP tom-Latitude-3570.56244 > 172.214.77.34.bc.googleusercontent.com.8333: tcp 0
23:25:05.226799 IP 97-82-78-25.dhcp.leds.al.charter.com.8333 > tom-Latitude-3570.47742: tcp 24
23:25:05.227917 IP 97-82-78-25.dhcp.leds.al.charter.com.8333 > tom-Latitude-3570.47742: tcp 253
23:25:05.227978 IP tom-Latitude-3570.47742 > 97-82-78-25.dhcp.leds.al.charter.com.8333: tcp 0
23:25:05.228187 IP tom-Latitude-3570.47742 > 97-82-78-25.dhcp.leds.al.charter.com.8333: tcp 24
23:25:05.228289 IP tom-Latitude-3570.36650 > ec2-52-56-97-80.eu-west-2.compute.amazonaws.com.8333: tcp 24
23:25:05.229565 IP tom-Latitude-3570.36650 > ec2-52-56-97-80.eu-west-2.compute.amazonaws.com.8333: tcp 181
23:25:05.229604 IP tom-Latitude-3570.47742 > 97-82-78-25.dhcp.leds.al.charter.com.8333: tcp 73
23:25:05.294496 IP 97-82-78-25.dhcp.leds.al.charter.com.8333 > tom-Latitude-3570.47742: tcp 0
23:25:05.298959 IP ec2-52-56-97-80.eu-west-2.compute.amazonaws.com.8333 > tom-Latitude-3570.36650: tcp 0
23:25:05.306659 IP 97-82-78-25.dhcp.leds.al.charter.com.8333 > tom-Latitude-3570.47742: tcp 0
23:25:05.307257 IP ec2-52-56-97-80.eu-west-2.compute.amazonaws.com.8333 > tom-Latitude-3570.36650: tcp 0
23:25:05.491156 IP 97-82-78-25.dhcp.leds.al.charter.com.8333 > tom-Latitude-3570.47742: tcp 24
23:25:05.492111 IP 97-82-78-25.dhcp.leds.al.charter.com.8333 > tom-Latitude-3570.47742: tcp 226
23:25:05.492129 IP 97-82-78-25.dhcp.leds.al.charter.com.8333 > tom-Latitude-3570.47742: tcp 24
23:25:05.492133 IP 97-82-78-25.dhcp.leds.al.charter.com.8333 > tom-Latitude-3570.47742: tcp 222
23:25:05.492172 IP tom-Latitude-3570.47742 > 97-82-78-25.dhcp.leds.al.charter.com.8333: tcp 0
23:25:05.956786 IP ec2-52-56-97-80.eu-west-2.compute.amazonaws.com.8333 > tom-Latitude-3570.36650: tcp 24
23:25:05.957587 IP ec2-52-56-97-80.eu-west-2.compute.amazonaws.com.8333 > tom-Latitude-3570.36650: tcp 325
23:25:05.957639 IP tom-Latitude-3570.36650 > ec2-52-56-97-80.eu-west-2.compute.amazonaws.com.8333: tcp 0
23:25:05.957870 IP tom-Latitude-3570.36650 > ec2-52-56-97-80.eu-west-2.compute.amazonaws.com.8333: tcp 24
23:25:05.959029 IP tom-Latitude-3570.36650 > ec2-52-56-97-80.eu-west-2.compute.amazonaws.com.8333: tcp 253
23:25:06.016776 IP ec2-52-56-97-80.eu-west-2.compute.amazonaws.com.8333 > tom-Latitude-3570.36650: tcp 0
23:25:06.058259 IP tom-Latitude-3570.47742 > 97-82-78-25.dhcp.leds.al.charter.com.8333: tcp 24
23:25:06.059198 IP tom-Latitude-3570.47742 > 97-82-78-25.dhcp.leds.al.charter.com.8333: tcp 31
23:25:06.088585 IP ec2-52-56-97-80.eu-west-2.compute.amazonaws.com.8333 > tom-Latitude-3570.36650: tcp 0
23:25:06.092385 IP 97-82-78-25.dhcp.leds.al.charter.com.8333 > tom-Latitude-3570.47742: tcp 0
23:25:06.092971 IP 97-82-78-25.dhcp.leds.al.charter.com.8333 > tom-Latitude-3570.47742: tcp 0
23:25:06.146752 IP ec2-52-56-97-80.eu-west-2.compute.amazonaws.com.8333 > tom-Latitude-3570.36650: tcp 24
23:25:06.147785 IP ec2-52-56-97-80.eu-west-2.compute.amazonaws.com.8333 > tom-Latitude-3570.36650: tcp 247
23:25:06.147806 IP ec2-52-56-97-80.eu-west-2.compute.amazonaws.com.8333 > tom-Latitude-3570.36650: tcp 1382
23:25:06.147849 IP tom-Latitude-3570.36650 > ec2-52-56-97-80.eu-west-2.compute.amazonaws.com.8333: tcp 0
23:25:06.152401 IP ec2-52-56-97-80.eu-west-2.compute.amazonaws.com.8333 > tom-Latitude-3570.36650: tcp 66
23:25:06.153207 IP ec2-52-56-97-80.eu-west-2.compute.amazonaws.com.8333 > tom-Latitude-3570.36650: tcp 40
23:25:06.153259 IP tom-Latitude-3570.36650 > ec2-52-56-97-80.eu-west-2.compute.amazonaws.com.8333: tcp 0
23:25:06.155902 IP ec2-52-56-97-80.eu-west-2.compute.amazonaws.com.8333 > tom-Latitude-3570.36650: tcp 556
23:25:06.199897 IP tom-Latitude-3570.36650 > ec2-52-56-97-80.eu-west-2.compute.amazonaws.com.8333: tcp 0
23:25:06.256793 IP tom-Latitude-3570.56244 > 172.214.77.34.bc.googleusercontent.com.8333: tcp 24
23:25:06.257734 IP tom-Latitude-3570.56244 > 172.214.77.34.bc.googleusercontent.com.8333: tcp 325
23:25:06.286816 IP 172.214.77.34.bc.googleusercontent.com.8333 > tom-Latitude-3570.56244: tcp 0
23:25:06.288189 IP 172.214.77.34.bc.googleusercontent.com.8333 > tom-Latitude-3570.56244: tcp 0
23:25:06.357276 IP tom-Latitude-3570.47742 > 97-82-78-25.dhcp.leds.al.charter.com.8333: tcp 24
23:25:06.358216 IP tom-Latitude-3570.47742 > 97-82-78-25.dhcp.leds.al.charter.com.8333: tcp 253
23:25:06.386780 IP 97-82-78-25.dhcp.leds.al.charter.com.8333 > tom-Latitude-3570.47742: tcp 0
23:25:06.387358 IP 97-82-78-25.dhcp.leds.al.charter.com.8333 > tom-Latitude-3570.47742: tcp 0
23:25:06.858854 IP tom-Latitude-3570.59818 > c-73-101-52-184.hsd1.pa.comcast.net.8333: tcp 24
23:25:06.858874 IP tom-Latitude-3570.59818 > c-73-101-52-184.hsd1.pa.comcast.net.8333: tcp 1045
23:25:06.858947 IP tom-Latitude-3570.34082 > host93-234-110-95.serverdedicati.aruba.it.8333: tcp 24
23:25:06.866783 IP tom-Latitude-3570.34082 > host93-234-110-95.serverdedicati.aruba.it.8333: tcp 505
23:25:06.912472 IP c-73-101-52-184.hsd1.pa.comcast.net.8333 > tom-Latitude-3570.59818: tcp 0
23:25:06.938732 IP c-73-101-52-184.hsd1.pa.comcast.net.8333 > tom-Latitude-3570.59818: tcp 0
23:25:06.944140 IP host93-234-110-95.serverdedicati.aruba.it.8333 > tom-Latitude-3570.34082: tcp 0
23:25:07.059527 IP tom-Latitude-3570.33922 > pool-108-20-207-31.bstnma.fios.verizon.net.8333: tcp 24
23:25:07.060596 IP tom-Latitude-3570.33922 > pool-108-20-207-31.bstnma.fios.verizon.net.8333: tcp 505
23:25:07.090829 IP pool-108-20-207-31.bstnma.fios.verizon.net.8333 > tom-Latitude-3570.33922: tcp 0
23:25:07.094465 IP pool-108-20-207-31.bstnma.fios.verizon.net.8333 > tom-Latitude-3570.33922: tcp 0
23:25:07.159991 IP tom-Latitude-3570.47822 > 59.110.157.16.8333: tcp 24
23:25:07.163257 IP tom-Latitude-3570.47822 > 59.110.157.16.8333: tcp 505
23:25:07.208686 IP 59.110.157.16.8333 > tom-Latitude-3570.47822: tcp 0
23:25:07.220588 IP 59.110.157.16.8333 > tom-Latitude-3570.47822: tcp 0
23:25:08.100992 IP 59.110.157.16.8333 > tom-Latitude-3570.47822: tcp 24
23:25:08.101744 IP 59.110.157.16.8333 > tom-Latitude-3570.47822: tcp 433
23:25:08.101789 IP tom-Latitude-3570.47822 > 59.110.157.16.8333: tcp 0
23:25:08.102095 IP tom-Latitude-3570.47822 > 59.110.157.16.8333: tcp 24
23:25:08.103166 IP tom-Latitude-3570.47822 > 59.110.157.16.8333: tcp 433
23:25:08.176764 IP 59.110.157.16.8333 > tom-Latitude-3570.47822: tcp 0
23:25:08.188700 IP 59.110.157.16.8333 > tom-Latitude-3570.47822: tcp 0
23:25:08.421174 IP 59.110.157.16.8333 > tom-Latitude-3570.47822: tcp 24
23:25:08.421821 IP 59.110.157.16.8333 > tom-Latitude-3570.47822: tcp 225
23:25:08.421840 IP 59.110.157.16.8333 > tom-Latitude-3570.47822: tcp 24
23:25:08.421929 IP tom-Latitude-3570.47822 > 59.110.157.16.8333: tcp 0
23:25:08.522548 IP tom-Latitude-3570.47742 > 97-82-78-25.dhcp.leds.al.charter.com.8333: tcp 24
23:25:08.522611 IP tom-Latitude-3570.59818 > c-73-101-52-184.hsd1.pa.comcast.net.8333: tcp 24
23:25:08.523518 IP tom-Latitude-3570.59818 > c-73-101-52-184.hsd1.pa.comcast.net.8333: tcp 37
23:25:08.523529 IP tom-Latitude-3570.47742 > 97-82-78-25.dhcp.leds.al.charter.com.8333: tcp 37
23:25:08.556868 IP 97-82-78-25.dhcp.leds.al.charter.com.8333 > tom-Latitude-3570.47742: tcp 0
23:25:08.557544 IP c-73-101-52-184.hsd1.pa.comcast.net.8333 > tom-Latitude-3570.59818: tcp 0
23:25:08.563030 IP c-73-101-52-184.hsd1.pa.comcast.net.8333 > tom-Latitude-3570.59818: tcp 0
23:25:08.563044 IP 97-82-78-25.dhcp.leds.al.charter.com.8333 > tom-Latitude-3570.47742: tcp 0
23:25:08.623076 IP tom-Latitude-3570.33922 > pool-108-20-207-31.bstnma.fios.verizon.net.8333: tcp 24
23:25:08.624017 IP tom-Latitude-3570.33922 > pool-108-20-207-31.bstnma.fios.verizon.net.8333: tcp 37
23:25:08.653536 IP 59.110.157.16.8333 > tom-Latitude-3570.47822: tcp 1382
