23:46:23.266311 IP c-73-101-52-184.hsd1.pa.comcast.net.8333 > tom-Latitude-3570.59818: tcp 24
23:46:23.266330 IP c-73-101-52-184.hsd1.pa.comcast.net.8333 > tom-Latitude-3570.59818: tcp 37
23:46:23.266333 IP c-73-101-52-184.hsd1.pa.comcast.net.8333 > tom-Latitude-3570.59818: tcp 24
23:46:23.266378 IP tom-Latitude-3570.59818 > c-73-101-52-184.hsd1.pa.comcast.net.8333: tcp 0
23:46:23.267082 IP c-73-101-52-184.hsd1.pa.comcast.net.8333 > tom-Latitude-3570.59818: tcp 283
23:46:23.267107 IP c-73-101-52-184.hsd1.pa.comcast.net.8333 > tom-Latitude-3570.59818: tcp 24
23:46:23.267111 IP c-73-101-52-184.hsd1.pa.comcast.net.8333 > tom-Latitude-3570.59818: tcp 283
23:46:23.267173 IP tom-Latitude-3570.59818 > c-73-101-52-184.hsd1.pa.comcast.net.8333: tcp 0
23:46:23.267890 IP tom-Latitude-3570.59818 > c-73-101-52-184.hsd1.pa.comcast.net.8333: tcp 24
23:46:23.268776 IP tom-Latitude-3570.59818 > c-73-101-52-184.hsd1.pa.comcast.net.8333: tcp 37
23:46:23.269360 IP c-73-101-52-184.hsd1.pa.comcast.net.8333 > tom-Latitude-3570.59818: tcp 283
23:46:23.269379 IP tom-Latitude-3570.59818 > c-73-101-52-184.hsd1.pa.comcast.net.8333: tcp 0
23:46:23.302940 IP c-73-101-52-184.hsd1.pa.comcast.net.8333 > tom-Latitude-3570.59818: tcp 0
23:46:23.302954 IP c-73-101-52-184.hsd1.pa.comcast.net.8333 > tom-Latitude-3570.59818: tcp 0
23:46:23.368275 IP tom-Latitude-3570.59818 > c-73-101-52-184.hsd1.pa.comcast.net.8333: tcp 24
23:46:23.369212 IP tom-Latitude-3570.59818 > c-73-101-52-184.hsd1.pa.comcast.net.8333: tcp 433
23:46:23.414658 IP c-73-101-52-184.hsd1.pa.comcast.net.8333 > tom-Latitude-3570.59818: tcp 0
23:46:23.436200 IP c-73-101-52-184.hsd1.pa.comcast.net.8333 > tom-Latitude-3570.59818: tcp 0
23:46:23.465083 IP c-73-101-52-184.hsd1.pa.comcast.net.8333 > tom-Latitude-3570.59818: tcp 24
23:46:23.465103 IP tom-Latitude-3570.59818 > c-73-101-52-184.hsd1.pa.comcast.net.8333: tcp 0
23:46:23.465676 IP c-73-101-52-184.hsd1.pa.comcast.net.8333 > tom-Latitude-3570.59818: tcp 37
23:46:23.465693 IP tom-Latitude-3570.59818 > c-73-101-52-184.hsd1.pa.comcast.net.8333: tcp 0
23:46:23.880536 IP 172.214.77.34.bc.googleusercontent.com.8333 > tom-Latitude-3570.56244: tcp 24
23:46:23.880562 IP tom-Latitude-3570.56244 > 172.214.77.34.bc.googleusercontent.com.8333: tcp 0
23:46:23.880579 IP 172.214.77.34.bc.googleusercontent.com.8333 > tom-Latitude-3570.56244: tcp 253
23:46:23.880583 IP tom-Latitude-3570.56244 > 172.214.77.34.bc.googleusercontent.com.8333: tcp 0
23:46:23.880853 IP tom-Latitude-3570.56244 > 172.214.77.34.bc.googleusercontent.com.8333: tcp 24
23:46:23.881978 IP tom-Latitude-3570.56244 > 172.214.77.34.bc.googleusercontent.com.8333: tcp 109
23:46:23.932440 IP ec2-52-56-97-80.eu-west-2.compute.amazonaws.com.8333 > tom-Latitude-3570.36650: tcp 24
23:46:23.932458 IP tom-Latitude-3570.36650 > ec2-52-56-97-80.eu-west-2.compute.amazonaws.com.8333: tcp 0
23:46:23.933992 IP ec2-52-56-97-80.eu-west-2.compute.amazonaws.com.8333 > tom-Latitude-3570.36650: tcp 145
23:46:23.934018 IP tom-Latitude-3570.36650 > ec2-52-56-97-80.eu-west-2.compute.amazonaws.com.8333: tcp 0
23:46:23.934333 IP tom-Latitude-3570.36650 > ec2-52-56-97-80.eu-west-2.compute.amazonaws.com.8333: tcp 24
23:46:23.935139 IP tom-Latitude-3570.36650 > ec2-52-56-97-80.eu-west-2.compute.amazonaws.com.8333: tcp 37
23:46:23.956286 IP 172.214.77.34.bc.googleusercontent.com.8333 > tom-Latitude-3570.56244: tcp 0
23:46:23.976135 IP 172.214.77.34.bc.googleusercontent.com.8333 > tom-Latitude-3570.56244: tcp 0
23:46:23.980196 IP ec2-52-56-97-80.eu-west-2.compute.amazonaws.com.8333 > tom-Latitude-3570.36650: tcp 0
23:46:23.983642 IP ec2-52-56-97-80.eu-west-2.compute.amazonaws.com.8333 > tom-Latitude-3570.36650: tcp 0
23:46:24.036835 IP 172.214.77.34.bc.googleusercontent.com.8333 > tom-Latitude-3570.56244: tcp 24
23:46:24.037876 IP 172.214.77.34.bc.googleusercontent.com.8333 > tom-Latitude-3570.56244: tcp 902
23:46:24.037890 IP 172.214.77.34.bc.googleusercontent.com.8333 > tom-Latitude-3570.56244: tcp 24
23:46:24.037893 IP 172.214.77.34.bc.googleusercontent.com.8333 > tom-Latitude-3570.56244: tcp 249
23:46:24.037897 IP 172.214.77.34.bc.googleusercontent.com.8333 > tom-Latitude-3570.56244: tcp 24
23:46:24.037899 IP 172.214.77.34.bc.googleusercontent.com.8333 > tom-Latitude-3570.56244: tcp 189
23:46:24.037902 IP ec2-52-56-97-80.eu-west-2.compute.amazonaws.com.8333 > tom-Latitude-3570.36650: tcp 24
23:46:24.037932 IP tom-Latitude-3570.56244 > 172.214.77.34.bc.googleusercontent.com.8333: tcp 0
23:46:24.040458 IP ec2-52-56-97-80.eu-west-2.compute.amazonaws.com.8333 > tom-Latitude-3570.36650: tcp 562
23:46:24.040511 IP tom-Latitude-3570.36650 > ec2-52-56-97-80.eu-west-2.compute.amazonaws.com.8333: tcp 0
23:46:24.946021 IP tom-Latitude-3570.59818 > c-73-101-52-184.hsd1.pa.comcast.net.8333: tcp 24
23:46:24.946080 IP tom-Latitude-3570.54046 > 184-101-12-201.phnx.qwest.net.8333: tcp 24
23:46:24.948047 IP tom-Latitude-3570.54046 > 184-101-12-201.phnx.qwest.net.8333: tcp 145
23:46:24.948057 IP tom-Latitude-3570.59818 > c-73-101-52-184.hsd1.pa.comcast.net.8333: tcp 145
23:46:25.002062 IP 184-101-12-201.phnx.qwest.net.8333 > tom-Latitude-3570.54046: tcp 0
23:46:25.009665 IP 184-101-12-201.phnx.qwest.net.8333 > tom-Latitude-3570.54046: tcp 0
23:46:25.011009 IP c-73-101-52-184.hsd1.pa.comcast.net.8333 > tom-Latitude-3570.59818: tcp 0
23:46:25.046412 IP tom-Latitude-3570.36650 > ec2-52-56-97-80.eu-west-2.compute.amazonaws.com.8333: tcp 24
23:46:25.049632 IP tom-Latitude-3570.36650 > ec2-52-56-97-80.eu-west-2.compute.amazonaws.com.8333: tcp 31
23:46:25.101029 IP ec2-52-56-97-80.eu-west-2.compute.amazonaws.com.8333 > tom-Latitude-3570.36650: tcp 0
23:46:25.101043 IP ec2-52-56-97-80.eu-west-2.compute.amazonaws.com.8333 > tom-Latitude-3570.36650: tcp 0
23:46:25.146731 IP tom-Latitude-3570.56244 > 172.214.77.34.bc.googleusercontent.com.8333: tcp 24
23:46:25.147653 IP tom-Latitude-3570.56244 > 172.214.77.34.bc.googleusercontent.com.8333: tcp 37
23:46:25.190258 IP pool-108-20-207-31.bstnma.fios.verizon.net.8333 > tom-Latitude-3570.33922: tcp 24
23:46:25.190275 IP tom-Latitude-3570.33922 > pool-108-20-207-31.bstnma.fios.verizon.net.8333: tcp 0
23:46:25.193034 IP pool-108-20-207-31.bstnma.fios.verizon.net.8333 > tom-Latitude-3570.33922: tcp 289
23:46:25.193059 IP tom-Latitude-3570.33922 > pool-108-20-207-31.bstnma.fios.verizon.net.8333: tcp 0
23:46:25.193075 IP 172.214.77.34.bc.googleusercontent.com.8333 > tom-Latitude-3570.56244: tcp 0
23:46:25.193336 IP tom-Latitude-3570.33922 > pool-108-20-207-31.bstnma.fios.verizon.net.8333: tcp 24
23:46:25.195064 IP 172.214.77.34.bc.googleusercontent.com.8333 > tom-Latitude-3570.56244: tcp 0
23:46:25.198345 IP tom-Latitude-3570.33922 > pool-108-20-207-31.bstnma.fios.verizon.net.8333: tcp 145
23:46:25.227646 IP pool-108-20-207-31.bstnma.fios.verizon.net.8333 > tom-Latitude-3570.33922: tcp 0
23:46:25.234256 IP pool-108-20-207-31.bstnma.fios.verizon.net.8333 > tom-Latitude-3570.33922: tcp 0
23:46:25.419445 IP pool-108-20-207-31.bstnma.fios.verizon.net.8333 > tom-Latitude-3570.33922: tcp 24
23:46:25.419466 IP pool-108-20-207-31.bstnma.fios.verizon.net.8333 > tom-Latitude-3570.33922: tcp 1460
23:46:25.419511 IP tom-Latitude-3570.33922 > pool-108-20-207-31.bstnma.fios.verizon.net.8333: tcp 0
23:46:25.420441 IP pool-108-20-207-31.bstnma.fios.verizon.net.8333 > tom-Latitude-3570.33922: tcp 1460
23:46:25.420459 IP pool-108-20-207-31.bstnma.fios.verizon.net.8333 > tom-Latitude-3570.33922: tcp 1288
23:46:25.420461 IP pool-108-20-207-31.bstnma.fios.verizon.net.8333 > tom-Latitude-3570.33922: tcp 24
23:46:25.420464 IP pool-108-20-207-31.bstnma.fios.verizon.net.8333 > tom-Latitude-3570.33922: tcp 373
23:46:25.420468 IP pool-108-20-207-31.bstnma.fios.verizon.net.8333 > tom-Latitude-3570.33922: tcp 24
23:46:25.420473 IP pool-108-20-207-31.bstnma.fios.verizon.net.8333 > tom-Latitude-3570.33922: tcp 1460
23:46:25.420475 IP pool-108-20-207-31.bstnma.fios.verizon.net.8333 > tom-Latitude-3570.33922: tcp 93
23:46:25.420476 IP pool-108-20-207-31.bstnma.fios.verizon.net.8333 > tom-Latitude-3570.33922: tcp 24
23:46:25.420478 IP pool-108-20-207-31.bstnma.fios.verizon.net.8333 > tom-Latitude-3570.33922: tcp 255
23:46:25.420511 IP tom-Latitude-3570.33922 > pool-108-20-207-31.bstnma.fios.verizon.net.8333: tcp 0
23:46:25.528982 IP tom-Latitude-3570.36650 > ec2-52-56-97-80.eu-west-2.compute.amazonaws.com.8333: tcp 24
23:46:25.531230 IP tom-Latitude-3570.36650 > ec2-52-56-97-80.eu-west-2.compute.amazonaws.com.8333: tcp 145
23:46:25.566568 IP ec2-52-56-97-80.eu-west-2.compute.amazonaws.com.8333 > tom-Latitude-3570.36650: tcp 0
23:46:25.570242 IP ec2-52-56-97-80.eu-west-2.compute.amazonaws.com.8333 > tom-Latitude-3570.36650: tcp 0
23:46:25.829676 IP tom-Latitude-3570.59818 > c-73-101-52-184.hsd1.pa.comcast.net.8333: tcp 24
23:46:25.831800 IP tom-Latitude-3570.59818 > c-73-101-52-184.hsd1.pa.comcast.net.8333: tcp 145
23:46:25.882440 IP c-73-101-52-184.hsd1.pa.comcast.net.8333 > tom-Latitude-3570.59818: tcp 0
23:46:25.930083 IP tom-Latitude-3570.56244 > 172.214.77.34.bc.googleusercontent.com.8333: tcp 24
23:46:25.930903 IP tom-Latitude-3570.56244 > 172.214.77.34.bc.googleusercontent.com.8333: tcp 145
23:46:25.973295 IP 172.214.77.34.bc.googleusercontent.com.8333 > tom-Latitude-3570.56244: tcp 0
23:46:26.008442 IP 172.214.77.34.bc.googleusercontent.com.8333 > tom-Latitude-3570.56244: tcp 0
23:46:26.231237 IP tom-Latitude-3570.47742 > 97-82-78-25.dhcp.leds.al.charter.com.8333: tcp 24
23:46:26.231441 IP tom-Latitude-3570.54046 > 184-101-12-201.phnx.qwest.net.8333: tcp 24
23:46:26.233866 IP tom-Latitude-3570.54046 > 184-101-12-201.phnx.qwest.net.8333: tcp 145
23:46:26.233876 IP tom-Latitude-3570.47742 > 97-82-78-25.dhcp.leds.al.charter.com.8333: tcp 289
23:46:26.272490 IP 184-101-12-201.phnx.qwest.net.8333 > tom-Latitude-3570.54046: tcp 0
23:46:26.310623 IP 97-82-78-25.dhcp.leds.al.charter.com.8333 > tom-Latitude-3570.47742: tcp 0
23:46:26.311298 IP 184-101-12-201.phnx.qwest.net.8333 > tom-Latitude-3570.54046: tcp 0
23:46:26.331674 IP tom-Latitude-3570.34082 > host93-234-110-95.serverdedicati.aruba.it.8333: tcp 24
23:46:26.332992 IP tom-Latitude-3570.34082 > host93-234-110-95.serverdedicati.aruba.it.8333: tcp 289
23:46:26.507884 IP tom-Latitude-3570.34082 > host93-234-110-95.serverdedicati.aruba.it.8333: tcp 289
23:46:26.510603 IP 97-82-78-25.dhcp.leds.al.charter.com.8333 > tom-Latitude-3570.47742: tcp 0
23:46:26.510617 IP host93-234-110-95.serverdedicati.aruba.it.8333 > tom-Latitude-3570.34082: tcp 0
23:46:26.548398 IP host93-234-110-95.serverdedicati.aruba.it.8333 > tom-Latitude-3570.34082: tcp 0
23:46:26.570430 IP 172.214.77.34.bc.googleusercontent.com.8333 > tom-Latitude-3570.56244: tcp 24
23:46:26.570974 IP 172.214.77.34.bc.googleusercontent.com.8333 > tom-Latitude-3570.56244: tcp 253
23:46:26.571085 IP tom-Latitude-3570.56244 > 172.214.77.34.bc.googleusercontent.com.8333: tcp 0
23:46:26.571392 IP tom-Latitude-3570.56244 > 172.214.77.34.bc.googleusercontent.com.8333: tcp 24
23:46:26.572686 IP tom-Latitude-3570.56244 > 172.214.77.34.bc.googleusercontent.com.8333: tcp 253
23:46:26.604321 IP 172.214.77.34.bc.googleusercontent.com.8333 > tom-Latitude-3570.56244: tcp 0
23:46:26.616276 IP 172.214.77.34.bc.googleusercontent.com.8333 > tom-Latitude-3570.56244: tcp 0
23:46:26.677274 IP 172.214.77.34.bc.googleusercontent.com.8333 > tom-Latitude-3570.56244: tcp 24
23:46:26.678376 IP 172.214.77.34.bc.googleusercontent.com.8333 > tom-Latitude-3570.56244: tcp 226
23:46:26.678394 IP 172.214.77.34.bc.googleusercontent.com.8333 > tom-Latitude-3570.56244: tcp 24
23:46:26.678396 IP 172.214.77.34.bc.googleusercontent.com.8333 > tom-Latitude-3570.56244: tcp 224
23:46:26.678398 IP 172.214.77.34.bc.googleusercontent.com.8333 > tom-Latitude-3570.56244: tcp 24
23:46:26.678400 IP 172.214.77.34.bc.googleusercontent.com.8333 > tom-Latitude-3570.56244: tcp 223
23:46:26.678402 IP 172.214.77.34.bc.googleusercontent.com.8333 > tom-Latitude-3570.56244: tcp 24
23:46:26.678422 IP 172.214.77.34.bc.googleusercontent.com.8333 > tom-Latitude-3570.56244: tcp 245
23:46:26.678424 IP 172.214.77.34.bc.googleusercontent.com.8333 > tom-Latitude-3570.56244: tcp 24
23:46:26.678426 IP 172.214.77.34.bc.googleusercontent.com.8333 > tom-Latitude-3570.56244: tcp 225
23:46:26.678428 IP 172.214.77.34.bc.googleusercontent.com.8333 > tom-Latitude-3570.56244: tcp 24
23:46:26.678431 IP 172.214.77.34.bc.googleusercontent.com.8333 > tom-Latitude-3570.56244: tcp 418
23:46:26.678433 IP 172.214.77.34.bc.googleusercontent.com.8333 > tom-Latitude-3570.56244: tcp 24
23:46:26.678492 IP tom-Latitude-3570.56244 > 172.214.77.34.bc.googleusercontent.com.8333: tcp 0
23:46:26.680504 IP 172.214.77.34.bc.googleusercontent.com.8333 > tom-Latitude-3570.56244: tcp 521
23:46:26.723893 IP tom-Latitude-3570.56244 > 172.214.77.34.bc.googleusercontent.com.8333: tcp 0
23:46:26.885370 IP tom-Latitude-3570.34082 > host93-234-110-95.serverdedicati.aruba.it.8333: tcp 24
23:46:26.887297 IP tom-Latitude-3570.34082 > host93-234-110-95.serverdedicati.aruba.it.8333: tcp 253
23:46:26.920559 IP host93-234-110-95.serverdedicati.aruba.it.8333 > tom-Latitude-3570.34082: tcp 0
23:46:26.939021 IP host93-234-110-95.serverdedicati.aruba.it.8333 > tom-Latitude-3570.34082: tcp 0
23:46:27.362514 IP 59.110.157.16.8333 > tom-Latitude-3570.47822: tcp 24
23:46:27.362538 IP tom-Latitude-3570.47822 > 59.110.157.16.8333: tcp 0
23:46:27.362571 IP 59.110.157.16.8333 > tom-Latitude-3570.47822: tcp 613
23:46:27.362575 IP tom-Latitude-3570.47822 > 59.110.157.16.8333: tcp 0
23:46:27.362905 IP tom-Latitude-3570.47822 > 59.110.157.16.8333: tcp 24
23:46:27.364130 IP tom-Latitude-3570.47822 > 59.110.157.16.8333: tcp 73
23:46:27.424568 IP 59.110.157.16.8333 > tom-Latitude-3570.47822: tcp 0
23:46:27.428566 IP 59.110.157.16.8333 > tom-Latitude-3570.47822: tcp 0
23:46:27.772159 IP 59.110.157.16.8333 > tom-Latitude-3570.47822: tcp 24
23:46:27.772178 IP 59.110.157.16.8333 > tom-Latitude-3570.47822: tcp 223
23:46:27.772181 IP 59.110.157.16.8333 > tom-Latitude-3570.47822: tcp 24
23:46:27.772276 IP tom-Latitude-3570.47822 > 59.110.157.16.8333: tcp 0
23:46:27.873107 IP tom-Latitude-3570.33922 > pool-108-20-207-31.bstnma.fios.verizon.net.8333: tcp 24
23:46:27.874497 IP tom-Latitude-3570.33922 > pool-108-20-207-31.bstnma.fios.verizon.net.8333: tcp 289
23:46:27.885819 IP 59.110.157.16.8333 > tom-Latitude-3570.47822: tcp 700
23:46:27.927905 IP tom-Latitude-3570.47822 > 59.110.157.16.8333: tcp 0
23:46:27.943004 IP pool-108-20-207-31.bstnma.fios.verizon.net.8333 > tom-Latitude-3570.33922: tcp 0
23:46:27.955994 IP pool-108-20-207-31.bstnma.fios.verizon.net.8333 > tom-Latitude-3570.33922: tcp 0
23:46:28.022420 IP pool-108-20-207-31.bstnma.fios.verizon.net.8333 > tom-Latitude-3570.33922: tcp 24
23:46:28.022437 IP pool-108-20-207-31.bstnma.fios.verizon.net.8333 > tom-Latitude-3570.33922: tcp 8
23:46:28.022532 IP tom-Latitude-3570.33922 > pool-108-20-207-31.bstnma.fios.verizon.net.8333: tcp 0
23:46:28.022667 IP tom-Latitude-3570.33922 > pool-108-20-207-31.bstnma.fios.verizon.net.8333: tcp 24
23:46:28.024198 IP tom-Latitude-3570.33922 > pool-108-20-207-31.bstnma.fios.verizon.net.8333: tcp 8
23:46:28.058400 IP pool-108-20-207-31.bstnma.fios.verizon.net.8333 > tom-Latitude-3570.33922: tcp 0
23:46:28.058976 IP pool-108-20-207-31.bstnma.fios.verizon.net.8333 > tom-Latitude-3570.33922: tcp 0
23:46:28.524196 IP tom-Latitude-3570.47742 > 97-82-78-25.dhcp.leds.al.charter.com.8333: tcp 24
23:46:28.526235 IP tom-Latitude-3570.47742 > 97-82-78-25.dhcp.leds.al.charter.com.8333: tcp 325
23:46:28.526826 IP 172.214.77.34.bc.googleusercontent.com.8333 > tom-Latitude-3570.56244: tcp 24
23:46:28.526850 IP tom-Latitude-3570.56244 > 172.214.77.34.bc.googleusercontent.com.8333: tcp 0
23:46:28.526881 IP 172.214.77.34.bc.googleusercontent.com.8333 > tom-Latitude-3570.56244: tcp 361
23:46:28.526887 IP tom-Latitude-3570.56244 > 172.214.77.34.bc.googleusercontent.com.8333: tcp 0
23:46:28.527222 IP tom-Latitude-3570.56244 > 172.214.77.34.bc.googleusercontent.com.8333: tcp 24
23:46:28.528239 IP tom-Latitude-3570.56244 > 172.214.77.34.bc.googleusercontent.com.8333: tcp 289
23:46:28.562461 IP 97-82-78-25.dhcp.leds.al.charter.com.8333 > tom-Latitude-3570.47742: tcp 0
23:46:28.570572 IP 97-82-78-25.dhcp.leds.al.charter.com.8333 > tom-Latitude-3570.47742: tcp 0
23:46:28.570585 IP 172.214.77.34.bc.googleusercontent.com.8333 > tom-Latitude-3570.56244: tcp 0
23:46:28.584703 IP 172.214.77.34.bc.googleusercontent.com.8333 > tom-Latitude-3570.56244: tcp 0
23:46:28.588313 IP 97-82-78-25.dhcp.leds.al.charter.com.8333 > tom-Latitude-3570.47742: tcp 24
23:46:28.588329 IP 97-82-78-25.dhcp.leds.al.charter.com.8333 > tom-Latitude-3570.47742: tcp 433
23:46:28.588416 IP tom-Latitude-3570.47742 > 97-82-78-25.dhcp.leds.al.charter.com.8333: tcp 0
23:46:28.657933 IP 172.214.77.34.bc.googleusercontent.com.8333 > tom-Latitude-3570.56244: tcp 24
23:46:28.657952 IP 172.214.77.34.bc.googleusercontent.com.8333 > tom-Latitude-3570.56244: tcp 469
23:46:28.657955 IP 172.214.77.34.bc.googleusercontent.com.8333 > tom-Latitude-3570.56244: tcp 24
23:46:28.657957 IP 172.214.77.34.bc.googleusercontent.com.8333 > tom-Latitude-3570.56244: tcp 371
23:46:28.658073 IP tom-Latitude-3570.56244 > 172.214.77.34.bc.googleusercontent.com.8333: tcp 0
23:46:28.660040 IP 172.214.77.34.bc.googleusercontent.com.8333 > tom-Latitude-3570.56244: tcp 24
23:46:28.660053 IP 172.214.77.34.bc.googleusercontent.com.8333 > tom-Latitude-3570.56244: tcp 225
23:46:28.660056 IP 172.214.77.34.bc.googleusercontent.com.8333 > tom-Latitude-3570.56244: tcp 24
23:46:28.660058 IP 172.214.77.34.bc.googleusercontent.com.8333 > tom-Latitude-3570.56244: tcp 224
23:46:28.660059 IP 172.214.77.34.bc.googleusercontent.com.8333 > tom-Latitude-3570.56244: tcp 24
23:46:28.660079 IP 172.214.77.34.bc.googleusercontent.com.8333 > tom-Latitude-3570.56244: tcp 225
23:46:28.660082 IP 172.214.77.34.bc.googleusercontent.com.8333 > tom-Latitude-3570.56244: tcp 24
23:46:28.660084 IP 172.214.77.34.bc.googleusercontent.com.8333 > tom-Latitude-3570.56244: tcp 190
23:46:28.660086 IP 172.214.77.34.bc.googleusercontent.com.8333 > tom-Latitude-3570.56244: tcp 24
23:46:28.660088 IP 172.214.77.34.bc.googleusercontent.com.8333 > tom-Latitude-3570.56244: tcp 224
23:46:28.660089 IP 172.214.77.34.bc.googleusercontent.com.8333 > tom-Latitude-3570.56244: tcp 24
23:46:28.660091 IP 172.214.77.34.bc.googleusercontent.com.8333 > tom-Latitude-3570.56244: tcp 224
23:46:28.660130 IP tom-Latitude-3570.56244 > 172.214.77.34.bc.googleusercontent.com.8333: tcp 0
23:46:28.712404 IP 184-101-12-201.phnx.qwest.net.8333 > tom-Latitude-3570.54046: tcp 32
23:46:28.712661 IP tom-Latitude-3570.54046 > 184-101-12-201.phnx.qwest.net.8333: tcp 24
23:46:28.713595 IP tom-Latitude-3570.54046 > 184-101-12-201.phnx.qwest.net.8333: tcp 8
23:46:28.760549 IP 184-101-12-201.phnx.qwest.net.8333 > tom-Latitude-3570.54046: tcp 0
23:46:28.761278 IP 184-101-12-201.phnx.qwest.net.8333 > tom-Latitude-3570.54046: tcp 0
23:46:29.001692 IP 59.110.157.16.8333 > tom-Latitude-3570.47822: tcp 24
23:46:29.001710 IP tom-Latitude-3570.47822 > 59.110.157.16.8333: tcp 0
23:46:29.001728 IP 59.110.157.16.8333 > tom-Latitude-3570.47822: tcp 289
23:46:29.001732 IP tom-Latitude-3570.47822 > 59.110.157.16.8333: tcp 0
23:46:29.001989 IP tom-Latitude-3570.47742 > 97-82-78-25.dhcp.leds.al.charter.com.8333: tcp 24
23:46:29.002111 IP tom-Latitude-3570.47822 > 59.110.157.16.8333: tcp 24
23:46:29.003196 IP tom-Latitude-3570.47822 > 59.110.157.16.8333: tcp 37
23:46:29.003203 IP tom-Latitude-3570.47742 > 97-82-78-25.dhcp.leds.al.charter.com.8333: tcp 181
23:46:29.055052 IP 59.110.157.16.8333 > tom-Latitude-3570.47822: tcp 0
23:46:29.055067 IP 97-82-78-25.dhcp.leds.al.charter.com.8333 > tom-Latitude-3570.47742: tcp 0
23:46:29.058430 IP 59.110.157.16.8333 > tom-Latitude-3570.47822: tcp 0
23:46:29.179073 IP ec2-52-56-97-80.eu-west-2.compute.amazonaws.com.8333 > tom-Latitude-3570.36650: tcp 24
23:46:29.182166 IP ec2-52-56-97-80.eu-west-2.compute.amazonaws.com.8333 > tom-Latitude-3570.36650: tcp 649
23:46:29.182300 IP tom-Latitude-3570.36650 > ec2-52-56-97-80.eu-west-2.compute.amazonaws.com.8333: tcp 0
23:46:29.182647 IP tom-Latitude-3570.36650 > ec2-52-56-97-80.eu-west-2.compute.amazonaws.com.8333: tcp 24
23:46:29.182794 IP tom-Latitude-3570.59818 > c-73-101-52-184.hsd1.pa.comcast.net.8333: tcp 24
23:46:29.187196 IP tom-Latitude-3570.59818 > c-73-101-52-184.hsd1.pa.comcast.net.8333: tcp 613
23:46:29.187201 IP tom-Latitude-3570.36650 > ec2-52-56-97-80.eu-west-2.compute.amazonaws.com.8333: tcp 37
23:46:29.222389 IP ec2-52-56-97-80.eu-west-2.compute.amazonaws.com.8333 > tom-Latitude-3570.36650: tcp 0
23:46:29.240232 IP c-73-101-52-184.hsd1.pa.comcast.net.8333 > tom-Latitude-3570.59818: tcp 0
23:46:29.243773 IP ec2-52-56-97-80.eu-west-2.compute.amazonaws.com.8333 > tom-Latitude-3570.36650: tcp 0
23:46:29.282936 IP 59.110.157.16.8333 > tom-Latitude-3570.47822: tcp 24
23:46:29.286748 IP 59.110.157.16.8333 > tom-Latitude-3570.47822: tcp 37
23:46:29.286881 IP tom-Latitude-3570.47822 > 59.110.157.16.8333: tcp 0
23:46:29.301565 IP ec2-52-56-97-80.eu-west-2.compute.amazonaws.com.8333 > tom-Latitude-3570.36650: tcp 24
23:46:29.302364 IP ec2-52-56-97-80.eu-west-2.compute.amazonaws.com.8333 > tom-Latitude-3570.36650: tcp 698
23:46:29.302496 IP tom-Latitude-3570.36650 > ec2-52-56-97-80.eu-west-2.compute.amazonaws.com.8333: tcp 0
23:46:29.403958 IP tom-Latitude-3570.47822 > 59.110.157.16.8333: tcp 24
23:46:29.405209 IP tom-Latitude-3570.47822 > 59.110.157.16.8333: tcp 73
23:46:29.455072 IP 59.110.157.16.8333 > tom-Latitude-3570.47822: tcp 0
23:46:29.459099 IP 59.110.157.16.8333 > tom-Latitude-3570.47822: tcp 0
23:46:29.504433 IP tom-Latitude-3570.54046 > 184-101-12-201.phnx.qwest.net.8333: tcp 24
23:46:29.505371 IP tom-Latitude-3570.54046 > 184-101-12-201.phnx.qwest.net.8333: tcp 649
23:46:29.538601 IP 184-101-12-201.phnx.qwest.net.8333 > tom-Latitude-3570.54046: tcp 0
23:46:29.566548 IP 184-101-12-201.phnx.qwest.net.8333 > tom-Latitude-3570.54046: tcp 0
23:46:29.604778 IP tom-Latitude-3570.59818 > c-73-101-52-184.hsd1.pa.comcast.net.8333: tcp 24
23:46:29.627024 IP tom-Latitude-3570.59818 > c-73-101-52-184.hsd1.pa.comcast.net.8333: tcp 8
23:46:29.662429 IP c-73-101-52-184.hsd1.pa.comcast.net.8333 > tom-Latitude-3570.59818: tcp 0
23:46:29.686754 IP 59.110.157.16.8333 > tom-Latitude-3570.47822: tcp 24
23:46:29.687440 IP 59.110.157.16.8333 > tom-Latitude-3570.47822: tcp 284
23:46:29.687458 IP 59.110.157.16.8333 > tom-Latitude-3570.47822: tcp 24
23:46:29.687578 IP tom-Latitude-3570.47822 > 59.110.157.16.8333: tcp 0
23:46:29.768470 IP pool-108-20-207-31.bstnma.fios.verizon.net.8333 > tom-Latitude-3570.33922: tcp 24
23:46:29.778624 IP pool-108-20-207-31.bstnma.fios.verizon.net.8333 > tom-Latitude-3570.33922: tcp 433
23:46:29.778731 IP tom-Latitude-3570.33922 > pool-108-20-207-31.bstnma.fios.verizon.net.8333: tcp 0
23:46:29.778897 IP tom-Latitude-3570.34082 > host93-234-110-95.serverdedicati.aruba.it.8333: tcp 24
23:46:29.779067 IP tom-Latitude-3570.33922 > pool-108-20-207-31.bstnma.fios.verizon.net.8333: tcp 24
23:46:29.780313 IP tom-Latitude-3570.33922 > pool-108-20-207-31.bstnma.fios.verizon.net.8333: tcp 73
23:46:29.780325 IP tom-Latitude-3570.34082 > host93-234-110-95.serverdedicati.aruba.it.8333: tcp 397
23:46:29.781820 IP ec2-52-56-97-80.eu-west-2.compute.amazonaws.com.8333 > tom-Latitude-3570.36650: tcp 24
23:46:29.781840 IP ec2-52-56-97-80.eu-west-2.compute.amazonaws.com.8333 > tom-Latitude-3570.36650: tcp 181
23:46:29.781939 IP tom-Latitude-3570.36650 > ec2-52-56-97-80.eu-west-2.compute.amazonaws.com.8333: tcp 0
23:46:29.782171 IP tom-Latitude-3570.36650 > ec2-52-56-97-80.eu-west-2.compute.amazonaws.com.8333: tcp 24
23:46:29.783414 IP tom-Latitude-3570.36650 > ec2-52-56-97-80.eu-west-2.compute.amazonaws.com.8333: tcp 109
23:46:29.812603 IP host93-234-110-95.serverdedicati.aruba.it.8333 > tom-Latitude-3570.34082: tcp 0
23:46:29.813205 IP pool-108-20-207-31.bstnma.fios.verizon.net.8333 > tom-Latitude-3570.33922: tcp 0
23:46:29.822490 IP c-73-101-52-184.hsd1.pa.comcast.net.8333 > tom-Latitude-3570.59818: tcp 24
23:46:29.822514 IP tom-Latitude-3570.59818 > c-73-101-52-184.hsd1.pa.comcast.net.8333: tcp 0
23:46:29.823060 IP c-73-101-52-184.hsd1.pa.comcast.net.8333 > tom-Latitude-3570.59818: tcp 8
23:46:29.823067 IP tom-Latitude-3570.59818 > c-73-101-52-184.hsd1.pa.comcast.net.8333: tcp 0
23:46:29.830804 IP pool-108-20-207-31.bstnma.fios.verizon.net.8333 > tom-Latitude-3570.33922: tcp 0
23:46:29.830819 IP host93-234-110-95.serverdedicati.aruba.it.8333 > tom-Latitude-3570.34082: tcp 0
23:46:29.830821 IP ec2-52-56-97-80.eu-west-2.compute.amazonaws.com.8333 > tom-Latitude-3570.36650: tcp 0
23:46:29.835742 IP ec2-52-56-97-80.eu-west-2.compute.amazonaws.com.8333 > tom-Latitude-3570.36650: tcp 0
23:46:29.890744 IP ec2-52-56-97-80.eu-west-2.compute.amazonaws.com.8333 > tom-Latitude-3570.36650: tcp 24
23:46:29.891551 IP ec2-52-56-97-80.eu-west-2.compute.amazonaws.com.8333 > tom-Latitude-3570.36650: tcp 224
23:46:29.891570 IP ec2-52-56-97-80.eu-west-2.compute.amazonaws.com.8333 > tom-Latitude-3570.36650: tcp 554
23:46:29.891661 IP tom-Latitude-3570.36650 > ec2-52-56-97-80.eu-west-2.compute.amazonaws.com.8333: tcp 0
23:46:29.915110 IP 59.110.157.16.8333 > tom-Latitude-3570.47822: tcp 284
23:46:29.955880 IP tom-Latitude-3570.47822 > 59.110.157.16.8333: tcp 0
23:46:29.968848 IP pool-108-20-207-31.bstnma.fios.verizon.net.8333 > tom-Latitude-3570.33922: tcp 24
23:46:29.969549 IP pool-108-20-207-31.bstnma.fios.verizon.net.8333 > tom-Latitude-3570.33922: tcp 190
23:46:29.969578 IP pool-108-20-207-31.bstnma.fios.verizon.net.8333 > tom-Latitude-3570.33922: tcp 24
23:46:29.969581 IP pool-108-20-207-31.bstnma.fios.verizon.net.8333 > tom-Latitude-3570.33922: tcp 283
23:46:29.969661 IP tom-Latitude-3570.33922 > pool-108-20-207-31.bstnma.fios.verizon.net.8333: tcp 0
23:46:30.471921 IP tom-Latitude-3570.47822 > 59.110.157.16.8333: tcp 24
23:46:30.474027 IP tom-Latitude-3570.47822 > 59.110.157.16.8333: tcp 37
23:46:30.519302 IP 59.110.157.16.8333 > tom-Latitude-3570.47822: tcp 0
23:46:30.568560 IP 59.110.157.16.8333 > tom-Latitude-3570.47822: tcp 0
23:46:30.672635 IP tom-Latitude-3570.59818 > c-73-101-52-184.hsd1.pa.comcast.net.8333: tcp 24
23:46:30.675021 IP tom-Latitude-3570.59818 > c-73-101-52-184.hsd1.pa.comcast.net.8333: tcp 217
23:46:30.742402 IP c-73-101-52-184.hsd1.pa.comcast.net.8333 > tom-Latitude-3570.59818: tcp 0
23:46:30.773072 IP tom-Latitude-3570.47822 > 59.110.157.16.8333: tcp 24
23:46:30.773989 IP tom-Latitude-3570.47822 > 59.110.157.16.8333: tcp 217
23:46:30.796687 IP 59.110.157.16.8333 > tom-Latitude-3570.47822: tcp 24
23:46:30.796717 IP tom-Latitude-3570.47822 > 59.110.157.16.8333: tcp 0
23:46:30.798595 IP 59.110.157.16.8333 > tom-Latitude-3570.47822: tcp 284
23:46:30.798620 IP tom-Latitude-3570.47822 > 59.110.157.16.8333: tcp 0
23:46:30.821088 IP 59.110.157.16.8333 > tom-Latitude-3570.47822: tcp 0
23:46:30.821102 IP 59.110.157.16.8333 > tom-Latitude-3570.47822: tcp 0
23:46:31.253522 IP 59.110.157.16.8333 > tom-Latitude-3570.47822: tcp 24
23:46:31.253544 IP tom-Latitude-3570.47822 > 59.110.157.16.8333: tcp 0
23:46:31.253577 IP 59.110.157.16.8333 > tom-Latitude-3570.47822: tcp 937
23:46:31.253582 IP tom-Latitude-3570.47822 > 59.110.157.16.8333: tcp 0
23:46:31.254045 IP tom-Latitude-3570.47822 > 59.110.157.16.8333: tcp 24
23:46:31.254118 IP tom-Latitude-3570.54046 > 184-101-12-201.phnx.qwest.net.8333: tcp 24
23:46:31.254968 IP tom-Latitude-3570.54046 > 184-101-12-201.phnx.qwest.net.8333: tcp 181
23:46:31.254974 IP tom-Latitude-3570.47822 > 59.110.157.16.8333: tcp 937
23:46:31.326522 IP 184-101-12-201.phnx.qwest.net.8333 > tom-Latitude-3570.54046: tcp 0
23:46:31.330263 IP 184-101-12-201.phnx.qwest.net.8333 > tom-Latitude-3570.54046: tcp 0
23:46:31.330975 IP 59.110.157.16.8333 > tom-Latitude-3570.47822: tcp 0
23:46:31.374481 IP 59.110.157.16.8333 > tom-Latitude-3570.47822: tcp 0
23:46:31.663433 IP 59.110.157.16.8333 > tom-Latitude-3570.47822: tcp 24
23:46:31.663452 IP 59.110.157.16.8333 > tom-Latitude-3570.47822: tcp 223
23:46:31.663455 IP 59.110.157.16.8333 > tom-Latitude-3570.47822: tcp 24
23:46:31.663548 IP tom-Latitude-3570.47822 > 59.110.157.16.8333: tcp 0
23:46:31.864549 IP tom-Latitude-3570.47742 > 97-82-78-25.dhcp.leds.al.charter.com.8333: tcp 24
23:46:31.864605 IP tom-Latitude-3570.47822 > 59.110.157.16.8333: tcp 24
23:46:31.865723 IP tom-Latitude-3570.47822 > 59.110.157.16.8333: tcp 73
23:46:31.865734 IP tom-Latitude-3570.47742 > 97-82-78-25.dhcp.leds.al.charter.com.8333: tcp 37
23:46:31.867815 IP 59.110.157.16.8333 > tom-Latitude-3570.47822: tcp 1448
23:46:31.867835 IP 59.110.157.16.8333 > tom-Latitude-3570.47822: tcp 1448
23:46:31.867929 IP tom-Latitude-3570.47822 > 59.110.157.16.8333: tcp 0
23:46:31.869442 IP 59.110.157.16.8333 > tom-Latitude-3570.47822: tcp 1448
23:46:31.869501 IP tom-Latitude-3570.47822 > 59.110.157.16.8333: tcp 0
23:46:31.940985 IP 97-82-78-25.dhcp.leds.al.charter.com.8333 > tom-Latitude-3570.47742: tcp 0
23:46:31.941000 IP 59.110.157.16.8333 > tom-Latitude-3570.47822: tcp 0
23:46:31.944420 IP 59.110.157.16.8333 > tom-Latitude-3570.47822: tcp 0
23:46:32.012396 IP host93-234-110-95.serverdedicati.aruba.it.8333 > tom-Latitude-3570.34082: tcp 24
23:46:32.012419 IP host93-234-110-95.serverdedicati.aruba.it.8333 > tom-Latitude-3570.34082: tcp 1261
23:46:32.012510 IP tom-Latitude-3570.34082 > host93-234-110-95.serverdedicati.aruba.it.8333: tcp 0
23:46:32.012924 IP tom-Latitude-3570.34082 > host93-234-110-95.serverdedicati.aruba.it.8333: tcp 24
23:46:32.013932 IP tom-Latitude-3570.34082 > host93-234-110-95.serverdedicati.aruba.it.8333: tcp 397
23:46:32.046710 IP host93-234-110-95.serverdedicati.aruba.it.8333 > tom-Latitude-3570.34082: tcp 0
23:46:32.070527 IP 59.110.157.16.8333 > tom-Latitude-3570.47822: tcp 1448
23:46:32.070547 IP 59.110.157.16.8333 > tom-Latitude-3570.47822: tcp 1448
23:46:32.070549 IP host93-234-110-95.serverdedicati.aruba.it.8333 > tom-Latitude-3570.34082: tcp 0
23:46:32.070641 IP tom-Latitude-3570.47822 > 59.110.157.16.8333: tcp 0
23:46:32.095064 IP 59.110.157.16.8333 > tom-Latitude-3570.47822: tcp 513
23:46:32.109111 IP 97-82-78-25.dhcp.leds.al.charter.com.8333 > tom-Latitude-3570.47742: tcp 24
23:46:32.115290 IP 97-82-78-25.dhcp.leds.al.charter.com.8333 > tom-Latitude-3570.47742: tcp 284
23:46:32.115407 IP tom-Latitude-3570.47742 > 97-82-78-25.dhcp.leds.al.charter.com.8333: tcp 0
23:46:32.139700 IP tom-Latitude-3570.47822 > 59.110.157.16.8333: tcp 0
23:46:32.184854 IP host93-234-110-95.serverdedicati.aruba.it.8333 > tom-Latitude-3570.34082: tcp 24
23:46:32.185863 IP host93-234-110-95.serverdedicati.aruba.it.8333 > tom-Latitude-3570.34082: tcp 451
23:46:32.185878 IP host93-234-110-95.serverdedicati.aruba.it.8333 > tom-Latitude-3570.34082: tcp 24
23:46:32.185880 IP host93-234-110-95.serverdedicati.aruba.it.8333 > tom-Latitude-3570.34082: tcp 247
23:46:32.185882 IP host93-234-110-95.serverdedicati.aruba.it.8333 > tom-Latitude-3570.34082: tcp 24
23:46:32.185884 IP host93-234-110-95.serverdedicati.aruba.it.8333 > tom-Latitude-3570.34082: tcp 284
23:46:32.185886 IP host93-234-110-95.serverdedicati.aruba.it.8333 > tom-Latitude-3570.34082: tcp 24
23:46:32.185888 IP host93-234-110-95.serverdedicati.aruba.it.8333 > tom-Latitude-3570.34082: tcp 283
23:46:32.185889 IP host93-234-110-95.serverdedicati.aruba.it.8333 > tom-Latitude-3570.34082: tcp 24
23:46:32.185908 IP host93-234-110-95.serverdedicati.aruba.it.8333 > tom-Latitude-3570.34082: tcp 284
23:46:32.185979 IP tom-Latitude-3570.34082 > host93-234-110-95.serverdedicati.aruba.it.8333: tcp 0
23:46:32.249524 IP host93-234-110-95.serverdedicati.aruba.it.8333 > tom-Latitude-3570.34082: tcp 1448
23:46:32.249543 IP host93-234-110-95.serverdedicati.aruba.it.8333 > tom-Latitude-3570.34082: tcp 396
23:46:32.249638 IP tom-Latitude-3570.34082 > host93-234-110-95.serverdedicati.aruba.it.8333: tcp 0
23:46:32.281713 IP 59.110.157.16.8333 > tom-Latitude-3570.47822: tcp 616
23:46:32.281738 IP tom-Latitude-3570.47822 > 59.110.157.16.8333: tcp 0
23:46:32.282142 IP tom-Latitude-3570.47822 > 59.110.157.16.8333: tcp 24
23:46:32.283176 IP tom-Latitude-3570.47822 > 59.110.157.16.8333: tcp 98
23:46:32.314477 IP 59.110.157.16.8333 > tom-Latitude-3570.47822: tcp 0
23:46:32.332373 IP 59.110.157.16.8333 > tom-Latitude-3570.47822: tcp 0
23:46:32.382594 IP tom-Latitude-3570.47822 > 59.110.157.16.8333: tcp 24
23:46:32.383501 IP tom-Latitude-3570.47822 > 59.110.157.16.8333: tcp 37
23:46:32.417014 IP 59.110.157.16.8333 > tom-Latitude-3570.47822: tcp 0
23:46:32.422033 IP 59.110.157.16.8333 > tom-Latitude-3570.47822: tcp 0
23:46:32.482974 IP tom-Latitude-3570.47822 > 59.110.157.16.8333: tcp 24
23:46:32.483937 IP tom-Latitude-3570.47822 > 59.110.157.16.8333: tcp 37
23:46:32.514938 IP 59.110.157.16.8333 > tom-Latitude-3570.47822: tcp 0
23:46:32.518063 IP 59.110.157.16.8333 > tom-Latitude-3570.47822: tcp 0
23:46:32.558682 IP 59.110.157.16.8333 > tom-Latitude-3570.47822: tcp 24
23:46:32.559284 IP 59.110.157.16.8333 > tom-Latitude-3570.47822: tcp 37
23:46:32.559301 IP 59.110.157.16.8333 > tom-Latitude-3570.47822: tcp 24
23:46:32.559415 IP tom-Latitude-3570.47822 > 59.110.157.16.8333: tcp 0
23:46:32.560108 IP tom-Latitude-3570.56244 > 172.214.77.34.bc.googleusercontent.com.8333: tcp 24
23:46:32.560128 IP tom-Latitude-3570.56244 > 172.214.77.34.bc.googleusercontent.com.8333: tcp 1261
23:46:32.591477 IP 172.214.77.34.bc.googleusercontent.com.8333 > tom-Latitude-3570.56244: tcp 0
23:46:32.624299 IP 172.214.77.34.bc.googleusercontent.com.8333 > tom-Latitude-3570.56244: tcp 0
23:46:32.660458 IP tom-Latitude-3570.47822 > 59.110.157.16.8333: tcp 24
23:46:32.661398 IP tom-Latitude-3570.47822 > 59.110.157.16.8333: tcp 397
23:46:32.694488 IP 59.110.157.16.8333 > tom-Latitude-3570.47822: tcp 0
23:46:32.708515 IP 59.110.157.16.8333 > tom-Latitude-3570.47822: tcp 0
23:46:32.784813 IP 59.110.157.16.8333 > tom-Latitude-3570.47822: tcp 406
23:46:32.785304 IP tom-Latitude-3570.47822 > 59.110.157.16.8333: tcp 24
23:46:32.787634 IP tom-Latitude-3570.47822 > 59.110.157.16.8333: tcp 37
23:46:32.820454 IP 59.110.157.16.8333 > tom-Latitude-3570.47822: tcp 0
23:46:32.824166 IP 59.110.157.16.8333 > tom-Latitude-3570.47822: tcp 0
23:46:32.885723 IP tom-Latitude-3570.33922 > pool-108-20-207-31.bstnma.fios.verizon.net.8333: tcp 24
23:46:32.885741 IP tom-Latitude-3570.33922 > pool-108-20-207-31.bstnma.fios.verizon.net.8333: tcp 1261
23:46:32.921201 IP pool-108-20-207-31.bstnma.fios.verizon.net.8333 > tom-Latitude-3570.33922: tcp 0
23:46:32.957373 IP pool-108-20-207-31.bstnma.fios.verizon.net.8333 > tom-Latitude-3570.33922: tcp 0
23:46:33.048631 IP 59.110.157.16.8333 > tom-Latitude-3570.47822: tcp 24
23:46:33.048648 IP 59.110.157.16.8333 > tom-Latitude-3570.47822: tcp 37
23:46:33.048745 IP tom-Latitude-3570.47822 > 59.110.157.16.8333: tcp 0
23:46:33.506375 IP host93-234-110-95.serverdedicati.aruba.it.8333 > tom-Latitude-3570.34082: tcp 24
23:46:33.506395 IP host93-234-110-95.serverdedicati.aruba.it.8333 > tom-Latitude-3570.34082: tcp 649
23:46:33.506399 IP host93-234-110-95.serverdedicati.aruba.it.8333 > tom-Latitude-3570.34082: tcp 649
23:46:33.506426 IP tom-Latitude-3570.34082 > host93-234-110-95.serverdedicati.aruba.it.8333: tcp 0
23:46:33.506824 IP tom-Latitude-3570.34082 > host93-234-110-95.serverdedicati.aruba.it.8333: tcp 24
23:46:33.507723 IP tom-Latitude-3570.34082 > host93-234-110-95.serverdedicati.aruba.it.8333: tcp 397
23:46:33.566625 IP host93-234-110-95.serverdedicati.aruba.it.8333 > tom-Latitude-3570.34082: tcp 0
23:46:33.576408 IP host93-234-110-95.serverdedicati.aruba.it.8333 > tom-Latitude-3570.34082: tcp 0
23:46:33.666218 IP host93-234-110-95.serverdedicati.aruba.it.8333 > tom-Latitude-3570.34082: tcp 24
23:46:33.666236 IP host93-234-110-95.serverdedicati.aruba.it.8333 > tom-Latitude-3570.34082: tcp 224
23:46:33.666241 IP host93-234-110-95.serverdedicati.aruba.it.8333 > tom-Latitude-3570.34082: tcp 24
23:46:33.666243 IP host93-234-110-95.serverdedicati.aruba.it.8333 > tom-Latitude-3570.34082: tcp 247
23:46:33.666334 IP tom-Latitude-3570.34082 > host93-234-110-95.serverdedicati.aruba.it.8333: tcp 0
23:46:33.666488 IP tom-Latitude-3570.47742 > 97-82-78-25.dhcp.leds.al.charter.com.8333: tcp 24
23:46:33.666858 IP tom-Latitude-3570.47822 > 59.110.157.16.8333: tcp 24
23:46:33.680708 IP tom-Latitude-3570.47822 > 59.110.157.16.8333: tcp 253
23:46:33.680719 IP tom-Latitude-3570.47742 > 97-82-78-25.dhcp.leds.al.charter.com.8333: tcp 109
23:46:33.681447 IP host93-234-110-95.serverdedicati.aruba.it.8333 > tom-Latitude-3570.34082: tcp 24
23:46:33.681465 IP host93-234-110-95.serverdedicati.aruba.it.8333 > tom-Latitude-3570.34082: tcp 190
23:46:33.681469 IP host93-234-110-95.serverdedicati.aruba.it.8333 > tom-Latitude-3570.34082: tcp 24
23:46:33.681470 IP host93-234-110-95.serverdedicati.aruba.it.8333 > tom-Latitude-3570.34082: tcp 283
23:46:33.681472 IP host93-234-110-95.serverdedicati.aruba.it.8333 > tom-Latitude-3570.34082: tcp 24
23:46:33.681493 IP host93-234-110-95.serverdedicati.aruba.it.8333 > tom-Latitude-3570.34082: tcp 284
23:46:33.681563 IP tom-Latitude-3570.34082 > host93-234-110-95.serverdedicati.aruba.it.8333: tcp 0
23:46:33.720395 IP 59.110.157.16.8333 > tom-Latitude-3570.47822: tcp 0
23:46:33.721028 IP 59.110.157.16.8333 > tom-Latitude-3570.47822: tcp 0
23:46:33.724001 IP 97-82-78-25.dhcp.leds.al.charter.com.8333 > tom-Latitude-3570.47742: tcp 0
23:46:33.753582 IP host93-234-110-95.serverdedicati.aruba.it.8333 > tom-Latitude-3570.34082: tcp 1448
23:46:33.753602 IP host93-234-110-95.serverdedicati.aruba.it.8333 > tom-Latitude-3570.34082: tcp 399
23:46:33.753695 IP tom-Latitude-3570.34082 > host93-234-110-95.serverdedicati.aruba.it.8333: tcp 0
23:46:33.753794 IP tom-Latitude-3570.56244 > 172.214.77.34.bc.googleusercontent.com.8333: tcp 24
23:46:33.754472 IP tom-Latitude-3570.56244 > 172.214.77.34.bc.googleusercontent.com.8333: tcp 37
23:46:33.786346 IP 172.214.77.34.bc.googleusercontent.com.8333 > tom-Latitude-3570.56244: tcp 0
23:46:33.790024 IP 172.214.77.34.bc.googleusercontent.com.8333 > tom-Latitude-3570.56244: tcp 0
23:46:33.851009 IP 172.214.77.34.bc.googleusercontent.com.8333 > tom-Latitude-3570.56244: tcp 24
23:46:33.851027 IP 172.214.77.34.bc.googleusercontent.com.8333 > tom-Latitude-3570.56244: tcp 37
23:46:33.851144 IP tom-Latitude-3570.56244 > 172.214.77.34.bc.googleusercontent.com.8333: tcp 0
23:46:33.888963 IP 97-82-78-25.dhcp.leds.al.charter.com.8333 > tom-Latitude-3570.47742: tcp 24
23:46:33.890822 IP 97-82-78-25.dhcp.leds.al.charter.com.8333 > tom-Latitude-3570.47742: tcp 283
23:46:33.890837 IP 97-82-78-25.dhcp.leds.al.charter.com.8333 > tom-Latitude-3570.47742: tcp 24
23:46:33.890839 IP 97-82-78-25.dhcp.leds.al.charter.com.8333 > tom-Latitude-3570.47742: tcp 283
23:46:33.890841 IP 97-82-78-25.dhcp.leds.al.charter.com.8333 > tom-Latitude-3570.47742: tcp 24
23:46:33.890844 IP 97-82-78-25.dhcp.leds.al.charter.com.8333 > tom-Latitude-3570.47742: tcp 283
23:46:33.890942 IP tom-Latitude-3570.47742 > 97-82-78-25.dhcp.leds.al.charter.com.8333: tcp 0
23:46:33.891382 IP tom-Latitude-3570.47742 > 97-82-78-25.dhcp.leds.al.charter.com.8333: tcp 24
23:46:33.892465 IP tom-Latitude-3570.47742 > 97-82-78-25.dhcp.leds.al.charter.com.8333: tcp 37
23:46:33.940335 IP 97-82-78-25.dhcp.leds.al.charter.com.8333 > tom-Latitude-3570.47742: tcp 0
23:46:33.951468 IP 59.110.157.16.8333 > tom-Latitude-3570.47822: tcp 24
23:46:33.951488 IP 59.110.157.16.8333 > tom-Latitude-3570.47822: tcp 284
23:46:33.951492 IP 59.110.157.16.8333 > tom-Latitude-3570.47822: tcp 24
23:46:33.951587 IP tom-Latitude-3570.47822 > 59.110.157.16.8333: tcp 0
23:46:33.951690 IP tom-Latitude-3570.34082 > host93-234-110-95.serverdedicati.aruba.it.8333: tcp 24
23:46:33.952655 IP tom-Latitude-3570.34082 > host93-234-110-95.serverdedicati.aruba.it.8333: tcp 8
23:46:33.985152 IP host93-234-110-95.serverdedicati.aruba.it.8333 > tom-Latitude-3570.34082: tcp 0
