03:07:30.703330 IP static-87-75-105-186.vodafonexdsl.co.uk.8333 > tom-Latitude-3570.46284: tcp 0
03:07:30.703366 IP static-87-75-105-186.vodafonexdsl.co.uk.8333 > tom-Latitude-3570.46284: tcp 0
03:07:30.707599 IP c-185-45-236-223.customer.ggaweb.ch.8333 > tom-Latitude-3570.49070: tcp 24
03:07:30.708321 IP c-185-45-236-223.customer.ggaweb.ch.8333 > tom-Latitude-3570.49070: tcp 469
03:07:30.708437 IP tom-Latitude-3570.49070 > c-185-45-236-223.customer.ggaweb.ch.8333: tcp 0
03:07:30.738933 IP static-87-75-105-186.vodafonexdsl.co.uk.8333 > tom-Latitude-3570.46284: tcp 24
03:07:30.739630 IP static-87-75-105-186.vodafonexdsl.co.uk.8333 > tom-Latitude-3570.46284: tcp 191
03:07:30.739648 IP static-87-75-105-186.vodafonexdsl.co.uk.8333 > tom-Latitude-3570.46284: tcp 24
03:07:30.739650 IP static-87-75-105-186.vodafonexdsl.co.uk.8333 > tom-Latitude-3570.46284: tcp 192
03:07:30.739653 IP static-87-75-105-186.vodafonexdsl.co.uk.8333 > tom-Latitude-3570.46284: tcp 24
03:07:30.739654 IP static-87-75-105-186.vodafonexdsl.co.uk.8333 > tom-Latitude-3570.46284: tcp 226
03:07:30.739748 IP tom-Latitude-3570.46284 > static-87-75-105-186.vodafonexdsl.co.uk.8333: tcp 0
03:07:30.941177 IP tom-Latitude-3570.56714 > ns3113832.ip-54-38-177.eu.8333: tcp 24
03:07:30.943210 IP tom-Latitude-3570.56714 > ns3113832.ip-54-38-177.eu.8333: tcp 181
03:07:30.974925 IP ns3113832.ip-54-38-177.eu.8333 > tom-Latitude-3570.56714: tcp 0
03:07:30.982974 IP ns3113832.ip-54-38-177.eu.8333 > tom-Latitude-3570.56714: tcp 0
03:07:31.442846 IP tom-Latitude-3570.39110 > vmi195435.contaboserver.net.8333: tcp 24
03:07:31.442913 IP tom-Latitude-3570.42516 > 2.56.9.15.8333: tcp 24
03:07:31.445113 IP tom-Latitude-3570.42516 > 2.56.9.15.8333: tcp 181
03:07:31.445124 IP tom-Latitude-3570.39110 > vmi195435.contaboserver.net.8333: tcp 181
03:07:31.494715 IP 2.56.9.15.8333 > tom-Latitude-3570.42516: tcp 0
03:07:31.504157 IP vmi195435.contaboserver.net.8333 > tom-Latitude-3570.39110: tcp 0
03:07:31.504172 IP 2.56.9.15.8333 > tom-Latitude-3570.42516: tcp 0
03:07:31.504175 IP vmi195435.contaboserver.net.8333 > tom-Latitude-3570.39110: tcp 0
03:07:31.543356 IP tom-Latitude-3570.57976 > 167.99.216.145.8333: tcp 24
03:07:31.544293 IP tom-Latitude-3570.57976 > 167.99.216.145.8333: tcp 469
03:07:31.545755 IP bb42-60-217-183.singnet.com.sg.8333 > tom-Latitude-3570.60470: tcp 24
03:07:31.545774 IP bb42-60-217-183.singnet.com.sg.8333 > tom-Latitude-3570.60470: tcp 109
03:07:31.545869 IP tom-Latitude-3570.60470 > bb42-60-217-183.singnet.com.sg.8333: tcp 0
03:07:31.583368 IP 167.99.216.145.8333 > tom-Latitude-3570.57976: tcp 0
03:07:31.584055 IP 167.99.216.145.8333 > tom-Latitude-3570.57976: tcp 0
03:07:32.549346 IP tom-Latitude-3570.60988 > 81.198.101.144.8333: tcp 24
03:07:32.551523 IP tom-Latitude-3570.60988 > 81.198.101.144.8333: tcp 469
03:07:32.605787 IP 81.198.101.144.8333 > tom-Latitude-3570.60988: tcp 0
03:07:32.614434 IP 81.198.101.144.8333 > tom-Latitude-3570.60988: tcp 0
03:07:33.380679 IP c-185-45-236-223.customer.ggaweb.ch.8333 > tom-Latitude-3570.49070: tcp 24
03:07:33.380699 IP c-185-45-236-223.customer.ggaweb.ch.8333 > tom-Latitude-3570.49070: tcp 109
03:07:33.380703 IP 81.198.101.144.8333 > tom-Latitude-3570.60988: tcp 24
03:07:33.380706 IP 81.198.101.144.8333 > tom-Latitude-3570.60988: tcp 73
03:07:33.380790 IP tom-Latitude-3570.49070 > c-185-45-236-223.customer.ggaweb.ch.8333: tcp 0
03:07:33.380822 IP tom-Latitude-3570.60988 > 81.198.101.144.8333: tcp 0
03:07:33.380951 IP tom-Latitude-3570.49070 > c-185-45-236-223.customer.ggaweb.ch.8333: tcp 24
03:07:33.382376 IP tom-Latitude-3570.49070 > c-185-45-236-223.customer.ggaweb.ch.8333: tcp 109
03:07:33.413498 IP c-185-45-236-223.customer.ggaweb.ch.8333 > tom-Latitude-3570.49070: tcp 0
03:07:33.414110 IP c-185-45-236-223.customer.ggaweb.ch.8333 > tom-Latitude-3570.49070: tcp 0
03:07:33.507510 IP c-185-45-236-223.customer.ggaweb.ch.8333 > tom-Latitude-3570.49070: tcp 24
03:07:33.508224 IP c-185-45-236-223.customer.ggaweb.ch.8333 > tom-Latitude-3570.49070: tcp 781
03:07:33.508353 IP tom-Latitude-3570.49070 > c-185-45-236-223.customer.ggaweb.ch.8333: tcp 0
03:07:33.711874 IP tom-Latitude-3570.56714 > ns3113832.ip-54-38-177.eu.8333: tcp 24
03:07:33.713990 IP tom-Latitude-3570.56714 > ns3113832.ip-54-38-177.eu.8333: tcp 109
03:07:33.714527 IP 167.99.216.145.8333 > tom-Latitude-3570.57976: tcp 24
03:07:33.714547 IP 167.99.216.145.8333 > tom-Latitude-3570.57976: tcp 145
03:07:33.714663 IP tom-Latitude-3570.57976 > 167.99.216.145.8333: tcp 0
03:07:33.714810 IP tom-Latitude-3570.57976 > 167.99.216.145.8333: tcp 24
03:07:33.716099 IP tom-Latitude-3570.57976 > 167.99.216.145.8333: tcp 37
03:07:33.753648 IP ns3113832.ip-54-38-177.eu.8333 > tom-Latitude-3570.56714: tcp 0
03:07:33.754340 IP ns3113832.ip-54-38-177.eu.8333 > tom-Latitude-3570.56714: tcp 0
03:07:33.754354 IP 167.99.216.145.8333 > tom-Latitude-3570.57976: tcp 0
03:07:33.754359 IP 167.99.216.145.8333 > tom-Latitude-3570.57976: tcp 0
03:07:33.815178 IP 167.99.216.145.8333 > tom-Latitude-3570.57976: tcp 24
03:07:33.815715 IP 167.99.216.145.8333 > tom-Latitude-3570.57976: tcp 257
03:07:33.815846 IP tom-Latitude-3570.57976 > 167.99.216.145.8333: tcp 0
03:07:33.866247 IP static-87-75-105-186.vodafonexdsl.co.uk.8333 > tom-Latitude-3570.46284: tcp 24
03:07:33.870250 IP static-87-75-105-186.vodafonexdsl.co.uk.8333 > tom-Latitude-3570.46284: tcp 109
03:07:33.870381 IP tom-Latitude-3570.46284 > static-87-75-105-186.vodafonexdsl.co.uk.8333: tcp 0
03:07:33.901554 IP vmi195435.contaboserver.net.8333 > tom-Latitude-3570.39110: tcp 24
03:07:33.901579 IP tom-Latitude-3570.39110 > vmi195435.contaboserver.net.8333: tcp 0
03:07:33.902185 IP vmi195435.contaboserver.net.8333 > tom-Latitude-3570.39110: tcp 181
03:07:33.902209 IP tom-Latitude-3570.39110 > vmi195435.contaboserver.net.8333: tcp 0
03:07:33.902431 IP tom-Latitude-3570.39110 > vmi195435.contaboserver.net.8333: tcp 24
03:07:33.903457 IP tom-Latitude-3570.39110 > vmi195435.contaboserver.net.8333: tcp 37
03:07:33.943514 IP vmi195435.contaboserver.net.8333 > tom-Latitude-3570.39110: tcp 0
03:07:33.945779 IP vmi195435.contaboserver.net.8333 > tom-Latitude-3570.39110: tcp 0
03:07:34.034983 IP vmi195435.contaboserver.net.8333 > tom-Latitude-3570.39110: tcp 24
03:07:34.035001 IP vmi195435.contaboserver.net.8333 > tom-Latitude-3570.39110: tcp 190
03:07:34.035107 IP tom-Latitude-3570.39110 > vmi195435.contaboserver.net.8333: tcp 0
03:07:34.236172 IP tom-Latitude-3570.56714 > ns3113832.ip-54-38-177.eu.8333: tcp 24
03:07:34.238312 IP tom-Latitude-3570.56714 > ns3113832.ip-54-38-177.eu.8333: tcp 73
03:07:34.275480 IP ns3113832.ip-54-38-177.eu.8333 > tom-Latitude-3570.56714: tcp 0
03:07:34.283028 IP ns3113832.ip-54-38-177.eu.8333 > tom-Latitude-3570.56714: tcp 0
03:07:34.536812 IP tom-Latitude-3570.57976 > 167.99.216.145.8333: tcp 24
03:07:34.544790 IP tom-Latitude-3570.57976 > 167.99.216.145.8333: tcp 37
03:07:34.594057 IP 167.99.216.145.8333 > tom-Latitude-3570.57976: tcp 0
03:07:34.603426 IP 167.99.216.145.8333 > tom-Latitude-3570.57976: tcp 0
03:07:34.637285 IP tom-Latitude-3570.46284 > static-87-75-105-186.vodafonexdsl.co.uk.8333: tcp 24
03:07:34.638097 IP tom-Latitude-3570.46284 > static-87-75-105-186.vodafonexdsl.co.uk.8333: tcp 73
03:07:34.665390 IP static-87-75-105-186.vodafonexdsl.co.uk.8333 > tom-Latitude-3570.46284: tcp 0
03:07:34.673777 IP static-87-75-105-186.vodafonexdsl.co.uk.8333 > tom-Latitude-3570.46284: tcp 0
03:07:34.938341 IP tom-Latitude-3570.60470 > bb42-60-217-183.singnet.com.sg.8333: tcp 24
03:07:34.941128 IP tom-Latitude-3570.60470 > bb42-60-217-183.singnet.com.sg.8333: tcp 181
03:07:34.987669 IP bb42-60-217-183.singnet.com.sg.8333 > tom-Latitude-3570.60470: tcp 0
03:07:34.987689 IP bb42-60-217-183.singnet.com.sg.8333 > tom-Latitude-3570.60470: tcp 0
03:07:35.053133 IP 167.99.216.145.8333 > tom-Latitude-3570.57976: tcp 24
03:07:35.053792 IP 167.99.216.145.8333 > tom-Latitude-3570.57976: tcp 145
03:07:35.053902 IP tom-Latitude-3570.57976 > 167.99.216.145.8333: tcp 0
03:07:35.054108 IP tom-Latitude-3570.57976 > 167.99.216.145.8333: tcp 24
03:07:35.055712 IP tom-Latitude-3570.57976 > 167.99.216.145.8333: tcp 145
03:07:35.064126 IP vmi195435.contaboserver.net.8333 > tom-Latitude-3570.39110: tcp 24
03:07:35.064855 IP vmi195435.contaboserver.net.8333 > tom-Latitude-3570.39110: tcp 181
03:07:35.064979 IP tom-Latitude-3570.39110 > vmi195435.contaboserver.net.8333: tcp 0
03:07:35.065147 IP tom-Latitude-3570.39110 > vmi195435.contaboserver.net.8333: tcp 24
03:07:35.067782 IP tom-Latitude-3570.39110 > vmi195435.contaboserver.net.8333: tcp 37
03:07:35.083131 IP 167.99.216.145.8333 > tom-Latitude-3570.57976: tcp 0
03:07:35.083817 IP 167.99.216.145.8333 > tom-Latitude-3570.57976: tcp 0
03:07:35.103088 IP vmi195435.contaboserver.net.8333 > tom-Latitude-3570.39110: tcp 0
03:07:35.103669 IP vmi195435.contaboserver.net.8333 > tom-Latitude-3570.39110: tcp 0
03:07:35.146703 IP 167.99.216.145.8333 > tom-Latitude-3570.57976: tcp 24
03:07:35.146712 IP 167.99.216.145.8333 > tom-Latitude-3570.57976: tcp 246
03:07:35.146714 IP 167.99.216.145.8333 > tom-Latitude-3570.57976: tcp 24
03:07:35.146716 IP 167.99.216.145.8333 > tom-Latitude-3570.57976: tcp 405
03:07:35.146718 IP 167.99.216.145.8333 > tom-Latitude-3570.57976: tcp 24
03:07:35.146719 IP 167.99.216.145.8333 > tom-Latitude-3570.57976: tcp 190
03:07:35.146720 IP 167.99.216.145.8333 > tom-Latitude-3570.57976: tcp 24
03:07:35.146721 IP 167.99.216.145.8333 > tom-Latitude-3570.57976: tcp 221
03:07:35.146728 IP tom-Latitude-3570.57976 > 167.99.216.145.8333: tcp 0
03:07:35.146783 IP tom-Latitude-3570.57976 > 167.99.216.145.8333: tcp 0
03:07:35.182458 IP vmi195435.contaboserver.net.8333 > tom-Latitude-3570.39110: tcp 24
03:07:35.190463 IP vmi195435.contaboserver.net.8333 > tom-Latitude-3570.39110: tcp 193
03:07:35.190586 IP tom-Latitude-3570.39110 > vmi195435.contaboserver.net.8333: tcp 0
03:07:35.692538 IP tom-Latitude-3570.49070 > c-185-45-236-223.customer.ggaweb.ch.8333: tcp 24
03:07:35.694615 IP tom-Latitude-3570.49070 > c-185-45-236-223.customer.ggaweb.ch.8333: tcp 253
03:07:35.743706 IP c-185-45-236-223.customer.ggaweb.ch.8333 > tom-Latitude-3570.49070: tcp 0
03:07:35.755414 IP c-185-45-236-223.customer.ggaweb.ch.8333 > tom-Latitude-3570.49070: tcp 0
03:07:36.294576 IP tom-Latitude-3570.46284 > static-87-75-105-186.vodafonexdsl.co.uk.8333: tcp 24
03:07:36.296622 IP tom-Latitude-3570.46284 > static-87-75-105-186.vodafonexdsl.co.uk.8333: tcp 181
03:07:36.344326 IP static-87-75-105-186.vodafonexdsl.co.uk.8333 > tom-Latitude-3570.46284: tcp 0
03:07:36.352280 IP static-87-75-105-186.vodafonexdsl.co.uk.8333 > tom-Latitude-3570.46284: tcp 0
03:07:36.495322 IP tom-Latitude-3570.60470 > bb42-60-217-183.singnet.com.sg.8333: tcp 24
03:07:36.497556 IP tom-Latitude-3570.60470 > bb42-60-217-183.singnet.com.sg.8333: tcp 181
03:07:36.498111 IP 167.99.216.145.8333 > tom-Latitude-3570.57976: tcp 24
03:07:36.498130 IP 167.99.216.145.8333 > tom-Latitude-3570.57976: tcp 8
03:07:36.498240 IP tom-Latitude-3570.57976 > 167.99.216.145.8333: tcp 0
03:07:36.498327 IP tom-Latitude-3570.57976 > 167.99.216.145.8333: tcp 24
03:07:36.499487 IP tom-Latitude-3570.57976 > 167.99.216.145.8333: tcp 8
03:07:36.512304 IP bb42-60-217-183.singnet.com.sg.8333 > tom-Latitude-3570.60470: tcp 24
03:07:36.512898 IP bb42-60-217-183.singnet.com.sg.8333 > tom-Latitude-3570.60470: tcp 253
03:07:36.513027 IP tom-Latitude-3570.60470 > bb42-60-217-183.singnet.com.sg.8333: tcp 0
03:07:36.513206 IP tom-Latitude-3570.60470 > bb42-60-217-183.singnet.com.sg.8333: tcp 24
03:07:36.513219 IP tom-Latitude-3570.60470 > bb42-60-217-183.singnet.com.sg.8333: tcp 73
03:07:36.532065 IP bb42-60-217-183.singnet.com.sg.8333 > tom-Latitude-3570.60470: tcp 0
03:07:36.532688 IP bb42-60-217-183.singnet.com.sg.8333 > tom-Latitude-3570.60470: tcp 0
03:07:36.532713 IP 167.99.216.145.8333 > tom-Latitude-3570.57976: tcp 0
03:07:36.532716 IP 167.99.216.145.8333 > tom-Latitude-3570.57976: tcp 0
03:07:36.539900 IP bb42-60-217-183.singnet.com.sg.8333 > tom-Latitude-3570.60470: tcp 0
03:07:36.540629 IP bb42-60-217-183.singnet.com.sg.8333 > tom-Latitude-3570.60470: tcp 0
03:07:36.862171 IP static-87-75-105-186.vodafonexdsl.co.uk.8333 > tom-Latitude-3570.46284: tcp 24
03:07:36.862177 IP static-87-75-105-186.vodafonexdsl.co.uk.8333 > tom-Latitude-3570.46284: tcp 73
03:07:36.862232 IP tom-Latitude-3570.46284 > static-87-75-105-186.vodafonexdsl.co.uk.8333: tcp 0
03:07:36.918278 IP bb42-60-217-183.singnet.com.sg.8333 > tom-Latitude-3570.60470: tcp 24
03:07:36.919006 IP bb42-60-217-183.singnet.com.sg.8333 > tom-Latitude-3570.60470: tcp 226
03:07:36.919024 IP bb42-60-217-183.singnet.com.sg.8333 > tom-Latitude-3570.60470: tcp 24
03:07:36.919026 IP bb42-60-217-183.singnet.com.sg.8333 > tom-Latitude-3570.60470: tcp 223
03:07:36.919116 IP tom-Latitude-3570.60470 > bb42-60-217-183.singnet.com.sg.8333: tcp 0
03:07:36.990166 IP vmi195435.contaboserver.net.8333 > tom-Latitude-3570.39110: tcp 24
03:07:36.990842 IP vmi195435.contaboserver.net.8333 > tom-Latitude-3570.39110: tcp 109
03:07:36.990950 IP tom-Latitude-3570.39110 > vmi195435.contaboserver.net.8333: tcp 0
03:07:36.991106 IP tom-Latitude-3570.39110 > vmi195435.contaboserver.net.8333: tcp 24
03:07:36.992505 IP tom-Latitude-3570.39110 > vmi195435.contaboserver.net.8333: tcp 37
03:07:37.022563 IP vmi195435.contaboserver.net.8333 > tom-Latitude-3570.39110: tcp 0
03:07:37.022577 IP vmi195435.contaboserver.net.8333 > tom-Latitude-3570.39110: tcp 0
03:07:37.091587 IP tom-Latitude-3570.42516 > 2.56.9.15.8333: tcp 24
03:07:37.103035 IP vmi195435.contaboserver.net.8333 > tom-Latitude-3570.39110: tcp 24
03:07:37.103054 IP vmi195435.contaboserver.net.8333 > tom-Latitude-3570.39110: tcp 249
03:07:37.103141 IP tom-Latitude-3570.39110 > vmi195435.contaboserver.net.8333: tcp 0
03:07:37.103560 IP tom-Latitude-3570.42516 > 2.56.9.15.8333: tcp 433
03:07:37.133142 IP 2.56.9.15.8333 > tom-Latitude-3570.42516: tcp 0
03:07:37.133695 IP 2.56.9.15.8333 > tom-Latitude-3570.42516: tcp 0
03:07:37.203851 IP tom-Latitude-3570.42516 > 2.56.9.15.8333: tcp 24
03:07:37.204793 IP tom-Latitude-3570.42516 > 2.56.9.15.8333: tcp 37
03:07:37.238730 IP 2.56.9.15.8333 > tom-Latitude-3570.42516: tcp 0
03:07:37.241209 IP 2.56.9.15.8333 > tom-Latitude-3570.42516: tcp 0
03:07:37.504950 IP tom-Latitude-3570.56714 > ns3113832.ip-54-38-177.eu.8333: tcp 24
03:07:37.506991 IP tom-Latitude-3570.56714 > ns3113832.ip-54-38-177.eu.8333: tcp 289
03:07:37.507549 IP 81.198.101.144.8333 > tom-Latitude-3570.60988: tcp 24
03:07:37.507568 IP 81.198.101.144.8333 > tom-Latitude-3570.60988: tcp 361
03:07:37.507658 IP tom-Latitude-3570.60988 > 81.198.101.144.8333: tcp 0
03:07:37.543170 IP ns3113832.ip-54-38-177.eu.8333 > tom-Latitude-3570.56714: tcp 0
03:07:37.543795 IP ns3113832.ip-54-38-177.eu.8333 > tom-Latitude-3570.56714: tcp 0
03:07:37.808891 IP tom-Latitude-3570.57976 > 167.99.216.145.8333: tcp 24
03:07:37.811149 IP tom-Latitude-3570.57976 > 167.99.216.145.8333: tcp 145
03:07:37.843361 IP 167.99.216.145.8333 > tom-Latitude-3570.57976: tcp 0
03:07:37.853192 IP 167.99.216.145.8333 > tom-Latitude-3570.57976: tcp 0
03:07:38.296040 IP 2.56.9.15.8333 > tom-Latitude-3570.42516: tcp 24
03:07:38.296060 IP 2.56.9.15.8333 > tom-Latitude-3570.42516: tcp 109
03:07:38.296063 IP 2.56.9.15.8333 > tom-Latitude-3570.42516: tcp 109
03:07:38.296091 IP tom-Latitude-3570.42516 > 2.56.9.15.8333: tcp 0
03:07:38.296318 IP tom-Latitude-3570.42516 > 2.56.9.15.8333: tcp 24
03:07:38.297550 IP tom-Latitude-3570.42516 > 2.56.9.15.8333: tcp 109
03:07:38.298143 IP static-87-75-105-186.vodafonexdsl.co.uk.8333 > tom-Latitude-3570.46284: tcp 24
03:07:38.299372 IP static-87-75-105-186.vodafonexdsl.co.uk.8333 > tom-Latitude-3570.46284: tcp 181
03:07:38.299490 IP tom-Latitude-3570.46284 > static-87-75-105-186.vodafonexdsl.co.uk.8333: tcp 0
03:07:38.299653 IP tom-Latitude-3570.46284 > static-87-75-105-186.vodafonexdsl.co.uk.8333: tcp 24
03:07:38.300958 IP tom-Latitude-3570.46284 > static-87-75-105-186.vodafonexdsl.co.uk.8333: tcp 37
03:07:38.383121 IP 2.56.9.15.8333 > tom-Latitude-3570.42516: tcp 0
03:07:38.383135 IP 2.56.9.15.8333 > tom-Latitude-3570.42516: tcp 0
03:07:38.383138 IP static-87-75-105-186.vodafonexdsl.co.uk.8333 > tom-Latitude-3570.46284: tcp 0
03:07:38.383140 IP static-87-75-105-186.vodafonexdsl.co.uk.8333 > tom-Latitude-3570.46284: tcp 0
03:07:38.398237 IP static-87-75-105-186.vodafonexdsl.co.uk.8333 > tom-Latitude-3570.46284: tcp 24
03:07:38.398853 IP static-87-75-105-186.vodafonexdsl.co.uk.8333 > tom-Latitude-3570.46284: tcp 372
03:07:38.398984 IP tom-Latitude-3570.46284 > static-87-75-105-186.vodafonexdsl.co.uk.8333: tcp 0
03:07:38.430029 IP 2.56.9.15.8333 > tom-Latitude-3570.42516: tcp 24
03:07:38.430782 IP 2.56.9.15.8333 > tom-Latitude-3570.42516: tcp 256
03:07:38.430800 IP 2.56.9.15.8333 > tom-Latitude-3570.42516: tcp 24
03:07:38.430803 IP 2.56.9.15.8333 > tom-Latitude-3570.42516: tcp 258
03:07:38.430805 IP 2.56.9.15.8333 > tom-Latitude-3570.42516: tcp 24
03:07:38.430807 IP 2.56.9.15.8333 > tom-Latitude-3570.42516: tcp 224
03:07:38.430893 IP tom-Latitude-3570.42516 > 2.56.9.15.8333: tcp 0
03:07:38.833167 IP tom-Latitude-3570.39110 > vmi195435.contaboserver.net.8333: tcp 24
03:07:38.835267 IP tom-Latitude-3570.39110 > vmi195435.contaboserver.net.8333: tcp 145
03:07:38.864144 IP vmi195435.contaboserver.net.8333 > tom-Latitude-3570.39110: tcp 0
03:07:38.873753 IP vmi195435.contaboserver.net.8333 > tom-Latitude-3570.39110: tcp 0
03:07:39.115244 IP vmi195435.contaboserver.net.8333 > tom-Latitude-3570.39110: tcp 24
03:07:39.115263 IP vmi195435.contaboserver.net.8333 > tom-Latitude-3570.39110: tcp 73
03:07:39.115350 IP tom-Latitude-3570.39110 > vmi195435.contaboserver.net.8333: tcp 0
03:07:39.115474 IP tom-Latitude-3570.39110 > vmi195435.contaboserver.net.8333: tcp 24
03:07:39.116903 IP tom-Latitude-3570.39110 > vmi195435.contaboserver.net.8333: tcp 73
03:07:39.153844 IP vmi195435.contaboserver.net.8333 > tom-Latitude-3570.39110: tcp 0
03:07:39.154433 IP vmi195435.contaboserver.net.8333 > tom-Latitude-3570.39110: tcp 0
03:07:39.231960 IP vmi195435.contaboserver.net.8333 > tom-Latitude-3570.39110: tcp 24
03:07:39.232728 IP vmi195435.contaboserver.net.8333 > tom-Latitude-3570.39110: tcp 788
03:07:39.232747 IP vmi195435.contaboserver.net.8333 > tom-Latitude-3570.39110: tcp 24
03:07:39.232749 IP vmi195435.contaboserver.net.8333 > tom-Latitude-3570.39110: tcp 195
03:07:39.232833 IP tom-Latitude-3570.39110 > vmi195435.contaboserver.net.8333: tcp 0
03:07:39.436828 IP tom-Latitude-3570.57976 > 167.99.216.145.8333: tcp 24
03:07:39.438958 IP tom-Latitude-3570.57976 > 167.99.216.145.8333: tcp 217
03:07:39.475802 IP 167.99.216.145.8333 > tom-Latitude-3570.57976: tcp 0
03:07:39.482984 IP 167.99.216.145.8333 > tom-Latitude-3570.57976: tcp 0
03:07:39.637555 IP tom-Latitude-3570.56714 > ns3113832.ip-54-38-177.eu.8333: tcp 24
03:07:39.666610 IP tom-Latitude-3570.56714 > ns3113832.ip-54-38-177.eu.8333: tcp 217
03:07:39.696404 IP ns3113832.ip-54-38-177.eu.8333 > tom-Latitude-3570.56714: tcp 0
03:07:39.705867 IP ns3113832.ip-54-38-177.eu.8333 > tom-Latitude-3570.56714: tcp 0
03:07:39.838305 IP tom-Latitude-3570.60470 > bb42-60-217-183.singnet.com.sg.8333: tcp 24
03:07:39.840341 IP tom-Latitude-3570.60470 > bb42-60-217-183.singnet.com.sg.8333: tcp 253
03:07:39.875815 IP bb42-60-217-183.singnet.com.sg.8333 > tom-Latitude-3570.60470: tcp 0
03:07:39.882608 IP bb42-60-217-183.singnet.com.sg.8333 > tom-Latitude-3570.60470: tcp 0
03:07:40.753722 IP ns3113832.ip-54-38-177.eu.8333 > tom-Latitude-3570.56714: tcp 24
03:07:40.753740 IP ns3113832.ip-54-38-177.eu.8333 > tom-Latitude-3570.56714: tcp 73
03:07:40.753742 IP ns3113832.ip-54-38-177.eu.8333 > tom-Latitude-3570.56714: tcp 73
03:07:40.753769 IP tom-Latitude-3570.56714 > ns3113832.ip-54-38-177.eu.8333: tcp 0
03:07:40.753948 IP tom-Latitude-3570.56714 > ns3113832.ip-54-38-177.eu.8333: tcp 24
03:07:40.755321 IP tom-Latitude-3570.56714 > ns3113832.ip-54-38-177.eu.8333: tcp 73
03:07:40.793715 IP ns3113832.ip-54-38-177.eu.8333 > tom-Latitude-3570.56714: tcp 0
03:07:40.794264 IP ns3113832.ip-54-38-177.eu.8333 > tom-Latitude-3570.56714: tcp 0
03:07:40.851731 IP ns3113832.ip-54-38-177.eu.8333 > tom-Latitude-3570.56714: tcp 24
03:07:40.854291 IP ns3113832.ip-54-38-177.eu.8333 > tom-Latitude-3570.56714: tcp 226
03:07:40.854316 IP ns3113832.ip-54-38-177.eu.8333 > tom-Latitude-3570.56714: tcp 24
03:07:40.854319 IP ns3113832.ip-54-38-177.eu.8333 > tom-Latitude-3570.56714: tcp 256
03:07:40.854365 IP tom-Latitude-3570.56714 > ns3113832.ip-54-38-177.eu.8333: tcp 0
03:07:41.163353 IP 167.99.216.145.8333 > tom-Latitude-3570.57976: tcp 24
03:07:41.163373 IP 167.99.216.145.8333 > tom-Latitude-3570.57976: tcp 145
03:07:41.163376 IP 167.99.216.145.8333 > tom-Latitude-3570.57976: tcp 145
03:07:41.163403 IP tom-Latitude-3570.57976 > 167.99.216.145.8333: tcp 0
03:07:41.163596 IP tom-Latitude-3570.57976 > 167.99.216.145.8333: tcp 24
03:07:41.164861 IP tom-Latitude-3570.57976 > 167.99.216.145.8333: tcp 73
03:07:41.203641 IP 167.99.216.145.8333 > tom-Latitude-3570.57976: tcp 0
03:07:41.211645 IP 167.99.216.145.8333 > tom-Latitude-3570.57976: tcp 0
03:07:41.263173 IP bb42-60-217-183.singnet.com.sg.8333 > tom-Latitude-3570.60470: tcp 24
03:07:41.263191 IP bb42-60-217-183.singnet.com.sg.8333 > tom-Latitude-3570.60470: tcp 61
03:07:41.263283 IP tom-Latitude-3570.60470 > bb42-60-217-183.singnet.com.sg.8333: tcp 0
03:07:41.263474 IP tom-Latitude-3570.46284 > static-87-75-105-186.vodafonexdsl.co.uk.8333: tcp 24
03:07:41.264902 IP tom-Latitude-3570.46284 > static-87-75-105-186.vodafonexdsl.co.uk.8333: tcp 145
03:07:41.265552 IP 167.99.216.145.8333 > tom-Latitude-3570.57976: tcp 24
03:07:41.266793 IP 167.99.216.145.8333 > tom-Latitude-3570.57976: tcp 222
03:07:41.266906 IP tom-Latitude-3570.57976 > 167.99.216.145.8333: tcp 0
03:07:41.274637 IP 167.99.216.145.8333 > tom-Latitude-3570.57976: tcp 24
03:07:41.275326 IP 167.99.216.145.8333 > tom-Latitude-3570.57976: tcp 373
03:07:41.275454 IP tom-Latitude-3570.57976 > 167.99.216.145.8333: tcp 0
03:07:41.303754 IP static-87-75-105-186.vodafonexdsl.co.uk.8333 > tom-Latitude-3570.46284: tcp 0
03:07:41.304404 IP static-87-75-105-186.vodafonexdsl.co.uk.8333 > tom-Latitude-3570.46284: tcp 0
03:07:41.476523 IP tom-Latitude-3570.60470 > bb42-60-217-183.singnet.com.sg.8333: tcp 24
03:07:41.478656 IP tom-Latitude-3570.60470 > bb42-60-217-183.singnet.com.sg.8333: tcp 145
03:07:41.515683 IP bb42-60-217-183.singnet.com.sg.8333 > tom-Latitude-3570.60470: tcp 0
03:07:41.523655 IP bb42-60-217-183.singnet.com.sg.8333 > tom-Latitude-3570.60470: tcp 0
03:07:41.777641 IP tom-Latitude-3570.49070 > c-185-45-236-223.customer.ggaweb.ch.8333: tcp 24
03:07:41.777730 IP tom-Latitude-3570.42516 > 2.56.9.15.8333: tcp 24
03:07:41.777757 IP tom-Latitude-3570.46284 > static-87-75-105-186.vodafonexdsl.co.uk.8333: tcp 24
03:07:41.779756 IP tom-Latitude-3570.46284 > static-87-75-105-186.vodafonexdsl.co.uk.8333: tcp 73
03:07:41.779768 IP tom-Latitude-3570.42516 > 2.56.9.15.8333: tcp 253
03:07:41.779771 IP tom-Latitude-3570.49070 > c-185-45-236-223.customer.ggaweb.ch.8333: tcp 469
03:07:41.815704 IP 2.56.9.15.8333 > tom-Latitude-3570.42516: tcp 0
03:07:41.823701 IP c-185-45-236-223.customer.ggaweb.ch.8333 > tom-Latitude-3570.49070: tcp 0
03:07:41.824528 IP static-87-75-105-186.vodafonexdsl.co.uk.8333 > tom-Latitude-3570.46284: tcp 0
03:07:41.824542 IP static-87-75-105-186.vodafonexdsl.co.uk.8333 > tom-Latitude-3570.46284: tcp 0
03:07:41.824545 IP 2.56.9.15.8333 > tom-Latitude-3570.42516: tcp 0
03:07:41.824547 IP c-185-45-236-223.customer.ggaweb.ch.8333 > tom-Latitude-3570.49070: tcp 0
03:07:41.878156 IP tom-Latitude-3570.39110 > vmi195435.contaboserver.net.8333: tcp 24
03:07:41.879096 IP tom-Latitude-3570.39110 > vmi195435.contaboserver.net.8333: tcp 145
03:07:41.915730 IP vmi195435.contaboserver.net.8333 > tom-Latitude-3570.39110: tcp 0
03:07:41.923674 IP vmi195435.contaboserver.net.8333 > tom-Latitude-3570.39110: tcp 0
03:07:41.978577 IP tom-Latitude-3570.56714 > ns3113832.ip-54-38-177.eu.8333: tcp 24
03:07:41.980072 IP tom-Latitude-3570.56714 > ns3113832.ip-54-38-177.eu.8333: tcp 73
03:07:42.014670 IP ns3113832.ip-54-38-177.eu.8333 > tom-Latitude-3570.56714: tcp 0
03:07:42.023667 IP ns3113832.ip-54-38-177.eu.8333 > tom-Latitude-3570.56714: tcp 0
03:07:42.781393 IP tom-Latitude-3570.60988 > 81.198.101.144.8333: tcp 24
03:07:42.783638 IP tom-Latitude-3570.60988 > 81.198.101.144.8333: tcp 397
03:07:42.835585 IP 81.198.101.144.8333 > tom-Latitude-3570.60988: tcp 0
03:07:42.841746 IP 81.198.101.144.8333 > tom-Latitude-3570.60988: tcp 0
03:07:44.645352 IP c-185-45-236-223.customer.ggaweb.ch.8333 > tom-Latitude-3570.49070: tcp 24
03:07:44.645372 IP c-185-45-236-223.customer.ggaweb.ch.8333 > tom-Latitude-3570.49070: tcp 613
03:07:44.645375 IP c-185-45-236-223.customer.ggaweb.ch.8333 > tom-Latitude-3570.49070: tcp 613
03:07:44.645402 IP tom-Latitude-3570.49070 > c-185-45-236-223.customer.ggaweb.ch.8333: tcp 0
03:07:44.645416 IP ns3113832.ip-54-38-177.eu.8333 > tom-Latitude-3570.56714: tcp 24
03:07:44.645420 IP ns3113832.ip-54-38-177.eu.8333 > tom-Latitude-3570.56714: tcp 649
03:07:44.645512 IP tom-Latitude-3570.56714 > ns3113832.ip-54-38-177.eu.8333: tcp 0
03:07:44.645816 IP tom-Latitude-3570.49070 > c-185-45-236-223.customer.ggaweb.ch.8333: tcp 24
03:07:44.645989 IP tom-Latitude-3570.56714 > ns3113832.ip-54-38-177.eu.8333: tcp 24
03:07:44.646851 IP tom-Latitude-3570.56714 > ns3113832.ip-54-38-177.eu.8333: tcp 37
03:07:44.646857 IP tom-Latitude-3570.49070 > c-185-45-236-223.customer.ggaweb.ch.8333: tcp 613
03:07:44.682146 IP c-185-45-236-223.customer.ggaweb.ch.8333 > tom-Latitude-3570.49070: tcp 0
03:07:44.682865 IP ns3113832.ip-54-38-177.eu.8333 > tom-Latitude-3570.56714: tcp 0
03:07:44.682870 IP ns3113832.ip-54-38-177.eu.8333 > tom-Latitude-3570.56714: tcp 0
03:07:44.682872 IP c-185-45-236-223.customer.ggaweb.ch.8333 > tom-Latitude-3570.49070: tcp 0
03:07:44.731736 IP ns3113832.ip-54-38-177.eu.8333 > tom-Latitude-3570.56714: tcp 24
03:07:44.732552 IP ns3113832.ip-54-38-177.eu.8333 > tom-Latitude-3570.56714: tcp 256
03:07:44.732683 IP tom-Latitude-3570.56714 > ns3113832.ip-54-38-177.eu.8333: tcp 0
03:07:44.784000 IP c-185-45-236-223.customer.ggaweb.ch.8333 > tom-Latitude-3570.49070: tcp 24
03:07:44.784019 IP c-185-45-236-223.customer.ggaweb.ch.8333 > tom-Latitude-3570.49070: tcp 1343
03:07:44.784024 IP c-185-45-236-223.customer.ggaweb.ch.8333 > tom-Latitude-3570.49070: tcp 736
03:07:44.784026 IP c-185-45-236-223.customer.ggaweb.ch.8333 > tom-Latitude-3570.49070: tcp 1005
03:07:44.784051 IP c-185-45-236-223.customer.ggaweb.ch.8333 > tom-Latitude-3570.49070: tcp 922
03:07:44.784054 IP c-185-45-236-223.customer.ggaweb.ch.8333 > tom-Latitude-3570.49070: tcp 923
03:07:44.784056 IP c-185-45-236-223.customer.ggaweb.ch.8333 > tom-Latitude-3570.49070: tcp 307
03:07:44.784120 IP tom-Latitude-3570.49070 > c-185-45-236-223.customer.ggaweb.ch.8333: tcp 0
03:07:45.669339 IP c-185-45-236-223.customer.ggaweb.ch.8333 > tom-Latitude-3570.49070: tcp 24
03:07:45.669359 IP c-185-45-236-223.customer.ggaweb.ch.8333 > tom-Latitude-3570.49070: tcp 109
03:07:45.669362 IP c-185-45-236-223.customer.ggaweb.ch.8333 > tom-Latitude-3570.49070: tcp 109
03:07:45.669389 IP tom-Latitude-3570.49070 > c-185-45-236-223.customer.ggaweb.ch.8333: tcp 0
03:07:45.669572 IP tom-Latitude-3570.49070 > c-185-45-236-223.customer.ggaweb.ch.8333: tcp 24
03:07:45.670778 IP tom-Latitude-3570.49070 > c-185-45-236-223.customer.ggaweb.ch.8333: tcp 73
03:07:45.713858 IP c-185-45-236-223.customer.ggaweb.ch.8333 > tom-Latitude-3570.49070: tcp 0
03:07:45.714463 IP c-185-45-236-223.customer.ggaweb.ch.8333 > tom-Latitude-3570.49070: tcp 0
03:07:45.765714 IP bb42-60-217-183.singnet.com.sg.8333 > tom-Latitude-3570.60470: tcp 24
03:07:45.765735 IP bb42-60-217-183.singnet.com.sg.8333 > tom-Latitude-3570.60470: tcp 793
03:07:45.765827 IP tom-Latitude-3570.60470 > bb42-60-217-183.singnet.com.sg.8333: tcp 0
03:07:45.766097 IP tom-Latitude-3570.60470 > bb42-60-217-183.singnet.com.sg.8333: tcp 24
03:07:45.769080 IP tom-Latitude-3570.60470 > bb42-60-217-183.singnet.com.sg.8333: tcp 73
03:07:45.795671 IP c-185-45-236-223.customer.ggaweb.ch.8333 > tom-Latitude-3570.49070: tcp 24
03:07:45.797078 IP c-185-45-236-223.customer.ggaweb.ch.8333 > tom-Latitude-3570.49070: tcp 592
03:07:45.797091 IP tom-Latitude-3570.49070 > c-185-45-236-223.customer.ggaweb.ch.8333: tcp 0
03:07:45.803777 IP bb42-60-217-183.singnet.com.sg.8333 > tom-Latitude-3570.60470: tcp 0
03:07:45.804446 IP bb42-60-217-183.singnet.com.sg.8333 > tom-Latitude-3570.60470: tcp 0
03:07:46.098659 IP tom-Latitude-3570.39110 > vmi195435.contaboserver.net.8333: tcp 24
03:07:46.100801 IP tom-Latitude-3570.39110 > vmi195435.contaboserver.net.8333: tcp 721
03:07:46.145319 IP vmi195435.contaboserver.net.8333 > tom-Latitude-3570.39110: tcp 0
03:07:46.153325 IP vmi195435.contaboserver.net.8333 > tom-Latitude-3570.39110: tcp 0
03:07:46.190391 IP bb42-60-217-183.singnet.com.sg.8333 > tom-Latitude-3570.60470: tcp 24
03:07:46.191089 IP bb42-60-217-183.singnet.com.sg.8333 > tom-Latitude-3570.60470: tcp 283
03:07:46.191107 IP bb42-60-217-183.singnet.com.sg.8333 > tom-Latitude-3570.60470: tcp 24
03:07:46.191110 IP bb42-60-217-183.singnet.com.sg.8333 > tom-Latitude-3570.60470: tcp 283
03:07:46.191200 IP tom-Latitude-3570.60470 > bb42-60-217-183.singnet.com.sg.8333: tcp 0
03:07:46.292451 IP tom-Latitude-3570.46284 > static-87-75-105-186.vodafonexdsl.co.uk.8333: tcp 24
03:07:46.312492 IP tom-Latitude-3570.46284 > static-87-75-105-186.vodafonexdsl.co.uk.8333: tcp 793
03:07:46.343635 IP static-87-75-105-186.vodafonexdsl.co.uk.8333 > tom-Latitude-3570.46284: tcp 0
03:07:46.367494 IP 2.56.9.15.8333 > tom-Latitude-3570.42516: tcp 24
03:07:46.368197 IP 2.56.9.15.8333 > tom-Latitude-3570.42516: tcp 973
03:07:46.368214 IP static-87-75-105-186.vodafonexdsl.co.uk.8333 > tom-Latitude-3570.46284: tcp 0
03:07:46.368307 IP tom-Latitude-3570.42516 > 2.56.9.15.8333: tcp 0
03:07:46.368622 IP tom-Latitude-3570.42516 > 2.56.9.15.8333: tcp 24
03:07:46.369812 IP tom-Latitude-3570.42516 > 2.56.9.15.8333: tcp 181
03:07:46.406685 IP 2.56.9.15.8333 > tom-Latitude-3570.42516: tcp 0
03:07:46.406693 IP 2.56.9.15.8333 > tom-Latitude-3570.42516: tcp 0
03:07:46.497505 IP 2.56.9.15.8333 > tom-Latitude-3570.42516: tcp 24
03:07:46.498374 IP 2.56.9.15.8333 > tom-Latitude-3570.42516: tcp 226
03:07:46.498400 IP 2.56.9.15.8333 > tom-Latitude-3570.42516: tcp 24
03:07:46.498402 IP 2.56.9.15.8333 > tom-Latitude-3570.42516: tcp 246
03:07:46.498405 IP 2.56.9.15.8333 > tom-Latitude-3570.42516: tcp 24
03:07:46.498407 IP 2.56.9.15.8333 > tom-Latitude-3570.42516: tcp 249
03:07:46.498409 IP 2.56.9.15.8333 > tom-Latitude-3570.42516: tcp 24
03:07:46.498428 IP 2.56.9.15.8333 > tom-Latitude-3570.42516: tcp 283
03:07:46.498430 IP 2.56.9.15.8333 > tom-Latitude-3570.42516: tcp 24
03:07:46.498496 IP tom-Latitude-3570.42516 > 2.56.9.15.8333: tcp 0
03:07:46.498912 IP 2.56.9.15.8333 > tom-Latitude-3570.42516: tcp 283
03:07:46.518296 IP 167.99.216.145.8333 > tom-Latitude-3570.57976: tcp 24
03:07:46.519155 IP 167.99.216.145.8333 > tom-Latitude-3570.57976: tcp 973
03:07:46.519286 IP tom-Latitude-3570.57976 > 167.99.216.145.8333: tcp 0
03:07:46.539792 IP tom-Latitude-3570.42516 > 2.56.9.15.8333: tcp 0
03:07:46.619883 IP tom-Latitude-3570.49070 > c-185-45-236-223.customer.ggaweb.ch.8333: tcp 24
03:07:46.620052 IP tom-Latitude-3570.60988 > 81.198.101.144.8333: tcp 24
03:07:46.620833 IP tom-Latitude-3570.49070 > c-185-45-236-223.customer.ggaweb.ch.8333: tcp 253
03:07:46.621509 IP tom-Latitude-3570.60988 > 81.198.101.144.8333: tcp 973
03:07:46.655403 IP 81.198.101.144.8333 > tom-Latitude-3570.60988: tcp 0
03:07:46.662339 IP c-185-45-236-223.customer.ggaweb.ch.8333 > tom-Latitude-3570.49070: tcp 0
03:07:46.662907 IP c-185-45-236-223.customer.ggaweb.ch.8333 > tom-Latitude-3570.49070: tcp 0
03:07:46.662921 IP 81.198.101.144.8333 > tom-Latitude-3570.60988: tcp 0
03:07:47.512653 IP bb42-60-217-183.singnet.com.sg.8333 > tom-Latitude-3570.60470: tcp 24
03:07:47.512672 IP bb42-60-217-183.singnet.com.sg.8333 > tom-Latitude-3570.60470: tcp 181
03:07:47.512676 IP bb42-60-217-183.singnet.com.sg.8333 > tom-Latitude-3570.60470: tcp 181
03:07:47.512704 IP tom-Latitude-3570.60470 > bb42-60-217-183.singnet.com.sg.8333: tcp 0
03:07:47.512718 IP 2.56.9.15.8333 > tom-Latitude-3570.42516: tcp 24
03:07:47.512723 IP tom-Latitude-3570.42516 > 2.56.9.15.8333: tcp 0
03:07:47.512725 IP 2.56.9.15.8333 > tom-Latitude-3570.42516: tcp 73
03:07:47.512727 IP tom-Latitude-3570.42516 > 2.56.9.15.8333: tcp 0
03:07:47.512731 IP 2.56.9.15.8333 > tom-Latitude-3570.42516: tcp 73
03:07:47.512733 IP tom-Latitude-3570.42516 > 2.56.9.15.8333: tcp 0
03:07:47.513018 IP tom-Latitude-3570.42516 > 2.56.9.15.8333: tcp 24
03:07:47.514213 IP tom-Latitude-3570.42516 > 2.56.9.15.8333: tcp 73
03:07:47.553300 IP 2.56.9.15.8333 > tom-Latitude-3570.42516: tcp 0
03:07:47.553308 IP 2.56.9.15.8333 > tom-Latitude-3570.42516: tcp 0
03:07:47.650853 IP 2.56.9.15.8333 > tom-Latitude-3570.42516: tcp 24
03:07:47.651630 IP 2.56.9.15.8333 > tom-Latitude-3570.42516: tcp 192
03:07:47.651648 IP 2.56.9.15.8333 > tom-Latitude-3570.42516: tcp 24
03:07:47.651651 IP 2.56.9.15.8333 > tom-Latitude-3570.42516: tcp 225
03:07:47.651742 IP tom-Latitude-3570.42516 > 2.56.9.15.8333: tcp 0
03:07:47.752507 IP tom-Latitude-3570.39110 > vmi195435.contaboserver.net.8333: tcp 24
03:07:47.752598 IP tom-Latitude-3570.56714 > ns3113832.ip-54-38-177.eu.8333: tcp 24
03:07:47.754102 IP tom-Latitude-3570.56714 > ns3113832.ip-54-38-177.eu.8333: tcp 397
03:07:47.754113 IP tom-Latitude-3570.39110 > vmi195435.contaboserver.net.8333: tcp 325
03:07:47.786267 IP ns3113832.ip-54-38-177.eu.8333 > tom-Latitude-3570.56714: tcp 0
03:07:47.792028 IP vmi195435.contaboserver.net.8333 > tom-Latitude-3570.39110: tcp 0
03:07:47.792707 IP ns3113832.ip-54-38-177.eu.8333 > tom-Latitude-3570.56714: tcp 0
03:07:47.792721 IP vmi195435.contaboserver.net.8333 > tom-Latitude-3570.39110: tcp 0
03:07:47.852998 IP tom-Latitude-3570.57976 > 167.99.216.145.8333: tcp 24
03:07:47.853935 IP tom-Latitude-3570.57976 > 167.99.216.145.8333: tcp 73
03:07:47.884552 IP 167.99.216.145.8333 > tom-Latitude-3570.57976: tcp 0
03:07:47.894972 IP 167.99.216.145.8333 > tom-Latitude-3570.57976: tcp 0
03:07:48.536320 IP 167.99.216.145.8333 > tom-Latitude-3570.57976: tcp 24
03:07:48.536346 IP 167.99.216.145.8333 > tom-Latitude-3570.57976: tcp 145
03:07:48.536353 IP 167.99.216.145.8333 > tom-Latitude-3570.57976: tcp 145
03:07:48.536366 IP tom-Latitude-3570.57976 > 167.99.216.145.8333: tcp 0
03:07:48.536383 IP 2.56.9.15.8333 > tom-Latitude-3570.42516: tcp 24
03:07:48.536389 IP 2.56.9.15.8333 > tom-Latitude-3570.42516: tcp 109
03:07:48.536469 IP tom-Latitude-3570.42516 > 2.56.9.15.8333: tcp 0
03:07:48.536581 IP tom-Latitude-3570.60988 > 81.198.101.144.8333: tcp 24
03:07:48.536724 IP tom-Latitude-3570.57976 > 167.99.216.145.8333: tcp 24
03:07:48.537884 IP tom-Latitude-3570.57976 > 167.99.216.145.8333: tcp 145
03:07:48.537896 IP tom-Latitude-3570.60988 > 81.198.101.144.8333: tcp 73
03:07:48.573276 IP 81.198.101.144.8333 > tom-Latitude-3570.60988: tcp 0
03:07:48.575305 IP 167.99.216.145.8333 > tom-Latitude-3570.57976: tcp 0
03:07:48.575319 IP 81.198.101.144.8333 > tom-Latitude-3570.60988: tcp 0
03:07:48.575322 IP 167.99.216.145.8333 > tom-Latitude-3570.57976: tcp 0
03:07:48.637160 IP 167.99.216.145.8333 > tom-Latitude-3570.57976: tcp 24
03:07:48.638202 IP 167.99.216.145.8333 > tom-Latitude-3570.57976: tcp 191
03:07:48.638220 IP 167.99.216.145.8333 > tom-Latitude-3570.57976: tcp 24
03:07:48.638222 IP 167.99.216.145.8333 > tom-Latitude-3570.57976: tcp 370
03:07:48.638225 IP 167.99.216.145.8333 > tom-Latitude-3570.57976: tcp 24
03:07:48.638226 IP 167.99.216.145.8333 > tom-Latitude-3570.57976: tcp 372
03:07:48.638228 IP 167.99.216.145.8333 > tom-Latitude-3570.57976: tcp 24
03:07:48.638230 IP 167.99.216.145.8333 > tom-Latitude-3570.57976: tcp 225
03:07:48.638319 IP tom-Latitude-3570.57976 > 167.99.216.145.8333: tcp 0
03:07:48.840645 IP tom-Latitude-3570.39110 > vmi195435.contaboserver.net.8333: tcp 24
03:07:48.840699 IP tom-Latitude-3570.42516 > 2.56.9.15.8333: tcp 24
03:07:48.842775 IP tom-Latitude-3570.42516 > 2.56.9.15.8333: tcp 37
03:07:48.842786 IP tom-Latitude-3570.39110 > vmi195435.contaboserver.net.8333: tcp 145
03:07:48.879012 IP 2.56.9.15.8333 > tom-Latitude-3570.42516: tcp 0
03:07:48.884244 IP 2.56.9.15.8333 > tom-Latitude-3570.42516: tcp 0
03:07:48.884257 IP vmi195435.contaboserver.net.8333 > tom-Latitude-3570.39110: tcp 0
03:07:48.884261 IP vmi195435.contaboserver.net.8333 > tom-Latitude-3570.39110: tcp 0
03:07:49.150817 IP bb42-60-217-183.singnet.com.sg.8333 > tom-Latitude-3570.60470: tcp 24
03:07:49.150834 IP tom-Latitude-3570.60470 > bb42-60-217-183.singnet.com.sg.8333: tcp 0
03:07:49.150852 IP bb42-60-217-183.singnet.com.sg.8333 > tom-Latitude-3570.60470: tcp 217
03:07:49.150856 IP tom-Latitude-3570.60470 > bb42-60-217-183.singnet.com.sg.8333: tcp 0
03:07:49.151165 IP tom-Latitude-3570.60470 > bb42-60-217-183.singnet.com.sg.8333: tcp 24
03:07:49.152347 IP tom-Latitude-3570.60470 > bb42-60-217-183.singnet.com.sg.8333: tcp 37
03:07:49.194016 IP bb42-60-217-183.singnet.com.sg.8333 > tom-Latitude-3570.60470: tcp 0
03:07:49.194576 IP bb42-60-217-183.singnet.com.sg.8333 > tom-Latitude-3570.60470: tcp 0
03:07:49.652711 IP tom-Latitude-3570.56714 > ns3113832.ip-54-38-177.eu.8333: tcp 24
03:07:49.654720 IP tom-Latitude-3570.56714 > ns3113832.ip-54-38-177.eu.8333: tcp 145
03:07:49.666559 IP 2.56.9.15.8333 > tom-Latitude-3570.42516: tcp 24
03:07:49.667201 IP 2.56.9.15.8333 > tom-Latitude-3570.42516: tcp 73
03:07:49.667218 IP bb42-60-217-183.singnet.com.sg.8333 > tom-Latitude-3570.60470: tcp 24
03:07:49.667224 IP bb42-60-217-183.singnet.com.sg.8333 > tom-Latitude-3570.60470: tcp 226
03:07:49.667347 IP tom-Latitude-3570.60470 > bb42-60-217-183.singnet.com.sg.8333: tcp 0
03:07:49.667377 IP tom-Latitude-3570.42516 > 2.56.9.15.8333: tcp 0
03:07:49.684363 IP 2.56.9.15.8333 > tom-Latitude-3570.42516: tcp 73
03:07:49.684381 IP tom-Latitude-3570.42516 > 2.56.9.15.8333: tcp 0
03:07:49.692412 IP ns3113832.ip-54-38-177.eu.8333 > tom-Latitude-3570.56714: tcp 0
03:07:49.692972 IP ns3113832.ip-54-38-177.eu.8333 > tom-Latitude-3570.56714: tcp 0
03:07:49.770374 IP tom-Latitude-3570.42516 > 2.56.9.15.8333: tcp 24
03:07:49.771319 IP tom-Latitude-3570.42516 > 2.56.9.15.8333: tcp 37
03:07:49.806023 IP 2.56.9.15.8333 > tom-Latitude-3570.42516: tcp 0
03:07:49.814018 IP 2.56.9.15.8333 > tom-Latitude-3570.42516: tcp 0
03:07:49.910062 IP 2.56.9.15.8333 > tom-Latitude-3570.42516: tcp 24
03:07:49.910080 IP tom-Latitude-3570.42516 > 2.56.9.15.8333: tcp 0
03:07:49.910714 IP 2.56.9.15.8333 > tom-Latitude-3570.42516: tcp 261
03:07:49.910738 IP tom-Latitude-3570.42516 > 2.56.9.15.8333: tcp 0
03:07:49.972107 IP c-185-45-236-223.customer.ggaweb.ch.8333 > tom-Latitude-3570.49070: tcp 24
03:07:49.972781 IP c-185-45-236-223.customer.ggaweb.ch.8333 > tom-Latitude-3570.49070: tcp 325
03:07:49.972908 IP tom-Latitude-3570.49070 > c-185-45-236-223.customer.ggaweb.ch.8333: tcp 0
03:07:49.973145 IP tom-Latitude-3570.49070 > c-185-45-236-223.customer.ggaweb.ch.8333: tcp 24
03:07:49.973300 IP tom-Latitude-3570.60470 > bb42-60-217-183.singnet.com.sg.8333: tcp 24
03:07:49.974488 IP tom-Latitude-3570.60470 > bb42-60-217-183.singnet.com.sg.8333: tcp 73
03:07:49.974499 IP tom-Latitude-3570.49070 > c-185-45-236-223.customer.ggaweb.ch.8333: tcp 37
03:07:50.004209 IP bb42-60-217-183.singnet.com.sg.8333 > tom-Latitude-3570.60470: tcp 0
03:07:50.004795 IP bb42-60-217-183.singnet.com.sg.8333 > tom-Latitude-3570.60470: tcp 0
03:07:50.004808 IP c-185-45-236-223.customer.ggaweb.ch.8333 > tom-Latitude-3570.49070: tcp 0
03:07:50.004812 IP c-185-45-236-223.customer.ggaweb.ch.8333 > tom-Latitude-3570.49070: tcp 0
03:07:50.087119 IP c-185-45-236-223.customer.ggaweb.ch.8333 > tom-Latitude-3570.49070: tcp 24
