11:41:51.166978 IP tom-Latitude-3570.56118 > ns3051461.ip-51-255-95.eu.8333: tcp 24
11:41:51.169111 IP tom-Latitude-3570.56118 > ns3051461.ip-51-255-95.eu.8333: tcp 181
11:41:51.208878 IP ns3051461.ip-51-255-95.eu.8333 > tom-Latitude-3570.56118: tcp 0
11:41:51.245704 IP pool-108-20-207-31.bstnma.fios.verizon.net.8333 > tom-Latitude-3570.33922: tcp 24
11:41:51.245830 IP pool-108-20-207-31.bstnma.fios.verizon.net.8333 > tom-Latitude-3570.33922: tcp 289
11:41:51.245853 IP tom-Latitude-3570.33922 > pool-108-20-207-31.bstnma.fios.verizon.net.8333: tcp 0
11:41:51.255615 IP c-73-101-52-184.hsd1.pa.comcast.net.8333 > tom-Latitude-3570.59818: tcp 24
11:41:51.256014 IP c-73-101-52-184.hsd1.pa.comcast.net.8333 > tom-Latitude-3570.59818: tcp 403
11:41:51.256020 IP c-73-101-52-184.hsd1.pa.comcast.net.8333 > tom-Latitude-3570.59818: tcp 24
11:41:51.256022 IP c-73-101-52-184.hsd1.pa.comcast.net.8333 > tom-Latitude-3570.59818: tcp 192
11:41:51.256024 IP c-73-101-52-184.hsd1.pa.comcast.net.8333 > tom-Latitude-3570.59818: tcp 24
11:41:51.256026 IP c-73-101-52-184.hsd1.pa.comcast.net.8333 > tom-Latitude-3570.59818: tcp 248
11:41:51.256088 IP tom-Latitude-3570.59818 > c-73-101-52-184.hsd1.pa.comcast.net.8333: tcp 0
11:41:51.457794 IP tom-Latitude-3570.33922 > pool-108-20-207-31.bstnma.fios.verizon.net.8333: tcp 24
11:41:51.458068 IP tom-Latitude-3570.33922 > pool-108-20-207-31.bstnma.fios.verizon.net.8333: tcp 73
11:41:51.497625 IP pool-108-20-207-31.bstnma.fios.verizon.net.8333 > tom-Latitude-3570.33922: tcp 0
11:41:51.558096 IP tom-Latitude-3570.56344 > 23.226.90.172.8333: tcp 24
11:41:51.558166 IP tom-Latitude-3570.34082 > host93-234-110-95.serverdedicati.aruba.it.8333: tcp 24
11:41:51.558387 IP tom-Latitude-3570.34082 > host93-234-110-95.serverdedicati.aruba.it.8333: tcp 109
11:41:51.558392 IP tom-Latitude-3570.56344 > 23.226.90.172.8333: tcp 613
11:41:51.597443 IP 23.226.90.172.8333 > tom-Latitude-3570.56344: tcp 0
11:41:51.609223 IP host93-234-110-95.serverdedicati.aruba.it.8333 > tom-Latitude-3570.34082: tcp 0
11:41:51.631746 IP host93-234-110-95.serverdedicati.aruba.it.8333 > tom-Latitude-3570.34082: tcp 0
11:41:51.631751 IP 23.226.90.172.8333 > tom-Latitude-3570.56344: tcp 0
11:41:51.638248 IP pool-108-20-207-31.bstnma.fios.verizon.net.8333 > tom-Latitude-3570.33922: tcp 24
11:41:51.638256 IP pool-108-20-207-31.bstnma.fios.verizon.net.8333 > tom-Latitude-3570.33922: tcp 73
11:41:51.638348 IP tom-Latitude-3570.33922 > pool-108-20-207-31.bstnma.fios.verizon.net.8333: tcp 0
11:41:51.638427 IP tom-Latitude-3570.33922 > pool-108-20-207-31.bstnma.fios.verizon.net.8333: tcp 24
11:41:51.640467 IP tom-Latitude-3570.33922 > pool-108-20-207-31.bstnma.fios.verizon.net.8333: tcp 619
11:41:51.687543 IP pool-108-20-207-31.bstnma.fios.verizon.net.8333 > tom-Latitude-3570.33922: tcp 0
11:41:52.139335 IP tom-Latitude-3570.56118 > ns3051461.ip-51-255-95.eu.8333: tcp 24
11:41:52.143187 IP tom-Latitude-3570.56118 > ns3051461.ip-51-255-95.eu.8333: tcp 109
11:41:52.149644 IP 23.226.90.172.8333 > tom-Latitude-3570.56344: tcp 24
11:41:52.149658 IP 23.226.90.172.8333 > tom-Latitude-3570.56344: tcp 109
11:41:52.149726 IP tom-Latitude-3570.56344 > 23.226.90.172.8333: tcp 0
11:41:52.149887 IP tom-Latitude-3570.56344 > 23.226.90.172.8333: tcp 24
11:41:52.150372 IP tom-Latitude-3570.56344 > 23.226.90.172.8333: tcp 109
11:41:52.158104 IP 23.226.90.172.8333 > tom-Latitude-3570.56344: tcp 109
11:41:52.158110 IP tom-Latitude-3570.56344 > 23.226.90.172.8333: tcp 0
11:41:52.197457 IP ns3051461.ip-51-255-95.eu.8333 > tom-Latitude-3570.56118: tcp 0
11:41:52.197469 IP 23.226.90.172.8333 > tom-Latitude-3570.56344: tcp 0
11:41:52.197472 IP 23.226.90.172.8333 > tom-Latitude-3570.56344: tcp 0
11:41:52.367712 IP 23.226.90.172.8333 > tom-Latitude-3570.56344: tcp 24
11:41:52.367724 IP tom-Latitude-3570.56344 > 23.226.90.172.8333: tcp 0
11:41:52.368421 IP 23.226.90.172.8333 > tom-Latitude-3570.56344: tcp 1104
11:41:52.368443 IP tom-Latitude-3570.56344 > 23.226.90.172.8333: tcp 0
11:41:52.369495 IP tom-Latitude-3570.33922 > pool-108-20-207-31.bstnma.fios.verizon.net.8333: tcp 24
11:41:52.369689 IP tom-Latitude-3570.33922 > pool-108-20-207-31.bstnma.fios.verizon.net.8333: tcp 37
11:41:52.397638 IP pool-108-20-207-31.bstnma.fios.verizon.net.8333 > tom-Latitude-3570.33922: tcp 0
11:41:52.401264 IP ns3051461.ip-51-255-95.eu.8333 > tom-Latitude-3570.56118: tcp 24
11:41:52.401417 IP ns3051461.ip-51-255-95.eu.8333 > tom-Latitude-3570.56118: tcp 31
11:41:52.401442 IP ns3051461.ip-51-255-95.eu.8333 > tom-Latitude-3570.56118: tcp 133
11:41:52.401461 IP tom-Latitude-3570.56118 > ns3051461.ip-51-255-95.eu.8333: tcp 0
11:41:52.601976 IP tom-Latitude-3570.36650 > ec2-52-56-97-80.eu-west-2.compute.amazonaws.com.8333: tcp 24
11:41:52.605150 IP tom-Latitude-3570.36650 > ec2-52-56-97-80.eu-west-2.compute.amazonaws.com.8333: tcp 397
11:41:52.639644 IP ec2-52-56-97-80.eu-west-2.compute.amazonaws.com.8333 > tom-Latitude-3570.36650: tcp 0
11:41:52.648416 IP ec2-52-56-97-80.eu-west-2.compute.amazonaws.com.8333 > tom-Latitude-3570.36650: tcp 0
11:41:52.902554 IP tom-Latitude-3570.56244 > 172.214.77.34.bc.googleusercontent.com.8333: tcp 24
11:41:52.902618 IP tom-Latitude-3570.59818 > c-73-101-52-184.hsd1.pa.comcast.net.8333: tcp 24
11:41:52.914369 IP tom-Latitude-3570.56244 > 172.214.77.34.bc.googleusercontent.com.8333: tcp 217
11:41:52.915030 IP tom-Latitude-3570.59818 > c-73-101-52-184.hsd1.pa.comcast.net.8333: tcp 109
11:41:52.917156 IP pool-108-20-207-31.bstnma.fios.verizon.net.8333 > tom-Latitude-3570.33922: tcp 24
11:41:52.917307 IP pool-108-20-207-31.bstnma.fios.verizon.net.8333 > tom-Latitude-3570.33922: tcp 73
11:41:52.917323 IP tom-Latitude-3570.33922 > pool-108-20-207-31.bstnma.fios.verizon.net.8333: tcp 0
11:41:52.952766 IP 172.214.77.34.bc.googleusercontent.com.8333 > tom-Latitude-3570.56244: tcp 0
11:41:52.952788 IP c-73-101-52-184.hsd1.pa.comcast.net.8333 > tom-Latitude-3570.59818: tcp 0
11:41:52.952791 IP c-73-101-52-184.hsd1.pa.comcast.net.8333 > tom-Latitude-3570.59818: tcp 0
11:41:53.927746 IP 23.226.90.172.8333 > tom-Latitude-3570.56344: tcp 24
11:41:53.927764 IP tom-Latitude-3570.56344 > 23.226.90.172.8333: tcp 0
11:41:53.927797 IP 23.226.90.172.8333 > tom-Latitude-3570.56344: tcp 253
11:41:53.927800 IP tom-Latitude-3570.56344 > 23.226.90.172.8333: tcp 0
11:41:53.927802 IP 23.226.90.172.8333 > tom-Latitude-3570.56344: tcp 253
11:41:53.927811 IP tom-Latitude-3570.56344 > 23.226.90.172.8333: tcp 0
11:41:53.927955 IP tom-Latitude-3570.56344 > 23.226.90.172.8333: tcp 24
11:41:53.928370 IP tom-Latitude-3570.56344 > 23.226.90.172.8333: tcp 253
11:41:53.966218 IP 23.226.90.172.8333 > tom-Latitude-3570.56344: tcp 0
11:41:53.966225 IP 23.226.90.172.8333 > tom-Latitude-3570.56344: tcp 0
11:41:54.124807 IP c-73-101-52-184.hsd1.pa.comcast.net.8333 > tom-Latitude-3570.59818: tcp 24
11:41:54.125151 IP c-73-101-52-184.hsd1.pa.comcast.net.8333 > tom-Latitude-3570.59818: tcp 109
11:41:54.125240 IP tom-Latitude-3570.59818 > c-73-101-52-184.hsd1.pa.comcast.net.8333: tcp 0
11:41:54.136838 IP 23.226.90.172.8333 > tom-Latitude-3570.56344: tcp 24
11:41:54.137227 IP 23.226.90.172.8333 > tom-Latitude-3570.56344: tcp 1073
11:41:54.137234 IP 23.226.90.172.8333 > tom-Latitude-3570.56344: tcp 853
11:41:54.137249 IP tom-Latitude-3570.56344 > 23.226.90.172.8333: tcp 0
11:41:54.145454 IP 23.226.90.172.8333 > tom-Latitude-3570.56344: tcp 24
11:41:54.145467 IP 23.226.90.172.8333 > tom-Latitude-3570.56344: tcp 1422
11:41:54.145471 IP 23.226.90.172.8333 > tom-Latitude-3570.56344: tcp 1422
11:41:54.145487 IP tom-Latitude-3570.56344 > 23.226.90.172.8333: tcp 0
11:41:54.192858 IP 23.226.90.172.8333 > tom-Latitude-3570.56344: tcp 1422
11:41:54.192881 IP 23.226.90.172.8333 > tom-Latitude-3570.56344: tcp 233
11:41:54.192883 IP 23.226.90.172.8333 > tom-Latitude-3570.56344: tcp 429
11:41:54.192886 IP 97-82-78-25.dhcp.leds.al.charter.com.8333 > tom-Latitude-3570.47742: tcp 24
11:41:54.192888 IP 97-82-78-25.dhcp.leds.al.charter.com.8333 > tom-Latitude-3570.47742: tcp 397
11:41:54.192896 IP tom-Latitude-3570.56344 > 23.226.90.172.8333: tcp 0
11:41:54.192926 IP tom-Latitude-3570.47742 > 97-82-78-25.dhcp.leds.al.charter.com.8333: tcp 0
11:41:54.220725 IP 97-82-78-25.dhcp.leds.al.charter.com.8333 > tom-Latitude-3570.47742: tcp 397
11:41:54.220737 IP tom-Latitude-3570.47742 > 97-82-78-25.dhcp.leds.al.charter.com.8333: tcp 0
11:41:54.245289 IP ec2-52-56-97-80.eu-west-2.compute.amazonaws.com.8333 > tom-Latitude-3570.36650: tcp 24
11:41:54.245316 IP ec2-52-56-97-80.eu-west-2.compute.amazonaws.com.8333 > tom-Latitude-3570.36650: tcp 289
11:41:54.245369 IP tom-Latitude-3570.36650 > ec2-52-56-97-80.eu-west-2.compute.amazonaws.com.8333: tcp 0
11:41:54.245546 IP tom-Latitude-3570.36650 > ec2-52-56-97-80.eu-west-2.compute.amazonaws.com.8333: tcp 24
11:41:54.245954 IP tom-Latitude-3570.36650 > ec2-52-56-97-80.eu-west-2.compute.amazonaws.com.8333: tcp 37
11:41:54.287760 IP ec2-52-56-97-80.eu-west-2.compute.amazonaws.com.8333 > tom-Latitude-3570.36650: tcp 0
11:41:54.287895 IP ec2-52-56-97-80.eu-west-2.compute.amazonaws.com.8333 > tom-Latitude-3570.36650: tcp 0
11:41:54.346363 IP ec2-52-56-97-80.eu-west-2.compute.amazonaws.com.8333 > tom-Latitude-3570.36650: tcp 24
11:41:54.346370 IP ec2-52-56-97-80.eu-west-2.compute.amazonaws.com.8333 > tom-Latitude-3570.36650: tcp 405
11:41:54.346381 IP tom-Latitude-3570.36650 > ec2-52-56-97-80.eu-west-2.compute.amazonaws.com.8333: tcp 0
11:41:54.494275 IP host93-234-110-95.serverdedicati.aruba.it.8333 > tom-Latitude-3570.34082: tcp 24
11:41:54.494618 IP host93-234-110-95.serverdedicati.aruba.it.8333 > tom-Latitude-3570.34082: tcp 397
11:41:54.494726 IP tom-Latitude-3570.34082 > host93-234-110-95.serverdedicati.aruba.it.8333: tcp 0
11:41:54.595119 IP tom-Latitude-3570.33922 > pool-108-20-207-31.bstnma.fios.verizon.net.8333: tcp 24
11:41:54.595517 IP tom-Latitude-3570.33922 > pool-108-20-207-31.bstnma.fios.verizon.net.8333: tcp 289
11:41:54.637780 IP pool-108-20-207-31.bstnma.fios.verizon.net.8333 > tom-Latitude-3570.33922: tcp 0
11:41:54.769923 IP 23.226.90.172.8333 > tom-Latitude-3570.56344: tcp 24
11:41:54.770015 IP 23.226.90.172.8333 > tom-Latitude-3570.56344: tcp 37
11:41:54.770147 IP tom-Latitude-3570.56344 > 23.226.90.172.8333: tcp 0
11:41:54.951569 IP 172.214.77.34.bc.googleusercontent.com.8333 > tom-Latitude-3570.56244: tcp 24
11:41:54.951588 IP tom-Latitude-3570.56244 > 172.214.77.34.bc.googleusercontent.com.8333: tcp 0
11:41:54.957520 IP 172.214.77.34.bc.googleusercontent.com.8333 > tom-Latitude-3570.56244: tcp 253
11:41:54.957602 IP tom-Latitude-3570.56244 > 172.214.77.34.bc.googleusercontent.com.8333: tcp 0
11:41:55.173031 IP 23.226.90.172.8333 > tom-Latitude-3570.56344: tcp 24
11:41:55.173044 IP 23.226.90.172.8333 > tom-Latitude-3570.56344: tcp 37
11:41:55.173064 IP tom-Latitude-3570.56344 > 23.226.90.172.8333: tcp 0
11:41:55.173149 IP tom-Latitude-3570.56344 > 23.226.90.172.8333: tcp 24
11:41:55.173482 IP tom-Latitude-3570.56344 > 23.226.90.172.8333: tcp 37
11:41:55.209572 IP 23.226.90.172.8333 > tom-Latitude-3570.56344: tcp 0
11:41:55.209694 IP 23.226.90.172.8333 > tom-Latitude-3570.56344: tcp 0
11:41:55.378843 IP 23.226.90.172.8333 > tom-Latitude-3570.56344: tcp 24
11:41:55.378982 IP 23.226.90.172.8333 > tom-Latitude-3570.56344: tcp 322
11:41:55.379047 IP tom-Latitude-3570.56344 > 23.226.90.172.8333: tcp 0
11:41:55.880262 IP tom-Latitude-3570.59818 > c-73-101-52-184.hsd1.pa.comcast.net.8333: tcp 24
11:41:55.880305 IP tom-Latitude-3570.33922 > pool-108-20-207-31.bstnma.fios.verizon.net.8333: tcp 24
11:41:55.881075 IP tom-Latitude-3570.33922 > pool-108-20-207-31.bstnma.fios.verizon.net.8333: tcp 37
11:41:55.881080 IP tom-Latitude-3570.59818 > c-73-101-52-184.hsd1.pa.comcast.net.8333: tcp 217
11:41:55.979755 IP tom-Latitude-3570.59818 > c-73-101-52-184.hsd1.pa.comcast.net.8333: tcp 217
11:41:55.991682 IP tom-Latitude-3570.33922 > pool-108-20-207-31.bstnma.fios.verizon.net.8333: tcp 37
11:41:56.227757 IP tom-Latitude-3570.59818 > c-73-101-52-184.hsd1.pa.comcast.net.8333: tcp 241
11:41:56.247774 IP tom-Latitude-3570.33922 > pool-108-20-207-31.bstnma.fios.verizon.net.8333: tcp 61
11:41:56.379805 IP c-73-101-52-184.hsd1.pa.comcast.net.8333 > tom-Latitude-3570.59818: tcp 0
11:41:56.380045 IP c-73-101-52-184.hsd1.pa.comcast.net.8333 > tom-Latitude-3570.59818: tcp 0
11:41:56.380067 IP pool-108-20-207-31.bstnma.fios.verizon.net.8333 > tom-Latitude-3570.33922: tcp 0
11:41:56.380070 IP c-73-101-52-184.hsd1.pa.comcast.net.8333 > tom-Latitude-3570.59818: tcp 0
11:41:56.380351 IP pool-108-20-207-31.bstnma.fios.verizon.net.8333 > tom-Latitude-3570.33922: tcp 0
11:41:56.380636 IP c-73-101-52-184.hsd1.pa.comcast.net.8333 > tom-Latitude-3570.59818: tcp 0
11:41:56.380656 IP pool-108-20-207-31.bstnma.fios.verizon.net.8333 > tom-Latitude-3570.33922: tcp 0
11:41:56.581358 IP tom-Latitude-3570.47742 > 97-82-78-25.dhcp.leds.al.charter.com.8333: tcp 24
11:41:56.581755 IP tom-Latitude-3570.47742 > 97-82-78-25.dhcp.leds.al.charter.com.8333: tcp 145
11:41:56.620828 IP 97-82-78-25.dhcp.leds.al.charter.com.8333 > tom-Latitude-3570.47742: tcp 0
11:41:57.182384 IP tom-Latitude-3570.47742 > 97-82-78-25.dhcp.leds.al.charter.com.8333: tcp 24
11:41:57.185157 IP tom-Latitude-3570.47742 > 97-82-78-25.dhcp.leds.al.charter.com.8333: tcp 31
11:41:57.247285 IP 97-82-78-25.dhcp.leds.al.charter.com.8333 > tom-Latitude-3570.47742: tcp 0
11:41:57.362903 IP pool-108-20-207-31.bstnma.fios.verizon.net.8333 > tom-Latitude-3570.33922: tcp 24
11:41:57.363029 IP pool-108-20-207-31.bstnma.fios.verizon.net.8333 > tom-Latitude-3570.33922: tcp 145
11:41:57.363046 IP tom-Latitude-3570.33922 > pool-108-20-207-31.bstnma.fios.verizon.net.8333: tcp 0
11:41:57.363215 IP tom-Latitude-3570.33922 > pool-108-20-207-31.bstnma.fios.verizon.net.8333: tcp 24
11:41:57.363926 IP tom-Latitude-3570.33922 > pool-108-20-207-31.bstnma.fios.verizon.net.8333: tcp 145
11:41:57.397955 IP pool-108-20-207-31.bstnma.fios.verizon.net.8333 > tom-Latitude-3570.33922: tcp 0
11:41:57.397961 IP pool-108-20-207-31.bstnma.fios.verizon.net.8333 > tom-Latitude-3570.33922: tcp 0
11:41:57.534862 IP pool-108-20-207-31.bstnma.fios.verizon.net.8333 > tom-Latitude-3570.33922: tcp 24
11:41:57.534872 IP pool-108-20-207-31.bstnma.fios.verizon.net.8333 > tom-Latitude-3570.33922: tcp 192
11:41:57.534875 IP pool-108-20-207-31.bstnma.fios.verizon.net.8333 > tom-Latitude-3570.33922: tcp 24
11:41:57.534877 IP pool-108-20-207-31.bstnma.fios.verizon.net.8333 > tom-Latitude-3570.33922: tcp 256
11:41:57.534879 IP pool-108-20-207-31.bstnma.fios.verizon.net.8333 > tom-Latitude-3570.33922: tcp 24
11:41:57.534881 IP pool-108-20-207-31.bstnma.fios.verizon.net.8333 > tom-Latitude-3570.33922: tcp 226
11:41:57.534882 IP pool-108-20-207-31.bstnma.fios.verizon.net.8333 > tom-Latitude-3570.33922: tcp 24
11:41:57.534884 IP pool-108-20-207-31.bstnma.fios.verizon.net.8333 > tom-Latitude-3570.33922: tcp 249
11:41:57.534948 IP tom-Latitude-3570.33922 > pool-108-20-207-31.bstnma.fios.verizon.net.8333: tcp 0
11:41:57.636242 IP tom-Latitude-3570.56118 > ns3051461.ip-51-255-95.eu.8333: tcp 24
11:41:57.636777 IP tom-Latitude-3570.56118 > ns3051461.ip-51-255-95.eu.8333: tcp 469
11:41:57.677849 IP ns3051461.ip-51-255-95.eu.8333 > tom-Latitude-3570.56118: tcp 0
11:41:57.836654 IP tom-Latitude-3570.59818 > c-73-101-52-184.hsd1.pa.comcast.net.8333: tcp 24
11:41:57.839622 IP tom-Latitude-3570.59818 > c-73-101-52-184.hsd1.pa.comcast.net.8333: tcp 145
11:41:57.868100 IP c-73-101-52-184.hsd1.pa.comcast.net.8333 > tom-Latitude-3570.59818: tcp 0
11:41:57.868105 IP c-73-101-52-184.hsd1.pa.comcast.net.8333 > tom-Latitude-3570.59818: tcp 0
11:41:57.997837 IP ec2-52-56-97-80.eu-west-2.compute.amazonaws.com.8333 > tom-Latitude-3570.36650: tcp 24
11:41:57.997850 IP ec2-52-56-97-80.eu-west-2.compute.amazonaws.com.8333 > tom-Latitude-3570.36650: tcp 289
11:41:57.997867 IP tom-Latitude-3570.36650 > ec2-52-56-97-80.eu-west-2.compute.amazonaws.com.8333: tcp 0
11:41:57.998123 IP tom-Latitude-3570.36650 > ec2-52-56-97-80.eu-west-2.compute.amazonaws.com.8333: tcp 24
11:41:58.042526 IP tom-Latitude-3570.36650 > ec2-52-56-97-80.eu-west-2.compute.amazonaws.com.8333: tcp 109
11:41:58.065448 IP ec2-52-56-97-80.eu-west-2.compute.amazonaws.com.8333 > tom-Latitude-3570.36650: tcp 289
11:41:58.065458 IP tom-Latitude-3570.36650 > ec2-52-56-97-80.eu-west-2.compute.amazonaws.com.8333: tcp 0
11:41:58.085917 IP ec2-52-56-97-80.eu-west-2.compute.amazonaws.com.8333 > tom-Latitude-3570.36650: tcp 0
11:41:58.085933 IP ec2-52-56-97-80.eu-west-2.compute.amazonaws.com.8333 > tom-Latitude-3570.36650: tcp 0
11:41:58.098314 IP tom-Latitude-3570.47742 > 97-82-78-25.dhcp.leds.al.charter.com.8333: tcp 24
11:41:58.102909 IP tom-Latitude-3570.47742 > 97-82-78-25.dhcp.leds.al.charter.com.8333: tcp 145
11:41:58.134902 IP ec2-52-56-97-80.eu-west-2.compute.amazonaws.com.8333 > tom-Latitude-3570.36650: tcp 24
11:41:58.134907 IP tom-Latitude-3570.36650 > ec2-52-56-97-80.eu-west-2.compute.amazonaws.com.8333: tcp 0
11:41:58.135116 IP ec2-52-56-97-80.eu-west-2.compute.amazonaws.com.8333 > tom-Latitude-3570.36650: tcp 406
11:41:58.135122 IP tom-Latitude-3570.36650 > ec2-52-56-97-80.eu-west-2.compute.amazonaws.com.8333: tcp 0
11:41:58.135263 IP tom-Latitude-3570.56344 > 23.226.90.172.8333: tcp 24
11:41:58.135772 IP tom-Latitude-3570.56344 > 23.226.90.172.8333: tcp 145
11:41:58.138109 IP ec2-52-56-97-80.eu-west-2.compute.amazonaws.com.8333 > tom-Latitude-3570.36650: tcp 1037
11:41:58.138114 IP tom-Latitude-3570.36650 > ec2-52-56-97-80.eu-west-2.compute.amazonaws.com.8333: tcp 0
11:41:58.145776 IP 97-82-78-25.dhcp.leds.al.charter.com.8333 > tom-Latitude-3570.47742: tcp 0
11:41:58.177845 IP 23.226.90.172.8333 > tom-Latitude-3570.56344: tcp 0
11:41:58.178407 IP 23.226.90.172.8333 > tom-Latitude-3570.56344: tcp 0
11:41:58.717966 IP c-73-101-52-184.hsd1.pa.comcast.net.8333 > tom-Latitude-3570.59818: tcp 24
11:41:58.717983 IP c-73-101-52-184.hsd1.pa.comcast.net.8333 > tom-Latitude-3570.59818: tcp 109
11:41:58.717986 IP c-73-101-52-184.hsd1.pa.comcast.net.8333 > tom-Latitude-3570.59818: tcp 109
11:41:58.718014 IP tom-Latitude-3570.59818 > c-73-101-52-184.hsd1.pa.comcast.net.8333: tcp 0
11:41:59.018756 IP tom-Latitude-3570.33922 > pool-108-20-207-31.bstnma.fios.verizon.net.8333: tcp 24
11:41:59.022998 IP tom-Latitude-3570.33922 > pool-108-20-207-31.bstnma.fios.verizon.net.8333: tcp 109
11:41:59.063283 IP pool-108-20-207-31.bstnma.fios.verizon.net.8333 > tom-Latitude-3570.33922: tcp 0
11:41:59.069125 IP pool-108-20-207-31.bstnma.fios.verizon.net.8333 > tom-Latitude-3570.33922: tcp 0
11:41:59.419516 IP tom-Latitude-3570.47742 > 97-82-78-25.dhcp.leds.al.charter.com.8333: tcp 24
11:41:59.421194 IP tom-Latitude-3570.47742 > 97-82-78-25.dhcp.leds.al.charter.com.8333: tcp 109
11:41:59.468797 IP 97-82-78-25.dhcp.leds.al.charter.com.8333 > tom-Latitude-3570.47742: tcp 0
11:41:59.679294 IP ns3051461.ip-51-255-95.eu.8333 > tom-Latitude-3570.56118: tcp 24
11:41:59.679307 IP ns3051461.ip-51-255-95.eu.8333 > tom-Latitude-3570.56118: tcp 145
11:41:59.679406 IP tom-Latitude-3570.56118 > ns3051461.ip-51-255-95.eu.8333: tcp 0
11:41:59.679545 IP tom-Latitude-3570.56118 > ns3051461.ip-51-255-95.eu.8333: tcp 24
11:41:59.680923 IP tom-Latitude-3570.56118 > ns3051461.ip-51-255-95.eu.8333: tcp 37
11:41:59.717969 IP ns3051461.ip-51-255-95.eu.8333 > tom-Latitude-3570.56118: tcp 0
11:41:59.776736 IP ns3051461.ip-51-255-95.eu.8333 > tom-Latitude-3570.56118: tcp 24
11:41:59.777476 IP ns3051461.ip-51-255-95.eu.8333 > tom-Latitude-3570.56118: tcp 818
11:41:59.777573 IP tom-Latitude-3570.56118 > ns3051461.ip-51-255-95.eu.8333: tcp 0
11:41:59.777688 IP tom-Latitude-3570.56244 > 172.214.77.34.bc.googleusercontent.com.8333: tcp 24
11:41:59.777972 IP tom-Latitude-3570.56244 > 172.214.77.34.bc.googleusercontent.com.8333: tcp 325
11:41:59.808483 IP 172.214.77.34.bc.googleusercontent.com.8333 > tom-Latitude-3570.56244: tcp 0
11:42:00.003818 IP host93-234-110-95.serverdedicati.aruba.it.8333 > tom-Latitude-3570.34082: tcp 24
11:42:00.003860 IP host93-234-110-95.serverdedicati.aruba.it.8333 > tom-Latitude-3570.34082: tcp 505
11:42:00.003944 IP tom-Latitude-3570.34082 > host93-234-110-95.serverdedicati.aruba.it.8333: tcp 0
11:42:00.004044 IP tom-Latitude-3570.47742 > 97-82-78-25.dhcp.leds.al.charter.com.8333: tcp 24
11:42:00.004275 IP tom-Latitude-3570.34082 > host93-234-110-95.serverdedicati.aruba.it.8333: tcp 24
11:42:00.004382 IP tom-Latitude-3570.47742 > 97-82-78-25.dhcp.leds.al.charter.com.8333: tcp 37
11:42:00.004597 IP tom-Latitude-3570.34082 > host93-234-110-95.serverdedicati.aruba.it.8333: tcp 181
11:42:00.038456 IP 97-82-78-25.dhcp.leds.al.charter.com.8333 > tom-Latitude-3570.47742: tcp 0
11:42:00.038488 IP host93-234-110-95.serverdedicati.aruba.it.8333 > tom-Latitude-3570.34082: tcp 0
11:42:00.038492 IP host93-234-110-95.serverdedicati.aruba.it.8333 > tom-Latitude-3570.34082: tcp 0
11:42:00.104487 IP tom-Latitude-3570.56344 > 23.226.90.172.8333: tcp 24
11:42:00.105042 IP tom-Latitude-3570.56344 > 23.226.90.172.8333: tcp 145
11:42:00.138180 IP host93-234-110-95.serverdedicati.aruba.it.8333 > tom-Latitude-3570.34082: tcp 24
11:42:00.138192 IP host93-234-110-95.serverdedicati.aruba.it.8333 > tom-Latitude-3570.34082: tcp 257
11:42:00.138197 IP host93-234-110-95.serverdedicati.aruba.it.8333 > tom-Latitude-3570.34082: tcp 24
11:42:00.138210 IP tom-Latitude-3570.34082 > host93-234-110-95.serverdedicati.aruba.it.8333: tcp 0
11:42:00.138361 IP host93-234-110-95.serverdedicati.aruba.it.8333 > tom-Latitude-3570.34082: tcp 257
11:42:00.138366 IP host93-234-110-95.serverdedicati.aruba.it.8333 > tom-Latitude-3570.34082: tcp 24
11:42:00.138369 IP host93-234-110-95.serverdedicati.aruba.it.8333 > tom-Latitude-3570.34082: tcp 257
11:42:00.138371 IP host93-234-110-95.serverdedicati.aruba.it.8333 > tom-Latitude-3570.34082: tcp 24
11:42:00.138373 IP host93-234-110-95.serverdedicati.aruba.it.8333 > tom-Latitude-3570.34082: tcp 224
11:42:00.138375 IP host93-234-110-95.serverdedicati.aruba.it.8333 > tom-Latitude-3570.34082: tcp 24
11:42:00.138377 IP host93-234-110-95.serverdedicati.aruba.it.8333 > tom-Latitude-3570.34082: tcp 373
11:42:00.138387 IP tom-Latitude-3570.34082 > host93-234-110-95.serverdedicati.aruba.it.8333: tcp 0
11:42:00.144124 IP 23.226.90.172.8333 > tom-Latitude-3570.56344: tcp 0
11:42:00.151887 IP 23.226.90.172.8333 > tom-Latitude-3570.56344: tcp 0
11:42:00.243412 IP tom-Latitude-3570.56344 > 23.226.90.172.8333: tcp 24
11:42:00.249688 IP tom-Latitude-3570.56344 > 23.226.90.172.8333: tcp 181
11:42:00.280877 IP 23.226.90.172.8333 > tom-Latitude-3570.56344: tcp 0
11:42:00.295667 IP 23.226.90.172.8333 > tom-Latitude-3570.56344: tcp 0
11:42:00.491056 IP 97-82-78-25.dhcp.leds.al.charter.com.8333 > tom-Latitude-3570.47742: tcp 24
11:42:00.491071 IP tom-Latitude-3570.47742 > 97-82-78-25.dhcp.leds.al.charter.com.8333: tcp 0
11:42:00.491104 IP 97-82-78-25.dhcp.leds.al.charter.com.8333 > tom-Latitude-3570.47742: tcp 217
11:42:00.491109 IP tom-Latitude-3570.47742 > 97-82-78-25.dhcp.leds.al.charter.com.8333: tcp 0
11:42:00.491259 IP tom-Latitude-3570.47742 > 97-82-78-25.dhcp.leds.al.charter.com.8333: tcp 24
11:42:00.491501 IP tom-Latitude-3570.47742 > 97-82-78-25.dhcp.leds.al.charter.com.8333: tcp 37
11:42:00.527502 IP 97-82-78-25.dhcp.leds.al.charter.com.8333 > tom-Latitude-3570.47742: tcp 0
11:42:00.591555 IP tom-Latitude-3570.33922 > pool-108-20-207-31.bstnma.fios.verizon.net.8333: tcp 24
11:42:00.595550 IP tom-Latitude-3570.33922 > pool-108-20-207-31.bstnma.fios.verizon.net.8333: tcp 217
11:42:00.635295 IP pool-108-20-207-31.bstnma.fios.verizon.net.8333 > tom-Latitude-3570.33922: tcp 0
11:42:00.636533 IP pool-108-20-207-31.bstnma.fios.verizon.net.8333 > tom-Latitude-3570.33922: tcp 0
11:42:00.696459 IP 97-82-78-25.dhcp.leds.al.charter.com.8333 > tom-Latitude-3570.47742: tcp 24
11:42:00.697005 IP 97-82-78-25.dhcp.leds.al.charter.com.8333 > tom-Latitude-3570.47742: tcp 191
11:42:00.697117 IP tom-Latitude-3570.47742 > 97-82-78-25.dhcp.leds.al.charter.com.8333: tcp 0
11:42:00.897819 IP tom-Latitude-3570.56344 > 23.226.90.172.8333: tcp 24
11:42:00.898568 IP tom-Latitude-3570.56344 > 23.226.90.172.8333: tcp 37
11:42:00.951109 IP 23.226.90.172.8333 > tom-Latitude-3570.56344: tcp 0
11:42:00.951215 IP host93-234-110-95.serverdedicati.aruba.it.8333 > tom-Latitude-3570.34082: tcp 24
11:42:00.951222 IP host93-234-110-95.serverdedicati.aruba.it.8333 > tom-Latitude-3570.34082: tcp 73
11:42:00.951224 IP 23.226.90.172.8333 > tom-Latitude-3570.56344: tcp 0
11:42:00.951233 IP tom-Latitude-3570.34082 > host93-234-110-95.serverdedicati.aruba.it.8333: tcp 0
11:42:00.951362 IP tom-Latitude-3570.34082 > host93-234-110-95.serverdedicati.aruba.it.8333: tcp 24
11:42:00.951689 IP tom-Latitude-3570.34082 > host93-234-110-95.serverdedicati.aruba.it.8333: tcp 37
11:42:00.971229 IP 23.226.90.172.8333 > tom-Latitude-3570.56344: tcp 24
11:42:00.971236 IP 23.226.90.172.8333 > tom-Latitude-3570.56344: tcp 73
11:42:00.971267 IP tom-Latitude-3570.56344 > 23.226.90.172.8333: tcp 0
11:42:00.992826 IP host93-234-110-95.serverdedicati.aruba.it.8333 > tom-Latitude-3570.34082: tcp 0
11:42:00.992848 IP host93-234-110-95.serverdedicati.aruba.it.8333 > tom-Latitude-3570.34082: tcp 0
11:42:01.071678 IP tom-Latitude-3570.33922 > pool-108-20-207-31.bstnma.fios.verizon.net.8333: tcp 24
11:42:01.072076 IP tom-Latitude-3570.33922 > pool-108-20-207-31.bstnma.fios.verizon.net.8333: tcp 37
11:42:01.080655 IP host93-234-110-95.serverdedicati.aruba.it.8333 > tom-Latitude-3570.34082: tcp 24
11:42:01.081222 IP host93-234-110-95.serverdedicati.aruba.it.8333 > tom-Latitude-3570.34082: tcp 764
11:42:01.081321 IP tom-Latitude-3570.34082 > host93-234-110-95.serverdedicati.aruba.it.8333: tcp 0
11:42:01.100848 IP pool-108-20-207-31.bstnma.fios.verizon.net.8333 > tom-Latitude-3570.33922: tcp 0
11:42:01.100857 IP 172.214.77.34.bc.googleusercontent.com.8333 > tom-Latitude-3570.56244: tcp 24
11:42:01.100866 IP tom-Latitude-3570.56244 > 172.214.77.34.bc.googleusercontent.com.8333: tcp 0
11:42:01.100874 IP 172.214.77.34.bc.googleusercontent.com.8333 > tom-Latitude-3570.56244: tcp 289
11:42:01.100897 IP tom-Latitude-3570.56244 > 172.214.77.34.bc.googleusercontent.com.8333: tcp 0
11:42:01.123839 IP pool-108-20-207-31.bstnma.fios.verizon.net.8333 > tom-Latitude-3570.33922: tcp 0
11:42:01.182793 IP ec2-52-56-97-80.eu-west-2.compute.amazonaws.com.8333 > tom-Latitude-3570.36650: tcp 24
11:42:01.182801 IP tom-Latitude-3570.36650 > ec2-52-56-97-80.eu-west-2.compute.amazonaws.com.8333: tcp 0
11:42:01.183453 IP ec2-52-56-97-80.eu-west-2.compute.amazonaws.com.8333 > tom-Latitude-3570.36650: tcp 289
11:42:01.183460 IP tom-Latitude-3570.36650 > ec2-52-56-97-80.eu-west-2.compute.amazonaws.com.8333: tcp 0
11:42:01.584500 IP tom-Latitude-3570.33922 > pool-108-20-207-31.bstnma.fios.verizon.net.8333: tcp 24
11:42:01.586732 IP tom-Latitude-3570.33922 > pool-108-20-207-31.bstnma.fios.verizon.net.8333: tcp 37
11:42:01.630622 IP pool-108-20-207-31.bstnma.fios.verizon.net.8333 > tom-Latitude-3570.33922: tcp 0
11:42:01.630634 IP pool-108-20-207-31.bstnma.fios.verizon.net.8333 > tom-Latitude-3570.33922: tcp 0
11:42:02.486161 IP tom-Latitude-3570.47742 > 97-82-78-25.dhcp.leds.al.charter.com.8333: tcp 24
11:42:02.486719 IP tom-Latitude-3570.47742 > 97-82-78-25.dhcp.leds.al.charter.com.8333: tcp 37
11:42:02.528756 IP 97-82-78-25.dhcp.leds.al.charter.com.8333 > tom-Latitude-3570.47742: tcp 24
11:42:02.528768 IP 97-82-78-25.dhcp.leds.al.charter.com.8333 > tom-Latitude-3570.47742: tcp 109
11:42:02.528771 IP 97-82-78-25.dhcp.leds.al.charter.com.8333 > tom-Latitude-3570.47742: tcp 109
11:42:02.528775 IP tom-Latitude-3570.47742 > 97-82-78-25.dhcp.leds.al.charter.com.8333: tcp 0
11:42:02.528941 IP tom-Latitude-3570.47742 > 97-82-78-25.dhcp.leds.al.charter.com.8333: tcp 24
11:42:02.528949 IP tom-Latitude-3570.47742 > 97-82-78-25.dhcp.leds.al.charter.com.8333: tcp 73
11:42:02.538726 IP 97-82-78-25.dhcp.leds.al.charter.com.8333 > tom-Latitude-3570.47742: tcp 0
11:42:02.553438 IP 23.226.90.172.8333 > tom-Latitude-3570.56344: tcp 24
11:42:02.561201 IP 23.226.90.172.8333 > tom-Latitude-3570.56344: tcp 109
11:42:02.561259 IP tom-Latitude-3570.56344 > 23.226.90.172.8333: tcp 0
11:42:02.561455 IP tom-Latitude-3570.56344 > 23.226.90.172.8333: tcp 24
11:42:02.561767 IP tom-Latitude-3570.56344 > 23.226.90.172.8333: tcp 37
11:42:02.566548 IP 97-82-78-25.dhcp.leds.al.charter.com.8333 > tom-Latitude-3570.47742: tcp 0
11:42:02.597982 IP 23.226.90.172.8333 > tom-Latitude-3570.56344: tcp 0
11:42:02.756027 IP 97-82-78-25.dhcp.leds.al.charter.com.8333 > tom-Latitude-3570.47742: tcp 24
11:42:02.762196 IP 97-82-78-25.dhcp.leds.al.charter.com.8333 > tom-Latitude-3570.47742: tcp 1460
11:42:02.762202 IP 97-82-78-25.dhcp.leds.al.charter.com.8333 > tom-Latitude-3570.47742: tcp 59
11:42:02.762203 IP 97-82-78-25.dhcp.leds.al.charter.com.8333 > tom-Latitude-3570.47742: tcp 24
11:42:02.762205 IP 97-82-78-25.dhcp.leds.al.charter.com.8333 > tom-Latitude-3570.47742: tcp 373
11:42:02.762275 IP tom-Latitude-3570.47742 > 97-82-78-25.dhcp.leds.al.charter.com.8333: tcp 0
11:42:02.772056 IP 23.226.90.172.8333 > tom-Latitude-3570.56344: tcp 24
11:42:02.772067 IP 23.226.90.172.8333 > tom-Latitude-3570.56344: tcp 248
11:42:02.772084 IP tom-Latitude-3570.56344 > 23.226.90.172.8333: tcp 0
11:42:02.923796 IP 172.214.77.34.bc.googleusercontent.com.8333 > tom-Latitude-3570.56244: tcp 24
11:42:02.923808 IP tom-Latitude-3570.56244 > 172.214.77.34.bc.googleusercontent.com.8333: tcp 0
11:42:02.923819 IP 172.214.77.34.bc.googleusercontent.com.8333 > tom-Latitude-3570.56244: tcp 145
11:42:02.923822 IP tom-Latitude-3570.56244 > 172.214.77.34.bc.googleusercontent.com.8333: tcp 0
11:42:02.924044 IP tom-Latitude-3570.47742 > 97-82-78-25.dhcp.leds.al.charter.com.8333: tcp 24
11:42:02.924122 IP tom-Latitude-3570.56244 > 172.214.77.34.bc.googleusercontent.com.8333: tcp 24
11:42:02.924361 IP tom-Latitude-3570.47742 > 97-82-78-25.dhcp.leds.al.charter.com.8333: tcp 37
11:42:02.924665 IP tom-Latitude-3570.56244 > 172.214.77.34.bc.googleusercontent.com.8333: tcp 37
11:42:02.959571 IP 97-82-78-25.dhcp.leds.al.charter.com.8333 > tom-Latitude-3570.47742: tcp 0
11:42:02.959580 IP 172.214.77.34.bc.googleusercontent.com.8333 > tom-Latitude-3570.56244: tcp 0
11:42:03.022224 IP 172.214.77.34.bc.googleusercontent.com.8333 > tom-Latitude-3570.56244: tcp 24
11:42:03.022650 IP 172.214.77.34.bc.googleusercontent.com.8333 > tom-Latitude-3570.56244: tcp 400
11:42:03.022749 IP tom-Latitude-3570.56244 > 172.214.77.34.bc.googleusercontent.com.8333: tcp 0
11:42:03.046424 IP 97-82-78-25.dhcp.leds.al.charter.com.8333 > tom-Latitude-3570.47742: tcp 24
11:42:03.046995 IP 97-82-78-25.dhcp.leds.al.charter.com.8333 > tom-Latitude-3570.47742: tcp 73
11:42:03.047055 IP tom-Latitude-3570.47742 > 97-82-78-25.dhcp.leds.al.charter.com.8333: tcp 0
11:42:03.047176 IP tom-Latitude-3570.47742 > 97-82-78-25.dhcp.leds.al.charter.com.8333: tcp 24
11:42:03.048925 IP tom-Latitude-3570.47742 > 97-82-78-25.dhcp.leds.al.charter.com.8333: tcp 37
11:42:03.103975 IP 97-82-78-25.dhcp.leds.al.charter.com.8333 > tom-Latitude-3570.47742: tcp 0
11:42:03.266417 IP 97-82-78-25.dhcp.leds.al.charter.com.8333 > tom-Latitude-3570.47742: tcp 24
11:42:03.303975 IP 97-82-78-25.dhcp.leds.al.charter.com.8333 > tom-Latitude-3570.47742: tcp 1460
11:42:03.303991 IP tom-Latitude-3570.47742 > 97-82-78-25.dhcp.leds.al.charter.com.8333: tcp 0
11:42:03.304691 IP 97-82-78-25.dhcp.leds.al.charter.com.8333 > tom-Latitude-3570.47742: tcp 1460
11:42:03.304697 IP 97-82-78-25.dhcp.leds.al.charter.com.8333 > tom-Latitude-3570.47742: tcp 1460
11:42:03.304700 IP 97-82-78-25.dhcp.leds.al.charter.com.8333 > tom-Latitude-3570.47742: tcp 1005
11:42:03.304790 IP tom-Latitude-3570.47742 > 97-82-78-25.dhcp.leds.al.charter.com.8333: tcp 0
11:42:03.504021 IP 172.214.77.34.bc.googleusercontent.com.8333 > tom-Latitude-3570.56244: tcp 24
11:42:03.504035 IP 172.214.77.34.bc.googleusercontent.com.8333 > tom-Latitude-3570.56244: tcp 37
11:42:03.504138 IP tom-Latitude-3570.56244 > 172.214.77.34.bc.googleusercontent.com.8333: tcp 0
11:42:04.005271 IP tom-Latitude-3570.34082 > host93-234-110-95.serverdedicati.aruba.it.8333: tcp 24
11:42:04.005681 IP tom-Latitude-3570.34082 > host93-234-110-95.serverdedicati.aruba.it.8333: tcp 181
11:42:04.052296 IP host93-234-110-95.serverdedicati.aruba.it.8333 > tom-Latitude-3570.34082: tcp 0
11:42:04.052298 IP host93-234-110-95.serverdedicati.aruba.it.8333 > tom-Latitude-3570.34082: tcp 0
11:42:04.105580 IP tom-Latitude-3570.33922 > pool-108-20-207-31.bstnma.fios.verizon.net.8333: tcp 24
11:42:04.113683 IP tom-Latitude-3570.33922 > pool-108-20-207-31.bstnma.fios.verizon.net.8333: tcp 181
11:42:04.138305 IP pool-108-20-207-31.bstnma.fios.verizon.net.8333 > tom-Latitude-3570.33922: tcp 0
11:42:04.147219 IP pool-108-20-207-31.bstnma.fios.verizon.net.8333 > tom-Latitude-3570.33922: tcp 0
11:42:04.205976 IP tom-Latitude-3570.36650 > ec2-52-56-97-80.eu-west-2.compute.amazonaws.com.8333: tcp 24
11:42:04.206381 IP tom-Latitude-3570.36650 > ec2-52-56-97-80.eu-west-2.compute.amazonaws.com.8333: tcp 181
11:42:04.238788 IP ec2-52-56-97-80.eu-west-2.compute.amazonaws.com.8333 > tom-Latitude-3570.36650: tcp 0
11:42:04.246179 IP ec2-52-56-97-80.eu-west-2.compute.amazonaws.com.8333 > tom-Latitude-3570.36650: tcp 0
11:42:04.799534 IP 23.226.90.172.8333 > tom-Latitude-3570.56344: tcp 24
11:42:04.804410 IP 23.226.90.172.8333 > tom-Latitude-3570.56344: tcp 289
11:42:04.804419 IP 23.226.90.172.8333 > tom-Latitude-3570.56344: tcp 289
11:42:04.804445 IP tom-Latitude-3570.56344 > 23.226.90.172.8333: tcp 0
11:42:04.804599 IP tom-Latitude-3570.56344 > 23.226.90.172.8333: tcp 24
11:42:04.804865 IP tom-Latitude-3570.56344 > 23.226.90.172.8333: tcp 217
11:42:04.836463 IP 23.226.90.172.8333 > tom-Latitude-3570.56344: tcp 0
11:42:05.006486 IP 23.226.90.172.8333 > tom-Latitude-3570.56344: tcp 24
11:42:05.010024 IP 23.226.90.172.8333 > tom-Latitude-3570.56344: tcp 1382
11:42:05.010123 IP tom-Latitude-3570.56344 > 23.226.90.172.8333: tcp 0
11:42:05.010464 IP 23.226.90.172.8333 > tom-Latitude-3570.56344: tcp 40
11:42:05.010470 IP 23.226.90.172.8333 > tom-Latitude-3570.56344: tcp 370
11:42:05.010475 IP 23.226.90.172.8333 > tom-Latitude-3570.56344: tcp 808
11:42:05.010477 IP 23.226.90.172.8333 > tom-Latitude-3570.56344: tcp 642
11:42:05.010537 IP tom-Latitude-3570.56344 > 23.226.90.172.8333: tcp 0
11:42:05.141694 IP 23.226.90.172.8333 > tom-Latitude-3570.56344: tcp 24
11:42:05.146506 IP 23.226.90.172.8333 > tom-Latitude-3570.56344: tcp 73
11:42:05.146606 IP tom-Latitude-3570.56344 > 23.226.90.172.8333: tcp 0
11:42:05.146709 IP tom-Latitude-3570.56344 > 23.226.90.172.8333: tcp 24
11:42:05.149361 IP tom-Latitude-3570.56344 > 23.226.90.172.8333: tcp 73
11:42:05.189621 IP 23.226.90.172.8333 > tom-Latitude-3570.56344: tcp 0
11:42:05.346295 IP 97-82-78-25.dhcp.leds.al.charter.com.8333 > tom-Latitude-3570.47742: tcp 24
11:42:05.346527 IP 97-82-78-25.dhcp.leds.al.charter.com.8333 > tom-Latitude-3570.47742: tcp 289
11:42:05.346543 IP tom-Latitude-3570.47742 > 97-82-78-25.dhcp.leds.al.charter.com.8333: tcp 0
11:42:05.368517 IP 23.226.90.172.8333 > tom-Latitude-3570.56344: tcp 24
11:42:05.371867 IP 23.226.90.172.8333 > tom-Latitude-3570.56344: tcp 1015
11:42:05.371962 IP tom-Latitude-3570.56344 > 23.226.90.172.8333: tcp 0
11:42:06.078110 IP 23.226.90.172.8333 > tom-Latitude-3570.56344: tcp 24
11:42:06.078122 IP 23.226.90.172.8333 > tom-Latitude-3570.56344: tcp 37
11:42:06.078218 IP tom-Latitude-3570.56344 > 23.226.90.172.8333: tcp 0
11:42:06.078387 IP tom-Latitude-3570.56344 > 23.226.90.172.8333: tcp 24
11:42:06.080953 IP tom-Latitude-3570.56344 > 23.226.90.172.8333: tcp 37
11:42:06.097938 IP 23.226.90.172.8333 > tom-Latitude-3570.56344: tcp 37
11:42:06.097945 IP tom-Latitude-3570.56344 > 23.226.90.172.8333: tcp 0
11:42:06.116143 IP 23.226.90.172.8333 > tom-Latitude-3570.56344: tcp 0
11:42:06.237804 IP pool-108-20-207-31.bstnma.fios.verizon.net.8333 > tom-Latitude-3570.33922: tcp 24
11:42:06.238187 IP pool-108-20-207-31.bstnma.fios.verizon.net.8333 > tom-Latitude-3570.33922: tcp 433
11:42:06.238289 IP tom-Latitude-3570.33922 > pool-108-20-207-31.bstnma.fios.verizon.net.8333: tcp 0
11:42:06.238613 IP tom-Latitude-3570.33922 > pool-108-20-207-31.bstnma.fios.verizon.net.8333: tcp 24
11:42:06.239566 IP tom-Latitude-3570.33922 > pool-108-20-207-31.bstnma.fios.verizon.net.8333: tcp 109
11:42:06.291893 IP 23.226.90.172.8333 > tom-Latitude-3570.56344: tcp 24
11:42:06.291932 IP tom-Latitude-3570.56344 > 23.226.90.172.8333: tcp 0
11:42:06.291943 IP 23.226.90.172.8333 > tom-Latitude-3570.56344: tcp 249
11:42:06.291947 IP tom-Latitude-3570.56344 > 23.226.90.172.8333: tcp 0
11:42:06.291949 IP pool-108-20-207-31.bstnma.fios.verizon.net.8333 > tom-Latitude-3570.33922: tcp 0
11:42:06.291953 IP pool-108-20-207-31.bstnma.fios.verizon.net.8333 > tom-Latitude-3570.33922: tcp 0
11:42:06.392734 IP tom-Latitude-3570.56244 > 172.214.77.34.bc.googleusercontent.com.8333: tcp 24
11:42:06.392858 IP tom-Latitude-3570.59818 > c-73-101-52-184.hsd1.pa.comcast.net.8333: tcp 24
11:42:06.393048 IP tom-Latitude-3570.56244 > 172.214.77.34.bc.googleusercontent.com.8333: tcp 325
11:42:06.395981 IP tom-Latitude-3570.59818 > c-73-101-52-184.hsd1.pa.comcast.net.8333: tcp 793
11:42:06.424173 IP pool-108-20-207-31.bstnma.fios.verizon.net.8333 > tom-Latitude-3570.33922: tcp 24
11:42:06.424188 IP pool-108-20-207-31.bstnma.fios.verizon.net.8333 > tom-Latitude-3570.33922: tcp 374
11:42:06.424193 IP pool-108-20-207-31.bstnma.fios.verizon.net.8333 > tom-Latitude-3570.33922: tcp 24
11:42:06.424254 IP tom-Latitude-3570.33922 > pool-108-20-207-31.bstnma.fios.verizon.net.8333: tcp 0
11:42:06.427228 IP pool-108-20-207-31.bstnma.fios.verizon.net.8333 > tom-Latitude-3570.33922: tcp 223
11:42:06.427463 IP pool-108-20-207-31.bstnma.fios.verizon.net.8333 > tom-Latitude-3570.33922: tcp 24
11:42:06.427468 IP pool-108-20-207-31.bstnma.fios.verizon.net.8333 > tom-Latitude-3570.33922: tcp 520
11:42:06.427470 IP c-73-101-52-184.hsd1.pa.comcast.net.8333 > tom-Latitude-3570.59818: tcp 0
11:42:06.427474 IP 172.214.77.34.bc.googleusercontent.com.8333 > tom-Latitude-3570.56244: tcp 0
11:42:06.427482 IP tom-Latitude-3570.33922 > pool-108-20-207-31.bstnma.fios.verizon.net.8333: tcp 0
11:42:06.429947 IP c-73-101-52-184.hsd1.pa.comcast.net.8333 > tom-Latitude-3570.59818: tcp 0
11:42:06.729896 IP tom-Latitude-3570.47742 > 97-82-78-25.dhcp.leds.al.charter.com.8333: tcp 24
11:42:06.730191 IP tom-Latitude-3570.47742 > 97-82-78-25.dhcp.leds.al.charter.com.8333: tcp 181
11:42:06.805544 IP 97-82-78-25.dhcp.leds.al.charter.com.8333 > tom-Latitude-3570.47742: tcp 0
11:42:06.930354 IP tom-Latitude-3570.36650 > ec2-52-56-97-80.eu-west-2.compute.amazonaws.com.8333: tcp 24
11:42:06.930386 IP tom-Latitude-3570.59818 > c-73-101-52-184.hsd1.pa.comcast.net.8333: tcp 24
11:42:06.933591 IP tom-Latitude-3570.59818 > c-73-101-52-184.hsd1.pa.comcast.net.8333: tcp 109
11:42:06.933597 IP tom-Latitude-3570.36650 > ec2-52-56-97-80.eu-west-2.compute.amazonaws.com.8333: tcp 433
11:42:06.992983 IP c-73-101-52-184.hsd1.pa.comcast.net.8333 > tom-Latitude-3570.59818: tcp 0
11:42:07.002798 IP ec2-52-56-97-80.eu-west-2.compute.amazonaws.com.8333 > tom-Latitude-3570.36650: tcp 0
11:42:07.002804 IP c-73-101-52-184.hsd1.pa.comcast.net.8333 > tom-Latitude-3570.59818: tcp 0
11:42:07.009966 IP ec2-52-56-97-80.eu-west-2.compute.amazonaws.com.8333 > tom-Latitude-3570.36650: tcp 0
11:42:07.027377 IP host93-234-110-95.serverdedicati.aruba.it.8333 > tom-Latitude-3570.34082: tcp 24
11:42:07.027387 IP host93-234-110-95.serverdedicati.aruba.it.8333 > tom-Latitude-3570.34082: tcp 685
11:42:07.027496 IP tom-Latitude-3570.34082 > host93-234-110-95.serverdedicati.aruba.it.8333: tcp 0
11:42:07.027831 IP tom-Latitude-3570.34082 > host93-234-110-95.serverdedicati.aruba.it.8333: tcp 24
11:42:07.030108 IP tom-Latitude-3570.34082 > host93-234-110-95.serverdedicati.aruba.it.8333: tcp 253
