10:11:35.163708 IP tom-Latitude-3570.43084 > 47.244.214.69.8333: tcp 55
10:11:35.201498 IP 185.207.232.56.8333 > tom-Latitude-3570.60304: tcp 24
10:11:35.201512 IP tom-Latitude-3570.60304 > 185.207.232.56.8333: tcp 0
10:11:35.212199 IP 185.207.232.56.8333 > tom-Latitude-3570.60304: tcp 937
10:11:35.212204 IP tom-Latitude-3570.60304 > 185.207.232.56.8333: tcp 0
10:11:35.215747 IP 47.244.214.69.8333 > tom-Latitude-3570.43084: tcp 0
10:11:35.594133 IP 23.226.90.172.8333 > tom-Latitude-3570.56010: tcp 853
10:11:35.594154 IP tom-Latitude-3570.56010 > 23.226.90.172.8333: tcp 55
10:11:35.600881 IP tom-Latitude-3570.56010 > 23.226.90.172.8333: tcp 781
10:11:35.618099 IP 47.244.214.69.8333 > tom-Latitude-3570.43084: tcp 601
10:11:35.618135 IP tom-Latitude-3570.43084 > 47.244.214.69.8333: tcp 0
10:11:35.631920 IP 23.226.90.172.8333 > tom-Latitude-3570.56010: tcp 0
10:11:35.671804 IP 104-62-47-181.lightspeed.bcvloh.sbcglobal.net.8333 > tom-Latitude-3570.33742: tcp 565
10:11:35.671826 IP tom-Latitude-3570.33742 > 104-62-47-181.lightspeed.bcvloh.sbcglobal.net.8333: tcp 133
10:11:35.678162 IP 23.226.90.172.8333 > tom-Latitude-3570.56010: tcp 0
10:11:35.738595 IP 104-62-47-181.lightspeed.bcvloh.sbcglobal.net.8333 > tom-Latitude-3570.33742: tcp 0
10:11:35.848182 IP 23.226.90.172.8333 > tom-Latitude-3570.56010: tcp 24
10:11:35.856147 IP 23.226.90.172.8333 > tom-Latitude-3570.56010: tcp 722
10:11:35.856175 IP tom-Latitude-3570.56010 > 23.226.90.172.8333: tcp 0
10:11:35.862779 IP 23.226.90.172.8333 > tom-Latitude-3570.56010: tcp 643
10:11:35.872730 IP 23.226.90.172.8333 > tom-Latitude-3570.56010: tcp 1283
10:11:35.872798 IP tom-Latitude-3570.56010 > 23.226.90.172.8333: tcp 0
10:11:35.881302 IP 23.226.90.172.8333 > tom-Latitude-3570.56010: tcp 487
10:11:35.896180 IP static.93.100.202.116.clients.your-server.de.8333 > tom-Latitude-3570.38996: tcp 781
10:11:35.896199 IP tom-Latitude-3570.38996 > static.93.100.202.116.clients.your-server.de.8333: tcp 133
10:11:35.923724 IP tom-Latitude-3570.56010 > 23.226.90.172.8333: tcp 0
10:11:35.931683 IP tom-Latitude-3570.52038 > 47.52.161.242.8333: tcp 133
10:11:35.931689 IP tom-Latitude-3570.35144 > vmd25034.contaboserver.net.8333: tcp 218
10:11:35.981930 IP static.93.100.202.116.clients.your-server.de.8333 > tom-Latitude-3570.38996: tcp 0
10:11:35.982984 IP 47.52.161.242.8333 > tom-Latitude-3570.52038: tcp 0
10:11:35.990570 IP vmd25034.contaboserver.net.8333 > tom-Latitude-3570.35144: tcp 0
10:11:35.996609 IP tom-Latitude-3570.60304 > 185.207.232.56.8333: tcp 24
10:11:35.996671 IP tom-Latitude-3570.35144 > vmd25034.contaboserver.net.8333: tcp 24
10:11:35.996850 IP tom-Latitude-3570.60304 > 185.207.232.56.8333: tcp 289
10:11:35.997086 IP tom-Latitude-3570.35144 > vmd25034.contaboserver.net.8333: tcp 289
10:11:36.027329 IP 23.226.90.172.8333 > tom-Latitude-3570.56010: tcp 1382
10:11:36.027346 IP tom-Latitude-3570.56010 > 23.226.90.172.8333: tcp 0
10:11:36.028125 IP tom-Latitude-3570.56010 > 23.226.90.172.8333: tcp 24
10:11:36.029510 IP 23.226.90.172.8333 > tom-Latitude-3570.56010: tcp 40
10:11:36.029802 IP tom-Latitude-3570.56010 > 23.226.90.172.8333: tcp 37
10:11:36.036399 IP 23.226.90.172.8333 > tom-Latitude-3570.56010: tcp 1382
10:11:36.039454 IP 23.226.90.172.8333 > tom-Latitude-3570.56010: tcp 40
10:11:36.039459 IP tom-Latitude-3570.56010 > 23.226.90.172.8333: tcp 0
10:11:36.044565 IP 23.226.90.172.8333 > tom-Latitude-3570.56010: tcp 1085
10:11:36.045205 IP tom-Latitude-3570.56010 > 23.226.90.172.8333: tcp 24
10:11:36.045215 IP tom-Latitude-3570.56010 > 23.226.90.172.8333: tcp 37
10:11:36.045678 IP tom-Latitude-3570.56010 > 23.226.90.172.8333: tcp 61
10:11:36.103789 IP tom-Latitude-3570.60304 > 185.207.232.56.8333: tcp 289
10:11:36.119785 IP tom-Latitude-3570.35144 > vmd25034.contaboserver.net.8333: tcp 289
10:11:36.125054 IP 185.207.232.56.8333 > tom-Latitude-3570.60304: tcp 0
10:11:36.140244 IP vmd25034.contaboserver.net.8333 > tom-Latitude-3570.35144: tcp 0
10:11:36.143529 IP 185.207.232.56.8333 > tom-Latitude-3570.60304: tcp 0
10:11:36.150947 IP vmd25034.contaboserver.net.8333 > tom-Latitude-3570.35144: tcp 0
10:11:36.156473 IP 23.226.90.172.8333 > tom-Latitude-3570.56010: tcp 0
10:11:36.165134 IP 23.226.90.172.8333 > tom-Latitude-3570.56010: tcp 0
10:11:36.188090 IP 23.226.90.172.8333 > tom-Latitude-3570.56010: tcp 0
10:11:36.188830 IP 23.226.90.172.8333 > tom-Latitude-3570.56010: tcp 0
10:11:36.204067 IP 23.226.90.172.8333 > tom-Latitude-3570.56010: tcp 0
10:11:36.227534 IP vmd25034.contaboserver.net.8333 > tom-Latitude-3570.35144: tcp 0
10:11:36.228249 IP 185.207.232.56.8333 > tom-Latitude-3570.60304: tcp 0
10:11:36.329408 IP static-87-75-105-186.vodafonexdsl.co.uk.8333 > tom-Latitude-3570.47264: tcp 950
10:11:36.329424 IP tom-Latitude-3570.47264 > static-87-75-105-186.vodafonexdsl.co.uk.8333: tcp 218
10:11:36.329760 IP tom-Latitude-3570.52038 > 47.52.161.242.8333: tcp 24
10:11:36.329838 IP tom-Latitude-3570.33742 > 104-62-47-181.lightspeed.bcvloh.sbcglobal.net.8333: tcp 24
10:11:36.332436 IP tom-Latitude-3570.33742 > 104-62-47-181.lightspeed.bcvloh.sbcglobal.net.8333: tcp 613
10:11:36.332442 IP tom-Latitude-3570.52038 > 47.52.161.242.8333: tcp 613
10:11:36.334512 IP 23.226.90.172.8333 > tom-Latitude-3570.56010: tcp 24
10:11:36.334518 IP 23.226.90.172.8333 > tom-Latitude-3570.56010: tcp 37
10:11:36.334547 IP tom-Latitude-3570.56010 > 23.226.90.172.8333: tcp 0
10:11:36.355005 IP 23.226.90.172.8333 > tom-Latitude-3570.56010: tcp 24
10:11:36.355013 IP 23.226.90.172.8333 > tom-Latitude-3570.56010: tcp 37
10:11:36.355066 IP tom-Latitude-3570.56010 > 23.226.90.172.8333: tcp 0
10:11:36.357014 IP 23.226.90.172.8333 > tom-Latitude-3570.56010: tcp 24
10:11:36.364890 IP static-87-75-105-186.vodafonexdsl.co.uk.8333 > tom-Latitude-3570.47264: tcp 0
10:11:36.365926 IP 47.52.161.242.8333 > tom-Latitude-3570.52038: tcp 0
10:11:36.368485 IP 104-62-47-181.lightspeed.bcvloh.sbcglobal.net.8333 > tom-Latitude-3570.33742: tcp 0
10:11:36.389899 IP 104-62-47-181.lightspeed.bcvloh.sbcglobal.net.8333 > tom-Latitude-3570.33742: tcp 0
10:11:36.390570 IP 47.52.161.242.8333 > tom-Latitude-3570.52038: tcp 0
10:11:36.399725 IP tom-Latitude-3570.56010 > 23.226.90.172.8333: tcp 0
10:11:36.487315 IP vmd25034.contaboserver.net.8333 > tom-Latitude-3570.35144: tcp 853
10:11:36.487342 IP tom-Latitude-3570.35144 > vmd25034.contaboserver.net.8333: tcp 0
10:11:36.496506 IP 23.226.90.172.8333 > tom-Latitude-3570.56010: tcp 37
10:11:36.496513 IP tom-Latitude-3570.56010 > 23.226.90.172.8333: tcp 0
10:11:36.697221 IP tom-Latitude-3570.38996 > static.93.100.202.116.clients.your-server.de.8333: tcp 24
10:11:36.697925 IP tom-Latitude-3570.38996 > static.93.100.202.116.clients.your-server.de.8333: tcp 145
10:11:36.727651 IP 47.52.161.242.8333 > tom-Latitude-3570.52038: tcp 97
10:11:36.727661 IP tom-Latitude-3570.52038 > 47.52.161.242.8333: tcp 0
10:11:36.727754 IP tom-Latitude-3570.52038 > 47.52.161.242.8333: tcp 24
10:11:36.728280 IP tom-Latitude-3570.52038 > 47.52.161.242.8333: tcp 591
10:11:36.748469 IP static.93.100.202.116.clients.your-server.de.8333 > tom-Latitude-3570.38996: tcp 0
10:11:36.751989 IP static.93.100.202.116.clients.your-server.de.8333 > tom-Latitude-3570.38996: tcp 0
10:11:36.776339 IP 47.52.161.242.8333 > tom-Latitude-3570.52038: tcp 0
10:11:36.810828 IP 47.52.161.242.8333 > tom-Latitude-3570.52038: tcp 0
10:11:37.028361 IP tom-Latitude-3570.35144 > vmd25034.contaboserver.net.8333: tcp 24
10:11:37.029021 IP tom-Latitude-3570.35144 > vmd25034.contaboserver.net.8333: tcp 109
10:11:37.061025 IP vmd25034.contaboserver.net.8333 > tom-Latitude-3570.35144: tcp 0
10:11:37.061684 IP vmd25034.contaboserver.net.8333 > tom-Latitude-3570.35144: tcp 0
10:11:37.136674 IP 47.52.161.242.8333 > tom-Latitude-3570.52038: tcp 73
10:11:37.141711 IP 47.52.161.242.8333 > tom-Latitude-3570.52038: tcp 73
10:11:37.141840 IP tom-Latitude-3570.52038 > 47.52.161.242.8333: tcp 0
10:11:37.314574 IP vmd25034.contaboserver.net.8333 > tom-Latitude-3570.35144: tcp 24
10:11:37.314591 IP tom-Latitude-3570.35144 > vmd25034.contaboserver.net.8333: tcp 0
10:11:37.319354 IP vmd25034.contaboserver.net.8333 > tom-Latitude-3570.35144: tcp 361
10:11:37.319378 IP tom-Latitude-3570.35144 > vmd25034.contaboserver.net.8333: tcp 0
10:11:37.319870 IP tom-Latitude-3570.35144 > vmd25034.contaboserver.net.8333: tcp 24
10:11:37.321711 IP tom-Latitude-3570.35144 > vmd25034.contaboserver.net.8333: tcp 361
10:11:37.373315 IP vmd25034.contaboserver.net.8333 > tom-Latitude-3570.35144: tcp 0
10:11:37.378017 IP vmd25034.contaboserver.net.8333 > tom-Latitude-3570.35144: tcp 0
10:11:37.470004 IP vmd25034.contaboserver.net.8333 > tom-Latitude-3570.35144: tcp 24
10:11:37.472642 IP vmd25034.contaboserver.net.8333 > tom-Latitude-3570.35144: tcp 403
10:11:37.472658 IP vmd25034.contaboserver.net.8333 > tom-Latitude-3570.35144: tcp 24
10:11:37.472772 IP tom-Latitude-3570.35144 > vmd25034.contaboserver.net.8333: tcp 0
10:11:37.477240 IP vmd25034.contaboserver.net.8333 > tom-Latitude-3570.35144: tcp 403
10:11:37.477254 IP vmd25034.contaboserver.net.8333 > tom-Latitude-3570.35144: tcp 24
10:11:37.477357 IP tom-Latitude-3570.35144 > vmd25034.contaboserver.net.8333: tcp 0
10:11:37.481636 IP vmd25034.contaboserver.net.8333 > tom-Latitude-3570.35144: tcp 403
10:11:37.486772 IP vmd25034.contaboserver.net.8333 > tom-Latitude-3570.35144: tcp 24
10:11:37.486890 IP tom-Latitude-3570.35144 > vmd25034.contaboserver.net.8333: tcp 0
10:11:37.496641 IP vmd25034.contaboserver.net.8333 > tom-Latitude-3570.35144: tcp 404
10:11:37.496659 IP vmd25034.contaboserver.net.8333 > tom-Latitude-3570.35144: tcp 24
10:11:37.496773 IP tom-Latitude-3570.35144 > vmd25034.contaboserver.net.8333: tcp 0
10:11:37.498673 IP vmd25034.contaboserver.net.8333 > tom-Latitude-3570.35144: tcp 222
10:11:37.539907 IP tom-Latitude-3570.35144 > vmd25034.contaboserver.net.8333: tcp 0
10:11:37.567173 IP vmd25034.contaboserver.net.8333 > tom-Latitude-3570.35144: tcp 1448
10:11:37.567197 IP tom-Latitude-3570.35144 > vmd25034.contaboserver.net.8333: tcp 0
10:11:37.568925 IP vmd25034.contaboserver.net.8333 > tom-Latitude-3570.35144: tcp 328
10:11:37.568939 IP tom-Latitude-3570.35144 > vmd25034.contaboserver.net.8333: tcp 0
10:11:37.569257 IP tom-Latitude-3570.35144 > vmd25034.contaboserver.net.8333: tcp 24
10:11:37.571690 IP tom-Latitude-3570.35144 > vmd25034.contaboserver.net.8333: tcp 37
10:11:37.610986 IP vmd25034.contaboserver.net.8333 > tom-Latitude-3570.35144: tcp 0
10:11:37.611560 IP vmd25034.contaboserver.net.8333 > tom-Latitude-3570.35144: tcp 0
10:11:37.680065 IP 185.207.232.56.8333 > tom-Latitude-3570.60304: tcp 735
10:11:37.680089 IP tom-Latitude-3570.60304 > 185.207.232.56.8333: tcp 0
10:11:37.691429 IP vmd25034.contaboserver.net.8333 > tom-Latitude-3570.35144: tcp 24
10:11:37.691443 IP vmd25034.contaboserver.net.8333 > tom-Latitude-3570.35144: tcp 37
10:11:37.691483 IP tom-Latitude-3570.35144 > vmd25034.contaboserver.net.8333: tcp 0
10:11:37.792048 IP tom-Latitude-3570.33742 > 104-62-47-181.lightspeed.bcvloh.sbcglobal.net.8333: tcp 24
10:11:37.792942 IP tom-Latitude-3570.33742 > 104-62-47-181.lightspeed.bcvloh.sbcglobal.net.8333: tcp 505
10:11:37.829253 IP 104-62-47-181.lightspeed.bcvloh.sbcglobal.net.8333 > tom-Latitude-3570.33742: tcp 0
10:11:37.842206 IP 104-62-47-181.lightspeed.bcvloh.sbcglobal.net.8333 > tom-Latitude-3570.33742: tcp 0
10:11:37.961215 IP 104-62-47-181.lightspeed.bcvloh.sbcglobal.net.8333 > tom-Latitude-3570.33742: tcp 24
10:11:37.961234 IP tom-Latitude-3570.33742 > 104-62-47-181.lightspeed.bcvloh.sbcglobal.net.8333: tcp 0
10:11:37.965373 IP 104-62-47-181.lightspeed.bcvloh.sbcglobal.net.8333 > tom-Latitude-3570.33742: tcp 289
10:11:37.965391 IP tom-Latitude-3570.33742 > 104-62-47-181.lightspeed.bcvloh.sbcglobal.net.8333: tcp 0
10:11:37.992893 IP tom-Latitude-3570.38996 > static.93.100.202.116.clients.your-server.de.8333: tcp 24
10:11:37.994213 IP tom-Latitude-3570.38996 > static.93.100.202.116.clients.your-server.de.8333: tcp 397
10:11:38.032376 IP static.93.100.202.116.clients.your-server.de.8333 > tom-Latitude-3570.38996: tcp 0
10:11:38.032985 IP static.93.100.202.116.clients.your-server.de.8333 > tom-Latitude-3570.38996: tcp 0
10:11:38.595065 IP tom-Latitude-3570.52038 > 47.52.161.242.8333: tcp 24
10:11:38.595653 IP tom-Latitude-3570.52038 > 47.52.161.242.8333: tcp 505
10:11:38.631785 IP 47.52.161.242.8333 > tom-Latitude-3570.52038: tcp 0
10:11:38.632680 IP 47.52.161.242.8333 > tom-Latitude-3570.52038: tcp 0
10:11:38.695542 IP tom-Latitude-3570.43084 > 47.244.214.69.8333: tcp 24
10:11:38.695661 IP tom-Latitude-3570.47264 > static-87-75-105-186.vodafonexdsl.co.uk.8333: tcp 24
10:11:38.696875 IP tom-Latitude-3570.47264 > static-87-75-105-186.vodafonexdsl.co.uk.8333: tcp 433
10:11:38.696885 IP tom-Latitude-3570.43084 > 47.244.214.69.8333: tcp 613
10:11:38.729093 IP 47.244.214.69.8333 > tom-Latitude-3570.43084: tcp 0
10:11:38.732721 IP static-87-75-105-186.vodafonexdsl.co.uk.8333 > tom-Latitude-3570.47264: tcp 0
10:11:38.733476 IP static-87-75-105-186.vodafonexdsl.co.uk.8333 > tom-Latitude-3570.47264: tcp 0
10:11:38.745526 IP 47.244.214.69.8333 > tom-Latitude-3570.43084: tcp 0
10:11:38.882004 IP 104-62-47-181.lightspeed.bcvloh.sbcglobal.net.8333 > tom-Latitude-3570.33742: tcp 637
10:11:38.882030 IP tom-Latitude-3570.33742 > 104-62-47-181.lightspeed.bcvloh.sbcglobal.net.8333: tcp 0
10:11:38.882609 IP tom-Latitude-3570.33742 > 104-62-47-181.lightspeed.bcvloh.sbcglobal.net.8333: tcp 24
10:11:38.883044 IP tom-Latitude-3570.33742 > 104-62-47-181.lightspeed.bcvloh.sbcglobal.net.8333: tcp 145
10:11:38.919253 IP 104-62-47-181.lightspeed.bcvloh.sbcglobal.net.8333 > tom-Latitude-3570.33742: tcp 0
10:11:38.928904 IP 104-62-47-181.lightspeed.bcvloh.sbcglobal.net.8333 > tom-Latitude-3570.33742: tcp 0
10:11:38.957644 IP 47.52.161.242.8333 > tom-Latitude-3570.52038: tcp 61
10:11:38.957825 IP tom-Latitude-3570.60304 > 185.207.232.56.8333: tcp 24
10:11:38.957854 IP tom-Latitude-3570.52038 > 47.52.161.242.8333: tcp 24
10:11:38.959167 IP tom-Latitude-3570.52038 > 47.52.161.242.8333: tcp 283
10:11:38.959178 IP tom-Latitude-3570.60304 > 185.207.232.56.8333: tcp 181
10:11:38.994021 IP 185.207.232.56.8333 > tom-Latitude-3570.60304: tcp 0
10:11:38.997476 IP 47.52.161.242.8333 > tom-Latitude-3570.52038: tcp 0
10:11:39.014215 IP 47.52.161.242.8333 > tom-Latitude-3570.52038: tcp 0
10:11:39.014228 IP 185.207.232.56.8333 > tom-Latitude-3570.60304: tcp 0
10:11:39.088596 IP 104-62-47-181.lightspeed.bcvloh.sbcglobal.net.8333 > tom-Latitude-3570.33742: tcp 24
10:11:39.088614 IP 104-62-47-181.lightspeed.bcvloh.sbcglobal.net.8333 > tom-Latitude-3570.33742: tcp 676
10:11:39.088727 IP tom-Latitude-3570.33742 > 104-62-47-181.lightspeed.bcvloh.sbcglobal.net.8333: tcp 0
10:11:39.101816 IP 104-62-47-181.lightspeed.bcvloh.sbcglobal.net.8333 > tom-Latitude-3570.33742: tcp 838
10:11:39.143886 IP tom-Latitude-3570.33742 > 104-62-47-181.lightspeed.bcvloh.sbcglobal.net.8333: tcp 0
10:11:39.339059 IP 47.52.161.242.8333 > tom-Latitude-3570.52038: tcp 73
10:11:39.379913 IP tom-Latitude-3570.52038 > 47.52.161.242.8333: tcp 0
10:11:39.426870 IP static-87-75-105-186.vodafonexdsl.co.uk.8333 > tom-Latitude-3570.47264: tcp 24
10:11:39.447354 IP static-87-75-105-186.vodafonexdsl.co.uk.8333 > tom-Latitude-3570.47264: tcp 217
10:11:39.447481 IP tom-Latitude-3570.47264 > static-87-75-105-186.vodafonexdsl.co.uk.8333: tcp 0
10:11:39.447711 IP tom-Latitude-3570.47264 > static-87-75-105-186.vodafonexdsl.co.uk.8333: tcp 24
10:11:39.448028 IP tom-Latitude-3570.47264 > static-87-75-105-186.vodafonexdsl.co.uk.8333: tcp 73
10:11:39.478540 IP static-87-75-105-186.vodafonexdsl.co.uk.8333 > tom-Latitude-3570.47264: tcp 0
10:11:39.482137 IP static-87-75-105-186.vodafonexdsl.co.uk.8333 > tom-Latitude-3570.47264: tcp 0
10:11:39.549587 IP static-87-75-105-186.vodafonexdsl.co.uk.8333 > tom-Latitude-3570.47264: tcp 24
10:11:39.550691 IP static-87-75-105-186.vodafonexdsl.co.uk.8333 > tom-Latitude-3570.47264: tcp 257
10:11:39.550819 IP tom-Latitude-3570.47264 > static-87-75-105-186.vodafonexdsl.co.uk.8333: tcp 0
10:11:39.552060 IP static-87-75-105-186.vodafonexdsl.co.uk.8333 > tom-Latitude-3570.47264: tcp 24
10:11:39.553484 IP static-87-75-105-186.vodafonexdsl.co.uk.8333 > tom-Latitude-3570.47264: tcp 404
10:11:39.553635 IP tom-Latitude-3570.47264 > static-87-75-105-186.vodafonexdsl.co.uk.8333: tcp 0
10:11:39.654648 IP tom-Latitude-3570.60304 > 185.207.232.56.8333: tcp 24
10:11:39.655236 IP tom-Latitude-3570.60304 > 185.207.232.56.8333: tcp 217
10:11:39.688709 IP 185.207.232.56.8333 > tom-Latitude-3570.60304: tcp 0
10:11:39.691235 IP 185.207.232.56.8333 > tom-Latitude-3570.60304: tcp 0
10:11:39.826883 IP 23.226.90.172.8333 > tom-Latitude-3570.56010: tcp 721
10:11:39.826900 IP tom-Latitude-3570.56010 > 23.226.90.172.8333: tcp 0
10:11:39.884864 IP 23.226.90.172.8333 > tom-Latitude-3570.56010: tcp 24
10:11:39.884889 IP tom-Latitude-3570.56010 > 23.226.90.172.8333: tcp 0
10:11:39.885288 IP tom-Latitude-3570.56010 > 23.226.90.172.8333: tcp 24
10:11:39.885618 IP tom-Latitude-3570.56010 > 23.226.90.172.8333: tcp 145
10:11:39.918586 IP 23.226.90.172.8333 > tom-Latitude-3570.56010: tcp 0
10:11:39.930362 IP 23.226.90.172.8333 > tom-Latitude-3570.56010: tcp 0
10:11:40.100309 IP 23.226.90.172.8333 > tom-Latitude-3570.56010: tcp 24
10:11:40.100323 IP 23.226.90.172.8333 > tom-Latitude-3570.56010: tcp 962
10:11:40.100340 IP tom-Latitude-3570.56010 > 23.226.90.172.8333: tcp 0
10:11:40.103612 IP 23.226.90.172.8333 > tom-Latitude-3570.56010: tcp 1126
10:11:40.103955 IP tom-Latitude-3570.56010 > 23.226.90.172.8333: tcp 24
10:11:40.105309 IP tom-Latitude-3570.56010 > 23.226.90.172.8333: tcp 73
10:11:40.152777 IP vmd25034.contaboserver.net.8333 > tom-Latitude-3570.35144: tcp 24
10:11:40.152797 IP vmd25034.contaboserver.net.8333 > tom-Latitude-3570.35144: tcp 325
10:11:40.152910 IP tom-Latitude-3570.35144 > vmd25034.contaboserver.net.8333: tcp 0
10:11:40.155395 IP 23.226.90.172.8333 > tom-Latitude-3570.56010: tcp 0
10:11:40.160338 IP 23.226.90.172.8333 > tom-Latitude-3570.56010: tcp 0
10:11:40.330574 IP 23.226.90.172.8333 > tom-Latitude-3570.56010: tcp 24
10:11:40.330588 IP 23.226.90.172.8333 > tom-Latitude-3570.56010: tcp 73
10:11:40.330643 IP tom-Latitude-3570.56010 > 23.226.90.172.8333: tcp 0
10:11:40.731426 IP tom-Latitude-3570.47264 > static-87-75-105-186.vodafonexdsl.co.uk.8333: tcp 24
10:11:40.732517 IP tom-Latitude-3570.47264 > static-87-75-105-186.vodafonexdsl.co.uk.8333: tcp 109
10:11:40.761289 IP static-87-75-105-186.vodafonexdsl.co.uk.8333 > tom-Latitude-3570.47264: tcp 0
10:11:40.769267 IP static-87-75-105-186.vodafonexdsl.co.uk.8333 > tom-Latitude-3570.47264: tcp 0
10:11:41.273820 IP 47.52.161.242.8333 > tom-Latitude-3570.52038: tcp 565
10:11:41.273844 IP tom-Latitude-3570.52038 > 47.52.161.242.8333: tcp 0
10:11:41.274215 IP tom-Latitude-3570.52038 > 47.52.161.242.8333: tcp 24
10:11:41.277567 IP tom-Latitude-3570.52038 > 47.52.161.242.8333: tcp 109
10:11:41.338510 IP 47.52.161.242.8333 > tom-Latitude-3570.52038: tcp 0
10:11:41.360517 IP 47.52.161.242.8333 > tom-Latitude-3570.52038: tcp 0
10:11:41.610112 IP 104-62-47-181.lightspeed.bcvloh.sbcglobal.net.8333 > tom-Latitude-3570.33742: tcp 24
10:11:41.610135 IP tom-Latitude-3570.33742 > 104-62-47-181.lightspeed.bcvloh.sbcglobal.net.8333: tcp 0
10:11:41.610169 IP 104-62-47-181.lightspeed.bcvloh.sbcglobal.net.8333 > tom-Latitude-3570.33742: tcp 469
10:11:41.610187 IP tom-Latitude-3570.33742 > 104-62-47-181.lightspeed.bcvloh.sbcglobal.net.8333: tcp 0
10:11:41.610535 IP tom-Latitude-3570.33742 > 104-62-47-181.lightspeed.bcvloh.sbcglobal.net.8333: tcp 24
10:11:41.612736 IP tom-Latitude-3570.33742 > 104-62-47-181.lightspeed.bcvloh.sbcglobal.net.8333: tcp 145
10:11:41.641665 IP 104-62-47-181.lightspeed.bcvloh.sbcglobal.net.8333 > tom-Latitude-3570.33742: tcp 0
10:11:41.652195 IP 104-62-47-181.lightspeed.bcvloh.sbcglobal.net.8333 > tom-Latitude-3570.33742: tcp 0
10:11:41.688902 IP 47.52.161.242.8333 > tom-Latitude-3570.52038: tcp 527
10:11:41.688920 IP 47.52.161.242.8333 > tom-Latitude-3570.52038: tcp 544
10:11:41.689003 IP tom-Latitude-3570.52038 > 47.52.161.242.8333: tcp 0
10:11:41.690166 IP tom-Latitude-3570.52038 > 47.52.161.242.8333: tcp 24
10:11:41.691242 IP 47.52.161.242.8333 > tom-Latitude-3570.52038: tcp 247
10:11:41.692062 IP tom-Latitude-3570.52038 > 47.52.161.242.8333: tcp 109
10:11:41.722529 IP 47.52.161.242.8333 > tom-Latitude-3570.52038: tcp 0
10:11:41.724142 IP 47.52.161.242.8333 > tom-Latitude-3570.52038: tcp 0
10:11:41.792094 IP tom-Latitude-3570.47264 > static-87-75-105-186.vodafonexdsl.co.uk.8333: tcp 24
10:11:41.792678 IP tom-Latitude-3570.47264 > static-87-75-105-186.vodafonexdsl.co.uk.8333: tcp 73
10:11:41.808832 IP 104-62-47-181.lightspeed.bcvloh.sbcglobal.net.8333 > tom-Latitude-3570.33742: tcp 24
10:11:41.814826 IP 104-62-47-181.lightspeed.bcvloh.sbcglobal.net.8333 > tom-Latitude-3570.33742: tcp 742
10:11:41.814845 IP 104-62-47-181.lightspeed.bcvloh.sbcglobal.net.8333 > tom-Latitude-3570.33742: tcp 677
10:11:41.814955 IP tom-Latitude-3570.33742 > 104-62-47-181.lightspeed.bcvloh.sbcglobal.net.8333: tcp 0
10:11:41.843075 IP static-87-75-105-186.vodafonexdsl.co.uk.8333 > tom-Latitude-3570.47264: tcp 0
10:11:41.844483 IP static-87-75-105-186.vodafonexdsl.co.uk.8333 > tom-Latitude-3570.47264: tcp 0
10:11:42.060039 IP 47.52.161.242.8333 > tom-Latitude-3570.52038: tcp 133
10:11:42.060271 IP tom-Latitude-3570.38996 > static.93.100.202.116.clients.your-server.de.8333: tcp 24
10:11:42.062830 IP tom-Latitude-3570.38996 > static.93.100.202.116.clients.your-server.de.8333: tcp 8
10:11:42.096861 IP static.93.100.202.116.clients.your-server.de.8333 > tom-Latitude-3570.38996: tcp 0
10:11:42.096975 IP static.93.100.202.116.clients.your-server.de.8333 > tom-Latitude-3570.38996: tcp 0
10:11:42.103880 IP tom-Latitude-3570.52038 > 47.52.161.242.8333: tcp 0
10:11:42.182794 IP static.93.100.202.116.clients.your-server.de.8333 > tom-Latitude-3570.38996: tcp 32
10:11:42.223903 IP tom-Latitude-3570.38996 > static.93.100.202.116.clients.your-server.de.8333: tcp 0
10:11:42.317096 IP static.93.100.202.116.clients.your-server.de.8333 > tom-Latitude-3570.38996: tcp 32
10:11:42.317112 IP tom-Latitude-3570.38996 > static.93.100.202.116.clients.your-server.de.8333: tcp 0
10:11:42.317351 IP tom-Latitude-3570.38996 > static.93.100.202.116.clients.your-server.de.8333: tcp 24
10:11:42.319156 IP tom-Latitude-3570.38996 > static.93.100.202.116.clients.your-server.de.8333: tcp 8
10:11:42.358265 IP static.93.100.202.116.clients.your-server.de.8333 > tom-Latitude-3570.38996: tcp 0
10:11:42.383037 IP static.93.100.202.116.clients.your-server.de.8333 > tom-Latitude-3570.38996: tcp 0
10:11:42.602003 IP vmd25034.contaboserver.net.8333 > tom-Latitude-3570.35144: tcp 24
10:11:42.602021 IP vmd25034.contaboserver.net.8333 > tom-Latitude-3570.35144: tcp 469
10:11:42.602115 IP tom-Latitude-3570.35144 > vmd25034.contaboserver.net.8333: tcp 0
10:11:42.602285 IP tom-Latitude-3570.47264 > static-87-75-105-186.vodafonexdsl.co.uk.8333: tcp 24
10:11:42.602498 IP tom-Latitude-3570.35144 > vmd25034.contaboserver.net.8333: tcp 24
10:11:42.602883 IP tom-Latitude-3570.35144 > vmd25034.contaboserver.net.8333: tcp 181
10:11:42.602889 IP tom-Latitude-3570.47264 > static-87-75-105-186.vodafonexdsl.co.uk.8333: tcp 145
10:11:42.668182 IP static-87-75-105-186.vodafonexdsl.co.uk.8333 > tom-Latitude-3570.47264: tcp 0
10:11:42.682542 IP static-87-75-105-186.vodafonexdsl.co.uk.8333 > tom-Latitude-3570.47264: tcp 0
10:11:42.698707 IP vmd25034.contaboserver.net.8333 > tom-Latitude-3570.35144: tcp 0
10:11:42.702810 IP tom-Latitude-3570.52038 > 47.52.161.242.8333: tcp 24
10:11:42.703446 IP tom-Latitude-3570.52038 > 47.52.161.242.8333: tcp 145
10:11:42.718475 IP vmd25034.contaboserver.net.8333 > tom-Latitude-3570.35144: tcp 0
10:11:42.738076 IP 47.52.161.242.8333 > tom-Latitude-3570.52038: tcp 0
10:11:42.738091 IP 47.52.161.242.8333 > tom-Latitude-3570.52038: tcp 0
10:11:42.869848 IP vmd25034.contaboserver.net.8333 > tom-Latitude-3570.35144: tcp 24
10:11:42.869868 IP vmd25034.contaboserver.net.8333 > tom-Latitude-3570.35144: tcp 215
10:11:42.869872 IP vmd25034.contaboserver.net.8333 > tom-Latitude-3570.35144: tcp 24
10:11:42.869958 IP tom-Latitude-3570.35144 > vmd25034.contaboserver.net.8333: tcp 0
10:11:42.870045 IP vmd25034.contaboserver.net.8333 > tom-Latitude-3570.35144: tcp 191
10:11:42.873721 IP vmd25034.contaboserver.net.8333 > tom-Latitude-3570.35144: tcp 24
10:11:42.873739 IP vmd25034.contaboserver.net.8333 > tom-Latitude-3570.35144: tcp 224
10:11:42.873742 IP vmd25034.contaboserver.net.8333 > tom-Latitude-3570.35144: tcp 24
10:11:42.873829 IP tom-Latitude-3570.35144 > vmd25034.contaboserver.net.8333: tcp 0
10:11:42.873974 IP vmd25034.contaboserver.net.8333 > tom-Latitude-3570.35144: tcp 589
10:11:42.876731 IP vmd25034.contaboserver.net.8333 > tom-Latitude-3570.35144: tcp 24
10:11:42.876845 IP tom-Latitude-3570.35144 > vmd25034.contaboserver.net.8333: tcp 0
10:11:42.886586 IP vmd25034.contaboserver.net.8333 > tom-Latitude-3570.35144: tcp 249
10:11:42.927901 IP tom-Latitude-3570.35144 > vmd25034.contaboserver.net.8333: tcp 0
10:11:42.998619 IP 104-62-47-181.lightspeed.bcvloh.sbcglobal.net.8333 > tom-Latitude-3570.33742: tcp 24
10:11:42.998639 IP 104-62-47-181.lightspeed.bcvloh.sbcglobal.net.8333 > tom-Latitude-3570.33742: tcp 217
10:11:42.998730 IP tom-Latitude-3570.33742 > 104-62-47-181.lightspeed.bcvloh.sbcglobal.net.8333: tcp 0
10:11:42.998976 IP tom-Latitude-3570.33742 > 104-62-47-181.lightspeed.bcvloh.sbcglobal.net.8333: tcp 24
10:11:42.999496 IP tom-Latitude-3570.33742 > 104-62-47-181.lightspeed.bcvloh.sbcglobal.net.8333: tcp 37
10:11:43.026343 IP 104-62-47-181.lightspeed.bcvloh.sbcglobal.net.8333 > tom-Latitude-3570.33742: tcp 0
10:11:43.029760 IP 104-62-47-181.lightspeed.bcvloh.sbcglobal.net.8333 > tom-Latitude-3570.33742: tcp 0
10:11:43.190425 IP 104-62-47-181.lightspeed.bcvloh.sbcglobal.net.8333 > tom-Latitude-3570.33742: tcp 24
10:11:43.191391 IP 104-62-47-181.lightspeed.bcvloh.sbcglobal.net.8333 > tom-Latitude-3570.33742: tcp 225
10:11:43.191520 IP tom-Latitude-3570.33742 > 104-62-47-181.lightspeed.bcvloh.sbcglobal.net.8333: tcp 0
10:11:43.191730 IP tom-Latitude-3570.47264 > static-87-75-105-186.vodafonexdsl.co.uk.8333: tcp 24
10:11:43.192904 IP tom-Latitude-3570.47264 > static-87-75-105-186.vodafonexdsl.co.uk.8333: tcp 181
10:11:43.222729 IP static-87-75-105-186.vodafonexdsl.co.uk.8333 > tom-Latitude-3570.47264: tcp 0
10:11:43.227301 IP static-87-75-105-186.vodafonexdsl.co.uk.8333 > tom-Latitude-3570.47264: tcp 0
10:11:43.493087 IP tom-Latitude-3570.35144 > vmd25034.contaboserver.net.8333: tcp 24
10:11:43.493619 IP tom-Latitude-3570.35144 > vmd25034.contaboserver.net.8333: tcp 37
10:11:43.525639 IP vmd25034.contaboserver.net.8333 > tom-Latitude-3570.35144: tcp 0
10:11:43.546045 IP vmd25034.contaboserver.net.8333 > tom-Latitude-3570.35144: tcp 0
10:11:43.894471 IP tom-Latitude-3570.52038 > 47.52.161.242.8333: tcp 24
10:11:43.895052 IP tom-Latitude-3570.52038 > 47.52.161.242.8333: tcp 217
10:11:43.946678 IP 47.52.161.242.8333 > tom-Latitude-3570.52038: tcp 0
10:11:43.966887 IP 47.52.161.242.8333 > tom-Latitude-3570.52038: tcp 0
10:11:44.860123 IP 23.226.90.172.8333 > tom-Latitude-3570.56010: tcp 24
10:11:44.860143 IP 23.226.90.172.8333 > tom-Latitude-3570.56010: tcp 649
10:11:44.860233 IP tom-Latitude-3570.56010 > 23.226.90.172.8333: tcp 0
10:11:44.860553 IP tom-Latitude-3570.56010 > 23.226.90.172.8333: tcp 24
10:11:44.862920 IP tom-Latitude-3570.56010 > 23.226.90.172.8333: tcp 181
10:11:44.941301 IP 23.226.90.172.8333 > tom-Latitude-3570.56010: tcp 0
10:11:44.941309 IP 23.226.90.172.8333 > tom-Latitude-3570.56010: tcp 0
10:11:45.104159 IP 23.226.90.172.8333 > tom-Latitude-3570.56010: tcp 24
10:11:45.104167 IP 23.226.90.172.8333 > tom-Latitude-3570.56010: tcp 870
10:11:45.104177 IP tom-Latitude-3570.56010 > 23.226.90.172.8333: tcp 0
10:11:45.108909 IP 23.226.90.172.8333 > tom-Latitude-3570.56010: tcp 500
10:11:45.151771 IP tom-Latitude-3570.56010 > 23.226.90.172.8333: tcp 0
10:11:45.310399 IP tom-Latitude-3570.43084 > 47.244.214.69.8333: tcp 24
10:11:45.310459 IP tom-Latitude-3570.52038 > 47.52.161.242.8333: tcp 24
10:11:45.310522 IP tom-Latitude-3570.33742 > 104-62-47-181.lightspeed.bcvloh.sbcglobal.net.8333: tcp 24
10:11:45.312192 IP tom-Latitude-3570.33742 > 104-62-47-181.lightspeed.bcvloh.sbcglobal.net.8333: tcp 181
10:11:45.312202 IP tom-Latitude-3570.52038 > 47.52.161.242.8333: tcp 181
10:11:45.312204 IP tom-Latitude-3570.43084 > 47.244.214.69.8333: tcp 937
10:11:45.347385 IP 47.244.214.69.8333 > tom-Latitude-3570.43084: tcp 0
10:11:45.364988 IP 185.207.232.56.8333 > tom-Latitude-3570.60304: tcp 24
10:11:45.365011 IP tom-Latitude-3570.60304 > 185.207.232.56.8333: tcp 0
10:11:45.365042 IP 185.207.232.56.8333 > tom-Latitude-3570.60304: tcp 31
10:11:45.365044 IP tom-Latitude-3570.60304 > 185.207.232.56.8333: tcp 0
10:11:45.372769 IP 47.244.214.69.8333 > tom-Latitude-3570.43084: tcp 0
10:11:45.372784 IP 104-62-47-181.lightspeed.bcvloh.sbcglobal.net.8333 > tom-Latitude-3570.33742: tcp 0
10:11:45.373367 IP 104-62-47-181.lightspeed.bcvloh.sbcglobal.net.8333 > tom-Latitude-3570.33742: tcp 0
10:11:45.373434 IP 47.52.161.242.8333 > tom-Latitude-3570.52038: tcp 0
10:11:45.373957 IP 47.52.161.242.8333 > tom-Latitude-3570.52038: tcp 0
10:11:45.570740 IP 185.207.232.56.8333 > tom-Latitude-3570.60304: tcp 32
10:11:45.570757 IP tom-Latitude-3570.60304 > 185.207.232.56.8333: tcp 0
10:11:45.570992 IP tom-Latitude-3570.60304 > 185.207.232.56.8333: tcp 24
10:11:45.571536 IP tom-Latitude-3570.60304 > 185.207.232.56.8333: tcp 8
10:11:45.600525 IP 185.207.232.56.8333 > tom-Latitude-3570.60304: tcp 0
10:11:45.600540 IP 185.207.232.56.8333 > tom-Latitude-3570.60304: tcp 0
10:11:45.771726 IP tom-Latitude-3570.60304 > 185.207.232.56.8333: tcp 24
10:11:45.773473 IP tom-Latitude-3570.60304 > 185.207.232.56.8333: tcp 8
10:11:45.806899 IP 185.207.232.56.8333 > tom-Latitude-3570.60304: tcp 0
10:11:45.810842 IP 185.207.232.56.8333 > tom-Latitude-3570.60304: tcp 0
10:11:45.980510 IP 185.207.232.56.8333 > tom-Latitude-3570.60304: tcp 24
10:11:45.980529 IP 185.207.232.56.8333 > tom-Latitude-3570.60304: tcp 8
10:11:45.980641 IP tom-Latitude-3570.60304 > 185.207.232.56.8333: tcp 0
10:11:46.281700 IP tom-Latitude-3570.38996 > static.93.100.202.116.clients.your-server.de.8333: tcp 24
10:11:46.288480 IP tom-Latitude-3570.38996 > static.93.100.202.116.clients.your-server.de.8333: tcp 937
10:11:46.348627 IP static.93.100.202.116.clients.your-server.de.8333 > tom-Latitude-3570.38996: tcp 0
10:11:46.395898 IP static.93.100.202.116.clients.your-server.de.8333 > tom-Latitude-3570.38996: tcp 0
10:11:46.582808 IP tom-Latitude-3570.56010 > 23.226.90.172.8333: tcp 24
10:11:46.585386 IP tom-Latitude-3570.56010 > 23.226.90.172.8333: tcp 8
10:11:46.619221 IP 23.226.90.172.8333 > tom-Latitude-3570.56010: tcp 0
10:11:46.625095 IP 23.226.90.172.8333 > tom-Latitude-3570.56010: tcp 24
10:11:46.625111 IP tom-Latitude-3570.56010 > 23.226.90.172.8333: tcp 0
10:11:46.625128 IP 23.226.90.172.8333 > tom-Latitude-3570.56010: tcp 8
10:11:46.625130 IP tom-Latitude-3570.56010 > 23.226.90.172.8333: tcp 0
10:11:46.625335 IP tom-Latitude-3570.56010 > 23.226.90.172.8333: tcp 24
10:11:46.626000 IP tom-Latitude-3570.56010 > 23.226.90.172.8333: tcp 8
10:11:46.688798 IP 23.226.90.172.8333 > tom-Latitude-3570.56010: tcp 0
10:11:46.729042 IP 23.226.90.172.8333 > tom-Latitude-3570.56010: tcp 0
10:11:46.731750 IP static.93.100.202.116.clients.your-server.de.8333 > tom-Latitude-3570.38996: tcp 313
10:11:46.731768 IP 23.226.90.172.8333 > tom-Latitude-3570.56010: tcp 24
10:11:46.732083 IP tom-Latitude-3570.38996 > static.93.100.202.116.clients.your-server.de.8333: tcp 24
10:11:46.732134 IP 23.226.90.172.8333 > tom-Latitude-3570.56010: tcp 217
10:11:46.732179 IP tom-Latitude-3570.56010 > 23.226.90.172.8333: tcp 0
10:11:46.734935 IP tom-Latitude-3570.38996 > static.93.100.202.116.clients.your-server.de.8333: tcp 217
10:11:46.778794 IP 104-62-47-181.lightspeed.bcvloh.sbcglobal.net.8333 > tom-Latitude-3570.33742: tcp 24
10:11:46.778804 IP 104-62-47-181.lightspeed.bcvloh.sbcglobal.net.8333 > tom-Latitude-3570.33742: tcp 73
10:11:46.778821 IP tom-Latitude-3570.33742 > 104-62-47-181.lightspeed.bcvloh.sbcglobal.net.8333: tcp 0
10:11:46.781962 IP static.93.100.202.116.clients.your-server.de.8333 > tom-Latitude-3570.38996: tcp 0
10:11:46.782134 IP static.93.100.202.116.clients.your-server.de.8333 > tom-Latitude-3570.38996: tcp 0
10:11:46.791357 IP 185.207.232.56.8333 > tom-Latitude-3570.60304: tcp 24
10:11:46.794411 IP 185.207.232.56.8333 > tom-Latitude-3570.60304: tcp 1009
10:11:46.794424 IP tom-Latitude-3570.60304 > 185.207.232.56.8333: tcp 0
10:11:46.794738 IP tom-Latitude-3570.60304 > 185.207.232.56.8333: tcp 24
10:11:46.796936 IP tom-Latitude-3570.60304 > 185.207.232.56.8333: tcp 37
10:11:46.826685 IP 185.207.232.56.8333 > tom-Latitude-3570.60304: tcp 0
10:11:46.826778 IP 185.207.232.56.8333 > tom-Latitude-3570.60304: tcp 0
10:11:46.836420 IP 23.226.90.172.8333 > tom-Latitude-3570.56010: tcp 24
10:11:46.838621 IP 23.226.90.172.8333 > tom-Latitude-3570.56010: tcp 8
10:11:46.838634 IP tom-Latitude-3570.56010 > 23.226.90.172.8333: tcp 0
10:11:46.881091 IP static.93.100.202.116.clients.your-server.de.8333 > tom-Latitude-3570.38996: tcp 427
10:11:46.883270 IP static.93.100.202.116.clients.your-server.de.8333 > tom-Latitude-3570.38996: tcp 427
10:11:46.883276 IP static.93.100.202.116.clients.your-server.de.8333 > tom-Latitude-3570.38996: tcp 428
10:11:46.883283 IP tom-Latitude-3570.38996 > static.93.100.202.116.clients.your-server.de.8333: tcp 0
10:11:46.886862 IP static.93.100.202.116.clients.your-server.de.8333 > tom-Latitude-3570.38996: tcp 429
10:11:46.886880 IP static.93.100.202.116.clients.your-server.de.8333 > tom-Latitude-3570.38996: tcp 606
10:11:46.886885 IP static.93.100.202.116.clients.your-server.de.8333 > tom-Latitude-3570.38996: tcp 444
10:11:46.886979 IP tom-Latitude-3570.38996 > static.93.100.202.116.clients.your-server.de.8333: tcp 0
10:11:46.947562 IP 185.207.232.56.8333 > tom-Latitude-3570.60304: tcp 24
10:11:46.947583 IP 185.207.232.56.8333 > tom-Latitude-3570.60304: tcp 373
10:11:46.947673 IP tom-Latitude-3570.60304 > 185.207.232.56.8333: tcp 0
10:11:46.948537 IP tom-Latitude-3570.47264 > static-87-75-105-186.vodafonexdsl.co.uk.8333: tcp 24
10:11:46.949097 IP tom-Latitude-3570.47264 > static-87-75-105-186.vodafonexdsl.co.uk.8333: tcp 469
10:11:46.978087 IP static-87-75-105-186.vodafonexdsl.co.uk.8333 > tom-Latitude-3570.47264: tcp 0
10:11:46.980891 IP static-87-75-105-186.vodafonexdsl.co.uk.8333 > tom-Latitude-3570.47264: tcp 0
10:11:47.148943 IP tom-Latitude-3570.43084 > 47.244.214.69.8333: tcp 24
10:11:47.153192 IP tom-Latitude-3570.43084 > 47.244.214.69.8333: tcp 8
10:11:47.188590 IP 47.244.214.69.8333 > tom-Latitude-3570.43084: tcp 0
10:11:47.207139 IP 47.244.214.69.8333 > tom-Latitude-3570.43084: tcp 0
10:11:47.217660 IP 47.244.214.69.8333 > tom-Latitude-3570.43084: tcp 24
10:11:47.217676 IP tom-Latitude-3570.43084 > 47.244.214.69.8333: tcp 0
10:11:47.223364 IP 47.244.214.69.8333 > tom-Latitude-3570.43084: tcp 8
10:11:47.223382 IP tom-Latitude-3570.43084 > 47.244.214.69.8333: tcp 0
10:11:47.223697 IP tom-Latitude-3570.60304 > 185.207.232.56.8333: tcp 24
10:11:47.223730 IP tom-Latitude-3570.43084 > 47.244.214.69.8333: tcp 24
10:11:47.224860 IP tom-Latitude-3570.43084 > 47.244.214.69.8333: tcp 8
10:11:47.224871 IP tom-Latitude-3570.60304 > 185.207.232.56.8333: tcp 37
10:11:47.260476 IP 185.207.232.56.8333 > tom-Latitude-3570.60304: tcp 0
10:11:47.266453 IP 47.244.214.69.8333 > tom-Latitude-3570.43084: tcp 0
10:11:47.267228 IP 185.207.232.56.8333 > tom-Latitude-3570.60304: tcp 0
10:11:47.324179 IP tom-Latitude-3570.52038 > 47.52.161.242.8333: tcp 24
10:11:47.327448 IP tom-Latitude-3570.52038 > 47.52.161.242.8333: tcp 253
10:11:47.357443 IP static-87-75-105-186.vodafonexdsl.co.uk.8333 > tom-Latitude-3570.47264: tcp 24
10:11:47.357462 IP static-87-75-105-186.vodafonexdsl.co.uk.8333 > tom-Latitude-3570.47264: tcp 31
10:11:47.357576 IP tom-Latitude-3570.47264 > static-87-75-105-186.vodafonexdsl.co.uk.8333: tcp 0
10:11:47.359162 IP 47.52.161.242.8333 > tom-Latitude-3570.52038: tcp 0
10:11:47.359696 IP 47.52.161.242.8333 > tom-Latitude-3570.52038: tcp 0
10:11:47.515059 IP 47.244.214.69.8333 > tom-Latitude-3570.43084: tcp 24
10:11:47.515078 IP 47.244.214.69.8333 > tom-Latitude-3570.43084: tcp 8
10:11:47.515188 IP tom-Latitude-3570.43084 > 47.244.214.69.8333: tcp 0
10:11:47.515406 IP tom-Latitude-3570.35144 > vmd25034.contaboserver.net.8333: tcp 24
10:11:47.516627 IP tom-Latitude-3570.35144 > vmd25034.contaboserver.net.8333: tcp 433
10:11:47.550813 IP vmd25034.contaboserver.net.8333 > tom-Latitude-3570.35144: tcp 0
10:11:47.550828 IP vmd25034.contaboserver.net.8333 > tom-Latitude-3570.35144: tcp 0
10:11:47.615852 IP tom-Latitude-3570.43084 > 47.244.214.69.8333: tcp 24
10:11:47.616636 IP tom-Latitude-3570.43084 > 47.244.214.69.8333: tcp 253
10:11:47.627370 IP 47.52.161.242.8333 > tom-Latitude-3570.52038: tcp 277
10:11:47.627394 IP tom-Latitude-3570.52038 > 47.52.161.242.8333: tcp 0
10:11:47.647497 IP 47.244.214.69.8333 > tom-Latitude-3570.43084: tcp 0
10:11:47.929840 IP static-87-75-105-186.vodafonexdsl.co.uk.8333 > tom-Latitude-3570.47264: tcp 24
10:11:47.929847 IP static-87-75-105-186.vodafonexdsl.co.uk.8333 > tom-Latitude-3570.47264: tcp 73
10:11:47.929859 IP tom-Latitude-3570.47264 > static-87-75-105-186.vodafonexdsl.co.uk.8333: tcp 0
10:11:48.632401 IP tom-Latitude-3570.33742 > 104-62-47-181.lightspeed.bcvloh.sbcglobal.net.8333: tcp 24
10:11:48.634121 IP tom-Latitude-3570.33742 > 104-62-47-181.lightspeed.bcvloh.sbcglobal.net.8333: tcp 181
10:11:48.697128 IP 104-62-47-181.lightspeed.bcvloh.sbcglobal.net.8333 > tom-Latitude-3570.33742: tcp 0
10:11:48.712587 IP 104-62-47-181.lightspeed.bcvloh.sbcglobal.net.8333 > tom-Latitude-3570.33742: tcp 0
10:11:49.234467 IP tom-Latitude-3570.38996 > static.93.100.202.116.clients.your-server.de.8333: tcp 24
10:11:49.238808 IP tom-Latitude-3570.38996 > static.93.100.202.116.clients.your-server.de.8333: tcp 37
10:11:49.291890 IP static.93.100.202.116.clients.your-server.de.8333 > tom-Latitude-3570.38996: tcp 0
10:11:49.304920 IP static.93.100.202.116.clients.your-server.de.8333 > tom-Latitude-3570.38996: tcp 0
10:11:49.348876 IP 47.52.161.242.8333 > tom-Latitude-3570.52038: tcp 32
10:11:49.348898 IP tom-Latitude-3570.52038 > 47.52.161.242.8333: tcp 0
10:11:49.349108 IP tom-Latitude-3570.52038 > 47.52.161.242.8333: tcp 24
10:11:49.349817 IP tom-Latitude-3570.52038 > 47.52.161.242.8333: tcp 8
10:11:49.418267 IP 47.52.161.242.8333 > tom-Latitude-3570.52038: tcp 0
10:11:49.432645 IP 47.52.161.242.8333 > tom-Latitude-3570.52038: tcp 0
10:11:49.549853 IP tom-Latitude-3570.52038 > 47.52.161.242.8333: tcp 24
10:11:49.551977 IP tom-Latitude-3570.52038 > 47.52.161.242.8333: tcp 8
10:11:49.606744 IP 47.52.161.242.8333 > tom-Latitude-3570.52038: tcp 0
10:11:49.624737 IP 47.52.161.242.8333 > tom-Latitude-3570.52038: tcp 0
10:11:49.977021 IP 47.52.161.242.8333 > tom-Latitude-3570.52038: tcp 32
10:11:50.019905 IP tom-Latitude-3570.52038 > 47.52.161.242.8333: tcp 0
10:11:50.063934 IP static.93.100.202.116.clients.your-server.de.8333 > tom-Latitude-3570.38996: tcp 241
10:11:50.064279 IP tom-Latitude-3570.38996 > static.93.100.202.116.clients.your-server.de.8333: tcp 24
10:11:50.066370 IP tom-Latitude-3570.38996 > static.93.100.202.116.clients.your-server.de.8333: tcp 217
10:11:50.136893 IP static.93.100.202.116.clients.your-server.de.8333 > tom-Latitude-3570.38996: tcp 0
10:11:50.142113 IP static.93.100.202.116.clients.your-server.de.8333 > tom-Latitude-3570.38996: tcp 0
10:11:50.241375 IP static.93.100.202.116.clients.your-server.de.8333 > tom-Latitude-3570.38996: tcp 429
10:11:50.245310 IP static.93.100.202.116.clients.your-server.de.8333 > tom-Latitude-3570.38996: tcp 248
