10:02:20.467808 IP static.93.100.202.116.clients.your-server.de.8333 > tom-Latitude-3570.38996: tcp 97
10:02:20.468048 IP tom-Latitude-3570.38996 > static.93.100.202.116.clients.your-server.de.8333: tcp 24
10:02:20.468556 IP tom-Latitude-3570.38996 > static.93.100.202.116.clients.your-server.de.8333: tcp 73
10:02:20.499583 IP static.93.100.202.116.clients.your-server.de.8333 > tom-Latitude-3570.38996: tcp 0
10:02:20.503182 IP static.93.100.202.116.clients.your-server.de.8333 > tom-Latitude-3570.38996: tcp 0
10:02:20.596973 IP static.93.100.202.116.clients.your-server.de.8333 > tom-Latitude-3570.38996: tcp 692
10:02:20.596995 IP static.93.100.202.116.clients.your-server.de.8333 > tom-Latitude-3570.38996: tcp 247
10:02:20.597081 IP tom-Latitude-3570.38996 > static.93.100.202.116.clients.your-server.de.8333: tcp 0
10:02:20.698954 IP tom-Latitude-3570.43084 > 47.244.214.69.8333: tcp 24
10:02:20.699542 IP tom-Latitude-3570.43084 > 47.244.214.69.8333: tcp 397
10:02:20.729738 IP 47.244.214.69.8333 > tom-Latitude-3570.43084: tcp 0
10:02:20.733308 IP 47.244.214.69.8333 > tom-Latitude-3570.43084: tcp 0
10:02:20.799358 IP tom-Latitude-3570.47264 > static-87-75-105-186.vodafonexdsl.co.uk.8333: tcp 24
10:02:20.799403 IP tom-Latitude-3570.56010 > 23.226.90.172.8333: tcp 24
10:02:20.800737 IP tom-Latitude-3570.56010 > 23.226.90.172.8333: tcp 61
10:02:20.800749 IP tom-Latitude-3570.47264 > static-87-75-105-186.vodafonexdsl.co.uk.8333: tcp 109
10:02:20.831843 IP static-87-75-105-186.vodafonexdsl.co.uk.8333 > tom-Latitude-3570.47264: tcp 0
10:02:20.835010 IP 23.226.90.172.8333 > tom-Latitude-3570.56010: tcp 0
10:02:20.839298 IP 23.226.90.172.8333 > tom-Latitude-3570.56010: tcp 0
10:02:20.860539 IP static-87-75-105-186.vodafonexdsl.co.uk.8333 > tom-Latitude-3570.47264: tcp 0
10:02:21.501296 IP tom-Latitude-3570.60304 > 185.207.232.56.8333: tcp 24
10:02:21.502387 IP tom-Latitude-3570.60304 > 185.207.232.56.8333: tcp 217
10:02:21.533671 IP 185.207.232.56.8333 > tom-Latitude-3570.60304: tcp 0
10:02:21.533687 IP 185.207.232.56.8333 > tom-Latitude-3570.60304: tcp 0
10:02:21.809234 IP 47.244.214.69.8333 > tom-Latitude-3570.43084: tcp 24
10:02:21.809254 IP 47.244.214.69.8333 > tom-Latitude-3570.43084: tcp 289
10:02:21.809363 IP tom-Latitude-3570.43084 > 47.244.214.69.8333: tcp 0
10:02:21.809566 IP tom-Latitude-3570.43084 > 47.244.214.69.8333: tcp 24
10:02:21.809944 IP tom-Latitude-3570.43084 > 47.244.214.69.8333: tcp 289
10:02:21.844291 IP 47.244.214.69.8333 > tom-Latitude-3570.43084: tcp 0
10:02:21.859341 IP 47.244.214.69.8333 > tom-Latitude-3570.43084: tcp 0
10:02:22.168525 IP 47.244.214.69.8333 > tom-Latitude-3570.43084: tcp 24
10:02:22.169058 IP 47.244.214.69.8333 > tom-Latitude-3570.43084: tcp 665
10:02:22.169076 IP 47.244.214.69.8333 > tom-Latitude-3570.43084: tcp 24
10:02:22.169079 IP 47.244.214.69.8333 > tom-Latitude-3570.43084: tcp 248
10:02:22.169081 IP 47.244.214.69.8333 > tom-Latitude-3570.43084: tcp 24
10:02:22.169083 IP 47.244.214.69.8333 > tom-Latitude-3570.43084: tcp 223
10:02:22.169085 IP 47.244.214.69.8333 > tom-Latitude-3570.43084: tcp 24
10:02:22.169105 IP 47.244.214.69.8333 > tom-Latitude-3570.43084: tcp 223
10:02:22.169106 IP 47.244.214.69.8333 > tom-Latitude-3570.43084: tcp 24
10:02:22.169186 IP tom-Latitude-3570.43084 > 47.244.214.69.8333: tcp 0
10:02:22.171153 IP 47.244.214.69.8333 > tom-Latitude-3570.43084: tcp 248
10:02:22.171615 IP 47.244.214.69.8333 > tom-Latitude-3570.43084: tcp 24
10:02:22.171621 IP 47.244.214.69.8333 > tom-Latitude-3570.43084: tcp 371
10:02:22.171623 IP 47.244.214.69.8333 > tom-Latitude-3570.43084: tcp 24
10:02:22.171625 IP 47.244.214.69.8333 > tom-Latitude-3570.43084: tcp 226
10:02:22.171627 IP 47.244.214.69.8333 > tom-Latitude-3570.43084: tcp 24
10:02:22.171629 IP 47.244.214.69.8333 > tom-Latitude-3570.43084: tcp 225
10:02:22.171664 IP tom-Latitude-3570.43084 > 47.244.214.69.8333: tcp 0
10:02:22.183944 IP 185.207.232.56.8333 > tom-Latitude-3570.60304: tcp 24
10:02:22.184774 IP 185.207.232.56.8333 > tom-Latitude-3570.60304: tcp 361
10:02:22.184876 IP tom-Latitude-3570.60304 > 185.207.232.56.8333: tcp 0
10:02:22.185067 IP tom-Latitude-3570.60304 > 185.207.232.56.8333: tcp 24
10:02:22.185482 IP tom-Latitude-3570.60304 > 185.207.232.56.8333: tcp 73
10:02:22.215048 IP 185.207.232.56.8333 > tom-Latitude-3570.60304: tcp 0
10:02:22.234294 IP 185.207.232.56.8333 > tom-Latitude-3570.60304: tcp 0
10:02:22.273351 IP 104-62-47-181.lightspeed.bcvloh.sbcglobal.net.8333 > tom-Latitude-3570.33742: tcp 24
10:02:22.273359 IP tom-Latitude-3570.33742 > 104-62-47-181.lightspeed.bcvloh.sbcglobal.net.8333: tcp 0
10:02:22.276611 IP 104-62-47-181.lightspeed.bcvloh.sbcglobal.net.8333 > tom-Latitude-3570.33742: tcp 865
10:02:22.276618 IP tom-Latitude-3570.33742 > 104-62-47-181.lightspeed.bcvloh.sbcglobal.net.8333: tcp 0
10:02:22.351699 IP 185.207.232.56.8333 > tom-Latitude-3570.60304: tcp 24
10:02:22.352305 IP 185.207.232.56.8333 > tom-Latitude-3570.60304: tcp 769
10:02:22.352409 IP tom-Latitude-3570.60304 > 185.207.232.56.8333: tcp 0
10:02:22.551974 IP 23.226.90.172.8333 > tom-Latitude-3570.56010: tcp 24
10:02:22.551996 IP 23.226.90.172.8333 > tom-Latitude-3570.56010: tcp 685
10:02:22.552086 IP tom-Latitude-3570.56010 > 23.226.90.172.8333: tcp 0
10:02:22.552323 IP tom-Latitude-3570.56010 > 23.226.90.172.8333: tcp 24
10:02:22.553179 IP tom-Latitude-3570.56010 > 23.226.90.172.8333: tcp 37
10:02:22.584101 IP 23.226.90.172.8333 > tom-Latitude-3570.56010: tcp 0
10:02:22.586905 IP 23.226.90.172.8333 > tom-Latitude-3570.56010: tcp 0
10:02:22.652470 IP tom-Latitude-3570.43084 > 47.244.214.69.8333: tcp 24
10:02:22.654158 IP tom-Latitude-3570.43084 > 47.244.214.69.8333: tcp 73
10:02:22.681575 IP 47.244.214.69.8333 > tom-Latitude-3570.43084: tcp 0
10:02:22.688105 IP 47.244.214.69.8333 > tom-Latitude-3570.43084: tcp 0
10:02:22.754962 IP 23.226.90.172.8333 > tom-Latitude-3570.56010: tcp 24
10:02:22.754982 IP 23.226.90.172.8333 > tom-Latitude-3570.56010: tcp 220
10:02:22.755073 IP tom-Latitude-3570.56010 > 23.226.90.172.8333: tcp 0
10:02:22.900105 IP 104-62-47-181.lightspeed.bcvloh.sbcglobal.net.8333 > tom-Latitude-3570.33742: tcp 61
10:02:22.900122 IP tom-Latitude-3570.33742 > 104-62-47-181.lightspeed.bcvloh.sbcglobal.net.8333: tcp 0
10:02:23.101126 IP tom-Latitude-3570.35144 > vmd25034.contaboserver.net.8333: tcp 24
10:02:23.102174 IP tom-Latitude-3570.35144 > vmd25034.contaboserver.net.8333: tcp 613
10:02:23.138423 IP vmd25034.contaboserver.net.8333 > tom-Latitude-3570.35144: tcp 0
10:02:23.138438 IP vmd25034.contaboserver.net.8333 > tom-Latitude-3570.35144: tcp 0
10:02:23.301982 IP tom-Latitude-3570.47264 > static-87-75-105-186.vodafonexdsl.co.uk.8333: tcp 24
10:02:23.302570 IP tom-Latitude-3570.47264 > static-87-75-105-186.vodafonexdsl.co.uk.8333: tcp 397
10:02:23.333488 IP static-87-75-105-186.vodafonexdsl.co.uk.8333 > tom-Latitude-3570.47264: tcp 0
10:02:23.369565 IP static-87-75-105-186.vodafonexdsl.co.uk.8333 > tom-Latitude-3570.47264: tcp 0
10:02:23.386244 IP 47.52.161.242.8333 > tom-Latitude-3570.52038: tcp 565
10:02:23.386280 IP tom-Latitude-3570.52038 > 47.52.161.242.8333: tcp 0
10:02:23.386680 IP tom-Latitude-3570.56010 > 23.226.90.172.8333: tcp 24
10:02:23.387043 IP tom-Latitude-3570.56010 > 23.226.90.172.8333: tcp 37
10:02:23.421664 IP 23.226.90.172.8333 > tom-Latitude-3570.56010: tcp 0
10:02:23.421673 IP 23.226.90.172.8333 > tom-Latitude-3570.56010: tcp 0
10:02:23.687347 IP tom-Latitude-3570.60304 > 185.207.232.56.8333: tcp 24
10:02:23.687964 IP tom-Latitude-3570.60304 > 185.207.232.56.8333: tcp 37
10:02:23.736835 IP 185.207.232.56.8333 > tom-Latitude-3570.60304: tcp 0
10:02:23.737440 IP 185.207.232.56.8333 > tom-Latitude-3570.60304: tcp 0
10:02:24.183696 IP 47.244.214.69.8333 > tom-Latitude-3570.43084: tcp 24
10:02:24.183716 IP 47.244.214.69.8333 > tom-Latitude-3570.43084: tcp 73
10:02:24.183760 IP tom-Latitude-3570.43084 > 47.244.214.69.8333: tcp 0
10:02:24.183946 IP tom-Latitude-3570.43084 > 47.244.214.69.8333: tcp 24
10:02:24.184996 IP tom-Latitude-3570.43084 > 47.244.214.69.8333: tcp 37
10:02:24.213975 IP 47.244.214.69.8333 > tom-Latitude-3570.43084: tcp 0
10:02:24.217403 IP 47.244.214.69.8333 > tom-Latitude-3570.43084: tcp 0
10:02:24.525997 IP 47.244.214.69.8333 > tom-Latitude-3570.43084: tcp 24
10:02:24.526020 IP 47.244.214.69.8333 > tom-Latitude-3570.43084: tcp 225
10:02:24.526061 IP tom-Latitude-3570.43084 > 47.244.214.69.8333: tcp 0
10:02:24.626774 IP tom-Latitude-3570.35144 > vmd25034.contaboserver.net.8333: tcp 24
10:02:24.627382 IP tom-Latitude-3570.35144 > vmd25034.contaboserver.net.8333: tcp 37
10:02:24.660868 IP vmd25034.contaboserver.net.8333 > tom-Latitude-3570.35144: tcp 0
10:02:24.660884 IP vmd25034.contaboserver.net.8333 > tom-Latitude-3570.35144: tcp 0
10:02:24.727217 IP tom-Latitude-3570.56010 > 23.226.90.172.8333: tcp 24
10:02:24.727992 IP tom-Latitude-3570.56010 > 23.226.90.172.8333: tcp 37
10:02:24.757578 IP 23.226.90.172.8333 > tom-Latitude-3570.56010: tcp 0
10:02:24.757594 IP 23.226.90.172.8333 > tom-Latitude-3570.56010: tcp 0
10:02:25.429654 IP tom-Latitude-3570.33742 > 104-62-47-181.lightspeed.bcvloh.sbcglobal.net.8333: tcp 24
10:02:25.430283 IP tom-Latitude-3570.33742 > 104-62-47-181.lightspeed.bcvloh.sbcglobal.net.8333: tcp 73
10:02:25.462966 IP 104-62-47-181.lightspeed.bcvloh.sbcglobal.net.8333 > tom-Latitude-3570.33742: tcp 0
10:02:25.466935 IP 104-62-47-181.lightspeed.bcvloh.sbcglobal.net.8333 > tom-Latitude-3570.33742: tcp 0
10:02:25.535389 IP static.93.100.202.116.clients.your-server.de.8333 > tom-Latitude-3570.38996: tcp 565
10:02:25.535719 IP tom-Latitude-3570.38996 > static.93.100.202.116.clients.your-server.de.8333: tcp 24
10:02:25.575534 IP tom-Latitude-3570.38996 > static.93.100.202.116.clients.your-server.de.8333: tcp 109
10:02:25.612448 IP static.93.100.202.116.clients.your-server.de.8333 > tom-Latitude-3570.38996: tcp 0
10:02:25.635491 IP static.93.100.202.116.clients.your-server.de.8333 > tom-Latitude-3570.38996: tcp 0
10:02:25.703899 IP static.93.100.202.116.clients.your-server.de.8333 > tom-Latitude-3570.38996: tcp 280
10:02:25.704025 IP static.93.100.202.116.clients.your-server.de.8333 > tom-Latitude-3570.38996: tcp 281
10:02:25.704058 IP tom-Latitude-3570.38996 > static.93.100.202.116.clients.your-server.de.8333: tcp 0
10:02:25.717929 IP static.93.100.202.116.clients.your-server.de.8333 > tom-Latitude-3570.38996: tcp 248
10:02:25.759784 IP tom-Latitude-3570.38996 > static.93.100.202.116.clients.your-server.de.8333: tcp 0
10:02:25.818326 IP tom-Latitude-3570.52038 > 47.52.161.242.8333: tcp 24
10:02:25.818826 IP tom-Latitude-3570.52038 > 47.52.161.242.8333: tcp 145
10:02:25.849610 IP 47.52.161.242.8333 > tom-Latitude-3570.52038: tcp 0
10:02:25.850577 IP 47.52.161.242.8333 > tom-Latitude-3570.52038: tcp 0
10:02:25.918725 IP tom-Latitude-3570.35144 > vmd25034.contaboserver.net.8333: tcp 24
10:02:25.920030 IP tom-Latitude-3570.35144 > vmd25034.contaboserver.net.8333: tcp 109
10:02:25.952210 IP vmd25034.contaboserver.net.8333 > tom-Latitude-3570.35144: tcp 0
10:02:25.967671 IP vmd25034.contaboserver.net.8333 > tom-Latitude-3570.35144: tcp 0
10:02:26.019199 IP tom-Latitude-3570.38996 > static.93.100.202.116.clients.your-server.de.8333: tcp 24
10:02:26.021485 IP tom-Latitude-3570.38996 > static.93.100.202.116.clients.your-server.de.8333: tcp 37
10:02:26.056860 IP static.93.100.202.116.clients.your-server.de.8333 > tom-Latitude-3570.38996: tcp 0
10:02:26.057653 IP static.93.100.202.116.clients.your-server.de.8333 > tom-Latitude-3570.38996: tcp 0
10:02:26.369865 IP 47.244.214.69.8333 > tom-Latitude-3570.43084: tcp 24
10:02:26.369887 IP 47.244.214.69.8333 > tom-Latitude-3570.43084: tcp 145
10:02:26.369930 IP tom-Latitude-3570.43084 > 47.244.214.69.8333: tcp 0
10:02:26.370119 IP tom-Latitude-3570.43084 > 47.244.214.69.8333: tcp 24
10:02:26.370793 IP tom-Latitude-3570.43084 > 47.244.214.69.8333: tcp 37
10:02:26.380456 IP 104-62-47-181.lightspeed.bcvloh.sbcglobal.net.8333 > tom-Latitude-3570.33742: tcp 24
10:02:26.380482 IP tom-Latitude-3570.33742 > 104-62-47-181.lightspeed.bcvloh.sbcglobal.net.8333: tcp 0
10:02:26.380501 IP 104-62-47-181.lightspeed.bcvloh.sbcglobal.net.8333 > tom-Latitude-3570.33742: tcp 181
10:02:26.380505 IP tom-Latitude-3570.33742 > 104-62-47-181.lightspeed.bcvloh.sbcglobal.net.8333: tcp 0
10:02:26.380722 IP tom-Latitude-3570.33742 > 104-62-47-181.lightspeed.bcvloh.sbcglobal.net.8333: tcp 24
10:02:26.381509 IP tom-Latitude-3570.33742 > 104-62-47-181.lightspeed.bcvloh.sbcglobal.net.8333: tcp 37
10:02:26.399779 IP 47.244.214.69.8333 > tom-Latitude-3570.43084: tcp 0
10:02:26.403305 IP 47.244.214.69.8333 > tom-Latitude-3570.43084: tcp 0
10:02:26.414554 IP 104-62-47-181.lightspeed.bcvloh.sbcglobal.net.8333 > tom-Latitude-3570.33742: tcp 0
10:02:26.418081 IP 104-62-47-181.lightspeed.bcvloh.sbcglobal.net.8333 > tom-Latitude-3570.33742: tcp 0
10:02:26.578058 IP 104-62-47-181.lightspeed.bcvloh.sbcglobal.net.8333 > tom-Latitude-3570.33742: tcp 24
10:02:26.578079 IP 104-62-47-181.lightspeed.bcvloh.sbcglobal.net.8333 > tom-Latitude-3570.33742: tcp 248
10:02:26.578124 IP tom-Latitude-3570.33742 > 104-62-47-181.lightspeed.bcvloh.sbcglobal.net.8333: tcp 0
10:02:26.710201 IP 47.244.214.69.8333 > tom-Latitude-3570.43084: tcp 24
10:02:26.710220 IP 47.244.214.69.8333 > tom-Latitude-3570.43084: tcp 298
10:02:26.710265 IP tom-Latitude-3570.43084 > 47.244.214.69.8333: tcp 0
10:02:27.112153 IP tom-Latitude-3570.56010 > 23.226.90.172.8333: tcp 24
10:02:27.112784 IP tom-Latitude-3570.56010 > 23.226.90.172.8333: tcp 181
10:02:27.149945 IP 23.226.90.172.8333 > tom-Latitude-3570.56010: tcp 0
10:02:27.149961 IP 23.226.90.172.8333 > tom-Latitude-3570.56010: tcp 0
10:02:27.212568 IP tom-Latitude-3570.60304 > 185.207.232.56.8333: tcp 24
10:02:27.213149 IP tom-Latitude-3570.60304 > 185.207.232.56.8333: tcp 217
10:02:27.245715 IP 185.207.232.56.8333 > tom-Latitude-3570.60304: tcp 0
10:02:27.245732 IP 185.207.232.56.8333 > tom-Latitude-3570.60304: tcp 0
10:02:27.814578 IP tom-Latitude-3570.52038 > 47.52.161.242.8333: tcp 24
10:02:27.815170 IP tom-Latitude-3570.52038 > 47.52.161.242.8333: tcp 73
10:02:27.849748 IP 47.52.161.242.8333 > tom-Latitude-3570.52038: tcp 0
10:02:27.867394 IP 47.52.161.242.8333 > tom-Latitude-3570.52038: tcp 0
10:02:28.015293 IP tom-Latitude-3570.35144 > vmd25034.contaboserver.net.8333: tcp 24
10:02:28.017368 IP tom-Latitude-3570.35144 > vmd25034.contaboserver.net.8333: tcp 73
10:02:28.050574 IP vmd25034.contaboserver.net.8333 > tom-Latitude-3570.35144: tcp 0
10:02:28.050589 IP vmd25034.contaboserver.net.8333 > tom-Latitude-3570.35144: tcp 0
10:02:28.353943 IP static.93.100.202.116.clients.your-server.de.8333 > tom-Latitude-3570.38996: tcp 169
10:02:28.353969 IP tom-Latitude-3570.38996 > static.93.100.202.116.clients.your-server.de.8333: tcp 0
10:02:28.354178 IP tom-Latitude-3570.38996 > static.93.100.202.116.clients.your-server.de.8333: tcp 24
10:02:28.354789 IP tom-Latitude-3570.38996 > static.93.100.202.116.clients.your-server.de.8333: tcp 73
10:02:28.393749 IP static.93.100.202.116.clients.your-server.de.8333 > tom-Latitude-3570.38996: tcp 0
10:02:28.393765 IP static.93.100.202.116.clients.your-server.de.8333 > tom-Latitude-3570.38996: tcp 0
10:02:28.480216 IP static.93.100.202.116.clients.your-server.de.8333 > tom-Latitude-3570.38996: tcp 509
10:02:28.483625 IP static.93.100.202.116.clients.your-server.de.8333 > tom-Latitude-3570.38996: tcp 395
10:02:28.483672 IP tom-Latitude-3570.38996 > static.93.100.202.116.clients.your-server.de.8333: tcp 0
10:02:28.684777 IP tom-Latitude-3570.35144 > vmd25034.contaboserver.net.8333: tcp 24
10:02:28.685376 IP tom-Latitude-3570.35144 > vmd25034.contaboserver.net.8333: tcp 73
10:02:28.721179 IP vmd25034.contaboserver.net.8333 > tom-Latitude-3570.35144: tcp 0
10:02:28.721193 IP vmd25034.contaboserver.net.8333 > tom-Latitude-3570.35144: tcp 0
10:02:28.785248 IP tom-Latitude-3570.56010 > 23.226.90.172.8333: tcp 24
10:02:28.791356 IP tom-Latitude-3570.56010 > 23.226.90.172.8333: tcp 73
10:02:28.821708 IP 23.226.90.172.8333 > tom-Latitude-3570.56010: tcp 0
10:02:28.821724 IP 23.226.90.172.8333 > tom-Latitude-3570.56010: tcp 0
10:02:29.086318 IP tom-Latitude-3570.33742 > 104-62-47-181.lightspeed.bcvloh.sbcglobal.net.8333: tcp 24
10:02:29.086914 IP tom-Latitude-3570.33742 > 104-62-47-181.lightspeed.bcvloh.sbcglobal.net.8333: tcp 73
10:02:29.118086 IP 104-62-47-181.lightspeed.bcvloh.sbcglobal.net.8333 > tom-Latitude-3570.33742: tcp 0
10:02:29.118102 IP 104-62-47-181.lightspeed.bcvloh.sbcglobal.net.8333 > tom-Latitude-3570.33742: tcp 0
10:02:29.125782 IP 23.226.90.172.8333 > tom-Latitude-3570.56010: tcp 24
10:02:29.129648 IP 23.226.90.172.8333 > tom-Latitude-3570.56010: tcp 37
10:02:29.129711 IP tom-Latitude-3570.56010 > 23.226.90.172.8333: tcp 0
10:02:29.129884 IP tom-Latitude-3570.56010 > 23.226.90.172.8333: tcp 24
10:02:29.130596 IP tom-Latitude-3570.56010 > 23.226.90.172.8333: tcp 37
10:02:29.162409 IP 23.226.90.172.8333 > tom-Latitude-3570.56010: tcp 0
10:02:29.163419 IP 23.226.90.172.8333 > tom-Latitude-3570.56010: tcp 0
10:02:29.340592 IP 23.226.90.172.8333 > tom-Latitude-3570.56010: tcp 24
10:02:29.341423 IP 23.226.90.172.8333 > tom-Latitude-3570.56010: tcp 215
10:02:29.341488 IP tom-Latitude-3570.56010 > 23.226.90.172.8333: tcp 0
10:02:29.442304 IP tom-Latitude-3570.60304 > 185.207.232.56.8333: tcp 24
10:02:29.458228 IP tom-Latitude-3570.60304 > 185.207.232.56.8333: tcp 109
10:02:29.488574 IP 185.207.232.56.8333 > tom-Latitude-3570.60304: tcp 0
10:02:29.492217 IP 185.207.232.56.8333 > tom-Latitude-3570.60304: tcp 0
10:02:29.843641 IP tom-Latitude-3570.43084 > 47.244.214.69.8333: tcp 24
10:02:29.843707 IP tom-Latitude-3570.52038 > 47.52.161.242.8333: tcp 24
10:02:29.844883 IP tom-Latitude-3570.52038 > 47.52.161.242.8333: tcp 109
10:02:29.844894 IP tom-Latitude-3570.43084 > 47.244.214.69.8333: tcp 145
10:02:29.880394 IP 47.244.214.69.8333 > tom-Latitude-3570.43084: tcp 0
10:02:29.880410 IP 47.244.214.69.8333 > tom-Latitude-3570.43084: tcp 0
10:02:29.883407 IP 47.52.161.242.8333 > tom-Latitude-3570.52038: tcp 0
10:02:29.883432 IP 47.52.161.242.8333 > tom-Latitude-3570.52038: tcp 0
10:02:30.245051 IP tom-Latitude-3570.35144 > vmd25034.contaboserver.net.8333: tcp 24
10:02:30.245645 IP tom-Latitude-3570.35144 > vmd25034.contaboserver.net.8333: tcp 37
10:02:30.296033 IP vmd25034.contaboserver.net.8333 > tom-Latitude-3570.35144: tcp 0
10:02:30.296049 IP vmd25034.contaboserver.net.8333 > tom-Latitude-3570.35144: tcp 0
10:02:30.996801 IP vmd25034.contaboserver.net.8333 > tom-Latitude-3570.35144: tcp 24
10:02:30.999445 IP vmd25034.contaboserver.net.8333 > tom-Latitude-3570.35144: tcp 73
10:02:30.999508 IP tom-Latitude-3570.35144 > vmd25034.contaboserver.net.8333: tcp 0
10:02:31.200439 IP tom-Latitude-3570.33742 > 104-62-47-181.lightspeed.bcvloh.sbcglobal.net.8333: tcp 24
10:02:31.202550 IP tom-Latitude-3570.33742 > 104-62-47-181.lightspeed.bcvloh.sbcglobal.net.8333: tcp 91
10:02:31.216210 IP 23.226.90.172.8333 > tom-Latitude-3570.56010: tcp 24
10:02:31.216232 IP 23.226.90.172.8333 > tom-Latitude-3570.56010: tcp 37
10:02:31.216274 IP tom-Latitude-3570.56010 > 23.226.90.172.8333: tcp 0
10:02:31.216448 IP tom-Latitude-3570.56010 > 23.226.90.172.8333: tcp 24
10:02:31.217076 IP tom-Latitude-3570.56010 > 23.226.90.172.8333: tcp 37
10:02:31.233756 IP 104-62-47-181.lightspeed.bcvloh.sbcglobal.net.8333 > tom-Latitude-3570.33742: tcp 0
10:02:31.237367 IP 104-62-47-181.lightspeed.bcvloh.sbcglobal.net.8333 > tom-Latitude-3570.33742: tcp 0
10:02:31.249977 IP 23.226.90.172.8333 > tom-Latitude-3570.56010: tcp 0
10:02:31.253555 IP 23.226.90.172.8333 > tom-Latitude-3570.56010: tcp 0
10:02:31.419927 IP 23.226.90.172.8333 > tom-Latitude-3570.56010: tcp 24
10:02:31.420095 IP 23.226.90.172.8333 > tom-Latitude-3570.56010: tcp 223
10:02:31.420126 IP tom-Latitude-3570.56010 > 23.226.90.172.8333: tcp 0
10:02:31.585920 IP 185.207.232.56.8333 > tom-Latitude-3570.60304: tcp 24
10:02:31.585940 IP 185.207.232.56.8333 > tom-Latitude-3570.60304: tcp 37
10:02:31.585982 IP tom-Latitude-3570.60304 > 185.207.232.56.8333: tcp 0
10:02:31.634590 IP 47.52.161.242.8333 > tom-Latitude-3570.52038: tcp 61
10:02:31.634615 IP tom-Latitude-3570.52038 > 47.52.161.242.8333: tcp 0
10:02:32.738259 IP tom-Latitude-3570.47264 > static-87-75-105-186.vodafonexdsl.co.uk.8333: tcp 24
10:02:32.738842 IP tom-Latitude-3570.47264 > static-87-75-105-186.vodafonexdsl.co.uk.8333: tcp 8
10:02:32.782542 IP static-87-75-105-186.vodafonexdsl.co.uk.8333 > tom-Latitude-3570.47264: tcp 0
10:02:32.801670 IP static-87-75-105-186.vodafonexdsl.co.uk.8333 > tom-Latitude-3570.47264: tcp 0
10:02:32.836234 IP static-87-75-105-186.vodafonexdsl.co.uk.8333 > tom-Latitude-3570.47264: tcp 24
10:02:32.836253 IP static-87-75-105-186.vodafonexdsl.co.uk.8333 > tom-Latitude-3570.47264: tcp 8
10:02:32.836298 IP tom-Latitude-3570.47264 > static-87-75-105-186.vodafonexdsl.co.uk.8333: tcp 0
10:02:32.836394 IP tom-Latitude-3570.47264 > static-87-75-105-186.vodafonexdsl.co.uk.8333: tcp 24
10:02:32.837231 IP tom-Latitude-3570.47264 > static-87-75-105-186.vodafonexdsl.co.uk.8333: tcp 8
10:02:32.868010 IP static-87-75-105-186.vodafonexdsl.co.uk.8333 > tom-Latitude-3570.47264: tcp 24
10:02:32.868031 IP static-87-75-105-186.vodafonexdsl.co.uk.8333 > tom-Latitude-3570.47264: tcp 8
10:02:32.868074 IP tom-Latitude-3570.47264 > static-87-75-105-186.vodafonexdsl.co.uk.8333: tcp 0
10:02:32.968529 IP tom-Latitude-3570.43084 > 47.244.214.69.8333: tcp 24
10:02:32.969200 IP tom-Latitude-3570.43084 > 47.244.214.69.8333: tcp 37
10:02:32.971905 IP tom-Latitude-3570.47264 > static-87-75-105-186.vodafonexdsl.co.uk.8333: tcp 8
10:02:33.010938 IP static-87-75-105-186.vodafonexdsl.co.uk.8333 > tom-Latitude-3570.47264: tcp 0
10:02:33.059903 IP tom-Latitude-3570.43084 > 47.244.214.69.8333: tcp 37
10:02:33.070906 IP 47.244.214.69.8333 > tom-Latitude-3570.43084: tcp 0
10:02:33.087827 IP 47.244.214.69.8333 > tom-Latitude-3570.43084: tcp 0
10:02:33.109383 IP static-87-75-105-186.vodafonexdsl.co.uk.8333 > tom-Latitude-3570.47264: tcp 0
10:02:33.109396 IP 47.244.214.69.8333 > tom-Latitude-3570.43084: tcp 0
10:02:33.227116 IP 47.244.214.69.8333 > tom-Latitude-3570.43084: tcp 24
10:02:33.227135 IP 47.244.214.69.8333 > tom-Latitude-3570.43084: tcp 37
10:02:33.227180 IP tom-Latitude-3570.43084 > 47.244.214.69.8333: tcp 0
10:02:33.227384 IP tom-Latitude-3570.33742 > 104-62-47-181.lightspeed.bcvloh.sbcglobal.net.8333: tcp 24
10:02:33.249634 IP tom-Latitude-3570.33742 > 104-62-47-181.lightspeed.bcvloh.sbcglobal.net.8333: tcp 73
10:02:33.308655 IP 104-62-47-181.lightspeed.bcvloh.sbcglobal.net.8333 > tom-Latitude-3570.33742: tcp 0
10:02:33.313423 IP 104-62-47-181.lightspeed.bcvloh.sbcglobal.net.8333 > tom-Latitude-3570.33742: tcp 0
10:02:34.046952 IP 104-62-47-181.lightspeed.bcvloh.sbcglobal.net.8333 > tom-Latitude-3570.33742: tcp 24
10:02:34.046972 IP 104-62-47-181.lightspeed.bcvloh.sbcglobal.net.8333 > tom-Latitude-3570.33742: tcp 73
10:02:34.047017 IP tom-Latitude-3570.33742 > 104-62-47-181.lightspeed.bcvloh.sbcglobal.net.8333: tcp 0
10:02:34.047223 IP tom-Latitude-3570.47264 > static-87-75-105-186.vodafonexdsl.co.uk.8333: tcp 24
10:02:34.047317 IP tom-Latitude-3570.33742 > 104-62-47-181.lightspeed.bcvloh.sbcglobal.net.8333: tcp 24
10:02:34.048066 IP tom-Latitude-3570.33742 > 104-62-47-181.lightspeed.bcvloh.sbcglobal.net.8333: tcp 73
10:02:34.048077 IP tom-Latitude-3570.47264 > static-87-75-105-186.vodafonexdsl.co.uk.8333: tcp 361
10:02:34.128352 IP static-87-75-105-186.vodafonexdsl.co.uk.8333 > tom-Latitude-3570.47264: tcp 0
10:02:34.128369 IP 104-62-47-181.lightspeed.bcvloh.sbcglobal.net.8333 > tom-Latitude-3570.33742: tcp 0
10:02:34.291299 IP static-87-75-105-186.vodafonexdsl.co.uk.8333 > tom-Latitude-3570.47264: tcp 0
10:02:34.291313 IP 104-62-47-181.lightspeed.bcvloh.sbcglobal.net.8333 > tom-Latitude-3570.33742: tcp 0
10:02:34.333872 IP static.93.100.202.116.clients.your-server.de.8333 > tom-Latitude-3570.38996: tcp 205
10:02:34.334166 IP tom-Latitude-3570.38996 > static.93.100.202.116.clients.your-server.de.8333: tcp 24
10:02:34.335533 IP tom-Latitude-3570.38996 > static.93.100.202.116.clients.your-server.de.8333: tcp 37
10:02:34.370046 IP static.93.100.202.116.clients.your-server.de.8333 > tom-Latitude-3570.38996: tcp 0
10:02:34.370062 IP static.93.100.202.116.clients.your-server.de.8333 > tom-Latitude-3570.38996: tcp 0
10:02:34.463703 IP 104-62-47-181.lightspeed.bcvloh.sbcglobal.net.8333 > tom-Latitude-3570.33742: tcp 24
10:02:34.463748 IP 104-62-47-181.lightspeed.bcvloh.sbcglobal.net.8333 > tom-Latitude-3570.33742: tcp 653
10:02:34.463769 IP tom-Latitude-3570.33742 > 104-62-47-181.lightspeed.bcvloh.sbcglobal.net.8333: tcp 0
10:02:34.742373 IP static.93.100.202.116.clients.your-server.de.8333 > tom-Latitude-3570.38996: tcp 444
10:02:34.783905 IP tom-Latitude-3570.38996 > static.93.100.202.116.clients.your-server.de.8333: tcp 0
10:02:35.043827 IP tom-Latitude-3570.52038 > 47.52.161.242.8333: tcp 24
10:02:35.044443 IP tom-Latitude-3570.52038 > 47.52.161.242.8333: tcp 109
10:02:35.082111 IP 47.52.161.242.8333 > tom-Latitude-3570.52038: tcp 0
10:02:35.082127 IP 47.52.161.242.8333 > tom-Latitude-3570.52038: tcp 0
10:02:35.141440 IP 104-62-47-181.lightspeed.bcvloh.sbcglobal.net.8333 > tom-Latitude-3570.33742: tcp 24
10:02:35.143742 IP 104-62-47-181.lightspeed.bcvloh.sbcglobal.net.8333 > tom-Latitude-3570.33742: tcp 109
10:02:35.143808 IP tom-Latitude-3570.33742 > 104-62-47-181.lightspeed.bcvloh.sbcglobal.net.8333: tcp 0
10:02:35.144017 IP tom-Latitude-3570.33742 > 104-62-47-181.lightspeed.bcvloh.sbcglobal.net.8333: tcp 24
10:02:35.144659 IP tom-Latitude-3570.33742 > 104-62-47-181.lightspeed.bcvloh.sbcglobal.net.8333: tcp 73
10:02:35.173867 IP 104-62-47-181.lightspeed.bcvloh.sbcglobal.net.8333 > tom-Latitude-3570.33742: tcp 0
10:02:35.191820 IP 104-62-47-181.lightspeed.bcvloh.sbcglobal.net.8333 > tom-Latitude-3570.33742: tcp 0
10:02:35.209805 IP static-87-75-105-186.vodafonexdsl.co.uk.8333 > tom-Latitude-3570.47264: tcp 24
10:02:35.220046 IP static-87-75-105-186.vodafonexdsl.co.uk.8333 > tom-Latitude-3570.47264: tcp 253
10:02:35.220110 IP tom-Latitude-3570.47264 > static-87-75-105-186.vodafonexdsl.co.uk.8333: tcp 0
10:02:35.220368 IP tom-Latitude-3570.47264 > static-87-75-105-186.vodafonexdsl.co.uk.8333: tcp 24
10:02:35.221280 IP tom-Latitude-3570.47264 > static-87-75-105-186.vodafonexdsl.co.uk.8333: tcp 73
10:02:35.247789 IP static-87-75-105-186.vodafonexdsl.co.uk.8333 > tom-Latitude-3570.47264: tcp 0
10:02:35.267617 IP static-87-75-105-186.vodafonexdsl.co.uk.8333 > tom-Latitude-3570.47264: tcp 0
10:02:35.320793 IP tom-Latitude-3570.60304 > 185.207.232.56.8333: tcp 24
10:02:35.321748 IP tom-Latitude-3570.60304 > 185.207.232.56.8333: tcp 109
10:02:35.338755 IP static-87-75-105-186.vodafonexdsl.co.uk.8333 > tom-Latitude-3570.47264: tcp 24
10:02:35.343616 IP static-87-75-105-186.vodafonexdsl.co.uk.8333 > tom-Latitude-3570.47264: tcp 280
10:02:35.343636 IP static-87-75-105-186.vodafonexdsl.co.uk.8333 > tom-Latitude-3570.47264: tcp 190
10:02:35.343692 IP tom-Latitude-3570.47264 > static-87-75-105-186.vodafonexdsl.co.uk.8333: tcp 0
10:02:35.343714 IP 104-62-47-181.lightspeed.bcvloh.sbcglobal.net.8333 > tom-Latitude-3570.33742: tcp 24
10:02:35.343720 IP 104-62-47-181.lightspeed.bcvloh.sbcglobal.net.8333 > tom-Latitude-3570.33742: tcp 1039
10:02:35.343760 IP tom-Latitude-3570.33742 > 104-62-47-181.lightspeed.bcvloh.sbcglobal.net.8333: tcp 0
10:02:35.363924 IP 185.207.232.56.8333 > tom-Latitude-3570.60304: tcp 0
10:02:35.363937 IP 185.207.232.56.8333 > tom-Latitude-3570.60304: tcp 0
10:02:35.646459 IP tom-Latitude-3570.43084 > 47.244.214.69.8333: tcp 24
10:02:35.647385 IP tom-Latitude-3570.43084 > 47.244.214.69.8333: tcp 253
10:02:35.683547 IP 47.244.214.69.8333 > tom-Latitude-3570.43084: tcp 0
10:02:35.683563 IP 47.244.214.69.8333 > tom-Latitude-3570.43084: tcp 0
10:02:35.836052 IP 104-62-47-181.lightspeed.bcvloh.sbcglobal.net.8333 > tom-Latitude-3570.33742: tcp 24
10:02:35.836073 IP 104-62-47-181.lightspeed.bcvloh.sbcglobal.net.8333 > tom-Latitude-3570.33742: tcp 73
10:02:35.836117 IP tom-Latitude-3570.33742 > 104-62-47-181.lightspeed.bcvloh.sbcglobal.net.8333: tcp 0
10:02:36.237236 IP tom-Latitude-3570.35144 > vmd25034.contaboserver.net.8333: tcp 24
10:02:36.237907 IP tom-Latitude-3570.35144 > vmd25034.contaboserver.net.8333: tcp 289
10:02:36.268077 IP vmd25034.contaboserver.net.8333 > tom-Latitude-3570.35144: tcp 0
10:02:36.271871 IP vmd25034.contaboserver.net.8333 > tom-Latitude-3570.35144: tcp 0
10:02:37.562976 IP 185.207.232.56.8333 > tom-Latitude-3570.60304: tcp 24
10:02:37.563593 IP 185.207.232.56.8333 > tom-Latitude-3570.60304: tcp 289
10:02:37.563655 IP tom-Latitude-3570.60304 > 185.207.232.56.8333: tcp 0
10:02:37.563915 IP tom-Latitude-3570.60304 > 185.207.232.56.8333: tcp 24
10:02:37.577444 IP 47.244.214.69.8333 > tom-Latitude-3570.43084: tcp 24
10:02:37.577466 IP 47.244.214.69.8333 > tom-Latitude-3570.43084: tcp 109
10:02:37.577531 IP tom-Latitude-3570.43084 > 47.244.214.69.8333: tcp 0
10:02:37.584998 IP tom-Latitude-3570.60304 > 185.207.232.56.8333: tcp 145
10:02:37.703791 IP 185.207.232.56.8333 > tom-Latitude-3570.60304: tcp 0
10:02:37.703806 IP 185.207.232.56.8333 > tom-Latitude-3570.60304: tcp 0
10:02:37.806586 IP 185.207.232.56.8333 > tom-Latitude-3570.60304: tcp 24
10:02:37.806714 IP 185.207.232.56.8333 > tom-Latitude-3570.60304: tcp 1331
10:02:37.806737 IP tom-Latitude-3570.60304 > 185.207.232.56.8333: tcp 0
10:02:38.109571 IP tom-Latitude-3570.35144 > vmd25034.contaboserver.net.8333: tcp 24
10:02:38.111221 IP tom-Latitude-3570.35144 > vmd25034.contaboserver.net.8333: tcp 145
10:02:38.211909 IP tom-Latitude-3570.35144 > vmd25034.contaboserver.net.8333: tcp 145
10:02:38.310078 IP vmd25034.contaboserver.net.8333 > tom-Latitude-3570.35144: tcp 0
10:02:38.347181 IP vmd25034.contaboserver.net.8333 > tom-Latitude-3570.35144: tcp 0
10:02:38.369748 IP vmd25034.contaboserver.net.8333 > tom-Latitude-3570.35144: tcp 0
10:02:38.410368 IP tom-Latitude-3570.38996 > static.93.100.202.116.clients.your-server.de.8333: tcp 24
10:02:38.412357 IP tom-Latitude-3570.38996 > static.93.100.202.116.clients.your-server.de.8333: tcp 289
10:02:38.468453 IP static.93.100.202.116.clients.your-server.de.8333 > tom-Latitude-3570.38996: tcp 0
10:02:38.483833 IP static.93.100.202.116.clients.your-server.de.8333 > tom-Latitude-3570.38996: tcp 0
10:02:38.879151 IP 23.226.90.172.8333 > tom-Latitude-3570.56010: tcp 24
10:02:38.882867 IP 23.226.90.172.8333 > tom-Latitude-3570.56010: tcp 433
10:02:38.882931 IP tom-Latitude-3570.56010 > 23.226.90.172.8333: tcp 0
10:02:38.883215 IP tom-Latitude-3570.56010 > 23.226.90.172.8333: tcp 24
10:02:38.884274 IP tom-Latitude-3570.56010 > 23.226.90.172.8333: tcp 37
10:02:38.942146 IP static.93.100.202.116.clients.your-server.de.8333 > tom-Latitude-3570.38996: tcp 97
10:02:38.942171 IP tom-Latitude-3570.38996 > static.93.100.202.116.clients.your-server.de.8333: tcp 0
10:02:38.942388 IP tom-Latitude-3570.38996 > static.93.100.202.116.clients.your-server.de.8333: tcp 24
10:02:38.946338 IP tom-Latitude-3570.38996 > static.93.100.202.116.clients.your-server.de.8333: tcp 37
10:02:38.949058 IP 23.226.90.172.8333 > tom-Latitude-3570.56010: tcp 0
10:02:38.952830 IP 23.226.90.172.8333 > tom-Latitude-3570.56010: tcp 0
10:02:38.978699 IP static.93.100.202.116.clients.your-server.de.8333 > tom-Latitude-3570.38996: tcp 0
10:02:38.997596 IP static.93.100.202.116.clients.your-server.de.8333 > tom-Latitude-3570.38996: tcp 0
10:02:39.103415 IP static.93.100.202.116.clients.your-server.de.8333 > tom-Latitude-3570.38996: tcp 249
10:02:39.118186 IP 23.226.90.172.8333 > tom-Latitude-3570.56010: tcp 24
10:02:39.118207 IP 23.226.90.172.8333 > tom-Latitude-3570.56010: tcp 426
10:02:39.118252 IP tom-Latitude-3570.56010 > 23.226.90.172.8333: tcp 0
10:02:39.143693 IP tom-Latitude-3570.38996 > static.93.100.202.116.clients.your-server.de.8333: tcp 0
10:02:39.620413 IP tom-Latitude-3570.56010 > 23.226.90.172.8333: tcp 24
10:02:39.653822 IP tom-Latitude-3570.56010 > 23.226.90.172.8333: tcp 37
10:02:39.664212 IP 47.52.161.242.8333 > tom-Latitude-3570.52038: tcp 313
10:02:39.664238 IP tom-Latitude-3570.52038 > 47.52.161.242.8333: tcp 0
10:02:39.716115 IP 23.226.90.172.8333 > tom-Latitude-3570.56010: tcp 0
10:02:39.734290 IP 23.226.90.172.8333 > tom-Latitude-3570.56010: tcp 0
10:02:39.764877 IP tom-Latitude-3570.60304 > 185.207.232.56.8333: tcp 24
10:02:39.765805 IP tom-Latitude-3570.60304 > 185.207.232.56.8333: tcp 31
10:02:39.827936 IP 185.207.232.56.8333 > tom-Latitude-3570.60304: tcp 0
10:02:39.845986 IP 185.207.232.56.8333 > tom-Latitude-3570.60304: tcp 0
10:02:40.768319 IP tom-Latitude-3570.47264 > static-87-75-105-186.vodafonexdsl.co.uk.8333: tcp 24
10:02:40.769025 IP tom-Latitude-3570.47264 > static-87-75-105-186.vodafonexdsl.co.uk.8333: tcp 217
10:02:40.818738 IP static-87-75-105-186.vodafonexdsl.co.uk.8333 > tom-Latitude-3570.47264: tcp 0
10:02:40.895904 IP static-87-75-105-186.vodafonexdsl.co.uk.8333 > tom-Latitude-3570.47264: tcp 0
10:02:41.269844 IP tom-Latitude-3570.35144 > vmd25034.contaboserver.net.8333: tcp 24
10:02:41.270691 IP tom-Latitude-3570.35144 > vmd25034.contaboserver.net.8333: tcp 73
10:02:41.331984 IP vmd25034.contaboserver.net.8333 > tom-Latitude-3570.35144: tcp 0
10:02:41.348717 IP vmd25034.contaboserver.net.8333 > tom-Latitude-3570.35144: tcp 0
10:02:41.370247 IP tom-Latitude-3570.60304 > 185.207.232.56.8333: tcp 24
10:02:41.370834 IP tom-Latitude-3570.60304 > 185.207.232.56.8333: tcp 73
10:02:41.412102 IP 185.207.232.56.8333 > tom-Latitude-3570.60304: tcp 0
10:02:41.433687 IP 185.207.232.56.8333 > tom-Latitude-3570.60304: tcp 0
10:02:42.574351 IP tom-Latitude-3570.33742 > 104-62-47-181.lightspeed.bcvloh.sbcglobal.net.8333: tcp 24
10:02:42.575480 IP tom-Latitude-3570.33742 > 104-62-47-181.lightspeed.bcvloh.sbcglobal.net.8333: tcp 217
10:02:42.614375 IP 104-62-47-181.lightspeed.bcvloh.sbcglobal.net.8333 > tom-Latitude-3570.33742: tcp 0
10:02:42.662110 IP 104-62-47-181.lightspeed.bcvloh.sbcglobal.net.8333 > tom-Latitude-3570.33742: tcp 0
10:02:43.695668 IP 23.226.90.172.8333 > tom-Latitude-3570.56010: tcp 385
10:02:43.695958 IP tom-Latitude-3570.56010 > 23.226.90.172.8333: tcp 24
10:02:43.696447 IP tom-Latitude-3570.56010 > 23.226.90.172.8333: tcp 361
10:02:43.767379 IP 23.226.90.172.8333 > tom-Latitude-3570.56010: tcp 0
10:02:43.796091 IP tom-Latitude-3570.43084 > 47.244.214.69.8333: tcp 24
10:02:43.799295 IP tom-Latitude-3570.43084 > 47.244.214.69.8333: tcp 109
10:02:43.904126 IP 23.226.90.172.8333 > tom-Latitude-3570.56010: tcp 0
10:02:43.907157 IP 47.244.214.69.8333 > tom-Latitude-3570.43084: tcp 0
10:02:43.907576 IP 47.244.214.69.8333 > tom-Latitude-3570.43084: tcp 0
10:02:44.127925 IP 23.226.90.172.8333 > tom-Latitude-3570.56010: tcp 24
10:02:44.127947 IP 23.226.90.172.8333 > tom-Latitude-3570.56010: tcp 870
10:02:44.127952 IP 23.226.90.172.8333 > tom-Latitude-3570.56010: tcp 523
10:02:44.127991 IP tom-Latitude-3570.56010 > 23.226.90.172.8333: tcp 0
10:02:44.229835 IP tom-Latitude-3570.35144 > vmd25034.contaboserver.net.8333: tcp 24
10:02:44.353328 IP tom-Latitude-3570.35144 > vmd25034.contaboserver.net.8333: tcp 181
10:02:44.367969 IP 23.226.90.172.8333 > tom-Latitude-3570.56010: tcp 1382
10:02:44.370732 IP 23.226.90.172.8333 > tom-Latitude-3570.56010: tcp 40
10:02:44.370747 IP tom-Latitude-3570.56010 > 23.226.90.172.8333: tcp 0
10:02:44.379096 IP 23.226.90.172.8333 > tom-Latitude-3570.56010: tcp 103
10:02:44.390459 IP vmd25034.contaboserver.net.8333 > tom-Latitude-3570.35144: tcp 0
10:02:44.395011 IP vmd25034.contaboserver.net.8333 > tom-Latitude-3570.35144: tcp 0
10:02:44.419903 IP tom-Latitude-3570.56010 > 23.226.90.172.8333: tcp 0
10:02:44.479892 IP tom-Latitude-3570.43084 > 47.244.214.69.8333: tcp 24
10:02:44.480470 IP tom-Latitude-3570.43084 > 47.244.214.69.8333: tcp 361
10:02:44.515207 IP 47.244.214.69.8333 > tom-Latitude-3570.43084: tcp 0
10:02:44.516095 IP 47.244.214.69.8333 > tom-Latitude-3570.43084: tcp 0
10:02:44.580343 IP tom-Latitude-3570.47264 > static-87-75-105-186.vodafonexdsl.co.uk.8333: tcp 24
10:02:44.580920 IP tom-Latitude-3570.47264 > static-87-75-105-186.vodafonexdsl.co.uk.8333: tcp 361
10:02:44.608217 IP static-87-75-105-186.vodafonexdsl.co.uk.8333 > tom-Latitude-3570.47264: tcp 0
10:02:44.633921 IP static-87-75-105-186.vodafonexdsl.co.uk.8333 > tom-Latitude-3570.47264: tcp 0
10:02:45.439277 IP 47.244.214.69.8333 > tom-Latitude-3570.43084: tcp 24
10:02:45.439298 IP 47.244.214.69.8333 > tom-Latitude-3570.43084: tcp 145
10:02:45.439340 IP tom-Latitude-3570.43084 > 47.244.214.69.8333: tcp 0
10:02:45.439500 IP tom-Latitude-3570.43084 > 47.244.214.69.8333: tcp 24
10:02:45.439794 IP tom-Latitude-3570.43084 > 47.244.214.69.8333: tcp 145
10:02:45.471908 IP 47.244.214.69.8333 > tom-Latitude-3570.43084: tcp 0
10:02:45.480906 IP 47.244.214.69.8333 > tom-Latitude-3570.43084: tcp 0
10:02:45.789292 IP 47.244.214.69.8333 > tom-Latitude-3570.43084: tcp 24
10:02:45.789584 IP 47.244.214.69.8333 > tom-Latitude-3570.43084: tcp 247
10:02:45.789603 IP 47.244.214.69.8333 > tom-Latitude-3570.43084: tcp 24
10:02:45.789606 IP 47.244.214.69.8333 > tom-Latitude-3570.43084: tcp 373
10:02:45.789609 IP 47.244.214.69.8333 > tom-Latitude-3570.43084: tcp 24
10:02:45.789611 IP 47.244.214.69.8333 > tom-Latitude-3570.43084: tcp 246
10:02:45.789614 IP 47.244.214.69.8333 > tom-Latitude-3570.43084: tcp 24
10:02:45.789649 IP tom-Latitude-3570.43084 > 47.244.214.69.8333: tcp 0
10:02:45.790020 IP tom-Latitude-3570.47264 > static-87-75-105-186.vodafonexdsl.co.uk.8333: tcp 24
10:02:45.790151 IP tom-Latitude-3570.52038 > 47.52.161.242.8333: tcp 24
10:02:45.792542 IP 47.244.214.69.8333 > tom-Latitude-3570.43084: tcp 223
10:02:45.797367 IP tom-Latitude-3570.47264 > static-87-75-105-186.vodafonexdsl.co.uk.8333: tcp 37
10:02:45.797738 IP tom-Latitude-3570.52038 > 47.52.161.242.8333: tcp 469
10:02:45.830258 IP static-87-75-105-186.vodafonexdsl.co.uk.8333 > tom-Latitude-3570.47264: tcp 0
10:02:45.833579 IP 47.52.161.242.8333 > tom-Latitude-3570.52038: tcp 0
10:02:45.835909 IP tom-Latitude-3570.43084 > 47.244.214.69.8333: tcp 0
10:02:45.845634 IP static-87-75-105-186.vodafonexdsl.co.uk.8333 > tom-Latitude-3570.47264: tcp 0
10:02:45.912087 IP 47.52.161.242.8333 > tom-Latitude-3570.52038: tcp 0
10:02:45.993542 IP tom-Latitude-3570.60304 > 185.207.232.56.8333: tcp 24
10:02:45.994121 IP tom-Latitude-3570.60304 > 185.207.232.56.8333: tcp 505
10:02:46.052298 IP 47.52.161.242.8333 > tom-Latitude-3570.52038: tcp 601
10:02:46.052316 IP tom-Latitude-3570.52038 > 47.52.161.242.8333: tcp 0
10:02:46.052336 IP 185.207.232.56.8333 > tom-Latitude-3570.60304: tcp 0
10:02:46.052583 IP tom-Latitude-3570.52038 > 47.52.161.242.8333: tcp 24
10:02:46.054406 IP tom-Latitude-3570.52038 > 47.52.161.242.8333: tcp 37
10:02:46.067690 IP 185.207.232.56.8333 > tom-Latitude-3570.60304: tcp 0
10:02:46.096188 IP 47.52.161.242.8333 > tom-Latitude-3570.52038: tcp 0
10:02:46.096211 IP 47.52.161.242.8333 > tom-Latitude-3570.52038: tcp 0
10:02:46.230864 IP vmd25034.contaboserver.net.8333 > tom-Latitude-3570.35144: tcp 24
10:02:46.230884 IP vmd25034.contaboserver.net.8333 > tom-Latitude-3570.35144: tcp 31
10:02:46.230927 IP tom-Latitude-3570.35144 > vmd25034.contaboserver.net.8333: tcp 0
10:02:46.581206 IP 47.52.161.242.8333 > tom-Latitude-3570.52038: tcp 398
10:02:46.623902 IP tom-Latitude-3570.52038 > 47.52.161.242.8333: tcp 0
10:02:46.853493 IP 185.207.232.56.8333 > tom-Latitude-3570.60304: tcp 24
10:02:46.853514 IP 185.207.232.56.8333 > tom-Latitude-3570.60304: tcp 181
10:02:46.853556 IP tom-Latitude-3570.60304 > 185.207.232.56.8333: tcp 0
10:02:46.853803 IP tom-Latitude-3570.60304 > 185.207.232.56.8333: tcp 24
10:02:46.854324 IP tom-Latitude-3570.60304 > 185.207.232.56.8333: tcp 145
10:02:46.884072 IP 185.207.232.56.8333 > tom-Latitude-3570.60304: tcp 0
10:02:46.895708 IP 185.207.232.56.8333 > tom-Latitude-3570.60304: tcp 0
10:02:47.017120 IP 185.207.232.56.8333 > tom-Latitude-3570.60304: tcp 24
