06:28:22.842352 IP 81.198.101.144.8333 > tom-Latitude-3570.60988: tcp 24
06:28:22.842374 IP 81.198.101.144.8333 > tom-Latitude-3570.60988: tcp 397
06:28:22.842381 IP 81.198.101.144.8333 > tom-Latitude-3570.60988: tcp 397
06:28:22.842393 IP tom-Latitude-3570.60988 > 81.198.101.144.8333: tcp 0
06:28:22.842641 IP tom-Latitude-3570.60988 > 81.198.101.144.8333: tcp 24
06:28:22.842754 IP tom-Latitude-3570.60470 > bb42-60-217-183.singnet.com.sg.8333: tcp 24
06:28:22.843761 IP tom-Latitude-3570.60988 > 81.198.101.144.8333: tcp 73
06:28:22.844447 IP tom-Latitude-3570.60470 > bb42-60-217-183.singnet.com.sg.8333: tcp 325
06:28:22.903791 IP bb42-60-217-183.singnet.com.sg.8333 > tom-Latitude-3570.60470: tcp 0
06:28:22.903799 IP 81.198.101.144.8333 > tom-Latitude-3570.60988: tcp 0
06:28:22.992951 IP 81.198.101.144.8333 > tom-Latitude-3570.60988: tcp 24
06:28:22.993701 IP 81.198.101.144.8333 > tom-Latitude-3570.60988: tcp 226
06:28:22.993724 IP 81.198.101.144.8333 > tom-Latitude-3570.60988: tcp 24
06:28:22.993746 IP 81.198.101.144.8333 > tom-Latitude-3570.60988: tcp 284
06:28:22.993804 IP tom-Latitude-3570.60988 > 81.198.101.144.8333: tcp 0
06:28:23.057849 IP 167.99.216.145.8333 > tom-Latitude-3570.57976: tcp 24
06:28:23.057906 IP tom-Latitude-3570.57976 > 167.99.216.145.8333: tcp 0
06:28:23.057925 IP 167.99.216.145.8333 > tom-Latitude-3570.57976: tcp 397
06:28:23.057930 IP tom-Latitude-3570.57976 > 167.99.216.145.8333: tcp 0
06:28:23.058177 IP tom-Latitude-3570.57976 > 167.99.216.145.8333: tcp 24
06:28:23.060274 IP tom-Latitude-3570.57976 > 167.99.216.145.8333: tcp 145
06:28:23.092689 IP 167.99.216.145.8333 > tom-Latitude-3570.57976: tcp 0
06:28:23.093349 IP 167.99.216.145.8333 > tom-Latitude-3570.57976: tcp 0
06:28:23.156099 IP 167.99.216.145.8333 > tom-Latitude-3570.57976: tcp 24
06:28:23.156107 IP 167.99.216.145.8333 > tom-Latitude-3570.57976: tcp 224
06:28:23.156111 IP 167.99.216.145.8333 > tom-Latitude-3570.57976: tcp 24
06:28:23.156114 IP 167.99.216.145.8333 > tom-Latitude-3570.57976: tcp 224
06:28:23.156116 IP 167.99.216.145.8333 > tom-Latitude-3570.57976: tcp 24
06:28:23.156119 IP 167.99.216.145.8333 > tom-Latitude-3570.57976: tcp 224
06:28:23.156121 IP 167.99.216.145.8333 > tom-Latitude-3570.57976: tcp 24
06:28:23.156124 IP tom-Latitude-3570.57976 > 167.99.216.145.8333: tcp 0
06:28:23.156154 IP tom-Latitude-3570.57976 > 167.99.216.145.8333: tcp 0
06:28:23.156544 IP tom-Latitude-3570.60470 > bb42-60-217-183.singnet.com.sg.8333: tcp 24
06:28:23.157736 IP 167.99.216.145.8333 > tom-Latitude-3570.57976: tcp 407
06:28:23.159023 IP tom-Latitude-3570.60470 > bb42-60-217-183.singnet.com.sg.8333: tcp 109
06:28:23.199906 IP tom-Latitude-3570.57976 > 167.99.216.145.8333: tcp 0
06:28:23.275906 IP tom-Latitude-3570.60470 > bb42-60-217-183.singnet.com.sg.8333: tcp 109
06:28:23.313576 IP bb42-60-217-183.singnet.com.sg.8333 > tom-Latitude-3570.60470: tcp 0
06:28:23.444957 IP static-87-75-105-186.vodafonexdsl.co.uk.8333 > tom-Latitude-3570.46284: tcp 24
06:28:23.457783 IP static-87-75-105-186.vodafonexdsl.co.uk.8333 > tom-Latitude-3570.46284: tcp 613
06:28:23.457848 IP tom-Latitude-3570.46284 > static-87-75-105-186.vodafonexdsl.co.uk.8333: tcp 0
06:28:23.458125 IP tom-Latitude-3570.46284 > static-87-75-105-186.vodafonexdsl.co.uk.8333: tcp 24
06:28:23.459373 IP tom-Latitude-3570.46284 > static-87-75-105-186.vodafonexdsl.co.uk.8333: tcp 73
06:28:23.492573 IP static-87-75-105-186.vodafonexdsl.co.uk.8333 > tom-Latitude-3570.46284: tcp 0
06:28:23.558985 IP static-87-75-105-186.vodafonexdsl.co.uk.8333 > tom-Latitude-3570.46284: tcp 24
06:28:23.559005 IP static-87-75-105-186.vodafonexdsl.co.uk.8333 > tom-Latitude-3570.46284: tcp 226
06:28:23.559011 IP static-87-75-105-186.vodafonexdsl.co.uk.8333 > tom-Latitude-3570.46284: tcp 24
06:28:23.559015 IP static-87-75-105-186.vodafonexdsl.co.uk.8333 > tom-Latitude-3570.46284: tcp 249
06:28:23.559052 IP tom-Latitude-3570.46284 > static-87-75-105-186.vodafonexdsl.co.uk.8333: tcp 0
06:28:23.660040 IP tom-Latitude-3570.60988 > 81.198.101.144.8333: tcp 24
06:28:23.661117 IP tom-Latitude-3570.60988 > 81.198.101.144.8333: tcp 217
06:28:23.703094 IP 81.198.101.144.8333 > tom-Latitude-3570.60988: tcp 0
06:28:24.261996 IP tom-Latitude-3570.49070 > c-185-45-236-223.customer.ggaweb.ch.8333: tcp 24
06:28:24.264176 IP tom-Latitude-3570.49070 > c-185-45-236-223.customer.ggaweb.ch.8333: tcp 361
06:28:24.316319 IP c-185-45-236-223.customer.ggaweb.ch.8333 > tom-Latitude-3570.49070: tcp 0
06:28:24.323030 IP c-185-45-236-223.customer.ggaweb.ch.8333 > tom-Latitude-3570.49070: tcp 0
06:28:24.362475 IP tom-Latitude-3570.39110 > vmi195435.contaboserver.net.8333: tcp 24
06:28:24.363424 IP tom-Latitude-3570.39110 > vmi195435.contaboserver.net.8333: tcp 613
06:28:24.396129 IP vmi195435.contaboserver.net.8333 > tom-Latitude-3570.39110: tcp 0
06:28:24.403556 IP vmi195435.contaboserver.net.8333 > tom-Latitude-3570.39110: tcp 0
06:28:24.663546 IP tom-Latitude-3570.56714 > ns3113832.ip-54-38-177.eu.8333: tcp 24
06:28:24.665768 IP tom-Latitude-3570.56714 > ns3113832.ip-54-38-177.eu.8333: tcp 289
06:28:24.666363 IP ns3113832.ip-54-38-177.eu.8333 > tom-Latitude-3570.56714: tcp 24
06:28:24.666387 IP ns3113832.ip-54-38-177.eu.8333 > tom-Latitude-3570.56714: tcp 433
06:28:24.666430 IP tom-Latitude-3570.56714 > ns3113832.ip-54-38-177.eu.8333: tcp 0
06:28:24.667221 IP tom-Latitude-3570.56714 > ns3113832.ip-54-38-177.eu.8333: tcp 169
06:28:24.682854 IP ns3113832.ip-54-38-177.eu.8333 > tom-Latitude-3570.56714: tcp 433
06:28:24.682862 IP tom-Latitude-3570.56714 > ns3113832.ip-54-38-177.eu.8333: tcp 0
06:28:24.693914 IP ns3113832.ip-54-38-177.eu.8333 > tom-Latitude-3570.56714: tcp 0
06:28:24.703318 IP ns3113832.ip-54-38-177.eu.8333 > tom-Latitude-3570.56714: tcp 0
06:28:24.703323 IP ns3113832.ip-54-38-177.eu.8333 > tom-Latitude-3570.56714: tcp 0
06:28:24.760860 IP ns3113832.ip-54-38-177.eu.8333 > tom-Latitude-3570.56714: tcp 24
06:28:24.760865 IP tom-Latitude-3570.56714 > ns3113832.ip-54-38-177.eu.8333: tcp 0
06:28:24.762532 IP ns3113832.ip-54-38-177.eu.8333 > tom-Latitude-3570.56714: tcp 964
06:28:24.762539 IP tom-Latitude-3570.56714 > ns3113832.ip-54-38-177.eu.8333: tcp 0
06:28:24.762546 IP ns3113832.ip-54-38-177.eu.8333 > tom-Latitude-3570.56714: tcp 24
06:28:24.762549 IP tom-Latitude-3570.56714 > ns3113832.ip-54-38-177.eu.8333: tcp 0
06:28:24.762553 IP ns3113832.ip-54-38-177.eu.8333 > tom-Latitude-3570.56714: tcp 189
06:28:24.762555 IP tom-Latitude-3570.56714 > ns3113832.ip-54-38-177.eu.8333: tcp 0
06:28:24.762559 IP ns3113832.ip-54-38-177.eu.8333 > tom-Latitude-3570.56714: tcp 24
06:28:24.762560 IP tom-Latitude-3570.56714 > ns3113832.ip-54-38-177.eu.8333: tcp 0
06:28:24.762564 IP ns3113832.ip-54-38-177.eu.8333 > tom-Latitude-3570.56714: tcp 435
06:28:24.762566 IP tom-Latitude-3570.56714 > ns3113832.ip-54-38-177.eu.8333: tcp 0
06:28:24.762569 IP ns3113832.ip-54-38-177.eu.8333 > tom-Latitude-3570.56714: tcp 24
06:28:24.762572 IP tom-Latitude-3570.56714 > ns3113832.ip-54-38-177.eu.8333: tcp 0
06:28:24.762576 IP ns3113832.ip-54-38-177.eu.8333 > tom-Latitude-3570.56714: tcp 284
06:28:24.762581 IP tom-Latitude-3570.56714 > ns3113832.ip-54-38-177.eu.8333: tcp 0
06:28:24.866866 IP tom-Latitude-3570.60470 > bb42-60-217-183.singnet.com.sg.8333: tcp 24
06:28:24.867801 IP tom-Latitude-3570.60470 > bb42-60-217-183.singnet.com.sg.8333: tcp 325
06:28:24.895742 IP bb42-60-217-183.singnet.com.sg.8333 > tom-Latitude-3570.60470: tcp 0
06:28:24.903521 IP bb42-60-217-183.singnet.com.sg.8333 > tom-Latitude-3570.60470: tcp 0
06:28:25.769874 IP tom-Latitude-3570.42516 > 2.56.9.15.8333: tcp 24
06:28:25.801087 IP tom-Latitude-3570.42516 > 2.56.9.15.8333: tcp 433
06:28:25.853598 IP 2.56.9.15.8333 > tom-Latitude-3570.42516: tcp 0
06:28:25.853612 IP 2.56.9.15.8333 > tom-Latitude-3570.42516: tcp 0
06:28:25.870280 IP tom-Latitude-3570.39110 > vmi195435.contaboserver.net.8333: tcp 24
06:28:25.871899 IP tom-Latitude-3570.39110 > vmi195435.contaboserver.net.8333: tcp 145
06:28:25.903958 IP ns3113832.ip-54-38-177.eu.8333 > tom-Latitude-3570.56714: tcp 24
06:28:25.903984 IP tom-Latitude-3570.56714 > ns3113832.ip-54-38-177.eu.8333: tcp 0
06:28:25.904004 IP ns3113832.ip-54-38-177.eu.8333 > tom-Latitude-3570.56714: tcp 757
06:28:25.904008 IP tom-Latitude-3570.56714 > ns3113832.ip-54-38-177.eu.8333: tcp 0
06:28:25.904381 IP tom-Latitude-3570.56714 > ns3113832.ip-54-38-177.eu.8333: tcp 24
06:28:25.904530 IP vmi195435.contaboserver.net.8333 > tom-Latitude-3570.39110: tcp 0
06:28:25.907310 IP tom-Latitude-3570.56714 > ns3113832.ip-54-38-177.eu.8333: tcp 757
06:28:25.912336 IP vmi195435.contaboserver.net.8333 > tom-Latitude-3570.39110: tcp 0
06:28:25.943995 IP ns3113832.ip-54-38-177.eu.8333 > tom-Latitude-3570.56714: tcp 0
06:28:25.944832 IP ns3113832.ip-54-38-177.eu.8333 > tom-Latitude-3570.56714: tcp 0
06:28:26.002376 IP ns3113832.ip-54-38-177.eu.8333 > tom-Latitude-3570.56714: tcp 24
06:28:26.002385 IP ns3113832.ip-54-38-177.eu.8333 > tom-Latitude-3570.56714: tcp 257
06:28:26.002388 IP ns3113832.ip-54-38-177.eu.8333 > tom-Latitude-3570.56714: tcp 24
06:28:26.002400 IP tom-Latitude-3570.56714 > ns3113832.ip-54-38-177.eu.8333: tcp 0
06:28:26.002719 IP ns3113832.ip-54-38-177.eu.8333 > tom-Latitude-3570.56714: tcp 403
06:28:26.002725 IP ns3113832.ip-54-38-177.eu.8333 > tom-Latitude-3570.56714: tcp 24
06:28:26.002729 IP ns3113832.ip-54-38-177.eu.8333 > tom-Latitude-3570.56714: tcp 404
06:28:26.002734 IP ns3113832.ip-54-38-177.eu.8333 > tom-Latitude-3570.56714: tcp 24
06:28:26.002737 IP ns3113832.ip-54-38-177.eu.8333 > tom-Latitude-3570.56714: tcp 405
06:28:26.002756 IP ns3113832.ip-54-38-177.eu.8333 > tom-Latitude-3570.56714: tcp 24
06:28:26.002757 IP tom-Latitude-3570.56714 > ns3113832.ip-54-38-177.eu.8333: tcp 0
06:28:26.002758 IP ns3113832.ip-54-38-177.eu.8333 > tom-Latitude-3570.56714: tcp 735
06:28:26.002814 IP tom-Latitude-3570.56714 > ns3113832.ip-54-38-177.eu.8333: tcp 0
06:28:26.060475 IP ns3113832.ip-54-38-177.eu.8333 > tom-Latitude-3570.56714: tcp 1350
06:28:26.061013 IP ns3113832.ip-54-38-177.eu.8333 > tom-Latitude-3570.56714: tcp 1350
06:28:26.061032 IP ns3113832.ip-54-38-177.eu.8333 > tom-Latitude-3570.56714: tcp 1350
06:28:26.061039 IP ns3113832.ip-54-38-177.eu.8333 > tom-Latitude-3570.56714: tcp 1350
06:28:26.061043 IP ns3113832.ip-54-38-177.eu.8333 > tom-Latitude-3570.56714: tcp 124
06:28:26.061075 IP tom-Latitude-3570.56714 > ns3113832.ip-54-38-177.eu.8333: tcp 0
06:28:26.092458 IP bb42-60-217-183.singnet.com.sg.8333 > tom-Latitude-3570.60470: tcp 24
06:28:26.093116 IP bb42-60-217-183.singnet.com.sg.8333 > tom-Latitude-3570.60470: tcp 721
06:28:26.093181 IP tom-Latitude-3570.60470 > bb42-60-217-183.singnet.com.sg.8333: tcp 0
06:28:26.631140 IP bb42-60-217-183.singnet.com.sg.8333 > tom-Latitude-3570.60470: tcp 24
06:28:26.631161 IP bb42-60-217-183.singnet.com.sg.8333 > tom-Latitude-3570.60470: tcp 181
06:28:26.631234 IP tom-Latitude-3570.60470 > bb42-60-217-183.singnet.com.sg.8333: tcp 0
06:28:26.631517 IP tom-Latitude-3570.60470 > bb42-60-217-183.singnet.com.sg.8333: tcp 24
06:28:26.632793 IP tom-Latitude-3570.60470 > bb42-60-217-183.singnet.com.sg.8333: tcp 181
06:28:26.673552 IP bb42-60-217-183.singnet.com.sg.8333 > tom-Latitude-3570.60470: tcp 0
06:28:26.674231 IP bb42-60-217-183.singnet.com.sg.8333 > tom-Latitude-3570.60470: tcp 0
06:28:26.683358 IP bb42-60-217-183.singnet.com.sg.8333 > tom-Latitude-3570.60470: tcp 24
06:28:26.683376 IP bb42-60-217-183.singnet.com.sg.8333 > tom-Latitude-3570.60470: tcp 73
06:28:26.683424 IP tom-Latitude-3570.60470 > bb42-60-217-183.singnet.com.sg.8333: tcp 0
06:28:26.683614 IP tom-Latitude-3570.60470 > bb42-60-217-183.singnet.com.sg.8333: tcp 24
06:28:26.684943 IP tom-Latitude-3570.60470 > bb42-60-217-183.singnet.com.sg.8333: tcp 37
06:28:26.723402 IP bb42-60-217-183.singnet.com.sg.8333 > tom-Latitude-3570.60470: tcp 0
06:28:26.784172 IP tom-Latitude-3570.60988 > 81.198.101.144.8333: tcp 24
06:28:26.785109 IP tom-Latitude-3570.60988 > 81.198.101.144.8333: tcp 901
06:28:26.830385 IP 81.198.101.144.8333 > tom-Latitude-3570.60988: tcp 0
06:28:27.143001 IP static-87-75-105-186.vodafonexdsl.co.uk.8333 > tom-Latitude-3570.46284: tcp 24
06:28:27.143016 IP bb42-60-217-183.singnet.com.sg.8333 > tom-Latitude-3570.60470: tcp 24
06:28:27.143021 IP bb42-60-217-183.singnet.com.sg.8333 > tom-Latitude-3570.60470: tcp 283
06:28:27.143026 IP bb42-60-217-183.singnet.com.sg.8333 > tom-Latitude-3570.60470: tcp 24
06:28:27.143036 IP tom-Latitude-3570.60470 > bb42-60-217-183.singnet.com.sg.8333: tcp 0
06:28:27.143415 IP bb42-60-217-183.singnet.com.sg.8333 > tom-Latitude-3570.60470: tcp 284
06:28:27.143421 IP bb42-60-217-183.singnet.com.sg.8333 > tom-Latitude-3570.60470: tcp 24
06:28:27.143424 IP bb42-60-217-183.singnet.com.sg.8333 > tom-Latitude-3570.60470: tcp 283
06:28:27.143427 IP bb42-60-217-183.singnet.com.sg.8333 > tom-Latitude-3570.60470: tcp 24
06:28:27.143430 IP bb42-60-217-183.singnet.com.sg.8333 > tom-Latitude-3570.60470: tcp 284
06:28:27.143433 IP bb42-60-217-183.singnet.com.sg.8333 > tom-Latitude-3570.60470: tcp 24
06:28:27.143436 IP bb42-60-217-183.singnet.com.sg.8333 > tom-Latitude-3570.60470: tcp 284
06:28:27.143436 IP tom-Latitude-3570.60470 > bb42-60-217-183.singnet.com.sg.8333: tcp 0
06:28:27.143439 IP static-87-75-105-186.vodafonexdsl.co.uk.8333 > tom-Latitude-3570.46284: tcp 1261
06:28:27.143442 IP bb42-60-217-183.singnet.com.sg.8333 > tom-Latitude-3570.60470: tcp 24
06:28:27.143445 IP bb42-60-217-183.singnet.com.sg.8333 > tom-Latitude-3570.60470: tcp 283
06:28:27.143467 IP tom-Latitude-3570.60470 > bb42-60-217-183.singnet.com.sg.8333: tcp 0
06:28:27.143491 IP tom-Latitude-3570.46284 > static-87-75-105-186.vodafonexdsl.co.uk.8333: tcp 0
06:28:27.143931 IP tom-Latitude-3570.46284 > static-87-75-105-186.vodafonexdsl.co.uk.8333: tcp 24
06:28:27.146886 IP tom-Latitude-3570.46284 > static-87-75-105-186.vodafonexdsl.co.uk.8333: tcp 253
06:28:27.151170 IP static-87-75-105-186.vodafonexdsl.co.uk.8333 > tom-Latitude-3570.46284: tcp 1261
06:28:27.151177 IP tom-Latitude-3570.46284 > static-87-75-105-186.vodafonexdsl.co.uk.8333: tcp 0
06:28:27.183530 IP static-87-75-105-186.vodafonexdsl.co.uk.8333 > tom-Latitude-3570.46284: tcp 0
06:28:27.245221 IP tom-Latitude-3570.56714 > ns3113832.ip-54-38-177.eu.8333: tcp 24
06:28:27.246181 IP tom-Latitude-3570.56714 > ns3113832.ip-54-38-177.eu.8333: tcp 217
06:28:27.249718 IP static-87-75-105-186.vodafonexdsl.co.uk.8333 > tom-Latitude-3570.46284: tcp 24
06:28:27.249744 IP tom-Latitude-3570.46284 > static-87-75-105-186.vodafonexdsl.co.uk.8333: tcp 0
06:28:27.249763 IP static-87-75-105-186.vodafonexdsl.co.uk.8333 > tom-Latitude-3570.46284: tcp 372
06:28:27.249767 IP tom-Latitude-3570.46284 > static-87-75-105-186.vodafonexdsl.co.uk.8333: tcp 0
06:28:27.249771 IP static-87-75-105-186.vodafonexdsl.co.uk.8333 > tom-Latitude-3570.46284: tcp 24
06:28:27.249773 IP tom-Latitude-3570.46284 > static-87-75-105-186.vodafonexdsl.co.uk.8333: tcp 0
06:28:27.249777 IP static-87-75-105-186.vodafonexdsl.co.uk.8333 > tom-Latitude-3570.46284: tcp 225
06:28:27.249780 IP static-87-75-105-186.vodafonexdsl.co.uk.8333 > tom-Latitude-3570.46284: tcp 24
06:28:27.249782 IP tom-Latitude-3570.46284 > static-87-75-105-186.vodafonexdsl.co.uk.8333: tcp 0
06:28:27.249783 IP static-87-75-105-186.vodafonexdsl.co.uk.8333 > tom-Latitude-3570.46284: tcp 435
06:28:27.249785 IP static-87-75-105-186.vodafonexdsl.co.uk.8333 > tom-Latitude-3570.46284: tcp 24
06:28:27.249789 IP tom-Latitude-3570.46284 > static-87-75-105-186.vodafonexdsl.co.uk.8333: tcp 0
06:28:27.249792 IP tom-Latitude-3570.46284 > static-87-75-105-186.vodafonexdsl.co.uk.8333: tcp 0
06:28:27.249795 IP tom-Latitude-3570.46284 > static-87-75-105-186.vodafonexdsl.co.uk.8333: tcp 0
06:28:27.253196 IP static-87-75-105-186.vodafonexdsl.co.uk.8333 > tom-Latitude-3570.46284: tcp 225
06:28:27.253209 IP tom-Latitude-3570.46284 > static-87-75-105-186.vodafonexdsl.co.uk.8333: tcp 0
06:28:27.253224 IP static-87-75-105-186.vodafonexdsl.co.uk.8333 > tom-Latitude-3570.46284: tcp 24
06:28:27.253226 IP tom-Latitude-3570.46284 > static-87-75-105-186.vodafonexdsl.co.uk.8333: tcp 0
06:28:27.253231 IP static-87-75-105-186.vodafonexdsl.co.uk.8333 > tom-Latitude-3570.46284: tcp 283
06:28:27.253234 IP tom-Latitude-3570.46284 > static-87-75-105-186.vodafonexdsl.co.uk.8333: tcp 0
06:28:27.253237 IP static-87-75-105-186.vodafonexdsl.co.uk.8333 > tom-Latitude-3570.46284: tcp 24
06:28:27.253239 IP tom-Latitude-3570.46284 > static-87-75-105-186.vodafonexdsl.co.uk.8333: tcp 0
06:28:27.253242 IP static-87-75-105-186.vodafonexdsl.co.uk.8333 > tom-Latitude-3570.46284: tcp 284
06:28:27.253245 IP tom-Latitude-3570.46284 > static-87-75-105-186.vodafonexdsl.co.uk.8333: tcp 0
06:28:27.253249 IP static-87-75-105-186.vodafonexdsl.co.uk.8333 > tom-Latitude-3570.46284: tcp 24
06:28:27.253252 IP tom-Latitude-3570.46284 > static-87-75-105-186.vodafonexdsl.co.uk.8333: tcp 0
06:28:27.253255 IP static-87-75-105-186.vodafonexdsl.co.uk.8333 > tom-Latitude-3570.46284: tcp 284
06:28:27.253264 IP tom-Latitude-3570.46284 > static-87-75-105-186.vodafonexdsl.co.uk.8333: tcp 0
06:28:27.291412 IP ns3113832.ip-54-38-177.eu.8333 > tom-Latitude-3570.56714: tcp 0
06:28:27.292128 IP ns3113832.ip-54-38-177.eu.8333 > tom-Latitude-3570.56714: tcp 0
06:28:27.357423 IP static-87-75-105-186.vodafonexdsl.co.uk.8333 > tom-Latitude-3570.46284: tcp 24
06:28:27.357446 IP tom-Latitude-3570.46284 > static-87-75-105-186.vodafonexdsl.co.uk.8333: tcp 0
06:28:27.367535 IP static-87-75-105-186.vodafonexdsl.co.uk.8333 > tom-Latitude-3570.46284: tcp 109
06:28:27.367626 IP tom-Latitude-3570.46284 > static-87-75-105-186.vodafonexdsl.co.uk.8333: tcp 0
06:28:27.468222 IP tom-Latitude-3570.39110 > vmi195435.contaboserver.net.8333: tcp 24
06:28:27.468242 IP tom-Latitude-3570.39110 > vmi195435.contaboserver.net.8333: tcp 1225
06:28:27.468412 IP tom-Latitude-3570.49070 > c-185-45-236-223.customer.ggaweb.ch.8333: tcp 24
06:28:27.468418 IP tom-Latitude-3570.49070 > c-185-45-236-223.customer.ggaweb.ch.8333: tcp 1261
06:28:27.496073 IP vmi195435.contaboserver.net.8333 > tom-Latitude-3570.39110: tcp 0
06:28:27.503513 IP vmi195435.contaboserver.net.8333 > tom-Latitude-3570.39110: tcp 0
06:28:27.503527 IP c-185-45-236-223.customer.ggaweb.ch.8333 > tom-Latitude-3570.49070: tcp 0
06:28:27.504559 IP c-185-45-236-223.customer.ggaweb.ch.8333 > tom-Latitude-3570.49070: tcp 0
06:28:27.669189 IP tom-Latitude-3570.60470 > bb42-60-217-183.singnet.com.sg.8333: tcp 24
06:28:27.671293 IP tom-Latitude-3570.60470 > bb42-60-217-183.singnet.com.sg.8333: tcp 253
06:28:27.714495 IP bb42-60-217-183.singnet.com.sg.8333 > tom-Latitude-3570.60470: tcp 0
06:28:27.762444 IP 81.198.101.144.8333 > tom-Latitude-3570.60988: tcp 24
06:28:27.763022 IP 81.198.101.144.8333 > tom-Latitude-3570.60988: tcp 541
06:28:27.763086 IP tom-Latitude-3570.60988 > 81.198.101.144.8333: tcp 0
06:28:27.763403 IP tom-Latitude-3570.60988 > 81.198.101.144.8333: tcp 24
06:28:27.764539 IP tom-Latitude-3570.60988 > 81.198.101.144.8333: tcp 73
06:28:27.793400 IP 81.198.101.144.8333 > tom-Latitude-3570.60988: tcp 0
06:28:27.891792 IP 81.198.101.144.8333 > tom-Latitude-3570.60988: tcp 24
06:28:27.891814 IP 81.198.101.144.8333 > tom-Latitude-3570.60988: tcp 249
06:28:27.891819 IP 81.198.101.144.8333 > tom-Latitude-3570.60988: tcp 24
06:28:27.891857 IP tom-Latitude-3570.60988 > 81.198.101.144.8333: tcp 0
06:28:27.891932 IP 81.198.101.144.8333 > tom-Latitude-3570.60988: tcp 1448
06:28:27.891941 IP 81.198.101.144.8333 > tom-Latitude-3570.60988: tcp 133
06:28:27.891967 IP tom-Latitude-3570.60988 > 81.198.101.144.8333: tcp 0
06:28:27.892027 IP tom-Latitude-3570.49070 > c-185-45-236-223.customer.ggaweb.ch.8333: tcp 24
06:28:27.893972 IP tom-Latitude-3570.49070 > c-185-45-236-223.customer.ggaweb.ch.8333: tcp 109
06:28:27.923643 IP c-185-45-236-223.customer.ggaweb.ch.8333 > tom-Latitude-3570.49070: tcp 0
06:28:27.923657 IP c-185-45-236-223.customer.ggaweb.ch.8333 > tom-Latitude-3570.49070: tcp 0
06:28:27.995279 IP tom-Latitude-3570.49070 > c-185-45-236-223.customer.ggaweb.ch.8333: tcp 24
06:28:27.995534 IP tom-Latitude-3570.57976 > 167.99.216.145.8333: tcp 24
06:28:27.995542 IP tom-Latitude-3570.57976 > 167.99.216.145.8333: tcp 1261
06:28:27.996384 IP tom-Latitude-3570.49070 > c-185-45-236-223.customer.ggaweb.ch.8333: tcp 73
06:28:28.025395 IP c-185-45-236-223.customer.ggaweb.ch.8333 > tom-Latitude-3570.49070: tcp 0
06:28:28.033333 IP 167.99.216.145.8333 > tom-Latitude-3570.57976: tcp 0
06:28:28.034001 IP 167.99.216.145.8333 > tom-Latitude-3570.57976: tcp 0
06:28:28.034015 IP c-185-45-236-223.customer.ggaweb.ch.8333 > tom-Latitude-3570.49070: tcp 0
06:28:28.296611 IP tom-Latitude-3570.56714 > ns3113832.ip-54-38-177.eu.8333: tcp 24
06:28:28.298677 IP tom-Latitude-3570.56714 > ns3113832.ip-54-38-177.eu.8333: tcp 325
06:28:28.356622 IP ns3113832.ip-54-38-177.eu.8333 > tom-Latitude-3570.56714: tcp 0
06:28:28.356636 IP ns3113832.ip-54-38-177.eu.8333 > tom-Latitude-3570.56714: tcp 0
06:28:28.597883 IP tom-Latitude-3570.42516 > 2.56.9.15.8333: tcp 24
06:28:28.597903 IP tom-Latitude-3570.42516 > 2.56.9.15.8333: tcp 1261
06:28:28.606748 IP vmi195435.contaboserver.net.8333 > tom-Latitude-3570.39110: tcp 24
06:28:28.606774 IP tom-Latitude-3570.39110 > vmi195435.contaboserver.net.8333: tcp 0
06:28:28.607639 IP vmi195435.contaboserver.net.8333 > tom-Latitude-3570.39110: tcp 361
06:28:28.607666 IP tom-Latitude-3570.39110 > vmi195435.contaboserver.net.8333: tcp 0
06:28:28.607691 IP 167.99.216.145.8333 > tom-Latitude-3570.57976: tcp 24
06:28:28.607695 IP tom-Latitude-3570.57976 > 167.99.216.145.8333: tcp 0
06:28:28.607718 IP 167.99.216.145.8333 > tom-Latitude-3570.57976: tcp 253
06:28:28.607723 IP tom-Latitude-3570.57976 > 167.99.216.145.8333: tcp 0
06:28:28.608022 IP tom-Latitude-3570.39110 > vmi195435.contaboserver.net.8333: tcp 24
06:28:28.611070 IP tom-Latitude-3570.39110 > vmi195435.contaboserver.net.8333: tcp 289
06:28:28.651790 IP 2.56.9.15.8333 > tom-Latitude-3570.42516: tcp 0
06:28:28.652425 IP 2.56.9.15.8333 > tom-Latitude-3570.42516: tcp 0
06:28:28.652438 IP vmi195435.contaboserver.net.8333 > tom-Latitude-3570.39110: tcp 0
06:28:28.652442 IP vmi195435.contaboserver.net.8333 > tom-Latitude-3570.39110: tcp 0
06:28:28.731145 IP vmi195435.contaboserver.net.8333 > tom-Latitude-3570.39110: tcp 24
06:28:28.732021 IP vmi195435.contaboserver.net.8333 > tom-Latitude-3570.39110: tcp 405
06:28:28.732039 IP vmi195435.contaboserver.net.8333 > tom-Latitude-3570.39110: tcp 24
06:28:28.732043 IP vmi195435.contaboserver.net.8333 > tom-Latitude-3570.39110: tcp 700
06:28:28.732047 IP vmi195435.contaboserver.net.8333 > tom-Latitude-3570.39110: tcp 24
06:28:28.732049 IP vmi195435.contaboserver.net.8333 > tom-Latitude-3570.39110: tcp 404
06:28:28.732052 IP vmi195435.contaboserver.net.8333 > tom-Latitude-3570.39110: tcp 24
06:28:28.732055 IP vmi195435.contaboserver.net.8333 > tom-Latitude-3570.39110: tcp 246
06:28:28.732057 IP vmi195435.contaboserver.net.8333 > tom-Latitude-3570.39110: tcp 24
06:28:28.732064 IP vmi195435.contaboserver.net.8333 > tom-Latitude-3570.39110: tcp 214
06:28:28.732103 IP tom-Latitude-3570.39110 > vmi195435.contaboserver.net.8333: tcp 0
06:28:28.738478 IP static-87-75-105-186.vodafonexdsl.co.uk.8333 > tom-Latitude-3570.46284: tcp 24
06:28:28.738492 IP tom-Latitude-3570.46284 > static-87-75-105-186.vodafonexdsl.co.uk.8333: tcp 0
06:28:28.752853 IP static-87-75-105-186.vodafonexdsl.co.uk.8333 > tom-Latitude-3570.46284: tcp 361
06:28:28.752879 IP tom-Latitude-3570.46284 > static-87-75-105-186.vodafonexdsl.co.uk.8333: tcp 0
06:28:28.822987 IP vmi195435.contaboserver.net.8333 > tom-Latitude-3570.39110: tcp 1448
06:28:28.823007 IP vmi195435.contaboserver.net.8333 > tom-Latitude-3570.39110: tcp 146
06:28:28.823049 IP tom-Latitude-3570.39110 > vmi195435.contaboserver.net.8333: tcp 0
06:28:28.896345 IP ns3113832.ip-54-38-177.eu.8333 > tom-Latitude-3570.56714: tcp 24
06:28:28.898046 IP ns3113832.ip-54-38-177.eu.8333 > tom-Latitude-3570.56714: tcp 1350
06:28:28.898068 IP ns3113832.ip-54-38-177.eu.8333 > tom-Latitude-3570.56714: tcp 1350
06:28:28.898073 IP ns3113832.ip-54-38-177.eu.8333 > tom-Latitude-3570.56714: tcp 1350
06:28:28.898078 IP ns3113832.ip-54-38-177.eu.8333 > tom-Latitude-3570.56714: tcp 1350
06:28:28.898081 IP ns3113832.ip-54-38-177.eu.8333 > tom-Latitude-3570.56714: tcp 1350
06:28:28.898089 IP ns3113832.ip-54-38-177.eu.8333 > tom-Latitude-3570.56714: tcp 1350
06:28:28.898092 IP ns3113832.ip-54-38-177.eu.8333 > tom-Latitude-3570.56714: tcp 1350
06:28:28.898095 IP ns3113832.ip-54-38-177.eu.8333 > tom-Latitude-3570.56714: tcp 1350
06:28:28.898098 IP ns3113832.ip-54-38-177.eu.8333 > tom-Latitude-3570.56714: tcp 309
06:28:28.898157 IP tom-Latitude-3570.56714 > ns3113832.ip-54-38-177.eu.8333: tcp 0
06:28:28.912679 IP vmi195435.contaboserver.net.8333 > tom-Latitude-3570.39110: tcp 24
06:28:28.914318 IP vmi195435.contaboserver.net.8333 > tom-Latitude-3570.39110: tcp 1448
06:28:28.914328 IP vmi195435.contaboserver.net.8333 > tom-Latitude-3570.39110: tcp 1448
06:28:28.914333 IP vmi195435.contaboserver.net.8333 > tom-Latitude-3570.39110: tcp 1448
06:28:28.914339 IP vmi195435.contaboserver.net.8333 > tom-Latitude-3570.39110: tcp 1448
06:28:28.914343 IP vmi195435.contaboserver.net.8333 > tom-Latitude-3570.39110: tcp 1448
06:28:28.914349 IP tom-Latitude-3570.39110 > vmi195435.contaboserver.net.8333: tcp 0
06:28:28.914352 IP vmi195435.contaboserver.net.8333 > tom-Latitude-3570.39110: tcp 1448
06:28:28.914424 IP tom-Latitude-3570.39110 > vmi195435.contaboserver.net.8333: tcp 0
06:28:28.914612 IP vmi195435.contaboserver.net.8333 > tom-Latitude-3570.39110: tcp 1448
06:28:28.914619 IP vmi195435.contaboserver.net.8333 > tom-Latitude-3570.39110: tcp 973
06:28:28.914634 IP tom-Latitude-3570.39110 > vmi195435.contaboserver.net.8333: tcp 0
06:28:28.955724 IP 167.99.216.145.8333 > tom-Latitude-3570.57976: tcp 24
06:28:28.955739 IP tom-Latitude-3570.57976 > 167.99.216.145.8333: tcp 0
06:28:28.956641 IP 167.99.216.145.8333 > tom-Latitude-3570.57976: tcp 1448
06:28:28.956650 IP tom-Latitude-3570.57976 > 167.99.216.145.8333: tcp 0
06:28:28.956660 IP 167.99.216.145.8333 > tom-Latitude-3570.57976: tcp 1448
06:28:28.956665 IP tom-Latitude-3570.57976 > 167.99.216.145.8333: tcp 0
06:28:28.959343 IP tom-Latitude-3570.49070 > c-185-45-236-223.customer.ggaweb.ch.8333: tcp 24
06:28:28.959377 IP tom-Latitude-3570.60988 > 81.198.101.144.8333: tcp 24
06:28:28.959398 IP tom-Latitude-3570.57976 > 167.99.216.145.8333: tcp 24
06:28:28.959412 IP tom-Latitude-3570.60470 > bb42-60-217-183.singnet.com.sg.8333: tcp 24
06:28:28.959427 IP tom-Latitude-3570.42516 > 2.56.9.15.8333: tcp 24
06:28:28.959443 IP tom-Latitude-3570.46284 > static-87-75-105-186.vodafonexdsl.co.uk.8333: tcp 24
06:28:28.959566 IP 167.99.216.145.8333 > tom-Latitude-3570.57976: tcp 1448
06:28:28.959585 IP 167.99.216.145.8333 > tom-Latitude-3570.57976: tcp 1448
06:28:28.959592 IP tom-Latitude-3570.57976 > 167.99.216.145.8333: tcp 82
06:28:28.959602 IP 167.99.216.145.8333 > tom-Latitude-3570.57976: tcp 1448
06:28:28.959605 IP tom-Latitude-3570.57976 > 167.99.216.145.8333: tcp 0
06:28:28.961312 IP 167.99.216.145.8333 > tom-Latitude-3570.57976: tcp 1448
06:28:28.961365 IP tom-Latitude-3570.57976 > 167.99.216.145.8333: tcp 0
06:28:28.961413 IP 167.99.216.145.8333 > tom-Latitude-3570.57976: tcp 1448
06:28:28.961464 IP 167.99.216.145.8333 > tom-Latitude-3570.57976: tcp 973
06:28:28.961505 IP tom-Latitude-3570.57976 > 167.99.216.145.8333: tcp 0
06:28:28.963237 IP tom-Latitude-3570.49070 > c-185-45-236-223.customer.ggaweb.ch.8333: tcp 82
06:28:28.964828 IP tom-Latitude-3570.60470 > bb42-60-217-183.singnet.com.sg.8333: tcp 82
06:28:28.964869 IP tom-Latitude-3570.60988 > 81.198.101.144.8333: tcp 82
06:28:28.966172 IP tom-Latitude-3570.46284 > static-87-75-105-186.vodafonexdsl.co.uk.8333: tcp 82
06:28:28.966200 IP tom-Latitude-3570.42516 > 2.56.9.15.8333: tcp 82
06:28:28.969986 IP c-185-45-236-223.customer.ggaweb.ch.8333 > tom-Latitude-3570.49070: tcp 24
06:28:28.970008 IP tom-Latitude-3570.49070 > c-185-45-236-223.customer.ggaweb.ch.8333: tcp 0
06:28:28.970019 IP c-185-45-236-223.customer.ggaweb.ch.8333 > tom-Latitude-3570.49070: tcp 82
06:28:28.970022 IP tom-Latitude-3570.49070 > c-185-45-236-223.customer.ggaweb.ch.8333: tcp 0
06:28:28.983758 IP 2.56.9.15.8333 > tom-Latitude-3570.42516: tcp 24
06:28:28.983805 IP tom-Latitude-3570.42516 > 2.56.9.15.8333: tcp 0
06:28:28.983836 IP 2.56.9.15.8333 > tom-Latitude-3570.42516: tcp 82
06:28:28.983840 IP tom-Latitude-3570.42516 > 2.56.9.15.8333: tcp 0
06:28:28.994851 IP c-185-45-236-223.customer.ggaweb.ch.8333 > tom-Latitude-3570.49070: tcp 0
06:28:28.998770 IP 2.56.9.15.8333 > tom-Latitude-3570.42516: tcp 0
06:28:28.998782 IP 167.99.216.145.8333 > tom-Latitude-3570.57976: tcp 0
06:28:28.999652 IP 167.99.216.145.8333 > tom-Latitude-3570.57976: tcp 0
06:28:28.999657 IP c-185-45-236-223.customer.ggaweb.ch.8333 > tom-Latitude-3570.49070: tcp 0
06:28:29.004071 IP bb42-60-217-183.singnet.com.sg.8333 > tom-Latitude-3570.60470: tcp 0
06:28:29.004083 IP 81.198.101.144.8333 > tom-Latitude-3570.60988: tcp 0
06:28:29.004086 IP static-87-75-105-186.vodafonexdsl.co.uk.8333 > tom-Latitude-3570.46284: tcp 0
06:28:29.004090 IP 2.56.9.15.8333 > tom-Latitude-3570.42516: tcp 0
06:28:29.004092 IP 81.198.101.144.8333 > tom-Latitude-3570.60988: tcp 24
06:28:29.004099 IP 81.198.101.144.8333 > tom-Latitude-3570.60988: tcp 82
06:28:29.004181 IP tom-Latitude-3570.60988 > 81.198.101.144.8333: tcp 0
06:28:29.104775 IP tom-Latitude-3570.42516 > 2.56.9.15.8333: tcp 24
06:28:29.106349 IP tom-Latitude-3570.42516 > 2.56.9.15.8333: tcp 325
06:28:29.137682 IP 2.56.9.15.8333 > tom-Latitude-3570.42516: tcp 0
06:28:29.142765 IP 2.56.9.15.8333 > tom-Latitude-3570.42516: tcp 0
06:28:29.186462 IP bb42-60-217-183.singnet.com.sg.8333 > tom-Latitude-3570.60470: tcp 24
06:28:29.186482 IP bb42-60-217-183.singnet.com.sg.8333 > tom-Latitude-3570.60470: tcp 82
06:28:29.186528 IP tom-Latitude-3570.60470 > bb42-60-217-183.singnet.com.sg.8333: tcp 0
06:28:30.215644 IP 167.99.216.145.8333 > tom-Latitude-3570.57976: tcp 24
06:28:30.215666 IP 167.99.216.145.8333 > tom-Latitude-3570.57976: tcp 325
06:28:30.215673 IP 167.99.216.145.8333 > tom-Latitude-3570.57976: tcp 325
06:28:30.215691 IP tom-Latitude-3570.57976 > 167.99.216.145.8333: tcp 0
06:28:30.215725 IP ns3113832.ip-54-38-177.eu.8333 > tom-Latitude-3570.56714: tcp 24
06:28:30.215731 IP ns3113832.ip-54-38-177.eu.8333 > tom-Latitude-3570.56714: tcp 361
06:28:30.215742 IP 2.56.9.15.8333 > tom-Latitude-3570.42516: tcp 24
06:28:30.215750 IP tom-Latitude-3570.42516 > 2.56.9.15.8333: tcp 0
06:28:30.215758 IP 2.56.9.15.8333 > tom-Latitude-3570.42516: tcp 109
06:28:30.215762 IP tom-Latitude-3570.42516 > 2.56.9.15.8333: tcp 0
06:28:30.215768 IP ns3113832.ip-54-38-177.eu.8333 > tom-Latitude-3570.56714: tcp 361
06:28:30.215788 IP tom-Latitude-3570.56714 > ns3113832.ip-54-38-177.eu.8333: tcp 0
06:28:30.215793 IP 2.56.9.15.8333 > tom-Latitude-3570.42516: tcp 109
06:28:30.215795 IP tom-Latitude-3570.42516 > 2.56.9.15.8333: tcp 0
06:28:30.216287 IP tom-Latitude-3570.56714 > ns3113832.ip-54-38-177.eu.8333: tcp 24
06:28:30.216420 IP tom-Latitude-3570.42516 > 2.56.9.15.8333: tcp 24
06:28:30.221204 IP tom-Latitude-3570.56714 > ns3113832.ip-54-38-177.eu.8333: tcp 73
06:28:30.221811 IP tom-Latitude-3570.42516 > 2.56.9.15.8333: tcp 37
06:28:30.251389 IP ns3113832.ip-54-38-177.eu.8333 > tom-Latitude-3570.56714: tcp 0
06:28:30.252205 IP 2.56.9.15.8333 > tom-Latitude-3570.42516: tcp 0
06:28:30.252219 IP ns3113832.ip-54-38-177.eu.8333 > tom-Latitude-3570.56714: tcp 0
06:28:30.252223 IP 2.56.9.15.8333 > tom-Latitude-3570.42516: tcp 0
06:28:30.309547 IP ns3113832.ip-54-38-177.eu.8333 > tom-Latitude-3570.56714: tcp 24
06:28:30.310190 IP ns3113832.ip-54-38-177.eu.8333 > tom-Latitude-3570.56714: tcp 370
06:28:30.310209 IP ns3113832.ip-54-38-177.eu.8333 > tom-Latitude-3570.56714: tcp 24
06:28:30.310214 IP ns3113832.ip-54-38-177.eu.8333 > tom-Latitude-3570.56714: tcp 226
06:28:30.310255 IP tom-Latitude-3570.56714 > ns3113832.ip-54-38-177.eu.8333: tcp 0
06:28:30.348086 IP 2.56.9.15.8333 > tom-Latitude-3570.42516: tcp 24
06:28:30.348660 IP 2.56.9.15.8333 > tom-Latitude-3570.42516: tcp 248
06:28:30.348727 IP tom-Latitude-3570.42516 > 2.56.9.15.8333: tcp 0
06:28:30.348888 IP tom-Latitude-3570.39110 > vmi195435.contaboserver.net.8333: tcp 24
06:28:30.350677 IP tom-Latitude-3570.39110 > vmi195435.contaboserver.net.8333: tcp 73
06:28:30.387078 IP vmi195435.contaboserver.net.8333 > tom-Latitude-3570.39110: tcp 0
06:28:30.387092 IP vmi195435.contaboserver.net.8333 > tom-Latitude-3570.39110: tcp 0
06:28:30.422226 IP bb42-60-217-183.singnet.com.sg.8333 > tom-Latitude-3570.60470: tcp 24
06:28:30.422792 IP bb42-60-217-183.singnet.com.sg.8333 > tom-Latitude-3570.60470: tcp 31
06:28:30.422856 IP tom-Latitude-3570.60470 > bb42-60-217-183.singnet.com.sg.8333: tcp 0
06:28:30.423031 IP tom-Latitude-3570.56714 > ns3113832.ip-54-38-177.eu.8333: tcp 24
06:28:30.424387 IP tom-Latitude-3570.56714 > ns3113832.ip-54-38-177.eu.8333: tcp 37
06:28:30.462827 IP ns3113832.ip-54-38-177.eu.8333 > tom-Latitude-3570.56714: tcp 0
06:28:30.463344 IP ns3113832.ip-54-38-177.eu.8333 > tom-Latitude-3570.56714: tcp 0
06:28:30.724109 IP tom-Latitude-3570.60470 > bb42-60-217-183.singnet.com.sg.8333: tcp 24
06:28:30.726245 IP tom-Latitude-3570.60470 > bb42-60-217-183.singnet.com.sg.8333: tcp 37
06:28:30.772101 IP vmi195435.contaboserver.net.8333 > tom-Latitude-3570.39110: tcp 24
06:28:30.772734 IP vmi195435.contaboserver.net.8333 > tom-Latitude-3570.39110: tcp 73
06:28:30.772792 IP tom-Latitude-3570.39110 > vmi195435.contaboserver.net.8333: tcp 0
06:28:30.772984 IP tom-Latitude-3570.39110 > vmi195435.contaboserver.net.8333: tcp 24
06:28:30.774691 IP tom-Latitude-3570.39110 > vmi195435.contaboserver.net.8333: tcp 37
06:28:30.782687 IP bb42-60-217-183.singnet.com.sg.8333 > tom-Latitude-3570.60470: tcp 0
06:28:30.799805 IP bb42-60-217-183.singnet.com.sg.8333 > tom-Latitude-3570.60470: tcp 24
06:28:30.800394 IP bb42-60-217-183.singnet.com.sg.8333 > tom-Latitude-3570.60470: tcp 361
06:28:30.800458 IP tom-Latitude-3570.60470 > bb42-60-217-183.singnet.com.sg.8333: tcp 0
06:28:30.803035 IP vmi195435.contaboserver.net.8333 > tom-Latitude-3570.39110: tcp 0
06:28:30.804362 IP vmi195435.contaboserver.net.8333 > tom-Latitude-3570.39110: tcp 0
06:28:30.901233 IP tom-Latitude-3570.46284 > static-87-75-105-186.vodafonexdsl.co.uk.8333: tcp 24
06:28:30.917212 IP vmi195435.contaboserver.net.8333 > tom-Latitude-3570.39110: tcp 24
06:28:30.917834 IP vmi195435.contaboserver.net.8333 > tom-Latitude-3570.39110: tcp 225
06:28:30.917931 IP tom-Latitude-3570.39110 > vmi195435.contaboserver.net.8333: tcp 0
06:28:30.919744 IP tom-Latitude-3570.46284 > static-87-75-105-186.vodafonexdsl.co.uk.8333: tcp 109
06:28:30.962672 IP static-87-75-105-186.vodafonexdsl.co.uk.8333 > tom-Latitude-3570.46284: tcp 0
06:28:31.018625 IP tom-Latitude-3570.57976 > 167.99.216.145.8333: tcp 24
06:28:31.018668 IP tom-Latitude-3570.42516 > 2.56.9.15.8333: tcp 24
06:28:31.020582 IP tom-Latitude-3570.57976 > 167.99.216.145.8333: tcp 109
06:28:31.021920 IP tom-Latitude-3570.42516 > 2.56.9.15.8333: tcp 37
06:28:31.055059 IP 2.56.9.15.8333 > tom-Latitude-3570.42516: tcp 0
06:28:31.061159 IP 167.99.216.145.8333 > tom-Latitude-3570.57976: tcp 0
06:28:31.061710 IP 2.56.9.15.8333 > tom-Latitude-3570.42516: tcp 0
06:28:31.061723 IP 167.99.216.145.8333 > tom-Latitude-3570.57976: tcp 0
06:28:31.119121 IP tom-Latitude-3570.60988 > 81.198.101.144.8333: tcp 24
06:28:31.121023 IP tom-Latitude-3570.60988 > 81.198.101.144.8333: tcp 433
06:28:31.123923 IP bb42-60-217-183.singnet.com.sg.8333 > tom-Latitude-3570.60470: tcp 24
06:28:31.124460 IP bb42-60-217-183.singnet.com.sg.8333 > tom-Latitude-3570.60470: tcp 37
06:28:31.124524 IP tom-Latitude-3570.60470 > bb42-60-217-183.singnet.com.sg.8333: tcp 0
06:28:31.158729 IP bb42-60-217-183.singnet.com.sg.8333 > tom-Latitude-3570.60470: tcp 24
06:28:31.159336 IP bb42-60-217-183.singnet.com.sg.8333 > tom-Latitude-3570.60470: tcp 257
06:28:31.159452 IP tom-Latitude-3570.60470 > bb42-60-217-183.singnet.com.sg.8333: tcp 0
06:28:31.159844 IP tom-Latitude-3570.60470 > bb42-60-217-183.singnet.com.sg.8333: tcp 24
06:28:31.161195 IP tom-Latitude-3570.60470 > bb42-60-217-183.singnet.com.sg.8333: tcp 37
06:28:31.162560 IP 81.198.101.144.8333 > tom-Latitude-3570.60988: tcp 0
06:28:31.202049 IP bb42-60-217-183.singnet.com.sg.8333 > tom-Latitude-3570.60470: tcp 0
06:28:31.260178 IP tom-Latitude-3570.57976 > 167.99.216.145.8333: tcp 24
06:28:31.260233 IP tom-Latitude-3570.46284 > static-87-75-105-186.vodafonexdsl.co.uk.8333: tcp 24
06:28:31.261140 IP tom-Latitude-3570.57976 > 167.99.216.145.8333: tcp 37
06:28:31.261732 IP tom-Latitude-3570.46284 > static-87-75-105-186.vodafonexdsl.co.uk.8333: tcp 37
06:28:31.303716 IP 167.99.216.145.8333 > tom-Latitude-3570.57976: tcp 0
06:28:31.303731 IP 167.99.216.145.8333 > tom-Latitude-3570.57976: tcp 0
06:28:31.303733 IP static-87-75-105-186.vodafonexdsl.co.uk.8333 > tom-Latitude-3570.46284: tcp 0
06:28:31.365739 IP 167.99.216.145.8333 > tom-Latitude-3570.57976: tcp 24
06:28:31.365756 IP tom-Latitude-3570.57976 > 167.99.216.145.8333: tcp 0
06:28:31.366498 IP 167.99.216.145.8333 > tom-Latitude-3570.57976: tcp 256
06:28:31.366524 IP tom-Latitude-3570.57976 > 167.99.216.145.8333: tcp 0
06:28:31.366911 IP tom-Latitude-3570.57976 > 167.99.216.145.8333: tcp 24
06:28:31.368484 IP tom-Latitude-3570.57976 > 167.99.216.145.8333: tcp 54
06:28:31.403065 IP 167.99.216.145.8333 > tom-Latitude-3570.57976: tcp 0
06:28:31.403080 IP 167.99.216.145.8333 > tom-Latitude-3570.57976: tcp 0
06:28:31.567699 IP tom-Latitude-3570.49070 > c-185-45-236-223.customer.ggaweb.ch.8333: tcp 24
06:28:31.569906 IP tom-Latitude-3570.49070 > c-185-45-236-223.customer.ggaweb.ch.8333: tcp 433
06:28:31.588015 IP bb42-60-217-183.singnet.com.sg.8333 > tom-Latitude-3570.60470: tcp 24
06:28:31.588037 IP bb42-60-217-183.singnet.com.sg.8333 > tom-Latitude-3570.60470: tcp 256
06:28:31.588080 IP tom-Latitude-3570.60470 > bb42-60-217-183.singnet.com.sg.8333: tcp 0
06:28:31.588440 IP tom-Latitude-3570.60470 > bb42-60-217-183.singnet.com.sg.8333: tcp 24
06:28:31.590527 IP tom-Latitude-3570.60470 > bb42-60-217-183.singnet.com.sg.8333: tcp 54
06:28:31.592524 IP c-185-45-236-223.customer.ggaweb.ch.8333 > tom-Latitude-3570.49070: tcp 0
06:28:31.602470 IP c-185-45-236-223.customer.ggaweb.ch.8333 > tom-Latitude-3570.49070: tcp 0
06:28:31.632629 IP bb42-60-217-183.singnet.com.sg.8333 > tom-Latitude-3570.60470: tcp 0
06:28:32.058307 IP static-87-75-105-186.vodafonexdsl.co.uk.8333 > tom-Latitude-3570.46284: tcp 24
06:28:32.058332 IP tom-Latitude-3570.46284 > static-87-75-105-186.vodafonexdsl.co.uk.8333: tcp 0
06:28:32.058349 IP static-87-75-105-186.vodafonexdsl.co.uk.8333 > tom-Latitude-3570.46284: tcp 73
06:28:32.058352 IP tom-Latitude-3570.46284 > static-87-75-105-186.vodafonexdsl.co.uk.8333: tcp 0
06:28:32.058357 IP static-87-75-105-186.vodafonexdsl.co.uk.8333 > tom-Latitude-3570.46284: tcp 73
06:28:32.058360 IP tom-Latitude-3570.46284 > static-87-75-105-186.vodafonexdsl.co.uk.8333: tcp 0
06:28:32.058571 IP tom-Latitude-3570.46284 > static-87-75-105-186.vodafonexdsl.co.uk.8333: tcp 24
06:28:32.061875 IP tom-Latitude-3570.46284 > static-87-75-105-186.vodafonexdsl.co.uk.8333: tcp 73
06:28:32.092650 IP static-87-75-105-186.vodafonexdsl.co.uk.8333 > tom-Latitude-3570.46284: tcp 0
06:28:32.196556 IP vmi195435.contaboserver.net.8333 > tom-Latitude-3570.39110: tcp 24
06:28:32.196577 IP vmi195435.contaboserver.net.8333 > tom-Latitude-3570.39110: tcp 109
06:28:32.196583 IP static-87-75-105-186.vodafonexdsl.co.uk.8333 > tom-Latitude-3570.46284: tcp 24
06:28:32.196586 IP static-87-75-105-186.vodafonexdsl.co.uk.8333 > tom-Latitude-3570.46284: tcp 223
06:28:32.196589 IP static-87-75-105-186.vodafonexdsl.co.uk.8333 > tom-Latitude-3570.46284: tcp 24
06:28:32.196592 IP static-87-75-105-186.vodafonexdsl.co.uk.8333 > tom-Latitude-3570.46284: tcp 226
