07:39:38.443885 IP tom-Latitude-3570.60470 > bb42-60-217-183.singnet.com.sg.8333: tcp 109
07:39:38.550817 IP bb42-60-217-183.singnet.com.sg.8333 > tom-Latitude-3570.60470: tcp 0
07:39:38.755850 IP static-87-75-105-186.vodafonexdsl.co.uk.8333 > tom-Latitude-3570.46284: tcp 24
07:39:38.755871 IP static-87-75-105-186.vodafonexdsl.co.uk.8333 > tom-Latitude-3570.46284: tcp 289
07:39:38.755876 IP bb42-60-217-183.singnet.com.sg.8333 > tom-Latitude-3570.60470: tcp 24
07:39:38.755881 IP bb42-60-217-183.singnet.com.sg.8333 > tom-Latitude-3570.60470: tcp 225
07:39:38.755884 IP bb42-60-217-183.singnet.com.sg.8333 > tom-Latitude-3570.60470: tcp 24
07:39:38.755886 IP bb42-60-217-183.singnet.com.sg.8333 > tom-Latitude-3570.60470: tcp 226
07:39:38.755911 IP bb42-60-217-183.singnet.com.sg.8333 > tom-Latitude-3570.60470: tcp 24
07:39:38.755916 IP bb42-60-217-183.singnet.com.sg.8333 > tom-Latitude-3570.60470: tcp 221
07:39:38.755917 IP tom-Latitude-3570.60470 > bb42-60-217-183.singnet.com.sg.8333: tcp 0
07:39:38.755954 IP tom-Latitude-3570.46284 > static-87-75-105-186.vodafonexdsl.co.uk.8333: tcp 0
07:39:38.755995 IP tom-Latitude-3570.60470 > bb42-60-217-183.singnet.com.sg.8333: tcp 0
07:39:38.756494 IP tom-Latitude-3570.46284 > static-87-75-105-186.vodafonexdsl.co.uk.8333: tcp 24
07:39:38.758759 IP tom-Latitude-3570.46284 > static-87-75-105-186.vodafonexdsl.co.uk.8333: tcp 37
07:39:38.767313 IP static-87-75-105-186.vodafonexdsl.co.uk.8333 > tom-Latitude-3570.46284: tcp 289
07:39:38.767322 IP tom-Latitude-3570.46284 > static-87-75-105-186.vodafonexdsl.co.uk.8333: tcp 0
07:39:38.808072 IP static-87-75-105-186.vodafonexdsl.co.uk.8333 > tom-Latitude-3570.46284: tcp 0
07:39:38.808855 IP static-87-75-105-186.vodafonexdsl.co.uk.8333 > tom-Latitude-3570.46284: tcp 0
07:39:38.857168 IP tom-Latitude-3570.42516 > 2.56.9.15.8333: tcp 24
07:39:38.857993 IP tom-Latitude-3570.42516 > 2.56.9.15.8333: tcp 109
07:39:38.865465 IP static-87-75-105-186.vodafonexdsl.co.uk.8333 > tom-Latitude-3570.46284: tcp 24
07:39:38.865482 IP tom-Latitude-3570.46284 > static-87-75-105-186.vodafonexdsl.co.uk.8333: tcp 0
07:39:38.868604 IP static-87-75-105-186.vodafonexdsl.co.uk.8333 > tom-Latitude-3570.46284: tcp 249
07:39:38.868624 IP tom-Latitude-3570.46284 > static-87-75-105-186.vodafonexdsl.co.uk.8333: tcp 0
07:39:38.888085 IP 2.56.9.15.8333 > tom-Latitude-3570.42516: tcp 0
07:39:38.969409 IP tom-Latitude-3570.49070 > c-185-45-236-223.customer.ggaweb.ch.8333: tcp 24
07:39:38.970506 IP tom-Latitude-3570.49070 > c-185-45-236-223.customer.ggaweb.ch.8333: tcp 397
07:39:39.001198 IP c-185-45-236-223.customer.ggaweb.ch.8333 > tom-Latitude-3570.49070: tcp 0
07:39:39.017062 IP c-185-45-236-223.customer.ggaweb.ch.8333 > tom-Latitude-3570.49070: tcp 0
07:39:39.170221 IP tom-Latitude-3570.57976 > 167.99.216.145.8333: tcp 24
07:39:39.172463 IP tom-Latitude-3570.57976 > 167.99.216.145.8333: tcp 145
07:39:39.201197 IP 167.99.216.145.8333 > tom-Latitude-3570.57976: tcp 0
07:39:39.209907 IP 167.99.216.145.8333 > tom-Latitude-3570.57976: tcp 0
07:39:39.371023 IP tom-Latitude-3570.60988 > 81.198.101.144.8333: tcp 24
07:39:39.373106 IP tom-Latitude-3570.60988 > 81.198.101.144.8333: tcp 145
07:39:39.402483 IP 81.198.101.144.8333 > tom-Latitude-3570.60988: tcp 0
07:39:39.409151 IP 81.198.101.144.8333 > tom-Latitude-3570.60988: tcp 0
07:39:40.086887 IP 2.56.9.15.8333 > tom-Latitude-3570.42516: tcp 24
07:39:40.086924 IP tom-Latitude-3570.42516 > 2.56.9.15.8333: tcp 0
07:39:40.087020 IP 2.56.9.15.8333 > tom-Latitude-3570.42516: tcp 397
07:39:40.087027 IP tom-Latitude-3570.42516 > 2.56.9.15.8333: tcp 0
07:39:40.087337 IP tom-Latitude-3570.42516 > 2.56.9.15.8333: tcp 24
07:39:40.089208 IP tom-Latitude-3570.42516 > 2.56.9.15.8333: tcp 217
07:39:40.128567 IP 2.56.9.15.8333 > tom-Latitude-3570.42516: tcp 0
07:39:40.187537 IP tom-Latitude-3570.39110 > vmi195435.contaboserver.net.8333: tcp 24
07:39:40.188351 IP tom-Latitude-3570.39110 > vmi195435.contaboserver.net.8333: tcp 397
07:39:40.221872 IP vmi195435.contaboserver.net.8333 > tom-Latitude-3570.39110: tcp 0
07:39:40.224382 IP 2.56.9.15.8333 > tom-Latitude-3570.42516: tcp 24
07:39:40.224390 IP 2.56.9.15.8333 > tom-Latitude-3570.42516: tcp 226
07:39:40.224392 IP 2.56.9.15.8333 > tom-Latitude-3570.42516: tcp 24
07:39:40.224414 IP tom-Latitude-3570.42516 > 2.56.9.15.8333: tcp 0
07:39:40.225233 IP 2.56.9.15.8333 > tom-Latitude-3570.42516: tcp 223
07:39:40.225251 IP 2.56.9.15.8333 > tom-Latitude-3570.42516: tcp 24
07:39:40.225349 IP tom-Latitude-3570.42516 > 2.56.9.15.8333: tcp 0
07:39:40.231783 IP 2.56.9.15.8333 > tom-Latitude-3570.42516: tcp 226
07:39:40.232347 IP 2.56.9.15.8333 > tom-Latitude-3570.42516: tcp 24
07:39:40.232361 IP 2.56.9.15.8333 > tom-Latitude-3570.42516: tcp 226
07:39:40.232380 IP 2.56.9.15.8333 > tom-Latitude-3570.42516: tcp 24
07:39:40.232382 IP 2.56.9.15.8333 > tom-Latitude-3570.42516: tcp 226
07:39:40.232384 IP vmi195435.contaboserver.net.8333 > tom-Latitude-3570.39110: tcp 0
07:39:40.232459 IP tom-Latitude-3570.42516 > 2.56.9.15.8333: tcp 0
07:39:40.325790 IP 2.56.9.15.8333 > tom-Latitude-3570.42516: tcp 280
07:39:40.367905 IP tom-Latitude-3570.42516 > 2.56.9.15.8333: tcp 0
07:39:40.426677 IP tom-Latitude-3570.56714 > ns3113832.ip-54-38-177.eu.8333: tcp 24
07:39:40.427614 IP tom-Latitude-3570.56714 > ns3113832.ip-54-38-177.eu.8333: tcp 325
07:39:40.461241 IP ns3113832.ip-54-38-177.eu.8333 > tom-Latitude-3570.56714: tcp 0
07:39:40.469268 IP ns3113832.ip-54-38-177.eu.8333 > tom-Latitude-3570.56714: tcp 0
07:39:40.676435 IP 81.198.101.144.8333 > tom-Latitude-3570.60988: tcp 869
07:39:40.719903 IP tom-Latitude-3570.60988 > 81.198.101.144.8333: tcp 0
07:39:40.750642 IP 81.198.101.144.8333 > tom-Latitude-3570.60988: tcp 969
07:39:40.750666 IP tom-Latitude-3570.60988 > 81.198.101.144.8333: tcp 0
07:39:40.752018 IP tom-Latitude-3570.56714 > ns3113832.ip-54-38-177.eu.8333: tcp 24
07:39:40.752746 IP tom-Latitude-3570.56714 > ns3113832.ip-54-38-177.eu.8333: tcp 109
07:39:40.796666 IP ns3113832.ip-54-38-177.eu.8333 > tom-Latitude-3570.56714: tcp 0
07:39:40.796681 IP ns3113832.ip-54-38-177.eu.8333 > tom-Latitude-3570.56714: tcp 0
07:39:40.953226 IP tom-Latitude-3570.60988 > 81.198.101.144.8333: tcp 24
07:39:40.953361 IP tom-Latitude-3570.60470 > bb42-60-217-183.singnet.com.sg.8333: tcp 24
07:39:40.995779 IP tom-Latitude-3570.60988 > 81.198.101.144.8333: tcp 217
07:39:40.996716 IP tom-Latitude-3570.60470 > bb42-60-217-183.singnet.com.sg.8333: tcp 253
07:39:41.020494 IP 81.198.101.144.8333 > tom-Latitude-3570.60988: tcp 0
07:39:41.028836 IP bb42-60-217-183.singnet.com.sg.8333 > tom-Latitude-3570.60470: tcp 0
07:39:41.028842 IP 81.198.101.144.8333 > tom-Latitude-3570.60988: tcp 0
07:39:41.028845 IP bb42-60-217-183.singnet.com.sg.8333 > tom-Latitude-3570.60470: tcp 0
07:39:41.154054 IP tom-Latitude-3570.39110 > vmi195435.contaboserver.net.8333: tcp 24
07:39:41.156783 IP tom-Latitude-3570.39110 > vmi195435.contaboserver.net.8333: tcp 361
07:39:41.190722 IP vmi195435.contaboserver.net.8333 > tom-Latitude-3570.39110: tcp 0
07:39:41.210879 IP vmi195435.contaboserver.net.8333 > tom-Latitude-3570.39110: tcp 0
07:39:41.655660 IP tom-Latitude-3570.49070 > c-185-45-236-223.customer.ggaweb.ch.8333: tcp 24
07:39:41.657808 IP tom-Latitude-3570.49070 > c-185-45-236-223.customer.ggaweb.ch.8333: tcp 361
07:39:41.763906 IP tom-Latitude-3570.49070 > c-185-45-236-223.customer.ggaweb.ch.8333: tcp 361
07:39:41.861785 IP 167.99.216.145.8333 > tom-Latitude-3570.57976: tcp 24
07:39:41.861806 IP 167.99.216.145.8333 > tom-Latitude-3570.57976: tcp 649
07:39:41.861813 IP c-185-45-236-223.customer.ggaweb.ch.8333 > tom-Latitude-3570.49070: tcp 0
07:39:41.861837 IP c-185-45-236-223.customer.ggaweb.ch.8333 > tom-Latitude-3570.49070: tcp 0
07:39:41.861840 IP ns3113832.ip-54-38-177.eu.8333 > tom-Latitude-3570.56714: tcp 24
07:39:41.861907 IP tom-Latitude-3570.57976 > 167.99.216.145.8333: tcp 0
07:39:41.861997 IP ns3113832.ip-54-38-177.eu.8333 > tom-Latitude-3570.56714: tcp 361
07:39:41.862009 IP 167.99.216.145.8333 > tom-Latitude-3570.57976: tcp 649
07:39:41.862017 IP tom-Latitude-3570.57976 > 167.99.216.145.8333: tcp 0
07:39:41.862065 IP tom-Latitude-3570.56714 > ns3113832.ip-54-38-177.eu.8333: tcp 0
07:39:41.862258 IP tom-Latitude-3570.57976 > 167.99.216.145.8333: tcp 24
07:39:41.871378 IP tom-Latitude-3570.57976 > 167.99.216.145.8333: tcp 289
07:39:41.909033 IP c-185-45-236-223.customer.ggaweb.ch.8333 > tom-Latitude-3570.49070: tcp 0
07:39:41.912030 IP 167.99.216.145.8333 > tom-Latitude-3570.57976: tcp 0
07:39:41.916968 IP 167.99.216.145.8333 > tom-Latitude-3570.57976: tcp 0
07:39:41.973779 IP 167.99.216.145.8333 > tom-Latitude-3570.57976: tcp 24
07:39:41.975135 IP 167.99.216.145.8333 > tom-Latitude-3570.57976: tcp 402
07:39:41.975141 IP 167.99.216.145.8333 > tom-Latitude-3570.57976: tcp 24
07:39:41.975144 IP 167.99.216.145.8333 > tom-Latitude-3570.57976: tcp 404
07:39:41.975146 IP 167.99.216.145.8333 > tom-Latitude-3570.57976: tcp 24
07:39:41.975149 IP 167.99.216.145.8333 > tom-Latitude-3570.57976: tcp 224
07:39:41.975150 IP tom-Latitude-3570.57976 > 167.99.216.145.8333: tcp 0
07:39:41.975150 IP 167.99.216.145.8333 > tom-Latitude-3570.57976: tcp 24
07:39:41.975152 IP 167.99.216.145.8333 > tom-Latitude-3570.57976: tcp 225
07:39:41.975154 IP 167.99.216.145.8333 > tom-Latitude-3570.57976: tcp 24
07:39:41.975156 IP 167.99.216.145.8333 > tom-Latitude-3570.57976: tcp 226
07:39:41.975174 IP tom-Latitude-3570.57976 > 167.99.216.145.8333: tcp 0
07:39:42.034778 IP 167.99.216.145.8333 > tom-Latitude-3570.57976: tcp 811
07:39:42.075914 IP tom-Latitude-3570.57976 > 167.99.216.145.8333: tcp 0
07:39:42.136245 IP tom-Latitude-3570.46284 > static-87-75-105-186.vodafonexdsl.co.uk.8333: tcp 24
07:39:42.137169 IP tom-Latitude-3570.46284 > static-87-75-105-186.vodafonexdsl.co.uk.8333: tcp 505
07:39:42.169312 IP ns3113832.ip-54-38-177.eu.8333 > tom-Latitude-3570.56714: tcp 24
07:39:42.169865 IP ns3113832.ip-54-38-177.eu.8333 > tom-Latitude-3570.56714: tcp 181
07:39:42.170002 IP tom-Latitude-3570.56714 > ns3113832.ip-54-38-177.eu.8333: tcp 0
07:39:42.170237 IP tom-Latitude-3570.56714 > ns3113832.ip-54-38-177.eu.8333: tcp 24
07:39:42.171643 IP tom-Latitude-3570.56714 > ns3113832.ip-54-38-177.eu.8333: tcp 181
07:39:42.172442 IP static-87-75-105-186.vodafonexdsl.co.uk.8333 > tom-Latitude-3570.46284: tcp 0
07:39:42.178744 IP static-87-75-105-186.vodafonexdsl.co.uk.8333 > tom-Latitude-3570.46284: tcp 0
07:39:42.209368 IP ns3113832.ip-54-38-177.eu.8333 > tom-Latitude-3570.56714: tcp 0
07:39:42.209383 IP ns3113832.ip-54-38-177.eu.8333 > tom-Latitude-3570.56714: tcp 0
07:39:42.212578 IP c-185-45-236-223.customer.ggaweb.ch.8333 > tom-Latitude-3570.49070: tcp 24
07:39:42.213323 IP c-185-45-236-223.customer.ggaweb.ch.8333 > tom-Latitude-3570.49070: tcp 541
07:39:42.213453 IP tom-Latitude-3570.49070 > c-185-45-236-223.customer.ggaweb.ch.8333: tcp 0
07:39:42.213756 IP tom-Latitude-3570.49070 > c-185-45-236-223.customer.ggaweb.ch.8333: tcp 24
07:39:42.215047 IP tom-Latitude-3570.49070 > c-185-45-236-223.customer.ggaweb.ch.8333: tcp 73
07:39:42.272052 IP c-185-45-236-223.customer.ggaweb.ch.8333 > tom-Latitude-3570.49070: tcp 0
07:39:42.272066 IP c-185-45-236-223.customer.ggaweb.ch.8333 > tom-Latitude-3570.49070: tcp 0
07:39:42.272069 IP ns3113832.ip-54-38-177.eu.8333 > tom-Latitude-3570.56714: tcp 24
07:39:42.272080 IP ns3113832.ip-54-38-177.eu.8333 > tom-Latitude-3570.56714: tcp 416
07:39:42.272084 IP ns3113832.ip-54-38-177.eu.8333 > tom-Latitude-3570.56714: tcp 24
07:39:42.272086 IP ns3113832.ip-54-38-177.eu.8333 > tom-Latitude-3570.56714: tcp 226
07:39:42.272088 IP ns3113832.ip-54-38-177.eu.8333 > tom-Latitude-3570.56714: tcp 24
07:39:42.272184 IP tom-Latitude-3570.56714 > ns3113832.ip-54-38-177.eu.8333: tcp 0
07:39:42.272259 IP ns3113832.ip-54-38-177.eu.8333 > tom-Latitude-3570.56714: tcp 225
07:39:42.272284 IP ns3113832.ip-54-38-177.eu.8333 > tom-Latitude-3570.56714: tcp 24
07:39:42.272289 IP ns3113832.ip-54-38-177.eu.8333 > tom-Latitude-3570.56714: tcp 256
07:39:42.272291 IP ns3113832.ip-54-38-177.eu.8333 > tom-Latitude-3570.56714: tcp 24
07:39:42.272294 IP ns3113832.ip-54-38-177.eu.8333 > tom-Latitude-3570.56714: tcp 256
07:39:42.272347 IP tom-Latitude-3570.56714 > ns3113832.ip-54-38-177.eu.8333: tcp 0
07:39:42.333319 IP c-185-45-236-223.customer.ggaweb.ch.8333 > tom-Latitude-3570.49070: tcp 24
07:39:42.338045 IP c-185-45-236-223.customer.ggaweb.ch.8333 > tom-Latitude-3570.49070: tcp 618
07:39:42.338175 IP tom-Latitude-3570.49070 > c-185-45-236-223.customer.ggaweb.ch.8333: tcp 0
07:39:42.940862 IP tom-Latitude-3570.46284 > static-87-75-105-186.vodafonexdsl.co.uk.8333: tcp 24
07:39:43.001262 IP tom-Latitude-3570.46284 > static-87-75-105-186.vodafonexdsl.co.uk.8333: tcp 253
07:39:43.038461 IP 81.198.101.144.8333 > tom-Latitude-3570.60988: tcp 24
07:39:43.038484 IP tom-Latitude-3570.60988 > 81.198.101.144.8333: tcp 0
07:39:43.038515 IP 81.198.101.144.8333 > tom-Latitude-3570.60988: tcp 577
07:39:43.038520 IP tom-Latitude-3570.60988 > 81.198.101.144.8333: tcp 0
07:39:43.038524 IP 167.99.216.145.8333 > tom-Latitude-3570.57976: tcp 24
07:39:43.038541 IP tom-Latitude-3570.57976 > 167.99.216.145.8333: tcp 0
07:39:43.038544 IP 167.99.216.145.8333 > tom-Latitude-3570.57976: tcp 289
07:39:43.038546 IP tom-Latitude-3570.57976 > 167.99.216.145.8333: tcp 0
07:39:43.038871 IP tom-Latitude-3570.60988 > 81.198.101.144.8333: tcp 24
07:39:43.038934 IP tom-Latitude-3570.56714 > ns3113832.ip-54-38-177.eu.8333: tcp 24
07:39:43.039825 IP 81.198.101.144.8333 > tom-Latitude-3570.60988: tcp 577
07:39:43.039834 IP tom-Latitude-3570.60988 > 81.198.101.144.8333: tcp 37
07:39:43.039841 IP static-87-75-105-186.vodafonexdsl.co.uk.8333 > tom-Latitude-3570.46284: tcp 0
07:39:43.044577 IP tom-Latitude-3570.56714 > ns3113832.ip-54-38-177.eu.8333: tcp 73
07:39:43.077782 IP static-87-75-105-186.vodafonexdsl.co.uk.8333 > tom-Latitude-3570.46284: tcp 24
07:39:43.077787 IP tom-Latitude-3570.46284 > static-87-75-105-186.vodafonexdsl.co.uk.8333: tcp 0
07:39:43.081191 IP static-87-75-105-186.vodafonexdsl.co.uk.8333 > tom-Latitude-3570.46284: tcp 0
07:39:43.081196 IP ns3113832.ip-54-38-177.eu.8333 > tom-Latitude-3570.56714: tcp 0
07:39:43.081199 IP ns3113832.ip-54-38-177.eu.8333 > tom-Latitude-3570.56714: tcp 0
07:39:43.081201 IP 81.198.101.144.8333 > tom-Latitude-3570.60988: tcp 0
07:39:43.081203 IP 81.198.101.144.8333 > tom-Latitude-3570.60988: tcp 0
07:39:43.094593 IP static-87-75-105-186.vodafonexdsl.co.uk.8333 > tom-Latitude-3570.46284: tcp 289
07:39:43.094600 IP tom-Latitude-3570.46284 > static-87-75-105-186.vodafonexdsl.co.uk.8333: tcp 0
07:39:43.095226 IP c-185-45-236-223.customer.ggaweb.ch.8333 > tom-Latitude-3570.49070: tcp 24
07:39:43.095234 IP c-185-45-236-223.customer.ggaweb.ch.8333 > tom-Latitude-3570.49070: tcp 109
07:39:43.095243 IP tom-Latitude-3570.49070 > c-185-45-236-223.customer.ggaweb.ch.8333: tcp 0
07:39:43.095380 IP tom-Latitude-3570.49070 > c-185-45-236-223.customer.ggaweb.ch.8333: tcp 24
07:39:43.097360 IP tom-Latitude-3570.49070 > c-185-45-236-223.customer.ggaweb.ch.8333: tcp 73
07:39:43.129677 IP c-185-45-236-223.customer.ggaweb.ch.8333 > tom-Latitude-3570.49070: tcp 0
07:39:43.129682 IP c-185-45-236-223.customer.ggaweb.ch.8333 > tom-Latitude-3570.49070: tcp 0
07:39:43.175165 IP 81.198.101.144.8333 > tom-Latitude-3570.60988: tcp 24
07:39:43.175185 IP 81.198.101.144.8333 > tom-Latitude-3570.60988: tcp 225
07:39:43.175272 IP tom-Latitude-3570.60988 > 81.198.101.144.8333: tcp 0
07:39:43.229646 IP c-185-45-236-223.customer.ggaweb.ch.8333 > tom-Latitude-3570.49070: tcp 24
07:39:43.230459 IP c-185-45-236-223.customer.ggaweb.ch.8333 > tom-Latitude-3570.49070: tcp 496
07:39:43.230590 IP tom-Latitude-3570.49070 > c-185-45-236-223.customer.ggaweb.ch.8333: tcp 0
07:39:43.331550 IP tom-Latitude-3570.60988 > 81.198.101.144.8333: tcp 24
07:39:43.331600 IP tom-Latitude-3570.56714 > ns3113832.ip-54-38-177.eu.8333: tcp 24
07:39:43.332678 IP tom-Latitude-3570.60988 > 81.198.101.144.8333: tcp 73
07:39:43.333271 IP tom-Latitude-3570.56714 > ns3113832.ip-54-38-177.eu.8333: tcp 109
07:39:43.362525 IP 81.198.101.144.8333 > tom-Latitude-3570.60988: tcp 0
07:39:43.370529 IP ns3113832.ip-54-38-177.eu.8333 > tom-Latitude-3570.56714: tcp 0
07:39:43.371168 IP 81.198.101.144.8333 > tom-Latitude-3570.60988: tcp 0
07:39:43.371182 IP ns3113832.ip-54-38-177.eu.8333 > tom-Latitude-3570.56714: tcp 0
07:39:43.468741 IP 81.198.101.144.8333 > tom-Latitude-3570.60988: tcp 24
07:39:43.469306 IP 81.198.101.144.8333 > tom-Latitude-3570.60988: tcp 73
07:39:43.469434 IP tom-Latitude-3570.60988 > 81.198.101.144.8333: tcp 0
07:39:43.469569 IP tom-Latitude-3570.60988 > 81.198.101.144.8333: tcp 24
07:39:43.471029 IP tom-Latitude-3570.60988 > 81.198.101.144.8333: tcp 496
07:39:43.552067 IP 81.198.101.144.8333 > tom-Latitude-3570.60988: tcp 0
07:39:43.552081 IP 81.198.101.144.8333 > tom-Latitude-3570.60988: tcp 0
07:39:43.570170 IP tom-Latitude-3570.60470 > bb42-60-217-183.singnet.com.sg.8333: tcp 24
07:39:43.571141 IP tom-Latitude-3570.60470 > bb42-60-217-183.singnet.com.sg.8333: tcp 649
07:39:43.600862 IP bb42-60-217-183.singnet.com.sg.8333 > tom-Latitude-3570.60470: tcp 0
07:39:43.611715 IP bb42-60-217-183.singnet.com.sg.8333 > tom-Latitude-3570.60470: tcp 0
07:39:44.573337 IP tom-Latitude-3570.42516 > 2.56.9.15.8333: tcp 24
07:39:44.575500 IP tom-Latitude-3570.42516 > 2.56.9.15.8333: tcp 649
07:39:44.636201 IP 2.56.9.15.8333 > tom-Latitude-3570.42516: tcp 0
07:39:44.673763 IP tom-Latitude-3570.57976 > 167.99.216.145.8333: tcp 24
07:39:44.675369 IP tom-Latitude-3570.57976 > 167.99.216.145.8333: tcp 73
07:39:44.700590 IP 167.99.216.145.8333 > tom-Latitude-3570.57976: tcp 0
07:39:44.708749 IP 167.99.216.145.8333 > tom-Latitude-3570.57976: tcp 0
07:39:44.874520 IP tom-Latitude-3570.46284 > static-87-75-105-186.vodafonexdsl.co.uk.8333: tcp 24
07:39:44.876749 IP tom-Latitude-3570.46284 > static-87-75-105-186.vodafonexdsl.co.uk.8333: tcp 73
07:39:44.919535 IP static-87-75-105-186.vodafonexdsl.co.uk.8333 > tom-Latitude-3570.46284: tcp 0
07:39:45.207571 IP ns3113832.ip-54-38-177.eu.8333 > tom-Latitude-3570.56714: tcp 24
07:39:45.207591 IP ns3113832.ip-54-38-177.eu.8333 > tom-Latitude-3570.56714: tcp 325
07:39:45.207694 IP tom-Latitude-3570.56714 > ns3113832.ip-54-38-177.eu.8333: tcp 0
07:39:45.207974 IP tom-Latitude-3570.56714 > ns3113832.ip-54-38-177.eu.8333: tcp 24
07:39:45.209176 IP tom-Latitude-3570.56714 > ns3113832.ip-54-38-177.eu.8333: tcp 325
07:39:45.248425 IP ns3113832.ip-54-38-177.eu.8333 > tom-Latitude-3570.56714: tcp 0
07:39:45.249477 IP ns3113832.ip-54-38-177.eu.8333 > tom-Latitude-3570.56714: tcp 0
07:39:45.268652 IP bb42-60-217-183.singnet.com.sg.8333 > tom-Latitude-3570.60470: tcp 24
07:39:45.269292 IP bb42-60-217-183.singnet.com.sg.8333 > tom-Latitude-3570.60470: tcp 469
07:39:45.269422 IP tom-Latitude-3570.60470 > bb42-60-217-183.singnet.com.sg.8333: tcp 0
07:39:45.269754 IP tom-Latitude-3570.60470 > bb42-60-217-183.singnet.com.sg.8333: tcp 24
07:39:45.270856 IP tom-Latitude-3570.60470 > bb42-60-217-183.singnet.com.sg.8333: tcp 145
07:39:45.307127 IP ns3113832.ip-54-38-177.eu.8333 > tom-Latitude-3570.56714: tcp 24
07:39:45.307138 IP ns3113832.ip-54-38-177.eu.8333 > tom-Latitude-3570.56714: tcp 256
07:39:45.307142 IP ns3113832.ip-54-38-177.eu.8333 > tom-Latitude-3570.56714: tcp 24
07:39:45.307162 IP tom-Latitude-3570.56714 > ns3113832.ip-54-38-177.eu.8333: tcp 0
07:39:45.307250 IP ns3113832.ip-54-38-177.eu.8333 > tom-Latitude-3570.56714: tcp 224
07:39:45.307257 IP ns3113832.ip-54-38-177.eu.8333 > tom-Latitude-3570.56714: tcp 24
07:39:45.307261 IP ns3113832.ip-54-38-177.eu.8333 > tom-Latitude-3570.56714: tcp 226
07:39:45.307263 IP ns3113832.ip-54-38-177.eu.8333 > tom-Latitude-3570.56714: tcp 24
07:39:45.307265 IP tom-Latitude-3570.56714 > ns3113832.ip-54-38-177.eu.8333: tcp 0
07:39:45.307915 IP ns3113832.ip-54-38-177.eu.8333 > tom-Latitude-3570.56714: tcp 764
07:39:45.307933 IP tom-Latitude-3570.56714 > ns3113832.ip-54-38-177.eu.8333: tcp 0
07:39:45.312345 IP ns3113832.ip-54-38-177.eu.8333 > tom-Latitude-3570.56714: tcp 24
07:39:45.312531 IP ns3113832.ip-54-38-177.eu.8333 > tom-Latitude-3570.56714: tcp 1350
07:39:45.312536 IP bb42-60-217-183.singnet.com.sg.8333 > tom-Latitude-3570.60470: tcp 0
07:39:45.312540 IP bb42-60-217-183.singnet.com.sg.8333 > tom-Latitude-3570.60470: tcp 0
07:39:45.312544 IP tom-Latitude-3570.56714 > ns3113832.ip-54-38-177.eu.8333: tcp 0
07:39:45.364606 IP ns3113832.ip-54-38-177.eu.8333 > tom-Latitude-3570.56714: tcp 1350
07:39:45.367971 IP ns3113832.ip-54-38-177.eu.8333 > tom-Latitude-3570.56714: tcp 1350
07:39:45.368101 IP tom-Latitude-3570.56714 > ns3113832.ip-54-38-177.eu.8333: tcp 0
07:39:45.369187 IP ns3113832.ip-54-38-177.eu.8333 > tom-Latitude-3570.56714: tcp 1350
07:39:45.369206 IP ns3113832.ip-54-38-177.eu.8333 > tom-Latitude-3570.56714: tcp 892
07:39:45.369303 IP tom-Latitude-3570.56714 > ns3113832.ip-54-38-177.eu.8333: tcp 0
07:39:46.026336 IP c-185-45-236-223.customer.ggaweb.ch.8333 > tom-Latitude-3570.49070: tcp 24
07:39:46.026357 IP c-185-45-236-223.customer.ggaweb.ch.8333 > tom-Latitude-3570.49070: tcp 613
07:39:46.026361 IP bb42-60-217-183.singnet.com.sg.8333 > tom-Latitude-3570.60470: tcp 24
07:39:46.026365 IP bb42-60-217-183.singnet.com.sg.8333 > tom-Latitude-3570.60470: tcp 257
07:39:46.026384 IP bb42-60-217-183.singnet.com.sg.8333 > tom-Latitude-3570.60470: tcp 24
07:39:46.026449 IP tom-Latitude-3570.49070 > c-185-45-236-223.customer.ggaweb.ch.8333: tcp 0
07:39:46.026481 IP tom-Latitude-3570.60470 > bb42-60-217-183.singnet.com.sg.8333: tcp 0
07:39:46.026805 IP tom-Latitude-3570.49070 > c-185-45-236-223.customer.ggaweb.ch.8333: tcp 24
07:39:46.026936 IP bb42-60-217-183.singnet.com.sg.8333 > tom-Latitude-3570.60470: tcp 191
07:39:46.026963 IP bb42-60-217-183.singnet.com.sg.8333 > tom-Latitude-3570.60470: tcp 24
07:39:46.026968 IP bb42-60-217-183.singnet.com.sg.8333 > tom-Latitude-3570.60470: tcp 593
07:39:46.026971 IP bb42-60-217-183.singnet.com.sg.8333 > tom-Latitude-3570.60470: tcp 24
07:39:46.026992 IP bb42-60-217-183.singnet.com.sg.8333 > tom-Latitude-3570.60470: tcp 256
07:39:46.026998 IP c-185-45-236-223.customer.ggaweb.ch.8333 > tom-Latitude-3570.49070: tcp 613
07:39:46.027008 IP tom-Latitude-3570.49070 > c-185-45-236-223.customer.ggaweb.ch.8333: tcp 145
07:39:46.027027 IP bb42-60-217-183.singnet.com.sg.8333 > tom-Latitude-3570.60470: tcp 256
07:39:46.027030 IP tom-Latitude-3570.60470 > bb42-60-217-183.singnet.com.sg.8333: tcp 0
07:39:46.027031 IP static-87-75-105-186.vodafonexdsl.co.uk.8333 > tom-Latitude-3570.46284: tcp 24
07:39:46.027037 IP tom-Latitude-3570.46284 > static-87-75-105-186.vodafonexdsl.co.uk.8333: tcp 0
07:39:46.027040 IP static-87-75-105-186.vodafonexdsl.co.uk.8333 > tom-Latitude-3570.46284: tcp 685
07:39:46.027041 IP tom-Latitude-3570.60470 > bb42-60-217-183.singnet.com.sg.8333: tcp 0
07:39:46.027043 IP tom-Latitude-3570.46284 > static-87-75-105-186.vodafonexdsl.co.uk.8333: tcp 0
07:39:46.027055 IP static-87-75-105-186.vodafonexdsl.co.uk.8333 > tom-Latitude-3570.46284: tcp 685
07:39:46.027060 IP tom-Latitude-3570.46284 > static-87-75-105-186.vodafonexdsl.co.uk.8333: tcp 0
07:39:46.027409 IP tom-Latitude-3570.46284 > static-87-75-105-186.vodafonexdsl.co.uk.8333: tcp 24
07:39:46.033944 IP tom-Latitude-3570.46284 > static-87-75-105-186.vodafonexdsl.co.uk.8333: tcp 73
07:39:46.112063 IP c-185-45-236-223.customer.ggaweb.ch.8333 > tom-Latitude-3570.49070: tcp 0
07:39:46.112077 IP c-185-45-236-223.customer.ggaweb.ch.8333 > tom-Latitude-3570.49070: tcp 0
07:39:46.112080 IP static-87-75-105-186.vodafonexdsl.co.uk.8333 > tom-Latitude-3570.46284: tcp 0
07:39:46.112774 IP ns3113832.ip-54-38-177.eu.8333 > tom-Latitude-3570.56714: tcp 24
07:39:46.113376 IP ns3113832.ip-54-38-177.eu.8333 > tom-Latitude-3570.56714: tcp 325
07:39:46.113507 IP tom-Latitude-3570.56714 > ns3113832.ip-54-38-177.eu.8333: tcp 0
07:39:46.113904 IP tom-Latitude-3570.57976 > 167.99.216.145.8333: tcp 24
07:39:46.113995 IP tom-Latitude-3570.42516 > 2.56.9.15.8333: tcp 24
07:39:46.114981 IP tom-Latitude-3570.57976 > 167.99.216.145.8333: tcp 469
07:39:46.115640 IP tom-Latitude-3570.42516 > 2.56.9.15.8333: tcp 469
07:39:46.135061 IP static-87-75-105-186.vodafonexdsl.co.uk.8333 > tom-Latitude-3570.46284: tcp 24
07:39:46.136096 IP static-87-75-105-186.vodafonexdsl.co.uk.8333 > tom-Latitude-3570.46284: tcp 215
07:39:46.136103 IP static-87-75-105-186.vodafonexdsl.co.uk.8333 > tom-Latitude-3570.46284: tcp 24
07:39:46.136106 IP static-87-75-105-186.vodafonexdsl.co.uk.8333 > tom-Latitude-3570.46284: tcp 225
07:39:46.136114 IP tom-Latitude-3570.46284 > static-87-75-105-186.vodafonexdsl.co.uk.8333: tcp 0
07:39:46.146802 IP 167.99.216.145.8333 > tom-Latitude-3570.57976: tcp 0
07:39:46.154045 IP c-185-45-236-223.customer.ggaweb.ch.8333 > tom-Latitude-3570.49070: tcp 24
07:39:46.155204 IP c-185-45-236-223.customer.ggaweb.ch.8333 > tom-Latitude-3570.49070: tcp 402
07:39:46.155223 IP c-185-45-236-223.customer.ggaweb.ch.8333 > tom-Latitude-3570.49070: tcp 216
07:39:46.155227 IP c-185-45-236-223.customer.ggaweb.ch.8333 > tom-Latitude-3570.49070: tcp 280
07:39:46.155230 IP c-185-45-236-223.customer.ggaweb.ch.8333 > tom-Latitude-3570.49070: tcp 250
07:39:46.155321 IP tom-Latitude-3570.49070 > c-185-45-236-223.customer.ggaweb.ch.8333: tcp 0
07:39:46.157368 IP 167.99.216.145.8333 > tom-Latitude-3570.57976: tcp 0
07:39:46.157393 IP 2.56.9.15.8333 > tom-Latitude-3570.42516: tcp 0
07:39:46.257603 IP tom-Latitude-3570.49070 > c-185-45-236-223.customer.ggaweb.ch.8333: tcp 24
07:39:46.260539 IP tom-Latitude-3570.49070 > c-185-45-236-223.customer.ggaweb.ch.8333: tcp 73
07:39:46.299330 IP c-185-45-236-223.customer.ggaweb.ch.8333 > tom-Latitude-3570.49070: tcp 0
07:39:46.302358 IP c-185-45-236-223.customer.ggaweb.ch.8333 > tom-Latitude-3570.49070: tcp 0
07:39:46.458326 IP tom-Latitude-3570.42516 > 2.56.9.15.8333: tcp 24
07:39:46.460781 IP tom-Latitude-3570.42516 > 2.56.9.15.8333: tcp 217
07:39:46.499056 IP 2.56.9.15.8333 > tom-Latitude-3570.42516: tcp 0
07:39:46.505096 IP c-185-45-236-223.customer.ggaweb.ch.8333 > tom-Latitude-3570.49070: tcp 24
07:39:46.505693 IP c-185-45-236-223.customer.ggaweb.ch.8333 > tom-Latitude-3570.49070: tcp 109
07:39:46.505823 IP tom-Latitude-3570.49070 > c-185-45-236-223.customer.ggaweb.ch.8333: tcp 0
07:39:46.506028 IP tom-Latitude-3570.49070 > c-185-45-236-223.customer.ggaweb.ch.8333: tcp 24
07:39:46.507393 IP tom-Latitude-3570.49070 > c-185-45-236-223.customer.ggaweb.ch.8333: tcp 109
07:39:46.538791 IP c-185-45-236-223.customer.ggaweb.ch.8333 > tom-Latitude-3570.49070: tcp 0
07:39:46.538806 IP c-185-45-236-223.customer.ggaweb.ch.8333 > tom-Latitude-3570.49070: tcp 0
07:39:46.628746 IP c-185-45-236-223.customer.ggaweb.ch.8333 > tom-Latitude-3570.49070: tcp 24
07:39:46.629429 IP c-185-45-236-223.customer.ggaweb.ch.8333 > tom-Latitude-3570.49070: tcp 753
07:39:46.629559 IP tom-Latitude-3570.49070 > c-185-45-236-223.customer.ggaweb.ch.8333: tcp 0
07:39:46.732998 IP tom-Latitude-3570.60988 > 81.198.101.144.8333: tcp 24
07:39:46.734944 IP tom-Latitude-3570.60988 > 81.198.101.144.8333: tcp 793
07:39:46.760844 IP 81.198.101.144.8333 > tom-Latitude-3570.60988: tcp 0
07:39:46.778555 IP 81.198.101.144.8333 > tom-Latitude-3570.60988: tcp 0
07:39:47.335032 IP tom-Latitude-3570.39110 > vmi195435.contaboserver.net.8333: tcp 24
07:39:47.335053 IP tom-Latitude-3570.39110 > vmi195435.contaboserver.net.8333: tcp 1261
07:39:47.335087 IP tom-Latitude-3570.42516 > 2.56.9.15.8333: tcp 24
07:39:47.411440 IP tom-Latitude-3570.42516 > 2.56.9.15.8333: tcp 31
07:39:47.431910 IP tom-Latitude-3570.39110 > vmi195435.contaboserver.net.8333: tcp 1261
07:39:47.435381 IP tom-Latitude-3570.46284 > static-87-75-105-186.vodafonexdsl.co.uk.8333: tcp 24
07:39:47.436284 IP tom-Latitude-3570.46284 > static-87-75-105-186.vodafonexdsl.co.uk.8333: tcp 109
07:39:47.448390 IP bb42-60-217-183.singnet.com.sg.8333 > tom-Latitude-3570.60470: tcp 24
07:39:47.448407 IP tom-Latitude-3570.60470 > bb42-60-217-183.singnet.com.sg.8333: tcp 0
07:39:47.448423 IP bb42-60-217-183.singnet.com.sg.8333 > tom-Latitude-3570.60470: tcp 577
07:39:47.448428 IP tom-Latitude-3570.60470 > bb42-60-217-183.singnet.com.sg.8333: tcp 0
07:39:47.448742 IP tom-Latitude-3570.60470 > bb42-60-217-183.singnet.com.sg.8333: tcp 24
07:39:47.450848 IP tom-Latitude-3570.60470 > bb42-60-217-183.singnet.com.sg.8333: tcp 253
07:39:47.451958 IP vmi195435.contaboserver.net.8333 > tom-Latitude-3570.39110: tcp 0
07:39:47.466167 IP vmi195435.contaboserver.net.8333 > tom-Latitude-3570.39110: tcp 0
07:39:47.466781 IP 2.56.9.15.8333 > tom-Latitude-3570.42516: tcp 0
07:39:47.466787 IP vmi195435.contaboserver.net.8333 > tom-Latitude-3570.39110: tcp 0
07:39:47.466790 IP static-87-75-105-186.vodafonexdsl.co.uk.8333 > tom-Latitude-3570.46284: tcp 0
07:39:47.479446 IP bb42-60-217-183.singnet.com.sg.8333 > tom-Latitude-3570.60470: tcp 0
07:39:47.480085 IP bb42-60-217-183.singnet.com.sg.8333 > tom-Latitude-3570.60470: tcp 0
07:39:47.649225 IP tom-Latitude-3570.42516 > 2.56.9.15.8333: tcp 24
07:39:47.651276 IP tom-Latitude-3570.42516 > 2.56.9.15.8333: tcp 109
07:39:47.696894 IP 2.56.9.15.8333 > tom-Latitude-3570.42516: tcp 0
07:39:47.886081 IP static-87-75-105-186.vodafonexdsl.co.uk.8333 > tom-Latitude-3570.46284: tcp 24
07:39:47.886104 IP bb42-60-217-183.singnet.com.sg.8333 > tom-Latitude-3570.60470: tcp 24
07:39:47.886124 IP static-87-75-105-186.vodafonexdsl.co.uk.8333 > tom-Latitude-3570.46284: tcp 577
07:39:47.886131 IP bb42-60-217-183.singnet.com.sg.8333 > tom-Latitude-3570.60470: tcp 439
07:39:47.886133 IP bb42-60-217-183.singnet.com.sg.8333 > tom-Latitude-3570.60470: tcp 24
07:39:47.886137 IP bb42-60-217-183.singnet.com.sg.8333 > tom-Latitude-3570.60470: tcp 464
07:39:47.886138 IP bb42-60-217-183.singnet.com.sg.8333 > tom-Latitude-3570.60470: tcp 24
07:39:47.886143 IP bb42-60-217-183.singnet.com.sg.8333 > tom-Latitude-3570.60470: tcp 226
07:39:47.886145 IP bb42-60-217-183.singnet.com.sg.8333 > tom-Latitude-3570.60470: tcp 24
07:39:47.886174 IP tom-Latitude-3570.60470 > bb42-60-217-183.singnet.com.sg.8333: tcp 0
07:39:47.886223 IP tom-Latitude-3570.46284 > static-87-75-105-186.vodafonexdsl.co.uk.8333: tcp 0
07:39:47.886304 IP bb42-60-217-183.singnet.com.sg.8333 > tom-Latitude-3570.60470: tcp 223
07:39:47.886316 IP bb42-60-217-183.singnet.com.sg.8333 > tom-Latitude-3570.60470: tcp 24
07:39:47.886324 IP bb42-60-217-183.singnet.com.sg.8333 > tom-Latitude-3570.60470: tcp 462
07:39:47.886327 IP bb42-60-217-183.singnet.com.sg.8333 > tom-Latitude-3570.60470: tcp 24
07:39:47.886331 IP bb42-60-217-183.singnet.com.sg.8333 > tom-Latitude-3570.60470: tcp 226
07:39:47.886333 IP bb42-60-217-183.singnet.com.sg.8333 > tom-Latitude-3570.60470: tcp 24
07:39:47.886336 IP bb42-60-217-183.singnet.com.sg.8333 > tom-Latitude-3570.60470: tcp 225
07:39:47.886391 IP tom-Latitude-3570.60470 > bb42-60-217-183.singnet.com.sg.8333: tcp 0
07:39:47.887259 IP tom-Latitude-3570.46284 > static-87-75-105-186.vodafonexdsl.co.uk.8333: tcp 24
07:39:47.888929 IP tom-Latitude-3570.46284 > static-87-75-105-186.vodafonexdsl.co.uk.8333: tcp 325
07:39:47.932387 IP static-87-75-105-186.vodafonexdsl.co.uk.8333 > tom-Latitude-3570.46284: tcp 0
07:39:47.989406 IP tom-Latitude-3570.57976 > 167.99.216.145.8333: tcp 24
07:39:47.990343 IP tom-Latitude-3570.57976 > 167.99.216.145.8333: tcp 577
07:39:48.021292 IP static-87-75-105-186.vodafonexdsl.co.uk.8333 > tom-Latitude-3570.46284: tcp 24
07:39:48.021312 IP static-87-75-105-186.vodafonexdsl.co.uk.8333 > tom-Latitude-3570.46284: tcp 403
07:39:48.021316 IP static-87-75-105-186.vodafonexdsl.co.uk.8333 > tom-Latitude-3570.46284: tcp 24
07:39:48.021319 IP static-87-75-105-186.vodafonexdsl.co.uk.8333 > tom-Latitude-3570.46284: tcp 403
07:39:48.021339 IP static-87-75-105-186.vodafonexdsl.co.uk.8333 > tom-Latitude-3570.46284: tcp 24
07:39:48.021342 IP static-87-75-105-186.vodafonexdsl.co.uk.8333 > tom-Latitude-3570.46284: tcp 404
07:39:48.021344 IP static-87-75-105-186.vodafonexdsl.co.uk.8333 > tom-Latitude-3570.46284: tcp 24
07:39:48.021411 IP tom-Latitude-3570.46284 > static-87-75-105-186.vodafonexdsl.co.uk.8333: tcp 0
07:39:48.021613 IP tom-Latitude-3570.42516 > 2.56.9.15.8333: tcp 24
07:39:48.021692 IP static-87-75-105-186.vodafonexdsl.co.uk.8333 > tom-Latitude-3570.46284: tcp 404
07:39:48.021705 IP static-87-75-105-186.vodafonexdsl.co.uk.8333 > tom-Latitude-3570.46284: tcp 24
07:39:48.021709 IP static-87-75-105-186.vodafonexdsl.co.uk.8333 > tom-Latitude-3570.46284: tcp 404
07:39:48.021712 IP static-87-75-105-186.vodafonexdsl.co.uk.8333 > tom-Latitude-3570.46284: tcp 24
07:39:48.021737 IP static-87-75-105-186.vodafonexdsl.co.uk.8333 > tom-Latitude-3570.46284: tcp 429
07:39:48.021742 IP static-87-75-105-186.vodafonexdsl.co.uk.8333 > tom-Latitude-3570.46284: tcp 249
07:39:48.021760 IP static-87-75-105-186.vodafonexdsl.co.uk.8333 > tom-Latitude-3570.46284: tcp 280
07:39:48.021768 IP static-87-75-105-186.vodafonexdsl.co.uk.8333 > tom-Latitude-3570.46284: tcp 226
07:39:48.021773 IP 167.99.216.145.8333 > tom-Latitude-3570.57976: tcp 0
07:39:48.021785 IP 81.198.101.144.8333 > tom-Latitude-3570.60988: tcp 24
07:39:48.021795 IP 81.198.101.144.8333 > tom-Latitude-3570.60988: tcp 361
07:39:48.021800 IP tom-Latitude-3570.46284 > static-87-75-105-186.vodafonexdsl.co.uk.8333: tcp 0
07:39:48.021853 IP tom-Latitude-3570.60988 > 81.198.101.144.8333: tcp 0
07:39:48.024765 IP tom-Latitude-3570.42516 > 2.56.9.15.8333: tcp 253
07:39:48.025275 IP 167.99.216.145.8333 > tom-Latitude-3570.57976: tcp 0
07:39:48.059381 IP 2.56.9.15.8333 > tom-Latitude-3570.42516: tcp 0
07:39:48.227372 IP tom-Latitude-3570.42516 > 2.56.9.15.8333: tcp 24
07:39:48.229672 IP tom-Latitude-3570.42516 > 2.56.9.15.8333: tcp 325
07:39:48.268568 IP 2.56.9.15.8333 > tom-Latitude-3570.42516: tcp 0
07:39:48.327931 IP tom-Latitude-3570.56714 > ns3113832.ip-54-38-177.eu.8333: tcp 24
07:39:48.329044 IP tom-Latitude-3570.56714 > ns3113832.ip-54-38-177.eu.8333: tcp 721
07:39:48.427914 IP tom-Latitude-3570.56714 > ns3113832.ip-54-38-177.eu.8333: tcp 721
07:39:48.531503 IP ns3113832.ip-54-38-177.eu.8333 > tom-Latitude-3570.56714: tcp 0
07:39:48.729252 IP tom-Latitude-3570.39110 > vmi195435.contaboserver.net.8333: tcp 24
07:39:48.731464 IP tom-Latitude-3570.39110 > vmi195435.contaboserver.net.8333: tcp 757
07:39:48.761928 IP vmi195435.contaboserver.net.8333 > tom-Latitude-3570.39110: tcp 0
07:39:48.769668 IP vmi195435.contaboserver.net.8333 > tom-Latitude-3570.39110: tcp 0
07:39:49.130673 IP tom-Latitude-3570.57976 > 167.99.216.145.8333: tcp 24
07:39:49.132904 IP tom-Latitude-3570.57976 > 167.99.216.145.8333: tcp 325
07:39:49.182167 IP 167.99.216.145.8333 > tom-Latitude-3570.57976: tcp 0
07:39:49.197788 IP 167.99.216.145.8333 > tom-Latitude-3570.57976: tcp 0
07:39:49.712720 IP ns3113832.ip-54-38-177.eu.8333 > tom-Latitude-3570.56714: tcp 24
07:39:49.712741 IP ns3113832.ip-54-38-177.eu.8333 > tom-Latitude-3570.56714: tcp 253
07:39:49.712767 IP ns3113832.ip-54-38-177.eu.8333 > tom-Latitude-3570.56714: tcp 253
07:39:49.712780 IP tom-Latitude-3570.56714 > ns3113832.ip-54-38-177.eu.8333: tcp 0
07:39:49.713105 IP tom-Latitude-3570.56714 > ns3113832.ip-54-38-177.eu.8333: tcp 24
07:39:49.714655 IP tom-Latitude-3570.56714 > ns3113832.ip-54-38-177.eu.8333: tcp 253
07:39:49.748811 IP ns3113832.ip-54-38-177.eu.8333 > tom-Latitude-3570.56714: tcp 0
07:39:49.749490 IP ns3113832.ip-54-38-177.eu.8333 > tom-Latitude-3570.56714: tcp 0
07:39:49.801479 IP ns3113832.ip-54-38-177.eu.8333 > tom-Latitude-3570.56714: tcp 24
07:39:49.802051 IP ns3113832.ip-54-38-177.eu.8333 > tom-Latitude-3570.56714: tcp 73
07:39:49.802181 IP tom-Latitude-3570.56714 > ns3113832.ip-54-38-177.eu.8333: tcp 0
07:39:49.802377 IP tom-Latitude-3570.56714 > ns3113832.ip-54-38-177.eu.8333: tcp 24
07:39:49.803990 IP tom-Latitude-3570.56714 > ns3113832.ip-54-38-177.eu.8333: tcp 73
07:39:49.808120 IP ns3113832.ip-54-38-177.eu.8333 > tom-Latitude-3570.56714: tcp 24
07:39:49.808130 IP ns3113832.ip-54-38-177.eu.8333 > tom-Latitude-3570.56714: tcp 404
07:39:49.808139 IP ns3113832.ip-54-38-177.eu.8333 > tom-Latitude-3570.56714: tcp 24
07:39:49.808163 IP tom-Latitude-3570.56714 > ns3113832.ip-54-38-177.eu.8333: tcp 0
07:39:49.811434 IP ns3113832.ip-54-38-177.eu.8333 > tom-Latitude-3570.56714: tcp 404
07:39:49.811449 IP ns3113832.ip-54-38-177.eu.8333 > tom-Latitude-3570.56714: tcp 24
07:39:49.811452 IP ns3113832.ip-54-38-177.eu.8333 > tom-Latitude-3570.56714: tcp 405
07:39:49.811454 IP ns3113832.ip-54-38-177.eu.8333 > tom-Latitude-3570.56714: tcp 24
07:39:49.811544 IP ns3113832.ip-54-38-177.eu.8333 > tom-Latitude-3570.56714: tcp 405
07:39:49.811551 IP tom-Latitude-3570.56714 > ns3113832.ip-54-38-177.eu.8333: tcp 0
07:39:49.839903 IP ns3113832.ip-54-38-177.eu.8333 > tom-Latitude-3570.56714: tcp 0
07:39:49.839917 IP ns3113832.ip-54-38-177.eu.8333 > tom-Latitude-3570.56714: tcp 0
07:39:49.851907 IP tom-Latitude-3570.56714 > ns3113832.ip-54-38-177.eu.8333: tcp 0
07:39:49.859260 IP ns3113832.ip-54-38-177.eu.8333 > tom-Latitude-3570.56714: tcp 811
07:39:49.859285 IP tom-Latitude-3570.56714 > ns3113832.ip-54-38-177.eu.8333: tcp 0
07:39:49.899087 IP ns3113832.ip-54-38-177.eu.8333 > tom-Latitude-3570.56714: tcp 24
07:39:49.899105 IP tom-Latitude-3570.56714 > ns3113832.ip-54-38-177.eu.8333: tcp 0
07:39:49.899123 IP ns3113832.ip-54-38-177.eu.8333 > tom-Latitude-3570.56714: tcp 223
07:39:49.899126 IP tom-Latitude-3570.56714 > ns3113832.ip-54-38-177.eu.8333: tcp 0
07:39:49.899129 IP ns3113832.ip-54-38-177.eu.8333 > tom-Latitude-3570.56714: tcp 24
07:39:49.899131 IP tom-Latitude-3570.56714 > ns3113832.ip-54-38-177.eu.8333: tcp 0
07:39:49.899152 IP ns3113832.ip-54-38-177.eu.8333 > tom-Latitude-3570.56714: tcp 226
07:39:49.899154 IP tom-Latitude-3570.56714 > ns3113832.ip-54-38-177.eu.8333: tcp 0
07:39:50.200924 IP tom-Latitude-3570.57976 > 167.99.216.145.8333: tcp 24
07:39:50.203010 IP tom-Latitude-3570.57976 > 167.99.216.145.8333: tcp 325
07:39:50.229935 IP 167.99.216.145.8333 > tom-Latitude-3570.57976: tcp 0
07:39:50.238722 IP 167.99.216.145.8333 > tom-Latitude-3570.57976: tcp 0
07:39:50.802836 IP tom-Latitude-3570.49070 > c-185-45-236-223.customer.ggaweb.ch.8333: tcp 24
07:39:50.802915 IP tom-Latitude-3570.42516 > 2.56.9.15.8333: tcp 24
07:39:50.802966 IP tom-Latitude-3570.46284 > static-87-75-105-186.vodafonexdsl.co.uk.8333: tcp 24
07:39:50.804933 IP tom-Latitude-3570.49070 > c-185-45-236-223.customer.ggaweb.ch.8333: tcp 901
07:39:50.805512 IP tom-Latitude-3570.42516 > 2.56.9.15.8333: tcp 325
07:39:50.807117 IP tom-Latitude-3570.46284 > static-87-75-105-186.vodafonexdsl.co.uk.8333: tcp 325
07:39:50.871262 IP c-185-45-236-223.customer.ggaweb.ch.8333 > tom-Latitude-3570.49070: tcp 0
07:39:50.871276 IP c-185-45-236-223.customer.ggaweb.ch.8333 > tom-Latitude-3570.49070: tcp 0
07:39:50.874293 IP 2.56.9.15.8333 > tom-Latitude-3570.42516: tcp 0
07:39:50.874307 IP static-87-75-105-186.vodafonexdsl.co.uk.8333 > tom-Latitude-3570.46284: tcp 0
07:39:51.043727 IP ns3113832.ip-54-38-177.eu.8333 > tom-Latitude-3570.56714: tcp 24
07:39:51.043751 IP tom-Latitude-3570.56714 > ns3113832.ip-54-38-177.eu.8333: tcp 0
07:39:51.043784 IP ns3113832.ip-54-38-177.eu.8333 > tom-Latitude-3570.56714: tcp 397
07:39:51.043789 IP tom-Latitude-3570.56714 > ns3113832.ip-54-38-177.eu.8333: tcp 0
07:39:51.043793 IP vmi195435.contaboserver.net.8333 > tom-Latitude-3570.39110: tcp 24
07:39:51.043818 IP vmi195435.contaboserver.net.8333 > tom-Latitude-3570.39110: tcp 721
07:39:51.043875 IP tom-Latitude-3570.39110 > vmi195435.contaboserver.net.8333: tcp 0
07:39:51.043984 IP tom-Latitude-3570.39110 > vmi195435.contaboserver.net.8333: tcp 24
07:39:51.044203 IP tom-Latitude-3570.56714 > ns3113832.ip-54-38-177.eu.8333: tcp 24
07:39:51.046678 IP tom-Latitude-3570.39110 > vmi195435.contaboserver.net.8333: tcp 386
07:39:51.047430 IP tom-Latitude-3570.56714 > ns3113832.ip-54-38-177.eu.8333: tcp 397
07:39:51.088571 IP vmi195435.contaboserver.net.8333 > tom-Latitude-3570.39110: tcp 0
