02:17:28.628934 IP static-87-75-105-186.vodafonexdsl.co.uk.8333 > tom-Latitude-3570.46284: tcp 0
02:17:28.635047 IP bb42-60-217-183.singnet.com.sg.8333 > tom-Latitude-3570.60470: tcp 0
02:17:28.635662 IP static-87-75-105-186.vodafonexdsl.co.uk.8333 > tom-Latitude-3570.46284: tcp 0
02:17:28.635722 IP bb42-60-217-183.singnet.com.sg.8333 > tom-Latitude-3570.60470: tcp 0
02:17:28.692829 IP tom-Latitude-3570.60988 > 81.198.101.144.8333: tcp 24
02:17:28.693758 IP tom-Latitude-3570.60988 > 81.198.101.144.8333: tcp 397
02:17:28.730037 IP 81.198.101.144.8333 > tom-Latitude-3570.60988: tcp 0
02:17:28.736232 IP 81.198.101.144.8333 > tom-Latitude-3570.60988: tcp 0
02:17:28.893554 IP tom-Latitude-3570.56714 > ns3113832.ip-54-38-177.eu.8333: tcp 24
02:17:28.895636 IP tom-Latitude-3570.56714 > ns3113832.ip-54-38-177.eu.8333: tcp 37
02:17:28.928255 IP ns3113832.ip-54-38-177.eu.8333 > tom-Latitude-3570.56714: tcp 0
02:17:28.936242 IP ns3113832.ip-54-38-177.eu.8333 > tom-Latitude-3570.56714: tcp 0
02:17:29.013298 IP bb42-60-217-183.singnet.com.sg.8333 > tom-Latitude-3570.60470: tcp 24
02:17:29.013938 IP bb42-60-217-183.singnet.com.sg.8333 > tom-Latitude-3570.60470: tcp 8
02:17:29.014002 IP tom-Latitude-3570.60470 > bb42-60-217-183.singnet.com.sg.8333: tcp 0
02:17:29.114588 IP tom-Latitude-3570.39110 > vmi195435.contaboserver.net.8333: tcp 24
02:17:29.115639 IP tom-Latitude-3570.39110 > vmi195435.contaboserver.net.8333: tcp 397
02:17:29.148214 IP vmi195435.contaboserver.net.8333 > tom-Latitude-3570.39110: tcp 0
02:17:29.156077 IP vmi195435.contaboserver.net.8333 > tom-Latitude-3570.39110: tcp 0
02:17:29.917169 IP tom-Latitude-3570.42516 > 2.56.9.15.8333: tcp 24
02:17:29.919076 IP tom-Latitude-3570.42516 > 2.56.9.15.8333: tcp 397
02:17:29.919821 IP static-87-75-105-186.vodafonexdsl.co.uk.8333 > tom-Latitude-3570.46284: tcp 24
02:17:29.919847 IP tom-Latitude-3570.46284 > static-87-75-105-186.vodafonexdsl.co.uk.8333: tcp 0
02:17:29.919862 IP static-87-75-105-186.vodafonexdsl.co.uk.8333 > tom-Latitude-3570.46284: tcp 73
02:17:29.919866 IP tom-Latitude-3570.46284 > static-87-75-105-186.vodafonexdsl.co.uk.8333: tcp 0
02:17:29.919870 IP static-87-75-105-186.vodafonexdsl.co.uk.8333 > tom-Latitude-3570.46284: tcp 73
02:17:29.919872 IP tom-Latitude-3570.46284 > static-87-75-105-186.vodafonexdsl.co.uk.8333: tcp 0
02:17:29.920077 IP tom-Latitude-3570.46284 > static-87-75-105-186.vodafonexdsl.co.uk.8333: tcp 24
02:17:29.921419 IP tom-Latitude-3570.46284 > static-87-75-105-186.vodafonexdsl.co.uk.8333: tcp 73
02:17:29.957640 IP 2.56.9.15.8333 > tom-Latitude-3570.42516: tcp 0
02:17:29.957654 IP static-87-75-105-186.vodafonexdsl.co.uk.8333 > tom-Latitude-3570.46284: tcp 0
02:17:29.957658 IP static-87-75-105-186.vodafonexdsl.co.uk.8333 > tom-Latitude-3570.46284: tcp 0
02:17:30.017195 IP 167.99.216.145.8333 > tom-Latitude-3570.57976: tcp 24
02:17:30.017784 IP 167.99.216.145.8333 > tom-Latitude-3570.57976: tcp 253
02:17:30.017849 IP tom-Latitude-3570.57976 > 167.99.216.145.8333: tcp 0
02:17:30.018169 IP tom-Latitude-3570.57976 > 167.99.216.145.8333: tcp 24
02:17:30.019302 IP tom-Latitude-3570.57976 > 167.99.216.145.8333: tcp 181
02:17:30.020618 IP static-87-75-105-186.vodafonexdsl.co.uk.8333 > tom-Latitude-3570.46284: tcp 24
02:17:30.020629 IP static-87-75-105-186.vodafonexdsl.co.uk.8333 > tom-Latitude-3570.46284: tcp 247
02:17:30.020660 IP tom-Latitude-3570.46284 > static-87-75-105-186.vodafonexdsl.co.uk.8333: tcp 0
02:17:30.023503 IP static-87-75-105-186.vodafonexdsl.co.uk.8333 > tom-Latitude-3570.46284: tcp 24
02:17:30.024157 IP static-87-75-105-186.vodafonexdsl.co.uk.8333 > tom-Latitude-3570.46284: tcp 224
02:17:30.024245 IP tom-Latitude-3570.46284 > static-87-75-105-186.vodafonexdsl.co.uk.8333: tcp 0
02:17:30.037248 IP bb42-60-217-183.singnet.com.sg.8333 > tom-Latitude-3570.60470: tcp 24
02:17:30.037836 IP bb42-60-217-183.singnet.com.sg.8333 > tom-Latitude-3570.60470: tcp 145
02:17:30.037900 IP tom-Latitude-3570.60470 > bb42-60-217-183.singnet.com.sg.8333: tcp 0
02:17:30.049218 IP 167.99.216.145.8333 > tom-Latitude-3570.57976: tcp 0
02:17:30.056157 IP 167.99.216.145.8333 > tom-Latitude-3570.57976: tcp 0
02:17:30.117829 IP 167.99.216.145.8333 > tom-Latitude-3570.57976: tcp 24
02:17:30.118737 IP 167.99.216.145.8333 > tom-Latitude-3570.57976: tcp 440
02:17:30.118755 IP 167.99.216.145.8333 > tom-Latitude-3570.57976: tcp 24
02:17:30.118758 IP 167.99.216.145.8333 > tom-Latitude-3570.57976: tcp 372
02:17:30.118761 IP 167.99.216.145.8333 > tom-Latitude-3570.57976: tcp 24
02:17:30.118764 IP 167.99.216.145.8333 > tom-Latitude-3570.57976: tcp 249
02:17:30.118767 IP 167.99.216.145.8333 > tom-Latitude-3570.57976: tcp 24
02:17:30.118771 IP 167.99.216.145.8333 > tom-Latitude-3570.57976: tcp 223
02:17:30.118773 IP 167.99.216.145.8333 > tom-Latitude-3570.57976: tcp 24
02:17:30.118775 IP 167.99.216.145.8333 > tom-Latitude-3570.57976: tcp 315
02:17:30.118804 IP tom-Latitude-3570.57976 > 167.99.216.145.8333: tcp 0
02:17:30.321305 IP tom-Latitude-3570.60988 > 81.198.101.144.8333: tcp 24
02:17:30.321361 IP tom-Latitude-3570.60470 > bb42-60-217-183.singnet.com.sg.8333: tcp 24
02:17:30.321401 IP tom-Latitude-3570.42516 > 2.56.9.15.8333: tcp 24
02:17:30.368691 IP tom-Latitude-3570.42516 > 2.56.9.15.8333: tcp 253
02:17:30.368702 IP tom-Latitude-3570.60470 > bb42-60-217-183.singnet.com.sg.8333: tcp 109
02:17:30.368705 IP tom-Latitude-3570.60988 > 81.198.101.144.8333: tcp 253
02:17:30.407982 IP 81.198.101.144.8333 > tom-Latitude-3570.60988: tcp 0
02:17:30.415988 IP 2.56.9.15.8333 > tom-Latitude-3570.42516: tcp 0
02:17:30.416811 IP 81.198.101.144.8333 > tom-Latitude-3570.60988: tcp 0
02:17:30.416824 IP bb42-60-217-183.singnet.com.sg.8333 > tom-Latitude-3570.60470: tcp 0
02:17:30.416828 IP bb42-60-217-183.singnet.com.sg.8333 > tom-Latitude-3570.60470: tcp 0
02:17:30.522089 IP tom-Latitude-3570.56714 > ns3113832.ip-54-38-177.eu.8333: tcp 24
02:17:30.525395 IP tom-Latitude-3570.56714 > ns3113832.ip-54-38-177.eu.8333: tcp 253
02:17:30.558591 IP ns3113832.ip-54-38-177.eu.8333 > tom-Latitude-3570.56714: tcp 0
02:17:30.573973 IP ns3113832.ip-54-38-177.eu.8333 > tom-Latitude-3570.56714: tcp 0
02:17:30.622517 IP tom-Latitude-3570.49070 > c-185-45-236-223.customer.ggaweb.ch.8333: tcp 24
02:17:30.623383 IP tom-Latitude-3570.49070 > c-185-45-236-223.customer.ggaweb.ch.8333: tcp 253
02:17:30.647967 IP c-185-45-236-223.customer.ggaweb.ch.8333 > tom-Latitude-3570.49070: tcp 0
02:17:30.657402 IP c-185-45-236-223.customer.ggaweb.ch.8333 > tom-Latitude-3570.49070: tcp 0
02:17:30.662025 IP 167.99.216.145.8333 > tom-Latitude-3570.57976: tcp 24
02:17:30.662667 IP 167.99.216.145.8333 > tom-Latitude-3570.57976: tcp 37
02:17:30.662728 IP tom-Latitude-3570.57976 > 167.99.216.145.8333: tcp 0
02:17:30.662910 IP tom-Latitude-3570.57976 > 167.99.216.145.8333: tcp 24
02:17:30.664360 IP tom-Latitude-3570.57976 > 167.99.216.145.8333: tcp 37
02:17:30.707840 IP 167.99.216.145.8333 > tom-Latitude-3570.57976: tcp 0
02:17:30.707855 IP 167.99.216.145.8333 > tom-Latitude-3570.57976: tcp 0
02:17:30.769472 IP 167.99.216.145.8333 > tom-Latitude-3570.57976: tcp 24
02:17:30.770094 IP 167.99.216.145.8333 > tom-Latitude-3570.57976: tcp 189
02:17:30.770157 IP tom-Latitude-3570.57976 > 167.99.216.145.8333: tcp 0
02:17:30.870881 IP tom-Latitude-3570.60988 > 81.198.101.144.8333: tcp 24
02:17:30.872382 IP tom-Latitude-3570.60988 > 81.198.101.144.8333: tcp 37
02:17:30.897956 IP 81.198.101.144.8333 > tom-Latitude-3570.60988: tcp 0
02:17:30.905946 IP 81.198.101.144.8333 > tom-Latitude-3570.60988: tcp 0
02:17:30.971333 IP tom-Latitude-3570.49070 > c-185-45-236-223.customer.ggaweb.ch.8333: tcp 24
02:17:30.972264 IP tom-Latitude-3570.49070 > c-185-45-236-223.customer.ggaweb.ch.8333: tcp 37
02:17:30.994026 IP 81.198.101.144.8333 > tom-Latitude-3570.60988: tcp 24
02:17:30.994582 IP 81.198.101.144.8333 > tom-Latitude-3570.60988: tcp 37
02:17:30.994644 IP tom-Latitude-3570.60988 > 81.198.101.144.8333: tcp 0
02:17:30.994782 IP tom-Latitude-3570.60988 > 81.198.101.144.8333: tcp 24
02:17:30.996275 IP tom-Latitude-3570.60988 > 81.198.101.144.8333: tcp 189
02:17:31.007950 IP c-185-45-236-223.customer.ggaweb.ch.8333 > tom-Latitude-3570.49070: tcp 0
02:17:31.018516 IP c-185-45-236-223.customer.ggaweb.ch.8333 > tom-Latitude-3570.49070: tcp 0
02:17:31.023954 IP 81.198.101.144.8333 > tom-Latitude-3570.60988: tcp 0
02:17:31.031954 IP 81.198.101.144.8333 > tom-Latitude-3570.60988: tcp 0
02:17:31.099043 IP c-185-45-236-223.customer.ggaweb.ch.8333 > tom-Latitude-3570.49070: tcp 24
02:17:31.099607 IP c-185-45-236-223.customer.ggaweb.ch.8333 > tom-Latitude-3570.49070: tcp 37
02:17:31.099668 IP tom-Latitude-3570.49070 > c-185-45-236-223.customer.ggaweb.ch.8333: tcp 0
02:17:31.099826 IP tom-Latitude-3570.49070 > c-185-45-236-223.customer.ggaweb.ch.8333: tcp 24
02:17:31.101325 IP tom-Latitude-3570.49070 > c-185-45-236-223.customer.ggaweb.ch.8333: tcp 189
02:17:31.135817 IP c-185-45-236-223.customer.ggaweb.ch.8333 > tom-Latitude-3570.49070: tcp 0
02:17:31.136505 IP c-185-45-236-223.customer.ggaweb.ch.8333 > tom-Latitude-3570.49070: tcp 0
02:17:31.300644 IP tom-Latitude-3570.60470 > bb42-60-217-183.singnet.com.sg.8333: tcp 24
02:17:31.302683 IP tom-Latitude-3570.60470 > bb42-60-217-183.singnet.com.sg.8333: tcp 37
02:17:31.337935 IP bb42-60-217-183.singnet.com.sg.8333 > tom-Latitude-3570.60470: tcp 0
02:17:31.346349 IP bb42-60-217-183.singnet.com.sg.8333 > tom-Latitude-3570.60470: tcp 0
02:17:31.802382 IP tom-Latitude-3570.39110 > vmi195435.contaboserver.net.8333: tcp 24
02:17:31.803397 IP tom-Latitude-3570.39110 > vmi195435.contaboserver.net.8333: tcp 289
02:17:31.804868 IP c-185-45-236-223.customer.ggaweb.ch.8333 > tom-Latitude-3570.49070: tcp 24
02:17:31.804887 IP c-185-45-236-223.customer.ggaweb.ch.8333 > tom-Latitude-3570.49070: tcp 73
02:17:31.804891 IP c-185-45-236-223.customer.ggaweb.ch.8333 > tom-Latitude-3570.49070: tcp 73
02:17:31.804903 IP tom-Latitude-3570.49070 > c-185-45-236-223.customer.ggaweb.ch.8333: tcp 0
02:17:31.805109 IP tom-Latitude-3570.49070 > c-185-45-236-223.customer.ggaweb.ch.8333: tcp 24
02:17:31.806387 IP tom-Latitude-3570.49070 > c-185-45-236-223.customer.ggaweb.ch.8333: tcp 73
02:17:31.846105 IP vmi195435.contaboserver.net.8333 > tom-Latitude-3570.39110: tcp 0
02:17:31.846724 IP vmi195435.contaboserver.net.8333 > tom-Latitude-3570.39110: tcp 0
02:17:31.846738 IP c-185-45-236-223.customer.ggaweb.ch.8333 > tom-Latitude-3570.49070: tcp 0
02:17:31.846741 IP c-185-45-236-223.customer.ggaweb.ch.8333 > tom-Latitude-3570.49070: tcp 0
02:17:31.929993 IP c-185-45-236-223.customer.ggaweb.ch.8333 > tom-Latitude-3570.49070: tcp 24
02:17:31.930599 IP c-185-45-236-223.customer.ggaweb.ch.8333 > tom-Latitude-3570.49070: tcp 470
02:17:31.930664 IP tom-Latitude-3570.49070 > c-185-45-236-223.customer.ggaweb.ch.8333: tcp 0
02:17:32.031945 IP tom-Latitude-3570.56714 > ns3113832.ip-54-38-177.eu.8333: tcp 24
02:17:32.033164 IP tom-Latitude-3570.56714 > ns3113832.ip-54-38-177.eu.8333: tcp 109
02:17:32.067925 IP ns3113832.ip-54-38-177.eu.8333 > tom-Latitude-3570.56714: tcp 0
02:17:32.078139 IP ns3113832.ip-54-38-177.eu.8333 > tom-Latitude-3570.56714: tcp 0
02:17:32.232599 IP tom-Latitude-3570.60988 > 81.198.101.144.8333: tcp 24
02:17:32.234714 IP tom-Latitude-3570.60988 > 81.198.101.144.8333: tcp 73
02:17:32.290996 IP 81.198.101.144.8333 > tom-Latitude-3570.60988: tcp 0
02:17:32.291010 IP 81.198.101.144.8333 > tom-Latitude-3570.60988: tcp 0
02:17:32.433452 IP tom-Latitude-3570.46284 > static-87-75-105-186.vodafonexdsl.co.uk.8333: tcp 24
02:17:32.435490 IP tom-Latitude-3570.46284 > static-87-75-105-186.vodafonexdsl.co.uk.8333: tcp 289
02:17:32.543905 IP tom-Latitude-3570.46284 > static-87-75-105-186.vodafonexdsl.co.uk.8333: tcp 289
02:17:32.732873 IP static-87-75-105-186.vodafonexdsl.co.uk.8333 > tom-Latitude-3570.46284: tcp 0
02:17:32.732887 IP static-87-75-105-186.vodafonexdsl.co.uk.8333 > tom-Latitude-3570.46284: tcp 0
02:17:32.732890 IP static-87-75-105-186.vodafonexdsl.co.uk.8333 > tom-Latitude-3570.46284: tcp 0
02:17:33.135046 IP tom-Latitude-3570.57976 > 167.99.216.145.8333: tcp 24
02:17:33.137048 IP tom-Latitude-3570.57976 > 167.99.216.145.8333: tcp 73
02:17:33.137633 IP 2.56.9.15.8333 > tom-Latitude-3570.42516: tcp 24
02:17:33.137646 IP 2.56.9.15.8333 > tom-Latitude-3570.42516: tcp 253
02:17:33.137660 IP tom-Latitude-3570.42516 > 2.56.9.15.8333: tcp 0
02:17:33.137806 IP tom-Latitude-3570.42516 > 2.56.9.15.8333: tcp 24
02:17:33.139121 IP tom-Latitude-3570.42516 > 2.56.9.15.8333: tcp 145
02:17:33.169351 IP 2.56.9.15.8333 > tom-Latitude-3570.42516: tcp 253
02:17:33.169359 IP tom-Latitude-3570.42516 > 2.56.9.15.8333: tcp 0
02:17:33.171538 IP 167.99.216.145.8333 > tom-Latitude-3570.57976: tcp 0
02:17:33.175319 IP 167.99.216.145.8333 > tom-Latitude-3570.57976: tcp 0
02:17:33.175997 IP 2.56.9.15.8333 > tom-Latitude-3570.42516: tcp 0
02:17:33.271028 IP 2.56.9.15.8333 > tom-Latitude-3570.42516: tcp 24
02:17:33.271036 IP tom-Latitude-3570.42516 > 2.56.9.15.8333: tcp 0
02:17:33.271043 IP 2.56.9.15.8333 > tom-Latitude-3570.42516: tcp 223
02:17:33.271047 IP tom-Latitude-3570.42516 > 2.56.9.15.8333: tcp 0
02:17:33.271050 IP 2.56.9.15.8333 > tom-Latitude-3570.42516: tcp 24
02:17:33.271052 IP tom-Latitude-3570.42516 > 2.56.9.15.8333: tcp 0
02:17:33.271056 IP 2.56.9.15.8333 > tom-Latitude-3570.42516: tcp 224
02:17:33.271059 IP tom-Latitude-3570.42516 > 2.56.9.15.8333: tcp 0
02:17:33.271062 IP 2.56.9.15.8333 > tom-Latitude-3570.42516: tcp 24
02:17:33.271064 IP tom-Latitude-3570.42516 > 2.56.9.15.8333: tcp 0
02:17:33.271068 IP 2.56.9.15.8333 > tom-Latitude-3570.42516: tcp 246
02:17:33.271070 IP tom-Latitude-3570.42516 > 2.56.9.15.8333: tcp 0
02:17:33.271073 IP 2.56.9.15.8333 > tom-Latitude-3570.42516: tcp 24
02:17:33.271075 IP tom-Latitude-3570.42516 > 2.56.9.15.8333: tcp 0
02:17:33.271079 IP 2.56.9.15.8333 > tom-Latitude-3570.42516: tcp 226
02:17:33.271081 IP tom-Latitude-3570.42516 > 2.56.9.15.8333: tcp 0
02:17:33.329991 IP 2.56.9.15.8333 > tom-Latitude-3570.42516: tcp 24
02:17:33.329995 IP tom-Latitude-3570.42516 > 2.56.9.15.8333: tcp 0
02:17:33.330645 IP 2.56.9.15.8333 > tom-Latitude-3570.42516: tcp 145
02:17:33.330650 IP tom-Latitude-3570.42516 > 2.56.9.15.8333: tcp 0
02:17:33.330739 IP tom-Latitude-3570.56714 > ns3113832.ip-54-38-177.eu.8333: tcp 24
02:17:33.330815 IP tom-Latitude-3570.42516 > 2.56.9.15.8333: tcp 24
02:17:33.331797 IP tom-Latitude-3570.42516 > 2.56.9.15.8333: tcp 145
02:17:33.331803 IP tom-Latitude-3570.56714 > ns3113832.ip-54-38-177.eu.8333: tcp 145
02:17:33.346955 IP 167.99.216.145.8333 > tom-Latitude-3570.57976: tcp 24
02:17:33.347665 IP 167.99.216.145.8333 > tom-Latitude-3570.57976: tcp 8
02:17:33.347683 IP tom-Latitude-3570.57976 > 167.99.216.145.8333: tcp 0
02:17:33.347713 IP tom-Latitude-3570.57976 > 167.99.216.145.8333: tcp 24
02:17:33.348390 IP tom-Latitude-3570.57976 > 167.99.216.145.8333: tcp 8
02:17:33.366040 IP ns3113832.ip-54-38-177.eu.8333 > tom-Latitude-3570.56714: tcp 0
02:17:33.366649 IP 2.56.9.15.8333 > tom-Latitude-3570.42516: tcp 0
02:17:33.366678 IP ns3113832.ip-54-38-177.eu.8333 > tom-Latitude-3570.56714: tcp 0
02:17:33.366680 IP 167.99.216.145.8333 > tom-Latitude-3570.57976: tcp 0
02:17:33.379375 IP 167.99.216.145.8333 > tom-Latitude-3570.57976: tcp 0
02:17:33.457998 IP bb42-60-217-183.singnet.com.sg.8333 > tom-Latitude-3570.60470: tcp 24
02:17:33.458631 IP bb42-60-217-183.singnet.com.sg.8333 > tom-Latitude-3570.60470: tcp 361
02:17:33.458651 IP tom-Latitude-3570.60470 > bb42-60-217-183.singnet.com.sg.8333: tcp 0
02:17:33.461152 IP 2.56.9.15.8333 > tom-Latitude-3570.42516: tcp 24
02:17:33.461976 IP 2.56.9.15.8333 > tom-Latitude-3570.42516: tcp 189
02:17:33.461979 IP 2.56.9.15.8333 > tom-Latitude-3570.42516: tcp 24
02:17:33.461982 IP 2.56.9.15.8333 > tom-Latitude-3570.42516: tcp 223
02:17:33.461985 IP 2.56.9.15.8333 > tom-Latitude-3570.42516: tcp 24
02:17:33.461987 IP 2.56.9.15.8333 > tom-Latitude-3570.42516: tcp 225
02:17:33.461989 IP 2.56.9.15.8333 > tom-Latitude-3570.42516: tcp 24
02:17:33.461991 IP tom-Latitude-3570.42516 > 2.56.9.15.8333: tcp 0
02:17:33.461992 IP 2.56.9.15.8333 > tom-Latitude-3570.42516: tcp 224
02:17:33.462013 IP tom-Latitude-3570.42516 > 2.56.9.15.8333: tcp 0
02:17:34.056105 IP c-185-45-236-223.customer.ggaweb.ch.8333 > tom-Latitude-3570.49070: tcp 24
02:17:34.056126 IP c-185-45-236-223.customer.ggaweb.ch.8333 > tom-Latitude-3570.49070: tcp 397
02:17:34.056169 IP tom-Latitude-3570.49070 > c-185-45-236-223.customer.ggaweb.ch.8333: tcp 0
02:17:34.056447 IP tom-Latitude-3570.49070 > c-185-45-236-223.customer.ggaweb.ch.8333: tcp 24
02:17:34.057695 IP tom-Latitude-3570.49070 > c-185-45-236-223.customer.ggaweb.ch.8333: tcp 109
02:17:34.096195 IP c-185-45-236-223.customer.ggaweb.ch.8333 > tom-Latitude-3570.49070: tcp 0
02:17:34.096865 IP c-185-45-236-223.customer.ggaweb.ch.8333 > tom-Latitude-3570.49070: tcp 0
02:17:34.156794 IP tom-Latitude-3570.46284 > static-87-75-105-186.vodafonexdsl.co.uk.8333: tcp 24
02:17:34.161806 IP tom-Latitude-3570.46284 > static-87-75-105-186.vodafonexdsl.co.uk.8333: tcp 289
02:17:34.194417 IP c-185-45-236-223.customer.ggaweb.ch.8333 > tom-Latitude-3570.49070: tcp 24
02:17:34.194436 IP c-185-45-236-223.customer.ggaweb.ch.8333 > tom-Latitude-3570.49070: tcp 774
02:17:34.194442 IP static-87-75-105-186.vodafonexdsl.co.uk.8333 > tom-Latitude-3570.46284: tcp 0
02:17:34.194481 IP tom-Latitude-3570.49070 > c-185-45-236-223.customer.ggaweb.ch.8333: tcp 0
02:17:34.195930 IP static-87-75-105-186.vodafonexdsl.co.uk.8333 > tom-Latitude-3570.46284: tcp 0
02:17:34.244212 IP 81.198.101.144.8333 > tom-Latitude-3570.60988: tcp 24
02:17:34.244233 IP 81.198.101.144.8333 > tom-Latitude-3570.60988: tcp 361
02:17:34.244277 IP tom-Latitude-3570.60988 > 81.198.101.144.8333: tcp 0
02:17:34.645670 IP tom-Latitude-3570.39110 > vmi195435.contaboserver.net.8333: tcp 24
02:17:34.647900 IP tom-Latitude-3570.39110 > vmi195435.contaboserver.net.8333: tcp 469
02:17:34.677167 IP vmi195435.contaboserver.net.8333 > tom-Latitude-3570.39110: tcp 0
02:17:34.686079 IP vmi195435.contaboserver.net.8333 > tom-Latitude-3570.39110: tcp 0
02:17:34.846483 IP tom-Latitude-3570.56714 > ns3113832.ip-54-38-177.eu.8333: tcp 24
02:17:34.848691 IP tom-Latitude-3570.56714 > ns3113832.ip-54-38-177.eu.8333: tcp 253
02:17:34.878127 IP ns3113832.ip-54-38-177.eu.8333 > tom-Latitude-3570.56714: tcp 0
02:17:34.894077 IP ns3113832.ip-54-38-177.eu.8333 > tom-Latitude-3570.56714: tcp 0
02:17:35.749145 IP tom-Latitude-3570.60470 > bb42-60-217-183.singnet.com.sg.8333: tcp 24
02:17:35.749194 IP tom-Latitude-3570.46284 > static-87-75-105-186.vodafonexdsl.co.uk.8333: tcp 24
02:17:35.751226 IP tom-Latitude-3570.46284 > static-87-75-105-186.vodafonexdsl.co.uk.8333: tcp 109
02:17:35.751237 IP tom-Latitude-3570.60470 > bb42-60-217-183.singnet.com.sg.8333: tcp 109
02:17:35.787659 IP static-87-75-105-186.vodafonexdsl.co.uk.8333 > tom-Latitude-3570.46284: tcp 0
02:17:35.803819 IP bb42-60-217-183.singnet.com.sg.8333 > tom-Latitude-3570.60470: tcp 0
02:17:35.804337 IP bb42-60-217-183.singnet.com.sg.8333 > tom-Latitude-3570.60470: tcp 0
02:17:35.804346 IP static-87-75-105-186.vodafonexdsl.co.uk.8333 > tom-Latitude-3570.46284: tcp 0
02:17:36.451349 IP tom-Latitude-3570.60988 > 81.198.101.144.8333: tcp 24
02:17:36.453475 IP tom-Latitude-3570.60988 > 81.198.101.144.8333: tcp 37
02:17:36.496053 IP ns3113832.ip-54-38-177.eu.8333 > tom-Latitude-3570.56714: tcp 24
02:17:36.496654 IP ns3113832.ip-54-38-177.eu.8333 > tom-Latitude-3570.56714: tcp 109
02:17:36.496673 IP ns3113832.ip-54-38-177.eu.8333 > tom-Latitude-3570.56714: tcp 109
02:17:36.496685 IP tom-Latitude-3570.56714 > ns3113832.ip-54-38-177.eu.8333: tcp 0
02:17:36.496699 IP 81.198.101.144.8333 > tom-Latitude-3570.60988: tcp 0
02:17:36.496916 IP tom-Latitude-3570.56714 > ns3113832.ip-54-38-177.eu.8333: tcp 24
02:17:36.498136 IP tom-Latitude-3570.56714 > ns3113832.ip-54-38-177.eu.8333: tcp 109
02:17:36.504551 IP 81.198.101.144.8333 > tom-Latitude-3570.60988: tcp 0
02:17:36.526078 IP ns3113832.ip-54-38-177.eu.8333 > tom-Latitude-3570.56714: tcp 0
02:17:36.534033 IP ns3113832.ip-54-38-177.eu.8333 > tom-Latitude-3570.56714: tcp 0
02:17:36.592039 IP ns3113832.ip-54-38-177.eu.8333 > tom-Latitude-3570.56714: tcp 24
02:17:36.592864 IP ns3113832.ip-54-38-177.eu.8333 > tom-Latitude-3570.56714: tcp 373
02:17:36.592883 IP ns3113832.ip-54-38-177.eu.8333 > tom-Latitude-3570.56714: tcp 24
02:17:36.592887 IP ns3113832.ip-54-38-177.eu.8333 > tom-Latitude-3570.56714: tcp 520
02:17:36.592890 IP ns3113832.ip-54-38-177.eu.8333 > tom-Latitude-3570.56714: tcp 24
02:17:36.592892 IP ns3113832.ip-54-38-177.eu.8333 > tom-Latitude-3570.56714: tcp 248
02:17:36.592930 IP tom-Latitude-3570.56714 > ns3113832.ip-54-38-177.eu.8333: tcp 0
02:17:36.796578 IP tom-Latitude-3570.42516 > 2.56.9.15.8333: tcp 24
02:17:36.803974 IP tom-Latitude-3570.42516 > 2.56.9.15.8333: tcp 217
02:17:36.846127 IP 2.56.9.15.8333 > tom-Latitude-3570.42516: tcp 0
02:17:36.897041 IP tom-Latitude-3570.57976 > 167.99.216.145.8333: tcp 24
02:17:36.897983 IP tom-Latitude-3570.57976 > 167.99.216.145.8333: tcp 505
02:17:36.927773 IP 167.99.216.145.8333 > tom-Latitude-3570.57976: tcp 0
02:17:36.935755 IP 167.99.216.145.8333 > tom-Latitude-3570.57976: tcp 0
02:17:37.498798 IP tom-Latitude-3570.46284 > static-87-75-105-186.vodafonexdsl.co.uk.8333: tcp 24
02:17:37.501066 IP tom-Latitude-3570.46284 > static-87-75-105-186.vodafonexdsl.co.uk.8333: tcp 109
02:17:37.547191 IP static-87-75-105-186.vodafonexdsl.co.uk.8333 > tom-Latitude-3570.46284: tcp 0
02:17:37.554967 IP static-87-75-105-186.vodafonexdsl.co.uk.8333 > tom-Latitude-3570.46284: tcp 0
02:17:38.971957 IP 81.198.101.144.8333 > tom-Latitude-3570.60988: tcp 24
02:17:38.971977 IP 81.198.101.144.8333 > tom-Latitude-3570.60988: tcp 145
02:17:38.971982 IP 81.198.101.144.8333 > tom-Latitude-3570.60988: tcp 145
02:17:38.971993 IP tom-Latitude-3570.60988 > 81.198.101.144.8333: tcp 0
02:17:38.972010 IP 167.99.216.145.8333 > tom-Latitude-3570.57976: tcp 24
02:17:38.972013 IP 167.99.216.145.8333 > tom-Latitude-3570.57976: tcp 73
02:17:38.972016 IP 167.99.216.145.8333 > tom-Latitude-3570.57976: tcp 73
02:17:38.972019 IP tom-Latitude-3570.57976 > 167.99.216.145.8333: tcp 0
02:17:38.972235 IP tom-Latitude-3570.60988 > 81.198.101.144.8333: tcp 24
02:17:38.972298 IP tom-Latitude-3570.57976 > 167.99.216.145.8333: tcp 24
02:17:38.973534 IP tom-Latitude-3570.57976 > 167.99.216.145.8333: tcp 37
02:17:38.973546 IP tom-Latitude-3570.60988 > 81.198.101.144.8333: tcp 37
02:17:39.015925 IP 81.198.101.144.8333 > tom-Latitude-3570.60988: tcp 0
02:17:39.016676 IP 167.99.216.145.8333 > tom-Latitude-3570.57976: tcp 0
02:17:39.016690 IP 81.198.101.144.8333 > tom-Latitude-3570.60988: tcp 0
02:17:39.016693 IP 167.99.216.145.8333 > tom-Latitude-3570.57976: tcp 0
02:17:39.079041 IP 167.99.216.145.8333 > tom-Latitude-3570.57976: tcp 24
02:17:39.079655 IP 167.99.216.145.8333 > tom-Latitude-3570.57976: tcp 226
02:17:39.079735 IP tom-Latitude-3570.57976 > 167.99.216.145.8333: tcp 0
02:17:39.107452 IP 81.198.101.144.8333 > tom-Latitude-3570.60988: tcp 24
02:17:39.107468 IP 81.198.101.144.8333 > tom-Latitude-3570.60988: tcp 223
02:17:39.107510 IP tom-Latitude-3570.60988 > 81.198.101.144.8333: tcp 0
02:17:39.208120 IP tom-Latitude-3570.56714 > ns3113832.ip-54-38-177.eu.8333: tcp 24
02:17:39.208166 IP tom-Latitude-3570.42516 > 2.56.9.15.8333: tcp 24
02:17:39.210595 IP tom-Latitude-3570.42516 > 2.56.9.15.8333: tcp 73
02:17:39.210607 IP tom-Latitude-3570.56714 > ns3113832.ip-54-38-177.eu.8333: tcp 73
02:17:39.232792 IP 2.56.9.15.8333 > tom-Latitude-3570.42516: tcp 24
02:17:39.232813 IP 2.56.9.15.8333 > tom-Latitude-3570.42516: tcp 181
02:17:39.232858 IP tom-Latitude-3570.42516 > 2.56.9.15.8333: tcp 0
02:17:39.233119 IP tom-Latitude-3570.42516 > 2.56.9.15.8333: tcp 24
02:17:39.233134 IP tom-Latitude-3570.42516 > 2.56.9.15.8333: tcp 109
02:17:39.235614 IP 167.99.216.145.8333 > tom-Latitude-3570.57976: tcp 24
02:17:39.235634 IP 167.99.216.145.8333 > tom-Latitude-3570.57976: tcp 181
02:17:39.235726 IP tom-Latitude-3570.57976 > 167.99.216.145.8333: tcp 0
02:17:39.235958 IP tom-Latitude-3570.57976 > 167.99.216.145.8333: tcp 24
02:17:39.237071 IP tom-Latitude-3570.57976 > 167.99.216.145.8333: tcp 73
02:17:39.237616 IP ns3113832.ip-54-38-177.eu.8333 > tom-Latitude-3570.56714: tcp 0
02:17:39.245772 IP 2.56.9.15.8333 > tom-Latitude-3570.42516: tcp 0
02:17:39.246330 IP ns3113832.ip-54-38-177.eu.8333 > tom-Latitude-3570.56714: tcp 0
02:17:39.314807 IP 2.56.9.15.8333 > tom-Latitude-3570.42516: tcp 0
02:17:39.314821 IP 167.99.216.145.8333 > tom-Latitude-3570.57976: tcp 0
02:17:39.314825 IP 167.99.216.145.8333 > tom-Latitude-3570.57976: tcp 0
02:17:39.338067 IP 167.99.216.145.8333 > tom-Latitude-3570.57976: tcp 24
02:17:39.338766 IP 167.99.216.145.8333 > tom-Latitude-3570.57976: tcp 224
02:17:39.338784 IP 167.99.216.145.8333 > tom-Latitude-3570.57976: tcp 24
02:17:39.338788 IP 167.99.216.145.8333 > tom-Latitude-3570.57976: tcp 192
02:17:39.338832 IP tom-Latitude-3570.57976 > 167.99.216.145.8333: tcp 0
02:17:39.371173 IP 2.56.9.15.8333 > tom-Latitude-3570.42516: tcp 24
02:17:39.371961 IP 2.56.9.15.8333 > tom-Latitude-3570.42516: tcp 369
02:17:39.371979 IP 2.56.9.15.8333 > tom-Latitude-3570.42516: tcp 24
02:17:39.371982 IP 2.56.9.15.8333 > tom-Latitude-3570.42516: tcp 249
02:17:39.371986 IP 2.56.9.15.8333 > tom-Latitude-3570.42516: tcp 24
02:17:39.371988 IP 2.56.9.15.8333 > tom-Latitude-3570.42516: tcp 249
02:17:39.372026 IP tom-Latitude-3570.42516 > 2.56.9.15.8333: tcp 0
02:17:39.473722 IP tom-Latitude-3570.60988 > 81.198.101.144.8333: tcp 24
02:17:39.474657 IP tom-Latitude-3570.60988 > 81.198.101.144.8333: tcp 217
02:17:39.508359 IP 81.198.101.144.8333 > tom-Latitude-3570.60988: tcp 0
02:17:39.517188 IP 81.198.101.144.8333 > tom-Latitude-3570.60988: tcp 0
02:17:39.574129 IP tom-Latitude-3570.39110 > vmi195435.contaboserver.net.8333: tcp 24
02:17:39.575070 IP tom-Latitude-3570.39110 > vmi195435.contaboserver.net.8333: tcp 361
02:17:39.603146 IP 81.198.101.144.8333 > tom-Latitude-3570.60988: tcp 24
02:17:39.603806 IP 81.198.101.144.8333 > tom-Latitude-3570.60988: tcp 73
02:17:39.603868 IP tom-Latitude-3570.60988 > 81.198.101.144.8333: tcp 0
02:17:39.604005 IP tom-Latitude-3570.60988 > 81.198.101.144.8333: tcp 24
02:17:39.605489 IP tom-Latitude-3570.60988 > 81.198.101.144.8333: tcp 440
02:17:39.606845 IP vmi195435.contaboserver.net.8333 > tom-Latitude-3570.39110: tcp 0
02:17:39.616257 IP vmi195435.contaboserver.net.8333 > tom-Latitude-3570.39110: tcp 0
02:17:39.634427 IP 81.198.101.144.8333 > tom-Latitude-3570.60988: tcp 0
02:17:39.635045 IP 81.198.101.144.8333 > tom-Latitude-3570.60988: tcp 0
02:17:39.702973 IP vmi195435.contaboserver.net.8333 > tom-Latitude-3570.39110: tcp 24
02:17:39.703530 IP vmi195435.contaboserver.net.8333 > tom-Latitude-3570.39110: tcp 37
02:17:39.703589 IP tom-Latitude-3570.39110 > vmi195435.contaboserver.net.8333: tcp 0
02:17:39.703718 IP tom-Latitude-3570.39110 > vmi195435.contaboserver.net.8333: tcp 24
02:17:39.705257 IP tom-Latitude-3570.39110 > vmi195435.contaboserver.net.8333: tcp 224
02:17:39.735925 IP vmi195435.contaboserver.net.8333 > tom-Latitude-3570.39110: tcp 0
02:17:39.736485 IP vmi195435.contaboserver.net.8333 > tom-Latitude-3570.39110: tcp 0
02:17:40.004899 IP tom-Latitude-3570.49070 > c-185-45-236-223.customer.ggaweb.ch.8333: tcp 24
02:17:40.007012 IP tom-Latitude-3570.49070 > c-185-45-236-223.customer.ggaweb.ch.8333: tcp 361
02:17:40.047821 IP c-185-45-236-223.customer.ggaweb.ch.8333 > tom-Latitude-3570.49070: tcp 0
02:17:40.055292 IP c-185-45-236-223.customer.ggaweb.ch.8333 > tom-Latitude-3570.49070: tcp 0
02:17:40.147490 IP c-185-45-236-223.customer.ggaweb.ch.8333 > tom-Latitude-3570.49070: tcp 24
02:17:40.147507 IP c-185-45-236-223.customer.ggaweb.ch.8333 > tom-Latitude-3570.49070: tcp 37
02:17:40.147552 IP tom-Latitude-3570.49070 > c-185-45-236-223.customer.ggaweb.ch.8333: tcp 0
02:17:40.147739 IP tom-Latitude-3570.49070 > c-185-45-236-223.customer.ggaweb.ch.8333: tcp 24
02:17:40.150220 IP tom-Latitude-3570.49070 > c-185-45-236-223.customer.ggaweb.ch.8333: tcp 224
02:17:40.190306 IP c-185-45-236-223.customer.ggaweb.ch.8333 > tom-Latitude-3570.49070: tcp 0
02:17:40.190320 IP c-185-45-236-223.customer.ggaweb.ch.8333 > tom-Latitude-3570.49070: tcp 0
02:17:40.404659 IP c-185-45-236-223.customer.ggaweb.ch.8333 > tom-Latitude-3570.49070: tcp 24
02:17:40.404678 IP c-185-45-236-223.customer.ggaweb.ch.8333 > tom-Latitude-3570.49070: tcp 109
02:17:40.404722 IP tom-Latitude-3570.49070 > c-185-45-236-223.customer.ggaweb.ch.8333: tcp 0
02:17:40.404930 IP tom-Latitude-3570.49070 > c-185-45-236-223.customer.ggaweb.ch.8333: tcp 24
02:17:40.406200 IP tom-Latitude-3570.49070 > c-185-45-236-223.customer.ggaweb.ch.8333: tcp 109
02:17:40.446288 IP c-185-45-236-223.customer.ggaweb.ch.8333 > tom-Latitude-3570.49070: tcp 0
02:17:40.446840 IP c-185-45-236-223.customer.ggaweb.ch.8333 > tom-Latitude-3570.49070: tcp 0
02:17:40.529350 IP c-185-45-236-223.customer.ggaweb.ch.8333 > tom-Latitude-3570.49070: tcp 24
02:17:40.530100 IP c-185-45-236-223.customer.ggaweb.ch.8333 > tom-Latitude-3570.49070: tcp 494
02:17:40.530117 IP c-185-45-236-223.customer.ggaweb.ch.8333 > tom-Latitude-3570.49070: tcp 247
02:17:40.530162 IP tom-Latitude-3570.49070 > c-185-45-236-223.customer.ggaweb.ch.8333: tcp 0
02:17:40.832027 IP tom-Latitude-3570.60470 > bb42-60-217-183.singnet.com.sg.8333: tcp 24
02:17:40.834086 IP tom-Latitude-3570.60470 > bb42-60-217-183.singnet.com.sg.8333: tcp 469
02:17:40.870179 IP bb42-60-217-183.singnet.com.sg.8333 > tom-Latitude-3570.60470: tcp 0
02:17:40.887001 IP bb42-60-217-183.singnet.com.sg.8333 > tom-Latitude-3570.60470: tcp 0
02:17:41.032679 IP tom-Latitude-3570.39110 > vmi195435.contaboserver.net.8333: tcp 24
02:17:41.034792 IP tom-Latitude-3570.39110 > vmi195435.contaboserver.net.8333: tcp 109
02:17:41.068108 IP vmi195435.contaboserver.net.8333 > tom-Latitude-3570.39110: tcp 0
02:17:41.074443 IP vmi195435.contaboserver.net.8333 > tom-Latitude-3570.39110: tcp 0
02:17:41.434130 IP tom-Latitude-3570.42516 > 2.56.9.15.8333: tcp 24
02:17:41.437155 IP tom-Latitude-3570.42516 > 2.56.9.15.8333: tcp 181
02:17:41.495607 IP 2.56.9.15.8333 > tom-Latitude-3570.42516: tcp 0
02:17:42.236774 IP tom-Latitude-3570.57976 > 167.99.216.145.8333: tcp 24
02:17:42.238807 IP tom-Latitude-3570.57976 > 167.99.216.145.8333: tcp 109
02:17:42.281678 IP bb42-60-217-183.singnet.com.sg.8333 > tom-Latitude-3570.60470: tcp 24
02:17:42.282350 IP bb42-60-217-183.singnet.com.sg.8333 > tom-Latitude-3570.60470: tcp 181
02:17:42.282368 IP 167.99.216.145.8333 > tom-Latitude-3570.57976: tcp 24
02:17:42.282374 IP 167.99.216.145.8333 > tom-Latitude-3570.57976: tcp 73
02:17:42.282377 IP bb42-60-217-183.singnet.com.sg.8333 > tom-Latitude-3570.60470: tcp 181
02:17:42.282388 IP tom-Latitude-3570.60470 > bb42-60-217-183.singnet.com.sg.8333: tcp 0
02:17:42.282412 IP tom-Latitude-3570.57976 > 167.99.216.145.8333: tcp 0
02:17:42.282683 IP tom-Latitude-3570.60470 > bb42-60-217-183.singnet.com.sg.8333: tcp 24
02:17:42.283778 IP tom-Latitude-3570.60470 > bb42-60-217-183.singnet.com.sg.8333: tcp 181
02:17:42.291085 IP 167.99.216.145.8333 > tom-Latitude-3570.57976: tcp 0
02:17:42.300359 IP 167.99.216.145.8333 > tom-Latitude-3570.57976: tcp 0
02:17:42.316938 IP bb42-60-217-183.singnet.com.sg.8333 > tom-Latitude-3570.60470: tcp 0
02:17:42.317592 IP bb42-60-217-183.singnet.com.sg.8333 > tom-Latitude-3570.60470: tcp 0
02:17:42.382852 IP tom-Latitude-3570.60988 > 81.198.101.144.8333: tcp 24
02:17:42.384067 IP tom-Latitude-3570.60988 > 81.198.101.144.8333: tcp 109
02:17:42.417888 IP 81.198.101.144.8333 > tom-Latitude-3570.60988: tcp 0
02:17:42.425874 IP 81.198.101.144.8333 > tom-Latitude-3570.60988: tcp 0
02:17:43.067645 IP bb42-60-217-183.singnet.com.sg.8333 > tom-Latitude-3570.60470: tcp 248
02:17:43.067664 IP tom-Latitude-3570.60470 > bb42-60-217-183.singnet.com.sg.8333: tcp 0
02:17:43.067682 IP bb42-60-217-183.singnet.com.sg.8333 > tom-Latitude-3570.60470: tcp 24
02:17:43.067685 IP tom-Latitude-3570.60470 > bb42-60-217-183.singnet.com.sg.8333: tcp 0
02:17:43.067688 IP bb42-60-217-183.singnet.com.sg.8333 > tom-Latitude-3570.60470: tcp 668
02:17:43.067691 IP tom-Latitude-3570.60470 > bb42-60-217-183.singnet.com.sg.8333: tcp 0
02:17:43.067693 IP bb42-60-217-183.singnet.com.sg.8333 > tom-Latitude-3570.60470: tcp 24
02:17:43.067695 IP tom-Latitude-3570.60470 > bb42-60-217-183.singnet.com.sg.8333: tcp 0
02:17:43.067697 IP bb42-60-217-183.singnet.com.sg.8333 > tom-Latitude-3570.60470: tcp 249
02:17:43.067698 IP tom-Latitude-3570.60470 > bb42-60-217-183.singnet.com.sg.8333: tcp 0
02:17:43.067700 IP bb42-60-217-183.singnet.com.sg.8333 > tom-Latitude-3570.60470: tcp 24
02:17:43.067701 IP tom-Latitude-3570.60470 > bb42-60-217-183.singnet.com.sg.8333: tcp 0
02:17:43.067704 IP bb42-60-217-183.singnet.com.sg.8333 > tom-Latitude-3570.60470: tcp 386
02:17:43.067705 IP tom-Latitude-3570.60470 > bb42-60-217-183.singnet.com.sg.8333: tcp 0
02:17:43.067707 IP bb42-60-217-183.singnet.com.sg.8333 > tom-Latitude-3570.60470: tcp 24
02:17:43.067708 IP tom-Latitude-3570.60470 > bb42-60-217-183.singnet.com.sg.8333: tcp 0
02:17:43.067710 IP bb42-60-217-183.singnet.com.sg.8333 > tom-Latitude-3570.60470: tcp 226
02:17:43.067712 IP tom-Latitude-3570.60470 > bb42-60-217-183.singnet.com.sg.8333: tcp 0
02:17:43.154117 IP bb42-60-217-183.singnet.com.sg.8333 > tom-Latitude-3570.60470: tcp 24
02:17:43.154146 IP tom-Latitude-3570.60470 > bb42-60-217-183.singnet.com.sg.8333: tcp 0
02:17:43.457214 IP tom-Latitude-3570.49070 > c-185-45-236-223.customer.ggaweb.ch.8333: tcp 24
02:17:43.459430 IP tom-Latitude-3570.49070 > c-185-45-236-223.customer.ggaweb.ch.8333: tcp 181
02:17:43.509983 IP vmi195435.contaboserver.net.8333 > tom-Latitude-3570.39110: tcp 24
02:17:43.510003 IP vmi195435.contaboserver.net.8333 > tom-Latitude-3570.39110: tcp 325
02:17:43.510044 IP tom-Latitude-3570.39110 > vmi195435.contaboserver.net.8333: tcp 0
02:17:43.510289 IP tom-Latitude-3570.39110 > vmi195435.contaboserver.net.8333: tcp 24
02:17:43.510752 IP c-185-45-236-223.customer.ggaweb.ch.8333 > tom-Latitude-3570.49070: tcp 0
02:17:43.511208 IP tom-Latitude-3570.39110 > vmi195435.contaboserver.net.8333: tcp 145
02:17:43.514210 IP c-185-45-236-223.customer.ggaweb.ch.8333 > tom-Latitude-3570.49070: tcp 0
02:17:43.517996 IP c-185-45-236-223.customer.ggaweb.ch.8333 > tom-Latitude-3570.49070: tcp 24
02:17:43.518675 IP c-185-45-236-223.customer.ggaweb.ch.8333 > tom-Latitude-3570.49070: tcp 361
02:17:43.518738 IP tom-Latitude-3570.49070 > c-185-45-236-223.customer.ggaweb.ch.8333: tcp 0
02:17:43.519001 IP tom-Latitude-3570.49070 > c-185-45-236-223.customer.ggaweb.ch.8333: tcp 24
02:17:43.520289 IP tom-Latitude-3570.49070 > c-185-45-236-223.customer.ggaweb.ch.8333: tcp 37
02:17:43.545498 IP vmi195435.contaboserver.net.8333 > tom-Latitude-3570.39110: tcp 0
02:17:43.546109 IP vmi195435.contaboserver.net.8333 > tom-Latitude-3570.39110: tcp 0
02:17:43.546123 IP c-185-45-236-223.customer.ggaweb.ch.8333 > tom-Latitude-3570.49070: tcp 0
02:17:43.638904 IP c-185-45-236-223.customer.ggaweb.ch.8333 > tom-Latitude-3570.49070: tcp 24
02:17:43.638925 IP c-185-45-236-223.customer.ggaweb.ch.8333 > tom-Latitude-3570.49070: tcp 484
02:17:43.638967 IP tom-Latitude-3570.49070 > c-185-45-236-223.customer.ggaweb.ch.8333: tcp 0
02:17:43.684551 IP vmi195435.contaboserver.net.8333 > tom-Latitude-3570.39110: tcp 24
02:17:43.684604 IP vmi195435.contaboserver.net.8333 > tom-Latitude-3570.39110: tcp 370
02:17:43.684609 IP vmi195435.contaboserver.net.8333 > tom-Latitude-3570.39110: tcp 24
02:17:43.684615 IP vmi195435.contaboserver.net.8333 > tom-Latitude-3570.39110: tcp 1448
02:17:43.684618 IP vmi195435.contaboserver.net.8333 > tom-Latitude-3570.39110: tcp 72
02:17:43.684620 IP vmi195435.contaboserver.net.8333 > tom-Latitude-3570.39110: tcp 24
02:17:43.684622 IP vmi195435.contaboserver.net.8333 > tom-Latitude-3570.39110: tcp 192
02:17:43.684625 IP vmi195435.contaboserver.net.8333 > tom-Latitude-3570.39110: tcp 24
02:17:43.684626 IP vmi195435.contaboserver.net.8333 > tom-Latitude-3570.39110: tcp 224
02:17:43.684648 IP tom-Latitude-3570.39110 > vmi195435.contaboserver.net.8333: tcp 0
02:17:43.686097 IP tom-Latitude-3570.42516 > 2.56.9.15.8333: tcp 24
02:17:43.686778 IP tom-Latitude-3570.42516 > 2.56.9.15.8333: tcp 253
02:17:43.714562 IP 2.56.9.15.8333 > tom-Latitude-3570.42516: tcp 0
02:17:43.814526 IP 2.56.9.15.8333 > tom-Latitude-3570.42516: tcp 24
02:17:43.814545 IP 2.56.9.15.8333 > tom-Latitude-3570.42516: tcp 37
02:17:43.814590 IP tom-Latitude-3570.42516 > 2.56.9.15.8333: tcp 0
02:17:43.814769 IP tom-Latitude-3570.42516 > 2.56.9.15.8333: tcp 24
02:17:43.814969 IP tom-Latitude-3570.46284 > static-87-75-105-186.vodafonexdsl.co.uk.8333: tcp 24
02:17:43.818057 IP tom-Latitude-3570.46284 > static-87-75-105-186.vodafonexdsl.co.uk.8333: tcp 721
02:17:43.818069 IP tom-Latitude-3570.42516 > 2.56.9.15.8333: tcp 484
02:17:43.844519 IP static-87-75-105-186.vodafonexdsl.co.uk.8333 > tom-Latitude-3570.46284: tcp 0
02:17:43.890563 IP static-87-75-105-186.vodafonexdsl.co.uk.8333 > tom-Latitude-3570.46284: tcp 0
02:17:43.890576 IP 2.56.9.15.8333 > tom-Latitude-3570.42516: tcp 0
02:17:43.915353 IP tom-Latitude-3570.60988 > 81.198.101.144.8333: tcp 24
02:17:43.916292 IP tom-Latitude-3570.60988 > 81.198.101.144.8333: tcp 361
02:17:43.946996 IP 81.198.101.144.8333 > tom-Latitude-3570.60988: tcp 0
02:17:43.976128 IP 81.198.101.144.8333 > tom-Latitude-3570.60988: tcp 0
02:17:44.044503 IP 81.198.101.144.8333 > tom-Latitude-3570.60988: tcp 24
02:17:44.045105 IP 81.198.101.144.8333 > tom-Latitude-3570.60988: tcp 37
02:17:44.045167 IP tom-Latitude-3570.60988 > 81.198.101.144.8333: tcp 0
02:17:44.045305 IP tom-Latitude-3570.60988 > 81.198.101.144.8333: tcp 24
02:17:44.046692 IP tom-Latitude-3570.60988 > 81.198.101.144.8333: tcp 484
02:17:44.076845 IP 81.198.101.144.8333 > tom-Latitude-3570.60988: tcp 0
02:17:44.076859 IP 81.198.101.144.8333 > tom-Latitude-3570.60988: tcp 0
02:17:44.145785 IP tom-Latitude-3570.42516 > 2.56.9.15.8333: tcp 24
02:17:44.146722 IP tom-Latitude-3570.42516 > 2.56.9.15.8333: tcp 109
02:17:44.263911 IP tom-Latitude-3570.42516 > 2.56.9.15.8333: tcp 109
02:17:44.323622 IP 2.56.9.15.8333 > tom-Latitude-3570.42516: tcp 0
02:17:44.323636 IP 2.56.9.15.8333 > tom-Latitude-3570.42516: tcp 0
02:17:44.647578 IP tom-Latitude-3570.56714 > ns3113832.ip-54-38-177.eu.8333: tcp 24
02:17:44.649862 IP tom-Latitude-3570.56714 > ns3113832.ip-54-38-177.eu.8333: tcp 649
02:17:44.650390 IP static-87-75-105-186.vodafonexdsl.co.uk.8333 > tom-Latitude-3570.46284: tcp 24
02:17:44.650410 IP static-87-75-105-186.vodafonexdsl.co.uk.8333 > tom-Latitude-3570.46284: tcp 73
02:17:44.650457 IP tom-Latitude-3570.46284 > static-87-75-105-186.vodafonexdsl.co.uk.8333: tcp 0
02:17:44.650659 IP tom-Latitude-3570.46284 > static-87-75-105-186.vodafonexdsl.co.uk.8333: tcp 24
02:17:44.651730 IP tom-Latitude-3570.46284 > static-87-75-105-186.vodafonexdsl.co.uk.8333: tcp 73
02:17:44.685685 IP ns3113832.ip-54-38-177.eu.8333 > tom-Latitude-3570.56714: tcp 0
02:17:44.685697 IP ns3113832.ip-54-38-177.eu.8333 > tom-Latitude-3570.56714: tcp 0
02:17:44.685699 IP static-87-75-105-186.vodafonexdsl.co.uk.8333 > tom-Latitude-3570.46284: tcp 0
02:17:44.685702 IP static-87-75-105-186.vodafonexdsl.co.uk.8333 > tom-Latitude-3570.46284: tcp 0
02:17:44.755027 IP static-87-75-105-186.vodafonexdsl.co.uk.8333 > tom-Latitude-3570.46284: tcp 24
02:17:44.755046 IP static-87-75-105-186.vodafonexdsl.co.uk.8333 > tom-Latitude-3570.46284: tcp 373
02:17:44.755051 IP static-87-75-105-186.vodafonexdsl.co.uk.8333 > tom-Latitude-3570.46284: tcp 24
02:17:44.755054 IP static-87-75-105-186.vodafonexdsl.co.uk.8333 > tom-Latitude-3570.46284: tcp 223
02:17:44.755084 IP tom-Latitude-3570.46284 > static-87-75-105-186.vodafonexdsl.co.uk.8333: tcp 0
02:17:44.856567 IP tom-Latitude-3570.57976 > 167.99.216.145.8333: tcp 24
02:17:44.857643 IP tom-Latitude-3570.57976 > 167.99.216.145.8333: tcp 433
