06:04:14.232454 IP tom-Latitude-3570.57976 > 167.99.216.145.8333: tcp 24
06:04:14.234546 IP tom-Latitude-3570.57976 > 167.99.216.145.8333: tcp 109
06:04:14.310888 IP 2.56.9.15.8333 > tom-Latitude-3570.42516: tcp 24
06:04:14.310909 IP 2.56.9.15.8333 > tom-Latitude-3570.42516: tcp 109
06:04:14.310914 IP 167.99.216.145.8333 > tom-Latitude-3570.57976: tcp 0
06:04:14.310954 IP tom-Latitude-3570.42516 > 2.56.9.15.8333: tcp 0
06:04:14.311165 IP tom-Latitude-3570.42516 > 2.56.9.15.8333: tcp 24
06:04:14.312491 IP tom-Latitude-3570.42516 > 2.56.9.15.8333: tcp 73
06:04:14.352024 IP 2.56.9.15.8333 > tom-Latitude-3570.42516: tcp 0
06:04:14.352038 IP 2.56.9.15.8333 > tom-Latitude-3570.42516: tcp 0
06:04:14.447703 IP 2.56.9.15.8333 > tom-Latitude-3570.42516: tcp 24
06:04:14.448442 IP 2.56.9.15.8333 > tom-Latitude-3570.42516: tcp 222
06:04:14.448465 IP 2.56.9.15.8333 > tom-Latitude-3570.42516: tcp 24
06:04:14.448469 IP 2.56.9.15.8333 > tom-Latitude-3570.42516: tcp 283
06:04:14.448547 IP tom-Latitude-3570.42516 > 2.56.9.15.8333: tcp 0
06:04:14.649773 IP tom-Latitude-3570.49070 > c-185-45-236-223.customer.ggaweb.ch.8333: tcp 24
06:04:14.651911 IP tom-Latitude-3570.49070 > c-185-45-236-223.customer.ggaweb.ch.8333: tcp 181
06:04:14.683083 IP c-185-45-236-223.customer.ggaweb.ch.8333 > tom-Latitude-3570.49070: tcp 0
06:04:14.692535 IP c-185-45-236-223.customer.ggaweb.ch.8333 > tom-Latitude-3570.49070: tcp 0
06:04:14.850540 IP tom-Latitude-3570.46284 > static-87-75-105-186.vodafonexdsl.co.uk.8333: tcp 24
06:04:14.852641 IP tom-Latitude-3570.46284 > static-87-75-105-186.vodafonexdsl.co.uk.8333: tcp 109
06:04:14.892542 IP static-87-75-105-186.vodafonexdsl.co.uk.8333 > tom-Latitude-3570.46284: tcp 0
06:04:15.042997 IP static-87-75-105-186.vodafonexdsl.co.uk.8333 > tom-Latitude-3570.46284: tcp 24
06:04:15.043022 IP tom-Latitude-3570.46284 > static-87-75-105-186.vodafonexdsl.co.uk.8333: tcp 0
06:04:15.043040 IP static-87-75-105-186.vodafonexdsl.co.uk.8333 > tom-Latitude-3570.46284: tcp 31
06:04:15.043043 IP tom-Latitude-3570.46284 > static-87-75-105-186.vodafonexdsl.co.uk.8333: tcp 0
06:04:15.043047 IP vmi195435.contaboserver.net.8333 > tom-Latitude-3570.39110: tcp 24
06:04:15.043052 IP vmi195435.contaboserver.net.8333 > tom-Latitude-3570.39110: tcp 145
06:04:15.043101 IP tom-Latitude-3570.39110 > vmi195435.contaboserver.net.8333: tcp 0
06:04:15.043306 IP tom-Latitude-3570.39110 > vmi195435.contaboserver.net.8333: tcp 24
06:04:15.045747 IP tom-Latitude-3570.39110 > vmi195435.contaboserver.net.8333: tcp 73
06:04:15.082492 IP vmi195435.contaboserver.net.8333 > tom-Latitude-3570.39110: tcp 0
06:04:15.083052 IP vmi195435.contaboserver.net.8333 > tom-Latitude-3570.39110: tcp 0
06:04:15.160707 IP vmi195435.contaboserver.net.8333 > tom-Latitude-3570.39110: tcp 24
06:04:15.161370 IP vmi195435.contaboserver.net.8333 > tom-Latitude-3570.39110: tcp 248
06:04:15.161388 IP vmi195435.contaboserver.net.8333 > tom-Latitude-3570.39110: tcp 24
06:04:15.161393 IP vmi195435.contaboserver.net.8333 > tom-Latitude-3570.39110: tcp 284
06:04:15.161430 IP tom-Latitude-3570.39110 > vmi195435.contaboserver.net.8333: tcp 0
06:04:15.262520 IP bb42-60-217-183.singnet.com.sg.8333 > tom-Latitude-3570.60470: tcp 24
06:04:15.262540 IP bb42-60-217-183.singnet.com.sg.8333 > tom-Latitude-3570.60470: tcp 181
06:04:15.262576 IP tom-Latitude-3570.60470 > bb42-60-217-183.singnet.com.sg.8333: tcp 0
06:04:15.760241 IP 81.198.101.144.8333 > tom-Latitude-3570.60988: tcp 24
06:04:15.760263 IP 81.198.101.144.8333 > tom-Latitude-3570.60988: tcp 289
06:04:15.760269 IP 81.198.101.144.8333 > tom-Latitude-3570.60988: tcp 289
06:04:15.760280 IP tom-Latitude-3570.60988 > 81.198.101.144.8333: tcp 0
06:04:15.760533 IP tom-Latitude-3570.60988 > 81.198.101.144.8333: tcp 24
06:04:15.761661 IP tom-Latitude-3570.60988 > 81.198.101.144.8333: tcp 37
06:04:15.801621 IP 81.198.101.144.8333 > tom-Latitude-3570.60988: tcp 0
06:04:15.802270 IP 81.198.101.144.8333 > tom-Latitude-3570.60988: tcp 0
06:04:15.889010 IP 81.198.101.144.8333 > tom-Latitude-3570.60988: tcp 24
06:04:15.889630 IP 81.198.101.144.8333 > tom-Latitude-3570.60988: tcp 256
06:04:15.889717 IP tom-Latitude-3570.60988 > 81.198.101.144.8333: tcp 0
06:04:15.990567 IP tom-Latitude-3570.57976 > 167.99.216.145.8333: tcp 24
06:04:15.991910 IP tom-Latitude-3570.57976 > 167.99.216.145.8333: tcp 181
06:04:16.032555 IP 167.99.216.145.8333 > tom-Latitude-3570.57976: tcp 0
06:04:16.692959 IP tom-Latitude-3570.39110 > vmi195435.contaboserver.net.8333: tcp 24
06:04:16.693026 IP tom-Latitude-3570.42516 > 2.56.9.15.8333: tcp 24
06:04:16.694978 IP tom-Latitude-3570.39110 > vmi195435.contaboserver.net.8333: tcp 37
06:04:16.695553 IP 2.56.9.15.8333 > tom-Latitude-3570.42516: tcp 24
06:04:16.695575 IP tom-Latitude-3570.42516 > 2.56.9.15.8333: tcp 109
06:04:16.695592 IP 2.56.9.15.8333 > tom-Latitude-3570.42516: tcp 253
06:04:16.695597 IP 2.56.9.15.8333 > tom-Latitude-3570.42516: tcp 253
06:04:16.695601 IP tom-Latitude-3570.42516 > 2.56.9.15.8333: tcp 0
06:04:16.696488 IP tom-Latitude-3570.42516 > 2.56.9.15.8333: tcp 169
06:04:16.732130 IP 2.56.9.15.8333 > tom-Latitude-3570.42516: tcp 0
06:04:16.732142 IP vmi195435.contaboserver.net.8333 > tom-Latitude-3570.39110: tcp 0
06:04:16.732144 IP vmi195435.contaboserver.net.8333 > tom-Latitude-3570.39110: tcp 0
06:04:16.732147 IP 2.56.9.15.8333 > tom-Latitude-3570.42516: tcp 0
06:04:16.732149 IP 2.56.9.15.8333 > tom-Latitude-3570.42516: tcp 0
06:04:16.886832 IP 2.56.9.15.8333 > tom-Latitude-3570.42516: tcp 24
06:04:16.886859 IP 2.56.9.15.8333 > tom-Latitude-3570.42516: tcp 403
06:04:16.886869 IP 2.56.9.15.8333 > tom-Latitude-3570.42516: tcp 24
06:04:16.886874 IP 2.56.9.15.8333 > tom-Latitude-3570.42516: tcp 403
06:04:16.886878 IP 2.56.9.15.8333 > tom-Latitude-3570.42516: tcp 24
06:04:16.886882 IP 2.56.9.15.8333 > tom-Latitude-3570.42516: tcp 225
06:04:16.886886 IP 2.56.9.15.8333 > tom-Latitude-3570.42516: tcp 24
06:04:16.886891 IP 2.56.9.15.8333 > tom-Latitude-3570.42516: tcp 225
06:04:16.886931 IP tom-Latitude-3570.42516 > 2.56.9.15.8333: tcp 0
06:04:17.191702 IP tom-Latitude-3570.39110 > vmi195435.contaboserver.net.8333: tcp 24
06:04:17.193731 IP tom-Latitude-3570.39110 > vmi195435.contaboserver.net.8333: tcp 145
06:04:17.234903 IP vmi195435.contaboserver.net.8333 > tom-Latitude-3570.39110: tcp 0
06:04:17.242910 IP vmi195435.contaboserver.net.8333 > tom-Latitude-3570.39110: tcp 0
06:04:17.316686 IP ns3113832.ip-54-38-177.eu.8333 > tom-Latitude-3570.56714: tcp 24
06:04:17.316711 IP tom-Latitude-3570.56714 > ns3113832.ip-54-38-177.eu.8333: tcp 0
06:04:17.317259 IP ns3113832.ip-54-38-177.eu.8333 > tom-Latitude-3570.56714: tcp 469
06:04:17.317284 IP tom-Latitude-3570.56714 > ns3113832.ip-54-38-177.eu.8333: tcp 0
06:04:17.317568 IP tom-Latitude-3570.56714 > ns3113832.ip-54-38-177.eu.8333: tcp 24
06:04:17.320038 IP tom-Latitude-3570.56714 > ns3113832.ip-54-38-177.eu.8333: tcp 37
06:04:17.343765 IP bb42-60-217-183.singnet.com.sg.8333 > tom-Latitude-3570.60470: tcp 24
06:04:17.344313 IP bb42-60-217-183.singnet.com.sg.8333 > tom-Latitude-3570.60470: tcp 217
06:04:17.344399 IP tom-Latitude-3570.60470 > bb42-60-217-183.singnet.com.sg.8333: tcp 0
06:04:17.356635 IP ns3113832.ip-54-38-177.eu.8333 > tom-Latitude-3570.56714: tcp 0
06:04:17.357219 IP ns3113832.ip-54-38-177.eu.8333 > tom-Latitude-3570.56714: tcp 0
06:04:17.416744 IP ns3113832.ip-54-38-177.eu.8333 > tom-Latitude-3570.56714: tcp 24
06:04:17.416764 IP ns3113832.ip-54-38-177.eu.8333 > tom-Latitude-3570.56714: tcp 1063
06:04:17.416809 IP tom-Latitude-3570.56714 > ns3113832.ip-54-38-177.eu.8333: tcp 0
06:04:17.514652 IP static-87-75-105-186.vodafonexdsl.co.uk.8333 > tom-Latitude-3570.46284: tcp 24
06:04:17.514669 IP tom-Latitude-3570.46284 > static-87-75-105-186.vodafonexdsl.co.uk.8333: tcp 0
06:04:17.527736 IP static-87-75-105-186.vodafonexdsl.co.uk.8333 > tom-Latitude-3570.46284: tcp 289
06:04:17.527760 IP tom-Latitude-3570.46284 > static-87-75-105-186.vodafonexdsl.co.uk.8333: tcp 0
06:04:17.728815 IP tom-Latitude-3570.60988 > 81.198.101.144.8333: tcp 24
06:04:17.730700 IP tom-Latitude-3570.60988 > 81.198.101.144.8333: tcp 181
06:04:17.764631 IP 81.198.101.144.8333 > tom-Latitude-3570.60988: tcp 0
06:04:17.774626 IP 81.198.101.144.8333 > tom-Latitude-3570.60988: tcp 0
06:04:18.218951 IP static-87-75-105-186.vodafonexdsl.co.uk.8333 > tom-Latitude-3570.46284: tcp 24
06:04:18.218968 IP tom-Latitude-3570.46284 > static-87-75-105-186.vodafonexdsl.co.uk.8333: tcp 0
06:04:18.218987 IP static-87-75-105-186.vodafonexdsl.co.uk.8333 > tom-Latitude-3570.46284: tcp 73
06:04:18.218990 IP tom-Latitude-3570.46284 > static-87-75-105-186.vodafonexdsl.co.uk.8333: tcp 0
06:04:18.218994 IP static-87-75-105-186.vodafonexdsl.co.uk.8333 > tom-Latitude-3570.46284: tcp 73
06:04:18.218999 IP tom-Latitude-3570.46284 > static-87-75-105-186.vodafonexdsl.co.uk.8333: tcp 0
06:04:18.219002 IP 81.198.101.144.8333 > tom-Latitude-3570.60988: tcp 24
06:04:18.219007 IP 81.198.101.144.8333 > tom-Latitude-3570.60988: tcp 8
06:04:18.219074 IP tom-Latitude-3570.60988 > 81.198.101.144.8333: tcp 0
06:04:18.219150 IP tom-Latitude-3570.60988 > 81.198.101.144.8333: tcp 24
06:04:18.219237 IP tom-Latitude-3570.46284 > static-87-75-105-186.vodafonexdsl.co.uk.8333: tcp 24
06:04:18.222390 IP tom-Latitude-3570.60988 > 81.198.101.144.8333: tcp 8
06:04:18.223287 IP tom-Latitude-3570.46284 > static-87-75-105-186.vodafonexdsl.co.uk.8333: tcp 73
06:04:18.266977 IP 81.198.101.144.8333 > tom-Latitude-3570.60988: tcp 0
06:04:18.266992 IP 81.198.101.144.8333 > tom-Latitude-3570.60988: tcp 0
06:04:18.266994 IP static-87-75-105-186.vodafonexdsl.co.uk.8333 > tom-Latitude-3570.46284: tcp 0
06:04:18.328667 IP static-87-75-105-186.vodafonexdsl.co.uk.8333 > tom-Latitude-3570.46284: tcp 24
06:04:18.329416 IP static-87-75-105-186.vodafonexdsl.co.uk.8333 > tom-Latitude-3570.46284: tcp 256
06:04:18.329435 IP static-87-75-105-186.vodafonexdsl.co.uk.8333 > tom-Latitude-3570.46284: tcp 24
06:04:18.329440 IP static-87-75-105-186.vodafonexdsl.co.uk.8333 > tom-Latitude-3570.46284: tcp 247
06:04:18.329483 IP tom-Latitude-3570.46284 > static-87-75-105-186.vodafonexdsl.co.uk.8333: tcp 0
06:04:19.132672 IP tom-Latitude-3570.49070 > c-185-45-236-223.customer.ggaweb.ch.8333: tcp 24
06:04:19.132747 IP tom-Latitude-3570.56714 > ns3113832.ip-54-38-177.eu.8333: tcp 24
06:04:19.138345 IP tom-Latitude-3570.49070 > c-185-45-236-223.customer.ggaweb.ch.8333: tcp 361
06:04:19.139177 IP tom-Latitude-3570.56714 > ns3113832.ip-54-38-177.eu.8333: tcp 73
06:04:19.155456 IP 167.99.216.145.8333 > tom-Latitude-3570.57976: tcp 24
06:04:19.155482 IP tom-Latitude-3570.57976 > 167.99.216.145.8333: tcp 0
06:04:19.156121 IP 167.99.216.145.8333 > tom-Latitude-3570.57976: tcp 289
06:04:19.156146 IP tom-Latitude-3570.57976 > 167.99.216.145.8333: tcp 0
06:04:19.156162 IP 167.99.216.145.8333 > tom-Latitude-3570.57976: tcp 289
06:04:19.156166 IP tom-Latitude-3570.57976 > 167.99.216.145.8333: tcp 0
06:04:19.156400 IP tom-Latitude-3570.57976 > 167.99.216.145.8333: tcp 24
06:04:19.159009 IP tom-Latitude-3570.57976 > 167.99.216.145.8333: tcp 37
06:04:19.160943 IP c-185-45-236-223.customer.ggaweb.ch.8333 > tom-Latitude-3570.49070: tcp 0
06:04:19.167057 IP ns3113832.ip-54-38-177.eu.8333 > tom-Latitude-3570.56714: tcp 0
06:04:19.167783 IP c-185-45-236-223.customer.ggaweb.ch.8333 > tom-Latitude-3570.49070: tcp 0
06:04:19.167807 IP ns3113832.ip-54-38-177.eu.8333 > tom-Latitude-3570.56714: tcp 0
06:04:19.191096 IP 167.99.216.145.8333 > tom-Latitude-3570.57976: tcp 0
06:04:19.226901 IP 2.56.9.15.8333 > tom-Latitude-3570.42516: tcp 24
06:04:19.227465 IP 2.56.9.15.8333 > tom-Latitude-3570.42516: tcp 253
06:04:19.227528 IP tom-Latitude-3570.42516 > 2.56.9.15.8333: tcp 0
06:04:19.227811 IP tom-Latitude-3570.42516 > 2.56.9.15.8333: tcp 24
06:04:19.229105 IP tom-Latitude-3570.42516 > 2.56.9.15.8333: tcp 109
06:04:19.255747 IP 167.99.216.145.8333 > tom-Latitude-3570.57976: tcp 24
06:04:19.256323 IP 167.99.216.145.8333 > tom-Latitude-3570.57976: tcp 226
06:04:19.256335 IP tom-Latitude-3570.57976 > 167.99.216.145.8333: tcp 0
06:04:19.262129 IP 2.56.9.15.8333 > tom-Latitude-3570.42516: tcp 0
06:04:19.262143 IP 2.56.9.15.8333 > tom-Latitude-3570.42516: tcp 0
06:04:19.357008 IP tom-Latitude-3570.60988 > 81.198.101.144.8333: tcp 24
06:04:19.357953 IP tom-Latitude-3570.60988 > 81.198.101.144.8333: tcp 109
06:04:19.358850 IP 2.56.9.15.8333 > tom-Latitude-3570.42516: tcp 24
06:04:19.358892 IP 2.56.9.15.8333 > tom-Latitude-3570.42516: tcp 225
06:04:19.358899 IP 2.56.9.15.8333 > tom-Latitude-3570.42516: tcp 24
06:04:19.358903 IP 2.56.9.15.8333 > tom-Latitude-3570.42516: tcp 223
06:04:19.358905 IP 2.56.9.15.8333 > tom-Latitude-3570.42516: tcp 24
06:04:19.358908 IP 2.56.9.15.8333 > tom-Latitude-3570.42516: tcp 1368
06:04:19.358912 IP 2.56.9.15.8333 > tom-Latitude-3570.42516: tcp 559
06:04:19.358940 IP tom-Latitude-3570.42516 > 2.56.9.15.8333: tcp 0
06:04:19.430928 IP 81.198.101.144.8333 > tom-Latitude-3570.60988: tcp 0
06:04:19.430942 IP 81.198.101.144.8333 > tom-Latitude-3570.60988: tcp 0
06:04:19.461432 IP tom-Latitude-3570.39110 > vmi195435.contaboserver.net.8333: tcp 24
06:04:19.462370 IP tom-Latitude-3570.39110 > vmi195435.contaboserver.net.8333: tcp 253
06:04:19.473107 IP static-87-75-105-186.vodafonexdsl.co.uk.8333 > tom-Latitude-3570.46284: tcp 24
06:04:19.479138 IP static-87-75-105-186.vodafonexdsl.co.uk.8333 > tom-Latitude-3570.46284: tcp 145
06:04:19.479202 IP tom-Latitude-3570.46284 > static-87-75-105-186.vodafonexdsl.co.uk.8333: tcp 0
06:04:19.482077 IP 81.198.101.144.8333 > tom-Latitude-3570.60988: tcp 24
06:04:19.482712 IP 81.198.101.144.8333 > tom-Latitude-3570.60988: tcp 37
06:04:19.482774 IP tom-Latitude-3570.60988 > 81.198.101.144.8333: tcp 0
06:04:19.482914 IP tom-Latitude-3570.60988 > 81.198.101.144.8333: tcp 24
06:04:19.484292 IP tom-Latitude-3570.60988 > 81.198.101.144.8333: tcp 226
06:04:19.490834 IP vmi195435.contaboserver.net.8333 > tom-Latitude-3570.39110: tcp 0
06:04:19.505613 IP vmi195435.contaboserver.net.8333 > tom-Latitude-3570.39110: tcp 0
06:04:19.533043 IP 81.198.101.144.8333 > tom-Latitude-3570.60988: tcp 0
06:04:19.533060 IP 81.198.101.144.8333 > tom-Latitude-3570.60988: tcp 0
06:04:19.856641 IP 167.99.216.145.8333 > tom-Latitude-3570.57976: tcp 24
06:04:19.856661 IP 167.99.216.145.8333 > tom-Latitude-3570.57976: tcp 73
06:04:19.856665 IP vmi195435.contaboserver.net.8333 > tom-Latitude-3570.39110: tcp 24
06:04:19.856669 IP vmi195435.contaboserver.net.8333 > tom-Latitude-3570.39110: tcp 37
06:04:19.856706 IP tom-Latitude-3570.57976 > 167.99.216.145.8333: tcp 0
06:04:19.856742 IP tom-Latitude-3570.39110 > vmi195435.contaboserver.net.8333: tcp 0
06:04:19.856886 IP tom-Latitude-3570.39110 > vmi195435.contaboserver.net.8333: tcp 24
06:04:19.858869 IP tom-Latitude-3570.39110 > vmi195435.contaboserver.net.8333: tcp 37
06:04:19.860260 IP 167.99.216.145.8333 > tom-Latitude-3570.57976: tcp 73
06:04:19.860278 IP tom-Latitude-3570.57976 > 167.99.216.145.8333: tcp 0
06:04:19.906277 IP vmi195435.contaboserver.net.8333 > tom-Latitude-3570.39110: tcp 0
06:04:19.906872 IP vmi195435.contaboserver.net.8333 > tom-Latitude-3570.39110: tcp 0
06:04:19.972232 IP vmi195435.contaboserver.net.8333 > tom-Latitude-3570.39110: tcp 24
06:04:19.972252 IP vmi195435.contaboserver.net.8333 > tom-Latitude-3570.39110: tcp 438
06:04:19.972317 IP tom-Latitude-3570.39110 > vmi195435.contaboserver.net.8333: tcp 0
06:04:20.017677 IP static-87-75-105-186.vodafonexdsl.co.uk.8333 > tom-Latitude-3570.46284: tcp 24
06:04:20.018276 IP static-87-75-105-186.vodafonexdsl.co.uk.8333 > tom-Latitude-3570.46284: tcp 37
06:04:20.018340 IP tom-Latitude-3570.46284 > static-87-75-105-186.vodafonexdsl.co.uk.8333: tcp 0
06:04:20.018526 IP tom-Latitude-3570.46284 > static-87-75-105-186.vodafonexdsl.co.uk.8333: tcp 24
06:04:20.020018 IP tom-Latitude-3570.46284 > static-87-75-105-186.vodafonexdsl.co.uk.8333: tcp 37
06:04:20.052970 IP static-87-75-105-186.vodafonexdsl.co.uk.8333 > tom-Latitude-3570.46284: tcp 0
06:04:20.119029 IP static-87-75-105-186.vodafonexdsl.co.uk.8333 > tom-Latitude-3570.46284: tcp 24
06:04:20.119656 IP static-87-75-105-186.vodafonexdsl.co.uk.8333 > tom-Latitude-3570.46284: tcp 247
06:04:20.119707 IP tom-Latitude-3570.46284 > static-87-75-105-186.vodafonexdsl.co.uk.8333: tcp 0
06:04:20.320780 IP tom-Latitude-3570.42516 > 2.56.9.15.8333: tcp 24
06:04:20.322843 IP tom-Latitude-3570.42516 > 2.56.9.15.8333: tcp 73
06:04:20.354968 IP 2.56.9.15.8333 > tom-Latitude-3570.42516: tcp 0
06:04:20.362943 IP 2.56.9.15.8333 > tom-Latitude-3570.42516: tcp 0
06:04:20.456235 IP 2.56.9.15.8333 > tom-Latitude-3570.42516: tcp 24
06:04:20.456858 IP 2.56.9.15.8333 > tom-Latitude-3570.42516: tcp 37
06:04:20.456922 IP tom-Latitude-3570.42516 > 2.56.9.15.8333: tcp 0
06:04:20.457096 IP tom-Latitude-3570.56714 > ns3113832.ip-54-38-177.eu.8333: tcp 24
06:04:20.457150 IP tom-Latitude-3570.42516 > 2.56.9.15.8333: tcp 24
06:04:20.458513 IP tom-Latitude-3570.56714 > ns3113832.ip-54-38-177.eu.8333: tcp 217
06:04:20.459302 IP tom-Latitude-3570.42516 > 2.56.9.15.8333: tcp 438
06:04:20.494743 IP ns3113832.ip-54-38-177.eu.8333 > tom-Latitude-3570.56714: tcp 0
06:04:20.494757 IP 2.56.9.15.8333 > tom-Latitude-3570.42516: tcp 0
06:04:20.494760 IP 2.56.9.15.8333 > tom-Latitude-3570.42516: tcp 0
06:04:20.494762 IP ns3113832.ip-54-38-177.eu.8333 > tom-Latitude-3570.56714: tcp 0
06:04:20.553018 IP ns3113832.ip-54-38-177.eu.8333 > tom-Latitude-3570.56714: tcp 24
06:04:20.553590 IP ns3113832.ip-54-38-177.eu.8333 > tom-Latitude-3570.56714: tcp 37
06:04:20.553652 IP tom-Latitude-3570.56714 > ns3113832.ip-54-38-177.eu.8333: tcp 0
06:04:20.553791 IP tom-Latitude-3570.56714 > ns3113832.ip-54-38-177.eu.8333: tcp 24
06:04:20.555188 IP tom-Latitude-3570.56714 > ns3113832.ip-54-38-177.eu.8333: tcp 438
06:04:20.582969 IP ns3113832.ip-54-38-177.eu.8333 > tom-Latitude-3570.56714: tcp 0
06:04:20.590967 IP ns3113832.ip-54-38-177.eu.8333 > tom-Latitude-3570.56714: tcp 0
06:04:20.654274 IP tom-Latitude-3570.60988 > 81.198.101.144.8333: tcp 24
06:04:20.655215 IP tom-Latitude-3570.60988 > 81.198.101.144.8333: tcp 181
06:04:20.710896 IP 81.198.101.144.8333 > tom-Latitude-3570.60988: tcp 0
06:04:20.710910 IP 81.198.101.144.8333 > tom-Latitude-3570.60988: tcp 0
06:04:20.855102 IP tom-Latitude-3570.60470 > bb42-60-217-183.singnet.com.sg.8333: tcp 24
06:04:20.857331 IP tom-Latitude-3570.60470 > bb42-60-217-183.singnet.com.sg.8333: tcp 289
06:04:20.904062 IP bb42-60-217-183.singnet.com.sg.8333 > tom-Latitude-3570.60470: tcp 0
06:04:21.494260 IP c-185-45-236-223.customer.ggaweb.ch.8333 > tom-Latitude-3570.49070: tcp 24
06:04:21.494281 IP c-185-45-236-223.customer.ggaweb.ch.8333 > tom-Latitude-3570.49070: tcp 433
06:04:21.494287 IP c-185-45-236-223.customer.ggaweb.ch.8333 > tom-Latitude-3570.49070: tcp 433
06:04:21.494298 IP tom-Latitude-3570.49070 > c-185-45-236-223.customer.ggaweb.ch.8333: tcp 0
06:04:21.494313 IP 2.56.9.15.8333 > tom-Latitude-3570.42516: tcp 24
06:04:21.494318 IP 2.56.9.15.8333 > tom-Latitude-3570.42516: tcp 217
06:04:21.494373 IP tom-Latitude-3570.42516 > 2.56.9.15.8333: tcp 0
06:04:21.494596 IP tom-Latitude-3570.49070 > c-185-45-236-223.customer.ggaweb.ch.8333: tcp 24
06:04:21.496352 IP tom-Latitude-3570.49070 > c-185-45-236-223.customer.ggaweb.ch.8333: tcp 217
06:04:21.536300 IP c-185-45-236-223.customer.ggaweb.ch.8333 > tom-Latitude-3570.49070: tcp 0
06:04:21.536314 IP c-185-45-236-223.customer.ggaweb.ch.8333 > tom-Latitude-3570.49070: tcp 0
06:04:21.594961 IP tom-Latitude-3570.57976 > 167.99.216.145.8333: tcp 24
06:04:21.596148 IP tom-Latitude-3570.57976 > 167.99.216.145.8333: tcp 109
06:04:21.615771 IP c-185-45-236-223.customer.ggaweb.ch.8333 > tom-Latitude-3570.49070: tcp 24
06:04:21.615791 IP c-185-45-236-223.customer.ggaweb.ch.8333 > tom-Latitude-3570.49070: tcp 807
06:04:21.615798 IP c-185-45-236-223.customer.ggaweb.ch.8333 > tom-Latitude-3570.49070: tcp 552
06:04:21.615836 IP tom-Latitude-3570.49070 > c-185-45-236-223.customer.ggaweb.ch.8333: tcp 0
06:04:21.615918 IP c-185-45-236-223.customer.ggaweb.ch.8333 > tom-Latitude-3570.49070: tcp 468
06:04:21.615925 IP c-185-45-236-223.customer.ggaweb.ch.8333 > tom-Latitude-3570.49070: tcp 224
06:04:21.615947 IP tom-Latitude-3570.49070 > c-185-45-236-223.customer.ggaweb.ch.8333: tcp 0
06:04:21.627934 IP 167.99.216.145.8333 > tom-Latitude-3570.57976: tcp 0
06:04:21.903981 IP bb42-60-217-183.singnet.com.sg.8333 > tom-Latitude-3570.60470: tcp 24
06:04:21.904003 IP bb42-60-217-183.singnet.com.sg.8333 > tom-Latitude-3570.60470: tcp 253
06:04:21.904046 IP tom-Latitude-3570.60470 > bb42-60-217-183.singnet.com.sg.8333: tcp 0
06:04:21.904287 IP tom-Latitude-3570.60470 > bb42-60-217-183.singnet.com.sg.8333: tcp 24
06:04:21.905513 IP tom-Latitude-3570.60470 > bb42-60-217-183.singnet.com.sg.8333: tcp 37
06:04:21.942712 IP bb42-60-217-183.singnet.com.sg.8333 > tom-Latitude-3570.60470: tcp 0
06:04:22.305513 IP tom-Latitude-3570.56714 > ns3113832.ip-54-38-177.eu.8333: tcp 24
06:04:22.305663 IP tom-Latitude-3570.46284 > static-87-75-105-186.vodafonexdsl.co.uk.8333: tcp 24
06:04:22.307793 IP tom-Latitude-3570.56714 > ns3113832.ip-54-38-177.eu.8333: tcp 217
06:04:22.308385 IP static-87-75-105-186.vodafonexdsl.co.uk.8333 > tom-Latitude-3570.46284: tcp 24
06:04:22.308412 IP tom-Latitude-3570.46284 > static-87-75-105-186.vodafonexdsl.co.uk.8333: tcp 253
06:04:22.308431 IP static-87-75-105-186.vodafonexdsl.co.uk.8333 > tom-Latitude-3570.46284: tcp 289
06:04:22.308441 IP static-87-75-105-186.vodafonexdsl.co.uk.8333 > tom-Latitude-3570.46284: tcp 289
06:04:22.308446 IP tom-Latitude-3570.46284 > static-87-75-105-186.vodafonexdsl.co.uk.8333: tcp 0
06:04:22.319766 IP bb42-60-217-183.singnet.com.sg.8333 > tom-Latitude-3570.60470: tcp 24
06:04:22.320393 IP bb42-60-217-183.singnet.com.sg.8333 > tom-Latitude-3570.60470: tcp 247
06:04:22.320407 IP tom-Latitude-3570.60470 > bb42-60-217-183.singnet.com.sg.8333: tcp 0
06:04:22.332932 IP ns3113832.ip-54-38-177.eu.8333 > tom-Latitude-3570.56714: tcp 0
06:04:22.340312 IP ns3113832.ip-54-38-177.eu.8333 > tom-Latitude-3570.56714: tcp 0
06:04:22.340326 IP static-87-75-105-186.vodafonexdsl.co.uk.8333 > tom-Latitude-3570.46284: tcp 0
06:04:22.621770 IP tom-Latitude-3570.60988 > 81.198.101.144.8333: tcp 24
06:04:22.624019 IP tom-Latitude-3570.60988 > 81.198.101.144.8333: tcp 253
06:04:22.656117 IP 81.198.101.144.8333 > tom-Latitude-3570.60988: tcp 0
06:04:22.661231 IP 81.198.101.144.8333 > tom-Latitude-3570.60988: tcp 0
06:04:22.722230 IP tom-Latitude-3570.49070 > c-185-45-236-223.customer.ggaweb.ch.8333: tcp 24
06:04:22.723168 IP tom-Latitude-3570.49070 > c-185-45-236-223.customer.ggaweb.ch.8333: tcp 37
06:04:22.753256 IP c-185-45-236-223.customer.ggaweb.ch.8333 > tom-Latitude-3570.49070: tcp 0
06:04:22.762392 IP c-185-45-236-223.customer.ggaweb.ch.8333 > tom-Latitude-3570.49070: tcp 0
06:04:23.123429 IP tom-Latitude-3570.56714 > ns3113832.ip-54-38-177.eu.8333: tcp 24
06:04:23.125499 IP tom-Latitude-3570.56714 > ns3113832.ip-54-38-177.eu.8333: tcp 37
06:04:23.126101 IP 167.99.216.145.8333 > tom-Latitude-3570.57976: tcp 24
06:04:23.126126 IP tom-Latitude-3570.57976 > 167.99.216.145.8333: tcp 0
06:04:23.126143 IP 167.99.216.145.8333 > tom-Latitude-3570.57976: tcp 289
06:04:23.126148 IP tom-Latitude-3570.57976 > 167.99.216.145.8333: tcp 0
06:04:23.126152 IP 167.99.216.145.8333 > tom-Latitude-3570.57976: tcp 289
06:04:23.126154 IP tom-Latitude-3570.57976 > 167.99.216.145.8333: tcp 0
06:04:23.126411 IP tom-Latitude-3570.57976 > 167.99.216.145.8333: tcp 24
06:04:23.133695 IP tom-Latitude-3570.57976 > 167.99.216.145.8333: tcp 37
06:04:23.162370 IP ns3113832.ip-54-38-177.eu.8333 > tom-Latitude-3570.56714: tcp 0
06:04:23.162384 IP ns3113832.ip-54-38-177.eu.8333 > tom-Latitude-3570.56714: tcp 0
06:04:23.162387 IP 167.99.216.145.8333 > tom-Latitude-3570.57976: tcp 0
06:04:23.224629 IP 167.99.216.145.8333 > tom-Latitude-3570.57976: tcp 24
06:04:23.267909 IP tom-Latitude-3570.57976 > 167.99.216.145.8333: tcp 0
06:04:23.327136 IP tom-Latitude-3570.42516 > 2.56.9.15.8333: tcp 24
06:04:23.328078 IP tom-Latitude-3570.42516 > 2.56.9.15.8333: tcp 37
06:04:23.358965 IP static-87-75-105-186.vodafonexdsl.co.uk.8333 > tom-Latitude-3570.46284: tcp 24
06:04:23.358992 IP tom-Latitude-3570.46284 > static-87-75-105-186.vodafonexdsl.co.uk.8333: tcp 0
06:04:23.359008 IP static-87-75-105-186.vodafonexdsl.co.uk.8333 > tom-Latitude-3570.46284: tcp 73
06:04:23.359011 IP tom-Latitude-3570.46284 > static-87-75-105-186.vodafonexdsl.co.uk.8333: tcp 0
06:04:23.359216 IP tom-Latitude-3570.46284 > static-87-75-105-186.vodafonexdsl.co.uk.8333: tcp 24
06:04:23.362192 IP tom-Latitude-3570.46284 > static-87-75-105-186.vodafonexdsl.co.uk.8333: tcp 37
06:04:23.362759 IP 2.56.9.15.8333 > tom-Latitude-3570.42516: tcp 0
06:04:23.370343 IP 2.56.9.15.8333 > tom-Latitude-3570.42516: tcp 0
06:04:23.394364 IP static-87-75-105-186.vodafonexdsl.co.uk.8333 > tom-Latitude-3570.46284: tcp 0
06:04:23.458533 IP static-87-75-105-186.vodafonexdsl.co.uk.8333 > tom-Latitude-3570.46284: tcp 24
06:04:23.459139 IP static-87-75-105-186.vodafonexdsl.co.uk.8333 > tom-Latitude-3570.46284: tcp 223
06:04:23.459203 IP tom-Latitude-3570.46284 > static-87-75-105-186.vodafonexdsl.co.uk.8333: tcp 0
06:04:23.747452 IP c-185-45-236-223.customer.ggaweb.ch.8333 > tom-Latitude-3570.49070: tcp 24
06:04:23.747471 IP c-185-45-236-223.customer.ggaweb.ch.8333 > tom-Latitude-3570.49070: tcp 73
06:04:23.747515 IP tom-Latitude-3570.49070 > c-185-45-236-223.customer.ggaweb.ch.8333: tcp 0
06:04:23.747780 IP tom-Latitude-3570.57976 > 167.99.216.145.8333: tcp 24
06:04:23.748986 IP tom-Latitude-3570.57976 > 167.99.216.145.8333: tcp 37
06:04:23.751338 IP 167.99.216.145.8333 > tom-Latitude-3570.57976: tcp 347
06:04:23.751365 IP tom-Latitude-3570.57976 > 167.99.216.145.8333: tcp 0
06:04:23.784550 IP 167.99.216.145.8333 > tom-Latitude-3570.57976: tcp 0
06:04:23.797728 IP 81.198.101.144.8333 > tom-Latitude-3570.60988: tcp 24
06:04:23.798404 IP 81.198.101.144.8333 > tom-Latitude-3570.60988: tcp 145
06:04:23.798466 IP tom-Latitude-3570.60988 > 81.198.101.144.8333: tcp 0
06:04:23.798671 IP tom-Latitude-3570.60988 > 81.198.101.144.8333: tcp 24
06:04:23.800012 IP tom-Latitude-3570.60988 > 81.198.101.144.8333: tcp 73
06:04:23.830726 IP 81.198.101.144.8333 > tom-Latitude-3570.60988: tcp 0
06:04:23.831293 IP 81.198.101.144.8333 > tom-Latitude-3570.60988: tcp 0
06:04:23.847863 IP 167.99.216.145.8333 > tom-Latitude-3570.57976: tcp 24
06:04:23.847888 IP tom-Latitude-3570.57976 > 167.99.216.145.8333: tcp 0
06:04:23.848534 IP 167.99.216.145.8333 > tom-Latitude-3570.57976: tcp 37
06:04:23.848551 IP tom-Latitude-3570.57976 > 167.99.216.145.8333: tcp 0
06:04:23.918749 IP 81.198.101.144.8333 > tom-Latitude-3570.60988: tcp 24
06:04:23.919463 IP 81.198.101.144.8333 > tom-Latitude-3570.60988: tcp 192
06:04:23.919486 IP 81.198.101.144.8333 > tom-Latitude-3570.60988: tcp 24
06:04:23.919490 IP 81.198.101.144.8333 > tom-Latitude-3570.60988: tcp 226
06:04:23.919568 IP tom-Latitude-3570.60988 > 81.198.101.144.8333: tcp 0
06:04:24.020701 IP tom-Latitude-3570.57976 > 167.99.216.145.8333: tcp 24
06:04:24.021923 IP tom-Latitude-3570.57976 > 167.99.216.145.8333: tcp 37
06:04:24.060695 IP 167.99.216.145.8333 > tom-Latitude-3570.57976: tcp 0
06:04:24.120989 IP tom-Latitude-3570.39110 > vmi195435.contaboserver.net.8333: tcp 24
06:04:24.121972 IP tom-Latitude-3570.39110 > vmi195435.contaboserver.net.8333: tcp 433
06:04:24.154127 IP vmi195435.contaboserver.net.8333 > tom-Latitude-3570.39110: tcp 0
06:04:24.169506 IP vmi195435.contaboserver.net.8333 > tom-Latitude-3570.39110: tcp 0
06:04:24.206319 IP c-185-45-236-223.customer.ggaweb.ch.8333 > tom-Latitude-3570.49070: tcp 24
06:04:24.212540 IP c-185-45-236-223.customer.ggaweb.ch.8333 > tom-Latitude-3570.49070: tcp 73
06:04:24.212600 IP tom-Latitude-3570.49070 > c-185-45-236-223.customer.ggaweb.ch.8333: tcp 0
06:04:24.513872 IP tom-Latitude-3570.60470 > bb42-60-217-183.singnet.com.sg.8333: tcp 24
06:04:24.513918 IP tom-Latitude-3570.46284 > static-87-75-105-186.vodafonexdsl.co.uk.8333: tcp 24
06:04:24.555829 IP tom-Latitude-3570.60470 > bb42-60-217-183.singnet.com.sg.8333: tcp 145
06:04:24.556771 IP tom-Latitude-3570.46284 > static-87-75-105-186.vodafonexdsl.co.uk.8333: tcp 73
06:04:24.592690 IP bb42-60-217-183.singnet.com.sg.8333 > tom-Latitude-3570.60470: tcp 0
06:04:24.593343 IP static-87-75-105-186.vodafonexdsl.co.uk.8333 > tom-Latitude-3570.46284: tcp 0
06:04:24.814956 IP tom-Latitude-3570.42516 > 2.56.9.15.8333: tcp 24
06:04:24.822585 IP tom-Latitude-3570.42516 > 2.56.9.15.8333: tcp 145
06:04:24.856392 IP 2.56.9.15.8333 > tom-Latitude-3570.42516: tcp 0
06:04:24.861587 IP 2.56.9.15.8333 > tom-Latitude-3570.42516: tcp 0
06:04:25.517325 IP tom-Latitude-3570.56714 > ns3113832.ip-54-38-177.eu.8333: tcp 24
06:04:25.519387 IP tom-Latitude-3570.56714 > ns3113832.ip-54-38-177.eu.8333: tcp 145
06:04:25.544789 IP ns3113832.ip-54-38-177.eu.8333 > tom-Latitude-3570.56714: tcp 0
06:04:25.551709 IP ns3113832.ip-54-38-177.eu.8333 > tom-Latitude-3570.56714: tcp 0
06:04:26.409510 IP bb42-60-217-183.singnet.com.sg.8333 > tom-Latitude-3570.60470: tcp 24
06:04:26.409530 IP bb42-60-217-183.singnet.com.sg.8333 > tom-Latitude-3570.60470: tcp 73
06:04:26.409534 IP vmi195435.contaboserver.net.8333 > tom-Latitude-3570.39110: tcp 24
06:04:26.409539 IP vmi195435.contaboserver.net.8333 > tom-Latitude-3570.39110: tcp 145
06:04:26.409544 IP vmi195435.contaboserver.net.8333 > tom-Latitude-3570.39110: tcp 145
06:04:26.409555 IP tom-Latitude-3570.39110 > vmi195435.contaboserver.net.8333: tcp 0
06:04:26.409569 IP bb42-60-217-183.singnet.com.sg.8333 > tom-Latitude-3570.60470: tcp 73
06:04:26.409570 IP tom-Latitude-3570.60470 > bb42-60-217-183.singnet.com.sg.8333: tcp 0
06:04:26.409573 IP c-185-45-236-223.customer.ggaweb.ch.8333 > tom-Latitude-3570.49070: tcp 24
06:04:26.409577 IP tom-Latitude-3570.60470 > bb42-60-217-183.singnet.com.sg.8333: tcp 0
06:04:26.409577 IP c-185-45-236-223.customer.ggaweb.ch.8333 > tom-Latitude-3570.49070: tcp 109
06:04:26.409634 IP tom-Latitude-3570.49070 > c-185-45-236-223.customer.ggaweb.ch.8333: tcp 0
06:04:26.409790 IP tom-Latitude-3570.39110 > vmi195435.contaboserver.net.8333: tcp 24
06:04:26.409871 IP tom-Latitude-3570.56714 > ns3113832.ip-54-38-177.eu.8333: tcp 24
06:04:26.413288 IP tom-Latitude-3570.39110 > vmi195435.contaboserver.net.8333: tcp 145
06:04:26.413889 IP tom-Latitude-3570.56714 > ns3113832.ip-54-38-177.eu.8333: tcp 61
06:04:26.429955 IP c-185-45-236-223.customer.ggaweb.ch.8333 > tom-Latitude-3570.49070: tcp 109
06:04:26.429961 IP tom-Latitude-3570.49070 > c-185-45-236-223.customer.ggaweb.ch.8333: tcp 0
06:04:26.453079 IP vmi195435.contaboserver.net.8333 > tom-Latitude-3570.39110: tcp 0
06:04:26.453654 IP ns3113832.ip-54-38-177.eu.8333 > tom-Latitude-3570.56714: tcp 0
06:04:26.453682 IP ns3113832.ip-54-38-177.eu.8333 > tom-Latitude-3570.56714: tcp 0
06:04:26.453684 IP vmi195435.contaboserver.net.8333 > tom-Latitude-3570.39110: tcp 0
06:04:26.532266 IP vmi195435.contaboserver.net.8333 > tom-Latitude-3570.39110: tcp 24
06:04:26.533270 IP vmi195435.contaboserver.net.8333 > tom-Latitude-3570.39110: tcp 226
06:04:26.533293 IP vmi195435.contaboserver.net.8333 > tom-Latitude-3570.39110: tcp 24
06:04:26.533298 IP vmi195435.contaboserver.net.8333 > tom-Latitude-3570.39110: tcp 1062
06:04:26.533301 IP vmi195435.contaboserver.net.8333 > tom-Latitude-3570.39110: tcp 24
06:04:26.533303 IP vmi195435.contaboserver.net.8333 > tom-Latitude-3570.39110: tcp 226
06:04:26.533306 IP vmi195435.contaboserver.net.8333 > tom-Latitude-3570.39110: tcp 24
06:04:26.533326 IP vmi195435.contaboserver.net.8333 > tom-Latitude-3570.39110: tcp 225
06:04:26.533368 IP tom-Latitude-3570.39110 > vmi195435.contaboserver.net.8333: tcp 0
06:04:26.736301 IP tom-Latitude-3570.57976 > 167.99.216.145.8333: tcp 24
06:04:26.736382 IP tom-Latitude-3570.46284 > static-87-75-105-186.vodafonexdsl.co.uk.8333: tcp 24
06:04:26.738443 IP tom-Latitude-3570.57976 > 167.99.216.145.8333: tcp 145
06:04:26.739735 IP tom-Latitude-3570.46284 > static-87-75-105-186.vodafonexdsl.co.uk.8333: tcp 145
06:04:26.771424 IP 167.99.216.145.8333 > tom-Latitude-3570.57976: tcp 0
06:04:26.772313 IP static-87-75-105-186.vodafonexdsl.co.uk.8333 > tom-Latitude-3570.46284: tcp 0
06:04:27.433509 IP ns3113832.ip-54-38-177.eu.8333 > tom-Latitude-3570.56714: tcp 24
06:04:27.433531 IP ns3113832.ip-54-38-177.eu.8333 > tom-Latitude-3570.56714: tcp 181
06:04:27.433537 IP ns3113832.ip-54-38-177.eu.8333 > tom-Latitude-3570.56714: tcp 181
06:04:27.433547 IP tom-Latitude-3570.56714 > ns3113832.ip-54-38-177.eu.8333: tcp 0
06:04:27.433780 IP tom-Latitude-3570.56714 > ns3113832.ip-54-38-177.eu.8333: tcp 24
06:04:27.435123 IP tom-Latitude-3570.56714 > ns3113832.ip-54-38-177.eu.8333: tcp 37
06:04:27.466980 IP ns3113832.ip-54-38-177.eu.8333 > tom-Latitude-3570.56714: tcp 0
06:04:27.467918 IP ns3113832.ip-54-38-177.eu.8333 > tom-Latitude-3570.56714: tcp 0
06:04:27.524685 IP ns3113832.ip-54-38-177.eu.8333 > tom-Latitude-3570.56714: tcp 24
06:04:27.526009 IP ns3113832.ip-54-38-177.eu.8333 > tom-Latitude-3570.56714: tcp 1350
06:04:27.526029 IP ns3113832.ip-54-38-177.eu.8333 > tom-Latitude-3570.56714: tcp 1350
06:04:27.526035 IP ns3113832.ip-54-38-177.eu.8333 > tom-Latitude-3570.56714: tcp 1350
06:04:27.526039 IP ns3113832.ip-54-38-177.eu.8333 > tom-Latitude-3570.56714: tcp 1179
06:04:27.526111 IP tom-Latitude-3570.56714 > ns3113832.ip-54-38-177.eu.8333: tcp 0
06:04:27.843346 IP ns3113832.ip-54-38-177.eu.8333 > tom-Latitude-3570.56714: tcp 24
06:04:27.843366 IP ns3113832.ip-54-38-177.eu.8333 > tom-Latitude-3570.56714: tcp 73
06:04:27.843411 IP tom-Latitude-3570.56714 > ns3113832.ip-54-38-177.eu.8333: tcp 0
06:04:27.843609 IP tom-Latitude-3570.56714 > ns3113832.ip-54-38-177.eu.8333: tcp 24
06:04:27.844865 IP tom-Latitude-3570.56714 > ns3113832.ip-54-38-177.eu.8333: tcp 73
06:04:27.882466 IP ns3113832.ip-54-38-177.eu.8333 > tom-Latitude-3570.56714: tcp 0
06:04:27.883162 IP ns3113832.ip-54-38-177.eu.8333 > tom-Latitude-3570.56714: tcp 0
06:04:27.939012 IP ns3113832.ip-54-38-177.eu.8333 > tom-Latitude-3570.56714: tcp 24
06:04:27.939708 IP ns3113832.ip-54-38-177.eu.8333 > tom-Latitude-3570.56714: tcp 189
06:04:27.939732 IP ns3113832.ip-54-38-177.eu.8333 > tom-Latitude-3570.56714: tcp 24
06:04:27.939742 IP ns3113832.ip-54-38-177.eu.8333 > tom-Latitude-3570.56714: tcp 224
06:04:27.939803 IP tom-Latitude-3570.56714 > ns3113832.ip-54-38-177.eu.8333: tcp 0
06:04:27.939972 IP tom-Latitude-3570.49070 > c-185-45-236-223.customer.ggaweb.ch.8333: tcp 24
06:04:27.944989 IP tom-Latitude-3570.49070 > c-185-45-236-223.customer.ggaweb.ch.8333: tcp 73
06:04:27.972130 IP c-185-45-236-223.customer.ggaweb.ch.8333 > tom-Latitude-3570.49070: tcp 0
06:04:27.972144 IP c-185-45-236-223.customer.ggaweb.ch.8333 > tom-Latitude-3570.49070: tcp 0
06:04:28.041175 IP tom-Latitude-3570.60988 > 81.198.101.144.8333: tcp 24
06:04:28.042111 IP tom-Latitude-3570.60988 > 81.198.101.144.8333: tcp 253
06:04:28.074326 IP 81.198.101.144.8333 > tom-Latitude-3570.60988: tcp 0
06:04:28.081275 IP 81.198.101.144.8333 > tom-Latitude-3570.60988: tcp 0
06:04:28.241476 IP tom-Latitude-3570.57976 > 167.99.216.145.8333: tcp 24
06:04:28.243572 IP tom-Latitude-3570.57976 > 167.99.216.145.8333: tcp 109
06:04:28.282297 IP 167.99.216.145.8333 > tom-Latitude-3570.57976: tcp 0
06:04:28.441862 IP tom-Latitude-3570.42516 > 2.56.9.15.8333: tcp 24
06:04:28.442628 IP tom-Latitude-3570.42516 > 2.56.9.15.8333: tcp 253
06:04:28.473957 IP 2.56.9.15.8333 > tom-Latitude-3570.42516: tcp 0
06:04:28.481900 IP 2.56.9.15.8333 > tom-Latitude-3570.42516: tcp 0
06:04:28.542022 IP tom-Latitude-3570.60470 > bb42-60-217-183.singnet.com.sg.8333: tcp 24
06:04:28.542845 IP tom-Latitude-3570.60470 > bb42-60-217-183.singnet.com.sg.8333: tcp 181
06:04:28.583924 IP bb42-60-217-183.singnet.com.sg.8333 > tom-Latitude-3570.60470: tcp 0
06:04:28.642159 IP tom-Latitude-3570.39110 > vmi195435.contaboserver.net.8333: tcp 24
06:04:28.642970 IP tom-Latitude-3570.39110 > vmi195435.contaboserver.net.8333: tcp 109
06:04:28.674575 IP vmi195435.contaboserver.net.8333 > tom-Latitude-3570.39110: tcp 0
06:04:28.682305 IP vmi195435.contaboserver.net.8333 > tom-Latitude-3570.39110: tcp 0
06:04:28.842664 IP tom-Latitude-3570.49070 > c-185-45-236-223.customer.ggaweb.ch.8333: tcp 24
06:04:28.844960 IP tom-Latitude-3570.49070 > c-185-45-236-223.customer.ggaweb.ch.8333: tcp 73
06:04:28.872916 IP c-185-45-236-223.customer.ggaweb.ch.8333 > tom-Latitude-3570.49070: tcp 0
06:04:28.880922 IP c-185-45-236-223.customer.ggaweb.ch.8333 > tom-Latitude-3570.49070: tcp 0
06:04:29.244084 IP tom-Latitude-3570.46284 > static-87-75-105-186.vodafonexdsl.co.uk.8333: tcp 24
06:04:29.246209 IP tom-Latitude-3570.46284 > static-87-75-105-186.vodafonexdsl.co.uk.8333: tcp 109
06:04:29.301856 IP static-87-75-105-186.vodafonexdsl.co.uk.8333 > tom-Latitude-3570.46284: tcp 0
06:04:30.505809 IP vmi195435.contaboserver.net.8333 > tom-Latitude-3570.39110: tcp 24
06:04:30.505831 IP vmi195435.contaboserver.net.8333 > tom-Latitude-3570.39110: tcp 253
06:04:30.505836 IP vmi195435.contaboserver.net.8333 > tom-Latitude-3570.39110: tcp 253
06:04:30.505847 IP tom-Latitude-3570.39110 > vmi195435.contaboserver.net.8333: tcp 0
06:04:30.505863 IP 2.56.9.15.8333 > tom-Latitude-3570.42516: tcp 24
06:04:30.505867 IP 2.56.9.15.8333 > tom-Latitude-3570.42516: tcp 217
06:04:30.505870 IP 2.56.9.15.8333 > tom-Latitude-3570.42516: tcp 217
06:04:30.505873 IP tom-Latitude-3570.42516 > 2.56.9.15.8333: tcp 0
06:04:30.506159 IP tom-Latitude-3570.39110 > vmi195435.contaboserver.net.8333: tcp 24
06:04:30.506254 IP tom-Latitude-3570.42516 > 2.56.9.15.8333: tcp 24
06:04:30.507950 IP tom-Latitude-3570.39110 > vmi195435.contaboserver.net.8333: tcp 253
06:04:30.508632 IP tom-Latitude-3570.42516 > 2.56.9.15.8333: tcp 37
06:04:30.542744 IP vmi195435.contaboserver.net.8333 > tom-Latitude-3570.39110: tcp 0
06:04:30.543335 IP 2.56.9.15.8333 > tom-Latitude-3570.42516: tcp 0
06:04:30.543359 IP 2.56.9.15.8333 > tom-Latitude-3570.42516: tcp 0
06:04:30.543361 IP vmi195435.contaboserver.net.8333 > tom-Latitude-3570.39110: tcp 0
06:04:30.622335 IP vmi195435.contaboserver.net.8333 > tom-Latitude-3570.39110: tcp 24
06:04:30.623357 IP vmi195435.contaboserver.net.8333 > tom-Latitude-3570.39110: tcp 364
06:04:30.623376 IP vmi195435.contaboserver.net.8333 > tom-Latitude-3570.39110: tcp 24
06:04:30.623380 IP vmi195435.contaboserver.net.8333 > tom-Latitude-3570.39110: tcp 476
06:04:30.623383 IP vmi195435.contaboserver.net.8333 > tom-Latitude-3570.39110: tcp 24
06:04:30.623386 IP vmi195435.contaboserver.net.8333 > tom-Latitude-3570.39110: tcp 519
06:04:30.623389 IP vmi195435.contaboserver.net.8333 > tom-Latitude-3570.39110: tcp 24
06:04:30.623393 IP vmi195435.contaboserver.net.8333 > tom-Latitude-3570.39110: tcp 1028
06:04:30.623395 IP vmi195435.contaboserver.net.8333 > tom-Latitude-3570.39110: tcp 24
06:04:30.623397 IP vmi195435.contaboserver.net.8333 > tom-Latitude-3570.39110: tcp 226
06:04:30.623420 IP tom-Latitude-3570.39110 > vmi195435.contaboserver.net.8333: tcp 0
06:04:30.636905 IP 2.56.9.15.8333 > tom-Latitude-3570.42516: tcp 24
06:04:30.640729 IP 2.56.9.15.8333 > tom-Latitude-3570.42516: tcp 1368
06:04:30.640793 IP tom-Latitude-3570.42516 > 2.56.9.15.8333: tcp 0
06:04:30.641505 IP 2.56.9.15.8333 > tom-Latitude-3570.42516: tcp 612
06:04:30.683905 IP tom-Latitude-3570.42516 > 2.56.9.15.8333: tcp 0
06:04:30.698951 IP vmi195435.contaboserver.net.8333 > tom-Latitude-3570.39110: tcp 488
06:04:30.739902 IP tom-Latitude-3570.39110 > vmi195435.contaboserver.net.8333: tcp 0
06:04:31.000615 IP tom-Latitude-3570.57976 > 167.99.216.145.8333: tcp 24
06:04:31.002866 IP tom-Latitude-3570.57976 > 167.99.216.145.8333: tcp 289
06:04:31.003443 IP ns3113832.ip-54-38-177.eu.8333 > tom-Latitude-3570.56714: tcp 24
06:04:31.003465 IP ns3113832.ip-54-38-177.eu.8333 > tom-Latitude-3570.56714: tcp 217
06:04:31.003475 IP ns3113832.ip-54-38-177.eu.8333 > tom-Latitude-3570.56714: tcp 217
