01:34:39.284744 IP tom-Latitude-3570.49070 > c-185-45-236-223.customer.ggaweb.ch.8333: tcp 24
01:34:39.284795 IP tom-Latitude-3570.60470 > bb42-60-217-183.singnet.com.sg.8333: tcp 24
01:34:39.286277 IP tom-Latitude-3570.60470 > bb42-60-217-183.singnet.com.sg.8333: tcp 73
01:34:39.286288 IP tom-Latitude-3570.49070 > c-185-45-236-223.customer.ggaweb.ch.8333: tcp 433
01:34:39.338296 IP c-185-45-236-223.customer.ggaweb.ch.8333 > tom-Latitude-3570.49070: tcp 0
01:34:39.346363 IP bb42-60-217-183.singnet.com.sg.8333 > tom-Latitude-3570.60470: tcp 0
01:34:39.347033 IP bb42-60-217-183.singnet.com.sg.8333 > tom-Latitude-3570.60470: tcp 0
01:34:39.347046 IP c-185-45-236-223.customer.ggaweb.ch.8333 > tom-Latitude-3570.49070: tcp 0
01:34:39.562548 IP bb42-60-217-183.singnet.com.sg.8333 > tom-Latitude-3570.60470: tcp 24
01:34:39.562568 IP bb42-60-217-183.singnet.com.sg.8333 > tom-Latitude-3570.60470: tcp 253
01:34:39.562661 IP tom-Latitude-3570.60470 > bb42-60-217-183.singnet.com.sg.8333: tcp 0
01:34:39.562901 IP tom-Latitude-3570.60470 > bb42-60-217-183.singnet.com.sg.8333: tcp 24
01:34:39.564220 IP tom-Latitude-3570.60470 > bb42-60-217-183.singnet.com.sg.8333: tcp 181
01:34:39.595570 IP bb42-60-217-183.singnet.com.sg.8333 > tom-Latitude-3570.60470: tcp 0
01:34:39.596250 IP bb42-60-217-183.singnet.com.sg.8333 > tom-Latitude-3570.60470: tcp 0
01:34:39.782461 IP 167.99.216.145.8333 > tom-Latitude-3570.57976: tcp 24
01:34:39.783084 IP 167.99.216.145.8333 > tom-Latitude-3570.57976: tcp 145
01:34:39.783215 IP tom-Latitude-3570.57976 > 167.99.216.145.8333: tcp 0
01:34:39.975774 IP bb42-60-217-183.singnet.com.sg.8333 > tom-Latitude-3570.60470: tcp 24
01:34:39.977224 IP bb42-60-217-183.singnet.com.sg.8333 > tom-Latitude-3570.60470: tcp 249
01:34:39.977242 IP bb42-60-217-183.singnet.com.sg.8333 > tom-Latitude-3570.60470: tcp 24
01:34:39.977245 IP bb42-60-217-183.singnet.com.sg.8333 > tom-Latitude-3570.60470: tcp 248
01:34:39.977247 IP bb42-60-217-183.singnet.com.sg.8333 > tom-Latitude-3570.60470: tcp 24
01:34:39.977251 IP bb42-60-217-183.singnet.com.sg.8333 > tom-Latitude-3570.60470: tcp 1460
01:34:39.977274 IP bb42-60-217-183.singnet.com.sg.8333 > tom-Latitude-3570.60470: tcp 1460
01:34:39.977276 IP bb42-60-217-183.singnet.com.sg.8333 > tom-Latitude-3570.60470: tcp 1157
01:34:39.977278 IP bb42-60-217-183.singnet.com.sg.8333 > tom-Latitude-3570.60470: tcp 24
01:34:39.977280 IP bb42-60-217-183.singnet.com.sg.8333 > tom-Latitude-3570.60470: tcp 307
01:34:39.977282 IP bb42-60-217-183.singnet.com.sg.8333 > tom-Latitude-3570.60470: tcp 24
01:34:39.977285 IP bb42-60-217-183.singnet.com.sg.8333 > tom-Latitude-3570.60470: tcp 272
01:34:39.977346 IP tom-Latitude-3570.60470 > bb42-60-217-183.singnet.com.sg.8333: tcp 0
01:34:39.977472 IP tom-Latitude-3570.39110 > vmi195435.contaboserver.net.8333: tcp 24
01:34:39.978751 IP tom-Latitude-3570.39110 > vmi195435.contaboserver.net.8333: tcp 73
01:34:40.006411 IP vmi195435.contaboserver.net.8333 > tom-Latitude-3570.39110: tcp 0
01:34:40.007037 IP vmi195435.contaboserver.net.8333 > tom-Latitude-3570.39110: tcp 0
01:34:40.892493 IP tom-Latitude-3570.57976 > 167.99.216.145.8333: tcp 24
01:34:40.893434 IP tom-Latitude-3570.57976 > 167.99.216.145.8333: tcp 37
01:34:40.936851 IP 167.99.216.145.8333 > tom-Latitude-3570.57976: tcp 0
01:34:40.960648 IP 81.198.101.144.8333 > tom-Latitude-3570.60988: tcp 24
01:34:40.961271 IP 81.198.101.144.8333 > tom-Latitude-3570.60988: tcp 109
01:34:40.961384 IP tom-Latitude-3570.60988 > 81.198.101.144.8333: tcp 0
01:34:41.463158 IP tom-Latitude-3570.56714 > ns3113832.ip-54-38-177.eu.8333: tcp 24
01:34:41.463992 IP tom-Latitude-3570.56714 > ns3113832.ip-54-38-177.eu.8333: tcp 181
01:34:41.508040 IP ns3113832.ip-54-38-177.eu.8333 > tom-Latitude-3570.56714: tcp 0
01:34:41.516089 IP ns3113832.ip-54-38-177.eu.8333 > tom-Latitude-3570.56714: tcp 0
01:34:41.764044 IP tom-Latitude-3570.60988 > 81.198.101.144.8333: tcp 24
01:34:41.764988 IP tom-Latitude-3570.60988 > 81.198.101.144.8333: tcp 73
01:34:41.796128 IP 81.198.101.144.8333 > tom-Latitude-3570.60988: tcp 24
01:34:41.797587 IP 81.198.101.144.8333 > tom-Latitude-3570.60988: tcp 181
01:34:41.797608 IP tom-Latitude-3570.60988 > 81.198.101.144.8333: tcp 0
01:34:41.797763 IP tom-Latitude-3570.60988 > 81.198.101.144.8333: tcp 24
01:34:41.797771 IP tom-Latitude-3570.60988 > 81.198.101.144.8333: tcp 109
01:34:41.799542 IP 81.198.101.144.8333 > tom-Latitude-3570.60988: tcp 0
01:34:41.806201 IP 81.198.101.144.8333 > tom-Latitude-3570.60988: tcp 0
01:34:41.903904 IP tom-Latitude-3570.60988 > 81.198.101.144.8333: tcp 109
01:34:41.913063 IP 81.198.101.144.8333 > tom-Latitude-3570.60988: tcp 0
01:34:41.913078 IP 81.198.101.144.8333 > tom-Latitude-3570.60988: tcp 0
01:34:41.913080 IP vmi195435.contaboserver.net.8333 > tom-Latitude-3570.39110: tcp 24
01:34:41.913097 IP tom-Latitude-3570.39110 > vmi195435.contaboserver.net.8333: tcp 0
01:34:41.913127 IP vmi195435.contaboserver.net.8333 > tom-Latitude-3570.39110: tcp 91
01:34:41.913129 IP tom-Latitude-3570.39110 > vmi195435.contaboserver.net.8333: tcp 0
01:34:41.922466 IP 81.198.101.144.8333 > tom-Latitude-3570.60988: tcp 24
01:34:41.923217 IP 81.198.101.144.8333 > tom-Latitude-3570.60988: tcp 249
01:34:41.923235 IP 81.198.101.144.8333 > tom-Latitude-3570.60988: tcp 24
01:34:41.923239 IP 81.198.101.144.8333 > tom-Latitude-3570.60988: tcp 730
01:34:41.923241 IP 81.198.101.144.8333 > tom-Latitude-3570.60988: tcp 24
01:34:41.923329 IP tom-Latitude-3570.60988 > 81.198.101.144.8333: tcp 0
01:34:41.925411 IP 81.198.101.144.8333 > tom-Latitude-3570.60988: tcp 1241
01:34:41.945921 IP 81.198.101.144.8333 > tom-Latitude-3570.60988: tcp 0
01:34:41.967901 IP tom-Latitude-3570.60988 > 81.198.101.144.8333: tcp 0
01:34:42.039757 IP 2.56.9.15.8333 > tom-Latitude-3570.42516: tcp 24
01:34:42.039781 IP tom-Latitude-3570.42516 > 2.56.9.15.8333: tcp 0
01:34:42.040511 IP 2.56.9.15.8333 > tom-Latitude-3570.42516: tcp 541
01:34:42.040536 IP tom-Latitude-3570.42516 > 2.56.9.15.8333: tcp 0
01:34:42.040885 IP tom-Latitude-3570.42516 > 2.56.9.15.8333: tcp 24
01:34:42.041747 IP tom-Latitude-3570.42516 > 2.56.9.15.8333: tcp 253
01:34:42.078410 IP 2.56.9.15.8333 > tom-Latitude-3570.42516: tcp 0
01:34:42.078425 IP 2.56.9.15.8333 > tom-Latitude-3570.42516: tcp 0
01:34:42.170811 IP 2.56.9.15.8333 > tom-Latitude-3570.42516: tcp 24
01:34:42.171623 IP 2.56.9.15.8333 > tom-Latitude-3570.42516: tcp 192
01:34:42.171632 IP 2.56.9.15.8333 > tom-Latitude-3570.42516: tcp 24
01:34:42.171635 IP 2.56.9.15.8333 > tom-Latitude-3570.42516: tcp 221
01:34:42.171636 IP 2.56.9.15.8333 > tom-Latitude-3570.42516: tcp 24
01:34:42.171638 IP 2.56.9.15.8333 > tom-Latitude-3570.42516: tcp 247
01:34:42.171641 IP 2.56.9.15.8333 > tom-Latitude-3570.42516: tcp 24
01:34:42.171717 IP tom-Latitude-3570.42516 > 2.56.9.15.8333: tcp 0
01:34:42.174283 IP 2.56.9.15.8333 > tom-Latitude-3570.42516: tcp 249
01:34:42.174900 IP 2.56.9.15.8333 > tom-Latitude-3570.42516: tcp 24
01:34:42.174913 IP 2.56.9.15.8333 > tom-Latitude-3570.42516: tcp 226
01:34:42.174990 IP tom-Latitude-3570.42516 > 2.56.9.15.8333: tcp 0
01:34:42.279829 IP 2.56.9.15.8333 > tom-Latitude-3570.42516: tcp 564
01:34:42.323910 IP tom-Latitude-3570.42516 > 2.56.9.15.8333: tcp 0
01:34:42.348046 IP static-87-75-105-186.vodafonexdsl.co.uk.8333 > tom-Latitude-3570.46284: tcp 24
01:34:42.356541 IP static-87-75-105-186.vodafonexdsl.co.uk.8333 > tom-Latitude-3570.46284: tcp 31
01:34:42.356673 IP tom-Latitude-3570.46284 > static-87-75-105-186.vodafonexdsl.co.uk.8333: tcp 0
01:34:42.557415 IP tom-Latitude-3570.46284 > static-87-75-105-186.vodafonexdsl.co.uk.8333: tcp 24
01:34:42.558349 IP tom-Latitude-3570.46284 > static-87-75-105-186.vodafonexdsl.co.uk.8333: tcp 541
01:34:42.578594 IP static-87-75-105-186.vodafonexdsl.co.uk.8333 > tom-Latitude-3570.46284: tcp 0
01:34:42.594413 IP static-87-75-105-186.vodafonexdsl.co.uk.8333 > tom-Latitude-3570.46284: tcp 0
01:34:43.360028 IP tom-Latitude-3570.57976 > 167.99.216.145.8333: tcp 24
01:34:43.360904 IP tom-Latitude-3570.57976 > 167.99.216.145.8333: tcp 151
01:34:43.396366 IP 167.99.216.145.8333 > tom-Latitude-3570.57976: tcp 0
01:34:43.660821 IP tom-Latitude-3570.60470 > bb42-60-217-183.singnet.com.sg.8333: tcp 24
01:34:43.661803 IP tom-Latitude-3570.60470 > bb42-60-217-183.singnet.com.sg.8333: tcp 361
01:34:43.709187 IP bb42-60-217-183.singnet.com.sg.8333 > tom-Latitude-3570.60470: tcp 0
01:34:43.718945 IP bb42-60-217-183.singnet.com.sg.8333 > tom-Latitude-3570.60470: tcp 0
01:34:43.961798 IP tom-Latitude-3570.56714 > ns3113832.ip-54-38-177.eu.8333: tcp 24
01:34:43.991148 IP tom-Latitude-3570.56714 > ns3113832.ip-54-38-177.eu.8333: tcp 536
01:34:44.099905 IP tom-Latitude-3570.56714 > ns3113832.ip-54-38-177.eu.8333: tcp 536
01:34:44.115334 IP ns3113832.ip-54-38-177.eu.8333 > tom-Latitude-3570.56714: tcp 0
01:34:44.115351 IP ns3113832.ip-54-38-177.eu.8333 > tom-Latitude-3570.56714: tcp 0
01:34:44.115354 IP 81.198.101.144.8333 > tom-Latitude-3570.60988: tcp 24
01:34:44.115383 IP tom-Latitude-3570.60988 > 81.198.101.144.8333: tcp 0
01:34:44.115412 IP 81.198.101.144.8333 > tom-Latitude-3570.60988: tcp 397
01:34:44.115417 IP tom-Latitude-3570.60988 > 81.198.101.144.8333: tcp 0
01:34:44.115640 IP tom-Latitude-3570.60988 > 81.198.101.144.8333: tcp 24
01:34:44.117637 IP tom-Latitude-3570.60988 > 81.198.101.144.8333: tcp 145
01:34:44.158106 IP ns3113832.ip-54-38-177.eu.8333 > tom-Latitude-3570.56714: tcp 0
01:34:44.162977 IP 81.198.101.144.8333 > tom-Latitude-3570.60988: tcp 0
01:34:44.163597 IP 81.198.101.144.8333 > tom-Latitude-3570.60988: tcp 0
01:34:44.216172 IP tom-Latitude-3570.49070 > c-185-45-236-223.customer.ggaweb.ch.8333: tcp 24
01:34:44.217161 IP tom-Latitude-3570.49070 > c-185-45-236-223.customer.ggaweb.ch.8333: tcp 541
01:34:44.248587 IP c-185-45-236-223.customer.ggaweb.ch.8333 > tom-Latitude-3570.49070: tcp 0
01:34:44.251399 IP 81.198.101.144.8333 > tom-Latitude-3570.60988: tcp 24
01:34:44.254045 IP 81.198.101.144.8333 > tom-Latitude-3570.60988: tcp 225
01:34:44.254067 IP 81.198.101.144.8333 > tom-Latitude-3570.60988: tcp 24
01:34:44.254072 IP 81.198.101.144.8333 > tom-Latitude-3570.60988: tcp 249
01:34:44.254077 IP 81.198.101.144.8333 > tom-Latitude-3570.60988: tcp 24
01:34:44.254094 IP 81.198.101.144.8333 > tom-Latitude-3570.60988: tcp 249
01:34:44.254100 IP 81.198.101.144.8333 > tom-Latitude-3570.60988: tcp 24
01:34:44.254103 IP 81.198.101.144.8333 > tom-Latitude-3570.60988: tcp 291
01:34:44.254148 IP tom-Latitude-3570.60988 > 81.198.101.144.8333: tcp 0
01:34:44.255478 IP c-185-45-236-223.customer.ggaweb.ch.8333 > tom-Latitude-3570.49070: tcp 0
01:34:44.455733 IP tom-Latitude-3570.46284 > static-87-75-105-186.vodafonexdsl.co.uk.8333: tcp 24
01:34:44.457970 IP tom-Latitude-3570.46284 > static-87-75-105-186.vodafonexdsl.co.uk.8333: tcp 145
01:34:44.460715 IP 81.198.101.144.8333 > tom-Latitude-3570.60988: tcp 24
01:34:44.460735 IP 81.198.101.144.8333 > tom-Latitude-3570.60988: tcp 181
01:34:44.460801 IP tom-Latitude-3570.60988 > 81.198.101.144.8333: tcp 0
01:34:44.460995 IP tom-Latitude-3570.60988 > 81.198.101.144.8333: tcp 24
01:34:44.462252 IP tom-Latitude-3570.60988 > 81.198.101.144.8333: tcp 181
01:34:44.495924 IP static-87-75-105-186.vodafonexdsl.co.uk.8333 > tom-Latitude-3570.46284: tcp 0
01:34:44.496592 IP static-87-75-105-186.vodafonexdsl.co.uk.8333 > tom-Latitude-3570.46284: tcp 0
01:34:44.501022 IP 81.198.101.144.8333 > tom-Latitude-3570.60988: tcp 0
01:34:44.501036 IP 81.198.101.144.8333 > tom-Latitude-3570.60988: tcp 0
01:34:44.587075 IP 81.198.101.144.8333 > tom-Latitude-3570.60988: tcp 24
01:34:44.587820 IP 81.198.101.144.8333 > tom-Latitude-3570.60988: tcp 223
01:34:44.587833 IP 81.198.101.144.8333 > tom-Latitude-3570.60988: tcp 24
01:34:44.587836 IP 81.198.101.144.8333 > tom-Latitude-3570.60988: tcp 224
01:34:44.587839 IP 81.198.101.144.8333 > tom-Latitude-3570.60988: tcp 24
01:34:44.587841 IP 81.198.101.144.8333 > tom-Latitude-3570.60988: tcp 223
01:34:44.587844 IP 81.198.101.144.8333 > tom-Latitude-3570.60988: tcp 24
01:34:44.587846 IP 81.198.101.144.8333 > tom-Latitude-3570.60988: tcp 189
01:34:44.587848 IP 81.198.101.144.8333 > tom-Latitude-3570.60988: tcp 24
01:34:44.587851 IP 81.198.101.144.8333 > tom-Latitude-3570.60988: tcp 223
01:34:44.587873 IP tom-Latitude-3570.60988 > 81.198.101.144.8333: tcp 0
01:34:44.689541 IP tom-Latitude-3570.56714 > ns3113832.ip-54-38-177.eu.8333: tcp 24
01:34:44.690506 IP tom-Latitude-3570.56714 > ns3113832.ip-54-38-177.eu.8333: tcp 325
01:34:44.717962 IP ns3113832.ip-54-38-177.eu.8333 > tom-Latitude-3570.56714: tcp 0
01:34:44.735555 IP ns3113832.ip-54-38-177.eu.8333 > tom-Latitude-3570.56714: tcp 0
01:34:44.990370 IP tom-Latitude-3570.42516 > 2.56.9.15.8333: tcp 24
01:34:44.991313 IP tom-Latitude-3570.42516 > 2.56.9.15.8333: tcp 325
01:34:45.028237 IP 2.56.9.15.8333 > tom-Latitude-3570.42516: tcp 0
01:34:45.045160 IP 2.56.9.15.8333 > tom-Latitude-3570.42516: tcp 0
01:34:45.282593 IP 167.99.216.145.8333 > tom-Latitude-3570.57976: tcp 24
01:34:45.290598 IP 167.99.216.145.8333 > tom-Latitude-3570.57976: tcp 793
01:34:45.290661 IP tom-Latitude-3570.57976 > 167.99.216.145.8333: tcp 0
01:34:45.290944 IP tom-Latitude-3570.39110 > vmi195435.contaboserver.net.8333: tcp 24
01:34:45.291152 IP tom-Latitude-3570.57976 > 167.99.216.145.8333: tcp 24
01:34:45.292139 IP tom-Latitude-3570.57976 > 167.99.216.145.8333: tcp 109
01:34:45.292145 IP tom-Latitude-3570.39110 > vmi195435.contaboserver.net.8333: tcp 865
01:34:45.326447 IP vmi195435.contaboserver.net.8333 > tom-Latitude-3570.39110: tcp 0
01:34:45.327135 IP 167.99.216.145.8333 > tom-Latitude-3570.57976: tcp 0
01:34:45.330202 IP vmi195435.contaboserver.net.8333 > tom-Latitude-3570.39110: tcp 0
01:34:45.389586 IP 167.99.216.145.8333 > tom-Latitude-3570.57976: tcp 24
01:34:45.390298 IP 167.99.216.145.8333 > tom-Latitude-3570.57976: tcp 226
01:34:45.390313 IP 167.99.216.145.8333 > tom-Latitude-3570.57976: tcp 24
01:34:45.390316 IP 167.99.216.145.8333 > tom-Latitude-3570.57976: tcp 256
01:34:45.390371 IP tom-Latitude-3570.57976 > 167.99.216.145.8333: tcp 0
01:34:45.390827 IP 167.99.216.145.8333 > tom-Latitude-3570.57976: tcp 24
01:34:45.390841 IP 167.99.216.145.8333 > tom-Latitude-3570.57976: tcp 226
01:34:45.390885 IP tom-Latitude-3570.57976 > 167.99.216.145.8333: tcp 0
01:34:45.995056 IP tom-Latitude-3570.46284 > static-87-75-105-186.vodafonexdsl.co.uk.8333: tcp 24
01:34:45.995936 IP tom-Latitude-3570.46284 > static-87-75-105-186.vodafonexdsl.co.uk.8333: tcp 289
01:34:46.028142 IP static-87-75-105-186.vodafonexdsl.co.uk.8333 > tom-Latitude-3570.46284: tcp 0
01:34:46.036847 IP static-87-75-105-186.vodafonexdsl.co.uk.8333 > tom-Latitude-3570.46284: tcp 0
01:34:46.396274 IP tom-Latitude-3570.56714 > ns3113832.ip-54-38-177.eu.8333: tcp 24
01:34:46.397771 IP tom-Latitude-3570.56714 > ns3113832.ip-54-38-177.eu.8333: tcp 109
01:34:46.447960 IP ns3113832.ip-54-38-177.eu.8333 > tom-Latitude-3570.56714: tcp 0
01:34:46.456002 IP ns3113832.ip-54-38-177.eu.8333 > tom-Latitude-3570.56714: tcp 0
01:34:46.496574 IP tom-Latitude-3570.60988 > 81.198.101.144.8333: tcp 24
01:34:46.497536 IP tom-Latitude-3570.60988 > 81.198.101.144.8333: tcp 109
01:34:46.544386 IP 81.198.101.144.8333 > tom-Latitude-3570.60988: tcp 0
01:34:46.586036 IP 81.198.101.144.8333 > tom-Latitude-3570.60988: tcp 0
01:34:46.797616 IP tom-Latitude-3570.46284 > static-87-75-105-186.vodafonexdsl.co.uk.8333: tcp 24
01:34:46.798556 IP tom-Latitude-3570.46284 > static-87-75-105-186.vodafonexdsl.co.uk.8333: tcp 31
01:34:46.828305 IP static-87-75-105-186.vodafonexdsl.co.uk.8333 > tom-Latitude-3570.46284: tcp 0
01:34:46.836219 IP static-87-75-105-186.vodafonexdsl.co.uk.8333 > tom-Latitude-3570.46284: tcp 0
01:34:46.839495 IP 2.56.9.15.8333 > tom-Latitude-3570.42516: tcp 24
01:34:46.839521 IP tom-Latitude-3570.42516 > 2.56.9.15.8333: tcp 0
01:34:46.840147 IP 2.56.9.15.8333 > tom-Latitude-3570.42516: tcp 325
01:34:46.840173 IP tom-Latitude-3570.42516 > 2.56.9.15.8333: tcp 0
01:34:46.840443 IP tom-Latitude-3570.42516 > 2.56.9.15.8333: tcp 24
01:34:46.841261 IP tom-Latitude-3570.42516 > 2.56.9.15.8333: tcp 217
01:34:46.876277 IP 2.56.9.15.8333 > tom-Latitude-3570.42516: tcp 0
01:34:46.876829 IP 2.56.9.15.8333 > tom-Latitude-3570.42516: tcp 0
01:34:46.950369 IP 81.198.101.144.8333 > tom-Latitude-3570.60988: tcp 24
01:34:46.950998 IP 81.198.101.144.8333 > tom-Latitude-3570.60988: tcp 145
01:34:46.951062 IP tom-Latitude-3570.60988 > 81.198.101.144.8333: tcp 0
01:34:46.971278 IP 2.56.9.15.8333 > tom-Latitude-3570.42516: tcp 24
01:34:46.972047 IP 2.56.9.15.8333 > tom-Latitude-3570.42516: tcp 225
01:34:46.972065 IP 2.56.9.15.8333 > tom-Latitude-3570.42516: tcp 24
01:34:46.972068 IP 2.56.9.15.8333 > tom-Latitude-3570.42516: tcp 225
01:34:46.972114 IP tom-Latitude-3570.42516 > 2.56.9.15.8333: tcp 0
01:34:46.974664 IP 2.56.9.15.8333 > tom-Latitude-3570.42516: tcp 24
01:34:46.975572 IP 2.56.9.15.8333 > tom-Latitude-3570.42516: tcp 249
01:34:46.975589 IP 2.56.9.15.8333 > tom-Latitude-3570.42516: tcp 24
01:34:46.975592 IP 2.56.9.15.8333 > tom-Latitude-3570.42516: tcp 371
01:34:46.975596 IP 2.56.9.15.8333 > tom-Latitude-3570.42516: tcp 24
01:34:46.975598 IP 2.56.9.15.8333 > tom-Latitude-3570.42516: tcp 1368
01:34:46.975666 IP tom-Latitude-3570.42516 > 2.56.9.15.8333: tcp 0
01:34:47.066106 IP 2.56.9.15.8333 > tom-Latitude-3570.42516: tcp 1368
01:34:47.069485 IP 2.56.9.15.8333 > tom-Latitude-3570.42516: tcp 1368
01:34:47.069510 IP tom-Latitude-3570.42516 > 2.56.9.15.8333: tcp 0
01:34:47.070681 IP 2.56.9.15.8333 > tom-Latitude-3570.42516: tcp 1368
01:34:47.070688 IP 2.56.9.15.8333 > tom-Latitude-3570.42516: tcp 1368
01:34:47.070697 IP 2.56.9.15.8333 > tom-Latitude-3570.42516: tcp 1368
01:34:47.070700 IP 2.56.9.15.8333 > tom-Latitude-3570.42516: tcp 1368
01:34:47.070704 IP tom-Latitude-3570.42516 > 2.56.9.15.8333: tcp 0
01:34:47.083160 IP 2.56.9.15.8333 > tom-Latitude-3570.42516: tcp 1368
01:34:47.083179 IP 2.56.9.15.8333 > tom-Latitude-3570.42516: tcp 1368
01:34:47.083183 IP 2.56.9.15.8333 > tom-Latitude-3570.42516: tcp 1368
01:34:47.083187 IP 2.56.9.15.8333 > tom-Latitude-3570.42516: tcp 1368
01:34:47.083189 IP 2.56.9.15.8333 > tom-Latitude-3570.42516: tcp 1368
01:34:47.083194 IP 2.56.9.15.8333 > tom-Latitude-3570.42516: tcp 1255
01:34:47.083229 IP tom-Latitude-3570.42516 > 2.56.9.15.8333: tcp 0
01:34:47.083426 IP tom-Latitude-3570.56714 > ns3113832.ip-54-38-177.eu.8333: tcp 24
01:34:47.084712 IP tom-Latitude-3570.56714 > ns3113832.ip-54-38-177.eu.8333: tcp 145
01:34:47.115888 IP ns3113832.ip-54-38-177.eu.8333 > tom-Latitude-3570.56714: tcp 0
01:34:47.115903 IP ns3113832.ip-54-38-177.eu.8333 > tom-Latitude-3570.56714: tcp 0
01:34:47.307123 IP tom-Latitude-3570.57976 > 167.99.216.145.8333: tcp 24
01:34:47.308107 IP tom-Latitude-3570.57976 > 167.99.216.145.8333: tcp 217
01:34:47.414953 IP 167.99.216.145.8333 > tom-Latitude-3570.57976: tcp 0
01:34:47.924061 IP c-185-45-236-223.customer.ggaweb.ch.8333 > tom-Latitude-3570.49070: tcp 24
01:34:47.924085 IP tom-Latitude-3570.49070 > c-185-45-236-223.customer.ggaweb.ch.8333: tcp 0
01:34:47.926266 IP c-185-45-236-223.customer.ggaweb.ch.8333 > tom-Latitude-3570.49070: tcp 757
01:34:47.926291 IP tom-Latitude-3570.49070 > c-185-45-236-223.customer.ggaweb.ch.8333: tcp 0
01:34:47.926309 IP c-185-45-236-223.customer.ggaweb.ch.8333 > tom-Latitude-3570.49070: tcp 757
01:34:47.926313 IP tom-Latitude-3570.49070 > c-185-45-236-223.customer.ggaweb.ch.8333: tcp 0
01:34:47.926646 IP tom-Latitude-3570.49070 > c-185-45-236-223.customer.ggaweb.ch.8333: tcp 24
01:34:47.927836 IP tom-Latitude-3570.49070 > c-185-45-236-223.customer.ggaweb.ch.8333: tcp 73
01:34:47.964338 IP c-185-45-236-223.customer.ggaweb.ch.8333 > tom-Latitude-3570.49070: tcp 0
01:34:47.967579 IP c-185-45-236-223.customer.ggaweb.ch.8333 > tom-Latitude-3570.49070: tcp 0
01:34:48.026438 IP 2.56.9.15.8333 > tom-Latitude-3570.42516: tcp 24
01:34:48.026457 IP 2.56.9.15.8333 > tom-Latitude-3570.42516: tcp 37
01:34:48.026503 IP tom-Latitude-3570.42516 > 2.56.9.15.8333: tcp 0
01:34:48.028784 IP static-87-75-105-186.vodafonexdsl.co.uk.8333 > tom-Latitude-3570.46284: tcp 24
01:34:48.042094 IP static-87-75-105-186.vodafonexdsl.co.uk.8333 > tom-Latitude-3570.46284: tcp 253
01:34:48.042112 IP c-185-45-236-223.customer.ggaweb.ch.8333 > tom-Latitude-3570.49070: tcp 24
01:34:48.042164 IP tom-Latitude-3570.46284 > static-87-75-105-186.vodafonexdsl.co.uk.8333: tcp 0
01:34:48.043752 IP c-185-45-236-223.customer.ggaweb.ch.8333 > tom-Latitude-3570.49070: tcp 223
01:34:48.043802 IP tom-Latitude-3570.49070 > c-185-45-236-223.customer.ggaweb.ch.8333: tcp 0
01:34:48.045248 IP c-185-45-236-223.customer.ggaweb.ch.8333 > tom-Latitude-3570.49070: tcp 476
01:34:48.087783 IP tom-Latitude-3570.49070 > c-185-45-236-223.customer.ggaweb.ch.8333: tcp 0
01:34:48.146116 IP tom-Latitude-3570.60470 > bb42-60-217-183.singnet.com.sg.8333: tcp 24
01:34:48.146146 IP tom-Latitude-3570.42516 > 2.56.9.15.8333: tcp 24
01:34:48.146903 IP tom-Latitude-3570.42516 > 2.56.9.15.8333: tcp 37
01:34:48.146909 IP tom-Latitude-3570.60470 > bb42-60-217-183.singnet.com.sg.8333: tcp 721
01:34:48.177833 IP 2.56.9.15.8333 > tom-Latitude-3570.42516: tcp 0
01:34:48.185872 IP bb42-60-217-183.singnet.com.sg.8333 > tom-Latitude-3570.60470: tcp 0
01:34:48.186486 IP 2.56.9.15.8333 > tom-Latitude-3570.42516: tcp 0
01:34:48.188972 IP bb42-60-217-183.singnet.com.sg.8333 > tom-Latitude-3570.60470: tcp 0
01:34:48.281832 IP 2.56.9.15.8333 > tom-Latitude-3570.42516: tcp 24
01:34:48.282379 IP 2.56.9.15.8333 > tom-Latitude-3570.42516: tcp 37
01:34:48.282444 IP tom-Latitude-3570.42516 > 2.56.9.15.8333: tcp 0
01:34:48.282600 IP tom-Latitude-3570.57976 > 167.99.216.145.8333: tcp 24
01:34:48.282634 IP tom-Latitude-3570.42516 > 2.56.9.15.8333: tcp 24
01:34:48.284022 IP tom-Latitude-3570.42516 > 2.56.9.15.8333: tcp 223
01:34:48.284032 IP tom-Latitude-3570.57976 > 167.99.216.145.8333: tcp 73
01:34:48.315572 IP 2.56.9.15.8333 > tom-Latitude-3570.42516: tcp 0
01:34:48.317071 IP 2.56.9.15.8333 > tom-Latitude-3570.42516: tcp 0
01:34:48.317084 IP 167.99.216.145.8333 > tom-Latitude-3570.57976: tcp 0
01:34:48.483530 IP tom-Latitude-3570.60988 > 81.198.101.144.8333: tcp 24
01:34:48.517715 IP tom-Latitude-3570.60988 > 81.198.101.144.8333: tcp 145
01:34:48.547672 IP 81.198.101.144.8333 > tom-Latitude-3570.60988: tcp 0
01:34:48.557104 IP 81.198.101.144.8333 > tom-Latitude-3570.60988: tcp 0
01:34:48.684333 IP tom-Latitude-3570.56714 > ns3113832.ip-54-38-177.eu.8333: tcp 24
01:34:48.685280 IP tom-Latitude-3570.56714 > ns3113832.ip-54-38-177.eu.8333: tcp 145
01:34:48.724229 IP ns3113832.ip-54-38-177.eu.8333 > tom-Latitude-3570.56714: tcp 0
01:34:48.724244 IP static-87-75-105-186.vodafonexdsl.co.uk.8333 > tom-Latitude-3570.46284: tcp 24
01:34:48.724254 IP static-87-75-105-186.vodafonexdsl.co.uk.8333 > tom-Latitude-3570.46284: tcp 37
01:34:48.724301 IP tom-Latitude-3570.46284 > static-87-75-105-186.vodafonexdsl.co.uk.8333: tcp 0
01:34:48.725798 IP ns3113832.ip-54-38-177.eu.8333 > tom-Latitude-3570.56714: tcp 0
01:34:50.171054 IP 2.56.9.15.8333 > tom-Latitude-3570.42516: tcp 24
01:34:50.172062 IP 2.56.9.15.8333 > tom-Latitude-3570.42516: tcp 181
01:34:50.172080 IP 2.56.9.15.8333 > tom-Latitude-3570.42516: tcp 181
01:34:50.172092 IP tom-Latitude-3570.42516 > 2.56.9.15.8333: tcp 0
01:34:50.172107 IP bb42-60-217-183.singnet.com.sg.8333 > tom-Latitude-3570.60470: tcp 24
01:34:50.172110 IP bb42-60-217-183.singnet.com.sg.8333 > tom-Latitude-3570.60470: tcp 181
01:34:50.172114 IP bb42-60-217-183.singnet.com.sg.8333 > tom-Latitude-3570.60470: tcp 181
01:34:50.172116 IP tom-Latitude-3570.60470 > bb42-60-217-183.singnet.com.sg.8333: tcp 0
01:34:50.172361 IP tom-Latitude-3570.60470 > bb42-60-217-183.singnet.com.sg.8333: tcp 24
01:34:50.173518 IP tom-Latitude-3570.60470 > bb42-60-217-183.singnet.com.sg.8333: tcp 181
01:34:50.206859 IP bb42-60-217-183.singnet.com.sg.8333 > tom-Latitude-3570.60470: tcp 0
01:34:50.207533 IP bb42-60-217-183.singnet.com.sg.8333 > tom-Latitude-3570.60470: tcp 0
01:34:50.473370 IP tom-Latitude-3570.39110 > vmi195435.contaboserver.net.8333: tcp 24
01:34:50.474308 IP tom-Latitude-3570.39110 > vmi195435.contaboserver.net.8333: tcp 397
01:34:50.509387 IP vmi195435.contaboserver.net.8333 > tom-Latitude-3570.39110: tcp 0
01:34:50.516341 IP vmi195435.contaboserver.net.8333 > tom-Latitude-3570.39110: tcp 0
01:34:50.563687 IP 2.56.9.15.8333 > tom-Latitude-3570.42516: tcp 24
01:34:50.563704 IP tom-Latitude-3570.42516 > 2.56.9.15.8333: tcp 0
01:34:50.564293 IP 2.56.9.15.8333 > tom-Latitude-3570.42516: tcp 37
01:34:50.564310 IP tom-Latitude-3570.42516 > 2.56.9.15.8333: tcp 0
01:34:50.564568 IP tom-Latitude-3570.42516 > 2.56.9.15.8333: tcp 24
01:34:50.565505 IP tom-Latitude-3570.42516 > 2.56.9.15.8333: tcp 37
01:34:50.586303 IP bb42-60-217-183.singnet.com.sg.8333 > tom-Latitude-3570.60470: tcp 24
01:34:50.586324 IP bb42-60-217-183.singnet.com.sg.8333 > tom-Latitude-3570.60470: tcp 221
01:34:50.586329 IP bb42-60-217-183.singnet.com.sg.8333 > tom-Latitude-3570.60470: tcp 24
01:34:50.586332 IP bb42-60-217-183.singnet.com.sg.8333 > tom-Latitude-3570.60470: tcp 248
01:34:50.586334 IP bb42-60-217-183.singnet.com.sg.8333 > tom-Latitude-3570.60470: tcp 24
01:34:50.586336 IP bb42-60-217-183.singnet.com.sg.8333 > tom-Latitude-3570.60470: tcp 249
01:34:50.586338 IP bb42-60-217-183.singnet.com.sg.8333 > tom-Latitude-3570.60470: tcp 24
01:34:50.586371 IP tom-Latitude-3570.60470 > bb42-60-217-183.singnet.com.sg.8333: tcp 0
01:34:50.587775 IP bb42-60-217-183.singnet.com.sg.8333 > tom-Latitude-3570.60470: tcp 247
01:34:50.587796 IP bb42-60-217-183.singnet.com.sg.8333 > tom-Latitude-3570.60470: tcp 24
01:34:50.587846 IP tom-Latitude-3570.60470 > bb42-60-217-183.singnet.com.sg.8333: tcp 0
01:34:50.590936 IP bb42-60-217-183.singnet.com.sg.8333 > tom-Latitude-3570.60470: tcp 463
01:34:50.599786 IP 2.56.9.15.8333 > tom-Latitude-3570.42516: tcp 0
01:34:50.604549 IP 2.56.9.15.8333 > tom-Latitude-3570.42516: tcp 0
01:34:50.631903 IP tom-Latitude-3570.60470 > bb42-60-217-183.singnet.com.sg.8333: tcp 0
01:34:50.710627 IP 2.56.9.15.8333 > tom-Latitude-3570.42516: tcp 24
01:34:50.710647 IP 2.56.9.15.8333 > tom-Latitude-3570.42516: tcp 371
01:34:50.710695 IP tom-Latitude-3570.42516 > 2.56.9.15.8333: tcp 0
01:34:50.783432 IP 167.99.216.145.8333 > tom-Latitude-3570.57976: tcp 24
01:34:50.783453 IP 167.99.216.145.8333 > tom-Latitude-3570.57976: tcp 217
01:34:50.783498 IP tom-Latitude-3570.57976 > 167.99.216.145.8333: tcp 0
01:34:50.818320 IP 2.56.9.15.8333 > tom-Latitude-3570.42516: tcp 371
01:34:50.818340 IP tom-Latitude-3570.42516 > 2.56.9.15.8333: tcp 0
01:34:50.824022 IP 167.99.216.145.8333 > tom-Latitude-3570.57976: tcp 217
01:34:50.824040 IP tom-Latitude-3570.57976 > 167.99.216.145.8333: tcp 0
01:34:51.024558 IP static-87-75-105-186.vodafonexdsl.co.uk.8333 > tom-Latitude-3570.46284: tcp 24
01:34:51.025252 IP static-87-75-105-186.vodafonexdsl.co.uk.8333 > tom-Latitude-3570.46284: tcp 217
01:34:51.025317 IP tom-Latitude-3570.46284 > static-87-75-105-186.vodafonexdsl.co.uk.8333: tcp 0
01:34:51.225991 IP tom-Latitude-3570.49070 > c-185-45-236-223.customer.ggaweb.ch.8333: tcp 24
01:34:51.226933 IP tom-Latitude-3570.49070 > c-185-45-236-223.customer.ggaweb.ch.8333: tcp 217
01:34:51.243618 IP vmi195435.contaboserver.net.8333 > tom-Latitude-3570.39110: tcp 24
01:34:51.243644 IP tom-Latitude-3570.39110 > vmi195435.contaboserver.net.8333: tcp 0
01:34:51.244283 IP vmi195435.contaboserver.net.8333 > tom-Latitude-3570.39110: tcp 217
01:34:51.244309 IP tom-Latitude-3570.39110 > vmi195435.contaboserver.net.8333: tcp 0
01:34:51.258152 IP c-185-45-236-223.customer.ggaweb.ch.8333 > tom-Latitude-3570.49070: tcp 0
01:34:51.266352 IP c-185-45-236-223.customer.ggaweb.ch.8333 > tom-Latitude-3570.49070: tcp 0
01:34:51.416609 IP 81.198.101.144.8333 > tom-Latitude-3570.60988: tcp 24
01:34:51.416630 IP 81.198.101.144.8333 > tom-Latitude-3570.60988: tcp 217
01:34:51.416676 IP tom-Latitude-3570.60988 > 81.198.101.144.8333: tcp 0
01:34:51.416862 IP tom-Latitude-3570.60470 > bb42-60-217-183.singnet.com.sg.8333: tcp 24
01:34:51.419464 IP tom-Latitude-3570.60470 > bb42-60-217-183.singnet.com.sg.8333: tcp 37
01:34:51.446349 IP bb42-60-217-183.singnet.com.sg.8333 > tom-Latitude-3570.60470: tcp 0
01:34:51.447027 IP bb42-60-217-183.singnet.com.sg.8333 > tom-Latitude-3570.60470: tcp 0
01:34:52.821058 IP tom-Latitude-3570.46284 > static-87-75-105-186.vodafonexdsl.co.uk.8333: tcp 24
01:34:52.822016 IP tom-Latitude-3570.46284 > static-87-75-105-186.vodafonexdsl.co.uk.8333: tcp 8
01:34:52.856906 IP static-87-75-105-186.vodafonexdsl.co.uk.8333 > tom-Latitude-3570.46284: tcp 0
01:34:52.865022 IP static-87-75-105-186.vodafonexdsl.co.uk.8333 > tom-Latitude-3570.46284: tcp 0
01:34:52.887886 IP bb42-60-217-183.singnet.com.sg.8333 > tom-Latitude-3570.60470: tcp 24
01:34:52.887908 IP tom-Latitude-3570.60470 > bb42-60-217-183.singnet.com.sg.8333: tcp 0
01:34:52.887942 IP bb42-60-217-183.singnet.com.sg.8333 > tom-Latitude-3570.60470: tcp 181
01:34:52.887947 IP tom-Latitude-3570.60470 > bb42-60-217-183.singnet.com.sg.8333: tcp 0
01:34:52.888170 IP tom-Latitude-3570.60470 > bb42-60-217-183.singnet.com.sg.8333: tcp 24
01:34:52.889437 IP tom-Latitude-3570.60470 > bb42-60-217-183.singnet.com.sg.8333: tcp 181
01:34:52.957484 IP bb42-60-217-183.singnet.com.sg.8333 > tom-Latitude-3570.60470: tcp 0
01:34:52.957497 IP bb42-60-217-183.singnet.com.sg.8333 > tom-Latitude-3570.60470: tcp 0
01:34:52.957500 IP static-87-75-105-186.vodafonexdsl.co.uk.8333 > tom-Latitude-3570.46284: tcp 24
01:34:52.957509 IP static-87-75-105-186.vodafonexdsl.co.uk.8333 > tom-Latitude-3570.46284: tcp 8
01:34:52.957511 IP static-87-75-105-186.vodafonexdsl.co.uk.8333 > tom-Latitude-3570.46284: tcp 24
01:34:52.957513 IP static-87-75-105-186.vodafonexdsl.co.uk.8333 > tom-Latitude-3570.46284: tcp 181
01:34:52.957604 IP tom-Latitude-3570.46284 > static-87-75-105-186.vodafonexdsl.co.uk.8333: tcp 0
01:34:53.363749 IP bb42-60-217-183.singnet.com.sg.8333 > tom-Latitude-3570.60470: tcp 24
01:34:53.363769 IP bb42-60-217-183.singnet.com.sg.8333 > tom-Latitude-3570.60470: tcp 223
01:34:53.363773 IP bb42-60-217-183.singnet.com.sg.8333 > tom-Latitude-3570.60470: tcp 24
01:34:53.363775 IP bb42-60-217-183.singnet.com.sg.8333 > tom-Latitude-3570.60470: tcp 247
01:34:53.363776 IP bb42-60-217-183.singnet.com.sg.8333 > tom-Latitude-3570.60470: tcp 24
01:34:53.363796 IP bb42-60-217-183.singnet.com.sg.8333 > tom-Latitude-3570.60470: tcp 223
01:34:53.363798 IP bb42-60-217-183.singnet.com.sg.8333 > tom-Latitude-3570.60470: tcp 24
01:34:53.363800 IP bb42-60-217-183.singnet.com.sg.8333 > tom-Latitude-3570.60470: tcp 225
01:34:53.363802 IP bb42-60-217-183.singnet.com.sg.8333 > tom-Latitude-3570.60470: tcp 24
01:34:53.363865 IP tom-Latitude-3570.60470 > bb42-60-217-183.singnet.com.sg.8333: tcp 0
01:34:53.367089 IP bb42-60-217-183.singnet.com.sg.8333 > tom-Latitude-3570.60470: tcp 668
01:34:53.382449 IP c-185-45-236-223.customer.ggaweb.ch.8333 > tom-Latitude-3570.49070: tcp 24
01:34:53.382472 IP tom-Latitude-3570.49070 > c-185-45-236-223.customer.ggaweb.ch.8333: tcp 0
01:34:53.383028 IP c-185-45-236-223.customer.ggaweb.ch.8333 > tom-Latitude-3570.49070: tcp 253
01:34:53.383052 IP tom-Latitude-3570.49070 > c-185-45-236-223.customer.ggaweb.ch.8333: tcp 0
01:34:53.383318 IP tom-Latitude-3570.49070 > c-185-45-236-223.customer.ggaweb.ch.8333: tcp 24
01:34:53.384238 IP tom-Latitude-3570.49070 > c-185-45-236-223.customer.ggaweb.ch.8333: tcp 73
01:34:53.407905 IP tom-Latitude-3570.60470 > bb42-60-217-183.singnet.com.sg.8333: tcp 0
01:34:53.416219 IP c-185-45-236-223.customer.ggaweb.ch.8333 > tom-Latitude-3570.49070: tcp 0
01:34:53.416808 IP c-185-45-236-223.customer.ggaweb.ch.8333 > tom-Latitude-3570.49070: tcp 0
01:34:53.499956 IP c-185-45-236-223.customer.ggaweb.ch.8333 > tom-Latitude-3570.49070: tcp 24
01:34:53.503834 IP c-185-45-236-223.customer.ggaweb.ch.8333 > tom-Latitude-3570.49070: tcp 527
01:34:53.503975 IP tom-Latitude-3570.49070 > c-185-45-236-223.customer.ggaweb.ch.8333: tcp 0
01:34:53.574506 IP 2.56.9.15.8333 > tom-Latitude-3570.42516: tcp 24
01:34:53.574531 IP tom-Latitude-3570.42516 > 2.56.9.15.8333: tcp 0
01:34:53.574563 IP 2.56.9.15.8333 > tom-Latitude-3570.42516: tcp 217
01:34:53.574568 IP tom-Latitude-3570.42516 > 2.56.9.15.8333: tcp 0
01:34:53.574816 IP tom-Latitude-3570.57976 > 167.99.216.145.8333: tcp 24
01:34:53.574852 IP tom-Latitude-3570.60470 > bb42-60-217-183.singnet.com.sg.8333: tcp 24
01:34:53.576177 IP tom-Latitude-3570.60470 > bb42-60-217-183.singnet.com.sg.8333: tcp 73
01:34:53.576188 IP tom-Latitude-3570.57976 > 167.99.216.145.8333: tcp 253
01:34:53.608749 IP bb42-60-217-183.singnet.com.sg.8333 > tom-Latitude-3570.60470: tcp 0
01:34:53.608763 IP bb42-60-217-183.singnet.com.sg.8333 > tom-Latitude-3570.60470: tcp 0
01:34:53.609628 IP 167.99.216.145.8333 > tom-Latitude-3570.57976: tcp 0
01:34:53.675390 IP tom-Latitude-3570.56714 > ns3113832.ip-54-38-177.eu.8333: tcp 24
01:34:53.676375 IP tom-Latitude-3570.56714 > ns3113832.ip-54-38-177.eu.8333: tcp 469
01:34:53.708303 IP ns3113832.ip-54-38-177.eu.8333 > tom-Latitude-3570.56714: tcp 0
01:34:53.716710 IP ns3113832.ip-54-38-177.eu.8333 > tom-Latitude-3570.56714: tcp 0
01:34:53.814749 IP bb42-60-217-183.singnet.com.sg.8333 > tom-Latitude-3570.60470: tcp 24
01:34:53.814766 IP tom-Latitude-3570.60470 > bb42-60-217-183.singnet.com.sg.8333: tcp 0
01:34:53.815339 IP bb42-60-217-183.singnet.com.sg.8333 > tom-Latitude-3570.60470: tcp 73
01:34:53.815356 IP tom-Latitude-3570.60470 > bb42-60-217-183.singnet.com.sg.8333: tcp 0
01:34:54.517710 IP tom-Latitude-3570.42516 > 2.56.9.15.8333: tcp 24
01:34:54.518892 IP tom-Latitude-3570.42516 > 2.56.9.15.8333: tcp 37
01:34:54.575926 IP 2.56.9.15.8333 > tom-Latitude-3570.42516: tcp 0
01:34:54.584381 IP 2.56.9.15.8333 > tom-Latitude-3570.42516: tcp 0
01:34:54.618120 IP tom-Latitude-3570.46284 > static-87-75-105-186.vodafonexdsl.co.uk.8333: tcp 24
01:34:54.619067 IP tom-Latitude-3570.46284 > static-87-75-105-186.vodafonexdsl.co.uk.8333: tcp 73
01:34:54.649504 IP static-87-75-105-186.vodafonexdsl.co.uk.8333 > tom-Latitude-3570.46284: tcp 0
01:34:54.656202 IP static-87-75-105-186.vodafonexdsl.co.uk.8333 > tom-Latitude-3570.46284: tcp 0
01:34:54.718557 IP tom-Latitude-3570.39110 > vmi195435.contaboserver.net.8333: tcp 24
01:34:54.719495 IP tom-Latitude-3570.39110 > vmi195435.contaboserver.net.8333: tcp 253
01:34:54.731892 IP ns3113832.ip-54-38-177.eu.8333 > tom-Latitude-3570.56714: tcp 24
01:34:54.732577 IP ns3113832.ip-54-38-177.eu.8333 > tom-Latitude-3570.56714: tcp 145
01:34:54.732709 IP tom-Latitude-3570.56714 > ns3113832.ip-54-38-177.eu.8333: tcp 0
01:34:54.732933 IP tom-Latitude-3570.56714 > ns3113832.ip-54-38-177.eu.8333: tcp 24
01:34:54.734238 IP tom-Latitude-3570.56714 > ns3113832.ip-54-38-177.eu.8333: tcp 145
01:34:54.745180 IP vmi195435.contaboserver.net.8333 > tom-Latitude-3570.39110: tcp 0
01:34:54.753378 IP vmi195435.contaboserver.net.8333 > tom-Latitude-3570.39110: tcp 0
01:34:54.760165 IP ns3113832.ip-54-38-177.eu.8333 > tom-Latitude-3570.56714: tcp 0
01:34:54.760730 IP ns3113832.ip-54-38-177.eu.8333 > tom-Latitude-3570.56714: tcp 0
01:34:54.827130 IP ns3113832.ip-54-38-177.eu.8333 > tom-Latitude-3570.56714: tcp 24
01:34:54.827959 IP ns3113832.ip-54-38-177.eu.8333 > tom-Latitude-3570.56714: tcp 248
01:34:54.827977 IP ns3113832.ip-54-38-177.eu.8333 > tom-Latitude-3570.56714: tcp 24
01:34:54.827979 IP ns3113832.ip-54-38-177.eu.8333 > tom-Latitude-3570.56714: tcp 223
01:34:54.827982 IP ns3113832.ip-54-38-177.eu.8333 > tom-Latitude-3570.56714: tcp 24
01:34:54.827984 IP ns3113832.ip-54-38-177.eu.8333 > tom-Latitude-3570.56714: tcp 247
01:34:54.827986 IP ns3113832.ip-54-38-177.eu.8333 > tom-Latitude-3570.56714: tcp 24
01:34:54.828006 IP ns3113832.ip-54-38-177.eu.8333 > tom-Latitude-3570.56714: tcp 284
01:34:54.828073 IP tom-Latitude-3570.56714 > ns3113832.ip-54-38-177.eu.8333: tcp 0
01:34:55.029810 IP tom-Latitude-3570.60470 > bb42-60-217-183.singnet.com.sg.8333: tcp 24
01:34:55.030746 IP tom-Latitude-3570.60470 > bb42-60-217-183.singnet.com.sg.8333: tcp 230
01:34:55.058847 IP bb42-60-217-183.singnet.com.sg.8333 > tom-Latitude-3570.60470: tcp 0
01:34:55.068496 IP bb42-60-217-183.singnet.com.sg.8333 > tom-Latitude-3570.60470: tcp 0
01:34:55.932705 IP tom-Latitude-3570.49070 > c-185-45-236-223.customer.ggaweb.ch.8333: tcp 24
01:34:55.933681 IP tom-Latitude-3570.49070 > c-185-45-236-223.customer.ggaweb.ch.8333: tcp 145
01:34:55.968486 IP c-185-45-236-223.customer.ggaweb.ch.8333 > tom-Latitude-3570.49070: tcp 0
01:34:55.984349 IP c-185-45-236-223.customer.ggaweb.ch.8333 > tom-Latitude-3570.49070: tcp 0
01:34:56.033113 IP tom-Latitude-3570.42516 > 2.56.9.15.8333: tcp 24
01:34:56.034051 IP tom-Latitude-3570.42516 > 2.56.9.15.8333: tcp 145
01:34:56.059832 IP 2.56.9.15.8333 > tom-Latitude-3570.42516: tcp 0
01:34:56.068021 IP 2.56.9.15.8333 > tom-Latitude-3570.42516: tcp 0
01:34:56.133521 IP tom-Latitude-3570.57976 > 167.99.216.145.8333: tcp 24
01:34:56.134461 IP tom-Latitude-3570.57976 > 167.99.216.145.8333: tcp 145
01:34:56.178095 IP 167.99.216.145.8333 > tom-Latitude-3570.57976: tcp 0
01:34:56.363586 IP vmi195435.contaboserver.net.8333 > tom-Latitude-3570.39110: tcp 24
01:34:56.363610 IP tom-Latitude-3570.39110 > vmi195435.contaboserver.net.8333: tcp 0
01:34:56.364322 IP vmi195435.contaboserver.net.8333 > tom-Latitude-3570.39110: tcp 685
01:34:56.364346 IP tom-Latitude-3570.39110 > vmi195435.contaboserver.net.8333: tcp 0
01:34:56.364780 IP tom-Latitude-3570.39110 > vmi195435.contaboserver.net.8333: tcp 24
01:34:56.366099 IP tom-Latitude-3570.39110 > vmi195435.contaboserver.net.8333: tcp 541
01:34:56.397437 IP vmi195435.contaboserver.net.8333 > tom-Latitude-3570.39110: tcp 0
01:34:56.398017 IP vmi195435.contaboserver.net.8333 > tom-Latitude-3570.39110: tcp 0
01:34:56.526709 IP 81.198.101.144.8333 > tom-Latitude-3570.60988: tcp 24
01:34:56.526724 IP 81.198.101.144.8333 > tom-Latitude-3570.60988: tcp 613
01:34:56.526840 IP tom-Latitude-3570.60988 > 81.198.101.144.8333: tcp 0
01:34:56.530784 IP vmi195435.contaboserver.net.8333 > tom-Latitude-3570.39110: tcp 24
01:34:56.531799 IP vmi195435.contaboserver.net.8333 > tom-Latitude-3570.39110: tcp 693
01:34:56.531804 IP vmi195435.contaboserver.net.8333 > tom-Latitude-3570.39110: tcp 24
01:34:56.531806 IP vmi195435.contaboserver.net.8333 > tom-Latitude-3570.39110: tcp 189
01:34:56.531808 IP vmi195435.contaboserver.net.8333 > tom-Latitude-3570.39110: tcp 24
01:34:56.531810 IP vmi195435.contaboserver.net.8333 > tom-Latitude-3570.39110: tcp 246
01:34:56.531812 IP vmi195435.contaboserver.net.8333 > tom-Latitude-3570.39110: tcp 24
01:34:56.531813 IP vmi195435.contaboserver.net.8333 > tom-Latitude-3570.39110: tcp 223
01:34:56.531815 IP vmi195435.contaboserver.net.8333 > tom-Latitude-3570.39110: tcp 24
01:34:56.531816 IP vmi195435.contaboserver.net.8333 > tom-Latitude-3570.39110: tcp 291
01:34:56.531816 IP tom-Latitude-3570.39110 > vmi195435.contaboserver.net.8333: tcp 0
01:34:56.531860 IP tom-Latitude-3570.39110 > vmi195435.contaboserver.net.8333: tcp 0
01:34:56.612532 IP vmi195435.contaboserver.net.8333 > tom-Latitude-3570.39110: tcp 1448
01:34:56.612554 IP vmi195435.contaboserver.net.8333 > tom-Latitude-3570.39110: tcp 1448
01:34:56.612556 IP vmi195435.contaboserver.net.8333 > tom-Latitude-3570.39110: tcp 62
01:34:56.612646 IP tom-Latitude-3570.39110 > vmi195435.contaboserver.net.8333: tcp 0
01:34:56.615232 IP tom-Latitude-3570.60988 > 81.198.101.144.8333: tcp 24
01:34:56.615929 IP tom-Latitude-3570.60988 > 81.198.101.144.8333: tcp 145
01:34:56.616228 IP tom-Latitude-3570.39110 > vmi195435.contaboserver.net.8333: tcp 24
01:34:56.617206 IP tom-Latitude-3570.39110 > vmi195435.contaboserver.net.8333: tcp 37
01:34:56.647117 IP 81.198.101.144.8333 > tom-Latitude-3570.60988: tcp 0
01:34:56.647745 IP 81.198.101.144.8333 > tom-Latitude-3570.60988: tcp 0
01:34:56.647749 IP vmi195435.contaboserver.net.8333 > tom-Latitude-3570.39110: tcp 0
