05:33:36.428774 IP 2.56.9.15.8333 > tom-Latitude-3570.42516: tcp 24
05:33:36.428791 IP tom-Latitude-3570.42516 > 2.56.9.15.8333: tcp 0
05:33:36.428810 IP 2.56.9.15.8333 > tom-Latitude-3570.42516: tcp 181
05:33:36.428815 IP tom-Latitude-3570.42516 > 2.56.9.15.8333: tcp 0
05:33:36.429131 IP tom-Latitude-3570.57976 > 167.99.216.145.8333: tcp 24
05:33:36.429259 IP tom-Latitude-3570.42516 > 2.56.9.15.8333: tcp 24
05:33:36.432666 IP static-87-75-105-186.vodafonexdsl.co.uk.8333 > tom-Latitude-3570.46284: tcp 24
05:33:36.432691 IP tom-Latitude-3570.46284 > static-87-75-105-186.vodafonexdsl.co.uk.8333: tcp 0
05:33:36.433351 IP tom-Latitude-3570.57976 > 167.99.216.145.8333: tcp 829
05:33:36.433946 IP tom-Latitude-3570.42516 > 2.56.9.15.8333: tcp 145
05:33:36.451605 IP static-87-75-105-186.vodafonexdsl.co.uk.8333 > tom-Latitude-3570.46284: tcp 325
05:33:36.451631 IP tom-Latitude-3570.46284 > static-87-75-105-186.vodafonexdsl.co.uk.8333: tcp 0
05:33:36.451944 IP tom-Latitude-3570.46284 > static-87-75-105-186.vodafonexdsl.co.uk.8333: tcp 24
05:33:36.452967 IP tom-Latitude-3570.46284 > static-87-75-105-186.vodafonexdsl.co.uk.8333: tcp 37
05:33:36.475667 IP 2.56.9.15.8333 > tom-Latitude-3570.42516: tcp 0
05:33:36.475687 IP 167.99.216.145.8333 > tom-Latitude-3570.57976: tcp 0
05:33:36.480839 IP static-87-75-105-186.vodafonexdsl.co.uk.8333 > tom-Latitude-3570.46284: tcp 0
05:33:36.548964 IP static-87-75-105-186.vodafonexdsl.co.uk.8333 > tom-Latitude-3570.46284: tcp 24
05:33:36.548986 IP static-87-75-105-186.vodafonexdsl.co.uk.8333 > tom-Latitude-3570.46284: tcp 224
05:33:36.549030 IP tom-Latitude-3570.46284 > static-87-75-105-186.vodafonexdsl.co.uk.8333: tcp 0
05:33:36.572365 IP 2.56.9.15.8333 > tom-Latitude-3570.42516: tcp 24
05:33:36.572387 IP 2.56.9.15.8333 > tom-Latitude-3570.42516: tcp 520
05:33:36.572393 IP 2.56.9.15.8333 > tom-Latitude-3570.42516: tcp 24
05:33:36.572397 IP 2.56.9.15.8333 > tom-Latitude-3570.42516: tcp 283
05:33:36.572399 IP 2.56.9.15.8333 > tom-Latitude-3570.42516: tcp 24
05:33:36.572402 IP 2.56.9.15.8333 > tom-Latitude-3570.42516: tcp 284
05:33:36.572409 IP 2.56.9.15.8333 > tom-Latitude-3570.42516: tcp 24
05:33:36.572412 IP 2.56.9.15.8333 > tom-Latitude-3570.42516: tcp 283
05:33:36.572455 IP tom-Latitude-3570.42516 > 2.56.9.15.8333: tcp 0
05:33:36.977239 IP tom-Latitude-3570.57976 > 167.99.216.145.8333: tcp 24
05:33:36.979419 IP tom-Latitude-3570.57976 > 167.99.216.145.8333: tcp 181
05:33:36.980221 IP 167.99.216.145.8333 > tom-Latitude-3570.57976: tcp 24
05:33:36.980245 IP 167.99.216.145.8333 > tom-Latitude-3570.57976: tcp 253
05:33:36.980250 IP ns3113832.ip-54-38-177.eu.8333 > tom-Latitude-3570.56714: tcp 24
05:33:36.980268 IP tom-Latitude-3570.56714 > ns3113832.ip-54-38-177.eu.8333: tcp 0
05:33:36.980284 IP ns3113832.ip-54-38-177.eu.8333 > tom-Latitude-3570.56714: tcp 937
05:33:36.980287 IP tom-Latitude-3570.56714 > ns3113832.ip-54-38-177.eu.8333: tcp 0
05:33:36.980294 IP tom-Latitude-3570.57976 > 167.99.216.145.8333: tcp 0
05:33:36.980959 IP tom-Latitude-3570.57976 > 167.99.216.145.8333: tcp 97
05:33:36.994980 IP 167.99.216.145.8333 > tom-Latitude-3570.57976: tcp 253
05:33:36.995000 IP tom-Latitude-3570.57976 > 167.99.216.145.8333: tcp 0
05:33:37.017165 IP 167.99.216.145.8333 > tom-Latitude-3570.57976: tcp 0
05:33:37.058087 IP 167.99.216.145.8333 > tom-Latitude-3570.57976: tcp 0
05:33:37.089999 IP 167.99.216.145.8333 > tom-Latitude-3570.57976: tcp 24
05:33:37.090016 IP tom-Latitude-3570.57976 > 167.99.216.145.8333: tcp 0
05:33:37.090036 IP 167.99.216.145.8333 > tom-Latitude-3570.57976: tcp 226
05:33:37.090042 IP tom-Latitude-3570.57976 > 167.99.216.145.8333: tcp 0
05:33:37.090046 IP 167.99.216.145.8333 > tom-Latitude-3570.57976: tcp 24
05:33:37.090049 IP tom-Latitude-3570.57976 > 167.99.216.145.8333: tcp 0
05:33:37.090053 IP 167.99.216.145.8333 > tom-Latitude-3570.57976: tcp 225
05:33:37.090056 IP tom-Latitude-3570.57976 > 167.99.216.145.8333: tcp 0
05:33:37.555155 IP ns3113832.ip-54-38-177.eu.8333 > tom-Latitude-3570.56714: tcp 24
05:33:37.555186 IP tom-Latitude-3570.56714 > ns3113832.ip-54-38-177.eu.8333: tcp 0
05:33:37.555208 IP ns3113832.ip-54-38-177.eu.8333 > tom-Latitude-3570.56714: tcp 1350
05:33:37.555215 IP tom-Latitude-3570.56714 > ns3113832.ip-54-38-177.eu.8333: tcp 0
05:33:37.556559 IP ns3113832.ip-54-38-177.eu.8333 > tom-Latitude-3570.56714: tcp 1350
05:33:37.556569 IP tom-Latitude-3570.56714 > ns3113832.ip-54-38-177.eu.8333: tcp 0
05:33:37.556604 IP ns3113832.ip-54-38-177.eu.8333 > tom-Latitude-3570.56714: tcp 1350
05:33:37.556606 IP tom-Latitude-3570.56714 > ns3113832.ip-54-38-177.eu.8333: tcp 0
05:33:37.556611 IP ns3113832.ip-54-38-177.eu.8333 > tom-Latitude-3570.56714: tcp 1092
05:33:37.556615 IP tom-Latitude-3570.56714 > ns3113832.ip-54-38-177.eu.8333: tcp 0
05:33:37.556618 IP 167.99.216.145.8333 > tom-Latitude-3570.57976: tcp 24
05:33:37.556621 IP tom-Latitude-3570.57976 > 167.99.216.145.8333: tcp 0
05:33:37.556627 IP 167.99.216.145.8333 > tom-Latitude-3570.57976: tcp 1448
05:33:37.556629 IP tom-Latitude-3570.57976 > 167.99.216.145.8333: tcp 0
05:33:37.556634 IP 167.99.216.145.8333 > tom-Latitude-3570.57976: tcp 1448
05:33:37.556636 IP tom-Latitude-3570.57976 > 167.99.216.145.8333: tcp 0
05:33:37.556640 IP 167.99.216.145.8333 > tom-Latitude-3570.57976: tcp 1448
05:33:37.556641 IP tom-Latitude-3570.57976 > 167.99.216.145.8333: tcp 0
05:33:37.556644 IP 167.99.216.145.8333 > tom-Latitude-3570.57976: tcp 798
05:33:37.556646 IP tom-Latitude-3570.57976 > 167.99.216.145.8333: tcp 0
05:33:37.556648 IP vmi195435.contaboserver.net.8333 > tom-Latitude-3570.39110: tcp 24
05:33:37.556653 IP vmi195435.contaboserver.net.8333 > tom-Latitude-3570.39110: tcp 1448
05:33:37.556672 IP tom-Latitude-3570.39110 > vmi195435.contaboserver.net.8333: tcp 0
05:33:37.557014 IP vmi195435.contaboserver.net.8333 > tom-Latitude-3570.39110: tcp 1448
05:33:37.557056 IP tom-Latitude-3570.39110 > vmi195435.contaboserver.net.8333: tcp 0
05:33:37.559625 IP vmi195435.contaboserver.net.8333 > tom-Latitude-3570.39110: tcp 1448
05:33:37.559632 IP vmi195435.contaboserver.net.8333 > tom-Latitude-3570.39110: tcp 798
05:33:37.559635 IP 81.198.101.144.8333 > tom-Latitude-3570.60988: tcp 24
05:33:37.559639 IP 81.198.101.144.8333 > tom-Latitude-3570.60988: tcp 82
05:33:37.559659 IP c-185-45-236-223.customer.ggaweb.ch.8333 > tom-Latitude-3570.49070: tcp 24
05:33:37.559663 IP c-185-45-236-223.customer.ggaweb.ch.8333 > tom-Latitude-3570.49070: tcp 82
05:33:37.559666 IP 2.56.9.15.8333 > tom-Latitude-3570.42516: tcp 24
05:33:37.559669 IP 2.56.9.15.8333 > tom-Latitude-3570.42516: tcp 82
05:33:37.559700 IP tom-Latitude-3570.39110 > vmi195435.contaboserver.net.8333: tcp 0
05:33:37.559720 IP tom-Latitude-3570.49070 > c-185-45-236-223.customer.ggaweb.ch.8333: tcp 0
05:33:37.559727 IP tom-Latitude-3570.60988 > 81.198.101.144.8333: tcp 0
05:33:37.559740 IP tom-Latitude-3570.42516 > 2.56.9.15.8333: tcp 0
05:33:37.562924 IP vmi195435.contaboserver.net.8333 > tom-Latitude-3570.39110: tcp 798
05:33:37.562934 IP tom-Latitude-3570.39110 > vmi195435.contaboserver.net.8333: tcp 0
05:33:37.575357 IP tom-Latitude-3570.46284 > static-87-75-105-186.vodafonexdsl.co.uk.8333: tcp 24
05:33:37.575491 IP tom-Latitude-3570.60470 > bb42-60-217-183.singnet.com.sg.8333: tcp 24
05:33:37.576082 IP tom-Latitude-3570.46284 > static-87-75-105-186.vodafonexdsl.co.uk.8333: tcp 82
05:33:37.576667 IP tom-Latitude-3570.60470 > bb42-60-217-183.singnet.com.sg.8333: tcp 82
05:33:37.601982 IP static-87-75-105-186.vodafonexdsl.co.uk.8333 > tom-Latitude-3570.46284: tcp 24
05:33:37.603292 IP static-87-75-105-186.vodafonexdsl.co.uk.8333 > tom-Latitude-3570.46284: tcp 0
05:33:37.603863 IP bb42-60-217-183.singnet.com.sg.8333 > tom-Latitude-3570.60470: tcp 0
05:33:37.610689 IP static-87-75-105-186.vodafonexdsl.co.uk.8333 > tom-Latitude-3570.46284: tcp 106
05:33:37.610806 IP tom-Latitude-3570.46284 > static-87-75-105-186.vodafonexdsl.co.uk.8333: tcp 0
05:33:37.611953 IP static-87-75-105-186.vodafonexdsl.co.uk.8333 > tom-Latitude-3570.46284: tcp 181
05:33:37.612490 IP tom-Latitude-3570.46284 > static-87-75-105-186.vodafonexdsl.co.uk.8333: tcp 24
05:33:37.613343 IP tom-Latitude-3570.46284 > static-87-75-105-186.vodafonexdsl.co.uk.8333: tcp 109
05:33:37.648100 IP static-87-75-105-186.vodafonexdsl.co.uk.8333 > tom-Latitude-3570.46284: tcp 0
05:33:37.712613 IP static-87-75-105-186.vodafonexdsl.co.uk.8333 > tom-Latitude-3570.46284: tcp 24
05:33:37.721147 IP static-87-75-105-186.vodafonexdsl.co.uk.8333 > tom-Latitude-3570.46284: tcp 634
05:33:37.721167 IP static-87-75-105-186.vodafonexdsl.co.uk.8333 > tom-Latitude-3570.46284: tcp 24
05:33:37.721170 IP static-87-75-105-186.vodafonexdsl.co.uk.8333 > tom-Latitude-3570.46284: tcp 404
05:33:37.721172 IP static-87-75-105-186.vodafonexdsl.co.uk.8333 > tom-Latitude-3570.46284: tcp 24
05:33:37.721259 IP tom-Latitude-3570.46284 > static-87-75-105-186.vodafonexdsl.co.uk.8333: tcp 0
05:33:37.721577 IP static-87-75-105-186.vodafonexdsl.co.uk.8333 > tom-Latitude-3570.46284: tcp 1440
05:33:37.721597 IP static-87-75-105-186.vodafonexdsl.co.uk.8333 > tom-Latitude-3570.46284: tcp 1440
05:33:37.721619 IP static-87-75-105-186.vodafonexdsl.co.uk.8333 > tom-Latitude-3570.46284: tcp 658
05:33:37.721663 IP tom-Latitude-3570.46284 > static-87-75-105-186.vodafonexdsl.co.uk.8333: tcp 0
05:33:38.067296 IP bb42-60-217-183.singnet.com.sg.8333 > tom-Latitude-3570.60470: tcp 24
05:33:38.067315 IP bb42-60-217-183.singnet.com.sg.8333 > tom-Latitude-3570.60470: tcp 82
05:33:38.067317 IP bb42-60-217-183.singnet.com.sg.8333 > tom-Latitude-3570.60470: tcp 24
05:33:38.067321 IP bb42-60-217-183.singnet.com.sg.8333 > tom-Latitude-3570.60470: tcp 901
05:33:38.067407 IP tom-Latitude-3570.60470 > bb42-60-217-183.singnet.com.sg.8333: tcp 0
05:33:38.469083 IP tom-Latitude-3570.39110 > vmi195435.contaboserver.net.8333: tcp 24
05:33:38.470511 IP tom-Latitude-3570.39110 > vmi195435.contaboserver.net.8333: tcp 361
05:33:38.525841 IP vmi195435.contaboserver.net.8333 > tom-Latitude-3570.39110: tcp 0
05:33:38.597530 IP static-87-75-105-186.vodafonexdsl.co.uk.8333 > tom-Latitude-3570.46284: tcp 24
05:33:38.600802 IP static-87-75-105-186.vodafonexdsl.co.uk.8333 > tom-Latitude-3570.46284: tcp 145
05:33:38.600934 IP tom-Latitude-3570.46284 > static-87-75-105-186.vodafonexdsl.co.uk.8333: tcp 0
05:33:38.601175 IP tom-Latitude-3570.46284 > static-87-75-105-186.vodafonexdsl.co.uk.8333: tcp 24
05:33:38.602562 IP tom-Latitude-3570.46284 > static-87-75-105-186.vodafonexdsl.co.uk.8333: tcp 145
05:33:38.637460 IP static-87-75-105-186.vodafonexdsl.co.uk.8333 > tom-Latitude-3570.46284: tcp 0
05:33:38.703694 IP static-87-75-105-186.vodafonexdsl.co.uk.8333 > tom-Latitude-3570.46284: tcp 24
05:33:38.704557 IP static-87-75-105-186.vodafonexdsl.co.uk.8333 > tom-Latitude-3570.46284: tcp 283
05:33:38.704575 IP static-87-75-105-186.vodafonexdsl.co.uk.8333 > tom-Latitude-3570.46284: tcp 24
05:33:38.704579 IP static-87-75-105-186.vodafonexdsl.co.uk.8333 > tom-Latitude-3570.46284: tcp 284
05:33:38.704581 IP static-87-75-105-186.vodafonexdsl.co.uk.8333 > tom-Latitude-3570.46284: tcp 24
05:33:38.704584 IP static-87-75-105-186.vodafonexdsl.co.uk.8333 > tom-Latitude-3570.46284: tcp 586
05:33:38.704605 IP static-87-75-105-186.vodafonexdsl.co.uk.8333 > tom-Latitude-3570.46284: tcp 24
05:33:38.704607 IP static-87-75-105-186.vodafonexdsl.co.uk.8333 > tom-Latitude-3570.46284: tcp 257
05:33:38.704678 IP tom-Latitude-3570.46284 > static-87-75-105-186.vodafonexdsl.co.uk.8333: tcp 0
05:33:38.806375 IP tom-Latitude-3570.39110 > vmi195435.contaboserver.net.8333: tcp 24
05:33:38.807319 IP tom-Latitude-3570.39110 > vmi195435.contaboserver.net.8333: tcp 145
05:33:38.847481 IP vmi195435.contaboserver.net.8333 > tom-Latitude-3570.39110: tcp 0
05:33:38.906792 IP tom-Latitude-3570.60988 > 81.198.101.144.8333: tcp 24
05:33:38.907734 IP tom-Latitude-3570.60988 > 81.198.101.144.8333: tcp 577
05:33:38.941362 IP 81.198.101.144.8333 > tom-Latitude-3570.60988: tcp 0
05:33:38.948429 IP 81.198.101.144.8333 > tom-Latitude-3570.60988: tcp 0
05:33:39.002786 IP c-185-45-236-223.customer.ggaweb.ch.8333 > tom-Latitude-3570.49070: tcp 24
05:33:39.002806 IP c-185-45-236-223.customer.ggaweb.ch.8333 > tom-Latitude-3570.49070: tcp 649
05:33:39.002895 IP tom-Latitude-3570.49070 > c-185-45-236-223.customer.ggaweb.ch.8333: tcp 0
05:33:39.003295 IP tom-Latitude-3570.49070 > c-185-45-236-223.customer.ggaweb.ch.8333: tcp 24
05:33:39.004304 IP tom-Latitude-3570.49070 > c-185-45-236-223.customer.ggaweb.ch.8333: tcp 109
05:33:39.038217 IP 81.198.101.144.8333 > tom-Latitude-3570.60988: tcp 24
05:33:39.039346 IP c-185-45-236-223.customer.ggaweb.ch.8333 > tom-Latitude-3570.49070: tcp 0
05:33:39.039353 IP 81.198.101.144.8333 > tom-Latitude-3570.60988: tcp 283
05:33:39.039358 IP 81.198.101.144.8333 > tom-Latitude-3570.60988: tcp 24
05:33:39.039360 IP 81.198.101.144.8333 > tom-Latitude-3570.60988: tcp 283
05:33:39.039362 IP c-185-45-236-223.customer.ggaweb.ch.8333 > tom-Latitude-3570.49070: tcp 0
05:33:39.039364 IP 81.198.101.144.8333 > tom-Latitude-3570.60988: tcp 24
05:33:39.039366 IP 81.198.101.144.8333 > tom-Latitude-3570.60988: tcp 283
05:33:39.039368 IP tom-Latitude-3570.60988 > 81.198.101.144.8333: tcp 0
05:33:39.039368 IP 81.198.101.144.8333 > tom-Latitude-3570.60988: tcp 24
05:33:39.039370 IP 81.198.101.144.8333 > tom-Latitude-3570.60988: tcp 283
05:33:39.039372 IP 81.198.101.144.8333 > tom-Latitude-3570.60988: tcp 24
05:33:39.039373 IP 81.198.101.144.8333 > tom-Latitude-3570.60988: tcp 283
05:33:39.039375 IP 81.198.101.144.8333 > tom-Latitude-3570.60988: tcp 24
05:33:39.039378 IP 81.198.101.144.8333 > tom-Latitude-3570.60988: tcp 283
05:33:39.039379 IP 81.198.101.144.8333 > tom-Latitude-3570.60988: tcp 24
05:33:39.039381 IP 81.198.101.144.8333 > tom-Latitude-3570.60988: tcp 284
05:33:39.039383 IP 81.198.101.144.8333 > tom-Latitude-3570.60988: tcp 24
05:33:39.039388 IP 81.198.101.144.8333 > tom-Latitude-3570.60988: tcp 284
05:33:39.039398 IP tom-Latitude-3570.60988 > 81.198.101.144.8333: tcp 0
05:33:39.039660 IP tom-Latitude-3570.60988 > 81.198.101.144.8333: tcp 24
05:33:39.041565 IP tom-Latitude-3570.60988 > 81.198.101.144.8333: tcp 464
05:33:39.069588 IP 81.198.101.144.8333 > tom-Latitude-3570.60988: tcp 1382
05:33:39.070097 IP tom-Latitude-3570.60988 > 81.198.101.144.8333: tcp 24
05:33:39.070117 IP tom-Latitude-3570.60988 > 81.198.101.144.8333: tcp 37
05:33:39.071088 IP tom-Latitude-3570.60988 > 81.198.101.144.8333: tcp 183
05:33:39.072378 IP 81.198.101.144.8333 > tom-Latitude-3570.60988: tcp 1051
05:33:39.073226 IP tom-Latitude-3570.60988 > 81.198.101.144.8333: tcp 183
05:33:39.074078 IP tom-Latitude-3570.60988 > 81.198.101.144.8333: tcp 78
05:33:39.076502 IP 81.198.101.144.8333 > tom-Latitude-3570.60988: tcp 0
05:33:39.077267 IP 81.198.101.144.8333 > tom-Latitude-3570.60988: tcp 0
05:33:39.099455 IP 81.198.101.144.8333 > tom-Latitude-3570.60988: tcp 0
05:33:39.107458 IP 81.198.101.144.8333 > tom-Latitude-3570.60988: tcp 0
05:33:39.108084 IP 81.198.101.144.8333 > tom-Latitude-3570.60988: tcp 0
05:33:39.108098 IP 81.198.101.144.8333 > tom-Latitude-3570.60988: tcp 0
05:33:39.108100 IP 81.198.101.144.8333 > tom-Latitude-3570.60988: tcp 0
05:33:39.120519 IP c-185-45-236-223.customer.ggaweb.ch.8333 > tom-Latitude-3570.49070: tcp 24
05:33:39.121175 IP c-185-45-236-223.customer.ggaweb.ch.8333 > tom-Latitude-3570.49070: tcp 862
05:33:39.121304 IP tom-Latitude-3570.49070 > c-185-45-236-223.customer.ggaweb.ch.8333: tcp 0
05:33:39.166011 IP 81.198.101.144.8333 > tom-Latitude-3570.60988: tcp 24
05:33:39.166031 IP 81.198.101.144.8333 > tom-Latitude-3570.60988: tcp 283
05:33:39.166035 IP 81.198.101.144.8333 > tom-Latitude-3570.60988: tcp 24
05:33:39.166038 IP 81.198.101.144.8333 > tom-Latitude-3570.60988: tcp 284
05:33:39.166039 IP 81.198.101.144.8333 > tom-Latitude-3570.60988: tcp 24
05:33:39.166060 IP 81.198.101.144.8333 > tom-Latitude-3570.60988: tcp 284
05:33:39.166062 IP 81.198.101.144.8333 > tom-Latitude-3570.60988: tcp 24
05:33:39.166065 IP 81.198.101.144.8333 > tom-Latitude-3570.60988: tcp 283
05:33:39.166129 IP tom-Latitude-3570.60988 > 81.198.101.144.8333: tcp 0
05:33:39.166506 IP tom-Latitude-3570.60988 > 81.198.101.144.8333: tcp 24
05:33:39.167828 IP tom-Latitude-3570.60988 > 81.198.101.144.8333: tcp 220
05:33:39.169452 IP 81.198.101.144.8333 > tom-Latitude-3570.60988: tcp 24
05:33:39.169467 IP 81.198.101.144.8333 > tom-Latitude-3570.60988: tcp 283
05:33:39.169470 IP 81.198.101.144.8333 > tom-Latitude-3570.60988: tcp 24
05:33:39.169473 IP 81.198.101.144.8333 > tom-Latitude-3570.60988: tcp 284
05:33:39.169492 IP 81.198.101.144.8333 > tom-Latitude-3570.60988: tcp 24
05:33:39.169494 IP 81.198.101.144.8333 > tom-Latitude-3570.60988: tcp 283
05:33:39.169496 IP 81.198.101.144.8333 > tom-Latitude-3570.60988: tcp 24
05:33:39.169498 IP 81.198.101.144.8333 > tom-Latitude-3570.60988: tcp 283
05:33:39.169550 IP tom-Latitude-3570.60988 > 81.198.101.144.8333: tcp 0
05:33:39.169894 IP tom-Latitude-3570.60988 > 81.198.101.144.8333: tcp 24
05:33:39.169908 IP tom-Latitude-3570.60988 > 81.198.101.144.8333: tcp 37
05:33:39.171908 IP tom-Latitude-3570.60988 > 81.198.101.144.8333: tcp 183
05:33:39.198189 IP 81.198.101.144.8333 > tom-Latitude-3570.60988: tcp 24
05:33:39.198208 IP 81.198.101.144.8333 > tom-Latitude-3570.60988: tcp 283
05:33:39.198211 IP 81.198.101.144.8333 > tom-Latitude-3570.60988: tcp 24
05:33:39.198214 IP 81.198.101.144.8333 > tom-Latitude-3570.60988: tcp 283
05:33:39.198215 IP 81.198.101.144.8333 > tom-Latitude-3570.60988: tcp 24
05:33:39.198219 IP 81.198.101.144.8333 > tom-Latitude-3570.60988: tcp 284
05:33:39.198303 IP tom-Latitude-3570.60988 > 81.198.101.144.8333: tcp 0
05:33:39.198470 IP tom-Latitude-3570.39110 > vmi195435.contaboserver.net.8333: tcp 24
05:33:39.198757 IP tom-Latitude-3570.60988 > 81.198.101.144.8333: tcp 24
05:33:39.198770 IP tom-Latitude-3570.60988 > 81.198.101.144.8333: tcp 37
05:33:39.199790 IP tom-Latitude-3570.39110 > vmi195435.contaboserver.net.8333: tcp 109
05:33:39.200522 IP 81.198.101.144.8333 > tom-Latitude-3570.60988: tcp 615
05:33:39.200540 IP 81.198.101.144.8333 > tom-Latitude-3570.60988: tcp 24
05:33:39.200619 IP tom-Latitude-3570.60988 > 81.198.101.144.8333: tcp 0
05:33:39.201102 IP tom-Latitude-3570.60988 > 81.198.101.144.8333: tcp 122
05:33:39.201901 IP 81.198.101.144.8333 > tom-Latitude-3570.60988: tcp 283
05:33:39.201916 IP 81.198.101.144.8333 > tom-Latitude-3570.60988: tcp 24
05:33:39.201918 IP 81.198.101.144.8333 > tom-Latitude-3570.60988: tcp 283
05:33:39.201995 IP tom-Latitude-3570.60988 > 81.198.101.144.8333: tcp 0
05:33:39.202388 IP tom-Latitude-3570.60988 > 81.198.101.144.8333: tcp 122
05:33:39.205769 IP tom-Latitude-3570.60988 > 81.198.101.144.8333: tcp 61
05:33:39.206350 IP 81.198.101.144.8333 > tom-Latitude-3570.60988: tcp 0
05:33:39.206362 IP 81.198.101.144.8333 > tom-Latitude-3570.60988: tcp 0
05:33:39.206365 IP 81.198.101.144.8333 > tom-Latitude-3570.60988: tcp 0
05:33:39.206367 IP 81.198.101.144.8333 > tom-Latitude-3570.60988: tcp 0
05:33:39.206369 IP 81.198.101.144.8333 > tom-Latitude-3570.60988: tcp 0
05:33:39.227710 IP 81.198.101.144.8333 > tom-Latitude-3570.60988: tcp 0
05:33:39.235521 IP 81.198.101.144.8333 > tom-Latitude-3570.60988: tcp 0
05:33:39.236279 IP vmi195435.contaboserver.net.8333 > tom-Latitude-3570.39110: tcp 0
05:33:39.236294 IP 81.198.101.144.8333 > tom-Latitude-3570.60988: tcp 0
05:33:39.236297 IP 81.198.101.144.8333 > tom-Latitude-3570.60988: tcp 0
05:33:39.236300 IP 81.198.101.144.8333 > tom-Latitude-3570.60988: tcp 0
05:33:39.298200 IP 81.198.101.144.8333 > tom-Latitude-3570.60988: tcp 24
05:33:39.300331 IP 81.198.101.144.8333 > tom-Latitude-3570.60988: tcp 283
05:33:39.300350 IP 81.198.101.144.8333 > tom-Latitude-3570.60988: tcp 24
05:33:39.300354 IP 81.198.101.144.8333 > tom-Latitude-3570.60988: tcp 284
05:33:39.300356 IP 81.198.101.144.8333 > tom-Latitude-3570.60988: tcp 24
05:33:39.300359 IP 81.198.101.144.8333 > tom-Latitude-3570.60988: tcp 284
05:33:39.300379 IP 81.198.101.144.8333 > tom-Latitude-3570.60988: tcp 24
05:33:39.300382 IP 81.198.101.144.8333 > tom-Latitude-3570.60988: tcp 284
05:33:39.300384 IP 81.198.101.144.8333 > tom-Latitude-3570.60988: tcp 24
05:33:39.300387 IP 81.198.101.144.8333 > tom-Latitude-3570.60988: tcp 283
05:33:39.300389 IP 81.198.101.144.8333 > tom-Latitude-3570.60988: tcp 24
05:33:39.300392 IP 81.198.101.144.8333 > tom-Latitude-3570.60988: tcp 283
05:33:39.300393 IP 81.198.101.144.8333 > tom-Latitude-3570.60988: tcp 24
05:33:39.300415 IP 81.198.101.144.8333 > tom-Latitude-3570.60988: tcp 284
05:33:39.300417 IP 81.198.101.144.8333 > tom-Latitude-3570.60988: tcp 24
05:33:39.300420 IP 81.198.101.144.8333 > tom-Latitude-3570.60988: tcp 283
05:33:39.300450 IP tom-Latitude-3570.60988 > 81.198.101.144.8333: tcp 0
05:33:39.300881 IP tom-Latitude-3570.60988 > 81.198.101.144.8333: tcp 24
05:33:39.301951 IP tom-Latitude-3570.60988 > 81.198.101.144.8333: tcp 403
05:33:39.301963 IP tom-Latitude-3570.57976 > 167.99.216.145.8333: tcp 24
05:33:39.303567 IP tom-Latitude-3570.57976 > 167.99.216.145.8333: tcp 361
05:33:39.324955 IP 81.198.101.144.8333 > tom-Latitude-3570.60988: tcp 24
05:33:39.324974 IP 81.198.101.144.8333 > tom-Latitude-3570.60988: tcp 284
05:33:39.324977 IP 81.198.101.144.8333 > tom-Latitude-3570.60988: tcp 24
05:33:39.324980 IP 81.198.101.144.8333 > tom-Latitude-3570.60988: tcp 284
05:33:39.324981 IP 81.198.101.144.8333 > tom-Latitude-3570.60988: tcp 24
05:33:39.324983 IP 81.198.101.144.8333 > tom-Latitude-3570.60988: tcp 284
05:33:39.324985 IP 81.198.101.144.8333 > tom-Latitude-3570.60988: tcp 24
05:33:39.325082 IP tom-Latitude-3570.60988 > 81.198.101.144.8333: tcp 0
05:33:39.325488 IP tom-Latitude-3570.60988 > 81.198.101.144.8333: tcp 24
05:33:39.325504 IP tom-Latitude-3570.60988 > 81.198.101.144.8333: tcp 37
05:33:39.325614 IP 81.198.101.144.8333 > tom-Latitude-3570.60988: tcp 283
05:33:39.325634 IP 81.198.101.144.8333 > tom-Latitude-3570.60988: tcp 24
05:33:39.325709 IP tom-Latitude-3570.60988 > 81.198.101.144.8333: tcp 0
05:33:39.327044 IP tom-Latitude-3570.60988 > 81.198.101.144.8333: tcp 183
05:33:39.330818 IP 81.198.101.144.8333 > tom-Latitude-3570.60988: tcp 591
05:33:39.331264 IP tom-Latitude-3570.60988 > 81.198.101.144.8333: tcp 24
05:33:39.331280 IP tom-Latitude-3570.60988 > 81.198.101.144.8333: tcp 37
05:33:39.332303 IP tom-Latitude-3570.60988 > 81.198.101.144.8333: tcp 61
05:33:39.335019 IP 81.198.101.144.8333 > tom-Latitude-3570.60988: tcp 0
05:33:39.345344 IP 167.99.216.145.8333 > tom-Latitude-3570.57976: tcp 0
05:33:39.346033 IP 167.99.216.145.8333 > tom-Latitude-3570.57976: tcp 0
05:33:39.346046 IP 81.198.101.144.8333 > tom-Latitude-3570.60988: tcp 0
05:33:39.367795 IP 81.198.101.144.8333 > tom-Latitude-3570.60988: tcp 0
05:33:39.367810 IP 81.198.101.144.8333 > tom-Latitude-3570.60988: tcp 0
05:33:39.367812 IP 81.198.101.144.8333 > tom-Latitude-3570.60988: tcp 0
05:33:39.367815 IP 81.198.101.144.8333 > tom-Latitude-3570.60988: tcp 0
05:33:39.368727 IP 81.198.101.144.8333 > tom-Latitude-3570.60988: tcp 0
05:33:39.368742 IP 81.198.101.144.8333 > tom-Latitude-3570.60988: tcp 0
05:33:39.435836 IP 81.198.101.144.8333 > tom-Latitude-3570.60988: tcp 24
05:33:39.435855 IP 81.198.101.144.8333 > tom-Latitude-3570.60988: tcp 283
05:33:39.435948 IP tom-Latitude-3570.60988 > 81.198.101.144.8333: tcp 0
05:33:39.436194 IP tom-Latitude-3570.60988 > 81.198.101.144.8333: tcp 24
05:33:39.436449 IP 81.198.101.144.8333 > tom-Latitude-3570.60988: tcp 24
05:33:39.436468 IP 81.198.101.144.8333 > tom-Latitude-3570.60988: tcp 283
05:33:39.436471 IP 81.198.101.144.8333 > tom-Latitude-3570.60988: tcp 24
05:33:39.436473 IP 81.198.101.144.8333 > tom-Latitude-3570.60988: tcp 284
05:33:39.436504 IP tom-Latitude-3570.60988 > 81.198.101.144.8333: tcp 37
05:33:39.436519 IP 81.198.101.144.8333 > tom-Latitude-3570.60988: tcp 24
05:33:39.437144 IP 81.198.101.144.8333 > tom-Latitude-3570.60988: tcp 284
05:33:39.437158 IP 81.198.101.144.8333 > tom-Latitude-3570.60988: tcp 24
05:33:39.437161 IP 81.198.101.144.8333 > tom-Latitude-3570.60988: tcp 284
05:33:39.437163 IP 81.198.101.144.8333 > tom-Latitude-3570.60988: tcp 24
05:33:39.437166 IP 81.198.101.144.8333 > tom-Latitude-3570.60988: tcp 284
05:33:39.437185 IP 81.198.101.144.8333 > tom-Latitude-3570.60988: tcp 24
05:33:39.437187 IP 81.198.101.144.8333 > tom-Latitude-3570.60988: tcp 283
05:33:39.437235 IP tom-Latitude-3570.60988 > 81.198.101.144.8333: tcp 0
05:33:39.438607 IP tom-Latitude-3570.60988 > 81.198.101.144.8333: tcp 305
05:33:39.453301 IP 81.198.101.144.8333 > tom-Latitude-3570.60988: tcp 24
05:33:39.453885 IP 81.198.101.144.8333 > tom-Latitude-3570.60988: tcp 283
05:33:39.453903 IP tom-Latitude-3570.60988 > 81.198.101.144.8333: tcp 0
05:33:39.454245 IP tom-Latitude-3570.60988 > 81.198.101.144.8333: tcp 24
05:33:39.454254 IP tom-Latitude-3570.60988 > 81.198.101.144.8333: tcp 37
05:33:39.456622 IP 81.198.101.144.8333 > tom-Latitude-3570.60988: tcp 24
05:33:39.457487 IP 81.198.101.144.8333 > tom-Latitude-3570.60988: tcp 284
05:33:39.457508 IP 81.198.101.144.8333 > tom-Latitude-3570.60988: tcp 24
05:33:39.457596 IP tom-Latitude-3570.60988 > 81.198.101.144.8333: tcp 0
05:33:39.457989 IP tom-Latitude-3570.60988 > 81.198.101.144.8333: tcp 24
05:33:39.458004 IP tom-Latitude-3570.60988 > 81.198.101.144.8333: tcp 37
05:33:39.465737 IP 81.198.101.144.8333 > tom-Latitude-3570.60988: tcp 284
05:33:39.466125 IP tom-Latitude-3570.60988 > 81.198.101.144.8333: tcp 24
05:33:39.466141 IP tom-Latitude-3570.60988 > 81.198.101.144.8333: tcp 37
05:33:39.466512 IP 81.198.101.144.8333 > tom-Latitude-3570.60988: tcp 24
05:33:39.466528 IP 81.198.101.144.8333 > tom-Latitude-3570.60988: tcp 283
05:33:39.466530 IP 81.198.101.144.8333 > tom-Latitude-3570.60988: tcp 24
05:33:39.466533 IP 81.198.101.144.8333 > tom-Latitude-3570.60988: tcp 284
05:33:39.466552 IP 81.198.101.144.8333 > tom-Latitude-3570.60988: tcp 24
05:33:39.466554 IP 81.198.101.144.8333 > tom-Latitude-3570.60988: tcp 284
05:33:39.466556 IP 81.198.101.144.8333 > tom-Latitude-3570.60988: tcp 0
05:33:39.466609 IP tom-Latitude-3570.60988 > 81.198.101.144.8333: tcp 0
05:33:39.466987 IP tom-Latitude-3570.60988 > 81.198.101.144.8333: tcp 61
05:33:39.467735 IP tom-Latitude-3570.60988 > 81.198.101.144.8333: tcp 122
05:33:39.469057 IP 81.198.101.144.8333 > tom-Latitude-3570.60988: tcp 0
05:33:39.469973 IP 81.198.101.144.8333 > tom-Latitude-3570.60988: tcp 0
05:33:39.472173 IP vmi195435.contaboserver.net.8333 > tom-Latitude-3570.39110: tcp 24
05:33:39.472193 IP tom-Latitude-3570.39110 > vmi195435.contaboserver.net.8333: tcp 0
05:33:39.472221 IP vmi195435.contaboserver.net.8333 > tom-Latitude-3570.39110: tcp 73
05:33:39.472224 IP tom-Latitude-3570.39110 > vmi195435.contaboserver.net.8333: tcp 0
05:33:39.472415 IP tom-Latitude-3570.39110 > vmi195435.contaboserver.net.8333: tcp 24
05:33:39.474352 IP tom-Latitude-3570.39110 > vmi195435.contaboserver.net.8333: tcp 73
05:33:39.492503 IP 81.198.101.144.8333 > tom-Latitude-3570.60988: tcp 0
05:33:39.493209 IP 81.198.101.144.8333 > tom-Latitude-3570.60988: tcp 0
05:33:39.500736 IP 81.198.101.144.8333 > tom-Latitude-3570.60988: tcp 0
05:33:39.501413 IP 81.198.101.144.8333 > tom-Latitude-3570.60988: tcp 0
05:33:39.501427 IP 81.198.101.144.8333 > tom-Latitude-3570.60988: tcp 0
05:33:39.501429 IP 81.198.101.144.8333 > tom-Latitude-3570.60988: tcp 0
05:33:39.501431 IP 81.198.101.144.8333 > tom-Latitude-3570.60988: tcp 0
05:33:39.501434 IP 81.198.101.144.8333 > tom-Latitude-3570.60988: tcp 0
05:33:39.508429 IP vmi195435.contaboserver.net.8333 > tom-Latitude-3570.39110: tcp 0
05:33:39.555445 IP 81.198.101.144.8333 > tom-Latitude-3570.60988: tcp 24
05:33:39.556469 IP 81.198.101.144.8333 > tom-Latitude-3570.60988: tcp 284
05:33:39.556488 IP 81.198.101.144.8333 > tom-Latitude-3570.60988: tcp 24
05:33:39.556491 IP 81.198.101.144.8333 > tom-Latitude-3570.60988: tcp 284
05:33:39.556493 IP 81.198.101.144.8333 > tom-Latitude-3570.60988: tcp 24
05:33:39.556496 IP 81.198.101.144.8333 > tom-Latitude-3570.60988: tcp 283
05:33:39.556516 IP 81.198.101.144.8333 > tom-Latitude-3570.60988: tcp 24
05:33:39.556518 IP 81.198.101.144.8333 > tom-Latitude-3570.60988: tcp 283
05:33:39.556520 IP 81.198.101.144.8333 > tom-Latitude-3570.60988: tcp 24
05:33:39.556527 IP 81.198.101.144.8333 > tom-Latitude-3570.60988: tcp 284
05:33:39.556529 IP 81.198.101.144.8333 > tom-Latitude-3570.60988: tcp 24
05:33:39.556532 IP 81.198.101.144.8333 > tom-Latitude-3570.60988: tcp 284
05:33:39.556585 IP tom-Latitude-3570.60988 > 81.198.101.144.8333: tcp 0
05:33:39.557003 IP tom-Latitude-3570.60988 > 81.198.101.144.8333: tcp 24
05:33:39.558450 IP tom-Latitude-3570.60988 > 81.198.101.144.8333: tcp 342
05:33:39.584053 IP 81.198.101.144.8333 > tom-Latitude-3570.60988: tcp 24
05:33:39.584074 IP 81.198.101.144.8333 > tom-Latitude-3570.60988: tcp 283
05:33:39.584164 IP tom-Latitude-3570.60988 > 81.198.101.144.8333: tcp 0
05:33:39.584555 IP tom-Latitude-3570.60988 > 81.198.101.144.8333: tcp 24
05:33:39.584572 IP tom-Latitude-3570.60988 > 81.198.101.144.8333: tcp 37
05:33:39.585663 IP vmi195435.contaboserver.net.8333 > tom-Latitude-3570.39110: tcp 24
05:33:39.585683 IP vmi195435.contaboserver.net.8333 > tom-Latitude-3570.39110: tcp 247
05:33:39.585687 IP vmi195435.contaboserver.net.8333 > tom-Latitude-3570.39110: tcp 24
05:33:39.585690 IP vmi195435.contaboserver.net.8333 > tom-Latitude-3570.39110: tcp 223
05:33:39.585692 IP 81.198.101.144.8333 > tom-Latitude-3570.60988: tcp 0
05:33:39.585714 IP 81.198.101.144.8333 > tom-Latitude-3570.60988: tcp 0
05:33:39.585777 IP tom-Latitude-3570.39110 > vmi195435.contaboserver.net.8333: tcp 0
05:33:39.589517 IP 81.198.101.144.8333 > tom-Latitude-3570.60988: tcp 24
05:33:39.589532 IP 81.198.101.144.8333 > tom-Latitude-3570.60988: tcp 283
05:33:39.589536 IP 81.198.101.144.8333 > tom-Latitude-3570.60988: tcp 24
05:33:39.589538 IP 81.198.101.144.8333 > tom-Latitude-3570.60988: tcp 283
05:33:39.589540 IP 81.198.101.144.8333 > tom-Latitude-3570.60988: tcp 24
05:33:39.589560 IP 81.198.101.144.8333 > tom-Latitude-3570.60988: tcp 283
05:33:39.589565 IP 81.198.101.144.8333 > tom-Latitude-3570.60988: tcp 24
05:33:39.589567 IP 81.198.101.144.8333 > tom-Latitude-3570.60988: tcp 284
05:33:39.589570 IP 81.198.101.144.8333 > tom-Latitude-3570.60988: tcp 24
05:33:39.589572 IP 81.198.101.144.8333 > tom-Latitude-3570.60988: tcp 283
05:33:39.589621 IP tom-Latitude-3570.60988 > 81.198.101.144.8333: tcp 0
05:33:39.589967 IP tom-Latitude-3570.60988 > 81.198.101.144.8333: tcp 24
05:33:39.589982 IP tom-Latitude-3570.60988 > 81.198.101.144.8333: tcp 37
05:33:39.591402 IP tom-Latitude-3570.60988 > 81.198.101.144.8333: tcp 244
05:33:39.626129 IP 81.198.101.144.8333 > tom-Latitude-3570.60988: tcp 0
05:33:39.626649 IP 81.198.101.144.8333 > tom-Latitude-3570.60988: tcp 0
05:33:39.668448 IP 81.198.101.144.8333 > tom-Latitude-3570.60988: tcp 0
05:33:39.674735 IP 81.198.101.144.8333 > tom-Latitude-3570.60988: tcp 24
05:33:39.675472 IP 81.198.101.144.8333 > tom-Latitude-3570.60988: tcp 284
05:33:39.675491 IP 81.198.101.144.8333 > tom-Latitude-3570.60988: tcp 24
05:33:39.675494 IP 81.198.101.144.8333 > tom-Latitude-3570.60988: tcp 284
05:33:39.675496 IP 81.198.101.144.8333 > tom-Latitude-3570.60988: tcp 24
05:33:39.675498 IP 81.198.101.144.8333 > tom-Latitude-3570.60988: tcp 284
05:33:39.675587 IP tom-Latitude-3570.60988 > 81.198.101.144.8333: tcp 0
05:33:39.676021 IP tom-Latitude-3570.60988 > 81.198.101.144.8333: tcp 24
05:33:39.677253 IP tom-Latitude-3570.60988 > 81.198.101.144.8333: tcp 159
05:33:39.678946 IP 81.198.101.144.8333 > tom-Latitude-3570.60988: tcp 24
05:33:39.678962 IP 81.198.101.144.8333 > tom-Latitude-3570.60988: tcp 284
05:33:39.678965 IP 81.198.101.144.8333 > tom-Latitude-3570.60988: tcp 24
05:33:39.678967 IP 81.198.101.144.8333 > tom-Latitude-3570.60988: tcp 284
05:33:39.678986 IP 81.198.101.144.8333 > tom-Latitude-3570.60988: tcp 24
05:33:39.678989 IP 81.198.101.144.8333 > tom-Latitude-3570.60988: tcp 283
05:33:39.679045 IP tom-Latitude-3570.60988 > 81.198.101.144.8333: tcp 0
05:33:39.679396 IP tom-Latitude-3570.60988 > 81.198.101.144.8333: tcp 24
05:33:39.679410 IP tom-Latitude-3570.60988 > 81.198.101.144.8333: tcp 37
05:33:39.680654 IP tom-Latitude-3570.60988 > 81.198.101.144.8333: tcp 122
05:33:39.715892 IP 81.198.101.144.8333 > tom-Latitude-3570.60988: tcp 24
05:33:39.716922 IP 81.198.101.144.8333 > tom-Latitude-3570.60988: tcp 284
05:33:39.716930 IP 81.198.101.144.8333 > tom-Latitude-3570.60988: tcp 24
05:33:39.716933 IP 81.198.101.144.8333 > tom-Latitude-3570.60988: tcp 283
05:33:39.716935 IP 81.198.101.144.8333 > tom-Latitude-3570.60988: tcp 24
05:33:39.716937 IP 81.198.101.144.8333 > tom-Latitude-3570.60988: tcp 283
05:33:39.716959 IP 81.198.101.144.8333 > tom-Latitude-3570.60988: tcp 24
05:33:39.716961 IP 81.198.101.144.8333 > tom-Latitude-3570.60988: tcp 284
05:33:39.716963 IP 81.198.101.144.8333 > tom-Latitude-3570.60988: tcp 24
05:33:39.716965 IP 81.198.101.144.8333 > tom-Latitude-3570.60988: tcp 284
05:33:39.716967 IP 81.198.101.144.8333 > tom-Latitude-3570.60988: tcp 24
05:33:39.716969 IP 81.198.101.144.8333 > tom-Latitude-3570.60988: tcp 284
05:33:39.716987 IP tom-Latitude-3570.60988 > 81.198.101.144.8333: tcp 0
05:33:39.717384 IP tom-Latitude-3570.60988 > 81.198.101.144.8333: tcp 24
05:33:39.717401 IP tom-Latitude-3570.60988 > 81.198.101.144.8333: tcp 37
05:33:39.718431 IP tom-Latitude-3570.60988 > 81.198.101.144.8333: tcp 305
05:33:39.777871 IP 81.198.101.144.8333 > tom-Latitude-3570.60988: tcp 0
05:33:39.778519 IP 81.198.101.144.8333 > tom-Latitude-3570.60988: tcp 0
05:33:39.778533 IP 81.198.101.144.8333 > tom-Latitude-3570.60988: tcp 0
05:33:39.778535 IP 81.198.101.144.8333 > tom-Latitude-3570.60988: tcp 0
05:33:39.778537 IP 81.198.101.144.8333 > tom-Latitude-3570.60988: tcp 0
05:33:39.778539 IP 81.198.101.144.8333 > tom-Latitude-3570.60988: tcp 0
05:33:39.778541 IP 81.198.101.144.8333 > tom-Latitude-3570.60988: tcp 0
05:33:39.778543 IP 81.198.101.144.8333 > tom-Latitude-3570.60988: tcp 0
05:33:39.868450 IP 81.198.101.144.8333 > tom-Latitude-3570.60988: tcp 24
05:33:39.869699 IP 81.198.101.144.8333 > tom-Latitude-3570.60988: tcp 283
05:33:39.869717 IP 81.198.101.144.8333 > tom-Latitude-3570.60988: tcp 24
05:33:39.869720 IP 81.198.101.144.8333 > tom-Latitude-3570.60988: tcp 283
05:33:39.869722 IP 81.198.101.144.8333 > tom-Latitude-3570.60988: tcp 24
05:33:39.869727 IP 81.198.101.144.8333 > tom-Latitude-3570.60988: tcp 284
05:33:39.869748 IP 81.198.101.144.8333 > tom-Latitude-3570.60988: tcp 24
05:33:39.869750 IP 81.198.101.144.8333 > tom-Latitude-3570.60988: tcp 284
05:33:39.869752 IP 81.198.101.144.8333 > tom-Latitude-3570.60988: tcp 24
05:33:39.869755 IP 81.198.101.144.8333 > tom-Latitude-3570.60988: tcp 283
05:33:39.869757 IP 81.198.101.144.8333 > tom-Latitude-3570.60988: tcp 24
05:33:39.869760 IP 81.198.101.144.8333 > tom-Latitude-3570.60988: tcp 284
05:33:39.869763 IP 81.198.101.144.8333 > tom-Latitude-3570.60988: tcp 24
05:33:39.869766 IP 81.198.101.144.8333 > tom-Latitude-3570.60988: tcp 284
05:33:39.869768 IP 81.198.101.144.8333 > tom-Latitude-3570.60988: tcp 24
05:33:39.869771 IP 81.198.101.144.8333 > tom-Latitude-3570.60988: tcp 284
05:33:39.869773 IP 81.198.101.144.8333 > tom-Latitude-3570.60988: tcp 24
05:33:39.869776 IP 81.198.101.144.8333 > tom-Latitude-3570.60988: tcp 283
05:33:39.869778 IP 81.198.101.144.8333 > tom-Latitude-3570.60988: tcp 24
05:33:39.869781 IP 81.198.101.144.8333 > tom-Latitude-3570.60988: tcp 284
05:33:39.869783 IP 81.198.101.144.8333 > tom-Latitude-3570.60988: tcp 24
05:33:39.869786 IP 81.198.101.144.8333 > tom-Latitude-3570.60988: tcp 284
05:33:39.869826 IP tom-Latitude-3570.60988 > 81.198.101.144.8333: tcp 0
05:33:39.870246 IP tom-Latitude-3570.60988 > 81.198.101.144.8333: tcp 24
05:33:39.870379 IP tom-Latitude-3570.42516 > 2.56.9.15.8333: tcp 24
05:33:39.871722 IP tom-Latitude-3570.60988 > 81.198.101.144.8333: tcp 647
05:33:39.872714 IP tom-Latitude-3570.42516 > 2.56.9.15.8333: tcp 541
05:33:39.873985 IP 81.198.101.144.8333 > tom-Latitude-3570.60988: tcp 24
05:33:39.874001 IP 81.198.101.144.8333 > tom-Latitude-3570.60988: tcp 283
05:33:39.874080 IP tom-Latitude-3570.60988 > 81.198.101.144.8333: tcp 0
05:33:39.874423 IP tom-Latitude-3570.60988 > 81.198.101.144.8333: tcp 24
05:33:39.874437 IP tom-Latitude-3570.60988 > 81.198.101.144.8333: tcp 37
05:33:39.907844 IP 81.198.101.144.8333 > tom-Latitude-3570.60988: tcp 0
05:33:39.907859 IP 81.198.101.144.8333 > tom-Latitude-3570.60988: tcp 0
05:33:39.907861 IP 81.198.101.144.8333 > tom-Latitude-3570.60988: tcp 0
05:33:39.907864 IP 81.198.101.144.8333 > tom-Latitude-3570.60988: tcp 0
05:33:39.907866 IP 2.56.9.15.8333 > tom-Latitude-3570.42516: tcp 0
05:33:39.997231 IP 81.198.101.144.8333 > tom-Latitude-3570.60988: tcp 24
05:33:39.997251 IP 81.198.101.144.8333 > tom-Latitude-3570.60988: tcp 283
05:33:39.997255 IP 81.198.101.144.8333 > tom-Latitude-3570.60988: tcp 24
05:33:39.997258 IP 81.198.101.144.8333 > tom-Latitude-3570.60988: tcp 283
05:33:39.997259 IP 81.198.101.144.8333 > tom-Latitude-3570.60988: tcp 24
05:33:39.997262 IP 81.198.101.144.8333 > tom-Latitude-3570.60988: tcp 284
05:33:39.997263 IP 81.198.101.144.8333 > tom-Latitude-3570.60988: tcp 24
05:33:39.997355 IP tom-Latitude-3570.60988 > 81.198.101.144.8333: tcp 0
05:33:39.997483 IP 81.198.101.144.8333 > tom-Latitude-3570.60988: tcp 284
05:33:39.997493 IP 81.198.101.144.8333 > tom-Latitude-3570.60988: tcp 24
05:33:39.997498 IP 81.198.101.144.8333 > tom-Latitude-3570.60988: tcp 284
05:33:39.997501 IP 81.198.101.144.8333 > tom-Latitude-3570.60988: tcp 24
05:33:39.997521 IP 81.198.101.144.8333 > tom-Latitude-3570.60988: tcp 284
05:33:39.997524 IP 81.198.101.144.8333 > tom-Latitude-3570.60988: tcp 24
05:33:39.997534 IP 81.198.101.144.8333 > tom-Latitude-3570.60988: tcp 283
05:33:39.997550 IP 81.198.101.144.8333 > tom-Latitude-3570.60988: tcp 24
05:33:39.997555 IP 81.198.101.144.8333 > tom-Latitude-3570.60988: tcp 283
05:33:39.997561 IP 81.198.101.144.8333 > tom-Latitude-3570.60988: tcp 24
05:33:39.997567 IP 81.198.101.144.8333 > tom-Latitude-3570.60988: tcp 284
05:33:39.997572 IP 81.198.101.144.8333 > tom-Latitude-3570.60988: tcp 24
05:33:39.997576 IP tom-Latitude-3570.60988 > 81.198.101.144.8333: tcp 0
05:33:39.997619 IP tom-Latitude-3570.60988 > 81.198.101.144.8333: tcp 0
05:33:39.997865 IP tom-Latitude-3570.60988 > 81.198.101.144.8333: tcp 24
05:33:40.001062 IP 81.198.101.144.8333 > tom-Latitude-3570.60988: tcp 283
05:33:40.001077 IP 81.198.101.144.8333 > tom-Latitude-3570.60988: tcp 24
05:33:40.001080 IP 81.198.101.144.8333 > tom-Latitude-3570.60988: tcp 284
05:33:40.001082 IP 81.198.101.144.8333 > tom-Latitude-3570.60988: tcp 24
05:33:40.001084 IP 81.198.101.144.8333 > tom-Latitude-3570.60988: tcp 283
05:33:40.001158 IP tom-Latitude-3570.60988 > 81.198.101.144.8333: tcp 0
05:33:40.053742 IP tom-Latitude-3570.60988 > 81.198.101.144.8333: tcp 708
05:33:40.097558 IP 81.198.101.144.8333 > tom-Latitude-3570.60988: tcp 0
05:33:40.098318 IP 81.198.101.144.8333 > tom-Latitude-3570.60988: tcp 0
05:33:40.102077 IP tom-Latitude-3570.57976 > 167.99.216.145.8333: tcp 24
05:33:40.103012 IP tom-Latitude-3570.57976 > 167.99.216.145.8333: tcp 73
05:33:40.141488 IP 167.99.216.145.8333 > tom-Latitude-3570.57976: tcp 0
05:33:40.147254 IP 167.99.216.145.8333 > tom-Latitude-3570.57976: tcp 0
05:33:40.152443 IP 167.99.216.145.8333 > tom-Latitude-3570.57976: tcp 24
05:33:40.152460 IP tom-Latitude-3570.57976 > 167.99.216.145.8333: tcp 0
05:33:40.153484 IP 167.99.216.145.8333 > tom-Latitude-3570.57976: tcp 73
05:33:40.153501 IP tom-Latitude-3570.57976 > 167.99.216.145.8333: tcp 0
05:33:40.209446 IP 81.198.101.144.8333 > tom-Latitude-3570.60988: tcp 24
05:33:40.210432 IP 81.198.101.144.8333 > tom-Latitude-3570.60988: tcp 284
05:33:40.210439 IP 81.198.101.144.8333 > tom-Latitude-3570.60988: tcp 24
05:33:40.210442 IP 81.198.101.144.8333 > tom-Latitude-3570.60988: tcp 284
05:33:40.210445 IP 81.198.101.144.8333 > tom-Latitude-3570.60988: tcp 24
