00:09:24.178417 IP tom-Latitude-3570.39282 > default-rdns.vocus.co.nz.8333: tcp 24
00:09:24.179381 IP tom-Latitude-3570.39282 > default-rdns.vocus.co.nz.8333: tcp 8
00:09:24.223991 IP default-rdns.vocus.co.nz.8333 > tom-Latitude-3570.39282: tcp 0
00:09:24.228678 IP 81.198.101.144.8333 > tom-Latitude-3570.60988: tcp 24
00:09:24.237640 IP 81.198.101.144.8333 > tom-Latitude-3570.60988: tcp 8
00:09:24.237770 IP tom-Latitude-3570.60988 > 81.198.101.144.8333: tcp 0
00:09:24.237899 IP tom-Latitude-3570.60988 > 81.198.101.144.8333: tcp 24
00:09:24.239324 IP tom-Latitude-3570.60988 > 81.198.101.144.8333: tcp 8
00:09:24.241112 IP ns3113832.ip-54-38-177.eu.8333 > tom-Latitude-3570.56714: tcp 24
00:09:24.244607 IP ns3113832.ip-54-38-177.eu.8333 > tom-Latitude-3570.56714: tcp 181
00:09:24.244740 IP tom-Latitude-3570.56714 > ns3113832.ip-54-38-177.eu.8333: tcp 0
00:09:24.281167 IP 81.198.101.144.8333 > tom-Latitude-3570.60988: tcp 0
00:09:24.281181 IP 81.198.101.144.8333 > tom-Latitude-3570.60988: tcp 0
00:09:24.345414 IP tom-Latitude-3570.39110 > vmi195435.contaboserver.net.8333: tcp 24
00:09:24.385025 IP default-rdns.vocus.co.nz.8333 > tom-Latitude-3570.39282: tcp 24
00:09:24.385044 IP default-rdns.vocus.co.nz.8333 > tom-Latitude-3570.39282: tcp 8
00:09:24.385136 IP tom-Latitude-3570.39282 > default-rdns.vocus.co.nz.8333: tcp 0
00:09:24.385268 IP tom-Latitude-3570.39282 > default-rdns.vocus.co.nz.8333: tcp 24
00:09:24.386459 IP default-rdns.vocus.co.nz.8333 > tom-Latitude-3570.39282: tcp 8
00:09:24.386483 IP tom-Latitude-3570.39282 > default-rdns.vocus.co.nz.8333: tcp 8
00:09:24.390508 IP tom-Latitude-3570.39110 > vmi195435.contaboserver.net.8333: tcp 37
00:09:24.422436 IP vmi195435.contaboserver.net.8333 > tom-Latitude-3570.39110: tcp 0
00:09:24.431884 IP default-rdns.vocus.co.nz.8333 > tom-Latitude-3570.39282: tcp 0
00:09:24.548764 IP default-rdns.vocus.co.nz.8333 > tom-Latitude-3570.39282: tcp 24
00:09:24.549388 IP default-rdns.vocus.co.nz.8333 > tom-Latitude-3570.39282: tcp 8
00:09:24.549502 IP tom-Latitude-3570.39282 > default-rdns.vocus.co.nz.8333: tcp 0
00:09:24.750376 IP tom-Latitude-3570.60988 > 81.198.101.144.8333: tcp 24
00:09:24.751347 IP tom-Latitude-3570.60988 > 81.198.101.144.8333: tcp 217
00:09:24.774539 IP 167.99.216.145.8333 > tom-Latitude-3570.57976: tcp 24
00:09:24.775191 IP 167.99.216.145.8333 > tom-Latitude-3570.57976: tcp 37
00:09:24.775321 IP tom-Latitude-3570.57976 > 167.99.216.145.8333: tcp 0
00:09:24.784367 IP 81.198.101.144.8333 > tom-Latitude-3570.60988: tcp 0
00:09:24.793157 IP 81.198.101.144.8333 > tom-Latitude-3570.60988: tcp 0
00:09:24.820935 IP 81.198.101.144.8333 > tom-Latitude-3570.60988: tcp 24
00:09:24.821662 IP 81.198.101.144.8333 > tom-Latitude-3570.60988: tcp 31
00:09:24.821791 IP tom-Latitude-3570.60988 > 81.198.101.144.8333: tcp 0
00:09:25.123038 IP tom-Latitude-3570.42516 > 2.56.9.15.8333: tcp 24
00:09:25.123934 IP tom-Latitude-3570.42516 > 2.56.9.15.8333: tcp 181
00:09:25.171598 IP 2.56.9.15.8333 > tom-Latitude-3570.42516: tcp 0
00:09:25.180490 IP 2.56.9.15.8333 > tom-Latitude-3570.42516: tcp 0
00:09:25.424070 IP tom-Latitude-3570.57976 > 167.99.216.145.8333: tcp 24
00:09:25.489254 IP tom-Latitude-3570.57976 > 167.99.216.145.8333: tcp 8
00:09:25.534035 IP 167.99.216.145.8333 > tom-Latitude-3570.57976: tcp 0
00:09:25.541996 IP 167.99.216.145.8333 > tom-Latitude-3570.57976: tcp 0
00:09:25.613716 IP 167.99.216.145.8333 > tom-Latitude-3570.57976: tcp 24
00:09:25.613734 IP 167.99.216.145.8333 > tom-Latitude-3570.57976: tcp 8
00:09:25.613782 IP tom-Latitude-3570.57976 > 167.99.216.145.8333: tcp 0
00:09:25.814595 IP tom-Latitude-3570.60470 > bb42-60-217-183.singnet.com.sg.8333: tcp 24
00:09:25.815512 IP tom-Latitude-3570.60470 > bb42-60-217-183.singnet.com.sg.8333: tcp 8
00:09:25.845178 IP bb42-60-217-183.singnet.com.sg.8333 > tom-Latitude-3570.60470: tcp 0
00:09:25.855654 IP bb42-60-217-183.singnet.com.sg.8333 > tom-Latitude-3570.60470: tcp 0
00:09:25.910536 IP bb42-60-217-183.singnet.com.sg.8333 > tom-Latitude-3570.60470: tcp 24
00:09:25.910553 IP tom-Latitude-3570.60470 > bb42-60-217-183.singnet.com.sg.8333: tcp 0
00:09:25.915035 IP tom-Latitude-3570.56714 > ns3113832.ip-54-38-177.eu.8333: tcp 24
00:09:25.915554 IP bb42-60-217-183.singnet.com.sg.8333 > tom-Latitude-3570.60470: tcp 8
00:09:25.915571 IP tom-Latitude-3570.60470 > bb42-60-217-183.singnet.com.sg.8333: tcp 0
00:09:25.915781 IP tom-Latitude-3570.60470 > bb42-60-217-183.singnet.com.sg.8333: tcp 24
00:09:25.916217 IP tom-Latitude-3570.56714 > ns3113832.ip-54-38-177.eu.8333: tcp 37
00:09:25.916834 IP tom-Latitude-3570.60470 > bb42-60-217-183.singnet.com.sg.8333: tcp 8
00:09:25.941904 IP ns3113832.ip-54-38-177.eu.8333 > tom-Latitude-3570.56714: tcp 0
00:09:25.944334 IP bb42-60-217-183.singnet.com.sg.8333 > tom-Latitude-3570.60470: tcp 0
00:09:25.944349 IP bb42-60-217-183.singnet.com.sg.8333 > tom-Latitude-3570.60470: tcp 0
00:09:25.954514 IP vmi195435.contaboserver.net.8333 > tom-Latitude-3570.39110: tcp 24
00:09:25.954534 IP vmi195435.contaboserver.net.8333 > tom-Latitude-3570.39110: tcp 73
00:09:25.954576 IP tom-Latitude-3570.39110 > vmi195435.contaboserver.net.8333: tcp 0
00:09:25.954781 IP tom-Latitude-3570.39110 > vmi195435.contaboserver.net.8333: tcp 24
00:09:25.954858 IP tom-Latitude-3570.60470 > bb42-60-217-183.singnet.com.sg.8333: tcp 24
00:09:25.956129 IP tom-Latitude-3570.60470 > bb42-60-217-183.singnet.com.sg.8333: tcp 37
00:09:25.956140 IP tom-Latitude-3570.39110 > vmi195435.contaboserver.net.8333: tcp 73
00:09:25.993635 IP bb42-60-217-183.singnet.com.sg.8333 > tom-Latitude-3570.60470: tcp 0
00:09:25.995892 IP vmi195435.contaboserver.net.8333 > tom-Latitude-3570.39110: tcp 0
00:09:25.995906 IP bb42-60-217-183.singnet.com.sg.8333 > tom-Latitude-3570.60470: tcp 0
00:09:26.071890 IP vmi195435.contaboserver.net.8333 > tom-Latitude-3570.39110: tcp 24
00:09:26.072599 IP vmi195435.contaboserver.net.8333 > tom-Latitude-3570.39110: tcp 223
00:09:26.072617 IP vmi195435.contaboserver.net.8333 > tom-Latitude-3570.39110: tcp 24
00:09:26.072621 IP vmi195435.contaboserver.net.8333 > tom-Latitude-3570.39110: tcp 225
00:09:26.072660 IP tom-Latitude-3570.39110 > vmi195435.contaboserver.net.8333: tcp 0
00:09:26.231715 IP bb42-60-217-183.singnet.com.sg.8333 > tom-Latitude-3570.60470: tcp 24
00:09:26.232315 IP bb42-60-217-183.singnet.com.sg.8333 > tom-Latitude-3570.60470: tcp 8
00:09:26.232378 IP tom-Latitude-3570.60470 > bb42-60-217-183.singnet.com.sg.8333: tcp 0
00:09:26.734222 IP tom-Latitude-3570.56714 > ns3113832.ip-54-38-177.eu.8333: tcp 24
00:09:26.734970 IP tom-Latitude-3570.56714 > ns3113832.ip-54-38-177.eu.8333: tcp 73
00:09:26.792025 IP ns3113832.ip-54-38-177.eu.8333 > tom-Latitude-3570.56714: tcp 0
00:09:26.967708 IP 167.99.216.145.8333 > tom-Latitude-3570.57976: tcp 24
00:09:26.976640 IP 167.99.216.145.8333 > tom-Latitude-3570.57976: tcp 8
00:09:26.976704 IP tom-Latitude-3570.57976 > 167.99.216.145.8333: tcp 0
00:09:26.976843 IP tom-Latitude-3570.57976 > 167.99.216.145.8333: tcp 24
00:09:26.977685 IP tom-Latitude-3570.57976 > 167.99.216.145.8333: tcp 8
00:09:27.022512 IP 167.99.216.145.8333 > tom-Latitude-3570.57976: tcp 0
00:09:27.023208 IP 167.99.216.145.8333 > tom-Latitude-3570.57976: tcp 0
00:09:27.177620 IP tom-Latitude-3570.49070 > c-185-45-236-223.customer.ggaweb.ch.8333: tcp 24
00:09:27.177707 IP tom-Latitude-3570.57976 > 167.99.216.145.8333: tcp 24
00:09:27.178590 IP tom-Latitude-3570.57976 > 167.99.216.145.8333: tcp 73
00:09:27.178602 IP tom-Latitude-3570.49070 > c-185-45-236-223.customer.ggaweb.ch.8333: tcp 109
00:09:27.227931 IP 167.99.216.145.8333 > tom-Latitude-3570.57976: tcp 0
00:09:27.228592 IP 167.99.216.145.8333 > tom-Latitude-3570.57976: tcp 0
00:09:27.228606 IP c-185-45-236-223.customer.ggaweb.ch.8333 > tom-Latitude-3570.49070: tcp 0
00:09:27.925641 IP 167.99.216.145.8333 > tom-Latitude-3570.57976: tcp 24
00:09:27.926384 IP 167.99.216.145.8333 > tom-Latitude-3570.57976: tcp 217
00:09:27.926403 IP bb42-60-217-183.singnet.com.sg.8333 > tom-Latitude-3570.60470: tcp 24
00:09:27.926408 IP bb42-60-217-183.singnet.com.sg.8333 > tom-Latitude-3570.60470: tcp 289
00:09:27.926413 IP 167.99.216.145.8333 > tom-Latitude-3570.57976: tcp 217
00:09:27.926423 IP tom-Latitude-3570.57976 > 167.99.216.145.8333: tcp 0
00:09:27.926439 IP bb42-60-217-183.singnet.com.sg.8333 > tom-Latitude-3570.60470: tcp 289
00:09:27.926441 IP tom-Latitude-3570.60470 > bb42-60-217-183.singnet.com.sg.8333: tcp 0
00:09:27.926693 IP tom-Latitude-3570.57976 > 167.99.216.145.8333: tcp 24
00:09:27.927836 IP tom-Latitude-3570.57976 > 167.99.216.145.8333: tcp 217
00:09:27.969731 IP 167.99.216.145.8333 > tom-Latitude-3570.57976: tcp 0
00:09:27.970332 IP 167.99.216.145.8333 > tom-Latitude-3570.57976: tcp 0
00:09:28.039151 IP 167.99.216.145.8333 > tom-Latitude-3570.57976: tcp 24
00:09:28.039836 IP 167.99.216.145.8333 > tom-Latitude-3570.57976: tcp 372
00:09:28.039845 IP 167.99.216.145.8333 > tom-Latitude-3570.57976: tcp 24
00:09:28.039849 IP 167.99.216.145.8333 > tom-Latitude-3570.57976: tcp 225
00:09:28.039852 IP 167.99.216.145.8333 > tom-Latitude-3570.57976: tcp 24
00:09:28.039855 IP 167.99.216.145.8333 > tom-Latitude-3570.57976: tcp 190
00:09:28.039858 IP 167.99.216.145.8333 > tom-Latitude-3570.57976: tcp 24
00:09:28.039860 IP 167.99.216.145.8333 > tom-Latitude-3570.57976: tcp 223
00:09:28.039862 IP 167.99.216.145.8333 > tom-Latitude-3570.57976: tcp 24
00:09:28.039864 IP 167.99.216.145.8333 > tom-Latitude-3570.57976: tcp 225
00:09:28.039873 IP tom-Latitude-3570.57976 > 167.99.216.145.8333: tcp 0
00:09:28.039933 IP tom-Latitude-3570.57976 > 167.99.216.145.8333: tcp 0
00:09:28.094779 IP 167.99.216.145.8333 > tom-Latitude-3570.57976: tcp 214
00:09:28.135742 IP tom-Latitude-3570.57976 > 167.99.216.145.8333: tcp 0
00:09:28.295637 IP tom-Latitude-3570.49070 > c-185-45-236-223.customer.ggaweb.ch.8333: tcp 24
00:09:28.295708 IP tom-Latitude-3570.56714 > ns3113832.ip-54-38-177.eu.8333: tcp 24
00:09:28.295770 IP tom-Latitude-3570.42516 > 2.56.9.15.8333: tcp 24
00:09:28.296624 IP tom-Latitude-3570.42516 > 2.56.9.15.8333: tcp 289
00:09:28.296633 IP tom-Latitude-3570.56714 > ns3113832.ip-54-38-177.eu.8333: tcp 217
00:09:28.296636 IP tom-Latitude-3570.49070 > c-185-45-236-223.customer.ggaweb.ch.8333: tcp 217
00:09:28.340330 IP 2.56.9.15.8333 > tom-Latitude-3570.42516: tcp 0
00:09:28.342975 IP 2.56.9.15.8333 > tom-Latitude-3570.42516: tcp 0
00:09:28.342988 IP ns3113832.ip-54-38-177.eu.8333 > tom-Latitude-3570.56714: tcp 0
00:09:28.342992 IP c-185-45-236-223.customer.ggaweb.ch.8333 > tom-Latitude-3570.49070: tcp 0
00:09:28.882328 IP 167.99.216.145.8333 > tom-Latitude-3570.57976: tcp 24
00:09:28.882354 IP tom-Latitude-3570.57976 > 167.99.216.145.8333: tcp 0
00:09:28.882372 IP 167.99.216.145.8333 > tom-Latitude-3570.57976: tcp 145
00:09:28.882377 IP tom-Latitude-3570.57976 > 167.99.216.145.8333: tcp 0
00:09:28.882595 IP tom-Latitude-3570.57976 > 167.99.216.145.8333: tcp 24
00:09:28.885362 IP tom-Latitude-3570.57976 > 167.99.216.145.8333: tcp 145
00:09:28.911992 IP 167.99.216.145.8333 > tom-Latitude-3570.57976: tcp 0
00:09:28.912006 IP 167.99.216.145.8333 > tom-Latitude-3570.57976: tcp 0
00:09:28.974974 IP 167.99.216.145.8333 > tom-Latitude-3570.57976: tcp 24
00:09:28.975752 IP 167.99.216.145.8333 > tom-Latitude-3570.57976: tcp 226
00:09:28.975769 IP 167.99.216.145.8333 > tom-Latitude-3570.57976: tcp 24
00:09:28.975772 IP 167.99.216.145.8333 > tom-Latitude-3570.57976: tcp 224
00:09:28.975775 IP 167.99.216.145.8333 > tom-Latitude-3570.57976: tcp 24
00:09:28.975778 IP 167.99.216.145.8333 > tom-Latitude-3570.57976: tcp 224
00:09:28.975782 IP 167.99.216.145.8333 > tom-Latitude-3570.57976: tcp 24
00:09:28.975784 IP 167.99.216.145.8333 > tom-Latitude-3570.57976: tcp 520
00:09:28.975821 IP tom-Latitude-3570.57976 > 167.99.216.145.8333: tcp 0
00:09:28.987870 IP vmi195435.contaboserver.net.8333 > tom-Latitude-3570.39110: tcp 24
00:09:28.987898 IP vmi195435.contaboserver.net.8333 > tom-Latitude-3570.39110: tcp 433
00:09:28.987928 IP tom-Latitude-3570.39110 > vmi195435.contaboserver.net.8333: tcp 0
00:09:28.988184 IP tom-Latitude-3570.39110 > vmi195435.contaboserver.net.8333: tcp 24
00:09:28.989450 IP tom-Latitude-3570.39110 > vmi195435.contaboserver.net.8333: tcp 73
00:09:29.075298 IP vmi195435.contaboserver.net.8333 > tom-Latitude-3570.39110: tcp 0
00:09:29.088690 IP tom-Latitude-3570.60988 > 81.198.101.144.8333: tcp 24
00:09:29.088798 IP tom-Latitude-3570.39282 > default-rdns.vocus.co.nz.8333: tcp 24
00:09:29.090149 IP tom-Latitude-3570.39282 > default-rdns.vocus.co.nz.8333: tcp 613
00:09:29.090161 IP tom-Latitude-3570.60988 > 81.198.101.144.8333: tcp 433
00:09:29.105312 IP c-185-45-236-223.customer.ggaweb.ch.8333 > tom-Latitude-3570.49070: tcp 24
00:09:29.105997 IP c-185-45-236-223.customer.ggaweb.ch.8333 > tom-Latitude-3570.49070: tcp 145
00:09:29.106085 IP tom-Latitude-3570.49070 > c-185-45-236-223.customer.ggaweb.ch.8333: tcp 0
00:09:29.110995 IP vmi195435.contaboserver.net.8333 > tom-Latitude-3570.39110: tcp 24
00:09:29.111014 IP vmi195435.contaboserver.net.8333 > tom-Latitude-3570.39110: tcp 437
00:09:29.111020 IP vmi195435.contaboserver.net.8333 > tom-Latitude-3570.39110: tcp 24
00:09:29.111023 IP vmi195435.contaboserver.net.8333 > tom-Latitude-3570.39110: tcp 247
00:09:29.111057 IP tom-Latitude-3570.39110 > vmi195435.contaboserver.net.8333: tcp 0
00:09:29.141911 IP 81.198.101.144.8333 > tom-Latitude-3570.60988: tcp 0
00:09:29.141925 IP default-rdns.vocus.co.nz.8333 > tom-Latitude-3570.39282: tcp 0
00:09:29.315015 IP tom-Latitude-3570.60470 > bb42-60-217-183.singnet.com.sg.8333: tcp 24
00:09:29.315990 IP tom-Latitude-3570.60470 > bb42-60-217-183.singnet.com.sg.8333: tcp 217
00:09:29.351788 IP bb42-60-217-183.singnet.com.sg.8333 > tom-Latitude-3570.60470: tcp 0
00:09:29.367700 IP bb42-60-217-183.singnet.com.sg.8333 > tom-Latitude-3570.60470: tcp 0
00:09:29.375705 IP default-rdns.vocus.co.nz.8333 > tom-Latitude-3570.39282: tcp 24
00:09:29.376529 IP default-rdns.vocus.co.nz.8333 > tom-Latitude-3570.39282: tcp 613
00:09:29.376663 IP tom-Latitude-3570.39282 > default-rdns.vocus.co.nz.8333: tcp 0
00:09:29.477274 IP tom-Latitude-3570.60988 > 81.198.101.144.8333: tcp 24
00:09:29.478260 IP tom-Latitude-3570.60988 > 81.198.101.144.8333: tcp 73
00:09:29.511370 IP 81.198.101.144.8333 > tom-Latitude-3570.60988: tcp 0
00:09:29.778373 IP tom-Latitude-3570.42516 > 2.56.9.15.8333: tcp 24
00:09:29.779366 IP tom-Latitude-3570.42516 > 2.56.9.15.8333: tcp 217
00:09:29.824775 IP 2.56.9.15.8333 > tom-Latitude-3570.42516: tcp 0
00:09:29.832692 IP 2.56.9.15.8333 > tom-Latitude-3570.42516: tcp 0
00:09:29.878801 IP tom-Latitude-3570.49070 > c-185-45-236-223.customer.ggaweb.ch.8333: tcp 24
00:09:29.878851 IP tom-Latitude-3570.57976 > 167.99.216.145.8333: tcp 24
00:09:29.879766 IP tom-Latitude-3570.57976 > 167.99.216.145.8333: tcp 73
00:09:29.879777 IP tom-Latitude-3570.49070 > c-185-45-236-223.customer.ggaweb.ch.8333: tcp 73
00:09:29.947949 IP 167.99.216.145.8333 > tom-Latitude-3570.57976: tcp 0
00:09:29.947968 IP 167.99.216.145.8333 > tom-Latitude-3570.57976: tcp 0
00:09:29.947971 IP c-185-45-236-223.customer.ggaweb.ch.8333 > tom-Latitude-3570.49070: tcp 0
00:09:30.280079 IP tom-Latitude-3570.56714 > ns3113832.ip-54-38-177.eu.8333: tcp 24
00:09:30.281011 IP tom-Latitude-3570.56714 > ns3113832.ip-54-38-177.eu.8333: tcp 217
00:09:30.355300 IP ns3113832.ip-54-38-177.eu.8333 > tom-Latitude-3570.56714: tcp 0
00:09:30.380454 IP tom-Latitude-3570.39282 > default-rdns.vocus.co.nz.8333: tcp 24
00:09:30.381390 IP tom-Latitude-3570.39282 > default-rdns.vocus.co.nz.8333: tcp 73
00:09:30.421864 IP default-rdns.vocus.co.nz.8333 > tom-Latitude-3570.39282: tcp 0
00:09:30.749258 IP default-rdns.vocus.co.nz.8333 > tom-Latitude-3570.39282: tcp 24
00:09:30.749272 IP default-rdns.vocus.co.nz.8333 > tom-Latitude-3570.39282: tcp 37
00:09:30.749288 IP tom-Latitude-3570.39282 > default-rdns.vocus.co.nz.8333: tcp 0
00:09:30.749426 IP tom-Latitude-3570.39282 > default-rdns.vocus.co.nz.8333: tcp 24
00:09:30.750176 IP tom-Latitude-3570.39282 > default-rdns.vocus.co.nz.8333: tcp 437
00:09:30.791246 IP default-rdns.vocus.co.nz.8333 > tom-Latitude-3570.39282: tcp 0
00:09:30.912072 IP c-185-45-236-223.customer.ggaweb.ch.8333 > tom-Latitude-3570.49070: tcp 24
00:09:30.919919 IP c-185-45-236-223.customer.ggaweb.ch.8333 > tom-Latitude-3570.49070: tcp 145
00:09:30.919939 IP tom-Latitude-3570.49070 > c-185-45-236-223.customer.ggaweb.ch.8333: tcp 0
00:09:30.920121 IP tom-Latitude-3570.49070 > c-185-45-236-223.customer.ggaweb.ch.8333: tcp 24
00:09:30.921324 IP tom-Latitude-3570.49070 > c-185-45-236-223.customer.ggaweb.ch.8333: tcp 145
00:09:30.951986 IP c-185-45-236-223.customer.ggaweb.ch.8333 > tom-Latitude-3570.49070: tcp 0
00:09:31.060113 IP c-185-45-236-223.customer.ggaweb.ch.8333 > tom-Latitude-3570.49070: tcp 24
00:09:31.060120 IP c-185-45-236-223.customer.ggaweb.ch.8333 > tom-Latitude-3570.49070: tcp 1084
00:09:31.060166 IP tom-Latitude-3570.49070 > c-185-45-236-223.customer.ggaweb.ch.8333: tcp 0
00:09:31.249450 IP 167.99.216.145.8333 > tom-Latitude-3570.57976: tcp 24
00:09:31.249470 IP 167.99.216.145.8333 > tom-Latitude-3570.57976: tcp 145
00:09:31.249562 IP tom-Latitude-3570.57976 > 167.99.216.145.8333: tcp 0
00:09:31.550664 IP tom-Latitude-3570.42516 > 2.56.9.15.8333: tcp 24
00:09:31.551594 IP tom-Latitude-3570.42516 > 2.56.9.15.8333: tcp 145
00:09:31.584725 IP 2.56.9.15.8333 > tom-Latitude-3570.42516: tcp 0
00:09:31.831881 IP tom-Latitude-3570.42516 > 2.56.9.15.8333: tcp 145
00:09:31.851725 IP tom-Latitude-3570.60988 > 81.198.101.144.8333: tcp 24
00:09:31.852707 IP tom-Latitude-3570.60988 > 81.198.101.144.8333: tcp 145
00:09:31.872150 IP 2.56.9.15.8333 > tom-Latitude-3570.42516: tcp 0
00:09:31.879752 IP 81.198.101.144.8333 > tom-Latitude-3570.60988: tcp 0
00:09:32.553914 IP tom-Latitude-3570.60470 > bb42-60-217-183.singnet.com.sg.8333: tcp 24
00:09:32.554822 IP tom-Latitude-3570.60470 > bb42-60-217-183.singnet.com.sg.8333: tcp 145
00:09:32.595091 IP bb42-60-217-183.singnet.com.sg.8333 > tom-Latitude-3570.60470: tcp 0
00:09:32.602104 IP bb42-60-217-183.singnet.com.sg.8333 > tom-Latitude-3570.60470: tcp 0
00:09:32.654319 IP tom-Latitude-3570.56714 > ns3113832.ip-54-38-177.eu.8333: tcp 24
00:09:32.654368 IP tom-Latitude-3570.39282 > default-rdns.vocus.co.nz.8333: tcp 24
00:09:32.655280 IP tom-Latitude-3570.39282 > default-rdns.vocus.co.nz.8333: tcp 145
00:09:32.655292 IP tom-Latitude-3570.56714 > ns3113832.ip-54-38-177.eu.8333: tcp 145
00:09:32.695474 IP ns3113832.ip-54-38-177.eu.8333 > tom-Latitude-3570.56714: tcp 0
00:09:32.695488 IP default-rdns.vocus.co.nz.8333 > tom-Latitude-3570.39282: tcp 0
00:09:32.751610 IP vmi195435.contaboserver.net.8333 > tom-Latitude-3570.39110: tcp 24
00:09:32.752404 IP vmi195435.contaboserver.net.8333 > tom-Latitude-3570.39110: tcp 217
00:09:32.752513 IP tom-Latitude-3570.39110 > vmi195435.contaboserver.net.8333: tcp 0
00:09:32.752712 IP tom-Latitude-3570.39110 > vmi195435.contaboserver.net.8333: tcp 24
00:09:32.752757 IP tom-Latitude-3570.49070 > c-185-45-236-223.customer.ggaweb.ch.8333: tcp 24
00:09:32.754014 IP tom-Latitude-3570.49070 > c-185-45-236-223.customer.ggaweb.ch.8333: tcp 31
00:09:32.754019 IP tom-Latitude-3570.39110 > vmi195435.contaboserver.net.8333: tcp 73
00:09:32.782599 IP vmi195435.contaboserver.net.8333 > tom-Latitude-3570.39110: tcp 0
00:09:32.782612 IP c-185-45-236-223.customer.ggaweb.ch.8333 > tom-Latitude-3570.49070: tcp 0
00:09:32.861222 IP vmi195435.contaboserver.net.8333 > tom-Latitude-3570.39110: tcp 24
00:09:32.862241 IP vmi195435.contaboserver.net.8333 > tom-Latitude-3570.39110: tcp 1448
00:09:32.862261 IP vmi195435.contaboserver.net.8333 > tom-Latitude-3570.39110: tcp 1448
00:09:32.862350 IP tom-Latitude-3570.39110 > vmi195435.contaboserver.net.8333: tcp 0
00:09:32.865261 IP vmi195435.contaboserver.net.8333 > tom-Latitude-3570.39110: tcp 1067
00:09:32.865779 IP vmi195435.contaboserver.net.8333 > tom-Latitude-3570.39110: tcp 24
00:09:32.865793 IP vmi195435.contaboserver.net.8333 > tom-Latitude-3570.39110: tcp 226
00:09:32.865872 IP tom-Latitude-3570.39110 > vmi195435.contaboserver.net.8333: tcp 0
00:09:32.973933 IP tom-Latitude-3570.56714 > ns3113832.ip-54-38-177.eu.8333: tcp 24
00:09:32.974960 IP tom-Latitude-3570.56714 > ns3113832.ip-54-38-177.eu.8333: tcp 73
00:09:33.016663 IP ns3113832.ip-54-38-177.eu.8333 > tom-Latitude-3570.56714: tcp 0
00:09:33.288587 IP 167.99.216.145.8333 > tom-Latitude-3570.57976: tcp 24
00:09:33.288601 IP 167.99.216.145.8333 > tom-Latitude-3570.57976: tcp 109
00:09:33.288618 IP tom-Latitude-3570.57976 > 167.99.216.145.8333: tcp 0
00:09:33.288737 IP tom-Latitude-3570.57976 > 167.99.216.145.8333: tcp 24
00:09:33.289519 IP tom-Latitude-3570.57976 > 167.99.216.145.8333: tcp 37
00:09:33.312484 IP default-rdns.vocus.co.nz.8333 > tom-Latitude-3570.39282: tcp 24
00:09:33.317728 IP default-rdns.vocus.co.nz.8333 > tom-Latitude-3570.39282: tcp 37
00:09:33.317859 IP tom-Latitude-3570.39282 > default-rdns.vocus.co.nz.8333: tcp 0
00:09:33.332813 IP 167.99.216.145.8333 > tom-Latitude-3570.57976: tcp 0
00:09:33.333389 IP 167.99.216.145.8333 > tom-Latitude-3570.57976: tcp 0
00:09:33.396482 IP 167.99.216.145.8333 > tom-Latitude-3570.57976: tcp 24
00:09:33.396501 IP 167.99.216.145.8333 > tom-Latitude-3570.57976: tcp 226
00:09:33.396595 IP tom-Latitude-3570.57976 > 167.99.216.145.8333: tcp 0
00:09:33.397000 IP tom-Latitude-3570.60470 > bb42-60-217-183.singnet.com.sg.8333: tcp 24
00:09:33.398122 IP tom-Latitude-3570.60470 > bb42-60-217-183.singnet.com.sg.8333: tcp 109
00:09:33.432982 IP bb42-60-217-183.singnet.com.sg.8333 > tom-Latitude-3570.60470: tcp 0
00:09:33.432996 IP bb42-60-217-183.singnet.com.sg.8333 > tom-Latitude-3570.60470: tcp 0
00:09:33.997820 IP vmi195435.contaboserver.net.8333 > tom-Latitude-3570.39110: tcp 24
00:09:33.998332 IP vmi195435.contaboserver.net.8333 > tom-Latitude-3570.39110: tcp 181
00:09:33.998429 IP tom-Latitude-3570.39110 > vmi195435.contaboserver.net.8333: tcp 0
00:09:33.998656 IP tom-Latitude-3570.39110 > vmi195435.contaboserver.net.8333: tcp 24
00:09:33.999988 IP tom-Latitude-3570.39110 > vmi195435.contaboserver.net.8333: tcp 145
00:09:34.041825 IP vmi195435.contaboserver.net.8333 > tom-Latitude-3570.39110: tcp 0
00:09:34.119593 IP vmi195435.contaboserver.net.8333 > tom-Latitude-3570.39110: tcp 24
00:09:34.119612 IP vmi195435.contaboserver.net.8333 > tom-Latitude-3570.39110: tcp 190
00:09:34.119616 IP vmi195435.contaboserver.net.8333 > tom-Latitude-3570.39110: tcp 24
00:09:34.119618 IP vmi195435.contaboserver.net.8333 > tom-Latitude-3570.39110: tcp 224
00:09:34.119619 IP vmi195435.contaboserver.net.8333 > tom-Latitude-3570.39110: tcp 24
00:09:34.119621 IP vmi195435.contaboserver.net.8333 > tom-Latitude-3570.39110: tcp 225
00:09:34.119623 IP vmi195435.contaboserver.net.8333 > tom-Latitude-3570.39110: tcp 24
00:09:34.119643 IP vmi195435.contaboserver.net.8333 > tom-Latitude-3570.39110: tcp 249
00:09:34.119715 IP tom-Latitude-3570.39110 > vmi195435.contaboserver.net.8333: tcp 0
00:09:34.321606 IP tom-Latitude-3570.60988 > 81.198.101.144.8333: tcp 24
00:09:34.386644 IP tom-Latitude-3570.60988 > 81.198.101.144.8333: tcp 253
00:09:34.431864 IP 81.198.101.144.8333 > tom-Latitude-3570.60988: tcp 0
00:09:34.643692 IP 167.99.216.145.8333 > tom-Latitude-3570.57976: tcp 24
00:09:34.644347 IP 167.99.216.145.8333 > tom-Latitude-3570.57976: tcp 253
00:09:34.644461 IP tom-Latitude-3570.57976 > 167.99.216.145.8333: tcp 0
00:09:34.644719 IP tom-Latitude-3570.57976 > 167.99.216.145.8333: tcp 24
00:09:34.646063 IP tom-Latitude-3570.57976 > 167.99.216.145.8333: tcp 109
00:09:34.683613 IP 167.99.216.145.8333 > tom-Latitude-3570.57976: tcp 0
00:09:34.684235 IP 167.99.216.145.8333 > tom-Latitude-3570.57976: tcp 0
00:09:34.726206 IP c-185-45-236-223.customer.ggaweb.ch.8333 > tom-Latitude-3570.49070: tcp 24
00:09:34.726226 IP c-185-45-236-223.customer.ggaweb.ch.8333 > tom-Latitude-3570.49070: tcp 289
00:09:34.726319 IP tom-Latitude-3570.49070 > c-185-45-236-223.customer.ggaweb.ch.8333: tcp 0
00:09:34.744742 IP 167.99.216.145.8333 > tom-Latitude-3570.57976: tcp 24
00:09:34.745487 IP 167.99.216.145.8333 > tom-Latitude-3570.57976: tcp 380
00:09:34.745493 IP 167.99.216.145.8333 > tom-Latitude-3570.57976: tcp 24
00:09:34.745505 IP tom-Latitude-3570.57976 > 167.99.216.145.8333: tcp 0
00:09:34.747811 IP 167.99.216.145.8333 > tom-Latitude-3570.57976: tcp 192
00:09:34.747923 IP tom-Latitude-3570.39110 > vmi195435.contaboserver.net.8333: tcp 24
00:09:34.748772 IP tom-Latitude-3570.39110 > vmi195435.contaboserver.net.8333: tcp 37
00:09:34.754273 IP 167.99.216.145.8333 > tom-Latitude-3570.57976: tcp 24
00:09:34.754403 IP tom-Latitude-3570.57976 > 167.99.216.145.8333: tcp 0
00:09:34.757019 IP 167.99.216.145.8333 > tom-Latitude-3570.57976: tcp 223
00:09:34.781570 IP vmi195435.contaboserver.net.8333 > tom-Latitude-3570.39110: tcp 0
00:09:34.799905 IP tom-Latitude-3570.57976 > 167.99.216.145.8333: tcp 0
00:09:35.158853 IP tom-Latitude-3570.56714 > ns3113832.ip-54-38-177.eu.8333: tcp 24
00:09:35.159512 IP tom-Latitude-3570.56714 > ns3113832.ip-54-38-177.eu.8333: tcp 289
00:09:35.212686 IP ns3113832.ip-54-38-177.eu.8333 > tom-Latitude-3570.56714: tcp 0
00:09:35.306280 IP 2.56.9.15.8333 > tom-Latitude-3570.42516: tcp 24
00:09:35.306300 IP 2.56.9.15.8333 > tom-Latitude-3570.42516: tcp 505
00:09:35.306392 IP tom-Latitude-3570.42516 > 2.56.9.15.8333: tcp 0
00:09:35.306685 IP tom-Latitude-3570.42516 > 2.56.9.15.8333: tcp 24
00:09:35.307917 IP tom-Latitude-3570.42516 > 2.56.9.15.8333: tcp 145
00:09:35.342724 IP 2.56.9.15.8333 > tom-Latitude-3570.42516: tcp 0
00:09:35.343276 IP 2.56.9.15.8333 > tom-Latitude-3570.42516: tcp 0
00:09:35.531143 IP 2.56.9.15.8333 > tom-Latitude-3570.42516: tcp 24
00:09:35.531162 IP 2.56.9.15.8333 > tom-Latitude-3570.42516: tcp 224
00:09:35.531166 IP 2.56.9.15.8333 > tom-Latitude-3570.42516: tcp 24
00:09:35.531168 IP 2.56.9.15.8333 > tom-Latitude-3570.42516: tcp 223
00:09:35.531169 IP 2.56.9.15.8333 > tom-Latitude-3570.42516: tcp 24
00:09:35.531171 IP 2.56.9.15.8333 > tom-Latitude-3570.42516: tcp 223
00:09:35.531191 IP 2.56.9.15.8333 > tom-Latitude-3570.42516: tcp 24
00:09:35.531192 IP 2.56.9.15.8333 > tom-Latitude-3570.42516: tcp 223
00:09:35.531194 IP 2.56.9.15.8333 > tom-Latitude-3570.42516: tcp 223
00:09:35.531206 IP tom-Latitude-3570.42516 > 2.56.9.15.8333: tcp 0
00:09:35.933637 IP tom-Latitude-3570.39110 > vmi195435.contaboserver.net.8333: tcp 24
00:09:35.934577 IP tom-Latitude-3570.39110 > vmi195435.contaboserver.net.8333: tcp 217
00:09:35.981774 IP vmi195435.contaboserver.net.8333 > tom-Latitude-3570.39110: tcp 0
00:09:36.134463 IP tom-Latitude-3570.49070 > c-185-45-236-223.customer.ggaweb.ch.8333: tcp 24
00:09:36.134617 IP tom-Latitude-3570.60470 > bb42-60-217-183.singnet.com.sg.8333: tcp 24
00:09:36.135412 IP tom-Latitude-3570.49070 > c-185-45-236-223.customer.ggaweb.ch.8333: tcp 217
00:09:36.136086 IP tom-Latitude-3570.60470 > bb42-60-217-183.singnet.com.sg.8333: tcp 397
00:09:36.172080 IP bb42-60-217-183.singnet.com.sg.8333 > tom-Latitude-3570.60470: tcp 0
00:09:36.172795 IP c-185-45-236-223.customer.ggaweb.ch.8333 > tom-Latitude-3570.49070: tcp 0
00:09:36.176576 IP bb42-60-217-183.singnet.com.sg.8333 > tom-Latitude-3570.60470: tcp 0
00:09:36.736361 IP tom-Latitude-3570.57976 > 167.99.216.145.8333: tcp 24
00:09:36.772598 IP tom-Latitude-3570.57976 > 167.99.216.145.8333: tcp 145
00:09:36.814047 IP 167.99.216.145.8333 > tom-Latitude-3570.57976: tcp 0
00:09:36.829963 IP 167.99.216.145.8333 > tom-Latitude-3570.57976: tcp 0
00:09:36.836806 IP tom-Latitude-3570.56714 > ns3113832.ip-54-38-177.eu.8333: tcp 24
00:09:36.836906 IP tom-Latitude-3570.39282 > default-rdns.vocus.co.nz.8333: tcp 24
00:09:36.849744 IP tom-Latitude-3570.39282 > default-rdns.vocus.co.nz.8333: tcp 469
00:09:36.849754 IP tom-Latitude-3570.56714 > ns3113832.ip-54-38-177.eu.8333: tcp 145
00:09:36.881958 IP ns3113832.ip-54-38-177.eu.8333 > tom-Latitude-3570.56714: tcp 0
00:09:36.884279 IP default-rdns.vocus.co.nz.8333 > tom-Latitude-3570.39282: tcp 0
00:09:36.897547 IP ns3113832.ip-54-38-177.eu.8333 > tom-Latitude-3570.56714: tcp 24
00:09:36.898089 IP ns3113832.ip-54-38-177.eu.8333 > tom-Latitude-3570.56714: tcp 325
00:09:36.898165 IP tom-Latitude-3570.56714 > ns3113832.ip-54-38-177.eu.8333: tcp 0
00:09:36.898413 IP tom-Latitude-3570.56714 > ns3113832.ip-54-38-177.eu.8333: tcp 24
00:09:36.899567 IP tom-Latitude-3570.56714 > ns3113832.ip-54-38-177.eu.8333: tcp 181
00:09:36.932170 IP ns3113832.ip-54-38-177.eu.8333 > tom-Latitude-3570.56714: tcp 0
00:09:36.990521 IP ns3113832.ip-54-38-177.eu.8333 > tom-Latitude-3570.56714: tcp 24
00:09:36.991161 IP ns3113832.ip-54-38-177.eu.8333 > tom-Latitude-3570.56714: tcp 417
00:09:36.991179 IP ns3113832.ip-54-38-177.eu.8333 > tom-Latitude-3570.56714: tcp 24
00:09:36.991294 IP tom-Latitude-3570.56714 > ns3113832.ip-54-38-177.eu.8333: tcp 0
00:09:36.998689 IP ns3113832.ip-54-38-177.eu.8333 > tom-Latitude-3570.56714: tcp 226
00:09:36.999535 IP ns3113832.ip-54-38-177.eu.8333 > tom-Latitude-3570.56714: tcp 24
00:09:36.999550 IP ns3113832.ip-54-38-177.eu.8333 > tom-Latitude-3570.56714: tcp 249
00:09:36.999552 IP ns3113832.ip-54-38-177.eu.8333 > tom-Latitude-3570.56714: tcp 24
00:09:36.999554 IP ns3113832.ip-54-38-177.eu.8333 > tom-Latitude-3570.56714: tcp 1350
00:09:36.999556 IP ns3113832.ip-54-38-177.eu.8333 > tom-Latitude-3570.56714: tcp 8
00:09:36.999575 IP ns3113832.ip-54-38-177.eu.8333 > tom-Latitude-3570.56714: tcp 24
00:09:36.999632 IP tom-Latitude-3570.56714 > ns3113832.ip-54-38-177.eu.8333: tcp 0
00:09:37.027993 IP 167.99.216.145.8333 > tom-Latitude-3570.57976: tcp 24
00:09:37.028010 IP tom-Latitude-3570.57976 > 167.99.216.145.8333: tcp 0
00:09:37.031610 IP 167.99.216.145.8333 > tom-Latitude-3570.57976: tcp 325
00:09:37.031633 IP tom-Latitude-3570.57976 > 167.99.216.145.8333: tcp 0
00:09:37.031969 IP tom-Latitude-3570.57976 > 167.99.216.145.8333: tcp 24
00:09:37.032928 IP tom-Latitude-3570.57976 > 167.99.216.145.8333: tcp 145
00:09:37.051367 IP ns3113832.ip-54-38-177.eu.8333 > tom-Latitude-3570.56714: tcp 189
00:09:37.064473 IP 167.99.216.145.8333 > tom-Latitude-3570.57976: tcp 0
00:09:37.065037 IP 167.99.216.145.8333 > tom-Latitude-3570.57976: tcp 0
00:09:37.091780 IP tom-Latitude-3570.56714 > ns3113832.ip-54-38-177.eu.8333: tcp 0
00:09:37.135888 IP 167.99.216.145.8333 > tom-Latitude-3570.57976: tcp 24
00:09:37.136761 IP 167.99.216.145.8333 > tom-Latitude-3570.57976: tcp 1448
00:09:37.136782 IP 167.99.216.145.8333 > tom-Latitude-3570.57976: tcp 68
00:09:37.136785 IP 167.99.216.145.8333 > tom-Latitude-3570.57976: tcp 24
00:09:37.136788 IP 167.99.216.145.8333 > tom-Latitude-3570.57976: tcp 223
00:09:37.136790 IP 167.99.216.145.8333 > tom-Latitude-3570.57976: tcp 24
00:09:37.136792 IP 167.99.216.145.8333 > tom-Latitude-3570.57976: tcp 226
00:09:37.136797 IP 167.99.216.145.8333 > tom-Latitude-3570.57976: tcp 24
00:09:37.136799 IP 167.99.216.145.8333 > tom-Latitude-3570.57976: tcp 223
00:09:37.136841 IP tom-Latitude-3570.57976 > 167.99.216.145.8333: tcp 0
00:09:37.137121 IP tom-Latitude-3570.60988 > 81.198.101.144.8333: tcp 24
00:09:37.139456 IP tom-Latitude-3570.60988 > 81.198.101.144.8333: tcp 433
00:09:37.173305 IP 81.198.101.144.8333 > tom-Latitude-3570.60988: tcp 0
00:09:37.242731 IP 2.56.9.15.8333 > tom-Latitude-3570.42516: tcp 24
00:09:37.242755 IP tom-Latitude-3570.42516 > 2.56.9.15.8333: tcp 0
00:09:37.242788 IP 2.56.9.15.8333 > tom-Latitude-3570.42516: tcp 217
00:09:37.242793 IP tom-Latitude-3570.42516 > 2.56.9.15.8333: tcp 0
00:09:37.243021 IP tom-Latitude-3570.39110 > vmi195435.contaboserver.net.8333: tcp 24
00:09:37.244175 IP tom-Latitude-3570.39110 > vmi195435.contaboserver.net.8333: tcp 325
00:09:37.273450 IP vmi195435.contaboserver.net.8333 > tom-Latitude-3570.39110: tcp 0
00:09:37.351768 IP vmi195435.contaboserver.net.8333 > tom-Latitude-3570.39110: tcp 24
00:09:37.354607 IP vmi195435.contaboserver.net.8333 > tom-Latitude-3570.39110: tcp 109
00:09:37.354734 IP tom-Latitude-3570.39110 > vmi195435.contaboserver.net.8333: tcp 0
00:09:37.354873 IP tom-Latitude-3570.39110 > vmi195435.contaboserver.net.8333: tcp 24
00:09:37.355593 IP tom-Latitude-3570.39110 > vmi195435.contaboserver.net.8333: tcp 720
00:09:37.390547 IP vmi195435.contaboserver.net.8333 > tom-Latitude-3570.39110: tcp 0
00:09:37.756206 IP tom-Latitude-3570.60470 > bb42-60-217-183.singnet.com.sg.8333: tcp 24
00:09:37.786076 IP tom-Latitude-3570.60470 > bb42-60-217-183.singnet.com.sg.8333: tcp 325
00:09:37.835317 IP bb42-60-217-183.singnet.com.sg.8333 > tom-Latitude-3570.60470: tcp 0
00:09:37.850151 IP bb42-60-217-183.singnet.com.sg.8333 > tom-Latitude-3570.60470: tcp 0
00:09:37.920975 IP 81.198.101.144.8333 > tom-Latitude-3570.60988: tcp 24
00:09:37.921612 IP 81.198.101.144.8333 > tom-Latitude-3570.60988: tcp 37
00:09:37.921742 IP tom-Latitude-3570.60988 > 81.198.101.144.8333: tcp 0
00:09:38.197864 IP ns3113832.ip-54-38-177.eu.8333 > tom-Latitude-3570.56714: tcp 24
00:09:38.197881 IP tom-Latitude-3570.56714 > ns3113832.ip-54-38-177.eu.8333: tcp 0
00:09:38.198563 IP ns3113832.ip-54-38-177.eu.8333 > tom-Latitude-3570.56714: tcp 145
00:09:38.198587 IP tom-Latitude-3570.56714 > ns3113832.ip-54-38-177.eu.8333: tcp 0
00:09:38.399526 IP tom-Latitude-3570.60988 > 81.198.101.144.8333: tcp 24
00:09:38.400481 IP tom-Latitude-3570.60988 > 81.198.101.144.8333: tcp 109
00:09:38.442742 IP 81.198.101.144.8333 > tom-Latitude-3570.60988: tcp 0
00:09:38.727464 IP bb42-60-217-183.singnet.com.sg.8333 > tom-Latitude-3570.60470: tcp 24
00:09:38.727490 IP tom-Latitude-3570.60470 > bb42-60-217-183.singnet.com.sg.8333: tcp 0
00:09:38.727522 IP bb42-60-217-183.singnet.com.sg.8333 > tom-Latitude-3570.60470: tcp 61
00:09:38.727525 IP tom-Latitude-3570.60470 > bb42-60-217-183.singnet.com.sg.8333: tcp 0
00:09:38.885385 IP 167.99.216.145.8333 > tom-Latitude-3570.57976: tcp 24
00:09:38.885404 IP 167.99.216.145.8333 > tom-Latitude-3570.57976: tcp 109
00:09:38.885407 IP default-rdns.vocus.co.nz.8333 > tom-Latitude-3570.39282: tcp 24
00:09:38.885410 IP default-rdns.vocus.co.nz.8333 > tom-Latitude-3570.39282: tcp 361
00:09:38.885412 IP 167.99.216.145.8333 > tom-Latitude-3570.57976: tcp 109
00:09:38.885441 IP tom-Latitude-3570.57976 > 167.99.216.145.8333: tcp 0
00:09:38.885500 IP tom-Latitude-3570.39282 > default-rdns.vocus.co.nz.8333: tcp 0
00:09:38.885741 IP tom-Latitude-3570.39282 > default-rdns.vocus.co.nz.8333: tcp 24
00:09:38.885811 IP tom-Latitude-3570.57976 > 167.99.216.145.8333: tcp 24
00:09:38.886897 IP tom-Latitude-3570.57976 > 167.99.216.145.8333: tcp 73
00:09:38.886902 IP tom-Latitude-3570.39282 > default-rdns.vocus.co.nz.8333: tcp 37
00:09:38.909553 IP c-185-45-236-223.customer.ggaweb.ch.8333 > tom-Latitude-3570.49070: tcp 24
00:09:38.910233 IP c-185-45-236-223.customer.ggaweb.ch.8333 > tom-Latitude-3570.49070: tcp 433
00:09:38.910364 IP tom-Latitude-3570.49070 > c-185-45-236-223.customer.ggaweb.ch.8333: tcp 0
00:09:38.920683 IP 167.99.216.145.8333 > tom-Latitude-3570.57976: tcp 0
00:09:38.920693 IP 167.99.216.145.8333 > tom-Latitude-3570.57976: tcp 0
00:09:38.920695 IP default-rdns.vocus.co.nz.8333 > tom-Latitude-3570.39282: tcp 0
00:09:38.975546 IP 167.99.216.145.8333 > tom-Latitude-3570.57976: tcp 24
00:09:38.976258 IP 167.99.216.145.8333 > tom-Latitude-3570.57976: tcp 225
00:09:38.976276 IP 167.99.216.145.8333 > tom-Latitude-3570.57976: tcp 24
00:09:38.976279 IP 167.99.216.145.8333 > tom-Latitude-3570.57976: tcp 247
00:09:38.976367 IP tom-Latitude-3570.57976 > 167.99.216.145.8333: tcp 0
00:09:39.239621 IP default-rdns.vocus.co.nz.8333 > tom-Latitude-3570.39282: tcp 24
00:09:39.239641 IP default-rdns.vocus.co.nz.8333 > tom-Latitude-3570.39282: tcp 1360
00:09:39.239742 IP tom-Latitude-3570.39282 > default-rdns.vocus.co.nz.8333: tcp 0
00:09:39.241496 IP default-rdns.vocus.co.nz.8333 > tom-Latitude-3570.39282: tcp 1360
00:09:39.241513 IP default-rdns.vocus.co.nz.8333 > tom-Latitude-3570.39282: tcp 1046
00:09:39.241609 IP tom-Latitude-3570.39282 > default-rdns.vocus.co.nz.8333: tcp 0
00:09:39.350248 IP tom-Latitude-3570.39110 > vmi195435.contaboserver.net.8333: tcp 24
00:09:39.351159 IP tom-Latitude-3570.39110 > vmi195435.contaboserver.net.8333: tcp 109
00:09:39.399812 IP vmi195435.contaboserver.net.8333 > tom-Latitude-3570.39110: tcp 0
00:09:40.855013 IP tom-Latitude-3570.60988 > 81.198.101.144.8333: tcp 24
00:09:40.855077 IP tom-Latitude-3570.39282 > default-rdns.vocus.co.nz.8333: tcp 24
00:09:40.855918 IP tom-Latitude-3570.39282 > default-rdns.vocus.co.nz.8333: tcp 73
00:09:40.855928 IP tom-Latitude-3570.60988 > 81.198.101.144.8333: tcp 109
00:09:40.918393 IP bb42-60-217-183.singnet.com.sg.8333 > tom-Latitude-3570.60470: tcp 24
00:09:40.918411 IP tom-Latitude-3570.60470 > bb42-60-217-183.singnet.com.sg.8333: tcp 0
00:09:40.918970 IP bb42-60-217-183.singnet.com.sg.8333 > tom-Latitude-3570.60470: tcp 253
00:09:40.918994 IP tom-Latitude-3570.60470 > bb42-60-217-183.singnet.com.sg.8333: tcp 0
00:09:40.919325 IP tom-Latitude-3570.60470 > bb42-60-217-183.singnet.com.sg.8333: tcp 24
00:09:40.920025 IP tom-Latitude-3570.60470 > bb42-60-217-183.singnet.com.sg.8333: tcp 145
00:09:40.921268 IP 81.198.101.144.8333 > tom-Latitude-3570.60988: tcp 0
00:09:40.921276 IP default-rdns.vocus.co.nz.8333 > tom-Latitude-3570.39282: tcp 0
00:09:40.952245 IP bb42-60-217-183.singnet.com.sg.8333 > tom-Latitude-3570.60470: tcp 0
00:09:40.952810 IP bb42-60-217-183.singnet.com.sg.8333 > tom-Latitude-3570.60470: tcp 0
00:09:41.367953 IP bb42-60-217-183.singnet.com.sg.8333 > tom-Latitude-3570.60470: tcp 24
00:09:41.367972 IP bb42-60-217-183.singnet.com.sg.8333 > tom-Latitude-3570.60470: tcp 250
00:09:41.367975 IP bb42-60-217-183.singnet.com.sg.8333 > tom-Latitude-3570.60470: tcp 24
00:09:41.367977 IP bb42-60-217-183.singnet.com.sg.8333 > tom-Latitude-3570.60470: tcp 247
00:09:41.367978 IP bb42-60-217-183.singnet.com.sg.8333 > tom-Latitude-3570.60470: tcp 24
00:09:41.367998 IP bb42-60-217-183.singnet.com.sg.8333 > tom-Latitude-3570.60470: tcp 252
00:09:41.368000 IP bb42-60-217-183.singnet.com.sg.8333 > tom-Latitude-3570.60470: tcp 24
00:09:41.368078 IP tom-Latitude-3570.60470 > bb42-60-217-183.singnet.com.sg.8333: tcp 0
00:09:41.368475 IP bb42-60-217-183.singnet.com.sg.8333 > tom-Latitude-3570.60470: tcp 373
00:09:41.411779 IP tom-Latitude-3570.60470 > bb42-60-217-183.singnet.com.sg.8333: tcp 0
00:09:41.569906 IP tom-Latitude-3570.49070 > c-185-45-236-223.customer.ggaweb.ch.8333: tcp 24
00:09:41.569964 IP tom-Latitude-3570.57976 > 167.99.216.145.8333: tcp 24
00:09:41.570868 IP tom-Latitude-3570.57976 > 167.99.216.145.8333: tcp 145
00:09:41.570880 IP tom-Latitude-3570.49070 > c-185-45-236-223.customer.ggaweb.ch.8333: tcp 145
00:09:41.613546 IP 167.99.216.145.8333 > tom-Latitude-3570.57976: tcp 0
00:09:41.614190 IP 167.99.216.145.8333 > tom-Latitude-3570.57976: tcp 0
00:09:41.614204 IP c-185-45-236-223.customer.ggaweb.ch.8333 > tom-Latitude-3570.49070: tcp 0
00:09:41.871080 IP tom-Latitude-3570.56714 > ns3113832.ip-54-38-177.eu.8333: tcp 24
00:09:41.877086 IP tom-Latitude-3570.56714 > ns3113832.ip-54-38-177.eu.8333: tcp 253
00:09:41.912655 IP ns3113832.ip-54-38-177.eu.8333 > tom-Latitude-3570.56714: tcp 0
00:09:42.071826 IP tom-Latitude-3570.39282 > default-rdns.vocus.co.nz.8333: tcp 24
00:09:42.072807 IP tom-Latitude-3570.39282 > default-rdns.vocus.co.nz.8333: tcp 145
00:09:42.179908 IP tom-Latitude-3570.39282 > default-rdns.vocus.co.nz.8333: tcp 145
00:09:42.182349 IP default-rdns.vocus.co.nz.8333 > tom-Latitude-3570.39282: tcp 0
00:09:42.222498 IP default-rdns.vocus.co.nz.8333 > tom-Latitude-3570.39282: tcp 0
00:09:42.304721 IP vmi195435.contaboserver.net.8333 > tom-Latitude-3570.39110: tcp 24
00:09:42.305396 IP vmi195435.contaboserver.net.8333 > tom-Latitude-3570.39110: tcp 253
00:09:42.305524 IP tom-Latitude-3570.39110 > vmi195435.contaboserver.net.8333: tcp 0
00:09:42.305740 IP tom-Latitude-3570.39110 > vmi195435.contaboserver.net.8333: tcp 24
