02:01:49.716106 IP tom-Latitude-3570.42516 > 2.56.9.15.8333: tcp 24
02:01:49.718374 IP tom-Latitude-3570.42516 > 2.56.9.15.8333: tcp 469
02:01:49.741384 IP 2.56.9.15.8333 > tom-Latitude-3570.42516: tcp 24
02:01:49.742077 IP 2.56.9.15.8333 > tom-Latitude-3570.42516: tcp 469
02:01:49.742209 IP tom-Latitude-3570.42516 > 2.56.9.15.8333: tcp 0
02:01:49.775298 IP 2.56.9.15.8333 > tom-Latitude-3570.42516: tcp 0
02:01:50.385078 IP vmi195435.contaboserver.net.8333 > tom-Latitude-3570.39110: tcp 24
02:01:50.385094 IP tom-Latitude-3570.39110 > vmi195435.contaboserver.net.8333: tcp 0
02:01:50.385112 IP vmi195435.contaboserver.net.8333 > tom-Latitude-3570.39110: tcp 109
02:01:50.385117 IP tom-Latitude-3570.39110 > vmi195435.contaboserver.net.8333: tcp 0
02:01:50.385119 IP ns3113832.ip-54-38-177.eu.8333 > tom-Latitude-3570.56714: tcp 24
02:01:50.385122 IP tom-Latitude-3570.56714 > ns3113832.ip-54-38-177.eu.8333: tcp 0
02:01:50.385143 IP ns3113832.ip-54-38-177.eu.8333 > tom-Latitude-3570.56714: tcp 217
02:01:50.385146 IP tom-Latitude-3570.56714 > ns3113832.ip-54-38-177.eu.8333: tcp 0
02:01:50.385149 IP ns3113832.ip-54-38-177.eu.8333 > tom-Latitude-3570.56714: tcp 217
02:01:50.385152 IP tom-Latitude-3570.56714 > ns3113832.ip-54-38-177.eu.8333: tcp 0
02:01:50.385155 IP 167.99.216.145.8333 > tom-Latitude-3570.57976: tcp 24
02:01:50.385159 IP 167.99.216.145.8333 > tom-Latitude-3570.57976: tcp 181
02:01:50.385227 IP tom-Latitude-3570.57976 > 167.99.216.145.8333: tcp 0
02:01:50.385411 IP tom-Latitude-3570.39110 > vmi195435.contaboserver.net.8333: tcp 24
02:01:50.385576 IP tom-Latitude-3570.57976 > 167.99.216.145.8333: tcp 24
02:01:50.386546 IP tom-Latitude-3570.57976 > 167.99.216.145.8333: tcp 73
02:01:50.386552 IP tom-Latitude-3570.39110 > vmi195435.contaboserver.net.8333: tcp 109
02:01:50.426713 IP 167.99.216.145.8333 > tom-Latitude-3570.57976: tcp 0
02:01:50.427313 IP vmi195435.contaboserver.net.8333 > tom-Latitude-3570.39110: tcp 0
02:01:50.427319 IP 167.99.216.145.8333 > tom-Latitude-3570.57976: tcp 0
02:01:50.427321 IP vmi195435.contaboserver.net.8333 > tom-Latitude-3570.39110: tcp 0
02:01:50.485916 IP tom-Latitude-3570.46284 > static-87-75-105-186.vodafonexdsl.co.uk.8333: tcp 24
02:01:50.486723 IP tom-Latitude-3570.46284 > static-87-75-105-186.vodafonexdsl.co.uk.8333: tcp 649
02:01:50.490036 IP 167.99.216.145.8333 > tom-Latitude-3570.57976: tcp 24
02:01:50.490772 IP 167.99.216.145.8333 > tom-Latitude-3570.57976: tcp 336
02:01:50.490779 IP 167.99.216.145.8333 > tom-Latitude-3570.57976: tcp 24
02:01:50.490781 IP 167.99.216.145.8333 > tom-Latitude-3570.57976: tcp 225
02:01:50.490789 IP tom-Latitude-3570.57976 > 167.99.216.145.8333: tcp 0
02:01:50.504814 IP vmi195435.contaboserver.net.8333 > tom-Latitude-3570.39110: tcp 24
02:01:50.505641 IP vmi195435.contaboserver.net.8333 > tom-Latitude-3570.39110: tcp 517
02:01:50.505647 IP vmi195435.contaboserver.net.8333 > tom-Latitude-3570.39110: tcp 24
02:01:50.505650 IP vmi195435.contaboserver.net.8333 > tom-Latitude-3570.39110: tcp 249
02:01:50.505651 IP vmi195435.contaboserver.net.8333 > tom-Latitude-3570.39110: tcp 24
02:01:50.505653 IP vmi195435.contaboserver.net.8333 > tom-Latitude-3570.39110: tcp 281
02:01:50.505656 IP tom-Latitude-3570.39110 > vmi195435.contaboserver.net.8333: tcp 0
02:01:50.505690 IP tom-Latitude-3570.39110 > vmi195435.contaboserver.net.8333: tcp 0
02:01:50.506415 IP tom-Latitude-3570.39110 > vmi195435.contaboserver.net.8333: tcp 24
02:01:50.507142 IP tom-Latitude-3570.39110 > vmi195435.contaboserver.net.8333: tcp 73
02:01:50.528742 IP static-87-75-105-186.vodafonexdsl.co.uk.8333 > tom-Latitude-3570.46284: tcp 0
02:01:50.528756 IP static-87-75-105-186.vodafonexdsl.co.uk.8333 > tom-Latitude-3570.46284: tcp 0
02:01:50.534721 IP vmi195435.contaboserver.net.8333 > tom-Latitude-3570.39110: tcp 0
02:01:50.541333 IP vmi195435.contaboserver.net.8333 > tom-Latitude-3570.39110: tcp 0
02:01:50.620632 IP vmi195435.contaboserver.net.8333 > tom-Latitude-3570.39110: tcp 24
02:01:50.621183 IP vmi195435.contaboserver.net.8333 > tom-Latitude-3570.39110: tcp 37
02:01:50.621306 IP tom-Latitude-3570.39110 > vmi195435.contaboserver.net.8333: tcp 0
02:01:50.621425 IP tom-Latitude-3570.39110 > vmi195435.contaboserver.net.8333: tcp 24
02:01:50.622903 IP tom-Latitude-3570.39110 > vmi195435.contaboserver.net.8333: tcp 336
02:01:50.658474 IP vmi195435.contaboserver.net.8333 > tom-Latitude-3570.39110: tcp 0
02:01:50.659180 IP vmi195435.contaboserver.net.8333 > tom-Latitude-3570.39110: tcp 0
02:01:50.822296 IP tom-Latitude-3570.56714 > ns3113832.ip-54-38-177.eu.8333: tcp 24
02:01:50.824314 IP tom-Latitude-3570.56714 > ns3113832.ip-54-38-177.eu.8333: tcp 145
02:01:50.824845 IP ns3113832.ip-54-38-177.eu.8333 > tom-Latitude-3570.56714: tcp 24
02:01:50.824863 IP tom-Latitude-3570.56714 > ns3113832.ip-54-38-177.eu.8333: tcp 0
02:01:50.824879 IP ns3113832.ip-54-38-177.eu.8333 > tom-Latitude-3570.56714: tcp 73
02:01:50.824881 IP tom-Latitude-3570.56714 > ns3113832.ip-54-38-177.eu.8333: tcp 0
02:01:50.882850 IP ns3113832.ip-54-38-177.eu.8333 > tom-Latitude-3570.56714: tcp 0
02:01:50.882865 IP ns3113832.ip-54-38-177.eu.8333 > tom-Latitude-3570.56714: tcp 0
02:01:50.925041 IP ns3113832.ip-54-38-177.eu.8333 > tom-Latitude-3570.56714: tcp 24
02:01:50.925058 IP tom-Latitude-3570.56714 > ns3113832.ip-54-38-177.eu.8333: tcp 0
02:01:50.925670 IP ns3113832.ip-54-38-177.eu.8333 > tom-Latitude-3570.56714: tcp 73
02:01:50.925687 IP tom-Latitude-3570.56714 > ns3113832.ip-54-38-177.eu.8333: tcp 0
02:01:50.925955 IP tom-Latitude-3570.56714 > ns3113832.ip-54-38-177.eu.8333: tcp 24
02:01:50.926912 IP tom-Latitude-3570.56714 > ns3113832.ip-54-38-177.eu.8333: tcp 585
02:01:50.957667 IP ns3113832.ip-54-38-177.eu.8333 > tom-Latitude-3570.56714: tcp 0
02:01:50.959120 IP ns3113832.ip-54-38-177.eu.8333 > tom-Latitude-3570.56714: tcp 0
02:01:51.026391 IP tom-Latitude-3570.46284 > static-87-75-105-186.vodafonexdsl.co.uk.8333: tcp 24
02:01:51.027331 IP tom-Latitude-3570.46284 > static-87-75-105-186.vodafonexdsl.co.uk.8333: tcp 181
02:01:51.059546 IP static-87-75-105-186.vodafonexdsl.co.uk.8333 > tom-Latitude-3570.46284: tcp 0
02:01:51.066342 IP static-87-75-105-186.vodafonexdsl.co.uk.8333 > tom-Latitude-3570.46284: tcp 0
02:01:51.133607 IP static-87-75-105-186.vodafonexdsl.co.uk.8333 > tom-Latitude-3570.46284: tcp 24
02:01:51.134178 IP static-87-75-105-186.vodafonexdsl.co.uk.8333 > tom-Latitude-3570.46284: tcp 37
02:01:51.134308 IP tom-Latitude-3570.46284 > static-87-75-105-186.vodafonexdsl.co.uk.8333: tcp 0
02:01:51.134455 IP tom-Latitude-3570.46284 > static-87-75-105-186.vodafonexdsl.co.uk.8333: tcp 24
02:01:51.138610 IP tom-Latitude-3570.46284 > static-87-75-105-186.vodafonexdsl.co.uk.8333: tcp 336
02:01:51.167673 IP static-87-75-105-186.vodafonexdsl.co.uk.8333 > tom-Latitude-3570.46284: tcp 0
02:01:51.175528 IP static-87-75-105-186.vodafonexdsl.co.uk.8333 > tom-Latitude-3570.46284: tcp 0
02:01:51.535938 IP tom-Latitude-3570.42516 > 2.56.9.15.8333: tcp 24
02:01:51.538168 IP tom-Latitude-3570.42516 > 2.56.9.15.8333: tcp 181
02:01:51.538691 IP 167.99.216.145.8333 > tom-Latitude-3570.57976: tcp 24
02:01:51.538709 IP 167.99.216.145.8333 > tom-Latitude-3570.57976: tcp 37
02:01:51.538820 IP tom-Latitude-3570.57976 > 167.99.216.145.8333: tcp 0
02:01:51.538982 IP tom-Latitude-3570.57976 > 167.99.216.145.8333: tcp 24
02:01:51.545199 IP tom-Latitude-3570.57976 > 167.99.216.145.8333: tcp 37
02:01:51.556286 IP 167.99.216.145.8333 > tom-Latitude-3570.57976: tcp 37
02:01:51.556305 IP tom-Latitude-3570.57976 > 167.99.216.145.8333: tcp 0
02:01:51.577749 IP 2.56.9.15.8333 > tom-Latitude-3570.42516: tcp 0
02:01:51.578292 IP 167.99.216.145.8333 > tom-Latitude-3570.57976: tcp 0
02:01:51.585713 IP 167.99.216.145.8333 > tom-Latitude-3570.57976: tcp 0
02:01:51.940474 IP tom-Latitude-3570.60988 > 81.198.101.144.8333: tcp 24
02:01:51.940534 IP tom-Latitude-3570.60470 > bb42-60-217-183.singnet.com.sg.8333: tcp 24
02:01:51.942747 IP tom-Latitude-3570.60470 > bb42-60-217-183.singnet.com.sg.8333: tcp 181
02:01:51.942758 IP tom-Latitude-3570.60988 > 81.198.101.144.8333: tcp 181
02:01:51.943272 IP vmi195435.contaboserver.net.8333 > tom-Latitude-3570.39110: tcp 24
02:01:51.943290 IP vmi195435.contaboserver.net.8333 > tom-Latitude-3570.39110: tcp 73
02:01:51.943399 IP tom-Latitude-3570.39110 > vmi195435.contaboserver.net.8333: tcp 0
02:01:51.943588 IP tom-Latitude-3570.39110 > vmi195435.contaboserver.net.8333: tcp 24
02:01:51.944954 IP tom-Latitude-3570.39110 > vmi195435.contaboserver.net.8333: tcp 73
02:01:51.968327 IP vmi195435.contaboserver.net.8333 > tom-Latitude-3570.39110: tcp 73
02:01:51.968346 IP tom-Latitude-3570.39110 > vmi195435.contaboserver.net.8333: tcp 0
02:01:51.986712 IP bb42-60-217-183.singnet.com.sg.8333 > tom-Latitude-3570.60470: tcp 0
02:01:51.987342 IP bb42-60-217-183.singnet.com.sg.8333 > tom-Latitude-3570.60470: tcp 0
02:01:51.995516 IP vmi195435.contaboserver.net.8333 > tom-Latitude-3570.39110: tcp 0
02:01:51.996310 IP vmi195435.contaboserver.net.8333 > tom-Latitude-3570.39110: tcp 0
02:01:51.996324 IP 81.198.101.144.8333 > tom-Latitude-3570.60988: tcp 0
02:01:52.065034 IP vmi195435.contaboserver.net.8333 > tom-Latitude-3570.39110: tcp 24
02:01:52.065051 IP tom-Latitude-3570.39110 > vmi195435.contaboserver.net.8333: tcp 0
02:01:52.065734 IP vmi195435.contaboserver.net.8333 > tom-Latitude-3570.39110: tcp 248
02:01:52.065758 IP tom-Latitude-3570.39110 > vmi195435.contaboserver.net.8333: tcp 0
02:01:52.065787 IP vmi195435.contaboserver.net.8333 > tom-Latitude-3570.39110: tcp 24
02:01:52.065789 IP tom-Latitude-3570.39110 > vmi195435.contaboserver.net.8333: tcp 0
02:01:52.065793 IP vmi195435.contaboserver.net.8333 > tom-Latitude-3570.39110: tcp 247
02:01:52.065795 IP tom-Latitude-3570.39110 > vmi195435.contaboserver.net.8333: tcp 0
02:01:52.267168 IP tom-Latitude-3570.57976 > 167.99.216.145.8333: tcp 24
02:01:52.267216 IP tom-Latitude-3570.46284 > static-87-75-105-186.vodafonexdsl.co.uk.8333: tcp 24
02:01:52.269666 IP tom-Latitude-3570.46284 > static-87-75-105-186.vodafonexdsl.co.uk.8333: tcp 73
02:01:52.269677 IP tom-Latitude-3570.57976 > 167.99.216.145.8333: tcp 73
02:01:52.299689 IP static-87-75-105-186.vodafonexdsl.co.uk.8333 > tom-Latitude-3570.46284: tcp 0
02:01:52.316391 IP 167.99.216.145.8333 > tom-Latitude-3570.57976: tcp 0
02:01:52.316411 IP static-87-75-105-186.vodafonexdsl.co.uk.8333 > tom-Latitude-3570.46284: tcp 0
02:01:52.316417 IP 167.99.216.145.8333 > tom-Latitude-3570.57976: tcp 0
02:01:53.069892 IP tom-Latitude-3570.49070 > c-185-45-236-223.customer.ggaweb.ch.8333: tcp 24
02:01:53.072172 IP tom-Latitude-3570.49070 > c-185-45-236-223.customer.ggaweb.ch.8333: tcp 253
02:01:53.129098 IP c-185-45-236-223.customer.ggaweb.ch.8333 > tom-Latitude-3570.49070: tcp 0
02:01:53.137041 IP c-185-45-236-223.customer.ggaweb.ch.8333 > tom-Latitude-3570.49070: tcp 0
02:01:53.270630 IP tom-Latitude-3570.42516 > 2.56.9.15.8333: tcp 24
02:01:53.272564 IP tom-Latitude-3570.42516 > 2.56.9.15.8333: tcp 73
02:01:53.315068 IP 2.56.9.15.8333 > tom-Latitude-3570.42516: tcp 0
02:01:53.442902 IP vmi195435.contaboserver.net.8333 > tom-Latitude-3570.39110: tcp 24
02:01:53.442925 IP tom-Latitude-3570.39110 > vmi195435.contaboserver.net.8333: tcp 0
02:01:53.442959 IP vmi195435.contaboserver.net.8333 > tom-Latitude-3570.39110: tcp 181
02:01:53.442963 IP tom-Latitude-3570.39110 > vmi195435.contaboserver.net.8333: tcp 0
02:01:53.443224 IP tom-Latitude-3570.39110 > vmi195435.contaboserver.net.8333: tcp 24
02:01:53.444448 IP tom-Latitude-3570.39110 > vmi195435.contaboserver.net.8333: tcp 181
02:01:53.494202 IP vmi195435.contaboserver.net.8333 > tom-Latitude-3570.39110: tcp 0
02:01:53.498985 IP vmi195435.contaboserver.net.8333 > tom-Latitude-3570.39110: tcp 0
02:01:53.573260 IP vmi195435.contaboserver.net.8333 > tom-Latitude-3570.39110: tcp 24
02:01:53.573976 IP vmi195435.contaboserver.net.8333 > tom-Latitude-3570.39110: tcp 223
02:01:53.573992 IP vmi195435.contaboserver.net.8333 > tom-Latitude-3570.39110: tcp 24
02:01:53.573994 IP vmi195435.contaboserver.net.8333 > tom-Latitude-3570.39110: tcp 192
02:01:53.573996 IP vmi195435.contaboserver.net.8333 > tom-Latitude-3570.39110: tcp 24
02:01:53.574084 IP tom-Latitude-3570.39110 > vmi195435.contaboserver.net.8333: tcp 0
02:01:53.580047 IP vmi195435.contaboserver.net.8333 > tom-Latitude-3570.39110: tcp 226
02:01:53.580594 IP vmi195435.contaboserver.net.8333 > tom-Latitude-3570.39110: tcp 24
02:01:53.580606 IP vmi195435.contaboserver.net.8333 > tom-Latitude-3570.39110: tcp 226
02:01:53.580608 IP vmi195435.contaboserver.net.8333 > tom-Latitude-3570.39110: tcp 24
02:01:53.580610 IP vmi195435.contaboserver.net.8333 > tom-Latitude-3570.39110: tcp 226
02:01:53.580710 IP tom-Latitude-3570.39110 > vmi195435.contaboserver.net.8333: tcp 0
02:01:54.183471 IP tom-Latitude-3570.56714 > ns3113832.ip-54-38-177.eu.8333: tcp 24
02:01:54.185691 IP tom-Latitude-3570.56714 > ns3113832.ip-54-38-177.eu.8333: tcp 253
02:01:54.186252 IP bb42-60-217-183.singnet.com.sg.8333 > tom-Latitude-3570.60470: tcp 24
02:01:54.186272 IP bb42-60-217-183.singnet.com.sg.8333 > tom-Latitude-3570.60470: tcp 217
02:01:54.186364 IP tom-Latitude-3570.60470 > bb42-60-217-183.singnet.com.sg.8333: tcp 0
02:01:54.227404 IP ns3113832.ip-54-38-177.eu.8333 > tom-Latitude-3570.56714: tcp 0
02:01:54.227915 IP ns3113832.ip-54-38-177.eu.8333 > tom-Latitude-3570.56714: tcp 0
02:01:54.890833 IP c-185-45-236-223.customer.ggaweb.ch.8333 > tom-Latitude-3570.49070: tcp 24
02:01:54.890856 IP tom-Latitude-3570.49070 > c-185-45-236-223.customer.ggaweb.ch.8333: tcp 0
02:01:54.890888 IP c-185-45-236-223.customer.ggaweb.ch.8333 > tom-Latitude-3570.49070: tcp 253
02:01:54.890892 IP tom-Latitude-3570.49070 > c-185-45-236-223.customer.ggaweb.ch.8333: tcp 0
02:01:54.890895 IP c-185-45-236-223.customer.ggaweb.ch.8333 > tom-Latitude-3570.49070: tcp 253
02:01:54.890898 IP tom-Latitude-3570.49070 > c-185-45-236-223.customer.ggaweb.ch.8333: tcp 0
02:01:54.891180 IP tom-Latitude-3570.49070 > c-185-45-236-223.customer.ggaweb.ch.8333: tcp 24
02:01:54.892260 IP tom-Latitude-3570.49070 > c-185-45-236-223.customer.ggaweb.ch.8333: tcp 73
02:01:54.927369 IP c-185-45-236-223.customer.ggaweb.ch.8333 > tom-Latitude-3570.49070: tcp 0
02:01:54.932198 IP c-185-45-236-223.customer.ggaweb.ch.8333 > tom-Latitude-3570.49070: tcp 0
02:01:54.991529 IP tom-Latitude-3570.60988 > 81.198.101.144.8333: tcp 24
02:01:54.992466 IP tom-Latitude-3570.60988 > 81.198.101.144.8333: tcp 253
02:01:55.011160 IP c-185-45-236-223.customer.ggaweb.ch.8333 > tom-Latitude-3570.49070: tcp 24
02:01:55.012038 IP c-185-45-236-223.customer.ggaweb.ch.8333 > tom-Latitude-3570.49070: tcp 259
02:01:55.012057 IP c-185-45-236-223.customer.ggaweb.ch.8333 > tom-Latitude-3570.49070: tcp 1448
02:01:55.012060 IP c-185-45-236-223.customer.ggaweb.ch.8333 > tom-Latitude-3570.49070: tcp 90
02:01:55.012148 IP tom-Latitude-3570.49070 > c-185-45-236-223.customer.ggaweb.ch.8333: tcp 0
02:01:55.034719 IP 81.198.101.144.8333 > tom-Latitude-3570.60988: tcp 0
02:01:55.300211 IP 2.56.9.15.8333 > tom-Latitude-3570.42516: tcp 24
02:01:55.300231 IP 2.56.9.15.8333 > tom-Latitude-3570.42516: tcp 325
02:01:55.300326 IP tom-Latitude-3570.42516 > 2.56.9.15.8333: tcp 0
02:01:55.300611 IP tom-Latitude-3570.42516 > 2.56.9.15.8333: tcp 24
02:01:55.301841 IP tom-Latitude-3570.42516 > 2.56.9.15.8333: tcp 73
02:01:55.337358 IP 2.56.9.15.8333 > tom-Latitude-3570.42516: tcp 0
02:01:55.432588 IP 2.56.9.15.8333 > tom-Latitude-3570.42516: tcp 24
02:01:55.433437 IP 2.56.9.15.8333 > tom-Latitude-3570.42516: tcp 407
02:01:55.433455 IP 2.56.9.15.8333 > tom-Latitude-3570.42516: tcp 24
02:01:55.433458 IP 2.56.9.15.8333 > tom-Latitude-3570.42516: tcp 760
02:01:55.433551 IP tom-Latitude-3570.42516 > 2.56.9.15.8333: tcp 0
02:01:55.535240 IP tom-Latitude-3570.46284 > static-87-75-105-186.vodafonexdsl.co.uk.8333: tcp 24
02:01:55.536512 IP tom-Latitude-3570.46284 > static-87-75-105-186.vodafonexdsl.co.uk.8333: tcp 325
02:01:55.569428 IP static-87-75-105-186.vodafonexdsl.co.uk.8333 > tom-Latitude-3570.46284: tcp 0
02:01:55.577401 IP static-87-75-105-186.vodafonexdsl.co.uk.8333 > tom-Latitude-3570.46284: tcp 0
02:01:56.337214 IP tom-Latitude-3570.39110 > vmi195435.contaboserver.net.8333: tcp 24
02:01:56.337270 IP tom-Latitude-3570.56714 > ns3113832.ip-54-38-177.eu.8333: tcp 24
02:01:56.339459 IP tom-Latitude-3570.56714 > ns3113832.ip-54-38-177.eu.8333: tcp 145
02:01:56.339468 IP tom-Latitude-3570.39110 > vmi195435.contaboserver.net.8333: tcp 145
02:01:56.388782 IP vmi195435.contaboserver.net.8333 > tom-Latitude-3570.39110: tcp 0
02:01:56.395466 IP ns3113832.ip-54-38-177.eu.8333 > tom-Latitude-3570.56714: tcp 0
02:01:56.396105 IP ns3113832.ip-54-38-177.eu.8333 > tom-Latitude-3570.56714: tcp 0
02:01:56.396119 IP vmi195435.contaboserver.net.8333 > tom-Latitude-3570.39110: tcp 0
02:01:56.424065 IP c-185-45-236-223.customer.ggaweb.ch.8333 > tom-Latitude-3570.49070: tcp 24
02:01:56.424086 IP c-185-45-236-223.customer.ggaweb.ch.8333 > tom-Latitude-3570.49070: tcp 325
02:01:56.424174 IP tom-Latitude-3570.49070 > c-185-45-236-223.customer.ggaweb.ch.8333: tcp 0
02:01:56.424463 IP tom-Latitude-3570.49070 > c-185-45-236-223.customer.ggaweb.ch.8333: tcp 24
02:01:56.425665 IP tom-Latitude-3570.49070 > c-185-45-236-223.customer.ggaweb.ch.8333: tcp 253
02:01:56.467898 IP c-185-45-236-223.customer.ggaweb.ch.8333 > tom-Latitude-3570.49070: tcp 0
02:01:56.467906 IP c-185-45-236-223.customer.ggaweb.ch.8333 > tom-Latitude-3570.49070: tcp 0
02:01:56.524696 IP tom-Latitude-3570.57976 > 167.99.216.145.8333: tcp 24
02:01:56.528502 IP tom-Latitude-3570.57976 > 167.99.216.145.8333: tcp 325
02:01:56.549180 IP c-185-45-236-223.customer.ggaweb.ch.8333 > tom-Latitude-3570.49070: tcp 24
02:01:56.550524 IP c-185-45-236-223.customer.ggaweb.ch.8333 > tom-Latitude-3570.49070: tcp 931
02:01:56.550543 IP c-185-45-236-223.customer.ggaweb.ch.8333 > tom-Latitude-3570.49070: tcp 1226
02:01:56.550546 IP c-185-45-236-223.customer.ggaweb.ch.8333 > tom-Latitude-3570.49070: tcp 637
02:01:56.550549 IP c-185-45-236-223.customer.ggaweb.ch.8333 > tom-Latitude-3570.49070: tcp 934
02:01:56.550634 IP tom-Latitude-3570.49070 > c-185-45-236-223.customer.ggaweb.ch.8333: tcp 0
02:01:56.560491 IP 167.99.216.145.8333 > tom-Latitude-3570.57976: tcp 0
02:01:56.565794 IP 167.99.216.145.8333 > tom-Latitude-3570.57976: tcp 0
02:01:57.055443 IP tom-Latitude-3570.56714 > ns3113832.ip-54-38-177.eu.8333: tcp 24
02:01:57.057609 IP tom-Latitude-3570.56714 > ns3113832.ip-54-38-177.eu.8333: tcp 253
02:01:57.058211 IP 81.198.101.144.8333 > tom-Latitude-3570.60988: tcp 24
02:01:57.058235 IP tom-Latitude-3570.60988 > 81.198.101.144.8333: tcp 0
02:01:57.058265 IP 81.198.101.144.8333 > tom-Latitude-3570.60988: tcp 253
02:01:57.058270 IP tom-Latitude-3570.60988 > 81.198.101.144.8333: tcp 0
02:01:57.058274 IP 81.198.101.144.8333 > tom-Latitude-3570.60988: tcp 253
02:01:57.058276 IP tom-Latitude-3570.60988 > 81.198.101.144.8333: tcp 0
02:01:57.085676 IP ns3113832.ip-54-38-177.eu.8333 > tom-Latitude-3570.56714: tcp 0
02:01:57.088590 IP ns3113832.ip-54-38-177.eu.8333 > tom-Latitude-3570.56714: tcp 0
02:01:57.158929 IP tom-Latitude-3570.60470 > bb42-60-217-183.singnet.com.sg.8333: tcp 24
02:01:57.158991 IP tom-Latitude-3570.42516 > 2.56.9.15.8333: tcp 24
02:01:57.159900 IP tom-Latitude-3570.42516 > 2.56.9.15.8333: tcp 253
02:01:57.159911 IP tom-Latitude-3570.60470 > bb42-60-217-183.singnet.com.sg.8333: tcp 433
02:01:57.255905 IP tom-Latitude-3570.60470 > bb42-60-217-183.singnet.com.sg.8333: tcp 433
02:01:57.259460 IP tom-Latitude-3570.60988 > 81.198.101.144.8333: tcp 24
02:01:57.259534 IP tom-Latitude-3570.46284 > static-87-75-105-186.vodafonexdsl.co.uk.8333: tcp 24
02:01:57.267905 IP tom-Latitude-3570.42516 > 2.56.9.15.8333: tcp 253
02:01:57.290202 IP tom-Latitude-3570.46284 > static-87-75-105-186.vodafonexdsl.co.uk.8333: tcp 253
02:01:57.290213 IP tom-Latitude-3570.60988 > 81.198.101.144.8333: tcp 145
02:01:57.293228 IP bb42-60-217-183.singnet.com.sg.8333 > tom-Latitude-3570.60470: tcp 0
02:01:57.293242 IP bb42-60-217-183.singnet.com.sg.8333 > tom-Latitude-3570.60470: tcp 0
02:01:57.293245 IP 2.56.9.15.8333 > tom-Latitude-3570.42516: tcp 0
02:01:57.327732 IP bb42-60-217-183.singnet.com.sg.8333 > tom-Latitude-3570.60470: tcp 0
02:01:57.328380 IP static-87-75-105-186.vodafonexdsl.co.uk.8333 > tom-Latitude-3570.46284: tcp 0
02:01:57.328394 IP 2.56.9.15.8333 > tom-Latitude-3570.42516: tcp 0
02:01:57.328398 IP static-87-75-105-186.vodafonexdsl.co.uk.8333 > tom-Latitude-3570.46284: tcp 0
02:01:57.328400 IP 81.198.101.144.8333 > tom-Latitude-3570.60988: tcp 0
02:01:58.262751 IP tom-Latitude-3570.57976 > 167.99.216.145.8333: tcp 24
02:01:58.265014 IP tom-Latitude-3570.57976 > 167.99.216.145.8333: tcp 253
02:01:58.317562 IP 167.99.216.145.8333 > tom-Latitude-3570.57976: tcp 0
02:01:58.327034 IP 167.99.216.145.8333 > tom-Latitude-3570.57976: tcp 0
02:01:59.191528 IP c-185-45-236-223.customer.ggaweb.ch.8333 > tom-Latitude-3570.49070: tcp 24
02:01:59.191549 IP c-185-45-236-223.customer.ggaweb.ch.8333 > tom-Latitude-3570.49070: tcp 181
02:01:59.191552 IP c-185-45-236-223.customer.ggaweb.ch.8333 > tom-Latitude-3570.49070: tcp 181
02:01:59.191580 IP tom-Latitude-3570.49070 > c-185-45-236-223.customer.ggaweb.ch.8333: tcp 0
02:01:59.191594 IP static-87-75-105-186.vodafonexdsl.co.uk.8333 > tom-Latitude-3570.46284: tcp 24
02:01:59.191597 IP static-87-75-105-186.vodafonexdsl.co.uk.8333 > tom-Latitude-3570.46284: tcp 145
02:01:59.191599 IP static-87-75-105-186.vodafonexdsl.co.uk.8333 > tom-Latitude-3570.46284: tcp 145
02:01:59.191615 IP tom-Latitude-3570.46284 > static-87-75-105-186.vodafonexdsl.co.uk.8333: tcp 0
02:01:59.191832 IP tom-Latitude-3570.49070 > c-185-45-236-223.customer.ggaweb.ch.8333: tcp 24
02:01:59.192945 IP tom-Latitude-3570.49070 > c-185-45-236-223.customer.ggaweb.ch.8333: tcp 181
02:01:59.237394 IP c-185-45-236-223.customer.ggaweb.ch.8333 > tom-Latitude-3570.49070: tcp 0
02:01:59.238009 IP c-185-45-236-223.customer.ggaweb.ch.8333 > tom-Latitude-3570.49070: tcp 0
02:01:59.321489 IP c-185-45-236-223.customer.ggaweb.ch.8333 > tom-Latitude-3570.49070: tcp 24
02:01:59.322469 IP c-185-45-236-223.customer.ggaweb.ch.8333 > tom-Latitude-3570.49070: tcp 452
02:01:59.322488 IP c-185-45-236-223.customer.ggaweb.ch.8333 > tom-Latitude-3570.49070: tcp 273
02:01:59.322491 IP c-185-45-236-223.customer.ggaweb.ch.8333 > tom-Latitude-3570.49070: tcp 361
02:01:59.322494 IP c-185-45-236-223.customer.ggaweb.ch.8333 > tom-Latitude-3570.49070: tcp 24
02:01:59.322495 IP c-185-45-236-223.customer.ggaweb.ch.8333 > tom-Latitude-3570.49070: tcp 225
02:01:59.322497 IP c-185-45-236-223.customer.ggaweb.ch.8333 > tom-Latitude-3570.49070: tcp 24
02:01:59.322517 IP c-185-45-236-223.customer.ggaweb.ch.8333 > tom-Latitude-3570.49070: tcp 670
02:01:59.322586 IP tom-Latitude-3570.49070 > c-185-45-236-223.customer.ggaweb.ch.8333: tcp 0
02:01:59.527629 IP tom-Latitude-3570.39110 > vmi195435.contaboserver.net.8333: tcp 24
02:01:59.529837 IP tom-Latitude-3570.39110 > vmi195435.contaboserver.net.8333: tcp 433
02:01:59.559476 IP vmi195435.contaboserver.net.8333 > tom-Latitude-3570.39110: tcp 0
02:01:59.575611 IP vmi195435.contaboserver.net.8333 > tom-Latitude-3570.39110: tcp 0
02:01:59.628071 IP tom-Latitude-3570.42516 > 2.56.9.15.8333: tcp 24
02:01:59.629008 IP tom-Latitude-3570.42516 > 2.56.9.15.8333: tcp 181
02:01:59.659475 IP 2.56.9.15.8333 > tom-Latitude-3570.42516: tcp 0
02:01:59.667466 IP 2.56.9.15.8333 > tom-Latitude-3570.42516: tcp 0
02:01:59.700886 IP ns3113832.ip-54-38-177.eu.8333 > tom-Latitude-3570.56714: tcp 24
02:01:59.700906 IP ns3113832.ip-54-38-177.eu.8333 > tom-Latitude-3570.56714: tcp 289
02:01:59.701000 IP tom-Latitude-3570.56714 > ns3113832.ip-54-38-177.eu.8333: tcp 0
02:01:59.701178 IP tom-Latitude-3570.56714 > ns3113832.ip-54-38-177.eu.8333: tcp 24
02:01:59.701254 IP tom-Latitude-3570.57976 > 167.99.216.145.8333: tcp 24
02:01:59.702554 IP tom-Latitude-3570.57976 > 167.99.216.145.8333: tcp 181
02:01:59.702565 IP tom-Latitude-3570.56714 > ns3113832.ip-54-38-177.eu.8333: tcp 109
02:01:59.710520 IP 2.56.9.15.8333 > tom-Latitude-3570.42516: tcp 24
02:01:59.711180 IP 2.56.9.15.8333 > tom-Latitude-3570.42516: tcp 289
02:01:59.711296 IP tom-Latitude-3570.42516 > 2.56.9.15.8333: tcp 0
02:01:59.720898 IP ns3113832.ip-54-38-177.eu.8333 > tom-Latitude-3570.56714: tcp 0
02:01:59.730325 IP 167.99.216.145.8333 > tom-Latitude-3570.57976: tcp 0
02:01:59.740408 IP ns3113832.ip-54-38-177.eu.8333 > tom-Latitude-3570.56714: tcp 0
02:01:59.740413 IP 167.99.216.145.8333 > tom-Latitude-3570.57976: tcp 0
02:01:59.908249 IP ns3113832.ip-54-38-177.eu.8333 > tom-Latitude-3570.56714: tcp 443
02:01:59.908267 IP tom-Latitude-3570.56714 > ns3113832.ip-54-38-177.eu.8333: tcp 0
02:01:59.909022 IP ns3113832.ip-54-38-177.eu.8333 > tom-Latitude-3570.56714: tcp 24
02:01:59.909041 IP tom-Latitude-3570.56714 > ns3113832.ip-54-38-177.eu.8333: tcp 0
02:01:59.909052 IP ns3113832.ip-54-38-177.eu.8333 > tom-Latitude-3570.56714: tcp 193
02:01:59.909054 IP tom-Latitude-3570.56714 > ns3113832.ip-54-38-177.eu.8333: tcp 0
02:01:59.909056 IP ns3113832.ip-54-38-177.eu.8333 > tom-Latitude-3570.56714: tcp 24
02:01:59.909058 IP tom-Latitude-3570.56714 > ns3113832.ip-54-38-177.eu.8333: tcp 0
02:01:59.909060 IP ns3113832.ip-54-38-177.eu.8333 > tom-Latitude-3570.56714: tcp 222
02:01:59.909062 IP tom-Latitude-3570.56714 > ns3113832.ip-54-38-177.eu.8333: tcp 0
02:01:59.925616 IP ns3113832.ip-54-38-177.eu.8333 > tom-Latitude-3570.56714: tcp 222
02:01:59.925635 IP tom-Latitude-3570.56714 > ns3113832.ip-54-38-177.eu.8333: tcp 0
02:01:59.950162 IP ns3113832.ip-54-38-177.eu.8333 > tom-Latitude-3570.56714: tcp 24
02:01:59.950189 IP tom-Latitude-3570.56714 > ns3113832.ip-54-38-177.eu.8333: tcp 0
02:02:00.026128 IP vmi195435.contaboserver.net.8333 > tom-Latitude-3570.39110: tcp 24
02:02:00.026194 IP vmi195435.contaboserver.net.8333 > tom-Latitude-3570.39110: tcp 109
02:02:00.026304 IP tom-Latitude-3570.39110 > vmi195435.contaboserver.net.8333: tcp 0
02:02:00.026504 IP tom-Latitude-3570.60470 > bb42-60-217-183.singnet.com.sg.8333: tcp 24
02:02:00.027842 IP tom-Latitude-3570.60470 > bb42-60-217-183.singnet.com.sg.8333: tcp 289
02:02:00.057541 IP bb42-60-217-183.singnet.com.sg.8333 > tom-Latitude-3570.60470: tcp 0
02:02:00.058218 IP bb42-60-217-183.singnet.com.sg.8333 > tom-Latitude-3570.60470: tcp 0
02:02:01.330822 IP tom-Latitude-3570.49070 > c-185-45-236-223.customer.ggaweb.ch.8333: tcp 24
02:02:01.330875 IP tom-Latitude-3570.57976 > 167.99.216.145.8333: tcp 24
02:02:01.333183 IP tom-Latitude-3570.57976 > 167.99.216.145.8333: tcp 109
02:02:01.333198 IP tom-Latitude-3570.49070 > c-185-45-236-223.customer.ggaweb.ch.8333: tcp 109
02:02:01.389116 IP c-185-45-236-223.customer.ggaweb.ch.8333 > tom-Latitude-3570.49070: tcp 0
02:02:01.397043 IP 167.99.216.145.8333 > tom-Latitude-3570.57976: tcp 0
02:02:01.397628 IP 167.99.216.145.8333 > tom-Latitude-3570.57976: tcp 0
02:02:01.397642 IP c-185-45-236-223.customer.ggaweb.ch.8333 > tom-Latitude-3570.49070: tcp 0
02:02:01.732291 IP tom-Latitude-3570.60988 > 81.198.101.144.8333: tcp 24
02:02:01.737186 IP tom-Latitude-3570.60988 > 81.198.101.144.8333: tcp 289
02:02:01.788330 IP vmi195435.contaboserver.net.8333 > tom-Latitude-3570.39110: tcp 24
02:02:01.788349 IP vmi195435.contaboserver.net.8333 > tom-Latitude-3570.39110: tcp 181
02:02:01.788449 IP tom-Latitude-3570.39110 > vmi195435.contaboserver.net.8333: tcp 0
02:02:01.788613 IP tom-Latitude-3570.39110 > vmi195435.contaboserver.net.8333: tcp 24
02:02:01.793202 IP tom-Latitude-3570.39110 > vmi195435.contaboserver.net.8333: tcp 181
02:02:01.795226 IP 81.198.101.144.8333 > tom-Latitude-3570.60988: tcp 0
02:02:01.826113 IP vmi195435.contaboserver.net.8333 > tom-Latitude-3570.39110: tcp 0
02:02:01.826671 IP vmi195435.contaboserver.net.8333 > tom-Latitude-3570.39110: tcp 0
02:02:01.889054 IP tom-Latitude-3570.46284 > static-87-75-105-186.vodafonexdsl.co.uk.8333: tcp 24
02:02:01.890814 IP tom-Latitude-3570.46284 > static-87-75-105-186.vodafonexdsl.co.uk.8333: tcp 145
02:02:01.906606 IP vmi195435.contaboserver.net.8333 > tom-Latitude-3570.39110: tcp 24
02:02:01.907500 IP vmi195435.contaboserver.net.8333 > tom-Latitude-3570.39110: tcp 225
02:02:01.907518 IP vmi195435.contaboserver.net.8333 > tom-Latitude-3570.39110: tcp 24
02:02:01.907520 IP vmi195435.contaboserver.net.8333 > tom-Latitude-3570.39110: tcp 224
02:02:01.907523 IP vmi195435.contaboserver.net.8333 > tom-Latitude-3570.39110: tcp 24
02:02:01.907525 IP vmi195435.contaboserver.net.8333 > tom-Latitude-3570.39110: tcp 248
02:02:01.907527 IP vmi195435.contaboserver.net.8333 > tom-Latitude-3570.39110: tcp 24
02:02:01.907547 IP vmi195435.contaboserver.net.8333 > tom-Latitude-3570.39110: tcp 223
02:02:01.907548 IP vmi195435.contaboserver.net.8333 > tom-Latitude-3570.39110: tcp 24
02:02:01.907550 IP vmi195435.contaboserver.net.8333 > tom-Latitude-3570.39110: tcp 374
02:02:01.907607 IP tom-Latitude-3570.39110 > vmi195435.contaboserver.net.8333: tcp 0
02:02:01.919307 IP static-87-75-105-186.vodafonexdsl.co.uk.8333 > tom-Latitude-3570.46284: tcp 0
02:02:01.926009 IP static-87-75-105-186.vodafonexdsl.co.uk.8333 > tom-Latitude-3570.46284: tcp 0
02:02:02.811718 IP tom-Latitude-3570.56714 > ns3113832.ip-54-38-177.eu.8333: tcp 24
02:02:02.815287 IP tom-Latitude-3570.56714 > ns3113832.ip-54-38-177.eu.8333: tcp 181
02:02:02.816020 IP 2.56.9.15.8333 > tom-Latitude-3570.42516: tcp 24
02:02:02.816041 IP 2.56.9.15.8333 > tom-Latitude-3570.42516: tcp 253
02:02:02.816044 IP 2.56.9.15.8333 > tom-Latitude-3570.42516: tcp 253
02:02:02.816072 IP tom-Latitude-3570.42516 > 2.56.9.15.8333: tcp 0
02:02:02.816085 IP 167.99.216.145.8333 > tom-Latitude-3570.57976: tcp 24
02:02:02.816102 IP tom-Latitude-3570.57976 > 167.99.216.145.8333: tcp 0
02:02:02.816105 IP 167.99.216.145.8333 > tom-Latitude-3570.57976: tcp 253
02:02:02.816107 IP tom-Latitude-3570.57976 > 167.99.216.145.8333: tcp 0
02:02:02.816110 IP bb42-60-217-183.singnet.com.sg.8333 > tom-Latitude-3570.60470: tcp 24
02:02:02.816113 IP bb42-60-217-183.singnet.com.sg.8333 > tom-Latitude-3570.60470: tcp 253
02:02:02.816177 IP tom-Latitude-3570.60470 > bb42-60-217-183.singnet.com.sg.8333: tcp 0
02:02:02.816313 IP tom-Latitude-3570.57976 > 167.99.216.145.8333: tcp 24
02:02:02.817530 IP tom-Latitude-3570.57976 > 167.99.216.145.8333: tcp 73
02:02:02.857136 IP ns3113832.ip-54-38-177.eu.8333 > tom-Latitude-3570.56714: tcp 0
02:02:02.857144 IP ns3113832.ip-54-38-177.eu.8333 > tom-Latitude-3570.56714: tcp 0
02:02:02.857146 IP 167.99.216.145.8333 > tom-Latitude-3570.57976: tcp 0
02:02:02.857148 IP 167.99.216.145.8333 > tom-Latitude-3570.57976: tcp 0
02:02:02.916594 IP tom-Latitude-3570.60988 > 81.198.101.144.8333: tcp 24
02:02:02.919396 IP 167.99.216.145.8333 > tom-Latitude-3570.57976: tcp 24
02:02:02.919403 IP 167.99.216.145.8333 > tom-Latitude-3570.57976: tcp 189
02:02:02.919406 IP 167.99.216.145.8333 > tom-Latitude-3570.57976: tcp 24
02:02:02.919408 IP 167.99.216.145.8333 > tom-Latitude-3570.57976: tcp 285
02:02:02.919414 IP tom-Latitude-3570.57976 > 167.99.216.145.8333: tcp 0
02:02:02.919945 IP tom-Latitude-3570.60988 > 81.198.101.144.8333: tcp 181
02:02:02.947508 IP 81.198.101.144.8333 > tom-Latitude-3570.60988: tcp 0
02:02:03.287454 IP 81.198.101.144.8333 > tom-Latitude-3570.60988: tcp 24
02:02:03.287477 IP tom-Latitude-3570.60988 > 81.198.101.144.8333: tcp 0
02:02:03.287509 IP 81.198.101.144.8333 > tom-Latitude-3570.60988: tcp 73
02:02:03.287511 IP tom-Latitude-3570.60988 > 81.198.101.144.8333: tcp 0
02:02:03.287515 IP 81.198.101.144.8333 > tom-Latitude-3570.60988: tcp 73
02:02:03.287518 IP tom-Latitude-3570.60988 > 81.198.101.144.8333: tcp 0
02:02:04.591951 IP tom-Latitude-3570.39110 > vmi195435.contaboserver.net.8333: tcp 24
02:02:04.592029 IP tom-Latitude-3570.49070 > c-185-45-236-223.customer.ggaweb.ch.8333: tcp 24
02:02:04.594108 IP tom-Latitude-3570.49070 > c-185-45-236-223.customer.ggaweb.ch.8333: tcp 253
02:02:04.594119 IP tom-Latitude-3570.39110 > vmi195435.contaboserver.net.8333: tcp 73
02:02:04.647489 IP vmi195435.contaboserver.net.8333 > tom-Latitude-3570.39110: tcp 0
02:02:04.660283 IP c-185-45-236-223.customer.ggaweb.ch.8333 > tom-Latitude-3570.49070: tcp 0
02:02:04.660298 IP c-185-45-236-223.customer.ggaweb.ch.8333 > tom-Latitude-3570.49070: tcp 0
02:02:04.660300 IP vmi195435.contaboserver.net.8333 > tom-Latitude-3570.39110: tcp 0
02:02:05.131005 IP ns3113832.ip-54-38-177.eu.8333 > tom-Latitude-3570.56714: tcp 24
02:02:05.131029 IP tom-Latitude-3570.56714 > ns3113832.ip-54-38-177.eu.8333: tcp 0
02:02:05.131061 IP ns3113832.ip-54-38-177.eu.8333 > tom-Latitude-3570.56714: tcp 361
02:02:05.131066 IP tom-Latitude-3570.56714 > ns3113832.ip-54-38-177.eu.8333: tcp 0
02:02:05.131069 IP c-185-45-236-223.customer.ggaweb.ch.8333 > tom-Latitude-3570.49070: tcp 24
02:02:05.131072 IP c-185-45-236-223.customer.ggaweb.ch.8333 > tom-Latitude-3570.49070: tcp 325
02:02:05.131075 IP ns3113832.ip-54-38-177.eu.8333 > tom-Latitude-3570.56714: tcp 361
02:02:05.131078 IP tom-Latitude-3570.56714 > ns3113832.ip-54-38-177.eu.8333: tcp 0
02:02:05.131152 IP tom-Latitude-3570.49070 > c-185-45-236-223.customer.ggaweb.ch.8333: tcp 0
02:02:05.131339 IP tom-Latitude-3570.49070 > c-185-45-236-223.customer.ggaweb.ch.8333: tcp 24
02:02:05.132472 IP tom-Latitude-3570.49070 > c-185-45-236-223.customer.ggaweb.ch.8333: tcp 325
02:02:05.174449 IP c-185-45-236-223.customer.ggaweb.ch.8333 > tom-Latitude-3570.49070: tcp 0
02:02:05.175072 IP c-185-45-236-223.customer.ggaweb.ch.8333 > tom-Latitude-3570.49070: tcp 0
02:02:05.261810 IP c-185-45-236-223.customer.ggaweb.ch.8333 > tom-Latitude-3570.49070: tcp 24
02:02:05.262756 IP c-185-45-236-223.customer.ggaweb.ch.8333 > tom-Latitude-3570.49070: tcp 223
02:02:05.262775 IP c-185-45-236-223.customer.ggaweb.ch.8333 > tom-Latitude-3570.49070: tcp 271
02:02:05.262778 IP c-185-45-236-223.customer.ggaweb.ch.8333 > tom-Latitude-3570.49070: tcp 249
02:02:05.262780 IP c-185-45-236-223.customer.ggaweb.ch.8333 > tom-Latitude-3570.49070: tcp 24
02:02:05.262782 IP c-185-45-236-223.customer.ggaweb.ch.8333 > tom-Latitude-3570.49070: tcp 658
02:02:05.262802 IP c-185-45-236-223.customer.ggaweb.ch.8333 > tom-Latitude-3570.49070: tcp 214
02:02:05.262804 IP c-185-45-236-223.customer.ggaweb.ch.8333 > tom-Latitude-3570.49070: tcp 189
02:02:05.262867 IP tom-Latitude-3570.49070 > c-185-45-236-223.customer.ggaweb.ch.8333: tcp 0
02:02:05.346791 IP c-185-45-236-223.customer.ggaweb.ch.8333 > tom-Latitude-3570.49070: tcp 1382
02:02:05.347320 IP c-185-45-236-223.customer.ggaweb.ch.8333 > tom-Latitude-3570.49070: tcp 66
02:02:05.347335 IP tom-Latitude-3570.49070 > c-185-45-236-223.customer.ggaweb.ch.8333: tcp 0
02:02:05.347352 IP c-185-45-236-223.customer.ggaweb.ch.8333 > tom-Latitude-3570.49070: tcp 649
02:02:05.387897 IP tom-Latitude-3570.49070 > c-185-45-236-223.customer.ggaweb.ch.8333: tcp 0
02:02:05.751249 IP tom-Latitude-3570.60470 > bb42-60-217-183.singnet.com.sg.8333: tcp 24
02:02:05.753344 IP tom-Latitude-3570.60470 > bb42-60-217-183.singnet.com.sg.8333: tcp 325
02:02:05.817679 IP bb42-60-217-183.singnet.com.sg.8333 > tom-Latitude-3570.60470: tcp 0
02:02:05.833836 IP bb42-60-217-183.singnet.com.sg.8333 > tom-Latitude-3570.60470: tcp 0
02:02:06.152405 IP tom-Latitude-3570.60988 > 81.198.101.144.8333: tcp 24
02:02:06.154517 IP tom-Latitude-3570.60988 > 81.198.101.144.8333: tcp 325
02:02:06.242937 IP 81.198.101.144.8333 > tom-Latitude-3570.60988: tcp 0
02:02:06.252817 IP tom-Latitude-3570.56714 > ns3113832.ip-54-38-177.eu.8333: tcp 24
02:02:06.252852 IP tom-Latitude-3570.57976 > 167.99.216.145.8333: tcp 24
02:02:06.254550 IP tom-Latitude-3570.57976 > 167.99.216.145.8333: tcp 31
02:02:06.254561 IP tom-Latitude-3570.56714 > ns3113832.ip-54-38-177.eu.8333: tcp 37
02:02:06.289259 IP ns3113832.ip-54-38-177.eu.8333 > tom-Latitude-3570.56714: tcp 0
02:02:06.298708 IP ns3113832.ip-54-38-177.eu.8333 > tom-Latitude-3570.56714: tcp 0
02:02:06.298722 IP 167.99.216.145.8333 > tom-Latitude-3570.57976: tcp 0
02:02:06.298727 IP 167.99.216.145.8333 > tom-Latitude-3570.57976: tcp 0
02:02:06.769116 IP 167.99.216.145.8333 > tom-Latitude-3570.57976: tcp 24
02:02:06.769136 IP 167.99.216.145.8333 > tom-Latitude-3570.57976: tcp 469
02:02:06.769229 IP tom-Latitude-3570.57976 > 167.99.216.145.8333: tcp 0
02:02:06.769457 IP tom-Latitude-3570.57976 > 167.99.216.145.8333: tcp 24
02:02:06.770706 IP tom-Latitude-3570.57976 > 167.99.216.145.8333: tcp 145
02:02:06.772199 IP 167.99.216.145.8333 > tom-Latitude-3570.57976: tcp 469
02:02:06.772214 IP tom-Latitude-3570.57976 > 167.99.216.145.8333: tcp 0
02:02:06.806423 IP 167.99.216.145.8333 > tom-Latitude-3570.57976: tcp 0
02:02:06.811213 IP 167.99.216.145.8333 > tom-Latitude-3570.57976: tcp 0
02:02:06.868915 IP 167.99.216.145.8333 > tom-Latitude-3570.57976: tcp 24
02:02:06.868928 IP tom-Latitude-3570.57976 > 167.99.216.145.8333: tcp 0
02:02:06.868943 IP 167.99.216.145.8333 > tom-Latitude-3570.57976: tcp 370
02:02:06.868947 IP tom-Latitude-3570.57976 > 167.99.216.145.8333: tcp 0
02:02:06.868950 IP 167.99.216.145.8333 > tom-Latitude-3570.57976: tcp 24
02:02:06.868951 IP tom-Latitude-3570.57976 > 167.99.216.145.8333: tcp 0
02:02:06.869466 IP tom-Latitude-3570.60470 > bb42-60-217-183.singnet.com.sg.8333: tcp 24
02:02:06.870554 IP tom-Latitude-3570.60470 > bb42-60-217-183.singnet.com.sg.8333: tcp 37
02:02:06.872017 IP 167.99.216.145.8333 > tom-Latitude-3570.57976: tcp 516
02:02:06.872034 IP tom-Latitude-3570.57976 > 167.99.216.145.8333: tcp 0
02:02:06.872049 IP 167.99.216.145.8333 > tom-Latitude-3570.57976: tcp 24
02:02:06.872051 IP tom-Latitude-3570.57976 > 167.99.216.145.8333: tcp 0
02:02:06.872055 IP 167.99.216.145.8333 > tom-Latitude-3570.57976: tcp 225
02:02:06.872056 IP tom-Latitude-3570.57976 > 167.99.216.145.8333: tcp 0
02:02:06.872059 IP 167.99.216.145.8333 > tom-Latitude-3570.57976: tcp 24
02:02:06.872078 IP tom-Latitude-3570.57976 > 167.99.216.145.8333: tcp 0
02:02:06.872081 IP 167.99.216.145.8333 > tom-Latitude-3570.57976: tcp 226
02:02:06.872086 IP tom-Latitude-3570.57976 > 167.99.216.145.8333: tcp 0
02:02:06.908155 IP bb42-60-217-183.singnet.com.sg.8333 > tom-Latitude-3570.60470: tcp 0
02:02:06.908170 IP bb42-60-217-183.singnet.com.sg.8333 > tom-Latitude-3570.60470: tcp 0
02:02:06.973579 IP tom-Latitude-3570.60470 > bb42-60-217-183.singnet.com.sg.8333: tcp 24
02:02:06.974517 IP tom-Latitude-3570.60470 > bb42-60-217-183.singnet.com.sg.8333: tcp 109
02:02:07.010728 IP bb42-60-217-183.singnet.com.sg.8333 > tom-Latitude-3570.60470: tcp 0
02:02:07.015619 IP bb42-60-217-183.singnet.com.sg.8333 > tom-Latitude-3570.60470: tcp 0
02:02:07.174133 IP tom-Latitude-3570.42516 > 2.56.9.15.8333: tcp 24
02:02:07.176120 IP tom-Latitude-3570.42516 > 2.56.9.15.8333: tcp 469
02:02:07.209415 IP 2.56.9.15.8333 > tom-Latitude-3570.42516: tcp 0
02:02:07.220684 IP 2.56.9.15.8333 > tom-Latitude-3570.42516: tcp 0
02:02:07.793062 IP 81.198.101.144.8333 > tom-Latitude-3570.60988: tcp 24
02:02:07.793087 IP tom-Latitude-3570.60988 > 81.198.101.144.8333: tcp 0
02:02:07.793119 IP 81.198.101.144.8333 > tom-Latitude-3570.60988: tcp 37
02:02:07.793122 IP tom-Latitude-3570.60988 > 81.198.101.144.8333: tcp 0
02:02:07.793248 IP tom-Latitude-3570.60988 > 81.198.101.144.8333: tcp 24
02:02:07.794723 IP tom-Latitude-3570.60988 > 81.198.101.144.8333: tcp 284
02:02:07.805131 IP 81.198.101.144.8333 > tom-Latitude-3570.60988: tcp 37
02:02:07.805151 IP tom-Latitude-3570.60988 > 81.198.101.144.8333: tcp 0
02:02:07.837435 IP 81.198.101.144.8333 > tom-Latitude-3570.60988: tcp 0
02:02:07.874953 IP 81.198.101.144.8333 > tom-Latitude-3570.60988: tcp 24
02:02:07.874967 IP tom-Latitude-3570.60988 > 81.198.101.144.8333: tcp 0
02:02:07.874981 IP 81.198.101.144.8333 > tom-Latitude-3570.60988: tcp 8
02:02:07.874983 IP tom-Latitude-3570.60988 > 81.198.101.144.8333: tcp 0
02:02:07.875155 IP tom-Latitude-3570.60988 > 81.198.101.144.8333: tcp 24
02:02:07.876559 IP tom-Latitude-3570.60988 > 81.198.101.144.8333: tcp 8
