02:23:12.514400 IP 81.198.101.144.8333 > tom-Latitude-3570.60988: tcp 24
02:23:12.514419 IP 81.198.101.144.8333 > tom-Latitude-3570.60988: tcp 121
02:23:12.514423 IP c-185-45-236-223.customer.ggaweb.ch.8333 > tom-Latitude-3570.49070: tcp 24
02:23:12.514425 IP c-185-45-236-223.customer.ggaweb.ch.8333 > tom-Latitude-3570.49070: tcp 217
02:23:12.514427 IP 81.198.101.144.8333 > tom-Latitude-3570.60988: tcp 121
02:23:12.514455 IP tom-Latitude-3570.60988 > 81.198.101.144.8333: tcp 0
02:23:12.514468 IP c-185-45-236-223.customer.ggaweb.ch.8333 > tom-Latitude-3570.49070: tcp 217
02:23:12.514471 IP tom-Latitude-3570.49070 > c-185-45-236-223.customer.ggaweb.ch.8333: tcp 0
02:23:12.514742 IP tom-Latitude-3570.49070 > c-185-45-236-223.customer.ggaweb.ch.8333: tcp 24
02:23:12.517346 IP tom-Latitude-3570.49070 > c-185-45-236-223.customer.ggaweb.ch.8333: tcp 217
02:23:12.545497 IP c-185-45-236-223.customer.ggaweb.ch.8333 > tom-Latitude-3570.49070: tcp 0
02:23:12.628578 IP c-185-45-236-223.customer.ggaweb.ch.8333 > tom-Latitude-3570.49070: tcp 24
02:23:12.629723 IP c-185-45-236-223.customer.ggaweb.ch.8333 > tom-Latitude-3570.49070: tcp 1182
02:23:12.629741 IP c-185-45-236-223.customer.ggaweb.ch.8333 > tom-Latitude-3570.49070: tcp 395
02:23:12.629829 IP tom-Latitude-3570.49070 > c-185-45-236-223.customer.ggaweb.ch.8333: tcp 0
02:23:13.035468 IP tom-Latitude-3570.57976 > 167.99.216.145.8333: tcp 24
02:23:13.035694 IP tom-Latitude-3570.42516 > 2.56.9.15.8333: tcp 24
02:23:13.036842 IP tom-Latitude-3570.42516 > 2.56.9.15.8333: tcp 937
02:23:13.036854 IP tom-Latitude-3570.57976 > 167.99.216.145.8333: tcp 217
02:23:13.087134 IP 2.56.9.15.8333 > tom-Latitude-3570.42516: tcp 0
02:23:13.094256 IP 167.99.216.145.8333 > tom-Latitude-3570.57976: tcp 0
02:23:13.094796 IP 167.99.216.145.8333 > tom-Latitude-3570.57976: tcp 0
02:23:13.094809 IP 2.56.9.15.8333 > tom-Latitude-3570.42516: tcp 0
02:23:13.336586 IP tom-Latitude-3570.57976 > 167.99.216.145.8333: tcp 24
02:23:13.337570 IP tom-Latitude-3570.57976 > 167.99.216.145.8333: tcp 61
02:23:13.385746 IP 167.99.216.145.8333 > tom-Latitude-3570.57976: tcp 0
02:23:13.427135 IP 167.99.216.145.8333 > tom-Latitude-3570.57976: tcp 0
02:23:13.792923 IP ec2-13-229-99-77.ap-southeast-1.compute.amazonaws.com.8333 > tom-Latitude-3570.60470: tcp 0
02:23:13.793652 IP bb42-60-217-183.singnet.com.sg.8333 > tom-Latitude-3570.60470: tcp 24
02:23:13.793673 IP bb42-60-217-183.singnet.com.sg.8333 > tom-Latitude-3570.60470: tcp 541
02:23:13.793764 IP tom-Latitude-3570.60470 > bb42-60-217-183.singnet.com.sg.8333: tcp 0
02:23:13.793990 IP tom-Latitude-3570.60470 > bb42-60-217-183.singnet.com.sg.8333: tcp 24
02:23:13.795265 IP tom-Latitude-3570.60470 > bb42-60-217-183.singnet.com.sg.8333: tcp 145
02:23:13.825510 IP bb42-60-217-183.singnet.com.sg.8333 > tom-Latitude-3570.60470: tcp 0
02:23:13.826146 IP bb42-60-217-183.singnet.com.sg.8333 > tom-Latitude-3570.60470: tcp 0
02:23:13.957528 IP static-87-75-105-186.vodafonexdsl.co.uk.8333 > tom-Latitude-3570.46284: tcp 24
02:23:13.958069 IP static-87-75-105-186.vodafonexdsl.co.uk.8333 > tom-Latitude-3570.46284: tcp 8
02:23:13.958198 IP tom-Latitude-3570.46284 > static-87-75-105-186.vodafonexdsl.co.uk.8333: tcp 0
02:23:13.958286 IP tom-Latitude-3570.46284 > static-87-75-105-186.vodafonexdsl.co.uk.8333: tcp 24
02:23:13.959203 IP tom-Latitude-3570.46284 > static-87-75-105-186.vodafonexdsl.co.uk.8333: tcp 8
02:23:13.997926 IP static-87-75-105-186.vodafonexdsl.co.uk.8333 > tom-Latitude-3570.46284: tcp 0
02:23:14.202533 IP bb42-60-217-183.singnet.com.sg.8333 > tom-Latitude-3570.60470: tcp 24
02:23:14.203220 IP bb42-60-217-183.singnet.com.sg.8333 > tom-Latitude-3570.60470: tcp 249
02:23:14.203352 IP tom-Latitude-3570.60470 > bb42-60-217-183.singnet.com.sg.8333: tcp 0
02:23:14.206834 IP bb42-60-217-183.singnet.com.sg.8333 > tom-Latitude-3570.60470: tcp 24
02:23:14.206853 IP bb42-60-217-183.singnet.com.sg.8333 > tom-Latitude-3570.60470: tcp 224
02:23:14.206856 IP bb42-60-217-183.singnet.com.sg.8333 > tom-Latitude-3570.60470: tcp 24
02:23:14.206858 IP bb42-60-217-183.singnet.com.sg.8333 > tom-Latitude-3570.60470: tcp 389
02:23:14.206860 IP bb42-60-217-183.singnet.com.sg.8333 > tom-Latitude-3570.60470: tcp 24
02:23:14.206862 IP bb42-60-217-183.singnet.com.sg.8333 > tom-Latitude-3570.60470: tcp 226
02:23:14.206975 IP tom-Latitude-3570.60470 > bb42-60-217-183.singnet.com.sg.8333: tcp 0
02:23:14.266667 IP c-185-45-236-223.customer.ggaweb.ch.8333 > tom-Latitude-3570.49070: tcp 24
02:23:14.266686 IP c-185-45-236-223.customer.ggaweb.ch.8333 > tom-Latitude-3570.49070: tcp 217
02:23:14.266797 IP tom-Latitude-3570.49070 > c-185-45-236-223.customer.ggaweb.ch.8333: tcp 0
02:23:14.266956 IP tom-Latitude-3570.49070 > c-185-45-236-223.customer.ggaweb.ch.8333: tcp 24
02:23:14.274289 IP tom-Latitude-3570.49070 > c-185-45-236-223.customer.ggaweb.ch.8333: tcp 73
02:23:14.315938 IP c-185-45-236-223.customer.ggaweb.ch.8333 > tom-Latitude-3570.49070: tcp 0
02:23:14.393958 IP 2.56.9.15.8333 > tom-Latitude-3570.42516: tcp 24
02:23:14.393978 IP 2.56.9.15.8333 > tom-Latitude-3570.42516: tcp 145
02:23:14.394069 IP tom-Latitude-3570.42516 > 2.56.9.15.8333: tcp 0
02:23:14.398968 IP c-185-45-236-223.customer.ggaweb.ch.8333 > tom-Latitude-3570.49070: tcp 24
02:23:14.398988 IP c-185-45-236-223.customer.ggaweb.ch.8333 > tom-Latitude-3570.49070: tcp 519
02:23:14.398992 IP c-185-45-236-223.customer.ggaweb.ch.8333 > tom-Latitude-3570.49070: tcp 273
02:23:14.399079 IP tom-Latitude-3570.49070 > c-185-45-236-223.customer.ggaweb.ch.8333: tcp 0
02:23:14.516517 IP static-87-75-105-186.vodafonexdsl.co.uk.8333 > tom-Latitude-3570.46284: tcp 24
02:23:14.541617 IP static-87-75-105-186.vodafonexdsl.co.uk.8333 > tom-Latitude-3570.46284: tcp 541
02:23:14.541753 IP tom-Latitude-3570.46284 > static-87-75-105-186.vodafonexdsl.co.uk.8333: tcp 0
02:23:14.664929 IP 167.99.216.145.8333 > tom-Latitude-3570.57976: tcp 24
02:23:14.664950 IP 167.99.216.145.8333 > tom-Latitude-3570.57976: tcp 253
02:23:14.665038 IP tom-Latitude-3570.57976 > 167.99.216.145.8333: tcp 0
02:23:14.665203 IP tom-Latitude-3570.57976 > 167.99.216.145.8333: tcp 24
02:23:14.666717 IP tom-Latitude-3570.57976 > 167.99.216.145.8333: tcp 37
02:23:14.704577 IP 167.99.216.145.8333 > tom-Latitude-3570.57976: tcp 0
02:23:14.705180 IP 167.99.216.145.8333 > tom-Latitude-3570.57976: tcp 0
02:23:14.769917 IP 167.99.216.145.8333 > tom-Latitude-3570.57976: tcp 24
02:23:14.769936 IP 167.99.216.145.8333 > tom-Latitude-3570.57976: tcp 223
02:23:14.770027 IP tom-Latitude-3570.57976 > 167.99.216.145.8333: tcp 0
02:23:14.771573 IP c-185-45-236-223.customer.ggaweb.ch.8333 > tom-Latitude-3570.49070: tcp 24
02:23:14.772200 IP c-185-45-236-223.customer.ggaweb.ch.8333 > tom-Latitude-3570.49070: tcp 37
02:23:14.772328 IP tom-Latitude-3570.49070 > c-185-45-236-223.customer.ggaweb.ch.8333: tcp 0
02:23:14.973090 IP tom-Latitude-3570.60988 > 81.198.101.144.8333: tcp 24
02:23:14.974042 IP tom-Latitude-3570.60988 > 81.198.101.144.8333: tcp 649
02:23:15.007427 IP 81.198.101.144.8333 > tom-Latitude-3570.60988: tcp 0
02:23:15.015485 IP 81.198.101.144.8333 > tom-Latitude-3570.60988: tcp 0
02:23:15.104529 IP 81.198.101.144.8333 > tom-Latitude-3570.60988: tcp 24
02:23:15.104546 IP tom-Latitude-3570.60988 > 81.198.101.144.8333: tcp 0
02:23:15.105196 IP 81.198.101.144.8333 > tom-Latitude-3570.60988: tcp 109
02:23:15.105220 IP tom-Latitude-3570.60988 > 81.198.101.144.8333: tcp 0
02:23:15.105378 IP tom-Latitude-3570.60988 > 81.198.101.144.8333: tcp 24
02:23:15.105425 IP tom-Latitude-3570.60988 > 81.198.101.144.8333: tcp 1039
02:23:15.144856 IP 81.198.101.144.8333 > tom-Latitude-3570.60988: tcp 0
02:23:15.144871 IP 81.198.101.144.8333 > tom-Latitude-3570.60988: tcp 0
02:23:15.406501 IP tom-Latitude-3570.60470 > bb42-60-217-183.singnet.com.sg.8333: tcp 24
02:23:15.407460 IP tom-Latitude-3570.60470 > bb42-60-217-183.singnet.com.sg.8333: tcp 109
02:23:15.455867 IP bb42-60-217-183.singnet.com.sg.8333 > tom-Latitude-3570.60470: tcp 0
02:23:15.473060 IP bb42-60-217-183.singnet.com.sg.8333 > tom-Latitude-3570.60470: tcp 0
02:23:15.506950 IP tom-Latitude-3570.42516 > 2.56.9.15.8333: tcp 24
02:23:15.507801 IP tom-Latitude-3570.42516 > 2.56.9.15.8333: tcp 109
02:23:15.537288 IP 2.56.9.15.8333 > tom-Latitude-3570.42516: tcp 0
02:23:15.545067 IP 2.56.9.15.8333 > tom-Latitude-3570.42516: tcp 0
02:23:15.677100 IP static-87-75-105-186.vodafonexdsl.co.uk.8333 > tom-Latitude-3570.46284: tcp 24
02:23:15.683040 IP static-87-75-105-186.vodafonexdsl.co.uk.8333 > tom-Latitude-3570.46284: tcp 109
02:23:15.683134 IP tom-Latitude-3570.46284 > static-87-75-105-186.vodafonexdsl.co.uk.8333: tcp 0
02:23:15.885051 IP static-87-75-105-186.vodafonexdsl.co.uk.8333 > tom-Latitude-3570.46284: tcp 24
02:23:15.927924 IP tom-Latitude-3570.46284 > static-87-75-105-186.vodafonexdsl.co.uk.8333: tcp 0
02:23:15.944936 IP static-87-75-105-186.vodafonexdsl.co.uk.8333 > tom-Latitude-3570.46284: tcp 145
02:23:15.944960 IP tom-Latitude-3570.46284 > static-87-75-105-186.vodafonexdsl.co.uk.8333: tcp 0
02:23:15.945287 IP tom-Latitude-3570.46284 > static-87-75-105-186.vodafonexdsl.co.uk.8333: tcp 24
02:23:15.948977 IP tom-Latitude-3570.46284 > static-87-75-105-186.vodafonexdsl.co.uk.8333: tcp 145
02:23:15.985122 IP static-87-75-105-186.vodafonexdsl.co.uk.8333 > tom-Latitude-3570.46284: tcp 0
02:23:16.055084 IP static-87-75-105-186.vodafonexdsl.co.uk.8333 > tom-Latitude-3570.46284: tcp 24
02:23:16.059927 IP static-87-75-105-186.vodafonexdsl.co.uk.8333 > tom-Latitude-3570.46284: tcp 216
02:23:16.060019 IP tom-Latitude-3570.46284 > static-87-75-105-186.vodafonexdsl.co.uk.8333: tcp 0
02:23:16.068189 IP static-87-75-105-186.vodafonexdsl.co.uk.8333 > tom-Latitude-3570.46284: tcp 215
02:23:16.068716 IP static-87-75-105-186.vodafonexdsl.co.uk.8333 > tom-Latitude-3570.46284: tcp 411
02:23:16.068729 IP static-87-75-105-186.vodafonexdsl.co.uk.8333 > tom-Latitude-3570.46284: tcp 256
02:23:16.068733 IP 167.99.216.145.8333 > tom-Latitude-3570.57976: tcp 24
02:23:16.068738 IP 167.99.216.145.8333 > tom-Latitude-3570.57976: tcp 217
02:23:16.068813 IP tom-Latitude-3570.57976 > 167.99.216.145.8333: tcp 0
02:23:16.068836 IP tom-Latitude-3570.46284 > static-87-75-105-186.vodafonexdsl.co.uk.8333: tcp 0
02:23:16.069022 IP tom-Latitude-3570.57976 > 167.99.216.145.8333: tcp 24
02:23:16.070238 IP tom-Latitude-3570.57976 > 167.99.216.145.8333: tcp 73
02:23:16.104950 IP 167.99.216.145.8333 > tom-Latitude-3570.57976: tcp 0
02:23:16.105988 IP 167.99.216.145.8333 > tom-Latitude-3570.57976: tcp 0
02:23:16.165921 IP 167.99.216.145.8333 > tom-Latitude-3570.57976: tcp 24
02:23:16.166623 IP 167.99.216.145.8333 > tom-Latitude-3570.57976: tcp 225
02:23:16.166641 IP 167.99.216.145.8333 > tom-Latitude-3570.57976: tcp 24
02:23:16.166644 IP 167.99.216.145.8333 > tom-Latitude-3570.57976: tcp 224
02:23:16.166733 IP tom-Latitude-3570.57976 > 167.99.216.145.8333: tcp 0
02:23:16.249199 IP bb42-60-217-183.singnet.com.sg.8333 > tom-Latitude-3570.60470: tcp 24
02:23:16.249914 IP bb42-60-217-183.singnet.com.sg.8333 > tom-Latitude-3570.60470: tcp 145
02:23:16.250045 IP tom-Latitude-3570.60470 > bb42-60-217-183.singnet.com.sg.8333: tcp 0
02:23:16.551351 IP tom-Latitude-3570.60988 > 81.198.101.144.8333: tcp 24
02:23:16.552992 IP tom-Latitude-3570.60988 > 81.198.101.144.8333: tcp 217
02:23:16.597581 IP 81.198.101.144.8333 > tom-Latitude-3570.60988: tcp 0
02:23:16.604608 IP 81.198.101.144.8333 > tom-Latitude-3570.60988: tcp 0
02:23:17.153613 IP tom-Latitude-3570.56714 > ns3113832.ip-54-38-177.eu.8333: tcp 24
02:23:17.154450 IP tom-Latitude-3570.56714 > ns3113832.ip-54-38-177.eu.8333: tcp 757
02:23:17.226801 IP ns3113832.ip-54-38-177.eu.8333 > tom-Latitude-3570.56714: tcp 0
02:23:17.226815 IP ns3113832.ip-54-38-177.eu.8333 > tom-Latitude-3570.56714: tcp 0
02:23:17.354441 IP tom-Latitude-3570.39110 > vmi195435.contaboserver.net.8333: tcp 24
02:23:17.355381 IP tom-Latitude-3570.39110 > vmi195435.contaboserver.net.8333: tcp 865
02:23:17.451916 IP tom-Latitude-3570.39110 > vmi195435.contaboserver.net.8333: tcp 865
02:23:17.478182 IP vmi195435.contaboserver.net.8333 > tom-Latitude-3570.39110: tcp 0
02:23:17.478196 IP vmi195435.contaboserver.net.8333 > tom-Latitude-3570.39110: tcp 0
02:23:17.505744 IP vmi195435.contaboserver.net.8333 > tom-Latitude-3570.39110: tcp 0
02:23:17.655525 IP tom-Latitude-3570.49070 > c-185-45-236-223.customer.ggaweb.ch.8333: tcp 24
02:23:17.656511 IP tom-Latitude-3570.49070 > c-185-45-236-223.customer.ggaweb.ch.8333: tcp 217
02:23:17.737421 IP c-185-45-236-223.customer.ggaweb.ch.8333 > tom-Latitude-3570.49070: tcp 0
02:23:17.737435 IP c-185-45-236-223.customer.ggaweb.ch.8333 > tom-Latitude-3570.49070: tcp 24
02:23:17.737445 IP c-185-45-236-223.customer.ggaweb.ch.8333 > tom-Latitude-3570.49070: tcp 505
02:23:17.737537 IP tom-Latitude-3570.49070 > c-185-45-236-223.customer.ggaweb.ch.8333: tcp 0
02:23:17.737886 IP tom-Latitude-3570.49070 > c-185-45-236-223.customer.ggaweb.ch.8333: tcp 24
02:23:17.741365 IP tom-Latitude-3570.49070 > c-185-45-236-223.customer.ggaweb.ch.8333: tcp 289
02:23:17.788096 IP ns3113832.ip-54-38-177.eu.8333 > tom-Latitude-3570.56714: tcp 24
02:23:17.788106 IP tom-Latitude-3570.56714 > ns3113832.ip-54-38-177.eu.8333: tcp 0
02:23:17.788112 IP ns3113832.ip-54-38-177.eu.8333 > tom-Latitude-3570.56714: tcp 181
02:23:17.788114 IP tom-Latitude-3570.56714 > ns3113832.ip-54-38-177.eu.8333: tcp 0
02:23:17.788116 IP c-185-45-236-223.customer.ggaweb.ch.8333 > tom-Latitude-3570.49070: tcp 0
02:23:17.868015 IP c-185-45-236-223.customer.ggaweb.ch.8333 > tom-Latitude-3570.49070: tcp 24
02:23:17.868024 IP c-185-45-236-223.customer.ggaweb.ch.8333 > tom-Latitude-3570.49070: tcp 1391
02:23:17.868027 IP c-185-45-236-223.customer.ggaweb.ch.8333 > tom-Latitude-3570.49070: tcp 980
02:23:17.868031 IP tom-Latitude-3570.49070 > c-185-45-236-223.customer.ggaweb.ch.8333: tcp 0
02:23:17.868492 IP tom-Latitude-3570.42516 > 2.56.9.15.8333: tcp 24
02:23:17.869394 IP tom-Latitude-3570.42516 > 2.56.9.15.8333: tcp 253
02:23:17.911905 IP tom-Latitude-3570.49070 > c-185-45-236-223.customer.ggaweb.ch.8333: tcp 0
02:23:17.983904 IP tom-Latitude-3570.42516 > 2.56.9.15.8333: tcp 253
02:23:18.070632 IP tom-Latitude-3570.57976 > 167.99.216.145.8333: tcp 24
02:23:18.072142 IP tom-Latitude-3570.57976 > 167.99.216.145.8333: tcp 289
02:23:18.072807 IP 2.56.9.15.8333 > tom-Latitude-3570.42516: tcp 0
02:23:18.072822 IP 2.56.9.15.8333 > tom-Latitude-3570.42516: tcp 0
02:23:18.072824 IP 2.56.9.15.8333 > tom-Latitude-3570.42516: tcp 0
02:23:18.109758 IP 167.99.216.145.8333 > tom-Latitude-3570.57976: tcp 0
02:23:18.115139 IP 167.99.216.145.8333 > tom-Latitude-3570.57976: tcp 0
02:23:18.371582 IP tom-Latitude-3570.39110 > vmi195435.contaboserver.net.8333: tcp 24
02:23:18.372974 IP tom-Latitude-3570.39110 > vmi195435.contaboserver.net.8333: tcp 8
02:23:18.406004 IP vmi195435.contaboserver.net.8333 > tom-Latitude-3570.39110: tcp 0
02:23:18.415582 IP vmi195435.contaboserver.net.8333 > tom-Latitude-3570.39110: tcp 0
02:23:18.471911 IP tom-Latitude-3570.60988 > 81.198.101.144.8333: tcp 24
02:23:18.506459 IP vmi195435.contaboserver.net.8333 > tom-Latitude-3570.39110: tcp 24
02:23:18.506476 IP vmi195435.contaboserver.net.8333 > tom-Latitude-3570.39110: tcp 8
02:23:18.506585 IP tom-Latitude-3570.39110 > vmi195435.contaboserver.net.8333: tcp 0
02:23:18.515659 IP tom-Latitude-3570.60988 > 81.198.101.144.8333: tcp 289
02:23:18.555068 IP 81.198.101.144.8333 > tom-Latitude-3570.60988: tcp 0
02:23:18.555733 IP 81.198.101.144.8333 > tom-Latitude-3570.60988: tcp 0
02:23:18.607153 IP tom-Latitude-3570.39110 > vmi195435.contaboserver.net.8333: tcp 24
02:23:18.608097 IP tom-Latitude-3570.39110 > vmi195435.contaboserver.net.8333: tcp 289
02:23:18.637014 IP vmi195435.contaboserver.net.8333 > tom-Latitude-3570.39110: tcp 0
02:23:18.645002 IP vmi195435.contaboserver.net.8333 > tom-Latitude-3570.39110: tcp 0
02:23:18.707549 IP tom-Latitude-3570.56714 > ns3113832.ip-54-38-177.eu.8333: tcp 24
02:23:18.708478 IP tom-Latitude-3570.56714 > ns3113832.ip-54-38-177.eu.8333: tcp 31
02:23:18.736857 IP ns3113832.ip-54-38-177.eu.8333 > tom-Latitude-3570.56714: tcp 0
02:23:18.744894 IP ns3113832.ip-54-38-177.eu.8333 > tom-Latitude-3570.56714: tcp 0
02:23:18.875081 IP vmi195435.contaboserver.net.8333 > tom-Latitude-3570.39110: tcp 24
02:23:18.875745 IP vmi195435.contaboserver.net.8333 > tom-Latitude-3570.39110: tcp 253
02:23:18.875872 IP tom-Latitude-3570.39110 > vmi195435.contaboserver.net.8333: tcp 0
02:23:18.876118 IP tom-Latitude-3570.39110 > vmi195435.contaboserver.net.8333: tcp 24
02:23:18.877417 IP tom-Latitude-3570.39110 > vmi195435.contaboserver.net.8333: tcp 253
02:23:18.905052 IP vmi195435.contaboserver.net.8333 > tom-Latitude-3570.39110: tcp 0
02:23:18.908138 IP vmi195435.contaboserver.net.8333 > tom-Latitude-3570.39110: tcp 0
02:23:18.991933 IP vmi195435.contaboserver.net.8333 > tom-Latitude-3570.39110: tcp 24
02:23:18.991951 IP vmi195435.contaboserver.net.8333 > tom-Latitude-3570.39110: tcp 371
02:23:18.991955 IP vmi195435.contaboserver.net.8333 > tom-Latitude-3570.39110: tcp 24
02:23:18.991957 IP vmi195435.contaboserver.net.8333 > tom-Latitude-3570.39110: tcp 223
02:23:18.991959 IP vmi195435.contaboserver.net.8333 > tom-Latitude-3570.39110: tcp 24
02:23:18.991960 IP vmi195435.contaboserver.net.8333 > tom-Latitude-3570.39110: tcp 225
02:23:18.991962 IP vmi195435.contaboserver.net.8333 > tom-Latitude-3570.39110: tcp 24
02:23:18.991982 IP vmi195435.contaboserver.net.8333 > tom-Latitude-3570.39110: tcp 224
02:23:18.991983 IP vmi195435.contaboserver.net.8333 > tom-Latitude-3570.39110: tcp 24
02:23:18.991985 IP vmi195435.contaboserver.net.8333 > tom-Latitude-3570.39110: tcp 223
02:23:18.992045 IP tom-Latitude-3570.39110 > vmi195435.contaboserver.net.8333: tcp 0
02:23:19.062764 IP vmi195435.contaboserver.net.8333 > tom-Latitude-3570.39110: tcp 518
02:23:19.103907 IP tom-Latitude-3570.39110 > vmi195435.contaboserver.net.8333: tcp 0
02:23:19.105454 IP bb42-60-217-183.singnet.com.sg.8333 > tom-Latitude-3570.60470: tcp 24
02:23:19.105473 IP bb42-60-217-183.singnet.com.sg.8333 > tom-Latitude-3570.60470: tcp 577
02:23:19.105564 IP tom-Latitude-3570.60470 > bb42-60-217-183.singnet.com.sg.8333: tcp 0
02:23:19.333022 IP static-87-75-105-186.vodafonexdsl.co.uk.8333 > tom-Latitude-3570.46284: tcp 24
02:23:19.349098 IP static-87-75-105-186.vodafonexdsl.co.uk.8333 > tom-Latitude-3570.46284: tcp 685
02:23:19.349228 IP tom-Latitude-3570.46284 > static-87-75-105-186.vodafonexdsl.co.uk.8333: tcp 0
02:23:19.349546 IP tom-Latitude-3570.46284 > static-87-75-105-186.vodafonexdsl.co.uk.8333: tcp 24
02:23:19.350765 IP tom-Latitude-3570.46284 > static-87-75-105-186.vodafonexdsl.co.uk.8333: tcp 73
02:23:19.385641 IP static-87-75-105-186.vodafonexdsl.co.uk.8333 > tom-Latitude-3570.46284: tcp 0
02:23:19.482206 IP static-87-75-105-186.vodafonexdsl.co.uk.8333 > tom-Latitude-3570.46284: tcp 24
02:23:19.489102 IP static-87-75-105-186.vodafonexdsl.co.uk.8333 > tom-Latitude-3570.46284: tcp 398
02:23:19.489232 IP tom-Latitude-3570.46284 > static-87-75-105-186.vodafonexdsl.co.uk.8333: tcp 0
02:23:19.489506 IP static-87-75-105-186.vodafonexdsl.co.uk.8333 > tom-Latitude-3570.46284: tcp 248
02:23:19.531904 IP tom-Latitude-3570.46284 > static-87-75-105-186.vodafonexdsl.co.uk.8333: tcp 0
02:23:19.690723 IP tom-Latitude-3570.60988 > 81.198.101.144.8333: tcp 24
02:23:19.691668 IP tom-Latitude-3570.60988 > 81.198.101.144.8333: tcp 325
02:23:19.731394 IP 81.198.101.144.8333 > tom-Latitude-3570.60988: tcp 0
02:23:19.734963 IP 81.198.101.144.8333 > tom-Latitude-3570.60988: tcp 0
02:23:19.823981 IP 81.198.101.144.8333 > tom-Latitude-3570.60988: tcp 24
02:23:19.833322 IP 81.198.101.144.8333 > tom-Latitude-3570.60988: tcp 109
02:23:19.833453 IP tom-Latitude-3570.60988 > 81.198.101.144.8333: tcp 0
02:23:19.833586 IP tom-Latitude-3570.60988 > 81.198.101.144.8333: tcp 24
02:23:19.834416 IP tom-Latitude-3570.60988 > 81.198.101.144.8333: tcp 893
02:23:19.864962 IP 81.198.101.144.8333 > tom-Latitude-3570.60988: tcp 0
02:23:19.865605 IP 81.198.101.144.8333 > tom-Latitude-3570.60988: tcp 0
02:23:19.933977 IP tom-Latitude-3570.39110 > vmi195435.contaboserver.net.8333: tcp 24
02:23:19.935658 IP tom-Latitude-3570.39110 > vmi195435.contaboserver.net.8333: tcp 73
02:23:19.967021 IP vmi195435.contaboserver.net.8333 > tom-Latitude-3570.39110: tcp 0
02:23:19.973822 IP vmi195435.contaboserver.net.8333 > tom-Latitude-3570.39110: tcp 0
02:23:20.837138 IP tom-Latitude-3570.57976 > 167.99.216.145.8333: tcp 24
02:23:20.837246 IP tom-Latitude-3570.42516 > 2.56.9.15.8333: tcp 24
02:23:20.838152 IP tom-Latitude-3570.42516 > 2.56.9.15.8333: tcp 577
02:23:20.838163 IP tom-Latitude-3570.57976 > 167.99.216.145.8333: tcp 325
02:23:20.884545 IP bb42-60-217-183.singnet.com.sg.8333 > tom-Latitude-3570.60470: tcp 24
02:23:20.885124 IP bb42-60-217-183.singnet.com.sg.8333 > tom-Latitude-3570.60470: tcp 109
02:23:20.885258 IP tom-Latitude-3570.60470 > bb42-60-217-183.singnet.com.sg.8333: tcp 0
02:23:20.888133 IP 2.56.9.15.8333 > tom-Latitude-3570.42516: tcp 0
02:23:20.893403 IP 167.99.216.145.8333 > tom-Latitude-3570.57976: tcp 0
02:23:20.894045 IP 167.99.216.145.8333 > tom-Latitude-3570.57976: tcp 0
02:23:20.901702 IP 2.56.9.15.8333 > tom-Latitude-3570.42516: tcp 0
02:23:20.934239 IP vmi195435.contaboserver.net.8333 > tom-Latitude-3570.39110: tcp 24
02:23:20.934263 IP tom-Latitude-3570.39110 > vmi195435.contaboserver.net.8333: tcp 0
02:23:20.934881 IP vmi195435.contaboserver.net.8333 > tom-Latitude-3570.39110: tcp 8
02:23:20.934899 IP tom-Latitude-3570.39110 > vmi195435.contaboserver.net.8333: tcp 0
02:23:20.935118 IP tom-Latitude-3570.39110 > vmi195435.contaboserver.net.8333: tcp 24
02:23:20.936081 IP tom-Latitude-3570.39110 > vmi195435.contaboserver.net.8333: tcp 8
02:23:20.975600 IP vmi195435.contaboserver.net.8333 > tom-Latitude-3570.39110: tcp 0
02:23:20.975614 IP vmi195435.contaboserver.net.8333 > tom-Latitude-3570.39110: tcp 0
02:23:21.471701 IP c-185-45-236-223.customer.ggaweb.ch.8333 > tom-Latitude-3570.49070: tcp 24
02:23:21.471719 IP tom-Latitude-3570.49070 > c-185-45-236-223.customer.ggaweb.ch.8333: tcp 0
02:23:21.471735 IP c-185-45-236-223.customer.ggaweb.ch.8333 > tom-Latitude-3570.49070: tcp 8
02:23:21.471738 IP tom-Latitude-3570.49070 > c-185-45-236-223.customer.ggaweb.ch.8333: tcp 0
02:23:21.471961 IP tom-Latitude-3570.49070 > c-185-45-236-223.customer.ggaweb.ch.8333: tcp 24
02:23:21.473298 IP tom-Latitude-3570.49070 > c-185-45-236-223.customer.ggaweb.ch.8333: tcp 8
02:23:21.504343 IP c-185-45-236-223.customer.ggaweb.ch.8333 > tom-Latitude-3570.49070: tcp 0
02:23:21.572476 IP tom-Latitude-3570.56714 > ns3113832.ip-54-38-177.eu.8333: tcp 24
02:23:21.574033 IP tom-Latitude-3570.56714 > ns3113832.ip-54-38-177.eu.8333: tcp 433
02:23:21.598442 IP 2.56.9.15.8333 > tom-Latitude-3570.42516: tcp 24
02:23:21.599094 IP 2.56.9.15.8333 > tom-Latitude-3570.42516: tcp 109
02:23:21.599112 IP 81.198.101.144.8333 > tom-Latitude-3570.60988: tcp 24
02:23:21.599115 IP 81.198.101.144.8333 > tom-Latitude-3570.60988: tcp 37
02:23:21.599203 IP tom-Latitude-3570.60988 > 81.198.101.144.8333: tcp 0
02:23:21.599234 IP tom-Latitude-3570.42516 > 2.56.9.15.8333: tcp 0
02:23:21.599381 IP tom-Latitude-3570.60988 > 81.198.101.144.8333: tcp 24
02:23:21.599470 IP tom-Latitude-3570.42516 > 2.56.9.15.8333: tcp 24
02:23:21.600782 IP tom-Latitude-3570.42516 > 2.56.9.15.8333: tcp 73
02:23:21.600793 IP tom-Latitude-3570.60988 > 81.198.101.144.8333: tcp 37
02:23:21.605991 IP ns3113832.ip-54-38-177.eu.8333 > tom-Latitude-3570.56714: tcp 0
02:23:21.615207 IP ns3113832.ip-54-38-177.eu.8333 > tom-Latitude-3570.56714: tcp 0
02:23:21.635395 IP 81.198.101.144.8333 > tom-Latitude-3570.60988: tcp 0
02:23:21.635997 IP 2.56.9.15.8333 > tom-Latitude-3570.42516: tcp 0
02:23:21.636012 IP 2.56.9.15.8333 > tom-Latitude-3570.42516: tcp 0
02:23:21.636014 IP 81.198.101.144.8333 > tom-Latitude-3570.60988: tcp 0
02:23:21.732319 IP 81.198.101.144.8333 > tom-Latitude-3570.60988: tcp 24
02:23:21.732337 IP 81.198.101.144.8333 > tom-Latitude-3570.60988: tcp 247
02:23:21.732429 IP tom-Latitude-3570.60988 > 81.198.101.144.8333: tcp 0
02:23:21.821414 IP 2.56.9.15.8333 > tom-Latitude-3570.42516: tcp 24
02:23:21.822089 IP 2.56.9.15.8333 > tom-Latitude-3570.42516: tcp 249
02:23:21.822107 IP 2.56.9.15.8333 > tom-Latitude-3570.42516: tcp 24
02:23:21.822110 IP 2.56.9.15.8333 > tom-Latitude-3570.42516: tcp 249
02:23:21.822201 IP tom-Latitude-3570.42516 > 2.56.9.15.8333: tcp 0
02:23:21.822371 IP tom-Latitude-3570.39110 > vmi195435.contaboserver.net.8333: tcp 24
02:23:21.824246 IP tom-Latitude-3570.39110 > vmi195435.contaboserver.net.8333: tcp 37
02:23:21.855309 IP vmi195435.contaboserver.net.8333 > tom-Latitude-3570.39110: tcp 0
02:23:21.855904 IP vmi195435.contaboserver.net.8333 > tom-Latitude-3570.39110: tcp 0
02:23:21.923379 IP tom-Latitude-3570.49070 > c-185-45-236-223.customer.ggaweb.ch.8333: tcp 24
02:23:21.924366 IP tom-Latitude-3570.49070 > c-185-45-236-223.customer.ggaweb.ch.8333: tcp 433
02:23:21.965207 IP c-185-45-236-223.customer.ggaweb.ch.8333 > tom-Latitude-3570.49070: tcp 0
02:23:22.123983 IP tom-Latitude-3570.56714 > ns3113832.ip-54-38-177.eu.8333: tcp 24
02:23:22.124029 IP tom-Latitude-3570.57976 > 167.99.216.145.8333: tcp 24
02:23:22.124968 IP tom-Latitude-3570.57976 > 167.99.216.145.8333: tcp 109
02:23:22.124979 IP tom-Latitude-3570.56714 > ns3113832.ip-54-38-177.eu.8333: tcp 109
02:23:22.156938 IP ns3113832.ip-54-38-177.eu.8333 > tom-Latitude-3570.56714: tcp 0
02:23:22.165913 IP ns3113832.ip-54-38-177.eu.8333 > tom-Latitude-3570.56714: tcp 0
02:23:22.165926 IP 167.99.216.145.8333 > tom-Latitude-3570.57976: tcp 0
02:23:22.165931 IP 167.99.216.145.8333 > tom-Latitude-3570.57976: tcp 0
02:23:22.324725 IP tom-Latitude-3570.49070 > c-185-45-236-223.customer.ggaweb.ch.8333: tcp 24
02:23:22.346956 IP tom-Latitude-3570.49070 > c-185-45-236-223.customer.ggaweb.ch.8333: tcp 8
02:23:22.447911 IP tom-Latitude-3570.49070 > c-185-45-236-223.customer.ggaweb.ch.8333: tcp 8
02:23:22.459849 IP c-185-45-236-223.customer.ggaweb.ch.8333 > tom-Latitude-3570.49070: tcp 0
02:23:22.468965 IP c-185-45-236-223.customer.ggaweb.ch.8333 > tom-Latitude-3570.49070: tcp 24
02:23:22.468982 IP c-185-45-236-223.customer.ggaweb.ch.8333 > tom-Latitude-3570.49070: tcp 8
02:23:22.469096 IP tom-Latitude-3570.49070 > c-185-45-236-223.customer.ggaweb.ch.8333: tcp 0
02:23:22.477139 IP c-185-45-236-223.customer.ggaweb.ch.8333 > tom-Latitude-3570.49070: tcp 0
02:23:22.770287 IP tom-Latitude-3570.60988 > 81.198.101.144.8333: tcp 24
02:23:22.771219 IP tom-Latitude-3570.60988 > 81.198.101.144.8333: tcp 73
02:23:22.816141 IP 81.198.101.144.8333 > tom-Latitude-3570.60988: tcp 0
02:23:22.823724 IP 81.198.101.144.8333 > tom-Latitude-3570.60988: tcp 0
02:23:23.743419 IP vmi195435.contaboserver.net.8333 > tom-Latitude-3570.39110: tcp 24
02:23:23.743439 IP vmi195435.contaboserver.net.8333 > tom-Latitude-3570.39110: tcp 541
02:23:23.743525 IP tom-Latitude-3570.39110 > vmi195435.contaboserver.net.8333: tcp 0
02:23:23.743861 IP tom-Latitude-3570.39110 > vmi195435.contaboserver.net.8333: tcp 24
02:23:23.746084 IP tom-Latitude-3570.39110 > vmi195435.contaboserver.net.8333: tcp 469
02:23:23.775376 IP vmi195435.contaboserver.net.8333 > tom-Latitude-3570.39110: tcp 541
02:23:23.775385 IP tom-Latitude-3570.39110 > vmi195435.contaboserver.net.8333: tcp 0
02:23:23.775390 IP vmi195435.contaboserver.net.8333 > tom-Latitude-3570.39110: tcp 0
02:23:23.825863 IP vmi195435.contaboserver.net.8333 > tom-Latitude-3570.39110: tcp 0
02:23:23.855662 IP vmi195435.contaboserver.net.8333 > tom-Latitude-3570.39110: tcp 24
02:23:23.855666 IP tom-Latitude-3570.39110 > vmi195435.contaboserver.net.8333: tcp 0
02:23:23.856652 IP vmi195435.contaboserver.net.8333 > tom-Latitude-3570.39110: tcp 373
02:23:23.856676 IP tom-Latitude-3570.39110 > vmi195435.contaboserver.net.8333: tcp 0
02:23:23.856705 IP vmi195435.contaboserver.net.8333 > tom-Latitude-3570.39110: tcp 24
02:23:23.856708 IP tom-Latitude-3570.39110 > vmi195435.contaboserver.net.8333: tcp 0
02:23:23.856711 IP vmi195435.contaboserver.net.8333 > tom-Latitude-3570.39110: tcp 192
02:23:23.856713 IP tom-Latitude-3570.39110 > vmi195435.contaboserver.net.8333: tcp 0
02:23:23.856716 IP vmi195435.contaboserver.net.8333 > tom-Latitude-3570.39110: tcp 24
02:23:23.856718 IP tom-Latitude-3570.39110 > vmi195435.contaboserver.net.8333: tcp 0
02:23:23.856722 IP vmi195435.contaboserver.net.8333 > tom-Latitude-3570.39110: tcp 226
02:23:23.856724 IP tom-Latitude-3570.39110 > vmi195435.contaboserver.net.8333: tcp 0
02:23:23.856728 IP vmi195435.contaboserver.net.8333 > tom-Latitude-3570.39110: tcp 24
02:23:23.856731 IP tom-Latitude-3570.39110 > vmi195435.contaboserver.net.8333: tcp 0
02:23:23.856735 IP vmi195435.contaboserver.net.8333 > tom-Latitude-3570.39110: tcp 249
02:23:23.856738 IP vmi195435.contaboserver.net.8333 > tom-Latitude-3570.39110: tcp 24
02:23:23.856741 IP vmi195435.contaboserver.net.8333 > tom-Latitude-3570.39110: tcp 573
02:23:23.856745 IP tom-Latitude-3570.39110 > vmi195435.contaboserver.net.8333: tcp 0
02:23:23.856753 IP tom-Latitude-3570.39110 > vmi195435.contaboserver.net.8333: tcp 0
02:23:23.856755 IP tom-Latitude-3570.39110 > vmi195435.contaboserver.net.8333: tcp 0
02:23:23.933679 IP vmi195435.contaboserver.net.8333 > tom-Latitude-3570.39110: tcp 1382
02:23:23.933696 IP tom-Latitude-3570.39110 > vmi195435.contaboserver.net.8333: tcp 0
02:23:23.934728 IP vmi195435.contaboserver.net.8333 > tom-Latitude-3570.39110: tcp 66
02:23:23.934746 IP tom-Latitude-3570.39110 > vmi195435.contaboserver.net.8333: tcp 0
02:23:23.934765 IP vmi195435.contaboserver.net.8333 > tom-Latitude-3570.39110: tcp 1448
02:23:23.934767 IP tom-Latitude-3570.39110 > vmi195435.contaboserver.net.8333: tcp 0
02:23:23.934772 IP vmi195435.contaboserver.net.8333 > tom-Latitude-3570.39110: tcp 1423
02:23:23.934791 IP tom-Latitude-3570.39110 > vmi195435.contaboserver.net.8333: tcp 0
02:23:24.041848 IP tom-Latitude-3570.60988 > 81.198.101.144.8333: tcp 24
02:23:24.042786 IP tom-Latitude-3570.60988 > 81.198.101.144.8333: tcp 469
02:23:24.082598 IP 81.198.101.144.8333 > tom-Latitude-3570.60988: tcp 0
02:23:24.083979 IP 81.198.101.144.8333 > tom-Latitude-3570.60988: tcp 0
02:23:24.142424 IP tom-Latitude-3570.42516 > 2.56.9.15.8333: tcp 24
02:23:24.143365 IP tom-Latitude-3570.42516 > 2.56.9.15.8333: tcp 469
02:23:24.177194 IP 2.56.9.15.8333 > tom-Latitude-3570.42516: tcp 0
02:23:24.185058 IP 2.56.9.15.8333 > tom-Latitude-3570.42516: tcp 0
02:23:24.219562 IP 2.56.9.15.8333 > tom-Latitude-3570.42516: tcp 24
02:23:24.220310 IP 2.56.9.15.8333 > tom-Latitude-3570.42516: tcp 505
02:23:24.220440 IP tom-Latitude-3570.42516 > 2.56.9.15.8333: tcp 0
02:23:24.220719 IP tom-Latitude-3570.42516 > 2.56.9.15.8333: tcp 24
02:23:24.222031 IP tom-Latitude-3570.42516 > 2.56.9.15.8333: tcp 37
02:23:24.254816 IP 2.56.9.15.8333 > tom-Latitude-3570.42516: tcp 0
02:23:24.351329 IP 2.56.9.15.8333 > tom-Latitude-3570.42516: tcp 24
02:23:24.352012 IP 2.56.9.15.8333 > tom-Latitude-3570.42516: tcp 247
02:23:24.352143 IP tom-Latitude-3570.42516 > 2.56.9.15.8333: tcp 0
02:23:24.452947 IP tom-Latitude-3570.56714 > ns3113832.ip-54-38-177.eu.8333: tcp 24
02:23:24.453886 IP tom-Latitude-3570.56714 > ns3113832.ip-54-38-177.eu.8333: tcp 505
02:23:24.489334 IP ns3113832.ip-54-38-177.eu.8333 > tom-Latitude-3570.56714: tcp 0
02:23:24.494016 IP ns3113832.ip-54-38-177.eu.8333 > tom-Latitude-3570.56714: tcp 0
02:23:24.753984 IP tom-Latitude-3570.39110 > vmi195435.contaboserver.net.8333: tcp 24
02:23:24.754779 IP tom-Latitude-3570.39110 > vmi195435.contaboserver.net.8333: tcp 37
02:23:24.806614 IP vmi195435.contaboserver.net.8333 > tom-Latitude-3570.39110: tcp 0
02:23:24.815465 IP vmi195435.contaboserver.net.8333 > tom-Latitude-3570.39110: tcp 0
02:23:24.840693 IP 2.56.9.15.8333 > tom-Latitude-3570.42516: tcp 24
02:23:24.841370 IP 2.56.9.15.8333 > tom-Latitude-3570.42516: tcp 8
02:23:24.841501 IP tom-Latitude-3570.42516 > 2.56.9.15.8333: tcp 0
02:23:24.841635 IP tom-Latitude-3570.42516 > 2.56.9.15.8333: tcp 24
02:23:24.843114 IP tom-Latitude-3570.42516 > 2.56.9.15.8333: tcp 8
02:23:24.904670 IP 2.56.9.15.8333 > tom-Latitude-3570.42516: tcp 0
02:23:24.942065 IP tom-Latitude-3570.60988 > 81.198.101.144.8333: tcp 24
02:23:24.943004 IP tom-Latitude-3570.60988 > 81.198.101.144.8333: tcp 37
02:23:24.977540 IP 81.198.101.144.8333 > tom-Latitude-3570.60988: tcp 0
02:23:24.984360 IP 81.198.101.144.8333 > tom-Latitude-3570.60988: tcp 0
02:23:25.632803 IP ns3113832.ip-54-38-177.eu.8333 > tom-Latitude-3570.56714: tcp 24
02:23:25.632828 IP tom-Latitude-3570.56714 > ns3113832.ip-54-38-177.eu.8333: tcp 0
02:23:25.633399 IP ns3113832.ip-54-38-177.eu.8333 > tom-Latitude-3570.56714: tcp 8
02:23:25.633416 IP tom-Latitude-3570.56714 > ns3113832.ip-54-38-177.eu.8333: tcp 0
02:23:25.633655 IP tom-Latitude-3570.56714 > ns3113832.ip-54-38-177.eu.8333: tcp 24
02:23:25.634701 IP tom-Latitude-3570.56714 > ns3113832.ip-54-38-177.eu.8333: tcp 8
02:23:25.663635 IP ns3113832.ip-54-38-177.eu.8333 > tom-Latitude-3570.56714: tcp 0
02:23:25.664255 IP ns3113832.ip-54-38-177.eu.8333 > tom-Latitude-3570.56714: tcp 0
02:23:25.734078 IP tom-Latitude-3570.60988 > 81.198.101.144.8333: tcp 24
02:23:25.734121 IP tom-Latitude-3570.42516 > 2.56.9.15.8333: tcp 24
02:23:25.734237 IP tom-Latitude-3570.46284 > static-87-75-105-186.vodafonexdsl.co.uk.8333: tcp 24
02:23:25.735036 IP tom-Latitude-3570.42516 > 2.56.9.15.8333: tcp 8
02:23:25.735047 IP tom-Latitude-3570.60988 > 81.198.101.144.8333: tcp 8
02:23:25.735617 IP tom-Latitude-3570.46284 > static-87-75-105-186.vodafonexdsl.co.uk.8333: tcp 613
02:23:25.737625 IP 2.56.9.15.8333 > tom-Latitude-3570.42516: tcp 24
02:23:25.739107 IP 2.56.9.15.8333 > tom-Latitude-3570.42516: tcp 109
02:23:25.739239 IP tom-Latitude-3570.42516 > 2.56.9.15.8333: tcp 0
02:23:25.739451 IP tom-Latitude-3570.42516 > 2.56.9.15.8333: tcp 24
02:23:25.739466 IP tom-Latitude-3570.42516 > 2.56.9.15.8333: tcp 109
02:23:25.783230 IP 81.198.101.144.8333 > tom-Latitude-3570.60988: tcp 0
02:23:25.783857 IP 2.56.9.15.8333 > tom-Latitude-3570.42516: tcp 0
02:23:25.783872 IP 81.198.101.144.8333 > tom-Latitude-3570.60988: tcp 0
02:23:25.783875 IP static-87-75-105-186.vodafonexdsl.co.uk.8333 > tom-Latitude-3570.46284: tcp 0
02:23:25.783878 IP 2.56.9.15.8333 > tom-Latitude-3570.42516: tcp 0
02:23:25.872272 IP 81.198.101.144.8333 > tom-Latitude-3570.60988: tcp 24
02:23:25.874155 IP 81.198.101.144.8333 > tom-Latitude-3570.60988: tcp 8
02:23:25.874281 IP tom-Latitude-3570.60988 > 81.198.101.144.8333: tcp 0
02:23:25.883052 IP 2.56.9.15.8333 > tom-Latitude-3570.42516: tcp 24
02:23:25.883835 IP 2.56.9.15.8333 > tom-Latitude-3570.42516: tcp 8
02:23:25.883964 IP tom-Latitude-3570.42516 > 2.56.9.15.8333: tcp 0
02:23:25.895457 IP 2.56.9.15.8333 > tom-Latitude-3570.42516: tcp 24
02:23:25.896151 IP 2.56.9.15.8333 > tom-Latitude-3570.42516: tcp 248
02:23:25.896169 IP 2.56.9.15.8333 > tom-Latitude-3570.42516: tcp 24
02:23:25.896171 IP 2.56.9.15.8333 > tom-Latitude-3570.42516: tcp 247
02:23:25.896175 IP 2.56.9.15.8333 > tom-Latitude-3570.42516: tcp 24
02:23:25.896177 IP 2.56.9.15.8333 > tom-Latitude-3570.42516: tcp 226
02:23:25.896265 IP tom-Latitude-3570.42516 > 2.56.9.15.8333: tcp 0
02:23:25.966300 IP 81.198.101.144.8333 > tom-Latitude-3570.60988: tcp 24
02:23:25.966950 IP 81.198.101.144.8333 > tom-Latitude-3570.60988: tcp 181
02:23:25.967078 IP tom-Latitude-3570.60988 > 81.198.101.144.8333: tcp 0
02:23:25.967304 IP tom-Latitude-3570.60988 > 81.198.101.144.8333: tcp 24
02:23:25.968650 IP tom-Latitude-3570.60988 > 81.198.101.144.8333: tcp 73
02:23:26.005254 IP 81.198.101.144.8333 > tom-Latitude-3570.60988: tcp 0
02:23:26.005868 IP 81.198.101.144.8333 > tom-Latitude-3570.60988: tcp 0
02:23:26.067878 IP tom-Latitude-3570.60470 > bb42-60-217-183.singnet.com.sg.8333: tcp 24
02:23:26.068824 IP tom-Latitude-3570.60470 > bb42-60-217-183.singnet.com.sg.8333: tcp 721
02:23:26.097185 IP bb42-60-217-183.singnet.com.sg.8333 > tom-Latitude-3570.60470: tcp 0
02:23:26.101077 IP 81.198.101.144.8333 > tom-Latitude-3570.60988: tcp 24
02:23:26.101846 IP 81.198.101.144.8333 > tom-Latitude-3570.60988: tcp 223
02:23:26.101864 IP 81.198.101.144.8333 > tom-Latitude-3570.60988: tcp 24
02:23:26.101867 IP 81.198.101.144.8333 > tom-Latitude-3570.60988: tcp 521
02:23:26.101959 IP tom-Latitude-3570.60988 > 81.198.101.144.8333: tcp 0
02:23:26.104655 IP bb42-60-217-183.singnet.com.sg.8333 > tom-Latitude-3570.60470: tcp 0
02:23:26.203255 IP tom-Latitude-3570.56714 > ns3113832.ip-54-38-177.eu.8333: tcp 24
02:23:26.204244 IP tom-Latitude-3570.56714 > ns3113832.ip-54-38-177.eu.8333: tcp 181
02:23:26.237742 IP ns3113832.ip-54-38-177.eu.8333 > tom-Latitude-3570.56714: tcp 0
02:23:26.245172 IP ns3113832.ip-54-38-177.eu.8333 > tom-Latitude-3570.56714: tcp 0
02:23:26.504138 IP tom-Latitude-3570.56714 > ns3113832.ip-54-38-177.eu.8333: tcp 24
02:23:26.505108 IP tom-Latitude-3570.56714 > ns3113832.ip-54-38-177.eu.8333: tcp 8
02:23:26.537252 IP ns3113832.ip-54-38-177.eu.8333 > tom-Latitude-3570.56714: tcp 0
02:23:26.544569 IP ns3113832.ip-54-38-177.eu.8333 > tom-Latitude-3570.56714: tcp 0
02:23:26.602632 IP ns3113832.ip-54-38-177.eu.8333 > tom-Latitude-3570.56714: tcp 24
02:23:26.603212 IP ns3113832.ip-54-38-177.eu.8333 > tom-Latitude-3570.56714: tcp 8
02:23:26.603341 IP tom-Latitude-3570.56714 > ns3113832.ip-54-38-177.eu.8333: tcp 0
02:23:26.642607 IP c-185-45-236-223.customer.ggaweb.ch.8333 > tom-Latitude-3570.49070: tcp 24
02:23:26.642627 IP c-185-45-236-223.customer.ggaweb.ch.8333 > tom-Latitude-3570.49070: tcp 721
02:23:26.642737 IP tom-Latitude-3570.49070 > c-185-45-236-223.customer.ggaweb.ch.8333: tcp 0
02:23:26.643044 IP tom-Latitude-3570.49070 > c-185-45-236-223.customer.ggaweb.ch.8333: tcp 24
02:23:26.644337 IP tom-Latitude-3570.49070 > c-185-45-236-223.customer.ggaweb.ch.8333: tcp 37
02:23:26.674611 IP c-185-45-236-223.customer.ggaweb.ch.8333 > tom-Latitude-3570.49070: tcp 0
02:23:26.675288 IP c-185-45-236-223.customer.ggaweb.ch.8333 > tom-Latitude-3570.49070: tcp 0
02:23:26.757735 IP c-185-45-236-223.customer.ggaweb.ch.8333 > tom-Latitude-3570.49070: tcp 24
02:23:26.758453 IP c-185-45-236-223.customer.ggaweb.ch.8333 > tom-Latitude-3570.49070: tcp 517
02:23:26.758582 IP tom-Latitude-3570.49070 > c-185-45-236-223.customer.ggaweb.ch.8333: tcp 0
02:23:26.854794 IP 81.198.101.144.8333 > tom-Latitude-3570.60988: tcp 24
02:23:26.855475 IP 81.198.101.144.8333 > tom-Latitude-3570.60988: tcp 37
02:23:26.855605 IP tom-Latitude-3570.60988 > 81.198.101.144.8333: tcp 0
02:23:26.855787 IP tom-Latitude-3570.42516 > 2.56.9.15.8333: tcp 24
02:23:26.857239 IP tom-Latitude-3570.42516 > 2.56.9.15.8333: tcp 109
02:23:26.884569 IP 2.56.9.15.8333 > tom-Latitude-3570.42516: tcp 0
02:23:27.357363 IP tom-Latitude-3570.46284 > static-87-75-105-186.vodafonexdsl.co.uk.8333: tcp 24
02:23:27.359467 IP tom-Latitude-3570.46284 > static-87-75-105-186.vodafonexdsl.co.uk.8333: tcp 217
02:23:27.414651 IP static-87-75-105-186.vodafonexdsl.co.uk.8333 > tom-Latitude-3570.46284: tcp 0
02:23:27.558087 IP tom-Latitude-3570.60470 > bb42-60-217-183.singnet.com.sg.8333: tcp 24
02:23:27.559454 IP tom-Latitude-3570.60470 > bb42-60-217-183.singnet.com.sg.8333: tcp 109
02:23:27.586698 IP bb42-60-217-183.singnet.com.sg.8333 > tom-Latitude-3570.60470: tcp 0
02:23:27.594638 IP bb42-60-217-183.singnet.com.sg.8333 > tom-Latitude-3570.60470: tcp 0
02:23:27.758827 IP tom-Latitude-3570.39110 > vmi195435.contaboserver.net.8333: tcp 24
02:23:27.759771 IP tom-Latitude-3570.39110 > vmi195435.contaboserver.net.8333: tcp 217
02:23:27.796158 IP vmi195435.contaboserver.net.8333 > tom-Latitude-3570.39110: tcp 0
02:23:27.812625 IP vmi195435.contaboserver.net.8333 > tom-Latitude-3570.39110: tcp 0
02:23:28.260409 IP tom-Latitude-3570.57976 > 167.99.216.145.8333: tcp 24
02:23:28.261346 IP tom-Latitude-3570.57976 > 167.99.216.145.8333: tcp 8
02:23:28.360816 IP tom-Latitude-3570.56714 > ns3113832.ip-54-38-177.eu.8333: tcp 24
