04:16:40.046108 IP vmi195435.contaboserver.net.8333 > tom-Latitude-3570.39110: tcp 24
04:16:40.046129 IP vmi195435.contaboserver.net.8333 > tom-Latitude-3570.39110: tcp 397
04:16:40.046136 IP vmi195435.contaboserver.net.8333 > tom-Latitude-3570.39110: tcp 397
04:16:40.046164 IP tom-Latitude-3570.39110 > vmi195435.contaboserver.net.8333: tcp 0
04:16:40.046434 IP tom-Latitude-3570.39110 > vmi195435.contaboserver.net.8333: tcp 24
04:16:40.048183 IP tom-Latitude-3570.39110 > vmi195435.contaboserver.net.8333: tcp 181
04:16:40.087508 IP vmi195435.contaboserver.net.8333 > tom-Latitude-3570.39110: tcp 0
04:16:40.166554 IP vmi195435.contaboserver.net.8333 > tom-Latitude-3570.39110: tcp 24
04:16:40.167427 IP vmi195435.contaboserver.net.8333 > tom-Latitude-3570.39110: tcp 191
04:16:40.167446 IP vmi195435.contaboserver.net.8333 > tom-Latitude-3570.39110: tcp 24
04:16:40.167449 IP vmi195435.contaboserver.net.8333 > tom-Latitude-3570.39110: tcp 410
04:16:40.167451 IP vmi195435.contaboserver.net.8333 > tom-Latitude-3570.39110: tcp 24
04:16:40.167454 IP vmi195435.contaboserver.net.8333 > tom-Latitude-3570.39110: tcp 441
04:16:40.167456 IP vmi195435.contaboserver.net.8333 > tom-Latitude-3570.39110: tcp 24
04:16:40.167476 IP vmi195435.contaboserver.net.8333 > tom-Latitude-3570.39110: tcp 374
04:16:40.167478 IP vmi195435.contaboserver.net.8333 > tom-Latitude-3570.39110: tcp 24
04:16:40.167481 IP vmi195435.contaboserver.net.8333 > tom-Latitude-3570.39110: tcp 257
04:16:40.167543 IP tom-Latitude-3570.39110 > vmi195435.contaboserver.net.8333: tcp 0
04:16:40.455907 IP 81.198.101.144.8333 > tom-Latitude-3570.60988: tcp 24
04:16:40.455928 IP 81.198.101.144.8333 > tom-Latitude-3570.60988: tcp 685
04:16:40.456017 IP tom-Latitude-3570.60988 > 81.198.101.144.8333: tcp 0
04:16:40.456291 IP tom-Latitude-3570.60988 > 81.198.101.144.8333: tcp 24
04:16:40.457548 IP tom-Latitude-3570.60988 > 81.198.101.144.8333: tcp 73
04:16:40.542909 IP 81.198.101.144.8333 > tom-Latitude-3570.60988: tcp 0
04:16:40.556724 IP tom-Latitude-3570.49070 > c-185-45-236-223.customer.ggaweb.ch.8333: tcp 24
04:16:40.558777 IP tom-Latitude-3570.49070 > c-185-45-236-223.customer.ggaweb.ch.8333: tcp 181
04:16:40.586320 IP 81.198.101.144.8333 > tom-Latitude-3570.60988: tcp 24
04:16:40.586947 IP 81.198.101.144.8333 > tom-Latitude-3570.60988: tcp 226
04:16:40.586969 IP 81.198.101.144.8333 > tom-Latitude-3570.60988: tcp 24
04:16:40.586972 IP 81.198.101.144.8333 > tom-Latitude-3570.60988: tcp 223
04:16:40.587060 IP tom-Latitude-3570.60988 > 81.198.101.144.8333: tcp 0
04:16:40.597152 IP c-185-45-236-223.customer.ggaweb.ch.8333 > tom-Latitude-3570.49070: tcp 0
04:16:40.688005 IP tom-Latitude-3570.60470 > bb42-60-217-183.singnet.com.sg.8333: tcp 24
04:16:40.688949 IP tom-Latitude-3570.60470 > bb42-60-217-183.singnet.com.sg.8333: tcp 685
04:16:40.717509 IP bb42-60-217-183.singnet.com.sg.8333 > tom-Latitude-3570.60470: tcp 0
04:16:40.733251 IP c-185-45-236-223.customer.ggaweb.ch.8333 > tom-Latitude-3570.49070: tcp 24
04:16:40.733808 IP c-185-45-236-223.customer.ggaweb.ch.8333 > tom-Latitude-3570.49070: tcp 73
04:16:40.733937 IP tom-Latitude-3570.49070 > c-185-45-236-223.customer.ggaweb.ch.8333: tcp 0
04:16:40.736396 IP bb42-60-217-183.singnet.com.sg.8333 > tom-Latitude-3570.60470: tcp 0
04:16:40.834490 IP tom-Latitude-3570.57976 > 167.99.216.145.8333: tcp 24
04:16:40.835425 IP tom-Latitude-3570.57976 > 167.99.216.145.8333: tcp 469
04:16:40.868299 IP 167.99.216.145.8333 > tom-Latitude-3570.57976: tcp 0
04:16:40.875955 IP 167.99.216.145.8333 > tom-Latitude-3570.57976: tcp 0
04:16:41.135557 IP tom-Latitude-3570.39110 > vmi195435.contaboserver.net.8333: tcp 24
04:16:41.137664 IP tom-Latitude-3570.39110 > vmi195435.contaboserver.net.8333: tcp 73
04:16:41.138111 IP 81.198.101.144.8333 > tom-Latitude-3570.60988: tcp 24
04:16:41.138128 IP 81.198.101.144.8333 > tom-Latitude-3570.60988: tcp 109
04:16:41.138215 IP tom-Latitude-3570.60988 > 81.198.101.144.8333: tcp 0
04:16:41.138390 IP tom-Latitude-3570.60988 > 81.198.101.144.8333: tcp 24
04:16:41.141537 IP tom-Latitude-3570.60988 > 81.198.101.144.8333: tcp 109
04:16:41.175009 IP vmi195435.contaboserver.net.8333 > tom-Latitude-3570.39110: tcp 0
04:16:41.175659 IP 81.198.101.144.8333 > tom-Latitude-3570.60988: tcp 0
04:16:41.176306 IP 81.198.101.144.8333 > tom-Latitude-3570.60988: tcp 0
04:16:41.238865 IP tom-Latitude-3570.42516 > 2.56.9.15.8333: tcp 24
04:16:41.239815 IP tom-Latitude-3570.42516 > 2.56.9.15.8333: tcp 397
04:16:41.274970 IP 81.198.101.144.8333 > tom-Latitude-3570.60988: tcp 24
04:16:41.274990 IP 81.198.101.144.8333 > tom-Latitude-3570.60988: tcp 216
04:16:41.274994 IP 81.198.101.144.8333 > tom-Latitude-3570.60988: tcp 24
04:16:41.274996 IP 81.198.101.144.8333 > tom-Latitude-3570.60988: tcp 383
04:16:41.274998 IP 81.198.101.144.8333 > tom-Latitude-3570.60988: tcp 24
04:16:41.275000 IP 81.198.101.144.8333 > tom-Latitude-3570.60988: tcp 256
04:16:41.275019 IP 2.56.9.15.8333 > tom-Latitude-3570.42516: tcp 0
04:16:41.275086 IP tom-Latitude-3570.60988 > 81.198.101.144.8333: tcp 0
04:16:41.288960 IP 2.56.9.15.8333 > tom-Latitude-3570.42516: tcp 0
04:16:41.576800 IP tom-Latitude-3570.42516 > 2.56.9.15.8333: tcp 24
04:16:41.579641 IP tom-Latitude-3570.42516 > 2.56.9.15.8333: tcp 109
04:16:41.628167 IP 2.56.9.15.8333 > tom-Latitude-3570.42516: tcp 0
04:16:41.637484 IP 2.56.9.15.8333 > tom-Latitude-3570.42516: tcp 0
04:16:41.777579 IP tom-Latitude-3570.56714 > ns3113832.ip-54-38-177.eu.8333: tcp 24
04:16:41.823953 IP tom-Latitude-3570.56714 > ns3113832.ip-54-38-177.eu.8333: tcp 361
04:16:41.851909 IP 167.99.216.145.8333 > tom-Latitude-3570.57976: tcp 24
04:16:41.851943 IP 167.99.216.145.8333 > tom-Latitude-3570.57976: tcp 217
04:16:41.852057 IP tom-Latitude-3570.57976 > 167.99.216.145.8333: tcp 0
04:16:41.852254 IP tom-Latitude-3570.57976 > 167.99.216.145.8333: tcp 24
04:16:41.853672 IP tom-Latitude-3570.57976 > 167.99.216.145.8333: tcp 109
04:16:41.867305 IP ns3113832.ip-54-38-177.eu.8333 > tom-Latitude-3570.56714: tcp 0
04:16:41.887189 IP 167.99.216.145.8333 > tom-Latitude-3570.57976: tcp 0
04:16:41.888598 IP 167.99.216.145.8333 > tom-Latitude-3570.57976: tcp 0
04:16:41.949396 IP 167.99.216.145.8333 > tom-Latitude-3570.57976: tcp 24
04:16:41.949948 IP 167.99.216.145.8333 > tom-Latitude-3570.57976: tcp 370
04:16:41.949967 IP 167.99.216.145.8333 > tom-Latitude-3570.57976: tcp 24
04:16:41.950058 IP tom-Latitude-3570.57976 > 167.99.216.145.8333: tcp 0
04:16:41.958328 IP 167.99.216.145.8333 > tom-Latitude-3570.57976: tcp 557
04:16:41.958908 IP 167.99.216.145.8333 > tom-Latitude-3570.57976: tcp 24
04:16:41.958924 IP 167.99.216.145.8333 > tom-Latitude-3570.57976: tcp 225
04:16:41.958959 IP tom-Latitude-3570.57976 > 167.99.216.145.8333: tcp 0
04:16:42.160089 IP tom-Latitude-3570.42516 > 2.56.9.15.8333: tcp 24
04:16:42.162393 IP tom-Latitude-3570.42516 > 2.56.9.15.8333: tcp 109
04:16:42.198299 IP 2.56.9.15.8333 > tom-Latitude-3570.42516: tcp 0
04:16:42.206307 IP 2.56.9.15.8333 > tom-Latitude-3570.42516: tcp 0
04:16:42.260507 IP tom-Latitude-3570.39110 > vmi195435.contaboserver.net.8333: tcp 24
04:16:42.261848 IP tom-Latitude-3570.39110 > vmi195435.contaboserver.net.8333: tcp 217
04:16:42.299669 IP vmi195435.contaboserver.net.8333 > tom-Latitude-3570.39110: tcp 0
04:16:42.661905 IP tom-Latitude-3570.56714 > ns3113832.ip-54-38-177.eu.8333: tcp 24
04:16:42.664406 IP tom-Latitude-3570.56714 > ns3113832.ip-54-38-177.eu.8333: tcp 109
04:16:42.725032 IP ns3113832.ip-54-38-177.eu.8333 > tom-Latitude-3570.56714: tcp 24
04:16:42.725056 IP ns3113832.ip-54-38-177.eu.8333 > tom-Latitude-3570.56714: tcp 253
04:16:42.725145 IP tom-Latitude-3570.56714 > ns3113832.ip-54-38-177.eu.8333: tcp 0
04:16:42.725382 IP tom-Latitude-3570.56714 > ns3113832.ip-54-38-177.eu.8333: tcp 24
04:16:42.725396 IP tom-Latitude-3570.56714 > ns3113832.ip-54-38-177.eu.8333: tcp 145
04:16:42.755988 IP ns3113832.ip-54-38-177.eu.8333 > tom-Latitude-3570.56714: tcp 0
04:16:42.800110 IP ns3113832.ip-54-38-177.eu.8333 > tom-Latitude-3570.56714: tcp 0
04:16:42.814176 IP ns3113832.ip-54-38-177.eu.8333 > tom-Latitude-3570.56714: tcp 24
04:16:42.814992 IP ns3113832.ip-54-38-177.eu.8333 > tom-Latitude-3570.56714: tcp 405
04:16:42.815012 IP ns3113832.ip-54-38-177.eu.8333 > tom-Latitude-3570.56714: tcp 24
04:16:42.815015 IP ns3113832.ip-54-38-177.eu.8333 > tom-Latitude-3570.56714: tcp 225
04:16:42.815017 IP ns3113832.ip-54-38-177.eu.8333 > tom-Latitude-3570.56714: tcp 24
04:16:42.815020 IP ns3113832.ip-54-38-177.eu.8333 > tom-Latitude-3570.56714: tcp 372
04:16:42.815040 IP ns3113832.ip-54-38-177.eu.8333 > tom-Latitude-3570.56714: tcp 24
04:16:42.815042 IP ns3113832.ip-54-38-177.eu.8333 > tom-Latitude-3570.56714: tcp 288
04:16:42.815110 IP tom-Latitude-3570.56714 > ns3113832.ip-54-38-177.eu.8333: tcp 0
04:16:42.918933 IP tom-Latitude-3570.39110 > vmi195435.contaboserver.net.8333: tcp 24
04:16:42.921128 IP tom-Latitude-3570.39110 > vmi195435.contaboserver.net.8333: tcp 145
04:16:42.956994 IP vmi195435.contaboserver.net.8333 > tom-Latitude-3570.39110: tcp 0
04:16:43.220024 IP tom-Latitude-3570.60470 > bb42-60-217-183.singnet.com.sg.8333: tcp 24
04:16:43.220197 IP tom-Latitude-3570.46284 > static-87-75-105-186.vodafonexdsl.co.uk.8333: tcp 24
04:16:43.222155 IP tom-Latitude-3570.60470 > bb42-60-217-183.singnet.com.sg.8333: tcp 361
04:16:43.223798 IP tom-Latitude-3570.46284 > static-87-75-105-186.vodafonexdsl.co.uk.8333: tcp 829
04:16:43.271258 IP bb42-60-217-183.singnet.com.sg.8333 > tom-Latitude-3570.60470: tcp 0
04:16:43.277017 IP static-87-75-105-186.vodafonexdsl.co.uk.8333 > tom-Latitude-3570.46284: tcp 0
04:16:43.277658 IP static-87-75-105-186.vodafonexdsl.co.uk.8333 > tom-Latitude-3570.46284: tcp 0
04:16:43.277671 IP bb42-60-217-183.singnet.com.sg.8333 > tom-Latitude-3570.60470: tcp 0
04:16:43.320592 IP tom-Latitude-3570.57976 > 167.99.216.145.8333: tcp 24
04:16:43.322040 IP tom-Latitude-3570.57976 > 167.99.216.145.8333: tcp 145
04:16:43.358777 IP 167.99.216.145.8333 > tom-Latitude-3570.57976: tcp 0
04:16:43.365411 IP 167.99.216.145.8333 > tom-Latitude-3570.57976: tcp 0
04:16:43.732843 IP 167.99.216.145.8333 > tom-Latitude-3570.57976: tcp 24
04:16:43.732863 IP 167.99.216.145.8333 > tom-Latitude-3570.57976: tcp 73
04:16:43.732955 IP tom-Latitude-3570.57976 > 167.99.216.145.8333: tcp 0
04:16:43.733144 IP tom-Latitude-3570.57976 > 167.99.216.145.8333: tcp 24
04:16:43.734449 IP tom-Latitude-3570.57976 > 167.99.216.145.8333: tcp 73
04:16:43.760641 IP 167.99.216.145.8333 > tom-Latitude-3570.57976: tcp 73
04:16:43.760661 IP tom-Latitude-3570.57976 > 167.99.216.145.8333: tcp 0
04:16:43.776108 IP 167.99.216.145.8333 > tom-Latitude-3570.57976: tcp 0
04:16:43.776122 IP 167.99.216.145.8333 > tom-Latitude-3570.57976: tcp 0
04:16:43.833630 IP tom-Latitude-3570.49070 > c-185-45-236-223.customer.ggaweb.ch.8333: tcp 24
04:16:43.834782 IP tom-Latitude-3570.49070 > c-185-45-236-223.customer.ggaweb.ch.8333: tcp 361
04:16:43.840146 IP 167.99.216.145.8333 > tom-Latitude-3570.57976: tcp 24
04:16:43.840164 IP tom-Latitude-3570.57976 > 167.99.216.145.8333: tcp 0
04:16:43.840183 IP 167.99.216.145.8333 > tom-Latitude-3570.57976: tcp 405
04:16:43.840187 IP tom-Latitude-3570.57976 > 167.99.216.145.8333: tcp 0
04:16:43.840190 IP 167.99.216.145.8333 > tom-Latitude-3570.57976: tcp 24
04:16:43.840210 IP tom-Latitude-3570.57976 > 167.99.216.145.8333: tcp 0
04:16:43.840214 IP 167.99.216.145.8333 > tom-Latitude-3570.57976: tcp 224
04:16:43.840217 IP tom-Latitude-3570.57976 > 167.99.216.145.8333: tcp 0
04:16:43.880360 IP c-185-45-236-223.customer.ggaweb.ch.8333 > tom-Latitude-3570.49070: tcp 0
04:16:44.543356 IP tom-Latitude-3570.60470 > bb42-60-217-183.singnet.com.sg.8333: tcp 24
04:16:44.548112 IP 2.56.9.15.8333 > tom-Latitude-3570.42516: tcp 24
04:16:44.548132 IP 2.56.9.15.8333 > tom-Latitude-3570.42516: tcp 217
04:16:44.548136 IP 2.56.9.15.8333 > tom-Latitude-3570.42516: tcp 217
04:16:44.548164 IP tom-Latitude-3570.42516 > 2.56.9.15.8333: tcp 0
04:16:44.548879 IP tom-Latitude-3570.60470 > bb42-60-217-183.singnet.com.sg.8333: tcp 73
04:16:44.587396 IP bb42-60-217-183.singnet.com.sg.8333 > tom-Latitude-3570.60470: tcp 0
04:16:44.588359 IP bb42-60-217-183.singnet.com.sg.8333 > tom-Latitude-3570.60470: tcp 0
04:16:44.756535 IP vmi195435.contaboserver.net.8333 > tom-Latitude-3570.39110: tcp 24
04:16:44.756556 IP vmi195435.contaboserver.net.8333 > tom-Latitude-3570.39110: tcp 181
04:16:44.756641 IP tom-Latitude-3570.39110 > vmi195435.contaboserver.net.8333: tcp 0
04:16:44.756850 IP tom-Latitude-3570.39110 > vmi195435.contaboserver.net.8333: tcp 24
04:16:44.758303 IP tom-Latitude-3570.39110 > vmi195435.contaboserver.net.8333: tcp 109
04:16:44.797235 IP vmi195435.contaboserver.net.8333 > tom-Latitude-3570.39110: tcp 0
04:16:44.876380 IP vmi195435.contaboserver.net.8333 > tom-Latitude-3570.39110: tcp 24
04:16:44.877101 IP vmi195435.contaboserver.net.8333 > tom-Latitude-3570.39110: tcp 404
04:16:44.877121 IP vmi195435.contaboserver.net.8333 > tom-Latitude-3570.39110: tcp 24
04:16:44.877124 IP vmi195435.contaboserver.net.8333 > tom-Latitude-3570.39110: tcp 372
04:16:44.877126 IP vmi195435.contaboserver.net.8333 > tom-Latitude-3570.39110: tcp 24
04:16:44.877128 IP vmi195435.contaboserver.net.8333 > tom-Latitude-3570.39110: tcp 223
04:16:44.877213 IP tom-Latitude-3570.39110 > vmi195435.contaboserver.net.8333: tcp 0
04:16:45.379973 IP tom-Latitude-3570.60470 > bb42-60-217-183.singnet.com.sg.8333: tcp 24
04:16:45.380060 IP tom-Latitude-3570.42516 > 2.56.9.15.8333: tcp 24
04:16:45.382035 IP tom-Latitude-3570.60470 > bb42-60-217-183.singnet.com.sg.8333: tcp 109
04:16:45.382983 IP tom-Latitude-3570.42516 > 2.56.9.15.8333: tcp 109
04:16:45.403497 IP vmi195435.contaboserver.net.8333 > tom-Latitude-3570.39110: tcp 24
04:16:45.404887 IP vmi195435.contaboserver.net.8333 > tom-Latitude-3570.39110: tcp 109
04:16:45.404905 IP c-185-45-236-223.customer.ggaweb.ch.8333 > tom-Latitude-3570.49070: tcp 24
04:16:45.404909 IP c-185-45-236-223.customer.ggaweb.ch.8333 > tom-Latitude-3570.49070: tcp 325
04:16:45.404913 IP c-185-45-236-223.customer.ggaweb.ch.8333 > tom-Latitude-3570.49070: tcp 325
04:16:45.404941 IP tom-Latitude-3570.49070 > c-185-45-236-223.customer.ggaweb.ch.8333: tcp 0
04:16:45.405010 IP tom-Latitude-3570.39110 > vmi195435.contaboserver.net.8333: tcp 0
04:16:45.405194 IP tom-Latitude-3570.39110 > vmi195435.contaboserver.net.8333: tcp 24
04:16:45.405305 IP tom-Latitude-3570.49070 > c-185-45-236-223.customer.ggaweb.ch.8333: tcp 24
04:16:45.407109 IP tom-Latitude-3570.39110 > vmi195435.contaboserver.net.8333: tcp 109
04:16:45.407881 IP tom-Latitude-3570.49070 > c-185-45-236-223.customer.ggaweb.ch.8333: tcp 37
04:16:45.416059 IP static-87-75-105-186.vodafonexdsl.co.uk.8333 > tom-Latitude-3570.46284: tcp 24
04:16:45.416749 IP static-87-75-105-186.vodafonexdsl.co.uk.8333 > tom-Latitude-3570.46284: tcp 37
04:16:45.416866 IP tom-Latitude-3570.46284 > static-87-75-105-186.vodafonexdsl.co.uk.8333: tcp 0
04:16:45.417002 IP tom-Latitude-3570.46284 > static-87-75-105-186.vodafonexdsl.co.uk.8333: tcp 24
04:16:45.418415 IP tom-Latitude-3570.46284 > static-87-75-105-186.vodafonexdsl.co.uk.8333: tcp 37
04:16:45.425110 IP 2.56.9.15.8333 > tom-Latitude-3570.42516: tcp 0
04:16:45.425157 IP bb42-60-217-183.singnet.com.sg.8333 > tom-Latitude-3570.60470: tcp 0
04:16:45.425160 IP 2.56.9.15.8333 > tom-Latitude-3570.42516: tcp 0
04:16:45.425163 IP bb42-60-217-183.singnet.com.sg.8333 > tom-Latitude-3570.60470: tcp 0
04:16:45.448339 IP vmi195435.contaboserver.net.8333 > tom-Latitude-3570.39110: tcp 0
04:16:45.449012 IP c-185-45-236-223.customer.ggaweb.ch.8333 > tom-Latitude-3570.49070: tcp 0
04:16:45.449026 IP static-87-75-105-186.vodafonexdsl.co.uk.8333 > tom-Latitude-3570.46284: tcp 0
04:16:45.449030 IP static-87-75-105-186.vodafonexdsl.co.uk.8333 > tom-Latitude-3570.46284: tcp 0
04:16:45.527166 IP vmi195435.contaboserver.net.8333 > tom-Latitude-3570.39110: tcp 24
04:16:45.527186 IP vmi195435.contaboserver.net.8333 > tom-Latitude-3570.39110: tcp 247
04:16:45.527190 IP vmi195435.contaboserver.net.8333 > tom-Latitude-3570.39110: tcp 24
04:16:45.527193 IP vmi195435.contaboserver.net.8333 > tom-Latitude-3570.39110: tcp 246
04:16:45.527213 IP vmi195435.contaboserver.net.8333 > tom-Latitude-3570.39110: tcp 24
04:16:45.527215 IP vmi195435.contaboserver.net.8333 > tom-Latitude-3570.39110: tcp 190
04:16:45.527280 IP tom-Latitude-3570.39110 > vmi195435.contaboserver.net.8333: tcp 0
04:16:45.529430 IP c-185-45-236-223.customer.ggaweb.ch.8333 > tom-Latitude-3570.49070: tcp 24
04:16:45.530065 IP c-185-45-236-223.customer.ggaweb.ch.8333 > tom-Latitude-3570.49070: tcp 375
04:16:45.530180 IP tom-Latitude-3570.49070 > c-185-45-236-223.customer.ggaweb.ch.8333: tcp 0
04:16:46.032493 IP tom-Latitude-3570.60470 > bb42-60-217-183.singnet.com.sg.8333: tcp 24
04:16:46.034625 IP tom-Latitude-3570.60470 > bb42-60-217-183.singnet.com.sg.8333: tcp 145
04:16:46.041606 IP 2.56.9.15.8333 > tom-Latitude-3570.42516: tcp 24
04:16:46.041629 IP tom-Latitude-3570.42516 > 2.56.9.15.8333: tcp 0
04:16:46.042288 IP 2.56.9.15.8333 > tom-Latitude-3570.42516: tcp 145
04:16:46.042312 IP tom-Latitude-3570.42516 > 2.56.9.15.8333: tcp 0
04:16:46.055454 IP bb42-60-217-183.singnet.com.sg.8333 > tom-Latitude-3570.60470: tcp 0
04:16:46.077568 IP bb42-60-217-183.singnet.com.sg.8333 > tom-Latitude-3570.60470: tcp 0
04:16:46.243493 IP tom-Latitude-3570.60988 > 81.198.101.144.8333: tcp 24
04:16:46.245746 IP tom-Latitude-3570.60988 > 81.198.101.144.8333: tcp 577
04:16:46.278916 IP 81.198.101.144.8333 > tom-Latitude-3570.60988: tcp 0
04:16:46.286102 IP 81.198.101.144.8333 > tom-Latitude-3570.60988: tcp 0
04:16:46.544697 IP tom-Latitude-3570.57976 > 167.99.216.145.8333: tcp 24
04:16:46.546788 IP tom-Latitude-3570.57976 > 167.99.216.145.8333: tcp 253
04:16:46.579024 IP 167.99.216.145.8333 > tom-Latitude-3570.57976: tcp 0
04:16:46.587030 IP 167.99.216.145.8333 > tom-Latitude-3570.57976: tcp 0
04:16:47.009710 IP 81.198.101.144.8333 > tom-Latitude-3570.60988: tcp 24
04:16:47.009730 IP 81.198.101.144.8333 > tom-Latitude-3570.60988: tcp 109
04:16:47.009734 IP 81.198.101.144.8333 > tom-Latitude-3570.60988: tcp 109
04:16:47.009762 IP tom-Latitude-3570.60988 > 81.198.101.144.8333: tcp 0
04:16:47.010009 IP tom-Latitude-3570.60988 > 81.198.101.144.8333: tcp 24
04:16:47.011752 IP tom-Latitude-3570.60988 > 81.198.101.144.8333: tcp 109
04:16:47.047103 IP 81.198.101.144.8333 > tom-Latitude-3570.60988: tcp 0
04:16:47.047645 IP 81.198.101.144.8333 > tom-Latitude-3570.60988: tcp 0
04:16:47.136256 IP 81.198.101.144.8333 > tom-Latitude-3570.60988: tcp 24
04:16:47.136815 IP 81.198.101.144.8333 > tom-Latitude-3570.60988: tcp 223
04:16:47.136826 IP 81.198.101.144.8333 > tom-Latitude-3570.60988: tcp 24
04:16:47.136829 IP 81.198.101.144.8333 > tom-Latitude-3570.60988: tcp 225
04:16:47.136831 IP 81.198.101.144.8333 > tom-Latitude-3570.60988: tcp 24
04:16:47.136833 IP 81.198.101.144.8333 > tom-Latitude-3570.60988: tcp 249
04:16:47.136903 IP tom-Latitude-3570.60988 > 81.198.101.144.8333: tcp 0
04:16:47.438931 IP tom-Latitude-3570.46284 > static-87-75-105-186.vodafonexdsl.co.uk.8333: tcp 24
04:16:47.441119 IP tom-Latitude-3570.46284 > static-87-75-105-186.vodafonexdsl.co.uk.8333: tcp 433
04:16:47.487446 IP static-87-75-105-186.vodafonexdsl.co.uk.8333 > tom-Latitude-3570.46284: tcp 0
04:16:47.496489 IP static-87-75-105-186.vodafonexdsl.co.uk.8333 > tom-Latitude-3570.46284: tcp 0
04:16:47.530053 IP 167.99.216.145.8333 > tom-Latitude-3570.57976: tcp 24
04:16:47.530076 IP tom-Latitude-3570.57976 > 167.99.216.145.8333: tcp 0
04:16:47.530637 IP 167.99.216.145.8333 > tom-Latitude-3570.57976: tcp 145
04:16:47.530661 IP tom-Latitude-3570.57976 > 167.99.216.145.8333: tcp 0
04:16:47.530957 IP tom-Latitude-3570.57976 > 167.99.216.145.8333: tcp 24
04:16:47.533025 IP tom-Latitude-3570.57976 > 167.99.216.145.8333: tcp 37
04:16:47.568579 IP 167.99.216.145.8333 > tom-Latitude-3570.57976: tcp 0
04:16:47.568594 IP 167.99.216.145.8333 > tom-Latitude-3570.57976: tcp 0
04:16:47.629754 IP 167.99.216.145.8333 > tom-Latitude-3570.57976: tcp 24
04:16:47.630403 IP 167.99.216.145.8333 > tom-Latitude-3570.57976: tcp 223
04:16:47.630532 IP tom-Latitude-3570.57976 > 167.99.216.145.8333: tcp 0
04:16:48.232911 IP tom-Latitude-3570.46284 > static-87-75-105-186.vodafonexdsl.co.uk.8333: tcp 24
04:16:48.234968 IP tom-Latitude-3570.46284 > static-87-75-105-186.vodafonexdsl.co.uk.8333: tcp 37
04:16:48.275384 IP c-185-45-236-223.customer.ggaweb.ch.8333 > tom-Latitude-3570.49070: tcp 24
04:16:48.275403 IP c-185-45-236-223.customer.ggaweb.ch.8333 > tom-Latitude-3570.49070: tcp 145
04:16:48.275519 IP tom-Latitude-3570.49070 > c-185-45-236-223.customer.ggaweb.ch.8333: tcp 0
04:16:48.275776 IP tom-Latitude-3570.60470 > bb42-60-217-183.singnet.com.sg.8333: tcp 24
04:16:48.277544 IP tom-Latitude-3570.60470 > bb42-60-217-183.singnet.com.sg.8333: tcp 145
04:16:48.278181 IP static-87-75-105-186.vodafonexdsl.co.uk.8333 > tom-Latitude-3570.46284: tcp 0
04:16:48.285867 IP static-87-75-105-186.vodafonexdsl.co.uk.8333 > tom-Latitude-3570.46284: tcp 0
04:16:48.319272 IP bb42-60-217-183.singnet.com.sg.8333 > tom-Latitude-3570.60470: tcp 0
04:16:48.319287 IP bb42-60-217-183.singnet.com.sg.8333 > tom-Latitude-3570.60470: tcp 0
04:16:48.351949 IP static-87-75-105-186.vodafonexdsl.co.uk.8333 > tom-Latitude-3570.46284: tcp 24
04:16:48.352594 IP static-87-75-105-186.vodafonexdsl.co.uk.8333 > tom-Latitude-3570.46284: tcp 37
04:16:48.352723 IP tom-Latitude-3570.46284 > static-87-75-105-186.vodafonexdsl.co.uk.8333: tcp 0
04:16:48.352934 IP tom-Latitude-3570.56714 > ns3113832.ip-54-38-177.eu.8333: tcp 24
04:16:48.352974 IP tom-Latitude-3570.46284 > static-87-75-105-186.vodafonexdsl.co.uk.8333: tcp 24
04:16:48.354246 IP tom-Latitude-3570.56714 > ns3113832.ip-54-38-177.eu.8333: tcp 469
04:16:48.355011 IP tom-Latitude-3570.46284 > static-87-75-105-186.vodafonexdsl.co.uk.8333: tcp 223
04:16:48.386978 IP ns3113832.ip-54-38-177.eu.8333 > tom-Latitude-3570.56714: tcp 0
04:16:48.387596 IP static-87-75-105-186.vodafonexdsl.co.uk.8333 > tom-Latitude-3570.46284: tcp 0
04:16:48.387610 IP ns3113832.ip-54-38-177.eu.8333 > tom-Latitude-3570.56714: tcp 0
04:16:48.387613 IP static-87-75-105-186.vodafonexdsl.co.uk.8333 > tom-Latitude-3570.46284: tcp 0
04:16:48.647771 IP ns3113832.ip-54-38-177.eu.8333 > tom-Latitude-3570.56714: tcp 24
04:16:48.647791 IP ns3113832.ip-54-38-177.eu.8333 > tom-Latitude-3570.56714: tcp 109
04:16:48.647903 IP tom-Latitude-3570.56714 > ns3113832.ip-54-38-177.eu.8333: tcp 0
04:16:48.648127 IP tom-Latitude-3570.56714 > ns3113832.ip-54-38-177.eu.8333: tcp 24
04:16:48.649534 IP tom-Latitude-3570.56714 > ns3113832.ip-54-38-177.eu.8333: tcp 109
04:16:48.686943 IP ns3113832.ip-54-38-177.eu.8333 > tom-Latitude-3570.56714: tcp 0
04:16:48.687991 IP ns3113832.ip-54-38-177.eu.8333 > tom-Latitude-3570.56714: tcp 0
04:16:48.744003 IP ns3113832.ip-54-38-177.eu.8333 > tom-Latitude-3570.56714: tcp 24
04:16:48.746651 IP ns3113832.ip-54-38-177.eu.8333 > tom-Latitude-3570.56714: tcp 256
04:16:48.746670 IP ns3113832.ip-54-38-177.eu.8333 > tom-Latitude-3570.56714: tcp 24
04:16:48.746673 IP ns3113832.ip-54-38-177.eu.8333 > tom-Latitude-3570.56714: tcp 192
04:16:48.746676 IP ns3113832.ip-54-38-177.eu.8333 > tom-Latitude-3570.56714: tcp 24
04:16:48.746678 IP ns3113832.ip-54-38-177.eu.8333 > tom-Latitude-3570.56714: tcp 225
04:16:48.746767 IP tom-Latitude-3570.56714 > ns3113832.ip-54-38-177.eu.8333: tcp 0
04:16:49.671786 IP 167.99.216.145.8333 > tom-Latitude-3570.57976: tcp 24
04:16:49.671806 IP 167.99.216.145.8333 > tom-Latitude-3570.57976: tcp 181
04:16:49.671811 IP 167.99.216.145.8333 > tom-Latitude-3570.57976: tcp 181
04:16:49.671839 IP tom-Latitude-3570.57976 > 167.99.216.145.8333: tcp 0
04:16:49.672111 IP tom-Latitude-3570.57976 > 167.99.216.145.8333: tcp 24
04:16:49.673603 IP tom-Latitude-3570.57976 > 167.99.216.145.8333: tcp 73
04:16:49.691999 IP ns3113832.ip-54-38-177.eu.8333 > tom-Latitude-3570.56714: tcp 24
04:16:49.692018 IP ns3113832.ip-54-38-177.eu.8333 > tom-Latitude-3570.56714: tcp 73
04:16:49.692129 IP tom-Latitude-3570.56714 > ns3113832.ip-54-38-177.eu.8333: tcp 0
04:16:49.704431 IP 167.99.216.145.8333 > tom-Latitude-3570.57976: tcp 0
04:16:49.708122 IP 167.99.216.145.8333 > tom-Latitude-3570.57976: tcp 0
04:16:49.770535 IP 167.99.216.145.8333 > tom-Latitude-3570.57976: tcp 24
04:16:49.770543 IP 167.99.216.145.8333 > tom-Latitude-3570.57976: tcp 257
04:16:49.770546 IP 167.99.216.145.8333 > tom-Latitude-3570.57976: tcp 24
04:16:49.770549 IP 167.99.216.145.8333 > tom-Latitude-3570.57976: tcp 223
04:16:49.770554 IP tom-Latitude-3570.57976 > 167.99.216.145.8333: tcp 0
04:16:49.770593 IP tom-Latitude-3570.57976 > 167.99.216.145.8333: tcp 0
04:16:50.072150 IP tom-Latitude-3570.60988 > 81.198.101.144.8333: tcp 24
04:16:50.074498 IP tom-Latitude-3570.60988 > 81.198.101.144.8333: tcp 217
04:16:50.082165 IP 167.99.216.145.8333 > tom-Latitude-3570.57976: tcp 24
04:16:50.082184 IP 167.99.216.145.8333 > tom-Latitude-3570.57976: tcp 37
04:16:50.082277 IP tom-Latitude-3570.57976 > 167.99.216.145.8333: tcp 0
04:16:50.082439 IP tom-Latitude-3570.57976 > 167.99.216.145.8333: tcp 24
04:16:50.083727 IP tom-Latitude-3570.57976 > 167.99.216.145.8333: tcp 37
04:16:50.117219 IP 81.198.101.144.8333 > tom-Latitude-3570.60988: tcp 0
04:16:50.117831 IP 81.198.101.144.8333 > tom-Latitude-3570.60988: tcp 0
04:16:50.117845 IP 167.99.216.145.8333 > tom-Latitude-3570.57976: tcp 0
04:16:50.117849 IP 167.99.216.145.8333 > tom-Latitude-3570.57976: tcp 0
04:16:50.182910 IP tom-Latitude-3570.46284 > static-87-75-105-186.vodafonexdsl.co.uk.8333: tcp 24
04:16:50.183944 IP tom-Latitude-3570.46284 > static-87-75-105-186.vodafonexdsl.co.uk.8333: tcp 181
04:16:50.219780 IP static-87-75-105-186.vodafonexdsl.co.uk.8333 > tom-Latitude-3570.46284: tcp 0
04:16:50.227160 IP static-87-75-105-186.vodafonexdsl.co.uk.8333 > tom-Latitude-3570.46284: tcp 0
04:16:50.885331 IP tom-Latitude-3570.49070 > c-185-45-236-223.customer.ggaweb.ch.8333: tcp 24
04:16:50.887454 IP tom-Latitude-3570.49070 > c-185-45-236-223.customer.ggaweb.ch.8333: tcp 181
04:16:50.935582 IP bb42-60-217-183.singnet.com.sg.8333 > tom-Latitude-3570.60470: tcp 24
04:16:50.935604 IP bb42-60-217-183.singnet.com.sg.8333 > tom-Latitude-3570.60470: tcp 217
04:16:50.935686 IP tom-Latitude-3570.60470 > bb42-60-217-183.singnet.com.sg.8333: tcp 0
04:16:50.935948 IP tom-Latitude-3570.60470 > bb42-60-217-183.singnet.com.sg.8333: tcp 24
04:16:50.937206 IP tom-Latitude-3570.60470 > bb42-60-217-183.singnet.com.sg.8333: tcp 37
04:16:50.944916 IP c-185-45-236-223.customer.ggaweb.ch.8333 > tom-Latitude-3570.49070: tcp 0
04:16:50.964991 IP bb42-60-217-183.singnet.com.sg.8333 > tom-Latitude-3570.60470: tcp 0
04:16:50.966604 IP bb42-60-217-183.singnet.com.sg.8333 > tom-Latitude-3570.60470: tcp 0
04:16:51.025015 IP ns3113832.ip-54-38-177.eu.8333 > tom-Latitude-3570.56714: tcp 24
04:16:51.025699 IP ns3113832.ip-54-38-177.eu.8333 > tom-Latitude-3570.56714: tcp 73
04:16:51.025828 IP tom-Latitude-3570.56714 > ns3113832.ip-54-38-177.eu.8333: tcp 0
04:16:51.026020 IP tom-Latitude-3570.56714 > ns3113832.ip-54-38-177.eu.8333: tcp 24
04:16:51.027529 IP tom-Latitude-3570.56714 > ns3113832.ip-54-38-177.eu.8333: tcp 37
04:16:51.056920 IP ns3113832.ip-54-38-177.eu.8333 > tom-Latitude-3570.56714: tcp 0
04:16:51.056935 IP ns3113832.ip-54-38-177.eu.8333 > tom-Latitude-3570.56714: tcp 0
04:16:51.113026 IP ns3113832.ip-54-38-177.eu.8333 > tom-Latitude-3570.56714: tcp 24
04:16:51.113666 IP ns3113832.ip-54-38-177.eu.8333 > tom-Latitude-3570.56714: tcp 223
04:16:51.113701 IP tom-Latitude-3570.56714 > ns3113832.ip-54-38-177.eu.8333: tcp 0
04:16:51.122967 IP static-87-75-105-186.vodafonexdsl.co.uk.8333 > tom-Latitude-3570.46284: tcp 24
04:16:51.126332 IP static-87-75-105-186.vodafonexdsl.co.uk.8333 > tom-Latitude-3570.46284: tcp 73
04:16:51.126345 IP tom-Latitude-3570.46284 > static-87-75-105-186.vodafonexdsl.co.uk.8333: tcp 0
04:16:51.327224 IP tom-Latitude-3570.60988 > 81.198.101.144.8333: tcp 24
04:16:51.327312 IP tom-Latitude-3570.60470 > bb42-60-217-183.singnet.com.sg.8333: tcp 24
04:16:51.329268 IP tom-Latitude-3570.60988 > 81.198.101.144.8333: tcp 37
04:16:51.330277 IP tom-Latitude-3570.60470 > bb42-60-217-183.singnet.com.sg.8333: tcp 37
04:16:51.342055 IP bb42-60-217-183.singnet.com.sg.8333 > tom-Latitude-3570.60470: tcp 24
04:16:51.345206 IP bb42-60-217-183.singnet.com.sg.8333 > tom-Latitude-3570.60470: tcp 224
04:16:51.345339 IP tom-Latitude-3570.60470 > bb42-60-217-183.singnet.com.sg.8333: tcp 0
04:16:51.356018 IP 81.198.101.144.8333 > tom-Latitude-3570.60988: tcp 0
04:16:51.364012 IP bb42-60-217-183.singnet.com.sg.8333 > tom-Latitude-3570.60470: tcp 0
04:16:51.365182 IP 81.198.101.144.8333 > tom-Latitude-3570.60988: tcp 0
04:16:51.365196 IP bb42-60-217-183.singnet.com.sg.8333 > tom-Latitude-3570.60470: tcp 0
04:16:51.546471 IP tom-Latitude-3570.42516 > 2.56.9.15.8333: tcp 24
04:16:51.548550 IP tom-Latitude-3570.42516 > 2.56.9.15.8333: tcp 397
04:16:51.577879 IP 2.56.9.15.8333 > tom-Latitude-3570.42516: tcp 0
04:16:51.585059 IP 2.56.9.15.8333 > tom-Latitude-3570.42516: tcp 0
04:16:51.646905 IP tom-Latitude-3570.60988 > 81.198.101.144.8333: tcp 24
04:16:51.647942 IP tom-Latitude-3570.60988 > 81.198.101.144.8333: tcp 37
04:16:51.677153 IP 81.198.101.144.8333 > tom-Latitude-3570.60988: tcp 0
04:16:51.685114 IP 81.198.101.144.8333 > tom-Latitude-3570.60988: tcp 0
04:16:52.248974 IP tom-Latitude-3570.57976 > 167.99.216.145.8333: tcp 24
04:16:52.252133 IP tom-Latitude-3570.57976 > 167.99.216.145.8333: tcp 73
04:16:52.253692 IP vmi195435.contaboserver.net.8333 > tom-Latitude-3570.39110: tcp 24
04:16:52.253711 IP vmi195435.contaboserver.net.8333 > tom-Latitude-3570.39110: tcp 469
04:16:52.253717 IP vmi195435.contaboserver.net.8333 > tom-Latitude-3570.39110: tcp 469
04:16:52.253745 IP tom-Latitude-3570.39110 > vmi195435.contaboserver.net.8333: tcp 0
04:16:52.254089 IP tom-Latitude-3570.39110 > vmi195435.contaboserver.net.8333: tcp 24
04:16:52.255256 IP tom-Latitude-3570.39110 > vmi195435.contaboserver.net.8333: tcp 37
04:16:52.271616 IP 81.198.101.144.8333 > tom-Latitude-3570.60988: tcp 24
04:16:52.272216 IP 81.198.101.144.8333 > tom-Latitude-3570.60988: tcp 37
04:16:52.272345 IP tom-Latitude-3570.60988 > 81.198.101.144.8333: tcp 0
04:16:52.272527 IP tom-Latitude-3570.60988 > 81.198.101.144.8333: tcp 24
04:16:52.274279 IP tom-Latitude-3570.60988 > 81.198.101.144.8333: tcp 37
04:16:52.285751 IP 167.99.216.145.8333 > tom-Latitude-3570.57976: tcp 0
04:16:52.285765 IP 167.99.216.145.8333 > tom-Latitude-3570.57976: tcp 0
04:16:52.285768 IP vmi195435.contaboserver.net.8333 > tom-Latitude-3570.39110: tcp 0
04:16:52.305669 IP 81.198.101.144.8333 > tom-Latitude-3570.60988: tcp 0
04:16:52.305684 IP 81.198.101.144.8333 > tom-Latitude-3570.60988: tcp 0
04:16:52.364569 IP vmi195435.contaboserver.net.8333 > tom-Latitude-3570.39110: tcp 24
04:16:52.365198 IP vmi195435.contaboserver.net.8333 > tom-Latitude-3570.39110: tcp 249
04:16:52.365328 IP tom-Latitude-3570.39110 > vmi195435.contaboserver.net.8333: tcp 0
04:16:52.365778 IP tom-Latitude-3570.60470 > bb42-60-217-183.singnet.com.sg.8333: tcp 24
04:16:52.365817 IP tom-Latitude-3570.42516 > 2.56.9.15.8333: tcp 24
04:16:52.367037 IP tom-Latitude-3570.60470 > bb42-60-217-183.singnet.com.sg.8333: tcp 37
04:16:52.367636 IP tom-Latitude-3570.42516 > 2.56.9.15.8333: tcp 37
04:16:52.395906 IP 81.198.101.144.8333 > tom-Latitude-3570.60988: tcp 24
04:16:52.395925 IP 81.198.101.144.8333 > tom-Latitude-3570.60988: tcp 371
04:16:52.395930 IP bb42-60-217-183.singnet.com.sg.8333 > tom-Latitude-3570.60470: tcp 0
04:16:52.395953 IP 2.56.9.15.8333 > tom-Latitude-3570.42516: tcp 0
04:16:52.395957 IP bb42-60-217-183.singnet.com.sg.8333 > tom-Latitude-3570.60470: tcp 0
04:16:52.395960 IP 2.56.9.15.8333 > tom-Latitude-3570.42516: tcp 0
04:16:52.396020 IP tom-Latitude-3570.60988 > 81.198.101.144.8333: tcp 0
04:16:52.898065 IP tom-Latitude-3570.60988 > 81.198.101.144.8333: tcp 24
04:16:52.900330 IP tom-Latitude-3570.60988 > 81.198.101.144.8333: tcp 37
04:16:52.948695 IP 81.198.101.144.8333 > tom-Latitude-3570.60988: tcp 0
04:16:52.955224 IP 81.198.101.144.8333 > tom-Latitude-3570.60988: tcp 0
04:16:53.043274 IP 81.198.101.144.8333 > tom-Latitude-3570.60988: tcp 24
04:16:53.043913 IP 81.198.101.144.8333 > tom-Latitude-3570.60988: tcp 37
04:16:53.044041 IP tom-Latitude-3570.60988 > 81.198.101.144.8333: tcp 0
04:16:53.044183 IP tom-Latitude-3570.60988 > 81.198.101.144.8333: tcp 24
04:16:53.048236 IP tom-Latitude-3570.60988 > 81.198.101.144.8333: tcp 249
04:16:53.076700 IP 81.198.101.144.8333 > tom-Latitude-3570.60988: tcp 0
04:16:53.077716 IP 81.198.101.144.8333 > tom-Latitude-3570.60988: tcp 0
04:16:53.244978 IP tom-Latitude-3570.56714 > ns3113832.ip-54-38-177.eu.8333: tcp 24
04:16:53.247196 IP tom-Latitude-3570.56714 > ns3113832.ip-54-38-177.eu.8333: tcp 73
04:16:53.279390 IP ns3113832.ip-54-38-177.eu.8333 > tom-Latitude-3570.56714: tcp 0
04:16:53.286838 IP ns3113832.ip-54-38-177.eu.8333 > tom-Latitude-3570.56714: tcp 0
04:16:53.341788 IP vmi195435.contaboserver.net.8333 > tom-Latitude-3570.39110: tcp 24
04:16:53.341795 IP vmi195435.contaboserver.net.8333 > tom-Latitude-3570.39110: tcp 37
04:16:53.341812 IP tom-Latitude-3570.39110 > vmi195435.contaboserver.net.8333: tcp 0
04:16:53.542722 IP tom-Latitude-3570.49070 > c-185-45-236-223.customer.ggaweb.ch.8333: tcp 24
04:16:53.542786 IP tom-Latitude-3570.57976 > 167.99.216.145.8333: tcp 24
04:16:53.544800 IP tom-Latitude-3570.49070 > c-185-45-236-223.customer.ggaweb.ch.8333: tcp 145
04:16:53.545368 IP tom-Latitude-3570.57976 > 167.99.216.145.8333: tcp 73
04:16:53.587432 IP 167.99.216.145.8333 > tom-Latitude-3570.57976: tcp 0
04:16:53.587446 IP c-185-45-236-223.customer.ggaweb.ch.8333 > tom-Latitude-3570.49070: tcp 0
04:16:53.587449 IP 167.99.216.145.8333 > tom-Latitude-3570.57976: tcp 0
04:16:55.047366 IP tom-Latitude-3570.46284 > static-87-75-105-186.vodafonexdsl.co.uk.8333: tcp 24
04:16:55.051158 IP tom-Latitude-3570.46284 > static-87-75-105-186.vodafonexdsl.co.uk.8333: tcp 73
04:16:55.051838 IP bb42-60-217-183.singnet.com.sg.8333 > tom-Latitude-3570.60470: tcp 24
04:16:55.051858 IP bb42-60-217-183.singnet.com.sg.8333 > tom-Latitude-3570.60470: tcp 145
04:16:55.051948 IP tom-Latitude-3570.60470 > bb42-60-217-183.singnet.com.sg.8333: tcp 0
04:16:55.052099 IP tom-Latitude-3570.60470 > bb42-60-217-183.singnet.com.sg.8333: tcp 24
04:16:55.054488 IP tom-Latitude-3570.60470 > bb42-60-217-183.singnet.com.sg.8333: tcp 109
04:16:55.088679 IP static-87-75-105-186.vodafonexdsl.co.uk.8333 > tom-Latitude-3570.46284: tcp 0
04:16:55.088726 IP static-87-75-105-186.vodafonexdsl.co.uk.8333 > tom-Latitude-3570.46284: tcp 0
04:16:55.088728 IP bb42-60-217-183.singnet.com.sg.8333 > tom-Latitude-3570.60470: tcp 0
04:16:55.088732 IP bb42-60-217-183.singnet.com.sg.8333 > tom-Latitude-3570.60470: tcp 0
04:16:55.815906 IP bb42-60-217-183.singnet.com.sg.8333 > tom-Latitude-3570.60470: tcp 24
04:16:55.815926 IP bb42-60-217-183.singnet.com.sg.8333 > tom-Latitude-3570.60470: tcp 225
04:16:55.815930 IP bb42-60-217-183.singnet.com.sg.8333 > tom-Latitude-3570.60470: tcp 24
04:16:55.815932 IP bb42-60-217-183.singnet.com.sg.8333 > tom-Latitude-3570.60470: tcp 226
04:16:55.815953 IP bb42-60-217-183.singnet.com.sg.8333 > tom-Latitude-3570.60470: tcp 24
04:16:55.815955 IP bb42-60-217-183.singnet.com.sg.8333 > tom-Latitude-3570.60470: tcp 257
04:16:55.815959 IP bb42-60-217-183.singnet.com.sg.8333 > tom-Latitude-3570.60470: tcp 257
04:16:55.815971 IP tom-Latitude-3570.60470 > bb42-60-217-183.singnet.com.sg.8333: tcp 0
04:16:55.919296 IP tom-Latitude-3570.60988 > 81.198.101.144.8333: tcp 24
04:16:55.921344 IP tom-Latitude-3570.60988 > 81.198.101.144.8333: tcp 109
04:16:55.950333 IP 81.198.101.144.8333 > tom-Latitude-3570.60988: tcp 0
04:16:55.957318 IP 81.198.101.144.8333 > tom-Latitude-3570.60988: tcp 0
04:16:56.220343 IP tom-Latitude-3570.46284 > static-87-75-105-186.vodafonexdsl.co.uk.8333: tcp 24
04:16:56.222446 IP tom-Latitude-3570.46284 > static-87-75-105-186.vodafonexdsl.co.uk.8333: tcp 8
04:16:56.268801 IP static-87-75-105-186.vodafonexdsl.co.uk.8333 > tom-Latitude-3570.46284: tcp 0
04:16:56.279475 IP static-87-75-105-186.vodafonexdsl.co.uk.8333 > tom-Latitude-3570.46284: tcp 0
04:16:56.342458 IP static-87-75-105-186.vodafonexdsl.co.uk.8333 > tom-Latitude-3570.46284: tcp 24
04:16:56.354490 IP static-87-75-105-186.vodafonexdsl.co.uk.8333 > tom-Latitude-3570.46284: tcp 357
04:16:56.354621 IP tom-Latitude-3570.46284 > static-87-75-105-186.vodafonexdsl.co.uk.8333: tcp 0
04:16:56.354912 IP tom-Latitude-3570.46284 > static-87-75-105-186.vodafonexdsl.co.uk.8333: tcp 24
04:16:56.356168 IP tom-Latitude-3570.46284 > static-87-75-105-186.vodafonexdsl.co.uk.8333: tcp 217
04:16:56.396632 IP static-87-75-105-186.vodafonexdsl.co.uk.8333 > tom-Latitude-3570.46284: tcp 0
04:16:56.396647 IP static-87-75-105-186.vodafonexdsl.co.uk.8333 > tom-Latitude-3570.46284: tcp 0
04:16:56.464010 IP static-87-75-105-186.vodafonexdsl.co.uk.8333 > tom-Latitude-3570.46284: tcp 24
04:16:56.464909 IP static-87-75-105-186.vodafonexdsl.co.uk.8333 > tom-Latitude-3570.46284: tcp 223
04:16:56.464927 IP static-87-75-105-186.vodafonexdsl.co.uk.8333 > tom-Latitude-3570.46284: tcp 24
04:16:56.464931 IP static-87-75-105-186.vodafonexdsl.co.uk.8333 > tom-Latitude-3570.46284: tcp 373
04:16:56.464933 IP static-87-75-105-186.vodafonexdsl.co.uk.8333 > tom-Latitude-3570.46284: tcp 24
04:16:56.464936 IP static-87-75-105-186.vodafonexdsl.co.uk.8333 > tom-Latitude-3570.46284: tcp 223
04:16:56.464955 IP static-87-75-105-186.vodafonexdsl.co.uk.8333 > tom-Latitude-3570.46284: tcp 24
04:16:56.464958 IP static-87-75-105-186.vodafonexdsl.co.uk.8333 > tom-Latitude-3570.46284: tcp 388
04:16:56.464960 IP static-87-75-105-186.vodafonexdsl.co.uk.8333 > tom-Latitude-3570.46284: tcp 24
04:16:56.464962 IP static-87-75-105-186.vodafonexdsl.co.uk.8333 > tom-Latitude-3570.46284: tcp 224
04:16:56.464964 IP static-87-75-105-186.vodafonexdsl.co.uk.8333 > tom-Latitude-3570.46284: tcp 24
04:16:56.464967 IP static-87-75-105-186.vodafonexdsl.co.uk.8333 > tom-Latitude-3570.46284: tcp 257
04:16:56.465056 IP tom-Latitude-3570.46284 > static-87-75-105-186.vodafonexdsl.co.uk.8333: tcp 0
04:16:57.044049 IP 167.99.216.145.8333 > tom-Latitude-3570.57976: tcp 24
04:16:57.044070 IP 167.99.216.145.8333 > tom-Latitude-3570.57976: tcp 325
04:16:57.044166 IP tom-Latitude-3570.57976 > 167.99.216.145.8333: tcp 0
04:16:57.060253 IP 167.99.216.145.8333 > tom-Latitude-3570.57976: tcp 325
04:16:57.060264 IP tom-Latitude-3570.57976 > 167.99.216.145.8333: tcp 0
04:16:57.445718 IP tom-Latitude-3570.39110 > vmi195435.contaboserver.net.8333: tcp 24
04:16:57.447753 IP tom-Latitude-3570.39110 > vmi195435.contaboserver.net.8333: tcp 325
04:16:57.496013 IP c-185-45-236-223.customer.ggaweb.ch.8333 > tom-Latitude-3570.49070: tcp 24
04:16:57.505013 IP c-185-45-236-223.customer.ggaweb.ch.8333 > tom-Latitude-3570.49070: tcp 325
04:16:57.505032 IP c-185-45-236-223.customer.ggaweb.ch.8333 > tom-Latitude-3570.49070: tcp 325
04:16:57.505060 IP tom-Latitude-3570.49070 > c-185-45-236-223.customer.ggaweb.ch.8333: tcp 0
04:16:57.508593 IP vmi195435.contaboserver.net.8333 > tom-Latitude-3570.39110: tcp 0
04:16:57.863859 IP 2.56.9.15.8333 > tom-Latitude-3570.42516: tcp 24
04:16:57.863883 IP tom-Latitude-3570.42516 > 2.56.9.15.8333: tcp 0
04:16:57.863916 IP 2.56.9.15.8333 > tom-Latitude-3570.42516: tcp 361
04:16:57.863921 IP tom-Latitude-3570.42516 > 2.56.9.15.8333: tcp 0
04:16:59.297512 IP 2.56.9.15.8333 > tom-Latitude-3570.42516: tcp 24
04:16:59.297529 IP tom-Latitude-3570.42516 > 2.56.9.15.8333: tcp 0
04:16:59.297548 IP 2.56.9.15.8333 > tom-Latitude-3570.42516: tcp 181
04:16:59.297552 IP tom-Latitude-3570.42516 > 2.56.9.15.8333: tcp 0
04:16:59.297555 IP 2.56.9.15.8333 > tom-Latitude-3570.42516: tcp 181
04:16:59.297575 IP tom-Latitude-3570.42516 > 2.56.9.15.8333: tcp 0
04:16:59.297860 IP tom-Latitude-3570.42516 > 2.56.9.15.8333: tcp 24
