07:55:07.238419 IP tom-Latitude-3570.60988 > 81.198.101.144.8333: tcp 24
07:55:07.240424 IP tom-Latitude-3570.60988 > 81.198.101.144.8333: tcp 181
07:55:07.338881 IP tom-Latitude-3570.42516 > 2.56.9.15.8333: tcp 24
07:55:07.338901 IP tom-Latitude-3570.42516 > 2.56.9.15.8333: tcp 1153
07:55:07.395905 IP tom-Latitude-3570.60988 > 81.198.101.144.8333: tcp 181
07:55:07.411723 IP 2.56.9.15.8333 > tom-Latitude-3570.42516: tcp 0
07:55:07.441417 IP 81.198.101.144.8333 > tom-Latitude-3570.60988: tcp 0
07:55:07.940972 IP tom-Latitude-3570.46284 > static-87-75-105-186.vodafonexdsl.co.uk.8333: tcp 24
07:55:07.940994 IP tom-Latitude-3570.46284 > static-87-75-105-186.vodafonexdsl.co.uk.8333: tcp 1261
07:55:08.004147 IP static-87-75-105-186.vodafonexdsl.co.uk.8333 > tom-Latitude-3570.46284: tcp 0
07:55:08.007916 IP static-87-75-105-186.vodafonexdsl.co.uk.8333 > tom-Latitude-3570.46284: tcp 0
07:55:08.242273 IP tom-Latitude-3570.60470 > bb42-60-217-183.singnet.com.sg.8333: tcp 24
07:55:08.242294 IP tom-Latitude-3570.60470 > bb42-60-217-183.singnet.com.sg.8333: tcp 1153
07:55:08.266116 IP static-87-75-105-186.vodafonexdsl.co.uk.8333 > tom-Latitude-3570.46284: tcp 24
07:55:08.266131 IP tom-Latitude-3570.46284 > static-87-75-105-186.vodafonexdsl.co.uk.8333: tcp 0
07:55:08.266951 IP static-87-75-105-186.vodafonexdsl.co.uk.8333 > tom-Latitude-3570.46284: tcp 1153
07:55:08.266976 IP tom-Latitude-3570.46284 > static-87-75-105-186.vodafonexdsl.co.uk.8333: tcp 0
07:55:08.267458 IP tom-Latitude-3570.46284 > static-87-75-105-186.vodafonexdsl.co.uk.8333: tcp 24
07:55:08.268916 IP tom-Latitude-3570.46284 > static-87-75-105-186.vodafonexdsl.co.uk.8333: tcp 145
07:55:08.278180 IP bb42-60-217-183.singnet.com.sg.8333 > tom-Latitude-3570.60470: tcp 0
07:55:08.286486 IP bb42-60-217-183.singnet.com.sg.8333 > tom-Latitude-3570.60470: tcp 0
07:55:08.304315 IP static-87-75-105-186.vodafonexdsl.co.uk.8333 > tom-Latitude-3570.46284: tcp 0
07:55:08.304996 IP static-87-75-105-186.vodafonexdsl.co.uk.8333 > tom-Latitude-3570.46284: tcp 0
07:55:08.563721 IP static-87-75-105-186.vodafonexdsl.co.uk.8333 > tom-Latitude-3570.46284: tcp 24
07:55:08.563741 IP static-87-75-105-186.vodafonexdsl.co.uk.8333 > tom-Latitude-3570.46284: tcp 189
07:55:08.563745 IP static-87-75-105-186.vodafonexdsl.co.uk.8333 > tom-Latitude-3570.46284: tcp 24
07:55:08.563748 IP static-87-75-105-186.vodafonexdsl.co.uk.8333 > tom-Latitude-3570.46284: tcp 256
07:55:08.563749 IP static-87-75-105-186.vodafonexdsl.co.uk.8333 > tom-Latitude-3570.46284: tcp 24
07:55:08.563769 IP static-87-75-105-186.vodafonexdsl.co.uk.8333 > tom-Latitude-3570.46284: tcp 225
07:55:08.563771 IP static-87-75-105-186.vodafonexdsl.co.uk.8333 > tom-Latitude-3570.46284: tcp 24
07:55:08.563838 IP tom-Latitude-3570.46284 > static-87-75-105-186.vodafonexdsl.co.uk.8333: tcp 0
07:55:08.564003 IP static-87-75-105-186.vodafonexdsl.co.uk.8333 > tom-Latitude-3570.46284: tcp 283
07:55:08.564013 IP bb42-60-217-183.singnet.com.sg.8333 > tom-Latitude-3570.60470: tcp 24
07:55:08.564018 IP bb42-60-217-183.singnet.com.sg.8333 > tom-Latitude-3570.60470: tcp 1225
07:55:08.564022 IP static-87-75-105-186.vodafonexdsl.co.uk.8333 > tom-Latitude-3570.46284: tcp 283
07:55:08.564045 IP tom-Latitude-3570.46284 > static-87-75-105-186.vodafonexdsl.co.uk.8333: tcp 0
07:55:08.564095 IP tom-Latitude-3570.60470 > bb42-60-217-183.singnet.com.sg.8333: tcp 0
07:55:08.665565 IP tom-Latitude-3570.49070 > c-185-45-236-223.customer.ggaweb.ch.8333: tcp 24
07:55:08.666376 IP tom-Latitude-3570.49070 > c-185-45-236-223.customer.ggaweb.ch.8333: tcp 145
07:55:08.696072 IP c-185-45-236-223.customer.ggaweb.ch.8333 > tom-Latitude-3570.49070: tcp 0
07:55:08.703619 IP c-185-45-236-223.customer.ggaweb.ch.8333 > tom-Latitude-3570.49070: tcp 0
07:55:09.066520 IP tom-Latitude-3570.60988 > 81.198.101.144.8333: tcp 24
07:55:09.066635 IP tom-Latitude-3570.56714 > ns3113832.ip-54-38-177.eu.8333: tcp 24
07:55:09.069252 IP tom-Latitude-3570.60988 > 81.198.101.144.8333: tcp 145
07:55:09.070103 IP tom-Latitude-3570.56714 > ns3113832.ip-54-38-177.eu.8333: tcp 469
07:55:09.115512 IP 81.198.101.144.8333 > tom-Latitude-3570.60988: tcp 0
07:55:09.123450 IP 81.198.101.144.8333 > tom-Latitude-3570.60988: tcp 0
07:55:09.124086 IP ns3113832.ip-54-38-177.eu.8333 > tom-Latitude-3570.56714: tcp 0
07:55:10.706022 IP 81.198.101.144.8333 > tom-Latitude-3570.60988: tcp 24
07:55:10.706046 IP tom-Latitude-3570.60988 > 81.198.101.144.8333: tcp 0
07:55:10.706079 IP 81.198.101.144.8333 > tom-Latitude-3570.60988: tcp 217
07:55:10.706084 IP tom-Latitude-3570.60988 > 81.198.101.144.8333: tcp 0
07:55:10.706088 IP bb42-60-217-183.singnet.com.sg.8333 > tom-Latitude-3570.60470: tcp 24
07:55:10.706093 IP bb42-60-217-183.singnet.com.sg.8333 > tom-Latitude-3570.60470: tcp 325
07:55:10.706164 IP tom-Latitude-3570.60470 > bb42-60-217-183.singnet.com.sg.8333: tcp 0
07:55:10.706344 IP tom-Latitude-3570.60988 > 81.198.101.144.8333: tcp 24
07:55:10.706559 IP tom-Latitude-3570.57976 > 167.99.216.145.8333: tcp 24
07:55:10.706759 IP tom-Latitude-3570.60470 > bb42-60-217-183.singnet.com.sg.8333: tcp 24
07:55:10.708819 IP tom-Latitude-3570.60988 > 81.198.101.144.8333: tcp 217
07:55:10.709507 IP tom-Latitude-3570.57976 > 167.99.216.145.8333: tcp 289
07:55:10.711634 IP tom-Latitude-3570.60470 > bb42-60-217-183.singnet.com.sg.8333: tcp 37
07:55:10.745045 IP 81.198.101.144.8333 > tom-Latitude-3570.60988: tcp 0
07:55:10.745054 IP 167.99.216.145.8333 > tom-Latitude-3570.57976: tcp 0
07:55:10.751272 IP bb42-60-217-183.singnet.com.sg.8333 > tom-Latitude-3570.60470: tcp 0
07:55:10.751959 IP 81.198.101.144.8333 > tom-Latitude-3570.60988: tcp 0
07:55:10.755373 IP 167.99.216.145.8333 > tom-Latitude-3570.57976: tcp 0
07:55:10.755378 IP bb42-60-217-183.singnet.com.sg.8333 > tom-Latitude-3570.60470: tcp 0
07:55:10.834018 IP 81.198.101.144.8333 > tom-Latitude-3570.60988: tcp 24
07:55:10.834039 IP 81.198.101.144.8333 > tom-Latitude-3570.60988: tcp 1126
07:55:10.834042 IP 81.198.101.144.8333 > tom-Latitude-3570.60988: tcp 24
07:55:10.834044 IP 81.198.101.144.8333 > tom-Latitude-3570.60988: tcp 225
07:55:10.834045 IP 81.198.101.144.8333 > tom-Latitude-3570.60988: tcp 24
07:55:10.834131 IP tom-Latitude-3570.60988 > 81.198.101.144.8333: tcp 0
07:55:10.834215 IP 81.198.101.144.8333 > tom-Latitude-3570.60988: tcp 247
07:55:10.834239 IP 81.198.101.144.8333 > tom-Latitude-3570.60988: tcp 24
07:55:10.834242 IP 81.198.101.144.8333 > tom-Latitude-3570.60988: tcp 192
07:55:10.834244 IP 81.198.101.144.8333 > tom-Latitude-3570.60988: tcp 24
07:55:10.834246 IP 81.198.101.144.8333 > tom-Latitude-3570.60988: tcp 192
07:55:10.834249 IP 81.198.101.144.8333 > tom-Latitude-3570.60988: tcp 24
07:55:10.834270 IP 81.198.101.144.8333 > tom-Latitude-3570.60988: tcp 283
07:55:10.834305 IP tom-Latitude-3570.60988 > 81.198.101.144.8333: tcp 0
07:55:11.137596 IP tom-Latitude-3570.46284 > static-87-75-105-186.vodafonexdsl.co.uk.8333: tcp 24
07:55:11.139709 IP tom-Latitude-3570.46284 > static-87-75-105-186.vodafonexdsl.co.uk.8333: tcp 217
07:55:11.141173 IP bb42-60-217-183.singnet.com.sg.8333 > tom-Latitude-3570.60470: tcp 24
07:55:11.141193 IP bb42-60-217-183.singnet.com.sg.8333 > tom-Latitude-3570.60470: tcp 191
07:55:11.141289 IP tom-Latitude-3570.60470 > bb42-60-217-183.singnet.com.sg.8333: tcp 0
07:55:11.165659 IP static-87-75-105-186.vodafonexdsl.co.uk.8333 > tom-Latitude-3570.46284: tcp 0
07:55:11.173065 IP static-87-75-105-186.vodafonexdsl.co.uk.8333 > tom-Latitude-3570.46284: tcp 0
07:55:11.242040 IP tom-Latitude-3570.49070 > c-185-45-236-223.customer.ggaweb.ch.8333: tcp 24
07:55:11.242993 IP tom-Latitude-3570.49070 > c-185-45-236-223.customer.ggaweb.ch.8333: tcp 253
07:55:11.275554 IP c-185-45-236-223.customer.ggaweb.ch.8333 > tom-Latitude-3570.49070: tcp 0
07:55:11.283166 IP c-185-45-236-223.customer.ggaweb.ch.8333 > tom-Latitude-3570.49070: tcp 0
07:55:11.643615 IP tom-Latitude-3570.39110 > vmi195435.contaboserver.net.8333: tcp 24
07:55:11.648514 IP tom-Latitude-3570.39110 > vmi195435.contaboserver.net.8333: tcp 577
07:55:11.695233 IP vmi195435.contaboserver.net.8333 > tom-Latitude-3570.39110: tcp 0
07:55:11.703700 IP vmi195435.contaboserver.net.8333 > tom-Latitude-3570.39110: tcp 0
07:55:11.844350 IP tom-Latitude-3570.60988 > 81.198.101.144.8333: tcp 24
07:55:11.846414 IP tom-Latitude-3570.60988 > 81.198.101.144.8333: tcp 37
07:55:11.875367 IP 81.198.101.144.8333 > tom-Latitude-3570.60988: tcp 0
07:55:11.882595 IP 81.198.101.144.8333 > tom-Latitude-3570.60988: tcp 0
07:55:11.944684 IP tom-Latitude-3570.42516 > 2.56.9.15.8333: tcp 24
07:55:11.946106 IP tom-Latitude-3570.42516 > 2.56.9.15.8333: tcp 397
07:55:11.950768 IP 2.56.9.15.8333 > tom-Latitude-3570.42516: tcp 24
07:55:11.951411 IP 2.56.9.15.8333 > tom-Latitude-3570.42516: tcp 433
07:55:11.951545 IP tom-Latitude-3570.42516 > 2.56.9.15.8333: tcp 0
07:55:11.951814 IP tom-Latitude-3570.42516 > 2.56.9.15.8333: tcp 24
07:55:11.951830 IP tom-Latitude-3570.42516 > 2.56.9.15.8333: tcp 37
07:55:11.970612 IP 2.56.9.15.8333 > tom-Latitude-3570.42516: tcp 0
07:55:11.979827 IP 2.56.9.15.8333 > tom-Latitude-3570.42516: tcp 0
07:55:12.076273 IP 2.56.9.15.8333 > tom-Latitude-3570.42516: tcp 24
07:55:12.076280 IP 2.56.9.15.8333 > tom-Latitude-3570.42516: tcp 284
07:55:12.076291 IP tom-Latitude-3570.42516 > 2.56.9.15.8333: tcp 0
07:55:12.377612 IP tom-Latitude-3570.39110 > vmi195435.contaboserver.net.8333: tcp 24
07:55:12.380521 IP tom-Latitude-3570.39110 > vmi195435.contaboserver.net.8333: tcp 37
07:55:12.435849 IP vmi195435.contaboserver.net.8333 > tom-Latitude-3570.39110: tcp 0
07:55:12.444267 IP vmi195435.contaboserver.net.8333 > tom-Latitude-3570.39110: tcp 0
07:55:12.478060 IP tom-Latitude-3570.57976 > 167.99.216.145.8333: tcp 24
07:55:12.478989 IP tom-Latitude-3570.57976 > 167.99.216.145.8333: tcp 289
07:55:12.505511 IP 167.99.216.145.8333 > tom-Latitude-3570.57976: tcp 0
07:55:12.513529 IP 167.99.216.145.8333 > tom-Latitude-3570.57976: tcp 0
07:55:12.979738 IP tom-Latitude-3570.46284 > static-87-75-105-186.vodafonexdsl.co.uk.8333: tcp 24
07:55:12.981835 IP tom-Latitude-3570.46284 > static-87-75-105-186.vodafonexdsl.co.uk.8333: tcp 73
07:55:13.028128 IP static-87-75-105-186.vodafonexdsl.co.uk.8333 > tom-Latitude-3570.46284: tcp 0
07:55:13.034620 IP static-87-75-105-186.vodafonexdsl.co.uk.8333 > tom-Latitude-3570.46284: tcp 0
07:55:13.481498 IP tom-Latitude-3570.56714 > ns3113832.ip-54-38-177.eu.8333: tcp 24
07:55:13.483531 IP tom-Latitude-3570.56714 > ns3113832.ip-54-38-177.eu.8333: tcp 289
07:55:13.523148 IP ns3113832.ip-54-38-177.eu.8333 > tom-Latitude-3570.56714: tcp 0
07:55:14.037408 IP tom-Latitude-3570.33688 > 194.230.82.174.8333: tcp 0
07:55:14.125790 IP 167.99.216.145.8333 > tom-Latitude-3570.57976: tcp 24
07:55:14.125809 IP 167.99.216.145.8333 > tom-Latitude-3570.57976: tcp 73
07:55:14.125813 IP 167.99.216.145.8333 > tom-Latitude-3570.57976: tcp 73
07:55:14.125840 IP tom-Latitude-3570.57976 > 167.99.216.145.8333: tcp 0
07:55:14.125853 IP 194.230.82.174.8333 > tom-Latitude-3570.33688: tcp 0
07:55:14.126106 IP tom-Latitude-3570.57976 > 167.99.216.145.8333: tcp 24
07:55:14.127375 IP tom-Latitude-3570.57976 > 167.99.216.145.8333: tcp 73
07:55:14.164085 IP 167.99.216.145.8333 > tom-Latitude-3570.57976: tcp 0
07:55:14.164099 IP 167.99.216.145.8333 > tom-Latitude-3570.57976: tcp 0
07:55:14.233805 IP 167.99.216.145.8333 > tom-Latitude-3570.57976: tcp 24
07:55:14.234843 IP 167.99.216.145.8333 > tom-Latitude-3570.57976: tcp 667
07:55:14.234863 IP 167.99.216.145.8333 > tom-Latitude-3570.57976: tcp 24
07:55:14.234868 IP 167.99.216.145.8333 > tom-Latitude-3570.57976: tcp 1448
07:55:14.234872 IP 167.99.216.145.8333 > tom-Latitude-3570.57976: tcp 1130
07:55:14.234991 IP tom-Latitude-3570.57976 > 167.99.216.145.8333: tcp 0
07:55:14.597562 IP ns3113832.ip-54-38-177.eu.8333 > tom-Latitude-3570.56714: tcp 24
07:55:14.597586 IP tom-Latitude-3570.56714 > ns3113832.ip-54-38-177.eu.8333: tcp 0
07:55:14.597618 IP ns3113832.ip-54-38-177.eu.8333 > tom-Latitude-3570.56714: tcp 31
07:55:14.597622 IP tom-Latitude-3570.56714 > ns3113832.ip-54-38-177.eu.8333: tcp 0
07:55:14.597626 IP ns3113832.ip-54-38-177.eu.8333 > tom-Latitude-3570.56714: tcp 31
07:55:14.597629 IP tom-Latitude-3570.56714 > ns3113832.ip-54-38-177.eu.8333: tcp 0
07:55:14.698198 IP tom-Latitude-3570.49070 > c-185-45-236-223.customer.ggaweb.ch.8333: tcp 24
07:55:14.700510 IP tom-Latitude-3570.49070 > c-185-45-236-223.customer.ggaweb.ch.8333: tcp 109
07:55:14.725260 IP c-185-45-236-223.customer.ggaweb.ch.8333 > tom-Latitude-3570.49070: tcp 0
07:55:14.732743 IP c-185-45-236-223.customer.ggaweb.ch.8333 > tom-Latitude-3570.49070: tcp 0
07:55:15.212263 IP 167.99.216.145.8333 > tom-Latitude-3570.57976: tcp 24
07:55:15.212282 IP 167.99.216.145.8333 > tom-Latitude-3570.57976: tcp 61
07:55:15.212285 IP 81.198.101.144.8333 > tom-Latitude-3570.60988: tcp 24
07:55:15.212289 IP 81.198.101.144.8333 > tom-Latitude-3570.60988: tcp 253
07:55:15.212313 IP 167.99.216.145.8333 > tom-Latitude-3570.57976: tcp 61
07:55:15.212327 IP tom-Latitude-3570.57976 > 167.99.216.145.8333: tcp 0
07:55:15.212381 IP tom-Latitude-3570.60988 > 81.198.101.144.8333: tcp 0
07:55:15.212552 IP tom-Latitude-3570.60988 > 81.198.101.144.8333: tcp 24
07:55:15.216072 IP tom-Latitude-3570.60988 > 81.198.101.144.8333: tcp 145
07:55:15.261515 IP 81.198.101.144.8333 > tom-Latitude-3570.60988: tcp 0
07:55:15.261527 IP 81.198.101.144.8333 > tom-Latitude-3570.60988: tcp 0
07:55:15.349026 IP 81.198.101.144.8333 > tom-Latitude-3570.60988: tcp 24
07:55:15.349805 IP 81.198.101.144.8333 > tom-Latitude-3570.60988: tcp 662
07:55:15.349823 IP 81.198.101.144.8333 > tom-Latitude-3570.60988: tcp 24
07:55:15.349826 IP 81.198.101.144.8333 > tom-Latitude-3570.60988: tcp 223
07:55:15.349828 IP 81.198.101.144.8333 > tom-Latitude-3570.60988: tcp 24
07:55:15.349831 IP 81.198.101.144.8333 > tom-Latitude-3570.60988: tcp 406
07:55:15.349833 IP 81.198.101.144.8333 > tom-Latitude-3570.60988: tcp 24
07:55:15.349853 IP 81.198.101.144.8333 > tom-Latitude-3570.60988: tcp 223
07:55:15.349923 IP tom-Latitude-3570.60988 > 81.198.101.144.8333: tcp 0
07:55:15.653152 IP tom-Latitude-3570.39110 > vmi195435.contaboserver.net.8333: tcp 24
07:55:15.655333 IP tom-Latitude-3570.39110 > vmi195435.contaboserver.net.8333: tcp 217
07:55:15.685932 IP vmi195435.contaboserver.net.8333 > tom-Latitude-3570.39110: tcp 0
07:55:15.694992 IP vmi195435.contaboserver.net.8333 > tom-Latitude-3570.39110: tcp 0
07:55:15.954159 IP tom-Latitude-3570.46284 > static-87-75-105-186.vodafonexdsl.co.uk.8333: tcp 24
07:55:15.956881 IP tom-Latitude-3570.46284 > static-87-75-105-186.vodafonexdsl.co.uk.8333: tcp 217
07:55:15.985389 IP static-87-75-105-186.vodafonexdsl.co.uk.8333 > tom-Latitude-3570.46284: tcp 0
07:55:16.000839 IP static-87-75-105-186.vodafonexdsl.co.uk.8333 > tom-Latitude-3570.46284: tcp 0
07:55:16.052663 IP bb42-60-217-183.singnet.com.sg.8333 > tom-Latitude-3570.60470: tcp 24
07:55:16.056448 IP bb42-60-217-183.singnet.com.sg.8333 > tom-Latitude-3570.60470: tcp 31
07:55:16.056576 IP tom-Latitude-3570.60470 > bb42-60-217-183.singnet.com.sg.8333: tcp 0
07:55:16.157069 IP tom-Latitude-3570.57976 > 167.99.216.145.8333: tcp 24
07:55:16.158038 IP tom-Latitude-3570.57976 > 167.99.216.145.8333: tcp 145
07:55:16.184961 IP 167.99.216.145.8333 > tom-Latitude-3570.57976: tcp 0
07:55:16.192881 IP 167.99.216.145.8333 > tom-Latitude-3570.57976: tcp 0
07:55:16.440546 IP 194.230.82.174.8333 > tom-Latitude-3570.33688: tcp 0
07:55:16.959758 IP tom-Latitude-3570.49070 > c-185-45-236-223.customer.ggaweb.ch.8333: tcp 24
07:55:16.961780 IP tom-Latitude-3570.49070 > c-185-45-236-223.customer.ggaweb.ch.8333: tcp 145
07:55:17.003702 IP vmi195435.contaboserver.net.8333 > tom-Latitude-3570.39110: tcp 24
07:55:17.003722 IP vmi195435.contaboserver.net.8333 > tom-Latitude-3570.39110: tcp 109
07:55:17.003726 IP vmi195435.contaboserver.net.8333 > tom-Latitude-3570.39110: tcp 109
07:55:17.003754 IP tom-Latitude-3570.39110 > vmi195435.contaboserver.net.8333: tcp 0
07:55:17.003963 IP tom-Latitude-3570.39110 > vmi195435.contaboserver.net.8333: tcp 24
07:55:17.005286 IP tom-Latitude-3570.39110 > vmi195435.contaboserver.net.8333: tcp 109
07:55:17.013870 IP c-185-45-236-223.customer.ggaweb.ch.8333 > tom-Latitude-3570.49070: tcp 0
07:55:17.013885 IP c-185-45-236-223.customer.ggaweb.ch.8333 > tom-Latitude-3570.49070: tcp 0
07:55:17.033583 IP vmi195435.contaboserver.net.8333 > tom-Latitude-3570.39110: tcp 0
07:55:17.033597 IP vmi195435.contaboserver.net.8333 > tom-Latitude-3570.39110: tcp 0
07:55:17.113633 IP vmi195435.contaboserver.net.8333 > tom-Latitude-3570.39110: tcp 24
07:55:17.113652 IP vmi195435.contaboserver.net.8333 > tom-Latitude-3570.39110: tcp 256
07:55:17.113656 IP vmi195435.contaboserver.net.8333 > tom-Latitude-3570.39110: tcp 24
07:55:17.113660 IP vmi195435.contaboserver.net.8333 > tom-Latitude-3570.39110: tcp 311
07:55:17.113661 IP vmi195435.contaboserver.net.8333 > tom-Latitude-3570.39110: tcp 24
07:55:17.113684 IP vmi195435.contaboserver.net.8333 > tom-Latitude-3570.39110: tcp 191
07:55:17.113749 IP tom-Latitude-3570.39110 > vmi195435.contaboserver.net.8333: tcp 0
07:55:17.215234 IP tom-Latitude-3570.60988 > 81.198.101.144.8333: tcp 24
07:55:17.216239 IP tom-Latitude-3570.60988 > 81.198.101.144.8333: tcp 109
07:55:17.248625 IP 81.198.101.144.8333 > tom-Latitude-3570.60988: tcp 0
07:55:17.253018 IP 81.198.101.144.8333 > tom-Latitude-3570.60988: tcp 0
07:55:17.415795 IP tom-Latitude-3570.56714 > ns3113832.ip-54-38-177.eu.8333: tcp 24
07:55:17.417858 IP tom-Latitude-3570.56714 > ns3113832.ip-54-38-177.eu.8333: tcp 325
07:55:17.454160 IP ns3113832.ip-54-38-177.eu.8333 > tom-Latitude-3570.56714: tcp 0
07:55:17.519674 IP ns3113832.ip-54-38-177.eu.8333 > tom-Latitude-3570.56714: tcp 24
07:55:17.519698 IP tom-Latitude-3570.56714 > ns3113832.ip-54-38-177.eu.8333: tcp 0
07:55:17.519715 IP ns3113832.ip-54-38-177.eu.8333 > tom-Latitude-3570.56714: tcp 37
07:55:17.519718 IP tom-Latitude-3570.56714 > ns3113832.ip-54-38-177.eu.8333: tcp 0
07:55:17.519880 IP tom-Latitude-3570.56714 > ns3113832.ip-54-38-177.eu.8333: tcp 24
07:55:17.522153 IP tom-Latitude-3570.56714 > ns3113832.ip-54-38-177.eu.8333: tcp 191
07:55:17.554020 IP ns3113832.ip-54-38-177.eu.8333 > tom-Latitude-3570.56714: tcp 0
07:55:17.576780 IP static-87-75-105-186.vodafonexdsl.co.uk.8333 > tom-Latitude-3570.46284: tcp 24
07:55:17.576803 IP tom-Latitude-3570.46284 > static-87-75-105-186.vodafonexdsl.co.uk.8333: tcp 0
07:55:17.584605 IP static-87-75-105-186.vodafonexdsl.co.uk.8333 > tom-Latitude-3570.46284: tcp 145
07:55:17.584629 IP tom-Latitude-3570.46284 > static-87-75-105-186.vodafonexdsl.co.uk.8333: tcp 0
07:55:17.584877 IP tom-Latitude-3570.46284 > static-87-75-105-186.vodafonexdsl.co.uk.8333: tcp 24
07:55:17.586879 IP tom-Latitude-3570.46284 > static-87-75-105-186.vodafonexdsl.co.uk.8333: tcp 37
07:55:17.613362 IP static-87-75-105-186.vodafonexdsl.co.uk.8333 > tom-Latitude-3570.46284: tcp 0
07:55:17.613951 IP static-87-75-105-186.vodafonexdsl.co.uk.8333 > tom-Latitude-3570.46284: tcp 0
07:55:17.688224 IP static-87-75-105-186.vodafonexdsl.co.uk.8333 > tom-Latitude-3570.46284: tcp 24
07:55:17.688801 IP static-87-75-105-186.vodafonexdsl.co.uk.8333 > tom-Latitude-3570.46284: tcp 248
07:55:17.688931 IP tom-Latitude-3570.46284 > static-87-75-105-186.vodafonexdsl.co.uk.8333: tcp 0
07:55:18.079117 IP vmi195435.contaboserver.net.8333 > tom-Latitude-3570.39110: tcp 24
07:55:18.079138 IP vmi195435.contaboserver.net.8333 > tom-Latitude-3570.39110: tcp 109
07:55:18.079142 IP vmi195435.contaboserver.net.8333 > tom-Latitude-3570.39110: tcp 109
07:55:18.079170 IP tom-Latitude-3570.39110 > vmi195435.contaboserver.net.8333: tcp 0
07:55:18.079367 IP tom-Latitude-3570.39110 > vmi195435.contaboserver.net.8333: tcp 24
07:55:18.079460 IP tom-Latitude-3570.56714 > ns3113832.ip-54-38-177.eu.8333: tcp 24
07:55:18.081162 IP tom-Latitude-3570.39110 > vmi195435.contaboserver.net.8333: tcp 73
07:55:18.081779 IP tom-Latitude-3570.56714 > ns3113832.ip-54-38-177.eu.8333: tcp 37
07:55:18.131726 IP vmi195435.contaboserver.net.8333 > tom-Latitude-3570.39110: tcp 0
07:55:18.132350 IP vmi195435.contaboserver.net.8333 > tom-Latitude-3570.39110: tcp 0
07:55:18.132364 IP ns3113832.ip-54-38-177.eu.8333 > tom-Latitude-3570.56714: tcp 0
07:55:18.151578 IP 2.56.9.15.8333 > tom-Latitude-3570.42516: tcp 24
07:55:18.159560 IP 2.56.9.15.8333 > tom-Latitude-3570.42516: tcp 361
07:55:18.159659 IP tom-Latitude-3570.42516 > 2.56.9.15.8333: tcp 0
07:55:18.201104 IP vmi195435.contaboserver.net.8333 > tom-Latitude-3570.39110: tcp 24
07:55:18.201116 IP vmi195435.contaboserver.net.8333 > tom-Latitude-3570.39110: tcp 371
07:55:18.201119 IP vmi195435.contaboserver.net.8333 > tom-Latitude-3570.39110: tcp 24
07:55:18.201176 IP tom-Latitude-3570.39110 > vmi195435.contaboserver.net.8333: tcp 0
07:55:18.204045 IP vmi195435.contaboserver.net.8333 > tom-Latitude-3570.39110: tcp 224
07:55:18.247905 IP tom-Latitude-3570.39110 > vmi195435.contaboserver.net.8333: tcp 0
07:55:18.304818 IP tom-Latitude-3570.42516 > 2.56.9.15.8333: tcp 24
07:55:18.305759 IP tom-Latitude-3570.42516 > 2.56.9.15.8333: tcp 73
07:55:18.343400 IP 2.56.9.15.8333 > tom-Latitude-3570.42516: tcp 0
07:55:19.102991 IP ns3113832.ip-54-38-177.eu.8333 > tom-Latitude-3570.56714: tcp 24
07:55:19.103012 IP ns3113832.ip-54-38-177.eu.8333 > tom-Latitude-3570.56714: tcp 145
07:55:19.103016 IP ns3113832.ip-54-38-177.eu.8333 > tom-Latitude-3570.56714: tcp 145
07:55:19.103043 IP tom-Latitude-3570.56714 > ns3113832.ip-54-38-177.eu.8333: tcp 0
07:55:19.103272 IP tom-Latitude-3570.56714 > ns3113832.ip-54-38-177.eu.8333: tcp 24
07:55:19.103416 IP tom-Latitude-3570.60470 > bb42-60-217-183.singnet.com.sg.8333: tcp 24
07:55:19.105828 IP tom-Latitude-3570.56714 > ns3113832.ip-54-38-177.eu.8333: tcp 73
07:55:19.106511 IP tom-Latitude-3570.60470 > bb42-60-217-183.singnet.com.sg.8333: tcp 469
07:55:19.146900 IP ns3113832.ip-54-38-177.eu.8333 > tom-Latitude-3570.56714: tcp 0
07:55:19.146914 IP bb42-60-217-183.singnet.com.sg.8333 > tom-Latitude-3570.60470: tcp 0
07:55:19.151918 IP bb42-60-217-183.singnet.com.sg.8333 > tom-Latitude-3570.60470: tcp 0
07:55:19.241198 IP ns3113832.ip-54-38-177.eu.8333 > tom-Latitude-3570.56714: tcp 24
07:55:19.241220 IP ns3113832.ip-54-38-177.eu.8333 > tom-Latitude-3570.56714: tcp 248
07:55:19.241223 IP ns3113832.ip-54-38-177.eu.8333 > tom-Latitude-3570.56714: tcp 24
07:55:19.241226 IP ns3113832.ip-54-38-177.eu.8333 > tom-Latitude-3570.56714: tcp 256
07:55:19.241311 IP tom-Latitude-3570.56714 > ns3113832.ip-54-38-177.eu.8333: tcp 0
07:55:19.342125 IP tom-Latitude-3570.46284 > static-87-75-105-186.vodafonexdsl.co.uk.8333: tcp 24
07:55:19.343062 IP tom-Latitude-3570.46284 > static-87-75-105-186.vodafonexdsl.co.uk.8333: tcp 145
07:55:19.383731 IP static-87-75-105-186.vodafonexdsl.co.uk.8333 > tom-Latitude-3570.46284: tcp 0
07:55:19.386781 IP static-87-75-105-186.vodafonexdsl.co.uk.8333 > tom-Latitude-3570.46284: tcp 0
07:55:19.442566 IP tom-Latitude-3570.49070 > c-185-45-236-223.customer.ggaweb.ch.8333: tcp 24
07:55:19.443508 IP tom-Latitude-3570.49070 > c-185-45-236-223.customer.ggaweb.ch.8333: tcp 289
07:55:19.483880 IP c-185-45-236-223.customer.ggaweb.ch.8333 > tom-Latitude-3570.49070: tcp 0
07:55:19.492219 IP c-185-45-236-223.customer.ggaweb.ch.8333 > tom-Latitude-3570.49070: tcp 0
07:55:19.643350 IP tom-Latitude-3570.57976 > 167.99.216.145.8333: tcp 24
07:55:19.645759 IP tom-Latitude-3570.57976 > 167.99.216.145.8333: tcp 289
07:55:19.675751 IP 167.99.216.145.8333 > tom-Latitude-3570.57976: tcp 0
07:55:19.684603 IP 167.99.216.145.8333 > tom-Latitude-3570.57976: tcp 0
07:55:19.743820 IP tom-Latitude-3570.60470 > bb42-60-217-183.singnet.com.sg.8333: tcp 24
07:55:19.746333 IP tom-Latitude-3570.60470 > bb42-60-217-183.singnet.com.sg.8333: tcp 73
07:55:19.777181 IP bb42-60-217-183.singnet.com.sg.8333 > tom-Latitude-3570.60470: tcp 0
07:55:19.787013 IP bb42-60-217-183.singnet.com.sg.8333 > tom-Latitude-3570.60470: tcp 0
07:55:20.127881 IP static-87-75-105-186.vodafonexdsl.co.uk.8333 > tom-Latitude-3570.46284: tcp 24
07:55:20.127900 IP static-87-75-105-186.vodafonexdsl.co.uk.8333 > tom-Latitude-3570.46284: tcp 8
07:55:20.127903 IP static-87-75-105-186.vodafonexdsl.co.uk.8333 > tom-Latitude-3570.46284: tcp 24
07:55:20.127905 IP static-87-75-105-186.vodafonexdsl.co.uk.8333 > tom-Latitude-3570.46284: tcp 73
07:55:20.127994 IP tom-Latitude-3570.46284 > static-87-75-105-186.vodafonexdsl.co.uk.8333: tcp 0
07:55:20.128122 IP tom-Latitude-3570.60988 > 81.198.101.144.8333: tcp 24
07:55:20.128159 IP tom-Latitude-3570.46284 > static-87-75-105-186.vodafonexdsl.co.uk.8333: tcp 24
07:55:20.129986 IP tom-Latitude-3570.60988 > 81.198.101.144.8333: tcp 181
07:55:20.130657 IP tom-Latitude-3570.46284 > static-87-75-105-186.vodafonexdsl.co.uk.8333: tcp 105
07:55:20.133611 IP bb42-60-217-183.singnet.com.sg.8333 > tom-Latitude-3570.60470: tcp 24
07:55:20.133631 IP bb42-60-217-183.singnet.com.sg.8333 > tom-Latitude-3570.60470: tcp 145
07:55:20.133724 IP tom-Latitude-3570.60470 > bb42-60-217-183.singnet.com.sg.8333: tcp 0
07:55:20.170932 IP 81.198.101.144.8333 > tom-Latitude-3570.60988: tcp 0
07:55:20.170946 IP 81.198.101.144.8333 > tom-Latitude-3570.60988: tcp 0
07:55:20.170949 IP static-87-75-105-186.vodafonexdsl.co.uk.8333 > tom-Latitude-3570.46284: tcp 0
07:55:20.170952 IP static-87-75-105-186.vodafonexdsl.co.uk.8333 > tom-Latitude-3570.46284: tcp 0
07:55:20.238430 IP static-87-75-105-186.vodafonexdsl.co.uk.8333 > tom-Latitude-3570.46284: tcp 24
07:55:20.239338 IP static-87-75-105-186.vodafonexdsl.co.uk.8333 > tom-Latitude-3570.46284: tcp 190
07:55:20.239360 IP static-87-75-105-186.vodafonexdsl.co.uk.8333 > tom-Latitude-3570.46284: tcp 24
07:55:20.239364 IP static-87-75-105-186.vodafonexdsl.co.uk.8333 > tom-Latitude-3570.46284: tcp 257
07:55:20.239456 IP tom-Latitude-3570.46284 > static-87-75-105-186.vodafonexdsl.co.uk.8333: tcp 0
07:55:20.273343 IP 2.56.9.15.8333 > tom-Latitude-3570.42516: tcp 24
07:55:20.273364 IP 2.56.9.15.8333 > tom-Latitude-3570.42516: tcp 145
07:55:20.273477 IP tom-Latitude-3570.42516 > 2.56.9.15.8333: tcp 0
07:55:20.474326 IP tom-Latitude-3570.39110 > vmi195435.contaboserver.net.8333: tcp 24
07:55:20.525922 IP tom-Latitude-3570.39110 > vmi195435.contaboserver.net.8333: tcp 145
07:55:20.555436 IP vmi195435.contaboserver.net.8333 > tom-Latitude-3570.39110: tcp 0
07:55:20.563193 IP vmi195435.contaboserver.net.8333 > tom-Latitude-3570.39110: tcp 0
07:55:22.079645 IP tom-Latitude-3570.60470 > bb42-60-217-183.singnet.com.sg.8333: tcp 24
07:55:22.081990 IP tom-Latitude-3570.60470 > bb42-60-217-183.singnet.com.sg.8333: tcp 31
07:55:22.124755 IP bb42-60-217-183.singnet.com.sg.8333 > tom-Latitude-3570.60470: tcp 0
07:55:22.124769 IP bb42-60-217-183.singnet.com.sg.8333 > tom-Latitude-3570.60470: tcp 0
07:55:22.581225 IP tom-Latitude-3570.39110 > vmi195435.contaboserver.net.8333: tcp 24
07:55:22.581296 IP tom-Latitude-3570.49070 > c-185-45-236-223.customer.ggaweb.ch.8333: tcp 24
07:55:22.583131 IP tom-Latitude-3570.39110 > vmi195435.contaboserver.net.8333: tcp 91
07:55:22.584040 IP tom-Latitude-3570.49070 > c-185-45-236-223.customer.ggaweb.ch.8333: tcp 73
07:55:22.643751 IP c-185-45-236-223.customer.ggaweb.ch.8333 > tom-Latitude-3570.49070: tcp 0
07:55:22.646998 IP vmi195435.contaboserver.net.8333 > tom-Latitude-3570.39110: tcp 0
07:55:22.647597 IP vmi195435.contaboserver.net.8333 > tom-Latitude-3570.39110: tcp 0
07:55:22.647611 IP c-185-45-236-223.customer.ggaweb.ch.8333 > tom-Latitude-3570.49070: tcp 0
07:55:23.584567 IP tom-Latitude-3570.57976 > 167.99.216.145.8333: tcp 24
07:55:23.587421 IP tom-Latitude-3570.57976 > 167.99.216.145.8333: tcp 73
07:55:23.635145 IP 167.99.216.145.8333 > tom-Latitude-3570.57976: tcp 0
07:55:23.644101 IP 167.99.216.145.8333 > tom-Latitude-3570.57976: tcp 0
07:55:24.018193 IP vmi195435.contaboserver.net.8333 > tom-Latitude-3570.39110: tcp 24
07:55:24.018219 IP tom-Latitude-3570.39110 > vmi195435.contaboserver.net.8333: tcp 0
07:55:24.018252 IP vmi195435.contaboserver.net.8333 > tom-Latitude-3570.39110: tcp 325
07:55:24.018257 IP tom-Latitude-3570.39110 > vmi195435.contaboserver.net.8333: tcp 0
07:55:24.018262 IP vmi195435.contaboserver.net.8333 > tom-Latitude-3570.39110: tcp 325
07:55:24.018264 IP tom-Latitude-3570.39110 > vmi195435.contaboserver.net.8333: tcp 0
07:55:24.018572 IP tom-Latitude-3570.39110 > vmi195435.contaboserver.net.8333: tcp 24
07:55:24.022652 IP tom-Latitude-3570.39110 > vmi195435.contaboserver.net.8333: tcp 325
07:55:24.053063 IP vmi195435.contaboserver.net.8333 > tom-Latitude-3570.39110: tcp 0
07:55:24.053665 IP vmi195435.contaboserver.net.8333 > tom-Latitude-3570.39110: tcp 0
07:55:24.134424 IP vmi195435.contaboserver.net.8333 > tom-Latitude-3570.39110: tcp 24
07:55:24.134444 IP vmi195435.contaboserver.net.8333 > tom-Latitude-3570.39110: tcp 571
07:55:24.134447 IP vmi195435.contaboserver.net.8333 > tom-Latitude-3570.39110: tcp 24
07:55:24.134449 IP vmi195435.contaboserver.net.8333 > tom-Latitude-3570.39110: tcp 340
07:55:24.134452 IP vmi195435.contaboserver.net.8333 > tom-Latitude-3570.39110: tcp 24
07:55:24.134472 IP vmi195435.contaboserver.net.8333 > tom-Latitude-3570.39110: tcp 470
07:55:24.134476 IP vmi195435.contaboserver.net.8333 > tom-Latitude-3570.39110: tcp 24
07:55:24.134534 IP tom-Latitude-3570.39110 > vmi195435.contaboserver.net.8333: tcp 0
07:55:24.134598 IP vmi195435.contaboserver.net.8333 > tom-Latitude-3570.39110: tcp 733
07:55:24.134613 IP vmi195435.contaboserver.net.8333 > tom-Latitude-3570.39110: tcp 24
07:55:24.134617 IP vmi195435.contaboserver.net.8333 > tom-Latitude-3570.39110: tcp 224
07:55:24.134678 IP tom-Latitude-3570.39110 > vmi195435.contaboserver.net.8333: tcp 0
07:55:24.209944 IP vmi195435.contaboserver.net.8333 > tom-Latitude-3570.39110: tcp 1049
07:55:24.251904 IP tom-Latitude-3570.39110 > vmi195435.contaboserver.net.8333: tcp 0
07:55:24.311588 IP tom-Latitude-3570.49070 > c-185-45-236-223.customer.ggaweb.ch.8333: tcp 24
07:55:24.313025 IP tom-Latitude-3570.49070 > c-185-45-236-223.customer.ggaweb.ch.8333: tcp 325
07:55:24.361118 IP c-185-45-236-223.customer.ggaweb.ch.8333 > tom-Latitude-3570.49070: tcp 0
07:55:24.361132 IP c-185-45-236-223.customer.ggaweb.ch.8333 > tom-Latitude-3570.49070: tcp 0
07:55:24.512226 IP tom-Latitude-3570.56714 > ns3113832.ip-54-38-177.eu.8333: tcp 24
07:55:24.514494 IP tom-Latitude-3570.56714 > ns3113832.ip-54-38-177.eu.8333: tcp 397
07:55:24.553709 IP ns3113832.ip-54-38-177.eu.8333 > tom-Latitude-3570.56714: tcp 0
07:55:24.619321 IP ns3113832.ip-54-38-177.eu.8333 > tom-Latitude-3570.56714: tcp 24
07:55:24.619341 IP ns3113832.ip-54-38-177.eu.8333 > tom-Latitude-3570.56714: tcp 37
07:55:24.619431 IP tom-Latitude-3570.56714 > ns3113832.ip-54-38-177.eu.8333: tcp 0
07:55:24.619608 IP tom-Latitude-3570.56714 > ns3113832.ip-54-38-177.eu.8333: tcp 24
07:55:24.621504 IP tom-Latitude-3570.56714 > ns3113832.ip-54-38-177.eu.8333: tcp 37
07:55:24.653328 IP ns3113832.ip-54-38-177.eu.8333 > tom-Latitude-3570.56714: tcp 0
07:55:24.713716 IP ns3113832.ip-54-38-177.eu.8333 > tom-Latitude-3570.56714: tcp 24
07:55:24.713735 IP ns3113832.ip-54-38-177.eu.8333 > tom-Latitude-3570.56714: tcp 250
07:55:24.713848 IP tom-Latitude-3570.56714 > ns3113832.ip-54-38-177.eu.8333: tcp 0
07:55:24.814662 IP tom-Latitude-3570.60470 > bb42-60-217-183.singnet.com.sg.8333: tcp 24
07:55:24.815851 IP tom-Latitude-3570.60470 > bb42-60-217-183.singnet.com.sg.8333: tcp 361
07:55:24.846892 IP bb42-60-217-183.singnet.com.sg.8333 > tom-Latitude-3570.60470: tcp 0
07:55:24.858979 IP bb42-60-217-183.singnet.com.sg.8333 > tom-Latitude-3570.60470: tcp 0
07:55:24.880611 IP 167.99.216.145.8333 > tom-Latitude-3570.57976: tcp 24
07:55:24.880635 IP tom-Latitude-3570.57976 > 167.99.216.145.8333: tcp 0
07:55:24.887083 IP 167.99.216.145.8333 > tom-Latitude-3570.57976: tcp 361
07:55:24.887108 IP tom-Latitude-3570.57976 > 167.99.216.145.8333: tcp 0
07:55:25.489405 IP tom-Latitude-3570.49070 > c-185-45-236-223.customer.ggaweb.ch.8333: tcp 24
07:55:25.491943 IP tom-Latitude-3570.49070 > c-185-45-236-223.customer.ggaweb.ch.8333: tcp 37
07:55:25.535637 IP c-185-45-236-223.customer.ggaweb.ch.8333 > tom-Latitude-3570.49070: tcp 0
07:55:25.543393 IP c-185-45-236-223.customer.ggaweb.ch.8333 > tom-Latitude-3570.49070: tcp 0
07:55:25.554164 IP vmi195435.contaboserver.net.8333 > tom-Latitude-3570.39110: tcp 24
07:55:25.554188 IP tom-Latitude-3570.39110 > vmi195435.contaboserver.net.8333: tcp 0
07:55:25.554222 IP vmi195435.contaboserver.net.8333 > tom-Latitude-3570.39110: tcp 325
07:55:25.554227 IP tom-Latitude-3570.39110 > vmi195435.contaboserver.net.8333: tcp 0
07:55:25.554542 IP tom-Latitude-3570.39110 > vmi195435.contaboserver.net.8333: tcp 24
07:55:25.554612 IP tom-Latitude-3570.42516 > 2.56.9.15.8333: tcp 24
07:55:25.557350 IP tom-Latitude-3570.39110 > vmi195435.contaboserver.net.8333: tcp 289
07:55:25.557931 IP tom-Latitude-3570.42516 > 2.56.9.15.8333: tcp 31
07:55:25.644235 IP c-185-45-236-223.customer.ggaweb.ch.8333 > tom-Latitude-3570.49070: tcp 289
07:55:25.644254 IP tom-Latitude-3570.49070 > c-185-45-236-223.customer.ggaweb.ch.8333: tcp 0
07:55:25.644847 IP vmi195435.contaboserver.net.8333 > tom-Latitude-3570.39110: tcp 0
07:55:25.644862 IP vmi195435.contaboserver.net.8333 > tom-Latitude-3570.39110: tcp 0
07:55:25.644864 IP 2.56.9.15.8333 > tom-Latitude-3570.42516: tcp 0
07:55:25.679304 IP vmi195435.contaboserver.net.8333 > tom-Latitude-3570.39110: tcp 24
07:55:25.679323 IP vmi195435.contaboserver.net.8333 > tom-Latitude-3570.39110: tcp 189
07:55:25.679326 IP vmi195435.contaboserver.net.8333 > tom-Latitude-3570.39110: tcp 24
07:55:25.679410 IP tom-Latitude-3570.39110 > vmi195435.contaboserver.net.8333: tcp 0
07:55:25.679827 IP tom-Latitude-3570.39110 > vmi195435.contaboserver.net.8333: tcp 24
07:55:25.681012 IP tom-Latitude-3570.39110 > vmi195435.contaboserver.net.8333: tcp 8
07:55:25.689041 IP vmi195435.contaboserver.net.8333 > tom-Latitude-3570.39110: tcp 225
07:55:25.689060 IP vmi195435.contaboserver.net.8333 > tom-Latitude-3570.39110: tcp 24
07:55:25.689063 IP vmi195435.contaboserver.net.8333 > tom-Latitude-3570.39110: tcp 641
07:55:25.689068 IP vmi195435.contaboserver.net.8333 > tom-Latitude-3570.39110: tcp 24
07:55:25.689069 IP vmi195435.contaboserver.net.8333 > tom-Latitude-3570.39110: tcp 248
07:55:25.689089 IP vmi195435.contaboserver.net.8333 > tom-Latitude-3570.39110: tcp 24
07:55:25.689093 IP vmi195435.contaboserver.net.8333 > tom-Latitude-3570.39110: tcp 246
07:55:25.689151 IP tom-Latitude-3570.39110 > vmi195435.contaboserver.net.8333: tcp 0
07:55:25.696302 IP c-185-45-236-223.customer.ggaweb.ch.8333 > tom-Latitude-3570.49070: tcp 24
07:55:25.696322 IP tom-Latitude-3570.49070 > c-185-45-236-223.customer.ggaweb.ch.8333: tcp 0
07:55:25.712991 IP vmi195435.contaboserver.net.8333 > tom-Latitude-3570.39110: tcp 0
07:55:25.720773 IP vmi195435.contaboserver.net.8333 > tom-Latitude-3570.39110: tcp 0
07:55:25.757173 IP vmi195435.contaboserver.net.8333 > tom-Latitude-3570.39110: tcp 771
07:55:25.799907 IP tom-Latitude-3570.39110 > vmi195435.contaboserver.net.8333: tcp 0
07:55:25.810854 IP vmi195435.contaboserver.net.8333 > tom-Latitude-3570.39110: tcp 24
07:55:25.810872 IP tom-Latitude-3570.39110 > vmi195435.contaboserver.net.8333: tcp 0
07:55:25.810889 IP vmi195435.contaboserver.net.8333 > tom-Latitude-3570.39110: tcp 8
07:55:25.810892 IP tom-Latitude-3570.39110 > vmi195435.contaboserver.net.8333: tcp 0
07:55:25.811242 IP tom-Latitude-3570.46284 > static-87-75-105-186.vodafonexdsl.co.uk.8333: tcp 24
07:55:25.813245 IP tom-Latitude-3570.46284 > static-87-75-105-186.vodafonexdsl.co.uk.8333: tcp 649
07:55:25.854547 IP static-87-75-105-186.vodafonexdsl.co.uk.8333 > tom-Latitude-3570.46284: tcp 0
07:55:25.854561 IP static-87-75-105-186.vodafonexdsl.co.uk.8333 > tom-Latitude-3570.46284: tcp 0
07:55:25.911246 IP c-185-45-236-223.customer.ggaweb.ch.8333 > tom-Latitude-3570.49070: tcp 24
07:55:25.911270 IP tom-Latitude-3570.49070 > c-185-45-236-223.customer.ggaweb.ch.8333: tcp 0
07:55:25.911302 IP c-185-45-236-223.customer.ggaweb.ch.8333 > tom-Latitude-3570.49070: tcp 8
07:55:25.911304 IP tom-Latitude-3570.49070 > c-185-45-236-223.customer.ggaweb.ch.8333: tcp 0
07:55:25.911402 IP tom-Latitude-3570.49070 > c-185-45-236-223.customer.ggaweb.ch.8333: tcp 24
07:55:25.911511 IP tom-Latitude-3570.60470 > bb42-60-217-183.singnet.com.sg.8333: tcp 24
07:55:25.913637 IP tom-Latitude-3570.49070 > c-185-45-236-223.customer.ggaweb.ch.8333: tcp 8
07:55:25.914242 IP tom-Latitude-3570.60470 > bb42-60-217-183.singnet.com.sg.8333: tcp 289
07:55:25.943311 IP bb42-60-217-183.singnet.com.sg.8333 > tom-Latitude-3570.60470: tcp 0
07:55:25.943326 IP c-185-45-236-223.customer.ggaweb.ch.8333 > tom-Latitude-3570.49070: tcp 0
07:55:25.944122 IP bb42-60-217-183.singnet.com.sg.8333 > tom-Latitude-3570.60470: tcp 0
07:55:25.944136 IP c-185-45-236-223.customer.ggaweb.ch.8333 > tom-Latitude-3570.49070: tcp 0
07:55:26.012049 IP tom-Latitude-3570.42516 > 2.56.9.15.8333: tcp 24
07:55:26.012988 IP tom-Latitude-3570.42516 > 2.56.9.15.8333: tcp 649
07:55:26.053316 IP 2.56.9.15.8333 > tom-Latitude-3570.42516: tcp 0
07:55:26.149287 IP 2.56.9.15.8333 > tom-Latitude-3570.42516: tcp 24
07:55:26.149960 IP 2.56.9.15.8333 > tom-Latitude-3570.42516: tcp 37
07:55:26.150088 IP tom-Latitude-3570.42516 > 2.56.9.15.8333: tcp 0
07:55:26.150230 IP tom-Latitude-3570.42516 > 2.56.9.15.8333: tcp 24
07:55:26.151646 IP tom-Latitude-3570.42516 > 2.56.9.15.8333: tcp 641
07:55:26.182942 IP 2.56.9.15.8333 > tom-Latitude-3570.42516: tcp 0
07:55:26.189949 IP ns3113832.ip-54-38-177.eu.8333 > tom-Latitude-3570.56714: tcp 24
07:55:26.191157 IP ns3113832.ip-54-38-177.eu.8333 > tom-Latitude-3570.56714: tcp 145
07:55:26.191288 IP tom-Latitude-3570.56714 > ns3113832.ip-54-38-177.eu.8333: tcp 0
07:55:26.492519 IP tom-Latitude-3570.49070 > c-185-45-236-223.customer.ggaweb.ch.8333: tcp 24
07:55:26.494600 IP tom-Latitude-3570.49070 > c-185-45-236-223.customer.ggaweb.ch.8333: tcp 37
07:55:26.545542 IP c-185-45-236-223.customer.ggaweb.ch.8333 > tom-Latitude-3570.49070: tcp 0
07:55:26.546313 IP c-185-45-236-223.customer.ggaweb.ch.8333 > tom-Latitude-3570.49070: tcp 0
07:55:26.610978 IP 2.56.9.15.8333 > tom-Latitude-3570.42516: tcp 24
07:55:26.611546 IP 2.56.9.15.8333 > tom-Latitude-3570.42516: tcp 73
07:55:26.611702 IP tom-Latitude-3570.42516 > 2.56.9.15.8333: tcp 0
07:55:26.611910 IP tom-Latitude-3570.42516 > 2.56.9.15.8333: tcp 24
07:55:26.613383 IP tom-Latitude-3570.42516 > 2.56.9.15.8333: tcp 73
07:55:26.644416 IP 2.56.9.15.8333 > tom-Latitude-3570.42516: tcp 0
07:55:26.783040 IP 2.56.9.15.8333 > tom-Latitude-3570.42516: tcp 24
07:55:26.783060 IP 2.56.9.15.8333 > tom-Latitude-3570.42516: tcp 404
07:55:26.783064 IP 2.56.9.15.8333 > tom-Latitude-3570.42516: tcp 24
07:55:26.783067 IP 2.56.9.15.8333 > tom-Latitude-3570.42516: tcp 224
07:55:26.783156 IP tom-Latitude-3570.42516 > 2.56.9.15.8333: tcp 0
07:55:27.187878 IP tom-Latitude-3570.60988 > 81.198.101.144.8333: tcp 24
07:55:27.187931 IP tom-Latitude-3570.46284 > static-87-75-105-186.vodafonexdsl.co.uk.8333: tcp 24
07:55:27.190648 IP tom-Latitude-3570.60988 > 81.198.101.144.8333: tcp 793
07:55:27.191221 IP tom-Latitude-3570.46284 > static-87-75-105-186.vodafonexdsl.co.uk.8333: tcp 73
07:55:27.235493 IP vmi195435.contaboserver.net.8333 > tom-Latitude-3570.39110: tcp 24
07:55:27.235517 IP tom-Latitude-3570.39110 > vmi195435.contaboserver.net.8333: tcp 0
07:55:27.235548 IP vmi195435.contaboserver.net.8333 > tom-Latitude-3570.39110: tcp 37
07:55:27.235551 IP tom-Latitude-3570.39110 > vmi195435.contaboserver.net.8333: tcp 0
07:55:27.235748 IP tom-Latitude-3570.39110 > vmi195435.contaboserver.net.8333: tcp 24
07:55:27.237618 IP 81.198.101.144.8333 > tom-Latitude-3570.60988: tcp 0
07:55:27.238381 IP tom-Latitude-3570.39110 > vmi195435.contaboserver.net.8333: tcp 37
07:55:27.243873 IP static-87-75-105-186.vodafonexdsl.co.uk.8333 > tom-Latitude-3570.46284: tcp 0
07:55:27.244503 IP 81.198.101.144.8333 > tom-Latitude-3570.60988: tcp 0
