07:07:09.809049 IP bb42-60-217-183.singnet.com.sg.8333 > tom-Latitude-3570.60470: tcp 24
07:07:09.809070 IP bb42-60-217-183.singnet.com.sg.8333 > tom-Latitude-3570.60470: tcp 223
07:07:09.809074 IP bb42-60-217-183.singnet.com.sg.8333 > tom-Latitude-3570.60470: tcp 24
07:07:09.809077 IP bb42-60-217-183.singnet.com.sg.8333 > tom-Latitude-3570.60470: tcp 225
07:07:09.809169 IP tom-Latitude-3570.60470 > bb42-60-217-183.singnet.com.sg.8333: tcp 0
07:07:09.853099 IP static-87-75-105-186.vodafonexdsl.co.uk.8333 > tom-Latitude-3570.46284: tcp 24
07:07:09.856880 IP static-87-75-105-186.vodafonexdsl.co.uk.8333 > tom-Latitude-3570.46284: tcp 109
07:07:09.857012 IP tom-Latitude-3570.46284 > static-87-75-105-186.vodafonexdsl.co.uk.8333: tcp 0
07:07:09.857217 IP tom-Latitude-3570.46284 > static-87-75-105-186.vodafonexdsl.co.uk.8333: tcp 24
07:07:09.858631 IP tom-Latitude-3570.46284 > static-87-75-105-186.vodafonexdsl.co.uk.8333: tcp 37
07:07:09.899557 IP static-87-75-105-186.vodafonexdsl.co.uk.8333 > tom-Latitude-3570.46284: tcp 0
07:07:09.899571 IP static-87-75-105-186.vodafonexdsl.co.uk.8333 > tom-Latitude-3570.46284: tcp 0
07:07:09.913972 IP ns3113832.ip-54-38-177.eu.8333 > tom-Latitude-3570.56714: tcp 24
07:07:09.914525 IP ns3113832.ip-54-38-177.eu.8333 > tom-Latitude-3570.56714: tcp 109
07:07:09.914652 IP tom-Latitude-3570.56714 > ns3113832.ip-54-38-177.eu.8333: tcp 0
07:07:09.914922 IP tom-Latitude-3570.57976 > 167.99.216.145.8333: tcp 24
07:07:09.916285 IP tom-Latitude-3570.57976 > 167.99.216.145.8333: tcp 109
07:07:09.956888 IP static-87-75-105-186.vodafonexdsl.co.uk.8333 > tom-Latitude-3570.46284: tcp 24
07:07:09.960114 IP static-87-75-105-186.vodafonexdsl.co.uk.8333 > tom-Latitude-3570.46284: tcp 1382
07:07:09.960243 IP tom-Latitude-3570.46284 > static-87-75-105-186.vodafonexdsl.co.uk.8333: tcp 0
07:07:09.962678 IP static-87-75-105-186.vodafonexdsl.co.uk.8333 > tom-Latitude-3570.46284: tcp 58
07:07:09.962696 IP 167.99.216.145.8333 > tom-Latitude-3570.57976: tcp 0
07:07:09.962703 IP 167.99.216.145.8333 > tom-Latitude-3570.57976: tcp 0
07:07:09.962707 IP static-87-75-105-186.vodafonexdsl.co.uk.8333 > tom-Latitude-3570.46284: tcp 999
07:07:09.962793 IP tom-Latitude-3570.46284 > static-87-75-105-186.vodafonexdsl.co.uk.8333: tcp 0
07:07:10.069713 IP tom-Latitude-3570.57976 > 167.99.216.145.8333: tcp 24
07:07:10.071763 IP tom-Latitude-3570.57976 > 167.99.216.145.8333: tcp 37
07:07:10.102094 IP 167.99.216.145.8333 > tom-Latitude-3570.57976: tcp 0
07:07:10.109976 IP 167.99.216.145.8333 > tom-Latitude-3570.57976: tcp 0
07:07:10.270435 IP tom-Latitude-3570.60988 > 81.198.101.144.8333: tcp 24
07:07:10.308575 IP tom-Latitude-3570.60988 > 81.198.101.144.8333: tcp 109
07:07:10.343918 IP 81.198.101.144.8333 > tom-Latitude-3570.60988: tcp 0
07:07:10.350282 IP 81.198.101.144.8333 > tom-Latitude-3570.60988: tcp 0
07:07:10.622166 IP vmi195435.contaboserver.net.8333 > tom-Latitude-3570.39110: tcp 24
07:07:10.622183 IP vmi195435.contaboserver.net.8333 > tom-Latitude-3570.39110: tcp 253
07:07:10.622261 IP tom-Latitude-3570.39110 > vmi195435.contaboserver.net.8333: tcp 0
07:07:10.622473 IP tom-Latitude-3570.39110 > vmi195435.contaboserver.net.8333: tcp 24
07:07:10.626187 IP tom-Latitude-3570.39110 > vmi195435.contaboserver.net.8333: tcp 73
07:07:10.629319 IP vmi195435.contaboserver.net.8333 > tom-Latitude-3570.39110: tcp 253
07:07:10.629330 IP tom-Latitude-3570.39110 > vmi195435.contaboserver.net.8333: tcp 0
07:07:10.660153 IP vmi195435.contaboserver.net.8333 > tom-Latitude-3570.39110: tcp 0
07:07:10.667528 IP 2.56.9.15.8333 > tom-Latitude-3570.42516: tcp 24
07:07:10.667552 IP tom-Latitude-3570.42516 > 2.56.9.15.8333: tcp 0
07:07:10.667600 IP 2.56.9.15.8333 > tom-Latitude-3570.42516: tcp 361
07:07:10.667604 IP tom-Latitude-3570.42516 > 2.56.9.15.8333: tcp 0
07:07:10.667938 IP tom-Latitude-3570.42516 > 2.56.9.15.8333: tcp 24
07:07:10.670160 IP tom-Latitude-3570.42516 > 2.56.9.15.8333: tcp 109
07:07:10.712573 IP 2.56.9.15.8333 > tom-Latitude-3570.42516: tcp 0
07:07:10.788229 IP vmi195435.contaboserver.net.8333 > tom-Latitude-3570.39110: tcp 24
07:07:10.788236 IP tom-Latitude-3570.39110 > vmi195435.contaboserver.net.8333: tcp 0
07:07:10.788243 IP vmi195435.contaboserver.net.8333 > tom-Latitude-3570.39110: tcp 256
07:07:10.788245 IP tom-Latitude-3570.39110 > vmi195435.contaboserver.net.8333: tcp 0
07:07:10.788247 IP vmi195435.contaboserver.net.8333 > tom-Latitude-3570.39110: tcp 24
07:07:10.788249 IP tom-Latitude-3570.39110 > vmi195435.contaboserver.net.8333: tcp 0
07:07:10.788252 IP vmi195435.contaboserver.net.8333 > tom-Latitude-3570.39110: tcp 263
07:07:10.788254 IP tom-Latitude-3570.39110 > vmi195435.contaboserver.net.8333: tcp 0
07:07:10.788721 IP tom-Latitude-3570.60470 > bb42-60-217-183.singnet.com.sg.8333: tcp 24
07:07:10.796752 IP 2.56.9.15.8333 > tom-Latitude-3570.42516: tcp 24
07:07:10.839905 IP tom-Latitude-3570.42516 > 2.56.9.15.8333: tcp 0
07:07:10.893405 IP 2.56.9.15.8333 > tom-Latitude-3570.42516: tcp 1293
07:07:10.893429 IP tom-Latitude-3570.42516 > 2.56.9.15.8333: tcp 0
07:07:10.893459 IP 2.56.9.15.8333 > tom-Latitude-3570.42516: tcp 24
07:07:10.893463 IP tom-Latitude-3570.42516 > 2.56.9.15.8333: tcp 0
07:07:10.893467 IP 2.56.9.15.8333 > tom-Latitude-3570.42516: tcp 224
07:07:10.893469 IP tom-Latitude-3570.42516 > 2.56.9.15.8333: tcp 0
07:07:10.893473 IP 2.56.9.15.8333 > tom-Latitude-3570.42516: tcp 24
07:07:10.893475 IP tom-Latitude-3570.42516 > 2.56.9.15.8333: tcp 0
07:07:10.893487 IP 2.56.9.15.8333 > tom-Latitude-3570.42516: tcp 249
07:07:10.893493 IP tom-Latitude-3570.42516 > 2.56.9.15.8333: tcp 0
07:07:10.894415 IP tom-Latitude-3570.60470 > bb42-60-217-183.singnet.com.sg.8333: tcp 73
07:07:10.909132 IP 2.56.9.15.8333 > tom-Latitude-3570.42516: tcp 249
07:07:10.909151 IP tom-Latitude-3570.42516 > 2.56.9.15.8333: tcp 0
07:07:10.933104 IP bb42-60-217-183.singnet.com.sg.8333 > tom-Latitude-3570.60470: tcp 0
07:07:10.933119 IP bb42-60-217-183.singnet.com.sg.8333 > tom-Latitude-3570.60470: tcp 0
07:07:10.998746 IP tom-Latitude-3570.60988 > 81.198.101.144.8333: tcp 24
07:07:10.999854 IP tom-Latitude-3570.60988 > 81.198.101.144.8333: tcp 181
07:07:11.032308 IP 81.198.101.144.8333 > tom-Latitude-3570.60988: tcp 0
07:07:11.040258 IP 81.198.101.144.8333 > tom-Latitude-3570.60988: tcp 0
07:07:11.110131 IP 2.56.9.15.8333 > tom-Latitude-3570.42516: tcp 24
07:07:11.110148 IP tom-Latitude-3570.42516 > 2.56.9.15.8333: tcp 0
07:07:11.110808 IP 2.56.9.15.8333 > tom-Latitude-3570.42516: tcp 145
07:07:11.110826 IP tom-Latitude-3570.42516 > 2.56.9.15.8333: tcp 0
07:07:11.111164 IP tom-Latitude-3570.42516 > 2.56.9.15.8333: tcp 24
07:07:11.112709 IP tom-Latitude-3570.42516 > 2.56.9.15.8333: tcp 145
07:07:11.131436 IP 81.198.101.144.8333 > tom-Latitude-3570.60988: tcp 24
07:07:11.132292 IP 81.198.101.144.8333 > tom-Latitude-3570.60988: tcp 145
07:07:11.132422 IP tom-Latitude-3570.60988 > 81.198.101.144.8333: tcp 0
07:07:11.132569 IP tom-Latitude-3570.60988 > 81.198.101.144.8333: tcp 24
07:07:11.132582 IP tom-Latitude-3570.60988 > 81.198.101.144.8333: tcp 1293
07:07:11.134188 IP tom-Latitude-3570.60988 > 81.198.101.144.8333: tcp 808
07:07:11.141549 IP 2.56.9.15.8333 > tom-Latitude-3570.42516: tcp 0
07:07:11.142182 IP 2.56.9.15.8333 > tom-Latitude-3570.42516: tcp 0
07:07:11.173318 IP 81.198.101.144.8333 > tom-Latitude-3570.60988: tcp 0
07:07:11.173998 IP 81.198.101.144.8333 > tom-Latitude-3570.60988: tcp 0
07:07:11.174700 IP 81.198.101.144.8333 > tom-Latitude-3570.60988: tcp 0
07:07:11.241399 IP 2.56.9.15.8333 > tom-Latitude-3570.42516: tcp 24
07:07:11.241420 IP 2.56.9.15.8333 > tom-Latitude-3570.42516: tcp 668
07:07:11.241422 IP 2.56.9.15.8333 > tom-Latitude-3570.42516: tcp 24
07:07:11.241424 IP 2.56.9.15.8333 > tom-Latitude-3570.42516: tcp 338
07:07:11.241426 IP 2.56.9.15.8333 > tom-Latitude-3570.42516: tcp 24
07:07:11.241447 IP 2.56.9.15.8333 > tom-Latitude-3570.42516: tcp 226
07:07:11.241448 IP 2.56.9.15.8333 > tom-Latitude-3570.42516: tcp 24
07:07:11.241451 IP 2.56.9.15.8333 > tom-Latitude-3570.42516: tcp 439
07:07:11.241521 IP tom-Latitude-3570.42516 > 2.56.9.15.8333: tcp 0
07:07:11.343876 IP tom-Latitude-3570.57976 > 167.99.216.145.8333: tcp 24
07:07:11.344834 IP tom-Latitude-3570.57976 > 167.99.216.145.8333: tcp 325
07:07:11.373121 IP 167.99.216.145.8333 > tom-Latitude-3570.57976: tcp 0
07:07:11.380122 IP 167.99.216.145.8333 > tom-Latitude-3570.57976: tcp 0
07:07:11.820838 IP bb42-60-217-183.singnet.com.sg.8333 > tom-Latitude-3570.60470: tcp 24
07:07:11.821483 IP bb42-60-217-183.singnet.com.sg.8333 > tom-Latitude-3570.60470: tcp 325
07:07:11.821615 IP tom-Latitude-3570.60470 > bb42-60-217-183.singnet.com.sg.8333: tcp 0
07:07:11.821825 IP tom-Latitude-3570.60470 > bb42-60-217-183.singnet.com.sg.8333: tcp 24
07:07:11.823166 IP tom-Latitude-3570.60470 > bb42-60-217-183.singnet.com.sg.8333: tcp 37
07:07:11.849789 IP bb42-60-217-183.singnet.com.sg.8333 > tom-Latitude-3570.60470: tcp 0
07:07:11.850405 IP bb42-60-217-183.singnet.com.sg.8333 > tom-Latitude-3570.60470: tcp 0
07:07:11.922044 IP tom-Latitude-3570.49070 > c-185-45-236-223.customer.ggaweb.ch.8333: tcp 24
07:07:11.922123 IP tom-Latitude-3570.46284 > static-87-75-105-186.vodafonexdsl.co.uk.8333: tcp 24
07:07:11.998868 IP tom-Latitude-3570.49070 > c-185-45-236-223.customer.ggaweb.ch.8333: tcp 433
07:07:11.999484 IP tom-Latitude-3570.46284 > static-87-75-105-186.vodafonexdsl.co.uk.8333: tcp 325
07:07:12.035282 IP c-185-45-236-223.customer.ggaweb.ch.8333 > tom-Latitude-3570.49070: tcp 0
07:07:12.040617 IP static-87-75-105-186.vodafonexdsl.co.uk.8333 > tom-Latitude-3570.46284: tcp 0
07:07:12.040623 IP c-185-45-236-223.customer.ggaweb.ch.8333 > tom-Latitude-3570.49070: tcp 0
07:07:12.040625 IP static-87-75-105-186.vodafonexdsl.co.uk.8333 > tom-Latitude-3570.46284: tcp 0
07:07:12.265814 IP bb42-60-217-183.singnet.com.sg.8333 > tom-Latitude-3570.60470: tcp 24
07:07:12.265836 IP bb42-60-217-183.singnet.com.sg.8333 > tom-Latitude-3570.60470: tcp 191
07:07:12.265926 IP tom-Latitude-3570.60470 > bb42-60-217-183.singnet.com.sg.8333: tcp 0
07:07:12.466913 IP tom-Latitude-3570.49070 > c-185-45-236-223.customer.ggaweb.ch.8333: tcp 24
07:07:12.469020 IP tom-Latitude-3570.49070 > c-185-45-236-223.customer.ggaweb.ch.8333: tcp 37
07:07:12.503083 IP c-185-45-236-223.customer.ggaweb.ch.8333 > tom-Latitude-3570.49070: tcp 0
07:07:12.510415 IP c-185-45-236-223.customer.ggaweb.ch.8333 > tom-Latitude-3570.49070: tcp 0
07:07:12.667667 IP tom-Latitude-3570.42516 > 2.56.9.15.8333: tcp 24
07:07:12.669887 IP tom-Latitude-3570.42516 > 2.56.9.15.8333: tcp 37
07:07:12.703631 IP 2.56.9.15.8333 > tom-Latitude-3570.42516: tcp 0
07:07:12.709619 IP 2.56.9.15.8333 > tom-Latitude-3570.42516: tcp 0
07:07:12.968835 IP tom-Latitude-3570.39110 > vmi195435.contaboserver.net.8333: tcp 24
07:07:12.970901 IP tom-Latitude-3570.39110 > vmi195435.contaboserver.net.8333: tcp 289
07:07:12.972873 IP ns3113832.ip-54-38-177.eu.8333 > tom-Latitude-3570.56714: tcp 24
07:07:12.972894 IP ns3113832.ip-54-38-177.eu.8333 > tom-Latitude-3570.56714: tcp 505
07:07:12.972988 IP tom-Latitude-3570.56714 > ns3113832.ip-54-38-177.eu.8333: tcp 0
07:07:12.973308 IP tom-Latitude-3570.56714 > ns3113832.ip-54-38-177.eu.8333: tcp 24
07:07:12.975101 IP tom-Latitude-3570.56714 > ns3113832.ip-54-38-177.eu.8333: tcp 145
07:07:13.095789 IP tom-Latitude-3570.56714 > ns3113832.ip-54-38-177.eu.8333: tcp 145
07:07:13.095795 IP tom-Latitude-3570.39110 > vmi195435.contaboserver.net.8333: tcp 289
07:07:13.250826 IP ns3113832.ip-54-38-177.eu.8333 > tom-Latitude-3570.56714: tcp 24
07:07:13.250851 IP ns3113832.ip-54-38-177.eu.8333 > tom-Latitude-3570.56714: tcp 374
07:07:13.250855 IP ns3113832.ip-54-38-177.eu.8333 > tom-Latitude-3570.56714: tcp 24
07:07:13.250858 IP ns3113832.ip-54-38-177.eu.8333 > tom-Latitude-3570.56714: tcp 224
07:07:13.250877 IP ns3113832.ip-54-38-177.eu.8333 > tom-Latitude-3570.56714: tcp 24
07:07:13.250880 IP ns3113832.ip-54-38-177.eu.8333 > tom-Latitude-3570.56714: tcp 406
07:07:13.250887 IP ns3113832.ip-54-38-177.eu.8333 > tom-Latitude-3570.56714: tcp 24
07:07:13.250891 IP ns3113832.ip-54-38-177.eu.8333 > tom-Latitude-3570.56714: tcp 689
07:07:13.250895 IP ns3113832.ip-54-38-177.eu.8333 > tom-Latitude-3570.56714: tcp 689
07:07:13.250911 IP tom-Latitude-3570.56714 > ns3113832.ip-54-38-177.eu.8333: tcp 0
07:07:13.291925 IP ns3113832.ip-54-38-177.eu.8333 > tom-Latitude-3570.56714: tcp 0
07:07:13.291937 IP vmi195435.contaboserver.net.8333 > tom-Latitude-3570.39110: tcp 0
07:07:13.300850 IP bb42-60-217-183.singnet.com.sg.8333 > tom-Latitude-3570.60470: tcp 145
07:07:13.300868 IP tom-Latitude-3570.60470 > bb42-60-217-183.singnet.com.sg.8333: tcp 0
07:07:13.366499 IP bb42-60-217-183.singnet.com.sg.8333 > tom-Latitude-3570.60470: tcp 24
07:07:13.366525 IP tom-Latitude-3570.60470 > bb42-60-217-183.singnet.com.sg.8333: tcp 0
07:07:13.667757 IP tom-Latitude-3570.39110 > vmi195435.contaboserver.net.8333: tcp 24
07:07:13.667806 IP tom-Latitude-3570.49070 > c-185-45-236-223.customer.ggaweb.ch.8333: tcp 24
07:07:13.669976 IP tom-Latitude-3570.39110 > vmi195435.contaboserver.net.8333: tcp 145
07:07:13.670906 IP tom-Latitude-3570.49070 > c-185-45-236-223.customer.ggaweb.ch.8333: tcp 145
07:07:13.723080 IP vmi195435.contaboserver.net.8333 > tom-Latitude-3570.39110: tcp 0
07:07:13.743102 IP c-185-45-236-223.customer.ggaweb.ch.8333 > tom-Latitude-3570.49070: tcp 0
07:07:13.743751 IP vmi195435.contaboserver.net.8333 > tom-Latitude-3570.39110: tcp 0
07:07:13.743765 IP c-185-45-236-223.customer.ggaweb.ch.8333 > tom-Latitude-3570.49070: tcp 0
07:07:13.789053 IP static-87-75-105-186.vodafonexdsl.co.uk.8333 > tom-Latitude-3570.46284: tcp 24
07:07:13.808831 IP static-87-75-105-186.vodafonexdsl.co.uk.8333 > tom-Latitude-3570.46284: tcp 289
07:07:13.808966 IP tom-Latitude-3570.46284 > static-87-75-105-186.vodafonexdsl.co.uk.8333: tcp 0
07:07:13.809231 IP tom-Latitude-3570.46284 > static-87-75-105-186.vodafonexdsl.co.uk.8333: tcp 24
07:07:13.810495 IP tom-Latitude-3570.46284 > static-87-75-105-186.vodafonexdsl.co.uk.8333: tcp 109
07:07:13.842010 IP static-87-75-105-186.vodafonexdsl.co.uk.8333 > tom-Latitude-3570.46284: tcp 0
07:07:13.843030 IP static-87-75-105-186.vodafonexdsl.co.uk.8333 > tom-Latitude-3570.46284: tcp 0
07:07:13.908090 IP static-87-75-105-186.vodafonexdsl.co.uk.8333 > tom-Latitude-3570.46284: tcp 24
07:07:13.908633 IP static-87-75-105-186.vodafonexdsl.co.uk.8333 > tom-Latitude-3570.46284: tcp 191
07:07:13.908762 IP tom-Latitude-3570.46284 > static-87-75-105-186.vodafonexdsl.co.uk.8333: tcp 0
07:07:13.916837 IP static-87-75-105-186.vodafonexdsl.co.uk.8333 > tom-Latitude-3570.46284: tcp 24
07:07:13.917562 IP static-87-75-105-186.vodafonexdsl.co.uk.8333 > tom-Latitude-3570.46284: tcp 226
07:07:13.917581 IP static-87-75-105-186.vodafonexdsl.co.uk.8333 > tom-Latitude-3570.46284: tcp 24
07:07:13.917584 IP static-87-75-105-186.vodafonexdsl.co.uk.8333 > tom-Latitude-3570.46284: tcp 224
07:07:13.917674 IP tom-Latitude-3570.46284 > static-87-75-105-186.vodafonexdsl.co.uk.8333: tcp 0
07:07:13.942056 IP vmi195435.contaboserver.net.8333 > tom-Latitude-3570.39110: tcp 24
07:07:13.942070 IP tom-Latitude-3570.39110 > vmi195435.contaboserver.net.8333: tcp 0
07:07:13.942086 IP vmi195435.contaboserver.net.8333 > tom-Latitude-3570.39110: tcp 181
07:07:13.942090 IP tom-Latitude-3570.39110 > vmi195435.contaboserver.net.8333: tcp 0
07:07:13.942445 IP tom-Latitude-3570.39110 > vmi195435.contaboserver.net.8333: tcp 24
07:07:13.944292 IP tom-Latitude-3570.39110 > vmi195435.contaboserver.net.8333: tcp 73
07:07:13.982167 IP vmi195435.contaboserver.net.8333 > tom-Latitude-3570.39110: tcp 0
07:07:13.983171 IP vmi195435.contaboserver.net.8333 > tom-Latitude-3570.39110: tcp 0
07:07:14.059760 IP vmi195435.contaboserver.net.8333 > tom-Latitude-3570.39110: tcp 24
07:07:14.059779 IP vmi195435.contaboserver.net.8333 > tom-Latitude-3570.39110: tcp 250
07:07:14.059782 IP vmi195435.contaboserver.net.8333 > tom-Latitude-3570.39110: tcp 24
07:07:14.059785 IP vmi195435.contaboserver.net.8333 > tom-Latitude-3570.39110: tcp 248
07:07:14.059869 IP tom-Latitude-3570.39110 > vmi195435.contaboserver.net.8333: tcp 0
07:07:14.161179 IP tom-Latitude-3570.60470 > bb42-60-217-183.singnet.com.sg.8333: tcp 24
07:07:14.277851 IP 167.99.216.145.8333 > tom-Latitude-3570.57976: tcp 24
07:07:14.277871 IP 167.99.216.145.8333 > tom-Latitude-3570.57976: tcp 109
07:07:14.277962 IP tom-Latitude-3570.57976 > 167.99.216.145.8333: tcp 0
07:07:14.278937 IP tom-Latitude-3570.60470 > bb42-60-217-183.singnet.com.sg.8333: tcp 181
07:07:14.308922 IP 167.99.216.145.8333 > tom-Latitude-3570.57976: tcp 109
07:07:14.308940 IP tom-Latitude-3570.57976 > 167.99.216.145.8333: tcp 0
07:07:14.341230 IP bb42-60-217-183.singnet.com.sg.8333 > tom-Latitude-3570.60470: tcp 0
07:07:14.355958 IP bb42-60-217-183.singnet.com.sg.8333 > tom-Latitude-3570.60470: tcp 0
07:07:14.930306 IP c-185-45-236-223.customer.ggaweb.ch.8333 > tom-Latitude-3570.49070: tcp 24
07:07:14.930330 IP tom-Latitude-3570.49070 > c-185-45-236-223.customer.ggaweb.ch.8333: tcp 0
07:07:14.930363 IP c-185-45-236-223.customer.ggaweb.ch.8333 > tom-Latitude-3570.49070: tcp 253
07:07:14.930368 IP tom-Latitude-3570.49070 > c-185-45-236-223.customer.ggaweb.ch.8333: tcp 0
07:07:14.930649 IP tom-Latitude-3570.49070 > c-185-45-236-223.customer.ggaweb.ch.8333: tcp 24
07:07:14.932459 IP tom-Latitude-3570.49070 > c-185-45-236-223.customer.ggaweb.ch.8333: tcp 73
07:07:14.978311 IP c-185-45-236-223.customer.ggaweb.ch.8333 > tom-Latitude-3570.49070: tcp 0
07:07:14.978967 IP c-185-45-236-223.customer.ggaweb.ch.8333 > tom-Latitude-3570.49070: tcp 0
07:07:15.011995 IP vmi195435.contaboserver.net.8333 > tom-Latitude-3570.39110: tcp 24
07:07:15.012015 IP vmi195435.contaboserver.net.8333 > tom-Latitude-3570.39110: tcp 145
07:07:15.012103 IP tom-Latitude-3570.39110 > vmi195435.contaboserver.net.8333: tcp 0
07:07:15.012322 IP tom-Latitude-3570.39110 > vmi195435.contaboserver.net.8333: tcp 24
07:07:15.013518 IP tom-Latitude-3570.39110 > vmi195435.contaboserver.net.8333: tcp 73
07:07:15.051793 IP vmi195435.contaboserver.net.8333 > tom-Latitude-3570.39110: tcp 0
07:07:15.051801 IP vmi195435.contaboserver.net.8333 > tom-Latitude-3570.39110: tcp 0
07:07:15.053986 IP c-185-45-236-223.customer.ggaweb.ch.8333 > tom-Latitude-3570.49070: tcp 24
07:07:15.063806 IP c-185-45-236-223.customer.ggaweb.ch.8333 > tom-Latitude-3570.49070: tcp 1382
07:07:15.063822 IP tom-Latitude-3570.49070 > c-185-45-236-223.customer.ggaweb.ch.8333: tcp 0
07:07:15.064843 IP c-185-45-236-223.customer.ggaweb.ch.8333 > tom-Latitude-3570.49070: tcp 66
07:07:15.064851 IP c-185-45-236-223.customer.ggaweb.ch.8333 > tom-Latitude-3570.49070: tcp 979
07:07:15.064853 IP c-185-45-236-223.customer.ggaweb.ch.8333 > tom-Latitude-3570.49070: tcp 24
07:07:15.064855 IP c-185-45-236-223.customer.ggaweb.ch.8333 > tom-Latitude-3570.49070: tcp 372
07:07:15.064857 IP tom-Latitude-3570.49070 > c-185-45-236-223.customer.ggaweb.ch.8333: tcp 0
07:07:15.107906 IP tom-Latitude-3570.49070 > c-185-45-236-223.customer.ggaweb.ch.8333: tcp 0
07:07:15.130483 IP vmi195435.contaboserver.net.8333 > tom-Latitude-3570.39110: tcp 24
07:07:15.130502 IP vmi195435.contaboserver.net.8333 > tom-Latitude-3570.39110: tcp 223
07:07:15.130507 IP vmi195435.contaboserver.net.8333 > tom-Latitude-3570.39110: tcp 24
07:07:15.130509 IP vmi195435.contaboserver.net.8333 > tom-Latitude-3570.39110: tcp 225
07:07:15.130590 IP tom-Latitude-3570.39110 > vmi195435.contaboserver.net.8333: tcp 0
07:07:15.544237 IP bb42-60-217-183.singnet.com.sg.8333 > tom-Latitude-3570.60470: tcp 24
07:07:15.544260 IP tom-Latitude-3570.60470 > bb42-60-217-183.singnet.com.sg.8333: tcp 0
07:07:15.544293 IP bb42-60-217-183.singnet.com.sg.8333 > tom-Latitude-3570.60470: tcp 109
07:07:15.544297 IP tom-Latitude-3570.60470 > bb42-60-217-183.singnet.com.sg.8333: tcp 0
07:07:15.945915 IP tom-Latitude-3570.56714 > ns3113832.ip-54-38-177.eu.8333: tcp 24
07:07:15.945993 IP tom-Latitude-3570.46284 > static-87-75-105-186.vodafonexdsl.co.uk.8333: tcp 24
07:07:15.948016 IP tom-Latitude-3570.56714 > ns3113832.ip-54-38-177.eu.8333: tcp 325
07:07:15.951198 IP tom-Latitude-3570.46284 > static-87-75-105-186.vodafonexdsl.co.uk.8333: tcp 217
07:07:15.966768 IP bb42-60-217-183.singnet.com.sg.8333 > tom-Latitude-3570.60470: tcp 24
07:07:15.966785 IP tom-Latitude-3570.60470 > bb42-60-217-183.singnet.com.sg.8333: tcp 0
07:07:15.974683 IP bb42-60-217-183.singnet.com.sg.8333 > tom-Latitude-3570.60470: tcp 325
07:07:15.974706 IP tom-Latitude-3570.60470 > bb42-60-217-183.singnet.com.sg.8333: tcp 0
07:07:15.975073 IP tom-Latitude-3570.60470 > bb42-60-217-183.singnet.com.sg.8333: tcp 24
07:07:15.976546 IP tom-Latitude-3570.60470 > bb42-60-217-183.singnet.com.sg.8333: tcp 289
07:07:15.982245 IP ns3113832.ip-54-38-177.eu.8333 > tom-Latitude-3570.56714: tcp 0
07:07:15.991548 IP static-87-75-105-186.vodafonexdsl.co.uk.8333 > tom-Latitude-3570.46284: tcp 0
07:07:15.991554 IP ns3113832.ip-54-38-177.eu.8333 > tom-Latitude-3570.56714: tcp 0
07:07:15.994095 IP static-87-75-105-186.vodafonexdsl.co.uk.8333 > tom-Latitude-3570.46284: tcp 0
07:07:16.011779 IP bb42-60-217-183.singnet.com.sg.8333 > tom-Latitude-3570.60470: tcp 0
07:07:16.011794 IP bb42-60-217-183.singnet.com.sg.8333 > tom-Latitude-3570.60470: tcp 0
07:07:16.018187 IP ns3113832.ip-54-38-177.eu.8333 > tom-Latitude-3570.56714: tcp 24
07:07:16.018204 IP tom-Latitude-3570.56714 > ns3113832.ip-54-38-177.eu.8333: tcp 0
07:07:16.018842 IP ns3113832.ip-54-38-177.eu.8333 > tom-Latitude-3570.56714: tcp 397
07:07:16.018866 IP tom-Latitude-3570.56714 > ns3113832.ip-54-38-177.eu.8333: tcp 0
07:07:16.035470 IP c-185-45-236-223.customer.ggaweb.ch.8333 > tom-Latitude-3570.49070: tcp 24
07:07:16.035483 IP tom-Latitude-3570.49070 > c-185-45-236-223.customer.ggaweb.ch.8333: tcp 0
07:07:16.035492 IP c-185-45-236-223.customer.ggaweb.ch.8333 > tom-Latitude-3570.49070: tcp 397
07:07:16.035495 IP tom-Latitude-3570.49070 > c-185-45-236-223.customer.ggaweb.ch.8333: tcp 0
07:07:16.035729 IP tom-Latitude-3570.49070 > c-185-45-236-223.customer.ggaweb.ch.8333: tcp 24
07:07:16.037489 IP tom-Latitude-3570.49070 > c-185-45-236-223.customer.ggaweb.ch.8333: tcp 37
07:07:16.070461 IP c-185-45-236-223.customer.ggaweb.ch.8333 > tom-Latitude-3570.49070: tcp 0
07:07:16.071114 IP c-185-45-236-223.customer.ggaweb.ch.8333 > tom-Latitude-3570.49070: tcp 0
07:07:16.156507 IP c-185-45-236-223.customer.ggaweb.ch.8333 > tom-Latitude-3570.49070: tcp 24
07:07:16.156514 IP c-185-45-236-223.customer.ggaweb.ch.8333 > tom-Latitude-3570.49070: tcp 404
07:07:16.156523 IP tom-Latitude-3570.49070 > c-185-45-236-223.customer.ggaweb.ch.8333: tcp 0
07:07:16.465923 IP bb42-60-217-183.singnet.com.sg.8333 > tom-Latitude-3570.60470: tcp 24
07:07:16.465944 IP bb42-60-217-183.singnet.com.sg.8333 > tom-Latitude-3570.60470: tcp 256
07:07:16.465952 IP bb42-60-217-183.singnet.com.sg.8333 > tom-Latitude-3570.60470: tcp 24
07:07:16.465973 IP bb42-60-217-183.singnet.com.sg.8333 > tom-Latitude-3570.60470: tcp 403
07:07:16.465977 IP bb42-60-217-183.singnet.com.sg.8333 > tom-Latitude-3570.60470: tcp 24
07:07:16.466040 IP tom-Latitude-3570.60470 > bb42-60-217-183.singnet.com.sg.8333: tcp 0
07:07:16.466406 IP bb42-60-217-183.singnet.com.sg.8333 > tom-Latitude-3570.60470: tcp 403
07:07:16.466425 IP bb42-60-217-183.singnet.com.sg.8333 > tom-Latitude-3570.60470: tcp 24
07:07:16.466429 IP bb42-60-217-183.singnet.com.sg.8333 > tom-Latitude-3570.60470: tcp 403
07:07:16.466432 IP bb42-60-217-183.singnet.com.sg.8333 > tom-Latitude-3570.60470: tcp 24
07:07:16.466453 IP bb42-60-217-183.singnet.com.sg.8333 > tom-Latitude-3570.60470: tcp 404
07:07:16.466458 IP bb42-60-217-183.singnet.com.sg.8333 > tom-Latitude-3570.60470: tcp 24
07:07:16.466465 IP bb42-60-217-183.singnet.com.sg.8333 > tom-Latitude-3570.60470: tcp 404
07:07:16.466469 IP bb42-60-217-183.singnet.com.sg.8333 > tom-Latitude-3570.60470: tcp 24
07:07:16.466472 IP bb42-60-217-183.singnet.com.sg.8333 > tom-Latitude-3570.60470: tcp 404
07:07:16.466477 IP bb42-60-217-183.singnet.com.sg.8333 > tom-Latitude-3570.60470: tcp 24
07:07:16.466483 IP bb42-60-217-183.singnet.com.sg.8333 > tom-Latitude-3570.60470: tcp 404
07:07:16.466519 IP tom-Latitude-3570.60470 > bb42-60-217-183.singnet.com.sg.8333: tcp 0
07:07:16.558478 IP bb42-60-217-183.singnet.com.sg.8333 > tom-Latitude-3570.60470: tcp 24
07:07:16.559025 IP bb42-60-217-183.singnet.com.sg.8333 > tom-Latitude-3570.60470: tcp 37
07:07:16.559157 IP tom-Latitude-3570.60470 > bb42-60-217-183.singnet.com.sg.8333: tcp 0
07:07:16.559344 IP tom-Latitude-3570.56714 > ns3113832.ip-54-38-177.eu.8333: tcp 24
07:07:16.559479 IP tom-Latitude-3570.57976 > 167.99.216.145.8333: tcp 24
07:07:16.560710 IP tom-Latitude-3570.56714 > ns3113832.ip-54-38-177.eu.8333: tcp 253
07:07:16.561353 IP tom-Latitude-3570.57976 > 167.99.216.145.8333: tcp 721
07:07:16.590662 IP 167.99.216.145.8333 > tom-Latitude-3570.57976: tcp 0
07:07:16.591326 IP ns3113832.ip-54-38-177.eu.8333 > tom-Latitude-3570.56714: tcp 0
07:07:16.591341 IP 167.99.216.145.8333 > tom-Latitude-3570.57976: tcp 0
07:07:16.635191 IP 2.56.9.15.8333 > tom-Latitude-3570.42516: tcp 24
07:07:16.638543 IP 2.56.9.15.8333 > tom-Latitude-3570.42516: tcp 829
07:07:16.638661 IP tom-Latitude-3570.42516 > 2.56.9.15.8333: tcp 0
07:07:16.638994 IP tom-Latitude-3570.42516 > 2.56.9.15.8333: tcp 24
07:07:16.640143 IP tom-Latitude-3570.42516 > 2.56.9.15.8333: tcp 37
07:07:16.707350 IP 2.56.9.15.8333 > tom-Latitude-3570.42516: tcp 0
07:07:16.707357 IP 2.56.9.15.8333 > tom-Latitude-3570.42516: tcp 0
07:07:16.765655 IP 2.56.9.15.8333 > tom-Latitude-3570.42516: tcp 24
07:07:16.766285 IP 2.56.9.15.8333 > tom-Latitude-3570.42516: tcp 418
07:07:16.766417 IP tom-Latitude-3570.42516 > 2.56.9.15.8333: tcp 0
07:07:16.775683 IP static-87-75-105-186.vodafonexdsl.co.uk.8333 > tom-Latitude-3570.46284: tcp 24
07:07:16.787491 IP static-87-75-105-186.vodafonexdsl.co.uk.8333 > tom-Latitude-3570.46284: tcp 397
07:07:16.787564 IP tom-Latitude-3570.46284 > static-87-75-105-186.vodafonexdsl.co.uk.8333: tcp 0
07:07:16.787787 IP tom-Latitude-3570.46284 > static-87-75-105-186.vodafonexdsl.co.uk.8333: tcp 24
07:07:16.789020 IP tom-Latitude-3570.46284 > static-87-75-105-186.vodafonexdsl.co.uk.8333: tcp 37
07:07:16.821545 IP static-87-75-105-186.vodafonexdsl.co.uk.8333 > tom-Latitude-3570.46284: tcp 0
07:07:16.823706 IP static-87-75-105-186.vodafonexdsl.co.uk.8333 > tom-Latitude-3570.46284: tcp 0
07:07:16.888370 IP static-87-75-105-186.vodafonexdsl.co.uk.8333 > tom-Latitude-3570.46284: tcp 24
07:07:16.892055 IP static-87-75-105-186.vodafonexdsl.co.uk.8333 > tom-Latitude-3570.46284: tcp 418
07:07:16.892070 IP tom-Latitude-3570.46284 > static-87-75-105-186.vodafonexdsl.co.uk.8333: tcp 0
07:07:17.093099 IP tom-Latitude-3570.60988 > 81.198.101.144.8333: tcp 24
07:07:17.093132 IP tom-Latitude-3570.60988 > 81.198.101.144.8333: tcp 1045
07:07:17.095769 IP ns3113832.ip-54-38-177.eu.8333 > tom-Latitude-3570.56714: tcp 24
07:07:17.095792 IP tom-Latitude-3570.56714 > ns3113832.ip-54-38-177.eu.8333: tcp 0
07:07:17.095823 IP ns3113832.ip-54-38-177.eu.8333 > tom-Latitude-3570.56714: tcp 109
07:07:17.095828 IP tom-Latitude-3570.56714 > ns3113832.ip-54-38-177.eu.8333: tcp 0
07:07:17.096071 IP tom-Latitude-3570.56714 > ns3113832.ip-54-38-177.eu.8333: tcp 24
07:07:17.100889 IP tom-Latitude-3570.56714 > ns3113832.ip-54-38-177.eu.8333: tcp 37
07:07:17.112529 IP 81.198.101.144.8333 > tom-Latitude-3570.60988: tcp 0
07:07:17.122146 IP 81.198.101.144.8333 > tom-Latitude-3570.60988: tcp 0
07:07:17.129082 IP ns3113832.ip-54-38-177.eu.8333 > tom-Latitude-3570.56714: tcp 0
07:07:17.188298 IP ns3113832.ip-54-38-177.eu.8333 > tom-Latitude-3570.56714: tcp 24
07:07:17.188319 IP ns3113832.ip-54-38-177.eu.8333 > tom-Latitude-3570.56714: tcp 461
07:07:17.188410 IP tom-Latitude-3570.56714 > ns3113832.ip-54-38-177.eu.8333: tcp 0
07:07:17.389494 IP tom-Latitude-3570.42516 > 2.56.9.15.8333: tcp 24
07:07:17.391532 IP tom-Latitude-3570.42516 > 2.56.9.15.8333: tcp 73
07:07:17.394879 IP c-185-45-236-223.customer.ggaweb.ch.8333 > tom-Latitude-3570.49070: tcp 24
07:07:17.394899 IP c-185-45-236-223.customer.ggaweb.ch.8333 > tom-Latitude-3570.49070: tcp 145
07:07:17.394992 IP tom-Latitude-3570.49070 > c-185-45-236-223.customer.ggaweb.ch.8333: tcp 0
07:07:17.395197 IP tom-Latitude-3570.49070 > c-185-45-236-223.customer.ggaweb.ch.8333: tcp 24
07:07:17.396469 IP tom-Latitude-3570.49070 > c-185-45-236-223.customer.ggaweb.ch.8333: tcp 37
07:07:17.435922 IP 2.56.9.15.8333 > tom-Latitude-3570.42516: tcp 0
07:07:17.435935 IP 2.56.9.15.8333 > tom-Latitude-3570.42516: tcp 0
07:07:17.435939 IP c-185-45-236-223.customer.ggaweb.ch.8333 > tom-Latitude-3570.49070: tcp 0
07:07:17.435942 IP c-185-45-236-223.customer.ggaweb.ch.8333 > tom-Latitude-3570.49070: tcp 0
07:07:17.495682 IP tom-Latitude-3570.39110 > vmi195435.contaboserver.net.8333: tcp 24
07:07:17.496636 IP tom-Latitude-3570.39110 > vmi195435.contaboserver.net.8333: tcp 433
07:07:17.513661 IP c-185-45-236-223.customer.ggaweb.ch.8333 > tom-Latitude-3570.49070: tcp 24
07:07:17.514274 IP c-185-45-236-223.customer.ggaweb.ch.8333 > tom-Latitude-3570.49070: tcp 224
07:07:17.514405 IP tom-Latitude-3570.49070 > c-185-45-236-223.customer.ggaweb.ch.8333: tcp 0
07:07:17.522553 IP vmi195435.contaboserver.net.8333 > tom-Latitude-3570.39110: tcp 0
07:07:17.530487 IP vmi195435.contaboserver.net.8333 > tom-Latitude-3570.39110: tcp 0
07:07:17.797543 IP bb42-60-217-183.singnet.com.sg.8333 > tom-Latitude-3570.60470: tcp 24
07:07:17.797563 IP bb42-60-217-183.singnet.com.sg.8333 > tom-Latitude-3570.60470: tcp 109
07:07:17.797657 IP tom-Latitude-3570.60470 > bb42-60-217-183.singnet.com.sg.8333: tcp 0
07:07:17.898052 IP tom-Latitude-3570.60470 > bb42-60-217-183.singnet.com.sg.8333: tcp 24
07:07:17.898863 IP tom-Latitude-3570.60470 > bb42-60-217-183.singnet.com.sg.8333: tcp 37
07:07:17.932583 IP bb42-60-217-183.singnet.com.sg.8333 > tom-Latitude-3570.60470: tcp 0
07:07:17.998246 IP tom-Latitude-3570.46284 > static-87-75-105-186.vodafonexdsl.co.uk.8333: tcp 24
07:07:17.999060 IP tom-Latitude-3570.46284 > static-87-75-105-186.vodafonexdsl.co.uk.8333: tcp 73
07:07:18.034865 IP static-87-75-105-186.vodafonexdsl.co.uk.8333 > tom-Latitude-3570.46284: tcp 0
07:07:18.042282 IP static-87-75-105-186.vodafonexdsl.co.uk.8333 > tom-Latitude-3570.46284: tcp 0
07:07:18.199069 IP tom-Latitude-3570.57976 > 167.99.216.145.8333: tcp 24
07:07:18.203902 IP tom-Latitude-3570.60470 > bb42-60-217-183.singnet.com.sg.8333: tcp 37
07:07:18.204743 IP tom-Latitude-3570.57976 > 167.99.216.145.8333: tcp 145
07:07:18.233102 IP 167.99.216.145.8333 > tom-Latitude-3570.57976: tcp 0
07:07:18.259816 IP bb42-60-217-183.singnet.com.sg.8333 > tom-Latitude-3570.60470: tcp 0
07:07:18.259832 IP 167.99.216.145.8333 > tom-Latitude-3570.57976: tcp 0
07:07:18.819572 IP 2.56.9.15.8333 > tom-Latitude-3570.42516: tcp 24
07:07:18.819594 IP 2.56.9.15.8333 > tom-Latitude-3570.42516: tcp 109
07:07:18.819638 IP tom-Latitude-3570.42516 > 2.56.9.15.8333: tcp 0
07:07:18.819854 IP tom-Latitude-3570.42516 > 2.56.9.15.8333: tcp 24
07:07:18.821137 IP tom-Latitude-3570.42516 > 2.56.9.15.8333: tcp 73
07:07:18.862286 IP 2.56.9.15.8333 > tom-Latitude-3570.42516: tcp 0
07:07:18.862875 IP 2.56.9.15.8333 > tom-Latitude-3570.42516: tcp 0
07:07:18.920299 IP tom-Latitude-3570.56714 > ns3113832.ip-54-38-177.eu.8333: tcp 24
07:07:18.921238 IP tom-Latitude-3570.56714 > ns3113832.ip-54-38-177.eu.8333: tcp 37
07:07:18.968815 IP 2.56.9.15.8333 > tom-Latitude-3570.42516: tcp 24
07:07:18.968836 IP 2.56.9.15.8333 > tom-Latitude-3570.42516: tcp 226
07:07:18.968841 IP 2.56.9.15.8333 > tom-Latitude-3570.42516: tcp 24
07:07:18.968844 IP 2.56.9.15.8333 > tom-Latitude-3570.42516: tcp 249
07:07:18.968847 IP ns3113832.ip-54-38-177.eu.8333 > tom-Latitude-3570.56714: tcp 0
07:07:18.968884 IP tom-Latitude-3570.42516 > 2.56.9.15.8333: tcp 0
07:07:19.015584 IP vmi195435.contaboserver.net.8333 > tom-Latitude-3570.39110: tcp 24
07:07:19.016148 IP vmi195435.contaboserver.net.8333 > tom-Latitude-3570.39110: tcp 217
07:07:19.016209 IP tom-Latitude-3570.39110 > vmi195435.contaboserver.net.8333: tcp 0
07:07:19.016430 IP tom-Latitude-3570.39110 > vmi195435.contaboserver.net.8333: tcp 24
07:07:19.017822 IP tom-Latitude-3570.39110 > vmi195435.contaboserver.net.8333: tcp 109
07:07:19.051667 IP vmi195435.contaboserver.net.8333 > tom-Latitude-3570.39110: tcp 0
07:07:19.051688 IP vmi195435.contaboserver.net.8333 > tom-Latitude-3570.39110: tcp 0
07:07:19.130783 IP vmi195435.contaboserver.net.8333 > tom-Latitude-3570.39110: tcp 24
07:07:19.130804 IP vmi195435.contaboserver.net.8333 > tom-Latitude-3570.39110: tcp 249
07:07:19.130810 IP vmi195435.contaboserver.net.8333 > tom-Latitude-3570.39110: tcp 24
07:07:19.130813 IP vmi195435.contaboserver.net.8333 > tom-Latitude-3570.39110: tcp 257
07:07:19.130815 IP vmi195435.contaboserver.net.8333 > tom-Latitude-3570.39110: tcp 24
07:07:19.130871 IP tom-Latitude-3570.39110 > vmi195435.contaboserver.net.8333: tcp 0
07:07:19.131579 IP vmi195435.contaboserver.net.8333 > tom-Latitude-3570.39110: tcp 540
07:07:19.171918 IP tom-Latitude-3570.39110 > vmi195435.contaboserver.net.8333: tcp 0
07:07:19.203277 IP static-87-75-105-186.vodafonexdsl.co.uk.8333 > tom-Latitude-3570.46284: tcp 24
07:07:19.203905 IP static-87-75-105-186.vodafonexdsl.co.uk.8333 > tom-Latitude-3570.46284: tcp 8
07:07:19.203969 IP tom-Latitude-3570.46284 > static-87-75-105-186.vodafonexdsl.co.uk.8333: tcp 0
07:07:19.204109 IP tom-Latitude-3570.46284 > static-87-75-105-186.vodafonexdsl.co.uk.8333: tcp 24
07:07:19.205597 IP tom-Latitude-3570.46284 > static-87-75-105-186.vodafonexdsl.co.uk.8333: tcp 8
07:07:19.264945 IP static-87-75-105-186.vodafonexdsl.co.uk.8333 > tom-Latitude-3570.46284: tcp 0
07:07:19.264959 IP static-87-75-105-186.vodafonexdsl.co.uk.8333 > tom-Latitude-3570.46284: tcp 0
07:07:19.404905 IP tom-Latitude-3570.57976 > 167.99.216.145.8333: tcp 24
07:07:19.407093 IP tom-Latitude-3570.57976 > 167.99.216.145.8333: tcp 181
07:07:19.443225 IP 167.99.216.145.8333 > tom-Latitude-3570.57976: tcp 0
07:07:19.454373 IP 167.99.216.145.8333 > tom-Latitude-3570.57976: tcp 0
07:07:19.605690 IP tom-Latitude-3570.49070 > c-185-45-236-223.customer.ggaweb.ch.8333: tcp 24
07:07:19.750891 IP tom-Latitude-3570.49070 > c-185-45-236-223.customer.ggaweb.ch.8333: tcp 181
07:07:19.751450 IP ns3113832.ip-54-38-177.eu.8333 > tom-Latitude-3570.56714: tcp 24
07:07:19.751473 IP ns3113832.ip-54-38-177.eu.8333 > tom-Latitude-3570.56714: tcp 217
07:07:19.751518 IP tom-Latitude-3570.56714 > ns3113832.ip-54-38-177.eu.8333: tcp 0
07:07:19.751759 IP tom-Latitude-3570.56714 > ns3113832.ip-54-38-177.eu.8333: tcp 24
07:07:19.753783 IP tom-Latitude-3570.56714 > ns3113832.ip-54-38-177.eu.8333: tcp 37
07:07:19.791439 IP c-185-45-236-223.customer.ggaweb.ch.8333 > tom-Latitude-3570.49070: tcp 0
07:07:19.791868 IP c-185-45-236-223.customer.ggaweb.ch.8333 > tom-Latitude-3570.49070: tcp 0
07:07:19.791874 IP ns3113832.ip-54-38-177.eu.8333 > tom-Latitude-3570.56714: tcp 0
07:07:19.851522 IP ns3113832.ip-54-38-177.eu.8333 > tom-Latitude-3570.56714: tcp 24
07:07:19.851543 IP ns3113832.ip-54-38-177.eu.8333 > tom-Latitude-3570.56714: tcp 256
07:07:19.851590 IP tom-Latitude-3570.56714 > ns3113832.ip-54-38-177.eu.8333: tcp 0
07:07:19.952192 IP tom-Latitude-3570.39110 > vmi195435.contaboserver.net.8333: tcp 24
07:07:19.953402 IP tom-Latitude-3570.39110 > vmi195435.contaboserver.net.8333: tcp 37
07:07:19.982815 IP vmi195435.contaboserver.net.8333 > tom-Latitude-3570.39110: tcp 0
07:07:19.991809 IP vmi195435.contaboserver.net.8333 > tom-Latitude-3570.39110: tcp 0
07:07:20.151600 IP bb42-60-217-183.singnet.com.sg.8333 > tom-Latitude-3570.60470: tcp 24
07:07:20.151623 IP bb42-60-217-183.singnet.com.sg.8333 > tom-Latitude-3570.60470: tcp 217
07:07:20.151667 IP tom-Latitude-3570.60470 > bb42-60-217-183.singnet.com.sg.8333: tcp 0
07:07:20.180858 IP 81.198.101.144.8333 > tom-Latitude-3570.60988: tcp 24
07:07:20.181420 IP 81.198.101.144.8333 > tom-Latitude-3570.60988: tcp 217
07:07:20.181482 IP tom-Latitude-3570.60988 > 81.198.101.144.8333: tcp 0
07:07:20.583036 IP tom-Latitude-3570.57976 > 167.99.216.145.8333: tcp 24
07:07:20.585182 IP tom-Latitude-3570.57976 > 167.99.216.145.8333: tcp 37
07:07:20.633211 IP 167.99.216.145.8333 > tom-Latitude-3570.57976: tcp 0
07:07:20.641994 IP 167.99.216.145.8333 > tom-Latitude-3570.57976: tcp 0
07:07:20.783780 IP tom-Latitude-3570.60988 > 81.198.101.144.8333: tcp 24
07:07:20.783841 IP tom-Latitude-3570.42516 > 2.56.9.15.8333: tcp 24
07:07:20.870510 IP tom-Latitude-3570.60988 > 81.198.101.144.8333: tcp 73
07:07:20.871149 IP tom-Latitude-3570.42516 > 2.56.9.15.8333: tcp 145
07:07:20.901768 IP 81.198.101.144.8333 > tom-Latitude-3570.60988: tcp 0
07:07:20.909775 IP 2.56.9.15.8333 > tom-Latitude-3570.42516: tcp 0
07:07:20.910463 IP 81.198.101.144.8333 > tom-Latitude-3570.60988: tcp 0
07:07:20.910477 IP 2.56.9.15.8333 > tom-Latitude-3570.42516: tcp 0
07:07:21.279181 IP bb42-60-217-183.singnet.com.sg.8333 > tom-Latitude-3570.60470: tcp 24
07:07:21.279201 IP bb42-60-217-183.singnet.com.sg.8333 > tom-Latitude-3570.60470: tcp 181
07:07:21.279247 IP tom-Latitude-3570.60470 > bb42-60-217-183.singnet.com.sg.8333: tcp 0
07:07:21.279550 IP tom-Latitude-3570.60470 > bb42-60-217-183.singnet.com.sg.8333: tcp 24
07:07:21.280920 IP tom-Latitude-3570.60470 > bb42-60-217-183.singnet.com.sg.8333: tcp 181
07:07:21.319826 IP bb42-60-217-183.singnet.com.sg.8333 > tom-Latitude-3570.60470: tcp 0
07:07:21.320460 IP bb42-60-217-183.singnet.com.sg.8333 > tom-Latitude-3570.60470: tcp 0
07:07:22.098023 IP bb42-60-217-183.singnet.com.sg.8333 > tom-Latitude-3570.60470: tcp 24
07:07:22.098046 IP bb42-60-217-183.singnet.com.sg.8333 > tom-Latitude-3570.60470: tcp 366
07:07:22.098050 IP bb42-60-217-183.singnet.com.sg.8333 > tom-Latitude-3570.60470: tcp 24
07:07:22.098054 IP bb42-60-217-183.singnet.com.sg.8333 > tom-Latitude-3570.60470: tcp 223
07:07:22.098061 IP bb42-60-217-183.singnet.com.sg.8333 > tom-Latitude-3570.60470: tcp 24
07:07:22.098065 IP bb42-60-217-183.singnet.com.sg.8333 > tom-Latitude-3570.60470: tcp 225
07:07:22.098114 IP tom-Latitude-3570.60470 > bb42-60-217-183.singnet.com.sg.8333: tcp 0
07:07:22.098295 IP bb42-60-217-183.singnet.com.sg.8333 > tom-Latitude-3570.60470: tcp 24
07:07:22.098325 IP bb42-60-217-183.singnet.com.sg.8333 > tom-Latitude-3570.60470: tcp 421
07:07:22.098330 IP bb42-60-217-183.singnet.com.sg.8333 > tom-Latitude-3570.60470: tcp 24
07:07:22.098334 IP bb42-60-217-183.singnet.com.sg.8333 > tom-Latitude-3570.60470: tcp 226
07:07:22.098337 IP bb42-60-217-183.singnet.com.sg.8333 > tom-Latitude-3570.60470: tcp 226
07:07:22.098374 IP tom-Latitude-3570.60470 > bb42-60-217-183.singnet.com.sg.8333: tcp 0
07:07:22.402212 IP tom-Latitude-3570.49070 > c-185-45-236-223.customer.ggaweb.ch.8333: tcp 24
07:07:22.404877 IP tom-Latitude-3570.49070 > c-185-45-236-223.customer.ggaweb.ch.8333: tcp 217
07:07:22.434044 IP c-185-45-236-223.customer.ggaweb.ch.8333 > tom-Latitude-3570.49070: tcp 0
07:07:22.444123 IP c-185-45-236-223.customer.ggaweb.ch.8333 > tom-Latitude-3570.49070: tcp 0
07:07:23.327336 IP ns3113832.ip-54-38-177.eu.8333 > tom-Latitude-3570.56714: tcp 24
07:07:23.327359 IP ns3113832.ip-54-38-177.eu.8333 > tom-Latitude-3570.56714: tcp 325
07:07:23.327364 IP ns3113832.ip-54-38-177.eu.8333 > tom-Latitude-3570.56714: tcp 24
07:07:23.327368 IP ns3113832.ip-54-38-177.eu.8333 > tom-Latitude-3570.56714: tcp 109
07:07:23.327371 IP ns3113832.ip-54-38-177.eu.8333 > tom-Latitude-3570.56714: tcp 109
07:07:23.327382 IP tom-Latitude-3570.56714 > ns3113832.ip-54-38-177.eu.8333: tcp 0
07:07:23.327644 IP tom-Latitude-3570.56714 > ns3113832.ip-54-38-177.eu.8333: tcp 24
07:07:23.329185 IP tom-Latitude-3570.56714 > ns3113832.ip-54-38-177.eu.8333: tcp 278
07:07:23.370575 IP ns3113832.ip-54-38-177.eu.8333 > tom-Latitude-3570.56714: tcp 0
07:07:23.428921 IP ns3113832.ip-54-38-177.eu.8333 > tom-Latitude-3570.56714: tcp 24
07:07:23.429956 IP ns3113832.ip-54-38-177.eu.8333 > tom-Latitude-3570.56714: tcp 367
