02:36:11.045214 IP tom-Latitude-3570.46284 > static-87-75-105-186.vodafonexdsl.co.uk.8333: tcp 24
02:36:11.046145 IP tom-Latitude-3570.46284 > static-87-75-105-186.vodafonexdsl.co.uk.8333: tcp 31
02:36:11.091801 IP static-87-75-105-186.vodafonexdsl.co.uk.8333 > tom-Latitude-3570.46284: tcp 0
02:36:11.948196 IP tom-Latitude-3570.57976 > 167.99.216.145.8333: tcp 24
02:36:11.949156 IP tom-Latitude-3570.57976 > 167.99.216.145.8333: tcp 109
02:36:11.997530 IP 2.56.9.15.8333 > tom-Latitude-3570.42516: tcp 24
02:36:11.998196 IP 2.56.9.15.8333 > tom-Latitude-3570.42516: tcp 145
02:36:11.998214 IP 2.56.9.15.8333 > tom-Latitude-3570.42516: tcp 145
02:36:11.998226 IP tom-Latitude-3570.42516 > 2.56.9.15.8333: tcp 0
02:36:11.998478 IP tom-Latitude-3570.42516 > 2.56.9.15.8333: tcp 24
02:36:11.999781 IP tom-Latitude-3570.42516 > 2.56.9.15.8333: tcp 109
02:36:12.001179 IP 167.99.216.145.8333 > tom-Latitude-3570.57976: tcp 0
02:36:12.029816 IP 2.56.9.15.8333 > tom-Latitude-3570.42516: tcp 0
02:36:12.030616 IP 2.56.9.15.8333 > tom-Latitude-3570.42516: tcp 0
02:36:12.098865 IP tom-Latitude-3570.49070 > c-185-45-236-223.customer.ggaweb.ch.8333: tcp 24
02:36:12.099800 IP tom-Latitude-3570.49070 > c-185-45-236-223.customer.ggaweb.ch.8333: tcp 31
02:36:12.127700 IP 2.56.9.15.8333 > tom-Latitude-3570.42516: tcp 24
02:36:12.128313 IP 2.56.9.15.8333 > tom-Latitude-3570.42516: tcp 224
02:36:12.128331 IP 2.56.9.15.8333 > tom-Latitude-3570.42516: tcp 24
02:36:12.128334 IP 2.56.9.15.8333 > tom-Latitude-3570.42516: tcp 223
02:36:12.128337 IP 2.56.9.15.8333 > tom-Latitude-3570.42516: tcp 24
02:36:12.128339 IP 2.56.9.15.8333 > tom-Latitude-3570.42516: tcp 223
02:36:12.128379 IP tom-Latitude-3570.42516 > 2.56.9.15.8333: tcp 0
02:36:12.141238 IP c-185-45-236-223.customer.ggaweb.ch.8333 > tom-Latitude-3570.49070: tcp 0
02:36:12.329801 IP tom-Latitude-3570.49070 > c-185-45-236-223.customer.ggaweb.ch.8333: tcp 24
02:36:12.330736 IP tom-Latitude-3570.49070 > c-185-45-236-223.customer.ggaweb.ch.8333: tcp 109
02:36:12.371265 IP c-185-45-236-223.customer.ggaweb.ch.8333 > tom-Latitude-3570.49070: tcp 0
02:36:12.831357 IP tom-Latitude-3570.60470 > bb42-60-217-183.singnet.com.sg.8333: tcp 24
02:36:12.832145 IP tom-Latitude-3570.60470 > bb42-60-217-183.singnet.com.sg.8333: tcp 109
02:36:12.895007 IP bb42-60-217-183.singnet.com.sg.8333 > tom-Latitude-3570.60470: tcp 0
02:36:12.900477 IP bb42-60-217-183.singnet.com.sg.8333 > tom-Latitude-3570.60470: tcp 0
02:36:13.537326 IP static-87-75-105-186.vodafonexdsl.co.uk.8333 > tom-Latitude-3570.46284: tcp 24
02:36:13.538084 IP static-87-75-105-186.vodafonexdsl.co.uk.8333 > tom-Latitude-3570.46284: tcp 253
02:36:13.538102 IP vmi195435.contaboserver.net.8333 > tom-Latitude-3570.39110: tcp 24
02:36:13.538106 IP vmi195435.contaboserver.net.8333 > tom-Latitude-3570.39110: tcp 145
02:36:13.538166 IP tom-Latitude-3570.39110 > vmi195435.contaboserver.net.8333: tcp 0
02:36:13.538218 IP tom-Latitude-3570.46284 > static-87-75-105-186.vodafonexdsl.co.uk.8333: tcp 0
02:36:13.538382 IP tom-Latitude-3570.39110 > vmi195435.contaboserver.net.8333: tcp 24
02:36:13.540741 IP tom-Latitude-3570.39110 > vmi195435.contaboserver.net.8333: tcp 37
02:36:13.610652 IP vmi195435.contaboserver.net.8333 > tom-Latitude-3570.39110: tcp 0
02:36:13.610667 IP vmi195435.contaboserver.net.8333 > tom-Latitude-3570.39110: tcp 0
02:36:13.638861 IP tom-Latitude-3570.60988 > 81.198.101.144.8333: tcp 24
02:36:13.639827 IP tom-Latitude-3570.60988 > 81.198.101.144.8333: tcp 109
02:36:13.667180 IP vmi195435.contaboserver.net.8333 > tom-Latitude-3570.39110: tcp 24
02:36:13.667200 IP vmi195435.contaboserver.net.8333 > tom-Latitude-3570.39110: tcp 226
02:36:13.667205 IP 81.198.101.144.8333 > tom-Latitude-3570.60988: tcp 0
02:36:13.667241 IP tom-Latitude-3570.39110 > vmi195435.contaboserver.net.8333: tcp 0
02:36:13.667633 IP 81.198.101.144.8333 > tom-Latitude-3570.60988: tcp 0
02:36:13.707929 IP 2.56.9.15.8333 > tom-Latitude-3570.42516: tcp 24
02:36:13.707947 IP 2.56.9.15.8333 > tom-Latitude-3570.42516: tcp 37
02:36:13.707993 IP tom-Latitude-3570.42516 > 2.56.9.15.8333: tcp 0
02:36:13.708149 IP tom-Latitude-3570.60470 > bb42-60-217-183.singnet.com.sg.8333: tcp 24
02:36:13.709523 IP tom-Latitude-3570.60470 > bb42-60-217-183.singnet.com.sg.8333: tcp 37
02:36:13.755290 IP bb42-60-217-183.singnet.com.sg.8333 > tom-Latitude-3570.60470: tcp 0
02:36:13.755304 IP bb42-60-217-183.singnet.com.sg.8333 > tom-Latitude-3570.60470: tcp 0
02:36:14.597789 IP static-87-75-105-186.vodafonexdsl.co.uk.8333 > tom-Latitude-3570.46284: tcp 24
02:36:14.597809 IP static-87-75-105-186.vodafonexdsl.co.uk.8333 > tom-Latitude-3570.46284: tcp 181
02:36:14.597857 IP tom-Latitude-3570.46284 > static-87-75-105-186.vodafonexdsl.co.uk.8333: tcp 0
02:36:14.598100 IP tom-Latitude-3570.46284 > static-87-75-105-186.vodafonexdsl.co.uk.8333: tcp 24
02:36:14.599703 IP tom-Latitude-3570.46284 > static-87-75-105-186.vodafonexdsl.co.uk.8333: tcp 181
02:36:14.641267 IP static-87-75-105-186.vodafonexdsl.co.uk.8333 > tom-Latitude-3570.46284: tcp 0
02:36:14.698521 IP tom-Latitude-3570.56714 > ns3113832.ip-54-38-177.eu.8333: tcp 24
02:36:14.699502 IP tom-Latitude-3570.56714 > ns3113832.ip-54-38-177.eu.8333: tcp 145
02:36:14.706661 IP static-87-75-105-186.vodafonexdsl.co.uk.8333 > tom-Latitude-3570.46284: tcp 24
02:36:14.707390 IP static-87-75-105-186.vodafonexdsl.co.uk.8333 > tom-Latitude-3570.46284: tcp 372
02:36:14.707417 IP static-87-75-105-186.vodafonexdsl.co.uk.8333 > tom-Latitude-3570.46284: tcp 24
02:36:14.707465 IP tom-Latitude-3570.46284 > static-87-75-105-186.vodafonexdsl.co.uk.8333: tcp 0
02:36:14.715581 IP static-87-75-105-186.vodafonexdsl.co.uk.8333 > tom-Latitude-3570.46284: tcp 225
02:36:14.716293 IP static-87-75-105-186.vodafonexdsl.co.uk.8333 > tom-Latitude-3570.46284: tcp 24
02:36:14.716308 IP static-87-75-105-186.vodafonexdsl.co.uk.8333 > tom-Latitude-3570.46284: tcp 226
02:36:14.716311 IP static-87-75-105-186.vodafonexdsl.co.uk.8333 > tom-Latitude-3570.46284: tcp 24
02:36:14.716314 IP static-87-75-105-186.vodafonexdsl.co.uk.8333 > tom-Latitude-3570.46284: tcp 247
02:36:14.716316 IP static-87-75-105-186.vodafonexdsl.co.uk.8333 > tom-Latitude-3570.46284: tcp 24
02:36:14.716319 IP static-87-75-105-186.vodafonexdsl.co.uk.8333 > tom-Latitude-3570.46284: tcp 223
02:36:14.716348 IP tom-Latitude-3570.46284 > static-87-75-105-186.vodafonexdsl.co.uk.8333: tcp 0
02:36:14.718834 IP ns3113832.ip-54-38-177.eu.8333 > tom-Latitude-3570.56714: tcp 0
02:36:14.739856 IP ns3113832.ip-54-38-177.eu.8333 > tom-Latitude-3570.56714: tcp 0
02:36:15.218736 IP tom-Latitude-3570.56714 > ns3113832.ip-54-38-177.eu.8333: tcp 24
02:36:15.219666 IP tom-Latitude-3570.56714 > ns3113832.ip-54-38-177.eu.8333: tcp 181
02:36:15.263006 IP ns3113832.ip-54-38-177.eu.8333 > tom-Latitude-3570.56714: tcp 0
02:36:15.269851 IP ns3113832.ip-54-38-177.eu.8333 > tom-Latitude-3570.56714: tcp 0
02:36:15.857645 IP ns3113832.ip-54-38-177.eu.8333 > tom-Latitude-3570.56714: tcp 24
02:36:15.857664 IP ns3113832.ip-54-38-177.eu.8333 > tom-Latitude-3570.56714: tcp 37
02:36:15.857710 IP tom-Latitude-3570.56714 > ns3113832.ip-54-38-177.eu.8333: tcp 0
02:36:15.857896 IP tom-Latitude-3570.56714 > ns3113832.ip-54-38-177.eu.8333: tcp 24
02:36:15.860795 IP ns3113832.ip-54-38-177.eu.8333 > tom-Latitude-3570.56714: tcp 37
02:36:15.860815 IP tom-Latitude-3570.56714 > ns3113832.ip-54-38-177.eu.8333: tcp 37
02:36:15.889766 IP ns3113832.ip-54-38-177.eu.8333 > tom-Latitude-3570.56714: tcp 0
02:36:15.890318 IP ns3113832.ip-54-38-177.eu.8333 > tom-Latitude-3570.56714: tcp 0
02:36:15.947390 IP ns3113832.ip-54-38-177.eu.8333 > tom-Latitude-3570.56714: tcp 24
02:36:15.948113 IP ns3113832.ip-54-38-177.eu.8333 > tom-Latitude-3570.56714: tcp 224
02:36:15.948178 IP tom-Latitude-3570.56714 > ns3113832.ip-54-38-177.eu.8333: tcp 0
02:36:16.504616 IP 2.56.9.15.8333 > tom-Latitude-3570.42516: tcp 24
02:36:16.505276 IP 2.56.9.15.8333 > tom-Latitude-3570.42516: tcp 217
02:36:16.505295 IP 2.56.9.15.8333 > tom-Latitude-3570.42516: tcp 217
02:36:16.505307 IP tom-Latitude-3570.42516 > 2.56.9.15.8333: tcp 0
02:36:16.605982 IP tom-Latitude-3570.57976 > 167.99.216.145.8333: tcp 24
02:36:16.606985 IP tom-Latitude-3570.57976 > 167.99.216.145.8333: tcp 361
02:36:16.654667 IP 167.99.216.145.8333 > tom-Latitude-3570.57976: tcp 0
02:36:16.706465 IP tom-Latitude-3570.60988 > 81.198.101.144.8333: tcp 24
02:36:16.736772 IP tom-Latitude-3570.60988 > 81.198.101.144.8333: tcp 253
02:36:16.774445 IP 81.198.101.144.8333 > tom-Latitude-3570.60988: tcp 0
02:36:16.779624 IP 81.198.101.144.8333 > tom-Latitude-3570.60988: tcp 0
02:36:16.907274 IP tom-Latitude-3570.60470 > bb42-60-217-183.singnet.com.sg.8333: tcp 24
02:36:16.908258 IP tom-Latitude-3570.60470 > bb42-60-217-183.singnet.com.sg.8333: tcp 217
02:36:16.942872 IP bb42-60-217-183.singnet.com.sg.8333 > tom-Latitude-3570.60470: tcp 0
02:36:16.950691 IP bb42-60-217-183.singnet.com.sg.8333 > tom-Latitude-3570.60470: tcp 0
02:36:17.090913 IP static-87-75-105-186.vodafonexdsl.co.uk.8333 > tom-Latitude-3570.46284: tcp 24
02:36:17.091556 IP static-87-75-105-186.vodafonexdsl.co.uk.8333 > tom-Latitude-3570.46284: tcp 109
02:36:17.091661 IP tom-Latitude-3570.46284 > static-87-75-105-186.vodafonexdsl.co.uk.8333: tcp 0
02:36:17.091903 IP tom-Latitude-3570.46284 > static-87-75-105-186.vodafonexdsl.co.uk.8333: tcp 24
02:36:17.093278 IP tom-Latitude-3570.46284 > static-87-75-105-186.vodafonexdsl.co.uk.8333: tcp 73
02:36:17.120692 IP static-87-75-105-186.vodafonexdsl.co.uk.8333 > tom-Latitude-3570.46284: tcp 0
02:36:17.186496 IP static-87-75-105-186.vodafonexdsl.co.uk.8333 > tom-Latitude-3570.46284: tcp 24
02:36:17.187041 IP static-87-75-105-186.vodafonexdsl.co.uk.8333 > tom-Latitude-3570.46284: tcp 224
02:36:17.187059 IP static-87-75-105-186.vodafonexdsl.co.uk.8333 > tom-Latitude-3570.46284: tcp 24
02:36:17.187107 IP tom-Latitude-3570.46284 > static-87-75-105-186.vodafonexdsl.co.uk.8333: tcp 0
02:36:17.190678 IP static-87-75-105-186.vodafonexdsl.co.uk.8333 > tom-Latitude-3570.46284: tcp 1382
02:36:17.191486 IP static-87-75-105-186.vodafonexdsl.co.uk.8333 > tom-Latitude-3570.46284: tcp 58
02:36:17.191504 IP static-87-75-105-186.vodafonexdsl.co.uk.8333 > tom-Latitude-3570.46284: tcp 1440
02:36:17.191507 IP static-87-75-105-186.vodafonexdsl.co.uk.8333 > tom-Latitude-3570.46284: tcp 641
02:36:17.191544 IP tom-Latitude-3570.46284 > static-87-75-105-186.vodafonexdsl.co.uk.8333: tcp 0
02:36:17.401925 IP tom-Latitude-3570.60988 > 81.198.101.144.8333: tcp 24
02:36:17.401981 IP tom-Latitude-3570.60470 > bb42-60-217-183.singnet.com.sg.8333: tcp 24
02:36:17.402894 IP tom-Latitude-3570.60470 > bb42-60-217-183.singnet.com.sg.8333: tcp 73
02:36:17.402905 IP tom-Latitude-3570.60988 > 81.198.101.144.8333: tcp 61
02:36:17.432847 IP 81.198.101.144.8333 > tom-Latitude-3570.60988: tcp 0
02:36:17.440875 IP 81.198.101.144.8333 > tom-Latitude-3570.60988: tcp 0
02:36:17.441525 IP bb42-60-217-183.singnet.com.sg.8333 > tom-Latitude-3570.60470: tcp 0
02:36:17.441540 IP bb42-60-217-183.singnet.com.sg.8333 > tom-Latitude-3570.60470: tcp 0
02:36:18.004004 IP tom-Latitude-3570.49070 > c-185-45-236-223.customer.ggaweb.ch.8333: tcp 24
02:36:18.017155 IP tom-Latitude-3570.49070 > c-185-45-236-223.customer.ggaweb.ch.8333: tcp 325
02:36:18.089400 IP c-185-45-236-223.customer.ggaweb.ch.8333 > tom-Latitude-3570.49070: tcp 0
02:36:18.204733 IP tom-Latitude-3570.57976 > 167.99.216.145.8333: tcp 24
02:36:18.207914 IP tom-Latitude-3570.57976 > 167.99.216.145.8333: tcp 73
02:36:18.252396 IP 167.99.216.145.8333 > tom-Latitude-3570.57976: tcp 0
02:36:18.907080 IP tom-Latitude-3570.39110 > vmi195435.contaboserver.net.8333: tcp 24
02:36:18.907824 IP tom-Latitude-3570.39110 > vmi195435.contaboserver.net.8333: tcp 289
02:36:18.961726 IP vmi195435.contaboserver.net.8333 > tom-Latitude-3570.39110: tcp 0
02:36:18.970676 IP vmi195435.contaboserver.net.8333 > tom-Latitude-3570.39110: tcp 0
02:36:19.408819 IP tom-Latitude-3570.42516 > 2.56.9.15.8333: tcp 24
02:36:19.409770 IP tom-Latitude-3570.42516 > 2.56.9.15.8333: tcp 73
02:36:19.511906 IP tom-Latitude-3570.42516 > 2.56.9.15.8333: tcp 73
02:36:19.528229 IP 2.56.9.15.8333 > tom-Latitude-3570.42516: tcp 0
02:36:19.528244 IP 2.56.9.15.8333 > tom-Latitude-3570.42516: tcp 0
02:36:19.546679 IP 2.56.9.15.8333 > tom-Latitude-3570.42516: tcp 24
02:36:19.546697 IP tom-Latitude-3570.42516 > 2.56.9.15.8333: tcp 0
02:36:19.546716 IP 2.56.9.15.8333 > tom-Latitude-3570.42516: tcp 289
02:36:19.546721 IP tom-Latitude-3570.42516 > 2.56.9.15.8333: tcp 0
02:36:19.547025 IP tom-Latitude-3570.42516 > 2.56.9.15.8333: tcp 24
02:36:19.548150 IP tom-Latitude-3570.42516 > 2.56.9.15.8333: tcp 217
02:36:19.550575 IP 2.56.9.15.8333 > tom-Latitude-3570.42516: tcp 0
02:36:19.580315 IP 2.56.9.15.8333 > tom-Latitude-3570.42516: tcp 0
02:36:19.583001 IP 2.56.9.15.8333 > tom-Latitude-3570.42516: tcp 0
02:36:19.703552 IP 2.56.9.15.8333 > tom-Latitude-3570.42516: tcp 24
02:36:19.704353 IP 2.56.9.15.8333 > tom-Latitude-3570.42516: tcp 223
02:36:19.704371 IP 2.56.9.15.8333 > tom-Latitude-3570.42516: tcp 24
02:36:19.704374 IP 2.56.9.15.8333 > tom-Latitude-3570.42516: tcp 224
02:36:19.704378 IP 2.56.9.15.8333 > tom-Latitude-3570.42516: tcp 24
02:36:19.704381 IP 2.56.9.15.8333 > tom-Latitude-3570.42516: tcp 223
02:36:19.704384 IP 2.56.9.15.8333 > tom-Latitude-3570.42516: tcp 24
02:36:19.704387 IP 2.56.9.15.8333 > tom-Latitude-3570.42516: tcp 339
02:36:19.704389 IP 2.56.9.15.8333 > tom-Latitude-3570.42516: tcp 24
02:36:19.704391 IP 2.56.9.15.8333 > tom-Latitude-3570.42516: tcp 406
02:36:19.704423 IP tom-Latitude-3570.42516 > 2.56.9.15.8333: tcp 0
02:36:19.704889 IP tom-Latitude-3570.49070 > c-185-45-236-223.customer.ggaweb.ch.8333: tcp 24
02:36:19.705794 IP tom-Latitude-3570.49070 > c-185-45-236-223.customer.ggaweb.ch.8333: tcp 37
02:36:19.752510 IP c-185-45-236-223.customer.ggaweb.ch.8333 > tom-Latitude-3570.49070: tcp 0
02:36:19.836979 IP 2.56.9.15.8333 > tom-Latitude-3570.42516: tcp 249
02:36:19.879905 IP tom-Latitude-3570.42516 > 2.56.9.15.8333: tcp 0
02:36:20.110286 IP ns3113832.ip-54-38-177.eu.8333 > tom-Latitude-3570.56714: tcp 24
02:36:20.110894 IP ns3113832.ip-54-38-177.eu.8333 > tom-Latitude-3570.56714: tcp 325
02:36:20.110957 IP tom-Latitude-3570.56714 > ns3113832.ip-54-38-177.eu.8333: tcp 0
02:36:20.111163 IP tom-Latitude-3570.56714 > ns3113832.ip-54-38-177.eu.8333: tcp 24
02:36:20.114978 IP tom-Latitude-3570.56714 > ns3113832.ip-54-38-177.eu.8333: tcp 37
02:36:20.141797 IP ns3113832.ip-54-38-177.eu.8333 > tom-Latitude-3570.56714: tcp 0
02:36:20.151356 IP static-87-75-105-186.vodafonexdsl.co.uk.8333 > tom-Latitude-3570.46284: tcp 24
02:36:20.151375 IP ns3113832.ip-54-38-177.eu.8333 > tom-Latitude-3570.56714: tcp 0
02:36:20.155063 IP static-87-75-105-186.vodafonexdsl.co.uk.8333 > tom-Latitude-3570.46284: tcp 253
02:36:20.155128 IP tom-Latitude-3570.46284 > static-87-75-105-186.vodafonexdsl.co.uk.8333: tcp 0
02:36:20.210397 IP ns3113832.ip-54-38-177.eu.8333 > tom-Latitude-3570.56714: tcp 24
02:36:20.211016 IP ns3113832.ip-54-38-177.eu.8333 > tom-Latitude-3570.56714: tcp 224
02:36:20.211081 IP tom-Latitude-3570.56714 > ns3113832.ip-54-38-177.eu.8333: tcp 0
02:36:20.311830 IP tom-Latitude-3570.49070 > c-185-45-236-223.customer.ggaweb.ch.8333: tcp 24
02:36:20.312816 IP tom-Latitude-3570.49070 > c-185-45-236-223.customer.ggaweb.ch.8333: tcp 217
02:36:20.360627 IP c-185-45-236-223.customer.ggaweb.ch.8333 > tom-Latitude-3570.49070: tcp 0
02:36:20.512644 IP tom-Latitude-3570.60988 > 81.198.101.144.8333: tcp 24
02:36:20.513646 IP tom-Latitude-3570.60988 > 81.198.101.144.8333: tcp 325
02:36:20.574625 IP 81.198.101.144.8333 > tom-Latitude-3570.60988: tcp 0
02:36:20.574639 IP 81.198.101.144.8333 > tom-Latitude-3570.60988: tcp 0
02:36:22.017725 IP tom-Latitude-3570.42516 > 2.56.9.15.8333: tcp 24
02:36:22.018713 IP tom-Latitude-3570.42516 > 2.56.9.15.8333: tcp 37
02:36:22.078527 IP 81.198.101.144.8333 > tom-Latitude-3570.60988: tcp 24
02:36:22.079135 IP 81.198.101.144.8333 > tom-Latitude-3570.60988: tcp 37
02:36:22.079152 IP 2.56.9.15.8333 > tom-Latitude-3570.42516: tcp 0
02:36:22.079197 IP tom-Latitude-3570.60988 > 81.198.101.144.8333: tcp 0
02:36:22.079391 IP tom-Latitude-3570.60988 > 81.198.101.144.8333: tcp 24
02:36:22.080559 IP tom-Latitude-3570.60988 > 81.198.101.144.8333: tcp 37
02:36:22.081946 IP 2.56.9.15.8333 > tom-Latitude-3570.42516: tcp 0
02:36:22.101767 IP 81.198.101.144.8333 > tom-Latitude-3570.60988: tcp 37
02:36:22.101786 IP tom-Latitude-3570.60988 > 81.198.101.144.8333: tcp 0
02:36:22.110490 IP 81.198.101.144.8333 > tom-Latitude-3570.60988: tcp 0
02:36:22.110505 IP 81.198.101.144.8333 > tom-Latitude-3570.60988: tcp 0
02:36:22.199476 IP 81.198.101.144.8333 > tom-Latitude-3570.60988: tcp 24
02:36:22.199493 IP tom-Latitude-3570.60988 > 81.198.101.144.8333: tcp 0
02:36:22.200116 IP 81.198.101.144.8333 > tom-Latitude-3570.60988: tcp 381
02:36:22.200141 IP tom-Latitude-3570.60988 > 81.198.101.144.8333: tcp 0
02:36:22.497053 IP ns3113832.ip-54-38-177.eu.8333 > tom-Latitude-3570.56714: tcp 24
02:36:22.497666 IP ns3113832.ip-54-38-177.eu.8333 > tom-Latitude-3570.56714: tcp 37
02:36:22.497730 IP tom-Latitude-3570.56714 > ns3113832.ip-54-38-177.eu.8333: tcp 0
02:36:22.698680 IP tom-Latitude-3570.46284 > static-87-75-105-186.vodafonexdsl.co.uk.8333: tcp 24
02:36:22.699636 IP tom-Latitude-3570.46284 > static-87-75-105-186.vodafonexdsl.co.uk.8333: tcp 37
02:36:22.740628 IP static-87-75-105-186.vodafonexdsl.co.uk.8333 > tom-Latitude-3570.46284: tcp 0
02:36:22.765015 IP 2.56.9.15.8333 > tom-Latitude-3570.42516: tcp 24
02:36:22.765036 IP tom-Latitude-3570.42516 > 2.56.9.15.8333: tcp 0
02:36:22.765051 IP 2.56.9.15.8333 > tom-Latitude-3570.42516: tcp 109
02:36:22.765055 IP tom-Latitude-3570.42516 > 2.56.9.15.8333: tcp 0
02:36:22.765291 IP tom-Latitude-3570.42516 > 2.56.9.15.8333: tcp 24
02:36:22.766576 IP tom-Latitude-3570.42516 > 2.56.9.15.8333: tcp 73
02:36:22.801053 IP 2.56.9.15.8333 > tom-Latitude-3570.42516: tcp 0
02:36:22.801561 IP 2.56.9.15.8333 > tom-Latitude-3570.42516: tcp 0
02:36:22.897116 IP 2.56.9.15.8333 > tom-Latitude-3570.42516: tcp 24
02:36:22.900949 IP 2.56.9.15.8333 > tom-Latitude-3570.42516: tcp 193
02:36:22.901013 IP tom-Latitude-3570.42516 > 2.56.9.15.8333: tcp 0
02:36:22.901411 IP 2.56.9.15.8333 > tom-Latitude-3570.42516: tcp 24
02:36:22.901430 IP 2.56.9.15.8333 > tom-Latitude-3570.42516: tcp 256
02:36:22.901479 IP tom-Latitude-3570.42516 > 2.56.9.15.8333: tcp 0
02:36:23.141484 IP bb42-60-217-183.singnet.com.sg.8333 > tom-Latitude-3570.60470: tcp 361
02:36:23.141503 IP tom-Latitude-3570.60470 > bb42-60-217-183.singnet.com.sg.8333: tcp 0
02:36:23.200955 IP bb42-60-217-183.singnet.com.sg.8333 > tom-Latitude-3570.60470: tcp 24
02:36:23.200981 IP tom-Latitude-3570.60470 > bb42-60-217-183.singnet.com.sg.8333: tcp 0
02:36:23.301614 IP tom-Latitude-3570.39110 > vmi195435.contaboserver.net.8333: tcp 24
02:36:23.302566 IP tom-Latitude-3570.39110 > vmi195435.contaboserver.net.8333: tcp 361
02:36:23.330398 IP vmi195435.contaboserver.net.8333 > tom-Latitude-3570.39110: tcp 0
02:36:23.340040 IP vmi195435.contaboserver.net.8333 > tom-Latitude-3570.39110: tcp 0
02:36:23.703017 IP tom-Latitude-3570.56714 > ns3113832.ip-54-38-177.eu.8333: tcp 24
02:36:23.703981 IP tom-Latitude-3570.56714 > ns3113832.ip-54-38-177.eu.8333: tcp 73
02:36:23.752506 IP ns3113832.ip-54-38-177.eu.8333 > tom-Latitude-3570.56714: tcp 0
02:36:23.760297 IP ns3113832.ip-54-38-177.eu.8333 > tom-Latitude-3570.56714: tcp 0
02:36:24.405415 IP tom-Latitude-3570.60988 > 81.198.101.144.8333: tcp 24
02:36:24.428787 IP tom-Latitude-3570.60988 > 81.198.101.144.8333: tcp 73
02:36:24.478427 IP 2.56.9.15.8333 > tom-Latitude-3570.42516: tcp 24
02:36:24.479816 IP 2.56.9.15.8333 > tom-Latitude-3570.42516: tcp 109
02:36:24.479833 IP 2.56.9.15.8333 > tom-Latitude-3570.42516: tcp 109
02:36:24.479843 IP tom-Latitude-3570.42516 > 2.56.9.15.8333: tcp 0
02:36:24.479873 IP 81.198.101.144.8333 > tom-Latitude-3570.60988: tcp 0
02:36:24.480088 IP tom-Latitude-3570.42516 > 2.56.9.15.8333: tcp 24
02:36:24.480143 IP tom-Latitude-3570.46284 > static-87-75-105-186.vodafonexdsl.co.uk.8333: tcp 24
02:36:24.481890 IP tom-Latitude-3570.46284 > static-87-75-105-186.vodafonexdsl.co.uk.8333: tcp 73
02:36:24.481901 IP tom-Latitude-3570.42516 > 2.56.9.15.8333: tcp 109
02:36:24.482935 IP 81.198.101.144.8333 > tom-Latitude-3570.60988: tcp 0
02:36:24.579906 IP tom-Latitude-3570.46284 > static-87-75-105-186.vodafonexdsl.co.uk.8333: tcp 73
02:36:24.595906 IP tom-Latitude-3570.42516 > 2.56.9.15.8333: tcp 109
02:36:24.782809 IP 2.56.9.15.8333 > tom-Latitude-3570.42516: tcp 0
02:36:24.782823 IP 2.56.9.15.8333 > tom-Latitude-3570.42516: tcp 0
02:36:24.782826 IP static-87-75-105-186.vodafonexdsl.co.uk.8333 > tom-Latitude-3570.46284: tcp 0
02:36:24.782829 IP ns3113832.ip-54-38-177.eu.8333 > tom-Latitude-3570.56714: tcp 24
02:36:24.782840 IP ns3113832.ip-54-38-177.eu.8333 > tom-Latitude-3570.56714: tcp 109
02:36:24.782843 IP static-87-75-105-186.vodafonexdsl.co.uk.8333 > tom-Latitude-3570.46284: tcp 0
02:36:24.782845 IP 2.56.9.15.8333 > tom-Latitude-3570.42516: tcp 24
02:36:24.782848 IP 2.56.9.15.8333 > tom-Latitude-3570.42516: tcp 225
02:36:24.782850 IP 2.56.9.15.8333 > tom-Latitude-3570.42516: tcp 24
02:36:24.782852 IP 2.56.9.15.8333 > tom-Latitude-3570.42516: tcp 226
02:36:24.782853 IP 2.56.9.15.8333 > tom-Latitude-3570.42516: tcp 24
02:36:24.782855 IP 2.56.9.15.8333 > tom-Latitude-3570.42516: tcp 223
02:36:24.782857 IP 2.56.9.15.8333 > tom-Latitude-3570.42516: tcp 0
02:36:24.782858 IP ns3113832.ip-54-38-177.eu.8333 > tom-Latitude-3570.56714: tcp 109
02:36:24.782886 IP tom-Latitude-3570.56714 > ns3113832.ip-54-38-177.eu.8333: tcp 0
02:36:24.782969 IP tom-Latitude-3570.42516 > 2.56.9.15.8333: tcp 0
02:36:24.884652 IP tom-Latitude-3570.39110 > vmi195435.contaboserver.net.8333: tcp 24
02:36:24.885610 IP tom-Latitude-3570.39110 > vmi195435.contaboserver.net.8333: tcp 109
02:36:24.967701 IP vmi195435.contaboserver.net.8333 > tom-Latitude-3570.39110: tcp 0
02:36:24.967716 IP vmi195435.contaboserver.net.8333 > tom-Latitude-3570.39110: tcp 0
02:36:25.185560 IP tom-Latitude-3570.57976 > 167.99.216.145.8333: tcp 24
02:36:25.186514 IP tom-Latitude-3570.57976 > 167.99.216.145.8333: tcp 469
02:36:25.233696 IP vmi195435.contaboserver.net.8333 > tom-Latitude-3570.39110: tcp 24
02:36:25.234332 IP vmi195435.contaboserver.net.8333 > tom-Latitude-3570.39110: tcp 37
02:36:25.234458 IP tom-Latitude-3570.39110 > vmi195435.contaboserver.net.8333: tcp 0
02:36:25.234586 IP tom-Latitude-3570.39110 > vmi195435.contaboserver.net.8333: tcp 24
02:36:25.235461 IP tom-Latitude-3570.39110 > vmi195435.contaboserver.net.8333: tcp 37
02:36:25.239832 IP 167.99.216.145.8333 > tom-Latitude-3570.57976: tcp 0
02:36:25.262196 IP 2.56.9.15.8333 > tom-Latitude-3570.42516: tcp 24
02:36:25.262810 IP 2.56.9.15.8333 > tom-Latitude-3570.42516: tcp 37
02:36:25.262926 IP tom-Latitude-3570.42516 > 2.56.9.15.8333: tcp 0
02:36:25.281404 IP vmi195435.contaboserver.net.8333 > tom-Latitude-3570.39110: tcp 0
02:36:25.281418 IP vmi195435.contaboserver.net.8333 > tom-Latitude-3570.39110: tcp 0
02:36:25.353252 IP vmi195435.contaboserver.net.8333 > tom-Latitude-3570.39110: tcp 24
02:36:25.353272 IP vmi195435.contaboserver.net.8333 > tom-Latitude-3570.39110: tcp 666
02:36:25.353360 IP tom-Latitude-3570.39110 > vmi195435.contaboserver.net.8333: tcp 0
02:36:25.521502 IP 167.99.216.145.8333 > tom-Latitude-3570.57976: tcp 24
02:36:25.521520 IP 167.99.216.145.8333 > tom-Latitude-3570.57976: tcp 37
02:36:25.521612 IP tom-Latitude-3570.57976 > 167.99.216.145.8333: tcp 0
02:36:26.023380 IP tom-Latitude-3570.60988 > 81.198.101.144.8333: tcp 24
02:36:26.024256 IP tom-Latitude-3570.60988 > 81.198.101.144.8333: tcp 145
02:36:26.072333 IP 81.198.101.144.8333 > tom-Latitude-3570.60988: tcp 0
02:36:26.080239 IP 81.198.101.144.8333 > tom-Latitude-3570.60988: tcp 0
02:36:27.126590 IP tom-Latitude-3570.49070 > c-185-45-236-223.customer.ggaweb.ch.8333: tcp 24
02:36:27.126632 IP tom-Latitude-3570.56714 > ns3113832.ip-54-38-177.eu.8333: tcp 24
02:36:27.127570 IP tom-Latitude-3570.56714 > ns3113832.ip-54-38-177.eu.8333: tcp 37
02:36:27.127581 IP tom-Latitude-3570.49070 > c-185-45-236-223.customer.ggaweb.ch.8333: tcp 253
02:36:27.184005 IP ns3113832.ip-54-38-177.eu.8333 > tom-Latitude-3570.56714: tcp 0
02:36:27.192104 IP ns3113832.ip-54-38-177.eu.8333 > tom-Latitude-3570.56714: tcp 0
02:36:27.192952 IP c-185-45-236-223.customer.ggaweb.ch.8333 > tom-Latitude-3570.49070: tcp 0
02:36:27.215337 IP 2.56.9.15.8333 > tom-Latitude-3570.42516: tcp 24
02:36:27.215935 IP 2.56.9.15.8333 > tom-Latitude-3570.42516: tcp 181
02:36:27.216067 IP tom-Latitude-3570.42516 > 2.56.9.15.8333: tcp 0
02:36:27.216256 IP tom-Latitude-3570.42516 > 2.56.9.15.8333: tcp 24
02:36:27.217633 IP tom-Latitude-3570.42516 > 2.56.9.15.8333: tcp 181
02:36:27.250388 IP 2.56.9.15.8333 > tom-Latitude-3570.42516: tcp 0
02:36:27.250977 IP 2.56.9.15.8333 > tom-Latitude-3570.42516: tcp 0
02:36:27.316411 IP 81.198.101.144.8333 > tom-Latitude-3570.60988: tcp 24
02:36:27.316458 IP tom-Latitude-3570.60988 > 81.198.101.144.8333: tcp 0
02:36:27.316604 IP tom-Latitude-3570.60470 > bb42-60-217-183.singnet.com.sg.8333: tcp 24
02:36:27.317030 IP 81.198.101.144.8333 > tom-Latitude-3570.60988: tcp 145
02:36:27.317053 IP tom-Latitude-3570.60988 > 81.198.101.144.8333: tcp 0
02:36:27.317412 IP tom-Latitude-3570.60470 > bb42-60-217-183.singnet.com.sg.8333: tcp 145
02:36:27.346145 IP 2.56.9.15.8333 > tom-Latitude-3570.42516: tcp 24
02:36:27.354116 IP 2.56.9.15.8333 > tom-Latitude-3570.42516: tcp 191
02:36:27.354172 IP tom-Latitude-3570.42516 > 2.56.9.15.8333: tcp 0
02:36:27.354819 IP 2.56.9.15.8333 > tom-Latitude-3570.42516: tcp 24
02:36:27.357026 IP 2.56.9.15.8333 > tom-Latitude-3570.42516: tcp 192
02:36:27.357103 IP tom-Latitude-3570.42516 > 2.56.9.15.8333: tcp 0
02:36:27.358132 IP 2.56.9.15.8333 > tom-Latitude-3570.42516: tcp 24
02:36:27.358151 IP 2.56.9.15.8333 > tom-Latitude-3570.42516: tcp 225
02:36:27.358153 IP 2.56.9.15.8333 > tom-Latitude-3570.42516: tcp 24
02:36:27.358156 IP 2.56.9.15.8333 > tom-Latitude-3570.42516: tcp 669
02:36:27.358157 IP 2.56.9.15.8333 > tom-Latitude-3570.42516: tcp 24
02:36:27.358159 IP 2.56.9.15.8333 > tom-Latitude-3570.42516: tcp 454
02:36:27.358162 IP bb42-60-217-183.singnet.com.sg.8333 > tom-Latitude-3570.60470: tcp 0
02:36:27.358185 IP bb42-60-217-183.singnet.com.sg.8333 > tom-Latitude-3570.60470: tcp 0
02:36:27.358252 IP tom-Latitude-3570.42516 > 2.56.9.15.8333: tcp 0
02:36:28.012262 IP tom-Latitude-3570.43758 > chello089173005015.chello.sk.8333: tcp 0
02:36:28.015490 IP ns3113832.ip-54-38-177.eu.8333 > tom-Latitude-3570.56714: tcp 24
02:36:28.015518 IP tom-Latitude-3570.56714 > ns3113832.ip-54-38-177.eu.8333: tcp 0
02:36:28.016136 IP ns3113832.ip-54-38-177.eu.8333 > tom-Latitude-3570.56714: tcp 181
02:36:28.016144 IP tom-Latitude-3570.56714 > ns3113832.ip-54-38-177.eu.8333: tcp 0
02:36:28.016149 IP bb42-60-217-183.singnet.com.sg.8333 > tom-Latitude-3570.60470: tcp 24
02:36:28.016169 IP tom-Latitude-3570.60470 > bb42-60-217-183.singnet.com.sg.8333: tcp 0
02:36:28.016172 IP bb42-60-217-183.singnet.com.sg.8333 > tom-Latitude-3570.60470: tcp 145
02:36:28.016175 IP tom-Latitude-3570.60470 > bb42-60-217-183.singnet.com.sg.8333: tcp 0
02:36:28.016177 IP bb42-60-217-183.singnet.com.sg.8333 > tom-Latitude-3570.60470: tcp 145
02:36:28.016192 IP tom-Latitude-3570.60470 > bb42-60-217-183.singnet.com.sg.8333: tcp 0
02:36:28.083648 IP chello089173005015.chello.sk.8333 > tom-Latitude-3570.43758: tcp 0
02:36:28.660800 IP vmi195435.contaboserver.net.8333 > tom-Latitude-3570.39110: tcp 24
02:36:28.661465 IP vmi195435.contaboserver.net.8333 > tom-Latitude-3570.39110: tcp 37
02:36:28.661482 IP vmi195435.contaboserver.net.8333 > tom-Latitude-3570.39110: tcp 24
02:36:28.661485 IP vmi195435.contaboserver.net.8333 > tom-Latitude-3570.39110: tcp 37
02:36:28.661594 IP tom-Latitude-3570.39110 > vmi195435.contaboserver.net.8333: tcp 0
02:36:28.661739 IP tom-Latitude-3570.39110 > vmi195435.contaboserver.net.8333: tcp 24
02:36:28.663163 IP tom-Latitude-3570.39110 > vmi195435.contaboserver.net.8333: tcp 98
02:36:28.668501 IP vmi195435.contaboserver.net.8333 > tom-Latitude-3570.39110: tcp 37
02:36:28.668521 IP tom-Latitude-3570.39110 > vmi195435.contaboserver.net.8333: tcp 0
02:36:28.676692 IP tom-Latitude-3570.53856 > 176.221.19.160.8333: tcp 0
02:36:28.688938 IP vmi195435.contaboserver.net.8333 > tom-Latitude-3570.39110: tcp 0
02:36:28.689552 IP vmi195435.contaboserver.net.8333 > tom-Latitude-3570.39110: tcp 0
02:36:28.712371 IP 176.221.19.160.8333 > tom-Latitude-3570.53856: tcp 0
02:36:28.712402 IP tom-Latitude-3570.53856 > 176.221.19.160.8333: tcp 0
02:36:28.712751 IP tom-Latitude-3570.53856 > 176.221.19.160.8333: tcp 24
02:36:28.714063 IP tom-Latitude-3570.53856 > 176.221.19.160.8333: tcp 102
02:36:28.791487 IP 176.221.19.160.8333 > tom-Latitude-3570.53856: tcp 0
02:36:29.163571 IP tom-Latitude-3570.49070 > c-185-45-236-223.customer.ggaweb.ch.8333: tcp 24
02:36:29.164400 IP tom-Latitude-3570.49070 > c-185-45-236-223.customer.ggaweb.ch.8333: tcp 181
02:36:29.221018 IP c-185-45-236-223.customer.ggaweb.ch.8333 > tom-Latitude-3570.49070: tcp 0
02:36:29.364136 IP tom-Latitude-3570.39110 > vmi195435.contaboserver.net.8333: tcp 24
02:36:29.365102 IP tom-Latitude-3570.39110 > vmi195435.contaboserver.net.8333: tcp 181
02:36:29.392550 IP ns3113832.ip-54-38-177.eu.8333 > tom-Latitude-3570.56714: tcp 24
02:36:29.392568 IP tom-Latitude-3570.56714 > ns3113832.ip-54-38-177.eu.8333: tcp 0
02:36:29.393171 IP ns3113832.ip-54-38-177.eu.8333 > tom-Latitude-3570.56714: tcp 181
02:36:29.393195 IP tom-Latitude-3570.56714 > ns3113832.ip-54-38-177.eu.8333: tcp 0
02:36:29.393224 IP vmi195435.contaboserver.net.8333 > tom-Latitude-3570.39110: tcp 0
02:36:29.393515 IP tom-Latitude-3570.56714 > ns3113832.ip-54-38-177.eu.8333: tcp 24
02:36:29.394399 IP tom-Latitude-3570.56714 > ns3113832.ip-54-38-177.eu.8333: tcp 181
02:36:29.399096 IP vmi195435.contaboserver.net.8333 > tom-Latitude-3570.39110: tcp 0
02:36:29.423158 IP bb42-60-217-183.singnet.com.sg.8333 > tom-Latitude-3570.60470: tcp 24
02:36:29.423175 IP tom-Latitude-3570.60470 > bb42-60-217-183.singnet.com.sg.8333: tcp 0
02:36:29.425893 IP bb42-60-217-183.singnet.com.sg.8333 > tom-Latitude-3570.60470: tcp 217
02:36:29.425917 IP tom-Latitude-3570.60470 > bb42-60-217-183.singnet.com.sg.8333: tcp 0
02:36:29.429238 IP ns3113832.ip-54-38-177.eu.8333 > tom-Latitude-3570.56714: tcp 0
02:36:29.429906 IP ns3113832.ip-54-38-177.eu.8333 > tom-Latitude-3570.56714: tcp 0
02:36:29.526364 IP tom-Latitude-3570.60988 > 81.198.101.144.8333: tcp 24
02:36:29.533095 IP ns3113832.ip-54-38-177.eu.8333 > tom-Latitude-3570.56714: tcp 24
02:36:29.533102 IP ns3113832.ip-54-38-177.eu.8333 > tom-Latitude-3570.56714: tcp 247
02:36:29.533105 IP ns3113832.ip-54-38-177.eu.8333 > tom-Latitude-3570.56714: tcp 24
02:36:29.533107 IP ns3113832.ip-54-38-177.eu.8333 > tom-Latitude-3570.56714: tcp 223
02:36:29.533108 IP ns3113832.ip-54-38-177.eu.8333 > tom-Latitude-3570.56714: tcp 24
02:36:29.533110 IP ns3113832.ip-54-38-177.eu.8333 > tom-Latitude-3570.56714: tcp 224
02:36:29.533111 IP ns3113832.ip-54-38-177.eu.8333 > tom-Latitude-3570.56714: tcp 24
02:36:29.533113 IP tom-Latitude-3570.56714 > ns3113832.ip-54-38-177.eu.8333: tcp 0
02:36:29.533113 IP ns3113832.ip-54-38-177.eu.8333 > tom-Latitude-3570.56714: tcp 259
02:36:29.533115 IP ns3113832.ip-54-38-177.eu.8333 > tom-Latitude-3570.56714: tcp 24
02:36:29.533117 IP ns3113832.ip-54-38-177.eu.8333 > tom-Latitude-3570.56714: tcp 191
02:36:29.533153 IP tom-Latitude-3570.56714 > ns3113832.ip-54-38-177.eu.8333: tcp 0
02:36:29.533958 IP tom-Latitude-3570.60988 > 81.198.101.144.8333: tcp 37
02:36:29.569342 IP 81.198.101.144.8333 > tom-Latitude-3570.60988: tcp 0
02:36:29.569959 IP 81.198.101.144.8333 > tom-Latitude-3570.60988: tcp 0
02:36:29.667669 IP vmi195435.contaboserver.net.8333 > tom-Latitude-3570.39110: tcp 24
02:36:29.667699 IP tom-Latitude-3570.39110 > vmi195435.contaboserver.net.8333: tcp 0
02:36:29.668285 IP vmi195435.contaboserver.net.8333 > tom-Latitude-3570.39110: tcp 181
02:36:29.668310 IP tom-Latitude-3570.39110 > vmi195435.contaboserver.net.8333: tcp 0
02:36:30.270576 IP tom-Latitude-3570.60988 > 81.198.101.144.8333: tcp 24
02:36:30.271398 IP tom-Latitude-3570.60988 > 81.198.101.144.8333: tcp 181
02:36:30.318733 IP c-185-45-236-223.customer.ggaweb.ch.8333 > tom-Latitude-3570.49070: tcp 24
02:36:30.319417 IP c-185-45-236-223.customer.ggaweb.ch.8333 > tom-Latitude-3570.49070: tcp 253
02:36:30.319482 IP tom-Latitude-3570.49070 > c-185-45-236-223.customer.ggaweb.ch.8333: tcp 0
02:36:30.319736 IP tom-Latitude-3570.49070 > c-185-45-236-223.customer.ggaweb.ch.8333: tcp 24
02:36:30.320968 IP tom-Latitude-3570.49070 > c-185-45-236-223.customer.ggaweb.ch.8333: tcp 73
02:36:30.322365 IP 81.198.101.144.8333 > tom-Latitude-3570.60988: tcp 0
02:36:30.329067 IP 81.198.101.144.8333 > tom-Latitude-3570.60988: tcp 0
02:36:30.348685 IP c-185-45-236-223.customer.ggaweb.ch.8333 > tom-Latitude-3570.49070: tcp 0
02:36:30.433321 IP c-185-45-236-223.customer.ggaweb.ch.8333 > tom-Latitude-3570.49070: tcp 24
02:36:30.434003 IP c-185-45-236-223.customer.ggaweb.ch.8333 > tom-Latitude-3570.49070: tcp 404
02:36:30.434067 IP tom-Latitude-3570.49070 > c-185-45-236-223.customer.ggaweb.ch.8333: tcp 0
02:36:30.531609 IP chello089173005015.chello.sk.8333 > tom-Latitude-3570.43758: tcp 0
02:36:31.036750 IP tom-Latitude-3570.60988 > 81.198.101.144.8333: tcp 24
02:36:31.037583 IP tom-Latitude-3570.60988 > 81.198.101.144.8333: tcp 73
02:36:31.147905 IP tom-Latitude-3570.60988 > 81.198.101.144.8333: tcp 73
02:36:31.300078 IP 81.198.101.144.8333 > tom-Latitude-3570.60988: tcp 0
02:36:31.300092 IP 81.198.101.144.8333 > tom-Latitude-3570.60988: tcp 0
02:36:31.300095 IP 81.198.101.144.8333 > tom-Latitude-3570.60988: tcp 0
02:36:31.897062 IP 81.198.101.144.8333 > tom-Latitude-3570.60988: tcp 24
02:36:31.897087 IP tom-Latitude-3570.60988 > 81.198.101.144.8333: tcp 0
02:36:31.897105 IP 81.198.101.144.8333 > tom-Latitude-3570.60988: tcp 37
02:36:31.897108 IP tom-Latitude-3570.60988 > 81.198.101.144.8333: tcp 0
02:36:31.897237 IP tom-Latitude-3570.60988 > 81.198.101.144.8333: tcp 24
02:36:31.903027 IP tom-Latitude-3570.60988 > 81.198.101.144.8333: tcp 37
02:36:31.946580 IP 81.198.101.144.8333 > tom-Latitude-3570.60988: tcp 0
02:36:31.947192 IP 81.198.101.144.8333 > tom-Latitude-3570.60988: tcp 0
02:36:32.037502 IP 81.198.101.144.8333 > tom-Latitude-3570.60988: tcp 24
02:36:32.037522 IP 81.198.101.144.8333 > tom-Latitude-3570.60988: tcp 225
02:36:32.037569 IP tom-Latitude-3570.60988 > 81.198.101.144.8333: tcp 0
02:36:32.508356 IP ns3113832.ip-54-38-177.eu.8333 > tom-Latitude-3570.56714: tcp 24
02:36:32.512430 IP ns3113832.ip-54-38-177.eu.8333 > tom-Latitude-3570.56714: tcp 145
02:36:32.512495 IP tom-Latitude-3570.56714 > ns3113832.ip-54-38-177.eu.8333: tcp 0
02:36:32.512641 IP tom-Latitude-3570.56714 > ns3113832.ip-54-38-177.eu.8333: tcp 24
02:36:32.516035 IP tom-Latitude-3570.56714 > ns3113832.ip-54-38-177.eu.8333: tcp 37
02:36:32.536745 IP ns3113832.ip-54-38-177.eu.8333 > tom-Latitude-3570.56714: tcp 145
02:36:32.536763 IP tom-Latitude-3570.56714 > ns3113832.ip-54-38-177.eu.8333: tcp 0
02:36:32.546269 IP ns3113832.ip-54-38-177.eu.8333 > tom-Latitude-3570.56714: tcp 0
02:36:32.549060 IP ns3113832.ip-54-38-177.eu.8333 > tom-Latitude-3570.56714: tcp 0
02:36:32.615238 IP ns3113832.ip-54-38-177.eu.8333 > tom-Latitude-3570.56714: tcp 24
02:36:32.615257 IP tom-Latitude-3570.56714 > ns3113832.ip-54-38-177.eu.8333: tcp 0
02:36:32.616437 IP ns3113832.ip-54-38-177.eu.8333 > tom-Latitude-3570.56714: tcp 1350
02:36:32.616463 IP tom-Latitude-3570.56714 > ns3113832.ip-54-38-177.eu.8333: tcp 0
02:36:32.616484 IP ns3113832.ip-54-38-177.eu.8333 > tom-Latitude-3570.56714: tcp 1350
02:36:32.616488 IP tom-Latitude-3570.56714 > ns3113832.ip-54-38-177.eu.8333: tcp 0
02:36:32.616511 IP ns3113832.ip-54-38-177.eu.8333 > tom-Latitude-3570.56714: tcp 1350
02:36:32.616514 IP tom-Latitude-3570.56714 > ns3113832.ip-54-38-177.eu.8333: tcp 0
02:36:32.620417 IP ns3113832.ip-54-38-177.eu.8333 > tom-Latitude-3570.56714: tcp 1350
02:36:32.620434 IP tom-Latitude-3570.56714 > ns3113832.ip-54-38-177.eu.8333: tcp 0
02:36:32.620452 IP ns3113832.ip-54-38-177.eu.8333 > tom-Latitude-3570.56714: tcp 1350
02:36:32.620456 IP tom-Latitude-3570.56714 > ns3113832.ip-54-38-177.eu.8333: tcp 0
02:36:32.620462 IP ns3113832.ip-54-38-177.eu.8333 > tom-Latitude-3570.56714: tcp 1350
02:36:32.620465 IP tom-Latitude-3570.56714 > ns3113832.ip-54-38-177.eu.8333: tcp 0
02:36:32.620469 IP ns3113832.ip-54-38-177.eu.8333 > tom-Latitude-3570.56714: tcp 1350
02:36:32.620471 IP tom-Latitude-3570.56714 > ns3113832.ip-54-38-177.eu.8333: tcp 0
02:36:32.620475 IP ns3113832.ip-54-38-177.eu.8333 > tom-Latitude-3570.56714: tcp 1350
02:36:32.620478 IP tom-Latitude-3570.56714 > ns3113832.ip-54-38-177.eu.8333: tcp 0
02:36:32.620481 IP ns3113832.ip-54-38-177.eu.8333 > tom-Latitude-3570.56714: tcp 1350
02:36:32.620484 IP tom-Latitude-3570.56714 > ns3113832.ip-54-38-177.eu.8333: tcp 0
02:36:32.666823 IP ns3113832.ip-54-38-177.eu.8333 > tom-Latitude-3570.56714: tcp 1350
02:36:32.666841 IP tom-Latitude-3570.56714 > ns3113832.ip-54-38-177.eu.8333: tcp 0
02:36:32.670027 IP ns3113832.ip-54-38-177.eu.8333 > tom-Latitude-3570.56714: tcp 1350
02:36:32.670044 IP tom-Latitude-3570.56714 > ns3113832.ip-54-38-177.eu.8333: tcp 0
02:36:32.672681 IP ns3113832.ip-54-38-177.eu.8333 > tom-Latitude-3570.56714: tcp 1350
02:36:32.672698 IP tom-Latitude-3570.56714 > ns3113832.ip-54-38-177.eu.8333: tcp 0
02:36:32.672715 IP ns3113832.ip-54-38-177.eu.8333 > tom-Latitude-3570.56714: tcp 1350
02:36:32.672718 IP tom-Latitude-3570.56714 > ns3113832.ip-54-38-177.eu.8333: tcp 0
02:36:32.672725 IP ns3113832.ip-54-38-177.eu.8333 > tom-Latitude-3570.56714: tcp 1350
02:36:32.672727 IP tom-Latitude-3570.56714 > ns3113832.ip-54-38-177.eu.8333: tcp 0
02:36:32.672731 IP ns3113832.ip-54-38-177.eu.8333 > tom-Latitude-3570.56714: tcp 1350
02:36:32.672740 IP ns3113832.ip-54-38-177.eu.8333 > tom-Latitude-3570.56714: tcp 1350
02:36:32.672742 IP ns3113832.ip-54-38-177.eu.8333 > tom-Latitude-3570.56714: tcp 1350
02:36:32.672745 IP ns3113832.ip-54-38-177.eu.8333 > tom-Latitude-3570.56714: tcp 1350
02:36:32.672749 IP ns3113832.ip-54-38-177.eu.8333 > tom-Latitude-3570.56714: tcp 1350
02:36:32.672770 IP ns3113832.ip-54-38-177.eu.8333 > tom-Latitude-3570.56714: tcp 1350
02:36:32.672774 IP ns3113832.ip-54-38-177.eu.8333 > tom-Latitude-3570.56714: tcp 1350
02:36:32.672781 IP ns3113832.ip-54-38-177.eu.8333 > tom-Latitude-3570.56714: tcp 1350
02:36:32.672783 IP tom-Latitude-3570.56714 > ns3113832.ip-54-38-177.eu.8333: tcp 0
02:36:32.672865 IP tom-Latitude-3570.56714 > ns3113832.ip-54-38-177.eu.8333: tcp 0
02:36:32.673005 IP ns3113832.ip-54-38-177.eu.8333 > tom-Latitude-3570.56714: tcp 1350
02:36:32.673015 IP ns3113832.ip-54-38-177.eu.8333 > tom-Latitude-3570.56714: tcp 1350
02:36:32.673019 IP ns3113832.ip-54-38-177.eu.8333 > tom-Latitude-3570.56714: tcp 1350
02:36:32.673034 IP tom-Latitude-3570.56714 > ns3113832.ip-54-38-177.eu.8333: tcp 0
02:36:32.712739 IP ns3113832.ip-54-38-177.eu.8333 > tom-Latitude-3570.56714: tcp 1382
02:36:32.713259 IP tom-Latitude-3570.60470 > bb42-60-217-183.singnet.com.sg.8333: tcp 24
02:36:32.713284 IP ns3113832.ip-54-38-177.eu.8333 > tom-Latitude-3570.56714: tcp 1382
02:36:32.713340 IP tom-Latitude-3570.56714 > ns3113832.ip-54-38-177.eu.8333: tcp 0
02:36:32.714157 IP tom-Latitude-3570.60470 > bb42-60-217-183.singnet.com.sg.8333: tcp 109
02:36:32.729052 IP ns3113832.ip-54-38-177.eu.8333 > tom-Latitude-3570.56714: tcp 1382
02:36:32.730900 IP ns3113832.ip-54-38-177.eu.8333 > tom-Latitude-3570.56714: tcp 1254
02:36:32.730919 IP ns3113832.ip-54-38-177.eu.8333 > tom-Latitude-3570.56714: tcp 1350
02:36:32.730923 IP ns3113832.ip-54-38-177.eu.8333 > tom-Latitude-3570.56714: tcp 1350
