01:56:41.749296 IP 2.56.9.15.8333 > tom-Latitude-3570.42516: tcp 24
01:56:41.749321 IP tom-Latitude-3570.42516 > 2.56.9.15.8333: tcp 0
01:56:41.749339 IP 2.56.9.15.8333 > tom-Latitude-3570.42516: tcp 325
01:56:41.749343 IP tom-Latitude-3570.42516 > 2.56.9.15.8333: tcp 0
01:56:41.749347 IP static-87-75-105-186.vodafonexdsl.co.uk.8333 > tom-Latitude-3570.46284: tcp 24
01:56:41.749350 IP tom-Latitude-3570.46284 > static-87-75-105-186.vodafonexdsl.co.uk.8333: tcp 0
01:56:41.749354 IP static-87-75-105-186.vodafonexdsl.co.uk.8333 > tom-Latitude-3570.46284: tcp 325
01:56:41.749356 IP tom-Latitude-3570.46284 > static-87-75-105-186.vodafonexdsl.co.uk.8333: tcp 0
01:56:41.749359 IP 2.56.9.15.8333 > tom-Latitude-3570.42516: tcp 325
01:56:41.749362 IP tom-Latitude-3570.42516 > 2.56.9.15.8333: tcp 0
01:56:41.749365 IP static-87-75-105-186.vodafonexdsl.co.uk.8333 > tom-Latitude-3570.46284: tcp 325
01:56:41.749367 IP tom-Latitude-3570.46284 > static-87-75-105-186.vodafonexdsl.co.uk.8333: tcp 0
01:56:41.749646 IP tom-Latitude-3570.42516 > 2.56.9.15.8333: tcp 24
01:56:41.750696 IP tom-Latitude-3570.42516 > 2.56.9.15.8333: tcp 325
01:56:41.786466 IP 2.56.9.15.8333 > tom-Latitude-3570.42516: tcp 0
01:56:41.950322 IP tom-Latitude-3570.49070 > c-185-45-236-223.customer.ggaweb.ch.8333: tcp 24
01:56:41.951565 IP tom-Latitude-3570.49070 > c-185-45-236-223.customer.ggaweb.ch.8333: tcp 73
01:56:41.952470 IP 2.56.9.15.8333 > tom-Latitude-3570.42516: tcp 24
01:56:41.952490 IP 2.56.9.15.8333 > tom-Latitude-3570.42516: tcp 371
01:56:41.952495 IP 2.56.9.15.8333 > tom-Latitude-3570.42516: tcp 24
01:56:41.952498 IP 2.56.9.15.8333 > tom-Latitude-3570.42516: tcp 332
01:56:41.952500 IP 2.56.9.15.8333 > tom-Latitude-3570.42516: tcp 24
01:56:41.952502 IP 2.56.9.15.8333 > tom-Latitude-3570.42516: tcp 225
01:56:41.952504 IP 2.56.9.15.8333 > tom-Latitude-3570.42516: tcp 24
01:56:41.952506 IP 2.56.9.15.8333 > tom-Latitude-3570.42516: tcp 434
01:56:41.952508 IP 2.56.9.15.8333 > tom-Latitude-3570.42516: tcp 24
01:56:41.952510 IP 2.56.9.15.8333 > tom-Latitude-3570.42516: tcp 373
01:56:41.952536 IP tom-Latitude-3570.42516 > 2.56.9.15.8333: tcp 0
01:56:41.991787 IP 2.56.9.15.8333 > tom-Latitude-3570.42516: tcp 1028
01:56:41.991812 IP c-185-45-236-223.customer.ggaweb.ch.8333 > tom-Latitude-3570.49070: tcp 0
01:56:41.991819 IP c-185-45-236-223.customer.ggaweb.ch.8333 > tom-Latitude-3570.49070: tcp 0
01:56:42.035905 IP tom-Latitude-3570.42516 > 2.56.9.15.8333: tcp 0
01:56:42.193499 IP tom-Latitude-3570.49070 > c-185-45-236-223.customer.ggaweb.ch.8333: tcp 24
01:56:42.196695 IP tom-Latitude-3570.49070 > c-185-45-236-223.customer.ggaweb.ch.8333: tcp 325
01:56:42.227721 IP c-185-45-236-223.customer.ggaweb.ch.8333 > tom-Latitude-3570.49070: tcp 0
01:56:42.234650 IP c-185-45-236-223.customer.ggaweb.ch.8333 > tom-Latitude-3570.49070: tcp 0
01:56:42.293923 IP tom-Latitude-3570.60988 > 81.198.101.144.8333: tcp 24
01:56:42.298850 IP tom-Latitude-3570.60988 > 81.198.101.144.8333: tcp 325
01:56:42.327280 IP 81.198.101.144.8333 > tom-Latitude-3570.60988: tcp 0
01:56:42.335290 IP 81.198.101.144.8333 > tom-Latitude-3570.60988: tcp 0
01:56:42.394400 IP tom-Latitude-3570.56714 > ns3113832.ip-54-38-177.eu.8333: tcp 24
01:56:42.401458 IP tom-Latitude-3570.56714 > ns3113832.ip-54-38-177.eu.8333: tcp 649
01:56:42.428716 IP ns3113832.ip-54-38-177.eu.8333 > tom-Latitude-3570.56714: tcp 0
01:56:42.443746 IP ns3113832.ip-54-38-177.eu.8333 > tom-Latitude-3570.56714: tcp 0
01:56:43.182658 IP ns3113832.ip-54-38-177.eu.8333 > tom-Latitude-3570.56714: tcp 24
01:56:43.182679 IP ns3113832.ip-54-38-177.eu.8333 > tom-Latitude-3570.56714: tcp 145
01:56:43.182724 IP tom-Latitude-3570.56714 > ns3113832.ip-54-38-177.eu.8333: tcp 0
01:56:43.182955 IP tom-Latitude-3570.56714 > ns3113832.ip-54-38-177.eu.8333: tcp 24
01:56:43.184804 IP tom-Latitude-3570.56714 > ns3113832.ip-54-38-177.eu.8333: tcp 145
01:56:43.195648 IP ns3113832.ip-54-38-177.eu.8333 > tom-Latitude-3570.56714: tcp 145
01:56:43.195668 IP tom-Latitude-3570.56714 > ns3113832.ip-54-38-177.eu.8333: tcp 0
01:56:43.208598 IP ns3113832.ip-54-38-177.eu.8333 > tom-Latitude-3570.56714: tcp 0
01:56:43.220460 IP ns3113832.ip-54-38-177.eu.8333 > tom-Latitude-3570.56714: tcp 0
01:56:43.272785 IP ns3113832.ip-54-38-177.eu.8333 > tom-Latitude-3570.56714: tcp 24
01:56:43.272803 IP tom-Latitude-3570.56714 > ns3113832.ip-54-38-177.eu.8333: tcp 0
01:56:43.273585 IP ns3113832.ip-54-38-177.eu.8333 > tom-Latitude-3570.56714: tcp 247
01:56:43.273610 IP tom-Latitude-3570.56714 > ns3113832.ip-54-38-177.eu.8333: tcp 0
01:56:43.273626 IP ns3113832.ip-54-38-177.eu.8333 > tom-Latitude-3570.56714: tcp 24
01:56:43.273628 IP tom-Latitude-3570.56714 > ns3113832.ip-54-38-177.eu.8333: tcp 0
01:56:43.273632 IP ns3113832.ip-54-38-177.eu.8333 > tom-Latitude-3570.56714: tcp 246
01:56:43.273635 IP tom-Latitude-3570.56714 > ns3113832.ip-54-38-177.eu.8333: tcp 0
01:56:43.273638 IP ns3113832.ip-54-38-177.eu.8333 > tom-Latitude-3570.56714: tcp 24
01:56:43.273639 IP tom-Latitude-3570.56714 > ns3113832.ip-54-38-177.eu.8333: tcp 0
01:56:43.273643 IP ns3113832.ip-54-38-177.eu.8333 > tom-Latitude-3570.56714: tcp 226
01:56:43.273645 IP ns3113832.ip-54-38-177.eu.8333 > tom-Latitude-3570.56714: tcp 24
01:56:43.273647 IP ns3113832.ip-54-38-177.eu.8333 > tom-Latitude-3570.56714: tcp 226
01:56:43.273648 IP tom-Latitude-3570.56714 > ns3113832.ip-54-38-177.eu.8333: tcp 0
01:56:43.273655 IP tom-Latitude-3570.56714 > ns3113832.ip-54-38-177.eu.8333: tcp 0
01:56:43.273659 IP tom-Latitude-3570.56714 > ns3113832.ip-54-38-177.eu.8333: tcp 0
01:56:43.273880 IP tom-Latitude-3570.39110 > vmi195435.contaboserver.net.8333: tcp 24
01:56:43.274829 IP tom-Latitude-3570.39110 > vmi195435.contaboserver.net.8333: tcp 325
01:56:43.306530 IP vmi195435.contaboserver.net.8333 > tom-Latitude-3570.39110: tcp 0
01:56:43.576032 IP tom-Latitude-3570.39110 > vmi195435.contaboserver.net.8333: tcp 24
01:56:43.579459 IP tom-Latitude-3570.39110 > vmi195435.contaboserver.net.8333: tcp 145
01:56:43.580056 IP 167.99.216.145.8333 > tom-Latitude-3570.57976: tcp 24
01:56:43.580075 IP 167.99.216.145.8333 > tom-Latitude-3570.57976: tcp 541
01:56:43.580122 IP tom-Latitude-3570.57976 > 167.99.216.145.8333: tcp 0
01:56:43.580417 IP tom-Latitude-3570.57976 > 167.99.216.145.8333: tcp 24
01:56:43.581631 IP 167.99.216.145.8333 > tom-Latitude-3570.57976: tcp 541
01:56:43.581651 IP tom-Latitude-3570.57976 > 167.99.216.145.8333: tcp 73
01:56:43.624577 IP vmi195435.contaboserver.net.8333 > tom-Latitude-3570.39110: tcp 0
01:56:43.629148 IP 167.99.216.145.8333 > tom-Latitude-3570.57976: tcp 0
01:56:43.629162 IP 167.99.216.145.8333 > tom-Latitude-3570.57976: tcp 0
01:56:43.687702 IP 167.99.216.145.8333 > tom-Latitude-3570.57976: tcp 24
01:56:43.688375 IP 167.99.216.145.8333 > tom-Latitude-3570.57976: tcp 404
01:56:43.688393 IP 167.99.216.145.8333 > tom-Latitude-3570.57976: tcp 24
01:56:43.688397 IP 167.99.216.145.8333 > tom-Latitude-3570.57976: tcp 189
01:56:43.688461 IP tom-Latitude-3570.57976 > 167.99.216.145.8333: tcp 0
01:56:44.001858 IP 2.56.9.15.8333 > tom-Latitude-3570.42516: tcp 24
01:56:44.001875 IP tom-Latitude-3570.42516 > 2.56.9.15.8333: tcp 0
01:56:44.001895 IP 2.56.9.15.8333 > tom-Latitude-3570.42516: tcp 181
01:56:44.001901 IP tom-Latitude-3570.42516 > 2.56.9.15.8333: tcp 0
01:56:44.303316 IP tom-Latitude-3570.46284 > static-87-75-105-186.vodafonexdsl.co.uk.8333: tcp 24
01:56:44.306593 IP tom-Latitude-3570.46284 > static-87-75-105-186.vodafonexdsl.co.uk.8333: tcp 217
01:56:44.358762 IP static-87-75-105-186.vodafonexdsl.co.uk.8333 > tom-Latitude-3570.46284: tcp 0
01:56:44.365144 IP static-87-75-105-186.vodafonexdsl.co.uk.8333 > tom-Latitude-3570.46284: tcp 0
01:56:44.397372 IP ns3113832.ip-54-38-177.eu.8333 > tom-Latitude-3570.56714: tcp 24
01:56:44.397398 IP tom-Latitude-3570.56714 > ns3113832.ip-54-38-177.eu.8333: tcp 0
01:56:44.398053 IP ns3113832.ip-54-38-177.eu.8333 > tom-Latitude-3570.56714: tcp 181
01:56:44.398079 IP tom-Latitude-3570.56714 > ns3113832.ip-54-38-177.eu.8333: tcp 0
01:56:44.398320 IP tom-Latitude-3570.56714 > ns3113832.ip-54-38-177.eu.8333: tcp 24
01:56:44.399247 IP tom-Latitude-3570.56714 > ns3113832.ip-54-38-177.eu.8333: tcp 109
01:56:44.436366 IP ns3113832.ip-54-38-177.eu.8333 > tom-Latitude-3570.56714: tcp 0
01:56:44.437027 IP ns3113832.ip-54-38-177.eu.8333 > tom-Latitude-3570.56714: tcp 0
01:56:44.502411 IP ns3113832.ip-54-38-177.eu.8333 > tom-Latitude-3570.56714: tcp 24
01:56:44.503158 IP ns3113832.ip-54-38-177.eu.8333 > tom-Latitude-3570.56714: tcp 248
01:56:44.503176 IP ns3113832.ip-54-38-177.eu.8333 > tom-Latitude-3570.56714: tcp 24
01:56:44.503180 IP ns3113832.ip-54-38-177.eu.8333 > tom-Latitude-3570.56714: tcp 224
01:56:44.503183 IP ns3113832.ip-54-38-177.eu.8333 > tom-Latitude-3570.56714: tcp 24
01:56:44.503185 IP ns3113832.ip-54-38-177.eu.8333 > tom-Latitude-3570.56714: tcp 247
01:56:44.503222 IP tom-Latitude-3570.56714 > ns3113832.ip-54-38-177.eu.8333: tcp 0
01:56:44.821128 IP vmi195435.contaboserver.net.8333 > tom-Latitude-3570.39110: tcp 24
01:56:44.821149 IP vmi195435.contaboserver.net.8333 > tom-Latitude-3570.39110: tcp 253
01:56:44.821153 IP vmi195435.contaboserver.net.8333 > tom-Latitude-3570.39110: tcp 253
01:56:44.821165 IP tom-Latitude-3570.39110 > vmi195435.contaboserver.net.8333: tcp 0
01:56:44.821393 IP tom-Latitude-3570.39110 > vmi195435.contaboserver.net.8333: tcp 24
01:56:44.822530 IP tom-Latitude-3570.39110 > vmi195435.contaboserver.net.8333: tcp 73
01:56:44.873090 IP vmi195435.contaboserver.net.8333 > tom-Latitude-3570.39110: tcp 0
01:56:44.921685 IP tom-Latitude-3570.42516 > 2.56.9.15.8333: tcp 24
01:56:44.961984 IP c-185-45-236-223.customer.ggaweb.ch.8333 > tom-Latitude-3570.49070: tcp 24
01:56:44.962010 IP tom-Latitude-3570.49070 > c-185-45-236-223.customer.ggaweb.ch.8333: tcp 0
01:56:44.962026 IP c-185-45-236-223.customer.ggaweb.ch.8333 > tom-Latitude-3570.49070: tcp 469
01:56:44.962030 IP tom-Latitude-3570.49070 > c-185-45-236-223.customer.ggaweb.ch.8333: tcp 0
01:56:44.962033 IP vmi195435.contaboserver.net.8333 > tom-Latitude-3570.39110: tcp 24
01:56:44.962041 IP vmi195435.contaboserver.net.8333 > tom-Latitude-3570.39110: tcp 1448
01:56:44.962044 IP vmi195435.contaboserver.net.8333 > tom-Latitude-3570.39110: tcp 105
01:56:44.962046 IP vmi195435.contaboserver.net.8333 > tom-Latitude-3570.39110: tcp 24
01:56:44.962049 IP vmi195435.contaboserver.net.8333 > tom-Latitude-3570.39110: tcp 225
01:56:44.962096 IP tom-Latitude-3570.39110 > vmi195435.contaboserver.net.8333: tcp 0
01:56:44.962292 IP tom-Latitude-3570.49070 > c-185-45-236-223.customer.ggaweb.ch.8333: tcp 24
01:56:44.962861 IP tom-Latitude-3570.42516 > 2.56.9.15.8333: tcp 145
01:56:44.963273 IP tom-Latitude-3570.49070 > c-185-45-236-223.customer.ggaweb.ch.8333: tcp 73
01:56:44.996404 IP c-185-45-236-223.customer.ggaweb.ch.8333 > tom-Latitude-3570.49070: tcp 0
01:56:44.997103 IP 2.56.9.15.8333 > tom-Latitude-3570.42516: tcp 0
01:56:44.997117 IP c-185-45-236-223.customer.ggaweb.ch.8333 > tom-Latitude-3570.49070: tcp 0
01:56:45.080384 IP c-185-45-236-223.customer.ggaweb.ch.8333 > tom-Latitude-3570.49070: tcp 24
01:56:45.081121 IP c-185-45-236-223.customer.ggaweb.ch.8333 > tom-Latitude-3570.49070: tcp 590
01:56:45.081186 IP tom-Latitude-3570.49070 > c-185-45-236-223.customer.ggaweb.ch.8333: tcp 0
01:56:45.282563 IP tom-Latitude-3570.56714 > ns3113832.ip-54-38-177.eu.8333: tcp 24
01:56:45.284623 IP tom-Latitude-3570.56714 > ns3113832.ip-54-38-177.eu.8333: tcp 145
01:56:45.319714 IP ns3113832.ip-54-38-177.eu.8333 > tom-Latitude-3570.56714: tcp 0
01:56:45.326320 IP ns3113832.ip-54-38-177.eu.8333 > tom-Latitude-3570.56714: tcp 0
01:56:45.383030 IP tom-Latitude-3570.60988 > 81.198.101.144.8333: tcp 24
01:56:45.383916 IP tom-Latitude-3570.60988 > 81.198.101.144.8333: tcp 469
01:56:45.384510 IP ns3113832.ip-54-38-177.eu.8333 > tom-Latitude-3570.56714: tcp 24
01:56:45.384527 IP ns3113832.ip-54-38-177.eu.8333 > tom-Latitude-3570.56714: tcp 145
01:56:45.384563 IP tom-Latitude-3570.56714 > ns3113832.ip-54-38-177.eu.8333: tcp 0
01:56:45.384687 IP tom-Latitude-3570.56714 > ns3113832.ip-54-38-177.eu.8333: tcp 24
01:56:45.384747 IP tom-Latitude-3570.56714 > ns3113832.ip-54-38-177.eu.8333: tcp 1382
01:56:45.384750 IP tom-Latitude-3570.56714 > ns3113832.ip-54-38-177.eu.8333: tcp 535
01:56:45.386017 IP tom-Latitude-3570.56714 > ns3113832.ip-54-38-177.eu.8333: tcp 499
01:56:45.416115 IP ns3113832.ip-54-38-177.eu.8333 > tom-Latitude-3570.56714: tcp 0
01:56:45.416785 IP 81.198.101.144.8333 > tom-Latitude-3570.60988: tcp 0
01:56:45.416799 IP 81.198.101.144.8333 > tom-Latitude-3570.60988: tcp 0
01:56:45.421808 IP ns3113832.ip-54-38-177.eu.8333 > tom-Latitude-3570.56714: tcp 0
01:56:45.421823 IP ns3113832.ip-54-38-177.eu.8333 > tom-Latitude-3570.56714: tcp 0
01:56:45.640290 IP 81.198.101.144.8333 > tom-Latitude-3570.60988: tcp 24
01:56:45.640308 IP 81.198.101.144.8333 > tom-Latitude-3570.60988: tcp 37
01:56:45.640354 IP tom-Latitude-3570.60988 > 81.198.101.144.8333: tcp 0
01:56:45.640491 IP tom-Latitude-3570.60988 > 81.198.101.144.8333: tcp 24
01:56:45.641920 IP tom-Latitude-3570.60988 > 81.198.101.144.8333: tcp 340
01:56:45.677896 IP 81.198.101.144.8333 > tom-Latitude-3570.60988: tcp 0
01:56:45.677909 IP 81.198.101.144.8333 > tom-Latitude-3570.60988: tcp 0
01:56:45.941763 IP tom-Latitude-3570.60470 > bb42-60-217-183.singnet.com.sg.8333: tcp 24
01:56:45.944975 IP tom-Latitude-3570.60470 > bb42-60-217-183.singnet.com.sg.8333: tcp 793
01:56:45.997166 IP bb42-60-217-183.singnet.com.sg.8333 > tom-Latitude-3570.60470: tcp 0
01:56:46.004358 IP bb42-60-217-183.singnet.com.sg.8333 > tom-Latitude-3570.60470: tcp 0
01:56:46.152261 IP 81.198.101.144.8333 > tom-Latitude-3570.60988: tcp 24
01:56:46.152281 IP 81.198.101.144.8333 > tom-Latitude-3570.60988: tcp 37
01:56:46.152325 IP tom-Latitude-3570.60988 > 81.198.101.144.8333: tcp 0
01:56:46.152501 IP tom-Latitude-3570.60988 > 81.198.101.144.8333: tcp 24
01:56:46.153848 IP tom-Latitude-3570.60988 > 81.198.101.144.8333: tcp 37
01:56:46.239907 IP tom-Latitude-3570.60988 > 81.198.101.144.8333: tcp 37
01:56:46.240399 IP 81.198.101.144.8333 > tom-Latitude-3570.60988: tcp 0
01:56:46.240414 IP 81.198.101.144.8333 > tom-Latitude-3570.60988: tcp 0
01:56:46.268180 IP 81.198.101.144.8333 > tom-Latitude-3570.60988: tcp 0
01:56:46.664599 IP 2.56.9.15.8333 > tom-Latitude-3570.42516: tcp 24
01:56:46.664624 IP tom-Latitude-3570.42516 > 2.56.9.15.8333: tcp 0
01:56:46.664642 IP 2.56.9.15.8333 > tom-Latitude-3570.42516: tcp 253
01:56:46.664646 IP tom-Latitude-3570.42516 > 2.56.9.15.8333: tcp 0
01:56:46.664650 IP 81.198.101.144.8333 > tom-Latitude-3570.60988: tcp 24
01:56:46.664657 IP 81.198.101.144.8333 > tom-Latitude-3570.60988: tcp 1405
01:56:46.664660 IP 81.198.101.144.8333 > tom-Latitude-3570.60988: tcp 23
01:56:46.664663 IP tom-Latitude-3570.60988 > 81.198.101.144.8333: tcp 0
01:56:46.664667 IP ns3113832.ip-54-38-177.eu.8333 > tom-Latitude-3570.56714: tcp 24
01:56:46.664670 IP ns3113832.ip-54-38-177.eu.8333 > tom-Latitude-3570.56714: tcp 253
01:56:46.664732 IP tom-Latitude-3570.56714 > ns3113832.ip-54-38-177.eu.8333: tcp 0
01:56:46.668735 IP tom-Latitude-3570.56714 > ns3113832.ip-54-38-177.eu.8333: tcp 24
01:56:46.669367 IP tom-Latitude-3570.56714 > ns3113832.ip-54-38-177.eu.8333: tcp 217
01:56:46.705924 IP ns3113832.ip-54-38-177.eu.8333 > tom-Latitude-3570.56714: tcp 0
01:56:46.706472 IP ns3113832.ip-54-38-177.eu.8333 > tom-Latitude-3570.56714: tcp 0
01:56:46.764423 IP ns3113832.ip-54-38-177.eu.8333 > tom-Latitude-3570.56714: tcp 24
01:56:46.765695 IP ns3113832.ip-54-38-177.eu.8333 > tom-Latitude-3570.56714: tcp 933
01:56:46.765714 IP ns3113832.ip-54-38-177.eu.8333 > tom-Latitude-3570.56714: tcp 24
01:56:46.765717 IP ns3113832.ip-54-38-177.eu.8333 > tom-Latitude-3570.56714: tcp 224
01:56:46.765719 IP ns3113832.ip-54-38-177.eu.8333 > tom-Latitude-3570.56714: tcp 24
01:56:46.765722 IP ns3113832.ip-54-38-177.eu.8333 > tom-Latitude-3570.56714: tcp 246
01:56:46.765725 IP ns3113832.ip-54-38-177.eu.8333 > tom-Latitude-3570.56714: tcp 24
01:56:46.765727 IP ns3113832.ip-54-38-177.eu.8333 > tom-Latitude-3570.56714: tcp 189
01:56:46.765729 IP ns3113832.ip-54-38-177.eu.8333 > tom-Latitude-3570.56714: tcp 24
01:56:46.765731 IP ns3113832.ip-54-38-177.eu.8333 > tom-Latitude-3570.56714: tcp 451
01:56:46.765760 IP tom-Latitude-3570.56714 > ns3113832.ip-54-38-177.eu.8333: tcp 0
01:56:46.820109 IP ns3113832.ip-54-38-177.eu.8333 > tom-Latitude-3570.56714: tcp 248
01:56:46.863910 IP tom-Latitude-3570.56714 > ns3113832.ip-54-38-177.eu.8333: tcp 0
01:56:46.920931 IP tom-Latitude-3570.57976 > 167.99.216.145.8333: tcp 24
01:56:46.921871 IP tom-Latitude-3570.57976 > 167.99.216.145.8333: tcp 505
01:56:46.958111 IP 167.99.216.145.8333 > tom-Latitude-3570.57976: tcp 0
01:56:46.964680 IP 167.99.216.145.8333 > tom-Latitude-3570.57976: tcp 0
01:56:47.278665 IP 167.99.216.145.8333 > tom-Latitude-3570.57976: tcp 24
01:56:47.278685 IP 167.99.216.145.8333 > tom-Latitude-3570.57976: tcp 37
01:56:47.278729 IP tom-Latitude-3570.57976 > 167.99.216.145.8333: tcp 0
01:56:47.278868 IP tom-Latitude-3570.57976 > 167.99.216.145.8333: tcp 24
01:56:47.280284 IP tom-Latitude-3570.57976 > 167.99.216.145.8333: tcp 451
01:56:47.316065 IP 167.99.216.145.8333 > tom-Latitude-3570.57976: tcp 0
01:56:47.316752 IP 167.99.216.145.8333 > tom-Latitude-3570.57976: tcp 0
01:56:47.379357 IP tom-Latitude-3570.60470 > bb42-60-217-183.singnet.com.sg.8333: tcp 24
01:56:47.380295 IP tom-Latitude-3570.60470 > bb42-60-217-183.singnet.com.sg.8333: tcp 253
01:56:47.407923 IP bb42-60-217-183.singnet.com.sg.8333 > tom-Latitude-3570.60470: tcp 0
01:56:47.417192 IP bb42-60-217-183.singnet.com.sg.8333 > tom-Latitude-3570.60470: tcp 0
01:56:47.680467 IP tom-Latitude-3570.60988 > 81.198.101.144.8333: tcp 24
01:56:47.682745 IP tom-Latitude-3570.60988 > 81.198.101.144.8333: tcp 217
01:56:47.724424 IP 81.198.101.144.8333 > tom-Latitude-3570.60988: tcp 0
01:56:47.727242 IP 81.198.101.144.8333 > tom-Latitude-3570.60988: tcp 0
01:56:48.712320 IP 2.56.9.15.8333 > tom-Latitude-3570.42516: tcp 24
01:56:48.712338 IP tom-Latitude-3570.42516 > 2.56.9.15.8333: tcp 0
01:56:48.712358 IP 2.56.9.15.8333 > tom-Latitude-3570.42516: tcp 361
01:56:48.712363 IP tom-Latitude-3570.42516 > 2.56.9.15.8333: tcp 0
01:56:48.712681 IP tom-Latitude-3570.42516 > 2.56.9.15.8333: tcp 24
01:56:48.713815 IP tom-Latitude-3570.42516 > 2.56.9.15.8333: tcp 217
01:56:48.744630 IP 2.56.9.15.8333 > tom-Latitude-3570.42516: tcp 361
01:56:48.744649 IP tom-Latitude-3570.42516 > 2.56.9.15.8333: tcp 0
01:56:48.800065 IP 2.56.9.15.8333 > tom-Latitude-3570.42516: tcp 0
01:56:48.852822 IP 2.56.9.15.8333 > tom-Latitude-3570.42516: tcp 24
01:56:48.852847 IP tom-Latitude-3570.42516 > 2.56.9.15.8333: tcp 0
01:56:48.853706 IP 2.56.9.15.8333 > tom-Latitude-3570.42516: tcp 247
01:56:48.853730 IP tom-Latitude-3570.42516 > 2.56.9.15.8333: tcp 0
01:56:48.853746 IP 2.56.9.15.8333 > tom-Latitude-3570.42516: tcp 24
01:56:48.853748 IP tom-Latitude-3570.42516 > 2.56.9.15.8333: tcp 0
01:56:48.853752 IP 2.56.9.15.8333 > tom-Latitude-3570.42516: tcp 225
01:56:48.853755 IP tom-Latitude-3570.42516 > 2.56.9.15.8333: tcp 0
01:56:48.853758 IP 2.56.9.15.8333 > tom-Latitude-3570.42516: tcp 24
01:56:48.853760 IP tom-Latitude-3570.42516 > 2.56.9.15.8333: tcp 0
01:56:48.853763 IP 2.56.9.15.8333 > tom-Latitude-3570.42516: tcp 248
01:56:48.853765 IP 2.56.9.15.8333 > tom-Latitude-3570.42516: tcp 24
01:56:48.853767 IP 2.56.9.15.8333 > tom-Latitude-3570.42516: tcp 249
01:56:48.853768 IP tom-Latitude-3570.42516 > 2.56.9.15.8333: tcp 0
01:56:48.853769 IP 2.56.9.15.8333 > tom-Latitude-3570.42516: tcp 24
01:56:48.853771 IP 2.56.9.15.8333 > tom-Latitude-3570.42516: tcp 397
01:56:48.853773 IP tom-Latitude-3570.42516 > 2.56.9.15.8333: tcp 0
01:56:48.853777 IP tom-Latitude-3570.42516 > 2.56.9.15.8333: tcp 0
01:56:48.853781 IP tom-Latitude-3570.42516 > 2.56.9.15.8333: tcp 0
01:56:48.853786 IP tom-Latitude-3570.42516 > 2.56.9.15.8333: tcp 0
01:56:48.853964 IP tom-Latitude-3570.49070 > c-185-45-236-223.customer.ggaweb.ch.8333: tcp 24
01:56:48.854943 IP tom-Latitude-3570.49070 > c-185-45-236-223.customer.ggaweb.ch.8333: tcp 253
01:56:48.886610 IP c-185-45-236-223.customer.ggaweb.ch.8333 > tom-Latitude-3570.49070: tcp 0
01:56:48.887178 IP c-185-45-236-223.customer.ggaweb.ch.8333 > tom-Latitude-3570.49070: tcp 0
01:56:48.948612 IP 2.56.9.15.8333 > tom-Latitude-3570.42516: tcp 315
01:56:48.948630 IP tom-Latitude-3570.42516 > 2.56.9.15.8333: tcp 0
01:56:49.149879 IP tom-Latitude-3570.39110 > vmi195435.contaboserver.net.8333: tcp 24
01:56:49.151966 IP tom-Latitude-3570.39110 > vmi195435.contaboserver.net.8333: tcp 541
01:56:49.194924 IP vmi195435.contaboserver.net.8333 > tom-Latitude-3570.39110: tcp 0
01:56:49.238859 IP 167.99.216.145.8333 > tom-Latitude-3570.57976: tcp 24
01:56:49.239535 IP 167.99.216.145.8333 > tom-Latitude-3570.57976: tcp 145
01:56:49.239600 IP tom-Latitude-3570.57976 > 167.99.216.145.8333: tcp 0
01:56:49.340300 IP tom-Latitude-3570.46284 > static-87-75-105-186.vodafonexdsl.co.uk.8333: tcp 24
01:56:49.341556 IP tom-Latitude-3570.46284 > static-87-75-105-186.vodafonexdsl.co.uk.8333: tcp 721
01:56:49.378585 IP static-87-75-105-186.vodafonexdsl.co.uk.8333 > tom-Latitude-3570.46284: tcp 0
01:56:49.386349 IP static-87-75-105-186.vodafonexdsl.co.uk.8333 > tom-Latitude-3570.46284: tcp 0
01:56:49.440746 IP tom-Latitude-3570.60470 > bb42-60-217-183.singnet.com.sg.8333: tcp 24
01:56:49.441682 IP tom-Latitude-3570.60470 > bb42-60-217-183.singnet.com.sg.8333: tcp 217
01:56:49.468539 IP bb42-60-217-183.singnet.com.sg.8333 > tom-Latitude-3570.60470: tcp 0
01:56:49.478779 IP bb42-60-217-183.singnet.com.sg.8333 > tom-Latitude-3570.60470: tcp 0
01:56:49.478792 IP bb42-60-217-183.singnet.com.sg.8333 > tom-Latitude-3570.60470: tcp 24
01:56:49.478802 IP tom-Latitude-3570.60470 > bb42-60-217-183.singnet.com.sg.8333: tcp 0
01:56:49.480242 IP bb42-60-217-183.singnet.com.sg.8333 > tom-Latitude-3570.60470: tcp 325
01:56:49.480268 IP tom-Latitude-3570.60470 > bb42-60-217-183.singnet.com.sg.8333: tcp 0
01:56:49.480559 IP tom-Latitude-3570.60470 > bb42-60-217-183.singnet.com.sg.8333: tcp 24
01:56:49.481838 IP tom-Latitude-3570.60470 > bb42-60-217-183.singnet.com.sg.8333: tcp 109
01:56:49.517050 IP bb42-60-217-183.singnet.com.sg.8333 > tom-Latitude-3570.60470: tcp 0
01:56:49.982301 IP tom-Latitude-3570.57976 > 167.99.216.145.8333: tcp 24
01:56:49.984446 IP tom-Latitude-3570.57976 > 167.99.216.145.8333: tcp 73
01:56:50.081918 IP bb42-60-217-183.singnet.com.sg.8333 > tom-Latitude-3570.60470: tcp 24
01:56:50.081935 IP bb42-60-217-183.singnet.com.sg.8333 > tom-Latitude-3570.60470: tcp 470
01:56:50.081939 IP bb42-60-217-183.singnet.com.sg.8333 > tom-Latitude-3570.60470: tcp 24
01:56:50.081942 IP bb42-60-217-183.singnet.com.sg.8333 > tom-Latitude-3570.60470: tcp 216
01:56:50.081944 IP bb42-60-217-183.singnet.com.sg.8333 > tom-Latitude-3570.60470: tcp 24
01:56:50.081947 IP bb42-60-217-183.singnet.com.sg.8333 > tom-Latitude-3570.60470: tcp 371
01:56:50.081949 IP 81.198.101.144.8333 > tom-Latitude-3570.60988: tcp 24
01:56:50.081958 IP tom-Latitude-3570.60988 > 81.198.101.144.8333: tcp 0
01:56:50.081969 IP tom-Latitude-3570.60470 > bb42-60-217-183.singnet.com.sg.8333: tcp 0
01:56:50.081970 IP 81.198.101.144.8333 > tom-Latitude-3570.60988: tcp 217
01:56:50.081974 IP tom-Latitude-3570.60988 > 81.198.101.144.8333: tcp 0
01:56:50.081975 IP bb42-60-217-183.singnet.com.sg.8333 > tom-Latitude-3570.60470: tcp 371
01:56:50.081977 IP 167.99.216.145.8333 > tom-Latitude-3570.57976: tcp 0
01:56:50.081979 IP tom-Latitude-3570.60470 > bb42-60-217-183.singnet.com.sg.8333: tcp 0
01:56:50.081982 IP 167.99.216.145.8333 > tom-Latitude-3570.57976: tcp 0
01:56:50.585043 IP tom-Latitude-3570.56714 > ns3113832.ip-54-38-177.eu.8333: tcp 24
01:56:50.587095 IP tom-Latitude-3570.56714 > ns3113832.ip-54-38-177.eu.8333: tcp 325
01:56:50.636514 IP ns3113832.ip-54-38-177.eu.8333 > tom-Latitude-3570.56714: tcp 0
01:56:50.644689 IP ns3113832.ip-54-38-177.eu.8333 > tom-Latitude-3570.56714: tcp 0
01:56:50.785907 IP tom-Latitude-3570.49070 > c-185-45-236-223.customer.ggaweb.ch.8333: tcp 24
01:56:50.787952 IP tom-Latitude-3570.49070 > c-185-45-236-223.customer.ggaweb.ch.8333: tcp 325
01:56:50.816588 IP c-185-45-236-223.customer.ggaweb.ch.8333 > tom-Latitude-3570.49070: tcp 0
01:56:50.824140 IP c-185-45-236-223.customer.ggaweb.ch.8333 > tom-Latitude-3570.49070: tcp 0
01:56:51.086998 IP tom-Latitude-3570.57976 > 167.99.216.145.8333: tcp 24
01:56:51.089144 IP tom-Latitude-3570.57976 > 167.99.216.145.8333: tcp 109
01:56:51.118441 IP 167.99.216.145.8333 > tom-Latitude-3570.57976: tcp 0
01:56:51.126297 IP 167.99.216.145.8333 > tom-Latitude-3570.57976: tcp 0
01:56:51.187427 IP tom-Latitude-3570.42516 > 2.56.9.15.8333: tcp 24
01:56:51.188363 IP tom-Latitude-3570.42516 > 2.56.9.15.8333: tcp 109
01:56:51.226307 IP 2.56.9.15.8333 > tom-Latitude-3570.42516: tcp 0
01:56:51.388042 IP tom-Latitude-3570.46284 > static-87-75-105-186.vodafonexdsl.co.uk.8333: tcp 24
01:56:51.390065 IP tom-Latitude-3570.46284 > static-87-75-105-186.vodafonexdsl.co.uk.8333: tcp 109
01:56:51.418291 IP static-87-75-105-186.vodafonexdsl.co.uk.8333 > tom-Latitude-3570.46284: tcp 0
01:56:51.426298 IP static-87-75-105-186.vodafonexdsl.co.uk.8333 > tom-Latitude-3570.46284: tcp 0
01:56:51.492396 IP ns3113832.ip-54-38-177.eu.8333 > tom-Latitude-3570.56714: tcp 24
01:56:51.492422 IP tom-Latitude-3570.56714 > ns3113832.ip-54-38-177.eu.8333: tcp 0
01:56:51.493051 IP ns3113832.ip-54-38-177.eu.8333 > tom-Latitude-3570.56714: tcp 145
01:56:51.493075 IP tom-Latitude-3570.56714 > ns3113832.ip-54-38-177.eu.8333: tcp 0
01:56:51.493314 IP tom-Latitude-3570.56714 > ns3113832.ip-54-38-177.eu.8333: tcp 24
01:56:51.494264 IP tom-Latitude-3570.56714 > ns3113832.ip-54-38-177.eu.8333: tcp 145
01:56:51.526777 IP ns3113832.ip-54-38-177.eu.8333 > tom-Latitude-3570.56714: tcp 0
01:56:51.526792 IP ns3113832.ip-54-38-177.eu.8333 > tom-Latitude-3570.56714: tcp 0
01:56:51.584670 IP ns3113832.ip-54-38-177.eu.8333 > tom-Latitude-3570.56714: tcp 24
01:56:51.585537 IP ns3113832.ip-54-38-177.eu.8333 > tom-Latitude-3570.56714: tcp 226
01:56:51.585555 IP ns3113832.ip-54-38-177.eu.8333 > tom-Latitude-3570.56714: tcp 24
01:56:51.585557 IP ns3113832.ip-54-38-177.eu.8333 > tom-Latitude-3570.56714: tcp 404
01:56:51.585559 IP ns3113832.ip-54-38-177.eu.8333 > tom-Latitude-3570.56714: tcp 24
01:56:51.585561 IP ns3113832.ip-54-38-177.eu.8333 > tom-Latitude-3570.56714: tcp 225
01:56:51.585564 IP ns3113832.ip-54-38-177.eu.8333 > tom-Latitude-3570.56714: tcp 24
01:56:51.585584 IP ns3113832.ip-54-38-177.eu.8333 > tom-Latitude-3570.56714: tcp 375
01:56:51.585651 IP tom-Latitude-3570.56714 > ns3113832.ip-54-38-177.eu.8333: tcp 0
01:56:51.687405 IP tom-Latitude-3570.49070 > c-185-45-236-223.customer.ggaweb.ch.8333: tcp 24
01:56:51.688347 IP tom-Latitude-3570.49070 > c-185-45-236-223.customer.ggaweb.ch.8333: tcp 145
01:56:51.720605 IP c-185-45-236-223.customer.ggaweb.ch.8333 > tom-Latitude-3570.49070: tcp 0
01:56:51.725412 IP bb42-60-217-183.singnet.com.sg.8333 > tom-Latitude-3570.60470: tcp 24
01:56:51.725429 IP tom-Latitude-3570.60470 > bb42-60-217-183.singnet.com.sg.8333: tcp 0
01:56:51.726109 IP bb42-60-217-183.singnet.com.sg.8333 > tom-Latitude-3570.60470: tcp 145
01:56:51.726134 IP tom-Latitude-3570.60470 > bb42-60-217-183.singnet.com.sg.8333: tcp 0
01:56:51.726162 IP c-185-45-236-223.customer.ggaweb.ch.8333 > tom-Latitude-3570.49070: tcp 0
01:56:51.826724 IP tom-Latitude-3570.60988 > 81.198.101.144.8333: tcp 24
01:56:51.827661 IP tom-Latitude-3570.60988 > 81.198.101.144.8333: tcp 253
01:56:51.858308 IP 81.198.101.144.8333 > tom-Latitude-3570.60988: tcp 0
01:56:51.862092 IP vmi195435.contaboserver.net.8333 > tom-Latitude-3570.39110: tcp 24
01:56:51.862757 IP vmi195435.contaboserver.net.8333 > tom-Latitude-3570.39110: tcp 31
01:56:51.862882 IP tom-Latitude-3570.39110 > vmi195435.contaboserver.net.8333: tcp 0
01:56:51.865444 IP 81.198.101.144.8333 > tom-Latitude-3570.60988: tcp 0
01:56:52.264390 IP tom-Latitude-3570.57976 > 167.99.216.145.8333: tcp 24
01:56:52.266511 IP tom-Latitude-3570.57976 > 167.99.216.145.8333: tcp 253
01:56:52.317162 IP 167.99.216.145.8333 > tom-Latitude-3570.57976: tcp 0
01:56:52.326640 IP 167.99.216.145.8333 > tom-Latitude-3570.57976: tcp 0
01:56:52.393659 IP 167.99.216.145.8333 > tom-Latitude-3570.57976: tcp 24
01:56:52.394598 IP 167.99.216.145.8333 > tom-Latitude-3570.57976: tcp 283
01:56:52.394616 IP 167.99.216.145.8333 > tom-Latitude-3570.57976: tcp 24
01:56:52.394618 IP 167.99.216.145.8333 > tom-Latitude-3570.57976: tcp 283
01:56:52.394621 IP 167.99.216.145.8333 > tom-Latitude-3570.57976: tcp 24
01:56:52.394623 IP 167.99.216.145.8333 > tom-Latitude-3570.57976: tcp 283
01:56:52.394625 IP 167.99.216.145.8333 > tom-Latitude-3570.57976: tcp 24
01:56:52.394644 IP 167.99.216.145.8333 > tom-Latitude-3570.57976: tcp 283
01:56:52.394646 IP 167.99.216.145.8333 > tom-Latitude-3570.57976: tcp 24
01:56:52.394648 IP 167.99.216.145.8333 > tom-Latitude-3570.57976: tcp 284
01:56:52.394713 IP tom-Latitude-3570.57976 > 167.99.216.145.8333: tcp 0
01:56:52.395079 IP tom-Latitude-3570.57976 > 167.99.216.145.8333: tcp 24
01:56:52.397010 IP tom-Latitude-3570.57976 > 167.99.216.145.8333: tcp 281
01:56:52.426707 IP 167.99.216.145.8333 > tom-Latitude-3570.57976: tcp 0
01:56:52.427434 IP 167.99.216.145.8333 > tom-Latitude-3570.57976: tcp 0
01:56:52.706027 IP 167.99.216.145.8333 > tom-Latitude-3570.57976: tcp 616
01:56:52.706046 IP ns3113832.ip-54-38-177.eu.8333 > tom-Latitude-3570.56714: tcp 24
01:56:52.706050 IP ns3113832.ip-54-38-177.eu.8333 > tom-Latitude-3570.56714: tcp 109
01:56:52.706053 IP ns3113832.ip-54-38-177.eu.8333 > tom-Latitude-3570.56714: tcp 109
01:56:52.706081 IP tom-Latitude-3570.56714 > ns3113832.ip-54-38-177.eu.8333: tcp 0
01:56:52.706289 IP tom-Latitude-3570.56714 > ns3113832.ip-54-38-177.eu.8333: tcp 24
01:56:52.706635 IP tom-Latitude-3570.57976 > 167.99.216.145.8333: tcp 24
01:56:52.707486 IP tom-Latitude-3570.57976 > 167.99.216.145.8333: tcp 98
01:56:52.707494 IP tom-Latitude-3570.56714 > ns3113832.ip-54-38-177.eu.8333: tcp 109
01:56:52.746843 IP ns3113832.ip-54-38-177.eu.8333 > tom-Latitude-3570.56714: tcp 0
01:56:52.747300 IP ns3113832.ip-54-38-177.eu.8333 > tom-Latitude-3570.56714: tcp 0
01:56:52.747305 IP 167.99.216.145.8333 > tom-Latitude-3570.57976: tcp 0
01:56:52.747309 IP 167.99.216.145.8333 > tom-Latitude-3570.57976: tcp 0
01:56:52.805897 IP ns3113832.ip-54-38-177.eu.8333 > tom-Latitude-3570.56714: tcp 24
01:56:52.805916 IP ns3113832.ip-54-38-177.eu.8333 > tom-Latitude-3570.56714: tcp 340
01:56:52.805921 IP ns3113832.ip-54-38-177.eu.8333 > tom-Latitude-3570.56714: tcp 24
01:56:52.805923 IP ns3113832.ip-54-38-177.eu.8333 > tom-Latitude-3570.56714: tcp 190
01:56:52.805925 IP ns3113832.ip-54-38-177.eu.8333 > tom-Latitude-3570.56714: tcp 24
01:56:52.805945 IP ns3113832.ip-54-38-177.eu.8333 > tom-Latitude-3570.56714: tcp 192
01:56:52.806012 IP tom-Latitude-3570.56714 > ns3113832.ip-54-38-177.eu.8333: tcp 0
01:56:53.408469 IP tom-Latitude-3570.46284 > static-87-75-105-186.vodafonexdsl.co.uk.8333: tcp 24
01:56:53.410736 IP tom-Latitude-3570.46284 > static-87-75-105-186.vodafonexdsl.co.uk.8333: tcp 8
01:56:53.468729 IP static-87-75-105-186.vodafonexdsl.co.uk.8333 > tom-Latitude-3570.46284: tcp 0
01:56:53.476650 IP static-87-75-105-186.vodafonexdsl.co.uk.8333 > tom-Latitude-3570.46284: tcp 0
01:56:53.832319 IP static-87-75-105-186.vodafonexdsl.co.uk.8333 > tom-Latitude-3570.46284: tcp 24
01:56:53.832342 IP tom-Latitude-3570.46284 > static-87-75-105-186.vodafonexdsl.co.uk.8333: tcp 0
01:56:53.832372 IP static-87-75-105-186.vodafonexdsl.co.uk.8333 > tom-Latitude-3570.46284: tcp 8
01:56:53.832375 IP tom-Latitude-3570.46284 > static-87-75-105-186.vodafonexdsl.co.uk.8333: tcp 0
01:56:53.932935 IP tom-Latitude-3570.39110 > vmi195435.contaboserver.net.8333: tcp 24
01:56:53.933876 IP tom-Latitude-3570.39110 > vmi195435.contaboserver.net.8333: tcp 361
01:56:53.976336 IP vmi195435.contaboserver.net.8333 > tom-Latitude-3570.39110: tcp 0
01:56:54.033397 IP tom-Latitude-3570.42516 > 2.56.9.15.8333: tcp 24
01:56:54.034581 IP tom-Latitude-3570.42516 > 2.56.9.15.8333: tcp 253
01:56:54.074883 IP 2.56.9.15.8333 > tom-Latitude-3570.42516: tcp 0
01:56:54.172403 IP c-185-45-236-223.customer.ggaweb.ch.8333 > tom-Latitude-3570.49070: tcp 24
01:56:54.179788 IP c-185-45-236-223.customer.ggaweb.ch.8333 > tom-Latitude-3570.49070: tcp 1261
01:56:54.179917 IP tom-Latitude-3570.49070 > c-185-45-236-223.customer.ggaweb.ch.8333: tcp 0
01:56:54.180368 IP tom-Latitude-3570.49070 > c-185-45-236-223.customer.ggaweb.ch.8333: tcp 24
01:56:54.180383 IP tom-Latitude-3570.49070 > c-185-45-236-223.customer.ggaweb.ch.8333: tcp 1153
01:56:54.180458 IP tom-Latitude-3570.57976 > 167.99.216.145.8333: tcp 24
01:56:54.181639 IP tom-Latitude-3570.57976 > 167.99.216.145.8333: tcp 253
01:56:54.216464 IP c-185-45-236-223.customer.ggaweb.ch.8333 > tom-Latitude-3570.49070: tcp 0
01:56:54.217145 IP c-185-45-236-223.customer.ggaweb.ch.8333 > tom-Latitude-3570.49070: tcp 0
01:56:54.217159 IP 167.99.216.145.8333 > tom-Latitude-3570.57976: tcp 0
01:56:54.217163 IP 167.99.216.145.8333 > tom-Latitude-3570.57976: tcp 0
01:56:54.302149 IP c-185-45-236-223.customer.ggaweb.ch.8333 > tom-Latitude-3570.49070: tcp 24
01:56:54.303283 IP c-185-45-236-223.customer.ggaweb.ch.8333 > tom-Latitude-3570.49070: tcp 225
01:56:54.303300 IP c-185-45-236-223.customer.ggaweb.ch.8333 > tom-Latitude-3570.49070: tcp 492
01:56:54.303304 IP c-185-45-236-223.customer.ggaweb.ch.8333 > tom-Latitude-3570.49070: tcp 307
01:56:54.303306 IP c-185-45-236-223.customer.ggaweb.ch.8333 > tom-Latitude-3570.49070: tcp 308
01:56:54.303308 IP c-185-45-236-223.customer.ggaweb.ch.8333 > tom-Latitude-3570.49070: tcp 615
01:56:54.303310 IP c-185-45-236-223.customer.ggaweb.ch.8333 > tom-Latitude-3570.49070: tcp 307
01:56:54.303330 IP c-185-45-236-223.customer.ggaweb.ch.8333 > tom-Latitude-3570.49070: tcp 332
01:56:54.303332 IP c-185-45-236-223.customer.ggaweb.ch.8333 > tom-Latitude-3570.49070: tcp 591
01:56:54.303334 IP c-185-45-236-223.customer.ggaweb.ch.8333 > tom-Latitude-3570.49070: tcp 307
01:56:54.303396 IP tom-Latitude-3570.49070 > c-185-45-236-223.customer.ggaweb.ch.8333: tcp 0
01:56:54.384630 IP c-185-45-236-223.customer.ggaweb.ch.8333 > tom-Latitude-3570.49070: tcp 1382
01:56:54.385256 IP c-185-45-236-223.customer.ggaweb.ch.8333 > tom-Latitude-3570.49070: tcp 66
01:56:54.385278 IP tom-Latitude-3570.49070 > c-185-45-236-223.customer.ggaweb.ch.8333: tcp 0
01:56:54.395942 IP c-185-45-236-223.customer.ggaweb.ch.8333 > tom-Latitude-3570.49070: tcp 1448
01:56:54.395961 IP c-185-45-236-223.customer.ggaweb.ch.8333 > tom-Latitude-3570.49070: tcp 1448
01:56:54.395968 IP c-185-45-236-223.customer.ggaweb.ch.8333 > tom-Latitude-3570.49070: tcp 1448
01:56:54.395989 IP c-185-45-236-223.customer.ggaweb.ch.8333 > tom-Latitude-3570.49070: tcp 357
01:56:54.396060 IP tom-Latitude-3570.49070 > c-185-45-236-223.customer.ggaweb.ch.8333: tcp 0
01:56:54.856467 IP static-87-75-105-186.vodafonexdsl.co.uk.8333 > tom-Latitude-3570.46284: tcp 24
01:56:54.856485 IP tom-Latitude-3570.46284 > static-87-75-105-186.vodafonexdsl.co.uk.8333: tcp 0
01:56:54.856503 IP static-87-75-105-186.vodafonexdsl.co.uk.8333 > tom-Latitude-3570.46284: tcp 1261
01:56:54.856507 IP tom-Latitude-3570.46284 > static-87-75-105-186.vodafonexdsl.co.uk.8333: tcp 0
01:56:54.856982 IP tom-Latitude-3570.46284 > static-87-75-105-186.vodafonexdsl.co.uk.8333: tcp 24
01:56:54.858102 IP tom-Latitude-3570.46284 > static-87-75-105-186.vodafonexdsl.co.uk.8333: tcp 397
01:56:54.895398 IP static-87-75-105-186.vodafonexdsl.co.uk.8333 > tom-Latitude-3570.46284: tcp 0
01:56:54.895940 IP static-87-75-105-186.vodafonexdsl.co.uk.8333 > tom-Latitude-3570.46284: tcp 0
01:56:54.963315 IP static-87-75-105-186.vodafonexdsl.co.uk.8333 > tom-Latitude-3570.46284: tcp 24
01:56:55.003918 IP tom-Latitude-3570.46284 > static-87-75-105-186.vodafonexdsl.co.uk.8333: tcp 0
01:56:55.025168 IP static-87-75-105-186.vodafonexdsl.co.uk.8333 > tom-Latitude-3570.46284: tcp 279
01:56:55.025192 IP tom-Latitude-3570.46284 > static-87-75-105-186.vodafonexdsl.co.uk.8333: tcp 0
01:56:55.025617 IP static-87-75-105-186.vodafonexdsl.co.uk.8333 > tom-Latitude-3570.46284: tcp 307
01:56:55.025633 IP tom-Latitude-3570.46284 > static-87-75-105-186.vodafonexdsl.co.uk.8333: tcp 0
01:56:55.028167 IP static-87-75-105-186.vodafonexdsl.co.uk.8333 > tom-Latitude-3570.46284: tcp 308
01:56:55.028181 IP tom-Latitude-3570.46284 > static-87-75-105-186.vodafonexdsl.co.uk.8333: tcp 0
01:56:55.028739 IP static-87-75-105-186.vodafonexdsl.co.uk.8333 > tom-Latitude-3570.46284: tcp 308
01:56:55.028750 IP tom-Latitude-3570.46284 > static-87-75-105-186.vodafonexdsl.co.uk.8333: tcp 0
01:56:55.230036 IP tom-Latitude-3570.42516 > 2.56.9.15.8333: tcp 24
01:56:55.230057 IP tom-Latitude-3570.42516 > 2.56.9.15.8333: tcp 1261
01:56:55.233262 IP 167.99.216.145.8333 > tom-Latitude-3570.57976: tcp 24
01:56:55.233282 IP 167.99.216.145.8333 > tom-Latitude-3570.57976: tcp 283
01:56:55.233285 IP 167.99.216.145.8333 > tom-Latitude-3570.57976: tcp 24
01:56:55.233287 IP 167.99.216.145.8333 > tom-Latitude-3570.57976: tcp 181
01:56:55.233289 IP static-87-75-105-186.vodafonexdsl.co.uk.8333 > tom-Latitude-3570.46284: tcp 307
01:56:55.233317 IP tom-Latitude-3570.46284 > static-87-75-105-186.vodafonexdsl.co.uk.8333: tcp 0
01:56:55.233331 IP static-87-75-105-186.vodafonexdsl.co.uk.8333 > tom-Latitude-3570.46284: tcp 307
01:56:55.233334 IP tom-Latitude-3570.46284 > static-87-75-105-186.vodafonexdsl.co.uk.8333: tcp 0
01:56:55.233338 IP static-87-75-105-186.vodafonexdsl.co.uk.8333 > tom-Latitude-3570.46284: tcp 307
01:56:55.233339 IP tom-Latitude-3570.46284 > static-87-75-105-186.vodafonexdsl.co.uk.8333: tcp 0
01:56:55.233343 IP static-87-75-105-186.vodafonexdsl.co.uk.8333 > tom-Latitude-3570.46284: tcp 307
01:56:55.233345 IP tom-Latitude-3570.46284 > static-87-75-105-186.vodafonexdsl.co.uk.8333: tcp 0
01:56:55.233347 IP static-87-75-105-186.vodafonexdsl.co.uk.8333 > tom-Latitude-3570.46284: tcp 332
01:56:55.233349 IP tom-Latitude-3570.46284 > static-87-75-105-186.vodafonexdsl.co.uk.8333: tcp 0
01:56:55.233365 IP tom-Latitude-3570.57976 > 167.99.216.145.8333: tcp 0
01:56:55.233736 IP tom-Latitude-3570.57976 > 167.99.216.145.8333: tcp 24
01:56:55.234681 IP tom-Latitude-3570.57976 > 167.99.216.145.8333: tcp 37
01:56:55.263252 IP static-87-75-105-186.vodafonexdsl.co.uk.8333 > tom-Latitude-3570.46284: tcp 282
01:56:55.263260 IP tom-Latitude-3570.46284 > static-87-75-105-186.vodafonexdsl.co.uk.8333: tcp 0
01:56:55.264009 IP static-87-75-105-186.vodafonexdsl.co.uk.8333 > tom-Latitude-3570.46284: tcp 284
01:56:55.264026 IP tom-Latitude-3570.46284 > static-87-75-105-186.vodafonexdsl.co.uk.8333: tcp 0
01:56:55.276428 IP 2.56.9.15.8333 > tom-Latitude-3570.42516: tcp 0
01:56:55.277110 IP 167.99.216.145.8333 > tom-Latitude-3570.57976: tcp 0
01:56:55.277124 IP 167.99.216.145.8333 > tom-Latitude-3570.57976: tcp 0
01:56:55.313386 IP vmi195435.contaboserver.net.8333 > tom-Latitude-3570.39110: tcp 24
01:56:55.314178 IP vmi195435.contaboserver.net.8333 > tom-Latitude-3570.39110: tcp 1261
01:56:55.314305 IP tom-Latitude-3570.39110 > vmi195435.contaboserver.net.8333: tcp 0
01:56:55.314675 IP tom-Latitude-3570.39110 > vmi195435.contaboserver.net.8333: tcp 24
01:56:55.315874 IP tom-Latitude-3570.39110 > vmi195435.contaboserver.net.8333: tcp 217
01:56:55.356382 IP vmi195435.contaboserver.net.8333 > tom-Latitude-3570.39110: tcp 0
01:56:55.415046 IP tom-Latitude-3570.57976 > 167.99.216.145.8333: tcp 24
01:56:55.415065 IP tom-Latitude-3570.57976 > 167.99.216.145.8333: tcp 1261
01:56:55.434747 IP vmi195435.contaboserver.net.8333 > tom-Latitude-3570.39110: tcp 24
01:56:55.435601 IP vmi195435.contaboserver.net.8333 > tom-Latitude-3570.39110: tcp 224
01:56:55.435619 IP vmi195435.contaboserver.net.8333 > tom-Latitude-3570.39110: tcp 24
01:56:55.435621 IP vmi195435.contaboserver.net.8333 > tom-Latitude-3570.39110: tcp 283
