07:49:36.547629 IP tom-Latitude-3570.56714 > ns3113832.ip-54-38-177.eu.8333: tcp 24
07:49:36.549685 IP tom-Latitude-3570.56714 > ns3113832.ip-54-38-177.eu.8333: tcp 541
07:49:36.602648 IP ns3113832.ip-54-38-177.eu.8333 > tom-Latitude-3570.56714: tcp 0
07:49:36.613477 IP ns3113832.ip-54-38-177.eu.8333 > tom-Latitude-3570.56714: tcp 0
07:49:36.948986 IP tom-Latitude-3570.60470 > bb42-60-217-183.singnet.com.sg.8333: tcp 24
07:49:36.968858 IP tom-Latitude-3570.60470 > bb42-60-217-183.singnet.com.sg.8333: tcp 8
07:49:37.023066 IP bb42-60-217-183.singnet.com.sg.8333 > tom-Latitude-3570.60470: tcp 0
07:49:37.030138 IP bb42-60-217-183.singnet.com.sg.8333 > tom-Latitude-3570.60470: tcp 0
07:49:37.490365 IP bb42-60-217-183.singnet.com.sg.8333 > tom-Latitude-3570.60470: tcp 24
07:49:37.490387 IP bb42-60-217-183.singnet.com.sg.8333 > tom-Latitude-3570.60470: tcp 109
07:49:37.490392 IP bb42-60-217-183.singnet.com.sg.8333 > tom-Latitude-3570.60470: tcp 24
07:49:37.490395 IP bb42-60-217-183.singnet.com.sg.8333 > tom-Latitude-3570.60470: tcp 8
07:49:37.490431 IP tom-Latitude-3570.60470 > bb42-60-217-183.singnet.com.sg.8333: tcp 0
07:49:37.490643 IP tom-Latitude-3570.60470 > bb42-60-217-183.singnet.com.sg.8333: tcp 24
07:49:37.491965 IP tom-Latitude-3570.60470 > bb42-60-217-183.singnet.com.sg.8333: tcp 109
07:49:37.531059 IP bb42-60-217-183.singnet.com.sg.8333 > tom-Latitude-3570.60470: tcp 0
07:49:37.531071 IP bb42-60-217-183.singnet.com.sg.8333 > tom-Latitude-3570.60470: tcp 0
07:49:37.992396 IP tom-Latitude-3570.39110 > vmi195435.contaboserver.net.8333: tcp 24
07:49:38.066561 IP tom-Latitude-3570.39110 > vmi195435.contaboserver.net.8333: tcp 181
07:49:38.125115 IP bb42-60-217-183.singnet.com.sg.8333 > tom-Latitude-3570.60470: tcp 374
07:49:38.125134 IP tom-Latitude-3570.60470 > bb42-60-217-183.singnet.com.sg.8333: tcp 0
07:49:38.125729 IP bb42-60-217-183.singnet.com.sg.8333 > tom-Latitude-3570.60470: tcp 24
07:49:38.125748 IP tom-Latitude-3570.60470 > bb42-60-217-183.singnet.com.sg.8333: tcp 0
07:49:38.128345 IP bb42-60-217-183.singnet.com.sg.8333 > tom-Latitude-3570.60470: tcp 500
07:49:38.128365 IP tom-Latitude-3570.60470 > bb42-60-217-183.singnet.com.sg.8333: tcp 0
07:49:38.128376 IP bb42-60-217-183.singnet.com.sg.8333 > tom-Latitude-3570.60470: tcp 24
07:49:38.128378 IP tom-Latitude-3570.60470 > bb42-60-217-183.singnet.com.sg.8333: tcp 0
07:49:38.128381 IP bb42-60-217-183.singnet.com.sg.8333 > tom-Latitude-3570.60470: tcp 226
07:49:38.128383 IP tom-Latitude-3570.60470 > bb42-60-217-183.singnet.com.sg.8333: tcp 0
07:49:38.145924 IP bb42-60-217-183.singnet.com.sg.8333 > tom-Latitude-3570.60470: tcp 226
07:49:38.145948 IP tom-Latitude-3570.60470 > bb42-60-217-183.singnet.com.sg.8333: tcp 0
07:49:38.146712 IP vmi195435.contaboserver.net.8333 > tom-Latitude-3570.39110: tcp 0
07:49:38.160904 IP vmi195435.contaboserver.net.8333 > tom-Latitude-3570.39110: tcp 0
07:49:38.164710 IP bb42-60-217-183.singnet.com.sg.8333 > tom-Latitude-3570.60470: tcp 24
07:49:38.164738 IP tom-Latitude-3570.60470 > bb42-60-217-183.singnet.com.sg.8333: tcp 0
07:49:38.266568 IP tom-Latitude-3570.57976 > 167.99.216.145.8333: tcp 24
07:49:38.267551 IP tom-Latitude-3570.57976 > 167.99.216.145.8333: tcp 577
07:49:38.303108 IP 167.99.216.145.8333 > tom-Latitude-3570.57976: tcp 0
07:49:38.321609 IP 167.99.216.145.8333 > tom-Latitude-3570.57976: tcp 0
07:49:38.340710 IP 2.56.9.15.8333 > tom-Latitude-3570.42516: tcp 24
07:49:38.340736 IP tom-Latitude-3570.42516 > 2.56.9.15.8333: tcp 0
07:49:38.340755 IP 2.56.9.15.8333 > tom-Latitude-3570.42516: tcp 181
07:49:38.340760 IP tom-Latitude-3570.42516 > 2.56.9.15.8333: tcp 0
07:49:38.341017 IP tom-Latitude-3570.42516 > 2.56.9.15.8333: tcp 24
07:49:38.342979 IP tom-Latitude-3570.42516 > 2.56.9.15.8333: tcp 73
07:49:38.396915 IP 2.56.9.15.8333 > tom-Latitude-3570.42516: tcp 0
07:49:38.397556 IP 2.56.9.15.8333 > tom-Latitude-3570.42516: tcp 0
07:49:38.490103 IP 2.56.9.15.8333 > tom-Latitude-3570.42516: tcp 24
07:49:38.491752 IP 2.56.9.15.8333 > tom-Latitude-3570.42516: tcp 371
07:49:38.491775 IP 2.56.9.15.8333 > tom-Latitude-3570.42516: tcp 24
07:49:38.491778 IP 2.56.9.15.8333 > tom-Latitude-3570.42516: tcp 223
07:49:38.491856 IP tom-Latitude-3570.42516 > 2.56.9.15.8333: tcp 0
07:49:38.693410 IP tom-Latitude-3570.60988 > 81.198.101.144.8333: tcp 24
07:49:38.695484 IP tom-Latitude-3570.60988 > 81.198.101.144.8333: tcp 325
07:49:38.755043 IP 81.198.101.144.8333 > tom-Latitude-3570.60988: tcp 0
07:49:38.755058 IP 81.198.101.144.8333 > tom-Latitude-3570.60988: tcp 0
07:49:38.758169 IP vmi195435.contaboserver.net.8333 > tom-Latitude-3570.39110: tcp 24
07:49:38.758191 IP vmi195435.contaboserver.net.8333 > tom-Latitude-3570.39110: tcp 253
07:49:38.758230 IP tom-Latitude-3570.39110 > vmi195435.contaboserver.net.8333: tcp 0
07:49:38.758491 IP tom-Latitude-3570.39110 > vmi195435.contaboserver.net.8333: tcp 24
07:49:38.760051 IP tom-Latitude-3570.39110 > vmi195435.contaboserver.net.8333: tcp 73
07:49:38.801515 IP vmi195435.contaboserver.net.8333 > tom-Latitude-3570.39110: tcp 0
07:49:38.801529 IP vmi195435.contaboserver.net.8333 > tom-Latitude-3570.39110: tcp 0
07:49:38.879102 IP vmi195435.contaboserver.net.8333 > tom-Latitude-3570.39110: tcp 24
07:49:38.879122 IP vmi195435.contaboserver.net.8333 > tom-Latitude-3570.39110: tcp 225
07:49:38.879164 IP tom-Latitude-3570.39110 > vmi195435.contaboserver.net.8333: tcp 0
07:49:38.885293 IP vmi195435.contaboserver.net.8333 > tom-Latitude-3570.39110: tcp 24
07:49:38.886967 IP vmi195435.contaboserver.net.8333 > tom-Latitude-3570.39110: tcp 283
07:49:38.887010 IP tom-Latitude-3570.39110 > vmi195435.contaboserver.net.8333: tcp 0
07:49:38.949965 IP 2.56.9.15.8333 > tom-Latitude-3570.42516: tcp 24
07:49:38.958177 IP 2.56.9.15.8333 > tom-Latitude-3570.42516: tcp 181
07:49:38.958241 IP tom-Latitude-3570.42516 > 2.56.9.15.8333: tcp 0
07:49:38.958469 IP tom-Latitude-3570.42516 > 2.56.9.15.8333: tcp 24
07:49:38.959846 IP tom-Latitude-3570.42516 > 2.56.9.15.8333: tcp 109
07:49:38.989633 IP 2.56.9.15.8333 > tom-Latitude-3570.42516: tcp 0
07:49:38.989647 IP 2.56.9.15.8333 > tom-Latitude-3570.42516: tcp 0
07:49:39.166267 IP 2.56.9.15.8333 > tom-Latitude-3570.42516: tcp 24
07:49:39.166288 IP 2.56.9.15.8333 > tom-Latitude-3570.42516: tcp 278
07:49:39.166294 IP 2.56.9.15.8333 > tom-Latitude-3570.42516: tcp 24
07:49:39.166298 IP 2.56.9.15.8333 > tom-Latitude-3570.42516: tcp 451
07:49:39.166301 IP 2.56.9.15.8333 > tom-Latitude-3570.42516: tcp 24
07:49:39.166303 IP 2.56.9.15.8333 > tom-Latitude-3570.42516: tcp 225
07:49:39.166373 IP tom-Latitude-3570.42516 > 2.56.9.15.8333: tcp 0
07:49:39.538994 IP c-185-45-236-223.customer.ggaweb.ch.8333 > tom-Latitude-3570.49070: tcp 24
07:49:39.539011 IP tom-Latitude-3570.49070 > c-185-45-236-223.customer.ggaweb.ch.8333: tcp 0
07:49:39.539030 IP c-185-45-236-223.customer.ggaweb.ch.8333 > tom-Latitude-3570.49070: tcp 433
07:49:39.539036 IP tom-Latitude-3570.49070 > c-185-45-236-223.customer.ggaweb.ch.8333: tcp 0
07:49:39.539331 IP tom-Latitude-3570.49070 > c-185-45-236-223.customer.ggaweb.ch.8333: tcp 24
07:49:39.540910 IP tom-Latitude-3570.49070 > c-185-45-236-223.customer.ggaweb.ch.8333: tcp 73
07:49:39.573000 IP bb42-60-217-183.singnet.com.sg.8333 > tom-Latitude-3570.60470: tcp 24
07:49:39.573014 IP tom-Latitude-3570.60470 > bb42-60-217-183.singnet.com.sg.8333: tcp 0
07:49:39.575965 IP bb42-60-217-183.singnet.com.sg.8333 > tom-Latitude-3570.60470: tcp 253
07:49:39.575991 IP tom-Latitude-3570.60470 > bb42-60-217-183.singnet.com.sg.8333: tcp 0
07:49:39.576392 IP c-185-45-236-223.customer.ggaweb.ch.8333 > tom-Latitude-3570.49070: tcp 0
07:49:39.586517 IP c-185-45-236-223.customer.ggaweb.ch.8333 > tom-Latitude-3570.49070: tcp 0
07:49:39.675123 IP c-185-45-236-223.customer.ggaweb.ch.8333 > tom-Latitude-3570.49070: tcp 24
07:49:39.676623 IP tom-Latitude-3570.60988 > 81.198.101.144.8333: tcp 24
07:49:39.676864 IP c-185-45-236-223.customer.ggaweb.ch.8333 > tom-Latitude-3570.49070: tcp 653
07:49:39.676917 IP tom-Latitude-3570.49070 > c-185-45-236-223.customer.ggaweb.ch.8333: tcp 0
07:49:39.677635 IP tom-Latitude-3570.60988 > 81.198.101.144.8333: tcp 181
07:49:39.718298 IP 81.198.101.144.8333 > tom-Latitude-3570.60988: tcp 0
07:49:39.718312 IP 81.198.101.144.8333 > tom-Latitude-3570.60988: tcp 0
07:49:39.741276 IP 2.56.9.15.8333 > tom-Latitude-3570.42516: tcp 24
07:49:39.741919 IP 2.56.9.15.8333 > tom-Latitude-3570.42516: tcp 145
07:49:39.741984 IP tom-Latitude-3570.42516 > 2.56.9.15.8333: tcp 0
07:49:39.742257 IP tom-Latitude-3570.42516 > 2.56.9.15.8333: tcp 24
07:49:39.743911 IP tom-Latitude-3570.42516 > 2.56.9.15.8333: tcp 73
07:49:39.780107 IP 2.56.9.15.8333 > tom-Latitude-3570.42516: tcp 0
07:49:39.780764 IP 2.56.9.15.8333 > tom-Latitude-3570.42516: tcp 0
07:49:39.842664 IP tom-Latitude-3570.60988 > 81.198.101.144.8333: tcp 24
07:49:39.845156 IP tom-Latitude-3570.60988 > 81.198.101.144.8333: tcp 73
07:49:39.873427 IP 81.198.101.144.8333 > tom-Latitude-3570.60988: tcp 0
07:49:39.877126 IP 2.56.9.15.8333 > tom-Latitude-3570.42516: tcp 24
07:49:39.877146 IP 2.56.9.15.8333 > tom-Latitude-3570.42516: tcp 226
07:49:39.877151 IP 2.56.9.15.8333 > tom-Latitude-3570.42516: tcp 24
07:49:39.877154 IP 2.56.9.15.8333 > tom-Latitude-3570.42516: tcp 404
07:49:39.877193 IP tom-Latitude-3570.42516 > 2.56.9.15.8333: tcp 0
07:49:39.880080 IP 81.198.101.144.8333 > tom-Latitude-3570.60988: tcp 0
07:49:39.901035 IP vmi195435.contaboserver.net.8333 > tom-Latitude-3570.39110: tcp 24
07:49:39.901873 IP vmi195435.contaboserver.net.8333 > tom-Latitude-3570.39110: tcp 289
07:49:39.901903 IP tom-Latitude-3570.39110 > vmi195435.contaboserver.net.8333: tcp 0
07:49:39.902082 IP tom-Latitude-3570.39110 > vmi195435.contaboserver.net.8333: tcp 24
07:49:39.903622 IP tom-Latitude-3570.39110 > vmi195435.contaboserver.net.8333: tcp 37
07:49:39.941954 IP vmi195435.contaboserver.net.8333 > tom-Latitude-3570.39110: tcp 0
07:49:39.941968 IP vmi195435.contaboserver.net.8333 > tom-Latitude-3570.39110: tcp 0
07:49:40.035714 IP vmi195435.contaboserver.net.8333 > tom-Latitude-3570.39110: tcp 24
07:49:40.035733 IP vmi195435.contaboserver.net.8333 > tom-Latitude-3570.39110: tcp 403
07:49:40.035775 IP tom-Latitude-3570.39110 > vmi195435.contaboserver.net.8333: tcp 0
07:49:40.136500 IP tom-Latitude-3570.60988 > 81.198.101.144.8333: tcp 24
07:49:40.136603 IP tom-Latitude-3570.60470 > bb42-60-217-183.singnet.com.sg.8333: tcp 24
07:49:40.137594 IP tom-Latitude-3570.60988 > 81.198.101.144.8333: tcp 109
07:49:40.138228 IP tom-Latitude-3570.60470 > bb42-60-217-183.singnet.com.sg.8333: tcp 181
07:49:40.243887 IP tom-Latitude-3570.60470 > bb42-60-217-183.singnet.com.sg.8333: tcp 181
07:49:40.243902 IP tom-Latitude-3570.60988 > 81.198.101.144.8333: tcp 109
07:49:40.264796 IP 81.198.101.144.8333 > tom-Latitude-3570.60988: tcp 0
07:49:40.264811 IP 81.198.101.144.8333 > tom-Latitude-3570.60988: tcp 0
07:49:40.264814 IP bb42-60-217-183.singnet.com.sg.8333 > tom-Latitude-3570.60470: tcp 0
07:49:40.264816 IP bb42-60-217-183.singnet.com.sg.8333 > tom-Latitude-3570.60470: tcp 0
07:49:40.277849 IP 81.198.101.144.8333 > tom-Latitude-3570.60988: tcp 24
07:49:40.278486 IP 81.198.101.144.8333 > tom-Latitude-3570.60988: tcp 37
07:49:40.278548 IP tom-Latitude-3570.60988 > 81.198.101.144.8333: tcp 0
07:49:40.278682 IP tom-Latitude-3570.60988 > 81.198.101.144.8333: tcp 24
07:49:40.280143 IP tom-Latitude-3570.60988 > 81.198.101.144.8333: tcp 403
07:49:40.322200 IP 81.198.101.144.8333 > tom-Latitude-3570.60988: tcp 0
07:49:40.322243 IP 81.198.101.144.8333 > tom-Latitude-3570.60988: tcp 0
07:49:40.322248 IP bb42-60-217-183.singnet.com.sg.8333 > tom-Latitude-3570.60470: tcp 0
07:49:40.327973 IP 81.198.101.144.8333 > tom-Latitude-3570.60988: tcp 0
07:49:40.562379 IP ns3113832.ip-54-38-177.eu.8333 > tom-Latitude-3570.56714: tcp 24
07:49:40.562401 IP ns3113832.ip-54-38-177.eu.8333 > tom-Latitude-3570.56714: tcp 541
07:49:40.562480 IP tom-Latitude-3570.56714 > ns3113832.ip-54-38-177.eu.8333: tcp 0
07:49:40.567885 IP bb42-60-217-183.singnet.com.sg.8333 > tom-Latitude-3570.60470: tcp 24
07:49:40.567898 IP tom-Latitude-3570.60470 > bb42-60-217-183.singnet.com.sg.8333: tcp 0
07:49:40.577576 IP bb42-60-217-183.singnet.com.sg.8333 > tom-Latitude-3570.60470: tcp 37
07:49:40.577594 IP tom-Latitude-3570.60470 > bb42-60-217-183.singnet.com.sg.8333: tcp 0
07:49:40.577789 IP tom-Latitude-3570.60470 > bb42-60-217-183.singnet.com.sg.8333: tcp 24
07:49:40.579202 IP tom-Latitude-3570.60470 > bb42-60-217-183.singnet.com.sg.8333: tcp 403
07:49:40.618053 IP bb42-60-217-183.singnet.com.sg.8333 > tom-Latitude-3570.60470: tcp 0
07:49:40.618646 IP bb42-60-217-183.singnet.com.sg.8333 > tom-Latitude-3570.60470: tcp 0
07:49:40.678308 IP tom-Latitude-3570.57976 > 167.99.216.145.8333: tcp 24
07:49:40.679274 IP tom-Latitude-3570.57976 > 167.99.216.145.8333: tcp 433
07:49:40.719176 IP 167.99.216.145.8333 > tom-Latitude-3570.57976: tcp 0
07:49:40.733700 IP 167.99.216.145.8333 > tom-Latitude-3570.57976: tcp 0
07:49:40.879179 IP tom-Latitude-3570.46284 > static-87-75-105-186.vodafonexdsl.co.uk.8333: tcp 24
07:49:40.881245 IP tom-Latitude-3570.46284 > static-87-75-105-186.vodafonexdsl.co.uk.8333: tcp 541
07:49:40.881769 IP 167.99.216.145.8333 > tom-Latitude-3570.57976: tcp 24
07:49:40.881787 IP tom-Latitude-3570.57976 > 167.99.216.145.8333: tcp 0
07:49:40.881804 IP 167.99.216.145.8333 > tom-Latitude-3570.57976: tcp 73
07:49:40.881807 IP tom-Latitude-3570.57976 > 167.99.216.145.8333: tcp 0
07:49:40.929353 IP static-87-75-105-186.vodafonexdsl.co.uk.8333 > tom-Latitude-3570.46284: tcp 0
07:49:40.935842 IP static-87-75-105-186.vodafonexdsl.co.uk.8333 > tom-Latitude-3570.46284: tcp 0
07:49:41.176869 IP 2.56.9.15.8333 > tom-Latitude-3570.42516: tcp 24
07:49:41.176891 IP 2.56.9.15.8333 > tom-Latitude-3570.42516: tcp 145
07:49:41.176934 IP tom-Latitude-3570.42516 > 2.56.9.15.8333: tcp 0
07:49:41.177155 IP tom-Latitude-3570.42516 > 2.56.9.15.8333: tcp 24
07:49:41.179332 IP tom-Latitude-3570.42516 > 2.56.9.15.8333: tcp 109
07:49:41.222035 IP 2.56.9.15.8333 > tom-Latitude-3570.42516: tcp 0
07:49:41.222594 IP 2.56.9.15.8333 > tom-Latitude-3570.42516: tcp 0
07:49:41.427532 IP 2.56.9.15.8333 > tom-Latitude-3570.42516: tcp 24
07:49:41.427554 IP 2.56.9.15.8333 > tom-Latitude-3570.42516: tcp 247
07:49:41.427559 IP 2.56.9.15.8333 > tom-Latitude-3570.42516: tcp 24
07:49:41.427563 IP 2.56.9.15.8333 > tom-Latitude-3570.42516: tcp 246
07:49:41.427565 IP 2.56.9.15.8333 > tom-Latitude-3570.42516: tcp 24
07:49:41.427568 IP 2.56.9.15.8333 > tom-Latitude-3570.42516: tcp 225
07:49:41.427600 IP tom-Latitude-3570.42516 > 2.56.9.15.8333: tcp 0
07:49:41.791198 IP ns3113832.ip-54-38-177.eu.8333 > tom-Latitude-3570.56714: tcp 24
07:49:41.791216 IP ns3113832.ip-54-38-177.eu.8333 > tom-Latitude-3570.56714: tcp 73
07:49:41.791262 IP tom-Latitude-3570.56714 > ns3113832.ip-54-38-177.eu.8333: tcp 0
07:49:41.996012 IP static-87-75-105-186.vodafonexdsl.co.uk.8333 > tom-Latitude-3570.46284: tcp 24
07:49:41.996034 IP static-87-75-105-186.vodafonexdsl.co.uk.8333 > tom-Latitude-3570.46284: tcp 361
07:49:41.996078 IP tom-Latitude-3570.46284 > static-87-75-105-186.vodafonexdsl.co.uk.8333: tcp 0
07:49:41.996378 IP tom-Latitude-3570.46284 > static-87-75-105-186.vodafonexdsl.co.uk.8333: tcp 24
07:49:41.997671 IP tom-Latitude-3570.46284 > static-87-75-105-186.vodafonexdsl.co.uk.8333: tcp 253
07:49:42.038210 IP static-87-75-105-186.vodafonexdsl.co.uk.8333 > tom-Latitude-3570.46284: tcp 0
07:49:42.041436 IP static-87-75-105-186.vodafonexdsl.co.uk.8333 > tom-Latitude-3570.46284: tcp 0
07:49:42.105488 IP static-87-75-105-186.vodafonexdsl.co.uk.8333 > tom-Latitude-3570.46284: tcp 24
07:49:42.110042 IP static-87-75-105-186.vodafonexdsl.co.uk.8333 > tom-Latitude-3570.46284: tcp 662
07:49:42.110106 IP tom-Latitude-3570.46284 > static-87-75-105-186.vodafonexdsl.co.uk.8333: tcp 0
07:49:42.112576 IP static-87-75-105-186.vodafonexdsl.co.uk.8333 > tom-Latitude-3570.46284: tcp 24
07:49:42.112597 IP static-87-75-105-186.vodafonexdsl.co.uk.8333 > tom-Latitude-3570.46284: tcp 223
07:49:42.112601 IP static-87-75-105-186.vodafonexdsl.co.uk.8333 > tom-Latitude-3570.46284: tcp 24
07:49:42.112604 IP static-87-75-105-186.vodafonexdsl.co.uk.8333 > tom-Latitude-3570.46284: tcp 256
07:49:42.112611 IP static-87-75-105-186.vodafonexdsl.co.uk.8333 > tom-Latitude-3570.46284: tcp 24
07:49:42.112614 IP static-87-75-105-186.vodafonexdsl.co.uk.8333 > tom-Latitude-3570.46284: tcp 404
07:49:42.112619 IP static-87-75-105-186.vodafonexdsl.co.uk.8333 > tom-Latitude-3570.46284: tcp 24
07:49:42.112622 IP static-87-75-105-186.vodafonexdsl.co.uk.8333 > tom-Latitude-3570.46284: tcp 405
07:49:42.112642 IP static-87-75-105-186.vodafonexdsl.co.uk.8333 > tom-Latitude-3570.46284: tcp 24
07:49:42.112645 IP static-87-75-105-186.vodafonexdsl.co.uk.8333 > tom-Latitude-3570.46284: tcp 404
07:49:42.112649 IP static-87-75-105-186.vodafonexdsl.co.uk.8333 > tom-Latitude-3570.46284: tcp 24
07:49:42.112655 IP static-87-75-105-186.vodafonexdsl.co.uk.8333 > tom-Latitude-3570.46284: tcp 403
07:49:42.112676 IP tom-Latitude-3570.46284 > static-87-75-105-186.vodafonexdsl.co.uk.8333: tcp 0
07:49:42.112743 IP tom-Latitude-3570.46284 > static-87-75-105-186.vodafonexdsl.co.uk.8333: tcp 0
07:49:42.215152 IP tom-Latitude-3570.57976 > 167.99.216.145.8333: tcp 24
07:49:42.216190 IP tom-Latitude-3570.57976 > 167.99.216.145.8333: tcp 361
07:49:42.248963 IP 167.99.216.145.8333 > tom-Latitude-3570.57976: tcp 0
07:49:42.252626 IP 167.99.216.145.8333 > tom-Latitude-3570.57976: tcp 0
07:49:42.341206 IP 2.56.9.15.8333 > tom-Latitude-3570.42516: tcp 24
07:49:42.341228 IP 2.56.9.15.8333 > tom-Latitude-3570.42516: tcp 469
07:49:42.341270 IP tom-Latitude-3570.42516 > 2.56.9.15.8333: tcp 0
07:49:42.341582 IP tom-Latitude-3570.42516 > 2.56.9.15.8333: tcp 24
07:49:42.342621 IP tom-Latitude-3570.42516 > 2.56.9.15.8333: tcp 217
07:49:42.447905 IP tom-Latitude-3570.42516 > 2.56.9.15.8333: tcp 217
07:49:42.466233 IP 2.56.9.15.8333 > tom-Latitude-3570.42516: tcp 0
07:49:42.466248 IP 2.56.9.15.8333 > tom-Latitude-3570.42516: tcp 0
07:49:42.474279 IP 2.56.9.15.8333 > tom-Latitude-3570.42516: tcp 24
07:49:42.475141 IP 2.56.9.15.8333 > tom-Latitude-3570.42516: tcp 373
07:49:42.475164 IP 2.56.9.15.8333 > tom-Latitude-3570.42516: tcp 24
07:49:42.475245 IP tom-Latitude-3570.42516 > 2.56.9.15.8333: tcp 0
07:49:42.478146 IP 2.56.9.15.8333 > tom-Latitude-3570.42516: tcp 404
07:49:42.478165 IP 2.56.9.15.8333 > tom-Latitude-3570.42516: tcp 24
07:49:42.478170 IP 2.56.9.15.8333 > tom-Latitude-3570.42516: tcp 405
07:49:42.478173 IP 2.56.9.15.8333 > tom-Latitude-3570.42516: tcp 24
07:49:42.478176 IP 2.56.9.15.8333 > tom-Latitude-3570.42516: tcp 405
07:49:42.478181 IP 2.56.9.15.8333 > tom-Latitude-3570.42516: tcp 24
07:49:42.478214 IP tom-Latitude-3570.42516 > 2.56.9.15.8333: tcp 0
07:49:42.478581 IP 2.56.9.15.8333 > tom-Latitude-3570.42516: tcp 224
07:49:42.494186 IP 2.56.9.15.8333 > tom-Latitude-3570.42516: tcp 0
07:49:42.519912 IP tom-Latitude-3570.42516 > 2.56.9.15.8333: tcp 0
07:49:42.582096 IP tom-Latitude-3570.49070 > c-185-45-236-223.customer.ggaweb.ch.8333: tcp 24
07:49:42.595112 IP tom-Latitude-3570.49070 > c-185-45-236-223.customer.ggaweb.ch.8333: tcp 649
07:49:42.595669 IP 2.56.9.15.8333 > tom-Latitude-3570.42516: tcp 472
07:49:42.595701 IP tom-Latitude-3570.42516 > 2.56.9.15.8333: tcp 0
07:49:42.628488 IP c-185-45-236-223.customer.ggaweb.ch.8333 > tom-Latitude-3570.49070: tcp 0
07:49:42.631570 IP c-185-45-236-223.customer.ggaweb.ch.8333 > tom-Latitude-3570.49070: tcp 0
07:49:42.815229 IP vmi195435.contaboserver.net.8333 > tom-Latitude-3570.39110: tcp 24
07:49:42.815246 IP vmi195435.contaboserver.net.8333 > tom-Latitude-3570.39110: tcp 685
07:49:42.815263 IP tom-Latitude-3570.39110 > vmi195435.contaboserver.net.8333: tcp 0
07:49:42.815497 IP tom-Latitude-3570.39110 > vmi195435.contaboserver.net.8333: tcp 24
07:49:42.817180 IP tom-Latitude-3570.39110 > vmi195435.contaboserver.net.8333: tcp 109
07:49:42.860172 IP vmi195435.contaboserver.net.8333 > tom-Latitude-3570.39110: tcp 0
07:49:42.861869 IP vmi195435.contaboserver.net.8333 > tom-Latitude-3570.39110: tcp 0
07:49:42.938386 IP vmi195435.contaboserver.net.8333 > tom-Latitude-3570.39110: tcp 24
07:49:42.939988 IP vmi195435.contaboserver.net.8333 > tom-Latitude-3570.39110: tcp 222
07:49:42.940007 IP vmi195435.contaboserver.net.8333 > tom-Latitude-3570.39110: tcp 24
07:49:42.940011 IP vmi195435.contaboserver.net.8333 > tom-Latitude-3570.39110: tcp 338
07:49:42.940019 IP vmi195435.contaboserver.net.8333 > tom-Latitude-3570.39110: tcp 24
07:49:42.940022 IP vmi195435.contaboserver.net.8333 > tom-Latitude-3570.39110: tcp 404
07:49:42.940072 IP tom-Latitude-3570.39110 > vmi195435.contaboserver.net.8333: tcp 0
07:49:43.142221 IP tom-Latitude-3570.60470 > bb42-60-217-183.singnet.com.sg.8333: tcp 24
07:49:43.144313 IP tom-Latitude-3570.60470 > bb42-60-217-183.singnet.com.sg.8333: tcp 685
07:49:43.170278 IP bb42-60-217-183.singnet.com.sg.8333 > tom-Latitude-3570.60470: tcp 0
07:49:43.184126 IP bb42-60-217-183.singnet.com.sg.8333 > tom-Latitude-3570.60470: tcp 0
07:49:43.242649 IP tom-Latitude-3570.57976 > 167.99.216.145.8333: tcp 24
07:49:43.244644 IP tom-Latitude-3570.57976 > 167.99.216.145.8333: tcp 325
07:49:43.248300 IP bb42-60-217-183.singnet.com.sg.8333 > tom-Latitude-3570.60470: tcp 24
07:49:43.252116 IP bb42-60-217-183.singnet.com.sg.8333 > tom-Latitude-3570.60470: tcp 685
07:49:43.252178 IP tom-Latitude-3570.60470 > bb42-60-217-183.singnet.com.sg.8333: tcp 0
07:49:43.278521 IP 167.99.216.145.8333 > tom-Latitude-3570.57976: tcp 0
07:49:43.281916 IP 167.99.216.145.8333 > tom-Latitude-3570.57976: tcp 0
07:49:44.044402 IP 2.56.9.15.8333 > tom-Latitude-3570.42516: tcp 24
07:49:44.044428 IP tom-Latitude-3570.42516 > 2.56.9.15.8333: tcp 0
07:49:44.044446 IP 2.56.9.15.8333 > tom-Latitude-3570.42516: tcp 145
07:49:44.044451 IP tom-Latitude-3570.42516 > 2.56.9.15.8333: tcp 0
07:49:44.044456 IP 2.56.9.15.8333 > tom-Latitude-3570.42516: tcp 145
07:49:44.044458 IP tom-Latitude-3570.42516 > 2.56.9.15.8333: tcp 0
07:49:44.044666 IP tom-Latitude-3570.42516 > 2.56.9.15.8333: tcp 24
07:49:44.044783 IP tom-Latitude-3570.46284 > static-87-75-105-186.vodafonexdsl.co.uk.8333: tcp 24
07:49:44.047338 IP tom-Latitude-3570.42516 > 2.56.9.15.8333: tcp 37
07:49:44.048045 IP tom-Latitude-3570.46284 > static-87-75-105-186.vodafonexdsl.co.uk.8333: tcp 325
07:49:44.098629 IP 2.56.9.15.8333 > tom-Latitude-3570.42516: tcp 0
07:49:44.099224 IP 2.56.9.15.8333 > tom-Latitude-3570.42516: tcp 0
07:49:44.099237 IP static-87-75-105-186.vodafonexdsl.co.uk.8333 > tom-Latitude-3570.46284: tcp 0
07:49:44.099242 IP static-87-75-105-186.vodafonexdsl.co.uk.8333 > tom-Latitude-3570.46284: tcp 0
07:49:44.198588 IP 2.56.9.15.8333 > tom-Latitude-3570.42516: tcp 24
07:49:44.198609 IP 2.56.9.15.8333 > tom-Latitude-3570.42516: tcp 225
07:49:44.198655 IP tom-Latitude-3570.42516 > 2.56.9.15.8333: tcp 0
07:49:44.198975 IP tom-Latitude-3570.56714 > ns3113832.ip-54-38-177.eu.8333: tcp 24
07:49:44.200254 IP tom-Latitude-3570.56714 > ns3113832.ip-54-38-177.eu.8333: tcp 613
07:49:44.230482 IP ns3113832.ip-54-38-177.eu.8333 > tom-Latitude-3570.56714: tcp 0
07:49:44.239378 IP ns3113832.ip-54-38-177.eu.8333 > tom-Latitude-3570.56714: tcp 0
07:49:45.202457 IP tom-Latitude-3570.56714 > ns3113832.ip-54-38-177.eu.8333: tcp 24
07:49:45.204980 IP tom-Latitude-3570.56714 > ns3113832.ip-54-38-177.eu.8333: tcp 37
07:49:45.205548 IP vmi195435.contaboserver.net.8333 > tom-Latitude-3570.39110: tcp 24
07:49:45.205568 IP vmi195435.contaboserver.net.8333 > tom-Latitude-3570.39110: tcp 73
07:49:45.205571 IP vmi195435.contaboserver.net.8333 > tom-Latitude-3570.39110: tcp 73
07:49:45.205584 IP tom-Latitude-3570.39110 > vmi195435.contaboserver.net.8333: tcp 0
07:49:45.205781 IP tom-Latitude-3570.39110 > vmi195435.contaboserver.net.8333: tcp 24
07:49:45.209943 IP tom-Latitude-3570.39110 > vmi195435.contaboserver.net.8333: tcp 37
07:49:45.240591 IP ns3113832.ip-54-38-177.eu.8333 > tom-Latitude-3570.56714: tcp 0
07:49:45.240605 IP ns3113832.ip-54-38-177.eu.8333 > tom-Latitude-3570.56714: tcp 0
07:49:45.244031 IP vmi195435.contaboserver.net.8333 > tom-Latitude-3570.39110: tcp 0
07:49:45.244797 IP vmi195435.contaboserver.net.8333 > tom-Latitude-3570.39110: tcp 0
07:49:45.328396 IP vmi195435.contaboserver.net.8333 > tom-Latitude-3570.39110: tcp 24
07:49:45.328417 IP vmi195435.contaboserver.net.8333 > tom-Latitude-3570.39110: tcp 284
07:49:45.328459 IP tom-Latitude-3570.39110 > vmi195435.contaboserver.net.8333: tcp 0
07:49:46.095031 IP 81.198.101.144.8333 > tom-Latitude-3570.60988: tcp 24
07:49:46.095047 IP 81.198.101.144.8333 > tom-Latitude-3570.60988: tcp 793
07:49:46.095065 IP tom-Latitude-3570.60988 > 81.198.101.144.8333: tcp 0
07:49:46.095167 IP 81.198.101.144.8333 > tom-Latitude-3570.60988: tcp 793
07:49:46.095173 IP tom-Latitude-3570.60988 > 81.198.101.144.8333: tcp 0
07:49:46.095457 IP tom-Latitude-3570.60988 > 81.198.101.144.8333: tcp 24
07:49:46.098304 IP tom-Latitude-3570.60988 > 81.198.101.144.8333: tcp 37
07:49:46.125914 IP bb42-60-217-183.singnet.com.sg.8333 > tom-Latitude-3570.60470: tcp 24
07:49:46.126499 IP bb42-60-217-183.singnet.com.sg.8333 > tom-Latitude-3570.60470: tcp 109
07:49:46.126511 IP tom-Latitude-3570.60470 > bb42-60-217-183.singnet.com.sg.8333: tcp 0
07:49:46.146122 IP 81.198.101.144.8333 > tom-Latitude-3570.60988: tcp 0
07:49:46.154053 IP 81.198.101.144.8333 > tom-Latitude-3570.60988: tcp 0
07:49:46.241686 IP 81.198.101.144.8333 > tom-Latitude-3570.60988: tcp 24
07:49:46.242295 IP 81.198.101.144.8333 > tom-Latitude-3570.60988: tcp 343
07:49:46.242357 IP tom-Latitude-3570.60988 > 81.198.101.144.8333: tcp 0
07:49:46.343468 IP tom-Latitude-3570.60470 > bb42-60-217-183.singnet.com.sg.8333: tcp 24
07:49:46.343509 IP tom-Latitude-3570.46284 > static-87-75-105-186.vodafonexdsl.co.uk.8333: tcp 24
07:49:46.344633 IP tom-Latitude-3570.60470 > bb42-60-217-183.singnet.com.sg.8333: tcp 37
07:49:46.345564 IP tom-Latitude-3570.46284 > static-87-75-105-186.vodafonexdsl.co.uk.8333: tcp 37
07:49:46.380069 IP bb42-60-217-183.singnet.com.sg.8333 > tom-Latitude-3570.60470: tcp 0
07:49:46.388063 IP static-87-75-105-186.vodafonexdsl.co.uk.8333 > tom-Latitude-3570.46284: tcp 0
07:49:46.435176 IP static-87-75-105-186.vodafonexdsl.co.uk.8333 > tom-Latitude-3570.46284: tcp 0
07:49:46.435768 IP bb42-60-217-183.singnet.com.sg.8333 > tom-Latitude-3570.60470: tcp 0
07:49:46.462159 IP static-87-75-105-186.vodafonexdsl.co.uk.8333 > tom-Latitude-3570.46284: tcp 24
07:49:46.462709 IP static-87-75-105-186.vodafonexdsl.co.uk.8333 > tom-Latitude-3570.46284: tcp 284
07:49:46.462773 IP tom-Latitude-3570.46284 > static-87-75-105-186.vodafonexdsl.co.uk.8333: tcp 0
07:49:46.463177 IP tom-Latitude-3570.46284 > static-87-75-105-186.vodafonexdsl.co.uk.8333: tcp 24
07:49:46.464361 IP tom-Latitude-3570.46284 > static-87-75-105-186.vodafonexdsl.co.uk.8333: tcp 37
07:49:46.499173 IP static-87-75-105-186.vodafonexdsl.co.uk.8333 > tom-Latitude-3570.46284: tcp 0
07:49:46.499188 IP static-87-75-105-186.vodafonexdsl.co.uk.8333 > tom-Latitude-3570.46284: tcp 0
07:49:46.534049 IP ns3113832.ip-54-38-177.eu.8333 > tom-Latitude-3570.56714: tcp 24
07:49:46.534071 IP ns3113832.ip-54-38-177.eu.8333 > tom-Latitude-3570.56714: tcp 145
07:49:46.534114 IP tom-Latitude-3570.56714 > ns3113832.ip-54-38-177.eu.8333: tcp 0
07:49:46.534343 IP tom-Latitude-3570.56714 > ns3113832.ip-54-38-177.eu.8333: tcp 24
07:49:46.535635 IP tom-Latitude-3570.56714 > ns3113832.ip-54-38-177.eu.8333: tcp 73
07:49:46.566269 IP static-87-75-105-186.vodafonexdsl.co.uk.8333 > tom-Latitude-3570.46284: tcp 24
07:49:46.567314 IP static-87-75-105-186.vodafonexdsl.co.uk.8333 > tom-Latitude-3570.46284: tcp 284
07:49:46.567379 IP tom-Latitude-3570.46284 > static-87-75-105-186.vodafonexdsl.co.uk.8333: tcp 0
07:49:46.567888 IP tom-Latitude-3570.46284 > static-87-75-105-186.vodafonexdsl.co.uk.8333: tcp 24
07:49:46.569339 IP ns3113832.ip-54-38-177.eu.8333 > tom-Latitude-3570.56714: tcp 0
07:49:46.570257 IP tom-Latitude-3570.46284 > static-87-75-105-186.vodafonexdsl.co.uk.8333: tcp 37
07:49:46.578091 IP ns3113832.ip-54-38-177.eu.8333 > tom-Latitude-3570.56714: tcp 0
07:49:46.617463 IP static-87-75-105-186.vodafonexdsl.co.uk.8333 > tom-Latitude-3570.46284: tcp 0
07:49:46.617481 IP static-87-75-105-186.vodafonexdsl.co.uk.8333 > tom-Latitude-3570.46284: tcp 0
07:49:46.628300 IP ns3113832.ip-54-38-177.eu.8333 > tom-Latitude-3570.56714: tcp 24
07:49:46.628321 IP ns3113832.ip-54-38-177.eu.8333 > tom-Latitude-3570.56714: tcp 224
07:49:46.628326 IP ns3113832.ip-54-38-177.eu.8333 > tom-Latitude-3570.56714: tcp 24
07:49:46.628331 IP ns3113832.ip-54-38-177.eu.8333 > tom-Latitude-3570.56714: tcp 761
07:49:46.628367 IP tom-Latitude-3570.56714 > ns3113832.ip-54-38-177.eu.8333: tcp 0
07:49:46.628867 IP tom-Latitude-3570.57976 > 167.99.216.145.8333: tcp 24
07:49:46.629968 IP tom-Latitude-3570.57976 > 167.99.216.145.8333: tcp 145
07:49:46.676539 IP 167.99.216.145.8333 > tom-Latitude-3570.57976: tcp 0
07:49:46.680087 IP 167.99.216.145.8333 > tom-Latitude-3570.57976: tcp 0
07:49:46.683982 IP static-87-75-105-186.vodafonexdsl.co.uk.8333 > tom-Latitude-3570.46284: tcp 24
07:49:46.686565 IP static-87-75-105-186.vodafonexdsl.co.uk.8333 > tom-Latitude-3570.46284: tcp 284
07:49:46.686670 IP tom-Latitude-3570.46284 > static-87-75-105-186.vodafonexdsl.co.uk.8333: tcp 0
07:49:46.686844 IP tom-Latitude-3570.42516 > 2.56.9.15.8333: tcp 24
07:49:46.687259 IP tom-Latitude-3570.46284 > static-87-75-105-186.vodafonexdsl.co.uk.8333: tcp 24
07:49:46.688695 IP tom-Latitude-3570.42516 > 2.56.9.15.8333: tcp 145
07:49:46.689408 IP tom-Latitude-3570.46284 > static-87-75-105-186.vodafonexdsl.co.uk.8333: tcp 37
07:49:46.720698 IP 2.56.9.15.8333 > tom-Latitude-3570.42516: tcp 0
07:49:46.721340 IP 2.56.9.15.8333 > tom-Latitude-3570.42516: tcp 0
07:49:46.721354 IP static-87-75-105-186.vodafonexdsl.co.uk.8333 > tom-Latitude-3570.46284: tcp 0
07:49:46.721358 IP static-87-75-105-186.vodafonexdsl.co.uk.8333 > tom-Latitude-3570.46284: tcp 0
07:49:46.775455 IP bb42-60-217-183.singnet.com.sg.8333 > tom-Latitude-3570.60470: tcp 24
07:49:46.778877 IP bb42-60-217-183.singnet.com.sg.8333 > tom-Latitude-3570.60470: tcp 284
07:49:46.778941 IP tom-Latitude-3570.60470 > bb42-60-217-183.singnet.com.sg.8333: tcp 0
07:49:46.779357 IP tom-Latitude-3570.60470 > bb42-60-217-183.singnet.com.sg.8333: tcp 24
07:49:46.780317 IP tom-Latitude-3570.60470 > bb42-60-217-183.singnet.com.sg.8333: tcp 37
07:49:46.789165 IP static-87-75-105-186.vodafonexdsl.co.uk.8333 > tom-Latitude-3570.46284: tcp 24
07:49:46.789177 IP static-87-75-105-186.vodafonexdsl.co.uk.8333 > tom-Latitude-3570.46284: tcp 283
07:49:46.789214 IP tom-Latitude-3570.46284 > static-87-75-105-186.vodafonexdsl.co.uk.8333: tcp 0
07:49:46.789487 IP tom-Latitude-3570.46284 > static-87-75-105-186.vodafonexdsl.co.uk.8333: tcp 24
07:49:46.790652 IP tom-Latitude-3570.46284 > static-87-75-105-186.vodafonexdsl.co.uk.8333: tcp 37
07:49:46.816138 IP 2.56.9.15.8333 > tom-Latitude-3570.42516: tcp 24
07:49:46.816155 IP 2.56.9.15.8333 > tom-Latitude-3570.42516: tcp 145
07:49:46.816198 IP tom-Latitude-3570.42516 > 2.56.9.15.8333: tcp 0
07:49:46.816338 IP tom-Latitude-3570.42516 > 2.56.9.15.8333: tcp 24
07:49:46.818181 IP tom-Latitude-3570.42516 > 2.56.9.15.8333: tcp 37
07:49:46.818746 IP bb42-60-217-183.singnet.com.sg.8333 > tom-Latitude-3570.60470: tcp 0
07:49:46.818753 IP bb42-60-217-183.singnet.com.sg.8333 > tom-Latitude-3570.60470: tcp 0
07:49:46.818755 IP static-87-75-105-186.vodafonexdsl.co.uk.8333 > tom-Latitude-3570.46284: tcp 0
07:49:46.821304 IP static-87-75-105-186.vodafonexdsl.co.uk.8333 > tom-Latitude-3570.46284: tcp 0
07:49:46.916595 IP tom-Latitude-3570.49070 > c-185-45-236-223.customer.ggaweb.ch.8333: tcp 24
07:49:46.939920 IP tom-Latitude-3570.42516 > 2.56.9.15.8333: tcp 37
07:49:46.960509 IP 2.56.9.15.8333 > tom-Latitude-3570.42516: tcp 0
07:49:46.960524 IP 2.56.9.15.8333 > tom-Latitude-3570.42516: tcp 0
07:49:46.960527 IP static-87-75-105-186.vodafonexdsl.co.uk.8333 > tom-Latitude-3570.46284: tcp 24
07:49:46.960595 IP static-87-75-105-186.vodafonexdsl.co.uk.8333 > tom-Latitude-3570.46284: tcp 283
07:49:46.960621 IP tom-Latitude-3570.46284 > static-87-75-105-186.vodafonexdsl.co.uk.8333: tcp 0
07:49:46.961848 IP 2.56.9.15.8333 > tom-Latitude-3570.42516: tcp 24
07:49:46.962066 IP tom-Latitude-3570.46284 > static-87-75-105-186.vodafonexdsl.co.uk.8333: tcp 24
07:49:46.969909 IP tom-Latitude-3570.49070 > c-185-45-236-223.customer.ggaweb.ch.8333: tcp 325
07:49:46.970453 IP 2.56.9.15.8333 > tom-Latitude-3570.42516: tcp 226
07:49:46.970510 IP tom-Latitude-3570.42516 > 2.56.9.15.8333: tcp 0
07:49:46.972854 IP tom-Latitude-3570.46284 > static-87-75-105-186.vodafonexdsl.co.uk.8333: tcp 37
07:49:46.983912 IP static-87-75-105-186.vodafonexdsl.co.uk.8333 > tom-Latitude-3570.46284: tcp 283
07:49:46.983948 IP tom-Latitude-3570.46284 > static-87-75-105-186.vodafonexdsl.co.uk.8333: tcp 0
07:49:47.002385 IP c-185-45-236-223.customer.ggaweb.ch.8333 > tom-Latitude-3570.49070: tcp 0
07:49:47.002398 IP 2.56.9.15.8333 > tom-Latitude-3570.42516: tcp 0
07:49:47.002404 IP static-87-75-105-186.vodafonexdsl.co.uk.8333 > tom-Latitude-3570.46284: tcp 0
07:49:47.005179 IP c-185-45-236-223.customer.ggaweb.ch.8333 > tom-Latitude-3570.49070: tcp 0
07:49:47.007887 IP static-87-75-105-186.vodafonexdsl.co.uk.8333 > tom-Latitude-3570.46284: tcp 0
07:49:47.078145 IP static-87-75-105-186.vodafonexdsl.co.uk.8333 > tom-Latitude-3570.46284: tcp 24
07:49:47.078162 IP tom-Latitude-3570.46284 > static-87-75-105-186.vodafonexdsl.co.uk.8333: tcp 0
07:49:47.078855 IP static-87-75-105-186.vodafonexdsl.co.uk.8333 > tom-Latitude-3570.46284: tcp 283
07:49:47.078881 IP tom-Latitude-3570.46284 > static-87-75-105-186.vodafonexdsl.co.uk.8333: tcp 0
07:49:47.079368 IP tom-Latitude-3570.46284 > static-87-75-105-186.vodafonexdsl.co.uk.8333: tcp 24
07:49:47.081329 IP tom-Latitude-3570.46284 > static-87-75-105-186.vodafonexdsl.co.uk.8333: tcp 37
07:49:47.118152 IP static-87-75-105-186.vodafonexdsl.co.uk.8333 > tom-Latitude-3570.46284: tcp 0
07:49:47.118829 IP static-87-75-105-186.vodafonexdsl.co.uk.8333 > tom-Latitude-3570.46284: tcp 0
07:49:47.179707 IP tom-Latitude-3570.49070 > c-185-45-236-223.customer.ggaweb.ch.8333: tcp 24
07:49:47.179818 IP tom-Latitude-3570.60988 > 81.198.101.144.8333: tcp 24
07:49:47.180645 IP tom-Latitude-3570.49070 > c-185-45-236-223.customer.ggaweb.ch.8333: tcp 37
07:49:47.181315 IP tom-Latitude-3570.60988 > 81.198.101.144.8333: tcp 109
07:49:47.183146 IP static-87-75-105-186.vodafonexdsl.co.uk.8333 > tom-Latitude-3570.46284: tcp 24
07:49:47.184448 IP static-87-75-105-186.vodafonexdsl.co.uk.8333 > tom-Latitude-3570.46284: tcp 283
07:49:47.184513 IP tom-Latitude-3570.46284 > static-87-75-105-186.vodafonexdsl.co.uk.8333: tcp 0
07:49:47.184950 IP tom-Latitude-3570.46284 > static-87-75-105-186.vodafonexdsl.co.uk.8333: tcp 24
07:49:47.186022 IP tom-Latitude-3570.46284 > static-87-75-105-186.vodafonexdsl.co.uk.8333: tcp 37
07:49:47.200143 IP bb42-60-217-183.singnet.com.sg.8333 > tom-Latitude-3570.60470: tcp 24
07:49:47.200786 IP bb42-60-217-183.singnet.com.sg.8333 > tom-Latitude-3570.60470: tcp 283
07:49:47.200850 IP tom-Latitude-3570.60470 > bb42-60-217-183.singnet.com.sg.8333: tcp 0
07:49:47.201250 IP tom-Latitude-3570.60470 > bb42-60-217-183.singnet.com.sg.8333: tcp 24
07:49:47.202368 IP tom-Latitude-3570.60470 > bb42-60-217-183.singnet.com.sg.8333: tcp 37
07:49:47.213212 IP 81.198.101.144.8333 > tom-Latitude-3570.60988: tcp 0
07:49:47.220265 IP c-185-45-236-223.customer.ggaweb.ch.8333 > tom-Latitude-3570.49070: tcp 0
07:49:47.220826 IP c-185-45-236-223.customer.ggaweb.ch.8333 > tom-Latitude-3570.49070: tcp 0
07:49:47.220842 IP 81.198.101.144.8333 > tom-Latitude-3570.60988: tcp 0
07:49:47.220844 IP static-87-75-105-186.vodafonexdsl.co.uk.8333 > tom-Latitude-3570.46284: tcp 0
07:49:47.223924 IP static-87-75-105-186.vodafonexdsl.co.uk.8333 > tom-Latitude-3570.46284: tcp 0
07:49:47.227899 IP bb42-60-217-183.singnet.com.sg.8333 > tom-Latitude-3570.60470: tcp 0
07:49:47.234476 IP bb42-60-217-183.singnet.com.sg.8333 > tom-Latitude-3570.60470: tcp 0
07:49:47.288063 IP static-87-75-105-186.vodafonexdsl.co.uk.8333 > tom-Latitude-3570.46284: tcp 24
07:49:47.289088 IP static-87-75-105-186.vodafonexdsl.co.uk.8333 > tom-Latitude-3570.46284: tcp 283
07:49:47.289114 IP tom-Latitude-3570.46284 > static-87-75-105-186.vodafonexdsl.co.uk.8333: tcp 0
07:49:47.289476 IP tom-Latitude-3570.46284 > static-87-75-105-186.vodafonexdsl.co.uk.8333: tcp 24
07:49:47.290908 IP tom-Latitude-3570.46284 > static-87-75-105-186.vodafonexdsl.co.uk.8333: tcp 37
07:49:47.309163 IP 81.198.101.144.8333 > tom-Latitude-3570.60988: tcp 24
07:49:47.309170 IP 81.198.101.144.8333 > tom-Latitude-3570.60988: tcp 37
07:49:47.309185 IP tom-Latitude-3570.60988 > 81.198.101.144.8333: tcp 0
07:49:47.309238 IP tom-Latitude-3570.60988 > 81.198.101.144.8333: tcp 24
07:49:47.310563 IP tom-Latitude-3570.60988 > 81.198.101.144.8333: tcp 226
07:49:47.320000 IP static-87-75-105-186.vodafonexdsl.co.uk.8333 > tom-Latitude-3570.46284: tcp 0
07:49:47.320680 IP static-87-75-105-186.vodafonexdsl.co.uk.8333 > tom-Latitude-3570.46284: tcp 0
07:49:47.349964 IP 81.198.101.144.8333 > tom-Latitude-3570.60988: tcp 0
07:49:47.351931 IP 81.198.101.144.8333 > tom-Latitude-3570.60988: tcp 0
07:49:47.386379 IP static-87-75-105-186.vodafonexdsl.co.uk.8333 > tom-Latitude-3570.46284: tcp 24
07:49:47.386387 IP static-87-75-105-186.vodafonexdsl.co.uk.8333 > tom-Latitude-3570.46284: tcp 283
07:49:47.386401 IP tom-Latitude-3570.46284 > static-87-75-105-186.vodafonexdsl.co.uk.8333: tcp 0
07:49:47.386582 IP tom-Latitude-3570.46284 > static-87-75-105-186.vodafonexdsl.co.uk.8333: tcp 24
07:49:47.387777 IP tom-Latitude-3570.46284 > static-87-75-105-186.vodafonexdsl.co.uk.8333: tcp 37
07:49:47.430036 IP static-87-75-105-186.vodafonexdsl.co.uk.8333 > tom-Latitude-3570.46284: tcp 0
07:49:47.430617 IP static-87-75-105-186.vodafonexdsl.co.uk.8333 > tom-Latitude-3570.46284: tcp 0
07:49:47.495080 IP static-87-75-105-186.vodafonexdsl.co.uk.8333 > tom-Latitude-3570.46284: tcp 24
07:49:47.499014 IP static-87-75-105-186.vodafonexdsl.co.uk.8333 > tom-Latitude-3570.46284: tcp 283
07:49:47.499035 IP tom-Latitude-3570.46284 > static-87-75-105-186.vodafonexdsl.co.uk.8333: tcp 0
07:49:47.499099 IP tom-Latitude-3570.39110 > vmi195435.contaboserver.net.8333: tcp 24
07:49:47.499217 IP tom-Latitude-3570.46284 > static-87-75-105-186.vodafonexdsl.co.uk.8333: tcp 24
07:49:47.500466 IP tom-Latitude-3570.39110 > vmi195435.contaboserver.net.8333: tcp 145
07:49:47.501399 IP tom-Latitude-3570.46284 > static-87-75-105-186.vodafonexdsl.co.uk.8333: tcp 37
07:49:47.539005 IP vmi195435.contaboserver.net.8333 > tom-Latitude-3570.39110: tcp 0
07:49:47.539010 IP static-87-75-105-186.vodafonexdsl.co.uk.8333 > tom-Latitude-3570.46284: tcp 0
07:49:47.539012 IP vmi195435.contaboserver.net.8333 > tom-Latitude-3570.39110: tcp 0
07:49:47.539014 IP static-87-75-105-186.vodafonexdsl.co.uk.8333 > tom-Latitude-3570.46284: tcp 0
07:49:47.605103 IP static-87-75-105-186.vodafonexdsl.co.uk.8333 > tom-Latitude-3570.46284: tcp 24
07:49:47.605111 IP static-87-75-105-186.vodafonexdsl.co.uk.8333 > tom-Latitude-3570.46284: tcp 283
07:49:47.605125 IP tom-Latitude-3570.46284 > static-87-75-105-186.vodafonexdsl.co.uk.8333: tcp 0
07:49:47.623130 IP bb42-60-217-183.singnet.com.sg.8333 > tom-Latitude-3570.60470: tcp 24
07:49:47.623138 IP bb42-60-217-183.singnet.com.sg.8333 > tom-Latitude-3570.60470: tcp 284
07:49:47.623152 IP tom-Latitude-3570.60470 > bb42-60-217-183.singnet.com.sg.8333: tcp 0
07:49:47.623324 IP tom-Latitude-3570.60470 > bb42-60-217-183.singnet.com.sg.8333: tcp 24
07:49:47.626288 IP tom-Latitude-3570.60470 > bb42-60-217-183.singnet.com.sg.8333: tcp 37
07:49:47.716059 IP bb42-60-217-183.singnet.com.sg.8333 > tom-Latitude-3570.60470: tcp 0
07:49:47.716064 IP bb42-60-217-183.singnet.com.sg.8333 > tom-Latitude-3570.60470: tcp 0
