07:04:24.461823 IP tom-Latitude-3570.49070 > c-185-45-236-223.customer.ggaweb.ch.8333: tcp 24
07:04:24.461903 IP tom-Latitude-3570.60988 > 81.198.101.144.8333: tcp 24
07:04:24.464833 IP tom-Latitude-3570.49070 > c-185-45-236-223.customer.ggaweb.ch.8333: tcp 37
07:04:24.465399 IP tom-Latitude-3570.60988 > 81.198.101.144.8333: tcp 181
07:04:24.492175 IP 81.198.101.144.8333 > tom-Latitude-3570.60988: tcp 0
07:04:24.500438 IP c-185-45-236-223.customer.ggaweb.ch.8333 > tom-Latitude-3570.49070: tcp 0
07:04:24.500452 IP c-185-45-236-223.customer.ggaweb.ch.8333 > tom-Latitude-3570.49070: tcp 0
07:04:24.503687 IP 81.198.101.144.8333 > tom-Latitude-3570.60988: tcp 0
07:04:24.585368 IP c-185-45-236-223.customer.ggaweb.ch.8333 > tom-Latitude-3570.49070: tcp 24
07:04:24.585385 IP tom-Latitude-3570.49070 > c-185-45-236-223.customer.ggaweb.ch.8333: tcp 0
07:04:24.585404 IP c-185-45-236-223.customer.ggaweb.ch.8333 > tom-Latitude-3570.49070: tcp 283
07:04:24.585408 IP tom-Latitude-3570.49070 > c-185-45-236-223.customer.ggaweb.ch.8333: tcp 0
07:04:24.773995 IP 167.99.216.145.8333 > tom-Latitude-3570.57976: tcp 24
07:04:24.774016 IP 167.99.216.145.8333 > tom-Latitude-3570.57976: tcp 469
07:04:24.774107 IP tom-Latitude-3570.57976 > 167.99.216.145.8333: tcp 0
07:04:24.774427 IP tom-Latitude-3570.57976 > 167.99.216.145.8333: tcp 24
07:04:24.775577 IP tom-Latitude-3570.57976 > 167.99.216.145.8333: tcp 289
07:04:24.818049 IP 167.99.216.145.8333 > tom-Latitude-3570.57976: tcp 0
07:04:24.825907 IP 167.99.216.145.8333 > tom-Latitude-3570.57976: tcp 0
07:04:24.888581 IP 167.99.216.145.8333 > tom-Latitude-3570.57976: tcp 24
07:04:24.889392 IP 167.99.216.145.8333 > tom-Latitude-3570.57976: tcp 224
07:04:24.889398 IP 167.99.216.145.8333 > tom-Latitude-3570.57976: tcp 24
07:04:24.889401 IP 167.99.216.145.8333 > tom-Latitude-3570.57976: tcp 668
07:04:24.889403 IP 167.99.216.145.8333 > tom-Latitude-3570.57976: tcp 24
07:04:24.889405 IP 167.99.216.145.8333 > tom-Latitude-3570.57976: tcp 256
07:04:24.889407 IP 167.99.216.145.8333 > tom-Latitude-3570.57976: tcp 24
07:04:24.889408 IP tom-Latitude-3570.57976 > 167.99.216.145.8333: tcp 0
07:04:24.889450 IP tom-Latitude-3570.57976 > 167.99.216.145.8333: tcp 0
07:04:24.951746 IP 167.99.216.145.8333 > tom-Latitude-3570.57976: tcp 1448
07:04:24.951764 IP 167.99.216.145.8333 > tom-Latitude-3570.57976: tcp 7
07:04:24.951859 IP tom-Latitude-3570.57976 > 167.99.216.145.8333: tcp 0
07:04:24.952281 IP tom-Latitude-3570.46284 > static-87-75-105-186.vodafonexdsl.co.uk.8333: tcp 24
07:04:24.953338 IP tom-Latitude-3570.46284 > static-87-75-105-186.vodafonexdsl.co.uk.8333: tcp 145
07:04:24.980671 IP 81.198.101.144.8333 > tom-Latitude-3570.60988: tcp 24
07:04:24.981240 IP 81.198.101.144.8333 > tom-Latitude-3570.60988: tcp 37
07:04:24.981256 IP static-87-75-105-186.vodafonexdsl.co.uk.8333 > tom-Latitude-3570.46284: tcp 0
07:04:24.981262 IP static-87-75-105-186.vodafonexdsl.co.uk.8333 > tom-Latitude-3570.46284: tcp 0
07:04:24.981349 IP tom-Latitude-3570.60988 > 81.198.101.144.8333: tcp 0
07:04:24.981438 IP tom-Latitude-3570.60988 > 81.198.101.144.8333: tcp 24
07:04:24.983519 IP tom-Latitude-3570.60988 > 81.198.101.144.8333: tcp 256
07:04:25.028900 IP 81.198.101.144.8333 > tom-Latitude-3570.60988: tcp 0
07:04:25.028914 IP 81.198.101.144.8333 > tom-Latitude-3570.60988: tcp 0
07:04:25.121063 IP 81.198.101.144.8333 > tom-Latitude-3570.60988: tcp 24
07:04:25.128174 IP 81.198.101.144.8333 > tom-Latitude-3570.60988: tcp 54
07:04:25.128303 IP tom-Latitude-3570.60988 > 81.198.101.144.8333: tcp 0
07:04:25.189246 IP 2.56.9.15.8333 > tom-Latitude-3570.42516: tcp 24
07:04:25.189270 IP tom-Latitude-3570.42516 > 2.56.9.15.8333: tcp 0
07:04:25.189850 IP 2.56.9.15.8333 > tom-Latitude-3570.42516: tcp 361
07:04:25.189874 IP tom-Latitude-3570.42516 > 2.56.9.15.8333: tcp 0
07:04:25.190155 IP tom-Latitude-3570.42516 > 2.56.9.15.8333: tcp 24
07:04:25.191718 IP tom-Latitude-3570.42516 > 2.56.9.15.8333: tcp 73
07:04:25.220145 IP 2.56.9.15.8333 > tom-Latitude-3570.42516: tcp 0
07:04:25.223394 IP 2.56.9.15.8333 > tom-Latitude-3570.42516: tcp 0
07:04:25.315706 IP 2.56.9.15.8333 > tom-Latitude-3570.42516: tcp 24
07:04:25.315726 IP 2.56.9.15.8333 > tom-Latitude-3570.42516: tcp 257
07:04:25.315823 IP tom-Latitude-3570.42516 > 2.56.9.15.8333: tcp 0
07:04:25.318565 IP 2.56.9.15.8333 > tom-Latitude-3570.42516: tcp 24
07:04:25.319209 IP 2.56.9.15.8333 > tom-Latitude-3570.42516: tcp 256
07:04:25.319339 IP tom-Latitude-3570.42516 > 2.56.9.15.8333: tcp 0
07:04:25.420094 IP tom-Latitude-3570.60988 > 81.198.101.144.8333: tcp 24
07:04:25.421236 IP tom-Latitude-3570.60988 > 81.198.101.144.8333: tcp 361
07:04:25.453428 IP 81.198.101.144.8333 > tom-Latitude-3570.60988: tcp 0
07:04:25.477027 IP 81.198.101.144.8333 > tom-Latitude-3570.60988: tcp 0
07:04:25.620920 IP tom-Latitude-3570.60470 > bb42-60-217-183.singnet.com.sg.8333: tcp 24
07:04:25.623214 IP tom-Latitude-3570.60470 > bb42-60-217-183.singnet.com.sg.8333: tcp 541
07:04:25.652895 IP bb42-60-217-183.singnet.com.sg.8333 > tom-Latitude-3570.60470: tcp 0
07:04:25.663847 IP bb42-60-217-183.singnet.com.sg.8333 > tom-Latitude-3570.60470: tcp 0
07:04:25.922072 IP tom-Latitude-3570.49070 > c-185-45-236-223.customer.ggaweb.ch.8333: tcp 24
07:04:25.924262 IP tom-Latitude-3570.49070 > c-185-45-236-223.customer.ggaweb.ch.8333: tcp 505
07:04:25.951270 IP c-185-45-236-223.customer.ggaweb.ch.8333 > tom-Latitude-3570.49070: tcp 0
07:04:25.965440 IP c-185-45-236-223.customer.ggaweb.ch.8333 > tom-Latitude-3570.49070: tcp 0
07:04:26.022548 IP tom-Latitude-3570.39110 > vmi195435.contaboserver.net.8333: tcp 24
07:04:26.023503 IP tom-Latitude-3570.39110 > vmi195435.contaboserver.net.8333: tcp 541
07:04:26.026237 IP 167.99.216.145.8333 > tom-Latitude-3570.57976: tcp 24
07:04:26.026258 IP 167.99.216.145.8333 > tom-Latitude-3570.57976: tcp 145
07:04:26.026349 IP tom-Latitude-3570.57976 > 167.99.216.145.8333: tcp 0
07:04:26.026530 IP tom-Latitude-3570.57976 > 167.99.216.145.8333: tcp 24
07:04:26.028230 IP tom-Latitude-3570.57976 > 167.99.216.145.8333: tcp 73
07:04:26.059363 IP vmi195435.contaboserver.net.8333 > tom-Latitude-3570.39110: tcp 0
07:04:26.070190 IP vmi195435.contaboserver.net.8333 > tom-Latitude-3570.39110: tcp 0
07:04:26.070858 IP 167.99.216.145.8333 > tom-Latitude-3570.57976: tcp 0
07:04:26.070872 IP 167.99.216.145.8333 > tom-Latitude-3570.57976: tcp 0
07:04:26.132514 IP 167.99.216.145.8333 > tom-Latitude-3570.57976: tcp 24
07:04:26.133291 IP 167.99.216.145.8333 > tom-Latitude-3570.57976: tcp 370
07:04:26.133309 IP 167.99.216.145.8333 > tom-Latitude-3570.57976: tcp 24
07:04:26.133313 IP 167.99.216.145.8333 > tom-Latitude-3570.57976: tcp 257
07:04:26.133403 IP tom-Latitude-3570.57976 > 167.99.216.145.8333: tcp 0
07:04:26.582573 IP ns3113832.ip-54-38-177.eu.8333 > tom-Latitude-3570.56714: tcp 24
07:04:26.582594 IP ns3113832.ip-54-38-177.eu.8333 > tom-Latitude-3570.56714: tcp 613
07:04:26.582598 IP ns3113832.ip-54-38-177.eu.8333 > tom-Latitude-3570.56714: tcp 613
07:04:26.582626 IP tom-Latitude-3570.56714 > ns3113832.ip-54-38-177.eu.8333: tcp 0
07:04:26.582927 IP tom-Latitude-3570.56714 > ns3113832.ip-54-38-177.eu.8333: tcp 24
07:04:26.584099 IP tom-Latitude-3570.56714 > ns3113832.ip-54-38-177.eu.8333: tcp 37
07:04:26.603162 IP ns3113832.ip-54-38-177.eu.8333 > tom-Latitude-3570.56714: tcp 0
07:04:26.603177 IP ns3113832.ip-54-38-177.eu.8333 > tom-Latitude-3570.56714: tcp 0
07:04:26.628288 IP vmi195435.contaboserver.net.8333 > tom-Latitude-3570.39110: tcp 24
07:04:26.629215 IP vmi195435.contaboserver.net.8333 > tom-Latitude-3570.39110: tcp 109
07:04:26.629342 IP tom-Latitude-3570.39110 > vmi195435.contaboserver.net.8333: tcp 0
07:04:26.658498 IP ns3113832.ip-54-38-177.eu.8333 > tom-Latitude-3570.56714: tcp 24
07:04:26.659078 IP ns3113832.ip-54-38-177.eu.8333 > tom-Latitude-3570.56714: tcp 257
07:04:26.659191 IP tom-Latitude-3570.56714 > ns3113832.ip-54-38-177.eu.8333: tcp 0
07:04:26.659299 IP tom-Latitude-3570.60988 > 81.198.101.144.8333: tcp 24
07:04:26.661257 IP tom-Latitude-3570.60988 > 81.198.101.144.8333: tcp 73
07:04:26.699245 IP 81.198.101.144.8333 > tom-Latitude-3570.60988: tcp 0
07:04:26.699931 IP 81.198.101.144.8333 > tom-Latitude-3570.60988: tcp 0
07:04:27.610137 IP c-185-45-236-223.customer.ggaweb.ch.8333 > tom-Latitude-3570.49070: tcp 24
07:04:27.610161 IP tom-Latitude-3570.49070 > c-185-45-236-223.customer.ggaweb.ch.8333: tcp 0
07:04:27.610195 IP c-185-45-236-223.customer.ggaweb.ch.8333 > tom-Latitude-3570.49070: tcp 253
07:04:27.610199 IP tom-Latitude-3570.49070 > c-185-45-236-223.customer.ggaweb.ch.8333: tcp 0
07:04:27.610204 IP c-185-45-236-223.customer.ggaweb.ch.8333 > tom-Latitude-3570.49070: tcp 253
07:04:27.610206 IP tom-Latitude-3570.49070 > c-185-45-236-223.customer.ggaweb.ch.8333: tcp 0
07:04:27.610487 IP tom-Latitude-3570.49070 > c-185-45-236-223.customer.ggaweb.ch.8333: tcp 24
07:04:27.612917 IP tom-Latitude-3570.49070 > c-185-45-236-223.customer.ggaweb.ch.8333: tcp 145
07:04:27.633777 IP c-185-45-236-223.customer.ggaweb.ch.8333 > tom-Latitude-3570.49070: tcp 0
07:04:27.638348 IP c-185-45-236-223.customer.ggaweb.ch.8333 > tom-Latitude-3570.49070: tcp 0
07:04:27.743517 IP c-185-45-236-223.customer.ggaweb.ch.8333 > tom-Latitude-3570.49070: tcp 24
07:04:27.743538 IP c-185-45-236-223.customer.ggaweb.ch.8333 > tom-Latitude-3570.49070: tcp 1064
07:04:27.743627 IP tom-Latitude-3570.49070 > c-185-45-236-223.customer.ggaweb.ch.8333: tcp 0
07:04:27.845153 IP tom-Latitude-3570.57976 > 167.99.216.145.8333: tcp 24
07:04:27.846362 IP tom-Latitude-3570.57976 > 167.99.216.145.8333: tcp 181
07:04:27.877197 IP 167.99.216.145.8333 > tom-Latitude-3570.57976: tcp 0
07:04:27.877771 IP 167.99.216.145.8333 > tom-Latitude-3570.57976: tcp 0
07:04:28.045682 IP tom-Latitude-3570.39110 > vmi195435.contaboserver.net.8333: tcp 24
07:04:28.099982 IP tom-Latitude-3570.39110 > vmi195435.contaboserver.net.8333: tcp 145
07:04:28.128877 IP vmi195435.contaboserver.net.8333 > tom-Latitude-3570.39110: tcp 0
07:04:28.143862 IP vmi195435.contaboserver.net.8333 > tom-Latitude-3570.39110: tcp 0
07:04:28.630630 IP static-87-75-105-186.vodafonexdsl.co.uk.8333 > tom-Latitude-3570.46284: tcp 24
07:04:28.630653 IP static-87-75-105-186.vodafonexdsl.co.uk.8333 > tom-Latitude-3570.46284: tcp 505
07:04:28.630657 IP static-87-75-105-186.vodafonexdsl.co.uk.8333 > tom-Latitude-3570.46284: tcp 505
07:04:28.630686 IP tom-Latitude-3570.46284 > static-87-75-105-186.vodafonexdsl.co.uk.8333: tcp 0
07:04:28.630702 IP bb42-60-217-183.singnet.com.sg.8333 > tom-Latitude-3570.60470: tcp 24
07:04:28.630705 IP tom-Latitude-3570.60470 > bb42-60-217-183.singnet.com.sg.8333: tcp 0
07:04:28.630722 IP bb42-60-217-183.singnet.com.sg.8333 > tom-Latitude-3570.60470: tcp 289
07:04:28.630726 IP tom-Latitude-3570.60470 > bb42-60-217-183.singnet.com.sg.8333: tcp 0
07:04:28.630997 IP tom-Latitude-3570.60470 > bb42-60-217-183.singnet.com.sg.8333: tcp 24
07:04:28.633461 IP tom-Latitude-3570.60470 > bb42-60-217-183.singnet.com.sg.8333: tcp 37
07:04:28.659435 IP bb42-60-217-183.singnet.com.sg.8333 > tom-Latitude-3570.60470: tcp 0
07:04:28.662911 IP bb42-60-217-183.singnet.com.sg.8333 > tom-Latitude-3570.60470: tcp 0
07:04:29.449847 IP bb42-60-217-183.singnet.com.sg.8333 > tom-Latitude-3570.60470: tcp 24
07:04:29.449867 IP bb42-60-217-183.singnet.com.sg.8333 > tom-Latitude-3570.60470: tcp 373
07:04:29.449877 IP bb42-60-217-183.singnet.com.sg.8333 > tom-Latitude-3570.60470: tcp 373
07:04:29.449908 IP tom-Latitude-3570.60470 > bb42-60-217-183.singnet.com.sg.8333: tcp 0
07:04:29.449928 IP 167.99.216.145.8333 > tom-Latitude-3570.57976: tcp 24
07:04:29.449946 IP 167.99.216.145.8333 > tom-Latitude-3570.57976: tcp 649
07:04:29.450018 IP tom-Latitude-3570.57976 > 167.99.216.145.8333: tcp 0
07:04:29.450302 IP tom-Latitude-3570.57976 > 167.99.216.145.8333: tcp 24
07:04:29.451799 IP tom-Latitude-3570.57976 > 167.99.216.145.8333: tcp 613
07:04:29.463801 IP 81.198.101.144.8333 > tom-Latitude-3570.60988: tcp 24
07:04:29.463923 IP 81.198.101.144.8333 > tom-Latitude-3570.60988: tcp 973
07:04:29.463939 IP tom-Latitude-3570.60988 > 81.198.101.144.8333: tcp 0
07:04:29.464274 IP tom-Latitude-3570.60988 > 81.198.101.144.8333: tcp 24
07:04:29.465329 IP tom-Latitude-3570.60988 > 81.198.101.144.8333: tcp 145
07:04:29.484697 IP 167.99.216.145.8333 > tom-Latitude-3570.57976: tcp 0
07:04:29.491364 IP 167.99.216.145.8333 > tom-Latitude-3570.57976: tcp 0
07:04:29.491368 IP 81.198.101.144.8333 > tom-Latitude-3570.60988: tcp 0
07:04:29.491371 IP 81.198.101.144.8333 > tom-Latitude-3570.60988: tcp 0
07:04:29.560779 IP 167.99.216.145.8333 > tom-Latitude-3570.57976: tcp 24
07:04:29.560787 IP 167.99.216.145.8333 > tom-Latitude-3570.57976: tcp 280
07:04:29.560790 IP 167.99.216.145.8333 > tom-Latitude-3570.57976: tcp 24
07:04:29.560798 IP tom-Latitude-3570.57976 > 167.99.216.145.8333: tcp 0
07:04:29.560956 IP 167.99.216.145.8333 > tom-Latitude-3570.57976: tcp 223
07:04:29.560963 IP 167.99.216.145.8333 > tom-Latitude-3570.57976: tcp 24
07:04:29.560967 IP 167.99.216.145.8333 > tom-Latitude-3570.57976: tcp 283
07:04:29.560971 IP 167.99.216.145.8333 > tom-Latitude-3570.57976: tcp 24
07:04:29.560971 IP tom-Latitude-3570.57976 > 167.99.216.145.8333: tcp 0
07:04:29.560974 IP 167.99.216.145.8333 > tom-Latitude-3570.57976: tcp 284
07:04:29.560986 IP tom-Latitude-3570.57976 > 167.99.216.145.8333: tcp 0
07:04:29.581330 IP 81.198.101.144.8333 > tom-Latitude-3570.60988: tcp 24
07:04:29.582241 IP 81.198.101.144.8333 > tom-Latitude-3570.60988: tcp 283
07:04:29.582250 IP 81.198.101.144.8333 > tom-Latitude-3570.60988: tcp 24
07:04:29.582253 IP 81.198.101.144.8333 > tom-Latitude-3570.60988: tcp 284
07:04:29.582256 IP 81.198.101.144.8333 > tom-Latitude-3570.60988: tcp 24
07:04:29.582257 IP tom-Latitude-3570.60988 > 81.198.101.144.8333: tcp 0
07:04:29.582258 IP 81.198.101.144.8333 > tom-Latitude-3570.60988: tcp 284
07:04:29.582260 IP 81.198.101.144.8333 > tom-Latitude-3570.60988: tcp 24
07:04:29.582263 IP 81.198.101.144.8333 > tom-Latitude-3570.60988: tcp 284
07:04:29.582277 IP tom-Latitude-3570.60988 > 81.198.101.144.8333: tcp 0
07:04:29.618047 IP 167.99.216.145.8333 > tom-Latitude-3570.57976: tcp 1448
07:04:29.618180 IP tom-Latitude-3570.57976 > 167.99.216.145.8333: tcp 0
07:04:29.618443 IP 167.99.216.145.8333 > tom-Latitude-3570.57976: tcp 1448
07:04:29.618456 IP 167.99.216.145.8333 > tom-Latitude-3570.57976: tcp 1102
07:04:29.618519 IP tom-Latitude-3570.57976 > 167.99.216.145.8333: tcp 0
07:04:29.618772 IP tom-Latitude-3570.60470 > bb42-60-217-183.singnet.com.sg.8333: tcp 24
07:04:29.620585 IP tom-Latitude-3570.60470 > bb42-60-217-183.singnet.com.sg.8333: tcp 325
07:04:29.663117 IP bb42-60-217-183.singnet.com.sg.8333 > tom-Latitude-3570.60470: tcp 0
07:04:29.663132 IP bb42-60-217-183.singnet.com.sg.8333 > tom-Latitude-3570.60470: tcp 0
07:04:30.063591 IP 2.56.9.15.8333 > tom-Latitude-3570.42516: tcp 24
07:04:30.063611 IP 2.56.9.15.8333 > tom-Latitude-3570.42516: tcp 1261
07:04:30.063732 IP tom-Latitude-3570.42516 > 2.56.9.15.8333: tcp 0
07:04:30.063787 IP 2.56.9.15.8333 > tom-Latitude-3570.42516: tcp 1261
07:04:30.063797 IP tom-Latitude-3570.42516 > 2.56.9.15.8333: tcp 0
07:04:30.064197 IP tom-Latitude-3570.42516 > 2.56.9.15.8333: tcp 24
07:04:30.065989 IP tom-Latitude-3570.42516 > 2.56.9.15.8333: tcp 325
07:04:30.101286 IP 2.56.9.15.8333 > tom-Latitude-3570.42516: tcp 0
07:04:30.104655 IP 2.56.9.15.8333 > tom-Latitude-3570.42516: tcp 0
07:04:30.264809 IP tom-Latitude-3570.57976 > 167.99.216.145.8333: tcp 24
07:04:30.265041 IP tom-Latitude-3570.46284 > static-87-75-105-186.vodafonexdsl.co.uk.8333: tcp 24
07:04:30.341282 IP tom-Latitude-3570.57976 > 167.99.216.145.8333: tcp 145
07:04:30.342732 IP tom-Latitude-3570.46284 > static-87-75-105-186.vodafonexdsl.co.uk.8333: tcp 757
07:04:30.373023 IP 167.99.216.145.8333 > tom-Latitude-3570.57976: tcp 0
07:04:30.379960 IP static-87-75-105-186.vodafonexdsl.co.uk.8333 > tom-Latitude-3570.46284: tcp 0
07:04:30.380620 IP 167.99.216.145.8333 > tom-Latitude-3570.57976: tcp 0
07:04:30.384318 IP static-87-75-105-186.vodafonexdsl.co.uk.8333 > tom-Latitude-3570.46284: tcp 0
07:04:30.411527 IP 2.56.9.15.8333 > tom-Latitude-3570.42516: tcp 1229
07:04:30.411545 IP tom-Latitude-3570.42516 > 2.56.9.15.8333: tcp 0
07:04:30.446537 IP 2.56.9.15.8333 > tom-Latitude-3570.42516: tcp 1143
07:04:30.446562 IP tom-Latitude-3570.42516 > 2.56.9.15.8333: tcp 0
07:04:30.446596 IP 2.56.9.15.8333 > tom-Latitude-3570.42516: tcp 1279
07:04:30.446601 IP tom-Latitude-3570.42516 > 2.56.9.15.8333: tcp 0
07:04:30.446605 IP 2.56.9.15.8333 > tom-Latitude-3570.42516: tcp 283
07:04:30.446608 IP tom-Latitude-3570.42516 > 2.56.9.15.8333: tcp 0
07:04:30.851937 IP tom-Latitude-3570.39110 > vmi195435.contaboserver.net.8333: tcp 24
07:04:30.851958 IP tom-Latitude-3570.39110 > vmi195435.contaboserver.net.8333: tcp 1117
07:04:30.901577 IP vmi195435.contaboserver.net.8333 > tom-Latitude-3570.39110: tcp 0
07:04:30.917544 IP vmi195435.contaboserver.net.8333 > tom-Latitude-3570.39110: tcp 0
07:04:30.952395 IP tom-Latitude-3570.60988 > 81.198.101.144.8333: tcp 24
07:04:30.953405 IP tom-Latitude-3570.60988 > 81.198.101.144.8333: tcp 325
07:04:30.985440 IP 81.198.101.144.8333 > tom-Latitude-3570.60988: tcp 0
07:04:30.993615 IP 81.198.101.144.8333 > tom-Latitude-3570.60988: tcp 0
07:04:31.052978 IP tom-Latitude-3570.56714 > ns3113832.ip-54-38-177.eu.8333: tcp 24
07:04:31.053000 IP tom-Latitude-3570.56714 > ns3113832.ip-54-38-177.eu.8333: tcp 1261
07:04:31.081310 IP ns3113832.ip-54-38-177.eu.8333 > tom-Latitude-3570.56714: tcp 0
07:04:31.104246 IP ns3113832.ip-54-38-177.eu.8333 > tom-Latitude-3570.56714: tcp 0
07:04:31.122342 IP ns3113832.ip-54-38-177.eu.8333 > tom-Latitude-3570.56714: tcp 24
07:04:31.123208 IP ns3113832.ip-54-38-177.eu.8333 > tom-Latitude-3570.56714: tcp 1261
07:04:31.123226 IP bb42-60-217-183.singnet.com.sg.8333 > tom-Latitude-3570.60470: tcp 24
07:04:31.123237 IP tom-Latitude-3570.60470 > bb42-60-217-183.singnet.com.sg.8333: tcp 0
07:04:31.123320 IP tom-Latitude-3570.56714 > ns3113832.ip-54-38-177.eu.8333: tcp 0
07:04:31.123812 IP tom-Latitude-3570.56714 > ns3113832.ip-54-38-177.eu.8333: tcp 24
07:04:31.125669 IP bb42-60-217-183.singnet.com.sg.8333 > tom-Latitude-3570.60470: tcp 31
07:04:31.125677 IP tom-Latitude-3570.60470 > bb42-60-217-183.singnet.com.sg.8333: tcp 0
07:04:31.127213 IP tom-Latitude-3570.56714 > ns3113832.ip-54-38-177.eu.8333: tcp 505
07:04:31.162320 IP ns3113832.ip-54-38-177.eu.8333 > tom-Latitude-3570.56714: tcp 0
07:04:31.219419 IP ns3113832.ip-54-38-177.eu.8333 > tom-Latitude-3570.56714: tcp 24
07:04:31.220586 IP ns3113832.ip-54-38-177.eu.8333 > tom-Latitude-3570.56714: tcp 371
07:04:31.220597 IP ns3113832.ip-54-38-177.eu.8333 > tom-Latitude-3570.56714: tcp 24
07:04:31.220601 IP ns3113832.ip-54-38-177.eu.8333 > tom-Latitude-3570.56714: tcp 256
07:04:31.220603 IP tom-Latitude-3570.56714 > ns3113832.ip-54-38-177.eu.8333: tcp 0
07:04:31.220603 IP ns3113832.ip-54-38-177.eu.8333 > tom-Latitude-3570.56714: tcp 24
07:04:31.220607 IP ns3113832.ip-54-38-177.eu.8333 > tom-Latitude-3570.56714: tcp 257
07:04:31.220608 IP ns3113832.ip-54-38-177.eu.8333 > tom-Latitude-3570.56714: tcp 24
07:04:31.220610 IP ns3113832.ip-54-38-177.eu.8333 > tom-Latitude-3570.56714: tcp 403
07:04:31.220612 IP ns3113832.ip-54-38-177.eu.8333 > tom-Latitude-3570.56714: tcp 24
07:04:31.220614 IP ns3113832.ip-54-38-177.eu.8333 > tom-Latitude-3570.56714: tcp 403
07:04:31.220626 IP tom-Latitude-3570.56714 > ns3113832.ip-54-38-177.eu.8333: tcp 0
07:04:31.276385 IP ns3113832.ip-54-38-177.eu.8333 > tom-Latitude-3570.56714: tcp 1350
07:04:31.279634 IP ns3113832.ip-54-38-177.eu.8333 > tom-Latitude-3570.56714: tcp 1350
07:04:31.279754 IP tom-Latitude-3570.56714 > ns3113832.ip-54-38-177.eu.8333: tcp 0
07:04:31.280505 IP ns3113832.ip-54-38-177.eu.8333 > tom-Latitude-3570.56714: tcp 493
07:04:31.323882 IP tom-Latitude-3570.56714 > ns3113832.ip-54-38-177.eu.8333: tcp 0
07:04:31.483573 IP tom-Latitude-3570.57976 > 167.99.216.145.8333: tcp 24
07:04:31.483779 IP tom-Latitude-3570.60470 > bb42-60-217-183.singnet.com.sg.8333: tcp 24
07:04:31.483788 IP tom-Latitude-3570.60470 > bb42-60-217-183.singnet.com.sg.8333: tcp 1261
07:04:31.485734 IP tom-Latitude-3570.57976 > 167.99.216.145.8333: tcp 829
07:04:31.527624 IP 167.99.216.145.8333 > tom-Latitude-3570.57976: tcp 0
07:04:31.528753 IP bb42-60-217-183.singnet.com.sg.8333 > tom-Latitude-3570.60470: tcp 0
07:04:31.528767 IP bb42-60-217-183.singnet.com.sg.8333 > tom-Latitude-3570.60470: tcp 0
07:04:31.528771 IP 167.99.216.145.8333 > tom-Latitude-3570.57976: tcp 0
07:04:31.609446 IP static-87-75-105-186.vodafonexdsl.co.uk.8333 > tom-Latitude-3570.46284: tcp 24
07:04:31.609464 IP tom-Latitude-3570.46284 > static-87-75-105-186.vodafonexdsl.co.uk.8333: tcp 0
07:04:31.640730 IP static-87-75-105-186.vodafonexdsl.co.uk.8333 > tom-Latitude-3570.46284: tcp 1081
07:04:31.640750 IP tom-Latitude-3570.46284 > static-87-75-105-186.vodafonexdsl.co.uk.8333: tcp 0
07:04:31.676904 IP static-87-75-105-186.vodafonexdsl.co.uk.8333 > tom-Latitude-3570.46284: tcp 55
07:04:31.676929 IP tom-Latitude-3570.46284 > static-87-75-105-186.vodafonexdsl.co.uk.8333: tcp 0
07:04:31.677459 IP tom-Latitude-3570.46284 > static-87-75-105-186.vodafonexdsl.co.uk.8333: tcp 24
07:04:31.678371 IP tom-Latitude-3570.46284 > static-87-75-105-186.vodafonexdsl.co.uk.8333: tcp 253
07:04:31.714351 IP static-87-75-105-186.vodafonexdsl.co.uk.8333 > tom-Latitude-3570.46284: tcp 0
07:04:31.719255 IP static-87-75-105-186.vodafonexdsl.co.uk.8333 > tom-Latitude-3570.46284: tcp 0
07:04:31.780139 IP 81.198.101.144.8333 > tom-Latitude-3570.60988: tcp 24
07:04:31.783187 IP 81.198.101.144.8333 > tom-Latitude-3570.60988: tcp 181
07:04:31.783203 IP tom-Latitude-3570.60988 > 81.198.101.144.8333: tcp 0
07:04:31.786473 IP static-87-75-105-186.vodafonexdsl.co.uk.8333 > tom-Latitude-3570.46284: tcp 24
07:04:31.787479 IP static-87-75-105-186.vodafonexdsl.co.uk.8333 > tom-Latitude-3570.46284: tcp 284
07:04:31.787485 IP static-87-75-105-186.vodafonexdsl.co.uk.8333 > tom-Latitude-3570.46284: tcp 24
07:04:31.787492 IP tom-Latitude-3570.46284 > static-87-75-105-186.vodafonexdsl.co.uk.8333: tcp 0
07:04:31.788896 IP static-87-75-105-186.vodafonexdsl.co.uk.8333 > tom-Latitude-3570.46284: tcp 257
07:04:31.788902 IP static-87-75-105-186.vodafonexdsl.co.uk.8333 > tom-Latitude-3570.46284: tcp 24
07:04:31.788905 IP static-87-75-105-186.vodafonexdsl.co.uk.8333 > tom-Latitude-3570.46284: tcp 283
07:04:31.788911 IP tom-Latitude-3570.46284 > static-87-75-105-186.vodafonexdsl.co.uk.8333: tcp 0
07:04:31.789999 IP static-87-75-105-186.vodafonexdsl.co.uk.8333 > tom-Latitude-3570.46284: tcp 24
07:04:31.790018 IP static-87-75-105-186.vodafonexdsl.co.uk.8333 > tom-Latitude-3570.46284: tcp 283
07:04:31.790021 IP static-87-75-105-186.vodafonexdsl.co.uk.8333 > tom-Latitude-3570.46284: tcp 24
07:04:31.790024 IP static-87-75-105-186.vodafonexdsl.co.uk.8333 > tom-Latitude-3570.46284: tcp 284
07:04:31.790026 IP static-87-75-105-186.vodafonexdsl.co.uk.8333 > tom-Latitude-3570.46284: tcp 24
07:04:31.790047 IP static-87-75-105-186.vodafonexdsl.co.uk.8333 > tom-Latitude-3570.46284: tcp 407
07:04:31.790048 IP static-87-75-105-186.vodafonexdsl.co.uk.8333 > tom-Latitude-3570.46284: tcp 24
07:04:31.790051 IP static-87-75-105-186.vodafonexdsl.co.uk.8333 > tom-Latitude-3570.46284: tcp 257
07:04:31.790118 IP tom-Latitude-3570.46284 > static-87-75-105-186.vodafonexdsl.co.uk.8333: tcp 0
07:04:32.293012 IP tom-Latitude-3570.39110 > vmi195435.contaboserver.net.8333: tcp 24
07:04:32.295076 IP tom-Latitude-3570.39110 > vmi195435.contaboserver.net.8333: tcp 757
07:04:32.319332 IP vmi195435.contaboserver.net.8333 > tom-Latitude-3570.39110: tcp 0
07:04:32.328296 IP vmi195435.contaboserver.net.8333 > tom-Latitude-3570.39110: tcp 0
07:04:32.393436 IP tom-Latitude-3570.49070 > c-185-45-236-223.customer.ggaweb.ch.8333: tcp 24
07:04:32.393445 IP tom-Latitude-3570.49070 > c-185-45-236-223.customer.ggaweb.ch.8333: tcp 1261
07:04:32.393490 IP tom-Latitude-3570.60470 > bb42-60-217-183.singnet.com.sg.8333: tcp 24
07:04:32.578235 IP tom-Latitude-3570.60470 > bb42-60-217-183.singnet.com.sg.8333: tcp 253
07:04:32.593778 IP tom-Latitude-3570.57976 > 167.99.216.145.8333: tcp 24
07:04:32.594614 IP tom-Latitude-3570.57976 > 167.99.216.145.8333: tcp 253
07:04:32.612471 IP c-185-45-236-223.customer.ggaweb.ch.8333 > tom-Latitude-3570.49070: tcp 0
07:04:32.631143 IP c-185-45-236-223.customer.ggaweb.ch.8333 > tom-Latitude-3570.49070: tcp 0
07:04:32.631157 IP bb42-60-217-183.singnet.com.sg.8333 > tom-Latitude-3570.60470: tcp 0
07:04:32.631162 IP bb42-60-217-183.singnet.com.sg.8333 > tom-Latitude-3570.60470: tcp 0
07:04:32.631164 IP 167.99.216.145.8333 > tom-Latitude-3570.57976: tcp 0
07:04:32.631167 IP 167.99.216.145.8333 > tom-Latitude-3570.57976: tcp 0
07:04:32.794637 IP tom-Latitude-3570.56714 > ns3113832.ip-54-38-177.eu.8333: tcp 24
07:04:32.796927 IP tom-Latitude-3570.56714 > ns3113832.ip-54-38-177.eu.8333: tcp 253
07:04:32.864500 IP ns3113832.ip-54-38-177.eu.8333 > tom-Latitude-3570.56714: tcp 0
07:04:33.096011 IP tom-Latitude-3570.42516 > 2.56.9.15.8333: tcp 24
07:04:33.098117 IP tom-Latitude-3570.42516 > 2.56.9.15.8333: tcp 865
07:04:33.118080 IP 2.56.9.15.8333 > tom-Latitude-3570.42516: tcp 0
07:04:33.134771 IP 2.56.9.15.8333 > tom-Latitude-3570.42516: tcp 0
07:04:33.955373 IP bb42-60-217-183.singnet.com.sg.8333 > tom-Latitude-3570.60470: tcp 24
07:04:33.955397 IP tom-Latitude-3570.60470 > bb42-60-217-183.singnet.com.sg.8333: tcp 0
07:04:33.955444 IP bb42-60-217-183.singnet.com.sg.8333 > tom-Latitude-3570.60470: tcp 1081
07:04:33.955449 IP tom-Latitude-3570.60470 > bb42-60-217-183.singnet.com.sg.8333: tcp 0
07:04:33.955997 IP tom-Latitude-3570.60470 > bb42-60-217-183.singnet.com.sg.8333: tcp 24
07:04:33.956015 IP tom-Latitude-3570.60470 > bb42-60-217-183.singnet.com.sg.8333: tcp 1081
07:04:33.957499 IP bb42-60-217-183.singnet.com.sg.8333 > tom-Latitude-3570.60470: tcp 1081
07:04:33.957508 IP tom-Latitude-3570.60470 > bb42-60-217-183.singnet.com.sg.8333: tcp 0
07:04:33.990154 IP bb42-60-217-183.singnet.com.sg.8333 > tom-Latitude-3570.60470: tcp 0
07:04:33.999010 IP bb42-60-217-183.singnet.com.sg.8333 > tom-Latitude-3570.60470: tcp 0
07:04:34.557848 IP tom-Latitude-3570.49070 > c-185-45-236-223.customer.ggaweb.ch.8333: tcp 24
07:04:34.559946 IP tom-Latitude-3570.49070 > c-185-45-236-223.customer.ggaweb.ch.8333: tcp 613
07:04:34.561300 IP bb42-60-217-183.singnet.com.sg.8333 > tom-Latitude-3570.60470: tcp 24
07:04:34.561324 IP tom-Latitude-3570.60470 > bb42-60-217-183.singnet.com.sg.8333: tcp 0
07:04:34.561356 IP bb42-60-217-183.singnet.com.sg.8333 > tom-Latitude-3570.60470: tcp 246
07:04:34.561361 IP tom-Latitude-3570.60470 > bb42-60-217-183.singnet.com.sg.8333: tcp 0
07:04:34.561365 IP bb42-60-217-183.singnet.com.sg.8333 > tom-Latitude-3570.60470: tcp 24
07:04:34.561368 IP tom-Latitude-3570.60470 > bb42-60-217-183.singnet.com.sg.8333: tcp 0
07:04:34.561372 IP bb42-60-217-183.singnet.com.sg.8333 > tom-Latitude-3570.60470: tcp 246
07:04:34.561373 IP tom-Latitude-3570.60470 > bb42-60-217-183.singnet.com.sg.8333: tcp 0
07:04:34.561376 IP bb42-60-217-183.singnet.com.sg.8333 > tom-Latitude-3570.60470: tcp 24
07:04:34.561377 IP tom-Latitude-3570.60470 > bb42-60-217-183.singnet.com.sg.8333: tcp 0
07:04:34.561382 IP bb42-60-217-183.singnet.com.sg.8333 > tom-Latitude-3570.60470: tcp 224
07:04:34.561385 IP tom-Latitude-3570.60470 > bb42-60-217-183.singnet.com.sg.8333: tcp 0
07:04:34.561387 IP bb42-60-217-183.singnet.com.sg.8333 > tom-Latitude-3570.60470: tcp 24
07:04:34.561389 IP tom-Latitude-3570.60470 > bb42-60-217-183.singnet.com.sg.8333: tcp 0
07:04:34.561394 IP bb42-60-217-183.singnet.com.sg.8333 > tom-Latitude-3570.60470: tcp 404
07:04:34.561397 IP bb42-60-217-183.singnet.com.sg.8333 > tom-Latitude-3570.60470: tcp 24
07:04:34.561414 IP bb42-60-217-183.singnet.com.sg.8333 > tom-Latitude-3570.60470: tcp 283
07:04:34.561415 IP tom-Latitude-3570.60470 > bb42-60-217-183.singnet.com.sg.8333: tcp 0
07:04:34.561417 IP bb42-60-217-183.singnet.com.sg.8333 > tom-Latitude-3570.60470: tcp 24
07:04:34.561419 IP bb42-60-217-183.singnet.com.sg.8333 > tom-Latitude-3570.60470: tcp 284
07:04:34.561422 IP tom-Latitude-3570.60470 > bb42-60-217-183.singnet.com.sg.8333: tcp 0
07:04:34.561424 IP tom-Latitude-3570.60470 > bb42-60-217-183.singnet.com.sg.8333: tcp 0
07:04:34.561426 IP bb42-60-217-183.singnet.com.sg.8333 > tom-Latitude-3570.60470: tcp 24
07:04:34.561427 IP tom-Latitude-3570.60470 > bb42-60-217-183.singnet.com.sg.8333: tcp 0
07:04:34.561429 IP tom-Latitude-3570.60470 > bb42-60-217-183.singnet.com.sg.8333: tcp 0
07:04:34.561431 IP bb42-60-217-183.singnet.com.sg.8333 > tom-Latitude-3570.60470: tcp 284
07:04:34.561431 IP tom-Latitude-3570.60470 > bb42-60-217-183.singnet.com.sg.8333: tcp 0
07:04:34.561434 IP tom-Latitude-3570.60470 > bb42-60-217-183.singnet.com.sg.8333: tcp 0
07:04:34.561434 IP bb42-60-217-183.singnet.com.sg.8333 > tom-Latitude-3570.60470: tcp 24
07:04:34.561437 IP tom-Latitude-3570.60470 > bb42-60-217-183.singnet.com.sg.8333: tcp 0
07:04:34.561445 IP bb42-60-217-183.singnet.com.sg.8333 > tom-Latitude-3570.60470: tcp 283
07:04:34.561450 IP tom-Latitude-3570.60470 > bb42-60-217-183.singnet.com.sg.8333: tcp 0
07:04:34.561453 IP bb42-60-217-183.singnet.com.sg.8333 > tom-Latitude-3570.60470: tcp 24
07:04:34.561457 IP bb42-60-217-183.singnet.com.sg.8333 > tom-Latitude-3570.60470: tcp 283
07:04:34.561460 IP bb42-60-217-183.singnet.com.sg.8333 > tom-Latitude-3570.60470: tcp 24
07:04:34.561466 IP bb42-60-217-183.singnet.com.sg.8333 > tom-Latitude-3570.60470: tcp 283
07:04:34.561472 IP bb42-60-217-183.singnet.com.sg.8333 > tom-Latitude-3570.60470: tcp 24
07:04:34.561498 IP tom-Latitude-3570.60470 > bb42-60-217-183.singnet.com.sg.8333: tcp 0
07:04:34.664564 IP tom-Latitude-3570.46284 > static-87-75-105-186.vodafonexdsl.co.uk.8333: tcp 24
07:04:34.739910 IP tom-Latitude-3570.49070 > c-185-45-236-223.customer.ggaweb.ch.8333: tcp 613
07:04:34.765063 IP bb42-60-217-183.singnet.com.sg.8333 > tom-Latitude-3570.60470: tcp 1382
07:04:34.765082 IP bb42-60-217-183.singnet.com.sg.8333 > tom-Latitude-3570.60470: tcp 1382
07:04:34.765087 IP bb42-60-217-183.singnet.com.sg.8333 > tom-Latitude-3570.60470: tcp 1382
07:04:34.765108 IP bb42-60-217-183.singnet.com.sg.8333 > tom-Latitude-3570.60470: tcp 1382
07:04:34.765115 IP bb42-60-217-183.singnet.com.sg.8333 > tom-Latitude-3570.60470: tcp 481
07:04:34.765118 IP c-185-45-236-223.customer.ggaweb.ch.8333 > tom-Latitude-3570.49070: tcp 0
07:04:34.765128 IP c-185-45-236-223.customer.ggaweb.ch.8333 > tom-Latitude-3570.49070: tcp 0
07:04:34.765133 IP bb42-60-217-183.singnet.com.sg.8333 > tom-Latitude-3570.60470: tcp 24
07:04:34.765151 IP bb42-60-217-183.singnet.com.sg.8333 > tom-Latitude-3570.60470: tcp 541
07:04:34.765174 IP tom-Latitude-3570.60470 > bb42-60-217-183.singnet.com.sg.8333: tcp 0
07:04:34.767899 IP tom-Latitude-3570.46284 > static-87-75-105-186.vodafonexdsl.co.uk.8333: tcp 361
07:04:34.768576 IP tom-Latitude-3570.42516 > 2.56.9.15.8333: tcp 24
07:04:34.769415 IP tom-Latitude-3570.60470 > bb42-60-217-183.singnet.com.sg.8333: tcp 24
07:04:34.773725 IP tom-Latitude-3570.42516 > 2.56.9.15.8333: tcp 937
07:04:34.774327 IP tom-Latitude-3570.60470 > bb42-60-217-183.singnet.com.sg.8333: tcp 541
07:04:34.819030 IP static-87-75-105-186.vodafonexdsl.co.uk.8333 > tom-Latitude-3570.46284: tcp 0
07:04:34.820629 IP c-185-45-236-223.customer.ggaweb.ch.8333 > tom-Latitude-3570.49070: tcp 0
07:04:34.820642 IP static-87-75-105-186.vodafonexdsl.co.uk.8333 > tom-Latitude-3570.46284: tcp 0
07:04:34.820648 IP 2.56.9.15.8333 > tom-Latitude-3570.42516: tcp 0
07:04:34.820652 IP bb42-60-217-183.singnet.com.sg.8333 > tom-Latitude-3570.60470: tcp 0
07:04:34.820655 IP 2.56.9.15.8333 > tom-Latitude-3570.42516: tcp 0
07:04:34.820657 IP bb42-60-217-183.singnet.com.sg.8333 > tom-Latitude-3570.60470: tcp 0
07:04:35.212419 IP bb42-60-217-183.singnet.com.sg.8333 > tom-Latitude-3570.60470: tcp 24
07:04:35.212441 IP bb42-60-217-183.singnet.com.sg.8333 > tom-Latitude-3570.60470: tcp 225
07:04:35.212444 IP bb42-60-217-183.singnet.com.sg.8333 > tom-Latitude-3570.60470: tcp 24
07:04:35.212448 IP bb42-60-217-183.singnet.com.sg.8333 > tom-Latitude-3570.60470: tcp 412
07:04:35.212449 IP bb42-60-217-183.singnet.com.sg.8333 > tom-Latitude-3570.60470: tcp 24
07:04:35.212470 IP bb42-60-217-183.singnet.com.sg.8333 > tom-Latitude-3570.60470: tcp 192
07:04:35.212471 IP bb42-60-217-183.singnet.com.sg.8333 > tom-Latitude-3570.60470: tcp 24
07:04:35.212534 IP tom-Latitude-3570.60470 > bb42-60-217-183.singnet.com.sg.8333: tcp 0
07:04:35.212579 IP bb42-60-217-183.singnet.com.sg.8333 > tom-Latitude-3570.60470: tcp 191
07:04:35.212589 IP bb42-60-217-183.singnet.com.sg.8333 > tom-Latitude-3570.60470: tcp 24
07:04:35.212595 IP bb42-60-217-183.singnet.com.sg.8333 > tom-Latitude-3570.60470: tcp 256
07:04:35.212595 IP tom-Latitude-3570.60470 > bb42-60-217-183.singnet.com.sg.8333: tcp 0
07:04:35.212598 IP bb42-60-217-183.singnet.com.sg.8333 > tom-Latitude-3570.60470: tcp 24
07:04:35.212618 IP tom-Latitude-3570.60470 > bb42-60-217-183.singnet.com.sg.8333: tcp 0
07:04:35.215776 IP bb42-60-217-183.singnet.com.sg.8333 > tom-Latitude-3570.60470: tcp 249
07:04:35.215788 IP bb42-60-217-183.singnet.com.sg.8333 > tom-Latitude-3570.60470: tcp 24
07:04:35.215791 IP bb42-60-217-183.singnet.com.sg.8333 > tom-Latitude-3570.60470: tcp 284
07:04:35.215794 IP bb42-60-217-183.singnet.com.sg.8333 > tom-Latitude-3570.60470: tcp 24
07:04:35.215796 IP bb42-60-217-183.singnet.com.sg.8333 > tom-Latitude-3570.60470: tcp 283
07:04:35.215798 IP bb42-60-217-183.singnet.com.sg.8333 > tom-Latitude-3570.60470: tcp 24
07:04:35.215818 IP bb42-60-217-183.singnet.com.sg.8333 > tom-Latitude-3570.60470: tcp 283
07:04:35.215820 IP bb42-60-217-183.singnet.com.sg.8333 > tom-Latitude-3570.60470: tcp 24
07:04:35.215823 IP bb42-60-217-183.singnet.com.sg.8333 > tom-Latitude-3570.60470: tcp 284
07:04:35.215873 IP tom-Latitude-3570.60470 > bb42-60-217-183.singnet.com.sg.8333: tcp 0
07:04:35.242283 IP bb42-60-217-183.singnet.com.sg.8333 > tom-Latitude-3570.60470: tcp 1382
07:04:35.242290 IP bb42-60-217-183.singnet.com.sg.8333 > tom-Latitude-3570.60470: tcp 100
07:04:35.242304 IP tom-Latitude-3570.60470 > bb42-60-217-183.singnet.com.sg.8333: tcp 0
07:04:35.343991 IP tom-Latitude-3570.49070 > c-185-45-236-223.customer.ggaweb.ch.8333: tcp 24
07:04:35.344012 IP tom-Latitude-3570.49070 > c-185-45-236-223.customer.ggaweb.ch.8333: tcp 1261
07:04:35.344120 IP tom-Latitude-3570.42516 > 2.56.9.15.8333: tcp 24
07:04:35.347654 IP tom-Latitude-3570.42516 > 2.56.9.15.8333: tcp 685
07:04:35.372761 IP c-185-45-236-223.customer.ggaweb.ch.8333 > tom-Latitude-3570.49070: tcp 0
07:04:35.423556 IP 2.56.9.15.8333 > tom-Latitude-3570.42516: tcp 0
07:04:35.423570 IP c-185-45-236-223.customer.ggaweb.ch.8333 > tom-Latitude-3570.49070: tcp 0
07:04:35.423574 IP 2.56.9.15.8333 > tom-Latitude-3570.42516: tcp 0
07:04:35.444654 IP tom-Latitude-3570.39110 > vmi195435.contaboserver.net.8333: tcp 24
07:04:35.444675 IP tom-Latitude-3570.39110 > vmi195435.contaboserver.net.8333: tcp 1261
07:04:35.444887 IP tom-Latitude-3570.60988 > 81.198.101.144.8333: tcp 24
07:04:35.444894 IP tom-Latitude-3570.60988 > 81.198.101.144.8333: tcp 1261
07:04:35.473225 IP vmi195435.contaboserver.net.8333 > tom-Latitude-3570.39110: tcp 0
07:04:35.491236 IP vmi195435.contaboserver.net.8333 > tom-Latitude-3570.39110: tcp 0
07:04:35.491250 IP 81.198.101.144.8333 > tom-Latitude-3570.60988: tcp 0
07:04:35.493039 IP 81.198.101.144.8333 > tom-Latitude-3570.60988: tcp 0
07:04:35.645541 IP tom-Latitude-3570.49070 > c-185-45-236-223.customer.ggaweb.ch.8333: tcp 24
07:04:35.647818 IP tom-Latitude-3570.49070 > c-185-45-236-223.customer.ggaweb.ch.8333: tcp 37
07:04:35.648489 IP vmi195435.contaboserver.net.8333 > tom-Latitude-3570.39110: tcp 24
07:04:35.648510 IP vmi195435.contaboserver.net.8333 > tom-Latitude-3570.39110: tcp 649
07:04:35.648599 IP tom-Latitude-3570.39110 > vmi195435.contaboserver.net.8333: tcp 0
07:04:35.648914 IP tom-Latitude-3570.39110 > vmi195435.contaboserver.net.8333: tcp 24
07:04:35.651174 IP tom-Latitude-3570.39110 > vmi195435.contaboserver.net.8333: tcp 289
07:04:35.679623 IP c-185-45-236-223.customer.ggaweb.ch.8333 > tom-Latitude-3570.49070: tcp 0
07:04:35.680276 IP c-185-45-236-223.customer.ggaweb.ch.8333 > tom-Latitude-3570.49070: tcp 0
07:04:35.680281 IP vmi195435.contaboserver.net.8333 > tom-Latitude-3570.39110: tcp 0
07:04:35.685155 IP vmi195435.contaboserver.net.8333 > tom-Latitude-3570.39110: tcp 0
07:04:35.749255 IP tom-Latitude-3570.49070 > c-185-45-236-223.customer.ggaweb.ch.8333: tcp 24
07:04:35.749485 IP tom-Latitude-3570.57976 > 167.99.216.145.8333: tcp 24
07:04:35.749494 IP tom-Latitude-3570.57976 > 167.99.216.145.8333: tcp 1261
07:04:35.789064 IP vmi195435.contaboserver.net.8333 > tom-Latitude-3570.39110: tcp 24
07:04:35.789084 IP vmi195435.contaboserver.net.8333 > tom-Latitude-3570.39110: tcp 246
07:04:35.789092 IP vmi195435.contaboserver.net.8333 > tom-Latitude-3570.39110: tcp 24
07:04:35.789114 IP vmi195435.contaboserver.net.8333 > tom-Latitude-3570.39110: tcp 247
07:04:35.789118 IP vmi195435.contaboserver.net.8333 > tom-Latitude-3570.39110: tcp 24
07:04:35.789176 IP tom-Latitude-3570.39110 > vmi195435.contaboserver.net.8333: tcp 0
07:04:35.789491 IP vmi195435.contaboserver.net.8333 > tom-Latitude-3570.39110: tcp 284
07:04:35.789508 IP vmi195435.contaboserver.net.8333 > tom-Latitude-3570.39110: tcp 24
07:04:35.789512 IP vmi195435.contaboserver.net.8333 > tom-Latitude-3570.39110: tcp 283
07:04:35.789515 IP vmi195435.contaboserver.net.8333 > tom-Latitude-3570.39110: tcp 24
07:04:35.789537 IP vmi195435.contaboserver.net.8333 > tom-Latitude-3570.39110: tcp 257
07:04:35.789542 IP c-185-45-236-223.customer.ggaweb.ch.8333 > tom-Latitude-3570.49070: tcp 24
07:04:35.789549 IP c-185-45-236-223.customer.ggaweb.ch.8333 > tom-Latitude-3570.49070: tcp 283
07:04:35.789576 IP tom-Latitude-3570.49070 > c-185-45-236-223.customer.ggaweb.ch.8333: tcp 361
07:04:35.789594 IP tom-Latitude-3570.39110 > vmi195435.contaboserver.net.8333: tcp 0
07:04:35.891434 IP tom-Latitude-3570.60470 > bb42-60-217-183.singnet.com.sg.8333: tcp 24
07:04:35.891488 IP tom-Latitude-3570.42516 > 2.56.9.15.8333: tcp 24
07:04:35.891621 IP vmi195435.contaboserver.net.8333 > tom-Latitude-3570.39110: tcp 896
07:04:35.893782 IP tom-Latitude-3570.49070 > c-185-45-236-223.customer.ggaweb.ch.8333: tcp 61
07:04:35.899561 IP tom-Latitude-3570.60470 > bb42-60-217-183.singnet.com.sg.8333: tcp 181
07:04:35.900209 IP tom-Latitude-3570.42516 > 2.56.9.15.8333: tcp 181
07:04:35.931910 IP tom-Latitude-3570.39110 > vmi195435.contaboserver.net.8333: tcp 0
07:04:35.931943 IP c-185-45-236-223.customer.ggaweb.ch.8333 > tom-Latitude-3570.49070: tcp 0
07:04:35.940420 IP 167.99.216.145.8333 > tom-Latitude-3570.57976: tcp 0
07:04:35.940435 IP 167.99.216.145.8333 > tom-Latitude-3570.57976: tcp 0
07:04:35.943087 IP bb42-60-217-183.singnet.com.sg.8333 > tom-Latitude-3570.60470: tcp 0
07:04:35.943787 IP c-185-45-236-223.customer.ggaweb.ch.8333 > tom-Latitude-3570.49070: tcp 0
07:04:35.943802 IP 2.56.9.15.8333 > tom-Latitude-3570.42516: tcp 0
07:04:35.943807 IP c-185-45-236-223.customer.ggaweb.ch.8333 > tom-Latitude-3570.49070: tcp 0
07:04:35.943809 IP bb42-60-217-183.singnet.com.sg.8333 > tom-Latitude-3570.60470: tcp 0
07:04:35.943811 IP 2.56.9.15.8333 > tom-Latitude-3570.42516: tcp 0
07:04:36.026877 IP c-185-45-236-223.customer.ggaweb.ch.8333 > tom-Latitude-3570.49070: tcp 24
07:04:36.027502 IP c-185-45-236-223.customer.ggaweb.ch.8333 > tom-Latitude-3570.49070: tcp 283
07:04:36.027631 IP tom-Latitude-3570.49070 > c-185-45-236-223.customer.ggaweb.ch.8333: tcp 0
07:04:36.028080 IP tom-Latitude-3570.49070 > c-185-45-236-223.customer.ggaweb.ch.8333: tcp 24
07:04:36.029568 IP tom-Latitude-3570.49070 > c-185-45-236-223.customer.ggaweb.ch.8333: tcp 37
07:04:36.061708 IP c-185-45-236-223.customer.ggaweb.ch.8333 > tom-Latitude-3570.49070: tcp 0
