08:37:28.239114 IP 2.56.9.15.8333 > tom-Latitude-3570.42516: tcp 24
08:37:28.239133 IP 2.56.9.15.8333 > tom-Latitude-3570.42516: tcp 289
08:37:28.239138 IP 2.56.9.15.8333 > tom-Latitude-3570.42516: tcp 289
08:37:28.239165 IP tom-Latitude-3570.42516 > 2.56.9.15.8333: tcp 0
08:37:28.239195 IP vmi195435.contaboserver.net.8333 > tom-Latitude-3570.39110: tcp 24
08:37:28.239199 IP vmi195435.contaboserver.net.8333 > tom-Latitude-3570.39110: tcp 217
08:37:28.239257 IP tom-Latitude-3570.39110 > vmi195435.contaboserver.net.8333: tcp 0
08:37:28.239449 IP tom-Latitude-3570.42516 > 2.56.9.15.8333: tcp 24
08:37:28.241378 IP tom-Latitude-3570.42516 > 2.56.9.15.8333: tcp 73
08:37:28.277731 IP 2.56.9.15.8333 > tom-Latitude-3570.42516: tcp 0
08:37:28.277745 IP 2.56.9.15.8333 > tom-Latitude-3570.42516: tcp 0
08:37:28.376865 IP 2.56.9.15.8333 > tom-Latitude-3570.42516: tcp 24
08:37:28.376885 IP 2.56.9.15.8333 > tom-Latitude-3570.42516: tcp 364
08:37:28.376889 IP 2.56.9.15.8333 > tom-Latitude-3570.42516: tcp 24
08:37:28.376892 IP 2.56.9.15.8333 > tom-Latitude-3570.42516: tcp 226
08:37:28.376978 IP tom-Latitude-3570.42516 > 2.56.9.15.8333: tcp 0
08:37:28.627782 IP static-87-75-105-186.vodafonexdsl.co.uk.8333 > tom-Latitude-3570.46284: tcp 24
08:37:28.634318 IP static-87-75-105-186.vodafonexdsl.co.uk.8333 > tom-Latitude-3570.46284: tcp 289
08:37:28.634448 IP tom-Latitude-3570.46284 > static-87-75-105-186.vodafonexdsl.co.uk.8333: tcp 0
08:37:28.735005 IP tom-Latitude-3570.49070 > c-185-45-236-223.customer.ggaweb.ch.8333: tcp 24
08:37:28.736831 IP tom-Latitude-3570.49070 > c-185-45-236-223.customer.ggaweb.ch.8333: tcp 73
08:37:28.769240 IP c-185-45-236-223.customer.ggaweb.ch.8333 > tom-Latitude-3570.49070: tcp 0
08:37:28.779334 IP c-185-45-236-223.customer.ggaweb.ch.8333 > tom-Latitude-3570.49070: tcp 0
08:37:29.136411 IP tom-Latitude-3570.60470 > bb42-60-217-183.singnet.com.sg.8333: tcp 24
08:37:29.138351 IP tom-Latitude-3570.60470 > bb42-60-217-183.singnet.com.sg.8333: tcp 73
08:37:29.197883 IP bb42-60-217-183.singnet.com.sg.8333 > tom-Latitude-3570.60470: tcp 0
08:37:29.197898 IP bb42-60-217-183.singnet.com.sg.8333 > tom-Latitude-3570.60470: tcp 0
08:37:29.437278 IP tom-Latitude-3570.57976 > 167.99.216.145.8333: tcp 24
08:37:29.441512 IP tom-Latitude-3570.57976 > 167.99.216.145.8333: tcp 73
08:37:29.472911 IP 167.99.216.145.8333 > tom-Latitude-3570.57976: tcp 0
08:37:29.477739 IP 167.99.216.145.8333 > tom-Latitude-3570.57976: tcp 0
08:37:29.550347 IP 2.56.9.15.8333 > tom-Latitude-3570.42516: tcp 24
08:37:29.550365 IP 2.56.9.15.8333 > tom-Latitude-3570.42516: tcp 8
08:37:29.550456 IP tom-Latitude-3570.42516 > 2.56.9.15.8333: tcp 0
08:37:29.550546 IP tom-Latitude-3570.42516 > 2.56.9.15.8333: tcp 24
08:37:29.552714 IP tom-Latitude-3570.42516 > 2.56.9.15.8333: tcp 8
08:37:29.588680 IP 2.56.9.15.8333 > tom-Latitude-3570.42516: tcp 0
08:37:29.588694 IP 2.56.9.15.8333 > tom-Latitude-3570.42516: tcp 0
08:37:29.877917 IP 167.99.216.145.8333 > tom-Latitude-3570.57976: tcp 24
08:37:29.877937 IP 167.99.216.145.8333 > tom-Latitude-3570.57976: tcp 73
08:37:29.878026 IP tom-Latitude-3570.57976 > 167.99.216.145.8333: tcp 0
08:37:29.884498 IP 167.99.216.145.8333 > tom-Latitude-3570.57976: tcp 73
08:37:29.884517 IP tom-Latitude-3570.57976 > 167.99.216.145.8333: tcp 0
08:37:30.287669 IP 81.198.101.144.8333 > tom-Latitude-3570.60988: tcp 24
08:37:30.287695 IP 81.198.101.144.8333 > tom-Latitude-3570.60988: tcp 109
08:37:30.287785 IP tom-Latitude-3570.60988 > 81.198.101.144.8333: tcp 0
08:37:30.287931 IP tom-Latitude-3570.60988 > 81.198.101.144.8333: tcp 24
08:37:30.292295 IP tom-Latitude-3570.60988 > 81.198.101.144.8333: tcp 37
08:37:30.296231 IP 81.198.101.144.8333 > tom-Latitude-3570.60988: tcp 109
08:37:30.296251 IP tom-Latitude-3570.60988 > 81.198.101.144.8333: tcp 0
08:37:30.327761 IP 81.198.101.144.8333 > tom-Latitude-3570.60988: tcp 0
08:37:30.330606 IP 81.198.101.144.8333 > tom-Latitude-3570.60988: tcp 0
08:37:30.415995 IP 81.198.101.144.8333 > tom-Latitude-3570.60988: tcp 24
08:37:30.416012 IP tom-Latitude-3570.60988 > 81.198.101.144.8333: tcp 0
08:37:30.416030 IP 81.198.101.144.8333 > tom-Latitude-3570.60988: tcp 226
08:37:30.416034 IP tom-Latitude-3570.60988 > 81.198.101.144.8333: tcp 0
08:37:30.463859 IP vmi195435.contaboserver.net.8333 > tom-Latitude-3570.39110: tcp 24
08:37:30.468716 IP vmi195435.contaboserver.net.8333 > tom-Latitude-3570.39110: tcp 109
08:37:30.468845 IP tom-Latitude-3570.39110 > vmi195435.contaboserver.net.8333: tcp 0
08:37:30.468995 IP tom-Latitude-3570.39110 > vmi195435.contaboserver.net.8333: tcp 24
08:37:30.470431 IP tom-Latitude-3570.39110 > vmi195435.contaboserver.net.8333: tcp 73
08:37:30.497981 IP vmi195435.contaboserver.net.8333 > tom-Latitude-3570.39110: tcp 0
08:37:30.505772 IP vmi195435.contaboserver.net.8333 > tom-Latitude-3570.39110: tcp 0
08:37:30.569407 IP tom-Latitude-3570.42516 > 2.56.9.15.8333: tcp 24
08:37:30.570741 IP tom-Latitude-3570.42516 > 2.56.9.15.8333: tcp 37
08:37:30.583664 IP vmi195435.contaboserver.net.8333 > tom-Latitude-3570.39110: tcp 24
08:37:30.607889 IP vmi195435.contaboserver.net.8333 > tom-Latitude-3570.39110: tcp 245
08:37:30.607923 IP vmi195435.contaboserver.net.8333 > tom-Latitude-3570.39110: tcp 24
08:37:30.607926 IP vmi195435.contaboserver.net.8333 > tom-Latitude-3570.39110: tcp 224
08:37:30.607928 IP 2.56.9.15.8333 > tom-Latitude-3570.42516: tcp 0
08:37:30.607933 IP 2.56.9.15.8333 > tom-Latitude-3570.42516: tcp 0
08:37:30.608010 IP tom-Latitude-3570.39110 > vmi195435.contaboserver.net.8333: tcp 0
08:37:30.798882 IP vmi195435.contaboserver.net.8333 > tom-Latitude-3570.39110: tcp 24
08:37:30.798901 IP vmi195435.contaboserver.net.8333 > tom-Latitude-3570.39110: tcp 73
08:37:30.798987 IP tom-Latitude-3570.39110 > vmi195435.contaboserver.net.8333: tcp 0
08:37:30.799131 IP tom-Latitude-3570.39110 > vmi195435.contaboserver.net.8333: tcp 24
08:37:30.801078 IP tom-Latitude-3570.39110 > vmi195435.contaboserver.net.8333: tcp 73
08:37:30.836850 IP vmi195435.contaboserver.net.8333 > tom-Latitude-3570.39110: tcp 0
08:37:30.837395 IP vmi195435.contaboserver.net.8333 > tom-Latitude-3570.39110: tcp 0
08:37:30.922779 IP vmi195435.contaboserver.net.8333 > tom-Latitude-3570.39110: tcp 24
08:37:30.922799 IP vmi195435.contaboserver.net.8333 > tom-Latitude-3570.39110: tcp 223
08:37:30.922804 IP vmi195435.contaboserver.net.8333 > tom-Latitude-3570.39110: tcp 24
08:37:30.922830 IP vmi195435.contaboserver.net.8333 > tom-Latitude-3570.39110: tcp 405
08:37:30.922891 IP tom-Latitude-3570.39110 > vmi195435.contaboserver.net.8333: tcp 0
08:37:31.325419 IP tom-Latitude-3570.56714 > ns3113832.ip-54-38-177.eu.8333: tcp 24
08:37:31.327451 IP tom-Latitude-3570.56714 > ns3113832.ip-54-38-177.eu.8333: tcp 253
08:37:31.377403 IP ns3113832.ip-54-38-177.eu.8333 > tom-Latitude-3570.56714: tcp 0
08:37:31.388465 IP ns3113832.ip-54-38-177.eu.8333 > tom-Latitude-3570.56714: tcp 0
08:37:31.446821 IP ns3113832.ip-54-38-177.eu.8333 > tom-Latitude-3570.56714: tcp 24
08:37:31.446839 IP ns3113832.ip-54-38-177.eu.8333 > tom-Latitude-3570.56714: tcp 37
08:37:31.446929 IP tom-Latitude-3570.56714 > ns3113832.ip-54-38-177.eu.8333: tcp 0
08:37:31.447019 IP tom-Latitude-3570.56714 > ns3113832.ip-54-38-177.eu.8333: tcp 24
08:37:31.448554 IP tom-Latitude-3570.56714 > ns3113832.ip-54-38-177.eu.8333: tcp 223
08:37:31.475449 IP ns3113832.ip-54-38-177.eu.8333 > tom-Latitude-3570.56714: tcp 0
08:37:31.476039 IP ns3113832.ip-54-38-177.eu.8333 > tom-Latitude-3570.56714: tcp 0
08:37:31.532478 IP 167.99.216.145.8333 > tom-Latitude-3570.57976: tcp 24
08:37:31.532496 IP tom-Latitude-3570.57976 > 167.99.216.145.8333: tcp 0
08:37:31.532514 IP 167.99.216.145.8333 > tom-Latitude-3570.57976: tcp 217
08:37:31.532518 IP tom-Latitude-3570.57976 > 167.99.216.145.8333: tcp 0
08:37:31.532779 IP tom-Latitude-3570.57976 > 167.99.216.145.8333: tcp 24
08:37:31.536365 IP tom-Latitude-3570.57976 > 167.99.216.145.8333: tcp 37
08:37:31.567609 IP 167.99.216.145.8333 > tom-Latitude-3570.57976: tcp 0
08:37:31.573723 IP 167.99.216.145.8333 > tom-Latitude-3570.57976: tcp 0
08:37:31.636839 IP 167.99.216.145.8333 > tom-Latitude-3570.57976: tcp 24
08:37:31.636860 IP 167.99.216.145.8333 > tom-Latitude-3570.57976: tcp 224
08:37:31.636963 IP tom-Latitude-3570.57976 > 167.99.216.145.8333: tcp 0
08:37:31.658965 IP c-185-45-236-223.customer.ggaweb.ch.8333 > tom-Latitude-3570.49070: tcp 24
08:37:31.658985 IP c-185-45-236-223.customer.ggaweb.ch.8333 > tom-Latitude-3570.49070: tcp 217
08:37:31.659074 IP tom-Latitude-3570.49070 > c-185-45-236-223.customer.ggaweb.ch.8333: tcp 0
08:37:31.859642 IP tom-Latitude-3570.49070 > c-185-45-236-223.customer.ggaweb.ch.8333: tcp 24
08:37:31.863976 IP tom-Latitude-3570.49070 > c-185-45-236-223.customer.ggaweb.ch.8333: tcp 8
08:37:31.866671 IP 2.56.9.15.8333 > tom-Latitude-3570.42516: tcp 24
08:37:31.866680 IP 2.56.9.15.8333 > tom-Latitude-3570.42516: tcp 181
08:37:31.866733 IP tom-Latitude-3570.42516 > 2.56.9.15.8333: tcp 0
08:37:31.904347 IP c-185-45-236-223.customer.ggaweb.ch.8333 > tom-Latitude-3570.49070: tcp 0
08:37:31.904351 IP c-185-45-236-223.customer.ggaweb.ch.8333 > tom-Latitude-3570.49070: tcp 0
08:37:31.947872 IP ns3113832.ip-54-38-177.eu.8333 > tom-Latitude-3570.56714: tcp 24
08:37:31.947876 IP ns3113832.ip-54-38-177.eu.8333 > tom-Latitude-3570.56714: tcp 8
08:37:31.947929 IP tom-Latitude-3570.56714 > ns3113832.ip-54-38-177.eu.8333: tcp 0
08:37:31.947969 IP tom-Latitude-3570.56714 > ns3113832.ip-54-38-177.eu.8333: tcp 24
08:37:31.951892 IP tom-Latitude-3570.56714 > ns3113832.ip-54-38-177.eu.8333: tcp 8
08:37:31.962772 IP vmi195435.contaboserver.net.8333 > tom-Latitude-3570.39110: tcp 24
08:37:31.962800 IP vmi195435.contaboserver.net.8333 > tom-Latitude-3570.39110: tcp 8
08:37:31.962848 IP tom-Latitude-3570.39110 > vmi195435.contaboserver.net.8333: tcp 0
08:37:31.962877 IP tom-Latitude-3570.39110 > vmi195435.contaboserver.net.8333: tcp 24
08:37:31.966943 IP tom-Latitude-3570.39110 > vmi195435.contaboserver.net.8333: tcp 8
08:37:31.981318 IP c-185-45-236-223.customer.ggaweb.ch.8333 > tom-Latitude-3570.49070: tcp 24
08:37:31.981344 IP c-185-45-236-223.customer.ggaweb.ch.8333 > tom-Latitude-3570.49070: tcp 8
08:37:31.981395 IP tom-Latitude-3570.49070 > c-185-45-236-223.customer.ggaweb.ch.8333: tcp 0
08:37:31.985094 IP ns3113832.ip-54-38-177.eu.8333 > tom-Latitude-3570.56714: tcp 0
08:37:31.985706 IP ns3113832.ip-54-38-177.eu.8333 > tom-Latitude-3570.56714: tcp 0
08:37:31.993182 IP vmi195435.contaboserver.net.8333 > tom-Latitude-3570.39110: tcp 0
08:37:31.993778 IP vmi195435.contaboserver.net.8333 > tom-Latitude-3570.39110: tcp 0
08:37:32.181969 IP tom-Latitude-3570.39110 > vmi195435.contaboserver.net.8333: tcp 24
08:37:32.186080 IP tom-Latitude-3570.39110 > vmi195435.contaboserver.net.8333: tcp 37
08:37:32.217376 IP vmi195435.contaboserver.net.8333 > tom-Latitude-3570.39110: tcp 0
08:37:32.225373 IP vmi195435.contaboserver.net.8333 > tom-Latitude-3570.39110: tcp 0
08:37:32.483048 IP tom-Latitude-3570.60988 > 81.198.101.144.8333: tcp 24
08:37:32.485334 IP tom-Latitude-3570.60988 > 81.198.101.144.8333: tcp 181
08:37:32.487250 IP 167.99.216.145.8333 > tom-Latitude-3570.57976: tcp 24
08:37:32.487270 IP 167.99.216.145.8333 > tom-Latitude-3570.57976: tcp 37
08:37:32.487361 IP tom-Latitude-3570.57976 > 167.99.216.145.8333: tcp 0
08:37:32.487496 IP tom-Latitude-3570.57976 > 167.99.216.145.8333: tcp 24
08:37:32.488887 IP tom-Latitude-3570.57976 > 167.99.216.145.8333: tcp 37
08:37:32.525493 IP 81.198.101.144.8333 > tom-Latitude-3570.60988: tcp 0
08:37:32.525508 IP 81.198.101.144.8333 > tom-Latitude-3570.60988: tcp 0
08:37:32.525511 IP 167.99.216.145.8333 > tom-Latitude-3570.57976: tcp 0
08:37:32.525514 IP 167.99.216.145.8333 > tom-Latitude-3570.57976: tcp 0
08:37:32.590707 IP 167.99.216.145.8333 > tom-Latitude-3570.57976: tcp 24
08:37:32.590725 IP 167.99.216.145.8333 > tom-Latitude-3570.57976: tcp 226
08:37:32.590842 IP tom-Latitude-3570.57976 > 167.99.216.145.8333: tcp 0
08:37:33.393858 IP tom-Latitude-3570.46284 > static-87-75-105-186.vodafonexdsl.co.uk.8333: tcp 24
08:37:33.427350 IP tom-Latitude-3570.46284 > static-87-75-105-186.vodafonexdsl.co.uk.8333: tcp 253
08:37:33.429984 IP static-87-75-105-186.vodafonexdsl.co.uk.8333 > tom-Latitude-3570.46284: tcp 24
08:37:33.430003 IP static-87-75-105-186.vodafonexdsl.co.uk.8333 > tom-Latitude-3570.46284: tcp 289
08:37:33.430093 IP tom-Latitude-3570.46284 > static-87-75-105-186.vodafonexdsl.co.uk.8333: tcp 0
08:37:33.432443 IP tom-Latitude-3570.46284 > static-87-75-105-186.vodafonexdsl.co.uk.8333: tcp 61
08:37:33.465912 IP static-87-75-105-186.vodafonexdsl.co.uk.8333 > tom-Latitude-3570.46284: tcp 0
08:37:33.525328 IP static-87-75-105-186.vodafonexdsl.co.uk.8333 > tom-Latitude-3570.46284: tcp 0
08:37:33.530524 IP tom-Latitude-3570.56714 > ns3113832.ip-54-38-177.eu.8333: tcp 24
08:37:33.532658 IP tom-Latitude-3570.56714 > ns3113832.ip-54-38-177.eu.8333: tcp 73
08:37:33.551769 IP static-87-75-105-186.vodafonexdsl.co.uk.8333 > tom-Latitude-3570.46284: tcp 24
08:37:33.551775 IP static-87-75-105-186.vodafonexdsl.co.uk.8333 > tom-Latitude-3570.46284: tcp 380
08:37:33.551867 IP tom-Latitude-3570.46284 > static-87-75-105-186.vodafonexdsl.co.uk.8333: tcp 0
08:37:33.560711 IP ns3113832.ip-54-38-177.eu.8333 > tom-Latitude-3570.56714: tcp 0
08:37:33.563797 IP ns3113832.ip-54-38-177.eu.8333 > tom-Latitude-3570.56714: tcp 0
08:37:33.652587 IP tom-Latitude-3570.57976 > 167.99.216.145.8333: tcp 24
08:37:33.653550 IP tom-Latitude-3570.57976 > 167.99.216.145.8333: tcp 37
08:37:33.700695 IP 167.99.216.145.8333 > tom-Latitude-3570.57976: tcp 0
08:37:33.747540 IP 167.99.216.145.8333 > tom-Latitude-3570.57976: tcp 0
08:37:33.953675 IP tom-Latitude-3570.49070 > c-185-45-236-223.customer.ggaweb.ch.8333: tcp 24
08:37:33.955815 IP tom-Latitude-3570.49070 > c-185-45-236-223.customer.ggaweb.ch.8333: tcp 73
08:37:33.987522 IP c-185-45-236-223.customer.ggaweb.ch.8333 > tom-Latitude-3570.49070: tcp 0
08:37:33.998727 IP c-185-45-236-223.customer.ggaweb.ch.8333 > tom-Latitude-3570.49070: tcp 0
08:37:34.154424 IP tom-Latitude-3570.60988 > 81.198.101.144.8333: tcp 24
08:37:34.157783 IP tom-Latitude-3570.60988 > 81.198.101.144.8333: tcp 73
08:37:34.189166 IP 81.198.101.144.8333 > tom-Latitude-3570.60988: tcp 0
08:37:34.195656 IP 81.198.101.144.8333 > tom-Latitude-3570.60988: tcp 0
08:37:34.254892 IP tom-Latitude-3570.60470 > bb42-60-217-183.singnet.com.sg.8333: tcp 24
08:37:34.255828 IP tom-Latitude-3570.60470 > bb42-60-217-183.singnet.com.sg.8333: tcp 289
08:37:34.287625 IP bb42-60-217-183.singnet.com.sg.8333 > tom-Latitude-3570.60470: tcp 0
08:37:34.295594 IP bb42-60-217-183.singnet.com.sg.8333 > tom-Latitude-3570.60470: tcp 0
08:37:34.555955 IP tom-Latitude-3570.60988 > 81.198.101.144.8333: tcp 24
08:37:34.556039 IP tom-Latitude-3570.56714 > ns3113832.ip-54-38-177.eu.8333: tcp 24
08:37:34.556067 IP tom-Latitude-3570.42516 > 2.56.9.15.8333: tcp 24
08:37:34.558076 IP tom-Latitude-3570.60988 > 81.198.101.144.8333: tcp 8
08:37:34.559023 IP tom-Latitude-3570.56714 > ns3113832.ip-54-38-177.eu.8333: tcp 37
08:37:34.559692 IP tom-Latitude-3570.42516 > 2.56.9.15.8333: tcp 8
08:37:34.562201 IP vmi195435.contaboserver.net.8333 > tom-Latitude-3570.39110: tcp 24
08:37:34.562221 IP vmi195435.contaboserver.net.8333 > tom-Latitude-3570.39110: tcp 109
08:37:34.562308 IP tom-Latitude-3570.39110 > vmi195435.contaboserver.net.8333: tcp 0
08:37:34.562449 IP tom-Latitude-3570.39110 > vmi195435.contaboserver.net.8333: tcp 24
08:37:34.563840 IP tom-Latitude-3570.39110 > vmi195435.contaboserver.net.8333: tcp 37
08:37:34.573686 IP bb42-60-217-183.singnet.com.sg.8333 > tom-Latitude-3570.60470: tcp 24
08:37:34.574403 IP bb42-60-217-183.singnet.com.sg.8333 > tom-Latitude-3570.60470: tcp 8
08:37:34.574531 IP tom-Latitude-3570.60470 > bb42-60-217-183.singnet.com.sg.8333: tcp 0
08:37:34.574617 IP tom-Latitude-3570.60470 > bb42-60-217-183.singnet.com.sg.8333: tcp 24
08:37:34.576137 IP tom-Latitude-3570.60470 > bb42-60-217-183.singnet.com.sg.8333: tcp 8
08:37:34.596665 IP ns3113832.ip-54-38-177.eu.8333 > tom-Latitude-3570.56714: tcp 0
08:37:34.596679 IP 81.198.101.144.8333 > tom-Latitude-3570.60988: tcp 0
08:37:34.596682 IP 2.56.9.15.8333 > tom-Latitude-3570.42516: tcp 0
08:37:34.596686 IP ns3113832.ip-54-38-177.eu.8333 > tom-Latitude-3570.56714: tcp 0
08:37:34.596688 IP 81.198.101.144.8333 > tom-Latitude-3570.60988: tcp 0
08:37:34.596690 IP 2.56.9.15.8333 > tom-Latitude-3570.42516: tcp 0
08:37:34.596692 IP vmi195435.contaboserver.net.8333 > tom-Latitude-3570.39110: tcp 0
08:37:34.596695 IP vmi195435.contaboserver.net.8333 > tom-Latitude-3570.39110: tcp 0
08:37:34.603280 IP bb42-60-217-183.singnet.com.sg.8333 > tom-Latitude-3570.60470: tcp 0
08:37:34.603295 IP bb42-60-217-183.singnet.com.sg.8333 > tom-Latitude-3570.60470: tcp 0
08:37:34.681072 IP vmi195435.contaboserver.net.8333 > tom-Latitude-3570.39110: tcp 24
08:37:34.681632 IP vmi195435.contaboserver.net.8333 > tom-Latitude-3570.39110: tcp 246
08:37:34.681758 IP tom-Latitude-3570.39110 > vmi195435.contaboserver.net.8333: tcp 0
08:37:34.694926 IP 81.198.101.144.8333 > tom-Latitude-3570.60988: tcp 24
08:37:34.694943 IP tom-Latitude-3570.60988 > 81.198.101.144.8333: tcp 0
08:37:34.694960 IP 81.198.101.144.8333 > tom-Latitude-3570.60988: tcp 8
08:37:34.694962 IP tom-Latitude-3570.60988 > 81.198.101.144.8333: tcp 0
08:37:34.696352 IP 2.56.9.15.8333 > tom-Latitude-3570.42516: tcp 24
08:37:34.696965 IP 2.56.9.15.8333 > tom-Latitude-3570.42516: tcp 8
08:37:34.697095 IP tom-Latitude-3570.42516 > 2.56.9.15.8333: tcp 0
08:37:34.893147 IP 167.99.216.145.8333 > tom-Latitude-3570.57976: tcp 24
08:37:34.893166 IP 167.99.216.145.8333 > tom-Latitude-3570.57976: tcp 37
08:37:34.893169 IP c-185-45-236-223.customer.ggaweb.ch.8333 > tom-Latitude-3570.49070: tcp 24
08:37:34.893173 IP c-185-45-236-223.customer.ggaweb.ch.8333 > tom-Latitude-3570.49070: tcp 145
08:37:34.893259 IP tom-Latitude-3570.49070 > c-185-45-236-223.customer.ggaweb.ch.8333: tcp 0
08:37:34.893289 IP tom-Latitude-3570.57976 > 167.99.216.145.8333: tcp 0
08:37:34.893437 IP tom-Latitude-3570.49070 > c-185-45-236-223.customer.ggaweb.ch.8333: tcp 24
08:37:34.906073 IP 167.99.216.145.8333 > tom-Latitude-3570.57976: tcp 37
08:37:34.906091 IP tom-Latitude-3570.57976 > 167.99.216.145.8333: tcp 0
08:37:34.911911 IP tom-Latitude-3570.49070 > c-185-45-236-223.customer.ggaweb.ch.8333: tcp 109
08:37:34.980859 IP c-185-45-236-223.customer.ggaweb.ch.8333 > tom-Latitude-3570.49070: tcp 0
08:37:34.980873 IP c-185-45-236-223.customer.ggaweb.ch.8333 > tom-Latitude-3570.49070: tcp 0
08:37:34.993910 IP tom-Latitude-3570.42516 > 2.56.9.15.8333: tcp 24
08:37:34.993953 IP tom-Latitude-3570.46284 > static-87-75-105-186.vodafonexdsl.co.uk.8333: tcp 24
08:37:34.994853 IP tom-Latitude-3570.42516 > 2.56.9.15.8333: tcp 109
08:37:34.995483 IP tom-Latitude-3570.46284 > static-87-75-105-186.vodafonexdsl.co.uk.8333: tcp 37
08:37:35.026646 IP 2.56.9.15.8333 > tom-Latitude-3570.42516: tcp 0
08:37:35.026661 IP 2.56.9.15.8333 > tom-Latitude-3570.42516: tcp 0
08:37:35.026664 IP static-87-75-105-186.vodafonexdsl.co.uk.8333 > tom-Latitude-3570.46284: tcp 0
08:37:35.026667 IP static-87-75-105-186.vodafonexdsl.co.uk.8333 > tom-Latitude-3570.46284: tcp 0
08:37:35.029832 IP c-185-45-236-223.customer.ggaweb.ch.8333 > tom-Latitude-3570.49070: tcp 24
08:37:35.031501 IP c-185-45-236-223.customer.ggaweb.ch.8333 > tom-Latitude-3570.49070: tcp 506
08:37:35.031520 IP c-185-45-236-223.customer.ggaweb.ch.8333 > tom-Latitude-3570.49070: tcp 281
08:37:35.031608 IP tom-Latitude-3570.49070 > c-185-45-236-223.customer.ggaweb.ch.8333: tcp 0
08:37:35.032235 IP tom-Latitude-3570.46284 > static-87-75-105-186.vodafonexdsl.co.uk.8333: tcp 24
08:37:35.038769 IP tom-Latitude-3570.46284 > static-87-75-105-186.vodafonexdsl.co.uk.8333: tcp 37
08:37:35.065081 IP static-87-75-105-186.vodafonexdsl.co.uk.8333 > tom-Latitude-3570.46284: tcp 0
08:37:35.065629 IP static-87-75-105-186.vodafonexdsl.co.uk.8333 > tom-Latitude-3570.46284: tcp 0
08:37:35.133402 IP tom-Latitude-3570.56714 > ns3113832.ip-54-38-177.eu.8333: tcp 24
08:37:35.134340 IP tom-Latitude-3570.56714 > ns3113832.ip-54-38-177.eu.8333: tcp 177
08:37:35.183448 IP ns3113832.ip-54-38-177.eu.8333 > tom-Latitude-3570.56714: tcp 0
08:37:35.183463 IP ns3113832.ip-54-38-177.eu.8333 > tom-Latitude-3570.56714: tcp 0
08:37:35.253183 IP ns3113832.ip-54-38-177.eu.8333 > tom-Latitude-3570.56714: tcp 24
08:37:35.253201 IP ns3113832.ip-54-38-177.eu.8333 > tom-Latitude-3570.56714: tcp 8
08:37:35.253204 IP ns3113832.ip-54-38-177.eu.8333 > tom-Latitude-3570.56714: tcp 24
08:37:35.253207 IP ns3113832.ip-54-38-177.eu.8333 > tom-Latitude-3570.56714: tcp 145
08:37:35.253297 IP tom-Latitude-3570.56714 > ns3113832.ip-54-38-177.eu.8333: tcp 0
08:37:35.253409 IP tom-Latitude-3570.56714 > ns3113832.ip-54-38-177.eu.8333: tcp 24
08:37:35.253478 IP tom-Latitude-3570.56714 > ns3113832.ip-54-38-177.eu.8333: tcp 1057
08:37:35.294113 IP ns3113832.ip-54-38-177.eu.8333 > tom-Latitude-3570.56714: tcp 0
08:37:35.294684 IP ns3113832.ip-54-38-177.eu.8333 > tom-Latitude-3570.56714: tcp 0
08:37:35.554590 IP tom-Latitude-3570.57976 > 167.99.216.145.8333: tcp 24
08:37:35.561719 IP tom-Latitude-3570.57976 > 167.99.216.145.8333: tcp 8
08:37:35.562262 IP vmi195435.contaboserver.net.8333 > tom-Latitude-3570.39110: tcp 24
08:37:35.567587 IP vmi195435.contaboserver.net.8333 > tom-Latitude-3570.39110: tcp 145
08:37:35.567605 IP c-185-45-236-223.customer.ggaweb.ch.8333 > tom-Latitude-3570.49070: tcp 24
08:37:35.567609 IP c-185-45-236-223.customer.ggaweb.ch.8333 > tom-Latitude-3570.49070: tcp 37
08:37:35.567612 IP vmi195435.contaboserver.net.8333 > tom-Latitude-3570.39110: tcp 145
08:37:35.567639 IP tom-Latitude-3570.39110 > vmi195435.contaboserver.net.8333: tcp 0
08:37:35.567732 IP tom-Latitude-3570.49070 > c-185-45-236-223.customer.ggaweb.ch.8333: tcp 0
08:37:35.567851 IP tom-Latitude-3570.39110 > vmi195435.contaboserver.net.8333: tcp 24
08:37:35.592690 IP 167.99.216.145.8333 > tom-Latitude-3570.57976: tcp 0
08:37:35.604893 IP 167.99.216.145.8333 > tom-Latitude-3570.57976: tcp 0
08:37:35.616999 IP c-185-45-236-223.customer.ggaweb.ch.8333 > tom-Latitude-3570.49070: tcp 37
08:37:35.617017 IP tom-Latitude-3570.49070 > c-185-45-236-223.customer.ggaweb.ch.8333: tcp 0
08:37:35.624378 IP tom-Latitude-3570.39110 > vmi195435.contaboserver.net.8333: tcp 37
08:37:35.655319 IP vmi195435.contaboserver.net.8333 > tom-Latitude-3570.39110: tcp 0
08:37:35.656639 IP vmi195435.contaboserver.net.8333 > tom-Latitude-3570.39110: tcp 0
08:37:35.665269 IP 167.99.216.145.8333 > tom-Latitude-3570.57976: tcp 24
08:37:35.665286 IP tom-Latitude-3570.57976 > 167.99.216.145.8333: tcp 0
08:37:35.665303 IP 167.99.216.145.8333 > tom-Latitude-3570.57976: tcp 8
08:37:35.665305 IP tom-Latitude-3570.57976 > 167.99.216.145.8333: tcp 0
08:37:35.665506 IP tom-Latitude-3570.42516 > 2.56.9.15.8333: tcp 24
08:37:35.675491 IP tom-Latitude-3570.42516 > 2.56.9.15.8333: tcp 109
08:37:35.711029 IP 2.56.9.15.8333 > tom-Latitude-3570.42516: tcp 0
08:37:35.711043 IP 2.56.9.15.8333 > tom-Latitude-3570.42516: tcp 0
08:37:35.735498 IP vmi195435.contaboserver.net.8333 > tom-Latitude-3570.39110: tcp 24
08:37:35.736347 IP vmi195435.contaboserver.net.8333 > tom-Latitude-3570.39110: tcp 225
08:37:35.736474 IP tom-Latitude-3570.39110 > vmi195435.contaboserver.net.8333: tcp 0
08:37:35.799180 IP static-87-75-105-186.vodafonexdsl.co.uk.8333 > tom-Latitude-3570.46284: tcp 24
08:37:35.806188 IP static-87-75-105-186.vodafonexdsl.co.uk.8333 > tom-Latitude-3570.46284: tcp 181
08:37:35.806318 IP tom-Latitude-3570.46284 > static-87-75-105-186.vodafonexdsl.co.uk.8333: tcp 0
08:37:35.806503 IP tom-Latitude-3570.46284 > static-87-75-105-186.vodafonexdsl.co.uk.8333: tcp 24
08:37:35.807723 IP tom-Latitude-3570.46284 > static-87-75-105-186.vodafonexdsl.co.uk.8333: tcp 73
08:37:35.846995 IP static-87-75-105-186.vodafonexdsl.co.uk.8333 > tom-Latitude-3570.46284: tcp 0
08:37:35.847001 IP static-87-75-105-186.vodafonexdsl.co.uk.8333 > tom-Latitude-3570.46284: tcp 0
08:37:35.912236 IP static-87-75-105-186.vodafonexdsl.co.uk.8333 > tom-Latitude-3570.46284: tcp 24
08:37:35.918167 IP static-87-75-105-186.vodafonexdsl.co.uk.8333 > tom-Latitude-3570.46284: tcp 226
08:37:35.918185 IP static-87-75-105-186.vodafonexdsl.co.uk.8333 > tom-Latitude-3570.46284: tcp 24
08:37:35.918188 IP static-87-75-105-186.vodafonexdsl.co.uk.8333 > tom-Latitude-3570.46284: tcp 223
08:37:35.918281 IP tom-Latitude-3570.46284 > static-87-75-105-186.vodafonexdsl.co.uk.8333: tcp 0
08:37:36.019075 IP tom-Latitude-3570.49070 > c-185-45-236-223.customer.ggaweb.ch.8333: tcp 24
08:37:36.020324 IP tom-Latitude-3570.49070 > c-185-45-236-223.customer.ggaweb.ch.8333: tcp 73
08:37:36.050191 IP c-185-45-236-223.customer.ggaweb.ch.8333 > tom-Latitude-3570.49070: tcp 0
08:37:36.055853 IP c-185-45-236-223.customer.ggaweb.ch.8333 > tom-Latitude-3570.49070: tcp 0
08:37:36.420329 IP tom-Latitude-3570.56714 > ns3113832.ip-54-38-177.eu.8333: tcp 24
08:37:36.420396 IP tom-Latitude-3570.57976 > 167.99.216.145.8333: tcp 24
08:37:36.424324 IP tom-Latitude-3570.56714 > ns3113832.ip-54-38-177.eu.8333: tcp 109
08:37:36.427840 IP tom-Latitude-3570.57976 > 167.99.216.145.8333: tcp 217
08:37:36.440282 IP ns3113832.ip-54-38-177.eu.8333 > tom-Latitude-3570.56714: tcp 24
08:37:36.440304 IP ns3113832.ip-54-38-177.eu.8333 > tom-Latitude-3570.56714: tcp 109
08:37:36.440393 IP tom-Latitude-3570.56714 > ns3113832.ip-54-38-177.eu.8333: tcp 0
08:37:36.464047 IP ns3113832.ip-54-38-177.eu.8333 > tom-Latitude-3570.56714: tcp 0
08:37:36.465458 IP 167.99.216.145.8333 > tom-Latitude-3570.57976: tcp 0
08:37:36.504812 IP ns3113832.ip-54-38-177.eu.8333 > tom-Latitude-3570.56714: tcp 0
08:37:36.504826 IP 167.99.216.145.8333 > tom-Latitude-3570.57976: tcp 0
08:37:36.741576 IP tom-Latitude-3570.39110 > vmi195435.contaboserver.net.8333: tcp 24
08:37:36.743758 IP tom-Latitude-3570.39110 > vmi195435.contaboserver.net.8333: tcp 73
08:37:36.790949 IP vmi195435.contaboserver.net.8333 > tom-Latitude-3570.39110: tcp 0
08:37:36.799191 IP vmi195435.contaboserver.net.8333 > tom-Latitude-3570.39110: tcp 0
08:37:36.842085 IP tom-Latitude-3570.60988 > 81.198.101.144.8333: tcp 24
08:37:36.844918 IP tom-Latitude-3570.60988 > 81.198.101.144.8333: tcp 253
08:37:36.898319 IP 81.198.101.144.8333 > tom-Latitude-3570.60988: tcp 0
08:37:36.898333 IP 81.198.101.144.8333 > tom-Latitude-3570.60988: tcp 0
08:37:37.661345 IP ns3113832.ip-54-38-177.eu.8333 > tom-Latitude-3570.56714: tcp 24
08:37:37.661365 IP ns3113832.ip-54-38-177.eu.8333 > tom-Latitude-3570.56714: tcp 31
08:37:37.661453 IP tom-Latitude-3570.56714 > ns3113832.ip-54-38-177.eu.8333: tcp 0
08:37:37.731504 IP bb42-60-217-183.singnet.com.sg.8333 > tom-Latitude-3570.60470: tcp 24
08:37:37.731525 IP bb42-60-217-183.singnet.com.sg.8333 > tom-Latitude-3570.60470: tcp 325
08:37:37.731617 IP tom-Latitude-3570.60470 > bb42-60-217-183.singnet.com.sg.8333: tcp 0
08:37:37.731852 IP tom-Latitude-3570.60470 > bb42-60-217-183.singnet.com.sg.8333: tcp 24
08:37:37.820584 IP tom-Latitude-3570.60470 > bb42-60-217-183.singnet.com.sg.8333: tcp 73
08:37:37.856863 IP bb42-60-217-183.singnet.com.sg.8333 > tom-Latitude-3570.60470: tcp 0
08:37:37.856870 IP bb42-60-217-183.singnet.com.sg.8333 > tom-Latitude-3570.60470: tcp 0
08:37:38.233235 IP tom-Latitude-3570.60470 > bb42-60-217-183.singnet.com.sg.8333: tcp 24
08:37:38.240458 IP tom-Latitude-3570.60470 > bb42-60-217-183.singnet.com.sg.8333: tcp 8
08:37:38.289306 IP bb42-60-217-183.singnet.com.sg.8333 > tom-Latitude-3570.60470: tcp 24
08:37:38.305800 IP bb42-60-217-183.singnet.com.sg.8333 > tom-Latitude-3570.60470: tcp 247
08:37:38.305820 IP bb42-60-217-183.singnet.com.sg.8333 > tom-Latitude-3570.60470: tcp 24
08:37:38.305912 IP tom-Latitude-3570.60470 > bb42-60-217-183.singnet.com.sg.8333: tcp 0
08:37:38.321107 IP bb42-60-217-183.singnet.com.sg.8333 > tom-Latitude-3570.60470: tcp 225
08:37:38.321124 IP 167.99.216.145.8333 > tom-Latitude-3570.57976: tcp 24
08:37:38.321134 IP tom-Latitude-3570.57976 > 167.99.216.145.8333: tcp 0
08:37:38.321162 IP 167.99.216.145.8333 > tom-Latitude-3570.57976: tcp 31
08:37:38.321164 IP tom-Latitude-3570.57976 > 167.99.216.145.8333: tcp 0
08:37:38.321168 IP bb42-60-217-183.singnet.com.sg.8333 > tom-Latitude-3570.60470: tcp 0
08:37:38.321173 IP bb42-60-217-183.singnet.com.sg.8333 > tom-Latitude-3570.60470: tcp 0
08:37:38.363903 IP tom-Latitude-3570.60470 > bb42-60-217-183.singnet.com.sg.8333: tcp 0
08:37:38.421924 IP tom-Latitude-3570.49070 > c-185-45-236-223.customer.ggaweb.ch.8333: tcp 24
08:37:38.426306 IP tom-Latitude-3570.49070 > c-185-45-236-223.customer.ggaweb.ch.8333: tcp 73
08:37:38.463804 IP c-185-45-236-223.customer.ggaweb.ch.8333 > tom-Latitude-3570.49070: tcp 0
08:37:38.468576 IP c-185-45-236-223.customer.ggaweb.ch.8333 > tom-Latitude-3570.49070: tcp 0
08:37:38.622655 IP tom-Latitude-3570.39110 > vmi195435.contaboserver.net.8333: tcp 24
08:37:38.626579 IP tom-Latitude-3570.39110 > vmi195435.contaboserver.net.8333: tcp 73
08:37:38.657445 IP vmi195435.contaboserver.net.8333 > tom-Latitude-3570.39110: tcp 0
08:37:38.669309 IP vmi195435.contaboserver.net.8333 > tom-Latitude-3570.39110: tcp 0
08:37:38.672703 IP bb42-60-217-183.singnet.com.sg.8333 > tom-Latitude-3570.60470: tcp 24
08:37:38.672727 IP tom-Latitude-3570.60470 > bb42-60-217-183.singnet.com.sg.8333: tcp 0
08:37:38.673545 IP bb42-60-217-183.singnet.com.sg.8333 > tom-Latitude-3570.60470: tcp 8
08:37:38.673563 IP tom-Latitude-3570.60470 > bb42-60-217-183.singnet.com.sg.8333: tcp 0
08:37:38.974625 IP tom-Latitude-3570.60988 > 81.198.101.144.8333: tcp 24
08:37:39.067627 IP tom-Latitude-3570.60988 > 81.198.101.144.8333: tcp 73
08:37:39.107930 IP 81.198.101.144.8333 > tom-Latitude-3570.60988: tcp 0
08:37:39.115846 IP 81.198.101.144.8333 > tom-Latitude-3570.60988: tcp 0
08:37:39.501248 IP ns3113832.ip-54-38-177.eu.8333 > tom-Latitude-3570.56714: tcp 24
08:37:39.501267 IP ns3113832.ip-54-38-177.eu.8333 > tom-Latitude-3570.56714: tcp 361
08:37:39.501357 IP tom-Latitude-3570.56714 > ns3113832.ip-54-38-177.eu.8333: tcp 0
08:37:39.501601 IP tom-Latitude-3570.56714 > ns3113832.ip-54-38-177.eu.8333: tcp 24
08:37:39.504342 IP ns3113832.ip-54-38-177.eu.8333 > tom-Latitude-3570.56714: tcp 361
08:37:39.504351 IP tom-Latitude-3570.56714 > ns3113832.ip-54-38-177.eu.8333: tcp 289
08:37:39.535153 IP ns3113832.ip-54-38-177.eu.8333 > tom-Latitude-3570.56714: tcp 0
08:37:39.535779 IP ns3113832.ip-54-38-177.eu.8333 > tom-Latitude-3570.56714: tcp 0
08:37:39.601664 IP ns3113832.ip-54-38-177.eu.8333 > tom-Latitude-3570.56714: tcp 24
08:37:39.602754 IP ns3113832.ip-54-38-177.eu.8333 > tom-Latitude-3570.56714: tcp 818
08:37:39.602778 IP ns3113832.ip-54-38-177.eu.8333 > tom-Latitude-3570.56714: tcp 24
08:37:39.602780 IP ns3113832.ip-54-38-177.eu.8333 > tom-Latitude-3570.56714: tcp 248
08:37:39.602783 IP ns3113832.ip-54-38-177.eu.8333 > tom-Latitude-3570.56714: tcp 24
08:37:39.602785 IP ns3113832.ip-54-38-177.eu.8333 > tom-Latitude-3570.56714: tcp 250
08:37:39.602787 IP ns3113832.ip-54-38-177.eu.8333 > tom-Latitude-3570.56714: tcp 24
08:37:39.602789 IP ns3113832.ip-54-38-177.eu.8333 > tom-Latitude-3570.56714: tcp 225
08:37:39.602791 IP ns3113832.ip-54-38-177.eu.8333 > tom-Latitude-3570.56714: tcp 24
08:37:39.602793 IP ns3113832.ip-54-38-177.eu.8333 > tom-Latitude-3570.56714: tcp 191
08:37:39.602835 IP tom-Latitude-3570.56714 > ns3113832.ip-54-38-177.eu.8333: tcp 0
08:37:39.669842 IP ns3113832.ip-54-38-177.eu.8333 > tom-Latitude-3570.56714: tcp 917
08:37:39.711905 IP tom-Latitude-3570.56714 > ns3113832.ip-54-38-177.eu.8333: tcp 0
08:37:39.788757 IP 81.198.101.144.8333 > tom-Latitude-3570.60988: tcp 24
08:37:39.788781 IP tom-Latitude-3570.60988 > 81.198.101.144.8333: tcp 0
08:37:39.788814 IP 81.198.101.144.8333 > tom-Latitude-3570.60988: tcp 181
08:37:39.788819 IP tom-Latitude-3570.60988 > 81.198.101.144.8333: tcp 0
08:37:40.090119 IP tom-Latitude-3570.42516 > 2.56.9.15.8333: tcp 24
08:37:40.173097 IP tom-Latitude-3570.42516 > 2.56.9.15.8333: tcp 469
08:37:40.190573 IP tom-Latitude-3570.49070 > c-185-45-236-223.customer.ggaweb.ch.8333: tcp 24
08:37:40.192583 IP tom-Latitude-3570.49070 > c-185-45-236-223.customer.ggaweb.ch.8333: tcp 289
08:37:40.193373 IP 167.99.216.145.8333 > tom-Latitude-3570.57976: tcp 24
08:37:40.193391 IP tom-Latitude-3570.57976 > 167.99.216.145.8333: tcp 0
08:37:40.193406 IP 167.99.216.145.8333 > tom-Latitude-3570.57976: tcp 37
08:37:40.193408 IP tom-Latitude-3570.57976 > 167.99.216.145.8333: tcp 0
08:37:40.193410 IP 167.99.216.145.8333 > tom-Latitude-3570.57976: tcp 37
08:37:40.193413 IP tom-Latitude-3570.57976 > 167.99.216.145.8333: tcp 0
08:37:40.193607 IP tom-Latitude-3570.57976 > 167.99.216.145.8333: tcp 24
08:37:40.196941 IP tom-Latitude-3570.57976 > 167.99.216.145.8333: tcp 37
08:37:40.197955 IP 2.56.9.15.8333 > tom-Latitude-3570.42516: tcp 0
08:37:40.206109 IP 2.56.9.15.8333 > tom-Latitude-3570.42516: tcp 0
08:37:40.232143 IP c-185-45-236-223.customer.ggaweb.ch.8333 > tom-Latitude-3570.49070: tcp 0
08:37:40.232702 IP 167.99.216.145.8333 > tom-Latitude-3570.57976: tcp 0
08:37:40.232717 IP c-185-45-236-223.customer.ggaweb.ch.8333 > tom-Latitude-3570.49070: tcp 0
08:37:40.232721 IP 167.99.216.145.8333 > tom-Latitude-3570.57976: tcp 0
08:37:40.260314 IP static-87-75-105-186.vodafonexdsl.co.uk.8333 > tom-Latitude-3570.46284: tcp 24
08:37:40.271612 IP static-87-75-105-186.vodafonexdsl.co.uk.8333 > tom-Latitude-3570.46284: tcp 397
08:37:40.271769 IP tom-Latitude-3570.46284 > static-87-75-105-186.vodafonexdsl.co.uk.8333: tcp 0
08:37:40.271986 IP tom-Latitude-3570.46284 > static-87-75-105-186.vodafonexdsl.co.uk.8333: tcp 24
08:37:40.277039 IP tom-Latitude-3570.46284 > static-87-75-105-186.vodafonexdsl.co.uk.8333: tcp 37
08:37:40.305748 IP static-87-75-105-186.vodafonexdsl.co.uk.8333 > tom-Latitude-3570.46284: tcp 0
08:37:40.305762 IP static-87-75-105-186.vodafonexdsl.co.uk.8333 > tom-Latitude-3570.46284: tcp 0
08:37:40.374829 IP static-87-75-105-186.vodafonexdsl.co.uk.8333 > tom-Latitude-3570.46284: tcp 24
08:37:40.374849 IP static-87-75-105-186.vodafonexdsl.co.uk.8333 > tom-Latitude-3570.46284: tcp 519
08:37:40.374941 IP tom-Latitude-3570.46284 > static-87-75-105-186.vodafonexdsl.co.uk.8333: tcp 0
08:37:40.476328 IP tom-Latitude-3570.60988 > 81.198.101.144.8333: tcp 24
08:37:40.498475 IP tom-Latitude-3570.60988 > 81.198.101.144.8333: tcp 145
08:37:40.527130 IP 81.198.101.144.8333 > tom-Latitude-3570.60988: tcp 0
08:37:40.536236 IP 81.198.101.144.8333 > tom-Latitude-3570.60988: tcp 0
08:37:40.576696 IP tom-Latitude-3570.49070 > c-185-45-236-223.customer.ggaweb.ch.8333: tcp 24
08:37:40.581312 IP tom-Latitude-3570.49070 > c-185-45-236-223.customer.ggaweb.ch.8333: tcp 37
08:37:40.607412 IP c-185-45-236-223.customer.ggaweb.ch.8333 > tom-Latitude-3570.49070: tcp 0
08:37:40.615314 IP c-185-45-236-223.customer.ggaweb.ch.8333 > tom-Latitude-3570.49070: tcp 0
08:37:41.559949 IP static-87-75-105-186.vodafonexdsl.co.uk.8333 > tom-Latitude-3570.46284: tcp 24
08:37:41.559969 IP static-87-75-105-186.vodafonexdsl.co.uk.8333 > tom-Latitude-3570.46284: tcp 73
08:37:41.559972 IP static-87-75-105-186.vodafonexdsl.co.uk.8333 > tom-Latitude-3570.46284: tcp 73
08:37:41.560015 IP tom-Latitude-3570.46284 > static-87-75-105-186.vodafonexdsl.co.uk.8333: tcp 0
08:37:41.560029 IP 81.198.101.144.8333 > tom-Latitude-3570.60988: tcp 24
08:37:41.560032 IP tom-Latitude-3570.60988 > 81.198.101.144.8333: tcp 0
08:37:41.560218 IP tom-Latitude-3570.46284 > static-87-75-105-186.vodafonexdsl.co.uk.8333: tcp 24
08:37:41.562227 IP 81.198.101.144.8333 > tom-Latitude-3570.60988: tcp 37
08:37:41.562244 IP tom-Latitude-3570.60988 > 81.198.101.144.8333: tcp 0
08:37:41.562260 IP 81.198.101.144.8333 > tom-Latitude-3570.60988: tcp 37
08:37:41.562263 IP tom-Latitude-3570.60988 > 81.198.101.144.8333: tcp 0
08:37:41.570167 IP tom-Latitude-3570.46284 > static-87-75-105-186.vodafonexdsl.co.uk.8333: tcp 73
08:37:41.603629 IP static-87-75-105-186.vodafonexdsl.co.uk.8333 > tom-Latitude-3570.46284: tcp 0
08:37:41.612523 IP static-87-75-105-186.vodafonexdsl.co.uk.8333 > tom-Latitude-3570.46284: tcp 0
08:37:41.679608 IP static-87-75-105-186.vodafonexdsl.co.uk.8333 > tom-Latitude-3570.46284: tcp 24
08:37:41.679628 IP static-87-75-105-186.vodafonexdsl.co.uk.8333 > tom-Latitude-3570.46284: tcp 374
08:37:41.679633 IP static-87-75-105-186.vodafonexdsl.co.uk.8333 > tom-Latitude-3570.46284: tcp 24
08:37:41.679635 IP static-87-75-105-186.vodafonexdsl.co.uk.8333 > tom-Latitude-3570.46284: tcp 256
08:37:41.679730 IP tom-Latitude-3570.46284 > static-87-75-105-186.vodafonexdsl.co.uk.8333: tcp 0
08:37:41.958901 IP 2.56.9.15.8333 > tom-Latitude-3570.42516: tcp 24
08:37:41.958922 IP 2.56.9.15.8333 > tom-Latitude-3570.42516: tcp 181
08:37:41.959012 IP tom-Latitude-3570.42516 > 2.56.9.15.8333: tcp 0
08:37:41.959211 IP tom-Latitude-3570.42516 > 2.56.9.15.8333: tcp 24
08:37:41.960569 IP tom-Latitude-3570.42516 > 2.56.9.15.8333: tcp 73
08:37:41.998033 IP 2.56.9.15.8333 > tom-Latitude-3570.42516: tcp 0
08:37:41.998048 IP 2.56.9.15.8333 > tom-Latitude-3570.42516: tcp 0
08:37:42.091721 IP 2.56.9.15.8333 > tom-Latitude-3570.42516: tcp 24
08:37:42.092394 IP 2.56.9.15.8333 > tom-Latitude-3570.42516: tcp 660
08:37:42.092409 IP 2.56.9.15.8333 > tom-Latitude-3570.42516: tcp 24
08:37:42.092411 IP 2.56.9.15.8333 > tom-Latitude-3570.42516: tcp 191
08:37:42.092521 IP tom-Latitude-3570.42516 > 2.56.9.15.8333: tcp 0
08:37:42.092619 IP tom-Latitude-3570.60988 > 81.198.101.144.8333: tcp 24
08:37:42.093898 IP tom-Latitude-3570.60988 > 81.198.101.144.8333: tcp 31
08:37:42.125863 IP 81.198.101.144.8333 > tom-Latitude-3570.60988: tcp 0
08:37:42.126451 IP 81.198.101.144.8333 > tom-Latitude-3570.60988: tcp 0
08:37:42.369101 IP vmi195435.contaboserver.net.8333 > tom-Latitude-3570.39110: tcp 24
08:37:42.369122 IP vmi195435.contaboserver.net.8333 > tom-Latitude-3570.39110: tcp 577
08:37:42.369207 IP tom-Latitude-3570.39110 > vmi195435.contaboserver.net.8333: tcp 0
08:37:42.369451 IP tom-Latitude-3570.39110 > vmi195435.contaboserver.net.8333: tcp 24
08:37:42.370776 IP tom-Latitude-3570.39110 > vmi195435.contaboserver.net.8333: tcp 109
08:37:42.395542 IP vmi195435.contaboserver.net.8333 > tom-Latitude-3570.39110: tcp 577
08:37:42.395561 IP tom-Latitude-3570.39110 > vmi195435.contaboserver.net.8333: tcp 0
08:37:42.408870 IP vmi195435.contaboserver.net.8333 > tom-Latitude-3570.39110: tcp 0
08:37:42.408884 IP vmi195435.contaboserver.net.8333 > tom-Latitude-3570.39110: tcp 0
08:37:42.469848 IP tom-Latitude-3570.60470 > bb42-60-217-183.singnet.com.sg.8333: tcp 24
08:37:42.470794 IP tom-Latitude-3570.60470 > bb42-60-217-183.singnet.com.sg.8333: tcp 469
08:37:42.483640 IP vmi195435.contaboserver.net.8333 > tom-Latitude-3570.39110: tcp 24
08:37:42.483656 IP tom-Latitude-3570.39110 > vmi195435.contaboserver.net.8333: tcp 0
08:37:42.484495 IP vmi195435.contaboserver.net.8333 > tom-Latitude-3570.39110: tcp 224
08:37:42.484519 IP tom-Latitude-3570.39110 > vmi195435.contaboserver.net.8333: tcp 0
08:37:42.484550 IP vmi195435.contaboserver.net.8333 > tom-Latitude-3570.39110: tcp 24
08:37:42.484553 IP tom-Latitude-3570.39110 > vmi195435.contaboserver.net.8333: tcp 0
08:37:42.484558 IP vmi195435.contaboserver.net.8333 > tom-Latitude-3570.39110: tcp 226
08:37:42.484560 IP tom-Latitude-3570.39110 > vmi195435.contaboserver.net.8333: tcp 0
08:37:42.484563 IP vmi195435.contaboserver.net.8333 > tom-Latitude-3570.39110: tcp 24
08:37:42.484564 IP tom-Latitude-3570.39110 > vmi195435.contaboserver.net.8333: tcp 0
08:37:42.484568 IP vmi195435.contaboserver.net.8333 > tom-Latitude-3570.39110: tcp 226
08:37:42.484570 IP tom-Latitude-3570.39110 > vmi195435.contaboserver.net.8333: tcp 0
08:37:42.498231 IP bb42-60-217-183.singnet.com.sg.8333 > tom-Latitude-3570.60470: tcp 0
08:37:42.504703 IP bb42-60-217-183.singnet.com.sg.8333 > tom-Latitude-3570.60470: tcp 0
08:37:42.585856 IP tom-Latitude-3570.42516 > 2.56.9.15.8333: tcp 24
08:37:42.591595 IP tom-Latitude-3570.42516 > 2.56.9.15.8333: tcp 31
