01:17:27.693451 IP bb42-60-217-183.singnet.com.sg.8333 > tom-Latitude-3570.60470: tcp 24
01:17:27.694233 IP bb42-60-217-183.singnet.com.sg.8333 > tom-Latitude-3570.60470: tcp 8
01:17:27.694297 IP tom-Latitude-3570.60470 > bb42-60-217-183.singnet.com.sg.8333: tcp 0
01:17:27.848412 IP 167.99.216.145.8333 > tom-Latitude-3570.57976: tcp 24
01:17:27.849066 IP 167.99.216.145.8333 > tom-Latitude-3570.57976: tcp 145
01:17:27.849131 IP tom-Latitude-3570.57976 > 167.99.216.145.8333: tcp 0
01:17:27.849339 IP tom-Latitude-3570.57976 > 167.99.216.145.8333: tcp 24
01:17:27.850627 IP tom-Latitude-3570.57976 > 167.99.216.145.8333: tcp 73
01:17:27.883793 IP 167.99.216.145.8333 > tom-Latitude-3570.57976: tcp 0
01:17:27.884345 IP 167.99.216.145.8333 > tom-Latitude-3570.57976: tcp 0
01:17:27.965194 IP 167.99.216.145.8333 > tom-Latitude-3570.57976: tcp 24
01:17:27.965859 IP 167.99.216.145.8333 > tom-Latitude-3570.57976: tcp 189
01:17:27.965906 IP 167.99.216.145.8333 > tom-Latitude-3570.57976: tcp 24
01:17:27.965909 IP 167.99.216.145.8333 > tom-Latitude-3570.57976: tcp 223
01:17:27.965953 IP tom-Latitude-3570.57976 > 167.99.216.145.8333: tcp 0
01:17:28.139260 IP 2.56.9.15.8333 > tom-Latitude-3570.42516: tcp 24
01:17:28.139925 IP 2.56.9.15.8333 > tom-Latitude-3570.42516: tcp 73
01:17:28.139989 IP tom-Latitude-3570.42516 > 2.56.9.15.8333: tcp 0
01:17:28.253091 IP ns3113832.ip-54-38-177.eu.8333 > tom-Latitude-3570.56714: tcp 24
01:17:28.253110 IP ns3113832.ip-54-38-177.eu.8333 > tom-Latitude-3570.56714: tcp 73
01:17:28.253159 IP tom-Latitude-3570.56714 > ns3113832.ip-54-38-177.eu.8333: tcp 0
01:17:28.348330 IP ns3113832.ip-54-38-177.eu.8333 > tom-Latitude-3570.56714: tcp 73
01:17:28.348348 IP tom-Latitude-3570.56714 > ns3113832.ip-54-38-177.eu.8333: tcp 0
01:17:28.422535 IP vmi195435.contaboserver.net.8333 > tom-Latitude-3570.39110: tcp 24
01:17:28.422554 IP vmi195435.contaboserver.net.8333 > tom-Latitude-3570.39110: tcp 31
01:17:28.422618 IP tom-Latitude-3570.39110 > vmi195435.contaboserver.net.8333: tcp 0
01:17:28.623334 IP tom-Latitude-3570.39110 > vmi195435.contaboserver.net.8333: tcp 24
01:17:28.624083 IP tom-Latitude-3570.39110 > vmi195435.contaboserver.net.8333: tcp 145
01:17:28.656267 IP vmi195435.contaboserver.net.8333 > tom-Latitude-3570.39110: tcp 0
01:17:28.667427 IP vmi195435.contaboserver.net.8333 > tom-Latitude-3570.39110: tcp 0
01:17:28.895582 IP ns3113832.ip-54-38-177.eu.8333 > tom-Latitude-3570.56714: tcp 24
01:17:28.895597 IP tom-Latitude-3570.56714 > ns3113832.ip-54-38-177.eu.8333: tcp 0
01:17:28.896162 IP ns3113832.ip-54-38-177.eu.8333 > tom-Latitude-3570.56714: tcp 37
01:17:28.896176 IP tom-Latitude-3570.56714 > ns3113832.ip-54-38-177.eu.8333: tcp 0
01:17:28.896371 IP tom-Latitude-3570.56714 > ns3113832.ip-54-38-177.eu.8333: tcp 24
01:17:28.897502 IP tom-Latitude-3570.56714 > ns3113832.ip-54-38-177.eu.8333: tcp 37
01:17:28.934205 IP ns3113832.ip-54-38-177.eu.8333 > tom-Latitude-3570.56714: tcp 0
01:17:28.934854 IP ns3113832.ip-54-38-177.eu.8333 > tom-Latitude-3570.56714: tcp 0
01:17:28.992514 IP ns3113832.ip-54-38-177.eu.8333 > tom-Latitude-3570.56714: tcp 24
01:17:28.993237 IP ns3113832.ip-54-38-177.eu.8333 > tom-Latitude-3570.56714: tcp 420
01:17:28.993300 IP tom-Latitude-3570.56714 > ns3113832.ip-54-38-177.eu.8333: tcp 0
01:17:28.993947 IP tom-Latitude-3570.42516 > 2.56.9.15.8333: tcp 24
01:17:28.994042 IP tom-Latitude-3570.46284 > static-87-75-105-186.vodafonexdsl.co.uk.8333: tcp 24
01:17:28.994899 IP tom-Latitude-3570.46284 > static-87-75-105-186.vodafonexdsl.co.uk.8333: tcp 109
01:17:28.994908 IP tom-Latitude-3570.42516 > 2.56.9.15.8333: tcp 37
01:17:29.024648 IP 2.56.9.15.8333 > tom-Latitude-3570.42516: tcp 0
01:17:29.025249 IP static-87-75-105-186.vodafonexdsl.co.uk.8333 > tom-Latitude-3570.46284: tcp 0
01:17:29.025263 IP static-87-75-105-186.vodafonexdsl.co.uk.8333 > tom-Latitude-3570.46284: tcp 0
01:17:29.027782 IP 2.56.9.15.8333 > tom-Latitude-3570.42516: tcp 0
01:17:29.173743 IP vmi195435.contaboserver.net.8333 > tom-Latitude-3570.39110: tcp 24
01:17:29.174344 IP vmi195435.contaboserver.net.8333 > tom-Latitude-3570.39110: tcp 73
01:17:29.174405 IP tom-Latitude-3570.39110 > vmi195435.contaboserver.net.8333: tcp 0
01:17:29.174571 IP tom-Latitude-3570.39110 > vmi195435.contaboserver.net.8333: tcp 24
01:17:29.174644 IP tom-Latitude-3570.60470 > bb42-60-217-183.singnet.com.sg.8333: tcp 24
01:17:29.175932 IP tom-Latitude-3570.60470 > bb42-60-217-183.singnet.com.sg.8333: tcp 109
01:17:29.175940 IP tom-Latitude-3570.39110 > vmi195435.contaboserver.net.8333: tcp 37
01:17:29.204043 IP vmi195435.contaboserver.net.8333 > tom-Latitude-3570.39110: tcp 0
01:17:29.204526 IP bb42-60-217-183.singnet.com.sg.8333 > tom-Latitude-3570.60470: tcp 0
01:17:29.209513 IP bb42-60-217-183.singnet.com.sg.8333 > tom-Latitude-3570.60470: tcp 0
01:17:29.210066 IP vmi195435.contaboserver.net.8333 > tom-Latitude-3570.39110: tcp 0
01:17:29.284786 IP vmi195435.contaboserver.net.8333 > tom-Latitude-3570.39110: tcp 24
01:17:29.285391 IP vmi195435.contaboserver.net.8333 > tom-Latitude-3570.39110: tcp 250
01:17:29.285450 IP tom-Latitude-3570.39110 > vmi195435.contaboserver.net.8333: tcp 0
01:17:29.285921 IP tom-Latitude-3570.49070 > c-185-45-236-223.customer.ggaweb.ch.8333: tcp 24
01:17:29.289716 IP tom-Latitude-3570.49070 > c-185-45-236-223.customer.ggaweb.ch.8333: tcp 145
01:17:29.343155 IP c-185-45-236-223.customer.ggaweb.ch.8333 > tom-Latitude-3570.49070: tcp 0
01:17:29.343169 IP c-185-45-236-223.customer.ggaweb.ch.8333 > tom-Latitude-3570.49070: tcp 0
01:17:29.586845 IP tom-Latitude-3570.56714 > ns3113832.ip-54-38-177.eu.8333: tcp 24
01:17:29.587605 IP tom-Latitude-3570.56714 > ns3113832.ip-54-38-177.eu.8333: tcp 37
01:17:29.626766 IP ns3113832.ip-54-38-177.eu.8333 > tom-Latitude-3570.56714: tcp 0
01:17:29.634268 IP ns3113832.ip-54-38-177.eu.8333 > tom-Latitude-3570.56714: tcp 0
01:17:29.687292 IP tom-Latitude-3570.60470 > bb42-60-217-183.singnet.com.sg.8333: tcp 24
01:17:29.687348 IP tom-Latitude-3570.42516 > 2.56.9.15.8333: tcp 24
01:17:29.688307 IP tom-Latitude-3570.42516 > 2.56.9.15.8333: tcp 37
01:17:29.688318 IP tom-Latitude-3570.60470 > bb42-60-217-183.singnet.com.sg.8333: tcp 37
01:17:29.736598 IP 2.56.9.15.8333 > tom-Latitude-3570.42516: tcp 0
01:17:29.736612 IP bb42-60-217-183.singnet.com.sg.8333 > tom-Latitude-3570.60470: tcp 0
01:17:29.736615 IP 2.56.9.15.8333 > tom-Latitude-3570.42516: tcp 0
01:17:29.736617 IP bb42-60-217-183.singnet.com.sg.8333 > tom-Latitude-3570.60470: tcp 0
01:17:29.862264 IP 241.240.220.35.bc.googleusercontent.com.8333 > tom-Latitude-3570.45056: tcp 169
01:17:29.903885 IP tom-Latitude-3570.45056 > 241.240.220.35.bc.googleusercontent.com.8333: tcp 0
01:17:29.991168 IP 167.99.216.145.8333 > tom-Latitude-3570.57976: tcp 24
01:17:29.991744 IP 167.99.216.145.8333 > tom-Latitude-3570.57976: tcp 8
01:17:29.991784 IP tom-Latitude-3570.57976 > 167.99.216.145.8333: tcp 0
01:17:29.991879 IP tom-Latitude-3570.57976 > 167.99.216.145.8333: tcp 24
01:17:29.992724 IP tom-Latitude-3570.57976 > 167.99.216.145.8333: tcp 8
01:17:30.024898 IP 167.99.216.145.8333 > tom-Latitude-3570.57976: tcp 0
01:17:30.025496 IP 167.99.216.145.8333 > tom-Latitude-3570.57976: tcp 0
01:17:30.035884 IP c-185-45-236-223.customer.ggaweb.ch.8333 > tom-Latitude-3570.49070: tcp 24
01:17:30.036406 IP c-185-45-236-223.customer.ggaweb.ch.8333 > tom-Latitude-3570.49070: tcp 37
01:17:30.036435 IP tom-Latitude-3570.49070 > c-185-45-236-223.customer.ggaweb.ch.8333: tcp 0
01:17:30.036589 IP tom-Latitude-3570.49070 > c-185-45-236-223.customer.ggaweb.ch.8333: tcp 24
01:17:30.038026 IP tom-Latitude-3570.49070 > c-185-45-236-223.customer.ggaweb.ch.8333: tcp 37
01:17:30.064434 IP c-185-45-236-223.customer.ggaweb.ch.8333 > tom-Latitude-3570.49070: tcp 0
01:17:30.064989 IP c-185-45-236-223.customer.ggaweb.ch.8333 > tom-Latitude-3570.49070: tcp 0
01:17:30.149210 IP c-185-45-236-223.customer.ggaweb.ch.8333 > tom-Latitude-3570.49070: tcp 24
01:17:30.149240 IP c-185-45-236-223.customer.ggaweb.ch.8333 > tom-Latitude-3570.49070: tcp 226
01:17:30.149280 IP tom-Latitude-3570.49070 > c-185-45-236-223.customer.ggaweb.ch.8333: tcp 0
01:17:30.651041 IP tom-Latitude-3570.42516 > 2.56.9.15.8333: tcp 24
01:17:30.651975 IP tom-Latitude-3570.42516 > 2.56.9.15.8333: tcp 37
01:17:30.713153 IP 2.56.9.15.8333 > tom-Latitude-3570.42516: tcp 24
01:17:30.725215 IP 2.56.9.15.8333 > tom-Latitude-3570.42516: tcp 37
01:17:30.725233 IP 2.56.9.15.8333 > tom-Latitude-3570.42516: tcp 0
01:17:30.725281 IP tom-Latitude-3570.42516 > 2.56.9.15.8333: tcp 0
01:17:30.725878 IP 2.56.9.15.8333 > tom-Latitude-3570.42516: tcp 0
01:17:30.825821 IP tom-Latitude-3570.39110 > vmi195435.contaboserver.net.8333: tcp 24
01:17:30.826758 IP tom-Latitude-3570.39110 > vmi195435.contaboserver.net.8333: tcp 37
01:17:30.843819 IP bb42-60-217-183.singnet.com.sg.8333 > tom-Latitude-3570.60470: tcp 24
01:17:30.850083 IP bb42-60-217-183.singnet.com.sg.8333 > tom-Latitude-3570.60470: tcp 109
01:17:30.850147 IP tom-Latitude-3570.60470 > bb42-60-217-183.singnet.com.sg.8333: tcp 0
01:17:30.850366 IP tom-Latitude-3570.60470 > bb42-60-217-183.singnet.com.sg.8333: tcp 24
01:17:30.851660 IP tom-Latitude-3570.60470 > bb42-60-217-183.singnet.com.sg.8333: tcp 73
01:17:30.855362 IP vmi195435.contaboserver.net.8333 > tom-Latitude-3570.39110: tcp 0
01:17:30.862869 IP vmi195435.contaboserver.net.8333 > tom-Latitude-3570.39110: tcp 0
01:17:30.885858 IP bb42-60-217-183.singnet.com.sg.8333 > tom-Latitude-3570.60470: tcp 0
01:17:30.886379 IP bb42-60-217-183.singnet.com.sg.8333 > tom-Latitude-3570.60470: tcp 0
01:17:31.051125 IP tom-Latitude-3570.60988 > 81.198.101.144.8333: tcp 24
01:17:31.052081 IP tom-Latitude-3570.60988 > 81.198.101.144.8333: tcp 829
01:17:31.087589 IP 81.198.101.144.8333 > tom-Latitude-3570.60988: tcp 0
01:17:31.097094 IP 81.198.101.144.8333 > tom-Latitude-3570.60988: tcp 0
01:17:31.151590 IP tom-Latitude-3570.46284 > static-87-75-105-186.vodafonexdsl.co.uk.8333: tcp 24
01:17:31.152571 IP tom-Latitude-3570.46284 > static-87-75-105-186.vodafonexdsl.co.uk.8333: tcp 73
01:17:31.186733 IP static-87-75-105-186.vodafonexdsl.co.uk.8333 > tom-Latitude-3570.46284: tcp 0
01:17:31.203864 IP static-87-75-105-186.vodafonexdsl.co.uk.8333 > tom-Latitude-3570.46284: tcp 0
01:17:31.265854 IP bb42-60-217-183.singnet.com.sg.8333 > tom-Latitude-3570.60470: tcp 24
01:17:31.266518 IP bb42-60-217-183.singnet.com.sg.8333 > tom-Latitude-3570.60470: tcp 226
01:17:31.266585 IP tom-Latitude-3570.60470 > bb42-60-217-183.singnet.com.sg.8333: tcp 0
01:17:31.272178 IP bb42-60-217-183.singnet.com.sg.8333 > tom-Latitude-3570.60470: tcp 24
01:17:31.272859 IP bb42-60-217-183.singnet.com.sg.8333 > tom-Latitude-3570.60470: tcp 190
01:17:31.272923 IP tom-Latitude-3570.60470 > bb42-60-217-183.singnet.com.sg.8333: tcp 0
01:17:31.373645 IP tom-Latitude-3570.56714 > ns3113832.ip-54-38-177.eu.8333: tcp 24
01:17:31.374628 IP tom-Latitude-3570.56714 > ns3113832.ip-54-38-177.eu.8333: tcp 109
01:17:31.410737 IP ns3113832.ip-54-38-177.eu.8333 > tom-Latitude-3570.56714: tcp 0
01:17:31.414579 IP ns3113832.ip-54-38-177.eu.8333 > tom-Latitude-3570.56714: tcp 0
01:17:31.473180 IP 81.198.101.144.8333 > tom-Latitude-3570.60988: tcp 24
01:17:31.473797 IP 81.198.101.144.8333 > tom-Latitude-3570.60988: tcp 8
01:17:31.473816 IP 81.198.101.144.8333 > tom-Latitude-3570.60988: tcp 24
01:17:31.473822 IP 81.198.101.144.8333 > tom-Latitude-3570.60988: tcp 8
01:17:31.473868 IP tom-Latitude-3570.60988 > 81.198.101.144.8333: tcp 0
01:17:31.474048 IP tom-Latitude-3570.60988 > 81.198.101.144.8333: tcp 24
01:17:31.476167 IP tom-Latitude-3570.60988 > 81.198.101.144.8333: tcp 8
01:17:31.481566 IP 81.198.101.144.8333 > tom-Latitude-3570.60988: tcp 24
01:17:31.482268 IP 81.198.101.144.8333 > tom-Latitude-3570.60988: tcp 181
01:17:31.482333 IP tom-Latitude-3570.60988 > 81.198.101.144.8333: tcp 0
01:17:31.599904 IP tom-Latitude-3570.60988 > 81.198.101.144.8333: tcp 8
01:17:31.636336 IP ns3113832.ip-54-38-177.eu.8333 > tom-Latitude-3570.56714: tcp 24
01:17:31.636354 IP ns3113832.ip-54-38-177.eu.8333 > tom-Latitude-3570.56714: tcp 73
01:17:31.636357 IP 81.198.101.144.8333 > tom-Latitude-3570.60988: tcp 24
01:17:31.636365 IP 81.198.101.144.8333 > tom-Latitude-3570.60988: tcp 37
01:17:31.636400 IP tom-Latitude-3570.60988 > 81.198.101.144.8333: tcp 0
01:17:31.636428 IP tom-Latitude-3570.56714 > ns3113832.ip-54-38-177.eu.8333: tcp 0
01:17:31.636540 IP tom-Latitude-3570.60988 > 81.198.101.144.8333: tcp 24
01:17:31.636657 IP tom-Latitude-3570.56714 > ns3113832.ip-54-38-177.eu.8333: tcp 24
01:17:31.641707 IP tom-Latitude-3570.60988 > 81.198.101.144.8333: tcp 226
01:17:31.645158 IP tom-Latitude-3570.56714 > ns3113832.ip-54-38-177.eu.8333: tcp 73
01:17:31.660828 IP ns3113832.ip-54-38-177.eu.8333 > tom-Latitude-3570.56714: tcp 73
01:17:31.660848 IP tom-Latitude-3570.56714 > ns3113832.ip-54-38-177.eu.8333: tcp 0
01:17:31.684108 IP 81.198.101.144.8333 > tom-Latitude-3570.60988: tcp 0
01:17:31.687223 IP 81.198.101.144.8333 > tom-Latitude-3570.60988: tcp 0
01:17:31.687985 IP ns3113832.ip-54-38-177.eu.8333 > tom-Latitude-3570.56714: tcp 0
01:17:31.688000 IP 81.198.101.144.8333 > tom-Latitude-3570.60988: tcp 0
01:17:31.697760 IP ns3113832.ip-54-38-177.eu.8333 > tom-Latitude-3570.56714: tcp 0
01:17:31.752847 IP ns3113832.ip-54-38-177.eu.8333 > tom-Latitude-3570.56714: tcp 24
01:17:31.752866 IP tom-Latitude-3570.56714 > ns3113832.ip-54-38-177.eu.8333: tcp 0
01:17:31.752885 IP ns3113832.ip-54-38-177.eu.8333 > tom-Latitude-3570.56714: tcp 407
01:17:31.752890 IP tom-Latitude-3570.56714 > ns3113832.ip-54-38-177.eu.8333: tcp 0
01:17:31.752895 IP ns3113832.ip-54-38-177.eu.8333 > tom-Latitude-3570.56714: tcp 24
01:17:31.752897 IP tom-Latitude-3570.56714 > ns3113832.ip-54-38-177.eu.8333: tcp 0
01:17:31.752900 IP ns3113832.ip-54-38-177.eu.8333 > tom-Latitude-3570.56714: tcp 226
01:17:31.752903 IP tom-Latitude-3570.56714 > ns3113832.ip-54-38-177.eu.8333: tcp 0
01:17:31.850086 IP 2.56.9.15.8333 > tom-Latitude-3570.42516: tcp 24
01:17:31.850107 IP 2.56.9.15.8333 > tom-Latitude-3570.42516: tcp 253
01:17:31.850153 IP tom-Latitude-3570.42516 > 2.56.9.15.8333: tcp 0
01:17:31.850393 IP tom-Latitude-3570.42516 > 2.56.9.15.8333: tcp 24
01:17:31.851508 IP tom-Latitude-3570.42516 > 2.56.9.15.8333: tcp 109
01:17:31.884255 IP 2.56.9.15.8333 > tom-Latitude-3570.42516: tcp 0
01:17:31.884902 IP 2.56.9.15.8333 > tom-Latitude-3570.42516: tcp 0
01:17:31.983122 IP 2.56.9.15.8333 > tom-Latitude-3570.42516: tcp 24
01:17:31.983968 IP 2.56.9.15.8333 > tom-Latitude-3570.42516: tcp 386
01:17:31.983988 IP 2.56.9.15.8333 > tom-Latitude-3570.42516: tcp 24
01:17:31.983991 IP 2.56.9.15.8333 > tom-Latitude-3570.42516: tcp 224
01:17:31.983994 IP 2.56.9.15.8333 > tom-Latitude-3570.42516: tcp 24
01:17:31.983997 IP 2.56.9.15.8333 > tom-Latitude-3570.42516: tcp 225
01:17:31.984035 IP tom-Latitude-3570.42516 > 2.56.9.15.8333: tcp 0
01:17:31.987053 IP tom-Latitude-3570.42516 > 2.56.9.15.8333: tcp 24
01:17:31.987773 IP tom-Latitude-3570.42516 > 2.56.9.15.8333: tcp 37
01:17:32.015808 IP 2.56.9.15.8333 > tom-Latitude-3570.42516: tcp 0
01:17:32.016477 IP 2.56.9.15.8333 > tom-Latitude-3570.42516: tcp 0
01:17:32.087451 IP tom-Latitude-3570.56714 > ns3113832.ip-54-38-177.eu.8333: tcp 24
01:17:32.088393 IP tom-Latitude-3570.56714 > ns3113832.ip-54-38-177.eu.8333: tcp 73
01:17:32.116046 IP 2.56.9.15.8333 > tom-Latitude-3570.42516: tcp 24
01:17:32.116061 IP 2.56.9.15.8333 > tom-Latitude-3570.42516: tcp 37
01:17:32.116098 IP tom-Latitude-3570.42516 > 2.56.9.15.8333: tcp 0
01:17:32.117646 IP ns3113832.ip-54-38-177.eu.8333 > tom-Latitude-3570.56714: tcp 0
01:17:32.132596 IP ns3113832.ip-54-38-177.eu.8333 > tom-Latitude-3570.56714: tcp 0
01:17:32.216612 IP tom-Latitude-3570.60470 > bb42-60-217-183.singnet.com.sg.8333: tcp 24
01:17:32.217595 IP tom-Latitude-3570.60470 > bb42-60-217-183.singnet.com.sg.8333: tcp 145
01:17:32.248759 IP bb42-60-217-183.singnet.com.sg.8333 > tom-Latitude-3570.60470: tcp 0
01:17:32.290067 IP bb42-60-217-183.singnet.com.sg.8333 > tom-Latitude-3570.60470: tcp 0
01:17:32.317075 IP tom-Latitude-3570.49070 > c-185-45-236-223.customer.ggaweb.ch.8333: tcp 24
01:17:32.318016 IP tom-Latitude-3570.49070 > c-185-45-236-223.customer.ggaweb.ch.8333: tcp 217
01:17:32.355717 IP c-185-45-236-223.customer.ggaweb.ch.8333 > tom-Latitude-3570.49070: tcp 0
01:17:32.362543 IP c-185-45-236-223.customer.ggaweb.ch.8333 > tom-Latitude-3570.49070: tcp 0
01:17:32.517848 IP tom-Latitude-3570.60988 > 81.198.101.144.8333: tcp 24
01:17:32.518811 IP tom-Latitude-3570.60988 > 81.198.101.144.8333: tcp 217
01:17:32.546656 IP 81.198.101.144.8333 > tom-Latitude-3570.60988: tcp 0
01:17:32.554102 IP 81.198.101.144.8333 > tom-Latitude-3570.60988: tcp 0
01:17:32.718617 IP tom-Latitude-3570.39110 > vmi195435.contaboserver.net.8333: tcp 24
01:17:32.806613 IP tom-Latitude-3570.39110 > vmi195435.contaboserver.net.8333: tcp 217
01:17:32.819091 IP tom-Latitude-3570.57976 > 167.99.216.145.8333: tcp 24
01:17:32.826514 IP tom-Latitude-3570.57976 > 167.99.216.145.8333: tcp 325
01:17:32.847627 IP vmi195435.contaboserver.net.8333 > tom-Latitude-3570.39110: tcp 0
01:17:32.853857 IP vmi195435.contaboserver.net.8333 > tom-Latitude-3570.39110: tcp 0
01:17:32.854220 IP 167.99.216.145.8333 > tom-Latitude-3570.57976: tcp 0
01:17:32.864671 IP 167.99.216.145.8333 > tom-Latitude-3570.57976: tcp 0
01:17:32.895602 IP 2.56.9.15.8333 > tom-Latitude-3570.42516: tcp 24
01:17:32.896321 IP 2.56.9.15.8333 > tom-Latitude-3570.42516: tcp 181
01:17:32.896426 IP tom-Latitude-3570.42516 > 2.56.9.15.8333: tcp 0
01:17:32.896667 IP tom-Latitude-3570.42516 > 2.56.9.15.8333: tcp 24
01:17:32.896775 IP tom-Latitude-3570.45056 > 241.240.220.35.bc.googleusercontent.com.8333: tcp 24
01:17:32.898232 IP tom-Latitude-3570.45056 > 241.240.220.35.bc.googleusercontent.com.8333: tcp 253
01:17:32.898244 IP tom-Latitude-3570.42516 > 2.56.9.15.8333: tcp 181
01:17:32.935954 IP 2.56.9.15.8333 > tom-Latitude-3570.42516: tcp 0
01:17:32.936620 IP 241.240.220.35.bc.googleusercontent.com.8333 > tom-Latitude-3570.45056: tcp 0
01:17:32.936634 IP 241.240.220.35.bc.googleusercontent.com.8333 > tom-Latitude-3570.45056: tcp 0
01:17:32.936637 IP 2.56.9.15.8333 > tom-Latitude-3570.42516: tcp 0
01:17:33.034985 IP 2.56.9.15.8333 > tom-Latitude-3570.42516: tcp 24
01:17:33.036039 IP 2.56.9.15.8333 > tom-Latitude-3570.42516: tcp 382
01:17:33.036057 IP 2.56.9.15.8333 > tom-Latitude-3570.42516: tcp 24
01:17:33.036060 IP 2.56.9.15.8333 > tom-Latitude-3570.42516: tcp 249
01:17:33.036063 IP 2.56.9.15.8333 > tom-Latitude-3570.42516: tcp 24
01:17:33.036066 IP 2.56.9.15.8333 > tom-Latitude-3570.42516: tcp 225
01:17:33.036068 IP 2.56.9.15.8333 > tom-Latitude-3570.42516: tcp 24
01:17:33.036070 IP 2.56.9.15.8333 > tom-Latitude-3570.42516: tcp 373
01:17:33.036072 IP 2.56.9.15.8333 > tom-Latitude-3570.42516: tcp 24
01:17:33.036075 IP 2.56.9.15.8333 > tom-Latitude-3570.42516: tcp 224
01:17:33.036107 IP tom-Latitude-3570.42516 > 2.56.9.15.8333: tcp 0
01:17:33.140839 IP tom-Latitude-3570.60988 > 81.198.101.144.8333: tcp 24
01:17:33.141812 IP tom-Latitude-3570.60988 > 81.198.101.144.8333: tcp 181
01:17:33.182283 IP 81.198.101.144.8333 > tom-Latitude-3570.60988: tcp 0
01:17:33.182298 IP 167.99.216.145.8333 > tom-Latitude-3570.57976: tcp 24
01:17:33.182310 IP 167.99.216.145.8333 > tom-Latitude-3570.57976: tcp 217
01:17:33.182354 IP tom-Latitude-3570.57976 > 167.99.216.145.8333: tcp 0
01:17:33.182528 IP tom-Latitude-3570.39110 > vmi195435.contaboserver.net.8333: tcp 24
01:17:33.183635 IP tom-Latitude-3570.39110 > vmi195435.contaboserver.net.8333: tcp 181
01:17:33.186881 IP 81.198.101.144.8333 > tom-Latitude-3570.60988: tcp 0
01:17:33.224576 IP vmi195435.contaboserver.net.8333 > tom-Latitude-3570.39110: tcp 0
01:17:33.229784 IP vmi195435.contaboserver.net.8333 > tom-Latitude-3570.39110: tcp 0
01:17:33.414717 IP 81.198.101.144.8333 > tom-Latitude-3570.60988: tcp 24
01:17:33.415392 IP 81.198.101.144.8333 > tom-Latitude-3570.60988: tcp 37
01:17:33.415487 IP tom-Latitude-3570.60988 > 81.198.101.144.8333: tcp 0
01:17:33.415620 IP tom-Latitude-3570.60988 > 81.198.101.144.8333: tcp 24
01:17:33.415756 IP tom-Latitude-3570.56714 > ns3113832.ip-54-38-177.eu.8333: tcp 24
01:17:33.417055 IP tom-Latitude-3570.56714 > ns3113832.ip-54-38-177.eu.8333: tcp 181
01:17:33.417067 IP tom-Latitude-3570.60988 > 81.198.101.144.8333: tcp 382
01:17:33.444105 IP 81.198.101.144.8333 > tom-Latitude-3570.60988: tcp 0
01:17:33.444775 IP ns3113832.ip-54-38-177.eu.8333 > tom-Latitude-3570.56714: tcp 0
01:17:33.447339 IP ns3113832.ip-54-38-177.eu.8333 > tom-Latitude-3570.56714: tcp 0
01:17:33.447867 IP 81.198.101.144.8333 > tom-Latitude-3570.60988: tcp 0
01:17:34.419149 IP tom-Latitude-3570.45056 > 241.240.220.35.bc.googleusercontent.com.8333: tcp 24
01:17:34.419965 IP tom-Latitude-3570.45056 > 241.240.220.35.bc.googleusercontent.com.8333: tcp 181
01:17:34.492103 IP 241.240.220.35.bc.googleusercontent.com.8333 > tom-Latitude-3570.45056: tcp 0
01:17:34.520680 IP 241.240.220.35.bc.googleusercontent.com.8333 > tom-Latitude-3570.45056: tcp 0
01:17:34.619887 IP tom-Latitude-3570.49070 > c-185-45-236-223.customer.ggaweb.ch.8333: tcp 24
01:17:34.620673 IP tom-Latitude-3570.49070 > c-185-45-236-223.customer.ggaweb.ch.8333: tcp 181
01:17:34.655878 IP c-185-45-236-223.customer.ggaweb.ch.8333 > tom-Latitude-3570.49070: tcp 0
01:17:34.673209 IP c-185-45-236-223.customer.ggaweb.ch.8333 > tom-Latitude-3570.49070: tcp 0
01:17:35.281593 IP 81.198.101.144.8333 > tom-Latitude-3570.60988: tcp 24
01:17:35.282273 IP 81.198.101.144.8333 > tom-Latitude-3570.60988: tcp 109
01:17:35.282403 IP tom-Latitude-3570.60988 > 81.198.101.144.8333: tcp 0
01:17:35.282553 IP tom-Latitude-3570.60988 > 81.198.101.144.8333: tcp 24
01:17:35.284051 IP tom-Latitude-3570.60988 > 81.198.101.144.8333: tcp 73
01:17:35.316942 IP 81.198.101.144.8333 > tom-Latitude-3570.60988: tcp 0
01:17:35.318295 IP 81.198.101.144.8333 > tom-Latitude-3570.60988: tcp 0
01:17:35.460036 IP 81.198.101.144.8333 > tom-Latitude-3570.60988: tcp 24
01:17:35.460953 IP 81.198.101.144.8333 > tom-Latitude-3570.60988: tcp 224
01:17:35.460967 IP 81.198.101.144.8333 > tom-Latitude-3570.60988: tcp 24
01:17:35.460970 IP 81.198.101.144.8333 > tom-Latitude-3570.60988: tcp 224
01:17:35.461047 IP tom-Latitude-3570.60988 > 81.198.101.144.8333: tcp 0
01:17:35.929494 IP 241.240.220.35.bc.googleusercontent.com.8333 > tom-Latitude-3570.45056: tcp 277
01:17:35.929513 IP tom-Latitude-3570.45056 > 241.240.220.35.bc.googleusercontent.com.8333: tcp 0
01:17:35.929774 IP tom-Latitude-3570.45056 > 241.240.220.35.bc.googleusercontent.com.8333: tcp 24
01:17:35.930847 IP tom-Latitude-3570.45056 > 241.240.220.35.bc.googleusercontent.com.8333: tcp 145
01:17:35.965887 IP 241.240.220.35.bc.googleusercontent.com.8333 > tom-Latitude-3570.45056: tcp 0
01:17:35.966556 IP 241.240.220.35.bc.googleusercontent.com.8333 > tom-Latitude-3570.45056: tcp 0
01:17:36.291219 IP 241.240.220.35.bc.googleusercontent.com.8333 > tom-Latitude-3570.45056: tcp 436
01:17:36.294593 IP 241.240.220.35.bc.googleusercontent.com.8333 > tom-Latitude-3570.45056: tcp 397
01:17:36.294615 IP tom-Latitude-3570.45056 > 241.240.220.35.bc.googleusercontent.com.8333: tcp 0
01:17:36.301832 IP 241.240.220.35.bc.googleusercontent.com.8333 > tom-Latitude-3570.45056: tcp 544
01:17:36.301849 IP 241.240.220.35.bc.googleusercontent.com.8333 > tom-Latitude-3570.45056: tcp 250
01:17:36.301945 IP tom-Latitude-3570.45056 > 241.240.220.35.bc.googleusercontent.com.8333: tcp 0
01:17:36.606048 IP tom-Latitude-3570.39110 > vmi195435.contaboserver.net.8333: tcp 24
01:17:36.609026 IP tom-Latitude-3570.39110 > vmi195435.contaboserver.net.8333: tcp 217
01:17:36.637117 IP vmi195435.contaboserver.net.8333 > tom-Latitude-3570.39110: tcp 0
01:17:36.639106 IP vmi195435.contaboserver.net.8333 > tom-Latitude-3570.39110: tcp 0
01:17:36.999892 IP 167.99.216.145.8333 > tom-Latitude-3570.57976: tcp 24
01:17:37.000524 IP 167.99.216.145.8333 > tom-Latitude-3570.57976: tcp 217
01:17:37.000658 IP tom-Latitude-3570.57976 > 167.99.216.145.8333: tcp 0
01:17:37.209608 IP ns3113832.ip-54-38-177.eu.8333 > tom-Latitude-3570.56714: tcp 24
01:17:37.209632 IP tom-Latitude-3570.56714 > ns3113832.ip-54-38-177.eu.8333: tcp 0
01:17:37.210236 IP ns3113832.ip-54-38-177.eu.8333 > tom-Latitude-3570.56714: tcp 253
01:17:37.210260 IP tom-Latitude-3570.56714 > ns3113832.ip-54-38-177.eu.8333: tcp 0
01:17:37.411201 IP tom-Latitude-3570.60988 > 81.198.101.144.8333: tcp 24
01:17:37.416952 IP 167.99.216.145.8333 > tom-Latitude-3570.57976: tcp 24
01:17:37.416968 IP 167.99.216.145.8333 > tom-Latitude-3570.57976: tcp 37
01:17:37.417014 IP tom-Latitude-3570.57976 > 167.99.216.145.8333: tcp 0
01:17:37.417196 IP tom-Latitude-3570.57976 > 167.99.216.145.8333: tcp 24
01:17:37.418141 IP tom-Latitude-3570.57976 > 167.99.216.145.8333: tcp 37
01:17:37.418147 IP tom-Latitude-3570.60988 > 81.198.101.144.8333: tcp 145
01:17:37.447003 IP 81.198.101.144.8333 > tom-Latitude-3570.60988: tcp 0
01:17:37.447584 IP 167.99.216.145.8333 > tom-Latitude-3570.57976: tcp 0
01:17:37.447596 IP 81.198.101.144.8333 > tom-Latitude-3570.60988: tcp 0
01:17:37.447600 IP 167.99.216.145.8333 > tom-Latitude-3570.57976: tcp 0
01:17:37.509681 IP 167.99.216.145.8333 > tom-Latitude-3570.57976: tcp 24
01:17:37.509700 IP 167.99.216.145.8333 > tom-Latitude-3570.57976: tcp 760
01:17:37.509793 IP tom-Latitude-3570.57976 > 167.99.216.145.8333: tcp 0
01:17:37.610795 IP tom-Latitude-3570.42516 > 2.56.9.15.8333: tcp 24
01:17:37.611729 IP tom-Latitude-3570.42516 > 2.56.9.15.8333: tcp 253
01:17:37.636146 IP 2.56.9.15.8333 > tom-Latitude-3570.42516: tcp 0
01:17:37.653315 IP 2.56.9.15.8333 > tom-Latitude-3570.42516: tcp 0
01:17:37.775043 IP 167.99.216.145.8333 > tom-Latitude-3570.57976: tcp 24
01:17:37.775716 IP 167.99.216.145.8333 > tom-Latitude-3570.57976: tcp 37
01:17:37.775846 IP tom-Latitude-3570.57976 > 167.99.216.145.8333: tcp 0
01:17:37.776008 IP tom-Latitude-3570.57976 > 167.99.216.145.8333: tcp 24
01:17:37.776114 IP tom-Latitude-3570.60470 > bb42-60-217-183.singnet.com.sg.8333: tcp 24
01:17:37.777404 IP tom-Latitude-3570.60470 > bb42-60-217-183.singnet.com.sg.8333: tcp 433
01:17:37.777415 IP tom-Latitude-3570.57976 > 167.99.216.145.8333: tcp 37
01:17:37.814116 IP 167.99.216.145.8333 > tom-Latitude-3570.57976: tcp 0
01:17:37.814733 IP bb42-60-217-183.singnet.com.sg.8333 > tom-Latitude-3570.60470: tcp 0
01:17:37.817261 IP 167.99.216.145.8333 > tom-Latitude-3570.57976: tcp 0
01:17:37.817850 IP bb42-60-217-183.singnet.com.sg.8333 > tom-Latitude-3570.60470: tcp 0
01:17:37.879117 IP 167.99.216.145.8333 > tom-Latitude-3570.57976: tcp 24
01:17:37.879639 IP 167.99.216.145.8333 > tom-Latitude-3570.57976: tcp 248
01:17:37.879722 IP tom-Latitude-3570.57976 > 167.99.216.145.8333: tcp 0
01:17:38.281343 IP tom-Latitude-3570.39110 > vmi195435.contaboserver.net.8333: tcp 24
01:17:38.308854 IP tom-Latitude-3570.39110 > vmi195435.contaboserver.net.8333: tcp 73
01:17:38.335934 IP vmi195435.contaboserver.net.8333 > tom-Latitude-3570.39110: tcp 0
01:17:38.353756 IP vmi195435.contaboserver.net.8333 > tom-Latitude-3570.39110: tcp 0
01:17:38.381761 IP tom-Latitude-3570.60470 > bb42-60-217-183.singnet.com.sg.8333: tcp 24
01:17:38.382627 IP tom-Latitude-3570.60470 > bb42-60-217-183.singnet.com.sg.8333: tcp 37
01:17:38.405221 IP bb42-60-217-183.singnet.com.sg.8333 > tom-Latitude-3570.60470: tcp 0
01:17:38.405235 IP bb42-60-217-183.singnet.com.sg.8333 > tom-Latitude-3570.60470: tcp 0
01:17:38.482168 IP tom-Latitude-3570.42516 > 2.56.9.15.8333: tcp 24
01:17:38.482299 IP tom-Latitude-3570.46284 > static-87-75-105-186.vodafonexdsl.co.uk.8333: tcp 24
01:17:38.483066 IP tom-Latitude-3570.46284 > static-87-75-105-186.vodafonexdsl.co.uk.8333: tcp 685
01:17:38.483077 IP tom-Latitude-3570.42516 > 2.56.9.15.8333: tcp 37
01:17:38.523471 IP 2.56.9.15.8333 > tom-Latitude-3570.42516: tcp 0
01:17:38.532716 IP static-87-75-105-186.vodafonexdsl.co.uk.8333 > tom-Latitude-3570.46284: tcp 0
01:17:38.539550 IP static-87-75-105-186.vodafonexdsl.co.uk.8333 > tom-Latitude-3570.46284: tcp 0
01:17:38.540180 IP 2.56.9.15.8333 > tom-Latitude-3570.42516: tcp 0
01:17:38.609884 IP static-87-75-105-186.vodafonexdsl.co.uk.8333 > tom-Latitude-3570.46284: tcp 24
01:17:38.614262 IP static-87-75-105-186.vodafonexdsl.co.uk.8333 > tom-Latitude-3570.46284: tcp 37
01:17:38.614393 IP tom-Latitude-3570.46284 > static-87-75-105-186.vodafonexdsl.co.uk.8333: tcp 0
01:17:38.614537 IP tom-Latitude-3570.46284 > static-87-75-105-186.vodafonexdsl.co.uk.8333: tcp 24
01:17:38.616044 IP tom-Latitude-3570.46284 > static-87-75-105-186.vodafonexdsl.co.uk.8333: tcp 248
01:17:38.629671 IP 167.99.216.145.8333 > tom-Latitude-3570.57976: tcp 24
01:17:38.630335 IP 167.99.216.145.8333 > tom-Latitude-3570.57976: tcp 73
01:17:38.630466 IP tom-Latitude-3570.57976 > 167.99.216.145.8333: tcp 0
01:17:38.630655 IP tom-Latitude-3570.57976 > 167.99.216.145.8333: tcp 24
01:17:38.632028 IP tom-Latitude-3570.57976 > 167.99.216.145.8333: tcp 73
01:17:38.641574 IP static-87-75-105-186.vodafonexdsl.co.uk.8333 > tom-Latitude-3570.46284: tcp 0
01:17:38.642222 IP static-87-75-105-186.vodafonexdsl.co.uk.8333 > tom-Latitude-3570.46284: tcp 0
01:17:38.697497 IP 167.99.216.145.8333 > tom-Latitude-3570.57976: tcp 0
01:17:38.697511 IP 167.99.216.145.8333 > tom-Latitude-3570.57976: tcp 0
01:17:38.734255 IP 167.99.216.145.8333 > tom-Latitude-3570.57976: tcp 24
01:17:38.735077 IP 167.99.216.145.8333 > tom-Latitude-3570.57976: tcp 701
01:17:38.735095 IP 167.99.216.145.8333 > tom-Latitude-3570.57976: tcp 24
01:17:38.735097 IP 167.99.216.145.8333 > tom-Latitude-3570.57976: tcp 189
01:17:38.735195 IP tom-Latitude-3570.57976 > 167.99.216.145.8333: tcp 0
01:17:39.040354 IP tom-Latitude-3570.39110 > vmi195435.contaboserver.net.8333: tcp 24
01:17:39.041326 IP tom-Latitude-3570.39110 > vmi195435.contaboserver.net.8333: tcp 73
01:17:39.066943 IP vmi195435.contaboserver.net.8333 > tom-Latitude-3570.39110: tcp 0
01:17:39.082975 IP vmi195435.contaboserver.net.8333 > tom-Latitude-3570.39110: tcp 0
01:17:39.240998 IP tom-Latitude-3570.46284 > static-87-75-105-186.vodafonexdsl.co.uk.8333: tcp 24
01:17:39.241773 IP tom-Latitude-3570.46284 > static-87-75-105-186.vodafonexdsl.co.uk.8333: tcp 73
01:17:39.275279 IP static-87-75-105-186.vodafonexdsl.co.uk.8333 > tom-Latitude-3570.46284: tcp 0
01:17:39.282461 IP static-87-75-105-186.vodafonexdsl.co.uk.8333 > tom-Latitude-3570.46284: tcp 0
01:17:39.292532 IP bb42-60-217-183.singnet.com.sg.8333 > tom-Latitude-3570.60470: tcp 24
01:17:39.293235 IP bb42-60-217-183.singnet.com.sg.8333 > tom-Latitude-3570.60470: tcp 145
01:17:39.293366 IP tom-Latitude-3570.60470 > bb42-60-217-183.singnet.com.sg.8333: tcp 0
01:17:39.293580 IP tom-Latitude-3570.60470 > bb42-60-217-183.singnet.com.sg.8333: tcp 24
01:17:39.294844 IP tom-Latitude-3570.60470 > bb42-60-217-183.singnet.com.sg.8333: tcp 37
01:17:39.387732 IP tom-Latitude-3570.60470 > bb42-60-217-183.singnet.com.sg.8333: tcp 37
01:17:39.406472 IP bb42-60-217-183.singnet.com.sg.8333 > tom-Latitude-3570.60470: tcp 0
01:17:39.406486 IP bb42-60-217-183.singnet.com.sg.8333 > tom-Latitude-3570.60470: tcp 0
01:17:39.436460 IP bb42-60-217-183.singnet.com.sg.8333 > tom-Latitude-3570.60470: tcp 0
01:17:39.643360 IP 2.56.9.15.8333 > tom-Latitude-3570.42516: tcp 24
01:17:39.643982 IP 2.56.9.15.8333 > tom-Latitude-3570.42516: tcp 145
01:17:39.644124 IP tom-Latitude-3570.42516 > 2.56.9.15.8333: tcp 0
01:17:39.644346 IP tom-Latitude-3570.42516 > 2.56.9.15.8333: tcp 24
01:17:39.645653 IP tom-Latitude-3570.42516 > 2.56.9.15.8333: tcp 37
01:17:39.674506 IP 2.56.9.15.8333 > tom-Latitude-3570.42516: tcp 0
01:17:39.675159 IP 2.56.9.15.8333 > tom-Latitude-3570.42516: tcp 0
01:17:39.717920 IP bb42-60-217-183.singnet.com.sg.8333 > tom-Latitude-3570.60470: tcp 24
01:17:39.717941 IP bb42-60-217-183.singnet.com.sg.8333 > tom-Latitude-3570.60470: tcp 225
01:17:39.718036 IP tom-Latitude-3570.60470 > bb42-60-217-183.singnet.com.sg.8333: tcp 0
01:17:39.737094 IP static-87-75-105-186.vodafonexdsl.co.uk.8333 > tom-Latitude-3570.46284: tcp 24
01:17:39.739115 IP static-87-75-105-186.vodafonexdsl.co.uk.8333 > tom-Latitude-3570.46284: tcp 109
01:17:39.739247 IP tom-Latitude-3570.46284 > static-87-75-105-186.vodafonexdsl.co.uk.8333: tcp 0
01:17:39.771156 IP 2.56.9.15.8333 > tom-Latitude-3570.42516: tcp 24
01:17:39.772533 IP 2.56.9.15.8333 > tom-Latitude-3570.42516: tcp 337
01:17:39.772665 IP tom-Latitude-3570.42516 > 2.56.9.15.8333: tcp 0
01:17:39.973792 IP tom-Latitude-3570.39110 > vmi195435.contaboserver.net.8333: tcp 24
01:17:39.978563 IP tom-Latitude-3570.39110 > vmi195435.contaboserver.net.8333: tcp 73
01:17:40.006923 IP vmi195435.contaboserver.net.8333 > tom-Latitude-3570.39110: tcp 0
01:17:40.014923 IP vmi195435.contaboserver.net.8333 > tom-Latitude-3570.39110: tcp 0
01:17:40.074333 IP tom-Latitude-3570.45056 > 241.240.220.35.bc.googleusercontent.com.8333: tcp 24
01:17:40.075267 IP tom-Latitude-3570.45056 > 241.240.220.35.bc.googleusercontent.com.8333: tcp 217
01:17:40.107504 IP 241.240.220.35.bc.googleusercontent.com.8333 > tom-Latitude-3570.45056: tcp 0
01:17:40.115737 IP 241.240.220.35.bc.googleusercontent.com.8333 > tom-Latitude-3570.45056: tcp 0
01:17:40.119872 IP 81.198.101.144.8333 > tom-Latitude-3570.60988: tcp 24
01:17:40.120471 IP 81.198.101.144.8333 > tom-Latitude-3570.60988: tcp 217
01:17:40.120603 IP tom-Latitude-3570.60988 > 81.198.101.144.8333: tcp 0
01:17:40.149681 IP bb42-60-217-183.singnet.com.sg.8333 > tom-Latitude-3570.60470: tcp 24
01:17:40.149699 IP bb42-60-217-183.singnet.com.sg.8333 > tom-Latitude-3570.60470: tcp 37
01:17:40.149814 IP tom-Latitude-3570.60470 > bb42-60-217-183.singnet.com.sg.8333: tcp 0
01:17:40.334961 IP 241.240.220.35.bc.googleusercontent.com.8333 > tom-Latitude-3570.45056: tcp 241
01:17:40.335270 IP tom-Latitude-3570.56714 > ns3113832.ip-54-38-177.eu.8333: tcp 24
01:17:40.336083 IP tom-Latitude-3570.56714 > ns3113832.ip-54-38-177.eu.8333: tcp 217
01:17:40.356147 IP ns3113832.ip-54-38-177.eu.8333 > tom-Latitude-3570.56714: tcp 0
01:17:40.364764 IP ns3113832.ip-54-38-177.eu.8333 > tom-Latitude-3570.56714: tcp 0
01:17:40.375900 IP tom-Latitude-3570.45056 > 241.240.220.35.bc.googleusercontent.com.8333: tcp 0
01:17:40.506619 IP c-185-45-236-223.customer.ggaweb.ch.8333 > tom-Latitude-3570.49070: tcp 24
01:17:40.506639 IP c-185-45-236-223.customer.ggaweb.ch.8333 > tom-Latitude-3570.49070: tcp 469
01:17:40.506733 IP tom-Latitude-3570.49070 > c-185-45-236-223.customer.ggaweb.ch.8333: tcp 0
01:17:41.681447 IP c-185-45-236-223.customer.ggaweb.ch.8333 > tom-Latitude-3570.49070: tcp 24
01:17:41.681465 IP c-185-45-236-223.customer.ggaweb.ch.8333 > tom-Latitude-3570.49070: tcp 109
01:17:41.681556 IP tom-Latitude-3570.49070 > c-185-45-236-223.customer.ggaweb.ch.8333: tcp 0
01:17:41.681773 IP tom-Latitude-3570.49070 > c-185-45-236-223.customer.ggaweb.ch.8333: tcp 24
01:17:41.683126 IP tom-Latitude-3570.49070 > c-185-45-236-223.customer.ggaweb.ch.8333: tcp 109
01:17:41.688015 IP c-185-45-236-223.customer.ggaweb.ch.8333 > tom-Latitude-3570.49070: tcp 109
01:17:41.688033 IP tom-Latitude-3570.49070 > c-185-45-236-223.customer.ggaweb.ch.8333: tcp 0
01:17:41.726412 IP c-185-45-236-223.customer.ggaweb.ch.8333 > tom-Latitude-3570.49070: tcp 0
01:17:41.729344 IP c-185-45-236-223.customer.ggaweb.ch.8333 > tom-Latitude-3570.49070: tcp 0
01:17:41.809197 IP c-185-45-236-223.customer.ggaweb.ch.8333 > tom-Latitude-3570.49070: tcp 24
01:17:41.809214 IP tom-Latitude-3570.49070 > c-185-45-236-223.customer.ggaweb.ch.8333: tcp 0
01:17:41.810009 IP c-185-45-236-223.customer.ggaweb.ch.8333 > tom-Latitude-3570.49070: tcp 722
01:17:41.810016 IP tom-Latitude-3570.49070 > c-185-45-236-223.customer.ggaweb.ch.8333: tcp 0
01:17:41.911307 IP tom-Latitude-3570.60988 > 81.198.101.144.8333: tcp 24
01:17:41.912294 IP tom-Latitude-3570.60988 > 81.198.101.144.8333: tcp 109
01:17:41.944233 IP 81.198.101.144.8333 > tom-Latitude-3570.60988: tcp 0
01:17:41.952249 IP 81.198.101.144.8333 > tom-Latitude-3570.60988: tcp 0
01:17:42.011591 IP tom-Latitude-3570.39110 > vmi195435.contaboserver.net.8333: tcp 24
01:17:42.012528 IP tom-Latitude-3570.39110 > vmi195435.contaboserver.net.8333: tcp 109
01:17:42.046174 IP vmi195435.contaboserver.net.8333 > tom-Latitude-3570.39110: tcp 0
01:17:42.069503 IP vmi195435.contaboserver.net.8333 > tom-Latitude-3570.39110: tcp 0
01:17:42.111984 IP tom-Latitude-3570.42516 > 2.56.9.15.8333: tcp 24
01:17:42.112936 IP tom-Latitude-3570.42516 > 2.56.9.15.8333: tcp 109
01:17:42.145962 IP 2.56.9.15.8333 > tom-Latitude-3570.42516: tcp 0
01:17:42.162447 IP 2.56.9.15.8333 > tom-Latitude-3570.42516: tcp 0
01:17:42.166522 IP vmi195435.contaboserver.net.8333 > tom-Latitude-3570.39110: tcp 24
01:17:42.167182 IP vmi195435.contaboserver.net.8333 > tom-Latitude-3570.39110: tcp 73
01:17:42.167312 IP tom-Latitude-3570.39110 > vmi195435.contaboserver.net.8333: tcp 0
01:17:42.167492 IP tom-Latitude-3570.39110 > vmi195435.contaboserver.net.8333: tcp 24
01:17:42.168873 IP tom-Latitude-3570.39110 > vmi195435.contaboserver.net.8333: tcp 37
01:17:42.212441 IP vmi195435.contaboserver.net.8333 > tom-Latitude-3570.39110: tcp 0
01:17:42.213056 IP vmi195435.contaboserver.net.8333 > tom-Latitude-3570.39110: tcp 0
01:17:42.295896 IP vmi195435.contaboserver.net.8333 > tom-Latitude-3570.39110: tcp 24
01:17:42.295914 IP vmi195435.contaboserver.net.8333 > tom-Latitude-3570.39110: tcp 518
01:17:42.296003 IP tom-Latitude-3570.39110 > vmi195435.contaboserver.net.8333: tcp 0
01:17:42.399070 IP tom-Latitude-3570.49070 > c-185-45-236-223.customer.ggaweb.ch.8333: tcp 24
01:17:42.399908 IP tom-Latitude-3570.49070 > c-185-45-236-223.customer.ggaweb.ch.8333: tcp 37
01:17:42.426796 IP c-185-45-236-223.customer.ggaweb.ch.8333 > tom-Latitude-3570.49070: tcp 0
01:17:42.434758 IP c-185-45-236-223.customer.ggaweb.ch.8333 > tom-Latitude-3570.49070: tcp 0
01:17:42.499521 IP tom-Latitude-3570.57976 > 167.99.216.145.8333: tcp 24
01:17:42.499572 IP tom-Latitude-3570.60470 > bb42-60-217-183.singnet.com.sg.8333: tcp 24
01:17:42.538813 IP tom-Latitude-3570.60470 > bb42-60-217-183.singnet.com.sg.8333: tcp 145
01:17:42.538824 IP tom-Latitude-3570.57976 > 167.99.216.145.8333: tcp 217
01:17:42.568129 IP 167.99.216.145.8333 > tom-Latitude-3570.57976: tcp 0
01:17:42.575466 IP bb42-60-217-183.singnet.com.sg.8333 > tom-Latitude-3570.60470: tcp 0
01:17:42.583187 IP bb42-60-217-183.singnet.com.sg.8333 > tom-Latitude-3570.60470: tcp 0
01:17:42.583544 IP 167.99.216.145.8333 > tom-Latitude-3570.57976: tcp 0
01:17:42.800634 IP tom-Latitude-3570.45056 > 241.240.220.35.bc.googleusercontent.com.8333: tcp 24
01:17:42.814236 IP tom-Latitude-3570.45056 > 241.240.220.35.bc.googleusercontent.com.8333: tcp 145
01:17:42.855354 IP 241.240.220.35.bc.googleusercontent.com.8333 > tom-Latitude-3570.45056: tcp 0
01:17:42.862271 IP 241.240.220.35.bc.googleusercontent.com.8333 > tom-Latitude-3570.45056: tcp 0
01:17:42.901037 IP tom-Latitude-3570.56714 > ns3113832.ip-54-38-177.eu.8333: tcp 24
01:17:42.901995 IP tom-Latitude-3570.56714 > ns3113832.ip-54-38-177.eu.8333: tcp 145
01:17:42.938139 IP ns3113832.ip-54-38-177.eu.8333 > tom-Latitude-3570.56714: tcp 0
01:17:42.938723 IP ns3113832.ip-54-38-177.eu.8333 > tom-Latitude-3570.56714: tcp 0
01:17:43.854538 IP tom-Latitude-3570.45056 > 241.240.220.35.bc.googleusercontent.com.8333: tcp 0
01:17:44.006578 IP 241.240.220.35.bc.googleusercontent.com.8333 > tom-Latitude-3570.45056: tcp 0
01:17:44.204784 IP tom-Latitude-3570.42516 > 2.56.9.15.8333: tcp 24
01:17:44.205656 IP tom-Latitude-3570.42516 > 2.56.9.15.8333: tcp 37
01:17:44.245966 IP 2.56.9.15.8333 > tom-Latitude-3570.42516: tcp 0
01:17:44.246675 IP 2.56.9.15.8333 > tom-Latitude-3570.42516: tcp 0
01:17:44.259826 IP vmi195435.contaboserver.net.8333 > tom-Latitude-3570.39110: tcp 24
01:17:44.263214 IP vmi195435.contaboserver.net.8333 > tom-Latitude-3570.39110: tcp 73
01:17:44.263340 IP tom-Latitude-3570.39110 > vmi195435.contaboserver.net.8333: tcp 0
01:17:44.263525 IP tom-Latitude-3570.39110 > vmi195435.contaboserver.net.8333: tcp 24
