08:59:40.057902 IP tom-Latitude-3570.49070 > c-185-45-236-223.customer.ggaweb.ch.8333: tcp 24
08:59:40.057961 IP tom-Latitude-3570.57976 > 167.99.216.145.8333: tcp 24
08:59:40.059929 IP tom-Latitude-3570.49070 > c-185-45-236-223.customer.ggaweb.ch.8333: tcp 109
08:59:40.061268 IP tom-Latitude-3570.57976 > 167.99.216.145.8333: tcp 73
08:59:40.099196 IP static-87-75-105-186.vodafonexdsl.co.uk.8333 > tom-Latitude-3570.46284: tcp 24
08:59:40.099213 IP tom-Latitude-3570.46284 > static-87-75-105-186.vodafonexdsl.co.uk.8333: tcp 0
08:59:40.099851 IP static-87-75-105-186.vodafonexdsl.co.uk.8333 > tom-Latitude-3570.46284: tcp 73
08:59:40.099868 IP tom-Latitude-3570.46284 > static-87-75-105-186.vodafonexdsl.co.uk.8333: tcp 0
08:59:40.100116 IP tom-Latitude-3570.46284 > static-87-75-105-186.vodafonexdsl.co.uk.8333: tcp 24
08:59:40.101728 IP tom-Latitude-3570.46284 > static-87-75-105-186.vodafonexdsl.co.uk.8333: tcp 73
08:59:40.110983 IP c-185-45-236-223.customer.ggaweb.ch.8333 > tom-Latitude-3570.49070: tcp 0
08:59:40.128801 IP 167.99.216.145.8333 > tom-Latitude-3570.57976: tcp 0
08:59:40.129358 IP c-185-45-236-223.customer.ggaweb.ch.8333 > tom-Latitude-3570.49070: tcp 0
08:59:40.129372 IP 167.99.216.145.8333 > tom-Latitude-3570.57976: tcp 0
08:59:40.135063 IP static-87-75-105-186.vodafonexdsl.co.uk.8333 > tom-Latitude-3570.46284: tcp 0
08:59:40.201208 IP static-87-75-105-186.vodafonexdsl.co.uk.8333 > tom-Latitude-3570.46284: tcp 24
08:59:40.201228 IP static-87-75-105-186.vodafonexdsl.co.uk.8333 > tom-Latitude-3570.46284: tcp 246
08:59:40.201232 IP static-87-75-105-186.vodafonexdsl.co.uk.8333 > tom-Latitude-3570.46284: tcp 24
08:59:40.201237 IP static-87-75-105-186.vodafonexdsl.co.uk.8333 > tom-Latitude-3570.46284: tcp 225
08:59:40.201327 IP tom-Latitude-3570.46284 > static-87-75-105-186.vodafonexdsl.co.uk.8333: tcp 0
08:59:40.369818 IP 2.56.9.15.8333 > tom-Latitude-3570.42516: tcp 24
08:59:40.369839 IP 2.56.9.15.8333 > tom-Latitude-3570.42516: tcp 145
08:59:40.369929 IP tom-Latitude-3570.42516 > 2.56.9.15.8333: tcp 0
08:59:40.370075 IP tom-Latitude-3570.42516 > 2.56.9.15.8333: tcp 24
08:59:40.371524 IP tom-Latitude-3570.42516 > 2.56.9.15.8333: tcp 37
08:59:40.408483 IP 2.56.9.15.8333 > tom-Latitude-3570.42516: tcp 0
08:59:40.470470 IP tom-Latitude-3570.46284 > static-87-75-105-186.vodafonexdsl.co.uk.8333: tcp 24
08:59:40.471982 IP tom-Latitude-3570.46284 > static-87-75-105-186.vodafonexdsl.co.uk.8333: tcp 31
08:59:40.506441 IP 2.56.9.15.8333 > tom-Latitude-3570.42516: tcp 24
08:59:40.506462 IP 2.56.9.15.8333 > tom-Latitude-3570.42516: tcp 372
08:59:40.506552 IP tom-Latitude-3570.42516 > 2.56.9.15.8333: tcp 0
08:59:40.509432 IP static-87-75-105-186.vodafonexdsl.co.uk.8333 > tom-Latitude-3570.46284: tcp 0
08:59:40.625774 IP 2.56.9.15.8333 > tom-Latitude-3570.42516: tcp 372
08:59:40.625793 IP tom-Latitude-3570.42516 > 2.56.9.15.8333: tcp 0
08:59:40.707569 IP tom-Latitude-3570.49070 > c-185-45-236-223.customer.ggaweb.ch.8333: tcp 24
08:59:40.711530 IP tom-Latitude-3570.49070 > c-185-45-236-223.customer.ggaweb.ch.8333: tcp 109
08:59:40.741823 IP c-185-45-236-223.customer.ggaweb.ch.8333 > tom-Latitude-3570.49070: tcp 0
08:59:40.750211 IP c-185-45-236-223.customer.ggaweb.ch.8333 > tom-Latitude-3570.49070: tcp 0
08:59:40.808010 IP tom-Latitude-3570.60470 > bb42-60-217-183.singnet.com.sg.8333: tcp 24
08:59:40.808082 IP tom-Latitude-3570.46284 > static-87-75-105-186.vodafonexdsl.co.uk.8333: tcp 24
08:59:40.808958 IP tom-Latitude-3570.60470 > bb42-60-217-183.singnet.com.sg.8333: tcp 145
08:59:40.809658 IP tom-Latitude-3570.46284 > static-87-75-105-186.vodafonexdsl.co.uk.8333: tcp 37
08:59:40.840378 IP bb42-60-217-183.singnet.com.sg.8333 > tom-Latitude-3570.60470: tcp 0
08:59:40.848816 IP bb42-60-217-183.singnet.com.sg.8333 > tom-Latitude-3570.60470: tcp 0
08:59:40.848830 IP static-87-75-105-186.vodafonexdsl.co.uk.8333 > tom-Latitude-3570.46284: tcp 0
08:59:40.936365 IP vmi195435.contaboserver.net.8333 > tom-Latitude-3570.39110: tcp 24
08:59:40.937294 IP vmi195435.contaboserver.net.8333 > tom-Latitude-3570.39110: tcp 145
08:59:40.937405 IP tom-Latitude-3570.39110 > vmi195435.contaboserver.net.8333: tcp 0
08:59:40.937526 IP tom-Latitude-3570.39110 > vmi195435.contaboserver.net.8333: tcp 24
08:59:40.940285 IP tom-Latitude-3570.39110 > vmi195435.contaboserver.net.8333: tcp 37
08:59:40.975993 IP vmi195435.contaboserver.net.8333 > tom-Latitude-3570.39110: tcp 0
08:59:40.976008 IP vmi195435.contaboserver.net.8333 > tom-Latitude-3570.39110: tcp 0
08:59:41.065165 IP vmi195435.contaboserver.net.8333 > tom-Latitude-3570.39110: tcp 24
08:59:41.065184 IP vmi195435.contaboserver.net.8333 > tom-Latitude-3570.39110: tcp 225
08:59:41.065295 IP tom-Latitude-3570.39110 > vmi195435.contaboserver.net.8333: tcp 0
08:59:41.266356 IP tom-Latitude-3570.49070 > c-185-45-236-223.customer.ggaweb.ch.8333: tcp 24
08:59:41.276810 IP tom-Latitude-3570.49070 > c-185-45-236-223.customer.ggaweb.ch.8333: tcp 37
08:59:41.300145 IP c-185-45-236-223.customer.ggaweb.ch.8333 > tom-Latitude-3570.49070: tcp 0
08:59:41.309775 IP c-185-45-236-223.customer.ggaweb.ch.8333 > tom-Latitude-3570.49070: tcp 0
08:59:41.567412 IP tom-Latitude-3570.46284 > static-87-75-105-186.vodafonexdsl.co.uk.8333: tcp 24
08:59:41.569721 IP tom-Latitude-3570.46284 > static-87-75-105-186.vodafonexdsl.co.uk.8333: tcp 37
08:59:41.632754 IP static-87-75-105-186.vodafonexdsl.co.uk.8333 > tom-Latitude-3570.46284: tcp 0
08:59:41.868429 IP tom-Latitude-3570.57976 > 167.99.216.145.8333: tcp 24
08:59:41.871876 IP tom-Latitude-3570.57976 > 167.99.216.145.8333: tcp 145
08:59:41.910572 IP 167.99.216.145.8333 > tom-Latitude-3570.57976: tcp 0
08:59:41.918741 IP 167.99.216.145.8333 > tom-Latitude-3570.57976: tcp 0
08:59:41.989250 IP static-87-75-105-186.vodafonexdsl.co.uk.8333 > tom-Latitude-3570.46284: tcp 24
08:59:41.994065 IP static-87-75-105-186.vodafonexdsl.co.uk.8333 > tom-Latitude-3570.46284: tcp 109
08:59:41.994197 IP tom-Latitude-3570.46284 > static-87-75-105-186.vodafonexdsl.co.uk.8333: tcp 0
08:59:41.994345 IP tom-Latitude-3570.46284 > static-87-75-105-186.vodafonexdsl.co.uk.8333: tcp 24
08:59:41.995856 IP tom-Latitude-3570.46284 > static-87-75-105-186.vodafonexdsl.co.uk.8333: tcp 109
08:59:42.029301 IP static-87-75-105-186.vodafonexdsl.co.uk.8333 > tom-Latitude-3570.46284: tcp 0
08:59:42.096129 IP static-87-75-105-186.vodafonexdsl.co.uk.8333 > tom-Latitude-3570.46284: tcp 24
08:59:42.096149 IP static-87-75-105-186.vodafonexdsl.co.uk.8333 > tom-Latitude-3570.46284: tcp 386
08:59:42.096156 IP static-87-75-105-186.vodafonexdsl.co.uk.8333 > tom-Latitude-3570.46284: tcp 24
08:59:42.096245 IP tom-Latitude-3570.46284 > static-87-75-105-186.vodafonexdsl.co.uk.8333: tcp 0
08:59:42.101997 IP static-87-75-105-186.vodafonexdsl.co.uk.8333 > tom-Latitude-3570.46284: tcp 284
08:59:42.102012 IP static-87-75-105-186.vodafonexdsl.co.uk.8333 > tom-Latitude-3570.46284: tcp 24
08:59:42.102143 IP static-87-75-105-186.vodafonexdsl.co.uk.8333 > tom-Latitude-3570.46284: tcp 1413
08:59:42.102149 IP tom-Latitude-3570.46284 > static-87-75-105-186.vodafonexdsl.co.uk.8333: tcp 0
08:59:42.102193 IP tom-Latitude-3570.46284 > static-87-75-105-186.vodafonexdsl.co.uk.8333: tcp 0
08:59:42.404968 IP tom-Latitude-3570.49070 > c-185-45-236-223.customer.ggaweb.ch.8333: tcp 24
08:59:42.408875 IP tom-Latitude-3570.49070 > c-185-45-236-223.customer.ggaweb.ch.8333: tcp 109
08:59:42.450544 IP c-185-45-236-223.customer.ggaweb.ch.8333 > tom-Latitude-3570.49070: tcp 0
08:59:42.458486 IP c-185-45-236-223.customer.ggaweb.ch.8333 > tom-Latitude-3570.49070: tcp 0
08:59:42.906330 IP tom-Latitude-3570.39110 > vmi195435.contaboserver.net.8333: tcp 24
08:59:42.908604 IP tom-Latitude-3570.39110 > vmi195435.contaboserver.net.8333: tcp 109
08:59:42.950596 IP vmi195435.contaboserver.net.8333 > tom-Latitude-3570.39110: tcp 24
08:59:42.950619 IP vmi195435.contaboserver.net.8333 > tom-Latitude-3570.39110: tcp 217
08:59:42.950623 IP vmi195435.contaboserver.net.8333 > tom-Latitude-3570.39110: tcp 217
08:59:42.950651 IP tom-Latitude-3570.39110 > vmi195435.contaboserver.net.8333: tcp 0
08:59:42.950666 IP vmi195435.contaboserver.net.8333 > tom-Latitude-3570.39110: tcp 0
08:59:42.950932 IP tom-Latitude-3570.39110 > vmi195435.contaboserver.net.8333: tcp 24
08:59:42.950946 IP tom-Latitude-3570.39110 > vmi195435.contaboserver.net.8333: tcp 109
08:59:42.951037 IP tom-Latitude-3570.42516 > 2.56.9.15.8333: tcp 24
08:59:42.953582 IP tom-Latitude-3570.42516 > 2.56.9.15.8333: tcp 145
08:59:42.959249 IP vmi195435.contaboserver.net.8333 > tom-Latitude-3570.39110: tcp 0
08:59:42.991420 IP vmi195435.contaboserver.net.8333 > tom-Latitude-3570.39110: tcp 0
08:59:42.991425 IP vmi195435.contaboserver.net.8333 > tom-Latitude-3570.39110: tcp 0
08:59:42.991427 IP 2.56.9.15.8333 > tom-Latitude-3570.42516: tcp 0
08:59:43.051242 IP tom-Latitude-3570.39110 > vmi195435.contaboserver.net.8333: tcp 24
08:59:43.052074 IP tom-Latitude-3570.39110 > vmi195435.contaboserver.net.8333: tcp 31
08:59:43.069519 IP vmi195435.contaboserver.net.8333 > tom-Latitude-3570.39110: tcp 24
08:59:43.069541 IP vmi195435.contaboserver.net.8333 > tom-Latitude-3570.39110: tcp 223
08:59:43.069544 IP vmi195435.contaboserver.net.8333 > tom-Latitude-3570.39110: tcp 24
08:59:43.069547 IP vmi195435.contaboserver.net.8333 > tom-Latitude-3570.39110: tcp 591
08:59:43.069567 IP vmi195435.contaboserver.net.8333 > tom-Latitude-3570.39110: tcp 24
08:59:43.069569 IP vmi195435.contaboserver.net.8333 > tom-Latitude-3570.39110: tcp 248
08:59:43.069633 IP tom-Latitude-3570.39110 > vmi195435.contaboserver.net.8333: tcp 0
08:59:43.070092 IP tom-Latitude-3570.49070 > c-185-45-236-223.customer.ggaweb.ch.8333: tcp 24
08:59:43.072824 IP tom-Latitude-3570.49070 > c-185-45-236-223.customer.ggaweb.ch.8333: tcp 37
08:59:43.077822 IP vmi195435.contaboserver.net.8333 > tom-Latitude-3570.39110: tcp 0
08:59:43.086514 IP vmi195435.contaboserver.net.8333 > tom-Latitude-3570.39110: tcp 0
08:59:43.097905 IP c-185-45-236-223.customer.ggaweb.ch.8333 > tom-Latitude-3570.49070: tcp 0
08:59:43.105908 IP c-185-45-236-223.customer.ggaweb.ch.8333 > tom-Latitude-3570.49070: tcp 0
08:59:43.169671 IP static-87-75-105-186.vodafonexdsl.co.uk.8333 > tom-Latitude-3570.46284: tcp 24
08:59:43.171240 IP tom-Latitude-3570.42516 > 2.56.9.15.8333: tcp 24
08:59:43.172618 IP tom-Latitude-3570.42516 > 2.56.9.15.8333: tcp 109
08:59:43.174838 IP static-87-75-105-186.vodafonexdsl.co.uk.8333 > tom-Latitude-3570.46284: tcp 145
08:59:43.174966 IP tom-Latitude-3570.46284 > static-87-75-105-186.vodafonexdsl.co.uk.8333: tcp 0
08:59:43.175177 IP tom-Latitude-3570.46284 > static-87-75-105-186.vodafonexdsl.co.uk.8333: tcp 24
08:59:43.177329 IP tom-Latitude-3570.46284 > static-87-75-105-186.vodafonexdsl.co.uk.8333: tcp 37
08:59:43.216073 IP 2.56.9.15.8333 > tom-Latitude-3570.42516: tcp 0
08:59:43.216081 IP static-87-75-105-186.vodafonexdsl.co.uk.8333 > tom-Latitude-3570.46284: tcp 0
08:59:43.275944 IP static-87-75-105-186.vodafonexdsl.co.uk.8333 > tom-Latitude-3570.46284: tcp 24
08:59:43.276529 IP static-87-75-105-186.vodafonexdsl.co.uk.8333 > tom-Latitude-3570.46284: tcp 249
08:59:43.276545 IP tom-Latitude-3570.46284 > static-87-75-105-186.vodafonexdsl.co.uk.8333: tcp 0
08:59:43.477516 IP tom-Latitude-3570.60988 > 81.198.101.144.8333: tcp 24
08:59:43.482352 IP tom-Latitude-3570.60988 > 81.198.101.144.8333: tcp 397
08:59:43.510101 IP 81.198.101.144.8333 > tom-Latitude-3570.60988: tcp 0
08:59:43.520414 IP 81.198.101.144.8333 > tom-Latitude-3570.60988: tcp 0
08:59:43.678402 IP tom-Latitude-3570.57976 > 167.99.216.145.8333: tcp 24
08:59:43.680604 IP tom-Latitude-3570.57976 > 167.99.216.145.8333: tcp 253
08:59:43.710773 IP 167.99.216.145.8333 > tom-Latitude-3570.57976: tcp 0
08:59:43.719570 IP 167.99.216.145.8333 > tom-Latitude-3570.57976: tcp 0
08:59:44.480982 IP tom-Latitude-3570.56714 > ns3113832.ip-54-38-177.eu.8333: tcp 24
08:59:44.483100 IP tom-Latitude-3570.56714 > ns3113832.ip-54-38-177.eu.8333: tcp 469
08:59:44.530258 IP ns3113832.ip-54-38-177.eu.8333 > tom-Latitude-3570.56714: tcp 0
08:59:44.539659 IP ns3113832.ip-54-38-177.eu.8333 > tom-Latitude-3570.56714: tcp 0
08:59:45.183379 IP tom-Latitude-3570.49070 > c-185-45-236-223.customer.ggaweb.ch.8333: tcp 24
08:59:45.185659 IP tom-Latitude-3570.49070 > c-185-45-236-223.customer.ggaweb.ch.8333: tcp 109
08:59:45.219772 IP c-185-45-236-223.customer.ggaweb.ch.8333 > tom-Latitude-3570.49070: tcp 24
08:59:45.219794 IP c-185-45-236-223.customer.ggaweb.ch.8333 > tom-Latitude-3570.49070: tcp 253
08:59:45.219883 IP tom-Latitude-3570.49070 > c-185-45-236-223.customer.ggaweb.ch.8333: tcp 0
08:59:45.220151 IP tom-Latitude-3570.49070 > c-185-45-236-223.customer.ggaweb.ch.8333: tcp 24
08:59:45.220166 IP tom-Latitude-3570.49070 > c-185-45-236-223.customer.ggaweb.ch.8333: tcp 145
08:59:45.220369 IP vmi195435.contaboserver.net.8333 > tom-Latitude-3570.39110: tcp 24
08:59:45.220382 IP vmi195435.contaboserver.net.8333 > tom-Latitude-3570.39110: tcp 181
08:59:45.220405 IP tom-Latitude-3570.39110 > vmi195435.contaboserver.net.8333: tcp 0
08:59:45.226477 IP vmi195435.contaboserver.net.8333 > tom-Latitude-3570.39110: tcp 181
08:59:45.226485 IP tom-Latitude-3570.39110 > vmi195435.contaboserver.net.8333: tcp 0
08:59:45.227923 IP bb42-60-217-183.singnet.com.sg.8333 > tom-Latitude-3570.60470: tcp 24
08:59:45.227931 IP bb42-60-217-183.singnet.com.sg.8333 > tom-Latitude-3570.60470: tcp 433
08:59:45.227945 IP tom-Latitude-3570.60470 > bb42-60-217-183.singnet.com.sg.8333: tcp 0
08:59:45.233544 IP c-185-45-236-223.customer.ggaweb.ch.8333 > tom-Latitude-3570.49070: tcp 253
08:59:45.233550 IP tom-Latitude-3570.49070 > c-185-45-236-223.customer.ggaweb.ch.8333: tcp 0
08:59:45.237173 IP c-185-45-236-223.customer.ggaweb.ch.8333 > tom-Latitude-3570.49070: tcp 0
08:59:45.238644 IP c-185-45-236-223.customer.ggaweb.ch.8333 > tom-Latitude-3570.49070: tcp 0
08:59:45.254780 IP c-185-45-236-223.customer.ggaweb.ch.8333 > tom-Latitude-3570.49070: tcp 0
08:59:45.254785 IP c-185-45-236-223.customer.ggaweb.ch.8333 > tom-Latitude-3570.49070: tcp 0
08:59:45.346787 IP c-185-45-236-223.customer.ggaweb.ch.8333 > tom-Latitude-3570.49070: tcp 24
08:59:45.346792 IP tom-Latitude-3570.49070 > c-185-45-236-223.customer.ggaweb.ch.8333: tcp 0
08:59:45.347582 IP c-185-45-236-223.customer.ggaweb.ch.8333 > tom-Latitude-3570.49070: tcp 587
08:59:45.347589 IP tom-Latitude-3570.49070 > c-185-45-236-223.customer.ggaweb.ch.8333: tcp 0
08:59:45.347598 IP c-185-45-236-223.customer.ggaweb.ch.8333 > tom-Latitude-3570.49070: tcp 499
08:59:45.347601 IP tom-Latitude-3570.49070 > c-185-45-236-223.customer.ggaweb.ch.8333: tcp 0
08:59:45.585242 IP ns3113832.ip-54-38-177.eu.8333 > tom-Latitude-3570.56714: tcp 24
08:59:45.585263 IP ns3113832.ip-54-38-177.eu.8333 > tom-Latitude-3570.56714: tcp 145
08:59:45.585376 IP tom-Latitude-3570.56714 > ns3113832.ip-54-38-177.eu.8333: tcp 0
08:59:46.087153 IP tom-Latitude-3570.42516 > 2.56.9.15.8333: tcp 24
08:59:46.089286 IP tom-Latitude-3570.42516 > 2.56.9.15.8333: tcp 181
08:59:46.195903 IP tom-Latitude-3570.42516 > 2.56.9.15.8333: tcp 181
08:59:46.257944 IP static-87-75-105-186.vodafonexdsl.co.uk.8333 > tom-Latitude-3570.46284: tcp 145
08:59:46.257961 IP tom-Latitude-3570.46284 > static-87-75-105-186.vodafonexdsl.co.uk.8333: tcp 0
08:59:46.258641 IP static-87-75-105-186.vodafonexdsl.co.uk.8333 > tom-Latitude-3570.46284: tcp 145
08:59:46.258646 IP tom-Latitude-3570.46284 > static-87-75-105-186.vodafonexdsl.co.uk.8333: tcp 0
08:59:46.258653 IP 2.56.9.15.8333 > tom-Latitude-3570.42516: tcp 0
08:59:46.298905 IP 2.56.9.15.8333 > tom-Latitude-3570.42516: tcp 0
08:59:46.311924 IP static-87-75-105-186.vodafonexdsl.co.uk.8333 > tom-Latitude-3570.46284: tcp 24
08:59:46.311932 IP tom-Latitude-3570.46284 > static-87-75-105-186.vodafonexdsl.co.uk.8333: tcp 0
08:59:46.393303 IP 81.198.101.144.8333 > tom-Latitude-3570.60988: tcp 24
08:59:46.393324 IP 81.198.101.144.8333 > tom-Latitude-3570.60988: tcp 145
08:59:46.393412 IP tom-Latitude-3570.60988 > 81.198.101.144.8333: tcp 0
08:59:46.609386 IP ns3113832.ip-54-38-177.eu.8333 > tom-Latitude-3570.56714: tcp 24
08:59:46.609405 IP ns3113832.ip-54-38-177.eu.8333 > tom-Latitude-3570.56714: tcp 91
08:59:46.609480 IP tom-Latitude-3570.56714 > ns3113832.ip-54-38-177.eu.8333: tcp 0
08:59:47.017636 IP 167.99.216.145.8333 > tom-Latitude-3570.57976: tcp 24
08:59:47.017656 IP 167.99.216.145.8333 > tom-Latitude-3570.57976: tcp 217
08:59:47.017702 IP 167.99.216.145.8333 > tom-Latitude-3570.57976: tcp 217
08:59:47.017709 IP tom-Latitude-3570.57976 > 167.99.216.145.8333: tcp 0
08:59:47.017894 IP tom-Latitude-3570.57976 > 167.99.216.145.8333: tcp 24
08:59:47.019931 IP tom-Latitude-3570.57976 > 167.99.216.145.8333: tcp 73
08:59:47.067196 IP 167.99.216.145.8333 > tom-Latitude-3570.57976: tcp 0
08:59:47.067785 IP 167.99.216.145.8333 > tom-Latitude-3570.57976: tcp 0
08:59:47.137636 IP 167.99.216.145.8333 > tom-Latitude-3570.57976: tcp 24
08:59:47.137657 IP 167.99.216.145.8333 > tom-Latitude-3570.57976: tcp 246
08:59:47.137662 IP 167.99.216.145.8333 > tom-Latitude-3570.57976: tcp 24
08:59:47.137666 IP 167.99.216.145.8333 > tom-Latitude-3570.57976: tcp 192
08:59:47.137702 IP tom-Latitude-3570.57976 > 167.99.216.145.8333: tcp 0
08:59:47.539871 IP tom-Latitude-3570.42516 > 2.56.9.15.8333: tcp 24
08:59:47.542776 IP tom-Latitude-3570.42516 > 2.56.9.15.8333: tcp 73
08:59:47.590101 IP 2.56.9.15.8333 > tom-Latitude-3570.42516: tcp 0
08:59:47.597918 IP 2.56.9.15.8333 > tom-Latitude-3570.42516: tcp 0
08:59:48.044076 IP c-185-45-236-223.customer.ggaweb.ch.8333 > tom-Latitude-3570.49070: tcp 24
08:59:48.044102 IP tom-Latitude-3570.49070 > c-185-45-236-223.customer.ggaweb.ch.8333: tcp 0
08:59:48.044120 IP c-185-45-236-223.customer.ggaweb.ch.8333 > tom-Latitude-3570.49070: tcp 181
08:59:48.044125 IP tom-Latitude-3570.49070 > c-185-45-236-223.customer.ggaweb.ch.8333: tcp 0
08:59:48.044130 IP c-185-45-236-223.customer.ggaweb.ch.8333 > tom-Latitude-3570.49070: tcp 181
08:59:48.044133 IP tom-Latitude-3570.49070 > c-185-45-236-223.customer.ggaweb.ch.8333: tcp 0
08:59:48.044363 IP tom-Latitude-3570.49070 > c-185-45-236-223.customer.ggaweb.ch.8333: tcp 24
08:59:48.049084 IP tom-Latitude-3570.49070 > c-185-45-236-223.customer.ggaweb.ch.8333: tcp 109
08:59:48.090260 IP c-185-45-236-223.customer.ggaweb.ch.8333 > tom-Latitude-3570.49070: tcp 0
08:59:48.090274 IP c-185-45-236-223.customer.ggaweb.ch.8333 > tom-Latitude-3570.49070: tcp 0
08:59:48.172129 IP c-185-45-236-223.customer.ggaweb.ch.8333 > tom-Latitude-3570.49070: tcp 24
08:59:48.172145 IP c-185-45-236-223.customer.ggaweb.ch.8333 > tom-Latitude-3570.49070: tcp 249
08:59:48.172182 IP c-185-45-236-223.customer.ggaweb.ch.8333 > tom-Latitude-3570.49070: tcp 395
08:59:48.172189 IP c-185-45-236-223.customer.ggaweb.ch.8333 > tom-Latitude-3570.49070: tcp 250
08:59:48.172231 IP tom-Latitude-3570.49070 > c-185-45-236-223.customer.ggaweb.ch.8333: tcp 0
08:59:48.273665 IP tom-Latitude-3570.60988 > 81.198.101.144.8333: tcp 24
08:59:48.274612 IP tom-Latitude-3570.60988 > 81.198.101.144.8333: tcp 181
08:59:48.299989 IP 81.198.101.144.8333 > tom-Latitude-3570.60988: tcp 0
08:59:48.308491 IP 81.198.101.144.8333 > tom-Latitude-3570.60988: tcp 0
08:59:48.474211 IP tom-Latitude-3570.39110 > vmi195435.contaboserver.net.8333: tcp 24
08:59:48.476482 IP tom-Latitude-3570.39110 > vmi195435.contaboserver.net.8333: tcp 181
08:59:48.509958 IP vmi195435.contaboserver.net.8333 > tom-Latitude-3570.39110: tcp 0
08:59:48.517952 IP vmi195435.contaboserver.net.8333 > tom-Latitude-3570.39110: tcp 0
08:59:48.675050 IP tom-Latitude-3570.42516 > 2.56.9.15.8333: tcp 24
08:59:48.677099 IP tom-Latitude-3570.42516 > 2.56.9.15.8333: tcp 109
08:59:48.743009 IP 2.56.9.15.8333 > tom-Latitude-3570.42516: tcp 0
08:59:48.743024 IP 2.56.9.15.8333 > tom-Latitude-3570.42516: tcp 0
08:59:48.806173 IP ns3113832.ip-54-38-177.eu.8333 > tom-Latitude-3570.56714: tcp 24
08:59:48.806193 IP ns3113832.ip-54-38-177.eu.8333 > tom-Latitude-3570.56714: tcp 181
08:59:48.806283 IP tom-Latitude-3570.56714 > ns3113832.ip-54-38-177.eu.8333: tcp 0
08:59:49.107482 IP tom-Latitude-3570.60470 > bb42-60-217-183.singnet.com.sg.8333: tcp 24
08:59:49.112052 IP tom-Latitude-3570.60470 > bb42-60-217-183.singnet.com.sg.8333: tcp 181
08:59:49.150979 IP bb42-60-217-183.singnet.com.sg.8333 > tom-Latitude-3570.60470: tcp 0
08:59:49.157956 IP bb42-60-217-183.singnet.com.sg.8333 > tom-Latitude-3570.60470: tcp 0
08:59:49.609021 IP tom-Latitude-3570.57976 > 167.99.216.145.8333: tcp 24
08:59:49.611290 IP tom-Latitude-3570.57976 > 167.99.216.145.8333: tcp 109
08:59:49.650674 IP 167.99.216.145.8333 > tom-Latitude-3570.57976: tcp 0
08:59:49.665895 IP 167.99.216.145.8333 > tom-Latitude-3570.57976: tcp 0
08:59:50.612424 IP tom-Latitude-3570.46284 > static-87-75-105-186.vodafonexdsl.co.uk.8333: tcp 24
08:59:50.614461 IP tom-Latitude-3570.46284 > static-87-75-105-186.vodafonexdsl.co.uk.8333: tcp 181
08:59:50.659606 IP 2.56.9.15.8333 > tom-Latitude-3570.42516: tcp 24
08:59:50.659631 IP tom-Latitude-3570.42516 > 2.56.9.15.8333: tcp 0
08:59:50.659663 IP 2.56.9.15.8333 > tom-Latitude-3570.42516: tcp 145
08:59:50.659669 IP tom-Latitude-3570.42516 > 2.56.9.15.8333: tcp 0
08:59:50.659673 IP 2.56.9.15.8333 > tom-Latitude-3570.42516: tcp 145
08:59:50.659682 IP tom-Latitude-3570.42516 > 2.56.9.15.8333: tcp 0
08:59:50.660005 IP tom-Latitude-3570.42516 > 2.56.9.15.8333: tcp 24
08:59:50.663413 IP tom-Latitude-3570.42516 > 2.56.9.15.8333: tcp 145
08:59:50.668351 IP static-87-75-105-186.vodafonexdsl.co.uk.8333 > tom-Latitude-3570.46284: tcp 0
08:59:50.697751 IP 2.56.9.15.8333 > tom-Latitude-3570.42516: tcp 0
08:59:50.698319 IP 2.56.9.15.8333 > tom-Latitude-3570.42516: tcp 0
08:59:50.794705 IP 2.56.9.15.8333 > tom-Latitude-3570.42516: tcp 24
08:59:50.795417 IP 2.56.9.15.8333 > tom-Latitude-3570.42516: tcp 225
08:59:50.795434 IP 2.56.9.15.8333 > tom-Latitude-3570.42516: tcp 24
08:59:50.795437 IP 2.56.9.15.8333 > tom-Latitude-3570.42516: tcp 225
08:59:50.795439 IP 2.56.9.15.8333 > tom-Latitude-3570.42516: tcp 24
08:59:50.795529 IP tom-Latitude-3570.42516 > 2.56.9.15.8333: tcp 0
08:59:50.797791 IP 2.56.9.15.8333 > tom-Latitude-3570.42516: tcp 255
08:59:50.797811 IP 2.56.9.15.8333 > tom-Latitude-3570.42516: tcp 24
08:59:50.797814 IP 2.56.9.15.8333 > tom-Latitude-3570.42516: tcp 224
08:59:50.797905 IP tom-Latitude-3570.42516 > 2.56.9.15.8333: tcp 0
08:59:51.099622 IP tom-Latitude-3570.39110 > vmi195435.contaboserver.net.8333: tcp 24
08:59:51.101960 IP tom-Latitude-3570.39110 > vmi195435.contaboserver.net.8333: tcp 145
08:59:51.191905 IP tom-Latitude-3570.39110 > vmi195435.contaboserver.net.8333: tcp 145
08:59:51.302936 IP vmi195435.contaboserver.net.8333 > tom-Latitude-3570.39110: tcp 0
08:59:51.318263 IP vmi195435.contaboserver.net.8333 > tom-Latitude-3570.39110: tcp 0
08:59:51.319553 IP vmi195435.contaboserver.net.8333 > tom-Latitude-3570.39110: tcp 0
08:59:51.500878 IP tom-Latitude-3570.49070 > c-185-45-236-223.customer.ggaweb.ch.8333: tcp 24
08:59:51.503057 IP tom-Latitude-3570.49070 > c-185-45-236-223.customer.ggaweb.ch.8333: tcp 145
08:59:51.530319 IP c-185-45-236-223.customer.ggaweb.ch.8333 > tom-Latitude-3570.49070: tcp 0
08:59:51.541392 IP c-185-45-236-223.customer.ggaweb.ch.8333 > tom-Latitude-3570.49070: tcp 0
08:59:52.203177 IP tom-Latitude-3570.60470 > bb42-60-217-183.singnet.com.sg.8333: tcp 24
08:59:52.205284 IP tom-Latitude-3570.60470 > bb42-60-217-183.singnet.com.sg.8333: tcp 31
08:59:52.249128 IP ns3113832.ip-54-38-177.eu.8333 > tom-Latitude-3570.56714: tcp 24
08:59:52.255065 IP ns3113832.ip-54-38-177.eu.8333 > tom-Latitude-3570.56714: tcp 253
08:59:52.255083 IP bb42-60-217-183.singnet.com.sg.8333 > tom-Latitude-3570.60470: tcp 0
08:59:52.255177 IP tom-Latitude-3570.56714 > ns3113832.ip-54-38-177.eu.8333: tcp 0
08:59:52.255413 IP tom-Latitude-3570.56714 > ns3113832.ip-54-38-177.eu.8333: tcp 24
08:59:52.256712 IP tom-Latitude-3570.56714 > ns3113832.ip-54-38-177.eu.8333: tcp 109
08:59:52.257994 IP bb42-60-217-183.singnet.com.sg.8333 > tom-Latitude-3570.60470: tcp 0
08:59:52.283062 IP ns3113832.ip-54-38-177.eu.8333 > tom-Latitude-3570.56714: tcp 253
08:59:52.283067 IP tom-Latitude-3570.56714 > ns3113832.ip-54-38-177.eu.8333: tcp 0
08:59:52.283073 IP static-87-75-105-186.vodafonexdsl.co.uk.8333 > tom-Latitude-3570.46284: tcp 24
08:59:52.283078 IP tom-Latitude-3570.46284 > static-87-75-105-186.vodafonexdsl.co.uk.8333: tcp 0
08:59:52.288265 IP ns3113832.ip-54-38-177.eu.8333 > tom-Latitude-3570.56714: tcp 0
08:59:52.291388 IP static-87-75-105-186.vodafonexdsl.co.uk.8333 > tom-Latitude-3570.46284: tcp 289
08:59:52.291395 IP tom-Latitude-3570.46284 > static-87-75-105-186.vodafonexdsl.co.uk.8333: tcp 0
08:59:52.291580 IP tom-Latitude-3570.46284 > static-87-75-105-186.vodafonexdsl.co.uk.8333: tcp 24
08:59:52.292834 IP tom-Latitude-3570.46284 > static-87-75-105-186.vodafonexdsl.co.uk.8333: tcp 37
08:59:52.296076 IP ns3113832.ip-54-38-177.eu.8333 > tom-Latitude-3570.56714: tcp 0
08:59:52.333670 IP static-87-75-105-186.vodafonexdsl.co.uk.8333 > tom-Latitude-3570.46284: tcp 0
08:59:52.353843 IP ns3113832.ip-54-38-177.eu.8333 > tom-Latitude-3570.56714: tcp 24
08:59:52.353847 IP tom-Latitude-3570.56714 > ns3113832.ip-54-38-177.eu.8333: tcp 0
08:59:52.354694 IP ns3113832.ip-54-38-177.eu.8333 > tom-Latitude-3570.56714: tcp 189
08:59:52.354701 IP tom-Latitude-3570.56714 > ns3113832.ip-54-38-177.eu.8333: tcp 0
08:59:52.354707 IP ns3113832.ip-54-38-177.eu.8333 > tom-Latitude-3570.56714: tcp 24
08:59:52.354708 IP tom-Latitude-3570.56714 > ns3113832.ip-54-38-177.eu.8333: tcp 0
08:59:52.354712 IP ns3113832.ip-54-38-177.eu.8333 > tom-Latitude-3570.56714: tcp 559
08:59:52.354715 IP tom-Latitude-3570.56714 > ns3113832.ip-54-38-177.eu.8333: tcp 0
08:59:52.354718 IP ns3113832.ip-54-38-177.eu.8333 > tom-Latitude-3570.56714: tcp 24
08:59:52.354720 IP tom-Latitude-3570.56714 > ns3113832.ip-54-38-177.eu.8333: tcp 0
08:59:52.354724 IP ns3113832.ip-54-38-177.eu.8333 > tom-Latitude-3570.56714: tcp 223
08:59:52.354726 IP tom-Latitude-3570.56714 > ns3113832.ip-54-38-177.eu.8333: tcp 0
08:59:52.408938 IP static-87-75-105-186.vodafonexdsl.co.uk.8333 > tom-Latitude-3570.46284: tcp 24
08:59:52.408959 IP static-87-75-105-186.vodafonexdsl.co.uk.8333 > tom-Latitude-3570.46284: tcp 404
08:59:52.409074 IP tom-Latitude-3570.46284 > static-87-75-105-186.vodafonexdsl.co.uk.8333: tcp 0
08:59:52.509970 IP tom-Latitude-3570.49070 > c-185-45-236-223.customer.ggaweb.ch.8333: tcp 24
08:59:52.513663 IP tom-Latitude-3570.49070 > c-185-45-236-223.customer.ggaweb.ch.8333: tcp 145
08:59:52.582899 IP c-185-45-236-223.customer.ggaweb.ch.8333 > tom-Latitude-3570.49070: tcp 0
08:59:52.582914 IP c-185-45-236-223.customer.ggaweb.ch.8333 > tom-Latitude-3570.49070: tcp 0
08:59:52.811118 IP tom-Latitude-3570.60988 > 81.198.101.144.8333: tcp 24
08:59:52.813358 IP tom-Latitude-3570.60988 > 81.198.101.144.8333: tcp 289
08:59:52.816685 IP bb42-60-217-183.singnet.com.sg.8333 > tom-Latitude-3570.60470: tcp 24
08:59:52.816706 IP bb42-60-217-183.singnet.com.sg.8333 > tom-Latitude-3570.60470: tcp 253
08:59:52.816796 IP tom-Latitude-3570.60470 > bb42-60-217-183.singnet.com.sg.8333: tcp 0
08:59:52.848290 IP 81.198.101.144.8333 > tom-Latitude-3570.60988: tcp 0
08:59:52.856614 IP 81.198.101.144.8333 > tom-Latitude-3570.60988: tcp 0
08:59:52.935704 IP 81.198.101.144.8333 > tom-Latitude-3570.60988: tcp 24
08:59:52.936960 IP 81.198.101.144.8333 > tom-Latitude-3570.60988: tcp 37
08:59:52.937088 IP tom-Latitude-3570.60988 > 81.198.101.144.8333: tcp 0
08:59:52.937224 IP tom-Latitude-3570.60988 > 81.198.101.144.8333: tcp 24
08:59:52.937364 IP tom-Latitude-3570.57976 > 167.99.216.145.8333: tcp 24
08:59:52.939292 IP tom-Latitude-3570.60988 > 81.198.101.144.8333: tcp 404
08:59:52.939891 IP tom-Latitude-3570.57976 > 167.99.216.145.8333: tcp 289
08:59:52.968592 IP 81.198.101.144.8333 > tom-Latitude-3570.60988: tcp 0
08:59:52.968606 IP 167.99.216.145.8333 > tom-Latitude-3570.57976: tcp 0
08:59:52.978714 IP 81.198.101.144.8333 > tom-Latitude-3570.60988: tcp 0
08:59:52.978728 IP 167.99.216.145.8333 > tom-Latitude-3570.57976: tcp 0
08:59:53.037791 IP tom-Latitude-3570.42516 > 2.56.9.15.8333: tcp 24
08:59:53.038763 IP tom-Latitude-3570.42516 > 2.56.9.15.8333: tcp 145
08:59:53.075767 IP 2.56.9.15.8333 > tom-Latitude-3570.42516: tcp 24
08:59:53.075798 IP 2.56.9.15.8333 > tom-Latitude-3570.42516: tcp 217
08:59:53.075802 IP 2.56.9.15.8333 > tom-Latitude-3570.42516: tcp 0
08:59:53.075876 IP tom-Latitude-3570.42516 > 2.56.9.15.8333: tcp 0
08:59:53.076099 IP tom-Latitude-3570.42516 > 2.56.9.15.8333: tcp 24
08:59:53.076112 IP tom-Latitude-3570.42516 > 2.56.9.15.8333: tcp 73
08:59:53.081815 IP 2.56.9.15.8333 > tom-Latitude-3570.42516: tcp 0
08:59:53.115739 IP 2.56.9.15.8333 > tom-Latitude-3570.42516: tcp 0
08:59:53.126142 IP 2.56.9.15.8333 > tom-Latitude-3570.42516: tcp 0
08:59:53.176534 IP tom-Latitude-3570.60470 > bb42-60-217-183.singnet.com.sg.8333: tcp 24
08:59:53.177476 IP tom-Latitude-3570.60470 > bb42-60-217-183.singnet.com.sg.8333: tcp 37
08:59:53.212747 IP bb42-60-217-183.singnet.com.sg.8333 > tom-Latitude-3570.60470: tcp 0
08:59:53.218004 IP bb42-60-217-183.singnet.com.sg.8333 > tom-Latitude-3570.60470: tcp 0
08:59:53.223137 IP 2.56.9.15.8333 > tom-Latitude-3570.42516: tcp 24
08:59:53.223156 IP 2.56.9.15.8333 > tom-Latitude-3570.42516: tcp 223
08:59:53.223161 IP 2.56.9.15.8333 > tom-Latitude-3570.42516: tcp 24
08:59:53.223249 IP tom-Latitude-3570.42516 > 2.56.9.15.8333: tcp 0
08:59:53.227867 IP 2.56.9.15.8333 > tom-Latitude-3570.42516: tcp 257
08:59:53.271904 IP tom-Latitude-3570.42516 > 2.56.9.15.8333: tcp 0
08:59:53.830319 IP tom-Latitude-3570.56714 > ns3113832.ip-54-38-177.eu.8333: tcp 24
08:59:53.920739 IP tom-Latitude-3570.56714 > ns3113832.ip-54-38-177.eu.8333: tcp 109
08:59:53.987255 IP ns3113832.ip-54-38-177.eu.8333 > tom-Latitude-3570.56714: tcp 0
08:59:53.987269 IP ns3113832.ip-54-38-177.eu.8333 > tom-Latitude-3570.56714: tcp 0
08:59:54.432333 IP tom-Latitude-3570.60470 > bb42-60-217-183.singnet.com.sg.8333: tcp 24
08:59:54.437269 IP tom-Latitude-3570.60470 > bb42-60-217-183.singnet.com.sg.8333: tcp 73
08:59:54.480591 IP bb42-60-217-183.singnet.com.sg.8333 > tom-Latitude-3570.60470: tcp 0
08:59:54.487887 IP bb42-60-217-183.singnet.com.sg.8333 > tom-Latitude-3570.60470: tcp 0
08:59:54.569312 IP vmi195435.contaboserver.net.8333 > tom-Latitude-3570.39110: tcp 24
08:59:54.569337 IP tom-Latitude-3570.39110 > vmi195435.contaboserver.net.8333: tcp 0
08:59:54.569370 IP vmi195435.contaboserver.net.8333 > tom-Latitude-3570.39110: tcp 397
08:59:54.569376 IP tom-Latitude-3570.39110 > vmi195435.contaboserver.net.8333: tcp 0
08:59:54.569676 IP tom-Latitude-3570.39110 > vmi195435.contaboserver.net.8333: tcp 24
08:59:54.571521 IP tom-Latitude-3570.39110 > vmi195435.contaboserver.net.8333: tcp 181
08:59:54.598033 IP vmi195435.contaboserver.net.8333 > tom-Latitude-3570.39110: tcp 0
08:59:54.598040 IP vmi195435.contaboserver.net.8333 > tom-Latitude-3570.39110: tcp 0
08:59:54.678025 IP vmi195435.contaboserver.net.8333 > tom-Latitude-3570.39110: tcp 24
08:59:54.678044 IP vmi195435.contaboserver.net.8333 > tom-Latitude-3570.39110: tcp 215
08:59:54.678047 IP vmi195435.contaboserver.net.8333 > tom-Latitude-3570.39110: tcp 24
08:59:54.678068 IP vmi195435.contaboserver.net.8333 > tom-Latitude-3570.39110: tcp 226
08:59:54.678070 IP vmi195435.contaboserver.net.8333 > tom-Latitude-3570.39110: tcp 24
08:59:54.678077 IP vmi195435.contaboserver.net.8333 > tom-Latitude-3570.39110: tcp 226
08:59:54.678083 IP vmi195435.contaboserver.net.8333 > tom-Latitude-3570.39110: tcp 24
08:59:54.678133 IP tom-Latitude-3570.39110 > vmi195435.contaboserver.net.8333: tcp 0
08:59:54.678232 IP vmi195435.contaboserver.net.8333 > tom-Latitude-3570.39110: tcp 223
08:59:54.678241 IP vmi195435.contaboserver.net.8333 > tom-Latitude-3570.39110: tcp 24
08:59:54.678244 IP vmi195435.contaboserver.net.8333 > tom-Latitude-3570.39110: tcp 225
08:59:54.678315 IP tom-Latitude-3570.39110 > vmi195435.contaboserver.net.8333: tcp 0
08:59:55.582592 IP tom-Latitude-3570.57976 > 167.99.216.145.8333: tcp 24
08:59:55.584934 IP tom-Latitude-3570.57976 > 167.99.216.145.8333: tcp 253
08:59:55.630621 IP 167.99.216.145.8333 > tom-Latitude-3570.57976: tcp 0
08:59:55.637840 IP 167.99.216.145.8333 > tom-Latitude-3570.57976: tcp 0
08:59:55.783307 IP tom-Latitude-3570.60988 > 81.198.101.144.8333: tcp 24
08:59:55.785946 IP tom-Latitude-3570.60988 > 81.198.101.144.8333: tcp 31
08:59:55.821106 IP 81.198.101.144.8333 > tom-Latitude-3570.60988: tcp 0
08:59:55.827658 IP 81.198.101.144.8333 > tom-Latitude-3570.60988: tcp 0
08:59:56.138906 IP ns3113832.ip-54-38-177.eu.8333 > tom-Latitude-3570.56714: tcp 24
08:59:56.138930 IP tom-Latitude-3570.56714 > ns3113832.ip-54-38-177.eu.8333: tcp 0
08:59:56.139660 IP ns3113832.ip-54-38-177.eu.8333 > tom-Latitude-3570.56714: tcp 253
08:59:56.139709 IP tom-Latitude-3570.56714 > ns3113832.ip-54-38-177.eu.8333: tcp 0
08:59:56.140005 IP tom-Latitude-3570.56714 > ns3113832.ip-54-38-177.eu.8333: tcp 24
08:59:56.141642 IP tom-Latitude-3570.56714 > ns3113832.ip-54-38-177.eu.8333: tcp 73
08:59:56.178317 IP ns3113832.ip-54-38-177.eu.8333 > tom-Latitude-3570.56714: tcp 0
08:59:56.178331 IP ns3113832.ip-54-38-177.eu.8333 > tom-Latitude-3570.56714: tcp 0
08:59:56.235766 IP ns3113832.ip-54-38-177.eu.8333 > tom-Latitude-3570.56714: tcp 24
08:59:56.235785 IP ns3113832.ip-54-38-177.eu.8333 > tom-Latitude-3570.56714: tcp 248
08:59:56.235788 IP ns3113832.ip-54-38-177.eu.8333 > tom-Latitude-3570.56714: tcp 24
08:59:56.235878 IP tom-Latitude-3570.56714 > ns3113832.ip-54-38-177.eu.8333: tcp 0
08:59:56.236308 IP ns3113832.ip-54-38-177.eu.8333 > tom-Latitude-3570.56714: tcp 518
08:59:56.279903 IP tom-Latitude-3570.56714 > ns3113832.ip-54-38-177.eu.8333: tcp 0
08:59:56.538002 IP tom-Latitude-3570.57976 > 167.99.216.145.8333: tcp 24
08:59:56.540097 IP tom-Latitude-3570.57976 > 167.99.216.145.8333: tcp 73
08:59:56.570051 IP 167.99.216.145.8333 > tom-Latitude-3570.57976: tcp 0
08:59:56.578055 IP 167.99.216.145.8333 > tom-Latitude-3570.57976: tcp 0
08:59:57.140053 IP tom-Latitude-3570.60988 > 81.198.101.144.8333: tcp 24
08:59:57.208929 IP tom-Latitude-3570.60988 > 81.198.101.144.8333: tcp 325
08:59:57.210383 IP vmi195435.contaboserver.net.8333 > tom-Latitude-3570.39110: tcp 24
08:59:57.210404 IP vmi195435.contaboserver.net.8333 > tom-Latitude-3570.39110: tcp 217
08:59:57.210430 IP vmi195435.contaboserver.net.8333 > tom-Latitude-3570.39110: tcp 217
08:59:57.210444 IP tom-Latitude-3570.39110 > vmi195435.contaboserver.net.8333: tcp 0
08:59:57.210716 IP tom-Latitude-3570.39110 > vmi195435.contaboserver.net.8333: tcp 24
08:59:57.210840 IP tom-Latitude-3570.46284 > static-87-75-105-186.vodafonexdsl.co.uk.8333: tcp 24
08:59:57.213443 IP tom-Latitude-3570.39110 > vmi195435.contaboserver.net.8333: tcp 145
08:59:57.214687 IP tom-Latitude-3570.46284 > static-87-75-105-186.vodafonexdsl.co.uk.8333: tcp 325
08:59:57.247708 IP 81.198.101.144.8333 > tom-Latitude-3570.60988: tcp 0
08:59:57.249096 IP 81.198.101.144.8333 > tom-Latitude-3570.60988: tcp 0
08:59:57.249110 IP vmi195435.contaboserver.net.8333 > tom-Latitude-3570.39110: tcp 0
08:59:57.249114 IP vmi195435.contaboserver.net.8333 > tom-Latitude-3570.39110: tcp 0
08:59:57.249116 IP static-87-75-105-186.vodafonexdsl.co.uk.8333 > tom-Latitude-3570.46284: tcp 0
08:59:57.311247 IP tom-Latitude-3570.49070 > c-185-45-236-223.customer.ggaweb.ch.8333: tcp 24
08:59:57.312252 IP tom-Latitude-3570.49070 > c-185-45-236-223.customer.ggaweb.ch.8333: tcp 325
08:59:57.326439 IP vmi195435.contaboserver.net.8333 > tom-Latitude-3570.39110: tcp 24
08:59:57.327248 IP vmi195435.contaboserver.net.8333 > tom-Latitude-3570.39110: tcp 223
08:59:57.327266 IP vmi195435.contaboserver.net.8333 > tom-Latitude-3570.39110: tcp 24
08:59:57.327269 IP vmi195435.contaboserver.net.8333 > tom-Latitude-3570.39110: tcp 282
08:59:57.327272 IP vmi195435.contaboserver.net.8333 > tom-Latitude-3570.39110: tcp 24
08:59:57.327274 IP vmi195435.contaboserver.net.8333 > tom-Latitude-3570.39110: tcp 246
08:59:57.327294 IP vmi195435.contaboserver.net.8333 > tom-Latitude-3570.39110: tcp 24
08:59:57.327357 IP tom-Latitude-3570.39110 > vmi195435.contaboserver.net.8333: tcp 0
08:59:57.327706 IP vmi195435.contaboserver.net.8333 > tom-Latitude-3570.39110: tcp 224
08:59:57.338741 IP c-185-45-236-223.customer.ggaweb.ch.8333 > tom-Latitude-3570.49070: tcp 0
08:59:57.346401 IP c-185-45-236-223.customer.ggaweb.ch.8333 > tom-Latitude-3570.49070: tcp 0
08:59:57.371906 IP tom-Latitude-3570.39110 > vmi195435.contaboserver.net.8333: tcp 0
08:59:57.729825 IP tom-Latitude-3570.56714 > ns3113832.ip-54-38-177.eu.8333: tcp 24
08:59:57.729967 IP tom-Latitude-3570.42516 > 2.56.9.15.8333: tcp 24
08:59:57.739731 IP tom-Latitude-3570.56714 > ns3113832.ip-54-38-177.eu.8333: tcp 145
08:59:57.740311 IP tom-Latitude-3570.42516 > 2.56.9.15.8333: tcp 397
08:59:57.784161 IP ns3113832.ip-54-38-177.eu.8333 > tom-Latitude-3570.56714: tcp 0
08:59:57.787349 IP 2.56.9.15.8333 > tom-Latitude-3570.42516: tcp 0
08:59:57.787932 IP ns3113832.ip-54-38-177.eu.8333 > tom-Latitude-3570.56714: tcp 0
08:59:57.787951 IP 2.56.9.15.8333 > tom-Latitude-3570.42516: tcp 0
08:59:57.930768 IP tom-Latitude-3570.46284 > static-87-75-105-186.vodafonexdsl.co.uk.8333: tcp 24
08:59:57.932887 IP tom-Latitude-3570.46284 > static-87-75-105-186.vodafonexdsl.co.uk.8333: tcp 145
08:59:57.938194 IP 167.99.216.145.8333 > tom-Latitude-3570.57976: tcp 24
08:59:57.946085 IP 167.99.216.145.8333 > tom-Latitude-3570.57976: tcp 253
08:59:57.946213 IP tom-Latitude-3570.57976 > 167.99.216.145.8333: tcp 0
08:59:57.946462 IP tom-Latitude-3570.57976 > 167.99.216.145.8333: tcp 24
08:59:57.948374 IP tom-Latitude-3570.57976 > 167.99.216.145.8333: tcp 109
08:59:57.959217 IP static-87-75-105-186.vodafonexdsl.co.uk.8333 > tom-Latitude-3570.46284: tcp 0
08:59:57.979738 IP 167.99.216.145.8333 > tom-Latitude-3570.57976: tcp 0
08:59:57.980346 IP 167.99.216.145.8333 > tom-Latitude-3570.57976: tcp 0
08:59:58.043051 IP 167.99.216.145.8333 > tom-Latitude-3570.57976: tcp 24
08:59:58.043072 IP 167.99.216.145.8333 > tom-Latitude-3570.57976: tcp 224
08:59:58.043076 IP 167.99.216.145.8333 > tom-Latitude-3570.57976: tcp 24
08:59:58.043079 IP 167.99.216.145.8333 > tom-Latitude-3570.57976: tcp 249
08:59:58.043081 IP 167.99.216.145.8333 > tom-Latitude-3570.57976: tcp 24
08:59:58.043104 IP 167.99.216.145.8333 > tom-Latitude-3570.57976: tcp 225
08:59:58.043169 IP tom-Latitude-3570.57976 > 167.99.216.145.8333: tcp 0
08:59:58.345557 IP tom-Latitude-3570.39110 > vmi195435.contaboserver.net.8333: tcp 24
08:59:58.347830 IP tom-Latitude-3570.39110 > vmi195435.contaboserver.net.8333: tcp 109
08:59:58.348351 IP static-87-75-105-186.vodafonexdsl.co.uk.8333 > tom-Latitude-3570.46284: tcp 24
08:59:58.348370 IP static-87-75-105-186.vodafonexdsl.co.uk.8333 > tom-Latitude-3570.46284: tcp 73
08:59:58.348486 IP tom-Latitude-3570.46284 > static-87-75-105-186.vodafonexdsl.co.uk.8333: tcp 0
08:59:58.348630 IP tom-Latitude-3570.46284 > static-87-75-105-186.vodafonexdsl.co.uk.8333: tcp 24
08:59:58.350663 IP tom-Latitude-3570.46284 > static-87-75-105-186.vodafonexdsl.co.uk.8333: tcp 37
08:59:58.375384 IP c-185-45-236-223.customer.ggaweb.ch.8333 > tom-Latitude-3570.49070: tcp 24
08:59:58.375404 IP c-185-45-236-223.customer.ggaweb.ch.8333 > tom-Latitude-3570.49070: tcp 289
08:59:58.375493 IP tom-Latitude-3570.49070 > c-185-45-236-223.customer.ggaweb.ch.8333: tcp 0
08:59:58.375705 IP tom-Latitude-3570.49070 > c-185-45-236-223.customer.ggaweb.ch.8333: tcp 24
08:59:58.377658 IP tom-Latitude-3570.49070 > c-185-45-236-223.customer.ggaweb.ch.8333: tcp 37
08:59:58.378231 IP vmi195435.contaboserver.net.8333 > tom-Latitude-3570.39110: tcp 0
08:59:58.381190 IP vmi195435.contaboserver.net.8333 > tom-Latitude-3570.39110: tcp 0
08:59:58.381204 IP static-87-75-105-186.vodafonexdsl.co.uk.8333 > tom-Latitude-3570.46284: tcp 0
08:59:58.401893 IP 81.198.101.144.8333 > tom-Latitude-3570.60988: tcp 24
08:59:58.401914 IP 81.198.101.144.8333 > tom-Latitude-3570.60988: tcp 217
