04:23:04.660351 IP vmi195435.contaboserver.net.8333 > tom-Latitude-3570.39110: tcp 24
04:23:04.660368 IP tom-Latitude-3570.39110 > vmi195435.contaboserver.net.8333: tcp 0
04:23:04.660387 IP vmi195435.contaboserver.net.8333 > tom-Latitude-3570.39110: tcp 109
04:23:04.660393 IP tom-Latitude-3570.39110 > vmi195435.contaboserver.net.8333: tcp 0
04:23:04.660398 IP vmi195435.contaboserver.net.8333 > tom-Latitude-3570.39110: tcp 109
04:23:04.660401 IP tom-Latitude-3570.39110 > vmi195435.contaboserver.net.8333: tcp 0
04:23:04.660599 IP tom-Latitude-3570.39110 > vmi195435.contaboserver.net.8333: tcp 24
04:23:04.664253 IP tom-Latitude-3570.39110 > vmi195435.contaboserver.net.8333: tcp 109
04:23:04.706797 IP vmi195435.contaboserver.net.8333 > tom-Latitude-3570.39110: tcp 0
04:23:04.794932 IP vmi195435.contaboserver.net.8333 > tom-Latitude-3570.39110: tcp 24
04:23:04.796028 IP vmi195435.contaboserver.net.8333 > tom-Latitude-3570.39110: tcp 372
04:23:04.796047 IP vmi195435.contaboserver.net.8333 > tom-Latitude-3570.39110: tcp 24
04:23:04.796051 IP vmi195435.contaboserver.net.8333 > tom-Latitude-3570.39110: tcp 225
04:23:04.796054 IP vmi195435.contaboserver.net.8333 > tom-Latitude-3570.39110: tcp 24
04:23:04.796063 IP vmi195435.contaboserver.net.8333 > tom-Latitude-3570.39110: tcp 1448
04:23:04.796067 IP vmi195435.contaboserver.net.8333 > tom-Latitude-3570.39110: tcp 1137
04:23:04.796129 IP tom-Latitude-3570.39110 > vmi195435.contaboserver.net.8333: tcp 0
04:23:04.902058 IP tom-Latitude-3570.60470 > bb42-60-217-183.singnet.com.sg.8333: tcp 24
04:23:04.904187 IP tom-Latitude-3570.60470 > bb42-60-217-183.singnet.com.sg.8333: tcp 181
04:23:04.947424 IP bb42-60-217-183.singnet.com.sg.8333 > tom-Latitude-3570.60470: tcp 0
04:23:05.303471 IP tom-Latitude-3570.42516 > 2.56.9.15.8333: tcp 24
04:23:05.305534 IP tom-Latitude-3570.42516 > 2.56.9.15.8333: tcp 109
04:23:05.359339 IP 2.56.9.15.8333 > tom-Latitude-3570.42516: tcp 0
04:23:05.364672 IP ns3113832.ip-54-38-177.eu.8333 > tom-Latitude-3570.56714: tcp 24
04:23:05.364694 IP ns3113832.ip-54-38-177.eu.8333 > tom-Latitude-3570.56714: tcp 181
04:23:05.364737 IP tom-Latitude-3570.56714 > ns3113832.ip-54-38-177.eu.8333: tcp 0
04:23:05.367219 IP 2.56.9.15.8333 > tom-Latitude-3570.42516: tcp 0
04:23:05.665950 IP tom-Latitude-3570.60988 > 81.198.101.144.8333: tcp 24
04:23:05.669083 IP tom-Latitude-3570.60988 > 81.198.101.144.8333: tcp 109
04:23:05.736792 IP 81.198.101.144.8333 > tom-Latitude-3570.60988: tcp 0
04:23:05.966984 IP tom-Latitude-3570.49070 > c-185-45-236-223.customer.ggaweb.ch.8333: tcp 24
04:23:05.969317 IP tom-Latitude-3570.49070 > c-185-45-236-223.customer.ggaweb.ch.8333: tcp 109
04:23:06.021777 IP c-185-45-236-223.customer.ggaweb.ch.8333 > tom-Latitude-3570.49070: tcp 0
04:23:06.024180 IP c-185-45-236-223.customer.ggaweb.ch.8333 > tom-Latitude-3570.49070: tcp 0
04:23:06.708130 IP 2.56.9.15.8333 > tom-Latitude-3570.42516: tcp 24
04:23:06.708151 IP 2.56.9.15.8333 > tom-Latitude-3570.42516: tcp 181
04:23:06.708184 IP 2.56.9.15.8333 > tom-Latitude-3570.42516: tcp 181
04:23:06.708190 IP tom-Latitude-3570.42516 > 2.56.9.15.8333: tcp 0
04:23:06.708443 IP tom-Latitude-3570.42516 > 2.56.9.15.8333: tcp 24
04:23:06.710560 IP tom-Latitude-3570.42516 > 2.56.9.15.8333: tcp 181
04:23:06.746412 IP 2.56.9.15.8333 > tom-Latitude-3570.42516: tcp 0
04:23:06.747089 IP 2.56.9.15.8333 > tom-Latitude-3570.42516: tcp 0
04:23:06.843410 IP 2.56.9.15.8333 > tom-Latitude-3570.42516: tcp 24
04:23:06.844357 IP 2.56.9.15.8333 > tom-Latitude-3570.42516: tcp 224
04:23:06.844380 IP 2.56.9.15.8333 > tom-Latitude-3570.42516: tcp 24
04:23:06.844384 IP 2.56.9.15.8333 > tom-Latitude-3570.42516: tcp 224
04:23:06.844388 IP 2.56.9.15.8333 > tom-Latitude-3570.42516: tcp 24
04:23:06.844409 IP 2.56.9.15.8333 > tom-Latitude-3570.42516: tcp 257
04:23:06.844412 IP 2.56.9.15.8333 > tom-Latitude-3570.42516: tcp 24
04:23:06.844416 IP 2.56.9.15.8333 > tom-Latitude-3570.42516: tcp 226
04:23:06.844420 IP 2.56.9.15.8333 > tom-Latitude-3570.42516: tcp 24
04:23:06.844424 IP 2.56.9.15.8333 > tom-Latitude-3570.42516: tcp 189
04:23:06.844461 IP tom-Latitude-3570.42516 > 2.56.9.15.8333: tcp 0
04:23:06.901485 IP 167.99.216.145.8333 > tom-Latitude-3570.57976: tcp 24
04:23:06.902070 IP 167.99.216.145.8333 > tom-Latitude-3570.57976: tcp 289
04:23:06.902132 IP tom-Latitude-3570.57976 > 167.99.216.145.8333: tcp 0
04:23:06.902371 IP tom-Latitude-3570.57976 > 167.99.216.145.8333: tcp 24
04:23:06.903987 IP tom-Latitude-3570.57976 > 167.99.216.145.8333: tcp 37
04:23:06.936529 IP 167.99.216.145.8333 > tom-Latitude-3570.57976: tcp 0
04:23:06.936543 IP 167.99.216.145.8333 > tom-Latitude-3570.57976: tcp 0
04:23:06.999094 IP 167.99.216.145.8333 > tom-Latitude-3570.57976: tcp 24
04:23:06.999723 IP 167.99.216.145.8333 > tom-Latitude-3570.57976: tcp 247
04:23:06.999786 IP tom-Latitude-3570.57976 > 167.99.216.145.8333: tcp 0
04:23:06.999963 IP tom-Latitude-3570.39110 > vmi195435.contaboserver.net.8333: tcp 24
04:23:07.002544 IP tom-Latitude-3570.39110 > vmi195435.contaboserver.net.8333: tcp 181
04:23:07.036319 IP vmi195435.contaboserver.net.8333 > tom-Latitude-3570.39110: tcp 0
04:23:07.100513 IP tom-Latitude-3570.57976 > 167.99.216.145.8333: tcp 24
04:23:07.104503 IP tom-Latitude-3570.57976 > 167.99.216.145.8333: tcp 37
04:23:07.138317 IP 167.99.216.145.8333 > tom-Latitude-3570.57976: tcp 0
04:23:07.146305 IP 167.99.216.145.8333 > tom-Latitude-3570.57976: tcp 0
04:23:07.527487 IP vmi195435.contaboserver.net.8333 > tom-Latitude-3570.39110: tcp 24
04:23:07.527509 IP vmi195435.contaboserver.net.8333 > tom-Latitude-3570.39110: tcp 145
04:23:07.527548 IP tom-Latitude-3570.39110 > vmi195435.contaboserver.net.8333: tcp 0
04:23:07.527787 IP tom-Latitude-3570.39110 > vmi195435.contaboserver.net.8333: tcp 24
04:23:07.529026 IP tom-Latitude-3570.39110 > vmi195435.contaboserver.net.8333: tcp 109
04:23:07.565474 IP vmi195435.contaboserver.net.8333 > tom-Latitude-3570.39110: tcp 0
04:23:07.644588 IP vmi195435.contaboserver.net.8333 > tom-Latitude-3570.39110: tcp 24
04:23:07.645478 IP vmi195435.contaboserver.net.8333 > tom-Latitude-3570.39110: tcp 373
04:23:07.645502 IP vmi195435.contaboserver.net.8333 > tom-Latitude-3570.39110: tcp 24
04:23:07.645506 IP vmi195435.contaboserver.net.8333 > tom-Latitude-3570.39110: tcp 224
04:23:07.645510 IP vmi195435.contaboserver.net.8333 > tom-Latitude-3570.39110: tcp 24
04:23:07.645513 IP vmi195435.contaboserver.net.8333 > tom-Latitude-3570.39110: tcp 613
04:23:07.645573 IP tom-Latitude-3570.39110 > vmi195435.contaboserver.net.8333: tcp 0
04:23:07.738510 IP static-87-75-105-186.vodafonexdsl.co.uk.8333 > tom-Latitude-3570.46284: tcp 24
04:23:07.747354 IP static-87-75-105-186.vodafonexdsl.co.uk.8333 > tom-Latitude-3570.46284: tcp 361
04:23:07.747461 IP tom-Latitude-3570.46284 > static-87-75-105-186.vodafonexdsl.co.uk.8333: tcp 0
04:23:07.747606 IP tom-Latitude-3570.46284 > static-87-75-105-186.vodafonexdsl.co.uk.8333: tcp 24
04:23:07.748916 IP tom-Latitude-3570.46284 > static-87-75-105-186.vodafonexdsl.co.uk.8333: tcp 469
04:23:07.792479 IP static-87-75-105-186.vodafonexdsl.co.uk.8333 > tom-Latitude-3570.46284: tcp 0
04:23:07.848167 IP tom-Latitude-3570.42516 > 2.56.9.15.8333: tcp 24
04:23:07.849103 IP tom-Latitude-3570.42516 > 2.56.9.15.8333: tcp 145
04:23:07.851916 IP static-87-75-105-186.vodafonexdsl.co.uk.8333 > tom-Latitude-3570.46284: tcp 24
04:23:07.852538 IP static-87-75-105-186.vodafonexdsl.co.uk.8333 > tom-Latitude-3570.46284: tcp 73
04:23:07.852602 IP tom-Latitude-3570.46284 > static-87-75-105-186.vodafonexdsl.co.uk.8333: tcp 0
04:23:07.852748 IP tom-Latitude-3570.46284 > static-87-75-105-186.vodafonexdsl.co.uk.8333: tcp 24
04:23:07.854128 IP tom-Latitude-3570.46284 > static-87-75-105-186.vodafonexdsl.co.uk.8333: tcp 621
04:23:07.886549 IP 2.56.9.15.8333 > tom-Latitude-3570.42516: tcp 0
04:23:07.887162 IP 2.56.9.15.8333 > tom-Latitude-3570.42516: tcp 0
04:23:07.887175 IP static-87-75-105-186.vodafonexdsl.co.uk.8333 > tom-Latitude-3570.46284: tcp 0
04:23:08.053606 IP tom-Latitude-3570.49070 > c-185-45-236-223.customer.ggaweb.ch.8333: tcp 24
04:23:08.055720 IP tom-Latitude-3570.49070 > c-185-45-236-223.customer.ggaweb.ch.8333: tcp 325
04:23:08.089071 IP c-185-45-236-223.customer.ggaweb.ch.8333 > tom-Latitude-3570.49070: tcp 0
04:23:08.099695 IP c-185-45-236-223.customer.ggaweb.ch.8333 > tom-Latitude-3570.49070: tcp 0
04:23:08.154118 IP tom-Latitude-3570.56714 > ns3113832.ip-54-38-177.eu.8333: tcp 24
04:23:08.155454 IP tom-Latitude-3570.56714 > ns3113832.ip-54-38-177.eu.8333: tcp 325
04:23:08.188306 IP ns3113832.ip-54-38-177.eu.8333 > tom-Latitude-3570.56714: tcp 0
04:23:08.196307 IP ns3113832.ip-54-38-177.eu.8333 > tom-Latitude-3570.56714: tcp 0
04:23:09.165618 IP 81.198.101.144.8333 > tom-Latitude-3570.60988: tcp 24
04:23:09.165640 IP 81.198.101.144.8333 > tom-Latitude-3570.60988: tcp 325
04:23:09.165646 IP 81.198.101.144.8333 > tom-Latitude-3570.60988: tcp 325
04:23:09.165657 IP tom-Latitude-3570.60988 > 81.198.101.144.8333: tcp 0
04:23:09.182977 IP vmi195435.contaboserver.net.8333 > tom-Latitude-3570.39110: tcp 24
04:23:09.183782 IP vmi195435.contaboserver.net.8333 > tom-Latitude-3570.39110: tcp 37
04:23:09.183840 IP tom-Latitude-3570.39110 > vmi195435.contaboserver.net.8333: tcp 0
04:23:09.184023 IP tom-Latitude-3570.39110 > vmi195435.contaboserver.net.8333: tcp 24
04:23:09.186098 IP tom-Latitude-3570.39110 > vmi195435.contaboserver.net.8333: tcp 37
04:23:09.226101 IP vmi195435.contaboserver.net.8333 > tom-Latitude-3570.39110: tcp 0
04:23:09.305204 IP vmi195435.contaboserver.net.8333 > tom-Latitude-3570.39110: tcp 24
04:23:09.305885 IP vmi195435.contaboserver.net.8333 > tom-Latitude-3570.39110: tcp 191
04:23:09.305944 IP tom-Latitude-3570.39110 > vmi195435.contaboserver.net.8333: tcp 0
04:23:09.406664 IP tom-Latitude-3570.49070 > c-185-45-236-223.customer.ggaweb.ch.8333: tcp 24
04:23:09.407927 IP tom-Latitude-3570.49070 > c-185-45-236-223.customer.ggaweb.ch.8333: tcp 37
04:23:09.437034 IP c-185-45-236-223.customer.ggaweb.ch.8333 > tom-Latitude-3570.49070: tcp 0
04:23:09.446053 IP c-185-45-236-223.customer.ggaweb.ch.8333 > tom-Latitude-3570.49070: tcp 0
04:23:09.507150 IP tom-Latitude-3570.56714 > ns3113832.ip-54-38-177.eu.8333: tcp 24
04:23:09.508087 IP tom-Latitude-3570.56714 > ns3113832.ip-54-38-177.eu.8333: tcp 37
04:23:09.538076 IP ns3113832.ip-54-38-177.eu.8333 > tom-Latitude-3570.56714: tcp 0
04:23:09.547064 IP ns3113832.ip-54-38-177.eu.8333 > tom-Latitude-3570.56714: tcp 0
04:23:09.607606 IP tom-Latitude-3570.60988 > 81.198.101.144.8333: tcp 24
04:23:09.608545 IP tom-Latitude-3570.60988 > 81.198.101.144.8333: tcp 37
04:23:09.662377 IP 81.198.101.144.8333 > tom-Latitude-3570.60988: tcp 0
04:23:09.984938 IP static-87-75-105-186.vodafonexdsl.co.uk.8333 > tom-Latitude-3570.46284: tcp 24
04:23:09.984954 IP static-87-75-105-186.vodafonexdsl.co.uk.8333 > tom-Latitude-3570.46284: tcp 109
04:23:09.984958 IP 81.198.101.144.8333 > tom-Latitude-3570.60988: tcp 24
04:23:09.984969 IP tom-Latitude-3570.60988 > 81.198.101.144.8333: tcp 0
04:23:09.984980 IP tom-Latitude-3570.46284 > static-87-75-105-186.vodafonexdsl.co.uk.8333: tcp 0
04:23:09.984984 IP 81.198.101.144.8333 > tom-Latitude-3570.60988: tcp 73
04:23:09.984987 IP tom-Latitude-3570.60988 > 81.198.101.144.8333: tcp 0
04:23:09.985106 IP tom-Latitude-3570.60988 > 81.198.101.144.8333: tcp 24
04:23:09.989469 IP tom-Latitude-3570.60988 > 81.198.101.144.8333: tcp 73
04:23:10.004626 IP static-87-75-105-186.vodafonexdsl.co.uk.8333 > tom-Latitude-3570.46284: tcp 109
04:23:10.004631 IP tom-Latitude-3570.46284 > static-87-75-105-186.vodafonexdsl.co.uk.8333: tcp 0
04:23:10.025722 IP 81.198.101.144.8333 > tom-Latitude-3570.60988: tcp 0
04:23:10.085606 IP tom-Latitude-3570.57976 > 167.99.216.145.8333: tcp 24
04:23:10.087504 IP tom-Latitude-3570.57976 > 167.99.216.145.8333: tcp 145
04:23:10.123877 IP 81.198.101.144.8333 > tom-Latitude-3570.60988: tcp 24
04:23:10.124428 IP 81.198.101.144.8333 > tom-Latitude-3570.60988: tcp 224
04:23:10.124447 IP 81.198.101.144.8333 > tom-Latitude-3570.60988: tcp 24
04:23:10.124491 IP tom-Latitude-3570.60988 > 81.198.101.144.8333: tcp 0
04:23:10.127463 IP 81.198.101.144.8333 > tom-Latitude-3570.60988: tcp 340
04:23:10.128162 IP 167.99.216.145.8333 > tom-Latitude-3570.57976: tcp 0
04:23:10.128174 IP 167.99.216.145.8333 > tom-Latitude-3570.57976: tcp 0
04:23:10.167901 IP tom-Latitude-3570.60988 > 81.198.101.144.8333: tcp 0
04:23:10.430859 IP tom-Latitude-3570.42516 > 2.56.9.15.8333: tcp 24
04:23:10.432909 IP tom-Latitude-3570.42516 > 2.56.9.15.8333: tcp 109
04:23:10.467226 IP 2.56.9.15.8333 > tom-Latitude-3570.42516: tcp 0
04:23:10.475932 IP 2.56.9.15.8333 > tom-Latitude-3570.42516: tcp 0
04:23:10.804562 IP c-185-45-236-223.customer.ggaweb.ch.8333 > tom-Latitude-3570.49070: tcp 24
04:23:10.804585 IP c-185-45-236-223.customer.ggaweb.ch.8333 > tom-Latitude-3570.49070: tcp 145
04:23:10.804626 IP tom-Latitude-3570.49070 > c-185-45-236-223.customer.ggaweb.ch.8333: tcp 0
04:23:10.804844 IP tom-Latitude-3570.49070 > c-185-45-236-223.customer.ggaweb.ch.8333: tcp 24
04:23:10.804989 IP tom-Latitude-3570.60470 > bb42-60-217-183.singnet.com.sg.8333: tcp 24
04:23:10.806575 IP tom-Latitude-3570.49070 > c-185-45-236-223.customer.ggaweb.ch.8333: tcp 73
04:23:10.809023 IP tom-Latitude-3570.60470 > bb42-60-217-183.singnet.com.sg.8333: tcp 433
04:23:10.846912 IP c-185-45-236-223.customer.ggaweb.ch.8333 > tom-Latitude-3570.49070: tcp 0
04:23:10.847342 IP bb42-60-217-183.singnet.com.sg.8333 > tom-Latitude-3570.60470: tcp 0
04:23:10.847349 IP c-185-45-236-223.customer.ggaweb.ch.8333 > tom-Latitude-3570.49070: tcp 0
04:23:10.943999 IP c-185-45-236-223.customer.ggaweb.ch.8333 > tom-Latitude-3570.49070: tcp 24
04:23:10.944022 IP c-185-45-236-223.customer.ggaweb.ch.8333 > tom-Latitude-3570.49070: tcp 1448
04:23:10.944027 IP c-185-45-236-223.customer.ggaweb.ch.8333 > tom-Latitude-3570.49070: tcp 20
04:23:10.944065 IP tom-Latitude-3570.49070 > c-185-45-236-223.customer.ggaweb.ch.8333: tcp 0
04:23:11.046238 IP tom-Latitude-3570.39110 > vmi195435.contaboserver.net.8333: tcp 24
04:23:11.046294 IP tom-Latitude-3570.60470 > bb42-60-217-183.singnet.com.sg.8333: tcp 24
04:23:11.047177 IP tom-Latitude-3570.39110 > vmi195435.contaboserver.net.8333: tcp 145
04:23:11.047822 IP tom-Latitude-3570.60470 > bb42-60-217-183.singnet.com.sg.8333: tcp 73
04:23:11.084744 IP vmi195435.contaboserver.net.8333 > tom-Latitude-3570.39110: tcp 0
04:23:11.085495 IP bb42-60-217-183.singnet.com.sg.8333 > tom-Latitude-3570.60470: tcp 0
04:23:11.146660 IP tom-Latitude-3570.56714 > ns3113832.ip-54-38-177.eu.8333: tcp 24
04:23:11.147616 IP tom-Latitude-3570.56714 > ns3113832.ip-54-38-177.eu.8333: tcp 145
04:23:11.177789 IP ns3113832.ip-54-38-177.eu.8333 > tom-Latitude-3570.56714: tcp 0
04:23:11.185777 IP ns3113832.ip-54-38-177.eu.8333 > tom-Latitude-3570.56714: tcp 0
04:23:11.848921 IP tom-Latitude-3570.46284 > static-87-75-105-186.vodafonexdsl.co.uk.8333: tcp 24
04:23:11.851149 IP tom-Latitude-3570.46284 > static-87-75-105-186.vodafonexdsl.co.uk.8333: tcp 73
04:23:11.904206 IP static-87-75-105-186.vodafonexdsl.co.uk.8333 > tom-Latitude-3570.46284: tcp 0
04:23:12.049617 IP tom-Latitude-3570.42516 > 2.56.9.15.8333: tcp 24
04:23:12.051791 IP tom-Latitude-3570.42516 > 2.56.9.15.8333: tcp 73
04:23:12.075972 IP 2.56.9.15.8333 > tom-Latitude-3570.42516: tcp 0
04:23:12.083967 IP 2.56.9.15.8333 > tom-Latitude-3570.42516: tcp 0
04:23:12.647077 IP 2.56.9.15.8333 > tom-Latitude-3570.42516: tcp 24
04:23:12.647098 IP 2.56.9.15.8333 > tom-Latitude-3570.42516: tcp 253
04:23:12.647190 IP tom-Latitude-3570.42516 > 2.56.9.15.8333: tcp 0
04:23:12.647439 IP tom-Latitude-3570.42516 > 2.56.9.15.8333: tcp 24
04:23:12.649465 IP tom-Latitude-3570.42516 > 2.56.9.15.8333: tcp 253
04:23:12.684395 IP 2.56.9.15.8333 > tom-Latitude-3570.42516: tcp 0
04:23:12.684409 IP 2.56.9.15.8333 > tom-Latitude-3570.42516: tcp 0
04:23:12.780324 IP 2.56.9.15.8333 > tom-Latitude-3570.42516: tcp 24
04:23:12.780998 IP 2.56.9.15.8333 > tom-Latitude-3570.42516: tcp 257
04:23:12.781020 IP 2.56.9.15.8333 > tom-Latitude-3570.42516: tcp 24
04:23:12.781023 IP 2.56.9.15.8333 > tom-Latitude-3570.42516: tcp 215
04:23:12.781026 IP 2.56.9.15.8333 > tom-Latitude-3570.42516: tcp 24
04:23:12.781028 IP 2.56.9.15.8333 > tom-Latitude-3570.42516: tcp 419
04:23:12.781030 IP 2.56.9.15.8333 > tom-Latitude-3570.42516: tcp 24
04:23:12.781120 IP tom-Latitude-3570.42516 > 2.56.9.15.8333: tcp 0
04:23:12.781769 IP 2.56.9.15.8333 > tom-Latitude-3570.42516: tcp 470
04:23:12.781785 IP 2.56.9.15.8333 > tom-Latitude-3570.42516: tcp 24
04:23:12.781789 IP 2.56.9.15.8333 > tom-Latitude-3570.42516: tcp 887
04:23:12.781864 IP tom-Latitude-3570.42516 > 2.56.9.15.8333: tcp 0
04:23:12.875854 IP 2.56.9.15.8333 > tom-Latitude-3570.42516: tcp 644
04:23:12.919900 IP tom-Latitude-3570.42516 > 2.56.9.15.8333: tcp 0
04:23:13.679320 IP tom-Latitude-3570.60470 > bb42-60-217-183.singnet.com.sg.8333: tcp 24
04:23:13.681638 IP tom-Latitude-3570.60470 > bb42-60-217-183.singnet.com.sg.8333: tcp 253
04:23:13.733931 IP bb42-60-217-183.singnet.com.sg.8333 > tom-Latitude-3570.60470: tcp 0
04:23:13.980400 IP tom-Latitude-3570.56714 > ns3113832.ip-54-38-177.eu.8333: tcp 24
04:23:13.980479 IP tom-Latitude-3570.57976 > 167.99.216.145.8333: tcp 24
04:23:13.984591 IP tom-Latitude-3570.56714 > ns3113832.ip-54-38-177.eu.8333: tcp 253
04:23:13.985137 IP static-87-75-105-186.vodafonexdsl.co.uk.8333 > tom-Latitude-3570.46284: tcp 24
04:23:13.985161 IP tom-Latitude-3570.46284 > static-87-75-105-186.vodafonexdsl.co.uk.8333: tcp 0
04:23:13.985192 IP static-87-75-105-186.vodafonexdsl.co.uk.8333 > tom-Latitude-3570.46284: tcp 325
04:23:13.985196 IP tom-Latitude-3570.46284 > static-87-75-105-186.vodafonexdsl.co.uk.8333: tcp 0
04:23:13.985445 IP tom-Latitude-3570.46284 > static-87-75-105-186.vodafonexdsl.co.uk.8333: tcp 24
04:23:13.985874 IP tom-Latitude-3570.57976 > 167.99.216.145.8333: tcp 397
04:23:13.988848 IP tom-Latitude-3570.46284 > static-87-75-105-186.vodafonexdsl.co.uk.8333: tcp 73
04:23:14.023835 IP 167.99.216.145.8333 > tom-Latitude-3570.57976: tcp 0
04:23:14.024402 IP ns3113832.ip-54-38-177.eu.8333 > tom-Latitude-3570.56714: tcp 0
04:23:14.024417 IP ns3113832.ip-54-38-177.eu.8333 > tom-Latitude-3570.56714: tcp 0
04:23:14.024419 IP 167.99.216.145.8333 > tom-Latitude-3570.57976: tcp 0
04:23:14.024423 IP static-87-75-105-186.vodafonexdsl.co.uk.8333 > tom-Latitude-3570.46284: tcp 0
04:23:14.094236 IP static-87-75-105-186.vodafonexdsl.co.uk.8333 > tom-Latitude-3570.46284: tcp 24
04:23:14.094257 IP static-87-75-105-186.vodafonexdsl.co.uk.8333 > tom-Latitude-3570.46284: tcp 386
04:23:14.094261 IP static-87-75-105-186.vodafonexdsl.co.uk.8333 > tom-Latitude-3570.46284: tcp 24
04:23:14.094264 IP static-87-75-105-186.vodafonexdsl.co.uk.8333 > tom-Latitude-3570.46284: tcp 218
04:23:14.094354 IP tom-Latitude-3570.46284 > static-87-75-105-186.vodafonexdsl.co.uk.8333: tcp 0
04:23:14.295391 IP tom-Latitude-3570.56714 > ns3113832.ip-54-38-177.eu.8333: tcp 24
04:23:14.297427 IP tom-Latitude-3570.56714 > ns3113832.ip-54-38-177.eu.8333: tcp 73
04:23:14.325786 IP ns3113832.ip-54-38-177.eu.8333 > tom-Latitude-3570.56714: tcp 0
04:23:14.335053 IP ns3113832.ip-54-38-177.eu.8333 > tom-Latitude-3570.56714: tcp 0
04:23:14.395817 IP tom-Latitude-3570.60470 > bb42-60-217-183.singnet.com.sg.8333: tcp 24
04:23:14.397530 IP tom-Latitude-3570.60470 > bb42-60-217-183.singnet.com.sg.8333: tcp 73
04:23:14.433771 IP bb42-60-217-183.singnet.com.sg.8333 > tom-Latitude-3570.60470: tcp 0
04:23:14.897479 IP tom-Latitude-3570.57976 > 167.99.216.145.8333: tcp 24
04:23:14.898243 IP tom-Latitude-3570.57976 > 167.99.216.145.8333: tcp 73
04:23:14.898976 IP 167.99.216.145.8333 > tom-Latitude-3570.57976: tcp 24
04:23:14.898998 IP 167.99.216.145.8333 > tom-Latitude-3570.57976: tcp 181
04:23:14.899002 IP 167.99.216.145.8333 > tom-Latitude-3570.57976: tcp 181
04:23:14.899030 IP tom-Latitude-3570.57976 > 167.99.216.145.8333: tcp 0
04:23:14.899262 IP tom-Latitude-3570.57976 > 167.99.216.145.8333: tcp 133
04:23:14.935971 IP 167.99.216.145.8333 > tom-Latitude-3570.57976: tcp 0
04:23:14.936519 IP 167.99.216.145.8333 > tom-Latitude-3570.57976: tcp 0
04:23:14.936540 IP 167.99.216.145.8333 > tom-Latitude-3570.57976: tcp 0
04:23:15.004586 IP 167.99.216.145.8333 > tom-Latitude-3570.57976: tcp 24
04:23:15.004605 IP 167.99.216.145.8333 > tom-Latitude-3570.57976: tcp 225
04:23:15.004609 IP 167.99.216.145.8333 > tom-Latitude-3570.57976: tcp 24
04:23:15.004612 IP 167.99.216.145.8333 > tom-Latitude-3570.57976: tcp 226
04:23:15.004614 IP 167.99.216.145.8333 > tom-Latitude-3570.57976: tcp 24
04:23:15.004640 IP 167.99.216.145.8333 > tom-Latitude-3570.57976: tcp 1079
04:23:15.004702 IP tom-Latitude-3570.57976 > 167.99.216.145.8333: tcp 0
04:23:15.407859 IP tom-Latitude-3570.56714 > ns3113832.ip-54-38-177.eu.8333: tcp 24
04:23:15.410054 IP tom-Latitude-3570.56714 > ns3113832.ip-54-38-177.eu.8333: tcp 109
04:23:15.454770 IP 167.99.216.145.8333 > tom-Latitude-3570.57976: tcp 24
04:23:15.454789 IP 167.99.216.145.8333 > tom-Latitude-3570.57976: tcp 37
04:23:15.454879 IP tom-Latitude-3570.57976 > 167.99.216.145.8333: tcp 0
04:23:15.454977 IP tom-Latitude-3570.57976 > 167.99.216.145.8333: tcp 24
04:23:15.456470 IP tom-Latitude-3570.57976 > 167.99.216.145.8333: tcp 37
04:23:15.457860 IP ns3113832.ip-54-38-177.eu.8333 > tom-Latitude-3570.56714: tcp 0
04:23:15.463976 IP ns3113832.ip-54-38-177.eu.8333 > tom-Latitude-3570.56714: tcp 0
04:23:15.485616 IP 167.99.216.145.8333 > tom-Latitude-3570.57976: tcp 0
04:23:15.486597 IP 167.99.216.145.8333 > tom-Latitude-3570.57976: tcp 0
04:23:15.956695 IP tom-Latitude-3570.46284 > static-87-75-105-186.vodafonexdsl.co.uk.8333: tcp 24
04:23:15.958750 IP tom-Latitude-3570.46284 > static-87-75-105-186.vodafonexdsl.co.uk.8333: tcp 109
04:23:16.059904 IP tom-Latitude-3570.46284 > static-87-75-105-186.vodafonexdsl.co.uk.8333: tcp 109
04:23:16.062998 IP 2.56.9.15.8333 > tom-Latitude-3570.42516: tcp 24
04:23:16.063022 IP tom-Latitude-3570.42516 > 2.56.9.15.8333: tcp 0
04:23:16.063054 IP 2.56.9.15.8333 > tom-Latitude-3570.42516: tcp 289
04:23:16.063073 IP tom-Latitude-3570.42516 > 2.56.9.15.8333: tcp 0
04:23:16.063077 IP static-87-75-105-186.vodafonexdsl.co.uk.8333 > tom-Latitude-3570.46284: tcp 0
04:23:16.063305 IP tom-Latitude-3570.42516 > 2.56.9.15.8333: tcp 24
04:23:16.065127 IP tom-Latitude-3570.42516 > 2.56.9.15.8333: tcp 109
04:23:16.105748 IP 2.56.9.15.8333 > tom-Latitude-3570.42516: tcp 0
04:23:16.106265 IP static-87-75-105-186.vodafonexdsl.co.uk.8333 > tom-Latitude-3570.46284: tcp 0
04:23:16.106271 IP 2.56.9.15.8333 > tom-Latitude-3570.42516: tcp 0
04:23:16.200978 IP static-87-75-105-186.vodafonexdsl.co.uk.8333 > tom-Latitude-3570.46284: tcp 24
04:23:16.201678 IP static-87-75-105-186.vodafonexdsl.co.uk.8333 > tom-Latitude-3570.46284: tcp 8
04:23:16.201694 IP 2.56.9.15.8333 > tom-Latitude-3570.42516: tcp 24
04:23:16.201700 IP 2.56.9.15.8333 > tom-Latitude-3570.42516: tcp 223
04:23:16.201702 IP 2.56.9.15.8333 > tom-Latitude-3570.42516: tcp 24
04:23:16.201705 IP 2.56.9.15.8333 > tom-Latitude-3570.42516: tcp 225
04:23:16.201725 IP 2.56.9.15.8333 > tom-Latitude-3570.42516: tcp 24
04:23:16.201732 IP 2.56.9.15.8333 > tom-Latitude-3570.42516: tcp 191
04:23:16.201796 IP tom-Latitude-3570.42516 > 2.56.9.15.8333: tcp 0
04:23:16.201830 IP tom-Latitude-3570.46284 > static-87-75-105-186.vodafonexdsl.co.uk.8333: tcp 0
04:23:16.202192 IP tom-Latitude-3570.46284 > static-87-75-105-186.vodafonexdsl.co.uk.8333: tcp 24
04:23:16.204514 IP tom-Latitude-3570.46284 > static-87-75-105-186.vodafonexdsl.co.uk.8333: tcp 8
04:23:16.235976 IP static-87-75-105-186.vodafonexdsl.co.uk.8333 > tom-Latitude-3570.46284: tcp 0
04:23:16.236024 IP static-87-75-105-186.vodafonexdsl.co.uk.8333 > tom-Latitude-3570.46284: tcp 0
04:23:16.303309 IP tom-Latitude-3570.39110 > vmi195435.contaboserver.net.8333: tcp 24
04:23:16.304084 IP tom-Latitude-3570.39110 > vmi195435.contaboserver.net.8333: tcp 541
04:23:16.343800 IP vmi195435.contaboserver.net.8333 > tom-Latitude-3570.39110: tcp 0
04:23:16.403713 IP tom-Latitude-3570.56714 > ns3113832.ip-54-38-177.eu.8333: tcp 24
04:23:16.403761 IP tom-Latitude-3570.57976 > 167.99.216.145.8333: tcp 24
04:23:16.404882 IP tom-Latitude-3570.56714 > ns3113832.ip-54-38-177.eu.8333: tcp 109
04:23:16.405512 IP tom-Latitude-3570.57976 > 167.99.216.145.8333: tcp 109
04:23:16.437495 IP ns3113832.ip-54-38-177.eu.8333 > tom-Latitude-3570.56714: tcp 0
04:23:16.444636 IP ns3113832.ip-54-38-177.eu.8333 > tom-Latitude-3570.56714: tcp 0
04:23:16.445296 IP 167.99.216.145.8333 > tom-Latitude-3570.57976: tcp 0
04:23:16.445310 IP 167.99.216.145.8333 > tom-Latitude-3570.57976: tcp 0
04:23:16.504181 IP tom-Latitude-3570.60988 > 81.198.101.144.8333: tcp 24
04:23:16.505116 IP tom-Latitude-3570.60988 > 81.198.101.144.8333: tcp 613
04:23:16.541520 IP static-87-75-105-186.vodafonexdsl.co.uk.8333 > tom-Latitude-3570.46284: tcp 24
04:23:16.544546 IP 81.198.101.144.8333 > tom-Latitude-3570.60988: tcp 0
04:23:16.548363 IP static-87-75-105-186.vodafonexdsl.co.uk.8333 > tom-Latitude-3570.46284: tcp 109
04:23:16.548494 IP tom-Latitude-3570.46284 > static-87-75-105-186.vodafonexdsl.co.uk.8333: tcp 0
04:23:16.849715 IP tom-Latitude-3570.49070 > c-185-45-236-223.customer.ggaweb.ch.8333: tcp 24
04:23:16.852251 IP tom-Latitude-3570.49070 > c-185-45-236-223.customer.ggaweb.ch.8333: tcp 541
04:23:16.907024 IP c-185-45-236-223.customer.ggaweb.ch.8333 > tom-Latitude-3570.49070: tcp 0
04:23:16.914412 IP c-185-45-236-223.customer.ggaweb.ch.8333 > tom-Latitude-3570.49070: tcp 0
04:23:18.053754 IP tom-Latitude-3570.60470 > bb42-60-217-183.singnet.com.sg.8333: tcp 24
04:23:18.056031 IP tom-Latitude-3570.60470 > bb42-60-217-183.singnet.com.sg.8333: tcp 217
04:23:18.115170 IP bb42-60-217-183.singnet.com.sg.8333 > tom-Latitude-3570.60470: tcp 0
04:23:19.814562 IP ns3113832.ip-54-38-177.eu.8333 > tom-Latitude-3570.56714: tcp 24
04:23:19.814583 IP ns3113832.ip-54-38-177.eu.8333 > tom-Latitude-3570.56714: tcp 253
04:23:19.814588 IP ns3113832.ip-54-38-177.eu.8333 > tom-Latitude-3570.56714: tcp 253
04:23:19.814615 IP tom-Latitude-3570.56714 > ns3113832.ip-54-38-177.eu.8333: tcp 0
04:23:19.814897 IP tom-Latitude-3570.56714 > ns3113832.ip-54-38-177.eu.8333: tcp 24
04:23:19.816071 IP tom-Latitude-3570.56714 > ns3113832.ip-54-38-177.eu.8333: tcp 253
04:23:19.854156 IP ns3113832.ip-54-38-177.eu.8333 > tom-Latitude-3570.56714: tcp 0
04:23:19.854744 IP ns3113832.ip-54-38-177.eu.8333 > tom-Latitude-3570.56714: tcp 0
04:23:19.916225 IP ns3113832.ip-54-38-177.eu.8333 > tom-Latitude-3570.56714: tcp 24
04:23:19.916246 IP ns3113832.ip-54-38-177.eu.8333 > tom-Latitude-3570.56714: tcp 247
04:23:19.916250 IP ns3113832.ip-54-38-177.eu.8333 > tom-Latitude-3570.56714: tcp 24
04:23:19.916253 IP ns3113832.ip-54-38-177.eu.8333 > tom-Latitude-3570.56714: tcp 521
04:23:19.916254 IP ns3113832.ip-54-38-177.eu.8333 > tom-Latitude-3570.56714: tcp 24
04:23:19.916278 IP ns3113832.ip-54-38-177.eu.8333 > tom-Latitude-3570.56714: tcp 226
04:23:19.916280 IP ns3113832.ip-54-38-177.eu.8333 > tom-Latitude-3570.56714: tcp 24
04:23:19.916345 IP tom-Latitude-3570.56714 > ns3113832.ip-54-38-177.eu.8333: tcp 0
04:23:19.916422 IP ns3113832.ip-54-38-177.eu.8333 > tom-Latitude-3570.56714: tcp 246
04:23:19.916433 IP ns3113832.ip-54-38-177.eu.8333 > tom-Latitude-3570.56714: tcp 24
04:23:19.916437 IP ns3113832.ip-54-38-177.eu.8333 > tom-Latitude-3570.56714: tcp 225
04:23:19.916459 IP tom-Latitude-3570.56714 > ns3113832.ip-54-38-177.eu.8333: tcp 0
04:23:19.969310 IP ns3113832.ip-54-38-177.eu.8333 > tom-Latitude-3570.56714: tcp 724
04:23:19.969548 IP tom-Latitude-3570.39110 > vmi195435.contaboserver.net.8333: tcp 24
04:23:19.970370 IP tom-Latitude-3570.39110 > vmi195435.contaboserver.net.8333: tcp 181
04:23:20.003802 IP vmi195435.contaboserver.net.8333 > tom-Latitude-3570.39110: tcp 0
04:23:20.011805 IP tom-Latitude-3570.56714 > ns3113832.ip-54-38-177.eu.8333: tcp 0
04:23:20.070973 IP tom-Latitude-3570.39110 > vmi195435.contaboserver.net.8333: tcp 24
04:23:20.071990 IP tom-Latitude-3570.39110 > vmi195435.contaboserver.net.8333: tcp 73
04:23:20.103785 IP vmi195435.contaboserver.net.8333 > tom-Latitude-3570.39110: tcp 0
04:23:20.171379 IP tom-Latitude-3570.42516 > 2.56.9.15.8333: tcp 24
04:23:20.172340 IP tom-Latitude-3570.42516 > 2.56.9.15.8333: tcp 253
04:23:20.195815 IP 2.56.9.15.8333 > tom-Latitude-3570.42516: tcp 0
04:23:20.203765 IP 2.56.9.15.8333 > tom-Latitude-3570.42516: tcp 0
04:23:20.271781 IP tom-Latitude-3570.49070 > c-185-45-236-223.customer.ggaweb.ch.8333: tcp 24
04:23:20.272724 IP tom-Latitude-3570.49070 > c-185-45-236-223.customer.ggaweb.ch.8333: tcp 253
04:23:20.295814 IP c-185-45-236-223.customer.ggaweb.ch.8333 > tom-Latitude-3570.49070: tcp 0
04:23:20.303824 IP c-185-45-236-223.customer.ggaweb.ch.8333 > tom-Latitude-3570.49070: tcp 0
04:23:20.672888 IP tom-Latitude-3570.60470 > bb42-60-217-183.singnet.com.sg.8333: tcp 24
04:23:20.674947 IP tom-Latitude-3570.60470 > bb42-60-217-183.singnet.com.sg.8333: tcp 253
04:23:20.735775 IP bb42-60-217-183.singnet.com.sg.8333 > tom-Latitude-3570.60470: tcp 0
04:23:20.973898 IP tom-Latitude-3570.39110 > vmi195435.contaboserver.net.8333: tcp 24
04:23:20.975950 IP tom-Latitude-3570.39110 > vmi195435.contaboserver.net.8333: tcp 8
04:23:21.025834 IP vmi195435.contaboserver.net.8333 > tom-Latitude-3570.39110: tcp 0
04:23:21.103938 IP vmi195435.contaboserver.net.8333 > tom-Latitude-3570.39110: tcp 24
04:23:21.103957 IP vmi195435.contaboserver.net.8333 > tom-Latitude-3570.39110: tcp 8
04:23:21.104044 IP tom-Latitude-3570.39110 > vmi195435.contaboserver.net.8333: tcp 0
04:23:21.452878 IP static-87-75-105-186.vodafonexdsl.co.uk.8333 > tom-Latitude-3570.46284: tcp 24
04:23:21.452906 IP static-87-75-105-186.vodafonexdsl.co.uk.8333 > tom-Latitude-3570.46284: tcp 397
04:23:21.452998 IP tom-Latitude-3570.46284 > static-87-75-105-186.vodafonexdsl.co.uk.8333: tcp 0
04:23:21.453221 IP tom-Latitude-3570.46284 > static-87-75-105-186.vodafonexdsl.co.uk.8333: tcp 24
04:23:21.454858 IP tom-Latitude-3570.46284 > static-87-75-105-186.vodafonexdsl.co.uk.8333: tcp 145
04:23:21.456750 IP static-87-75-105-186.vodafonexdsl.co.uk.8333 > tom-Latitude-3570.46284: tcp 397
04:23:21.456769 IP tom-Latitude-3570.46284 > static-87-75-105-186.vodafonexdsl.co.uk.8333: tcp 0
04:23:21.494715 IP static-87-75-105-186.vodafonexdsl.co.uk.8333 > tom-Latitude-3570.46284: tcp 0
04:23:21.495173 IP static-87-75-105-186.vodafonexdsl.co.uk.8333 > tom-Latitude-3570.46284: tcp 0
04:23:21.561977 IP static-87-75-105-186.vodafonexdsl.co.uk.8333 > tom-Latitude-3570.46284: tcp 24
04:23:21.561994 IP tom-Latitude-3570.46284 > static-87-75-105-186.vodafonexdsl.co.uk.8333: tcp 0
04:23:21.562013 IP static-87-75-105-186.vodafonexdsl.co.uk.8333 > tom-Latitude-3570.46284: tcp 257
04:23:21.562017 IP tom-Latitude-3570.46284 > static-87-75-105-186.vodafonexdsl.co.uk.8333: tcp 0
04:23:21.562020 IP static-87-75-105-186.vodafonexdsl.co.uk.8333 > tom-Latitude-3570.46284: tcp 24
04:23:21.562021 IP tom-Latitude-3570.46284 > static-87-75-105-186.vodafonexdsl.co.uk.8333: tcp 0
04:23:21.562042 IP static-87-75-105-186.vodafonexdsl.co.uk.8333 > tom-Latitude-3570.46284: tcp 347
04:23:21.562044 IP tom-Latitude-3570.46284 > static-87-75-105-186.vodafonexdsl.co.uk.8333: tcp 0
04:23:21.562048 IP static-87-75-105-186.vodafonexdsl.co.uk.8333 > tom-Latitude-3570.46284: tcp 24
04:23:21.562050 IP tom-Latitude-3570.46284 > static-87-75-105-186.vodafonexdsl.co.uk.8333: tcp 0
04:23:21.562059 IP static-87-75-105-186.vodafonexdsl.co.uk.8333 > tom-Latitude-3570.46284: tcp 223
04:23:21.562061 IP tom-Latitude-3570.46284 > static-87-75-105-186.vodafonexdsl.co.uk.8333: tcp 0
04:23:21.562660 IP static-87-75-105-186.vodafonexdsl.co.uk.8333 > tom-Latitude-3570.46284: tcp 24
04:23:21.562673 IP tom-Latitude-3570.46284 > static-87-75-105-186.vodafonexdsl.co.uk.8333: tcp 0
04:23:21.562690 IP static-87-75-105-186.vodafonexdsl.co.uk.8333 > tom-Latitude-3570.46284: tcp 247
04:23:21.562694 IP tom-Latitude-3570.46284 > static-87-75-105-186.vodafonexdsl.co.uk.8333: tcp 0
04:23:21.763854 IP tom-Latitude-3570.56714 > ns3113832.ip-54-38-177.eu.8333: tcp 24
04:23:21.763906 IP tom-Latitude-3570.60470 > bb42-60-217-183.singnet.com.sg.8333: tcp 24
04:23:21.765940 IP tom-Latitude-3570.56714 > ns3113832.ip-54-38-177.eu.8333: tcp 145
04:23:21.766786 IP tom-Latitude-3570.60470 > bb42-60-217-183.singnet.com.sg.8333: tcp 145
04:23:21.797496 IP ns3113832.ip-54-38-177.eu.8333 > tom-Latitude-3570.56714: tcp 0
04:23:21.804464 IP ns3113832.ip-54-38-177.eu.8333 > tom-Latitude-3570.56714: tcp 0
04:23:21.807714 IP bb42-60-217-183.singnet.com.sg.8333 > tom-Latitude-3570.60470: tcp 0
04:23:22.165295 IP tom-Latitude-3570.49070 > c-185-45-236-223.customer.ggaweb.ch.8333: tcp 24
04:23:22.168755 IP tom-Latitude-3570.49070 > c-185-45-236-223.customer.ggaweb.ch.8333: tcp 145
04:23:22.232690 IP c-185-45-236-223.customer.ggaweb.ch.8333 > tom-Latitude-3570.49070: tcp 0
04:23:22.236236 IP c-185-45-236-223.customer.ggaweb.ch.8333 > tom-Latitude-3570.49070: tcp 0
04:23:22.886630 IP vmi195435.contaboserver.net.8333 > tom-Latitude-3570.39110: tcp 24
04:23:22.886655 IP vmi195435.contaboserver.net.8333 > tom-Latitude-3570.39110: tcp 8
04:23:22.886660 IP vmi195435.contaboserver.net.8333 > tom-Latitude-3570.39110: tcp 8
04:23:22.886674 IP tom-Latitude-3570.39110 > vmi195435.contaboserver.net.8333: tcp 0
04:23:22.886831 IP tom-Latitude-3570.39110 > vmi195435.contaboserver.net.8333: tcp 24
04:23:22.888738 IP tom-Latitude-3570.39110 > vmi195435.contaboserver.net.8333: tcp 8
04:23:22.915651 IP vmi195435.contaboserver.net.8333 > tom-Latitude-3570.39110: tcp 0
04:23:23.187969 IP tom-Latitude-3570.57976 > 167.99.216.145.8333: tcp 24
04:23:23.191446 IP tom-Latitude-3570.57976 > 167.99.216.145.8333: tcp 397
04:23:23.226866 IP 167.99.216.145.8333 > tom-Latitude-3570.57976: tcp 0
04:23:23.234818 IP 167.99.216.145.8333 > tom-Latitude-3570.57976: tcp 0
04:23:23.243598 IP c-185-45-236-223.customer.ggaweb.ch.8333 > tom-Latitude-3570.49070: tcp 24
04:23:23.243617 IP c-185-45-236-223.customer.ggaweb.ch.8333 > tom-Latitude-3570.49070: tcp 8
04:23:23.243717 IP tom-Latitude-3570.49070 > c-185-45-236-223.customer.ggaweb.ch.8333: tcp 0
04:23:23.243845 IP tom-Latitude-3570.49070 > c-185-45-236-223.customer.ggaweb.ch.8333: tcp 24
04:23:23.243920 IP tom-Latitude-3570.42516 > 2.56.9.15.8333: tcp 24
04:23:23.245577 IP tom-Latitude-3570.49070 > c-185-45-236-223.customer.ggaweb.ch.8333: tcp 8
04:23:23.246227 IP tom-Latitude-3570.42516 > 2.56.9.15.8333: tcp 145
04:23:23.284986 IP 2.56.9.15.8333 > tom-Latitude-3570.42516: tcp 0
04:23:23.285560 IP c-185-45-236-223.customer.ggaweb.ch.8333 > tom-Latitude-3570.49070: tcp 0
04:23:23.285574 IP 2.56.9.15.8333 > tom-Latitude-3570.42516: tcp 0
04:23:23.285577 IP c-185-45-236-223.customer.ggaweb.ch.8333 > tom-Latitude-3570.49070: tcp 0
04:23:23.910570 IP vmi195435.contaboserver.net.8333 > tom-Latitude-3570.39110: tcp 24
04:23:23.910590 IP vmi195435.contaboserver.net.8333 > tom-Latitude-3570.39110: tcp 397
04:23:23.910594 IP bb42-60-217-183.singnet.com.sg.8333 > tom-Latitude-3570.60470: tcp 24
04:23:23.910598 IP bb42-60-217-183.singnet.com.sg.8333 > tom-Latitude-3570.60470: tcp 253
04:23:23.910677 IP tom-Latitude-3570.39110 > vmi195435.contaboserver.net.8333: tcp 0
04:23:23.910711 IP tom-Latitude-3570.60470 > bb42-60-217-183.singnet.com.sg.8333: tcp 0
04:23:23.910935 IP tom-Latitude-3570.39110 > vmi195435.contaboserver.net.8333: tcp 24
04:23:23.913959 IP tom-Latitude-3570.39110 > vmi195435.contaboserver.net.8333: tcp 253
04:23:23.936764 IP 167.99.216.145.8333 > tom-Latitude-3570.57976: tcp 24
04:23:23.937487 IP 167.99.216.145.8333 > tom-Latitude-3570.57976: tcp 289
04:23:23.937619 IP tom-Latitude-3570.57976 > 167.99.216.145.8333: tcp 0
04:23:23.937865 IP tom-Latitude-3570.57976 > 167.99.216.145.8333: tcp 24
04:23:23.939031 IP tom-Latitude-3570.57976 > 167.99.216.145.8333: tcp 37
04:23:23.954793 IP vmi195435.contaboserver.net.8333 > tom-Latitude-3570.39110: tcp 0
04:23:23.973502 IP 167.99.216.145.8333 > tom-Latitude-3570.57976: tcp 0
04:23:23.974077 IP 167.99.216.145.8333 > tom-Latitude-3570.57976: tcp 0
04:23:24.036647 IP vmi195435.contaboserver.net.8333 > tom-Latitude-3570.39110: tcp 24
04:23:24.036667 IP vmi195435.contaboserver.net.8333 > tom-Latitude-3570.39110: tcp 256
04:23:24.036671 IP vmi195435.contaboserver.net.8333 > tom-Latitude-3570.39110: tcp 24
04:23:24.036675 IP vmi195435.contaboserver.net.8333 > tom-Latitude-3570.39110: tcp 366
04:23:24.036694 IP vmi195435.contaboserver.net.8333 > tom-Latitude-3570.39110: tcp 24
04:23:24.036697 IP vmi195435.contaboserver.net.8333 > tom-Latitude-3570.39110: tcp 225
04:23:24.036699 IP vmi195435.contaboserver.net.8333 > tom-Latitude-3570.39110: tcp 24
04:23:24.036709 IP vmi195435.contaboserver.net.8333 > tom-Latitude-3570.39110: tcp 249
04:23:24.036712 IP vmi195435.contaboserver.net.8333 > tom-Latitude-3570.39110: tcp 24
04:23:24.036715 IP vmi195435.contaboserver.net.8333 > tom-Latitude-3570.39110: tcp 193
04:23:24.036762 IP tom-Latitude-3570.39110 > vmi195435.contaboserver.net.8333: tcp 0
04:23:24.038966 IP 167.99.216.145.8333 > tom-Latitude-3570.57976: tcp 24
04:23:24.038979 IP 167.99.216.145.8333 > tom-Latitude-3570.57976: tcp 901
04:23:24.039033 IP tom-Latitude-3570.57976 > 167.99.216.145.8333: tcp 0
04:23:24.113765 IP vmi195435.contaboserver.net.8333 > tom-Latitude-3570.39110: tcp 465
04:23:24.114334 IP tom-Latitude-3570.60470 > bb42-60-217-183.singnet.com.sg.8333: tcp 24
04:23:24.115950 IP tom-Latitude-3570.60470 > bb42-60-217-183.singnet.com.sg.8333: tcp 37
04:23:24.144797 IP bb42-60-217-183.singnet.com.sg.8333 > tom-Latitude-3570.60470: tcp 0
04:23:24.155903 IP tom-Latitude-3570.39110 > vmi195435.contaboserver.net.8333: tcp 0
04:23:24.207361 IP c-185-45-236-223.customer.ggaweb.ch.8333 > tom-Latitude-3570.49070: tcp 24
04:23:24.207952 IP c-185-45-236-223.customer.ggaweb.ch.8333 > tom-Latitude-3570.49070: tcp 325
04:23:24.208077 IP tom-Latitude-3570.49070 > c-185-45-236-223.customer.ggaweb.ch.8333: tcp 0
04:23:24.208292 IP tom-Latitude-3570.49070 > c-185-45-236-223.customer.ggaweb.ch.8333: tcp 24
04:23:24.208392 IP tom-Latitude-3570.56714 > ns3113832.ip-54-38-177.eu.8333: tcp 24
04:23:24.209473 IP tom-Latitude-3570.49070 > c-185-45-236-223.customer.ggaweb.ch.8333: tcp 37
04:23:24.210143 IP tom-Latitude-3570.56714 > ns3113832.ip-54-38-177.eu.8333: tcp 289
04:23:24.244949 IP ns3113832.ip-54-38-177.eu.8333 > tom-Latitude-3570.56714: tcp 0
04:23:24.245577 IP c-185-45-236-223.customer.ggaweb.ch.8333 > tom-Latitude-3570.49070: tcp 0
04:23:24.245592 IP c-185-45-236-223.customer.ggaweb.ch.8333 > tom-Latitude-3570.49070: tcp 0
04:23:24.245595 IP ns3113832.ip-54-38-177.eu.8333 > tom-Latitude-3570.56714: tcp 0
04:23:24.331833 IP c-185-45-236-223.customer.ggaweb.ch.8333 > tom-Latitude-3570.49070: tcp 24
04:23:24.332402 IP c-185-45-236-223.customer.ggaweb.ch.8333 > tom-Latitude-3570.49070: tcp 529
04:23:24.332518 IP tom-Latitude-3570.49070 > c-185-45-236-223.customer.ggaweb.ch.8333: tcp 0
04:23:24.934749 IP tom-Latitude-3570.60988 > 81.198.101.144.8333: tcp 24
04:23:24.936662 IP tom-Latitude-3570.60988 > 81.198.101.144.8333: tcp 721
04:23:25.021276 IP 81.198.101.144.8333 > tom-Latitude-3570.60988: tcp 0
04:23:25.536759 IP tom-Latitude-3570.49070 > c-185-45-236-223.customer.ggaweb.ch.8333: tcp 24
04:23:25.539050 IP tom-Latitude-3570.49070 > c-185-45-236-223.customer.ggaweb.ch.8333: tcp 8
04:23:25.598718 IP c-185-45-236-223.customer.ggaweb.ch.8333 > tom-Latitude-3570.49070: tcp 0
04:23:25.605034 IP c-185-45-236-223.customer.ggaweb.ch.8333 > tom-Latitude-3570.49070: tcp 0
04:23:25.689081 IP c-185-45-236-223.customer.ggaweb.ch.8333 > tom-Latitude-3570.49070: tcp 24
04:23:25.689730 IP c-185-45-236-223.customer.ggaweb.ch.8333 > tom-Latitude-3570.49070: tcp 8
04:23:25.689857 IP tom-Latitude-3570.49070 > c-185-45-236-223.customer.ggaweb.ch.8333: tcp 0
04:23:25.991040 IP tom-Latitude-3570.46284 > static-87-75-105-186.vodafonexdsl.co.uk.8333: tcp 24
