09:10:57.529789 IP vmi195435.contaboserver.net.8333 > tom-Latitude-3570.39110: tcp 24
09:10:57.529802 IP vmi195435.contaboserver.net.8333 > tom-Latitude-3570.39110: tcp 223
09:10:57.529808 IP vmi195435.contaboserver.net.8333 > tom-Latitude-3570.39110: tcp 24
09:10:57.529876 IP tom-Latitude-3570.39110 > vmi195435.contaboserver.net.8333: tcp 0
09:10:57.530386 IP tom-Latitude-3570.46284 > static-87-75-105-186.vodafonexdsl.co.uk.8333: tcp 24
09:10:57.532296 IP vmi195435.contaboserver.net.8333 > tom-Latitude-3570.39110: tcp 522
09:10:57.532949 IP tom-Latitude-3570.46284 > static-87-75-105-186.vodafonexdsl.co.uk.8333: tcp 37
09:10:57.534251 IP c-185-45-236-223.customer.ggaweb.ch.8333 > tom-Latitude-3570.49070: tcp 0
09:10:57.541728 IP c-185-45-236-223.customer.ggaweb.ch.8333 > tom-Latitude-3570.49070: tcp 0
09:10:57.575911 IP tom-Latitude-3570.39110 > vmi195435.contaboserver.net.8333: tcp 0
09:10:57.581554 IP 2.56.9.15.8333 > tom-Latitude-3570.42516: tcp 24
09:10:57.581579 IP tom-Latitude-3570.42516 > 2.56.9.15.8333: tcp 0
09:10:57.584952 IP 2.56.9.15.8333 > tom-Latitude-3570.42516: tcp 253
09:10:57.584976 IP tom-Latitude-3570.42516 > 2.56.9.15.8333: tcp 0
09:10:57.585207 IP tom-Latitude-3570.60470 > bb42-60-217-183.singnet.com.sg.8333: tcp 24
09:10:57.585624 IP tom-Latitude-3570.60470 > bb42-60-217-183.singnet.com.sg.8333: tcp 73
09:10:57.587855 IP static-87-75-105-186.vodafonexdsl.co.uk.8333 > tom-Latitude-3570.46284: tcp 0
09:10:57.588028 IP static-87-75-105-186.vodafonexdsl.co.uk.8333 > tom-Latitude-3570.46284: tcp 0
09:10:57.616787 IP bb42-60-217-183.singnet.com.sg.8333 > tom-Latitude-3570.60470: tcp 0
09:10:57.620761 IP bb42-60-217-183.singnet.com.sg.8333 > tom-Latitude-3570.60470: tcp 0
09:10:57.626084 IP c-185-45-236-223.customer.ggaweb.ch.8333 > tom-Latitude-3570.49070: tcp 24
09:10:57.628570 IP c-185-45-236-223.customer.ggaweb.ch.8333 > tom-Latitude-3570.49070: tcp 404
09:10:57.628586 IP tom-Latitude-3570.49070 > c-185-45-236-223.customer.ggaweb.ch.8333: tcp 0
09:10:57.926659 IP c-185-45-236-223.customer.ggaweb.ch.8333 > tom-Latitude-3570.49070: tcp 24
09:10:57.926678 IP c-185-45-236-223.customer.ggaweb.ch.8333 > tom-Latitude-3570.49070: tcp 37
09:10:57.926769 IP tom-Latitude-3570.49070 > c-185-45-236-223.customer.ggaweb.ch.8333: tcp 0
09:10:57.926920 IP tom-Latitude-3570.39110 > vmi195435.contaboserver.net.8333: tcp 24
09:10:57.926999 IP tom-Latitude-3570.49070 > c-185-45-236-223.customer.ggaweb.ch.8333: tcp 24
09:10:57.927534 IP tom-Latitude-3570.39110 > vmi195435.contaboserver.net.8333: tcp 37
09:10:57.927796 IP tom-Latitude-3570.49070 > c-185-45-236-223.customer.ggaweb.ch.8333: tcp 37
09:10:57.962671 IP vmi195435.contaboserver.net.8333 > tom-Latitude-3570.39110: tcp 0
09:10:57.962741 IP vmi195435.contaboserver.net.8333 > tom-Latitude-3570.39110: tcp 0
09:10:57.965820 IP c-185-45-236-223.customer.ggaweb.ch.8333 > tom-Latitude-3570.49070: tcp 0
09:10:57.971075 IP c-185-45-236-223.customer.ggaweb.ch.8333 > tom-Latitude-3570.49070: tcp 0
09:10:58.027411 IP tom-Latitude-3570.46284 > static-87-75-105-186.vodafonexdsl.co.uk.8333: tcp 24
09:10:58.027886 IP tom-Latitude-3570.46284 > static-87-75-105-186.vodafonexdsl.co.uk.8333: tcp 73
09:10:58.056574 IP static-87-75-105-186.vodafonexdsl.co.uk.8333 > tom-Latitude-3570.46284: tcp 0
09:10:58.056590 IP static-87-75-105-186.vodafonexdsl.co.uk.8333 > tom-Latitude-3570.46284: tcp 0
09:10:58.056593 IP c-185-45-236-223.customer.ggaweb.ch.8333 > tom-Latitude-3570.49070: tcp 24
09:10:58.060131 IP c-185-45-236-223.customer.ggaweb.ch.8333 > tom-Latitude-3570.49070: tcp 502
09:10:58.060263 IP tom-Latitude-3570.49070 > c-185-45-236-223.customer.ggaweb.ch.8333: tcp 0
09:10:58.161494 IP tom-Latitude-3570.39110 > vmi195435.contaboserver.net.8333: tcp 24
09:10:58.168795 IP tom-Latitude-3570.39110 > vmi195435.contaboserver.net.8333: tcp 37
09:10:58.202601 IP vmi195435.contaboserver.net.8333 > tom-Latitude-3570.39110: tcp 0
09:10:58.202616 IP vmi195435.contaboserver.net.8333 > tom-Latitude-3570.39110: tcp 0
09:10:58.302560 IP 167.99.216.145.8333 > tom-Latitude-3570.57976: tcp 24
09:10:58.302585 IP tom-Latitude-3570.57976 > 167.99.216.145.8333: tcp 0
09:10:58.302615 IP 167.99.216.145.8333 > tom-Latitude-3570.57976: tcp 31
09:10:58.302618 IP tom-Latitude-3570.57976 > 167.99.216.145.8333: tcp 0
09:10:58.302953 IP tom-Latitude-3570.42516 > 2.56.9.15.8333: tcp 24
09:10:58.303567 IP tom-Latitude-3570.42516 > 2.56.9.15.8333: tcp 73
09:10:58.335427 IP 2.56.9.15.8333 > tom-Latitude-3570.42516: tcp 0
09:10:58.339019 IP 2.56.9.15.8333 > tom-Latitude-3570.42516: tcp 0
09:10:58.403375 IP tom-Latitude-3570.46284 > static-87-75-105-186.vodafonexdsl.co.uk.8333: tcp 24
09:10:58.404282 IP tom-Latitude-3570.46284 > static-87-75-105-186.vodafonexdsl.co.uk.8333: tcp 37
09:10:58.430922 IP static-87-75-105-186.vodafonexdsl.co.uk.8333 > tom-Latitude-3570.46284: tcp 0
09:10:58.437749 IP static-87-75-105-186.vodafonexdsl.co.uk.8333 > tom-Latitude-3570.46284: tcp 0
09:10:58.503835 IP tom-Latitude-3570.60988 > 81.198.101.144.8333: tcp 24
09:10:58.504893 IP tom-Latitude-3570.60988 > 81.198.101.144.8333: tcp 145
09:10:58.531122 IP 81.198.101.144.8333 > tom-Latitude-3570.60988: tcp 0
09:10:58.534194 IP 81.198.101.144.8333 > tom-Latitude-3570.60988: tcp 0
09:10:58.729338 IP 81.198.101.144.8333 > tom-Latitude-3570.60988: tcp 24
09:10:58.732358 IP 81.198.101.144.8333 > tom-Latitude-3570.60988: tcp 73
09:10:58.732486 IP tom-Latitude-3570.60988 > 81.198.101.144.8333: tcp 0
09:10:58.732689 IP tom-Latitude-3570.60988 > 81.198.101.144.8333: tcp 24
09:10:58.733493 IP tom-Latitude-3570.60988 > 81.198.101.144.8333: tcp 73
09:10:58.762581 IP 81.198.101.144.8333 > tom-Latitude-3570.60988: tcp 0
09:10:58.767119 IP 81.198.101.144.8333 > tom-Latitude-3570.60988: tcp 0
09:10:58.858066 IP 81.198.101.144.8333 > tom-Latitude-3570.60988: tcp 24
09:10:58.858086 IP 81.198.101.144.8333 > tom-Latitude-3570.60988: tcp 226
09:10:58.858091 IP 81.198.101.144.8333 > tom-Latitude-3570.60988: tcp 24
09:10:58.858177 IP tom-Latitude-3570.60988 > 81.198.101.144.8333: tcp 0
09:10:58.860963 IP 81.198.101.144.8333 > tom-Latitude-3570.60988: tcp 370
09:10:58.903907 IP tom-Latitude-3570.60988 > 81.198.101.144.8333: tcp 0
09:10:59.062416 IP tom-Latitude-3570.60470 > bb42-60-217-183.singnet.com.sg.8333: tcp 24
09:10:59.111028 IP ns3113832.ip-54-38-177.eu.8333 > tom-Latitude-3570.56714: tcp 24
09:10:59.111051 IP tom-Latitude-3570.56714 > ns3113832.ip-54-38-177.eu.8333: tcp 0
09:10:59.111062 IP tom-Latitude-3570.60470 > bb42-60-217-183.singnet.com.sg.8333: tcp 145
09:10:59.111643 IP ns3113832.ip-54-38-177.eu.8333 > tom-Latitude-3570.56714: tcp 253
09:10:59.111651 IP tom-Latitude-3570.56714 > ns3113832.ip-54-38-177.eu.8333: tcp 0
09:10:59.111829 IP tom-Latitude-3570.56714 > ns3113832.ip-54-38-177.eu.8333: tcp 24
09:10:59.114152 IP tom-Latitude-3570.56714 > ns3113832.ip-54-38-177.eu.8333: tcp 37
09:10:59.146630 IP bb42-60-217-183.singnet.com.sg.8333 > tom-Latitude-3570.60470: tcp 0
09:10:59.146765 IP bb42-60-217-183.singnet.com.sg.8333 > tom-Latitude-3570.60470: tcp 0
09:10:59.164720 IP ns3113832.ip-54-38-177.eu.8333 > tom-Latitude-3570.56714: tcp 0
09:10:59.167955 IP ns3113832.ip-54-38-177.eu.8333 > tom-Latitude-3570.56714: tcp 0
09:10:59.226308 IP ns3113832.ip-54-38-177.eu.8333 > tom-Latitude-3570.56714: tcp 24
09:10:59.229543 IP ns3113832.ip-54-38-177.eu.8333 > tom-Latitude-3570.56714: tcp 247
09:10:59.229679 IP tom-Latitude-3570.56714 > ns3113832.ip-54-38-177.eu.8333: tcp 0
09:10:59.832045 IP tom-Latitude-3570.42516 > 2.56.9.15.8333: tcp 24
09:10:59.833966 IP tom-Latitude-3570.42516 > 2.56.9.15.8333: tcp 109
09:10:59.865207 IP 2.56.9.15.8333 > tom-Latitude-3570.42516: tcp 0
09:10:59.869627 IP 2.56.9.15.8333 > tom-Latitude-3570.42516: tcp 0
09:11:00.179427 IP vmi195435.contaboserver.net.8333 > tom-Latitude-3570.39110: tcp 24
09:11:00.179450 IP tom-Latitude-3570.39110 > vmi195435.contaboserver.net.8333: tcp 0
09:11:00.179481 IP vmi195435.contaboserver.net.8333 > tom-Latitude-3570.39110: tcp 109
09:11:00.179486 IP tom-Latitude-3570.39110 > vmi195435.contaboserver.net.8333: tcp 0
09:11:00.179505 IP 167.99.216.145.8333 > tom-Latitude-3570.57976: tcp 24
09:11:00.179508 IP tom-Latitude-3570.57976 > 167.99.216.145.8333: tcp 0
09:11:00.179512 IP 167.99.216.145.8333 > tom-Latitude-3570.57976: tcp 325
09:11:00.179514 IP tom-Latitude-3570.57976 > 167.99.216.145.8333: tcp 0
09:11:00.179517 IP vmi195435.contaboserver.net.8333 > tom-Latitude-3570.39110: tcp 109
09:11:00.179519 IP tom-Latitude-3570.39110 > vmi195435.contaboserver.net.8333: tcp 0
09:11:00.380376 IP tom-Latitude-3570.46284 > static-87-75-105-186.vodafonexdsl.co.uk.8333: tcp 24
09:11:00.381936 IP 81.198.101.144.8333 > tom-Latitude-3570.60988: tcp 24
09:11:00.381959 IP tom-Latitude-3570.60988 > 81.198.101.144.8333: tcp 0
09:11:00.381991 IP tom-Latitude-3570.46284 > static-87-75-105-186.vodafonexdsl.co.uk.8333: tcp 109
09:11:00.386347 IP 81.198.101.144.8333 > tom-Latitude-3570.60988: tcp 37
09:11:00.386370 IP tom-Latitude-3570.60988 > 81.198.101.144.8333: tcp 0
09:11:00.414405 IP static-87-75-105-186.vodafonexdsl.co.uk.8333 > tom-Latitude-3570.46284: tcp 0
09:11:00.414421 IP static-87-75-105-186.vodafonexdsl.co.uk.8333 > tom-Latitude-3570.46284: tcp 0
09:11:00.687760 IP tom-Latitude-3570.49070 > c-185-45-236-223.customer.ggaweb.ch.8333: tcp 24
09:11:00.736273 IP tom-Latitude-3570.49070 > c-185-45-236-223.customer.ggaweb.ch.8333: tcp 109
09:11:00.771005 IP c-185-45-236-223.customer.ggaweb.ch.8333 > tom-Latitude-3570.49070: tcp 0
09:11:00.771020 IP c-185-45-236-223.customer.ggaweb.ch.8333 > tom-Latitude-3570.49070: tcp 0
09:11:01.613024 IP 2.56.9.15.8333 > tom-Latitude-3570.42516: tcp 24
09:11:01.613047 IP tom-Latitude-3570.42516 > 2.56.9.15.8333: tcp 0
09:11:01.613080 IP 2.56.9.15.8333 > tom-Latitude-3570.42516: tcp 181
09:11:01.613099 IP tom-Latitude-3570.42516 > 2.56.9.15.8333: tcp 0
09:11:01.613418 IP tom-Latitude-3570.42516 > 2.56.9.15.8333: tcp 24
09:11:01.614088 IP tom-Latitude-3570.42516 > 2.56.9.15.8333: tcp 181
09:11:01.644594 IP 2.56.9.15.8333 > tom-Latitude-3570.42516: tcp 0
09:11:01.654665 IP 2.56.9.15.8333 > tom-Latitude-3570.42516: tcp 0
09:11:01.753942 IP 2.56.9.15.8333 > tom-Latitude-3570.42516: tcp 24
09:11:01.753962 IP 2.56.9.15.8333 > tom-Latitude-3570.42516: tcp 189
09:11:01.753965 IP 2.56.9.15.8333 > tom-Latitude-3570.42516: tcp 24
09:11:01.753967 IP 2.56.9.15.8333 > tom-Latitude-3570.42516: tcp 225
09:11:01.753969 IP 2.56.9.15.8333 > tom-Latitude-3570.42516: tcp 24
09:11:01.753995 IP 2.56.9.15.8333 > tom-Latitude-3570.42516: tcp 225
09:11:01.753999 IP 2.56.9.15.8333 > tom-Latitude-3570.42516: tcp 24
09:11:01.754060 IP tom-Latitude-3570.42516 > 2.56.9.15.8333: tcp 0
09:11:01.754353 IP 2.56.9.15.8333 > tom-Latitude-3570.42516: tcp 222
09:11:01.754367 IP 2.56.9.15.8333 > tom-Latitude-3570.42516: tcp 24
09:11:01.754458 IP tom-Latitude-3570.42516 > 2.56.9.15.8333: tcp 0
09:11:01.759824 IP 2.56.9.15.8333 > tom-Latitude-3570.42516: tcp 191
09:11:01.803902 IP tom-Latitude-3570.42516 > 2.56.9.15.8333: tcp 0
09:11:01.834780 IP vmi195435.contaboserver.net.8333 > tom-Latitude-3570.39110: tcp 24
09:11:01.834797 IP tom-Latitude-3570.39110 > vmi195435.contaboserver.net.8333: tcp 0
09:11:01.834815 IP vmi195435.contaboserver.net.8333 > tom-Latitude-3570.39110: tcp 253
09:11:01.834819 IP tom-Latitude-3570.39110 > vmi195435.contaboserver.net.8333: tcp 0
09:11:01.835116 IP tom-Latitude-3570.39110 > vmi195435.contaboserver.net.8333: tcp 24
09:11:01.836075 IP tom-Latitude-3570.39110 > vmi195435.contaboserver.net.8333: tcp 73
09:11:01.868527 IP vmi195435.contaboserver.net.8333 > tom-Latitude-3570.39110: tcp 0
09:11:01.872136 IP vmi195435.contaboserver.net.8333 > tom-Latitude-3570.39110: tcp 0
09:11:01.954855 IP vmi195435.contaboserver.net.8333 > tom-Latitude-3570.39110: tcp 24
09:11:01.954875 IP vmi195435.contaboserver.net.8333 > tom-Latitude-3570.39110: tcp 257
09:11:01.954879 IP vmi195435.contaboserver.net.8333 > tom-Latitude-3570.39110: tcp 24
09:11:01.954908 IP vmi195435.contaboserver.net.8333 > tom-Latitude-3570.39110: tcp 257
09:11:01.954965 IP tom-Latitude-3570.39110 > vmi195435.contaboserver.net.8333: tcp 0
09:11:02.056466 IP tom-Latitude-3570.60988 > 81.198.101.144.8333: tcp 24
09:11:02.057052 IP tom-Latitude-3570.60988 > 81.198.101.144.8333: tcp 253
09:11:02.086549 IP 81.198.101.144.8333 > tom-Latitude-3570.60988: tcp 0
09:11:02.105611 IP 81.198.101.144.8333 > tom-Latitude-3570.60988: tcp 0
09:11:02.194985 IP 81.198.101.144.8333 > tom-Latitude-3570.60988: tcp 24
09:11:02.195002 IP tom-Latitude-3570.60988 > 81.198.101.144.8333: tcp 0
09:11:02.195020 IP 81.198.101.144.8333 > tom-Latitude-3570.60988: tcp 73
09:11:02.195023 IP tom-Latitude-3570.60988 > 81.198.101.144.8333: tcp 0
09:11:02.195230 IP tom-Latitude-3570.60988 > 81.198.101.144.8333: tcp 24
09:11:02.196006 IP tom-Latitude-3570.60988 > 81.198.101.144.8333: tcp 538
09:11:02.228691 IP 81.198.101.144.8333 > tom-Latitude-3570.60988: tcp 0
09:11:02.251670 IP 81.198.101.144.8333 > tom-Latitude-3570.60988: tcp 0
09:11:02.295747 IP tom-Latitude-3570.46284 > static-87-75-105-186.vodafonexdsl.co.uk.8333: tcp 24
09:11:02.296341 IP tom-Latitude-3570.46284 > static-87-75-105-186.vodafonexdsl.co.uk.8333: tcp 253
09:11:02.324518 IP static-87-75-105-186.vodafonexdsl.co.uk.8333 > tom-Latitude-3570.46284: tcp 0
09:11:02.328151 IP static-87-75-105-186.vodafonexdsl.co.uk.8333 > tom-Latitude-3570.46284: tcp 0
09:11:02.366564 IP static-87-75-105-186.vodafonexdsl.co.uk.8333 > tom-Latitude-3570.46284: tcp 24
09:11:02.366581 IP tom-Latitude-3570.46284 > static-87-75-105-186.vodafonexdsl.co.uk.8333: tcp 0
09:11:02.375071 IP static-87-75-105-186.vodafonexdsl.co.uk.8333 > tom-Latitude-3570.46284: tcp 361
09:11:02.375095 IP tom-Latitude-3570.46284 > static-87-75-105-186.vodafonexdsl.co.uk.8333: tcp 0
09:11:02.375396 IP tom-Latitude-3570.56714 > ns3113832.ip-54-38-177.eu.8333: tcp 24
09:11:02.375552 IP tom-Latitude-3570.46284 > static-87-75-105-186.vodafonexdsl.co.uk.8333: tcp 24
09:11:02.375725 IP tom-Latitude-3570.56714 > ns3113832.ip-54-38-177.eu.8333: tcp 253
09:11:02.375973 IP tom-Latitude-3570.46284 > static-87-75-105-186.vodafonexdsl.co.uk.8333: tcp 109
09:11:02.417233 IP ns3113832.ip-54-38-177.eu.8333 > tom-Latitude-3570.56714: tcp 0
09:11:02.417370 IP ns3113832.ip-54-38-177.eu.8333 > tom-Latitude-3570.56714: tcp 0
09:11:02.417375 IP static-87-75-105-186.vodafonexdsl.co.uk.8333 > tom-Latitude-3570.46284: tcp 0
09:11:02.484700 IP static-87-75-105-186.vodafonexdsl.co.uk.8333 > tom-Latitude-3570.46284: tcp 24
09:11:02.484938 IP static-87-75-105-186.vodafonexdsl.co.uk.8333 > tom-Latitude-3570.46284: tcp 557
09:11:02.484948 IP static-87-75-105-186.vodafonexdsl.co.uk.8333 > tom-Latitude-3570.46284: tcp 24
09:11:02.484952 IP static-87-75-105-186.vodafonexdsl.co.uk.8333 > tom-Latitude-3570.46284: tcp 192
09:11:02.484954 IP static-87-75-105-186.vodafonexdsl.co.uk.8333 > tom-Latitude-3570.46284: tcp 24
09:11:02.484955 IP tom-Latitude-3570.46284 > static-87-75-105-186.vodafonexdsl.co.uk.8333: tcp 0
09:11:02.484991 IP tom-Latitude-3570.46284 > static-87-75-105-186.vodafonexdsl.co.uk.8333: tcp 0
09:11:02.487547 IP static-87-75-105-186.vodafonexdsl.co.uk.8333 > tom-Latitude-3570.46284: tcp 226
09:11:02.527905 IP tom-Latitude-3570.46284 > static-87-75-105-186.vodafonexdsl.co.uk.8333: tcp 0
09:11:02.788918 IP tom-Latitude-3570.39110 > vmi195435.contaboserver.net.8333: tcp 24
09:11:02.788990 IP tom-Latitude-3570.56714 > ns3113832.ip-54-38-177.eu.8333: tcp 24
09:11:02.789013 IP tom-Latitude-3570.46284 > static-87-75-105-186.vodafonexdsl.co.uk.8333: tcp 24
09:11:02.790668 IP tom-Latitude-3570.39110 > vmi195435.contaboserver.net.8333: tcp 31
09:11:02.790738 IP tom-Latitude-3570.56714 > ns3113832.ip-54-38-177.eu.8333: tcp 109
09:11:02.791442 IP tom-Latitude-3570.46284 > static-87-75-105-186.vodafonexdsl.co.uk.8333: tcp 8
09:11:02.837046 IP vmi195435.contaboserver.net.8333 > tom-Latitude-3570.39110: tcp 0
09:11:02.840872 IP ns3113832.ip-54-38-177.eu.8333 > tom-Latitude-3570.56714: tcp 0
09:11:02.840885 IP ns3113832.ip-54-38-177.eu.8333 > tom-Latitude-3570.56714: tcp 0
09:11:02.840887 IP vmi195435.contaboserver.net.8333 > tom-Latitude-3570.39110: tcp 0
09:11:02.854534 IP static-87-75-105-186.vodafonexdsl.co.uk.8333 > tom-Latitude-3570.46284: tcp 0
09:11:02.906322 IP static-87-75-105-186.vodafonexdsl.co.uk.8333 > tom-Latitude-3570.46284: tcp 24
09:11:02.906345 IP tom-Latitude-3570.46284 > static-87-75-105-186.vodafonexdsl.co.uk.8333: tcp 0
09:11:02.911598 IP static-87-75-105-186.vodafonexdsl.co.uk.8333 > tom-Latitude-3570.46284: tcp 8
09:11:02.911614 IP tom-Latitude-3570.46284 > static-87-75-105-186.vodafonexdsl.co.uk.8333: tcp 0
09:11:03.112703 IP tom-Latitude-3570.57976 > 167.99.216.145.8333: tcp 24
09:11:03.114808 IP tom-Latitude-3570.57976 > 167.99.216.145.8333: tcp 361
09:11:03.131651 IP vmi195435.contaboserver.net.8333 > tom-Latitude-3570.39110: tcp 24
09:11:03.132608 IP vmi195435.contaboserver.net.8333 > tom-Latitude-3570.39110: tcp 181
09:11:03.132735 IP tom-Latitude-3570.39110 > vmi195435.contaboserver.net.8333: tcp 0
09:11:03.132944 IP tom-Latitude-3570.39110 > vmi195435.contaboserver.net.8333: tcp 24
09:11:03.133739 IP tom-Latitude-3570.39110 > vmi195435.contaboserver.net.8333: tcp 73
09:11:03.149033 IP 167.99.216.145.8333 > tom-Latitude-3570.57976: tcp 0
09:11:03.152802 IP 167.99.216.145.8333 > tom-Latitude-3570.57976: tcp 0
09:11:03.193827 IP vmi195435.contaboserver.net.8333 > tom-Latitude-3570.39110: tcp 0
09:11:03.193842 IP vmi195435.contaboserver.net.8333 > tom-Latitude-3570.39110: tcp 0
09:11:03.276638 IP vmi195435.contaboserver.net.8333 > tom-Latitude-3570.39110: tcp 24
09:11:03.276658 IP vmi195435.contaboserver.net.8333 > tom-Latitude-3570.39110: tcp 256
09:11:03.276662 IP vmi195435.contaboserver.net.8333 > tom-Latitude-3570.39110: tcp 24
09:11:03.276665 IP vmi195435.contaboserver.net.8333 > tom-Latitude-3570.39110: tcp 256
09:11:03.276748 IP tom-Latitude-3570.39110 > vmi195435.contaboserver.net.8333: tcp 0
09:11:03.478094 IP tom-Latitude-3570.60470 > bb42-60-217-183.singnet.com.sg.8333: tcp 24
09:11:03.480095 IP tom-Latitude-3570.60470 > bb42-60-217-183.singnet.com.sg.8333: tcp 469
09:11:03.516757 IP bb42-60-217-183.singnet.com.sg.8333 > tom-Latitude-3570.60470: tcp 0
09:11:03.516774 IP bb42-60-217-183.singnet.com.sg.8333 > tom-Latitude-3570.60470: tcp 0
09:11:04.070594 IP 81.198.101.144.8333 > tom-Latitude-3570.60988: tcp 24
09:11:04.070615 IP 81.198.101.144.8333 > tom-Latitude-3570.60988: tcp 289
09:11:04.070704 IP tom-Latitude-3570.60988 > 81.198.101.144.8333: tcp 0
09:11:04.070956 IP tom-Latitude-3570.60988 > 81.198.101.144.8333: tcp 24
09:11:04.071292 IP tom-Latitude-3570.60988 > 81.198.101.144.8333: tcp 109
09:11:04.102413 IP 81.198.101.144.8333 > tom-Latitude-3570.60988: tcp 0
09:11:04.115796 IP 81.198.101.144.8333 > tom-Latitude-3570.60988: tcp 0
09:11:04.202970 IP 81.198.101.144.8333 > tom-Latitude-3570.60988: tcp 24
09:11:04.202991 IP 81.198.101.144.8333 > tom-Latitude-3570.60988: tcp 225
09:11:04.203083 IP tom-Latitude-3570.60988 > 81.198.101.144.8333: tcp 0
09:11:04.203156 IP 81.198.101.144.8333 > tom-Latitude-3570.60988: tcp 24
09:11:04.203182 IP 81.198.101.144.8333 > tom-Latitude-3570.60988: tcp 222
09:11:04.203210 IP 81.198.101.144.8333 > tom-Latitude-3570.60988: tcp 24
09:11:04.203215 IP 81.198.101.144.8333 > tom-Latitude-3570.60988: tcp 225
09:11:04.203260 IP tom-Latitude-3570.60988 > 81.198.101.144.8333: tcp 0
09:11:04.480192 IP static-87-75-105-186.vodafonexdsl.co.uk.8333 > tom-Latitude-3570.46284: tcp 24
09:11:04.480209 IP tom-Latitude-3570.46284 > static-87-75-105-186.vodafonexdsl.co.uk.8333: tcp 0
09:11:04.480227 IP static-87-75-105-186.vodafonexdsl.co.uk.8333 > tom-Latitude-3570.46284: tcp 181
09:11:04.480231 IP tom-Latitude-3570.46284 > static-87-75-105-186.vodafonexdsl.co.uk.8333: tcp 0
09:11:04.580925 IP tom-Latitude-3570.56714 > ns3113832.ip-54-38-177.eu.8333: tcp 24
09:11:04.581781 IP tom-Latitude-3570.56714 > ns3113832.ip-54-38-177.eu.8333: tcp 181
09:11:04.612519 IP ns3113832.ip-54-38-177.eu.8333 > tom-Latitude-3570.56714: tcp 0
09:11:04.612536 IP ns3113832.ip-54-38-177.eu.8333 > tom-Latitude-3570.56714: tcp 0
09:11:04.643484 IP bb42-60-217-183.singnet.com.sg.8333 > tom-Latitude-3570.60470: tcp 24
09:11:04.643505 IP bb42-60-217-183.singnet.com.sg.8333 > tom-Latitude-3570.60470: tcp 73
09:11:04.643596 IP tom-Latitude-3570.60470 > bb42-60-217-183.singnet.com.sg.8333: tcp 0
09:11:04.844545 IP tom-Latitude-3570.60470 > bb42-60-217-183.singnet.com.sg.8333: tcp 24
09:11:04.846319 IP tom-Latitude-3570.60470 > bb42-60-217-183.singnet.com.sg.8333: tcp 37
09:11:04.889688 IP bb42-60-217-183.singnet.com.sg.8333 > tom-Latitude-3570.60470: tcp 0
09:11:04.893085 IP bb42-60-217-183.singnet.com.sg.8333 > tom-Latitude-3570.60470: tcp 0
09:11:04.944978 IP tom-Latitude-3570.39110 > vmi195435.contaboserver.net.8333: tcp 24
09:11:04.945583 IP tom-Latitude-3570.39110 > vmi195435.contaboserver.net.8333: tcp 109
09:11:04.974318 IP vmi195435.contaboserver.net.8333 > tom-Latitude-3570.39110: tcp 0
09:11:04.977929 IP vmi195435.contaboserver.net.8333 > tom-Latitude-3570.39110: tcp 0
09:11:05.246076 IP tom-Latitude-3570.42516 > 2.56.9.15.8333: tcp 24
09:11:05.247795 IP tom-Latitude-3570.42516 > 2.56.9.15.8333: tcp 361
09:11:05.281532 IP 2.56.9.15.8333 > tom-Latitude-3570.42516: tcp 0
09:11:05.285268 IP 2.56.9.15.8333 > tom-Latitude-3570.42516: tcp 0
09:11:05.913780 IP bb42-60-217-183.singnet.com.sg.8333 > tom-Latitude-3570.60470: tcp 24
09:11:05.913800 IP bb42-60-217-183.singnet.com.sg.8333 > tom-Latitude-3570.60470: tcp 37
09:11:05.913913 IP tom-Latitude-3570.60470 > bb42-60-217-183.singnet.com.sg.8333: tcp 0
09:11:05.914095 IP tom-Latitude-3570.60470 > bb42-60-217-183.singnet.com.sg.8333: tcp 24
09:11:05.914726 IP tom-Latitude-3570.60470 > bb42-60-217-183.singnet.com.sg.8333: tcp 37
09:11:05.961579 IP bb42-60-217-183.singnet.com.sg.8333 > tom-Latitude-3570.60470: tcp 0
09:11:05.965168 IP bb42-60-217-183.singnet.com.sg.8333 > tom-Latitude-3570.60470: tcp 0
09:11:06.528482 IP bb42-60-217-183.singnet.com.sg.8333 > tom-Latitude-3570.60470: tcp 24
09:11:06.528597 IP bb42-60-217-183.singnet.com.sg.8333 > tom-Latitude-3570.60470: tcp 247
09:11:06.528622 IP tom-Latitude-3570.60470 > bb42-60-217-183.singnet.com.sg.8333: tcp 0
09:11:06.732974 IP ns3113832.ip-54-38-177.eu.8333 > tom-Latitude-3570.56714: tcp 24
09:11:06.732995 IP ns3113832.ip-54-38-177.eu.8333 > tom-Latitude-3570.56714: tcp 145
09:11:06.733087 IP tom-Latitude-3570.56714 > ns3113832.ip-54-38-177.eu.8333: tcp 0
09:11:06.733314 IP tom-Latitude-3570.56714 > ns3113832.ip-54-38-177.eu.8333: tcp 24
09:11:06.733866 IP tom-Latitude-3570.56714 > ns3113832.ip-54-38-177.eu.8333: tcp 109
09:11:06.788589 IP ns3113832.ip-54-38-177.eu.8333 > tom-Latitude-3570.56714: tcp 0
09:11:06.824426 IP ns3113832.ip-54-38-177.eu.8333 > tom-Latitude-3570.56714: tcp 0
09:11:06.882722 IP ns3113832.ip-54-38-177.eu.8333 > tom-Latitude-3570.56714: tcp 24
09:11:06.882744 IP ns3113832.ip-54-38-177.eu.8333 > tom-Latitude-3570.56714: tcp 192
09:11:06.882748 IP ns3113832.ip-54-38-177.eu.8333 > tom-Latitude-3570.56714: tcp 24
09:11:06.882751 IP ns3113832.ip-54-38-177.eu.8333 > tom-Latitude-3570.56714: tcp 255
09:11:06.882774 IP ns3113832.ip-54-38-177.eu.8333 > tom-Latitude-3570.56714: tcp 24
09:11:06.882840 IP tom-Latitude-3570.56714 > ns3113832.ip-54-38-177.eu.8333: tcp 0
09:11:06.883019 IP ns3113832.ip-54-38-177.eu.8333 > tom-Latitude-3570.56714: tcp 225
09:11:06.923906 IP tom-Latitude-3570.56714 > ns3113832.ip-54-38-177.eu.8333: tcp 0
09:11:07.553369 IP bb42-60-217-183.singnet.com.sg.8333 > tom-Latitude-3570.60470: tcp 24
09:11:07.554531 IP bb42-60-217-183.singnet.com.sg.8333 > tom-Latitude-3570.60470: tcp 289
09:11:07.554662 IP tom-Latitude-3570.60470 > bb42-60-217-183.singnet.com.sg.8333: tcp 0
09:11:07.554826 IP tom-Latitude-3570.39110 > vmi195435.contaboserver.net.8333: tcp 24
09:11:07.554993 IP tom-Latitude-3570.60470 > bb42-60-217-183.singnet.com.sg.8333: tcp 24
09:11:07.555370 IP tom-Latitude-3570.39110 > vmi195435.contaboserver.net.8333: tcp 145
09:11:07.555657 IP tom-Latitude-3570.60470 > bb42-60-217-183.singnet.com.sg.8333: tcp 181
09:11:07.620551 IP vmi195435.contaboserver.net.8333 > tom-Latitude-3570.39110: tcp 0
09:11:07.638211 IP bb42-60-217-183.singnet.com.sg.8333 > tom-Latitude-3570.60470: tcp 0
09:11:07.899904 IP tom-Latitude-3570.39110 > vmi195435.contaboserver.net.8333: tcp 145
09:11:07.903878 IP bb42-60-217-183.singnet.com.sg.8333 > tom-Latitude-3570.60470: tcp 0
09:11:07.903893 IP vmi195435.contaboserver.net.8333 > tom-Latitude-3570.39110: tcp 0
09:11:08.071974 IP vmi195435.contaboserver.net.8333 > tom-Latitude-3570.39110: tcp 0
09:11:08.071992 IP ns3113832.ip-54-38-177.eu.8333 > tom-Latitude-3570.56714: tcp 24
09:11:08.072009 IP tom-Latitude-3570.56714 > ns3113832.ip-54-38-177.eu.8333: tcp 0
09:11:08.072038 IP ns3113832.ip-54-38-177.eu.8333 > tom-Latitude-3570.56714: tcp 289
09:11:08.072042 IP tom-Latitude-3570.56714 > ns3113832.ip-54-38-177.eu.8333: tcp 0
09:11:08.072371 IP tom-Latitude-3570.56714 > ns3113832.ip-54-38-177.eu.8333: tcp 24
09:11:08.092699 IP tom-Latitude-3570.56714 > ns3113832.ip-54-38-177.eu.8333: tcp 109
09:11:08.140205 IP bb42-60-217-183.singnet.com.sg.8333 > tom-Latitude-3570.60470: tcp 24
09:11:08.143395 IP bb42-60-217-183.singnet.com.sg.8333 > tom-Latitude-3570.60470: tcp 247
09:11:08.143414 IP bb42-60-217-183.singnet.com.sg.8333 > tom-Latitude-3570.60470: tcp 24
09:11:08.143417 IP bb42-60-217-183.singnet.com.sg.8333 > tom-Latitude-3570.60470: tcp 735
09:11:08.143420 IP bb42-60-217-183.singnet.com.sg.8333 > tom-Latitude-3570.60470: tcp 24
09:11:08.143507 IP tom-Latitude-3570.60470 > bb42-60-217-183.singnet.com.sg.8333: tcp 0
09:11:08.147501 IP bb42-60-217-183.singnet.com.sg.8333 > tom-Latitude-3570.60470: tcp 591
09:11:08.147517 IP bb42-60-217-183.singnet.com.sg.8333 > tom-Latitude-3570.60470: tcp 24
09:11:08.147583 IP tom-Latitude-3570.60470 > bb42-60-217-183.singnet.com.sg.8333: tcp 0
09:11:08.157286 IP bb42-60-217-183.singnet.com.sg.8333 > tom-Latitude-3570.60470: tcp 816
09:11:08.157459 IP bb42-60-217-183.singnet.com.sg.8333 > tom-Latitude-3570.60470: tcp 24
09:11:08.157502 IP tom-Latitude-3570.60470 > bb42-60-217-183.singnet.com.sg.8333: tcp 0
09:11:08.158426 IP bb42-60-217-183.singnet.com.sg.8333 > tom-Latitude-3570.60470: tcp 226
09:11:08.174603 IP static-87-75-105-186.vodafonexdsl.co.uk.8333 > tom-Latitude-3570.46284: tcp 24
09:11:08.174652 IP tom-Latitude-3570.46284 > static-87-75-105-186.vodafonexdsl.co.uk.8333: tcp 0
09:11:08.174671 IP ns3113832.ip-54-38-177.eu.8333 > tom-Latitude-3570.56714: tcp 0
09:11:08.178951 IP ns3113832.ip-54-38-177.eu.8333 > tom-Latitude-3570.56714: tcp 0
09:11:08.189136 IP static-87-75-105-186.vodafonexdsl.co.uk.8333 > tom-Latitude-3570.46284: tcp 469
09:11:08.189162 IP tom-Latitude-3570.46284 > static-87-75-105-186.vodafonexdsl.co.uk.8333: tcp 0
09:11:08.189471 IP tom-Latitude-3570.46284 > static-87-75-105-186.vodafonexdsl.co.uk.8333: tcp 24
09:11:08.189788 IP tom-Latitude-3570.46284 > static-87-75-105-186.vodafonexdsl.co.uk.8333: tcp 37
09:11:08.199783 IP tom-Latitude-3570.60470 > bb42-60-217-183.singnet.com.sg.8333: tcp 0
09:11:08.224617 IP static-87-75-105-186.vodafonexdsl.co.uk.8333 > tom-Latitude-3570.46284: tcp 0
09:11:08.249426 IP ns3113832.ip-54-38-177.eu.8333 > tom-Latitude-3570.56714: tcp 24
09:11:08.249434 IP ns3113832.ip-54-38-177.eu.8333 > tom-Latitude-3570.56714: tcp 247
09:11:08.249438 IP ns3113832.ip-54-38-177.eu.8333 > tom-Latitude-3570.56714: tcp 24
09:11:08.249450 IP tom-Latitude-3570.56714 > ns3113832.ip-54-38-177.eu.8333: tcp 0
09:11:08.249810 IP ns3113832.ip-54-38-177.eu.8333 > tom-Latitude-3570.56714: tcp 1350
09:11:08.249816 IP ns3113832.ip-54-38-177.eu.8333 > tom-Latitude-3570.56714: tcp 370
09:11:08.249819 IP ns3113832.ip-54-38-177.eu.8333 > tom-Latitude-3570.56714: tcp 24
09:11:08.249822 IP ns3113832.ip-54-38-177.eu.8333 > tom-Latitude-3570.56714: tcp 226
09:11:08.249832 IP tom-Latitude-3570.56714 > ns3113832.ip-54-38-177.eu.8333: tcp 0
09:11:08.290567 IP static-87-75-105-186.vodafonexdsl.co.uk.8333 > tom-Latitude-3570.46284: tcp 24
09:11:08.300796 IP static-87-75-105-186.vodafonexdsl.co.uk.8333 > tom-Latitude-3570.46284: tcp 226
09:11:08.300862 IP tom-Latitude-3570.46284 > static-87-75-105-186.vodafonexdsl.co.uk.8333: tcp 0
09:11:08.602493 IP tom-Latitude-3570.42516 > 2.56.9.15.8333: tcp 24
09:11:08.604114 IP tom-Latitude-3570.42516 > 2.56.9.15.8333: tcp 469
09:11:08.676019 IP 2.56.9.15.8333 > tom-Latitude-3570.42516: tcp 0
09:11:08.737389 IP 2.56.9.15.8333 > tom-Latitude-3570.42516: tcp 24
09:11:08.737406 IP tom-Latitude-3570.42516 > 2.56.9.15.8333: tcp 0
09:11:08.737426 IP 2.56.9.15.8333 > tom-Latitude-3570.42516: tcp 505
09:11:08.737433 IP tom-Latitude-3570.42516 > 2.56.9.15.8333: tcp 0
09:11:08.737727 IP tom-Latitude-3570.42516 > 2.56.9.15.8333: tcp 24
09:11:08.737748 IP tom-Latitude-3570.42516 > 2.56.9.15.8333: tcp 37
09:11:08.739640 IP 2.56.9.15.8333 > tom-Latitude-3570.42516: tcp 0
09:11:08.818929 IP 2.56.9.15.8333 > tom-Latitude-3570.42516: tcp 0
09:11:08.848738 IP vmi195435.contaboserver.net.8333 > tom-Latitude-3570.39110: tcp 24
09:11:08.863810 IP vmi195435.contaboserver.net.8333 > tom-Latitude-3570.39110: tcp 397
09:11:08.863830 IP tom-Latitude-3570.39110 > vmi195435.contaboserver.net.8333: tcp 0
09:11:08.863955 IP tom-Latitude-3570.39110 > vmi195435.contaboserver.net.8333: tcp 24
09:11:08.864392 IP tom-Latitude-3570.39110 > vmi195435.contaboserver.net.8333: tcp 37
09:11:08.868253 IP 2.56.9.15.8333 > tom-Latitude-3570.42516: tcp 0
09:11:08.948386 IP vmi195435.contaboserver.net.8333 > tom-Latitude-3570.39110: tcp 0
09:11:08.966288 IP 2.56.9.15.8333 > tom-Latitude-3570.42516: tcp 24
09:11:08.966296 IP 2.56.9.15.8333 > tom-Latitude-3570.42516: tcp 224
09:11:08.966311 IP tom-Latitude-3570.42516 > 2.56.9.15.8333: tcp 0
09:11:08.978563 IP vmi195435.contaboserver.net.8333 > tom-Latitude-3570.39110: tcp 0
09:11:09.060484 IP vmi195435.contaboserver.net.8333 > tom-Latitude-3570.39110: tcp 24
09:11:09.061974 IP vmi195435.contaboserver.net.8333 > tom-Latitude-3570.39110: tcp 226
09:11:09.062034 IP tom-Latitude-3570.39110 > vmi195435.contaboserver.net.8333: tcp 0
09:11:09.162858 IP tom-Latitude-3570.60988 > 81.198.101.144.8333: tcp 24
09:11:09.164032 IP tom-Latitude-3570.60988 > 81.198.101.144.8333: tcp 541
09:11:09.219522 IP 81.198.101.144.8333 > tom-Latitude-3570.60988: tcp 0
09:11:09.268963 IP 81.198.101.144.8333 > tom-Latitude-3570.60988: tcp 0
09:11:09.362553 IP 81.198.101.144.8333 > tom-Latitude-3570.60988: tcp 24
09:11:09.363505 IP 81.198.101.144.8333 > tom-Latitude-3570.60988: tcp 73
09:11:09.363572 IP tom-Latitude-3570.60988 > 81.198.101.144.8333: tcp 0
09:11:09.363726 IP tom-Latitude-3570.60988 > 81.198.101.144.8333: tcp 24
09:11:09.364410 IP tom-Latitude-3570.60988 > 81.198.101.144.8333: tcp 474
09:11:09.440431 IP static-87-75-105-186.vodafonexdsl.co.uk.8333 > tom-Latitude-3570.46284: tcp 24
09:11:09.444288 IP static-87-75-105-186.vodafonexdsl.co.uk.8333 > tom-Latitude-3570.46284: tcp 73
09:11:09.444308 IP 81.198.101.144.8333 > tom-Latitude-3570.60988: tcp 0
09:11:09.444353 IP tom-Latitude-3570.46284 > static-87-75-105-186.vodafonexdsl.co.uk.8333: tcp 0
09:11:09.542163 IP 81.198.101.144.8333 > tom-Latitude-3570.60988: tcp 0
09:11:09.845880 IP tom-Latitude-3570.56714 > ns3113832.ip-54-38-177.eu.8333: tcp 24
09:11:09.845923 IP tom-Latitude-3570.42516 > 2.56.9.15.8333: tcp 24
09:11:09.849423 IP tom-Latitude-3570.56714 > ns3113832.ip-54-38-177.eu.8333: tcp 109
09:11:09.849546 IP tom-Latitude-3570.42516 > 2.56.9.15.8333: tcp 37
09:11:09.880996 IP ns3113832.ip-54-38-177.eu.8333 > tom-Latitude-3570.56714: tcp 0
09:11:09.884374 IP 2.56.9.15.8333 > tom-Latitude-3570.42516: tcp 0
09:11:09.887964 IP ns3113832.ip-54-38-177.eu.8333 > tom-Latitude-3570.56714: tcp 0
09:11:09.887980 IP 2.56.9.15.8333 > tom-Latitude-3570.42516: tcp 0
09:11:10.648448 IP tom-Latitude-3570.60470 > bb42-60-217-183.singnet.com.sg.8333: tcp 24
09:11:10.650344 IP tom-Latitude-3570.60470 > bb42-60-217-183.singnet.com.sg.8333: tcp 217
09:11:10.682988 IP bb42-60-217-183.singnet.com.sg.8333 > tom-Latitude-3570.60470: tcp 0
09:11:10.683003 IP bb42-60-217-183.singnet.com.sg.8333 > tom-Latitude-3570.60470: tcp 0
09:11:10.692685 IP c-185-45-236-223.customer.ggaweb.ch.8333 > tom-Latitude-3570.49070: tcp 24
09:11:10.733384 IP c-185-45-236-223.customer.ggaweb.ch.8333 > tom-Latitude-3570.49070: tcp 1189
09:11:10.733409 IP tom-Latitude-3570.49070 > c-185-45-236-223.customer.ggaweb.ch.8333: tcp 0
09:11:10.733806 IP tom-Latitude-3570.49070 > c-185-45-236-223.customer.ggaweb.ch.8333: tcp 24
09:11:10.734871 IP tom-Latitude-3570.49070 > c-185-45-236-223.customer.ggaweb.ch.8333: tcp 109
09:11:10.768254 IP c-185-45-236-223.customer.ggaweb.ch.8333 > tom-Latitude-3570.49070: tcp 0
09:11:10.812113 IP c-185-45-236-223.customer.ggaweb.ch.8333 > tom-Latitude-3570.49070: tcp 0
09:11:10.884790 IP c-185-45-236-223.customer.ggaweb.ch.8333 > tom-Latitude-3570.49070: tcp 24
09:11:10.887234 IP c-185-45-236-223.customer.ggaweb.ch.8333 > tom-Latitude-3570.49070: tcp 1448
09:11:10.887242 IP c-185-45-236-223.customer.ggaweb.ch.8333 > tom-Latitude-3570.49070: tcp 1115
09:11:10.887246 IP c-185-45-236-223.customer.ggaweb.ch.8333 > tom-Latitude-3570.49070: tcp 397
09:11:10.887257 IP tom-Latitude-3570.49070 > c-185-45-236-223.customer.ggaweb.ch.8333: tcp 0
09:11:10.990169 IP tom-Latitude-3570.56714 > ns3113832.ip-54-38-177.eu.8333: tcp 24
09:11:10.991671 IP tom-Latitude-3570.56714 > ns3113832.ip-54-38-177.eu.8333: tcp 109
09:11:11.022913 IP ns3113832.ip-54-38-177.eu.8333 > tom-Latitude-3570.56714: tcp 0
09:11:11.041727 IP ns3113832.ip-54-38-177.eu.8333 > tom-Latitude-3570.56714: tcp 0
09:11:11.090563 IP tom-Latitude-3570.49070 > c-185-45-236-223.customer.ggaweb.ch.8333: tcp 24
09:11:11.091670 IP tom-Latitude-3570.49070 > c-185-45-236-223.customer.ggaweb.ch.8333: tcp 31
09:11:11.122588 IP c-185-45-236-223.customer.ggaweb.ch.8333 > tom-Latitude-3570.49070: tcp 0
09:11:11.122604 IP c-185-45-236-223.customer.ggaweb.ch.8333 > tom-Latitude-3570.49070: tcp 0
09:11:12.057715 IP vmi195435.contaboserver.net.8333 > tom-Latitude-3570.39110: tcp 24
09:11:12.057738 IP vmi195435.contaboserver.net.8333 > tom-Latitude-3570.39110: tcp 181
09:11:12.057776 IP vmi195435.contaboserver.net.8333 > tom-Latitude-3570.39110: tcp 181
09:11:12.057785 IP tom-Latitude-3570.39110 > vmi195435.contaboserver.net.8333: tcp 0
09:11:12.057996 IP tom-Latitude-3570.39110 > vmi195435.contaboserver.net.8333: tcp 24
09:11:12.058469 IP tom-Latitude-3570.39110 > vmi195435.contaboserver.net.8333: tcp 73
09:11:12.094453 IP vmi195435.contaboserver.net.8333 > tom-Latitude-3570.39110: tcp 0
09:11:12.115619 IP vmi195435.contaboserver.net.8333 > tom-Latitude-3570.39110: tcp 0
09:11:12.172537 IP 167.99.216.145.8333 > tom-Latitude-3570.57976: tcp 24
09:11:12.172563 IP tom-Latitude-3570.57976 > 167.99.216.145.8333: tcp 0
09:11:12.172615 IP 167.99.216.145.8333 > tom-Latitude-3570.57976: tcp 901
09:11:12.172622 IP tom-Latitude-3570.57976 > 167.99.216.145.8333: tcp 0
09:11:12.212716 IP vmi195435.contaboserver.net.8333 > tom-Latitude-3570.39110: tcp 24
09:11:12.247385 IP vmi195435.contaboserver.net.8333 > tom-Latitude-3570.39110: tcp 1448
09:11:12.247395 IP tom-Latitude-3570.39110 > vmi195435.contaboserver.net.8333: tcp 0
09:11:12.247404 IP vmi195435.contaboserver.net.8333 > tom-Latitude-3570.39110: tcp 371
09:11:12.247407 IP vmi195435.contaboserver.net.8333 > tom-Latitude-3570.39110: tcp 24
09:11:12.247411 IP vmi195435.contaboserver.net.8333 > tom-Latitude-3570.39110: tcp 191
09:11:12.247428 IP tom-Latitude-3570.39110 > vmi195435.contaboserver.net.8333: tcp 0
09:11:12.451038 IP tom-Latitude-3570.60988 > 81.198.101.144.8333: tcp 24
09:11:12.454179 IP tom-Latitude-3570.60988 > 81.198.101.144.8333: tcp 181
09:11:12.486635 IP 81.198.101.144.8333 > tom-Latitude-3570.60988: tcp 0
09:11:12.486650 IP 81.198.101.144.8333 > tom-Latitude-3570.60988: tcp 0
09:11:12.852282 IP tom-Latitude-3570.56714 > ns3113832.ip-54-38-177.eu.8333: tcp 24
09:11:12.854066 IP tom-Latitude-3570.56714 > ns3113832.ip-54-38-177.eu.8333: tcp 73
09:11:12.886695 IP ns3113832.ip-54-38-177.eu.8333 > tom-Latitude-3570.56714: tcp 0
09:11:12.886730 IP ns3113832.ip-54-38-177.eu.8333 > tom-Latitude-3570.56714: tcp 0
09:11:13.554512 IP tom-Latitude-3570.46284 > static-87-75-105-186.vodafonexdsl.co.uk.8333: tcp 24
09:11:13.556358 IP vmi195435.contaboserver.net.8333 > tom-Latitude-3570.39110: tcp 24
09:11:13.556378 IP vmi195435.contaboserver.net.8333 > tom-Latitude-3570.39110: tcp 73
09:11:13.556382 IP 2.56.9.15.8333 > tom-Latitude-3570.42516: tcp 24
09:11:13.556397 IP tom-Latitude-3570.46284 > static-87-75-105-186.vodafonexdsl.co.uk.8333: tcp 181
09:11:13.556416 IP tom-Latitude-3570.39110 > vmi195435.contaboserver.net.8333: tcp 0
09:11:13.556573 IP 2.56.9.15.8333 > tom-Latitude-3570.42516: tcp 253
09:11:13.556588 IP tom-Latitude-3570.39110 > vmi195435.contaboserver.net.8333: tcp 24
09:11:13.556595 IP c-185-45-236-223.customer.ggaweb.ch.8333 > tom-Latitude-3570.49070: tcp 24
09:11:13.556602 IP c-185-45-236-223.customer.ggaweb.ch.8333 > tom-Latitude-3570.49070: tcp 145
09:11:13.556608 IP vmi195435.contaboserver.net.8333 > tom-Latitude-3570.39110: tcp 73
09:11:13.556615 IP tom-Latitude-3570.39110 > vmi195435.contaboserver.net.8333: tcp 0
09:11:13.556650 IP tom-Latitude-3570.42516 > 2.56.9.15.8333: tcp 0
09:11:13.556680 IP tom-Latitude-3570.49070 > c-185-45-236-223.customer.ggaweb.ch.8333: tcp 0
09:11:13.556772 IP tom-Latitude-3570.42516 > 2.56.9.15.8333: tcp 24
09:11:13.560291 IP tom-Latitude-3570.39110 > vmi195435.contaboserver.net.8333: tcp 73
09:11:13.561501 IP tom-Latitude-3570.42516 > 2.56.9.15.8333: tcp 73
09:11:13.611372 IP static-87-75-105-186.vodafonexdsl.co.uk.8333 > tom-Latitude-3570.46284: tcp 0
09:11:13.611528 IP vmi195435.contaboserver.net.8333 > tom-Latitude-3570.39110: tcp 0
09:11:13.614498 IP 2.56.9.15.8333 > tom-Latitude-3570.42516: tcp 0
09:11:13.626293 IP 2.56.9.15.8333 > tom-Latitude-3570.42516: tcp 0
09:11:13.626397 IP vmi195435.contaboserver.net.8333 > tom-Latitude-3570.39110: tcp 0
09:11:13.900903 IP 167.99.216.145.8333 > tom-Latitude-3570.57976: tcp 24
09:11:13.900920 IP tom-Latitude-3570.57976 > 167.99.216.145.8333: tcp 0
09:11:13.903992 IP 167.99.216.145.8333 > tom-Latitude-3570.57976: tcp 109
09:11:13.904019 IP tom-Latitude-3570.57976 > 167.99.216.145.8333: tcp 0
09:11:13.904034 IP 2.56.9.15.8333 > tom-Latitude-3570.42516: tcp 24
09:11:13.904307 IP tom-Latitude-3570.57976 > 167.99.216.145.8333: tcp 24
09:11:13.905499 IP tom-Latitude-3570.57976 > 167.99.216.145.8333: tcp 37
09:11:13.907704 IP 2.56.9.15.8333 > tom-Latitude-3570.42516: tcp 902
09:11:13.907718 IP 2.56.9.15.8333 > tom-Latitude-3570.42516: tcp 24
09:11:13.907758 IP tom-Latitude-3570.42516 > 2.56.9.15.8333: tcp 0
09:11:13.908029 IP 2.56.9.15.8333 > tom-Latitude-3570.42516: tcp 1368
09:11:13.908041 IP 2.56.9.15.8333 > tom-Latitude-3570.42516: tcp 392
09:11:13.908085 IP tom-Latitude-3570.42516 > 2.56.9.15.8333: tcp 0
09:11:13.925324 IP bb42-60-217-183.singnet.com.sg.8333 > tom-Latitude-3570.60470: tcp 24
09:11:13.925349 IP tom-Latitude-3570.60470 > bb42-60-217-183.singnet.com.sg.8333: tcp 0
09:11:13.927331 IP bb42-60-217-183.singnet.com.sg.8333 > tom-Latitude-3570.60470: tcp 289
09:11:13.927357 IP tom-Latitude-3570.60470 > bb42-60-217-183.singnet.com.sg.8333: tcp 0
09:11:13.931461 IP 167.99.216.145.8333 > tom-Latitude-3570.57976: tcp 109
09:11:13.931472 IP tom-Latitude-3570.57976 > 167.99.216.145.8333: tcp 0
09:11:13.946148 IP 167.99.216.145.8333 > tom-Latitude-3570.57976: tcp 0
09:11:13.946155 IP 167.99.216.145.8333 > tom-Latitude-3570.57976: tcp 0
09:11:14.012779 IP 167.99.216.145.8333 > tom-Latitude-3570.57976: tcp 24
09:11:14.012784 IP tom-Latitude-3570.57976 > 167.99.216.145.8333: tcp 0
09:11:14.012963 IP 167.99.216.145.8333 > tom-Latitude-3570.57976: tcp 248
09:11:14.012967 IP tom-Latitude-3570.57976 > 167.99.216.145.8333: tcp 0
