04:46:27.336951 IP tom-Latitude-3570.60470 > bb42-60-217-183.singnet.com.sg.8333: tcp 24
04:46:27.338989 IP tom-Latitude-3570.60470 > bb42-60-217-183.singnet.com.sg.8333: tcp 685
04:46:27.393222 IP bb42-60-217-183.singnet.com.sg.8333 > tom-Latitude-3570.60470: tcp 0
04:46:27.401091 IP bb42-60-217-183.singnet.com.sg.8333 > tom-Latitude-3570.60470: tcp 0
04:46:27.637558 IP tom-Latitude-3570.60988 > 81.198.101.144.8333: tcp 24
04:46:27.639573 IP tom-Latitude-3570.60988 > 81.198.101.144.8333: tcp 181
04:46:27.673142 IP 81.198.101.144.8333 > tom-Latitude-3570.60988: tcp 0
04:46:27.679480 IP 81.198.101.144.8333 > tom-Latitude-3570.60988: tcp 0
04:46:27.695982 IP ns3113832.ip-54-38-177.eu.8333 > tom-Latitude-3570.56714: tcp 24
04:46:27.696601 IP ns3113832.ip-54-38-177.eu.8333 > tom-Latitude-3570.56714: tcp 145
04:46:27.696713 IP tom-Latitude-3570.56714 > ns3113832.ip-54-38-177.eu.8333: tcp 0
04:46:27.696875 IP tom-Latitude-3570.56714 > ns3113832.ip-54-38-177.eu.8333: tcp 24
04:46:27.698222 IP tom-Latitude-3570.56714 > ns3113832.ip-54-38-177.eu.8333: tcp 145
04:46:27.731097 IP ns3113832.ip-54-38-177.eu.8333 > tom-Latitude-3570.56714: tcp 0
04:46:27.731756 IP ns3113832.ip-54-38-177.eu.8333 > tom-Latitude-3570.56714: tcp 0
04:46:27.789441 IP ns3113832.ip-54-38-177.eu.8333 > tom-Latitude-3570.56714: tcp 24
04:46:27.790370 IP ns3113832.ip-54-38-177.eu.8333 > tom-Latitude-3570.56714: tcp 338
04:46:27.790392 IP ns3113832.ip-54-38-177.eu.8333 > tom-Latitude-3570.56714: tcp 24
04:46:27.790395 IP ns3113832.ip-54-38-177.eu.8333 > tom-Latitude-3570.56714: tcp 190
04:46:27.790397 IP ns3113832.ip-54-38-177.eu.8333 > tom-Latitude-3570.56714: tcp 24
04:46:27.790399 IP ns3113832.ip-54-38-177.eu.8333 > tom-Latitude-3570.56714: tcp 336
04:46:27.790401 IP ns3113832.ip-54-38-177.eu.8333 > tom-Latitude-3570.56714: tcp 24
04:46:27.790403 IP ns3113832.ip-54-38-177.eu.8333 > tom-Latitude-3570.56714: tcp 559
04:46:27.790501 IP tom-Latitude-3570.56714 > ns3113832.ip-54-38-177.eu.8333: tcp 0
04:46:27.791959 IP tom-Latitude-3570.39282 > default-rdns.vocus.co.nz.8333: tcp 24
04:46:27.792612 IP tom-Latitude-3570.39282 > default-rdns.vocus.co.nz.8333: tcp 145
04:46:27.831044 IP default-rdns.vocus.co.nz.8333 > tom-Latitude-3570.39282: tcp 0
04:46:27.832527 IP default-rdns.vocus.co.nz.8333 > tom-Latitude-3570.39282: tcp 0
04:46:28.093820 IP tom-Latitude-3570.39282 > default-rdns.vocus.co.nz.8333: tcp 24
04:46:28.095940 IP tom-Latitude-3570.39282 > default-rdns.vocus.co.nz.8333: tcp 109
04:46:28.096529 IP c-185-45-236-223.customer.ggaweb.ch.8333 > tom-Latitude-3570.49070: tcp 24
04:46:28.096544 IP c-185-45-236-223.customer.ggaweb.ch.8333 > tom-Latitude-3570.49070: tcp 325
04:46:28.096623 IP tom-Latitude-3570.49070 > c-185-45-236-223.customer.ggaweb.ch.8333: tcp 0
04:46:28.096926 IP tom-Latitude-3570.49070 > c-185-45-236-223.customer.ggaweb.ch.8333: tcp 24
04:46:28.098100 IP tom-Latitude-3570.49070 > c-185-45-236-223.customer.ggaweb.ch.8333: tcp 73
04:46:28.123209 IP c-185-45-236-223.customer.ggaweb.ch.8333 > tom-Latitude-3570.49070: tcp 325
04:46:28.123252 IP tom-Latitude-3570.49070 > c-185-45-236-223.customer.ggaweb.ch.8333: tcp 0
04:46:28.136054 IP default-rdns.vocus.co.nz.8333 > tom-Latitude-3570.39282: tcp 0
04:46:28.140546 IP default-rdns.vocus.co.nz.8333 > tom-Latitude-3570.39282: tcp 0
04:46:28.140559 IP c-185-45-236-223.customer.ggaweb.ch.8333 > tom-Latitude-3570.49070: tcp 0
04:46:28.140564 IP c-185-45-236-223.customer.ggaweb.ch.8333 > tom-Latitude-3570.49070: tcp 0
04:46:28.227811 IP c-185-45-236-223.customer.ggaweb.ch.8333 > tom-Latitude-3570.49070: tcp 24
04:46:28.227827 IP tom-Latitude-3570.49070 > c-185-45-236-223.customer.ggaweb.ch.8333: tcp 0
04:46:28.227841 IP c-185-45-236-223.customer.ggaweb.ch.8333 > tom-Latitude-3570.49070: tcp 460
04:46:28.227846 IP tom-Latitude-3570.49070 > c-185-45-236-223.customer.ggaweb.ch.8333: tcp 0
04:46:28.428775 IP tom-Latitude-3570.60470 > bb42-60-217-183.singnet.com.sg.8333: tcp 24
04:46:28.430794 IP tom-Latitude-3570.60470 > bb42-60-217-183.singnet.com.sg.8333: tcp 217
04:46:28.463193 IP bb42-60-217-183.singnet.com.sg.8333 > tom-Latitude-3570.60470: tcp 0
04:46:28.472787 IP bb42-60-217-183.singnet.com.sg.8333 > tom-Latitude-3570.60470: tcp 0
04:46:28.829549 IP tom-Latitude-3570.56714 > ns3113832.ip-54-38-177.eu.8333: tcp 24
04:46:28.831444 IP tom-Latitude-3570.56714 > ns3113832.ip-54-38-177.eu.8333: tcp 31
04:46:28.883401 IP ns3113832.ip-54-38-177.eu.8333 > tom-Latitude-3570.56714: tcp 0
04:46:28.889483 IP ns3113832.ip-54-38-177.eu.8333 > tom-Latitude-3570.56714: tcp 0
04:46:29.398952 IP vmi195435.contaboserver.net.8333 > tom-Latitude-3570.39110: tcp 24
04:46:29.398971 IP vmi195435.contaboserver.net.8333 > tom-Latitude-3570.39110: tcp 289
04:46:29.399068 IP tom-Latitude-3570.39110 > vmi195435.contaboserver.net.8333: tcp 0
04:46:29.399401 IP vmi195435.contaboserver.net.8333 > tom-Latitude-3570.39110: tcp 289
04:46:29.399413 IP tom-Latitude-3570.39110 > vmi195435.contaboserver.net.8333: tcp 0
04:46:29.399656 IP tom-Latitude-3570.39110 > vmi195435.contaboserver.net.8333: tcp 24
04:46:29.400870 IP tom-Latitude-3570.39110 > vmi195435.contaboserver.net.8333: tcp 37
04:46:29.441397 IP vmi195435.contaboserver.net.8333 > tom-Latitude-3570.39110: tcp 0
04:46:29.442069 IP vmi195435.contaboserver.net.8333 > tom-Latitude-3570.39110: tcp 0
04:46:29.574983 IP vmi195435.contaboserver.net.8333 > tom-Latitude-3570.39110: tcp 24
04:46:29.574990 IP vmi195435.contaboserver.net.8333 > tom-Latitude-3570.39110: tcp 225
04:46:29.575017 IP tom-Latitude-3570.39110 > vmi195435.contaboserver.net.8333: tcp 0
04:46:29.927326 IP 81.198.101.144.8333 > tom-Latitude-3570.60988: tcp 24
04:46:29.927332 IP tom-Latitude-3570.60988 > 81.198.101.144.8333: tcp 0
04:46:29.927336 IP 81.198.101.144.8333 > tom-Latitude-3570.60988: tcp 217
04:46:29.927339 IP tom-Latitude-3570.60988 > 81.198.101.144.8333: tcp 0
04:46:30.027795 IP tom-Latitude-3570.60988 > 81.198.101.144.8333: tcp 24
04:46:30.027920 IP tom-Latitude-3570.57976 > 167.99.216.145.8333: tcp 24
04:46:30.029518 IP tom-Latitude-3570.57976 > 167.99.216.145.8333: tcp 541
04:46:30.029528 IP tom-Latitude-3570.60988 > 81.198.101.144.8333: tcp 37
04:46:30.063426 IP 81.198.101.144.8333 > tom-Latitude-3570.60988: tcp 0
04:46:30.070783 IP 81.198.101.144.8333 > tom-Latitude-3570.60988: tcp 0
04:46:30.074489 IP 167.99.216.145.8333 > tom-Latitude-3570.57976: tcp 0
04:46:30.074500 IP 167.99.216.145.8333 > tom-Latitude-3570.57976: tcp 0
04:46:30.083539 IP 167.99.216.145.8333 > tom-Latitude-3570.57976: tcp 24
04:46:30.085055 IP 167.99.216.145.8333 > tom-Latitude-3570.57976: tcp 541
04:46:30.085192 IP tom-Latitude-3570.57976 > 167.99.216.145.8333: tcp 0
04:46:30.085695 IP tom-Latitude-3570.60470 > bb42-60-217-183.singnet.com.sg.8333: tcp 24
04:46:30.086579 IP tom-Latitude-3570.60470 > bb42-60-217-183.singnet.com.sg.8333: tcp 37
04:46:30.122137 IP bb42-60-217-183.singnet.com.sg.8333 > tom-Latitude-3570.60470: tcp 0
04:46:30.122168 IP bb42-60-217-183.singnet.com.sg.8333 > tom-Latitude-3570.60470: tcp 0
04:46:31.289018 IP tom-Latitude-3570.42516 > 2.56.9.15.8333: tcp 24
04:46:31.291086 IP tom-Latitude-3570.42516 > 2.56.9.15.8333: tcp 253
04:46:31.294828 IP c-185-45-236-223.customer.ggaweb.ch.8333 > tom-Latitude-3570.49070: tcp 24
04:46:31.294854 IP tom-Latitude-3570.49070 > c-185-45-236-223.customer.ggaweb.ch.8333: tcp 0
04:46:31.295529 IP c-185-45-236-223.customer.ggaweb.ch.8333 > tom-Latitude-3570.49070: tcp 181
04:46:31.295552 IP tom-Latitude-3570.49070 > c-185-45-236-223.customer.ggaweb.ch.8333: tcp 0
04:46:31.295582 IP c-185-45-236-223.customer.ggaweb.ch.8333 > tom-Latitude-3570.49070: tcp 181
04:46:31.295586 IP tom-Latitude-3570.49070 > c-185-45-236-223.customer.ggaweb.ch.8333: tcp 0
04:46:31.295589 IP vmi195435.contaboserver.net.8333 > tom-Latitude-3570.39110: tcp 24
04:46:31.295595 IP vmi195435.contaboserver.net.8333 > tom-Latitude-3570.39110: tcp 217
04:46:31.295697 IP tom-Latitude-3570.39110 > vmi195435.contaboserver.net.8333: tcp 0
04:46:31.295842 IP tom-Latitude-3570.49070 > c-185-45-236-223.customer.ggaweb.ch.8333: tcp 24
04:46:31.295935 IP tom-Latitude-3570.39110 > vmi195435.contaboserver.net.8333: tcp 24
04:46:31.296822 IP tom-Latitude-3570.39110 > vmi195435.contaboserver.net.8333: tcp 73
04:46:31.296828 IP tom-Latitude-3570.49070 > c-185-45-236-223.customer.ggaweb.ch.8333: tcp 145
04:46:31.331618 IP 2.56.9.15.8333 > tom-Latitude-3570.42516: tcp 0
04:46:31.332330 IP c-185-45-236-223.customer.ggaweb.ch.8333 > tom-Latitude-3570.49070: tcp 0
04:46:31.332336 IP vmi195435.contaboserver.net.8333 > tom-Latitude-3570.39110: tcp 0
04:46:31.332339 IP vmi195435.contaboserver.net.8333 > tom-Latitude-3570.39110: tcp 0
04:46:31.332341 IP c-185-45-236-223.customer.ggaweb.ch.8333 > tom-Latitude-3570.49070: tcp 0
04:46:31.387080 IP 2.56.9.15.8333 > tom-Latitude-3570.42516: tcp 24
04:46:31.390889 IP 2.56.9.15.8333 > tom-Latitude-3570.42516: tcp 325
04:46:31.391098 IP tom-Latitude-3570.42516 > 2.56.9.15.8333: tcp 0
04:46:31.409664 IP vmi195435.contaboserver.net.8333 > tom-Latitude-3570.39110: tcp 24
04:46:31.410293 IP vmi195435.contaboserver.net.8333 > tom-Latitude-3570.39110: tcp 247
04:46:31.410300 IP vmi195435.contaboserver.net.8333 > tom-Latitude-3570.39110: tcp 24
04:46:31.410303 IP vmi195435.contaboserver.net.8333 > tom-Latitude-3570.39110: tcp 794
04:46:31.410363 IP tom-Latitude-3570.39110 > vmi195435.contaboserver.net.8333: tcp 0
04:46:31.416476 IP c-185-45-236-223.customer.ggaweb.ch.8333 > tom-Latitude-3570.49070: tcp 24
04:46:31.417456 IP c-185-45-236-223.customer.ggaweb.ch.8333 > tom-Latitude-3570.49070: tcp 646
04:46:31.417482 IP c-185-45-236-223.customer.ggaweb.ch.8333 > tom-Latitude-3570.49070: tcp 362
04:46:31.417488 IP c-185-45-236-223.customer.ggaweb.ch.8333 > tom-Latitude-3570.49070: tcp 24
04:46:31.417492 IP c-185-45-236-223.customer.ggaweb.ch.8333 > tom-Latitude-3570.49070: tcp 225
04:46:31.417499 IP c-185-45-236-223.customer.ggaweb.ch.8333 > tom-Latitude-3570.49070: tcp 541
04:46:31.417579 IP tom-Latitude-3570.49070 > c-185-45-236-223.customer.ggaweb.ch.8333: tcp 0
04:46:31.923375 IP tom-Latitude-3570.39282 > default-rdns.vocus.co.nz.8333: tcp 24
04:46:31.925270 IP tom-Latitude-3570.39282 > default-rdns.vocus.co.nz.8333: tcp 325
04:46:31.954288 IP default-rdns.vocus.co.nz.8333 > tom-Latitude-3570.39282: tcp 0
04:46:31.961515 IP default-rdns.vocus.co.nz.8333 > tom-Latitude-3570.39282: tcp 0
04:46:32.424301 IP tom-Latitude-3570.60470 > bb42-60-217-183.singnet.com.sg.8333: tcp 24
04:46:32.461812 IP tom-Latitude-3570.60470 > bb42-60-217-183.singnet.com.sg.8333: tcp 217
04:46:32.519409 IP default-rdns.vocus.co.nz.8333 > tom-Latitude-3570.39282: tcp 24
04:46:32.520254 IP default-rdns.vocus.co.nz.8333 > tom-Latitude-3570.39282: tcp 37
04:46:32.520300 IP c-185-45-236-223.customer.ggaweb.ch.8333 > tom-Latitude-3570.49070: tcp 24
04:46:32.520307 IP c-185-45-236-223.customer.ggaweb.ch.8333 > tom-Latitude-3570.49070: tcp 253
04:46:32.520311 IP default-rdns.vocus.co.nz.8333 > tom-Latitude-3570.39282: tcp 37
04:46:32.520321 IP tom-Latitude-3570.39282 > default-rdns.vocus.co.nz.8333: tcp 0
04:46:32.520333 IP bb42-60-217-183.singnet.com.sg.8333 > tom-Latitude-3570.60470: tcp 24
04:46:32.520335 IP tom-Latitude-3570.49070 > c-185-45-236-223.customer.ggaweb.ch.8333: tcp 0
04:46:32.520338 IP bb42-60-217-183.singnet.com.sg.8333 > tom-Latitude-3570.60470: tcp 361
04:46:32.520341 IP bb42-60-217-183.singnet.com.sg.8333 > tom-Latitude-3570.60470: tcp 0
04:46:32.520345 IP bb42-60-217-183.singnet.com.sg.8333 > tom-Latitude-3570.60470: tcp 0
04:46:32.520394 IP tom-Latitude-3570.60470 > bb42-60-217-183.singnet.com.sg.8333: tcp 0
04:46:32.520562 IP tom-Latitude-3570.49070 > c-185-45-236-223.customer.ggaweb.ch.8333: tcp 24
04:46:32.520616 IP tom-Latitude-3570.39282 > default-rdns.vocus.co.nz.8333: tcp 24
04:46:32.521863 IP tom-Latitude-3570.39282 > default-rdns.vocus.co.nz.8333: tcp 794
04:46:32.521869 IP tom-Latitude-3570.49070 > c-185-45-236-223.customer.ggaweb.ch.8333: tcp 181
04:46:32.536723 IP c-185-45-236-223.customer.ggaweb.ch.8333 > tom-Latitude-3570.49070: tcp 253
04:46:32.536743 IP tom-Latitude-3570.49070 > c-185-45-236-223.customer.ggaweb.ch.8333: tcp 0
04:46:32.550024 IP c-185-45-236-223.customer.ggaweb.ch.8333 > tom-Latitude-3570.49070: tcp 0
04:46:32.550698 IP default-rdns.vocus.co.nz.8333 > tom-Latitude-3570.39282: tcp 0
04:46:32.550705 IP default-rdns.vocus.co.nz.8333 > tom-Latitude-3570.39282: tcp 0
04:46:32.550708 IP c-185-45-236-223.customer.ggaweb.ch.8333 > tom-Latitude-3570.49070: tcp 0
04:46:32.635453 IP c-185-45-236-223.customer.ggaweb.ch.8333 > tom-Latitude-3570.49070: tcp 24
04:46:32.635524 IP tom-Latitude-3570.49070 > c-185-45-236-223.customer.ggaweb.ch.8333: tcp 0
04:46:32.635602 IP c-185-45-236-223.customer.ggaweb.ch.8333 > tom-Latitude-3570.49070: tcp 1057
04:46:32.635643 IP tom-Latitude-3570.49070 > c-185-45-236-223.customer.ggaweb.ch.8333: tcp 0
04:46:32.635650 IP c-185-45-236-223.customer.ggaweb.ch.8333 > tom-Latitude-3570.49070: tcp 398
04:46:32.635654 IP tom-Latitude-3570.49070 > c-185-45-236-223.customer.ggaweb.ch.8333: tcp 0
04:46:32.739029 IP tom-Latitude-3570.39282 > default-rdns.vocus.co.nz.8333: tcp 24
04:46:32.741173 IP tom-Latitude-3570.39282 > default-rdns.vocus.co.nz.8333: tcp 181
04:46:32.773552 IP default-rdns.vocus.co.nz.8333 > tom-Latitude-3570.39282: tcp 0
04:46:32.780948 IP default-rdns.vocus.co.nz.8333 > tom-Latitude-3570.39282: tcp 0
04:46:32.839455 IP tom-Latitude-3570.56714 > ns3113832.ip-54-38-177.eu.8333: tcp 24
04:46:32.839518 IP tom-Latitude-3570.57976 > 167.99.216.145.8333: tcp 24
04:46:32.840386 IP tom-Latitude-3570.57976 > 167.99.216.145.8333: tcp 397
04:46:32.840396 IP tom-Latitude-3570.56714 > ns3113832.ip-54-38-177.eu.8333: tcp 505
04:46:32.873205 IP ns3113832.ip-54-38-177.eu.8333 > tom-Latitude-3570.56714: tcp 0
04:46:32.881094 IP ns3113832.ip-54-38-177.eu.8333 > tom-Latitude-3570.56714: tcp 0
04:46:32.881837 IP 167.99.216.145.8333 > tom-Latitude-3570.57976: tcp 0
04:46:33.288028 IP ns3113832.ip-54-38-177.eu.8333 > tom-Latitude-3570.56714: tcp 24
04:46:33.288045 IP ns3113832.ip-54-38-177.eu.8333 > tom-Latitude-3570.56714: tcp 37
04:46:33.288048 IP ns3113832.ip-54-38-177.eu.8333 > tom-Latitude-3570.56714: tcp 37
04:46:33.288061 IP tom-Latitude-3570.56714 > ns3113832.ip-54-38-177.eu.8333: tcp 0
04:46:33.288166 IP tom-Latitude-3570.56714 > ns3113832.ip-54-38-177.eu.8333: tcp 24
04:46:33.289393 IP tom-Latitude-3570.56714 > ns3113832.ip-54-38-177.eu.8333: tcp 37
04:46:33.331107 IP ns3113832.ip-54-38-177.eu.8333 > tom-Latitude-3570.56714: tcp 0
04:46:33.331621 IP ns3113832.ip-54-38-177.eu.8333 > tom-Latitude-3570.56714: tcp 0
04:46:33.388733 IP ns3113832.ip-54-38-177.eu.8333 > tom-Latitude-3570.56714: tcp 24
04:46:33.389519 IP ns3113832.ip-54-38-177.eu.8333 > tom-Latitude-3570.56714: tcp 762
04:46:33.389605 IP tom-Latitude-3570.56714 > ns3113832.ip-54-38-177.eu.8333: tcp 0
04:46:33.492880 IP tom-Latitude-3570.39110 > vmi195435.contaboserver.net.8333: tcp 24
04:46:33.495569 IP tom-Latitude-3570.39110 > vmi195435.contaboserver.net.8333: tcp 217
04:46:33.522958 IP vmi195435.contaboserver.net.8333 > tom-Latitude-3570.39110: tcp 0
04:46:33.530869 IP vmi195435.contaboserver.net.8333 > tom-Latitude-3570.39110: tcp 0
04:46:33.593122 IP tom-Latitude-3570.42516 > 2.56.9.15.8333: tcp 24
04:46:33.593940 IP tom-Latitude-3570.42516 > 2.56.9.15.8333: tcp 361
04:46:33.630985 IP 2.56.9.15.8333 > tom-Latitude-3570.42516: tcp 0
04:46:33.661164 IP ns3113832.ip-54-38-177.eu.8333 > tom-Latitude-3570.56714: tcp 24
04:46:33.661787 IP ns3113832.ip-54-38-177.eu.8333 > tom-Latitude-3570.56714: tcp 37
04:46:33.661904 IP tom-Latitude-3570.56714 > ns3113832.ip-54-38-177.eu.8333: tcp 0
04:46:33.662065 IP tom-Latitude-3570.56714 > ns3113832.ip-54-38-177.eu.8333: tcp 24
04:46:33.663301 IP tom-Latitude-3570.56714 > ns3113832.ip-54-38-177.eu.8333: tcp 37
04:46:33.734109 IP ns3113832.ip-54-38-177.eu.8333 > tom-Latitude-3570.56714: tcp 0
04:46:33.734152 IP ns3113832.ip-54-38-177.eu.8333 > tom-Latitude-3570.56714: tcp 0
04:46:33.757425 IP ns3113832.ip-54-38-177.eu.8333 > tom-Latitude-3570.56714: tcp 24
04:46:33.757491 IP ns3113832.ip-54-38-177.eu.8333 > tom-Latitude-3570.56714: tcp 189
04:46:33.757645 IP tom-Latitude-3570.56714 > ns3113832.ip-54-38-177.eu.8333: tcp 0
04:46:33.758159 IP tom-Latitude-3570.60470 > bb42-60-217-183.singnet.com.sg.8333: tcp 24
04:46:33.759566 IP tom-Latitude-3570.60470 > bb42-60-217-183.singnet.com.sg.8333: tcp 109
04:46:33.790932 IP bb42-60-217-183.singnet.com.sg.8333 > tom-Latitude-3570.60470: tcp 0
04:46:33.791608 IP bb42-60-217-183.singnet.com.sg.8333 > tom-Latitude-3570.60470: tcp 0
04:46:33.958500 IP tom-Latitude-3570.49070 > c-185-45-236-223.customer.ggaweb.ch.8333: tcp 24
04:46:33.958539 IP tom-Latitude-3570.57976 > 167.99.216.145.8333: tcp 24
04:46:33.960396 IP tom-Latitude-3570.57976 > 167.99.216.145.8333: tcp 73
04:46:33.960402 IP tom-Latitude-3570.49070 > c-185-45-236-223.customer.ggaweb.ch.8333: tcp 73
04:46:33.992884 IP c-185-45-236-223.customer.ggaweb.ch.8333 > tom-Latitude-3570.49070: tcp 0
04:46:34.008662 IP 167.99.216.145.8333 > tom-Latitude-3570.57976: tcp 0
04:46:34.009262 IP c-185-45-236-223.customer.ggaweb.ch.8333 > tom-Latitude-3570.49070: tcp 0
04:46:34.158792 IP tom-Latitude-3570.42516 > 2.56.9.15.8333: tcp 24
04:46:34.160838 IP tom-Latitude-3570.42516 > 2.56.9.15.8333: tcp 37
04:46:34.161555 IP 167.99.216.145.8333 > tom-Latitude-3570.57976: tcp 24
04:46:34.161570 IP 167.99.216.145.8333 > tom-Latitude-3570.57976: tcp 37
04:46:34.161606 IP tom-Latitude-3570.57976 > 167.99.216.145.8333: tcp 0
04:46:34.161719 IP tom-Latitude-3570.57976 > 167.99.216.145.8333: tcp 24
04:46:34.162811 IP tom-Latitude-3570.57976 > 167.99.216.145.8333: tcp 37
04:46:34.200987 IP 2.56.9.15.8333 > tom-Latitude-3570.42516: tcp 0
04:46:34.201677 IP 167.99.216.145.8333 > tom-Latitude-3570.57976: tcp 0
04:46:34.219684 IP 81.198.101.144.8333 > tom-Latitude-3570.60988: tcp 24
04:46:34.219710 IP tom-Latitude-3570.60988 > 81.198.101.144.8333: tcp 0
04:46:34.219730 IP 81.198.101.144.8333 > tom-Latitude-3570.60988: tcp 469
04:46:34.219735 IP tom-Latitude-3570.60988 > 81.198.101.144.8333: tcp 0
04:46:34.264007 IP 167.99.216.145.8333 > tom-Latitude-3570.57976: tcp 24
04:46:34.264631 IP 167.99.216.145.8333 > tom-Latitude-3570.57976: tcp 223
04:46:34.264716 IP tom-Latitude-3570.57976 > 167.99.216.145.8333: tcp 0
04:46:34.666013 IP tom-Latitude-3570.49070 > c-185-45-236-223.customer.ggaweb.ch.8333: tcp 24
04:46:34.668081 IP tom-Latitude-3570.49070 > c-185-45-236-223.customer.ggaweb.ch.8333: tcp 37
04:46:34.721881 IP c-185-45-236-223.customer.ggaweb.ch.8333 > tom-Latitude-3570.49070: tcp 0
04:46:34.731250 IP c-185-45-236-223.customer.ggaweb.ch.8333 > tom-Latitude-3570.49070: tcp 0
04:46:34.766224 IP tom-Latitude-3570.39110 > vmi195435.contaboserver.net.8333: tcp 24
04:46:34.767161 IP tom-Latitude-3570.39110 > vmi195435.contaboserver.net.8333: tcp 73
04:46:34.793348 IP vmi195435.contaboserver.net.8333 > tom-Latitude-3570.39110: tcp 0
04:46:34.802426 IP vmi195435.contaboserver.net.8333 > tom-Latitude-3570.39110: tcp 0
04:46:34.866479 IP tom-Latitude-3570.39282 > default-rdns.vocus.co.nz.8333: tcp 24
04:46:34.867412 IP tom-Latitude-3570.39282 > default-rdns.vocus.co.nz.8333: tcp 109
04:46:34.893374 IP default-rdns.vocus.co.nz.8333 > tom-Latitude-3570.39282: tcp 0
04:46:34.899835 IP default-rdns.vocus.co.nz.8333 > tom-Latitude-3570.39282: tcp 0
04:46:34.966734 IP tom-Latitude-3570.39110 > vmi195435.contaboserver.net.8333: tcp 24
04:46:34.967666 IP tom-Latitude-3570.39110 > vmi195435.contaboserver.net.8333: tcp 37
04:46:35.014326 IP vmi195435.contaboserver.net.8333 > tom-Latitude-3570.39110: tcp 0
04:46:35.014341 IP vmi195435.contaboserver.net.8333 > tom-Latitude-3570.39110: tcp 0
04:46:35.081429 IP vmi195435.contaboserver.net.8333 > tom-Latitude-3570.39110: tcp 24
04:46:35.082182 IP vmi195435.contaboserver.net.8333 > tom-Latitude-3570.39110: tcp 283
04:46:35.082242 IP tom-Latitude-3570.39110 > vmi195435.contaboserver.net.8333: tcp 0
04:46:35.082681 IP tom-Latitude-3570.39110 > vmi195435.contaboserver.net.8333: tcp 24
04:46:35.083618 IP tom-Latitude-3570.39110 > vmi195435.contaboserver.net.8333: tcp 37
04:46:35.104571 IP bb42-60-217-183.singnet.com.sg.8333 > tom-Latitude-3570.60470: tcp 24
04:46:35.105206 IP bb42-60-217-183.singnet.com.sg.8333 > tom-Latitude-3570.60470: tcp 37
04:46:35.105269 IP tom-Latitude-3570.60470 > bb42-60-217-183.singnet.com.sg.8333: tcp 0
04:46:35.113318 IP vmi195435.contaboserver.net.8333 > tom-Latitude-3570.39110: tcp 0
04:46:35.113332 IP vmi195435.contaboserver.net.8333 > tom-Latitude-3570.39110: tcp 0
04:46:35.191108 IP vmi195435.contaboserver.net.8333 > tom-Latitude-3570.39110: tcp 24
04:46:35.191128 IP vmi195435.contaboserver.net.8333 > tom-Latitude-3570.39110: tcp 284
04:46:35.191169 IP tom-Latitude-3570.39110 > vmi195435.contaboserver.net.8333: tcp 0
04:46:35.191567 IP tom-Latitude-3570.39110 > vmi195435.contaboserver.net.8333: tcp 24
04:46:35.192695 IP tom-Latitude-3570.39110 > vmi195435.contaboserver.net.8333: tcp 37
04:46:35.221431 IP vmi195435.contaboserver.net.8333 > tom-Latitude-3570.39110: tcp 0
04:46:35.222030 IP vmi195435.contaboserver.net.8333 > tom-Latitude-3570.39110: tcp 0
04:46:35.225170 IP default-rdns.vocus.co.nz.8333 > tom-Latitude-3570.39282: tcp 24
04:46:35.225823 IP default-rdns.vocus.co.nz.8333 > tom-Latitude-3570.39282: tcp 37
04:46:35.225886 IP tom-Latitude-3570.39282 > default-rdns.vocus.co.nz.8333: tcp 0
04:46:35.226023 IP tom-Latitude-3570.39282 > default-rdns.vocus.co.nz.8333: tcp 24
04:46:35.227458 IP tom-Latitude-3570.39282 > default-rdns.vocus.co.nz.8333: tcp 223
04:46:35.259740 IP default-rdns.vocus.co.nz.8333 > tom-Latitude-3570.39282: tcp 0
04:46:35.260280 IP default-rdns.vocus.co.nz.8333 > tom-Latitude-3570.39282: tcp 0
04:46:35.299278 IP vmi195435.contaboserver.net.8333 > tom-Latitude-3570.39110: tcp 24
04:46:35.300093 IP vmi195435.contaboserver.net.8333 > tom-Latitude-3570.39110: tcp 37
04:46:35.300217 IP tom-Latitude-3570.39110 > vmi195435.contaboserver.net.8333: tcp 0
04:46:35.901712 IP tom-Latitude-3570.60988 > 81.198.101.144.8333: tcp 24
04:46:35.903597 IP tom-Latitude-3570.60988 > 81.198.101.144.8333: tcp 37
04:46:35.952144 IP 81.198.101.144.8333 > tom-Latitude-3570.60988: tcp 0
04:46:35.959421 IP 81.198.101.144.8333 > tom-Latitude-3570.60988: tcp 0
04:46:36.360080 IP vmi195435.contaboserver.net.8333 > tom-Latitude-3570.39110: tcp 24
04:46:36.360111 IP vmi195435.contaboserver.net.8333 > tom-Latitude-3570.39110: tcp 37
04:46:36.360114 IP vmi195435.contaboserver.net.8333 > tom-Latitude-3570.39110: tcp 37
04:46:36.360122 IP tom-Latitude-3570.39110 > vmi195435.contaboserver.net.8333: tcp 0
04:46:36.360296 IP tom-Latitude-3570.39110 > vmi195435.contaboserver.net.8333: tcp 24
04:46:36.361499 IP tom-Latitude-3570.39110 > vmi195435.contaboserver.net.8333: tcp 37
04:46:36.400928 IP vmi195435.contaboserver.net.8333 > tom-Latitude-3570.39110: tcp 0
04:46:36.401506 IP vmi195435.contaboserver.net.8333 > tom-Latitude-3570.39110: tcp 0
04:46:36.455997 IP 81.198.101.144.8333 > tom-Latitude-3570.60988: tcp 24
04:46:36.456029 IP tom-Latitude-3570.60988 > 81.198.101.144.8333: tcp 0
04:46:36.456802 IP 81.198.101.144.8333 > tom-Latitude-3570.60988: tcp 37
04:46:36.456859 IP tom-Latitude-3570.60988 > 81.198.101.144.8333: tcp 0
04:46:36.480121 IP vmi195435.contaboserver.net.8333 > tom-Latitude-3570.39110: tcp 24
04:46:36.480801 IP vmi195435.contaboserver.net.8333 > tom-Latitude-3570.39110: tcp 225
04:46:36.480914 IP tom-Latitude-3570.39110 > vmi195435.contaboserver.net.8333: tcp 0
04:46:36.481313 IP tom-Latitude-3570.49070 > c-185-45-236-223.customer.ggaweb.ch.8333: tcp 24
04:46:36.482350 IP tom-Latitude-3570.49070 > c-185-45-236-223.customer.ggaweb.ch.8333: tcp 37
04:46:36.521948 IP c-185-45-236-223.customer.ggaweb.ch.8333 > tom-Latitude-3570.49070: tcp 0
04:46:36.522002 IP c-185-45-236-223.customer.ggaweb.ch.8333 > tom-Latitude-3570.49070: tcp 0
04:46:36.997122 IP 81.198.101.144.8333 > tom-Latitude-3570.60988: tcp 24
04:46:36.997168 IP tom-Latitude-3570.60988 > 81.198.101.144.8333: tcp 0
04:46:36.997732 IP 81.198.101.144.8333 > tom-Latitude-3570.60988: tcp 109
04:46:36.997757 IP tom-Latitude-3570.60988 > 81.198.101.144.8333: tcp 0
04:46:36.997965 IP tom-Latitude-3570.60988 > 81.198.101.144.8333: tcp 24
04:46:36.998811 IP tom-Latitude-3570.60988 > 81.198.101.144.8333: tcp 109
04:46:37.031100 IP 81.198.101.144.8333 > tom-Latitude-3570.60988: tcp 0
04:46:37.031674 IP 81.198.101.144.8333 > tom-Latitude-3570.60988: tcp 0
04:46:37.699752 IP tom-Latitude-3570.60470 > bb42-60-217-183.singnet.com.sg.8333: tcp 24
04:46:37.701618 IP tom-Latitude-3570.60470 > bb42-60-217-183.singnet.com.sg.8333: tcp 37
04:46:37.702329 IP 81.198.101.144.8333 > tom-Latitude-3570.60988: tcp 224
04:46:37.702338 IP tom-Latitude-3570.60988 > 81.198.101.144.8333: tcp 0
04:46:37.702342 IP 81.198.101.144.8333 > tom-Latitude-3570.60988: tcp 24
04:46:37.702344 IP tom-Latitude-3570.60988 > 81.198.101.144.8333: tcp 0
04:46:37.702347 IP 81.198.101.144.8333 > tom-Latitude-3570.60988: tcp 224
04:46:37.702348 IP tom-Latitude-3570.60988 > 81.198.101.144.8333: tcp 0
04:46:37.702350 IP 81.198.101.144.8333 > tom-Latitude-3570.60988: tcp 24
04:46:37.702353 IP tom-Latitude-3570.60988 > 81.198.101.144.8333: tcp 0
04:46:37.702355 IP 81.198.101.144.8333 > tom-Latitude-3570.60988: tcp 223
04:46:37.702356 IP tom-Latitude-3570.60988 > 81.198.101.144.8333: tcp 0
04:46:37.702359 IP 81.198.101.144.8333 > tom-Latitude-3570.60988: tcp 223
04:46:37.702360 IP tom-Latitude-3570.60988 > 81.198.101.144.8333: tcp 0
04:46:37.739866 IP bb42-60-217-183.singnet.com.sg.8333 > tom-Latitude-3570.60470: tcp 0
04:46:37.740532 IP bb42-60-217-183.singnet.com.sg.8333 > tom-Latitude-3570.60470: tcp 0
04:46:37.744661 IP 81.198.101.144.8333 > tom-Latitude-3570.60988: tcp 24
04:46:37.744678 IP tom-Latitude-3570.60988 > 81.198.101.144.8333: tcp 0
04:46:37.826674 IP c-185-45-236-223.customer.ggaweb.ch.8333 > tom-Latitude-3570.49070: tcp 24
04:46:37.826694 IP tom-Latitude-3570.49070 > c-185-45-236-223.customer.ggaweb.ch.8333: tcp 0
04:46:37.827362 IP c-185-45-236-223.customer.ggaweb.ch.8333 > tom-Latitude-3570.49070: tcp 397
04:46:37.827369 IP tom-Latitude-3570.49070 > c-185-45-236-223.customer.ggaweb.ch.8333: tcp 0
04:46:37.827642 IP tom-Latitude-3570.49070 > c-185-45-236-223.customer.ggaweb.ch.8333: tcp 24
04:46:37.828555 IP tom-Latitude-3570.49070 > c-185-45-236-223.customer.ggaweb.ch.8333: tcp 289
04:46:37.861707 IP c-185-45-236-223.customer.ggaweb.ch.8333 > tom-Latitude-3570.49070: tcp 0
04:46:37.862272 IP c-185-45-236-223.customer.ggaweb.ch.8333 > tom-Latitude-3570.49070: tcp 0
04:46:37.946907 IP c-185-45-236-223.customer.ggaweb.ch.8333 > tom-Latitude-3570.49070: tcp 24
04:46:37.947806 IP c-185-45-236-223.customer.ggaweb.ch.8333 > tom-Latitude-3570.49070: tcp 191
04:46:37.947826 IP c-185-45-236-223.customer.ggaweb.ch.8333 > tom-Latitude-3570.49070: tcp 248
04:46:37.947831 IP c-185-45-236-223.customer.ggaweb.ch.8333 > tom-Latitude-3570.49070: tcp 24
04:46:37.947834 IP c-185-45-236-223.customer.ggaweb.ch.8333 > tom-Latitude-3570.49070: tcp 248
04:46:37.947837 IP c-185-45-236-223.customer.ggaweb.ch.8333 > tom-Latitude-3570.49070: tcp 265
04:46:37.947841 IP c-185-45-236-223.customer.ggaweb.ch.8333 > tom-Latitude-3570.49070: tcp 277
04:46:37.947844 IP c-185-45-236-223.customer.ggaweb.ch.8333 > tom-Latitude-3570.49070: tcp 249
04:46:37.947846 IP c-185-45-236-223.customer.ggaweb.ch.8333 > tom-Latitude-3570.49070: tcp 24
04:46:37.947848 IP c-185-45-236-223.customer.ggaweb.ch.8333 > tom-Latitude-3570.49070: tcp 249
04:46:37.947876 IP tom-Latitude-3570.49070 > c-185-45-236-223.customer.ggaweb.ch.8333: tcp 0
04:46:38.027721 IP c-185-45-236-223.customer.ggaweb.ch.8333 > tom-Latitude-3570.49070: tcp 226
04:46:38.071707 IP tom-Latitude-3570.49070 > c-185-45-236-223.customer.ggaweb.ch.8333: tcp 0
04:46:38.128353 IP tom-Latitude-3570.39110 > vmi195435.contaboserver.net.8333: tcp 24
04:46:38.129117 IP tom-Latitude-3570.39110 > vmi195435.contaboserver.net.8333: tcp 397
04:46:38.162092 IP vmi195435.contaboserver.net.8333 > tom-Latitude-3570.39110: tcp 0
04:46:38.171548 IP vmi195435.contaboserver.net.8333 > tom-Latitude-3570.39110: tcp 0
04:46:38.328769 IP tom-Latitude-3570.57976 > 167.99.216.145.8333: tcp 24
04:46:38.328851 IP tom-Latitude-3570.60470 > bb42-60-217-183.singnet.com.sg.8333: tcp 24
04:46:38.330679 IP tom-Latitude-3570.60470 > bb42-60-217-183.singnet.com.sg.8333: tcp 397
04:46:38.330685 IP tom-Latitude-3570.57976 > 167.99.216.145.8333: tcp 433
04:46:38.371639 IP bb42-60-217-183.singnet.com.sg.8333 > tom-Latitude-3570.60470: tcp 0
04:46:38.372330 IP bb42-60-217-183.singnet.com.sg.8333 > tom-Latitude-3570.60470: tcp 0
04:46:38.372336 IP 167.99.216.145.8333 > tom-Latitude-3570.57976: tcp 0
04:46:38.386445 IP c-185-45-236-223.customer.ggaweb.ch.8333 > tom-Latitude-3570.49070: tcp 24
04:46:38.386477 IP tom-Latitude-3570.49070 > c-185-45-236-223.customer.ggaweb.ch.8333: tcp 0
04:46:38.386493 IP c-185-45-236-223.customer.ggaweb.ch.8333 > tom-Latitude-3570.49070: tcp 37
04:46:38.386496 IP tom-Latitude-3570.49070 > c-185-45-236-223.customer.ggaweb.ch.8333: tcp 0
04:46:38.386593 IP tom-Latitude-3570.49070 > c-185-45-236-223.customer.ggaweb.ch.8333: tcp 24
04:46:38.387295 IP tom-Latitude-3570.49070 > c-185-45-236-223.customer.ggaweb.ch.8333: tcp 37
04:46:38.431575 IP c-185-45-236-223.customer.ggaweb.ch.8333 > tom-Latitude-3570.49070: tcp 0
04:46:38.432187 IP c-185-45-236-223.customer.ggaweb.ch.8333 > tom-Latitude-3570.49070: tcp 0
04:46:38.515565 IP c-185-45-236-223.customer.ggaweb.ch.8333 > tom-Latitude-3570.49070: tcp 24
04:46:38.516255 IP c-185-45-236-223.customer.ggaweb.ch.8333 > tom-Latitude-3570.49070: tcp 248
04:46:38.516280 IP tom-Latitude-3570.49070 > c-185-45-236-223.customer.ggaweb.ch.8333: tcp 0
04:46:38.516679 IP tom-Latitude-3570.42516 > 2.56.9.15.8333: tcp 24
04:46:38.517555 IP tom-Latitude-3570.42516 > 2.56.9.15.8333: tcp 505
04:46:38.551601 IP 2.56.9.15.8333 > tom-Latitude-3570.42516: tcp 0
04:46:39.117594 IP tom-Latitude-3570.60470 > bb42-60-217-183.singnet.com.sg.8333: tcp 24
04:46:39.119796 IP tom-Latitude-3570.60470 > bb42-60-217-183.singnet.com.sg.8333: tcp 37
04:46:39.171472 IP bb42-60-217-183.singnet.com.sg.8333 > tom-Latitude-3570.60470: tcp 0
04:46:39.179203 IP bb42-60-217-183.singnet.com.sg.8333 > tom-Latitude-3570.60470: tcp 0
04:46:39.317983 IP tom-Latitude-3570.60988 > 81.198.101.144.8333: tcp 24
04:46:39.319897 IP tom-Latitude-3570.60988 > 81.198.101.144.8333: tcp 325
04:46:39.353460 IP 81.198.101.144.8333 > tom-Latitude-3570.60988: tcp 0
04:46:39.360983 IP 81.198.101.144.8333 > tom-Latitude-3570.60988: tcp 0
04:46:39.418254 IP tom-Latitude-3570.56714 > ns3113832.ip-54-38-177.eu.8333: tcp 24
04:46:39.418982 IP tom-Latitude-3570.56714 > ns3113832.ip-54-38-177.eu.8333: tcp 505
04:46:39.441319 IP ns3113832.ip-54-38-177.eu.8333 > tom-Latitude-3570.56714: tcp 0
04:46:39.451124 IP ns3113832.ip-54-38-177.eu.8333 > tom-Latitude-3570.56714: tcp 0
04:46:39.710678 IP c-185-45-236-223.customer.ggaweb.ch.8333 > tom-Latitude-3570.49070: tcp 24
04:46:39.710732 IP c-185-45-236-223.customer.ggaweb.ch.8333 > tom-Latitude-3570.49070: tcp 109
04:46:39.710808 IP tom-Latitude-3570.49070 > c-185-45-236-223.customer.ggaweb.ch.8333: tcp 0
04:46:39.711066 IP tom-Latitude-3570.49070 > c-185-45-236-223.customer.ggaweb.ch.8333: tcp 24
04:46:39.712083 IP tom-Latitude-3570.49070 > c-185-45-236-223.customer.ggaweb.ch.8333: tcp 109
04:46:39.750164 IP c-185-45-236-223.customer.ggaweb.ch.8333 > tom-Latitude-3570.49070: tcp 0
04:46:39.750771 IP c-185-45-236-223.customer.ggaweb.ch.8333 > tom-Latitude-3570.49070: tcp 0
04:46:39.835216 IP c-185-45-236-223.customer.ggaweb.ch.8333 > tom-Latitude-3570.49070: tcp 24
04:46:39.836099 IP c-185-45-236-223.customer.ggaweb.ch.8333 > tom-Latitude-3570.49070: tcp 246
04:46:39.836112 IP c-185-45-236-223.customer.ggaweb.ch.8333 > tom-Latitude-3570.49070: tcp 270
04:46:39.836115 IP c-185-45-236-223.customer.ggaweb.ch.8333 > tom-Latitude-3570.49070: tcp 266
04:46:39.836118 IP ns3113832.ip-54-38-177.eu.8333 > tom-Latitude-3570.56714: tcp 24
04:46:39.836121 IP ns3113832.ip-54-38-177.eu.8333 > tom-Latitude-3570.56714: tcp 31
04:46:39.836140 IP tom-Latitude-3570.49070 > c-185-45-236-223.customer.ggaweb.ch.8333: tcp 0
04:46:39.836178 IP tom-Latitude-3570.56714 > ns3113832.ip-54-38-177.eu.8333: tcp 0
04:46:39.920043 IP default-rdns.vocus.co.nz.8333 > tom-Latitude-3570.39282: tcp 24
04:46:39.922970 IP default-rdns.vocus.co.nz.8333 > tom-Latitude-3570.39282: tcp 505
04:46:39.923036 IP tom-Latitude-3570.39282 > default-rdns.vocus.co.nz.8333: tcp 0
04:46:39.996035 IP ns3113832.ip-54-38-177.eu.8333 > tom-Latitude-3570.56714: tcp 24
04:46:39.996841 IP ns3113832.ip-54-38-177.eu.8333 > tom-Latitude-3570.56714: tcp 109
04:46:39.996912 IP tom-Latitude-3570.56714 > ns3113832.ip-54-38-177.eu.8333: tcp 0
04:46:40.661060 IP bb42-60-217-183.singnet.com.sg.8333 > tom-Latitude-3570.60470: tcp 24
04:46:40.661080 IP bb42-60-217-183.singnet.com.sg.8333 > tom-Latitude-3570.60470: tcp 109
04:46:40.661084 IP bb42-60-217-183.singnet.com.sg.8333 > tom-Latitude-3570.60470: tcp 109
04:46:40.661142 IP tom-Latitude-3570.60470 > bb42-60-217-183.singnet.com.sg.8333: tcp 0
04:46:40.661391 IP tom-Latitude-3570.57976 > 167.99.216.145.8333: tcp 24
04:46:40.663599 IP tom-Latitude-3570.57976 > 167.99.216.145.8333: tcp 145
04:46:40.701573 IP 167.99.216.145.8333 > tom-Latitude-3570.57976: tcp 0
04:46:41.331800 IP default-rdns.vocus.co.nz.8333 > tom-Latitude-3570.39282: tcp 24
04:46:41.332362 IP default-rdns.vocus.co.nz.8333 > tom-Latitude-3570.39282: tcp 61
04:46:41.332421 IP tom-Latitude-3570.39282 > default-rdns.vocus.co.nz.8333: tcp 0
04:46:41.502788 IP ns3113832.ip-54-38-177.eu.8333 > tom-Latitude-3570.56714: tcp 24
04:46:41.502821 IP ns3113832.ip-54-38-177.eu.8333 > tom-Latitude-3570.56714: tcp 73
04:46:41.503136 IP tom-Latitude-3570.56714 > ns3113832.ip-54-38-177.eu.8333: tcp 0
04:46:41.503387 IP tom-Latitude-3570.56714 > ns3113832.ip-54-38-177.eu.8333: tcp 24
04:46:41.504523 IP tom-Latitude-3570.56714 > ns3113832.ip-54-38-177.eu.8333: tcp 73
04:46:41.529660 IP ns3113832.ip-54-38-177.eu.8333 > tom-Latitude-3570.56714: tcp 0
04:46:41.536458 IP ns3113832.ip-54-38-177.eu.8333 > tom-Latitude-3570.56714: tcp 0
04:46:41.594654 IP ns3113832.ip-54-38-177.eu.8333 > tom-Latitude-3570.56714: tcp 24
04:46:41.595333 IP ns3113832.ip-54-38-177.eu.8333 > tom-Latitude-3570.56714: tcp 248
04:46:41.595343 IP ns3113832.ip-54-38-177.eu.8333 > tom-Latitude-3570.56714: tcp 24
04:46:41.595346 IP ns3113832.ip-54-38-177.eu.8333 > tom-Latitude-3570.56714: tcp 247
04:46:41.595410 IP tom-Latitude-3570.56714 > ns3113832.ip-54-38-177.eu.8333: tcp 0
04:46:41.698368 IP tom-Latitude-3570.42516 > 2.56.9.15.8333: tcp 24
04:46:41.699184 IP tom-Latitude-3570.42516 > 2.56.9.15.8333: tcp 181
04:46:41.750576 IP 2.56.9.15.8333 > tom-Latitude-3570.42516: tcp 0
04:46:41.796880 IP bb42-60-217-183.singnet.com.sg.8333 > tom-Latitude-3570.60470: tcp 24
04:46:41.796897 IP tom-Latitude-3570.60470 > bb42-60-217-183.singnet.com.sg.8333: tcp 0
04:46:41.797454 IP bb42-60-217-183.singnet.com.sg.8333 > tom-Latitude-3570.60470: tcp 109
04:46:41.797466 IP tom-Latitude-3570.60470 > bb42-60-217-183.singnet.com.sg.8333: tcp 0
04:46:41.797718 IP tom-Latitude-3570.60470 > bb42-60-217-183.singnet.com.sg.8333: tcp 24
04:46:41.798669 IP tom-Latitude-3570.60470 > bb42-60-217-183.singnet.com.sg.8333: tcp 37
04:46:41.831863 IP bb42-60-217-183.singnet.com.sg.8333 > tom-Latitude-3570.60470: tcp 0
04:46:41.832503 IP bb42-60-217-183.singnet.com.sg.8333 > tom-Latitude-3570.60470: tcp 0
04:46:41.898126 IP tom-Latitude-3570.49070 > c-185-45-236-223.customer.ggaweb.ch.8333: tcp 24
04:46:41.899063 IP tom-Latitude-3570.49070 > c-185-45-236-223.customer.ggaweb.ch.8333: tcp 73
04:46:41.930684 IP c-185-45-236-223.customer.ggaweb.ch.8333 > tom-Latitude-3570.49070: tcp 0
04:46:41.938596 IP c-185-45-236-223.customer.ggaweb.ch.8333 > tom-Latitude-3570.49070: tcp 0
04:46:41.998594 IP tom-Latitude-3570.57976 > 167.99.216.145.8333: tcp 24
04:46:41.999991 IP tom-Latitude-3570.57976 > 167.99.216.145.8333: tcp 73
04:46:42.041787 IP 167.99.216.145.8333 > tom-Latitude-3570.57976: tcp 0
04:46:42.099092 IP tom-Latitude-3570.39282 > default-rdns.vocus.co.nz.8333: tcp 24
04:46:42.099823 IP tom-Latitude-3570.39282 > default-rdns.vocus.co.nz.8333: tcp 145
04:46:42.132357 IP default-rdns.vocus.co.nz.8333 > tom-Latitude-3570.39282: tcp 0
04:46:42.132369 IP default-rdns.vocus.co.nz.8333 > tom-Latitude-3570.39282: tcp 0
04:46:42.209740 IP bb42-60-217-183.singnet.com.sg.8333 > tom-Latitude-3570.60470: tcp 24
04:46:42.210324 IP bb42-60-217-183.singnet.com.sg.8333 > tom-Latitude-3570.60470: tcp 191
04:46:42.210438 IP tom-Latitude-3570.60470 > bb42-60-217-183.singnet.com.sg.8333: tcp 0
04:46:42.265537 IP bb42-60-217-183.singnet.com.sg.8333 > tom-Latitude-3570.60470: tcp 24
04:46:42.266118 IP bb42-60-217-183.singnet.com.sg.8333 > tom-Latitude-3570.60470: tcp 73
04:46:42.266195 IP tom-Latitude-3570.60470 > bb42-60-217-183.singnet.com.sg.8333: tcp 0
04:46:42.266390 IP tom-Latitude-3570.60470 > bb42-60-217-183.singnet.com.sg.8333: tcp 24
04:46:42.267625 IP tom-Latitude-3570.60470 > bb42-60-217-183.singnet.com.sg.8333: tcp 73
04:46:42.301630 IP bb42-60-217-183.singnet.com.sg.8333 > tom-Latitude-3570.60470: tcp 0
04:46:42.302198 IP bb42-60-217-183.singnet.com.sg.8333 > tom-Latitude-3570.60470: tcp 0
04:46:42.399328 IP 2.56.9.15.8333 > tom-Latitude-3570.42516: tcp 24
04:46:42.399349 IP 2.56.9.15.8333 > tom-Latitude-3570.42516: tcp 181
04:46:42.399441 IP tom-Latitude-3570.42516 > 2.56.9.15.8333: tcp 0
04:46:42.399579 IP tom-Latitude-3570.60988 > 81.198.101.144.8333: tcp 24
04:46:42.399729 IP tom-Latitude-3570.42516 > 2.56.9.15.8333: tcp 24
04:46:42.401063 IP tom-Latitude-3570.42516 > 2.56.9.15.8333: tcp 73
04:46:42.401072 IP tom-Latitude-3570.60988 > 81.198.101.144.8333: tcp 217
04:46:42.431887 IP 81.198.101.144.8333 > tom-Latitude-3570.60988: tcp 0
04:46:42.432452 IP 2.56.9.15.8333 > tom-Latitude-3570.42516: tcp 0
04:46:42.432466 IP 81.198.101.144.8333 > tom-Latitude-3570.60988: tcp 0
04:46:42.499994 IP tom-Latitude-3570.57976 > 167.99.216.145.8333: tcp 24
04:46:42.501746 IP tom-Latitude-3570.57976 > 167.99.216.145.8333: tcp 37
04:46:42.526976 IP 2.56.9.15.8333 > tom-Latitude-3570.42516: tcp 24
04:46:42.527651 IP 2.56.9.15.8333 > tom-Latitude-3570.42516: tcp 249
04:46:42.527669 IP 2.56.9.15.8333 > tom-Latitude-3570.42516: tcp 24
04:46:42.527671 IP 2.56.9.15.8333 > tom-Latitude-3570.42516: tcp 221
04:46:42.527766 IP tom-Latitude-3570.42516 > 2.56.9.15.8333: tcp 0
04:46:42.541792 IP 167.99.216.145.8333 > tom-Latitude-3570.57976: tcp 0
04:46:42.709215 IP bb42-60-217-183.singnet.com.sg.8333 > tom-Latitude-3570.60470: tcp 24
04:46:42.709241 IP bb42-60-217-183.singnet.com.sg.8333 > tom-Latitude-3570.60470: tcp 262
04:46:42.709246 IP bb42-60-217-183.singnet.com.sg.8333 > tom-Latitude-3570.60470: tcp 24
04:46:42.709249 IP bb42-60-217-183.singnet.com.sg.8333 > tom-Latitude-3570.60470: tcp 262
04:46:42.709314 IP tom-Latitude-3570.60470 > bb42-60-217-183.singnet.com.sg.8333: tcp 0
04:46:42.910458 IP tom-Latitude-3570.39282 > default-rdns.vocus.co.nz.8333: tcp 24
04:46:42.911587 IP tom-Latitude-3570.39282 > default-rdns.vocus.co.nz.8333: tcp 181
04:46:42.912151 IP c-185-45-236-223.customer.ggaweb.ch.8333 > tom-Latitude-3570.49070: tcp 24
04:46:42.912171 IP c-185-45-236-223.customer.ggaweb.ch.8333 > tom-Latitude-3570.49070: tcp 217
04:46:42.912264 IP tom-Latitude-3570.49070 > c-185-45-236-223.customer.ggaweb.ch.8333: tcp 0
04:46:42.912433 IP tom-Latitude-3570.49070 > c-185-45-236-223.customer.ggaweb.ch.8333: tcp 24
04:46:42.913737 IP tom-Latitude-3570.49070 > c-185-45-236-223.customer.ggaweb.ch.8333: tcp 37
04:46:42.959766 IP default-rdns.vocus.co.nz.8333 > tom-Latitude-3570.39282: tcp 0
04:46:42.960401 IP default-rdns.vocus.co.nz.8333 > tom-Latitude-3570.39282: tcp 0
