04:21:17.741026 IP tom-Latitude-3570.39282 > default-rdns.vocus.co.nz.8333: tcp 24
04:21:17.742002 IP tom-Latitude-3570.39282 > default-rdns.vocus.co.nz.8333: tcp 577
04:21:17.790170 IP default-rdns.vocus.co.nz.8333 > tom-Latitude-3570.39282: tcp 0
04:21:17.796729 IP default-rdns.vocus.co.nz.8333 > tom-Latitude-3570.39282: tcp 0
04:21:17.941900 IP tom-Latitude-3570.49070 > c-185-45-236-223.customer.ggaweb.ch.8333: tcp 24
04:21:17.942835 IP tom-Latitude-3570.49070 > c-185-45-236-223.customer.ggaweb.ch.8333: tcp 73
04:21:17.979051 IP c-185-45-236-223.customer.ggaweb.ch.8333 > tom-Latitude-3570.49070: tcp 0
04:21:18.042373 IP tom-Latitude-3570.60470 > bb42-60-217-183.singnet.com.sg.8333: tcp 24
04:21:18.043323 IP tom-Latitude-3570.60470 > bb42-60-217-183.singnet.com.sg.8333: tcp 73
04:21:18.077903 IP bb42-60-217-183.singnet.com.sg.8333 > tom-Latitude-3570.60470: tcp 0
04:21:18.329174 IP c-185-45-236-223.customer.ggaweb.ch.8333 > tom-Latitude-3570.49070: tcp 24
04:21:18.329200 IP tom-Latitude-3570.49070 > c-185-45-236-223.customer.ggaweb.ch.8333: tcp 0
04:21:18.332434 IP c-185-45-236-223.customer.ggaweb.ch.8333 > tom-Latitude-3570.49070: tcp 145
04:21:18.332460 IP tom-Latitude-3570.49070 > c-185-45-236-223.customer.ggaweb.ch.8333: tcp 0
04:21:18.332700 IP tom-Latitude-3570.49070 > c-185-45-236-223.customer.ggaweb.ch.8333: tcp 24
04:21:18.333895 IP tom-Latitude-3570.49070 > c-185-45-236-223.customer.ggaweb.ch.8333: tcp 145
04:21:18.368002 IP c-185-45-236-223.customer.ggaweb.ch.8333 > tom-Latitude-3570.49070: tcp 0
04:21:18.452999 IP c-185-45-236-223.customer.ggaweb.ch.8333 > tom-Latitude-3570.49070: tcp 24
04:21:18.454911 IP c-185-45-236-223.customer.ggaweb.ch.8333 > tom-Latitude-3570.49070: tcp 678
04:21:18.454930 IP c-185-45-236-223.customer.ggaweb.ch.8333 > tom-Latitude-3570.49070: tcp 530
04:21:18.454974 IP tom-Latitude-3570.49070 > c-185-45-236-223.customer.ggaweb.ch.8333: tcp 0
04:21:18.857892 IP tom-Latitude-3570.60470 > bb42-60-217-183.singnet.com.sg.8333: tcp 24
04:21:18.858828 IP tom-Latitude-3570.60470 > bb42-60-217-183.singnet.com.sg.8333: tcp 145
04:21:18.907393 IP bb42-60-217-183.singnet.com.sg.8333 > tom-Latitude-3570.60470: tcp 0
04:21:18.958266 IP tom-Latitude-3570.39110 > vmi195435.contaboserver.net.8333: tcp 24
04:21:18.958409 IP tom-Latitude-3570.57976 > 167.99.216.145.8333: tcp 24
04:21:18.959250 IP tom-Latitude-3570.57976 > 167.99.216.145.8333: tcp 721
04:21:18.959261 IP tom-Latitude-3570.39110 > vmi195435.contaboserver.net.8333: tcp 181
04:21:18.990057 IP vmi195435.contaboserver.net.8333 > tom-Latitude-3570.39110: tcp 0
04:21:18.996720 IP 167.99.216.145.8333 > tom-Latitude-3570.57976: tcp 0
04:21:18.997357 IP 167.99.216.145.8333 > tom-Latitude-3570.57976: tcp 0
04:21:18.997370 IP vmi195435.contaboserver.net.8333 > tom-Latitude-3570.39110: tcp 0
04:21:19.000509 IP c-185-45-236-223.customer.ggaweb.ch.8333 > tom-Latitude-3570.49070: tcp 24
04:21:19.001120 IP c-185-45-236-223.customer.ggaweb.ch.8333 > tom-Latitude-3570.49070: tcp 145
04:21:19.001184 IP tom-Latitude-3570.49070 > c-185-45-236-223.customer.ggaweb.ch.8333: tcp 0
04:21:19.001397 IP tom-Latitude-3570.49070 > c-185-45-236-223.customer.ggaweb.ch.8333: tcp 24
04:21:19.002687 IP tom-Latitude-3570.49070 > c-185-45-236-223.customer.ggaweb.ch.8333: tcp 145
04:21:19.038063 IP c-185-45-236-223.customer.ggaweb.ch.8333 > tom-Latitude-3570.49070: tcp 0
04:21:19.124119 IP c-185-45-236-223.customer.ggaweb.ch.8333 > tom-Latitude-3570.49070: tcp 24
04:21:19.124817 IP c-185-45-236-223.customer.ggaweb.ch.8333 > tom-Latitude-3570.49070: tcp 617
04:21:19.124880 IP tom-Latitude-3570.49070 > c-185-45-236-223.customer.ggaweb.ch.8333: tcp 0
04:21:19.133019 IP c-185-45-236-223.customer.ggaweb.ch.8333 > tom-Latitude-3570.49070: tcp 527
04:21:19.175904 IP tom-Latitude-3570.49070 > c-185-45-236-223.customer.ggaweb.ch.8333: tcp 0
04:21:19.233920 IP tom-Latitude-3570.56714 > ns3113832.ip-54-38-177.eu.8333: tcp 24
04:21:19.233993 IP tom-Latitude-3570.42516 > 2.56.9.15.8333: tcp 24
04:21:19.234896 IP tom-Latitude-3570.42516 > 2.56.9.15.8333: tcp 325
04:21:19.234908 IP tom-Latitude-3570.56714 > ns3113832.ip-54-38-177.eu.8333: tcp 361
04:21:19.277110 IP ns3113832.ip-54-38-177.eu.8333 > tom-Latitude-3570.56714: tcp 0
04:21:19.286081 IP 2.56.9.15.8333 > tom-Latitude-3570.42516: tcp 0
04:21:19.286652 IP ns3113832.ip-54-38-177.eu.8333 > tom-Latitude-3570.56714: tcp 0
04:21:19.630833 IP 81.198.101.144.8333 > tom-Latitude-3570.60988: tcp 24
04:21:19.631399 IP 81.198.101.144.8333 > tom-Latitude-3570.60988: tcp 181
04:21:19.631463 IP tom-Latitude-3570.60988 > 81.198.101.144.8333: tcp 0
04:21:19.631681 IP tom-Latitude-3570.39282 > default-rdns.vocus.co.nz.8333: tcp 24
04:21:19.633072 IP tom-Latitude-3570.39282 > default-rdns.vocus.co.nz.8333: tcp 31
04:21:19.668976 IP default-rdns.vocus.co.nz.8333 > tom-Latitude-3570.39282: tcp 0
04:21:19.669550 IP default-rdns.vocus.co.nz.8333 > tom-Latitude-3570.39282: tcp 0
04:21:19.685951 IP c-185-45-236-223.customer.ggaweb.ch.8333 > tom-Latitude-3570.49070: tcp 24
04:21:19.685968 IP tom-Latitude-3570.49070 > c-185-45-236-223.customer.ggaweb.ch.8333: tcp 0
04:21:19.686541 IP c-185-45-236-223.customer.ggaweb.ch.8333 > tom-Latitude-3570.49070: tcp 8
04:21:19.686559 IP tom-Latitude-3570.49070 > c-185-45-236-223.customer.ggaweb.ch.8333: tcp 0
04:21:19.686726 IP tom-Latitude-3570.49070 > c-185-45-236-223.customer.ggaweb.ch.8333: tcp 24
04:21:19.686830 IP tom-Latitude-3570.60988 > 81.198.101.144.8333: tcp 24
04:21:19.687915 IP tom-Latitude-3570.60988 > 81.198.101.144.8333: tcp 109
04:21:19.687926 IP tom-Latitude-3570.49070 > c-185-45-236-223.customer.ggaweb.ch.8333: tcp 40
04:21:19.727900 IP 81.198.101.144.8333 > tom-Latitude-3570.60988: tcp 0
04:21:19.728562 IP c-185-45-236-223.customer.ggaweb.ch.8333 > tom-Latitude-3570.49070: tcp 0
04:21:19.822271 IP c-185-45-236-223.customer.ggaweb.ch.8333 > tom-Latitude-3570.49070: tcp 24
04:21:19.822290 IP c-185-45-236-223.customer.ggaweb.ch.8333 > tom-Latitude-3570.49070: tcp 8
04:21:19.822380 IP tom-Latitude-3570.49070 > c-185-45-236-223.customer.ggaweb.ch.8333: tcp 0
04:21:19.937939 IP tom-Latitude-3570.44696 > 104-57-178-131.lightspeed.austtx.sbcglobal.net.8333: tcp 0
04:21:19.970750 IP 104-57-178-131.lightspeed.austtx.sbcglobal.net.8333 > tom-Latitude-3570.44696: tcp 0
04:21:19.970781 IP tom-Latitude-3570.44696 > 104-57-178-131.lightspeed.austtx.sbcglobal.net.8333: tcp 0
04:21:19.971107 IP tom-Latitude-3570.44696 > 104-57-178-131.lightspeed.austtx.sbcglobal.net.8333: tcp 24
04:21:19.972221 IP tom-Latitude-3570.44696 > 104-57-178-131.lightspeed.austtx.sbcglobal.net.8333: tcp 102
04:21:19.981902 IP vmi195435.contaboserver.net.8333 > tom-Latitude-3570.39110: tcp 24
04:21:19.981918 IP tom-Latitude-3570.39110 > vmi195435.contaboserver.net.8333: tcp 0
04:21:19.982554 IP vmi195435.contaboserver.net.8333 > tom-Latitude-3570.39110: tcp 325
04:21:19.982557 IP tom-Latitude-3570.39110 > vmi195435.contaboserver.net.8333: tcp 0
04:21:19.982741 IP tom-Latitude-3570.39110 > vmi195435.contaboserver.net.8333: tcp 24
04:21:19.983751 IP tom-Latitude-3570.39110 > vmi195435.contaboserver.net.8333: tcp 181
04:21:20.017876 IP vmi195435.contaboserver.net.8333 > tom-Latitude-3570.39110: tcp 0
04:21:20.018545 IP vmi195435.contaboserver.net.8333 > tom-Latitude-3570.39110: tcp 0
04:21:20.041720 IP 104-57-178-131.lightspeed.austtx.sbcglobal.net.8333 > tom-Latitude-3570.44696: tcp 0
04:21:20.096748 IP vmi195435.contaboserver.net.8333 > tom-Latitude-3570.39110: tcp 24
04:21:20.097663 IP vmi195435.contaboserver.net.8333 > tom-Latitude-3570.39110: tcp 303
04:21:20.097680 IP vmi195435.contaboserver.net.8333 > tom-Latitude-3570.39110: tcp 24
04:21:20.097683 IP vmi195435.contaboserver.net.8333 > tom-Latitude-3570.39110: tcp 374
04:21:20.097685 IP vmi195435.contaboserver.net.8333 > tom-Latitude-3570.39110: tcp 24
04:21:20.097687 IP vmi195435.contaboserver.net.8333 > tom-Latitude-3570.39110: tcp 226
04:21:20.097690 IP vmi195435.contaboserver.net.8333 > tom-Latitude-3570.39110: tcp 24
04:21:20.097692 IP vmi195435.contaboserver.net.8333 > tom-Latitude-3570.39110: tcp 333
04:21:20.097693 IP vmi195435.contaboserver.net.8333 > tom-Latitude-3570.39110: tcp 24
04:21:20.097695 IP vmi195435.contaboserver.net.8333 > tom-Latitude-3570.39110: tcp 224
04:21:20.097777 IP tom-Latitude-3570.39110 > vmi195435.contaboserver.net.8333: tcp 0
04:21:20.311315 IP 104-57-178-131.lightspeed.austtx.sbcglobal.net.8333 > tom-Latitude-3570.44696: tcp 24
04:21:20.311334 IP tom-Latitude-3570.44696 > 104-57-178-131.lightspeed.austtx.sbcglobal.net.8333: tcp 0
04:21:20.319807 IP 104-57-178-131.lightspeed.austtx.sbcglobal.net.8333 > tom-Latitude-3570.44696: tcp 126
04:21:20.319812 IP tom-Latitude-3570.44696 > 104-57-178-131.lightspeed.austtx.sbcglobal.net.8333: tcp 0
04:21:20.319907 IP tom-Latitude-3570.44696 > 104-57-178-131.lightspeed.austtx.sbcglobal.net.8333: tcp 24
04:21:20.321131 IP tom-Latitude-3570.44696 > 104-57-178-131.lightspeed.austtx.sbcglobal.net.8333: tcp 24
04:21:20.365704 IP 104-57-178-131.lightspeed.austtx.sbcglobal.net.8333 > tom-Latitude-3570.44696: tcp 0
04:21:20.366316 IP 104-57-178-131.lightspeed.austtx.sbcglobal.net.8333 > tom-Latitude-3570.44696: tcp 0
04:21:20.369982 IP tom-Latitude-3570.44696 > 104-57-178-131.lightspeed.austtx.sbcglobal.net.8333: tcp 0
04:21:20.438429 IP 104-57-178-131.lightspeed.austtx.sbcglobal.net.8333 > tom-Latitude-3570.44696: tcp 0
04:21:20.530157 IP 104-57-178-131.lightspeed.austtx.sbcglobal.net.8333 > tom-Latitude-3570.44696: tcp 24
04:21:20.530177 IP tom-Latitude-3570.44696 > 104-57-178-131.lightspeed.austtx.sbcglobal.net.8333: tcp 0
04:21:20.530753 IP 104-57-178-131.lightspeed.austtx.sbcglobal.net.8333 > tom-Latitude-3570.44696: tcp 153
04:21:20.530763 IP tom-Latitude-3570.44696 > 104-57-178-131.lightspeed.austtx.sbcglobal.net.8333: tcp 0
04:21:20.530772 IP 104-57-178-131.lightspeed.austtx.sbcglobal.net.8333 > tom-Latitude-3570.44696: tcp 1085
04:21:20.530774 IP tom-Latitude-3570.44696 > 104-57-178-131.lightspeed.austtx.sbcglobal.net.8333: tcp 0
04:21:20.560493 IP 104-57-178-131.lightspeed.austtx.sbcglobal.net.8333 > tom-Latitude-3570.44696: tcp 0
04:21:20.560513 IP tom-Latitude-3570.44696 > 104-57-178-131.lightspeed.austtx.sbcglobal.net.8333: tcp 0
04:21:20.621587 IP tom-Latitude-3570.60988 > 81.198.101.144.8333: tcp 24
04:21:20.621667 IP tom-Latitude-3570.57976 > 167.99.216.145.8333: tcp 24
04:21:20.622810 IP tom-Latitude-3570.57976 > 167.99.216.145.8333: tcp 325
04:21:20.622821 IP tom-Latitude-3570.60988 > 81.198.101.144.8333: tcp 181
04:21:20.658178 IP 81.198.101.144.8333 > tom-Latitude-3570.60988: tcp 0
04:21:20.658192 IP 167.99.216.145.8333 > tom-Latitude-3570.57976: tcp 0
04:21:20.658196 IP 167.99.216.145.8333 > tom-Latitude-3570.57976: tcp 0
04:21:20.763611 IP 167.99.216.145.8333 > tom-Latitude-3570.57976: tcp 24
04:21:20.763628 IP tom-Latitude-3570.57976 > 167.99.216.145.8333: tcp 0
04:21:20.763646 IP 167.99.216.145.8333 > tom-Latitude-3570.57976: tcp 37
04:21:20.763649 IP tom-Latitude-3570.57976 > 167.99.216.145.8333: tcp 0
04:21:20.763817 IP tom-Latitude-3570.57976 > 167.99.216.145.8333: tcp 24
04:21:20.765157 IP tom-Latitude-3570.57976 > 167.99.216.145.8333: tcp 37
04:21:20.807869 IP 167.99.216.145.8333 > tom-Latitude-3570.57976: tcp 0
04:21:20.815843 IP 167.99.216.145.8333 > tom-Latitude-3570.57976: tcp 0
04:21:20.864216 IP tom-Latitude-3570.60470 > bb42-60-217-183.singnet.com.sg.8333: tcp 24
04:21:20.865127 IP tom-Latitude-3570.60470 > bb42-60-217-183.singnet.com.sg.8333: tcp 325
04:21:20.871930 IP 167.99.216.145.8333 > tom-Latitude-3570.57976: tcp 24
04:21:20.872619 IP 167.99.216.145.8333 > tom-Latitude-3570.57976: tcp 691
04:21:20.872683 IP tom-Latitude-3570.57976 > 167.99.216.145.8333: tcp 0
04:21:20.915626 IP bb42-60-217-183.singnet.com.sg.8333 > tom-Latitude-3570.60470: tcp 0
04:21:20.973400 IP tom-Latitude-3570.60470 > bb42-60-217-183.singnet.com.sg.8333: tcp 24
04:21:20.974306 IP tom-Latitude-3570.60470 > bb42-60-217-183.singnet.com.sg.8333: tcp 37
04:21:21.011581 IP bb42-60-217-183.singnet.com.sg.8333 > tom-Latitude-3570.60470: tcp 24
04:21:21.011604 IP bb42-60-217-183.singnet.com.sg.8333 > tom-Latitude-3570.60470: tcp 397
04:21:21.011649 IP tom-Latitude-3570.60470 > bb42-60-217-183.singnet.com.sg.8333: tcp 0
04:21:21.011847 IP tom-Latitude-3570.60470 > bb42-60-217-183.singnet.com.sg.8333: tcp 24
04:21:21.011875 IP tom-Latitude-3570.60470 > bb42-60-217-183.singnet.com.sg.8333: tcp 37
04:21:21.015573 IP bb42-60-217-183.singnet.com.sg.8333 > tom-Latitude-3570.60470: tcp 0
04:21:21.051126 IP bb42-60-217-183.singnet.com.sg.8333 > tom-Latitude-3570.60470: tcp 0
04:21:21.286883 IP vmi195435.contaboserver.net.8333 > tom-Latitude-3570.39110: tcp 24
04:21:21.287466 IP vmi195435.contaboserver.net.8333 > tom-Latitude-3570.39110: tcp 145
04:21:21.287489 IP tom-Latitude-3570.39110 > vmi195435.contaboserver.net.8333: tcp 0
04:21:21.287603 IP tom-Latitude-3570.39110 > vmi195435.contaboserver.net.8333: tcp 24
04:21:21.288892 IP tom-Latitude-3570.39110 > vmi195435.contaboserver.net.8333: tcp 73
04:21:21.311176 IP vmi195435.contaboserver.net.8333 > tom-Latitude-3570.39110: tcp 0
04:21:21.317739 IP vmi195435.contaboserver.net.8333 > tom-Latitude-3570.39110: tcp 0
04:21:21.394234 IP vmi195435.contaboserver.net.8333 > tom-Latitude-3570.39110: tcp 24
04:21:21.395023 IP vmi195435.contaboserver.net.8333 > tom-Latitude-3570.39110: tcp 223
04:21:21.395029 IP vmi195435.contaboserver.net.8333 > tom-Latitude-3570.39110: tcp 24
04:21:21.395032 IP vmi195435.contaboserver.net.8333 > tom-Latitude-3570.39110: tcp 639
04:21:21.395043 IP tom-Latitude-3570.39110 > vmi195435.contaboserver.net.8333: tcp 0
04:21:21.425968 IP bb42-60-217-183.singnet.com.sg.8333 > tom-Latitude-3570.60470: tcp 24
04:21:21.426558 IP bb42-60-217-183.singnet.com.sg.8333 > tom-Latitude-3570.60470: tcp 223
04:21:21.426648 IP tom-Latitude-3570.60470 > bb42-60-217-183.singnet.com.sg.8333: tcp 0
04:21:21.453828 IP ns3113832.ip-54-38-177.eu.8333 > tom-Latitude-3570.56714: tcp 24
04:21:21.454426 IP ns3113832.ip-54-38-177.eu.8333 > tom-Latitude-3570.56714: tcp 253
04:21:21.454450 IP tom-Latitude-3570.56714 > ns3113832.ip-54-38-177.eu.8333: tcp 0
04:21:21.454598 IP tom-Latitude-3570.49070 > c-185-45-236-223.customer.ggaweb.ch.8333: tcp 24
04:21:21.455847 IP tom-Latitude-3570.49070 > c-185-45-236-223.customer.ggaweb.ch.8333: tcp 325
04:21:21.506234 IP c-185-45-236-223.customer.ggaweb.ch.8333 > tom-Latitude-3570.49070: tcp 0
04:21:21.655428 IP tom-Latitude-3570.57976 > 167.99.216.145.8333: tcp 24
04:21:21.655483 IP tom-Latitude-3570.60470 > bb42-60-217-183.singnet.com.sg.8333: tcp 24
04:21:21.656391 IP tom-Latitude-3570.60470 > bb42-60-217-183.singnet.com.sg.8333: tcp 73
04:21:21.656403 IP tom-Latitude-3570.57976 > 167.99.216.145.8333: tcp 109
04:21:21.689904 IP 167.99.216.145.8333 > tom-Latitude-3570.57976: tcp 0
04:21:21.697952 IP bb42-60-217-183.singnet.com.sg.8333 > tom-Latitude-3570.60470: tcp 0
04:21:21.698731 IP 167.99.216.145.8333 > tom-Latitude-3570.57976: tcp 0
04:21:21.923989 IP 81.198.101.144.8333 > tom-Latitude-3570.60988: tcp 24
04:21:21.926863 IP 81.198.101.144.8333 > tom-Latitude-3570.60988: tcp 109
04:21:21.926926 IP tom-Latitude-3570.60988 > 81.198.101.144.8333: tcp 0
04:21:21.927115 IP tom-Latitude-3570.60988 > 81.198.101.144.8333: tcp 24
04:21:21.928545 IP tom-Latitude-3570.60988 > 81.198.101.144.8333: tcp 37
04:21:21.964218 IP 81.198.101.144.8333 > tom-Latitude-3570.60988: tcp 0
04:21:22.054023 IP 81.198.101.144.8333 > tom-Latitude-3570.60988: tcp 24
04:21:22.056458 IP 81.198.101.144.8333 > tom-Latitude-3570.60988: tcp 225
04:21:22.056521 IP tom-Latitude-3570.60988 > 81.198.101.144.8333: tcp 0
04:21:22.458237 IP tom-Latitude-3570.56714 > ns3113832.ip-54-38-177.eu.8333: tcp 24
04:21:22.459174 IP tom-Latitude-3570.56714 > ns3113832.ip-54-38-177.eu.8333: tcp 109
04:21:22.498811 IP ns3113832.ip-54-38-177.eu.8333 > tom-Latitude-3570.56714: tcp 0
04:21:22.506816 IP ns3113832.ip-54-38-177.eu.8333 > tom-Latitude-3570.56714: tcp 0
04:21:22.569616 IP ns3113832.ip-54-38-177.eu.8333 > tom-Latitude-3570.56714: tcp 24
04:21:22.570887 IP ns3113832.ip-54-38-177.eu.8333 > tom-Latitude-3570.56714: tcp 37
04:21:22.570904 IP ns3113832.ip-54-38-177.eu.8333 > tom-Latitude-3570.56714: tcp 24
04:21:22.570907 IP ns3113832.ip-54-38-177.eu.8333 > tom-Latitude-3570.56714: tcp 37
04:21:22.570952 IP tom-Latitude-3570.56714 > ns3113832.ip-54-38-177.eu.8333: tcp 0
04:21:22.571128 IP tom-Latitude-3570.56714 > ns3113832.ip-54-38-177.eu.8333: tcp 24
04:21:22.572376 IP tom-Latitude-3570.56714 > ns3113832.ip-54-38-177.eu.8333: tcp 286
04:21:22.612582 IP ns3113832.ip-54-38-177.eu.8333 > tom-Latitude-3570.56714: tcp 0
04:21:22.612596 IP ns3113832.ip-54-38-177.eu.8333 > tom-Latitude-3570.56714: tcp 0
04:21:22.667649 IP ns3113832.ip-54-38-177.eu.8333 > tom-Latitude-3570.56714: tcp 24
04:21:22.667669 IP ns3113832.ip-54-38-177.eu.8333 > tom-Latitude-3570.56714: tcp 1350
04:21:22.667681 IP ns3113832.ip-54-38-177.eu.8333 > tom-Latitude-3570.56714: tcp 1350
04:21:22.667763 IP tom-Latitude-3570.56714 > ns3113832.ip-54-38-177.eu.8333: tcp 0
04:21:22.671176 IP ns3113832.ip-54-38-177.eu.8333 > tom-Latitude-3570.56714: tcp 1280
04:21:22.711906 IP tom-Latitude-3570.56714 > ns3113832.ip-54-38-177.eu.8333: tcp 0
04:21:22.776245 IP tom-Latitude-3570.49070 > c-185-45-236-223.customer.ggaweb.ch.8333: tcp 24
04:21:22.777185 IP tom-Latitude-3570.49070 > c-185-45-236-223.customer.ggaweb.ch.8333: tcp 73
04:21:22.817787 IP 2.56.9.15.8333 > tom-Latitude-3570.42516: tcp 24
04:21:22.817813 IP tom-Latitude-3570.42516 > 2.56.9.15.8333: tcp 0
04:21:22.817830 IP 2.56.9.15.8333 > tom-Latitude-3570.42516: tcp 8
04:21:22.817833 IP tom-Latitude-3570.42516 > 2.56.9.15.8333: tcp 0
04:21:22.817977 IP tom-Latitude-3570.42516 > 2.56.9.15.8333: tcp 24
04:21:22.818236 IP c-185-45-236-223.customer.ggaweb.ch.8333 > tom-Latitude-3570.49070: tcp 0
04:21:22.819047 IP tom-Latitude-3570.42516 > 2.56.9.15.8333: tcp 8
04:21:22.848492 IP 2.56.9.15.8333 > tom-Latitude-3570.42516: tcp 0
04:21:22.918392 IP tom-Latitude-3570.60988 > 81.198.101.144.8333: tcp 24
04:21:22.918434 IP tom-Latitude-3570.42516 > 2.56.9.15.8333: tcp 24
04:21:22.920801 IP tom-Latitude-3570.42516 > 2.56.9.15.8333: tcp 8
04:21:22.920812 IP tom-Latitude-3570.60988 > 81.198.101.144.8333: tcp 8
04:21:22.958415 IP 2.56.9.15.8333 > tom-Latitude-3570.42516: tcp 0
04:21:22.959895 IP 81.198.101.144.8333 > tom-Latitude-3570.60988: tcp 0
04:21:23.055530 IP 2.56.9.15.8333 > tom-Latitude-3570.42516: tcp 24
04:21:23.056148 IP 2.56.9.15.8333 > tom-Latitude-3570.42516: tcp 8
04:21:23.056211 IP tom-Latitude-3570.42516 > 2.56.9.15.8333: tcp 0
04:21:23.056428 IP tom-Latitude-3570.42516 > 2.56.9.15.8333: tcp 24
04:21:23.057787 IP tom-Latitude-3570.42516 > 2.56.9.15.8333: tcp 397
04:21:23.095071 IP 2.56.9.15.8333 > tom-Latitude-3570.42516: tcp 0
04:21:23.120395 IP 81.198.101.144.8333 > tom-Latitude-3570.60988: tcp 24
04:21:23.129563 IP 81.198.101.144.8333 > tom-Latitude-3570.60988: tcp 8
04:21:23.129626 IP tom-Latitude-3570.60988 > 81.198.101.144.8333: tcp 0
04:21:23.129796 IP tom-Latitude-3570.57976 > 167.99.216.145.8333: tcp 24
04:21:23.131169 IP tom-Latitude-3570.57976 > 167.99.216.145.8333: tcp 73
04:21:23.168544 IP 167.99.216.145.8333 > tom-Latitude-3570.57976: tcp 0
04:21:23.168927 IP 167.99.216.145.8333 > tom-Latitude-3570.57976: tcp 0
04:21:23.230224 IP tom-Latitude-3570.39110 > vmi195435.contaboserver.net.8333: tcp 24
04:21:23.230281 IP tom-Latitude-3570.60470 > bb42-60-217-183.singnet.com.sg.8333: tcp 24
04:21:23.231230 IP tom-Latitude-3570.60470 > bb42-60-217-183.singnet.com.sg.8333: tcp 73
04:21:23.231242 IP tom-Latitude-3570.39110 > vmi195435.contaboserver.net.8333: tcp 73
04:21:23.238441 IP ns3113832.ip-54-38-177.eu.8333 > tom-Latitude-3570.56714: tcp 24
04:21:23.238466 IP tom-Latitude-3570.56714 > ns3113832.ip-54-38-177.eu.8333: tcp 0
04:21:23.238994 IP ns3113832.ip-54-38-177.eu.8333 > tom-Latitude-3570.56714: tcp 8
04:21:23.239012 IP tom-Latitude-3570.56714 > ns3113832.ip-54-38-177.eu.8333: tcp 0
04:21:23.239185 IP tom-Latitude-3570.56714 > ns3113832.ip-54-38-177.eu.8333: tcp 24
04:21:23.240313 IP tom-Latitude-3570.56714 > ns3113832.ip-54-38-177.eu.8333: tcp 8
04:21:23.250439 IP vmi195435.contaboserver.net.8333 > tom-Latitude-3570.39110: tcp 0
04:21:23.258452 IP bb42-60-217-183.singnet.com.sg.8333 > tom-Latitude-3570.60470: tcp 0
04:21:23.268358 IP ns3113832.ip-54-38-177.eu.8333 > tom-Latitude-3570.56714: tcp 0
04:21:23.268372 IP vmi195435.contaboserver.net.8333 > tom-Latitude-3570.39110: tcp 0
04:21:23.274492 IP ns3113832.ip-54-38-177.eu.8333 > tom-Latitude-3570.56714: tcp 0
04:21:23.324027 IP c-185-45-236-223.customer.ggaweb.ch.8333 > tom-Latitude-3570.49070: tcp 24
04:21:23.324045 IP c-185-45-236-223.customer.ggaweb.ch.8333 > tom-Latitude-3570.49070: tcp 109
04:21:23.324110 IP tom-Latitude-3570.49070 > c-185-45-236-223.customer.ggaweb.ch.8333: tcp 0
04:21:23.324373 IP tom-Latitude-3570.49070 > c-185-45-236-223.customer.ggaweb.ch.8333: tcp 24
04:21:23.325797 IP tom-Latitude-3570.49070 > c-185-45-236-223.customer.ggaweb.ch.8333: tcp 109
04:21:23.356598 IP c-185-45-236-223.customer.ggaweb.ch.8333 > tom-Latitude-3570.49070: tcp 0
04:21:23.424773 IP tom-Latitude-3570.56714 > ns3113832.ip-54-38-177.eu.8333: tcp 24
04:21:23.425712 IP tom-Latitude-3570.56714 > ns3113832.ip-54-38-177.eu.8333: tcp 8
04:21:23.444298 IP c-185-45-236-223.customer.ggaweb.ch.8333 > tom-Latitude-3570.49070: tcp 24
04:21:23.444318 IP c-185-45-236-223.customer.ggaweb.ch.8333 > tom-Latitude-3570.49070: tcp 712
04:21:23.444361 IP tom-Latitude-3570.49070 > c-185-45-236-223.customer.ggaweb.ch.8333: tcp 0
04:21:23.452572 IP ns3113832.ip-54-38-177.eu.8333 > tom-Latitude-3570.56714: tcp 0
04:21:23.452584 IP ns3113832.ip-54-38-177.eu.8333 > tom-Latitude-3570.56714: tcp 0
04:21:23.512354 IP ns3113832.ip-54-38-177.eu.8333 > tom-Latitude-3570.56714: tcp 24
04:21:23.512373 IP ns3113832.ip-54-38-177.eu.8333 > tom-Latitude-3570.56714: tcp 8
04:21:23.512419 IP tom-Latitude-3570.56714 > ns3113832.ip-54-38-177.eu.8333: tcp 0
04:21:23.549637 IP 81.198.101.144.8333 > tom-Latitude-3570.60988: tcp 24
04:21:23.549656 IP 81.198.101.144.8333 > tom-Latitude-3570.60988: tcp 289
04:21:23.549724 IP tom-Latitude-3570.60988 > 81.198.101.144.8333: tcp 0
04:21:23.549976 IP tom-Latitude-3570.60988 > 81.198.101.144.8333: tcp 24
04:21:23.551141 IP tom-Latitude-3570.60988 > 81.198.101.144.8333: tcp 73
04:21:23.588476 IP 81.198.101.144.8333 > tom-Latitude-3570.60988: tcp 0
04:21:23.639537 IP bb42-60-217-183.singnet.com.sg.8333 > tom-Latitude-3570.60470: tcp 24
04:21:23.640269 IP bb42-60-217-183.singnet.com.sg.8333 > tom-Latitude-3570.60470: tcp 109
04:21:23.640332 IP tom-Latitude-3570.60470 > bb42-60-217-183.singnet.com.sg.8333: tcp 0
04:21:23.677646 IP 81.198.101.144.8333 > tom-Latitude-3570.60988: tcp 24
04:21:23.678431 IP 81.198.101.144.8333 > tom-Latitude-3570.60988: tcp 518
04:21:23.678450 IP 81.198.101.144.8333 > tom-Latitude-3570.60988: tcp 24
04:21:23.678453 IP 81.198.101.144.8333 > tom-Latitude-3570.60988: tcp 371
04:21:23.678496 IP tom-Latitude-3570.60988 > 81.198.101.144.8333: tcp 0
04:21:24.381876 IP tom-Latitude-3570.56714 > ns3113832.ip-54-38-177.eu.8333: tcp 24
04:21:24.382847 IP tom-Latitude-3570.56714 > ns3113832.ip-54-38-177.eu.8333: tcp 181
04:21:24.436687 IP ns3113832.ip-54-38-177.eu.8333 > tom-Latitude-3570.56714: tcp 0
04:21:24.451681 IP ns3113832.ip-54-38-177.eu.8333 > tom-Latitude-3570.56714: tcp 0
04:21:24.582551 IP tom-Latitude-3570.39282 > default-rdns.vocus.co.nz.8333: tcp 24
04:21:24.604946 IP tom-Latitude-3570.39282 > default-rdns.vocus.co.nz.8333: tcp 8
04:21:24.614485 IP default-rdns.vocus.co.nz.8333 > tom-Latitude-3570.39282: tcp 24
04:21:24.614505 IP default-rdns.vocus.co.nz.8333 > tom-Latitude-3570.39282: tcp 8
04:21:24.614596 IP tom-Latitude-3570.39282 > default-rdns.vocus.co.nz.8333: tcp 0
04:21:24.614682 IP tom-Latitude-3570.39282 > default-rdns.vocus.co.nz.8333: tcp 24
04:21:24.615547 IP tom-Latitude-3570.39282 > default-rdns.vocus.co.nz.8333: tcp 8
04:21:24.658051 IP default-rdns.vocus.co.nz.8333 > tom-Latitude-3570.39282: tcp 0
04:21:24.658066 IP default-rdns.vocus.co.nz.8333 > tom-Latitude-3570.39282: tcp 0
04:21:24.658068 IP default-rdns.vocus.co.nz.8333 > tom-Latitude-3570.39282: tcp 0
04:21:24.658070 IP default-rdns.vocus.co.nz.8333 > tom-Latitude-3570.39282: tcp 0
04:21:25.016074 IP tom-Latitude-3570.39110 > vmi195435.contaboserver.net.8333: tcp 24
04:21:25.017066 IP tom-Latitude-3570.39110 > vmi195435.contaboserver.net.8333: tcp 181
04:21:25.045220 IP default-rdns.vocus.co.nz.8333 > tom-Latitude-3570.39282: tcp 24
04:21:25.045238 IP default-rdns.vocus.co.nz.8333 > tom-Latitude-3570.39282: tcp 8
04:21:25.045329 IP tom-Latitude-3570.39282 > default-rdns.vocus.co.nz.8333: tcp 0
04:21:25.060077 IP vmi195435.contaboserver.net.8333 > tom-Latitude-3570.39110: tcp 0
04:21:25.074964 IP vmi195435.contaboserver.net.8333 > tom-Latitude-3570.39110: tcp 0
04:21:25.098107 IP 81.198.101.144.8333 > tom-Latitude-3570.60988: tcp 24
04:21:25.098125 IP 81.198.101.144.8333 > tom-Latitude-3570.60988: tcp 8
04:21:25.098238 IP tom-Latitude-3570.60988 > 81.198.101.144.8333: tcp 0
04:21:25.098321 IP tom-Latitude-3570.60988 > 81.198.101.144.8333: tcp 24
04:21:25.099185 IP tom-Latitude-3570.60988 > 81.198.101.144.8333: tcp 8
04:21:25.138974 IP 81.198.101.144.8333 > tom-Latitude-3570.60988: tcp 0
04:21:25.215612 IP 167.99.216.145.8333 > tom-Latitude-3570.57976: tcp 24
04:21:25.215632 IP 167.99.216.145.8333 > tom-Latitude-3570.57976: tcp 325
04:21:25.215734 IP tom-Latitude-3570.57976 > 167.99.216.145.8333: tcp 0
04:21:25.215953 IP tom-Latitude-3570.57976 > 167.99.216.145.8333: tcp 24
04:21:25.217123 IP tom-Latitude-3570.57976 > 167.99.216.145.8333: tcp 145
04:21:25.263299 IP 167.99.216.145.8333 > tom-Latitude-3570.57976: tcp 0
04:21:25.263306 IP 167.99.216.145.8333 > tom-Latitude-3570.57976: tcp 0
04:21:25.324866 IP 167.99.216.145.8333 > tom-Latitude-3570.57976: tcp 24
04:21:25.324877 IP 167.99.216.145.8333 > tom-Latitude-3570.57976: tcp 407
04:21:25.324880 IP 167.99.216.145.8333 > tom-Latitude-3570.57976: tcp 24
04:21:25.324882 IP 167.99.216.145.8333 > tom-Latitude-3570.57976: tcp 223
04:21:25.324884 IP 167.99.216.145.8333 > tom-Latitude-3570.57976: tcp 24
04:21:25.324886 IP 167.99.216.145.8333 > tom-Latitude-3570.57976: tcp 247
04:21:25.324887 IP 167.99.216.145.8333 > tom-Latitude-3570.57976: tcp 24
04:21:25.324889 IP 167.99.216.145.8333 > tom-Latitude-3570.57976: tcp 247
04:21:25.324907 IP 167.99.216.145.8333 > tom-Latitude-3570.57976: tcp 24
04:21:25.324909 IP 167.99.216.145.8333 > tom-Latitude-3570.57976: tcp 37
04:21:25.324939 IP tom-Latitude-3570.57976 > 167.99.216.145.8333: tcp 0
04:21:25.326280 IP tom-Latitude-3570.57976 > 167.99.216.145.8333: tcp 24
04:21:25.326960 IP tom-Latitude-3570.57976 > 167.99.216.145.8333: tcp 37
04:21:25.359603 IP 167.99.216.145.8333 > tom-Latitude-3570.57976: tcp 0
04:21:25.359606 IP 167.99.216.145.8333 > tom-Latitude-3570.57976: tcp 0
04:21:25.398627 IP default-rdns.vocus.co.nz.8333 > tom-Latitude-3570.39282: tcp 24
04:21:25.398646 IP default-rdns.vocus.co.nz.8333 > tom-Latitude-3570.39282: tcp 1009
04:21:25.398742 IP tom-Latitude-3570.39282 > default-rdns.vocus.co.nz.8333: tcp 0
04:21:25.421414 IP 167.99.216.145.8333 > tom-Latitude-3570.57976: tcp 24
04:21:25.421433 IP 167.99.216.145.8333 > tom-Latitude-3570.57976: tcp 223
04:21:25.421526 IP tom-Latitude-3570.57976 > 167.99.216.145.8333: tcp 0
04:21:25.522276 IP tom-Latitude-3570.49070 > c-185-45-236-223.customer.ggaweb.ch.8333: tcp 24
04:21:25.523219 IP tom-Latitude-3570.49070 > c-185-45-236-223.customer.ggaweb.ch.8333: tcp 253
04:21:25.558833 IP c-185-45-236-223.customer.ggaweb.ch.8333 > tom-Latitude-3570.49070: tcp 0
04:21:25.622674 IP tom-Latitude-3570.57976 > 167.99.216.145.8333: tcp 24
04:21:25.623616 IP tom-Latitude-3570.57976 > 167.99.216.145.8333: tcp 8
04:21:25.660183 IP 167.99.216.145.8333 > tom-Latitude-3570.57976: tcp 0
04:21:25.668194 IP 167.99.216.145.8333 > tom-Latitude-3570.57976: tcp 0
04:21:25.753186 IP 167.99.216.145.8333 > tom-Latitude-3570.57976: tcp 24
04:21:25.753203 IP 167.99.216.145.8333 > tom-Latitude-3570.57976: tcp 8
04:21:25.753315 IP tom-Latitude-3570.57976 > 167.99.216.145.8333: tcp 0
04:21:25.944086 IP vmi195435.contaboserver.net.8333 > tom-Latitude-3570.39110: tcp 24
04:21:25.944107 IP vmi195435.contaboserver.net.8333 > tom-Latitude-3570.39110: tcp 217
04:21:25.944192 IP tom-Latitude-3570.39110 > vmi195435.contaboserver.net.8333: tcp 0
04:21:25.944333 IP tom-Latitude-3570.39110 > vmi195435.contaboserver.net.8333: tcp 24
04:21:25.944476 IP tom-Latitude-3570.39282 > default-rdns.vocus.co.nz.8333: tcp 24
04:21:25.947726 IP tom-Latitude-3570.39282 > default-rdns.vocus.co.nz.8333: tcp 37
04:21:25.947738 IP tom-Latitude-3570.39110 > vmi195435.contaboserver.net.8333: tcp 37
04:21:25.970114 IP vmi195435.contaboserver.net.8333 > tom-Latitude-3570.39110: tcp 0
04:21:25.978132 IP default-rdns.vocus.co.nz.8333 > tom-Latitude-3570.39282: tcp 0
04:21:25.978669 IP default-rdns.vocus.co.nz.8333 > tom-Latitude-3570.39282: tcp 0
04:21:25.978680 IP vmi195435.contaboserver.net.8333 > tom-Latitude-3570.39110: tcp 0
04:21:26.044864 IP tom-Latitude-3570.60470 > bb42-60-217-183.singnet.com.sg.8333: tcp 24
04:21:26.045798 IP tom-Latitude-3570.60470 > bb42-60-217-183.singnet.com.sg.8333: tcp 285
04:21:26.075589 IP vmi195435.contaboserver.net.8333 > tom-Latitude-3570.39110: tcp 24
04:21:26.075607 IP vmi195435.contaboserver.net.8333 > tom-Latitude-3570.39110: tcp 304
04:21:26.075703 IP tom-Latitude-3570.39110 > vmi195435.contaboserver.net.8333: tcp 0
04:21:26.076025 IP bb42-60-217-183.singnet.com.sg.8333 > tom-Latitude-3570.60470: tcp 0
04:21:26.153916 IP bb42-60-217-183.singnet.com.sg.8333 > tom-Latitude-3570.60470: tcp 24
04:21:26.153935 IP bb42-60-217-183.singnet.com.sg.8333 > tom-Latitude-3570.60470: tcp 8
04:21:26.153938 IP bb42-60-217-183.singnet.com.sg.8333 > tom-Latitude-3570.60470: tcp 24
04:21:26.153940 IP bb42-60-217-183.singnet.com.sg.8333 > tom-Latitude-3570.60470: tcp 253
04:21:26.154029 IP tom-Latitude-3570.60470 > bb42-60-217-183.singnet.com.sg.8333: tcp 0
04:21:26.154126 IP tom-Latitude-3570.60470 > bb42-60-217-183.singnet.com.sg.8333: tcp 24
04:21:26.154869 IP tom-Latitude-3570.60470 > bb42-60-217-183.singnet.com.sg.8333: tcp 8
04:21:26.191055 IP bb42-60-217-183.singnet.com.sg.8333 > tom-Latitude-3570.60470: tcp 0
04:21:26.254343 IP tom-Latitude-3570.39282 > default-rdns.vocus.co.nz.8333: tcp 24
04:21:26.255265 IP tom-Latitude-3570.39282 > default-rdns.vocus.co.nz.8333: tcp 37
04:21:26.292676 IP default-rdns.vocus.co.nz.8333 > tom-Latitude-3570.39282: tcp 0
04:21:26.298527 IP default-rdns.vocus.co.nz.8333 > tom-Latitude-3570.39282: tcp 0
04:21:26.454065 IP bb42-60-217-183.singnet.com.sg.8333 > tom-Latitude-3570.60470: tcp 24
04:21:26.454621 IP bb42-60-217-183.singnet.com.sg.8333 > tom-Latitude-3570.60470: tcp 8
04:21:26.454753 IP tom-Latitude-3570.60470 > bb42-60-217-183.singnet.com.sg.8333: tcp 0
04:21:26.555201 IP tom-Latitude-3570.60470 > bb42-60-217-183.singnet.com.sg.8333: tcp 24
04:21:26.556555 IP tom-Latitude-3570.60470 > bb42-60-217-183.singnet.com.sg.8333: tcp 37
04:21:26.598058 IP bb42-60-217-183.singnet.com.sg.8333 > tom-Latitude-3570.60470: tcp 0
04:21:27.047076 IP 167.99.216.145.8333 > tom-Latitude-3570.57976: tcp 24
04:21:27.047647 IP 167.99.216.145.8333 > tom-Latitude-3570.57976: tcp 109
04:21:27.047777 IP tom-Latitude-3570.57976 > 167.99.216.145.8333: tcp 0
04:21:27.047916 IP tom-Latitude-3570.57976 > 167.99.216.145.8333: tcp 24
04:21:27.049415 IP tom-Latitude-3570.57976 > 167.99.216.145.8333: tcp 73
04:21:27.078020 IP 167.99.216.145.8333 > tom-Latitude-3570.57976: tcp 0
04:21:27.078646 IP 167.99.216.145.8333 > tom-Latitude-3570.57976: tcp 0
04:21:27.148312 IP tom-Latitude-3570.49070 > c-185-45-236-223.customer.ggaweb.ch.8333: tcp 24
04:21:27.164432 IP 167.99.216.145.8333 > tom-Latitude-3570.57976: tcp 24
04:21:27.164451 IP 167.99.216.145.8333 > tom-Latitude-3570.57976: tcp 963
04:21:27.164456 IP 167.99.216.145.8333 > tom-Latitude-3570.57976: tcp 24
04:21:27.164458 IP 167.99.216.145.8333 > tom-Latitude-3570.57976: tcp 564
04:21:27.164546 IP tom-Latitude-3570.57976 > 167.99.216.145.8333: tcp 0
04:21:27.166964 IP tom-Latitude-3570.49070 > c-185-45-236-223.customer.ggaweb.ch.8333: tcp 37
04:21:27.207925 IP c-185-45-236-223.customer.ggaweb.ch.8333 > tom-Latitude-3570.49070: tcp 0
04:21:27.359078 IP 81.198.101.144.8333 > tom-Latitude-3570.60988: tcp 24
04:21:27.359748 IP 81.198.101.144.8333 > tom-Latitude-3570.60988: tcp 217
04:21:27.359876 IP tom-Latitude-3570.60988 > 81.198.101.144.8333: tcp 0
04:21:27.460317 IP tom-Latitude-3570.39282 > default-rdns.vocus.co.nz.8333: tcp 24
04:21:27.461248 IP tom-Latitude-3570.39282 > default-rdns.vocus.co.nz.8333: tcp 73
04:21:27.498088 IP default-rdns.vocus.co.nz.8333 > tom-Latitude-3570.39282: tcp 0
04:21:27.502261 IP default-rdns.vocus.co.nz.8333 > tom-Latitude-3570.39282: tcp 0
04:21:28.062070 IP tom-Latitude-3570.42516 > 2.56.9.15.8333: tcp 24
04:21:28.063394 IP tom-Latitude-3570.42516 > 2.56.9.15.8333: tcp 469
04:21:28.134674 IP 2.56.9.15.8333 > tom-Latitude-3570.42516: tcp 0
04:21:28.262506 IP tom-Latitude-3570.39110 > vmi195435.contaboserver.net.8333: tcp 24
04:21:28.264424 IP tom-Latitude-3570.39110 > vmi195435.contaboserver.net.8333: tcp 73
04:21:28.300027 IP vmi195435.contaboserver.net.8333 > tom-Latitude-3570.39110: tcp 0
04:21:28.308047 IP vmi195435.contaboserver.net.8333 > tom-Latitude-3570.39110: tcp 0
04:21:28.444264 IP bb42-60-217-183.singnet.com.sg.8333 > tom-Latitude-3570.60470: tcp 24
04:21:28.444283 IP bb42-60-217-183.singnet.com.sg.8333 > tom-Latitude-3570.60470: tcp 73
04:21:28.444375 IP tom-Latitude-3570.60470 > bb42-60-217-183.singnet.com.sg.8333: tcp 0
04:21:29.146898 IP tom-Latitude-3570.49070 > c-185-45-236-223.customer.ggaweb.ch.8333: tcp 24
04:21:29.147765 IP tom-Latitude-3570.49070 > c-185-45-236-223.customer.ggaweb.ch.8333: tcp 73
04:21:29.197247 IP 2.56.9.15.8333 > tom-Latitude-3570.42516: tcp 24
04:21:29.197999 IP 2.56.9.15.8333 > tom-Latitude-3570.42516: tcp 37
04:21:29.198016 IP ns3113832.ip-54-38-177.eu.8333 > tom-Latitude-3570.56714: tcp 24
04:21:29.198021 IP ns3113832.ip-54-38-177.eu.8333 > tom-Latitude-3570.56714: tcp 325
04:21:29.198025 IP 2.56.9.15.8333 > tom-Latitude-3570.42516: tcp 37
04:21:29.198052 IP tom-Latitude-3570.42516 > 2.56.9.15.8333: tcp 0
04:21:29.198067 IP ns3113832.ip-54-38-177.eu.8333 > tom-Latitude-3570.56714: tcp 325
04:21:29.198070 IP tom-Latitude-3570.56714 > ns3113832.ip-54-38-177.eu.8333: tcp 0
04:21:29.198320 IP tom-Latitude-3570.56714 > ns3113832.ip-54-38-177.eu.8333: tcp 24
04:21:29.199479 IP tom-Latitude-3570.56714 > ns3113832.ip-54-38-177.eu.8333: tcp 37
04:21:29.209000 IP c-185-45-236-223.customer.ggaweb.ch.8333 > tom-Latitude-3570.49070: tcp 0
04:21:29.227926 IP ns3113832.ip-54-38-177.eu.8333 > tom-Latitude-3570.56714: tcp 0
04:21:29.227940 IP ns3113832.ip-54-38-177.eu.8333 > tom-Latitude-3570.56714: tcp 0
04:21:29.243093 IP 167.99.216.145.8333 > tom-Latitude-3570.57976: tcp 24
04:21:29.243113 IP 167.99.216.145.8333 > tom-Latitude-3570.57976: tcp 8
04:21:29.243204 IP tom-Latitude-3570.57976 > 167.99.216.145.8333: tcp 0
04:21:29.243353 IP tom-Latitude-3570.57976 > 167.99.216.145.8333: tcp 24
04:21:29.244811 IP tom-Latitude-3570.57976 > 167.99.216.145.8333: tcp 8
04:21:29.291954 IP ns3113832.ip-54-38-177.eu.8333 > tom-Latitude-3570.56714: tcp 24
04:21:29.291974 IP ns3113832.ip-54-38-177.eu.8333 > tom-Latitude-3570.56714: tcp 223
04:21:29.291978 IP 167.99.216.145.8333 > tom-Latitude-3570.57976: tcp 0
04:21:29.291983 IP 167.99.216.145.8333 > tom-Latitude-3570.57976: tcp 0
04:21:29.292067 IP tom-Latitude-3570.56714 > ns3113832.ip-54-38-177.eu.8333: tcp 0
04:21:29.292500 IP tom-Latitude-3570.57976 > 167.99.216.145.8333: tcp 24
04:21:29.293603 IP tom-Latitude-3570.57976 > 167.99.216.145.8333: tcp 37
04:21:29.346408 IP 167.99.216.145.8333 > tom-Latitude-3570.57976: tcp 0
04:21:29.349138 IP 167.99.216.145.8333 > tom-Latitude-3570.57976: tcp 0
04:21:29.693767 IP tom-Latitude-3570.39282 > default-rdns.vocus.co.nz.8333: tcp 24
04:21:29.693814 IP tom-Latitude-3570.60470 > bb42-60-217-183.singnet.com.sg.8333: tcp 24
04:21:29.729976 IP tom-Latitude-3570.60470 > bb42-60-217-183.singnet.com.sg.8333: tcp 37
04:21:29.729987 IP tom-Latitude-3570.39282 > default-rdns.vocus.co.nz.8333: tcp 37
04:21:29.778606 IP default-rdns.vocus.co.nz.8333 > tom-Latitude-3570.39282: tcp 0
04:21:29.790365 IP bb42-60-217-183.singnet.com.sg.8333 > tom-Latitude-3570.60470: tcp 0
04:21:29.790372 IP default-rdns.vocus.co.nz.8333 > tom-Latitude-3570.39282: tcp 0
04:21:30.295701 IP tom-Latitude-3570.49070 > c-185-45-236-223.customer.ggaweb.ch.8333: tcp 24
04:21:30.296641 IP tom-Latitude-3570.49070 > c-185-45-236-223.customer.ggaweb.ch.8333: tcp 37
04:21:30.358311 IP c-185-45-236-223.customer.ggaweb.ch.8333 > tom-Latitude-3570.49070: tcp 0
04:21:31.132920 IP 167.99.216.145.8333 > tom-Latitude-3570.57976: tcp 24
04:21:31.133603 IP 167.99.216.145.8333 > tom-Latitude-3570.57976: tcp 361
04:21:31.133620 IP 167.99.216.145.8333 > tom-Latitude-3570.57976: tcp 361
04:21:31.133630 IP tom-Latitude-3570.57976 > 167.99.216.145.8333: tcp 0
04:21:31.134008 IP tom-Latitude-3570.57976 > 167.99.216.145.8333: tcp 24
04:21:31.135156 IP tom-Latitude-3570.57976 > 167.99.216.145.8333: tcp 361
04:21:31.170059 IP 167.99.216.145.8333 > tom-Latitude-3570.57976: tcp 0
04:21:31.170077 IP 167.99.216.145.8333 > tom-Latitude-3570.57976: tcp 0
04:21:31.230578 IP 167.99.216.145.8333 > tom-Latitude-3570.57976: tcp 24
04:21:31.231597 IP 167.99.216.145.8333 > tom-Latitude-3570.57976: tcp 191
04:21:31.231615 IP 167.99.216.145.8333 > tom-Latitude-3570.57976: tcp 24
04:21:31.231618 IP 167.99.216.145.8333 > tom-Latitude-3570.57976: tcp 223
04:21:31.231620 IP 167.99.216.145.8333 > tom-Latitude-3570.57976: tcp 24
04:21:31.231622 IP 167.99.216.145.8333 > tom-Latitude-3570.57976: tcp 223
04:21:31.231624 IP 167.99.216.145.8333 > tom-Latitude-3570.57976: tcp 24
04:21:31.231644 IP 167.99.216.145.8333 > tom-Latitude-3570.57976: tcp 225
04:21:31.231645 IP 167.99.216.145.8333 > tom-Latitude-3570.57976: tcp 24
04:21:31.231647 IP 167.99.216.145.8333 > tom-Latitude-3570.57976: tcp 223
04:21:31.231722 IP tom-Latitude-3570.57976 > 167.99.216.145.8333: tcp 0
04:21:31.231870 IP tom-Latitude-3570.39110 > vmi195435.contaboserver.net.8333: tcp 24
04:21:31.234278 IP tom-Latitude-3570.39110 > vmi195435.contaboserver.net.8333: tcp 37
04:21:31.259710 IP bb42-60-217-183.singnet.com.sg.8333 > tom-Latitude-3570.60470: tcp 24
04:21:31.260274 IP bb42-60-217-183.singnet.com.sg.8333 > tom-Latitude-3570.60470: tcp 397
04:21:31.260398 IP tom-Latitude-3570.60470 > bb42-60-217-183.singnet.com.sg.8333: tcp 0
04:21:31.260666 IP tom-Latitude-3570.60470 > bb42-60-217-183.singnet.com.sg.8333: tcp 24
04:21:31.261968 IP tom-Latitude-3570.60470 > bb42-60-217-183.singnet.com.sg.8333: tcp 73
04:21:31.268742 IP vmi195435.contaboserver.net.8333 > tom-Latitude-3570.39110: tcp 0
04:21:31.268753 IP vmi195435.contaboserver.net.8333 > tom-Latitude-3570.39110: tcp 0
04:21:31.294777 IP 167.99.216.145.8333 > tom-Latitude-3570.57976: tcp 1233
04:21:31.306377 IP bb42-60-217-183.singnet.com.sg.8333 > tom-Latitude-3570.60470: tcp 0
04:21:31.328646 IP ns3113832.ip-54-38-177.eu.8333 > tom-Latitude-3570.56714: tcp 24
04:21:31.329370 IP ns3113832.ip-54-38-177.eu.8333 > tom-Latitude-3570.56714: tcp 397
04:21:31.329502 IP tom-Latitude-3570.56714 > ns3113832.ip-54-38-177.eu.8333: tcp 0
04:21:31.335905 IP tom-Latitude-3570.57976 > 167.99.216.145.8333: tcp 0
04:21:31.530505 IP tom-Latitude-3570.60470 > bb42-60-217-183.singnet.com.sg.8333: tcp 24
04:21:31.531443 IP tom-Latitude-3570.60470 > bb42-60-217-183.singnet.com.sg.8333: tcp 37
04:21:31.567326 IP bb42-60-217-183.singnet.com.sg.8333 > tom-Latitude-3570.60470: tcp 0
04:21:31.682013 IP bb42-60-217-183.singnet.com.sg.8333 > tom-Latitude-3570.60470: tcp 24
