04:03:15.341181 IP tom-Latitude-3570.39110 > vmi195435.contaboserver.net.8333: tcp 24
04:03:15.342164 IP tom-Latitude-3570.39110 > vmi195435.contaboserver.net.8333: tcp 8
04:03:15.371028 IP vmi195435.contaboserver.net.8333 > tom-Latitude-3570.39110: tcp 0
04:03:15.386304 IP vmi195435.contaboserver.net.8333 > tom-Latitude-3570.39110: tcp 0
04:03:15.463533 IP vmi195435.contaboserver.net.8333 > tom-Latitude-3570.39110: tcp 24
04:03:15.464183 IP vmi195435.contaboserver.net.8333 > tom-Latitude-3570.39110: tcp 8
04:03:15.464244 IP tom-Latitude-3570.39110 > vmi195435.contaboserver.net.8333: tcp 0
04:03:15.680069 IP ns3113832.ip-54-38-177.eu.8333 > tom-Latitude-3570.56714: tcp 24
04:03:15.680701 IP ns3113832.ip-54-38-177.eu.8333 > tom-Latitude-3570.56714: tcp 577
04:03:15.680766 IP tom-Latitude-3570.56714 > ns3113832.ip-54-38-177.eu.8333: tcp 0
04:03:15.681018 IP tom-Latitude-3570.56714 > ns3113832.ip-54-38-177.eu.8333: tcp 24
04:03:15.682318 IP tom-Latitude-3570.56714 > ns3113832.ip-54-38-177.eu.8333: tcp 145
04:03:15.717586 IP ns3113832.ip-54-38-177.eu.8333 > tom-Latitude-3570.56714: tcp 0
04:03:15.718178 IP ns3113832.ip-54-38-177.eu.8333 > tom-Latitude-3570.56714: tcp 0
04:03:15.777256 IP ns3113832.ip-54-38-177.eu.8333 > tom-Latitude-3570.56714: tcp 24
04:03:15.777276 IP ns3113832.ip-54-38-177.eu.8333 > tom-Latitude-3570.56714: tcp 190
04:03:15.777281 IP ns3113832.ip-54-38-177.eu.8333 > tom-Latitude-3570.56714: tcp 24
04:03:15.777284 IP ns3113832.ip-54-38-177.eu.8333 > tom-Latitude-3570.56714: tcp 226
04:03:15.777286 IP ns3113832.ip-54-38-177.eu.8333 > tom-Latitude-3570.56714: tcp 24
04:03:15.777289 IP ns3113832.ip-54-38-177.eu.8333 > tom-Latitude-3570.56714: tcp 372
04:03:15.777291 IP ns3113832.ip-54-38-177.eu.8333 > tom-Latitude-3570.56714: tcp 24
04:03:15.777294 IP ns3113832.ip-54-38-177.eu.8333 > tom-Latitude-3570.56714: tcp 224
04:03:15.777325 IP tom-Latitude-3570.56714 > ns3113832.ip-54-38-177.eu.8333: tcp 0
04:03:15.819530 IP c-185-45-236-223.customer.ggaweb.ch.8333 > tom-Latitude-3570.49070: tcp 24
04:03:15.820139 IP c-185-45-236-223.customer.ggaweb.ch.8333 > tom-Latitude-3570.49070: tcp 181
04:03:15.820203 IP tom-Latitude-3570.49070 > c-185-45-236-223.customer.ggaweb.ch.8333: tcp 0
04:03:15.820356 IP tom-Latitude-3570.49070 > c-185-45-236-223.customer.ggaweb.ch.8333: tcp 24
04:03:15.821722 IP tom-Latitude-3570.49070 > c-185-45-236-223.customer.ggaweb.ch.8333: tcp 37
04:03:15.857618 IP c-185-45-236-223.customer.ggaweb.ch.8333 > tom-Latitude-3570.49070: tcp 0
04:03:15.858192 IP c-185-45-236-223.customer.ggaweb.ch.8333 > tom-Latitude-3570.49070: tcp 0
04:03:15.939526 IP c-185-45-236-223.customer.ggaweb.ch.8333 > tom-Latitude-3570.49070: tcp 24
04:03:15.940345 IP c-185-45-236-223.customer.ggaweb.ch.8333 > tom-Latitude-3570.49070: tcp 225
04:03:15.940408 IP tom-Latitude-3570.49070 > c-185-45-236-223.customer.ggaweb.ch.8333: tcp 0
04:03:16.060553 IP vmi195435.contaboserver.net.8333 > tom-Latitude-3570.39110: tcp 24
04:03:16.060573 IP vmi195435.contaboserver.net.8333 > tom-Latitude-3570.39110: tcp 217
04:03:16.060612 IP tom-Latitude-3570.39110 > vmi195435.contaboserver.net.8333: tcp 0
04:03:16.060781 IP tom-Latitude-3570.39110 > vmi195435.contaboserver.net.8333: tcp 24
04:03:16.064513 IP tom-Latitude-3570.39110 > vmi195435.contaboserver.net.8333: tcp 37
04:03:16.096525 IP vmi195435.contaboserver.net.8333 > tom-Latitude-3570.39110: tcp 0
04:03:16.097190 IP vmi195435.contaboserver.net.8333 > tom-Latitude-3570.39110: tcp 0
04:03:16.173762 IP vmi195435.contaboserver.net.8333 > tom-Latitude-3570.39110: tcp 24
04:03:16.174453 IP vmi195435.contaboserver.net.8333 > tom-Latitude-3570.39110: tcp 249
04:03:16.174538 IP tom-Latitude-3570.39110 > vmi195435.contaboserver.net.8333: tcp 0
04:03:16.256743 IP c-185-45-236-223.customer.ggaweb.ch.8333 > tom-Latitude-3570.49070: tcp 24
04:03:16.256764 IP c-185-45-236-223.customer.ggaweb.ch.8333 > tom-Latitude-3570.49070: tcp 109
04:03:16.256809 IP tom-Latitude-3570.49070 > c-185-45-236-223.customer.ggaweb.ch.8333: tcp 0
04:03:16.256958 IP tom-Latitude-3570.49070 > c-185-45-236-223.customer.ggaweb.ch.8333: tcp 24
04:03:16.258380 IP tom-Latitude-3570.49070 > c-185-45-236-223.customer.ggaweb.ch.8333: tcp 73
04:03:16.355905 IP tom-Latitude-3570.49070 > c-185-45-236-223.customer.ggaweb.ch.8333: tcp 73
04:03:16.357448 IP tom-Latitude-3570.57976 > 167.99.216.145.8333: tcp 24
04:03:16.373957 IP c-185-45-236-223.customer.ggaweb.ch.8333 > tom-Latitude-3570.49070: tcp 0
04:03:16.374000 IP c-185-45-236-223.customer.ggaweb.ch.8333 > tom-Latitude-3570.49070: tcp 0
04:03:16.374002 IP c-185-45-236-223.customer.ggaweb.ch.8333 > tom-Latitude-3570.49070: tcp 24
04:03:16.374011 IP c-185-45-236-223.customer.ggaweb.ch.8333 > tom-Latitude-3570.49070: tcp 825
04:03:16.374058 IP tom-Latitude-3570.49070 > c-185-45-236-223.customer.ggaweb.ch.8333: tcp 0
04:03:16.377788 IP tom-Latitude-3570.57976 > 167.99.216.145.8333: tcp 649
04:03:16.401308 IP vmi195435.contaboserver.net.8333 > tom-Latitude-3570.39110: tcp 24
04:03:16.401960 IP vmi195435.contaboserver.net.8333 > tom-Latitude-3570.39110: tcp 73
04:03:16.402018 IP tom-Latitude-3570.39110 > vmi195435.contaboserver.net.8333: tcp 0
04:03:16.405710 IP c-185-45-236-223.customer.ggaweb.ch.8333 > tom-Latitude-3570.49070: tcp 0
04:03:16.406380 IP 167.99.216.145.8333 > tom-Latitude-3570.57976: tcp 0
04:03:16.414730 IP 167.99.216.145.8333 > tom-Latitude-3570.57976: tcp 0
04:03:16.602645 IP tom-Latitude-3570.39282 > default-rdns.vocus.co.nz.8333: tcp 24
04:03:16.603476 IP tom-Latitude-3570.39282 > default-rdns.vocus.co.nz.8333: tcp 289
04:03:16.627818 IP default-rdns.vocus.co.nz.8333 > tom-Latitude-3570.39282: tcp 0
04:03:16.635688 IP default-rdns.vocus.co.nz.8333 > tom-Latitude-3570.39282: tcp 0
04:03:16.872119 IP default-rdns.vocus.co.nz.8333 > tom-Latitude-3570.39282: tcp 24
04:03:16.872781 IP default-rdns.vocus.co.nz.8333 > tom-Latitude-3570.39282: tcp 217
04:03:16.872848 IP tom-Latitude-3570.39282 > default-rdns.vocus.co.nz.8333: tcp 0
04:03:17.089615 IP ns3113832.ip-54-38-177.eu.8333 > tom-Latitude-3570.56714: tcp 24
04:03:17.089634 IP ns3113832.ip-54-38-177.eu.8333 > tom-Latitude-3570.56714: tcp 31
04:03:17.089680 IP tom-Latitude-3570.56714 > ns3113832.ip-54-38-177.eu.8333: tcp 0
04:03:17.792045 IP tom-Latitude-3570.60988 > 81.198.101.144.8333: tcp 24
04:03:17.792951 IP tom-Latitude-3570.60988 > 81.198.101.144.8333: tcp 289
04:03:17.867106 IP 81.198.101.144.8333 > tom-Latitude-3570.60988: tcp 0
04:03:17.867119 IP 81.198.101.144.8333 > tom-Latitude-3570.60988: tcp 0
04:03:17.896757 IP bb42-60-217-183.singnet.com.sg.8333 > tom-Latitude-3570.60470: tcp 24
04:03:17.897521 IP bb42-60-217-183.singnet.com.sg.8333 > tom-Latitude-3570.60470: tcp 1009
04:03:17.897587 IP tom-Latitude-3570.60470 > bb42-60-217-183.singnet.com.sg.8333: tcp 0
04:03:17.897904 IP tom-Latitude-3570.60470 > bb42-60-217-183.singnet.com.sg.8333: tcp 24
04:03:17.899231 IP tom-Latitude-3570.60470 > bb42-60-217-183.singnet.com.sg.8333: tcp 37
04:03:17.927721 IP bb42-60-217-183.singnet.com.sg.8333 > tom-Latitude-3570.60470: tcp 0
04:03:17.928381 IP bb42-60-217-183.singnet.com.sg.8333 > tom-Latitude-3570.60470: tcp 0
04:03:18.004672 IP c-185-45-236-223.customer.ggaweb.ch.8333 > tom-Latitude-3570.49070: tcp 24
04:03:18.007448 IP c-185-45-236-223.customer.ggaweb.ch.8333 > tom-Latitude-3570.49070: tcp 73
04:03:18.007511 IP tom-Latitude-3570.49070 > c-185-45-236-223.customer.ggaweb.ch.8333: tcp 0
04:03:18.007649 IP tom-Latitude-3570.49070 > c-185-45-236-223.customer.ggaweb.ch.8333: tcp 24
04:03:18.009128 IP tom-Latitude-3570.49070 > c-185-45-236-223.customer.ggaweb.ch.8333: tcp 37
04:03:18.036739 IP c-185-45-236-223.customer.ggaweb.ch.8333 > tom-Latitude-3570.49070: tcp 0
04:03:18.043360 IP c-185-45-236-223.customer.ggaweb.ch.8333 > tom-Latitude-3570.49070: tcp 0
04:03:18.125724 IP c-185-45-236-223.customer.ggaweb.ch.8333 > tom-Latitude-3570.49070: tcp 24
04:03:18.125744 IP c-185-45-236-223.customer.ggaweb.ch.8333 > tom-Latitude-3570.49070: tcp 249
04:03:18.125790 IP tom-Latitude-3570.49070 > c-185-45-236-223.customer.ggaweb.ch.8333: tcp 0
04:03:18.306678 IP bb42-60-217-183.singnet.com.sg.8333 > tom-Latitude-3570.60470: tcp 24
04:03:18.307169 IP bb42-60-217-183.singnet.com.sg.8333 > tom-Latitude-3570.60470: tcp 388
04:03:18.307219 IP tom-Latitude-3570.60470 > bb42-60-217-183.singnet.com.sg.8333: tcp 0
04:03:18.308170 IP tom-Latitude-3570.42516 > 2.56.9.15.8333: tcp 24
04:03:18.309017 IP tom-Latitude-3570.42516 > 2.56.9.15.8333: tcp 361
04:03:18.337773 IP 2.56.9.15.8333 > tom-Latitude-3570.42516: tcp 0
04:03:18.338339 IP 2.56.9.15.8333 > tom-Latitude-3570.42516: tcp 0
04:03:18.609051 IP tom-Latitude-3570.60470 > bb42-60-217-183.singnet.com.sg.8333: tcp 24
04:03:18.610437 IP tom-Latitude-3570.60470 > bb42-60-217-183.singnet.com.sg.8333: tcp 37
04:03:18.658213 IP bb42-60-217-183.singnet.com.sg.8333 > tom-Latitude-3570.60470: tcp 0
04:03:18.667252 IP bb42-60-217-183.singnet.com.sg.8333 > tom-Latitude-3570.60470: tcp 0
04:03:18.709459 IP tom-Latitude-3570.42516 > 2.56.9.15.8333: tcp 24
04:03:18.710396 IP tom-Latitude-3570.42516 > 2.56.9.15.8333: tcp 121
04:03:18.738362 IP 2.56.9.15.8333 > tom-Latitude-3570.42516: tcp 0
04:03:18.746143 IP 2.56.9.15.8333 > tom-Latitude-3570.42516: tcp 0
04:03:19.411801 IP tom-Latitude-3570.49070 > c-185-45-236-223.customer.ggaweb.ch.8333: tcp 24
04:03:19.412737 IP tom-Latitude-3570.49070 > c-185-45-236-223.customer.ggaweb.ch.8333: tcp 8
04:03:19.442198 IP c-185-45-236-223.customer.ggaweb.ch.8333 > tom-Latitude-3570.49070: tcp 0
04:03:19.447274 IP c-185-45-236-223.customer.ggaweb.ch.8333 > tom-Latitude-3570.49070: tcp 0
04:03:19.470219 IP c-185-45-236-223.customer.ggaweb.ch.8333 > tom-Latitude-3570.49070: tcp 24
04:03:19.473101 IP c-185-45-236-223.customer.ggaweb.ch.8333 > tom-Latitude-3570.49070: tcp 8
04:03:19.473165 IP tom-Latitude-3570.49070 > c-185-45-236-223.customer.ggaweb.ch.8333: tcp 0
04:03:19.473239 IP tom-Latitude-3570.49070 > c-185-45-236-223.customer.ggaweb.ch.8333: tcp 24
04:03:19.474172 IP tom-Latitude-3570.49070 > c-185-45-236-223.customer.ggaweb.ch.8333: tcp 8
04:03:19.517429 IP c-185-45-236-223.customer.ggaweb.ch.8333 > tom-Latitude-3570.49070: tcp 0
04:03:19.529324 IP c-185-45-236-223.customer.ggaweb.ch.8333 > tom-Latitude-3570.49070: tcp 24
04:03:19.530032 IP c-185-45-236-223.customer.ggaweb.ch.8333 > tom-Latitude-3570.49070: tcp 8
04:03:19.530056 IP tom-Latitude-3570.49070 > c-185-45-236-223.customer.ggaweb.ch.8333: tcp 0
04:03:19.831032 IP tom-Latitude-3570.39282 > default-rdns.vocus.co.nz.8333: tcp 24
04:03:19.832458 IP tom-Latitude-3570.39282 > default-rdns.vocus.co.nz.8333: tcp 73
04:03:19.879285 IP default-rdns.vocus.co.nz.8333 > tom-Latitude-3570.39282: tcp 0
04:03:19.888009 IP default-rdns.vocus.co.nz.8333 > tom-Latitude-3570.39282: tcp 0
04:03:19.931451 IP tom-Latitude-3570.57976 > 167.99.216.145.8333: tcp 24
04:03:19.933022 IP tom-Latitude-3570.57976 > 167.99.216.145.8333: tcp 145
04:03:19.959256 IP 167.99.216.145.8333 > tom-Latitude-3570.57976: tcp 0
04:03:19.966569 IP 167.99.216.145.8333 > tom-Latitude-3570.57976: tcp 0
04:03:20.432895 IP tom-Latitude-3570.39110 > vmi195435.contaboserver.net.8333: tcp 24
04:03:20.433848 IP tom-Latitude-3570.39110 > vmi195435.contaboserver.net.8333: tcp 73
04:03:20.491180 IP vmi195435.contaboserver.net.8333 > tom-Latitude-3570.39110: tcp 0
04:03:20.497041 IP vmi195435.contaboserver.net.8333 > tom-Latitude-3570.39110: tcp 0
04:03:20.733947 IP tom-Latitude-3570.60988 > 81.198.101.144.8333: tcp 24
04:03:20.776878 IP tom-Latitude-3570.60988 > 81.198.101.144.8333: tcp 73
04:03:20.829454 IP 81.198.101.144.8333 > tom-Latitude-3570.60988: tcp 0
04:03:20.846923 IP 81.198.101.144.8333 > tom-Latitude-3570.60988: tcp 0
04:03:20.941688 IP c-185-45-236-223.customer.ggaweb.ch.8333 > tom-Latitude-3570.49070: tcp 24
04:03:20.941708 IP c-185-45-236-223.customer.ggaweb.ch.8333 > tom-Latitude-3570.49070: tcp 325
04:03:20.941753 IP tom-Latitude-3570.49070 > c-185-45-236-223.customer.ggaweb.ch.8333: tcp 0
04:03:20.941991 IP tom-Latitude-3570.49070 > c-185-45-236-223.customer.ggaweb.ch.8333: tcp 24
04:03:20.952430 IP tom-Latitude-3570.49070 > c-185-45-236-223.customer.ggaweb.ch.8333: tcp 325
04:03:20.990701 IP c-185-45-236-223.customer.ggaweb.ch.8333 > tom-Latitude-3570.49070: tcp 0
04:03:21.071517 IP c-185-45-236-223.customer.ggaweb.ch.8333 > tom-Latitude-3570.49070: tcp 24
04:03:21.072622 IP c-185-45-236-223.customer.ggaweb.ch.8333 > tom-Latitude-3570.49070: tcp 524
04:03:21.072641 IP c-185-45-236-223.customer.ggaweb.ch.8333 > tom-Latitude-3570.49070: tcp 498
04:03:21.072645 IP c-185-45-236-223.customer.ggaweb.ch.8333 > tom-Latitude-3570.49070: tcp 725
04:03:21.072648 IP c-185-45-236-223.customer.ggaweb.ch.8333 > tom-Latitude-3570.49070: tcp 280
04:03:21.072651 IP c-185-45-236-223.customer.ggaweb.ch.8333 > tom-Latitude-3570.49070: tcp 894
04:03:21.072686 IP tom-Latitude-3570.49070 > c-185-45-236-223.customer.ggaweb.ch.8333: tcp 0
04:03:21.073076 IP tom-Latitude-3570.57976 > 167.99.216.145.8333: tcp 24
04:03:21.073118 IP tom-Latitude-3570.60470 > bb42-60-217-183.singnet.com.sg.8333: tcp 24
04:03:21.074094 IP tom-Latitude-3570.60470 > bb42-60-217-183.singnet.com.sg.8333: tcp 37
04:03:21.074103 IP tom-Latitude-3570.57976 > 167.99.216.145.8333: tcp 37
04:03:21.111294 IP 167.99.216.145.8333 > tom-Latitude-3570.57976: tcp 0
04:03:21.111302 IP bb42-60-217-183.singnet.com.sg.8333 > tom-Latitude-3570.60470: tcp 0
04:03:21.111304 IP bb42-60-217-183.singnet.com.sg.8333 > tom-Latitude-3570.60470: tcp 0
04:03:21.111306 IP 167.99.216.145.8333 > tom-Latitude-3570.57976: tcp 0
04:03:21.328045 IP vmi195435.contaboserver.net.8333 > tom-Latitude-3570.39110: tcp 24
04:03:21.328674 IP vmi195435.contaboserver.net.8333 > tom-Latitude-3570.39110: tcp 31
04:03:21.328733 IP tom-Latitude-3570.39110 > vmi195435.contaboserver.net.8333: tcp 0
04:03:21.730211 IP tom-Latitude-3570.60988 > 81.198.101.144.8333: tcp 24
04:03:21.731206 IP tom-Latitude-3570.60988 > 81.198.101.144.8333: tcp 325
04:03:21.867909 IP tom-Latitude-3570.60988 > 81.198.101.144.8333: tcp 325
04:03:21.932230 IP 81.198.101.144.8333 > tom-Latitude-3570.60988: tcp 0
04:03:21.932244 IP 81.198.101.144.8333 > tom-Latitude-3570.60988: tcp 0
04:03:21.932246 IP 81.198.101.144.8333 > tom-Latitude-3570.60988: tcp 24
04:03:21.932255 IP tom-Latitude-3570.60988 > 81.198.101.144.8333: tcp 0
04:03:21.932272 IP 81.198.101.144.8333 > tom-Latitude-3570.60988: tcp 253
04:03:21.932277 IP tom-Latitude-3570.60988 > 81.198.101.144.8333: tcp 0
04:03:21.932281 IP 167.99.216.145.8333 > tom-Latitude-3570.57976: tcp 24
04:03:21.932286 IP 167.99.216.145.8333 > tom-Latitude-3570.57976: tcp 397
04:03:21.932289 IP 81.198.101.144.8333 > tom-Latitude-3570.60988: tcp 253
04:03:21.932291 IP tom-Latitude-3570.60988 > 81.198.101.144.8333: tcp 0
04:03:21.932334 IP tom-Latitude-3570.57976 > 167.99.216.145.8333: tcp 0
04:03:21.932531 IP tom-Latitude-3570.57976 > 167.99.216.145.8333: tcp 24
04:03:21.939413 IP tom-Latitude-3570.57976 > 167.99.216.145.8333: tcp 109
04:03:21.949725 IP 167.99.216.145.8333 > tom-Latitude-3570.57976: tcp 397
04:03:21.949730 IP tom-Latitude-3570.57976 > 167.99.216.145.8333: tcp 0
04:03:21.955289 IP ns3113832.ip-54-38-177.eu.8333 > tom-Latitude-3570.56714: tcp 24
04:03:21.955956 IP ns3113832.ip-54-38-177.eu.8333 > tom-Latitude-3570.56714: tcp 613
04:03:21.955968 IP tom-Latitude-3570.56714 > ns3113832.ip-54-38-177.eu.8333: tcp 0
04:03:21.970453 IP 81.198.101.144.8333 > tom-Latitude-3570.60988: tcp 0
04:03:21.973273 IP 167.99.216.145.8333 > tom-Latitude-3570.57976: tcp 0
04:03:21.973298 IP 167.99.216.145.8333 > tom-Latitude-3570.57976: tcp 0
04:03:22.034849 IP 167.99.216.145.8333 > tom-Latitude-3570.57976: tcp 24
04:03:22.034852 IP tom-Latitude-3570.57976 > 167.99.216.145.8333: tcp 0
04:03:22.035827 IP 167.99.216.145.8333 > tom-Latitude-3570.57976: tcp 419
04:03:22.035852 IP tom-Latitude-3570.57976 > 167.99.216.145.8333: tcp 0
04:03:22.035866 IP 167.99.216.145.8333 > tom-Latitude-3570.57976: tcp 24
04:03:22.035869 IP tom-Latitude-3570.57976 > 167.99.216.145.8333: tcp 0
04:03:22.035873 IP 167.99.216.145.8333 > tom-Latitude-3570.57976: tcp 225
04:03:22.035875 IP tom-Latitude-3570.57976 > 167.99.216.145.8333: tcp 0
04:03:22.035878 IP 167.99.216.145.8333 > tom-Latitude-3570.57976: tcp 24
04:03:22.035881 IP tom-Latitude-3570.57976 > 167.99.216.145.8333: tcp 0
04:03:22.035884 IP 167.99.216.145.8333 > tom-Latitude-3570.57976: tcp 215
04:03:22.035891 IP tom-Latitude-3570.57976 > 167.99.216.145.8333: tcp 0
04:03:22.337654 IP tom-Latitude-3570.39282 > default-rdns.vocus.co.nz.8333: tcp 24
04:03:22.339241 IP tom-Latitude-3570.39282 > default-rdns.vocus.co.nz.8333: tcp 433
04:03:22.377520 IP default-rdns.vocus.co.nz.8333 > tom-Latitude-3570.39282: tcp 0
04:03:22.377917 IP default-rdns.vocus.co.nz.8333 > tom-Latitude-3570.39282: tcp 0
04:03:22.509559 IP 2.56.9.15.8333 > tom-Latitude-3570.42516: tcp 24
04:03:22.509585 IP tom-Latitude-3570.42516 > 2.56.9.15.8333: tcp 0
04:03:22.510210 IP 2.56.9.15.8333 > tom-Latitude-3570.42516: tcp 8
04:03:22.510227 IP tom-Latitude-3570.42516 > 2.56.9.15.8333: tcp 0
04:03:22.510352 IP tom-Latitude-3570.60988 > 81.198.101.144.8333: tcp 24
04:03:22.510388 IP tom-Latitude-3570.42516 > 2.56.9.15.8333: tcp 24
04:03:22.511582 IP tom-Latitude-3570.42516 > 2.56.9.15.8333: tcp 40
04:03:22.511593 IP tom-Latitude-3570.60988 > 81.198.101.144.8333: tcp 8
04:03:22.555644 IP 81.198.101.144.8333 > tom-Latitude-3570.60988: tcp 0
04:03:22.556963 IP 2.56.9.15.8333 > tom-Latitude-3570.42516: tcp 0
04:03:22.556983 IP 2.56.9.15.8333 > tom-Latitude-3570.42516: tcp 0
04:03:22.556986 IP 81.198.101.144.8333 > tom-Latitude-3570.60988: tcp 0
04:03:22.646536 IP 2.56.9.15.8333 > tom-Latitude-3570.42516: tcp 24
04:03:22.647225 IP 2.56.9.15.8333 > tom-Latitude-3570.42516: tcp 8
04:03:22.647308 IP tom-Latitude-3570.42516 > 2.56.9.15.8333: tcp 0
04:03:22.702514 IP default-rdns.vocus.co.nz.8333 > tom-Latitude-3570.39282: tcp 24
04:03:22.703070 IP default-rdns.vocus.co.nz.8333 > tom-Latitude-3570.39282: tcp 37
04:03:22.703134 IP tom-Latitude-3570.39282 > default-rdns.vocus.co.nz.8333: tcp 0
04:03:22.703272 IP tom-Latitude-3570.39282 > default-rdns.vocus.co.nz.8333: tcp 24
04:03:22.704659 IP tom-Latitude-3570.39282 > default-rdns.vocus.co.nz.8333: tcp 225
04:03:22.724583 IP 81.198.101.144.8333 > tom-Latitude-3570.60988: tcp 24
04:03:22.724600 IP tom-Latitude-3570.60988 > 81.198.101.144.8333: tcp 0
04:03:22.725182 IP 81.198.101.144.8333 > tom-Latitude-3570.60988: tcp 8
04:03:22.725200 IP tom-Latitude-3570.60988 > 81.198.101.144.8333: tcp 0
04:03:22.736474 IP default-rdns.vocus.co.nz.8333 > tom-Latitude-3570.39282: tcp 0
04:03:22.737072 IP default-rdns.vocus.co.nz.8333 > tom-Latitude-3570.39282: tcp 0
04:03:22.825840 IP tom-Latitude-3570.60470 > bb42-60-217-183.singnet.com.sg.8333: tcp 24
04:03:22.826782 IP tom-Latitude-3570.60470 > bb42-60-217-183.singnet.com.sg.8333: tcp 397
04:03:22.859485 IP bb42-60-217-183.singnet.com.sg.8333 > tom-Latitude-3570.60470: tcp 0
04:03:22.867444 IP bb42-60-217-183.singnet.com.sg.8333 > tom-Latitude-3570.60470: tcp 0
04:03:22.926265 IP tom-Latitude-3570.56714 > ns3113832.ip-54-38-177.eu.8333: tcp 24
04:03:22.977317 IP ns3113832.ip-54-38-177.eu.8333 > tom-Latitude-3570.56714: tcp 24
04:03:22.977343 IP tom-Latitude-3570.56714 > ns3113832.ip-54-38-177.eu.8333: tcp 8
04:03:22.977360 IP ns3113832.ip-54-38-177.eu.8333 > tom-Latitude-3570.56714: tcp 8
04:03:22.977364 IP ns3113832.ip-54-38-177.eu.8333 > tom-Latitude-3570.56714: tcp 24
04:03:22.977366 IP ns3113832.ip-54-38-177.eu.8333 > tom-Latitude-3570.56714: tcp 73
04:03:22.977369 IP ns3113832.ip-54-38-177.eu.8333 > tom-Latitude-3570.56714: tcp 73
04:03:22.977372 IP tom-Latitude-3570.56714 > ns3113832.ip-54-38-177.eu.8333: tcp 0
04:03:22.981520 IP tom-Latitude-3570.56714 > ns3113832.ip-54-38-177.eu.8333: tcp 93
04:03:23.025112 IP ns3113832.ip-54-38-177.eu.8333 > tom-Latitude-3570.56714: tcp 0
04:03:23.025127 IP ns3113832.ip-54-38-177.eu.8333 > tom-Latitude-3570.56714: tcp 0
04:03:23.025130 IP ns3113832.ip-54-38-177.eu.8333 > tom-Latitude-3570.56714: tcp 0
04:03:23.027766 IP tom-Latitude-3570.38514 > cpe90-146-140-201.liwest.at.8333: tcp 0
04:03:23.077779 IP tom-Latitude-3570.49070 > c-185-45-236-223.customer.ggaweb.ch.8333: tcp 24
04:03:23.078753 IP tom-Latitude-3570.49070 > c-185-45-236-223.customer.ggaweb.ch.8333: tcp 109
04:03:23.081625 IP ns3113832.ip-54-38-177.eu.8333 > tom-Latitude-3570.56714: tcp 24
04:03:23.082262 IP ns3113832.ip-54-38-177.eu.8333 > tom-Latitude-3570.56714: tcp 8
04:03:23.082325 IP tom-Latitude-3570.56714 > ns3113832.ip-54-38-177.eu.8333: tcp 0
04:03:23.085266 IP ns3113832.ip-54-38-177.eu.8333 > tom-Latitude-3570.56714: tcp 24
04:03:23.085285 IP ns3113832.ip-54-38-177.eu.8333 > tom-Latitude-3570.56714: tcp 217
04:03:23.085356 IP tom-Latitude-3570.56714 > ns3113832.ip-54-38-177.eu.8333: tcp 0
04:03:23.088587 IP cpe90-146-140-201.liwest.at.8333 > tom-Latitude-3570.38514: tcp 0
04:03:23.130958 IP c-185-45-236-223.customer.ggaweb.ch.8333 > tom-Latitude-3570.49070: tcp 0
04:03:23.330279 IP tom-Latitude-3570.37884 > 9.105.77.34.bc.googleusercontent.com.8333: tcp 0
04:03:23.367877 IP 9.105.77.34.bc.googleusercontent.com.8333 > tom-Latitude-3570.37884: tcp 0
04:03:23.367908 IP tom-Latitude-3570.37884 > 9.105.77.34.bc.googleusercontent.com.8333: tcp 0
04:03:23.368393 IP tom-Latitude-3570.37884 > 9.105.77.34.bc.googleusercontent.com.8333: tcp 24
04:03:23.369377 IP tom-Latitude-3570.37884 > 9.105.77.34.bc.googleusercontent.com.8333: tcp 102
04:03:23.428590 IP 9.105.77.34.bc.googleusercontent.com.8333 > tom-Latitude-3570.37884: tcp 0
04:03:23.486674 IP 9.105.77.34.bc.googleusercontent.com.8333 > tom-Latitude-3570.37884: tcp 24
04:03:23.486698 IP tom-Latitude-3570.37884 > 9.105.77.34.bc.googleusercontent.com.8333: tcp 0
04:03:23.487448 IP 9.105.77.34.bc.googleusercontent.com.8333 > tom-Latitude-3570.37884: tcp 113
04:03:23.487472 IP tom-Latitude-3570.37884 > 9.105.77.34.bc.googleusercontent.com.8333: tcp 0
04:03:23.487502 IP 9.105.77.34.bc.googleusercontent.com.8333 > tom-Latitude-3570.37884: tcp 24
04:03:23.487505 IP tom-Latitude-3570.37884 > 9.105.77.34.bc.googleusercontent.com.8333: tcp 0
04:03:23.487713 IP tom-Latitude-3570.37884 > 9.105.77.34.bc.googleusercontent.com.8333: tcp 24
04:03:23.488546 IP tom-Latitude-3570.37884 > 9.105.77.34.bc.googleusercontent.com.8333: tcp 24
04:03:23.517534 IP 9.105.77.34.bc.googleusercontent.com.8333 > tom-Latitude-3570.37884: tcp 0
04:03:23.537888 IP tom-Latitude-3570.37884 > 9.105.77.34.bc.googleusercontent.com.8333: tcp 0
04:03:23.575892 IP 9.105.77.34.bc.googleusercontent.com.8333 > tom-Latitude-3570.37884: tcp 24
04:03:23.575921 IP tom-Latitude-3570.37884 > 9.105.77.34.bc.googleusercontent.com.8333: tcp 0
04:03:23.576578 IP 9.105.77.34.bc.googleusercontent.com.8333 > tom-Latitude-3570.37884: tcp 24
04:03:23.576597 IP tom-Latitude-3570.37884 > 9.105.77.34.bc.googleusercontent.com.8333: tcp 0
04:03:23.576608 IP 9.105.77.34.bc.googleusercontent.com.8333 > tom-Latitude-3570.37884: tcp 9
04:03:23.576609 IP tom-Latitude-3570.37884 > 9.105.77.34.bc.googleusercontent.com.8333: tcp 0
04:03:23.576611 IP 9.105.77.34.bc.googleusercontent.com.8333 > tom-Latitude-3570.37884: tcp 24
04:03:23.576613 IP tom-Latitude-3570.37884 > 9.105.77.34.bc.googleusercontent.com.8333: tcp 0
04:03:23.576615 IP 9.105.77.34.bc.googleusercontent.com.8333 > tom-Latitude-3570.37884: tcp 8
04:03:23.576616 IP tom-Latitude-3570.37884 > 9.105.77.34.bc.googleusercontent.com.8333: tcp 0
04:03:23.576618 IP 9.105.77.34.bc.googleusercontent.com.8333 > tom-Latitude-3570.37884: tcp 24
04:03:23.576619 IP tom-Latitude-3570.37884 > 9.105.77.34.bc.googleusercontent.com.8333: tcp 0
04:03:23.576621 IP 9.105.77.34.bc.googleusercontent.com.8333 > tom-Latitude-3570.37884: tcp 31
04:03:23.576622 IP tom-Latitude-3570.37884 > 9.105.77.34.bc.googleusercontent.com.8333: tcp 0
04:03:23.576624 IP 9.105.77.34.bc.googleusercontent.com.8333 > tom-Latitude-3570.37884: tcp 24
04:03:23.576625 IP tom-Latitude-3570.37884 > 9.105.77.34.bc.googleusercontent.com.8333: tcp 0
04:03:23.576627 IP 9.105.77.34.bc.googleusercontent.com.8333 > tom-Latitude-3570.37884: tcp 8
04:03:23.576628 IP tom-Latitude-3570.37884 > 9.105.77.34.bc.googleusercontent.com.8333: tcp 0
04:03:23.589683 IP tom-Latitude-3570.60470 > bb42-60-217-183.singnet.com.sg.8333: tcp 24
04:03:23.590621 IP tom-Latitude-3570.60470 > bb42-60-217-183.singnet.com.sg.8333: tcp 37
04:03:23.619258 IP bb42-60-217-183.singnet.com.sg.8333 > tom-Latitude-3570.60470: tcp 0
04:03:23.627379 IP bb42-60-217-183.singnet.com.sg.8333 > tom-Latitude-3570.60470: tcp 0
04:03:23.990813 IP tom-Latitude-3570.49070 > c-185-45-236-223.customer.ggaweb.ch.8333: tcp 24
04:03:23.990952 IP tom-Latitude-3570.57976 > 167.99.216.145.8333: tcp 24
04:03:24.075301 IP 81.198.101.144.8333 > tom-Latitude-3570.60988: tcp 24
04:03:24.075325 IP tom-Latitude-3570.60988 > 81.198.101.144.8333: tcp 0
04:03:24.075354 IP 81.198.101.144.8333 > tom-Latitude-3570.60988: tcp 8
04:03:24.075356 IP tom-Latitude-3570.60988 > 81.198.101.144.8333: tcp 0
04:03:24.075525 IP tom-Latitude-3570.60988 > 81.198.101.144.8333: tcp 24
04:03:24.075563 IP tom-Latitude-3570.39282 > default-rdns.vocus.co.nz.8333: tcp 24
04:03:24.082021 IP tom-Latitude-3570.39282 > default-rdns.vocus.co.nz.8333: tcp 8
04:03:24.082033 IP tom-Latitude-3570.60988 > 81.198.101.144.8333: tcp 8
04:03:24.082035 IP tom-Latitude-3570.57976 > 167.99.216.145.8333: tcp 37
04:03:24.082038 IP tom-Latitude-3570.49070 > c-185-45-236-223.customer.ggaweb.ch.8333: tcp 37
04:03:24.101469 IP 81.198.101.144.8333 > tom-Latitude-3570.60988: tcp 8
04:03:24.101488 IP tom-Latitude-3570.60988 > 81.198.101.144.8333: tcp 0
04:03:24.126279 IP 167.99.216.145.8333 > tom-Latitude-3570.57976: tcp 0
04:03:24.126294 IP 81.198.101.144.8333 > tom-Latitude-3570.60988: tcp 0
04:03:24.126297 IP 81.198.101.144.8333 > tom-Latitude-3570.60988: tcp 0
04:03:24.126299 IP default-rdns.vocus.co.nz.8333 > tom-Latitude-3570.39282: tcp 0
04:03:24.126302 IP default-rdns.vocus.co.nz.8333 > tom-Latitude-3570.39282: tcp 0
04:03:24.126303 IP 167.99.216.145.8333 > tom-Latitude-3570.57976: tcp 0
04:03:24.126305 IP c-185-45-236-223.customer.ggaweb.ch.8333 > tom-Latitude-3570.49070: tcp 0
04:03:24.171369 IP default-rdns.vocus.co.nz.8333 > tom-Latitude-3570.39282: tcp 24
04:03:24.171993 IP default-rdns.vocus.co.nz.8333 > tom-Latitude-3570.39282: tcp 8
04:03:24.172012 IP tom-Latitude-3570.39282 > default-rdns.vocus.co.nz.8333: tcp 0
04:03:24.172163 IP tom-Latitude-3570.39282 > default-rdns.vocus.co.nz.8333: tcp 24
04:03:24.173484 IP tom-Latitude-3570.39282 > default-rdns.vocus.co.nz.8333: tcp 8
04:03:24.207500 IP default-rdns.vocus.co.nz.8333 > tom-Latitude-3570.39282: tcp 0
04:03:24.208133 IP default-rdns.vocus.co.nz.8333 > tom-Latitude-3570.39282: tcp 0
04:03:24.449891 IP default-rdns.vocus.co.nz.8333 > tom-Latitude-3570.39282: tcp 24
04:03:24.450494 IP default-rdns.vocus.co.nz.8333 > tom-Latitude-3570.39282: tcp 8
04:03:24.450623 IP tom-Latitude-3570.39282 > default-rdns.vocus.co.nz.8333: tcp 0
04:03:24.751852 IP tom-Latitude-3570.39110 > vmi195435.contaboserver.net.8333: tcp 24
04:03:24.751977 IP tom-Latitude-3570.42516 > 2.56.9.15.8333: tcp 24
04:03:24.752792 IP tom-Latitude-3570.39110 > vmi195435.contaboserver.net.8333: tcp 469
04:03:24.753400 IP tom-Latitude-3570.42516 > 2.56.9.15.8333: tcp 469
04:03:24.786347 IP vmi195435.contaboserver.net.8333 > tom-Latitude-3570.39110: tcp 0
04:03:24.794525 IP 2.56.9.15.8333 > tom-Latitude-3570.42516: tcp 0
04:03:24.798540 IP vmi195435.contaboserver.net.8333 > tom-Latitude-3570.39110: tcp 0
04:03:24.804824 IP 2.56.9.15.8333 > tom-Latitude-3570.42516: tcp 0
04:03:24.831278 IP 167.99.216.145.8333 > tom-Latitude-3570.57976: tcp 24
04:03:24.831302 IP tom-Latitude-3570.57976 > 167.99.216.145.8333: tcp 0
04:03:24.831828 IP 167.99.216.145.8333 > tom-Latitude-3570.57976: tcp 8
04:03:24.831845 IP tom-Latitude-3570.57976 > 167.99.216.145.8333: tcp 0
04:03:24.832091 IP tom-Latitude-3570.57976 > 167.99.216.145.8333: tcp 24
04:03:24.833124 IP tom-Latitude-3570.57976 > 167.99.216.145.8333: tcp 8
04:03:24.865687 IP 167.99.216.145.8333 > tom-Latitude-3570.57976: tcp 0
04:03:24.868659 IP 167.99.216.145.8333 > tom-Latitude-3570.57976: tcp 0
04:03:25.032896 IP tom-Latitude-3570.39282 > default-rdns.vocus.co.nz.8333: tcp 24
04:03:25.033878 IP tom-Latitude-3570.39282 > default-rdns.vocus.co.nz.8333: tcp 37
04:03:25.042189 IP default-rdns.vocus.co.nz.8333 > tom-Latitude-3570.39282: tcp 24
04:03:25.042210 IP default-rdns.vocus.co.nz.8333 > tom-Latitude-3570.39282: tcp 109
04:03:25.042304 IP tom-Latitude-3570.39282 > default-rdns.vocus.co.nz.8333: tcp 0
04:03:25.042508 IP tom-Latitude-3570.39282 > default-rdns.vocus.co.nz.8333: tcp 24
04:03:25.042523 IP tom-Latitude-3570.39282 > default-rdns.vocus.co.nz.8333: tcp 73
04:03:25.053542 IP default-rdns.vocus.co.nz.8333 > tom-Latitude-3570.39282: tcp 0
04:03:25.063329 IP default-rdns.vocus.co.nz.8333 > tom-Latitude-3570.39282: tcp 0
04:03:25.070260 IP default-rdns.vocus.co.nz.8333 > tom-Latitude-3570.39282: tcp 0
04:03:25.073547 IP default-rdns.vocus.co.nz.8333 > tom-Latitude-3570.39282: tcp 0
04:03:25.343540 IP tom-Latitude-3570.57976 > 167.99.216.145.8333: tcp 24
04:03:25.344448 IP tom-Latitude-3570.57976 > 167.99.216.145.8333: tcp 8
04:03:25.380215 IP 167.99.216.145.8333 > tom-Latitude-3570.57976: tcp 0
04:03:25.385882 IP 167.99.216.145.8333 > tom-Latitude-3570.57976: tcp 0
04:03:25.395221 IP default-rdns.vocus.co.nz.8333 > tom-Latitude-3570.39282: tcp 24
04:03:25.395910 IP default-rdns.vocus.co.nz.8333 > tom-Latitude-3570.39282: tcp 371
04:03:25.395924 IP default-rdns.vocus.co.nz.8333 > tom-Latitude-3570.39282: tcp 24
04:03:25.395926 IP default-rdns.vocus.co.nz.8333 > tom-Latitude-3570.39282: tcp 191
04:03:25.396006 IP tom-Latitude-3570.39282 > default-rdns.vocus.co.nz.8333: tcp 0
04:03:25.449225 IP 167.99.216.145.8333 > tom-Latitude-3570.57976: tcp 24
04:03:25.450834 IP 167.99.216.145.8333 > tom-Latitude-3570.57976: tcp 8
04:03:25.450937 IP tom-Latitude-3570.57976 > 167.99.216.145.8333: tcp 0
04:03:25.576281 IP cpe90-146-140-201.liwest.at.8333 > tom-Latitude-3570.38514: tcp 0
04:03:25.651547 IP tom-Latitude-3570.49070 > c-185-45-236-223.customer.ggaweb.ch.8333: tcp 24
04:03:25.652524 IP tom-Latitude-3570.49070 > c-185-45-236-223.customer.ggaweb.ch.8333: tcp 73
04:03:25.687655 IP c-185-45-236-223.customer.ggaweb.ch.8333 > tom-Latitude-3570.49070: tcp 0
04:03:25.751942 IP tom-Latitude-3570.60470 > bb42-60-217-183.singnet.com.sg.8333: tcp 24
04:03:25.751995 IP tom-Latitude-3570.42516 > 2.56.9.15.8333: tcp 24
04:03:25.752908 IP tom-Latitude-3570.42516 > 2.56.9.15.8333: tcp 73
04:03:25.752919 IP tom-Latitude-3570.60470 > bb42-60-217-183.singnet.com.sg.8333: tcp 8
04:03:25.784679 IP bb42-60-217-183.singnet.com.sg.8333 > tom-Latitude-3570.60470: tcp 0
04:03:25.785299 IP 2.56.9.15.8333 > tom-Latitude-3570.42516: tcp 0
04:03:25.792767 IP 2.56.9.15.8333 > tom-Latitude-3570.42516: tcp 0
04:03:25.793351 IP bb42-60-217-183.singnet.com.sg.8333 > tom-Latitude-3570.60470: tcp 0
04:03:25.811799 IP bb42-60-217-183.singnet.com.sg.8333 > tom-Latitude-3570.60470: tcp 24
04:03:25.815899 IP bb42-60-217-183.singnet.com.sg.8333 > tom-Latitude-3570.60470: tcp 8
04:03:25.815993 IP tom-Latitude-3570.60470 > bb42-60-217-183.singnet.com.sg.8333: tcp 0
04:03:25.816114 IP tom-Latitude-3570.60470 > bb42-60-217-183.singnet.com.sg.8333: tcp 24
04:03:25.817563 IP tom-Latitude-3570.60470 > bb42-60-217-183.singnet.com.sg.8333: tcp 8
04:03:25.856291 IP bb42-60-217-183.singnet.com.sg.8333 > tom-Latitude-3570.60470: tcp 0
04:03:26.117159 IP tom-Latitude-3570.57976 > 167.99.216.145.8333: tcp 24
04:03:26.118144 IP tom-Latitude-3570.57976 > 167.99.216.145.8333: tcp 73
04:03:26.152774 IP 167.99.216.145.8333 > tom-Latitude-3570.57976: tcp 0
04:03:26.153318 IP 167.99.216.145.8333 > tom-Latitude-3570.57976: tcp 0
04:03:26.171954 IP bb42-60-217-183.singnet.com.sg.8333 > tom-Latitude-3570.60470: tcp 24
04:03:26.171973 IP bb42-60-217-183.singnet.com.sg.8333 > tom-Latitude-3570.60470: tcp 8
04:03:26.172064 IP tom-Latitude-3570.60470 > bb42-60-217-183.singnet.com.sg.8333: tcp 0
04:03:26.301829 IP vmi195435.contaboserver.net.8333 > tom-Latitude-3570.39110: tcp 24
04:03:26.301849 IP vmi195435.contaboserver.net.8333 > tom-Latitude-3570.39110: tcp 289
04:03:26.301936 IP tom-Latitude-3570.39110 > vmi195435.contaboserver.net.8333: tcp 0
04:03:26.302227 IP tom-Latitude-3570.39110 > vmi195435.contaboserver.net.8333: tcp 24
04:03:26.303509 IP tom-Latitude-3570.39110 > vmi195435.contaboserver.net.8333: tcp 217
04:03:26.328064 IP vmi195435.contaboserver.net.8333 > tom-Latitude-3570.39110: tcp 0
04:03:26.344023 IP vmi195435.contaboserver.net.8333 > tom-Latitude-3570.39110: tcp 0
04:03:26.423365 IP vmi195435.contaboserver.net.8333 > tom-Latitude-3570.39110: tcp 24
04:03:26.424587 IP vmi195435.contaboserver.net.8333 > tom-Latitude-3570.39110: tcp 249
04:03:26.424605 IP vmi195435.contaboserver.net.8333 > tom-Latitude-3570.39110: tcp 24
04:03:26.424608 IP vmi195435.contaboserver.net.8333 > tom-Latitude-3570.39110: tcp 226
04:03:26.424610 IP vmi195435.contaboserver.net.8333 > tom-Latitude-3570.39110: tcp 24
04:03:26.424612 IP vmi195435.contaboserver.net.8333 > tom-Latitude-3570.39110: tcp 225
04:03:26.424614 IP vmi195435.contaboserver.net.8333 > tom-Latitude-3570.39110: tcp 24
04:03:26.424616 IP vmi195435.contaboserver.net.8333 > tom-Latitude-3570.39110: tcp 224
04:03:26.424635 IP vmi195435.contaboserver.net.8333 > tom-Latitude-3570.39110: tcp 24
04:03:26.424637 IP vmi195435.contaboserver.net.8333 > tom-Latitude-3570.39110: tcp 249
04:03:26.424697 IP tom-Latitude-3570.39110 > vmi195435.contaboserver.net.8333: tcp 0
04:03:26.500680 IP vmi195435.contaboserver.net.8333 > tom-Latitude-3570.39110: tcp 250
04:03:26.501311 IP tom-Latitude-3570.39282 > default-rdns.vocus.co.nz.8333: tcp 24
04:03:26.502265 IP tom-Latitude-3570.39282 > default-rdns.vocus.co.nz.8333: tcp 217
04:03:26.528710 IP default-rdns.vocus.co.nz.8333 > tom-Latitude-3570.39282: tcp 0
04:03:26.543913 IP tom-Latitude-3570.39110 > vmi195435.contaboserver.net.8333: tcp 0
04:03:26.543947 IP default-rdns.vocus.co.nz.8333 > tom-Latitude-3570.39282: tcp 0
04:03:26.802229 IP tom-Latitude-3570.57976 > 167.99.216.145.8333: tcp 24
04:03:26.831379 IP tom-Latitude-3570.57976 > 167.99.216.145.8333: tcp 217
04:03:26.860176 IP 167.99.216.145.8333 > tom-Latitude-3570.57976: tcp 0
04:03:26.866812 IP 167.99.216.145.8333 > tom-Latitude-3570.57976: tcp 0
04:03:26.871257 IP default-rdns.vocus.co.nz.8333 > tom-Latitude-3570.39282: tcp 24
04:03:26.871917 IP default-rdns.vocus.co.nz.8333 > tom-Latitude-3570.39282: tcp 73
04:03:26.872002 IP tom-Latitude-3570.39282 > default-rdns.vocus.co.nz.8333: tcp 0
04:03:26.872120 IP tom-Latitude-3570.39282 > default-rdns.vocus.co.nz.8333: tcp 24
04:03:26.873600 IP tom-Latitude-3570.39282 > default-rdns.vocus.co.nz.8333: tcp 473
04:03:26.906612 IP default-rdns.vocus.co.nz.8333 > tom-Latitude-3570.39282: tcp 0
04:03:26.907265 IP default-rdns.vocus.co.nz.8333 > tom-Latitude-3570.39282: tcp 0
04:03:27.273301 IP tom-Latitude-3570.56714 > ns3113832.ip-54-38-177.eu.8333: tcp 24
04:03:27.274113 IP tom-Latitude-3570.56714 > ns3113832.ip-54-38-177.eu.8333: tcp 289
04:03:27.373715 IP tom-Latitude-3570.60988 > 81.198.101.144.8333: tcp 24
04:03:27.373798 IP tom-Latitude-3570.60470 > bb42-60-217-183.singnet.com.sg.8333: tcp 24
04:03:27.469786 IP ns3113832.ip-54-38-177.eu.8333 > tom-Latitude-3570.56714: tcp 0
04:03:27.474050 IP tom-Latitude-3570.57976 > 167.99.216.145.8333: tcp 24
04:03:27.478248 IP tom-Latitude-3570.57976 > 167.99.216.145.8333: tcp 31
04:03:27.478259 IP tom-Latitude-3570.60470 > bb42-60-217-183.singnet.com.sg.8333: tcp 289
04:03:27.478262 IP tom-Latitude-3570.60988 > 81.198.101.144.8333: tcp 433
04:03:27.521233 IP ns3113832.ip-54-38-177.eu.8333 > tom-Latitude-3570.56714: tcp 0
04:03:27.521246 IP 81.198.101.144.8333 > tom-Latitude-3570.60988: tcp 0
04:03:27.521250 IP 81.198.101.144.8333 > tom-Latitude-3570.60988: tcp 0
04:03:27.525849 IP 167.99.216.145.8333 > tom-Latitude-3570.57976: tcp 0
04:03:27.526424 IP 167.99.216.145.8333 > tom-Latitude-3570.57976: tcp 0
04:03:27.526437 IP bb42-60-217-183.singnet.com.sg.8333 > tom-Latitude-3570.60470: tcp 0
04:03:27.913135 IP 167.99.216.145.8333 > tom-Latitude-3570.57976: tcp 24
04:03:27.913578 IP 167.99.216.145.8333 > tom-Latitude-3570.57976: tcp 73
04:03:27.913711 IP tom-Latitude-3570.57976 > 167.99.216.145.8333: tcp 0
04:03:27.913920 IP tom-Latitude-3570.57976 > 167.99.216.145.8333: tcp 24
04:03:27.914998 IP tom-Latitude-3570.57976 > 167.99.216.145.8333: tcp 73
04:03:27.940268 IP 167.99.216.145.8333 > tom-Latitude-3570.57976: tcp 73
04:03:27.940281 IP tom-Latitude-3570.57976 > 167.99.216.145.8333: tcp 0
04:03:27.949882 IP 167.99.216.145.8333 > tom-Latitude-3570.57976: tcp 0
04:03:27.963913 IP 167.99.216.145.8333 > tom-Latitude-3570.57976: tcp 0
04:03:28.014235 IP tom-Latitude-3570.49070 > c-185-45-236-223.customer.ggaweb.ch.8333: tcp 24
04:03:28.015181 IP tom-Latitude-3570.49070 > c-185-45-236-223.customer.ggaweb.ch.8333: tcp 217
04:03:28.024141 IP 167.99.216.145.8333 > tom-Latitude-3570.57976: tcp 24
04:03:28.024165 IP tom-Latitude-3570.57976 > 167.99.216.145.8333: tcp 0
04:03:28.025116 IP 167.99.216.145.8333 > tom-Latitude-3570.57976: tcp 224
04:03:28.025142 IP tom-Latitude-3570.57976 > 167.99.216.145.8333: tcp 0
04:03:28.025157 IP 167.99.216.145.8333 > tom-Latitude-3570.57976: tcp 24
04:03:28.025160 IP tom-Latitude-3570.57976 > 167.99.216.145.8333: tcp 0
04:03:28.025164 IP 167.99.216.145.8333 > tom-Latitude-3570.57976: tcp 668
04:03:28.025166 IP tom-Latitude-3570.57976 > 167.99.216.145.8333: tcp 0
04:03:28.044502 IP c-185-45-236-223.customer.ggaweb.ch.8333 > tom-Latitude-3570.49070: tcp 0
04:03:28.227222 IP tom-Latitude-3570.49070 > c-185-45-236-223.customer.ggaweb.ch.8333: tcp 24
04:03:28.228166 IP tom-Latitude-3570.49070 > c-185-45-236-223.customer.ggaweb.ch.8333: tcp 73
04:03:28.266752 IP c-185-45-236-223.customer.ggaweb.ch.8333 > tom-Latitude-3570.49070: tcp 0
04:03:28.427911 IP tom-Latitude-3570.60470 > bb42-60-217-183.singnet.com.sg.8333: tcp 24
04:03:28.475438 IP tom-Latitude-3570.60470 > bb42-60-217-183.singnet.com.sg.8333: tcp 73
04:03:28.516324 IP bb42-60-217-183.singnet.com.sg.8333 > tom-Latitude-3570.60470: tcp 0
04:03:28.728763 IP tom-Latitude-3570.39110 > vmi195435.contaboserver.net.8333: tcp 24
04:03:28.728857 IP tom-Latitude-3570.60988 > 81.198.101.144.8333: tcp 24
04:03:28.729737 IP tom-Latitude-3570.60988 > 81.198.101.144.8333: tcp 73
04:03:28.729749 IP tom-Latitude-3570.39110 > vmi195435.contaboserver.net.8333: tcp 73
04:03:28.759606 IP vmi195435.contaboserver.net.8333 > tom-Latitude-3570.39110: tcp 0
04:03:28.768266 IP 81.198.101.144.8333 > tom-Latitude-3570.60988: tcp 0
04:03:28.768280 IP 81.198.101.144.8333 > tom-Latitude-3570.60988: tcp 0
04:03:28.768283 IP vmi195435.contaboserver.net.8333 > tom-Latitude-3570.39110: tcp 0
04:03:29.029665 IP tom-Latitude-3570.56714 > ns3113832.ip-54-38-177.eu.8333: tcp 24
04:03:29.029759 IP tom-Latitude-3570.42516 > 2.56.9.15.8333: tcp 24
04:03:29.030539 IP tom-Latitude-3570.42516 > 2.56.9.15.8333: tcp 289
04:03:29.030545 IP tom-Latitude-3570.56714 > ns3113832.ip-54-38-177.eu.8333: tcp 73
04:03:29.058629 IP ns3113832.ip-54-38-177.eu.8333 > tom-Latitude-3570.56714: tcp 0
04:03:29.076396 IP 2.56.9.15.8333 > tom-Latitude-3570.42516: tcp 0
04:03:29.076998 IP 2.56.9.15.8333 > tom-Latitude-3570.42516: tcp 0
04:03:29.077003 IP ns3113832.ip-54-38-177.eu.8333 > tom-Latitude-3570.56714: tcp 0
04:03:29.631740 IP tom-Latitude-3570.39282 > default-rdns.vocus.co.nz.8333: tcp 24
04:03:29.632683 IP tom-Latitude-3570.39282 > default-rdns.vocus.co.nz.8333: tcp 73
04:03:29.689152 IP 81.198.101.144.8333 > tom-Latitude-3570.60988: tcp 24
04:03:29.689176 IP tom-Latitude-3570.60988 > 81.198.101.144.8333: tcp 0
04:03:29.689799 IP 81.198.101.144.8333 > tom-Latitude-3570.60988: tcp 109
